Staphylococcus_Aureus | LPS | Optuna:  92%|█████████▏| 184/200 [4:11:30<25:32, 95.80s/it, best=0.894] Staphylococcus_Aureus | LPS | Optuna:  92%|█████████▏| 184/200 [4:11:30<25:32, 95.80s/it, best=0.894][I 2026-03-05 00:10:08,153] Trial 5 finished with value: 0.8759899170997038 and parameters: {'activation': 'identity', 'solver': 'adam', 'lr': 2.259279742015697e-06, 'layer1': 106, 'layer2': 32, 'layer3': 169}. Best is trial 5 with value: 0.8759899170997038.
Klebsiella_Pneumoniae | DirectMulti | Optuna:   3%|▎         | 6/200 [08:40<4:31:01, 83.82s/it, best=0.875] Klebsiella_Pneumoniae | DirectMulti | Optuna:   3%|▎         | 6/200 [08:40<4:31:01, 83.82s/it, best=0.876][I 2026-03-05 00:11:13,004] Trial 15 finished with value: 0.8620754396009935 and parameters: {'activation': 'relu', 'solver': 'adam', 'lr': 0.006619096450229885, 'layer1': 499, 'layer2': 121, 'layer3': 162}. Best is trial 14 with value: 0.8622383676220722.
Pseudomonas_Aeruginosa | DirectMulti | Optuna:   8%|▊         | 16/200 [17:07<4:56:49, 96.79s/it, best=0.862]Pseudomonas_Aeruginosa | DirectMulti | Optuna:   8%|▊         | 16/200 [17:07<4:56:49, 96.79s/it, best=0.862][I 2026-03-05 00:11:16,489] Trial 6 finished with value: 0.8746470562584285 and parameters: {'activation': 'tanh', 'solver': 'adam', 'lr': 3.6618192203924288e-06, 'layer1': 403, 'layer2': 46, 'layer3': 494}. Best is trial 5 with value: 0.8759899170997038.
Klebsiella_Pneumoniae | DirectMulti | Optuna:   4%|▎         | 7/200 [09:48<4:13:20, 78.76s/it, best=0.876]Klebsiella_Pneumoniae | DirectMulti | Optuna:   4%|▎         | 7/200 [09:48<4:13:20, 78.76s/it, best=0.876][I 2026-03-05 00:11:17,861] Trial 184 finished with value: 0.8938593741576225 and parameters: {'activation': 'identity', 'solver': 'adam', 'lr': 0.0006169798200541636, 'layer1': 292, 'layer2': 82, 'layer3': 148}. Best is trial 184 with value: 0.8938593741576225.
Staphylococcus_Aureus | LPS | Optuna:  92%|█████████▎| 185/200 [4:12:59<23:27, 93.84s/it, best=0.894]Staphylococcus_Aureus | LPS | Optuna:  92%|█████████▎| 185/200 [4:12:59<23:27, 93.84s/it, best=0.894][I 2026-03-05 00:11:55,313] Trial 7 finished with value: 0.9287978043045089 and parameters: {'activation': 'relu', 'solver': 'adam', 'lr': 0.0012164139351417069, 'layer1': 46, 'layer2': 186, 'layer3': 66}. Best is trial 7 with value: 0.9287978043045089.
Klebsiella_Pneumoniae | DirectMulti | Optuna:   4%|▍         | 8/200 [10:27<3:31:20, 66.05s/it, best=0.876]Klebsiella_Pneumoniae | DirectMulti | Optuna:   4%|▍         | 8/200 [10:27<3:31:20, 66.05s/it, best=0.929][I 2026-03-05 00:12:48,129] Trial 185 finished with value: 0.8922170846052004 and parameters: {'activation': 'identity', 'solver': 'adam', 'lr': 0.0006407811769779414, 'layer1': 341, 'layer2': 274, 'layer3': 152}. Best is trial 184 with value: 0.8938593741576225.
Staphylococcus_Aureus | LPS | Optuna:  93%|█████████▎| 186/200 [4:14:30<21:38, 92.77s/it, best=0.894]Staphylococcus_Aureus | LPS | Optuna:  93%|█████████▎| 186/200 [4:14:30<21:38, 92.77s/it, best=0.894][I 2026-03-05 00:13:05,204] Trial 8 finished with value: 0.9288506944282295 and parameters: {'activation': 'identity', 'solver': 'adam', 'lr': 0.000828752236376816, 'layer1': 323, 'layer2': 445, 'layer3': 241}. Best is trial 8 with value: 0.9288506944282295.
Klebsiella_Pneumoniae | DirectMulti | Optuna:   4%|▍         | 9/200 [11:37<3:34:04, 67.25s/it, best=0.929]Klebsiella_Pneumoniae | DirectMulti | Optuna:   4%|▍         | 9/200 [11:37<3:34:04, 67.25s/it, best=0.929][I 2026-03-05 00:13:21,767] Trial 16 finished with value: 0.8601701540583763 and parameters: {'activation': 'relu', 'solver': 'adam', 'lr': 0.009191462170332445, 'layer1': 499, 'layer2': 104, 'layer3': 136}. Best is trial 14 with value: 0.8622383676220722.
Pseudomonas_Aeruginosa | DirectMulti | Optuna:   8%|▊         | 17/200 [19:15<5:24:32, 106.41s/it, best=0.862]Pseudomonas_Aeruginosa | DirectMulti | Optuna:   8%|▊         | 17/200 [19:15<5:24:32, 106.41s/it, best=0.862][I 2026-03-05 00:13:38,767] Trial 85 finished with value: 0.86302420112829 and parameters: {'activation': 'relu', 'solver': 'adam', 'lr': 2.471220075695907e-05, 'layer1': 434, 'layer2': 31, 'layer3': 435}. Best is trial 73 with value: 0.864893646817533.
Escherichia_Coli | LPS | Optuna:  43%|████▎     | 86/200 [4:15:20<9:03:23, 286.00s/it, best=0.865]Escherichia_Coli | LPS | Optuna:  43%|████▎     | 86/200 [4:15:20<9:03:23, 286.00s/it, best=0.865][I 2026-03-05 00:14:12,602] Trial 186 finished with value: 0.8928680781682943 and parameters: {'activation': 'identity', 'solver': 'adam', 'lr': 0.0008475130074923095, 'layer1': 293, 'layer2': 309, 'layer3': 232}. Best is trial 184 with value: 0.8938593741576225.
Staphylococcus_Aureus | LPS | Optuna:  94%|█████████▎| 187/200 [4:15:54<19:33, 90.28s/it, best=0.894]Staphylococcus_Aureus | LPS | Optuna:  94%|█████████▎| 187/200 [4:15:54<19:33, 90.28s/it, best=0.894][I 2026-03-05 00:14:43,252] Trial 9 finished with value: 0.8746852273219806 and parameters: {'activation': 'tanh', 'solver': 'sgd', 'lr': 0.00012329098365270507, 'layer1': 219, 'layer2': 22, 'layer3': 62}. Best is trial 8 with value: 0.9288506944282295.
Klebsiella_Pneumoniae | DirectMulti | Optuna:   5%|▌         | 10/200 [13:15<4:03:03, 76.76s/it, best=0.929]Klebsiella_Pneumoniae | DirectMulti | Optuna:   5%|▌         | 10/200 [13:15<4:03:03, 76.76s/it, best=0.929][I 2026-03-05 00:14:55,834] Trial 17 finished with value: 0.8590748523201432 and parameters: {'activation': 'relu', 'solver': 'adam', 'lr': 0.0037550935710103134, 'layer1': 445, 'layer2': 104, 'layer3': 183}. Best is trial 14 with value: 0.8622383676220722.
Pseudomonas_Aeruginosa | DirectMulti | Optuna:   9%|▉         | 18/200 [20:49<5:11:30, 102.70s/it, best=0.862]Pseudomonas_Aeruginosa | DirectMulti | Optuna:   9%|▉         | 18/200 [20:49<5:11:30, 102.70s/it, best=0.862][I 2026-03-05 00:15:31,209] Trial 10 finished with value: 0.8746470562584285 and parameters: {'activation': 'identity', 'solver': 'sgd', 'lr': 0.007553503645583194, 'layer1': 366, 'layer2': 492, 'layer3': 320}. Best is trial 8 with value: 0.9288506944282295.
Klebsiella_Pneumoniae | DirectMulti | Optuna:   6%|▌         | 11/200 [14:03<3:34:01, 67.94s/it, best=0.929]Klebsiella_Pneumoniae | DirectMulti | Optuna:   6%|▌         | 11/200 [14:03<3:34:01, 67.94s/it, best=0.929][I 2026-03-05 00:15:36,617] Trial 187 finished with value: 0.892977862527587 and parameters: {'activation': 'identity', 'solver': 'adam', 'lr': 0.0010938059117354226, 'layer1': 296, 'layer2': 260, 'layer3': 227}. Best is trial 184 with value: 0.8938593741576225.
Staphylococcus_Aureus | LPS | Optuna:  94%|█████████▍| 188/200 [4:17:18<17:40, 88.40s/it, best=0.894]Staphylococcus_Aureus | LPS | Optuna:  94%|█████████▍| 188/200 [4:17:18<17:40, 88.40s/it, best=0.894][I 2026-03-05 00:16:05,384] Trial 18 finished with value: 0.8267823131840377 and parameters: {'activation': 'relu', 'solver': 'sgd', 'lr': 0.0002558259303229424, 'layer1': 439, 'layer2': 113, 'layer3': 284}. Best is trial 14 with value: 0.8622383676220722.
Pseudomonas_Aeruginosa | DirectMulti | Optuna:  10%|▉         | 19/200 [21:59<4:39:46, 92.74s/it, best=0.862] Pseudomonas_Aeruginosa | DirectMulti | Optuna:  10%|▉         | 19/200 [21:59<4:39:46, 92.74s/it, best=0.862][I 2026-03-05 00:16:19,596] Trial 86 finished with value: 0.7423453494668969 and parameters: {'activation': 'relu', 'solver': 'sgd', 'lr': 2.502528881117529e-05, 'layer1': 490, 'layer2': 32, 'layer3': 408}. Best is trial 73 with value: 0.864893646817533.
Escherichia_Coli | LPS | Optuna:  44%|████▎     | 87/200 [4:18:01<7:47:54, 248.45s/it, best=0.865]Escherichia_Coli | LPS | Optuna:  44%|████▎     | 87/200 [4:18:01<7:47:54, 248.45s/it, best=0.865][I 2026-03-05 00:16:30,550] Trial 11 finished with value: 0.9285828862050917 and parameters: {'activation': 'relu', 'solver': 'adam', 'lr': 0.0013124793805688133, 'layer1': 150, 'layer2': 163, 'layer3': 284}. Best is trial 8 with value: 0.9288506944282295.
Klebsiella_Pneumoniae | DirectMulti | Optuna:   6%|▌         | 12/200 [15:02<3:24:41, 65.33s/it, best=0.929]Klebsiella_Pneumoniae | DirectMulti | Optuna:   6%|▌         | 12/200 [15:02<3:24:41, 65.33s/it, best=0.929][I 2026-03-05 00:17:14,820] Trial 188 finished with value: 0.8897750314316208 and parameters: {'activation': 'identity', 'solver': 'adam', 'lr': 0.0011389894765869032, 'layer1': 317, 'layer2': 287, 'layer3': 270}. Best is trial 184 with value: 0.8938593741576225.
Staphylococcus_Aureus | LPS | Optuna:  94%|█████████▍| 189/200 [4:18:56<16:44, 91.34s/it, best=0.894]Staphylococcus_Aureus | LPS | Optuna:  94%|█████████▍| 189/200 [4:18:56<16:44, 91.34s/it, best=0.894][I 2026-03-05 00:17:18,216] Trial 19 finished with value: 0.8368813006228593 and parameters: {'activation': 'tanh', 'solver': 'adam', 'lr': 0.0037119440897972695, 'layer1': 402, 'layer2': 220, 'layer3': 114}. Best is trial 14 with value: 0.8622383676220722.
Pseudomonas_Aeruginosa | DirectMulti | Optuna:  10%|█         | 20/200 [23:12<4:20:17, 86.76s/it, best=0.862]Pseudomonas_Aeruginosa | DirectMulti | Optuna:  10%|█         | 20/200 [23:12<4:20:17, 86.76s/it, best=0.862][I 2026-03-05 00:17:50,007] Trial 12 finished with value: 0.9273466238433901 and parameters: {'activation': 'identity', 'solver': 'adam', 'lr': 0.00046544039809979403, 'layer1': 347, 'layer2': 434, 'layer3': 419}. Best is trial 8 with value: 0.9288506944282295.
Klebsiella_Pneumoniae | DirectMulti | Optuna:   6%|▋         | 13/200 [16:22<3:36:56, 69.61s/it, best=0.929]Klebsiella_Pneumoniae | DirectMulti | Optuna:   6%|▋         | 13/200 [16:22<3:36:56, 69.61s/it, best=0.929][I 2026-03-05 00:18:30,735] Trial 20 finished with value: 0.8261898244308833 and parameters: {'activation': 'logistic', 'solver': 'adam', 'lr': 0.00011696287602690557, 'layer1': 496, 'layer2': 72, 'layer3': 364}. Best is trial 14 with value: 0.8622383676220722.
Pseudomonas_Aeruginosa | DirectMulti | Optuna:  10%|█         | 21/200 [24:24<4:06:05, 82.49s/it, best=0.862]Pseudomonas_Aeruginosa | DirectMulti | Optuna:  10%|█         | 21/200 [24:24<4:06:05, 82.49s/it, best=0.862][I 2026-03-05 00:18:57,346] Trial 189 finished with value: 0.8888832066148747 and parameters: {'activation': 'identity', 'solver': 'adam', 'lr': 0.0009887866498642607, 'layer1': 293, 'layer2': 311, 'layer3': 233}. Best is trial 184 with value: 0.8938593741576225.
Staphylococcus_Aureus | LPS | Optuna:  95%|█████████▌| 190/200 [4:20:39<15:46, 94.70s/it, best=0.894]Staphylococcus_Aureus | LPS | Optuna:  95%|█████████▌| 190/200 [4:20:39<15:46, 94.70s/it, best=0.894][I 2026-03-05 00:19:35,170] Trial 13 finished with value: 0.9275263227798332 and parameters: {'activation': 'relu', 'solver': 'adam', 'lr': 0.00214516912368351, 'layer1': 494, 'layer2': 157, 'layer3': 209}. Best is trial 8 with value: 0.9288506944282295.
Klebsiella_Pneumoniae | DirectMulti | Optuna:   7%|▋         | 14/200 [18:07<4:09:04, 80.35s/it, best=0.929]Klebsiella_Pneumoniae | DirectMulti | Optuna:   7%|▋         | 14/200 [18:07<4:09:04, 80.35s/it, best=0.929][I 2026-03-05 00:20:27,198] Trial 190 finished with value: 0.8882592001348799 and parameters: {'activation': 'identity', 'solver': 'adam', 'lr': 0.0011975342431654662, 'layer1': 305, 'layer2': 330, 'layer3': 239}. Best is trial 184 with value: 0.8938593741576225.
Staphylococcus_Aureus | LPS | Optuna:  96%|█████████▌| 191/200 [4:22:09<13:59, 93.24s/it, best=0.894]Staphylococcus_Aureus | LPS | Optuna:  96%|█████████▌| 191/200 [4:22:09<13:59, 93.24s/it, best=0.894][I 2026-03-05 00:20:28,596] Trial 87 finished with value: 0.8632820555352769 and parameters: {'activation': 'tanh', 'solver': 'adam', 'lr': 3.3880459577203104e-05, 'layer1': 433, 'layer2': 10, 'layer3': 435}. Best is trial 73 with value: 0.864893646817533.
Escherichia_Coli | LPS | Optuna:  44%|████▍     | 88/200 [4:22:10<7:44:04, 248.61s/it, best=0.865]Escherichia_Coli | LPS | Optuna:  44%|████▍     | 88/200 [4:22:10<7:44:04, 248.61s/it, best=0.865][I 2026-03-05 00:20:49,682] Trial 21 finished with value: 0.8609442210026591 and parameters: {'activation': 'relu', 'solver': 'adam', 'lr': 0.0027807441490481644, 'layer1': 489, 'layer2': 156, 'layer3': 205}. Best is trial 14 with value: 0.8622383676220722.
Pseudomonas_Aeruginosa | DirectMulti | Optuna:  11%|█         | 22/200 [26:43<4:54:58, 99.43s/it, best=0.862]Pseudomonas_Aeruginosa | DirectMulti | Optuna:  11%|█         | 22/200 [26:43<4:54:58, 99.43s/it, best=0.862][I 2026-03-05 00:20:54,107] Trial 14 finished with value: 0.9296819751169272 and parameters: {'activation': 'relu', 'solver': 'adam', 'lr': 0.0002523488569948534, 'layer1': 178, 'layer2': 411, 'layer3': 11}. Best is trial 14 with value: 0.9296819751169272.
Klebsiella_Pneumoniae | DirectMulti | Optuna:   8%|▊         | 15/200 [19:26<4:06:25, 79.92s/it, best=0.929]Klebsiella_Pneumoniae | DirectMulti | Optuna:   8%|▊         | 15/200 [19:26<4:06:25, 79.92s/it, best=0.93] [I 2026-03-05 00:21:55,789] Trial 15 finished with value: 0.9293121978860762 and parameters: {'activation': 'identity', 'solver': 'adam', 'lr': 0.0001694885205572446, 'layer1': 183, 'layer2': 397, 'layer3': 138}. Best is trial 14 with value: 0.9296819751169272.
Klebsiella_Pneumoniae | DirectMulti | Optuna:   8%|▊         | 16/200 [20:27<3:48:15, 74.43s/it, best=0.93]Klebsiella_Pneumoniae | DirectMulti | Optuna:   8%|▊         | 16/200 [20:27<3:48:15, 74.43s/it, best=0.93][I 2026-03-05 00:22:14,866] Trial 191 finished with value: 0.8903625421551675 and parameters: {'activation': 'identity', 'solver': 'adam', 'lr': 0.000808640416582365, 'layer1': 284, 'layer2': 359, 'layer3': 252}. Best is trial 184 with value: 0.8938593741576225.
Staphylococcus_Aureus | LPS | Optuna:  96%|█████████▌| 192/200 [4:23:56<13:00, 97.57s/it, best=0.894]Staphylococcus_Aureus | LPS | Optuna:  96%|█████████▌| 192/200 [4:23:56<13:00, 97.57s/it, best=0.894][I 2026-03-05 00:22:34,883] Trial 22 finished with value: 0.8617493480440184 and parameters: {'activation': 'relu', 'solver': 'adam', 'lr': 0.003946778482274155, 'layer1': 453, 'layer2': 130, 'layer3': 201}. Best is trial 14 with value: 0.8622383676220722.
Pseudomonas_Aeruginosa | DirectMulti | Optuna:  12%|█▏        | 23/200 [28:28<4:58:25, 101.16s/it, best=0.862]Pseudomonas_Aeruginosa | DirectMulti | Optuna:  12%|█▏        | 23/200 [28:28<4:58:25, 101.16s/it, best=0.862][I 2026-03-05 00:23:15,499] Trial 16 finished with value: 0.9301378577607926 and parameters: {'activation': 'tanh', 'solver': 'adam', 'lr': 7.054382978969143e-05, 'layer1': 176, 'layer2': 379, 'layer3': 136}. Best is trial 16 with value: 0.9301378577607926.
Klebsiella_Pneumoniae | DirectMulti | Optuna:   8%|▊         | 17/200 [21:47<3:51:51, 76.02s/it, best=0.93]Klebsiella_Pneumoniae | DirectMulti | Optuna:   8%|▊         | 17/200 [21:47<3:51:51, 76.02s/it, best=0.93][I 2026-03-05 00:23:49,683] Trial 192 finished with value: 0.8891218427240217 and parameters: {'activation': 'identity', 'solver': 'adam', 'lr': 0.0018051513347079383, 'layer1': 295, 'layer2': 306, 'layer3': 224}. Best is trial 184 with value: 0.8938593741576225.
Staphylococcus_Aureus | LPS | Optuna:  96%|█████████▋| 193/200 [4:25:31<11:17, 96.74s/it, best=0.894]Staphylococcus_Aureus | LPS | Optuna:  96%|█████████▋| 193/200 [4:25:31<11:17, 96.74s/it, best=0.894][I 2026-03-05 00:23:51,502] Trial 17 finished with value: 0.8760821249187967 and parameters: {'activation': 'tanh', 'solver': 'adam', 'lr': 4.7052574062611015e-05, 'layer1': 127, 'layer2': 359, 'layer3': 10}. Best is trial 16 with value: 0.9301378577607926.
Klebsiella_Pneumoniae | DirectMulti | Optuna:   9%|▉         | 18/200 [22:23<3:14:06, 63.99s/it, best=0.93]Klebsiella_Pneumoniae | DirectMulti | Optuna:   9%|▉         | 18/200 [22:23<3:14:06, 63.99s/it, best=0.93][I 2026-03-05 00:24:22,099] Trial 88 finished with value: 0.8627550405227149 and parameters: {'activation': 'tanh', 'solver': 'adam', 'lr': 3.3345592694035086e-05, 'layer1': 454, 'layer2': 45, 'layer3': 468}. Best is trial 73 with value: 0.864893646817533.
Escherichia_Coli | LPS | Optuna:  44%|████▍     | 89/200 [4:26:04<7:31:32, 244.08s/it, best=0.865]Escherichia_Coli | LPS | Optuna:  44%|████▍     | 89/200 [4:26:04<7:31:32, 244.08s/it, best=0.865][I 2026-03-05 00:24:27,995] Trial 23 finished with value: 0.8649994822247168 and parameters: {'activation': 'relu', 'solver': 'adam', 'lr': 0.008904946640667379, 'layer1': 457, 'layer2': 120, 'layer3': 276}. Best is trial 23 with value: 0.8649994822247168.
Pseudomonas_Aeruginosa | DirectMulti | Optuna:  12%|█▏        | 24/200 [30:22<5:07:15, 104.75s/it, best=0.862]Pseudomonas_Aeruginosa | DirectMulti | Optuna:  12%|█▏        | 24/200 [30:22<5:07:15, 104.75s/it, best=0.865][I 2026-03-05 00:24:40,863] Trial 18 finished with value: 0.8748126496172827 and parameters: {'activation': 'tanh', 'solver': 'sgd', 'lr': 0.0002761877013620139, 'layer1': 194, 'layer2': 500, 'layer3': 113}. Best is trial 16 with value: 0.9301378577607926.
Klebsiella_Pneumoniae | DirectMulti | Optuna:  10%|▉         | 19/200 [23:12<2:59:47, 59.60s/it, best=0.93]Klebsiella_Pneumoniae | DirectMulti | Optuna:  10%|▉         | 19/200 [23:12<2:59:47, 59.60s/it, best=0.93][I 2026-03-05 00:25:10,504] Trial 19 finished with value: 0.8747491534498986 and parameters: {'activation': 'tanh', 'solver': 'adam', 'lr': 4.329551448268649e-05, 'layer1': 15, 'layer2': 384, 'layer3': 75}. Best is trial 16 with value: 0.9301378577607926.
Klebsiella_Pneumoniae | DirectMulti | Optuna:  10%|█         | 20/200 [23:42<2:31:48, 50.60s/it, best=0.93]Klebsiella_Pneumoniae | DirectMulti | Optuna:  10%|█         | 20/200 [23:42<2:31:48, 50.60s/it, best=0.93][I 2026-03-05 00:25:11,943] Trial 193 finished with value: 0.8923998705128721 and parameters: {'activation': 'identity', 'solver': 'adam', 'lr': 0.0013099093778755923, 'layer1': 269, 'layer2': 85, 'layer3': 215}. Best is trial 184 with value: 0.8938593741576225.
Staphylococcus_Aureus | LPS | Optuna:  97%|█████████▋| 194/200 [4:26:54<09:14, 92.40s/it, best=0.894]Staphylococcus_Aureus | LPS | Optuna:  97%|█████████▋| 194/200 [4:26:54<09:14, 92.40s/it, best=0.894][I 2026-03-05 00:25:51,745] Trial 20 finished with value: 0.8746470562584285 and parameters: {'activation': 'logistic', 'solver': 'adam', 'lr': 6.409323466233637e-05, 'layer1': 114, 'layer2': 434, 'layer3': 180}. Best is trial 16 with value: 0.9301378577607926.
Klebsiella_Pneumoniae | DirectMulti | Optuna:  10%|█         | 21/200 [24:23<2:22:35, 47.79s/it, best=0.93]Klebsiella_Pneumoniae | DirectMulti | Optuna:  10%|█         | 21/200 [24:23<2:22:35, 47.79s/it, best=0.93][I 2026-03-05 00:26:11,623] Trial 24 finished with value: 0.8580063627299106 and parameters: {'activation': 'relu', 'solver': 'adam', 'lr': 0.009892970826729958, 'layer1': 387, 'layer2': 218, 'layer3': 281}. Best is trial 23 with value: 0.8649994822247168.
Pseudomonas_Aeruginosa | DirectMulti | Optuna:  12%|█▎        | 25/200 [32:05<5:04:32, 104.41s/it, best=0.865]Pseudomonas_Aeruginosa | DirectMulti | Optuna:  12%|█▎        | 25/200 [32:05<5:04:32, 104.41s/it, best=0.865][I 2026-03-05 00:26:37,524] Trial 194 finished with value: 0.892925635634733 and parameters: {'activation': 'identity', 'solver': 'adam', 'lr': 0.000960894037519336, 'layer1': 286, 'layer2': 280, 'layer3': 192}. Best is trial 184 with value: 0.8938593741576225.
Staphylococcus_Aureus | LPS | Optuna:  98%|█████████▊| 195/200 [4:28:19<07:31, 90.35s/it, best=0.894]Staphylococcus_Aureus | LPS | Optuna:  98%|█████████▊| 195/200 [4:28:19<07:31, 90.35s/it, best=0.894][I 2026-03-05 00:27:09,557] Trial 21 finished with value: 0.9305626294567638 and parameters: {'activation': 'relu', 'solver': 'adam', 'lr': 0.0002042778116852659, 'layer1': 183, 'layer2': 391, 'layer3': 127}. Best is trial 21 with value: 0.9305626294567638.
Klebsiella_Pneumoniae | DirectMulti | Optuna:  11%|█         | 22/200 [25:41<2:48:30, 56.80s/it, best=0.93]Klebsiella_Pneumoniae | DirectMulti | Optuna:  11%|█         | 22/200 [25:41<2:48:30, 56.80s/it, best=0.931][I 2026-03-05 00:27:16,929] Trial 25 finished with value: 0.8576395884959223 and parameters: {'activation': 'relu', 'solver': 'adam', 'lr': 0.0005957631193141916, 'layer1': 307, 'layer2': 80, 'layer3': 257}. Best is trial 23 with value: 0.8649994822247168.
Pseudomonas_Aeruginosa | DirectMulti | Optuna:  13%|█▎        | 26/200 [33:10<4:28:46, 92.68s/it, best=0.865] Pseudomonas_Aeruginosa | DirectMulti | Optuna:  13%|█▎        | 26/200 [33:10<4:28:46, 92.68s/it, best=0.865][I 2026-03-05 00:27:31,567] Trial 89 finished with value: 0.8626375149071276 and parameters: {'activation': 'tanh', 'solver': 'adam', 'lr': 4.7178245191247976e-05, 'layer1': 429, 'layer2': 26, 'layer3': 418}. Best is trial 73 with value: 0.864893646817533.
Escherichia_Coli | LPS | Optuna:  45%|████▌     | 90/200 [4:29:13<6:57:26, 227.70s/it, best=0.865]Escherichia_Coli | LPS | Optuna:  45%|████▌     | 90/200 [4:29:13<6:57:26, 227.70s/it, best=0.865][I 2026-03-05 00:27:43,034] Trial 26 finished with value: 0.8261898244308833 and parameters: {'activation': 'relu', 'solver': 'sgd', 'lr': 0.006178773569132502, 'layer1': 197, 'layer2': 67, 'layer3': 323}. Best is trial 23 with value: 0.8649994822247168.
Pseudomonas_Aeruginosa | DirectMulti | Optuna:  14%|█▎        | 27/200 [33:37<3:29:38, 72.71s/it, best=0.865]Pseudomonas_Aeruginosa | DirectMulti | Optuna:  14%|█▎        | 27/200 [33:37<3:29:38, 72.71s/it, best=0.865][I 2026-03-05 00:28:06,353] Trial 195 finished with value: 0.8915358512732873 and parameters: {'activation': 'identity', 'solver': 'adam', 'lr': 0.000944369967662376, 'layer1': 299, 'layer2': 260, 'layer3': 194}. Best is trial 184 with value: 0.8938593741576225.
