Pseudomonas_Aeruginosa | DirectMulti | Optuna:  77%|███████▋  | 154/200 [4:00:23<1:20:56, 105.58s/it, best=0.866]Pseudomonas_Aeruginosa | DirectMulti | Optuna:  77%|███████▋  | 154/200 [4:00:23<1:20:56, 105.58s/it, best=0.866][I 2026-03-05 03:54:35,725] Trial 143 finished with value: 0.8638765221763831 and parameters: {'activation': 'relu', 'solver': 'adam', 'lr': 3.159193744453104e-05, 'layer1': 490, 'layer2': 20, 'layer3': 482}. Best is trial 139 with value: 0.8649329422529497.
Escherichia_Coli | LPS | Optuna:  72%|███████▏  | 144/200 [7:56:17<4:29:26, 288.69s/it, best=0.865]Escherichia_Coli | LPS | Optuna:  72%|███████▏  | 144/200 [7:56:17<4:29:26, 288.69s/it, best=0.865][I 2026-03-05 03:54:37,164] Trial 75 finished with value: 0.8918879459236428 and parameters: {'activation': 'identity', 'solver': 'adam', 'lr': 1.989697529382373e-05, 'layer1': 427, 'layer2': 393, 'layer3': 75}. Best is trial 62 with value: 0.8933826282053527.
Staphylococcus_Aureus | DirectMulti | Optuna:  38%|███▊      | 76/200 [3:19:54<9:52:37, 286.75s/it, best=0.893] Staphylococcus_Aureus | DirectMulti | Optuna:  38%|███▊      | 76/200 [3:19:54<9:52:37, 286.75s/it, best=0.893][I 2026-03-05 03:55:21,077] Trial 170 finished with value: 0.8758106865767641 and parameters: {'activation': 'tanh', 'solver': 'sgd', 'lr': 2.8183058996389965e-05, 'layer1': 64, 'layer2': 80, 'layer3': 363}. Best is trial 162 with value: 0.9324033953093582.
Klebsiella_Pneumoniae | DirectMulti | Optuna:  86%|████████▌ | 171/200 [3:53:53<46:49, 96.89s/it, best=0.932]Klebsiella_Pneumoniae | DirectMulti | Optuna:  86%|████████▌ | 171/200 [3:53:53<46:49, 96.89s/it, best=0.932][I 2026-03-05 03:56:23,044] Trial 154 finished with value: 0.8582364673883113 and parameters: {'activation': 'relu', 'solver': 'adam', 'lr': 0.0019113027885434438, 'layer1': 470, 'layer2': 495, 'layer3': 312}. Best is trial 71 with value: 0.8659155749694897.
Pseudomonas_Aeruginosa | DirectMulti | Optuna:  78%|███████▊  | 155/200 [4:02:17<1:20:54, 107.87s/it, best=0.866]Pseudomonas_Aeruginosa | DirectMulti | Optuna:  78%|███████▊  | 155/200 [4:02:17<1:20:54, 107.87s/it, best=0.866][I 2026-03-05 03:56:59,178] Trial 171 finished with value: 0.9313426051901448 and parameters: {'activation': 'tanh', 'solver': 'adam', 'lr': 4.1721854365411415e-05, 'layer1': 74, 'layer2': 113, 'layer3': 324}. Best is trial 162 with value: 0.9324033953093582.
Klebsiella_Pneumoniae | DirectMulti | Optuna:  86%|████████▌ | 172/200 [3:55:31<45:23, 97.25s/it, best=0.932]Klebsiella_Pneumoniae | DirectMulti | Optuna:  86%|████████▌ | 172/200 [3:55:31<45:23, 97.25s/it, best=0.932][I 2026-03-05 03:58:26,136] Trial 172 finished with value: 0.932003719180026 and parameters: {'activation': 'tanh', 'solver': 'adam', 'lr': 6.158341320495701e-05, 'layer1': 71, 'layer2': 96, 'layer3': 331}. Best is trial 162 with value: 0.9324033953093582.
Klebsiella_Pneumoniae | DirectMulti | Optuna:  86%|████████▋ | 173/200 [3:56:58<42:22, 94.16s/it, best=0.932]Klebsiella_Pneumoniae | DirectMulti | Optuna:  86%|████████▋ | 173/200 [3:56:58<42:22, 94.16s/it, best=0.932][I 2026-03-05 03:58:26,290] Trial 155 finished with value: 0.8588722912279823 and parameters: {'activation': 'relu', 'solver': 'adam', 'lr': 0.0013339540341941103, 'layer1': 491, 'layer2': 471, 'layer3': 266}. Best is trial 71 with value: 0.8659155749694897.
Pseudomonas_Aeruginosa | DirectMulti | Optuna:  78%|███████▊  | 156/200 [4:04:20<1:22:29, 112.48s/it, best=0.866]Pseudomonas_Aeruginosa | DirectMulti | Optuna:  78%|███████▊  | 156/200 [4:04:20<1:22:29, 112.48s/it, best=0.866][I 2026-03-05 03:58:41,386] Trial 76 finished with value: 0.8914824682605259 and parameters: {'activation': 'identity', 'solver': 'adam', 'lr': 2.839455117851166e-05, 'layer1': 458, 'layer2': 365, 'layer3': 101}. Best is trial 62 with value: 0.8933826282053527.
Staphylococcus_Aureus | DirectMulti | Optuna:  38%|███▊      | 77/200 [3:23:59<9:21:41, 273.99s/it, best=0.893]Staphylococcus_Aureus | DirectMulti | Optuna:  38%|███▊      | 77/200 [3:23:59<9:21:41, 273.99s/it, best=0.893][I 2026-03-05 03:59:42,113] Trial 173 finished with value: 0.9321660797538589 and parameters: {'activation': 'tanh', 'solver': 'adam', 'lr': 8.165690930633631e-05, 'layer1': 99, 'layer2': 94, 'layer3': 338}. Best is trial 162 with value: 0.9324033953093582.
Klebsiella_Pneumoniae | DirectMulti | Optuna:  87%|████████▋ | 174/200 [3:58:14<38:26, 88.71s/it, best=0.932]Klebsiella_Pneumoniae | DirectMulti | Optuna:  87%|████████▋ | 174/200 [3:58:14<38:26, 88.71s/it, best=0.932][I 2026-03-05 03:59:54,035] Trial 77 finished with value: 0.8024356573534901 and parameters: {'activation': 'identity', 'solver': 'adam', 'lr': 2.854782040428242e-06, 'layer1': 324, 'layer2': 453, 'layer3': 124}. Best is trial 62 with value: 0.8933826282053527.
Staphylococcus_Aureus | DirectMulti | Optuna:  39%|███▉      | 78/200 [3:25:11<7:14:17, 213.59s/it, best=0.893]Staphylococcus_Aureus | DirectMulti | Optuna:  39%|███▉      | 78/200 [3:25:11<7:14:17, 213.59s/it, best=0.893][I 2026-03-05 03:59:54,764] Trial 144 finished with value: 0.8648993190474155 and parameters: {'activation': 'relu', 'solver': 'adam', 'lr': 3.173159563281563e-05, 'layer1': 490, 'layer2': 10, 'layer3': 476}. Best is trial 139 with value: 0.8649329422529497.
Escherichia_Coli | LPS | Optuna:  72%|███████▎  | 145/200 [8:01:36<4:32:58, 297.79s/it, best=0.865]Escherichia_Coli | LPS | Optuna:  72%|███████▎  | 145/200 [8:01:36<4:32:58, 297.79s/it, best=0.865][I 2026-03-05 04:00:32,078] Trial 156 finished with value: 0.8662160558326807 and parameters: {'activation': 'relu', 'solver': 'adam', 'lr': 0.003886097193909111, 'layer1': 451, 'layer2': 479, 'layer3': 287}. Best is trial 156 with value: 0.8662160558326807.
Pseudomonas_Aeruginosa | DirectMulti | Optuna:  78%|███████▊  | 157/200 [4:06:26<1:23:28, 116.47s/it, best=0.866]Pseudomonas_Aeruginosa | DirectMulti | Optuna:  78%|███████▊  | 157/200 [4:06:26<1:23:28, 116.47s/it, best=0.866][I 2026-03-05 04:01:13,746] Trial 174 finished with value: 0.9316191246041449 and parameters: {'activation': 'tanh', 'solver': 'adam', 'lr': 5.403306252586525e-05, 'layer1': 97, 'layer2': 95, 'layer3': 336}. Best is trial 162 with value: 0.9324033953093582.
Klebsiella_Pneumoniae | DirectMulti | Optuna:  88%|████████▊ | 175/200 [3:59:45<37:19, 89.58s/it, best=0.932]Klebsiella_Pneumoniae | DirectMulti | Optuna:  88%|████████▊ | 175/200 [3:59:45<37:19, 89.58s/it, best=0.932][I 2026-03-05 04:02:16,506] Trial 157 finished with value: 0.8587318616484142 and parameters: {'activation': 'relu', 'solver': 'adam', 'lr': 0.006762201918073423, 'layer1': 417, 'layer2': 485, 'layer3': 252}. Best is trial 156 with value: 0.8662160558326807.
Pseudomonas_Aeruginosa | DirectMulti | Optuna:  79%|███████▉  | 158/200 [4:08:10<1:19:00, 112.86s/it, best=0.866]Pseudomonas_Aeruginosa | DirectMulti | Optuna:  79%|███████▉  | 158/200 [4:08:10<1:19:00, 112.86s/it, best=0.866][I 2026-03-05 04:02:49,264] Trial 175 finished with value: 0.9318266380723117 and parameters: {'activation': 'tanh', 'solver': 'adam', 'lr': 6.290840653065716e-05, 'layer1': 89, 'layer2': 76, 'layer3': 305}. Best is trial 162 with value: 0.9324033953093582.
Klebsiella_Pneumoniae | DirectMulti | Optuna:  88%|████████▊ | 176/200 [4:01:21<36:32, 91.36s/it, best=0.932]Klebsiella_Pneumoniae | DirectMulti | Optuna:  88%|████████▊ | 176/200 [4:01:21<36:32, 91.36s/it, best=0.932][I 2026-03-05 04:03:21,623] Trial 158 finished with value: 0.8329238424654566 and parameters: {'activation': 'tanh', 'solver': 'adam', 'lr': 0.003906217586811, 'layer1': 430, 'layer2': 352, 'layer3': 286}. Best is trial 156 with value: 0.8662160558326807.
Pseudomonas_Aeruginosa | DirectMulti | Optuna:  80%|███████▉  | 159/200 [4:09:15<1:07:20, 98.54s/it, best=0.866] Pseudomonas_Aeruginosa | DirectMulti | Optuna:  80%|███████▉  | 159/200 [4:09:15<1:07:20, 98.54s/it, best=0.866][I 2026-03-05 04:04:21,911] Trial 145 finished with value: 0.8642369164231543 and parameters: {'activation': 'relu', 'solver': 'adam', 'lr': 3.344791211704822e-05, 'layer1': 490, 'layer2': 18, 'layer3': 480}. Best is trial 139 with value: 0.8649329422529497.
Escherichia_Coli | LPS | Optuna:  73%|███████▎  | 146/200 [8:06:03<4:19:44, 288.60s/it, best=0.865]Escherichia_Coli | LPS | Optuna:  73%|███████▎  | 146/200 [8:06:03<4:19:44, 288.60s/it, best=0.865][I 2026-03-05 04:04:21,920] Trial 176 finished with value: 0.931118074085574 and parameters: {'activation': 'tanh', 'solver': 'adam', 'lr': 6.208792065110047e-05, 'layer1': 55, 'layer2': 74, 'layer3': 305}. Best is trial 162 with value: 0.9324033953093582.
Klebsiella_Pneumoniae | DirectMulti | Optuna:  88%|████████▊ | 177/200 [4:02:54<35:10, 91.75s/it, best=0.932]Klebsiella_Pneumoniae | DirectMulti | Optuna:  88%|████████▊ | 177/200 [4:02:54<35:10, 91.75s/it, best=0.932][I 2026-03-05 04:05:02,360] Trial 159 finished with value: 0.8614034659657499 and parameters: {'activation': 'relu', 'solver': 'adam', 'lr': 0.005603714193279428, 'layer1': 449, 'layer2': 380, 'layer3': 296}. Best is trial 156 with value: 0.8662160558326807.
Pseudomonas_Aeruginosa | DirectMulti | Optuna:  80%|████████  | 160/200 [4:10:56<1:06:07, 99.20s/it, best=0.866]Pseudomonas_Aeruginosa | DirectMulti | Optuna:  80%|████████  | 160/200 [4:10:56<1:06:07, 99.20s/it, best=0.866][I 2026-03-05 04:05:34,107] Trial 177 finished with value: 0.9327253118571418 and parameters: {'activation': 'tanh', 'solver': 'adam', 'lr': 9.459131060843723e-05, 'layer1': 75, 'layer2': 90, 'layer3': 318}. Best is trial 177 with value: 0.9327253118571418.
Klebsiella_Pneumoniae | DirectMulti | Optuna:  89%|████████▉ | 178/200 [4:04:06<31:29, 85.88s/it, best=0.932]Klebsiella_Pneumoniae | DirectMulti | Optuna:  89%|████████▉ | 178/200 [4:04:06<31:29, 85.88s/it, best=0.933][I 2026-03-05 04:06:02,457] Trial 78 finished with value: 0.8920077772437948 and parameters: {'activation': 'identity', 'solver': 'adam', 'lr': 1.056926109172301e-05, 'layer1': 380, 'layer2': 423, 'layer3': 59}. Best is trial 62 with value: 0.8933826282053527.
Staphylococcus_Aureus | DirectMulti | Optuna:  40%|███▉      | 79/200 [3:31:20<8:44:24, 260.04s/it, best=0.893]Staphylococcus_Aureus | DirectMulti | Optuna:  40%|███▉      | 79/200 [3:31:20<8:44:24, 260.04s/it, best=0.893][I 2026-03-05 04:06:41,560] Trial 178 finished with value: 0.9305775121154427 and parameters: {'activation': 'tanh', 'solver': 'adam', 'lr': 9.437313425055803e-05, 'layer1': 86, 'layer2': 91, 'layer3': 317}. Best is trial 177 with value: 0.9327253118571418.
Klebsiella_Pneumoniae | DirectMulti | Optuna:  90%|████████▉ | 179/200 [4:05:13<28:07, 80.35s/it, best=0.933]Klebsiella_Pneumoniae | DirectMulti | Optuna:  90%|████████▉ | 179/200 [4:05:13<28:07, 80.35s/it, best=0.933][I 2026-03-05 04:06:58,739] Trial 160 finished with value: 0.8610279638648052 and parameters: {'activation': 'relu', 'solver': 'adam', 'lr': 0.0034490466529640746, 'layer1': 479, 'layer2': 164, 'layer3': 309}. Best is trial 156 with value: 0.8662160558326807.
Pseudomonas_Aeruginosa | DirectMulti | Optuna:  80%|████████  | 161/200 [4:12:52<1:07:49, 104.35s/it, best=0.866]Pseudomonas_Aeruginosa | DirectMulti | Optuna:  80%|████████  | 161/200 [4:12:52<1:07:49, 104.35s/it, best=0.866][I 2026-03-05 04:07:51,230] Trial 179 finished with value: 0.9326303087962848 and parameters: {'activation': 'tanh', 'solver': 'adam', 'lr': 0.00011098068704013565, 'layer1': 76, 'layer2': 78, 'layer3': 279}. Best is trial 177 with value: 0.9327253118571418.
Klebsiella_Pneumoniae | DirectMulti | Optuna:  90%|█████████ | 180/200 [4:06:23<25:42, 77.15s/it, best=0.933]Klebsiella_Pneumoniae | DirectMulti | Optuna:  90%|█████████ | 180/200 [4:06:23<25:42, 77.15s/it, best=0.933][I 2026-03-05 04:07:56,677] Trial 79 finished with value: 0.7606003188736786 and parameters: {'activation': 'logistic', 'solver': 'adam', 'lr': 1.8138280294153661e-06, 'layer1': 400, 'layer2': 426, 'layer3': 84}. Best is trial 62 with value: 0.8933826282053527.
Staphylococcus_Aureus | DirectMulti | Optuna:  40%|████      | 80/200 [3:33:14<7:12:35, 216.29s/it, best=0.893]Staphylococcus_Aureus | DirectMulti | Optuna:  40%|████      | 80/200 [3:33:14<7:12:35, 216.29s/it, best=0.893][I 2026-03-05 04:08:17,713] Trial 146 finished with value: 0.8612919575042627 and parameters: {'activation': 'relu', 'solver': 'adam', 'lr': 4.766609865972913e-05, 'layer1': 488, 'layer2': 11, 'layer3': 478}. Best is trial 139 with value: 0.8649329422529497.
Escherichia_Coli | LPS | Optuna:  74%|███████▎  | 147/200 [8:09:59<4:00:56, 272.76s/it, best=0.865]Escherichia_Coli | LPS | Optuna:  74%|███████▎  | 147/200 [8:09:59<4:00:56, 272.76s/it, best=0.865][I 2026-03-05 04:08:46,830] Trial 161 finished with value: 0.8669185742695007 and parameters: {'activation': 'relu', 'solver': 'adam', 'lr': 0.002765076022894333, 'layer1': 463, 'layer2': 472, 'layer3': 327}. Best is trial 161 with value: 0.8669185742695007.
Pseudomonas_Aeruginosa | DirectMulti | Optuna:  81%|████████  | 162/200 [4:14:40<1:06:47, 105.47s/it, best=0.866]Pseudomonas_Aeruginosa | DirectMulti | Optuna:  81%|████████  | 162/200 [4:14:40<1:06:47, 105.47s/it, best=0.867][I 2026-03-05 04:08:55,082] Trial 180 finished with value: 0.932132646067467 and parameters: {'activation': 'tanh', 'solver': 'adam', 'lr': 0.00012636251955739516, 'layer1': 74, 'layer2': 69, 'layer3': 273}. Best is trial 177 with value: 0.9327253118571418.
Klebsiella_Pneumoniae | DirectMulti | Optuna:  90%|█████████ | 181/200 [4:07:27<23:10, 73.16s/it, best=0.933]Klebsiella_Pneumoniae | DirectMulti | Optuna:  90%|█████████ | 181/200 [4:07:27<23:10, 73.16s/it, best=0.933][I 2026-03-05 04:09:51,315] Trial 181 finished with value: 0.9309542558922816 and parameters: {'activation': 'tanh', 'solver': 'adam', 'lr': 0.00012771065298213165, 'layer1': 76, 'layer2': 71, 'layer3': 253}. Best is trial 177 with value: 0.9327253118571418.
Klebsiella_Pneumoniae | DirectMulti | Optuna:  91%|█████████ | 182/200 [4:08:23<20:25, 68.08s/it, best=0.933]Klebsiella_Pneumoniae | DirectMulti | Optuna:  91%|█████████ | 182/200 [4:08:23<20:25, 68.08s/it, best=0.933][I 2026-03-05 04:10:35,582] Trial 162 finished with value: 0.8601705944535137 and parameters: {'activation': 'relu', 'solver': 'adam', 'lr': 0.0026385172812445554, 'layer1': 463, 'layer2': 430, 'layer3': 335}. Best is trial 161 with value: 0.8669185742695007.
Pseudomonas_Aeruginosa | DirectMulti | Optuna:  82%|████████▏ | 163/200 [4:16:29<1:05:38, 106.46s/it, best=0.867]Pseudomonas_Aeruginosa | DirectMulti | Optuna:  82%|████████▏ | 163/200 [4:16:29<1:05:38, 106.46s/it, best=0.867][I 2026-03-05 04:11:00,231] Trial 182 finished with value: 0.93217618506186 and parameters: {'activation': 'tanh', 'solver': 'adam', 'lr': 0.00010924399958991439, 'layer1': 66, 'layer2': 49, 'layer3': 276}. Best is trial 177 with value: 0.9327253118571418.
Klebsiella_Pneumoniae | DirectMulti | Optuna:  92%|█████████▏| 183/200 [4:09:32<19:21, 68.33s/it, best=0.933]Klebsiella_Pneumoniae | DirectMulti | Optuna:  92%|█████████▏| 183/200 [4:09:32<19:21, 68.33s/it, best=0.933][I 2026-03-05 04:12:18,904] Trial 183 finished with value: 0.9320105298274648 and parameters: {'activation': 'tanh', 'solver': 'adam', 'lr': 0.0001036196522427214, 'layer1': 65, 'layer2': 43, 'layer3': 265}. Best is trial 177 with value: 0.9327253118571418.
Klebsiella_Pneumoniae | DirectMulti | Optuna:  92%|█████████▏| 184/200 [4:10:51<19:02, 71.43s/it, best=0.933]Klebsiella_Pneumoniae | DirectMulti | Optuna:  92%|█████████▏| 184/200 [4:10:51<19:02, 71.43s/it, best=0.933][I 2026-03-05 04:12:19,259] Trial 163 finished with value: 0.8611682971710886 and parameters: {'activation': 'relu', 'solver': 'adam', 'lr': 0.0046660118552293035, 'layer1': 437, 'layer2': 488, 'layer3': 284}. Best is trial 161 with value: 0.8669185742695007.
Pseudomonas_Aeruginosa | DirectMulti | Optuna:  82%|████████▏ | 164/200 [4:18:13<1:03:22, 105.62s/it, best=0.867]Pseudomonas_Aeruginosa | DirectMulti | Optuna:  82%|████████▏ | 164/200 [4:18:13<1:03:22, 105.62s/it, best=0.867][I 2026-03-05 04:13:15,001] Trial 147 finished with value: 0.8627418349826945 and parameters: {'activation': 'relu', 'solver': 'adam', 'lr': 3.16656224440868e-05, 'layer1': 487, 'layer2': 19, 'layer3': 499}. Best is trial 139 with value: 0.8649329422529497.
Escherichia_Coli | LPS | Optuna:  74%|███████▍  | 148/200 [8:14:57<4:02:46, 280.12s/it, best=0.865]Escherichia_Coli | LPS | Optuna:  74%|███████▍  | 148/200 [8:14:57<4:02:46, 280.12s/it, best=0.865][I 2026-03-05 04:13:27,480] Trial 184 finished with value: 0.9312849824233883 and parameters: {'activation': 'tanh', 'solver': 'adam', 'lr': 0.00011321277410118476, 'layer1': 65, 'layer2': 52, 'layer3': 279}. Best is trial 177 with value: 0.9327253118571418.
Klebsiella_Pneumoniae | DirectMulti | Optuna:  92%|█████████▎| 185/200 [4:11:59<17:38, 70.58s/it, best=0.933]Klebsiella_Pneumoniae | DirectMulti | Optuna:  92%|█████████▎| 185/200 [4:11:59<17:38, 70.58s/it, best=0.933][I 2026-03-05 04:13:42,577] Trial 164 finished with value: 0.8616495679853481 and parameters: {'activation': 'relu', 'solver': 'adam', 'lr': 0.0031193213580803553, 'layer1': 277, 'layer2': 461, 'layer3': 301}. Best is trial 161 with value: 0.8669185742695007.
Pseudomonas_Aeruginosa | DirectMulti | Optuna:  82%|████████▎ | 165/200 [4:19:36<57:42, 98.93s/it, best=0.867]   Pseudomonas_Aeruginosa | DirectMulti | Optuna:  82%|████████▎ | 165/200 [4:19:36<57:42, 98.93s/it, best=0.867][I 2026-03-05 04:13:46,873] Trial 80 finished with value: 0.892907923298711 and parameters: {'activation': 'identity', 'solver': 'adam', 'lr': 1.0375521689901552e-05, 'layer1': 361, 'layer2': 331, 'layer3': 61}. Best is trial 62 with value: 0.8933826282053527.
Staphylococcus_Aureus | DirectMulti | Optuna:  40%|████      | 81/200 [3:39:04<8:28:39, 256.46s/it, best=0.893]Staphylococcus_Aureus | DirectMulti | Optuna:  40%|████      | 81/200 [3:39:04<8:28:39, 256.46s/it, best=0.893][I 2026-03-05 04:14:22,368] Trial 185 finished with value: 0.9314880219817475 and parameters: {'activation': 'tanh', 'solver': 'adam', 'lr': 0.00017954286808357205, 'layer1': 41, 'layer2': 61, 'layer3': 266}. Best is trial 177 with value: 0.9327253118571418.
Klebsiella_Pneumoniae | DirectMulti | Optuna:  93%|█████████▎| 186/200 [4:12:54<15:22, 65.87s/it, best=0.933]Klebsiella_Pneumoniae | DirectMulti | Optuna:  93%|█████████▎| 186/200 [4:12:54<15:22, 65.87s/it, best=0.933][I 2026-03-05 04:15:26,988] Trial 186 finished with value: 0.9317732243492719 and parameters: {'activation': 'tanh', 'solver': 'adam', 'lr': 0.00010379043876137114, 'layer1': 70, 'layer2': 48, 'layer3': 270}. Best is trial 177 with value: 0.9327253118571418.
Klebsiella_Pneumoniae | DirectMulti | Optuna:  94%|█████████▎| 187/200 [4:13:59<14:11, 65.49s/it, best=0.933]Klebsiella_Pneumoniae | DirectMulti | Optuna:  94%|█████████▎| 187/200 [4:13:59<14:11, 65.49s/it, best=0.933][I 2026-03-05 04:15:55,034] Trial 165 finished with value: 0.85986470549914 and parameters: {'activation': 'relu', 'solver': 'adam', 'lr': 0.0023046741441551627, 'layer1': 472, 'layer2': 447, 'layer3': 321}. Best is trial 161 with value: 0.8669185742695007.
Pseudomonas_Aeruginosa | DirectMulti | Optuna:  83%|████████▎ | 166/200 [4:21:49<1:01:45, 108.99s/it, best=0.867]Pseudomonas_Aeruginosa | DirectMulti | Optuna:  83%|████████▎ | 166/200 [4:21:49<1:01:45, 108.99s/it, best=0.867][I 2026-03-05 04:16:36,270] Trial 187 finished with value: 0.9309262277946498 and parameters: {'activation': 'tanh', 'solver': 'adam', 'lr': 0.00013365887348074982, 'layer1': 79, 'layer2': 27, 'layer3': 276}. Best is trial 177 with value: 0.9327253118571418.
Klebsiella_Pneumoniae | DirectMulti | Optuna:  94%|█████████▍| 188/200 [4:15:08<13:19, 66.63s/it, best=0.933]Klebsiella_Pneumoniae | DirectMulti | Optuna:  94%|█████████▍| 188/200 [4:15:08<13:19, 66.63s/it, best=0.933][I 2026-03-05 04:17:49,367] Trial 188 finished with value: 0.9312679015500226 and parameters: {'activation': 'tanh', 'solver': 'adam', 'lr': 0.00010126873283203352, 'layer1': 67, 'layer2': 329, 'layer3': 249}. Best is trial 177 with value: 0.9327253118571418.
Klebsiella_Pneumoniae | DirectMulti | Optuna:  94%|█████████▍| 189/200 [4:16:21<12:34, 68.57s/it, best=0.933]Klebsiella_Pneumoniae | DirectMulti | Optuna:  94%|█████████▍| 189/200 [4:16:21<12:34, 68.57s/it, best=0.933][I 2026-03-05 04:18:49,068] Trial 166 finished with value: 0.8635035946232238 and parameters: {'activation': 'relu', 'solver': 'adam', 'lr': 0.004004328501443124, 'layer1': 446, 'layer2': 370, 'layer3': 346}. Best is trial 161 with value: 0.8669185742695007.
Pseudomonas_Aeruginosa | DirectMulti | Optuna:  84%|████████▎ | 167/200 [4:24:43<1:10:40, 128.50s/it, best=0.867]Pseudomonas_Aeruginosa | DirectMulti | Optuna:  84%|████████▎ | 167/200 [4:24:43<1:10:40, 128.50s/it, best=0.867][I 2026-03-05 04:18:59,874] Trial 148 finished with value: 0.8618836895576054 and parameters: {'activation': 'relu', 'solver': 'adam', 'lr': 2.0276739864012263e-05, 'layer1': 492, 'layer2': 10, 'layer3': 472}. Best is trial 139 with value: 0.8649329422529497.
Escherichia_Coli | LPS | Optuna:  74%|███████▍  | 149/200 [8:20:41<4:14:36, 299.54s/it, best=0.865]Escherichia_Coli | LPS | Optuna:  74%|███████▍  | 149/200 [8:20:41<4:14:36, 299.54s/it, best=0.865][I 2026-03-05 04:19:11,414] Trial 189 finished with value: 0.930917044994235 and parameters: {'activation': 'tanh', 'solver': 'adam', 'lr': 7.121011518210045e-05, 'layer1': 58, 'layer2': 85, 'layer3': 262}. Best is trial 177 with value: 0.9327253118571418.
