Klebsiella_Pneumoniae | DirectMulti | Optuna:  76%|███████▌  | 152/200 [3:26:19<1:11:51, 89.82s/it, best=0.932]Klebsiella_Pneumoniae | DirectMulti | Optuna:  76%|███████▌  | 152/200 [3:26:19<1:11:51, 89.82s/it, best=0.932][I 2026-03-05 03:27:54,686] Trial 137 finished with value: 0.8610876422558006 and parameters: {'activation': 'relu', 'solver': 'adam', 'lr': 0.00014128092635134592, 'layer1': 416, 'layer2': 374, 'layer3': 369}. Best is trial 71 with value: 0.8659155749694897.
Pseudomonas_Aeruginosa | DirectMulti | Optuna:  69%|██████▉   | 138/200 [3:33:48<1:41:10, 97.91s/it, best=0.866]Pseudomonas_Aeruginosa | DirectMulti | Optuna:  69%|██████▉   | 138/200 [3:33:48<1:41:10, 97.91s/it, best=0.866][I 2026-03-05 03:28:52,267] Trial 152 finished with value: 0.9313898788929004 and parameters: {'activation': 'tanh', 'solver': 'adam', 'lr': 9.402576570258151e-05, 'layer1': 85, 'layer2': 132, 'layer3': 313}. Best is trial 132 with value: 0.9322660802940301.
Klebsiella_Pneumoniae | DirectMulti | Optuna:  76%|███████▋  | 153/200 [3:27:24<1:04:33, 82.42s/it, best=0.932]Klebsiella_Pneumoniae | DirectMulti | Optuna:  76%|███████▋  | 153/200 [3:27:24<1:04:33, 82.42s/it, best=0.932][I 2026-03-05 03:29:25,883] Trial 70 finished with value: 0.8027432162433144 and parameters: {'activation': 'identity', 'solver': 'sgd', 'lr': 7.2903337519764295e-06, 'layer1': 354, 'layer2': 471, 'layer3': 103}. Best is trial 62 with value: 0.8933826282053527.
Staphylococcus_Aureus | DirectMulti | Optuna:  36%|███▌      | 71/200 [2:54:43<11:34:37, 323.08s/it, best=0.893]Staphylococcus_Aureus | DirectMulti | Optuna:  36%|███▌      | 71/200 [2:54:43<11:34:37, 323.08s/it, best=0.893][I 2026-03-05 03:30:09,885] Trial 138 finished with value: 0.859344019125152 and parameters: {'activation': 'relu', 'solver': 'adam', 'lr': 0.005753698743273518, 'layer1': 478, 'layer2': 407, 'layer3': 319}. Best is trial 71 with value: 0.8659155749694897.
Pseudomonas_Aeruginosa | DirectMulti | Optuna:  70%|██████▉   | 139/200 [3:36:03<1:50:54, 109.09s/it, best=0.866]Pseudomonas_Aeruginosa | DirectMulti | Optuna:  70%|██████▉   | 139/200 [3:36:03<1:50:54, 109.09s/it, best=0.866][I 2026-03-05 03:30:29,866] Trial 153 finished with value: 0.9320260855961042 and parameters: {'activation': 'tanh', 'solver': 'adam', 'lr': 4.357407119785512e-05, 'layer1': 122, 'layer2': 83, 'layer3': 300}. Best is trial 132 with value: 0.9322660802940301.
Klebsiella_Pneumoniae | DirectMulti | Optuna:  77%|███████▋  | 154/200 [3:29:01<1:06:40, 86.97s/it, best=0.932]Klebsiella_Pneumoniae | DirectMulti | Optuna:  77%|███████▋  | 154/200 [3:29:01<1:06:40, 86.97s/it, best=0.932][I 2026-03-05 03:30:38,626] Trial 138 finished with value: 0.8615820240569331 and parameters: {'activation': 'relu', 'solver': 'adam', 'lr': 3.825113437381769e-05, 'layer1': 377, 'layer2': 68, 'layer3': 458}. Best is trial 73 with value: 0.864893646817533.
Escherichia_Coli | LPS | Optuna:  70%|██████▉   | 139/200 [7:32:20<5:03:10, 298.20s/it, best=0.865]Escherichia_Coli | LPS | Optuna:  70%|██████▉   | 139/200 [7:32:20<5:03:10, 298.20s/it, best=0.865][I 2026-03-05 03:31:16,761] Trial 139 finished with value: 0.8566386611730336 and parameters: {'activation': 'logistic', 'solver': 'adam', 'lr': 0.002760580914750554, 'layer1': 210, 'layer2': 343, 'layer3': 338}. Best is trial 71 with value: 0.8659155749694897.
Pseudomonas_Aeruginosa | DirectMulti | Optuna:  70%|███████   | 140/200 [3:37:10<1:36:25, 96.43s/it, best=0.866] Pseudomonas_Aeruginosa | DirectMulti | Optuna:  70%|███████   | 140/200 [3:37:10<1:36:25, 96.43s/it, best=0.866][I 2026-03-05 03:32:03,726] Trial 140 finished with value: 0.8261898244308833 and parameters: {'activation': 'relu', 'solver': 'sgd', 'lr': 0.008097801756868184, 'layer1': 430, 'layer2': 397, 'layer3': 293}. Best is trial 71 with value: 0.8659155749694897.
Pseudomonas_Aeruginosa | DirectMulti | Optuna:  70%|███████   | 141/200 [3:37:57<1:20:13, 81.59s/it, best=0.866]Pseudomonas_Aeruginosa | DirectMulti | Optuna:  70%|███████   | 141/200 [3:37:57<1:20:13, 81.59s/it, best=0.866][I 2026-03-05 03:32:10,107] Trial 154 finished with value: 0.930693167027685 and parameters: {'activation': 'tanh', 'solver': 'adam', 'lr': 4.3976718529273095e-05, 'layer1': 151, 'layer2': 86, 'layer3': 299}. Best is trial 132 with value: 0.9322660802940301.
Klebsiella_Pneumoniae | DirectMulti | Optuna:  78%|███████▊  | 155/200 [3:30:42<1:08:12, 90.95s/it, best=0.932]Klebsiella_Pneumoniae | DirectMulti | Optuna:  78%|███████▊  | 155/200 [3:30:42<1:08:12, 90.95s/it, best=0.932][I 2026-03-05 03:33:26,227] Trial 155 finished with value: 0.9318705021738662 and parameters: {'activation': 'tanh', 'solver': 'adam', 'lr': 8.36618978548988e-05, 'layer1': 139, 'layer2': 98, 'layer3': 348}. Best is trial 132 with value: 0.9322660802940301.
Klebsiella_Pneumoniae | DirectMulti | Optuna:  78%|███████▊  | 156/200 [3:31:58<1:03:26, 86.50s/it, best=0.932]Klebsiella_Pneumoniae | DirectMulti | Optuna:  78%|███████▊  | 156/200 [3:31:58<1:03:26, 86.50s/it, best=0.932][I 2026-03-05 03:33:41,953] Trial 141 finished with value: 0.8590416631072726 and parameters: {'activation': 'relu', 'solver': 'adam', 'lr': 0.002801337197413221, 'layer1': 423, 'layer2': 388, 'layer3': 316}. Best is trial 71 with value: 0.8659155749694897.
Pseudomonas_Aeruginosa | DirectMulti | Optuna:  71%|███████   | 142/200 [3:39:36<1:23:41, 86.58s/it, best=0.866]Pseudomonas_Aeruginosa | DirectMulti | Optuna:  71%|███████   | 142/200 [3:39:36<1:23:41, 86.58s/it, best=0.866][I 2026-03-05 03:34:45,181] Trial 71 finished with value: 0.8923808736955643 and parameters: {'activation': 'identity', 'solver': 'adam', 'lr': 1.3661079910007136e-05, 'layer1': 374, 'layer2': 427, 'layer3': 80}. Best is trial 62 with value: 0.8933826282053527.
Staphylococcus_Aureus | DirectMulti | Optuna:  36%|███▌      | 72/200 [3:00:02<11:26:49, 321.95s/it, best=0.893]Staphylococcus_Aureus | DirectMulti | Optuna:  36%|███▌      | 72/200 [3:00:02<11:26:49, 321.95s/it, best=0.893][I 2026-03-05 03:35:14,092] Trial 139 finished with value: 0.8649329422529497 and parameters: {'activation': 'relu', 'solver': 'adam', 'lr': 3.107623302582474e-05, 'layer1': 493, 'layer2': 55, 'layer3': 491}. Best is trial 139 with value: 0.8649329422529497.
Escherichia_Coli | LPS | Optuna:  70%|███████   | 140/200 [7:36:56<4:51:22, 291.38s/it, best=0.865]Escherichia_Coli | LPS | Optuna:  70%|███████   | 140/200 [7:36:56<4:51:22, 291.38s/it, best=0.865][I 2026-03-05 03:35:18,280] Trial 142 finished with value: 0.860424551749607 and parameters: {'activation': 'relu', 'solver': 'adam', 'lr': 0.002134378355781747, 'layer1': 404, 'layer2': 438, 'layer3': 328}. Best is trial 71 with value: 0.8659155749694897.
Pseudomonas_Aeruginosa | DirectMulti | Optuna:  72%|███████▏  | 143/200 [3:41:12<1:25:01, 89.50s/it, best=0.866]Pseudomonas_Aeruginosa | DirectMulti | Optuna:  72%|███████▏  | 143/200 [3:41:12<1:25:01, 89.50s/it, best=0.866][I 2026-03-05 03:35:34,885] Trial 156 finished with value: 0.9318359364522578 and parameters: {'activation': 'tanh', 'solver': 'adam', 'lr': 3.829807301471991e-05, 'layer1': 124, 'layer2': 75, 'layer3': 349}. Best is trial 132 with value: 0.9322660802940301.
Klebsiella_Pneumoniae | DirectMulti | Optuna:  78%|███████▊  | 157/200 [3:34:07<1:11:03, 99.15s/it, best=0.932]Klebsiella_Pneumoniae | DirectMulti | Optuna:  78%|███████▊  | 157/200 [3:34:07<1:11:03, 99.15s/it, best=0.932][I 2026-03-05 03:36:10,964] Trial 157 finished with value: 0.8746470562584285 and parameters: {'activation': 'logistic', 'solver': 'adam', 'lr': 3.6627335408219374e-05, 'layer1': 120, 'layer2': 83, 'layer3': 351}. Best is trial 132 with value: 0.9322660802940301.
Klebsiella_Pneumoniae | DirectMulti | Optuna:  79%|███████▉  | 158/200 [3:34:43<56:09, 80.23s/it, best=0.932]  Klebsiella_Pneumoniae | DirectMulti | Optuna:  79%|███████▉  | 158/200 [3:34:43<56:09, 80.23s/it, best=0.932][I 2026-03-05 03:36:47,356] Trial 158 finished with value: 0.8746470562584285 and parameters: {'activation': 'tanh', 'solver': 'adam', 'lr': 2.3835814377361968e-05, 'layer1': 125, 'layer2': 51, 'layer3': 344}. Best is trial 132 with value: 0.9322660802940301.
Klebsiella_Pneumoniae | DirectMulti | Optuna:  80%|███████▉  | 159/200 [3:35:19<45:50, 67.08s/it, best=0.932]Klebsiella_Pneumoniae | DirectMulti | Optuna:  80%|███████▉  | 159/200 [3:35:19<45:50, 67.08s/it, best=0.932][I 2026-03-05 03:37:03,682] Trial 143 finished with value: 0.860602072853531 and parameters: {'activation': 'relu', 'solver': 'adam', 'lr': 0.004579956247032273, 'layer1': 465, 'layer2': 184, 'layer3': 303}. Best is trial 71 with value: 0.8659155749694897.
Pseudomonas_Aeruginosa | DirectMulti | Optuna:  72%|███████▏  | 144/200 [3:42:57<1:27:59, 94.27s/it, best=0.866]Pseudomonas_Aeruginosa | DirectMulti | Optuna:  72%|███████▏  | 144/200 [3:42:57<1:27:59, 94.27s/it, best=0.866][I 2026-03-05 03:38:17,503] Trial 159 finished with value: 0.9319460130370565 and parameters: {'activation': 'tanh', 'solver': 'adam', 'lr': 4.8919097595944256e-05, 'layer1': 94, 'layer2': 75, 'layer3': 324}. Best is trial 132 with value: 0.9322660802940301.
Klebsiella_Pneumoniae | DirectMulti | Optuna:  80%|████████  | 160/200 [3:36:49<49:19, 74.00s/it, best=0.932]Klebsiella_Pneumoniae | DirectMulti | Optuna:  80%|████████  | 160/200 [3:36:49<49:19, 74.00s/it, best=0.932][I 2026-03-05 03:38:46,386] Trial 144 finished with value: 0.86207719339068 and parameters: {'activation': 'relu', 'solver': 'adam', 'lr': 0.003318676239411201, 'layer1': 442, 'layer2': 103, 'layer3': 353}. Best is trial 71 with value: 0.8659155749694897.
Pseudomonas_Aeruginosa | DirectMulti | Optuna:  72%|███████▎  | 145/200 [3:44:40<1:28:44, 96.80s/it, best=0.866]Pseudomonas_Aeruginosa | DirectMulti | Optuna:  72%|███████▎  | 145/200 [3:44:40<1:28:44, 96.80s/it, best=0.866][I 2026-03-05 03:40:00,497] Trial 160 finished with value: 0.9308172641167841 and parameters: {'activation': 'tanh', 'solver': 'adam', 'lr': 3.373212039355803e-05, 'layer1': 97, 'layer2': 75, 'layer3': 330}. Best is trial 132 with value: 0.9322660802940301.
Klebsiella_Pneumoniae | DirectMulti | Optuna:  80%|████████  | 161/200 [3:38:32<53:45, 82.70s/it, best=0.932]Klebsiella_Pneumoniae | DirectMulti | Optuna:  80%|████████  | 161/200 [3:38:32<53:45, 82.70s/it, best=0.932][I 2026-03-05 03:40:14,723] Trial 140 finished with value: 0.7440652037113292 and parameters: {'activation': 'relu', 'solver': 'sgd', 'lr': 1.719777889153548e-05, 'layer1': 500, 'layer2': 471, 'layer3': 488}. Best is trial 139 with value: 0.8649329422529497.
Escherichia_Coli | LPS | Optuna:  70%|███████   | 141/200 [7:41:56<4:49:15, 294.16s/it, best=0.865]Escherichia_Coli | LPS | Optuna:  70%|███████   | 141/200 [7:41:56<4:49:15, 294.16s/it, best=0.865][I 2026-03-05 03:40:43,019] Trial 145 finished with value: 0.859396536708986 and parameters: {'activation': 'relu', 'solver': 'adam', 'lr': 0.0018326090052397932, 'layer1': 456, 'layer2': 416, 'layer3': 317}. Best is trial 71 with value: 0.8659155749694897.
Pseudomonas_Aeruginosa | DirectMulti | Optuna:  73%|███████▎  | 146/200 [3:46:37<1:32:28, 102.75s/it, best=0.866]Pseudomonas_Aeruginosa | DirectMulti | Optuna:  73%|███████▎  | 146/200 [3:46:37<1:32:28, 102.75s/it, best=0.866][I 2026-03-05 03:41:39,322] Trial 161 finished with value: 0.9321081412996156 and parameters: {'activation': 'tanh', 'solver': 'adam', 'lr': 4.9471428204057025e-05, 'layer1': 74, 'layer2': 96, 'layer3': 322}. Best is trial 132 with value: 0.9322660802940301.
Klebsiella_Pneumoniae | DirectMulti | Optuna:  81%|████████  | 162/200 [3:40:11<55:26, 87.54s/it, best=0.932]Klebsiella_Pneumoniae | DirectMulti | Optuna:  81%|████████  | 162/200 [3:40:11<55:26, 87.54s/it, best=0.932][I 2026-03-05 03:41:54,153] Trial 72 finished with value: 0.8908986799913701 and parameters: {'activation': 'identity', 'solver': 'adam', 'lr': 8.529659135147888e-06, 'layer1': 377, 'layer2': 433, 'layer3': 88}. Best is trial 62 with value: 0.8933826282053527.
Staphylococcus_Aureus | DirectMulti | Optuna:  36%|███▋      | 73/200 [3:07:11<12:29:24, 354.05s/it, best=0.893]Staphylococcus_Aureus | DirectMulti | Optuna:  36%|███▋      | 73/200 [3:07:11<12:29:24, 354.05s/it, best=0.893][I 2026-03-05 03:41:56,560] Trial 146 finished with value: 0.8623191131071868 and parameters: {'activation': 'relu', 'solver': 'adam', 'lr': 0.0039357594328649536, 'layer1': 244, 'layer2': 361, 'layer3': 338}. Best is trial 71 with value: 0.8659155749694897.
Pseudomonas_Aeruginosa | DirectMulti | Optuna:  74%|███████▎  | 147/200 [3:47:50<1:23:01, 93.99s/it, best=0.866] Pseudomonas_Aeruginosa | DirectMulti | Optuna:  74%|███████▎  | 147/200 [3:47:50<1:23:01, 93.99s/it, best=0.866][I 2026-03-05 03:43:12,627] Trial 162 finished with value: 0.9324033953093582 and parameters: {'activation': 'tanh', 'solver': 'adam', 'lr': 5.5053536142259565e-05, 'layer1': 72, 'layer2': 93, 'layer3': 326}. Best is trial 162 with value: 0.9324033953093582.
Klebsiella_Pneumoniae | DirectMulti | Optuna:  82%|████████▏ | 163/200 [3:41:44<55:02, 89.27s/it, best=0.932]Klebsiella_Pneumoniae | DirectMulti | Optuna:  82%|████████▏ | 163/200 [3:41:44<55:02, 89.27s/it, best=0.932][I 2026-03-05 03:44:03,630] Trial 147 finished with value: 0.8605541177287821 and parameters: {'activation': 'relu', 'solver': 'adam', 'lr': 0.0026295660395324522, 'layer1': 428, 'layer2': 458, 'layer3': 276}. Best is trial 71 with value: 0.8659155749694897.
Pseudomonas_Aeruginosa | DirectMulti | Optuna:  74%|███████▍  | 148/200 [3:49:57<1:30:03, 103.91s/it, best=0.866]Pseudomonas_Aeruginosa | DirectMulti | Optuna:  74%|███████▍  | 148/200 [3:49:57<1:30:03, 103.91s/it, best=0.866][I 2026-03-05 03:44:46,280] Trial 163 finished with value: 0.9323811815296434 and parameters: {'activation': 'tanh', 'solver': 'adam', 'lr': 5.742057722712497e-05, 'layer1': 51, 'layer2': 94, 'layer3': 326}. Best is trial 162 with value: 0.9324033953093582.
Klebsiella_Pneumoniae | DirectMulti | Optuna:  82%|████████▏ | 164/200 [3:43:18<54:20, 90.58s/it, best=0.932]Klebsiella_Pneumoniae | DirectMulti | Optuna:  82%|████████▏ | 164/200 [3:43:18<54:20, 90.58s/it, best=0.932][I 2026-03-05 03:45:10,303] Trial 141 finished with value: 0.8622095028455281 and parameters: {'activation': 'relu', 'solver': 'adam', 'lr': 2.5219093814893842e-05, 'layer1': 471, 'layer2': 54, 'layer3': 495}. Best is trial 139 with value: 0.8649329422529497.
Escherichia_Coli | LPS | Optuna:  71%|███████   | 142/200 [7:46:52<4:44:45, 294.58s/it, best=0.865]Escherichia_Coli | LPS | Optuna:  71%|███████   | 142/200 [7:46:52<4:44:45, 294.58s/it, best=0.865][I 2026-03-05 03:45:33,845] Trial 148 finished with value: 0.8609714164326219 and parameters: {'activation': 'tanh', 'solver': 'adam', 'lr': 0.0016759544129083185, 'layer1': 464, 'layer2': 152, 'layer3': 302}. Best is trial 71 with value: 0.8659155749694897.
Pseudomonas_Aeruginosa | DirectMulti | Optuna:  74%|███████▍  | 149/200 [3:51:27<1:24:49, 99.80s/it, best=0.866] Pseudomonas_Aeruginosa | DirectMulti | Optuna:  74%|███████▍  | 149/200 [3:51:27<1:24:49, 99.80s/it, best=0.866][I 2026-03-05 03:46:02,996] Trial 164 finished with value: 0.9308374005352018 and parameters: {'activation': 'tanh', 'solver': 'adam', 'lr': 5.685308203113468e-05, 'layer1': 31, 'layer2': 93, 'layer3': 341}. Best is trial 162 with value: 0.9324033953093582.
Klebsiella_Pneumoniae | DirectMulti | Optuna:  82%|████████▎ | 165/200 [3:44:35<50:24, 86.42s/it, best=0.932]Klebsiella_Pneumoniae | DirectMulti | Optuna:  82%|████████▎ | 165/200 [3:44:35<50:24, 86.42s/it, best=0.932][I 2026-03-05 03:46:19,642] Trial 73 finished with value: 0.8923857907483927 and parameters: {'activation': 'identity', 'solver': 'adam', 'lr': 1.913977512298895e-05, 'layer1': 453, 'layer2': 464, 'layer3': 124}. Best is trial 62 with value: 0.8933826282053527.
Staphylococcus_Aureus | DirectMulti | Optuna:  37%|███▋      | 74/200 [3:11:37<11:27:43, 327.48s/it, best=0.893]Staphylococcus_Aureus | DirectMulti | Optuna:  37%|███▋      | 74/200 [3:11:37<11:27:43, 327.48s/it, best=0.893][I 2026-03-05 03:46:55,594] Trial 149 finished with value: 0.8544678862610322 and parameters: {'activation': 'identity', 'solver': 'adam', 'lr': 0.005111420350280379, 'layer1': 478, 'layer2': 138, 'layer3': 363}. Best is trial 71 with value: 0.8659155749694897.
Pseudomonas_Aeruginosa | DirectMulti | Optuna:  75%|███████▌  | 150/200 [3:52:49<1:18:39, 94.39s/it, best=0.866]Pseudomonas_Aeruginosa | DirectMulti | Optuna:  75%|███████▌  | 150/200 [3:52:49<1:18:39, 94.39s/it, best=0.866][I 2026-03-05 03:47:20,516] Trial 165 finished with value: 0.9315851217148241 and parameters: {'activation': 'tanh', 'solver': 'adam', 'lr': 6.913927241657316e-05, 'layer1': 45, 'layer2': 73, 'layer3': 322}. Best is trial 162 with value: 0.9324033953093582.
Klebsiella_Pneumoniae | DirectMulti | Optuna:  83%|████████▎ | 166/200 [3:45:52<47:27, 83.75s/it, best=0.932]Klebsiella_Pneumoniae | DirectMulti | Optuna:  83%|████████▎ | 166/200 [3:45:52<47:27, 83.75s/it, best=0.932][I 2026-03-05 03:48:54,552] Trial 166 finished with value: 0.9310244832700683 and parameters: {'activation': 'tanh', 'solver': 'adam', 'lr': 5.396186278699866e-05, 'layer1': 58, 'layer2': 56, 'layer3': 356}. Best is trial 162 with value: 0.9324033953093582.
Klebsiella_Pneumoniae | DirectMulti | Optuna:  84%|████████▎ | 167/200 [3:47:26<47:45, 86.84s/it, best=0.932]Klebsiella_Pneumoniae | DirectMulti | Optuna:  84%|████████▎ | 167/200 [3:47:26<47:45, 86.84s/it, best=0.932][I 2026-03-05 03:49:01,746] Trial 150 finished with value: 0.8626015804104414 and parameters: {'activation': 'relu', 'solver': 'adam', 'lr': 0.003098929324735823, 'layer1': 445, 'layer2': 392, 'layer3': 324}. Best is trial 71 with value: 0.8659155749694897.
Pseudomonas_Aeruginosa | DirectMulti | Optuna:  76%|███████▌  | 151/200 [3:54:55<1:24:51, 103.92s/it, best=0.866]Pseudomonas_Aeruginosa | DirectMulti | Optuna:  76%|███████▌  | 151/200 [3:54:55<1:24:51, 103.92s/it, best=0.866][I 2026-03-05 03:49:51,259] Trial 142 finished with value: 0.8644708589278249 and parameters: {'activation': 'relu', 'solver': 'adam', 'lr': 3.0642966618114085e-05, 'layer1': 486, 'layer2': 19, 'layer3': 469}. Best is trial 139 with value: 0.8649329422529497.
Escherichia_Coli | LPS | Optuna:  72%|███████▏  | 143/200 [7:51:33<4:35:58, 290.50s/it, best=0.865]Escherichia_Coli | LPS | Optuna:  72%|███████▏  | 143/200 [7:51:33<4:35:58, 290.50s/it, best=0.865][I 2026-03-05 03:50:21,606] Trial 167 finished with value: 0.9314255736951684 and parameters: {'activation': 'tanh', 'solver': 'adam', 'lr': 8.425935188308038e-05, 'layer1': 51, 'layer2': 38, 'layer3': 349}. Best is trial 162 with value: 0.9324033953093582.
Klebsiella_Pneumoniae | DirectMulti | Optuna:  84%|████████▍ | 168/200 [3:48:53<46:20, 86.90s/it, best=0.932]Klebsiella_Pneumoniae | DirectMulti | Optuna:  84%|████████▍ | 168/200 [3:48:53<46:20, 86.90s/it, best=0.932][I 2026-03-05 03:50:34,899] Trial 74 finished with value: 0.8914321137386947 and parameters: {'activation': 'identity', 'solver': 'adam', 'lr': 2.1147357100530155e-05, 'layer1': 467, 'layer2': 465, 'layer3': 120}. Best is trial 62 with value: 0.8933826282053527.
Staphylococcus_Aureus | DirectMulti | Optuna:  38%|███▊      | 75/200 [3:15:52<10:37:07, 305.82s/it, best=0.893]Staphylococcus_Aureus | DirectMulti | Optuna:  38%|███▊      | 75/200 [3:15:52<10:37:07, 305.82s/it, best=0.893][I 2026-03-05 03:51:11,434] Trial 151 finished with value: 0.8599111142387587 and parameters: {'activation': 'relu', 'solver': 'adam', 'lr': 0.0011310409245530021, 'layer1': 455, 'layer2': 470, 'layer3': 318}. Best is trial 71 with value: 0.8659155749694897.
Pseudomonas_Aeruginosa | DirectMulti | Optuna:  76%|███████▌  | 152/200 [3:57:05<1:29:19, 111.65s/it, best=0.866]Pseudomonas_Aeruginosa | DirectMulti | Optuna:  76%|███████▌  | 152/200 [3:57:05<1:29:19, 111.65s/it, best=0.866][I 2026-03-05 03:51:56,216] Trial 168 finished with value: 0.9295982873945092 and parameters: {'activation': 'relu', 'solver': 'adam', 'lr': 6.602854457445272e-05, 'layer1': 86, 'layer2': 65, 'layer3': 334}. Best is trial 162 with value: 0.9324033953093582.
Klebsiella_Pneumoniae | DirectMulti | Optuna:  84%|████████▍ | 169/200 [3:50:28<46:05, 89.21s/it, best=0.932]Klebsiella_Pneumoniae | DirectMulti | Optuna:  84%|████████▍ | 169/200 [3:50:28<46:05, 89.21s/it, best=0.932][I 2026-03-05 03:52:47,516] Trial 152 finished with value: 0.8601939792814572 and parameters: {'activation': 'relu', 'solver': 'adam', 'lr': 0.0015306868604904732, 'layer1': 438, 'layer2': 448, 'layer3': 329}. Best is trial 71 with value: 0.8659155749694897.
Pseudomonas_Aeruginosa | DirectMulti | Optuna:  76%|███████▋  | 153/200 [3:58:41<1:23:47, 106.98s/it, best=0.866]Pseudomonas_Aeruginosa | DirectMulti | Optuna:  76%|███████▋  | 153/200 [3:58:41<1:23:47, 106.98s/it, best=0.866][I 2026-03-05 03:53:28,293] Trial 169 finished with value: 0.9300105174648798 and parameters: {'activation': 'identity', 'solver': 'adam', 'lr': 4.88996155928382e-05, 'layer1': 20, 'layer2': 88, 'layer3': 311}. Best is trial 162 with value: 0.9324033953093582.
Klebsiella_Pneumoniae | DirectMulti | Optuna:  85%|████████▌ | 170/200 [3:52:00<45:02, 90.07s/it, best=0.932]Klebsiella_Pneumoniae | DirectMulti | Optuna:  85%|████████▌ | 170/200 [3:52:00<45:02, 90.07s/it, best=0.932][I 2026-03-05 03:54:29,842] Trial 153 finished with value: 0.858289960623971 and parameters: {'activation': 'relu', 'solver': 'adam', 'lr': 0.002372138498781566, 'layer1': 456, 'layer2': 434, 'layer3': 346}. Best is trial 71 with value: 0.8659155749694897.
