Klebsiella_Pneumoniae | DirectMulti | Optuna:  27%|██▋       | 54/200 [1:04:43<2:59:09, 73.63s/it, best=0.932]Klebsiella_Pneumoniae | DirectMulti | Optuna:  27%|██▋       | 54/200 [1:04:43<2:59:09, 73.63s/it, best=0.932][I 2026-03-05 01:07:37,766] Trial 17 finished with value: 0.8897462179386159 and parameters: {'activation': 'tanh', 'solver': 'adam', 'lr': 5.144089067558861e-05, 'layer1': 333, 'layer2': 104, 'layer3': 110}. Best is trial 11 with value: 0.8911580213645447.
Staphylococcus_Aureus | DirectMulti | Optuna:   9%|▉         | 18/200 [32:55<7:03:07, 139.49s/it, best=0.891]Staphylococcus_Aureus | DirectMulti | Optuna:   9%|▉         | 18/200 [32:55<7:03:07, 139.49s/it, best=0.891][I 2026-03-05 01:07:43,572] Trial 54 finished with value: 0.9311215241469519 and parameters: {'activation': 'tanh', 'solver': 'adam', 'lr': 4.1317946122967526e-05, 'layer1': 35, 'layer2': 92, 'layer3': 466}. Best is trial 45 with value: 0.9319055344000778.
Klebsiella_Pneumoniae | DirectMulti | Optuna:  28%|██▊       | 55/200 [1:06:15<3:11:06, 79.08s/it, best=0.932]Klebsiella_Pneumoniae | DirectMulti | Optuna:  28%|██▊       | 55/200 [1:06:15<3:11:06, 79.08s/it, best=0.932][I 2026-03-05 01:08:02,712] Trial 100 finished with value: 0.7409191605906366 and parameters: {'activation': 'tanh', 'solver': 'sgd', 'lr': 1.4559921001913354e-05, 'layer1': 479, 'layer2': 25, 'layer3': 347}. Best is trial 73 with value: 0.864893646817533.
Escherichia_Coli | LPS | Optuna:  50%|█████     | 101/200 [5:09:44<5:17:39, 192.52s/it, best=0.865]Escherichia_Coli | LPS | Optuna:  50%|█████     | 101/200 [5:09:44<5:17:39, 192.52s/it, best=0.865][I 2026-03-05 01:08:04,814] Trial 54 finished with value: 0.8610062348921073 and parameters: {'activation': 'relu', 'solver': 'adam', 'lr': 0.0027705425101526315, 'layer1': 484, 'layer2': 234, 'layer3': 440}. Best is trial 23 with value: 0.8649994822247168.
Pseudomonas_Aeruginosa | DirectMulti | Optuna:  28%|██▊       | 55/200 [1:13:58<3:41:15, 91.56s/it, best=0.865]Pseudomonas_Aeruginosa | DirectMulti | Optuna:  28%|██▊       | 55/200 [1:13:58<3:41:15, 91.56s/it, best=0.865][I 2026-03-05 01:08:11,169] Trial 18 finished with value: 0.8016455484651599 and parameters: {'activation': 'logistic', 'solver': 'sgd', 'lr': 0.00022966612172396766, 'layer1': 97, 'layer2': 225, 'layer3': 296}. Best is trial 11 with value: 0.8911580213645447.
Staphylococcus_Aureus | DirectMulti | Optuna:  10%|▉         | 19/200 [33:28<5:24:41, 107.63s/it, best=0.891]Staphylococcus_Aureus | DirectMulti | Optuna:  10%|▉         | 19/200 [33:28<5:24:41, 107.63s/it, best=0.891][I 2026-03-05 01:09:15,888] Trial 55 finished with value: 0.9322110061695005 and parameters: {'activation': 'tanh', 'solver': 'adam', 'lr': 3.948804002658642e-05, 'layer1': 32, 'layer2': 100, 'layer3': 468}. Best is trial 55 with value: 0.9322110061695005.
Klebsiella_Pneumoniae | DirectMulti | Optuna:  28%|██▊       | 56/200 [1:07:48<3:19:19, 83.05s/it, best=0.932]Klebsiella_Pneumoniae | DirectMulti | Optuna:  28%|██▊       | 56/200 [1:07:48<3:19:19, 83.05s/it, best=0.932][I 2026-03-05 01:09:29,231] Trial 19 finished with value: 0.8894350831388828 and parameters: {'activation': 'relu', 'solver': 'adam', 'lr': 0.0004110009732903731, 'layer1': 204, 'layer2': 78, 'layer3': 432}. Best is trial 11 with value: 0.8911580213645447.
Staphylococcus_Aureus | DirectMulti | Optuna:  10%|█         | 20/200 [34:46<4:56:15, 98.75s/it, best=0.891] Staphylococcus_Aureus | DirectMulti | Optuna:  10%|█         | 20/200 [34:46<4:56:15, 98.75s/it, best=0.891][I 2026-03-05 01:10:16,152] Trial 55 finished with value: 0.8603689642549727 and parameters: {'activation': 'relu', 'solver': 'adam', 'lr': 0.0073388546621179955, 'layer1': 499, 'layer2': 111, 'layer3': 350}. Best is trial 23 with value: 0.8649994822247168.
Pseudomonas_Aeruginosa | DirectMulti | Optuna:  28%|██▊       | 56/200 [1:16:10<4:08:22, 103.49s/it, best=0.865]Pseudomonas_Aeruginosa | DirectMulti | Optuna:  28%|██▊       | 56/200 [1:16:10<4:08:22, 103.49s/it, best=0.865][I 2026-03-05 01:10:27,210] Trial 56 finished with value: 0.9293101667689255 and parameters: {'activation': 'identity', 'solver': 'adam', 'lr': 3.845682778477056e-05, 'layer1': 33, 'layer2': 101, 'layer3': 468}. Best is trial 55 with value: 0.9322110061695005.
Klebsiella_Pneumoniae | DirectMulti | Optuna:  28%|██▊       | 57/200 [1:08:59<3:09:33, 79.53s/it, best=0.932]Klebsiella_Pneumoniae | DirectMulti | Optuna:  28%|██▊       | 57/200 [1:08:59<3:09:33, 79.53s/it, best=0.932][I 2026-03-05 01:11:00,233] Trial 57 finished with value: 0.8746470562584285 and parameters: {'activation': 'tanh', 'solver': 'adam', 'lr': 1.582716497504278e-05, 'layer1': 42, 'layer2': 112, 'layer3': 478}. Best is trial 55 with value: 0.9322110061695005.
Klebsiella_Pneumoniae | DirectMulti | Optuna:  29%|██▉       | 58/200 [1:09:32<2:35:12, 65.58s/it, best=0.932]Klebsiella_Pneumoniae | DirectMulti | Optuna:  29%|██▉       | 58/200 [1:09:32<2:35:12, 65.58s/it, best=0.932][I 2026-03-05 01:11:26,985] Trial 101 finished with value: 0.8623783633447794 and parameters: {'activation': 'tanh', 'solver': 'adam', 'lr': 2.910431500213966e-05, 'layer1': 410, 'layer2': 57, 'layer3': 386}. Best is trial 73 with value: 0.864893646817533.
Escherichia_Coli | LPS | Optuna:  51%|█████     | 102/200 [5:13:09<5:20:12, 196.05s/it, best=0.865]Escherichia_Coli | LPS | Optuna:  51%|█████     | 102/200 [5:13:09<5:20:12, 196.05s/it, best=0.865][I 2026-03-05 01:11:29,455] Trial 56 finished with value: 0.8560305510951484 and parameters: {'activation': 'identity', 'solver': 'adam', 'lr': 0.004421173557723925, 'layer1': 418, 'layer2': 147, 'layer3': 184}. Best is trial 23 with value: 0.8649994822247168.
Pseudomonas_Aeruginosa | DirectMulti | Optuna:  28%|██▊       | 57/200 [1:17:23<3:45:04, 94.43s/it, best=0.865] Pseudomonas_Aeruginosa | DirectMulti | Optuna:  28%|██▊       | 57/200 [1:17:23<3:45:04, 94.43s/it, best=0.865][I 2026-03-05 01:12:11,993] Trial 20 finished with value: 0.8904097012045531 and parameters: {'activation': 'relu', 'solver': 'adam', 'lr': 3.3532042554775476e-05, 'layer1': 133, 'layer2': 184, 'layer3': 267}. Best is trial 11 with value: 0.8911580213645447.
Staphylococcus_Aureus | DirectMulti | Optuna:  10%|█         | 21/200 [37:29<5:51:55, 117.97s/it, best=0.891]Staphylococcus_Aureus | DirectMulti | Optuna:  10%|█         | 21/200 [37:29<5:51:55, 117.97s/it, best=0.891][I 2026-03-05 01:12:13,541] Trial 57 finished with value: 0.826531958921184 and parameters: {'activation': 'relu', 'solver': 'sgd', 'lr': 0.00775129802310245, 'layer1': 453, 'layer2': 175, 'layer3': 489}. Best is trial 23 with value: 0.8649994822247168.
Pseudomonas_Aeruginosa | DirectMulti | Optuna:  29%|██▉       | 58/200 [1:18:07<3:07:44, 79.33s/it, best=0.865]Pseudomonas_Aeruginosa | DirectMulti | Optuna:  29%|██▉       | 58/200 [1:18:07<3:07:44, 79.33s/it, best=0.865][I 2026-03-05 01:13:16,858] Trial 58 finished with value: 0.8748708800000168 and parameters: {'activation': 'tanh', 'solver': 'sgd', 'lr': 2.0677753304809684e-05, 'layer1': 17, 'layer2': 121, 'layer3': 435}. Best is trial 55 with value: 0.9322110061695005.
Klebsiella_Pneumoniae | DirectMulti | Optuna:  30%|██▉       | 59/200 [1:11:48<3:24:11, 86.89s/it, best=0.932]Klebsiella_Pneumoniae | DirectMulti | Optuna:  30%|██▉       | 59/200 [1:11:48<3:24:11, 86.89s/it, best=0.932][I 2026-03-05 01:13:53,802] Trial 59 finished with value: 0.8859693706900327 and parameters: {'activation': 'tanh', 'solver': 'adam', 'lr': 4.631307742006914e-05, 'layer1': 10, 'layer2': 51, 'layer3': 459}. Best is trial 55 with value: 0.9322110061695005.
Klebsiella_Pneumoniae | DirectMulti | Optuna:  30%|███       | 60/200 [1:12:25<2:47:47, 71.91s/it, best=0.932]Klebsiella_Pneumoniae | DirectMulti | Optuna:  30%|███       | 60/200 [1:12:25<2:47:47, 71.91s/it, best=0.932][I 2026-03-05 01:13:56,394] Trial 58 finished with value: 0.8581985607891264 and parameters: {'activation': 'relu', 'solver': 'adam', 'lr': 0.0027680743447532357, 'layer1': 481, 'layer2': 99, 'layer3': 274}. Best is trial 23 with value: 0.8649994822247168.
Pseudomonas_Aeruginosa | DirectMulti | Optuna:  30%|██▉       | 59/200 [1:19:50<3:23:00, 86.39s/it, best=0.865]Pseudomonas_Aeruginosa | DirectMulti | Optuna:  30%|██▉       | 59/200 [1:19:50<3:23:00, 86.39s/it, best=0.865][I 2026-03-05 01:14:13,387] Trial 102 finished with value: 0.8614846537402903 and parameters: {'activation': 'tanh', 'solver': 'adam', 'lr': 6.111859981922254e-05, 'layer1': 427, 'layer2': 39, 'layer3': 363}. Best is trial 73 with value: 0.864893646817533.
Escherichia_Coli | LPS | Optuna:  52%|█████▏    | 103/200 [5:15:55<5:02:33, 187.15s/it, best=0.865]Escherichia_Coli | LPS | Optuna:  52%|█████▏    | 103/200 [5:15:55<5:02:33, 187.15s/it, best=0.865][I 2026-03-05 01:14:46,171] Trial 21 finished with value: 0.8897850733625219 and parameters: {'activation': 'relu', 'solver': 'adam', 'lr': 4.30965865748407e-05, 'layer1': 132, 'layer2': 147, 'layer3': 273}. Best is trial 11 with value: 0.8911580213645447.
Staphylococcus_Aureus | DirectMulti | Optuna:  11%|█         | 22/200 [40:03<6:22:12, 128.83s/it, best=0.891]Staphylococcus_Aureus | DirectMulti | Optuna:  11%|█         | 22/200 [40:03<6:22:12, 128.83s/it, best=0.891][I 2026-03-05 01:15:21,520] Trial 59 finished with value: 0.8591027166721755 and parameters: {'activation': 'logistic', 'solver': 'adam', 'lr': 0.0005854324450561418, 'layer1': 383, 'layer2': 116, 'layer3': 371}. Best is trial 23 with value: 0.8649994822247168.
Pseudomonas_Aeruginosa | DirectMulti | Optuna:  30%|███       | 60/200 [1:21:15<3:20:41, 86.01s/it, best=0.865]Pseudomonas_Aeruginosa | DirectMulti | Optuna:  30%|███       | 60/200 [1:21:15<3:20:41, 86.01s/it, best=0.865][I 2026-03-05 01:16:52,418] Trial 60 finished with value: 0.9295584346203981 and parameters: {'activation': 'logistic', 'solver': 'adam', 'lr': 0.00016233218880259002, 'layer1': 498, 'layer2': 145, 'layer3': 486}. Best is trial 55 with value: 0.9322110061695005.
Klebsiella_Pneumoniae | DirectMulti | Optuna:  30%|███       | 61/200 [1:15:24<4:00:44, 103.92s/it, best=0.932]Klebsiella_Pneumoniae | DirectMulti | Optuna:  30%|███       | 61/200 [1:15:24<4:00:44, 103.92s/it, best=0.932][I 2026-03-05 01:17:56,537] Trial 60 finished with value: 0.8601350301069101 and parameters: {'activation': 'relu', 'solver': 'adam', 'lr': 4.2532442568076146e-05, 'layer1': 427, 'layer2': 321, 'layer3': 242}. Best is trial 23 with value: 0.8649994822247168.
Pseudomonas_Aeruginosa | DirectMulti | Optuna:  30%|███       | 61/200 [1:23:50<4:07:12, 106.71s/it, best=0.865]Pseudomonas_Aeruginosa | DirectMulti | Optuna:  30%|███       | 61/200 [1:23:50<4:07:12, 106.71s/it, best=0.865][I 2026-03-05 01:18:27,868] Trial 22 finished with value: 0.8899445424961299 and parameters: {'activation': 'relu', 'solver': 'adam', 'lr': 3.220949257663769e-05, 'layer1': 222, 'layer2': 232, 'layer3': 197}. Best is trial 11 with value: 0.8911580213645447.
Staphylococcus_Aureus | DirectMulti | Optuna:  12%|█▏        | 23/200 [43:45<7:42:16, 156.70s/it, best=0.891]Staphylococcus_Aureus | DirectMulti | Optuna:  12%|█▏        | 23/200 [43:45<7:42:16, 156.70s/it, best=0.891][I 2026-03-05 01:18:31,454] Trial 61 finished with value: 0.9306437713949702 and parameters: {'activation': 'tanh', 'solver': 'adam', 'lr': 3.603229599653929e-05, 'layer1': 40, 'layer2': 83, 'layer3': 445}. Best is trial 55 with value: 0.9322110061695005.
Klebsiella_Pneumoniae | DirectMulti | Optuna:  31%|███       | 62/200 [1:17:03<3:55:38, 102.46s/it, best=0.932]Klebsiella_Pneumoniae | DirectMulti | Optuna:  31%|███       | 62/200 [1:17:03<3:55:38, 102.46s/it, best=0.932][I 2026-03-05 01:18:36,453] Trial 103 finished with value: 0.8630091631330685 and parameters: {'activation': 'tanh', 'solver': 'adam', 'lr': 1.9072728447505193e-05, 'layer1': 400, 'layer2': 23, 'layer3': 400}. Best is trial 73 with value: 0.864893646817533.
Escherichia_Coli | LPS | Optuna:  52%|█████▏    | 104/200 [5:20:18<5:35:53, 209.93s/it, best=0.865]Escherichia_Coli | LPS | Optuna:  52%|█████▏    | 104/200 [5:20:18<5:35:53, 209.93s/it, best=0.865][I 2026-03-05 01:19:45,994] Trial 61 finished with value: 0.8605995174480829 and parameters: {'activation': 'relu', 'solver': 'adam', 'lr': 0.0016531453856486029, 'layer1': 460, 'layer2': 206, 'layer3': 394}. Best is trial 23 with value: 0.8649994822247168.
Pseudomonas_Aeruginosa | DirectMulti | Optuna:  31%|███       | 62/200 [1:25:40<4:07:19, 107.53s/it, best=0.865]Pseudomonas_Aeruginosa | DirectMulti | Optuna:  31%|███       | 62/200 [1:25:40<4:07:19, 107.53s/it, best=0.865][I 2026-03-05 01:20:07,693] Trial 62 finished with value: 0.9315637099268187 and parameters: {'activation': 'tanh', 'solver': 'adam', 'lr': 5.2587126462516386e-05, 'layer1': 106, 'layer2': 136, 'layer3': 426}. Best is trial 55 with value: 0.9322110061695005.
Klebsiella_Pneumoniae | DirectMulti | Optuna:  32%|███▏      | 63/200 [1:18:39<3:49:40, 100.59s/it, best=0.932]Klebsiella_Pneumoniae | DirectMulti | Optuna:  32%|███▏      | 63/200 [1:18:39<3:49:40, 100.59s/it, best=0.932][I 2026-03-05 01:20:15,907] Trial 23 finished with value: 0.8903231169197164 and parameters: {'activation': 'relu', 'solver': 'adam', 'lr': 0.00010866303844729671, 'layer1': 146, 'layer2': 168, 'layer3': 114}. Best is trial 11 with value: 0.8911580213645447.
Staphylococcus_Aureus | DirectMulti | Optuna:  12%|█▏        | 24/200 [45:33<6:56:49, 142.10s/it, best=0.891]Staphylococcus_Aureus | DirectMulti | Optuna:  12%|█▏        | 24/200 [45:33<6:56:49, 142.10s/it, best=0.891][I 2026-03-05 01:21:26,775] Trial 24 finished with value: 0.8898450693292105 and parameters: {'activation': 'relu', 'solver': 'adam', 'lr': 0.0002631417825365252, 'layer1': 85, 'layer2': 194, 'layer3': 184}. Best is trial 11 with value: 0.8911580213645447.
Staphylococcus_Aureus | DirectMulti | Optuna:  12%|█▎        | 25/200 [46:44<5:52:07, 120.73s/it, best=0.891]Staphylococcus_Aureus | DirectMulti | Optuna:  12%|█▎        | 25/200 [46:44<5:52:07, 120.73s/it, best=0.891][I 2026-03-05 01:21:49,190] Trial 62 finished with value: 0.862117139078976 and parameters: {'activation': 'relu', 'solver': 'adam', 'lr': 0.005280780287943275, 'layer1': 447, 'layer2': 267, 'layer3': 451}. Best is trial 23 with value: 0.8649994822247168.
Pseudomonas_Aeruginosa | DirectMulti | Optuna:  32%|███▏      | 63/200 [1:27:43<4:16:15, 112.23s/it, best=0.865]Pseudomonas_Aeruginosa | DirectMulti | Optuna:  32%|███▏      | 63/200 [1:27:43<4:16:15, 112.23s/it, best=0.865][I 2026-03-05 01:21:55,127] Trial 104 finished with value: 0.8616492440116478 and parameters: {'activation': 'tanh', 'solver': 'adam', 'lr': 4.1497859167759296e-05, 'layer1': 500, 'layer2': 75, 'layer3': 412}. Best is trial 73 with value: 0.864893646817533.
Escherichia_Coli | LPS | Optuna:  52%|█████▎    | 105/200 [5:23:37<5:27:02, 206.55s/it, best=0.865]Escherichia_Coli | LPS | Optuna:  52%|█████▎    | 105/200 [5:23:37<5:27:02, 206.55s/it, best=0.865][I 2026-03-05 01:22:24,631] Trial 63 finished with value: 0.9313543699660493 and parameters: {'activation': 'tanh', 'solver': 'adam', 'lr': 5.36675497804631e-05, 'layer1': 440, 'layer2': 134, 'layer3': 422}. Best is trial 55 with value: 0.9322110061695005.
Klebsiella_Pneumoniae | DirectMulti | Optuna:  32%|███▏      | 64/200 [1:20:56<4:12:43, 111.49s/it, best=0.932]Klebsiella_Pneumoniae | DirectMulti | Optuna:  32%|███▏      | 64/200 [1:20:56<4:12:43, 111.49s/it, best=0.932][I 2026-03-05 01:22:42,206] Trial 25 finished with value: 0.8029047283983768 and parameters: {'activation': 'relu', 'solver': 'adam', 'lr': 7.297247216820816e-06, 'layer1': 307, 'layer2': 67, 'layer3': 287}. Best is trial 11 with value: 0.8911580213645447.
Staphylococcus_Aureus | DirectMulti | Optuna:  13%|█▎        | 26/200 [47:59<5:10:41, 107.14s/it, best=0.891]Staphylococcus_Aureus | DirectMulti | Optuna:  13%|█▎        | 26/200 [47:59<5:10:41, 107.14s/it, best=0.891][I 2026-03-05 01:23:32,539] Trial 26 finished with value: 0.8024651706908094 and parameters: {'activation': 'logistic', 'solver': 'sgd', 'lr': 8.447834159607868e-05, 'layer1': 175, 'layer2': 111, 'layer3': 399}. Best is trial 11 with value: 0.8911580213645447.
Staphylococcus_Aureus | DirectMulti | Optuna:  14%|█▎        | 27/200 [48:50<4:19:46, 90.09s/it, best=0.891] Staphylococcus_Aureus | DirectMulti | Optuna:  14%|█▎        | 27/200 [48:50<4:19:46, 90.09s/it, best=0.891][I 2026-03-05 01:23:52,971] Trial 63 finished with value: 0.8601852953652829 and parameters: {'activation': 'relu', 'solver': 'adam', 'lr': 0.005133701898140125, 'layer1': 442, 'layer2': 282, 'layer3': 468}. Best is trial 23 with value: 0.8649994822247168.
Pseudomonas_Aeruginosa | DirectMulti | Optuna:  32%|███▏      | 64/200 [1:29:47<4:22:14, 115.70s/it, best=0.865]Pseudomonas_Aeruginosa | DirectMulti | Optuna:  32%|███▏      | 64/200 [1:29:47<4:22:14, 115.70s/it, best=0.865][I 2026-03-05 01:24:37,610] Trial 27 finished with value: 0.88821994128533 and parameters: {'activation': 'identity', 'solver': 'adam', 'lr': 0.0016198580055141222, 'layer1': 119, 'layer2': 258, 'layer3': 75}. Best is trial 11 with value: 0.8911580213645447.
Staphylococcus_Aureus | DirectMulti | Optuna:  14%|█▍        | 28/200 [49:55<3:56:45, 82.59s/it, best=0.891]Staphylococcus_Aureus | DirectMulti | Optuna:  14%|█▍        | 28/200 [49:55<3:56:45, 82.59s/it, best=0.891][I 2026-03-05 01:24:37,992] Trial 64 finished with value: 0.9307982806797132 and parameters: {'activation': 'tanh', 'solver': 'adam', 'lr': 5.5413287775172296e-05, 'layer1': 428, 'layer2': 139, 'layer3': 425}. Best is trial 55 with value: 0.9322110061695005.
Klebsiella_Pneumoniae | DirectMulti | Optuna:  32%|███▎      | 65/200 [1:23:10<4:25:37, 118.05s/it, best=0.932]Klebsiella_Pneumoniae | DirectMulti | Optuna:  32%|███▎      | 65/200 [1:23:10<4:25:37, 118.05s/it, best=0.932][I 2026-03-05 01:25:21,959] Trial 105 finished with value: 0.8630519731439026 and parameters: {'activation': 'tanh', 'solver': 'adam', 'lr': 2.9199152775408538e-05, 'layer1': 355, 'layer2': 57, 'layer3': 371}. Best is trial 73 with value: 0.864893646817533.
Escherichia_Coli | LPS | Optuna:  53%|█████▎    | 106/200 [5:27:04<5:23:43, 206.64s/it, best=0.865]Escherichia_Coli | LPS | Optuna:  53%|█████▎    | 106/200 [5:27:04<5:23:43, 206.64s/it, best=0.865][I 2026-03-05 01:25:57,976] Trial 64 finished with value: 0.8596642708158283 and parameters: {'activation': 'relu', 'solver': 'adam', 'lr': 0.008122619030447168, 'layer1': 481, 'layer2': 230, 'layer3': 439}. Best is trial 23 with value: 0.8649994822247168.
Pseudomonas_Aeruginosa | DirectMulti | Optuna:  32%|███▎      | 65/200 [1:31:52<4:26:36, 118.49s/it, best=0.865]Pseudomonas_Aeruginosa | DirectMulti | Optuna:  32%|███▎      | 65/200 [1:31:52<4:26:36, 118.49s/it, best=0.865][I 2026-03-05 01:26:29,113] Trial 65 finished with value: 0.9313237090664576 and parameters: {'activation': 'tanh', 'solver': 'adam', 'lr': 2.588482867728915e-05, 'layer1': 122, 'layer2': 176, 'layer3': 415}. Best is trial 55 with value: 0.9322110061695005.
Klebsiella_Pneumoniae | DirectMulti | Optuna:  33%|███▎      | 66/200 [1:25:01<4:19:00, 115.97s/it, best=0.932]Klebsiella_Pneumoniae | DirectMulti | Optuna:  33%|███▎      | 66/200 [1:25:01<4:19:00, 115.97s/it, best=0.932][I 2026-03-05 01:27:02,126] Trial 106 finished with value: 0.7401209519194917 and parameters: {'activation': 'tanh', 'solver': 'adam', 'lr': 1.2785551116654102e-05, 'layer1': 396, 'layer2': 11, 'layer3': 319}. Best is trial 73 with value: 0.864893646817533.
Escherichia_Coli | LPS | Optuna:  54%|█████▎    | 107/200 [5:28:44<4:30:46, 174.69s/it, best=0.865]Escherichia_Coli | LPS | Optuna:  54%|█████▎    | 107/200 [5:28:44<4:30:46, 174.69s/it, best=0.865][I 2026-03-05 01:27:13,823] Trial 28 finished with value: 0.8903246114150246 and parameters: {'activation': 'tanh', 'solver': 'adam', 'lr': 2.328096224039698e-05, 'layer1': 69, 'layer2': 144, 'layer3': 233}. Best is trial 11 with value: 0.8911580213645447.
Staphylococcus_Aureus | DirectMulti | Optuna:  14%|█▍        | 29/200 [52:31<4:58:19, 104.68s/it, best=0.891]Staphylococcus_Aureus | DirectMulti | Optuna:  14%|█▍        | 29/200 [52:31<4:58:19, 104.68s/it, best=0.891][I 2026-03-05 01:28:08,574] Trial 65 finished with value: 0.8619494866680052 and parameters: {'activation': 'relu', 'solver': 'adam', 'lr': 0.003722870380482994, 'layer1': 498, 'layer2': 263, 'layer3': 500}. Best is trial 23 with value: 0.8649994822247168.
Pseudomonas_Aeruginosa | DirectMulti | Optuna:  33%|███▎      | 66/200 [1:34:02<4:32:44, 122.12s/it, best=0.865]Pseudomonas_Aeruginosa | DirectMulti | Optuna:  33%|███▎      | 66/200 [1:34:02<4:32:44, 122.12s/it, best=0.865][I 2026-03-05 01:28:17,041] Trial 29 finished with value: 0.4434462516578795 and parameters: {'activation': 'logistic', 'solver': 'sgd', 'lr': 8.88270139390585e-06, 'layer1': 226, 'layer2': 324, 'layer3': 135}. Best is trial 11 with value: 0.8911580213645447.
Staphylococcus_Aureus | DirectMulti | Optuna:  15%|█▌        | 30/200 [53:34<4:21:20, 92.24s/it, best=0.891] Staphylococcus_Aureus | DirectMulti | Optuna:  15%|█▌        | 30/200 [53:34<4:21:20, 92.24s/it, best=0.891][I 2026-03-05 01:29:21,388] Trial 30 finished with value: 0.8888502003665291 and parameters: {'activation': 'relu', 'solver': 'adam', 'lr': 0.00042674990888223947, 'layer1': 13, 'layer2': 207, 'layer3': 321}. Best is trial 11 with value: 0.8911580213645447.
Staphylococcus_Aureus | DirectMulti | Optuna:  16%|█▌        | 31/200 [54:39<3:56:14, 83.87s/it, best=0.891]Staphylococcus_Aureus | DirectMulti | Optuna:  16%|█▌        | 31/200 [54:39<3:56:14, 83.87s/it, best=0.891][I 2026-03-05 01:29:48,929] Trial 66 finished with value: 0.8598194931726164 and parameters: {'activation': 'relu', 'solver': 'adam', 'lr': 0.0030284649597533283, 'layer1': 409, 'layer2': 266, 'layer3': 456}. Best is trial 23 with value: 0.8649994822247168.
