Staphylococcus_Aureus | DirectMulti | Optuna:   4%|▍         | 8/200 [14:26<5:00:53, 94.03s/it, best=0.888] Staphylococcus_Aureus | DirectMulti | Optuna:   4%|▍         | 8/200 [14:26<5:00:53, 94.03s/it, best=0.889][I 2026-03-05 00:49:14,838] Trial 36 finished with value: 0.9295717373684085 and parameters: {'activation': 'tanh', 'solver': 'adam', 'lr': 3.076064002538331e-05, 'layer1': 60, 'layer2': 250, 'layer3': 309}. Best is trial 27 with value: 0.9312172203080404.
Klebsiella_Pneumoniae | DirectMulti | Optuna:  18%|█▊        | 37/200 [47:46<3:42:57, 82.07s/it, best=0.931]Klebsiella_Pneumoniae | DirectMulti | Optuna:  18%|█▊        | 37/200 [47:46<3:42:57, 82.07s/it, best=0.931][I 2026-03-05 00:49:48,057] Trial 40 finished with value: 0.8261898244308833 and parameters: {'activation': 'tanh', 'solver': 'adam', 'lr': 0.006527445319190357, 'layer1': 345, 'layer2': 12, 'layer3': 227}. Best is trial 23 with value: 0.8649994822247168.
Pseudomonas_Aeruginosa | DirectMulti | Optuna:  20%|██        | 41/200 [55:42<3:15:13, 73.67s/it, best=0.865]Pseudomonas_Aeruginosa | DirectMulti | Optuna:  20%|██        | 41/200 [55:42<3:15:13, 73.67s/it, best=0.865][I 2026-03-05 00:50:00,481] Trial 37 finished with value: 0.8750654239869105 and parameters: {'activation': 'tanh', 'solver': 'adam', 'lr': 1.1606728240544538e-05, 'layer1': 148, 'layer2': 70, 'layer3': 476}. Best is trial 27 with value: 0.9312172203080404.
Klebsiella_Pneumoniae | DirectMulti | Optuna:  19%|█▉        | 38/200 [48:32<3:12:05, 71.14s/it, best=0.931]Klebsiella_Pneumoniae | DirectMulti | Optuna:  19%|█▉        | 38/200 [48:32<3:12:05, 71.14s/it, best=0.931][I 2026-03-05 00:50:31,844] Trial 38 finished with value: 0.7911947756188089 and parameters: {'activation': 'logistic', 'solver': 'sgd', 'lr': 2.4793542727960973e-05, 'layer1': 12, 'layer2': 421, 'layer3': 248}. Best is trial 27 with value: 0.9312172203080404.
Klebsiella_Pneumoniae | DirectMulti | Optuna:  20%|█▉        | 39/200 [49:03<2:38:52, 59.21s/it, best=0.931]Klebsiella_Pneumoniae | DirectMulti | Optuna:  20%|█▉        | 39/200 [49:03<2:38:52, 59.21s/it, best=0.931][I 2026-03-05 00:50:33,422] Trial 41 finished with value: 0.8268741404885868 and parameters: {'activation': 'relu', 'solver': 'adam', 'lr': 1.1070759889398544e-05, 'layer1': 235, 'layer2': 342, 'layer3': 90}. Best is trial 23 with value: 0.8649994822247168.
Pseudomonas_Aeruginosa | DirectMulti | Optuna:  21%|██        | 42/200 [56:27<2:51:38, 65.18s/it, best=0.865]Pseudomonas_Aeruginosa | DirectMulti | Optuna:  21%|██        | 42/200 [56:27<2:51:38, 65.18s/it, best=0.865][I 2026-03-05 00:50:34,524] Trial 8 finished with value: 0.8881561582820641 and parameters: {'activation': 'identity', 'solver': 'adam', 'lr': 0.000828752236376816, 'layer1': 323, 'layer2': 445, 'layer3': 241}. Best is trial 7 with value: 0.8886176672771867.
Staphylococcus_Aureus | DirectMulti | Optuna:   4%|▍         | 9/200 [15:52<4:51:03, 91.43s/it, best=0.889]Staphylococcus_Aureus | DirectMulti | Optuna:   4%|▍         | 9/200 [15:52<4:51:03, 91.43s/it, best=0.889][I 2026-03-05 00:51:18,369] Trial 39 finished with value: 0.8756473466094074 and parameters: {'activation': 'tanh', 'solver': 'adam', 'lr': 1.120562692401504e-06, 'layer1': 106, 'layer2': 205, 'layer3': 455}. Best is trial 27 with value: 0.9312172203080404.
Klebsiella_Pneumoniae | DirectMulti | Optuna:  20%|██        | 40/200 [49:50<2:27:44, 55.40s/it, best=0.931]Klebsiella_Pneumoniae | DirectMulti | Optuna:  20%|██        | 40/200 [49:50<2:27:44, 55.40s/it, best=0.931][I 2026-03-05 00:51:50,779] Trial 95 finished with value: 0.8632131688006266 and parameters: {'activation': 'tanh', 'solver': 'adam', 'lr': 6.741141988868796e-05, 'layer1': 500, 'layer2': 41, 'layer3': 376}. Best is trial 73 with value: 0.864893646817533.
Escherichia_Coli | LPS | Optuna:  48%|████▊     | 96/200 [4:53:32<6:46:40, 234.62s/it, best=0.865]Escherichia_Coli | LPS | Optuna:  48%|████▊     | 96/200 [4:53:32<6:46:40, 234.62s/it, best=0.865][I 2026-03-05 00:51:53,879] Trial 40 finished with value: 0.8748553761815842 and parameters: {'activation': 'tanh', 'solver': 'adam', 'lr': 4.1637326715481464e-06, 'layer1': 37, 'layer2': 286, 'layer3': 308}. Best is trial 27 with value: 0.9312172203080404.
Klebsiella_Pneumoniae | DirectMulti | Optuna:  20%|██        | 41/200 [50:26<2:11:00, 49.44s/it, best=0.931]Klebsiella_Pneumoniae | DirectMulti | Optuna:  20%|██        | 41/200 [50:26<2:11:00, 49.44s/it, best=0.931][I 2026-03-05 00:52:20,421] Trial 9 finished with value: 0.8035348396364366 and parameters: {'activation': 'tanh', 'solver': 'sgd', 'lr': 0.00012329098365270507, 'layer1': 219, 'layer2': 22, 'layer3': 62}. Best is trial 7 with value: 0.8886176672771867.
Staphylococcus_Aureus | DirectMulti | Optuna:   5%|▌         | 10/200 [17:38<5:03:40, 95.90s/it, best=0.889]Staphylococcus_Aureus | DirectMulti | Optuna:   5%|▌         | 10/200 [17:38<5:03:40, 95.90s/it, best=0.889][I 2026-03-05 00:52:47,218] Trial 10 finished with value: 0.8016455484651599 and parameters: {'activation': 'relu', 'solver': 'sgd', 'lr': 0.007553503645583194, 'layer1': 18, 'layer2': 151, 'layer3': 348}. Best is trial 7 with value: 0.8886176672771867.
Staphylococcus_Aureus | DirectMulti | Optuna:   6%|▌         | 11/200 [18:04<3:55:27, 74.75s/it, best=0.889]Staphylococcus_Aureus | DirectMulti | Optuna:   6%|▌         | 11/200 [18:04<3:55:27, 74.75s/it, best=0.889][I 2026-03-05 00:53:07,384] Trial 41 finished with value: 0.9309208594685454 and parameters: {'activation': 'tanh', 'solver': 'adam', 'lr': 7.717928253970299e-05, 'layer1': 70, 'layer2': 458, 'layer3': 385}. Best is trial 27 with value: 0.9312172203080404.
Klebsiella_Pneumoniae | DirectMulti | Optuna:  21%|██        | 42/200 [51:39<2:29:11, 56.66s/it, best=0.931]Klebsiella_Pneumoniae | DirectMulti | Optuna:  21%|██        | 42/200 [51:39<2:29:11, 56.66s/it, best=0.931][I 2026-03-05 00:53:20,268] Trial 42 finished with value: 0.8586977191823945 and parameters: {'activation': 'relu', 'solver': 'adam', 'lr': 6.890999451920824e-05, 'layer1': 301, 'layer2': 325, 'layer3': 11}. Best is trial 23 with value: 0.8649994822247168.
Pseudomonas_Aeruginosa | DirectMulti | Optuna:  22%|██▏       | 43/200 [59:14<4:10:21, 95.68s/it, best=0.865]Pseudomonas_Aeruginosa | DirectMulti | Optuna:  22%|██▏       | 43/200 [59:14<4:10:21, 95.68s/it, best=0.865][I 2026-03-05 00:54:21,338] Trial 11 finished with value: 0.8911580213645447 and parameters: {'activation': 'relu', 'solver': 'adam', 'lr': 0.000202128655675791, 'layer1': 168, 'layer2': 188, 'layer3': 94}. Best is trial 11 with value: 0.8911580213645447.
Staphylococcus_Aureus | DirectMulti | Optuna:   6%|▌         | 12/200 [19:38<4:12:40, 80.64s/it, best=0.889]Staphylococcus_Aureus | DirectMulti | Optuna:   6%|▌         | 12/200 [19:38<4:12:40, 80.64s/it, best=0.891][I 2026-03-05 00:54:26,311] Trial 42 finished with value: 0.9308898266222402 and parameters: {'activation': 'tanh', 'solver': 'adam', 'lr': 7.013165398218812e-05, 'layer1': 65, 'layer2': 497, 'layer3': 413}. Best is trial 27 with value: 0.9312172203080404.
Klebsiella_Pneumoniae | DirectMulti | Optuna:  22%|██▏       | 43/200 [52:58<2:45:44, 63.34s/it, best=0.931]Klebsiella_Pneumoniae | DirectMulti | Optuna:  22%|██▏       | 43/200 [52:58<2:45:44, 63.34s/it, best=0.931][I 2026-03-05 00:55:24,440] Trial 43 finished with value: 0.8602474697302094 and parameters: {'activation': 'identity', 'solver': 'adam', 'lr': 3.0127282995060316e-05, 'layer1': 398, 'layer2': 378, 'layer3': 103}. Best is trial 23 with value: 0.8649994822247168.
Pseudomonas_Aeruginosa | DirectMulti | Optuna:  22%|██▏       | 44/200 [1:01:18<4:30:59, 104.23s/it, best=0.865]Pseudomonas_Aeruginosa | DirectMulti | Optuna:  22%|██▏       | 44/200 [1:01:18<4:30:59, 104.23s/it, best=0.865][I 2026-03-05 00:55:40,568] Trial 43 finished with value: 0.9309056093969016 and parameters: {'activation': 'tanh', 'solver': 'adam', 'lr': 6.206884148692748e-05, 'layer1': 61, 'layer2': 496, 'layer3': 400}. Best is trial 27 with value: 0.9312172203080404.
Klebsiella_Pneumoniae | DirectMulti | Optuna:  22%|██▏       | 44/200 [54:12<2:53:11, 66.61s/it, best=0.931]Klebsiella_Pneumoniae | DirectMulti | Optuna:  22%|██▏       | 44/200 [54:12<2:53:11, 66.61s/it, best=0.931][I 2026-03-05 00:55:46,356] Trial 12 finished with value: 0.8890009673455135 and parameters: {'activation': 'relu', 'solver': 'adam', 'lr': 0.000503655334822898, 'layer1': 137, 'layer2': 183, 'layer3': 14}. Best is trial 11 with value: 0.8911580213645447.
Staphylococcus_Aureus | DirectMulti | Optuna:   6%|▋         | 13/200 [21:03<4:15:27, 81.97s/it, best=0.891]Staphylococcus_Aureus | DirectMulti | Optuna:   6%|▋         | 13/200 [21:03<4:15:27, 81.97s/it, best=0.891][I 2026-03-05 00:55:59,466] Trial 96 finished with value: 0.8630806125894359 and parameters: {'activation': 'tanh', 'solver': 'adam', 'lr': 2.2671335164441804e-05, 'layer1': 496, 'layer2': 45, 'layer3': 378}. Best is trial 73 with value: 0.864893646817533.
Escherichia_Coli | LPS | Optuna:  48%|████▊     | 97/200 [4:57:41<6:50:00, 238.84s/it, best=0.865]Escherichia_Coli | LPS | Optuna:  48%|████▊     | 97/200 [4:57:41<6:50:00, 238.84s/it, best=0.865][I 2026-03-05 00:56:44,849] Trial 44 finished with value: 0.9303499667871543 and parameters: {'activation': 'tanh', 'solver': 'adam', 'lr': 7.289289551302347e-05, 'layer1': 108, 'layer2': 499, 'layer3': 444}. Best is trial 27 with value: 0.9312172203080404.
Klebsiella_Pneumoniae | DirectMulti | Optuna:  22%|██▎       | 45/200 [55:16<2:50:16, 65.91s/it, best=0.931]Klebsiella_Pneumoniae | DirectMulti | Optuna:  22%|██▎       | 45/200 [55:16<2:50:16, 65.91s/it, best=0.931][I 2026-03-05 00:56:54,773] Trial 44 finished with value: 0.859805132826142 and parameters: {'activation': 'relu', 'solver': 'adam', 'lr': 6.262454433502737e-05, 'layer1': 180, 'layer2': 141, 'layer3': 185}. Best is trial 23 with value: 0.8649994822247168.
Pseudomonas_Aeruginosa | DirectMulti | Optuna:  22%|██▎       | 45/200 [1:02:48<4:18:29, 100.06s/it, best=0.865]Pseudomonas_Aeruginosa | DirectMulti | Optuna:  22%|██▎       | 45/200 [1:02:48<4:18:29, 100.06s/it, best=0.865][I 2026-03-05 00:57:19,427] Trial 13 finished with value: 0.8899268556090403 and parameters: {'activation': 'relu', 'solver': 'adam', 'lr': 0.00018070468692286747, 'layer1': 167, 'layer2': 127, 'layer3': 144}. Best is trial 11 with value: 0.8911580213645447.
Staphylococcus_Aureus | DirectMulti | Optuna:   7%|▋         | 14/200 [22:37<4:24:29, 85.32s/it, best=0.891]Staphylococcus_Aureus | DirectMulti | Optuna:   7%|▋         | 14/200 [22:37<4:24:29, 85.32s/it, best=0.891][I 2026-03-05 00:57:39,964] Trial 45 finished with value: 0.826631727610288 and parameters: {'activation': 'relu', 'solver': 'adam', 'lr': 1.1976175136469665e-05, 'layer1': 270, 'layer2': 263, 'layer3': 77}. Best is trial 23 with value: 0.8649994822247168.
Pseudomonas_Aeruginosa | DirectMulti | Optuna:  23%|██▎       | 46/200 [1:03:34<3:34:34, 83.60s/it, best=0.865] Pseudomonas_Aeruginosa | DirectMulti | Optuna:  23%|██▎       | 46/200 [1:03:34<3:34:34, 83.60s/it, best=0.865][I 2026-03-05 00:58:02,958] Trial 45 finished with value: 0.9319055344000778 and parameters: {'activation': 'tanh', 'solver': 'adam', 'lr': 6.666443159747969e-05, 'layer1': 67, 'layer2': 484, 'layer3': 380}. Best is trial 45 with value: 0.9319055344000778.
Klebsiella_Pneumoniae | DirectMulti | Optuna:  23%|██▎       | 46/200 [56:35<2:58:34, 69.57s/it, best=0.931]Klebsiella_Pneumoniae | DirectMulti | Optuna:  23%|██▎       | 46/200 [56:35<2:58:34, 69.57s/it, best=0.932][I 2026-03-05 00:58:12,819] Trial 46 finished with value: 0.8262408648699131 and parameters: {'activation': 'relu', 'solver': 'adam', 'lr': 4.9780058081786565e-06, 'layer1': 64, 'layer2': 211, 'layer3': 52}. Best is trial 23 with value: 0.8649994822247168.
Pseudomonas_Aeruginosa | DirectMulti | Optuna:  24%|██▎       | 47/200 [1:04:06<2:54:21, 68.38s/it, best=0.865]Pseudomonas_Aeruginosa | DirectMulti | Optuna:  24%|██▎       | 47/200 [1:04:06<2:54:21, 68.38s/it, best=0.865][I 2026-03-05 00:58:27,617] Trial 97 finished with value: 0.8630847531438036 and parameters: {'activation': 'tanh', 'solver': 'adam', 'lr': 7.174546115797812e-05, 'layer1': 451, 'layer2': 37, 'layer3': 335}. Best is trial 73 with value: 0.864893646817533.
Escherichia_Coli | LPS | Optuna:  49%|████▉     | 98/200 [5:00:09<5:59:46, 211.63s/it, best=0.865]Escherichia_Coli | LPS | Optuna:  49%|████▉     | 98/200 [5:00:09<5:59:46, 211.63s/it, best=0.865][I 2026-03-05 00:58:39,311] Trial 46 finished with value: 0.8746470562584285 and parameters: {'activation': 'tanh', 'solver': 'adam', 'lr': 1.4844553547681908e-05, 'layer1': 64, 'layer2': 488, 'layer3': 374}. Best is trial 45 with value: 0.9319055344000778.
Klebsiella_Pneumoniae | DirectMulti | Optuna:  24%|██▎       | 47/200 [57:11<2:31:59, 59.61s/it, best=0.932]Klebsiella_Pneumoniae | DirectMulti | Optuna:  24%|██▎       | 47/200 [57:11<2:31:59, 59.61s/it, best=0.932][I 2026-03-05 00:59:18,754] Trial 47 finished with value: 0.8305313241533699 and parameters: {'activation': 'identity', 'solver': 'sgd', 'lr': 0.00019982902240850027, 'layer1': 473, 'layer2': 297, 'layer3': 128}. Best is trial 23 with value: 0.8649994822247168.
Pseudomonas_Aeruginosa | DirectMulti | Optuna:  24%|██▍       | 48/200 [1:05:12<2:51:21, 67.64s/it, best=0.865]Pseudomonas_Aeruginosa | DirectMulti | Optuna:  24%|██▍       | 48/200 [1:05:12<2:51:21, 67.64s/it, best=0.865][I 2026-03-05 00:59:24,024] Trial 47 finished with value: 0.8403469691349648 and parameters: {'activation': 'logistic', 'solver': 'sgd', 'lr': 5.177889543936103e-05, 'layer1': 31, 'layer2': 446, 'layer3': 429}. Best is trial 45 with value: 0.9319055344000778.
Klebsiella_Pneumoniae | DirectMulti | Optuna:  24%|██▍       | 48/200 [57:56<2:19:41, 55.14s/it, best=0.932]Klebsiella_Pneumoniae | DirectMulti | Optuna:  24%|██▍       | 48/200 [57:56<2:19:41, 55.14s/it, best=0.932][I 2026-03-05 00:59:29,858] Trial 14 finished with value: 0.8904546606411928 and parameters: {'activation': 'relu', 'solver': 'adam', 'lr': 0.00011695139073230126, 'layer1': 178, 'layer2': 117, 'layer3': 152}. Best is trial 11 with value: 0.8911580213645447.
Staphylococcus_Aureus | DirectMulti | Optuna:   8%|▊         | 15/200 [24:47<5:04:59, 98.92s/it, best=0.891]Staphylococcus_Aureus | DirectMulti | Optuna:   8%|▊         | 15/200 [24:47<5:04:59, 98.92s/it, best=0.891][I 2026-03-05 01:00:01,905] Trial 48 finished with value: 0.8269172664513812 and parameters: {'activation': 'relu', 'solver': 'adam', 'lr': 2.5215374020991128e-05, 'layer1': 288, 'layer2': 172, 'layer3': 227}. Best is trial 23 with value: 0.8649994822247168.
Pseudomonas_Aeruginosa | DirectMulti | Optuna:  24%|██▍       | 49/200 [1:05:55<2:31:44, 60.30s/it, best=0.865]Pseudomonas_Aeruginosa | DirectMulti | Optuna:  24%|██▍       | 49/200 [1:05:55<2:31:44, 60.30s/it, best=0.865][I 2026-03-05 01:00:27,311] Trial 48 finished with value: 0.928553694600329 and parameters: {'activation': 'identity', 'solver': 'adam', 'lr': 0.00014274346688480553, 'layer1': 158, 'layer2': 482, 'layer3': 391}. Best is trial 45 with value: 0.9319055344000778.
Klebsiella_Pneumoniae | DirectMulti | Optuna:  24%|██▍       | 49/200 [58:59<2:24:55, 57.58s/it, best=0.932]Klebsiella_Pneumoniae | DirectMulti | Optuna:  24%|██▍       | 49/200 [58:59<2:24:55, 57.58s/it, best=0.932][I 2026-03-05 01:01:04,360] Trial 49 finished with value: 0.8596994812486567 and parameters: {'activation': 'relu', 'solver': 'adam', 'lr': 0.0012950276776222992, 'layer1': 348, 'layer2': 92, 'layer3': 303}. Best is trial 23 with value: 0.8649994822247168.
Pseudomonas_Aeruginosa | DirectMulti | Optuna:  25%|██▌       | 50/200 [1:06:58<2:32:21, 60.94s/it, best=0.865]Pseudomonas_Aeruginosa | DirectMulti | Optuna:  25%|██▌       | 50/200 [1:06:58<2:32:21, 60.94s/it, best=0.865][I 2026-03-05 01:01:25,223] Trial 49 finished with value: 0.930752471333818 and parameters: {'activation': 'tanh', 'solver': 'adam', 'lr': 0.00020333852436576577, 'layer1': 128, 'layer2': 411, 'layer3': 500}. Best is trial 45 with value: 0.9319055344000778.
Klebsiella_Pneumoniae | DirectMulti | Optuna:  25%|██▌       | 50/200 [59:57<2:24:12, 57.68s/it, best=0.932]Klebsiella_Pneumoniae | DirectMulti | Optuna:  25%|██▌       | 50/200 [59:57<2:24:12, 57.68s/it, best=0.932][I 2026-03-05 01:01:55,066] Trial 50 finished with value: 0.83617575638792 and parameters: {'activation': 'tanh', 'solver': 'adam', 'lr': 0.006149851434832837, 'layer1': 144, 'layer2': 52, 'layer3': 161}. Best is trial 23 with value: 0.8649994822247168.
Pseudomonas_Aeruginosa | DirectMulti | Optuna:  26%|██▌       | 51/200 [1:07:49<2:23:42, 57.87s/it, best=0.865]Pseudomonas_Aeruginosa | DirectMulti | Optuna:  26%|██▌       | 51/200 [1:07:49<2:23:42, 57.87s/it, best=0.865][I 2026-03-05 01:02:01,238] Trial 15 finished with value: 0.8900665675653399 and parameters: {'activation': 'relu', 'solver': 'adam', 'lr': 6.230610655836955e-05, 'layer1': 183, 'layer2': 98, 'layer3': 326}. Best is trial 11 with value: 0.8911580213645447.
Staphylococcus_Aureus | DirectMulti | Optuna:   8%|▊         | 16/200 [27:18<5:51:46, 114.71s/it, best=0.891]Staphylococcus_Aureus | DirectMulti | Optuna:   8%|▊         | 16/200 [27:18<5:51:46, 114.71s/it, best=0.891][I 2026-03-05 01:02:02,170] Trial 98 finished with value: 0.8632602654458645 and parameters: {'activation': 'tanh', 'solver': 'adam', 'lr': 3.170578616179509e-05, 'layer1': 397, 'layer2': 24, 'layer3': 402}. Best is trial 73 with value: 0.864893646817533.
Escherichia_Coli | LPS | Optuna:  50%|████▉     | 99/200 [5:03:44<5:57:43, 212.51s/it, best=0.865]Escherichia_Coli | LPS | Optuna:  50%|████▉     | 99/200 [5:03:44<5:57:43, 212.51s/it, best=0.865][I 2026-03-05 01:02:11,893] Trial 50 finished with value: 0.9276589900967906 and parameters: {'activation': 'tanh', 'solver': 'adam', 'lr': 0.00031567582674911455, 'layer1': 65, 'layer2': 445, 'layer3': 329}. Best is trial 45 with value: 0.9319055344000778.
Klebsiella_Pneumoniae | DirectMulti | Optuna:  26%|██▌       | 51/200 [1:00:44<2:15:02, 54.38s/it, best=0.932]Klebsiella_Pneumoniae | DirectMulti | Optuna:  26%|██▌       | 51/200 [1:00:44<2:15:02, 54.38s/it, best=0.932][I 2026-03-05 01:02:24,604] Trial 51 finished with value: 0.8543084803443632 and parameters: {'activation': 'relu', 'solver': 'adam', 'lr': 0.002040343113916561, 'layer1': 11, 'layer2': 193, 'layer3': 425}. Best is trial 23 with value: 0.8649994822247168.
Pseudomonas_Aeruginosa | DirectMulti | Optuna:  26%|██▌       | 52/200 [1:08:18<2:01:47, 49.37s/it, best=0.865]Pseudomonas_Aeruginosa | DirectMulti | Optuna:  26%|██▌       | 52/200 [1:08:18<2:01:47, 49.37s/it, best=0.865][I 2026-03-05 01:03:12,775] Trial 51 finished with value: 0.9298200340352579 and parameters: {'activation': 'tanh', 'solver': 'adam', 'lr': 8.482341514688009e-05, 'layer1': 92, 'layer2': 481, 'layer3': 371}. Best is trial 45 with value: 0.9319055344000778.
Klebsiella_Pneumoniae | DirectMulti | Optuna:  26%|██▌       | 52/200 [1:01:44<2:18:56, 56.33s/it, best=0.932]Klebsiella_Pneumoniae | DirectMulti | Optuna:  26%|██▌       | 52/200 [1:01:44<2:18:56, 56.33s/it, best=0.932][I 2026-03-05 01:04:24,628] Trial 52 finished with value: 0.8635691207567062 and parameters: {'activation': 'relu', 'solver': 'adam', 'lr': 0.004825179700913605, 'layer1': 448, 'layer2': 151, 'layer3': 395}. Best is trial 23 with value: 0.8649994822247168.
Pseudomonas_Aeruginosa | DirectMulti | Optuna:  26%|██▋       | 53/200 [1:10:18<2:52:53, 70.57s/it, best=0.865]Pseudomonas_Aeruginosa | DirectMulti | Optuna:  26%|██▋       | 53/200 [1:10:18<2:52:53, 70.57s/it, best=0.865][I 2026-03-05 01:04:38,038] Trial 52 finished with value: 0.9314203554646122 and parameters: {'activation': 'tanh', 'solver': 'adam', 'lr': 4.4994489031916e-05, 'layer1': 43, 'layer2': 112, 'layer3': 422}. Best is trial 45 with value: 0.9319055344000778.
Klebsiella_Pneumoniae | DirectMulti | Optuna:  26%|██▋       | 53/200 [1:03:10<2:39:16, 65.01s/it, best=0.932]Klebsiella_Pneumoniae | DirectMulti | Optuna:  26%|██▋       | 53/200 [1:03:10<2:39:16, 65.01s/it, best=0.932][I 2026-03-05 01:05:18,042] Trial 16 finished with value: 0.8890137924455844 and parameters: {'activation': 'relu', 'solver': 'adam', 'lr': 0.0026989312998727416, 'layer1': 499, 'layer2': 391, 'layer3': 202}. Best is trial 11 with value: 0.8911580213645447.
Staphylococcus_Aureus | DirectMulti | Optuna:   8%|▊         | 17/200 [30:35<7:05:09, 139.40s/it, best=0.891]Staphylococcus_Aureus | DirectMulti | Optuna:   8%|▊         | 17/200 [30:35<7:05:09, 139.40s/it, best=0.891][I 2026-03-05 01:05:41,842] Trial 99 finished with value: 0.8635166566682357 and parameters: {'activation': 'tanh', 'solver': 'adam', 'lr': 2.9224610318737104e-05, 'layer1': 397, 'layer2': 23, 'layer3': 363}. Best is trial 73 with value: 0.864893646817533.
Escherichia_Coli | LPS | Optuna:  50%|█████     | 100/200 [5:07:23<5:57:45, 214.66s/it, best=0.865]Escherichia_Coli | LPS | Optuna:  50%|█████     | 100/200 [5:07:23<5:57:45, 214.66s/it, best=0.865][I 2026-03-05 01:06:05,502] Trial 53 finished with value: 0.8600138513307275 and parameters: {'activation': 'relu', 'solver': 'adam', 'lr': 0.00413821626951719, 'layer1': 442, 'layer2': 151, 'layer3': 392}. Best is trial 23 with value: 0.8649994822247168.
Pseudomonas_Aeruginosa | DirectMulti | Optuna:  27%|██▋       | 54/200 [1:11:59<3:13:50, 79.66s/it, best=0.865]Pseudomonas_Aeruginosa | DirectMulti | Optuna:  27%|██▋       | 54/200 [1:11:59<3:13:50, 79.66s/it, best=0.865][I 2026-03-05 01:06:11,774] Trial 53 finished with value: 0.9309515694374408 and parameters: {'activation': 'tanh', 'solver': 'adam', 'lr': 4.1120228137419525e-05, 'layer1': 38, 'layer2': 94, 'layer3': 464}. Best is trial 45 with value: 0.9319055344000778.
