Klebsiella_Pneumoniae | LPS | Optuna:  88%|████████▊ | 177/200 [3:33:43<28:34, 74.53s/it, best=0.933]Klebsiella_Pneumoniae | LPS | Optuna:  88%|████████▊ | 177/200 [3:33:43<28:34, 74.53s/it, best=0.933][I 2026-03-04 23:32:46,375] Trial 161 finished with value: 0.8920806194385863 and parameters: {'activation': 'identity', 'solver': 'adam', 'lr': 0.00035549918694332704, 'layer1': 246, 'layer2': 10, 'layer3': 126}. Best is trial 124 with value: 0.8938450095328893.
Staphylococcus_Aureus | LPS | Optuna:  81%|████████  | 162/200 [3:34:28<53:36, 84.63s/it, best=0.894]Staphylococcus_Aureus | LPS | Optuna:  81%|████████  | 162/200 [3:34:28<53:36, 84.63s/it, best=0.894][I 2026-03-04 23:33:22,774] Trial 185 finished with value: 0.8605794809794844 and parameters: {'activation': 'relu', 'solver': 'adam', 'lr': 0.00888922129793752, 'layer1': 408, 'layer2': 42, 'layer3': 430}. Best is trial 172 with value: 0.8682843857718467.
Pseudomonas_Aeruginosa | LPS | Optuna:  93%|█████████▎| 186/200 [3:35:04<26:22, 113.00s/it, best=0.868]Pseudomonas_Aeruginosa | LPS | Optuna:  93%|█████████▎| 186/200 [3:35:04<26:22, 113.00s/it, best=0.868][I 2026-03-04 23:33:40,281] Trial 177 finished with value: 0.9311927440615626 and parameters: {'activation': 'tanh', 'solver': 'adam', 'lr': 4.497021853467024e-05, 'layer1': 166, 'layer2': 292, 'layer3': 106}. Best is trial 175 with value: 0.9332398278164448.
Klebsiella_Pneumoniae | LPS | Optuna:  89%|████████▉ | 178/200 [3:35:22<30:01, 81.87s/it, best=0.933]Klebsiella_Pneumoniae | LPS | Optuna:  89%|████████▉ | 178/200 [3:35:22<30:01, 81.87s/it, best=0.933][I 2026-03-04 23:33:58,551] Trial 162 finished with value: 0.8920822472224936 and parameters: {'activation': 'identity', 'solver': 'adam', 'lr': 0.0006251379681026825, 'layer1': 224, 'layer2': 28, 'layer3': 134}. Best is trial 124 with value: 0.8938450095328893.
Staphylococcus_Aureus | LPS | Optuna:  82%|████████▏ | 163/200 [3:35:40<49:53, 80.90s/it, best=0.894]Staphylococcus_Aureus | LPS | Optuna:  82%|████████▏ | 163/200 [3:35:40<49:53, 80.90s/it, best=0.894][I 2026-03-04 23:34:44,000] Trial 186 finished with value: 0.8641169843189198 and parameters: {'activation': 'relu', 'solver': 'adam', 'lr': 0.004071004622763514, 'layer1': 416, 'layer2': 67, 'layer3': 457}. Best is trial 172 with value: 0.8682843857718467.
Pseudomonas_Aeruginosa | LPS | Optuna:  94%|█████████▎| 187/200 [3:36:26<22:25, 103.47s/it, best=0.868]Pseudomonas_Aeruginosa | LPS | Optuna:  94%|█████████▎| 187/200 [3:36:26<22:25, 103.47s/it, best=0.868][I 2026-03-04 23:34:49,709] Trial 76 finished with value: 0.8610662438375003 and parameters: {'activation': 'relu', 'solver': 'adam', 'lr': 0.00011810081234031535, 'layer1': 500, 'layer2': 45, 'layer3': 435}. Best is trial 73 with value: 0.864893646817533.
Escherichia_Coli | LPS | Optuna:  38%|███▊      | 77/200 [3:36:31<6:43:33, 196.86s/it, best=0.865]Escherichia_Coli | LPS | Optuna:  38%|███▊      | 77/200 [3:36:31<6:43:33, 196.86s/it, best=0.865][I 2026-03-04 23:35:09,773] Trial 178 finished with value: 0.9304068983558601 and parameters: {'activation': 'tanh', 'solver': 'adam', 'lr': 5.3898876106921634e-05, 'layer1': 139, 'layer2': 308, 'layer3': 116}. Best is trial 175 with value: 0.9332398278164448.
Klebsiella_Pneumoniae | LPS | Optuna:  90%|████████▉ | 179/200 [3:36:51<29:27, 84.15s/it, best=0.933]Klebsiella_Pneumoniae | LPS | Optuna:  90%|████████▉ | 179/200 [3:36:51<29:27, 84.15s/it, best=0.933][I 2026-03-04 23:35:24,794] Trial 163 finished with value: 0.8928595392984718 and parameters: {'activation': 'identity', 'solver': 'adam', 'lr': 0.0004137543277716234, 'layer1': 281, 'layer2': 10, 'layer3': 148}. Best is trial 124 with value: 0.8938450095328893.
Staphylococcus_Aureus | LPS | Optuna:  82%|████████▏ | 164/200 [3:37:06<49:30, 82.50s/it, best=0.894]Staphylococcus_Aureus | LPS | Optuna:  82%|████████▏ | 164/200 [3:37:06<49:30, 82.50s/it, best=0.894][I 2026-03-04 23:36:05,497] Trial 187 finished with value: 0.8621555375378233 and parameters: {'activation': 'relu', 'solver': 'adam', 'lr': 0.004176040898837087, 'layer1': 416, 'layer2': 64, 'layer3': 459}. Best is trial 172 with value: 0.8682843857718467.
Pseudomonas_Aeruginosa | LPS | Optuna:  94%|█████████▍| 188/200 [3:37:47<19:22, 96.88s/it, best=0.868] Pseudomonas_Aeruginosa | LPS | Optuna:  94%|█████████▍| 188/200 [3:37:47<19:22, 96.88s/it, best=0.868][I 2026-03-04 23:36:31,716] Trial 179 finished with value: 0.9317682294234043 and parameters: {'activation': 'tanh', 'solver': 'adam', 'lr': 5.900108466930258e-05, 'layer1': 132, 'layer2': 214, 'layer3': 123}. Best is trial 175 with value: 0.9332398278164448.
Klebsiella_Pneumoniae | LPS | Optuna:  90%|█████████ | 180/200 [3:38:13<27:49, 83.49s/it, best=0.933]Klebsiella_Pneumoniae | LPS | Optuna:  90%|█████████ | 180/200 [3:38:13<27:49, 83.49s/it, best=0.933][I 2026-03-04 23:36:51,155] Trial 164 finished with value: 0.8920915892623068 and parameters: {'activation': 'identity', 'solver': 'adam', 'lr': 0.00030202677322189244, 'layer1': 283, 'layer2': 20, 'layer3': 147}. Best is trial 124 with value: 0.8938450095328893.
Staphylococcus_Aureus | LPS | Optuna:  82%|████████▎ | 165/200 [3:38:33<48:48, 83.66s/it, best=0.894]Staphylococcus_Aureus | LPS | Optuna:  82%|████████▎ | 165/200 [3:38:33<48:48, 83.66s/it, best=0.894][I 2026-03-04 23:37:12,840] Trial 180 finished with value: 0.8746470562584285 and parameters: {'activation': 'logistic', 'solver': 'adam', 'lr': 3.93432742197575e-05, 'layer1': 127, 'layer2': 297, 'layer3': 136}. Best is trial 175 with value: 0.9332398278164448.
Klebsiella_Pneumoniae | LPS | Optuna:  90%|█████████ | 181/200 [3:38:55<22:24, 70.78s/it, best=0.933]Klebsiella_Pneumoniae | LPS | Optuna:  90%|█████████ | 181/200 [3:38:55<22:24, 70.78s/it, best=0.933][I 2026-03-04 23:37:38,086] Trial 77 finished with value: 0.860512266564695 and parameters: {'activation': 'relu', 'solver': 'adam', 'lr': 9.639134569619454e-05, 'layer1': 416, 'layer2': 72, 'layer3': 385}. Best is trial 73 with value: 0.864893646817533.
Escherichia_Coli | LPS | Optuna:  39%|███▉      | 78/200 [3:39:20<6:22:54, 188.31s/it, best=0.865]Escherichia_Coli | LPS | Optuna:  39%|███▉      | 78/200 [3:39:20<6:22:54, 188.31s/it, best=0.865][I 2026-03-04 23:37:49,345] Trial 188 finished with value: 0.8629493247019451 and parameters: {'activation': 'relu', 'solver': 'adam', 'lr': 0.004840981416420696, 'layer1': 434, 'layer2': 59, 'layer3': 446}. Best is trial 172 with value: 0.8682843857718467.
Pseudomonas_Aeruginosa | LPS | Optuna:  94%|█████████▍| 189/200 [3:39:31<18:08, 98.97s/it, best=0.868]Pseudomonas_Aeruginosa | LPS | Optuna:  94%|█████████▍| 189/200 [3:39:31<18:08, 98.97s/it, best=0.868][I 2026-03-04 23:38:25,654] Trial 165 finished with value: 0.8930835616448723 and parameters: {'activation': 'identity', 'solver': 'adam', 'lr': 0.00021484061435938633, 'layer1': 298, 'layer2': 36, 'layer3': 178}. Best is trial 124 with value: 0.8938450095328893.
Staphylococcus_Aureus | LPS | Optuna:  83%|████████▎ | 166/200 [3:40:07<49:14, 86.91s/it, best=0.894]Staphylococcus_Aureus | LPS | Optuna:  83%|████████▎ | 166/200 [3:40:07<49:14, 86.91s/it, best=0.894][I 2026-03-04 23:38:32,656] Trial 181 finished with value: 0.9312595772267924 and parameters: {'activation': 'tanh', 'solver': 'adam', 'lr': 6.316803121464776e-05, 'layer1': 154, 'layer2': 269, 'layer3': 103}. Best is trial 175 with value: 0.9332398278164448.
Klebsiella_Pneumoniae | LPS | Optuna:  91%|█████████ | 182/200 [3:40:14<22:02, 73.49s/it, best=0.933]Klebsiella_Pneumoniae | LPS | Optuna:  91%|█████████ | 182/200 [3:40:14<22:02, 73.49s/it, best=0.933][I 2026-03-04 23:38:55,249] Trial 189 finished with value: 0.8618886767350957 and parameters: {'activation': 'relu', 'solver': 'adam', 'lr': 0.0050932558104750236, 'layer1': 252, 'layer2': 74, 'layer3': 446}. Best is trial 172 with value: 0.8682843857718467.
Pseudomonas_Aeruginosa | LPS | Optuna:  95%|█████████▌| 190/200 [3:40:37<14:50, 89.05s/it, best=0.868]Pseudomonas_Aeruginosa | LPS | Optuna:  95%|█████████▌| 190/200 [3:40:37<14:50, 89.05s/it, best=0.868][I 2026-03-04 23:39:35,309] Trial 182 finished with value: 0.9328340391617147 and parameters: {'activation': 'tanh', 'solver': 'adam', 'lr': 8.1020522804856e-05, 'layer1': 110, 'layer2': 452, 'layer3': 97}. Best is trial 175 with value: 0.9332398278164448.
Klebsiella_Pneumoniae | LPS | Optuna:  92%|█████████▏| 183/200 [3:41:17<19:54, 70.24s/it, best=0.933]Klebsiella_Pneumoniae | LPS | Optuna:  92%|█████████▏| 183/200 [3:41:17<19:54, 70.24s/it, best=0.933][I 2026-03-04 23:40:01,879] Trial 166 finished with value: 0.8905807945352626 and parameters: {'activation': 'identity', 'solver': 'adam', 'lr': 0.00022094890710582557, 'layer1': 328, 'layer2': 211, 'layer3': 199}. Best is trial 124 with value: 0.8938450095328893.
Staphylococcus_Aureus | LPS | Optuna:  84%|████████▎ | 167/200 [3:41:43<49:20, 89.71s/it, best=0.894]Staphylococcus_Aureus | LPS | Optuna:  84%|████████▎ | 167/200 [3:41:43<49:20, 89.71s/it, best=0.894][I 2026-03-04 23:40:12,504] Trial 78 finished with value: 0.8606222318242134 and parameters: {'activation': 'identity', 'solver': 'adam', 'lr': 5.546154440864055e-05, 'layer1': 380, 'layer2': 96, 'layer3': 408}. Best is trial 73 with value: 0.864893646817533.
Escherichia_Coli | LPS | Optuna:  40%|███▉      | 79/200 [3:41:54<5:59:15, 178.14s/it, best=0.865]Escherichia_Coli | LPS | Optuna:  40%|███▉      | 79/200 [3:41:54<5:59:15, 178.14s/it, best=0.865][I 2026-03-04 23:40:42,193] Trial 183 finished with value: 0.9323281855735985 and parameters: {'activation': 'tanh', 'solver': 'adam', 'lr': 0.0001010055991245024, 'layer1': 108, 'layer2': 445, 'layer3': 86}. Best is trial 175 with value: 0.9332398278164448.
Klebsiella_Pneumoniae | LPS | Optuna:  92%|█████████▏| 184/200 [3:42:24<18:27, 69.23s/it, best=0.933]Klebsiella_Pneumoniae | LPS | Optuna:  92%|█████████▏| 184/200 [3:42:24<18:27, 69.23s/it, best=0.933][I 2026-03-04 23:40:50,415] Trial 190 finished with value: 0.8585558120511342 and parameters: {'activation': 'relu', 'solver': 'adam', 'lr': 0.006168122272084353, 'layer1': 438, 'layer2': 34, 'layer3': 441}. Best is trial 172 with value: 0.8682843857718467.
Pseudomonas_Aeruginosa | LPS | Optuna:  96%|█████████▌| 191/200 [3:42:32<14:31, 96.88s/it, best=0.868]Pseudomonas_Aeruginosa | LPS | Optuna:  96%|█████████▌| 191/200 [3:42:32<14:31, 96.88s/it, best=0.868][I 2026-03-04 23:41:48,050] Trial 167 finished with value: 0.8900711626266613 and parameters: {'activation': 'relu', 'solver': 'adam', 'lr': 0.0004024723568325343, 'layer1': 294, 'layer2': 43, 'layer3': 209}. Best is trial 124 with value: 0.8938450095328893.
Staphylococcus_Aureus | LPS | Optuna:  84%|████████▍ | 168/200 [3:43:30<50:28, 94.64s/it, best=0.894]Staphylococcus_Aureus | LPS | Optuna:  84%|████████▍ | 168/200 [3:43:30<50:28, 94.64s/it, best=0.894][I 2026-03-04 23:41:50,458] Trial 184 finished with value: 0.9319526837989637 and parameters: {'activation': 'tanh', 'solver': 'adam', 'lr': 8.552704481755613e-05, 'layer1': 106, 'layer2': 435, 'layer3': 87}. Best is trial 175 with value: 0.9332398278164448.
Klebsiella_Pneumoniae | LPS | Optuna:  92%|█████████▎| 185/200 [3:43:32<17:14, 68.94s/it, best=0.933]Klebsiella_Pneumoniae | LPS | Optuna:  92%|█████████▎| 185/200 [3:43:32<17:14, 68.94s/it, best=0.933][I 2026-03-04 23:42:29,463] Trial 191 finished with value: 0.8608730852981695 and parameters: {'activation': 'relu', 'solver': 'adam', 'lr': 0.0040443584035952254, 'layer1': 425, 'layer2': 52, 'layer3': 419}. Best is trial 172 with value: 0.8682843857718467.
Pseudomonas_Aeruginosa | LPS | Optuna:  96%|█████████▌| 192/200 [3:44:11<13:00, 97.53s/it, best=0.868]Pseudomonas_Aeruginosa | LPS | Optuna:  96%|█████████▌| 192/200 [3:44:11<13:00, 97.53s/it, best=0.868][I 2026-03-04 23:42:53,863] Trial 185 finished with value: 0.9306094397130955 and parameters: {'activation': 'tanh', 'solver': 'adam', 'lr': 0.00010540090865441176, 'layer1': 121, 'layer2': 449, 'layer3': 78}. Best is trial 175 with value: 0.9332398278164448.
Klebsiella_Pneumoniae | LPS | Optuna:  93%|█████████▎| 186/200 [3:44:36<15:41, 67.28s/it, best=0.933]Klebsiella_Pneumoniae | LPS | Optuna:  93%|█████████▎| 186/200 [3:44:36<15:41, 67.28s/it, best=0.933][I 2026-03-04 23:43:02,163] Trial 79 finished with value: 0.8597468172363893 and parameters: {'activation': 'relu', 'solver': 'adam', 'lr': 0.00019146961229202304, 'layer1': 484, 'layer2': 51, 'layer3': 468}. Best is trial 73 with value: 0.864893646817533.
Escherichia_Coli | LPS | Optuna:  40%|████      | 80/200 [3:44:44<5:51:11, 175.60s/it, best=0.865]Escherichia_Coli | LPS | Optuna:  40%|████      | 80/200 [3:44:44<5:51:11, 175.60s/it, best=0.865][I 2026-03-04 23:43:30,543] Trial 168 finished with value: 0.8914480060175066 and parameters: {'activation': 'identity', 'solver': 'adam', 'lr': 0.0001565604841365426, 'layer1': 306, 'layer2': 35, 'layer3': 177}. Best is trial 124 with value: 0.8938450095328893.
Staphylococcus_Aureus | LPS | Optuna:  84%|████████▍ | 169/200 [3:45:12<50:06, 97.00s/it, best=0.894]Staphylococcus_Aureus | LPS | Optuna:  84%|████████▍ | 169/200 [3:45:12<50:06, 97.00s/it, best=0.894][I 2026-03-04 23:44:01,852] Trial 192 finished with value: 0.8664414613458173 and parameters: {'activation': 'relu', 'solver': 'adam', 'lr': 0.0035080589051019726, 'layer1': 445, 'layer2': 90, 'layer3': 451}. Best is trial 172 with value: 0.8682843857718467.
Pseudomonas_Aeruginosa | LPS | Optuna:  96%|█████████▋| 193/200 [3:45:44<11:11, 95.99s/it, best=0.868]Pseudomonas_Aeruginosa | LPS | Optuna:  96%|█████████▋| 193/200 [3:45:44<11:11, 95.99s/it, best=0.868][I 2026-03-04 23:44:15,422] Trial 186 finished with value: 0.9321080600871664 and parameters: {'activation': 'tanh', 'solver': 'adam', 'lr': 5.3991825452674345e-05, 'layer1': 110, 'layer2': 451, 'layer3': 94}. Best is trial 175 with value: 0.9332398278164448.
Klebsiella_Pneumoniae | LPS | Optuna:  94%|█████████▎| 187/200 [3:45:57<15:30, 71.56s/it, best=0.933]Klebsiella_Pneumoniae | LPS | Optuna:  94%|█████████▎| 187/200 [3:45:57<15:30, 71.56s/it, best=0.933][I 2026-03-04 23:44:18,851] Trial 169 finished with value: 0.8024551713036733 and parameters: {'activation': 'identity', 'solver': 'sgd', 'lr': 0.00020361443873089807, 'layer1': 276, 'layer2': 69, 'layer3': 185}. Best is trial 124 with value: 0.8938450095328893.
Staphylococcus_Aureus | LPS | Optuna:  85%|████████▌ | 170/200 [3:46:00<41:11, 82.39s/it, best=0.894]Staphylococcus_Aureus | LPS | Optuna:  85%|████████▌ | 170/200 [3:46:00<41:11, 82.39s/it, best=0.894][I 2026-03-04 23:45:28,920] Trial 193 finished with value: 0.8619926825632103 and parameters: {'activation': 'relu', 'solver': 'adam', 'lr': 0.002973866212194715, 'layer1': 433, 'layer2': 65, 'layer3': 450}. Best is trial 172 with value: 0.8682843857718467.
Pseudomonas_Aeruginosa | LPS | Optuna:  97%|█████████▋| 194/200 [3:47:11<09:19, 93.31s/it, best=0.868]Pseudomonas_Aeruginosa | LPS | Optuna:  97%|█████████▋| 194/200 [3:47:11<09:19, 93.31s/it, best=0.868][I 2026-03-04 23:45:31,741] Trial 187 finished with value: 0.9309588414577321 and parameters: {'activation': 'tanh', 'solver': 'adam', 'lr': 4.804573897321662e-05, 'layer1': 112, 'layer2': 454, 'layer3': 103}. Best is trial 175 with value: 0.9332398278164448.
Klebsiella_Pneumoniae | LPS | Optuna:  94%|█████████▍| 188/200 [3:47:13<14:35, 72.99s/it, best=0.933]Klebsiella_Pneumoniae | LPS | Optuna:  94%|█████████▍| 188/200 [3:47:13<14:35, 72.99s/it, best=0.933][I 2026-03-04 23:46:20,685] Trial 170 finished with value: 0.8854194821998014 and parameters: {'activation': 'tanh', 'solver': 'adam', 'lr': 0.00011598415443663645, 'layer1': 266, 'layer2': 10, 'layer3': 163}. Best is trial 124 with value: 0.8938450095328893.
Staphylococcus_Aureus | LPS | Optuna:  86%|████████▌ | 171/200 [3:48:02<45:32, 94.22s/it, best=0.894]Staphylococcus_Aureus | LPS | Optuna:  86%|████████▌ | 171/200 [3:48:02<45:32, 94.22s/it, best=0.894][I 2026-03-04 23:46:57,857] Trial 194 finished with value: 0.8641494307023372 and parameters: {'activation': 'relu', 'solver': 'adam', 'lr': 0.0035398680996142633, 'layer1': 445, 'layer2': 87, 'layer3': 428}. Best is trial 172 with value: 0.8682843857718467.
Pseudomonas_Aeruginosa | LPS | Optuna:  98%|█████████▊| 195/200 [3:48:40<07:40, 92.00s/it, best=0.868]Pseudomonas_Aeruginosa | LPS | Optuna:  98%|█████████▊| 195/200 [3:48:40<07:40, 92.00s/it, best=0.868][I 2026-03-04 23:47:03,395] Trial 188 finished with value: 0.9318695989273152 and parameters: {'activation': 'tanh', 'solver': 'adam', 'lr': 3.4172097715633136e-05, 'layer1': 90, 'layer2': 441, 'layer3': 113}. Best is trial 175 with value: 0.9332398278164448.
Klebsiella_Pneumoniae | LPS | Optuna:  94%|█████████▍| 189/200 [3:48:45<14:24, 78.59s/it, best=0.933]Klebsiella_Pneumoniae | LPS | Optuna:  94%|█████████▍| 189/200 [3:48:45<14:24, 78.59s/it, best=0.933][I 2026-03-04 23:47:40,650] Trial 171 finished with value: 0.891244077910707 and parameters: {'activation': 'identity', 'solver': 'adam', 'lr': 0.00032776549113203293, 'layer1': 257, 'layer2': 27, 'layer3': 154}. Best is trial 124 with value: 0.8938450095328893.
Staphylococcus_Aureus | LPS | Optuna:  86%|████████▌ | 172/200 [3:49:22<41:58, 89.95s/it, best=0.894]Staphylococcus_Aureus | LPS | Optuna:  86%|████████▌ | 172/200 [3:49:22<41:58, 89.95s/it, best=0.894][I 2026-03-04 23:47:51,580] Trial 80 finished with value: 0.8638514614430515 and parameters: {'activation': 'relu', 'solver': 'adam', 'lr': 2.8073856186162035e-05, 'layer1': 453, 'layer2': 17, 'layer3': 449}. Best is trial 73 with value: 0.864893646817533.
Escherichia_Coli | LPS | Optuna:  40%|████      | 81/200 [3:49:33<6:55:59, 209.74s/it, best=0.865]Escherichia_Coli | LPS | Optuna:  40%|████      | 81/200 [3:49:33<6:55:59, 209.74s/it, best=0.865][I 2026-03-04 23:48:16,063] Trial 189 finished with value: 0.9291394480494063 and parameters: {'activation': 'tanh', 'solver': 'adam', 'lr': 5.763187880476737e-05, 'layer1': 99, 'layer2': 445, 'layer3': 70}. Best is trial 175 with value: 0.9332398278164448.
Klebsiella_Pneumoniae | LPS | Optuna:  95%|█████████▌| 190/200 [3:49:58<12:48, 76.81s/it, best=0.933]Klebsiella_Pneumoniae | LPS | Optuna:  95%|█████████▌| 190/200 [3:49:58<12:48, 76.81s/it, best=0.933][I 2026-03-04 23:48:27,475] Trial 195 finished with value: 0.8633577741922263 and parameters: {'activation': 'relu', 'solver': 'adam', 'lr': 0.003526279126975059, 'layer1': 446, 'layer2': 90, 'layer3': 428}. Best is trial 172 with value: 0.8682843857718467.
Pseudomonas_Aeruginosa | LPS | Optuna:  98%|█████████▊| 196/200 [3:50:09<06:05, 91.29s/it, best=0.868]Pseudomonas_Aeruginosa | LPS | Optuna:  98%|█████████▊| 196/200 [3:50:09<06:05, 91.29s/it, best=0.868][I 2026-03-04 23:49:09,915] Trial 196 finished with value: 0.8263583592003403 and parameters: {'activation': 'relu', 'solver': 'sgd', 'lr': 0.005549177840486886, 'layer1': 448, 'layer2': 88, 'layer3': 422}. Best is trial 172 with value: 0.8682843857718467.
Pseudomonas_Aeruginosa | LPS | Optuna:  98%|█████████▊| 197/200 [3:50:52<03:49, 76.63s/it, best=0.868]Pseudomonas_Aeruginosa | LPS | Optuna:  98%|█████████▊| 197/200 [3:50:52<03:49, 76.63s/it, best=0.868][I 2026-03-04 23:49:10,367] Trial 172 finished with value: 0.8914329883740517 and parameters: {'activation': 'identity', 'solver': 'adam', 'lr': 0.00043529244188726326, 'layer1': 299, 'layer2': 50, 'layer3': 136}. Best is trial 124 with value: 0.8938450095328893.
Staphylococcus_Aureus | LPS | Optuna:  86%|████████▋ | 173/200 [3:50:52<40:26, 89.88s/it, best=0.894]Staphylococcus_Aureus | LPS | Optuna:  86%|████████▋ | 173/200 [3:50:52<40:26, 89.88s/it, best=0.894][I 2026-03-04 23:50:17,279] Trial 190 finished with value: 0.9312884512682406 and parameters: {'activation': 'tanh', 'solver': 'adam', 'lr': 2.8115564586020612e-05, 'layer1': 107, 'layer2': 462, 'layer3': 127}. Best is trial 175 with value: 0.9332398278164448.
Klebsiella_Pneumoniae | LPS | Optuna:  96%|█████████▌| 191/200 [3:51:59<13:31, 90.13s/it, best=0.933]Klebsiella_Pneumoniae | LPS | Optuna:  96%|█████████▌| 191/200 [3:51:59<13:31, 90.13s/it, best=0.933][I 2026-03-04 23:50:34,886] Trial 173 finished with value: 0.8915838448743205 and parameters: {'activation': 'identity', 'solver': 'adam', 'lr': 0.0002854216552515143, 'layer1': 237, 'layer2': 20, 'layer3': 117}. Best is trial 124 with value: 0.8938450095328893.
Staphylococcus_Aureus | LPS | Optuna:  87%|████████▋ | 174/200 [3:52:17<38:15, 88.27s/it, best=0.894]Staphylococcus_Aureus | LPS | Optuna:  87%|████████▋ | 174/200 [3:52:17<38:15, 88.27s/it, best=0.894][I 2026-03-04 23:50:47,809] Trial 197 finished with value: 0.8628665925013514 and parameters: {'activation': 'relu', 'solver': 'adam', 'lr': 0.0032691144098231555, 'layer1': 469, 'layer2': 103, 'layer3': 433}. Best is trial 172 with value: 0.8682843857718467.
Pseudomonas_Aeruginosa | LPS | Optuna:  99%|█████████▉| 198/200 [3:52:30<02:46, 83.01s/it, best=0.868]Pseudomonas_Aeruginosa | LPS | Optuna:  99%|█████████▉| 198/200 [3:52:30<02:46, 83.01s/it, best=0.868][I 2026-03-04 23:51:30,518] Trial 191 finished with value: 0.9309249871184532 and parameters: {'activation': 'tanh', 'solver': 'adam', 'lr': 7.451490366771558e-05, 'layer1': 126, 'layer2': 476, 'layer3': 93}. Best is trial 175 with value: 0.9332398278164448.
Klebsiella_Pneumoniae | LPS | Optuna:  96%|█████████▌| 192/200 [3:53:12<11:20, 85.07s/it, best=0.933]Klebsiella_Pneumoniae | LPS | Optuna:  96%|█████████▌| 192/200 [3:53:12<11:20, 85.07s/it, best=0.933][I 2026-03-04 23:52:01,418] Trial 174 finished with value: 0.8914330497077187 and parameters: {'activation': 'identity', 'solver': 'adam', 'lr': 0.00036336171366355613, 'layer1': 286, 'layer2': 35, 'layer3': 175}. Best is trial 124 with value: 0.8938450095328893.
