Escherichia_Coli | LPS | Optuna:  64%|██████▍   | 128/200 [6:39:06<4:39:48, 233.18s/it, best=0.865]Escherichia_Coli | LPS | Optuna:  64%|██████▍   | 128/200 [6:39:06<4:39:48, 233.18s/it, best=0.865][I 2026-03-05 02:37:39,957] Trial 58 finished with value: 0.5649966040559 and parameters: {'activation': 'identity', 'solver': 'sgd', 'lr': 5.8072040232670965e-06, 'layer1': 309, 'layer2': 402, 'layer3': 20}. Best is trial 55 with value: 0.8925301599746895.
Staphylococcus_Aureus | DirectMulti | Optuna:  30%|██▉       | 59/200 [2:02:57<7:49:31, 199.80s/it, best=0.892]Staphylococcus_Aureus | DirectMulti | Optuna:  30%|██▉       | 59/200 [2:02:57<7:49:31, 199.80s/it, best=0.892][I 2026-03-05 02:37:49,901] Trial 106 finished with value: 0.8602424678758156 and parameters: {'activation': 'relu', 'solver': 'adam', 'lr': 0.0029174242098510103, 'layer1': 439, 'layer2': 480, 'layer3': 360}. Best is trial 71 with value: 0.8659155749694897.
Pseudomonas_Aeruginosa | DirectMulti | Optuna:  54%|█████▎    | 107/200 [2:43:43<2:43:52, 105.73s/it, best=0.866]Pseudomonas_Aeruginosa | DirectMulti | Optuna:  54%|█████▎    | 107/200 [2:43:43<2:43:52, 105.73s/it, best=0.866][I 2026-03-05 02:38:54,907] Trial 115 finished with value: 0.9320045838207888 and parameters: {'activation': 'tanh', 'solver': 'adam', 'lr': 4.538467049622071e-05, 'layer1': 97, 'layer2': 153, 'layer3': 428}. Best is trial 55 with value: 0.9322110061695005.
Klebsiella_Pneumoniae | DirectMulti | Optuna:  58%|█████▊    | 116/200 [2:37:27<2:15:24, 96.72s/it, best=0.932]Klebsiella_Pneumoniae | DirectMulti | Optuna:  58%|█████▊    | 116/200 [2:37:27<2:15:24, 96.72s/it, best=0.932][I 2026-03-05 02:39:05,784] Trial 59 finished with value: 0.8017571723506313 and parameters: {'activation': 'identity', 'solver': 'adam', 'lr': 2.5964434485925456e-06, 'layer1': 383, 'layer2': 411, 'layer3': 73}. Best is trial 55 with value: 0.8925301599746895.
Staphylococcus_Aureus | DirectMulti | Optuna:  30%|███       | 60/200 [2:04:23<6:26:24, 165.61s/it, best=0.892]Staphylococcus_Aureus | DirectMulti | Optuna:  30%|███       | 60/200 [2:04:23<6:26:24, 165.61s/it, best=0.892][I 2026-03-05 02:39:19,566] Trial 107 finished with value: 0.8636574513753443 and parameters: {'activation': 'tanh', 'solver': 'adam', 'lr': 0.001440461482597092, 'layer1': 456, 'layer2': 419, 'layer3': 309}. Best is trial 71 with value: 0.8659155749694897.
Pseudomonas_Aeruginosa | DirectMulti | Optuna:  54%|█████▍    | 108/200 [2:45:13<2:34:43, 100.91s/it, best=0.866]Pseudomonas_Aeruginosa | DirectMulti | Optuna:  54%|█████▍    | 108/200 [2:45:13<2:34:43, 100.91s/it, best=0.866][I 2026-03-05 02:40:35,360] Trial 116 finished with value: 0.930278370035337 and parameters: {'activation': 'tanh', 'solver': 'adam', 'lr': 3.0520254032012005e-05, 'layer1': 93, 'layer2': 269, 'layer3': 500}. Best is trial 55 with value: 0.9322110061695005.
Klebsiella_Pneumoniae | DirectMulti | Optuna:  58%|█████▊    | 117/200 [2:39:07<2:15:20, 97.84s/it, best=0.932]Klebsiella_Pneumoniae | DirectMulti | Optuna:  58%|█████▊    | 117/200 [2:39:07<2:15:20, 97.84s/it, best=0.932][I 2026-03-05 02:40:44,082] Trial 128 finished with value: 0.8604956695450326 and parameters: {'activation': 'relu', 'solver': 'adam', 'lr': 0.005872563386787133, 'layer1': 470, 'layer2': 30, 'layer3': 309}. Best is trial 73 with value: 0.864893646817533.
Escherichia_Coli | LPS | Optuna:  64%|██████▍   | 129/200 [6:42:26<4:24:03, 223.15s/it, best=0.865]Escherichia_Coli | LPS | Optuna:  64%|██████▍   | 129/200 [6:42:26<4:24:03, 223.15s/it, best=0.865][I 2026-03-05 02:41:09,338] Trial 108 finished with value: 0.8642072854461558 and parameters: {'activation': 'tanh', 'solver': 'adam', 'lr': 0.0018839576208105498, 'layer1': 461, 'layer2': 393, 'layer3': 313}. Best is trial 71 with value: 0.8659155749694897.
Pseudomonas_Aeruginosa | DirectMulti | Optuna:  55%|█████▍    | 109/200 [2:47:03<2:37:04, 103.57s/it, best=0.866]Pseudomonas_Aeruginosa | DirectMulti | Optuna:  55%|█████▍    | 109/200 [2:47:03<2:37:04, 103.57s/it, best=0.866][I 2026-03-05 02:42:16,311] Trial 117 finished with value: 0.931632015500478 and parameters: {'activation': 'tanh', 'solver': 'adam', 'lr': 4.505262145236694e-05, 'layer1': 110, 'layer2': 152, 'layer3': 371}. Best is trial 55 with value: 0.9322110061695005.
Klebsiella_Pneumoniae | DirectMulti | Optuna:  59%|█████▉    | 118/200 [2:40:48<2:14:59, 98.77s/it, best=0.932]Klebsiella_Pneumoniae | DirectMulti | Optuna:  59%|█████▉    | 118/200 [2:40:48<2:14:59, 98.77s/it, best=0.932][I 2026-03-05 02:42:38,539] Trial 109 finished with value: 0.8618376424369577 and parameters: {'activation': 'tanh', 'solver': 'adam', 'lr': 0.0003231278471425511, 'layer1': 483, 'layer2': 389, 'layer3': 309}. Best is trial 71 with value: 0.8659155749694897.
Pseudomonas_Aeruginosa | DirectMulti | Optuna:  55%|█████▌    | 110/200 [2:48:32<2:28:53, 99.26s/it, best=0.866] Pseudomonas_Aeruginosa | DirectMulti | Optuna:  55%|█████▌    | 110/200 [2:48:32<2:28:53, 99.26s/it, best=0.866][I 2026-03-05 02:43:33,093] Trial 118 finished with value: 0.9314081583948968 and parameters: {'activation': 'tanh', 'solver': 'adam', 'lr': 6.125725524533146e-05, 'layer1': 67, 'layer2': 152, 'layer3': 362}. Best is trial 55 with value: 0.9322110061695005.
Klebsiella_Pneumoniae | DirectMulti | Optuna:  60%|█████▉    | 119/200 [2:42:05<2:04:26, 92.17s/it, best=0.932]Klebsiella_Pneumoniae | DirectMulti | Optuna:  60%|█████▉    | 119/200 [2:42:05<2:04:26, 92.17s/it, best=0.932][I 2026-03-05 02:44:03,711] Trial 60 finished with value: 0.8917157021240454 and parameters: {'activation': 'identity', 'solver': 'adam', 'lr': 1.3406552471078155e-05, 'layer1': 266, 'layer2': 434, 'layer3': 25}. Best is trial 55 with value: 0.8925301599746895.
Staphylococcus_Aureus | DirectMulti | Optuna:  30%|███       | 61/200 [2:09:21<7:55:37, 205.30s/it, best=0.892]Staphylococcus_Aureus | DirectMulti | Optuna:  30%|███       | 61/200 [2:09:21<7:55:37, 205.30s/it, best=0.892][I 2026-03-05 02:44:07,767] Trial 110 finished with value: 0.8579852857406542 and parameters: {'activation': 'tanh', 'solver': 'adam', 'lr': 0.0018584560951091602, 'layer1': 432, 'layer2': 410, 'layer3': 333}. Best is trial 71 with value: 0.8659155749694897.
Pseudomonas_Aeruginosa | DirectMulti | Optuna:  56%|█████▌    | 111/200 [2:50:01<2:22:46, 96.25s/it, best=0.866]Pseudomonas_Aeruginosa | DirectMulti | Optuna:  56%|█████▌    | 111/200 [2:50:01<2:22:46, 96.25s/it, best=0.866][I 2026-03-05 02:45:01,260] Trial 129 finished with value: 0.863349401506928 and parameters: {'activation': 'relu', 'solver': 'adam', 'lr': 2.7291028807386703e-05, 'layer1': 403, 'layer2': 40, 'layer3': 476}. Best is trial 73 with value: 0.864893646817533.
Escherichia_Coli | LPS | Optuna:  65%|██████▌   | 130/200 [6:46:43<4:32:15, 233.36s/it, best=0.865]Escherichia_Coli | LPS | Optuna:  65%|██████▌   | 130/200 [6:46:43<4:32:15, 233.36s/it, best=0.865][I 2026-03-05 02:45:11,089] Trial 119 finished with value: 0.9317216605040194 and parameters: {'activation': 'tanh', 'solver': 'adam', 'lr': 4.390481171180307e-05, 'layer1': 70, 'layer2': 101, 'layer3': 324}. Best is trial 55 with value: 0.9322110061695005.
Klebsiella_Pneumoniae | DirectMulti | Optuna:  60%|██████    | 120/200 [2:43:43<2:05:13, 93.92s/it, best=0.932]Klebsiella_Pneumoniae | DirectMulti | Optuna:  60%|██████    | 120/200 [2:43:43<2:05:13, 93.92s/it, best=0.932][I 2026-03-05 02:45:29,269] Trial 111 finished with value: 0.8618510482993983 and parameters: {'activation': 'tanh', 'solver': 'adam', 'lr': 0.0014453535069671787, 'layer1': 457, 'layer2': 372, 'layer3': 325}. Best is trial 71 with value: 0.8659155749694897.
Pseudomonas_Aeruginosa | DirectMulti | Optuna:  56%|█████▌    | 112/200 [2:51:23<2:14:40, 91.83s/it, best=0.866]Pseudomonas_Aeruginosa | DirectMulti | Optuna:  56%|█████▌    | 112/200 [2:51:23<2:14:40, 91.83s/it, best=0.866][I 2026-03-05 02:46:33,208] Trial 120 finished with value: 0.8752995313375458 and parameters: {'activation': 'tanh', 'solver': 'sgd', 'lr': 4.4041201337539245e-05, 'layer1': 42, 'layer2': 96, 'layer3': 319}. Best is trial 55 with value: 0.9322110061695005.
Klebsiella_Pneumoniae | DirectMulti | Optuna:  60%|██████    | 121/200 [2:45:05<1:59:00, 90.38s/it, best=0.932]Klebsiella_Pneumoniae | DirectMulti | Optuna:  60%|██████    | 121/200 [2:45:05<1:59:00, 90.38s/it, best=0.932][I 2026-03-05 02:46:42,058] Trial 112 finished with value: 0.8593865746503763 and parameters: {'activation': 'tanh', 'solver': 'adam', 'lr': 0.0007665650326726189, 'layer1': 444, 'layer2': 442, 'layer3': 313}. Best is trial 71 with value: 0.8659155749694897.
Pseudomonas_Aeruginosa | DirectMulti | Optuna:  56%|█████▋    | 113/200 [2:52:36<2:04:51, 86.11s/it, best=0.866]Pseudomonas_Aeruginosa | DirectMulti | Optuna:  56%|█████▋    | 113/200 [2:52:36<2:04:51, 86.11s/it, best=0.866][I 2026-03-05 02:48:02,448] Trial 121 finished with value: 0.9314822626030874 and parameters: {'activation': 'tanh', 'solver': 'adam', 'lr': 6.077524648196855e-05, 'layer1': 65, 'layer2': 149, 'layer3': 344}. Best is trial 55 with value: 0.9322110061695005.
Klebsiella_Pneumoniae | DirectMulti | Optuna:  61%|██████    | 122/200 [2:46:34<1:57:02, 90.04s/it, best=0.932]Klebsiella_Pneumoniae | DirectMulti | Optuna:  61%|██████    | 122/200 [2:46:34<1:57:02, 90.04s/it, best=0.932][I 2026-03-05 02:48:29,339] Trial 113 finished with value: 0.8610086580084898 and parameters: {'activation': 'tanh', 'solver': 'adam', 'lr': 0.0021625160016413153, 'layer1': 456, 'layer2': 425, 'layer3': 264}. Best is trial 71 with value: 0.8659155749694897.
Pseudomonas_Aeruginosa | DirectMulti | Optuna:  57%|█████▋    | 114/200 [2:54:23<2:12:31, 92.46s/it, best=0.866]Pseudomonas_Aeruginosa | DirectMulti | Optuna:  57%|█████▋    | 114/200 [2:54:23<2:12:31, 92.46s/it, best=0.866][I 2026-03-05 02:49:00,739] Trial 61 finished with value: 0.8900623930253719 and parameters: {'activation': 'identity', 'solver': 'adam', 'lr': 1.1710177549539747e-05, 'layer1': 267, 'layer2': 446, 'layer3': 28}. Best is trial 55 with value: 0.8925301599746895.
Staphylococcus_Aureus | DirectMulti | Optuna:  31%|███       | 62/200 [2:14:18<8:55:29, 232.82s/it, best=0.892]Staphylococcus_Aureus | DirectMulti | Optuna:  31%|███       | 62/200 [2:14:18<8:55:29, 232.82s/it, best=0.892][I 2026-03-05 02:49:28,020] Trial 122 finished with value: 0.931802545689662 and parameters: {'activation': 'tanh', 'solver': 'adam', 'lr': 4.918000223569628e-05, 'layer1': 105, 'layer2': 115, 'layer3': 333}. Best is trial 55 with value: 0.9322110061695005.
Klebsiella_Pneumoniae | DirectMulti | Optuna:  62%|██████▏   | 123/200 [2:48:00<1:53:49, 88.70s/it, best=0.932]Klebsiella_Pneumoniae | DirectMulti | Optuna:  62%|██████▏   | 123/200 [2:48:00<1:53:49, 88.70s/it, best=0.932][I 2026-03-05 02:49:31,157] Trial 130 finished with value: 0.8630824641430687 and parameters: {'activation': 'relu', 'solver': 'adam', 'lr': 2.945256307175018e-05, 'layer1': 403, 'layer2': 19, 'layer3': 474}. Best is trial 73 with value: 0.864893646817533.
Escherichia_Coli | LPS | Optuna:  66%|██████▌   | 131/200 [6:51:13<4:40:58, 244.32s/it, best=0.865]Escherichia_Coli | LPS | Optuna:  66%|██████▌   | 131/200 [6:51:13<4:40:58, 244.32s/it, best=0.865][I 2026-03-05 02:49:57,001] Trial 114 finished with value: 0.858556184074246 and parameters: {'activation': 'tanh', 'solver': 'adam', 'lr': 0.0004420013715057477, 'layer1': 490, 'layer2': 381, 'layer3': 300}. Best is trial 71 with value: 0.8659155749694897.
Pseudomonas_Aeruginosa | DirectMulti | Optuna:  57%|█████▊    | 115/200 [2:55:51<2:08:57, 91.02s/it, best=0.866]Pseudomonas_Aeruginosa | DirectMulti | Optuna:  57%|█████▊    | 115/200 [2:55:51<2:08:57, 91.02s/it, best=0.866][I 2026-03-05 02:50:50,805] Trial 123 finished with value: 0.9314233412348987 and parameters: {'activation': 'tanh', 'solver': 'adam', 'lr': 6.932040541958388e-05, 'layer1': 104, 'layer2': 67, 'layer3': 337}. Best is trial 55 with value: 0.9322110061695005.
Klebsiella_Pneumoniae | DirectMulti | Optuna:  62%|██████▏   | 124/200 [2:49:22<1:50:06, 86.92s/it, best=0.932]Klebsiella_Pneumoniae | DirectMulti | Optuna:  62%|██████▏   | 124/200 [2:49:22<1:50:06, 86.92s/it, best=0.932][I 2026-03-05 02:51:35,003] Trial 115 finished with value: 0.8580863008993113 and parameters: {'activation': 'tanh', 'solver': 'adam', 'lr': 0.0010645971642032515, 'layer1': 477, 'layer2': 453, 'layer3': 346}. Best is trial 71 with value: 0.8659155749694897.
Pseudomonas_Aeruginosa | DirectMulti | Optuna:  58%|█████▊    | 116/200 [2:57:29<2:10:21, 93.12s/it, best=0.866]Pseudomonas_Aeruginosa | DirectMulti | Optuna:  58%|█████▊    | 116/200 [2:57:29<2:10:21, 93.12s/it, best=0.866][I 2026-03-05 02:52:15,229] Trial 124 finished with value: 0.9313868813660993 and parameters: {'activation': 'tanh', 'solver': 'adam', 'lr': 7.070919380368313e-05, 'layer1': 106, 'layer2': 67, 'layer3': 334}. Best is trial 55 with value: 0.9322110061695005.
Klebsiella_Pneumoniae | DirectMulti | Optuna:  62%|██████▎   | 125/200 [2:50:47<1:47:43, 86.17s/it, best=0.932]Klebsiella_Pneumoniae | DirectMulti | Optuna:  62%|██████▎   | 125/200 [2:50:47<1:47:43, 86.17s/it, best=0.932][I 2026-03-05 02:52:34,796] Trial 62 finished with value: 0.8933826282053527 and parameters: {'activation': 'identity', 'solver': 'adam', 'lr': 1.9577977686900198e-05, 'layer1': 311, 'layer2': 420, 'layer3': 61}. Best is trial 62 with value: 0.8933826282053527.
Staphylococcus_Aureus | DirectMulti | Optuna:  32%|███▏      | 63/200 [2:17:52<8:38:45, 227.19s/it, best=0.892]Staphylococcus_Aureus | DirectMulti | Optuna:  32%|███▏      | 63/200 [2:17:52<8:38:45, 227.19s/it, best=0.893][I 2026-03-05 02:53:09,873] Trial 116 finished with value: 0.8589940010016719 and parameters: {'activation': 'tanh', 'solver': 'adam', 'lr': 0.0014021132032397217, 'layer1': 464, 'layer2': 401, 'layer3': 378}. Best is trial 71 with value: 0.8659155749694897.
Pseudomonas_Aeruginosa | DirectMulti | Optuna:  58%|█████▊    | 117/200 [2:59:03<2:09:32, 93.64s/it, best=0.866]Pseudomonas_Aeruginosa | DirectMulti | Optuna:  58%|█████▊    | 117/200 [2:59:03<2:09:32, 93.64s/it, best=0.866][I 2026-03-05 02:53:47,480] Trial 125 finished with value: 0.93182855650154 and parameters: {'activation': 'tanh', 'solver': 'adam', 'lr': 8.489013209257877e-05, 'layer1': 117, 'layer2': 37, 'layer3': 320}. Best is trial 55 with value: 0.9322110061695005.
Klebsiella_Pneumoniae | DirectMulti | Optuna:  63%|██████▎   | 126/200 [2:52:19<1:48:31, 88.00s/it, best=0.932]Klebsiella_Pneumoniae | DirectMulti | Optuna:  63%|██████▎   | 126/200 [2:52:19<1:48:31, 88.00s/it, best=0.932][I 2026-03-05 02:54:24,589] Trial 131 finished with value: 0.864274787180937 and parameters: {'activation': 'relu', 'solver': 'adam', 'lr': 2.5928294162902912e-05, 'layer1': 384, 'layer2': 40, 'layer3': 481}. Best is trial 73 with value: 0.864893646817533.
Escherichia_Coli | LPS | Optuna:  66%|██████▌   | 132/200 [6:56:06<4:53:35, 259.05s/it, best=0.865]Escherichia_Coli | LPS | Optuna:  66%|██████▌   | 132/200 [6:56:06<4:53:35, 259.05s/it, best=0.865][I 2026-03-05 02:54:42,285] Trial 117 finished with value: 0.8627762621020393 and parameters: {'activation': 'tanh', 'solver': 'adam', 'lr': 0.002455576007280683, 'layer1': 320, 'layer2': 472, 'layer3': 246}. Best is trial 71 with value: 0.8659155749694897.
Pseudomonas_Aeruginosa | DirectMulti | Optuna:  59%|█████▉    | 118/200 [3:00:36<2:07:28, 93.27s/it, best=0.866]Pseudomonas_Aeruginosa | DirectMulti | Optuna:  59%|█████▉    | 118/200 [3:00:36<2:07:28, 93.27s/it, best=0.866][I 2026-03-05 02:54:53,036] Trial 126 finished with value: 0.9307468085073513 and parameters: {'activation': 'tanh', 'solver': 'adam', 'lr': 0.00017239824997872523, 'layer1': 117, 'layer2': 39, 'layer3': 318}. Best is trial 55 with value: 0.9322110061695005.
Klebsiella_Pneumoniae | DirectMulti | Optuna:  64%|██████▎   | 127/200 [2:53:25<1:38:52, 81.26s/it, best=0.932]Klebsiella_Pneumoniae | DirectMulti | Optuna:  64%|██████▎   | 127/200 [2:53:25<1:38:52, 81.26s/it, best=0.932][I 2026-03-05 02:55:27,263] Trial 127 finished with value: 0.8746470562584285 and parameters: {'activation': 'logistic', 'solver': 'adam', 'lr': 8.90200432521353e-05, 'layer1': 90, 'layer2': 81, 'layer3': 299}. Best is trial 55 with value: 0.9322110061695005.
Klebsiella_Pneumoniae | DirectMulti | Optuna:  64%|██████▍   | 128/200 [2:53:59<1:20:35, 67.15s/it, best=0.932]Klebsiella_Pneumoniae | DirectMulti | Optuna:  64%|██████▍   | 128/200 [2:53:59<1:20:35, 67.15s/it, best=0.932][I 2026-03-05 02:55:32,170] Trial 118 finished with value: 0.8261898244308833 and parameters: {'activation': 'logistic', 'solver': 'sgd', 'lr': 0.0018361217842145427, 'layer1': 437, 'layer2': 365, 'layer3': 278}. Best is trial 71 with value: 0.8659155749694897.
Pseudomonas_Aeruginosa | DirectMulti | Optuna:  60%|█████▉    | 119/200 [3:01:26<1:48:20, 80.26s/it, best=0.866]Pseudomonas_Aeruginosa | DirectMulti | Optuna:  60%|█████▉    | 119/200 [3:01:26<1:48:20, 80.26s/it, best=0.866][I 2026-03-05 02:56:49,065] Trial 63 finished with value: 0.8923208420214868 and parameters: {'activation': 'identity', 'solver': 'adam', 'lr': 1.6526498706710816e-05, 'layer1': 302, 'layer2': 429, 'layer3': 69}. Best is trial 62 with value: 0.8933826282053527.
Staphylococcus_Aureus | DirectMulti | Optuna:  32%|███▏      | 64/200 [2:22:06<8:53:22, 235.31s/it, best=0.893]Staphylococcus_Aureus | DirectMulti | Optuna:  32%|███▏      | 64/200 [2:22:06<8:53:22, 235.31s/it, best=0.893][I 2026-03-05 02:56:50,551] Trial 119 finished with value: 0.8565778908289122 and parameters: {'activation': 'identity', 'solver': 'adam', 'lr': 0.004334676144810314, 'layer1': 448, 'layer2': 413, 'layer3': 325}. Best is trial 71 with value: 0.8659155749694897.
Pseudomonas_Aeruginosa | DirectMulti | Optuna:  60%|██████    | 120/200 [3:02:44<1:46:15, 79.69s/it, best=0.866]Pseudomonas_Aeruginosa | DirectMulti | Optuna:  60%|██████    | 120/200 [3:02:44<1:46:15, 79.69s/it, best=0.866][I 2026-03-05 02:56:59,360] Trial 128 finished with value: 0.9313614591891483 and parameters: {'activation': 'tanh', 'solver': 'adam', 'lr': 5.117470707455736e-05, 'layer1': 80, 'layer2': 49, 'layer3': 325}. Best is trial 55 with value: 0.9322110061695005.
Klebsiella_Pneumoniae | DirectMulti | Optuna:  64%|██████▍   | 129/200 [2:55:31<1:28:19, 74.64s/it, best=0.932]Klebsiella_Pneumoniae | DirectMulti | Optuna:  64%|██████▍   | 129/200 [2:55:31<1:28:19, 74.64s/it, best=0.932][I 2026-03-05 02:57:39,014] Trial 129 finished with value: 0.8746470562584285 and parameters: {'activation': 'tanh', 'solver': 'adam', 'lr': 2.1962150682845363e-05, 'layer1': 139, 'layer2': 119, 'layer3': 346}. Best is trial 55 with value: 0.9322110061695005.
Klebsiella_Pneumoniae | DirectMulti | Optuna:  65%|██████▌   | 130/200 [2:56:11<1:14:49, 64.14s/it, best=0.932]Klebsiella_Pneumoniae | DirectMulti | Optuna:  65%|██████▌   | 130/200 [2:56:11<1:14:49, 64.14s/it, best=0.932][I 2026-03-05 02:58:00,622] Trial 120 finished with value: 0.8266554749761902 and parameters: {'activation': 'relu', 'solver': 'adam', 'lr': 2.711595994363398e-06, 'layer1': 414, 'layer2': 431, 'layer3': 359}. Best is trial 71 with value: 0.8659155749694897.
Pseudomonas_Aeruginosa | DirectMulti | Optuna:  60%|██████    | 121/200 [3:03:54<1:41:07, 76.81s/it, best=0.866]Pseudomonas_Aeruginosa | DirectMulti | Optuna:  60%|██████    | 121/200 [3:03:54<1:41:07, 76.81s/it, best=0.866][I 2026-03-05 02:59:34,881] Trial 130 finished with value: 0.9311073006322446 and parameters: {'activation': 'tanh', 'solver': 'adam', 'lr': 3.3254954739768496e-05, 'layer1': 117, 'layer2': 103, 'layer3': 352}. Best is trial 55 with value: 0.9322110061695005.
Klebsiella_Pneumoniae | DirectMulti | Optuna:  66%|██████▌   | 131/200 [2:58:07<1:31:36, 79.66s/it, best=0.932]Klebsiella_Pneumoniae | DirectMulti | Optuna:  66%|██████▌   | 131/200 [2:58:07<1:31:36, 79.66s/it, best=0.932][I 2026-03-05 02:59:40,846] Trial 132 finished with value: 0.8619567333634462 and parameters: {'activation': 'relu', 'solver': 'adam', 'lr': 1.8758395486292684e-05, 'layer1': 387, 'layer2': 49, 'layer3': 486}. Best is trial 73 with value: 0.864893646817533.
Escherichia_Coli | LPS | Optuna:  66%|██████▋   | 133/200 [7:01:22<5:08:26, 276.22s/it, best=0.865]Escherichia_Coli | LPS | Optuna:  66%|██████▋   | 133/200 [7:01:22<5:08:26, 276.22s/it, best=0.865][I 2026-03-05 03:00:20,521] Trial 121 finished with value: 0.8611509058360622 and parameters: {'activation': 'relu', 'solver': 'adam', 'lr': 0.003267218785239734, 'layer1': 472, 'layer2': 422, 'layer3': 290}. Best is trial 71 with value: 0.8659155749694897.
Pseudomonas_Aeruginosa | DirectMulti | Optuna:  61%|██████    | 122/200 [3:06:14<2:04:27, 95.73s/it, best=0.866]Pseudomonas_Aeruginosa | DirectMulti | Optuna:  61%|██████    | 122/200 [3:06:14<2:04:27, 95.73s/it, best=0.866][I 2026-03-05 03:01:16,683] Trial 131 finished with value: 0.9313695171161799 and parameters: {'activation': 'tanh', 'solver': 'adam', 'lr': 6.583443300518819e-05, 'layer1': 109, 'layer2': 28, 'layer3': 282}. Best is trial 55 with value: 0.9322110061695005.
Klebsiella_Pneumoniae | DirectMulti | Optuna:  66%|██████▌   | 132/200 [2:59:48<1:37:48, 86.30s/it, best=0.932]Klebsiella_Pneumoniae | DirectMulti | Optuna:  66%|██████▌   | 132/200 [2:59:48<1:37:48, 86.30s/it, best=0.932][I 2026-03-05 03:02:05,082] Trial 122 finished with value: 0.8605097572874751 and parameters: {'activation': 'relu', 'solver': 'adam', 'lr': 0.0034225667520410836, 'layer1': 464, 'layer2': 396, 'layer3': 338}. Best is trial 71 with value: 0.8659155749694897.
