Klebsiella_Pneumoniae | DirectMulti | Optuna:  95%|█████████▌| 190/200 [4:17:43<12:06, 72.61s/it, best=0.933]Klebsiella_Pneumoniae | DirectMulti | Optuna:  95%|█████████▌| 190/200 [4:17:43<12:06, 72.61s/it, best=0.933][I 2026-03-05 04:19:31,251] Trial 81 finished with value: 0.891807495651636 and parameters: {'activation': 'identity', 'solver': 'adam', 'lr': 1.0165151526005744e-05, 'layer1': 362, 'layer2': 353, 'layer3': 62}. Best is trial 62 with value: 0.8933826282053527.
Staphylococcus_Aureus | DirectMulti | Optuna:  41%|████      | 82/200 [3:44:48<9:16:14, 282.84s/it, best=0.893]Staphylococcus_Aureus | DirectMulti | Optuna:  41%|████      | 82/200 [3:44:48<9:16:14, 282.84s/it, best=0.893][I 2026-03-05 04:19:42,771] Trial 167 finished with value: 0.8263400360029971 and parameters: {'activation': 'relu', 'solver': 'sgd', 'lr': 0.004371532863211069, 'layer1': 500, 'layer2': 369, 'layer3': 390}. Best is trial 161 with value: 0.8669185742695007.
Pseudomonas_Aeruginosa | DirectMulti | Optuna:  84%|████████▍ | 168/200 [4:25:36<56:34, 106.06s/it, best=0.867]  Pseudomonas_Aeruginosa | DirectMulti | Optuna:  84%|████████▍ | 168/200 [4:25:36<56:34, 106.06s/it, best=0.867][I 2026-03-05 04:20:16,280] Trial 190 finished with value: 0.9309597677184552 and parameters: {'activation': 'tanh', 'solver': 'adam', 'lr': 0.00011531401662143311, 'layer1': 36, 'layer2': 61, 'layer3': 290}. Best is trial 177 with value: 0.9327253118571418.
Klebsiella_Pneumoniae | DirectMulti | Optuna:  96%|█████████▌| 191/200 [4:18:48<10:32, 70.29s/it, best=0.933]Klebsiella_Pneumoniae | DirectMulti | Optuna:  96%|█████████▌| 191/200 [4:18:48<10:32, 70.29s/it, best=0.933][I 2026-03-05 04:21:24,669] Trial 191 finished with value: 0.9318342183385895 and parameters: {'activation': 'tanh', 'solver': 'adam', 'lr': 8.801016696288702e-05, 'layer1': 48, 'layer2': 79, 'layer3': 296}. Best is trial 177 with value: 0.9327253118571418.
Klebsiella_Pneumoniae | DirectMulti | Optuna:  96%|█████████▌| 192/200 [4:19:56<09:17, 69.72s/it, best=0.933]Klebsiella_Pneumoniae | DirectMulti | Optuna:  96%|█████████▌| 192/200 [4:19:56<09:17, 69.72s/it, best=0.933][I 2026-03-05 04:21:37,742] Trial 168 finished with value: 0.8651233076356402 and parameters: {'activation': 'relu', 'solver': 'adam', 'lr': 0.003721605781843351, 'layer1': 448, 'layer2': 406, 'layer3': 345}. Best is trial 161 with value: 0.8669185742695007.
Pseudomonas_Aeruginosa | DirectMulti | Optuna:  84%|████████▍ | 169/200 [4:27:31<56:10, 108.74s/it, best=0.867]Pseudomonas_Aeruginosa | DirectMulti | Optuna:  84%|████████▍ | 169/200 [4:27:31<56:10, 108.74s/it, best=0.867][I 2026-03-05 04:22:35,009] Trial 192 finished with value: 0.9315141131505393 and parameters: {'activation': 'tanh', 'solver': 'adam', 'lr': 9.116351371799698e-05, 'layer1': 49, 'layer2': 80, 'layer3': 281}. Best is trial 177 with value: 0.9327253118571418.
Klebsiella_Pneumoniae | DirectMulti | Optuna:  96%|█████████▋| 193/200 [4:21:07<08:09, 69.91s/it, best=0.933]Klebsiella_Pneumoniae | DirectMulti | Optuna:  96%|█████████▋| 193/200 [4:21:07<08:09, 69.91s/it, best=0.933][I 2026-03-05 04:22:47,628] Trial 169 finished with value: 0.8261898244308833 and parameters: {'activation': 'tanh', 'solver': 'adam', 'lr': 0.0066539442258970035, 'layer1': 459, 'layer2': 403, 'layer3': 359}. Best is trial 161 with value: 0.8669185742695007.
Pseudomonas_Aeruginosa | DirectMulti | Optuna:  85%|████████▌ | 170/200 [4:28:41<48:32, 97.08s/it, best=0.867] Pseudomonas_Aeruginosa | DirectMulti | Optuna:  85%|████████▌ | 170/200 [4:28:41<48:32, 97.08s/it, best=0.867][I 2026-03-05 04:23:36,054] Trial 149 finished with value: 0.8646847215034971 and parameters: {'activation': 'relu', 'solver': 'adam', 'lr': 4.358142169531646e-05, 'layer1': 479, 'layer2': 23, 'layer3': 489}. Best is trial 139 with value: 0.8649329422529497.
Escherichia_Coli | LPS | Optuna:  75%|███████▌  | 150/200 [8:25:18<4:03:46, 292.54s/it, best=0.865]Escherichia_Coli | LPS | Optuna:  75%|███████▌  | 150/200 [8:25:18<4:03:46, 292.54s/it, best=0.865][I 2026-03-05 04:24:00,890] Trial 193 finished with value: 0.9312415374585692 and parameters: {'activation': 'tanh', 'solver': 'adam', 'lr': 7.584885352981011e-05, 'layer1': 77, 'layer2': 94, 'layer3': 299}. Best is trial 177 with value: 0.9327253118571418.
Klebsiella_Pneumoniae | DirectMulti | Optuna:  97%|█████████▋| 194/200 [4:22:33<07:28, 74.70s/it, best=0.933]Klebsiella_Pneumoniae | DirectMulti | Optuna:  97%|█████████▋| 194/200 [4:22:33<07:28, 74.70s/it, best=0.933][I 2026-03-05 04:24:29,293] Trial 82 finished with value: 0.8920376813816789 and parameters: {'activation': 'identity', 'solver': 'adam', 'lr': 1.5284752566346962e-05, 'layer1': 387, 'layer2': 394, 'layer3': 99}. Best is trial 62 with value: 0.8933826282053527.
Staphylococcus_Aureus | DirectMulti | Optuna:  42%|████▏     | 83/200 [3:49:46<9:20:25, 287.40s/it, best=0.893]Staphylococcus_Aureus | DirectMulti | Optuna:  42%|████▏     | 83/200 [3:49:46<9:20:25, 287.40s/it, best=0.893][I 2026-03-05 04:24:49,820] Trial 170 finished with value: 0.8575788832294309 and parameters: {'activation': 'relu', 'solver': 'adam', 'lr': 0.00856067278639637, 'layer1': 485, 'layer2': 477, 'layer3': 332}. Best is trial 161 with value: 0.8669185742695007.
Pseudomonas_Aeruginosa | DirectMulti | Optuna:  86%|████████▌ | 171/200 [4:30:43<50:33, 104.61s/it, best=0.867]Pseudomonas_Aeruginosa | DirectMulti | Optuna:  86%|████████▌ | 171/200 [4:30:43<50:33, 104.61s/it, best=0.867][I 2026-03-05 04:25:04,862] Trial 194 finished with value: 0.931448468297806 and parameters: {'activation': 'tanh', 'solver': 'adam', 'lr': 0.00015335273304717626, 'layer1': 62, 'layer2': 67, 'layer3': 241}. Best is trial 177 with value: 0.9327253118571418.
Klebsiella_Pneumoniae | DirectMulti | Optuna:  98%|█████████▊| 195/200 [4:23:36<05:57, 71.48s/it, best=0.933]Klebsiella_Pneumoniae | DirectMulti | Optuna:  98%|█████████▊| 195/200 [4:23:36<05:57, 71.48s/it, best=0.933][I 2026-03-05 04:26:07,744] Trial 195 finished with value: 0.9312651954642494 and parameters: {'activation': 'tanh', 'solver': 'adam', 'lr': 0.0001283568528737085, 'layer1': 50, 'layer2': 45, 'layer3': 294}. Best is trial 177 with value: 0.9327253118571418.
Klebsiella_Pneumoniae | DirectMulti | Optuna:  98%|█████████▊| 196/200 [4:24:39<04:35, 68.90s/it, best=0.933]Klebsiella_Pneumoniae | DirectMulti | Optuna:  98%|█████████▊| 196/200 [4:24:39<04:35, 68.90s/it, best=0.933][I 2026-03-05 04:26:38,116] Trial 171 finished with value: 0.8633495835514055 and parameters: {'activation': 'relu', 'solver': 'adam', 'lr': 0.0038159186465311227, 'layer1': 447, 'layer2': 381, 'layer3': 345}. Best is trial 161 with value: 0.8669185742695007.
Pseudomonas_Aeruginosa | DirectMulti | Optuna:  86%|████████▌ | 172/200 [4:32:32<49:20, 105.72s/it, best=0.867]Pseudomonas_Aeruginosa | DirectMulti | Optuna:  86%|████████▌ | 172/200 [4:32:32<49:20, 105.72s/it, best=0.867][I 2026-03-05 04:27:16,553] Trial 196 finished with value: 0.9322668560420302 and parameters: {'activation': 'tanh', 'solver': 'adam', 'lr': 9.26575982704848e-05, 'layer1': 85, 'layer2': 85, 'layer3': 284}. Best is trial 177 with value: 0.9327253118571418.
Klebsiella_Pneumoniae | DirectMulti | Optuna:  98%|█████████▊| 197/200 [4:25:48<03:26, 68.87s/it, best=0.933]Klebsiella_Pneumoniae | DirectMulti | Optuna:  98%|█████████▊| 197/200 [4:25:48<03:26, 68.87s/it, best=0.933][I 2026-03-05 04:27:25,252] Trial 150 finished with value: 0.8631015013708453 and parameters: {'activation': 'relu', 'solver': 'adam', 'lr': 4.044154670194934e-05, 'layer1': 475, 'layer2': 26, 'layer3': 489}. Best is trial 139 with value: 0.8649329422529497.
Escherichia_Coli | LPS | Optuna:  76%|███████▌  | 151/200 [8:29:07<3:43:23, 273.53s/it, best=0.865]Escherichia_Coli | LPS | Optuna:  76%|███████▌  | 151/200 [8:29:07<3:43:23, 273.53s/it, best=0.865][I 2026-03-05 04:28:07,163] Trial 197 finished with value: 0.7879021917597229 and parameters: {'activation': 'logistic', 'solver': 'adam', 'lr': 1.7549203848008046e-06, 'layer1': 91, 'layer2': 97, 'layer3': 273}. Best is trial 177 with value: 0.9327253118571418.
Klebsiella_Pneumoniae | DirectMulti | Optuna:  99%|█████████▉| 198/200 [4:26:39<02:06, 63.39s/it, best=0.933]Klebsiella_Pneumoniae | DirectMulti | Optuna:  99%|█████████▉| 198/200 [4:26:39<02:06, 63.39s/it, best=0.933][I 2026-03-05 04:28:22,956] Trial 172 finished with value: 0.8602057767150459 and parameters: {'activation': 'relu', 'solver': 'adam', 'lr': 0.0034221509001492074, 'layer1': 449, 'layer2': 418, 'layer3': 345}. Best is trial 161 with value: 0.8669185742695007.
Pseudomonas_Aeruginosa | DirectMulti | Optuna:  86%|████████▋ | 173/200 [4:34:17<47:27, 105.46s/it, best=0.867]Pseudomonas_Aeruginosa | DirectMulti | Optuna:  86%|████████▋ | 173/200 [4:34:17<47:27, 105.46s/it, best=0.867][I 2026-03-05 04:28:49,356] Trial 198 finished with value: 0.929166406612684 and parameters: {'activation': 'tanh', 'solver': 'adam', 'lr': 0.0015399304481421112, 'layer1': 80, 'layer2': 90, 'layer3': 259}. Best is trial 177 with value: 0.9327253118571418.
Klebsiella_Pneumoniae | DirectMulti | Optuna: 100%|█████████▉| 199/200 [4:27:21<00:57, 57.03s/it, best=0.933]Klebsiella_Pneumoniae | DirectMulti | Optuna: 100%|█████████▉| 199/200 [4:27:21<00:57, 57.03s/it, best=0.933][I 2026-03-05 04:30:04,566] Trial 199 finished with value: 0.9320535558003475 and parameters: {'activation': 'tanh', 'solver': 'adam', 'lr': 7.214678174375393e-05, 'layer1': 70, 'layer2': 71, 'layer3': 327}. Best is trial 177 with value: 0.9327253118571418.
Klebsiella_Pneumoniae | DirectMulti | Optuna: 100%|██████████| 200/200 [4:28:36<00:00, 62.49s/it, best=0.933]Klebsiella_Pneumoniae | DirectMulti | Optuna: 100%|██████████| 200/200 [4:28:36<00:00, 62.49s/it, best=0.933]                                                                                                             [Klebsiella_Pneumoniae | DirectMulti] [OPTUNA DONE] Best CV WF1=0.9327 | params={'activation': 'tanh', 'solver': 'adam', 'lr': 9.459131060843723e-05, 'layer1': 75, 'layer2': 90, 'layer3': 318}
[Klebsiella_Pneumoniae | DirectMulti] Retraining with validation early stopping (10% split)...
[I 2026-03-05 04:30:09,615] Trial 173 finished with value: 0.8637621881896915 and parameters: {'activation': 'relu', 'solver': 'adam', 'lr': 0.0052522001481456505, 'layer1': 466, 'layer2': 334, 'layer3': 411}. Best is trial 161 with value: 0.8669185742695007.
Pseudomonas_Aeruginosa | DirectMulti | Optuna:  87%|████████▋ | 174/200 [4:36:03<45:51, 105.82s/it, best=0.867]Pseudomonas_Aeruginosa | DirectMulti | Optuna:  87%|████████▋ | 174/200 [4:36:03<45:51, 105.82s/it, best=0.867][Klebsiella_Pneumoniae | DirectMulti] Testing...
[Klebsiella_Pneumoniae | DirectMulti] [TEST] WF1=0.9307 | ACC=0.9392 | HL=0.0608 | best_val_WF1=0.9374

[END] Species: Klebsiella_Pneumoniae done.
[Parallel(n_jobs=5)]: Done   1 tasks      | elapsed: 512.0min
[I 2026-03-05 04:31:26,826] Trial 83 finished with value: 0.891537945757342 and parameters: {'activation': 'identity', 'solver': 'adam', 'lr': 7.082774145321016e-06, 'layer1': 297, 'layer2': 332, 'layer3': 103}. Best is trial 62 with value: 0.8933826282053527.
Staphylococcus_Aureus | DirectMulti | Optuna:  42%|████▏     | 84/200 [3:56:44<10:31:06, 326.44s/it, best=0.893]Staphylococcus_Aureus | DirectMulti | Optuna:  42%|████▏     | 84/200 [3:56:44<10:31:06, 326.44s/it, best=0.893][I 2026-03-05 04:31:55,259] Trial 151 finished with value: 0.8646836210887787 and parameters: {'activation': 'relu', 'solver': 'adam', 'lr': 3.12102633916047e-05, 'layer1': 482, 'layer2': 19, 'layer3': 484}. Best is trial 139 with value: 0.8649329422529497.
Escherichia_Coli | LPS | Optuna:  76%|███████▌  | 152/200 [8:33:37<3:37:58, 272.48s/it, best=0.865]Escherichia_Coli | LPS | Optuna:  76%|███████▌  | 152/200 [8:33:37<3:37:58, 272.48s/it, best=0.865][I 2026-03-05 04:32:02,387] Trial 174 finished with value: 0.8635377736204705 and parameters: {'activation': 'relu', 'solver': 'adam', 'lr': 0.005447033736395894, 'layer1': 469, 'layer2': 333, 'layer3': 414}. Best is trial 161 with value: 0.8669185742695007.
Pseudomonas_Aeruginosa | DirectMulti | Optuna:  88%|████████▊ | 175/200 [4:37:56<44:57, 107.90s/it, best=0.867]Pseudomonas_Aeruginosa | DirectMulti | Optuna:  88%|████████▊ | 175/200 [4:37:56<44:57, 107.90s/it, best=0.867][I 2026-03-05 04:33:57,520] Trial 175 finished with value: 0.8518400309167689 and parameters: {'activation': 'logistic', 'solver': 'adam', 'lr': 0.005021175667712654, 'layer1': 477, 'layer2': 318, 'layer3': 377}. Best is trial 161 with value: 0.8669185742695007.
Pseudomonas_Aeruginosa | DirectMulti | Optuna:  88%|████████▊ | 176/200 [4:39:51<44:01, 110.07s/it, best=0.867]Pseudomonas_Aeruginosa | DirectMulti | Optuna:  88%|████████▊ | 176/200 [4:39:51<44:01, 110.07s/it, best=0.867][I 2026-03-05 04:35:22,644] Trial 84 finished with value: 0.891382140403795 and parameters: {'activation': 'identity', 'solver': 'adam', 'lr': 1.7039850584440566e-05, 'layer1': 397, 'layer2': 382, 'layer3': 488}. Best is trial 62 with value: 0.8933826282053527.
Staphylococcus_Aureus | DirectMulti | Optuna:  42%|████▎     | 85/200 [4:00:40<9:33:34, 299.25s/it, best=0.893] Staphylococcus_Aureus | DirectMulti | Optuna:  42%|████▎     | 85/200 [4:00:40<9:33:34, 299.25s/it, best=0.893][I 2026-03-05 04:35:30,291] Trial 176 finished with value: 0.8617877538301606 and parameters: {'activation': 'relu', 'solver': 'adam', 'lr': 0.0030997672609964708, 'layer1': 462, 'layer2': 343, 'layer3': 407}. Best is trial 161 with value: 0.8669185742695007.
Pseudomonas_Aeruginosa | DirectMulti | Optuna:  88%|████████▊ | 177/200 [4:41:24<40:12, 104.88s/it, best=0.867]Pseudomonas_Aeruginosa | DirectMulti | Optuna:  88%|████████▊ | 177/200 [4:41:24<40:12, 104.88s/it, best=0.867][I 2026-03-05 04:35:45,223] Trial 152 finished with value: 0.864075277290655 and parameters: {'activation': 'relu', 'solver': 'adam', 'lr': 4.3256477280205674e-05, 'layer1': 480, 'layer2': 30, 'layer3': 484}. Best is trial 139 with value: 0.8649329422529497.
Escherichia_Coli | LPS | Optuna:  76%|███████▋  | 153/200 [8:37:27<3:23:26, 259.72s/it, best=0.865]Escherichia_Coli | LPS | Optuna:  76%|███████▋  | 153/200 [8:37:27<3:23:26, 259.72s/it, best=0.865][I 2026-03-05 04:36:59,487] Trial 177 finished with value: 0.8595396737731189 and parameters: {'activation': 'relu', 'solver': 'adam', 'lr': 0.006166593485829815, 'layer1': 439, 'layer2': 208, 'layer3': 310}. Best is trial 161 with value: 0.8669185742695007.
Pseudomonas_Aeruginosa | DirectMulti | Optuna:  89%|████████▉ | 178/200 [4:42:53<36:43, 100.18s/it, best=0.867]Pseudomonas_Aeruginosa | DirectMulti | Optuna:  89%|████████▉ | 178/200 [4:42:53<36:43, 100.18s/it, best=0.867][I 2026-03-05 04:38:26,134] Trial 178 finished with value: 0.8587479302667486 and parameters: {'activation': 'relu', 'solver': 'adam', 'lr': 0.0020643204835774343, 'layer1': 457, 'layer2': 356, 'layer3': 331}. Best is trial 161 with value: 0.8669185742695007.
Pseudomonas_Aeruginosa | DirectMulti | Optuna:  90%|████████▉ | 179/200 [4:44:20<33:38, 96.12s/it, best=0.867] Pseudomonas_Aeruginosa | DirectMulti | Optuna:  90%|████████▉ | 179/200 [4:44:20<33:38, 96.12s/it, best=0.867][I 2026-03-05 04:39:08,660] Trial 153 finished with value: 0.8630294675181048 and parameters: {'activation': 'relu', 'solver': 'adam', 'lr': 5.293747863747678e-05, 'layer1': 480, 'layer2': 20, 'layer3': 484}. Best is trial 139 with value: 0.8649329422529497.
Escherichia_Coli | LPS | Optuna:  77%|███████▋  | 154/200 [8:40:50<3:06:10, 242.84s/it, best=0.865]Escherichia_Coli | LPS | Optuna:  77%|███████▋  | 154/200 [8:40:50<3:06:10, 242.84s/it, best=0.865][I 2026-03-05 04:39:40,058] Trial 179 finished with value: 0.8554686707393765 and parameters: {'activation': 'identity', 'solver': 'adam', 'lr': 0.00975468644808853, 'layer1': 471, 'layer2': 88, 'layer3': 297}. Best is trial 161 with value: 0.8669185742695007.
Pseudomonas_Aeruginosa | DirectMulti | Optuna:  90%|█████████ | 180/200 [4:45:34<29:49, 89.46s/it, best=0.867]Pseudomonas_Aeruginosa | DirectMulti | Optuna:  90%|█████████ | 180/200 [4:45:34<29:49, 89.46s/it, best=0.867][I 2026-03-05 04:40:12,680] Trial 85 finished with value: 0.8914117674615767 and parameters: {'activation': 'identity', 'solver': 'adam', 'lr': 1.5023060613783585e-05, 'layer1': 423, 'layer2': 395, 'layer3': 145}. Best is trial 62 with value: 0.8933826282053527.
Staphylococcus_Aureus | DirectMulti | Optuna:  43%|████▎     | 86/200 [4:05:30<9:23:19, 296.49s/it, best=0.893]Staphylococcus_Aureus | DirectMulti | Optuna:  43%|████▎     | 86/200 [4:05:30<9:23:19, 296.49s/it, best=0.893][I 2026-03-05 04:41:01,134] Trial 180 finished with value: 0.8606355802970775 and parameters: {'activation': 'relu', 'solver': 'adam', 'lr': 0.004524539628017531, 'layer1': 353, 'layer2': 236, 'layer3': 404}. Best is trial 161 with value: 0.8669185742695007.
Pseudomonas_Aeruginosa | DirectMulti | Optuna:  90%|█████████ | 181/200 [4:46:55<27:31, 86.94s/it, best=0.867]Pseudomonas_Aeruginosa | DirectMulti | Optuna:  90%|█████████ | 181/200 [4:46:55<27:31, 86.94s/it, best=0.867][I 2026-03-05 04:42:07,677] Trial 86 finished with value: 0.8865286114390919 and parameters: {'activation': 'identity', 'solver': 'adam', 'lr': 0.008253700658679058, 'layer1': 451, 'layer2': 442, 'layer3': 83}. Best is trial 62 with value: 0.8933826282053527.
Staphylococcus_Aureus | DirectMulti | Optuna:  44%|████▎     | 87/200 [4:07:25<7:35:50, 242.04s/it, best=0.893]Staphylococcus_Aureus | DirectMulti | Optuna:  44%|████▎     | 87/200 [4:07:25<7:35:50, 242.04s/it, best=0.893][I 2026-03-05 04:42:50,234] Trial 181 finished with value: 0.8545731620706285 and parameters: {'activation': 'relu', 'solver': 'adam', 'lr': 0.007465042317886605, 'layer1': 468, 'layer2': 329, 'layer3': 431}. Best is trial 161 with value: 0.8669185742695007.
Pseudomonas_Aeruginosa | DirectMulti | Optuna:  91%|█████████ | 182/200 [4:48:44<28:04, 93.59s/it, best=0.867]Pseudomonas_Aeruginosa | DirectMulti | Optuna:  91%|█████████ | 182/200 [4:48:44<28:04, 93.59s/it, best=0.867][I 2026-03-05 04:43:09,653] Trial 154 finished with value: 0.8626615870917178 and parameters: {'activation': 'relu', 'solver': 'adam', 'lr': 4.28815164926534e-05, 'layer1': 487, 'layer2': 30, 'layer3': 469}. Best is trial 139 with value: 0.8649329422529497.
Escherichia_Coli | LPS | Optuna:  78%|███████▊  | 155/200 [8:44:51<3:01:42, 242.28s/it, best=0.865]Escherichia_Coli | LPS | Optuna:  78%|███████▊  | 155/200 [8:44:51<3:01:42, 242.28s/it, best=0.865][I 2026-03-05 04:44:37,755] Trial 182 finished with value: 0.8638499943858502 and parameters: {'activation': 'relu', 'solver': 'adam', 'lr': 0.003838703635057387, 'layer1': 464, 'layer2': 346, 'layer3': 415}. Best is trial 161 with value: 0.8669185742695007.
Pseudomonas_Aeruginosa | DirectMulti | Optuna:  92%|█████████▏| 183/200 [4:50:31<27:42, 97.77s/it, best=0.867]Pseudomonas_Aeruginosa | DirectMulti | Optuna:  92%|█████████▏| 183/200 [4:50:31<27:42, 97.77s/it, best=0.867][I 2026-03-05 04:44:41,337] Trial 87 finished with value: 0.8037073814622993 and parameters: {'activation': 'identity', 'solver': 'sgd', 'lr': 2.7187297704417378e-05, 'layer1': 494, 'layer2': 361, 'layer3': 126}. Best is trial 62 with value: 0.8933826282053527.
Staphylococcus_Aureus | DirectMulti | Optuna:  44%|████▍     | 88/200 [4:09:58<6:42:18, 215.53s/it, best=0.893]Staphylococcus_Aureus | DirectMulti | Optuna:  44%|████▍     | 88/200 [4:09:58<6:42:18, 215.53s/it, best=0.893][I 2026-03-05 04:46:28,193] Trial 183 finished with value: 0.8581177821252689 and parameters: {'activation': 'relu', 'solver': 'adam', 'lr': 0.0028371414209355183, 'layer1': 483, 'layer2': 346, 'layer3': 397}. Best is trial 161 with value: 0.8669185742695007.
Pseudomonas_Aeruginosa | DirectMulti | Optuna:  92%|█████████▏| 184/200 [4:52:22<27:05, 101.57s/it, best=0.867]Pseudomonas_Aeruginosa | DirectMulti | Optuna:  92%|█████████▏| 184/200 [4:52:22<27:05, 101.57s/it, best=0.867][I 2026-03-05 04:47:00,842] Trial 88 finished with value: 0.8912974534074621 and parameters: {'activation': 'identity', 'solver': 'adam', 'lr': 4.2245254624050434e-05, 'layer1': 336, 'layer2': 310, 'layer3': 93}. Best is trial 62 with value: 0.8933826282053527.
Staphylococcus_Aureus | DirectMulti | Optuna:  44%|████▍     | 89/200 [4:12:18<5:56:31, 192.72s/it, best=0.893]Staphylococcus_Aureus | DirectMulti | Optuna:  44%|████▍     | 89/200 [4:12:18<5:56:31, 192.72s/it, best=0.893][I 2026-03-05 04:47:39,734] Trial 155 finished with value: 0.8634607721040306 and parameters: {'activation': 'relu', 'solver': 'adam', 'lr': 2.3290344975043522e-05, 'layer1': 465, 'layer2': 20, 'layer3': 498}. Best is trial 139 with value: 0.8649329422529497.
Escherichia_Coli | LPS | Optuna:  78%|███████▊  | 156/200 [8:49:21<3:03:47, 250.62s/it, best=0.865]Escherichia_Coli | LPS | Optuna:  78%|███████▊  | 156/200 [8:49:21<3:03:47, 250.62s/it, best=0.865][I 2026-03-05 04:48:17,645] Trial 184 finished with value: 0.8653452873886245 and parameters: {'activation': 'relu', 'solver': 'adam', 'lr': 0.0037833213739375004, 'layer1': 452, 'layer2': 363, 'layer3': 419}. Best is trial 161 with value: 0.8669185742695007.
Pseudomonas_Aeruginosa | DirectMulti | Optuna:  92%|█████████▎| 185/200 [4:54:11<25:59, 103.93s/it, best=0.867]Pseudomonas_Aeruginosa | DirectMulti | Optuna:  92%|█████████▎| 185/200 [4:54:11<25:59, 103.93s/it, best=0.867][I 2026-03-05 04:48:31,603] Trial 89 finished with value: 0.804282919936189 and parameters: {'activation': 'logistic', 'solver': 'adam', 'lr': 5.221272652137767e-06, 'layer1': 365, 'layer2': 337, 'layer3': 112}. Best is trial 62 with value: 0.8933826282053527.
