Staphylococcus_Aureus | DirectMulti | Optuna:  66%|██████▌   | 132/200 [6:07:19<1:45:53, 93.43s/it, best=0.893]Staphylococcus_Aureus | DirectMulti | Optuna:  66%|██████▌   | 132/200 [6:07:19<1:45:53, 93.43s/it, best=0.893][I 2026-03-05 06:44:51,663] Trial 132 finished with value: 0.8914000606159626 and parameters: {'activation': 'identity', 'solver': 'adam', 'lr': 1.8524461869841063e-05, 'layer1': 349, 'layer2': 398, 'layer3': 57}. Best is trial 102 with value: 0.8935277328516141.
Staphylococcus_Aureus | DirectMulti | Optuna:  66%|██████▋   | 133/200 [6:10:09<2:09:50, 116.28s/it, best=0.893]Staphylococcus_Aureus | DirectMulti | Optuna:  66%|██████▋   | 133/200 [6:10:09<2:09:50, 116.28s/it, best=0.893][I 2026-03-05 06:48:00,828] Trial 189 finished with value: 0.8627637202198633 and parameters: {'activation': 'relu', 'solver': 'adam', 'lr': 1.2014525068764843e-05, 'layer1': 473, 'layer2': 10, 'layer3': 474}. Best is trial 169 with value: 0.8650159865951903.
Escherichia_Coli | LPS | Optuna:  95%|█████████▌| 190/200 [10:49:42<39:20, 236.01s/it, best=0.865]Escherichia_Coli | LPS | Optuna:  95%|█████████▌| 190/200 [10:49:42<39:20, 236.01s/it, best=0.865][I 2026-03-05 06:49:10,681] Trial 133 finished with value: 0.8922179794269779 and parameters: {'activation': 'identity', 'solver': 'adam', 'lr': 1.1101623443883476e-05, 'layer1': 396, 'layer2': 343, 'layer3': 42}. Best is trial 102 with value: 0.8935277328516141.
Staphylococcus_Aureus | DirectMulti | Optuna:  67%|██████▋   | 134/200 [6:14:28<2:55:00, 159.10s/it, best=0.893]Staphylococcus_Aureus | DirectMulti | Optuna:  67%|██████▋   | 134/200 [6:14:28<2:55:00, 159.10s/it, best=0.893][I 2026-03-05 06:51:07,974] Trial 190 finished with value: 0.8637539644138623 and parameters: {'activation': 'relu', 'solver': 'adam', 'lr': 3.485799841963415e-05, 'layer1': 483, 'layer2': 29, 'layer3': 494}. Best is trial 169 with value: 0.8650159865951903.
Escherichia_Coli | LPS | Optuna:  96%|█████████▌| 191/200 [10:52:50<33:12, 221.35s/it, best=0.865]Escherichia_Coli | LPS | Optuna:  96%|█████████▌| 191/200 [10:52:50<33:12, 221.35s/it, best=0.865][I 2026-03-05 06:51:52,312] Trial 134 finished with value: 0.890905457967172 and parameters: {'activation': 'identity', 'solver': 'adam', 'lr': 2.262727776683087e-05, 'layer1': 326, 'layer2': 426, 'layer3': 77}. Best is trial 102 with value: 0.8935277328516141.
Staphylococcus_Aureus | DirectMulti | Optuna:  68%|██████▊   | 135/200 [6:17:09<2:53:11, 159.86s/it, best=0.893]Staphylococcus_Aureus | DirectMulti | Optuna:  68%|██████▊   | 135/200 [6:17:09<2:53:11, 159.86s/it, best=0.893][I 2026-03-05 06:54:18,845] Trial 191 finished with value: 0.8633847102616832 and parameters: {'activation': 'relu', 'solver': 'adam', 'lr': 3.512257041811323e-05, 'layer1': 486, 'layer2': 31, 'layer3': 493}. Best is trial 169 with value: 0.8650159865951903.
Escherichia_Coli | LPS | Optuna:  96%|█████████▌| 192/200 [10:56:00<28:17, 212.21s/it, best=0.865]Escherichia_Coli | LPS | Optuna:  96%|█████████▌| 192/200 [10:56:00<28:17, 212.21s/it, best=0.865][I 2026-03-05 06:54:21,066] Trial 135 finished with value: 0.8920323542843682 and parameters: {'activation': 'identity', 'solver': 'adam', 'lr': 2.8424067057343962e-05, 'layer1': 381, 'layer2': 371, 'layer3': 56}. Best is trial 102 with value: 0.8935277328516141.
Staphylococcus_Aureus | DirectMulti | Optuna:  68%|██████▊   | 136/200 [6:19:38<2:46:57, 156.53s/it, best=0.893]Staphylococcus_Aureus | DirectMulti | Optuna:  68%|██████▊   | 136/200 [6:19:38<2:46:57, 156.53s/it, best=0.893][I 2026-03-05 06:57:33,912] Trial 192 finished with value: 0.8640250059201101 and parameters: {'activation': 'relu', 'solver': 'adam', 'lr': 2.8137127412889062e-05, 'layer1': 481, 'layer2': 22, 'layer3': 481}. Best is trial 169 with value: 0.8650159865951903.
Escherichia_Coli | LPS | Optuna:  96%|█████████▋| 193/200 [10:59:15<24:09, 207.06s/it, best=0.865]Escherichia_Coli | LPS | Optuna:  96%|█████████▋| 193/200 [10:59:15<24:09, 207.06s/it, best=0.865][I 2026-03-05 06:58:37,736] Trial 136 finished with value: 0.8921684723745578 and parameters: {'activation': 'identity', 'solver': 'adam', 'lr': 1.2759851121021073e-05, 'layer1': 440, 'layer2': 462, 'layer3': 41}. Best is trial 102 with value: 0.8935277328516141.
Staphylococcus_Aureus | DirectMulti | Optuna:  68%|██████▊   | 137/200 [6:23:55<3:15:54, 186.57s/it, best=0.893]Staphylococcus_Aureus | DirectMulti | Optuna:  68%|██████▊   | 137/200 [6:23:55<3:15:54, 186.57s/it, best=0.893][I 2026-03-05 07:00:20,901] Trial 137 finished with value: 0.8924228836813185 and parameters: {'activation': 'identity', 'solver': 'adam', 'lr': 4.649286658088349e-05, 'layer1': 337, 'layer2': 391, 'layer3': 117}. Best is trial 102 with value: 0.8935277328516141.
Staphylococcus_Aureus | DirectMulti | Optuna:  69%|██████▉   | 138/200 [6:25:38<2:46:56, 161.55s/it, best=0.893]Staphylococcus_Aureus | DirectMulti | Optuna:  69%|██████▉   | 138/200 [6:25:38<2:46:56, 161.55s/it, best=0.893][I 2026-03-05 07:00:38,422] Trial 193 finished with value: 0.8628729156408553 and parameters: {'activation': 'relu', 'solver': 'adam', 'lr': 4.017975009479433e-05, 'layer1': 492, 'layer2': 19, 'layer3': 467}. Best is trial 169 with value: 0.8650159865951903.
Escherichia_Coli | LPS | Optuna:  97%|█████████▋| 194/200 [11:02:20<20:01, 200.30s/it, best=0.865]Escherichia_Coli | LPS | Optuna:  97%|█████████▋| 194/200 [11:02:20<20:01, 200.30s/it, best=0.865][I 2026-03-05 07:02:23,340] Trial 138 finished with value: 0.8918804383951164 and parameters: {'activation': 'identity', 'solver': 'adam', 'lr': 4.895655015877476e-05, 'layer1': 489, 'layer2': 386, 'layer3': 66}. Best is trial 102 with value: 0.8935277328516141.
Staphylococcus_Aureus | DirectMulti | Optuna:  70%|██████▉   | 139/200 [6:27:40<2:32:18, 149.82s/it, best=0.893]Staphylococcus_Aureus | DirectMulti | Optuna:  70%|██████▉   | 139/200 [6:27:40<2:32:18, 149.82s/it, best=0.893][I 2026-03-05 07:03:32,353] Trial 139 finished with value: 0.8915730053354656 and parameters: {'activation': 'identity', 'solver': 'adam', 'lr': 0.00012771556943291096, 'layer1': 336, 'layer2': 413, 'layer3': 133}. Best is trial 102 with value: 0.8935277328516141.
Staphylococcus_Aureus | DirectMulti | Optuna:  70%|███████   | 140/200 [6:28:49<2:05:34, 125.58s/it, best=0.893]Staphylococcus_Aureus | DirectMulti | Optuna:  70%|███████   | 140/200 [6:28:49<2:05:34, 125.58s/it, best=0.893][I 2026-03-05 07:04:29,035] Trial 194 finished with value: 0.8654959734403287 and parameters: {'activation': 'relu', 'solver': 'adam', 'lr': 2.4378878006413237e-05, 'layer1': 481, 'layer2': 24, 'layer3': 500}. Best is trial 194 with value: 0.8654959734403287.
Escherichia_Coli | LPS | Optuna:  98%|█████████▊| 195/200 [11:06:11<17:26, 209.39s/it, best=0.865]Escherichia_Coli | LPS | Optuna:  98%|█████████▊| 195/200 [11:06:11<17:26, 209.39s/it, best=0.866][I 2026-03-05 07:05:28,667] Trial 140 finished with value: 0.8917495804733179 and parameters: {'activation': 'identity', 'solver': 'adam', 'lr': 3.354768851249904e-05, 'layer1': 308, 'layer2': 362, 'layer3': 151}. Best is trial 102 with value: 0.8935277328516141.
Staphylococcus_Aureus | DirectMulti | Optuna:  70%|███████   | 141/200 [6:30:46<2:00:45, 122.80s/it, best=0.893]Staphylococcus_Aureus | DirectMulti | Optuna:  70%|███████   | 141/200 [6:30:46<2:00:45, 122.80s/it, best=0.893][I 2026-03-05 07:08:07,287] Trial 195 finished with value: 0.8625293188127812 and parameters: {'activation': 'relu', 'solver': 'adam', 'lr': 2.2277961569780228e-05, 'layer1': 478, 'layer2': 26, 'layer3': 499}. Best is trial 194 with value: 0.8654959734403287.
Escherichia_Coli | LPS | Optuna:  98%|█████████▊| 196/200 [11:09:49<14:08, 212.05s/it, best=0.866]Escherichia_Coli | LPS | Optuna:  98%|█████████▊| 196/200 [11:09:49<14:08, 212.05s/it, best=0.866][I 2026-03-05 07:08:25,528] Trial 141 finished with value: 0.892843550779211 and parameters: {'activation': 'identity', 'solver': 'adam', 'lr': 1.6654505421151444e-05, 'layer1': 356, 'layer2': 439, 'layer3': 90}. Best is trial 102 with value: 0.8935277328516141.
Staphylococcus_Aureus | DirectMulti | Optuna:  71%|███████   | 142/200 [6:33:43<2:14:22, 139.02s/it, best=0.893]Staphylococcus_Aureus | DirectMulti | Optuna:  71%|███████   | 142/200 [6:33:43<2:14:22, 139.02s/it, best=0.893][I 2026-03-05 07:10:52,260] Trial 196 finished with value: 0.8614939613432547 and parameters: {'activation': 'identity', 'solver': 'adam', 'lr': 2.6677215789929307e-05, 'layer1': 482, 'layer2': 17, 'layer3': 479}. Best is trial 194 with value: 0.8654959734403287.
Escherichia_Coli | LPS | Optuna:  98%|█████████▊| 197/200 [11:12:34<09:53, 197.93s/it, best=0.866]Escherichia_Coli | LPS | Optuna:  98%|█████████▊| 197/200 [11:12:34<09:53, 197.93s/it, best=0.866][I 2026-03-05 07:11:17,806] Trial 142 finished with value: 0.8925534835957674 and parameters: {'activation': 'identity', 'solver': 'adam', 'lr': 1.7462280163323357e-05, 'layer1': 359, 'layer2': 437, 'layer3': 94}. Best is trial 102 with value: 0.8935277328516141.
Staphylococcus_Aureus | DirectMulti | Optuna:  72%|███████▏  | 143/200 [6:36:35<2:21:32, 148.99s/it, best=0.893]Staphylococcus_Aureus | DirectMulti | Optuna:  72%|███████▏  | 143/200 [6:36:35<2:21:32, 148.99s/it, best=0.893][I 2026-03-05 07:13:31,738] Trial 143 finished with value: 0.8924069746044678 and parameters: {'activation': 'identity', 'solver': 'adam', 'lr': 2.4411071183192737e-05, 'layer1': 359, 'layer2': 392, 'layer3': 93}. Best is trial 102 with value: 0.8935277328516141.
Staphylococcus_Aureus | DirectMulti | Optuna:  72%|███████▏  | 144/200 [6:38:49<2:14:50, 144.48s/it, best=0.893]Staphylococcus_Aureus | DirectMulti | Optuna:  72%|███████▏  | 144/200 [6:38:49<2:14:50, 144.48s/it, best=0.893][I 2026-03-05 07:14:51,472] Trial 197 finished with value: 0.862465498077585 and parameters: {'activation': 'relu', 'solver': 'adam', 'lr': 1.8373582897607327e-05, 'layer1': 471, 'layer2': 34, 'layer3': 500}. Best is trial 194 with value: 0.8654959734403287.
Escherichia_Coli | LPS | Optuna:  99%|█████████▉| 198/200 [11:16:33<07:00, 210.31s/it, best=0.866]Escherichia_Coli | LPS | Optuna:  99%|█████████▉| 198/200 [11:16:33<07:00, 210.31s/it, best=0.866][I 2026-03-05 07:16:27,752] Trial 144 finished with value: 0.8921204985469633 and parameters: {'activation': 'identity', 'solver': 'adam', 'lr': 1.639032178776222e-05, 'layer1': 351, 'layer2': 439, 'layer3': 114}. Best is trial 102 with value: 0.8935277328516141.
Staphylococcus_Aureus | DirectMulti | Optuna:  72%|███████▎  | 145/200 [6:41:45<2:21:06, 153.94s/it, best=0.893]Staphylococcus_Aureus | DirectMulti | Optuna:  72%|███████▎  | 145/200 [6:41:45<2:21:06, 153.94s/it, best=0.893][I 2026-03-05 07:18:14,428] Trial 145 finished with value: 0.8915633239573493 and parameters: {'activation': 'identity', 'solver': 'adam', 'lr': 4.111814308260686e-05, 'layer1': 344, 'layer2': 374, 'layer3': 68}. Best is trial 102 with value: 0.8935277328516141.
Staphylococcus_Aureus | DirectMulti | Optuna:  73%|███████▎  | 146/200 [6:43:32<2:05:46, 139.76s/it, best=0.893]Staphylococcus_Aureus | DirectMulti | Optuna:  73%|███████▎  | 146/200 [6:43:32<2:05:46, 139.76s/it, best=0.893][I 2026-03-05 07:18:23,620] Trial 198 finished with value: 0.8612518493525124 and parameters: {'activation': 'relu', 'solver': 'adam', 'lr': 1.413280158382896e-05, 'layer1': 206, 'layer2': 24, 'layer3': 479}. Best is trial 194 with value: 0.8654959734403287.
Escherichia_Coli | LPS | Optuna: 100%|█████████▉| 199/200 [11:20:05<03:30, 210.86s/it, best=0.866]Escherichia_Coli | LPS | Optuna: 100%|█████████▉| 199/200 [11:20:05<03:30, 210.86s/it, best=0.866][I 2026-03-05 07:20:18,183] Trial 146 finished with value: 0.8915336176525741 and parameters: {'activation': 'identity', 'solver': 'adam', 'lr': 3.050156482746764e-05, 'layer1': 370, 'layer2': 415, 'layer3': 99}. Best is trial 102 with value: 0.8935277328516141.
Staphylococcus_Aureus | DirectMulti | Optuna:  74%|███████▎  | 147/200 [6:45:35<1:59:12, 134.96s/it, best=0.893]Staphylococcus_Aureus | DirectMulti | Optuna:  74%|███████▎  | 147/200 [6:45:35<1:59:12, 134.96s/it, best=0.893][I 2026-03-05 07:21:45,712] Trial 199 finished with value: 0.86316035282046 and parameters: {'activation': 'relu', 'solver': 'adam', 'lr': 2.8418634152489446e-05, 'layer1': 500, 'layer2': 41, 'layer3': 487}. Best is trial 194 with value: 0.8654959734403287.
Escherichia_Coli | LPS | Optuna: 100%|██████████| 200/200 [11:23:27<00:00, 208.23s/it, best=0.866]Escherichia_Coli | LPS | Optuna: 100%|██████████| 200/200 [11:23:27<00:00, 208.23s/it, best=0.866]                                                                                                  [Escherichia_Coli | LPS] [OPTUNA DONE] Best CV WF1=0.8655 | params={'activation': 'relu', 'solver': 'adam', 'lr': 2.4378878006413237e-05, 'layer1': 481, 'layer2': 24, 'layer3': 500}
[Escherichia_Coli | LPS] Retraining with validation early stopping (10% split)...
[Escherichia_Coli | LPS] Testing...
[Escherichia_Coli | LPS] [TEST] WF1=0.8518 | ACC=0.8677 | HL=0.1323 | best_val_WF1=0.8761

[Escherichia_Coli] ===== Direct multilabel training =====
[I 2026-03-05 07:22:40,463] A new study created in memory with name: no-name-75070a40-16a6-48fe-a721-d98242ce9224
Escherichia_Coli | DirectMulti | Optuna:   0%|          | 0/200 [00:00<?, ?it/s][I 2026-03-05 07:23:39,434] Trial 0 finished with value: 0.47931339261696654 and parameters: {'activation': 'logistic', 'solver': 'sgd', 'lr': 1.7073967431528114e-06, 'layer1': 435, 'layer2': 305, 'layer3': 357}. Best is trial 0 with value: 0.47931339261696654.
Escherichia_Coli | DirectMulti | Optuna:   0%|          | 1/200 [00:58<3:15:35, 58.97s/it]Escherichia_Coli | DirectMulti | Optuna:   0%|          | 1/200 [00:58<3:15:35, 58.97s/it, best=0.479][I 2026-03-05 07:23:53,486] Trial 147 finished with value: 0.8018655425920114 and parameters: {'activation': 'identity', 'solver': 'sgd', 'lr': 8.485264957304431e-06, 'layer1': 318, 'layer2': 318, 'layer3': 302}. Best is trial 102 with value: 0.8935277328516141.
Staphylococcus_Aureus | DirectMulti | Optuna:  74%|███████▍  | 148/200 [6:49:11<2:17:51, 159.06s/it, best=0.893]Staphylococcus_Aureus | DirectMulti | Optuna:  74%|███████▍  | 148/200 [6:49:11<2:17:51, 159.06s/it, best=0.893][I 2026-03-05 07:24:39,200] Trial 1 finished with value: 0.7388067228206201 and parameters: {'activation': 'logistic', 'solver': 'adam', 'lr': 1.6480446427978994e-05, 'layer1': 267, 'layer2': 222, 'layer3': 152}. Best is trial 1 with value: 0.7388067228206201.
Escherichia_Coli | DirectMulti | Optuna:   1%|          | 2/200 [01:58<3:16:08, 59.44s/it, best=0.479]Escherichia_Coli | DirectMulti | Optuna:   1%|          | 2/200 [01:58<3:16:08, 59.44s/it, best=0.739][I 2026-03-05 07:26:21,372] Trial 148 finished with value: 0.8910847267072632 and parameters: {'activation': 'identity', 'solver': 'adam', 'lr': 2.1547325398542203e-05, 'layer1': 358, 'layer2': 448, 'layer3': 89}. Best is trial 102 with value: 0.8935277328516141.
Staphylococcus_Aureus | DirectMulti | Optuna:  74%|███████▍  | 149/200 [6:51:39<2:12:21, 155.71s/it, best=0.893]Staphylococcus_Aureus | DirectMulti | Optuna:  74%|███████▍  | 149/200 [6:51:39<2:12:21, 155.71s/it, best=0.893][I 2026-03-05 07:27:53,646] Trial 149 finished with value: 0.8920080650195276 and parameters: {'activation': 'tanh', 'solver': 'adam', 'lr': 6.507670917097731e-05, 'layer1': 332, 'layer2': 402, 'layer3': 73}. Best is trial 102 with value: 0.8935277328516141.
Staphylococcus_Aureus | DirectMulti | Optuna:  75%|███████▌  | 150/200 [6:53:11<1:53:53, 136.68s/it, best=0.893]Staphylococcus_Aureus | DirectMulti | Optuna:  75%|███████▌  | 150/200 [6:53:11<1:53:53, 136.68s/it, best=0.893][I 2026-03-05 07:28:01,877] Trial 2 finished with value: 0.8373764361023331 and parameters: {'activation': 'identity', 'solver': 'adam', 'lr': 6.290644294586145e-06, 'layer1': 262, 'layer2': 300, 'layer3': 32}. Best is trial 2 with value: 0.8373764361023331.
Escherichia_Coli | DirectMulti | Optuna:   2%|▏         | 3/200 [05:21<6:49:54, 124.84s/it, best=0.739]Escherichia_Coli | DirectMulti | Optuna:   2%|▏         | 3/200 [05:21<6:49:54, 124.84s/it, best=0.837][I 2026-03-05 07:29:28,050] Trial 150 finished with value: 0.8920169588768182 and parameters: {'activation': 'identity', 'solver': 'adam', 'lr': 5.355913699207249e-05, 'layer1': 367, 'layer2': 431, 'layer3': 21}. Best is trial 102 with value: 0.8935277328516141.
Staphylococcus_Aureus | DirectMulti | Optuna:  76%|███████▌  | 151/200 [6:54:45<1:41:15, 124.00s/it, best=0.893]Staphylococcus_Aureus | DirectMulti | Optuna:  76%|███████▌  | 151/200 [6:54:45<1:41:15, 124.00s/it, best=0.893][I 2026-03-05 07:31:27,644] Trial 3 finished with value: 0.5563914358025019 and parameters: {'activation': 'relu', 'solver': 'sgd', 'lr': 1.6536937182824424e-05, 'layer1': 57, 'layer2': 345, 'layer3': 226}. Best is trial 2 with value: 0.8373764361023331.
Escherichia_Coli | DirectMulti | Optuna:   2%|▏         | 4/200 [08:47<8:32:11, 156.79s/it, best=0.837]Escherichia_Coli | DirectMulti | Optuna:   2%|▏         | 4/200 [08:47<8:32:11, 156.79s/it, best=0.837][I 2026-03-05 07:31:34,269] Trial 151 finished with value: 0.8925878021134788 and parameters: {'activation': 'identity', 'solver': 'adam', 'lr': 2.549612793241869e-05, 'layer1': 354, 'layer2': 386, 'layer3': 84}. Best is trial 102 with value: 0.8935277328516141.
Staphylococcus_Aureus | DirectMulti | Optuna:  76%|███████▌  | 152/200 [6:56:51<1:39:43, 124.66s/it, best=0.893]Staphylococcus_Aureus | DirectMulti | Optuna:  76%|███████▌  | 152/200 [6:56:51<1:39:43, 124.66s/it, best=0.893][I 2026-03-05 07:33:53,874] Trial 4 finished with value: 0.8622713495192522 and parameters: {'activation': 'relu', 'solver': 'adam', 'lr': 1.7654048052495086e-05, 'layer1': 265, 'layer2': 278, 'layer3': 100}. Best is trial 4 with value: 0.8622713495192522.
Escherichia_Coli | DirectMulti | Optuna:   2%|▎         | 5/200 [11:13<8:17:11, 152.98s/it, best=0.837]Escherichia_Coli | DirectMulti | Optuna:   2%|▎         | 5/200 [11:13<8:17:11, 152.98s/it, best=0.862][I 2026-03-05 07:34:28,169] Trial 152 finished with value: 0.8922722473350101 and parameters: {'activation': 'identity', 'solver': 'adam', 'lr': 1.7682489219885032e-05, 'layer1': 343, 'layer2': 380, 'layer3': 85}. Best is trial 102 with value: 0.8935277328516141.
Staphylococcus_Aureus | DirectMulti | Optuna:  76%|███████▋  | 153/200 [6:59:45<1:49:13, 139.43s/it, best=0.893]Staphylococcus_Aureus | DirectMulti | Optuna:  76%|███████▋  | 153/200 [6:59:45<1:49:13, 139.43s/it, best=0.893][I 2026-03-05 07:34:36,281] Trial 5 finished with value: 0.7411553805964445 and parameters: {'activation': 'identity', 'solver': 'adam', 'lr': 2.259279742015697e-06, 'layer1': 106, 'layer2': 32, 'layer3': 169}. Best is trial 4 with value: 0.8622713495192522.
Escherichia_Coli | DirectMulti | Optuna:   3%|▎         | 6/200 [11:55<6:13:05, 115.39s/it, best=0.862]Escherichia_Coli | DirectMulti | Optuna:   3%|▎         | 6/200 [11:55<6:13:05, 115.39s/it, best=0.862][I 2026-03-05 07:35:49,174] Trial 6 finished with value: 0.7391145700389147 and parameters: {'activation': 'tanh', 'solver': 'adam', 'lr': 3.6618192203924288e-06, 'layer1': 403, 'layer2': 46, 'layer3': 494}. Best is trial 4 with value: 0.8622713495192522.
Escherichia_Coli | DirectMulti | Optuna:   4%|▎         | 7/200 [13:08<5:26:28, 101.49s/it, best=0.862]Escherichia_Coli | DirectMulti | Optuna:   4%|▎         | 7/200 [13:08<5:26:28, 101.49s/it, best=0.862][I 2026-03-05 07:36:28,595] Trial 7 finished with value: 0.8578151159702234 and parameters: {'activation': 'relu', 'solver': 'adam', 'lr': 0.0012164139351417069, 'layer1': 46, 'layer2': 186, 'layer3': 66}. Best is trial 4 with value: 0.8622713495192522.
Escherichia_Coli | DirectMulti | Optuna:   4%|▍         | 8/200 [13:48<4:21:32, 81.73s/it, best=0.862] Escherichia_Coli | DirectMulti | Optuna:   4%|▍         | 8/200 [13:48<4:21:32, 81.73s/it, best=0.862][I 2026-03-05 07:36:58,434] Trial 153 finished with value: 0.8936680613721473 and parameters: {'activation': 'identity', 'solver': 'adam', 'lr': 2.7646086843997938e-05, 'layer1': 385, 'layer2': 421, 'layer3': 58}. Best is trial 153 with value: 0.8936680613721473.
Staphylococcus_Aureus | DirectMulti | Optuna:  77%|███████▋  | 154/200 [7:02:16<1:49:23, 142.68s/it, best=0.893]Staphylococcus_Aureus | DirectMulti | Optuna:  77%|███████▋  | 154/200 [7:02:16<1:49:23, 142.68s/it, best=0.894][I 2026-03-05 07:37:37,533] Trial 8 finished with value: 0.8550649198041725 and parameters: {'activation': 'identity', 'solver': 'adam', 'lr': 0.000828752236376816, 'layer1': 323, 'layer2': 445, 'layer3': 241}. Best is trial 4 with value: 0.8622713495192522.
Escherichia_Coli | DirectMulti | Optuna:   4%|▍         | 9/200 [14:57<4:07:27, 77.73s/it, best=0.862]Escherichia_Coli | DirectMulti | Optuna:   4%|▍         | 9/200 [14:57<4:07:27, 77.73s/it, best=0.862][I 2026-03-05 07:38:53,396] Trial 9 finished with value: 0.7428027935749112 and parameters: {'activation': 'tanh', 'solver': 'sgd', 'lr': 0.00012329098365270507, 'layer1': 219, 'layer2': 22, 'layer3': 62}. Best is trial 4 with value: 0.8622713495192522.
Escherichia_Coli | DirectMulti | Optuna:   5%|▌         | 10/200 [16:12<4:04:19, 77.16s/it, best=0.862]Escherichia_Coli | DirectMulti | Optuna:   5%|▌         | 10/200 [16:12<4:04:19, 77.16s/it, best=0.862][I 2026-03-05 07:39:27,531] Trial 154 finished with value: 0.8921994895159624 and parameters: {'activation': 'identity', 'solver': 'adam', 'lr': 2.6569614852985687e-05, 'layer1': 381, 'layer2': 423, 'layer3': 50}. Best is trial 153 with value: 0.8936680613721473.
