Escherichia_Coli | DirectMulti | Optuna:  50%|█████     | 101/200 [3:58:29<3:31:56, 128.45s/it, best=0.864]Escherichia_Coli | DirectMulti | Optuna:  50%|█████     | 101/200 [3:58:29<3:31:56, 128.45s/it, best=0.864][I 2026-03-05 11:23:20,450] Trial 101 finished with value: 0.7882627750340626 and parameters: {'activation': 'tanh', 'solver': 'adam', 'lr': 8.681452228390002e-06, 'layer1': 453, 'layer2': 133, 'layer3': 61}. Best is trial 82 with value: 0.8640917047043644.
Escherichia_Coli | DirectMulti | Optuna:  51%|█████     | 102/200 [4:00:39<3:30:54, 129.12s/it, best=0.864]Escherichia_Coli | DirectMulti | Optuna:  51%|█████     | 102/200 [4:00:40<3:30:54, 129.12s/it, best=0.864][I 2026-03-05 11:25:31,238] Trial 102 finished with value: 0.8628369213466062 and parameters: {'activation': 'tanh', 'solver': 'adam', 'lr': 1.220657788136822e-05, 'layer1': 358, 'layer2': 475, 'layer3': 334}. Best is trial 82 with value: 0.8640917047043644.
Escherichia_Coli | DirectMulti | Optuna:  52%|█████▏    | 103/200 [4:02:50<3:29:33, 129.62s/it, best=0.864]Escherichia_Coli | DirectMulti | Optuna:  52%|█████▏    | 103/200 [4:02:50<3:29:33, 129.62s/it, best=0.864][I 2026-03-05 11:27:45,789] Trial 103 finished with value: 0.8634338117109779 and parameters: {'activation': 'tanh', 'solver': 'adam', 'lr': 2.6852792790215576e-05, 'layer1': 401, 'layer2': 423, 'layer3': 33}. Best is trial 82 with value: 0.8640917047043644.
Escherichia_Coli | DirectMulti | Optuna:  52%|█████▏    | 104/200 [4:05:05<3:29:45, 131.10s/it, best=0.864]Escherichia_Coli | DirectMulti | Optuna:  52%|█████▏    | 104/200 [4:05:05<3:29:45, 131.10s/it, best=0.864][I 2026-03-05 11:29:58,377] Trial 104 finished with value: 0.8633215903986811 and parameters: {'activation': 'tanh', 'solver': 'adam', 'lr': 2.764516299035868e-05, 'layer1': 422, 'layer2': 418, 'layer3': 35}. Best is trial 82 with value: 0.8640917047043644.
Escherichia_Coli | DirectMulti | Optuna:  52%|█████▎    | 105/200 [4:07:17<3:28:17, 131.55s/it, best=0.864]Escherichia_Coli | DirectMulti | Optuna:  52%|█████▎    | 105/200 [4:07:17<3:28:17, 131.55s/it, best=0.864][I 2026-03-05 11:31:38,883] Trial 105 finished with value: 0.8114075577406716 and parameters: {'activation': 'tanh', 'solver': 'adam', 'lr': 0.0017637726683144917, 'layer1': 401, 'layer2': 425, 'layer3': 25}. Best is trial 82 with value: 0.8640917047043644.
Escherichia_Coli | DirectMulti | Optuna:  53%|█████▎    | 106/200 [4:08:58<3:11:30, 122.23s/it, best=0.864]Escherichia_Coli | DirectMulti | Optuna:  53%|█████▎    | 106/200 [4:08:58<3:11:30, 122.23s/it, best=0.864][I 2026-03-05 11:34:06,140] Trial 106 finished with value: 0.8646284220353448 and parameters: {'activation': 'tanh', 'solver': 'adam', 'lr': 1.7708879893278444e-05, 'layer1': 477, 'layer2': 456, 'layer3': 73}. Best is trial 106 with value: 0.8646284220353448.
Escherichia_Coli | DirectMulti | Optuna:  54%|█████▎    | 107/200 [4:11:25<3:21:05, 129.74s/it, best=0.864]Escherichia_Coli | DirectMulti | Optuna:  54%|█████▎    | 107/200 [4:11:25<3:21:05, 129.74s/it, best=0.865][I 2026-03-05 11:36:35,801] Trial 107 finished with value: 0.8637494644359519 and parameters: {'activation': 'tanh', 'solver': 'adam', 'lr': 1.6818302372196462e-05, 'layer1': 477, 'layer2': 454, 'layer3': 68}. Best is trial 106 with value: 0.8646284220353448.
Escherichia_Coli | DirectMulti | Optuna:  54%|█████▍    | 108/200 [4:13:55<3:28:06, 135.72s/it, best=0.865]Escherichia_Coli | DirectMulti | Optuna:  54%|█████▍    | 108/200 [4:13:55<3:28:06, 135.72s/it, best=0.865][I 2026-03-05 11:39:17,703] Trial 108 finished with value: 0.8634020628079705 and parameters: {'activation': 'tanh', 'solver': 'adam', 'lr': 1.7478981989866207e-05, 'layer1': 500, 'layer2': 443, 'layer3': 72}. Best is trial 106 with value: 0.8646284220353448.
Escherichia_Coli | DirectMulti | Optuna:  55%|█████▍    | 109/200 [4:16:37<3:37:45, 143.57s/it, best=0.865]Escherichia_Coli | DirectMulti | Optuna:  55%|█████▍    | 109/200 [4:16:37<3:37:45, 143.57s/it, best=0.865][I 2026-03-05 11:42:13,267] Trial 109 finished with value: 0.8630073915967603 and parameters: {'activation': 'tanh', 'solver': 'adam', 'lr': 1.3481551064963758e-05, 'layer1': 477, 'layer2': 456, 'layer3': 94}. Best is trial 106 with value: 0.8646284220353448.
Escherichia_Coli | DirectMulti | Optuna:  55%|█████▌    | 110/200 [4:19:32<3:49:45, 153.17s/it, best=0.865]Escherichia_Coli | DirectMulti | Optuna:  55%|█████▌    | 110/200 [4:19:32<3:49:45, 153.17s/it, best=0.865][I 2026-03-05 11:44:37,373] Trial 110 finished with value: 0.8620686992064861 and parameters: {'activation': 'relu', 'solver': 'adam', 'lr': 2.3257815722077157e-05, 'layer1': 462, 'layer2': 377, 'layer3': 63}. Best is trial 106 with value: 0.8646284220353448.
Escherichia_Coli | DirectMulti | Optuna:  56%|█████▌    | 111/200 [4:21:56<3:43:10, 150.45s/it, best=0.865]Escherichia_Coli | DirectMulti | Optuna:  56%|█████▌    | 111/200 [4:21:56<3:43:10, 150.45s/it, best=0.865][I 2026-03-05 11:46:34,725] Trial 111 finished with value: 0.8635198973001519 and parameters: {'activation': 'tanh', 'solver': 'adam', 'lr': 3.641674587946064e-05, 'layer1': 476, 'layer2': 489, 'layer3': 44}. Best is trial 106 with value: 0.8646284220353448.
Escherichia_Coli | DirectMulti | Optuna:  56%|█████▌    | 112/200 [4:23:54<3:26:05, 140.52s/it, best=0.865]Escherichia_Coli | DirectMulti | Optuna:  56%|█████▌    | 112/200 [4:23:54<3:26:05, 140.52s/it, best=0.865][I 2026-03-05 11:48:35,423] Trial 112 finished with value: 0.8638925695129931 and parameters: {'activation': 'tanh', 'solver': 'adam', 'lr': 3.513976591189339e-05, 'layer1': 493, 'layer2': 467, 'layer3': 42}. Best is trial 106 with value: 0.8646284220353448.
Escherichia_Coli | DirectMulti | Optuna:  56%|█████▋    | 113/200 [4:25:54<3:15:07, 134.57s/it, best=0.865]Escherichia_Coli | DirectMulti | Optuna:  56%|█████▋    | 113/200 [4:25:54<3:15:07, 134.57s/it, best=0.865][I 2026-03-05 11:50:28,949] Trial 113 finished with value: 0.861903713046966 and parameters: {'activation': 'tanh', 'solver': 'adam', 'lr': 5.628884385295403e-05, 'layer1': 478, 'layer2': 467, 'layer3': 21}. Best is trial 106 with value: 0.8646284220353448.
Escherichia_Coli | DirectMulti | Optuna:  57%|█████▋    | 114/200 [4:27:48<3:03:50, 128.26s/it, best=0.865]Escherichia_Coli | DirectMulti | Optuna:  57%|█████▋    | 114/200 [4:27:48<3:03:50, 128.26s/it, best=0.865][I 2026-03-05 11:52:26,166] Trial 114 finished with value: 0.8638182869752192 and parameters: {'activation': 'tanh', 'solver': 'adam', 'lr': 3.822526668518115e-05, 'layer1': 490, 'layer2': 487, 'layer3': 83}. Best is trial 106 with value: 0.8646284220353448.
Escherichia_Coli | DirectMulti | Optuna:  57%|█████▊    | 115/200 [4:29:45<2:57:00, 124.95s/it, best=0.865]Escherichia_Coli | DirectMulti | Optuna:  57%|█████▊    | 115/200 [4:29:45<2:57:00, 124.95s/it, best=0.865][I 2026-03-05 11:54:55,590] Trial 115 finished with value: 0.8627031405387144 and parameters: {'activation': 'tanh', 'solver': 'adam', 'lr': 1.7720523931282622e-05, 'layer1': 491, 'layer2': 481, 'layer3': 76}. Best is trial 106 with value: 0.8646284220353448.
Escherichia_Coli | DirectMulti | Optuna:  58%|█████▊    | 116/200 [4:32:15<3:05:12, 132.29s/it, best=0.865]Escherichia_Coli | DirectMulti | Optuna:  58%|█████▊    | 116/200 [4:32:15<3:05:12, 132.29s/it, best=0.865][I 2026-03-05 11:57:51,997] Trial 116 finished with value: 0.8632347832512499 and parameters: {'activation': 'tanh', 'solver': 'adam', 'lr': 1.0252732497330948e-05, 'layer1': 453, 'layer2': 454, 'layer3': 86}. Best is trial 106 with value: 0.8646284220353448.
Escherichia_Coli | DirectMulti | Optuna:  58%|█████▊    | 117/200 [4:35:11<3:21:18, 145.53s/it, best=0.865]Escherichia_Coli | DirectMulti | Optuna:  58%|█████▊    | 117/200 [4:35:11<3:21:18, 145.53s/it, best=0.865][I 2026-03-05 11:59:34,816] Trial 117 finished with value: 0.862645953403225 and parameters: {'activation': 'tanh', 'solver': 'adam', 'lr': 4.18959678103604e-05, 'layer1': 490, 'layer2': 473, 'layer3': 126}. Best is trial 106 with value: 0.8646284220353448.
Escherichia_Coli | DirectMulti | Optuna:  59%|█████▉    | 118/200 [4:36:54<3:01:22, 132.71s/it, best=0.865]Escherichia_Coli | DirectMulti | Optuna:  59%|█████▉    | 118/200 [4:36:54<3:01:22, 132.71s/it, best=0.865][I 2026-03-05 12:02:07,224] Trial 118 finished with value: 0.8622146262222273 and parameters: {'activation': 'tanh', 'solver': 'adam', 'lr': 1.2552506550593234e-05, 'layer1': 462, 'layer2': 460, 'layer3': 136}. Best is trial 106 with value: 0.8646284220353448.
Escherichia_Coli | DirectMulti | Optuna:  60%|█████▉    | 119/200 [4:39:26<3:07:08, 138.62s/it, best=0.865]Escherichia_Coli | DirectMulti | Optuna:  60%|█████▉    | 119/200 [4:39:26<3:07:08, 138.62s/it, best=0.865][I 2026-03-05 12:04:14,459] Trial 119 finished with value: 0.8632390638872881 and parameters: {'activation': 'tanh', 'solver': 'adam', 'lr': 2.268533861921443e-05, 'layer1': 439, 'layer2': 491, 'layer3': 59}. Best is trial 106 with value: 0.8646284220353448.
Escherichia_Coli | DirectMulti | Optuna:  60%|██████    | 120/200 [4:41:33<3:00:16, 135.21s/it, best=0.865]Escherichia_Coli | DirectMulti | Optuna:  60%|██████    | 120/200 [4:41:33<3:00:16, 135.21s/it, best=0.865][I 2026-03-05 12:05:09,908] Trial 120 finished with value: 0.46858165659106915 and parameters: {'activation': 'logistic', 'solver': 'sgd', 'lr': 1.517878334968397e-05, 'layer1': 491, 'layer2': 470, 'layer3': 71}. Best is trial 106 with value: 0.8646284220353448.
Escherichia_Coli | DirectMulti | Optuna:  60%|██████    | 121/200 [4:42:29<2:26:31, 111.28s/it, best=0.865]Escherichia_Coli | DirectMulti | Optuna:  60%|██████    | 121/200 [4:42:29<2:26:31, 111.28s/it, best=0.865][I 2026-03-05 12:07:10,155] Trial 121 finished with value: 0.8643819348330242 and parameters: {'activation': 'tanh', 'solver': 'adam', 'lr': 3.4997437563457205e-05, 'layer1': 477, 'layer2': 488, 'layer3': 42}. Best is trial 106 with value: 0.8646284220353448.
Escherichia_Coli | DirectMulti | Optuna:  61%|██████    | 122/200 [4:44:29<2:28:09, 113.97s/it, best=0.865]Escherichia_Coli | DirectMulti | Optuna:  61%|██████    | 122/200 [4:44:29<2:28:09, 113.97s/it, best=0.865][I 2026-03-05 12:09:09,271] Trial 122 finished with value: 0.8623155943863179 and parameters: {'activation': 'tanh', 'solver': 'adam', 'lr': 3.409236154208673e-05, 'layer1': 476, 'layer2': 478, 'layer3': 48}. Best is trial 106 with value: 0.8646284220353448.
Escherichia_Coli | DirectMulti | Optuna:  62%|██████▏   | 123/200 [4:46:28<2:28:14, 115.51s/it, best=0.865]Escherichia_Coli | DirectMulti | Optuna:  62%|██████▏   | 123/200 [4:46:28<2:28:14, 115.51s/it, best=0.865][I 2026-03-05 12:11:38,190] Trial 123 finished with value: 0.8612735142555941 and parameters: {'activation': 'tanh', 'solver': 'adam', 'lr': 1.9156856616629505e-05, 'layer1': 484, 'layer2': 449, 'layer3': 34}. Best is trial 106 with value: 0.8646284220353448.
Escherichia_Coli | DirectMulti | Optuna:  62%|██████▏   | 124/200 [4:48:57<2:39:00, 125.53s/it, best=0.865]Escherichia_Coli | DirectMulti | Optuna:  62%|██████▏   | 124/200 [4:48:57<2:39:00, 125.53s/it, best=0.865][I 2026-03-05 12:13:26,566] Trial 124 finished with value: 0.8630374430298609 and parameters: {'activation': 'tanh', 'solver': 'adam', 'lr': 4.616752792969624e-05, 'layer1': 466, 'layer2': 485, 'layer3': 66}. Best is trial 106 with value: 0.8646284220353448.
Escherichia_Coli | DirectMulti | Optuna:  62%|██████▎   | 125/200 [4:50:46<2:30:29, 120.39s/it, best=0.865]Escherichia_Coli | DirectMulti | Optuna:  62%|██████▎   | 125/200 [4:50:46<2:30:29, 120.39s/it, best=0.865][I 2026-03-05 12:15:00,851] Trial 125 finished with value: 0.8638951111441393 and parameters: {'activation': 'tanh', 'solver': 'adam', 'lr': 5.977080971790865e-05, 'layer1': 449, 'layer2': 466, 'layer3': 98}. Best is trial 106 with value: 0.8646284220353448.
Escherichia_Coli | DirectMulti | Optuna:  63%|██████▎   | 126/200 [4:52:20<2:18:49, 112.56s/it, best=0.865]Escherichia_Coli | DirectMulti | Optuna:  63%|██████▎   | 126/200 [4:52:20<2:18:49, 112.56s/it, best=0.865][I 2026-03-05 12:16:23,237] Trial 126 finished with value: 0.8635754932256571 and parameters: {'activation': 'tanh', 'solver': 'adam', 'lr': 7.68042579953818e-05, 'layer1': 432, 'layer2': 463, 'layer3': 102}. Best is trial 106 with value: 0.8646284220353448.
Escherichia_Coli | DirectMulti | Optuna:  64%|██████▎   | 127/200 [4:53:42<2:05:55, 103.51s/it, best=0.865]Escherichia_Coli | DirectMulti | Optuna:  64%|██████▎   | 127/200 [4:53:42<2:05:55, 103.51s/it, best=0.865][I 2026-03-05 12:17:52,762] Trial 127 finished with value: 0.8631796830709915 and parameters: {'activation': 'tanh', 'solver': 'adam', 'lr': 6.731951952779364e-05, 'layer1': 446, 'layer2': 433, 'layer3': 94}. Best is trial 106 with value: 0.8646284220353448.
Escherichia_Coli | DirectMulti | Optuna:  64%|██████▍   | 128/200 [4:55:12<1:59:10, 99.31s/it, best=0.865] Escherichia_Coli | DirectMulti | Optuna:  64%|██████▍   | 128/200 [4:55:12<1:59:10, 99.31s/it, best=0.865][I 2026-03-05 12:19:18,329] Trial 128 finished with value: 0.8623647289774199 and parameters: {'activation': 'tanh', 'solver': 'adam', 'lr': 8.055480066763286e-05, 'layer1': 452, 'layer2': 465, 'layer3': 104}. Best is trial 106 with value: 0.8646284220353448.
Escherichia_Coli | DirectMulti | Optuna:  64%|██████▍   | 129/200 [4:56:37<1:52:38, 95.19s/it, best=0.865]Escherichia_Coli | DirectMulti | Optuna:  64%|██████▍   | 129/200 [4:56:37<1:52:38, 95.19s/it, best=0.865][I 2026-03-05 12:20:47,878] Trial 129 finished with value: 0.8637705043621373 and parameters: {'activation': 'tanh', 'solver': 'adam', 'lr': 6.23370592607153e-05, 'layer1': 431, 'layer2': 456, 'layer3': 85}. Best is trial 106 with value: 0.8646284220353448.
Escherichia_Coli | DirectMulti | Optuna:  65%|██████▌   | 130/200 [4:58:07<1:49:04, 93.50s/it, best=0.865]Escherichia_Coli | DirectMulti | Optuna:  65%|██████▌   | 130/200 [4:58:07<1:49:04, 93.50s/it, best=0.865][I 2026-03-05 12:22:16,899] Trial 130 finished with value: 0.86254290480991 and parameters: {'activation': 'tanh', 'solver': 'adam', 'lr': 5.470807229219576e-05, 'layer1': 409, 'layer2': 447, 'layer3': 79}. Best is trial 106 with value: 0.8646284220353448.
Escherichia_Coli | DirectMulti | Optuna:  66%|██████▌   | 131/200 [4:59:36<1:45:58, 92.15s/it, best=0.865]Escherichia_Coli | DirectMulti | Optuna:  66%|██████▌   | 131/200 [4:59:36<1:45:58, 92.15s/it, best=0.865][I 2026-03-05 12:23:50,140] Trial 131 finished with value: 0.8629227136263655 and parameters: {'activation': 'tanh', 'solver': 'adam', 'lr': 5.731806288840413e-05, 'layer1': 434, 'layer2': 459, 'layer3': 97}. Best is trial 106 with value: 0.8646284220353448.
Escherichia_Coli | DirectMulti | Optuna:  66%|██████▌   | 132/200 [5:01:09<1:44:48, 92.48s/it, best=0.865]Escherichia_Coli | DirectMulti | Optuna:  66%|██████▌   | 132/200 [5:01:09<1:44:48, 92.48s/it, best=0.865][I 2026-03-05 12:25:24,281] Trial 132 finished with value: 0.8634736953938823 and parameters: {'activation': 'tanh', 'solver': 'adam', 'lr': 3.775016996181635e-05, 'layer1': 416, 'layer2': 476, 'layer3': 85}. Best is trial 106 with value: 0.8646284220353448.
Escherichia_Coli | DirectMulti | Optuna:  66%|██████▋   | 133/200 [5:02:43<1:43:49, 92.98s/it, best=0.865]Escherichia_Coli | DirectMulti | Optuna:  66%|██████▋   | 133/200 [5:02:43<1:43:49, 92.98s/it, best=0.865][I 2026-03-05 12:26:51,743] Trial 133 finished with value: 0.863357910177809 and parameters: {'activation': 'tanh', 'solver': 'adam', 'lr': 9.222392947096127e-05, 'layer1': 457, 'layer2': 438, 'layer3': 108}. Best is trial 106 with value: 0.8646284220353448.
Escherichia_Coli | DirectMulti | Optuna:  67%|██████▋   | 134/200 [5:04:11<1:40:27, 91.32s/it, best=0.865]Escherichia_Coli | DirectMulti | Optuna:  67%|██████▋   | 134/200 [5:04:11<1:40:27, 91.32s/it, best=0.865][I 2026-03-05 12:28:18,106] Trial 134 finished with value: 0.8614160122415369 and parameters: {'activation': 'tanh', 'solver': 'adam', 'lr': 0.0001032839154521287, 'layer1': 467, 'layer2': 470, 'layer3': 119}. Best is trial 106 with value: 0.8646284220353448.
Escherichia_Coli | DirectMulti | Optuna:  68%|██████▊   | 135/200 [5:05:37<1:37:19, 89.84s/it, best=0.865]Escherichia_Coli | DirectMulti | Optuna:  68%|██████▊   | 135/200 [5:05:37<1:37:19, 89.84s/it, best=0.865][I 2026-03-05 12:29:50,184] Trial 135 finished with value: 0.8621418717758041 and parameters: {'activation': 'identity', 'solver': 'adam', 'lr': 4.617849734981641e-05, 'layer1': 445, 'layer2': 403, 'layer3': 69}. Best is trial 106 with value: 0.8646284220353448.
Escherichia_Coli | DirectMulti | Optuna:  68%|██████▊   | 136/200 [5:07:09<1:36:32, 90.51s/it, best=0.865]Escherichia_Coli | DirectMulti | Optuna:  68%|██████▊   | 136/200 [5:07:09<1:36:32, 90.51s/it, best=0.865][I 2026-03-05 12:31:53,955] Trial 136 finished with value: 0.8643868108561991 and parameters: {'activation': 'tanh', 'solver': 'adam', 'lr': 3.1877482369865534e-05, 'layer1': 477, 'layer2': 491, 'layer3': 54}. Best is trial 106 with value: 0.8646284220353448.
Escherichia_Coli | DirectMulti | Optuna:  68%|██████▊   | 137/200 [5:09:13<1:45:30, 100.49s/it, best=0.865]Escherichia_Coli | DirectMulti | Optuna:  68%|██████▊   | 137/200 [5:09:13<1:45:30, 100.49s/it, best=0.865][I 2026-03-05 12:33:53,877] Trial 137 finished with value: 0.8625370068004875 and parameters: {'activation': 'tanh', 'solver': 'adam', 'lr': 2.8158649128991208e-05, 'layer1': 482, 'layer2': 491, 'layer3': 58}. Best is trial 106 with value: 0.8646284220353448.
Escherichia_Coli | DirectMulti | Optuna:  69%|██████▉   | 138/200 [5:11:13<1:49:51, 106.32s/it, best=0.865]Escherichia_Coli | DirectMulti | Optuna:  69%|██████▉   | 138/200 [5:11:13<1:49:51, 106.32s/it, best=0.865][I 2026-03-05 12:36:12,676] Trial 138 finished with value: 0.8642589402594301 and parameters: {'activation': 'tanh', 'solver': 'adam', 'lr': 2.370934236128187e-05, 'layer1': 492, 'layer2': 492, 'layer3': 46}. Best is trial 106 with value: 0.8646284220353448.
Escherichia_Coli | DirectMulti | Optuna:  70%|██████▉   | 139/200 [5:13:32<1:57:59, 116.06s/it, best=0.865]Escherichia_Coli | DirectMulti | Optuna:  70%|██████▉   | 139/200 [5:13:32<1:57:59, 116.06s/it, best=0.865][I 2026-03-05 12:38:23,417] Trial 139 finished with value: 0.863410541243178 and parameters: {'activation': 'tanh', 'solver': 'adam', 'lr': 3.211313863739652e-05, 'layer1': 500, 'layer2': 499, 'layer3': 39}. Best is trial 106 with value: 0.8646284220353448.
Escherichia_Coli | DirectMulti | Optuna:  70%|███████   | 140/200 [5:15:42<2:00:27, 120.47s/it, best=0.865]Escherichia_Coli | DirectMulti | Optuna:  70%|███████   | 140/200 [5:15:42<2:00:27, 120.47s/it, best=0.865][I 2026-03-05 12:40:41,306] Trial 140 finished with value: 0.8619365167097103 and parameters: {'activation': 'tanh', 'solver': 'adam', 'lr': 2.297986307384177e-05, 'layer1': 474, 'layer2': 453, 'layer3': 46}. Best is trial 106 with value: 0.8646284220353448.
Escherichia_Coli | DirectMulti | Optuna:  70%|███████   | 141/200 [5:18:00<2:03:35, 125.69s/it, best=0.865]Escherichia_Coli | DirectMulti | Optuna:  70%|███████   | 141/200 [5:18:00<2:03:35, 125.69s/it, best=0.865][I 2026-03-05 12:42:42,536] Trial 141 finished with value: 0.8628324785062935 and parameters: {'activation': 'tanh', 'solver': 'adam', 'lr': 2.5577522111212357e-05, 'layer1': 488, 'layer2': 481, 'layer3': 54}. Best is trial 106 with value: 0.8646284220353448.
Escherichia_Coli | DirectMulti | Optuna:  71%|███████   | 142/200 [5:20:02<2:00:12, 124.35s/it, best=0.865]Escherichia_Coli | DirectMulti | Optuna:  71%|███████   | 142/200 [5:20:02<2:00:12, 124.35s/it, best=0.865][I 2026-03-05 12:44:33,164] Trial 142 finished with value: 0.8634550949590482 and parameters: {'activation': 'tanh', 'solver': 'adam', 'lr': 4.0937201567796875e-05, 'layer1': 462, 'layer2': 489, 'layer3': 79}. Best is trial 106 with value: 0.8646284220353448.
Escherichia_Coli | DirectMulti | Optuna:  72%|███████▏  | 143/200 [5:21:52<1:54:13, 120.24s/it, best=0.865]Escherichia_Coli | DirectMulti | Optuna:  72%|███████▏  | 143/200 [5:21:52<1:54:13, 120.24s/it, best=0.865][I 2026-03-05 12:46:21,109] Trial 143 finished with value: 0.8627715408479173 and parameters: {'activation': 'tanh', 'solver': 'adam', 'lr': 3.157051910854714e-05, 'layer1': 480, 'layer2': 476, 'layer3': 66}. Best is trial 106 with value: 0.8646284220353448.
Escherichia_Coli | DirectMulti | Optuna:  72%|███████▏  | 144/200 [5:23:40<1:48:46, 116.55s/it, best=0.865]Escherichia_Coli | DirectMulti | Optuna:  72%|███████▏  | 144/200 [5:23:40<1:48:46, 116.55s/it, best=0.865][I 2026-03-05 12:49:17,484] Trial 144 finished with value: 0.8617174187571308 and parameters: {'activation': 'tanh', 'solver': 'adam', 'lr': 1.8905899111114973e-05, 'layer1': 493, 'layer2': 492, 'layer3': 24}. Best is trial 106 with value: 0.8646284220353448.
Escherichia_Coli | DirectMulti | Optuna:  72%|███████▎  | 145/200 [5:26:37<2:03:17, 134.50s/it, best=0.865]Escherichia_Coli | DirectMulti | Optuna:  72%|███████▎  | 145/200 [5:26:37<2:03:17, 134.50s/it, best=0.865][I 2026-03-05 12:51:32,995] Trial 145 finished with value: 0.8627092981236897 and parameters: {'activation': 'tanh', 'solver': 'adam', 'lr': 2.1168292134498176e-05, 'layer1': 470, 'layer2': 469, 'layer3': 47}. Best is trial 106 with value: 0.8646284220353448.
Escherichia_Coli | DirectMulti | Optuna:  73%|███████▎  | 146/200 [5:28:52<2:01:19, 134.80s/it, best=0.865]Escherichia_Coli | DirectMulti | Optuna:  73%|███████▎  | 146/200 [5:28:52<2:01:19, 134.80s/it, best=0.865][I 2026-03-05 12:53:10,225] Trial 146 finished with value: 0.8632529111751159 and parameters: {'activation': 'tanh', 'solver': 'adam', 'lr': 5.885921241022321e-05, 'layer1': 482, 'layer2': 458, 'layer3': 87}. Best is trial 106 with value: 0.8646284220353448.
