Pseudomonas_Aeruginosa | LPS | Optuna:  24%|██▎       | 47/200 [44:31<2:54:30, 68.43s/it, best=0.864]Pseudomonas_Aeruginosa | LPS | Optuna:  24%|██▎       | 47/200 [44:31<2:54:30, 68.43s/it, best=0.864][I 2026-03-04 20:43:12,643] Trial 24 finished with value: 0.8920534268270947 and parameters: {'activation': 'identity', 'solver': 'adam', 'lr': 0.00038003485036276297, 'layer1': 73, 'layer2': 194, 'layer3': 127}. Best is trial 22 with value: 0.8930759779387886.
Staphylococcus_Aureus | LPS | Optuna:  12%|█▎        | 25/200 [44:54<3:45:25, 77.29s/it, best=0.893]Staphylococcus_Aureus | LPS | Optuna:  12%|█▎        | 25/200 [44:54<3:45:25, 77.29s/it, best=0.893][I 2026-03-04 20:43:21,304] Trial 19 finished with value: 0.8612570391459793 and parameters: {'activation': 'tanh', 'solver': 'adam', 'lr': 3.6236161820767374e-05, 'layer1': 488, 'layer2': 206, 'layer3': 436}. Best is trial 14 with value: 0.863668804271893.
Escherichia_Coli | LPS | Optuna:  10%|█         | 20/200 [45:03<8:42:46, 174.26s/it, best=0.864]Escherichia_Coli | LPS | Optuna:  10%|█         | 20/200 [45:03<8:42:46, 174.26s/it, best=0.864][I 2026-03-04 20:43:30,659] Trial 39 finished with value: 0.875064791054996 and parameters: {'activation': 'tanh', 'solver': 'adam', 'lr': 1.1194019257153895e-06, 'layer1': 116, 'layer2': 269, 'layer3': 174}. Best is trial 8 with value: 0.9323547463948406.
Klebsiella_Pneumoniae | LPS | Optuna:  20%|██        | 40/200 [45:12<2:13:42, 50.14s/it, best=0.932]Klebsiella_Pneumoniae | LPS | Optuna:  20%|██        | 40/200 [45:12<2:13:42, 50.14s/it, best=0.932][I 2026-03-04 20:43:44,461] Trial 47 finished with value: 0.8614644319889921 and parameters: {'activation': 'relu', 'solver': 'adam', 'lr': 0.0003221844040577685, 'layer1': 198, 'layer2': 184, 'layer3': 75}. Best is trial 8 with value: 0.8639876185286128.
Pseudomonas_Aeruginosa | LPS | Optuna:  24%|██▍       | 48/200 [45:26<2:43:22, 64.49s/it, best=0.864]Pseudomonas_Aeruginosa | LPS | Optuna:  24%|██▍       | 48/200 [45:26<2:43:22, 64.49s/it, best=0.864][I 2026-03-04 20:43:59,594] Trial 40 finished with value: 0.8746470562584285 and parameters: {'activation': 'logistic', 'solver': 'adam', 'lr': 1.2620681913813098e-05, 'layer1': 57, 'layer2': 202, 'layer3': 241}. Best is trial 8 with value: 0.9323547463948406.
Klebsiella_Pneumoniae | LPS | Optuna:  20%|██        | 41/200 [45:41<1:56:00, 43.78s/it, best=0.932]Klebsiella_Pneumoniae | LPS | Optuna:  20%|██        | 41/200 [45:41<1:56:00, 43.78s/it, best=0.932][I 2026-03-04 20:44:00,968] Trial 25 finished with value: 0.8921436460000264 and parameters: {'activation': 'identity', 'solver': 'adam', 'lr': 0.00031556843882462763, 'layer1': 66, 'layer2': 197, 'layer3': 121}. Best is trial 22 with value: 0.8930759779387886.
Staphylococcus_Aureus | LPS | Optuna:  13%|█▎        | 26/200 [45:43<3:18:55, 68.60s/it, best=0.893]Staphylococcus_Aureus | LPS | Optuna:  13%|█▎        | 26/200 [45:43<3:18:55, 68.60s/it, best=0.893][I 2026-03-04 20:44:18,087] Trial 48 finished with value: 0.8591574941154093 and parameters: {'activation': 'identity', 'solver': 'adam', 'lr': 0.0006805278134046286, 'layer1': 131, 'layer2': 249, 'layer3': 49}. Best is trial 8 with value: 0.8639876185286128.
Pseudomonas_Aeruginosa | LPS | Optuna:  24%|██▍       | 49/200 [46:00<2:19:00, 55.23s/it, best=0.864]Pseudomonas_Aeruginosa | LPS | Optuna:  24%|██▍       | 49/200 [46:00<2:19:00, 55.23s/it, best=0.864][I 2026-03-04 20:44:34,839] Trial 26 finished with value: 0.8016455484651599 and parameters: {'activation': 'identity', 'solver': 'sgd', 'lr': 0.0003683974141303493, 'layer1': 68, 'layer2': 201, 'layer3': 122}. Best is trial 22 with value: 0.8930759779387886.
Staphylococcus_Aureus | LPS | Optuna:  14%|█▎        | 27/200 [46:16<2:47:44, 58.18s/it, best=0.893]Staphylococcus_Aureus | LPS | Optuna:  14%|█▎        | 27/200 [46:16<2:47:44, 58.18s/it, best=0.893][I 2026-03-04 20:45:02,955] Trial 41 finished with value: 0.9325947076370852 and parameters: {'activation': 'tanh', 'solver': 'adam', 'lr': 7.66498503727984e-05, 'layer1': 92, 'layer2': 309, 'layer3': 58}. Best is trial 41 with value: 0.9325947076370852.
Klebsiella_Pneumoniae | LPS | Optuna:  21%|██        | 42/200 [46:45<2:10:45, 49.65s/it, best=0.932]Klebsiella_Pneumoniae | LPS | Optuna:  21%|██        | 42/200 [46:45<2:10:45, 49.65s/it, best=0.933][I 2026-03-04 20:45:19,146] Trial 27 finished with value: 0.8889226084005889 and parameters: {'activation': 'identity', 'solver': 'adam', 'lr': 0.0005004214428104062, 'layer1': 12, 'layer2': 267, 'layer3': 121}. Best is trial 22 with value: 0.8930759779387886.
Staphylococcus_Aureus | LPS | Optuna:  14%|█▍        | 28/200 [47:01<2:34:50, 54.02s/it, best=0.893]Staphylococcus_Aureus | LPS | Optuna:  14%|█▍        | 28/200 [47:01<2:34:50, 54.02s/it, best=0.893][I 2026-03-04 20:45:25,429] Trial 49 finished with value: 0.8647157569215889 and parameters: {'activation': 'tanh', 'solver': 'adam', 'lr': 0.0010062805129244636, 'layer1': 409, 'layer2': 52, 'layer3': 466}. Best is trial 49 with value: 0.8647157569215889.
Pseudomonas_Aeruginosa | LPS | Optuna:  25%|██▌       | 50/200 [47:07<2:27:09, 58.86s/it, best=0.864]Pseudomonas_Aeruginosa | LPS | Optuna:  25%|██▌       | 50/200 [47:07<2:27:09, 58.86s/it, best=0.865][I 2026-03-04 20:45:36,085] Trial 20 finished with value: 0.8562405981356127 and parameters: {'activation': 'logistic', 'solver': 'adam', 'lr': 0.003988956930078274, 'layer1': 454, 'layer2': 140, 'layer3': 317}. Best is trial 14 with value: 0.863668804271893.
Escherichia_Coli | LPS | Optuna:  10%|█         | 21/200 [47:18<8:04:31, 162.41s/it, best=0.864]Escherichia_Coli | LPS | Optuna:  10%|█         | 21/200 [47:18<8:04:31, 162.41s/it, best=0.864][I 2026-03-04 20:45:56,741] Trial 42 finished with value: 0.931633122099179 and parameters: {'activation': 'tanh', 'solver': 'adam', 'lr': 0.00010693605965014623, 'layer1': 34, 'layer2': 291, 'layer3': 75}. Best is trial 41 with value: 0.9325947076370852.
Klebsiella_Pneumoniae | LPS | Optuna:  22%|██▏       | 43/200 [47:38<2:13:10, 50.89s/it, best=0.933]Klebsiella_Pneumoniae | LPS | Optuna:  22%|██▏       | 43/200 [47:38<2:13:10, 50.89s/it, best=0.933][I 2026-03-04 20:46:50,812] Trial 28 finished with value: 0.8888013939088429 and parameters: {'activation': 'identity', 'solver': 'adam', 'lr': 5.520350166411609e-05, 'layer1': 88, 'layer2': 322, 'layer3': 201}. Best is trial 22 with value: 0.8930759779387886.
Staphylococcus_Aureus | LPS | Optuna:  14%|█▍        | 29/200 [48:32<3:06:08, 65.31s/it, best=0.893]Staphylococcus_Aureus | LPS | Optuna:  14%|█▍        | 29/200 [48:32<3:06:08, 65.31s/it, best=0.893][I 2026-03-04 20:46:52,284] Trial 50 finished with value: 0.8567631771532975 and parameters: {'activation': 'tanh', 'solver': 'adam', 'lr': 0.0012919771352342432, 'layer1': 495, 'layer2': 51, 'layer3': 475}. Best is trial 49 with value: 0.8647157569215889.
Pseudomonas_Aeruginosa | LPS | Optuna:  26%|██▌       | 51/200 [48:34<2:47:02, 67.26s/it, best=0.865]Pseudomonas_Aeruginosa | LPS | Optuna:  26%|██▌       | 51/200 [48:34<2:47:02, 67.26s/it, best=0.865][I 2026-03-04 20:47:18,792] Trial 29 finished with value: 0.8016455484651599 and parameters: {'activation': 'logistic', 'solver': 'sgd', 'lr': 0.0028222059774847957, 'layer1': 45, 'layer2': 103, 'layer3': 24}. Best is trial 22 with value: 0.8930759779387886.
Staphylococcus_Aureus | LPS | Optuna:  15%|█▌        | 30/200 [49:00<2:33:19, 54.11s/it, best=0.893]Staphylococcus_Aureus | LPS | Optuna:  15%|█▌        | 30/200 [49:00<2:33:19, 54.11s/it, best=0.893][I 2026-03-04 20:47:49,249] Trial 43 finished with value: 0.9296674107233894 and parameters: {'activation': 'tanh', 'solver': 'adam', 'lr': 2.0560425911911435e-05, 'layer1': 99, 'layer2': 326, 'layer3': 83}. Best is trial 41 with value: 0.9325947076370852.
Klebsiella_Pneumoniae | LPS | Optuna:  22%|██▏       | 44/200 [49:31<3:00:22, 69.38s/it, best=0.933]Klebsiella_Pneumoniae | LPS | Optuna:  22%|██▏       | 44/200 [49:31<3:00:22, 69.38s/it, best=0.933][I 2026-03-04 20:48:16,161] Trial 21 finished with value: 0.8596400777964238 and parameters: {'activation': 'relu', 'solver': 'adam', 'lr': 0.00040182349832289835, 'layer1': 489, 'layer2': 162, 'layer3': 299}. Best is trial 14 with value: 0.863668804271893.
Escherichia_Coli | LPS | Optuna:  11%|█         | 22/200 [49:58<7:59:44, 161.71s/it, best=0.864]Escherichia_Coli | LPS | Optuna:  11%|█         | 22/200 [49:58<7:59:44, 161.71s/it, best=0.864][I 2026-03-04 20:48:31,472] Trial 30 finished with value: 0.8879771699558956 and parameters: {'activation': 'identity', 'solver': 'adam', 'lr': 9.347463354382347e-05, 'layer1': 85, 'layer2': 257, 'layer3': 82}. Best is trial 22 with value: 0.8930759779387886.
Staphylococcus_Aureus | LPS | Optuna:  16%|█▌        | 31/200 [50:13<2:48:06, 59.68s/it, best=0.893]Staphylococcus_Aureus | LPS | Optuna:  16%|█▌        | 31/200 [50:13<2:48:06, 59.68s/it, best=0.893][I 2026-03-04 20:48:57,432] Trial 51 finished with value: 0.8489833154635142 and parameters: {'activation': 'tanh', 'solver': 'adam', 'lr': 0.0031577090221411135, 'layer1': 416, 'layer2': 79, 'layer3': 458}. Best is trial 49 with value: 0.8647157569215889.
Pseudomonas_Aeruginosa | LPS | Optuna:  26%|██▌       | 52/200 [50:39<3:28:44, 84.63s/it, best=0.865]Pseudomonas_Aeruginosa | LPS | Optuna:  26%|██▌       | 52/200 [50:39<3:28:44, 84.63s/it, best=0.865][I 2026-03-04 20:49:14,990] Trial 44 finished with value: 0.9311435496824094 and parameters: {'activation': 'tanh', 'solver': 'adam', 'lr': 6.534011254392208e-05, 'layer1': 248, 'layer2': 380, 'layer3': 150}. Best is trial 41 with value: 0.9325947076370852.
Klebsiella_Pneumoniae | LPS | Optuna:  22%|██▎       | 45/200 [50:57<3:11:54, 74.29s/it, best=0.933]Klebsiella_Pneumoniae | LPS | Optuna:  22%|██▎       | 45/200 [50:57<3:11:54, 74.29s/it, best=0.933][I 2026-03-04 20:49:39,907] Trial 31 finished with value: 0.8905243324833358 and parameters: {'activation': 'identity', 'solver': 'adam', 'lr': 0.00023579235121147548, 'layer1': 137, 'layer2': 211, 'layer3': 139}. Best is trial 22 with value: 0.8930759779387886.
Staphylococcus_Aureus | LPS | Optuna:  16%|█▌        | 32/200 [51:22<2:54:27, 62.31s/it, best=0.893]Staphylococcus_Aureus | LPS | Optuna:  16%|█▌        | 32/200 [51:22<2:54:27, 62.31s/it, best=0.893][I 2026-03-04 20:50:03,164] Trial 52 finished with value: 0.8589364670120799 and parameters: {'activation': 'tanh', 'solver': 'adam', 'lr': 0.0005843949361095506, 'layer1': 378, 'layer2': 37, 'layer3': 392}. Best is trial 49 with value: 0.8647157569215889.
Pseudomonas_Aeruginosa | LPS | Optuna:  26%|██▋       | 53/200 [51:45<3:13:26, 78.96s/it, best=0.865]Pseudomonas_Aeruginosa | LPS | Optuna:  26%|██▋       | 53/200 [51:45<3:13:26, 78.96s/it, best=0.865][I 2026-03-04 20:50:19,953] Trial 45 finished with value: 0.93201560091762 and parameters: {'activation': 'tanh', 'solver': 'adam', 'lr': 0.00016840289215896008, 'layer1': 148, 'layer2': 461, 'layer3': 45}. Best is trial 41 with value: 0.9325947076370852.
Klebsiella_Pneumoniae | LPS | Optuna:  23%|██▎       | 46/200 [52:02<3:03:29, 71.49s/it, best=0.933]Klebsiella_Pneumoniae | LPS | Optuna:  23%|██▎       | 46/200 [52:02<3:03:29, 71.49s/it, best=0.933][I 2026-03-04 20:50:46,305] Trial 22 finished with value: 0.8605952502144909 and parameters: {'activation': 'relu', 'solver': 'adam', 'lr': 0.00014073446037142297, 'layer1': 374, 'layer2': 237, 'layer3': 209}. Best is trial 14 with value: 0.863668804271893.
Escherichia_Coli | LPS | Optuna:  12%|█▏        | 23/200 [52:28<7:46:48, 158.24s/it, best=0.864]Escherichia_Coli | LPS | Optuna:  12%|█▏        | 23/200 [52:28<7:46:48, 158.24s/it, best=0.864][I 2026-03-04 20:50:49,716] Trial 53 finished with value: 0.8261898244308833 and parameters: {'activation': 'tanh', 'solver': 'adam', 'lr': 0.0063480545783147, 'layer1': 345, 'layer2': 141, 'layer3': 362}. Best is trial 49 with value: 0.8647157569215889.
Pseudomonas_Aeruginosa | LPS | Optuna:  27%|██▋       | 54/200 [52:31<2:48:28, 69.24s/it, best=0.865]Pseudomonas_Aeruginosa | LPS | Optuna:  27%|██▋       | 54/200 [52:31<2:48:28, 69.24s/it, best=0.865][I 2026-03-04 20:50:54,604] Trial 32 finished with value: 0.8916354851036674 and parameters: {'activation': 'identity', 'solver': 'adam', 'lr': 0.00020309441551213906, 'layer1': 184, 'layer2': 141, 'layer3': 202}. Best is trial 22 with value: 0.8930759779387886.
Staphylococcus_Aureus | LPS | Optuna:  16%|█▋        | 33/200 [52:36<3:03:46, 66.02s/it, best=0.893]Staphylococcus_Aureus | LPS | Optuna:  16%|█▋        | 33/200 [52:36<3:03:46, 66.02s/it, best=0.893][I 2026-03-04 20:50:59,824] Trial 46 finished with value: 0.8748553761815842 and parameters: {'activation': 'relu', 'solver': 'sgd', 'lr': 0.0001869895692720765, 'layer1': 152, 'layer2': 468, 'layer3': 38}. Best is trial 41 with value: 0.9325947076370852.
Klebsiella_Pneumoniae | LPS | Optuna:  24%|██▎       | 47/200 [52:42<2:38:06, 62.00s/it, best=0.933]Klebsiella_Pneumoniae | LPS | Optuna:  24%|██▎       | 47/200 [52:42<2:38:06, 62.00s/it, best=0.933][I 2026-03-04 20:51:43,829] Trial 47 finished with value: 0.8757662066129406 and parameters: {'activation': 'tanh', 'solver': 'adam', 'lr': 4.841812813269254e-06, 'layer1': 186, 'layer2': 419, 'layer3': 54}. Best is trial 41 with value: 0.9325947076370852.
Klebsiella_Pneumoniae | LPS | Optuna:  24%|██▍       | 48/200 [53:26<2:23:23, 56.60s/it, best=0.933]Klebsiella_Pneumoniae | LPS | Optuna:  24%|██▍       | 48/200 [53:26<2:23:23, 56.60s/it, best=0.933][I 2026-03-04 20:51:50,343] Trial 33 finished with value: 0.8905894426001095 and parameters: {'activation': 'identity', 'solver': 'adam', 'lr': 0.0004912908705855878, 'layer1': 126, 'layer2': 72, 'layer3': 170}. Best is trial 22 with value: 0.8930759779387886.
Staphylococcus_Aureus | LPS | Optuna:  17%|█▋        | 34/200 [53:32<2:54:07, 62.94s/it, best=0.893]Staphylococcus_Aureus | LPS | Optuna:  17%|█▋        | 34/200 [53:32<2:54:07, 62.94s/it, best=0.893][I 2026-03-04 20:52:32,660] Trial 54 finished with value: 0.8609085765273055 and parameters: {'activation': 'relu', 'solver': 'adam', 'lr': 0.000958299436843952, 'layer1': 462, 'layer2': 214, 'layer3': 500}. Best is trial 49 with value: 0.8647157569215889.
Pseudomonas_Aeruginosa | LPS | Optuna:  28%|██▊       | 55/200 [54:14<3:11:45, 79.35s/it, best=0.865]Pseudomonas_Aeruginosa | LPS | Optuna:  28%|██▊       | 55/200 [54:14<3:11:45, 79.35s/it, best=0.865][I 2026-03-04 20:52:38,072] Trial 48 finished with value: 0.9263376074378137 and parameters: {'activation': 'relu', 'solver': 'adam', 'lr': 0.0008279360607585369, 'layer1': 143, 'layer2': 471, 'layer3': 13}. Best is trial 41 with value: 0.9325947076370852.
Klebsiella_Pneumoniae | LPS | Optuna:  24%|██▍       | 49/200 [54:20<2:20:40, 55.90s/it, best=0.933]Klebsiella_Pneumoniae | LPS | Optuna:  24%|██▍       | 49/200 [54:20<2:20:40, 55.90s/it, best=0.933][I 2026-03-04 20:52:52,392] Trial 34 finished with value: 0.8035379848327558 and parameters: {'activation': 'logistic', 'solver': 'adam', 'lr': 3.5486959508932417e-05, 'layer1': 225, 'layer2': 286, 'layer3': 107}. Best is trial 22 with value: 0.8930759779387886.
Staphylococcus_Aureus | LPS | Optuna:  18%|█▊        | 35/200 [54:34<2:52:20, 62.67s/it, best=0.893]Staphylococcus_Aureus | LPS | Optuna:  18%|█▊        | 35/200 [54:34<2:52:20, 62.67s/it, best=0.893][I 2026-03-04 20:53:20,376] Trial 23 finished with value: 0.8598476319413493 and parameters: {'activation': 'relu', 'solver': 'adam', 'lr': 0.0022560591397042733, 'layer1': 457, 'layer2': 90, 'layer3': 386}. Best is trial 14 with value: 0.863668804271893.
Escherichia_Coli | LPS | Optuna:  12%|█▏        | 24/200 [55:02<7:40:29, 156.99s/it, best=0.864]Escherichia_Coli | LPS | Optuna:  12%|█▏        | 24/200 [55:02<7:40:29, 156.99s/it, best=0.864][I 2026-03-04 20:53:26,550] Trial 49 finished with value: 0.8746470562584285 and parameters: {'activation': 'tanh', 'solver': 'adam', 'lr': 0.005232642754087575, 'layer1': 198, 'layer2': 497, 'layer3': 44}. Best is trial 41 with value: 0.9325947076370852.
Klebsiella_Pneumoniae | LPS | Optuna:  25%|██▌       | 50/200 [55:08<2:14:10, 53.67s/it, best=0.933]Klebsiella_Pneumoniae | LPS | Optuna:  25%|██▌       | 50/200 [55:08<2:14:10, 53.67s/it, best=0.933][I 2026-03-04 20:53:34,544] Trial 55 finished with value: 0.859562799531761 and parameters: {'activation': 'tanh', 'solver': 'adam', 'lr': 0.0002877079931967307, 'layer1': 354, 'layer2': 99, 'layer3': 407}. Best is trial 49 with value: 0.8647157569215889.
Pseudomonas_Aeruginosa | LPS | Optuna:  28%|██▊       | 56/200 [55:16<2:57:51, 74.11s/it, best=0.865]Pseudomonas_Aeruginosa | LPS | Optuna:  28%|██▊       | 56/200 [55:16<2:57:51, 74.11s/it, best=0.865][I 2026-03-04 20:54:10,504] Trial 50 finished with value: 0.9280831495841951 and parameters: {'activation': 'identity', 'solver': 'adam', 'lr': 0.0004140758974168334, 'layer1': 68, 'layer2': 457, 'layer3': 97}. Best is trial 41 with value: 0.9325947076370852.
Klebsiella_Pneumoniae | LPS | Optuna:  26%|██▌       | 51/200 [55:52<2:06:02, 50.76s/it, best=0.933]Klebsiella_Pneumoniae | LPS | Optuna:  26%|██▌       | 51/200 [55:52<2:06:02, 50.76s/it, best=0.933][I 2026-03-04 20:54:14,380] Trial 56 finished with value: 0.826531958921184 and parameters: {'activation': 'identity', 'solver': 'sgd', 'lr': 0.0016935614286534065, 'layer1': 426, 'layer2': 228, 'layer3': 213}. Best is trial 49 with value: 0.8647157569215889.
Pseudomonas_Aeruginosa | LPS | Optuna:  28%|██▊       | 57/200 [55:56<2:32:07, 63.83s/it, best=0.865]Pseudomonas_Aeruginosa | LPS | Optuna:  28%|██▊       | 57/200 [55:56<2:32:07, 63.83s/it, best=0.865][I 2026-03-04 20:55:05,141] Trial 57 finished with value: 0.8261898244308833 and parameters: {'activation': 'logistic', 'solver': 'adam', 'lr': 7.980011721993523e-05, 'layer1': 390, 'layer2': 55, 'layer3': 93}. Best is trial 49 with value: 0.8647157569215889.
Pseudomonas_Aeruginosa | LPS | Optuna:  29%|██▉       | 58/200 [56:47<2:21:46, 59.91s/it, best=0.865]Pseudomonas_Aeruginosa | LPS | Optuna:  29%|██▉       | 58/200 [56:47<2:21:46, 59.91s/it, best=0.865][I 2026-03-04 20:55:12,720] Trial 35 finished with value: 0.8882651318073934 and parameters: {'activation': 'identity', 'solver': 'adam', 'lr': 2.6979987468263632e-05, 'layer1': 80, 'layer2': 345, 'layer3': 341}. Best is trial 22 with value: 0.8930759779387886.
Staphylococcus_Aureus | LPS | Optuna:  18%|█▊        | 36/200 [56:54<3:54:58, 85.97s/it, best=0.893]Staphylococcus_Aureus | LPS | Optuna:  18%|█▊        | 36/200 [56:54<3:54:58, 85.97s/it, best=0.893][I 2026-03-04 20:55:35,067] Trial 51 finished with value: 0.9321664403735127 and parameters: {'activation': 'tanh', 'solver': 'adam', 'lr': 3.709758437408391e-05, 'layer1': 107, 'layer2': 425, 'layer3': 99}. Best is trial 41 with value: 0.9325947076370852.
Klebsiella_Pneumoniae | LPS | Optuna:  26%|██▌       | 52/200 [57:17<2:30:12, 60.90s/it, best=0.933]Klebsiella_Pneumoniae | LPS | Optuna:  26%|██▌       | 52/200 [57:17<2:30:12, 60.90s/it, best=0.933][I 2026-03-04 20:56:02,082] Trial 24 finished with value: 0.8595212939217648 and parameters: {'activation': 'relu', 'solver': 'adam', 'lr': 0.00047471117736241366, 'layer1': 461, 'layer2': 167, 'layer3': 283}. Best is trial 14 with value: 0.863668804271893.
Escherichia_Coli | LPS | Optuna:  12%|█▎        | 25/200 [57:44<7:42:00, 158.40s/it, best=0.864]Escherichia_Coli | LPS | Optuna:  12%|█▎        | 25/200 [57:44<7:42:00, 158.40s/it, best=0.864][I 2026-03-04 20:56:30,353] Trial 58 finished with value: 0.8567471160945983 and parameters: {'activation': 'relu', 'solver': 'adam', 'lr': 0.009671755892418494, 'layer1': 324, 'layer2': 271, 'layer3': 299}. Best is trial 49 with value: 0.8647157569215889.
Pseudomonas_Aeruginosa | LPS | Optuna:  30%|██▉       | 59/200 [58:12<2:38:37, 67.50s/it, best=0.865]Pseudomonas_Aeruginosa | LPS | Optuna:  30%|██▉       | 59/200 [58:12<2:38:37, 67.50s/it, best=0.865][I 2026-03-04 20:56:31,378] Trial 36 finished with value: 0.8897463933124474 and parameters: {'activation': 'identity', 'solver': 'adam', 'lr': 9.088237791752751e-05, 'layer1': 23, 'layer2': 230, 'layer3': 143}. Best is trial 22 with value: 0.8930759779387886.
Staphylococcus_Aureus | LPS | Optuna:  18%|█▊        | 37/200 [58:13<3:47:35, 83.78s/it, best=0.893]Staphylococcus_Aureus | LPS | Optuna:  18%|█▊        | 37/200 [58:13<3:47:35, 83.78s/it, best=0.893][I 2026-03-04 20:56:59,238] Trial 52 finished with value: 0.930382391426434 and parameters: {'activation': 'tanh', 'solver': 'adam', 'lr': 3.562136621719006e-05, 'layer1': 100, 'layer2': 420, 'layer3': 291}. Best is trial 41 with value: 0.9325947076370852.
Klebsiella_Pneumoniae | LPS | Optuna:  26%|██▋       | 53/200 [58:41<2:46:18, 67.88s/it, best=0.933]Klebsiella_Pneumoniae | LPS | Optuna:  26%|██▋       | 53/200 [58:41<2:46:18, 67.88s/it, best=0.933][I 2026-03-04 20:57:32,206] Trial 37 finished with value: 0.8901638316018922 and parameters: {'activation': 'tanh', 'solver': 'adam', 'lr': 0.00016501753119255505, 'layer1': 49, 'layer2': 167, 'layer3': 273}. Best is trial 22 with value: 0.8930759779387886.
Staphylococcus_Aureus | LPS | Optuna:  19%|█▉        | 38/200 [59:14<3:27:36, 76.89s/it, best=0.893]Staphylococcus_Aureus | LPS | Optuna:  19%|█▉        | 38/200 [59:14<3:27:36, 76.89s/it, best=0.893][I 2026-03-04 20:57:53,120] Trial 59 finished with value: 0.8621074476381974 and parameters: {'activation': 'relu', 'solver': 'adam', 'lr': 0.00014315628288467553, 'layer1': 280, 'layer2': 195, 'layer3': 452}. Best is trial 49 with value: 0.8647157569215889.
