Klebsiella_Pneumoniae | LPS | Optuna:  68%|██████▊   | 136/200 [2:41:17<1:33:28, 87.63s/it, best=0.933] Klebsiella_Pneumoniae | LPS | Optuna:  68%|██████▊   | 136/200 [2:41:17<1:33:28, 87.63s/it, best=0.933][I 2026-03-04 22:39:46,268] Trial 145 finished with value: 0.8629259897843495 and parameters: {'activation': 'identity', 'solver': 'adam', 'lr': 0.0011793809793008635, 'layer1': 346, 'layer2': 238, 'layer3': 148}. Best is trial 49 with value: 0.8647157569215889.
Pseudomonas_Aeruginosa | LPS | Optuna:  73%|███████▎  | 146/200 [2:41:28<57:21, 63.73s/it, best=0.865]  Pseudomonas_Aeruginosa | LPS | Optuna:  73%|███████▎  | 146/200 [2:41:28<57:21, 63.73s/it, best=0.865][I 2026-03-04 22:39:50,060] Trial 117 finished with value: 0.8890467564304559 and parameters: {'activation': 'identity', 'solver': 'adam', 'lr': 0.0005026799229744222, 'layer1': 89, 'layer2': 38, 'layer3': 125}. Best is trial 90 with value: 0.8934794004485915.
Staphylococcus_Aureus | LPS | Optuna:  59%|█████▉    | 118/200 [2:41:32<1:25:47, 62.78s/it, best=0.893]Staphylococcus_Aureus | LPS | Optuna:  59%|█████▉    | 118/200 [2:41:32<1:25:47, 62.78s/it, best=0.893][I 2026-03-04 22:40:37,486] Trial 146 finished with value: 0.8260977603006419 and parameters: {'activation': 'relu', 'solver': 'adam', 'lr': 7.5747207188550066e-06, 'layer1': 337, 'layer2': 247, 'layer3': 147}. Best is trial 49 with value: 0.8647157569215889.
Pseudomonas_Aeruginosa | LPS | Optuna:  74%|███████▎  | 147/200 [2:42:19<52:58, 59.97s/it, best=0.865]Pseudomonas_Aeruginosa | LPS | Optuna:  74%|███████▎  | 147/200 [2:42:19<52:58, 59.97s/it, best=0.865][I 2026-03-04 22:40:49,748] Trial 118 finished with value: 0.8644291378536566 and parameters: {'activation': 'logistic', 'solver': 'adam', 'lr': 0.0006427435481825548, 'layer1': 61, 'layer2': 50, 'layer3': 143}. Best is trial 90 with value: 0.8934794004485915.
Staphylococcus_Aureus | LPS | Optuna:  60%|█████▉    | 119/200 [2:42:31<1:23:29, 61.85s/it, best=0.893]Staphylococcus_Aureus | LPS | Optuna:  60%|█████▉    | 119/200 [2:42:31<1:23:29, 61.85s/it, best=0.893][I 2026-03-04 22:41:32,105] Trial 119 finished with value: 0.8020501521297417 and parameters: {'activation': 'identity', 'solver': 'sgd', 'lr': 0.00013750654362699799, 'layer1': 118, 'layer2': 35, 'layer3': 106}. Best is trial 90 with value: 0.8934794004485915.
Staphylococcus_Aureus | LPS | Optuna:  60%|██████    | 120/200 [2:43:14<1:14:40, 56.00s/it, best=0.893]Staphylococcus_Aureus | LPS | Optuna:  60%|██████    | 120/200 [2:43:14<1:14:40, 56.00s/it, best=0.893][I 2026-03-04 22:41:38,366] Trial 136 finished with value: 0.9310385884928083 and parameters: {'activation': 'tanh', 'solver': 'adam', 'lr': 3.895385540827716e-05, 'layer1': 280, 'layer2': 263, 'layer3': 50}. Best is trial 104 with value: 0.9327898309005132.
Klebsiella_Pneumoniae | LPS | Optuna:  68%|██████▊   | 137/200 [2:43:20<1:43:11, 98.27s/it, best=0.933]Klebsiella_Pneumoniae | LPS | Optuna:  68%|██████▊   | 137/200 [2:43:20<1:43:11, 98.27s/it, best=0.933][I 2026-03-04 22:42:01,530] Trial 147 finished with value: 0.8596574157249725 and parameters: {'activation': 'identity', 'solver': 'adam', 'lr': 5.913956767099225e-05, 'layer1': 321, 'layer2': 233, 'layer3': 487}. Best is trial 49 with value: 0.8647157569215889.
Pseudomonas_Aeruginosa | LPS | Optuna:  74%|███████▍  | 148/200 [2:43:43<58:14, 67.19s/it, best=0.865]Pseudomonas_Aeruginosa | LPS | Optuna:  74%|███████▍  | 148/200 [2:43:43<58:14, 67.19s/it, best=0.865][I 2026-03-04 22:42:06,099] Trial 60 finished with value: 0.7659522562401675 and parameters: {'activation': 'relu', 'solver': 'adam', 'lr': 5.831259455032442e-06, 'layer1': 403, 'layer2': 285, 'layer3': 457}. Best is trial 14 with value: 0.863668804271893.
Escherichia_Coli | LPS | Optuna:  30%|███       | 61/200 [2:43:48<6:48:34, 176.37s/it, best=0.864]Escherichia_Coli | LPS | Optuna:  30%|███       | 61/200 [2:43:48<6:48:34, 176.37s/it, best=0.864][I 2026-03-04 22:42:28,860] Trial 137 finished with value: 0.9311990453181581 and parameters: {'activation': 'tanh', 'solver': 'adam', 'lr': 0.00014853445951868547, 'layer1': 96, 'layer2': 147, 'layer3': 108}. Best is trial 104 with value: 0.9327898309005132.
Klebsiella_Pneumoniae | LPS | Optuna:  69%|██████▉   | 138/200 [2:44:11<1:26:44, 83.94s/it, best=0.933]Klebsiella_Pneumoniae | LPS | Optuna:  69%|██████▉   | 138/200 [2:44:11<1:26:44, 83.94s/it, best=0.933][I 2026-03-04 22:42:58,890] Trial 120 finished with value: 0.8931962719243949 and parameters: {'activation': 'identity', 'solver': 'adam', 'lr': 0.00026449846021183213, 'layer1': 238, 'layer2': 66, 'layer3': 174}. Best is trial 90 with value: 0.8934794004485915.
Staphylococcus_Aureus | LPS | Optuna:  60%|██████    | 121/200 [2:44:41<1:25:53, 65.24s/it, best=0.893]Staphylococcus_Aureus | LPS | Optuna:  60%|██████    | 121/200 [2:44:41<1:25:53, 65.24s/it, best=0.893][I 2026-03-04 22:43:11,385] Trial 148 finished with value: 0.8634813440245843 and parameters: {'activation': 'relu', 'solver': 'adam', 'lr': 0.0008639928622674042, 'layer1': 346, 'layer2': 214, 'layer3': 500}. Best is trial 49 with value: 0.8647157569215889.
Pseudomonas_Aeruginosa | LPS | Optuna:  74%|███████▍  | 149/200 [2:44:53<57:47, 67.99s/it, best=0.865]Pseudomonas_Aeruginosa | LPS | Optuna:  74%|███████▍  | 149/200 [2:44:53<57:47, 67.99s/it, best=0.865][I 2026-03-04 22:43:24,681] Trial 138 finished with value: 0.8759983395318501 and parameters: {'activation': 'tanh', 'solver': 'sgd', 'lr': 6.40728890466838e-05, 'layer1': 236, 'layer2': 280, 'layer3': 99}. Best is trial 104 with value: 0.9327898309005132.
Klebsiella_Pneumoniae | LPS | Optuna:  70%|██████▉   | 139/200 [2:45:06<1:16:45, 75.50s/it, best=0.933]Klebsiella_Pneumoniae | LPS | Optuna:  70%|██████▉   | 139/200 [2:45:06<1:16:45, 75.50s/it, best=0.933][I 2026-03-04 22:44:29,156] Trial 121 finished with value: 0.8908085627879417 and parameters: {'activation': 'identity', 'solver': 'adam', 'lr': 0.0002598335188980296, 'layer1': 226, 'layer2': 63, 'layer3': 157}. Best is trial 90 with value: 0.8934794004485915.
Staphylococcus_Aureus | LPS | Optuna:  61%|██████    | 122/200 [2:46:11<1:34:34, 72.75s/it, best=0.893]Staphylococcus_Aureus | LPS | Optuna:  61%|██████    | 122/200 [2:46:11<1:34:34, 72.75s/it, best=0.893][I 2026-03-04 22:44:35,896] Trial 149 finished with value: 0.8640693079028164 and parameters: {'activation': 'relu', 'solver': 'adam', 'lr': 0.0008447146320367265, 'layer1': 350, 'layer2': 236, 'layer3': 498}. Best is trial 49 with value: 0.8647157569215889.
Pseudomonas_Aeruginosa | LPS | Optuna:  75%|███████▌  | 150/200 [2:46:18<1:00:47, 72.95s/it, best=0.865]Pseudomonas_Aeruginosa | LPS | Optuna:  75%|███████▌  | 150/200 [2:46:18<1:00:47, 72.95s/it, best=0.865][I 2026-03-04 22:45:20,777] Trial 139 finished with value: 0.9310044805754665 and parameters: {'activation': 'tanh', 'solver': 'adam', 'lr': 4.500398913951654e-05, 'layer1': 251, 'layer2': 233, 'layer3': 36}. Best is trial 104 with value: 0.9327898309005132.
Klebsiella_Pneumoniae | LPS | Optuna:  70%|███████   | 140/200 [2:47:02<1:27:40, 87.68s/it, best=0.933]Klebsiella_Pneumoniae | LPS | Optuna:  70%|███████   | 140/200 [2:47:02<1:27:40, 87.68s/it, best=0.933][I 2026-03-04 22:45:36,570] Trial 61 finished with value: 0.8616729873906825 and parameters: {'activation': 'relu', 'solver': 'adam', 'lr': 2.108452755973732e-05, 'layer1': 321, 'layer2': 230, 'layer3': 488}. Best is trial 14 with value: 0.863668804271893.
Escherichia_Coli | LPS | Optuna:  31%|███       | 62/200 [2:47:18<7:09:10, 186.60s/it, best=0.864]Escherichia_Coli | LPS | Optuna:  31%|███       | 62/200 [2:47:18<7:09:10, 186.60s/it, best=0.864][I 2026-03-04 22:45:39,809] Trial 150 finished with value: 0.8611613968572401 and parameters: {'activation': 'relu', 'solver': 'adam', 'lr': 0.0006681110939052476, 'layer1': 345, 'layer2': 92, 'layer3': 478}. Best is trial 49 with value: 0.8647157569215889.
Pseudomonas_Aeruginosa | LPS | Optuna:  76%|███████▌  | 151/200 [2:47:22<57:21, 70.24s/it, best=0.865]  Pseudomonas_Aeruginosa | LPS | Optuna:  76%|███████▌  | 151/200 [2:47:22<57:21, 70.24s/it, best=0.865][I 2026-03-04 22:45:41,944] Trial 122 finished with value: 0.8919703418426763 and parameters: {'activation': 'identity', 'solver': 'adam', 'lr': 0.0007521957044444353, 'layer1': 236, 'layer2': 78, 'layer3': 130}. Best is trial 90 with value: 0.8934794004485915.
Staphylococcus_Aureus | LPS | Optuna:  62%|██████▏   | 123/200 [2:47:24<1:33:22, 72.76s/it, best=0.893]Staphylococcus_Aureus | LPS | Optuna:  62%|██████▏   | 123/200 [2:47:24<1:33:22, 72.76s/it, best=0.893][I 2026-03-04 22:46:40,641] Trial 140 finished with value: 0.9309532204039291 and parameters: {'activation': 'relu', 'solver': 'adam', 'lr': 8.831481182862629e-05, 'layer1': 43, 'layer2': 173, 'layer3': 68}. Best is trial 104 with value: 0.9327898309005132.
Klebsiella_Pneumoniae | LPS | Optuna:  70%|███████   | 141/200 [2:48:22<1:23:54, 85.34s/it, best=0.933]Klebsiella_Pneumoniae | LPS | Optuna:  70%|███████   | 141/200 [2:48:22<1:23:54, 85.34s/it, best=0.933][I 2026-03-04 22:46:48,482] Trial 151 finished with value: 0.8618835129665452 and parameters: {'activation': 'relu', 'solver': 'adam', 'lr': 0.0008506637147473176, 'layer1': 304, 'layer2': 230, 'layer3': 499}. Best is trial 49 with value: 0.8647157569215889.
Pseudomonas_Aeruginosa | LPS | Optuna:  76%|███████▌  | 152/200 [2:48:30<55:48, 69.77s/it, best=0.865]Pseudomonas_Aeruginosa | LPS | Optuna:  76%|███████▌  | 152/200 [2:48:30<55:48, 69.77s/it, best=0.865][I 2026-03-04 22:47:05,136] Trial 123 finished with value: 0.8915802788595417 and parameters: {'activation': 'identity', 'solver': 'adam', 'lr': 0.0004335060726269858, 'layer1': 214, 'layer2': 46, 'layer3': 90}. Best is trial 90 with value: 0.8934794004485915.
Staphylococcus_Aureus | LPS | Optuna:  62%|██████▏   | 124/200 [2:48:47<1:36:07, 75.89s/it, best=0.893]Staphylococcus_Aureus | LPS | Optuna:  62%|██████▏   | 124/200 [2:48:47<1:36:07, 75.89s/it, best=0.893][I 2026-03-04 22:47:51,513] Trial 141 finished with value: 0.9285809647922356 and parameters: {'activation': 'tanh', 'solver': 'adam', 'lr': 0.0032101331360910495, 'layer1': 190, 'layer2': 210, 'layer3': 58}. Best is trial 104 with value: 0.9327898309005132.
Klebsiella_Pneumoniae | LPS | Optuna:  71%|███████   | 142/200 [2:49:33<1:18:17, 81.00s/it, best=0.933]Klebsiella_Pneumoniae | LPS | Optuna:  71%|███████   | 142/200 [2:49:33<1:18:17, 81.00s/it, best=0.933][I 2026-03-04 22:47:51,742] Trial 124 finished with value: 0.8938450095328893 and parameters: {'activation': 'identity', 'solver': 'adam', 'lr': 0.0005505655520838394, 'layer1': 82, 'layer2': 93, 'layer3': 117}. Best is trial 124 with value: 0.8938450095328893.
Staphylococcus_Aureus | LPS | Optuna:  62%|██████▎   | 125/200 [2:49:33<1:23:52, 67.10s/it, best=0.893]Staphylococcus_Aureus | LPS | Optuna:  62%|██████▎   | 125/200 [2:49:33<1:23:52, 67.10s/it, best=0.894][I 2026-03-04 22:48:01,678] Trial 152 finished with value: 0.8616602355832172 and parameters: {'activation': 'relu', 'solver': 'adam', 'lr': 0.0005628026641364339, 'layer1': 330, 'layer2': 216, 'layer3': 495}. Best is trial 49 with value: 0.8647157569215889.
Pseudomonas_Aeruginosa | LPS | Optuna:  76%|███████▋  | 153/200 [2:49:43<55:27, 70.80s/it, best=0.865]Pseudomonas_Aeruginosa | LPS | Optuna:  76%|███████▋  | 153/200 [2:49:43<55:27, 70.80s/it, best=0.865][I 2026-03-04 22:48:48,454] Trial 125 finished with value: 0.8897153292022182 and parameters: {'activation': 'identity', 'solver': 'adam', 'lr': 0.0002147365057306459, 'layer1': 81, 'layer2': 125, 'layer3': 175}. Best is trial 124 with value: 0.8938450095328893.
Staphylococcus_Aureus | LPS | Optuna:  63%|██████▎   | 126/200 [2:50:30<1:18:54, 63.99s/it, best=0.894]Staphylococcus_Aureus | LPS | Optuna:  63%|██████▎   | 126/200 [2:50:30<1:18:54, 63.99s/it, best=0.894][I 2026-03-04 22:48:49,565] Trial 62 finished with value: 0.863100900494189 and parameters: {'activation': 'relu', 'solver': 'adam', 'lr': 3.393449900704321e-05, 'layer1': 373, 'layer2': 203, 'layer3': 465}. Best is trial 14 with value: 0.863668804271893.
Escherichia_Coli | LPS | Optuna:  32%|███▏      | 63/200 [2:50:31<7:10:26, 188.52s/it, best=0.864]Escherichia_Coli | LPS | Optuna:  32%|███▏      | 63/200 [2:50:31<7:10:26, 188.52s/it, best=0.864][I 2026-03-04 22:49:19,453] Trial 153 finished with value: 0.8605507118227191 and parameters: {'activation': 'relu', 'solver': 'adam', 'lr': 0.0011794081863105656, 'layer1': 342, 'layer2': 249, 'layer3': 472}. Best is trial 49 with value: 0.8647157569215889.
Pseudomonas_Aeruginosa | LPS | Optuna:  77%|███████▋  | 154/200 [2:51:01<55:52, 72.89s/it, best=0.865]Pseudomonas_Aeruginosa | LPS | Optuna:  77%|███████▋  | 154/200 [2:51:01<55:52, 72.89s/it, best=0.865][I 2026-03-04 22:49:44,737] Trial 142 finished with value: 0.9312788498659657 and parameters: {'activation': 'tanh', 'solver': 'adam', 'lr': 2.925860009023007e-05, 'layer1': 168, 'layer2': 192, 'layer3': 86}. Best is trial 104 with value: 0.9327898309005132.
Klebsiella_Pneumoniae | LPS | Optuna:  72%|███████▏  | 143/200 [2:51:26<1:26:07, 90.66s/it, best=0.933]Klebsiella_Pneumoniae | LPS | Optuna:  72%|███████▏  | 143/200 [2:51:26<1:26:07, 90.66s/it, best=0.933][I 2026-03-04 22:49:46,395] Trial 126 finished with value: 0.8906178413894329 and parameters: {'activation': 'identity', 'solver': 'adam', 'lr': 0.0003802473702610975, 'layer1': 103, 'layer2': 65, 'layer3': 116}. Best is trial 124 with value: 0.8938450095328893.
Staphylococcus_Aureus | LPS | Optuna:  64%|██████▎   | 127/200 [2:51:28<1:15:38, 62.17s/it, best=0.894]Staphylococcus_Aureus | LPS | Optuna:  64%|██████▎   | 127/200 [2:51:28<1:15:38, 62.17s/it, best=0.894][I 2026-03-04 22:50:24,923] Trial 154 finished with value: 0.8582930692292446 and parameters: {'activation': 'relu', 'solver': 'adam', 'lr': 0.000812847112582795, 'layer1': 349, 'layer2': 241, 'layer3': 449}. Best is trial 49 with value: 0.8647157569215889.
Pseudomonas_Aeruginosa | LPS | Optuna:  78%|███████▊  | 155/200 [2:52:07<52:59, 70.66s/it, best=0.865]Pseudomonas_Aeruginosa | LPS | Optuna:  78%|███████▊  | 155/200 [2:52:07<52:59, 70.66s/it, best=0.865][I 2026-03-04 22:50:35,064] Trial 127 finished with value: 0.8926705015627503 and parameters: {'activation': 'identity', 'solver': 'adam', 'lr': 0.0005244625370921052, 'layer1': 43, 'layer2': 94, 'layer3': 22}. Best is trial 124 with value: 0.8938450095328893.
Staphylococcus_Aureus | LPS | Optuna:  64%|██████▍   | 128/200 [2:52:17<1:09:44, 58.12s/it, best=0.894]Staphylococcus_Aureus | LPS | Optuna:  64%|██████▍   | 128/200 [2:52:17<1:09:44, 58.12s/it, best=0.894][I 2026-03-04 22:51:05,836] Trial 143 finished with value: 0.9312159043897801 and parameters: {'activation': 'tanh', 'solver': 'adam', 'lr': 7.192629584338353e-05, 'layer1': 209, 'layer2': 225, 'layer3': 46}. Best is trial 104 with value: 0.9327898309005132.
Klebsiella_Pneumoniae | LPS | Optuna:  72%|███████▏  | 144/200 [2:52:48<1:21:56, 87.80s/it, best=0.933]Klebsiella_Pneumoniae | LPS | Optuna:  72%|███████▏  | 144/200 [2:52:48<1:21:56, 87.80s/it, best=0.933][I 2026-03-04 22:51:15,042] Trial 128 finished with value: 0.8919309693616588 and parameters: {'activation': 'identity', 'solver': 'adam', 'lr': 0.0009533344097910664, 'layer1': 22, 'layer2': 93, 'layer3': 20}. Best is trial 124 with value: 0.8938450095328893.
Staphylococcus_Aureus | LPS | Optuna:  64%|██████▍   | 129/200 [2:52:57<1:02:20, 52.68s/it, best=0.894]Staphylococcus_Aureus | LPS | Optuna:  64%|██████▍   | 129/200 [2:52:57<1:02:20, 52.68s/it, best=0.894][I 2026-03-04 22:51:49,465] Trial 155 finished with value: 0.862192863023344 and parameters: {'activation': 'relu', 'solver': 'adam', 'lr': 0.000978578997999343, 'layer1': 355, 'layer2': 269, 'layer3': 481}. Best is trial 49 with value: 0.8647157569215889.
Pseudomonas_Aeruginosa | LPS | Optuna:  78%|███████▊  | 156/200 [2:53:31<54:52, 74.83s/it, best=0.865]Pseudomonas_Aeruginosa | LPS | Optuna:  78%|███████▊  | 156/200 [2:53:31<54:52, 74.83s/it, best=0.865][I 2026-03-04 22:51:51,626] Trial 63 finished with value: 0.8620718677889536 and parameters: {'activation': 'relu', 'solver': 'adam', 'lr': 3.995484261125948e-05, 'layer1': 336, 'layer2': 152, 'layer3': 438}. Best is trial 14 with value: 0.863668804271893.
Escherichia_Coli | LPS | Optuna:  32%|███▏      | 64/200 [2:53:33<7:02:54, 186.58s/it, best=0.864]Escherichia_Coli | LPS | Optuna:  32%|███▏      | 64/200 [2:53:33<7:02:54, 186.58s/it, best=0.864][I 2026-03-04 22:52:03,375] Trial 129 finished with value: 0.8904049263412956 and parameters: {'activation': 'identity', 'solver': 'adam', 'lr': 0.0002778566819958787, 'layer1': 34, 'layer2': 153, 'layer3': 48}. Best is trial 124 with value: 0.8938450095328893.
Staphylococcus_Aureus | LPS | Optuna:  65%|██████▌   | 130/200 [2:53:45<59:56, 51.37s/it, best=0.894]  Staphylococcus_Aureus | LPS | Optuna:  65%|██████▌   | 130/200 [2:53:45<59:56, 51.37s/it, best=0.894][I 2026-03-04 22:52:48,780] Trial 144 finished with value: 0.9306444082394181 and parameters: {'activation': 'tanh', 'solver': 'adam', 'lr': 3.633901171215619e-05, 'layer1': 73, 'layer2': 269, 'layer3': 27}. Best is trial 104 with value: 0.9327898309005132.
Klebsiella_Pneumoniae | LPS | Optuna:  72%|███████▎  | 145/200 [2:54:30<1:24:38, 92.34s/it, best=0.933]Klebsiella_Pneumoniae | LPS | Optuna:  72%|███████▎  | 145/200 [2:54:30<1:24:38, 92.34s/it, best=0.933][I 2026-03-04 22:52:59,036] Trial 156 finished with value: 0.8593477227392861 and parameters: {'activation': 'relu', 'solver': 'adam', 'lr': 0.0005001772803184625, 'layer1': 294, 'layer2': 258, 'layer3': 426}. Best is trial 49 with value: 0.8647157569215889.
Pseudomonas_Aeruginosa | LPS | Optuna:  78%|███████▊  | 157/200 [2:54:41<52:29, 73.25s/it, best=0.865]Pseudomonas_Aeruginosa | LPS | Optuna:  78%|███████▊  | 157/200 [2:54:41<52:29, 73.25s/it, best=0.865][I 2026-03-04 22:53:43,778] Trial 130 finished with value: 0.8872899479040368 and parameters: {'activation': 'relu', 'solver': 'adam', 'lr': 0.0005745249171771621, 'layer1': 262, 'layer2': 96, 'layer3': 31}. Best is trial 124 with value: 0.8938450095328893.
Staphylococcus_Aureus | LPS | Optuna:  66%|██████▌   | 131/200 [2:55:25<1:15:59, 66.08s/it, best=0.894]Staphylococcus_Aureus | LPS | Optuna:  66%|██████▌   | 131/200 [2:55:25<1:15:59, 66.08s/it, best=0.894][I 2026-03-04 22:54:20,873] Trial 145 finished with value: 0.9310659857743641 and parameters: {'activation': 'tanh', 'solver': 'adam', 'lr': 5.45711248941381e-05, 'layer1': 177, 'layer2': 240, 'layer3': 74}. Best is trial 104 with value: 0.9327898309005132.
Klebsiella_Pneumoniae | LPS | Optuna:  73%|███████▎  | 146/200 [2:56:03<1:23:02, 92.27s/it, best=0.933]Klebsiella_Pneumoniae | LPS | Optuna:  73%|███████▎  | 146/200 [2:56:03<1:23:02, 92.27s/it, best=0.933][I 2026-03-04 22:54:25,540] Trial 131 finished with value: 0.8917069317431909 and parameters: {'activation': 'identity', 'solver': 'adam', 'lr': 0.00071418459732175, 'layer1': 57, 'layer2': 81, 'layer3': 43}. Best is trial 124 with value: 0.8938450095328893.
Staphylococcus_Aureus | LPS | Optuna:  66%|██████▌   | 132/200 [2:56:07<1:06:37, 58.79s/it, best=0.894]Staphylococcus_Aureus | LPS | Optuna:  66%|██████▌   | 132/200 [2:56:07<1:06:37, 58.79s/it, best=0.894][I 2026-03-04 22:54:34,006] Trial 157 finished with value: 0.858936598810893 and parameters: {'activation': 'relu', 'solver': 'adam', 'lr': 0.0013866380284327802, 'layer1': 488, 'layer2': 351, 'layer3': 133}. Best is trial 49 with value: 0.8647157569215889.
Pseudomonas_Aeruginosa | LPS | Optuna:  79%|███████▉  | 158/200 [2:56:16<55:50, 79.77s/it, best=0.865]Pseudomonas_Aeruginosa | LPS | Optuna:  79%|███████▉  | 158/200 [2:56:16<55:50, 79.77s/it, best=0.865][I 2026-03-04 22:54:58,071] Trial 64 finished with value: 0.8607108105359036 and parameters: {'activation': 'relu', 'solver': 'adam', 'lr': 6.015997361506882e-05, 'layer1': 384, 'layer2': 201, 'layer3': 423}. Best is trial 14 with value: 0.863668804271893.
Escherichia_Coli | LPS | Optuna:  32%|███▎      | 65/200 [2:56:40<6:59:42, 186.54s/it, best=0.864]Escherichia_Coli | LPS | Optuna:  32%|███▎      | 65/200 [2:56:40<6:59:42, 186.54s/it, best=0.864][I 2026-03-04 22:55:02,893] Trial 146 finished with value: 0.9271435161627256 and parameters: {'activation': 'logistic', 'solver': 'adam', 'lr': 0.002428471290457449, 'layer1': 89, 'layer2': 77, 'layer3': 359}. Best is trial 104 with value: 0.9327898309005132.
Klebsiella_Pneumoniae | LPS | Optuna:  74%|███████▎  | 147/200 [2:56:45<1:08:11, 77.19s/it, best=0.933]Klebsiella_Pneumoniae | LPS | Optuna:  74%|███████▎  | 147/200 [2:56:45<1:08:11, 77.19s/it, best=0.933][I 2026-03-04 22:55:14,651] Trial 132 finished with value: 0.8908346470592636 and parameters: {'activation': 'identity', 'solver': 'adam', 'lr': 0.0004949910586357256, 'layer1': 43, 'layer2': 115, 'layer3': 167}. Best is trial 124 with value: 0.8938450095328893.
Staphylococcus_Aureus | LPS | Optuna:  66%|██████▋   | 133/200 [2:56:56<1:02:24, 55.88s/it, best=0.894]Staphylococcus_Aureus | LPS | Optuna:  66%|██████▋   | 133/200 [2:56:56<1:02:24, 55.88s/it, best=0.894][I 2026-03-04 22:55:34,783] Trial 158 finished with value: 0.8579184388899158 and parameters: {'activation': 'relu', 'solver': 'adam', 'lr': 0.0011682582744708785, 'layer1': 320, 'layer2': 211, 'layer3': 466}. Best is trial 49 with value: 0.8647157569215889.
Pseudomonas_Aeruginosa | LPS | Optuna:  80%|███████▉  | 159/200 [2:57:17<50:36, 74.07s/it, best=0.865]Pseudomonas_Aeruginosa | LPS | Optuna:  80%|███████▉  | 159/200 [2:57:17<50:36, 74.07s/it, best=0.865][I 2026-03-04 22:56:00,983] Trial 133 finished with value: 0.8928909574574633 and parameters: {'activation': 'identity', 'solver': 'adam', 'lr': 0.0012227062612136272, 'layer1': 76, 'layer2': 107, 'layer3': 138}. Best is trial 124 with value: 0.8938450095328893.
