Staphylococcus_Aureus | DirectMulti | Optuna:  45%|████▌     | 90/200 [4:13:49<4:57:14, 162.13s/it, best=0.893]Staphylococcus_Aureus | DirectMulti | Optuna:  45%|████▌     | 90/200 [4:13:49<4:57:14, 162.13s/it, best=0.893][I 2026-03-05 04:50:07,178] Trial 185 finished with value: 0.8588517076900752 and parameters: {'activation': 'relu', 'solver': 'adam', 'lr': 0.003599327505910614, 'layer1': 455, 'layer2': 361, 'layer3': 424}. Best is trial 161 with value: 0.8669185742695007.
Pseudomonas_Aeruginosa | DirectMulti | Optuna:  93%|█████████▎| 186/200 [4:56:01<24:38, 105.61s/it, best=0.867]Pseudomonas_Aeruginosa | DirectMulti | Optuna:  93%|█████████▎| 186/200 [4:56:01<24:38, 105.61s/it, best=0.867][I 2026-03-05 04:52:03,639] Trial 186 finished with value: 0.8616736825410491 and parameters: {'activation': 'relu', 'solver': 'adam', 'lr': 0.0025576834647639624, 'layer1': 435, 'layer2': 353, 'layer3': 421}. Best is trial 161 with value: 0.8669185742695007.
Pseudomonas_Aeruginosa | DirectMulti | Optuna:  94%|█████████▎| 187/200 [4:57:57<23:35, 108.87s/it, best=0.867]Pseudomonas_Aeruginosa | DirectMulti | Optuna:  94%|█████████▎| 187/200 [4:57:57<23:35, 108.87s/it, best=0.867][I 2026-03-05 04:52:41,236] Trial 156 finished with value: 0.8640520148114753 and parameters: {'activation': 'relu', 'solver': 'adam', 'lr': 2.1473785060895408e-05, 'layer1': 467, 'layer2': 32, 'layer3': 485}. Best is trial 139 with value: 0.8649329422529497.
Escherichia_Coli | LPS | Optuna:  78%|███████▊  | 157/200 [8:54:23<3:10:33, 265.89s/it, best=0.865]Escherichia_Coli | LPS | Optuna:  78%|███████▊  | 157/200 [8:54:23<3:10:33, 265.89s/it, best=0.865][I 2026-03-05 04:53:03,545] Trial 187 finished with value: 0.8292338960006855 and parameters: {'activation': 'tanh', 'solver': 'adam', 'lr': 0.0038826829754702408, 'layer1': 462, 'layer2': 37, 'layer3': 323}. Best is trial 161 with value: 0.8669185742695007.
Pseudomonas_Aeruginosa | DirectMulti | Optuna:  94%|█████████▍| 188/200 [4:58:57<18:50, 94.18s/it, best=0.867] Pseudomonas_Aeruginosa | DirectMulti | Optuna:  94%|█████████▍| 188/200 [4:58:57<18:50, 94.18s/it, best=0.867][I 2026-03-05 04:55:00,171] Trial 188 finished with value: 0.8614241045997039 and parameters: {'activation': 'relu', 'solver': 'adam', 'lr': 0.002279091644166857, 'layer1': 492, 'layer2': 309, 'layer3': 447}. Best is trial 161 with value: 0.8669185742695007.
Pseudomonas_Aeruginosa | DirectMulti | Optuna:  94%|█████████▍| 189/200 [5:00:54<18:30, 100.91s/it, best=0.867]Pseudomonas_Aeruginosa | DirectMulti | Optuna:  94%|█████████▍| 189/200 [5:00:54<18:30, 100.91s/it, best=0.867][I 2026-03-05 04:55:41,585] Trial 189 finished with value: 0.8585974119424794 and parameters: {'activation': 'relu', 'solver': 'adam', 'lr': 0.0031418917013874355, 'layer1': 75, 'layer2': 373, 'layer3': 273}. Best is trial 161 with value: 0.8669185742695007.
Pseudomonas_Aeruginosa | DirectMulti | Optuna:  95%|█████████▌| 190/200 [5:01:35<13:50, 83.06s/it, best=0.867] Pseudomonas_Aeruginosa | DirectMulti | Optuna:  95%|█████████▌| 190/200 [5:01:35<13:50, 83.06s/it, best=0.867][I 2026-03-05 04:56:33,444] Trial 90 finished with value: 0.8909541775281955 and parameters: {'activation': 'identity', 'solver': 'adam', 'lr': 7.489344494996159e-06, 'layer1': 390, 'layer2': 457, 'layer3': 36}. Best is trial 62 with value: 0.8933826282053527.
Staphylococcus_Aureus | DirectMulti | Optuna:  46%|████▌     | 91/200 [4:21:51<7:48:46, 258.04s/it, best=0.893]Staphylococcus_Aureus | DirectMulti | Optuna:  46%|████▌     | 91/200 [4:21:51<7:48:46, 258.04s/it, best=0.893][I 2026-03-05 04:56:50,588] Trial 157 finished with value: 0.8633774549970653 and parameters: {'activation': 'relu', 'solver': 'adam', 'lr': 3.682713431168726e-05, 'layer1': 493, 'layer2': 49, 'layer3': 482}. Best is trial 139 with value: 0.8649329422529497.
Escherichia_Coli | LPS | Optuna:  79%|███████▉  | 158/200 [8:58:32<3:02:38, 260.93s/it, best=0.865]Escherichia_Coli | LPS | Optuna:  79%|███████▉  | 158/200 [8:58:32<3:02:38, 260.93s/it, best=0.865][I 2026-03-05 04:57:14,002] Trial 190 finished with value: 0.8617891740419159 and parameters: {'activation': 'relu', 'solver': 'adam', 'lr': 0.004576034974252993, 'layer1': 449, 'layer2': 336, 'layer3': 309}. Best is trial 161 with value: 0.8669185742695007.
Pseudomonas_Aeruginosa | DirectMulti | Optuna:  96%|█████████▌| 191/200 [5:03:08<12:52, 85.87s/it, best=0.867]Pseudomonas_Aeruginosa | DirectMulti | Optuna:  96%|█████████▌| 191/200 [5:03:08<12:52, 85.87s/it, best=0.867][I 2026-03-05 04:59:00,325] Trial 191 finished with value: 0.8602999103182004 and parameters: {'activation': 'relu', 'solver': 'adam', 'lr': 0.005766485081218651, 'layer1': 444, 'layer2': 387, 'layer3': 403}. Best is trial 161 with value: 0.8669185742695007.
Pseudomonas_Aeruginosa | DirectMulti | Optuna:  96%|█████████▌| 192/200 [5:04:54<12:16, 92.01s/it, best=0.867]Pseudomonas_Aeruginosa | DirectMulti | Optuna:  96%|█████████▌| 192/200 [5:04:54<12:16, 92.01s/it, best=0.867][I 2026-03-05 05:00:44,028] Trial 192 finished with value: 0.8638961792186961 and parameters: {'activation': 'relu', 'solver': 'adam', 'lr': 0.003587122929853495, 'layer1': 461, 'layer2': 403, 'layer3': 413}. Best is trial 161 with value: 0.8669185742695007.
Pseudomonas_Aeruginosa | DirectMulti | Optuna:  96%|█████████▋| 193/200 [5:06:38<11:08, 95.51s/it, best=0.867]Pseudomonas_Aeruginosa | DirectMulti | Optuna:  96%|█████████▋| 193/200 [5:06:38<11:08, 95.51s/it, best=0.867][I 2026-03-05 05:01:31,031] Trial 91 finished with value: 0.892289568826474 and parameters: {'activation': 'identity', 'solver': 'adam', 'lr': 1.1466371337881861e-05, 'layer1': 376, 'layer2': 420, 'layer3': 65}. Best is trial 62 with value: 0.8933826282053527.
Staphylococcus_Aureus | DirectMulti | Optuna:  46%|████▌     | 92/200 [4:26:48<8:05:50, 269.91s/it, best=0.893]Staphylococcus_Aureus | DirectMulti | Optuna:  46%|████▌     | 92/200 [4:26:48<8:05:50, 269.91s/it, best=0.893][I 2026-03-05 05:02:40,595] Trial 193 finished with value: 0.8616540598352129 and parameters: {'activation': 'relu', 'solver': 'adam', 'lr': 0.0029046137085619026, 'layer1': 478, 'layer2': 399, 'layer3': 412}. Best is trial 161 with value: 0.8669185742695007.
Pseudomonas_Aeruginosa | DirectMulti | Optuna:  97%|█████████▋| 194/200 [5:08:34<10:10, 101.83s/it, best=0.867]Pseudomonas_Aeruginosa | DirectMulti | Optuna:  97%|█████████▋| 194/200 [5:08:34<10:10, 101.83s/it, best=0.867][I 2026-03-05 05:02:42,012] Trial 158 finished with value: 0.8620161243339328 and parameters: {'activation': 'relu', 'solver': 'adam', 'lr': 1.56656916157077e-05, 'layer1': 476, 'layer2': 32, 'layer3': 465}. Best is trial 139 with value: 0.8649329422529497.
Escherichia_Coli | LPS | Optuna:  80%|███████▉  | 159/200 [9:04:24<3:16:51, 288.08s/it, best=0.865]Escherichia_Coli | LPS | Optuna:  80%|███████▉  | 159/200 [9:04:24<3:16:51, 288.08s/it, best=0.865][I 2026-03-05 05:04:49,975] Trial 92 finished with value: 0.8920523066828349 and parameters: {'activation': 'identity', 'solver': 'adam', 'lr': 1.966066011703954e-05, 'layer1': 353, 'layer2': 418, 'layer3': 74}. Best is trial 62 with value: 0.8933826282053527.
Staphylococcus_Aureus | DirectMulti | Optuna:  46%|████▋     | 93/200 [4:30:07<7:23:22, 248.62s/it, best=0.893]Staphylococcus_Aureus | DirectMulti | Optuna:  46%|████▋     | 93/200 [4:30:07<7:23:22, 248.62s/it, best=0.893][I 2026-03-05 05:04:56,840] Trial 194 finished with value: 0.8619975271432392 and parameters: {'activation': 'relu', 'solver': 'adam', 'lr': 0.00343160153648151, 'layer1': 463, 'layer2': 405, 'layer3': 442}. Best is trial 161 with value: 0.8669185742695007.
Pseudomonas_Aeruginosa | DirectMulti | Optuna:  98%|█████████▊| 195/200 [5:10:50<09:20, 112.15s/it, best=0.867]Pseudomonas_Aeruginosa | DirectMulti | Optuna:  98%|█████████▊| 195/200 [5:10:50<09:20, 112.15s/it, best=0.867][I 2026-03-05 05:06:01,884] Trial 159 finished with value: 0.8629932963409533 and parameters: {'activation': 'relu', 'solver': 'adam', 'lr': 5.852186339454008e-05, 'layer1': 480, 'layer2': 30, 'layer3': 486}. Best is trial 139 with value: 0.8649329422529497.
Escherichia_Coli | LPS | Optuna:  80%|████████  | 160/200 [9:07:43<2:54:24, 261.61s/it, best=0.865]Escherichia_Coli | LPS | Optuna:  80%|████████  | 160/200 [9:07:43<2:54:24, 261.61s/it, best=0.865][I 2026-03-05 05:06:52,464] Trial 195 finished with value: 0.8626899560249071 and parameters: {'activation': 'relu', 'solver': 'adam', 'lr': 0.00413446569282964, 'layer1': 454, 'layer2': 363, 'layer3': 390}. Best is trial 161 with value: 0.8669185742695007.
Pseudomonas_Aeruginosa | DirectMulti | Optuna:  98%|█████████▊| 196/200 [5:12:46<07:32, 113.20s/it, best=0.867]Pseudomonas_Aeruginosa | DirectMulti | Optuna:  98%|█████████▊| 196/200 [5:12:46<07:32, 113.20s/it, best=0.867][I 2026-03-05 05:08:25,131] Trial 196 finished with value: 0.8589311792509904 and parameters: {'activation': 'relu', 'solver': 'adam', 'lr': 0.001980294391400617, 'layer1': 474, 'layer2': 410, 'layer3': 337}. Best is trial 161 with value: 0.8669185742695007.
Pseudomonas_Aeruginosa | DirectMulti | Optuna:  98%|█████████▊| 197/200 [5:14:19<05:21, 107.04s/it, best=0.867]Pseudomonas_Aeruginosa | DirectMulti | Optuna:  98%|█████████▊| 197/200 [5:14:19<05:21, 107.04s/it, best=0.867][I 2026-03-05 05:09:43,073] Trial 93 finished with value: 0.8924949379847653 and parameters: {'activation': 'identity', 'solver': 'adam', 'lr': 1.2599574076092518e-05, 'layer1': 349, 'layer2': 418, 'layer3': 68}. Best is trial 62 with value: 0.8933826282053527.
Staphylococcus_Aureus | DirectMulti | Optuna:  47%|████▋     | 94/200 [4:35:00<7:42:48, 261.96s/it, best=0.893]Staphylococcus_Aureus | DirectMulti | Optuna:  47%|████▋     | 94/200 [4:35:00<7:42:48, 261.96s/it, best=0.893][I 2026-03-05 05:09:56,092] Trial 197 finished with value: 0.8607263363521984 and parameters: {'activation': 'relu', 'solver': 'adam', 'lr': 0.00261761980399209, 'layer1': 428, 'layer2': 343, 'layer3': 432}. Best is trial 161 with value: 0.8669185742695007.
Pseudomonas_Aeruginosa | DirectMulti | Optuna:  99%|█████████▉| 198/200 [5:15:50<03:24, 102.21s/it, best=0.867]Pseudomonas_Aeruginosa | DirectMulti | Optuna:  99%|█████████▉| 198/200 [5:15:50<03:24, 102.21s/it, best=0.867][I 2026-03-05 05:10:42,010] Trial 198 finished with value: 0.8272167479341297 and parameters: {'activation': 'tanh', 'solver': 'sgd', 'lr': 0.0035529812314278163, 'layer1': 467, 'layer2': 395, 'layer3': 323}. Best is trial 161 with value: 0.8669185742695007.
Pseudomonas_Aeruginosa | DirectMulti | Optuna: 100%|█████████▉| 199/200 [5:16:36<01:25, 85.33s/it, best=0.867] Pseudomonas_Aeruginosa | DirectMulti | Optuna: 100%|█████████▉| 199/200 [5:16:36<01:25, 85.33s/it, best=0.867][I 2026-03-05 05:11:08,665] Trial 160 finished with value: 0.8622133082444341 and parameters: {'activation': 'relu', 'solver': 'adam', 'lr': 3.13530301484894e-05, 'layer1': 495, 'layer2': 57, 'layer3': 78}. Best is trial 139 with value: 0.8649329422529497.
Escherichia_Coli | LPS | Optuna:  80%|████████  | 161/200 [9:12:50<2:58:51, 275.16s/it, best=0.865]Escherichia_Coli | LPS | Optuna:  80%|████████  | 161/200 [9:12:50<2:58:51, 275.16s/it, best=0.865][I 2026-03-05 05:12:20,198] Trial 199 finished with value: 0.8646643850083426 and parameters: {'activation': 'relu', 'solver': 'adam', 'lr': 0.005112306654577843, 'layer1': 441, 'layer2': 377, 'layer3': 414}. Best is trial 161 with value: 0.8669185742695007.
Pseudomonas_Aeruginosa | DirectMulti | Optuna: 100%|██████████| 200/200 [5:18:14<00:00, 89.18s/it, best=0.867]Pseudomonas_Aeruginosa | DirectMulti | Optuna: 100%|██████████| 200/200 [5:18:14<00:00, 89.18s/it, best=0.867]                                                                                                              [Pseudomonas_Aeruginosa | DirectMulti] [OPTUNA DONE] Best CV WF1=0.8669 | params={'activation': 'relu', 'solver': 'adam', 'lr': 0.002765076022894333, 'layer1': 463, 'layer2': 472, 'layer3': 327}
[Pseudomonas_Aeruginosa | DirectMulti] Retraining with validation early stopping (10% split)...
[Pseudomonas_Aeruginosa | DirectMulti] Testing...
[Pseudomonas_Aeruginosa | DirectMulti] [TEST] WF1=0.8503 | ACC=0.8761 | HL=0.1239 | best_val_WF1=0.8410

[END] Species: Pseudomonas_Aeruginosa done.
[Parallel(n_jobs=5)]: Done   2 out of   4 | elapsed: 554.5min remaining: 554.5min
[I 2026-03-05 05:13:58,395] Trial 94 finished with value: 0.8910898735634987 and parameters: {'activation': 'identity', 'solver': 'adam', 'lr': 1.1940500871409285e-05, 'layer1': 328, 'layer2': 442, 'layer3': 38}. Best is trial 62 with value: 0.8933826282053527.
Staphylococcus_Aureus | DirectMulti | Optuna:  48%|████▊     | 95/200 [4:39:16<7:34:56, 259.97s/it, best=0.893]Staphylococcus_Aureus | DirectMulti | Optuna:  48%|████▊     | 95/200 [4:39:16<7:34:56, 259.97s/it, best=0.893][I 2026-03-05 05:14:47,589] Trial 95 finished with value: 0.8043224714145548 and parameters: {'activation': 'identity', 'solver': 'adam', 'lr': 4.198169410375091e-06, 'layer1': 311, 'layer2': 374, 'layer3': 54}. Best is trial 62 with value: 0.8933826282053527.
Staphylococcus_Aureus | DirectMulti | Optuna:  48%|████▊     | 96/200 [4:40:05<5:41:00, 196.74s/it, best=0.893]Staphylococcus_Aureus | DirectMulti | Optuna:  48%|████▊     | 96/200 [4:40:05<5:41:00, 196.74s/it, best=0.893][I 2026-03-05 05:15:04,408] Trial 161 finished with value: 0.8625838987711774 and parameters: {'activation': 'relu', 'solver': 'adam', 'lr': 2.126797011298738e-05, 'layer1': 463, 'layer2': 22, 'layer3': 500}. Best is trial 139 with value: 0.8649329422529497.
Escherichia_Coli | LPS | Optuna:  81%|████████  | 162/200 [9:16:46<2:46:46, 263.34s/it, best=0.865]Escherichia_Coli | LPS | Optuna:  81%|████████  | 162/200 [9:16:46<2:46:46, 263.34s/it, best=0.865][I 2026-03-05 05:17:02,613] Trial 96 finished with value: 0.8925926999402991 and parameters: {'activation': 'identity', 'solver': 'adam', 'lr': 2.6896471952995237e-05, 'layer1': 372, 'layer2': 482, 'layer3': 70}. Best is trial 62 with value: 0.8933826282053527.
Staphylococcus_Aureus | DirectMulti | Optuna:  48%|████▊     | 97/200 [4:42:20<5:05:56, 178.22s/it, best=0.893]Staphylococcus_Aureus | DirectMulti | Optuna:  48%|████▊     | 97/200 [4:42:20<5:05:56, 178.22s/it, best=0.893][I 2026-03-05 05:18:46,873] Trial 162 finished with value: 0.8618450273503082 and parameters: {'activation': 'relu', 'solver': 'adam', 'lr': 2.0537848264221353e-05, 'layer1': 467, 'layer2': 19, 'layer3': 490}. Best is trial 139 with value: 0.8649329422529497.
Escherichia_Coli | LPS | Optuna:  82%|████████▏ | 163/200 [9:20:28<2:34:49, 251.08s/it, best=0.865]Escherichia_Coli | LPS | Optuna:  82%|████████▏ | 163/200 [9:20:28<2:34:49, 251.08s/it, best=0.865][I 2026-03-05 05:19:48,612] Trial 97 finished with value: 0.8911592290509496 and parameters: {'activation': 'identity', 'solver': 'adam', 'lr': 2.489286922740553e-05, 'layer1': 413, 'layer2': 481, 'layer3': 67}. Best is trial 62 with value: 0.8933826282053527.
Staphylococcus_Aureus | DirectMulti | Optuna:  49%|████▉     | 98/200 [4:45:06<4:56:44, 174.56s/it, best=0.893]Staphylococcus_Aureus | DirectMulti | Optuna:  49%|████▉     | 98/200 [4:45:06<4:56:44, 174.56s/it, best=0.893][I 2026-03-05 05:21:39,018] Trial 98 finished with value: 0.8910392752997268 and parameters: {'activation': 'identity', 'solver': 'adam', 'lr': 3.639147349183373e-05, 'layer1': 297, 'layer2': 384, 'layer3': 67}. Best is trial 62 with value: 0.8933826282053527.
Staphylococcus_Aureus | DirectMulti | Optuna:  50%|████▉     | 99/200 [4:46:56<4:21:26, 155.31s/it, best=0.893]Staphylococcus_Aureus | DirectMulti | Optuna:  50%|████▉     | 99/200 [4:46:56<4:21:26, 155.31s/it, best=0.893][I 2026-03-05 05:22:10,189] Trial 163 finished with value: 0.8641876002640867 and parameters: {'activation': 'relu', 'solver': 'adam', 'lr': 2.9518625420209488e-05, 'layer1': 476, 'layer2': 41, 'layer3': 474}. Best is trial 139 with value: 0.8649329422529497.
Escherichia_Coli | LPS | Optuna:  82%|████████▏ | 164/200 [9:23:52<2:22:02, 236.75s/it, best=0.865]Escherichia_Coli | LPS | Optuna:  82%|████████▏ | 164/200 [9:23:52<2:22:02, 236.75s/it, best=0.865][I 2026-03-05 05:23:28,138] Trial 99 finished with value: 0.8912026937625829 and parameters: {'activation': 'identity', 'solver': 'adam', 'lr': 4.811310251616577e-05, 'layer1': 373, 'layer2': 408, 'layer3': 36}. Best is trial 62 with value: 0.8933826282053527.
Staphylococcus_Aureus | DirectMulti | Optuna:  50%|█████     | 100/200 [4:48:45<3:55:45, 141.45s/it, best=0.893]Staphylococcus_Aureus | DirectMulti | Optuna:  50%|█████     | 100/200 [4:48:45<3:55:45, 141.45s/it, best=0.893][I 2026-03-05 05:24:50,363] Trial 164 finished with value: 0.8632582429300044 and parameters: {'activation': 'relu', 'solver': 'adam', 'lr': 4.477933255173051e-05, 'layer1': 483, 'layer2': 44, 'layer3': 468}. Best is trial 139 with value: 0.8649329422529497.
Escherichia_Coli | LPS | Optuna:  82%|████████▎ | 165/200 [9:26:32<2:04:42, 213.78s/it, best=0.865]Escherichia_Coli | LPS | Optuna:  82%|████████▎ | 165/200 [9:26:32<2:04:42, 213.78s/it, best=0.865][I 2026-03-05 05:26:03,606] Trial 100 finished with value: 0.758896081315561 and parameters: {'activation': 'identity', 'solver': 'sgd', 'lr': 1.2976204327349683e-05, 'layer1': 339, 'layer2': 445, 'layer3': 47}. Best is trial 62 with value: 0.8933826282053527.
Staphylococcus_Aureus | DirectMulti | Optuna:  50%|█████     | 101/200 [4:51:21<4:00:20, 145.66s/it, best=0.893]Staphylococcus_Aureus | DirectMulti | Optuna:  50%|█████     | 101/200 [4:51:21<4:00:20, 145.66s/it, best=0.893][I 2026-03-05 05:28:35,551] Trial 165 finished with value: 0.863236970013177 and parameters: {'activation': 'relu', 'solver': 'adam', 'lr': 3.224462385501209e-05, 'layer1': 493, 'layer2': 37, 'layer3': 457}. Best is trial 139 with value: 0.8649329422529497.
Escherichia_Coli | LPS | Optuna:  83%|████████▎ | 166/200 [9:30:17<2:03:04, 217.20s/it, best=0.865]Escherichia_Coli | LPS | Optuna:  83%|████████▎ | 166/200 [9:30:17<2:03:04, 217.20s/it, best=0.865][I 2026-03-05 05:30:32,277] Trial 101 finished with value: 0.8911800981453254 and parameters: {'activation': 'identity', 'solver': 'adam', 'lr': 8.814791746555144e-06, 'layer1': 355, 'layer2': 461, 'layer3': 82}. Best is trial 62 with value: 0.8933826282053527.
Staphylococcus_Aureus | DirectMulti | Optuna:  51%|█████     | 102/200 [4:55:49<4:58:11, 182.56s/it, best=0.893]Staphylococcus_Aureus | DirectMulti | Optuna:  51%|█████     | 102/200 [4:55:49<4:58:11, 182.56s/it, best=0.893][I 2026-03-05 05:31:21,824] Trial 166 finished with value: 0.8620857726195853 and parameters: {'activation': 'relu', 'solver': 'adam', 'lr': 3.808588224686415e-05, 'layer1': 477, 'layer2': 47, 'layer3': 477}. Best is trial 139 with value: 0.8649329422529497.
Escherichia_Coli | LPS | Optuna:  84%|████████▎ | 167/200 [9:33:03<1:51:03, 201.92s/it, best=0.865]Escherichia_Coli | LPS | Optuna:  84%|████████▎ | 167/200 [9:33:03<1:51:03, 201.92s/it, best=0.865][I 2026-03-05 05:33:07,225] Trial 102 finished with value: 0.8935277328516141 and parameters: {'activation': 'identity', 'solver': 'adam', 'lr': 2.1629440028622046e-05, 'layer1': 318, 'layer2': 434, 'layer3': 55}. Best is trial 102 with value: 0.8935277328516141.
Staphylococcus_Aureus | DirectMulti | Optuna:  52%|█████▏    | 103/200 [4:58:24<4:41:44, 174.28s/it, best=0.893]Staphylococcus_Aureus | DirectMulti | Optuna:  52%|█████▏    | 103/200 [4:58:24<4:41:44, 174.28s/it, best=0.893][I 2026-03-05 05:34:54,152] Trial 167 finished with value: 0.8633262545228687 and parameters: {'activation': 'relu', 'solver': 'adam', 'lr': 2.9332741187406707e-05, 'layer1': 500, 'layer2': 29, 'layer3': 460}. Best is trial 139 with value: 0.8649329422529497.
Escherichia_Coli | LPS | Optuna:  84%|████████▍ | 168/200 [9:36:36<1:49:21, 205.04s/it, best=0.865]Escherichia_Coli | LPS | Optuna:  84%|████████▍ | 168/200 [9:36:36<1:49:21, 205.04s/it, best=0.865][I 2026-03-05 05:35:53,155] Trial 103 finished with value: 0.8915001932294725 and parameters: {'activation': 'identity', 'solver': 'adam', 'lr': 2.1192889409841653e-05, 'layer1': 319, 'layer2': 479, 'layer3': 59}. Best is trial 102 with value: 0.8935277328516141.
Staphylococcus_Aureus | DirectMulti | Optuna:  52%|█████▏    | 104/200 [5:01:10<4:34:50, 171.77s/it, best=0.893]Staphylococcus_Aureus | DirectMulti | Optuna:  52%|█████▏    | 104/200 [5:01:10<4:34:50, 171.77s/it, best=0.893][I 2026-03-05 05:37:33,775] Trial 168 finished with value: 0.8620342399585134 and parameters: {'activation': 'relu', 'solver': 'adam', 'lr': 4.677296255351112e-05, 'layer1': 472, 'layer2': 10, 'layer3': 482}. Best is trial 139 with value: 0.8649329422529497.
Escherichia_Coli | LPS | Optuna:  84%|████████▍ | 169/200 [9:39:15<1:38:53, 191.42s/it, best=0.865]Escherichia_Coli | LPS | Optuna:  84%|████████▍ | 169/200 [9:39:15<1:38:53, 191.42s/it, best=0.865][I 2026-03-05 05:39:15,638] Trial 104 finished with value: 0.892454275937985 and parameters: {'activation': 'identity', 'solver': 'adam', 'lr': 1.5975390912337347e-05, 'layer1': 298, 'layer2': 435, 'layer3': 17}. Best is trial 102 with value: 0.8935277328516141.
Staphylococcus_Aureus | DirectMulti | Optuna:  52%|█████▎    | 105/200 [5:04:33<4:46:33, 180.99s/it, best=0.893]Staphylococcus_Aureus | DirectMulti | Optuna:  52%|█████▎    | 105/200 [5:04:33<4:46:33, 180.99s/it, best=0.893][I 2026-03-05 05:41:13,743] Trial 169 finished with value: 0.8650159865951903 and parameters: {'activation': 'relu', 'solver': 'adam', 'lr': 2.4384211925309443e-05, 'layer1': 488, 'layer2': 64, 'layer3': 471}. Best is trial 169 with value: 0.8650159865951903.
