Klebsiella_Pneumoniae | LPS | Optuna:  56%|█████▋    | 113/200 [2:05:04<2:06:08, 87.00s/it, best=0.933]Klebsiella_Pneumoniae | LPS | Optuna:  56%|█████▋    | 113/200 [2:05:04<2:06:08, 87.00s/it, best=0.933][I 2026-03-04 22:03:35,006] Trial 87 finished with value: 0.8886186298841234 and parameters: {'activation': 'relu', 'solver': 'adam', 'lr': 0.0009354775689284922, 'layer1': 286, 'layer2': 48, 'layer3': 38}. Best is trial 82 with value: 0.8934684233581975.
Staphylococcus_Aureus | LPS | Optuna:  44%|████▍     | 88/200 [2:05:17<2:19:36, 74.79s/it, best=0.893]Staphylococcus_Aureus | LPS | Optuna:  44%|████▍     | 88/200 [2:05:17<2:19:36, 74.79s/it, best=0.893][I 2026-03-04 22:04:34,083] Trial 116 finished with value: 0.8559896596094518 and parameters: {'activation': 'identity', 'solver': 'adam', 'lr': 0.0006119553081991071, 'layer1': 485, 'layer2': 109, 'layer3': 268}. Best is trial 49 with value: 0.8647157569215889.
Pseudomonas_Aeruginosa | LPS | Optuna:  58%|█████▊    | 117/200 [2:06:16<1:50:43, 80.05s/it, best=0.865]Pseudomonas_Aeruginosa | LPS | Optuna:  58%|█████▊    | 117/200 [2:06:16<1:50:43, 80.05s/it, best=0.865][I 2026-03-04 22:04:43,348] Trial 88 finished with value: 0.889644529809182 and parameters: {'activation': 'identity', 'solver': 'adam', 'lr': 0.0006605765324286325, 'layer1': 192, 'layer2': 373, 'layer3': 12}. Best is trial 82 with value: 0.8934684233581975.
Staphylococcus_Aureus | LPS | Optuna:  44%|████▍     | 89/200 [2:06:25<2:14:47, 72.86s/it, best=0.893]Staphylococcus_Aureus | LPS | Optuna:  44%|████▍     | 89/200 [2:06:25<2:14:47, 72.86s/it, best=0.893][I 2026-03-04 22:04:43,389] Trial 113 finished with value: 0.9326300345254162 and parameters: {'activation': 'tanh', 'solver': 'adam', 'lr': 5.103786192477762e-05, 'layer1': 62, 'layer2': 241, 'layer3': 54}. Best is trial 104 with value: 0.9327898309005132.
Klebsiella_Pneumoniae | LPS | Optuna:  57%|█████▋    | 114/200 [2:06:25<2:02:03, 85.15s/it, best=0.933]Klebsiella_Pneumoniae | LPS | Optuna:  57%|█████▋    | 114/200 [2:06:25<2:02:03, 85.15s/it, best=0.933][I 2026-03-04 22:05:42,721] Trial 117 finished with value: 0.8598279601936032 and parameters: {'activation': 'identity', 'solver': 'adam', 'lr': 0.00039147541673871717, 'layer1': 429, 'layer2': 131, 'layer3': 292}. Best is trial 49 with value: 0.8647157569215889.
Pseudomonas_Aeruginosa | LPS | Optuna:  59%|█████▉    | 118/200 [2:07:24<1:44:43, 76.62s/it, best=0.865]Pseudomonas_Aeruginosa | LPS | Optuna:  59%|█████▉    | 118/200 [2:07:24<1:44:43, 76.62s/it, best=0.865][I 2026-03-04 22:05:51,133] Trial 48 finished with value: 0.8624493998624766 and parameters: {'activation': 'relu', 'solver': 'adam', 'lr': 1.652712357887551e-05, 'layer1': 386, 'layer2': 238, 'layer3': 495}. Best is trial 14 with value: 0.863668804271893.
Escherichia_Coli | LPS | Optuna:  24%|██▍       | 49/200 [2:07:33<8:14:13, 196.38s/it, best=0.864]Escherichia_Coli | LPS | Optuna:  24%|██▍       | 49/200 [2:07:33<8:14:13, 196.38s/it, best=0.864][I 2026-03-04 22:06:29,360] Trial 89 finished with value: 0.8886565684756228 and parameters: {'activation': 'tanh', 'solver': 'adam', 'lr': 0.00021831107891025778, 'layer1': 230, 'layer2': 68, 'layer3': 83}. Best is trial 82 with value: 0.8934684233581975.
Staphylococcus_Aureus | LPS | Optuna:  45%|████▌     | 90/200 [2:08:11<2:31:48, 82.80s/it, best=0.893]Staphylococcus_Aureus | LPS | Optuna:  45%|████▌     | 90/200 [2:08:11<2:31:48, 82.80s/it, best=0.893][I 2026-03-04 22:06:41,248] Trial 114 finished with value: 0.9085190505107287 and parameters: {'activation': 'tanh', 'solver': 'adam', 'lr': 4.7799667642689656e-05, 'layer1': 241, 'layer2': 244, 'layer3': 14}. Best is trial 104 with value: 0.9327898309005132.
Klebsiella_Pneumoniae | LPS | Optuna:  57%|█████▊    | 115/200 [2:08:23<2:14:31, 94.96s/it, best=0.933]Klebsiella_Pneumoniae | LPS | Optuna:  57%|█████▊    | 115/200 [2:08:23<2:14:31, 94.96s/it, best=0.933][I 2026-03-04 22:07:15,149] Trial 118 finished with value: 0.8584876779593479 and parameters: {'activation': 'identity', 'solver': 'adam', 'lr': 0.0010770198309404896, 'layer1': 498, 'layer2': 86, 'layer3': 310}. Best is trial 49 with value: 0.8647157569215889.
Pseudomonas_Aeruginosa | LPS | Optuna:  60%|█████▉    | 119/200 [2:08:57<1:49:50, 81.36s/it, best=0.865]Pseudomonas_Aeruginosa | LPS | Optuna:  60%|█████▉    | 119/200 [2:08:57<1:49:50, 81.36s/it, best=0.865][I 2026-03-04 22:07:40,928] Trial 90 finished with value: 0.8934794004485915 and parameters: {'activation': 'identity', 'solver': 'adam', 'lr': 0.00032090679577429133, 'layer1': 138, 'layer2': 25, 'layer3': 140}. Best is trial 90 with value: 0.8934794004485915.
Staphylococcus_Aureus | LPS | Optuna:  46%|████▌     | 91/200 [2:09:23<2:24:18, 79.43s/it, best=0.893]Staphylococcus_Aureus | LPS | Optuna:  46%|████▌     | 91/200 [2:09:23<2:24:18, 79.43s/it, best=0.893][I 2026-03-04 22:07:49,565] Trial 49 finished with value: 0.7412361348670821 and parameters: {'activation': 'relu', 'solver': 'adam', 'lr': 5.7652693794168246e-06, 'layer1': 390, 'layer2': 294, 'layer3': 500}. Best is trial 14 with value: 0.863668804271893.
Escherichia_Coli | LPS | Optuna:  25%|██▌       | 50/200 [2:09:31<7:12:29, 173.00s/it, best=0.864]Escherichia_Coli | LPS | Optuna:  25%|██▌       | 50/200 [2:09:31<7:12:29, 173.00s/it, best=0.864][I 2026-03-04 22:08:37,997] Trial 119 finished with value: 0.8604817369175155 and parameters: {'activation': 'identity', 'solver': 'adam', 'lr': 0.00016622171709034599, 'layer1': 450, 'layer2': 166, 'layer3': 273}. Best is trial 49 with value: 0.8647157569215889.
Pseudomonas_Aeruginosa | LPS | Optuna:  60%|██████    | 120/200 [2:10:20<1:49:04, 81.81s/it, best=0.865]Pseudomonas_Aeruginosa | LPS | Optuna:  60%|██████    | 120/200 [2:10:20<1:49:04, 81.81s/it, best=0.865][I 2026-03-04 22:08:45,500] Trial 91 finished with value: 0.8923484719051323 and parameters: {'activation': 'identity', 'solver': 'adam', 'lr': 0.00032883222933916657, 'layer1': 140, 'layer2': 23, 'layer3': 140}. Best is trial 90 with value: 0.8934794004485915.
Staphylococcus_Aureus | LPS | Optuna:  46%|████▌     | 92/200 [2:10:27<2:14:57, 74.97s/it, best=0.893]Staphylococcus_Aureus | LPS | Optuna:  46%|████▌     | 92/200 [2:10:27<2:14:57, 74.97s/it, best=0.893][I 2026-03-04 22:09:09,387] Trial 115 finished with value: 0.9325121485815766 and parameters: {'activation': 'tanh', 'solver': 'adam', 'lr': 2.689104217701963e-05, 'layer1': 217, 'layer2': 203, 'layer3': 49}. Best is trial 104 with value: 0.9327898309005132.
Klebsiella_Pneumoniae | LPS | Optuna:  58%|█████▊    | 116/200 [2:10:51<2:35:16, 110.92s/it, best=0.933]Klebsiella_Pneumoniae | LPS | Optuna:  58%|█████▊    | 116/200 [2:10:51<2:35:16, 110.92s/it, best=0.933][I 2026-03-04 22:09:56,316] Trial 92 finished with value: 0.8901495878874268 and parameters: {'activation': 'identity', 'solver': 'adam', 'lr': 0.0002446533113365057, 'layer1': 158, 'layer2': 27, 'layer3': 138}. Best is trial 90 with value: 0.8934794004485915.
Staphylococcus_Aureus | LPS | Optuna:  46%|████▋     | 93/200 [2:11:38<2:11:28, 73.73s/it, best=0.893]Staphylococcus_Aureus | LPS | Optuna:  46%|████▋     | 93/200 [2:11:38<2:11:28, 73.73s/it, best=0.893][I 2026-03-04 22:10:17,076] Trial 50 finished with value: 0.85998987827825 and parameters: {'activation': 'tanh', 'solver': 'adam', 'lr': 0.00014597779157691457, 'layer1': 462, 'layer2': 240, 'layer3': 442}. Best is trial 14 with value: 0.863668804271893.
Escherichia_Coli | LPS | Optuna:  26%|██▌       | 51/200 [2:11:59<6:50:37, 165.35s/it, best=0.864]Escherichia_Coli | LPS | Optuna:  26%|██▌       | 51/200 [2:11:59<6:50:37, 165.35s/it, best=0.864][I 2026-03-04 22:10:53,772] Trial 120 finished with value: 0.8586723268055249 and parameters: {'activation': 'logistic', 'solver': 'adam', 'lr': 0.0013020252189739883, 'layer1': 468, 'layer2': 61, 'layer3': 267}. Best is trial 49 with value: 0.8647157569215889.
Pseudomonas_Aeruginosa | LPS | Optuna:  60%|██████    | 121/200 [2:12:35<2:09:01, 98.00s/it, best=0.865]Pseudomonas_Aeruginosa | LPS | Optuna:  60%|██████    | 121/200 [2:12:35<2:09:01, 98.00s/it, best=0.865][I 2026-03-04 22:10:55,126] Trial 116 finished with value: 0.9067325165338923 and parameters: {'activation': 'tanh', 'solver': 'adam', 'lr': 2.5956482636331162e-05, 'layer1': 228, 'layer2': 166, 'layer3': 26}. Best is trial 104 with value: 0.9327898309005132.
Klebsiella_Pneumoniae | LPS | Optuna:  58%|█████▊    | 117/200 [2:12:37<2:31:17, 109.36s/it, best=0.933]Klebsiella_Pneumoniae | LPS | Optuna:  58%|█████▊    | 117/200 [2:12:37<2:31:17, 109.36s/it, best=0.933][I 2026-03-04 22:11:08,654] Trial 93 finished with value: 0.8923480067750443 and parameters: {'activation': 'identity', 'solver': 'adam', 'lr': 0.0003235526772690389, 'layer1': 140, 'layer2': 26, 'layer3': 185}. Best is trial 90 with value: 0.8934794004485915.
Staphylococcus_Aureus | LPS | Optuna:  47%|████▋     | 94/200 [2:12:50<2:09:30, 73.31s/it, best=0.893]Staphylococcus_Aureus | LPS | Optuna:  47%|████▋     | 94/200 [2:12:50<2:09:30, 73.31s/it, best=0.893][I 2026-03-04 22:11:57,154] Trial 121 finished with value: 0.8583639190577623 and parameters: {'activation': 'identity', 'solver': 'adam', 'lr': 0.0016462666364805065, 'layer1': 415, 'layer2': 219, 'layer3': 232}. Best is trial 49 with value: 0.8647157569215889.
Pseudomonas_Aeruginosa | LPS | Optuna:  61%|██████    | 122/200 [2:13:39<1:53:53, 87.61s/it, best=0.865]Pseudomonas_Aeruginosa | LPS | Optuna:  61%|██████    | 122/200 [2:13:39<1:53:53, 87.61s/it, best=0.865][I 2026-03-04 22:12:19,532] Trial 51 finished with value: 0.7841275367085242 and parameters: {'activation': 'relu', 'solver': 'adam', 'lr': 1.6331892016426144e-05, 'layer1': 11, 'layer2': 179, 'layer3': 484}. Best is trial 14 with value: 0.863668804271893.
Escherichia_Coli | LPS | Optuna:  26%|██▌       | 52/200 [2:14:01<6:16:07, 152.48s/it, best=0.864]Escherichia_Coli | LPS | Optuna:  26%|██▌       | 52/200 [2:14:01<6:16:07, 152.48s/it, best=0.864][I 2026-03-04 22:12:38,486] Trial 94 finished with value: 0.890382243032932 and parameters: {'activation': 'identity', 'solver': 'adam', 'lr': 0.00010621195400888364, 'layer1': 136, 'layer2': 26, 'layer3': 181}. Best is trial 90 with value: 0.8934794004485915.
Staphylococcus_Aureus | LPS | Optuna:  48%|████▊     | 95/200 [2:14:20<2:16:58, 78.27s/it, best=0.893]Staphylococcus_Aureus | LPS | Optuna:  48%|████▊     | 95/200 [2:14:20<2:16:58, 78.27s/it, best=0.893][I 2026-03-04 22:12:45,205] Trial 117 finished with value: 0.9321858491121422 and parameters: {'activation': 'tanh', 'solver': 'adam', 'lr': 4.123113979021553e-05, 'layer1': 212, 'layer2': 217, 'layer3': 56}. Best is trial 104 with value: 0.9327898309005132.
Klebsiella_Pneumoniae | LPS | Optuna:  59%|█████▉    | 118/200 [2:14:27<2:29:45, 109.58s/it, best=0.933]Klebsiella_Pneumoniae | LPS | Optuna:  59%|█████▉    | 118/200 [2:14:27<2:29:45, 109.58s/it, best=0.933][I 2026-03-04 22:13:05,870] Trial 122 finished with value: 0.8620578732256983 and parameters: {'activation': 'identity', 'solver': 'adam', 'lr': 0.0023595102597688514, 'layer1': 407, 'layer2': 177, 'layer3': 168}. Best is trial 49 with value: 0.8647157569215889.
Pseudomonas_Aeruginosa | LPS | Optuna:  62%|██████▏   | 123/200 [2:14:48<1:45:09, 81.94s/it, best=0.865]Pseudomonas_Aeruginosa | LPS | Optuna:  62%|██████▏   | 123/200 [2:14:48<1:45:09, 81.94s/it, best=0.865][I 2026-03-04 22:13:40,140] Trial 95 finished with value: 0.8893315561931647 and parameters: {'activation': 'identity', 'solver': 'adam', 'lr': 0.00031869157235913433, 'layer1': 106, 'layer2': 58, 'layer3': 162}. Best is trial 90 with value: 0.8934794004485915.
Staphylococcus_Aureus | LPS | Optuna:  48%|████▊     | 96/200 [2:15:22<2:07:01, 73.28s/it, best=0.893]Staphylococcus_Aureus | LPS | Optuna:  48%|████▊     | 96/200 [2:15:22<2:07:01, 73.28s/it, best=0.893][I 2026-03-04 22:14:22,813] Trial 123 finished with value: 0.8590948103312288 and parameters: {'activation': 'identity', 'solver': 'adam', 'lr': 0.0033995724685315963, 'layer1': 443, 'layer2': 191, 'layer3': 211}. Best is trial 49 with value: 0.8647157569215889.
Pseudomonas_Aeruginosa | LPS | Optuna:  62%|██████▏   | 124/200 [2:16:05<1:41:53, 80.44s/it, best=0.865]Pseudomonas_Aeruginosa | LPS | Optuna:  62%|██████▏   | 124/200 [2:16:05<1:41:53, 80.44s/it, best=0.865][I 2026-03-04 22:14:35,232] Trial 118 finished with value: 0.9310807641234244 and parameters: {'activation': 'tanh', 'solver': 'adam', 'lr': 4.1086876770571414e-05, 'layer1': 218, 'layer2': 213, 'layer3': 52}. Best is trial 104 with value: 0.9327898309005132.
Klebsiella_Pneumoniae | LPS | Optuna:  60%|█████▉    | 119/200 [2:16:17<2:28:06, 109.71s/it, best=0.933]Klebsiella_Pneumoniae | LPS | Optuna:  60%|█████▉    | 119/200 [2:16:17<2:28:06, 109.71s/it, best=0.933][I 2026-03-04 22:15:04,407] Trial 96 finished with value: 0.8916124156708628 and parameters: {'activation': 'identity', 'solver': 'adam', 'lr': 0.00016450292609017857, 'layer1': 143, 'layer2': 37, 'layer3': 189}. Best is trial 90 with value: 0.8934794004485915.
Staphylococcus_Aureus | LPS | Optuna:  48%|████▊     | 97/200 [2:16:46<2:11:27, 76.58s/it, best=0.893]Staphylococcus_Aureus | LPS | Optuna:  48%|████▊     | 97/200 [2:16:46<2:11:27, 76.58s/it, best=0.893][I 2026-03-04 22:15:37,625] Trial 124 finished with value: 0.859394348420501 and parameters: {'activation': 'identity', 'solver': 'adam', 'lr': 0.0018158093702141291, 'layer1': 435, 'layer2': 246, 'layer3': 259}. Best is trial 49 with value: 0.8647157569215889.
Pseudomonas_Aeruginosa | LPS | Optuna:  62%|██████▎   | 125/200 [2:17:19<1:38:26, 78.75s/it, best=0.865]Pseudomonas_Aeruginosa | LPS | Optuna:  62%|██████▎   | 125/200 [2:17:19<1:38:26, 78.75s/it, best=0.865][I 2026-03-04 22:16:48,737] Trial 119 finished with value: 0.931496167707928 and parameters: {'activation': 'tanh', 'solver': 'adam', 'lr': 3.070570398657778e-05, 'layer1': 255, 'layer2': 190, 'layer3': 71}. Best is trial 104 with value: 0.9327898309005132.
Klebsiella_Pneumoniae | LPS | Optuna:  60%|██████    | 120/200 [2:18:30<2:35:48, 116.85s/it, best=0.933]Klebsiella_Pneumoniae | LPS | Optuna:  60%|██████    | 120/200 [2:18:30<2:35:48, 116.85s/it, best=0.933][I 2026-03-04 22:16:52,444] Trial 97 finished with value: 0.8664798584813613 and parameters: {'activation': 'logistic', 'solver': 'adam', 'lr': 0.0004729857133632886, 'layer1': 169, 'layer2': 10, 'layer3': 215}. Best is trial 90 with value: 0.8934794004485915.
Staphylococcus_Aureus | LPS | Optuna:  49%|████▉     | 98/200 [2:18:34<2:26:13, 86.02s/it, best=0.893]Staphylococcus_Aureus | LPS | Optuna:  49%|████▉     | 98/200 [2:18:34<2:26:13, 86.02s/it, best=0.893][I 2026-03-04 22:16:59,544] Trial 125 finished with value: 0.8591078281524366 and parameters: {'activation': 'tanh', 'solver': 'adam', 'lr': 0.00031883836174666745, 'layer1': 397, 'layer2': 219, 'layer3': 182}. Best is trial 49 with value: 0.8647157569215889.
Pseudomonas_Aeruginosa | LPS | Optuna:  63%|██████▎   | 126/200 [2:18:41<1:38:18, 79.70s/it, best=0.865]Pseudomonas_Aeruginosa | LPS | Optuna:  63%|██████▎   | 126/200 [2:18:41<1:38:18, 79.70s/it, best=0.865][I 2026-03-04 22:17:48,423] Trial 98 finished with value: 0.8928206363828195 and parameters: {'activation': 'identity', 'solver': 'adam', 'lr': 0.000344914730964348, 'layer1': 122, 'layer2': 23, 'layer3': 141}. Best is trial 90 with value: 0.8934794004485915.
Staphylococcus_Aureus | LPS | Optuna:  50%|████▉     | 99/200 [2:19:30<2:09:37, 77.00s/it, best=0.893]Staphylococcus_Aureus | LPS | Optuna:  50%|████▉     | 99/200 [2:19:30<2:09:37, 77.00s/it, best=0.893][I 2026-03-04 22:17:56,735] Trial 52 finished with value: 0.8617914939228065 and parameters: {'activation': 'relu', 'solver': 'adam', 'lr': 1.2309138961948751e-05, 'layer1': 353, 'layer2': 217, 'layer3': 451}. Best is trial 14 with value: 0.863668804271893.
Escherichia_Coli | LPS | Optuna:  26%|██▋       | 53/200 [2:19:38<8:29:21, 207.90s/it, best=0.864]Escherichia_Coli | LPS | Optuna:  26%|██▋       | 53/200 [2:19:38<8:29:21, 207.90s/it, best=0.864][I 2026-03-04 22:18:14,844] Trial 126 finished with value: 0.8619191773219489 and parameters: {'activation': 'identity', 'solver': 'adam', 'lr': 0.0009550382336763535, 'layer1': 478, 'layer2': 112, 'layer3': 150}. Best is trial 49 with value: 0.8647157569215889.
Pseudomonas_Aeruginosa | LPS | Optuna:  64%|██████▎   | 127/200 [2:19:57<1:35:21, 78.38s/it, best=0.865]Pseudomonas_Aeruginosa | LPS | Optuna:  64%|██████▎   | 127/200 [2:19:57<1:35:21, 78.38s/it, best=0.865][I 2026-03-04 22:18:21,922] Trial 120 finished with value: 0.9084385042132904 and parameters: {'activation': 'tanh', 'solver': 'adam', 'lr': 2.2995611358953844e-05, 'layer1': 62, 'layer2': 218, 'layer3': 58}. Best is trial 104 with value: 0.9327898309005132.
Klebsiella_Pneumoniae | LPS | Optuna:  60%|██████    | 121/200 [2:20:04<2:24:30, 109.75s/it, best=0.933]Klebsiella_Pneumoniae | LPS | Optuna:  60%|██████    | 121/200 [2:20:04<2:24:30, 109.75s/it, best=0.933][I 2026-03-04 22:18:47,162] Trial 99 finished with value: 0.8915313081974328 and parameters: {'activation': 'identity', 'solver': 'adam', 'lr': 0.00025075275079772014, 'layer1': 121, 'layer2': 39, 'layer3': 241}. Best is trial 90 with value: 0.8934794004485915.
Staphylococcus_Aureus | LPS | Optuna:  50%|█████     | 100/200 [2:20:29<1:59:12, 71.52s/it, best=0.893]Staphylococcus_Aureus | LPS | Optuna:  50%|█████     | 100/200 [2:20:29<1:59:12, 71.52s/it, best=0.893][I 2026-03-04 22:18:54,509] Trial 127 finished with value: 0.861134289374996 and parameters: {'activation': 'identity', 'solver': 'adam', 'lr': 0.00021316068982339366, 'layer1': 83, 'layer2': 235, 'layer3': 467}. Best is trial 49 with value: 0.8647157569215889.
Pseudomonas_Aeruginosa | LPS | Optuna:  64%|██████▍   | 128/200 [2:20:36<1:20:07, 66.77s/it, best=0.865]Pseudomonas_Aeruginosa | LPS | Optuna:  64%|██████▍   | 128/200 [2:20:36<1:20:07, 66.77s/it, best=0.865][I 2026-03-04 22:19:59,902] Trial 121 finished with value: 0.9294928595518666 and parameters: {'activation': 'tanh', 'solver': 'adam', 'lr': 5.4313808243520194e-05, 'layer1': 204, 'layer2': 228, 'layer3': 39}. Best is trial 104 with value: 0.9327898309005132.
Klebsiella_Pneumoniae | LPS | Optuna:  61%|██████    | 122/200 [2:21:42<2:18:05, 106.22s/it, best=0.933]Klebsiella_Pneumoniae | LPS | Optuna:  61%|██████    | 122/200 [2:21:42<2:18:05, 106.22s/it, best=0.933][I 2026-03-04 22:20:26,583] Trial 128 finished with value: 0.8607609514399414 and parameters: {'activation': 'identity', 'solver': 'adam', 'lr': 8.838797182975284e-05, 'layer1': 423, 'layer2': 158, 'layer3': 439}. Best is trial 49 with value: 0.8647157569215889.
Pseudomonas_Aeruginosa | LPS | Optuna:  64%|██████▍   | 129/200 [2:22:08<1:27:59, 74.36s/it, best=0.865]Pseudomonas_Aeruginosa | LPS | Optuna:  64%|██████▍   | 129/200 [2:22:08<1:27:59, 74.36s/it, best=0.865][I 2026-03-04 22:20:44,113] Trial 122 finished with value: 0.8746470562584285 and parameters: {'activation': 'tanh', 'solver': 'adam', 'lr': 1.023801801375349e-05, 'layer1': 190, 'layer2': 179, 'layer3': 81}. Best is trial 104 with value: 0.9327898309005132.
Klebsiella_Pneumoniae | LPS | Optuna:  62%|██████▏   | 123/200 [2:22:26<1:52:26, 87.62s/it, best=0.933] Klebsiella_Pneumoniae | LPS | Optuna:  62%|██████▏   | 123/200 [2:22:26<1:52:26, 87.62s/it, best=0.933][I 2026-03-04 22:21:19,912] Trial 100 finished with value: 0.8048368506318614 and parameters: {'activation': 'identity', 'solver': 'sgd', 'lr': 3.712230363602767e-06, 'layer1': 98, 'layer2': 447, 'layer3': 147}. Best is trial 90 with value: 0.8934794004485915.
Staphylococcus_Aureus | LPS | Optuna:  50%|█████     | 101/200 [2:23:02<2:38:13, 95.89s/it, best=0.893]Staphylococcus_Aureus | LPS | Optuna:  50%|█████     | 101/200 [2:23:02<2:38:13, 95.89s/it, best=0.893][I 2026-03-04 22:21:38,737] Trial 53 finished with value: 0.8630489001000881 and parameters: {'activation': 'relu', 'solver': 'adam', 'lr': 4.8411922543385185e-05, 'layer1': 475, 'layer2': 202, 'layer3': 424}. Best is trial 14 with value: 0.863668804271893.
Escherichia_Coli | LPS | Optuna:  27%|██▋       | 54/200 [2:23:20<8:36:10, 212.13s/it, best=0.864]Escherichia_Coli | LPS | Optuna:  27%|██▋       | 54/200 [2:23:20<8:36:10, 212.13s/it, best=0.864][I 2026-03-04 22:21:43,428] Trial 129 finished with value: 0.8617026279028153 and parameters: {'activation': 'tanh', 'solver': 'adam', 'lr': 0.0007521483855725784, 'layer1': 411, 'layer2': 193, 'layer3': 339}. Best is trial 49 with value: 0.8647157569215889.
Pseudomonas_Aeruginosa | LPS | Optuna:  65%|██████▌   | 130/200 [2:23:25<1:27:37, 75.11s/it, best=0.865]Pseudomonas_Aeruginosa | LPS | Optuna:  65%|██████▌   | 130/200 [2:23:25<1:27:37, 75.11s/it, best=0.865][I 2026-03-04 22:22:24,347] Trial 101 finished with value: 0.8922128595163308 and parameters: {'activation': 'identity', 'solver': 'adam', 'lr': 0.0003584950834024476, 'layer1': 131, 'layer2': 22, 'layer3': 114}. Best is trial 90 with value: 0.8934794004485915.
Staphylococcus_Aureus | LPS | Optuna:  51%|█████     | 102/200 [2:24:06<2:21:12, 86.46s/it, best=0.893]Staphylococcus_Aureus | LPS | Optuna:  51%|█████     | 102/200 [2:24:06<2:21:12, 86.46s/it, best=0.893][I 2026-03-04 22:22:27,323] Trial 123 finished with value: 0.8964547289370511 and parameters: {'activation': 'tanh', 'solver': 'adam', 'lr': 1.6975676496701118e-05, 'layer1': 235, 'layer2': 248, 'layer3': 44}. Best is trial 104 with value: 0.9327898309005132.
Klebsiella_Pneumoniae | LPS | Optuna:  62%|██████▏   | 124/200 [2:24:09<1:56:54, 92.29s/it, best=0.933]Klebsiella_Pneumoniae | LPS | Optuna:  62%|██████▏   | 124/200 [2:24:09<1:56:54, 92.29s/it, best=0.933][I 2026-03-04 22:22:48,138] Trial 130 finished with value: 0.8629933172533463 and parameters: {'activation': 'identity', 'solver': 'adam', 'lr': 0.002785981247580928, 'layer1': 367, 'layer2': 75, 'layer3': 286}. Best is trial 49 with value: 0.8647157569215889.
