Pseudomonas_Aeruginosa | LPS | Optuna:  37%|███▋      | 74/200 [1:14:10<2:09:51, 61.83s/it, best=0.865]Pseudomonas_Aeruginosa | LPS | Optuna:  37%|███▋      | 74/200 [1:14:10<2:09:51, 61.83s/it, best=0.865][I 2026-03-04 21:12:43,262] Trial 51 finished with value: 0.8896870866621226 and parameters: {'activation': 'identity', 'solver': 'adam', 'lr': 0.00014081447689934994, 'layer1': 65, 'layer2': 179, 'layer3': 222}. Best is trial 22 with value: 0.8930759779387886.
Staphylococcus_Aureus | LPS | Optuna:  26%|██▌       | 52/200 [1:14:25<2:30:33, 61.04s/it, best=0.893]Staphylococcus_Aureus | LPS | Optuna:  26%|██▌       | 52/200 [1:14:25<2:30:33, 61.04s/it, best=0.893][I 2026-03-04 21:13:34,186] Trial 67 finished with value: 0.9295965909623793 and parameters: {'activation': 'relu', 'solver': 'adam', 'lr': 8.531654822947424e-05, 'layer1': 85, 'layer2': 238, 'layer3': 91}. Best is trial 41 with value: 0.9325947076370852.
Klebsiella_Pneumoniae | LPS | Optuna:  34%|███▍      | 68/200 [1:15:16<2:18:56, 63.16s/it, best=0.933]Klebsiella_Pneumoniae | LPS | Optuna:  34%|███▍      | 68/200 [1:15:16<2:18:56, 63.16s/it, best=0.933][I 2026-03-04 21:13:43,769] Trial 31 finished with value: 0.8622662444014205 and parameters: {'activation': 'relu', 'solver': 'adam', 'lr': 6.807000651844765e-05, 'layer1': 445, 'layer2': 119, 'layer3': 481}. Best is trial 14 with value: 0.863668804271893.
Escherichia_Coli | LPS | Optuna:  16%|█▌        | 32/200 [1:15:25<6:28:15, 138.66s/it, best=0.864]Escherichia_Coli | LPS | Optuna:  16%|█▌        | 32/200 [1:15:25<6:28:15, 138.66s/it, best=0.864][I 2026-03-04 21:13:57,536] Trial 52 finished with value: 0.8913351219289698 and parameters: {'activation': 'identity', 'solver': 'adam', 'lr': 0.0002768072161241762, 'layer1': 250, 'layer2': 146, 'layer3': 204}. Best is trial 22 with value: 0.8930759779387886.
Staphylococcus_Aureus | LPS | Optuna:  26%|██▋       | 53/200 [1:15:39<2:39:16, 65.01s/it, best=0.893]Staphylococcus_Aureus | LPS | Optuna:  26%|██▋       | 53/200 [1:15:39<2:39:16, 65.01s/it, best=0.893][I 2026-03-04 21:14:11,227] Trial 68 finished with value: 0.8758454169905194 and parameters: {'activation': 'tanh', 'solver': 'sgd', 'lr': 0.00015560880775356196, 'layer1': 149, 'layer2': 341, 'layer3': 418}. Best is trial 41 with value: 0.9325947076370852.
Klebsiella_Pneumoniae | LPS | Optuna:  34%|███▍      | 69/200 [1:15:53<2:00:47, 55.32s/it, best=0.933]Klebsiella_Pneumoniae | LPS | Optuna:  34%|███▍      | 69/200 [1:15:53<2:00:47, 55.32s/it, best=0.933][I 2026-03-04 21:14:16,117] Trial 74 finished with value: 0.8591910386270524 and parameters: {'activation': 'relu', 'solver': 'adam', 'lr': 6.316139562481682e-05, 'layer1': 248, 'layer2': 160, 'layer3': 80}. Best is trial 49 with value: 0.8647157569215889.
Pseudomonas_Aeruginosa | LPS | Optuna:  38%|███▊      | 75/200 [1:15:58<2:37:39, 75.67s/it, best=0.865]Pseudomonas_Aeruginosa | LPS | Optuna:  38%|███▊      | 75/200 [1:15:58<2:37:39, 75.67s/it, best=0.865][I 2026-03-04 21:14:51,002] Trial 69 finished with value: 0.9297660589914954 and parameters: {'activation': 'identity', 'solver': 'adam', 'lr': 0.0022202632148547305, 'layer1': 123, 'layer2': 273, 'layer3': 34}. Best is trial 41 with value: 0.9325947076370852.
Klebsiella_Pneumoniae | LPS | Optuna:  35%|███▌      | 70/200 [1:16:33<1:49:45, 50.66s/it, best=0.933]Klebsiella_Pneumoniae | LPS | Optuna:  35%|███▌      | 70/200 [1:16:33<1:49:45, 50.66s/it, best=0.933][I 2026-03-04 21:15:08,036] Trial 53 finished with value: 0.8927016242105085 and parameters: {'activation': 'identity', 'solver': 'adam', 'lr': 0.0003455045832651432, 'layer1': 192, 'layer2': 114, 'layer3': 91}. Best is trial 22 with value: 0.8930759779387886.
Staphylococcus_Aureus | LPS | Optuna:  27%|██▋       | 54/200 [1:16:50<2:42:11, 66.66s/it, best=0.893]Staphylococcus_Aureus | LPS | Optuna:  27%|██▋       | 54/200 [1:16:50<2:42:11, 66.66s/it, best=0.893][I 2026-03-04 21:15:12,796] Trial 75 finished with value: 0.857637005011741 and parameters: {'activation': 'relu', 'solver': 'adam', 'lr': 0.0013894765002203512, 'layer1': 228, 'layer2': 105, 'layer3': 335}. Best is trial 49 with value: 0.8647157569215889.
Pseudomonas_Aeruginosa | LPS | Optuna:  38%|███▊      | 76/200 [1:16:55<2:24:36, 69.97s/it, best=0.865]Pseudomonas_Aeruginosa | LPS | Optuna:  38%|███▊      | 76/200 [1:16:55<2:24:36, 69.97s/it, best=0.865][I 2026-03-04 21:15:32,377] Trial 70 finished with value: 0.929401662543461 and parameters: {'activation': 'tanh', 'solver': 'adam', 'lr': 0.0009330453234799825, 'layer1': 34, 'layer2': 324, 'layer3': 479}. Best is trial 41 with value: 0.9325947076370852.
Klebsiella_Pneumoniae | LPS | Optuna:  36%|███▌      | 71/200 [1:17:14<1:42:55, 47.87s/it, best=0.933]Klebsiella_Pneumoniae | LPS | Optuna:  36%|███▌      | 71/200 [1:17:14<1:42:55, 47.87s/it, best=0.933][I 2026-03-04 21:16:09,219] Trial 54 finished with value: 0.8911524768690162 and parameters: {'activation': 'identity', 'solver': 'adam', 'lr': 0.0003586787053041896, 'layer1': 150, 'layer2': 252, 'layer3': 91}. Best is trial 22 with value: 0.8930759779387886.
Staphylococcus_Aureus | LPS | Optuna:  28%|██▊       | 55/200 [1:17:51<2:37:07, 65.01s/it, best=0.893]Staphylococcus_Aureus | LPS | Optuna:  28%|██▊       | 55/200 [1:17:51<2:37:07, 65.01s/it, best=0.893][I 2026-03-04 21:16:27,037] Trial 71 finished with value: 0.9312599138035637 and parameters: {'activation': 'tanh', 'solver': 'adam', 'lr': 0.00010668468328407328, 'layer1': 32, 'layer2': 294, 'layer3': 76}. Best is trial 41 with value: 0.9325947076370852.
Klebsiella_Pneumoniae | LPS | Optuna:  36%|███▌      | 72/200 [1:18:09<1:46:28, 49.91s/it, best=0.933]Klebsiella_Pneumoniae | LPS | Optuna:  36%|███▌      | 72/200 [1:18:09<1:46:28, 49.91s/it, best=0.933][I 2026-03-04 21:16:29,463] Trial 32 finished with value: 0.8592832267423048 and parameters: {'activation': 'relu', 'solver': 'adam', 'lr': 9.962393401175604e-05, 'layer1': 397, 'layer2': 192, 'layer3': 472}. Best is trial 14 with value: 0.863668804271893.
Escherichia_Coli | LPS | Optuna:  16%|█▋        | 33/200 [1:18:11<6:48:30, 146.77s/it, best=0.864]Escherichia_Coli | LPS | Optuna:  16%|█▋        | 33/200 [1:18:11<6:48:30, 146.77s/it, best=0.864][I 2026-03-04 21:16:32,297] Trial 76 finished with value: 0.862960834337629 and parameters: {'activation': 'relu', 'solver': 'adam', 'lr': 0.00022899941622961799, 'layer1': 335, 'layer2': 263, 'layer3': 171}. Best is trial 49 with value: 0.8647157569215889.
Pseudomonas_Aeruginosa | LPS | Optuna:  38%|███▊      | 77/200 [1:18:14<2:29:18, 72.83s/it, best=0.865]Pseudomonas_Aeruginosa | LPS | Optuna:  38%|███▊      | 77/200 [1:18:14<2:29:18, 72.83s/it, best=0.865][I 2026-03-04 21:17:17,867] Trial 55 finished with value: 0.8921760034849642 and parameters: {'activation': 'identity', 'solver': 'adam', 'lr': 0.0006507058336280571, 'layer1': 199, 'layer2': 108, 'layer3': 75}. Best is trial 22 with value: 0.8930759779387886.
Staphylococcus_Aureus | LPS | Optuna:  28%|██▊       | 56/200 [1:18:59<2:38:39, 66.10s/it, best=0.893]Staphylococcus_Aureus | LPS | Optuna:  28%|██▊       | 56/200 [1:18:59<2:38:39, 66.10s/it, best=0.893][I 2026-03-04 21:17:42,849] Trial 72 finished with value: 0.9305342445662672 and parameters: {'activation': 'tanh', 'solver': 'adam', 'lr': 4.8784777043228216e-05, 'layer1': 48, 'layer2': 262, 'layer3': 77}. Best is trial 41 with value: 0.9325947076370852.
Klebsiella_Pneumoniae | LPS | Optuna:  36%|███▋      | 73/200 [1:19:25<2:02:05, 57.68s/it, best=0.933]Klebsiella_Pneumoniae | LPS | Optuna:  36%|███▋      | 73/200 [1:19:25<2:02:05, 57.68s/it, best=0.933][I 2026-03-04 21:18:14,437] Trial 77 finished with value: 0.859490518841997 and parameters: {'activation': 'relu', 'solver': 'adam', 'lr': 8.061382067942063e-05, 'layer1': 340, 'layer2': 402, 'layer3': 174}. Best is trial 49 with value: 0.8647157569215889.
Pseudomonas_Aeruginosa | LPS | Optuna:  39%|███▉      | 78/200 [1:19:56<2:45:58, 81.62s/it, best=0.865]Pseudomonas_Aeruginosa | LPS | Optuna:  39%|███▉      | 78/200 [1:19:56<2:45:58, 81.62s/it, best=0.865][I 2026-03-04 21:18:25,824] Trial 56 finished with value: 0.8920384732759041 and parameters: {'activation': 'identity', 'solver': 'adam', 'lr': 0.0007997938248169591, 'layer1': 202, 'layer2': 20, 'layer3': 70}. Best is trial 22 with value: 0.8930759779387886.
Staphylococcus_Aureus | LPS | Optuna:  28%|██▊       | 57/200 [1:20:07<2:38:52, 66.66s/it, best=0.893]Staphylococcus_Aureus | LPS | Optuna:  28%|██▊       | 57/200 [1:20:07<2:38:52, 66.66s/it, best=0.893][I 2026-03-04 21:18:32,800] Trial 33 finished with value: 0.7424018917869585 and parameters: {'activation': 'relu', 'solver': 'adam', 'lr': 1.1219361516513664e-06, 'layer1': 440, 'layer2': 113, 'layer3': 410}. Best is trial 14 with value: 0.863668804271893.
Escherichia_Coli | LPS | Optuna:  17%|█▋        | 34/200 [1:20:14<6:26:37, 139.74s/it, best=0.864]Escherichia_Coli | LPS | Optuna:  17%|█▋        | 34/200 [1:20:14<6:26:37, 139.74s/it, best=0.864][I 2026-03-04 21:19:38,150] Trial 78 finished with value: 0.8607341091139655 and parameters: {'activation': 'relu', 'solver': 'adam', 'lr': 0.0002118124761155867, 'layer1': 366, 'layer2': 447, 'layer3': 253}. Best is trial 49 with value: 0.8647157569215889.
Pseudomonas_Aeruginosa | LPS | Optuna:  40%|███▉      | 79/200 [1:21:20<2:45:52, 82.25s/it, best=0.865]Pseudomonas_Aeruginosa | LPS | Optuna:  40%|███▉      | 79/200 [1:21:20<2:45:52, 82.25s/it, best=0.865][I 2026-03-04 21:19:39,664] Trial 73 finished with value: 0.9298172114660698 and parameters: {'activation': 'tanh', 'solver': 'adam', 'lr': 2.9801441318350687e-05, 'layer1': 14, 'layer2': 286, 'layer3': 113}. Best is trial 41 with value: 0.9325947076370852.
Klebsiella_Pneumoniae | LPS | Optuna:  37%|███▋      | 74/200 [1:21:21<2:38:22, 75.42s/it, best=0.933]Klebsiella_Pneumoniae | LPS | Optuna:  37%|███▋      | 74/200 [1:21:21<2:38:22, 75.42s/it, best=0.933][I 2026-03-04 21:20:31,629] Trial 79 finished with value: 0.8278886567989231 and parameters: {'activation': 'tanh', 'solver': 'sgd', 'lr': 4.204497392170515e-05, 'layer1': 333, 'layer2': 264, 'layer3': 411}. Best is trial 49 with value: 0.8647157569215889.
Pseudomonas_Aeruginosa | LPS | Optuna:  40%|████      | 80/200 [1:22:13<2:27:14, 73.62s/it, best=0.865]Pseudomonas_Aeruginosa | LPS | Optuna:  40%|████      | 80/200 [1:22:13<2:27:14, 73.62s/it, best=0.865][I 2026-03-04 21:20:43,138] Trial 74 finished with value: 0.93200867403391 and parameters: {'activation': 'tanh', 'solver': 'adam', 'lr': 0.00010016336701911589, 'layer1': 82, 'layer2': 314, 'layer3': 63}. Best is trial 41 with value: 0.9325947076370852.
Klebsiella_Pneumoniae | LPS | Optuna:  38%|███▊      | 75/200 [1:22:25<2:29:39, 71.84s/it, best=0.933]Klebsiella_Pneumoniae | LPS | Optuna:  38%|███▊      | 75/200 [1:22:25<2:29:39, 71.84s/it, best=0.933][I 2026-03-04 21:20:44,979] Trial 57 finished with value: 0.8863760796815614 and parameters: {'activation': 'relu', 'solver': 'adam', 'lr': 0.000546701915778267, 'layer1': 303, 'layer2': 17, 'layer3': 13}. Best is trial 22 with value: 0.8930759779387886.
Staphylococcus_Aureus | LPS | Optuna:  29%|██▉       | 58/200 [1:22:27<3:29:14, 88.41s/it, best=0.893]Staphylococcus_Aureus | LPS | Optuna:  29%|██▉       | 58/200 [1:22:27<3:29:14, 88.41s/it, best=0.893][I 2026-03-04 21:21:17,561] Trial 75 finished with value: 0.8746470562584285 and parameters: {'activation': 'logistic', 'solver': 'adam', 'lr': 2.343567646987085e-05, 'layer1': 79, 'layer2': 312, 'layer3': 227}. Best is trial 41 with value: 0.9325947076370852.
Klebsiella_Pneumoniae | LPS | Optuna:  38%|███▊      | 76/200 [1:22:59<2:05:15, 60.61s/it, best=0.933]Klebsiella_Pneumoniae | LPS | Optuna:  38%|███▊      | 76/200 [1:22:59<2:05:15, 60.61s/it, best=0.933][I 2026-03-04 21:21:22,820] Trial 58 finished with value: 0.8016455484651599 and parameters: {'activation': 'identity', 'solver': 'sgd', 'lr': 0.0015839963680396834, 'layer1': 199, 'layer2': 32, 'layer3': 70}. Best is trial 22 with value: 0.8930759779387886.
Staphylococcus_Aureus | LPS | Optuna:  30%|██▉       | 59/200 [1:23:04<2:52:06, 73.24s/it, best=0.893]Staphylococcus_Aureus | LPS | Optuna:  30%|██▉       | 59/200 [1:23:04<2:52:06, 73.24s/it, best=0.893][I 2026-03-04 21:21:31,921] Trial 80 finished with value: 0.8590965508223085 and parameters: {'activation': 'identity', 'solver': 'adam', 'lr': 0.0004402739645037877, 'layer1': 315, 'layer2': 478, 'layer3': 204}. Best is trial 49 with value: 0.8647157569215889.
Pseudomonas_Aeruginosa | LPS | Optuna:  40%|████      | 81/200 [1:23:14<2:18:04, 69.62s/it, best=0.865]Pseudomonas_Aeruginosa | LPS | Optuna:  40%|████      | 81/200 [1:23:14<2:18:04, 69.62s/it, best=0.865][I 2026-03-04 21:22:22,509] Trial 76 finished with value: 0.8866352156761275 and parameters: {'activation': 'tanh', 'solver': 'adam', 'lr': 1.4746767476605787e-05, 'layer1': 132, 'layer2': 452, 'layer3': 61}. Best is trial 41 with value: 0.9325947076370852.
Klebsiella_Pneumoniae | LPS | Optuna:  38%|███▊      | 77/200 [1:24:04<2:06:55, 61.91s/it, best=0.933]Klebsiella_Pneumoniae | LPS | Optuna:  38%|███▊      | 77/200 [1:24:04<2:06:55, 61.91s/it, best=0.933][I 2026-03-04 21:22:33,050] Trial 81 finished with value: 0.8583082011993663 and parameters: {'activation': 'relu', 'solver': 'adam', 'lr': 0.0007761861934096158, 'layer1': 304, 'layer2': 64, 'layer3': 161}. Best is trial 49 with value: 0.8647157569215889.
Pseudomonas_Aeruginosa | LPS | Optuna:  41%|████      | 82/200 [1:24:15<2:11:54, 67.07s/it, best=0.865]Pseudomonas_Aeruginosa | LPS | Optuna:  41%|████      | 82/200 [1:24:15<2:11:54, 67.07s/it, best=0.865][I 2026-03-04 21:22:50,212] Trial 34 finished with value: 0.8620136199079182 and parameters: {'activation': 'relu', 'solver': 'adam', 'lr': 1.947160647845054e-05, 'layer1': 368, 'layer2': 220, 'layer3': 472}. Best is trial 14 with value: 0.863668804271893.
Escherichia_Coli | LPS | Optuna:  18%|█▊        | 35/200 [1:24:32<8:01:21, 175.04s/it, best=0.864]Escherichia_Coli | LPS | Optuna:  18%|█▊        | 35/200 [1:24:32<8:01:21, 175.04s/it, best=0.864][I 2026-03-04 21:23:24,063] Trial 77 finished with value: 0.929250088149764 and parameters: {'activation': 'identity', 'solver': 'adam', 'lr': 6.723041432597664e-05, 'layer1': 106, 'layer2': 354, 'layer3': 343}. Best is trial 41 with value: 0.9325947076370852.
Klebsiella_Pneumoniae | LPS | Optuna:  39%|███▉      | 78/200 [1:25:06<2:05:40, 61.81s/it, best=0.933]Klebsiella_Pneumoniae | LPS | Optuna:  39%|███▉      | 78/200 [1:25:06<2:05:40, 61.81s/it, best=0.933][I 2026-03-04 21:24:09,125] Trial 78 finished with value: 0.8751815044678993 and parameters: {'activation': 'tanh', 'solver': 'adam', 'lr': 9.855333502638269e-06, 'layer1': 204, 'layer2': 374, 'layer3': 47}. Best is trial 41 with value: 0.9325947076370852.
Klebsiella_Pneumoniae | LPS | Optuna:  40%|███▉      | 79/200 [1:25:51<1:54:30, 56.78s/it, best=0.933]Klebsiella_Pneumoniae | LPS | Optuna:  40%|███▉      | 79/200 [1:25:51<1:54:30, 56.78s/it, best=0.933][I 2026-03-04 21:24:10,421] Trial 82 finished with value: 0.8623852700049328 and parameters: {'activation': 'relu', 'solver': 'adam', 'lr': 0.00011019085905610765, 'layer1': 359, 'layer2': 238, 'layer3': 108}. Best is trial 49 with value: 0.8647157569215889.
Pseudomonas_Aeruginosa | LPS | Optuna:  42%|████▏     | 83/200 [1:25:52<2:28:31, 76.16s/it, best=0.865]Pseudomonas_Aeruginosa | LPS | Optuna:  42%|████▏     | 83/200 [1:25:52<2:28:31, 76.16s/it, best=0.865][I 2026-03-04 21:25:07,807] Trial 79 finished with value: 0.8761247119943011 and parameters: {'activation': 'tanh', 'solver': 'sgd', 'lr': 0.00040425198632969923, 'layer1': 414, 'layer2': 393, 'layer3': 215}. Best is trial 41 with value: 0.9325947076370852.
Klebsiella_Pneumoniae | LPS | Optuna:  40%|████      | 80/200 [1:26:50<1:54:42, 57.35s/it, best=0.933]Klebsiella_Pneumoniae | LPS | Optuna:  40%|████      | 80/200 [1:26:50<1:54:42, 57.35s/it, best=0.933][I 2026-03-04 21:25:43,388] Trial 59 finished with value: 0.8800415687497998 and parameters: {'activation': 'logistic', 'solver': 'adam', 'lr': 0.0007563861495116641, 'layer1': 268, 'layer2': 83, 'layer3': 36}. Best is trial 22 with value: 0.8930759779387886.
Staphylococcus_Aureus | LPS | Optuna:  30%|███       | 60/200 [1:27:25<5:02:01, 129.44s/it, best=0.893]Staphylococcus_Aureus | LPS | Optuna:  30%|███       | 60/200 [1:27:25<5:02:01, 129.44s/it, best=0.893][I 2026-03-04 21:25:51,220] Trial 83 finished with value: 0.8616379551062614 and parameters: {'activation': 'relu', 'solver': 'adam', 'lr': 0.00011439369310142413, 'layer1': 361, 'layer2': 234, 'layer3': 138}. Best is trial 49 with value: 0.8647157569215889.
Pseudomonas_Aeruginosa | LPS | Optuna:  42%|████▏     | 84/200 [1:27:33<2:41:32, 83.55s/it, best=0.865]Pseudomonas_Aeruginosa | LPS | Optuna:  42%|████▏     | 84/200 [1:27:33<2:41:32, 83.55s/it, best=0.865][I 2026-03-04 21:26:09,890] Trial 80 finished with value: 0.9318061496176326 and parameters: {'activation': 'identity', 'solver': 'adam', 'lr': 0.00018478380025809977, 'layer1': 160, 'layer2': 481, 'layer3': 145}. Best is trial 41 with value: 0.9325947076370852.
Klebsiella_Pneumoniae | LPS | Optuna:  40%|████      | 81/200 [1:27:52<1:56:33, 58.77s/it, best=0.933]Klebsiella_Pneumoniae | LPS | Optuna:  40%|████      | 81/200 [1:27:52<1:56:33, 58.77s/it, best=0.933][I 2026-03-04 21:27:07,544] Trial 81 finished with value: 0.9298872600953917 and parameters: {'activation': 'identity', 'solver': 'adam', 'lr': 0.00017392679128318072, 'layer1': 172, 'layer2': 480, 'layer3': 139}. Best is trial 41 with value: 0.9325947076370852.
Klebsiella_Pneumoniae | LPS | Optuna:  41%|████      | 82/200 [1:28:49<1:54:55, 58.44s/it, best=0.933]Klebsiella_Pneumoniae | LPS | Optuna:  41%|████      | 82/200 [1:28:49<1:54:55, 58.44s/it, best=0.933][I 2026-03-04 21:27:24,645] Trial 60 finished with value: 0.8916943976346936 and parameters: {'activation': 'identity', 'solver': 'adam', 'lr': 0.0004117959277692569, 'layer1': 363, 'layer2': 105, 'layer3': 71}. Best is trial 22 with value: 0.8930759779387886.
Staphylococcus_Aureus | LPS | Optuna:  30%|███       | 61/200 [1:29:06<4:40:16, 120.98s/it, best=0.893]Staphylococcus_Aureus | LPS | Optuna:  30%|███       | 61/200 [1:29:06<4:40:16, 120.98s/it, best=0.893][I 2026-03-04 21:27:29,095] Trial 35 finished with value: 0.8618862016953595 and parameters: {'activation': 'relu', 'solver': 'adam', 'lr': 1.3340679588391062e-05, 'layer1': 304, 'layer2': 345, 'layer3': 478}. Best is trial 14 with value: 0.863668804271893.
Escherichia_Coli | LPS | Optuna:  18%|█▊        | 36/200 [1:29:11<9:23:35, 206.19s/it, best=0.864]Escherichia_Coli | LPS | Optuna:  18%|█▊        | 36/200 [1:29:11<9:23:35, 206.19s/it, best=0.864][I 2026-03-04 21:27:34,030] Trial 84 finished with value: 0.859584318170531 and parameters: {'activation': 'relu', 'solver': 'adam', 'lr': 0.0001760347547849225, 'layer1': 391, 'layer2': 288, 'layer3': 115}. Best is trial 49 with value: 0.8647157569215889.
Pseudomonas_Aeruginosa | LPS | Optuna:  42%|████▎     | 85/200 [1:29:16<2:51:13, 89.33s/it, best=0.865]Pseudomonas_Aeruginosa | LPS | Optuna:  42%|████▎     | 85/200 [1:29:16<2:51:13, 89.33s/it, best=0.865][I 2026-03-04 21:28:06,628] Trial 82 finished with value: 0.9305068941914397 and parameters: {'activation': 'identity', 'solver': 'adam', 'lr': 9.328020884107817e-05, 'layer1': 160, 'layer2': 444, 'layer3': 165}. Best is trial 41 with value: 0.9325947076370852.
Klebsiella_Pneumoniae | LPS | Optuna:  42%|████▏     | 83/200 [1:29:48<1:54:19, 58.63s/it, best=0.933]Klebsiella_Pneumoniae | LPS | Optuna:  42%|████▏     | 83/200 [1:29:48<1:54:19, 58.63s/it, best=0.933][I 2026-03-04 21:28:26,373] Trial 61 finished with value: 0.8921447503315069 and parameters: {'activation': 'identity', 'solver': 'adam', 'lr': 0.0011034136516993413, 'layer1': 211, 'layer2': 46, 'layer3': 99}. Best is trial 22 with value: 0.8930759779387886.
Staphylococcus_Aureus | LPS | Optuna:  31%|███       | 62/200 [1:30:08<3:57:22, 103.21s/it, best=0.893]Staphylococcus_Aureus | LPS | Optuna:  31%|███       | 62/200 [1:30:08<3:57:22, 103.21s/it, best=0.893][I 2026-03-04 21:28:30,776] Trial 85 finished with value: 0.8592820179830303 and parameters: {'activation': 'relu', 'solver': 'adam', 'lr': 0.00025297328020359826, 'layer1': 11, 'layer2': 257, 'layer3': 296}. Best is trial 49 with value: 0.8647157569215889.
Pseudomonas_Aeruginosa | LPS | Optuna:  43%|████▎     | 86/200 [1:30:12<2:31:09, 79.56s/it, best=0.865]Pseudomonas_Aeruginosa | LPS | Optuna:  43%|████▎     | 86/200 [1:30:13<2:31:09, 79.56s/it, best=0.865][I 2026-03-04 21:29:08,198] Trial 83 finished with value: 0.9293689972981302 and parameters: {'activation': 'identity', 'solver': 'adam', 'lr': 0.00022332051288508406, 'layer1': 142, 'layer2': 462, 'layer3': 101}. Best is trial 41 with value: 0.9325947076370852.
Klebsiella_Pneumoniae | LPS | Optuna:  42%|████▏     | 84/200 [1:30:50<1:55:03, 59.51s/it, best=0.933]Klebsiella_Pneumoniae | LPS | Optuna:  42%|████▏     | 84/200 [1:30:50<1:55:03, 59.51s/it, best=0.933][I 2026-03-04 21:29:41,138] Trial 62 finished with value: 0.8919105719799856 and parameters: {'activation': 'identity', 'solver': 'adam', 'lr': 0.0012388281934201085, 'layer1': 238, 'layer2': 55, 'layer3': 52}. Best is trial 22 with value: 0.8930759779387886.
Staphylococcus_Aureus | LPS | Optuna:  32%|███▏      | 63/200 [1:31:23<3:36:10, 94.67s/it, best=0.893] Staphylococcus_Aureus | LPS | Optuna:  32%|███▏      | 63/200 [1:31:23<3:36:10, 94.67s/it, best=0.893][I 2026-03-04 21:29:57,965] Trial 86 finished with value: 0.860705495809707 and parameters: {'activation': 'relu', 'solver': 'adam', 'lr': 0.00037624448622024644, 'layer1': 415, 'layer2': 242, 'layer3': 97}. Best is trial 49 with value: 0.8647157569215889.
