Escherichia_Coli | DirectMulti | Optuna:  74%|███████▎  | 147/200 [5:30:29<1:49:07, 123.53s/it, best=0.865]Escherichia_Coli | DirectMulti | Optuna:  74%|███████▎  | 147/200 [5:30:29<1:49:07, 123.53s/it, best=0.865][I 2026-03-05 12:56:25,557] Trial 147 finished with value: 0.7187126221269791 and parameters: {'activation': 'tanh', 'solver': 'sgd', 'lr': 3.6159576726068246e-05, 'layer1': 457, 'layer2': 499, 'layer3': 35}. Best is trial 106 with value: 0.8646284220353448.
Escherichia_Coli | DirectMulti | Optuna:  74%|███████▍  | 148/200 [5:33:45<2:05:43, 145.07s/it, best=0.865]Escherichia_Coli | DirectMulti | Optuna:  74%|███████▍  | 148/200 [5:33:45<2:05:43, 145.07s/it, best=0.865][I 2026-03-05 12:57:30,857] Trial 148 finished with value: 0.8613837051617187 and parameters: {'activation': 'tanh', 'solver': 'adam', 'lr': 2.7350250563872575e-05, 'layer1': 14, 'layer2': 480, 'layer3': 58}. Best is trial 106 with value: 0.8646284220353448.
Escherichia_Coli | DirectMulti | Optuna:  74%|███████▍  | 149/200 [5:34:50<1:42:58, 121.14s/it, best=0.865]Escherichia_Coli | DirectMulti | Optuna:  74%|███████▍  | 149/200 [5:34:50<1:42:58, 121.14s/it, best=0.865][I 2026-03-05 12:59:18,124] Trial 149 finished with value: 0.8631468639677571 and parameters: {'activation': 'tanh', 'solver': 'adam', 'lr': 4.429927334243397e-05, 'layer1': 500, 'layer2': 443, 'layer3': 73}. Best is trial 106 with value: 0.8646284220353448.
Escherichia_Coli | DirectMulti | Optuna:  75%|███████▌  | 150/200 [5:36:37<1:37:28, 116.98s/it, best=0.865]Escherichia_Coli | DirectMulti | Optuna:  75%|███████▌  | 150/200 [5:36:37<1:37:28, 116.98s/it, best=0.865][I 2026-03-05 13:02:06,902] Trial 150 finished with value: 0.8370577712133139 and parameters: {'activation': 'tanh', 'solver': 'adam', 'lr': 1.6521731689545778e-05, 'layer1': 470, 'layer2': 429, 'layer3': 23}. Best is trial 106 with value: 0.8646284220353448.
Escherichia_Coli | DirectMulti | Optuna:  76%|███████▌  | 151/200 [5:39:26<1:48:13, 132.52s/it, best=0.865]Escherichia_Coli | DirectMulti | Optuna:  76%|███████▌  | 151/200 [5:39:26<1:48:13, 132.52s/it, best=0.865][I 2026-03-05 13:03:31,724] Trial 151 finished with value: 0.8634881020165643 and parameters: {'activation': 'tanh', 'solver': 'adam', 'lr': 0.00014395484894747093, 'layer1': 432, 'layer2': 461, 'layer3': 65}. Best is trial 106 with value: 0.8646284220353448.
Escherichia_Coli | DirectMulti | Optuna:  76%|███████▌  | 152/200 [5:40:51<1:34:34, 118.21s/it, best=0.865]Escherichia_Coli | DirectMulti | Optuna:  76%|███████▌  | 152/200 [5:40:51<1:34:34, 118.21s/it, best=0.865][I 2026-03-05 13:04:38,787] Trial 152 finished with value: 0.8613570260917138 and parameters: {'activation': 'tanh', 'solver': 'adam', 'lr': 6.261095844208175e-05, 'layer1': 282, 'layer2': 466, 'layer3': 93}. Best is trial 106 with value: 0.8646284220353448.
Escherichia_Coli | DirectMulti | Optuna:  76%|███████▋  | 153/200 [5:41:58<1:20:34, 102.87s/it, best=0.865]Escherichia_Coli | DirectMulti | Optuna:  76%|███████▋  | 153/200 [5:41:58<1:20:34, 102.87s/it, best=0.865][I 2026-03-05 13:05:28,108] Trial 153 finished with value: 0.8634953295861567 and parameters: {'activation': 'tanh', 'solver': 'adam', 'lr': 7.588675172464732e-05, 'layer1': 131, 'layer2': 482, 'layer3': 80}. Best is trial 106 with value: 0.8646284220353448.
Escherichia_Coli | DirectMulti | Optuna:  77%|███████▋  | 154/200 [5:42:47<1:06:32, 86.80s/it, best=0.865] Escherichia_Coli | DirectMulti | Optuna:  77%|███████▋  | 154/200 [5:42:47<1:06:32, 86.80s/it, best=0.865][I 2026-03-05 13:07:33,161] Trial 154 finished with value: 0.8633045348260927 and parameters: {'activation': 'tanh', 'solver': 'adam', 'lr': 2.3794983482564623e-05, 'layer1': 444, 'layer2': 453, 'layer3': 49}. Best is trial 106 with value: 0.8646284220353448.
Escherichia_Coli | DirectMulti | Optuna:  78%|███████▊  | 155/200 [5:44:52<1:13:42, 98.28s/it, best=0.865]Escherichia_Coli | DirectMulti | Optuna:  78%|███████▊  | 155/200 [5:44:52<1:13:42, 98.28s/it, best=0.865][I 2026-03-05 13:09:11,471] Trial 155 finished with value: 0.8627851224224072 and parameters: {'activation': 'tanh', 'solver': 'adam', 'lr': 5.200322238250712e-05, 'layer1': 422, 'layer2': 472, 'layer3': 41}. Best is trial 106 with value: 0.8646284220353448.
Escherichia_Coli | DirectMulti | Optuna:  78%|███████▊  | 156/200 [5:46:31<1:12:04, 98.29s/it, best=0.865]Escherichia_Coli | DirectMulti | Optuna:  78%|███████▊  | 156/200 [5:46:31<1:12:04, 98.29s/it, best=0.865][I 2026-03-05 13:12:06,885] Trial 156 finished with value: 0.8629750755941572 and parameters: {'activation': 'tanh', 'solver': 'adam', 'lr': 1.2699828445287555e-05, 'layer1': 485, 'layer2': 489, 'layer3': 57}. Best is trial 106 with value: 0.8646284220353448.
Escherichia_Coli | DirectMulti | Optuna:  78%|███████▊  | 157/200 [5:49:26<1:27:01, 121.43s/it, best=0.865]Escherichia_Coli | DirectMulti | Optuna:  78%|███████▊  | 157/200 [5:49:26<1:27:01, 121.43s/it, best=0.865][I 2026-03-05 13:13:17,886] Trial 157 finished with value: 0.7388067228206201 and parameters: {'activation': 'logistic', 'solver': 'adam', 'lr': 3.399611575609084e-05, 'layer1': 453, 'layer2': 463, 'layer3': 101}. Best is trial 106 with value: 0.8646284220353448.
Escherichia_Coli | DirectMulti | Optuna:  79%|███████▉  | 158/200 [5:50:37<1:14:24, 106.30s/it, best=0.865]Escherichia_Coli | DirectMulti | Optuna:  79%|███████▉  | 158/200 [5:50:37<1:14:24, 106.30s/it, best=0.865][I 2026-03-05 13:15:43,396] Trial 158 finished with value: 0.8630973851659102 and parameters: {'activation': 'tanh', 'solver': 'adam', 'lr': 9.6535266966324e-06, 'layer1': 248, 'layer2': 443, 'layer3': 73}. Best is trial 106 with value: 0.8646284220353448.
Escherichia_Coli | DirectMulti | Optuna:  80%|███████▉  | 159/200 [5:53:02<1:20:40, 118.06s/it, best=0.865]Escherichia_Coli | DirectMulti | Optuna:  80%|███████▉  | 159/200 [5:53:02<1:20:40, 118.06s/it, best=0.865][I 2026-03-05 13:17:33,035] Trial 159 finished with value: 0.8616071063947611 and parameters: {'activation': 'identity', 'solver': 'adam', 'lr': 2.8733714428287584e-05, 'layer1': 475, 'layer2': 474, 'layer3': 302}. Best is trial 106 with value: 0.8646284220353448.
Escherichia_Coli | DirectMulti | Optuna:  80%|████████  | 160/200 [5:54:52<1:17:01, 115.53s/it, best=0.865]Escherichia_Coli | DirectMulti | Optuna:  80%|████████  | 160/200 [5:54:52<1:17:01, 115.53s/it, best=0.865][I 2026-03-05 13:19:17,319] Trial 160 finished with value: 0.8623698013051184 and parameters: {'activation': 'tanh', 'solver': 'adam', 'lr': 4.478187467152495e-05, 'layer1': 490, 'layer2': 482, 'layer3': 161}. Best is trial 106 with value: 0.8646284220353448.
Escherichia_Coli | DirectMulti | Optuna:  80%|████████  | 161/200 [5:56:36<1:12:54, 112.16s/it, best=0.865]Escherichia_Coli | DirectMulti | Optuna:  80%|████████  | 161/200 [5:56:36<1:12:54, 112.16s/it, best=0.865][I 2026-03-05 13:21:59,934] Trial 161 finished with value: 0.8632330305441517 and parameters: {'activation': 'tanh', 'solver': 'adam', 'lr': 1.409993025125554e-05, 'layer1': 428, 'layer2': 499, 'layer3': 51}. Best is trial 106 with value: 0.8646284220353448.
Escherichia_Coli | DirectMulti | Optuna:  81%|████████  | 162/200 [5:59:19<1:20:37, 127.30s/it, best=0.865]Escherichia_Coli | DirectMulti | Optuna:  81%|████████  | 162/200 [5:59:19<1:20:37, 127.30s/it, best=0.865][I 2026-03-05 13:24:11,192] Trial 162 finished with value: 0.863436109081489 and parameters: {'activation': 'tanh', 'solver': 'adam', 'lr': 1.750131979428019e-05, 'layer1': 410, 'layer2': 453, 'layer3': 61}. Best is trial 106 with value: 0.8646284220353448.
Escherichia_Coli | DirectMulti | Optuna:  82%|████████▏ | 163/200 [6:01:30<1:19:13, 128.48s/it, best=0.865]Escherichia_Coli | DirectMulti | Optuna:  82%|████████▏ | 163/200 [6:01:30<1:19:13, 128.48s/it, best=0.865][I 2026-03-05 13:26:47,402] Trial 163 finished with value: 0.8368086643031255 and parameters: {'activation': 'tanh', 'solver': 'adam', 'lr': 1.1200873715979316e-05, 'layer1': 434, 'layer2': 489, 'layer3': 32}. Best is trial 106 with value: 0.8646284220353448.
Escherichia_Coli | DirectMulti | Optuna:  82%|████████▏ | 164/200 [6:04:06<1:22:04, 136.80s/it, best=0.865]Escherichia_Coli | DirectMulti | Optuna:  82%|████████▏ | 164/200 [6:04:06<1:22:04, 136.80s/it, best=0.865][I 2026-03-05 13:30:25,541] Trial 164 finished with value: 0.8640959624826102 and parameters: {'activation': 'tanh', 'solver': 'adam', 'lr': 7.220085226120471e-06, 'layer1': 443, 'layer2': 467, 'layer3': 85}. Best is trial 106 with value: 0.8646284220353448.
Escherichia_Coli | DirectMulti | Optuna:  82%|████████▎ | 165/200 [6:07:45<1:34:02, 161.20s/it, best=0.865]Escherichia_Coli | DirectMulti | Optuna:  82%|████████▎ | 165/200 [6:07:45<1:34:02, 161.20s/it, best=0.865][I 2026-03-05 13:35:10,097] Trial 165 finished with value: 0.8637459390186404 and parameters: {'activation': 'tanh', 'solver': 'adam', 'lr': 5.493486878231498e-06, 'layer1': 465, 'layer2': 463, 'layer3': 89}. Best is trial 106 with value: 0.8646284220353448.
Escherichia_Coli | DirectMulti | Optuna:  83%|████████▎ | 166/200 [6:12:29<1:52:19, 198.21s/it, best=0.865]Escherichia_Coli | DirectMulti | Optuna:  83%|████████▎ | 166/200 [6:12:29<1:52:19, 198.21s/it, best=0.865][I 2026-03-05 13:36:20,786] Trial 166 finished with value: 0.7397475697445847 and parameters: {'activation': 'tanh', 'solver': 'adam', 'lr': 3.938672527109592e-06, 'layer1': 461, 'layer2': 475, 'layer3': 88}. Best is trial 106 with value: 0.8646284220353448.
Escherichia_Coli | DirectMulti | Optuna:  84%|████████▎ | 167/200 [6:13:40<1:27:58, 159.95s/it, best=0.865]Escherichia_Coli | DirectMulti | Optuna:  84%|████████▎ | 167/200 [6:13:40<1:27:58, 159.95s/it, best=0.865][I 2026-03-05 13:39:17,682] Trial 167 finished with value: 0.8146178299160545 and parameters: {'activation': 'tanh', 'solver': 'adam', 'lr': 6.128726044281834e-06, 'layer1': 469, 'layer2': 448, 'layer3': 71}. Best is trial 106 with value: 0.8646284220353448.
Escherichia_Coli | DirectMulti | Optuna:  84%|████████▍ | 168/200 [6:16:37<1:28:01, 165.04s/it, best=0.865]Escherichia_Coli | DirectMulti | Optuna:  84%|████████▍ | 168/200 [6:16:37<1:28:01, 165.04s/it, best=0.865][I 2026-03-05 13:40:28,404] Trial 168 finished with value: 0.7397768696562306 and parameters: {'activation': 'tanh', 'solver': 'adam', 'lr': 2.7325572472535923e-06, 'layer1': 446, 'layer2': 435, 'layer3': 80}. Best is trial 106 with value: 0.8646284220353448.
Escherichia_Coli | DirectMulti | Optuna:  84%|████████▍ | 169/200 [6:17:47<1:10:38, 136.74s/it, best=0.865]Escherichia_Coli | DirectMulti | Optuna:  84%|████████▍ | 169/200 [6:17:47<1:10:38, 136.74s/it, best=0.865][I 2026-03-05 13:43:48,656] Trial 169 finished with value: 0.8147256895463275 and parameters: {'activation': 'tanh', 'solver': 'adam', 'lr': 7.830275052634788e-06, 'layer1': 480, 'layer2': 465, 'layer3': 10}. Best is trial 106 with value: 0.8646284220353448.
Escherichia_Coli | DirectMulti | Optuna:  85%|████████▌ | 170/200 [6:21:08<1:17:53, 155.79s/it, best=0.865]Escherichia_Coli | DirectMulti | Optuna:  85%|████████▌ | 170/200 [6:21:08<1:17:53, 155.79s/it, best=0.865][I 2026-03-05 13:52:45,173] Trial 170 finished with value: 0.7440348077258554 and parameters: {'activation': 'tanh', 'solver': 'sgd', 'lr': 7.428798781491622e-06, 'layer1': 491, 'layer2': 482, 'layer3': 112}. Best is trial 106 with value: 0.8646284220353448.
Escherichia_Coli | DirectMulti | Optuna:  86%|████████▌ | 171/200 [6:30:04<2:10:30, 270.01s/it, best=0.865]Escherichia_Coli | DirectMulti | Optuna:  86%|████████▌ | 171/200 [6:30:04<2:10:30, 270.01s/it, best=0.865][I 2026-03-05 13:55:18,643] Trial 171 finished with value: 0.7871648721403888 and parameters: {'activation': 'tanh', 'solver': 'adam', 'lr': 4.89701751210236e-06, 'layer1': 438, 'layer2': 460, 'layer3': 66}. Best is trial 106 with value: 0.8646284220353448.
Escherichia_Coli | DirectMulti | Optuna:  86%|████████▌ | 172/200 [6:32:38<1:49:41, 235.05s/it, best=0.865]Escherichia_Coli | DirectMulti | Optuna:  86%|████████▌ | 172/200 [6:32:38<1:49:41, 235.05s/it, best=0.865][I 2026-03-05 13:59:38,892] Trial 172 finished with value: 0.8626196457461134 and parameters: {'activation': 'tanh', 'solver': 'adam', 'lr': 5.778016410819464e-06, 'layer1': 453, 'layer2': 468, 'layer3': 95}. Best is trial 106 with value: 0.8646284220353448.
Escherichia_Coli | DirectMulti | Optuna:  86%|████████▋ | 173/200 [6:36:58<1:49:10, 242.61s/it, best=0.865]Escherichia_Coli | DirectMulti | Optuna:  86%|████████▋ | 173/200 [6:36:58<1:49:10, 242.61s/it, best=0.865][I 2026-03-05 14:03:25,039] Trial 173 finished with value: 0.863549195647399 and parameters: {'activation': 'tanh', 'solver': 'adam', 'lr': 9.244142573368743e-06, 'layer1': 462, 'layer2': 458, 'layer3': 42}. Best is trial 106 with value: 0.8646284220353448.
Escherichia_Coli | DirectMulti | Optuna:  87%|████████▋ | 174/200 [6:40:44<1:42:59, 237.67s/it, best=0.865]Escherichia_Coli | DirectMulti | Optuna:  87%|████████▋ | 174/200 [6:40:44<1:42:59, 237.67s/it, best=0.865][I 2026-03-05 14:05:33,185] Trial 174 finished with value: 0.8641499042782327 and parameters: {'activation': 'tanh', 'solver': 'adam', 'lr': 2.1416696782126022e-05, 'layer1': 421, 'layer2': 492, 'layer3': 83}. Best is trial 106 with value: 0.8646284220353448.
Escherichia_Coli | DirectMulti | Optuna:  88%|████████▊ | 175/200 [6:42:52<1:25:20, 204.81s/it, best=0.865]Escherichia_Coli | DirectMulti | Optuna:  88%|████████▊ | 175/200 [6:42:52<1:25:20, 204.81s/it, best=0.865][I 2026-03-05 14:07:27,986] Trial 175 finished with value: 0.8628842310882596 and parameters: {'activation': 'tanh', 'solver': 'adam', 'lr': 2.3320659098099412e-05, 'layer1': 474, 'layer2': 488, 'layer3': 86}. Best is trial 106 with value: 0.8646284220353448.
Escherichia_Coli | DirectMulti | Optuna:  88%|████████▊ | 176/200 [6:44:47<1:11:07, 177.81s/it, best=0.865]Escherichia_Coli | DirectMulti | Optuna:  88%|████████▊ | 176/200 [6:44:47<1:11:07, 177.81s/it, best=0.865][I 2026-03-05 14:09:30,882] Trial 176 finished with value: 0.8633304049248582 and parameters: {'activation': 'tanh', 'solver': 'adam', 'lr': 2.0363212282957778e-05, 'layer1': 419, 'layer2': 493, 'layer3': 76}. Best is trial 106 with value: 0.8646284220353448.
Escherichia_Coli | DirectMulti | Optuna:  88%|████████▊ | 177/200 [6:46:50<1:01:50, 161.34s/it, best=0.865]Escherichia_Coli | DirectMulti | Optuna:  88%|████████▊ | 177/200 [6:46:50<1:01:50, 161.34s/it, best=0.865][I 2026-03-05 14:11:25,186] Trial 177 finished with value: 0.8635488909024325 and parameters: {'activation': 'tanh', 'solver': 'adam', 'lr': 3.821244445784193e-05, 'layer1': 500, 'layer2': 474, 'layer3': 55}. Best is trial 106 with value: 0.8646284220353448.
Escherichia_Coli | DirectMulti | Optuna:  89%|████████▉ | 178/200 [6:48:44<53:58, 147.23s/it, best=0.865]  Escherichia_Coli | DirectMulti | Optuna:  89%|████████▉ | 178/200 [6:48:44<53:58, 147.23s/it, best=0.865][I 2026-03-05 14:13:32,763] Trial 178 finished with value: 0.8632551854102444 and parameters: {'activation': 'tanh', 'solver': 'adam', 'lr': 2.8851974167603405e-05, 'layer1': 485, 'layer2': 479, 'layer3': 65}. Best is trial 106 with value: 0.8646284220353448.
Escherichia_Coli | DirectMulti | Optuna:  90%|████████▉ | 179/200 [6:50:52<49:27, 141.33s/it, best=0.865]Escherichia_Coli | DirectMulti | Optuna:  90%|████████▉ | 179/200 [6:50:52<49:27, 141.33s/it, best=0.865][I 2026-03-05 14:16:03,113] Trial 179 finished with value: 0.862687257214432 and parameters: {'activation': 'tanh', 'solver': 'adam', 'lr': 1.637998428028092e-05, 'layer1': 448, 'layer2': 500, 'layer3': 41}. Best is trial 106 with value: 0.8646284220353448.
Escherichia_Coli | DirectMulti | Optuna:  90%|█████████ | 180/200 [6:53:22<48:00, 144.04s/it, best=0.865]Escherichia_Coli | DirectMulti | Optuna:  90%|█████████ | 180/200 [6:53:22<48:00, 144.04s/it, best=0.865][I 2026-03-05 14:18:10,089] Trial 180 finished with value: 0.8626655210969132 and parameters: {'activation': 'tanh', 'solver': 'adam', 'lr': 3.471583495839635e-05, 'layer1': 473, 'layer2': 448, 'layer3': 31}. Best is trial 106 with value: 0.8646284220353448.
Escherichia_Coli | DirectMulti | Optuna:  90%|█████████ | 181/200 [6:55:29<43:59, 138.92s/it, best=0.865]Escherichia_Coli | DirectMulti | Optuna:  90%|█████████ | 181/200 [6:55:29<43:59, 138.92s/it, best=0.865][I 2026-03-05 14:19:57,596] Trial 181 finished with value: 0.8637745573056377 and parameters: {'activation': 'tanh', 'solver': 'adam', 'lr': 2.4997517591420812e-05, 'layer1': 391, 'layer2': 468, 'layer3': 101}. Best is trial 106 with value: 0.8646284220353448.
Escherichia_Coli | DirectMulti | Optuna:  91%|█████████ | 182/200 [6:57:17<38:50, 129.50s/it, best=0.865]Escherichia_Coli | DirectMulti | Optuna:  91%|█████████ | 182/200 [6:57:17<38:50, 129.50s/it, best=0.865][I 2026-03-05 14:22:05,395] Trial 182 finished with value: 0.8630442568794983 and parameters: {'activation': 'tanh', 'solver': 'adam', 'lr': 2.059239824052017e-05, 'layer1': 389, 'layer2': 471, 'layer3': 111}. Best is trial 106 with value: 0.8646284220353448.
Escherichia_Coli | DirectMulti | Optuna:  92%|█████████▏| 183/200 [6:59:24<36:32, 128.99s/it, best=0.865]Escherichia_Coli | DirectMulti | Optuna:  92%|█████████▏| 183/200 [6:59:24<36:32, 128.99s/it, best=0.865][I 2026-03-05 14:24:20,534] Trial 183 finished with value: 0.8638996239429477 and parameters: {'activation': 'tanh', 'solver': 'adam', 'lr': 2.5168119130729736e-05, 'layer1': 402, 'layer2': 483, 'layer3': 83}. Best is trial 106 with value: 0.8646284220353448.
Escherichia_Coli | DirectMulti | Optuna:  92%|█████████▏| 184/200 [7:01:40<34:53, 130.83s/it, best=0.865]Escherichia_Coli | DirectMulti | Optuna:  92%|█████████▏| 184/200 [7:01:40<34:53, 130.83s/it, best=0.865][I 2026-03-05 14:26:17,849] Trial 184 finished with value: 0.8629868278184212 and parameters: {'activation': 'tanh', 'solver': 'adam', 'lr': 2.7498187110537103e-05, 'layer1': 379, 'layer2': 490, 'layer3': 92}. Best is trial 106 with value: 0.8646284220353448.
Escherichia_Coli | DirectMulti | Optuna:  92%|█████████▎| 185/200 [7:03:37<31:41, 126.78s/it, best=0.865]Escherichia_Coli | DirectMulti | Optuna:  92%|█████████▎| 185/200 [7:03:37<31:41, 126.78s/it, best=0.865][I 2026-03-05 14:28:12,698] Trial 185 finished with value: 0.8633104860285293 and parameters: {'activation': 'tanh', 'solver': 'adam', 'lr': 3.285434082869349e-05, 'layer1': 399, 'layer2': 455, 'layer3': 85}. Best is trial 106 with value: 0.8646284220353448.
Escherichia_Coli | DirectMulti | Optuna:  93%|█████████▎| 186/200 [7:05:32<28:44, 123.20s/it, best=0.865]Escherichia_Coli | DirectMulti | Optuna:  93%|█████████▎| 186/200 [7:05:32<28:44, 123.20s/it, best=0.865][I 2026-03-05 14:30:03,527] Trial 186 finished with value: 0.8633657960454068 and parameters: {'activation': 'tanh', 'solver': 'adam', 'lr': 2.5197510009047302e-05, 'layer1': 374, 'layer2': 478, 'layer3': 102}. Best is trial 106 with value: 0.8646284220353448.
Escherichia_Coli | DirectMulti | Optuna:  94%|█████████▎| 187/200 [7:07:23<25:53, 119.49s/it, best=0.865]Escherichia_Coli | DirectMulti | Optuna:  94%|█████████▎| 187/200 [7:07:23<25:53, 119.49s/it, best=0.865][I 2026-03-05 14:31:44,786] Trial 187 finished with value: 0.8617118338943822 and parameters: {'activation': 'tanh', 'solver': 'adam', 'lr': 5.000649701564919e-05, 'layer1': 412, 'layer2': 466, 'layer3': 117}. Best is trial 106 with value: 0.8646284220353448.
Escherichia_Coli | DirectMulti | Optuna:  94%|█████████▍| 188/200 [7:09:04<22:48, 114.02s/it, best=0.865]Escherichia_Coli | DirectMulti | Optuna:  94%|█████████▍| 188/200 [7:09:04<22:48, 114.02s/it, best=0.865][I 2026-03-05 14:32:56,030] Trial 188 finished with value: 0.7392744518274187 and parameters: {'activation': 'logistic', 'solver': 'adam', 'lr': 4.035907067066436e-05, 'layer1': 392, 'layer2': 440, 'layer3': 77}. Best is trial 106 with value: 0.8646284220353448.
Escherichia_Coli | DirectMulti | Optuna:  94%|█████████▍| 189/200 [7:10:15<18:33, 101.19s/it, best=0.865]Escherichia_Coli | DirectMulti | Optuna:  94%|█████████▍| 189/200 [7:10:15<18:33, 101.19s/it, best=0.865][I 2026-03-05 14:35:04,470] Trial 189 finished with value: 0.8638705549029269 and parameters: {'activation': 'tanh', 'solver': 'adam', 'lr': 2.337433051186825e-05, 'layer1': 404, 'layer2': 483, 'layer3': 72}. Best is trial 106 with value: 0.8646284220353448.
Escherichia_Coli | DirectMulti | Optuna:  95%|█████████▌| 190/200 [7:12:24<18:13, 109.36s/it, best=0.865]Escherichia_Coli | DirectMulti | Optuna:  95%|█████████▌| 190/200 [7:12:24<18:13, 109.36s/it, best=0.865][I 2026-03-05 14:37:42,019] Trial 190 finished with value: 0.8634300386652509 and parameters: {'activation': 'tanh', 'solver': 'adam', 'lr': 1.7512600979973263e-05, 'layer1': 406, 'layer2': 500, 'layer3': 69}. Best is trial 106 with value: 0.8646284220353448.
Escherichia_Coli | DirectMulti | Optuna:  96%|█████████▌| 191/200 [7:15:01<18:34, 123.82s/it, best=0.865]Escherichia_Coli | DirectMulti | Optuna:  96%|█████████▌| 191/200 [7:15:01<18:34, 123.82s/it, best=0.865][I 2026-03-05 14:39:50,414] Trial 191 finished with value: 0.8624895733864164 and parameters: {'activation': 'tanh', 'solver': 'adam', 'lr': 2.3751249187606462e-05, 'layer1': 421, 'layer2': 482, 'layer3': 84}. Best is trial 106 with value: 0.8646284220353448.
Escherichia_Coli | DirectMulti | Optuna:  96%|█████████▌| 192/200 [7:17:09<16:41, 125.19s/it, best=0.865]Escherichia_Coli | DirectMulti | Optuna:  96%|█████████▌| 192/200 [7:17:09<16:41, 125.19s/it, best=0.865][I 2026-03-05 14:41:48,660] Trial 192 finished with value: 0.8629080132844467 and parameters: {'activation': 'tanh', 'solver': 'adam', 'lr': 3.084219731028353e-05, 'layer1': 398, 'layer2': 472, 'layer3': 60}. Best is trial 106 with value: 0.8646284220353448.
