Pseudomonas_Aeruginosa | DirectMulti | Optuna:  40%|████      | 81/200 [1:58:26<2:40:37, 80.99s/it, best=0.866]Pseudomonas_Aeruginosa | DirectMulti | Optuna:  40%|████      | 81/200 [1:58:26<2:40:37, 80.99s/it, best=0.866][I 2026-03-05 01:53:10,497] Trial 80 finished with value: 0.8746470562584285 and parameters: {'activation': 'logistic', 'solver': 'adam', 'lr': 5.487026254327964e-05, 'layer1': 142, 'layer2': 155, 'layer3': 329}. Best is trial 55 with value: 0.9322110061695005.
Klebsiella_Pneumoniae | DirectMulti | Optuna:  40%|████      | 81/200 [1:51:42<1:56:44, 58.86s/it, best=0.932]Klebsiella_Pneumoniae | DirectMulti | Optuna:  40%|████      | 81/200 [1:51:42<1:56:44, 58.86s/it, best=0.932][I 2026-03-05 01:54:10,660] Trial 81 finished with value: 0.8616886147404763 and parameters: {'activation': 'relu', 'solver': 'adam', 'lr': 0.004748483781550761, 'layer1': 461, 'layer2': 288, 'layer3': 210}. Best is trial 71 with value: 0.8659155749694897.
Pseudomonas_Aeruginosa | DirectMulti | Optuna:  41%|████      | 82/200 [2:00:04<2:49:10, 86.02s/it, best=0.866]Pseudomonas_Aeruginosa | DirectMulti | Optuna:  41%|████      | 82/200 [2:00:04<2:49:10, 86.02s/it, best=0.866][I 2026-03-05 01:54:20,018] Trial 81 finished with value: 0.9313946901201439 and parameters: {'activation': 'tanh', 'solver': 'adam', 'lr': 9.78637365708061e-05, 'layer1': 124, 'layer2': 182, 'layer3': 403}. Best is trial 55 with value: 0.9322110061695005.
Klebsiella_Pneumoniae | DirectMulti | Optuna:  41%|████      | 82/200 [1:52:52<2:02:02, 62.06s/it, best=0.932]Klebsiella_Pneumoniae | DirectMulti | Optuna:  41%|████      | 82/200 [1:52:52<2:02:02, 62.06s/it, best=0.932][I 2026-03-05 01:54:49,490] Trial 41 finished with value: 0.8880347602274341 and parameters: {'activation': 'relu', 'solver': 'adam', 'lr': 1.7962804359359865e-05, 'layer1': 241, 'layer2': 184, 'layer3': 222}. Best is trial 39 with value: 0.8916726567218316.
Staphylococcus_Aureus | DirectMulti | Optuna:  21%|██        | 42/200 [1:20:07<8:18:05, 189.15s/it, best=0.892]Staphylococcus_Aureus | DirectMulti | Optuna:  21%|██        | 42/200 [1:20:07<8:18:05, 189.15s/it, best=0.892][I 2026-03-05 01:55:10,862] Trial 114 finished with value: 0.8616685991814389 and parameters: {'activation': 'tanh', 'solver': 'adam', 'lr': 2.1317894505244133e-05, 'layer1': 392, 'layer2': 37, 'layer3': 466}. Best is trial 73 with value: 0.864893646817533.
Escherichia_Coli | LPS | Optuna:  57%|█████▊    | 115/200 [5:56:52<4:38:56, 196.91s/it, best=0.865]Escherichia_Coli | LPS | Optuna:  57%|█████▊    | 115/200 [5:56:52<4:38:56, 196.91s/it, best=0.865][I 2026-03-05 01:55:34,793] Trial 82 finished with value: 0.9317274973786228 and parameters: {'activation': 'tanh', 'solver': 'adam', 'lr': 7.938698875580319e-05, 'layer1': 124, 'layer2': 194, 'layer3': 360}. Best is trial 55 with value: 0.9322110061695005.
Klebsiella_Pneumoniae | DirectMulti | Optuna:  42%|████▏     | 83/200 [1:54:06<2:08:27, 65.87s/it, best=0.932]Klebsiella_Pneumoniae | DirectMulti | Optuna:  42%|████▏     | 83/200 [1:54:06<2:08:27, 65.87s/it, best=0.932][I 2026-03-05 01:56:35,294] Trial 82 finished with value: 0.8618277962253206 and parameters: {'activation': 'relu', 'solver': 'adam', 'lr': 0.00617167895012052, 'layer1': 487, 'layer2': 327, 'layer3': 413}. Best is trial 71 with value: 0.8659155749694897.
Pseudomonas_Aeruginosa | DirectMulti | Optuna:  42%|████▏     | 83/200 [2:02:29<3:22:01, 103.60s/it, best=0.866]Pseudomonas_Aeruginosa | DirectMulti | Optuna:  42%|████▏     | 83/200 [2:02:29<3:22:01, 103.60s/it, best=0.866][I 2026-03-05 01:56:46,944] Trial 83 finished with value: 0.9315104248234569 and parameters: {'activation': 'tanh', 'solver': 'adam', 'lr': 7.770584258029089e-05, 'layer1': 116, 'layer2': 191, 'layer3': 362}. Best is trial 55 with value: 0.9322110061695005.
Klebsiella_Pneumoniae | DirectMulti | Optuna:  42%|████▏     | 84/200 [1:55:19<2:10:59, 67.76s/it, best=0.932]Klebsiella_Pneumoniae | DirectMulti | Optuna:  42%|████▏     | 84/200 [1:55:19<2:10:59, 67.76s/it, best=0.932][I 2026-03-05 01:57:47,092] Trial 115 finished with value: 0.861675509339145 and parameters: {'activation': 'tanh', 'solver': 'adam', 'lr': 6.83834152318282e-05, 'layer1': 467, 'layer2': 84, 'layer3': 355}. Best is trial 73 with value: 0.864893646817533.
Escherichia_Coli | LPS | Optuna:  58%|█████▊    | 116/200 [5:59:29<4:18:34, 184.70s/it, best=0.865]Escherichia_Coli | LPS | Optuna:  58%|█████▊    | 116/200 [5:59:29<4:18:34, 184.70s/it, best=0.865][I 2026-03-05 01:58:01,455] Trial 84 finished with value: 0.9308467018535385 and parameters: {'activation': 'tanh', 'solver': 'adam', 'lr': 7.878525681350636e-05, 'layer1': 99, 'layer2': 198, 'layer3': 362}. Best is trial 55 with value: 0.9322110061695005.
Klebsiella_Pneumoniae | DirectMulti | Optuna:  42%|████▎     | 85/200 [1:56:33<2:13:44, 69.78s/it, best=0.932]Klebsiella_Pneumoniae | DirectMulti | Optuna:  42%|████▎     | 85/200 [1:56:33<2:13:44, 69.78s/it, best=0.932][I 2026-03-05 01:58:21,596] Trial 42 finished with value: 0.8912362148124358 and parameters: {'activation': 'relu', 'solver': 'adam', 'lr': 3.868315731085242e-05, 'layer1': 162, 'layer2': 171, 'layer3': 182}. Best is trial 39 with value: 0.8916726567218316.
Staphylococcus_Aureus | DirectMulti | Optuna:  22%|██▏       | 43/200 [1:23:39<8:32:57, 196.04s/it, best=0.892]Staphylococcus_Aureus | DirectMulti | Optuna:  22%|██▏       | 43/200 [1:23:39<8:32:57, 196.04s/it, best=0.892][I 2026-03-05 01:58:39,924] Trial 83 finished with value: 0.8584787238181238 and parameters: {'activation': 'relu', 'solver': 'adam', 'lr': 0.009824777890836281, 'layer1': 447, 'layer2': 298, 'layer3': 465}. Best is trial 71 with value: 0.8659155749694897.
Pseudomonas_Aeruginosa | DirectMulti | Optuna:  42%|████▏     | 84/200 [2:04:33<3:32:29, 109.91s/it, best=0.866]Pseudomonas_Aeruginosa | DirectMulti | Optuna:  42%|████▏     | 84/200 [2:04:33<3:32:29, 109.91s/it, best=0.866][I 2026-03-05 01:59:00,834] Trial 85 finished with value: 0.9300031211166763 and parameters: {'activation': 'tanh', 'solver': 'adam', 'lr': 0.00012542542791052182, 'layer1': 113, 'layer2': 235, 'layer3': 341}. Best is trial 55 with value: 0.9322110061695005.
Klebsiella_Pneumoniae | DirectMulti | Optuna:  43%|████▎     | 86/200 [1:57:32<2:06:39, 66.66s/it, best=0.932]Klebsiella_Pneumoniae | DirectMulti | Optuna:  43%|████▎     | 86/200 [1:57:32<2:06:39, 66.66s/it, best=0.932][I 2026-03-05 02:00:00,249] Trial 86 finished with value: 0.9297107131979597 and parameters: {'activation': 'tanh', 'solver': 'adam', 'lr': 0.00025401291092913645, 'layer1': 167, 'layer2': 271, 'layer3': 381}. Best is trial 55 with value: 0.9322110061695005.
Klebsiella_Pneumoniae | DirectMulti | Optuna:  44%|████▎     | 87/200 [1:58:32<2:01:27, 64.49s/it, best=0.932]Klebsiella_Pneumoniae | DirectMulti | Optuna:  44%|████▎     | 87/200 [1:58:32<2:01:27, 64.49s/it, best=0.932][I 2026-03-05 02:01:00,520] Trial 43 finished with value: 0.8894409939723031 and parameters: {'activation': 'relu', 'solver': 'adam', 'lr': 4.2997694732050204e-05, 'layer1': 161, 'layer2': 237, 'layer3': 174}. Best is trial 39 with value: 0.8916726567218316.
Staphylococcus_Aureus | DirectMulti | Optuna:  22%|██▏       | 44/200 [1:26:18<8:00:44, 184.90s/it, best=0.892]Staphylococcus_Aureus | DirectMulti | Optuna:  22%|██▏       | 44/200 [1:26:18<8:00:44, 184.90s/it, best=0.892][I 2026-03-05 02:01:10,879] Trial 84 finished with value: 0.8633463611595609 and parameters: {'activation': 'relu', 'solver': 'adam', 'lr': 0.003444864261489047, 'layer1': 470, 'layer2': 421, 'layer3': 487}. Best is trial 71 with value: 0.8659155749694897.
Pseudomonas_Aeruginosa | DirectMulti | Optuna:  42%|████▎     | 85/200 [2:07:04<3:54:15, 122.22s/it, best=0.866]Pseudomonas_Aeruginosa | DirectMulti | Optuna:  42%|████▎     | 85/200 [2:07:04<3:54:15, 122.22s/it, best=0.866][I 2026-03-05 02:01:51,110] Trial 116 finished with value: 0.8615232298612272 and parameters: {'activation': 'relu', 'solver': 'adam', 'lr': 2.9291019636870524e-05, 'layer1': 423, 'layer2': 125, 'layer3': 442}. Best is trial 73 with value: 0.864893646817533.
Escherichia_Coli | LPS | Optuna:  58%|█████▊    | 117/200 [6:03:33<4:40:07, 202.50s/it, best=0.865]Escherichia_Coli | LPS | Optuna:  58%|█████▊    | 117/200 [6:03:33<4:40:07, 202.50s/it, best=0.865][I 2026-03-05 02:01:53,528] Trial 87 finished with value: 0.7425544287147604 and parameters: {'activation': 'relu', 'solver': 'sgd', 'lr': 6.37023657504647e-05, 'layer1': 75, 'layer2': 218, 'layer3': 367}. Best is trial 55 with value: 0.9322110061695005.
Klebsiella_Pneumoniae | DirectMulti | Optuna:  44%|████▍     | 88/200 [2:00:25<2:27:41, 79.12s/it, best=0.932]Klebsiella_Pneumoniae | DirectMulti | Optuna:  44%|████▍     | 88/200 [2:00:25<2:27:41, 79.12s/it, best=0.932][I 2026-03-05 02:02:54,152] Trial 88 finished with value: 0.93013017398049 and parameters: {'activation': 'tanh', 'solver': 'adam', 'lr': 0.0006175393694241137, 'layer1': 201, 'layer2': 188, 'layer3': 296}. Best is trial 55 with value: 0.9322110061695005.
Klebsiella_Pneumoniae | DirectMulti | Optuna:  44%|████▍     | 89/200 [2:01:26<2:16:06, 73.57s/it, best=0.932]Klebsiella_Pneumoniae | DirectMulti | Optuna:  44%|████▍     | 89/200 [2:01:26<2:16:06, 73.57s/it, best=0.932][I 2026-03-05 02:03:02,218] Trial 85 finished with value: 0.8612061423556 and parameters: {'activation': 'relu', 'solver': 'adam', 'lr': 0.0034664144427216242, 'layer1': 470, 'layer2': 500, 'layer3': 483}. Best is trial 71 with value: 0.8659155749694897.
Pseudomonas_Aeruginosa | DirectMulti | Optuna:  43%|████▎     | 86/200 [2:08:56<3:46:01, 118.96s/it, best=0.866]Pseudomonas_Aeruginosa | DirectMulti | Optuna:  43%|████▎     | 86/200 [2:08:56<3:46:01, 118.96s/it, best=0.866][I 2026-03-05 02:03:08,512] Trial 44 finished with value: 0.8902383974905053 and parameters: {'activation': 'relu', 'solver': 'adam', 'lr': 0.00016204355808935832, 'layer1': 364, 'layer2': 204, 'layer3': 113}. Best is trial 39 with value: 0.8916726567218316.
Staphylococcus_Aureus | DirectMulti | Optuna:  22%|██▎       | 45/200 [1:28:26<7:13:33, 167.83s/it, best=0.892]Staphylococcus_Aureus | DirectMulti | Optuna:  22%|██▎       | 45/200 [1:28:26<7:13:33, 167.83s/it, best=0.892][I 2026-03-05 02:03:42,054] Trial 117 finished with value: 0.7388067228206201 and parameters: {'activation': 'logistic', 'solver': 'adam', 'lr': 4.8354859672953034e-05, 'layer1': 446, 'layer2': 24, 'layer3': 431}. Best is trial 73 with value: 0.864893646817533.
Escherichia_Coli | LPS | Optuna:  59%|█████▉    | 118/200 [6:05:24<3:59:12, 175.03s/it, best=0.865]Escherichia_Coli | LPS | Optuna:  59%|█████▉    | 118/200 [6:05:24<3:59:12, 175.03s/it, best=0.865][I 2026-03-05 02:04:03,835] Trial 86 finished with value: 0.8261898244308833 and parameters: {'activation': 'tanh', 'solver': 'adam', 'lr': 0.004161575900019965, 'layer1': 408, 'layer2': 464, 'layer3': 500}. Best is trial 71 with value: 0.8659155749694897.
Pseudomonas_Aeruginosa | DirectMulti | Optuna:  44%|████▎     | 87/200 [2:09:57<3:11:38, 101.76s/it, best=0.866]Pseudomonas_Aeruginosa | DirectMulti | Optuna:  44%|████▎     | 87/200 [2:09:57<3:11:38, 101.76s/it, best=0.866][I 2026-03-05 02:04:08,238] Trial 89 finished with value: 0.9301256872089292 and parameters: {'activation': 'identity', 'solver': 'adam', 'lr': 4.6415813750297806e-05, 'layer1': 131, 'layer2': 162, 'layer3': 397}. Best is trial 55 with value: 0.9322110061695005.
Klebsiella_Pneumoniae | DirectMulti | Optuna:  45%|████▌     | 90/200 [2:02:40<2:15:10, 73.73s/it, best=0.932]Klebsiella_Pneumoniae | DirectMulti | Optuna:  45%|████▌     | 90/200 [2:02:40<2:15:10, 73.73s/it, best=0.932][I 2026-03-05 02:05:19,636] Trial 90 finished with value: 0.897723299989879 and parameters: {'activation': 'tanh', 'solver': 'adam', 'lr': 3.4686556188673005e-05, 'layer1': 49, 'layer2': 106, 'layer3': 350}. Best is trial 55 with value: 0.9322110061695005.
Klebsiella_Pneumoniae | DirectMulti | Optuna:  46%|████▌     | 91/200 [2:03:51<2:12:40, 73.03s/it, best=0.932]Klebsiella_Pneumoniae | DirectMulti | Optuna:  46%|████▌     | 91/200 [2:03:51<2:12:40, 73.03s/it, best=0.932][I 2026-03-05 02:05:38,314] Trial 45 finished with value: 0.8907098797841988 and parameters: {'activation': 'relu', 'solver': 'adam', 'lr': 8.521899874453629e-05, 'layer1': 199, 'layer2': 163, 'layer3': 180}. Best is trial 39 with value: 0.8916726567218316.
Staphylococcus_Aureus | DirectMulti | Optuna:  23%|██▎       | 46/200 [1:30:55<6:56:52, 162.42s/it, best=0.892]Staphylococcus_Aureus | DirectMulti | Optuna:  23%|██▎       | 46/200 [1:30:55<6:56:52, 162.42s/it, best=0.892][I 2026-03-05 02:05:41,824] Trial 87 finished with value: 0.8561652619219172 and parameters: {'activation': 'relu', 'solver': 'adam', 'lr': 0.007168900809671818, 'layer1': 434, 'layer2': 412, 'layer3': 451}. Best is trial 71 with value: 0.8659155749694897.
Pseudomonas_Aeruginosa | DirectMulti | Optuna:  44%|████▍     | 88/200 [2:11:35<3:07:50, 100.63s/it, best=0.866]Pseudomonas_Aeruginosa | DirectMulti | Optuna:  44%|████▍     | 88/200 [2:11:35<3:07:50, 100.63s/it, best=0.866][I 2026-03-05 02:06:26,145] Trial 91 finished with value: 0.9309355041689852 and parameters: {'activation': 'tanh', 'solver': 'adam', 'lr': 8.688346850310457e-05, 'layer1': 117, 'layer2': 174, 'layer3': 433}. Best is trial 55 with value: 0.9322110061695005.
Klebsiella_Pneumoniae | DirectMulti | Optuna:  46%|████▌     | 92/200 [2:04:58<2:07:55, 71.07s/it, best=0.932]Klebsiella_Pneumoniae | DirectMulti | Optuna:  46%|████▌     | 92/200 [2:04:58<2:07:55, 71.07s/it, best=0.932][I 2026-03-05 02:07:14,640] Trial 118 finished with value: 0.862286327168613 and parameters: {'activation': 'relu', 'solver': 'adam', 'lr': 3.5183079656853865e-05, 'layer1': 359, 'layer2': 44, 'layer3': 231}. Best is trial 73 with value: 0.864893646817533.
Escherichia_Coli | LPS | Optuna:  60%|█████▉    | 119/200 [6:08:56<4:11:30, 186.30s/it, best=0.865]Escherichia_Coli | LPS | Optuna:  60%|█████▉    | 119/200 [6:08:56<4:11:30, 186.30s/it, best=0.865][I 2026-03-05 02:07:36,463] Trial 88 finished with value: 0.8600787665972094 and parameters: {'activation': 'relu', 'solver': 'adam', 'lr': 0.0022621872185234182, 'layer1': 453, 'layer2': 424, 'layer3': 433}. Best is trial 71 with value: 0.8659155749694897.
Pseudomonas_Aeruginosa | DirectMulti | Optuna:  44%|████▍     | 89/200 [2:13:30<3:13:56, 104.83s/it, best=0.866]Pseudomonas_Aeruginosa | DirectMulti | Optuna:  44%|████▍     | 89/200 [2:13:30<3:13:56, 104.83s/it, best=0.866][I 2026-03-05 02:07:44,156] Trial 46 finished with value: 0.8901921038083161 and parameters: {'activation': 'relu', 'solver': 'adam', 'lr': 9.369479781447052e-05, 'layer1': 201, 'layer2': 126, 'layer3': 138}. Best is trial 39 with value: 0.8916726567218316.
Staphylococcus_Aureus | DirectMulti | Optuna:  24%|██▎       | 47/200 [1:33:01<6:26:11, 151.45s/it, best=0.892]Staphylococcus_Aureus | DirectMulti | Optuna:  24%|██▎       | 47/200 [1:33:01<6:26:11, 151.45s/it, best=0.892][I 2026-03-05 02:08:22,448] Trial 92 finished with value: 0.9305592734076903 and parameters: {'activation': 'tanh', 'solver': 'adam', 'lr': 2.4624794797910304e-05, 'layer1': 144, 'layer2': 208, 'layer3': 409}. Best is trial 55 with value: 0.9322110061695005.
Klebsiella_Pneumoniae | DirectMulti | Optuna:  46%|████▋     | 93/200 [2:06:54<2:30:56, 84.64s/it, best=0.932]Klebsiella_Pneumoniae | DirectMulti | Optuna:  46%|████▋     | 93/200 [2:06:54<2:30:56, 84.64s/it, best=0.932][I 2026-03-05 02:08:32,976] Trial 119 finished with value: 0.7388067228206201 and parameters: {'activation': 'relu', 'solver': 'sgd', 'lr': 0.0018800544028886163, 'layer1': 409, 'layer2': 10, 'layer3': 181}. Best is trial 73 with value: 0.864893646817533.
Escherichia_Coli | LPS | Optuna:  60%|██████    | 120/200 [6:10:15<3:25:12, 153.91s/it, best=0.865]Escherichia_Coli | LPS | Optuna:  60%|██████    | 120/200 [6:10:15<3:25:12, 153.91s/it, best=0.865][I 2026-03-05 02:08:42,803] Trial 47 finished with value: 0.8016455484651599 and parameters: {'activation': 'relu', 'solver': 'sgd', 'lr': 0.0005920352060333061, 'layer1': 280, 'layer2': 46, 'layer3': 94}. Best is trial 39 with value: 0.8916726567218316.
Staphylococcus_Aureus | DirectMulti | Optuna:  24%|██▍       | 48/200 [1:34:00<5:13:08, 123.61s/it, best=0.892]Staphylococcus_Aureus | DirectMulti | Optuna:  24%|██▍       | 48/200 [1:34:00<5:13:08, 123.61s/it, best=0.892][I 2026-03-05 02:09:24,429] Trial 93 finished with value: 0.930774602398899 and parameters: {'activation': 'tanh', 'solver': 'adam', 'lr': 0.00010551594504905118, 'layer1': 99, 'layer2': 123, 'layer3': 382}. Best is trial 55 with value: 0.9322110061695005.
Klebsiella_Pneumoniae | DirectMulti | Optuna:  47%|████▋     | 94/200 [2:07:56<2:17:31, 77.84s/it, best=0.932]Klebsiella_Pneumoniae | DirectMulti | Optuna:  47%|████▋     | 94/200 [2:07:56<2:17:31, 77.84s/it, best=0.932][I 2026-03-05 02:09:31,614] Trial 89 finished with value: 0.852591577562985 and parameters: {'activation': 'logistic', 'solver': 'adam', 'lr': 0.00516370614700122, 'layer1': 480, 'layer2': 397, 'layer3': 461}. Best is trial 71 with value: 0.8659155749694897.
Pseudomonas_Aeruginosa | DirectMulti | Optuna:  45%|████▌     | 90/200 [2:15:25<3:17:51, 107.93s/it, best=0.866]Pseudomonas_Aeruginosa | DirectMulti | Optuna:  45%|████▌     | 90/200 [2:15:25<3:17:51, 107.93s/it, best=0.866][I 2026-03-05 02:10:24,664] Trial 48 finished with value: 0.891551652075519 and parameters: {'activation': 'identity', 'solver': 'adam', 'lr': 7.86695524976148e-05, 'layer1': 242, 'layer2': 471, 'layer3': 50}. Best is trial 39 with value: 0.8916726567218316.
Staphylococcus_Aureus | DirectMulti | Optuna:  24%|██▍       | 49/200 [1:35:42<4:54:39, 117.08s/it, best=0.892]Staphylococcus_Aureus | DirectMulti | Optuna:  24%|██▍       | 49/200 [1:35:42<4:54:39, 117.08s/it, best=0.892][I 2026-03-05 02:10:44,874] Trial 94 finished with value: 0.9311563206958606 and parameters: {'activation': 'tanh', 'solver': 'adam', 'lr': 6.680076653688892e-05, 'layer1': 132, 'layer2': 230, 'layer3': 415}. Best is trial 55 with value: 0.9322110061695005.
Klebsiella_Pneumoniae | DirectMulti | Optuna:  48%|████▊     | 95/200 [2:09:17<2:17:35, 78.62s/it, best=0.932]Klebsiella_Pneumoniae | DirectMulti | Optuna:  48%|████▊     | 95/200 [2:09:17<2:17:35, 78.62s/it, best=0.932][I 2026-03-05 02:11:24,377] Trial 90 finished with value: 0.8643945409077365 and parameters: {'activation': 'relu', 'solver': 'adam', 'lr': 0.0030280242495657897, 'layer1': 394, 'layer2': 357, 'layer3': 331}. Best is trial 71 with value: 0.8659155749694897.
Pseudomonas_Aeruginosa | DirectMulti | Optuna:  46%|████▌     | 91/200 [2:17:18<3:18:42, 109.38s/it, best=0.866]Pseudomonas_Aeruginosa | DirectMulti | Optuna:  46%|████▌     | 91/200 [2:17:18<3:18:42, 109.38s/it, best=0.866][I 2026-03-05 02:11:53,803] Trial 120 finished with value: 0.8606707569123475 and parameters: {'activation': 'identity', 'solver': 'adam', 'lr': 2.4270010474345244e-05, 'layer1': 461, 'layer2': 145, 'layer3': 461}. Best is trial 73 with value: 0.864893646817533.
Escherichia_Coli | LPS | Optuna:  60%|██████    | 121/200 [6:13:35<3:41:10, 167.98s/it, best=0.865]Escherichia_Coli | LPS | Optuna:  60%|██████    | 121/200 [6:13:35<3:41:10, 167.98s/it, best=0.865][I 2026-03-05 02:12:03,101] Trial 49 finished with value: 0.8919989571847162 and parameters: {'activation': 'identity', 'solver': 'adam', 'lr': 6.499942065107398e-05, 'layer1': 232, 'layer2': 473, 'layer3': 46}. Best is trial 49 with value: 0.8919989571847162.
Staphylococcus_Aureus | DirectMulti | Optuna:  25%|██▌       | 50/200 [1:37:20<4:38:43, 111.49s/it, best=0.892]Staphylococcus_Aureus | DirectMulti | Optuna:  25%|██▌       | 50/200 [1:37:20<4:38:43, 111.49s/it, best=0.892][I 2026-03-05 02:12:11,103] Trial 95 finished with value: 0.9190709923592856 and parameters: {'activation': 'tanh', 'solver': 'adam', 'lr': 3.190175388450727e-05, 'layer1': 23, 'layer2': 180, 'layer3': 438}. Best is trial 55 with value: 0.9322110061695005.
Klebsiella_Pneumoniae | DirectMulti | Optuna:  48%|████▊     | 96/200 [2:10:43<2:20:14, 80.91s/it, best=0.932]Klebsiella_Pneumoniae | DirectMulti | Optuna:  48%|████▊     | 96/200 [2:10:43<2:20:14, 80.91s/it, best=0.932][I 2026-03-05 02:13:03,763] Trial 91 finished with value: 0.8646883607846634 and parameters: {'activation': 'relu', 'solver': 'adam', 'lr': 0.002993869032619496, 'layer1': 464, 'layer2': 358, 'layer3': 324}. Best is trial 71 with value: 0.8659155749694897.
Pseudomonas_Aeruginosa | DirectMulti | Optuna:  46%|████▌     | 92/200 [2:18:57<3:11:29, 106.38s/it, best=0.866]Pseudomonas_Aeruginosa | DirectMulti | Optuna:  46%|████▌     | 92/200 [2:18:57<3:11:29, 106.38s/it, best=0.866][I 2026-03-05 02:13:26,444] Trial 96 finished with value: 0.9306692501886742 and parameters: {'activation': 'tanh', 'solver': 'adam', 'lr': 5.020499778856893e-05, 'layer1': 75, 'layer2': 148, 'layer3': 396}. Best is trial 55 with value: 0.9322110061695005.
Klebsiella_Pneumoniae | DirectMulti | Optuna:  48%|████▊     | 97/200 [2:11:58<2:16:01, 79.24s/it, best=0.932]Klebsiella_Pneumoniae | DirectMulti | Optuna:  48%|████▊     | 97/200 [2:11:58<2:16:01, 79.24s/it, best=0.932][I 2026-03-05 02:14:00,832] Trial 50 finished with value: 0.8908636833853543 and parameters: {'activation': 'identity', 'solver': 'adam', 'lr': 5.626011089242131e-05, 'layer1': 238, 'layer2': 484, 'layer3': 52}. Best is trial 49 with value: 0.8919989571847162.
Staphylococcus_Aureus | DirectMulti | Optuna:  26%|██▌       | 51/200 [1:39:18<4:41:30, 113.36s/it, best=0.892]Staphylococcus_Aureus | DirectMulti | Optuna:  26%|██▌       | 51/200 [1:39:18<4:41:30, 113.36s/it, best=0.892][I 2026-03-05 02:14:27,487] Trial 97 finished with value: 0.931620447085747 and parameters: {'activation': 'tanh', 'solver': 'adam', 'lr': 0.00014721166928710933, 'layer1': 156, 'layer2': 140, 'layer3': 453}. Best is trial 55 with value: 0.9322110061695005.
