Escherichia_Coli | DirectMulti | Optuna:  30%|███       | 61/200 [2:22:56<4:53:34, 126.73s/it, best=0.864]Escherichia_Coli | DirectMulti | Optuna:  30%|███       | 61/200 [2:22:56<4:53:34, 126.73s/it, best=0.864][I 2026-03-05 09:47:39,475] Trial 61 finished with value: 0.862698076638804 and parameters: {'activation': 'tanh', 'solver': 'adam', 'lr': 7.317494870616033e-05, 'layer1': 486, 'layer2': 461, 'layer3': 41}. Best is trial 14 with value: 0.8635368497386182.
Escherichia_Coli | DirectMulti | Optuna:  31%|███       | 62/200 [2:24:59<4:48:37, 125.49s/it, best=0.864]Escherichia_Coli | DirectMulti | Optuna:  31%|███       | 62/200 [2:24:59<4:48:37, 125.49s/it, best=0.864][I 2026-03-05 09:48:31,040] Trial 62 finished with value: 0.8617426312920964 and parameters: {'activation': 'tanh', 'solver': 'adam', 'lr': 0.00045047524818741424, 'layer1': 91, 'layer2': 432, 'layer3': 29}. Best is trial 14 with value: 0.8635368497386182.
Escherichia_Coli | DirectMulti | Optuna:  32%|███▏      | 63/200 [2:25:50<3:55:53, 103.31s/it, best=0.864]Escherichia_Coli | DirectMulti | Optuna:  32%|███▏      | 63/200 [2:25:50<3:55:53, 103.31s/it, best=0.864][I 2026-03-05 09:48:45,468] Trial 195 finished with value: 0.8901634996175363 and parameters: {'activation': 'identity', 'solver': 'adam', 'lr': 1.000694423532863e-05, 'layer1': 337, 'layer2': 390, 'layer3': 83}. Best is trial 153 with value: 0.8936680613721473.
Staphylococcus_Aureus | DirectMulti | Optuna:  98%|█████████▊| 196/200 [9:14:03<13:17, 199.33s/it, best=0.894]Staphylococcus_Aureus | DirectMulti | Optuna:  98%|█████████▊| 196/200 [9:14:03<13:17, 199.33s/it, best=0.894][I 2026-03-05 09:50:32,386] Trial 63 finished with value: 0.8629895144807603 and parameters: {'activation': 'tanh', 'solver': 'adam', 'lr': 4.990201012452263e-05, 'layer1': 499, 'layer2': 410, 'layer3': 73}. Best is trial 14 with value: 0.8635368497386182.
Escherichia_Coli | DirectMulti | Optuna:  32%|███▏      | 64/200 [2:27:51<4:06:26, 108.72s/it, best=0.864]Escherichia_Coli | DirectMulti | Optuna:  32%|███▏      | 64/200 [2:27:51<4:06:26, 108.72s/it, best=0.864][I 2026-03-05 09:50:54,601] Trial 196 finished with value: 0.8917600529332205 and parameters: {'activation': 'identity', 'solver': 'adam', 'lr': 2.989120936425819e-05, 'layer1': 310, 'layer2': 431, 'layer3': 62}. Best is trial 153 with value: 0.8936680613721473.
Staphylococcus_Aureus | DirectMulti | Optuna:  98%|█████████▊| 197/200 [9:16:12<08:54, 178.27s/it, best=0.894]Staphylococcus_Aureus | DirectMulti | Optuna:  98%|█████████▊| 197/200 [9:16:12<08:54, 178.27s/it, best=0.894][I 2026-03-05 09:52:42,595] Trial 64 finished with value: 0.8632904909161981 and parameters: {'activation': 'tanh', 'solver': 'adam', 'lr': 4.822311081315529e-05, 'layer1': 485, 'layer2': 398, 'layer3': 68}. Best is trial 14 with value: 0.8635368497386182.
Escherichia_Coli | DirectMulti | Optuna:  32%|███▎      | 65/200 [2:30:02<4:19:07, 115.17s/it, best=0.864]Escherichia_Coli | DirectMulti | Optuna:  32%|███▎      | 65/200 [2:30:02<4:19:07, 115.17s/it, best=0.864][I 2026-03-05 09:53:34,868] Trial 197 finished with value: 0.8918093439523931 and parameters: {'activation': 'identity', 'solver': 'adam', 'lr': 2.1583527506601934e-05, 'layer1': 364, 'layer2': 423, 'layer3': 43}. Best is trial 153 with value: 0.8936680613721473.
Staphylococcus_Aureus | DirectMulti | Optuna:  99%|█████████▉| 198/200 [9:18:52<05:45, 172.87s/it, best=0.894]Staphylococcus_Aureus | DirectMulti | Optuna:  99%|█████████▉| 198/200 [9:18:52<05:45, 172.87s/it, best=0.894][I 2026-03-05 09:54:45,548] Trial 65 finished with value: 0.8628089151211624 and parameters: {'activation': 'tanh', 'solver': 'adam', 'lr': 5.05786759700563e-05, 'layer1': 500, 'layer2': 406, 'layer3': 63}. Best is trial 14 with value: 0.8635368497386182.
Escherichia_Coli | DirectMulti | Optuna:  33%|███▎      | 66/200 [2:32:05<4:22:25, 117.50s/it, best=0.864]Escherichia_Coli | DirectMulti | Optuna:  33%|███▎      | 66/200 [2:32:05<4:22:25, 117.50s/it, best=0.864][I 2026-03-05 09:56:44,621] Trial 198 finished with value: 0.8918889233958627 and parameters: {'activation': 'identity', 'solver': 'adam', 'lr': 1.4040098132628816e-05, 'layer1': 262, 'layer2': 399, 'layer3': 25}. Best is trial 153 with value: 0.8936680613721473.
Staphylococcus_Aureus | DirectMulti | Optuna: 100%|█████████▉| 199/200 [9:22:02<02:57, 177.93s/it, best=0.894]Staphylococcus_Aureus | DirectMulti | Optuna: 100%|█████████▉| 199/200 [9:22:02<02:57, 177.93s/it, best=0.894][I 2026-03-05 09:56:48,398] Trial 66 finished with value: 0.8598549046126088 and parameters: {'activation': 'relu', 'solver': 'adam', 'lr': 0.00011222349410400406, 'layer1': 458, 'layer2': 479, 'layer3': 77}. Best is trial 14 with value: 0.8635368497386182.
Escherichia_Coli | DirectMulti | Optuna:  34%|███▎      | 67/200 [2:34:07<4:24:01, 119.11s/it, best=0.864]Escherichia_Coli | DirectMulti | Optuna:  34%|███▎      | 67/200 [2:34:07<4:24:01, 119.11s/it, best=0.864][I 2026-03-05 09:58:33,594] Trial 67 finished with value: 0.8625443381212774 and parameters: {'activation': 'tanh', 'solver': 'adam', 'lr': 0.00017221975459794664, 'layer1': 484, 'layer2': 438, 'layer3': 50}. Best is trial 14 with value: 0.8635368497386182.
Escherichia_Coli | DirectMulti | Optuna:  34%|███▍      | 68/200 [2:35:53<4:12:51, 114.93s/it, best=0.864]Escherichia_Coli | DirectMulti | Optuna:  34%|███▍      | 68/200 [2:35:53<4:12:51, 114.93s/it, best=0.864][I 2026-03-05 09:59:34,501] Trial 199 finished with value: 0.8919170058579026 and parameters: {'activation': 'identity', 'solver': 'adam', 'lr': 1.8658335771147038e-05, 'layer1': 329, 'layer2': 408, 'layer3': 73}. Best is trial 153 with value: 0.8936680613721473.
Staphylococcus_Aureus | DirectMulti | Optuna: 100%|██████████| 200/200 [9:24:52<00:00, 175.52s/it, best=0.894]Staphylococcus_Aureus | DirectMulti | Optuna: 100%|██████████| 200/200 [9:24:52<00:00, 175.52s/it, best=0.894]                                                                                                              [Staphylococcus_Aureus | DirectMulti] [OPTUNA DONE] Best CV WF1=0.8937 | params={'activation': 'identity', 'solver': 'adam', 'lr': 2.7646086843997938e-05, 'layer1': 385, 'layer2': 421, 'layer3': 58}
[Staphylococcus_Aureus | DirectMulti] Retraining with validation early stopping (10% split)...
[Staphylococcus_Aureus | DirectMulti] Testing...
[Staphylococcus_Aureus | DirectMulti] [TEST] WF1=0.8878 | ACC=0.8965 | HL=0.1035 | best_val_WF1=0.9019

[END] Species: Staphylococcus_Aureus done.
[I 2026-03-05 10:00:54,972] Trial 68 finished with value: 0.8591521840369957 and parameters: {'activation': 'tanh', 'solver': 'adam', 'lr': 9.125303464123097e-05, 'layer1': 487, 'layer2': 458, 'layer3': 11}. Best is trial 14 with value: 0.8635368497386182.
Escherichia_Coli | DirectMulti | Optuna:  34%|███▍      | 69/200 [2:38:14<4:28:15, 122.87s/it, best=0.864]Escherichia_Coli | DirectMulti | Optuna:  34%|███▍      | 69/200 [2:38:14<4:28:15, 122.87s/it, best=0.864][I 2026-03-05 10:03:01,297] Trial 69 finished with value: 0.8619546062360985 and parameters: {'activation': 'relu', 'solver': 'adam', 'lr': 3.834178416537163e-05, 'layer1': 461, 'layer2': 413, 'layer3': 100}. Best is trial 14 with value: 0.8635368497386182.
Escherichia_Coli | DirectMulti | Optuna:  35%|███▌      | 70/200 [2:40:20<4:28:27, 123.90s/it, best=0.864]Escherichia_Coli | DirectMulti | Optuna:  35%|███▌      | 70/200 [2:40:20<4:28:27, 123.90s/it, best=0.864][I 2026-03-05 10:04:24,993] Trial 70 finished with value: 0.7408456866885468 and parameters: {'activation': 'tanh', 'solver': 'sgd', 'lr': 6.733609931746692e-05, 'layer1': 169, 'layer2': 391, 'layer3': 36}. Best is trial 14 with value: 0.8635368497386182.
Escherichia_Coli | DirectMulti | Optuna:  36%|███▌      | 71/200 [2:41:44<4:00:27, 111.84s/it, best=0.864]Escherichia_Coli | DirectMulti | Optuna:  36%|███▌      | 71/200 [2:41:44<4:00:27, 111.84s/it, best=0.864][I 2026-03-05 10:06:07,581] Trial 71 finished with value: 0.8628490045863092 and parameters: {'activation': 'tanh', 'solver': 'adam', 'lr': 5.064760127602434e-05, 'layer1': 444, 'layer2': 453, 'layer3': 70}. Best is trial 14 with value: 0.8635368497386182.
Escherichia_Coli | DirectMulti | Optuna:  36%|███▌      | 72/200 [2:43:27<3:52:40, 109.07s/it, best=0.864]Escherichia_Coli | DirectMulti | Optuna:  36%|███▌      | 72/200 [2:43:27<3:52:40, 109.07s/it, best=0.864][I 2026-03-05 10:08:40,002] Trial 72 finished with value: 0.8633472217398769 and parameters: {'activation': 'tanh', 'solver': 'adam', 'lr': 3.082692888725765e-05, 'layer1': 481, 'layer2': 481, 'layer3': 24}. Best is trial 14 with value: 0.8635368497386182.
Escherichia_Coli | DirectMulti | Optuna:  36%|███▋      | 73/200 [2:45:59<4:18:23, 122.07s/it, best=0.864]Escherichia_Coli | DirectMulti | Optuna:  36%|███▋      | 73/200 [2:45:59<4:18:23, 122.07s/it, best=0.864][I 2026-03-05 10:10:59,142] Trial 73 finished with value: 0.8637100680847147 and parameters: {'activation': 'tanh', 'solver': 'adam', 'lr': 3.3643573743747705e-05, 'layer1': 500, 'layer2': 477, 'layer3': 26}. Best is trial 73 with value: 0.8637100680847147.
Escherichia_Coli | DirectMulti | Optuna:  37%|███▋      | 74/200 [2:48:18<4:27:06, 127.19s/it, best=0.864]Escherichia_Coli | DirectMulti | Optuna:  37%|███▋      | 74/200 [2:48:18<4:27:06, 127.19s/it, best=0.864][I 2026-03-05 10:13:23,228] Trial 74 finished with value: 0.8631482855074749 and parameters: {'activation': 'tanh', 'solver': 'adam', 'lr': 3.176561049161867e-05, 'layer1': 475, 'layer2': 500, 'layer3': 30}. Best is trial 73 with value: 0.8637100680847147.
Escherichia_Coli | DirectMulti | Optuna:  38%|███▊      | 75/200 [2:50:42<4:35:32, 132.26s/it, best=0.864]Escherichia_Coli | DirectMulti | Optuna:  38%|███▊      | 75/200 [2:50:42<4:35:32, 132.26s/it, best=0.864][I 2026-03-05 10:15:20,905] Trial 75 finished with value: 0.8634620960483627 and parameters: {'activation': 'tanh', 'solver': 'adam', 'lr': 3.094913978563731e-05, 'layer1': 470, 'layer2': 498, 'layer3': 50}. Best is trial 73 with value: 0.8637100680847147.
Escherichia_Coli | DirectMulti | Optuna:  38%|███▊      | 76/200 [2:52:40<4:24:17, 127.89s/it, best=0.864]Escherichia_Coli | DirectMulti | Optuna:  38%|███▊      | 76/200 [2:52:40<4:24:17, 127.89s/it, best=0.864][I 2026-03-05 10:17:37,318] Trial 76 finished with value: 0.8613799118075189 and parameters: {'activation': 'relu', 'solver': 'adam', 'lr': 3.3971327087193766e-05, 'layer1': 470, 'layer2': 498, 'layer3': 28}. Best is trial 73 with value: 0.8637100680847147.
Escherichia_Coli | DirectMulti | Optuna:  38%|███▊      | 77/200 [2:54:56<4:27:24, 130.44s/it, best=0.864]Escherichia_Coli | DirectMulti | Optuna:  38%|███▊      | 77/200 [2:54:56<4:27:24, 130.44s/it, best=0.864][I 2026-03-05 10:19:40,323] Trial 77 finished with value: 0.8636211560752389 and parameters: {'activation': 'tanh', 'solver': 'adam', 'lr': 3.033268484437882e-05, 'layer1': 477, 'layer2': 476, 'layer3': 53}. Best is trial 73 with value: 0.8637100680847147.
Escherichia_Coli | DirectMulti | Optuna:  39%|███▉      | 78/200 [2:56:59<4:20:41, 128.21s/it, best=0.864]Escherichia_Coli | DirectMulti | Optuna:  39%|███▉      | 78/200 [2:56:59<4:20:41, 128.21s/it, best=0.864][I 2026-03-05 10:20:59,061] Trial 78 finished with value: 0.7388067228206201 and parameters: {'activation': 'logistic', 'solver': 'adam', 'lr': 1.644806510843097e-05, 'layer1': 490, 'layer2': 480, 'layer3': 53}. Best is trial 73 with value: 0.8637100680847147.
Escherichia_Coli | DirectMulti | Optuna:  40%|███▉      | 79/200 [2:58:18<3:48:37, 113.37s/it, best=0.864]Escherichia_Coli | DirectMulti | Optuna:  40%|███▉      | 79/200 [2:58:18<3:48:37, 113.37s/it, best=0.864][I 2026-03-05 10:22:47,170] Trial 79 finished with value: 0.8615959392297785 and parameters: {'activation': 'identity', 'solver': 'adam', 'lr': 2.8734373001253944e-05, 'layer1': 462, 'layer2': 474, 'layer3': 92}. Best is trial 73 with value: 0.8637100680847147.
Escherichia_Coli | DirectMulti | Optuna:  40%|████      | 80/200 [3:00:06<3:43:35, 111.79s/it, best=0.864]Escherichia_Coli | DirectMulti | Optuna:  40%|████      | 80/200 [3:00:06<3:43:35, 111.79s/it, best=0.864][I 2026-03-05 10:23:47,912] Trial 80 finished with value: 0.8610354937103238 and parameters: {'activation': 'tanh', 'solver': 'adam', 'lr': 0.00012438696823775585, 'layer1': 273, 'layer2': 468, 'layer3': 145}. Best is trial 73 with value: 0.8637100680847147.
Escherichia_Coli | DirectMulti | Optuna:  40%|████      | 81/200 [3:01:07<3:11:20, 96.48s/it, best=0.864] Escherichia_Coli | DirectMulti | Optuna:  40%|████      | 81/200 [3:01:07<3:11:20, 96.48s/it, best=0.864][I 2026-03-05 10:26:08,128] Trial 81 finished with value: 0.8622284228138521 and parameters: {'activation': 'tanh', 'solver': 'adam', 'lr': 3.889982178469739e-05, 'layer1': 467, 'layer2': 489, 'layer3': 15}. Best is trial 73 with value: 0.8637100680847147.
Escherichia_Coli | DirectMulti | Optuna:  41%|████      | 82/200 [3:03:27<3:35:32, 109.60s/it, best=0.864]Escherichia_Coli | DirectMulti | Optuna:  41%|████      | 82/200 [3:03:27<3:35:32, 109.60s/it, best=0.864][I 2026-03-05 10:28:07,326] Trial 82 finished with value: 0.8640917047043644 and parameters: {'activation': 'tanh', 'solver': 'adam', 'lr': 2.9462569539623068e-05, 'layer1': 479, 'layer2': 483, 'layer3': 60}. Best is trial 82 with value: 0.8640917047043644.
Escherichia_Coli | DirectMulti | Optuna:  42%|████▏     | 83/200 [3:05:26<3:39:19, 112.48s/it, best=0.864]Escherichia_Coli | DirectMulti | Optuna:  42%|████▏     | 83/200 [3:05:26<3:39:19, 112.48s/it, best=0.864][I 2026-03-05 10:30:51,276] Trial 83 finished with value: 0.8635844341539325 and parameters: {'activation': 'tanh', 'solver': 'adam', 'lr': 1.3806895076513384e-05, 'layer1': 430, 'layer2': 484, 'layer3': 54}. Best is trial 82 with value: 0.8640917047043644.
Escherichia_Coli | DirectMulti | Optuna:  42%|████▏     | 84/200 [3:08:10<4:07:18, 127.92s/it, best=0.864]Escherichia_Coli | DirectMulti | Optuna:  42%|████▏     | 84/200 [3:08:10<4:07:18, 127.92s/it, best=0.864][I 2026-03-05 10:33:38,209] Trial 84 finished with value: 0.8635397656629136 and parameters: {'activation': 'tanh', 'solver': 'adam', 'lr': 1.4785780427863337e-05, 'layer1': 429, 'layer2': 485, 'layer3': 56}. Best is trial 82 with value: 0.8640917047043644.
Escherichia_Coli | DirectMulti | Optuna:  42%|████▎     | 85/200 [3:10:57<4:27:36, 139.62s/it, best=0.864]Escherichia_Coli | DirectMulti | Optuna:  42%|████▎     | 85/200 [3:10:57<4:27:36, 139.62s/it, best=0.864][I 2026-03-05 10:36:30,497] Trial 85 finished with value: 0.8628491977011608 and parameters: {'activation': 'tanh', 'solver': 'adam', 'lr': 1.4121223409781457e-05, 'layer1': 439, 'layer2': 471, 'layer3': 52}. Best is trial 82 with value: 0.8640917047043644.
Escherichia_Coli | DirectMulti | Optuna:  43%|████▎     | 86/200 [3:13:50<4:43:54, 149.42s/it, best=0.864]Escherichia_Coli | DirectMulti | Optuna:  43%|████▎     | 86/200 [3:13:50<4:43:54, 149.42s/it, best=0.864][I 2026-03-05 10:45:08,712] Trial 86 finished with value: 0.7431660008894633 and parameters: {'activation': 'tanh', 'solver': 'sgd', 'lr': 7.747690449001945e-06, 'layer1': 424, 'layer2': 487, 'layer3': 114}. Best is trial 82 with value: 0.8640917047043644.
Escherichia_Coli | DirectMulti | Optuna:  44%|████▎     | 87/200 [3:22:28<8:09:46, 260.06s/it, best=0.864]Escherichia_Coli | DirectMulti | Optuna:  44%|████▎     | 87/200 [3:22:28<8:09:46, 260.06s/it, best=0.864][I 2026-03-05 10:47:35,827] Trial 87 finished with value: 0.8621460688176905 and parameters: {'activation': 'relu', 'solver': 'adam', 'lr': 2.0342228365867814e-05, 'layer1': 429, 'layer2': 463, 'layer3': 85}. Best is trial 82 with value: 0.8640917047043644.
Escherichia_Coli | DirectMulti | Optuna:  44%|████▍     | 88/200 [3:24:55<7:02:11, 226.18s/it, best=0.864]Escherichia_Coli | DirectMulti | Optuna:  44%|████▍     | 88/200 [3:24:55<7:02:11, 226.18s/it, best=0.864][I 2026-03-05 10:49:50,170] Trial 88 finished with value: 0.8636430360757409 and parameters: {'activation': 'tanh', 'solver': 'adam', 'lr': 1.62018774952638e-05, 'layer1': 401, 'layer2': 448, 'layer3': 59}. Best is trial 82 with value: 0.8640917047043644.
Escherichia_Coli | DirectMulti | Optuna:  44%|████▍     | 89/200 [3:27:09<6:07:27, 198.63s/it, best=0.864]Escherichia_Coli | DirectMulti | Optuna:  44%|████▍     | 89/200 [3:27:09<6:07:27, 198.63s/it, best=0.864][I 2026-03-05 10:52:59,786] Trial 89 finished with value: 0.8629721343094229 and parameters: {'activation': 'tanh', 'solver': 'adam', 'lr': 1.1225785051015416e-05, 'layer1': 405, 'layer2': 448, 'layer3': 52}. Best is trial 82 with value: 0.8640917047043644.
Escherichia_Coli | DirectMulti | Optuna:  45%|████▌     | 90/200 [3:30:19<5:59:11, 195.92s/it, best=0.864]Escherichia_Coli | DirectMulti | Optuna:  45%|████▌     | 90/200 [3:30:19<5:59:11, 195.92s/it, best=0.864][I 2026-03-05 10:55:19,805] Trial 90 finished with value: 0.862873530291291 and parameters: {'activation': 'tanh', 'solver': 'adam', 'lr': 1.4996279175728798e-05, 'layer1': 394, 'layer2': 431, 'layer3': 101}. Best is trial 82 with value: 0.8640917047043644.
Escherichia_Coli | DirectMulti | Optuna:  46%|████▌     | 91/200 [3:32:39<5:25:27, 179.15s/it, best=0.864]Escherichia_Coli | DirectMulti | Optuna:  46%|████▌     | 91/200 [3:32:39<5:25:27, 179.15s/it, best=0.864][I 2026-03-05 10:59:42,488] Trial 91 finished with value: 0.8626435303004205 and parameters: {'activation': 'tanh', 'solver': 'adam', 'lr': 6.829237147830623e-06, 'layer1': 456, 'layer2': 490, 'layer3': 57}. Best is trial 82 with value: 0.8640917047043644.
Escherichia_Coli | DirectMulti | Optuna:  46%|████▌     | 92/200 [3:37:02<6:07:34, 204.21s/it, best=0.864]Escherichia_Coli | DirectMulti | Optuna:  46%|████▌     | 92/200 [3:37:02<6:07:34, 204.21s/it, best=0.864][I 2026-03-05 11:01:38,227] Trial 92 finished with value: 0.8158793260259365 and parameters: {'activation': 'tanh', 'solver': 'adam', 'lr': 2.1105706249629053e-05, 'layer1': 446, 'layer2': 468, 'layer3': 18}. Best is trial 82 with value: 0.8640917047043644.
Escherichia_Coli | DirectMulti | Optuna:  46%|████▋     | 93/200 [3:38:57<5:16:50, 177.67s/it, best=0.864]Escherichia_Coli | DirectMulti | Optuna:  46%|████▋     | 93/200 [3:38:57<5:16:50, 177.67s/it, best=0.864][I 2026-03-05 11:05:06,597] Trial 93 finished with value: 0.8639195610298616 and parameters: {'activation': 'tanh', 'solver': 'adam', 'lr': 8.819438358106905e-06, 'layer1': 423, 'layer2': 444, 'layer3': 63}. Best is trial 82 with value: 0.8640917047043644.
Escherichia_Coli | DirectMulti | Optuna:  47%|████▋     | 94/200 [3:42:26<5:30:09, 186.88s/it, best=0.864]Escherichia_Coli | DirectMulti | Optuna:  47%|████▋     | 94/200 [3:42:26<5:30:09, 186.88s/it, best=0.864][I 2026-03-05 11:07:09,193] Trial 94 finished with value: 0.8626932614433176 and parameters: {'activation': 'tanh', 'solver': 'adam', 'lr': 2.574254966436025e-05, 'layer1': 418, 'layer2': 422, 'layer3': 63}. Best is trial 82 with value: 0.8640917047043644.
Escherichia_Coli | DirectMulti | Optuna:  48%|████▊     | 95/200 [3:44:28<4:53:17, 167.59s/it, best=0.864]Escherichia_Coli | DirectMulti | Optuna:  48%|████▊     | 95/200 [3:44:28<4:53:17, 167.59s/it, best=0.864][I 2026-03-05 11:09:08,047] Trial 95 finished with value: 0.763318547911196 and parameters: {'activation': 'tanh', 'solver': 'adam', 'lr': 4.363415123932671e-06, 'layer1': 469, 'layer2': 445, 'layer3': 87}. Best is trial 82 with value: 0.8640917047043644.
Escherichia_Coli | DirectMulti | Optuna:  48%|████▊     | 96/200 [3:46:27<4:25:09, 152.97s/it, best=0.864]Escherichia_Coli | DirectMulti | Optuna:  48%|████▊     | 96/200 [3:46:27<4:25:09, 152.97s/it, best=0.864][I 2026-03-05 11:11:36,626] Trial 96 finished with value: 0.8632015577945529 and parameters: {'activation': 'tanh', 'solver': 'adam', 'lr': 1.5828275975516526e-05, 'layer1': 320, 'layer2': 453, 'layer3': 39}. Best is trial 82 with value: 0.8640917047043644.
Escherichia_Coli | DirectMulti | Optuna:  48%|████▊     | 97/200 [3:48:56<4:20:20, 151.65s/it, best=0.864]Escherichia_Coli | DirectMulti | Optuna:  48%|████▊     | 97/200 [3:48:56<4:20:20, 151.65s/it, best=0.864][I 2026-03-05 11:16:09,927] Trial 97 finished with value: 0.8627817901573567 and parameters: {'activation': 'relu', 'solver': 'adam', 'lr': 1.0143407360311012e-05, 'layer1': 491, 'layer2': 485, 'layer3': 46}. Best is trial 82 with value: 0.8640917047043644.
Escherichia_Coli | DirectMulti | Optuna:  49%|████▉     | 98/200 [3:53:29<5:19:51, 188.15s/it, best=0.864]Escherichia_Coli | DirectMulti | Optuna:  49%|████▉     | 98/200 [3:53:29<5:19:51, 188.15s/it, best=0.864][I 2026-03-05 11:18:12,338] Trial 98 finished with value: 0.8619142956979328 and parameters: {'activation': 'identity', 'solver': 'adam', 'lr': 1.9936923594451238e-05, 'layer1': 434, 'layer2': 462, 'layer3': 109}. Best is trial 82 with value: 0.8640917047043644.
Escherichia_Coli | DirectMulti | Optuna:  50%|████▉     | 99/200 [3:55:31<4:43:31, 168.43s/it, best=0.864]Escherichia_Coli | DirectMulti | Optuna:  50%|████▉     | 99/200 [3:55:31<4:43:31, 168.43s/it, best=0.864][I 2026-03-05 11:19:33,510] Trial 99 finished with value: 0.6520561134783864 and parameters: {'activation': 'logistic', 'solver': 'adam', 'lr': 6.432050342368687e-06, 'layer1': 385, 'layer2': 439, 'layer3': 11}. Best is trial 82 with value: 0.8640917047043644.
Escherichia_Coli | DirectMulti | Optuna:  50%|█████     | 100/200 [3:56:53<3:57:05, 142.25s/it, best=0.864]Escherichia_Coli | DirectMulti | Optuna:  50%|█████     | 100/200 [3:56:53<3:57:05, 142.25s/it, best=0.864][I 2026-03-05 11:21:09,744] Trial 100 finished with value: 0.7428440160065797 and parameters: {'activation': 'tanh', 'solver': 'sgd', 'lr': 4.147048306220622e-05, 'layer1': 207, 'layer2': 500, 'layer3': 79}. Best is trial 82 with value: 0.8640917047043644.
