Klebsiella_Pneumoniae | DirectMulti | Optuna:  49%|████▉     | 98/200 [2:12:59<2:05:25, 73.78s/it, best=0.932]Klebsiella_Pneumoniae | DirectMulti | Optuna:  49%|████▉     | 98/200 [2:12:59<2:05:25, 73.78s/it, best=0.932][I 2026-03-05 02:14:30,416] Trial 92 finished with value: 0.8641472583163976 and parameters: {'activation': 'relu', 'solver': 'adam', 'lr': 0.003371783247008813, 'layer1': 464, 'layer2': 353, 'layer3': 335}. Best is trial 71 with value: 0.8659155749694897.
Pseudomonas_Aeruginosa | DirectMulti | Optuna:  46%|████▋     | 93/200 [2:20:24<2:59:09, 100.46s/it, best=0.866]Pseudomonas_Aeruginosa | DirectMulti | Optuna:  46%|████▋     | 93/200 [2:20:24<2:59:09, 100.46s/it, best=0.866][I 2026-03-05 02:14:46,393] Trial 121 finished with value: 0.8609442203492292 and parameters: {'activation': 'tanh', 'solver': 'adam', 'lr': 6.675335295787413e-05, 'layer1': 481, 'layer2': 32, 'layer3': 267}. Best is trial 73 with value: 0.864893646817533.
Escherichia_Coli | LPS | Optuna:  61%|██████    | 122/200 [6:16:28<3:40:10, 169.37s/it, best=0.865]Escherichia_Coli | LPS | Optuna:  61%|██████    | 122/200 [6:16:28<3:40:10, 169.37s/it, best=0.865][I 2026-03-05 02:15:33,151] Trial 98 finished with value: 0.9298145406771896 and parameters: {'activation': 'tanh', 'solver': 'adam', 'lr': 0.00015328994304025375, 'layer1': 168, 'layer2': 143, 'layer3': 454}. Best is trial 55 with value: 0.9322110061695005.
Klebsiella_Pneumoniae | DirectMulti | Optuna:  50%|████▉     | 99/200 [2:14:05<2:00:05, 71.34s/it, best=0.932]Klebsiella_Pneumoniae | DirectMulti | Optuna:  50%|████▉     | 99/200 [2:14:05<2:00:05, 71.34s/it, best=0.932][I 2026-03-05 02:15:59,827] Trial 51 finished with value: 0.8912283688381472 and parameters: {'activation': 'identity', 'solver': 'adam', 'lr': 5.890828822345339e-05, 'layer1': 233, 'layer2': 492, 'layer3': 46}. Best is trial 49 with value: 0.8919989571847162.
Staphylococcus_Aureus | DirectMulti | Optuna:  26%|██▌       | 52/200 [1:41:17<4:43:47, 115.05s/it, best=0.892]Staphylococcus_Aureus | DirectMulti | Optuna:  26%|██▌       | 52/200 [1:41:17<4:43:47, 115.05s/it, best=0.892][I 2026-03-05 02:16:22,654] Trial 93 finished with value: 0.8627741627377612 and parameters: {'activation': 'relu', 'solver': 'adam', 'lr': 0.001668563578680811, 'layer1': 463, 'layer2': 354, 'layer3': 333}. Best is trial 71 with value: 0.8659155749694897.
Pseudomonas_Aeruginosa | DirectMulti | Optuna:  47%|████▋     | 94/200 [2:22:16<3:03:43, 103.99s/it, best=0.866]Pseudomonas_Aeruginosa | DirectMulti | Optuna:  47%|████▋     | 94/200 [2:22:16<3:03:43, 103.99s/it, best=0.866][I 2026-03-05 02:16:42,647] Trial 99 finished with value: 0.9295236940521384 and parameters: {'activation': 'tanh', 'solver': 'adam', 'lr': 0.0003638162640604088, 'layer1': 246, 'layer2': 122, 'layer3': 470}. Best is trial 55 with value: 0.9322110061695005.
Klebsiella_Pneumoniae | DirectMulti | Optuna:  50%|█████     | 100/200 [2:15:14<1:57:58, 70.79s/it, best=0.932]Klebsiella_Pneumoniae | DirectMulti | Optuna:  50%|█████     | 100/200 [2:15:14<1:57:58, 70.79s/it, best=0.932][I 2026-03-05 02:17:33,469] Trial 100 finished with value: 0.8746470562584285 and parameters: {'activation': 'logistic', 'solver': 'sgd', 'lr': 0.0001269091314981246, 'layer1': 207, 'layer2': 159, 'layer3': 486}. Best is trial 55 with value: 0.9322110061695005.
Klebsiella_Pneumoniae | DirectMulti | Optuna:  50%|█████     | 101/200 [2:16:05<1:46:55, 64.80s/it, best=0.932]Klebsiella_Pneumoniae | DirectMulti | Optuna:  50%|█████     | 101/200 [2:16:05<1:46:55, 64.80s/it, best=0.932][I 2026-03-05 02:17:47,474] Trial 122 finished with value: 0.8619148750862724 and parameters: {'activation': 'tanh', 'solver': 'adam', 'lr': 4.303000723627309e-05, 'layer1': 442, 'layer2': 36, 'layer3': 383}. Best is trial 73 with value: 0.864893646817533.
Escherichia_Coli | LPS | Optuna:  62%|██████▏   | 123/200 [6:19:29<3:41:51, 172.88s/it, best=0.865]Escherichia_Coli | LPS | Optuna:  62%|██████▏   | 123/200 [6:19:29<3:41:51, 172.88s/it, best=0.865][I 2026-03-05 02:17:47,885] Trial 52 finished with value: 0.8915295795769772 and parameters: {'activation': 'identity', 'solver': 'adam', 'lr': 6.230347061455932e-05, 'layer1': 277, 'layer2': 497, 'layer3': 45}. Best is trial 49 with value: 0.8919989571847162.
Staphylococcus_Aureus | DirectMulti | Optuna:  26%|██▋       | 53/200 [1:43:05<4:36:44, 112.95s/it, best=0.892]Staphylococcus_Aureus | DirectMulti | Optuna:  26%|██▋       | 53/200 [1:43:05<4:36:44, 112.95s/it, best=0.892][I 2026-03-05 02:17:58,125] Trial 94 finished with value: 0.860267916211293 and parameters: {'activation': 'relu', 'solver': 'adam', 'lr': 0.0017048562652486633, 'layer1': 465, 'layer2': 358, 'layer3': 332}. Best is trial 71 with value: 0.8659155749694897.
Pseudomonas_Aeruginosa | DirectMulti | Optuna:  48%|████▊     | 95/200 [2:23:52<2:57:30, 101.44s/it, best=0.866]Pseudomonas_Aeruginosa | DirectMulti | Optuna:  48%|████▊     | 95/200 [2:23:52<2:57:30, 101.44s/it, best=0.866][I 2026-03-05 02:19:18,356] Trial 101 finished with value: 0.931416168846607 and parameters: {'activation': 'tanh', 'solver': 'adam', 'lr': 3.9486509744410515e-05, 'layer1': 56, 'layer2': 201, 'layer3': 426}. Best is trial 55 with value: 0.9322110061695005.
Klebsiella_Pneumoniae | DirectMulti | Optuna:  51%|█████     | 102/200 [2:17:50<2:05:28, 76.83s/it, best=0.932]Klebsiella_Pneumoniae | DirectMulti | Optuna:  51%|█████     | 102/200 [2:17:50<2:05:28, 76.83s/it, best=0.932][I 2026-03-05 02:19:40,750] Trial 95 finished with value: 0.8583749163054012 and parameters: {'activation': 'relu', 'solver': 'adam', 'lr': 0.0010220937698842865, 'layer1': 422, 'layer2': 364, 'layer3': 312}. Best is trial 71 with value: 0.8659155749694897.
Pseudomonas_Aeruginosa | DirectMulti | Optuna:  48%|████▊     | 96/200 [2:25:34<2:56:26, 101.79s/it, best=0.866]Pseudomonas_Aeruginosa | DirectMulti | Optuna:  48%|████▊     | 96/200 [2:25:34<2:56:26, 101.79s/it, best=0.866][I 2026-03-05 02:20:20,924] Trial 123 finished with value: 0.8607548878005188 and parameters: {'activation': 'tanh', 'solver': 'adam', 'lr': 7.67847468386963e-05, 'layer1': 455, 'layer2': 55, 'layer3': 337}. Best is trial 73 with value: 0.864893646817533.
Escherichia_Coli | LPS | Optuna:  62%|██████▏   | 124/200 [6:22:03<3:31:35, 167.05s/it, best=0.865]Escherichia_Coli | LPS | Optuna:  62%|██████▏   | 124/200 [6:22:03<3:31:35, 167.05s/it, best=0.865][I 2026-03-05 02:20:49,487] Trial 102 finished with value: 0.9317636743691985 and parameters: {'activation': 'tanh', 'solver': 'adam', 'lr': 4.268129843575598e-05, 'layer1': 52, 'layer2': 196, 'layer3': 425}. Best is trial 55 with value: 0.9322110061695005.
Klebsiella_Pneumoniae | DirectMulti | Optuna:  52%|█████▏    | 103/200 [2:19:21<2:11:08, 81.12s/it, best=0.932]Klebsiella_Pneumoniae | DirectMulti | Optuna:  52%|█████▏    | 103/200 [2:19:21<2:11:08, 81.12s/it, best=0.932][I 2026-03-05 02:21:22,891] Trial 96 finished with value: 0.863725278819677 and parameters: {'activation': 'relu', 'solver': 'adam', 'lr': 0.003059367573829801, 'layer1': 458, 'layer2': 395, 'layer3': 336}. Best is trial 71 with value: 0.8659155749694897.
Pseudomonas_Aeruginosa | DirectMulti | Optuna:  48%|████▊     | 97/200 [2:27:16<2:54:55, 101.90s/it, best=0.866]Pseudomonas_Aeruginosa | DirectMulti | Optuna:  48%|████▊     | 97/200 [2:27:16<2:54:55, 101.90s/it, best=0.866][I 2026-03-05 02:21:50,199] Trial 53 finished with value: 0.8904373452515637 and parameters: {'activation': 'identity', 'solver': 'adam', 'lr': 2.3392657550127834e-05, 'layer1': 346, 'layer2': 494, 'layer3': 11}. Best is trial 49 with value: 0.8919989571847162.
Staphylococcus_Aureus | DirectMulti | Optuna:  27%|██▋       | 54/200 [1:47:07<6:09:17, 151.76s/it, best=0.892]Staphylococcus_Aureus | DirectMulti | Optuna:  27%|██▋       | 54/200 [1:47:07<6:09:17, 151.76s/it, best=0.892][I 2026-03-05 02:21:55,069] Trial 103 finished with value: 0.9310004972389934 and parameters: {'activation': 'tanh', 'solver': 'adam', 'lr': 7.714074128948631e-05, 'layer1': 50, 'layer2': 206, 'layer3': 447}. Best is trial 55 with value: 0.9322110061695005.
Klebsiella_Pneumoniae | DirectMulti | Optuna:  52%|█████▏    | 104/200 [2:20:27<2:02:19, 76.46s/it, best=0.932]Klebsiella_Pneumoniae | DirectMulti | Optuna:  52%|█████▏    | 104/200 [2:20:27<2:02:19, 76.46s/it, best=0.932][I 2026-03-05 02:22:37,583] Trial 97 finished with value: 0.8558986106354098 and parameters: {'activation': 'identity', 'solver': 'adam', 'lr': 0.000733837374602033, 'layer1': 434, 'layer2': 387, 'layer3': 348}. Best is trial 71 with value: 0.8659155749694897.
Pseudomonas_Aeruginosa | DirectMulti | Optuna:  49%|████▉     | 98/200 [2:28:31<2:39:21, 93.74s/it, best=0.866] Pseudomonas_Aeruginosa | DirectMulti | Optuna:  49%|████▉     | 98/200 [2:28:31<2:39:21, 93.74s/it, best=0.866][I 2026-03-05 02:23:22,743] Trial 104 finished with value: 0.9310115821713673 and parameters: {'activation': 'tanh', 'solver': 'adam', 'lr': 3.971143580465237e-05, 'layer1': 89, 'layer2': 196, 'layer3': 429}. Best is trial 55 with value: 0.9322110061695005.
Klebsiella_Pneumoniae | DirectMulti | Optuna:  52%|█████▎    | 105/200 [2:21:54<2:06:23, 79.82s/it, best=0.932]Klebsiella_Pneumoniae | DirectMulti | Optuna:  52%|█████▎    | 105/200 [2:21:54<2:06:23, 79.82s/it, best=0.932][I 2026-03-05 02:23:23,487] Trial 124 finished with value: 0.861146887078022 and parameters: {'activation': 'tanh', 'solver': 'adam', 'lr': 5.3682664734653625e-05, 'layer1': 485, 'layer2': 67, 'layer3': 417}. Best is trial 73 with value: 0.864893646817533.
Escherichia_Coli | LPS | Optuna:  62%|██████▎   | 125/200 [6:25:05<3:34:37, 171.70s/it, best=0.865]Escherichia_Coli | LPS | Optuna:  62%|██████▎   | 125/200 [6:25:05<3:34:37, 171.70s/it, best=0.865][I 2026-03-05 02:23:51,724] Trial 54 finished with value: 0.8909025123205394 and parameters: {'activation': 'identity', 'solver': 'adam', 'lr': 6.159805414535612e-05, 'layer1': 289, 'layer2': 455, 'layer3': 43}. Best is trial 49 with value: 0.8919989571847162.
Staphylococcus_Aureus | DirectMulti | Optuna:  28%|██▊       | 55/200 [1:49:09<5:44:50, 142.69s/it, best=0.892]Staphylococcus_Aureus | DirectMulti | Optuna:  28%|██▊       | 55/200 [1:49:09<5:44:50, 142.69s/it, best=0.892][I 2026-03-05 02:24:22,639] Trial 105 finished with value: 0.9310868929237195 and parameters: {'activation': 'tanh', 'solver': 'adam', 'lr': 9.390257717898958e-05, 'layer1': 57, 'layer2': 225, 'layer3': 405}. Best is trial 55 with value: 0.9322110061695005.
Klebsiella_Pneumoniae | DirectMulti | Optuna:  53%|█████▎    | 106/200 [2:22:54<1:55:41, 73.84s/it, best=0.932]Klebsiella_Pneumoniae | DirectMulti | Optuna:  53%|█████▎    | 106/200 [2:22:54<1:55:41, 73.84s/it, best=0.932][I 2026-03-05 02:24:24,423] Trial 98 finished with value: 0.862299844762066 and parameters: {'activation': 'relu', 'solver': 'adam', 'lr': 0.0029301563662388064, 'layer1': 396, 'layer2': 401, 'layer3': 273}. Best is trial 71 with value: 0.8659155749694897.
Pseudomonas_Aeruginosa | DirectMulti | Optuna:  50%|████▉     | 99/200 [2:30:18<2:44:24, 97.67s/it, best=0.866]Pseudomonas_Aeruginosa | DirectMulti | Optuna:  50%|████▉     | 99/200 [2:30:18<2:44:24, 97.67s/it, best=0.866][I 2026-03-05 02:25:20,983] Trial 99 finished with value: 0.8261898244308833 and parameters: {'activation': 'relu', 'solver': 'sgd', 'lr': 0.0021280113562610315, 'layer1': 475, 'layer2': 436, 'layer3': 369}. Best is trial 71 with value: 0.8659155749694897.
Pseudomonas_Aeruginosa | DirectMulti | Optuna:  50%|█████     | 100/200 [2:31:15<2:22:13, 85.34s/it, best=0.866]Pseudomonas_Aeruginosa | DirectMulti | Optuna:  50%|█████     | 100/200 [2:31:15<2:22:13, 85.34s/it, best=0.866][I 2026-03-05 02:26:08,824] Trial 106 finished with value: 0.9299199857347386 and parameters: {'activation': 'tanh', 'solver': 'adam', 'lr': 6.444427983980329e-05, 'layer1': 294, 'layer2': 252, 'layer3': 477}. Best is trial 55 with value: 0.9322110061695005.
Klebsiella_Pneumoniae | DirectMulti | Optuna:  54%|█████▎    | 107/200 [2:24:40<2:09:29, 83.55s/it, best=0.932]Klebsiella_Pneumoniae | DirectMulti | Optuna:  54%|█████▎    | 107/200 [2:24:40<2:09:29, 83.55s/it, best=0.932][I 2026-03-05 02:26:30,359] Trial 55 finished with value: 0.8925301599746895 and parameters: {'activation': 'identity', 'solver': 'adam', 'lr': 4.251729366741687e-05, 'layer1': 269, 'layer2': 417, 'layer3': 28}. Best is trial 55 with value: 0.8925301599746895.
Staphylococcus_Aureus | DirectMulti | Optuna:  28%|██▊       | 56/200 [1:51:47<5:53:56, 147.47s/it, best=0.892]Staphylococcus_Aureus | DirectMulti | Optuna:  28%|██▊       | 56/200 [1:51:47<5:53:56, 147.47s/it, best=0.892][I 2026-03-05 02:27:00,612] Trial 100 finished with value: 0.8578581184149868 and parameters: {'activation': 'relu', 'solver': 'adam', 'lr': 0.0033717761399631556, 'layer1': 411, 'layer2': 334, 'layer3': 290}. Best is trial 71 with value: 0.8659155749694897.
Pseudomonas_Aeruginosa | DirectMulti | Optuna:  50%|█████     | 101/200 [2:32:54<2:27:52, 89.62s/it, best=0.866]Pseudomonas_Aeruginosa | DirectMulti | Optuna:  50%|█████     | 101/200 [2:32:54<2:27:52, 89.62s/it, best=0.866][I 2026-03-05 02:27:47,241] Trial 107 finished with value: 0.9313029674322013 and parameters: {'activation': 'tanh', 'solver': 'adam', 'lr': 4.3583164614844745e-05, 'layer1': 27, 'layer2': 90, 'layer3': 460}. Best is trial 55 with value: 0.9322110061695005.
Klebsiella_Pneumoniae | DirectMulti | Optuna:  54%|█████▍    | 108/200 [2:26:19<2:14:56, 88.01s/it, best=0.932]Klebsiella_Pneumoniae | DirectMulti | Optuna:  54%|█████▍    | 108/200 [2:26:19<2:14:56, 88.01s/it, best=0.932][I 2026-03-05 02:28:43,530] Trial 108 finished with value: 0.927754194496955 and parameters: {'activation': 'relu', 'solver': 'adam', 'lr': 0.005724899948442512, 'layer1': 73, 'layer2': 200, 'layer3': 375}. Best is trial 55 with value: 0.9322110061695005.
Klebsiella_Pneumoniae | DirectMulti | Optuna:  55%|█████▍    | 109/200 [2:27:15<1:59:02, 78.49s/it, best=0.932]Klebsiella_Pneumoniae | DirectMulti | Optuna:  55%|█████▍    | 109/200 [2:27:15<1:59:02, 78.49s/it, best=0.932][I 2026-03-05 02:28:50,082] Trial 125 finished with value: 0.862360075166411 and parameters: {'activation': 'tanh', 'solver': 'adam', 'lr': 1.6540570142419168e-05, 'layer1': 453, 'layer2': 21, 'layer3': 334}. Best is trial 73 with value: 0.864893646817533.
Escherichia_Coli | LPS | Optuna:  63%|██████▎   | 126/200 [6:30:32<4:29:04, 218.17s/it, best=0.865]Escherichia_Coli | LPS | Optuna:  63%|██████▎   | 126/200 [6:30:32<4:29:04, 218.17s/it, best=0.865][I 2026-03-05 02:28:56,060] Trial 101 finished with value: 0.8643735812316592 and parameters: {'activation': 'relu', 'solver': 'adam', 'lr': 0.0026215159545190806, 'layer1': 456, 'layer2': 453, 'layer3': 335}. Best is trial 71 with value: 0.8659155749694897.
Pseudomonas_Aeruginosa | DirectMulti | Optuna:  51%|█████     | 102/200 [2:34:50<2:39:02, 97.37s/it, best=0.866]Pseudomonas_Aeruginosa | DirectMulti | Optuna:  51%|█████     | 102/200 [2:34:50<2:39:02, 97.37s/it, best=0.866][I 2026-03-05 02:29:00,096] Trial 56 finished with value: 0.891626220511521 and parameters: {'activation': 'identity', 'solver': 'adam', 'lr': 3.312192326553251e-05, 'layer1': 272, 'layer2': 408, 'layer3': 64}. Best is trial 55 with value: 0.8925301599746895.
Staphylococcus_Aureus | DirectMulti | Optuna:  28%|██▊       | 57/200 [1:54:17<5:53:05, 148.15s/it, best=0.892]Staphylococcus_Aureus | DirectMulti | Optuna:  28%|██▊       | 57/200 [1:54:17<5:53:05, 148.15s/it, best=0.892][I 2026-03-05 02:29:52,729] Trial 109 finished with value: 0.9297303037961806 and parameters: {'activation': 'identity', 'solver': 'adam', 'lr': 0.00020840302058311585, 'layer1': 258, 'layer2': 187, 'layer3': 441}. Best is trial 55 with value: 0.9322110061695005.
Klebsiella_Pneumoniae | DirectMulti | Optuna:  55%|█████▌    | 110/200 [2:28:24<1:53:33, 75.70s/it, best=0.932]Klebsiella_Pneumoniae | DirectMulti | Optuna:  55%|█████▌    | 110/200 [2:28:24<1:53:33, 75.70s/it, best=0.932][I 2026-03-05 02:30:30,124] Trial 110 finished with value: 0.8746470562584285 and parameters: {'activation': 'tanh', 'solver': 'adam', 'lr': 1.7873074067701276e-05, 'layer1': 106, 'layer2': 163, 'layer3': 388}. Best is trial 55 with value: 0.9322110061695005.
Klebsiella_Pneumoniae | DirectMulti | Optuna:  56%|█████▌    | 111/200 [2:29:02<1:35:14, 64.21s/it, best=0.932]Klebsiella_Pneumoniae | DirectMulti | Optuna:  56%|█████▌    | 111/200 [2:29:02<1:35:14, 64.21s/it, best=0.932][I 2026-03-05 02:30:49,600] Trial 102 finished with value: 0.8632013608473773 and parameters: {'activation': 'relu', 'solver': 'adam', 'lr': 0.0038210647968639675, 'layer1': 454, 'layer2': 484, 'layer3': 320}. Best is trial 71 with value: 0.8659155749694897.
Pseudomonas_Aeruginosa | DirectMulti | Optuna:  52%|█████▏    | 103/200 [2:36:43<2:45:15, 102.22s/it, best=0.866]Pseudomonas_Aeruginosa | DirectMulti | Optuna:  52%|█████▏    | 103/200 [2:36:43<2:45:15, 102.22s/it, best=0.866][I 2026-03-05 02:32:04,833] Trial 111 finished with value: 0.9310622026162438 and parameters: {'activation': 'tanh', 'solver': 'adam', 'lr': 5.3297559287173596e-05, 'layer1': 57, 'layer2': 137, 'layer3': 428}. Best is trial 55 with value: 0.9322110061695005.
Klebsiella_Pneumoniae | DirectMulti | Optuna:  56%|█████▌    | 112/200 [2:30:36<1:47:35, 73.36s/it, best=0.932]Klebsiella_Pneumoniae | DirectMulti | Optuna:  56%|█████▌    | 112/200 [2:30:36<1:47:35, 73.36s/it, best=0.932][I 2026-03-05 02:32:33,873] Trial 103 finished with value: 0.8634472292192934 and parameters: {'activation': 'relu', 'solver': 'adam', 'lr': 0.0013825674474931373, 'layer1': 456, 'layer2': 468, 'layer3': 322}. Best is trial 71 with value: 0.8659155749694897.
Pseudomonas_Aeruginosa | DirectMulti | Optuna:  52%|█████▏    | 104/200 [2:38:27<2:44:32, 102.84s/it, best=0.866]Pseudomonas_Aeruginosa | DirectMulti | Optuna:  52%|█████▏    | 104/200 [2:38:27<2:44:32, 102.84s/it, best=0.866][I 2026-03-05 02:33:50,809] Trial 112 finished with value: 0.930466631647997 and parameters: {'activation': 'tanh', 'solver': 'adam', 'lr': 3.7018887085269164e-05, 'layer1': 156, 'layer2': 131, 'layer3': 419}. Best is trial 55 with value: 0.9322110061695005.
Klebsiella_Pneumoniae | DirectMulti | Optuna:  56%|█████▋    | 113/200 [2:32:22<2:00:33, 83.15s/it, best=0.932]Klebsiella_Pneumoniae | DirectMulti | Optuna:  56%|█████▋    | 113/200 [2:32:22<2:00:33, 83.15s/it, best=0.932][I 2026-03-05 02:34:01,149] Trial 126 finished with value: 0.8616946737028026 and parameters: {'activation': 'relu', 'solver': 'adam', 'lr': 2.2021867019635724e-05, 'layer1': 432, 'layer2': 10, 'layer3': 373}. Best is trial 73 with value: 0.864893646817533.
Escherichia_Coli | LPS | Optuna:  64%|██████▎   | 127/200 [6:35:43<4:59:20, 246.04s/it, best=0.865]Escherichia_Coli | LPS | Optuna:  64%|██████▎   | 127/200 [6:35:43<4:59:20, 246.04s/it, best=0.865][I 2026-03-05 02:34:14,134] Trial 104 finished with value: 0.8558467275884218 and parameters: {'activation': 'relu', 'solver': 'adam', 'lr': 0.002568078577154864, 'layer1': 423, 'layer2': 462, 'layer3': 342}. Best is trial 71 with value: 0.8659155749694897.
Pseudomonas_Aeruginosa | DirectMulti | Optuna:  52%|█████▎    | 105/200 [2:40:08<2:41:36, 102.06s/it, best=0.866]Pseudomonas_Aeruginosa | DirectMulti | Optuna:  52%|█████▎    | 105/200 [2:40:08<2:41:36, 102.06s/it, best=0.866][I 2026-03-05 02:34:19,601] Trial 57 finished with value: 0.8916810097950856 and parameters: {'activation': 'identity', 'solver': 'adam', 'lr': 1.3321514295441139e-05, 'layer1': 273, 'layer2': 410, 'layer3': 26}. Best is trial 55 with value: 0.8925301599746895.
Staphylococcus_Aureus | DirectMulti | Optuna:  29%|██▉       | 58/200 [1:59:37<7:52:17, 199.56s/it, best=0.892]Staphylococcus_Aureus | DirectMulti | Optuna:  29%|██▉       | 58/200 [1:59:37<7:52:17, 199.56s/it, best=0.892][I 2026-03-05 02:34:59,553] Trial 113 finished with value: 0.9310074807052725 and parameters: {'activation': 'tanh', 'solver': 'adam', 'lr': 0.00011527827939556211, 'layer1': 82, 'layer2': 241, 'layer3': 453}. Best is trial 55 with value: 0.9322110061695005.
Klebsiella_Pneumoniae | DirectMulti | Optuna:  57%|█████▋    | 114/200 [2:33:31<1:52:58, 78.82s/it, best=0.932]Klebsiella_Pneumoniae | DirectMulti | Optuna:  57%|█████▋    | 114/200 [2:33:31<1:52:58, 78.82s/it, best=0.932][I 2026-03-05 02:35:54,260] Trial 105 finished with value: 0.8582460104641079 and parameters: {'activation': 'relu', 'solver': 'adam', 'lr': 0.0012376633770175539, 'layer1': 490, 'layer2': 454, 'layer3': 294}. Best is trial 71 with value: 0.8659155749694897.
Pseudomonas_Aeruginosa | DirectMulti | Optuna:  53%|█████▎    | 106/200 [2:41:48<2:38:59, 101.48s/it, best=0.866]Pseudomonas_Aeruginosa | DirectMulti | Optuna:  53%|█████▎    | 106/200 [2:41:48<2:38:59, 101.48s/it, best=0.866][I 2026-03-05 02:37:18,593] Trial 114 finished with value: 0.9305817925731326 and parameters: {'activation': 'tanh', 'solver': 'adam', 'lr': 7.828448081615884e-05, 'layer1': 463, 'layer2': 111, 'layer3': 401}. Best is trial 55 with value: 0.9322110061695005.
Klebsiella_Pneumoniae | DirectMulti | Optuna:  57%|█████▊    | 115/200 [2:35:50<2:17:15, 96.89s/it, best=0.932]Klebsiella_Pneumoniae | DirectMulti | Optuna:  57%|█████▊    | 115/200 [2:35:50<2:17:15, 96.89s/it, best=0.932][I 2026-03-05 02:37:24,318] Trial 127 finished with value: 0.8618780862911997 and parameters: {'activation': 'tanh', 'solver': 'adam', 'lr': 3.7520332005995484e-05, 'layer1': 419, 'layer2': 46, 'layer3': 393}. Best is trial 73 with value: 0.864893646817533.
