Escherichia_Coli | LPS | Optuna:  85%|████████▌ | 170/200 [9:42:55<1:39:59, 199.98s/it, best=0.865]Escherichia_Coli | LPS | Optuna:  85%|████████▌ | 170/200 [9:42:55<1:39:59, 199.98s/it, best=0.865][I 2026-03-05 05:41:25,305] Trial 105 finished with value: 0.8365411048380237 and parameters: {'activation': 'tanh', 'solver': 'adam', 'lr': 3.05129386162982e-05, 'layer1': 287, 'layer2': 433, 'layer3': 10}. Best is trial 102 with value: 0.8935277328516141.
Staphylococcus_Aureus | DirectMulti | Optuna:  53%|█████▎    | 106/200 [5:06:42<4:19:25, 165.59s/it, best=0.893]Staphylococcus_Aureus | DirectMulti | Optuna:  53%|█████▎    | 106/200 [5:06:42<4:19:25, 165.59s/it, best=0.893][I 2026-03-05 05:42:45,748] Trial 170 finished with value: 0.6407858027931721 and parameters: {'activation': 'relu', 'solver': 'sgd', 'lr': 1.7424100284942668e-05, 'layer1': 488, 'layer2': 63, 'layer3': 470}. Best is trial 169 with value: 0.8650159865951903.
Escherichia_Coli | LPS | Optuna:  86%|████████▌ | 171/200 [9:44:27<1:21:00, 167.59s/it, best=0.865]Escherichia_Coli | LPS | Optuna:  86%|████████▌ | 171/200 [9:44:27<1:21:00, 167.59s/it, best=0.865][I 2026-03-05 05:45:10,929] Trial 106 finished with value: 0.8923241971976961 and parameters: {'activation': 'identity', 'solver': 'adam', 'lr': 1.6156520059053482e-05, 'layer1': 303, 'layer2': 404, 'layer3': 32}. Best is trial 102 with value: 0.8935277328516141.
Staphylococcus_Aureus | DirectMulti | Optuna:  54%|█████▎    | 107/200 [5:10:28<4:44:34, 183.60s/it, best=0.893]Staphylococcus_Aureus | DirectMulti | Optuna:  54%|█████▎    | 107/200 [5:10:28<4:44:34, 183.60s/it, best=0.893][I 2026-03-05 05:46:35,636] Trial 171 finished with value: 0.8624588177154795 and parameters: {'activation': 'relu', 'solver': 'adam', 'lr': 2.4639133407737564e-05, 'layer1': 483, 'layer2': 36, 'layer3': 450}. Best is trial 169 with value: 0.8650159865951903.
Escherichia_Coli | LPS | Optuna:  86%|████████▌ | 172/200 [9:48:17<1:26:55, 186.28s/it, best=0.865]Escherichia_Coli | LPS | Optuna:  86%|████████▌ | 172/200 [9:48:17<1:26:55, 186.28s/it, best=0.865][I 2026-03-05 05:47:54,498] Trial 107 finished with value: 0.8925823505889502 and parameters: {'activation': 'identity', 'solver': 'adam', 'lr': 2.5364372679580436e-05, 'layer1': 342, 'layer2': 399, 'layer3': 23}. Best is trial 102 with value: 0.8935277328516141.
Staphylococcus_Aureus | DirectMulti | Optuna:  54%|█████▍    | 108/200 [5:13:12<4:32:18, 177.59s/it, best=0.893]Staphylococcus_Aureus | DirectMulti | Optuna:  54%|█████▍    | 108/200 [5:13:12<4:32:18, 177.59s/it, best=0.893][I 2026-03-05 05:49:07,561] Trial 108 finished with value: 0.8148108106941333 and parameters: {'activation': 'logistic', 'solver': 'adam', 'lr': 0.005724899948442512, 'layer1': 344, 'layer2': 415, 'layer3': 25}. Best is trial 102 with value: 0.8935277328516141.
Staphylococcus_Aureus | DirectMulti | Optuna:  55%|█████▍    | 109/200 [5:14:25<3:41:47, 146.23s/it, best=0.893]Staphylococcus_Aureus | DirectMulti | Optuna:  55%|█████▍    | 109/200 [5:14:25<3:41:47, 146.23s/it, best=0.893][I 2026-03-05 05:49:55,980] Trial 172 finished with value: 0.8636451577838671 and parameters: {'activation': 'relu', 'solver': 'adam', 'lr': 2.973076828793189e-05, 'layer1': 463, 'layer2': 52, 'layer3': 489}. Best is trial 169 with value: 0.8650159865951903.
Escherichia_Coli | LPS | Optuna:  86%|████████▋ | 173/200 [9:51:38<1:25:43, 190.50s/it, best=0.865]Escherichia_Coli | LPS | Optuna:  86%|████████▋ | 173/200 [9:51:38<1:25:43, 190.50s/it, best=0.865][I 2026-03-05 05:51:32,582] Trial 109 finished with value: 0.8909269783246282 and parameters: {'activation': 'identity', 'solver': 'adam', 'lr': 2.4558220618968777e-05, 'layer1': 329, 'layer2': 448, 'layer3': 51}. Best is trial 102 with value: 0.8935277328516141.
Staphylococcus_Aureus | DirectMulti | Optuna:  55%|█████▌    | 110/200 [5:16:50<3:38:48, 145.87s/it, best=0.893]Staphylococcus_Aureus | DirectMulti | Optuna:  55%|█████▌    | 110/200 [5:16:50<3:38:48, 145.87s/it, best=0.893][I 2026-03-05 05:52:56,796] Trial 173 finished with value: 0.8629872020325123 and parameters: {'activation': 'relu', 'solver': 'adam', 'lr': 3.7246249178672286e-05, 'layer1': 469, 'layer2': 52, 'layer3': 491}. Best is trial 169 with value: 0.8650159865951903.
Escherichia_Coli | LPS | Optuna:  87%|████████▋ | 174/200 [9:54:38<1:21:17, 187.59s/it, best=0.865]Escherichia_Coli | LPS | Optuna:  87%|████████▋ | 174/200 [9:54:38<1:21:17, 187.59s/it, best=0.865][I 2026-03-05 05:53:01,641] Trial 110 finished with value: 0.8919119659334612 and parameters: {'activation': 'identity', 'solver': 'adam', 'lr': 4.824410304150259e-05, 'layer1': 254, 'layer2': 487, 'layer3': 37}. Best is trial 102 with value: 0.8935277328516141.
Staphylococcus_Aureus | DirectMulti | Optuna:  56%|█████▌    | 111/200 [5:18:19<3:11:05, 128.83s/it, best=0.893]Staphylococcus_Aureus | DirectMulti | Optuna:  56%|█████▌    | 111/200 [5:18:19<3:11:05, 128.83s/it, best=0.893][I 2026-03-05 05:55:59,714] Trial 111 finished with value: 0.8913686600499482 and parameters: {'activation': 'identity', 'solver': 'adam', 'lr': 1.8660631045508292e-05, 'layer1': 316, 'layer2': 405, 'layer3': 16}. Best is trial 102 with value: 0.8935277328516141.
Staphylococcus_Aureus | DirectMulti | Optuna:  56%|█████▌    | 112/200 [5:21:17<3:30:36, 143.60s/it, best=0.893]Staphylococcus_Aureus | DirectMulti | Optuna:  56%|█████▌    | 112/200 [5:21:17<3:30:36, 143.60s/it, best=0.893][I 2026-03-05 05:56:20,962] Trial 174 finished with value: 0.861711383286503 and parameters: {'activation': 'relu', 'solver': 'adam', 'lr': 2.3089571029103626e-05, 'layer1': 460, 'layer2': 63, 'layer3': 476}. Best is trial 169 with value: 0.8650159865951903.
Escherichia_Coli | LPS | Optuna:  88%|████████▊ | 175/200 [9:58:03<1:20:14, 192.57s/it, best=0.865]Escherichia_Coli | LPS | Optuna:  88%|████████▊ | 175/200 [9:58:03<1:20:14, 192.57s/it, best=0.865][I 2026-03-05 05:59:01,934] Trial 112 finished with value: 0.8917673549400325 and parameters: {'activation': 'identity', 'solver': 'adam', 'lr': 1.4571817282884513e-05, 'layer1': 302, 'layer2': 396, 'layer3': 31}. Best is trial 102 with value: 0.8935277328516141.
Staphylococcus_Aureus | DirectMulti | Optuna:  56%|█████▋    | 113/200 [5:24:19<3:45:01, 155.19s/it, best=0.893]Staphylococcus_Aureus | DirectMulti | Optuna:  56%|█████▋    | 113/200 [5:24:19<3:45:01, 155.19s/it, best=0.893][I 2026-03-05 05:59:34,880] Trial 175 finished with value: 0.8631340513936827 and parameters: {'activation': 'relu', 'solver': 'adam', 'lr': 3.1689227013378786e-05, 'layer1': 499, 'layer2': 46, 'layer3': 500}. Best is trial 169 with value: 0.8650159865951903.
Escherichia_Coli | LPS | Optuna:  88%|████████▊ | 176/200 [10:01:16<1:17:11, 192.97s/it, best=0.865]Escherichia_Coli | LPS | Optuna:  88%|████████▊ | 176/200 [10:01:16<1:17:11, 192.97s/it, best=0.865][I 2026-03-05 06:00:55,050] Trial 113 finished with value: 0.8928753261999068 and parameters: {'activation': 'identity', 'solver': 'adam', 'lr': 3.7752116982846404e-05, 'layer1': 368, 'layer2': 437, 'layer3': 20}. Best is trial 102 with value: 0.8935277328516141.
Staphylococcus_Aureus | DirectMulti | Optuna:  57%|█████▋    | 114/200 [5:26:12<3:24:20, 142.57s/it, best=0.893]Staphylococcus_Aureus | DirectMulti | Optuna:  57%|█████▋    | 114/200 [5:26:12<3:24:20, 142.57s/it, best=0.893][I 2026-03-05 06:02:54,360] Trial 114 finished with value: 0.8909685876513501 and parameters: {'activation': 'identity', 'solver': 'adam', 'lr': 3.432273260497694e-05, 'layer1': 365, 'layer2': 454, 'layer3': 52}. Best is trial 102 with value: 0.8935277328516141.
Staphylococcus_Aureus | DirectMulti | Optuna:  57%|█████▊    | 115/200 [5:28:11<3:12:05, 135.59s/it, best=0.893]Staphylococcus_Aureus | DirectMulti | Optuna:  57%|█████▊    | 115/200 [5:28:11<3:12:05, 135.59s/it, best=0.893][I 2026-03-05 06:03:22,906] Trial 176 finished with value: 0.8638717328222889 and parameters: {'activation': 'relu', 'solver': 'adam', 'lr': 1.8541922816897144e-05, 'layer1': 475, 'layer2': 77, 'layer3': 464}. Best is trial 169 with value: 0.8650159865951903.
Escherichia_Coli | LPS | Optuna:  88%|████████▊ | 177/200 [10:05:04<1:18:00, 203.49s/it, best=0.865]Escherichia_Coli | LPS | Optuna:  88%|████████▊ | 177/200 [10:05:04<1:18:00, 203.49s/it, best=0.865][I 2026-03-05 06:05:08,433] Trial 115 finished with value: 0.8921358666969808 and parameters: {'activation': 'identity', 'solver': 'adam', 'lr': 2.6236395176918184e-05, 'layer1': 332, 'layer2': 437, 'layer3': 19}. Best is trial 102 with value: 0.8935277328516141.
Staphylococcus_Aureus | DirectMulti | Optuna:  58%|█████▊    | 116/200 [5:30:26<3:09:11, 135.13s/it, best=0.893]Staphylococcus_Aureus | DirectMulti | Optuna:  58%|█████▊    | 116/200 [5:30:26<3:09:11, 135.13s/it, best=0.893][I 2026-03-05 06:07:08,531] Trial 116 finished with value: 0.8913060707165785 and parameters: {'activation': 'identity', 'solver': 'adam', 'lr': 3.783735800948991e-05, 'layer1': 369, 'layer2': 385, 'layer3': 46}. Best is trial 102 with value: 0.8935277328516141.
Staphylococcus_Aureus | DirectMulti | Optuna:  58%|█████▊    | 117/200 [5:32:26<3:00:41, 130.62s/it, best=0.893]Staphylococcus_Aureus | DirectMulti | Optuna:  58%|█████▊    | 117/200 [5:32:26<3:00:41, 130.62s/it, best=0.893][I 2026-03-05 06:08:19,002] Trial 177 finished with value: 0.8634442273662504 and parameters: {'activation': 'relu', 'solver': 'adam', 'lr': 1.5129941457319969e-05, 'layer1': 476, 'layer2': 33, 'layer3': 462}. Best is trial 169 with value: 0.8650159865951903.
Escherichia_Coli | LPS | Optuna:  89%|████████▉ | 178/200 [10:10:01<1:24:47, 231.27s/it, best=0.865]Escherichia_Coli | LPS | Optuna:  89%|████████▉ | 178/200 [10:10:01<1:24:47, 231.27s/it, best=0.865][I 2026-03-05 06:09:05,777] Trial 117 finished with value: 0.8914633650119679 and parameters: {'activation': 'identity', 'solver': 'adam', 'lr': 2.355697860844515e-05, 'layer1': 284, 'layer2': 425, 'layer3': 382}. Best is trial 102 with value: 0.8935277328516141.
Staphylococcus_Aureus | DirectMulti | Optuna:  59%|█████▉    | 118/200 [5:34:23<2:53:02, 126.61s/it, best=0.893]Staphylococcus_Aureus | DirectMulti | Optuna:  59%|█████▉    | 118/200 [5:34:23<2:53:02, 126.61s/it, best=0.893][I 2026-03-05 06:11:32,922] Trial 178 finished with value: 0.8628931696189193 and parameters: {'activation': 'relu', 'solver': 'adam', 'lr': 1.797092804161791e-05, 'layer1': 255, 'layer2': 72, 'layer3': 450}. Best is trial 169 with value: 0.8650159865951903.
Escherichia_Coli | LPS | Optuna:  90%|████████▉ | 179/200 [10:13:15<1:17:01, 220.07s/it, best=0.865]Escherichia_Coli | LPS | Optuna:  90%|████████▉ | 179/200 [10:13:15<1:17:01, 220.07s/it, best=0.865][I 2026-03-05 06:13:15,369] Trial 118 finished with value: 0.8901369859956532 and parameters: {'activation': 'identity', 'solver': 'adam', 'lr': 9.707353566002141e-06, 'layer1': 341, 'layer2': 471, 'layer3': 20}. Best is trial 102 with value: 0.8935277328516141.
Staphylococcus_Aureus | DirectMulti | Optuna:  60%|█████▉    | 119/200 [5:38:32<3:40:43, 163.50s/it, best=0.893]Staphylococcus_Aureus | DirectMulti | Optuna:  60%|█████▉    | 119/200 [5:38:32<3:40:43, 163.50s/it, best=0.893][I 2026-03-05 06:15:29,267] Trial 179 finished with value: 0.8636358526596523 and parameters: {'activation': 'relu', 'solver': 'adam', 'lr': 2.1222048430260976e-05, 'layer1': 487, 'layer2': 89, 'layer3': 470}. Best is trial 169 with value: 0.8650159865951903.
Escherichia_Coli | LPS | Optuna:  90%|█████████ | 180/200 [10:17:11<1:14:58, 224.95s/it, best=0.865]Escherichia_Coli | LPS | Optuna:  90%|█████████ | 180/200 [10:17:11<1:14:58, 224.95s/it, best=0.865][I 2026-03-05 06:16:05,978] Trial 119 finished with value: 0.8910216024691471 and parameters: {'activation': 'identity', 'solver': 'adam', 'lr': 1.9066826604138843e-05, 'layer1': 390, 'layer2': 448, 'layer3': 94}. Best is trial 102 with value: 0.8935277328516141.
Staphylococcus_Aureus | DirectMulti | Optuna:  60%|██████    | 120/200 [5:41:23<3:40:50, 165.64s/it, best=0.893]Staphylococcus_Aureus | DirectMulti | Optuna:  60%|██████    | 120/200 [5:41:23<3:40:50, 165.64s/it, best=0.893][I 2026-03-05 06:18:04,184] Trial 120 finished with value: 0.6492858162103584 and parameters: {'activation': 'tanh', 'solver': 'sgd', 'lr': 2.7870553786510758e-05, 'layer1': 350, 'layer2': 498, 'layer3': 42}. Best is trial 102 with value: 0.8935277328516141.
Staphylococcus_Aureus | DirectMulti | Optuna:  60%|██████    | 121/200 [5:43:21<3:19:21, 151.41s/it, best=0.893]Staphylococcus_Aureus | DirectMulti | Optuna:  60%|██████    | 121/200 [5:43:21<3:19:21, 151.41s/it, best=0.893][I 2026-03-05 06:18:09,611] Trial 180 finished with value: 0.862446878553104 and parameters: {'activation': 'relu', 'solver': 'adam', 'lr': 5.6546191655653537e-05, 'layer1': 455, 'layer2': 20, 'layer3': 484}. Best is trial 169 with value: 0.8650159865951903.
Escherichia_Coli | LPS | Optuna:  90%|█████████ | 181/200 [10:19:51<1:05:05, 205.57s/it, best=0.865]Escherichia_Coli | LPS | Optuna:  90%|█████████ | 181/200 [10:19:51<1:05:05, 205.57s/it, best=0.865][I 2026-03-05 06:20:45,830] Trial 181 finished with value: 0.862682871784985 and parameters: {'activation': 'relu', 'solver': 'adam', 'lr': 2.6815767073749913e-05, 'layer1': 310, 'layer2': 56, 'layer3': 490}. Best is trial 169 with value: 0.8650159865951903.
Escherichia_Coli | LPS | Optuna:  91%|█████████ | 182/200 [10:22:27<57:13, 190.76s/it, best=0.865]  Escherichia_Coli | LPS | Optuna:  91%|█████████ | 182/200 [10:22:27<57:13, 190.76s/it, best=0.865][I 2026-03-05 06:20:53,401] Trial 121 finished with value: 0.8906773770381348 and parameters: {'activation': 'identity', 'solver': 'adam', 'lr': 1.5446487747372314e-05, 'layer1': 294, 'layer2': 407, 'layer3': 33}. Best is trial 102 with value: 0.8935277328516141.
Staphylococcus_Aureus | DirectMulti | Optuna:  61%|██████    | 122/200 [5:46:11<3:23:46, 156.75s/it, best=0.893]Staphylococcus_Aureus | DirectMulti | Optuna:  61%|██████    | 122/200 [5:46:11<3:23:46, 156.75s/it, best=0.893][I 2026-03-05 06:23:30,978] Trial 182 finished with value: 0.8626271611932335 and parameters: {'activation': 'relu', 'solver': 'adam', 'lr': 3.549712750897682e-05, 'layer1': 470, 'layer2': 112, 'layer3': 478}. Best is trial 169 with value: 0.8650159865951903.
Escherichia_Coli | LPS | Optuna:  92%|█████████▏| 183/200 [10:25:13<51:52, 183.08s/it, best=0.865]Escherichia_Coli | LPS | Optuna:  92%|█████████▏| 183/200 [10:25:13<51:52, 183.08s/it, best=0.865][I 2026-03-05 06:25:16,810] Trial 122 finished with value: 0.8907956797291622 and parameters: {'activation': 'identity', 'solver': 'adam', 'lr': 1.3295884416723576e-05, 'layer1': 314, 'layer2': 355, 'layer3': 10}. Best is trial 102 with value: 0.8935277328516141.
Staphylococcus_Aureus | DirectMulti | Optuna:  62%|██████▏   | 123/200 [5:50:34<4:02:13, 188.75s/it, best=0.893]Staphylococcus_Aureus | DirectMulti | Optuna:  62%|██████▏   | 123/200 [5:50:34<4:02:13, 188.75s/it, best=0.893][I 2026-03-05 06:26:57,382] Trial 183 finished with value: 0.8632339613141518 and parameters: {'activation': 'relu', 'solver': 'adam', 'lr': 2.6749736054904477e-05, 'layer1': 491, 'layer2': 78, 'layer3': 462}. Best is trial 169 with value: 0.8650159865951903.
Escherichia_Coli | LPS | Optuna:  92%|█████████▏| 184/200 [10:28:39<50:41, 190.08s/it, best=0.865]Escherichia_Coli | LPS | Optuna:  92%|█████████▏| 184/200 [10:28:39<50:41, 190.08s/it, best=0.865][I 2026-03-05 06:28:03,856] Trial 123 finished with value: 0.8924238469652487 and parameters: {'activation': 'identity', 'solver': 'adam', 'lr': 2.248332915864519e-05, 'layer1': 357, 'layer2': 403, 'layer3': 56}. Best is trial 102 with value: 0.8935277328516141.
Staphylococcus_Aureus | DirectMulti | Optuna:  62%|██████▏   | 124/200 [5:53:21<3:50:50, 182.24s/it, best=0.893]Staphylococcus_Aureus | DirectMulti | Optuna:  62%|██████▏   | 124/200 [5:53:21<3:50:50, 182.24s/it, best=0.893][I 2026-03-05 06:29:42,944] Trial 184 finished with value: 0.8624152389654457 and parameters: {'activation': 'relu', 'solver': 'adam', 'lr': 4.066931283295555e-05, 'layer1': 480, 'layer2': 41, 'layer3': 471}. Best is trial 169 with value: 0.8650159865951903.
Escherichia_Coli | LPS | Optuna:  92%|█████████▎| 185/200 [10:31:25<45:40, 182.72s/it, best=0.865]Escherichia_Coli | LPS | Optuna:  92%|█████████▎| 185/200 [10:31:25<45:40, 182.72s/it, best=0.865][I 2026-03-05 06:30:47,882] Trial 124 finished with value: 0.8922605511330415 and parameters: {'activation': 'identity', 'solver': 'adam', 'lr': 2.1327675386690887e-05, 'layer1': 359, 'layer2': 417, 'layer3': 73}. Best is trial 102 with value: 0.8935277328516141.
Staphylococcus_Aureus | DirectMulti | Optuna:  62%|██████▎   | 125/200 [5:56:05<3:40:58, 176.77s/it, best=0.893]Staphylococcus_Aureus | DirectMulti | Optuna:  62%|██████▎   | 125/200 [5:56:05<3:40:58, 176.77s/it, best=0.893][I 2026-03-05 06:31:45,644] Trial 185 finished with value: 0.8621831850313464 and parameters: {'activation': 'relu', 'solver': 'adam', 'lr': 3.114332613343506e-05, 'layer1': 101, 'layer2': 28, 'layer3': 443}. Best is trial 169 with value: 0.8650159865951903.
Escherichia_Coli | LPS | Optuna:  93%|█████████▎| 186/200 [10:33:27<38:26, 164.72s/it, best=0.865]Escherichia_Coli | LPS | Optuna:  93%|█████████▎| 186/200 [10:33:27<38:26, 164.72s/it, best=0.865][I 2026-03-05 06:33:09,719] Trial 125 finished with value: 0.8907756013974689 and parameters: {'activation': 'identity', 'solver': 'adam', 'lr': 3.1923462808981486e-05, 'layer1': 411, 'layer2': 436, 'layer3': 52}. Best is trial 102 with value: 0.8935277328516141.
Staphylococcus_Aureus | DirectMulti | Optuna:  63%|██████▎   | 126/200 [5:58:27<3:25:05, 166.29s/it, best=0.893]Staphylococcus_Aureus | DirectMulti | Optuna:  63%|██████▎   | 126/200 [5:58:27<3:25:05, 166.29s/it, best=0.893][I 2026-03-05 06:34:55,576] Trial 126 finished with value: 0.8929490740081508 and parameters: {'activation': 'identity', 'solver': 'adam', 'lr': 4.422953789063532e-05, 'layer1': 347, 'layer2': 296, 'layer3': 77}. Best is trial 102 with value: 0.8935277328516141.
Staphylococcus_Aureus | DirectMulti | Optuna:  64%|██████▎   | 127/200 [6:00:13<3:00:15, 148.16s/it, best=0.893]Staphylococcus_Aureus | DirectMulti | Optuna:  64%|██████▎   | 127/200 [6:00:13<3:00:15, 148.16s/it, best=0.893][I 2026-03-05 06:36:08,227] Trial 186 finished with value: 0.8633536107757344 and parameters: {'activation': 'relu', 'solver': 'adam', 'lr': 1.875406887034402e-05, 'layer1': 461, 'layer2': 68, 'layer3': 483}. Best is trial 169 with value: 0.8650159865951903.
Escherichia_Coli | LPS | Optuna:  94%|█████████▎| 187/200 [10:37:50<42:02, 194.08s/it, best=0.865]Escherichia_Coli | LPS | Optuna:  94%|█████████▎| 187/200 [10:37:50<42:02, 194.08s/it, best=0.865][I 2026-03-05 06:36:37,179] Trial 127 finished with value: 0.8917924106492296 and parameters: {'activation': 'identity', 'solver': 'adam', 'lr': 4.242520370973477e-05, 'layer1': 322, 'layer2': 310, 'layer3': 61}. Best is trial 102 with value: 0.8935277328516141.
Staphylococcus_Aureus | DirectMulti | Optuna:  64%|██████▍   | 128/200 [6:01:54<2:41:01, 134.19s/it, best=0.893]Staphylococcus_Aureus | DirectMulti | Optuna:  64%|██████▍   | 128/200 [6:01:54<2:41:01, 134.19s/it, best=0.893][I 2026-03-05 06:38:16,733] Trial 128 finished with value: 0.8915325746003419 and parameters: {'activation': 'identity', 'solver': 'adam', 'lr': 5.357511432817743e-05, 'layer1': 345, 'layer2': 283, 'layer3': 26}. Best is trial 102 with value: 0.8935277328516141.
Staphylococcus_Aureus | DirectMulti | Optuna:  64%|██████▍   | 129/200 [6:03:34<2:26:29, 123.80s/it, best=0.893]Staphylococcus_Aureus | DirectMulti | Optuna:  64%|██████▍   | 129/200 [6:03:34<2:26:29, 123.80s/it, best=0.893][I 2026-03-05 06:39:32,880] Trial 129 finished with value: 0.8911021958654904 and parameters: {'activation': 'identity', 'solver': 'adam', 'lr': 0.00010384045849606109, 'layer1': 334, 'layer2': 294, 'layer3': 90}. Best is trial 102 with value: 0.8935277328516141.
Staphylococcus_Aureus | DirectMulti | Optuna:  65%|██████▌   | 130/200 [6:04:50<2:07:45, 109.51s/it, best=0.893]Staphylococcus_Aureus | DirectMulti | Optuna:  65%|██████▌   | 130/200 [6:04:50<2:07:45, 109.51s/it, best=0.893][I 2026-03-05 06:40:06,546] Trial 187 finished with value: 0.8622384132780425 and parameters: {'activation': 'relu', 'solver': 'adam', 'lr': 2.389613699024055e-05, 'layer1': 499, 'layer2': 51, 'layer3': 456}. Best is trial 169 with value: 0.8650159865951903.
Escherichia_Coli | LPS | Optuna:  94%|█████████▍| 188/200 [10:41:48<41:28, 207.35s/it, best=0.865]Escherichia_Coli | LPS | Optuna:  94%|█████████▍| 188/200 [10:41:48<41:28, 207.35s/it, best=0.865][I 2026-03-05 06:40:28,218] Trial 130 finished with value: 0.8016455484651599 and parameters: {'activation': 'logistic', 'solver': 'adam', 'lr': 3.808272954988339e-05, 'layer1': 362, 'layer2': 325, 'layer3': 106}. Best is trial 102 with value: 0.8935277328516141.
Staphylococcus_Aureus | DirectMulti | Optuna:  66%|██████▌   | 131/200 [6:05:45<1:47:14, 93.26s/it, best=0.893] Staphylococcus_Aureus | DirectMulti | Optuna:  66%|██████▌   | 131/200 [6:05:45<1:47:14, 93.26s/it, best=0.893][I 2026-03-05 06:41:34,069] Trial 188 finished with value: 0.7388067228206201 and parameters: {'activation': 'logistic', 'solver': 'adam', 'lr': 4.9253814979199975e-05, 'layer1': 449, 'layer2': 41, 'layer3': 488}. Best is trial 169 with value: 0.8650159865951903.
Escherichia_Coli | LPS | Optuna:  94%|█████████▍| 189/200 [10:43:16<31:25, 171.40s/it, best=0.865]Escherichia_Coli | LPS | Optuna:  94%|█████████▍| 189/200 [10:43:16<31:25, 171.40s/it, best=0.865][I 2026-03-05 06:42:02,060] Trial 131 finished with value: 0.8918347969896396 and parameters: {'activation': 'identity', 'solver': 'adam', 'lr': 7.160940202334377e-05, 'layer1': 374, 'layer2': 268, 'layer3': 80}. Best is trial 102 with value: 0.8935277328516141.
