Pseudomonas_Aeruginosa | LPS | Optuna:  87%|████████▋ | 174/200 [3:14:02<37:03, 85.54s/it, best=0.868]Pseudomonas_Aeruginosa | LPS | Optuna:  87%|████████▋ | 174/200 [3:14:02<37:03, 85.54s/it, best=0.868][I 2026-03-04 23:12:40,618] Trial 147 finished with value: 0.8884844479713833 and parameters: {'activation': 'identity', 'solver': 'adam', 'lr': 0.0012521686026081278, 'layer1': 193, 'layer2': 17, 'layer3': 10}. Best is trial 124 with value: 0.8938450095328893.
Staphylococcus_Aureus | LPS | Optuna:  74%|███████▍  | 148/200 [3:14:22<1:08:17, 78.80s/it, best=0.894]Staphylococcus_Aureus | LPS | Optuna:  74%|███████▍  | 148/200 [3:14:22<1:08:17, 78.80s/it, best=0.894][I 2026-03-04 23:13:01,441] Trial 161 finished with value: 0.9304942233301805 and parameters: {'activation': 'tanh', 'solver': 'adam', 'lr': 0.00011032726043368264, 'layer1': 119, 'layer2': 286, 'layer3': 123}. Best is trial 104 with value: 0.9327898309005132.
Klebsiella_Pneumoniae | LPS | Optuna:  81%|████████  | 162/200 [3:14:43<39:53, 62.98s/it, best=0.933]Klebsiella_Pneumoniae | LPS | Optuna:  81%|████████  | 162/200 [3:14:43<39:53, 62.98s/it, best=0.933][I 2026-03-04 23:13:29,748] Trial 70 finished with value: 0.7403053430763131 and parameters: {'activation': 'relu', 'solver': 'sgd', 'lr': 0.00031176028222803723, 'layer1': 422, 'layer2': 29, 'layer3': 280}. Best is trial 14 with value: 0.863668804271893.
Escherichia_Coli | LPS | Optuna:  36%|███▌      | 71/200 [3:15:11<5:27:05, 152.14s/it, best=0.864]Escherichia_Coli | LPS | Optuna:  36%|███▌      | 71/200 [3:15:11<5:27:05, 152.14s/it, best=0.864][I 2026-03-04 23:13:56,693] Trial 174 finished with value: 0.8610341809877022 and parameters: {'activation': 'relu', 'solver': 'adam', 'lr': 0.005358999892330477, 'layer1': 407, 'layer2': 211, 'layer3': 418}. Best is trial 172 with value: 0.8682843857718467.
Pseudomonas_Aeruginosa | LPS | Optuna:  88%|████████▊ | 175/200 [3:15:38<37:01, 88.85s/it, best=0.868]Pseudomonas_Aeruginosa | LPS | Optuna:  88%|████████▊ | 175/200 [3:15:38<37:01, 88.85s/it, best=0.868][I 2026-03-04 23:14:13,859] Trial 162 finished with value: 0.9323200979612143 and parameters: {'activation': 'tanh', 'solver': 'adam', 'lr': 6.539598297089943e-05, 'layer1': 100, 'layer2': 306, 'layer3': 105}. Best is trial 104 with value: 0.9327898309005132.
Klebsiella_Pneumoniae | LPS | Optuna:  82%|████████▏ | 163/200 [3:15:56<40:35, 65.81s/it, best=0.933]Klebsiella_Pneumoniae | LPS | Optuna:  82%|████████▏ | 163/200 [3:15:56<40:35, 65.81s/it, best=0.933][I 2026-03-04 23:14:25,805] Trial 148 finished with value: 0.8760626355857216 and parameters: {'activation': 'logistic', 'solver': 'adam', 'lr': 0.000762026184239399, 'layer1': 240, 'layer2': 104, 'layer3': 392}. Best is trial 124 with value: 0.8938450095328893.
Staphylococcus_Aureus | LPS | Optuna:  74%|███████▍  | 149/200 [3:16:07<1:13:42, 86.72s/it, best=0.894]Staphylococcus_Aureus | LPS | Optuna:  74%|███████▍  | 149/200 [3:16:07<1:13:42, 86.72s/it, best=0.894][I 2026-03-04 23:15:30,963] Trial 163 finished with value: 0.9318654054547514 and parameters: {'activation': 'tanh', 'solver': 'adam', 'lr': 6.287714155017379e-05, 'layer1': 99, 'layer2': 305, 'layer3': 69}. Best is trial 104 with value: 0.9327898309005132.
Klebsiella_Pneumoniae | LPS | Optuna:  82%|████████▏ | 164/200 [3:17:13<41:31, 69.20s/it, best=0.933]Klebsiella_Pneumoniae | LPS | Optuna:  82%|████████▏ | 164/200 [3:17:13<41:31, 69.20s/it, best=0.933][I 2026-03-04 23:15:37,474] Trial 175 finished with value: 0.8657487574495756 and parameters: {'activation': 'relu', 'solver': 'adam', 'lr': 0.005601423015898307, 'layer1': 427, 'layer2': 189, 'layer3': 401}. Best is trial 172 with value: 0.8682843857718467.
Pseudomonas_Aeruginosa | LPS | Optuna:  88%|████████▊ | 176/200 [3:17:19<36:58, 92.43s/it, best=0.868]Pseudomonas_Aeruginosa | LPS | Optuna:  88%|████████▊ | 176/200 [3:17:19<36:58, 92.43s/it, best=0.868][I 2026-03-04 23:15:46,726] Trial 149 finished with value: 0.8932202558970879 and parameters: {'activation': 'identity', 'solver': 'adam', 'lr': 0.00037223837642340714, 'layer1': 264, 'layer2': 57, 'layer3': 75}. Best is trial 124 with value: 0.8938450095328893.
Staphylococcus_Aureus | LPS | Optuna:  75%|███████▌  | 150/200 [3:17:28<1:10:48, 84.98s/it, best=0.894]Staphylococcus_Aureus | LPS | Optuna:  75%|███████▌  | 150/200 [3:17:28<1:10:48, 84.98s/it, best=0.894][I 2026-03-04 23:16:37,757] Trial 164 finished with value: 0.931840839015812 and parameters: {'activation': 'tanh', 'solver': 'adam', 'lr': 8.815608855482945e-05, 'layer1': 131, 'layer2': 278, 'layer3': 114}. Best is trial 104 with value: 0.9327898309005132.
Klebsiella_Pneumoniae | LPS | Optuna:  82%|████████▎ | 165/200 [3:18:19<39:56, 68.48s/it, best=0.933]Klebsiella_Pneumoniae | LPS | Optuna:  82%|████████▎ | 165/200 [3:18:19<39:56, 68.48s/it, best=0.933][I 2026-03-04 23:16:52,697] Trial 71 finished with value: 0.8624812327216697 and parameters: {'activation': 'relu', 'solver': 'adam', 'lr': 9.778358434858275e-05, 'layer1': 451, 'layer2': 63, 'layer3': 445}. Best is trial 14 with value: 0.863668804271893.
Escherichia_Coli | LPS | Optuna:  36%|███▌      | 72/200 [3:18:34<5:57:04, 167.38s/it, best=0.864]Escherichia_Coli | LPS | Optuna:  36%|███▌      | 72/200 [3:18:34<5:57:04, 167.38s/it, best=0.864][I 2026-03-04 23:17:05,772] Trial 150 finished with value: 0.8931430173573757 and parameters: {'activation': 'identity', 'solver': 'adam', 'lr': 0.00035451676829776626, 'layer1': 264, 'layer2': 26, 'layer3': 67}. Best is trial 124 with value: 0.8938450095328893.
Staphylococcus_Aureus | LPS | Optuna:  76%|███████▌  | 151/200 [3:18:47<1:07:56, 83.20s/it, best=0.894]Staphylococcus_Aureus | LPS | Optuna:  76%|███████▌  | 151/200 [3:18:47<1:07:56, 83.20s/it, best=0.894][I 2026-03-04 23:17:33,461] Trial 176 finished with value: 0.8600397204752882 and parameters: {'activation': 'relu', 'solver': 'adam', 'lr': 0.005364984945262426, 'layer1': 419, 'layer2': 207, 'layer3': 390}. Best is trial 172 with value: 0.8682843857718467.
Pseudomonas_Aeruginosa | LPS | Optuna:  88%|████████▊ | 177/200 [3:19:15<38:08, 99.50s/it, best=0.868]Pseudomonas_Aeruginosa | LPS | Optuna:  88%|████████▊ | 177/200 [3:19:15<38:08, 99.50s/it, best=0.868][I 2026-03-04 23:17:45,883] Trial 165 finished with value: 0.9321137023505077 and parameters: {'activation': 'tanh', 'solver': 'adam', 'lr': 7.392979307861654e-05, 'layer1': 115, 'layer2': 300, 'layer3': 136}. Best is trial 104 with value: 0.9327898309005132.
Klebsiella_Pneumoniae | LPS | Optuna:  83%|████████▎ | 166/200 [3:19:28<38:44, 68.37s/it, best=0.933]Klebsiella_Pneumoniae | LPS | Optuna:  83%|████████▎ | 166/200 [3:19:28<38:44, 68.37s/it, best=0.933][I 2026-03-04 23:18:30,425] Trial 151 finished with value: 0.8904807865467579 and parameters: {'activation': 'identity', 'solver': 'adam', 'lr': 0.00035460654987919755, 'layer1': 259, 'layer2': 25, 'layer3': 78}. Best is trial 124 with value: 0.8938450095328893.
Staphylococcus_Aureus | LPS | Optuna:  76%|███████▌  | 152/200 [3:20:12<1:06:54, 83.63s/it, best=0.894]Staphylococcus_Aureus | LPS | Optuna:  76%|███████▌  | 152/200 [3:20:12<1:06:54, 83.63s/it, best=0.894][I 2026-03-04 23:18:55,960] Trial 166 finished with value: 0.9319434816402474 and parameters: {'activation': 'tanh', 'solver': 'adam', 'lr': 7.039739557489625e-05, 'layer1': 115, 'layer2': 286, 'layer3': 109}. Best is trial 104 with value: 0.9327898309005132.
Klebsiella_Pneumoniae | LPS | Optuna:  84%|████████▎ | 167/200 [3:20:38<37:53, 68.88s/it, best=0.933]Klebsiella_Pneumoniae | LPS | Optuna:  84%|████████▎ | 167/200 [3:20:38<37:53, 68.88s/it, best=0.933][I 2026-03-04 23:19:07,025] Trial 177 finished with value: 0.8617432594952621 and parameters: {'activation': 'relu', 'solver': 'adam', 'lr': 0.004214403116925536, 'layer1': 392, 'layer2': 193, 'layer3': 400}. Best is trial 172 with value: 0.8682843857718467.
Pseudomonas_Aeruginosa | LPS | Optuna:  89%|████████▉ | 178/200 [3:20:49<35:49, 97.72s/it, best=0.868]Pseudomonas_Aeruginosa | LPS | Optuna:  89%|████████▉ | 178/200 [3:20:49<35:49, 97.72s/it, best=0.868][I 2026-03-04 23:20:01,845] Trial 152 finished with value: 0.8907732008408417 and parameters: {'activation': 'identity', 'solver': 'adam', 'lr': 0.00022984776659170473, 'layer1': 269, 'layer2': 55, 'layer3': 65}. Best is trial 124 with value: 0.8938450095328893.
Staphylococcus_Aureus | LPS | Optuna:  76%|███████▋  | 153/200 [3:21:43<1:07:20, 85.97s/it, best=0.894]Staphylococcus_Aureus | LPS | Optuna:  76%|███████▋  | 153/200 [3:21:43<1:07:20, 85.97s/it, best=0.894][I 2026-03-04 23:20:11,144] Trial 72 finished with value: 0.8620274229104737 and parameters: {'activation': 'relu', 'solver': 'adam', 'lr': 8.483935841825724e-05, 'layer1': 460, 'layer2': 60, 'layer3': 442}. Best is trial 14 with value: 0.863668804271893.
Escherichia_Coli | LPS | Optuna:  36%|███▋      | 73/200 [3:21:53<6:14:00, 176.70s/it, best=0.864]Escherichia_Coli | LPS | Optuna:  36%|███▋      | 73/200 [3:21:53<6:14:00, 176.70s/it, best=0.864][I 2026-03-04 23:20:27,604] Trial 167 finished with value: 0.931167312169117 and parameters: {'activation': 'tanh', 'solver': 'adam', 'lr': 4.1489403141406795e-05, 'layer1': 184, 'layer2': 271, 'layer3': 135}. Best is trial 104 with value: 0.9327898309005132.
Klebsiella_Pneumoniae | LPS | Optuna:  84%|████████▍ | 168/200 [3:22:09<40:22, 75.71s/it, best=0.933]Klebsiella_Pneumoniae | LPS | Optuna:  84%|████████▍ | 168/200 [3:22:09<40:22, 75.71s/it, best=0.933][I 2026-03-04 23:20:53,577] Trial 178 finished with value: 0.8604263719697013 and parameters: {'activation': 'relu', 'solver': 'adam', 'lr': 0.0047627513226373855, 'layer1': 433, 'layer2': 194, 'layer3': 438}. Best is trial 172 with value: 0.8682843857718467.
Pseudomonas_Aeruginosa | LPS | Optuna:  90%|████████▉ | 179/200 [3:22:35<35:07, 100.37s/it, best=0.868]Pseudomonas_Aeruginosa | LPS | Optuna:  90%|████████▉ | 179/200 [3:22:35<35:07, 100.37s/it, best=0.868][I 2026-03-04 23:21:32,605] Trial 168 finished with value: 0.9311660150475655 and parameters: {'activation': 'tanh', 'solver': 'adam', 'lr': 8.097439364844891e-05, 'layer1': 108, 'layer2': 299, 'layer3': 95}. Best is trial 104 with value: 0.9327898309005132.
Klebsiella_Pneumoniae | LPS | Optuna:  84%|████████▍ | 169/200 [3:23:14<37:27, 72.50s/it, best=0.933]Klebsiella_Pneumoniae | LPS | Optuna:  84%|████████▍ | 169/200 [3:23:14<37:27, 72.50s/it, best=0.933][I 2026-03-04 23:21:39,218] Trial 153 finished with value: 0.8915299697453367 and parameters: {'activation': 'identity', 'solver': 'adam', 'lr': 0.00018285991433366751, 'layer1': 312, 'layer2': 47, 'layer3': 92}. Best is trial 124 with value: 0.8938450095328893.
Staphylococcus_Aureus | LPS | Optuna:  77%|███████▋  | 154/200 [3:23:21<1:08:31, 89.39s/it, best=0.894]Staphylococcus_Aureus | LPS | Optuna:  77%|███████▋  | 154/200 [3:23:21<1:08:31, 89.39s/it, best=0.894][I 2026-03-04 23:22:49,143] Trial 179 finished with value: 0.8609833692269312 and parameters: {'activation': 'relu', 'solver': 'adam', 'lr': 0.00824280717314183, 'layer1': 403, 'layer2': 177, 'layer3': 432}. Best is trial 172 with value: 0.8682843857718467.
Pseudomonas_Aeruginosa | LPS | Optuna:  90%|█████████ | 180/200 [3:24:31<34:58, 104.93s/it, best=0.868]Pseudomonas_Aeruginosa | LPS | Optuna:  90%|█████████ | 180/200 [3:24:31<34:58, 104.93s/it, best=0.868][I 2026-03-04 23:22:50,887] Trial 169 finished with value: 0.9309639024773961 and parameters: {'activation': 'tanh', 'solver': 'adam', 'lr': 6.257005165728769e-05, 'layer1': 144, 'layer2': 247, 'layer3': 109}. Best is trial 104 with value: 0.9327898309005132.
Klebsiella_Pneumoniae | LPS | Optuna:  85%|████████▌ | 170/200 [3:24:33<37:07, 74.23s/it, best=0.933]Klebsiella_Pneumoniae | LPS | Optuna:  85%|████████▌ | 170/200 [3:24:33<37:07, 74.23s/it, best=0.933][I 2026-03-04 23:23:00,995] Trial 154 finished with value: 0.8937037678154611 and parameters: {'activation': 'identity', 'solver': 'adam', 'lr': 0.0003709988931341119, 'layer1': 248, 'layer2': 124, 'layer3': 75}. Best is trial 124 with value: 0.8938450095328893.
Staphylococcus_Aureus | LPS | Optuna:  78%|███████▊  | 155/200 [3:24:43<1:05:19, 87.11s/it, best=0.894]Staphylococcus_Aureus | LPS | Optuna:  78%|███████▊  | 155/200 [3:24:43<1:05:19, 87.11s/it, best=0.894][I 2026-03-04 23:24:18,731] Trial 180 finished with value: 0.8588201905065194 and parameters: {'activation': 'relu', 'solver': 'adam', 'lr': 0.0036398060489433053, 'layer1': 400, 'layer2': 188, 'layer3': 403}. Best is trial 172 with value: 0.8682843857718467.
Pseudomonas_Aeruginosa | LPS | Optuna:  90%|█████████ | 181/200 [3:26:00<31:46, 100.33s/it, best=0.868]Pseudomonas_Aeruginosa | LPS | Optuna:  90%|█████████ | 181/200 [3:26:00<31:46, 100.33s/it, best=0.868][I 2026-03-04 23:24:20,926] Trial 155 finished with value: 0.8922741051060555 and parameters: {'activation': 'identity', 'solver': 'adam', 'lr': 0.0004072200445222848, 'layer1': 251, 'layer2': 125, 'layer3': 104}. Best is trial 124 with value: 0.8938450095328893.
Staphylococcus_Aureus | LPS | Optuna:  78%|███████▊  | 156/200 [3:26:03<1:02:17, 84.95s/it, best=0.894]Staphylococcus_Aureus | LPS | Optuna:  78%|███████▊  | 156/200 [3:26:03<1:02:17, 84.95s/it, best=0.894][I 2026-03-04 23:24:52,573] Trial 73 finished with value: 0.864893646817533 and parameters: {'activation': 'relu', 'solver': 'adam', 'lr': 3.76826098467102e-05, 'layer1': 500, 'layer2': 14, 'layer3': 415}. Best is trial 73 with value: 0.864893646817533.
Escherichia_Coli | LPS | Optuna:  37%|███▋      | 74/200 [3:26:34<7:17:02, 208.12s/it, best=0.864]Escherichia_Coli | LPS | Optuna:  37%|███▋      | 74/200 [3:26:34<7:17:02, 208.12s/it, best=0.865][I 2026-03-04 23:25:01,825] Trial 170 finished with value: 0.9300193894133197 and parameters: {'activation': 'relu', 'solver': 'adam', 'lr': 3.334372785030354e-05, 'layer1': 91, 'layer2': 257, 'layer3': 124}. Best is trial 104 with value: 0.9327898309005132.
Klebsiella_Pneumoniae | LPS | Optuna:  86%|████████▌ | 171/200 [3:26:44<44:06, 91.24s/it, best=0.933]Klebsiella_Pneumoniae | LPS | Optuna:  86%|████████▌ | 171/200 [3:26:44<44:06, 91.24s/it, best=0.933][I 2026-03-04 23:25:37,513] Trial 181 finished with value: 0.8624508024362127 and parameters: {'activation': 'relu', 'solver': 'adam', 'lr': 0.0027094408473694095, 'layer1': 420, 'layer2': 224, 'layer3': 442}. Best is trial 172 with value: 0.8682843857718467.
Pseudomonas_Aeruginosa | LPS | Optuna:  91%|█████████ | 182/200 [3:27:19<28:09, 93.86s/it, best=0.868] Pseudomonas_Aeruginosa | LPS | Optuna:  91%|█████████ | 182/200 [3:27:19<28:09, 93.86s/it, best=0.868][I 2026-03-04 23:25:47,348] Trial 156 finished with value: 0.8917239528596242 and parameters: {'activation': 'identity', 'solver': 'adam', 'lr': 0.0004620979572034599, 'layer1': 277, 'layer2': 29, 'layer3': 69}. Best is trial 124 with value: 0.8938450095328893.
Staphylococcus_Aureus | LPS | Optuna:  78%|███████▊  | 157/200 [3:27:29<1:01:11, 85.39s/it, best=0.894]Staphylococcus_Aureus | LPS | Optuna:  78%|███████▊  | 157/200 [3:27:29<1:01:11, 85.39s/it, best=0.894][I 2026-03-04 23:26:25,960] Trial 171 finished with value: 0.9313850216856381 and parameters: {'activation': 'tanh', 'solver': 'adam', 'lr': 0.00011999070436771484, 'layer1': 355, 'layer2': 318, 'layer3': 84}. Best is trial 104 with value: 0.9327898309005132.
Klebsiella_Pneumoniae | LPS | Optuna:  86%|████████▌ | 172/200 [3:28:08<41:35, 89.11s/it, best=0.933]Klebsiella_Pneumoniae | LPS | Optuna:  86%|████████▌ | 172/200 [3:28:08<41:35, 89.11s/it, best=0.933][I 2026-03-04 23:27:09,255] Trial 157 finished with value: 0.8937194646593888 and parameters: {'activation': 'identity', 'solver': 'adam', 'lr': 0.000292466851074095, 'layer1': 267, 'layer2': 15, 'layer3': 146}. Best is trial 124 with value: 0.8938450095328893.
Staphylococcus_Aureus | LPS | Optuna:  79%|███████▉  | 158/200 [3:28:51<59:02, 84.35s/it, best=0.894]  Staphylococcus_Aureus | LPS | Optuna:  79%|███████▉  | 158/200 [3:28:51<59:02, 84.35s/it, best=0.894][I 2026-03-04 23:27:23,200] Trial 172 finished with value: 0.9319287177882449 and parameters: {'activation': 'tanh', 'solver': 'adam', 'lr': 9.424866144335307e-05, 'layer1': 101, 'layer2': 303, 'layer3': 93}. Best is trial 104 with value: 0.9327898309005132.
Klebsiella_Pneumoniae | LPS | Optuna:  86%|████████▋ | 173/200 [3:29:05<35:47, 79.55s/it, best=0.933]Klebsiella_Pneumoniae | LPS | Optuna:  86%|████████▋ | 173/200 [3:29:05<35:47, 79.55s/it, best=0.933][I 2026-03-04 23:27:27,211] Trial 182 finished with value: 0.8632785840989186 and parameters: {'activation': 'relu', 'solver': 'adam', 'lr': 0.007458056513903605, 'layer1': 441, 'layer2': 63, 'layer3': 426}. Best is trial 172 with value: 0.8682843857718467.
Pseudomonas_Aeruginosa | LPS | Optuna:  92%|█████████▏| 183/200 [3:29:09<27:56, 98.61s/it, best=0.868]Pseudomonas_Aeruginosa | LPS | Optuna:  92%|█████████▏| 183/200 [3:29:09<27:56, 98.61s/it, best=0.868][I 2026-03-04 23:28:26,249] Trial 158 finished with value: 0.8907915887963631 and parameters: {'activation': 'identity', 'solver': 'adam', 'lr': 0.0017660103838164735, 'layer1': 290, 'layer2': 20, 'layer3': 144}. Best is trial 124 with value: 0.8938450095328893.
Staphylococcus_Aureus | LPS | Optuna:  80%|███████▉  | 159/200 [3:30:08<56:07, 82.14s/it, best=0.894]Staphylococcus_Aureus | LPS | Optuna:  80%|███████▉  | 159/200 [3:30:08<56:07, 82.14s/it, best=0.894][I 2026-03-04 23:28:32,422] Trial 173 finished with value: 0.9308122644838075 and parameters: {'activation': 'tanh', 'solver': 'adam', 'lr': 7.462963719323895e-05, 'layer1': 120, 'layer2': 327, 'layer3': 66}. Best is trial 104 with value: 0.9327898309005132.
Klebsiella_Pneumoniae | LPS | Optuna:  87%|████████▋ | 174/200 [3:30:14<33:07, 76.45s/it, best=0.933]Klebsiella_Pneumoniae | LPS | Optuna:  87%|████████▋ | 174/200 [3:30:14<33:07, 76.45s/it, best=0.933][I 2026-03-04 23:29:23,174] Trial 183 finished with value: 0.8575159784832961 and parameters: {'activation': 'relu', 'solver': 'adam', 'lr': 0.00753437706565289, 'layer1': 426, 'layer2': 169, 'layer3': 377}. Best is trial 172 with value: 0.8682843857718467.
Pseudomonas_Aeruginosa | LPS | Optuna:  92%|█████████▏| 184/200 [3:31:05<27:41, 103.82s/it, best=0.868]Pseudomonas_Aeruginosa | LPS | Optuna:  92%|█████████▏| 184/200 [3:31:05<27:41, 103.82s/it, best=0.868][I 2026-03-04 23:29:24,217] Trial 174 finished with value: 0.9313699746594264 and parameters: {'activation': 'tanh', 'solver': 'adam', 'lr': 0.00015617875654997494, 'layer1': 79, 'layer2': 281, 'layer3': 78}. Best is trial 104 with value: 0.9327898309005132.
Klebsiella_Pneumoniae | LPS | Optuna:  88%|████████▊ | 175/200 [3:31:06<28:46, 69.05s/it, best=0.933]Klebsiella_Pneumoniae | LPS | Optuna:  88%|████████▊ | 175/200 [3:31:06<28:46, 69.05s/it, best=0.933][I 2026-03-04 23:29:32,773] Trial 74 finished with value: 0.8618674153935973 and parameters: {'activation': 'relu', 'solver': 'adam', 'lr': 5.001936931016132e-05, 'layer1': 489, 'layer2': 18, 'layer3': 460}. Best is trial 73 with value: 0.864893646817533.
Escherichia_Coli | LPS | Optuna:  38%|███▊      | 75/200 [3:31:14<7:58:37, 229.74s/it, best=0.865]Escherichia_Coli | LPS | Optuna:  38%|███▊      | 75/200 [3:31:14<7:58:37, 229.74s/it, best=0.865][I 2026-03-04 23:29:55,283] Trial 159 finished with value: 0.890870405344064 and parameters: {'activation': 'identity', 'solver': 'adam', 'lr': 0.0002618077489197644, 'layer1': 267, 'layer2': 59, 'layer3': 159}. Best is trial 124 with value: 0.8938450095328893.
Staphylococcus_Aureus | LPS | Optuna:  80%|████████  | 160/200 [3:31:37<56:08, 84.21s/it, best=0.894]Staphylococcus_Aureus | LPS | Optuna:  80%|████████  | 160/200 [3:31:37<56:08, 84.21s/it, best=0.894][I 2026-03-04 23:30:35,682] Trial 175 finished with value: 0.9332398278164448 and parameters: {'activation': 'tanh', 'solver': 'adam', 'lr': 5.921179507999755e-05, 'layer1': 137, 'layer2': 315, 'layer3': 103}. Best is trial 175 with value: 0.9332398278164448.
Klebsiella_Pneumoniae | LPS | Optuna:  88%|████████▊ | 176/200 [3:32:17<27:54, 69.78s/it, best=0.933]Klebsiella_Pneumoniae | LPS | Optuna:  88%|████████▊ | 176/200 [3:32:17<27:54, 69.78s/it, best=0.933][I 2026-03-04 23:31:11,501] Trial 184 finished with value: 0.8622302624921027 and parameters: {'activation': 'relu', 'solver': 'adam', 'lr': 0.006305420584434553, 'layer1': 441, 'layer2': 216, 'layer3': 411}. Best is trial 172 with value: 0.8682843857718467.
Pseudomonas_Aeruginosa | LPS | Optuna:  92%|█████████▎| 185/200 [3:32:53<26:17, 105.17s/it, best=0.868]Pseudomonas_Aeruginosa | LPS | Optuna:  92%|█████████▎| 185/200 [3:32:53<26:17, 105.17s/it, best=0.868][I 2026-03-04 23:31:23,681] Trial 160 finished with value: 0.8918877996018185 and parameters: {'activation': 'identity', 'solver': 'adam', 'lr': 0.0002819263432535518, 'layer1': 261, 'layer2': 40, 'layer3': 169}. Best is trial 124 with value: 0.8938450095328893.
Staphylococcus_Aureus | LPS | Optuna:  80%|████████  | 161/200 [3:33:05<55:33, 85.47s/it, best=0.894]Staphylococcus_Aureus | LPS | Optuna:  80%|████████  | 161/200 [3:33:05<55:33, 85.47s/it, best=0.894][I 2026-03-04 23:31:32,757] Trial 75 finished with value: 0.7388067228206201 and parameters: {'activation': 'logistic', 'solver': 'adam', 'lr': 3.606639082493287e-05, 'layer1': 473, 'layer2': 80, 'layer3': 364}. Best is trial 73 with value: 0.864893646817533.
Escherichia_Coli | LPS | Optuna:  38%|███▊      | 76/200 [3:33:14<6:46:45, 196.82s/it, best=0.865]Escherichia_Coli | LPS | Optuna:  38%|███▊      | 76/200 [3:33:14<6:46:45, 196.82s/it, best=0.865][I 2026-03-04 23:32:01,294] Trial 176 finished with value: 0.9324991298650085 and parameters: {'activation': 'tanh', 'solver': 'adam', 'lr': 5.4756430363160855e-05, 'layer1': 135, 'layer2': 290, 'layer3': 107}. Best is trial 175 with value: 0.9332398278164448.
