Pseudomonas_Aeruginosa | LPS | Optuna:  44%|████▎     | 87/200 [1:31:40<2:34:08, 81.85s/it, best=0.865]Pseudomonas_Aeruginosa | LPS | Optuna:  44%|████▎     | 87/200 [1:31:40<2:34:08, 81.85s/it, best=0.865][I 2026-03-04 21:30:22,104] Trial 84 finished with value: 0.9306009479162454 and parameters: {'activation': 'identity', 'solver': 'adam', 'lr': 5.872787751452457e-05, 'layer1': 90, 'layer2': 485, 'layer3': 121}. Best is trial 41 with value: 0.9325947076370852.
Klebsiella_Pneumoniae | LPS | Optuna:  42%|████▎     | 85/200 [1:32:04<2:02:20, 63.83s/it, best=0.933]Klebsiella_Pneumoniae | LPS | Optuna:  42%|████▎     | 85/200 [1:32:04<2:02:20, 63.83s/it, best=0.933][I 2026-03-04 21:30:44,721] Trial 63 finished with value: 0.8924426271239211 and parameters: {'activation': 'identity', 'solver': 'adam', 'lr': 0.0005581046835511508, 'layer1': 208, 'layer2': 32, 'layer3': 100}. Best is trial 22 with value: 0.8930759779387886.
Staphylococcus_Aureus | LPS | Optuna:  32%|███▏      | 64/200 [1:32:26<3:13:27, 85.35s/it, best=0.893]Staphylococcus_Aureus | LPS | Optuna:  32%|███▏      | 64/200 [1:32:26<3:13:27, 85.35s/it, best=0.893][I 2026-03-04 21:30:52,626] Trial 87 finished with value: 0.8261898244308833 and parameters: {'activation': 'logistic', 'solver': 'adam', 'lr': 7.200633770677456e-05, 'layer1': 388, 'layer2': 213, 'layer3': 49}. Best is trial 49 with value: 0.8647157569215889.
Pseudomonas_Aeruginosa | LPS | Optuna:  44%|████▍     | 88/200 [1:32:34<2:17:33, 73.69s/it, best=0.865]Pseudomonas_Aeruginosa | LPS | Optuna:  44%|████▍     | 88/200 [1:32:34<2:17:33, 73.69s/it, best=0.865][I 2026-03-04 21:31:48,836] Trial 36 finished with value: 0.8623062191889824 and parameters: {'activation': 'relu', 'solver': 'adam', 'lr': 1.3295023017513299e-05, 'layer1': 290, 'layer2': 338, 'layer3': 417}. Best is trial 14 with value: 0.863668804271893.
Escherichia_Coli | LPS | Optuna:  18%|█▊        | 37/200 [1:33:30<10:03:48, 222.26s/it, best=0.864]Escherichia_Coli | LPS | Optuna:  18%|█▊        | 37/200 [1:33:30<10:03:48, 222.26s/it, best=0.864][I 2026-03-04 21:31:56,204] Trial 88 finished with value: 0.8608176539859528 and parameters: {'activation': 'relu', 'solver': 'adam', 'lr': 0.0006133244816199231, 'layer1': 324, 'layer2': 171, 'layer3': 153}. Best is trial 49 with value: 0.8647157569215889.
Pseudomonas_Aeruginosa | LPS | Optuna:  44%|████▍     | 89/200 [1:33:38<2:10:42, 70.66s/it, best=0.865]Pseudomonas_Aeruginosa | LPS | Optuna:  44%|████▍     | 89/200 [1:33:38<2:10:42, 70.66s/it, best=0.865][I 2026-03-04 21:32:03,078] Trial 64 finished with value: 0.8903576073414768 and parameters: {'activation': 'identity', 'solver': 'adam', 'lr': 0.0003305404722667945, 'layer1': 221, 'layer2': 33, 'layer3': 102}. Best is trial 22 with value: 0.8930759779387886.
Staphylococcus_Aureus | LPS | Optuna:  32%|███▎      | 65/200 [1:33:45<3:07:18, 83.25s/it, best=0.893]Staphylococcus_Aureus | LPS | Optuna:  32%|███▎      | 65/200 [1:33:45<3:07:18, 83.25s/it, best=0.893][I 2026-03-04 21:32:33,044] Trial 85 finished with value: 0.9299947839502707 and parameters: {'activation': 'relu', 'solver': 'adam', 'lr': 4.850697526617257e-05, 'layer1': 182, 'layer2': 420, 'layer3': 145}. Best is trial 41 with value: 0.9325947076370852.
Klebsiella_Pneumoniae | LPS | Optuna:  43%|████▎     | 86/200 [1:34:15<2:39:31, 83.96s/it, best=0.933]Klebsiella_Pneumoniae | LPS | Optuna:  43%|████▎     | 86/200 [1:34:15<2:39:31, 83.96s/it, best=0.933][I 2026-03-04 21:33:32,469] Trial 89 finished with value: 0.8604593789728756 and parameters: {'activation': 'relu', 'solver': 'adam', 'lr': 0.00013047934087049591, 'layer1': 353, 'layer2': 322, 'layer3': 229}. Best is trial 49 with value: 0.8647157569215889.
Pseudomonas_Aeruginosa | LPS | Optuna:  45%|████▌     | 90/200 [1:35:14<2:23:37, 78.34s/it, best=0.865]Pseudomonas_Aeruginosa | LPS | Optuna:  45%|████▌     | 90/200 [1:35:14<2:23:37, 78.34s/it, best=0.865][I 2026-03-04 21:33:38,456] Trial 37 finished with value: 0.7388067228206201 and parameters: {'activation': 'logistic', 'solver': 'adam', 'lr': 4.056974067526422e-06, 'layer1': 296, 'layer2': 331, 'layer3': 412}. Best is trial 14 with value: 0.863668804271893.
Escherichia_Coli | LPS | Optuna:  19%|█▉        | 38/200 [1:35:20<8:28:51, 188.47s/it, best=0.864] Escherichia_Coli | LPS | Optuna:  19%|█▉        | 38/200 [1:35:20<8:28:51, 188.47s/it, best=0.864][I 2026-03-04 21:33:49,119] Trial 86 finished with value: 0.9316676643477937 and parameters: {'activation': 'tanh', 'solver': 'adam', 'lr': 0.00011298078386890897, 'layer1': 230, 'layer2': 334, 'layer3': 265}. Best is trial 41 with value: 0.9325947076370852.
Klebsiella_Pneumoniae | LPS | Optuna:  44%|████▎     | 87/200 [1:35:31<2:33:40, 81.60s/it, best=0.933]Klebsiella_Pneumoniae | LPS | Optuna:  44%|████▎     | 87/200 [1:35:31<2:33:40, 81.60s/it, best=0.933][I 2026-03-04 21:33:55,809] Trial 90 finished with value: 0.8261898244308833 and parameters: {'activation': 'tanh', 'solver': 'adam', 'lr': 4.9187297440662034e-05, 'layer1': 49, 'layer2': 27, 'layer3': 130}. Best is trial 49 with value: 0.8647157569215889.
Pseudomonas_Aeruginosa | LPS | Optuna:  46%|████▌     | 91/200 [1:35:38<1:52:20, 61.84s/it, best=0.865]Pseudomonas_Aeruginosa | LPS | Optuna:  46%|████▌     | 91/200 [1:35:38<1:52:20, 61.84s/it, best=0.865][I 2026-03-04 21:34:06,801] Trial 65 finished with value: 0.8917815423381775 and parameters: {'activation': 'identity', 'solver': 'adam', 'lr': 0.0005377185832151483, 'layer1': 494, 'layer2': 49, 'layer3': 122}. Best is trial 22 with value: 0.8930759779387886.
Staphylococcus_Aureus | LPS | Optuna:  33%|███▎      | 66/200 [1:35:48<3:33:02, 95.39s/it, best=0.893]Staphylococcus_Aureus | LPS | Optuna:  33%|███▎      | 66/200 [1:35:48<3:33:02, 95.39s/it, best=0.893][I 2026-03-04 21:34:38,537] Trial 87 finished with value: 0.9293549842804273 and parameters: {'activation': 'identity', 'solver': 'adam', 'lr': 0.00032382258912970957, 'layer1': 105, 'layer2': 499, 'layer3': 304}. Best is trial 41 with value: 0.9325947076370852.
Klebsiella_Pneumoniae | LPS | Optuna:  44%|████▍     | 88/200 [1:36:20<2:14:17, 71.94s/it, best=0.933]Klebsiella_Pneumoniae | LPS | Optuna:  44%|████▍     | 88/200 [1:36:20<2:14:17, 71.94s/it, best=0.933][I 2026-03-04 21:35:10,279] Trial 91 finished with value: 0.8538732857155583 and parameters: {'activation': 'relu', 'solver': 'adam', 'lr': 0.0001033530604955646, 'layer1': 118, 'layer2': 95, 'layer3': 87}. Best is trial 49 with value: 0.8647157569215889.
Pseudomonas_Aeruginosa | LPS | Optuna:  46%|████▌     | 92/200 [1:36:52<1:58:07, 65.63s/it, best=0.865]Pseudomonas_Aeruginosa | LPS | Optuna:  46%|████▌     | 92/200 [1:36:52<1:58:07, 65.63s/it, best=0.865][I 2026-03-04 21:35:21,406] Trial 66 finished with value: 0.8898959517163119 and parameters: {'activation': 'identity', 'solver': 'adam', 'lr': 0.002202448914748146, 'layer1': 284, 'layer2': 118, 'layer3': 90}. Best is trial 22 with value: 0.8930759779387886.
Staphylococcus_Aureus | LPS | Optuna:  34%|███▎      | 67/200 [1:37:03<3:17:37, 89.16s/it, best=0.893]Staphylococcus_Aureus | LPS | Optuna:  34%|███▎      | 67/200 [1:37:03<3:17:37, 89.16s/it, best=0.893][I 2026-03-04 21:35:23,637] Trial 88 finished with value: 0.9310656006264159 and parameters: {'activation': 'tanh', 'solver': 'adam', 'lr': 0.0007292166256933387, 'layer1': 126, 'layer2': 436, 'layer3': 162}. Best is trial 41 with value: 0.9325947076370852.
Klebsiella_Pneumoniae | LPS | Optuna:  44%|████▍     | 89/200 [1:37:05<1:58:11, 63.89s/it, best=0.933]Klebsiella_Pneumoniae | LPS | Optuna:  44%|████▍     | 89/200 [1:37:05<1:58:11, 63.89s/it, best=0.933][I 2026-03-04 21:35:50,038] Trial 92 finished with value: 0.8562696003572716 and parameters: {'activation': 'relu', 'solver': 'adam', 'lr': 0.00362306437719753, 'layer1': 145, 'layer2': 131, 'layer3': 69}. Best is trial 49 with value: 0.8647157569215889.
Pseudomonas_Aeruginosa | LPS | Optuna:  46%|████▋     | 93/200 [1:37:32<1:43:11, 57.87s/it, best=0.865]Pseudomonas_Aeruginosa | LPS | Optuna:  46%|████▋     | 93/200 [1:37:32<1:43:11, 57.87s/it, best=0.865][I 2026-03-04 21:36:38,339] Trial 93 finished with value: 0.8274163127179349 and parameters: {'activation': 'relu', 'solver': 'adam', 'lr': 3.013779041432989e-06, 'layer1': 275, 'layer2': 42, 'layer3': 109}. Best is trial 49 with value: 0.8647157569215889.
Pseudomonas_Aeruginosa | LPS | Optuna:  47%|████▋     | 94/200 [1:38:20<1:37:09, 55.00s/it, best=0.865]Pseudomonas_Aeruginosa | LPS | Optuna:  47%|████▋     | 94/200 [1:38:20<1:37:09, 55.00s/it, best=0.865][I 2026-03-04 21:36:46,987] Trial 89 finished with value: 0.8955187306289869 and parameters: {'activation': 'logistic', 'solver': 'adam', 'lr': 0.001201910917870737, 'layer1': 295, 'layer2': 201, 'layer3': 30}. Best is trial 41 with value: 0.9325947076370852.
Klebsiella_Pneumoniae | LPS | Optuna:  45%|████▌     | 90/200 [1:38:29<2:07:50, 69.73s/it, best=0.933]Klebsiella_Pneumoniae | LPS | Optuna:  45%|████▌     | 90/200 [1:38:29<2:07:50, 69.73s/it, best=0.933][I 2026-03-04 21:36:49,874] Trial 38 finished with value: 0.6051292623122074 and parameters: {'activation': 'relu', 'solver': 'sgd', 'lr': 1.5258862626954865e-05, 'layer1': 274, 'layer2': 299, 'layer3': 371}. Best is trial 14 with value: 0.863668804271893.
Escherichia_Coli | LPS | Optuna:  20%|█▉        | 39/200 [1:38:31<8:28:05, 189.35s/it, best=0.864]Escherichia_Coli | LPS | Optuna:  20%|█▉        | 39/200 [1:38:31<8:28:05, 189.35s/it, best=0.864][I 2026-03-04 21:37:53,410] Trial 67 finished with value: 0.8867957699296356 and parameters: {'activation': 'relu', 'solver': 'adam', 'lr': 0.00012471925592484067, 'layer1': 182, 'layer2': 86, 'layer3': 129}. Best is trial 22 with value: 0.8930759779387886.
Staphylococcus_Aureus | LPS | Optuna:  34%|███▍      | 68/200 [1:39:35<3:57:37, 108.01s/it, best=0.893]Staphylococcus_Aureus | LPS | Optuna:  34%|███▍      | 68/200 [1:39:35<3:57:37, 108.01s/it, best=0.893][I 2026-03-04 21:38:07,593] Trial 90 finished with value: 0.9300300696485474 and parameters: {'activation': 'identity', 'solver': 'adam', 'lr': 0.0002500672668645211, 'layer1': 337, 'layer2': 305, 'layer3': 190}. Best is trial 41 with value: 0.9325947076370852.
Klebsiella_Pneumoniae | LPS | Optuna:  46%|████▌     | 91/200 [1:39:49<2:12:36, 72.99s/it, best=0.933]Klebsiella_Pneumoniae | LPS | Optuna:  46%|████▌     | 91/200 [1:39:49<2:12:36, 72.99s/it, best=0.933][I 2026-03-04 21:38:11,167] Trial 94 finished with value: 0.8619583349764041 and parameters: {'activation': 'relu', 'solver': 'adam', 'lr': 0.0008781956177819806, 'layer1': 261, 'layer2': 147, 'layer3': 177}. Best is trial 49 with value: 0.8647157569215889.
Pseudomonas_Aeruginosa | LPS | Optuna:  48%|████▊     | 95/200 [1:39:53<1:56:06, 66.35s/it, best=0.865]Pseudomonas_Aeruginosa | LPS | Optuna:  48%|████▊     | 95/200 [1:39:53<1:56:06, 66.35s/it, best=0.865][I 2026-03-04 21:38:18,708] Trial 39 finished with value: 0.7406159647563688 and parameters: {'activation': 'relu', 'solver': 'adam', 'lr': 4.17760100558602e-06, 'layer1': 233, 'layer2': 380, 'layer3': 500}. Best is trial 14 with value: 0.863668804271893.
Escherichia_Coli | LPS | Optuna:  20%|██        | 40/200 [1:40:00<7:04:31, 159.20s/it, best=0.864]Escherichia_Coli | LPS | Optuna:  20%|██        | 40/200 [1:40:00<7:04:31, 159.20s/it, best=0.864][I 2026-03-04 21:38:37,002] Trial 68 finished with value: 0.8016455484651599 and parameters: {'activation': 'identity', 'solver': 'sgd', 'lr': 0.0010383821098289181, 'layer1': 244, 'layer2': 63, 'layer3': 107}. Best is trial 22 with value: 0.8930759779387886.
Staphylococcus_Aureus | LPS | Optuna:  34%|███▍      | 69/200 [1:40:19<3:13:37, 88.68s/it, best=0.893] Staphylococcus_Aureus | LPS | Optuna:  34%|███▍      | 69/200 [1:40:19<3:13:37, 88.68s/it, best=0.893][I 2026-03-04 21:39:10,221] Trial 91 finished with value: 0.9309292213595907 and parameters: {'activation': 'tanh', 'solver': 'adam', 'lr': 0.00011976471918835331, 'layer1': 231, 'layer2': 332, 'layer3': 253}. Best is trial 41 with value: 0.9325947076370852.
Klebsiella_Pneumoniae | LPS | Optuna:  46%|████▌     | 92/200 [1:40:52<2:05:47, 69.88s/it, best=0.933]Klebsiella_Pneumoniae | LPS | Optuna:  46%|████▌     | 92/200 [1:40:52<2:05:47, 69.88s/it, best=0.933][I 2026-03-04 21:39:19,800] Trial 95 finished with value: 0.8592399330284216 and parameters: {'activation': 'identity', 'solver': 'adam', 'lr': 0.0002612853727402637, 'layer1': 295, 'layer2': 218, 'layer3': 465}. Best is trial 49 with value: 0.8647157569215889.
Pseudomonas_Aeruginosa | LPS | Optuna:  48%|████▊     | 96/200 [1:41:02<1:56:11, 67.03s/it, best=0.865]Pseudomonas_Aeruginosa | LPS | Optuna:  48%|████▊     | 96/200 [1:41:02<1:56:11, 67.03s/it, best=0.865][I 2026-03-04 21:39:19,948] Trial 40 finished with value: 0.7397418157115234 and parameters: {'activation': 'tanh', 'solver': 'adam', 'lr': 6.786464591671078e-06, 'layer1': 174, 'layer2': 271, 'layer3': 346}. Best is trial 14 with value: 0.863668804271893.
Escherichia_Coli | LPS | Optuna:  20%|██        | 41/200 [1:41:02<5:43:59, 129.81s/it, best=0.864]Escherichia_Coli | LPS | Optuna:  20%|██        | 41/200 [1:41:02<5:43:59, 129.81s/it, best=0.864][I 2026-03-04 21:40:06,554] Trial 96 finished with value: 0.6673350619274439 and parameters: {'activation': 'relu', 'solver': 'sgd', 'lr': 2.916958555349444e-05, 'layer1': 170, 'layer2': 188, 'layer3': 90}. Best is trial 49 with value: 0.8647157569215889.
Pseudomonas_Aeruginosa | LPS | Optuna:  48%|████▊     | 97/200 [1:41:48<1:44:37, 60.95s/it, best=0.865]Pseudomonas_Aeruginosa | LPS | Optuna:  48%|████▊     | 97/200 [1:41:48<1:44:37, 60.95s/it, best=0.865][I 2026-03-04 21:40:34,400] Trial 92 finished with value: 0.9305880216206027 and parameters: {'activation': 'tanh', 'solver': 'adam', 'lr': 3.5803337572641656e-05, 'layer1': 111, 'layer2': 320, 'layer3': 237}. Best is trial 41 with value: 0.9325947076370852.
Klebsiella_Pneumoniae | LPS | Optuna:  46%|████▋     | 93/200 [1:42:16<2:12:16, 74.17s/it, best=0.933]Klebsiella_Pneumoniae | LPS | Optuna:  46%|████▋     | 93/200 [1:42:16<2:12:16, 74.17s/it, best=0.933][I 2026-03-04 21:40:35,428] Trial 69 finished with value: 0.8767001783732586 and parameters: {'activation': 'tanh', 'solver': 'adam', 'lr': 0.0038402598920130515, 'layer1': 172, 'layer2': 42, 'layer3': 150}. Best is trial 22 with value: 0.8930759779387886.
Staphylococcus_Aureus | LPS | Optuna:  35%|███▌      | 70/200 [1:42:17<3:31:28, 97.61s/it, best=0.893]Staphylococcus_Aureus | LPS | Optuna:  35%|███▌      | 70/200 [1:42:17<3:31:28, 97.61s/it, best=0.893][I 2026-03-04 21:41:38,490] Trial 93 finished with value: 0.9291753881068837 and parameters: {'activation': 'tanh', 'solver': 'adam', 'lr': 0.00048267355933782533, 'layer1': 279, 'layer2': 355, 'layer3': 262}. Best is trial 41 with value: 0.9325947076370852.
Klebsiella_Pneumoniae | LPS | Optuna:  47%|████▋     | 94/200 [1:43:20<2:05:41, 71.15s/it, best=0.933]Klebsiella_Pneumoniae | LPS | Optuna:  47%|████▋     | 94/200 [1:43:20<2:05:41, 71.15s/it, best=0.933][I 2026-03-04 21:41:40,097] Trial 97 finished with value: 0.8578445468868947 and parameters: {'activation': 'relu', 'solver': 'adam', 'lr': 0.0022156460532417083, 'layer1': 445, 'layer2': 10, 'layer3': 124}. Best is trial 49 with value: 0.8647157569215889.
Pseudomonas_Aeruginosa | LPS | Optuna:  49%|████▉     | 98/200 [1:43:22<2:00:14, 70.73s/it, best=0.865]Pseudomonas_Aeruginosa | LPS | Optuna:  49%|████▉     | 98/200 [1:43:22<2:00:14, 70.73s/it, best=0.865][I 2026-03-04 21:42:11,920] Trial 70 finished with value: 0.8911778834140179 and parameters: {'activation': 'identity', 'solver': 'adam', 'lr': 0.0001783575540368105, 'layer1': 217, 'layer2': 98, 'layer3': 78}. Best is trial 22 with value: 0.8930759779387886.
Staphylococcus_Aureus | LPS | Optuna:  36%|███▌      | 71/200 [1:43:54<3:29:08, 97.27s/it, best=0.893]Staphylococcus_Aureus | LPS | Optuna:  36%|███▌      | 71/200 [1:43:54<3:29:08, 97.27s/it, best=0.893][I 2026-03-04 21:42:47,435] Trial 98 finished with value: 0.8613333822203133 and parameters: {'activation': 'relu', 'solver': 'adam', 'lr': 0.004768198904691372, 'layer1': 236, 'layer2': 499, 'layer3': 68}. Best is trial 49 with value: 0.8647157569215889.
Pseudomonas_Aeruginosa | LPS | Optuna:  50%|████▉     | 99/200 [1:44:29<1:57:20, 69.71s/it, best=0.865]Pseudomonas_Aeruginosa | LPS | Optuna:  50%|████▉     | 99/200 [1:44:29<1:57:20, 69.71s/it, best=0.865][I 2026-03-04 21:42:57,852] Trial 94 finished with value: 0.9302222928543629 and parameters: {'activation': 'tanh', 'solver': 'adam', 'lr': 7.733774306930339e-05, 'layer1': 256, 'layer2': 472, 'layer3': 379}. Best is trial 41 with value: 0.9325947076370852.
Klebsiella_Pneumoniae | LPS | Optuna:  48%|████▊     | 95/200 [1:44:40<2:08:49, 73.61s/it, best=0.933]Klebsiella_Pneumoniae | LPS | Optuna:  48%|████▊     | 95/200 [1:44:40<2:08:49, 73.61s/it, best=0.933][I 2026-03-04 21:43:24,599] Trial 71 finished with value: 0.8927588473044805 and parameters: {'activation': 'identity', 'solver': 'adam', 'lr': 0.000573114518838013, 'layer1': 208, 'layer2': 12, 'layer3': 58}. Best is trial 22 with value: 0.8930759779387886.
Staphylococcus_Aureus | LPS | Optuna:  36%|███▌      | 72/200 [1:45:06<3:11:46, 89.89s/it, best=0.893]Staphylococcus_Aureus | LPS | Optuna:  36%|███▌      | 72/200 [1:45:06<3:11:46, 89.89s/it, best=0.893][I 2026-03-04 21:43:40,678] Trial 99 finished with value: 0.8604004448612693 and parameters: {'activation': 'tanh', 'solver': 'adam', 'lr': 0.001145525276641776, 'layer1': 198, 'layer2': 240, 'layer3': 489}. Best is trial 49 with value: 0.8647157569215889.
Pseudomonas_Aeruginosa | LPS | Optuna:  50%|█████     | 100/200 [1:45:22<1:47:57, 64.77s/it, best=0.865]Pseudomonas_Aeruginosa | LPS | Optuna:  50%|█████     | 100/200 [1:45:22<1:47:57, 64.77s/it, best=0.865][I 2026-03-04 21:44:11,408] Trial 95 finished with value: 0.9305554585003021 and parameters: {'activation': 'tanh', 'solver': 'adam', 'lr': 0.00010087747596449631, 'layer1': 193, 'layer2': 338, 'layer3': 207}. Best is trial 41 with value: 0.9325947076370852.
Klebsiella_Pneumoniae | LPS | Optuna:  48%|████▊     | 96/200 [1:45:53<2:07:33, 73.59s/it, best=0.933]Klebsiella_Pneumoniae | LPS | Optuna:  48%|████▊     | 96/200 [1:45:53<2:07:33, 73.59s/it, best=0.933][I 2026-03-04 21:44:28,945] Trial 41 finished with value: 0.8616285298377766 and parameters: {'activation': 'relu', 'solver': 'adam', 'lr': 1.1070759889398544e-05, 'layer1': 330, 'layer2': 365, 'layer3': 480}. Best is trial 14 with value: 0.863668804271893.
Escherichia_Coli | LPS | Optuna:  21%|██        | 42/200 [1:46:11<8:03:23, 183.57s/it, best=0.864]Escherichia_Coli | LPS | Optuna:  21%|██        | 42/200 [1:46:11<8:03:23, 183.57s/it, best=0.864][I 2026-03-04 21:45:00,039] Trial 72 finished with value: 0.8899427571858431 and parameters: {'activation': 'identity', 'solver': 'adam', 'lr': 0.00028223793439417094, 'layer1': 259, 'layer2': 74, 'layer3': 48}. Best is trial 22 with value: 0.8930759779387886.
Staphylococcus_Aureus | LPS | Optuna:  36%|███▋      | 73/200 [1:46:42<3:13:47, 91.56s/it, best=0.893]Staphylococcus_Aureus | LPS | Optuna:  36%|███▋      | 73/200 [1:46:42<3:13:47, 91.56s/it, best=0.893][I 2026-03-04 21:45:03,726] Trial 96 finished with value: 0.8746470562584285 and parameters: {'activation': 'tanh', 'solver': 'adam', 'lr': 0.009858695803900948, 'layer1': 208, 'layer2': 427, 'layer3': 67}. Best is trial 41 with value: 0.9325947076370852.
Klebsiella_Pneumoniae | LPS | Optuna:  48%|████▊     | 97/200 [1:46:45<1:55:22, 67.21s/it, best=0.933]Klebsiella_Pneumoniae | LPS | Optuna:  48%|████▊     | 97/200 [1:46:45<1:55:22, 67.21s/it, best=0.933][I 2026-03-04 21:45:24,733] Trial 100 finished with value: 0.8645066856486319 and parameters: {'activation': 'identity', 'solver': 'adam', 'lr': 0.001521272607900683, 'layer1': 403, 'layer2': 205, 'layer3': 191}. Best is trial 49 with value: 0.8647157569215889.
Pseudomonas_Aeruginosa | LPS | Optuna:  50%|█████     | 101/200 [1:47:06<2:06:19, 76.56s/it, best=0.865]Pseudomonas_Aeruginosa | LPS | Optuna:  50%|█████     | 101/200 [1:47:06<2:06:19, 76.56s/it, best=0.865][I 2026-03-04 21:45:56,937] Trial 97 finished with value: 0.8749479158049146 and parameters: {'activation': 'tanh', 'solver': 'sgd', 'lr': 4.154460525957694e-05, 'layer1': 157, 'layer2': 400, 'layer3': 91}. Best is trial 41 with value: 0.9325947076370852.
Klebsiella_Pneumoniae | LPS | Optuna:  49%|████▉     | 98/200 [1:47:39<1:47:07, 63.01s/it, best=0.933]Klebsiella_Pneumoniae | LPS | Optuna:  49%|████▉     | 98/200 [1:47:39<1:47:07, 63.01s/it, best=0.933][I 2026-03-04 21:46:09,709] Trial 73 finished with value: 0.892857514965339 and parameters: {'activation': 'identity', 'solver': 'adam', 'lr': 0.0005146328800103814, 'layer1': 204, 'layer2': 11, 'layer3': 116}. Best is trial 22 with value: 0.8930759779387886.
Staphylococcus_Aureus | LPS | Optuna:  37%|███▋      | 74/200 [1:47:51<2:58:28, 84.99s/it, best=0.893]Staphylococcus_Aureus | LPS | Optuna:  37%|███▋      | 74/200 [1:47:51<2:58:28, 84.99s/it, best=0.893][I 2026-03-04 21:46:31,856] Trial 101 finished with value: 0.8626344388334382 and parameters: {'activation': 'identity', 'solver': 'adam', 'lr': 0.0017447323725014261, 'layer1': 371, 'layer2': 204, 'layer3': 199}. Best is trial 49 with value: 0.8647157569215889.
Pseudomonas_Aeruginosa | LPS | Optuna:  51%|█████     | 102/200 [1:48:14<2:00:25, 73.73s/it, best=0.865]Pseudomonas_Aeruginosa | LPS | Optuna:  51%|█████     | 102/200 [1:48:14<2:00:25, 73.73s/it, best=0.865][I 2026-03-04 21:46:40,644] Trial 98 finished with value: 0.929771537158351 and parameters: {'activation': 'identity', 'solver': 'adam', 'lr': 0.00019340747135535304, 'layer1': 69, 'layer2': 314, 'layer3': 277}. Best is trial 41 with value: 0.9325947076370852.
