Pseudomonas_Aeruginosa | DirectMulti | Optuna:  62%|██████▏   | 123/200 [3:07:59<2:06:15, 98.38s/it, best=0.866]Pseudomonas_Aeruginosa | DirectMulti | Optuna:  62%|██████▏   | 123/200 [3:07:59<2:06:15, 98.38s/it, best=0.866][I 2026-03-05 03:02:53,943] Trial 132 finished with value: 0.9322660802940301 and parameters: {'activation': 'tanh', 'solver': 'adam', 'lr': 7.548220860905372e-05, 'layer1': 95, 'layer2': 65, 'layer3': 337}. Best is trial 132 with value: 0.9322660802940301.
Klebsiella_Pneumoniae | DirectMulti | Optuna:  66%|██████▋   | 133/200 [3:01:26<1:40:02, 89.59s/it, best=0.932]Klebsiella_Pneumoniae | DirectMulti | Optuna:  66%|██████▋   | 133/200 [3:01:26<1:40:02, 89.59s/it, best=0.932][I 2026-03-05 03:03:08,726] Trial 64 finished with value: 0.8916563959021921 and parameters: {'activation': 'identity', 'solver': 'adam', 'lr': 9.869986620119164e-06, 'layer1': 311, 'layer2': 370, 'layer3': 25}. Best is trial 62 with value: 0.8933826282053527.
Staphylococcus_Aureus | DirectMulti | Optuna:  32%|███▎      | 65/200 [2:28:26<10:26:53, 278.62s/it, best=0.893]Staphylococcus_Aureus | DirectMulti | Optuna:  32%|███▎      | 65/200 [2:28:26<10:26:53, 278.62s/it, best=0.893][I 2026-03-05 03:03:49,013] Trial 123 finished with value: 0.8644422698815148 and parameters: {'activation': 'relu', 'solver': 'adam', 'lr': 0.002749245099824891, 'layer1': 454, 'layer2': 444, 'layer3': 313}. Best is trial 71 with value: 0.8659155749694897.
Pseudomonas_Aeruginosa | DirectMulti | Optuna:  62%|██████▏   | 124/200 [3:09:43<2:06:43, 100.05s/it, best=0.866]Pseudomonas_Aeruginosa | DirectMulti | Optuna:  62%|██████▏   | 124/200 [3:09:43<2:06:43, 100.05s/it, best=0.866][I 2026-03-05 03:04:09,557] Trial 133 finished with value: 0.931133698893882 and parameters: {'activation': 'tanh', 'solver': 'adam', 'lr': 0.00010984512457405786, 'layer1': 96, 'layer2': 60, 'layer3': 306}. Best is trial 132 with value: 0.9322660802940301.
Klebsiella_Pneumoniae | DirectMulti | Optuna:  67%|██████▋   | 134/200 [3:02:41<1:33:56, 85.40s/it, best=0.932]Klebsiella_Pneumoniae | DirectMulti | Optuna:  67%|██████▋   | 134/200 [3:02:41<1:33:56, 85.40s/it, best=0.932][I 2026-03-05 03:04:14,368] Trial 133 finished with value: 0.8638755703666232 and parameters: {'activation': 'relu', 'solver': 'adam', 'lr': 2.5282331426398427e-05, 'layer1': 375, 'layer2': 63, 'layer3': 450}. Best is trial 73 with value: 0.864893646817533.
Escherichia_Coli | LPS | Optuna:  67%|██████▋   | 134/200 [7:05:56<5:02:56, 275.41s/it, best=0.865]Escherichia_Coli | LPS | Optuna:  67%|██████▋   | 134/200 [7:05:56<5:02:56, 275.41s/it, best=0.865][I 2026-03-05 03:05:34,007] Trial 134 finished with value: 0.9310800633219815 and parameters: {'activation': 'tanh', 'solver': 'adam', 'lr': 5.7887926204425625e-05, 'layer1': 68, 'layer2': 39, 'layer3': 356}. Best is trial 132 with value: 0.9322660802940301.
Klebsiella_Pneumoniae | DirectMulti | Optuna:  68%|██████▊   | 135/200 [3:04:06<1:32:12, 85.11s/it, best=0.932]Klebsiella_Pneumoniae | DirectMulti | Optuna:  68%|██████▊   | 135/200 [3:04:06<1:32:12, 85.11s/it, best=0.932][I 2026-03-05 03:05:53,644] Trial 124 finished with value: 0.863467042135038 and parameters: {'activation': 'relu', 'solver': 'adam', 'lr': 0.0026998501533113, 'layer1': 425, 'layer2': 450, 'layer3': 318}. Best is trial 71 with value: 0.8659155749694897.
Pseudomonas_Aeruginosa | DirectMulti | Optuna:  62%|██████▎   | 125/200 [3:11:47<2:14:16, 107.42s/it, best=0.866]Pseudomonas_Aeruginosa | DirectMulti | Optuna:  62%|██████▎   | 125/200 [3:11:47<2:14:16, 107.42s/it, best=0.866][I 2026-03-05 03:06:43,328] Trial 135 finished with value: 0.9305653423214799 and parameters: {'activation': 'tanh', 'solver': 'adam', 'lr': 0.00013785974266056452, 'layer1': 130, 'layer2': 143, 'layer3': 315}. Best is trial 132 with value: 0.9322660802940301.
Klebsiella_Pneumoniae | DirectMulti | Optuna:  68%|██████▊   | 136/200 [3:05:15<1:25:44, 80.38s/it, best=0.932]Klebsiella_Pneumoniae | DirectMulti | Optuna:  68%|██████▊   | 136/200 [3:05:15<1:25:44, 80.38s/it, best=0.932][I 2026-03-05 03:07:25,156] Trial 65 finished with value: 0.8931518787151613 and parameters: {'activation': 'identity', 'solver': 'adam', 'lr': 1.7087522355841843e-05, 'layer1': 339, 'layer2': 380, 'layer3': 85}. Best is trial 62 with value: 0.8933826282053527.
Staphylococcus_Aureus | DirectMulti | Optuna:  33%|███▎      | 66/200 [2:32:42<10:07:22, 271.96s/it, best=0.893]Staphylococcus_Aureus | DirectMulti | Optuna:  33%|███▎      | 66/200 [2:32:42<10:07:22, 271.96s/it, best=0.893][I 2026-03-05 03:07:26,101] Trial 125 finished with value: 0.8598488070901359 and parameters: {'activation': 'relu', 'solver': 'adam', 'lr': 0.002430652415808303, 'layer1': 392, 'layer2': 449, 'layer3': 265}. Best is trial 71 with value: 0.8659155749694897.
Pseudomonas_Aeruginosa | DirectMulti | Optuna:  63%|██████▎   | 126/200 [3:13:20<2:06:57, 102.93s/it, best=0.866]Pseudomonas_Aeruginosa | DirectMulti | Optuna:  63%|██████▎   | 126/200 [3:13:20<2:06:57, 102.93s/it, best=0.866][I 2026-03-05 03:08:15,461] Trial 136 finished with value: 0.9292056922898242 and parameters: {'activation': 'relu', 'solver': 'adam', 'lr': 8.745603665448217e-05, 'layer1': 81, 'layer2': 83, 'layer3': 339}. Best is trial 132 with value: 0.9322660802940301.
Klebsiella_Pneumoniae | DirectMulti | Optuna:  68%|██████▊   | 137/200 [3:06:47<1:28:05, 83.90s/it, best=0.932]Klebsiella_Pneumoniae | DirectMulti | Optuna:  68%|██████▊   | 137/200 [3:06:47<1:28:05, 83.90s/it, best=0.932][I 2026-03-05 03:09:05,837] Trial 126 finished with value: 0.8650443429094901 and parameters: {'activation': 'relu', 'solver': 'adam', 'lr': 0.0045579008958714865, 'layer1': 426, 'layer2': 350, 'layer3': 310}. Best is trial 71 with value: 0.8659155749694897.
Pseudomonas_Aeruginosa | DirectMulti | Optuna:  64%|██████▎   | 127/200 [3:14:59<2:04:04, 101.97s/it, best=0.866]Pseudomonas_Aeruginosa | DirectMulti | Optuna:  64%|██████▎   | 127/200 [3:14:59<2:04:04, 101.97s/it, best=0.866][I 2026-03-05 03:09:28,605] Trial 137 finished with value: 0.9296184077938425 and parameters: {'activation': 'identity', 'solver': 'adam', 'lr': 5.002371227978198e-05, 'layer1': 90, 'layer2': 126, 'layer3': 371}. Best is trial 132 with value: 0.9322660802940301.
Klebsiella_Pneumoniae | DirectMulti | Optuna:  69%|██████▉   | 138/200 [3:08:00<1:23:21, 80.67s/it, best=0.932]Klebsiella_Pneumoniae | DirectMulti | Optuna:  69%|██████▉   | 138/200 [3:08:00<1:23:21, 80.67s/it, best=0.932][I 2026-03-05 03:10:21,735] Trial 138 finished with value: 0.8860348726389418 and parameters: {'activation': 'tanh', 'solver': 'adam', 'lr': 4.1039585071803754e-05, 'layer1': 147, 'layer2': 14, 'layer3': 330}. Best is trial 132 with value: 0.9322660802940301.
Klebsiella_Pneumoniae | DirectMulti | Optuna:  70%|██████▉   | 139/200 [3:08:53<1:13:37, 72.41s/it, best=0.932]Klebsiella_Pneumoniae | DirectMulti | Optuna:  70%|██████▉   | 139/200 [3:08:53<1:13:37, 72.41s/it, best=0.932][I 2026-03-05 03:10:46,970] Trial 127 finished with value: 0.8597057369401883 and parameters: {'activation': 'relu', 'solver': 'adam', 'lr': 0.0062946929989591, 'layer1': 374, 'layer2': 339, 'layer3': 300}. Best is trial 71 with value: 0.8659155749694897.
Pseudomonas_Aeruginosa | DirectMulti | Optuna:  64%|██████▍   | 128/200 [3:16:41<2:02:03, 101.72s/it, best=0.866]Pseudomonas_Aeruginosa | DirectMulti | Optuna:  64%|██████▍   | 128/200 [3:16:41<2:02:03, 101.72s/it, best=0.866][I 2026-03-05 03:11:12,316] Trial 134 finished with value: 0.8620358413175391 and parameters: {'activation': 'relu', 'solver': 'adam', 'lr': 1.1651175497942009e-05, 'layer1': 394, 'layer2': 61, 'layer3': 452}. Best is trial 73 with value: 0.864893646817533.
Escherichia_Coli | LPS | Optuna:  68%|██████▊   | 135/200 [7:12:54<5:44:41, 318.17s/it, best=0.865]Escherichia_Coli | LPS | Optuna:  68%|██████▊   | 135/200 [7:12:54<5:44:41, 318.17s/it, best=0.865][I 2026-03-05 03:11:15,040] Trial 66 finished with value: 0.8913614350690467 and parameters: {'activation': 'identity', 'solver': 'adam', 'lr': 1.7195792578202048e-05, 'layer1': 339, 'layer2': 420, 'layer3': 76}. Best is trial 62 with value: 0.8933826282053527.
Staphylococcus_Aureus | DirectMulti | Optuna:  34%|███▎      | 67/200 [2:36:32<9:34:52, 259.34s/it, best=0.893] Staphylococcus_Aureus | DirectMulti | Optuna:  34%|███▎      | 67/200 [2:36:32<9:34:52, 259.34s/it, best=0.893][I 2026-03-05 03:11:45,040] Trial 139 finished with value: 0.9310480775858899 and parameters: {'activation': 'tanh', 'solver': 'adam', 'lr': 6.0277787071061834e-05, 'layer1': 124, 'layer2': 171, 'layer3': 235}. Best is trial 132 with value: 0.9322660802940301.
Klebsiella_Pneumoniae | DirectMulti | Optuna:  70%|███████   | 140/200 [3:10:17<1:15:40, 75.68s/it, best=0.932]Klebsiella_Pneumoniae | DirectMulti | Optuna:  70%|███████   | 140/200 [3:10:17<1:15:40, 75.68s/it, best=0.932][I 2026-03-05 03:12:33,053] Trial 128 finished with value: 0.8568684453265527 and parameters: {'activation': 'relu', 'solver': 'adam', 'lr': 0.007943149435564942, 'layer1': 407, 'layer2': 350, 'layer3': 307}. Best is trial 71 with value: 0.8659155749694897.
Pseudomonas_Aeruginosa | DirectMulti | Optuna:  64%|██████▍   | 129/200 [3:18:27<2:01:55, 103.03s/it, best=0.866]Pseudomonas_Aeruginosa | DirectMulti | Optuna:  64%|██████▍   | 129/200 [3:18:27<2:01:55, 103.03s/it, best=0.866][I 2026-03-05 03:12:38,511] Trial 67 finished with value: 0.8029084233697203 and parameters: {'activation': 'identity', 'solver': 'adam', 'lr': 3.861884360599821e-06, 'layer1': 409, 'layer2': 432, 'layer3': 60}. Best is trial 62 with value: 0.8933826282053527.
Staphylococcus_Aureus | DirectMulti | Optuna:  34%|███▍      | 68/200 [2:37:56<7:34:28, 206.58s/it, best=0.893]Staphylococcus_Aureus | DirectMulti | Optuna:  34%|███▍      | 68/200 [2:37:56<7:34:28, 206.58s/it, best=0.893][I 2026-03-05 03:13:00,305] Trial 140 finished with value: 0.9317591854225409 and parameters: {'activation': 'tanh', 'solver': 'adam', 'lr': 8.071835293686273e-05, 'layer1': 99, 'layer2': 105, 'layer3': 346}. Best is trial 132 with value: 0.9322660802940301.
Klebsiella_Pneumoniae | DirectMulti | Optuna:  70%|███████   | 141/200 [3:11:32<1:14:17, 75.56s/it, best=0.932]Klebsiella_Pneumoniae | DirectMulti | Optuna:  70%|███████   | 141/200 [3:11:32<1:14:17, 75.56s/it, best=0.932][I 2026-03-05 03:13:41,480] Trial 129 finished with value: 0.8261898244308833 and parameters: {'activation': 'tanh', 'solver': 'adam', 'lr': 0.0045947121923954806, 'layer1': 441, 'layer2': 316, 'layer3': 292}. Best is trial 71 with value: 0.8659155749694897.
Pseudomonas_Aeruginosa | DirectMulti | Optuna:  65%|██████▌   | 130/200 [3:19:35<1:48:05, 92.65s/it, best=0.866] Pseudomonas_Aeruginosa | DirectMulti | Optuna:  65%|██████▌   | 130/200 [3:19:35<1:48:05, 92.65s/it, best=0.866][I 2026-03-05 03:13:48,496] Trial 68 finished with value: 0.8022147392054837 and parameters: {'activation': 'identity', 'solver': 'adam', 'lr': 5.315732023042357e-06, 'layer1': 323, 'layer2': 379, 'layer3': 12}. Best is trial 62 with value: 0.8933826282053527.
Staphylococcus_Aureus | DirectMulti | Optuna:  34%|███▍      | 69/200 [2:39:06<6:01:33, 165.60s/it, best=0.893]Staphylococcus_Aureus | DirectMulti | Optuna:  34%|███▍      | 69/200 [2:39:06<6:01:33, 165.60s/it, best=0.893][I 2026-03-05 03:14:15,883] Trial 141 finished with value: 0.9319162685012543 and parameters: {'activation': 'tanh', 'solver': 'adam', 'lr': 7.502424284104029e-05, 'layer1': 110, 'layer2': 102, 'layer3': 348}. Best is trial 132 with value: 0.9322660802940301.
Klebsiella_Pneumoniae | DirectMulti | Optuna:  71%|███████   | 142/200 [3:12:48<1:13:02, 75.56s/it, best=0.932]Klebsiella_Pneumoniae | DirectMulti | Optuna:  71%|███████   | 142/200 [3:12:48<1:13:02, 75.56s/it, best=0.932][I 2026-03-05 03:15:02,683] Trial 135 finished with value: 0.8625040440759033 and parameters: {'activation': 'relu', 'solver': 'adam', 'lr': 2.7125158132116527e-05, 'layer1': 405, 'layer2': 77, 'layer3': 477}. Best is trial 73 with value: 0.864893646817533.
Escherichia_Coli | LPS | Optuna:  68%|██████▊   | 136/200 [7:16:44<5:11:17, 291.83s/it, best=0.865]Escherichia_Coli | LPS | Optuna:  68%|██████▊   | 136/200 [7:16:44<5:11:17, 291.83s/it, best=0.865][I 2026-03-05 03:15:50,391] Trial 142 finished with value: 0.930216368793052 and parameters: {'activation': 'tanh', 'solver': 'adam', 'lr': 7.397825105884064e-05, 'layer1': 101, 'layer2': 368, 'layer3': 357}. Best is trial 132 with value: 0.9322660802940301.
Klebsiella_Pneumoniae | DirectMulti | Optuna:  72%|███████▏  | 143/200 [3:14:22<1:17:11, 81.25s/it, best=0.932]Klebsiella_Pneumoniae | DirectMulti | Optuna:  72%|███████▏  | 143/200 [3:14:22<1:17:11, 81.25s/it, best=0.932][I 2026-03-05 03:16:37,420] Trial 130 finished with value: 0.859755534699105 and parameters: {'activation': 'relu', 'solver': 'adam', 'lr': 0.006520052450792149, 'layer1': 489, 'layer2': 331, 'layer3': 353}. Best is trial 71 with value: 0.8659155749694897.
Pseudomonas_Aeruginosa | DirectMulti | Optuna:  66%|██████▌   | 131/200 [3:22:31<2:15:16, 117.64s/it, best=0.866]Pseudomonas_Aeruginosa | DirectMulti | Optuna:  66%|██████▌   | 131/200 [3:22:31<2:15:16, 117.64s/it, best=0.866][I 2026-03-05 03:16:59,930] Trial 143 finished with value: 0.9309126081545529 and parameters: {'activation': 'tanh', 'solver': 'adam', 'lr': 0.00010351016870054072, 'layer1': 113, 'layer2': 89, 'layer3': 373}. Best is trial 132 with value: 0.9322660802940301.
Klebsiella_Pneumoniae | DirectMulti | Optuna:  72%|███████▏  | 144/200 [3:15:32<1:12:33, 77.73s/it, best=0.932]Klebsiella_Pneumoniae | DirectMulti | Optuna:  72%|███████▏  | 144/200 [3:15:32<1:12:33, 77.73s/it, best=0.932][I 2026-03-05 03:18:24,788] Trial 131 finished with value: 0.8612932176112917 and parameters: {'activation': 'relu', 'solver': 'adam', 'lr': 0.003915652963217037, 'layer1': 424, 'layer2': 442, 'layer3': 311}. Best is trial 71 with value: 0.8659155749694897.
Pseudomonas_Aeruginosa | DirectMulti | Optuna:  66%|██████▌   | 132/200 [3:24:18<2:09:49, 114.56s/it, best=0.866]Pseudomonas_Aeruginosa | DirectMulti | Optuna:  66%|██████▌   | 132/200 [3:24:18<2:09:49, 114.56s/it, best=0.866][I 2026-03-05 03:18:30,304] Trial 144 finished with value: 0.9315948816128727 and parameters: {'activation': 'tanh', 'solver': 'adam', 'lr': 8.012234758791742e-05, 'layer1': 137, 'layer2': 102, 'layer3': 290}. Best is trial 132 with value: 0.9322660802940301.
Klebsiella_Pneumoniae | DirectMulti | Optuna:  72%|███████▎  | 145/200 [3:17:02<1:14:43, 81.53s/it, best=0.932]Klebsiella_Pneumoniae | DirectMulti | Optuna:  72%|███████▎  | 145/200 [3:17:02<1:14:43, 81.53s/it, best=0.932][I 2026-03-05 03:19:36,998] Trial 145 finished with value: 0.9305025112273475 and parameters: {'activation': 'tanh', 'solver': 'adam', 'lr': 0.000155240229142953, 'layer1': 140, 'layer2': 98, 'layer3': 289}. Best is trial 132 with value: 0.9322660802940301.
Klebsiella_Pneumoniae | DirectMulti | Optuna:  73%|███████▎  | 146/200 [3:18:09<1:09:22, 77.08s/it, best=0.932]Klebsiella_Pneumoniae | DirectMulti | Optuna:  73%|███████▎  | 146/200 [3:18:09<1:09:22, 77.08s/it, best=0.932][I 2026-03-05 03:19:56,823] Trial 136 finished with value: 0.8627118956229914 and parameters: {'activation': 'relu', 'solver': 'adam', 'lr': 2.2340449025655423e-05, 'layer1': 363, 'layer2': 40, 'layer3': 442}. Best is trial 73 with value: 0.864893646817533.
Escherichia_Coli | LPS | Optuna:  68%|██████▊   | 137/200 [7:21:38<5:07:08, 292.52s/it, best=0.865]Escherichia_Coli | LPS | Optuna:  68%|██████▊   | 137/200 [7:21:38<5:07:08, 292.52s/it, best=0.865][I 2026-03-05 03:20:06,339] Trial 132 finished with value: 0.864092522951203 and parameters: {'activation': 'relu', 'solver': 'adam', 'lr': 0.002793828947970155, 'layer1': 430, 'layer2': 382, 'layer3': 318}. Best is trial 71 with value: 0.8659155749694897.
Pseudomonas_Aeruginosa | DirectMulti | Optuna:  66%|██████▋   | 133/200 [3:26:00<2:03:33, 110.65s/it, best=0.866]Pseudomonas_Aeruginosa | DirectMulti | Optuna:  66%|██████▋   | 133/200 [3:26:00<2:03:33, 110.65s/it, best=0.866][I 2026-03-05 03:20:44,461] Trial 146 finished with value: 0.9309704890320735 and parameters: {'activation': 'tanh', 'solver': 'adam', 'lr': 0.00011809336818894447, 'layer1': 131, 'layer2': 112, 'layer3': 306}. Best is trial 132 with value: 0.9322660802940301.
Klebsiella_Pneumoniae | DirectMulti | Optuna:  74%|███████▎  | 147/200 [3:19:16<1:05:32, 74.19s/it, best=0.932]Klebsiella_Pneumoniae | DirectMulti | Optuna:  74%|███████▎  | 147/200 [3:19:16<1:05:32, 74.19s/it, best=0.932][I 2026-03-05 03:21:04,929] Trial 69 finished with value: 0.8922539521752734 and parameters: {'activation': 'identity', 'solver': 'adam', 'lr': 7.592658201129532e-06, 'layer1': 351, 'layer2': 464, 'layer3': 84}. Best is trial 62 with value: 0.8933826282053527.
Staphylococcus_Aureus | DirectMulti | Optuna:  35%|███▌      | 70/200 [2:46:22<8:54:50, 246.85s/it, best=0.893]Staphylococcus_Aureus | DirectMulti | Optuna:  35%|███▌      | 70/200 [2:46:22<8:54:50, 246.85s/it, best=0.893][I 2026-03-05 03:21:25,044] Trial 147 finished with value: 0.8754069959169163 and parameters: {'activation': 'tanh', 'solver': 'sgd', 'lr': 0.00022580913630818847, 'layer1': 95, 'layer2': 73, 'layer3': 323}. Best is trial 132 with value: 0.9322660802940301.
Klebsiella_Pneumoniae | DirectMulti | Optuna:  74%|███████▍  | 148/200 [3:19:57<55:33, 64.11s/it, best=0.932]  Klebsiella_Pneumoniae | DirectMulti | Optuna:  74%|███████▍  | 148/200 [3:19:57<55:33, 64.11s/it, best=0.932][I 2026-03-05 03:21:54,699] Trial 133 finished with value: 0.8594086392003618 and parameters: {'activation': 'relu', 'solver': 'adam', 'lr': 0.0049830495241273655, 'layer1': 448, 'layer2': 377, 'layer3': 329}. Best is trial 71 with value: 0.8659155749694897.
Pseudomonas_Aeruginosa | DirectMulti | Optuna:  67%|██████▋   | 134/200 [3:27:48<2:00:57, 109.97s/it, best=0.866]Pseudomonas_Aeruginosa | DirectMulti | Optuna:  67%|██████▋   | 134/200 [3:27:48<2:00:57, 109.97s/it, best=0.866][I 2026-03-05 03:22:44,342] Trial 134 finished with value: 0.8580390085606805 and parameters: {'activation': 'relu', 'solver': 'adam', 'lr': 0.0030214016537088396, 'layer1': 121, 'layer2': 365, 'layer3': 343}. Best is trial 71 with value: 0.8659155749694897.
Pseudomonas_Aeruginosa | DirectMulti | Optuna:  68%|██████▊   | 135/200 [3:28:38<1:39:31, 91.87s/it, best=0.866] Pseudomonas_Aeruginosa | DirectMulti | Optuna:  68%|██████▊   | 135/200 [3:28:38<1:39:31, 91.87s/it, best=0.866][I 2026-03-05 03:23:23,063] Trial 148 finished with value: 0.9317125611616559 and parameters: {'activation': 'tanh', 'solver': 'adam', 'lr': 3.560541358009578e-05, 'layer1': 81, 'layer2': 104, 'layer3': 311}. Best is trial 132 with value: 0.9322660802940301.
Klebsiella_Pneumoniae | DirectMulti | Optuna:  74%|███████▍  | 149/200 [3:21:55<1:08:14, 80.28s/it, best=0.932]Klebsiella_Pneumoniae | DirectMulti | Optuna:  74%|███████▍  | 149/200 [3:21:55<1:08:14, 80.28s/it, best=0.932][I 2026-03-05 03:23:55,121] Trial 149 finished with value: 0.8746470562584285 and parameters: {'activation': 'tanh', 'solver': 'adam', 'lr': 3.52741565486188e-05, 'layer1': 75, 'layer2': 59, 'layer3': 289}. Best is trial 132 with value: 0.9322660802940301.
Klebsiella_Pneumoniae | DirectMulti | Optuna:  75%|███████▌  | 150/200 [3:22:27<54:50, 65.81s/it, best=0.932]  Klebsiella_Pneumoniae | DirectMulti | Optuna:  75%|███████▌  | 150/200 [3:22:27<54:50, 65.81s/it, best=0.932][I 2026-03-05 03:24:40,967] Trial 135 finished with value: 0.8632841734443039 and parameters: {'activation': 'relu', 'solver': 'adam', 'lr': 0.003921268789784615, 'layer1': 436, 'layer2': 357, 'layer3': 283}. Best is trial 71 with value: 0.8659155749694897.
Pseudomonas_Aeruginosa | DirectMulti | Optuna:  68%|██████▊   | 136/200 [3:30:35<1:45:54, 99.30s/it, best=0.866]Pseudomonas_Aeruginosa | DirectMulti | Optuna:  68%|██████▊   | 136/200 [3:30:35<1:45:54, 99.30s/it, best=0.866][I 2026-03-05 03:26:08,762] Trial 150 finished with value: 0.9199822482594318 and parameters: {'activation': 'tanh', 'solver': 'adam', 'lr': 2.9099449067930374e-05, 'layer1': 180, 'layer2': 103, 'layer3': 265}. Best is trial 132 with value: 0.9322660802940301.
Klebsiella_Pneumoniae | DirectMulti | Optuna:  76%|███████▌  | 151/200 [3:24:40<1:10:21, 86.16s/it, best=0.932]Klebsiella_Pneumoniae | DirectMulti | Optuna:  76%|███████▌  | 151/200 [3:24:40<1:10:21, 86.16s/it, best=0.932][I 2026-03-05 03:26:19,465] Trial 136 finished with value: 0.8591306968600184 and parameters: {'activation': 'relu', 'solver': 'adam', 'lr': 0.0021331992105372488, 'layer1': 453, 'layer2': 386, 'layer3': 381}. Best is trial 71 with value: 0.8659155749694897.
Pseudomonas_Aeruginosa | DirectMulti | Optuna:  68%|██████▊   | 137/200 [3:32:13<1:44:00, 99.06s/it, best=0.866]Pseudomonas_Aeruginosa | DirectMulti | Optuna:  68%|██████▊   | 137/200 [3:32:13<1:44:00, 99.06s/it, best=0.866][I 2026-03-05 03:26:55,413] Trial 137 finished with value: 0.8620820326651473 and parameters: {'activation': 'relu', 'solver': 'adam', 'lr': 1.3823116440126644e-05, 'layer1': 422, 'layer2': 29, 'layer3': 426}. Best is trial 73 with value: 0.864893646817533.
Escherichia_Coli | LPS | Optuna:  69%|██████▉   | 138/200 [7:28:37<5:41:21, 330.34s/it, best=0.865]Escherichia_Coli | LPS | Optuna:  69%|██████▉   | 138/200 [7:28:37<5:41:21, 330.34s/it, best=0.865][I 2026-03-05 03:27:47,101] Trial 151 finished with value: 0.931057339121321 and parameters: {'activation': 'tanh', 'solver': 'adam', 'lr': 4.787507603692132e-05, 'layer1': 108, 'layer2': 121, 'layer3': 335}. Best is trial 132 with value: 0.9322660802940301.
