Pseudomonas_Aeruginosa | LPS | Optuna:  66%|██████▌   | 131/200 [2:24:30<1:22:47, 71.99s/it, best=0.865]Pseudomonas_Aeruginosa | LPS | Optuna:  66%|██████▌   | 131/200 [2:24:30<1:22:47, 71.99s/it, best=0.865][I 2026-03-04 22:23:14,879] Trial 124 finished with value: 0.8753940709309476 and parameters: {'activation': 'tanh', 'solver': 'adam', 'lr': 6.3831297659051566e-06, 'layer1': 210, 'layer2': 202, 'layer3': 62}. Best is trial 104 with value: 0.9327898309005132.
Klebsiella_Pneumoniae | LPS | Optuna:  62%|██████▎   | 125/200 [2:24:57<1:38:35, 78.87s/it, best=0.933]Klebsiella_Pneumoniae | LPS | Optuna:  62%|██████▎   | 125/200 [2:24:57<1:38:35, 78.87s/it, best=0.933][I 2026-03-04 22:23:49,535] Trial 131 finished with value: 0.8570178578417067 and parameters: {'activation': 'identity', 'solver': 'adam', 'lr': 0.002823811948705408, 'layer1': 365, 'layer2': 53, 'layer3': 285}. Best is trial 49 with value: 0.8647157569215889.
Pseudomonas_Aeruginosa | LPS | Optuna:  66%|██████▌   | 132/200 [2:25:31<1:17:59, 68.81s/it, best=0.865]Pseudomonas_Aeruginosa | LPS | Optuna:  66%|██████▌   | 132/200 [2:25:31<1:17:59, 68.81s/it, best=0.865][I 2026-03-04 22:24:13,203] Trial 102 finished with value: 0.8904253627327838 and parameters: {'activation': 'identity', 'solver': 'adam', 'lr': 7.97076388352032e-05, 'layer1': 146, 'layer2': 31, 'layer3': 135}. Best is trial 90 with value: 0.8934794004485915.
Staphylococcus_Aureus | LPS | Optuna:  52%|█████▏    | 103/200 [2:25:55<2:30:38, 93.18s/it, best=0.893]Staphylococcus_Aureus | LPS | Optuna:  52%|█████▏    | 103/200 [2:25:55<2:30:38, 93.18s/it, best=0.893][I 2026-03-04 22:24:14,653] Trial 54 finished with value: 0.8612588314324772 and parameters: {'activation': 'relu', 'solver': 'adam', 'lr': 0.00022675671091412916, 'layer1': 433, 'layer2': 201, 'layer3': 334}. Best is trial 14 with value: 0.863668804271893.
Escherichia_Coli | LPS | Optuna:  28%|██▊       | 55/200 [2:25:56<7:51:53, 195.27s/it, best=0.864]Escherichia_Coli | LPS | Optuna:  28%|██▊       | 55/200 [2:25:56<7:51:53, 195.27s/it, best=0.864][I 2026-03-04 22:24:56,146] Trial 132 finished with value: 0.8602955147361179 and parameters: {'activation': 'identity', 'solver': 'adam', 'lr': 0.006830979536598959, 'layer1': 333, 'layer2': 82, 'layer3': 373}. Best is trial 49 with value: 0.8647157569215889.
Pseudomonas_Aeruginosa | LPS | Optuna:  66%|██████▋   | 133/200 [2:26:38<1:16:06, 68.15s/it, best=0.865]Pseudomonas_Aeruginosa | LPS | Optuna:  66%|██████▋   | 133/200 [2:26:38<1:16:06, 68.15s/it, best=0.865][I 2026-03-04 22:25:11,512] Trial 125 finished with value: 0.9214469910913745 and parameters: {'activation': 'tanh', 'solver': 'adam', 'lr': 4.2545358150648265e-05, 'layer1': 176, 'layer2': 239, 'layer3': 24}. Best is trial 104 with value: 0.9327898309005132.
Klebsiella_Pneumoniae | LPS | Optuna:  63%|██████▎   | 126/200 [2:26:53<1:51:14, 90.20s/it, best=0.933]Klebsiella_Pneumoniae | LPS | Optuna:  63%|██████▎   | 126/200 [2:26:53<1:51:14, 90.20s/it, best=0.933][I 2026-03-04 22:25:23,207] Trial 103 finished with value: 0.8913108176976465 and parameters: {'activation': 'identity', 'solver': 'adam', 'lr': 0.0001966907282420068, 'layer1': 113, 'layer2': 62, 'layer3': 171}. Best is trial 90 with value: 0.8934794004485915.
Staphylococcus_Aureus | LPS | Optuna:  52%|█████▏    | 104/200 [2:27:05<2:17:57, 86.22s/it, best=0.893]Staphylococcus_Aureus | LPS | Optuna:  52%|█████▏    | 104/200 [2:27:05<2:17:57, 86.22s/it, best=0.893][I 2026-03-04 22:25:59,026] Trial 133 finished with value: 0.8617507382684085 and parameters: {'activation': 'identity', 'solver': 'adam', 'lr': 0.0018460601760000033, 'layer1': 349, 'layer2': 71, 'layer3': 456}. Best is trial 49 with value: 0.8647157569215889.
Pseudomonas_Aeruginosa | LPS | Optuna:  67%|██████▋   | 134/200 [2:27:41<1:13:13, 66.57s/it, best=0.865]Pseudomonas_Aeruginosa | LPS | Optuna:  67%|██████▋   | 134/200 [2:27:41<1:13:13, 66.57s/it, best=0.865][I 2026-03-04 22:26:10,791] Trial 104 finished with value: 0.8906587128695993 and parameters: {'activation': 'identity', 'solver': 'adam', 'lr': 0.007489199881454868, 'layer1': 77, 'layer2': 16, 'layer3': 194}. Best is trial 90 with value: 0.8934794004485915.
Staphylococcus_Aureus | LPS | Optuna:  52%|█████▎    | 105/200 [2:27:52<1:58:10, 74.63s/it, best=0.893]Staphylococcus_Aureus | LPS | Optuna:  52%|█████▎    | 105/200 [2:27:52<1:58:10, 74.63s/it, best=0.893][I 2026-03-04 22:26:58,988] Trial 126 finished with value: 0.9183160810506518 and parameters: {'activation': 'tanh', 'solver': 'adam', 'lr': 3.3593880581985566e-05, 'layer1': 221, 'layer2': 259, 'layer3': 35}. Best is trial 104 with value: 0.9327898309005132.
Klebsiella_Pneumoniae | LPS | Optuna:  64%|██████▎   | 127/200 [2:28:41<1:56:02, 95.38s/it, best=0.933]Klebsiella_Pneumoniae | LPS | Optuna:  64%|██████▎   | 127/200 [2:28:41<1:56:02, 95.38s/it, best=0.933][I 2026-03-04 22:27:15,444] Trial 134 finished with value: 0.8620147278704502 and parameters: {'activation': 'identity', 'solver': 'adam', 'lr': 0.0012316329959917744, 'layer1': 432, 'layer2': 211, 'layer3': 18}. Best is trial 49 with value: 0.8647157569215889.
Pseudomonas_Aeruginosa | LPS | Optuna:  68%|██████▊   | 135/200 [2:28:57<1:15:19, 69.52s/it, best=0.865]Pseudomonas_Aeruginosa | LPS | Optuna:  68%|██████▊   | 135/200 [2:28:57<1:15:19, 69.52s/it, best=0.865][I 2026-03-04 22:27:18,907] Trial 105 finished with value: 0.8905029754065789 and parameters: {'activation': 'identity', 'solver': 'adam', 'lr': 0.0003798326856739624, 'layer1': 160, 'layer2': 51, 'layer3': 115}. Best is trial 90 with value: 0.8934794004485915.
Staphylococcus_Aureus | LPS | Optuna:  53%|█████▎    | 106/200 [2:29:01<1:53:51, 72.68s/it, best=0.893]Staphylococcus_Aureus | LPS | Optuna:  53%|█████▎    | 106/200 [2:29:01<1:53:51, 72.68s/it, best=0.893][I 2026-03-04 22:27:30,150] Trial 127 finished with value: 0.8746470562584285 and parameters: {'activation': 'tanh', 'solver': 'adam', 'lr': 2.608227799020193e-05, 'layer1': 51, 'layer2': 230, 'layer3': 50}. Best is trial 104 with value: 0.9327898309005132.
Klebsiella_Pneumoniae | LPS | Optuna:  64%|██████▍   | 128/200 [2:29:12<1:31:20, 76.12s/it, best=0.933]Klebsiella_Pneumoniae | LPS | Optuna:  64%|██████▍   | 128/200 [2:29:12<1:31:20, 76.12s/it, best=0.933][I 2026-03-04 22:27:48,882] Trial 55 finished with value: 0.8619542023036058 and parameters: {'activation': 'relu', 'solver': 'adam', 'lr': 6.132340054219847e-05, 'layer1': 478, 'layer2': 249, 'layer3': 426}. Best is trial 14 with value: 0.863668804271893.
Escherichia_Coli | LPS | Optuna:  28%|██▊       | 56/200 [2:29:30<8:02:17, 200.95s/it, best=0.864]Escherichia_Coli | LPS | Optuna:  28%|██▊       | 56/200 [2:29:30<8:02:17, 200.95s/it, best=0.864][I 2026-03-04 22:28:16,021] Trial 106 finished with value: 0.8932989563811489 and parameters: {'activation': 'identity', 'solver': 'adam', 'lr': 0.0005280561751395456, 'layer1': 89, 'layer2': 24, 'layer3': 127}. Best is trial 90 with value: 0.8934794004485915.
Staphylococcus_Aureus | LPS | Optuna:  54%|█████▎    | 107/200 [2:29:58<1:45:24, 68.01s/it, best=0.893]Staphylococcus_Aureus | LPS | Optuna:  54%|█████▎    | 107/200 [2:29:58<1:45:24, 68.01s/it, best=0.893][I 2026-03-04 22:28:48,973] Trial 128 finished with value: 0.9093165258628625 and parameters: {'activation': 'tanh', 'solver': 'adam', 'lr': 8.955812871925072e-05, 'layer1': 246, 'layer2': 220, 'layer3': 12}. Best is trial 104 with value: 0.9327898309005132.
Klebsiella_Pneumoniae | LPS | Optuna:  64%|██████▍   | 129/200 [2:30:31<1:31:01, 76.93s/it, best=0.933]Klebsiella_Pneumoniae | LPS | Optuna:  64%|██████▍   | 129/200 [2:30:31<1:31:01, 76.93s/it, best=0.933][I 2026-03-04 22:28:55,053] Trial 135 finished with value: 0.8547732505534388 and parameters: {'activation': 'identity', 'solver': 'adam', 'lr': 0.004160399741248451, 'layer1': 463, 'layer2': 433, 'layer3': 310}. Best is trial 49 with value: 0.8647157569215889.
Pseudomonas_Aeruginosa | LPS | Optuna:  68%|██████▊   | 136/200 [2:30:37<1:23:47, 78.55s/it, best=0.865]Pseudomonas_Aeruginosa | LPS | Optuna:  68%|██████▊   | 136/200 [2:30:37<1:23:47, 78.55s/it, best=0.865][I 2026-03-04 22:29:24,847] Trial 107 finished with value: 0.8890220640517811 and parameters: {'activation': 'relu', 'solver': 'adam', 'lr': 0.0007627177574333212, 'layer1': 52, 'layer2': 42, 'layer3': 121}. Best is trial 90 with value: 0.8934794004485915.
Staphylococcus_Aureus | LPS | Optuna:  54%|█████▍    | 108/200 [2:31:06<1:44:39, 68.25s/it, best=0.893]Staphylococcus_Aureus | LPS | Optuna:  54%|█████▍    | 108/200 [2:31:06<1:44:39, 68.25s/it, best=0.893][I 2026-03-04 22:29:35,894] Trial 136 finished with value: 0.8261898244308833 and parameters: {'activation': 'logistic', 'solver': 'sgd', 'lr': 0.0015955732420199781, 'layer1': 386, 'layer2': 132, 'layer3': 282}. Best is trial 49 with value: 0.8647157569215889.
Pseudomonas_Aeruginosa | LPS | Optuna:  68%|██████▊   | 137/200 [2:31:18<1:10:35, 67.24s/it, best=0.865]Pseudomonas_Aeruginosa | LPS | Optuna:  68%|██████▊   | 137/200 [2:31:18<1:10:35, 67.24s/it, best=0.865][I 2026-03-04 22:30:11,026] Trial 129 finished with value: 0.9324118344340964 and parameters: {'activation': 'tanh', 'solver': 'adam', 'lr': 6.507340696499089e-05, 'layer1': 198, 'layer2': 275, 'layer3': 94}. Best is trial 104 with value: 0.9327898309005132.
Klebsiella_Pneumoniae | LPS | Optuna:  65%|██████▌   | 130/200 [2:31:53<1:31:32, 78.47s/it, best=0.933]Klebsiella_Pneumoniae | LPS | Optuna:  65%|██████▌   | 130/200 [2:31:53<1:31:32, 78.47s/it, best=0.933][I 2026-03-04 22:30:25,917] Trial 108 finished with value: 0.8925591039174323 and parameters: {'activation': 'identity', 'solver': 'adam', 'lr': 0.0005454504729285464, 'layer1': 107, 'layer2': 94, 'layer3': 157}. Best is trial 90 with value: 0.8934794004485915.
Staphylococcus_Aureus | LPS | Optuna:  55%|█████▍    | 109/200 [2:32:08<1:40:14, 66.10s/it, best=0.893]Staphylococcus_Aureus | LPS | Optuna:  55%|█████▍    | 109/200 [2:32:08<1:40:14, 66.10s/it, best=0.893][I 2026-03-04 22:30:43,532] Trial 137 finished with value: 0.8608749745245268 and parameters: {'activation': 'relu', 'solver': 'adam', 'lr': 0.0022884394180773086, 'layer1': 314, 'layer2': 277, 'layer3': 261}. Best is trial 49 with value: 0.8647157569215889.
Pseudomonas_Aeruginosa | LPS | Optuna:  69%|██████▉   | 138/200 [2:32:25<1:09:36, 67.36s/it, best=0.865]Pseudomonas_Aeruginosa | LPS | Optuna:  69%|██████▉   | 138/200 [2:32:25<1:09:36, 67.36s/it, best=0.865][I 2026-03-04 22:31:04,133] Trial 56 finished with value: 0.8617291786448172 and parameters: {'activation': 'relu', 'solver': 'adam', 'lr': 8.271766282141601e-05, 'layer1': 476, 'layer2': 159, 'layer3': 205}. Best is trial 14 with value: 0.863668804271893.
Escherichia_Coli | LPS | Optuna:  28%|██▊       | 57/200 [2:32:46<7:54:51, 199.24s/it, best=0.864]Escherichia_Coli | LPS | Optuna:  28%|██▊       | 57/200 [2:32:46<7:54:51, 199.24s/it, best=0.864][I 2026-03-04 22:31:19,703] Trial 109 finished with value: 0.8914305316091072 and parameters: {'activation': 'identity', 'solver': 'adam', 'lr': 0.0018805820435564954, 'layer1': 107, 'layer2': 70, 'layer3': 154}. Best is trial 90 with value: 0.8934794004485915.
Staphylococcus_Aureus | LPS | Optuna:  55%|█████▌    | 110/200 [2:33:01<1:33:36, 62.40s/it, best=0.893]Staphylococcus_Aureus | LPS | Optuna:  55%|█████▌    | 110/200 [2:33:01<1:33:36, 62.40s/it, best=0.893][I 2026-03-04 22:31:42,169] Trial 130 finished with value: 0.9305352311811037 and parameters: {'activation': 'tanh', 'solver': 'adam', 'lr': 6.121404113793869e-05, 'layer1': 223, 'layer2': 279, 'layer3': 81}. Best is trial 104 with value: 0.9327898309005132.
Klebsiella_Pneumoniae | LPS | Optuna:  66%|██████▌   | 131/200 [2:33:24<1:34:36, 82.27s/it, best=0.933]Klebsiella_Pneumoniae | LPS | Optuna:  66%|██████▌   | 131/200 [2:33:24<1:34:36, 82.27s/it, best=0.933][I 2026-03-04 22:32:05,718] Trial 138 finished with value: 0.8604380803136558 and parameters: {'activation': 'identity', 'solver': 'adam', 'lr': 0.00013091328054140272, 'layer1': 451, 'layer2': 384, 'layer3': 238}. Best is trial 49 with value: 0.8647157569215889.
Pseudomonas_Aeruginosa | LPS | Optuna:  70%|██████▉   | 139/200 [2:33:47<1:13:00, 71.81s/it, best=0.865]Pseudomonas_Aeruginosa | LPS | Optuna:  70%|██████▉   | 139/200 [2:33:47<1:13:00, 71.81s/it, best=0.865][I 2026-03-04 22:32:55,103] Trial 110 finished with value: 0.8906544756343303 and parameters: {'activation': 'tanh', 'solver': 'adam', 'lr': 0.0005327551120807883, 'layer1': 341, 'layer2': 80, 'layer3': 467}. Best is trial 90 with value: 0.8934794004485915.
Staphylococcus_Aureus | LPS | Optuna:  56%|█████▌    | 111/200 [2:34:37<1:47:14, 72.30s/it, best=0.893]Staphylococcus_Aureus | LPS | Optuna:  56%|█████▌    | 111/200 [2:34:37<1:47:14, 72.30s/it, best=0.893][I 2026-03-04 22:33:04,885] Trial 131 finished with value: 0.9322888796723088 and parameters: {'activation': 'tanh', 'solver': 'adam', 'lr': 7.160940202334377e-05, 'layer1': 196, 'layer2': 272, 'layer3': 68}. Best is trial 104 with value: 0.9327898309005132.
Klebsiella_Pneumoniae | LPS | Optuna:  66%|██████▌   | 132/200 [2:34:47<1:33:23, 82.40s/it, best=0.933]Klebsiella_Pneumoniae | LPS | Optuna:  66%|██████▌   | 132/200 [2:34:47<1:33:23, 82.40s/it, best=0.933][I 2026-03-04 22:33:22,563] Trial 139 finished with value: 0.8584945644878905 and parameters: {'activation': 'relu', 'solver': 'adam', 'lr': 0.0031735379545397716, 'layer1': 395, 'layer2': 35, 'layer3': 168}. Best is trial 49 with value: 0.8647157569215889.
Pseudomonas_Aeruginosa | LPS | Optuna:  70%|███████   | 140/200 [2:35:04<1:13:19, 73.32s/it, best=0.865]Pseudomonas_Aeruginosa | LPS | Optuna:  70%|███████   | 140/200 [2:35:04<1:13:19, 73.32s/it, best=0.865][I 2026-03-04 22:33:51,436] Trial 57 finished with value: 0.8588906698676773 and parameters: {'activation': 'identity', 'solver': 'adam', 'lr': 4.5269139766281166e-05, 'layer1': 423, 'layer2': 265, 'layer3': 401}. Best is trial 14 with value: 0.863668804271893.
Escherichia_Coli | LPS | Optuna:  29%|██▉       | 58/200 [2:35:33<7:28:51, 189.66s/it, best=0.864]Escherichia_Coli | LPS | Optuna:  29%|██▉       | 58/200 [2:35:33<7:28:51, 189.66s/it, best=0.864][I 2026-03-04 22:33:52,391] Trial 111 finished with value: 0.8910332990626124 and parameters: {'activation': 'identity', 'solver': 'adam', 'lr': 0.0005937759502943419, 'layer1': 88, 'layer2': 21, 'layer3': 130}. Best is trial 90 with value: 0.8934794004485915.
Staphylococcus_Aureus | LPS | Optuna:  56%|█████▌    | 112/200 [2:35:34<1:39:26, 67.80s/it, best=0.893]Staphylococcus_Aureus | LPS | Optuna:  56%|█████▌    | 112/200 [2:35:34<1:39:26, 67.80s/it, best=0.893][I 2026-03-04 22:34:23,995] Trial 132 finished with value: 0.931810103941251 and parameters: {'activation': 'tanh', 'solver': 'adam', 'lr': 7.595172647191727e-05, 'layer1': 200, 'layer2': 271, 'layer3': 92}. Best is trial 104 with value: 0.9327898309005132.
Klebsiella_Pneumoniae | LPS | Optuna:  66%|██████▋   | 133/200 [2:36:06<1:30:54, 81.42s/it, best=0.933]Klebsiella_Pneumoniae | LPS | Optuna:  66%|██████▋   | 133/200 [2:36:06<1:30:54, 81.42s/it, best=0.933][I 2026-03-04 22:34:32,505] Trial 140 finished with value: 0.8562642509697487 and parameters: {'activation': 'tanh', 'solver': 'adam', 'lr': 0.0010262317560952173, 'layer1': 372, 'layer2': 259, 'layer3': 220}. Best is trial 49 with value: 0.8647157569215889.
Pseudomonas_Aeruginosa | LPS | Optuna:  70%|███████   | 141/200 [2:36:14<1:11:05, 72.30s/it, best=0.865]Pseudomonas_Aeruginosa | LPS | Optuna:  70%|███████   | 141/200 [2:36:14<1:11:05, 72.30s/it, best=0.865][I 2026-03-04 22:34:47,942] Trial 112 finished with value: 0.8924535201456607 and parameters: {'activation': 'identity', 'solver': 'adam', 'lr': 0.00044164920522601615, 'layer1': 95, 'layer2': 34, 'layer3': 140}. Best is trial 90 with value: 0.8934794004485915.
Staphylococcus_Aureus | LPS | Optuna:  56%|█████▋    | 113/200 [2:36:30<1:32:58, 64.12s/it, best=0.893]Staphylococcus_Aureus | LPS | Optuna:  56%|█████▋    | 113/200 [2:36:30<1:32:58, 64.12s/it, best=0.893][I 2026-03-04 22:35:34,049] Trial 141 finished with value: 0.857506806526082 and parameters: {'activation': 'identity', 'solver': 'adam', 'lr': 0.002020794043540764, 'layer1': 380, 'layer2': 196, 'layer3': 194}. Best is trial 49 with value: 0.8647157569215889.
Pseudomonas_Aeruginosa | LPS | Optuna:  71%|███████   | 142/200 [2:37:16<1:06:46, 69.08s/it, best=0.865]Pseudomonas_Aeruginosa | LPS | Optuna:  71%|███████   | 142/200 [2:37:16<1:06:46, 69.08s/it, best=0.865][I 2026-03-04 22:35:38,256] Trial 113 finished with value: 0.8911111270286896 and parameters: {'activation': 'identity', 'solver': 'adam', 'lr': 0.0004591383473391858, 'layer1': 72, 'layer2': 132, 'layer3': 98}. Best is trial 90 with value: 0.8934794004485915.
Staphylococcus_Aureus | LPS | Optuna:  57%|█████▋    | 114/200 [2:37:20<1:25:58, 59.98s/it, best=0.893]Staphylococcus_Aureus | LPS | Optuna:  57%|█████▋    | 114/200 [2:37:20<1:25:58, 59.98s/it, best=0.893][I 2026-03-04 22:36:30,708] Trial 114 finished with value: 0.8913665534121662 and parameters: {'activation': 'identity', 'solver': 'adam', 'lr': 0.0008881523593587385, 'layer1': 94, 'layer2': 91, 'layer3': 165}. Best is trial 90 with value: 0.8934794004485915.
Staphylococcus_Aureus | LPS | Optuna:  57%|█████▊    | 115/200 [2:38:12<1:21:46, 57.72s/it, best=0.893]Staphylococcus_Aureus | LPS | Optuna:  57%|█████▊    | 115/200 [2:38:12<1:21:46, 57.72s/it, best=0.893][I 2026-03-04 22:36:34,736] Trial 142 finished with value: 0.8588007268342153 and parameters: {'activation': 'identity', 'solver': 'adam', 'lr': 0.0024216481132328547, 'layer1': 359, 'layer2': 180, 'layer3': 38}. Best is trial 49 with value: 0.8647157569215889.
Pseudomonas_Aeruginosa | LPS | Optuna:  72%|███████▏  | 143/200 [2:38:16<1:03:13, 66.56s/it, best=0.865]Pseudomonas_Aeruginosa | LPS | Optuna:  72%|███████▏  | 143/200 [2:38:16<1:03:13, 66.56s/it, best=0.865][I 2026-03-04 22:36:38,118] Trial 58 finished with value: 0.7196825815685539 and parameters: {'activation': 'relu', 'solver': 'sgd', 'lr': 3.005422201171218e-05, 'layer1': 443, 'layer2': 177, 'layer3': 374}. Best is trial 14 with value: 0.863668804271893.
Escherichia_Coli | LPS | Optuna:  30%|██▉       | 59/200 [2:38:20<7:09:30, 182.77s/it, best=0.864]Escherichia_Coli | LPS | Optuna:  30%|██▉       | 59/200 [2:38:20<7:09:30, 182.77s/it, best=0.864][I 2026-03-04 22:37:03,254] Trial 133 finished with value: 0.9312175215002398 and parameters: {'activation': 'tanh', 'solver': 'adam', 'lr': 1.9853330597671967e-05, 'layer1': 183, 'layer2': 253, 'layer3': 68}. Best is trial 104 with value: 0.9327898309005132.
Klebsiella_Pneumoniae | LPS | Optuna:  67%|██████▋   | 134/200 [2:38:45<1:55:14, 104.77s/it, best=0.933]Klebsiella_Pneumoniae | LPS | Optuna:  67%|██████▋   | 134/200 [2:38:45<1:55:14, 104.77s/it, best=0.933][I 2026-03-04 22:37:39,709] Trial 115 finished with value: 0.891007709140035 and parameters: {'activation': 'identity', 'solver': 'adam', 'lr': 0.0002884229457565566, 'layer1': 127, 'layer2': 56, 'layer3': 149}. Best is trial 90 with value: 0.8934794004485915.
Staphylococcus_Aureus | LPS | Optuna:  58%|█████▊    | 116/200 [2:39:21<1:25:32, 61.11s/it, best=0.893]Staphylococcus_Aureus | LPS | Optuna:  58%|█████▊    | 116/200 [2:39:21<1:25:32, 61.11s/it, best=0.893][I 2026-03-04 22:37:40,846] Trial 143 finished with value: 0.8572982082022982 and parameters: {'activation': 'identity', 'solver': 'adam', 'lr': 0.0013920683066897276, 'layer1': 385, 'layer2': 203, 'layer3': 204}. Best is trial 49 with value: 0.8647157569215889.
Pseudomonas_Aeruginosa | LPS | Optuna:  72%|███████▏  | 144/200 [2:39:23<1:01:59, 66.42s/it, best=0.865]Pseudomonas_Aeruginosa | LPS | Optuna:  72%|███████▏  | 144/200 [2:39:23<1:01:59, 66.42s/it, best=0.865][I 2026-03-04 22:38:46,693] Trial 134 finished with value: 0.9310163977253783 and parameters: {'activation': 'tanh', 'solver': 'adam', 'lr': 5.4917839001511315e-05, 'layer1': 215, 'layer2': 244, 'layer3': 59}. Best is trial 104 with value: 0.9327898309005132.
Klebsiella_Pneumoniae | LPS | Optuna:  68%|██████▊   | 135/200 [2:40:28<1:53:04, 104.37s/it, best=0.933]Klebsiella_Pneumoniae | LPS | Optuna:  68%|██████▊   | 135/200 [2:40:28<1:53:04, 104.37s/it, best=0.933][I 2026-03-04 22:38:46,832] Trial 59 finished with value: 0.7388067228206201 and parameters: {'activation': 'logistic', 'solver': 'adam', 'lr': 0.00010973709364386202, 'layer1': 474, 'layer2': 327, 'layer3': 14}. Best is trial 14 with value: 0.863668804271893.
Escherichia_Coli | LPS | Optuna:  30%|███       | 60/200 [2:40:28<6:28:37, 166.55s/it, best=0.864]Escherichia_Coli | LPS | Optuna:  30%|███       | 60/200 [2:40:28<6:28:37, 166.55s/it, best=0.864][I 2026-03-04 22:38:49,397] Trial 116 finished with value: 0.8911629860186782 and parameters: {'activation': 'identity', 'solver': 'adam', 'lr': 0.0004033938431207302, 'layer1': 177, 'layer2': 10, 'layer3': 64}. Best is trial 90 with value: 0.8934794004485915.
Staphylococcus_Aureus | LPS | Optuna:  58%|█████▊    | 117/200 [2:40:31<1:28:05, 63.68s/it, best=0.893]Staphylococcus_Aureus | LPS | Optuna:  58%|█████▊    | 117/200 [2:40:31<1:28:05, 63.68s/it, best=0.893][I 2026-03-04 22:38:52,497] Trial 144 finished with value: 0.8575127087460732 and parameters: {'activation': 'identity', 'solver': 'adam', 'lr': 0.0018560581517367831, 'layer1': 399, 'layer2': 224, 'layer3': 188}. Best is trial 49 with value: 0.8647157569215889.
Pseudomonas_Aeruginosa | LPS | Optuna:  72%|███████▎  | 145/200 [2:40:34<1:02:19, 67.99s/it, best=0.865]Pseudomonas_Aeruginosa | LPS | Optuna:  72%|███████▎  | 145/200 [2:40:34<1:02:19, 67.99s/it, best=0.865][I 2026-03-04 22:39:35,273] Trial 135 finished with value: 0.87483545671538 and parameters: {'activation': 'tanh', 'solver': 'adam', 'lr': 2.44065067721504e-06, 'layer1': 196, 'layer2': 200, 'layer3': 77}. Best is trial 104 with value: 0.9327898309005132.
