Pseudomonas_Aeruginosa | LPS | Optuna:  30%|███       | 60/200 [59:35<2:48:11, 72.08s/it, best=0.865]Pseudomonas_Aeruginosa | LPS | Optuna:  30%|███       | 60/200 [59:35<2:48:11, 72.08s/it, best=0.865][I 2026-03-04 20:57:54,086] Trial 53 finished with value: 0.9314410122266781 and parameters: {'activation': 'tanh', 'solver': 'adam', 'lr': 0.0002513283489854968, 'layer1': 162, 'layer2': 399, 'layer3': 86}. Best is trial 41 with value: 0.9325947076370852.
Klebsiella_Pneumoniae | LPS | Optuna:  27%|██▋       | 54/200 [59:36<2:35:39, 63.97s/it, best=0.933]Klebsiella_Pneumoniae | LPS | Optuna:  27%|██▋       | 54/200 [59:36<2:35:39, 63.97s/it, best=0.933][I 2026-03-04 20:58:06,102] Trial 38 finished with value: 0.8016524974155473 and parameters: {'activation': 'identity', 'solver': 'sgd', 'lr': 0.00041402484465987463, 'layer1': 99, 'layer2': 200, 'layer3': 222}. Best is trial 22 with value: 0.8930759779387886.
Staphylococcus_Aureus | LPS | Optuna:  20%|█▉        | 39/200 [59:48<2:51:42, 63.99s/it, best=0.893]Staphylococcus_Aureus | LPS | Optuna:  20%|█▉        | 39/200 [59:48<2:51:42, 63.99s/it, best=0.893][I 2026-03-04 20:58:53,950] Trial 54 finished with value: 0.9315883675821552 and parameters: {'activation': 'tanh', 'solver': 'adam', 'lr': 0.00012884470262173713, 'layer1': 115, 'layer2': 430, 'layer3': 65}. Best is trial 41 with value: 0.9325947076370852.
Klebsiella_Pneumoniae | LPS | Optuna:  28%|██▊       | 55/200 [1:00:36<2:31:37, 62.74s/it, best=0.933]Klebsiella_Pneumoniae | LPS | Optuna:  28%|██▊       | 55/200 [1:00:36<2:31:37, 62.74s/it, best=0.933][I 2026-03-04 20:58:59,846] Trial 39 finished with value: 0.8016455484651599 and parameters: {'activation': 'identity', 'solver': 'adam', 'lr': 9.07330211440507e-06, 'layer1': 177, 'layer2': 122, 'layer3': 60}. Best is trial 22 with value: 0.8930759779387886.
Staphylococcus_Aureus | LPS | Optuna:  20%|██        | 40/200 [1:00:41<2:42:26, 60.92s/it, best=0.893]Staphylococcus_Aureus | LPS | Optuna:  20%|██        | 40/200 [1:00:41<2:42:26, 60.92s/it, best=0.893][I 2026-03-04 20:59:16,359] Trial 60 finished with value: 0.8585551499804251 and parameters: {'activation': 'identity', 'solver': 'adam', 'lr': 0.0010579545225344953, 'layer1': 484, 'layer2': 170, 'layer3': 476}. Best is trial 49 with value: 0.8647157569215889.
Pseudomonas_Aeruginosa | LPS | Optuna:  30%|███       | 61/200 [1:00:58<2:54:44, 75.43s/it, best=0.865]Pseudomonas_Aeruginosa | LPS | Optuna:  30%|███       | 61/200 [1:00:58<2:54:44, 75.43s/it, best=0.865][I 2026-03-04 21:00:01,403] Trial 55 finished with value: 0.9306457848630345 and parameters: {'activation': 'tanh', 'solver': 'adam', 'lr': 0.0014144038348606377, 'layer1': 276, 'layer2': 67, 'layer3': 274}. Best is trial 41 with value: 0.9325947076370852.
Klebsiella_Pneumoniae | LPS | Optuna:  28%|██▊       | 56/200 [1:01:43<2:33:57, 64.15s/it, best=0.933]Klebsiella_Pneumoniae | LPS | Optuna:  28%|██▊       | 56/200 [1:01:43<2:33:57, 64.15s/it, best=0.933][I 2026-03-04 21:00:09,113] Trial 25 finished with value: 0.8614039794826492 and parameters: {'activation': 'relu', 'solver': 'adam', 'lr': 2.5192235261990826e-05, 'layer1': 409, 'layer2': 106, 'layer3': 453}. Best is trial 14 with value: 0.863668804271893.
Escherichia_Coli | LPS | Optuna:  13%|█▎        | 26/200 [1:01:51<8:56:29, 184.99s/it, best=0.864]Escherichia_Coli | LPS | Optuna:  13%|█▎        | 26/200 [1:01:51<8:56:29, 184.99s/it, best=0.864][I 2026-03-04 21:00:37,843] Trial 61 finished with value: 0.8620160285225648 and parameters: {'activation': 'relu', 'solver': 'adam', 'lr': 0.00015034136730871073, 'layer1': 281, 'layer2': 199, 'layer3': 447}. Best is trial 49 with value: 0.8647157569215889.
Pseudomonas_Aeruginosa | LPS | Optuna:  31%|███       | 62/200 [1:02:20<2:57:39, 77.24s/it, best=0.865]Pseudomonas_Aeruginosa | LPS | Optuna:  31%|███       | 62/200 [1:02:20<2:57:39, 77.24s/it, best=0.865][I 2026-03-04 21:01:06,549] Trial 56 finished with value: 0.9299520908862154 and parameters: {'activation': 'identity', 'solver': 'adam', 'lr': 8.499132823791924e-05, 'layer1': 135, 'layer2': 455, 'layer3': 155}. Best is trial 41 with value: 0.9325947076370852.
Klebsiella_Pneumoniae | LPS | Optuna:  28%|██▊       | 57/200 [1:02:48<2:33:36, 64.45s/it, best=0.933]Klebsiella_Pneumoniae | LPS | Optuna:  28%|██▊       | 57/200 [1:02:48<2:33:36, 64.45s/it, best=0.933][I 2026-03-04 21:01:38,170] Trial 40 finished with value: 0.8760762738316824 and parameters: {'activation': 'logistic', 'solver': 'adam', 'lr': 0.0006808074383694198, 'layer1': 280, 'layer2': 59, 'layer3': 88}. Best is trial 22 with value: 0.8930759779387886.
Staphylococcus_Aureus | LPS | Optuna:  20%|██        | 41/200 [1:03:20<3:58:52, 90.14s/it, best=0.893]Staphylococcus_Aureus | LPS | Optuna:  20%|██        | 41/200 [1:03:20<3:58:52, 90.14s/it, best=0.893][I 2026-03-04 21:01:43,971] Trial 62 finished with value: 0.8602998103674533 and parameters: {'activation': 'relu', 'solver': 'adam', 'lr': 0.000530894134365911, 'layer1': 234, 'layer2': 143, 'layer3': 465}. Best is trial 49 with value: 0.8647157569215889.
Pseudomonas_Aeruginosa | LPS | Optuna:  32%|███▏      | 63/200 [1:03:26<2:48:45, 73.91s/it, best=0.865]Pseudomonas_Aeruginosa | LPS | Optuna:  32%|███▏      | 63/200 [1:03:26<2:48:45, 73.91s/it, best=0.865][I 2026-03-04 21:02:09,821] Trial 57 finished with value: 0.8756881589210016 and parameters: {'activation': 'identity', 'solver': 'sgd', 'lr': 1.935829026995e-05, 'layer1': 243, 'layer2': 389, 'layer3': 223}. Best is trial 41 with value: 0.9325947076370852.
Klebsiella_Pneumoniae | LPS | Optuna:  29%|██▉       | 58/200 [1:03:52<2:31:41, 64.10s/it, best=0.933]Klebsiella_Pneumoniae | LPS | Optuna:  29%|██▉       | 58/200 [1:03:52<2:31:41, 64.10s/it, best=0.933][I 2026-03-04 21:02:56,298] Trial 41 finished with value: 0.8914386576140864 and parameters: {'activation': 'identity', 'solver': 'adam', 'lr': 0.00020011690857957106, 'layer1': 198, 'layer2': 132, 'layer3': 209}. Best is trial 22 with value: 0.8930759779387886.
Staphylococcus_Aureus | LPS | Optuna:  21%|██        | 42/200 [1:04:38<3:47:52, 86.54s/it, best=0.893]Staphylococcus_Aureus | LPS | Optuna:  21%|██        | 42/200 [1:04:38<3:47:52, 86.54s/it, best=0.893][I 2026-03-04 21:03:09,497] Trial 63 finished with value: 0.8614168605788546 and parameters: {'activation': 'relu', 'solver': 'adam', 'lr': 0.00019718507845770588, 'layer1': 314, 'layer2': 191, 'layer3': 425}. Best is trial 49 with value: 0.8647157569215889.
Pseudomonas_Aeruginosa | LPS | Optuna:  32%|███▏      | 64/200 [1:04:51<2:55:25, 77.39s/it, best=0.865]Pseudomonas_Aeruginosa | LPS | Optuna:  32%|███▏      | 64/200 [1:04:51<2:55:25, 77.39s/it, best=0.865][I 2026-03-04 21:03:26,059] Trial 26 finished with value: 0.5289643523130428 and parameters: {'activation': 'relu', 'solver': 'sgd', 'lr': 8.376801354395926e-06, 'layer1': 420, 'layer2': 67, 'layer3': 446}. Best is trial 14 with value: 0.863668804271893.
Escherichia_Coli | LPS | Optuna:  14%|█▎        | 27/200 [1:05:08<9:03:44, 188.58s/it, best=0.864]Escherichia_Coli | LPS | Optuna:  14%|█▎        | 27/200 [1:05:08<9:03:44, 188.58s/it, best=0.864][I 2026-03-04 21:03:39,319] Trial 58 finished with value: 0.9274645538168222 and parameters: {'activation': 'logistic', 'solver': 'adam', 'lr': 0.0005863609107765241, 'layer1': 349, 'layer2': 489, 'layer3': 106}. Best is trial 41 with value: 0.9325947076370852.
Klebsiella_Pneumoniae | LPS | Optuna:  30%|██▉       | 59/200 [1:05:21<2:48:32, 71.72s/it, best=0.933]Klebsiella_Pneumoniae | LPS | Optuna:  30%|██▉       | 59/200 [1:05:21<2:48:32, 71.72s/it, best=0.933][I 2026-03-04 21:04:07,677] Trial 42 finished with value: 0.8905746130514064 and parameters: {'activation': 'identity', 'solver': 'adam', 'lr': 0.0016807505035577003, 'layer1': 236, 'layer2': 159, 'layer3': 184}. Best is trial 22 with value: 0.8930759779387886.
Staphylococcus_Aureus | LPS | Optuna:  22%|██▏       | 43/200 [1:05:49<3:34:32, 81.99s/it, best=0.893]Staphylococcus_Aureus | LPS | Optuna:  22%|██▏       | 43/200 [1:05:49<3:34:32, 81.99s/it, best=0.893][I 2026-03-04 21:04:21,741] Trial 59 finished with value: 0.8958578587178995 and parameters: {'activation': 'tanh', 'solver': 'adam', 'lr': 0.005133842697634816, 'layer1': 28, 'layer2': 406, 'layer3': 24}. Best is trial 41 with value: 0.9325947076370852.
Klebsiella_Pneumoniae | LPS | Optuna:  30%|███       | 60/200 [1:06:03<2:26:50, 62.93s/it, best=0.933]Klebsiella_Pneumoniae | LPS | Optuna:  30%|███       | 60/200 [1:06:03<2:26:50, 62.93s/it, best=0.933][I 2026-03-04 21:04:56,046] Trial 64 finished with value: 0.8626490891169778 and parameters: {'activation': 'relu', 'solver': 'adam', 'lr': 8.496571644205793e-05, 'layer1': 266, 'layer2': 232, 'layer3': 63}. Best is trial 49 with value: 0.8647157569215889.
Pseudomonas_Aeruginosa | LPS | Optuna:  32%|███▎      | 65/200 [1:06:38<3:13:49, 86.14s/it, best=0.865]Pseudomonas_Aeruginosa | LPS | Optuna:  32%|███▎      | 65/200 [1:06:38<3:13:49, 86.14s/it, best=0.865][I 2026-03-04 21:05:01,478] Trial 43 finished with value: 0.8033421400034501 and parameters: {'activation': 'identity', 'solver': 'adam', 'lr': 1.2403668302547623e-06, 'layer1': 166, 'layer2': 189, 'layer3': 256}. Best is trial 22 with value: 0.8930759779387886.
Staphylococcus_Aureus | LPS | Optuna:  22%|██▏       | 44/200 [1:06:43<3:11:11, 73.53s/it, best=0.893]Staphylococcus_Aureus | LPS | Optuna:  22%|██▏       | 44/200 [1:06:43<3:11:11, 73.53s/it, best=0.893][I 2026-03-04 21:05:32,066] Trial 65 finished with value: 0.8269820396146932 and parameters: {'activation': 'relu', 'solver': 'adam', 'lr': 3.060199241064993e-05, 'layer1': 173, 'layer2': 333, 'layer3': 62}. Best is trial 49 with value: 0.8647157569215889.
Pseudomonas_Aeruginosa | LPS | Optuna:  33%|███▎      | 66/200 [1:07:14<2:38:48, 71.10s/it, best=0.865]Pseudomonas_Aeruginosa | LPS | Optuna:  33%|███▎      | 66/200 [1:07:14<2:38:48, 71.10s/it, best=0.865][I 2026-03-04 21:05:57,680] Trial 44 finished with value: 0.8918614618896628 and parameters: {'activation': 'identity', 'solver': 'adam', 'lr': 0.0008861827566431888, 'layer1': 122, 'layer2': 247, 'layer3': 162}. Best is trial 22 with value: 0.8930759779387886.
Staphylococcus_Aureus | LPS | Optuna:  22%|██▎       | 45/200 [1:07:39<2:56:31, 68.33s/it, best=0.893]Staphylococcus_Aureus | LPS | Optuna:  22%|██▎       | 45/200 [1:07:39<2:56:31, 68.33s/it, best=0.893][I 2026-03-04 21:05:59,821] Trial 60 finished with value: 0.9306348582204839 and parameters: {'activation': 'identity', 'solver': 'adam', 'lr': 3.984767364123964e-05, 'layer1': 213, 'layer2': 346, 'layer3': 247}. Best is trial 41 with value: 0.9325947076370852.
Klebsiella_Pneumoniae | LPS | Optuna:  30%|███       | 61/200 [1:07:42<2:50:12, 73.47s/it, best=0.933]Klebsiella_Pneumoniae | LPS | Optuna:  30%|███       | 61/200 [1:07:42<2:50:12, 73.47s/it, best=0.933][I 2026-03-04 21:06:18,883] Trial 27 finished with value: 0.8617774937255772 and parameters: {'activation': 'relu', 'solver': 'adam', 'lr': 4.6907560613132756e-05, 'layer1': 368, 'layer2': 112, 'layer3': 463}. Best is trial 14 with value: 0.863668804271893.
Escherichia_Coli | LPS | Optuna:  14%|█▍        | 28/200 [1:08:00<8:47:02, 183.85s/it, best=0.864]Escherichia_Coli | LPS | Optuna:  14%|█▍        | 28/200 [1:08:00<8:47:02, 183.85s/it, best=0.864][I 2026-03-04 21:06:35,519] Trial 66 finished with value: 0.8607090713036071 and parameters: {'activation': 'relu', 'solver': 'adam', 'lr': 0.00031808324551807135, 'layer1': 215, 'layer2': 292, 'layer3': 114}. Best is trial 49 with value: 0.8647157569215889.
Pseudomonas_Aeruginosa | LPS | Optuna:  34%|███▎      | 67/200 [1:08:17<2:32:31, 68.81s/it, best=0.865]Pseudomonas_Aeruginosa | LPS | Optuna:  34%|███▎      | 67/200 [1:08:17<2:32:31, 68.81s/it, best=0.865][I 2026-03-04 21:06:53,584] Trial 45 finished with value: 0.8881439127465883 and parameters: {'activation': 'identity', 'solver': 'adam', 'lr': 0.004931987671490605, 'layer1': 116, 'layer2': 311, 'layer3': 152}. Best is trial 22 with value: 0.8930759779387886.
Staphylococcus_Aureus | LPS | Optuna:  23%|██▎       | 46/200 [1:08:35<2:45:49, 64.60s/it, best=0.893]Staphylococcus_Aureus | LPS | Optuna:  23%|██▎       | 46/200 [1:08:35<2:45:49, 64.60s/it, best=0.893][I 2026-03-04 21:07:06,456] Trial 67 finished with value: 0.8272550062044512 and parameters: {'activation': 'tanh', 'solver': 'sgd', 'lr': 8.868098347065048e-05, 'layer1': 102, 'layer2': 252, 'layer3': 25}. Best is trial 49 with value: 0.8647157569215889.
Pseudomonas_Aeruginosa | LPS | Optuna:  34%|███▍      | 68/200 [1:08:48<2:06:23, 57.45s/it, best=0.865]Pseudomonas_Aeruginosa | LPS | Optuna:  34%|███▍      | 68/200 [1:08:48<2:06:23, 57.45s/it, best=0.865][I 2026-03-04 21:07:09,039] Trial 61 finished with value: 0.9310400112030639 and parameters: {'activation': 'tanh', 'solver': 'adam', 'lr': 4.709298058965829e-05, 'layer1': 52, 'layer2': 302, 'layer3': 180}. Best is trial 41 with value: 0.9325947076370852.
Klebsiella_Pneumoniae | LPS | Optuna:  31%|███       | 62/200 [1:08:51<2:46:03, 72.20s/it, best=0.933]Klebsiella_Pneumoniae | LPS | Optuna:  31%|███       | 62/200 [1:08:51<2:46:03, 72.20s/it, best=0.933][I 2026-03-04 21:07:44,064] Trial 68 finished with value: 0.8261898244308833 and parameters: {'activation': 'logistic', 'solver': 'adam', 'lr': 5.1885074786143304e-05, 'layer1': 265, 'layer2': 229, 'layer3': 61}. Best is trial 49 with value: 0.8647157569215889.
Pseudomonas_Aeruginosa | LPS | Optuna:  34%|███▍      | 69/200 [1:09:26<1:52:25, 51.50s/it, best=0.865]Pseudomonas_Aeruginosa | LPS | Optuna:  34%|███▍      | 69/200 [1:09:26<1:52:25, 51.50s/it, best=0.865][I 2026-03-04 21:07:45,894] Trial 28 finished with value: 0.7388067228206201 and parameters: {'activation': 'logistic', 'solver': 'adam', 'lr': 3.163778801486374e-05, 'layer1': 365, 'layer2': 106, 'layer3': 455}. Best is trial 14 with value: 0.863668804271893.
Escherichia_Coli | LPS | Optuna:  14%|█▍        | 29/200 [1:09:27<7:21:10, 154.80s/it, best=0.864]Escherichia_Coli | LPS | Optuna:  14%|█▍        | 29/200 [1:09:27<7:21:10, 154.80s/it, best=0.864][I 2026-03-04 21:08:00,805] Trial 46 finished with value: 0.8857388047167684 and parameters: {'activation': 'tanh', 'solver': 'adam', 'lr': 0.0009198904061099676, 'layer1': 64, 'layer2': 243, 'layer3': 111}. Best is trial 22 with value: 0.8930759779387886.
Staphylococcus_Aureus | LPS | Optuna:  24%|██▎       | 47/200 [1:09:42<2:46:44, 65.39s/it, best=0.893]Staphylococcus_Aureus | LPS | Optuna:  24%|██▎       | 47/200 [1:09:42<2:46:44, 65.39s/it, best=0.893][I 2026-03-04 21:08:09,772] Trial 69 finished with value: 0.8584212267230228 and parameters: {'activation': 'relu', 'solver': 'adam', 'lr': 0.002077214365635408, 'layer1': 38, 'layer2': 84, 'layer3': 140}. Best is trial 49 with value: 0.8647157569215889.
Pseudomonas_Aeruginosa | LPS | Optuna:  35%|███▌      | 70/200 [1:09:51<1:34:48, 43.76s/it, best=0.865]Pseudomonas_Aeruginosa | LPS | Optuna:  35%|███▌      | 70/200 [1:09:51<1:34:48, 43.76s/it, best=0.865][I 2026-03-04 21:08:16,081] Trial 62 finished with value: 0.9313640460742849 and parameters: {'activation': 'tanh', 'solver': 'adam', 'lr': 7.782929997099939e-05, 'layer1': 95, 'layer2': 278, 'layer3': 53}. Best is trial 41 with value: 0.9325947076370852.
Klebsiella_Pneumoniae | LPS | Optuna:  32%|███▏      | 63/200 [1:09:58<2:41:19, 70.65s/it, best=0.933]Klebsiella_Pneumoniae | LPS | Optuna:  32%|███▏      | 63/200 [1:09:58<2:41:19, 70.65s/it, best=0.933][I 2026-03-04 21:08:30,316] Trial 47 finished with value: 0.8022939582300058 and parameters: {'activation': 'identity', 'solver': 'sgd', 'lr': 0.0006745773677346341, 'layer1': 34, 'layer2': 291, 'layer3': 159}. Best is trial 22 with value: 0.8930759779387886.
Staphylococcus_Aureus | LPS | Optuna:  24%|██▍       | 48/200 [1:10:12<2:18:23, 54.63s/it, best=0.893]Staphylococcus_Aureus | LPS | Optuna:  24%|██▍       | 48/200 [1:10:12<2:18:23, 54.63s/it, best=0.893][I 2026-03-04 21:08:30,718] Trial 70 finished with value: 0.8270741037449347 and parameters: {'activation': 'identity', 'solver': 'adam', 'lr': 1.9695098886017966e-05, 'layer1': 74, 'layer2': 369, 'layer3': 33}. Best is trial 49 with value: 0.8647157569215889.
Pseudomonas_Aeruginosa | LPS | Optuna:  36%|███▌      | 71/200 [1:10:12<1:19:22, 36.92s/it, best=0.865]Pseudomonas_Aeruginosa | LPS | Optuna:  36%|███▌      | 71/200 [1:10:12<1:19:22, 36.92s/it, best=0.865][I 2026-03-04 21:09:20,642] Trial 29 finished with value: 0.7423343382038556 and parameters: {'activation': 'tanh', 'solver': 'sgd', 'lr': 2.8912644384523117e-05, 'layer1': 305, 'layer2': 58, 'layer3': 381}. Best is trial 14 with value: 0.863668804271893.
Escherichia_Coli | LPS | Optuna:  15%|█▌        | 30/200 [1:11:02<6:27:33, 136.78s/it, best=0.864]Escherichia_Coli | LPS | Optuna:  15%|█▌        | 30/200 [1:11:02<6:27:33, 136.78s/it, best=0.864][I 2026-03-04 21:09:36,902] Trial 48 finished with value: 0.8900970254409728 and parameters: {'activation': 'identity', 'solver': 'adam', 'lr': 0.0017332114237007448, 'layer1': 132, 'layer2': 216, 'layer3': 44}. Best is trial 22 with value: 0.8930759779387886.
Staphylococcus_Aureus | LPS | Optuna:  24%|██▍       | 49/200 [1:11:19<2:26:30, 58.21s/it, best=0.893]Staphylococcus_Aureus | LPS | Optuna:  24%|██▍       | 49/200 [1:11:19<2:26:30, 58.21s/it, best=0.893][I 2026-03-04 21:09:56,874] Trial 71 finished with value: 0.8615958556090332 and parameters: {'activation': 'relu', 'solver': 'adam', 'lr': 0.000107699803485985, 'layer1': 289, 'layer2': 211, 'layer3': 482}. Best is trial 49 with value: 0.8647157569215889.
Pseudomonas_Aeruginosa | LPS | Optuna:  36%|███▌      | 72/200 [1:11:39<1:50:16, 51.69s/it, best=0.865]Pseudomonas_Aeruginosa | LPS | Optuna:  36%|███▌      | 72/200 [1:11:39<1:50:16, 51.69s/it, best=0.865][I 2026-03-04 21:10:04,208] Trial 63 finished with value: 0.9312495180636697 and parameters: {'activation': 'tanh', 'solver': 'adam', 'lr': 2.676694162988517e-05, 'layer1': 171, 'layer2': 224, 'layer3': 153}. Best is trial 41 with value: 0.9325947076370852.
Klebsiella_Pneumoniae | LPS | Optuna:  32%|███▏      | 64/200 [1:11:46<3:05:37, 81.89s/it, best=0.933]Klebsiella_Pneumoniae | LPS | Optuna:  32%|███▏      | 64/200 [1:11:46<3:05:37, 81.89s/it, best=0.933][I 2026-03-04 21:10:36,277] Trial 49 finished with value: 0.8859863119907834 and parameters: {'activation': 'identity', 'solver': 'adam', 'lr': 0.004510134072206837, 'layer1': 152, 'layer2': 339, 'layer3': 133}. Best is trial 22 with value: 0.8930759779387886.
Staphylococcus_Aureus | LPS | Optuna:  25%|██▌       | 50/200 [1:12:18<2:26:24, 58.56s/it, best=0.893]Staphylococcus_Aureus | LPS | Optuna:  25%|██▌       | 50/200 [1:12:18<2:26:24, 58.56s/it, best=0.893][I 2026-03-04 21:10:41,755] Trial 30 finished with value: 0.7388067228206201 and parameters: {'activation': 'logistic', 'solver': 'adam', 'lr': 9.14618153065241e-06, 'layer1': 213, 'layer2': 257, 'layer3': 355}. Best is trial 14 with value: 0.863668804271893.
Escherichia_Coli | LPS | Optuna:  16%|█▌        | 31/200 [1:12:23<5:38:13, 120.08s/it, best=0.864]Escherichia_Coli | LPS | Optuna:  16%|█▌        | 31/200 [1:12:23<5:38:13, 120.08s/it, best=0.864][I 2026-03-04 21:10:54,060] Trial 64 finished with value: 0.9302152411756255 and parameters: {'activation': 'tanh', 'solver': 'adam', 'lr': 0.00014077988585178757, 'layer1': 70, 'layer2': 369, 'layer3': 122}. Best is trial 41 with value: 0.9325947076370852.
Klebsiella_Pneumoniae | LPS | Optuna:  32%|███▎      | 65/200 [1:12:36<2:42:37, 72.28s/it, best=0.933]Klebsiella_Pneumoniae | LPS | Optuna:  32%|███▎      | 65/200 [1:12:36<2:42:37, 72.28s/it, best=0.933][I 2026-03-04 21:11:26,531] Trial 65 finished with value: 0.8746470562584285 and parameters: {'activation': 'tanh', 'solver': 'adam', 'lr': 1.3370880056656189e-05, 'layer1': 62, 'layer2': 145, 'layer3': 500}. Best is trial 41 with value: 0.9325947076370852.
Klebsiella_Pneumoniae | LPS | Optuna:  33%|███▎      | 66/200 [1:13:08<2:14:45, 60.34s/it, best=0.933]Klebsiella_Pneumoniae | LPS | Optuna:  33%|███▎      | 66/200 [1:13:08<2:14:45, 60.34s/it, best=0.933][I 2026-03-04 21:11:35,504] Trial 72 finished with value: 0.8632448709952045 and parameters: {'activation': 'relu', 'solver': 'adam', 'lr': 7.371831947045586e-05, 'layer1': 249, 'layer2': 123, 'layer3': 442}. Best is trial 49 with value: 0.8647157569215889.
Pseudomonas_Aeruginosa | LPS | Optuna:  36%|███▋      | 73/200 [1:13:17<2:19:12, 65.77s/it, best=0.865]Pseudomonas_Aeruginosa | LPS | Optuna:  36%|███▋      | 73/200 [1:13:17<2:19:12, 65.77s/it, best=0.865][I 2026-03-04 21:11:40,190] Trial 50 finished with value: 0.890073338573569 and parameters: {'activation': 'tanh', 'solver': 'adam', 'lr': 0.0010980602435641438, 'layer1': 98, 'layer2': 269, 'layer3': 178}. Best is trial 22 with value: 0.8930759779387886.
Staphylococcus_Aureus | LPS | Optuna:  26%|██▌       | 51/200 [1:13:22<2:29:24, 60.17s/it, best=0.893]Staphylococcus_Aureus | LPS | Optuna:  26%|██▌       | 51/200 [1:13:22<2:29:24, 60.17s/it, best=0.893][I 2026-03-04 21:12:18,830] Trial 66 finished with value: 0.9293235790714387 and parameters: {'activation': 'identity', 'solver': 'adam', 'lr': 0.0003047011828889165, 'layer1': 114, 'layer2': 432, 'layer3': 190}. Best is trial 41 with value: 0.9325947076370852.
Klebsiella_Pneumoniae | LPS | Optuna:  34%|███▎      | 67/200 [1:14:01<2:08:24, 57.93s/it, best=0.933]Klebsiella_Pneumoniae | LPS | Optuna:  34%|███▎      | 67/200 [1:14:01<2:08:24, 57.93s/it, best=0.933][I 2026-03-04 21:12:28,156] Trial 73 finished with value: 0.8617741972524428 and parameters: {'activation': 'relu', 'solver': 'adam', 'lr': 0.002852193323510268, 'layer1': 203, 'layer2': 121, 'layer3': 435}. Best is trial 49 with value: 0.8647157569215889.
