Staphylococcus_Aureus | LPS | Optuna:  67%|██████▋   | 134/200 [2:57:43<58:19, 53.02s/it, best=0.894]  Staphylococcus_Aureus | LPS | Optuna:  67%|██████▋   | 134/200 [2:57:43<58:19, 53.02s/it, best=0.894][I 2026-03-04 22:56:01,348] Trial 147 finished with value: 0.9314899038263317 and parameters: {'activation': 'tanh', 'solver': 'adam', 'lr': 9.23893706973553e-05, 'layer1': 106, 'layer2': 292, 'layer3': 407}. Best is trial 104 with value: 0.9327898309005132.
Klebsiella_Pneumoniae | LPS | Optuna:  74%|███████▍  | 148/200 [2:57:43<1:02:01, 71.57s/it, best=0.933]Klebsiella_Pneumoniae | LPS | Optuna:  74%|███████▍  | 148/200 [2:57:43<1:02:01, 71.57s/it, best=0.933][I 2026-03-04 22:56:01,459] Trial 159 finished with value: 0.8268216179756734 and parameters: {'activation': 'relu', 'solver': 'sgd', 'lr': 0.000361504401742551, 'layer1': 118, 'layer2': 225, 'layer3': 489}. Best is trial 49 with value: 0.8647157569215889.
Pseudomonas_Aeruginosa | LPS | Optuna:  80%|████████  | 160/200 [2:57:43<39:54, 59.85s/it, best=0.865]Pseudomonas_Aeruginosa | LPS | Optuna:  80%|████████  | 160/200 [2:57:43<39:54, 59.85s/it, best=0.865][I 2026-03-04 22:56:39,977] Trial 134 finished with value: 0.8903360983544861 and parameters: {'activation': 'identity', 'solver': 'adam', 'lr': 0.001259779892919824, 'layer1': 68, 'layer2': 113, 'layer3': 79}. Best is trial 124 with value: 0.8938450095328893.
Staphylococcus_Aureus | LPS | Optuna:  68%|██████▊   | 135/200 [2:58:22<52:52, 48.81s/it, best=0.894]Staphylococcus_Aureus | LPS | Optuna:  68%|██████▊   | 135/200 [2:58:22<52:52, 48.81s/it, best=0.894][I 2026-03-04 22:56:40,876] Trial 160 finished with value: 0.8368110049828076 and parameters: {'activation': 'relu', 'solver': 'adam', 'lr': 7.348677393749488e-05, 'layer1': 18, 'layer2': 115, 'layer3': 159}. Best is trial 49 with value: 0.8647157569215889.
Pseudomonas_Aeruginosa | LPS | Optuna:  80%|████████  | 161/200 [2:58:23<34:55, 53.72s/it, best=0.865]Pseudomonas_Aeruginosa | LPS | Optuna:  80%|████████  | 161/200 [2:58:23<34:55, 53.72s/it, best=0.865][I 2026-03-04 22:56:44,822] Trial 148 finished with value: 0.8746470562584285 and parameters: {'activation': 'tanh', 'solver': 'adam', 'lr': 1.3673086609921967e-05, 'layer1': 200, 'layer2': 310, 'layer3': 56}. Best is trial 104 with value: 0.9327898309005132.
Klebsiella_Pneumoniae | LPS | Optuna:  74%|███████▍  | 149/200 [2:58:27<53:40, 63.14s/it, best=0.933]  Klebsiella_Pneumoniae | LPS | Optuna:  74%|███████▍  | 149/200 [2:58:27<53:40, 63.14s/it, best=0.933][I 2026-03-04 22:57:21,962] Trial 135 finished with value: 0.891012476842924 and parameters: {'activation': 'identity', 'solver': 'adam', 'lr': 0.0015548431112518313, 'layer1': 42, 'layer2': 99, 'layer3': 57}. Best is trial 124 with value: 0.8938450095328893.
Staphylococcus_Aureus | LPS | Optuna:  68%|██████▊   | 136/200 [2:59:04<49:52, 46.76s/it, best=0.894]Staphylococcus_Aureus | LPS | Optuna:  68%|██████▊   | 136/200 [2:59:04<49:52, 46.76s/it, best=0.894][I 2026-03-04 22:57:46,030] Trial 161 finished with value: 0.860829198913579 and parameters: {'activation': 'identity', 'solver': 'adam', 'lr': 0.0016338672271657816, 'layer1': 372, 'layer2': 206, 'layer3': 500}. Best is trial 49 with value: 0.8647157569215889.
Pseudomonas_Aeruginosa | LPS | Optuna:  81%|████████  | 162/200 [2:59:28<36:11, 57.15s/it, best=0.865]Pseudomonas_Aeruginosa | LPS | Optuna:  81%|████████  | 162/200 [2:59:28<36:11, 57.15s/it, best=0.865][I 2026-03-04 22:58:06,656] Trial 136 finished with value: 0.8912156394743637 and parameters: {'activation': 'identity', 'solver': 'adam', 'lr': 0.000863000347408919, 'layer1': 80, 'layer2': 86, 'layer3': 25}. Best is trial 124 with value: 0.8938450095328893.
Staphylococcus_Aureus | LPS | Optuna:  68%|██████▊   | 137/200 [2:59:48<48:26, 46.14s/it, best=0.894]Staphylococcus_Aureus | LPS | Optuna:  68%|██████▊   | 137/200 [2:59:48<48:26, 46.14s/it, best=0.894][I 2026-03-04 22:58:29,793] Trial 162 finished with value: 0.8615165524769784 and parameters: {'activation': 'identity', 'solver': 'adam', 'lr': 0.0010037263609644256, 'layer1': 143, 'layer2': 185, 'layer3': 57}. Best is trial 49 with value: 0.8647157569215889.
Pseudomonas_Aeruginosa | LPS | Optuna:  82%|████████▏ | 163/200 [3:00:12<32:45, 53.13s/it, best=0.865]Pseudomonas_Aeruginosa | LPS | Optuna:  82%|████████▏ | 163/200 [3:00:12<32:45, 53.13s/it, best=0.865][I 2026-03-04 22:58:43,348] Trial 149 finished with value: 0.930306575013485 and parameters: {'activation': 'tanh', 'solver': 'adam', 'lr': 2.3274702167293667e-05, 'layer1': 150, 'layer2': 255, 'layer3': 334}. Best is trial 104 with value: 0.9327898309005132.
Klebsiella_Pneumoniae | LPS | Optuna:  75%|███████▌  | 150/200 [3:00:25<1:06:27, 79.76s/it, best=0.933]Klebsiella_Pneumoniae | LPS | Optuna:  75%|███████▌  | 150/200 [3:00:25<1:06:27, 79.76s/it, best=0.933][I 2026-03-04 22:59:19,639] Trial 150 finished with value: 0.9295482467037302 and parameters: {'activation': 'identity', 'solver': 'adam', 'lr': 0.004428925449719243, 'layer1': 62, 'layer2': 425, 'layer3': 34}. Best is trial 104 with value: 0.9327898309005132.
Klebsiella_Pneumoniae | LPS | Optuna:  76%|███████▌  | 151/200 [3:01:01<54:29, 66.72s/it, best=0.933]  Klebsiella_Pneumoniae | LPS | Optuna:  76%|███████▌  | 151/200 [3:01:01<54:29, 66.72s/it, best=0.933][I 2026-03-04 22:59:26,801] Trial 137 finished with value: 0.891319186883116 and parameters: {'activation': 'identity', 'solver': 'adam', 'lr': 0.00032428293531430345, 'layer1': 252, 'layer2': 131, 'layer3': 154}. Best is trial 124 with value: 0.8938450095328893.
Staphylococcus_Aureus | LPS | Optuna:  69%|██████▉   | 138/200 [3:01:08<58:13, 56.34s/it, best=0.894]Staphylococcus_Aureus | LPS | Optuna:  69%|██████▉   | 138/200 [3:01:08<58:13, 56.34s/it, best=0.894][I 2026-03-04 22:59:38,044] Trial 163 finished with value: 0.8610645411101812 and parameters: {'activation': 'tanh', 'solver': 'adam', 'lr': 0.0006749627512383331, 'layer1': 366, 'layer2': 235, 'layer3': 209}. Best is trial 49 with value: 0.8647157569215889.
Pseudomonas_Aeruginosa | LPS | Optuna:  82%|████████▏ | 164/200 [3:01:20<34:36, 57.67s/it, best=0.865]Pseudomonas_Aeruginosa | LPS | Optuna:  82%|████████▏ | 164/200 [3:01:20<34:36, 57.67s/it, best=0.865][I 2026-03-04 23:00:11,049] Trial 164 finished with value: 0.860420882742537 and parameters: {'activation': 'identity', 'solver': 'adam', 'lr': 0.0013951449549186755, 'layer1': 66, 'layer2': 220, 'layer3': 170}. Best is trial 49 with value: 0.8647157569215889.
Pseudomonas_Aeruginosa | LPS | Optuna:  82%|████████▎ | 165/200 [3:01:53<29:19, 50.27s/it, best=0.865]Pseudomonas_Aeruginosa | LPS | Optuna:  82%|████████▎ | 165/200 [3:01:53<29:19, 50.27s/it, best=0.865][I 2026-03-04 23:00:12,337] Trial 65 finished with value: 0.8129020615665382 and parameters: {'activation': 'relu', 'solver': 'adam', 'lr': 9.342745194471608e-06, 'layer1': 441, 'layer2': 125, 'layer3': 128}. Best is trial 14 with value: 0.863668804271893.
Escherichia_Coli | LPS | Optuna:  33%|███▎      | 66/200 [3:01:54<8:22:10, 224.86s/it, best=0.864]Escherichia_Coli | LPS | Optuna:  33%|███▎      | 66/200 [3:01:54<8:22:10, 224.86s/it, best=0.864][I 2026-03-04 23:00:28,297] Trial 138 finished with value: 0.8895194210365911 and parameters: {'activation': 'tanh', 'solver': 'adam', 'lr': 0.0006399285162123393, 'layer1': 114, 'layer2': 103, 'layer3': 302}. Best is trial 124 with value: 0.8938450095328893.
Staphylococcus_Aureus | LPS | Optuna:  70%|██████▉   | 139/200 [3:02:10<58:51, 57.89s/it, best=0.894]Staphylococcus_Aureus | LPS | Optuna:  70%|██████▉   | 139/200 [3:02:10<58:51, 57.89s/it, best=0.894][I 2026-03-04 23:00:36,238] Trial 151 finished with value: 0.9320505330701353 and parameters: {'activation': 'tanh', 'solver': 'adam', 'lr': 7.27761701757958e-05, 'layer1': 196, 'layer2': 281, 'layer3': 91}. Best is trial 104 with value: 0.9327898309005132.
Klebsiella_Pneumoniae | LPS | Optuna:  76%|███████▌  | 152/200 [3:02:18<55:44, 69.68s/it, best=0.933]Klebsiella_Pneumoniae | LPS | Optuna:  76%|███████▌  | 152/200 [3:02:18<55:44, 69.68s/it, best=0.933][I 2026-03-04 23:01:22,664] Trial 165 finished with value: 0.8591055896049504 and parameters: {'activation': 'relu', 'solver': 'adam', 'lr': 0.0008841072714692698, 'layer1': 330, 'layer2': 200, 'layer3': 175}. Best is trial 49 with value: 0.8647157569215889.
Pseudomonas_Aeruginosa | LPS | Optuna:  83%|████████▎ | 166/200 [3:03:04<32:06, 56.67s/it, best=0.865]Pseudomonas_Aeruginosa | LPS | Optuna:  83%|████████▎ | 166/200 [3:03:04<32:06, 56.67s/it, best=0.865][I 2026-03-04 23:01:53,647] Trial 139 finished with value: 0.8930274519406673 and parameters: {'activation': 'identity', 'solver': 'adam', 'lr': 0.0011103838426438522, 'layer1': 291, 'layer2': 109, 'layer3': 127}. Best is trial 124 with value: 0.8938450095328893.
Staphylococcus_Aureus | LPS | Optuna:  70%|███████   | 140/200 [3:03:35<1:06:07, 66.13s/it, best=0.894]Staphylococcus_Aureus | LPS | Optuna:  70%|███████   | 140/200 [3:03:35<1:06:07, 66.13s/it, best=0.894][I 2026-03-04 23:02:01,266] Trial 152 finished with value: 0.9320100185842446 and parameters: {'activation': 'tanh', 'solver': 'adam', 'lr': 6.881298568554162e-05, 'layer1': 219, 'layer2': 275, 'layer3': 97}. Best is trial 104 with value: 0.9327898309005132.
Klebsiella_Pneumoniae | LPS | Optuna:  76%|███████▋  | 153/200 [3:03:43<58:11, 74.29s/it, best=0.933]Klebsiella_Pneumoniae | LPS | Optuna:  76%|███████▋  | 153/200 [3:03:43<58:11, 74.29s/it, best=0.933][I 2026-03-04 23:02:42,407] Trial 140 finished with value: 0.802337221083187 and parameters: {'activation': 'identity', 'solver': 'sgd', 'lr': 0.0010303270052309165, 'layer1': 296, 'layer2': 74, 'layer3': 123}. Best is trial 124 with value: 0.8938450095328893.
Staphylococcus_Aureus | LPS | Optuna:  70%|███████   | 141/200 [3:04:24<59:54, 60.92s/it, best=0.894]  Staphylococcus_Aureus | LPS | Optuna:  70%|███████   | 141/200 [3:04:24<59:54, 60.92s/it, best=0.894][I 2026-03-04 23:03:14,353] Trial 166 finished with value: 0.8580875273731369 and parameters: {'activation': 'identity', 'solver': 'adam', 'lr': 9.437255525261445e-05, 'layer1': 426, 'layer2': 49, 'layer3': 456}. Best is trial 49 with value: 0.8647157569215889.
Pseudomonas_Aeruginosa | LPS | Optuna:  84%|████████▎ | 167/200 [3:04:56<40:14, 73.18s/it, best=0.865]Pseudomonas_Aeruginosa | LPS | Optuna:  84%|████████▎ | 167/200 [3:04:56<40:14, 73.18s/it, best=0.865][I 2026-03-04 23:03:25,246] Trial 153 finished with value: 0.9310893882203404 and parameters: {'activation': 'tanh', 'solver': 'adam', 'lr': 6.85120161134161e-05, 'layer1': 219, 'layer2': 281, 'layer3': 91}. Best is trial 104 with value: 0.9327898309005132.
Klebsiella_Pneumoniae | LPS | Optuna:  77%|███████▋  | 154/200 [3:05:07<59:10, 77.19s/it, best=0.933]Klebsiella_Pneumoniae | LPS | Optuna:  77%|███████▋  | 154/200 [3:05:07<59:10, 77.19s/it, best=0.933][I 2026-03-04 23:04:11,076] Trial 167 finished with value: 0.8487745506659208 and parameters: {'activation': 'logistic', 'solver': 'adam', 'lr': 0.001607677335763275, 'layer1': 48, 'layer2': 239, 'layer3': 48}. Best is trial 49 with value: 0.8647157569215889.
Pseudomonas_Aeruginosa | LPS | Optuna:  84%|████████▍ | 168/200 [3:05:53<36:23, 68.24s/it, best=0.865]Pseudomonas_Aeruginosa | LPS | Optuna:  84%|████████▍ | 168/200 [3:05:53<36:23, 68.24s/it, best=0.865][I 2026-03-04 23:04:15,034] Trial 141 finished with value: 0.8908507653008165 and parameters: {'activation': 'identity', 'solver': 'adam', 'lr': 0.002047042533270953, 'layer1': 320, 'layer2': 106, 'layer3': 133}. Best is trial 124 with value: 0.8938450095328893.
Staphylococcus_Aureus | LPS | Optuna:  71%|███████   | 142/200 [3:05:57<1:08:04, 70.43s/it, best=0.894]Staphylococcus_Aureus | LPS | Optuna:  71%|███████   | 142/200 [3:05:57<1:08:04, 70.43s/it, best=0.894][I 2026-03-04 23:04:35,555] Trial 154 finished with value: 0.9311390491787035 and parameters: {'activation': 'tanh', 'solver': 'adam', 'lr': 0.000105618584898672, 'layer1': 226, 'layer2': 321, 'layer3': 115}. Best is trial 104 with value: 0.9327898309005132.
Klebsiella_Pneumoniae | LPS | Optuna:  78%|███████▊  | 155/200 [3:06:17<56:20, 75.13s/it, best=0.933]Klebsiella_Pneumoniae | LPS | Optuna:  78%|███████▊  | 155/200 [3:06:17<56:20, 75.13s/it, best=0.933][I 2026-03-04 23:04:38,218] Trial 66 finished with value: 0.8631590093840666 and parameters: {'activation': 'relu', 'solver': 'adam', 'lr': 2.6900708377103517e-05, 'layer1': 415, 'layer2': 86, 'layer3': 462}. Best is trial 14 with value: 0.863668804271893.
Escherichia_Coli | LPS | Optuna:  34%|███▎      | 67/200 [3:06:20<8:45:42, 237.16s/it, best=0.864]Escherichia_Coli | LPS | Optuna:  34%|███▎      | 67/200 [3:06:20<8:45:42, 237.16s/it, best=0.864][I 2026-03-04 23:05:17,988] Trial 168 finished with value: 0.8600004849072906 and parameters: {'activation': 'relu', 'solver': 'adam', 'lr': 0.0011605247638575716, 'layer1': 355, 'layer2': 24, 'layer3': 145}. Best is trial 49 with value: 0.8647157569215889.
Pseudomonas_Aeruginosa | LPS | Optuna:  84%|████████▍ | 169/200 [3:07:00<35:03, 67.84s/it, best=0.865]Pseudomonas_Aeruginosa | LPS | Optuna:  84%|████████▍ | 169/200 [3:07:00<35:03, 67.84s/it, best=0.865][I 2026-03-04 23:05:32,360] Trial 142 finished with value: 0.8935611746486474 and parameters: {'activation': 'identity', 'solver': 'adam', 'lr': 0.0013967697079049883, 'layer1': 275, 'layer2': 142, 'layer3': 144}. Best is trial 124 with value: 0.8938450095328893.
Staphylococcus_Aureus | LPS | Optuna:  72%|███████▏  | 143/200 [3:07:14<1:08:52, 72.50s/it, best=0.894]Staphylococcus_Aureus | LPS | Optuna:  72%|███████▏  | 143/200 [3:07:14<1:08:52, 72.50s/it, best=0.894][I 2026-03-04 23:06:04,824] Trial 169 finished with value: 0.8591473005826412 and parameters: {'activation': 'identity', 'solver': 'adam', 'lr': 0.00017949702658413995, 'layer1': 185, 'layer2': 73, 'layer3': 484}. Best is trial 49 with value: 0.8647157569215889.
Pseudomonas_Aeruginosa | LPS | Optuna:  85%|████████▌ | 170/200 [3:07:47<30:46, 61.54s/it, best=0.865]Pseudomonas_Aeruginosa | LPS | Optuna:  85%|████████▌ | 170/200 [3:07:47<30:46, 61.54s/it, best=0.865][I 2026-03-04 23:06:11,174] Trial 155 finished with value: 0.9319201015146037 and parameters: {'activation': 'tanh', 'solver': 'adam', 'lr': 5.029941980095563e-05, 'layer1': 210, 'layer2': 293, 'layer3': 100}. Best is trial 104 with value: 0.9327898309005132.
Klebsiella_Pneumoniae | LPS | Optuna:  78%|███████▊  | 156/200 [3:07:53<59:36, 81.28s/it, best=0.933]Klebsiella_Pneumoniae | LPS | Optuna:  78%|███████▊  | 156/200 [3:07:53<59:36, 81.28s/it, best=0.933][I 2026-03-04 23:07:05,615] Trial 143 finished with value: 0.8910164818966815 and parameters: {'activation': 'identity', 'solver': 'adam', 'lr': 0.0024880945887812986, 'layer1': 280, 'layer2': 140, 'layer3': 109}. Best is trial 124 with value: 0.8938450095328893.
Staphylococcus_Aureus | LPS | Optuna:  72%|███████▏  | 144/200 [3:08:47<1:13:28, 78.73s/it, best=0.894]Staphylococcus_Aureus | LPS | Optuna:  72%|███████▏  | 144/200 [3:08:47<1:13:28, 78.73s/it, best=0.894][I 2026-03-04 23:07:06,549] Trial 67 finished with value: 0.8608738144069086 and parameters: {'activation': 'relu', 'solver': 'adam', 'lr': 2.8099376273045883e-05, 'layer1': 102, 'layer2': 92, 'layer3': 460}. Best is trial 14 with value: 0.863668804271893.
Escherichia_Coli | LPS | Optuna:  34%|███▍      | 68/200 [3:08:48<7:43:07, 210.51s/it, best=0.864]Escherichia_Coli | LPS | Optuna:  34%|███▍      | 68/200 [3:08:48<7:43:07, 210.51s/it, best=0.864][I 2026-03-04 23:07:31,655] Trial 170 finished with value: 0.8633104408622104 and parameters: {'activation': 'relu', 'solver': 'adam', 'lr': 0.005456616934992638, 'layer1': 418, 'layer2': 209, 'layer3': 407}. Best is trial 49 with value: 0.8647157569215889.
Pseudomonas_Aeruginosa | LPS | Optuna:  86%|████████▌ | 171/200 [3:09:13<33:24, 69.13s/it, best=0.865]Pseudomonas_Aeruginosa | LPS | Optuna:  86%|████████▌ | 171/200 [3:09:13<33:24, 69.13s/it, best=0.865][I 2026-03-04 23:07:54,819] Trial 156 finished with value: 0.9307532233289543 and parameters: {'activation': 'tanh', 'solver': 'adam', 'lr': 4.9245845507519786e-05, 'layer1': 210, 'layer2': 298, 'layer3': 100}. Best is trial 104 with value: 0.9327898309005132.
Klebsiella_Pneumoniae | LPS | Optuna:  78%|███████▊  | 157/200 [3:09:37<1:03:03, 87.99s/it, best=0.933]Klebsiella_Pneumoniae | LPS | Optuna:  78%|███████▊  | 157/200 [3:09:37<1:03:03, 87.99s/it, best=0.933][I 2026-03-04 23:08:40,593] Trial 144 finished with value: 0.8916982773249478 and parameters: {'activation': 'identity', 'solver': 'adam', 'lr': 0.0014214627387171934, 'layer1': 302, 'layer2': 171, 'layer3': 143}. Best is trial 124 with value: 0.8938450095328893.
Staphylococcus_Aureus | LPS | Optuna:  72%|███████▎  | 145/200 [3:10:22<1:16:38, 83.60s/it, best=0.894]Staphylococcus_Aureus | LPS | Optuna:  72%|███████▎  | 145/200 [3:10:22<1:16:38, 83.60s/it, best=0.894][I 2026-03-04 23:09:04,951] Trial 157 finished with value: 0.9301954928990577 and parameters: {'activation': 'tanh', 'solver': 'adam', 'lr': 0.00013645440056797722, 'layer1': 194, 'layer2': 273, 'layer3': 80}. Best is trial 104 with value: 0.9327898309005132.
Klebsiella_Pneumoniae | LPS | Optuna:  79%|███████▉  | 158/200 [3:10:47<57:50, 82.63s/it, best=0.933]  Klebsiella_Pneumoniae | LPS | Optuna:  79%|███████▉  | 158/200 [3:10:47<57:50, 82.63s/it, best=0.933][I 2026-03-04 23:09:14,520] Trial 171 finished with value: 0.8609364583869196 and parameters: {'activation': 'relu', 'solver': 'adam', 'lr': 0.006268384770524623, 'layer1': 413, 'layer2': 220, 'layer3': 417}. Best is trial 49 with value: 0.8647157569215889.
Pseudomonas_Aeruginosa | LPS | Optuna:  86%|████████▌ | 172/200 [3:10:56<36:58, 79.25s/it, best=0.865]Pseudomonas_Aeruginosa | LPS | Optuna:  86%|████████▌ | 172/200 [3:10:56<36:58, 79.25s/it, best=0.865][I 2026-03-04 23:09:18,641] Trial 68 finished with value: 0.8619036356747406 and parameters: {'activation': 'tanh', 'solver': 'adam', 'lr': 0.00016491767985198617, 'layer1': 407, 'layer2': 38, 'layer3': 399}. Best is trial 14 with value: 0.863668804271893.
Escherichia_Coli | LPS | Optuna:  34%|███▍      | 69/200 [3:11:00<6:48:15, 186.99s/it, best=0.864]Escherichia_Coli | LPS | Optuna:  34%|███▍      | 69/200 [3:11:00<6:48:15, 186.99s/it, best=0.864][I 2026-03-04 23:10:13,334] Trial 145 finished with value: 0.8896485292598285 and parameters: {'activation': 'identity', 'solver': 'adam', 'lr': 0.0011500994200155852, 'layer1': 290, 'layer2': 116, 'layer3': 116}. Best is trial 124 with value: 0.8938450095328893.
Staphylococcus_Aureus | LPS | Optuna:  73%|███████▎  | 146/200 [3:11:55<1:17:42, 86.34s/it, best=0.894]Staphylococcus_Aureus | LPS | Optuna:  73%|███████▎  | 146/200 [3:11:55<1:17:42, 86.34s/it, best=0.894][I 2026-03-04 23:10:18,221] Trial 158 finished with value: 0.9323025515389455 and parameters: {'activation': 'tanh', 'solver': 'adam', 'lr': 7.796685290141916e-05, 'layer1': 188, 'layer2': 301, 'layer3': 95}. Best is trial 104 with value: 0.9327898309005132.
Klebsiella_Pneumoniae | LPS | Optuna:  80%|███████▉  | 159/200 [3:12:00<54:32, 79.82s/it, best=0.933]Klebsiella_Pneumoniae | LPS | Optuna:  80%|███████▉  | 159/200 [3:12:00<54:32, 79.82s/it, best=0.933][I 2026-03-04 23:10:54,190] Trial 172 finished with value: 0.8682843857718467 and parameters: {'activation': 'relu', 'solver': 'adam', 'lr': 0.004215968282365892, 'layer1': 402, 'layer2': 208, 'layer3': 435}. Best is trial 172 with value: 0.8682843857718467.
Pseudomonas_Aeruginosa | LPS | Optuna:  86%|████████▋ | 173/200 [3:12:36<38:25, 85.38s/it, best=0.865]Pseudomonas_Aeruginosa | LPS | Optuna:  86%|████████▋ | 173/200 [3:12:36<38:25, 85.38s/it, best=0.868][I 2026-03-04 23:11:25,737] Trial 159 finished with value: 0.9322022877789035 and parameters: {'activation': 'tanh', 'solver': 'adam', 'lr': 8.536572220932021e-05, 'layer1': 116, 'layer2': 286, 'layer3': 110}. Best is trial 104 with value: 0.9327898309005132.
Klebsiella_Pneumoniae | LPS | Optuna:  80%|████████  | 160/200 [3:13:07<50:45, 76.13s/it, best=0.933]Klebsiella_Pneumoniae | LPS | Optuna:  80%|████████  | 160/200 [3:13:07<50:45, 76.13s/it, best=0.933][I 2026-03-04 23:11:38,831] Trial 146 finished with value: 0.8906071494074943 and parameters: {'activation': 'identity', 'solver': 'adam', 'lr': 0.0031665915402206736, 'layer1': 274, 'layer2': 154, 'layer3': 130}. Best is trial 124 with value: 0.8938450095328893.
Staphylococcus_Aureus | LPS | Optuna:  74%|███████▎  | 147/200 [3:13:20<1:16:02, 86.09s/it, best=0.894]Staphylococcus_Aureus | LPS | Optuna:  74%|███████▎  | 147/200 [3:13:20<1:16:02, 86.09s/it, best=0.894][I 2026-03-04 23:11:59,461] Trial 160 finished with value: 0.8770935484376331 and parameters: {'activation': 'tanh', 'solver': 'sgd', 'lr': 8.110833110826766e-05, 'layer1': 80, 'layer2': 264, 'layer3': 86}. Best is trial 104 with value: 0.9327898309005132.
Klebsiella_Pneumoniae | LPS | Optuna:  80%|████████  | 161/200 [3:13:41<41:12, 63.41s/it, best=0.933]Klebsiella_Pneumoniae | LPS | Optuna:  80%|████████  | 161/200 [3:13:41<41:12, 63.41s/it, best=0.933][I 2026-03-04 23:12:03,304] Trial 69 finished with value: 0.8626360582627417 and parameters: {'activation': 'relu', 'solver': 'adam', 'lr': 8.777194099584447e-05, 'layer1': 416, 'layer2': 84, 'layer3': 448}. Best is trial 14 with value: 0.863668804271893.
Escherichia_Coli | LPS | Optuna:  35%|███▌      | 70/200 [3:13:45<6:30:37, 180.29s/it, best=0.864]Escherichia_Coli | LPS | Optuna:  35%|███▌      | 70/200 [3:13:45<6:30:37, 180.29s/it, best=0.864][I 2026-03-04 23:12:20,099] Trial 173 finished with value: 0.8641783343663205 and parameters: {'activation': 'relu', 'solver': 'adam', 'lr': 0.004180748785880511, 'layer1': 410, 'layer2': 209, 'layer3': 429}. Best is trial 172 with value: 0.8682843857718467.
