Staphylococcus_Aureus | LPS | Optuna:  98%|█████████▊| 196/200 [4:29:48<05:59, 89.90s/it, best=0.894]Staphylococcus_Aureus | LPS | Optuna:  98%|█████████▊| 196/200 [4:29:48<05:59, 89.90s/it, best=0.894][I 2026-03-05 00:28:22,571] Trial 22 finished with value: 0.9298550683663237 and parameters: {'activation': 'relu', 'solver': 'adam', 'lr': 0.0003843653478914359, 'layer1': 222, 'layer2': 355, 'layer3': 118}. Best is trial 21 with value: 0.9305626294567638.
Klebsiella_Pneumoniae | DirectMulti | Optuna:  12%|█▏        | 23/200 [26:54<3:01:55, 61.67s/it, best=0.931]Klebsiella_Pneumoniae | DirectMulti | Optuna:  12%|█▏        | 23/200 [26:54<3:01:55, 61.67s/it, best=0.931][I 2026-03-05 00:29:13,249] Trial 90 finished with value: 0.7389302046851636 and parameters: {'activation': 'tanh', 'solver': 'adam', 'lr': 1.5124195013295955e-05, 'layer1': 449, 'layer2': 13, 'layer3': 62}. Best is trial 73 with value: 0.864893646817533.
Escherichia_Coli | LPS | Optuna:  46%|████▌     | 91/200 [4:30:55<5:44:58, 189.89s/it, best=0.865]Escherichia_Coli | LPS | Optuna:  46%|████▌     | 91/200 [4:30:55<5:44:58, 189.89s/it, best=0.865][I 2026-03-05 00:29:25,612] Trial 196 finished with value: 0.8903686691733673 and parameters: {'activation': 'identity', 'solver': 'adam', 'lr': 0.001468221282042384, 'layer1': 251, 'layer2': 278, 'layer3': 205}. Best is trial 184 with value: 0.8938593741576225.
Staphylococcus_Aureus | LPS | Optuna:  98%|█████████▊| 197/200 [4:31:07<04:20, 86.71s/it, best=0.894]Staphylococcus_Aureus | LPS | Optuna:  98%|█████████▊| 197/200 [4:31:07<04:20, 86.71s/it, best=0.894][I 2026-03-05 00:29:33,438] Trial 27 finished with value: 0.8618248900200933 and parameters: {'activation': 'relu', 'solver': 'adam', 'lr': 0.0018820040316420753, 'layer1': 453, 'layer2': 193, 'layer3': 413}. Best is trial 23 with value: 0.8649994822247168.
Pseudomonas_Aeruginosa | DirectMulti | Optuna:  14%|█▍        | 28/200 [35:27<4:00:50, 84.02s/it, best=0.865]Pseudomonas_Aeruginosa | DirectMulti | Optuna:  14%|█▍        | 28/200 [35:27<4:00:50, 84.02s/it, best=0.865][I 2026-03-05 00:29:39,561] Trial 23 finished with value: 0.9265848313099989 and parameters: {'activation': 'relu', 'solver': 'adam', 'lr': 0.0036714839884436482, 'layer1': 227, 'layer2': 341, 'layer3': 122}. Best is trial 21 with value: 0.9305626294567638.
Klebsiella_Pneumoniae | DirectMulti | Optuna:  12%|█▏        | 24/200 [28:11<3:14:22, 66.27s/it, best=0.931]Klebsiella_Pneumoniae | DirectMulti | Optuna:  12%|█▏        | 24/200 [28:11<3:14:22, 66.27s/it, best=0.931][I 2026-03-05 00:30:54,340] Trial 197 finished with value: 0.895291438550062 and parameters: {'activation': 'identity', 'solver': 'adam', 'lr': 0.0008078817205716293, 'layer1': 289, 'layer2': 242, 'layer3': 189}. Best is trial 197 with value: 0.895291438550062.
Staphylococcus_Aureus | LPS | Optuna:  99%|█████████▉| 198/200 [4:32:36<02:54, 87.31s/it, best=0.894]Staphylococcus_Aureus | LPS | Optuna:  99%|█████████▉| 198/200 [4:32:36<02:54, 87.31s/it, best=0.895][I 2026-03-05 00:31:01,259] Trial 24 finished with value: 0.9285317457559514 and parameters: {'activation': 'relu', 'solver': 'adam', 'lr': 0.000537713159869917, 'layer1': 309, 'layer2': 252, 'layer3': 193}. Best is trial 21 with value: 0.9305626294567638.
Klebsiella_Pneumoniae | DirectMulti | Optuna:  12%|█▎        | 25/200 [29:33<3:26:46, 70.90s/it, best=0.931]Klebsiella_Pneumoniae | DirectMulti | Optuna:  12%|█▎        | 25/200 [29:33<3:26:46, 70.90s/it, best=0.931][I 2026-03-05 00:31:58,442] Trial 28 finished with value: 0.8571649208552158 and parameters: {'activation': 'logistic', 'solver': 'adam', 'lr': 0.00029490821206316215, 'layer1': 414, 'layer2': 251, 'layer3': 132}. Best is trial 23 with value: 0.8649994822247168.
Pseudomonas_Aeruginosa | DirectMulti | Optuna:  14%|█▍        | 29/200 [37:52<4:51:35, 102.31s/it, best=0.865]Pseudomonas_Aeruginosa | DirectMulti | Optuna:  14%|█▍        | 29/200 [37:52<4:51:35, 102.31s/it, best=0.865][I 2026-03-05 00:32:05,531] Trial 25 finished with value: 0.9308766784644542 and parameters: {'activation': 'tanh', 'solver': 'adam', 'lr': 9.070037793115918e-05, 'layer1': 88, 'layer2': 335, 'layer3': 258}. Best is trial 25 with value: 0.9308766784644542.
Klebsiella_Pneumoniae | DirectMulti | Optuna:  13%|█▎        | 26/200 [30:37<3:19:50, 68.91s/it, best=0.931]Klebsiella_Pneumoniae | DirectMulti | Optuna:  13%|█▎        | 26/200 [30:37<3:19:50, 68.91s/it, best=0.931][I 2026-03-05 00:32:41,330] Trial 198 finished with value: 0.8906039563953794 and parameters: {'activation': 'identity', 'solver': 'adam', 'lr': 0.002184019044635494, 'layer1': 271, 'layer2': 246, 'layer3': 191}. Best is trial 197 with value: 0.895291438550062.
Staphylococcus_Aureus | LPS | Optuna: 100%|█████████▉| 199/200 [4:34:23<01:33, 93.22s/it, best=0.895]Staphylococcus_Aureus | LPS | Optuna: 100%|█████████▉| 199/200 [4:34:23<01:33, 93.22s/it, best=0.895][I 2026-03-05 00:32:42,461] Trial 29 finished with value: 0.826631727610288 and parameters: {'activation': 'tanh', 'solver': 'sgd', 'lr': 0.004966776982370136, 'layer1': 468, 'layer2': 125, 'layer3': 338}. Best is trial 23 with value: 0.8649994822247168.
Pseudomonas_Aeruginosa | DirectMulti | Optuna:  15%|█▌        | 30/200 [38:36<4:00:20, 84.82s/it, best=0.865] Pseudomonas_Aeruginosa | DirectMulti | Optuna:  15%|█▌        | 30/200 [38:36<4:00:20, 84.82s/it, best=0.865][I 2026-03-05 00:33:33,599] Trial 91 finished with value: 0.8631916355256071 and parameters: {'activation': 'tanh', 'solver': 'adam', 'lr': 2.5653038530532273e-05, 'layer1': 431, 'layer2': 37, 'layer3': 396}. Best is trial 73 with value: 0.864893646817533.
Escherichia_Coli | LPS | Optuna:  46%|████▌     | 92/200 [4:35:15<6:19:51, 211.03s/it, best=0.865]Escherichia_Coli | LPS | Optuna:  46%|████▌     | 92/200 [4:35:15<6:19:51, 211.03s/it, best=0.865][I 2026-03-05 00:34:07,802] Trial 30 finished with value: 0.8605460087755613 and parameters: {'activation': 'logistic', 'solver': 'adam', 'lr': 0.0017483053583257795, 'layer1': 366, 'layer2': 381, 'layer3': 378}. Best is trial 23 with value: 0.8649994822247168.
Pseudomonas_Aeruginosa | DirectMulti | Optuna:  16%|█▌        | 31/200 [40:01<3:59:21, 84.98s/it, best=0.865]Pseudomonas_Aeruginosa | DirectMulti | Optuna:  16%|█▌        | 31/200 [40:01<3:59:21, 84.98s/it, best=0.865][I 2026-03-05 00:34:21,362] Trial 199 finished with value: 0.8939654618288767 and parameters: {'activation': 'identity', 'solver': 'adam', 'lr': 0.0006559363935345658, 'layer1': 336, 'layer2': 238, 'layer3': 183}. Best is trial 197 with value: 0.895291438550062.
Staphylococcus_Aureus | LPS | Optuna: 100%|██████████| 200/200 [4:36:03<00:00, 95.26s/it, best=0.895]Staphylococcus_Aureus | LPS | Optuna: 100%|██████████| 200/200 [4:36:03<00:00, 95.26s/it, best=0.895]                                                                                                     [Staphylococcus_Aureus | LPS] [OPTUNA DONE] Best CV WF1=0.8953 | params={'activation': 'identity', 'solver': 'adam', 'lr': 0.0008078817205716293, 'layer1': 289, 'layer2': 242, 'layer3': 189}
[Staphylococcus_Aureus | LPS] Retraining with validation early stopping (10% split)...
[I 2026-03-05 00:34:24,796] Trial 26 finished with value: 0.8756259732191598 and parameters: {'activation': 'tanh', 'solver': 'sgd', 'lr': 3.434112369574395e-05, 'layer1': 77, 'layer2': 309, 'layer3': 285}. Best is trial 25 with value: 0.9308766784644542.
Klebsiella_Pneumoniae | DirectMulti | Optuna:  14%|█▎        | 27/200 [32:56<4:19:32, 90.02s/it, best=0.931]Klebsiella_Pneumoniae | DirectMulti | Optuna:  14%|█▎        | 27/200 [32:56<4:19:32, 90.02s/it, best=0.931][Staphylococcus_Aureus | LPS] Testing...
[Staphylococcus_Aureus | LPS] [TEST] WF1=0.8913 | ACC=0.9007 | HL=0.0993 | best_val_WF1=0.8997

[Staphylococcus_Aureus] ===== Direct multilabel training =====
[I 2026-03-05 00:34:42,371] A new study created in memory with name: no-name-760f5ea3-a961-49eb-b5d2-074797a9b0bd
Staphylococcus_Aureus | DirectMulti | Optuna:   0%|          | 0/200 [00:00<?, ?it/s][I 2026-03-05 00:35:32,541] Trial 27 finished with value: 0.9312172203080404 and parameters: {'activation': 'tanh', 'solver': 'adam', 'lr': 9.418193763604616e-05, 'layer1': 82, 'layer2': 471, 'layer3': 267}. Best is trial 27 with value: 0.9312172203080404.
Klebsiella_Pneumoniae | DirectMulti | Optuna:  14%|█▍        | 28/200 [34:04<3:58:53, 83.33s/it, best=0.931]Klebsiella_Pneumoniae | DirectMulti | Optuna:  14%|█▍        | 28/200 [34:04<3:58:53, 83.33s/it, best=0.931][I 2026-03-05 00:35:39,588] Trial 31 finished with value: 0.8609314754761357 and parameters: {'activation': 'relu', 'solver': 'adam', 'lr': 0.0020655557967181703, 'layer1': 462, 'layer2': 173, 'layer3': 455}. Best is trial 23 with value: 0.8649994822247168.
Pseudomonas_Aeruginosa | DirectMulti | Optuna:  16%|█▌        | 32/200 [41:33<4:03:39, 87.02s/it, best=0.865]Pseudomonas_Aeruginosa | DirectMulti | Optuna:  16%|█▌        | 32/200 [41:33<4:03:39, 87.02s/it, best=0.865][I 2026-03-05 00:35:49,893] Trial 0 finished with value: 0.44516213108722685 and parameters: {'activation': 'logistic', 'solver': 'sgd', 'lr': 1.7073967431528114e-06, 'layer1': 435, 'layer2': 305, 'layer3': 357}. Best is trial 0 with value: 0.44516213108722685.
Staphylococcus_Aureus | DirectMulti | Optuna:   0%|          | 1/200 [01:07<3:43:56, 67.52s/it]Staphylococcus_Aureus | DirectMulti | Optuna:   0%|          | 1/200 [01:07<3:43:56, 67.52s/it, best=0.445][I 2026-03-05 00:36:36,754] Trial 28 finished with value: 0.9306485616058247 and parameters: {'activation': 'tanh', 'solver': 'adam', 'lr': 0.00010714061944853887, 'layer1': 84, 'layer2': 460, 'layer3': 272}. Best is trial 27 with value: 0.9312172203080404.
Klebsiella_Pneumoniae | DirectMulti | Optuna:  14%|█▍        | 29/200 [35:08<3:41:09, 77.60s/it, best=0.931]Klebsiella_Pneumoniae | DirectMulti | Optuna:  14%|█▍        | 29/200 [35:08<3:41:09, 77.60s/it, best=0.931][I 2026-03-05 00:36:59,466] Trial 1 finished with value: 0.8016455484651599 and parameters: {'activation': 'logistic', 'solver': 'adam', 'lr': 1.6480446427978994e-05, 'layer1': 267, 'layer2': 222, 'layer3': 152}. Best is trial 1 with value: 0.8016455484651599.
Staphylococcus_Aureus | DirectMulti | Optuna:   1%|          | 2/200 [02:17<3:46:48, 68.73s/it, best=0.445]Staphylococcus_Aureus | DirectMulti | Optuna:   1%|          | 2/200 [02:17<3:46:48, 68.73s/it, best=0.802][I 2026-03-05 00:37:20,214] Trial 32 finished with value: 0.8639460386699044 and parameters: {'activation': 'relu', 'solver': 'adam', 'lr': 0.005215665527747614, 'layer1': 434, 'layer2': 192, 'layer3': 406}. Best is trial 23 with value: 0.8649994822247168.
Pseudomonas_Aeruginosa | DirectMulti | Optuna:  16%|█▋        | 33/200 [43:14<4:13:34, 91.10s/it, best=0.865]Pseudomonas_Aeruginosa | DirectMulti | Optuna:  16%|█▋        | 33/200 [43:14<4:13:34, 91.10s/it, best=0.865][I 2026-03-05 00:38:53,620] Trial 33 finished with value: 0.8614429245196131 and parameters: {'activation': 'relu', 'solver': 'adam', 'lr': 0.009983802591000351, 'layer1': 418, 'layer2': 246, 'layer3': 167}. Best is trial 23 with value: 0.8649994822247168.
Pseudomonas_Aeruginosa | DirectMulti | Optuna:  17%|█▋        | 34/200 [44:47<4:13:57, 91.79s/it, best=0.865]Pseudomonas_Aeruginosa | DirectMulti | Optuna:  17%|█▋        | 34/200 [44:47<4:13:57, 91.79s/it, best=0.865][I 2026-03-05 00:39:43,809] Trial 2 finished with value: 0.8235636486619147 and parameters: {'activation': 'identity', 'solver': 'adam', 'lr': 6.290644294586145e-06, 'layer1': 262, 'layer2': 300, 'layer3': 32}. Best is trial 2 with value: 0.8235636486619147.
Staphylococcus_Aureus | DirectMulti | Optuna:   2%|▏         | 3/200 [05:01<6:09:00, 112.39s/it, best=0.802]Staphylococcus_Aureus | DirectMulti | Optuna:   2%|▏         | 3/200 [05:01<6:09:00, 112.39s/it, best=0.824][I 2026-03-05 00:39:46,547] Trial 92 finished with value: 0.8375932778257379 and parameters: {'activation': 'tanh', 'solver': 'adam', 'lr': 1.0497926077609602e-05, 'layer1': 490, 'layer2': 51, 'layer3': 394}. Best is trial 73 with value: 0.864893646817533.
Escherichia_Coli | LPS | Optuna:  46%|████▋     | 93/200 [4:41:28<7:42:57, 259.60s/it, best=0.865]Escherichia_Coli | LPS | Optuna:  46%|████▋     | 93/200 [4:41:28<7:42:57, 259.60s/it, best=0.865][I 2026-03-05 00:40:56,059] Trial 29 finished with value: 0.8774339022167641 and parameters: {'activation': 'tanh', 'solver': 'sgd', 'lr': 7.325770661723272e-06, 'layer1': 24, 'layer2': 455, 'layer3': 376}. Best is trial 27 with value: 0.9312172203080404.
Klebsiella_Pneumoniae | DirectMulti | Optuna:  15%|█▌        | 30/200 [39:28<6:14:18, 132.11s/it, best=0.931]Klebsiella_Pneumoniae | DirectMulti | Optuna:  15%|█▌        | 30/200 [39:28<6:14:18, 132.11s/it, best=0.931][I 2026-03-05 00:41:18,799] Trial 3 finished with value: 0.805024467179571 and parameters: {'activation': 'relu', 'solver': 'sgd', 'lr': 1.6536937182824424e-05, 'layer1': 57, 'layer2': 345, 'layer3': 226}. Best is trial 2 with value: 0.8235636486619147.
Staphylococcus_Aureus | DirectMulti | Optuna:   2%|▏         | 4/200 [06:36<5:44:41, 105.52s/it, best=0.824]Staphylococcus_Aureus | DirectMulti | Optuna:   2%|▏         | 4/200 [06:36<5:44:41, 105.52s/it, best=0.824][I 2026-03-05 00:41:34,006] Trial 34 finished with value: 0.8611895523338319 and parameters: {'activation': 'relu', 'solver': 'adam', 'lr': 3.5486959508932417e-05, 'layer1': 467, 'layer2': 194, 'layer3': 256}. Best is trial 23 with value: 0.8649994822247168.
Pseudomonas_Aeruginosa | DirectMulti | Optuna:  18%|█▊        | 35/200 [47:28<5:09:01, 112.37s/it, best=0.865]Pseudomonas_Aeruginosa | DirectMulti | Optuna:  18%|█▊        | 35/200 [47:28<5:09:01, 112.37s/it, best=0.865][I 2026-03-05 00:42:07,073] Trial 30 finished with value: 0.9306281998237139 and parameters: {'activation': 'tanh', 'solver': 'adam', 'lr': 0.00010015659082291702, 'layer1': 85, 'layer2': 465, 'layer3': 348}. Best is trial 27 with value: 0.9312172203080404.
Klebsiella_Pneumoniae | DirectMulti | Optuna:  16%|█▌        | 31/200 [40:39<5:20:29, 113.78s/it, best=0.931]Klebsiella_Pneumoniae | DirectMulti | Optuna:  16%|█▌        | 31/200 [40:39<5:20:29, 113.78s/it, best=0.931][I 2026-03-05 00:43:16,769] Trial 31 finished with value: 0.9299748680064954 and parameters: {'activation': 'tanh', 'solver': 'adam', 'lr': 0.00011207774364690227, 'layer1': 82, 'layer2': 469, 'layer3': 354}. Best is trial 27 with value: 0.9312172203080404.
Klebsiella_Pneumoniae | DirectMulti | Optuna:  16%|█▌        | 32/200 [41:48<4:41:33, 100.56s/it, best=0.931]Klebsiella_Pneumoniae | DirectMulti | Optuna:  16%|█▌        | 32/200 [41:48<4:41:33, 100.56s/it, best=0.931][I 2026-03-05 00:43:26,813] Trial 35 finished with value: 0.8607069341259198 and parameters: {'activation': 'relu', 'solver': 'adam', 'lr': 0.005303383031776016, 'layer1': 430, 'layer2': 131, 'layer3': 406}. Best is trial 23 with value: 0.8649994822247168.
Pseudomonas_Aeruginosa | DirectMulti | Optuna:  18%|█▊        | 36/200 [49:20<5:07:30, 112.50s/it, best=0.865]Pseudomonas_Aeruginosa | DirectMulti | Optuna:  18%|█▊        | 36/200 [49:20<5:07:30, 112.50s/it, best=0.865][I 2026-03-05 00:44:25,486] Trial 32 finished with value: 0.9303577068812533 and parameters: {'activation': 'tanh', 'solver': 'adam', 'lr': 0.00011433513844209844, 'layer1': 137, 'layer2': 477, 'layer3': 271}. Best is trial 27 with value: 0.9312172203080404.
Klebsiella_Pneumoniae | DirectMulti | Optuna:  16%|█▋        | 33/200 [42:57<4:13:17, 91.00s/it, best=0.931] Klebsiella_Pneumoniae | DirectMulti | Optuna:  16%|█▋        | 33/200 [42:57<4:13:17, 91.00s/it, best=0.931][I 2026-03-05 00:45:03,968] Trial 33 finished with value: 0.8746470562584285 and parameters: {'activation': 'logistic', 'solver': 'adam', 'lr': 2.1133098301124614e-05, 'layer1': 89, 'layer2': 426, 'layer3': 341}. Best is trial 27 with value: 0.9312172203080404.
Klebsiella_Pneumoniae | DirectMulti | Optuna:  17%|█▋        | 34/200 [43:36<3:28:11, 75.25s/it, best=0.931]Klebsiella_Pneumoniae | DirectMulti | Optuna:  17%|█▋        | 34/200 [43:36<3:28:11, 75.25s/it, best=0.931][I 2026-03-05 00:45:28,559] Trial 36 finished with value: 0.8618658736442036 and parameters: {'activation': 'relu', 'solver': 'adam', 'lr': 4.4003896844243976e-05, 'layer1': 300, 'layer2': 314, 'layer3': 76}. Best is trial 23 with value: 0.8649994822247168.
Pseudomonas_Aeruginosa | DirectMulti | Optuna:  18%|█▊        | 37/200 [51:22<5:13:09, 115.28s/it, best=0.865]Pseudomonas_Aeruginosa | DirectMulti | Optuna:  18%|█▊        | 37/200 [51:22<5:13:09, 115.28s/it, best=0.865][I 2026-03-05 00:45:43,074] Trial 93 finished with value: 0.8614972792628872 and parameters: {'activation': 'tanh', 'solver': 'adam', 'lr': 1.8509796466071527e-05, 'layer1': 469, 'layer2': 11, 'layer3': 430}. Best is trial 73 with value: 0.864893646817533.
Escherichia_Coli | LPS | Optuna:  47%|████▋     | 94/200 [4:47:25<8:30:00, 288.68s/it, best=0.865]Escherichia_Coli | LPS | Optuna:  47%|████▋     | 94/200 [4:47:25<8:30:00, 288.68s/it, best=0.865][I 2026-03-05 00:46:06,615] Trial 4 finished with value: 0.888506976054158 and parameters: {'activation': 'relu', 'solver': 'adam', 'lr': 1.7654048052495086e-05, 'layer1': 265, 'layer2': 278, 'layer3': 100}. Best is trial 4 with value: 0.888506976054158.
Staphylococcus_Aureus | DirectMulti | Optuna:   2%|▎         | 5/200 [11:24<9:16:35, 171.26s/it, best=0.824]Staphylococcus_Aureus | DirectMulti | Optuna:   2%|▎         | 5/200 [11:24<9:16:35, 171.26s/it, best=0.888][I 2026-03-05 00:46:47,820] Trial 34 finished with value: 0.9306658669922768 and parameters: {'activation': 'tanh', 'solver': 'adam', 'lr': 2.842562024484166e-05, 'layer1': 52, 'layer2': 466, 'layer3': 401}. Best is trial 27 with value: 0.9312172203080404.
Klebsiella_Pneumoniae | DirectMulti | Optuna:  18%|█▊        | 35/200 [45:19<3:50:31, 83.83s/it, best=0.931]Klebsiella_Pneumoniae | DirectMulti | Optuna:  18%|█▊        | 35/200 [45:19<3:50:31, 83.83s/it, best=0.931][I 2026-03-05 00:46:54,954] Trial 37 finished with value: 0.8611894401844509 and parameters: {'activation': 'logistic', 'solver': 'adam', 'lr': 0.0009428986004010245, 'layer1': 382, 'layer2': 86, 'layer3': 477}. Best is trial 23 with value: 0.8649994822247168.
Pseudomonas_Aeruginosa | DirectMulti | Optuna:  19%|█▉        | 38/200 [52:49<4:47:51, 106.61s/it, best=0.865]Pseudomonas_Aeruginosa | DirectMulti | Optuna:  19%|█▉        | 38/200 [52:49<4:47:51, 106.61s/it, best=0.865][I 2026-03-05 00:46:55,104] Trial 5 finished with value: 0.8059439924191274 and parameters: {'activation': 'identity', 'solver': 'adam', 'lr': 2.259279742015697e-06, 'layer1': 106, 'layer2': 32, 'layer3': 169}. Best is trial 4 with value: 0.888506976054158.
Staphylococcus_Aureus | DirectMulti | Optuna:   3%|▎         | 6/200 [12:12<6:58:46, 129.52s/it, best=0.888]Staphylococcus_Aureus | DirectMulti | Optuna:   3%|▎         | 6/200 [12:12<6:58:46, 129.52s/it, best=0.888][I 2026-03-05 00:47:22,357] Trial 35 finished with value: 0.875348556308527 and parameters: {'activation': 'tanh', 'solver': 'adam', 'lr': 9.357818791106016e-06, 'layer1': 49, 'layer2': 320, 'layer3': 404}. Best is trial 27 with value: 0.9312172203080404.
Klebsiella_Pneumoniae | DirectMulti | Optuna:  18%|█▊        | 36/200 [45:54<3:08:42, 69.04s/it, best=0.931]Klebsiella_Pneumoniae | DirectMulti | Optuna:  18%|█▊        | 36/200 [45:54<3:08:42, 69.04s/it, best=0.931][I 2026-03-05 00:47:46,326] Trial 38 finished with value: 0.8267582410058887 and parameters: {'activation': 'relu', 'solver': 'sgd', 'lr': 0.0031623852552361046, 'layer1': 479, 'layer2': 49, 'layer3': 35}. Best is trial 23 with value: 0.8649994822247168.
Pseudomonas_Aeruginosa | DirectMulti | Optuna:  20%|█▉        | 39/200 [53:40<4:01:36, 90.04s/it, best=0.865] Pseudomonas_Aeruginosa | DirectMulti | Optuna:  20%|█▉        | 39/200 [53:40<4:01:36, 90.04s/it, best=0.865][I 2026-03-05 00:48:18,414] Trial 6 finished with value: 0.8017874462013385 and parameters: {'activation': 'tanh', 'solver': 'adam', 'lr': 3.6618192203924288e-06, 'layer1': 403, 'layer2': 46, 'layer3': 494}. Best is trial 4 with value: 0.888506976054158.
Staphylococcus_Aureus | DirectMulti | Optuna:   4%|▎         | 7/200 [13:36<6:08:01, 114.41s/it, best=0.888]Staphylococcus_Aureus | DirectMulti | Optuna:   4%|▎         | 7/200 [13:36<6:08:01, 114.41s/it, best=0.888][I 2026-03-05 00:48:53,604] Trial 94 finished with value: 0.8617641093101648 and parameters: {'activation': 'tanh', 'solver': 'adam', 'lr': 3.938394105785713e-05, 'layer1': 438, 'layer2': 71, 'layer3': 478}. Best is trial 73 with value: 0.864893646817533.
Escherichia_Coli | LPS | Optuna:  48%|████▊     | 95/200 [4:50:35<7:33:39, 259.24s/it, best=0.865]Escherichia_Coli | LPS | Optuna:  48%|████▊     | 95/200 [4:50:35<7:33:39, 259.24s/it, best=0.865][I 2026-03-05 00:49:03,752] Trial 39 finished with value: 0.8267709645916301 and parameters: {'activation': 'relu', 'solver': 'adam', 'lr': 1.1781620737312393e-06, 'layer1': 431, 'layer2': 286, 'layer3': 153}. Best is trial 23 with value: 0.8649994822247168.
Pseudomonas_Aeruginosa | DirectMulti | Optuna:  20%|██        | 40/200 [54:57<3:50:00, 86.26s/it, best=0.865]Pseudomonas_Aeruginosa | DirectMulti | Optuna:  20%|██        | 40/200 [54:57<3:50:00, 86.26s/it, best=0.865][I 2026-03-05 00:49:08,800] Trial 7 finished with value: 0.8886176672771867 and parameters: {'activation': 'relu', 'solver': 'adam', 'lr': 0.0012164139351417069, 'layer1': 46, 'layer2': 186, 'layer3': 66}. Best is trial 7 with value: 0.8886176672771867.
