Klebsiella_Pneumoniae | LPS | Optuna:  50%|████▉     | 99/200 [1:48:22<1:36:19, 57.22s/it, best=0.933]Klebsiella_Pneumoniae | LPS | Optuna:  50%|████▉     | 99/200 [1:48:22<1:36:19, 57.22s/it, best=0.933][I 2026-03-04 21:47:11,663] Trial 74 finished with value: 0.8901606893139885 and parameters: {'activation': 'identity', 'solver': 'adam', 'lr': 0.0005596913380686632, 'layer1': 193, 'layer2': 17, 'layer3': 29}. Best is trial 22 with value: 0.8930759779387886.
Staphylococcus_Aureus | LPS | Optuna:  38%|███▊      | 75/200 [1:48:53<2:42:40, 78.08s/it, best=0.893]Staphylococcus_Aureus | LPS | Optuna:  38%|███▊      | 75/200 [1:48:53<2:42:40, 78.08s/it, best=0.893][I 2026-03-04 21:47:20,881] Trial 99 finished with value: 0.8746470562584285 and parameters: {'activation': 'tanh', 'solver': 'adam', 'lr': 0.005682803615348717, 'layer1': 141, 'layer2': 414, 'layer3': 114}. Best is trial 41 with value: 0.9325947076370852.
Klebsiella_Pneumoniae | LPS | Optuna:  50%|█████     | 100/200 [1:49:03<1:26:52, 52.13s/it, best=0.933]Klebsiella_Pneumoniae | LPS | Optuna:  50%|█████     | 100/200 [1:49:03<1:26:52, 52.13s/it, best=0.933][I 2026-03-04 21:47:48,134] Trial 102 finished with value: 0.8625487983405067 and parameters: {'activation': 'identity', 'solver': 'adam', 'lr': 0.002002457439352091, 'layer1': 377, 'layer2': 202, 'layer3': 193}. Best is trial 49 with value: 0.8647157569215889.
Pseudomonas_Aeruginosa | LPS | Optuna:  52%|█████▏    | 103/200 [1:49:30<2:00:25, 74.49s/it, best=0.865]Pseudomonas_Aeruginosa | LPS | Optuna:  52%|█████▏    | 103/200 [1:49:30<2:00:25, 74.49s/it, best=0.865][I 2026-03-04 21:48:18,655] Trial 75 finished with value: 0.8902186711214192 and parameters: {'activation': 'identity', 'solver': 'adam', 'lr': 0.0014627090151380796, 'layer1': 206, 'layer2': 12, 'layer3': 93}. Best is trial 22 with value: 0.8930759779387886.
Staphylococcus_Aureus | LPS | Optuna:  38%|███▊      | 76/200 [1:50:00<2:34:29, 74.75s/it, best=0.893]Staphylococcus_Aureus | LPS | Optuna:  38%|███▊      | 76/200 [1:50:00<2:34:29, 74.75s/it, best=0.893][I 2026-03-04 21:48:21,449] Trial 42 finished with value: 0.862011682161896 and parameters: {'activation': 'relu', 'solver': 'adam', 'lr': 2.1436518319704048e-05, 'layer1': 283, 'layer2': 420, 'layer3': 477}. Best is trial 14 with value: 0.863668804271893.
Escherichia_Coli | LPS | Optuna:  22%|██▏       | 43/200 [1:50:03<8:38:44, 198.25s/it, best=0.864]Escherichia_Coli | LPS | Optuna:  22%|██▏       | 43/200 [1:50:03<8:38:44, 198.25s/it, best=0.864][I 2026-03-04 21:48:49,186] Trial 103 finished with value: 0.8605369757965068 and parameters: {'activation': 'identity', 'solver': 'adam', 'lr': 0.0015377954075991688, 'layer1': 372, 'layer2': 204, 'layer3': 218}. Best is trial 49 with value: 0.8647157569215889.
Pseudomonas_Aeruginosa | LPS | Optuna:  52%|█████▏    | 104/200 [1:50:31<1:52:44, 70.46s/it, best=0.865]Pseudomonas_Aeruginosa | LPS | Optuna:  52%|█████▏    | 104/200 [1:50:31<1:52:44, 70.46s/it, best=0.865][I 2026-03-04 21:49:17,539] Trial 100 finished with value: 0.9310774318953697 and parameters: {'activation': 'tanh', 'solver': 'adam', 'lr': 6.238476707780314e-05, 'layer1': 386, 'layer2': 285, 'layer3': 130}. Best is trial 41 with value: 0.9325947076370852.
Klebsiella_Pneumoniae | LPS | Optuna:  50%|█████     | 101/200 [1:50:59<1:57:57, 71.49s/it, best=0.933]Klebsiella_Pneumoniae | LPS | Optuna:  50%|█████     | 101/200 [1:50:59<1:57:57, 71.49s/it, best=0.933][I 2026-03-04 21:49:54,663] Trial 104 finished with value: 0.859833364319867 and parameters: {'activation': 'identity', 'solver': 'adam', 'lr': 0.002013083403612624, 'layer1': 341, 'layer2': 172, 'layer3': 203}. Best is trial 49 with value: 0.8647157569215889.
Pseudomonas_Aeruginosa | LPS | Optuna:  52%|█████▎    | 105/200 [1:51:36<1:49:11, 68.96s/it, best=0.865]Pseudomonas_Aeruginosa | LPS | Optuna:  52%|█████▎    | 105/200 [1:51:36<1:49:11, 68.96s/it, best=0.865][I 2026-03-04 21:50:07,191] Trial 101 finished with value: 0.9312043181901266 and parameters: {'activation': 'tanh', 'solver': 'adam', 'lr': 0.0001351051233361904, 'layer1': 39, 'layer2': 265, 'layer3': 74}. Best is trial 41 with value: 0.9325947076370852.
Klebsiella_Pneumoniae | LPS | Optuna:  51%|█████     | 102/200 [1:51:49<1:46:03, 64.94s/it, best=0.933]Klebsiella_Pneumoniae | LPS | Optuna:  51%|█████     | 102/200 [1:51:49<1:46:03, 64.94s/it, best=0.933][I 2026-03-04 21:50:38,576] Trial 76 finished with value: 0.8722044672717006 and parameters: {'activation': 'logistic', 'solver': 'adam', 'lr': 0.0006335274256075766, 'layer1': 231, 'layer2': 42, 'layer3': 110}. Best is trial 22 with value: 0.8930759779387886.
Staphylococcus_Aureus | LPS | Optuna:  38%|███▊      | 77/200 [1:52:20<3:13:19, 94.30s/it, best=0.893]Staphylococcus_Aureus | LPS | Optuna:  38%|███▊      | 77/200 [1:52:20<3:13:19, 94.30s/it, best=0.893][I 2026-03-04 21:51:02,642] Trial 102 finished with value: 0.9316365723263325 and parameters: {'activation': 'tanh', 'solver': 'adam', 'lr': 0.00011146075936001605, 'layer1': 75, 'layer2': 295, 'layer3': 56}. Best is trial 41 with value: 0.9325947076370852.
Klebsiella_Pneumoniae | LPS | Optuna:  52%|█████▏    | 103/200 [1:52:44<1:40:22, 62.09s/it, best=0.933]Klebsiella_Pneumoniae | LPS | Optuna:  52%|█████▏    | 103/200 [1:52:44<1:40:22, 62.09s/it, best=0.933][I 2026-03-04 21:51:09,563] Trial 105 finished with value: 0.8640976755199079 and parameters: {'activation': 'identity', 'solver': 'adam', 'lr': 0.0012686780733233505, 'layer1': 403, 'layer2': 226, 'layer3': 194}. Best is trial 49 with value: 0.8647157569215889.
Pseudomonas_Aeruginosa | LPS | Optuna:  53%|█████▎    | 106/200 [1:52:51<1:50:50, 70.75s/it, best=0.865]Pseudomonas_Aeruginosa | LPS | Optuna:  53%|█████▎    | 106/200 [1:52:51<1:50:50, 70.75s/it, best=0.865][I 2026-03-04 21:51:38,823] Trial 77 finished with value: 0.8920226640209211 and parameters: {'activation': 'identity', 'solver': 'adam', 'lr': 0.00042082221632285124, 'layer1': 161, 'layer2': 69, 'layer3': 53}. Best is trial 22 with value: 0.8930759779387886.
Staphylococcus_Aureus | LPS | Optuna:  39%|███▉      | 78/200 [1:53:20<2:50:58, 84.09s/it, best=0.893]Staphylococcus_Aureus | LPS | Optuna:  39%|███▉      | 78/200 [1:53:20<2:50:58, 84.09s/it, best=0.893][I 2026-03-04 21:51:54,867] Trial 43 finished with value: 0.8601895376659285 and parameters: {'activation': 'relu', 'solver': 'adam', 'lr': 2.06530836154442e-05, 'layer1': 252, 'layer2': 435, 'layer3': 415}. Best is trial 14 with value: 0.863668804271893.
Escherichia_Coli | LPS | Optuna:  22%|██▏       | 44/200 [1:53:36<8:47:16, 202.80s/it, best=0.864]Escherichia_Coli | LPS | Optuna:  22%|██▏       | 44/200 [1:53:36<8:47:16, 202.80s/it, best=0.864][I 2026-03-04 21:52:11,970] Trial 103 finished with value: 0.9196675622650711 and parameters: {'activation': 'tanh', 'solver': 'adam', 'lr': 7.447004722912804e-05, 'layer1': 57, 'layer2': 303, 'layer3': 23}. Best is trial 41 with value: 0.9325947076370852.
Klebsiella_Pneumoniae | LPS | Optuna:  52%|█████▏    | 104/200 [1:53:54<1:42:49, 64.26s/it, best=0.933]Klebsiella_Pneumoniae | LPS | Optuna:  52%|█████▏    | 104/200 [1:53:54<1:42:49, 64.26s/it, best=0.933][I 2026-03-04 21:52:17,738] Trial 106 finished with value: 0.8569682362047315 and parameters: {'activation': 'identity', 'solver': 'adam', 'lr': 0.0011892291888546255, 'layer1': 404, 'layer2': 226, 'layer3': 238}. Best is trial 49 with value: 0.8647157569215889.
Pseudomonas_Aeruginosa | LPS | Optuna:  54%|█████▎    | 107/200 [1:53:59<1:48:27, 69.97s/it, best=0.865]Pseudomonas_Aeruginosa | LPS | Optuna:  54%|█████▎    | 107/200 [1:53:59<1:48:27, 69.97s/it, best=0.865][I 2026-03-04 21:52:52,562] Trial 78 finished with value: 0.8929202333297364 and parameters: {'activation': 'identity', 'solver': 'adam', 'lr': 0.0020327748717013905, 'layer1': 218, 'layer2': 35, 'layer3': 14}. Best is trial 22 with value: 0.8930759779387886.
Staphylococcus_Aureus | LPS | Optuna:  40%|███▉      | 79/200 [1:54:34<2:43:18, 80.98s/it, best=0.893]Staphylococcus_Aureus | LPS | Optuna:  40%|███▉      | 79/200 [1:54:34<2:43:18, 80.98s/it, best=0.893][I 2026-03-04 21:53:08,638] Trial 104 finished with value: 0.9327898309005132 and parameters: {'activation': 'tanh', 'solver': 'adam', 'lr': 0.00015801477823387117, 'layer1': 78, 'layer2': 249, 'layer3': 47}. Best is trial 104 with value: 0.9327898309005132.
Klebsiella_Pneumoniae | LPS | Optuna:  52%|█████▎    | 105/200 [1:54:50<1:38:08, 61.98s/it, best=0.933]Klebsiella_Pneumoniae | LPS | Optuna:  52%|█████▎    | 105/200 [1:54:50<1:38:08, 61.98s/it, best=0.933][I 2026-03-04 21:53:28,639] Trial 44 finished with value: 0.7395887413896647 and parameters: {'activation': 'identity', 'solver': 'adam', 'lr': 2.1143458476075655e-06, 'layer1': 279, 'layer2': 432, 'layer3': 468}. Best is trial 14 with value: 0.863668804271893.
Escherichia_Coli | LPS | Optuna:  22%|██▎       | 45/200 [1:55:10<7:19:24, 170.09s/it, best=0.864]Escherichia_Coli | LPS | Optuna:  22%|██▎       | 45/200 [1:55:10<7:19:24, 170.09s/it, best=0.864][I 2026-03-04 21:53:34,987] Trial 107 finished with value: 0.8615305274504819 and parameters: {'activation': 'identity', 'solver': 'adam', 'lr': 0.001490094768162668, 'layer1': 420, 'layer2': 183, 'layer3': 183}. Best is trial 49 with value: 0.8647157569215889.
Pseudomonas_Aeruginosa | LPS | Optuna:  54%|█████▍    | 108/200 [1:55:17<1:50:38, 72.16s/it, best=0.865]Pseudomonas_Aeruginosa | LPS | Optuna:  54%|█████▍    | 108/200 [1:55:17<1:50:38, 72.16s/it, best=0.865][I 2026-03-04 21:53:56,769] Trial 79 finished with value: 0.8916749158135577 and parameters: {'activation': 'identity', 'solver': 'adam', 'lr': 0.0021148549715978696, 'layer1': 210, 'layer2': 37, 'layer3': 37}. Best is trial 22 with value: 0.8930759779387886.
Staphylococcus_Aureus | LPS | Optuna:  40%|████      | 80/200 [1:55:38<2:31:53, 75.95s/it, best=0.893]Staphylococcus_Aureus | LPS | Optuna:  40%|████      | 80/200 [1:55:38<2:31:53, 75.95s/it, best=0.893][I 2026-03-04 21:54:04,310] Trial 105 finished with value: 0.9293477655989273 and parameters: {'activation': 'relu', 'solver': 'adam', 'lr': 0.000270679073805258, 'layer1': 95, 'layer2': 234, 'layer3': 45}. Best is trial 104 with value: 0.9327898309005132.
Klebsiella_Pneumoniae | LPS | Optuna:  53%|█████▎    | 106/200 [1:55:46<1:34:08, 60.09s/it, best=0.933]Klebsiella_Pneumoniae | LPS | Optuna:  53%|█████▎    | 106/200 [1:55:46<1:34:08, 60.09s/it, best=0.933][I 2026-03-04 21:54:38,944] Trial 106 finished with value: 0.9281397360075552 and parameters: {'activation': 'tanh', 'solver': 'adam', 'lr': 0.0017838803196435565, 'layer1': 24, 'layer2': 254, 'layer3': 101}. Best is trial 104 with value: 0.9327898309005132.
Klebsiella_Pneumoniae | LPS | Optuna:  54%|█████▎    | 107/200 [1:56:21<1:21:18, 52.45s/it, best=0.933]Klebsiella_Pneumoniae | LPS | Optuna:  54%|█████▎    | 107/200 [1:56:21<1:21:18, 52.45s/it, best=0.933][I 2026-03-04 21:54:51,062] Trial 108 finished with value: 0.856207352291837 and parameters: {'activation': 'identity', 'solver': 'adam', 'lr': 0.0007056377180410737, 'layer1': 439, 'layer2': 266, 'layer3': 162}. Best is trial 49 with value: 0.8647157569215889.
Pseudomonas_Aeruginosa | LPS | Optuna:  55%|█████▍    | 109/200 [1:56:33<1:51:13, 73.33s/it, best=0.865]Pseudomonas_Aeruginosa | LPS | Optuna:  55%|█████▍    | 109/200 [1:56:33<1:51:13, 73.33s/it, best=0.865][I 2026-03-04 21:54:53,286] Trial 80 finished with value: 0.8918735596274816 and parameters: {'activation': 'identity', 'solver': 'adam', 'lr': 0.0027424733370175116, 'layer1': 185, 'layer2': 54, 'layer3': 14}. Best is trial 22 with value: 0.8930759779387886.
Staphylococcus_Aureus | LPS | Optuna:  40%|████      | 81/200 [1:56:35<2:19:04, 70.12s/it, best=0.893]Staphylococcus_Aureus | LPS | Optuna:  40%|████      | 81/200 [1:56:35<2:19:04, 70.12s/it, best=0.893][I 2026-03-04 21:55:35,763] Trial 107 finished with value: 0.9296575767640606 and parameters: {'activation': 'identity', 'solver': 'adam', 'lr': 0.0001746819806624848, 'layer1': 124, 'layer2': 463, 'layer3': 39}. Best is trial 104 with value: 0.9327898309005132.
Klebsiella_Pneumoniae | LPS | Optuna:  54%|█████▍    | 108/200 [1:57:17<1:22:26, 53.76s/it, best=0.933]Klebsiella_Pneumoniae | LPS | Optuna:  54%|█████▍    | 108/200 [1:57:17<1:22:26, 53.76s/it, best=0.933][I 2026-03-04 21:55:35,947] Trial 45 finished with value: 0.8608037636983165 and parameters: {'activation': 'relu', 'solver': 'adam', 'lr': 7.824148597366643e-05, 'layer1': 182, 'layer2': 305, 'layer3': 427}. Best is trial 14 with value: 0.863668804271893.
Escherichia_Coli | LPS | Optuna:  23%|██▎       | 46/200 [1:57:18<6:43:37, 157.26s/it, best=0.864]Escherichia_Coli | LPS | Optuna:  23%|██▎       | 46/200 [1:57:18<6:43:37, 157.26s/it, best=0.864][I 2026-03-04 21:55:56,487] Trial 109 finished with value: 0.8591602293672078 and parameters: {'activation': 'identity', 'solver': 'adam', 'lr': 0.000503487494691241, 'layer1': 401, 'layer2': 253, 'layer3': 250}. Best is trial 49 with value: 0.8647157569215889.
Pseudomonas_Aeruginosa | LPS | Optuna:  55%|█████▌    | 110/200 [1:57:38<1:46:26, 70.96s/it, best=0.865]Pseudomonas_Aeruginosa | LPS | Optuna:  55%|█████▌    | 110/200 [1:57:38<1:46:26, 70.96s/it, best=0.865][I 2026-03-04 21:56:00,283] Trial 81 finished with value: 0.891895460940126 and parameters: {'activation': 'identity', 'solver': 'adam', 'lr': 0.0010685361631617386, 'layer1': 219, 'layer2': 27, 'layer3': 83}. Best is trial 22 with value: 0.8930759779387886.
Staphylococcus_Aureus | LPS | Optuna:  41%|████      | 82/200 [1:57:42<2:16:03, 69.18s/it, best=0.893]Staphylococcus_Aureus | LPS | Optuna:  41%|████      | 82/200 [1:57:42<2:16:03, 69.18s/it, best=0.893][I 2026-03-04 21:56:41,306] Trial 110 finished with value: 0.8270741037449347 and parameters: {'activation': 'identity', 'solver': 'sgd', 'lr': 0.000978802753904135, 'layer1': 474, 'layer2': 211, 'layer3': 219}. Best is trial 49 with value: 0.8647157569215889.
Pseudomonas_Aeruginosa | LPS | Optuna:  56%|█████▌    | 111/200 [1:58:23<1:33:37, 63.12s/it, best=0.865]Pseudomonas_Aeruginosa | LPS | Optuna:  56%|█████▌    | 111/200 [1:58:23<1:33:37, 63.12s/it, best=0.865][I 2026-03-04 21:57:21,466] Trial 82 finished with value: 0.8934684233581975 and parameters: {'activation': 'identity', 'solver': 'adam', 'lr': 0.00047917472353467555, 'layer1': 276, 'layer2': 77, 'layer3': 54}. Best is trial 82 with value: 0.8934684233581975.
Staphylococcus_Aureus | LPS | Optuna:  42%|████▏     | 83/200 [1:59:03<2:21:55, 72.78s/it, best=0.893]Staphylococcus_Aureus | LPS | Optuna:  42%|████▏     | 83/200 [1:59:03<2:21:55, 72.78s/it, best=0.893][I 2026-03-04 21:58:02,884] Trial 111 finished with value: 0.858913523043951 and parameters: {'activation': 'identity', 'solver': 'adam', 'lr': 0.002678795727193505, 'layer1': 387, 'layer2': 201, 'layer3': 198}. Best is trial 49 with value: 0.8647157569215889.
Pseudomonas_Aeruginosa | LPS | Optuna:  56%|█████▌    | 112/200 [1:59:45<1:40:41, 68.66s/it, best=0.865]Pseudomonas_Aeruginosa | LPS | Optuna:  56%|█████▌    | 112/200 [1:59:45<1:40:41, 68.66s/it, best=0.865][I 2026-03-04 21:58:13,466] Trial 108 finished with value: 0.9323125302257672 and parameters: {'activation': 'tanh', 'solver': 'adam', 'lr': 2.2914809458486257e-05, 'layer1': 226, 'layer2': 212, 'layer3': 83}. Best is trial 104 with value: 0.9327898309005132.
Klebsiella_Pneumoniae | LPS | Optuna:  55%|█████▍    | 109/200 [1:59:55<2:08:49, 84.94s/it, best=0.933]Klebsiella_Pneumoniae | LPS | Optuna:  55%|█████▍    | 109/200 [1:59:55<2:08:49, 84.94s/it, best=0.933][I 2026-03-04 21:58:44,286] Trial 83 finished with value: 0.8920372928680758 and parameters: {'activation': 'identity', 'solver': 'adam', 'lr': 0.0007983245810084682, 'layer1': 273, 'layer2': 79, 'layer3': 26}. Best is trial 82 with value: 0.8934684233581975.
Staphylococcus_Aureus | LPS | Optuna:  42%|████▏     | 84/200 [2:00:26<2:26:32, 75.79s/it, best=0.893]Staphylococcus_Aureus | LPS | Optuna:  42%|████▏     | 84/200 [2:00:26<2:26:32, 75.79s/it, best=0.893][I 2026-03-04 21:58:49,450] Trial 109 finished with value: 0.8746470562584285 and parameters: {'activation': 'tanh', 'solver': 'adam', 'lr': 1.6937657913263054e-05, 'layer1': 82, 'layer2': 209, 'layer3': 88}. Best is trial 104 with value: 0.9327898309005132.
Klebsiella_Pneumoniae | LPS | Optuna:  55%|█████▌    | 110/200 [2:00:31<1:45:23, 70.26s/it, best=0.933]Klebsiella_Pneumoniae | LPS | Optuna:  55%|█████▌    | 110/200 [2:00:31<1:45:23, 70.26s/it, best=0.933][I 2026-03-04 21:59:02,907] Trial 112 finished with value: 0.858719467096624 and parameters: {'activation': 'identity', 'solver': 'adam', 'lr': 0.0008397467674921916, 'layer1': 375, 'layer2': 227, 'layer3': 194}. Best is trial 49 with value: 0.8647157569215889.
Pseudomonas_Aeruginosa | LPS | Optuna:  56%|█████▋    | 113/200 [2:00:45<1:35:47, 66.07s/it, best=0.865]Pseudomonas_Aeruginosa | LPS | Optuna:  56%|█████▋    | 113/200 [2:00:45<1:35:47, 66.07s/it, best=0.865][I 2026-03-04 21:59:18,398] Trial 46 finished with value: 0.8621932554894286 and parameters: {'activation': 'relu', 'solver': 'adam', 'lr': 1.999061729775058e-05, 'layer1': 334, 'layer2': 212, 'layer3': 497}. Best is trial 14 with value: 0.863668804271893.
Escherichia_Coli | LPS | Optuna:  24%|██▎       | 47/200 [2:01:00<7:30:52, 176.81s/it, best=0.864]Escherichia_Coli | LPS | Optuna:  24%|██▎       | 47/200 [2:01:00<7:30:52, 176.81s/it, best=0.864][I 2026-03-04 21:59:45,754] Trial 110 finished with value: 0.6353584023400065 and parameters: {'activation': 'logistic', 'solver': 'sgd', 'lr': 2.1644259503365914e-05, 'layer1': 480, 'layer2': 446, 'layer3': 66}. Best is trial 104 with value: 0.9327898309005132.
Klebsiella_Pneumoniae | LPS | Optuna:  56%|█████▌    | 111/200 [2:01:27<1:38:00, 66.07s/it, best=0.933]Klebsiella_Pneumoniae | LPS | Optuna:  56%|█████▌    | 111/200 [2:01:27<1:38:00, 66.07s/it, best=0.933][I 2026-03-04 21:59:56,058] Trial 84 finished with value: 0.8914370535041035 and parameters: {'activation': 'identity', 'solver': 'adam', 'lr': 0.0013715989808534444, 'layer1': 245, 'layer2': 114, 'layer3': 63}. Best is trial 82 with value: 0.8934684233581975.
Staphylococcus_Aureus | LPS | Optuna:  42%|████▎     | 85/200 [2:01:38<2:22:57, 74.59s/it, best=0.893]Staphylococcus_Aureus | LPS | Optuna:  42%|████▎     | 85/200 [2:01:38<2:22:57, 74.59s/it, best=0.893][I 2026-03-04 22:00:11,364] Trial 113 finished with value: 0.8629791569622682 and parameters: {'activation': 'identity', 'solver': 'adam', 'lr': 0.0018576345617542667, 'layer1': 429, 'layer2': 191, 'layer3': 263}. Best is trial 49 with value: 0.8647157569215889.
Pseudomonas_Aeruginosa | LPS | Optuna:  57%|█████▋    | 114/200 [2:01:53<1:35:43, 66.78s/it, best=0.865]Pseudomonas_Aeruginosa | LPS | Optuna:  57%|█████▋    | 114/200 [2:01:53<1:35:43, 66.78s/it, best=0.865][I 2026-03-04 22:00:48,161] Trial 47 finished with value: 0.7410692229667428 and parameters: {'activation': 'identity', 'solver': 'sgd', 'lr': 4.142189667639494e-05, 'layer1': 343, 'layer2': 221, 'layer3': 392}. Best is trial 14 with value: 0.863668804271893.
Escherichia_Coli | LPS | Optuna:  24%|██▍       | 48/200 [2:02:30<6:21:46, 150.70s/it, best=0.864]Escherichia_Coli | LPS | Optuna:  24%|██▍       | 48/200 [2:02:30<6:21:46, 150.70s/it, best=0.864][I 2026-03-04 22:01:15,230] Trial 85 finished with value: 0.8893193672688486 and parameters: {'activation': 'identity', 'solver': 'adam', 'lr': 0.0033189551980158066, 'layer1': 306, 'layer2': 91, 'layer3': 55}. Best is trial 82 with value: 0.8934684233581975.
Staphylococcus_Aureus | LPS | Optuna:  43%|████▎     | 86/200 [2:02:57<2:24:19, 75.96s/it, best=0.893]Staphylococcus_Aureus | LPS | Optuna:  43%|████▎     | 86/200 [2:02:57<2:24:19, 75.96s/it, best=0.893][I 2026-03-04 22:01:34,529] Trial 114 finished with value: 0.8626802451851283 and parameters: {'activation': 'identity', 'solver': 'adam', 'lr': 0.0013093328773541718, 'layer1': 454, 'layer2': 111, 'layer3': 275}. Best is trial 49 with value: 0.8647157569215889.
Pseudomonas_Aeruginosa | LPS | Optuna:  57%|█████▊    | 115/200 [2:03:16<1:41:34, 71.70s/it, best=0.865]Pseudomonas_Aeruginosa | LPS | Optuna:  57%|█████▊    | 115/200 [2:03:16<1:41:34, 71.70s/it, best=0.865][I 2026-03-04 22:01:41,455] Trial 111 finished with value: 0.9312827169436779 and parameters: {'activation': 'tanh', 'solver': 'adam', 'lr': 3.317526054072291e-05, 'layer1': 266, 'layer2': 186, 'layer3': 445}. Best is trial 104 with value: 0.9327898309005132.
Klebsiella_Pneumoniae | LPS | Optuna:  56%|█████▌    | 112/200 [2:03:23<1:58:44, 80.96s/it, best=0.933]Klebsiella_Pneumoniae | LPS | Optuna:  56%|█████▌    | 112/200 [2:03:23<1:58:44, 80.96s/it, best=0.933][I 2026-03-04 22:02:03,701] Trial 86 finished with value: 0.8016455484651599 and parameters: {'activation': 'identity', 'solver': 'sgd', 'lr': 0.000452657400153399, 'layer1': 255, 'layer2': 10, 'layer3': 99}. Best is trial 82 with value: 0.8934684233581975.
Staphylococcus_Aureus | LPS | Optuna:  44%|████▎     | 87/200 [2:03:45<2:07:31, 67.72s/it, best=0.893]Staphylococcus_Aureus | LPS | Optuna:  44%|████▎     | 87/200 [2:03:45<2:07:31, 67.72s/it, best=0.893][I 2026-03-04 22:03:13,997] Trial 115 finished with value: 0.8617219045783763 and parameters: {'activation': 'identity', 'solver': 'adam', 'lr': 0.0013993868909134295, 'layer1': 459, 'layer2': 150, 'layer3': 245}. Best is trial 49 with value: 0.8647157569215889.
Pseudomonas_Aeruginosa | LPS | Optuna:  58%|█████▊    | 116/200 [2:04:56<1:52:02, 80.03s/it, best=0.865]Pseudomonas_Aeruginosa | LPS | Optuna:  58%|█████▊    | 116/200 [2:04:56<1:52:02, 80.03s/it, best=0.865][I 2026-03-04 22:03:22,548] Trial 112 finished with value: 0.9318314862180348 and parameters: {'activation': 'tanh', 'solver': 'adam', 'lr': 5.287165456548897e-05, 'layer1': 234, 'layer2': 237, 'layer3': 54}. Best is trial 104 with value: 0.9327898309005132.
