Staphylococcus_Aureus | LPS | Optuna:   7%|▋         | 14/200 [28:00<7:04:45, 137.02s/it, best=0.891]Staphylococcus_Aureus | LPS | Optuna:   7%|▋         | 14/200 [28:00<7:04:45, 137.02s/it, best=0.891][I 2026-03-04 20:26:23,781] Trial 23 finished with value: 0.9301839817969695 and parameters: {'activation': 'identity', 'solver': 'adam', 'lr': 0.008498940864615697, 'layer1': 304, 'layer2': 447, 'layer3': 396}. Best is trial 8 with value: 0.9323547463948406.
Klebsiella_Pneumoniae | LPS | Optuna:  12%|█▏        | 24/200 [28:05<3:44:47, 76.63s/it, best=0.932]Klebsiella_Pneumoniae | LPS | Optuna:  12%|█▏        | 24/200 [28:05<3:44:47, 76.63s/it, best=0.932][I 2026-03-04 20:26:28,466] Trial 31 finished with value: 0.8609667591263218 and parameters: {'activation': 'relu', 'solver': 'adam', 'lr': 0.0024757806945205963, 'layer1': 212, 'layer2': 103, 'layer3': 84}. Best is trial 8 with value: 0.8639876185286128.
Pseudomonas_Aeruginosa | LPS | Optuna:  16%|█▌        | 32/200 [28:10<2:28:59, 53.21s/it, best=0.864]Pseudomonas_Aeruginosa | LPS | Optuna:  16%|█▌        | 32/200 [28:10<2:28:59, 53.21s/it, best=0.864][I 2026-03-04 20:27:19,252] Trial 32 finished with value: 0.8587304757845942 and parameters: {'activation': 'relu', 'solver': 'adam', 'lr': 0.002581589436715266, 'layer1': 189, 'layer2': 69, 'layer3': 52}. Best is trial 8 with value: 0.8639876185286128.
Pseudomonas_Aeruginosa | LPS | Optuna:  16%|█▋        | 33/200 [29:01<2:26:04, 52.48s/it, best=0.864]Pseudomonas_Aeruginosa | LPS | Optuna:  16%|█▋        | 33/200 [29:01<2:26:04, 52.48s/it, best=0.864][I 2026-03-04 20:27:58,008] Trial 24 finished with value: 0.9295152752725423 and parameters: {'activation': 'identity', 'solver': 'adam', 'lr': 0.0035981727236742496, 'layer1': 411, 'layer2': 329, 'layer3': 439}. Best is trial 8 with value: 0.9323547463948406.
Klebsiella_Pneumoniae | LPS | Optuna:  12%|█▎        | 25/200 [29:40<3:58:54, 81.91s/it, best=0.932]Klebsiella_Pneumoniae | LPS | Optuna:  12%|█▎        | 25/200 [29:40<3:58:54, 81.91s/it, best=0.932][I 2026-03-04 20:28:16,416] Trial 33 finished with value: 0.8585108497279854 and parameters: {'activation': 'relu', 'solver': 'adam', 'lr': 0.0008978535769632132, 'layer1': 244, 'layer2': 72, 'layer3': 125}. Best is trial 8 with value: 0.8639876185286128.
Pseudomonas_Aeruginosa | LPS | Optuna:  17%|█▋        | 34/200 [29:58<2:29:05, 53.89s/it, best=0.864]Pseudomonas_Aeruginosa | LPS | Optuna:  17%|█▋        | 34/200 [29:58<2:29:05, 53.89s/it, best=0.864][I 2026-03-04 20:28:29,064] Trial 14 finished with value: 0.863668804271893 and parameters: {'activation': 'relu', 'solver': 'adam', 'lr': 3.703261438698777e-05, 'layer1': 499, 'layer2': 137, 'layer3': 436}. Best is trial 14 with value: 0.863668804271893.
Escherichia_Coli | LPS | Optuna:   8%|▊         | 15/200 [30:11<8:22:29, 162.97s/it, best=0.861]Escherichia_Coli | LPS | Optuna:   8%|▊         | 15/200 [30:11<8:22:29, 162.97s/it, best=0.864][I 2026-03-04 20:29:16,253] Trial 34 finished with value: 0.8601269898172588 and parameters: {'activation': 'relu', 'solver': 'adam', 'lr': 0.0018160599088753347, 'layer1': 292, 'layer2': 242, 'layer3': 75}. Best is trial 8 with value: 0.8639876185286128.
Pseudomonas_Aeruginosa | LPS | Optuna:  18%|█▊        | 35/200 [30:58<2:33:06, 55.67s/it, best=0.864]Pseudomonas_Aeruginosa | LPS | Optuna:  18%|█▊        | 35/200 [30:58<2:33:06, 55.67s/it, best=0.864][I 2026-03-04 20:29:28,762] Trial 25 finished with value: 0.930748201959122 and parameters: {'activation': 'identity', 'solver': 'adam', 'lr': 6.885444338539904e-05, 'layer1': 229, 'layer2': 386, 'layer3': 364}. Best is trial 8 with value: 0.9323547463948406.
Klebsiella_Pneumoniae | LPS | Optuna:  13%|█▎        | 26/200 [31:10<4:05:14, 84.56s/it, best=0.932]Klebsiella_Pneumoniae | LPS | Optuna:  13%|█▎        | 26/200 [31:10<4:05:14, 84.56s/it, best=0.932][I 2026-03-04 20:29:34,325] Trial 14 finished with value: 0.8775264278911079 and parameters: {'activation': 'relu', 'solver': 'adam', 'lr': 0.008909399584034763, 'layer1': 330, 'layer2': 397, 'layer3': 234}. Best is trial 11 with value: 0.8914503234994129.
Staphylococcus_Aureus | LPS | Optuna:   8%|▊         | 15/200 [31:16<7:57:09, 154.75s/it, best=0.891]Staphylococcus_Aureus | LPS | Optuna:   8%|▊         | 15/200 [31:16<7:57:09, 154.75s/it, best=0.891][I 2026-03-04 20:30:12,940] Trial 35 finished with value: 0.8605422184362332 and parameters: {'activation': 'relu', 'solver': 'adam', 'lr': 0.00019160146526767962, 'layer1': 130, 'layer2': 179, 'layer3': 161}. Best is trial 8 with value: 0.8639876185286128.
Pseudomonas_Aeruginosa | LPS | Optuna:  18%|█▊        | 36/200 [31:55<2:33:00, 55.98s/it, best=0.864]Pseudomonas_Aeruginosa | LPS | Optuna:  18%|█▊        | 36/200 [31:55<2:33:00, 55.98s/it, best=0.864][I 2026-03-04 20:30:25,421] Trial 26 finished with value: 0.8751371337487118 and parameters: {'activation': 'identity', 'solver': 'sgd', 'lr': 0.0005717056056563958, 'layer1': 461, 'layer2': 435, 'layer3': 203}. Best is trial 8 with value: 0.9323547463948406.
Klebsiella_Pneumoniae | LPS | Optuna:  14%|█▎        | 27/200 [32:07<3:39:41, 76.19s/it, best=0.932]Klebsiella_Pneumoniae | LPS | Optuna:  14%|█▎        | 27/200 [32:07<3:39:41, 76.19s/it, best=0.932][I 2026-03-04 20:30:44,553] Trial 15 finished with value: 0.8916772283175017 and parameters: {'activation': 'identity', 'solver': 'adam', 'lr': 0.00023079754987887792, 'layer1': 162, 'layer2': 149, 'layer3': 262}. Best is trial 15 with value: 0.8916772283175017.
Staphylococcus_Aureus | LPS | Optuna:   8%|▊         | 16/200 [32:26<6:36:33, 129.31s/it, best=0.891]Staphylococcus_Aureus | LPS | Optuna:   8%|▊         | 16/200 [32:26<6:36:33, 129.31s/it, best=0.892][I 2026-03-04 20:30:52,039] Trial 36 finished with value: 0.8289703788113453 and parameters: {'activation': 'logistic', 'solver': 'adam', 'lr': 0.004218668525882685, 'layer1': 86, 'layer2': 306, 'layer3': 39}. Best is trial 8 with value: 0.8639876185286128.
Pseudomonas_Aeruginosa | LPS | Optuna:  18%|█▊        | 37/200 [32:34<2:18:18, 50.91s/it, best=0.864]Pseudomonas_Aeruginosa | LPS | Optuna:  18%|█▊        | 37/200 [32:34<2:18:18, 50.91s/it, best=0.864][I 2026-03-04 20:31:24,177] Trial 15 finished with value: 0.8612044485046846 and parameters: {'activation': 'relu', 'solver': 'adam', 'lr': 0.00027188414293487136, 'layer1': 499, 'layer2': 134, 'layer3': 496}. Best is trial 14 with value: 0.863668804271893.
Escherichia_Coli | LPS | Optuna:   8%|▊         | 16/200 [33:06<8:30:59, 166.63s/it, best=0.864]Escherichia_Coli | LPS | Optuna:   8%|▊         | 16/200 [33:06<8:30:59, 166.63s/it, best=0.864][I 2026-03-04 20:31:40,090] Trial 27 finished with value: 0.9280172772764198 and parameters: {'activation': 'logistic', 'solver': 'adam', 'lr': 0.001777710222946374, 'layer1': 368, 'layer2': 254, 'layer3': 265}. Best is trial 8 with value: 0.9323547463948406.
Klebsiella_Pneumoniae | LPS | Optuna:  14%|█▍        | 28/200 [33:22<3:37:06, 75.74s/it, best=0.932]Klebsiella_Pneumoniae | LPS | Optuna:  14%|█▍        | 28/200 [33:22<3:37:06, 75.74s/it, best=0.932][I 2026-03-04 20:32:07,274] Trial 16 finished with value: 0.8901858091892887 and parameters: {'activation': 'tanh', 'solver': 'adam', 'lr': 0.00015107626998085415, 'layer1': 148, 'layer2': 104, 'layer3': 409}. Best is trial 15 with value: 0.8916772283175017.
Staphylococcus_Aureus | LPS | Optuna:   8%|▊         | 17/200 [33:49<5:51:40, 115.30s/it, best=0.892]Staphylococcus_Aureus | LPS | Optuna:   8%|▊         | 17/200 [33:49<5:51:40, 115.30s/it, best=0.892][I 2026-03-04 20:32:29,578] Trial 37 finished with value: 0.8620212169172013 and parameters: {'activation': 'relu', 'solver': 'adam', 'lr': 0.00038177748466342644, 'layer1': 445, 'layer2': 281, 'layer3': 188}. Best is trial 8 with value: 0.8639876185286128.
Pseudomonas_Aeruginosa | LPS | Optuna:  19%|█▉        | 38/200 [34:11<2:55:14, 64.90s/it, best=0.864]Pseudomonas_Aeruginosa | LPS | Optuna:  19%|█▉        | 38/200 [34:11<2:55:14, 64.90s/it, best=0.864][I 2026-03-04 20:33:13,649] Trial 38 finished with value: 0.8289425450585075 and parameters: {'activation': 'identity', 'solver': 'sgd', 'lr': 3.386349758284922e-05, 'layer1': 269, 'layer2': 120, 'layer3': 128}. Best is trial 8 with value: 0.8639876185286128.
Pseudomonas_Aeruginosa | LPS | Optuna:  20%|█▉        | 39/200 [34:55<2:37:22, 58.65s/it, best=0.864]Pseudomonas_Aeruginosa | LPS | Optuna:  20%|█▉        | 39/200 [34:55<2:37:22, 58.65s/it, best=0.864][I 2026-03-04 20:33:14,761] Trial 28 finished with value: 0.9313768195548853 and parameters: {'activation': 'tanh', 'solver': 'adam', 'lr': 5.520350166411609e-05, 'layer1': 291, 'layer2': 363, 'layer3': 316}. Best is trial 8 with value: 0.9323547463948406.
Klebsiella_Pneumoniae | LPS | Optuna:  14%|█▍        | 29/200 [34:56<3:52:02, 81.42s/it, best=0.932]Klebsiella_Pneumoniae | LPS | Optuna:  14%|█▍        | 29/200 [34:56<3:52:02, 81.42s/it, best=0.932][I 2026-03-04 20:33:40,521] Trial 39 finished with value: 0.8270735296511216 and parameters: {'activation': 'tanh', 'solver': 'adam', 'lr': 9.07330211440507e-06, 'layer1': 34, 'layer2': 380, 'layer3': 16}. Best is trial 8 with value: 0.8639876185286128.
Pseudomonas_Aeruginosa | LPS | Optuna:  20%|██        | 40/200 [35:22<2:10:58, 49.12s/it, best=0.864]Pseudomonas_Aeruginosa | LPS | Optuna:  20%|██        | 40/200 [35:22<2:10:58, 49.12s/it, best=0.864][I 2026-03-04 20:34:05,850] Trial 29 finished with value: 0.8759292271472219 and parameters: {'activation': 'tanh', 'solver': 'sgd', 'lr': 2.8912644384523117e-05, 'layer1': 180, 'layer2': 365, 'layer3': 323}. Best is trial 8 with value: 0.9323547463948406.
Klebsiella_Pneumoniae | LPS | Optuna:  15%|█▌        | 30/200 [35:48<3:24:54, 72.32s/it, best=0.932]Klebsiella_Pneumoniae | LPS | Optuna:  15%|█▌        | 30/200 [35:48<3:24:54, 72.32s/it, best=0.932][I 2026-03-04 20:34:06,814] Trial 17 finished with value: 0.8680125981423601 and parameters: {'activation': 'logistic', 'solver': 'adam', 'lr': 0.000255276101246794, 'layer1': 186, 'layer2': 174, 'layer3': 171}. Best is trial 15 with value: 0.8916772283175017.
Staphylococcus_Aureus | LPS | Optuna:   9%|▉         | 18/200 [35:48<5:53:36, 116.57s/it, best=0.892]Staphylococcus_Aureus | LPS | Optuna:   9%|▉         | 18/200 [35:48<5:53:36, 116.57s/it, best=0.892][I 2026-03-04 20:34:37,901] Trial 40 finished with value: 0.8550927355488446 and parameters: {'activation': 'relu', 'solver': 'adam', 'lr': 0.0007502543802492683, 'layer1': 246, 'layer2': 461, 'layer3': 103}. Best is trial 8 with value: 0.8639876185286128.
Pseudomonas_Aeruginosa | LPS | Optuna:  20%|██        | 41/200 [36:20<2:16:43, 51.60s/it, best=0.864]Pseudomonas_Aeruginosa | LPS | Optuna:  20%|██        | 41/200 [36:20<2:16:43, 51.60s/it, best=0.864][I 2026-03-04 20:34:37,929] Trial 16 finished with value: 0.8613829852178949 and parameters: {'activation': 'relu', 'solver': 'adam', 'lr': 7.054382978969143e-05, 'layer1': 499, 'layer2': 135, 'layer3': 435}. Best is trial 14 with value: 0.863668804271893.
Escherichia_Coli | LPS | Optuna:   8%|▊         | 17/200 [36:20<8:53:05, 174.78s/it, best=0.864]Escherichia_Coli | LPS | Optuna:   8%|▊         | 17/200 [36:20<8:53:05, 174.78s/it, best=0.864][I 2026-03-04 20:34:40,317] Trial 18 finished with value: 0.8016455484651599 and parameters: {'activation': 'identity', 'solver': 'sgd', 'lr': 0.002623070698116898, 'layer1': 116, 'layer2': 89, 'layer3': 296}. Best is trial 15 with value: 0.8916772283175017.
Staphylococcus_Aureus | LPS | Optuna:  10%|▉         | 19/200 [36:22<4:36:24, 91.62s/it, best=0.892] Staphylococcus_Aureus | LPS | Optuna:  10%|▉         | 19/200 [36:22<4:36:24, 91.62s/it, best=0.892][I 2026-03-04 20:35:16,513] Trial 30 finished with value: 0.9316824907474907 and parameters: {'activation': 'tanh', 'solver': 'adam', 'lr': 5.327455931259204e-05, 'layer1': 85, 'layer2': 302, 'layer3': 129}. Best is trial 8 with value: 0.9323547463948406.
Klebsiella_Pneumoniae | LPS | Optuna:  16%|█▌        | 31/200 [36:58<3:22:17, 71.82s/it, best=0.932]Klebsiella_Pneumoniae | LPS | Optuna:  16%|█▌        | 31/200 [36:58<3:22:17, 71.82s/it, best=0.932][I 2026-03-04 20:36:08,305] Trial 41 finished with value: 0.8606611045557854 and parameters: {'activation': 'relu', 'solver': 'adam', 'lr': 0.00042354326690258556, 'layer1': 456, 'layer2': 276, 'layer3': 184}. Best is trial 8 with value: 0.8639876185286128.
Pseudomonas_Aeruginosa | LPS | Optuna:  21%|██        | 42/200 [37:50<2:46:31, 63.24s/it, best=0.864]Pseudomonas_Aeruginosa | LPS | Optuna:  21%|██        | 42/200 [37:50<2:46:31, 63.24s/it, best=0.864][I 2026-03-04 20:36:19,646] Trial 31 finished with value: 0.9315468714977182 and parameters: {'activation': 'tanh', 'solver': 'adam', 'lr': 5.7201310906173836e-05, 'layer1': 85, 'layer2': 314, 'layer3': 127}. Best is trial 8 with value: 0.9323547463948406.
Klebsiella_Pneumoniae | LPS | Optuna:  16%|█▌        | 32/200 [38:01<3:13:48, 69.21s/it, best=0.932]Klebsiella_Pneumoniae | LPS | Optuna:  16%|█▌        | 32/200 [38:01<3:13:48, 69.21s/it, best=0.932][I 2026-03-04 20:36:34,785] Trial 19 finished with value: 0.8845174736832572 and parameters: {'activation': 'relu', 'solver': 'adam', 'lr': 6.493485096206295e-05, 'layer1': 14, 'layer2': 226, 'layer3': 378}. Best is trial 15 with value: 0.8916772283175017.
Staphylococcus_Aureus | LPS | Optuna:  10%|█         | 20/200 [38:16<4:55:26, 98.48s/it, best=0.892]Staphylococcus_Aureus | LPS | Optuna:  10%|█         | 20/200 [38:16<4:55:26, 98.48s/it, best=0.892][I 2026-03-04 20:37:45,618] Trial 32 finished with value: 0.9314229884874059 and parameters: {'activation': 'tanh', 'solver': 'adam', 'lr': 3.73371008736941e-05, 'layer1': 16, 'layer2': 314, 'layer3': 135}. Best is trial 8 with value: 0.9323547463948406.
Klebsiella_Pneumoniae | LPS | Optuna:  16%|█▋        | 33/200 [39:27<3:26:38, 74.24s/it, best=0.932]Klebsiella_Pneumoniae | LPS | Optuna:  16%|█▋        | 33/200 [39:27<3:26:38, 74.24s/it, best=0.932][I 2026-03-04 20:37:59,675] Trial 17 finished with value: 0.8607352485394077 and parameters: {'activation': 'relu', 'solver': 'adam', 'lr': 6.446221903608035e-05, 'layer1': 430, 'layer2': 104, 'layer3': 400}. Best is trial 14 with value: 0.863668804271893.
Escherichia_Coli | LPS | Optuna:   9%|▉         | 18/200 [39:41<9:14:45, 182.88s/it, best=0.864]Escherichia_Coli | LPS | Optuna:   9%|▉         | 18/200 [39:41<9:14:45, 182.88s/it, best=0.864][I 2026-03-04 20:38:06,538] Trial 42 finished with value: 0.8570523363578534 and parameters: {'activation': 'relu', 'solver': 'adam', 'lr': 0.0001263505369958539, 'layer1': 434, 'layer2': 10, 'layer3': 228}. Best is trial 8 with value: 0.8639876185286128.
Pseudomonas_Aeruginosa | LPS | Optuna:  22%|██▏       | 43/200 [39:48<3:28:38, 79.74s/it, best=0.864]Pseudomonas_Aeruginosa | LPS | Optuna:  22%|██▏       | 43/200 [39:48<3:28:38, 79.74s/it, best=0.864][I 2026-03-04 20:38:10,676] Trial 20 finished with value: 0.8891981649657495 and parameters: {'activation': 'relu', 'solver': 'adam', 'lr': 0.00030240963997002864, 'layer1': 211, 'layer2': 140, 'layer3': 467}. Best is trial 15 with value: 0.8916772283175017.
Staphylococcus_Aureus | LPS | Optuna:  10%|█         | 21/200 [39:52<4:51:29, 97.71s/it, best=0.892]Staphylococcus_Aureus | LPS | Optuna:  10%|█         | 21/200 [39:52<4:51:29, 97.71s/it, best=0.892][I 2026-03-04 20:38:19,006] Trial 33 finished with value: 0.8746470562584285 and parameters: {'activation': 'tanh', 'solver': 'adam', 'lr': 9.132127331919702e-06, 'layer1': 86, 'layer2': 250, 'layer3': 130}. Best is trial 8 with value: 0.9323547463948406.
Klebsiella_Pneumoniae | LPS | Optuna:  17%|█▋        | 34/200 [40:01<2:51:29, 61.99s/it, best=0.932]Klebsiella_Pneumoniae | LPS | Optuna:  17%|█▋        | 34/200 [40:01<2:51:29, 61.99s/it, best=0.932][I 2026-03-04 20:39:15,224] Trial 43 finished with value: 0.8282377802931814 and parameters: {'activation': 'relu', 'solver': 'adam', 'lr': 1.2403668302547623e-06, 'layer1': 405, 'layer2': 304, 'layer3': 256}. Best is trial 8 with value: 0.8639876185286128.
Pseudomonas_Aeruginosa | LPS | Optuna:  22%|██▏       | 44/200 [40:57<3:18:41, 76.42s/it, best=0.864]Pseudomonas_Aeruginosa | LPS | Optuna:  22%|██▏       | 44/200 [40:57<3:18:41, 76.42s/it, best=0.864][I 2026-03-04 20:39:16,146] Trial 34 finished with value: 0.9312935709034276 and parameters: {'activation': 'tanh', 'solver': 'adam', 'lr': 0.0001272493022097496, 'layer1': 132, 'layer2': 290, 'layer3': 112}. Best is trial 8 with value: 0.9323547463948406.
Klebsiella_Pneumoniae | LPS | Optuna:  18%|█▊        | 35/200 [40:58<2:46:27, 60.53s/it, best=0.932]Klebsiella_Pneumoniae | LPS | Optuna:  18%|█▊        | 35/200 [40:58<2:46:27, 60.53s/it, best=0.932][I 2026-03-04 20:39:47,768] Trial 35 finished with value: 0.8746470562584285 and parameters: {'activation': 'logistic', 'solver': 'adam', 'lr': 0.00021984327536695803, 'layer1': 76, 'layer2': 227, 'layer3': 16}. Best is trial 8 with value: 0.9323547463948406.
Klebsiella_Pneumoniae | LPS | Optuna:  18%|█▊        | 36/200 [41:29<2:21:44, 51.86s/it, best=0.932]Klebsiella_Pneumoniae | LPS | Optuna:  18%|█▊        | 36/200 [41:29<2:21:44, 51.86s/it, best=0.932][I 2026-03-04 20:39:50,739] Trial 21 finished with value: 0.8901649601963249 and parameters: {'activation': 'identity', 'solver': 'adam', 'lr': 0.0023613619658472912, 'layer1': 318, 'layer2': 412, 'layer3': 251}. Best is trial 15 with value: 0.8916772283175017.
Staphylococcus_Aureus | LPS | Optuna:  11%|█         | 22/200 [41:32<4:51:57, 98.41s/it, best=0.892]Staphylococcus_Aureus | LPS | Optuna:  11%|█         | 22/200 [41:32<4:51:57, 98.41s/it, best=0.892][I 2026-03-04 20:40:11,208] Trial 18 finished with value: 0.7416503444146234 and parameters: {'activation': 'relu', 'solver': 'sgd', 'lr': 5.378678880540115e-05, 'layer1': 394, 'layer2': 81, 'layer3': 429}. Best is trial 14 with value: 0.863668804271893.
Escherichia_Coli | LPS | Optuna:  10%|▉         | 19/200 [41:53<8:25:10, 167.46s/it, best=0.864]Escherichia_Coli | LPS | Optuna:  10%|▉         | 19/200 [41:53<8:25:10, 167.46s/it, best=0.864][I 2026-03-04 20:40:43,085] Trial 22 finished with value: 0.8930759779387886 and parameters: {'activation': 'identity', 'solver': 'adam', 'lr': 0.0005554680614125038, 'layer1': 111, 'layer2': 234, 'layer3': 196}. Best is trial 22 with value: 0.8930759779387886.
Staphylococcus_Aureus | LPS | Optuna:  12%|█▏        | 23/200 [42:25<4:09:32, 84.59s/it, best=0.892]Staphylococcus_Aureus | LPS | Optuna:  12%|█▏        | 23/200 [42:25<4:09:32, 84.59s/it, best=0.893][I 2026-03-04 20:40:56,668] Trial 44 finished with value: 0.8631318645847681 and parameters: {'activation': 'relu', 'solver': 'adam', 'lr': 0.0003220368082329943, 'layer1': 483, 'layer2': 234, 'layer3': 140}. Best is trial 8 with value: 0.8639876185286128.
Pseudomonas_Aeruginosa | LPS | Optuna:  22%|██▎       | 45/200 [42:38<3:36:48, 83.93s/it, best=0.864]Pseudomonas_Aeruginosa | LPS | Optuna:  22%|██▎       | 45/200 [42:38<3:36:48, 83.93s/it, best=0.864][I 2026-03-04 20:41:30,191] Trial 36 finished with value: 0.9320026323014939 and parameters: {'activation': 'tanh', 'solver': 'adam', 'lr': 2.8228279182780675e-05, 'layer1': 22, 'layer2': 324, 'layer3': 200}. Best is trial 8 with value: 0.9323547463948406.
Klebsiella_Pneumoniae | LPS | Optuna:  18%|█▊        | 37/200 [43:12<3:02:05, 67.03s/it, best=0.932]Klebsiella_Pneumoniae | LPS | Optuna:  18%|█▊        | 37/200 [43:12<3:02:05, 67.03s/it, best=0.932][I 2026-03-04 20:42:01,613] Trial 37 finished with value: 0.8752932749930242 and parameters: {'activation': 'tanh', 'solver': 'adam', 'lr': 9.142395121749077e-06, 'layer1': 13, 'layer2': 341, 'layer3': 197}. Best is trial 8 with value: 0.9323547463948406.
Klebsiella_Pneumoniae | LPS | Optuna:  19%|█▉        | 38/200 [43:43<2:32:08, 56.35s/it, best=0.932]Klebsiella_Pneumoniae | LPS | Optuna:  19%|█▉        | 38/200 [43:43<2:32:08, 56.35s/it, best=0.932][I 2026-03-04 20:42:08,240] Trial 45 finished with value: 0.8601928307604737 and parameters: {'activation': 'identity', 'solver': 'adam', 'lr': 0.001632571157145225, 'layer1': 473, 'layer2': 157, 'layer3': 141}. Best is trial 8 with value: 0.8639876185286128.
Pseudomonas_Aeruginosa | LPS | Optuna:  23%|██▎       | 46/200 [43:50<3:25:54, 80.22s/it, best=0.864]Pseudomonas_Aeruginosa | LPS | Optuna:  23%|██▎       | 46/200 [43:50<3:25:54, 80.22s/it, best=0.864][I 2026-03-04 20:42:23,407] Trial 23 finished with value: 0.8901513910119474 and parameters: {'activation': 'identity', 'solver': 'adam', 'lr': 5.239421697847566e-05, 'layer1': 108, 'layer2': 239, 'layer3': 193}. Best is trial 22 with value: 0.8930759779387886.
Staphylococcus_Aureus | LPS | Optuna:  12%|█▏        | 24/200 [44:05<4:21:58, 89.31s/it, best=0.893]Staphylococcus_Aureus | LPS | Optuna:  12%|█▏        | 24/200 [44:05<4:21:58, 89.31s/it, best=0.893][I 2026-03-04 20:42:48,111] Trial 38 finished with value: 0.4626074948542668 and parameters: {'activation': 'relu', 'solver': 'sgd', 'lr': 2.8058928372291766e-05, 'layer1': 44, 'layer2': 472, 'layer3': 212}. Best is trial 8 with value: 0.9323547463948406.
Klebsiella_Pneumoniae | LPS | Optuna:  20%|█▉        | 39/200 [44:30<2:23:16, 53.39s/it, best=0.932]Klebsiella_Pneumoniae | LPS | Optuna:  20%|█▉        | 39/200 [44:30<2:23:16, 53.39s/it, best=0.932][I 2026-03-04 20:42:49,168] Trial 46 finished with value: 0.8287051981583435 and parameters: {'activation': 'relu', 'solver': 'sgd', 'lr': 0.00015951907705597938, 'layer1': 158, 'layer2': 227, 'layer3': 102}. Best is trial 8 with value: 0.8639876185286128.
