Staphylococcus_Aureus | LPS | Optuna:  88%|████████▊ | 175/200 [3:53:43<36:33, 87.75s/it, best=0.894]Staphylococcus_Aureus | LPS | Optuna:  88%|████████▊ | 175/200 [3:53:43<36:33, 87.75s/it, best=0.894][I 2026-03-04 23:52:17,558] Trial 198 finished with value: 0.8593871018020085 and parameters: {'activation': 'relu', 'solver': 'adam', 'lr': 0.0032842859492045085, 'layer1': 457, 'layer2': 76, 'layer3': 398}. Best is trial 172 with value: 0.8682843857718467.
Pseudomonas_Aeruginosa | LPS | Optuna: 100%|█████████▉| 199/200 [3:53:59<01:25, 85.03s/it, best=0.868]Pseudomonas_Aeruginosa | LPS | Optuna: 100%|█████████▉| 199/200 [3:53:59<01:25, 85.03s/it, best=0.868][I 2026-03-04 23:53:15,791] Trial 192 finished with value: 0.9320487661979904 and parameters: {'activation': 'tanh', 'solver': 'adam', 'lr': 4.4277668863615125e-05, 'layer1': 113, 'layer2': 288, 'layer3': 84}. Best is trial 175 with value: 0.9332398278164448.
Klebsiella_Pneumoniae | LPS | Optuna:  96%|█████████▋| 193/200 [3:54:58<10:37, 91.13s/it, best=0.933]Klebsiella_Pneumoniae | LPS | Optuna:  96%|█████████▋| 193/200 [3:54:58<10:37, 91.13s/it, best=0.933][I 2026-03-04 23:53:16,804] Trial 81 finished with value: 0.8633886656293214 and parameters: {'activation': 'relu', 'solver': 'adam', 'lr': 2.513189169933412e-05, 'layer1': 453, 'layer2': 12, 'layer3': 450}. Best is trial 73 with value: 0.864893646817533.
Escherichia_Coli | LPS | Optuna:  41%|████      | 82/200 [3:54:58<8:00:37, 244.39s/it, best=0.865]Escherichia_Coli | LPS | Optuna:  41%|████      | 82/200 [3:54:58<8:00:37, 244.39s/it, best=0.865][I 2026-03-04 23:53:46,305] Trial 199 finished with value: 0.8650570224780738 and parameters: {'activation': 'relu', 'solver': 'adam', 'lr': 0.0038496895351166406, 'layer1': 450, 'layer2': 83, 'layer3': 408}. Best is trial 172 with value: 0.8682843857718467.
Pseudomonas_Aeruginosa | LPS | Optuna: 100%|██████████| 200/200 [3:55:28<00:00, 86.15s/it, best=0.868]Pseudomonas_Aeruginosa | LPS | Optuna: 100%|██████████| 200/200 [3:55:28<00:00, 86.15s/it, best=0.868]                                                                                                      [Pseudomonas_Aeruginosa | LPS] [OPTUNA DONE] Best CV WF1=0.8683 | params={'activation': 'relu', 'solver': 'adam', 'lr': 0.004215968282365892, 'layer1': 402, 'layer2': 208, 'layer3': 435}
[Pseudomonas_Aeruginosa | LPS] Retraining with validation early stopping (10% split)...
[Pseudomonas_Aeruginosa | LPS] Testing...
[Pseudomonas_Aeruginosa | LPS] [TEST] WF1=0.8452 | ACC=0.8628 | HL=0.1372 | best_val_WF1=0.8733

[Pseudomonas_Aeruginosa] ===== Direct multilabel training =====
[I 2026-03-04 23:54:05,949] A new study created in memory with name: no-name-6119ec57-73d2-4d1d-835f-0ec99413c482
Pseudomonas_Aeruginosa | DirectMulti | Optuna:   0%|          | 0/200 [00:00<?, ?it/s][I 2026-03-04 23:54:19,704] Trial 193 finished with value: 0.9335316167236047 and parameters: {'activation': 'tanh', 'solver': 'adam', 'lr': 7.693489492906515e-05, 'layer1': 94, 'layer2': 313, 'layer3': 99}. Best is trial 193 with value: 0.9335316167236047.
Klebsiella_Pneumoniae | LPS | Optuna:  97%|█████████▋| 194/200 [3:56:01<08:17, 82.96s/it, best=0.933]Klebsiella_Pneumoniae | LPS | Optuna:  97%|█████████▋| 194/200 [3:56:01<08:17, 82.96s/it, best=0.933][I 2026-03-04 23:54:59,866] Trial 0 finished with value: 0.4533594158261649 and parameters: {'activation': 'logistic', 'solver': 'sgd', 'lr': 1.7073967431528114e-06, 'layer1': 435, 'layer2': 305, 'layer3': 357}. Best is trial 0 with value: 0.4533594158261649.
Pseudomonas_Aeruginosa | DirectMulti | Optuna:   0%|          | 1/200 [00:53<2:58:49, 53.92s/it]Pseudomonas_Aeruginosa | DirectMulti | Optuna:   0%|          | 1/200 [00:53<2:58:49, 53.92s/it, best=0.453][I 2026-03-04 23:55:24,830] Trial 194 finished with value: 0.9312085095210761 and parameters: {'activation': 'tanh', 'solver': 'adam', 'lr': 8.839223980687321e-05, 'layer1': 87, 'layer2': 322, 'layer3': 106}. Best is trial 193 with value: 0.9335316167236047.
Klebsiella_Pneumoniae | LPS | Optuna:  98%|█████████▊| 195/200 [3:57:07<06:28, 77.61s/it, best=0.933]Klebsiella_Pneumoniae | LPS | Optuna:  98%|█████████▊| 195/200 [3:57:07<06:28, 77.61s/it, best=0.933][I 2026-03-04 23:55:43,847] Trial 1 finished with value: 0.8261898244308833 and parameters: {'activation': 'logistic', 'solver': 'adam', 'lr': 1.6480446427978994e-05, 'layer1': 267, 'layer2': 222, 'layer3': 152}. Best is trial 1 with value: 0.8261898244308833.
Pseudomonas_Aeruginosa | DirectMulti | Optuna:   1%|          | 2/200 [01:37<2:38:38, 48.07s/it, best=0.453]Pseudomonas_Aeruginosa | DirectMulti | Optuna:   1%|          | 2/200 [01:37<2:38:38, 48.07s/it, best=0.826][I 2026-03-04 23:56:19,441] Trial 195 finished with value: 0.9318802876075907 and parameters: {'activation': 'tanh', 'solver': 'adam', 'lr': 0.00012341305534862887, 'layer1': 96, 'layer2': 310, 'layer3': 95}. Best is trial 193 with value: 0.9335316167236047.
Klebsiella_Pneumoniae | LPS | Optuna:  98%|█████████▊| 196/200 [3:58:01<04:42, 70.71s/it, best=0.933]Klebsiella_Pneumoniae | LPS | Optuna:  98%|█████████▊| 196/200 [3:58:01<04:42, 70.71s/it, best=0.933][I 2026-03-04 23:56:27,344] Trial 2 finished with value: 0.8260977603006419 and parameters: {'activation': 'identity', 'solver': 'adam', 'lr': 6.290644294586145e-06, 'layer1': 262, 'layer2': 300, 'layer3': 32}. Best is trial 1 with value: 0.8261898244308833.
Pseudomonas_Aeruginosa | DirectMulti | Optuna:   2%|▏         | 3/200 [02:21<2:30:58, 45.98s/it, best=0.826]Pseudomonas_Aeruginosa | DirectMulti | Optuna:   2%|▏         | 3/200 [02:21<2:30:58, 45.98s/it, best=0.826][I 2026-03-04 23:57:13,095] Trial 175 finished with value: 0.8738742718982717 and parameters: {'activation': 'identity', 'solver': 'adam', 'lr': 1.057711010372339e-05, 'layer1': 272, 'layer2': 46, 'layer3': 147}. Best is trial 124 with value: 0.8938450095328893.
Staphylococcus_Aureus | LPS | Optuna:  88%|████████▊ | 176/200 [3:58:55<1:01:58, 154.93s/it, best=0.894]Staphylococcus_Aureus | LPS | Optuna:  88%|████████▊ | 176/200 [3:58:55<1:01:58, 154.93s/it, best=0.894][I 2026-03-04 23:57:38,523] Trial 196 finished with value: 0.9313506373566078 and parameters: {'activation': 'tanh', 'solver': 'adam', 'lr': 5.711386300225455e-05, 'layer1': 135, 'layer2': 347, 'layer3': 74}. Best is trial 193 with value: 0.9335316167236047.
Klebsiella_Pneumoniae | LPS | Optuna:  98%|█████████▊| 197/200 [3:59:20<03:39, 73.22s/it, best=0.933]Klebsiella_Pneumoniae | LPS | Optuna:  98%|█████████▊| 197/200 [3:59:20<03:39, 73.22s/it, best=0.933][I 2026-03-04 23:57:43,659] Trial 3 finished with value: 0.4006100238725514 and parameters: {'activation': 'relu', 'solver': 'sgd', 'lr': 1.6536937182824424e-05, 'layer1': 57, 'layer2': 345, 'layer3': 226}. Best is trial 1 with value: 0.8261898244308833.
Pseudomonas_Aeruginosa | DirectMulti | Optuna:   2%|▏         | 4/200 [03:37<3:09:19, 57.96s/it, best=0.826]Pseudomonas_Aeruginosa | DirectMulti | Optuna:   2%|▏         | 4/200 [03:37<3:09:19, 57.96s/it, best=0.826][I 2026-03-04 23:58:25,269] Trial 4 finished with value: 0.8263598931700298 and parameters: {'activation': 'relu', 'solver': 'adam', 'lr': 1.7654048052495086e-05, 'layer1': 265, 'layer2': 278, 'layer3': 100}. Best is trial 4 with value: 0.8263598931700298.
Pseudomonas_Aeruginosa | DirectMulti | Optuna:   2%|▎         | 5/200 [04:19<2:49:12, 52.06s/it, best=0.826]Pseudomonas_Aeruginosa | DirectMulti | Optuna:   2%|▎         | 5/200 [04:19<2:49:12, 52.06s/it, best=0.826][I 2026-03-04 23:58:25,551] Trial 197 finished with value: 0.8752670324307722 and parameters: {'activation': 'tanh', 'solver': 'sgd', 'lr': 5.1055182067479946e-05, 'layer1': 118, 'layer2': 455, 'layer3': 118}. Best is trial 193 with value: 0.9335316167236047.
Klebsiella_Pneumoniae | LPS | Optuna:  99%|█████████▉| 198/200 [4:00:07<02:10, 65.36s/it, best=0.933]Klebsiella_Pneumoniae | LPS | Optuna:  99%|█████████▉| 198/200 [4:00:07<02:10, 65.36s/it, best=0.933][I 2026-03-04 23:58:26,122] Trial 176 finished with value: 0.8908625497991295 and parameters: {'activation': 'identity', 'solver': 'adam', 'lr': 0.0004933506873847468, 'layer1': 252, 'layer2': 184, 'layer3': 125}. Best is trial 124 with value: 0.8938450095328893.
Staphylococcus_Aureus | LPS | Optuna:  88%|████████▊ | 177/200 [4:00:08<49:58, 130.36s/it, best=0.894]  Staphylococcus_Aureus | LPS | Optuna:  88%|████████▊ | 177/200 [4:00:08<49:58, 130.36s/it, best=0.894][I 2026-03-04 23:58:36,666] Trial 82 finished with value: 0.8641132512215508 and parameters: {'activation': 'relu', 'solver': 'adam', 'lr': 2.5770853645924526e-05, 'layer1': 458, 'layer2': 32, 'layer3': 448}. Best is trial 73 with value: 0.864893646817533.
Escherichia_Coli | LPS | Optuna:  42%|████▏     | 83/200 [4:00:18<8:40:42, 267.03s/it, best=0.865]Escherichia_Coli | LPS | Optuna:  42%|████▏     | 83/200 [4:00:18<8:40:42, 267.03s/it, best=0.865][I 2026-03-04 23:58:58,657] Trial 5 finished with value: 0.8272127666324639 and parameters: {'activation': 'identity', 'solver': 'adam', 'lr': 2.259279742015697e-06, 'layer1': 106, 'layer2': 32, 'layer3': 169}. Best is trial 5 with value: 0.8272127666324639.
Pseudomonas_Aeruginosa | DirectMulti | Optuna:   3%|▎         | 6/200 [04:52<2:27:48, 45.71s/it, best=0.826]Pseudomonas_Aeruginosa | DirectMulti | Optuna:   3%|▎         | 6/200 [04:52<2:27:48, 45.71s/it, best=0.827][I 2026-03-04 23:59:58,935] Trial 6 finished with value: 0.8272407478297297 and parameters: {'activation': 'tanh', 'solver': 'adam', 'lr': 3.6618192203924288e-06, 'layer1': 403, 'layer2': 46, 'layer3': 494}. Best is trial 6 with value: 0.8272407478297297.
Pseudomonas_Aeruginosa | DirectMulti | Optuna:   4%|▎         | 7/200 [05:52<2:42:21, 50.47s/it, best=0.827]Pseudomonas_Aeruginosa | DirectMulti | Optuna:   4%|▎         | 7/200 [05:52<2:42:21, 50.47s/it, best=0.827][I 2026-03-05 00:00:03,107] Trial 198 finished with value: 0.931240265964988 and parameters: {'activation': 'tanh', 'solver': 'adam', 'lr': 9.716359683677581e-05, 'layer1': 311, 'layer2': 431, 'layer3': 63}. Best is trial 193 with value: 0.9335316167236047.
Klebsiella_Pneumoniae | LPS | Optuna: 100%|█████████▉| 199/200 [4:01:45<01:15, 75.02s/it, best=0.933]Klebsiella_Pneumoniae | LPS | Optuna: 100%|█████████▉| 199/200 [4:01:45<01:15, 75.02s/it, best=0.933][I 2026-03-05 00:00:24,016] Trial 177 finished with value: 0.8913424841548565 and parameters: {'activation': 'identity', 'solver': 'adam', 'lr': 0.0002379961082127363, 'layer1': 424, 'layer2': 60, 'layer3': 139}. Best is trial 124 with value: 0.8938450095328893.
Staphylococcus_Aureus | LPS | Optuna:  89%|████████▉ | 178/200 [4:02:06<46:25, 126.62s/it, best=0.894]Staphylococcus_Aureus | LPS | Optuna:  89%|████████▉ | 178/200 [4:02:06<46:25, 126.62s/it, best=0.894][I 2026-03-05 00:00:31,806] Trial 7 finished with value: 0.857590682859375 and parameters: {'activation': 'relu', 'solver': 'adam', 'lr': 0.0012164139351417069, 'layer1': 46, 'layer2': 186, 'layer3': 66}. Best is trial 7 with value: 0.857590682859375.
Pseudomonas_Aeruginosa | DirectMulti | Optuna:   4%|▍         | 8/200 [06:25<2:23:35, 44.87s/it, best=0.827]Pseudomonas_Aeruginosa | DirectMulti | Optuna:   4%|▍         | 8/200 [06:25<2:23:35, 44.87s/it, best=0.858][I 2026-03-05 00:01:14,936] Trial 199 finished with value: 0.9299927101158371 and parameters: {'activation': 'tanh', 'solver': 'adam', 'lr': 6.746528537194876e-05, 'layer1': 68, 'layer2': 193, 'layer3': 104}. Best is trial 193 with value: 0.9335316167236047.
Klebsiella_Pneumoniae | LPS | Optuna: 100%|██████████| 200/200 [4:02:57<00:00, 74.06s/it, best=0.933]Klebsiella_Pneumoniae | LPS | Optuna: 100%|██████████| 200/200 [4:02:57<00:00, 74.06s/it, best=0.933]                                                                                                     [Klebsiella_Pneumoniae | LPS] [OPTUNA DONE] Best CV WF1=0.9335 | params={'activation': 'tanh', 'solver': 'adam', 'lr': 7.693489492906515e-05, 'layer1': 94, 'layer2': 313, 'layer3': 99}
[Klebsiella_Pneumoniae | LPS] Retraining with validation early stopping (10% split)...
[Klebsiella_Pneumoniae | LPS] Testing...
[Klebsiella_Pneumoniae | LPS] [TEST] WF1=0.9353 | ACC=0.9419 | HL=0.0581 | best_val_WF1=0.9388

[Klebsiella_Pneumoniae] ===== Direct multilabel training =====
[I 2026-03-05 00:01:27,867] A new study created in memory with name: no-name-b14e80b5-155c-4df3-822e-fd80fbb629cf
Klebsiella_Pneumoniae | DirectMulti | Optuna:   0%|          | 0/200 [00:00<?, ?it/s][I 2026-03-05 00:01:34,451] Trial 8 finished with value: 0.8587047088974256 and parameters: {'activation': 'identity', 'solver': 'adam', 'lr': 0.000828752236376816, 'layer1': 323, 'layer2': 445, 'layer3': 241}. Best is trial 8 with value: 0.8587047088974256.
Pseudomonas_Aeruginosa | DirectMulti | Optuna:   4%|▍         | 9/200 [07:28<2:40:31, 50.43s/it, best=0.858]Pseudomonas_Aeruginosa | DirectMulti | Optuna:   4%|▍         | 9/200 [07:28<2:40:31, 50.43s/it, best=0.859][I 2026-03-05 00:01:38,499] Trial 178 finished with value: 0.8934636285880266 and parameters: {'activation': 'identity', 'solver': 'adam', 'lr': 0.0008391923543294548, 'layer1': 243, 'layer2': 314, 'layer3': 108}. Best is trial 124 with value: 0.8938450095328893.
Staphylococcus_Aureus | LPS | Optuna:  90%|████████▉ | 179/200 [4:03:20<38:50, 110.98s/it, best=0.894]Staphylococcus_Aureus | LPS | Optuna:  90%|████████▉ | 179/200 [4:03:20<38:50, 110.98s/it, best=0.894][I 2026-03-05 00:02:32,070] Trial 0 finished with value: 0.594894926638014 and parameters: {'activation': 'logistic', 'solver': 'sgd', 'lr': 1.7073967431528114e-06, 'layer1': 435, 'layer2': 305, 'layer3': 357}. Best is trial 0 with value: 0.594894926638014.
Klebsiella_Pneumoniae | DirectMulti | Optuna:   0%|          | 1/200 [01:04<3:32:56, 64.20s/it]Klebsiella_Pneumoniae | DirectMulti | Optuna:   0%|          | 1/200 [01:04<3:32:56, 64.20s/it, best=0.595][I 2026-03-05 00:02:41,980] Trial 9 finished with value: 0.8290777278391184 and parameters: {'activation': 'tanh', 'solver': 'sgd', 'lr': 0.00012329098365270507, 'layer1': 219, 'layer2': 22, 'layer3': 62}. Best is trial 8 with value: 0.8587047088974256.
Pseudomonas_Aeruginosa | DirectMulti | Optuna:   5%|▌         | 10/200 [08:36<2:56:24, 55.71s/it, best=0.859]Pseudomonas_Aeruginosa | DirectMulti | Optuna:   5%|▌         | 10/200 [08:36<2:56:24, 55.71s/it, best=0.859][I 2026-03-05 00:02:58,745] Trial 179 finished with value: 0.8923516537779512 and parameters: {'activation': 'identity', 'solver': 'adam', 'lr': 0.0009721079971270152, 'layer1': 243, 'layer2': 329, 'layer3': 107}. Best is trial 124 with value: 0.8938450095328893.
Staphylococcus_Aureus | LPS | Optuna:  90%|█████████ | 180/200 [4:04:40<33:55, 101.76s/it, best=0.894]Staphylococcus_Aureus | LPS | Optuna:  90%|█████████ | 180/200 [4:04:40<33:55, 101.76s/it, best=0.894][I 2026-03-05 00:03:19,247] Trial 10 finished with value: 0.826631727610288 and parameters: {'activation': 'identity', 'solver': 'sgd', 'lr': 0.007553503645583194, 'layer1': 366, 'layer2': 492, 'layer3': 320}. Best is trial 8 with value: 0.8587047088974256.
Pseudomonas_Aeruginosa | DirectMulti | Optuna:   6%|▌         | 11/200 [09:13<2:37:41, 50.06s/it, best=0.859]Pseudomonas_Aeruginosa | DirectMulti | Optuna:   6%|▌         | 11/200 [09:13<2:37:41, 50.06s/it, best=0.859][I 2026-03-05 00:03:31,024] Trial 1 finished with value: 0.8746470562584285 and parameters: {'activation': 'logistic', 'solver': 'adam', 'lr': 1.6480446427978994e-05, 'layer1': 267, 'layer2': 222, 'layer3': 152}. Best is trial 1 with value: 0.8746470562584285.
Klebsiella_Pneumoniae | DirectMulti | Optuna:   1%|          | 2/200 [02:03<3:21:40, 61.11s/it, best=0.595]Klebsiella_Pneumoniae | DirectMulti | Optuna:   1%|          | 2/200 [02:03<3:21:40, 61.11s/it, best=0.875][I 2026-03-05 00:04:06,689] Trial 11 finished with value: 0.8554786540448731 and parameters: {'activation': 'relu', 'solver': 'adam', 'lr': 0.0013124793805688133, 'layer1': 150, 'layer2': 163, 'layer3': 284}. Best is trial 8 with value: 0.8587047088974256.
Pseudomonas_Aeruginosa | DirectMulti | Optuna:   6%|▌         | 12/200 [10:00<2:34:22, 49.27s/it, best=0.859]Pseudomonas_Aeruginosa | DirectMulti | Optuna:   6%|▌         | 12/200 [10:00<2:34:22, 49.27s/it, best=0.859][I 2026-03-05 00:04:20,464] Trial 2 finished with value: 0.8752717715153426 and parameters: {'activation': 'identity', 'solver': 'adam', 'lr': 6.290644294586145e-06, 'layer1': 262, 'layer2': 300, 'layer3': 32}. Best is trial 2 with value: 0.8752717715153426.
Klebsiella_Pneumoniae | DirectMulti | Optuna:   2%|▏         | 3/200 [02:52<3:03:09, 55.78s/it, best=0.875]Klebsiella_Pneumoniae | DirectMulti | Optuna:   2%|▏         | 3/200 [02:52<3:03:09, 55.78s/it, best=0.875][I 2026-03-05 00:04:27,885] Trial 83 finished with value: 0.8620847701855133 and parameters: {'activation': 'relu', 'solver': 'adam', 'lr': 2.5307590921049177e-05, 'layer1': 463, 'layer2': 16, 'layer3': 424}. Best is trial 73 with value: 0.864893646817533.
Escherichia_Coli | LPS | Optuna:  42%|████▏     | 84/200 [4:06:09<9:25:05, 292.29s/it, best=0.865]Escherichia_Coli | LPS | Optuna:  42%|████▏     | 84/200 [4:06:09<9:25:05, 292.29s/it, best=0.865][I 2026-03-05 00:05:15,331] Trial 12 finished with value: 0.8573087599119678 and parameters: {'activation': 'identity', 'solver': 'adam', 'lr': 0.00046544039809979403, 'layer1': 347, 'layer2': 434, 'layer3': 419}. Best is trial 8 with value: 0.8587047088974256.
Pseudomonas_Aeruginosa | DirectMulti | Optuna:   6%|▋         | 13/200 [11:09<2:51:50, 55.14s/it, best=0.859]Pseudomonas_Aeruginosa | DirectMulti | Optuna:   6%|▋         | 13/200 [11:09<2:51:50, 55.14s/it, best=0.859][I 2026-03-05 00:05:32,768] Trial 180 finished with value: 0.8732580881282999 and parameters: {'activation': 'logistic', 'solver': 'adam', 'lr': 0.0007033398576553447, 'layer1': 234, 'layer2': 297, 'layer3': 81}. Best is trial 124 with value: 0.8938450095328893.
Staphylococcus_Aureus | LPS | Optuna:  90%|█████████ | 181/200 [4:07:14<37:11, 117.44s/it, best=0.894]Staphylococcus_Aureus | LPS | Optuna:  90%|█████████ | 181/200 [4:07:14<37:11, 117.44s/it, best=0.894][I 2026-03-05 00:07:01,962] Trial 181 finished with value: 0.8924533740524578 and parameters: {'activation': 'identity', 'solver': 'adam', 'lr': 0.0008279054027965548, 'layer1': 311, 'layer2': 351, 'layer3': 121}. Best is trial 124 with value: 0.8938450095328893.
Staphylococcus_Aureus | LPS | Optuna:  91%|█████████ | 182/200 [4:08:44<32:41, 108.96s/it, best=0.894]Staphylococcus_Aureus | LPS | Optuna:  91%|█████████ | 182/200 [4:08:44<32:41, 108.96s/it, best=0.894][I 2026-03-05 00:07:09,639] Trial 13 finished with value: 0.860341390656114 and parameters: {'activation': 'relu', 'solver': 'adam', 'lr': 0.00214516912368351, 'layer1': 494, 'layer2': 157, 'layer3': 209}. Best is trial 13 with value: 0.860341390656114.
Pseudomonas_Aeruginosa | DirectMulti | Optuna:   7%|▋         | 14/200 [13:03<3:46:19, 73.01s/it, best=0.859]Pseudomonas_Aeruginosa | DirectMulti | Optuna:   7%|▋         | 14/200 [13:03<3:46:19, 73.01s/it, best=0.86] [I 2026-03-05 00:08:26,236] Trial 182 finished with value: 0.8902366253884744 and parameters: {'activation': 'identity', 'solver': 'adam', 'lr': 0.0005324366353630102, 'layer1': 262, 'layer2': 227, 'layer3': 96}. Best is trial 124 with value: 0.8938450095328893.
Staphylococcus_Aureus | LPS | Optuna:  92%|█████████▏| 183/200 [4:10:08<28:46, 101.56s/it, best=0.894]Staphylococcus_Aureus | LPS | Optuna:  92%|█████████▏| 183/200 [4:10:08<28:46, 101.56s/it, best=0.894][I 2026-03-05 00:08:27,733] Trial 3 finished with value: 0.5993708062956026 and parameters: {'activation': 'relu', 'solver': 'sgd', 'lr': 1.6536937182824424e-05, 'layer1': 57, 'layer2': 345, 'layer3': 226}. Best is trial 2 with value: 0.8752717715153426.
Klebsiella_Pneumoniae | DirectMulti | Optuna:   2%|▏         | 4/200 [06:59<7:09:10, 131.38s/it, best=0.875]Klebsiella_Pneumoniae | DirectMulti | Optuna:   2%|▏         | 4/200 [06:59<7:09:10, 131.38s/it, best=0.875][I 2026-03-05 00:08:37,770] Trial 84 finished with value: 0.8625064956118023 and parameters: {'activation': 'relu', 'solver': 'adam', 'lr': 3.517447272743259e-05, 'layer1': 467, 'layer2': 14, 'layer3': 452}. Best is trial 73 with value: 0.864893646817533.
Escherichia_Coli | LPS | Optuna:  42%|████▎     | 85/200 [4:10:19<8:55:50, 279.57s/it, best=0.865]Escherichia_Coli | LPS | Optuna:  42%|████▎     | 85/200 [4:10:19<8:55:50, 279.57s/it, best=0.865][I 2026-03-05 00:09:23,769] Trial 14 finished with value: 0.8622383676220722 and parameters: {'activation': 'relu', 'solver': 'adam', 'lr': 0.008909399584034763, 'layer1': 499, 'layer2': 129, 'layer3': 212}. Best is trial 14 with value: 0.8622383676220722.
Pseudomonas_Aeruginosa | DirectMulti | Optuna:   8%|▊         | 15/200 [15:17<4:41:54, 91.43s/it, best=0.86]Pseudomonas_Aeruginosa | DirectMulti | Optuna:   8%|▊         | 15/200 [15:17<4:41:54, 91.43s/it, best=0.862][I 2026-03-05 00:09:24,244] Trial 4 finished with value: 0.8746574309039234 and parameters: {'activation': 'relu', 'solver': 'adam', 'lr': 1.7654048052495086e-05, 'layer1': 265, 'layer2': 278, 'layer3': 100}. Best is trial 2 with value: 0.8752717715153426.
Klebsiella_Pneumoniae | DirectMulti | Optuna:   2%|▎         | 5/200 [07:56<5:39:14, 104.38s/it, best=0.875]Klebsiella_Pneumoniae | DirectMulti | Optuna:   2%|▎         | 5/200 [07:56<5:39:14, 104.38s/it, best=0.875][I 2026-03-05 00:09:48,587] Trial 183 finished with value: 0.8926838667932872 and parameters: {'activation': 'identity', 'solver': 'adam', 'lr': 0.0014978249768676842, 'layer1': 279, 'layer2': 21, 'layer3': 110}. Best is trial 124 with value: 0.8938450095328893.
