Escherichia_Coli | DirectMulti | Optuna:  96%|█████████▋| 193/200 [7:19:08<14:21, 123.11s/it, best=0.865]Escherichia_Coli | DirectMulti | Optuna:  96%|█████████▋| 193/200 [7:19:08<14:21, 123.11s/it, best=0.865][I 2026-03-05 14:44:16,485] Trial 193 finished with value: 0.8625474531886315 and parameters: {'activation': 'tanh', 'solver': 'adam', 'lr': 2.1022091685048137e-05, 'layer1': 489, 'layer2': 313, 'layer3': 95}. Best is trial 106 with value: 0.8646284220353448.
Escherichia_Coli | DirectMulti | Optuna:  97%|█████████▋| 194/200 [7:21:36<13:03, 130.52s/it, best=0.865]Escherichia_Coli | DirectMulti | Optuna:  97%|█████████▋| 194/200 [7:21:36<13:03, 130.52s/it, best=0.865][I 2026-03-05 14:46:09,609] Trial 194 finished with value: 0.8635918277981698 and parameters: {'activation': 'tanh', 'solver': 'adam', 'lr': 2.903486009866252e-05, 'layer1': 414, 'layer2': 486, 'layer3': 134}. Best is trial 106 with value: 0.8646284220353448.
Escherichia_Coli | DirectMulti | Optuna:  98%|█████████▊| 195/200 [7:23:29<10:26, 125.30s/it, best=0.865]Escherichia_Coli | DirectMulti | Optuna:  98%|█████████▊| 195/200 [7:23:29<10:26, 125.30s/it, best=0.865][I 2026-03-05 14:47:44,324] Trial 195 finished with value: 0.8626306607592772 and parameters: {'activation': 'identity', 'solver': 'adam', 'lr': 3.655588900999089e-05, 'layer1': 369, 'layer2': 463, 'layer3': 72}. Best is trial 106 with value: 0.8646284220353448.
Escherichia_Coli | DirectMulti | Optuna:  98%|█████████▊| 196/200 [7:25:03<07:44, 116.13s/it, best=0.865]Escherichia_Coli | DirectMulti | Optuna:  98%|█████████▊| 196/200 [7:25:03<07:44, 116.13s/it, best=0.865][I 2026-03-05 14:50:07,520] Trial 196 finished with value: 0.8627245420213405 and parameters: {'activation': 'tanh', 'solver': 'adam', 'lr': 2.4588347832169103e-05, 'layer1': 465, 'layer2': 452, 'layer3': 47}. Best is trial 106 with value: 0.8646284220353448.
Escherichia_Coli | DirectMulti | Optuna:  98%|█████████▊| 197/200 [7:27:27<06:12, 124.25s/it, best=0.865]Escherichia_Coli | DirectMulti | Optuna:  98%|█████████▊| 197/200 [7:27:27<06:12, 124.25s/it, best=0.865][I 2026-03-05 14:52:43,368] Trial 197 finished with value: 0.8626863901869001 and parameters: {'activation': 'tanh', 'solver': 'adam', 'lr': 1.9418958405279746e-05, 'layer1': 481, 'layer2': 491, 'layer3': 83}. Best is trial 106 with value: 0.8646284220353448.
Escherichia_Coli | DirectMulti | Optuna:  99%|█████████▉| 198/200 [7:30:02<04:27, 133.73s/it, best=0.865]Escherichia_Coli | DirectMulti | Optuna:  99%|█████████▉| 198/200 [7:30:02<04:27, 133.73s/it, best=0.865][I 2026-03-05 14:54:37,265] Trial 198 finished with value: 0.861522800558187 and parameters: {'activation': 'tanh', 'solver': 'adam', 'lr': 4.5608488324644475e-05, 'layer1': 489, 'layer2': 473, 'layer3': 63}. Best is trial 106 with value: 0.8646284220353448.
Escherichia_Coli | DirectMulti | Optuna: 100%|█████████▉| 199/200 [7:31:56<02:07, 127.78s/it, best=0.865]Escherichia_Coli | DirectMulti | Optuna: 100%|█████████▉| 199/200 [7:31:56<02:07, 127.78s/it, best=0.865][I 2026-03-05 14:56:35,729] Trial 199 finished with value: 0.8626883854189906 and parameters: {'activation': 'tanh', 'solver': 'adam', 'lr': 3.070520372189056e-05, 'layer1': 384, 'layer2': 483, 'layer3': 54}. Best is trial 106 with value: 0.8646284220353448.
Escherichia_Coli | DirectMulti | Optuna: 100%|██████████| 200/200 [7:33:55<00:00, 124.98s/it, best=0.865]Escherichia_Coli | DirectMulti | Optuna: 100%|██████████| 200/200 [7:33:55<00:00, 124.98s/it, best=0.865]                                                                                                         [Escherichia_Coli | DirectMulti] [OPTUNA DONE] Best CV WF1=0.8646 | params={'activation': 'tanh', 'solver': 'adam', 'lr': 1.7708879893278444e-05, 'layer1': 477, 'layer2': 456, 'layer3': 73}
[Escherichia_Coli | DirectMulti] Retraining with validation early stopping (10% split)...
[Escherichia_Coli | DirectMulti] Testing...
[Escherichia_Coli | DirectMulti] [TEST] WF1=0.8477 | ACC=0.8632 | HL=0.1368 | best_val_WF1=0.8744

[END] Species: Escherichia_Coli done.
[Parallel(n_jobs=5)]: Done   4 out of   4 | elapsed: 1138.9min finished

==================== ALL RESULTS (top by Test_WF1) ====================
               Species              Task Antibiotic   CV_WF1  Retrain_Val_WF1  Test_WF1  Test_ACC  Test_HL hp_activation hp_solver    hp_lr  hp_layer1  hp_layer2  hp_layer3  n_patterns                                                                                                                model_path
 Klebsiella_Pneumoniae    lps_multiclass        ALL 0.933532         0.938844  0.935323  0.941860 0.058140          tanh      adam 0.000077         94        313         99         5.0                 saved_models2/benchmark_mlp_20260304_195812/Klebsiella_Pneumoniae/lps_model/Klebsiella_Pneumoniae__lps.pt
 Klebsiella_Pneumoniae direct_multilabel        ALL 0.932725         0.937379  0.930741  0.939177 0.060823          tanh      adam 0.000095         75         90        318         NaN   saved_models2/benchmark_mlp_20260304_195812/Klebsiella_Pneumoniae/multilabel_model/Klebsiella_Pneumoniae__multilabel.pt
 Staphylococcus_Aureus    lps_multiclass        ALL 0.895291         0.899686  0.891266  0.900749 0.099251      identity      adam 0.000808        289        242        189         8.0                 saved_models2/benchmark_mlp_20260304_195812/Staphylococcus_Aureus/lps_model/Staphylococcus_Aureus__lps.pt
 Staphylococcus_Aureus direct_multilabel        ALL 0.893668         0.901942  0.887789  0.896536 0.103464      identity      adam 0.000028        385        421         58         NaN   saved_models2/benchmark_mlp_20260304_195812/Staphylococcus_Aureus/multilabel_model/Staphylococcus_Aureus__multilabel.pt
      Escherichia_Coli    lps_multiclass        ALL 0.865496         0.876080  0.851790  0.867742 0.132258          relu      adam 0.000024        481         24        500        11.0                           saved_models2/benchmark_mlp_20260304_195812/Escherichia_Coli/lps_model/Escherichia_Coli__lps.pt
Pseudomonas_Aeruginosa direct_multilabel        ALL 0.866919         0.841026  0.850278  0.876106 0.123894          relu      adam 0.002765        463        472        327         NaN saved_models2/benchmark_mlp_20260304_195812/Pseudomonas_Aeruginosa/multilabel_model/Pseudomonas_Aeruginosa__multilabel.pt
      Escherichia_Coli direct_multilabel        ALL 0.864628         0.874392  0.847744  0.863172 0.136828          tanh      adam 0.000018        477        456         73         NaN             saved_models2/benchmark_mlp_20260304_195812/Escherichia_Coli/multilabel_model/Escherichia_Coli__multilabel.pt
Pseudomonas_Aeruginosa    lps_multiclass        ALL 0.868284         0.873320  0.845167  0.862832 0.137168          relu      adam 0.004216        402        208        435         6.0               saved_models2/benchmark_mlp_20260304_195812/Pseudomonas_Aeruginosa/lps_model/Pseudomonas_Aeruginosa__lps.pt

==================== SUMMARY: mean over antibiotics (binary) per species ====================

==================== SUMMARY: LPS vs Multilabel per species ====================
               Species              Task Antibiotic   CV_WF1  Retrain_Val_WF1  Test_WF1  Test_ACC  Test_HL hp_activation hp_solver    hp_lr  hp_layer1  hp_layer2  hp_layer3  n_patterns                                                                                                                model_path
      Escherichia_Coli direct_multilabel        ALL 0.864628         0.874392  0.847744  0.863172 0.136828          tanh      adam 0.000018        477        456         73         NaN             saved_models2/benchmark_mlp_20260304_195812/Escherichia_Coli/multilabel_model/Escherichia_Coli__multilabel.pt
      Escherichia_Coli    lps_multiclass        ALL 0.865496         0.876080  0.851790  0.867742 0.132258          relu      adam 0.000024        481         24        500        11.0                           saved_models2/benchmark_mlp_20260304_195812/Escherichia_Coli/lps_model/Escherichia_Coli__lps.pt
 Klebsiella_Pneumoniae direct_multilabel        ALL 0.932725         0.937379  0.930741  0.939177 0.060823          tanh      adam 0.000095         75         90        318         NaN   saved_models2/benchmark_mlp_20260304_195812/Klebsiella_Pneumoniae/multilabel_model/Klebsiella_Pneumoniae__multilabel.pt
 Klebsiella_Pneumoniae    lps_multiclass        ALL 0.933532         0.938844  0.935323  0.941860 0.058140          tanh      adam 0.000077         94        313         99         5.0                 saved_models2/benchmark_mlp_20260304_195812/Klebsiella_Pneumoniae/lps_model/Klebsiella_Pneumoniae__lps.pt
Pseudomonas_Aeruginosa direct_multilabel        ALL 0.866919         0.841026  0.850278  0.876106 0.123894          relu      adam 0.002765        463        472        327         NaN saved_models2/benchmark_mlp_20260304_195812/Pseudomonas_Aeruginosa/multilabel_model/Pseudomonas_Aeruginosa__multilabel.pt
Pseudomonas_Aeruginosa    lps_multiclass        ALL 0.868284         0.873320  0.845167  0.862832 0.137168          relu      adam 0.004216        402        208        435         6.0               saved_models2/benchmark_mlp_20260304_195812/Pseudomonas_Aeruginosa/lps_model/Pseudomonas_Aeruginosa__lps.pt
 Staphylococcus_Aureus direct_multilabel        ALL 0.893668         0.901942  0.887789  0.896536 0.103464      identity      adam 0.000028        385        421         58         NaN   saved_models2/benchmark_mlp_20260304_195812/Staphylococcus_Aureus/multilabel_model/Staphylococcus_Aureus__multilabel.pt
 Staphylococcus_Aureus    lps_multiclass        ALL 0.895291         0.899686  0.891266  0.900749 0.099251      identity      adam 0.000808        289        242        189         8.0                 saved_models2/benchmark_mlp_20260304_195812/Staphylococcus_Aureus/lps_model/Staphylococcus_Aureus__lps.pt

[INFO] Done. Results saved in: saved_models2/benchmark_mlp_20260304_195812
