Pseudomonas_Aeruginosa | DirectMulti | Optuna:  34%|███▎      | 67/200 [1:35:42<4:16:13, 115.59s/it, best=0.865]Pseudomonas_Aeruginosa | DirectMulti | Optuna:  34%|███▎      | 67/200 [1:35:42<4:16:13, 115.59s/it, best=0.865][I 2026-03-05 01:31:05,050] Trial 67 finished with value: 0.8261898244308833 and parameters: {'activation': 'tanh', 'solver': 'adam', 'lr': 0.009555099742628432, 'layer1': 500, 'layer2': 137, 'layer3': 436}. Best is trial 23 with value: 0.8649994822247168.
Pseudomonas_Aeruginosa | DirectMulti | Optuna:  34%|███▍      | 68/200 [1:36:59<3:48:15, 103.75s/it, best=0.865]Pseudomonas_Aeruginosa | DirectMulti | Optuna:  34%|███▍      | 68/200 [1:36:59<3:48:15, 103.75s/it, best=0.865][I 2026-03-05 01:31:06,267] Trial 66 finished with value: 0.9303154804175673 and parameters: {'activation': 'identity', 'solver': 'adam', 'lr': 1.2418191747365832e-05, 'layer1': 473, 'layer2': 182, 'layer3': 215}. Best is trial 55 with value: 0.9322110061695005.
Klebsiella_Pneumoniae | DirectMulti | Optuna:  34%|███▎      | 67/200 [1:29:38<6:04:15, 164.33s/it, best=0.932]Klebsiella_Pneumoniae | DirectMulti | Optuna:  34%|███▎      | 67/200 [1:29:38<6:04:15, 164.33s/it, best=0.932][I 2026-03-05 01:31:26,884] Trial 31 finished with value: 0.8900808132220437 and parameters: {'activation': 'tanh', 'solver': 'adam', 'lr': 3.225323161723384e-05, 'layer1': 72, 'layer2': 125, 'layer3': 243}. Best is trial 11 with value: 0.8911580213645447.
Staphylococcus_Aureus | DirectMulti | Optuna:  16%|█▌        | 32/200 [56:44<4:29:48, 96.36s/it, best=0.891]Staphylococcus_Aureus | DirectMulti | Optuna:  16%|█▌        | 32/200 [56:44<4:29:48, 96.36s/it, best=0.891][I 2026-03-05 01:31:51,081] Trial 68 finished with value: 0.8263329290001545 and parameters: {'activation': 'relu', 'solver': 'sgd', 'lr': 0.005702700804755585, 'layer1': 459, 'layer2': 70, 'layer3': 495}. Best is trial 23 with value: 0.8649994822247168.
Pseudomonas_Aeruginosa | DirectMulti | Optuna:  34%|███▍      | 69/200 [1:37:45<3:08:42, 86.43s/it, best=0.865] Pseudomonas_Aeruginosa | DirectMulti | Optuna:  34%|███▍      | 69/200 [1:37:45<3:08:42, 86.43s/it, best=0.865][I 2026-03-05 01:32:57,783] Trial 107 finished with value: 0.8628496258914572 and parameters: {'activation': 'tanh', 'solver': 'adam', 'lr': 1.77684169115406e-05, 'layer1': 443, 'layer2': 22, 'layer3': 392}. Best is trial 73 with value: 0.864893646817533.
Escherichia_Coli | LPS | Optuna:  54%|█████▍    | 108/200 [5:34:39<5:51:06, 228.98s/it, best=0.865]Escherichia_Coli | LPS | Optuna:  54%|█████▍    | 108/200 [5:34:39<5:51:06, 228.98s/it, best=0.865][I 2026-03-05 01:33:24,596] Trial 69 finished with value: 0.8596488052100699 and parameters: {'activation': 'relu', 'solver': 'adam', 'lr': 0.0009568658094299461, 'layer1': 470, 'layer2': 163, 'layer3': 467}. Best is trial 23 with value: 0.8649994822247168.
Pseudomonas_Aeruginosa | DirectMulti | Optuna:  35%|███▌      | 70/200 [1:39:18<3:11:52, 88.56s/it, best=0.865]Pseudomonas_Aeruginosa | DirectMulti | Optuna:  35%|███▌      | 70/200 [1:39:18<3:11:52, 88.56s/it, best=0.865][I 2026-03-05 01:33:45,396] Trial 67 finished with value: 0.9313765797978005 and parameters: {'activation': 'tanh', 'solver': 'adam', 'lr': 2.70412587107116e-05, 'layer1': 276, 'layer2': 164, 'layer3': 415}. Best is trial 55 with value: 0.9322110061695005.
Klebsiella_Pneumoniae | DirectMulti | Optuna:  34%|███▍      | 68/200 [1:32:17<5:58:05, 162.77s/it, best=0.932]Klebsiella_Pneumoniae | DirectMulti | Optuna:  34%|███▍      | 68/200 [1:32:17<5:58:05, 162.77s/it, best=0.932][I 2026-03-05 01:34:10,652] Trial 32 finished with value: 0.8903015541907621 and parameters: {'activation': 'tanh', 'solver': 'adam', 'lr': 2.3856950784973895e-05, 'layer1': 152, 'layer2': 143, 'layer3': 226}. Best is trial 11 with value: 0.8911580213645447.
Staphylococcus_Aureus | DirectMulti | Optuna:  16%|█▋        | 33/200 [59:28<5:24:29, 116.58s/it, best=0.891]Staphylococcus_Aureus | DirectMulti | Optuna:  16%|█▋        | 33/200 [59:28<5:24:29, 116.58s/it, best=0.891][I 2026-03-05 01:34:44,450] Trial 68 finished with value: 0.8750950929289804 and parameters: {'activation': 'tanh', 'solver': 'adam', 'lr': 6.138399039110705e-06, 'layer1': 309, 'layer2': 170, 'layer3': 413}. Best is trial 55 with value: 0.9322110061695005.
Klebsiella_Pneumoniae | DirectMulti | Optuna:  34%|███▍      | 69/200 [1:33:16<4:47:26, 131.65s/it, best=0.932]Klebsiella_Pneumoniae | DirectMulti | Optuna:  34%|███▍      | 69/200 [1:33:16<4:47:26, 131.65s/it, best=0.932][I 2026-03-05 01:35:12,264] Trial 33 finished with value: 0.8035161161273237 and parameters: {'activation': 'tanh', 'solver': 'adam', 'lr': 1.073220280880823e-06, 'layer1': 190, 'layer2': 249, 'layer3': 158}. Best is trial 11 with value: 0.8911580213645447.
Staphylococcus_Aureus | DirectMulti | Optuna:  17%|█▋        | 34/200 [1:00:29<4:36:55, 100.09s/it, best=0.891]Staphylococcus_Aureus | DirectMulti | Optuna:  17%|█▋        | 34/200 [1:00:29<4:36:55, 100.09s/it, best=0.891][I 2026-03-05 01:35:21,848] Trial 70 finished with value: 0.8563347016875713 and parameters: {'activation': 'logistic', 'solver': 'adam', 'lr': 0.0034641919841932366, 'layer1': 448, 'layer2': 124, 'layer3': 479}. Best is trial 23 with value: 0.8649994822247168.
Pseudomonas_Aeruginosa | DirectMulti | Optuna:  36%|███▌      | 71/200 [1:41:15<3:28:54, 97.17s/it, best=0.865]Pseudomonas_Aeruginosa | DirectMulti | Optuna:  36%|███▌      | 71/200 [1:41:15<3:28:54, 97.17s/it, best=0.865][I 2026-03-05 01:36:18,481] Trial 34 finished with value: 0.8894440536446065 and parameters: {'activation': 'tanh', 'solver': 'adam', 'lr': 0.00013312621392335043, 'layer1': 46, 'layer2': 75, 'layer3': 208}. Best is trial 11 with value: 0.8911580213645447.
Staphylococcus_Aureus | DirectMulti | Optuna:  18%|█▊        | 35/200 [1:01:36<4:07:18, 89.93s/it, best=0.891] Staphylococcus_Aureus | DirectMulti | Optuna:  18%|█▊        | 35/200 [1:01:36<4:07:18, 89.93s/it, best=0.891][I 2026-03-05 01:37:07,031] Trial 35 finished with value: 0.8016455484651599 and parameters: {'activation': 'logistic', 'solver': 'adam', 'lr': 1.1480313030787723e-05, 'layer1': 106, 'layer2': 162, 'layer3': 265}. Best is trial 11 with value: 0.8911580213645447.
Staphylococcus_Aureus | DirectMulti | Optuna:  18%|█▊        | 36/200 [1:02:24<3:31:52, 77.52s/it, best=0.891]Staphylococcus_Aureus | DirectMulti | Optuna:  18%|█▊        | 36/200 [1:02:24<3:31:52, 77.52s/it, best=0.891][I 2026-03-05 01:37:16,808] Trial 108 finished with value: 0.8615841747747581 and parameters: {'activation': 'tanh', 'solver': 'adam', 'lr': 2.613247558744705e-05, 'layer1': 459, 'layer2': 39, 'layer3': 406}. Best is trial 73 with value: 0.864893646817533.
Escherichia_Coli | LPS | Optuna:  55%|█████▍    | 109/200 [5:38:58<6:00:57, 238.00s/it, best=0.865]Escherichia_Coli | LPS | Optuna:  55%|█████▍    | 109/200 [5:38:58<6:00:57, 238.00s/it, best=0.865][I 2026-03-05 01:37:36,927] Trial 69 finished with value: 0.9304659377081853 and parameters: {'activation': 'tanh', 'solver': 'adam', 'lr': 2.4797452127076395e-05, 'layer1': 379, 'layer2': 129, 'layer3': 445}. Best is trial 55 with value: 0.9322110061695005.
Klebsiella_Pneumoniae | DirectMulti | Optuna:  35%|███▌      | 70/200 [1:36:09<5:11:47, 143.90s/it, best=0.932]Klebsiella_Pneumoniae | DirectMulti | Optuna:  35%|███▌      | 70/200 [1:36:09<5:11:47, 143.90s/it, best=0.932][I 2026-03-05 01:37:39,002] Trial 71 finished with value: 0.8659155749694897 and parameters: {'activation': 'relu', 'solver': 'adam', 'lr': 0.004747660690835633, 'layer1': 484, 'layer2': 304, 'layer3': 500}. Best is trial 71 with value: 0.8659155749694897.
Pseudomonas_Aeruginosa | DirectMulti | Optuna:  36%|███▌      | 72/200 [1:43:33<3:52:52, 109.16s/it, best=0.865]Pseudomonas_Aeruginosa | DirectMulti | Optuna:  36%|███▌      | 72/200 [1:43:33<3:52:52, 109.16s/it, best=0.866][I 2026-03-05 01:37:46,859] Trial 36 finished with value: 0.8021350901840945 and parameters: {'activation': 'identity', 'solver': 'adam', 'lr': 4.563571019163555e-06, 'layer1': 68, 'layer2': 267, 'layer3': 132}. Best is trial 11 with value: 0.8911580213645447.
Staphylococcus_Aureus | DirectMulti | Optuna:  18%|█▊        | 37/200 [1:03:04<2:59:52, 66.21s/it, best=0.891]Staphylococcus_Aureus | DirectMulti | Optuna:  18%|█▊        | 37/200 [1:03:04<2:59:52, 66.21s/it, best=0.891][I 2026-03-05 01:39:38,738] Trial 72 finished with value: 0.8582669744408312 and parameters: {'activation': 'relu', 'solver': 'adam', 'lr': 0.0024345600105154337, 'layer1': 488, 'layer2': 248, 'layer3': 450}. Best is trial 71 with value: 0.8659155749694897.
Pseudomonas_Aeruginosa | DirectMulti | Optuna:  36%|███▋      | 73/200 [1:45:32<3:57:46, 112.33s/it, best=0.866]Pseudomonas_Aeruginosa | DirectMulti | Optuna:  36%|███▋      | 73/200 [1:45:32<3:57:46, 112.33s/it, best=0.866][I 2026-03-05 01:40:30,053] Trial 109 finished with value: 0.8612452855847508 and parameters: {'activation': 'tanh', 'solver': 'adam', 'lr': 5.2880650622840124e-05, 'layer1': 482, 'layer2': 32, 'layer3': 419}. Best is trial 73 with value: 0.864893646817533.
Escherichia_Coli | LPS | Optuna:  55%|█████▌    | 110/200 [5:42:12<5:36:51, 224.57s/it, best=0.865]Escherichia_Coli | LPS | Optuna:  55%|█████▌    | 110/200 [5:42:12<5:36:51, 224.57s/it, best=0.865][I 2026-03-05 01:41:02,092] Trial 70 finished with value: 0.8751564309355432 and parameters: {'activation': 'tanh', 'solver': 'sgd', 'lr': 2.0707070361824816e-05, 'layer1': 274, 'layer2': 151, 'layer3': 423}. Best is trial 55 with value: 0.9322110061695005.
Klebsiella_Pneumoniae | DirectMulti | Optuna:  36%|███▌      | 71/200 [1:39:34<5:48:54, 162.28s/it, best=0.932]Klebsiella_Pneumoniae | DirectMulti | Optuna:  36%|███▌      | 71/200 [1:39:34<5:48:54, 162.28s/it, best=0.932][I 2026-03-05 01:42:05,374] Trial 73 finished with value: 0.8630083406290667 and parameters: {'activation': 'relu', 'solver': 'adam', 'lr': 0.004329750434030769, 'layer1': 471, 'layer2': 297, 'layer3': 499}. Best is trial 71 with value: 0.8659155749694897.
Pseudomonas_Aeruginosa | DirectMulti | Optuna:  37%|███▋      | 74/200 [1:47:59<4:17:30, 122.63s/it, best=0.866]Pseudomonas_Aeruginosa | DirectMulti | Optuna:  37%|███▋      | 74/200 [1:47:59<4:17:30, 122.63s/it, best=0.866][I 2026-03-05 01:42:14,188] Trial 37 finished with value: 0.8901577040754706 and parameters: {'activation': 'tanh', 'solver': 'adam', 'lr': 1.4771393942563639e-05, 'layer1': 258, 'layer2': 294, 'layer3': 86}. Best is trial 11 with value: 0.8911580213645447.
Staphylococcus_Aureus | DirectMulti | Optuna:  19%|█▉        | 38/200 [1:07:31<5:41:40, 126.54s/it, best=0.891]Staphylococcus_Aureus | DirectMulti | Optuna:  19%|█▉        | 38/200 [1:07:31<5:41:40, 126.54s/it, best=0.891][I 2026-03-05 01:42:29,619] Trial 110 finished with value: 0.7389640312774719 and parameters: {'activation': 'logistic', 'solver': 'adam', 'lr': 8.2292974256187e-06, 'layer1': 432, 'layer2': 64, 'layer3': 435}. Best is trial 73 with value: 0.864893646817533.
Escherichia_Coli | LPS | Optuna:  56%|█████▌    | 111/200 [5:44:11<4:46:23, 193.07s/it, best=0.865]Escherichia_Coli | LPS | Optuna:  56%|█████▌    | 111/200 [5:44:11<4:46:23, 193.07s/it, best=0.865][I 2026-03-05 01:43:25,890] Trial 71 finished with value: 0.9309378156213655 and parameters: {'activation': 'tanh', 'solver': 'adam', 'lr': 3.074841435597445e-05, 'layer1': 340, 'layer2': 236, 'layer3': 387}. Best is trial 55 with value: 0.9322110061695005.
Klebsiella_Pneumoniae | DirectMulti | Optuna:  36%|███▌      | 72/200 [1:41:58<5:34:22, 156.74s/it, best=0.932]Klebsiella_Pneumoniae | DirectMulti | Optuna:  36%|███▌      | 72/200 [1:41:58<5:34:22, 156.74s/it, best=0.932][I 2026-03-05 01:43:38,614] Trial 38 finished with value: 0.4796376019481673 and parameters: {'activation': 'relu', 'solver': 'sgd', 'lr': 7.312720996521728e-05, 'layer1': 290, 'layer2': 214, 'layer3': 35}. Best is trial 11 with value: 0.8911580213645447.
Staphylococcus_Aureus | DirectMulti | Optuna:  20%|█▉        | 39/200 [1:08:56<5:05:39, 113.91s/it, best=0.891]Staphylococcus_Aureus | DirectMulti | Optuna:  20%|█▉        | 39/200 [1:08:56<5:05:39, 113.91s/it, best=0.891][I 2026-03-05 01:43:53,150] Trial 74 finished with value: 0.8584628752357881 and parameters: {'activation': 'relu', 'solver': 'adam', 'lr': 0.007012931612187954, 'layer1': 429, 'layer2': 371, 'layer3': 424}. Best is trial 71 with value: 0.8659155749694897.
Pseudomonas_Aeruginosa | DirectMulti | Optuna:  38%|███▊      | 75/200 [1:49:47<4:06:11, 118.17s/it, best=0.866]Pseudomonas_Aeruginosa | DirectMulti | Optuna:  38%|███▊      | 75/200 [1:49:47<4:06:11, 118.17s/it, best=0.866][I 2026-03-05 01:45:14,104] Trial 72 finished with value: 0.9309994272683693 and parameters: {'activation': 'tanh', 'solver': 'adam', 'lr': 5.612092788330847e-05, 'layer1': 241, 'layer2': 214, 'layer3': 361}. Best is trial 55 with value: 0.9322110061695005.
Klebsiella_Pneumoniae | DirectMulti | Optuna:  36%|███▋      | 73/200 [1:43:46<5:00:56, 142.18s/it, best=0.932]Klebsiella_Pneumoniae | DirectMulti | Optuna:  36%|███▋      | 73/200 [1:43:46<5:00:56, 142.18s/it, best=0.932][I 2026-03-05 01:45:32,321] Trial 111 finished with value: 0.8616067990378834 and parameters: {'activation': 'tanh', 'solver': 'adam', 'lr': 4.279540257434843e-05, 'layer1': 414, 'layer2': 51, 'layer3': 455}. Best is trial 73 with value: 0.864893646817533.
Escherichia_Coli | LPS | Optuna:  56%|█████▌    | 112/200 [5:47:14<4:38:36, 189.96s/it, best=0.865]Escherichia_Coli | LPS | Optuna:  56%|█████▌    | 112/200 [5:47:14<4:38:36, 189.96s/it, best=0.865][I 2026-03-05 01:45:40,068] Trial 75 finished with value: 0.8597171294477393 and parameters: {'activation': 'relu', 'solver': 'adam', 'lr': 0.004542763327322501, 'layer1': 473, 'layer2': 348, 'layer3': 480}. Best is trial 71 with value: 0.8659155749694897.
Pseudomonas_Aeruginosa | DirectMulti | Optuna:  38%|███▊      | 76/200 [1:51:34<3:57:14, 114.79s/it, best=0.866]Pseudomonas_Aeruginosa | DirectMulti | Optuna:  38%|███▊      | 76/200 [1:51:34<3:57:14, 114.79s/it, best=0.866][I 2026-03-05 01:46:32,336] Trial 73 finished with value: 0.9294158711822016 and parameters: {'activation': 'tanh', 'solver': 'adam', 'lr': 0.00013670746229247155, 'layer1': 283, 'layer2': 191, 'layer3': 436}. Best is trial 55 with value: 0.9322110061695005.
Klebsiella_Pneumoniae | DirectMulti | Optuna:  37%|███▋      | 74/200 [1:45:04<4:18:17, 122.99s/it, best=0.932]Klebsiella_Pneumoniae | DirectMulti | Optuna:  37%|███▋      | 74/200 [1:45:04<4:18:17, 122.99s/it, best=0.932][I 2026-03-05 01:47:29,098] Trial 76 finished with value: 0.8627489200400555 and parameters: {'activation': 'relu', 'solver': 'adam', 'lr': 0.005480639445651363, 'layer1': 446, 'layer2': 302, 'layer3': 398}. Best is trial 71 with value: 0.8659155749694897.
Pseudomonas_Aeruginosa | DirectMulti | Optuna:  38%|███▊      | 77/200 [1:53:23<3:51:47, 113.07s/it, best=0.866]Pseudomonas_Aeruginosa | DirectMulti | Optuna:  38%|███▊      | 77/200 [1:53:23<3:51:47, 113.07s/it, best=0.866][I 2026-03-05 01:47:34,059] Trial 74 finished with value: 0.9311494062125003 and parameters: {'activation': 'tanh', 'solver': 'adam', 'lr': 9.776903302166237e-05, 'layer1': 121, 'layer2': 168, 'layer3': 409}. Best is trial 55 with value: 0.9322110061695005.
Klebsiella_Pneumoniae | DirectMulti | Optuna:  38%|███▊      | 75/200 [1:46:06<3:37:56, 104.61s/it, best=0.932]Klebsiella_Pneumoniae | DirectMulti | Optuna:  38%|███▊      | 75/200 [1:46:06<3:37:56, 104.61s/it, best=0.932][I 2026-03-05 01:48:06,891] Trial 39 finished with value: 0.8916726567218316 and parameters: {'activation': 'relu', 'solver': 'adam', 'lr': 2.8972041383060796e-05, 'layer1': 244, 'layer2': 182, 'layer3': 178}. Best is trial 39 with value: 0.8916726567218316.
Staphylococcus_Aureus | DirectMulti | Optuna:  20%|██        | 40/200 [1:13:24<7:07:15, 160.22s/it, best=0.891]Staphylococcus_Aureus | DirectMulti | Optuna:  20%|██        | 40/200 [1:13:24<7:07:15, 160.22s/it, best=0.892][I 2026-03-05 01:48:19,981] Trial 75 finished with value: 0.8746470562584285 and parameters: {'activation': 'tanh', 'solver': 'adam', 'lr': 1.8047165802902605e-05, 'layer1': 197, 'layer2': 61, 'layer3': 451}. Best is trial 55 with value: 0.9322110061695005.
Klebsiella_Pneumoniae | DirectMulti | Optuna:  38%|███▊      | 76/200 [1:46:52<2:59:48, 87.01s/it, best=0.932] Klebsiella_Pneumoniae | DirectMulti | Optuna:  38%|███▊      | 76/200 [1:46:52<2:59:48, 87.01s/it, best=0.932][I 2026-03-05 01:48:26,471] Trial 112 finished with value: 0.862631569831224 and parameters: {'activation': 'identity', 'solver': 'adam', 'lr': 3.365703931904051e-05, 'layer1': 378, 'layer2': 22, 'layer3': 490}. Best is trial 73 with value: 0.864893646817533.
Escherichia_Coli | LPS | Optuna:  56%|█████▋    | 113/200 [5:50:08<4:28:33, 185.22s/it, best=0.865]Escherichia_Coli | LPS | Optuna:  56%|█████▋    | 113/200 [5:50:08<4:28:33, 185.22s/it, best=0.865][I 2026-03-05 01:48:35,609] Trial 77 finished with value: 0.8564931710461282 and parameters: {'activation': 'identity', 'solver': 'adam', 'lr': 0.0014672050351875155, 'layer1': 397, 'layer2': 341, 'layer3': 404}. Best is trial 71 with value: 0.8659155749694897.
Pseudomonas_Aeruginosa | DirectMulti | Optuna:  39%|███▉      | 78/200 [1:54:29<3:21:30, 99.10s/it, best=0.866] Pseudomonas_Aeruginosa | DirectMulti | Optuna:  39%|███▉      | 78/200 [1:54:29<3:21:30, 99.10s/it, best=0.866][I 2026-03-05 01:48:58,215] Trial 76 finished with value: 0.8746470562584285 and parameters: {'activation': 'relu', 'solver': 'adam', 'lr': 2.6989842937574212e-05, 'layer1': 99, 'layer2': 19, 'layer3': 486}. Best is trial 55 with value: 0.9322110061695005.
Klebsiella_Pneumoniae | DirectMulti | Optuna:  38%|███▊      | 77/200 [1:47:30<2:28:22, 72.37s/it, best=0.932]Klebsiella_Pneumoniae | DirectMulti | Optuna:  38%|███▊      | 77/200 [1:47:30<2:28:22, 72.37s/it, best=0.932][I 2026-03-05 01:49:59,527] Trial 40 finished with value: 0.8895851467630477 and parameters: {'activation': 'relu', 'solver': 'adam', 'lr': 0.00024828046886781087, 'layer1': 253, 'layer2': 348, 'layer3': 162}. Best is trial 39 with value: 0.8916726567218316.
Staphylococcus_Aureus | DirectMulti | Optuna:  20%|██        | 41/200 [1:15:17<6:26:45, 145.94s/it, best=0.892]Staphylococcus_Aureus | DirectMulti | Optuna:  20%|██        | 41/200 [1:15:17<6:26:45, 145.94s/it, best=0.892][I 2026-03-05 01:50:25,338] Trial 78 finished with value: 0.8615837054078879 and parameters: {'activation': 'relu', 'solver': 'adam', 'lr': 0.005652598612032085, 'layer1': 438, 'layer2': 297, 'layer3': 385}. Best is trial 71 with value: 0.8659155749694897.
Pseudomonas_Aeruginosa | DirectMulti | Optuna:  40%|███▉      | 79/200 [1:56:19<3:26:16, 102.29s/it, best=0.866]Pseudomonas_Aeruginosa | DirectMulti | Optuna:  40%|███▉      | 79/200 [1:56:19<3:26:16, 102.29s/it, best=0.866][I 2026-03-05 01:50:37,002] Trial 77 finished with value: 0.9296095579855607 and parameters: {'activation': 'tanh', 'solver': 'adam', 'lr': 0.00018874689779420264, 'layer1': 383, 'layer2': 133, 'layer3': 420}. Best is trial 55 with value: 0.9322110061695005.
Klebsiella_Pneumoniae | DirectMulti | Optuna:  39%|███▉      | 78/200 [1:49:09<2:43:16, 80.30s/it, best=0.932]Klebsiella_Pneumoniae | DirectMulti | Optuna:  39%|███▉      | 78/200 [1:49:09<2:43:16, 80.30s/it, best=0.932][I 2026-03-05 01:51:15,010] Trial 113 finished with value: 0.8614215597382717 and parameters: {'activation': 'tanh', 'solver': 'adam', 'lr': 3.414843653619112e-05, 'layer1': 370, 'layer2': 98, 'layer3': 447}. Best is trial 73 with value: 0.864893646817533.
Escherichia_Coli | LPS | Optuna:  57%|█████▋    | 114/200 [5:52:57<4:18:18, 180.21s/it, best=0.865]Escherichia_Coli | LPS | Optuna:  57%|█████▋    | 114/200 [5:52:57<4:18:18, 180.21s/it, best=0.865][I 2026-03-05 01:51:47,598] Trial 79 finished with value: 0.8614932856706792 and parameters: {'activation': 'relu', 'solver': 'adam', 'lr': 0.008126370365637762, 'layer1': 368, 'layer2': 309, 'layer3': 303}. Best is trial 71 with value: 0.8659155749694897.
Pseudomonas_Aeruginosa | DirectMulti | Optuna:  40%|████      | 80/200 [1:57:41<3:12:33, 96.28s/it, best=0.866] Pseudomonas_Aeruginosa | DirectMulti | Optuna:  40%|████      | 80/200 [1:57:41<3:12:33, 96.28s/it, best=0.866][I 2026-03-05 01:51:50,119] Trial 78 finished with value: 0.8746470562584285 and parameters: {'activation': 'tanh', 'solver': 'adam', 'lr': 1.2118067427458068e-05, 'layer1': 438, 'layer2': 113, 'layer3': 396}. Best is trial 55 with value: 0.9322110061695005.
Klebsiella_Pneumoniae | DirectMulti | Optuna:  40%|███▉      | 79/200 [1:50:22<2:37:35, 78.14s/it, best=0.932]Klebsiella_Pneumoniae | DirectMulti | Optuna:  40%|███▉      | 79/200 [1:50:22<2:37:35, 78.14s/it, best=0.932][I 2026-03-05 01:52:29,515] Trial 79 finished with value: 0.8746470562584285 and parameters: {'activation': 'tanh', 'solver': 'adam', 'lr': 8.971064205106e-06, 'layer1': 159, 'layer2': 76, 'layer3': 170}. Best is trial 55 with value: 0.9322110061695005.
Klebsiella_Pneumoniae | DirectMulti | Optuna:  40%|████      | 80/200 [1:51:01<2:13:02, 66.52s/it, best=0.932]Klebsiella_Pneumoniae | DirectMulti | Optuna:  40%|████      | 80/200 [1:51:01<2:13:02, 66.52s/it, best=0.932][I 2026-03-05 01:52:32,911] Trial 80 finished with value: 0.8261898244308833 and parameters: {'activation': 'relu', 'solver': 'sgd', 'lr': 0.002446324964175193, 'layer1': 421, 'layer2': 275, 'layer3': 355}. Best is trial 71 with value: 0.8659155749694897.
