Escherichia_Coli | DirectMulti | Optuna:  17%|█▋        | 34/200 [1:25:21<11:56:23, 258.94s/it, best=0.864]Escherichia_Coli | DirectMulti | Optuna:  17%|█▋        | 34/200 [1:25:21<11:56:23, 258.94s/it, best=0.864][I 2026-03-05 08:49:59,252] Trial 176 finished with value: 0.891069770702083 and parameters: {'activation': 'identity', 'solver': 'adam', 'lr': 2.8660860470374593e-05, 'layer1': 342, 'layer2': 401, 'layer3': 51}. Best is trial 153 with value: 0.8936680613721473.
Staphylococcus_Aureus | DirectMulti | Optuna:  88%|████████▊ | 177/200 [8:15:16<1:08:22, 178.35s/it, best=0.894]Staphylococcus_Aureus | DirectMulti | Optuna:  88%|████████▊ | 177/200 [8:15:16<1:08:22, 178.35s/it, best=0.894][I 2026-03-05 08:50:58,449] Trial 34 finished with value: 0.8629868359152008 and parameters: {'activation': 'tanh', 'solver': 'adam', 'lr': 1.1212736642558073e-05, 'layer1': 417, 'layer2': 172, 'layer3': 475}. Best is trial 14 with value: 0.8635368497386182.
Escherichia_Coli | DirectMulti | Optuna:  18%|█▊        | 35/200 [1:28:17<10:44:01, 234.19s/it, best=0.864]Escherichia_Coli | DirectMulti | Optuna:  18%|█▊        | 35/200 [1:28:17<10:44:01, 234.19s/it, best=0.864][I 2026-03-05 08:52:21,003] Trial 35 finished with value: 0.7421580944042523 and parameters: {'activation': 'tanh', 'solver': 'adam', 'lr': 1.5520084070564937e-06, 'layer1': 439, 'layer2': 67, 'layer3': 397}. Best is trial 14 with value: 0.8635368497386182.
Escherichia_Coli | DirectMulti | Optuna:  18%|█▊        | 36/200 [1:29:40<8:35:46, 188.70s/it, best=0.864] Escherichia_Coli | DirectMulti | Optuna:  18%|█▊        | 36/200 [1:29:40<8:35:46, 188.70s/it, best=0.864][I 2026-03-05 08:53:23,081] Trial 36 finished with value: 0.7402360731352509 and parameters: {'activation': 'tanh', 'solver': 'adam', 'lr': 3.5381154925562808e-06, 'layer1': 304, 'layer2': 11, 'layer3': 469}. Best is trial 14 with value: 0.8635368497386182.
Escherichia_Coli | DirectMulti | Optuna:  18%|█▊        | 37/200 [1:30:42<6:49:26, 150.71s/it, best=0.864]Escherichia_Coli | DirectMulti | Optuna:  18%|█▊        | 37/200 [1:30:42<6:49:26, 150.71s/it, best=0.864][I 2026-03-05 08:53:39,269] Trial 177 finished with value: 0.8917736395582484 and parameters: {'activation': 'identity', 'solver': 'adam', 'lr': 1.0458916396846628e-05, 'layer1': 328, 'layer2': 425, 'layer3': 97}. Best is trial 153 with value: 0.8936680613721473.
Staphylococcus_Aureus | DirectMulti | Optuna:  89%|████████▉ | 178/200 [8:18:56<1:09:58, 190.85s/it, best=0.894]Staphylococcus_Aureus | DirectMulti | Optuna:  89%|████████▉ | 178/200 [8:18:56<1:09:58, 190.85s/it, best=0.894][I 2026-03-05 08:55:52,974] Trial 37 finished with value: 0.8621438488848481 and parameters: {'activation': 'tanh', 'solver': 'adam', 'lr': 1.2824627190324666e-05, 'layer1': 364, 'layer2': 212, 'layer3': 375}. Best is trial 14 with value: 0.8635368497386182.
Escherichia_Coli | DirectMulti | Optuna:  19%|█▉        | 38/200 [1:33:12<6:46:15, 150.47s/it, best=0.864]Escherichia_Coli | DirectMulti | Optuna:  19%|█▉        | 38/200 [1:33:12<6:46:15, 150.47s/it, best=0.864][I 2026-03-05 08:56:17,004] Trial 178 finished with value: 0.8908849728054978 and parameters: {'activation': 'tanh', 'solver': 'adam', 'lr': 2.3971144984132875e-05, 'layer1': 374, 'layer2': 410, 'layer3': 70}. Best is trial 153 with value: 0.8936680613721473.
Staphylococcus_Aureus | DirectMulti | Optuna:  90%|████████▉ | 179/200 [8:21:34<1:03:19, 180.91s/it, best=0.894]Staphylococcus_Aureus | DirectMulti | Optuna:  90%|████████▉ | 179/200 [8:21:34<1:03:19, 180.91s/it, best=0.894][I 2026-03-05 08:57:59,287] Trial 38 finished with value: 0.7441859013778853 and parameters: {'activation': 'tanh', 'solver': 'sgd', 'lr': 6.339007487315989e-05, 'layer1': 399, 'layer2': 328, 'layer3': 428}. Best is trial 14 with value: 0.8635368497386182.
Escherichia_Coli | DirectMulti | Optuna:  20%|█▉        | 39/200 [1:35:18<6:24:18, 143.22s/it, best=0.864]Escherichia_Coli | DirectMulti | Optuna:  20%|█▉        | 39/200 [1:35:18<6:24:18, 143.22s/it, best=0.864][I 2026-03-05 08:59:05,053] Trial 179 finished with value: 0.8926162541230823 and parameters: {'activation': 'identity', 'solver': 'adam', 'lr': 1.8420297941117016e-05, 'layer1': 362, 'layer2': 440, 'layer3': 58}. Best is trial 153 with value: 0.8936680613721473.
Staphylococcus_Aureus | DirectMulti | Optuna:  90%|█████████ | 180/200 [8:24:22<59:01, 177.05s/it, best=0.894]  Staphylococcus_Aureus | DirectMulti | Optuna:  90%|█████████ | 180/200 [8:24:22<59:01, 177.05s/it, best=0.894][I 2026-03-05 08:59:41,062] Trial 39 finished with value: 0.73917537650967 and parameters: {'activation': 'logistic', 'solver': 'adam', 'lr': 2.1055720510913844e-06, 'layer1': 466, 'layer2': 175, 'layer3': 500}. Best is trial 14 with value: 0.8635368497386182.
Escherichia_Coli | DirectMulti | Optuna:  20%|██        | 40/200 [1:37:00<5:48:45, 130.79s/it, best=0.864]Escherichia_Coli | DirectMulti | Optuna:  20%|██        | 40/200 [1:37:00<5:48:45, 130.79s/it, best=0.864][I 2026-03-05 09:01:10,275] Trial 180 finished with value: 0.892396252966738 and parameters: {'activation': 'identity', 'solver': 'adam', 'lr': 3.1723647581989695e-05, 'layer1': 347, 'layer2': 433, 'layer3': 108}. Best is trial 153 with value: 0.8936680613721473.
Staphylococcus_Aureus | DirectMulti | Optuna:  90%|█████████ | 181/200 [8:26:27<51:08, 161.50s/it, best=0.894]Staphylococcus_Aureus | DirectMulti | Optuna:  90%|█████████ | 181/200 [8:26:27<51:08, 161.50s/it, best=0.894][I 2026-03-05 09:01:52,249] Trial 40 finished with value: 0.8628909242792362 and parameters: {'activation': 'tanh', 'solver': 'adam', 'lr': 2.3710446619639802e-05, 'layer1': 430, 'layer2': 290, 'layer3': 193}. Best is trial 14 with value: 0.8635368497386182.
Escherichia_Coli | DirectMulti | Optuna:  20%|██        | 41/200 [1:39:11<5:46:54, 130.91s/it, best=0.864]Escherichia_Coli | DirectMulti | Optuna:  20%|██        | 41/200 [1:39:11<5:46:54, 130.91s/it, best=0.864][I 2026-03-05 09:04:03,613] Trial 181 finished with value: 0.8922358192507216 and parameters: {'activation': 'identity', 'solver': 'adam', 'lr': 1.7822219645623067e-05, 'layer1': 361, 'layer2': 444, 'layer3': 59}. Best is trial 153 with value: 0.8936680613721473.
Staphylococcus_Aureus | DirectMulti | Optuna:  91%|█████████ | 182/200 [8:29:21<49:30, 165.05s/it, best=0.894]Staphylococcus_Aureus | DirectMulti | Optuna:  91%|█████████ | 182/200 [8:29:21<49:30, 165.05s/it, best=0.894][I 2026-03-05 09:07:06,938] Trial 41 finished with value: 0.862728538189083 and parameters: {'activation': 'tanh', 'solver': 'adam', 'lr': 5.060836666499534e-06, 'layer1': 429, 'layer2': 297, 'layer3': 183}. Best is trial 14 with value: 0.8635368497386182.
Escherichia_Coli | DirectMulti | Optuna:  21%|██        | 42/200 [1:44:26<8:09:54, 186.04s/it, best=0.864]Escherichia_Coli | DirectMulti | Optuna:  21%|██        | 42/200 [1:44:26<8:09:54, 186.04s/it, best=0.864][I 2026-03-05 09:07:09,123] Trial 182 finished with value: 0.8917434592780735 and parameters: {'activation': 'identity', 'solver': 'adam', 'lr': 2.0664158311631058e-05, 'layer1': 384, 'layer2': 466, 'layer3': 80}. Best is trial 153 with value: 0.8936680613721473.
Staphylococcus_Aureus | DirectMulti | Optuna:  92%|█████████▏| 183/200 [8:32:26<48:30, 171.19s/it, best=0.894]Staphylococcus_Aureus | DirectMulti | Optuna:  92%|█████████▏| 183/200 [8:32:26<48:30, 171.19s/it, best=0.894][I 2026-03-05 09:08:45,425] Trial 42 finished with value: 0.8622575084639953 and parameters: {'activation': 'tanh', 'solver': 'adam', 'lr': 1.9548824651194817e-05, 'layer1': 236, 'layer2': 244, 'layer3': 477}. Best is trial 14 with value: 0.8635368497386182.
Escherichia_Coli | DirectMulti | Optuna:  22%|██▏       | 43/200 [1:46:04<6:58:04, 159.78s/it, best=0.864]Escherichia_Coli | DirectMulti | Optuna:  22%|██▏       | 43/200 [1:46:04<6:58:04, 159.78s/it, best=0.864][I 2026-03-05 09:10:56,375] Trial 43 finished with value: 0.8629671188419176 and parameters: {'activation': 'tanh', 'solver': 'adam', 'lr': 2.4594430630874654e-05, 'layer1': 469, 'layer2': 283, 'layer3': 218}. Best is trial 14 with value: 0.8635368497386182.
Escherichia_Coli | DirectMulti | Optuna:  22%|██▏       | 44/200 [1:48:15<6:32:55, 151.13s/it, best=0.864]Escherichia_Coli | DirectMulti | Optuna:  22%|██▏       | 44/200 [1:48:15<6:32:55, 151.13s/it, best=0.864][I 2026-03-05 09:11:05,607] Trial 183 finished with value: 0.8918490522488091 and parameters: {'activation': 'identity', 'solver': 'adam', 'lr': 1.2591330984920524e-05, 'layer1': 358, 'layer2': 418, 'layer3': 50}. Best is trial 153 with value: 0.8936680613721473.
Staphylococcus_Aureus | DirectMulti | Optuna:  92%|█████████▏| 184/200 [8:36:23<50:52, 190.78s/it, best=0.894]Staphylococcus_Aureus | DirectMulti | Optuna:  92%|█████████▏| 184/200 [8:36:23<50:52, 190.78s/it, best=0.894][I 2026-03-05 09:14:05,621] Trial 44 finished with value: 0.8620119624557455 and parameters: {'activation': 'identity', 'solver': 'adam', 'lr': 1.1567607292738493e-05, 'layer1': 475, 'layer2': 172, 'layer3': 271}. Best is trial 14 with value: 0.8635368497386182.
Escherichia_Coli | DirectMulti | Optuna:  22%|██▎       | 45/200 [1:51:25<6:59:57, 162.56s/it, best=0.864]Escherichia_Coli | DirectMulti | Optuna:  22%|██▎       | 45/200 [1:51:25<6:59:57, 162.56s/it, best=0.864][I 2026-03-05 09:15:54,082] Trial 45 finished with value: 0.7388067228206201 and parameters: {'activation': 'tanh', 'solver': 'adam', 'lr': 0.007873661232318058, 'layer1': 499, 'layer2': 220, 'layer3': 362}. Best is trial 14 with value: 0.8635368497386182.
Escherichia_Coli | DirectMulti | Optuna:  23%|██▎       | 46/200 [1:53:13<6:15:35, 146.33s/it, best=0.864]Escherichia_Coli | DirectMulti | Optuna:  23%|██▎       | 46/200 [1:53:13<6:15:35, 146.33s/it, best=0.864][I 2026-03-05 09:15:54,721] Trial 184 finished with value: 0.8911816615221639 and parameters: {'activation': 'identity', 'solver': 'adam', 'lr': 8.323845336165379e-06, 'layer1': 373, 'layer2': 455, 'layer3': 68}. Best is trial 153 with value: 0.8936680613721473.
Staphylococcus_Aureus | DirectMulti | Optuna:  92%|█████████▎| 185/200 [8:41:12<55:04, 220.28s/it, best=0.894]Staphylococcus_Aureus | DirectMulti | Optuna:  92%|█████████▎| 185/200 [8:41:12<55:04, 220.28s/it, best=0.894][I 2026-03-05 09:17:07,241] Trial 46 finished with value: 0.7395865180157584 and parameters: {'activation': 'tanh', 'solver': 'adam', 'lr': 5.17799351760891e-06, 'layer1': 394, 'layer2': 39, 'layer3': 446}. Best is trial 14 with value: 0.8635368497386182.
Escherichia_Coli | DirectMulti | Optuna:  24%|██▎       | 47/200 [1:54:26<5:17:10, 124.38s/it, best=0.864]Escherichia_Coli | DirectMulti | Optuna:  24%|██▎       | 47/200 [1:54:26<5:17:10, 124.38s/it, best=0.864][I 2026-03-05 09:18:42,089] Trial 47 finished with value: 0.7429036274807166 and parameters: {'activation': 'tanh', 'solver': 'sgd', 'lr': 9.623912387900715e-05, 'layer1': 452, 'layer2': 195, 'layer3': 227}. Best is trial 14 with value: 0.8635368497386182.
Escherichia_Coli | DirectMulti | Optuna:  24%|██▍       | 48/200 [1:56:01<4:52:39, 115.52s/it, best=0.864]Escherichia_Coli | DirectMulti | Optuna:  24%|██▍       | 48/200 [1:56:01<4:52:39, 115.52s/it, best=0.864][I 2026-03-05 09:19:10,800] Trial 185 finished with value: 0.893022098948619 and parameters: {'activation': 'identity', 'solver': 'adam', 'lr': 1.545058960377355e-05, 'layer1': 335, 'layer2': 432, 'layer3': 37}. Best is trial 153 with value: 0.8936680613721473.
Staphylococcus_Aureus | DirectMulti | Optuna:  93%|█████████▎| 186/200 [8:44:28<49:42, 213.02s/it, best=0.894]Staphylococcus_Aureus | DirectMulti | Optuna:  93%|█████████▎| 186/200 [8:44:28<49:42, 213.02s/it, best=0.894][I 2026-03-05 09:20:10,855] Trial 48 finished with value: 0.8504000570967902 and parameters: {'activation': 'identity', 'solver': 'adam', 'lr': 0.003944987817143686, 'layer1': 480, 'layer2': 347, 'layer3': 323}. Best is trial 14 with value: 0.8635368497386182.
Escherichia_Coli | DirectMulti | Optuna:  24%|██▍       | 49/200 [1:57:30<4:30:31, 107.49s/it, best=0.864]Escherichia_Coli | DirectMulti | Optuna:  24%|██▍       | 49/200 [1:57:30<4:30:31, 107.49s/it, best=0.864][I 2026-03-05 09:21:13,894] Trial 49 finished with value: 0.7389025207642418 and parameters: {'activation': 'tanh', 'solver': 'adam', 'lr': 2.9381386806459037e-06, 'layer1': 343, 'layer2': 112, 'layer3': 415}. Best is trial 14 with value: 0.8635368497386182.
Escherichia_Coli | DirectMulti | Optuna:  25%|██▌       | 50/200 [1:58:33<3:55:23, 94.16s/it, best=0.864] Escherichia_Coli | DirectMulti | Optuna:  25%|██▌       | 50/200 [1:58:33<3:55:23, 94.16s/it, best=0.864][I 2026-03-05 09:22:32,910] Trial 186 finished with value: 0.8927853961745958 and parameters: {'activation': 'identity', 'solver': 'adam', 'lr': 1.5069028583367887e-05, 'layer1': 217, 'layer2': 429, 'layer3': 89}. Best is trial 153 with value: 0.8936680613721473.
Staphylococcus_Aureus | DirectMulti | Optuna:  94%|█████████▎| 187/200 [8:47:50<45:26, 209.75s/it, best=0.894]Staphylococcus_Aureus | DirectMulti | Optuna:  94%|█████████▎| 187/200 [8:47:50<45:26, 209.75s/it, best=0.894][I 2026-03-05 09:22:44,371] Trial 50 finished with value: 0.7388991097092997 and parameters: {'activation': 'logistic', 'solver': 'adam', 'lr': 1.3844921328576758e-05, 'layer1': 415, 'layer2': 265, 'layer3': 483}. Best is trial 14 with value: 0.8635368497386182.
Escherichia_Coli | DirectMulti | Optuna:  26%|██▌       | 51/200 [2:00:03<3:51:04, 93.05s/it, best=0.864]Escherichia_Coli | DirectMulti | Optuna:  26%|██▌       | 51/200 [2:00:03<3:51:04, 93.05s/it, best=0.864][I 2026-03-05 09:25:10,876] Trial 51 finished with value: 0.8623236713465886 and parameters: {'activation': 'tanh', 'solver': 'adam', 'lr': 2.5566223487944716e-05, 'layer1': 441, 'layer2': 293, 'layer3': 243}. Best is trial 14 with value: 0.8635368497386182.
Escherichia_Coli | DirectMulti | Optuna:  26%|██▌       | 52/200 [2:02:30<4:29:05, 109.09s/it, best=0.864]Escherichia_Coli | DirectMulti | Optuna:  26%|██▌       | 52/200 [2:02:30<4:29:05, 109.09s/it, best=0.864][I 2026-03-05 09:25:42,549] Trial 187 finished with value: 0.8919288030042993 and parameters: {'activation': 'identity', 'solver': 'adam', 'lr': 1.49874391606694e-05, 'layer1': 334, 'layer2': 431, 'layer3': 87}. Best is trial 153 with value: 0.8936680613721473.
Staphylococcus_Aureus | DirectMulti | Optuna:  94%|█████████▍| 188/200 [8:51:00<40:44, 203.71s/it, best=0.894]Staphylococcus_Aureus | DirectMulti | Optuna:  94%|█████████▍| 188/200 [8:51:00<40:44, 203.71s/it, best=0.894][I 2026-03-05 09:27:16,397] Trial 52 finished with value: 0.8620899755915662 and parameters: {'activation': 'tanh', 'solver': 'adam', 'lr': 4.107611780073009e-05, 'layer1': 471, 'layer2': 339, 'layer3': 202}. Best is trial 14 with value: 0.8635368497386182.
Escherichia_Coli | DirectMulti | Optuna:  26%|██▋       | 53/200 [2:04:35<4:39:20, 114.02s/it, best=0.864]Escherichia_Coli | DirectMulti | Optuna:  26%|██▋       | 53/200 [2:04:35<4:39:20, 114.02s/it, best=0.864][I 2026-03-05 09:27:36,945] Trial 188 finished with value: 0.8918174628458152 and parameters: {'activation': 'identity', 'solver': 'adam', 'lr': 2.643174194920749e-05, 'layer1': 190, 'layer2': 302, 'layer3': 194}. Best is trial 153 with value: 0.8936680613721473.
Staphylococcus_Aureus | DirectMulti | Optuna:  94%|█████████▍| 189/200 [8:52:54<32:26, 176.92s/it, best=0.894]Staphylococcus_Aureus | DirectMulti | Optuna:  94%|█████████▍| 189/200 [8:52:54<32:26, 176.92s/it, best=0.894][I 2026-03-05 09:29:48,719] Trial 189 finished with value: 0.8914147468797493 and parameters: {'activation': 'identity', 'solver': 'adam', 'lr': 2.336790157152683e-05, 'layer1': 217, 'layer2': 435, 'layer3': 94}. Best is trial 153 with value: 0.8936680613721473.
Staphylococcus_Aureus | DirectMulti | Optuna:  95%|█████████▌| 190/200 [8:55:06<27:13, 163.38s/it, best=0.894]Staphylococcus_Aureus | DirectMulti | Optuna:  95%|█████████▌| 190/200 [8:55:06<27:13, 163.38s/it, best=0.894][I 2026-03-05 09:31:13,522] Trial 53 finished with value: 0.8623497035475113 and parameters: {'activation': 'tanh', 'solver': 'adam', 'lr': 8.012619998508143e-06, 'layer1': 411, 'layer2': 313, 'layer3': 162}. Best is trial 14 with value: 0.8635368497386182.
Escherichia_Coli | DirectMulti | Optuna:  27%|██▋       | 54/200 [2:08:33<6:07:18, 150.95s/it, best=0.864]Escherichia_Coli | DirectMulti | Optuna:  27%|██▋       | 54/200 [2:08:33<6:07:18, 150.95s/it, best=0.864][I 2026-03-05 09:31:32,384] Trial 190 finished with value: 0.892085471303853 and parameters: {'activation': 'identity', 'solver': 'adam', 'lr': 3.73456616187499e-05, 'layer1': 212, 'layer2': 443, 'layer3': 32}. Best is trial 153 with value: 0.8936680613721473.
Staphylococcus_Aureus | DirectMulti | Optuna:  96%|█████████▌| 191/200 [8:56:50<21:49, 145.46s/it, best=0.894]Staphylococcus_Aureus | DirectMulti | Optuna:  96%|█████████▌| 191/200 [8:56:50<21:49, 145.46s/it, best=0.894][I 2026-03-05 09:33:16,963] Trial 54 finished with value: 0.8629489506427579 and parameters: {'activation': 'tanh', 'solver': 'adam', 'lr': 2.187536780765872e-05, 'layer1': 376, 'layer2': 364, 'layer3': 119}. Best is trial 14 with value: 0.8635368497386182.
Escherichia_Coli | DirectMulti | Optuna:  28%|██▊       | 55/200 [2:10:36<5:44:51, 142.70s/it, best=0.864]Escherichia_Coli | DirectMulti | Optuna:  28%|██▊       | 55/200 [2:10:36<5:44:51, 142.70s/it, best=0.864][I 2026-03-05 09:35:11,686] Trial 191 finished with value: 0.8904770996045516 and parameters: {'activation': 'identity', 'solver': 'adam', 'lr': 1.1682610515700961e-05, 'layer1': 346, 'layer2': 420, 'layer3': 75}. Best is trial 153 with value: 0.8936680613721473.
Staphylococcus_Aureus | DirectMulti | Optuna:  96%|█████████▌| 192/200 [9:00:29<22:20, 167.61s/it, best=0.894]Staphylococcus_Aureus | DirectMulti | Optuna:  96%|█████████▌| 192/200 [9:00:29<22:20, 167.61s/it, best=0.894][I 2026-03-05 09:35:26,944] Trial 55 finished with value: 0.8620543015077464 and parameters: {'activation': 'tanh', 'solver': 'adam', 'lr': 1.8494986788553857e-05, 'layer1': 377, 'layer2': 366, 'layer3': 125}. Best is trial 14 with value: 0.8635368497386182.
Escherichia_Coli | DirectMulti | Optuna:  28%|██▊       | 56/200 [2:12:46<5:33:19, 138.88s/it, best=0.864]Escherichia_Coli | DirectMulti | Optuna:  28%|██▊       | 56/200 [2:12:46<5:33:19, 138.88s/it, best=0.864][I 2026-03-05 09:37:25,085] Trial 56 finished with value: 0.8630515084288888 and parameters: {'activation': 'tanh', 'solver': 'adam', 'lr': 6.892127714329487e-05, 'layer1': 450, 'layer2': 434, 'layer3': 43}. Best is trial 14 with value: 0.8635368497386182.
Escherichia_Coli | DirectMulti | Optuna:  28%|██▊       | 57/200 [2:14:44<5:16:10, 132.66s/it, best=0.864]Escherichia_Coli | DirectMulti | Optuna:  28%|██▊       | 57/200 [2:14:44<5:16:10, 132.66s/it, best=0.864][I 2026-03-05 09:38:31,689] Trial 192 finished with value: 0.892823127341348 and parameters: {'activation': 'identity', 'solver': 'adam', 'lr': 1.5733743783167336e-05, 'layer1': 319, 'layer2': 407, 'layer3': 59}. Best is trial 153 with value: 0.8936680613721473.
Staphylococcus_Aureus | DirectMulti | Optuna:  96%|█████████▋| 193/200 [9:03:49<20:41, 177.33s/it, best=0.894]Staphylococcus_Aureus | DirectMulti | Optuna:  96%|█████████▋| 193/200 [9:03:49<20:41, 177.33s/it, best=0.894][I 2026-03-05 09:39:23,474] Trial 57 finished with value: 0.8634957247400983 and parameters: {'activation': 'tanh', 'solver': 'adam', 'lr': 8.617312991455153e-05, 'layer1': 499, 'layer2': 440, 'layer3': 40}. Best is trial 14 with value: 0.8635368497386182.
Escherichia_Coli | DirectMulti | Optuna:  29%|██▉       | 58/200 [2:16:43<5:03:49, 128.38s/it, best=0.864]Escherichia_Coli | DirectMulti | Optuna:  29%|██▉       | 58/200 [2:16:43<5:03:49, 128.38s/it, best=0.864][I 2026-03-05 09:41:02,934] Trial 58 finished with value: 0.7411560134421348 and parameters: {'activation': 'identity', 'solver': 'sgd', 'lr': 0.0002582942865279622, 'layer1': 497, 'layer2': 497, 'layer3': 42}. Best is trial 14 with value: 0.8635368497386182.
Escherichia_Coli | DirectMulti | Optuna:  30%|██▉       | 59/200 [2:18:22<4:41:18, 119.70s/it, best=0.864]Escherichia_Coli | DirectMulti | Optuna:  30%|██▉       | 59/200 [2:18:22<4:41:18, 119.70s/it, best=0.864][I 2026-03-05 09:41:53,562] Trial 193 finished with value: 0.891433008768835 and parameters: {'activation': 'identity', 'solver': 'adam', 'lr': 1.592365268616796e-05, 'layer1': 319, 'layer2': 403, 'layer3': 55}. Best is trial 153 with value: 0.8936680613721473.
Staphylococcus_Aureus | DirectMulti | Optuna:  97%|█████████▋| 194/200 [9:07:11<18:28, 184.69s/it, best=0.894]Staphylococcus_Aureus | DirectMulti | Optuna:  97%|█████████▋| 194/200 [9:07:11<18:28, 184.69s/it, best=0.894][I 2026-03-05 09:43:39,694] Trial 59 finished with value: 0.8585012998675214 and parameters: {'activation': 'logistic', 'solver': 'adam', 'lr': 0.00013769708995581726, 'layer1': 450, 'layer2': 422, 'layer3': 80}. Best is trial 14 with value: 0.8635368497386182.
Escherichia_Coli | DirectMulti | Optuna:  30%|███       | 60/200 [2:20:59<5:05:14, 130.82s/it, best=0.864]Escherichia_Coli | DirectMulti | Optuna:  30%|███       | 60/200 [2:20:59<5:05:14, 130.82s/it, best=0.864][I 2026-03-05 09:44:37,398] Trial 194 finished with value: 0.8921887446256784 and parameters: {'activation': 'identity', 'solver': 'adam', 'lr': 1.6948005431824255e-05, 'layer1': 325, 'layer2': 412, 'layer3': 465}. Best is trial 153 with value: 0.8936680613721473.
Staphylococcus_Aureus | DirectMulti | Optuna:  98%|█████████▊| 195/200 [9:09:55<14:52, 178.44s/it, best=0.894]Staphylococcus_Aureus | DirectMulti | Optuna:  98%|█████████▊| 195/200 [9:09:55<14:52, 178.44s/it, best=0.894][I 2026-03-05 09:45:36,868] Trial 60 finished with value: 0.8630102561803786 and parameters: {'activation': 'tanh', 'solver': 'adam', 'lr': 6.913938805507918e-05, 'layer1': 483, 'layer2': 448, 'layer3': 28}. Best is trial 14 with value: 0.8635368497386182.
