Staphylococcus_Aureus | Clindamycin | Optuna:  26%|██▌       | 51/200 [1:07:25<2:49:27, 68.24s/it, best=0.856][A[I 2026-02-27 23:05:46,766] Trial 54 finished with value: 0.8845826165851074 and parameters: {'activation': 'identity', 'solver': 'adam', 'lr': 0.0005491278544725167, 'layer1': 363, 'layer2': 467, 'layer3': 414}. Best is trial 8 with value: 0.8854975788426769.

Pseudomonas_Aeruginosa | Meropenem | Optuna:  28%|██▊       | 55/200 [1:01:21<3:12:12, 79.53s/it, best=0.885][A
Pseudomonas_Aeruginosa | Meropenem | Optuna:  28%|██▊       | 55/200 [1:01:21<3:12:12, 79.53s/it, best=0.885][A[I 2026-02-27 23:06:39,137] Trial 198 finished with value: 0.8066896164414082 and parameters: {'activation': 'tanh', 'solver': 'adam', 'lr': 2.7009290608708337e-05, 'layer1': 383, 'layer2': 315, 'layer3': 20}. Best is trial 191 with value: 0.8109607364737272.

Escherichia_Coli | Ciprofloxacin | Optuna: 100%|█████████▉| 199/200 [8:19:08<02:55, 175.01s/it, best=0.811][A
Escherichia_Coli | Ciprofloxacin | Optuna: 100%|█████████▉| 199/200 [8:19:08<02:55, 175.01s/it, best=0.811][A[I 2026-02-27 23:06:46,577] Trial 51 finished with value: 0.8502957889498031 and parameters: {'activation': 'tanh', 'solver': 'adam', 'lr': 9.735243798701898e-05, 'layer1': 43, 'layer2': 154, 'layer3': 346}. Best is trial 33 with value: 0.8559196107911822.

Staphylococcus_Aureus | Clindamycin | Optuna:  26%|██▌       | 52/200 [1:08:48<2:58:45, 72.47s/it, best=0.856][A
Staphylococcus_Aureus | Clindamycin | Optuna:  26%|██▌       | 52/200 [1:08:48<2:58:45, 72.47s/it, best=0.856][A[I 2026-02-27 23:07:02,042] Trial 55 finished with value: 0.8844796598710387 and parameters: {'activation': 'identity', 'solver': 'adam', 'lr': 0.00449663713854535, 'layer1': 190, 'layer2': 348, 'layer3': 457}. Best is trial 8 with value: 0.8854975788426769.

Pseudomonas_Aeruginosa | Meropenem | Optuna:  28%|██▊       | 56/200 [1:02:37<3:07:48, 78.25s/it, best=0.885][A
Pseudomonas_Aeruginosa | Meropenem | Optuna:  28%|██▊       | 56/200 [1:02:37<3:07:48, 78.25s/it, best=0.885][A[I 2026-02-27 23:07:17,743] Trial 79 finished with value: 0.7279271383335318 and parameters: {'activation': 'identity', 'solver': 'sgd', 'lr': 1.6318247132527725e-05, 'layer1': 461, 'layer2': 488, 'layer3': 435}. Best is trial 25 with value: 0.9080365798965563.

Klebsiella_Pneumoniae | Ceftriaxone | Optuna:  40%|████      | 80/200 [2:16:39<3:48:07, 114.06s/it, best=0.908][A
Klebsiella_Pneumoniae | Ceftriaxone | Optuna:  40%|████      | 80/200 [2:16:39<3:48:07, 114.06s/it, best=0.908][A[I 2026-02-27 23:08:05,521] Trial 52 finished with value: 0.8521491182639395 and parameters: {'activation': 'tanh', 'solver': 'adam', 'lr': 0.0001265980514597842, 'layer1': 57, 'layer2': 165, 'layer3': 315}. Best is trial 33 with value: 0.8559196107911822.

Staphylococcus_Aureus | Clindamycin | Optuna:  26%|██▋       | 53/200 [1:10:07<3:02:18, 74.41s/it, best=0.856][A
Staphylococcus_Aureus | Clindamycin | Optuna:  26%|██▋       | 53/200 [1:10:07<3:02:18, 74.41s/it, best=0.856][A[I 2026-02-27 23:08:19,901] Trial 56 finished with value: 0.8825747694362459 and parameters: {'activation': 'identity', 'solver': 'adam', 'lr': 0.00036287932773878336, 'layer1': 394, 'layer2': 310, 'layer3': 213}. Best is trial 8 with value: 0.8854975788426769.

Pseudomonas_Aeruginosa | Meropenem | Optuna:  28%|██▊       | 57/200 [1:03:55<3:06:13, 78.14s/it, best=0.885][A
Pseudomonas_Aeruginosa | Meropenem | Optuna:  28%|██▊       | 57/200 [1:03:55<3:06:13, 78.14s/it, best=0.885][A[I 2026-02-27 23:08:36,472] Trial 57 finished with value: 0.8429744308639442 and parameters: {'activation': 'identity', 'solver': 'sgd', 'lr': 0.002422134789985835, 'layer1': 136, 'layer2': 280, 'layer3': 429}. Best is trial 8 with value: 0.8854975788426769.

Pseudomonas_Aeruginosa | Meropenem | Optuna:  29%|██▉       | 58/200 [1:04:11<2:21:12, 59.67s/it, best=0.885][A
Pseudomonas_Aeruginosa | Meropenem | Optuna:  29%|██▉       | 58/200 [1:04:11<2:21:12, 59.67s/it, best=0.885][A[I 2026-02-27 23:09:10,425] Trial 80 finished with value: 0.903162768404593 and parameters: {'activation': 'relu', 'solver': 'adam', 'lr': 8.168740771446135e-05, 'layer1': 411, 'layer2': 386, 'layer3': 391}. Best is trial 25 with value: 0.9080365798965563.

Klebsiella_Pneumoniae | Ceftriaxone | Optuna:  40%|████      | 81/200 [2:18:31<3:45:24, 113.65s/it, best=0.908][A
Klebsiella_Pneumoniae | Ceftriaxone | Optuna:  40%|████      | 81/200 [2:18:31<3:45:24, 113.65s/it, best=0.908][A[I 2026-02-27 23:09:12,620] Trial 53 finished with value: 0.8530083309172642 and parameters: {'activation': 'tanh', 'solver': 'adam', 'lr': 0.00024145404557630772, 'layer1': 101, 'layer2': 79, 'layer3': 368}. Best is trial 33 with value: 0.8559196107911822.

Staphylococcus_Aureus | Clindamycin | Optuna:  27%|██▋       | 54/200 [1:11:14<2:55:43, 72.22s/it, best=0.856][A
Staphylococcus_Aureus | Clindamycin | Optuna:  27%|██▋       | 54/200 [1:11:14<2:55:43, 72.22s/it, best=0.856][A[I 2026-02-27 23:09:32,040] Trial 199 finished with value: 0.808422947127298 and parameters: {'activation': 'tanh', 'solver': 'adam', 'lr': 2.2326925650722118e-05, 'layer1': 347, 'layer2': 304, 'layer3': 17}. Best is trial 191 with value: 0.8109607364737272.

Escherichia_Coli | Ciprofloxacin | Optuna: 100%|██████████| 200/200 [8:22:01<00:00, 174.38s/it, best=0.811][A
Escherichia_Coli | Ciprofloxacin | Optuna: 100%|██████████| 200/200 [8:22:01<00:00, 174.38s/it, best=0.811][A
                                                                                                           [A[Escherichia_Coli | Ciprofloxacin] [OPTUNA DONE] Best CV WF1=0.8110 | params={'activation': 'tanh', 'solver': 'adam', 'lr': 2.4264833651187717e-05, 'layer1': 385, 'layer2': 320, 'layer3': 21}
[Escherichia_Coli | Ciprofloxacin] Retraining with validation early stopping (10% split)...
[Escherichia_Coli | Ciprofloxacin] [TEST] WF1=0.7818 | ACC=0.7929 | HL=0.2071 | best_val_WF1=0.8282
Escherichia_Coli | Binary antibiotics:  25%|██▌       | 1/4 [8:22:27<25:07:23, 30147.87s/it]
[Escherichia_Coli | Ceftriaxone] Optuna search starting... (trials=200, cv=5)
[I 2026-02-27 23:09:58,501] A new study created in memory with name: no-name-9673ea9f-399b-4f5f-9ef7-db720221a194

Escherichia_Coli | Ceftriaxone | Optuna:   0%|          | 0/200 [00:00<?, ?it/s][A[I 2026-02-27 23:09:58,751] Trial 58 finished with value: 0.8785392710246327 and parameters: {'activation': 'logistic', 'solver': 'adam', 'lr': 0.0002335058429008247, 'layer1': 321, 'layer2': 429, 'layer3': 487}. Best is trial 8 with value: 0.8854975788426769.

Pseudomonas_Aeruginosa | Meropenem | Optuna:  30%|██▉       | 59/200 [1:05:33<2:36:09, 66.45s/it, best=0.885][A
Pseudomonas_Aeruginosa | Meropenem | Optuna:  30%|██▉       | 59/200 [1:05:33<2:36:09, 66.45s/it, best=0.885][A[I 2026-02-27 23:10:16,758] Trial 54 finished with value: 0.8506189116740227 and parameters: {'activation': 'tanh', 'solver': 'adam', 'lr': 0.00022675671091412916, 'layer1': 112, 'layer2': 90, 'layer3': 368}. Best is trial 33 with value: 0.8559196107911822.

Staphylococcus_Aureus | Clindamycin | Optuna:  28%|██▊       | 55/200 [1:12:18<2:48:40, 69.79s/it, best=0.856][A
Staphylococcus_Aureus | Clindamycin | Optuna:  28%|██▊       | 55/200 [1:12:18<2:48:40, 69.79s/it, best=0.856][A[I 2026-02-27 23:10:45,283] Trial 0 finished with value: 0.32400995807738486 and parameters: {'activation': 'logistic', 'solver': 'sgd', 'lr': 1.7073967431528114e-06, 'layer1': 435, 'layer2': 305, 'layer3': 357}. Best is trial 0 with value: 0.32400995807738486.

Escherichia_Coli | Ceftriaxone | Optuna:   0%|          | 1/200 [00:46<2:35:09, 46.78s/it][A
Escherichia_Coli | Ceftriaxone | Optuna:   0%|          | 1/200 [00:46<2:35:09, 46.78s/it, best=0.324][A[I 2026-02-27 23:10:58,560] Trial 81 finished with value: 0.9044552244016917 and parameters: {'activation': 'identity', 'solver': 'adam', 'lr': 0.0002343490412493324, 'layer1': 476, 'layer2': 330, 'layer3': 455}. Best is trial 25 with value: 0.9080365798965563.

Klebsiella_Pneumoniae | Ceftriaxone | Optuna:  41%|████      | 82/200 [2:20:20<3:40:15, 111.99s/it, best=0.908][A
Klebsiella_Pneumoniae | Ceftriaxone | Optuna:  41%|████      | 82/200 [2:20:20<3:40:15, 111.99s/it, best=0.908][A[I 2026-02-27 23:11:29,667] Trial 59 finished with value: 0.8824213716522304 and parameters: {'activation': 'identity', 'solver': 'adam', 'lr': 0.0011531497596988303, 'layer1': 422, 'layer2': 381, 'layer3': 342}. Best is trial 8 with value: 0.8854975788426769.

Pseudomonas_Aeruginosa | Meropenem | Optuna:  30%|███       | 60/200 [1:07:04<2:52:10, 73.79s/it, best=0.885][A
Pseudomonas_Aeruginosa | Meropenem | Optuna:  30%|███       | 60/200 [1:07:04<2:52:10, 73.79s/it, best=0.885][A[I 2026-02-27 23:11:32,197] Trial 1 finished with value: 0.7063623135534863 and parameters: {'activation': 'logistic', 'solver': 'adam', 'lr': 1.6480446427978994e-05, 'layer1': 267, 'layer2': 222, 'layer3': 152}. Best is trial 1 with value: 0.7063623135534863.

Escherichia_Coli | Ceftriaxone | Optuna:   1%|          | 2/200 [01:33<2:34:38, 46.86s/it, best=0.324][A
Escherichia_Coli | Ceftriaxone | Optuna:   1%|          | 2/200 [01:33<2:34:38, 46.86s/it, best=0.706][A[I 2026-02-27 23:11:36,953] Trial 55 finished with value: 0.8465136792282799 and parameters: {'activation': 'tanh', 'solver': 'adam', 'lr': 0.0005395568313746108, 'layer1': 160, 'layer2': 67, 'layer3': 406}. Best is trial 33 with value: 0.8559196107911822.

Staphylococcus_Aureus | Clindamycin | Optuna:  28%|██▊       | 56/200 [1:13:38<2:54:59, 72.91s/it, best=0.856][A
Staphylococcus_Aureus | Clindamycin | Optuna:  28%|██▊       | 56/200 [1:13:38<2:54:59, 72.91s/it, best=0.856][A[I 2026-02-27 23:12:46,283] Trial 60 finished with value: 0.8821154199466509 and parameters: {'activation': 'identity', 'solver': 'adam', 'lr': 0.0005048961644856337, 'layer1': 296, 'layer2': 242, 'layer3': 392}. Best is trial 8 with value: 0.8854975788426769.

Pseudomonas_Aeruginosa | Meropenem | Optuna:  30%|███       | 61/200 [1:08:21<2:52:54, 74.64s/it, best=0.885][A
Pseudomonas_Aeruginosa | Meropenem | Optuna:  30%|███       | 61/200 [1:08:21<2:52:54, 74.64s/it, best=0.885][A[I 2026-02-27 23:12:55,527] Trial 82 finished with value: 0.9042169405084122 and parameters: {'activation': 'identity', 'solver': 'adam', 'lr': 6.431104363270501e-05, 'layer1': 500, 'layer2': 412, 'layer3': 472}. Best is trial 25 with value: 0.9080365798965563.

Klebsiella_Pneumoniae | Ceftriaxone | Optuna:  42%|████▏     | 83/200 [2:22:17<3:41:17, 113.49s/it, best=0.908][A
Klebsiella_Pneumoniae | Ceftriaxone | Optuna:  42%|████▏     | 83/200 [2:22:17<3:41:17, 113.49s/it, best=0.908][A[I 2026-02-27 23:13:08,983] Trial 56 finished with value: 0.8467594163246025 and parameters: {'activation': 'relu', 'solver': 'adam', 'lr': 0.0003564944318268927, 'layer1': 109, 'layer2': 389, 'layer3': 394}. Best is trial 33 with value: 0.8559196107911822.

Staphylococcus_Aureus | Clindamycin | Optuna:  28%|██▊       | 57/200 [1:15:10<3:07:26, 78.65s/it, best=0.856][A
Staphylococcus_Aureus | Clindamycin | Optuna:  28%|██▊       | 57/200 [1:15:10<3:07:26, 78.65s/it, best=0.856][A[I 2026-02-27 23:14:02,888] Trial 61 finished with value: 0.881729844861247 and parameters: {'activation': 'identity', 'solver': 'adam', 'lr': 0.0014411608352033858, 'layer1': 378, 'layer2': 196, 'layer3': 451}. Best is trial 8 with value: 0.8854975788426769.

Pseudomonas_Aeruginosa | Meropenem | Optuna:  31%|███       | 62/200 [1:09:38<2:53:01, 75.23s/it, best=0.885][A
Pseudomonas_Aeruginosa | Meropenem | Optuna:  31%|███       | 62/200 [1:09:38<2:53:01, 75.23s/it, best=0.885][A[I 2026-02-27 23:14:52,348] Trial 57 finished with value: 0.816318756873611 and parameters: {'activation': 'logistic', 'solver': 'adam', 'lr': 0.00017642046144023495, 'layer1': 348, 'layer2': 58, 'layer3': 301}. Best is trial 33 with value: 0.8559196107911822.

Staphylococcus_Aureus | Clindamycin | Optuna:  29%|██▉       | 58/200 [1:16:54<3:23:41, 86.06s/it, best=0.856][A
Staphylococcus_Aureus | Clindamycin | Optuna:  29%|██▉       | 58/200 [1:16:54<3:23:41, 86.06s/it, best=0.856][A[I 2026-02-27 23:14:54,422] Trial 83 finished with value: 0.9036113520892142 and parameters: {'activation': 'identity', 'solver': 'adam', 'lr': 0.0007835196808104105, 'layer1': 444, 'layer2': 444, 'layer3': 487}. Best is trial 25 with value: 0.9080365798965563.

Klebsiella_Pneumoniae | Ceftriaxone | Optuna:  42%|████▏     | 84/200 [2:24:15<3:42:32, 115.11s/it, best=0.908][A
Klebsiella_Pneumoniae | Ceftriaxone | Optuna:  42%|████▏     | 84/200 [2:24:15<3:42:32, 115.11s/it, best=0.908][A[I 2026-02-27 23:15:13,487] Trial 58 finished with value: 0.7888558471217525 and parameters: {'activation': 'logistic', 'solver': 'sgd', 'lr': 0.0016033045228635709, 'layer1': 81, 'layer2': 29, 'layer3': 441}. Best is trial 33 with value: 0.8559196107911822.

Staphylococcus_Aureus | Clindamycin | Optuna:  30%|██▉       | 59/200 [1:17:15<2:36:28, 66.59s/it, best=0.856][A
Staphylococcus_Aureus | Clindamycin | Optuna:  30%|██▉       | 59/200 [1:17:15<2:36:28, 66.59s/it, best=0.856][A[I 2026-02-27 23:15:18,056] Trial 62 finished with value: 0.8832173898327771 and parameters: {'activation': 'identity', 'solver': 'adam', 'lr': 0.0009544656583705932, 'layer1': 358, 'layer2': 247, 'layer3': 433}. Best is trial 8 with value: 0.8854975788426769.

Pseudomonas_Aeruginosa | Meropenem | Optuna:  32%|███▏      | 63/200 [1:10:53<2:51:43, 75.21s/it, best=0.885][A
Pseudomonas_Aeruginosa | Meropenem | Optuna:  32%|███▏      | 63/200 [1:10:53<2:51:43, 75.21s/it, best=0.885][A[I 2026-02-27 23:16:13,317] Trial 59 finished with value: 0.8555509229706543 and parameters: {'activation': 'tanh', 'solver': 'adam', 'lr': 0.00027458420424343393, 'layer1': 23, 'layer2': 105, 'layer3': 14}. Best is trial 33 with value: 0.8559196107911822.

Staphylococcus_Aureus | Clindamycin | Optuna:  30%|███       | 60/200 [1:18:14<2:30:38, 64.56s/it, best=0.856][A
Staphylococcus_Aureus | Clindamycin | Optuna:  30%|███       | 60/200 [1:18:14<2:30:38, 64.56s/it, best=0.856][A[I 2026-02-27 23:16:18,291] Trial 84 finished with value: 0.9029501375649372 and parameters: {'activation': 'tanh', 'solver': 'adam', 'lr': 0.0001314542153502645, 'layer1': 490, 'layer2': 386, 'layer3': 448}. Best is trial 25 with value: 0.9080365798965563.

Klebsiella_Pneumoniae | Ceftriaxone | Optuna:  42%|████▎     | 85/200 [2:25:39<3:22:39, 105.74s/it, best=0.908][A
Klebsiella_Pneumoniae | Ceftriaxone | Optuna:  42%|████▎     | 85/200 [2:25:39<3:22:39, 105.74s/it, best=0.908][A[I 2026-02-27 23:16:37,443] Trial 63 finished with value: 0.8808813862022544 and parameters: {'activation': 'identity', 'solver': 'adam', 'lr': 0.0033131004303857997, 'layer1': 342, 'layer2': 166, 'layer3': 363}. Best is trial 8 with value: 0.8854975788426769.

Pseudomonas_Aeruginosa | Meropenem | Optuna:  32%|███▏      | 64/200 [1:12:12<2:53:18, 76.46s/it, best=0.885][A
Pseudomonas_Aeruginosa | Meropenem | Optuna:  32%|███▏      | 64/200 [1:12:12<2:53:18, 76.46s/it, best=0.885][A[I 2026-02-27 23:16:58,376] Trial 2 finished with value: 0.8816475100929212 and parameters: {'activation': 'identity', 'solver': 'adam', 'lr': 6.290644294586145e-06, 'layer1': 262, 'layer2': 300, 'layer3': 32}. Best is trial 2 with value: 0.8816475100929212.

Escherichia_Coli | Ceftriaxone | Optuna:   2%|▏         | 3/200 [06:59<9:32:37, 174.40s/it, best=0.706][A
Escherichia_Coli | Ceftriaxone | Optuna:   2%|▏         | 3/200 [06:59<9:32:37, 174.40s/it, best=0.882][A[I 2026-02-27 23:17:13,584] Trial 60 finished with value: 0.8522900913586924 and parameters: {'activation': 'tanh', 'solver': 'adam', 'lr': 0.0002711083309185912, 'layer1': 26, 'layer2': 109, 'layer3': 41}. Best is trial 33 with value: 0.8559196107911822.

Staphylococcus_Aureus | Clindamycin | Optuna:  30%|███       | 61/200 [1:19:15<2:26:34, 63.27s/it, best=0.856][A
Staphylococcus_Aureus | Clindamycin | Optuna:  30%|███       | 61/200 [1:19:15<2:26:34, 63.27s/it, best=0.856][A[I 2026-02-27 23:17:46,319] Trial 64 finished with value: 0.8835227682635722 and parameters: {'activation': 'identity', 'solver': 'adam', 'lr': 0.0008031097344430742, 'layer1': 322, 'layer2': 235, 'layer3': 454}. Best is trial 8 with value: 0.8854975788426769.

Pseudomonas_Aeruginosa | Meropenem | Optuna:  32%|███▎      | 65/200 [1:13:21<2:46:55, 74.19s/it, best=0.885][A
Pseudomonas_Aeruginosa | Meropenem | Optuna:  32%|███▎      | 65/200 [1:13:21<2:46:55, 74.19s/it, best=0.885][A[I 2026-02-27 23:18:04,824] Trial 85 finished with value: 0.9054443443811779 and parameters: {'activation': 'identity', 'solver': 'adam', 'lr': 9.851868119047314e-05, 'layer1': 455, 'layer2': 429, 'layer3': 464}. Best is trial 25 with value: 0.9080365798965563.

Klebsiella_Pneumoniae | Ceftriaxone | Optuna:  43%|████▎     | 86/200 [2:27:26<3:21:21, 105.98s/it, best=0.908][A
Klebsiella_Pneumoniae | Ceftriaxone | Optuna:  43%|████▎     | 86/200 [2:27:26<3:21:21, 105.98s/it, best=0.908][A[I 2026-02-27 23:18:11,697] Trial 61 finished with value: 0.8461411065225878 and parameters: {'activation': 'tanh', 'solver': 'adam', 'lr': 0.00030325075933178807, 'layer1': 59, 'layer2': 88, 'layer3': 167}. Best is trial 33 with value: 0.8559196107911822.

Staphylococcus_Aureus | Clindamycin | Optuna:  31%|███       | 62/200 [1:20:13<2:21:57, 61.72s/it, best=0.856][A
Staphylococcus_Aureus | Clindamycin | Optuna:  31%|███       | 62/200 [1:20:13<2:21:57, 61.72s/it, best=0.856][A[I 2026-02-27 23:18:31,149] Trial 65 finished with value: 0.8663593279262178 and parameters: {'activation': 'tanh', 'solver': 'adam', 'lr': 0.0016328860018487547, 'layer1': 431, 'layer2': 262, 'layer3': 401}. Best is trial 8 with value: 0.8854975788426769.

Pseudomonas_Aeruginosa | Meropenem | Optuna:  33%|███▎      | 66/200 [1:14:06<2:26:00, 65.38s/it, best=0.885][A
Pseudomonas_Aeruginosa | Meropenem | Optuna:  33%|███▎      | 66/200 [1:14:06<2:26:00, 65.38s/it, best=0.885][A[I 2026-02-27 23:18:33,228] Trial 3 finished with value: 0.585914401488623 and parameters: {'activation': 'relu', 'solver': 'sgd', 'lr': 1.6536937182824424e-05, 'layer1': 57, 'layer2': 345, 'layer3': 226}. Best is trial 2 with value: 0.8816475100929212.

Escherichia_Coli | Ceftriaxone | Optuna:   2%|▏         | 4/200 [08:34<7:47:07, 143.00s/it, best=0.882][A
Escherichia_Coli | Ceftriaxone | Optuna:   2%|▏         | 4/200 [08:34<7:47:07, 143.00s/it, best=0.882][A[I 2026-02-27 23:19:26,193] Trial 62 finished with value: 0.8480996173499527 and parameters: {'activation': 'tanh', 'solver': 'adam', 'lr': 0.0005756484163341067, 'layer1': 128, 'layer2': 132, 'layer3': 106}. Best is trial 33 with value: 0.8559196107911822.

Staphylococcus_Aureus | Clindamycin | Optuna:  32%|███▏      | 63/200 [1:21:27<2:29:41, 65.56s/it, best=0.856][A
Staphylococcus_Aureus | Clindamycin | Optuna:  32%|███▏      | 63/200 [1:21:27<2:29:41, 65.56s/it, best=0.856][A[I 2026-02-27 23:20:02,252] Trial 66 finished with value: 0.8799874310924162 and parameters: {'activation': 'identity', 'solver': 'adam', 'lr': 0.006121994943890861, 'layer1': 385, 'layer2': 210, 'layer3': 473}. Best is trial 8 with value: 0.8854975788426769.

Pseudomonas_Aeruginosa | Meropenem | Optuna:  34%|███▎      | 67/200 [1:15:37<2:42:01, 73.10s/it, best=0.885][A
Pseudomonas_Aeruginosa | Meropenem | Optuna:  34%|███▎      | 67/200 [1:15:37<2:42:01, 73.10s/it, best=0.885][A[I 2026-02-27 23:20:24,758] Trial 86 finished with value: 0.9046527597571504 and parameters: {'activation': 'identity', 'solver': 'adam', 'lr': 4.660499456184456e-05, 'layer1': 475, 'layer2': 464, 'layer3': 89}. Best is trial 25 with value: 0.9080365798965563.

Klebsiella_Pneumoniae | Ceftriaxone | Optuna:  44%|████▎     | 87/200 [2:29:46<3:38:46, 116.16s/it, best=0.908][A
Klebsiella_Pneumoniae | Ceftriaxone | Optuna:  44%|████▎     | 87/200 [2:29:46<3:38:46, 116.16s/it, best=0.908][A[I 2026-02-27 23:20:35,285] Trial 63 finished with value: 0.8532399174669536 and parameters: {'activation': 'tanh', 'solver': 'adam', 'lr': 0.0001342469276870154, 'layer1': 97, 'layer2': 78, 'layer3': 425}. Best is trial 33 with value: 0.8559196107911822.

Staphylococcus_Aureus | Clindamycin | Optuna:  32%|███▏      | 64/200 [1:22:36<2:30:59, 66.62s/it, best=0.856][A
Staphylococcus_Aureus | Clindamycin | Optuna:  32%|███▏      | 64/200 [1:22:36<2:30:59, 66.62s/it, best=0.856][A[I 2026-02-27 23:20:42,620] Trial 67 finished with value: 0.8437686142365293 and parameters: {'activation': 'relu', 'solver': 'sgd', 'lr': 6.884776079502286e-05, 'layer1': 489, 'layer2': 288, 'layer3': 422}. Best is trial 8 with value: 0.8854975788426769.

Pseudomonas_Aeruginosa | Meropenem | Optuna:  34%|███▍      | 68/200 [1:16:17<2:19:12, 63.28s/it, best=0.885][A
Pseudomonas_Aeruginosa | Meropenem | Optuna:  34%|███▍      | 68/200 [1:16:17<2:19:12, 63.28s/it, best=0.885][A[I 2026-02-27 23:21:53,324] Trial 68 finished with value: 0.8821788419508758 and parameters: {'activation': 'identity', 'solver': 'adam', 'lr': 0.0005996702300841258, 'layer1': 352, 'layer2': 135, 'layer3': 61}. Best is trial 8 with value: 0.8854975788426769.

Pseudomonas_Aeruginosa | Meropenem | Optuna:  34%|███▍      | 69/200 [1:17:28<2:23:01, 65.51s/it, best=0.885][A
Pseudomonas_Aeruginosa | Meropenem | Optuna:  34%|███▍      | 69/200 [1:17:28<2:23:01, 65.51s/it, best=0.885][A[I 2026-02-27 23:21:59,422] Trial 64 finished with value: 0.8527993793518724 and parameters: {'activation': 'tanh', 'solver': 'adam', 'lr': 0.00013510179528186287, 'layer1': 200, 'layer2': 103, 'layer3': 428}. Best is trial 33 with value: 0.8559196107911822.

Staphylococcus_Aureus | Clindamycin | Optuna:  32%|███▎      | 65/200 [1:24:01<2:41:42, 71.87s/it, best=0.856][A
