Staphylococcus_Aureus | Fusidic acid | Optuna:   2%|▏         | 4/200 [04:14<3:57:35, 72.73s/it, best=0.91][A[I 2026-02-28 02:45:23,377] Trial 28 finished with value: 0.8482138697470958 and parameters: {'activation': 'logistic', 'solver': 'adam', 'lr': 0.002870543221076163, 'layer1': 462, 'layer2': 260, 'layer3': 371}. Best is trial 25 with value: 0.867275854165397.
Pseudomonas_Aeruginosa | LPS | Optuna:  14%|█▍        | 29/200 [40:25<3:35:25, 75.59s/it, best=0.867]Pseudomonas_Aeruginosa | LPS | Optuna:  14%|█▍        | 29/200 [40:25<3:35:25, 75.59s/it, best=0.867]/export/usuarios01/egarroyo/MALDI_for_AMR_prediction/venv/lib/python3.13/site-packages/sklearn/model_selection/_split.py:813: UserWarning: The least populated class in y has only 4 members, which is less than n_splits=5.
  warnings.warn(
[I 2026-02-28 02:45:40,213] Trial 4 finished with value: 0.9050666137971211 and parameters: {'activation': 'relu', 'solver': 'adam', 'lr': 1.7654048052495086e-05, 'layer1': 265, 'layer2': 278, 'layer3': 100}. Best is trial 2 with value: 0.9098413340470424.

Staphylococcus_Aureus | Fusidic acid | Optuna:   2%|▎         | 5/200 [04:49<3:12:07, 59.12s/it, best=0.91][A
Staphylococcus_Aureus | Fusidic acid | Optuna:   2%|▎         | 5/200 [04:49<3:12:07, 59.12s/it, best=0.91][A[I 2026-02-28 02:45:45,400] Trial 29 finished with value: 0.8255018342260501 and parameters: {'activation': 'logistic', 'solver': 'sgd', 'lr': 0.00021978384905758016, 'layer1': 302, 'layer2': 324, 'layer3': 332}. Best is trial 25 with value: 0.867275854165397.
Pseudomonas_Aeruginosa | LPS | Optuna:  15%|█▌        | 30/200 [40:47<2:48:38, 59.52s/it, best=0.867]Pseudomonas_Aeruginosa | LPS | Optuna:  15%|█▌        | 30/200 [40:47<2:48:38, 59.52s/it, best=0.867]/export/usuarios01/egarroyo/MALDI_for_AMR_prediction/venv/lib/python3.13/site-packages/sklearn/model_selection/_split.py:813: UserWarning: The least populated class in y has only 4 members, which is less than n_splits=5.
  warnings.warn(
[I 2026-02-28 02:46:00,327] Trial 86 finished with value: 0.7395288400527819 and parameters: {'activation': 'relu', 'solver': 'adam', 'lr': 0.008253700658679058, 'layer1': 421, 'layer2': 119, 'layer3': 265}. Best is trial 14 with value: 0.8971256036318559.

Escherichia_Coli | Ceftriaxone | Optuna:  44%|████▎     | 87/200 [3:36:01<4:46:46, 152.27s/it, best=0.897][A
Escherichia_Coli | Ceftriaxone | Optuna:  44%|████▎     | 87/200 [3:36:01<4:46:46, 152.27s/it, best=0.897][A[I 2026-02-28 02:46:44,400] Trial 178 finished with value: 0.9045440516560708 and parameters: {'activation': 'tanh', 'solver': 'adam', 'lr': 1.9100343049875382e-05, 'layer1': 218, 'layer2': 459, 'layer3': 426}. Best is trial 174 with value: 0.9115644647823175.

Klebsiella_Pneumoniae | Ceftriaxone | Optuna:  90%|████████▉ | 179/200 [5:56:05<49:42, 142.03s/it, best=0.912][A
Klebsiella_Pneumoniae | Ceftriaxone | Optuna:  90%|████████▉ | 179/200 [5:56:05<49:42, 142.03s/it, best=0.912][A[I 2026-02-28 02:46:49,547] Trial 87 finished with value: 0.7060702528857489 and parameters: {'activation': 'logistic', 'solver': 'adam', 'lr': 3.807488411629229e-05, 'layer1': 476, 'layer2': 12, 'layer3': 224}. Best is trial 14 with value: 0.8971256036318559.

Escherichia_Coli | Ceftriaxone | Optuna:  44%|████▍     | 88/200 [3:36:51<3:46:31, 121.35s/it, best=0.897][A
Escherichia_Coli | Ceftriaxone | Optuna:  44%|████▍     | 88/200 [3:36:51<3:46:31, 121.35s/it, best=0.897][A[I 2026-02-28 02:47:08,296] Trial 5 finished with value: 0.9048747977825542 and parameters: {'activation': 'identity', 'solver': 'adam', 'lr': 2.259279742015697e-06, 'layer1': 106, 'layer2': 32, 'layer3': 169}. Best is trial 2 with value: 0.9098413340470424.

Staphylococcus_Aureus | Fusidic acid | Optuna:   3%|▎         | 6/200 [06:17<3:42:59, 68.97s/it, best=0.91][A
Staphylococcus_Aureus | Fusidic acid | Optuna:   3%|▎         | 6/200 [06:17<3:42:59, 68.97s/it, best=0.91][A[I 2026-02-28 02:47:19,575] Trial 30 finished with value: 0.8516398140080501 and parameters: {'activation': 'identity', 'solver': 'adam', 'lr': 5.4404214334379085e-05, 'layer1': 366, 'layer2': 465, 'layer3': 212}. Best is trial 25 with value: 0.867275854165397.
Pseudomonas_Aeruginosa | LPS | Optuna:  16%|█▌        | 31/200 [42:21<3:16:55, 69.92s/it, best=0.867]Pseudomonas_Aeruginosa | LPS | Optuna:  16%|█▌        | 31/200 [42:21<3:16:55, 69.92s/it, best=0.867]/export/usuarios01/egarroyo/MALDI_for_AMR_prediction/venv/lib/python3.13/site-packages/sklearn/model_selection/_split.py:813: UserWarning: The least populated class in y has only 4 members, which is less than n_splits=5.
  warnings.warn(
[I 2026-02-28 02:48:46,430] Trial 179 finished with value: 0.9074428330158693 and parameters: {'activation': 'tanh', 'solver': 'adam', 'lr': 2.3143101642272417e-05, 'layer1': 228, 'layer2': 470, 'layer3': 437}. Best is trial 174 with value: 0.9115644647823175.

Klebsiella_Pneumoniae | Ceftriaxone | Optuna:  90%|█████████ | 180/200 [5:58:07<45:20, 136.03s/it, best=0.912][A
Klebsiella_Pneumoniae | Ceftriaxone | Optuna:  90%|█████████ | 180/200 [5:58:07<45:20, 136.03s/it, best=0.912][A[I 2026-02-28 02:48:58,931] Trial 31 finished with value: 0.8657239552944332 and parameters: {'activation': 'identity', 'solver': 'adam', 'lr': 0.000561796987701441, 'layer1': 362, 'layer2': 454, 'layer3': 377}. Best is trial 25 with value: 0.867275854165397.
Pseudomonas_Aeruginosa | LPS | Optuna:  16%|█▌        | 32/200 [44:00<3:40:29, 78.75s/it, best=0.867]Pseudomonas_Aeruginosa | LPS | Optuna:  16%|█▌        | 32/200 [44:00<3:40:29, 78.75s/it, best=0.867]/export/usuarios01/egarroyo/MALDI_for_AMR_prediction/venv/lib/python3.13/site-packages/sklearn/model_selection/_split.py:813: UserWarning: The least populated class in y has only 4 members, which is less than n_splits=5.
  warnings.warn(
[I 2026-02-28 02:49:46,789] Trial 88 finished with value: 0.8938182840736255 and parameters: {'activation': 'relu', 'solver': 'adam', 'lr': 6.488684142405256e-05, 'layer1': 435, 'layer2': 140, 'layer3': 18}. Best is trial 14 with value: 0.8971256036318559.

Escherichia_Coli | Ceftriaxone | Optuna:  44%|████▍     | 89/200 [3:39:48<4:15:31, 138.12s/it, best=0.897][A
Escherichia_Coli | Ceftriaxone | Optuna:  44%|████▍     | 89/200 [3:39:48<4:15:31, 138.12s/it, best=0.897][A[I 2026-02-28 02:50:57,914] Trial 6 finished with value: 0.9064965527349166 and parameters: {'activation': 'tanh', 'solver': 'adam', 'lr': 3.6618192203924288e-06, 'layer1': 403, 'layer2': 46, 'layer3': 494}. Best is trial 2 with value: 0.9098413340470424.

Staphylococcus_Aureus | Fusidic acid | Optuna:   4%|▎         | 7/200 [10:07<6:30:46, 121.49s/it, best=0.91][A
Staphylococcus_Aureus | Fusidic acid | Optuna:   4%|▎         | 7/200 [10:07<6:30:46, 121.49s/it, best=0.91][A[I 2026-02-28 02:51:05,570] Trial 32 finished with value: 0.8642404640923733 and parameters: {'activation': 'identity', 'solver': 'adam', 'lr': 0.0006719418872918788, 'layer1': 420, 'layer2': 291, 'layer3': 371}. Best is trial 25 with value: 0.867275854165397.
Pseudomonas_Aeruginosa | LPS | Optuna:  16%|█▋        | 33/200 [46:07<4:19:10, 93.12s/it, best=0.867]Pseudomonas_Aeruginosa | LPS | Optuna:  16%|█▋        | 33/200 [46:07<4:19:10, 93.12s/it, best=0.867]/export/usuarios01/egarroyo/MALDI_for_AMR_prediction/venv/lib/python3.13/site-packages/sklearn/model_selection/_split.py:813: UserWarning: The least populated class in y has only 4 members, which is less than n_splits=5.
  warnings.warn(
[I 2026-02-28 02:51:06,370] Trial 180 finished with value: 0.909068730096364 and parameters: {'activation': 'tanh', 'solver': 'adam', 'lr': 2.2289470041864348e-05, 'layer1': 232, 'layer2': 472, 'layer3': 441}. Best is trial 174 with value: 0.9115644647823175.

Klebsiella_Pneumoniae | Ceftriaxone | Optuna:  90%|█████████ | 181/200 [6:00:27<43:26, 137.20s/it, best=0.912][A
Klebsiella_Pneumoniae | Ceftriaxone | Optuna:  90%|█████████ | 181/200 [6:00:27<43:26, 137.20s/it, best=0.912][A[I 2026-02-28 02:51:45,110] Trial 89 finished with value: 0.8923167841816972 and parameters: {'activation': 'relu', 'solver': 'adam', 'lr': 0.00023153662619849696, 'layer1': 463, 'layer2': 64, 'layer3': 251}. Best is trial 14 with value: 0.8971256036318559.

Escherichia_Coli | Ceftriaxone | Optuna:  45%|████▌     | 90/200 [3:41:46<4:02:19, 132.18s/it, best=0.897][A
Escherichia_Coli | Ceftriaxone | Optuna:  45%|████▌     | 90/200 [3:41:46<4:02:19, 132.18s/it, best=0.897][A[I 2026-02-28 02:52:05,503] Trial 7 finished with value: 0.9236398141410307 and parameters: {'activation': 'relu', 'solver': 'adam', 'lr': 0.0012164139351417069, 'layer1': 46, 'layer2': 186, 'layer3': 66}. Best is trial 7 with value: 0.9236398141410307.

Staphylococcus_Aureus | Fusidic acid | Optuna:   4%|▍         | 8/200 [11:14<5:33:51, 104.33s/it, best=0.91][A
Staphylococcus_Aureus | Fusidic acid | Optuna:   4%|▍         | 8/200 [11:14<5:33:51, 104.33s/it, best=0.924][A[I 2026-02-28 02:52:45,105] Trial 33 finished with value: 0.866056949261394 and parameters: {'activation': 'identity', 'solver': 'adam', 'lr': 0.0017973502106468366, 'layer1': 292, 'layer2': 358, 'layer3': 469}. Best is trial 25 with value: 0.867275854165397.
Pseudomonas_Aeruginosa | LPS | Optuna:  17%|█▋        | 34/200 [47:47<4:22:56, 95.04s/it, best=0.867]Pseudomonas_Aeruginosa | LPS | Optuna:  17%|█▋        | 34/200 [47:47<4:22:56, 95.04s/it, best=0.867]/export/usuarios01/egarroyo/MALDI_for_AMR_prediction/venv/lib/python3.13/site-packages/sklearn/model_selection/_split.py:813: UserWarning: The least populated class in y has only 4 members, which is less than n_splits=5.
  warnings.warn(
[I 2026-02-28 02:53:36,734] Trial 181 finished with value: 0.9076209297513567 and parameters: {'activation': 'tanh', 'solver': 'adam', 'lr': 1.690401678128064e-05, 'layer1': 231, 'layer2': 471, 'layer3': 442}. Best is trial 174 with value: 0.9115644647823175.

Klebsiella_Pneumoniae | Ceftriaxone | Optuna:  91%|█████████ | 182/200 [6:02:58<42:20, 141.15s/it, best=0.912][A
Klebsiella_Pneumoniae | Ceftriaxone | Optuna:  91%|█████████ | 182/200 [6:02:58<42:20, 141.15s/it, best=0.912][A[I 2026-02-28 02:53:52,630] Trial 90 finished with value: 0.8881444094669428 and parameters: {'activation': 'identity', 'solver': 'adam', 'lr': 0.0003287620384135546, 'layer1': 412, 'layer2': 46, 'layer3': 494}. Best is trial 14 with value: 0.8971256036318559.

Escherichia_Coli | Ceftriaxone | Optuna:  46%|████▌     | 91/200 [3:43:54<3:57:35, 130.78s/it, best=0.897][A
Escherichia_Coli | Ceftriaxone | Optuna:  46%|████▌     | 91/200 [3:43:54<3:57:35, 130.78s/it, best=0.897][A[I 2026-02-28 02:54:14,529] Trial 8 finished with value: 0.9272321206408927 and parameters: {'activation': 'identity', 'solver': 'adam', 'lr': 0.000828752236376816, 'layer1': 323, 'layer2': 445, 'layer3': 241}. Best is trial 8 with value: 0.9272321206408927.

Staphylococcus_Aureus | Fusidic acid | Optuna:   4%|▍         | 9/200 [13:23<5:56:41, 112.05s/it, best=0.924][A
Staphylococcus_Aureus | Fusidic acid | Optuna:   4%|▍         | 9/200 [13:23<5:56:41, 112.05s/it, best=0.927][A[I 2026-02-28 02:54:25,662] Trial 34 finished with value: 0.8674293894305268 and parameters: {'activation': 'identity', 'solver': 'adam', 'lr': 0.0017284163186356573, 'layer1': 293, 'layer2': 355, 'layer3': 468}. Best is trial 34 with value: 0.8674293894305268.
Pseudomonas_Aeruginosa | LPS | Optuna:  18%|█▊        | 35/200 [49:27<4:25:54, 96.70s/it, best=0.867]Pseudomonas_Aeruginosa | LPS | Optuna:  18%|█▊        | 35/200 [49:27<4:25:54, 96.70s/it, best=0.867]/export/usuarios01/egarroyo/MALDI_for_AMR_prediction/venv/lib/python3.13/site-packages/sklearn/model_selection/_split.py:813: UserWarning: The least populated class in y has only 4 members, which is less than n_splits=5.
  warnings.warn(
[I 2026-02-28 02:55:37,041] Trial 9 finished with value: 0.7258647813949078 and parameters: {'activation': 'tanh', 'solver': 'sgd', 'lr': 0.00012329098365270507, 'layer1': 219, 'layer2': 22, 'layer3': 62}. Best is trial 8 with value: 0.9272321206408927.

Staphylococcus_Aureus | Fusidic acid | Optuna:   5%|▌         | 10/200 [14:46<5:25:56, 102.93s/it, best=0.927][A
Staphylococcus_Aureus | Fusidic acid | Optuna:   5%|▌         | 10/200 [14:46<5:25:56, 102.93s/it, best=0.927][A[I 2026-02-28 02:55:43,151] Trial 35 finished with value: 0.8527771461032483 and parameters: {'activation': 'logistic', 'solver': 'adam', 'lr': 0.0023086656486752608, 'layer1': 286, 'layer2': 345, 'layer3': 475}. Best is trial 34 with value: 0.8674293894305268.
Pseudomonas_Aeruginosa | LPS | Optuna:  18%|█▊        | 36/200 [50:45<4:08:33, 90.93s/it, best=0.867]Pseudomonas_Aeruginosa | LPS | Optuna:  18%|█▊        | 36/200 [50:45<4:08:33, 90.93s/it, best=0.867]/export/usuarios01/egarroyo/MALDI_for_AMR_prediction/venv/lib/python3.13/site-packages/sklearn/model_selection/_split.py:813: UserWarning: The least populated class in y has only 4 members, which is less than n_splits=5.
  warnings.warn(
[I 2026-02-28 02:55:56,677] Trial 182 finished with value: 0.9039924748511339 and parameters: {'activation': 'tanh', 'solver': 'adam', 'lr': 1.6602693401584677e-05, 'layer1': 245, 'layer2': 455, 'layer3': 442}. Best is trial 174 with value: 0.9115644647823175.

Klebsiella_Pneumoniae | Ceftriaxone | Optuna:  92%|█████████▏| 183/200 [6:05:18<39:53, 140.79s/it, best=0.912][A
Klebsiella_Pneumoniae | Ceftriaxone | Optuna:  92%|█████████▏| 183/200 [6:05:18<39:53, 140.79s/it, best=0.912][A[I 2026-02-28 02:56:20,991] Trial 10 finished with value: 0.9063779921847468 and parameters: {'activation': 'identity', 'solver': 'sgd', 'lr': 0.007553503645583194, 'layer1': 366, 'layer2': 492, 'layer3': 320}. Best is trial 8 with value: 0.9272321206408927.

Staphylococcus_Aureus | Fusidic acid | Optuna:   6%|▌         | 11/200 [15:30<4:27:22, 84.88s/it, best=0.927] [A
Staphylococcus_Aureus | Fusidic acid | Optuna:   6%|▌         | 11/200 [15:30<4:27:22, 84.88s/it, best=0.927][A[I 2026-02-28 02:56:34,825] Trial 91 finished with value: 0.8958904374207617 and parameters: {'activation': 'relu', 'solver': 'adam', 'lr': 5.440846691872911e-05, 'layer1': 486, 'layer2': 95, 'layer3': 171}. Best is trial 14 with value: 0.8971256036318559.

Escherichia_Coli | Ceftriaxone | Optuna:  46%|████▌     | 92/200 [3:46:36<4:12:22, 140.21s/it, best=0.897][A
Escherichia_Coli | Ceftriaxone | Optuna:  46%|████▌     | 92/200 [3:46:36<4:12:22, 140.21s/it, best=0.897][A[I 2026-02-28 02:56:35,455] Trial 36 finished with value: 0.8598048022433344 and parameters: {'activation': 'relu', 'solver': 'adam', 'lr': 0.0014170993752361523, 'layer1': 205, 'layer2': 305, 'layer3': 462}. Best is trial 34 with value: 0.8674293894305268.
Pseudomonas_Aeruginosa | LPS | Optuna:  18%|█▊        | 37/200 [51:37<3:35:33, 79.34s/it, best=0.867]Pseudomonas_Aeruginosa | LPS | Optuna:  18%|█▊        | 37/200 [51:37<3:35:33, 79.34s/it, best=0.867]/export/usuarios01/egarroyo/MALDI_for_AMR_prediction/venv/lib/python3.13/site-packages/sklearn/model_selection/_split.py:813: UserWarning: The least populated class in y has only 4 members, which is less than n_splits=5.
  warnings.warn(
[I 2026-02-28 02:58:01,551] Trial 11 finished with value: 0.9235704643793483 and parameters: {'activation': 'relu', 'solver': 'adam', 'lr': 0.0013124793805688133, 'layer1': 150, 'layer2': 163, 'layer3': 284}. Best is trial 8 with value: 0.9272321206408927.

Staphylococcus_Aureus | Fusidic acid | Optuna:   6%|▌         | 12/200 [17:10<4:40:54, 89.65s/it, best=0.927][A
Staphylococcus_Aureus | Fusidic acid | Optuna:   6%|▌         | 12/200 [17:10<4:40:54, 89.65s/it, best=0.927][A[I 2026-02-28 02:58:03,504] Trial 37 finished with value: 0.8583244497662775 and parameters: {'activation': 'identity', 'solver': 'adam', 'lr': 0.009526589964577283, 'layer1': 252, 'layer2': 360, 'layer3': 476}. Best is trial 34 with value: 0.8674293894305268.
Pseudomonas_Aeruginosa | LPS | Optuna:  19%|█▉        | 38/200 [53:05<3:41:16, 81.96s/it, best=0.867]Pseudomonas_Aeruginosa | LPS | Optuna:  19%|█▉        | 38/200 [53:05<3:41:16, 81.96s/it, best=0.867]/export/usuarios01/egarroyo/MALDI_for_AMR_prediction/venv/lib/python3.13/site-packages/sklearn/model_selection/_split.py:813: UserWarning: The least populated class in y has only 4 members, which is less than n_splits=5.
  warnings.warn(
[I 2026-02-28 02:58:29,805] Trial 38 finished with value: 0.8274290968863383 and parameters: {'activation': 'identity', 'solver': 'sgd', 'lr': 0.0012071409495877216, 'layer1': 176, 'layer2': 265, 'layer3': 432}. Best is trial 34 with value: 0.8674293894305268.
Pseudomonas_Aeruginosa | LPS | Optuna:  20%|█▉        | 39/200 [53:31<2:55:06, 65.26s/it, best=0.867]Pseudomonas_Aeruginosa | LPS | Optuna:  20%|█▉        | 39/200 [53:31<2:55:06, 65.26s/it, best=0.867]/export/usuarios01/egarroyo/MALDI_for_AMR_prediction/venv/lib/python3.13/site-packages/sklearn/model_selection/_split.py:813: UserWarning: The least populated class in y has only 4 members, which is less than n_splits=5.
  warnings.warn(
[I 2026-02-28 02:58:41,926] Trial 183 finished with value: 0.9048637202435155 and parameters: {'activation': 'tanh', 'solver': 'adam', 'lr': 9.679564806840503e-06, 'layer1': 240, 'layer2': 478, 'layer3': 418}. Best is trial 174 with value: 0.9115644647823175.

Klebsiella_Pneumoniae | Ceftriaxone | Optuna:  92%|█████████▏| 184/200 [6:08:03<39:30, 148.13s/it, best=0.912][A
Klebsiella_Pneumoniae | Ceftriaxone | Optuna:  92%|█████████▏| 184/200 [6:08:03<39:30, 148.13s/it, best=0.912][A[I 2026-02-28 02:59:34,128] Trial 12 finished with value: 0.9209040229824357 and parameters: {'activation': 'identity', 'solver': 'adam', 'lr': 0.00046544039809979403, 'layer1': 347, 'layer2': 434, 'layer3': 419}. Best is trial 8 with value: 0.9272321206408927.

Staphylococcus_Aureus | Fusidic acid | Optuna:   6%|▋         | 13/200 [18:43<4:42:10, 90.54s/it, best=0.927][A
Staphylococcus_Aureus | Fusidic acid | Optuna:   6%|▋         | 13/200 [18:43<4:42:10, 90.54s/it, best=0.927][A[I 2026-02-28 03:00:09,140] Trial 39 finished with value: 0.8631551298722513 and parameters: {'activation': 'relu', 'solver': 'adam', 'lr': 0.004279202950225311, 'layer1': 244, 'layer2': 310, 'layer3': 149}. Best is trial 34 with value: 0.8674293894305268.
Pseudomonas_Aeruginosa | LPS | Optuna:  20%|██        | 40/200 [55:11<3:21:17, 75.48s/it, best=0.867]Pseudomonas_Aeruginosa | LPS | Optuna:  20%|██        | 40/200 [55:11<3:21:17, 75.48s/it, best=0.867]/export/usuarios01/egarroyo/MALDI_for_AMR_prediction/venv/lib/python3.13/site-packages/sklearn/model_selection/_split.py:813: UserWarning: The least populated class in y has only 4 members, which is less than n_splits=5.
  warnings.warn(
[I 2026-02-28 03:00:37,054] Trial 92 finished with value: 0.8951650416504282 and parameters: {'activation': 'relu', 'solver': 'adam', 'lr': 2.4206312492166592e-05, 'layer1': 479, 'layer2': 106, 'layer3': 198}. Best is trial 14 with value: 0.8971256036318559.

Escherichia_Coli | Ceftriaxone | Optuna:  46%|████▋     | 93/200 [3:50:38<5:04:36, 170.81s/it, best=0.897][A
Escherichia_Coli | Ceftriaxone | Optuna:  46%|████▋     | 93/200 [3:50:38<5:04:36, 170.81s/it, best=0.897][A[I 2026-02-28 03:00:57,811] Trial 184 finished with value: 0.9065132266950103 and parameters: {'activation': 'tanh', 'solver': 'adam', 'lr': 2.0059186963543235e-05, 'layer1': 227, 'layer2': 467, 'layer3': 448}. Best is trial 174 with value: 0.9115644647823175.

Klebsiella_Pneumoniae | Ceftriaxone | Optuna:  92%|█████████▎| 185/200 [6:10:19<36:06, 144.45s/it, best=0.912][A
Klebsiella_Pneumoniae | Ceftriaxone | Optuna:  92%|█████████▎| 185/200 [6:10:19<36:06, 144.45s/it, best=0.912][A[I 2026-02-28 03:01:00,884] Trial 40 finished with value: 0.8441769700352371 and parameters: {'activation': 'tanh', 'solver': 'adam', 'lr': 0.003987404849858682, 'layer1': 289, 'layer2': 223, 'layer3': 294}. Best is trial 34 with value: 0.8674293894305268.
Pseudomonas_Aeruginosa | LPS | Optuna:  20%|██        | 41/200 [56:02<3:01:09, 68.36s/it, best=0.867]Pseudomonas_Aeruginosa | LPS | Optuna:  20%|██        | 41/200 [56:02<3:01:09, 68.36s/it, best=0.867]/export/usuarios01/egarroyo/MALDI_for_AMR_prediction/venv/lib/python3.13/site-packages/sklearn/model_selection/_split.py:813: UserWarning: The least populated class in y has only 4 members, which is less than n_splits=5.
  warnings.warn(
[I 2026-02-28 03:01:56,649] Trial 13 finished with value: 0.9252775259404944 and parameters: {'activation': 'relu', 'solver': 'adam', 'lr': 0.00214516912368351, 'layer1': 494, 'layer2': 157, 'layer3': 209}. Best is trial 8 with value: 0.9272321206408927.

Staphylococcus_Aureus | Fusidic acid | Optuna:   7%|▋         | 14/200 [21:05<5:29:20, 106.24s/it, best=0.927][A
Staphylococcus_Aureus | Fusidic acid | Optuna:   7%|▋         | 14/200 [21:05<5:29:20, 106.24s/it, best=0.927][A[I 2026-02-28 03:02:40,594] Trial 14 finished with value: 0.9050666137971211 and parameters: {'activation': 'relu', 'solver': 'adam', 'lr': 0.008909399584034763, 'layer1': 499, 'layer2': 129, 'layer3': 212}. Best is trial 8 with value: 0.9272321206408927.

Staphylococcus_Aureus | Fusidic acid | Optuna:   8%|▊         | 15/200 [21:49<4:29:40, 87.46s/it, best=0.927] [A
Staphylococcus_Aureus | Fusidic acid | Optuna:   8%|▊         | 15/200 [21:49<4:29:40, 87.46s/it, best=0.927][A[I 2026-02-28 03:02:41,990] Trial 185 finished with value: 0.907972707034272 and parameters: {'activation': 'tanh', 'solver': 'adam', 'lr': 2.454577181963116e-05, 'layer1': 182, 'layer2': 447, 'layer3': 191}. Best is trial 174 with value: 0.9115644647823175.

Klebsiella_Pneumoniae | Ceftriaxone | Optuna:  93%|█████████▎| 186/200 [6:12:03<30:53, 132.37s/it, best=0.912][A
