Escherichia_Coli | Ciprofloxacin | Optuna:  57%|█████▋    | 114/200 [4:38:23<2:44:46, 114.96s/it, best=0.808][A[I 2026-02-27 19:25:57,899] Trial 147 finished with value: 0.8171665006726057 and parameters: {'activation': 'identity', 'solver': 'adam', 'lr': 7.24694790315522e-05, 'layer1': 317, 'layer2': 477, 'layer3': 220}. Best is trial 91 with value: 0.8315336183309556.

Klebsiella_Pneumoniae | Ciprofloxacin | Optuna:  74%|███████▍  | 148/200 [4:38:27<1:39:25, 114.73s/it, best=0.832][A
Klebsiella_Pneumoniae | Ciprofloxacin | Optuna:  74%|███████▍  | 148/200 [4:38:27<1:39:25, 114.73s/it, best=0.832][A[I 2026-02-27 19:26:09,623] Trial 63 finished with value: 0.8630602874834924 and parameters: {'activation': 'relu', 'solver': 'adam', 'lr': 0.0024077967558492823, 'layer1': 165, 'layer2': 191, 'layer3': 54}. Best is trial 42 with value: 0.8645324176837453.

Pseudomonas_Aeruginosa | Imipenem | Optuna:  32%|███▏      | 64/200 [54:03<2:04:51, 55.09s/it, best=0.865][A
Pseudomonas_Aeruginosa | Imipenem | Optuna:  32%|███▏      | 64/200 [54:03<2:04:51, 55.09s/it, best=0.865][A[I 2026-02-27 19:26:38,719] Trial 127 finished with value: 0.9057557060367968 and parameters: {'activation': 'identity', 'solver': 'adam', 'lr': 0.0006150122510037396, 'layer1': 357, 'layer2': 446, 'layer3': 480}. Best is trial 84 with value: 0.9099428178723615.

Staphylococcus_Aureus | Oxacillin | Optuna:  64%|██████▍   | 128/200 [4:39:08<2:27:37, 123.03s/it, best=0.91][A
Staphylococcus_Aureus | Oxacillin | Optuna:  64%|██████▍   | 128/200 [4:39:08<2:27:37, 123.03s/it, best=0.91][A[I 2026-02-27 19:27:06,770] Trial 64 finished with value: 0.8612757481527835 and parameters: {'activation': 'relu', 'solver': 'adam', 'lr': 0.0003852745457734411, 'layer1': 169, 'layer2': 472, 'layer3': 46}. Best is trial 42 with value: 0.8645324176837453.

Pseudomonas_Aeruginosa | Imipenem | Optuna:  32%|███▎      | 65/200 [55:00<2:05:20, 55.70s/it, best=0.865][A
Pseudomonas_Aeruginosa | Imipenem | Optuna:  32%|███▎      | 65/200 [55:00<2:05:20, 55.70s/it, best=0.865][A[I 2026-02-27 19:27:30,241] Trial 114 finished with value: 0.8048469085230681 and parameters: {'activation': 'tanh', 'solver': 'adam', 'lr': 4.8171645046993416e-05, 'layer1': 122, 'layer2': 296, 'layer3': 53}. Best is trial 107 with value: 0.8083747566869277.

Escherichia_Coli | Ciprofloxacin | Optuna:  57%|█████▊    | 115/200 [4:39:59<2:34:50, 109.30s/it, best=0.808][A
Escherichia_Coli | Ciprofloxacin | Optuna:  57%|█████▊    | 115/200 [4:39:59<2:34:50, 109.30s/it, best=0.808][A[I 2026-02-27 19:28:10,010] Trial 148 finished with value: 0.8170675937048305 and parameters: {'activation': 'identity', 'solver': 'adam', 'lr': 2.452150525925402e-05, 'layer1': 344, 'layer2': 443, 'layer3': 211}. Best is trial 91 with value: 0.8315336183309556.

Klebsiella_Pneumoniae | Ciprofloxacin | Optuna:  74%|███████▍  | 149/200 [4:40:39<1:41:57, 119.94s/it, best=0.832][A
Klebsiella_Pneumoniae | Ciprofloxacin | Optuna:  74%|███████▍  | 149/200 [4:40:39<1:41:57, 119.94s/it, best=0.832][A[I 2026-02-27 19:28:11,614] Trial 65 finished with value: 0.8631468687429076 and parameters: {'activation': 'relu', 'solver': 'adam', 'lr': 0.0020489858395765334, 'layer1': 497, 'layer2': 180, 'layer3': 55}. Best is trial 42 with value: 0.8645324176837453.

Pseudomonas_Aeruginosa | Imipenem | Optuna:  33%|███▎      | 66/200 [56:05<2:10:31, 58.45s/it, best=0.865][A
Pseudomonas_Aeruginosa | Imipenem | Optuna:  33%|███▎      | 66/200 [56:05<2:10:31, 58.45s/it, best=0.865][A[I 2026-02-27 19:28:34,250] Trial 128 finished with value: 0.9010830631223647 and parameters: {'activation': 'relu', 'solver': 'adam', 'lr': 0.0003248285115363132, 'layer1': 273, 'layer2': 400, 'layer3': 388}. Best is trial 84 with value: 0.9099428178723615.

Staphylococcus_Aureus | Oxacillin | Optuna:  64%|██████▍   | 129/200 [4:41:03<2:22:55, 120.78s/it, best=0.91][A
Staphylococcus_Aureus | Oxacillin | Optuna:  64%|██████▍   | 129/200 [4:41:03<2:22:55, 120.78s/it, best=0.91][A[I 2026-02-27 19:29:04,533] Trial 66 finished with value: 0.8598132036205758 and parameters: {'activation': 'relu', 'solver': 'adam', 'lr': 0.0027390935242307735, 'layer1': 238, 'layer2': 189, 'layer3': 29}. Best is trial 42 with value: 0.8645324176837453.

Pseudomonas_Aeruginosa | Imipenem | Optuna:  34%|███▎      | 67/200 [56:58<2:05:52, 56.79s/it, best=0.865][A
Pseudomonas_Aeruginosa | Imipenem | Optuna:  34%|███▎      | 67/200 [56:58<2:05:52, 56.79s/it, best=0.865][A[I 2026-02-27 19:30:00,541] Trial 115 finished with value: 0.8007389793787951 and parameters: {'activation': 'tanh', 'solver': 'adam', 'lr': 2.0362265258640664e-05, 'layer1': 154, 'layer2': 344, 'layer3': 238}. Best is trial 107 with value: 0.8083747566869277.

Escherichia_Coli | Ciprofloxacin | Optuna:  58%|█████▊    | 116/200 [4:42:29<2:50:14, 121.60s/it, best=0.808][A
Escherichia_Coli | Ciprofloxacin | Optuna:  58%|█████▊    | 116/200 [4:42:29<2:50:14, 121.60s/it, best=0.808][A[I 2026-02-27 19:30:22,202] Trial 67 finished with value: 0.8605610169547686 and parameters: {'activation': 'relu', 'solver': 'adam', 'lr': 0.001932772256521366, 'layer1': 500, 'layer2': 199, 'layer3': 56}. Best is trial 42 with value: 0.8645324176837453.

Pseudomonas_Aeruginosa | Imipenem | Optuna:  34%|███▍      | 68/200 [58:16<2:18:42, 63.05s/it, best=0.865][A
Pseudomonas_Aeruginosa | Imipenem | Optuna:  34%|███▍      | 68/200 [58:16<2:18:42, 63.05s/it, best=0.865][A[I 2026-02-27 19:30:49,019] Trial 149 finished with value: 0.8283525007789094 and parameters: {'activation': 'identity', 'solver': 'adam', 'lr': 3.619692741868754e-05, 'layer1': 329, 'layer2': 483, 'layer3': 195}. Best is trial 91 with value: 0.8315336183309556.

Klebsiella_Pneumoniae | Ciprofloxacin | Optuna:  75%|███████▌  | 150/200 [4:43:18<1:49:43, 131.66s/it, best=0.832][A
Klebsiella_Pneumoniae | Ciprofloxacin | Optuna:  75%|███████▌  | 150/200 [4:43:18<1:49:43, 131.66s/it, best=0.832][A[I 2026-02-27 19:30:59,615] Trial 129 finished with value: 0.9079707024453443 and parameters: {'activation': 'identity', 'solver': 'adam', 'lr': 0.00013280625465490246, 'layer1': 310, 'layer2': 371, 'layer3': 369}. Best is trial 84 with value: 0.9099428178723615.

Staphylococcus_Aureus | Oxacillin | Optuna:  65%|██████▌   | 130/200 [4:43:29<2:29:30, 128.15s/it, best=0.91][A
Staphylococcus_Aureus | Oxacillin | Optuna:  65%|██████▌   | 130/200 [4:43:29<2:29:30, 128.15s/it, best=0.91][A[I 2026-02-27 19:31:16,266] Trial 68 finished with value: 0.8581054878265888 and parameters: {'activation': 'relu', 'solver': 'adam', 'lr': 0.007208775567363564, 'layer1': 138, 'layer2': 262, 'layer3': 11}. Best is trial 42 with value: 0.8645324176837453.

Pseudomonas_Aeruginosa | Imipenem | Optuna:  34%|███▍      | 69/200 [59:10<2:11:46, 60.36s/it, best=0.865][A
Pseudomonas_Aeruginosa | Imipenem | Optuna:  34%|███▍      | 69/200 [59:10<2:11:46, 60.36s/it, best=0.865][A[I 2026-02-27 19:32:03,127] Trial 69 finished with value: 0.8435760808772855 and parameters: {'activation': 'tanh', 'solver': 'adam', 'lr': 0.004139872698968241, 'layer1': 480, 'layer2': 172, 'layer3': 75}. Best is trial 42 with value: 0.8645324176837453.

Pseudomonas_Aeruginosa | Imipenem | Optuna:  35%|███▌      | 70/200 [59:57<2:01:59, 56.31s/it, best=0.865][A
Pseudomonas_Aeruginosa | Imipenem | Optuna:  35%|███▌      | 70/200 [59:57<2:01:59, 56.31s/it, best=0.865][A[I 2026-02-27 19:32:16,866] Trial 70 finished with value: 0.8175565662034809 and parameters: {'activation': 'relu', 'solver': 'sgd', 'lr': 0.002418355498976982, 'layer1': 79, 'layer2': 148, 'layer3': 39}. Best is trial 42 with value: 0.8645324176837453.

Pseudomonas_Aeruginosa | Imipenem | Optuna:  36%|███▌      | 71/200 [1:00:11<1:33:36, 43.54s/it, best=0.865][A
Pseudomonas_Aeruginosa | Imipenem | Optuna:  36%|███▌      | 71/200 [1:00:11<1:33:36, 43.54s/it, best=0.865][A[I 2026-02-27 19:33:00,940] Trial 150 finished with value: 0.8239867512792391 and parameters: {'activation': 'identity', 'solver': 'adam', 'lr': 3.657623327098286e-05, 'layer1': 325, 'layer2': 484, 'layer3': 194}. Best is trial 91 with value: 0.8315336183309556.

Klebsiella_Pneumoniae | Ciprofloxacin | Optuna:  76%|███████▌  | 151/200 [4:45:30<1:47:35, 131.74s/it, best=0.832][A
Klebsiella_Pneumoniae | Ciprofloxacin | Optuna:  76%|███████▌  | 151/200 [4:45:30<1:47:35, 131.74s/it, best=0.832][A[I 2026-02-27 19:33:17,958] Trial 130 finished with value: 0.9083317534288821 and parameters: {'activation': 'identity', 'solver': 'adam', 'lr': 0.0008247223722680527, 'layer1': 322, 'layer2': 458, 'layer3': 402}. Best is trial 84 with value: 0.9099428178723615.

Staphylococcus_Aureus | Oxacillin | Optuna:  66%|██████▌   | 131/200 [4:45:47<2:30:53, 131.21s/it, best=0.91][A
Staphylococcus_Aureus | Oxacillin | Optuna:  66%|██████▌   | 131/200 [4:45:47<2:30:53, 131.21s/it, best=0.91][A[I 2026-02-27 19:33:27,714] Trial 71 finished with value: 0.8631689524920562 and parameters: {'activation': 'relu', 'solver': 'adam', 'lr': 0.0015367127486343394, 'layer1': 425, 'layer2': 237, 'layer3': 118}. Best is trial 42 with value: 0.8645324176837453.

Pseudomonas_Aeruginosa | Imipenem | Optuna:  36%|███▌      | 72/200 [1:01:21<1:50:21, 51.73s/it, best=0.865][A
Pseudomonas_Aeruginosa | Imipenem | Optuna:  36%|███▌      | 72/200 [1:01:21<1:50:21, 51.73s/it, best=0.865][A[I 2026-02-27 19:33:48,169] Trial 116 finished with value: 0.8037487310335223 and parameters: {'activation': 'tanh', 'solver': 'adam', 'lr': 1.1294902652380324e-05, 'layer1': 190, 'layer2': 323, 'layer3': 79}. Best is trial 107 with value: 0.8083747566869277.

Escherichia_Coli | Ciprofloxacin | Optuna:  58%|█████▊    | 117/200 [4:46:17<3:32:13, 153.41s/it, best=0.808][A
Escherichia_Coli | Ciprofloxacin | Optuna:  58%|█████▊    | 117/200 [4:46:17<3:32:13, 153.41s/it, best=0.808][A[I 2026-02-27 19:34:31,603] Trial 72 finished with value: 0.85960554842035 and parameters: {'activation': 'relu', 'solver': 'adam', 'lr': 0.0032757034137163177, 'layer1': 190, 'layer2': 232, 'layer3': 86}. Best is trial 42 with value: 0.8645324176837453.

Pseudomonas_Aeruginosa | Imipenem | Optuna:  36%|███▋      | 73/200 [1:02:25<1:57:12, 55.38s/it, best=0.865][A
Pseudomonas_Aeruginosa | Imipenem | Optuna:  36%|███▋      | 73/200 [1:02:25<1:57:12, 55.38s/it, best=0.865][A[I 2026-02-27 19:35:17,051] Trial 73 finished with value: 0.8588223222653351 and parameters: {'activation': 'relu', 'solver': 'adam', 'lr': 0.0016528263429154374, 'layer1': 226, 'layer2': 251, 'layer3': 112}. Best is trial 42 with value: 0.8645324176837453.

Pseudomonas_Aeruginosa | Imipenem | Optuna:  37%|███▋      | 74/200 [1:03:11<1:50:02, 52.40s/it, best=0.865][A
Pseudomonas_Aeruginosa | Imipenem | Optuna:  37%|███▋      | 74/200 [1:03:11<1:50:02, 52.40s/it, best=0.865][A[I 2026-02-27 19:35:25,061] Trial 151 finished with value: 0.8267681050624823 and parameters: {'activation': 'identity', 'solver': 'adam', 'lr': 2.97123943314703e-05, 'layer1': 304, 'layer2': 458, 'layer3': 228}. Best is trial 91 with value: 0.8315336183309556.

Klebsiella_Pneumoniae | Ciprofloxacin | Optuna:  76%|███████▌  | 152/200 [4:47:54<1:48:21, 135.45s/it, best=0.832][A
Klebsiella_Pneumoniae | Ciprofloxacin | Optuna:  76%|███████▌  | 152/200 [4:47:54<1:48:21, 135.45s/it, best=0.832][A[I 2026-02-27 19:35:39,431] Trial 131 finished with value: 0.9080918288769908 and parameters: {'activation': 'identity', 'solver': 'adam', 'lr': 0.00024522003908705747, 'layer1': 340, 'layer2': 429, 'layer3': 426}. Best is trial 84 with value: 0.9099428178723615.

Staphylococcus_Aureus | Oxacillin | Optuna:  66%|██████▌   | 132/200 [4:48:09<2:32:11, 134.29s/it, best=0.91][A
Staphylococcus_Aureus | Oxacillin | Optuna:  66%|██████▌   | 132/200 [4:48:09<2:32:11, 134.29s/it, best=0.91][A[I 2026-02-27 19:36:06,739] Trial 74 finished with value: 0.8623571695359852 and parameters: {'activation': 'relu', 'solver': 'adam', 'lr': 0.0010076761944804668, 'layer1': 174, 'layer2': 180, 'layer3': 70}. Best is trial 42 with value: 0.8645324176837453.

Pseudomonas_Aeruginosa | Imipenem | Optuna:  38%|███▊      | 75/200 [1:04:00<1:47:28, 51.59s/it, best=0.865][A
Pseudomonas_Aeruginosa | Imipenem | Optuna:  38%|███▊      | 75/200 [1:04:00<1:47:28, 51.59s/it, best=0.865][A[I 2026-02-27 19:36:40,799] Trial 117 finished with value: 0.7972001095862076 and parameters: {'activation': 'logistic', 'solver': 'adam', 'lr': 7.037359608591428e-05, 'layer1': 104, 'layer2': 310, 'layer3': 195}. Best is trial 107 with value: 0.8083747566869277.

Escherichia_Coli | Ciprofloxacin | Optuna:  59%|█████▉    | 118/200 [4:49:10<3:37:32, 159.18s/it, best=0.808][A
Escherichia_Coli | Ciprofloxacin | Optuna:  59%|█████▉    | 118/200 [4:49:10<3:37:32, 159.18s/it, best=0.808][A[I 2026-02-27 19:37:12,154] Trial 75 finished with value: 0.8578517192786281 and parameters: {'activation': 'identity', 'solver': 'adam', 'lr': 0.004859116209699331, 'layer1': 158, 'layer2': 216, 'layer3': 127}. Best is trial 42 with value: 0.8645324176837453.

Pseudomonas_Aeruginosa | Imipenem | Optuna:  38%|███▊      | 76/200 [1:05:06<1:55:11, 55.73s/it, best=0.865][A
Pseudomonas_Aeruginosa | Imipenem | Optuna:  38%|███▊      | 76/200 [1:05:06<1:55:11, 55.73s/it, best=0.865][A[I 2026-02-27 19:37:53,988] Trial 152 finished with value: 0.8266340267793651 and parameters: {'activation': 'identity', 'solver': 'adam', 'lr': 4.063259932848033e-05, 'layer1': 337, 'layer2': 471, 'layer3': 181}. Best is trial 91 with value: 0.8315336183309556.

Klebsiella_Pneumoniae | Ciprofloxacin | Optuna:  76%|███████▋  | 153/200 [4:50:23<1:49:16, 139.50s/it, best=0.832][A
Klebsiella_Pneumoniae | Ciprofloxacin | Optuna:  76%|███████▋  | 153/200 [4:50:23<1:49:16, 139.50s/it, best=0.832][A[I 2026-02-27 19:38:05,481] Trial 76 finished with value: 0.8588062680070481 and parameters: {'activation': 'logistic', 'solver': 'adam', 'lr': 0.0011377785608738655, 'layer1': 319, 'layer2': 294, 'layer3': 93}. Best is trial 42 with value: 0.8645324176837453.

Pseudomonas_Aeruginosa | Imipenem | Optuna:  38%|███▊      | 77/200 [1:05:59<1:52:46, 55.01s/it, best=0.865][A
Pseudomonas_Aeruginosa | Imipenem | Optuna:  38%|███▊      | 77/200 [1:05:59<1:52:46, 55.01s/it, best=0.865][A[I 2026-02-27 19:38:15,566] Trial 132 finished with value: 0.9078551295968886 and parameters: {'activation': 'identity', 'solver': 'adam', 'lr': 0.00038556669510626237, 'layer1': 348, 'layer2': 419, 'layer3': 444}. Best is trial 84 with value: 0.9099428178723615.

Staphylococcus_Aureus | Oxacillin | Optuna:  66%|██████▋   | 133/200 [4:50:45<2:37:16, 140.84s/it, best=0.91][A
Staphylococcus_Aureus | Oxacillin | Optuna:  66%|██████▋   | 133/200 [4:50:45<2:37:16, 140.84s/it, best=0.91][A[I 2026-02-27 19:39:02,413] Trial 77 finished with value: 0.8624398389112553 and parameters: {'activation': 'relu', 'solver': 'adam', 'lr': 0.002124716999267452, 'layer1': 261, 'layer2': 208, 'layer3': 53}. Best is trial 42 with value: 0.8645324176837453.

Pseudomonas_Aeruginosa | Imipenem | Optuna:  39%|███▉      | 78/200 [1:06:56<1:53:01, 55.59s/it, best=0.865][A
Pseudomonas_Aeruginosa | Imipenem | Optuna:  39%|███▉      | 78/200 [1:06:56<1:53:01, 55.59s/it, best=0.865][A[I 2026-02-27 19:39:02,803] Trial 118 finished with value: 0.8063235604668622 and parameters: {'activation': 'tanh', 'solver': 'adam', 'lr': 3.149336574958707e-05, 'layer1': 272, 'layer2': 279, 'layer3': 39}. Best is trial 107 with value: 0.8083747566869277.

Escherichia_Coli | Ciprofloxacin | Optuna:  60%|█████▉    | 119/200 [4:51:32<3:27:55, 154.02s/it, best=0.808][A
Escherichia_Coli | Ciprofloxacin | Optuna:  60%|█████▉    | 119/200 [4:51:32<3:27:55, 154.02s/it, best=0.808][A[I 2026-02-27 19:40:05,079] Trial 153 finished with value: 0.8254455218282427 and parameters: {'activation': 'identity', 'solver': 'adam', 'lr': 5.3927022522103323e-05, 'layer1': 314, 'layer2': 487, 'layer3': 199}. Best is trial 91 with value: 0.8315336183309556.

Klebsiella_Pneumoniae | Ciprofloxacin | Optuna:  77%|███████▋  | 154/200 [4:52:34<1:45:00, 136.98s/it, best=0.832][A
Klebsiella_Pneumoniae | Ciprofloxacin | Optuna:  77%|███████▋  | 154/200 [4:52:34<1:45:00, 136.98s/it, best=0.832][A[I 2026-02-27 19:40:05,107] Trial 78 finished with value: 0.8485102665301177 and parameters: {'activation': 'relu', 'solver': 'adam', 'lr': 0.00597024271341183, 'layer1': 439, 'layer2': 242, 'layer3': 83}. Best is trial 42 with value: 0.8645324176837453.

Pseudomonas_Aeruginosa | Imipenem | Optuna:  40%|███▉      | 79/200 [1:07:59<1:56:24, 57.72s/it, best=0.865][A
Pseudomonas_Aeruginosa | Imipenem | Optuna:  40%|███▉      | 79/200 [1:07:59<1:56:24, 57.72s/it, best=0.865][A[I 2026-02-27 19:40:28,047] Trial 133 finished with value: 0.90581360323753 and parameters: {'activation': 'identity', 'solver': 'adam', 'lr': 0.00021308294717134701, 'layer1': 361, 'layer2': 393, 'layer3': 477}. Best is trial 84 with value: 0.9099428178723615.

Staphylococcus_Aureus | Oxacillin | Optuna:  67%|██████▋   | 134/200 [4:52:57<2:32:10, 138.33s/it, best=0.91][A
Staphylococcus_Aureus | Oxacillin | Optuna:  67%|██████▋   | 134/200 [4:52:57<2:32:10, 138.33s/it, best=0.91][A[I 2026-02-27 19:41:00,154] Trial 79 finished with value: 0.8604814504317758 and parameters: {'activation': 'relu', 'solver': 'adam', 'lr': 0.0005527723436990179, 'layer1': 215, 'layer2': 130, 'layer3': 115}. Best is trial 42 with value: 0.8645324176837453.

Pseudomonas_Aeruginosa | Imipenem | Optuna:  40%|████      | 80/200 [1:08:54<1:53:50, 56.92s/it, best=0.865][A
Pseudomonas_Aeruginosa | Imipenem | Optuna:  40%|████      | 80/200 [1:08:54<1:53:50, 56.92s/it, best=0.865][A[I 2026-02-27 19:41:20,511] Trial 80 finished with value: 0.8182818869809069 and parameters: {'activation': 'relu', 'solver': 'sgd', 'lr': 0.003569294847522823, 'layer1': 457, 'layer2': 67, 'layer3': 208}. Best is trial 42 with value: 0.8645324176837453.

Pseudomonas_Aeruginosa | Imipenem | Optuna:  40%|████      | 81/200 [1:09:14<1:31:08, 45.95s/it, best=0.865][A
Pseudomonas_Aeruginosa | Imipenem | Optuna:  40%|████      | 81/200 [1:09:14<1:31:08, 45.95s/it, best=0.865][A[I 2026-02-27 19:42:28,886] Trial 81 finished with value: 0.8629507694990319 and parameters: {'activation': 'relu', 'solver': 'adam', 'lr': 0.00021517419385981955, 'layer1': 410, 'layer2': 27, 'layer3': 144}. Best is trial 42 with value: 0.8645324176837453.

Pseudomonas_Aeruginosa | Imipenem | Optuna:  41%|████      | 82/200 [1:10:23<1:43:35, 52.68s/it, best=0.865][A
Pseudomonas_Aeruginosa | Imipenem | Optuna:  41%|████      | 82/200 [1:10:23<1:43:35, 52.68s/it, best=0.865][A[I 2026-02-27 19:42:29,479] Trial 119 finished with value: 0.806571872705749 and parameters: {'activation': 'tanh', 'solver': 'adam', 'lr': 1.552532867136474e-05, 'layer1': 273, 'layer2': 282, 'layer3': 37}. Best is trial 107 with value: 0.8083747566869277.

Escherichia_Coli | Ciprofloxacin | Optuna:  60%|██████    | 120/200 [4:54:58<3:46:25, 169.82s/it, best=0.808][A
Escherichia_Coli | Ciprofloxacin | Optuna:  60%|██████    | 120/200 [4:54:58<3:46:25, 169.82s/it, best=0.808][A[I 2026-02-27 19:42:31,957] Trial 154 finished with value: 0.8267451396956759 and parameters: {'activation': 'identity', 'solver': 'adam', 'lr': 3.2480175300683645e-05, 'layer1': 373, 'layer2': 449, 'layer3': 188}. Best is trial 91 with value: 0.8315336183309556.

Klebsiella_Pneumoniae | Ciprofloxacin | Optuna:  78%|███████▊  | 155/200 [4:55:01<1:44:57, 139.95s/it, best=0.832][A
Klebsiella_Pneumoniae | Ciprofloxacin | Optuna:  78%|███████▊  | 155/200 [4:55:01<1:44:57, 139.95s/it, best=0.832][A[I 2026-02-27 19:42:34,699] Trial 134 finished with value: 0.906927177432026 and parameters: {'activation': 'identity', 'solver': 'adam', 'lr': 0.00010937436973486565, 'layer1': 306, 'layer2': 410, 'layer3': 434}. Best is trial 84 with value: 0.9099428178723615.

Staphylococcus_Aureus | Oxacillin | Optuna:  68%|██████▊   | 135/200 [4:55:04<2:26:03, 134.83s/it, best=0.91][A
Staphylococcus_Aureus | Oxacillin | Optuna:  68%|██████▊   | 135/200 [4:55:04<2:26:03, 134.83s/it, best=0.91][A[I 2026-02-27 19:43:03,136] Trial 82 finished with value: 0.8336080445324227 and parameters: {'activation': 'relu', 'solver': 'adam', 'lr': 0.0076637714164137834, 'layer1': 355, 'layer2': 32, 'layer3': 155}. Best is trial 42 with value: 0.8645324176837453.

Pseudomonas_Aeruginosa | Imipenem | Optuna:  42%|████▏     | 83/200 [1:10:57<1:31:56, 47.15s/it, best=0.865][A
Pseudomonas_Aeruginosa | Imipenem | Optuna:  42%|████▏     | 83/200 [1:10:57<1:31:56, 47.15s/it, best=0.865][A[I 2026-02-27 19:43:49,514] Trial 155 finished with value: 0.7926895827759686 and parameters: {'activation': 'identity', 'solver': 'adam', 'lr': 1.5959987475387874e-05, 'layer1': 326, 'layer2': 466, 'layer3': 158}. Best is trial 91 with value: 0.8315336183309556.

Klebsiella_Pneumoniae | Ciprofloxacin | Optuna:  78%|███████▊  | 156/200 [4:56:19<1:28:54, 121.23s/it, best=0.832][A
Klebsiella_Pneumoniae | Ciprofloxacin | Optuna:  78%|███████▊  | 156/200 [4:56:19<1:28:54, 121.23s/it, best=0.832][A[I 2026-02-27 19:44:02,348] Trial 120 finished with value: 0.4246706361340148 and parameters: {'activation': 'tanh', 'solver': 'sgd', 'lr': 8.659117555400077e-06, 'layer1': 169, 'layer2': 332, 'layer3': 26}. Best is trial 107 with value: 0.8083747566869277.

Escherichia_Coli | Ciprofloxacin | Optuna:  60%|██████    | 121/200 [4:56:31<3:13:12, 146.73s/it, best=0.808][A
Escherichia_Coli | Ciprofloxacin | Optuna:  60%|██████    | 121/200 [4:56:31<3:13:12, 146.73s/it, best=0.808][A[I 2026-02-27 19:44:14,914] Trial 83 finished with value: 0.8609637642175294 and parameters: {'activation': 'relu', 'solver': 'adam', 'lr': 0.00022159149644394724, 'layer1': 403, 'layer2': 11, 'layer3': 124}. Best is trial 42 with value: 0.8645324176837453.

Pseudomonas_Aeruginosa | Imipenem | Optuna:  42%|████▏     | 84/200 [1:12:09<1:45:26, 54.54s/it, best=0.865][A
