[I 2026-02-28 04:18:10,853] Trial 58 finished with value: 0.926751193277509 and parameters: {'activation': 'identity', 'solver': 'adam', 'lr': 0.0009007285528932977, 'layer1': 446, 'layer2': 279, 'layer3': 267}. Best is trial 20 with value: 0.9283335834984147.

Staphylococcus_Aureus | Fusidic acid | Optuna:  30%|██▉       | 59/200 [1:37:20<4:22:26, 111.68s/it, best=0.928][A
Staphylococcus_Aureus | Fusidic acid | Optuna:  30%|██▉       | 59/200 [1:37:20<4:22:26, 111.68s/it, best=0.928][A[I 2026-02-28 04:19:10,849] Trial 60 finished with value: 0.9856790969054625 and parameters: {'activation': 'relu', 'solver': 'adam', 'lr': 0.0009697361500594682, 'layer1': 395, 'layer2': 364, 'layer3': 381}. Best is trial 13 with value: 0.9860492846658779.

Klebsiella_Pneumoniae | Imipenem | Optuna:  30%|███       | 61/200 [50:23<1:55:30, 49.86s/it, best=0.986][A
Klebsiella_Pneumoniae | Imipenem | Optuna:  30%|███       | 61/200 [50:23<1:55:30, 49.86s/it, best=0.986][A[I 2026-02-28 04:19:21,298] Trial 59 finished with value: 0.9220234253839162 and parameters: {'activation': 'identity', 'solver': 'adam', 'lr': 0.0032252768325143582, 'layer1': 120, 'layer2': 498, 'layer3': 80}. Best is trial 20 with value: 0.9283335834984147.

Staphylococcus_Aureus | Fusidic acid | Optuna:  30%|███       | 60/200 [1:38:30<3:51:43, 99.31s/it, best=0.928] [A
Staphylococcus_Aureus | Fusidic acid | Optuna:  30%|███       | 60/200 [1:38:30<3:51:43, 99.31s/it, best=0.928][A[I 2026-02-28 04:19:47,288] Trial 91 finished with value: 0.8621328149013039 and parameters: {'activation': 'identity', 'solver': 'adam', 'lr': 0.001374489248456261, 'layer1': 296, 'layer2': 410, 'layer3': 424}. Best is trial 63 with value: 0.8682133709784562.
Pseudomonas_Aeruginosa | LPS | Optuna:  46%|████▌     | 92/200 [2:14:49<2:49:04, 93.93s/it, best=0.868]Pseudomonas_Aeruginosa | LPS | Optuna:  46%|████▌     | 92/200 [2:14:49<2:49:04, 93.93s/it, best=0.868]/export/usuarios01/egarroyo/MALDI_for_AMR_prediction/venv/lib/python3.13/site-packages/sklearn/model_selection/_split.py:813: UserWarning: The least populated class in y has only 4 members, which is less than n_splits=5.
  warnings.warn(
[I 2026-02-28 04:19:54,092] Trial 124 finished with value: 0.8946163982537652 and parameters: {'activation': 'relu', 'solver': 'adam', 'lr': 6.546004849489134e-05, 'layer1': 469, 'layer2': 374, 'layer3': 270}. Best is trial 122 with value: 0.897309104499819.

Escherichia_Coli | Ceftriaxone | Optuna:  62%|██████▎   | 125/200 [5:09:55<3:27:51, 166.29s/it, best=0.897][A
Escherichia_Coli | Ceftriaxone | Optuna:  62%|██████▎   | 125/200 [5:09:55<3:27:51, 166.29s/it, best=0.897][A[I 2026-02-28 04:20:07,159] Trial 61 finished with value: 0.9830528681877911 and parameters: {'activation': 'relu', 'solver': 'adam', 'lr': 0.0009938425211943815, 'layer1': 397, 'layer2': 369, 'layer3': 381}. Best is trial 13 with value: 0.9860492846658779.

Klebsiella_Pneumoniae | Imipenem | Optuna:  31%|███       | 62/200 [51:19<1:59:07, 51.79s/it, best=0.986][A
Klebsiella_Pneumoniae | Imipenem | Optuna:  31%|███       | 62/200 [51:19<1:59:07, 51.79s/it, best=0.986][A[I 2026-02-28 04:21:02,747] Trial 60 finished with value: 0.9213957323770965 and parameters: {'activation': 'relu', 'solver': 'adam', 'lr': 0.0011605709644922921, 'layer1': 433, 'layer2': 182, 'layer3': 169}. Best is trial 20 with value: 0.9283335834984147.

Staphylococcus_Aureus | Fusidic acid | Optuna:  30%|███       | 61/200 [1:40:11<3:51:32, 99.95s/it, best=0.928][A
Staphylococcus_Aureus | Fusidic acid | Optuna:  30%|███       | 61/200 [1:40:11<3:51:32, 99.95s/it, best=0.928][A[I 2026-02-28 04:21:06,897] Trial 62 finished with value: 0.984326270952112 and parameters: {'activation': 'relu', 'solver': 'adam', 'lr': 0.0014030379640897893, 'layer1': 329, 'layer2': 326, 'layer3': 420}. Best is trial 13 with value: 0.9860492846658779.

Klebsiella_Pneumoniae | Imipenem | Optuna:  32%|███▏      | 63/200 [52:19<2:03:42, 54.18s/it, best=0.986][A
Klebsiella_Pneumoniae | Imipenem | Optuna:  32%|███▏      | 63/200 [52:19<2:03:42, 54.18s/it, best=0.986][A[I 2026-02-28 04:21:50,294] Trial 92 finished with value: 0.8667149295407766 and parameters: {'activation': 'identity', 'solver': 'adam', 'lr': 0.0017975227555885852, 'layer1': 281, 'layer2': 351, 'layer3': 410}. Best is trial 63 with value: 0.8682133709784562.
Pseudomonas_Aeruginosa | LPS | Optuna:  46%|████▋     | 93/200 [2:16:52<3:03:03, 102.65s/it, best=0.868]Pseudomonas_Aeruginosa | LPS | Optuna:  46%|████▋     | 93/200 [2:16:52<3:03:03, 102.65s/it, best=0.868]/export/usuarios01/egarroyo/MALDI_for_AMR_prediction/venv/lib/python3.13/site-packages/sklearn/model_selection/_split.py:813: UserWarning: The least populated class in y has only 4 members, which is less than n_splits=5.
  warnings.warn(
[I 2026-02-28 04:21:56,922] Trial 63 finished with value: 0.9829994166046074 and parameters: {'activation': 'relu', 'solver': 'adam', 'lr': 0.0005412247669323689, 'layer1': 382, 'layer2': 378, 'layer3': 448}. Best is trial 13 with value: 0.9860492846658779.

Klebsiella_Pneumoniae | Imipenem | Optuna:  32%|███▏      | 64/200 [53:09<1:59:58, 52.93s/it, best=0.986][A
Klebsiella_Pneumoniae | Imipenem | Optuna:  32%|███▏      | 64/200 [53:09<1:59:58, 52.93s/it, best=0.986][A[I 2026-02-28 04:22:40,534] Trial 61 finished with value: 0.9216145952190654 and parameters: {'activation': 'identity', 'solver': 'adam', 'lr': 0.0002871906490629362, 'layer1': 484, 'layer2': 440, 'layer3': 135}. Best is trial 20 with value: 0.9283335834984147.

Staphylococcus_Aureus | Fusidic acid | Optuna:  31%|███       | 62/200 [1:41:49<3:48:23, 99.30s/it, best=0.928][A
Staphylococcus_Aureus | Fusidic acid | Optuna:  31%|███       | 62/200 [1:41:49<3:48:23, 99.30s/it, best=0.928][A[I 2026-02-28 04:22:50,145] Trial 125 finished with value: 0.8949896462793097 and parameters: {'activation': 'relu', 'solver': 'adam', 'lr': 4.5631600035627275e-05, 'layer1': 492, 'layer2': 299, 'layer3': 84}. Best is trial 122 with value: 0.897309104499819.

Escherichia_Coli | Ceftriaxone | Optuna:  63%|██████▎   | 126/200 [5:12:51<3:28:42, 169.22s/it, best=0.897][A
Escherichia_Coli | Ceftriaxone | Optuna:  63%|██████▎   | 126/200 [5:12:51<3:28:42, 169.22s/it, best=0.897][A[I 2026-02-28 04:23:11,741] Trial 64 finished with value: 0.984302249975201 and parameters: {'activation': 'relu', 'solver': 'adam', 'lr': 0.0027389431407973766, 'layer1': 453, 'layer2': 411, 'layer3': 306}. Best is trial 13 with value: 0.9860492846658779.

Klebsiella_Pneumoniae | Imipenem | Optuna:  32%|███▎      | 65/200 [54:24<2:13:52, 59.50s/it, best=0.986][A
Klebsiella_Pneumoniae | Imipenem | Optuna:  32%|███▎      | 65/200 [54:24<2:13:52, 59.50s/it, best=0.986][A[I 2026-02-28 04:23:28,815] Trial 93 finished with value: 0.828522522621377 and parameters: {'activation': 'identity', 'solver': 'adam', 'lr': 3.013779041432989e-06, 'layer1': 235, 'layer2': 371, 'layer3': 376}. Best is trial 63 with value: 0.8682133709784562.
Pseudomonas_Aeruginosa | LPS | Optuna:  47%|████▋     | 94/200 [2:18:30<2:59:09, 101.41s/it, best=0.868]Pseudomonas_Aeruginosa | LPS | Optuna:  47%|████▋     | 94/200 [2:18:30<2:59:09, 101.41s/it, best=0.868]/export/usuarios01/egarroyo/MALDI_for_AMR_prediction/venv/lib/python3.13/site-packages/sklearn/model_selection/_split.py:813: UserWarning: The least populated class in y has only 4 members, which is less than n_splits=5.
  warnings.warn(
[I 2026-02-28 04:24:09,253] Trial 65 finished with value: 0.9830528681877911 and parameters: {'activation': 'relu', 'solver': 'adam', 'lr': 0.0013514213161745455, 'layer1': 418, 'layer2': 294, 'layer3': 340}. Best is trial 13 with value: 0.9860492846658779.

Klebsiella_Pneumoniae | Imipenem | Optuna:  33%|███▎      | 66/200 [55:21<2:11:32, 58.90s/it, best=0.986][A
Klebsiella_Pneumoniae | Imipenem | Optuna:  33%|███▎      | 66/200 [55:21<2:11:32, 58.90s/it, best=0.986][A[I 2026-02-28 04:24:45,936] Trial 62 finished with value: 0.9266975215313107 and parameters: {'activation': 'identity', 'solver': 'adam', 'lr': 0.00033609834424586874, 'layer1': 451, 'layer2': 449, 'layer3': 197}. Best is trial 20 with value: 0.9283335834984147.

Staphylococcus_Aureus | Fusidic acid | Optuna:  32%|███▏      | 63/200 [1:43:55<4:04:36, 107.13s/it, best=0.928][A
Staphylococcus_Aureus | Fusidic acid | Optuna:  32%|███▏      | 63/200 [1:43:55<4:04:36, 107.13s/it, best=0.928][A[I 2026-02-28 04:25:01,293] Trial 94 finished with value: 0.8646227051791616 and parameters: {'activation': 'identity', 'solver': 'adam', 'lr': 0.0006223145231982202, 'layer1': 279, 'layer2': 309, 'layer3': 405}. Best is trial 63 with value: 0.8682133709784562.
Pseudomonas_Aeruginosa | LPS | Optuna:  48%|████▊     | 95/200 [2:20:03<2:52:46, 98.73s/it, best=0.868] Pseudomonas_Aeruginosa | LPS | Optuna:  48%|████▊     | 95/200 [2:20:03<2:52:46, 98.73s/it, best=0.868]/export/usuarios01/egarroyo/MALDI_for_AMR_prediction/venv/lib/python3.13/site-packages/sklearn/model_selection/_split.py:813: UserWarning: The least populated class in y has only 4 members, which is less than n_splits=5.
  warnings.warn(
[I 2026-02-28 04:25:07,449] Trial 66 finished with value: 0.9838504926271672 and parameters: {'activation': 'relu', 'solver': 'adam', 'lr': 0.000267750160680535, 'layer1': 368, 'layer2': 119, 'layer3': 391}. Best is trial 13 with value: 0.9860492846658779.

Klebsiella_Pneumoniae | Imipenem | Optuna:  34%|███▎      | 67/200 [56:20<2:10:05, 58.69s/it, best=0.986][A
Klebsiella_Pneumoniae | Imipenem | Optuna:  34%|███▎      | 67/200 [56:20<2:10:05, 58.69s/it, best=0.986][A[I 2026-02-28 04:26:01,416] Trial 67 finished with value: 0.9819919843971873 and parameters: {'activation': 'tanh', 'solver': 'adam', 'lr': 0.002396350886791956, 'layer1': 500, 'layer2': 349, 'layer3': 274}. Best is trial 13 with value: 0.9860492846658779.

Klebsiella_Pneumoniae | Imipenem | Optuna:  34%|███▍      | 68/200 [57:14<2:06:00, 57.27s/it, best=0.986][A
Klebsiella_Pneumoniae | Imipenem | Optuna:  34%|███▍      | 68/200 [57:14<2:06:00, 57.27s/it, best=0.986][A[I 2026-02-28 04:26:28,509] Trial 68 finished with value: 0.9800270054346416 and parameters: {'activation': 'relu', 'solver': 'sgd', 'lr': 0.0006815345056655136, 'layer1': 431, 'layer2': 170, 'layer3': 476}. Best is trial 13 with value: 0.9860492846658779.

Klebsiella_Pneumoniae | Imipenem | Optuna:  34%|███▍      | 69/200 [57:41<1:45:16, 48.22s/it, best=0.986][A
Klebsiella_Pneumoniae | Imipenem | Optuna:  34%|███▍      | 69/200 [57:41<1:45:16, 48.22s/it, best=0.986][A[I 2026-02-28 04:26:43,208] Trial 63 finished with value: 0.9257397606613786 and parameters: {'activation': 'identity', 'solver': 'adam', 'lr': 0.000667774461228385, 'layer1': 474, 'layer2': 421, 'layer3': 90}. Best is trial 20 with value: 0.9283335834984147.

Staphylococcus_Aureus | Fusidic acid | Optuna:  32%|███▏      | 64/200 [1:45:52<4:09:43, 110.17s/it, best=0.928][A
Staphylococcus_Aureus | Fusidic acid | Optuna:  32%|███▏      | 64/200 [1:45:52<4:09:43, 110.17s/it, best=0.928][A[I 2026-02-28 04:26:45,826] Trial 95 finished with value: 0.8642218038518527 and parameters: {'activation': 'identity', 'solver': 'adam', 'lr': 0.0010917130960791518, 'layer1': 326, 'layer2': 346, 'layer3': 351}. Best is trial 63 with value: 0.8682133709784562.
Pseudomonas_Aeruginosa | LPS | Optuna:  48%|████▊     | 96/200 [2:21:47<2:54:09, 100.47s/it, best=0.868]Pseudomonas_Aeruginosa | LPS | Optuna:  48%|████▊     | 96/200 [2:21:47<2:54:09, 100.47s/it, best=0.868]/export/usuarios01/egarroyo/MALDI_for_AMR_prediction/venv/lib/python3.13/site-packages/sklearn/model_selection/_split.py:813: UserWarning: The least populated class in y has only 4 members, which is less than n_splits=5.
  warnings.warn(
[I 2026-02-28 04:27:04,341] Trial 126 finished with value: 0.8953984329471687 and parameters: {'activation': 'relu', 'solver': 'adam', 'lr': 1.624678787035838e-05, 'layer1': 246, 'layer2': 360, 'layer3': 105}. Best is trial 122 with value: 0.897309104499819.

Escherichia_Coli | Ceftriaxone | Optuna:  64%|██████▎   | 127/200 [5:17:05<3:56:53, 194.71s/it, best=0.897][A
Escherichia_Coli | Ceftriaxone | Optuna:  64%|██████▎   | 127/200 [5:17:05<3:56:53, 194.71s/it, best=0.897][A[I 2026-02-28 04:27:17,620] Trial 69 finished with value: 0.9834744307179435 and parameters: {'activation': 'relu', 'solver': 'adam', 'lr': 0.0038402598920130515, 'layer1': 485, 'layer2': 153, 'layer3': 375}. Best is trial 13 with value: 0.9860492846658779.

Klebsiella_Pneumoniae | Imipenem | Optuna:  35%|███▌      | 70/200 [58:30<1:45:03, 48.49s/it, best=0.986][A
Klebsiella_Pneumoniae | Imipenem | Optuna:  35%|███▌      | 70/200 [58:30<1:45:03, 48.49s/it, best=0.986][A[I 2026-02-28 04:27:55,216] Trial 70 finished with value: 0.9800270054346416 and parameters: {'activation': 'logistic', 'solver': 'adam', 'lr': 0.005811843219105378, 'layer1': 274, 'layer2': 250, 'layer3': 352}. Best is trial 13 with value: 0.9860492846658779.

Klebsiella_Pneumoniae | Imipenem | Optuna:  36%|███▌      | 71/200 [59:07<1:37:13, 45.22s/it, best=0.986][A
Klebsiella_Pneumoniae | Imipenem | Optuna:  36%|███▌      | 71/200 [59:07<1:37:13, 45.22s/it, best=0.986][A[I 2026-02-28 04:28:33,689] Trial 64 finished with value: 0.9218356320739474 and parameters: {'activation': 'identity', 'solver': 'adam', 'lr': 0.00020023739417393872, 'layer1': 414, 'layer2': 483, 'layer3': 246}. Best is trial 20 with value: 0.9283335834984147.

Staphylococcus_Aureus | Fusidic acid | Optuna:  32%|███▎      | 65/200 [1:47:42<4:08:05, 110.27s/it, best=0.928][A
Staphylococcus_Aureus | Fusidic acid | Optuna:  32%|███▎      | 65/200 [1:47:42<4:08:05, 110.27s/it, best=0.928][A[I 2026-02-28 04:28:37,049] Trial 71 finished with value: 0.9829712044299164 and parameters: {'activation': 'relu', 'solver': 'adam', 'lr': 0.0015416143600401912, 'layer1': 330, 'layer2': 323, 'layer3': 429}. Best is trial 13 with value: 0.9860492846658779.

Klebsiella_Pneumoniae | Imipenem | Optuna:  36%|███▌      | 72/200 [59:49<1:34:18, 44.20s/it, best=0.986][A
Klebsiella_Pneumoniae | Imipenem | Optuna:  36%|███▌      | 72/200 [59:49<1:34:18, 44.20s/it, best=0.986][A[I 2026-02-28 04:28:41,002] Trial 96 finished with value: 0.865906483930187 and parameters: {'activation': 'identity', 'solver': 'adam', 'lr': 0.0022491089651467326, 'layer1': 310, 'layer2': 326, 'layer3': 468}. Best is trial 63 with value: 0.8682133709784562.
Pseudomonas_Aeruginosa | LPS | Optuna:  48%|████▊     | 97/200 [2:23:43<3:00:02, 104.88s/it, best=0.868]Pseudomonas_Aeruginosa | LPS | Optuna:  48%|████▊     | 97/200 [2:23:43<3:00:02, 104.88s/it, best=0.868]/export/usuarios01/egarroyo/MALDI_for_AMR_prediction/venv/lib/python3.13/site-packages/sklearn/model_selection/_split.py:813: UserWarning: The least populated class in y has only 4 members, which is less than n_splits=5.
  warnings.warn(
[I 2026-02-28 04:29:09,733] Trial 127 finished with value: 0.8897449212610689 and parameters: {'activation': 'tanh', 'solver': 'adam', 'lr': 3.614336458396049e-05, 'layer1': 458, 'layer2': 317, 'layer3': 90}. Best is trial 122 with value: 0.897309104499819.

Escherichia_Coli | Ceftriaxone | Optuna:  64%|██████▍   | 128/200 [5:19:11<3:28:41, 173.92s/it, best=0.897][A
Escherichia_Coli | Ceftriaxone | Optuna:  64%|██████▍   | 128/200 [5:19:11<3:28:41, 173.92s/it, best=0.897][A[I 2026-02-28 04:29:32,958] Trial 72 finished with value: 0.9833193787852853 and parameters: {'activation': 'relu', 'solver': 'adam', 'lr': 0.0014135949555169386, 'layer1': 300, 'layer2': 343, 'layer3': 410}. Best is trial 13 with value: 0.9860492846658779.

Klebsiella_Pneumoniae | Imipenem | Optuna:  36%|███▋      | 73/200 [1:00:45<1:40:59, 47.72s/it, best=0.986][A
Klebsiella_Pneumoniae | Imipenem | Optuna:  36%|███▋      | 73/200 [1:00:45<1:40:59, 47.72s/it, best=0.986][A[I 2026-02-28 04:30:29,147] Trial 73 finished with value: 0.984058813201597 and parameters: {'activation': 'relu', 'solver': 'adam', 'lr': 0.0008430922385952235, 'layer1': 345, 'layer2': 293, 'layer3': 423}. Best is trial 13 with value: 0.9860492846658779.

Klebsiella_Pneumoniae | Imipenem | Optuna:  37%|███▋      | 74/200 [1:01:41<1:45:32, 50.26s/it, best=0.986][A
Klebsiella_Pneumoniae | Imipenem | Optuna:  37%|███▋      | 74/200 [1:01:41<1:45:32, 50.26s/it, best=0.986][A[I 2026-02-28 04:30:31,404] Trial 97 finished with value: 0.8605722071033384 and parameters: {'activation': 'identity', 'solver': 'adam', 'lr': 0.00011519129515793445, 'layer1': 440, 'layer2': 379, 'layer3': 452}. Best is trial 63 with value: 0.8682133709784562.
Pseudomonas_Aeruginosa | LPS | Optuna:  49%|████▉     | 98/200 [2:25:33<3:01:06, 106.54s/it, best=0.868]Pseudomonas_Aeruginosa | LPS | Optuna:  49%|████▉     | 98/200 [2:25:33<3:01:06, 106.54s/it, best=0.868]/export/usuarios01/egarroyo/MALDI_for_AMR_prediction/venv/lib/python3.13/site-packages/sklearn/model_selection/_split.py:813: UserWarning: The least populated class in y has only 4 members, which is less than n_splits=5.
  warnings.warn(
[I 2026-02-28 04:30:37,389] Trial 65 finished with value: 0.9265749121663616 and parameters: {'activation': 'identity', 'solver': 'adam', 'lr': 0.00013755854411297635, 'layer1': 389, 'layer2': 397, 'layer3': 123}. Best is trial 20 with value: 0.9283335834984147.

Staphylococcus_Aureus | Fusidic acid | Optuna:  33%|███▎      | 66/200 [1:49:46<4:15:15, 114.30s/it, best=0.928][A
Staphylococcus_Aureus | Fusidic acid | Optuna:  33%|███▎      | 66/200 [1:49:46<4:15:15, 114.30s/it, best=0.928][A[I 2026-02-28 04:30:59,157] Trial 98 finished with value: 0.8289102276586906 and parameters: {'activation': 'identity', 'solver': 'sgd', 'lr': 0.0018448222485800156, 'layer1': 264, 'layer2': 451, 'layer3': 440}. Best is trial 63 with value: 0.8682133709784562.
Pseudomonas_Aeruginosa | LPS | Optuna:  50%|████▉     | 99/200 [2:26:01<2:19:33, 82.90s/it, best=0.868] Pseudomonas_Aeruginosa | LPS | Optuna:  50%|████▉     | 99/200 [2:26:01<2:19:33, 82.90s/it, best=0.868]/export/usuarios01/egarroyo/MALDI_for_AMR_prediction/venv/lib/python3.13/site-packages/sklearn/model_selection/_split.py:813: UserWarning: The least populated class in y has only 4 members, which is less than n_splits=5.
  warnings.warn(
[I 2026-02-28 04:31:13,691] Trial 74 finished with value: 0.9826549734836979 and parameters: {'activation': 'relu', 'solver': 'adam', 'lr': 0.000511319951662662, 'layer1': 321, 'layer2': 329, 'layer3': 463}. Best is trial 13 with value: 0.9860492846658779.

Klebsiella_Pneumoniae | Imipenem | Optuna:  38%|███▊      | 75/200 [1:02:26<1:41:07, 48.54s/it, best=0.986][A
Klebsiella_Pneumoniae | Imipenem | Optuna:  38%|███▊      | 75/200 [1:02:26<1:41:07, 48.54s/it, best=0.986][A[I 2026-02-28 04:31:43,856] Trial 128 finished with value: 0.8939979963169777 and parameters: {'activation': 'relu', 'solver': 'adam', 'lr': 4.4094453567877174e-05, 'layer1': 478, 'layer2': 382, 'layer3': 333}. Best is trial 122 with value: 0.897309104499819.

Escherichia_Coli | Ceftriaxone | Optuna:  64%|██████▍   | 129/200 [5:21:45<3:18:46, 167.98s/it, best=0.897][A
Escherichia_Coli | Ceftriaxone | Optuna:  64%|██████▍   | 129/200 [5:21:45<3:18:46, 167.98s/it, best=0.897][A[I 2026-02-28 04:31:59,132] Trial 75 finished with value: 0.9850153997114136 and parameters: {'activation': 'relu', 'solver': 'adam', 'lr': 0.002020281072243693, 'layer1': 17, 'layer2': 262, 'layer3': 486}. Best is trial 13 with value: 0.9860492846658779.

Klebsiella_Pneumoniae | Imipenem | Optuna:  38%|███▊      | 76/200 [1:03:11<1:38:23, 47.61s/it, best=0.986][A
Klebsiella_Pneumoniae | Imipenem | Optuna:  38%|███▊      | 76/200 [1:03:11<1:38:23, 47.61s/it, best=0.986][A[I 2026-02-28 04:32:32,344] Trial 76 finished with value: 0.982075919746457 and parameters: {'activation': 'relu', 'solver': 'adam', 'lr': 0.0021953593827153807, 'layer1': 43, 'layer2': 263, 'layer3': 494}. Best is trial 13 with value: 0.9860492846658779.

Klebsiella_Pneumoniae | Imipenem | Optuna:  38%|███▊      | 77/200 [1:03:44<1:28:44, 43.29s/it, best=0.986][A
Klebsiella_Pneumoniae | Imipenem | Optuna:  38%|███▊      | 77/200 [1:03:44<1:28:44, 43.29s/it, best=0.986][A[I 2026-02-28 04:32:32,542] Trial 66 finished with value: 0.9216007573300844 and parameters: {'activation': 'identity', 'solver': 'adam', 'lr': 0.00041032068824240766, 'layer1': 455, 'layer2': 420, 'layer3': 147}. Best is trial 20 with value: 0.9283335834984147.

Staphylococcus_Aureus | Fusidic acid | Optuna:  34%|███▎      | 67/200 [1:51:41<4:13:55, 114.55s/it, best=0.928][A
Staphylococcus_Aureus | Fusidic acid | Optuna:  34%|███▎      | 67/200 [1:51:41<4:13:55, 114.55s/it, best=0.928][A[I 2026-02-28 04:32:42,070] Trial 99 finished with value: 0.8645014161934323 and parameters: {'activation': 'identity', 'solver': 'adam', 'lr': 0.00415444242246967, 'layer1': 246, 'layer2': 351, 'layer3': 384}. Best is trial 63 with value: 0.8682133709784562.
Pseudomonas_Aeruginosa | LPS | Optuna:  50%|█████     | 100/200 [2:27:44<2:28:10, 88.91s/it, best=0.868]Pseudomonas_Aeruginosa | LPS | Optuna:  50%|█████     | 100/200 [2:27:44<2:28:10, 88.91s/it, best=0.868]/export/usuarios01/egarroyo/MALDI_for_AMR_prediction/venv/lib/python3.13/site-packages/sklearn/model_selection/_split.py:813: UserWarning: The least populated class in y has only 4 members, which is less than n_splits=5.
  warnings.warn(
[I 2026-02-28 04:33:32,719] Trial 77 finished with value: 0.9829733840622789 and parameters: {'activation': 'identity', 'solver': 'adam', 'lr': 0.0008981448155354332, 'layer1': 439, 'layer2': 500, 'layer3': 484}. Best is trial 13 with value: 0.9860492846658779.

Klebsiella_Pneumoniae | Imipenem | Optuna:  39%|███▉      | 78/200 [1:04:45<1:38:26, 48.42s/it, best=0.986][A
