Klebsiella_Pneumoniae | Ceftriaxone | Optuna:  93%|█████████▎| 186/200 [6:12:03<30:53, 132.37s/it, best=0.912][A[I 2026-02-28 03:02:59,764] Trial 41 finished with value: 0.8641567036135628 and parameters: {'activation': 'identity', 'solver': 'adam', 'lr': 0.0005793614640223861, 'layer1': 378, 'layer2': 397, 'layer3': 394}. Best is trial 34 with value: 0.8674293894305268.
Pseudomonas_Aeruginosa | LPS | Optuna:  21%|██        | 42/200 [58:01<3:39:55, 83.52s/it, best=0.867]Pseudomonas_Aeruginosa | LPS | Optuna:  21%|██        | 42/200 [58:01<3:39:55, 83.52s/it, best=0.867]/export/usuarios01/egarroyo/MALDI_for_AMR_prediction/venv/lib/python3.13/site-packages/sklearn/model_selection/_split.py:813: UserWarning: The least populated class in y has only 4 members, which is less than n_splits=5.
  warnings.warn(
[I 2026-02-28 03:03:45,862] Trial 93 finished with value: 0.8939663028233251 and parameters: {'activation': 'relu', 'solver': 'adam', 'lr': 4.4247046463460255e-05, 'layer1': 488, 'layer2': 163, 'layer3': 177}. Best is trial 14 with value: 0.8971256036318559.

Escherichia_Coli | Ceftriaxone | Optuna:  47%|████▋     | 94/200 [3:53:47<5:11:18, 176.21s/it, best=0.897][A
Escherichia_Coli | Ceftriaxone | Optuna:  47%|████▋     | 94/200 [3:53:47<5:11:18, 176.21s/it, best=0.897][A[I 2026-02-28 03:04:26,097] Trial 15 finished with value: 0.9216145952190654 and parameters: {'activation': 'identity', 'solver': 'adam', 'lr': 0.0002468377657358816, 'layer1': 497, 'layer2': 401, 'layer3': 258}. Best is trial 8 with value: 0.9272321206408927.

Staphylococcus_Aureus | Fusidic acid | Optuna:   8%|▊         | 16/200 [23:35<4:44:52, 92.89s/it, best=0.927][A
Staphylococcus_Aureus | Fusidic acid | Optuna:   8%|▊         | 16/200 [23:35<4:44:52, 92.89s/it, best=0.927][A[I 2026-02-28 03:04:48,407] Trial 42 finished with value: 0.8631110415330727 and parameters: {'activation': 'identity', 'solver': 'adam', 'lr': 0.0009470612093759428, 'layer1': 336, 'layer2': 284, 'layer3': 332}. Best is trial 34 with value: 0.8674293894305268.
Pseudomonas_Aeruginosa | LPS | Optuna:  22%|██▏       | 43/200 [59:50<3:58:15, 91.05s/it, best=0.867]Pseudomonas_Aeruginosa | LPS | Optuna:  22%|██▏       | 43/200 [59:50<3:58:15, 91.05s/it, best=0.867]/export/usuarios01/egarroyo/MALDI_for_AMR_prediction/venv/lib/python3.13/site-packages/sklearn/model_selection/_split.py:813: UserWarning: The least populated class in y has only 4 members, which is less than n_splits=5.
  warnings.warn(
[I 2026-02-28 03:05:07,605] Trial 186 finished with value: 0.9061013978999695 and parameters: {'activation': 'tanh', 'solver': 'adam', 'lr': 1.5676970305068027e-05, 'layer1': 261, 'layer2': 446, 'layer3': 171}. Best is trial 174 with value: 0.9115644647823175.

Klebsiella_Pneumoniae | Ceftriaxone | Optuna:  94%|█████████▎| 187/200 [6:14:29<29:32, 136.34s/it, best=0.912][A
Klebsiella_Pneumoniae | Ceftriaxone | Optuna:  94%|█████████▎| 187/200 [6:14:29<29:32, 136.34s/it, best=0.912][A[I 2026-02-28 03:05:56,485] Trial 16 finished with value: 0.9169772978285451 and parameters: {'activation': 'logistic', 'solver': 'adam', 'lr': 0.002175632661820793, 'layer1': 331, 'layer2': 104, 'layer3': 152}. Best is trial 8 with value: 0.9272321206408927.

Staphylococcus_Aureus | Fusidic acid | Optuna:   8%|▊         | 17/200 [25:05<4:41:01, 92.14s/it, best=0.927][A
Staphylococcus_Aureus | Fusidic acid | Optuna:   8%|▊         | 17/200 [25:05<4:41:01, 92.14s/it, best=0.927][A[I 2026-02-28 03:06:03,071] Trial 94 finished with value: 0.8945452802139112 and parameters: {'activation': 'relu', 'solver': 'adam', 'lr': 7.357131485519911e-05, 'layer1': 451, 'layer2': 128, 'layer3': 59}. Best is trial 14 with value: 0.8971256036318559.

Escherichia_Coli | Ceftriaxone | Optuna:  48%|████▊     | 95/200 [3:56:04<4:47:53, 164.51s/it, best=0.897][A
Escherichia_Coli | Ceftriaxone | Optuna:  48%|████▊     | 95/200 [3:56:04<4:47:53, 164.51s/it, best=0.897][A[I 2026-02-28 03:06:48,625] Trial 187 finished with value: 0.9038404178050692 and parameters: {'activation': 'tanh', 'solver': 'adam', 'lr': 1.9027882324608547e-05, 'layer1': 149, 'layer2': 86, 'layer3': 384}. Best is trial 174 with value: 0.9115644647823175.

Klebsiella_Pneumoniae | Ceftriaxone | Optuna:  94%|█████████▍| 188/200 [6:16:10<25:08, 125.75s/it, best=0.912][A
Klebsiella_Pneumoniae | Ceftriaxone | Optuna:  94%|█████████▍| 188/200 [6:16:10<25:08, 125.75s/it, best=0.912][A[I 2026-02-28 03:07:12,527] Trial 17 finished with value: 0.9101729205203082 and parameters: {'activation': 'tanh', 'solver': 'adam', 'lr': 0.003607601442238228, 'layer1': 430, 'layer2': 499, 'layer3': 400}. Best is trial 8 with value: 0.9272321206408927.

Staphylococcus_Aureus | Fusidic acid | Optuna:   9%|▉         | 18/200 [26:21<4:24:48, 87.30s/it, best=0.927][A
Staphylococcus_Aureus | Fusidic acid | Optuna:   9%|▉         | 18/200 [26:21<4:24:48, 87.30s/it, best=0.927][A[I 2026-02-28 03:07:33,725] Trial 43 finished with value: 0.8236008360404525 and parameters: {'activation': 'identity', 'solver': 'adam', 'lr': 1.2403668302547623e-06, 'layer1': 357, 'layer2': 345, 'layer3': 378}. Best is trial 34 with value: 0.8674293894305268.
Pseudomonas_Aeruginosa | LPS | Optuna:  22%|██▏       | 44/200 [1:02:35<4:54:40, 113.33s/it, best=0.867]Pseudomonas_Aeruginosa | LPS | Optuna:  22%|██▏       | 44/200 [1:02:35<4:54:40, 113.33s/it, best=0.867]/export/usuarios01/egarroyo/MALDI_for_AMR_prediction/venv/lib/python3.13/site-packages/sklearn/model_selection/_split.py:813: UserWarning: The least populated class in y has only 4 members, which is less than n_splits=5.
  warnings.warn(
[I 2026-02-28 03:07:48,725] Trial 18 finished with value: 0.9055634672875513 and parameters: {'activation': 'identity', 'solver': 'sgd', 'lr': 0.0005945436664186525, 'layer1': 179, 'layer2': 231, 'layer3': 304}. Best is trial 8 with value: 0.9272321206408927.

Staphylococcus_Aureus | Fusidic acid | Optuna:  10%|▉         | 19/200 [26:57<3:37:03, 71.95s/it, best=0.927][A
Staphylococcus_Aureus | Fusidic acid | Optuna:  10%|▉         | 19/200 [26:57<3:37:03, 71.95s/it, best=0.927][A[I 2026-02-28 03:08:45,539] Trial 95 finished with value: 0.8944591627603374 and parameters: {'activation': 'relu', 'solver': 'adam', 'lr': 0.0001151581253101959, 'layer1': 500, 'layer2': 81, 'layer3': 73}. Best is trial 14 with value: 0.8971256036318559.

Escherichia_Coli | Ceftriaxone | Optuna:  48%|████▊     | 96/200 [3:58:47<4:44:05, 163.90s/it, best=0.897][A
Escherichia_Coli | Ceftriaxone | Optuna:  48%|████▊     | 96/200 [3:58:47<4:44:05, 163.90s/it, best=0.897][A[I 2026-02-28 03:09:04,429] Trial 44 finished with value: 0.8628990853735446 and parameters: {'activation': 'identity', 'solver': 'adam', 'lr': 0.0018264355071860455, 'layer1': 282, 'layer2': 376, 'layer3': 487}. Best is trial 34 with value: 0.8674293894305268.
Pseudomonas_Aeruginosa | LPS | Optuna:  22%|██▎       | 45/200 [1:04:06<4:35:14, 106.54s/it, best=0.867]Pseudomonas_Aeruginosa | LPS | Optuna:  22%|██▎       | 45/200 [1:04:06<4:35:14, 106.54s/it, best=0.867]/export/usuarios01/egarroyo/MALDI_for_AMR_prediction/venv/lib/python3.13/site-packages/sklearn/model_selection/_split.py:813: UserWarning: The least populated class in y has only 4 members, which is less than n_splits=5.
  warnings.warn(
[I 2026-02-28 03:09:16,309] Trial 19 finished with value: 0.9186297500275744 and parameters: {'activation': 'relu', 'solver': 'adam', 'lr': 6.897395462103526e-05, 'layer1': 308, 'layer2': 364, 'layer3': 197}. Best is trial 8 with value: 0.9272321206408927.

Staphylococcus_Aureus | Fusidic acid | Optuna:  10%|█         | 20/200 [28:25<3:49:56, 76.65s/it, best=0.927][A
Staphylococcus_Aureus | Fusidic acid | Optuna:  10%|█         | 20/200 [28:25<3:49:56, 76.65s/it, best=0.927][A[I 2026-02-28 03:09:46,497] Trial 188 finished with value: 0.9071595177313554 and parameters: {'activation': 'tanh', 'solver': 'adam', 'lr': 1.2622503071345234e-05, 'layer1': 176, 'layer2': 431, 'layer3': 462}. Best is trial 174 with value: 0.9115644647823175.

Klebsiella_Pneumoniae | Ceftriaxone | Optuna:  94%|█████████▍| 189/200 [6:19:08<25:55, 141.38s/it, best=0.912][A
Klebsiella_Pneumoniae | Ceftriaxone | Optuna:  94%|█████████▍| 189/200 [6:19:08<25:55, 141.38s/it, best=0.912][A[I 2026-02-28 03:10:29,676] Trial 45 finished with value: 0.8546141336980257 and parameters: {'activation': 'identity', 'solver': 'adam', 'lr': 0.005972742883555157, 'layer1': 323, 'layer2': 453, 'layer3': 432}. Best is trial 34 with value: 0.8674293894305268.
Pseudomonas_Aeruginosa | LPS | Optuna:  23%|██▎       | 46/200 [1:05:31<4:17:03, 100.16s/it, best=0.867]Pseudomonas_Aeruginosa | LPS | Optuna:  23%|██▎       | 46/200 [1:05:31<4:17:03, 100.16s/it, best=0.867]/export/usuarios01/egarroyo/MALDI_for_AMR_prediction/venv/lib/python3.13/site-packages/sklearn/model_selection/_split.py:813: UserWarning: The least populated class in y has only 4 members, which is less than n_splits=5.
  warnings.warn(
[I 2026-02-28 03:11:01,178] Trial 20 finished with value: 0.9283335834984147 and parameters: {'activation': 'identity', 'solver': 'adam', 'lr': 0.00017168954554467802, 'layer1': 435, 'layer2': 89, 'layer3': 251}. Best is trial 20 with value: 0.9283335834984147.

Staphylococcus_Aureus | Fusidic acid | Optuna:  10%|█         | 21/200 [30:10<4:13:56, 85.12s/it, best=0.927][A
Staphylococcus_Aureus | Fusidic acid | Optuna:  10%|█         | 21/200 [30:10<4:13:56, 85.12s/it, best=0.928][A[I 2026-02-28 03:11:09,885] Trial 96 finished with value: 0.8928946397548607 and parameters: {'activation': 'relu', 'solver': 'adam', 'lr': 5.5018542304683264e-05, 'layer1': 134, 'layer2': 100, 'layer3': 39}. Best is trial 14 with value: 0.8971256036318559.

Escherichia_Coli | Ceftriaxone | Optuna:  48%|████▊     | 97/200 [4:01:11<4:31:17, 158.03s/it, best=0.897][A
Escherichia_Coli | Ceftriaxone | Optuna:  48%|████▊     | 97/200 [4:01:11<4:31:17, 158.03s/it, best=0.897][A[I 2026-02-28 03:11:41,426] Trial 189 finished with value: 0.9072880973179377 and parameters: {'activation': 'tanh', 'solver': 'adam', 'lr': 2.3196687493582645e-05, 'layer1': 192, 'layer2': 452, 'layer3': 303}. Best is trial 174 with value: 0.9115644647823175.

Klebsiella_Pneumoniae | Ceftriaxone | Optuna:  95%|█████████▌| 190/200 [6:21:02<22:14, 133.45s/it, best=0.912][A
Klebsiella_Pneumoniae | Ceftriaxone | Optuna:  95%|█████████▌| 190/200 [6:21:02<22:14, 133.45s/it, best=0.912][A[I 2026-02-28 03:12:00,810] Trial 46 finished with value: 0.8562283314878659 and parameters: {'activation': 'identity', 'solver': 'adam', 'lr': 0.0005983708961405204, 'layer1': 413, 'layer2': 335, 'layer3': 201}. Best is trial 34 with value: 0.8674293894305268.
Pseudomonas_Aeruginosa | LPS | Optuna:  24%|██▎       | 47/200 [1:07:02<4:08:29, 97.45s/it, best=0.867] Pseudomonas_Aeruginosa | LPS | Optuna:  24%|██▎       | 47/200 [1:07:02<4:08:29, 97.45s/it, best=0.867]/export/usuarios01/egarroyo/MALDI_for_AMR_prediction/venv/lib/python3.13/site-packages/sklearn/model_selection/_split.py:813: UserWarning: The least populated class in y has only 4 members, which is less than n_splits=5.
  warnings.warn(
[I 2026-02-28 03:12:24,679] Trial 21 finished with value: 0.9217683491915004 and parameters: {'activation': 'identity', 'solver': 'adam', 'lr': 0.00010051998987871784, 'layer1': 442, 'layer2': 81, 'layer3': 258}. Best is trial 20 with value: 0.9283335834984147.

Staphylococcus_Aureus | Fusidic acid | Optuna:  11%|█         | 22/200 [31:33<4:11:04, 84.63s/it, best=0.928][A
Staphylococcus_Aureus | Fusidic acid | Optuna:  11%|█         | 22/200 [31:33<4:11:04, 84.63s/it, best=0.928][A[I 2026-02-28 03:12:34,330] Trial 47 finished with value: 0.8282069483424873 and parameters: {'activation': 'identity', 'solver': 'sgd', 'lr': 0.0009407676433717245, 'layer1': 378, 'layer2': 408, 'layer3': 340}. Best is trial 34 with value: 0.8674293894305268.
Pseudomonas_Aeruginosa | LPS | Optuna:  24%|██▍       | 48/200 [1:07:36<3:18:17, 78.27s/it, best=0.867]Pseudomonas_Aeruginosa | LPS | Optuna:  24%|██▍       | 48/200 [1:07:36<3:18:17, 78.27s/it, best=0.867]/export/usuarios01/egarroyo/MALDI_for_AMR_prediction/venv/lib/python3.13/site-packages/sklearn/model_selection/_split.py:813: UserWarning: The least populated class in y has only 4 members, which is less than n_splits=5.
  warnings.warn(
[I 2026-02-28 03:13:19,484] Trial 190 finished with value: 0.9085116788614391 and parameters: {'activation': 'tanh', 'solver': 'adam', 'lr': 3.2826497428270754e-05, 'layer1': 176, 'layer2': 481, 'layer3': 403}. Best is trial 174 with value: 0.9115644647823175.

Klebsiella_Pneumoniae | Ceftriaxone | Optuna:  96%|█████████▌| 191/200 [6:22:41<18:25, 122.83s/it, best=0.912][A
Klebsiella_Pneumoniae | Ceftriaxone | Optuna:  96%|█████████▌| 191/200 [6:22:41<18:25, 122.83s/it, best=0.912][A[I 2026-02-28 03:13:27,268] Trial 48 finished with value: 0.855604988625093 and parameters: {'activation': 'relu', 'solver': 'adam', 'lr': 0.0016387911738697408, 'layer1': 235, 'layer2': 172, 'layer3': 273}. Best is trial 34 with value: 0.8674293894305268.
Pseudomonas_Aeruginosa | LPS | Optuna:  24%|██▍       | 49/200 [1:08:29<2:57:51, 70.67s/it, best=0.867]Pseudomonas_Aeruginosa | LPS | Optuna:  24%|██▍       | 49/200 [1:08:29<2:57:51, 70.67s/it, best=0.867]/export/usuarios01/egarroyo/MALDI_for_AMR_prediction/venv/lib/python3.13/site-packages/sklearn/model_selection/_split.py:813: UserWarning: The least populated class in y has only 4 members, which is less than n_splits=5.
  warnings.warn(
[I 2026-02-28 03:13:52,604] Trial 22 finished with value: 0.9217845568500256 and parameters: {'activation': 'identity', 'solver': 'adam', 'lr': 0.0003678269459532389, 'layer1': 394, 'layer2': 154, 'layer3': 127}. Best is trial 20 with value: 0.9283335834984147.

Staphylococcus_Aureus | Fusidic acid | Optuna:  12%|█▏        | 23/200 [33:01<4:12:34, 85.62s/it, best=0.928][A
Staphylococcus_Aureus | Fusidic acid | Optuna:  12%|█▏        | 23/200 [33:01<4:12:34, 85.62s/it, best=0.928][A[I 2026-02-28 03:14:42,971] Trial 97 finished with value: 0.8955233193386578 and parameters: {'activation': 'relu', 'solver': 'adam', 'lr': 3.0453989840994097e-05, 'layer1': 465, 'layer2': 69, 'layer3': 356}. Best is trial 14 with value: 0.8971256036318559.

Escherichia_Coli | Ceftriaxone | Optuna:  49%|████▉     | 98/200 [4:04:44<4:56:43, 174.55s/it, best=0.897][A
Escherichia_Coli | Ceftriaxone | Optuna:  49%|████▉     | 98/200 [4:04:44<4:56:43, 174.55s/it, best=0.897][A[I 2026-02-28 03:14:53,801] Trial 49 finished with value: 0.8543779840159779 and parameters: {'activation': 'identity', 'solver': 'adam', 'lr': 8.638325313159144e-05, 'layer1': 270, 'layer2': 315, 'layer3': 388}. Best is trial 34 with value: 0.8674293894305268.
Pseudomonas_Aeruginosa | LPS | Optuna:  25%|██▌       | 50/200 [1:09:55<3:08:34, 75.43s/it, best=0.867]Pseudomonas_Aeruginosa | LPS | Optuna:  25%|██▌       | 50/200 [1:09:55<3:08:34, 75.43s/it, best=0.867]/export/usuarios01/egarroyo/MALDI_for_AMR_prediction/venv/lib/python3.13/site-packages/sklearn/model_selection/_split.py:813: UserWarning: The least populated class in y has only 4 members, which is less than n_splits=5.
  warnings.warn(
[I 2026-02-28 03:14:56,008] Trial 191 finished with value: 0.9046271309339818 and parameters: {'activation': 'tanh', 'solver': 'adam', 'lr': 3.105627419112455e-05, 'layer1': 178, 'layer2': 484, 'layer3': 211}. Best is trial 174 with value: 0.9115644647823175.

Klebsiella_Pneumoniae | Ceftriaxone | Optuna:  96%|█████████▌| 192/200 [6:24:17<15:19, 114.94s/it, best=0.912][A
Klebsiella_Pneumoniae | Ceftriaxone | Optuna:  96%|█████████▌| 192/200 [6:24:17<15:19, 114.94s/it, best=0.912][A[I 2026-02-28 03:15:30,856] Trial 98 finished with value: 0.4536497133215446 and parameters: {'activation': 'relu', 'solver': 'sgd', 'lr': 2.1189263019733915e-05, 'layer1': 445, 'layer2': 151, 'layer3': 21}. Best is trial 14 with value: 0.8971256036318559.

Escherichia_Coli | Ceftriaxone | Optuna:  50%|████▉     | 99/200 [4:05:32<3:49:51, 136.55s/it, best=0.897][A
Escherichia_Coli | Ceftriaxone | Optuna:  50%|████▉     | 99/200 [4:05:32<3:49:51, 136.55s/it, best=0.897][A[I 2026-02-28 03:15:33,704] Trial 23 finished with value: 0.9259683309163197 and parameters: {'activation': 'identity', 'solver': 'adam', 'lr': 0.0009532701763312383, 'layer1': 462, 'layer2': 83, 'layer3': 340}. Best is trial 20 with value: 0.9283335834984147.

Staphylococcus_Aureus | Fusidic acid | Optuna:  12%|█▏        | 24/200 [34:42<4:24:46, 90.27s/it, best=0.928][A
Staphylococcus_Aureus | Fusidic acid | Optuna:  12%|█▏        | 24/200 [34:42<4:24:46, 90.27s/it, best=0.928][A[I 2026-02-28 03:16:43,664] Trial 50 finished with value: 0.8388293029707199 and parameters: {'activation': 'tanh', 'solver': 'adam', 'lr': 1.316632833983216e-05, 'layer1': 305, 'layer2': 198, 'layer3': 309}. Best is trial 34 with value: 0.8674293894305268.
Pseudomonas_Aeruginosa | LPS | Optuna:  26%|██▌       | 51/200 [1:11:45<3:32:58, 85.76s/it, best=0.867]Pseudomonas_Aeruginosa | LPS | Optuna:  26%|██▌       | 51/200 [1:11:45<3:32:58, 85.76s/it, best=0.867]/export/usuarios01/egarroyo/MALDI_for_AMR_prediction/venv/lib/python3.13/site-packages/sklearn/model_selection/_split.py:813: UserWarning: The least populated class in y has only 4 members, which is less than n_splits=5.
  warnings.warn(
[I 2026-02-28 03:16:55,132] Trial 192 finished with value: 0.907294058991484 and parameters: {'activation': 'tanh', 'solver': 'adam', 'lr': 2.4704456470914106e-05, 'layer1': 207, 'layer2': 475, 'layer3': 186}. Best is trial 174 with value: 0.9115644647823175.

Klebsiella_Pneumoniae | Ceftriaxone | Optuna:  96%|█████████▋| 193/200 [6:26:16<13:33, 116.19s/it, best=0.912][A
Klebsiella_Pneumoniae | Ceftriaxone | Optuna:  96%|█████████▋| 193/200 [6:26:16<13:33, 116.19s/it, best=0.912][A[I 2026-02-28 03:17:10,740] Trial 24 finished with value: 0.9255150028984485 and parameters: {'activation': 'identity', 'solver': 'adam', 'lr': 5.0413376916654016e-05, 'layer1': 450, 'layer2': 95, 'layer3': 356}. Best is trial 20 with value: 0.9283335834984147.

Staphylococcus_Aureus | Fusidic acid | Optuna:  12%|█▎        | 25/200 [36:19<4:29:11, 92.30s/it, best=0.928][A
Staphylococcus_Aureus | Fusidic acid | Optuna:  12%|█▎        | 25/200 [36:19<4:29:11, 92.30s/it, best=0.928][A[I 2026-02-28 03:17:41,423] Trial 99 finished with value: 0.8953181380783773 and parameters: {'activation': 'relu', 'solver': 'adam', 'lr': 0.00014175641142395625, 'layer1': 491, 'layer2': 116, 'layer3': 52}. Best is trial 14 with value: 0.8971256036318559.

Escherichia_Coli | Ceftriaxone | Optuna:  50%|█████     | 100/200 [4:07:42<3:44:35, 134.75s/it, best=0.897][A
Escherichia_Coli | Ceftriaxone | Optuna:  50%|█████     | 100/200 [4:07:42<3:44:35, 134.75s/it, best=0.897][A[I 2026-02-28 03:18:13,073] Trial 51 finished with value: 0.8669688076734644 and parameters: {'activation': 'identity', 'solver': 'adam', 'lr': 0.00015584345859124182, 'layer1': 11, 'layer2': 460, 'layer3': 418}. Best is trial 34 with value: 0.8674293894305268.
Pseudomonas_Aeruginosa | LPS | Optuna:  26%|██▌       | 52/200 [1:13:15<3:34:14, 86.85s/it, best=0.867]Pseudomonas_Aeruginosa | LPS | Optuna:  26%|██▌       | 52/200 [1:13:15<3:34:14, 86.85s/it, best=0.867]/export/usuarios01/egarroyo/MALDI_for_AMR_prediction/venv/lib/python3.13/site-packages/sklearn/model_selection/_split.py:813: UserWarning: The least populated class in y has only 4 members, which is less than n_splits=5.
  warnings.warn(
[I 2026-02-28 03:18:40,420] Trial 193 finished with value: 0.9077044951765936 and parameters: {'activation': 'tanh', 'solver': 'adam', 'lr': 3.332032053192721e-05, 'layer1': 160, 'layer2': 461, 'layer3': 227}. Best is trial 174 with value: 0.9115644647823175.

Klebsiella_Pneumoniae | Ceftriaxone | Optuna:  97%|█████████▋| 194/200 [6:28:01<11:17, 112.92s/it, best=0.912][A
Klebsiella_Pneumoniae | Ceftriaxone | Optuna:  97%|█████████▋| 194/200 [6:28:01<11:17, 112.92s/it, best=0.912][A[I 2026-02-28 03:18:44,166] Trial 25 finished with value: 0.9224026610422346 and parameters: {'activation': 'identity', 'solver': 'adam', 'lr': 0.00020876492308261743, 'layer1': 307, 'layer2': 208, 'layer3': 364}. Best is trial 20 with value: 0.9283335834984147.

Staphylococcus_Aureus | Fusidic acid | Optuna:  13%|█▎        | 26/200 [37:53<4:28:38, 92.64s/it, best=0.928][A
Staphylococcus_Aureus | Fusidic acid | Optuna:  13%|█▎        | 26/200 [37:53<4:28:38, 92.64s/it, best=0.928][A[I 2026-02-28 03:19:17,845] Trial 52 finished with value: 0.8646055503431466 and parameters: {'activation': 'identity', 'solver': 'adam', 'lr': 0.00020849332695351518, 'layer1': 21, 'layer2': 447, 'layer3': 430}. Best is trial 34 with value: 0.8674293894305268.
Pseudomonas_Aeruginosa | LPS | Optuna:  26%|██▋       | 53/200 [1:14:19<3:16:33, 80.23s/it, best=0.867]Pseudomonas_Aeruginosa | LPS | Optuna:  26%|██▋       | 53/200 [1:14:19<3:16:33, 80.23s/it, best=0.867]/export/usuarios01/egarroyo/MALDI_for_AMR_prediction/venv/lib/python3.13/site-packages/sklearn/model_selection/_split.py:813: UserWarning: The least populated class in y has only 4 members, which is less than n_splits=5.
  warnings.warn(
[I 2026-02-28 03:19:18,294] Trial 26 finished with value: 0.9048909057631024 and parameters: {'activation': 'identity', 'solver': 'sgd', 'lr': 0.0007359974431492631, 'layer1': 380, 'layer2': 63, 'layer3': 440}. Best is trial 20 with value: 0.9283335834984147.

Staphylococcus_Aureus | Fusidic acid | Optuna:  14%|█▎        | 27/200 [38:27<3:36:29, 75.08s/it, best=0.928][A
