Staphylococcus_Aureus | DirectMulti | Optuna:  23%|██▎       | 46/200 [1:59:28<8:57:52, 209.56s/it, best=0.887]Staphylococcus_Aureus | DirectMulti | Optuna:  23%|██▎       | 46/200 [1:59:28<8:57:52, 209.56s/it, best=0.887][I 2026-02-28 16:30:17,905] Trial 118 finished with value: 0.9206432022916846 and parameters: {'activation': 'tanh', 'solver': 'adam', 'lr': 2.981460068293634e-05, 'layer1': 27, 'layer2': 400, 'layer3': 459}. Best is trial 116 with value: 0.9230019854081373.
Klebsiella_Pneumoniae | DirectMulti | Optuna:  60%|█████▉    | 119/200 [3:04:03<2:25:45, 107.97s/it, best=0.923]Klebsiella_Pneumoniae | DirectMulti | Optuna:  60%|█████▉    | 119/200 [3:04:03<2:25:45, 107.97s/it, best=0.923][I 2026-02-28 16:30:28,962] Trial 50 finished with value: 0.8840458781554725 and parameters: {'activation': 'tanh', 'solver': 'adam', 'lr': 6.111503316098123e-05, 'layer1': 500, 'layer2': 149, 'layer3': 218}. Best is trial 14 with value: 0.8911503569339929.

Escherichia_Coli | Cefepime | Optuna:  26%|██▌       | 51/200 [1:32:53<4:15:08, 102.74s/it, best=0.891][A
Escherichia_Coli | Cefepime | Optuna:  26%|██▌       | 51/200 [1:32:53<4:15:08, 102.74s/it, best=0.891][A[I 2026-02-28 16:30:33,367] Trial 46 finished with value: 0.8731370360433968 and parameters: {'activation': 'tanh', 'solver': 'adam', 'lr': 0.0011748344320021843, 'layer1': 278, 'layer2': 243, 'layer3': 282}. Best is trial 40 with value: 0.8869621040536522.
Staphylococcus_Aureus | DirectMulti | Optuna:  24%|██▎       | 47/200 [2:00:38<7:08:05, 167.88s/it, best=0.887]Staphylococcus_Aureus | DirectMulti | Optuna:  24%|██▎       | 47/200 [2:00:38<7:08:05, 167.88s/it, best=0.887][I 2026-02-28 16:32:21,268] Trial 51 finished with value: 0.8894622954880809 and parameters: {'activation': 'relu', 'solver': 'adam', 'lr': 0.00020807611736648517, 'layer1': 475, 'layer2': 245, 'layer3': 172}. Best is trial 14 with value: 0.8911503569339929.

Escherichia_Coli | Cefepime | Optuna:  26%|██▌       | 52/200 [1:34:46<4:20:30, 105.61s/it, best=0.891][A
Escherichia_Coli | Cefepime | Optuna:  26%|██▌       | 52/200 [1:34:46<4:20:30, 105.61s/it, best=0.891][A[I 2026-02-28 16:33:38,901] Trial 52 finished with value: 0.8876588818475625 and parameters: {'activation': 'relu', 'solver': 'adam', 'lr': 0.00011565349979508046, 'layer1': 156, 'layer2': 455, 'layer3': 177}. Best is trial 14 with value: 0.8911503569339929.

Escherichia_Coli | Cefepime | Optuna:  26%|██▋       | 53/200 [1:36:03<3:58:10, 97.22s/it, best=0.891] [A
Escherichia_Coli | Cefepime | Optuna:  26%|██▋       | 53/200 [1:36:03<3:58:10, 97.22s/it, best=0.891][A[I 2026-02-28 16:35:29,870] Trial 53 finished with value: 0.8886338690876411 and parameters: {'activation': 'relu', 'solver': 'adam', 'lr': 0.0005319307175717723, 'layer1': 483, 'layer2': 338, 'layer3': 165}. Best is trial 14 with value: 0.8911503569339929.

Escherichia_Coli | Cefepime | Optuna:  27%|██▋       | 54/200 [1:37:54<4:06:35, 101.34s/it, best=0.891][A
Escherichia_Coli | Cefepime | Optuna:  27%|██▋       | 54/200 [1:37:54<4:06:35, 101.34s/it, best=0.891][A[I 2026-02-28 16:37:27,668] Trial 119 finished with value: 0.8142402402734893 and parameters: {'activation': 'tanh', 'solver': 'sgd', 'lr': 1.5018707413163676e-05, 'layer1': 83, 'layer2': 464, 'layer3': 498}. Best is trial 116 with value: 0.9230019854081373.
Klebsiella_Pneumoniae | DirectMulti | Optuna:  60%|██████    | 120/200 [3:11:13<4:32:40, 204.51s/it, best=0.923]Klebsiella_Pneumoniae | DirectMulti | Optuna:  60%|██████    | 120/200 [3:11:13<4:32:40, 204.51s/it, best=0.923][I 2026-02-28 16:37:54,457] Trial 54 finished with value: 0.8900924115121331 and parameters: {'activation': 'relu', 'solver': 'adam', 'lr': 4.166943163817265e-05, 'layer1': 448, 'layer2': 274, 'layer3': 139}. Best is trial 14 with value: 0.8911503569339929.

Escherichia_Coli | Cefepime | Optuna:  28%|██▊       | 55/200 [1:40:19<4:36:15, 114.32s/it, best=0.891][A
Escherichia_Coli | Cefepime | Optuna:  28%|██▊       | 55/200 [1:40:19<4:36:15, 114.32s/it, best=0.891][A[I 2026-02-28 16:39:17,202] Trial 47 finished with value: 0.793437664283584 and parameters: {'activation': 'tanh', 'solver': 'sgd', 'lr': 0.0001054225344646776, 'layer1': 486, 'layer2': 189, 'layer3': 127}. Best is trial 40 with value: 0.8869621040536522.
Staphylococcus_Aureus | DirectMulti | Optuna:  24%|██▍       | 48/200 [2:09:22<11:35:49, 274.67s/it, best=0.887]Staphylococcus_Aureus | DirectMulti | Optuna:  24%|██▍       | 48/200 [2:09:22<11:35:49, 274.67s/it, best=0.887][I 2026-02-28 16:39:22,214] Trial 120 finished with value: 0.9215071402176689 and parameters: {'activation': 'tanh', 'solver': 'adam', 'lr': 3.267530849917957e-05, 'layer1': 58, 'layer2': 413, 'layer3': 469}. Best is trial 116 with value: 0.9230019854081373.
Klebsiella_Pneumoniae | DirectMulti | Optuna:  60%|██████    | 121/200 [3:13:07<3:53:43, 177.52s/it, best=0.923]Klebsiella_Pneumoniae | DirectMulti | Optuna:  60%|██████    | 121/200 [3:13:07<3:53:43, 177.52s/it, best=0.923][I 2026-02-28 16:40:08,857] Trial 55 finished with value: 0.888774290531184 and parameters: {'activation': 'relu', 'solver': 'adam', 'lr': 3.982302955560823e-05, 'layer1': 434, 'layer2': 275, 'layer3': 79}. Best is trial 14 with value: 0.8911503569339929.

Escherichia_Coli | Cefepime | Optuna:  28%|██▊       | 56/200 [1:42:33<4:48:49, 120.34s/it, best=0.891][A
Escherichia_Coli | Cefepime | Optuna:  28%|██▊       | 56/200 [1:42:33<4:48:49, 120.34s/it, best=0.891][A[I 2026-02-28 16:40:41,104] Trial 48 finished with value: 0.8854702830367032 and parameters: {'activation': 'tanh', 'solver': 'adam', 'lr': 0.000249880159585178, 'layer1': 446, 'layer2': 271, 'layer3': 200}. Best is trial 40 with value: 0.8869621040536522.
Staphylococcus_Aureus | DirectMulti | Optuna:  24%|██▍       | 49/200 [2:10:46<9:07:12, 217.44s/it, best=0.887] Staphylococcus_Aureus | DirectMulti | Optuna:  24%|██▍       | 49/200 [2:10:46<9:07:12, 217.44s/it, best=0.887][I 2026-02-28 16:40:54,470] Trial 121 finished with value: 0.9211286818264188 and parameters: {'activation': 'tanh', 'solver': 'adam', 'lr': 4.930899477405322e-05, 'layer1': 43, 'layer2': 473, 'layer3': 446}. Best is trial 116 with value: 0.9230019854081373.
Klebsiella_Pneumoniae | DirectMulti | Optuna:  61%|██████    | 122/200 [3:14:40<3:17:31, 151.94s/it, best=0.923]Klebsiella_Pneumoniae | DirectMulti | Optuna:  61%|██████    | 122/200 [3:14:40<3:17:31, 151.94s/it, best=0.923][I 2026-02-28 16:42:27,763] Trial 49 finished with value: 0.8868050142916832 and parameters: {'activation': 'tanh', 'solver': 'adam', 'lr': 0.00022692076508145316, 'layer1': 386, 'layer2': 277, 'layer3': 198}. Best is trial 40 with value: 0.8869621040536522.
Staphylococcus_Aureus | DirectMulti | Optuna:  25%|██▌       | 50/200 [2:12:33<7:40:30, 184.20s/it, best=0.887]Staphylococcus_Aureus | DirectMulti | Optuna:  25%|██▌       | 50/200 [2:12:33<7:40:30, 184.20s/it, best=0.887][I 2026-02-28 16:42:46,821] Trial 56 finished with value: 0.8861563994327065 and parameters: {'activation': 'relu', 'solver': 'adam', 'lr': 0.0003282149377027387, 'layer1': 447, 'layer2': 233, 'layer3': 133}. Best is trial 14 with value: 0.8911503569339929.

Escherichia_Coli | Cefepime | Optuna:  28%|██▊       | 57/200 [1:45:11<5:13:42, 131.63s/it, best=0.891][A
Escherichia_Coli | Cefepime | Optuna:  28%|██▊       | 57/200 [1:45:11<5:13:42, 131.63s/it, best=0.891][A[I 2026-02-28 16:43:44,141] Trial 122 finished with value: 0.9202245431045919 and parameters: {'activation': 'tanh', 'solver': 'adam', 'lr': 2.0260577748489216e-05, 'layer1': 20, 'layer2': 497, 'layer3': 484}. Best is trial 116 with value: 0.9230019854081373.
Klebsiella_Pneumoniae | DirectMulti | Optuna:  62%|██████▏   | 123/200 [3:17:29<3:21:48, 157.26s/it, best=0.923]Klebsiella_Pneumoniae | DirectMulti | Optuna:  62%|██████▏   | 123/200 [3:17:29<3:21:48, 157.26s/it, best=0.923][I 2026-02-28 16:44:03,555] Trial 50 finished with value: 0.8806942323577023 and parameters: {'activation': 'tanh', 'solver': 'adam', 'lr': 0.0005267378952136052, 'layer1': 381, 'layer2': 299, 'layer3': 269}. Best is trial 40 with value: 0.8869621040536522.
Staphylococcus_Aureus | DirectMulti | Optuna:  26%|██▌       | 51/200 [2:14:08<6:31:34, 157.68s/it, best=0.887]Staphylococcus_Aureus | DirectMulti | Optuna:  26%|██▌       | 51/200 [2:14:08<6:31:34, 157.68s/it, best=0.887][I 2026-02-28 16:45:03,557] Trial 51 finished with value: 0.8841154916041644 and parameters: {'activation': 'tanh', 'solver': 'adam', 'lr': 0.0002639132364289302, 'layer1': 11, 'layer2': 276, 'layer3': 186}. Best is trial 40 with value: 0.8869621040536522.
Staphylococcus_Aureus | DirectMulti | Optuna:  26%|██▌       | 52/200 [2:15:08<5:16:39, 128.38s/it, best=0.887]Staphylococcus_Aureus | DirectMulti | Optuna:  26%|██▌       | 52/200 [2:15:08<5:16:39, 128.38s/it, best=0.887][I 2026-02-28 16:45:07,168] Trial 57 finished with value: 0.8773381807678678 and parameters: {'activation': 'identity', 'solver': 'adam', 'lr': 2.219544993884469e-05, 'layer1': 243, 'layer2': 287, 'layer3': 139}. Best is trial 14 with value: 0.8911503569339929.

Escherichia_Coli | Cefepime | Optuna:  29%|██▉       | 58/200 [1:47:31<5:17:42, 134.24s/it, best=0.891][A
Escherichia_Coli | Cefepime | Optuna:  29%|██▉       | 58/200 [1:47:31<5:17:42, 134.24s/it, best=0.891][A[I 2026-02-28 16:45:23,145] Trial 123 finished with value: 0.9228920620412125 and parameters: {'activation': 'tanh', 'solver': 'adam', 'lr': 3.527872047168376e-05, 'layer1': 46, 'layer2': 482, 'layer3': 473}. Best is trial 116 with value: 0.9230019854081373.
Klebsiella_Pneumoniae | DirectMulti | Optuna:  62%|██████▏   | 124/200 [3:19:08<2:57:03, 139.78s/it, best=0.923]Klebsiella_Pneumoniae | DirectMulti | Optuna:  62%|██████▏   | 124/200 [3:19:08<2:57:03, 139.78s/it, best=0.923][I 2026-02-28 16:45:54,270] Trial 58 finished with value: 0.7586274850191519 and parameters: {'activation': 'relu', 'solver': 'sgd', 'lr': 0.00019934463018038233, 'layer1': 402, 'layer2': 197, 'layer3': 29}. Best is trial 14 with value: 0.8911503569339929.

Escherichia_Coli | Cefepime | Optuna:  30%|██▉       | 59/200 [1:48:19<4:14:02, 108.10s/it, best=0.891][A
Escherichia_Coli | Cefepime | Optuna:  30%|██▉       | 59/200 [1:48:19<4:14:02, 108.10s/it, best=0.891][A[I 2026-02-28 16:46:43,527] Trial 52 finished with value: 0.8855695302436442 and parameters: {'activation': 'tanh', 'solver': 'adam', 'lr': 0.00015225903803877414, 'layer1': 445, 'layer2': 320, 'layer3': 219}. Best is trial 40 with value: 0.8869621040536522.
Staphylococcus_Aureus | DirectMulti | Optuna:  26%|██▋       | 53/200 [2:16:48<4:53:38, 119.85s/it, best=0.887]Staphylococcus_Aureus | DirectMulti | Optuna:  26%|██▋       | 53/200 [2:16:48<4:53:38, 119.85s/it, best=0.887][I 2026-02-28 16:47:24,512] Trial 59 finished with value: 0.8809821802787476 and parameters: {'activation': 'logistic', 'solver': 'adam', 'lr': 0.0007353353643807255, 'layer1': 476, 'layer2': 286, 'layer3': 102}. Best is trial 14 with value: 0.8911503569339929.

Escherichia_Coli | Cefepime | Optuna:  30%|███       | 60/200 [1:49:49<3:59:44, 102.74s/it, best=0.891][A
Escherichia_Coli | Cefepime | Optuna:  30%|███       | 60/200 [1:49:49<3:59:44, 102.74s/it, best=0.891][A[I 2026-02-28 16:47:30,987] Trial 124 finished with value: 0.9201677216706827 and parameters: {'activation': 'tanh', 'solver': 'adam', 'lr': 2.380267560667516e-05, 'layer1': 38, 'layer2': 460, 'layer3': 500}. Best is trial 116 with value: 0.9230019854081373.
Klebsiella_Pneumoniae | DirectMulti | Optuna:  62%|██████▎   | 125/200 [3:21:16<2:50:15, 136.20s/it, best=0.923]Klebsiella_Pneumoniae | DirectMulti | Optuna:  62%|██████▎   | 125/200 [3:21:16<2:50:15, 136.20s/it, best=0.923][I 2026-02-28 16:48:42,619] Trial 53 finished with value: 0.8858351311707733 and parameters: {'activation': 'tanh', 'solver': 'adam', 'lr': 0.00013763945380080187, 'layer1': 430, 'layer2': 316, 'layer3': 227}. Best is trial 40 with value: 0.8869621040536522.
Staphylococcus_Aureus | DirectMulti | Optuna:  27%|██▋       | 54/200 [2:18:48<4:51:05, 119.63s/it, best=0.887]Staphylococcus_Aureus | DirectMulti | Optuna:  27%|██▋       | 54/200 [2:18:48<4:51:05, 119.63s/it, best=0.887][I 2026-02-28 16:49:10,090] Trial 60 finished with value: 0.8897467215306396 and parameters: {'activation': 'relu', 'solver': 'adam', 'lr': 0.00013074574030498684, 'layer1': 419, 'layer2': 331, 'layer3': 217}. Best is trial 14 with value: 0.8911503569339929.

Escherichia_Coli | Cefepime | Optuna:  30%|███       | 61/200 [1:51:34<3:59:59, 103.59s/it, best=0.891][A
Escherichia_Coli | Cefepime | Optuna:  30%|███       | 61/200 [1:51:34<3:59:59, 103.59s/it, best=0.891][A[I 2026-02-28 16:49:21,831] Trial 125 finished with value: 0.9208207792776351 and parameters: {'activation': 'tanh', 'solver': 'adam', 'lr': 3.452808227255097e-05, 'layer1': 10, 'layer2': 444, 'layer3': 477}. Best is trial 116 with value: 0.9230019854081373.
Klebsiella_Pneumoniae | DirectMulti | Optuna:  63%|██████▎   | 126/200 [3:23:07<2:38:35, 128.59s/it, best=0.923]Klebsiella_Pneumoniae | DirectMulti | Optuna:  63%|██████▎   | 126/200 [3:23:07<2:38:35, 128.59s/it, best=0.923][I 2026-02-28 16:50:49,229] Trial 54 finished with value: 0.8848764027767654 and parameters: {'activation': 'tanh', 'solver': 'adam', 'lr': 0.00013964311662029196, 'layer1': 421, 'layer2': 324, 'layer3': 237}. Best is trial 40 with value: 0.8869621040536522.
Staphylococcus_Aureus | DirectMulti | Optuna:  28%|██▊       | 55/200 [2:20:54<4:54:09, 121.72s/it, best=0.887]Staphylococcus_Aureus | DirectMulti | Optuna:  28%|██▊       | 55/200 [2:20:54<4:54:09, 121.72s/it, best=0.887][I 2026-02-28 16:50:59,270] Trial 126 finished with value: 0.9217627315377811 and parameters: {'activation': 'tanh', 'solver': 'adam', 'lr': 4.304751164928582e-05, 'layer1': 59, 'layer2': 481, 'layer3': 452}. Best is trial 116 with value: 0.9230019854081373.
Klebsiella_Pneumoniae | DirectMulti | Optuna:  64%|██████▎   | 127/200 [3:24:44<2:25:05, 119.25s/it, best=0.923]Klebsiella_Pneumoniae | DirectMulti | Optuna:  64%|██████▎   | 127/200 [3:24:44<2:25:05, 119.25s/it, best=0.923][I 2026-02-28 16:51:05,454] Trial 61 finished with value: 0.8886714793804819 and parameters: {'activation': 'relu', 'solver': 'adam', 'lr': 0.00013730897853088663, 'layer1': 424, 'layer2': 369, 'layer3': 217}. Best is trial 14 with value: 0.8911503569339929.

Escherichia_Coli | Cefepime | Optuna:  31%|███       | 62/200 [1:53:30<4:06:23, 107.12s/it, best=0.891][A
Escherichia_Coli | Cefepime | Optuna:  31%|███       | 62/200 [1:53:30<4:06:23, 107.12s/it, best=0.891][A[I 2026-02-28 16:51:22,884] Trial 127 finished with value: 0.871869354896984 and parameters: {'activation': 'relu', 'solver': 'adam', 'lr': 1.0544105371219717e-05, 'layer1': 28, 'layer2': 433, 'layer3': 489}. Best is trial 116 with value: 0.9230019854081373.
Klebsiella_Pneumoniae | DirectMulti | Optuna:  64%|██████▍   | 128/200 [3:25:08<1:48:40, 90.56s/it, best=0.923] Klebsiella_Pneumoniae | DirectMulti | Optuna:  64%|██████▍   | 128/200 [3:25:08<1:48:40, 90.56s/it, best=0.923][I 2026-02-28 16:52:27,187] Trial 128 finished with value: 0.9213230020183432 and parameters: {'activation': 'tanh', 'solver': 'adam', 'lr': 7.762184494306026e-05, 'layer1': 48, 'layer2': 474, 'layer3': 459}. Best is trial 116 with value: 0.9230019854081373.
Klebsiella_Pneumoniae | DirectMulti | Optuna:  64%|██████▍   | 129/200 [3:26:12<1:37:50, 82.68s/it, best=0.923]Klebsiella_Pneumoniae | DirectMulti | Optuna:  64%|██████▍   | 129/200 [3:26:12<1:37:50, 82.68s/it, best=0.923][I 2026-02-28 16:52:53,597] Trial 55 finished with value: 0.8830465648227837 and parameters: {'activation': 'tanh', 'solver': 'adam', 'lr': 5.241596127382477e-05, 'layer1': 103, 'layer2': 317, 'layer3': 223}. Best is trial 40 with value: 0.8869621040536522.
Staphylococcus_Aureus | DirectMulti | Optuna:  28%|██▊       | 56/200 [2:22:59<4:54:02, 122.52s/it, best=0.887]Staphylococcus_Aureus | DirectMulti | Optuna:  28%|██▊       | 56/200 [2:22:59<4:54:02, 122.52s/it, best=0.887][I 2026-02-28 16:53:20,895] Trial 62 finished with value: 0.8894876075268205 and parameters: {'activation': 'relu', 'solver': 'adam', 'lr': 4.1349736471137804e-05, 'layer1': 458, 'layer2': 324, 'layer3': 230}. Best is trial 14 with value: 0.8911503569339929.

Escherichia_Coli | Cefepime | Optuna:  32%|███▏      | 63/200 [1:55:45<4:23:59, 115.62s/it, best=0.891][A
Escherichia_Coli | Cefepime | Optuna:  32%|███▏      | 63/200 [1:55:45<4:23:59, 115.62s/it, best=0.891][A[I 2026-02-28 16:54:28,306] Trial 129 finished with value: 0.9199588686901621 and parameters: {'activation': 'tanh', 'solver': 'adam', 'lr': 2.863346061102514e-05, 'layer1': 197, 'layer2': 225, 'layer3': 440}. Best is trial 116 with value: 0.9230019854081373.
Klebsiella_Pneumoniae | DirectMulti | Optuna:  65%|██████▌   | 130/200 [3:28:13<1:49:54, 94.21s/it, best=0.923]Klebsiella_Pneumoniae | DirectMulti | Optuna:  65%|██████▌   | 130/200 [3:28:13<1:49:54, 94.21s/it, best=0.923][I 2026-02-28 16:54:31,996] Trial 56 finished with value: 0.8851924054991118 and parameters: {'activation': 'tanh', 'solver': 'adam', 'lr': 0.00013817204623441903, 'layer1': 337, 'layer2': 217, 'layer3': 174}. Best is trial 40 with value: 0.8869621040536522.
Staphylococcus_Aureus | DirectMulti | Optuna:  28%|██▊       | 57/200 [2:24:37<4:34:45, 115.28s/it, best=0.887]Staphylococcus_Aureus | DirectMulti | Optuna:  28%|██▊       | 57/200 [2:24:37<4:34:45, 115.28s/it, best=0.887][I 2026-02-28 16:55:29,923] Trial 63 finished with value: 0.887398973539514 and parameters: {'activation': 'relu', 'solver': 'adam', 'lr': 4.584168092886134e-05, 'layer1': 481, 'layer2': 338, 'layer3': 239}. Best is trial 14 with value: 0.8911503569339929.

Escherichia_Coli | Cefepime | Optuna:  32%|███▏      | 64/200 [1:57:54<4:31:11, 119.64s/it, best=0.891][A
Escherichia_Coli | Cefepime | Optuna:  32%|███▏      | 64/200 [1:57:54<4:31:11, 119.64s/it, best=0.891][A[I 2026-02-28 16:56:05,942] Trial 57 finished with value: 0.8835811905492645 and parameters: {'activation': 'tanh', 'solver': 'adam', 'lr': 0.0005321095416716481, 'layer1': 394, 'layer2': 287, 'layer3': 81}. Best is trial 40 with value: 0.8869621040536522.
Staphylococcus_Aureus | DirectMulti | Optuna:  29%|██▉       | 58/200 [2:26:11<4:17:40, 108.88s/it, best=0.887]Staphylococcus_Aureus | DirectMulti | Optuna:  29%|██▉       | 58/200 [2:26:11<4:17:40, 108.88s/it, best=0.887][I 2026-02-28 16:56:07,123] Trial 130 finished with value: 0.9199501291553472 and parameters: {'activation': 'tanh', 'solver': 'adam', 'lr': 4.753606445201666e-05, 'layer1': 33, 'layer2': 122, 'layer3': 467}. Best is trial 116 with value: 0.9230019854081373.
Klebsiella_Pneumoniae | DirectMulti | Optuna:  66%|██████▌   | 131/200 [3:29:52<1:49:55, 95.59s/it, best=0.923]Klebsiella_Pneumoniae | DirectMulti | Optuna:  66%|██████▌   | 131/200 [3:29:52<1:49:55, 95.59s/it, best=0.923][I 2026-02-28 16:56:57,239] Trial 64 finished with value: 0.888521829468851 and parameters: {'activation': 'relu', 'solver': 'adam', 'lr': 7.858016967829124e-05, 'layer1': 384, 'layer2': 322, 'layer3': 180}. Best is trial 14 with value: 0.8911503569339929.

Escherichia_Coli | Cefepime | Optuna:  32%|███▎      | 65/200 [1:59:22<4:07:22, 109.94s/it, best=0.891][A
Escherichia_Coli | Cefepime | Optuna:  32%|███▎      | 65/200 [1:59:22<4:07:22, 109.94s/it, best=0.891][A[I 2026-02-28 16:57:31,389] Trial 131 finished with value: 0.9220503356581939 and parameters: {'activation': 'tanh', 'solver': 'adam', 'lr': 5.984624064759928e-05, 'layer1': 48, 'layer2': 488, 'layer3': 426}. Best is trial 116 with value: 0.9230019854081373.
Klebsiella_Pneumoniae | DirectMulti | Optuna:  66%|██████▌   | 132/200 [3:31:17<1:44:29, 92.20s/it, best=0.923]Klebsiella_Pneumoniae | DirectMulti | Optuna:  66%|██████▌   | 132/200 [3:31:17<1:44:29, 92.20s/it, best=0.923][I 2026-02-28 16:57:37,906] Trial 58 finished with value: 0.8060069101502144 and parameters: {'activation': 'tanh', 'solver': 'sgd', 'lr': 0.0009817597045249312, 'layer1': 349, 'layer2': 251, 'layer3': 156}. Best is trial 40 with value: 0.8869621040536522.
Staphylococcus_Aureus | DirectMulti | Optuna:  30%|██▉       | 59/200 [2:27:43<4:03:56, 103.81s/it, best=0.887]Staphylococcus_Aureus | DirectMulti | Optuna:  30%|██▉       | 59/200 [2:27:43<4:03:56, 103.81s/it, best=0.887][I 2026-02-28 16:58:31,340] Trial 132 finished with value: 0.9218253748131764 and parameters: {'activation': 'tanh', 'solver': 'adam', 'lr': 0.00010578931216265717, 'layer1': 19, 'layer2': 484, 'layer3': 80}. Best is trial 116 with value: 0.9230019854081373.
Klebsiella_Pneumoniae | DirectMulti | Optuna:  66%|██████▋   | 133/200 [3:32:17<1:32:08, 82.52s/it, best=0.923]Klebsiella_Pneumoniae | DirectMulti | Optuna:  66%|██████▋   | 133/200 [3:32:17<1:32:08, 82.52s/it, best=0.923][I 2026-02-28 16:59:18,105] Trial 65 finished with value: 0.8864147095029014 and parameters: {'activation': 'relu', 'solver': 'adam', 'lr': 2.4387276568194198e-05, 'layer1': 457, 'layer2': 262, 'layer3': 204}. Best is trial 14 with value: 0.8911503569339929.

Escherichia_Coli | Cefepime | Optuna:  33%|███▎      | 66/200 [2:01:42<4:26:15, 119.22s/it, best=0.891][A
Escherichia_Coli | Cefepime | Optuna:  33%|███▎      | 66/200 [2:01:42<4:26:15, 119.22s/it, best=0.891][A[I 2026-02-28 16:59:48,987] Trial 133 finished with value: 0.9214504458831916 and parameters: {'activation': 'tanh', 'solver': 'adam', 'lr': 6.920004075647422e-05, 'layer1': 56, 'layer2': 465, 'layer3': 414}. Best is trial 116 with value: 0.9230019854081373.
