Escherichia_Coli | Ceftriaxone | Optuna:  60%|█████▉    | 119/200 [4:52:58<2:53:17, 128.37s/it, best=0.897][A[I 2026-02-28 04:03:30,695] Trial 81 finished with value: 0.8657974171386197 and parameters: {'activation': 'identity', 'solver': 'adam', 'lr': 0.001843043389465823, 'layer1': 304, 'layer2': 401, 'layer3': 421}. Best is trial 63 with value: 0.8682133709784562.
Pseudomonas_Aeruginosa | LPS | Optuna:  41%|████      | 82/200 [1:58:32<2:47:55, 85.38s/it, best=0.868]Pseudomonas_Aeruginosa | LPS | Optuna:  41%|████      | 82/200 [1:58:32<2:47:55, 85.38s/it, best=0.868]/export/usuarios01/egarroyo/MALDI_for_AMR_prediction/venv/lib/python3.13/site-packages/sklearn/model_selection/_split.py:813: UserWarning: The least populated class in y has only 4 members, which is less than n_splits=5.
  warnings.warn(
[I 2026-02-28 04:04:01,838] Trial 50 finished with value: 0.9187338608531308 and parameters: {'activation': 'relu', 'solver': 'adam', 'lr': 0.001776775017051264, 'layer1': 196, 'layer2': 378, 'layer3': 42}. Best is trial 20 with value: 0.9283335834984147.

Staphylococcus_Aureus | Fusidic acid | Optuna:  26%|██▌       | 51/200 [1:23:11<5:49:11, 140.61s/it, best=0.928][A
Staphylococcus_Aureus | Fusidic acid | Optuna:  26%|██▌       | 51/200 [1:23:11<5:49:11, 140.61s/it, best=0.928][A[I 2026-02-28 04:04:02,176] Trial 43 finished with value: 0.9783258561957062 and parameters: {'activation': 'identity', 'solver': 'adam', 'lr': 1.2403668302547623e-06, 'layer1': 401, 'layer2': 308, 'layer3': 395}. Best is trial 13 with value: 0.9860492846658779.

Klebsiella_Pneumoniae | Imipenem | Optuna:  22%|██▏       | 44/200 [35:14<3:11:21, 73.60s/it, best=0.986][A
Klebsiella_Pneumoniae | Imipenem | Optuna:  22%|██▏       | 44/200 [35:14<3:11:21, 73.60s/it, best=0.986][A[I 2026-02-28 04:05:00,197] Trial 51 finished with value: 0.9209213479533431 and parameters: {'activation': 'identity', 'solver': 'adam', 'lr': 8.707306830957166e-05, 'layer1': 11, 'layer2': 492, 'layer3': 106}. Best is trial 20 with value: 0.9283335834984147.

Staphylococcus_Aureus | Fusidic acid | Optuna:  26%|██▌       | 52/200 [1:24:09<4:45:58, 115.94s/it, best=0.928][A
Staphylococcus_Aureus | Fusidic acid | Optuna:  26%|██▌       | 52/200 [1:24:09<4:45:58, 115.94s/it, best=0.928][A[I 2026-02-28 04:05:18,370] Trial 82 finished with value: 0.8650200236786707 and parameters: {'activation': 'identity', 'solver': 'adam', 'lr': 0.001519265661574864, 'layer1': 293, 'layer2': 358, 'layer3': 392}. Best is trial 63 with value: 0.8682133709784562.
Pseudomonas_Aeruginosa | LPS | Optuna:  42%|████▏     | 83/200 [2:00:20<2:59:32, 92.07s/it, best=0.868]Pseudomonas_Aeruginosa | LPS | Optuna:  42%|████▏     | 83/200 [2:00:20<2:59:32, 92.07s/it, best=0.868]/export/usuarios01/egarroyo/MALDI_for_AMR_prediction/venv/lib/python3.13/site-packages/sklearn/model_selection/_split.py:813: UserWarning: The least populated class in y has only 4 members, which is less than n_splits=5.
  warnings.warn(
[I 2026-02-28 04:05:21,013] Trial 44 finished with value: 0.9853091421420277 and parameters: {'activation': 'relu', 'solver': 'adam', 'lr': 0.0009985486408387845, 'layer1': 478, 'layer2': 380, 'layer3': 493}. Best is trial 13 with value: 0.9860492846658779.

Klebsiella_Pneumoniae | Imipenem | Optuna:  22%|██▎       | 45/200 [36:33<3:14:11, 75.17s/it, best=0.986][A
Klebsiella_Pneumoniae | Imipenem | Optuna:  22%|██▎       | 45/200 [36:33<3:14:11, 75.17s/it, best=0.986][A[I 2026-02-28 04:05:47,857] Trial 119 finished with value: 0.8962101293740501 and parameters: {'activation': 'relu', 'solver': 'adam', 'lr': 4.711728370605372e-05, 'layer1': 472, 'layer2': 365, 'layer3': 83}. Best is trial 14 with value: 0.8971256036318559.

Escherichia_Coli | Ceftriaxone | Optuna:  60%|██████    | 120/200 [4:55:49<3:08:11, 141.14s/it, best=0.897][A
Escherichia_Coli | Ceftriaxone | Optuna:  60%|██████    | 120/200 [4:55:49<3:08:11, 141.14s/it, best=0.897][A[I 2026-02-28 04:06:19,271] Trial 52 finished with value: 0.9223013486161549 and parameters: {'activation': 'identity', 'solver': 'adam', 'lr': 5.974382668431669e-05, 'layer1': 368, 'layer2': 12, 'layer3': 189}. Best is trial 20 with value: 0.9283335834984147.

Staphylococcus_Aureus | Fusidic acid | Optuna:  26%|██▋       | 53/200 [1:25:28<4:16:57, 104.88s/it, best=0.928][A
Staphylococcus_Aureus | Fusidic acid | Optuna:  26%|██▋       | 53/200 [1:25:28<4:16:57, 104.88s/it, best=0.928][A[I 2026-02-28 04:06:26,144] Trial 45 finished with value: 0.9837180369066644 and parameters: {'activation': 'relu', 'solver': 'adam', 'lr': 0.0034003703355514176, 'layer1': 464, 'layer2': 408, 'layer3': 468}. Best is trial 13 with value: 0.9860492846658779.

Klebsiella_Pneumoniae | Imipenem | Optuna:  23%|██▎       | 46/200 [37:38<3:05:12, 72.16s/it, best=0.986][A
Klebsiella_Pneumoniae | Imipenem | Optuna:  23%|██▎       | 46/200 [37:38<3:05:12, 72.16s/it, best=0.986][A[I 2026-02-28 04:07:21,147] Trial 46 finished with value: 0.9836392608886904 and parameters: {'activation': 'identity', 'solver': 'adam', 'lr': 0.0011134014981840675, 'layer1': 427, 'layer2': 387, 'layer3': 497}. Best is trial 13 with value: 0.9860492846658779.

Klebsiella_Pneumoniae | Imipenem | Optuna:  24%|██▎       | 47/200 [38:33<2:50:52, 67.01s/it, best=0.986][A
Klebsiella_Pneumoniae | Imipenem | Optuna:  24%|██▎       | 47/200 [38:33<2:50:52, 67.01s/it, best=0.986][A[I 2026-02-28 04:07:25,216] Trial 83 finished with value: 0.8649533773052502 and parameters: {'activation': 'identity', 'solver': 'adam', 'lr': 0.00212773747404196, 'layer1': 317, 'layer2': 440, 'layer3': 488}. Best is trial 63 with value: 0.8682133709784562.
Pseudomonas_Aeruginosa | LPS | Optuna:  42%|████▏     | 84/200 [2:02:27<3:18:10, 102.50s/it, best=0.868]Pseudomonas_Aeruginosa | LPS | Optuna:  42%|████▏     | 84/200 [2:02:27<3:18:10, 102.50s/it, best=0.868]/export/usuarios01/egarroyo/MALDI_for_AMR_prediction/venv/lib/python3.13/site-packages/sklearn/model_selection/_split.py:813: UserWarning: The least populated class in y has only 4 members, which is less than n_splits=5.
  warnings.warn(
[I 2026-02-28 04:07:49,515] Trial 120 finished with value: 0.8922179340973424 and parameters: {'activation': 'relu', 'solver': 'adam', 'lr': 0.00013560885198106768, 'layer1': 453, 'layer2': 355, 'layer3': 69}. Best is trial 14 with value: 0.8971256036318559.

Escherichia_Coli | Ceftriaxone | Optuna:  60%|██████    | 121/200 [4:57:51<2:58:08, 135.30s/it, best=0.897][A
Escherichia_Coli | Ceftriaxone | Optuna:  60%|██████    | 121/200 [4:57:51<2:58:08, 135.30s/it, best=0.897][A[I 2026-02-28 04:07:51,362] Trial 47 finished with value: 0.9800270054346416 and parameters: {'activation': 'relu', 'solver': 'sgd', 'lr': 0.006795674842118177, 'layer1': 488, 'layer2': 332, 'layer3': 413}. Best is trial 13 with value: 0.9860492846658779.

Klebsiella_Pneumoniae | Imipenem | Optuna:  24%|██▍       | 48/200 [39:03<2:21:47, 55.97s/it, best=0.986][A
Klebsiella_Pneumoniae | Imipenem | Optuna:  24%|██▍       | 48/200 [39:03<2:21:47, 55.97s/it, best=0.986][A[I 2026-02-28 04:07:56,478] Trial 53 finished with value: 0.922564475315086 and parameters: {'activation': 'identity', 'solver': 'adam', 'lr': 9.388652003980807e-05, 'layer1': 416, 'layer2': 399, 'layer3': 223}. Best is trial 20 with value: 0.9283335834984147.

Staphylococcus_Aureus | Fusidic acid | Optuna:  27%|██▋       | 54/200 [1:27:05<4:09:36, 102.58s/it, best=0.928][A
Staphylococcus_Aureus | Fusidic acid | Optuna:  27%|██▋       | 54/200 [1:27:05<4:09:36, 102.58s/it, best=0.928][A[I 2026-02-28 04:08:43,290] Trial 48 finished with value: 0.9829733840622789 and parameters: {'activation': 'relu', 'solver': 'adam', 'lr': 0.000731360730178551, 'layer1': 446, 'layer2': 361, 'layer3': 452}. Best is trial 13 with value: 0.9860492846658779.

Klebsiella_Pneumoniae | Imipenem | Optuna:  24%|██▍       | 49/200 [39:55<2:17:48, 54.76s/it, best=0.986][A
Klebsiella_Pneumoniae | Imipenem | Optuna:  24%|██▍       | 49/200 [39:55<2:17:48, 54.76s/it, best=0.986][A[I 2026-02-28 04:09:11,212] Trial 84 finished with value: 0.8676224765365224 and parameters: {'activation': 'identity', 'solver': 'adam', 'lr': 0.0012596986136949634, 'layer1': 271, 'layer2': 364, 'layer3': 403}. Best is trial 63 with value: 0.8682133709784562.
Pseudomonas_Aeruginosa | LPS | Optuna:  42%|████▎     | 85/200 [2:04:13<3:18:28, 103.55s/it, best=0.868]Pseudomonas_Aeruginosa | LPS | Optuna:  42%|████▎     | 85/200 [2:04:13<3:18:28, 103.55s/it, best=0.868]/export/usuarios01/egarroyo/MALDI_for_AMR_prediction/venv/lib/python3.13/site-packages/sklearn/model_selection/_split.py:813: UserWarning: The least populated class in y has only 4 members, which is less than n_splits=5.
  warnings.warn(
[I 2026-02-28 04:09:48,289] Trial 49 finished with value: 0.9844037962133683 and parameters: {'activation': 'relu', 'solver': 'adam', 'lr': 0.0022489389259052403, 'layer1': 415, 'layer2': 444, 'layer3': 365}. Best is trial 13 with value: 0.9860492846658779.

Klebsiella_Pneumoniae | Imipenem | Optuna:  25%|██▌       | 50/200 [41:00<2:24:34, 57.83s/it, best=0.986][A
Klebsiella_Pneumoniae | Imipenem | Optuna:  25%|██▌       | 50/200 [41:00<2:24:34, 57.83s/it, best=0.986][A[I 2026-02-28 04:10:06,211] Trial 54 finished with value: 0.9268980640049005 and parameters: {'activation': 'identity', 'solver': 'adam', 'lr': 0.0003173854235587031, 'layer1': 477, 'layer2': 442, 'layer3': 125}. Best is trial 20 with value: 0.9283335834984147.

Staphylococcus_Aureus | Fusidic acid | Optuna:  28%|██▊       | 55/200 [1:29:15<4:27:34, 110.72s/it, best=0.928][A
Staphylococcus_Aureus | Fusidic acid | Optuna:  28%|██▊       | 55/200 [1:29:15<4:27:34, 110.72s/it, best=0.928][A[I 2026-02-28 04:10:40,914] Trial 50 finished with value: 0.9824635179094361 and parameters: {'activation': 'tanh', 'solver': 'adam', 'lr': 0.009889774303951016, 'layer1': 412, 'layer2': 443, 'layer3': 367}. Best is trial 13 with value: 0.9860492846658779.

Klebsiella_Pneumoniae | Imipenem | Optuna:  26%|██▌       | 51/200 [41:53<2:19:44, 56.27s/it, best=0.986][A
Klebsiella_Pneumoniae | Imipenem | Optuna:  26%|██▌       | 51/200 [41:53<2:19:44, 56.27s/it, best=0.986][A[I 2026-02-28 04:10:50,697] Trial 85 finished with value: 0.8651444224192344 and parameters: {'activation': 'identity', 'solver': 'adam', 'lr': 0.0012585517114061817, 'layer1': 276, 'layer2': 319, 'layer3': 365}. Best is trial 63 with value: 0.8682133709784562.
Pseudomonas_Aeruginosa | LPS | Optuna:  43%|████▎     | 86/200 [2:05:52<3:14:25, 102.33s/it, best=0.868]Pseudomonas_Aeruginosa | LPS | Optuna:  43%|████▎     | 86/200 [2:05:52<3:14:25, 102.33s/it, best=0.868]/export/usuarios01/egarroyo/MALDI_for_AMR_prediction/venv/lib/python3.13/site-packages/sklearn/model_selection/_split.py:813: UserWarning: The least populated class in y has only 4 members, which is less than n_splits=5.
  warnings.warn(
[I 2026-02-28 04:10:54,371] Trial 121 finished with value: 0.8972218268376771 and parameters: {'activation': 'relu', 'solver': 'adam', 'lr': 4.7102552854129126e-05, 'layer1': 472, 'layer2': 334, 'layer3': 104}. Best is trial 121 with value: 0.8972218268376771.

Escherichia_Coli | Ceftriaxone | Optuna:  61%|██████    | 122/200 [5:00:55<3:15:12, 150.16s/it, best=0.897][A
Escherichia_Coli | Ceftriaxone | Optuna:  61%|██████    | 122/200 [5:00:55<3:15:12, 150.16s/it, best=0.897][A[I 2026-02-28 04:11:42,714] Trial 51 finished with value: 0.9840364474852452 and parameters: {'activation': 'relu', 'solver': 'adam', 'lr': 0.0018808844401764632, 'layer1': 378, 'layer2': 437, 'layer3': 346}. Best is trial 13 with value: 0.9860492846658779.

Klebsiella_Pneumoniae | Imipenem | Optuna:  26%|██▌       | 52/200 [42:55<2:22:53, 57.93s/it, best=0.986][A
Klebsiella_Pneumoniae | Imipenem | Optuna:  26%|██▌       | 52/200 [42:55<2:22:53, 57.93s/it, best=0.986][A[I 2026-02-28 04:11:43,778] Trial 86 finished with value: 0.8457408038149854 and parameters: {'activation': 'tanh', 'solver': 'adam', 'lr': 0.0033761906357240795, 'layer1': 221, 'layer2': 337, 'layer3': 89}. Best is trial 63 with value: 0.8682133709784562.
Pseudomonas_Aeruginosa | LPS | Optuna:  44%|████▎     | 87/200 [2:06:45<2:44:53, 87.56s/it, best=0.868] Pseudomonas_Aeruginosa | LPS | Optuna:  44%|████▎     | 87/200 [2:06:45<2:44:53, 87.56s/it, best=0.868]/export/usuarios01/egarroyo/MALDI_for_AMR_prediction/venv/lib/python3.13/site-packages/sklearn/model_selection/_split.py:813: UserWarning: The least populated class in y has only 4 members, which is less than n_splits=5.
  warnings.warn(
[I 2026-02-28 04:12:44,595] Trial 52 finished with value: 0.9836385527811521 and parameters: {'activation': 'relu', 'solver': 'adam', 'lr': 0.003260600901333087, 'layer1': 458, 'layer2': 480, 'layer3': 397}. Best is trial 13 with value: 0.9860492846658779.

Klebsiella_Pneumoniae | Imipenem | Optuna:  26%|██▋       | 53/200 [43:57<2:24:49, 59.11s/it, best=0.986][A
Klebsiella_Pneumoniae | Imipenem | Optuna:  26%|██▋       | 53/200 [43:57<2:24:49, 59.11s/it, best=0.986][A[I 2026-02-28 04:13:13,175] Trial 55 finished with value: 0.9282591094471606 and parameters: {'activation': 'identity', 'solver': 'adam', 'lr': 0.000732259721309456, 'layer1': 494, 'layer2': 434, 'layer3': 163}. Best is trial 20 with value: 0.9283335834984147.

Staphylococcus_Aureus | Fusidic acid | Optuna:  28%|██▊       | 56/200 [1:32:22<5:20:37, 133.60s/it, best=0.928][A
Staphylococcus_Aureus | Fusidic acid | Optuna:  28%|██▊       | 56/200 [1:32:22<5:20:37, 133.60s/it, best=0.928][A[I 2026-02-28 04:13:33,190] Trial 87 finished with value: 0.8630743512437734 and parameters: {'activation': 'identity', 'solver': 'adam', 'lr': 0.0004990376305431647, 'layer1': 453, 'layer2': 366, 'layer3': 384}. Best is trial 63 with value: 0.8682133709784562.
Pseudomonas_Aeruginosa | LPS | Optuna:  44%|████▍     | 88/200 [2:08:35<2:55:40, 94.11s/it, best=0.868]Pseudomonas_Aeruginosa | LPS | Optuna:  44%|████▍     | 88/200 [2:08:35<2:55:40, 94.11s/it, best=0.868]/export/usuarios01/egarroyo/MALDI_for_AMR_prediction/venv/lib/python3.13/site-packages/sklearn/model_selection/_split.py:813: UserWarning: The least populated class in y has only 4 members, which is less than n_splits=5.
  warnings.warn(
[I 2026-02-28 04:13:41,615] Trial 53 finished with value: 0.9839569633597328 and parameters: {'activation': 'relu', 'solver': 'adam', 'lr': 0.002038553228419487, 'layer1': 481, 'layer2': 311, 'layer3': 476}. Best is trial 13 with value: 0.9860492846658779.

Klebsiella_Pneumoniae | Imipenem | Optuna:  27%|██▋       | 54/200 [44:54<2:22:18, 58.49s/it, best=0.986][A
Klebsiella_Pneumoniae | Imipenem | Optuna:  27%|██▋       | 54/200 [44:54<2:22:18, 58.49s/it, best=0.986][A[I 2026-02-28 04:14:12,117] Trial 122 finished with value: 0.897309104499819 and parameters: {'activation': 'relu', 'solver': 'adam', 'lr': 4.5442598797381054e-05, 'layer1': 469, 'layer2': 318, 'layer3': 83}. Best is trial 122 with value: 0.897309104499819.

Escherichia_Coli | Ceftriaxone | Optuna:  62%|██████▏   | 123/200 [5:04:13<3:31:01, 164.44s/it, best=0.897][A
Escherichia_Coli | Ceftriaxone | Optuna:  62%|██████▏   | 123/200 [5:04:13<3:31:01, 164.44s/it, best=0.897][A[I 2026-02-28 04:14:40,165] Trial 54 finished with value: 0.983637081256328 and parameters: {'activation': 'relu', 'solver': 'adam', 'lr': 0.0011869865371604122, 'layer1': 418, 'layer2': 357, 'layer3': 435}. Best is trial 13 with value: 0.9860492846658779.

Klebsiella_Pneumoniae | Imipenem | Optuna:  28%|██▊       | 55/200 [45:52<2:21:23, 58.51s/it, best=0.986][A
Klebsiella_Pneumoniae | Imipenem | Optuna:  28%|██▊       | 55/200 [45:52<2:21:23, 58.51s/it, best=0.986][A[I 2026-02-28 04:15:18,055] Trial 55 finished with value: 0.9800270054346416 and parameters: {'activation': 'relu', 'solver': 'adam', 'lr': 5.133145960452293e-06, 'layer1': 347, 'layer2': 388, 'layer3': 330}. Best is trial 13 with value: 0.9860492846658779.

Klebsiella_Pneumoniae | Imipenem | Optuna:  28%|██▊       | 56/200 [46:30<2:05:34, 52.32s/it, best=0.986][A
Klebsiella_Pneumoniae | Imipenem | Optuna:  28%|██▊       | 56/200 [46:30<2:05:34, 52.32s/it, best=0.986][A[I 2026-02-28 04:15:23,513] Trial 56 finished with value: 0.9125229575097331 and parameters: {'activation': 'tanh', 'solver': 'adam', 'lr': 0.0037396536590500024, 'layer1': 479, 'layer2': 408, 'layer3': 156}. Best is trial 20 with value: 0.9283335834984147.

Staphylococcus_Aureus | Fusidic acid | Optuna:  28%|██▊       | 57/200 [1:34:32<5:16:04, 132.62s/it, best=0.928][A
Staphylococcus_Aureus | Fusidic acid | Optuna:  28%|██▊       | 57/200 [1:34:32<5:16:04, 132.62s/it, best=0.928][A[I 2026-02-28 04:15:26,683] Trial 88 finished with value: 0.8652059074166194 and parameters: {'activation': 'identity', 'solver': 'adam', 'lr': 0.0008622458314521123, 'layer1': 425, 'layer2': 500, 'layer3': 405}. Best is trial 63 with value: 0.8682133709784562.
Pseudomonas_Aeruginosa | LPS | Optuna:  44%|████▍     | 89/200 [2:10:28<3:04:51, 99.93s/it, best=0.868]Pseudomonas_Aeruginosa | LPS | Optuna:  44%|████▍     | 89/200 [2:10:28<3:04:51, 99.93s/it, best=0.868]/export/usuarios01/egarroyo/MALDI_for_AMR_prediction/venv/lib/python3.13/site-packages/sklearn/model_selection/_split.py:813: UserWarning: The least populated class in y has only 4 members, which is less than n_splits=5.
  warnings.warn(
[I 2026-02-28 04:16:02,496] Trial 57 finished with value: 0.9050666137971211 and parameters: {'activation': 'logistic', 'solver': 'sgd', 'lr': 0.000561395098636949, 'layer1': 500, 'layer2': 364, 'layer3': 210}. Best is trial 20 with value: 0.9283335834984147.

Staphylococcus_Aureus | Fusidic acid | Optuna:  29%|██▉       | 58/200 [1:35:11<4:07:22, 104.53s/it, best=0.928][A
Staphylococcus_Aureus | Fusidic acid | Optuna:  29%|██▉       | 58/200 [1:35:11<4:07:22, 104.53s/it, best=0.928][A[I 2026-02-28 04:16:09,585] Trial 56 finished with value: 0.9826556815912362 and parameters: {'activation': 'identity', 'solver': 'adam', 'lr': 0.00019769753070393407, 'layer1': 497, 'layer2': 425, 'layer3': 405}. Best is trial 13 with value: 0.9860492846658779.

Klebsiella_Pneumoniae | Imipenem | Optuna:  28%|██▊       | 57/200 [47:22<2:04:07, 52.08s/it, best=0.986][A
Klebsiella_Pneumoniae | Imipenem | Optuna:  28%|██▊       | 57/200 [47:22<2:04:07, 52.08s/it, best=0.986][A[I 2026-02-28 04:16:27,693] Trial 89 finished with value: 0.8500238526719539 and parameters: {'activation': 'logistic', 'solver': 'adam', 'lr': 0.002615647875602855, 'layer1': 253, 'layer2': 286, 'layer3': 442}. Best is trial 63 with value: 0.8682133709784562.
Pseudomonas_Aeruginosa | LPS | Optuna:  45%|████▌     | 90/200 [2:11:29<2:41:47, 88.25s/it, best=0.868]Pseudomonas_Aeruginosa | LPS | Optuna:  45%|████▌     | 90/200 [2:11:29<2:41:47, 88.25s/it, best=0.868]/export/usuarios01/egarroyo/MALDI_for_AMR_prediction/venv/lib/python3.13/site-packages/sklearn/model_selection/_split.py:813: UserWarning: The least populated class in y has only 4 members, which is less than n_splits=5.
  warnings.warn(
[I 2026-02-28 04:16:37,727] Trial 57 finished with value: 0.9801111166314398 and parameters: {'activation': 'relu', 'solver': 'sgd', 'lr': 0.0006753976248256008, 'layer1': 274, 'layer2': 464, 'layer3': 362}. Best is trial 13 with value: 0.9860492846658779.

Klebsiella_Pneumoniae | Imipenem | Optuna:  29%|██▉       | 58/200 [47:50<1:46:15, 44.90s/it, best=0.986][A
Klebsiella_Pneumoniae | Imipenem | Optuna:  29%|██▉       | 58/200 [47:50<1:46:15, 44.90s/it, best=0.986][A[I 2026-02-28 04:17:19,640] Trial 123 finished with value: 0.8959326371247046 and parameters: {'activation': 'relu', 'solver': 'adam', 'lr': 3.6938048929386575e-05, 'layer1': 471, 'layer2': 328, 'layer3': 98}. Best is trial 122 with value: 0.897309104499819.

Escherichia_Coli | Ceftriaxone | Optuna:  62%|██████▏   | 124/200 [5:07:21<3:37:03, 171.36s/it, best=0.897][A
Escherichia_Coli | Ceftriaxone | Optuna:  62%|██████▏   | 124/200 [5:07:21<3:37:03, 171.36s/it, best=0.897][A[I 2026-02-28 04:17:29,015] Trial 58 finished with value: 0.9837187450142026 and parameters: {'activation': 'relu', 'solver': 'adam', 'lr': 0.0024882671570583413, 'layer1': 447, 'layer2': 87, 'layer3': 285}. Best is trial 13 with value: 0.9860492846658779.

Klebsiella_Pneumoniae | Imipenem | Optuna:  30%|██▉       | 59/200 [48:41<1:50:01, 46.82s/it, best=0.986][A
Klebsiella_Pneumoniae | Imipenem | Optuna:  30%|██▉       | 59/200 [48:41<1:50:01, 46.82s/it, best=0.986][A[I 2026-02-28 04:18:09,357] Trial 59 finished with value: 0.9800270054346416 and parameters: {'activation': 'logistic', 'solver': 'adam', 'lr': 0.004550786399303692, 'layer1': 477, 'layer2': 411, 'layer3': 14}. Best is trial 13 with value: 0.9860492846658779.

Klebsiella_Pneumoniae | Imipenem | Optuna:  30%|███       | 60/200 [49:21<1:44:42, 44.87s/it, best=0.986][A
Klebsiella_Pneumoniae | Imipenem | Optuna:  30%|███       | 60/200 [49:21<1:44:42, 44.87s/it, best=0.986][A[I 2026-02-28 04:18:09,855] Trial 90 finished with value: 0.8598830491387919 and parameters: {'activation': 'identity', 'solver': 'adam', 'lr': 0.005601543614888128, 'layer1': 372, 'layer2': 474, 'layer3': 244}. Best is trial 63 with value: 0.8682133709784562.
Pseudomonas_Aeruginosa | LPS | Optuna:  46%|████▌     | 91/200 [2:13:11<2:47:54, 92.43s/it, best=0.868]Pseudomonas_Aeruginosa | LPS | Optuna:  46%|████▌     | 91/200 [2:13:11<2:47:54, 92.43s/it, best=0.868]/export/usuarios01/egarroyo/MALDI_for_AMR_prediction/venv/lib/python3.13/site-packages/sklearn/model_selection/_split.py:813: UserWarning: The least populated class in y has only 4 members, which is less than n_splits=5.
  warnings.warn(
