Staphylococcus_Aureus | Oxacillin | Optuna:  24%|██▍       | 48/200 [1:48:20<5:15:19, 124.47s/it, best=0.909][A[I 2026-02-27 16:35:57,841] Trial 107 finished with value: 0.8725088415604404 and parameters: {'activation': 'logistic', 'solver': 'adam', 'lr': 0.0004986560144544866, 'layer1': 376, 'layer2': 203, 'layer3': 395}. Best is trial 46 with value: 0.8754031846375991.

Pseudomonas_Aeruginosa | Ciprofloxacin | Optuna:  54%|█████▍    | 108/200 [1:48:27<1:41:13, 66.02s/it, best=0.875][A
Pseudomonas_Aeruginosa | Ciprofloxacin | Optuna:  54%|█████▍    | 108/200 [1:48:27<1:41:13, 66.02s/it, best=0.875][A[I 2026-02-27 16:36:24,145] Trial 34 finished with value: 0.8072405041442254 and parameters: {'activation': 'logistic', 'solver': 'adam', 'lr': 0.00014718607809077245, 'layer1': 347, 'layer2': 279, 'layer3': 446}. Best is trial 34 with value: 0.8072405041442254.

Escherichia_Coli | Ciprofloxacin | Optuna:  18%|█▊        | 35/200 [1:48:53<8:28:55, 185.06s/it, best=0.806][A
Escherichia_Coli | Ciprofloxacin | Optuna:  18%|█▊        | 35/200 [1:48:53<8:28:55, 185.06s/it, best=0.807][A[I 2026-02-27 16:37:01,297] Trial 65 finished with value: 0.8216030754329046 and parameters: {'activation': 'identity', 'solver': 'adam', 'lr': 0.003853214049461965, 'layer1': 358, 'layer2': 383, 'layer3': 217}. Best is trial 64 with value: 0.8298953923751187.

Klebsiella_Pneumoniae | Ciprofloxacin | Optuna:  33%|███▎      | 66/200 [1:49:30<4:06:24, 110.33s/it, best=0.83][A
Klebsiella_Pneumoniae | Ciprofloxacin | Optuna:  33%|███▎      | 66/200 [1:49:30<4:06:24, 110.33s/it, best=0.83][A[I 2026-02-27 16:37:21,168] Trial 35 finished with value: 0.5920038260220011 and parameters: {'activation': 'logistic', 'solver': 'adam', 'lr': 1.735956820031938e-05, 'layer1': 349, 'layer2': 360, 'layer3': 437}. Best is trial 34 with value: 0.8072405041442254.

Escherichia_Coli | Ciprofloxacin | Optuna:  18%|█▊        | 36/200 [1:49:50<6:40:50, 146.65s/it, best=0.807][A
Escherichia_Coli | Ciprofloxacin | Optuna:  18%|█▊        | 36/200 [1:49:50<6:40:50, 146.65s/it, best=0.807][A[I 2026-02-27 16:37:44,491] Trial 108 finished with value: 0.8727986459467398 and parameters: {'activation': 'logistic', 'solver': 'adam', 'lr': 0.00017963357698161004, 'layer1': 226, 'layer2': 459, 'layer3': 454}. Best is trial 46 with value: 0.8754031846375991.

Pseudomonas_Aeruginosa | Ciprofloxacin | Optuna:  55%|█████▍    | 109/200 [1:50:14<1:58:36, 78.21s/it, best=0.875][A
Pseudomonas_Aeruginosa | Ciprofloxacin | Optuna:  55%|█████▍    | 109/200 [1:50:14<1:58:36, 78.21s/it, best=0.875][A[I 2026-02-27 16:38:03,952] Trial 48 finished with value: 0.9078418601382096 and parameters: {'activation': 'identity', 'solver': 'adam', 'lr': 0.003944987817143686, 'layer1': 275, 'layer2': 462, 'layer3': 301}. Best is trial 12 with value: 0.9088083331363105.

Staphylococcus_Aureus | Oxacillin | Optuna:  24%|██▍       | 49/200 [1:50:33<5:19:56, 127.13s/it, best=0.909][A
Staphylococcus_Aureus | Oxacillin | Optuna:  24%|██▍       | 49/200 [1:50:33<5:19:56, 127.13s/it, best=0.909][A[I 2026-02-27 16:38:12,839] Trial 36 finished with value: 0.5920038260220011 and parameters: {'activation': 'logistic', 'solver': 'adam', 'lr': 2.323324867791642e-05, 'layer1': 264, 'layer2': 291, 'layer3': 398}. Best is trial 34 with value: 0.8072405041442254.

Escherichia_Coli | Ciprofloxacin | Optuna:  18%|█▊        | 37/200 [1:50:42<5:20:59, 118.16s/it, best=0.807][A
Escherichia_Coli | Ciprofloxacin | Optuna:  18%|█▊        | 37/200 [1:50:42<5:20:59, 118.16s/it, best=0.807][A[I 2026-02-27 16:38:26,371] Trial 66 finished with value: 0.8167641405888553 and parameters: {'activation': 'identity', 'solver': 'adam', 'lr': 0.006286460078797265, 'layer1': 336, 'layer2': 457, 'layer3': 186}. Best is trial 64 with value: 0.8298953923751187.

Klebsiella_Pneumoniae | Ciprofloxacin | Optuna:  34%|███▎      | 67/200 [1:50:55<3:47:46, 102.75s/it, best=0.83][A
Klebsiella_Pneumoniae | Ciprofloxacin | Optuna:  34%|███▎      | 67/200 [1:50:55<3:47:46, 102.75s/it, best=0.83][A[I 2026-02-27 16:39:01,894] Trial 67 finished with value: 0.7417840809323848 and parameters: {'activation': 'relu', 'solver': 'adam', 'lr': 1.9200007248182342e-05, 'layer1': 314, 'layer2': 421, 'layer3': 205}. Best is trial 64 with value: 0.8298953923751187.

Klebsiella_Pneumoniae | Ciprofloxacin | Optuna:  34%|███▍      | 68/200 [1:51:31<3:01:41, 82.59s/it, best=0.83] [A
Klebsiella_Pneumoniae | Ciprofloxacin | Optuna:  34%|███▍      | 68/200 [1:51:31<3:01:41, 82.59s/it, best=0.83][A[I 2026-02-27 16:39:05,381] Trial 109 finished with value: 0.8740230979244265 and parameters: {'activation': 'logistic', 'solver': 'adam', 'lr': 0.0003208746714910748, 'layer1': 482, 'layer2': 283, 'layer3': 446}. Best is trial 46 with value: 0.8754031846375991.

Pseudomonas_Aeruginosa | Ciprofloxacin | Optuna:  55%|█████▌    | 110/200 [1:51:35<1:58:31, 79.01s/it, best=0.875][A
Pseudomonas_Aeruginosa | Ciprofloxacin | Optuna:  55%|█████▌    | 110/200 [1:51:35<1:58:31, 79.01s/it, best=0.875][A[I 2026-02-27 16:39:42,921] Trial 49 finished with value: 0.8945843511586637 and parameters: {'activation': 'tanh', 'solver': 'adam', 'lr': 0.0009537907099387656, 'layer1': 426, 'layer2': 114, 'layer3': 253}. Best is trial 12 with value: 0.9088083331363105.

Staphylococcus_Aureus | Oxacillin | Optuna:  25%|██▌       | 50/200 [1:52:12<4:56:42, 118.68s/it, best=0.909][A
Staphylococcus_Aureus | Oxacillin | Optuna:  25%|██▌       | 50/200 [1:52:12<4:56:42, 118.68s/it, best=0.909][A[I 2026-02-27 16:40:03,368] Trial 110 finished with value: 0.8664132089478471 and parameters: {'activation': 'tanh', 'solver': 'adam', 'lr': 0.00024470003626303954, 'layer1': 357, 'layer2': 114, 'layer3': 485}. Best is trial 46 with value: 0.8754031846375991.

Pseudomonas_Aeruginosa | Ciprofloxacin | Optuna:  56%|█████▌    | 111/200 [1:52:33<1:47:50, 72.70s/it, best=0.875][A
Pseudomonas_Aeruginosa | Ciprofloxacin | Optuna:  56%|█████▌    | 111/200 [1:52:33<1:47:50, 72.70s/it, best=0.875][A[I 2026-02-27 16:40:50,738] Trial 37 finished with value: 0.6498549981807914 and parameters: {'activation': 'relu', 'solver': 'adam', 'lr': 8.093179353282824e-06, 'layer1': 350, 'layer2': 319, 'layer3': 347}. Best is trial 34 with value: 0.8072405041442254.

Escherichia_Coli | Ciprofloxacin | Optuna:  19%|█▉        | 38/200 [1:53:20<5:51:12, 130.08s/it, best=0.807][A
Escherichia_Coli | Ciprofloxacin | Optuna:  19%|█▉        | 38/200 [1:53:20<5:51:12, 130.08s/it, best=0.807][A[I 2026-02-27 16:40:51,698] Trial 68 finished with value: 0.7886660826025056 and parameters: {'activation': 'tanh', 'solver': 'adam', 'lr': 0.0030173987715962328, 'layer1': 380, 'layer2': 362, 'layer3': 283}. Best is trial 64 with value: 0.8298953923751187.

Klebsiella_Pneumoniae | Ciprofloxacin | Optuna:  34%|███▍      | 69/200 [1:53:21<3:18:08, 90.75s/it, best=0.83][A
Klebsiella_Pneumoniae | Ciprofloxacin | Optuna:  34%|███▍      | 69/200 [1:53:21<3:18:08, 90.75s/it, best=0.83][A[I 2026-02-27 16:41:26,476] Trial 111 finished with value: 0.872384310502564 and parameters: {'activation': 'logistic', 'solver': 'adam', 'lr': 0.0003726065689426211, 'layer1': 485, 'layer2': 279, 'layer3': 442}. Best is trial 46 with value: 0.8754031846375991.

Pseudomonas_Aeruginosa | Ciprofloxacin | Optuna:  56%|█████▌    | 112/200 [1:53:56<1:51:12, 75.83s/it, best=0.875][A
Pseudomonas_Aeruginosa | Ciprofloxacin | Optuna:  56%|█████▌    | 112/200 [1:53:56<1:51:12, 75.83s/it, best=0.875][A[I 2026-02-27 16:41:31,405] Trial 38 finished with value: 0.5920038260220011 and parameters: {'activation': 'logistic', 'solver': 'sgd', 'lr': 0.00019731427514425151, 'layer1': 287, 'layer2': 270, 'layer3': 438}. Best is trial 34 with value: 0.8072405041442254.

Escherichia_Coli | Ciprofloxacin | Optuna:  20%|█▉        | 39/200 [1:54:00<4:37:04, 103.26s/it, best=0.807][A
Escherichia_Coli | Ciprofloxacin | Optuna:  20%|█▉        | 39/200 [1:54:00<4:37:04, 103.26s/it, best=0.807][A[I 2026-02-27 16:42:09,041] Trial 50 finished with value: 0.9088598985641868 and parameters: {'activation': 'identity', 'solver': 'adam', 'lr': 7.652434538169704e-05, 'layer1': 308, 'layer2': 410, 'layer3': 422}. Best is trial 50 with value: 0.9088598985641868.

Staphylococcus_Aureus | Oxacillin | Optuna:  26%|██▌       | 51/200 [1:54:38<5:15:10, 126.91s/it, best=0.909][A
Staphylococcus_Aureus | Oxacillin | Optuna:  26%|██▌       | 51/200 [1:54:38<5:15:10, 126.91s/it, best=0.909][A[I 2026-02-27 16:42:51,259] Trial 112 finished with value: 0.8731009800876178 and parameters: {'activation': 'logistic', 'solver': 'adam', 'lr': 0.0003311508298568209, 'layer1': 446, 'layer2': 389, 'layer3': 416}. Best is trial 46 with value: 0.8754031846375991.

Pseudomonas_Aeruginosa | Ciprofloxacin | Optuna:  56%|█████▋    | 113/200 [1:55:20<1:53:50, 78.51s/it, best=0.875][A
Pseudomonas_Aeruginosa | Ciprofloxacin | Optuna:  56%|█████▋    | 113/200 [1:55:20<1:53:50, 78.51s/it, best=0.875][A[I 2026-02-27 16:43:12,003] Trial 69 finished with value: 0.8280129124114796 and parameters: {'activation': 'identity', 'solver': 'adam', 'lr': 4.267983706081433e-05, 'layer1': 357, 'layer2': 466, 'layer3': 228}. Best is trial 64 with value: 0.8298953923751187.

Klebsiella_Pneumoniae | Ciprofloxacin | Optuna:  35%|███▌      | 70/200 [1:55:41<3:48:50, 105.62s/it, best=0.83][A
Klebsiella_Pneumoniae | Ciprofloxacin | Optuna:  35%|███▌      | 70/200 [1:55:41<3:48:50, 105.62s/it, best=0.83][A[I 2026-02-27 16:43:27,842] Trial 39 finished with value: 0.7985963984519842 and parameters: {'activation': 'relu', 'solver': 'adam', 'lr': 0.0005093254352252313, 'layer1': 282, 'layer2': 82, 'layer3': 212}. Best is trial 34 with value: 0.8072405041442254.

Escherichia_Coli | Ciprofloxacin | Optuna:  20%|██        | 40/200 [1:55:57<4:45:53, 107.21s/it, best=0.807][A
Escherichia_Coli | Ciprofloxacin | Optuna:  20%|██        | 40/200 [1:55:57<4:45:53, 107.21s/it, best=0.807][A[I 2026-02-27 16:43:50,034] Trial 51 finished with value: 0.8997518681838288 and parameters: {'activation': 'identity', 'solver': 'adam', 'lr': 8.707306830957166e-05, 'layer1': 11, 'layer2': 403, 'layer3': 425}. Best is trial 50 with value: 0.9088598985641868.

Staphylococcus_Aureus | Oxacillin | Optuna:  26%|██▌       | 52/200 [1:56:19<4:53:52, 119.14s/it, best=0.909][A
Staphylococcus_Aureus | Oxacillin | Optuna:  26%|██▌       | 52/200 [1:56:19<4:53:52, 119.14s/it, best=0.909][A[I 2026-02-27 16:43:51,251] Trial 113 finished with value: 0.8728829329587535 and parameters: {'activation': 'logistic', 'solver': 'adam', 'lr': 0.0004888474726237763, 'layer1': 280, 'layer2': 263, 'layer3': 470}. Best is trial 46 with value: 0.8754031846375991.

Pseudomonas_Aeruginosa | Ciprofloxacin | Optuna:  57%|█████▋    | 114/200 [1:56:20<1:44:34, 72.96s/it, best=0.875][A
Pseudomonas_Aeruginosa | Ciprofloxacin | Optuna:  57%|█████▋    | 114/200 [1:56:20<1:44:34, 72.96s/it, best=0.875][A[I 2026-02-27 16:45:20,835] Trial 114 finished with value: 0.8738387405973725 and parameters: {'activation': 'logistic', 'solver': 'adam', 'lr': 0.00027602903220361034, 'layer1': 483, 'layer2': 137, 'layer3': 458}. Best is trial 46 with value: 0.8754031846375991.

Pseudomonas_Aeruginosa | Ciprofloxacin | Optuna:  57%|█████▊    | 115/200 [1:57:50<1:50:25, 77.94s/it, best=0.875][A
Pseudomonas_Aeruginosa | Ciprofloxacin | Optuna:  57%|█████▊    | 115/200 [1:57:50<1:50:25, 77.94s/it, best=0.875][A[I 2026-02-27 16:45:50,602] Trial 40 finished with value: 0.806239689274801 and parameters: {'activation': 'tanh', 'solver': 'adam', 'lr': 5.258657300085267e-05, 'layer1': 245, 'layer2': 413, 'layer3': 498}. Best is trial 34 with value: 0.8072405041442254.

Escherichia_Coli | Ciprofloxacin | Optuna:  20%|██        | 41/200 [1:58:19<5:12:22, 117.87s/it, best=0.807][A
Escherichia_Coli | Ciprofloxacin | Optuna:  20%|██        | 41/200 [1:58:19<5:12:22, 117.87s/it, best=0.807][A[I 2026-02-27 16:46:06,410] Trial 52 finished with value: 0.9051876919873741 and parameters: {'activation': 'identity', 'solver': 'adam', 'lr': 7.339450581966038e-05, 'layer1': 316, 'layer2': 371, 'layer3': 470}. Best is trial 50 with value: 0.9088598985641868.

Staphylococcus_Aureus | Oxacillin | Optuna:  26%|██▋       | 53/200 [1:58:36<5:04:33, 124.31s/it, best=0.909][A
Staphylococcus_Aureus | Oxacillin | Optuna:  26%|██▋       | 53/200 [1:58:36<5:04:33, 124.31s/it, best=0.909][A[I 2026-02-27 16:46:11,708] Trial 70 finished with value: 0.7509033959654351 and parameters: {'activation': 'identity', 'solver': 'sgd', 'lr': 3.968390737857406e-05, 'layer1': 407, 'layer2': 482, 'layer3': 227}. Best is trial 64 with value: 0.8298953923751187.

Klebsiella_Pneumoniae | Ciprofloxacin | Optuna:  36%|███▌      | 71/200 [1:58:41<4:34:51, 127.84s/it, best=0.83][A
Klebsiella_Pneumoniae | Ciprofloxacin | Optuna:  36%|███▌      | 71/200 [1:58:41<4:34:51, 127.84s/it, best=0.83][A[I 2026-02-27 16:46:51,340] Trial 115 finished with value: 0.8682340716387132 and parameters: {'activation': 'logistic', 'solver': 'adam', 'lr': 0.00014110211334608343, 'layer1': 476, 'layer2': 341, 'layer3': 431}. Best is trial 46 with value: 0.8754031846375991.

Pseudomonas_Aeruginosa | Ciprofloxacin | Optuna:  58%|█████▊    | 116/200 [1:59:21<1:54:23, 81.71s/it, best=0.875][A
Pseudomonas_Aeruginosa | Ciprofloxacin | Optuna:  58%|█████▊    | 116/200 [1:59:21<1:54:23, 81.71s/it, best=0.875][A[I 2026-02-27 16:48:05,462] Trial 116 finished with value: 0.8697739679173864 and parameters: {'activation': 'logistic', 'solver': 'adam', 'lr': 0.0007189795063788982, 'layer1': 492, 'layer2': 252, 'layer3': 477}. Best is trial 46 with value: 0.8754031846375991.

Pseudomonas_Aeruginosa | Ciprofloxacin | Optuna:  58%|█████▊    | 117/200 [2:00:35<1:49:53, 79.44s/it, best=0.875][A
Pseudomonas_Aeruginosa | Ciprofloxacin | Optuna:  58%|█████▊    | 117/200 [2:00:35<1:49:53, 79.44s/it, best=0.875][A[I 2026-02-27 16:48:05,499] Trial 41 finished with value: 0.8013517733769362 and parameters: {'activation': 'tanh', 'solver': 'adam', 'lr': 4.6200558042609035e-05, 'layer1': 239, 'layer2': 410, 'layer3': 492}. Best is trial 34 with value: 0.8072405041442254.

Escherichia_Coli | Ciprofloxacin | Optuna:  21%|██        | 42/200 [2:00:34<5:23:51, 122.98s/it, best=0.807][A
Escherichia_Coli | Ciprofloxacin | Optuna:  21%|██        | 42/200 [2:00:34<5:23:51, 122.98s/it, best=0.807][A[I 2026-02-27 16:48:20,899] Trial 71 finished with value: 0.8282087943847269 and parameters: {'activation': 'identity', 'solver': 'adam', 'lr': 7.951416125727278e-05, 'layer1': 342, 'layer2': 437, 'layer3': 136}. Best is trial 64 with value: 0.8298953923751187.

Klebsiella_Pneumoniae | Ciprofloxacin | Optuna:  36%|███▌      | 72/200 [2:00:50<4:33:35, 128.25s/it, best=0.83][A
Klebsiella_Pneumoniae | Ciprofloxacin | Optuna:  36%|███▌      | 72/200 [2:00:50<4:33:35, 128.25s/it, best=0.83][A[I 2026-02-27 16:48:35,563] Trial 53 finished with value: 0.9089466003924253 and parameters: {'activation': 'identity', 'solver': 'adam', 'lr': 0.000380992056863961, 'layer1': 346, 'layer2': 419, 'layer3': 436}. Best is trial 53 with value: 0.9089466003924253.

Staphylococcus_Aureus | Oxacillin | Optuna:  27%|██▋       | 54/200 [2:01:05<5:20:37, 131.76s/it, best=0.909][A
Staphylococcus_Aureus | Oxacillin | Optuna:  27%|██▋       | 54/200 [2:01:05<5:20:37, 131.76s/it, best=0.909][A[I 2026-02-27 16:49:06,028] Trial 117 finished with value: 0.8723964014900625 and parameters: {'activation': 'logistic', 'solver': 'adam', 'lr': 0.0006171595692935819, 'layer1': 300, 'layer2': 295, 'layer3': 445}. Best is trial 46 with value: 0.8754031846375991.

Pseudomonas_Aeruginosa | Ciprofloxacin | Optuna:  59%|█████▉    | 118/200 [2:01:35<1:40:49, 73.77s/it, best=0.875][A
Pseudomonas_Aeruginosa | Ciprofloxacin | Optuna:  59%|█████▉    | 118/200 [2:01:35<1:40:49, 73.77s/it, best=0.875][A[I 2026-02-27 16:49:35,018] Trial 118 finished with value: 0.8226569604900948 and parameters: {'activation': 'relu', 'solver': 'sgd', 'lr': 0.0002006774421721402, 'layer1': 324, 'layer2': 167, 'layer3': 231}. Best is trial 46 with value: 0.8754031846375991.

Pseudomonas_Aeruginosa | Ciprofloxacin | Optuna:  60%|█████▉    | 119/200 [2:02:04<1:21:27, 60.34s/it, best=0.875][A
Pseudomonas_Aeruginosa | Ciprofloxacin | Optuna:  60%|█████▉    | 119/200 [2:02:04<1:21:27, 60.34s/it, best=0.875][A[I 2026-02-27 16:50:04,311] Trial 72 finished with value: 0.8240724039295685 and parameters: {'activation': 'identity', 'solver': 'adam', 'lr': 7.415906576064323e-05, 'layer1': 314, 'layer2': 468, 'layer3': 129}. Best is trial 64 with value: 0.8298953923751187.

Klebsiella_Pneumoniae | Ciprofloxacin | Optuna:  36%|███▋      | 73/200 [2:02:33<4:15:41, 120.80s/it, best=0.83][A
Klebsiella_Pneumoniae | Ciprofloxacin | Optuna:  36%|███▋      | 73/200 [2:02:33<4:15:41, 120.80s/it, best=0.83][A[I 2026-02-27 16:50:06,199] Trial 42 finished with value: 0.7996353333469377 and parameters: {'activation': 'tanh', 'solver': 'adam', 'lr': 9.532778611149154e-05, 'layer1': 336, 'layer2': 470, 'layer3': 478}. Best is trial 34 with value: 0.8072405041442254.

Escherichia_Coli | Ciprofloxacin | Optuna:  22%|██▏       | 43/200 [2:02:35<5:20:00, 122.30s/it, best=0.807][A
Escherichia_Coli | Ciprofloxacin | Optuna:  22%|██▏       | 43/200 [2:02:35<5:20:00, 122.30s/it, best=0.807][A[I 2026-02-27 16:50:43,020] Trial 54 finished with value: 0.9070185775618593 and parameters: {'activation': 'identity', 'solver': 'adam', 'lr': 0.00029554365684390837, 'layer1': 349, 'layer2': 354, 'layer3': 438}. Best is trial 53 with value: 0.9089466003924253.

Staphylococcus_Aureus | Oxacillin | Optuna:  28%|██▊       | 55/200 [2:03:12<5:15:18, 130.47s/it, best=0.909][A
Staphylococcus_Aureus | Oxacillin | Optuna:  28%|██▊       | 55/200 [2:03:12<5:15:18, 130.47s/it, best=0.909][A[I 2026-02-27 16:50:44,486] Trial 119 finished with value: 0.8588135858685936 and parameters: {'activation': 'logistic', 'solver': 'adam', 'lr': 0.00039347969313683874, 'layer1': 469, 'layer2': 158, 'layer3': 71}. Best is trial 46 with value: 0.8754031846375991.

Pseudomonas_Aeruginosa | Ciprofloxacin | Optuna:  60%|██████    | 120/200 [2:03:14<1:24:06, 63.08s/it, best=0.875][A
Pseudomonas_Aeruginosa | Ciprofloxacin | Optuna:  60%|██████    | 120/200 [2:03:14<1:24:06, 63.08s/it, best=0.875][A[I 2026-02-27 16:52:01,272] Trial 120 finished with value: 0.8574119137452383 and parameters: {'activation': 'identity', 'solver': 'adam', 'lr': 0.00031955731938424425, 'layer1': 242, 'layer2': 355, 'layer3': 420}. Best is trial 46 with value: 0.8754031846375991.

Pseudomonas_Aeruginosa | Ciprofloxacin | Optuna:  60%|██████    | 121/200 [2:04:30<1:28:28, 67.19s/it, best=0.875][A
Pseudomonas_Aeruginosa | Ciprofloxacin | Optuna:  60%|██████    | 121/200 [2:04:30<1:28:28, 67.19s/it, best=0.875][A[I 2026-02-27 16:52:31,135] Trial 73 finished with value: 0.8288001984455458 and parameters: {'activation': 'identity', 'solver': 'adam', 'lr': 4.337505618712432e-05, 'layer1': 456, 'layer2': 439, 'layer3': 150}. Best is trial 64 with value: 0.8298953923751187.

Klebsiella_Pneumoniae | Ciprofloxacin | Optuna:  37%|███▋      | 74/200 [2:05:00<4:30:04, 128.61s/it, best=0.83][A
Klebsiella_Pneumoniae | Ciprofloxacin | Optuna:  37%|███▋      | 74/200 [2:05:00<4:30:04, 128.61s/it, best=0.83][A[I 2026-02-27 16:53:07,879] Trial 55 finished with value: 0.9079517428735897 and parameters: {'activation': 'identity', 'solver': 'adam', 'lr': 0.0001448259008473851, 'layer1': 382, 'layer2': 486, 'layer3': 401}. Best is trial 53 with value: 0.9089466003924253.

Staphylococcus_Aureus | Oxacillin | Optuna:  28%|██▊       | 56/200 [2:05:37<5:23:29, 134.79s/it, best=0.909][A
Staphylococcus_Aureus | Oxacillin | Optuna:  28%|██▊       | 56/200 [2:05:37<5:23:29, 134.79s/it, best=0.909][A[I 2026-02-27 16:53:17,931] Trial 43 finished with value: 0.7983007515060802 and parameters: {'activation': 'tanh', 'solver': 'adam', 'lr': 1.4159122278974282e-05, 'layer1': 174, 'layer2': 439, 'layer3': 453}. Best is trial 34 with value: 0.8072405041442254.

Escherichia_Coli | Ciprofloxacin | Optuna:  22%|██▏       | 44/200 [2:05:47<6:12:07, 143.13s/it, best=0.807][A
Escherichia_Coli | Ciprofloxacin | Optuna:  22%|██▏       | 44/200 [2:05:47<6:12:07, 143.13s/it, best=0.807][A[I 2026-02-27 16:53:28,792] Trial 121 finished with value: 0.8736350880718152 and parameters: {'activation': 'logistic', 'solver': 'adam', 'lr': 0.00026371486148082045, 'layer1': 287, 'layer2': 195, 'layer3': 496}. Best is trial 46 with value: 0.8754031846375991.

Pseudomonas_Aeruginosa | Ciprofloxacin | Optuna:  61%|██████    | 122/200 [2:05:58<1:35:16, 73.29s/it, best=0.875][A
Pseudomonas_Aeruginosa | Ciprofloxacin | Optuna:  61%|██████    | 122/200 [2:05:58<1:35:16, 73.29s/it, best=0.875][A[I 2026-02-27 16:54:36,126] Trial 74 finished with value: 0.8217249400005467 and parameters: {'activation': 'identity', 'solver': 'adam', 'lr': 0.0001228590911587237, 'layer1': 458, 'layer2': 437, 'layer3': 150}. Best is trial 64 with value: 0.8298953923751187.

Klebsiella_Pneumoniae | Ciprofloxacin | Optuna:  38%|███▊      | 75/200 [2:07:05<4:25:40, 127.52s/it, best=0.83][A
Klebsiella_Pneumoniae | Ciprofloxacin | Optuna:  38%|███▊      | 75/200 [2:07:05<4:25:40, 127.52s/it, best=0.83][A[I 2026-02-27 16:54:52,143] Trial 122 finished with value: 0.8735399958973235 and parameters: {'activation': 'logistic', 'solver': 'adam', 'lr': 0.00022998776808250558, 'layer1': 317, 'layer2': 169, 'layer3': 500}. Best is trial 46 with value: 0.8754031846375991.

Pseudomonas_Aeruginosa | Ciprofloxacin | Optuna:  62%|██████▏   | 123/200 [2:07:21<1:37:55, 76.31s/it, best=0.875][A
