Klebsiella_Pneumoniae | Ceftriaxone | Optuna:  20%|█▉        | 39/200 [1:06:56<4:37:28, 103.41s/it, best=0.908][A[I 2026-02-27 21:57:40,225] Trial 199 finished with value: 0.9064403055029686 and parameters: {'activation': 'identity', 'solver': 'adam', 'lr': 0.00020648818617363744, 'layer1': 315, 'layer2': 417, 'layer3': 434}. Best is trial 152 with value: 0.9102139153966748.

Staphylococcus_Aureus | Oxacillin | Optuna: 100%|██████████| 200/200 [7:10:09<00:00, 124.67s/it, best=0.91][A
Staphylococcus_Aureus | Oxacillin | Optuna: 100%|██████████| 200/200 [7:10:09<00:00, 124.67s/it, best=0.91][A
                                                                                                           [A[Staphylococcus_Aureus | Oxacillin] [OPTUNA DONE] Best CV WF1=0.9102 | params={'activation': 'identity', 'solver': 'adam', 'lr': 0.00018289210821592565, 'layer1': 338, 'layer2': 416, 'layer3': 379}
[Staphylococcus_Aureus | Oxacillin] Retraining with validation early stopping (10% split)...
[I 2026-02-27 21:57:57,503] Trial 193 finished with value: 0.8578506032715696 and parameters: {'activation': 'relu', 'solver': 'adam', 'lr': 0.00019072253893540452, 'layer1': 266, 'layer2': 351, 'layer3': 454}. Best is trial 126 with value: 0.8664911301660769.

Pseudomonas_Aeruginosa | Imipenem | Optuna:  97%|█████████▋| 194/200 [3:25:51<07:18, 73.02s/it, best=0.867][A
Pseudomonas_Aeruginosa | Imipenem | Optuna:  97%|█████████▋| 194/200 [3:25:51<07:18, 73.02s/it, best=0.867][A[Staphylococcus_Aureus | Oxacillin] [TEST] WF1=0.9088 | ACC=0.9115 | HL=0.0885 | best_val_WF1=0.8972
Staphylococcus_Aureus | Binary antibiotics:  33%|███▎      | 1/3 [7:10:28<14:20:56, 25828.01s/it]
[Staphylococcus_Aureus | Clindamycin] Optuna search starting... (trials=200, cv=5)
[I 2026-02-27 21:57:58,342] A new study created in memory with name: no-name-bf4033ed-5050-469b-a043-3c86dc35301b

Staphylococcus_Aureus | Clindamycin | Optuna:   0%|          | 0/200 [00:00<?, ?it/s][A[I 2026-02-27 21:58:34,791] Trial 0 finished with value: 0.18645445856297244 and parameters: {'activation': 'logistic', 'solver': 'sgd', 'lr': 1.7073967431528114e-06, 'layer1': 435, 'layer2': 305, 'layer3': 357}. Best is trial 0 with value: 0.18645445856297244.

Staphylococcus_Aureus | Clindamycin | Optuna:   0%|          | 1/200 [00:36<2:00:53, 36.45s/it][A
Staphylococcus_Aureus | Clindamycin | Optuna:   0%|          | 1/200 [00:36<2:00:53, 36.45s/it, best=0.186][A[I 2026-02-27 21:58:59,253] Trial 39 finished with value: 0.896189618259241 and parameters: {'activation': 'relu', 'solver': 'adam', 'lr': 0.00039093467411791634, 'layer1': 472, 'layer2': 358, 'layer3': 212}. Best is trial 25 with value: 0.9080365798965563.

Klebsiella_Pneumoniae | Ceftriaxone | Optuna:  20%|██        | 40/200 [1:08:20<4:20:09, 97.56s/it, best=0.908] [A
Klebsiella_Pneumoniae | Ceftriaxone | Optuna:  20%|██        | 40/200 [1:08:20<4:20:09, 97.56s/it, best=0.908][A[I 2026-02-27 21:59:00,884] Trial 194 finished with value: 0.8597094789575082 and parameters: {'activation': 'relu', 'solver': 'adam', 'lr': 0.0003107812080957419, 'layer1': 324, 'layer2': 360, 'layer3': 465}. Best is trial 126 with value: 0.8664911301660769.

Pseudomonas_Aeruginosa | Imipenem | Optuna:  98%|█████████▊| 195/200 [3:26:55<05:50, 70.13s/it, best=0.867][A
Pseudomonas_Aeruginosa | Imipenem | Optuna:  98%|█████████▊| 195/200 [3:26:55<05:50, 70.13s/it, best=0.867][A[I 2026-02-27 21:59:12,785] Trial 1 finished with value: 0.7888558471217525 and parameters: {'activation': 'logistic', 'solver': 'adam', 'lr': 1.6480446427978994e-05, 'layer1': 267, 'layer2': 222, 'layer3': 152}. Best is trial 1 with value: 0.7888558471217525.

Staphylococcus_Aureus | Clindamycin | Optuna:   1%|          | 2/200 [01:14<2:03:16, 37.36s/it, best=0.186][A
Staphylococcus_Aureus | Clindamycin | Optuna:   1%|          | 2/200 [01:14<2:03:16, 37.36s/it, best=0.789][A[I 2026-02-27 21:59:39,931] Trial 175 finished with value: 0.8075734889485465 and parameters: {'activation': 'tanh', 'solver': 'adam', 'lr': 3.4057264361930834e-05, 'layer1': 474, 'layer2': 316, 'layer3': 19}. Best is trial 124 with value: 0.8095465376114227.

Escherichia_Coli | Ciprofloxacin | Optuna:  88%|████████▊ | 176/200 [7:12:09<1:14:07, 185.32s/it, best=0.809][A
Escherichia_Coli | Ciprofloxacin | Optuna:  88%|████████▊ | 176/200 [7:12:09<1:14:07, 185.32s/it, best=0.809][A[I 2026-02-27 22:00:11,465] Trial 195 finished with value: 0.8622083586039848 and parameters: {'activation': 'relu', 'solver': 'adam', 'lr': 0.00026091034823990273, 'layer1': 320, 'layer2': 380, 'layer3': 212}. Best is trial 126 with value: 0.8664911301660769.

Pseudomonas_Aeruginosa | Imipenem | Optuna:  98%|█████████▊| 196/200 [3:28:05<04:41, 70.26s/it, best=0.867][A
Pseudomonas_Aeruginosa | Imipenem | Optuna:  98%|█████████▊| 196/200 [3:28:05<04:41, 70.26s/it, best=0.867][A[I 2026-02-27 22:01:22,899] Trial 196 finished with value: 0.8586628067483598 and parameters: {'activation': 'relu', 'solver': 'adam', 'lr': 0.00014580632533127722, 'layer1': 283, 'layer2': 315, 'layer3': 192}. Best is trial 126 with value: 0.8664911301660769.

Pseudomonas_Aeruginosa | Imipenem | Optuna:  98%|█████████▊| 197/200 [3:29:17<03:31, 70.62s/it, best=0.867][A
Pseudomonas_Aeruginosa | Imipenem | Optuna:  98%|█████████▊| 197/200 [3:29:17<03:31, 70.62s/it, best=0.867][A[I 2026-02-27 22:01:27,521] Trial 2 finished with value: 0.8066590537113969 and parameters: {'activation': 'identity', 'solver': 'adam', 'lr': 6.290644294586145e-06, 'layer1': 262, 'layer2': 300, 'layer3': 32}. Best is trial 2 with value: 0.8066590537113969.

Staphylococcus_Aureus | Clindamycin | Optuna:   2%|▏         | 3/200 [03:29<4:28:38, 81.82s/it, best=0.789][A
Staphylococcus_Aureus | Clindamycin | Optuna:   2%|▏         | 3/200 [03:29<4:28:38, 81.82s/it, best=0.807][A[I 2026-02-27 22:01:44,853] Trial 40 finished with value: 0.9038944597960852 and parameters: {'activation': 'tanh', 'solver': 'adam', 'lr': 1.2775957220471575e-05, 'layer1': 349, 'layer2': 457, 'layer3': 300}. Best is trial 25 with value: 0.9080365798965563.

Klebsiella_Pneumoniae | Ceftriaxone | Optuna:  20%|██        | 41/200 [1:11:06<5:12:37, 117.97s/it, best=0.908][A
Klebsiella_Pneumoniae | Ceftriaxone | Optuna:  20%|██        | 41/200 [1:11:06<5:12:37, 117.97s/it, best=0.908][A[I 2026-02-27 22:02:28,425] Trial 197 finished with value: 0.8653860984284506 and parameters: {'activation': 'relu', 'solver': 'adam', 'lr': 0.00035139135678712924, 'layer1': 348, 'layer2': 370, 'layer3': 39}. Best is trial 126 with value: 0.8664911301660769.

Pseudomonas_Aeruginosa | Imipenem | Optuna:  99%|█████████▉| 198/200 [3:30:22<02:18, 69.09s/it, best=0.867][A
Pseudomonas_Aeruginosa | Imipenem | Optuna:  99%|█████████▉| 198/200 [3:30:22<02:18, 69.09s/it, best=0.867][A[I 2026-02-27 22:02:28,658] Trial 176 finished with value: 0.806936233075179 and parameters: {'activation': 'tanh', 'solver': 'adam', 'lr': 2.893584616518674e-05, 'layer1': 378, 'layer2': 315, 'layer3': 17}. Best is trial 124 with value: 0.8095465376114227.

Escherichia_Coli | Ciprofloxacin | Optuna:  88%|████████▊ | 177/200 [7:14:58<1:09:07, 180.34s/it, best=0.809][A
Escherichia_Coli | Ciprofloxacin | Optuna:  88%|████████▊ | 177/200 [7:14:58<1:09:07, 180.34s/it, best=0.809][A[I 2026-02-27 22:02:43,664] Trial 3 finished with value: 0.7890955738741252 and parameters: {'activation': 'relu', 'solver': 'sgd', 'lr': 1.6536937182824424e-05, 'layer1': 57, 'layer2': 345, 'layer3': 226}. Best is trial 2 with value: 0.8066590537113969.

Staphylococcus_Aureus | Clindamycin | Optuna:   2%|▏         | 4/200 [04:45<4:19:57, 79.58s/it, best=0.807][A
Staphylococcus_Aureus | Clindamycin | Optuna:   2%|▏         | 4/200 [04:45<4:19:57, 79.58s/it, best=0.807][A[I 2026-02-27 22:03:19,549] Trial 4 finished with value: 0.7899555538987599 and parameters: {'activation': 'relu', 'solver': 'adam', 'lr': 1.7654048052495086e-05, 'layer1': 265, 'layer2': 278, 'layer3': 100}. Best is trial 2 with value: 0.8066590537113969.

Staphylococcus_Aureus | Clindamycin | Optuna:   2%|▎         | 5/200 [05:21<3:27:25, 63.82s/it, best=0.807][A
Staphylococcus_Aureus | Clindamycin | Optuna:   2%|▎         | 5/200 [05:21<3:27:25, 63.82s/it, best=0.807][A[I 2026-02-27 22:03:37,749] Trial 41 finished with value: 0.9052939042707475 and parameters: {'activation': 'identity', 'solver': 'adam', 'lr': 0.0001403011092394345, 'layer1': 489, 'layer2': 391, 'layer3': 496}. Best is trial 25 with value: 0.9080365798965563.

Klebsiella_Pneumoniae | Ceftriaxone | Optuna:  21%|██        | 42/200 [1:12:59<5:06:38, 116.45s/it, best=0.908][A
Klebsiella_Pneumoniae | Ceftriaxone | Optuna:  21%|██        | 42/200 [1:12:59<5:06:38, 116.45s/it, best=0.908][A[I 2026-02-27 22:03:43,122] Trial 198 finished with value: 0.8547697171629082 and parameters: {'activation': 'relu', 'solver': 'adam', 'lr': 0.00010905639475988958, 'layer1': 311, 'layer2': 371, 'layer3': 348}. Best is trial 126 with value: 0.8664911301660769.

Pseudomonas_Aeruginosa | Imipenem | Optuna: 100%|█████████▉| 199/200 [3:31:37<01:10, 70.77s/it, best=0.867][A
Pseudomonas_Aeruginosa | Imipenem | Optuna: 100%|█████████▉| 199/200 [3:31:37<01:10, 70.77s/it, best=0.867][A[I 2026-02-27 22:04:06,306] Trial 199 finished with value: 0.8175565662034809 and parameters: {'activation': 'relu', 'solver': 'sgd', 'lr': 0.00037307250899647177, 'layer1': 309, 'layer2': 355, 'layer3': 36}. Best is trial 126 with value: 0.8664911301660769.

Pseudomonas_Aeruginosa | Imipenem | Optuna: 100%|██████████| 200/200 [3:32:00<00:00, 56.49s/it, best=0.867][A
Pseudomonas_Aeruginosa | Imipenem | Optuna: 100%|██████████| 200/200 [3:32:00<00:00, 56.49s/it, best=0.867][A
                                                                                                           [A[Pseudomonas_Aeruginosa | Imipenem] [OPTUNA DONE] Best CV WF1=0.8665 | params={'activation': 'relu', 'solver': 'adam', 'lr': 0.000233377380678602, 'layer1': 478, 'layer2': 358, 'layer3': 52}
[Pseudomonas_Aeruginosa | Imipenem] Retraining with validation early stopping (10% split)...
[Pseudomonas_Aeruginosa | Imipenem] [TEST] WF1=0.8375 | ACC=0.8675 | HL=0.1325 | best_val_WF1=0.8504
Pseudomonas_Aeruginosa | Binary antibiotics:  67%|██████▋   | 2/3 [7:16:54<3:37:22, 13042.25s/it]
[Pseudomonas_Aeruginosa | Meropenem] Optuna search starting... (trials=200, cv=5)
[I 2026-02-27 22:04:24,779] A new study created in memory with name: no-name-3cd9678f-e09e-46e7-a88b-6d12e32ea559

Pseudomonas_Aeruginosa | Meropenem | Optuna:   0%|          | 0/200 [00:00<?, ?it/s][A[I 2026-02-27 22:04:47,980] Trial 0 finished with value: 0.6778736142152642 and parameters: {'activation': 'logistic', 'solver': 'sgd', 'lr': 1.7073967431528114e-06, 'layer1': 435, 'layer2': 305, 'layer3': 357}. Best is trial 0 with value: 0.6778736142152642.

Pseudomonas_Aeruginosa | Meropenem | Optuna:   0%|          | 1/200 [00:23<1:16:56, 23.20s/it][A
Pseudomonas_Aeruginosa | Meropenem | Optuna:   0%|          | 1/200 [00:23<1:16:56, 23.20s/it, best=0.678][A[I 2026-02-27 22:05:11,614] Trial 1 finished with value: 0.8429744308639442 and parameters: {'activation': 'logistic', 'solver': 'adam', 'lr': 1.6480446427978994e-05, 'layer1': 267, 'layer2': 222, 'layer3': 152}. Best is trial 1 with value: 0.8429744308639442.

Pseudomonas_Aeruginosa | Meropenem | Optuna:   1%|          | 2/200 [00:46<1:17:24, 23.46s/it, best=0.678][A
Pseudomonas_Aeruginosa | Meropenem | Optuna:   1%|          | 2/200 [00:46<1:17:24, 23.46s/it, best=0.843][A[I 2026-02-27 22:05:19,610] Trial 5 finished with value: 0.801073727748905 and parameters: {'activation': 'identity', 'solver': 'adam', 'lr': 2.259279742015697e-06, 'layer1': 106, 'layer2': 32, 'layer3': 169}. Best is trial 2 with value: 0.8066590537113969.

Staphylococcus_Aureus | Clindamycin | Optuna:   3%|▎         | 6/200 [07:21<4:28:11, 82.94s/it, best=0.807][A
Staphylococcus_Aureus | Clindamycin | Optuna:   3%|▎         | 6/200 [07:21<4:28:11, 82.94s/it, best=0.807][A[I 2026-02-27 22:05:20,368] Trial 42 finished with value: 0.9038060887646475 and parameters: {'activation': 'identity', 'solver': 'adam', 'lr': 7.4015958880011e-05, 'layer1': 440, 'layer2': 316, 'layer3': 477}. Best is trial 25 with value: 0.9080365798965563.

Klebsiella_Pneumoniae | Ceftriaxone | Optuna:  22%|██▏       | 43/200 [1:14:41<4:53:51, 112.30s/it, best=0.908][A
Klebsiella_Pneumoniae | Ceftriaxone | Optuna:  22%|██▏       | 43/200 [1:14:41<4:53:51, 112.30s/it, best=0.908][A[I 2026-02-27 22:05:21,998] Trial 177 finished with value: 0.8071102055386314 and parameters: {'activation': 'tanh', 'solver': 'adam', 'lr': 2.856232348067954e-05, 'layer1': 431, 'layer2': 322, 'layer3': 10}. Best is trial 124 with value: 0.8095465376114227.

Escherichia_Coli | Ciprofloxacin | Optuna:  89%|████████▉ | 178/200 [7:17:51<1:05:21, 178.24s/it, best=0.809][A
Escherichia_Coli | Ciprofloxacin | Optuna:  89%|████████▉ | 178/200 [7:17:51<1:05:21, 178.24s/it, best=0.809][A[I 2026-02-27 22:06:00,899] Trial 2 finished with value: 0.8512894383517496 and parameters: {'activation': 'identity', 'solver': 'adam', 'lr': 6.290644294586145e-06, 'layer1': 262, 'layer2': 300, 'layer3': 32}. Best is trial 2 with value: 0.8512894383517496.

Pseudomonas_Aeruginosa | Meropenem | Optuna:   2%|▏         | 3/200 [01:36<1:55:44, 35.25s/it, best=0.843][A
Pseudomonas_Aeruginosa | Meropenem | Optuna:   2%|▏         | 3/200 [01:36<1:55:44, 35.25s/it, best=0.851][A[I 2026-02-27 22:07:15,418] Trial 3 finished with value: 0.8433529013500513 and parameters: {'activation': 'relu', 'solver': 'sgd', 'lr': 1.6536937182824424e-05, 'layer1': 57, 'layer2': 345, 'layer3': 226}. Best is trial 2 with value: 0.8512894383517496.

Pseudomonas_Aeruginosa | Meropenem | Optuna:   2%|▏         | 4/200 [02:50<2:45:47, 50.75s/it, best=0.851][A
Pseudomonas_Aeruginosa | Meropenem | Optuna:   2%|▏         | 4/200 [02:50<2:45:47, 50.75s/it, best=0.851][A[I 2026-02-27 22:07:40,946] Trial 4 finished with value: 0.8429744308639442 and parameters: {'activation': 'relu', 'solver': 'adam', 'lr': 1.7654048052495086e-05, 'layer1': 265, 'layer2': 278, 'layer3': 100}. Best is trial 2 with value: 0.8512894383517496.

Pseudomonas_Aeruginosa | Meropenem | Optuna:   2%|▎         | 5/200 [03:16<2:15:23, 41.66s/it, best=0.851][A
Pseudomonas_Aeruginosa | Meropenem | Optuna:   2%|▎         | 5/200 [03:16<2:15:23, 41.66s/it, best=0.851][A[I 2026-02-27 22:07:56,726] Trial 43 finished with value: 0.8391437699129108 and parameters: {'activation': 'identity', 'solver': 'adam', 'lr': 1.2403668302547623e-06, 'layer1': 443, 'layer2': 357, 'layer3': 500}. Best is trial 25 with value: 0.9080365798965563.

Klebsiella_Pneumoniae | Ceftriaxone | Optuna:  22%|██▏       | 44/200 [1:17:18<5:26:20, 125.52s/it, best=0.908][A
Klebsiella_Pneumoniae | Ceftriaxone | Optuna:  22%|██▏       | 44/200 [1:17:18<5:26:20, 125.52s/it, best=0.908][A[I 2026-02-27 22:08:17,011] Trial 178 finished with value: 0.8080840331443708 and parameters: {'activation': 'tanh', 'solver': 'adam', 'lr': 2.7853853643363437e-05, 'layer1': 482, 'layer2': 320, 'layer3': 12}. Best is trial 124 with value: 0.8095465376114227.

Escherichia_Coli | Ciprofloxacin | Optuna:  90%|████████▉ | 179/200 [7:20:46<1:02:02, 177.27s/it, best=0.809][A
Escherichia_Coli | Ciprofloxacin | Optuna:  90%|████████▉ | 179/200 [7:20:46<1:02:02, 177.27s/it, best=0.809][A[I 2026-02-27 22:08:38,291] Trial 6 finished with value: 0.8029616176257346 and parameters: {'activation': 'tanh', 'solver': 'adam', 'lr': 3.6618192203924288e-06, 'layer1': 403, 'layer2': 46, 'layer3': 494}. Best is trial 2 with value: 0.8066590537113969.

Staphylococcus_Aureus | Clindamycin | Optuna:   4%|▎         | 7/200 [10:39<6:28:30, 120.78s/it, best=0.807][A
Staphylococcus_Aureus | Clindamycin | Optuna:   4%|▎         | 7/200 [10:39<6:28:30, 120.78s/it, best=0.807][A[I 2026-02-27 22:08:43,516] Trial 5 finished with value: 0.8450439851988214 and parameters: {'activation': 'identity', 'solver': 'adam', 'lr': 2.259279742015697e-06, 'layer1': 106, 'layer2': 32, 'layer3': 169}. Best is trial 2 with value: 0.8512894383517496.

Pseudomonas_Aeruginosa | Meropenem | Optuna:   3%|▎         | 6/200 [04:18<2:37:40, 48.77s/it, best=0.851][A
Pseudomonas_Aeruginosa | Meropenem | Optuna:   3%|▎         | 6/200 [04:18<2:37:40, 48.77s/it, best=0.851][A[I 2026-02-27 22:09:34,376] Trial 44 finished with value: 0.9040271360831763 and parameters: {'activation': 'identity', 'solver': 'adam', 'lr': 0.0010466844885636437, 'layer1': 478, 'layer2': 498, 'layer3': 440}. Best is trial 25 with value: 0.9080365798965563.

Klebsiella_Pneumoniae | Ceftriaxone | Optuna:  22%|██▎       | 45/200 [1:18:55<5:02:39, 117.16s/it, best=0.908][A
Klebsiella_Pneumoniae | Ceftriaxone | Optuna:  22%|██▎       | 45/200 [1:18:55<5:02:39, 117.16s/it, best=0.908][A[I 2026-02-27 22:09:34,667] Trial 7 finished with value: 0.8417352519229695 and parameters: {'activation': 'relu', 'solver': 'adam', 'lr': 0.0012164139351417069, 'layer1': 46, 'layer2': 186, 'layer3': 66}. Best is trial 7 with value: 0.8417352519229695.

Staphylococcus_Aureus | Clindamycin | Optuna:   4%|▍         | 8/200 [11:36<5:20:53, 100.28s/it, best=0.807][A
Staphylococcus_Aureus | Clindamycin | Optuna:   4%|▍         | 8/200 [11:36<5:20:53, 100.28s/it, best=0.842][A[I 2026-02-27 22:11:07,721] Trial 179 finished with value: 0.8048540515431466 and parameters: {'activation': 'tanh', 'solver': 'adam', 'lr': 3.412437541034227e-05, 'layer1': 457, 'layer2': 318, 'layer3': 15}. Best is trial 124 with value: 0.8095465376114227.

Escherichia_Coli | Ciprofloxacin | Optuna:  90%|█████████ | 180/200 [7:23:37<58:26, 175.30s/it, best=0.809]  [A
Escherichia_Coli | Ciprofloxacin | Optuna:  90%|█████████ | 180/200 [7:23:37<58:26, 175.30s/it, best=0.809][A[I 2026-02-27 22:11:07,851] Trial 6 finished with value: 0.8439383282999324 and parameters: {'activation': 'tanh', 'solver': 'adam', 'lr': 3.6618192203924288e-06, 'layer1': 403, 'layer2': 46, 'layer3': 494}. Best is trial 2 with value: 0.8512894383517496.

Pseudomonas_Aeruginosa | Meropenem | Optuna:   4%|▎         | 7/200 [06:43<4:17:21, 80.01s/it, best=0.851][A
Pseudomonas_Aeruginosa | Meropenem | Optuna:   4%|▎         | 7/200 [06:43<4:17:21, 80.01s/it, best=0.851][A[I 2026-02-27 22:11:19,699] Trial 45 finished with value: 0.907019896520383 and parameters: {'activation': 'identity', 'solver': 'adam', 'lr': 8.966428773958743e-05, 'layer1': 404, 'layer2': 435, 'layer3': 472}. Best is trial 25 with value: 0.9080365798965563.

Klebsiella_Pneumoniae | Ceftriaxone | Optuna:  23%|██▎       | 46/200 [1:20:41<4:51:35, 113.61s/it, best=0.908][A
Klebsiella_Pneumoniae | Ceftriaxone | Optuna:  23%|██▎       | 46/200 [1:20:41<4:51:35, 113.61s/it, best=0.908][A[I 2026-02-27 22:11:41,707] Trial 7 finished with value: 0.8761328395434994 and parameters: {'activation': 'relu', 'solver': 'adam', 'lr': 0.0012164139351417069, 'layer1': 46, 'layer2': 186, 'layer3': 66}. Best is trial 7 with value: 0.8761328395434994.

Pseudomonas_Aeruginosa | Meropenem | Optuna:   4%|▍         | 8/200 [07:16<3:29:00, 65.32s/it, best=0.851][A
Pseudomonas_Aeruginosa | Meropenem | Optuna:   4%|▍         | 8/200 [07:16<3:29:00, 65.32s/it, best=0.876][A[I 2026-02-27 22:12:04,788] Trial 180 finished with value: 0.602944158113796 and parameters: {'activation': 'logistic', 'solver': 'adam', 'lr': 2.7305368346796356e-05, 'layer1': 481, 'layer2': 329, 'layer3': 10}. Best is trial 124 with value: 0.8095465376114227.

Escherichia_Coli | Ciprofloxacin | Optuna:  90%|█████████ | 181/200 [7:24:34<44:16, 139.83s/it, best=0.809][A
Escherichia_Coli | Ciprofloxacin | Optuna:  90%|█████████ | 181/200 [7:24:34<44:16, 139.83s/it, best=0.809][A[I 2026-02-27 22:12:17,172] Trial 8 finished with value: 0.8460386109068014 and parameters: {'activation': 'identity', 'solver': 'adam', 'lr': 0.000828752236376816, 'layer1': 323, 'layer2': 445, 'layer3': 241}. Best is trial 8 with value: 0.8460386109068014.

Staphylococcus_Aureus | Clindamycin | Optuna:   4%|▍         | 9/200 [14:18<6:21:08, 119.73s/it, best=0.842][A
Staphylococcus_Aureus | Clindamycin | Optuna:   4%|▍         | 9/200 [14:18<6:21:08, 119.73s/it, best=0.846][A[I 2026-02-27 22:12:58,871] Trial 46 finished with value: 0.9037800577535251 and parameters: {'activation': 'identity', 'solver': 'adam', 'lr': 3.475565488549416e-05, 'layer1': 400, 'layer2': 440, 'layer3': 398}. Best is trial 25 with value: 0.9080365798965563.

Klebsiella_Pneumoniae | Ceftriaxone | Optuna:  24%|██▎       | 47/200 [1:22:20<4:38:39, 109.28s/it, best=0.908][A
Klebsiella_Pneumoniae | Ceftriaxone | Optuna:  24%|██▎       | 47/200 [1:22:20<4:38:39, 109.28s/it, best=0.908][A[I 2026-02-27 22:13:05,693] Trial 8 finished with value: 0.8854975788426769 and parameters: {'activation': 'identity', 'solver': 'adam', 'lr': 0.000828752236376816, 'layer1': 323, 'layer2': 445, 'layer3': 241}. Best is trial 8 with value: 0.8854975788426769.

Pseudomonas_Aeruginosa | Meropenem | Optuna:   4%|▍         | 9/200 [08:40<3:46:30, 71.15s/it, best=0.876][A
Pseudomonas_Aeruginosa | Meropenem | Optuna:   4%|▍         | 9/200 [08:40<3:46:30, 71.15s/it, best=0.885][A[I 2026-02-27 22:13:34,814] Trial 47 finished with value: 0.7869270073743752 and parameters: {'activation': 'identity', 'solver': 'sgd', 'lr': 0.00063566832665674, 'layer1': 368, 'layer2': 426, 'layer3': 429}. Best is trial 25 with value: 0.9080365798965563.

Klebsiella_Pneumoniae | Ceftriaxone | Optuna:  24%|██▍       | 48/200 [1:22:56<3:41:06, 87.28s/it, best=0.908] [A
