Staphylococcus_Aureus | Clindamycin | Optuna:  32%|███▎      | 65/200 [1:24:01<2:41:42, 71.87s/it, best=0.856][A[I 2026-02-27 23:22:19,824] Trial 69 finished with value: 0.8429744308639442 and parameters: {'activation': 'logistic', 'solver': 'adam', 'lr': 3.1949721764008344e-05, 'layer1': 308, 'layer2': 322, 'layer3': 311}. Best is trial 8 with value: 0.8854975788426769.

Pseudomonas_Aeruginosa | Meropenem | Optuna:  35%|███▌      | 70/200 [1:17:55<1:56:34, 53.80s/it, best=0.885][A
Pseudomonas_Aeruginosa | Meropenem | Optuna:  35%|███▌      | 70/200 [1:17:55<1:56:34, 53.80s/it, best=0.885][A[I 2026-02-27 23:22:29,366] Trial 87 finished with value: 0.9061287554066446 and parameters: {'activation': 'logistic', 'solver': 'adam', 'lr': 0.00017833944229208817, 'layer1': 427, 'layer2': 348, 'layer3': 489}. Best is trial 25 with value: 0.9080365798965563.

Klebsiella_Pneumoniae | Ceftriaxone | Optuna:  44%|████▍     | 88/200 [2:31:50<3:41:34, 118.70s/it, best=0.908][A
Klebsiella_Pneumoniae | Ceftriaxone | Optuna:  44%|████▍     | 88/200 [2:31:50<3:41:34, 118.70s/it, best=0.908][A[I 2026-02-27 23:22:49,842] Trial 4 finished with value: 0.8940585425996325 and parameters: {'activation': 'relu', 'solver': 'adam', 'lr': 1.7654048052495086e-05, 'layer1': 265, 'layer2': 278, 'layer3': 100}. Best is trial 4 with value: 0.8940585425996325.

Escherichia_Coli | Ceftriaxone | Optuna:   2%|▎         | 5/200 [12:51<9:57:53, 183.97s/it, best=0.882][A
Escherichia_Coli | Ceftriaxone | Optuna:   2%|▎         | 5/200 [12:51<9:57:53, 183.97s/it, best=0.894][A[I 2026-02-27 23:23:26,393] Trial 65 finished with value: 0.8515902529277156 and parameters: {'activation': 'tanh', 'solver': 'adam', 'lr': 0.00020330533592731502, 'layer1': 494, 'layer2': 77, 'layer3': 111}. Best is trial 33 with value: 0.8559196107911822.

Staphylococcus_Aureus | Clindamycin | Optuna:  33%|███▎      | 66/200 [1:25:28<2:50:37, 76.40s/it, best=0.856][A
Staphylococcus_Aureus | Clindamycin | Optuna:  33%|███▎      | 66/200 [1:25:28<2:50:37, 76.40s/it, best=0.856][A[I 2026-02-27 23:23:40,716] Trial 70 finished with value: 0.8828915323204217 and parameters: {'activation': 'identity', 'solver': 'adam', 'lr': 0.0003724133975219631, 'layer1': 277, 'layer2': 450, 'layer3': 442}. Best is trial 8 with value: 0.8854975788426769.

Pseudomonas_Aeruginosa | Meropenem | Optuna:  36%|███▌      | 71/200 [1:19:15<2:13:09, 61.93s/it, best=0.885][A
Pseudomonas_Aeruginosa | Meropenem | Optuna:  36%|███▌      | 71/200 [1:19:15<2:13:09, 61.93s/it, best=0.885][A[I 2026-02-27 23:24:09,105] Trial 88 finished with value: 0.9012713153010188 and parameters: {'activation': 'logistic', 'solver': 'adam', 'lr': 0.0005010785005219033, 'layer1': 404, 'layer2': 304, 'layer3': 424}. Best is trial 25 with value: 0.9080365798965563.

Klebsiella_Pneumoniae | Ceftriaxone | Optuna:  44%|████▍     | 89/200 [2:33:30<3:29:04, 113.01s/it, best=0.908][A
Klebsiella_Pneumoniae | Ceftriaxone | Optuna:  44%|████▍     | 89/200 [2:33:30<3:29:04, 113.01s/it, best=0.908][A[I 2026-02-27 23:24:54,641] Trial 66 finished with value: 0.8552144564805664 and parameters: {'activation': 'tanh', 'solver': 'adam', 'lr': 6.667387346534795e-05, 'layer1': 150, 'layer2': 34, 'layer3': 263}. Best is trial 33 with value: 0.8559196107911822.

Staphylococcus_Aureus | Clindamycin | Optuna:  34%|███▎      | 67/200 [1:26:56<2:57:14, 79.96s/it, best=0.856][A
Staphylococcus_Aureus | Clindamycin | Optuna:  34%|███▎      | 67/200 [1:26:56<2:57:14, 79.96s/it, best=0.856][A[I 2026-02-27 23:25:03,313] Trial 71 finished with value: 0.8822556632442247 and parameters: {'activation': 'identity', 'solver': 'adam', 'lr': 0.0025628672591093394, 'layer1': 455, 'layer2': 219, 'layer3': 483}. Best is trial 8 with value: 0.8854975788426769.

Pseudomonas_Aeruginosa | Meropenem | Optuna:  36%|███▌      | 72/200 [1:20:38<2:25:20, 68.13s/it, best=0.885][A
Pseudomonas_Aeruginosa | Meropenem | Optuna:  36%|███▌      | 72/200 [1:20:38<2:25:20, 68.13s/it, best=0.885][A[I 2026-02-27 23:25:46,924] Trial 5 finished with value: 0.760916201319102 and parameters: {'activation': 'identity', 'solver': 'adam', 'lr': 2.259279742015697e-06, 'layer1': 106, 'layer2': 32, 'layer3': 169}. Best is trial 4 with value: 0.8940585425996325.

Escherichia_Coli | Ceftriaxone | Optuna:   3%|▎         | 6/200 [15:48<9:47:15, 181.63s/it, best=0.894][A
Escherichia_Coli | Ceftriaxone | Optuna:   3%|▎         | 6/200 [15:48<9:47:15, 181.63s/it, best=0.894][A[I 2026-02-27 23:25:48,579] Trial 89 finished with value: 0.9049786650675242 and parameters: {'activation': 'logistic', 'solver': 'adam', 'lr': 0.0003512553081504855, 'layer1': 424, 'layer2': 346, 'layer3': 405}. Best is trial 25 with value: 0.9080365798965563.

Klebsiella_Pneumoniae | Ceftriaxone | Optuna:  45%|████▌     | 90/200 [2:35:10<3:19:44, 108.95s/it, best=0.908][A
Klebsiella_Pneumoniae | Ceftriaxone | Optuna:  45%|████▌     | 90/200 [2:35:10<3:19:44, 108.95s/it, best=0.908][A[I 2026-02-27 23:26:28,997] Trial 72 finished with value: 0.8827527094520281 and parameters: {'activation': 'identity', 'solver': 'adam', 'lr': 0.0010438021324011687, 'layer1': 404, 'layer2': 230, 'layer3': 464}. Best is trial 8 with value: 0.8854975788426769.

Pseudomonas_Aeruginosa | Meropenem | Optuna:  36%|███▋      | 73/200 [1:22:04<2:35:21, 73.40s/it, best=0.885][A
Pseudomonas_Aeruginosa | Meropenem | Optuna:  36%|███▋      | 73/200 [1:22:04<2:35:21, 73.40s/it, best=0.885][A[I 2026-02-27 23:26:55,133] Trial 67 finished with value: 0.8493428042496353 and parameters: {'activation': 'tanh', 'solver': 'adam', 'lr': 3.4345248154490965e-05, 'layer1': 174, 'layer2': 30, 'layer3': 241}. Best is trial 33 with value: 0.8559196107911822.

Staphylococcus_Aureus | Clindamycin | Optuna:  34%|███▍      | 68/200 [1:28:56<3:22:39, 92.12s/it, best=0.856][A
Staphylococcus_Aureus | Clindamycin | Optuna:  34%|███▍      | 68/200 [1:28:56<3:22:39, 92.12s/it, best=0.856][A[I 2026-02-27 23:27:47,479] Trial 90 finished with value: 0.9020623878937283 and parameters: {'activation': 'logistic', 'solver': 'adam', 'lr': 0.00016940420669458097, 'layer1': 433, 'layer2': 363, 'layer3': 477}. Best is trial 25 with value: 0.9080365798965563.

Klebsiella_Pneumoniae | Ceftriaxone | Optuna:  46%|████▌     | 91/200 [2:37:09<3:23:20, 111.93s/it, best=0.908][A
Klebsiella_Pneumoniae | Ceftriaxone | Optuna:  46%|████▌     | 91/200 [2:37:09<3:23:20, 111.93s/it, best=0.908][A[I 2026-02-27 23:27:49,613] Trial 73 finished with value: 0.8861579932511299 and parameters: {'activation': 'identity', 'solver': 'adam', 'lr': 0.0009126863395755617, 'layer1': 376, 'layer2': 186, 'layer3': 487}. Best is trial 73 with value: 0.8861579932511299.

Pseudomonas_Aeruginosa | Meropenem | Optuna:  37%|███▋      | 74/200 [1:23:24<2:38:40, 75.56s/it, best=0.885][A
Pseudomonas_Aeruginosa | Meropenem | Optuna:  37%|███▋      | 74/200 [1:23:24<2:38:40, 75.56s/it, best=0.886][A[I 2026-02-27 23:28:10,883] Trial 68 finished with value: 0.7821972152598982 and parameters: {'activation': 'tanh', 'solver': 'sgd', 'lr': 8.357453330159228e-05, 'layer1': 144, 'layer2': 52, 'layer3': 24}. Best is trial 33 with value: 0.8559196107911822.

Staphylococcus_Aureus | Clindamycin | Optuna:  34%|███▍      | 69/200 [1:30:12<3:10:24, 87.21s/it, best=0.856][A
Staphylococcus_Aureus | Clindamycin | Optuna:  34%|███▍      | 69/200 [1:30:12<3:10:24, 87.21s/it, best=0.856][A[I 2026-02-27 23:29:20,604] Trial 74 finished with value: 0.8837111958067009 and parameters: {'activation': 'identity', 'solver': 'adam', 'lr': 0.0008186247360911786, 'layer1': 335, 'layer2': 190, 'layer3': 497}. Best is trial 73 with value: 0.8861579932511299.

Pseudomonas_Aeruginosa | Meropenem | Optuna:  38%|███▊      | 75/200 [1:24:55<2:47:03, 80.19s/it, best=0.886][A
Pseudomonas_Aeruginosa | Meropenem | Optuna:  38%|███▊      | 75/200 [1:24:55<2:47:03, 80.19s/it, best=0.886][A[I 2026-02-27 23:30:28,309] Trial 69 finished with value: 0.8477853494978576 and parameters: {'activation': 'identity', 'solver': 'adam', 'lr': 6.405423819734949e-05, 'layer1': 163, 'layer2': 210, 'layer3': 269}. Best is trial 33 with value: 0.8559196107911822.

Staphylococcus_Aureus | Clindamycin | Optuna:  35%|███▌      | 70/200 [1:32:29<3:41:35, 102.27s/it, best=0.856][A
Staphylococcus_Aureus | Clindamycin | Optuna:  35%|███▌      | 70/200 [1:32:29<3:41:35, 102.27s/it, best=0.856][A[I 2026-02-27 23:30:41,195] Trial 91 finished with value: 0.9030774244562684 and parameters: {'activation': 'logistic', 'solver': 'adam', 'lr': 8.193190291668157e-05, 'layer1': 462, 'layer2': 376, 'layer3': 489}. Best is trial 25 with value: 0.9080365798965563.

Klebsiella_Pneumoniae | Ceftriaxone | Optuna:  46%|████▌     | 92/200 [2:40:02<3:54:50, 130.47s/it, best=0.908][A
Klebsiella_Pneumoniae | Ceftriaxone | Optuna:  46%|████▌     | 92/200 [2:40:02<3:54:50, 130.47s/it, best=0.908][A[I 2026-02-27 23:31:05,816] Trial 75 finished with value: 0.8847348995423479 and parameters: {'activation': 'identity', 'solver': 'adam', 'lr': 0.00031680186567010826, 'layer1': 371, 'layer2': 498, 'layer3': 227}. Best is trial 73 with value: 0.8861579932511299.

Pseudomonas_Aeruginosa | Meropenem | Optuna:  38%|███▊      | 76/200 [1:26:41<3:01:14, 87.70s/it, best=0.886][A
Pseudomonas_Aeruginosa | Meropenem | Optuna:  38%|███▊      | 76/200 [1:26:41<3:01:14, 87.70s/it, best=0.886][A[I 2026-02-27 23:31:07,367] Trial 70 finished with value: 0.7986964086836073 and parameters: {'activation': 'tanh', 'solver': 'adam', 'lr': 1.5456390993711084e-05, 'layer1': 23, 'layer2': 95, 'layer3': 89}. Best is trial 33 with value: 0.8559196107911822.

Staphylococcus_Aureus | Clindamycin | Optuna:  36%|███▌      | 71/200 [1:33:09<2:59:06, 83.31s/it, best=0.856] [A
Staphylococcus_Aureus | Clindamycin | Optuna:  36%|███▌      | 71/200 [1:33:09<2:59:06, 83.31s/it, best=0.856][A[I 2026-02-27 23:31:52,995] Trial 92 finished with value: 0.9000453913006397 and parameters: {'activation': 'identity', 'solver': 'adam', 'lr': 0.00021069683610391228, 'layer1': 443, 'layer2': 320, 'layer3': 452}. Best is trial 25 with value: 0.9080365798965563.

Klebsiella_Pneumoniae | Ceftriaxone | Optuna:  46%|████▋     | 93/200 [2:41:14<3:21:16, 112.87s/it, best=0.908][A
Klebsiella_Pneumoniae | Ceftriaxone | Optuna:  46%|████▋     | 93/200 [2:41:14<3:21:16, 112.87s/it, best=0.908][A[I 2026-02-27 23:32:23,417] Trial 76 finished with value: 0.8819653740126248 and parameters: {'activation': 'identity', 'solver': 'adam', 'lr': 0.00030534603511506766, 'layer1': 475, 'layer2': 499, 'layer3': 257}. Best is trial 73 with value: 0.8861579932511299.

Pseudomonas_Aeruginosa | Meropenem | Optuna:  38%|███▊      | 77/200 [1:27:58<2:53:34, 84.67s/it, best=0.886][A
Pseudomonas_Aeruginosa | Meropenem | Optuna:  38%|███▊      | 77/200 [1:27:58<2:53:34, 84.67s/it, best=0.886][A[I 2026-02-27 23:32:26,424] Trial 71 finished with value: 0.8566270523015425 and parameters: {'activation': 'tanh', 'solver': 'adam', 'lr': 0.00011872421650651561, 'layer1': 102, 'layer2': 115, 'layer3': 396}. Best is trial 71 with value: 0.8566270523015425.

Staphylococcus_Aureus | Clindamycin | Optuna:  36%|███▌      | 72/200 [1:34:28<2:55:00, 82.03s/it, best=0.856][A
Staphylococcus_Aureus | Clindamycin | Optuna:  36%|███▌      | 72/200 [1:34:28<2:55:00, 82.03s/it, best=0.857][A[I 2026-02-27 23:33:42,159] Trial 77 finished with value: 0.8821061771946962 and parameters: {'activation': 'identity', 'solver': 'adam', 'lr': 0.00012094149578528517, 'layer1': 259, 'layer2': 486, 'layer3': 183}. Best is trial 73 with value: 0.8861579932511299.

Pseudomonas_Aeruginosa | Meropenem | Optuna:  39%|███▉      | 78/200 [1:29:17<2:48:32, 82.89s/it, best=0.886][A
Pseudomonas_Aeruginosa | Meropenem | Optuna:  39%|███▉      | 78/200 [1:29:17<2:48:32, 82.89s/it, best=0.886][A[I 2026-02-27 23:33:49,577] Trial 72 finished with value: 0.8519864436562301 and parameters: {'activation': 'tanh', 'solver': 'adam', 'lr': 0.00011584850870626058, 'layer1': 116, 'layer2': 143, 'layer3': 399}. Best is trial 71 with value: 0.8566270523015425.

Staphylococcus_Aureus | Clindamycin | Optuna:  36%|███▋      | 73/200 [1:35:51<2:54:20, 82.37s/it, best=0.857][A
Staphylococcus_Aureus | Clindamycin | Optuna:  36%|███▋      | 73/200 [1:35:51<2:54:20, 82.37s/it, best=0.857][A[I 2026-02-27 23:33:54,145] Trial 6 finished with value: 0.8830943942411859 and parameters: {'activation': 'tanh', 'solver': 'adam', 'lr': 3.6618192203924288e-06, 'layer1': 403, 'layer2': 46, 'layer3': 494}. Best is trial 4 with value: 0.8940585425996325.

Escherichia_Coli | Ceftriaxone | Optuna:   4%|▎         | 7/200 [23:55<15:05:35, 281.53s/it, best=0.894][A
Escherichia_Coli | Ceftriaxone | Optuna:   4%|▎         | 7/200 [23:55<15:05:35, 281.53s/it, best=0.894][A[I 2026-02-27 23:34:34,640] Trial 93 finished with value: 0.9043501359876183 and parameters: {'activation': 'logistic', 'solver': 'adam', 'lr': 0.00011878523593478699, 'layer1': 488, 'layer2': 399, 'layer3': 470}. Best is trial 25 with value: 0.9080365798965563.

Klebsiella_Pneumoniae | Ceftriaxone | Optuna:  47%|████▋     | 94/200 [2:43:56<3:45:15, 127.50s/it, best=0.908][A
Klebsiella_Pneumoniae | Ceftriaxone | Optuna:  47%|████▋     | 94/200 [2:43:56<3:45:15, 127.50s/it, best=0.908][A[I 2026-02-27 23:35:01,865] Trial 78 finished with value: 0.8828505016082333 and parameters: {'activation': 'identity', 'solver': 'adam', 'lr': 0.00019944692145474816, 'layer1': 438, 'layer2': 447, 'layer3': 233}. Best is trial 73 with value: 0.8861579932511299.

Pseudomonas_Aeruginosa | Meropenem | Optuna:  40%|███▉      | 79/200 [1:30:37<2:45:14, 81.94s/it, best=0.886][A
Pseudomonas_Aeruginosa | Meropenem | Optuna:  40%|███▉      | 79/200 [1:30:37<2:45:14, 81.94s/it, best=0.886][A[I 2026-02-27 23:35:08,138] Trial 7 finished with value: 0.8855851275195358 and parameters: {'activation': 'relu', 'solver': 'adam', 'lr': 0.0012164139351417069, 'layer1': 46, 'layer2': 186, 'layer3': 66}. Best is trial 4 with value: 0.8940585425996325.

Escherichia_Coli | Ceftriaxone | Optuna:   4%|▍         | 8/200 [25:09<11:29:28, 215.46s/it, best=0.894][A
Escherichia_Coli | Ceftriaxone | Optuna:   4%|▍         | 8/200 [25:09<11:29:28, 215.46s/it, best=0.894][A[I 2026-02-27 23:35:30,047] Trial 73 finished with value: 0.8538779612341258 and parameters: {'activation': 'tanh', 'solver': 'adam', 'lr': 6.453656984989662e-05, 'layer1': 129, 'layer2': 119, 'layer3': 376}. Best is trial 71 with value: 0.8566270523015425.

Staphylococcus_Aureus | Clindamycin | Optuna:  37%|███▋      | 74/200 [1:37:31<3:04:22, 87.80s/it, best=0.857][A
Staphylococcus_Aureus | Clindamycin | Optuna:  37%|███▋      | 74/200 [1:37:31<3:04:22, 87.80s/it, best=0.857][A[I 2026-02-27 23:36:02,828] Trial 94 finished with value: 0.9048248854091632 and parameters: {'activation': 'identity', 'solver': 'adam', 'lr': 7.013879906730935e-05, 'layer1': 355, 'layer2': 408, 'layer3': 439}. Best is trial 25 with value: 0.9080365798965563.

Klebsiella_Pneumoniae | Ceftriaxone | Optuna:  48%|████▊     | 95/200 [2:45:24<3:22:29, 115.71s/it, best=0.908][A
Klebsiella_Pneumoniae | Ceftriaxone | Optuna:  48%|████▊     | 95/200 [2:45:24<3:22:29, 115.71s/it, best=0.908][A[I 2026-02-27 23:36:03,659] Trial 79 finished with value: 0.8293738602922998 and parameters: {'activation': 'tanh', 'solver': 'sgd', 'lr': 0.00042425991992424883, 'layer1': 372, 'layer2': 474, 'layer3': 222}. Best is trial 73 with value: 0.8861579932511299.

Pseudomonas_Aeruginosa | Meropenem | Optuna:  40%|████      | 80/200 [1:31:38<2:31:47, 75.89s/it, best=0.886][A
Pseudomonas_Aeruginosa | Meropenem | Optuna:  40%|████      | 80/200 [1:31:38<2:31:47, 75.89s/it, best=0.886][A[I 2026-02-27 23:36:56,416] Trial 80 finished with value: 0.8773067302118271 and parameters: {'activation': 'relu', 'solver': 'adam', 'lr': 0.0005001584719095057, 'layer1': 234, 'layer2': 181, 'layer3': 152}. Best is trial 73 with value: 0.8861579932511299.

Pseudomonas_Aeruginosa | Meropenem | Optuna:  40%|████      | 81/200 [1:32:31<2:16:45, 68.95s/it, best=0.886][A
Pseudomonas_Aeruginosa | Meropenem | Optuna:  40%|████      | 81/200 [1:32:31<2:16:45, 68.95s/it, best=0.886][A[I 2026-02-27 23:37:14,682] Trial 8 finished with value: 0.8847973812322356 and parameters: {'activation': 'identity', 'solver': 'adam', 'lr': 0.000828752236376816, 'layer1': 323, 'layer2': 445, 'layer3': 241}. Best is trial 4 with value: 0.8940585425996325.

Escherichia_Coli | Ceftriaxone | Optuna:   4%|▍         | 9/200 [27:16<9:57:23, 187.66s/it, best=0.894] [A
Escherichia_Coli | Ceftriaxone | Optuna:   4%|▍         | 9/200 [27:16<9:57:23, 187.66s/it, best=0.894][A[I 2026-02-27 23:37:42,089] Trial 74 finished with value: 0.8459665358451961 and parameters: {'activation': 'tanh', 'solver': 'adam', 'lr': 2.3555812237930415e-05, 'layer1': 154, 'layer2': 120, 'layer3': 373}. Best is trial 71 with value: 0.8566270523015425.

Staphylococcus_Aureus | Clindamycin | Optuna:  38%|███▊      | 75/200 [1:39:43<3:30:33, 101.07s/it, best=0.857][A
Staphylococcus_Aureus | Clindamycin | Optuna:  38%|███▊      | 75/200 [1:39:43<3:30:33, 101.07s/it, best=0.857][A[I 2026-02-27 23:37:48,445] Trial 95 finished with value: 0.9055108611338646 and parameters: {'activation': 'identity', 'solver': 'adam', 'lr': 0.00017566068041971762, 'layer1': 468, 'layer2': 449, 'layer3': 489}. Best is trial 25 with value: 0.9080365798965563.

Klebsiella_Pneumoniae | Ceftriaxone | Optuna:  48%|████▊     | 96/200 [2:47:09<3:15:18, 112.68s/it, best=0.908][A
Klebsiella_Pneumoniae | Ceftriaxone | Optuna:  48%|████▊     | 96/200 [2:47:09<3:15:18, 112.68s/it, best=0.908][A[I 2026-02-27 23:38:07,989] Trial 81 finished with value: 0.883205389388448 and parameters: {'activation': 'identity', 'solver': 'adam', 'lr': 0.0014527341818505964, 'layer1': 358, 'layer2': 365, 'layer3': 386}. Best is trial 73 with value: 0.8861579932511299.

Pseudomonas_Aeruginosa | Meropenem | Optuna:  41%|████      | 82/200 [1:33:43<2:17:09, 69.74s/it, best=0.886][A
Pseudomonas_Aeruginosa | Meropenem | Optuna:  41%|████      | 82/200 [1:33:43<2:17:09, 69.74s/it, best=0.886][A[I 2026-02-27 23:39:04,013] Trial 9 finished with value: 0.720022844153632 and parameters: {'activation': 'tanh', 'solver': 'sgd', 'lr': 0.00012329098365270507, 'layer1': 219, 'layer2': 22, 'layer3': 62}. Best is trial 4 with value: 0.8940585425996325.

Escherichia_Coli | Ceftriaxone | Optuna:   5%|▌         | 10/200 [29:05<8:37:41, 163.48s/it, best=0.894][A
Escherichia_Coli | Ceftriaxone | Optuna:   5%|▌         | 10/200 [29:05<8:37:41, 163.48s/it, best=0.894][A[I 2026-02-27 23:39:23,375] Trial 96 finished with value: 0.9023082605172362 and parameters: {'activation': 'identity', 'solver': 'adam', 'lr': 0.000277317843732139, 'layer1': 415, 'layer2': 348, 'layer3': 479}. Best is trial 25 with value: 0.9080365798965563.

Klebsiella_Pneumoniae | Ceftriaxone | Optuna:  48%|████▊     | 97/200 [2:48:44<3:04:17, 107.35s/it, best=0.908][A
Klebsiella_Pneumoniae | Ceftriaxone | Optuna:  48%|████▊     | 97/200 [2:48:44<3:04:17, 107.35s/it, best=0.908][A[I 2026-02-27 23:39:29,461] Trial 75 finished with value: 0.8518368607665915 and parameters: {'activation': 'tanh', 'solver': 'adam', 'lr': 5.9589058524794746e-05, 'layer1': 131, 'layer2': 167, 'layer3': 330}. Best is trial 71 with value: 0.8566270523015425.

Staphylococcus_Aureus | Clindamycin | Optuna:  38%|███▊      | 76/200 [1:41:31<3:32:47, 102.96s/it, best=0.857][A
Staphylococcus_Aureus | Clindamycin | Optuna:  38%|███▊      | 76/200 [1:41:31<3:32:47, 102.96s/it, best=0.857][A[I 2026-02-27 23:39:41,370] Trial 10 finished with value: 0.7060702528857489 and parameters: {'activation': 'relu', 'solver': 'sgd', 'lr': 0.007553503645583194, 'layer1': 157, 'layer2': 478, 'layer3': 348}. Best is trial 4 with value: 0.8940585425996325.

Escherichia_Coli | Ceftriaxone | Optuna:   6%|▌         | 11/200 [29:42<6:33:22, 124.88s/it, best=0.894][A
Escherichia_Coli | Ceftriaxone | Optuna:   6%|▌         | 11/200 [29:42<6:33:22, 124.88s/it, best=0.894][A[I 2026-02-27 23:39:43,933] Trial 82 finished with value: 0.8816644215319995 and parameters: {'activation': 'identity', 'solver': 'adam', 'lr': 0.0006653826024607248, 'layer1': 399, 'layer2': 404, 'layer3': 243}. Best is trial 73 with value: 0.8861579932511299.

Pseudomonas_Aeruginosa | Meropenem | Optuna:  42%|████▏     | 83/200 [1:35:19<2:31:19, 77.60s/it, best=0.886][A
Pseudomonas_Aeruginosa | Meropenem | Optuna:  42%|████▏     | 83/200 [1:35:19<2:31:19, 77.60s/it, best=0.886][A[I 2026-02-27 23:40:49,638] Trial 83 finished with value: 0.8830391023045628 and parameters: {'activation': 'identity', 'solver': 'adam', 'lr': 0.0018183877012485806, 'layer1': 331, 'layer2': 204, 'layer3': 448}. Best is trial 73 with value: 0.8861579932511299.

Pseudomonas_Aeruginosa | Meropenem | Optuna:  42%|████▏     | 84/200 [1:36:24<2:23:07, 74.03s/it, best=0.886][A
Pseudomonas_Aeruginosa | Meropenem | Optuna:  42%|████▏     | 84/200 [1:36:24<2:23:07, 74.03s/it, best=0.886][A[I 2026-02-27 23:40:55,152] Trial 97 finished with value: 0.7905930660688603 and parameters: {'activation': 'identity', 'solver': 'sgd', 'lr': 0.00013471430437354232, 'layer1': 452, 'layer2': 421, 'layer3': 464}. Best is trial 25 with value: 0.9080365798965563.

Klebsiella_Pneumoniae | Ceftriaxone | Optuna:  49%|████▉     | 98/200 [2:50:16<2:54:33, 102.68s/it, best=0.908][A
Klebsiella_Pneumoniae | Ceftriaxone | Optuna:  49%|████▉     | 98/200 [2:50:16<2:54:33, 102.68s/it, best=0.908][A[I 2026-02-27 23:40:56,982] Trial 11 finished with value: 0.8887391137513628 and parameters: {'activation': 'relu', 'solver': 'adam', 'lr': 0.000202128655675791, 'layer1': 13, 'layer2': 188, 'layer3': 94}. Best is trial 4 with value: 0.8940585425996325.

Escherichia_Coli | Ceftriaxone | Optuna:   6%|▌         | 12/200 [30:58<5:44:19, 109.89s/it, best=0.894][A
