Pseudomonas_Aeruginosa | Imipenem | Optuna:  22%|██▎       | 45/200 [35:21<2:04:56, 48.37s/it, best=0.865][A[I 2026-02-27 19:07:27,959] Trial 137 finished with value: 0.8207711742879912 and parameters: {'activation': 'identity', 'solver': 'adam', 'lr': 1.9948884240908643e-05, 'layer1': 101, 'layer2': 418, 'layer3': 148}. Best is trial 91 with value: 0.8315336183309556.

Klebsiella_Pneumoniae | Ciprofloxacin | Optuna:  69%|██████▉   | 138/200 [4:19:57<2:08:58, 124.81s/it, best=0.832][A
Klebsiella_Pneumoniae | Ciprofloxacin | Optuna:  69%|██████▉   | 138/200 [4:19:57<2:08:58, 124.81s/it, best=0.832][A[I 2026-02-27 19:08:08,507] Trial 45 finished with value: 0.8509071280207353 and parameters: {'activation': 'tanh', 'solver': 'adam', 'lr': 0.0013271720954987432, 'layer1': 249, 'layer2': 328, 'layer3': 223}. Best is trial 42 with value: 0.8645324176837453.

Pseudomonas_Aeruginosa | Imipenem | Optuna:  23%|██▎       | 46/200 [36:02<1:58:58, 46.35s/it, best=0.865][A
Pseudomonas_Aeruginosa | Imipenem | Optuna:  23%|██▎       | 46/200 [36:02<1:58:58, 46.35s/it, best=0.865][A[I 2026-02-27 19:08:50,029] Trial 105 finished with value: 0.8069665443981643 and parameters: {'activation': 'tanh', 'solver': 'adam', 'lr': 6.403668914464103e-05, 'layer1': 145, 'layer2': 328, 'layer3': 10}. Best is trial 55 with value: 0.8076668303114959.

Escherichia_Coli | Ciprofloxacin | Optuna:  53%|█████▎    | 106/200 [4:21:19<3:32:40, 135.75s/it, best=0.808][A
Escherichia_Coli | Ciprofloxacin | Optuna:  53%|█████▎    | 106/200 [4:21:19<3:32:40, 135.75s/it, best=0.808][A[I 2026-02-27 19:09:02,931] Trial 138 finished with value: 0.8172866317421811 and parameters: {'activation': 'identity', 'solver': 'adam', 'lr': 0.0025888738280268834, 'layer1': 344, 'layer2': 405, 'layer3': 175}. Best is trial 91 with value: 0.8315336183309556.

Klebsiella_Pneumoniae | Ciprofloxacin | Optuna:  70%|██████▉   | 139/200 [4:21:32<1:57:47, 115.86s/it, best=0.832][A
Klebsiella_Pneumoniae | Ciprofloxacin | Optuna:  70%|██████▉   | 139/200 [4:21:32<1:57:47, 115.86s/it, best=0.832][A[I 2026-02-27 19:09:17,438] Trial 46 finished with value: 0.8602186221825884 and parameters: {'activation': 'relu', 'solver': 'adam', 'lr': 0.003919393355600991, 'layer1': 185, 'layer2': 387, 'layer3': 61}. Best is trial 42 with value: 0.8645324176837453.

Pseudomonas_Aeruginosa | Imipenem | Optuna:  24%|██▎       | 47/200 [37:11<2:15:28, 53.13s/it, best=0.865][A
Pseudomonas_Aeruginosa | Imipenem | Optuna:  24%|██▎       | 47/200 [37:11<2:15:28, 53.13s/it, best=0.865][A[I 2026-02-27 19:09:32,202] Trial 119 finished with value: 0.9078177928291579 and parameters: {'activation': 'identity', 'solver': 'adam', 'lr': 5.892155503988625e-05, 'layer1': 285, 'layer2': 211, 'layer3': 412}. Best is trial 84 with value: 0.9099428178723615.

Staphylococcus_Aureus | Oxacillin | Optuna:  60%|██████    | 120/200 [4:22:01<2:43:42, 122.78s/it, best=0.91][A
Staphylococcus_Aureus | Oxacillin | Optuna:  60%|██████    | 120/200 [4:22:01<2:43:42, 122.78s/it, best=0.91][A[I 2026-02-27 19:09:33,789] Trial 47 finished with value: 0.8175565662034809 and parameters: {'activation': 'relu', 'solver': 'sgd', 'lr': 0.00680564411747891, 'layer1': 207, 'layer2': 275, 'layer3': 105}. Best is trial 42 with value: 0.8645324176837453.

Pseudomonas_Aeruginosa | Imipenem | Optuna:  24%|██▍       | 48/200 [37:28<1:46:38, 42.09s/it, best=0.865][A
Pseudomonas_Aeruginosa | Imipenem | Optuna:  24%|██▍       | 48/200 [37:28<1:46:38, 42.09s/it, best=0.865][A[I 2026-02-27 19:09:59,931] Trial 48 finished with value: 0.8175565662034809 and parameters: {'activation': 'relu', 'solver': 'adam', 'lr': 0.0098565686102585, 'layer1': 293, 'layer2': 356, 'layer3': 456}. Best is trial 42 with value: 0.8645324176837453.

Pseudomonas_Aeruginosa | Imipenem | Optuna:  24%|██▍       | 49/200 [37:54<1:33:53, 37.31s/it, best=0.865][A
Pseudomonas_Aeruginosa | Imipenem | Optuna:  24%|██▍       | 49/200 [37:54<1:33:53, 37.31s/it, best=0.865][A[I 2026-02-27 19:10:35,086] Trial 49 finished with value: 0.8505621140883199 and parameters: {'activation': 'tanh', 'solver': 'adam', 'lr': 0.0015124374608783268, 'layer1': 117, 'layer2': 320, 'layer3': 23}. Best is trial 42 with value: 0.8645324176837453.

Pseudomonas_Aeruginosa | Imipenem | Optuna:  25%|██▌       | 50/200 [38:29<1:31:39, 36.66s/it, best=0.865][A
Pseudomonas_Aeruginosa | Imipenem | Optuna:  25%|██▌       | 50/200 [38:29<1:31:39, 36.66s/it, best=0.865][A[I 2026-02-27 19:10:38,053] Trial 106 finished with value: 0.8050174090977442 and parameters: {'activation': 'tanh', 'solver': 'adam', 'lr': 5.295189299774317e-05, 'layer1': 177, 'layer2': 266, 'layer3': 20}. Best is trial 55 with value: 0.8076668303114959.

Escherichia_Coli | Ciprofloxacin | Optuna:  54%|█████▎    | 107/200 [4:23:07<3:17:31, 127.43s/it, best=0.808][A
Escherichia_Coli | Ciprofloxacin | Optuna:  54%|█████▎    | 107/200 [4:23:07<3:17:31, 127.43s/it, best=0.808][A[I 2026-02-27 19:10:44,378] Trial 139 finished with value: 0.7817618653151882 and parameters: {'activation': 'logistic', 'solver': 'adam', 'lr': 0.00467560652263178, 'layer1': 409, 'layer2': 435, 'layer3': 235}. Best is trial 91 with value: 0.8315336183309556.

Klebsiella_Pneumoniae | Ciprofloxacin | Optuna:  70%|███████   | 140/200 [4:23:13<1:51:32, 111.53s/it, best=0.832][A
Klebsiella_Pneumoniae | Ciprofloxacin | Optuna:  70%|███████   | 140/200 [4:23:13<1:51:32, 111.53s/it, best=0.832][A[I 2026-02-27 19:11:15,443] Trial 140 finished with value: 0.7472805238053303 and parameters: {'activation': 'identity', 'solver': 'sgd', 'lr': 0.0018419437377482331, 'layer1': 362, 'layer2': 471, 'layer3': 473}. Best is trial 91 with value: 0.8315336183309556.

Klebsiella_Pneumoniae | Ciprofloxacin | Optuna:  70%|███████   | 141/200 [4:23:45<1:25:56, 87.39s/it, best=0.832] [A
Klebsiella_Pneumoniae | Ciprofloxacin | Optuna:  70%|███████   | 141/200 [4:23:45<1:25:56, 87.39s/it, best=0.832][A[I 2026-02-27 19:11:40,242] Trial 120 finished with value: 0.9074812187504335 and parameters: {'activation': 'identity', 'solver': 'adam', 'lr': 0.000770383775101561, 'layer1': 224, 'layer2': 286, 'layer3': 426}. Best is trial 84 with value: 0.9099428178723615.

Staphylococcus_Aureus | Oxacillin | Optuna:  60%|██████    | 121/200 [4:24:09<2:43:44, 124.36s/it, best=0.91][A
Staphylococcus_Aureus | Oxacillin | Optuna:  60%|██████    | 121/200 [4:24:09<2:43:44, 124.36s/it, best=0.91][A[I 2026-02-27 19:11:41,135] Trial 50 finished with value: 0.862664522940275 and parameters: {'activation': 'relu', 'solver': 'adam', 'lr': 0.00036762649874463855, 'layer1': 418, 'layer2': 379, 'layer3': 138}. Best is trial 42 with value: 0.8645324176837453.

Pseudomonas_Aeruginosa | Imipenem | Optuna:  26%|██▌       | 51/200 [39:35<1:52:56, 45.48s/it, best=0.865][A
Pseudomonas_Aeruginosa | Imipenem | Optuna:  26%|██▌       | 51/200 [39:35<1:52:56, 45.48s/it, best=0.865][A[I 2026-02-27 19:12:36,146] Trial 141 finished with value: 0.8141621909590743 and parameters: {'activation': 'identity', 'solver': 'adam', 'lr': 0.006864959967951361, 'layer1': 238, 'layer2': 486, 'layer3': 264}. Best is trial 91 with value: 0.8315336183309556.

Klebsiella_Pneumoniae | Ciprofloxacin | Optuna:  71%|███████   | 142/200 [4:25:05<1:22:32, 85.39s/it, best=0.832][A
Klebsiella_Pneumoniae | Ciprofloxacin | Optuna:  71%|███████   | 142/200 [4:25:05<1:22:32, 85.39s/it, best=0.832][A[I 2026-02-27 19:12:45,425] Trial 51 finished with value: 0.8547698398853534 and parameters: {'activation': 'relu', 'solver': 'adam', 'lr': 0.00010727941736002471, 'layer1': 381, 'layer2': 387, 'layer3': 133}. Best is trial 42 with value: 0.8645324176837453.

Pseudomonas_Aeruginosa | Imipenem | Optuna:  26%|██▌       | 52/200 [40:39<2:06:05, 51.12s/it, best=0.865][A
Pseudomonas_Aeruginosa | Imipenem | Optuna:  26%|██▌       | 52/200 [40:39<2:06:05, 51.12s/it, best=0.865][A[I 2026-02-27 19:12:50,295] Trial 107 finished with value: 0.8083747566869277 and parameters: {'activation': 'tanh', 'solver': 'adam', 'lr': 2.8261769585438724e-05, 'layer1': 156, 'layer2': 324, 'layer3': 10}. Best is trial 107 with value: 0.8083747566869277.

Escherichia_Coli | Ciprofloxacin | Optuna:  54%|█████▍    | 108/200 [4:25:19<3:17:36, 128.88s/it, best=0.808][A
Escherichia_Coli | Ciprofloxacin | Optuna:  54%|█████▍    | 108/200 [4:25:19<3:17:36, 128.88s/it, best=0.808][A[I 2026-02-27 19:13:56,534] Trial 121 finished with value: 0.9067340364925436 and parameters: {'activation': 'identity', 'solver': 'adam', 'lr': 0.0002721958745563688, 'layer1': 301, 'layer2': 436, 'layer3': 442}. Best is trial 84 with value: 0.9099428178723615.

Staphylococcus_Aureus | Oxacillin | Optuna:  61%|██████    | 122/200 [4:26:26<2:46:19, 127.94s/it, best=0.91][A
Staphylococcus_Aureus | Oxacillin | Optuna:  61%|██████    | 122/200 [4:26:26<2:46:19, 127.94s/it, best=0.91][A[I 2026-02-27 19:14:09,859] Trial 52 finished with value: 0.8637226925370138 and parameters: {'activation': 'relu', 'solver': 'adam', 'lr': 0.000300350829776837, 'layer1': 431, 'layer2': 289, 'layer3': 109}. Best is trial 42 with value: 0.8645324176837453.

Pseudomonas_Aeruginosa | Imipenem | Optuna:  26%|██▋       | 53/200 [42:04<2:29:43, 61.12s/it, best=0.865][A
Pseudomonas_Aeruginosa | Imipenem | Optuna:  26%|██▋       | 53/200 [42:04<2:29:43, 61.12s/it, best=0.865][A[I 2026-02-27 19:15:06,435] Trial 108 finished with value: 0.8002943000588377 and parameters: {'activation': 'tanh', 'solver': 'adam', 'lr': 2.5235152054215564e-05, 'layer1': 109, 'layer2': 252, 'layer3': 153}. Best is trial 107 with value: 0.8083747566869277.

Escherichia_Coli | Ciprofloxacin | Optuna:  55%|█████▍    | 109/200 [4:27:35<3:18:46, 131.06s/it, best=0.808][A
Escherichia_Coli | Ciprofloxacin | Optuna:  55%|█████▍    | 109/200 [4:27:35<3:18:46, 131.06s/it, best=0.808][A[I 2026-02-27 19:15:24,528] Trial 53 finished with value: 0.8623634128730467 and parameters: {'activation': 'relu', 'solver': 'adam', 'lr': 0.00031431099706315447, 'layer1': 444, 'layer2': 281, 'layer3': 119}. Best is trial 42 with value: 0.8645324176837453.

Pseudomonas_Aeruginosa | Imipenem | Optuna:  27%|██▋       | 54/200 [43:18<2:38:36, 65.18s/it, best=0.865][A
Pseudomonas_Aeruginosa | Imipenem | Optuna:  27%|██▋       | 54/200 [43:18<2:38:36, 65.18s/it, best=0.865][A[I 2026-02-27 19:15:42,002] Trial 142 finished with value: 0.8254854656192613 and parameters: {'activation': 'identity', 'solver': 'adam', 'lr': 2.767451021999956e-05, 'layer1': 463, 'layer2': 452, 'layer3': 285}. Best is trial 91 with value: 0.8315336183309556.

Klebsiella_Pneumoniae | Ciprofloxacin | Optuna:  72%|███████▏  | 143/200 [4:28:11<1:49:45, 115.53s/it, best=0.832][A
Klebsiella_Pneumoniae | Ciprofloxacin | Optuna:  72%|███████▏  | 143/200 [4:28:11<1:49:45, 115.53s/it, best=0.832][A[I 2026-02-27 19:16:02,163] Trial 122 finished with value: 0.9049372773049447 and parameters: {'activation': 'identity', 'solver': 'adam', 'lr': 0.00021225534394923577, 'layer1': 334, 'layer2': 428, 'layer3': 457}. Best is trial 84 with value: 0.9099428178723615.

Staphylococcus_Aureus | Oxacillin | Optuna:  62%|██████▏   | 123/200 [4:28:31<2:43:17, 127.25s/it, best=0.91][A
Staphylococcus_Aureus | Oxacillin | Optuna:  62%|██████▏   | 123/200 [4:28:31<2:43:17, 127.25s/it, best=0.91][A[I 2026-02-27 19:16:57,035] Trial 54 finished with value: 0.8579594483161188 and parameters: {'activation': 'identity', 'solver': 'adam', 'lr': 0.00014305893479832574, 'layer1': 465, 'layer2': 339, 'layer3': 60}. Best is trial 42 with value: 0.8645324176837453.

Pseudomonas_Aeruginosa | Imipenem | Optuna:  28%|██▊       | 55/200 [44:51<2:57:19, 73.38s/it, best=0.865][A
Pseudomonas_Aeruginosa | Imipenem | Optuna:  28%|██▊       | 55/200 [44:51<2:57:19, 73.38s/it, best=0.865][A[I 2026-02-27 19:17:44,300] Trial 143 finished with value: 0.8235802770578953 and parameters: {'activation': 'identity', 'solver': 'adam', 'lr': 5.6816557008437115e-05, 'layer1': 480, 'layer2': 499, 'layer3': 246}. Best is trial 91 with value: 0.8315336183309556.

Klebsiella_Pneumoniae | Ciprofloxacin | Optuna:  72%|███████▏  | 144/200 [4:30:13<1:49:43, 117.56s/it, best=0.832][A
Klebsiella_Pneumoniae | Ciprofloxacin | Optuna:  72%|███████▏  | 144/200 [4:30:13<1:49:43, 117.56s/it, best=0.832][A[I 2026-02-27 19:18:15,515] Trial 123 finished with value: 0.9060907124208784 and parameters: {'activation': 'identity', 'solver': 'adam', 'lr': 0.00015474687041520263, 'layer1': 329, 'layer2': 419, 'layer3': 490}. Best is trial 84 with value: 0.9099428178723615.

Staphylococcus_Aureus | Oxacillin | Optuna:  62%|██████▏   | 124/200 [4:30:45<2:43:29, 129.08s/it, best=0.91][A
Staphylococcus_Aureus | Oxacillin | Optuna:  62%|██████▏   | 124/200 [4:30:45<2:43:29, 129.08s/it, best=0.91][A[I 2026-02-27 19:18:28,389] Trial 109 finished with value: 0.8039756684506554 and parameters: {'activation': 'relu', 'solver': 'adam', 'lr': 2.9389792200873463e-05, 'layer1': 161, 'layer2': 288, 'layer3': 46}. Best is trial 107 with value: 0.8083747566869277.

Escherichia_Coli | Ciprofloxacin | Optuna:  55%|█████▌    | 110/200 [4:30:57<3:48:29, 152.33s/it, best=0.808][A
Escherichia_Coli | Ciprofloxacin | Optuna:  55%|█████▌    | 110/200 [4:30:57<3:48:29, 152.33s/it, best=0.808][A[I 2026-02-27 19:18:44,473] Trial 55 finished with value: 0.8616874329439324 and parameters: {'activation': 'relu', 'solver': 'adam', 'lr': 7.861138924864515e-05, 'layer1': 414, 'layer2': 381, 'layer3': 338}. Best is trial 42 with value: 0.8645324176837453.

Pseudomonas_Aeruginosa | Imipenem | Optuna:  28%|██▊       | 56/200 [46:38<3:20:37, 83.60s/it, best=0.865][A
Pseudomonas_Aeruginosa | Imipenem | Optuna:  28%|██▊       | 56/200 [46:38<3:20:37, 83.60s/it, best=0.865][A[I 2026-02-27 19:19:55,228] Trial 56 finished with value: 0.8571934239995882 and parameters: {'activation': 'relu', 'solver': 'adam', 'lr': 0.0007997938248169591, 'layer1': 479, 'layer2': 228, 'layer3': 143}. Best is trial 42 with value: 0.8645324176837453.

Pseudomonas_Aeruginosa | Imipenem | Optuna:  28%|██▊       | 57/200 [47:49<3:10:03, 79.74s/it, best=0.865][A
Pseudomonas_Aeruginosa | Imipenem | Optuna:  28%|██▊       | 57/200 [47:49<3:10:03, 79.74s/it, best=0.865][A[I 2026-02-27 19:20:11,822] Trial 144 finished with value: 0.8281029958743913 and parameters: {'activation': 'identity', 'solver': 'adam', 'lr': 3.9854749728234656e-05, 'layer1': 320, 'layer2': 482, 'layer3': 203}. Best is trial 91 with value: 0.8315336183309556.

Klebsiella_Pneumoniae | Ciprofloxacin | Optuna:  72%|███████▎  | 145/200 [4:32:41<1:56:00, 126.55s/it, best=0.832][A
Klebsiella_Pneumoniae | Ciprofloxacin | Optuna:  72%|███████▎  | 145/200 [4:32:41<1:56:00, 126.55s/it, best=0.832][A[I 2026-02-27 19:21:01,301] Trial 124 finished with value: 0.9088584752279303 and parameters: {'activation': 'identity', 'solver': 'adam', 'lr': 0.00034981075850369034, 'layer1': 342, 'layer2': 412, 'layer3': 474}. Best is trial 84 with value: 0.9099428178723615.

Staphylococcus_Aureus | Oxacillin | Optuna:  62%|██████▎   | 125/200 [4:33:30<2:55:06, 140.09s/it, best=0.91][A
Staphylococcus_Aureus | Oxacillin | Optuna:  62%|██████▎   | 125/200 [4:33:30<2:55:06, 140.09s/it, best=0.91][A[I 2026-02-27 19:21:11,513] Trial 110 finished with value: 0.802763816455251 and parameters: {'activation': 'tanh', 'solver': 'adam', 'lr': 3.8032085890214616e-05, 'layer1': 207, 'layer2': 276, 'layer3': 67}. Best is trial 107 with value: 0.8083747566869277.

Escherichia_Coli | Ciprofloxacin | Optuna:  56%|█████▌    | 111/200 [4:33:40<3:50:45, 155.56s/it, best=0.808][A
Escherichia_Coli | Ciprofloxacin | Optuna:  56%|█████▌    | 111/200 [4:33:40<3:50:45, 155.56s/it, best=0.808][A[I 2026-02-27 19:21:16,435] Trial 57 finished with value: 0.8615884056253554 and parameters: {'activation': 'relu', 'solver': 'adam', 'lr': 0.00016105732354145932, 'layer1': 429, 'layer2': 298, 'layer3': 250}. Best is trial 42 with value: 0.8645324176837453.

Pseudomonas_Aeruginosa | Imipenem | Optuna:  29%|██▉       | 58/200 [49:10<3:09:46, 80.18s/it, best=0.865][A
Pseudomonas_Aeruginosa | Imipenem | Optuna:  29%|██▉       | 58/200 [49:10<3:09:46, 80.18s/it, best=0.865][A[I 2026-02-27 19:21:39,874] Trial 58 finished with value: 0.8179352697613392 and parameters: {'activation': 'logistic', 'solver': 'sgd', 'lr': 0.0003753121529842186, 'layer1': 371, 'layer2': 421, 'layer3': 74}. Best is trial 42 with value: 0.8645324176837453.

Pseudomonas_Aeruginosa | Imipenem | Optuna:  30%|██▉       | 59/200 [49:34<2:28:25, 63.16s/it, best=0.865][A
Pseudomonas_Aeruginosa | Imipenem | Optuna:  30%|██▉       | 59/200 [49:34<2:28:25, 63.16s/it, best=0.865][A[I 2026-02-27 19:22:31,992] Trial 145 finished with value: 0.8276581022181949 and parameters: {'activation': 'identity', 'solver': 'adam', 'lr': 4.218423814995514e-05, 'layer1': 333, 'layer2': 462, 'layer3': 201}. Best is trial 91 with value: 0.8315336183309556.

Klebsiella_Pneumoniae | Ciprofloxacin | Optuna:  73%|███████▎  | 146/200 [4:35:01<1:57:34, 130.63s/it, best=0.832][A
Klebsiella_Pneumoniae | Ciprofloxacin | Optuna:  73%|███████▎  | 146/200 [4:35:01<1:57:34, 130.63s/it, best=0.832][A[I 2026-02-27 19:22:34,548] Trial 111 finished with value: 0.8021445881421749 and parameters: {'activation': 'tanh', 'solver': 'adam', 'lr': 0.00010970153566340442, 'layer1': 143, 'layer2': 326, 'layer3': 12}. Best is trial 107 with value: 0.8083747566869277.

Escherichia_Coli | Ciprofloxacin | Optuna:  56%|█████▌    | 112/200 [4:35:03<3:16:14, 133.81s/it, best=0.808][A
Escherichia_Coli | Ciprofloxacin | Optuna:  56%|█████▌    | 112/200 [4:35:03<3:16:14, 133.81s/it, best=0.808][A[I 2026-02-27 19:22:52,236] Trial 59 finished with value: 0.8547859093463931 and parameters: {'activation': 'identity', 'solver': 'adam', 'lr': 0.000647790696717625, 'layer1': 342, 'layer2': 269, 'layer3': 165}. Best is trial 42 with value: 0.8645324176837453.

Pseudomonas_Aeruginosa | Imipenem | Optuna:  30%|███       | 60/200 [50:46<2:33:48, 65.92s/it, best=0.865][A
Pseudomonas_Aeruginosa | Imipenem | Optuna:  30%|███       | 60/200 [50:46<2:33:48, 65.92s/it, best=0.865][A[I 2026-02-27 19:22:53,273] Trial 125 finished with value: 0.904695477813404 and parameters: {'activation': 'identity', 'solver': 'adam', 'lr': 0.000495593603696045, 'layer1': 343, 'layer2': 381, 'layer3': 469}. Best is trial 84 with value: 0.9099428178723615.

Staphylococcus_Aureus | Oxacillin | Optuna:  63%|██████▎   | 126/200 [4:35:22<2:42:22, 131.65s/it, best=0.91][A
Staphylococcus_Aureus | Oxacillin | Optuna:  63%|██████▎   | 126/200 [4:35:22<2:42:22, 131.65s/it, best=0.91][A[I 2026-02-27 19:23:21,813] Trial 60 finished with value: 0.8175565662034809 and parameters: {'activation': 'relu', 'solver': 'adam', 'lr': 2.590091575274359e-05, 'layer1': 456, 'layer2': 364, 'layer3': 283}. Best is trial 42 with value: 0.8645324176837453.

Pseudomonas_Aeruginosa | Imipenem | Optuna:  30%|███       | 61/200 [51:16<2:07:27, 55.02s/it, best=0.865][A
Pseudomonas_Aeruginosa | Imipenem | Optuna:  30%|███       | 61/200 [51:16<2:07:27, 55.02s/it, best=0.865][A[I 2026-02-27 19:24:16,580] Trial 61 finished with value: 0.8600195377907098 and parameters: {'activation': 'relu', 'solver': 'adam', 'lr': 0.0002373628310782417, 'layer1': 215, 'layer2': 305, 'layer3': 101}. Best is trial 42 with value: 0.8645324176837453.

Pseudomonas_Aeruginosa | Imipenem | Optuna:  31%|███       | 62/200 [52:10<2:06:22, 54.94s/it, best=0.865][A
Pseudomonas_Aeruginosa | Imipenem | Optuna:  31%|███       | 62/200 [52:10<2:06:22, 54.94s/it, best=0.865][A[I 2026-02-27 19:24:31,001] Trial 112 finished with value: 0.8072443130902694 and parameters: {'activation': 'tanh', 'solver': 'adam', 'lr': 6.573823998682554e-05, 'layer1': 127, 'layer2': 313, 'layer3': 29}. Best is trial 107 with value: 0.8083747566869277.

Escherichia_Coli | Ciprofloxacin | Optuna:  56%|█████▋    | 113/200 [4:37:00<3:06:28, 128.60s/it, best=0.808][A
Escherichia_Coli | Ciprofloxacin | Optuna:  56%|█████▋    | 113/200 [4:37:00<3:06:28, 128.60s/it, best=0.808][A[I 2026-02-27 19:24:34,600] Trial 126 finished with value: 0.9062126875264314 and parameters: {'activation': 'tanh', 'solver': 'adam', 'lr': 8.633683881631394e-05, 'layer1': 184, 'layer2': 411, 'layer3': 357}. Best is trial 84 with value: 0.9099428178723615.

Staphylococcus_Aureus | Oxacillin | Optuna:  64%|██████▎   | 127/200 [4:37:04<2:29:06, 122.56s/it, best=0.91][A
Staphylococcus_Aureus | Oxacillin | Optuna:  64%|██████▎   | 127/200 [4:37:04<2:29:06, 122.56s/it, best=0.91][A[I 2026-02-27 19:24:34,800] Trial 146 finished with value: 0.8264798816951091 and parameters: {'activation': 'identity', 'solver': 'adam', 'lr': 4.481187099806404e-05, 'layer1': 332, 'layer2': 464, 'layer3': 203}. Best is trial 91 with value: 0.8315336183309556.

Klebsiella_Pneumoniae | Ciprofloxacin | Optuna:  74%|███████▎  | 147/200 [4:37:04<1:53:19, 128.29s/it, best=0.832][A
Klebsiella_Pneumoniae | Ciprofloxacin | Optuna:  74%|███████▎  | 147/200 [4:37:04<1:53:19, 128.29s/it, best=0.832][A[I 2026-02-27 19:25:20,444] Trial 62 finished with value: 0.8606530304196489 and parameters: {'activation': 'relu', 'solver': 'adam', 'lr': 0.0009866071903445591, 'layer1': 391, 'layer2': 334, 'layer3': 102}. Best is trial 42 with value: 0.8645324176837453.

Pseudomonas_Aeruginosa | Imipenem | Optuna:  32%|███▏      | 63/200 [53:14<2:11:33, 57.62s/it, best=0.865][A
Pseudomonas_Aeruginosa | Imipenem | Optuna:  32%|███▏      | 63/200 [53:14<2:11:33, 57.62s/it, best=0.865][A[I 2026-02-27 19:25:54,146] Trial 113 finished with value: 0.8029952876954315 and parameters: {'activation': 'tanh', 'solver': 'adam', 'lr': 6.3211184154394e-05, 'layer1': 76, 'layer2': 310, 'layer3': 30}. Best is trial 107 with value: 0.8083747566869277.

Escherichia_Coli | Ciprofloxacin | Optuna:  57%|█████▋    | 114/200 [4:38:23<2:44:46, 114.96s/it, best=0.808][A
