Staphylococcus_Aureus | Fusidic acid | Optuna:  90%|█████████ | 181/200 [4:52:01<30:48, 97.28s/it, best=0.928][A[I 2026-02-28 07:33:06,039] Trial 104 finished with value: 0.9803889127013818 and parameters: {'activation': 'tanh', 'solver': 'adam', 'lr': 0.002238315334236669, 'layer1': 367, 'layer2': 264, 'layer3': 107}. Best is trial 93 with value: 0.98311227086221.

Klebsiella_Pneumoniae | Meropenem | Optuna:  52%|█████▎    | 105/200 [1:33:46<1:24:57, 53.66s/it, best=0.983][A
Klebsiella_Pneumoniae | Meropenem | Optuna:  52%|█████▎    | 105/200 [1:33:46<1:24:57, 53.66s/it, best=0.983][A[I 2026-02-28 07:33:46,930] Trial 105 finished with value: 0.9787027197002102 and parameters: {'activation': 'tanh', 'solver': 'adam', 'lr': 0.0016513201711585244, 'layer1': 444, 'layer2': 295, 'layer3': 131}. Best is trial 93 with value: 0.98311227086221.

Klebsiella_Pneumoniae | Meropenem | Optuna:  53%|█████▎    | 106/200 [1:34:27<1:18:04, 49.83s/it, best=0.983][A
Klebsiella_Pneumoniae | Meropenem | Optuna:  53%|█████▎    | 106/200 [1:34:27<1:18:04, 49.83s/it, best=0.983][A[I 2026-02-28 07:33:56,153] Trial 188 finished with value: 0.896130923382405 and parameters: {'activation': 'relu', 'solver': 'adam', 'lr': 6.079274946872523e-05, 'layer1': 431, 'layer2': 146, 'layer3': 10}. Best is trial 137 with value: 0.8979080367540411.

Escherichia_Coli | Ceftriaxone | Optuna:  94%|█████████▍| 189/200 [8:23:57<41:31, 226.49s/it, best=0.898][A
Escherichia_Coli | Ceftriaxone | Optuna:  94%|█████████▍| 189/200 [8:23:57<41:31, 226.49s/it, best=0.898][A[I 2026-02-28 07:34:31,011] Trial 23 finished with value: 0.862003560562461 and parameters: {'activation': 'identity', 'solver': 'adam', 'lr': 0.0029999158417329873, 'layer1': 380, 'layer2': 347, 'layer3': 354}. Best is trial 13 with value: 0.8652354934942956.
Pseudomonas_Aeruginosa | DirectMulti | Optuna:  12%|█▏        | 24/200 [38:17<5:05:23, 104.11s/it, best=0.865]Pseudomonas_Aeruginosa | DirectMulti | Optuna:  12%|█▏        | 24/200 [38:17<5:05:23, 104.11s/it, best=0.865]/export/usuarios01/egarroyo/MALDI_for_AMR_prediction/venv/lib/python3.13/site-packages/sklearn/model_selection/_split.py:813: UserWarning: The least populated class in y has only 4 members, which is less than n_splits=5.
  warnings.warn(
[I 2026-02-28 07:34:43,019] Trial 106 finished with value: 0.9801404835218008 and parameters: {'activation': 'tanh', 'solver': 'adam', 'lr': 0.0007398689991527093, 'layer1': 383, 'layer2': 274, 'layer3': 69}. Best is trial 93 with value: 0.98311227086221.

Klebsiella_Pneumoniae | Meropenem | Optuna:  54%|█████▎    | 107/200 [1:35:23<1:20:08, 51.71s/it, best=0.983][A
Klebsiella_Pneumoniae | Meropenem | Optuna:  54%|█████▎    | 107/200 [1:35:23<1:20:08, 51.71s/it, best=0.983][A[I 2026-02-28 07:34:43,605] Trial 181 finished with value: 0.9262356229467411 and parameters: {'activation': 'identity', 'solver': 'adam', 'lr': 0.0004904665307389206, 'layer1': 470, 'layer2': 121, 'layer3': 242}. Best is trial 77 with value: 0.9283869597728589.

Staphylococcus_Aureus | Fusidic acid | Optuna:  91%|█████████ | 182/200 [4:53:52<30:24, 101.36s/it, best=0.928][A
Staphylococcus_Aureus | Fusidic acid | Optuna:  91%|█████████ | 182/200 [4:53:52<30:24, 101.36s/it, best=0.928][A[I 2026-02-28 07:35:31,355] Trial 107 finished with value: 0.9803288551932159 and parameters: {'activation': 'tanh', 'solver': 'adam', 'lr': 0.0002239209755522936, 'layer1': 404, 'layer2': 350, 'layer3': 88}. Best is trial 93 with value: 0.98311227086221.

Klebsiella_Pneumoniae | Meropenem | Optuna:  54%|█████▍    | 108/200 [1:36:11<1:17:44, 50.70s/it, best=0.983][A
Klebsiella_Pneumoniae | Meropenem | Optuna:  54%|█████▍    | 108/200 [1:36:11<1:17:44, 50.70s/it, best=0.983][A[I 2026-02-28 07:35:58,095] Trial 189 finished with value: 0.8887806066033626 and parameters: {'activation': 'tanh', 'solver': 'adam', 'lr': 6.19468875927424e-05, 'layer1': 430, 'layer2': 159, 'layer3': 25}. Best is trial 137 with value: 0.8979080367540411.

Escherichia_Coli | Ceftriaxone | Optuna:  95%|█████████▌| 190/200 [8:25:59<32:31, 195.13s/it, best=0.898][A
Escherichia_Coli | Ceftriaxone | Optuna:  95%|█████████▌| 190/200 [8:25:59<32:31, 195.13s/it, best=0.898][A[I 2026-02-28 07:36:07,578] Trial 108 finished with value: 0.9767069569332589 and parameters: {'activation': 'logistic', 'solver': 'adam', 'lr': 0.0004864250102229026, 'layer1': 458, 'layer2': 255, 'layer3': 153}. Best is trial 93 with value: 0.98311227086221.

Klebsiella_Pneumoniae | Meropenem | Optuna:  55%|█████▍    | 109/200 [1:36:48<1:10:18, 46.35s/it, best=0.983][A
Klebsiella_Pneumoniae | Meropenem | Optuna:  55%|█████▍    | 109/200 [1:36:48<1:10:18, 46.35s/it, best=0.983][A[I 2026-02-28 07:36:34,963] Trial 182 finished with value: 0.9210804487886719 and parameters: {'activation': 'identity', 'solver': 'adam', 'lr': 0.0010585180316599753, 'layer1': 484, 'layer2': 123, 'layer3': 268}. Best is trial 77 with value: 0.9283869597728589.

Staphylococcus_Aureus | Fusidic acid | Optuna:  92%|█████████▏| 183/200 [4:55:44<29:34, 104.36s/it, best=0.928][A
Staphylococcus_Aureus | Fusidic acid | Optuna:  92%|█████████▏| 183/200 [4:55:44<29:34, 104.36s/it, best=0.928][A[I 2026-02-28 07:36:40,119] Trial 24 finished with value: 0.8647983301043503 and parameters: {'activation': 'identity', 'solver': 'adam', 'lr': 0.00019884976316549496, 'layer1': 466, 'layer2': 410, 'layer3': 451}. Best is trial 13 with value: 0.8652354934942956.
Pseudomonas_Aeruginosa | DirectMulti | Optuna:  12%|█▎        | 25/200 [40:26<5:25:32, 111.61s/it, best=0.865]Pseudomonas_Aeruginosa | DirectMulti | Optuna:  12%|█▎        | 25/200 [40:26<5:25:32, 111.61s/it, best=0.865]/export/usuarios01/egarroyo/MALDI_for_AMR_prediction/venv/lib/python3.13/site-packages/sklearn/model_selection/_split.py:813: UserWarning: The least populated class in y has only 4 members, which is less than n_splits=5.
  warnings.warn(
[I 2026-02-28 07:36:46,278] Trial 109 finished with value: 0.9788305894023797 and parameters: {'activation': 'identity', 'solver': 'adam', 'lr': 0.001305482118916124, 'layer1': 354, 'layer2': 302, 'layer3': 129}. Best is trial 93 with value: 0.98311227086221.

Klebsiella_Pneumoniae | Meropenem | Optuna:  55%|█████▌    | 110/200 [1:37:26<1:06:05, 44.06s/it, best=0.983][A
Klebsiella_Pneumoniae | Meropenem | Optuna:  55%|█████▌    | 110/200 [1:37:26<1:06:05, 44.06s/it, best=0.983][A[I 2026-02-28 07:37:57,481] Trial 183 finished with value: 0.9216040803720995 and parameters: {'activation': 'identity', 'solver': 'adam', 'lr': 0.0004203481567258022, 'layer1': 366, 'layer2': 149, 'layer3': 251}. Best is trial 77 with value: 0.9283869597728589.

Staphylococcus_Aureus | Fusidic acid | Optuna:  92%|█████████▏| 184/200 [4:57:06<26:04, 97.81s/it, best=0.928] [A
Staphylococcus_Aureus | Fusidic acid | Optuna:  92%|█████████▏| 184/200 [4:57:06<26:04, 97.81s/it, best=0.928][A[I 2026-02-28 07:38:21,162] Trial 25 finished with value: 0.8619602933367965 and parameters: {'activation': 'identity', 'solver': 'adam', 'lr': 6.177595229736645e-05, 'layer1': 307, 'layer2': 469, 'layer3': 255}. Best is trial 13 with value: 0.8652354934942956.
Pseudomonas_Aeruginosa | DirectMulti | Optuna:  13%|█▎        | 26/200 [42:07<5:14:28, 108.44s/it, best=0.865]Pseudomonas_Aeruginosa | DirectMulti | Optuna:  13%|█▎        | 26/200 [42:07<5:14:28, 108.44s/it, best=0.865]/export/usuarios01/egarroyo/MALDI_for_AMR_prediction/venv/lib/python3.13/site-packages/sklearn/model_selection/_split.py:813: UserWarning: The least populated class in y has only 4 members, which is less than n_splits=5.
  warnings.warn(
[I 2026-02-28 07:39:33,636] Trial 184 finished with value: 0.9215908014819121 and parameters: {'activation': 'identity', 'solver': 'adam', 'lr': 0.0007515154394218957, 'layer1': 459, 'layer2': 473, 'layer3': 253}. Best is trial 77 with value: 0.9283869597728589.

Staphylococcus_Aureus | Fusidic acid | Optuna:  92%|█████████▎| 185/200 [4:58:42<24:19, 97.31s/it, best=0.928][A
Staphylococcus_Aureus | Fusidic acid | Optuna:  92%|█████████▎| 185/200 [4:58:42<24:19, 97.31s/it, best=0.928][A[I 2026-02-28 07:39:38,121] Trial 110 finished with value: 0.9748499203347366 and parameters: {'activation': 'tanh', 'solver': 'adam', 'lr': 4.370690189062213e-06, 'layer1': 337, 'layer2': 322, 'layer3': 41}. Best is trial 93 with value: 0.98311227086221.

Klebsiella_Pneumoniae | Meropenem | Optuna:  56%|█████▌    | 111/200 [1:40:18<2:02:13, 82.39s/it, best=0.983][A
Klebsiella_Pneumoniae | Meropenem | Optuna:  56%|█████▌    | 111/200 [1:40:18<2:02:13, 82.39s/it, best=0.983][A[I 2026-02-28 07:39:38,324] Trial 26 finished with value: 0.82646139159966 and parameters: {'activation': 'identity', 'solver': 'sgd', 'lr': 0.0007699407166268449, 'layer1': 397, 'layer2': 327, 'layer3': 132}. Best is trial 13 with value: 0.8652354934942956.
Pseudomonas_Aeruginosa | DirectMulti | Optuna:  14%|█▎        | 27/200 [43:24<4:45:36, 99.06s/it, best=0.865] Pseudomonas_Aeruginosa | DirectMulti | Optuna:  14%|█▎        | 27/200 [43:24<4:45:36, 99.06s/it, best=0.865]/export/usuarios01/egarroyo/MALDI_for_AMR_prediction/venv/lib/python3.13/site-packages/sklearn/model_selection/_split.py:813: UserWarning: The least populated class in y has only 4 members, which is less than n_splits=5.
  warnings.warn(
[I 2026-02-28 07:40:24,175] Trial 190 finished with value: 0.894132437364226 and parameters: {'activation': 'relu', 'solver': 'adam', 'lr': 3.865192482453276e-05, 'layer1': 424, 'layer2': 173, 'layer3': 10}. Best is trial 137 with value: 0.8979080367540411.

Escherichia_Coli | Ceftriaxone | Optuna:  96%|█████████▌| 191/200 [8:30:25<32:27, 216.41s/it, best=0.898][A
Escherichia_Coli | Ceftriaxone | Optuna:  96%|█████████▌| 191/200 [8:30:25<32:27, 216.41s/it, best=0.898][A[I 2026-02-28 07:40:26,248] Trial 111 finished with value: 0.9803444344736466 and parameters: {'activation': 'tanh', 'solver': 'adam', 'lr': 0.0009593541241701517, 'layer1': 403, 'layer2': 288, 'layer3': 38}. Best is trial 93 with value: 0.98311227086221.

Klebsiella_Pneumoniae | Meropenem | Optuna:  56%|█████▌    | 112/200 [1:41:06<1:45:46, 72.11s/it, best=0.983][A
Klebsiella_Pneumoniae | Meropenem | Optuna:  56%|█████▌    | 112/200 [1:41:06<1:45:46, 72.11s/it, best=0.983][A[I 2026-02-28 07:40:43,109] Trial 185 finished with value: 0.9218281779739694 and parameters: {'activation': 'identity', 'solver': 'adam', 'lr': 0.0002151193784648725, 'layer1': 89, 'layer2': 290, 'layer3': 144}. Best is trial 77 with value: 0.9283869597728589.

Staphylococcus_Aureus | Fusidic acid | Optuna:  93%|█████████▎| 186/200 [4:59:52<20:45, 88.96s/it, best=0.928][A
Staphylococcus_Aureus | Fusidic acid | Optuna:  93%|█████████▎| 186/200 [4:59:52<20:45, 88.96s/it, best=0.928][A[I 2026-02-28 07:40:54,033] Trial 27 finished with value: 0.8492499032822932 and parameters: {'activation': 'logistic', 'solver': 'adam', 'lr': 0.002973366279783855, 'layer1': 477, 'layer2': 381, 'layer3': 200}. Best is trial 13 with value: 0.8652354934942956.
Pseudomonas_Aeruginosa | DirectMulti | Optuna:  14%|█▍        | 28/200 [44:40<4:23:52, 92.05s/it, best=0.865]Pseudomonas_Aeruginosa | DirectMulti | Optuna:  14%|█▍        | 28/200 [44:40<4:23:52, 92.05s/it, best=0.865]/export/usuarios01/egarroyo/MALDI_for_AMR_prediction/venv/lib/python3.13/site-packages/sklearn/model_selection/_split.py:813: UserWarning: The least populated class in y has only 4 members, which is less than n_splits=5.
  warnings.warn(
[I 2026-02-28 07:41:20,860] Trial 112 finished with value: 0.9804186488391105 and parameters: {'activation': 'tanh', 'solver': 'adam', 'lr': 0.0007135876775500661, 'layer1': 416, 'layer2': 315, 'layer3': 75}. Best is trial 93 with value: 0.98311227086221.

Klebsiella_Pneumoniae | Meropenem | Optuna:  56%|█████▋    | 113/200 [1:42:01<1:36:57, 66.86s/it, best=0.983][A
Klebsiella_Pneumoniae | Meropenem | Optuna:  56%|█████▋    | 113/200 [1:42:01<1:36:57, 66.86s/it, best=0.983][A[I 2026-02-28 07:42:13,339] Trial 113 finished with value: 0.9805078980393687 and parameters: {'activation': 'tanh', 'solver': 'adam', 'lr': 0.0005922912988536841, 'layer1': 389, 'layer2': 304, 'layer3': 98}. Best is trial 93 with value: 0.98311227086221.

Klebsiella_Pneumoniae | Meropenem | Optuna:  57%|█████▋    | 114/200 [1:42:53<1:29:39, 62.55s/it, best=0.983][A
Klebsiella_Pneumoniae | Meropenem | Optuna:  57%|█████▋    | 114/200 [1:42:53<1:29:39, 62.55s/it, best=0.983][A[I 2026-02-28 07:42:35,197] Trial 186 finished with value: 0.9274318037136535 and parameters: {'activation': 'identity', 'solver': 'adam', 'lr': 7.775398001952744e-05, 'layer1': 394, 'layer2': 135, 'layer3': 265}. Best is trial 77 with value: 0.9283869597728589.

Staphylococcus_Aureus | Fusidic acid | Optuna:  94%|█████████▎| 187/200 [5:01:44<20:46, 95.90s/it, best=0.928][A
Staphylococcus_Aureus | Fusidic acid | Optuna:  94%|█████████▎| 187/200 [5:01:44<20:46, 95.90s/it, best=0.928][A[I 2026-02-28 07:42:58,836] Trial 28 finished with value: 0.8609118841766676 and parameters: {'activation': 'tanh', 'solver': 'adam', 'lr': 3.7481972718826746e-05, 'layer1': 425, 'layer2': 414, 'layer3': 392}. Best is trial 13 with value: 0.8652354934942956.
Pseudomonas_Aeruginosa | DirectMulti | Optuna:  14%|█▍        | 29/200 [46:45<4:50:21, 101.88s/it, best=0.865]Pseudomonas_Aeruginosa | DirectMulti | Optuna:  14%|█▍        | 29/200 [46:45<4:50:21, 101.88s/it, best=0.865]/export/usuarios01/egarroyo/MALDI_for_AMR_prediction/venv/lib/python3.13/site-packages/sklearn/model_selection/_split.py:813: UserWarning: The least populated class in y has only 4 members, which is less than n_splits=5.
  warnings.warn(
[I 2026-02-28 07:43:01,005] Trial 114 finished with value: 0.9795834986935651 and parameters: {'activation': 'tanh', 'solver': 'adam', 'lr': 0.00030163183653744805, 'layer1': 439, 'layer2': 330, 'layer3': 61}. Best is trial 93 with value: 0.98311227086221.

Klebsiella_Pneumoniae | Meropenem | Optuna:  57%|█████▊    | 115/200 [1:43:41<1:22:17, 58.08s/it, best=0.983][A
Klebsiella_Pneumoniae | Meropenem | Optuna:  57%|█████▊    | 115/200 [1:43:41<1:22:17, 58.08s/it, best=0.983][A[I 2026-02-28 07:43:13,917] Trial 191 finished with value: 0.8944667991407407 and parameters: {'activation': 'relu', 'solver': 'adam', 'lr': 5.163480010859906e-05, 'layer1': 459, 'layer2': 143, 'layer3': 37}. Best is trial 137 with value: 0.8979080367540411.

Escherichia_Coli | Ceftriaxone | Optuna:  96%|█████████▌| 192/200 [8:33:15<26:59, 202.41s/it, best=0.898][A
Escherichia_Coli | Ceftriaxone | Optuna:  96%|█████████▌| 192/200 [8:33:15<26:59, 202.41s/it, best=0.898][A[I 2026-02-28 07:43:25,800] Trial 29 finished with value: 0.8255018342260501 and parameters: {'activation': 'logistic', 'solver': 'sgd', 'lr': 0.00019284271825565738, 'layer1': 313, 'layer2': 248, 'layer3': 323}. Best is trial 13 with value: 0.8652354934942956.
Pseudomonas_Aeruginosa | DirectMulti | Optuna:  15%|█▌        | 30/200 [47:12<3:44:58, 79.40s/it, best=0.865] Pseudomonas_Aeruginosa | DirectMulti | Optuna:  15%|█▌        | 30/200 [47:12<3:44:58, 79.40s/it, best=0.865]/export/usuarios01/egarroyo/MALDI_for_AMR_prediction/venv/lib/python3.13/site-packages/sklearn/model_selection/_split.py:813: UserWarning: The least populated class in y has only 4 members, which is less than n_splits=5.
  warnings.warn(
[I 2026-02-28 07:43:42,390] Trial 115 finished with value: 0.9787027197002102 and parameters: {'activation': 'tanh', 'solver': 'adam', 'lr': 0.004254156490096061, 'layer1': 370, 'layer2': 272, 'layer3': 108}. Best is trial 93 with value: 0.98311227086221.

Klebsiella_Pneumoniae | Meropenem | Optuna:  58%|█████▊    | 116/200 [1:44:22<1:14:18, 53.07s/it, best=0.983][A
Klebsiella_Pneumoniae | Meropenem | Optuna:  58%|█████▊    | 116/200 [1:44:22<1:14:18, 53.07s/it, best=0.983][A[I 2026-02-28 07:44:03,182] Trial 187 finished with value: 0.9249926989233197 and parameters: {'activation': 'identity', 'solver': 'adam', 'lr': 7.620962493879279e-05, 'layer1': 390, 'layer2': 435, 'layer3': 76}. Best is trial 77 with value: 0.9283869597728589.

Staphylococcus_Aureus | Fusidic acid | Optuna:  94%|█████████▍| 188/200 [5:03:12<18:42, 93.52s/it, best=0.928][A
Staphylococcus_Aureus | Fusidic acid | Optuna:  94%|█████████▍| 188/200 [5:03:12<18:42, 93.52s/it, best=0.928][A[I 2026-02-28 07:44:24,686] Trial 116 finished with value: 0.9793906133883112 and parameters: {'activation': 'tanh', 'solver': 'adam', 'lr': 0.0010658787570064887, 'layer1': 423, 'layer2': 240, 'layer3': 13}. Best is trial 93 with value: 0.98311227086221.

Klebsiella_Pneumoniae | Meropenem | Optuna:  58%|█████▊    | 117/200 [1:45:05<1:08:56, 49.84s/it, best=0.983][A
Klebsiella_Pneumoniae | Meropenem | Optuna:  58%|█████▊    | 117/200 [1:45:05<1:08:56, 49.84s/it, best=0.983][A[I 2026-02-28 07:45:11,609] Trial 30 finished with value: 0.8632678689431799 and parameters: {'activation': 'identity', 'solver': 'adam', 'lr': 0.0008923364226443438, 'layer1': 364, 'layer2': 465, 'layer3': 378}. Best is trial 13 with value: 0.8652354934942956.
Pseudomonas_Aeruginosa | DirectMulti | Optuna:  16%|█▌        | 31/200 [48:57<4:05:57, 87.32s/it, best=0.865]Pseudomonas_Aeruginosa | DirectMulti | Optuna:  16%|█▌        | 31/200 [48:57<4:05:57, 87.32s/it, best=0.865]/export/usuarios01/egarroyo/MALDI_for_AMR_prediction/venv/lib/python3.13/site-packages/sklearn/model_selection/_split.py:813: UserWarning: The least populated class in y has only 4 members, which is less than n_splits=5.
  warnings.warn(
[I 2026-02-28 07:45:33,489] Trial 117 finished with value: 0.9806808136967516 and parameters: {'activation': 'tanh', 'solver': 'adam', 'lr': 7.846453320676983e-05, 'layer1': 314, 'layer2': 94, 'layer3': 53}. Best is trial 93 with value: 0.98311227086221.

Klebsiella_Pneumoniae | Meropenem | Optuna:  59%|█████▉    | 118/200 [1:46:13<1:15:53, 55.53s/it, best=0.983][A
Klebsiella_Pneumoniae | Meropenem | Optuna:  59%|█████▉    | 118/200 [1:46:13<1:15:53, 55.53s/it, best=0.983][A[I 2026-02-28 07:45:48,204] Trial 192 finished with value: 0.8938347819330398 and parameters: {'activation': 'relu', 'solver': 'adam', 'lr': 7.296739197748298e-05, 'layer1': 485, 'layer2': 136, 'layer3': 52}. Best is trial 137 with value: 0.8979080367540411.

Escherichia_Coli | Ceftriaxone | Optuna:  96%|█████████▋| 193/200 [8:35:49<21:55, 187.97s/it, best=0.898][A
Escherichia_Coli | Ceftriaxone | Optuna:  96%|█████████▋| 193/200 [8:35:49<21:55, 187.97s/it, best=0.898][A[I 2026-02-28 07:45:58,174] Trial 118 finished with value: 0.9767069569332589 and parameters: {'activation': 'logistic', 'solver': 'sgd', 'lr': 0.0018385144859336198, 'layer1': 398, 'layer2': 340, 'layer3': 31}. Best is trial 93 with value: 0.98311227086221.

Klebsiella_Pneumoniae | Meropenem | Optuna:  60%|█████▉    | 119/200 [1:46:38<1:02:28, 46.28s/it, best=0.983][A
Klebsiella_Pneumoniae | Meropenem | Optuna:  60%|█████▉    | 119/200 [1:46:38<1:02:28, 46.28s/it, best=0.983][A[I 2026-02-28 07:46:04,628] Trial 188 finished with value: 0.9264389516903918 and parameters: {'activation': 'identity', 'solver': 'adam', 'lr': 4.48118466727925e-05, 'layer1': 417, 'layer2': 162, 'layer3': 107}. Best is trial 77 with value: 0.9283869597728589.

Staphylococcus_Aureus | Fusidic acid | Optuna:  94%|█████████▍| 189/200 [5:05:13<18:40, 101.90s/it, best=0.928][A
Staphylococcus_Aureus | Fusidic acid | Optuna:  94%|█████████▍| 189/200 [5:05:13<18:40, 101.90s/it, best=0.928][A[I 2026-02-28 07:46:54,933] Trial 119 finished with value: 0.983615836127451 and parameters: {'activation': 'tanh', 'solver': 'adam', 'lr': 0.0008628450896122342, 'layer1': 285, 'layer2': 258, 'layer3': 94}. Best is trial 119 with value: 0.983615836127451.

Klebsiella_Pneumoniae | Meropenem | Optuna:  60%|██████    | 120/200 [1:47:35<1:05:53, 49.42s/it, best=0.983][A
Klebsiella_Pneumoniae | Meropenem | Optuna:  60%|██████    | 120/200 [1:47:35<1:05:53, 49.42s/it, best=0.984][A[I 2026-02-28 07:47:22,780] Trial 31 finished with value: 0.866367214803268 and parameters: {'activation': 'identity', 'solver': 'adam', 'lr': 0.000212131873212928, 'layer1': 463, 'layer2': 419, 'layer3': 458}. Best is trial 31 with value: 0.866367214803268.
Pseudomonas_Aeruginosa | DirectMulti | Optuna:  16%|█▌        | 32/200 [51:09<4:41:20, 100.48s/it, best=0.865]Pseudomonas_Aeruginosa | DirectMulti | Optuna:  16%|█▌        | 32/200 [51:09<4:41:20, 100.48s/it, best=0.866]/export/usuarios01/egarroyo/MALDI_for_AMR_prediction/venv/lib/python3.13/site-packages/sklearn/model_selection/_split.py:813: UserWarning: The least populated class in y has only 4 members, which is less than n_splits=5.
  warnings.warn(
[I 2026-02-28 07:47:30,519] Trial 120 finished with value: 0.9796994947054969 and parameters: {'activation': 'identity', 'solver': 'adam', 'lr': 0.0005045374966189121, 'layer1': 284, 'layer2': 251, 'layer3': 118}. Best is trial 119 with value: 0.983615836127451.

Klebsiella_Pneumoniae | Meropenem | Optuna:  60%|██████    | 121/200 [1:48:11<59:36, 45.27s/it, best=0.984]  [A
Klebsiella_Pneumoniae | Meropenem | Optuna:  60%|██████    | 121/200 [1:48:11<59:36, 45.27s/it, best=0.984][A[I 2026-02-28 07:47:33,743] Trial 189 finished with value: 0.9055652502767841 and parameters: {'activation': 'identity', 'solver': 'sgd', 'lr': 9.94336568773075e-05, 'layer1': 136, 'layer2': 140, 'layer3': 169}. Best is trial 77 with value: 0.9283869597728589.

Staphylococcus_Aureus | Fusidic acid | Optuna:  95%|█████████▌| 190/200 [5:06:42<16:20, 98.07s/it, best=0.928] [A
