Escherichia_Coli | Ceftriaxone | Optuna:  84%|████████▎ | 167/200 [7:10:08<1:47:27, 195.39s/it, best=0.898][A[I 2026-02-28 06:20:21,238] Trial 174 finished with value: 0.8630834342666663 and parameters: {'activation': 'identity', 'solver': 'adam', 'lr': 0.0038183051261543193, 'layer1': 291, 'layer2': 302, 'layer3': 450}. Best is trial 140 with value: 0.8705750568176336.
Pseudomonas_Aeruginosa | LPS | Optuna:  88%|████████▊ | 175/200 [4:15:23<40:20, 96.81s/it, best=0.871]Pseudomonas_Aeruginosa | LPS | Optuna:  88%|████████▊ | 175/200 [4:15:23<40:20, 96.81s/it, best=0.871]/export/usuarios01/egarroyo/MALDI_for_AMR_prediction/venv/lib/python3.13/site-packages/sklearn/model_selection/_split.py:813: UserWarning: The least populated class in y has only 4 members, which is less than n_splits=5.
  warnings.warn(
[I 2026-02-28 06:20:25,945] Trial 22 finished with value: 0.9806493028897805 and parameters: {'activation': 'relu', 'solver': 'adam', 'lr': 0.00028534166548083373, 'layer1': 390, 'layer2': 139, 'layer3': 446}. Best is trial 15 with value: 0.9817428046183034.

Klebsiella_Pneumoniae | Meropenem | Optuna:  12%|█▏        | 23/200 [21:06<2:46:50, 56.56s/it, best=0.982][A
Klebsiella_Pneumoniae | Meropenem | Optuna:  12%|█▏        | 23/200 [21:06<2:46:50, 56.56s/it, best=0.982][A[I 2026-02-28 06:20:44,008] Trial 134 finished with value: 0.9233733365309824 and parameters: {'activation': 'identity', 'solver': 'adam', 'lr': 0.0001548090201326409, 'layer1': 375, 'layer2': 49, 'layer3': 120}. Best is trial 77 with value: 0.9283869597728589.

Staphylococcus_Aureus | Fusidic acid | Optuna:  68%|██████▊   | 135/200 [3:39:53<1:36:29, 89.06s/it, best=0.928][A
Staphylococcus_Aureus | Fusidic acid | Optuna:  68%|██████▊   | 135/200 [3:39:53<1:36:29, 89.06s/it, best=0.928][A[I 2026-02-28 06:21:14,999] Trial 23 finished with value: 0.9785281590139275 and parameters: {'activation': 'relu', 'solver': 'adam', 'lr': 5.6790922509547325e-05, 'layer1': 458, 'layer2': 196, 'layer3': 385}. Best is trial 15 with value: 0.9817428046183034.

Klebsiella_Pneumoniae | Meropenem | Optuna:  12%|█▏        | 24/200 [21:55<2:39:17, 54.31s/it, best=0.982][A
Klebsiella_Pneumoniae | Meropenem | Optuna:  12%|█▏        | 24/200 [21:55<2:39:17, 54.31s/it, best=0.982][A[I 2026-02-28 06:22:09,903] Trial 175 finished with value: 0.8650009734850362 and parameters: {'activation': 'identity', 'solver': 'adam', 'lr': 0.0016347947059196896, 'layer1': 394, 'layer2': 313, 'layer3': 458}. Best is trial 140 with value: 0.8705750568176336.
Pseudomonas_Aeruginosa | LPS | Optuna:  88%|████████▊ | 176/200 [4:17:11<40:08, 100.36s/it, best=0.871]Pseudomonas_Aeruginosa | LPS | Optuna:  88%|████████▊ | 176/200 [4:17:11<40:08, 100.36s/it, best=0.871]/export/usuarios01/egarroyo/MALDI_for_AMR_prediction/venv/lib/python3.13/site-packages/sklearn/model_selection/_split.py:813: UserWarning: The least populated class in y has only 4 members, which is less than n_splits=5.
  warnings.warn(
[I 2026-02-28 06:22:10,484] Trial 24 finished with value: 0.9802769858430018 and parameters: {'activation': 'relu', 'solver': 'adam', 'lr': 0.0004620432767395983, 'layer1': 320, 'layer2': 107, 'layer3': 493}. Best is trial 15 with value: 0.9817428046183034.

Klebsiella_Pneumoniae | Meropenem | Optuna:  12%|█▎        | 25/200 [22:50<2:39:25, 54.66s/it, best=0.982][A
Klebsiella_Pneumoniae | Meropenem | Optuna:  12%|█▎        | 25/200 [22:50<2:39:25, 54.66s/it, best=0.982][A[I 2026-02-28 06:22:36,107] Trial 135 finished with value: 0.9265416298232673 and parameters: {'activation': 'identity', 'solver': 'adam', 'lr': 0.00010130177588794844, 'layer1': 391, 'layer2': 80, 'layer3': 67}. Best is trial 77 with value: 0.9283869597728589.

Staphylococcus_Aureus | Fusidic acid | Optuna:  68%|██████▊   | 136/200 [3:41:45<1:42:22, 95.98s/it, best=0.928][A
Staphylococcus_Aureus | Fusidic acid | Optuna:  68%|██████▊   | 136/200 [3:41:45<1:42:22, 95.98s/it, best=0.928][A[I 2026-02-28 06:23:10,165] Trial 167 finished with value: 0.8942481328513849 and parameters: {'activation': 'relu', 'solver': 'adam', 'lr': 5.2592358594525575e-05, 'layer1': 485, 'layer2': 133, 'layer3': 78}. Best is trial 137 with value: 0.8979080367540411.

Escherichia_Coli | Ceftriaxone | Optuna:  84%|████████▍ | 168/200 [7:13:11<1:42:18, 191.83s/it, best=0.898][A
Escherichia_Coli | Ceftriaxone | Optuna:  84%|████████▍ | 168/200 [7:13:11<1:42:18, 191.83s/it, best=0.898][A[I 2026-02-28 06:23:10,479] Trial 25 finished with value: 0.9790405952053369 and parameters: {'activation': 'relu', 'solver': 'adam', 'lr': 0.00016725642328307318, 'layer1': 493, 'layer2': 56, 'layer3': 445}. Best is trial 15 with value: 0.9817428046183034.

Klebsiella_Pneumoniae | Meropenem | Optuna:  13%|█▎        | 26/200 [23:50<2:43:09, 56.26s/it, best=0.982][A
Klebsiella_Pneumoniae | Meropenem | Optuna:  13%|█▎        | 26/200 [23:50<2:43:09, 56.26s/it, best=0.982][A[I 2026-02-28 06:23:35,620] Trial 26 finished with value: 0.9767069569332589 and parameters: {'activation': 'relu', 'solver': 'sgd', 'lr': 0.003352353170014301, 'layer1': 402, 'layer2': 169, 'layer3': 285}. Best is trial 15 with value: 0.9817428046183034.

Klebsiella_Pneumoniae | Meropenem | Optuna:  14%|█▎        | 27/200 [24:16<2:15:17, 46.92s/it, best=0.982][A
Klebsiella_Pneumoniae | Meropenem | Optuna:  14%|█▎        | 27/200 [24:16<2:15:17, 46.92s/it, best=0.982][A[I 2026-02-28 06:23:47,914] Trial 176 finished with value: 0.8639274262413726 and parameters: {'activation': 'identity', 'solver': 'adam', 'lr': 0.0032326028781574376, 'layer1': 415, 'layer2': 251, 'layer3': 466}. Best is trial 140 with value: 0.8705750568176336.
Pseudomonas_Aeruginosa | LPS | Optuna:  88%|████████▊ | 177/200 [4:18:49<38:12, 99.66s/it, best=0.871] Pseudomonas_Aeruginosa | LPS | Optuna:  88%|████████▊ | 177/200 [4:18:49<38:12, 99.66s/it, best=0.871]/export/usuarios01/egarroyo/MALDI_for_AMR_prediction/venv/lib/python3.13/site-packages/sklearn/model_selection/_split.py:813: UserWarning: The least populated class in y has only 4 members, which is less than n_splits=5.
  warnings.warn(
[I 2026-02-28 06:24:21,787] Trial 136 finished with value: 0.9261307200550342 and parameters: {'activation': 'identity', 'solver': 'adam', 'lr': 7.723862398426734e-05, 'layer1': 397, 'layer2': 21, 'layer3': 84}. Best is trial 77 with value: 0.9283869597728589.

Staphylococcus_Aureus | Fusidic acid | Optuna:  68%|██████▊   | 137/200 [3:43:30<1:43:49, 98.89s/it, best=0.928][A
Staphylococcus_Aureus | Fusidic acid | Optuna:  68%|██████▊   | 137/200 [3:43:30<1:43:49, 98.89s/it, best=0.928][A[I 2026-02-28 06:24:57,469] Trial 27 finished with value: 0.9821048418402821 and parameters: {'activation': 'relu', 'solver': 'adam', 'lr': 0.0007345151795352618, 'layer1': 442, 'layer2': 234, 'layer3': 383}. Best is trial 27 with value: 0.9821048418402821.

Klebsiella_Pneumoniae | Meropenem | Optuna:  14%|█▍        | 28/200 [25:37<2:44:33, 57.40s/it, best=0.982][A
Klebsiella_Pneumoniae | Meropenem | Optuna:  14%|█▍        | 28/200 [25:37<2:44:33, 57.40s/it, best=0.982][A[I 2026-02-28 06:25:49,345] Trial 28 finished with value: 0.977819745266264 and parameters: {'activation': 'logistic', 'solver': 'adam', 'lr': 0.0005771992990250263, 'layer1': 449, 'layer2': 242, 'layer3': 383}. Best is trial 27 with value: 0.9821048418402821.

Klebsiella_Pneumoniae | Meropenem | Optuna:  14%|█▍        | 29/200 [26:29<2:38:52, 55.74s/it, best=0.982][A
Klebsiella_Pneumoniae | Meropenem | Optuna:  14%|█▍        | 29/200 [26:29<2:38:52, 55.74s/it, best=0.982][A[I 2026-02-28 06:25:51,997] Trial 177 finished with value: 0.8674011388775515 and parameters: {'activation': 'identity', 'solver': 'adam', 'lr': 0.001957677747664176, 'layer1': 384, 'layer2': 296, 'layer3': 438}. Best is trial 140 with value: 0.8705750568176336.
Pseudomonas_Aeruginosa | LPS | Optuna:  89%|████████▉ | 178/200 [4:20:54<39:13, 106.99s/it, best=0.871]Pseudomonas_Aeruginosa | LPS | Optuna:  89%|████████▉ | 178/200 [4:20:54<39:13, 106.99s/it, best=0.871]/export/usuarios01/egarroyo/MALDI_for_AMR_prediction/venv/lib/python3.13/site-packages/sklearn/model_selection/_split.py:813: UserWarning: The least populated class in y has only 4 members, which is less than n_splits=5.
  warnings.warn(
[I 2026-02-28 06:26:02,088] Trial 137 finished with value: 0.925815389158344 and parameters: {'activation': 'identity', 'solver': 'adam', 'lr': 0.00020004358306354654, 'layer1': 366, 'layer2': 99, 'layer3': 128}. Best is trial 77 with value: 0.9283869597728589.

Staphylococcus_Aureus | Fusidic acid | Optuna:  69%|██████▉   | 138/200 [3:45:11<1:42:37, 99.31s/it, best=0.928][A
Staphylococcus_Aureus | Fusidic acid | Optuna:  69%|██████▉   | 138/200 [3:45:11<1:42:37, 99.31s/it, best=0.928][A[I 2026-02-28 06:26:22,369] Trial 29 finished with value: 0.9767069569332589 and parameters: {'activation': 'tanh', 'solver': 'sgd', 'lr': 0.0028222059774847957, 'layer1': 406, 'layer2': 259, 'layer3': 335}. Best is trial 27 with value: 0.9821048418402821.

Klebsiella_Pneumoniae | Meropenem | Optuna:  15%|█▌        | 30/200 [27:02<2:18:37, 48.93s/it, best=0.982][A
Klebsiella_Pneumoniae | Meropenem | Optuna:  15%|█▌        | 30/200 [27:02<2:18:37, 48.93s/it, best=0.982][A[I 2026-02-28 06:26:48,105] Trial 168 finished with value: 0.8945832454945191 and parameters: {'activation': 'relu', 'solver': 'adam', 'lr': 2.8391834341123036e-05, 'layer1': 455, 'layer2': 336, 'layer3': 101}. Best is trial 137 with value: 0.8979080367540411.

Escherichia_Coli | Ceftriaxone | Optuna:  84%|████████▍ | 169/200 [7:16:49<1:43:09, 199.66s/it, best=0.898][A
Escherichia_Coli | Ceftriaxone | Optuna:  84%|████████▍ | 169/200 [7:16:49<1:43:09, 199.66s/it, best=0.898][A[I 2026-02-28 06:26:57,539] Trial 30 finished with value: 0.9767069569332589 and parameters: {'activation': 'logistic', 'solver': 'adam', 'lr': 7.81594801864428e-05, 'layer1': 449, 'layer2': 192, 'layer3': 383}. Best is trial 27 with value: 0.9821048418402821.

Klebsiella_Pneumoniae | Meropenem | Optuna:  16%|█▌        | 31/200 [27:38<2:06:11, 44.80s/it, best=0.982][A
Klebsiella_Pneumoniae | Meropenem | Optuna:  16%|█▌        | 31/200 [27:38<2:06:11, 44.80s/it, best=0.982][A[I 2026-02-28 06:26:57,937] Trial 178 finished with value: 0.8664964910011891 and parameters: {'activation': 'identity', 'solver': 'adam', 'lr': 0.002001915068125954, 'layer1': 10, 'layer2': 264, 'layer3': 439}. Best is trial 140 with value: 0.8705750568176336.
Pseudomonas_Aeruginosa | LPS | Optuna:  90%|████████▉ | 179/200 [4:21:59<33:08, 94.67s/it, best=0.871] Pseudomonas_Aeruginosa | LPS | Optuna:  90%|████████▉ | 179/200 [4:21:59<33:08, 94.67s/it, best=0.871]/export/usuarios01/egarroyo/MALDI_for_AMR_prediction/venv/lib/python3.13/site-packages/sklearn/model_selection/_split.py:813: UserWarning: The least populated class in y has only 4 members, which is less than n_splits=5.
  warnings.warn(
[I 2026-02-28 06:27:35,510] Trial 138 finished with value: 0.9048087554895548 and parameters: {'activation': 'identity', 'solver': 'sgd', 'lr': 0.00012294202488288806, 'layer1': 336, 'layer2': 456, 'layer3': 190}. Best is trial 77 with value: 0.9283869597728589.

Staphylococcus_Aureus | Fusidic acid | Optuna:  70%|██████▉   | 139/200 [3:46:44<1:39:10, 97.54s/it, best=0.928][A
Staphylococcus_Aureus | Fusidic acid | Optuna:  70%|██████▉   | 139/200 [3:46:44<1:39:10, 97.54s/it, best=0.928][A[I 2026-02-28 06:27:47,950] Trial 31 finished with value: 0.9790971754622527 and parameters: {'activation': 'relu', 'solver': 'adam', 'lr': 0.00020266363886841537, 'layer1': 496, 'layer2': 115, 'layer3': 450}. Best is trial 27 with value: 0.9821048418402821.

Klebsiella_Pneumoniae | Meropenem | Optuna:  16%|█▌        | 32/200 [28:28<2:10:09, 46.48s/it, best=0.982][A
Klebsiella_Pneumoniae | Meropenem | Optuna:  16%|█▌        | 32/200 [28:28<2:10:09, 46.48s/it, best=0.982][A[I 2026-02-28 06:28:03,609] Trial 179 finished with value: 0.8619886666612333 and parameters: {'activation': 'identity', 'solver': 'adam', 'lr': 0.001247448753887883, 'layer1': 20, 'layer2': 263, 'layer3': 436}. Best is trial 140 with value: 0.8705750568176336.
Pseudomonas_Aeruginosa | LPS | Optuna:  90%|█████████ | 180/200 [4:23:05<28:39, 85.97s/it, best=0.871]Pseudomonas_Aeruginosa | LPS | Optuna:  90%|█████████ | 180/200 [4:23:05<28:39, 85.97s/it, best=0.871]/export/usuarios01/egarroyo/MALDI_for_AMR_prediction/venv/lib/python3.13/site-packages/sklearn/model_selection/_split.py:813: UserWarning: The least populated class in y has only 4 members, which is less than n_splits=5.
  warnings.warn(
[I 2026-02-28 06:28:12,940] Trial 139 finished with value: 0.9050666137971211 and parameters: {'activation': 'logistic', 'solver': 'adam', 'lr': 0.0002590241891684395, 'layer1': 385, 'layer2': 42, 'layer3': 141}. Best is trial 77 with value: 0.9283869597728589.

Staphylococcus_Aureus | Fusidic acid | Optuna:  70%|███████   | 140/200 [3:47:22<1:19:30, 79.51s/it, best=0.928][A
Staphylococcus_Aureus | Fusidic acid | Optuna:  70%|███████   | 140/200 [3:47:22<1:19:30, 79.51s/it, best=0.928][A[I 2026-02-28 06:28:19,823] Trial 32 finished with value: 0.9767069569332589 and parameters: {'activation': 'relu', 'solver': 'adam', 'lr': 3.2071325667185065e-05, 'layer1': 434, 'layer2': 63, 'layer3': 426}. Best is trial 27 with value: 0.9821048418402821.

Klebsiella_Pneumoniae | Meropenem | Optuna:  16%|█▋        | 33/200 [29:00<1:57:10, 42.10s/it, best=0.982][A
Klebsiella_Pneumoniae | Meropenem | Optuna:  16%|█▋        | 33/200 [29:00<1:57:10, 42.10s/it, best=0.982][A[I 2026-02-28 06:29:14,249] Trial 180 finished with value: 0.8644731171135265 and parameters: {'activation': 'identity', 'solver': 'adam', 'lr': 0.0019860640533484785, 'layer1': 38, 'layer2': 236, 'layer3': 425}. Best is trial 140 with value: 0.8705750568176336.
Pseudomonas_Aeruginosa | LPS | Optuna:  90%|█████████ | 181/200 [4:24:16<25:46, 81.37s/it, best=0.871]Pseudomonas_Aeruginosa | LPS | Optuna:  90%|█████████ | 181/200 [4:24:16<25:46, 81.37s/it, best=0.871]/export/usuarios01/egarroyo/MALDI_for_AMR_prediction/venv/lib/python3.13/site-packages/sklearn/model_selection/_split.py:813: UserWarning: The least populated class in y has only 4 members, which is less than n_splits=5.
  warnings.warn(
[I 2026-02-28 06:29:25,399] Trial 33 finished with value: 0.981382068109086 and parameters: {'activation': 'relu', 'solver': 'adam', 'lr': 0.000619653958111158, 'layer1': 473, 'layer2': 219, 'layer3': 498}. Best is trial 27 with value: 0.9821048418402821.

Klebsiella_Pneumoniae | Meropenem | Optuna:  17%|█▋        | 34/200 [30:05<2:15:57, 49.14s/it, best=0.982][A
Klebsiella_Pneumoniae | Meropenem | Optuna:  17%|█▋        | 34/200 [30:05<2:15:57, 49.14s/it, best=0.982][A[I 2026-02-28 06:29:30,469] Trial 169 finished with value: 0.8958706825818062 and parameters: {'activation': 'relu', 'solver': 'adam', 'lr': 8.548036032870329e-05, 'layer1': 469, 'layer2': 32, 'layer3': 47}. Best is trial 137 with value: 0.8979080367540411.

Escherichia_Coli | Ceftriaxone | Optuna:  85%|████████▌ | 170/200 [7:19:31<1:34:14, 188.47s/it, best=0.898][A
Escherichia_Coli | Ceftriaxone | Optuna:  85%|████████▌ | 170/200 [7:19:31<1:34:14, 188.47s/it, best=0.898][A[I 2026-02-28 06:29:37,321] Trial 140 finished with value: 0.9214027840738899 and parameters: {'activation': 'identity', 'solver': 'adam', 'lr': 5.837773220615591e-05, 'layer1': 413, 'layer2': 126, 'layer3': 473}. Best is trial 77 with value: 0.9283869597728589.

Staphylococcus_Aureus | Fusidic acid | Optuna:  70%|███████   | 141/200 [3:48:46<1:19:37, 80.97s/it, best=0.928][A
Staphylococcus_Aureus | Fusidic acid | Optuna:  70%|███████   | 141/200 [3:48:46<1:19:37, 80.97s/it, best=0.928][A[I 2026-02-28 06:30:17,199] Trial 181 finished with value: 0.8656837535256585 and parameters: {'activation': 'identity', 'solver': 'adam', 'lr': 0.001714209093646916, 'layer1': 13, 'layer2': 287, 'layer3': 448}. Best is trial 140 with value: 0.8705750568176336.
Pseudomonas_Aeruginosa | LPS | Optuna:  91%|█████████ | 182/200 [4:25:19<22:45, 75.85s/it, best=0.871]Pseudomonas_Aeruginosa | LPS | Optuna:  91%|█████████ | 182/200 [4:25:19<22:45, 75.85s/it, best=0.871]/export/usuarios01/egarroyo/MALDI_for_AMR_prediction/venv/lib/python3.13/site-packages/sklearn/model_selection/_split.py:813: UserWarning: The least populated class in y has only 4 members, which is less than n_splits=5.
  warnings.warn(
[I 2026-02-28 06:30:28,798] Trial 34 finished with value: 0.9799216025376347 and parameters: {'activation': 'relu', 'solver': 'adam', 'lr': 0.0007735296961565813, 'layer1': 466, 'layer2': 325, 'layer3': 496}. Best is trial 27 with value: 0.9821048418402821.

Klebsiella_Pneumoniae | Meropenem | Optuna:  18%|█▊        | 35/200 [31:09<2:26:54, 53.42s/it, best=0.982][A
Klebsiella_Pneumoniae | Meropenem | Optuna:  18%|█▊        | 35/200 [31:09<2:26:54, 53.42s/it, best=0.982][A[I 2026-02-28 06:31:15,252] Trial 141 finished with value: 0.9272414056374298 and parameters: {'activation': 'identity', 'solver': 'adam', 'lr': 0.0006168857215994889, 'layer1': 478, 'layer2': 90, 'layer3': 111}. Best is trial 77 with value: 0.9283869597728589.

Staphylococcus_Aureus | Fusidic acid | Optuna:  71%|███████   | 142/200 [3:50:24<1:23:11, 86.06s/it, best=0.928][A
Staphylococcus_Aureus | Fusidic acid | Optuna:  71%|███████   | 142/200 [3:50:24<1:23:11, 86.06s/it, best=0.928][A[I 2026-02-28 06:31:26,931] Trial 35 finished with value: 0.9803493610945964 and parameters: {'activation': 'relu', 'solver': 'adam', 'lr': 9.541704586952152e-05, 'layer1': 361, 'layer2': 236, 'layer3': 466}. Best is trial 27 with value: 0.9821048418402821.

Klebsiella_Pneumoniae | Meropenem | Optuna:  18%|█▊        | 36/200 [32:07<2:29:52, 54.83s/it, best=0.982][A
Klebsiella_Pneumoniae | Meropenem | Optuna:  18%|█▊        | 36/200 [32:07<2:29:52, 54.83s/it, best=0.982][A[I 2026-02-28 06:32:02,157] Trial 182 finished with value: 0.8483639861899654 and parameters: {'activation': 'identity', 'solver': 'adam', 'lr': 3.546108595717714e-05, 'layer1': 367, 'layer2': 311, 'layer3': 439}. Best is trial 140 with value: 0.8705750568176336.
Pseudomonas_Aeruginosa | LPS | Optuna:  92%|█████████▏| 183/200 [4:27:04<23:57, 84.58s/it, best=0.871]Pseudomonas_Aeruginosa | LPS | Optuna:  92%|█████████▏| 183/200 [4:27:04<23:57, 84.58s/it, best=0.871]/export/usuarios01/egarroyo/MALDI_for_AMR_prediction/venv/lib/python3.13/site-packages/sklearn/model_selection/_split.py:813: UserWarning: The least populated class in y has only 4 members, which is less than n_splits=5.
  warnings.warn(
[I 2026-02-28 06:32:32,573] Trial 36 finished with value: 0.9813396851711496 and parameters: {'activation': 'relu', 'solver': 'adam', 'lr': 0.000708101789053731, 'layer1': 303, 'layer2': 292, 'layer3': 208}. Best is trial 27 with value: 0.9821048418402821.

Klebsiella_Pneumoniae | Meropenem | Optuna:  18%|█▊        | 37/200 [33:13<2:37:46, 58.08s/it, best=0.982][A
Klebsiella_Pneumoniae | Meropenem | Optuna:  18%|█▊        | 37/200 [33:13<2:37:46, 58.08s/it, best=0.982][A[I 2026-02-28 06:32:50,251] Trial 142 finished with value: 0.9218702901843931 and parameters: {'activation': 'identity', 'solver': 'adam', 'lr': 0.0011174899074207296, 'layer1': 487, 'layer2': 119, 'layer3': 233}. Best is trial 77 with value: 0.9283869597728589.

Staphylococcus_Aureus | Fusidic acid | Optuna:  72%|███████▏  | 143/200 [3:51:59<1:24:18, 88.74s/it, best=0.928][A
Staphylococcus_Aureus | Fusidic acid | Optuna:  72%|███████▏  | 143/200 [3:51:59<1:24:18, 88.74s/it, best=0.928][A[I 2026-02-28 06:33:20,169] Trial 37 finished with value: 0.9795249340192143 and parameters: {'activation': 'logistic', 'solver': 'adam', 'lr': 0.0007739675755457269, 'layer1': 302, 'layer2': 295, 'layer3': 188}. Best is trial 27 with value: 0.9821048418402821.

Klebsiella_Pneumoniae | Meropenem | Optuna:  19%|█▉        | 38/200 [34:00<2:28:19, 54.93s/it, best=0.982][A
Klebsiella_Pneumoniae | Meropenem | Optuna:  19%|█▉        | 38/200 [34:00<2:28:19, 54.93s/it, best=0.982][A[I 2026-02-28 06:33:51,417] Trial 183 finished with value: 0.8664982397544456 and parameters: {'activation': 'identity', 'solver': 'adam', 'lr': 0.0014398618897722615, 'layer1': 344, 'layer2': 295, 'layer3': 415}. Best is trial 140 with value: 0.8705750568176336.
Pseudomonas_Aeruginosa | LPS | Optuna:  92%|█████████▏| 184/200 [4:28:53<24:31, 91.98s/it, best=0.871]Pseudomonas_Aeruginosa | LPS | Optuna:  92%|█████████▏| 184/200 [4:28:53<24:31, 91.98s/it, best=0.871]/export/usuarios01/egarroyo/MALDI_for_AMR_prediction/venv/lib/python3.13/site-packages/sklearn/model_selection/_split.py:813: UserWarning: The least populated class in y has only 4 members, which is less than n_splits=5.
  warnings.warn(
[I 2026-02-28 06:33:54,342] Trial 170 finished with value: 0.8954329026372779 and parameters: {'activation': 'relu', 'solver': 'adam', 'lr': 3.8052384295440794e-05, 'layer1': 449, 'layer2': 15, 'layer3': 42}. Best is trial 137 with value: 0.8979080367540411.

Escherichia_Coli | Ceftriaxone | Optuna:  86%|████████▌ | 171/200 [7:23:55<1:42:01, 211.09s/it, best=0.898][A
Escherichia_Coli | Ceftriaxone | Optuna:  86%|████████▌ | 171/200 [7:23:55<1:42:01, 211.09s/it, best=0.898][A[I 2026-02-28 06:34:13,412] Trial 143 finished with value: 0.9222481793596499 and parameters: {'activation': 'identity', 'solver': 'adam', 'lr': 0.00037241090292135226, 'layer1': 492, 'layer2': 107, 'layer3': 272}. Best is trial 77 with value: 0.9283869597728589.

Staphylococcus_Aureus | Fusidic acid | Optuna:  72%|███████▏  | 144/200 [3:53:22<1:21:15, 87.07s/it, best=0.928][A
