Pseudomonas_Aeruginosa | Imipenem | Optuna:  74%|███████▎  | 147/200 [2:26:11<55:20, 62.65s/it, best=0.867][A[I 2026-02-27 20:58:55,377] Trial 170 finished with value: 0.9060384583649643 and parameters: {'activation': 'identity', 'solver': 'adam', 'lr': 6.299694871682052e-05, 'layer1': 363, 'layer2': 448, 'layer3': 463}. Best is trial 152 with value: 0.9102139153966748.

Staphylococcus_Aureus | Oxacillin | Optuna:  86%|████████▌ | 171/200 [6:11:25<1:03:44, 131.86s/it, best=0.91][A
Staphylococcus_Aureus | Oxacillin | Optuna:  86%|████████▌ | 171/200 [6:11:25<1:03:44, 131.86s/it, best=0.91][A[I 2026-02-27 20:59:32,429] Trial 149 finished with value: 0.6732868667862638 and parameters: {'activation': 'tanh', 'solver': 'adam', 'lr': 0.009875553761052553, 'layer1': 163, 'layer2': 241, 'layer3': 69}. Best is trial 124 with value: 0.8095465376114227.

Escherichia_Coli | Ciprofloxacin | Optuna:  75%|███████▌  | 150/200 [6:12:01<1:30:50, 109.00s/it, best=0.809][A
Escherichia_Coli | Ciprofloxacin | Optuna:  75%|███████▌  | 150/200 [6:12:01<1:30:50, 109.00s/it, best=0.809][A[I 2026-02-27 20:59:46,245] Trial 147 finished with value: 0.8627966614437572 and parameters: {'activation': 'relu', 'solver': 'adam', 'lr': 0.00023788290680868491, 'layer1': 487, 'layer2': 351, 'layer3': 31}. Best is trial 126 with value: 0.8664911301660769.

Pseudomonas_Aeruginosa | Imipenem | Optuna:  74%|███████▍  | 148/200 [2:27:40<1:01:13, 70.65s/it, best=0.867][A
Pseudomonas_Aeruginosa | Imipenem | Optuna:  74%|███████▍  | 148/200 [2:27:40<1:01:13, 70.65s/it, best=0.867][A[I 2026-02-27 21:00:28,428] Trial 148 finished with value: 0.8586455057211536 and parameters: {'activation': 'relu', 'solver': 'adam', 'lr': 0.00048345380607186806, 'layer1': 14, 'layer2': 324, 'layer3': 69}. Best is trial 126 with value: 0.8664911301660769.

Pseudomonas_Aeruginosa | Imipenem | Optuna:  74%|███████▍  | 149/200 [2:28:22<52:47, 62.11s/it, best=0.867]  [A
Pseudomonas_Aeruginosa | Imipenem | Optuna:  74%|███████▍  | 149/200 [2:28:22<52:47, 62.11s/it, best=0.867][A[I 2026-02-27 21:01:18,286] Trial 171 finished with value: 0.9100547345658837 and parameters: {'activation': 'identity', 'solver': 'adam', 'lr': 0.00022709103436004065, 'layer1': 343, 'layer2': 433, 'layer3': 338}. Best is trial 152 with value: 0.9102139153966748.

Staphylococcus_Aureus | Oxacillin | Optuna:  86%|████████▌ | 172/200 [6:13:47<1:03:04, 135.18s/it, best=0.91][A
Staphylococcus_Aureus | Oxacillin | Optuna:  86%|████████▌ | 172/200 [6:13:47<1:03:04, 135.18s/it, best=0.91][A[I 2026-02-27 21:01:41,385] Trial 149 finished with value: 0.848159900421441 and parameters: {'activation': 'identity', 'solver': 'adam', 'lr': 0.009875553761052553, 'layer1': 453, 'layer2': 307, 'layer3': 85}. Best is trial 126 with value: 0.8664911301660769.

Pseudomonas_Aeruginosa | Imipenem | Optuna:  75%|███████▌  | 150/200 [2:29:35<54:28, 65.37s/it, best=0.867][A
Pseudomonas_Aeruginosa | Imipenem | Optuna:  75%|███████▌  | 150/200 [2:29:35<54:28, 65.37s/it, best=0.867][A[I 2026-02-27 21:01:58,617] Trial 6 finished with value: 0.881197904875302 and parameters: {'activation': 'tanh', 'solver': 'adam', 'lr': 3.6618192203924288e-06, 'layer1': 403, 'layer2': 46, 'layer3': 494}. Best is trial 6 with value: 0.881197904875302.

Klebsiella_Pneumoniae | Ceftriaxone | Optuna:   4%|▎         | 7/200 [11:20<7:47:48, 145.43s/it, best=0.871][A
Klebsiella_Pneumoniae | Ceftriaxone | Optuna:   4%|▎         | 7/200 [11:20<7:47:48, 145.43s/it, best=0.881][A[I 2026-02-27 21:02:36,496] Trial 150 finished with value: 0.8595264973551908 and parameters: {'activation': 'relu', 'solver': 'adam', 'lr': 0.0004172216274223239, 'layer1': 196, 'layer2': 342, 'layer3': 42}. Best is trial 126 with value: 0.8664911301660769.

Pseudomonas_Aeruginosa | Imipenem | Optuna:  76%|███████▌  | 151/200 [2:30:30<50:52, 62.29s/it, best=0.867][A
Pseudomonas_Aeruginosa | Imipenem | Optuna:  76%|███████▌  | 151/200 [2:30:30<50:52, 62.29s/it, best=0.867][A[I 2026-02-27 21:02:55,584] Trial 150 finished with value: 0.7982094446134713 and parameters: {'activation': 'tanh', 'solver': 'adam', 'lr': 1.4883543372201158e-05, 'layer1': 409, 'layer2': 212, 'layer3': 88}. Best is trial 124 with value: 0.8095465376114227.

Escherichia_Coli | Ciprofloxacin | Optuna:  76%|███████▌  | 151/200 [6:15:24<1:52:05, 137.25s/it, best=0.809][A
Escherichia_Coli | Ciprofloxacin | Optuna:  76%|███████▌  | 151/200 [6:15:24<1:52:05, 137.25s/it, best=0.809][A[I 2026-02-27 21:03:02,529] Trial 7 finished with value: 0.8976172299182996 and parameters: {'activation': 'relu', 'solver': 'adam', 'lr': 0.0012164139351417069, 'layer1': 46, 'layer2': 186, 'layer3': 66}. Best is trial 7 with value: 0.8976172299182996.

Klebsiella_Pneumoniae | Ceftriaxone | Optuna:   4%|▍         | 8/200 [12:24<6:22:19, 119.48s/it, best=0.881][A
Klebsiella_Pneumoniae | Ceftriaxone | Optuna:   4%|▍         | 8/200 [12:24<6:22:19, 119.48s/it, best=0.898][A[I 2026-02-27 21:03:30,716] Trial 172 finished with value: 0.9074768540788846 and parameters: {'activation': 'identity', 'solver': 'adam', 'lr': 0.0004284307668615955, 'layer1': 352, 'layer2': 232, 'layer3': 391}. Best is trial 152 with value: 0.9102139153966748.

Staphylococcus_Aureus | Oxacillin | Optuna:  86%|████████▋ | 173/200 [6:16:00<1:00:27, 134.35s/it, best=0.91][A
Staphylococcus_Aureus | Oxacillin | Optuna:  86%|████████▋ | 173/200 [6:16:00<1:00:27, 134.35s/it, best=0.91][A[I 2026-02-27 21:04:00,513] Trial 151 finished with value: 0.8594396082626415 and parameters: {'activation': 'relu', 'solver': 'adam', 'lr': 0.0006275047758095916, 'layer1': 456, 'layer2': 345, 'layer3': 57}. Best is trial 126 with value: 0.8664911301660769.

Pseudomonas_Aeruginosa | Imipenem | Optuna:  76%|███████▌  | 152/200 [2:31:54<55:02, 68.81s/it, best=0.867][A
Pseudomonas_Aeruginosa | Imipenem | Optuna:  76%|███████▌  | 152/200 [2:31:54<55:02, 68.81s/it, best=0.867][A[I 2026-02-27 21:04:37,694] Trial 8 finished with value: 0.9030715990312389 and parameters: {'activation': 'identity', 'solver': 'adam', 'lr': 0.000828752236376816, 'layer1': 323, 'layer2': 445, 'layer3': 241}. Best is trial 8 with value: 0.9030715990312389.

Klebsiella_Pneumoniae | Ceftriaxone | Optuna:   4%|▍         | 9/200 [13:59<5:56:08, 111.88s/it, best=0.898][A
Klebsiella_Pneumoniae | Ceftriaxone | Optuna:   4%|▍         | 9/200 [13:59<5:56:08, 111.88s/it, best=0.903][A[I 2026-02-27 21:04:50,272] Trial 151 finished with value: 0.8065835421229208 and parameters: {'activation': 'tanh', 'solver': 'adam', 'lr': 5.8707839699046067e-05, 'layer1': 161, 'layer2': 252, 'layer3': 62}. Best is trial 124 with value: 0.8095465376114227.

Escherichia_Coli | Ciprofloxacin | Optuna:  76%|███████▌  | 152/200 [6:17:19<1:44:23, 130.48s/it, best=0.809][A
Escherichia_Coli | Ciprofloxacin | Optuna:  76%|███████▌  | 152/200 [6:17:19<1:44:23, 130.48s/it, best=0.809][A[I 2026-02-27 21:05:14,838] Trial 9 finished with value: 0.7871313506632308 and parameters: {'activation': 'tanh', 'solver': 'sgd', 'lr': 0.00012329098365270507, 'layer1': 219, 'layer2': 22, 'layer3': 62}. Best is trial 8 with value: 0.9030715990312389.

Klebsiella_Pneumoniae | Ceftriaxone | Optuna:   5%|▌         | 10/200 [14:36<4:41:13, 88.81s/it, best=0.903][A
Klebsiella_Pneumoniae | Ceftriaxone | Optuna:   5%|▌         | 10/200 [14:36<4:41:13, 88.81s/it, best=0.903][A[I 2026-02-27 21:05:21,846] Trial 152 finished with value: 0.860682765790763 and parameters: {'activation': 'relu', 'solver': 'adam', 'lr': 0.0007854455384604484, 'layer1': 469, 'layer2': 318, 'layer3': 62}. Best is trial 126 with value: 0.8664911301660769.

Pseudomonas_Aeruginosa | Imipenem | Optuna:  76%|███████▋  | 153/200 [2:33:16<56:50, 72.56s/it, best=0.867][A
Pseudomonas_Aeruginosa | Imipenem | Optuna:  76%|███████▋  | 153/200 [2:33:16<56:50, 72.56s/it, best=0.867][A[I 2026-02-27 21:05:22,961] Trial 173 finished with value: 0.9076337452227998 and parameters: {'activation': 'identity', 'solver': 'adam', 'lr': 0.00019961769126518013, 'layer1': 314, 'layer2': 432, 'layer3': 219}. Best is trial 152 with value: 0.9102139153966748.

Staphylococcus_Aureus | Oxacillin | Optuna:  87%|████████▋ | 174/200 [6:17:52<55:20, 127.72s/it, best=0.91]  [A
Staphylococcus_Aureus | Oxacillin | Optuna:  87%|████████▋ | 174/200 [6:17:52<55:20, 127.72s/it, best=0.91][A[I 2026-02-27 21:06:37,696] Trial 153 finished with value: 0.8526206331789801 and parameters: {'activation': 'relu', 'solver': 'adam', 'lr': 0.005138753676905176, 'layer1': 436, 'layer2': 359, 'layer3': 74}. Best is trial 126 with value: 0.8664911301660769.

Pseudomonas_Aeruginosa | Imipenem | Optuna:  77%|███████▋  | 154/200 [2:34:31<56:23, 73.55s/it, best=0.867][A
Pseudomonas_Aeruginosa | Imipenem | Optuna:  77%|███████▋  | 154/200 [2:34:31<56:23, 73.55s/it, best=0.867][A[I 2026-02-27 21:06:49,793] Trial 152 finished with value: 0.8038148694240052 and parameters: {'activation': 'tanh', 'solver': 'adam', 'lr': 5.10671860954132e-05, 'layer1': 155, 'layer2': 260, 'layer3': 49}. Best is trial 124 with value: 0.8095465376114227.

Escherichia_Coli | Ciprofloxacin | Optuna:  76%|███████▋  | 153/200 [6:19:19<1:39:38, 127.19s/it, best=0.809][A
Escherichia_Coli | Ciprofloxacin | Optuna:  76%|███████▋  | 153/200 [6:19:19<1:39:38, 127.19s/it, best=0.809][A[I 2026-02-27 21:07:20,081] Trial 10 finished with value: 0.893706415522271 and parameters: {'activation': 'identity', 'solver': 'sgd', 'lr': 0.007553503645583194, 'layer1': 366, 'layer2': 492, 'layer3': 320}. Best is trial 8 with value: 0.9030715990312389.

Klebsiella_Pneumoniae | Ceftriaxone | Optuna:   6%|▌         | 11/200 [16:41<5:14:52, 99.96s/it, best=0.903][A
Klebsiella_Pneumoniae | Ceftriaxone | Optuna:   6%|▌         | 11/200 [16:41<5:14:52, 99.96s/it, best=0.903][A[I 2026-02-27 21:07:43,147] Trial 154 finished with value: 0.860887662534056 and parameters: {'activation': 'relu', 'solver': 'adam', 'lr': 0.0004776439528479039, 'layer1': 476, 'layer2': 332, 'layer3': 21}. Best is trial 126 with value: 0.8664911301660769.

Pseudomonas_Aeruginosa | Imipenem | Optuna:  78%|███████▊  | 155/200 [2:35:37<53:20, 71.12s/it, best=0.867][A
Pseudomonas_Aeruginosa | Imipenem | Optuna:  78%|███████▊  | 155/200 [2:35:37<53:20, 71.12s/it, best=0.867][A[I 2026-02-27 21:07:43,689] Trial 174 finished with value: 0.9082248019505762 and parameters: {'activation': 'identity', 'solver': 'adam', 'lr': 0.00032862886774940133, 'layer1': 345, 'layer2': 411, 'layer3': 427}. Best is trial 152 with value: 0.9102139153966748.

Staphylococcus_Aureus | Oxacillin | Optuna:  88%|████████▊ | 175/200 [6:20:13<54:50, 131.62s/it, best=0.91][A
Staphylococcus_Aureus | Oxacillin | Optuna:  88%|████████▊ | 175/200 [6:20:13<54:50, 131.62s/it, best=0.91][A[I 2026-02-27 21:08:24,060] Trial 153 finished with value: 0.8031523967062293 and parameters: {'activation': 'tanh', 'solver': 'adam', 'lr': 0.00011081818664249188, 'layer1': 145, 'layer2': 282, 'layer3': 60}. Best is trial 124 with value: 0.8095465376114227.

Escherichia_Coli | Ciprofloxacin | Optuna:  77%|███████▋  | 154/200 [6:20:53<1:29:56, 117.32s/it, best=0.809][A
Escherichia_Coli | Ciprofloxacin | Optuna:  77%|███████▋  | 154/200 [6:20:53<1:29:56, 117.32s/it, best=0.809][A[I 2026-02-27 21:08:40,408] Trial 11 finished with value: 0.8966006791139449 and parameters: {'activation': 'relu', 'solver': 'adam', 'lr': 0.0013124793805688133, 'layer1': 150, 'layer2': 163, 'layer3': 284}. Best is trial 8 with value: 0.9030715990312389.

Klebsiella_Pneumoniae | Ceftriaxone | Optuna:   6%|▌         | 12/200 [18:01<4:54:29, 93.99s/it, best=0.903][A
Klebsiella_Pneumoniae | Ceftriaxone | Optuna:   6%|▌         | 12/200 [18:01<4:54:29, 93.99s/it, best=0.903][A[I 2026-02-27 21:09:20,080] Trial 155 finished with value: 0.8637218298873215 and parameters: {'activation': 'relu', 'solver': 'adam', 'lr': 0.000275804122945945, 'layer1': 453, 'layer2': 376, 'layer3': 461}. Best is trial 126 with value: 0.8664911301660769.

Pseudomonas_Aeruginosa | Imipenem | Optuna:  78%|███████▊  | 156/200 [2:37:14<57:50, 78.86s/it, best=0.867][A
Pseudomonas_Aeruginosa | Imipenem | Optuna:  78%|███████▊  | 156/200 [2:37:14<57:50, 78.86s/it, best=0.867][A[I 2026-02-27 21:09:29,820] Trial 175 finished with value: 0.9033270624846141 and parameters: {'activation': 'identity', 'solver': 'adam', 'lr': 0.000243816965488586, 'layer1': 329, 'layer2': 440, 'layer3': 358}. Best is trial 152 with value: 0.9102139153966748.

Staphylococcus_Aureus | Oxacillin | Optuna:  88%|████████▊ | 176/200 [6:21:59<49:35, 123.98s/it, best=0.91][A
Staphylococcus_Aureus | Oxacillin | Optuna:  88%|████████▊ | 176/200 [6:21:59<49:35, 123.98s/it, best=0.91][A[I 2026-02-27 21:10:22,101] Trial 12 finished with value: 0.9050182181631682 and parameters: {'activation': 'identity', 'solver': 'adam', 'lr': 0.00046544039809979403, 'layer1': 347, 'layer2': 434, 'layer3': 419}. Best is trial 12 with value: 0.9050182181631682.

Klebsiella_Pneumoniae | Ceftriaxone | Optuna:   6%|▋         | 13/200 [19:43<5:00:11, 96.32s/it, best=0.903][A
Klebsiella_Pneumoniae | Ceftriaxone | Optuna:   6%|▋         | 13/200 [19:43<5:00:11, 96.32s/it, best=0.905][A[I 2026-02-27 21:10:29,036] Trial 154 finished with value: 0.8058096788217535 and parameters: {'activation': 'tanh', 'solver': 'adam', 'lr': 3.1054899916604626e-05, 'layer1': 134, 'layer2': 223, 'layer3': 10}. Best is trial 124 with value: 0.8095465376114227.

Escherichia_Coli | Ciprofloxacin | Optuna:  78%|███████▊  | 155/200 [6:22:58<1:29:42, 119.61s/it, best=0.809][A
Escherichia_Coli | Ciprofloxacin | Optuna:  78%|███████▊  | 155/200 [6:22:58<1:29:42, 119.61s/it, best=0.809][A[I 2026-02-27 21:11:04,465] Trial 156 finished with value: 0.862692197113667 and parameters: {'activation': 'relu', 'solver': 'adam', 'lr': 0.00029535111479035546, 'layer1': 495, 'layer2': 376, 'layer3': 355}. Best is trial 126 with value: 0.8664911301660769.

Pseudomonas_Aeruginosa | Imipenem | Optuna:  78%|███████▊  | 157/200 [2:38:58<1:02:00, 86.52s/it, best=0.867][A
Pseudomonas_Aeruginosa | Imipenem | Optuna:  78%|███████▊  | 157/200 [2:38:58<1:02:00, 86.52s/it, best=0.867][A[I 2026-02-27 21:11:34,425] Trial 176 finished with value: 0.9050605858935657 and parameters: {'activation': 'identity', 'solver': 'adam', 'lr': 0.00016554472900581944, 'layer1': 339, 'layer2': 424, 'layer3': 338}. Best is trial 152 with value: 0.9102139153966748.

Staphylococcus_Aureus | Oxacillin | Optuna:  88%|████████▊ | 177/200 [6:24:04<47:35, 124.16s/it, best=0.91][A
Staphylococcus_Aureus | Oxacillin | Optuna:  88%|████████▊ | 177/200 [6:24:04<47:35, 124.16s/it, best=0.91][A[I 2026-02-27 21:12:22,522] Trial 157 finished with value: 0.8642301825660743 and parameters: {'activation': 'relu', 'solver': 'adam', 'lr': 0.00017394632533826476, 'layer1': 466, 'layer2': 397, 'layer3': 496}. Best is trial 126 with value: 0.8664911301660769.

Pseudomonas_Aeruginosa | Imipenem | Optuna:  79%|███████▉  | 158/200 [2:40:16<58:47, 83.98s/it, best=0.867]  [A
Pseudomonas_Aeruginosa | Imipenem | Optuna:  79%|███████▉  | 158/200 [2:40:16<58:47, 83.98s/it, best=0.867][A[I 2026-02-27 21:12:32,495] Trial 13 finished with value: 0.9052490975786345 and parameters: {'activation': 'identity', 'solver': 'adam', 'lr': 0.00025548240574830476, 'layer1': 499, 'layer2': 471, 'layer3': 419}. Best is trial 13 with value: 0.9052490975786345.

Klebsiella_Pneumoniae | Ceftriaxone | Optuna:   7%|▋         | 14/200 [21:54<5:30:29, 106.61s/it, best=0.905][A
Klebsiella_Pneumoniae | Ceftriaxone | Optuna:   7%|▋         | 14/200 [21:54<5:30:29, 106.61s/it, best=0.905][A[I 2026-02-27 21:12:40,534] Trial 155 finished with value: 0.8046543979182053 and parameters: {'activation': 'tanh', 'solver': 'adam', 'lr': 6.478710520724259e-05, 'layer1': 165, 'layer2': 271, 'layer3': 78}. Best is trial 124 with value: 0.8095465376114227.

Escherichia_Coli | Ciprofloxacin | Optuna:  78%|███████▊  | 156/200 [6:25:09<1:30:19, 123.18s/it, best=0.809][A
Escherichia_Coli | Ciprofloxacin | Optuna:  78%|███████▊  | 156/200 [6:25:09<1:30:19, 123.18s/it, best=0.809][A[I 2026-02-27 21:13:46,136] Trial 177 finished with value: 0.9088373504734204 and parameters: {'activation': 'identity', 'solver': 'adam', 'lr': 0.00014097025667866639, 'layer1': 272, 'layer2': 455, 'layer3': 346}. Best is trial 152 with value: 0.9102139153966748.

Staphylococcus_Aureus | Oxacillin | Optuna:  89%|████████▉ | 178/200 [6:26:15<46:21, 126.43s/it, best=0.91][A
Staphylococcus_Aureus | Oxacillin | Optuna:  89%|████████▉ | 178/200 [6:26:15<46:21, 126.43s/it, best=0.91][A[I 2026-02-27 21:13:47,812] Trial 158 finished with value: 0.861471596662504 and parameters: {'activation': 'relu', 'solver': 'adam', 'lr': 0.00019169966018287195, 'layer1': 415, 'layer2': 396, 'layer3': 495}. Best is trial 126 with value: 0.8664911301660769.

Pseudomonas_Aeruginosa | Imipenem | Optuna:  80%|███████▉  | 159/200 [2:41:42<57:39, 84.37s/it, best=0.867][A
Pseudomonas_Aeruginosa | Imipenem | Optuna:  80%|███████▉  | 159/200 [2:41:42<57:39, 84.37s/it, best=0.867][A[I 2026-02-27 21:14:49,530] Trial 159 finished with value: 0.8588158545445619 and parameters: {'activation': 'relu', 'solver': 'adam', 'lr': 0.0003507302089690717, 'layer1': 106, 'layer2': 425, 'layer3': 466}. Best is trial 126 with value: 0.8664911301660769.

Pseudomonas_Aeruginosa | Imipenem | Optuna:  80%|████████  | 160/200 [2:42:43<51:43, 77.58s/it, best=0.867][A
Pseudomonas_Aeruginosa | Imipenem | Optuna:  80%|████████  | 160/200 [2:42:43<51:43, 77.58s/it, best=0.867][A[I 2026-02-27 21:14:53,795] Trial 14 finished with value: 0.9066099121999003 and parameters: {'activation': 'identity', 'solver': 'adam', 'lr': 0.00013839971926370072, 'layer1': 499, 'layer2': 394, 'layer3': 414}. Best is trial 14 with value: 0.9066099121999003.

Klebsiella_Pneumoniae | Ceftriaxone | Optuna:   8%|▊         | 15/200 [24:15<6:00:57, 117.07s/it, best=0.905][A
Klebsiella_Pneumoniae | Ceftriaxone | Optuna:   8%|▊         | 15/200 [24:15<6:00:57, 117.07s/it, best=0.907][A[I 2026-02-27 21:15:06,108] Trial 156 finished with value: 0.8011307389848957 and parameters: {'activation': 'identity', 'solver': 'adam', 'lr': 4.526841891062734e-05, 'layer1': 121, 'layer2': 300, 'layer3': 36}. Best is trial 124 with value: 0.8095465376114227.

Escherichia_Coli | Ciprofloxacin | Optuna:  78%|███████▊  | 157/200 [6:27:35<1:33:05, 129.90s/it, best=0.809][A
Escherichia_Coli | Ciprofloxacin | Optuna:  78%|███████▊  | 157/200 [6:27:35<1:33:05, 129.90s/it, best=0.809][A[I 2026-02-27 21:15:55,053] Trial 178 finished with value: 0.9064779564316714 and parameters: {'activation': 'identity', 'solver': 'adam', 'lr': 0.00015073829666342736, 'layer1': 277, 'layer2': 484, 'layer3': 319}. Best is trial 152 with value: 0.9102139153966748.

Staphylococcus_Aureus | Oxacillin | Optuna:  90%|████████▉ | 179/200 [6:28:24<44:30, 127.17s/it, best=0.91][A
Staphylococcus_Aureus | Oxacillin | Optuna:  90%|████████▉ | 179/200 [6:28:24<44:30, 127.17s/it, best=0.91][A[I 2026-02-27 21:16:12,143] Trial 160 finished with value: 0.859926089222585 and parameters: {'activation': 'relu', 'solver': 'adam', 'lr': 0.00015348913520442852, 'layer1': 449, 'layer2': 414, 'layer3': 448}. Best is trial 126 with value: 0.8664911301660769.

Pseudomonas_Aeruginosa | Imipenem | Optuna:  80%|████████  | 161/200 [2:44:06<51:24, 79.09s/it, best=0.867][A
Pseudomonas_Aeruginosa | Imipenem | Optuna:  80%|████████  | 161/200 [2:44:06<51:24, 79.09s/it, best=0.867][A[I 2026-02-27 21:16:20,558] Trial 157 finished with value: 0.8041787016821083 and parameters: {'activation': 'tanh', 'solver': 'adam', 'lr': 9.637173915282174e-05, 'layer1': 86, 'layer2': 324, 'layer3': 23}. Best is trial 124 with value: 0.8095465376114227.

Escherichia_Coli | Ciprofloxacin | Optuna:  79%|███████▉  | 158/200 [6:28:49<1:19:17, 113.26s/it, best=0.809][A
Escherichia_Coli | Ciprofloxacin | Optuna:  79%|███████▉  | 158/200 [6:28:49<1:19:17, 113.26s/it, best=0.809][A[I 2026-02-27 21:16:55,916] Trial 15 finished with value: 0.905968350965415 and parameters: {'activation': 'identity', 'solver': 'adam', 'lr': 0.0001014607879311535, 'layer1': 499, 'layer2': 383, 'layer3': 499}. Best is trial 14 with value: 0.9066099121999003.

Klebsiella_Pneumoniae | Ceftriaxone | Optuna:   8%|▊         | 16/200 [26:17<6:03:40, 118.59s/it, best=0.907][A
Klebsiella_Pneumoniae | Ceftriaxone | Optuna:   8%|▊         | 16/200 [26:17<6:03:40, 118.59s/it, best=0.907][A[I 2026-02-27 21:17:46,381] Trial 179 finished with value: 0.9051467273258803 and parameters: {'activation': 'identity', 'solver': 'adam', 'lr': 0.0005344549287544507, 'layer1': 268, 'layer2': 471, 'layer3': 350}. Best is trial 152 with value: 0.9102139153966748.

Staphylococcus_Aureus | Oxacillin | Optuna:  90%|█████████ | 180/200 [6:30:16<40:48, 122.42s/it, best=0.91][A
Staphylococcus_Aureus | Oxacillin | Optuna:  90%|█████████ | 180/200 [6:30:16<40:48, 122.42s/it, best=0.91][A[I 2026-02-27 21:17:59,109] Trial 161 finished with value: 0.8631691671171048 and parameters: {'activation': 'relu', 'solver': 'adam', 'lr': 0.0002487581406501245, 'layer1': 465, 'layer2': 397, 'layer3': 478}. Best is trial 126 with value: 0.8664911301660769.

Pseudomonas_Aeruginosa | Imipenem | Optuna:  81%|████████  | 162/200 [2:45:53<55:23, 87.45s/it, best=0.867][A
Pseudomonas_Aeruginosa | Imipenem | Optuna:  81%|████████  | 162/200 [2:45:53<55:23, 87.45s/it, best=0.867][A[I 2026-02-27 21:18:52,478] Trial 16 finished with value: 0.9032886543654481 and parameters: {'activation': 'identity', 'solver': 'adam', 'lr': 7.054382978969143e-05, 'layer1': 499, 'layer2': 380, 'layer3': 487}. Best is trial 14 with value: 0.9066099121999003.

Klebsiella_Pneumoniae | Ceftriaxone | Optuna:   8%|▊         | 17/200 [28:14<5:59:50, 117.98s/it, best=0.907][A
