Pseudomonas_Aeruginosa | Imipenem | Optuna:  59%|█████▉    | 118/200 [1:49:50<1:50:16, 80.69s/it, best=0.865][A[I 2026-02-27 20:22:24,624] Trial 181 finished with value: 0.8240962674616616 and parameters: {'activation': 'tanh', 'solver': 'adam', 'lr': 0.00010188929334303897, 'layer1': 320, 'layer2': 490, 'layer3': 165}. Best is trial 91 with value: 0.8315336183309556.

Klebsiella_Pneumoniae | Ciprofloxacin | Optuna:  91%|█████████ | 182/200 [5:34:54<25:46, 85.91s/it, best=0.832][A
Klebsiella_Pneumoniae | Ciprofloxacin | Optuna:  91%|█████████ | 182/200 [5:34:54<25:46, 85.91s/it, best=0.832][A[I 2026-02-27 20:22:39,446] Trial 153 finished with value: 0.9068242943268638 and parameters: {'activation': 'identity', 'solver': 'adam', 'lr': 0.00018187890405758832, 'layer1': 174, 'layer2': 418, 'layer3': 385}. Best is trial 152 with value: 0.9102139153966748.

Staphylococcus_Aureus | Oxacillin | Optuna:  77%|███████▋  | 154/200 [5:35:09<1:37:02, 126.57s/it, best=0.91][A
Staphylococcus_Aureus | Oxacillin | Optuna:  77%|███████▋  | 154/200 [5:35:09<1:37:02, 126.57s/it, best=0.91][A[I 2026-02-27 20:23:03,940] Trial 118 finished with value: 0.8209493587974919 and parameters: {'activation': 'identity', 'solver': 'sgd', 'lr': 0.00016646717758722992, 'layer1': 470, 'layer2': 460, 'layer3': 99}. Best is trial 42 with value: 0.8645324176837453.

Pseudomonas_Aeruginosa | Imipenem | Optuna:  60%|█████▉    | 119/200 [1:50:58<1:43:35, 76.73s/it, best=0.865][A
Pseudomonas_Aeruginosa | Imipenem | Optuna:  60%|█████▉    | 119/200 [1:50:58<1:43:35, 76.73s/it, best=0.865][A[I 2026-02-27 20:23:48,606] Trial 182 finished with value: 0.824229462237238 and parameters: {'activation': 'tanh', 'solver': 'adam', 'lr': 0.0001417552395068787, 'layer1': 306, 'layer2': 474, 'layer3': 166}. Best is trial 91 with value: 0.8315336183309556.

Klebsiella_Pneumoniae | Ciprofloxacin | Optuna:  92%|█████████▏| 183/200 [5:36:18<24:10, 85.33s/it, best=0.832][A
Klebsiella_Pneumoniae | Ciprofloxacin | Optuna:  92%|█████████▏| 183/200 [5:36:18<24:10, 85.33s/it, best=0.832][A[I 2026-02-27 20:24:11,023] Trial 133 finished with value: 0.7977211060186706 and parameters: {'activation': 'tanh', 'solver': 'adam', 'lr': 1.1651827085443491e-05, 'layer1': 172, 'layer2': 318, 'layer3': 77}. Best is trial 124 with value: 0.8095465376114227.

Escherichia_Coli | Ciprofloxacin | Optuna:  67%|██████▋   | 134/200 [5:36:40<3:48:18, 207.56s/it, best=0.809][A
Escherichia_Coli | Ciprofloxacin | Optuna:  67%|██████▋   | 134/200 [5:36:40<3:48:18, 207.56s/it, best=0.809][A[I 2026-02-27 20:24:19,442] Trial 119 finished with value: 0.8645900221293082 and parameters: {'activation': 'relu', 'solver': 'adam', 'lr': 0.0006018051481926159, 'layer1': 483, 'layer2': 371, 'layer3': 61}. Best is trial 119 with value: 0.8645900221293082.

Pseudomonas_Aeruginosa | Imipenem | Optuna:  60%|██████    | 120/200 [1:52:13<1:41:49, 76.36s/it, best=0.865][A
Pseudomonas_Aeruginosa | Imipenem | Optuna:  60%|██████    | 120/200 [1:52:13<1:41:49, 76.36s/it, best=0.865][A[I 2026-02-27 20:24:32,721] Trial 154 finished with value: 0.9068711961056672 and parameters: {'activation': 'identity', 'solver': 'adam', 'lr': 0.0001387912838013267, 'layer1': 347, 'layer2': 415, 'layer3': 381}. Best is trial 152 with value: 0.9102139153966748.

Staphylococcus_Aureus | Oxacillin | Optuna:  78%|███████▊  | 155/200 [5:37:02<1:31:56, 122.58s/it, best=0.91][A
Staphylococcus_Aureus | Oxacillin | Optuna:  78%|███████▊  | 155/200 [5:37:02<1:31:56, 122.58s/it, best=0.91][A[I 2026-02-27 20:25:24,126] Trial 183 finished with value: 0.8276872960129895 and parameters: {'activation': 'tanh', 'solver': 'adam', 'lr': 0.00011054899236251828, 'layer1': 345, 'layer2': 479, 'layer3': 143}. Best is trial 91 with value: 0.8315336183309556.

Klebsiella_Pneumoniae | Ciprofloxacin | Optuna:  92%|█████████▏| 184/200 [5:37:53<23:34, 88.39s/it, best=0.832][A
Klebsiella_Pneumoniae | Ciprofloxacin | Optuna:  92%|█████████▏| 184/200 [5:37:53<23:34, 88.39s/it, best=0.832][A[I 2026-02-27 20:25:39,905] Trial 120 finished with value: 0.8642199516255479 and parameters: {'activation': 'relu', 'solver': 'adam', 'lr': 0.0005501517324419723, 'layer1': 487, 'layer2': 375, 'layer3': 66}. Best is trial 119 with value: 0.8645900221293082.

Pseudomonas_Aeruginosa | Imipenem | Optuna:  60%|██████    | 121/200 [1:53:34<1:42:09, 77.59s/it, best=0.865][A
Pseudomonas_Aeruginosa | Imipenem | Optuna:  60%|██████    | 121/200 [1:53:34<1:42:09, 77.59s/it, best=0.865][A[I 2026-02-27 20:26:56,286] Trial 121 finished with value: 0.8607509369082287 and parameters: {'activation': 'relu', 'solver': 'adam', 'lr': 0.00040881323158001564, 'layer1': 488, 'layer2': 391, 'layer3': 63}. Best is trial 119 with value: 0.8645900221293082.

Pseudomonas_Aeruginosa | Imipenem | Optuna:  61%|██████    | 122/200 [1:54:50<1:40:23, 77.23s/it, best=0.865][A
Pseudomonas_Aeruginosa | Imipenem | Optuna:  61%|██████    | 122/200 [1:54:50<1:40:23, 77.23s/it, best=0.865][A[I 2026-02-27 20:26:57,410] Trial 155 finished with value: 0.9067069960448737 and parameters: {'activation': 'identity', 'solver': 'adam', 'lr': 5.509832756458526e-05, 'layer1': 315, 'layer2': 405, 'layer3': 398}. Best is trial 152 with value: 0.9102139153966748.

Staphylococcus_Aureus | Oxacillin | Optuna:  78%|███████▊  | 156/200 [5:39:27<1:34:45, 129.21s/it, best=0.91][A
Staphylococcus_Aureus | Oxacillin | Optuna:  78%|███████▊  | 156/200 [5:39:27<1:34:45, 129.21s/it, best=0.91][A[I 2026-02-27 20:27:10,679] Trial 134 finished with value: 0.8049827246833063 and parameters: {'activation': 'tanh', 'solver': 'adam', 'lr': 1.9545191520625846e-05, 'layer1': 145, 'layer2': 271, 'layer3': 21}. Best is trial 124 with value: 0.8095465376114227.

Escherichia_Coli | Ciprofloxacin | Optuna:  68%|██████▊   | 135/200 [5:39:40<3:35:47, 199.19s/it, best=0.809][A
Escherichia_Coli | Ciprofloxacin | Optuna:  68%|██████▊   | 135/200 [5:39:40<3:35:47, 199.19s/it, best=0.809][A[I 2026-02-27 20:27:14,229] Trial 184 finished with value: 0.8271337670408766 and parameters: {'activation': 'tanh', 'solver': 'adam', 'lr': 8.241788140481194e-05, 'layer1': 328, 'layer2': 491, 'layer3': 177}. Best is trial 91 with value: 0.8315336183309556.

Klebsiella_Pneumoniae | Ciprofloxacin | Optuna:  92%|█████████▎| 185/200 [5:39:43<23:43, 94.90s/it, best=0.832][A
Klebsiella_Pneumoniae | Ciprofloxacin | Optuna:  92%|█████████▎| 185/200 [5:39:43<23:43, 94.90s/it, best=0.832][A[I 2026-02-27 20:28:24,768] Trial 122 finished with value: 0.8609438965352114 and parameters: {'activation': 'relu', 'solver': 'adam', 'lr': 0.0005490957792240669, 'layer1': 480, 'layer2': 370, 'layer3': 38}. Best is trial 119 with value: 0.8645900221293082.

Pseudomonas_Aeruginosa | Imipenem | Optuna:  62%|██████▏   | 123/200 [1:56:18<1:43:26, 80.61s/it, best=0.865][A
Pseudomonas_Aeruginosa | Imipenem | Optuna:  62%|██████▏   | 123/200 [1:56:18<1:43:26, 80.61s/it, best=0.865][A[I 2026-02-27 20:28:36,667] Trial 185 finished with value: 0.8263353077384734 and parameters: {'activation': 'tanh', 'solver': 'adam', 'lr': 6.980763106265687e-05, 'layer1': 312, 'layer2': 500, 'layer3': 118}. Best is trial 91 with value: 0.8315336183309556.

Klebsiella_Pneumoniae | Ciprofloxacin | Optuna:  93%|█████████▎| 186/200 [5:41:06<21:16, 91.16s/it, best=0.832][A
Klebsiella_Pneumoniae | Ciprofloxacin | Optuna:  93%|█████████▎| 186/200 [5:41:06<21:16, 91.16s/it, best=0.832][A[I 2026-02-27 20:28:40,603] Trial 156 finished with value: 0.9061359925490129 and parameters: {'activation': 'identity', 'solver': 'adam', 'lr': 0.0009992868068969987, 'layer1': 381, 'layer2': 278, 'layer3': 261}. Best is trial 152 with value: 0.9102139153966748.

Staphylococcus_Aureus | Oxacillin | Optuna:  78%|███████▊  | 157/200 [5:41:10<1:27:00, 121.41s/it, best=0.91][A
Staphylococcus_Aureus | Oxacillin | Optuna:  78%|███████▊  | 157/200 [5:41:10<1:27:00, 121.41s/it, best=0.91][A[I 2026-02-27 20:29:09,567] Trial 135 finished with value: 0.8066379164198964 and parameters: {'activation': 'tanh', 'solver': 'adam', 'lr': 4.1416630410289554e-05, 'layer1': 125, 'layer2': 197, 'layer3': 62}. Best is trial 124 with value: 0.8095465376114227.

Escherichia_Coli | Ciprofloxacin | Optuna:  68%|██████▊   | 136/200 [5:41:38<3:06:46, 175.10s/it, best=0.809][A
Escherichia_Coli | Ciprofloxacin | Optuna:  68%|██████▊   | 136/200 [5:41:38<3:06:46, 175.10s/it, best=0.809][A[I 2026-02-27 20:29:41,830] Trial 123 finished with value: 0.8619210263561815 and parameters: {'activation': 'relu', 'solver': 'adam', 'lr': 0.0006533097094703837, 'layer1': 467, 'layer2': 356, 'layer3': 73}. Best is trial 119 with value: 0.8645900221293082.

Pseudomonas_Aeruginosa | Imipenem | Optuna:  62%|██████▏   | 124/200 [1:57:36<1:40:45, 79.54s/it, best=0.865][A
Pseudomonas_Aeruginosa | Imipenem | Optuna:  62%|██████▏   | 124/200 [1:57:36<1:40:45, 79.54s/it, best=0.865][A[I 2026-02-27 20:29:57,690] Trial 186 finished with value: 0.8231519789489807 and parameters: {'activation': 'tanh', 'solver': 'adam', 'lr': 6.180174198683043e-05, 'layer1': 294, 'layer2': 433, 'layer3': 160}. Best is trial 91 with value: 0.8315336183309556.

Klebsiella_Pneumoniae | Ciprofloxacin | Optuna:  94%|█████████▎| 187/200 [5:42:27<19:05, 88.12s/it, best=0.832][A
Klebsiella_Pneumoniae | Ciprofloxacin | Optuna:  94%|█████████▎| 187/200 [5:42:27<19:05, 88.12s/it, best=0.832][A[I 2026-02-27 20:30:44,526] Trial 124 finished with value: 0.8592855420494606 and parameters: {'activation': 'relu', 'solver': 'adam', 'lr': 0.000891675275532747, 'layer1': 461, 'layer2': 375, 'layer3': 19}. Best is trial 119 with value: 0.8645900221293082.

Pseudomonas_Aeruginosa | Imipenem | Optuna:  62%|██████▎   | 125/200 [1:58:38<1:33:06, 74.49s/it, best=0.865][A
Pseudomonas_Aeruginosa | Imipenem | Optuna:  62%|██████▎   | 125/200 [1:58:38<1:33:06, 74.49s/it, best=0.865][A[I 2026-02-27 20:31:27,044] Trial 157 finished with value: 0.9066338298072788 and parameters: {'activation': 'relu', 'solver': 'adam', 'lr': 8.809591847244659e-05, 'layer1': 490, 'layer2': 391, 'layer3': 420}. Best is trial 152 with value: 0.9102139153966748.

Staphylococcus_Aureus | Oxacillin | Optuna:  79%|███████▉  | 158/200 [5:43:56<1:34:26, 134.92s/it, best=0.91][A
Staphylococcus_Aureus | Oxacillin | Optuna:  79%|███████▉  | 158/200 [5:43:56<1:34:26, 134.92s/it, best=0.91][A[I 2026-02-27 20:31:36,250] Trial 187 finished with value: 0.8272595637893853 and parameters: {'activation': 'tanh', 'solver': 'adam', 'lr': 0.00010766413520103136, 'layer1': 257, 'layer2': 454, 'layer3': 149}. Best is trial 91 with value: 0.8315336183309556.

Klebsiella_Pneumoniae | Ciprofloxacin | Optuna:  94%|█████████▍| 188/200 [5:44:05<18:15, 91.25s/it, best=0.832][A
Klebsiella_Pneumoniae | Ciprofloxacin | Optuna:  94%|█████████▍| 188/200 [5:44:05<18:15, 91.25s/it, best=0.832][A[I 2026-02-27 20:31:53,880] Trial 136 finished with value: 0.8059619206827187 and parameters: {'activation': 'tanh', 'solver': 'adam', 'lr': 2.555597429236084e-05, 'layer1': 128, 'layer2': 196, 'layer3': 59}. Best is trial 124 with value: 0.8095465376114227.

Escherichia_Coli | Ciprofloxacin | Optuna:  68%|██████▊   | 137/200 [5:44:23<3:00:27, 171.86s/it, best=0.809][A
Escherichia_Coli | Ciprofloxacin | Optuna:  68%|██████▊   | 137/200 [5:44:23<3:00:27, 171.86s/it, best=0.809][A[I 2026-02-27 20:32:00,797] Trial 125 finished with value: 0.8627234847634895 and parameters: {'activation': 'relu', 'solver': 'adam', 'lr': 0.00032354986736203177, 'layer1': 491, 'layer2': 391, 'layer3': 89}. Best is trial 119 with value: 0.8645900221293082.

Pseudomonas_Aeruginosa | Imipenem | Optuna:  63%|██████▎   | 126/200 [1:59:55<1:32:31, 75.02s/it, best=0.865][A
Pseudomonas_Aeruginosa | Imipenem | Optuna:  63%|██████▎   | 126/200 [1:59:55<1:32:31, 75.02s/it, best=0.865][A[I 2026-02-27 20:33:13,489] Trial 188 finished with value: 0.8272843602964264 and parameters: {'activation': 'tanh', 'solver': 'adam', 'lr': 0.00013910060025079877, 'layer1': 351, 'layer2': 469, 'layer3': 182}. Best is trial 91 with value: 0.8315336183309556.

Klebsiella_Pneumoniae | Ciprofloxacin | Optuna:  94%|█████████▍| 189/200 [5:45:43<17:03, 93.05s/it, best=0.832][A
Klebsiella_Pneumoniae | Ciprofloxacin | Optuna:  94%|█████████▍| 189/200 [5:45:43<17:03, 93.05s/it, best=0.832][A[I 2026-02-27 20:33:19,990] Trial 126 finished with value: 0.8664911301660769 and parameters: {'activation': 'relu', 'solver': 'adam', 'lr': 0.000233377380678602, 'layer1': 478, 'layer2': 358, 'layer3': 52}. Best is trial 126 with value: 0.8664911301660769.

Pseudomonas_Aeruginosa | Imipenem | Optuna:  64%|██████▎   | 127/200 [2:01:14<1:32:48, 76.27s/it, best=0.865][A
Pseudomonas_Aeruginosa | Imipenem | Optuna:  64%|██████▎   | 127/200 [2:01:14<1:32:48, 76.27s/it, best=0.867][A[I 2026-02-27 20:33:52,479] Trial 158 finished with value: 0.9074983521977915 and parameters: {'activation': 'identity', 'solver': 'adam', 'lr': 4.460133546467786e-05, 'layer1': 300, 'layer2': 242, 'layer3': 457}. Best is trial 152 with value: 0.9102139153966748.

Staphylococcus_Aureus | Oxacillin | Optuna:  80%|███████▉  | 159/200 [5:46:22<1:34:20, 138.07s/it, best=0.91][A
Staphylococcus_Aureus | Oxacillin | Optuna:  80%|███████▉  | 159/200 [5:46:22<1:34:20, 138.07s/it, best=0.91][A[I 2026-02-27 20:34:10,126] Trial 137 finished with value: 0.8069328144418695 and parameters: {'activation': 'tanh', 'solver': 'adam', 'lr': 4.254616889110698e-05, 'layer1': 101, 'layer2': 168, 'layer3': 33}. Best is trial 124 with value: 0.8095465376114227.

Escherichia_Coli | Ciprofloxacin | Optuna:  69%|██████▉   | 138/200 [5:46:39<2:46:32, 161.18s/it, best=0.809][A
Escherichia_Coli | Ciprofloxacin | Optuna:  69%|██████▉   | 138/200 [5:46:39<2:46:32, 161.18s/it, best=0.809][A[I 2026-02-27 20:34:34,993] Trial 189 finished with value: 0.8227340360740311 and parameters: {'activation': 'tanh', 'solver': 'adam', 'lr': 0.0002068465938155368, 'layer1': 323, 'layer2': 448, 'layer3': 169}. Best is trial 91 with value: 0.8315336183309556.

Klebsiella_Pneumoniae | Ciprofloxacin | Optuna:  95%|█████████▌| 190/200 [5:47:04<14:55, 89.59s/it, best=0.832][A
Klebsiella_Pneumoniae | Ciprofloxacin | Optuna:  95%|█████████▌| 190/200 [5:47:04<14:55, 89.59s/it, best=0.832][A[I 2026-02-27 20:34:42,227] Trial 127 finished with value: 0.8631267272246838 and parameters: {'activation': 'relu', 'solver': 'adam', 'lr': 0.0005025618403268342, 'layer1': 483, 'layer2': 359, 'layer3': 48}. Best is trial 126 with value: 0.8664911301660769.

Pseudomonas_Aeruginosa | Imipenem | Optuna:  64%|██████▍   | 128/200 [2:02:36<1:33:40, 78.06s/it, best=0.867][A
Pseudomonas_Aeruginosa | Imipenem | Optuna:  64%|██████▍   | 128/200 [2:02:36<1:33:40, 78.06s/it, best=0.867][A[I 2026-02-27 20:34:47,455] Trial 159 finished with value: 0.7213151454550253 and parameters: {'activation': 'identity', 'solver': 'sgd', 'lr': 7.384169201172212e-05, 'layer1': 203, 'layer2': 427, 'layer3': 372}. Best is trial 152 with value: 0.9102139153966748.

Staphylococcus_Aureus | Oxacillin | Optuna:  80%|████████  | 160/200 [5:47:17<1:15:25, 113.14s/it, best=0.91][A
Staphylococcus_Aureus | Oxacillin | Optuna:  80%|████████  | 160/200 [5:47:17<1:15:25, 113.14s/it, best=0.91][A[I 2026-02-27 20:35:48,345] Trial 128 finished with value: 0.8593689224748033 and parameters: {'activation': 'relu', 'solver': 'adam', 'lr': 0.001164027643233693, 'layer1': 474, 'layer2': 340, 'layer3': 60}. Best is trial 126 with value: 0.8664911301660769.

Pseudomonas_Aeruginosa | Imipenem | Optuna:  64%|██████▍   | 129/200 [2:03:42<1:28:08, 74.48s/it, best=0.867][A
Pseudomonas_Aeruginosa | Imipenem | Optuna:  64%|██████▍   | 129/200 [2:03:42<1:28:08, 74.48s/it, best=0.867][A[I 2026-02-27 20:35:57,105] Trial 190 finished with value: 0.8272639679205186 and parameters: {'activation': 'tanh', 'solver': 'adam', 'lr': 9.52987177948931e-05, 'layer1': 274, 'layer2': 421, 'layer3': 385}. Best is trial 91 with value: 0.8315336183309556.

Klebsiella_Pneumoniae | Ciprofloxacin | Optuna:  96%|█████████▌| 191/200 [5:48:26<13:06, 87.34s/it, best=0.832][A
Klebsiella_Pneumoniae | Ciprofloxacin | Optuna:  96%|█████████▌| 191/200 [5:48:26<13:06, 87.34s/it, best=0.832][A[I 2026-02-27 20:36:29,247] Trial 138 finished with value: 0.79753021109123 and parameters: {'activation': 'relu', 'solver': 'adam', 'lr': 4.157250352246377e-05, 'layer1': 78, 'layer2': 166, 'layer3': 33}. Best is trial 124 with value: 0.8095465376114227.

Escherichia_Coli | Ciprofloxacin | Optuna:  70%|██████▉   | 139/200 [5:48:58<2:37:08, 154.56s/it, best=0.809][A
Escherichia_Coli | Ciprofloxacin | Optuna:  70%|██████▉   | 139/200 [5:48:58<2:37:08, 154.56s/it, best=0.809][A[I 2026-02-27 20:36:38,311] Trial 160 finished with value: 0.9079835167452874 and parameters: {'activation': 'identity', 'solver': 'adam', 'lr': 0.0006691136750797173, 'layer1': 223, 'layer2': 447, 'layer3': 78}. Best is trial 152 with value: 0.9102139153966748.

Staphylococcus_Aureus | Oxacillin | Optuna:  80%|████████  | 161/200 [5:49:07<1:13:05, 112.46s/it, best=0.91][A
Staphylococcus_Aureus | Oxacillin | Optuna:  80%|████████  | 161/200 [5:49:07<1:13:05, 112.46s/it, best=0.91][A[I 2026-02-27 20:37:16,275] Trial 129 finished with value: 0.865236493275568 and parameters: {'activation': 'relu', 'solver': 'adam', 'lr': 0.0002546779408172078, 'layer1': 452, 'layer2': 320, 'layer3': 33}. Best is trial 126 with value: 0.8664911301660769.

Pseudomonas_Aeruginosa | Imipenem | Optuna:  65%|██████▌   | 130/200 [2:05:10<1:31:36, 78.51s/it, best=0.867][A
Pseudomonas_Aeruginosa | Imipenem | Optuna:  65%|██████▌   | 130/200 [2:05:10<1:31:36, 78.51s/it, best=0.867][A[I 2026-02-27 20:37:30,621] Trial 191 finished with value: 0.8242396042147725 and parameters: {'activation': 'tanh', 'solver': 'adam', 'lr': 0.00010386653425396904, 'layer1': 344, 'layer2': 480, 'layer3': 154}. Best is trial 91 with value: 0.8315336183309556.

Klebsiella_Pneumoniae | Ciprofloxacin | Optuna:  96%|█████████▌| 192/200 [5:50:00<11:53, 89.20s/it, best=0.832][A
Klebsiella_Pneumoniae | Ciprofloxacin | Optuna:  96%|█████████▌| 192/200 [5:50:00<11:53, 89.20s/it, best=0.832][A[I 2026-02-27 20:38:39,775] Trial 130 finished with value: 0.8612335086812293 and parameters: {'activation': 'relu', 'solver': 'adam', 'lr': 0.00023589240846828776, 'layer1': 439, 'layer2': 312, 'layer3': 29}. Best is trial 126 with value: 0.8664911301660769.

Pseudomonas_Aeruginosa | Imipenem | Optuna:  66%|██████▌   | 131/200 [2:06:33<1:32:00, 80.01s/it, best=0.867][A
Pseudomonas_Aeruginosa | Imipenem | Optuna:  66%|██████▌   | 131/200 [2:06:33<1:32:00, 80.01s/it, best=0.867][A[I 2026-02-27 20:38:40,989] Trial 139 finished with value: 0.8046843760567437 and parameters: {'activation': 'tanh', 'solver': 'adam', 'lr': 3.101029658870187e-05, 'layer1': 269, 'layer2': 178, 'layer3': 268}. Best is trial 124 with value: 0.8095465376114227.

Escherichia_Coli | Ciprofloxacin | Optuna:  70%|███████   | 140/200 [5:51:10<2:27:42, 147.71s/it, best=0.809][A
Escherichia_Coli | Ciprofloxacin | Optuna:  70%|███████   | 140/200 [5:51:10<2:27:42, 147.71s/it, best=0.809][A[I 2026-02-27 20:38:58,825] Trial 161 finished with value: 0.9059820551847819 and parameters: {'activation': 'identity', 'solver': 'adam', 'lr': 0.00023281088879165945, 'layer1': 337, 'layer2': 434, 'layer3': 413}. Best is trial 152 with value: 0.9102139153966748.

Staphylococcus_Aureus | Oxacillin | Optuna:  81%|████████  | 162/200 [5:51:28<1:16:33, 120.87s/it, best=0.91][A
Staphylococcus_Aureus | Oxacillin | Optuna:  81%|████████  | 162/200 [5:51:28<1:16:33, 120.87s/it, best=0.91][A[I 2026-02-27 20:39:03,950] Trial 192 finished with value: 0.8254890260939106 and parameters: {'activation': 'tanh', 'solver': 'adam', 'lr': 0.0001221384856723628, 'layer1': 311, 'layer2': 482, 'layer3': 141}. Best is trial 91 with value: 0.8315336183309556.

Klebsiella_Pneumoniae | Ciprofloxacin | Optuna:  96%|█████████▋| 193/200 [5:51:33<10:33, 90.44s/it, best=0.832][A
Klebsiella_Pneumoniae | Ciprofloxacin | Optuna:  96%|█████████▋| 193/200 [5:51:33<10:33, 90.44s/it, best=0.832][A[I 2026-02-27 20:40:02,306] Trial 131 finished with value: 0.8642858328728196 and parameters: {'activation': 'relu', 'solver': 'adam', 'lr': 0.0003396903484117309, 'layer1': 452, 'layer2': 324, 'layer3': 40}. Best is trial 126 with value: 0.8664911301660769.

Pseudomonas_Aeruginosa | Imipenem | Optuna:  66%|██████▌   | 132/200 [2:07:56<1:31:32, 80.77s/it, best=0.867][A
Pseudomonas_Aeruginosa | Imipenem | Optuna:  66%|██████▌   | 132/200 [2:07:56<1:31:32, 80.77s/it, best=0.867][A[I 2026-02-27 20:40:38,556] Trial 193 finished with value: 0.8239409779847631 and parameters: {'activation': 'tanh', 'solver': 'adam', 'lr': 0.00016144856375884187, 'layer1': 337, 'layer2': 463, 'layer3': 139}. Best is trial 91 with value: 0.8315336183309556.

Klebsiella_Pneumoniae | Ciprofloxacin | Optuna:  97%|█████████▋| 194/200 [5:53:08<09:10, 91.69s/it, best=0.832][A
Klebsiella_Pneumoniae | Ciprofloxacin | Optuna:  97%|█████████▋| 194/200 [5:53:08<09:10, 91.69s/it, best=0.832][A[I 2026-02-27 20:41:20,294] Trial 162 finished with value: 0.9076837394803345 and parameters: {'activation': 'identity', 'solver': 'adam', 'lr': 0.00027763842802950895, 'layer1': 352, 'layer2': 424, 'layer3': 443}. Best is trial 152 with value: 0.9102139153966748.

Staphylococcus_Aureus | Oxacillin | Optuna:  82%|████████▏ | 163/200 [5:53:49<1:18:20, 127.05s/it, best=0.91][A
