Klebsiella_Pneumoniae | Ciprofloxacin | Optuna:  46%|████▋     | 93/200 [2:46:27<3:47:13, 127.41s/it, best=0.832][A[I 2026-02-27 17:34:50,977] Trial 155 finished with value: 0.8721452254649072 and parameters: {'activation': 'logistic', 'solver': 'adam', 'lr': 0.00020510410124446795, 'layer1': 292, 'layer2': 482, 'layer3': 398}. Best is trial 126 with value: 0.8764399491217574.

Pseudomonas_Aeruginosa | Ciprofloxacin | Optuna:  78%|███████▊  | 156/200 [2:47:20<59:55, 81.73s/it, best=0.876][A
Pseudomonas_Aeruginosa | Ciprofloxacin | Optuna:  78%|███████▊  | 156/200 [2:47:20<59:55, 81.73s/it, best=0.876][A[I 2026-02-27 17:35:00,437] Trial 62 finished with value: 0.8064988370241805 and parameters: {'activation': 'tanh', 'solver': 'adam', 'lr': 5.5426605636374385e-05, 'layer1': 135, 'layer2': 423, 'layer3': 21}. Best is trial 55 with value: 0.8076668303114959.

Escherichia_Coli | Ciprofloxacin | Optuna:  32%|███▏      | 63/200 [2:47:29<5:01:25, 132.01s/it, best=0.808][A
Escherichia_Coli | Ciprofloxacin | Optuna:  32%|███▏      | 63/200 [2:47:29<5:01:25, 132.01s/it, best=0.808][A[I 2026-02-27 17:36:06,057] Trial 156 finished with value: 0.8756136626875447 and parameters: {'activation': 'logistic', 'solver': 'adam', 'lr': 0.00029577644171463973, 'layer1': 318, 'layer2': 468, 'layer3': 414}. Best is trial 126 with value: 0.8764399491217574.

Pseudomonas_Aeruginosa | Ciprofloxacin | Optuna:  78%|███████▊  | 157/200 [2:48:35<57:08, 79.73s/it, best=0.876][A
Pseudomonas_Aeruginosa | Ciprofloxacin | Optuna:  78%|███████▊  | 157/200 [2:48:35<57:08, 79.73s/it, best=0.876][A[I 2026-02-27 17:36:21,581] Trial 93 finished with value: 0.8240034373504164 and parameters: {'activation': 'identity', 'solver': 'adam', 'lr': 6.556189082090278e-05, 'layer1': 389, 'layer2': 437, 'layer3': 163}. Best is trial 91 with value: 0.8315336183309556.

Klebsiella_Pneumoniae | Ciprofloxacin | Optuna:  47%|████▋     | 94/200 [2:48:51<3:53:29, 132.17s/it, best=0.832][A
Klebsiella_Pneumoniae | Ciprofloxacin | Optuna:  47%|████▋     | 94/200 [2:48:51<3:53:29, 132.17s/it, best=0.832][A[I 2026-02-27 17:36:28,021] Trial 76 finished with value: 0.9071100712326532 and parameters: {'activation': 'identity', 'solver': 'adam', 'lr': 3.862858330722955e-05, 'layer1': 324, 'layer2': 387, 'layer3': 33}. Best is trial 56 with value: 0.9091525983132491.

Staphylococcus_Aureus | Oxacillin | Optuna:  38%|███▊      | 77/200 [2:48:57<4:46:39, 139.84s/it, best=0.909][A
Staphylococcus_Aureus | Oxacillin | Optuna:  38%|███▊      | 77/200 [2:48:57<4:46:39, 139.84s/it, best=0.909][A[I 2026-02-27 17:36:35,246] Trial 157 finished with value: 0.8159756916186209 and parameters: {'activation': 'logistic', 'solver': 'adam', 'lr': 1.3459168397000321e-05, 'layer1': 321, 'layer2': 463, 'layer3': 345}. Best is trial 126 with value: 0.8764399491217574.

Pseudomonas_Aeruginosa | Ciprofloxacin | Optuna:  79%|███████▉  | 158/200 [2:49:04<45:11, 64.57s/it, best=0.876][A
Pseudomonas_Aeruginosa | Ciprofloxacin | Optuna:  79%|███████▉  | 158/200 [2:49:04<45:11, 64.57s/it, best=0.876][A[I 2026-02-27 17:36:40,692] Trial 63 finished with value: 0.8057981540847313 and parameters: {'activation': 'tanh', 'solver': 'adam', 'lr': 6.761156148116321e-05, 'layer1': 134, 'layer2': 366, 'layer3': 35}. Best is trial 55 with value: 0.8076668303114959.

Escherichia_Coli | Ciprofloxacin | Optuna:  32%|███▏      | 64/200 [2:49:10<4:37:38, 122.49s/it, best=0.808][A
Escherichia_Coli | Ciprofloxacin | Optuna:  32%|███▏      | 64/200 [2:49:10<4:37:38, 122.49s/it, best=0.808][A[I 2026-02-27 17:38:09,457] Trial 64 finished with value: 0.801020233615222 and parameters: {'activation': 'tanh', 'solver': 'adam', 'lr': 0.0001109202277851181, 'layer1': 121, 'layer2': 380, 'layer3': 50}. Best is trial 55 with value: 0.8076668303114959.

Escherichia_Coli | Ciprofloxacin | Optuna:  32%|███▎      | 65/200 [2:50:38<4:12:49, 112.37s/it, best=0.808][A
Escherichia_Coli | Ciprofloxacin | Optuna:  32%|███▎      | 65/200 [2:50:38<4:12:49, 112.37s/it, best=0.808][A[I 2026-02-27 17:38:15,438] Trial 158 finished with value: 0.8744333509806154 and parameters: {'activation': 'logistic', 'solver': 'adam', 'lr': 0.00025401345524413946, 'layer1': 467, 'layer2': 407, 'layer3': 383}. Best is trial 126 with value: 0.8764399491217574.

Pseudomonas_Aeruginosa | Ciprofloxacin | Optuna:  80%|███████▉  | 159/200 [2:50:45<51:25, 75.26s/it, best=0.876][A
Pseudomonas_Aeruginosa | Ciprofloxacin | Optuna:  80%|███████▉  | 159/200 [2:50:45<51:25, 75.26s/it, best=0.876][A[I 2026-02-27 17:38:30,515] Trial 94 finished with value: 0.8253195539069809 and parameters: {'activation': 'identity', 'solver': 'adam', 'lr': 8.693922137979477e-05, 'layer1': 301, 'layer2': 490, 'layer3': 251}. Best is trial 91 with value: 0.8315336183309556.

Klebsiella_Pneumoniae | Ciprofloxacin | Optuna:  48%|████▊     | 95/200 [2:51:00<3:49:35, 131.20s/it, best=0.832][A
Klebsiella_Pneumoniae | Ciprofloxacin | Optuna:  48%|████▊     | 95/200 [2:51:00<3:49:35, 131.20s/it, best=0.832][A[I 2026-02-27 17:39:37,677] Trial 77 finished with value: 0.8981562068169984 and parameters: {'activation': 'identity', 'solver': 'adam', 'lr': 1.300484693393287e-05, 'layer1': 397, 'layer2': 60, 'layer3': 348}. Best is trial 56 with value: 0.9091525983132491.

Staphylococcus_Aureus | Oxacillin | Optuna:  39%|███▉      | 78/200 [2:52:07<5:14:43, 154.78s/it, best=0.909][A
Staphylococcus_Aureus | Oxacillin | Optuna:  39%|███▉      | 78/200 [2:52:07<5:14:43, 154.78s/it, best=0.909][A[I 2026-02-27 17:39:59,717] Trial 159 finished with value: 0.8667620995929308 and parameters: {'activation': 'logistic', 'solver': 'adam', 'lr': 0.00013114125219221992, 'layer1': 467, 'layer2': 474, 'layer3': 381}. Best is trial 126 with value: 0.8764399491217574.

Pseudomonas_Aeruginosa | Ciprofloxacin | Optuna:  80%|████████  | 160/200 [2:52:29<55:58, 83.96s/it, best=0.876][A
Pseudomonas_Aeruginosa | Ciprofloxacin | Optuna:  80%|████████  | 160/200 [2:52:29<55:58, 83.96s/it, best=0.876][A[I 2026-02-27 17:40:08,684] Trial 65 finished with value: 0.805554356023455 and parameters: {'activation': 'tanh', 'solver': 'adam', 'lr': 6.941276169515247e-05, 'layer1': 149, 'layer2': 357, 'layer3': 23}. Best is trial 55 with value: 0.8076668303114959.

Escherichia_Coli | Ciprofloxacin | Optuna:  33%|███▎      | 66/200 [2:52:38<4:15:33, 114.43s/it, best=0.808][A
Escherichia_Coli | Ciprofloxacin | Optuna:  33%|███▎      | 66/200 [2:52:38<4:15:33, 114.43s/it, best=0.808][A[I 2026-02-27 17:41:01,985] Trial 95 finished with value: 0.8233868400162512 and parameters: {'activation': 'identity', 'solver': 'adam', 'lr': 3.1364349530544e-05, 'layer1': 371, 'layer2': 470, 'layer3': 212}. Best is trial 91 with value: 0.8315336183309556.

Klebsiella_Pneumoniae | Ciprofloxacin | Optuna:  48%|████▊     | 96/200 [2:53:31<3:57:56, 137.28s/it, best=0.832][A
Klebsiella_Pneumoniae | Ciprofloxacin | Optuna:  48%|████▊     | 96/200 [2:53:31<3:57:56, 137.28s/it, best=0.832][A[I 2026-02-27 17:41:24,105] Trial 78 finished with value: 0.9024675923279328 and parameters: {'activation': 'identity', 'solver': 'adam', 'lr': 8.512035157324778e-05, 'layer1': 307, 'layer2': 346, 'layer3': 419}. Best is trial 56 with value: 0.9091525983132491.

Staphylococcus_Aureus | Oxacillin | Optuna:  40%|███▉      | 79/200 [2:53:53<4:42:53, 140.28s/it, best=0.909][A
Staphylococcus_Aureus | Oxacillin | Optuna:  40%|███▉      | 79/200 [2:53:53<4:42:53, 140.28s/it, best=0.909][A[I 2026-02-27 17:41:35,131] Trial 160 finished with value: 0.8738205578433533 and parameters: {'activation': 'logistic', 'solver': 'adam', 'lr': 0.00025627196504017947, 'layer1': 456, 'layer2': 489, 'layer3': 412}. Best is trial 126 with value: 0.8764399491217574.

Pseudomonas_Aeruginosa | Ciprofloxacin | Optuna:  80%|████████  | 161/200 [2:54:04<56:48, 87.40s/it, best=0.876][A
Pseudomonas_Aeruginosa | Ciprofloxacin | Optuna:  80%|████████  | 161/200 [2:54:04<56:48, 87.40s/it, best=0.876][A[I 2026-02-27 17:41:44,159] Trial 66 finished with value: 0.805647750215404 and parameters: {'activation': 'tanh', 'solver': 'adam', 'lr': 7.069080802830594e-05, 'layer1': 154, 'layer2': 282, 'layer3': 25}. Best is trial 55 with value: 0.8076668303114959.

Escherichia_Coli | Ciprofloxacin | Optuna:  34%|███▎      | 67/200 [2:54:13<4:01:02, 108.74s/it, best=0.808][A
Escherichia_Coli | Ciprofloxacin | Optuna:  34%|███▎      | 67/200 [2:54:13<4:01:02, 108.74s/it, best=0.808][A[I 2026-02-27 17:42:53,076] Trial 161 finished with value: 0.87330818359564 and parameters: {'activation': 'logistic', 'solver': 'adam', 'lr': 0.0003977897530121512, 'layer1': 311, 'layer2': 409, 'layer3': 391}. Best is trial 126 with value: 0.8764399491217574.

Pseudomonas_Aeruginosa | Ciprofloxacin | Optuna:  81%|████████  | 162/200 [2:55:22<53:33, 84.56s/it, best=0.876][A
Pseudomonas_Aeruginosa | Ciprofloxacin | Optuna:  81%|████████  | 162/200 [2:55:22<53:33, 84.56s/it, best=0.876][A[I 2026-02-27 17:42:53,591] Trial 96 finished with value: 0.8202288802505671 and parameters: {'activation': 'identity', 'solver': 'adam', 'lr': 2.7298012097461943e-05, 'layer1': 288, 'layer2': 349, 'layer3': 234}. Best is trial 91 with value: 0.8315336183309556.

Klebsiella_Pneumoniae | Ciprofloxacin | Optuna:  48%|████▊     | 97/200 [2:55:23<3:42:26, 129.58s/it, best=0.832][A
Klebsiella_Pneumoniae | Ciprofloxacin | Optuna:  48%|████▊     | 97/200 [2:55:23<3:42:26, 129.58s/it, best=0.832][A[I 2026-02-27 17:43:16,021] Trial 67 finished with value: 0.8026833695711408 and parameters: {'activation': 'tanh', 'solver': 'adam', 'lr': 0.0001605106743341462, 'layer1': 82, 'layer2': 274, 'layer3': 16}. Best is trial 55 with value: 0.8076668303114959.

Escherichia_Coli | Ciprofloxacin | Optuna:  34%|███▍      | 68/200 [2:55:45<3:48:05, 103.68s/it, best=0.808][A
Escherichia_Coli | Ciprofloxacin | Optuna:  34%|███▍      | 68/200 [2:55:45<3:48:05, 103.68s/it, best=0.808][A[I 2026-02-27 17:43:37,361] Trial 79 finished with value: 0.7283266599919387 and parameters: {'activation': 'tanh', 'solver': 'sgd', 'lr': 0.00013639299571443017, 'layer1': 372, 'layer2': 453, 'layer3': 464}. Best is trial 56 with value: 0.9091525983132491.

Staphylococcus_Aureus | Oxacillin | Optuna:  40%|████      | 80/200 [2:56:07<4:36:20, 138.17s/it, best=0.909][A
Staphylococcus_Aureus | Oxacillin | Optuna:  40%|████      | 80/200 [2:56:07<4:36:20, 138.17s/it, best=0.909][A[I 2026-02-27 17:44:25,597] Trial 162 finished with value: 0.8740893226329038 and parameters: {'activation': 'logistic', 'solver': 'adam', 'lr': 0.0002948944844253331, 'layer1': 472, 'layer2': 397, 'layer3': 406}. Best is trial 126 with value: 0.8764399491217574.

Pseudomonas_Aeruginosa | Ciprofloxacin | Optuna:  82%|████████▏ | 163/200 [2:56:55<53:37, 86.95s/it, best=0.876][A
Pseudomonas_Aeruginosa | Ciprofloxacin | Optuna:  82%|████████▏ | 163/200 [2:56:55<53:37, 86.95s/it, best=0.876][A[I 2026-02-27 17:44:56,676] Trial 68 finished with value: 0.7940959695216481 and parameters: {'activation': 'tanh', 'solver': 'adam', 'lr': 0.0003565732127845712, 'layer1': 138, 'layer2': 336, 'layer3': 92}. Best is trial 55 with value: 0.8076668303114959.

Escherichia_Coli | Ciprofloxacin | Optuna:  34%|███▍      | 69/200 [2:57:26<3:44:22, 102.77s/it, best=0.808][A
Escherichia_Coli | Ciprofloxacin | Optuna:  34%|███▍      | 69/200 [2:57:26<3:44:22, 102.77s/it, best=0.808][A[I 2026-02-27 17:45:14,989] Trial 97 finished with value: 0.8263869917891405 and parameters: {'activation': 'identity', 'solver': 'adam', 'lr': 4.8383198628552056e-05, 'layer1': 445, 'layer2': 444, 'layer3': 279}. Best is trial 91 with value: 0.8315336183309556.

Klebsiella_Pneumoniae | Ciprofloxacin | Optuna:  49%|████▉     | 98/200 [2:57:44<3:46:18, 133.12s/it, best=0.832][A
Klebsiella_Pneumoniae | Ciprofloxacin | Optuna:  49%|████▉     | 98/200 [2:57:44<3:46:18, 133.12s/it, best=0.832][A[I 2026-02-27 17:45:51,503] Trial 80 finished with value: 0.9060543513289133 and parameters: {'activation': 'identity', 'solver': 'adam', 'lr': 0.0006866177785144022, 'layer1': 354, 'layer2': 312, 'layer3': 492}. Best is trial 56 with value: 0.9091525983132491.

Staphylococcus_Aureus | Oxacillin | Optuna:  40%|████      | 81/200 [2:58:21<4:31:38, 136.96s/it, best=0.909][A
Staphylococcus_Aureus | Oxacillin | Optuna:  40%|████      | 81/200 [2:58:21<4:31:38, 136.96s/it, best=0.909][A[I 2026-02-27 17:46:15,262] Trial 163 finished with value: 0.8745356791154176 and parameters: {'activation': 'logistic', 'solver': 'adam', 'lr': 0.00021579700914050906, 'layer1': 417, 'layer2': 425, 'layer3': 439}. Best is trial 126 with value: 0.8764399491217574.

Pseudomonas_Aeruginosa | Ciprofloxacin | Optuna:  82%|████████▏ | 164/200 [2:58:44<56:15, 93.76s/it, best=0.876][A
Pseudomonas_Aeruginosa | Ciprofloxacin | Optuna:  82%|████████▏ | 164/200 [2:58:44<56:15, 93.76s/it, best=0.876][A[I 2026-02-27 17:46:32,959] Trial 69 finished with value: 0.8041861817763982 and parameters: {'activation': 'tanh', 'solver': 'adam', 'lr': 7.910112753971392e-05, 'layer1': 180, 'layer2': 295, 'layer3': 40}. Best is trial 55 with value: 0.8076668303114959.

Escherichia_Coli | Ciprofloxacin | Optuna:  35%|███▌      | 70/200 [2:59:02<3:38:27, 100.82s/it, best=0.808][A
Escherichia_Coli | Ciprofloxacin | Optuna:  35%|███▌      | 70/200 [2:59:02<3:38:27, 100.82s/it, best=0.808][A[I 2026-02-27 17:47:09,522] Trial 98 finished with value: 0.8249784905031758 and parameters: {'activation': 'identity', 'solver': 'adam', 'lr': 0.0010369794168165827, 'layer1': 356, 'layer2': 500, 'layer3': 159}. Best is trial 91 with value: 0.8315336183309556.

Klebsiella_Pneumoniae | Ciprofloxacin | Optuna:  50%|████▉     | 99/200 [2:59:39<3:34:42, 127.55s/it, best=0.832][A
Klebsiella_Pneumoniae | Ciprofloxacin | Optuna:  50%|████▉     | 99/200 [2:59:39<3:34:42, 127.55s/it, best=0.832][A[I 2026-02-27 17:47:27,120] Trial 81 finished with value: 0.9024176180515697 and parameters: {'activation': 'identity', 'solver': 'adam', 'lr': 0.000246369149756243, 'layer1': 322, 'layer2': 426, 'layer3': 432}. Best is trial 56 with value: 0.9091525983132491.

Staphylococcus_Aureus | Oxacillin | Optuna:  41%|████      | 82/200 [2:59:56<4:04:57, 124.56s/it, best=0.909][A
Staphylococcus_Aureus | Oxacillin | Optuna:  41%|████      | 82/200 [2:59:56<4:04:57, 124.56s/it, best=0.909][A[I 2026-02-27 17:47:38,657] Trial 70 finished with value: 0.608967484341316 and parameters: {'activation': 'tanh', 'solver': 'sgd', 'lr': 5.407828293014895e-05, 'layer1': 54, 'layer2': 201, 'layer3': 55}. Best is trial 55 with value: 0.8076668303114959.

Escherichia_Coli | Ciprofloxacin | Optuna:  36%|███▌      | 71/200 [3:00:08<3:14:06, 90.29s/it, best=0.808] [A
Escherichia_Coli | Ciprofloxacin | Optuna:  36%|███▌      | 71/200 [3:00:08<3:14:06, 90.29s/it, best=0.808][A[I 2026-02-27 17:47:57,669] Trial 164 finished with value: 0.8734783342763748 and parameters: {'activation': 'logistic', 'solver': 'adam', 'lr': 0.00016081126379317918, 'layer1': 430, 'layer2': 429, 'layer3': 440}. Best is trial 126 with value: 0.8764399491217574.

Pseudomonas_Aeruginosa | Ciprofloxacin | Optuna:  82%|████████▎ | 165/200 [3:00:27<56:12, 96.36s/it, best=0.876][A
Pseudomonas_Aeruginosa | Ciprofloxacin | Optuna:  82%|████████▎ | 165/200 [3:00:27<56:12, 96.36s/it, best=0.876][A[I 2026-02-27 17:48:22,351] Trial 99 finished with value: 0.6875577517831232 and parameters: {'activation': 'identity', 'solver': 'sgd', 'lr': 6.383049014660767e-05, 'layer1': 418, 'layer2': 271, 'layer3': 117}. Best is trial 91 with value: 0.8315336183309556.

Klebsiella_Pneumoniae | Ciprofloxacin | Optuna:  50%|█████     | 100/200 [3:00:51<3:05:13, 111.13s/it, best=0.832][A
Klebsiella_Pneumoniae | Ciprofloxacin | Optuna:  50%|█████     | 100/200 [3:00:51<3:05:13, 111.13s/it, best=0.832][A[I 2026-02-27 17:49:22,372] Trial 82 finished with value: 0.9040837278049306 and parameters: {'activation': 'identity', 'solver': 'adam', 'lr': 0.00016272598737921331, 'layer1': 294, 'layer2': 431, 'layer3': 444}. Best is trial 56 with value: 0.9091525983132491.

Staphylococcus_Aureus | Oxacillin | Optuna:  42%|████▏     | 83/200 [3:01:52<3:57:26, 121.77s/it, best=0.909][A
Staphylococcus_Aureus | Oxacillin | Optuna:  42%|████▏     | 83/200 [3:01:52<3:57:26, 121.77s/it, best=0.909][A[I 2026-02-27 17:49:30,840] Trial 71 finished with value: 0.8061739449116525 and parameters: {'activation': 'tanh', 'solver': 'adam', 'lr': 8.778027184184946e-05, 'layer1': 149, 'layer2': 361, 'layer3': 12}. Best is trial 55 with value: 0.8076668303114959.

Escherichia_Coli | Ciprofloxacin | Optuna:  36%|███▌      | 72/200 [3:02:00<3:26:37, 96.86s/it, best=0.808][A
Escherichia_Coli | Ciprofloxacin | Optuna:  36%|███▌      | 72/200 [3:02:00<3:26:37, 96.86s/it, best=0.808][A[I 2026-02-27 17:49:32,115] Trial 165 finished with value: 0.8718118652060529 and parameters: {'activation': 'logistic', 'solver': 'adam', 'lr': 0.000202879653275768, 'layer1': 418, 'layer2': 446, 'layer3': 416}. Best is trial 126 with value: 0.8764399491217574.

Pseudomonas_Aeruginosa | Ciprofloxacin | Optuna:  83%|████████▎ | 166/200 [3:02:01<54:16, 95.78s/it, best=0.876][A
Pseudomonas_Aeruginosa | Ciprofloxacin | Optuna:  83%|████████▎ | 166/200 [3:02:01<54:16, 95.78s/it, best=0.876][A[I 2026-02-27 17:51:00,226] Trial 72 finished with value: 0.799849454047325 and parameters: {'activation': 'tanh', 'solver': 'adam', 'lr': 0.00012282802705123816, 'layer1': 159, 'layer2': 258, 'layer3': 33}. Best is trial 55 with value: 0.8076668303114959.

Escherichia_Coli | Ciprofloxacin | Optuna:  36%|███▋      | 73/200 [3:03:29<3:20:16, 94.61s/it, best=0.808][A
Escherichia_Coli | Ciprofloxacin | Optuna:  36%|███▋      | 73/200 [3:03:29<3:20:16, 94.61s/it, best=0.808][A[I 2026-02-27 17:51:08,749] Trial 166 finished with value: 0.8733319060604747 and parameters: {'activation': 'logistic', 'solver': 'adam', 'lr': 0.00028761279956400075, 'layer1': 439, 'layer2': 364, 'layer3': 376}. Best is trial 126 with value: 0.8764399491217574.

Pseudomonas_Aeruginosa | Ciprofloxacin | Optuna:  84%|████████▎ | 167/200 [3:03:38<52:49, 96.04s/it, best=0.876][A
Pseudomonas_Aeruginosa | Ciprofloxacin | Optuna:  84%|████████▎ | 167/200 [3:03:38<52:49, 96.04s/it, best=0.876][A[I 2026-02-27 17:51:24,412] Trial 100 finished with value: 0.8276131982495123 and parameters: {'activation': 'identity', 'solver': 'adam', 'lr': 2.0998459373585704e-05, 'layer1': 476, 'layer2': 408, 'layer3': 199}. Best is trial 91 with value: 0.8315336183309556.

Klebsiella_Pneumoniae | Ciprofloxacin | Optuna:  50%|█████     | 101/200 [3:03:53<3:38:28, 132.41s/it, best=0.832][A
Klebsiella_Pneumoniae | Ciprofloxacin | Optuna:  50%|█████     | 101/200 [3:03:53<3:38:28, 132.41s/it, best=0.832][A[I 2026-02-27 17:51:56,090] Trial 83 finished with value: 0.9091795188393892 and parameters: {'activation': 'identity', 'solver': 'adam', 'lr': 0.00010057287075115961, 'layer1': 274, 'layer2': 409, 'layer3': 391}. Best is trial 83 with value: 0.9091795188393892.

Staphylococcus_Aureus | Oxacillin | Optuna:  42%|████▏     | 84/200 [3:04:25<4:13:56, 131.35s/it, best=0.909][A
Staphylococcus_Aureus | Oxacillin | Optuna:  42%|████▏     | 84/200 [3:04:25<4:13:56, 131.35s/it, best=0.909][A[I 2026-02-27 17:52:19,497] Trial 73 finished with value: 0.8008629774238344 and parameters: {'activation': 'tanh', 'solver': 'adam', 'lr': 0.0001993734661140103, 'layer1': 118, 'layer2': 366, 'layer3': 15}. Best is trial 55 with value: 0.8076668303114959.

Escherichia_Coli | Ciprofloxacin | Optuna:  37%|███▋      | 74/200 [3:04:48<3:09:01, 90.01s/it, best=0.808][A
Escherichia_Coli | Ciprofloxacin | Optuna:  37%|███▋      | 74/200 [3:04:48<3:09:01, 90.01s/it, best=0.808][A[I 2026-02-27 17:52:47,831] Trial 167 finished with value: 0.8713232978820363 and parameters: {'activation': 'logistic', 'solver': 'adam', 'lr': 0.00021281272435893315, 'layer1': 415, 'layer2': 408, 'layer3': 432}. Best is trial 126 with value: 0.8764399491217574.

Pseudomonas_Aeruginosa | Ciprofloxacin | Optuna:  84%|████████▍ | 168/200 [3:05:17<51:42, 96.95s/it, best=0.876][A
Pseudomonas_Aeruginosa | Ciprofloxacin | Optuna:  84%|████████▍ | 168/200 [3:05:17<51:42, 96.95s/it, best=0.876][A[I 2026-02-27 17:53:13,115] Trial 168 finished with value: 0.8159756916186209 and parameters: {'activation': 'logistic', 'solver': 'sgd', 'lr': 0.00024061895509891156, 'layer1': 450, 'layer2': 462, 'layer3': 394}. Best is trial 126 with value: 0.8764399491217574.

Pseudomonas_Aeruginosa | Ciprofloxacin | Optuna:  84%|████████▍ | 169/200 [3:05:42<38:58, 75.45s/it, best=0.876][A
Pseudomonas_Aeruginosa | Ciprofloxacin | Optuna:  84%|████████▍ | 169/200 [3:05:42<38:58, 75.45s/it, best=0.876][A[I 2026-02-27 17:54:13,499] Trial 169 finished with value: 0.872364009983831 and parameters: {'activation': 'tanh', 'solver': 'adam', 'lr': 0.0001669263251574633, 'layer1': 284, 'layer2': 436, 'layer3': 417}. Best is trial 126 with value: 0.8764399491217574.

Pseudomonas_Aeruginosa | Ciprofloxacin | Optuna:  85%|████████▌ | 170/200 [3:06:43<35:27, 70.93s/it, best=0.876][A
Pseudomonas_Aeruginosa | Ciprofloxacin | Optuna:  85%|████████▌ | 170/200 [3:06:43<35:27, 70.93s/it, best=0.876][A[I 2026-02-27 17:54:19,940] Trial 101 finished with value: 0.8216068371547136 and parameters: {'activation': 'identity', 'solver': 'adam', 'lr': 2.234034649837244e-05, 'layer1': 469, 'layer2': 406, 'layer3': 199}. Best is trial 91 with value: 0.8315336183309556.

Klebsiella_Pneumoniae | Ciprofloxacin | Optuna:  51%|█████     | 102/200 [3:06:49<3:57:23, 145.35s/it, best=0.832][A
