Klebsiella_Pneumoniae | LPS | Optuna:  48%|████▊     | 97/200 [2:28:26<2:59:12, 104.39s/it, best=0.926]Klebsiella_Pneumoniae | LPS | Optuna:  48%|████▊     | 97/200 [2:28:26<2:59:12, 104.39s/it, best=0.926][I 2026-02-28 11:16:53,552] Trial 90 finished with value: 0.9102517055169317 and parameters: {'activation': 'relu', 'solver': 'adam', 'lr': 0.0007992670748237816, 'layer1': 274, 'layer2': 258, 'layer3': 213}. Best is trial 74 with value: 0.9166002918687234.

Escherichia_Coli | Piperacillin-Tazobactam | Optuna:  46%|████▌     | 91/200 [3:12:46<3:18:13, 109.11s/it, best=0.917][A
Escherichia_Coli | Piperacillin-Tazobactam | Optuna:  46%|████▌     | 91/200 [3:12:46<3:18:13, 109.11s/it, best=0.917][A[I 2026-02-28 11:17:34,165] Trial 84 finished with value: 0.8840415546053885 and parameters: {'activation': 'identity', 'solver': 'adam', 'lr': 0.00021226776966490807, 'layer1': 343, 'layer2': 359, 'layer3': 336}. Best is trial 8 with value: 0.8879562150966016.
Staphylococcus_Aureus | LPS | Optuna:  42%|████▎     | 85/200 [3:11:20<4:31:20, 141.57s/it, best=0.888]Staphylococcus_Aureus | LPS | Optuna:  42%|████▎     | 85/200 [3:11:20<4:31:20, 141.57s/it, best=0.888][I 2026-02-28 11:17:58,429] Trial 144 finished with value: 0.8551932281907888 and parameters: {'activation': 'identity', 'solver': 'adam', 'lr': 2.2532228609293233e-05, 'layer1': 407, 'layer2': 328, 'layer3': 188}. Best is trial 102 with value: 0.8672439264969375.
Pseudomonas_Aeruginosa | DirectMulti | Optuna:  72%|███████▎  | 145/200 [4:21:44<1:59:30, 130.38s/it, best=0.867]Pseudomonas_Aeruginosa | DirectMulti | Optuna:  72%|███████▎  | 145/200 [4:21:44<1:59:30, 130.38s/it, best=0.867]/export/usuarios01/egarroyo/MALDI_for_AMR_prediction/venv/lib/python3.13/site-packages/sklearn/model_selection/_split.py:813: UserWarning: The least populated class in y has only 4 members, which is less than n_splits=5.
  warnings.warn(
[I 2026-02-28 11:18:10,347] Trial 97 finished with value: 0.923890716562504 and parameters: {'activation': 'identity', 'solver': 'adam', 'lr': 0.00027538878772861937, 'layer1': 423, 'layer2': 336, 'layer3': 100}. Best is trial 71 with value: 0.9257111996592865.
Klebsiella_Pneumoniae | LPS | Optuna:  49%|████▉     | 98/200 [2:30:26<3:05:26, 109.09s/it, best=0.926]Klebsiella_Pneumoniae | LPS | Optuna:  49%|████▉     | 98/200 [2:30:26<3:05:26, 109.09s/it, best=0.926][I 2026-02-28 11:18:41,029] Trial 91 finished with value: 0.9128176730343094 and parameters: {'activation': 'relu', 'solver': 'adam', 'lr': 0.0009423723727585765, 'layer1': 305, 'layer2': 189, 'layer3': 79}. Best is trial 74 with value: 0.9166002918687234.

Escherichia_Coli | Piperacillin-Tazobactam | Optuna:  46%|████▌     | 92/200 [3:14:33<3:15:31, 108.62s/it, best=0.917][A
Escherichia_Coli | Piperacillin-Tazobactam | Optuna:  46%|████▌     | 92/200 [3:14:33<3:15:31, 108.62s/it, best=0.917][A[I 2026-02-28 11:20:14,951] Trial 85 finished with value: 0.887186470826894 and parameters: {'activation': 'identity', 'solver': 'adam', 'lr': 0.00048062612213937544, 'layer1': 318, 'layer2': 396, 'layer3': 300}. Best is trial 8 with value: 0.8879562150966016.
Staphylococcus_Aureus | LPS | Optuna:  43%|████▎     | 86/200 [3:14:01<4:39:55, 147.33s/it, best=0.888]Staphylococcus_Aureus | LPS | Optuna:  43%|████▎     | 86/200 [3:14:01<4:39:55, 147.33s/it, best=0.888][I 2026-02-28 11:20:16,368] Trial 98 finished with value: 0.9236174539558476 and parameters: {'activation': 'identity', 'solver': 'adam', 'lr': 6.911640365221457e-05, 'layer1': 476, 'layer2': 241, 'layer3': 253}. Best is trial 71 with value: 0.9257111996592865.
Klebsiella_Pneumoniae | LPS | Optuna:  50%|████▉     | 99/200 [2:32:32<3:12:10, 114.17s/it, best=0.926]Klebsiella_Pneumoniae | LPS | Optuna:  50%|████▉     | 99/200 [2:32:32<3:12:10, 114.17s/it, best=0.926][I 2026-02-28 11:20:23,683] Trial 145 finished with value: 0.8628781945664613 and parameters: {'activation': 'identity', 'solver': 'adam', 'lr': 3.0039601198988574e-05, 'layer1': 450, 'layer2': 405, 'layer3': 197}. Best is trial 102 with value: 0.8672439264969375.
Pseudomonas_Aeruginosa | DirectMulti | Optuna:  73%|███████▎  | 146/200 [4:24:09<2:01:21, 134.84s/it, best=0.867]Pseudomonas_Aeruginosa | DirectMulti | Optuna:  73%|███████▎  | 146/200 [4:24:09<2:01:21, 134.84s/it, best=0.867]/export/usuarios01/egarroyo/MALDI_for_AMR_prediction/venv/lib/python3.13/site-packages/sklearn/model_selection/_split.py:813: UserWarning: The least populated class in y has only 4 members, which is less than n_splits=5.
  warnings.warn(
[I 2026-02-28 11:20:53,201] Trial 99 finished with value: 0.8707211362928258 and parameters: {'activation': 'identity', 'solver': 'sgd', 'lr': 0.00030913777293260135, 'layer1': 42, 'layer2': 358, 'layer3': 27}. Best is trial 71 with value: 0.9257111996592865.
Klebsiella_Pneumoniae | LPS | Optuna:  50%|█████     | 100/200 [2:33:09<2:31:36, 90.97s/it, best=0.926]Klebsiella_Pneumoniae | LPS | Optuna:  50%|█████     | 100/200 [2:33:09<2:31:36, 90.97s/it, best=0.926][I 2026-02-28 11:21:10,534] Trial 92 finished with value: 0.913791372503475 and parameters: {'activation': 'relu', 'solver': 'adam', 'lr': 0.00011993469027455073, 'layer1': 350, 'layer2': 249, 'layer3': 111}. Best is trial 74 with value: 0.9166002918687234.

Escherichia_Coli | Piperacillin-Tazobactam | Optuna:  46%|████▋     | 93/200 [3:17:03<3:35:34, 120.89s/it, best=0.917][A
Escherichia_Coli | Piperacillin-Tazobactam | Optuna:  46%|████▋     | 93/200 [3:17:03<3:35:34, 120.89s/it, best=0.917][A[I 2026-02-28 11:22:21,486] Trial 86 finished with value: 0.887088960692265 and parameters: {'activation': 'identity', 'solver': 'adam', 'lr': 0.00046827237783629675, 'layer1': 280, 'layer2': 100, 'layer3': 305}. Best is trial 8 with value: 0.8879562150966016.
Staphylococcus_Aureus | LPS | Optuna:  44%|████▎     | 87/200 [3:16:07<4:25:43, 141.09s/it, best=0.888]Staphylococcus_Aureus | LPS | Optuna:  44%|████▎     | 87/200 [3:16:07<4:25:43, 141.09s/it, best=0.888][I 2026-02-28 11:22:22,752] Trial 146 finished with value: 0.8639404389972538 and parameters: {'activation': 'identity', 'solver': 'adam', 'lr': 5.809960069125994e-05, 'layer1': 488, 'layer2': 372, 'layer3': 160}. Best is trial 102 with value: 0.8672439264969375.
Pseudomonas_Aeruginosa | DirectMulti | Optuna:  74%|███████▎  | 147/200 [4:26:09<1:54:55, 130.11s/it, best=0.867]Pseudomonas_Aeruginosa | DirectMulti | Optuna:  74%|███████▎  | 147/200 [4:26:09<1:54:55, 130.11s/it, best=0.867]/export/usuarios01/egarroyo/MALDI_for_AMR_prediction/venv/lib/python3.13/site-packages/sklearn/model_selection/_split.py:813: UserWarning: The least populated class in y has only 4 members, which is less than n_splits=5.
  warnings.warn(
[I 2026-02-28 11:23:05,195] Trial 93 finished with value: 0.9138852342684481 and parameters: {'activation': 'relu', 'solver': 'adam', 'lr': 0.0003823953985105923, 'layer1': 374, 'layer2': 279, 'layer3': 17}. Best is trial 74 with value: 0.9166002918687234.

Escherichia_Coli | Piperacillin-Tazobactam | Optuna:  47%|████▋     | 94/200 [3:18:57<3:30:16, 119.02s/it, best=0.917][A
Escherichia_Coli | Piperacillin-Tazobactam | Optuna:  47%|████▋     | 94/200 [3:18:57<3:30:16, 119.02s/it, best=0.917][A[I 2026-02-28 11:23:37,114] Trial 100 finished with value: 0.8963353577033051 and parameters: {'activation': 'identity', 'solver': 'adam', 'lr': 3.712230363602767e-06, 'layer1': 395, 'layer2': 192, 'layer3': 180}. Best is trial 71 with value: 0.9257111996592865.
Klebsiella_Pneumoniae | LPS | Optuna:  50%|█████     | 101/200 [2:35:53<3:06:12, 112.85s/it, best=0.926]Klebsiella_Pneumoniae | LPS | Optuna:  50%|█████     | 101/200 [2:35:53<3:06:12, 112.85s/it, best=0.926][I 2026-02-28 11:24:28,368] Trial 87 finished with value: 0.8857381705935066 and parameters: {'activation': 'identity', 'solver': 'adam', 'lr': 0.0008194667524589403, 'layer1': 262, 'layer2': 395, 'layer3': 299}. Best is trial 8 with value: 0.8879562150966016.
Staphylococcus_Aureus | LPS | Optuna:  44%|████▍     | 88/200 [3:18:14<4:15:24, 136.83s/it, best=0.888]Staphylococcus_Aureus | LPS | Optuna:  44%|████▍     | 88/200 [3:18:14<4:15:24, 136.83s/it, best=0.888][I 2026-02-28 11:24:46,858] Trial 94 finished with value: 0.912724989387025 and parameters: {'activation': 'relu', 'solver': 'adam', 'lr': 0.0019334142223083539, 'layer1': 211, 'layer2': 240, 'layer3': 103}. Best is trial 74 with value: 0.9166002918687234.

Escherichia_Coli | Piperacillin-Tazobactam | Optuna:  48%|████▊     | 95/200 [3:20:39<3:19:10, 113.81s/it, best=0.917][A
Escherichia_Coli | Piperacillin-Tazobactam | Optuna:  48%|████▊     | 95/200 [3:20:39<3:19:10, 113.81s/it, best=0.917][A[I 2026-02-28 11:24:50,481] Trial 101 finished with value: 0.9242690651030383 and parameters: {'activation': 'identity', 'solver': 'adam', 'lr': 0.0002198136763651852, 'layer1': 25, 'layer2': 262, 'layer3': 82}. Best is trial 71 with value: 0.9257111996592865.
Klebsiella_Pneumoniae | LPS | Optuna:  51%|█████     | 102/200 [2:37:06<2:44:58, 101.01s/it, best=0.926]Klebsiella_Pneumoniae | LPS | Optuna:  51%|█████     | 102/200 [2:37:06<2:44:58, 101.01s/it, best=0.926][I 2026-02-28 11:24:52,015] Trial 147 finished with value: 0.8510807152912554 and parameters: {'activation': 'identity', 'solver': 'adam', 'lr': 1.3608824726064872e-05, 'layer1': 438, 'layer2': 394, 'layer3': 213}. Best is trial 102 with value: 0.8672439264969375.
Pseudomonas_Aeruginosa | DirectMulti | Optuna:  74%|███████▍  | 148/200 [4:28:38<1:57:44, 135.85s/it, best=0.867]Pseudomonas_Aeruginosa | DirectMulti | Optuna:  74%|███████▍  | 148/200 [4:28:38<1:57:44, 135.85s/it, best=0.867]/export/usuarios01/egarroyo/MALDI_for_AMR_prediction/venv/lib/python3.13/site-packages/sklearn/model_selection/_split.py:813: UserWarning: The least populated class in y has only 4 members, which is less than n_splits=5.
  warnings.warn(
[I 2026-02-28 11:26:02,068] Trial 102 finished with value: 0.9234089212062097 and parameters: {'activation': 'identity', 'solver': 'adam', 'lr': 0.00023439351956838184, 'layer1': 11, 'layer2': 272, 'layer3': 56}. Best is trial 71 with value: 0.9257111996592865.
Klebsiella_Pneumoniae | LPS | Optuna:  52%|█████▏    | 103/200 [2:38:18<2:29:01, 92.18s/it, best=0.926] Klebsiella_Pneumoniae | LPS | Optuna:  52%|█████▏    | 103/200 [2:38:18<2:29:01, 92.18s/it, best=0.926][I 2026-02-28 11:26:04,965] Trial 88 finished with value: 0.8816103325907456 and parameters: {'activation': 'logistic', 'solver': 'adam', 'lr': 0.0010410519758732115, 'layer1': 279, 'layer2': 245, 'layer3': 272}. Best is trial 8 with value: 0.8879562150966016.
Staphylococcus_Aureus | LPS | Optuna:  44%|████▍     | 89/200 [3:19:51<3:50:48, 124.76s/it, best=0.888]Staphylococcus_Aureus | LPS | Optuna:  44%|████▍     | 89/200 [3:19:51<3:50:48, 124.76s/it, best=0.888][I 2026-02-28 11:26:57,068] Trial 95 finished with value: 0.9127837840127233 and parameters: {'activation': 'relu', 'solver': 'adam', 'lr': 0.00024739189947892663, 'layer1': 355, 'layer2': 305, 'layer3': 70}. Best is trial 74 with value: 0.9166002918687234.

Escherichia_Coli | Piperacillin-Tazobactam | Optuna:  48%|████▊     | 96/200 [3:22:49<3:25:48, 118.73s/it, best=0.917][A
Escherichia_Coli | Piperacillin-Tazobactam | Optuna:  48%|████▊     | 96/200 [3:22:49<3:25:48, 118.73s/it, best=0.917][A[I 2026-02-28 11:27:00,897] Trial 148 finished with value: 0.8653734482683116 and parameters: {'activation': 'identity', 'solver': 'adam', 'lr': 6.798982912879146e-05, 'layer1': 476, 'layer2': 274, 'layer3': 180}. Best is trial 102 with value: 0.8672439264969375.
Pseudomonas_Aeruginosa | DirectMulti | Optuna:  74%|███████▍  | 149/200 [4:30:47<1:53:41, 133.76s/it, best=0.867]Pseudomonas_Aeruginosa | DirectMulti | Optuna:  74%|███████▍  | 149/200 [4:30:47<1:53:41, 133.76s/it, best=0.867]/export/usuarios01/egarroyo/MALDI_for_AMR_prediction/venv/lib/python3.13/site-packages/sklearn/model_selection/_split.py:813: UserWarning: The least populated class in y has only 4 members, which is less than n_splits=5.
  warnings.warn(
[I 2026-02-28 11:27:35,997] Trial 103 finished with value: 0.9240556204034152 and parameters: {'activation': 'identity', 'solver': 'adam', 'lr': 9.058118862693116e-05, 'layer1': 96, 'layer2': 487, 'layer3': 39}. Best is trial 71 with value: 0.9257111996592865.
Klebsiella_Pneumoniae | LPS | Optuna:  52%|█████▏    | 104/200 [2:39:52<2:28:19, 92.70s/it, best=0.926]Klebsiella_Pneumoniae | LPS | Optuna:  52%|█████▏    | 104/200 [2:39:52<2:28:19, 92.70s/it, best=0.926][I 2026-02-28 11:28:24,836] Trial 89 finished with value: 0.8861088200436769 and parameters: {'activation': 'identity', 'solver': 'adam', 'lr': 0.0005255407510841256, 'layer1': 316, 'layer2': 136, 'layer3': 242}. Best is trial 8 with value: 0.8879562150966016.
Staphylococcus_Aureus | LPS | Optuna:  45%|████▌     | 90/200 [3:22:11<3:57:02, 129.29s/it, best=0.888]Staphylococcus_Aureus | LPS | Optuna:  45%|████▌     | 90/200 [3:22:11<3:57:02, 129.29s/it, best=0.888][I 2026-02-28 11:28:37,843] Trial 104 finished with value: 0.9227870272860776 and parameters: {'activation': 'identity', 'solver': 'adam', 'lr': 0.00038874389654417125, 'layer1': 43, 'layer2': 233, 'layer3': 89}. Best is trial 71 with value: 0.9257111996592865.
Klebsiella_Pneumoniae | LPS | Optuna:  52%|█████▎    | 105/200 [2:40:53<2:12:07, 83.45s/it, best=0.926]Klebsiella_Pneumoniae | LPS | Optuna:  52%|█████▎    | 105/200 [2:40:53<2:12:07, 83.45s/it, best=0.926][I 2026-02-28 11:28:41,806] Trial 149 finished with value: 0.8639208534180878 and parameters: {'activation': 'identity', 'solver': 'adam', 'lr': 7.063445926803991e-05, 'layer1': 476, 'layer2': 278, 'layer3': 183}. Best is trial 102 with value: 0.8672439264969375.
Pseudomonas_Aeruginosa | DirectMulti | Optuna:  75%|███████▌  | 150/200 [4:32:28<1:43:15, 123.91s/it, best=0.867]Pseudomonas_Aeruginosa | DirectMulti | Optuna:  75%|███████▌  | 150/200 [4:32:28<1:43:15, 123.91s/it, best=0.867]/export/usuarios01/egarroyo/MALDI_for_AMR_prediction/venv/lib/python3.13/site-packages/sklearn/model_selection/_split.py:813: UserWarning: The least populated class in y has only 4 members, which is less than n_splits=5.
  warnings.warn(
[I 2026-02-28 11:29:06,035] Trial 96 finished with value: 0.9150287392685552 and parameters: {'activation': 'relu', 'solver': 'adam', 'lr': 0.0003150437909415606, 'layer1': 338, 'layer2': 327, 'layer3': 254}. Best is trial 74 with value: 0.9166002918687234.

Escherichia_Coli | Piperacillin-Tazobactam | Optuna:  48%|████▊     | 97/200 [3:24:58<3:29:05, 121.80s/it, best=0.917][A
Escherichia_Coli | Piperacillin-Tazobactam | Optuna:  48%|████▊     | 97/200 [3:24:58<3:29:05, 121.80s/it, best=0.917][A[I 2026-02-28 11:29:59,586] Trial 105 finished with value: 0.9242652009535197 and parameters: {'activation': 'identity', 'solver': 'adam', 'lr': 0.00017716926915626628, 'layer1': 69, 'layer2': 209, 'layer3': 117}. Best is trial 71 with value: 0.9257111996592865.
Klebsiella_Pneumoniae | LPS | Optuna:  53%|█████▎    | 106/200 [2:42:15<2:09:55, 82.94s/it, best=0.926]Klebsiella_Pneumoniae | LPS | Optuna:  53%|█████▎    | 106/200 [2:42:15<2:09:55, 82.94s/it, best=0.926][I 2026-02-28 11:30:22,402] Trial 150 finished with value: 0.8634849695497049 and parameters: {'activation': 'identity', 'solver': 'adam', 'lr': 0.00010981217721212411, 'layer1': 466, 'layer2': 268, 'layer3': 171}. Best is trial 102 with value: 0.8672439264969375.
Pseudomonas_Aeruginosa | DirectMulti | Optuna:  76%|███████▌  | 151/200 [4:34:08<1:35:28, 116.91s/it, best=0.867]Pseudomonas_Aeruginosa | DirectMulti | Optuna:  76%|███████▌  | 151/200 [4:34:08<1:35:28, 116.91s/it, best=0.867]/export/usuarios01/egarroyo/MALDI_for_AMR_prediction/venv/lib/python3.13/site-packages/sklearn/model_selection/_split.py:813: UserWarning: The least populated class in y has only 4 members, which is less than n_splits=5.
  warnings.warn(
[I 2026-02-28 11:30:32,581] Trial 90 finished with value: 0.8849653664707524 and parameters: {'activation': 'identity', 'solver': 'adam', 'lr': 0.0007539392931831771, 'layer1': 300, 'layer2': 370, 'layer3': 315}. Best is trial 8 with value: 0.8879562150966016.
Staphylococcus_Aureus | LPS | Optuna:  46%|████▌     | 91/200 [3:24:18<3:54:02, 128.83s/it, best=0.888]Staphylococcus_Aureus | LPS | Optuna:  46%|████▌     | 91/200 [3:24:18<3:54:02, 128.83s/it, best=0.888][I 2026-02-28 11:31:08,075] Trial 106 finished with value: 0.921811263789956 and parameters: {'activation': 'tanh', 'solver': 'adam', 'lr': 0.00013524681505585449, 'layer1': 60, 'layer2': 263, 'layer3': 72}. Best is trial 71 with value: 0.9257111996592865.
Klebsiella_Pneumoniae | LPS | Optuna:  54%|█████▎    | 107/200 [2:43:24<2:01:49, 78.60s/it, best=0.926]Klebsiella_Pneumoniae | LPS | Optuna:  54%|█████▎    | 107/200 [2:43:24<2:01:49, 78.60s/it, best=0.926][I 2026-02-28 11:31:25,968] Trial 97 finished with value: 0.9145863266405913 and parameters: {'activation': 'relu', 'solver': 'adam', 'lr': 0.0005358164711332534, 'layer1': 393, 'layer2': 481, 'layer3': 163}. Best is trial 74 with value: 0.9166002918687234.

Escherichia_Coli | Piperacillin-Tazobactam | Optuna:  49%|████▉     | 98/200 [3:27:18<3:36:18, 127.24s/it, best=0.917][A
Escherichia_Coli | Piperacillin-Tazobactam | Optuna:  49%|████▉     | 98/200 [3:27:18<3:36:18, 127.24s/it, best=0.917][A[I 2026-02-28 11:32:13,568] Trial 151 finished with value: 0.8655584300571121 and parameters: {'activation': 'identity', 'solver': 'adam', 'lr': 0.0001756962074457813, 'layer1': 423, 'layer2': 257, 'layer3': 135}. Best is trial 102 with value: 0.8672439264969375.
Pseudomonas_Aeruginosa | DirectMulti | Optuna:  76%|███████▌  | 152/200 [4:35:59<1:32:09, 115.19s/it, best=0.867]Pseudomonas_Aeruginosa | DirectMulti | Optuna:  76%|███████▌  | 152/200 [4:35:59<1:32:09, 115.19s/it, best=0.867]/export/usuarios01/egarroyo/MALDI_for_AMR_prediction/venv/lib/python3.13/site-packages/sklearn/model_selection/_split.py:813: UserWarning: The least populated class in y has only 4 members, which is less than n_splits=5.
  warnings.warn(
[I 2026-02-28 11:32:25,541] Trial 107 finished with value: 0.9206946224512391 and parameters: {'activation': 'relu', 'solver': 'adam', 'lr': 0.0002748145201252276, 'layer1': 113, 'layer2': 302, 'layer3': 139}. Best is trial 71 with value: 0.9257111996592865.
Klebsiella_Pneumoniae | LPS | Optuna:  54%|█████▍    | 108/200 [2:44:41<2:00:00, 78.26s/it, best=0.926]Klebsiella_Pneumoniae | LPS | Optuna:  54%|█████▍    | 108/200 [2:44:41<2:00:00, 78.26s/it, best=0.926][I 2026-02-28 11:32:31,784] Trial 91 finished with value: 0.8877556036100953 and parameters: {'activation': 'identity', 'solver': 'adam', 'lr': 0.00037037238586080213, 'layer1': 268, 'layer2': 104, 'layer3': 360}. Best is trial 8 with value: 0.8879562150966016.
Staphylococcus_Aureus | LPS | Optuna:  46%|████▌     | 92/200 [3:26:18<3:46:41, 125.94s/it, best=0.888]Staphylococcus_Aureus | LPS | Optuna:  46%|████▌     | 92/200 [3:26:18<3:46:41, 125.94s/it, best=0.888][I 2026-02-28 11:33:45,037] Trial 98 finished with value: 0.9126528904839984 and parameters: {'activation': 'relu', 'solver': 'adam', 'lr': 0.0006305359445415298, 'layer1': 312, 'layer2': 180, 'layer3': 30}. Best is trial 74 with value: 0.9166002918687234.

Escherichia_Coli | Piperacillin-Tazobactam | Optuna:  50%|████▉     | 99/200 [3:29:37<3:40:09, 130.79s/it, best=0.917][A
Escherichia_Coli | Piperacillin-Tazobactam | Optuna:  50%|████▉     | 99/200 [3:29:37<3:40:09, 130.79s/it, best=0.917][A[I 2026-02-28 11:34:01,520] Trial 152 finished with value: 0.866662838483389 and parameters: {'activation': 'identity', 'solver': 'adam', 'lr': 0.00022677751025836944, 'layer1': 424, 'layer2': 253, 'layer3': 135}. Best is trial 102 with value: 0.8672439264969375.
Pseudomonas_Aeruginosa | DirectMulti | Optuna:  76%|███████▋  | 153/200 [4:37:47<1:28:31, 113.02s/it, best=0.867]Pseudomonas_Aeruginosa | DirectMulti | Optuna:  76%|███████▋  | 153/200 [4:37:47<1:28:31, 113.02s/it, best=0.867]/export/usuarios01/egarroyo/MALDI_for_AMR_prediction/venv/lib/python3.13/site-packages/sklearn/model_selection/_split.py:813: UserWarning: The least populated class in y has only 4 members, which is less than n_splits=5.
  warnings.warn(
[I 2026-02-28 11:34:07,643] Trial 92 finished with value: 0.8843616634665468 and parameters: {'activation': 'identity', 'solver': 'adam', 'lr': 0.00037524824946111123, 'layer1': 267, 'layer2': 64, 'layer3': 361}. Best is trial 8 with value: 0.8879562150966016.
Staphylococcus_Aureus | LPS | Optuna:  46%|████▋     | 93/200 [3:27:53<3:28:30, 116.92s/it, best=0.888]Staphylococcus_Aureus | LPS | Optuna:  46%|████▋     | 93/200 [3:27:53<3:28:30, 116.92s/it, best=0.888][I 2026-02-28 11:34:23,823] Trial 108 finished with value: 0.9200864594666041 and parameters: {'activation': 'identity', 'solver': 'adam', 'lr': 0.005724899948442512, 'layer1': 433, 'layer2': 407, 'layer3': 153}. Best is trial 71 with value: 0.9257111996592865.
Klebsiella_Pneumoniae | LPS | Optuna:  55%|█████▍    | 109/200 [2:46:39<2:16:54, 90.27s/it, best=0.926]Klebsiella_Pneumoniae | LPS | Optuna:  55%|█████▍    | 109/200 [2:46:39<2:16:54, 90.27s/it, best=0.926][I 2026-02-28 11:35:22,148] Trial 109 finished with value: 0.9228086159287038 and parameters: {'activation': 'identity', 'solver': 'adam', 'lr': 0.0005728715188059849, 'layer1': 18, 'layer2': 250, 'layer3': 44}. Best is trial 71 with value: 0.9257111996592865.
