Pseudomonas_Aeruginosa | Ciprofloxacin | Optuna:  62%|██████▏   | 123/200 [2:07:21<1:37:55, 76.31s/it, best=0.875][A[I 2026-02-27 16:55:58,290] Trial 44 finished with value: 0.8032333469021596 and parameters: {'activation': 'tanh', 'solver': 'adam', 'lr': 4.4898777576591375e-05, 'layer1': 251, 'layer2': 482, 'layer3': 140}. Best is trial 34 with value: 0.8072405041442254.

Escherichia_Coli | Ciprofloxacin | Optuna:  22%|██▎       | 45/200 [2:08:27<6:23:06, 148.30s/it, best=0.807][A
Escherichia_Coli | Ciprofloxacin | Optuna:  22%|██▎       | 45/200 [2:08:27<6:23:06, 148.30s/it, best=0.807][A[I 2026-02-27 16:56:05,920] Trial 123 finished with value: 0.8722817250312047 and parameters: {'activation': 'logistic', 'solver': 'adam', 'lr': 0.0004930857681397486, 'layer1': 306, 'layer2': 376, 'layer3': 484}. Best is trial 46 with value: 0.8754031846375991.

Pseudomonas_Aeruginosa | Ciprofloxacin | Optuna:  62%|██████▏   | 124/200 [2:08:35<1:35:41, 75.55s/it, best=0.875][A
Pseudomonas_Aeruginosa | Ciprofloxacin | Optuna:  62%|██████▏   | 124/200 [2:08:35<1:35:41, 75.55s/it, best=0.875][A[I 2026-02-27 16:56:08,617] Trial 56 finished with value: 0.9091525983132491 and parameters: {'activation': 'identity', 'solver': 'adam', 'lr': 0.0005619058759941027, 'layer1': 306, 'layer2': 448, 'layer3': 377}. Best is trial 56 with value: 0.9091525983132491.

Staphylococcus_Aureus | Oxacillin | Optuna:  28%|██▊       | 57/200 [2:08:38<5:54:05, 148.57s/it, best=0.909][A
Staphylococcus_Aureus | Oxacillin | Optuna:  28%|██▊       | 57/200 [2:08:38<5:54:05, 148.57s/it, best=0.909][A[I 2026-02-27 16:56:41,710] Trial 57 finished with value: 0.711014531661111 and parameters: {'activation': 'logistic', 'solver': 'sgd', 'lr': 0.0005216161494836807, 'layer1': 266, 'layer2': 458, 'layer3': 380}. Best is trial 56 with value: 0.9091525983132491.

Staphylococcus_Aureus | Oxacillin | Optuna:  29%|██▉       | 58/200 [2:09:11<4:29:37, 113.93s/it, best=0.909][A
Staphylococcus_Aureus | Oxacillin | Optuna:  29%|██▉       | 58/200 [2:09:11<4:29:37, 113.93s/it, best=0.909][A[I 2026-02-27 16:57:01,025] Trial 75 finished with value: 0.826738905066706 and parameters: {'activation': 'identity', 'solver': 'adam', 'lr': 5.332090680760774e-05, 'layer1': 480, 'layer2': 450, 'layer3': 112}. Best is trial 64 with value: 0.8298953923751187.

Klebsiella_Pneumoniae | Ciprofloxacin | Optuna:  38%|███▊      | 76/200 [2:09:30<4:34:19, 132.73s/it, best=0.83][A
Klebsiella_Pneumoniae | Ciprofloxacin | Optuna:  38%|███▊      | 76/200 [2:09:30<4:34:19, 132.73s/it, best=0.83][A[I 2026-02-27 16:57:25,299] Trial 124 finished with value: 0.8741785122804051 and parameters: {'activation': 'logistic', 'solver': 'adam', 'lr': 0.0002963094916409923, 'layer1': 334, 'layer2': 150, 'layer3': 467}. Best is trial 46 with value: 0.8754031846375991.

Pseudomonas_Aeruginosa | Ciprofloxacin | Optuna:  62%|██████▎   | 125/200 [2:09:54<1:35:52, 76.70s/it, best=0.875][A
Pseudomonas_Aeruginosa | Ciprofloxacin | Optuna:  62%|██████▎   | 125/200 [2:09:54<1:35:52, 76.70s/it, best=0.875][A[I 2026-02-27 16:57:41,138] Trial 76 finished with value: 0.7417840809323848 and parameters: {'activation': 'logistic', 'solver': 'adam', 'lr': 1.820829966331629e-05, 'layer1': 500, 'layer2': 400, 'layer3': 178}. Best is trial 64 with value: 0.8298953923751187.

Klebsiella_Pneumoniae | Ciprofloxacin | Optuna:  38%|███▊      | 77/200 [2:10:10<3:35:08, 104.95s/it, best=0.83][A
Klebsiella_Pneumoniae | Ciprofloxacin | Optuna:  38%|███▊      | 77/200 [2:10:10<3:35:08, 104.95s/it, best=0.83][A[I 2026-02-27 16:58:19,584] Trial 125 finished with value: 0.8542204649720979 and parameters: {'activation': 'logistic', 'solver': 'adam', 'lr': 0.00017626034950126367, 'layer1': 339, 'layer2': 74, 'layer3': 465}. Best is trial 46 with value: 0.8754031846375991.

Pseudomonas_Aeruginosa | Ciprofloxacin | Optuna:  63%|██████▎   | 126/200 [2:10:49<1:26:18, 69.97s/it, best=0.875][A
Pseudomonas_Aeruginosa | Ciprofloxacin | Optuna:  63%|██████▎   | 126/200 [2:10:49<1:26:18, 69.97s/it, best=0.875][A[I 2026-02-27 16:59:03,650] Trial 58 finished with value: 0.9068041997168115 and parameters: {'activation': 'identity', 'solver': 'adam', 'lr': 0.00037521691145869177, 'layer1': 296, 'layer2': 442, 'layer3': 343}. Best is trial 56 with value: 0.9091525983132491.

Staphylococcus_Aureus | Oxacillin | Optuna:  30%|██▉       | 59/200 [2:11:33<4:47:28, 122.33s/it, best=0.909][A
Staphylococcus_Aureus | Oxacillin | Optuna:  30%|██▉       | 59/200 [2:11:33<4:47:28, 122.33s/it, best=0.909][A[I 2026-02-27 16:59:27,548] Trial 45 finished with value: 0.8010463236082046 and parameters: {'activation': 'identity', 'solver': 'adam', 'lr': 2.234090863841757e-05, 'layer1': 202, 'layer2': 425, 'layer3': 424}. Best is trial 34 with value: 0.8072405041442254.

Escherichia_Coli | Ciprofloxacin | Optuna:  23%|██▎       | 46/200 [2:11:56<7:07:34, 166.59s/it, best=0.807][A
Escherichia_Coli | Ciprofloxacin | Optuna:  23%|██▎       | 46/200 [2:11:56<7:07:34, 166.59s/it, best=0.807][A[I 2026-02-27 16:59:45,145] Trial 77 finished with value: 0.827705601685653 and parameters: {'activation': 'identity', 'solver': 'adam', 'lr': 8.695174708264281e-05, 'layer1': 441, 'layer2': 430, 'layer3': 164}. Best is trial 64 with value: 0.8298953923751187.

Klebsiella_Pneumoniae | Ciprofloxacin | Optuna:  39%|███▉      | 78/200 [2:12:14<3:45:01, 110.67s/it, best=0.83][A
Klebsiella_Pneumoniae | Ciprofloxacin | Optuna:  39%|███▉      | 78/200 [2:12:14<3:45:01, 110.67s/it, best=0.83][A[I 2026-02-27 17:00:05,803] Trial 126 finished with value: 0.8764399491217574 and parameters: {'activation': 'logistic', 'solver': 'adam', 'lr': 0.00038783005292880547, 'layer1': 435, 'layer2': 148, 'layer3': 404}. Best is trial 126 with value: 0.8764399491217574.

Pseudomonas_Aeruginosa | Ciprofloxacin | Optuna:  64%|██████▎   | 127/200 [2:12:35<1:38:21, 80.85s/it, best=0.875][A
Pseudomonas_Aeruginosa | Ciprofloxacin | Optuna:  64%|██████▎   | 127/200 [2:12:35<1:38:21, 80.85s/it, best=0.876][A[I 2026-02-27 17:01:00,698] Trial 59 finished with value: 0.9073433191383977 and parameters: {'activation': 'identity', 'solver': 'adam', 'lr': 0.00017671424130178345, 'layer1': 186, 'layer2': 401, 'layer3': 413}. Best is trial 56 with value: 0.9091525983132491.

Staphylococcus_Aureus | Oxacillin | Optuna:  30%|███       | 60/200 [2:13:30<4:41:44, 120.75s/it, best=0.909][A
Staphylococcus_Aureus | Oxacillin | Optuna:  30%|███       | 60/200 [2:13:30<4:41:44, 120.75s/it, best=0.909][A[I 2026-02-27 17:01:25,341] Trial 46 finished with value: 0.8003403164241181 and parameters: {'activation': 'tanh', 'solver': 'adam', 'lr': 0.00016418390799027692, 'layer1': 279, 'layer2': 459, 'layer3': 497}. Best is trial 34 with value: 0.8072405041442254.

Escherichia_Coli | Ciprofloxacin | Optuna:  24%|██▎       | 47/200 [2:13:54<6:27:27, 151.95s/it, best=0.807][A
Escherichia_Coli | Ciprofloxacin | Optuna:  24%|██▎       | 47/200 [2:13:54<6:27:27, 151.95s/it, best=0.807][A[I 2026-02-27 17:01:28,218] Trial 127 finished with value: 0.8735807426768133 and parameters: {'activation': 'logistic', 'solver': 'adam', 'lr': 0.00041648741399356377, 'layer1': 431, 'layer2': 140, 'layer3': 385}. Best is trial 126 with value: 0.8764399491217574.

Pseudomonas_Aeruginosa | Ciprofloxacin | Optuna:  64%|██████▍   | 128/200 [2:13:57<1:37:34, 81.32s/it, best=0.876][A
Pseudomonas_Aeruginosa | Ciprofloxacin | Optuna:  64%|██████▍   | 128/200 [2:13:57<1:37:34, 81.32s/it, best=0.876][A[I 2026-02-27 17:01:42,183] Trial 78 finished with value: 0.8213787621955653 and parameters: {'activation': 'identity', 'solver': 'adam', 'lr': 8.707857362781426e-05, 'layer1': 438, 'layer2': 462, 'layer3': 192}. Best is trial 64 with value: 0.8298953923751187.

Klebsiella_Pneumoniae | Ciprofloxacin | Optuna:  40%|███▉      | 79/200 [2:14:11<3:47:01, 112.58s/it, best=0.83][A
Klebsiella_Pneumoniae | Ciprofloxacin | Optuna:  40%|███▉      | 79/200 [2:14:11<3:47:01, 112.58s/it, best=0.83][A[I 2026-02-27 17:02:20,424] Trial 128 finished with value: 0.8700345817267866 and parameters: {'activation': 'logistic', 'solver': 'adam', 'lr': 0.0008139601813381712, 'layer1': 331, 'layer2': 33, 'layer3': 403}. Best is trial 126 with value: 0.8764399491217574.

Pseudomonas_Aeruginosa | Ciprofloxacin | Optuna:  64%|██████▍   | 129/200 [2:14:50<1:25:53, 72.58s/it, best=0.876][A
Pseudomonas_Aeruginosa | Ciprofloxacin | Optuna:  64%|██████▍   | 129/200 [2:14:50<1:25:53, 72.58s/it, best=0.876][A[I 2026-02-27 17:02:44,117] Trial 47 finished with value: 0.6213924879162258 and parameters: {'activation': 'identity', 'solver': 'sgd', 'lr': 0.00010365448848365668, 'layer1': 390, 'layer2': 375, 'layer3': 398}. Best is trial 34 with value: 0.8072405041442254.

Escherichia_Coli | Ciprofloxacin | Optuna:  24%|██▍       | 48/200 [2:15:13<5:29:19, 130.00s/it, best=0.807][A
Escherichia_Coli | Ciprofloxacin | Optuna:  24%|██▍       | 48/200 [2:15:13<5:29:19, 130.00s/it, best=0.807][A[I 2026-02-27 17:02:47,843] Trial 129 finished with value: 0.8159756916186209 and parameters: {'activation': 'logistic', 'solver': 'adam', 'lr': 0.00014491850152043492, 'layer1': 411, 'layer2': 148, 'layer3': 359}. Best is trial 126 with value: 0.8764399491217574.

Pseudomonas_Aeruginosa | Ciprofloxacin | Optuna:  65%|██████▌   | 130/200 [2:15:17<1:08:52, 59.03s/it, best=0.876][A
Pseudomonas_Aeruginosa | Ciprofloxacin | Optuna:  65%|██████▌   | 130/200 [2:15:17<1:08:52, 59.03s/it, best=0.876][A[I 2026-02-27 17:03:10,764] Trial 60 finished with value: 0.9043950534645605 and parameters: {'activation': 'identity', 'solver': 'adam', 'lr': 3.0087249822036486e-05, 'layer1': 239, 'layer2': 481, 'layer3': 443}. Best is trial 56 with value: 0.9091525983132491.

Staphylococcus_Aureus | Oxacillin | Optuna:  30%|███       | 61/200 [2:15:40<4:46:12, 123.54s/it, best=0.909][A
Staphylococcus_Aureus | Oxacillin | Optuna:  30%|███       | 61/200 [2:15:40<4:46:12, 123.54s/it, best=0.909][A[I 2026-02-27 17:03:38,967] Trial 48 finished with value: 0.5941008292113479 and parameters: {'activation': 'relu', 'solver': 'adam', 'lr': 4.863680205156866e-06, 'layer1': 361, 'layer2': 172, 'layer3': 482}. Best is trial 34 with value: 0.8072405041442254.

Escherichia_Coli | Ciprofloxacin | Optuna:  24%|██▍       | 49/200 [2:16:08<4:30:25, 107.45s/it, best=0.807][A
Escherichia_Coli | Ciprofloxacin | Optuna:  24%|██▍       | 49/200 [2:16:08<4:30:25, 107.45s/it, best=0.807][A[I 2026-02-27 17:04:00,034] Trial 130 finished with value: 0.8727286745486168 and parameters: {'activation': 'logistic', 'solver': 'adam', 'lr': 0.0005360859300823714, 'layer1': 453, 'layer2': 181, 'layer3': 423}. Best is trial 126 with value: 0.8764399491217574.

Pseudomonas_Aeruginosa | Ciprofloxacin | Optuna:  66%|██████▌   | 131/200 [2:16:29<1:12:25, 62.98s/it, best=0.876][A
Pseudomonas_Aeruginosa | Ciprofloxacin | Optuna:  66%|██████▌   | 131/200 [2:16:29<1:12:25, 62.98s/it, best=0.876][A[I 2026-02-27 17:04:05,800] Trial 79 finished with value: 0.8261087208679889 and parameters: {'activation': 'identity', 'solver': 'adam', 'lr': 5.417035570921638e-05, 'layer1': 453, 'layer2': 432, 'layer3': 143}. Best is trial 64 with value: 0.8298953923751187.

Klebsiella_Pneumoniae | Ciprofloxacin | Optuna:  40%|████      | 80/200 [2:16:35<4:03:46, 121.89s/it, best=0.83][A
Klebsiella_Pneumoniae | Ciprofloxacin | Optuna:  40%|████      | 80/200 [2:16:35<4:03:46, 121.89s/it, best=0.83][A[I 2026-02-27 17:05:28,454] Trial 61 finished with value: 0.9074182164416182 and parameters: {'activation': 'identity', 'solver': 'adam', 'lr': 0.00011118242892481962, 'layer1': 307, 'layer2': 421, 'layer3': 472}. Best is trial 56 with value: 0.9091525983132491.

Staphylococcus_Aureus | Oxacillin | Optuna:  31%|███       | 62/200 [2:17:58<4:53:54, 127.79s/it, best=0.909][A
Staphylococcus_Aureus | Oxacillin | Optuna:  31%|███       | 62/200 [2:17:58<4:53:54, 127.79s/it, best=0.909][A[I 2026-02-27 17:05:43,270] Trial 131 finished with value: 0.8745623361617529 and parameters: {'activation': 'logistic', 'solver': 'adam', 'lr': 0.00030118910753366523, 'layer1': 436, 'layer2': 399, 'layer3': 453}. Best is trial 126 with value: 0.8764399491217574.

Pseudomonas_Aeruginosa | Ciprofloxacin | Optuna:  66%|██████▌   | 132/200 [2:18:12<1:25:03, 75.06s/it, best=0.876][A
Pseudomonas_Aeruginosa | Ciprofloxacin | Optuna:  66%|██████▌   | 132/200 [2:18:12<1:25:03, 75.06s/it, best=0.876][A[I 2026-02-27 17:06:08,160] Trial 80 finished with value: 0.825334288885934 and parameters: {'activation': 'identity', 'solver': 'adam', 'lr': 0.00015751147375254622, 'layer1': 469, 'layer2': 391, 'layer3': 124}. Best is trial 64 with value: 0.8298953923751187.

Klebsiella_Pneumoniae | Ciprofloxacin | Optuna:  40%|████      | 81/200 [2:18:37<4:02:01, 122.03s/it, best=0.83][A
Klebsiella_Pneumoniae | Ciprofloxacin | Optuna:  40%|████      | 81/200 [2:18:37<4:02:01, 122.03s/it, best=0.83][A[I 2026-02-27 17:07:21,378] Trial 49 finished with value: 0.8025195023536504 and parameters: {'activation': 'identity', 'solver': 'adam', 'lr': 0.0003405448060547484, 'layer1': 421, 'layer2': 400, 'layer3': 422}. Best is trial 34 with value: 0.8072405041442254.

Escherichia_Coli | Ciprofloxacin | Optuna:  25%|██▌       | 50/200 [2:19:50<5:54:50, 141.94s/it, best=0.807][A
Escherichia_Coli | Ciprofloxacin | Optuna:  25%|██▌       | 50/200 [2:19:50<5:54:50, 141.94s/it, best=0.807][A[I 2026-02-27 17:07:38,673] Trial 132 finished with value: 0.8736324208930272 and parameters: {'activation': 'logistic', 'solver': 'adam', 'lr': 0.00020891769226139784, 'layer1': 426, 'layer2': 399, 'layer3': 436}. Best is trial 126 with value: 0.8764399491217574.

Pseudomonas_Aeruginosa | Ciprofloxacin | Optuna:  66%|██████▋   | 133/200 [2:20:08<1:37:19, 87.16s/it, best=0.876][A
Pseudomonas_Aeruginosa | Ciprofloxacin | Optuna:  66%|██████▋   | 133/200 [2:20:08<1:37:19, 87.16s/it, best=0.876][A[I 2026-02-27 17:08:09,232] Trial 62 finished with value: 0.9083439038698993 and parameters: {'activation': 'identity', 'solver': 'adam', 'lr': 0.000219880725376251, 'layer1': 336, 'layer2': 433, 'layer3': 433}. Best is trial 56 with value: 0.9091525983132491.

Staphylococcus_Aureus | Oxacillin | Optuna:  32%|███▏      | 63/200 [2:20:38<5:14:22, 137.68s/it, best=0.909][A
Staphylococcus_Aureus | Oxacillin | Optuna:  32%|███▏      | 63/200 [2:20:38<5:14:22, 137.68s/it, best=0.909][A[I 2026-02-27 17:08:25,729] Trial 81 finished with value: 0.825871137925436 and parameters: {'activation': 'identity', 'solver': 'adam', 'lr': 0.00019673806753214425, 'layer1': 398, 'layer2': 445, 'layer3': 157}. Best is trial 64 with value: 0.8298953923751187.

Klebsiella_Pneumoniae | Ciprofloxacin | Optuna:  41%|████      | 82/200 [2:20:55<4:09:09, 126.69s/it, best=0.83][A
Klebsiella_Pneumoniae | Ciprofloxacin | Optuna:  41%|████      | 82/200 [2:20:55<4:09:09, 126.69s/it, best=0.83][A[I 2026-02-27 17:08:28,036] Trial 50 finished with value: 0.5944454041801094 and parameters: {'activation': 'logistic', 'solver': 'adam', 'lr': 1.2851272152515255e-05, 'layer1': 462, 'layer2': 498, 'layer3': 195}. Best is trial 34 with value: 0.8072405041442254.

Escherichia_Coli | Ciprofloxacin | Optuna:  26%|██▌       | 51/200 [2:20:57<4:56:23, 119.36s/it, best=0.807][A
Escherichia_Coli | Ciprofloxacin | Optuna:  26%|██▌       | 51/200 [2:20:57<4:56:23, 119.36s/it, best=0.807][A[I 2026-02-27 17:09:01,541] Trial 133 finished with value: 0.8730692487188382 and parameters: {'activation': 'logistic', 'solver': 'adam', 'lr': 0.00029482784678454797, 'layer1': 275, 'layer2': 419, 'layer3': 455}. Best is trial 126 with value: 0.8764399491217574.

Pseudomonas_Aeruginosa | Ciprofloxacin | Optuna:  67%|██████▋   | 134/200 [2:21:31<1:34:27, 85.87s/it, best=0.876][A
Pseudomonas_Aeruginosa | Ciprofloxacin | Optuna:  67%|██████▋   | 134/200 [2:21:31<1:34:27, 85.87s/it, best=0.876][A[I 2026-02-27 17:10:15,451] Trial 134 finished with value: 0.8733946581412108 and parameters: {'activation': 'logistic', 'solver': 'adam', 'lr': 0.00038363333907120257, 'layer1': 399, 'layer2': 98, 'layer3': 471}. Best is trial 126 with value: 0.8764399491217574.

Pseudomonas_Aeruginosa | Ciprofloxacin | Optuna:  68%|██████▊   | 135/200 [2:22:45<1:29:08, 82.28s/it, best=0.876][A
Pseudomonas_Aeruginosa | Ciprofloxacin | Optuna:  68%|██████▊   | 135/200 [2:22:45<1:29:08, 82.28s/it, best=0.876][A[I 2026-02-27 17:10:19,848] Trial 51 finished with value: 0.7965723288253772 and parameters: {'activation': 'tanh', 'solver': 'adam', 'lr': 4.757848066708898e-05, 'layer1': 11, 'layer2': 477, 'layer3': 133}. Best is trial 34 with value: 0.8072405041442254.

Escherichia_Coli | Ciprofloxacin | Optuna:  26%|██▌       | 52/200 [2:22:49<4:48:49, 117.09s/it, best=0.807][A
Escherichia_Coli | Ciprofloxacin | Optuna:  26%|██▌       | 52/200 [2:22:49<4:48:49, 117.09s/it, best=0.807][A[I 2026-02-27 17:10:27,030] Trial 63 finished with value: 0.9072118588108979 and parameters: {'activation': 'identity', 'solver': 'adam', 'lr': 0.0002193445760596351, 'layer1': 355, 'layer2': 449, 'layer3': 428}. Best is trial 56 with value: 0.9091525983132491.

Staphylococcus_Aureus | Oxacillin | Optuna:  32%|███▏      | 64/200 [2:22:56<5:12:09, 137.72s/it, best=0.909][A
Staphylococcus_Aureus | Oxacillin | Optuna:  32%|███▏      | 64/200 [2:22:56<5:12:09, 137.72s/it, best=0.909][A[I 2026-02-27 17:10:32,949] Trial 82 finished with value: 0.8250693772804288 and parameters: {'activation': 'identity', 'solver': 'adam', 'lr': 0.00011019085905610765, 'layer1': 436, 'layer2': 407, 'layer3': 170}. Best is trial 64 with value: 0.8298953923751187.

Klebsiella_Pneumoniae | Ciprofloxacin | Optuna:  42%|████▏     | 83/200 [2:23:02<4:07:21, 126.85s/it, best=0.83][A
Klebsiella_Pneumoniae | Ciprofloxacin | Optuna:  42%|████▏     | 83/200 [2:23:02<4:07:21, 126.85s/it, best=0.83][A[I 2026-02-27 17:11:27,711] Trial 135 finished with value: 0.873195545235026 and parameters: {'activation': 'logistic', 'solver': 'adam', 'lr': 0.0002678557435871114, 'layer1': 439, 'layer2': 114, 'layer3': 399}. Best is trial 126 with value: 0.8764399491217574.

Pseudomonas_Aeruginosa | Ciprofloxacin | Optuna:  68%|██████▊   | 136/200 [2:23:57<1:24:33, 79.28s/it, best=0.876][A
Pseudomonas_Aeruginosa | Ciprofloxacin | Optuna:  68%|██████▊   | 136/200 [2:23:57<1:24:33, 79.28s/it, best=0.876][A[I 2026-02-27 17:12:26,043] Trial 83 finished with value: 0.8229291352496568 and parameters: {'activation': 'identity', 'solver': 'adam', 'lr': 6.433428011180139e-05, 'layer1': 366, 'layer2': 484, 'layer3': 102}. Best is trial 64 with value: 0.8298953923751187.

Klebsiella_Pneumoniae | Ciprofloxacin | Optuna:  42%|████▏     | 84/200 [2:24:55<3:57:15, 122.72s/it, best=0.83][A
Klebsiella_Pneumoniae | Ciprofloxacin | Optuna:  42%|████▏     | 84/200 [2:24:55<3:57:15, 122.72s/it, best=0.83][A[I 2026-02-27 17:12:30,109] Trial 136 finished with value: 0.8712855538124286 and parameters: {'activation': 'logistic', 'solver': 'adam', 'lr': 0.0004501051060399408, 'layer1': 351, 'layer2': 127, 'layer3': 410}. Best is trial 126 with value: 0.8764399491217574.

Pseudomonas_Aeruginosa | Ciprofloxacin | Optuna:  68%|██████▊   | 137/200 [2:24:59<1:17:55, 74.21s/it, best=0.876][A
Pseudomonas_Aeruginosa | Ciprofloxacin | Optuna:  68%|██████▊   | 137/200 [2:24:59<1:17:55, 74.21s/it, best=0.876][A[I 2026-02-27 17:12:35,938] Trial 64 finished with value: 0.9075489641204267 and parameters: {'activation': 'identity', 'solver': 'adam', 'lr': 0.0005901276452361805, 'layer1': 310, 'layer2': 500, 'layer3': 381}. Best is trial 56 with value: 0.9091525983132491.

Staphylococcus_Aureus | Oxacillin | Optuna:  32%|███▎      | 65/200 [2:25:05<5:03:55, 135.08s/it, best=0.909][A
Staphylococcus_Aureus | Oxacillin | Optuna:  32%|███▎      | 65/200 [2:25:05<5:03:55, 135.08s/it, best=0.909][A[I 2026-02-27 17:12:54,573] Trial 52 finished with value: 0.8021367263683719 and parameters: {'activation': 'tanh', 'solver': 'adam', 'lr': 3.208478848474445e-05, 'layer1': 252, 'layer2': 443, 'layer3': 111}. Best is trial 34 with value: 0.8072405041442254.

Escherichia_Coli | Ciprofloxacin | Optuna:  26%|██▋       | 53/200 [2:25:23<5:14:32, 128.38s/it, best=0.807][A
Escherichia_Coli | Ciprofloxacin | Optuna:  26%|██▋       | 53/200 [2:25:23<5:14:32, 128.38s/it, best=0.807][A[I 2026-02-27 17:12:55,771] Trial 137 finished with value: 0.8159756916186209 and parameters: {'activation': 'logistic', 'solver': 'adam', 'lr': 0.00011349159168238777, 'layer1': 337, 'layer2': 152, 'layer3': 435}. Best is trial 126 with value: 0.8764399491217574.

Pseudomonas_Aeruginosa | Ciprofloxacin | Optuna:  69%|██████▉   | 138/200 [2:25:25<1:01:38, 59.65s/it, best=0.876][A
Pseudomonas_Aeruginosa | Ciprofloxacin | Optuna:  69%|██████▉   | 138/200 [2:25:25<1:01:38, 59.65s/it, best=0.876][A[I 2026-02-27 17:13:44,818] Trial 138 finished with value: 0.8279602000882184 and parameters: {'activation': 'tanh', 'solver': 'adam', 'lr': 0.009918085343130302, 'layer1': 367, 'layer2': 385, 'layer3': 460}. Best is trial 126 with value: 0.8764399491217574.

Pseudomonas_Aeruginosa | Ciprofloxacin | Optuna:  70%|██████▉   | 139/200 [2:26:14<57:24, 56.47s/it, best=0.876]  [A
Pseudomonas_Aeruginosa | Ciprofloxacin | Optuna:  70%|██████▉   | 139/200 [2:26:14<57:24, 56.47s/it, best=0.876][A[I 2026-02-27 17:14:04,794] Trial 65 finished with value: 0.9015629547410706 and parameters: {'activation': 'tanh', 'solver': 'adam', 'lr': 0.00035638824040487685, 'layer1': 390, 'layer2': 382, 'layer3': 410}. Best is trial 56 with value: 0.9091525983132491.

Staphylococcus_Aureus | Oxacillin | Optuna:  33%|███▎      | 66/200 [2:26:34<4:30:42, 121.21s/it, best=0.909][A
