Klebsiella_Pneumoniae | LPS | Optuna:  62%|██████▏   | 123/200 [3:03:35<1:24:55, 66.17s/it, best=0.926]Klebsiella_Pneumoniae | LPS | Optuna:  62%|██████▏   | 123/200 [3:03:35<1:24:55, 66.17s/it, best=0.926][I 2026-02-28 11:51:24,880] Trial 163 finished with value: 0.8655514462698669 and parameters: {'activation': 'identity', 'solver': 'adam', 'lr': 0.00040002177642718684, 'layer1': 395, 'layer2': 290, 'layer3': 148}. Best is trial 155 with value: 0.8677633336625616.
Pseudomonas_Aeruginosa | DirectMulti | Optuna:  82%|████████▏ | 164/200 [4:55:11<1:00:50, 101.40s/it, best=0.868]Pseudomonas_Aeruginosa | DirectMulti | Optuna:  82%|████████▏ | 164/200 [4:55:11<1:00:50, 101.40s/it, best=0.868]/export/usuarios01/egarroyo/MALDI_for_AMR_prediction/venv/lib/python3.13/site-packages/sklearn/model_selection/_split.py:813: UserWarning: The least populated class in y has only 4 members, which is less than n_splits=5.
  warnings.warn(
[I 2026-02-28 11:52:17,647] Trial 107 finished with value: 0.9107440243901344 and parameters: {'activation': 'relu', 'solver': 'adam', 'lr': 0.00010536441039656468, 'layer1': 321, 'layer2': 336, 'layer3': 200}. Best is trial 74 with value: 0.9166002918687234.

Escherichia_Coli | Piperacillin-Tazobactam | Optuna:  54%|█████▍    | 108/200 [3:48:10<3:01:06, 118.11s/it, best=0.917][A
Escherichia_Coli | Piperacillin-Tazobactam | Optuna:  54%|█████▍    | 108/200 [3:48:10<3:01:06, 118.11s/it, best=0.917][A[I 2026-02-28 11:52:48,217] Trial 123 finished with value: 0.9250422421198745 and parameters: {'activation': 'identity', 'solver': 'adam', 'lr': 0.00019592789104967573, 'layer1': 95, 'layer2': 286, 'layer3': 125}. Best is trial 71 with value: 0.9257111996592865.
Klebsiella_Pneumoniae | LPS | Optuna:  62%|██████▏   | 124/200 [3:05:04<1:32:35, 73.09s/it, best=0.926]Klebsiella_Pneumoniae | LPS | Optuna:  62%|██████▏   | 124/200 [3:05:04<1:32:35, 73.09s/it, best=0.926][I 2026-02-28 11:53:13,844] Trial 101 finished with value: 0.8859662776029564 and parameters: {'activation': 'identity', 'solver': 'adam', 'lr': 0.00043213068459889333, 'layer1': 290, 'layer2': 353, 'layer3': 484}. Best is trial 8 with value: 0.8879562150966016.
Staphylococcus_Aureus | LPS | Optuna:  51%|█████     | 102/200 [3:47:00<3:26:58, 126.72s/it, best=0.888]Staphylococcus_Aureus | LPS | Optuna:  51%|█████     | 102/200 [3:47:00<3:26:58, 126.72s/it, best=0.888][I 2026-02-28 11:53:18,715] Trial 164 finished with value: 0.864743195921981 and parameters: {'activation': 'identity', 'solver': 'adam', 'lr': 0.00042427803531790045, 'layer1': 385, 'layer2': 291, 'layer3': 134}. Best is trial 155 with value: 0.8677633336625616.
Pseudomonas_Aeruginosa | DirectMulti | Optuna:  82%|████████▎ | 165/200 [4:57:04<1:01:19, 105.13s/it, best=0.868]Pseudomonas_Aeruginosa | DirectMulti | Optuna:  82%|████████▎ | 165/200 [4:57:04<1:01:19, 105.13s/it, best=0.868]/export/usuarios01/egarroyo/MALDI_for_AMR_prediction/venv/lib/python3.13/site-packages/sklearn/model_selection/_split.py:813: UserWarning: The least populated class in y has only 4 members, which is less than n_splits=5.
  warnings.warn(
[I 2026-02-28 11:54:25,029] Trial 108 finished with value: 0.914330300364561 and parameters: {'activation': 'relu', 'solver': 'adam', 'lr': 0.0002783906180770775, 'layer1': 384, 'layer2': 267, 'layer3': 170}. Best is trial 74 with value: 0.9166002918687234.

Escherichia_Coli | Piperacillin-Tazobactam | Optuna:  55%|█████▍    | 109/200 [3:50:17<3:03:21, 120.89s/it, best=0.917][A
Escherichia_Coli | Piperacillin-Tazobactam | Optuna:  55%|█████▍    | 109/200 [3:50:17<3:03:21, 120.89s/it, best=0.917][A[I 2026-02-28 11:54:32,536] Trial 165 finished with value: 0.8625683540602977 and parameters: {'activation': 'identity', 'solver': 'adam', 'lr': 0.00039051540286387895, 'layer1': 392, 'layer2': 247, 'layer3': 166}. Best is trial 155 with value: 0.8677633336625616.
Pseudomonas_Aeruginosa | DirectMulti | Optuna:  83%|████████▎ | 166/200 [4:58:18<54:15, 95.74s/it, best=0.868]   Pseudomonas_Aeruginosa | DirectMulti | Optuna:  83%|████████▎ | 166/200 [4:58:18<54:15, 95.74s/it, best=0.868]/export/usuarios01/egarroyo/MALDI_for_AMR_prediction/venv/lib/python3.13/site-packages/sklearn/model_selection/_split.py:813: UserWarning: The least populated class in y has only 4 members, which is less than n_splits=5.
  warnings.warn(
[I 2026-02-28 11:54:32,708] Trial 124 finished with value: 0.9228895733258644 and parameters: {'activation': 'identity', 'solver': 'adam', 'lr': 0.0001903756530102601, 'layer1': 389, 'layer2': 306, 'layer3': 66}. Best is trial 71 with value: 0.9257111996592865.
Klebsiella_Pneumoniae | LPS | Optuna:  62%|██████▎   | 125/200 [3:06:48<1:43:08, 82.51s/it, best=0.926]Klebsiella_Pneumoniae | LPS | Optuna:  62%|██████▎   | 125/200 [3:06:48<1:43:08, 82.51s/it, best=0.926][I 2026-02-28 11:55:18,782] Trial 102 finished with value: 0.8846441011464998 and parameters: {'activation': 'identity', 'solver': 'adam', 'lr': 0.002005455051625182, 'layer1': 225, 'layer2': 389, 'layer3': 334}. Best is trial 8 with value: 0.8879562150966016.
Staphylococcus_Aureus | LPS | Optuna:  52%|█████▏    | 103/200 [3:49:05<3:24:00, 126.19s/it, best=0.888]Staphylococcus_Aureus | LPS | Optuna:  52%|█████▏    | 103/200 [3:49:05<3:24:00, 126.19s/it, best=0.888][I 2026-02-28 11:56:03,149] Trial 125 finished with value: 0.9232589079102442 and parameters: {'activation': 'identity', 'solver': 'adam', 'lr': 0.00015293334970484828, 'layer1': 318, 'layer2': 331, 'layer3': 176}. Best is trial 71 with value: 0.9257111996592865.
Klebsiella_Pneumoniae | LPS | Optuna:  63%|██████▎   | 126/200 [3:08:19<1:44:41, 84.89s/it, best=0.926]Klebsiella_Pneumoniae | LPS | Optuna:  63%|██████▎   | 126/200 [3:08:19<1:44:41, 84.89s/it, best=0.926][I 2026-02-28 11:56:05,714] Trial 166 finished with value: 0.8640828836381014 and parameters: {'activation': 'identity', 'solver': 'adam', 'lr': 0.0002540452306748774, 'layer1': 352, 'layer2': 286, 'layer3': 147}. Best is trial 155 with value: 0.8677633336625616.
Pseudomonas_Aeruginosa | DirectMulti | Optuna:  84%|████████▎ | 167/200 [4:59:51<52:13, 94.97s/it, best=0.868]Pseudomonas_Aeruginosa | DirectMulti | Optuna:  84%|████████▎ | 167/200 [4:59:51<52:13, 94.97s/it, best=0.868]/export/usuarios01/egarroyo/MALDI_for_AMR_prediction/venv/lib/python3.13/site-packages/sklearn/model_selection/_split.py:813: UserWarning: The least populated class in y has only 4 members, which is less than n_splits=5.
  warnings.warn(
[I 2026-02-28 11:57:10,601] Trial 109 finished with value: 0.9101501466445882 and parameters: {'activation': 'identity', 'solver': 'adam', 'lr': 0.0007626795850823132, 'layer1': 434, 'layer2': 345, 'layer3': 220}. Best is trial 74 with value: 0.9166002918687234.

Escherichia_Coli | Piperacillin-Tazobactam | Optuna:  55%|█████▌    | 110/200 [3:53:03<3:21:26, 134.30s/it, best=0.917][A
Escherichia_Coli | Piperacillin-Tazobactam | Optuna:  55%|█████▌    | 110/200 [3:53:03<3:21:26, 134.30s/it, best=0.917][A[I 2026-02-28 11:57:10,901] Trial 126 finished with value: 0.9233824663371507 and parameters: {'activation': 'identity', 'solver': 'adam', 'lr': 0.00025262225412384304, 'layer1': 26, 'layer2': 290, 'layer3': 123}. Best is trial 71 with value: 0.9257111996592865.
Klebsiella_Pneumoniae | LPS | Optuna:  64%|██████▎   | 127/200 [3:09:26<1:37:01, 79.75s/it, best=0.926]Klebsiella_Pneumoniae | LPS | Optuna:  64%|██████▎   | 127/200 [3:09:26<1:37:01, 79.75s/it, best=0.926][I 2026-02-28 11:57:14,582] Trial 103 finished with value: 0.8851852593439664 and parameters: {'activation': 'identity', 'solver': 'adam', 'lr': 0.0013682407137729983, 'layer1': 78, 'layer2': 415, 'layer3': 451}. Best is trial 8 with value: 0.8879562150966016.
Staphylococcus_Aureus | LPS | Optuna:  52%|█████▏    | 104/200 [3:51:00<3:16:54, 123.07s/it, best=0.888]Staphylococcus_Aureus | LPS | Optuna:  52%|█████▏    | 104/200 [3:51:00<3:16:54, 123.07s/it, best=0.888][I 2026-02-28 11:57:25,191] Trial 167 finished with value: 0.824784263249698 and parameters: {'activation': 'identity', 'solver': 'sgd', 'lr': 0.00029825731475747135, 'layer1': 403, 'layer2': 298, 'layer3': 154}. Best is trial 155 with value: 0.8677633336625616.
Pseudomonas_Aeruginosa | DirectMulti | Optuna:  84%|████████▍ | 168/200 [5:01:11<48:10, 90.32s/it, best=0.868]Pseudomonas_Aeruginosa | DirectMulti | Optuna:  84%|████████▍ | 168/200 [5:01:11<48:10, 90.32s/it, best=0.868]/export/usuarios01/egarroyo/MALDI_for_AMR_prediction/venv/lib/python3.13/site-packages/sklearn/model_selection/_split.py:813: UserWarning: The least populated class in y has only 4 members, which is less than n_splits=5.
  warnings.warn(
[I 2026-02-28 11:57:57,530] Trial 127 finished with value: 0.888252889075798 and parameters: {'activation': 'relu', 'solver': 'adam', 'lr': 0.0001368003708638659, 'layer1': 10, 'layer2': 284, 'layer3': 54}. Best is trial 71 with value: 0.9257111996592865.
Klebsiella_Pneumoniae | LPS | Optuna:  64%|██████▍   | 128/200 [3:10:13<1:23:46, 69.81s/it, best=0.926]Klebsiella_Pneumoniae | LPS | Optuna:  64%|██████▍   | 128/200 [3:10:13<1:23:46, 69.81s/it, best=0.926][I 2026-02-28 11:59:10,146] Trial 104 finished with value: 0.8851563317531774 and parameters: {'activation': 'identity', 'solver': 'adam', 'lr': 0.0007400262511131067, 'layer1': 129, 'layer2': 402, 'layer3': 434}. Best is trial 8 with value: 0.8879562150966016.
Staphylococcus_Aureus | LPS | Optuna:  52%|█████▎    | 105/200 [3:52:56<3:11:17, 120.82s/it, best=0.888]Staphylococcus_Aureus | LPS | Optuna:  52%|█████▎    | 105/200 [3:52:56<3:11:17, 120.82s/it, best=0.888][I 2026-02-28 11:59:16,505] Trial 168 finished with value: 0.8658883052271683 and parameters: {'activation': 'identity', 'solver': 'adam', 'lr': 0.0001859790790144656, 'layer1': 395, 'layer2': 342, 'layer3': 193}. Best is trial 155 with value: 0.8677633336625616.
Pseudomonas_Aeruginosa | DirectMulti | Optuna:  84%|████████▍ | 169/200 [5:03:02<49:55, 96.62s/it, best=0.868]Pseudomonas_Aeruginosa | DirectMulti | Optuna:  84%|████████▍ | 169/200 [5:03:02<49:55, 96.62s/it, best=0.868]/export/usuarios01/egarroyo/MALDI_for_AMR_prediction/venv/lib/python3.13/site-packages/sklearn/model_selection/_split.py:813: UserWarning: The least populated class in y has only 4 members, which is less than n_splits=5.
  warnings.warn(
[I 2026-02-28 11:59:22,566] Trial 110 finished with value: 0.9140846134511277 and parameters: {'activation': 'relu', 'solver': 'adam', 'lr': 0.00012875291704067703, 'layer1': 302, 'layer2': 383, 'layer3': 90}. Best is trial 74 with value: 0.9166002918687234.

Escherichia_Coli | Piperacillin-Tazobactam | Optuna:  56%|█████▌    | 111/200 [3:55:15<3:18:10, 133.60s/it, best=0.917][A
Escherichia_Coli | Piperacillin-Tazobactam | Optuna:  56%|█████▌    | 111/200 [3:55:15<3:18:10, 133.60s/it, best=0.917][A[I 2026-02-28 11:59:46,783] Trial 128 finished with value: 0.9222191028386926 and parameters: {'activation': 'identity', 'solver': 'adam', 'lr': 4.3714487225458616e-05, 'layer1': 93, 'layer2': 423, 'layer3': 77}. Best is trial 71 with value: 0.9257111996592865.
Klebsiella_Pneumoniae | LPS | Optuna:  64%|██████▍   | 129/200 [3:12:02<1:36:36, 81.65s/it, best=0.926]Klebsiella_Pneumoniae | LPS | Optuna:  64%|██████▍   | 129/200 [3:12:02<1:36:36, 81.65s/it, best=0.926][I 2026-02-28 12:00:51,884] Trial 169 finished with value: 0.8624887114981099 and parameters: {'activation': 'identity', 'solver': 'adam', 'lr': 0.00017445554322635155, 'layer1': 413, 'layer2': 341, 'layer3': 194}. Best is trial 155 with value: 0.8677633336625616.
Pseudomonas_Aeruginosa | DirectMulti | Optuna:  85%|████████▌ | 170/200 [5:04:38<48:07, 96.25s/it, best=0.868]Pseudomonas_Aeruginosa | DirectMulti | Optuna:  85%|████████▌ | 170/200 [5:04:38<48:07, 96.25s/it, best=0.868]/export/usuarios01/egarroyo/MALDI_for_AMR_prediction/venv/lib/python3.13/site-packages/sklearn/model_selection/_split.py:813: UserWarning: The least populated class in y has only 4 members, which is less than n_splits=5.
  warnings.warn(
[I 2026-02-28 12:00:54,535] Trial 129 finished with value: 0.9212803154176369 and parameters: {'activation': 'tanh', 'solver': 'adam', 'lr': 0.0003724616122631731, 'layer1': 227, 'layer2': 256, 'layer3': 134}. Best is trial 71 with value: 0.9257111996592865.
Klebsiella_Pneumoniae | LPS | Optuna:  65%|██████▌   | 130/200 [3:13:10<1:30:23, 77.48s/it, best=0.926]Klebsiella_Pneumoniae | LPS | Optuna:  65%|██████▌   | 130/200 [3:13:10<1:30:23, 77.48s/it, best=0.926][I 2026-02-28 12:01:00,603] Trial 105 finished with value: 0.8850848339985543 and parameters: {'activation': 'relu', 'solver': 'adam', 'lr': 0.00029851807039546973, 'layer1': 355, 'layer2': 146, 'layer3': 262}. Best is trial 8 with value: 0.8879562150966016.
Staphylococcus_Aureus | LPS | Optuna:  53%|█████▎    | 106/200 [3:54:46<3:04:24, 117.71s/it, best=0.888]Staphylococcus_Aureus | LPS | Optuna:  53%|█████▎    | 106/200 [3:54:46<3:04:24, 117.71s/it, best=0.888][I 2026-02-28 12:01:36,976] Trial 111 finished with value: 0.9140990146744729 and parameters: {'activation': 'tanh', 'solver': 'adam', 'lr': 8.70271308556056e-05, 'layer1': 465, 'layer2': 302, 'layer3': 412}. Best is trial 74 with value: 0.9166002918687234.

Escherichia_Coli | Piperacillin-Tazobactam | Optuna:  56%|█████▌    | 112/200 [3:57:29<3:16:18, 133.84s/it, best=0.917][A
Escherichia_Coli | Piperacillin-Tazobactam | Optuna:  56%|█████▌    | 112/200 [3:57:29<3:16:18, 133.84s/it, best=0.917][A[I 2026-02-28 12:02:03,905] Trial 170 finished with value: 0.8489485824499058 and parameters: {'activation': 'logistic', 'solver': 'adam', 'lr': 0.000215121166979597, 'layer1': 364, 'layer2': 226, 'layer3': 206}. Best is trial 155 with value: 0.8677633336625616.
Pseudomonas_Aeruginosa | DirectMulti | Optuna:  86%|████████▌ | 171/200 [5:05:50<43:00, 88.98s/it, best=0.868]Pseudomonas_Aeruginosa | DirectMulti | Optuna:  86%|████████▌ | 171/200 [5:05:50<43:00, 88.98s/it, best=0.868]/export/usuarios01/egarroyo/MALDI_for_AMR_prediction/venv/lib/python3.13/site-packages/sklearn/model_selection/_split.py:813: UserWarning: The least populated class in y has only 4 members, which is less than n_splits=5.
  warnings.warn(
[I 2026-02-28 12:02:14,575] Trial 106 finished with value: 0.8843418291674338 and parameters: {'activation': 'identity', 'solver': 'adam', 'lr': 0.0005756082093295335, 'layer1': 17, 'layer2': 107, 'layer3': 469}. Best is trial 8 with value: 0.8879562150966016.
Staphylococcus_Aureus | LPS | Optuna:  54%|█████▎    | 107/200 [3:56:00<2:42:06, 104.59s/it, best=0.888]Staphylococcus_Aureus | LPS | Optuna:  54%|█████▎    | 107/200 [3:56:00<2:42:06, 104.59s/it, best=0.888][I 2026-02-28 12:02:31,615] Trial 130 finished with value: 0.9224645570397396 and parameters: {'activation': 'identity', 'solver': 'adam', 'lr': 0.00019657342035786263, 'layer1': 408, 'layer2': 300, 'layer3': 101}. Best is trial 71 with value: 0.9257111996592865.
Klebsiella_Pneumoniae | LPS | Optuna:  66%|██████▌   | 131/200 [3:14:47<1:35:51, 83.36s/it, best=0.926]Klebsiella_Pneumoniae | LPS | Optuna:  66%|██████▌   | 131/200 [3:14:47<1:35:51, 83.36s/it, best=0.926][I 2026-02-28 12:03:28,658] Trial 171 finished with value: 0.8629337422609854 and parameters: {'activation': 'identity', 'solver': 'adam', 'lr': 0.00016967159171679767, 'layer1': 396, 'layer2': 313, 'layer3': 170}. Best is trial 155 with value: 0.8677633336625616.
Pseudomonas_Aeruginosa | DirectMulti | Optuna:  86%|████████▌ | 172/200 [5:07:14<40:55, 87.71s/it, best=0.868]Pseudomonas_Aeruginosa | DirectMulti | Optuna:  86%|████████▌ | 172/200 [5:07:14<40:55, 87.71s/it, best=0.868]/export/usuarios01/egarroyo/MALDI_for_AMR_prediction/venv/lib/python3.13/site-packages/sklearn/model_selection/_split.py:813: UserWarning: The least populated class in y has only 4 members, which is less than n_splits=5.
  warnings.warn(
[I 2026-02-28 12:03:45,887] Trial 112 finished with value: 0.9157040154197913 and parameters: {'activation': 'relu', 'solver': 'adam', 'lr': 0.00019925218178468, 'layer1': 342, 'layer2': 323, 'layer3': 130}. Best is trial 74 with value: 0.9166002918687234.

Escherichia_Coli | Piperacillin-Tazobactam | Optuna:  56%|█████▋    | 113/200 [3:59:38<3:11:55, 132.36s/it, best=0.917][A
Escherichia_Coli | Piperacillin-Tazobactam | Optuna:  56%|█████▋    | 113/200 [3:59:38<3:11:55, 132.36s/it, best=0.917][A[I 2026-02-28 12:03:59,387] Trial 131 finished with value: 0.9222231129175242 and parameters: {'activation': 'identity', 'solver': 'adam', 'lr': 0.00028589017346056196, 'layer1': 107, 'layer2': 351, 'layer3': 107}. Best is trial 71 with value: 0.9257111996592865.
Klebsiella_Pneumoniae | LPS | Optuna:  66%|██████▌   | 132/200 [3:16:15<1:35:58, 84.68s/it, best=0.926]Klebsiella_Pneumoniae | LPS | Optuna:  66%|██████▌   | 132/200 [3:16:15<1:35:58, 84.68s/it, best=0.926][I 2026-02-28 12:05:08,801] Trial 172 finished with value: 0.8621333310119754 and parameters: {'activation': 'identity', 'solver': 'adam', 'lr': 0.0003533555285923119, 'layer1': 378, 'layer2': 354, 'layer3': 185}. Best is trial 155 with value: 0.8677633336625616.
Pseudomonas_Aeruginosa | DirectMulti | Optuna:  86%|████████▋ | 173/200 [5:08:55<41:08, 91.44s/it, best=0.868]Pseudomonas_Aeruginosa | DirectMulti | Optuna:  86%|████████▋ | 173/200 [5:08:55<41:08, 91.44s/it, best=0.868]/export/usuarios01/egarroyo/MALDI_for_AMR_prediction/venv/lib/python3.13/site-packages/sklearn/model_selection/_split.py:813: UserWarning: The least populated class in y has only 4 members, which is less than n_splits=5.
  warnings.warn(
[I 2026-02-28 12:05:44,692] Trial 132 finished with value: 0.9231476354323502 and parameters: {'activation': 'identity', 'solver': 'adam', 'lr': 5.851587083448401e-05, 'layer1': 84, 'layer2': 265, 'layer3': 125}. Best is trial 71 with value: 0.9257111996592865.
Klebsiella_Pneumoniae | LPS | Optuna:  66%|██████▋   | 133/200 [3:18:00<1:41:28, 90.87s/it, best=0.926]Klebsiella_Pneumoniae | LPS | Optuna:  66%|██████▋   | 133/200 [3:18:00<1:41:28, 90.87s/it, best=0.926][I 2026-02-28 12:06:03,995] Trial 113 finished with value: 0.9133728876660878 and parameters: {'activation': 'relu', 'solver': 'adam', 'lr': 0.00019566181425992974, 'layer1': 348, 'layer2': 326, 'layer3': 135}. Best is trial 74 with value: 0.9166002918687234.

Escherichia_Coli | Piperacillin-Tazobactam | Optuna:  57%|█████▋    | 114/200 [4:01:56<3:12:11, 134.09s/it, best=0.917][A
Escherichia_Coli | Piperacillin-Tazobactam | Optuna:  57%|█████▋    | 114/200 [4:01:56<3:12:11, 134.09s/it, best=0.917][A[I 2026-02-28 12:06:13,689] Trial 107 finished with value: 0.8646628559777145 and parameters: {'activation': 'identity', 'solver': 'adam', 'lr': 8.642057836876908e-06, 'layer1': 209, 'layer2': 370, 'layer3': 294}. Best is trial 8 with value: 0.8879562150966016.
Staphylococcus_Aureus | LPS | Optuna:  54%|█████▍    | 108/200 [4:00:00<3:42:15, 144.95s/it, best=0.888]Staphylococcus_Aureus | LPS | Optuna:  54%|█████▍    | 108/200 [4:00:00<3:42:15, 144.95s/it, best=0.888][I 2026-02-28 12:06:37,054] Trial 173 finished with value: 0.8631000898613534 and parameters: {'activation': 'identity', 'solver': 'adam', 'lr': 0.0001436399492768437, 'layer1': 405, 'layer2': 336, 'layer3': 140}. Best is trial 155 with value: 0.8677633336625616.
Pseudomonas_Aeruginosa | DirectMulti | Optuna:  87%|████████▋ | 174/200 [5:10:23<39:12, 90.48s/it, best=0.868]Pseudomonas_Aeruginosa | DirectMulti | Optuna:  87%|████████▋ | 174/200 [5:10:23<39:12, 90.48s/it, best=0.868]/export/usuarios01/egarroyo/MALDI_for_AMR_prediction/venv/lib/python3.13/site-packages/sklearn/model_selection/_split.py:813: UserWarning: The least populated class in y has only 4 members, which is less than n_splits=5.
  warnings.warn(
[I 2026-02-28 12:06:56,662] Trial 133 finished with value: 0.924820830055878 and parameters: {'activation': 'identity', 'solver': 'adam', 'lr': 0.00023019894247464957, 'layer1': 43, 'layer2': 439, 'layer3': 84}. Best is trial 71 with value: 0.9257111996592865.
Klebsiella_Pneumoniae | LPS | Optuna:  67%|██████▋   | 134/200 [3:19:12<1:33:43, 85.20s/it, best=0.926]Klebsiella_Pneumoniae | LPS | Optuna:  67%|██████▋   | 134/200 [3:19:12<1:33:43, 85.20s/it, best=0.926][I 2026-02-28 12:08:09,075] Trial 174 finished with value: 0.8623577120932918 and parameters: {'activation': 'identity', 'solver': 'adam', 'lr': 0.000514696887699395, 'layer1': 393, 'layer2': 321, 'layer3': 124}. Best is trial 155 with value: 0.8677633336625616.
Pseudomonas_Aeruginosa | DirectMulti | Optuna:  88%|████████▊ | 175/200 [5:11:55<37:53, 90.95s/it, best=0.868]Pseudomonas_Aeruginosa | DirectMulti | Optuna:  88%|████████▊ | 175/200 [5:11:55<37:53, 90.95s/it, best=0.868]/export/usuarios01/egarroyo/MALDI_for_AMR_prediction/venv/lib/python3.13/site-packages/sklearn/model_selection/_split.py:813: UserWarning: The least populated class in y has only 4 members, which is less than n_splits=5.
  warnings.warn(
[I 2026-02-28 12:08:26,476] Trial 114 finished with value: 0.9136068480437066 and parameters: {'activation': 'relu', 'solver': 'adam', 'lr': 0.00026165406360195134, 'layer1': 366, 'layer2': 292, 'layer3': 125}. Best is trial 74 with value: 0.9166002918687234.

Escherichia_Coli | Piperacillin-Tazobactam | Optuna:  57%|█████▊    | 115/200 [4:04:19<3:13:31, 136.60s/it, best=0.917][A
Escherichia_Coli | Piperacillin-Tazobactam | Optuna:  57%|█████▊    | 115/200 [4:04:19<3:13:31, 136.60s/it, best=0.917][A[I 2026-02-28 12:08:28,702] Trial 134 finished with value: 0.9250023753096462 and parameters: {'activation': 'identity', 'solver': 'adam', 'lr': 0.00022981512377808643, 'layer1': 46, 'layer2': 460, 'layer3': 351}. Best is trial 71 with value: 0.9257111996592865.
