Klebsiella_Pneumoniae | Ceftriaxone | Optuna:   8%|▊         | 17/200 [28:14<5:59:50, 117.98s/it, best=0.907][A[I 2026-02-27 21:19:12,970] Trial 162 finished with value: 0.8611817965252111 and parameters: {'activation': 'relu', 'solver': 'adam', 'lr': 0.0002067630900568771, 'layer1': 500, 'layer2': 384, 'layer3': 399}. Best is trial 126 with value: 0.8664911301660769.

Pseudomonas_Aeruginosa | Imipenem | Optuna:  82%|████████▏ | 163/200 [2:47:07<51:24, 83.37s/it, best=0.867][A
Pseudomonas_Aeruginosa | Imipenem | Optuna:  82%|████████▏ | 163/200 [2:47:07<51:24, 83.37s/it, best=0.867][A[I 2026-02-27 21:19:19,898] Trial 158 finished with value: 0.7983413301280728 and parameters: {'activation': 'tanh', 'solver': 'adam', 'lr': 1.9788896766750533e-05, 'layer1': 205, 'layer2': 244, 'layer3': 359}. Best is trial 124 with value: 0.8095465376114227.

Escherichia_Coli | Ciprofloxacin | Optuna:  80%|███████▉  | 159/200 [6:31:49<1:30:56, 133.09s/it, best=0.809][A
Escherichia_Coli | Ciprofloxacin | Optuna:  80%|███████▉  | 159/200 [6:31:49<1:30:56, 133.09s/it, best=0.809][A[I 2026-02-27 21:20:07,427] Trial 180 finished with value: 0.9068653463726115 and parameters: {'activation': 'identity', 'solver': 'adam', 'lr': 0.0002830220712203078, 'layer1': 296, 'layer2': 450, 'layer3': 375}. Best is trial 152 with value: 0.9102139153966748.

Staphylococcus_Aureus | Oxacillin | Optuna:  90%|█████████ | 181/200 [6:32:37<40:32, 128.01s/it, best=0.91][A
Staphylococcus_Aureus | Oxacillin | Optuna:  90%|█████████ | 181/200 [6:32:37<40:32, 128.01s/it, best=0.91][A[I 2026-02-27 21:20:07,594] Trial 159 finished with value: 0.6046084710371495 and parameters: {'activation': 'logistic', 'solver': 'adam', 'lr': 2.548511457990299e-05, 'layer1': 298, 'layer2': 232, 'layer3': 45}. Best is trial 124 with value: 0.8095465376114227.

Escherichia_Coli | Ciprofloxacin | Optuna:  80%|████████  | 160/200 [6:32:36<1:11:38, 107.47s/it, best=0.809][A
Escherichia_Coli | Ciprofloxacin | Optuna:  80%|████████  | 160/200 [6:32:36<1:11:38, 107.47s/it, best=0.809][A[I 2026-02-27 21:20:29,094] Trial 163 finished with value: 0.8572846870237212 and parameters: {'activation': 'relu', 'solver': 'adam', 'lr': 0.00011393327718979918, 'layer1': 485, 'layer2': 367, 'layer3': 460}. Best is trial 126 with value: 0.8664911301660769.

Pseudomonas_Aeruginosa | Imipenem | Optuna:  82%|████████▏ | 164/200 [2:48:23<48:43, 81.20s/it, best=0.867][A
Pseudomonas_Aeruginosa | Imipenem | Optuna:  82%|████████▏ | 164/200 [2:48:23<48:43, 81.20s/it, best=0.867][A[I 2026-02-27 21:21:05,586] Trial 17 finished with value: 0.9073937608183049 and parameters: {'activation': 'identity', 'solver': 'adam', 'lr': 6.446221903608035e-05, 'layer1': 445, 'layer2': 389, 'layer3': 414}. Best is trial 17 with value: 0.9073937608183049.

Klebsiella_Pneumoniae | Ceftriaxone | Optuna:   9%|▉         | 18/200 [30:27<6:11:39, 122.53s/it, best=0.907][A
Klebsiella_Pneumoniae | Ceftriaxone | Optuna:   9%|▉         | 18/200 [30:27<6:11:39, 122.53s/it, best=0.907][A[I 2026-02-27 21:21:40,407] Trial 164 finished with value: 0.8587819265006725 and parameters: {'activation': 'relu', 'solver': 'adam', 'lr': 0.0002835947192282775, 'layer1': 463, 'layer2': 439, 'layer3': 484}. Best is trial 126 with value: 0.8664911301660769.

Pseudomonas_Aeruginosa | Imipenem | Optuna:  82%|████████▎ | 165/200 [2:49:34<45:38, 78.23s/it, best=0.867][A
Pseudomonas_Aeruginosa | Imipenem | Optuna:  82%|████████▎ | 165/200 [2:49:34<45:38, 78.23s/it, best=0.867][A[I 2026-02-27 21:21:58,825] Trial 181 finished with value: 0.9031803503014215 and parameters: {'activation': 'identity', 'solver': 'adam', 'lr': 0.00012797747972796076, 'layer1': 235, 'layer2': 456, 'layer3': 367}. Best is trial 152 with value: 0.9102139153966748.

Staphylococcus_Aureus | Oxacillin | Optuna:  91%|█████████ | 182/200 [6:34:28<36:54, 123.03s/it, best=0.91][A
Staphylococcus_Aureus | Oxacillin | Optuna:  91%|█████████ | 182/200 [6:34:28<36:54, 123.03s/it, best=0.91][A[I 2026-02-27 21:22:32,320] Trial 160 finished with value: 0.8042689159470745 and parameters: {'activation': 'tanh', 'solver': 'adam', 'lr': 3.566983577013972e-05, 'layer1': 174, 'layer2': 343, 'layer3': 57}. Best is trial 124 with value: 0.8095465376114227.

Escherichia_Coli | Ciprofloxacin | Optuna:  80%|████████  | 161/200 [6:35:01<1:17:07, 118.65s/it, best=0.809][A
Escherichia_Coli | Ciprofloxacin | Optuna:  80%|████████  | 161/200 [6:35:01<1:17:07, 118.65s/it, best=0.809][A[I 2026-02-27 21:22:53,255] Trial 165 finished with value: 0.8593274340833146 and parameters: {'activation': 'relu', 'solver': 'adam', 'lr': 0.0003696066847400042, 'layer1': 439, 'layer2': 300, 'layer3': 485}. Best is trial 126 with value: 0.8664911301660769.

Pseudomonas_Aeruginosa | Imipenem | Optuna:  83%|████████▎ | 166/200 [2:50:47<43:25, 76.62s/it, best=0.867][A
Pseudomonas_Aeruginosa | Imipenem | Optuna:  83%|████████▎ | 166/200 [2:50:47<43:25, 76.62s/it, best=0.867][A[I 2026-02-27 21:24:15,180] Trial 166 finished with value: 0.8658184684633957 and parameters: {'activation': 'relu', 'solver': 'adam', 'lr': 0.00022846505416503836, 'layer1': 478, 'layer2': 377, 'layer3': 425}. Best is trial 126 with value: 0.8664911301660769.

Pseudomonas_Aeruginosa | Imipenem | Optuna:  84%|████████▎ | 167/200 [2:52:09<43:00, 78.21s/it, best=0.867][A
Pseudomonas_Aeruginosa | Imipenem | Optuna:  84%|████████▎ | 167/200 [2:52:09<43:00, 78.21s/it, best=0.867][A[I 2026-02-27 21:24:24,354] Trial 161 finished with value: 0.8036359772980817 and parameters: {'activation': 'tanh', 'solver': 'adam', 'lr': 5.737728196313584e-05, 'layer1': 162, 'layer2': 252, 'layer3': 70}. Best is trial 124 with value: 0.8095465376114227.

Escherichia_Coli | Ciprofloxacin | Optuna:  81%|████████  | 162/200 [6:36:53<1:13:53, 116.66s/it, best=0.809][A
Escherichia_Coli | Ciprofloxacin | Optuna:  81%|████████  | 162/200 [6:36:53<1:13:53, 116.66s/it, best=0.809][A[I 2026-02-27 21:24:27,213] Trial 18 finished with value: 0.7718959241296349 and parameters: {'activation': 'tanh', 'solver': 'sgd', 'lr': 4.2497987039186844e-05, 'layer1': 433, 'layer2': 401, 'layer3': 396}. Best is trial 17 with value: 0.9073937608183049.

Klebsiella_Pneumoniae | Ceftriaxone | Optuna:  10%|▉         | 19/200 [33:48<7:21:17, 146.28s/it, best=0.907][A
Klebsiella_Pneumoniae | Ceftriaxone | Optuna:  10%|▉         | 19/200 [33:48<7:21:17, 146.28s/it, best=0.907][A[I 2026-02-27 21:24:30,423] Trial 182 finished with value: 0.9063361433383494 and parameters: {'activation': 'identity', 'solver': 'adam', 'lr': 9.534488070099735e-05, 'layer1': 285, 'layer2': 465, 'layer3': 406}. Best is trial 152 with value: 0.9102139153966748.

Staphylococcus_Aureus | Oxacillin | Optuna:  92%|█████████▏| 183/200 [6:37:00<37:17, 131.60s/it, best=0.91][A
Staphylococcus_Aureus | Oxacillin | Optuna:  92%|█████████▏| 183/200 [6:37:00<37:17, 131.60s/it, best=0.91][A[I 2026-02-27 21:25:18,341] Trial 167 finished with value: 0.8568475755503038 and parameters: {'activation': 'tanh', 'solver': 'adam', 'lr': 0.00017404540793438926, 'layer1': 474, 'layer2': 371, 'layer3': 427}. Best is trial 126 with value: 0.8664911301660769.

Pseudomonas_Aeruginosa | Imipenem | Optuna:  84%|████████▍ | 168/200 [2:53:12<39:18, 73.70s/it, best=0.867][A
Pseudomonas_Aeruginosa | Imipenem | Optuna:  84%|████████▍ | 168/200 [2:53:12<39:18, 73.70s/it, best=0.867][A[I 2026-02-27 21:25:41,682] Trial 168 finished with value: 0.8185802286937287 and parameters: {'activation': 'relu', 'solver': 'sgd', 'lr': 0.006630617392564939, 'layer1': 450, 'layer2': 385, 'layer3': 424}. Best is trial 126 with value: 0.8664911301660769.

Pseudomonas_Aeruginosa | Imipenem | Optuna:  84%|████████▍ | 169/200 [2:53:35<30:16, 58.59s/it, best=0.867][A
Pseudomonas_Aeruginosa | Imipenem | Optuna:  84%|████████▍ | 169/200 [2:53:35<30:16, 58.59s/it, best=0.867][A[I 2026-02-27 21:25:51,024] Trial 19 finished with value: 0.8573821152933109 and parameters: {'activation': 'logistic', 'solver': 'adam', 'lr': 0.004019961076288503, 'layer1': 423, 'layer2': 335, 'layer3': 361}. Best is trial 17 with value: 0.9073937608183049.

Klebsiella_Pneumoniae | Ceftriaxone | Optuna:  10%|█         | 20/200 [35:12<6:22:34, 127.53s/it, best=0.907][A
Klebsiella_Pneumoniae | Ceftriaxone | Optuna:  10%|█         | 20/200 [35:12<6:22:34, 127.53s/it, best=0.907][A[I 2026-02-27 21:26:05,333] Trial 162 finished with value: 0.8031108758522297 and parameters: {'activation': 'tanh', 'solver': 'adam', 'lr': 7.632562453440799e-05, 'layer1': 183, 'layer2': 262, 'layer3': 63}. Best is trial 124 with value: 0.8095465376114227.

Escherichia_Coli | Ciprofloxacin | Optuna:  82%|████████▏ | 163/200 [6:38:34<1:09:02, 111.96s/it, best=0.809][A
Escherichia_Coli | Ciprofloxacin | Optuna:  82%|████████▏ | 163/200 [6:38:34<1:09:02, 111.96s/it, best=0.809][A[I 2026-02-27 21:26:36,700] Trial 183 finished with value: 0.9085380569262729 and parameters: {'activation': 'identity', 'solver': 'adam', 'lr': 7.850661597948003e-05, 'layer1': 193, 'layer2': 218, 'layer3': 487}. Best is trial 152 with value: 0.9102139153966748.

Staphylococcus_Aureus | Oxacillin | Optuna:  92%|█████████▏| 184/200 [6:39:06<34:40, 130.00s/it, best=0.91][A
Staphylococcus_Aureus | Oxacillin | Optuna:  92%|█████████▏| 184/200 [6:39:06<34:40, 130.00s/it, best=0.91][A[I 2026-02-27 21:26:47,541] Trial 169 finished with value: 0.8623192871225285 and parameters: {'activation': 'relu', 'solver': 'adam', 'lr': 0.0003318210625654949, 'layer1': 430, 'layer2': 401, 'layer3': 500}. Best is trial 126 with value: 0.8664911301660769.

Pseudomonas_Aeruginosa | Imipenem | Optuna:  85%|████████▌ | 170/200 [2:54:41<30:23, 60.77s/it, best=0.867][A
Pseudomonas_Aeruginosa | Imipenem | Optuna:  85%|████████▌ | 170/200 [2:54:41<30:23, 60.77s/it, best=0.867][A[I 2026-02-27 21:27:13,249] Trial 20 finished with value: 0.9036087459643065 and parameters: {'activation': 'identity', 'solver': 'adam', 'lr': 0.0002598769602207437, 'layer1': 201, 'layer2': 119, 'layer3': 448}. Best is trial 17 with value: 0.9073937608183049.

Klebsiella_Pneumoniae | Ceftriaxone | Optuna:  10%|█         | 21/200 [36:34<5:39:53, 113.93s/it, best=0.907][A
Klebsiella_Pneumoniae | Ceftriaxone | Optuna:  10%|█         | 21/200 [36:34<5:39:53, 113.93s/it, best=0.907][A[I 2026-02-27 21:28:06,806] Trial 163 finished with value: 0.804569023336645 and parameters: {'activation': 'tanh', 'solver': 'adam', 'lr': 5.539997178366004e-05, 'layer1': 143, 'layer2': 196, 'layer3': 31}. Best is trial 124 with value: 0.8095465376114227.

Escherichia_Coli | Ciprofloxacin | Optuna:  82%|████████▏ | 164/200 [6:40:36<1:08:53, 114.81s/it, best=0.809][A
Escherichia_Coli | Ciprofloxacin | Optuna:  82%|████████▏ | 164/200 [6:40:36<1:08:53, 114.81s/it, best=0.809][A[I 2026-02-27 21:28:13,475] Trial 170 finished with value: 0.8602443582542643 and parameters: {'activation': 'relu', 'solver': 'adam', 'lr': 0.0002169654455647525, 'layer1': 459, 'layer2': 351, 'layer3': 445}. Best is trial 126 with value: 0.8664911301660769.

Pseudomonas_Aeruginosa | Imipenem | Optuna:  86%|████████▌ | 171/200 [2:56:07<33:01, 68.32s/it, best=0.867][A
Pseudomonas_Aeruginosa | Imipenem | Optuna:  86%|████████▌ | 171/200 [2:56:07<33:01, 68.32s/it, best=0.867][A[I 2026-02-27 21:29:10,669] Trial 21 finished with value: 0.9048952894187282 and parameters: {'activation': 'identity', 'solver': 'adam', 'lr': 0.00011585692824308946, 'layer1': 470, 'layer2': 370, 'layer3': 463}. Best is trial 17 with value: 0.9073937608183049.

Klebsiella_Pneumoniae | Ceftriaxone | Optuna:  11%|█         | 22/200 [38:32<5:41:05, 114.98s/it, best=0.907][A
Klebsiella_Pneumoniae | Ceftriaxone | Optuna:  11%|█         | 22/200 [38:32<5:41:05, 114.98s/it, best=0.907][A[I 2026-02-27 21:29:35,629] Trial 184 finished with value: 0.9074251853403881 and parameters: {'activation': 'identity', 'solver': 'adam', 'lr': 0.00018114225755115696, 'layer1': 307, 'layer2': 438, 'layer3': 488}. Best is trial 152 with value: 0.9102139153966748.

Staphylococcus_Aureus | Oxacillin | Optuna:  92%|█████████▎| 185/200 [6:42:05<36:10, 144.68s/it, best=0.91][A
Staphylococcus_Aureus | Oxacillin | Optuna:  92%|█████████▎| 185/200 [6:42:05<36:10, 144.68s/it, best=0.91][A[I 2026-02-27 21:29:56,017] Trial 171 finished with value: 0.862655265145855 and parameters: {'activation': 'relu', 'solver': 'adam', 'lr': 0.00013628427087346534, 'layer1': 482, 'layer2': 375, 'layer3': 45}. Best is trial 126 with value: 0.8664911301660769.

Pseudomonas_Aeruginosa | Imipenem | Optuna:  86%|████████▌ | 172/200 [2:57:50<36:40, 78.59s/it, best=0.867][A
Pseudomonas_Aeruginosa | Imipenem | Optuna:  86%|████████▌ | 172/200 [2:57:50<36:40, 78.59s/it, best=0.867][A[I 2026-02-27 21:30:02,116] Trial 164 finished with value: 0.8031725057799901 and parameters: {'activation': 'tanh', 'solver': 'adam', 'lr': 4.747466121276077e-05, 'layer1': 168, 'layer2': 240, 'layer3': 48}. Best is trial 124 with value: 0.8095465376114227.

Escherichia_Coli | Ciprofloxacin | Optuna:  82%|████████▎ | 165/200 [6:42:31<1:07:03, 114.96s/it, best=0.809][A
Escherichia_Coli | Ciprofloxacin | Optuna:  82%|████████▎ | 165/200 [6:42:31<1:07:03, 114.96s/it, best=0.809][A[I 2026-02-27 21:30:54,000] Trial 22 finished with value: 0.9030988275811384 and parameters: {'activation': 'identity', 'solver': 'adam', 'lr': 3.220949257663769e-05, 'layer1': 387, 'layer2': 412, 'layer3': 370}. Best is trial 17 with value: 0.9073937608183049.

Klebsiella_Pneumoniae | Ceftriaxone | Optuna:  12%|█▏        | 23/200 [40:15<5:28:52, 111.48s/it, best=0.907][A
Klebsiella_Pneumoniae | Ceftriaxone | Optuna:  12%|█▏        | 23/200 [40:15<5:28:52, 111.48s/it, best=0.907][A[I 2026-02-27 21:31:06,685] Trial 185 finished with value: 0.9051483003241284 and parameters: {'activation': 'identity', 'solver': 'adam', 'lr': 0.00010975762041772968, 'layer1': 181, 'layer2': 200, 'layer3': 341}. Best is trial 152 with value: 0.9102139153966748.

Staphylococcus_Aureus | Oxacillin | Optuna:  93%|█████████▎| 186/200 [6:43:36<30:00, 128.59s/it, best=0.91][A
Staphylococcus_Aureus | Oxacillin | Optuna:  93%|█████████▎| 186/200 [6:43:36<30:00, 128.59s/it, best=0.91][A[I 2026-02-27 21:31:07,041] Trial 172 finished with value: 0.8605682807852315 and parameters: {'activation': 'relu', 'solver': 'adam', 'lr': 0.00024045990449590005, 'layer1': 474, 'layer2': 323, 'layer3': 474}. Best is trial 126 with value: 0.8664911301660769.

Pseudomonas_Aeruginosa | Imipenem | Optuna:  86%|████████▋ | 173/200 [2:59:01<34:20, 76.32s/it, best=0.867][A
Pseudomonas_Aeruginosa | Imipenem | Optuna:  86%|████████▋ | 173/200 [2:59:01<34:20, 76.32s/it, best=0.867][A[I 2026-02-27 21:31:33,267] Trial 165 finished with value: 0.805901342335584 and parameters: {'activation': 'tanh', 'solver': 'adam', 'lr': 6.916417300277861e-05, 'layer1': 155, 'layer2': 287, 'layer3': 20}. Best is trial 124 with value: 0.8095465376114227.

Escherichia_Coli | Ciprofloxacin | Optuna:  83%|████████▎ | 166/200 [6:44:02<1:01:05, 107.82s/it, best=0.809][A
Escherichia_Coli | Ciprofloxacin | Optuna:  83%|████████▎ | 166/200 [6:44:02<1:01:05, 107.82s/it, best=0.809][A[I 2026-02-27 21:32:17,549] Trial 186 finished with value: 0.9043980573851945 and parameters: {'activation': 'tanh', 'solver': 'adam', 'lr': 0.00014165886234744084, 'layer1': 165, 'layer2': 234, 'layer3': 397}. Best is trial 152 with value: 0.9102139153966748.

Staphylococcus_Aureus | Oxacillin | Optuna:  94%|█████████▎| 187/200 [6:44:47<24:06, 111.27s/it, best=0.91][A
Staphylococcus_Aureus | Oxacillin | Optuna:  94%|█████████▎| 187/200 [6:44:47<24:06, 111.27s/it, best=0.91][A[I 2026-02-27 21:32:39,374] Trial 173 finished with value: 0.8662332937367786 and parameters: {'activation': 'relu', 'solver': 'adam', 'lr': 0.0002896881089211344, 'layer1': 492, 'layer2': 360, 'layer3': 298}. Best is trial 126 with value: 0.8664911301660769.

Pseudomonas_Aeruginosa | Imipenem | Optuna:  87%|████████▋ | 174/200 [3:00:33<35:09, 81.12s/it, best=0.867][A
Pseudomonas_Aeruginosa | Imipenem | Optuna:  87%|████████▋ | 174/200 [3:00:33<35:09, 81.12s/it, best=0.867][A[I 2026-02-27 21:32:45,272] Trial 23 finished with value: 0.9040033394136021 and parameters: {'activation': 'identity', 'solver': 'adam', 'lr': 0.0002020255449965227, 'layer1': 457, 'layer2': 353, 'layer3': 441}. Best is trial 17 with value: 0.9073937608183049.

Klebsiella_Pneumoniae | Ceftriaxone | Optuna:  12%|█▏        | 24/200 [42:06<5:26:49, 111.42s/it, best=0.907][A
Klebsiella_Pneumoniae | Ceftriaxone | Optuna:  12%|█▏        | 24/200 [42:06<5:26:49, 111.42s/it, best=0.907][A[I 2026-02-27 21:33:41,230] Trial 166 finished with value: 0.8039026125874782 and parameters: {'activation': 'tanh', 'solver': 'adam', 'lr': 3.95711556494233e-05, 'layer1': 134, 'layer2': 250, 'layer3': 84}. Best is trial 124 with value: 0.8095465376114227.

Escherichia_Coli | Ciprofloxacin | Optuna:  84%|████████▎ | 167/200 [6:46:10<1:02:37, 113.86s/it, best=0.809][A
Escherichia_Coli | Ciprofloxacin | Optuna:  84%|████████▎ | 167/200 [6:46:10<1:02:37, 113.86s/it, best=0.809][A[I 2026-02-27 21:34:15,098] Trial 187 finished with value: 0.9050636401757697 and parameters: {'activation': 'identity', 'solver': 'adam', 'lr': 8.048486823270189e-05, 'layer1': 189, 'layer2': 216, 'layer3': 472}. Best is trial 152 with value: 0.9102139153966748.

Staphylococcus_Aureus | Oxacillin | Optuna:  94%|█████████▍| 188/200 [6:46:44<22:37, 113.16s/it, best=0.91][A
Staphylococcus_Aureus | Oxacillin | Optuna:  94%|█████████▍| 188/200 [6:46:44<22:37, 113.16s/it, best=0.91][A[I 2026-02-27 21:34:16,068] Trial 174 finished with value: 0.8556909618660591 and parameters: {'activation': 'relu', 'solver': 'adam', 'lr': 0.004374284385521809, 'layer1': 480, 'layer2': 362, 'layer3': 265}. Best is trial 126 with value: 0.8664911301660769.

Pseudomonas_Aeruginosa | Imipenem | Optuna:  88%|████████▊ | 175/200 [3:02:10<35:44, 85.79s/it, best=0.867][A
Pseudomonas_Aeruginosa | Imipenem | Optuna:  88%|████████▊ | 175/200 [3:02:10<35:44, 85.79s/it, best=0.867][A[I 2026-02-27 21:34:18,168] Trial 24 finished with value: 0.9042970580134873 and parameters: {'activation': 'identity', 'solver': 'adam', 'lr': 5.098150984214274e-05, 'layer1': 320, 'layer2': 232, 'layer3': 328}. Best is trial 17 with value: 0.9073937608183049.

Klebsiella_Pneumoniae | Ceftriaxone | Optuna:  12%|█▎        | 25/200 [43:39<5:08:45, 105.86s/it, best=0.907][A
Klebsiella_Pneumoniae | Ceftriaxone | Optuna:  12%|█▎        | 25/200 [43:39<5:08:45, 105.86s/it, best=0.907][A[I 2026-02-27 21:34:57,247] Trial 167 finished with value: 0.7952388956822128 and parameters: {'activation': 'tanh', 'solver': 'adam', 'lr': 0.0001872193437040196, 'layer1': 194, 'layer2': 270, 'layer3': 39}. Best is trial 124 with value: 0.8095465376114227.

Escherichia_Coli | Ciprofloxacin | Optuna:  84%|████████▍ | 168/200 [6:47:26<54:40, 102.51s/it, best=0.809]  [A
Escherichia_Coli | Ciprofloxacin | Optuna:  84%|████████▍ | 168/200 [6:47:26<54:40, 102.51s/it, best=0.809][A[I 2026-02-27 21:35:21,870] Trial 188 finished with value: 0.7196595818398238 and parameters: {'activation': 'identity', 'solver': 'sgd', 'lr': 0.00018153675216397346, 'layer1': 321, 'layer2': 418, 'layer3': 252}. Best is trial 152 with value: 0.9102139153966748.

Staphylococcus_Aureus | Oxacillin | Optuna:  94%|█████████▍| 189/200 [6:47:51<18:11, 99.24s/it, best=0.91] [A
Staphylococcus_Aureus | Oxacillin | Optuna:  94%|█████████▍| 189/200 [6:47:51<18:11, 99.24s/it, best=0.91][A[I 2026-02-27 21:35:23,315] Trial 175 finished with value: 0.8582181490079244 and parameters: {'activation': 'relu', 'solver': 'adam', 'lr': 0.00041075473980073786, 'layer1': 239, 'layer2': 379, 'layer3': 321}. Best is trial 126 with value: 0.8664911301660769.

Pseudomonas_Aeruginosa | Imipenem | Optuna:  88%|████████▊ | 176/200 [3:03:17<32:05, 80.23s/it, best=0.867][A
Pseudomonas_Aeruginosa | Imipenem | Optuna:  88%|████████▊ | 176/200 [3:03:17<32:05, 80.23s/it, best=0.867][A[I 2026-02-27 21:36:25,458] Trial 176 finished with value: 0.861141670162886 and parameters: {'activation': 'relu', 'solver': 'adam', 'lr': 0.00030175040182544693, 'layer1': 180, 'layer2': 352, 'layer3': 107}. Best is trial 126 with value: 0.8664911301660769.

Pseudomonas_Aeruginosa | Imipenem | Optuna:  88%|████████▊ | 177/200 [3:04:19<28:40, 74.80s/it, best=0.867][A
Pseudomonas_Aeruginosa | Imipenem | Optuna:  88%|████████▊ | 177/200 [3:04:19<28:40, 74.80s/it, best=0.867][A[I 2026-02-27 21:36:40,545] Trial 25 finished with value: 0.9080365798965563 and parameters: {'activation': 'identity', 'solver': 'adam', 'lr': 0.000493153003399682, 'layer1': 462, 'layer2': 443, 'layer3': 496}. Best is trial 25 with value: 0.9080365798965563.

Klebsiella_Pneumoniae | Ceftriaxone | Optuna:  13%|█▎        | 26/200 [46:02<5:38:46, 116.82s/it, best=0.907][A
Klebsiella_Pneumoniae | Ceftriaxone | Optuna:  13%|█▎        | 26/200 [46:02<5:38:46, 116.82s/it, best=0.908][A[I 2026-02-27 21:37:05,624] Trial 168 finished with value: 0.8019371759097915 and parameters: {'activation': 'relu', 'solver': 'adam', 'lr': 8.361579589739992e-05, 'layer1': 113, 'layer2': 311, 'layer3': 28}. Best is trial 124 with value: 0.8095465376114227.

Escherichia_Coli | Ciprofloxacin | Optuna:  84%|████████▍ | 169/200 [6:49:34<56:58, 110.27s/it, best=0.809][A
Escherichia_Coli | Ciprofloxacin | Optuna:  84%|████████▍ | 169/200 [6:49:34<56:58, 110.27s/it, best=0.809][A[I 2026-02-27 21:37:18,980] Trial 189 finished with value: 0.9068511907755067 and parameters: {'activation': 'identity', 'solver': 'adam', 'lr': 0.00022640726284802853, 'layer1': 198, 'layer2': 249, 'layer3': 499}. Best is trial 152 with value: 0.9102139153966748.

Staphylococcus_Aureus | Oxacillin | Optuna:  95%|█████████▌| 190/200 [6:49:48<17:26, 104.60s/it, best=0.91][A
