Staphylococcus_Aureus | Fusidic acid | Optuna:  18%|█▊        | 37/200 [53:28<4:27:17, 98.39s/it, best=0.928][A[I 2026-02-28 03:35:39,526] Trial 6 finished with value: 0.9471948821819935 and parameters: {'activation': 'tanh', 'solver': 'adam', 'lr': 3.6618192203924288e-06, 'layer1': 403, 'layer2': 46, 'layer3': 494}. Best is trial 1 with value: 0.9800270054346416.

Klebsiella_Pneumoniae | Imipenem | Optuna:   4%|▎         | 7/200 [06:52<4:13:59, 78.96s/it, best=0.98][A
Klebsiella_Pneumoniae | Imipenem | Optuna:   4%|▎         | 7/200 [06:52<4:13:59, 78.96s/it, best=0.98][A[I 2026-02-28 03:36:06,190] Trial 7 finished with value: 0.9816721022937823 and parameters: {'activation': 'relu', 'solver': 'adam', 'lr': 0.0012164139351417069, 'layer1': 46, 'layer2': 186, 'layer3': 66}. Best is trial 7 with value: 0.9816721022937823.

Klebsiella_Pneumoniae | Imipenem | Optuna:   4%|▍         | 8/200 [07:18<3:19:24, 62.31s/it, best=0.98][A
Klebsiella_Pneumoniae | Imipenem | Optuna:   4%|▍         | 8/200 [07:18<3:19:24, 62.31s/it, best=0.982][A[I 2026-02-28 03:36:06,816] Trial 63 finished with value: 0.8682133709784562 and parameters: {'activation': 'identity', 'solver': 'adam', 'lr': 0.0011290606659132914, 'layer1': 408, 'layer2': 485, 'layer3': 427}. Best is trial 63 with value: 0.8682133709784562.
Pseudomonas_Aeruginosa | LPS | Optuna:  32%|███▏      | 64/200 [1:31:08<4:01:29, 106.54s/it, best=0.867]Pseudomonas_Aeruginosa | LPS | Optuna:  32%|███▏      | 64/200 [1:31:08<4:01:29, 106.54s/it, best=0.868]/export/usuarios01/egarroyo/MALDI_for_AMR_prediction/venv/lib/python3.13/site-packages/sklearn/model_selection/_split.py:813: UserWarning: The least populated class in y has only 4 members, which is less than n_splits=5.
  warnings.warn(
[I 2026-02-28 03:36:23,455] Trial 106 finished with value: 0.8959657582181482 and parameters: {'activation': 'relu', 'solver': 'adam', 'lr': 0.0001017100255892197, 'layer1': 479, 'layer2': 42, 'layer3': 260}. Best is trial 14 with value: 0.8971256036318559.

Escherichia_Coli | Ceftriaxone | Optuna:  54%|█████▎    | 107/200 [4:26:24<3:45:34, 145.53s/it, best=0.897][A
Escherichia_Coli | Ceftriaxone | Optuna:  54%|█████▎    | 107/200 [4:26:24<3:45:34, 145.53s/it, best=0.897][A[I 2026-02-28 03:36:34,118] Trial 37 finished with value: 0.9243675560217082 and parameters: {'activation': 'tanh', 'solver': 'adam', 'lr': 2.969106236201215e-05, 'layer1': 465, 'layer2': 456, 'layer3': 182}. Best is trial 20 with value: 0.9283335834984147.

Staphylococcus_Aureus | Fusidic acid | Optuna:  19%|█▉        | 38/200 [55:43<4:55:32, 109.46s/it, best=0.928][A
Staphylococcus_Aureus | Fusidic acid | Optuna:  19%|█▉        | 38/200 [55:43<4:55:32, 109.46s/it, best=0.928][A[I 2026-02-28 03:36:54,463] Trial 8 finished with value: 0.9833408517615029 and parameters: {'activation': 'identity', 'solver': 'adam', 'lr': 0.000828752236376816, 'layer1': 323, 'layer2': 445, 'layer3': 241}. Best is trial 8 with value: 0.9833408517615029.

Klebsiella_Pneumoniae | Imipenem | Optuna:   4%|▍         | 9/200 [08:07<3:04:23, 57.92s/it, best=0.982][A
Klebsiella_Pneumoniae | Imipenem | Optuna:   4%|▍         | 9/200 [08:07<3:04:23, 57.92s/it, best=0.983][A[I 2026-02-28 03:37:42,991] Trial 38 finished with value: 0.9059302083341597 and parameters: {'activation': 'identity', 'solver': 'sgd', 'lr': 0.00028266295520045024, 'layer1': 471, 'layer2': 253, 'layer3': 235}. Best is trial 20 with value: 0.9283335834984147.

Staphylococcus_Aureus | Fusidic acid | Optuna:  20%|█▉        | 39/200 [56:52<4:21:02, 97.28s/it, best=0.928] [A
Staphylococcus_Aureus | Fusidic acid | Optuna:  20%|█▉        | 39/200 [56:52<4:21:02, 97.28s/it, best=0.928][A[I 2026-02-28 03:38:02,483] Trial 9 finished with value: 0.9795815845419942 and parameters: {'activation': 'tanh', 'solver': 'sgd', 'lr': 0.00012329098365270507, 'layer1': 219, 'layer2': 22, 'layer3': 62}. Best is trial 8 with value: 0.9833408517615029.

Klebsiella_Pneumoniae | Imipenem | Optuna:   5%|▌         | 10/200 [09:15<3:13:17, 61.04s/it, best=0.983][A
Klebsiella_Pneumoniae | Imipenem | Optuna:   5%|▌         | 10/200 [09:15<3:13:17, 61.04s/it, best=0.983][A[I 2026-02-28 03:38:17,526] Trial 64 finished with value: 0.8664698376024529 and parameters: {'activation': 'identity', 'solver': 'adam', 'lr': 0.0011558291763716505, 'layer1': 406, 'layer2': 500, 'layer3': 432}. Best is trial 63 with value: 0.8682133709784562.
Pseudomonas_Aeruginosa | LPS | Optuna:  32%|███▎      | 65/200 [1:33:19<4:16:02, 113.79s/it, best=0.868]Pseudomonas_Aeruginosa | LPS | Optuna:  32%|███▎      | 65/200 [1:33:19<4:16:02, 113.79s/it, best=0.868]/export/usuarios01/egarroyo/MALDI_for_AMR_prediction/venv/lib/python3.13/site-packages/sklearn/model_selection/_split.py:813: UserWarning: The least populated class in y has only 4 members, which is less than n_splits=5.
  warnings.warn(
[I 2026-02-28 03:38:26,265] Trial 39 finished with value: 0.9050666137971211 and parameters: {'activation': 'logistic', 'solver': 'adam', 'lr': 9.07330211440507e-06, 'layer1': 416, 'layer2': 380, 'layer3': 148}. Best is trial 20 with value: 0.9283335834984147.

Staphylococcus_Aureus | Fusidic acid | Optuna:  20%|██        | 40/200 [57:35<3:36:12, 81.08s/it, best=0.928][A
Staphylococcus_Aureus | Fusidic acid | Optuna:  20%|██        | 40/200 [57:35<3:36:12, 81.08s/it, best=0.928][A[I 2026-02-28 03:38:34,349] Trial 10 finished with value: 0.9800270054346416 and parameters: {'activation': 'identity', 'solver': 'sgd', 'lr': 0.007553503645583194, 'layer1': 366, 'layer2': 492, 'layer3': 320}. Best is trial 8 with value: 0.9833408517615029.

Klebsiella_Pneumoniae | Imipenem | Optuna:   6%|▌         | 11/200 [09:46<2:44:09, 52.11s/it, best=0.983][A
Klebsiella_Pneumoniae | Imipenem | Optuna:   6%|▌         | 11/200 [09:46<2:44:09, 52.11s/it, best=0.983][A[I 2026-02-28 03:38:34,471] Trial 107 finished with value: 0.8929621321140371 and parameters: {'activation': 'relu', 'solver': 'adam', 'lr': 0.00016996922839632194, 'layer1': 334, 'layer2': 37, 'layer3': 375}. Best is trial 14 with value: 0.8971256036318559.

Escherichia_Coli | Ceftriaxone | Optuna:  54%|█████▍    | 108/200 [4:28:35<3:36:28, 141.18s/it, best=0.897][A
Escherichia_Coli | Ceftriaxone | Optuna:  54%|█████▍    | 108/200 [4:28:35<3:36:28, 141.18s/it, best=0.897][A[I 2026-02-28 03:39:16,866] Trial 11 finished with value: 0.9847001446792942 and parameters: {'activation': 'relu', 'solver': 'adam', 'lr': 0.0013124793805688133, 'layer1': 150, 'layer2': 163, 'layer3': 284}. Best is trial 11 with value: 0.9847001446792942.

Klebsiella_Pneumoniae | Imipenem | Optuna:   6%|▌         | 12/200 [10:29<2:34:08, 49.19s/it, best=0.983][A
Klebsiella_Pneumoniae | Imipenem | Optuna:   6%|▌         | 12/200 [10:29<2:34:08, 49.19s/it, best=0.985][A[I 2026-02-28 03:39:52,606] Trial 12 finished with value: 0.9826556815912362 and parameters: {'activation': 'identity', 'solver': 'adam', 'lr': 0.000653831780412919, 'layer1': 166, 'layer2': 481, 'layer3': 300}. Best is trial 11 with value: 0.9847001446792942.

Klebsiella_Pneumoniae | Imipenem | Optuna:   6%|▋         | 13/200 [11:05<2:20:37, 45.12s/it, best=0.985][A
Klebsiella_Pneumoniae | Imipenem | Optuna:   6%|▋         | 13/200 [11:05<2:20:37, 45.12s/it, best=0.985][A[I 2026-02-28 03:40:14,411] Trial 65 finished with value: 0.8631511308094701 and parameters: {'activation': 'identity', 'solver': 'adam', 'lr': 0.0011634639087710727, 'layer1': 449, 'layer2': 494, 'layer3': 482}. Best is trial 63 with value: 0.8682133709784562.
Pseudomonas_Aeruginosa | LPS | Optuna:  33%|███▎      | 66/200 [1:35:16<4:16:12, 114.72s/it, best=0.868]Pseudomonas_Aeruginosa | LPS | Optuna:  33%|███▎      | 66/200 [1:35:16<4:16:12, 114.72s/it, best=0.868]/export/usuarios01/egarroyo/MALDI_for_AMR_prediction/venv/lib/python3.13/site-packages/sklearn/model_selection/_split.py:813: UserWarning: The least populated class in y has only 4 members, which is less than n_splits=5.
  warnings.warn(
[I 2026-02-28 03:40:37,486] Trial 40 finished with value: 0.9265673496136314 and parameters: {'activation': 'identity', 'solver': 'adam', 'lr': 7.946546966111584e-05, 'layer1': 373, 'layer2': 472, 'layer3': 113}. Best is trial 20 with value: 0.9283335834984147.

Staphylococcus_Aureus | Fusidic acid | Optuna:  20%|██        | 41/200 [59:46<4:14:43, 96.12s/it, best=0.928][A
Staphylococcus_Aureus | Fusidic acid | Optuna:  20%|██        | 41/200 [59:46<4:14:43, 96.12s/it, best=0.928][A[I 2026-02-28 03:41:06,847] Trial 13 finished with value: 0.9860492846658779 and parameters: {'activation': 'relu', 'solver': 'adam', 'lr': 0.001163276039561687, 'layer1': 499, 'layer2': 137, 'layer3': 404}. Best is trial 13 with value: 0.9860492846658779.

Klebsiella_Pneumoniae | Imipenem | Optuna:   7%|▋         | 14/200 [12:19<2:47:08, 53.91s/it, best=0.985][A
Klebsiella_Pneumoniae | Imipenem | Optuna:   7%|▋         | 14/200 [12:19<2:47:08, 53.91s/it, best=0.986][A[I 2026-02-28 03:41:34,313] Trial 66 finished with value: 0.8583725956169108 and parameters: {'activation': 'relu', 'solver': 'adam', 'lr': 0.002077623841039339, 'layer1': 404, 'layer2': 499, 'layer3': 436}. Best is trial 63 with value: 0.8682133709784562.
Pseudomonas_Aeruginosa | LPS | Optuna:  34%|███▎      | 67/200 [1:36:36<3:51:08, 104.28s/it, best=0.868]Pseudomonas_Aeruginosa | LPS | Optuna:  34%|███▎      | 67/200 [1:36:36<3:51:08, 104.28s/it, best=0.868]/export/usuarios01/egarroyo/MALDI_for_AMR_prediction/venv/lib/python3.13/site-packages/sklearn/model_selection/_split.py:813: UserWarning: The least populated class in y has only 4 members, which is less than n_splits=5.
  warnings.warn(
[I 2026-02-28 03:41:46,820] Trial 108 finished with value: 0.8690470526720933 and parameters: {'activation': 'logistic', 'solver': 'adam', 'lr': 0.005724899948442512, 'layer1': 285, 'layer2': 192, 'layer3': 118}. Best is trial 14 with value: 0.8971256036318559.

Escherichia_Coli | Ceftriaxone | Optuna:  55%|█████▍    | 109/200 [4:31:48<3:57:24, 156.53s/it, best=0.897][A
Escherichia_Coli | Ceftriaxone | Optuna:  55%|█████▍    | 109/200 [4:31:48<3:57:24, 156.53s/it, best=0.897][A[I 2026-02-28 03:41:52,902] Trial 14 finished with value: 0.9810084050997332 and parameters: {'activation': 'relu', 'solver': 'adam', 'lr': 0.009135190764330395, 'layer1': 499, 'layer2': 135, 'layer3': 404}. Best is trial 13 with value: 0.9860492846658779.

Klebsiella_Pneumoniae | Imipenem | Optuna:   8%|▊         | 15/200 [13:05<2:38:55, 51.55s/it, best=0.986][A
Klebsiella_Pneumoniae | Imipenem | Optuna:   8%|▊         | 15/200 [13:05<2:38:55, 51.55s/it, best=0.986][A[I 2026-02-28 03:42:30,193] Trial 15 finished with value: 0.983050420748868 and parameters: {'activation': 'relu', 'solver': 'adam', 'lr': 0.00018070082478471912, 'layer1': 160, 'layer2': 125, 'layer3': 439}. Best is trial 13 with value: 0.9860492846658779.

Klebsiella_Pneumoniae | Imipenem | Optuna:   8%|▊         | 16/200 [13:42<2:24:54, 47.25s/it, best=0.986][A
Klebsiella_Pneumoniae | Imipenem | Optuna:   8%|▊         | 16/200 [13:42<2:24:54, 47.25s/it, best=0.986][A[I 2026-02-28 03:42:32,316] Trial 67 finished with value: 0.857407338500615 and parameters: {'activation': 'tanh', 'solver': 'adam', 'lr': 0.0008726777237054816, 'layer1': 433, 'layer2': 441, 'layer3': 458}. Best is trial 63 with value: 0.8682133709784562.
Pseudomonas_Aeruginosa | LPS | Optuna:  34%|███▍      | 68/200 [1:37:34<3:18:51, 90.39s/it, best=0.868] Pseudomonas_Aeruginosa | LPS | Optuna:  34%|███▍      | 68/200 [1:37:34<3:18:51, 90.39s/it, best=0.868]/export/usuarios01/egarroyo/MALDI_for_AMR_prediction/venv/lib/python3.13/site-packages/sklearn/model_selection/_split.py:813: UserWarning: The least populated class in y has only 4 members, which is less than n_splits=5.
  warnings.warn(
[I 2026-02-28 03:42:36,027] Trial 41 finished with value: 0.9282653559116192 and parameters: {'activation': 'identity', 'solver': 'adam', 'lr': 6.06010273587132e-05, 'layer1': 372, 'layer2': 436, 'layer3': 104}. Best is trial 20 with value: 0.9283335834984147.

Staphylococcus_Aureus | Fusidic acid | Optuna:  21%|██        | 42/200 [1:01:45<4:30:50, 102.85s/it, best=0.928][A
Staphylococcus_Aureus | Fusidic acid | Optuna:  21%|██        | 42/200 [1:01:45<4:30:50, 102.85s/it, best=0.928][A[I 2026-02-28 03:43:05,610] Trial 68 finished with value: 0.8267812367532372 and parameters: {'activation': 'identity', 'solver': 'sgd', 'lr': 0.0025996616664038363, 'layer1': 405, 'layer2': 481, 'layer3': 411}. Best is trial 63 with value: 0.8682133709784562.
Pseudomonas_Aeruginosa | LPS | Optuna:  34%|███▍      | 69/200 [1:38:07<2:39:57, 73.26s/it, best=0.868]Pseudomonas_Aeruginosa | LPS | Optuna:  34%|███▍      | 69/200 [1:38:07<2:39:57, 73.26s/it, best=0.868]/export/usuarios01/egarroyo/MALDI_for_AMR_prediction/venv/lib/python3.13/site-packages/sklearn/model_selection/_split.py:813: UserWarning: The least populated class in y has only 4 members, which is less than n_splits=5.
  warnings.warn(
[I 2026-02-28 03:43:32,461] Trial 16 finished with value: 0.9830388047057097 and parameters: {'activation': 'relu', 'solver': 'adam', 'lr': 0.0026091673620149674, 'layer1': 499, 'layer2': 104, 'layer3': 379}. Best is trial 13 with value: 0.9860492846658779.

Klebsiella_Pneumoniae | Imipenem | Optuna:   8%|▊         | 17/200 [14:45<2:37:53, 51.77s/it, best=0.986][A
Klebsiella_Pneumoniae | Imipenem | Optuna:   8%|▊         | 17/200 [14:45<2:37:53, 51.77s/it, best=0.986][A[I 2026-02-28 03:44:00,628] Trial 109 finished with value: 0.8970671071893344 and parameters: {'activation': 'relu', 'solver': 'adam', 'lr': 0.00010905446729054634, 'layer1': 407, 'layer2': 23, 'layer3': 466}. Best is trial 14 with value: 0.8971256036318559.

Escherichia_Coli | Ceftriaxone | Optuna:  55%|█████▌    | 110/200 [4:34:02<3:44:34, 149.71s/it, best=0.897][A
Escherichia_Coli | Ceftriaxone | Optuna:  55%|█████▌    | 110/200 [4:34:02<3:44:34, 149.71s/it, best=0.897][A[I 2026-02-28 03:44:19,634] Trial 17 finished with value: 0.9833988629107976 and parameters: {'activation': 'relu', 'solver': 'adam', 'lr': 0.00030132919244687476, 'layer1': 182, 'layer2': 199, 'layer3': 288}. Best is trial 13 with value: 0.9860492846658779.

Klebsiella_Pneumoniae | Imipenem | Optuna:   9%|▉         | 18/200 [15:32<2:32:50, 50.39s/it, best=0.986][A
Klebsiella_Pneumoniae | Imipenem | Optuna:   9%|▉         | 18/200 [15:32<2:32:50, 50.39s/it, best=0.986][A[I 2026-02-28 03:44:41,403] Trial 69 finished with value: 0.864109538597537 and parameters: {'activation': 'identity', 'solver': 'adam', 'lr': 0.0014867084921375404, 'layer1': 373, 'layer2': 239, 'layer3': 441}. Best is trial 63 with value: 0.8682133709784562.
Pseudomonas_Aeruginosa | LPS | Optuna:  35%|███▌      | 70/200 [1:39:43<2:53:22, 80.02s/it, best=0.868]Pseudomonas_Aeruginosa | LPS | Optuna:  35%|███▌      | 70/200 [1:39:43<2:53:22, 80.02s/it, best=0.868]/export/usuarios01/egarroyo/MALDI_for_AMR_prediction/venv/lib/python3.13/site-packages/sklearn/model_selection/_split.py:813: UserWarning: The least populated class in y has only 4 members, which is less than n_splits=5.
  warnings.warn(
[I 2026-02-28 03:44:41,685] Trial 18 finished with value: 0.9800270054346416 and parameters: {'activation': 'relu', 'solver': 'sgd', 'lr': 0.002623070698116898, 'layer1': 322, 'layer2': 82, 'layer3': 472}. Best is trial 13 with value: 0.9860492846658779.

Klebsiella_Pneumoniae | Imipenem | Optuna:  10%|▉         | 19/200 [15:54<2:06:19, 41.88s/it, best=0.986][A
Klebsiella_Pneumoniae | Imipenem | Optuna:  10%|▉         | 19/200 [15:54<2:06:19, 41.88s/it, best=0.986][A[I 2026-02-28 03:45:20,625] Trial 42 finished with value: 0.9265326102164989 and parameters: {'activation': 'identity', 'solver': 'adam', 'lr': 1.6678413758465304e-05, 'layer1': 376, 'layer2': 425, 'layer3': 12}. Best is trial 20 with value: 0.9283335834984147.

Staphylococcus_Aureus | Fusidic acid | Optuna:  22%|██▏       | 43/200 [1:04:29<5:17:35, 121.37s/it, best=0.928][A
Staphylococcus_Aureus | Fusidic acid | Optuna:  22%|██▏       | 43/200 [1:04:29<5:17:35, 121.37s/it, best=0.928][A[I 2026-02-28 03:45:21,987] Trial 19 finished with value: 0.9827397927880345 and parameters: {'activation': 'tanh', 'solver': 'adam', 'lr': 6.897395462103526e-05, 'layer1': 108, 'layer2': 160, 'layer3': 350}. Best is trial 13 with value: 0.9860492846658779.

Klebsiella_Pneumoniae | Imipenem | Optuna:  10%|█         | 20/200 [16:34<2:04:12, 41.40s/it, best=0.986][A
Klebsiella_Pneumoniae | Imipenem | Optuna:  10%|█         | 20/200 [16:34<2:04:12, 41.40s/it, best=0.986][A[I 2026-02-28 03:45:52,483] Trial 20 finished with value: 0.9819919843971873 and parameters: {'activation': 'logistic', 'solver': 'adam', 'lr': 0.0031160988291745106, 'layer1': 17, 'layer2': 246, 'layer3': 418}. Best is trial 13 with value: 0.9860492846658779.

Klebsiella_Pneumoniae | Imipenem | Optuna:  10%|█         | 21/200 [17:05<1:53:45, 38.13s/it, best=0.986][A
Klebsiella_Pneumoniae | Imipenem | Optuna:  10%|█         | 21/200 [17:05<1:53:45, 38.13s/it, best=0.986][A[I 2026-02-28 03:45:56,181] Trial 70 finished with value: 0.8427790924956083 and parameters: {'activation': 'logistic', 'solver': 'adam', 'lr': 0.00581523622222437, 'layer1': 387, 'layer2': 296, 'layer3': 478}. Best is trial 63 with value: 0.8682133709784562.
Pseudomonas_Aeruginosa | LPS | Optuna:  36%|███▌      | 71/200 [1:40:58<2:48:39, 78.45s/it, best=0.868]Pseudomonas_Aeruginosa | LPS | Optuna:  36%|███▌      | 71/200 [1:40:58<2:48:39, 78.45s/it, best=0.868]/export/usuarios01/egarroyo/MALDI_for_AMR_prediction/venv/lib/python3.13/site-packages/sklearn/model_selection/_split.py:813: UserWarning: The least populated class in y has only 4 members, which is less than n_splits=5.
  warnings.warn(
[I 2026-02-28 03:46:22,378] Trial 110 finished with value: 0.8960410888637991 and parameters: {'activation': 'relu', 'solver': 'adam', 'lr': 9.92444216273456e-05, 'layer1': 489, 'layer2': 44, 'layer3': 467}. Best is trial 14 with value: 0.8971256036318559.

Escherichia_Coli | Ceftriaxone | Optuna:  56%|█████▌    | 111/200 [4:36:23<3:38:31, 147.32s/it, best=0.897][A
Escherichia_Coli | Ceftriaxone | Optuna:  56%|█████▌    | 111/200 [4:36:23<3:38:31, 147.32s/it, best=0.897][A[I 2026-02-28 03:46:35,591] Trial 21 finished with value: 0.983345411327614 and parameters: {'activation': 'relu', 'solver': 'adam', 'lr': 0.0003408828359752136, 'layer1': 188, 'layer2': 210, 'layer3': 292}. Best is trial 13 with value: 0.9860492846658779.

Klebsiella_Pneumoniae | Imipenem | Optuna:  11%|█         | 22/200 [17:48<1:57:33, 39.62s/it, best=0.986][A
Klebsiella_Pneumoniae | Imipenem | Optuna:  11%|█         | 22/200 [17:48<1:57:33, 39.62s/it, best=0.986][A[I 2026-02-28 03:47:09,123] Trial 22 finished with value: 0.9813543998227396 and parameters: {'activation': 'relu', 'solver': 'adam', 'lr': 0.000273414623891036, 'layer1': 121, 'layer2': 176, 'layer3': 207}. Best is trial 13 with value: 0.9860492846658779.

Klebsiella_Pneumoniae | Imipenem | Optuna:  12%|█▏        | 23/200 [18:21<1:51:29, 37.80s/it, best=0.986][A
Klebsiella_Pneumoniae | Imipenem | Optuna:  12%|█▏        | 23/200 [18:21<1:51:29, 37.80s/it, best=0.986][A[I 2026-02-28 03:47:25,498] Trial 43 finished with value: 0.9034242273885266 and parameters: {'activation': 'identity', 'solver': 'adam', 'lr': 1.2403668302547623e-06, 'layer1': 351, 'layer2': 475, 'layer3': 107}. Best is trial 20 with value: 0.9283335834984147.

Staphylococcus_Aureus | Fusidic acid | Optuna:  22%|██▏       | 44/200 [1:06:34<5:18:18, 122.42s/it, best=0.928][A
Staphylococcus_Aureus | Fusidic acid | Optuna:  22%|██▏       | 44/200 [1:06:34<5:18:18, 122.42s/it, best=0.928][A[I 2026-02-28 03:47:39,532] Trial 23 finished with value: 0.9800270054346416 and parameters: {'activation': 'relu', 'solver': 'adam', 'lr': 5.4788266772084266e-05, 'layer1': 216, 'layer2': 389, 'layer3': 299}. Best is trial 13 with value: 0.9860492846658779.

Klebsiella_Pneumoniae | Imipenem | Optuna:  12%|█▏        | 24/200 [18:52<1:44:21, 35.58s/it, best=0.986][A
Klebsiella_Pneumoniae | Imipenem | Optuna:  12%|█▏        | 24/200 [18:52<1:44:21, 35.58s/it, best=0.986][A[I 2026-02-28 03:47:57,251] Trial 71 finished with value: 0.8659830045043956 and parameters: {'activation': 'identity', 'solver': 'adam', 'lr': 0.0011456611155029972, 'layer1': 312, 'layer2': 460, 'layer3': 368}. Best is trial 63 with value: 0.8682133709784562.
Pseudomonas_Aeruginosa | LPS | Optuna:  36%|███▌      | 72/200 [1:42:59<3:14:38, 91.24s/it, best=0.868]Pseudomonas_Aeruginosa | LPS | Optuna:  36%|███▌      | 72/200 [1:42:59<3:14:38, 91.24s/it, best=0.868]/export/usuarios01/egarroyo/MALDI_for_AMR_prediction/venv/lib/python3.13/site-packages/sklearn/model_selection/_split.py:813: UserWarning: The least populated class in y has only 4 members, which is less than n_splits=5.
  warnings.warn(
[I 2026-02-28 03:48:11,108] Trial 24 finished with value: 0.9823372710126554 and parameters: {'activation': 'relu', 'solver': 'adam', 'lr': 0.0005222255910981044, 'layer1': 147, 'layer2': 68, 'layer3': 265}. Best is trial 13 with value: 0.9860492846658779.

Klebsiella_Pneumoniae | Imipenem | Optuna:  12%|█▎        | 25/200 [19:23<1:40:16, 34.38s/it, best=0.986][A
Klebsiella_Pneumoniae | Imipenem | Optuna:  12%|█▎        | 25/200 [19:23<1:40:16, 34.38s/it, best=0.986][A[I 2026-02-28 03:48:25,861] Trial 111 finished with value: 0.8936044558512688 and parameters: {'activation': 'relu', 'solver': 'adam', 'lr': 0.00012229265160298308, 'layer1': 489, 'layer2': 47, 'layer3': 472}. Best is trial 14 with value: 0.8971256036318559.

Escherichia_Coli | Ceftriaxone | Optuna:  56%|█████▌    | 112/200 [4:38:27<3:25:35, 140.17s/it, best=0.897][A
