Staphylococcus_Aureus | Oxacillin | Optuna:  82%|████████▏ | 163/200 [5:53:49<1:18:20, 127.05s/it, best=0.91][A[I 2026-02-27 20:41:28,471] Trial 132 finished with value: 0.8629543665514433 and parameters: {'activation': 'relu', 'solver': 'adam', 'lr': 0.00019534502464451175, 'layer1': 461, 'layer2': 318, 'layer3': 40}. Best is trial 126 with value: 0.8664911301660769.

Pseudomonas_Aeruginosa | Imipenem | Optuna:  66%|██████▋   | 133/200 [2:09:22<1:31:59, 82.39s/it, best=0.867][A
Pseudomonas_Aeruginosa | Imipenem | Optuna:  66%|██████▋   | 133/200 [2:09:22<1:31:59, 82.39s/it, best=0.867][A[I 2026-02-27 20:41:45,688] Trial 140 finished with value: 0.8000327313020451 and parameters: {'activation': 'tanh', 'solver': 'adam', 'lr': 1.7421381093590612e-05, 'layer1': 66, 'layer2': 139, 'layer3': 43}. Best is trial 124 with value: 0.8095465376114227.

Escherichia_Coli | Ciprofloxacin | Optuna:  70%|███████   | 141/200 [5:54:15<2:36:09, 158.81s/it, best=0.809][A
Escherichia_Coli | Ciprofloxacin | Optuna:  70%|███████   | 141/200 [5:54:15<2:36:09, 158.81s/it, best=0.809][A[I 2026-02-27 20:42:09,178] Trial 194 finished with value: 0.8256675944619143 and parameters: {'activation': 'tanh', 'solver': 'adam', 'lr': 7.870756933974945e-05, 'layer1': 349, 'layer2': 471, 'layer3': 190}. Best is trial 91 with value: 0.8315336183309556.

Klebsiella_Pneumoniae | Ciprofloxacin | Optuna:  98%|█████████▊| 195/200 [5:54:38<07:36, 91.37s/it, best=0.832][A
Klebsiella_Pneumoniae | Ciprofloxacin | Optuna:  98%|█████████▊| 195/200 [5:54:38<07:36, 91.37s/it, best=0.832][A[I 2026-02-27 20:42:44,078] Trial 133 finished with value: 0.8623614038436662 and parameters: {'activation': 'relu', 'solver': 'adam', 'lr': 0.00034306591461755843, 'layer1': 446, 'layer2': 291, 'layer3': 12}. Best is trial 126 with value: 0.8664911301660769.

Pseudomonas_Aeruginosa | Imipenem | Optuna:  67%|██████▋   | 134/200 [2:10:38<1:28:23, 80.35s/it, best=0.867][A
Pseudomonas_Aeruginosa | Imipenem | Optuna:  67%|██████▋   | 134/200 [2:10:38<1:28:23, 80.35s/it, best=0.867][A[I 2026-02-27 20:43:05,894] Trial 163 finished with value: 0.9068751530534834 and parameters: {'activation': 'identity', 'solver': 'adam', 'lr': 0.0003754200522732211, 'layer1': 337, 'layer2': 412, 'layer3': 240}. Best is trial 152 with value: 0.9102139153966748.

Staphylococcus_Aureus | Oxacillin | Optuna:  82%|████████▏ | 164/200 [5:55:35<1:12:22, 120.62s/it, best=0.91][A
Staphylococcus_Aureus | Oxacillin | Optuna:  82%|████████▏ | 164/200 [5:55:35<1:12:22, 120.62s/it, best=0.91][A[I 2026-02-27 20:43:27,571] Trial 195 finished with value: 0.8239745424189208 and parameters: {'activation': 'tanh', 'solver': 'adam', 'lr': 0.00012341305534862887, 'layer1': 231, 'layer2': 485, 'layer3': 171}. Best is trial 91 with value: 0.8315336183309556.

Klebsiella_Pneumoniae | Ciprofloxacin | Optuna:  98%|█████████▊| 196/200 [5:55:57<05:49, 87.47s/it, best=0.832][A
Klebsiella_Pneumoniae | Ciprofloxacin | Optuna:  98%|█████████▊| 196/200 [5:55:57<05:49, 87.47s/it, best=0.832][A[I 2026-02-27 20:43:44,408] Trial 141 finished with value: 0.804895220735108 and parameters: {'activation': 'tanh', 'solver': 'adam', 'lr': 4.4097639777183876e-05, 'layer1': 104, 'layer2': 217, 'layer3': 18}. Best is trial 124 with value: 0.8095465376114227.

Escherichia_Coli | Ciprofloxacin | Optuna:  71%|███████   | 142/200 [5:56:13<2:21:53, 146.78s/it, best=0.809][A
Escherichia_Coli | Ciprofloxacin | Optuna:  71%|███████   | 142/200 [5:56:13<2:21:53, 146.78s/it, best=0.809][A[I 2026-02-27 20:43:58,021] Trial 134 finished with value: 0.8651845658824391 and parameters: {'activation': 'relu', 'solver': 'adam', 'lr': 0.00026051131998054824, 'layer1': 476, 'layer2': 324, 'layer3': 51}. Best is trial 126 with value: 0.8664911301660769.

Pseudomonas_Aeruginosa | Imipenem | Optuna:  68%|██████▊   | 135/200 [2:11:52<1:24:57, 78.43s/it, best=0.867][A
Pseudomonas_Aeruginosa | Imipenem | Optuna:  68%|██████▊   | 135/200 [2:11:52<1:24:57, 78.43s/it, best=0.867][A[I 2026-02-27 20:45:05,724] Trial 196 finished with value: 0.8282247167521444 and parameters: {'activation': 'tanh', 'solver': 'adam', 'lr': 6.167809135600439e-05, 'layer1': 297, 'layer2': 460, 'layer3': 50}. Best is trial 91 with value: 0.8315336183309556.

Klebsiella_Pneumoniae | Ciprofloxacin | Optuna:  98%|█████████▊| 197/200 [5:57:35<04:32, 90.68s/it, best=0.832][A
Klebsiella_Pneumoniae | Ciprofloxacin | Optuna:  98%|█████████▊| 197/200 [5:57:35<04:32, 90.68s/it, best=0.832][A[I 2026-02-27 20:45:06,188] Trial 142 finished with value: 0.8026469972123147 and parameters: {'activation': 'tanh', 'solver': 'adam', 'lr': 7.701331426267231e-05, 'layer1': 125, 'layer2': 207, 'layer3': 32}. Best is trial 124 with value: 0.8095465376114227.

Escherichia_Coli | Ciprofloxacin | Optuna:  72%|███████▏  | 143/200 [5:57:35<2:00:55, 127.28s/it, best=0.809][A
Escherichia_Coli | Ciprofloxacin | Optuna:  72%|███████▏  | 143/200 [5:57:35<2:00:55, 127.28s/it, best=0.809][A[I 2026-02-27 20:45:34,713] Trial 135 finished with value: 0.8634759679604993 and parameters: {'activation': 'relu', 'solver': 'adam', 'lr': 0.00025127207195854674, 'layer1': 492, 'layer2': 324, 'layer3': 49}. Best is trial 126 with value: 0.8664911301660769.

Pseudomonas_Aeruginosa | Imipenem | Optuna:  68%|██████▊   | 136/200 [2:13:28<1:29:30, 83.91s/it, best=0.867][A
Pseudomonas_Aeruginosa | Imipenem | Optuna:  68%|██████▊   | 136/200 [2:13:28<1:29:30, 83.91s/it, best=0.867][A[I 2026-02-27 20:45:37,728] Trial 164 finished with value: 0.9101758639806103 and parameters: {'activation': 'identity', 'solver': 'adam', 'lr': 0.00017536608513171956, 'layer1': 325, 'layer2': 437, 'layer3': 475}. Best is trial 152 with value: 0.9102139153966748.

Staphylococcus_Aureus | Oxacillin | Optuna:  82%|████████▎ | 165/200 [5:58:07<1:15:49, 129.98s/it, best=0.91][A
Staphylococcus_Aureus | Oxacillin | Optuna:  82%|████████▎ | 165/200 [5:58:07<1:15:49, 129.98s/it, best=0.91][A[I 2026-02-27 20:46:41,429] Trial 197 finished with value: 0.8287790476120245 and parameters: {'activation': 'tanh', 'solver': 'adam', 'lr': 5.778581131440881e-05, 'layer1': 298, 'layer2': 437, 'layer3': 56}. Best is trial 91 with value: 0.8315336183309556.

Klebsiella_Pneumoniae | Ciprofloxacin | Optuna:  99%|█████████▉| 198/200 [5:59:10<03:04, 92.19s/it, best=0.832][A
Klebsiella_Pneumoniae | Ciprofloxacin | Optuna:  99%|█████████▉| 198/200 [5:59:10<03:04, 92.19s/it, best=0.832][A[I 2026-02-27 20:47:18,455] Trial 136 finished with value: 0.8613766337453143 and parameters: {'activation': 'relu', 'solver': 'adam', 'lr': 0.006171728653824757, 'layer1': 475, 'layer2': 303, 'layer3': 21}. Best is trial 126 with value: 0.8664911301660769.

Pseudomonas_Aeruginosa | Imipenem | Optuna:  68%|██████▊   | 137/200 [2:15:12<1:34:21, 89.86s/it, best=0.867][A
Pseudomonas_Aeruginosa | Imipenem | Optuna:  68%|██████▊   | 137/200 [2:15:12<1:34:21, 89.86s/it, best=0.867][A[I 2026-02-27 20:47:35,171] Trial 143 finished with value: 0.8047517519203915 and parameters: {'activation': 'tanh', 'solver': 'adam', 'lr': 2.3269252362796916e-05, 'layer1': 138, 'layer2': 184, 'layer3': 11}. Best is trial 124 with value: 0.8095465376114227.

Escherichia_Coli | Ciprofloxacin | Optuna:  72%|███████▏  | 144/200 [6:00:04<2:04:52, 133.79s/it, best=0.809][A
Escherichia_Coli | Ciprofloxacin | Optuna:  72%|███████▏  | 144/200 [6:00:04<2:04:52, 133.79s/it, best=0.809][A[I 2026-02-27 20:47:48,031] Trial 165 finished with value: 0.9062525371098644 and parameters: {'activation': 'identity', 'solver': 'adam', 'lr': 0.00011746301219454386, 'layer1': 288, 'layer2': 439, 'layer3': 480}. Best is trial 152 with value: 0.9102139153966748.

Staphylococcus_Aureus | Oxacillin | Optuna:  83%|████████▎ | 166/200 [6:00:17<1:13:42, 130.08s/it, best=0.91][A
Staphylococcus_Aureus | Oxacillin | Optuna:  83%|████████▎ | 166/200 [6:00:17<1:13:42, 130.08s/it, best=0.91][A[I 2026-02-27 20:48:08,341] Trial 198 finished with value: 0.8238996052958754 and parameters: {'activation': 'tanh', 'solver': 'adam', 'lr': 5.773832692732258e-05, 'layer1': 300, 'layer2': 457, 'layer3': 50}. Best is trial 91 with value: 0.8315336183309556.

Klebsiella_Pneumoniae | Ciprofloxacin | Optuna: 100%|█████████▉| 199/200 [6:00:37<01:30, 90.60s/it, best=0.832][A
Klebsiella_Pneumoniae | Ciprofloxacin | Optuna: 100%|█████████▉| 199/200 [6:00:37<01:30, 90.60s/it, best=0.832][A[I 2026-02-27 20:48:16,430] Trial 137 finished with value: 0.8608220990821065 and parameters: {'activation': 'tanh', 'solver': 'adam', 'lr': 0.0001289963384597791, 'layer1': 465, 'layer2': 328, 'layer3': 31}. Best is trial 126 with value: 0.8664911301660769.

Pseudomonas_Aeruginosa | Imipenem | Optuna:  69%|██████▉   | 138/200 [2:16:10<1:22:58, 80.29s/it, best=0.867][A
Pseudomonas_Aeruginosa | Imipenem | Optuna:  69%|██████▉   | 138/200 [2:16:10<1:22:58, 80.29s/it, best=0.867][A[I 2026-02-27 20:49:28,257] Trial 138 finished with value: 0.8579402776955666 and parameters: {'activation': 'relu', 'solver': 'adam', 'lr': 0.00016652042703195602, 'layer1': 481, 'layer2': 359, 'layer3': 69}. Best is trial 126 with value: 0.8664911301660769.

Pseudomonas_Aeruginosa | Imipenem | Optuna:  70%|██████▉   | 139/200 [2:17:22<1:19:02, 77.75s/it, best=0.867][A
Pseudomonas_Aeruginosa | Imipenem | Optuna:  70%|██████▉   | 139/200 [2:17:22<1:19:02, 77.75s/it, best=0.867][A[I 2026-02-27 20:49:37,035] Trial 144 finished with value: 0.8039681759795945 and parameters: {'activation': 'tanh', 'solver': 'adam', 'lr': 3.795568638621677e-05, 'layer1': 115, 'layer2': 230, 'layer3': 54}. Best is trial 124 with value: 0.8095465376114227.

Escherichia_Coli | Ciprofloxacin | Optuna:  72%|███████▎  | 145/200 [6:02:06<1:59:21, 130.21s/it, best=0.809][A
Escherichia_Coli | Ciprofloxacin | Optuna:  72%|███████▎  | 145/200 [6:02:06<1:59:21, 130.21s/it, best=0.809][A[I 2026-02-27 20:50:17,230] Trial 166 finished with value: 0.9057744913735032 and parameters: {'activation': 'logistic', 'solver': 'adam', 'lr': 0.00015173461526607105, 'layer1': 320, 'layer2': 458, 'layer3': 468}. Best is trial 152 with value: 0.9102139153966748.

Staphylococcus_Aureus | Oxacillin | Optuna:  84%|████████▎ | 167/200 [6:02:46<1:14:41, 135.81s/it, best=0.91][A
Staphylococcus_Aureus | Oxacillin | Optuna:  84%|████████▎ | 167/200 [6:02:46<1:14:41, 135.81s/it, best=0.91][A[I 2026-02-27 20:50:17,554] Trial 199 finished with value: 0.6048751723502528 and parameters: {'activation': 'tanh', 'solver': 'sgd', 'lr': 7.302119523289012e-05, 'layer1': 297, 'layer2': 444, 'layer3': 28}. Best is trial 91 with value: 0.8315336183309556.

Klebsiella_Pneumoniae | Ciprofloxacin | Optuna: 100%|██████████| 200/200 [6:02:47<00:00, 102.19s/it, best=0.832][A
Klebsiella_Pneumoniae | Ciprofloxacin | Optuna: 100%|██████████| 200/200 [6:02:47<00:00, 102.19s/it, best=0.832][A
                                                                                                                [A[Klebsiella_Pneumoniae | Ciprofloxacin] [OPTUNA DONE] Best CV WF1=0.8315 | params={'activation': 'identity', 'solver': 'adam', 'lr': 4.214851096068479e-05, 'layer1': 296, 'layer2': 499, 'layer3': 252}
[Klebsiella_Pneumoniae | Ciprofloxacin] Retraining with validation early stopping (10% split)...
[Klebsiella_Pneumoniae | Ciprofloxacin] [TEST] WF1=0.8034 | ACC=0.8096 | HL=0.1904 | best_val_WF1=0.8174
Klebsiella_Pneumoniae | Binary antibiotics:  25%|██▌       | 1/4 [6:03:08<18:09:24, 21788.02s/it]
[Klebsiella_Pneumoniae | Ceftriaxone] Optuna search starting... (trials=200, cv=5)
[I 2026-02-27 20:50:38,452] A new study created in memory with name: no-name-da5ea55e-14ea-4fd6-8e4f-551e1c7da12c

Klebsiella_Pneumoniae | Ceftriaxone | Optuna:   0%|          | 0/200 [00:00<?, ?it/s][A[I 2026-02-27 20:50:47,662] Trial 139 finished with value: 0.8623960864905363 and parameters: {'activation': 'relu', 'solver': 'adam', 'lr': 0.00038172059242999823, 'layer1': 490, 'layer2': 382, 'layer3': 46}. Best is trial 126 with value: 0.8664911301660769.

Pseudomonas_Aeruginosa | Imipenem | Optuna:  70%|███████   | 140/200 [2:18:41<1:18:14, 78.25s/it, best=0.867][A
Pseudomonas_Aeruginosa | Imipenem | Optuna:  70%|███████   | 140/200 [2:18:41<1:18:14, 78.25s/it, best=0.867][A[I 2026-02-27 20:51:06,443] Trial 0 finished with value: 0.038654517122752106 and parameters: {'activation': 'logistic', 'solver': 'sgd', 'lr': 1.7073967431528114e-06, 'layer1': 435, 'layer2': 305, 'layer3': 357}. Best is trial 0 with value: 0.038654517122752106.

Klebsiella_Pneumoniae | Ceftriaxone | Optuna:   0%|          | 1/200 [00:27<1:32:49, 27.99s/it][A
Klebsiella_Pneumoniae | Ceftriaxone | Optuna:   0%|          | 1/200 [00:27<1:32:49, 27.99s/it, best=0.0387][A[I 2026-02-27 20:51:24,391] Trial 140 finished with value: 0.8197868258311167 and parameters: {'activation': 'relu', 'solver': 'sgd', 'lr': 0.00010022675987309957, 'layer1': 499, 'layer2': 310, 'layer3': 37}. Best is trial 126 with value: 0.8664911301660769.

Pseudomonas_Aeruginosa | Imipenem | Optuna:  70%|███████   | 141/200 [2:19:18<1:04:41, 65.79s/it, best=0.867][A
Pseudomonas_Aeruginosa | Imipenem | Optuna:  70%|███████   | 141/200 [2:19:18<1:04:41, 65.79s/it, best=0.867][A[I 2026-02-27 20:51:41,294] Trial 1 finished with value: 0.782466545914998 and parameters: {'activation': 'logistic', 'solver': 'adam', 'lr': 1.6480446427978994e-05, 'layer1': 267, 'layer2': 222, 'layer3': 152}. Best is trial 1 with value: 0.782466545914998.

Klebsiella_Pneumoniae | Ceftriaxone | Optuna:   1%|          | 2/200 [01:02<1:45:41, 32.03s/it, best=0.0387][A
Klebsiella_Pneumoniae | Ceftriaxone | Optuna:   1%|          | 2/200 [01:02<1:45:41, 32.03s/it, best=0.782] [A[I 2026-02-27 20:52:31,476] Trial 167 finished with value: 0.907269691332558 and parameters: {'activation': 'identity', 'solver': 'adam', 'lr': 0.0001841284049799213, 'layer1': 306, 'layer2': 401, 'layer3': 487}. Best is trial 152 with value: 0.9102139153966748.

Staphylococcus_Aureus | Oxacillin | Optuna:  84%|████████▍ | 168/200 [6:05:01<1:12:11, 135.34s/it, best=0.91][A
Staphylococcus_Aureus | Oxacillin | Optuna:  84%|████████▍ | 168/200 [6:05:01<1:12:11, 135.34s/it, best=0.91][A[I 2026-02-27 20:52:37,473] Trial 141 finished with value: 0.860833678208037 and parameters: {'activation': 'relu', 'solver': 'adam', 'lr': 0.00024731684363038617, 'layer1': 474, 'layer2': 323, 'layer3': 52}. Best is trial 126 with value: 0.8664911301660769.

Pseudomonas_Aeruginosa | Imipenem | Optuna:  71%|███████   | 142/200 [2:20:31<1:05:42, 67.98s/it, best=0.867][A
Pseudomonas_Aeruginosa | Imipenem | Optuna:  71%|███████   | 142/200 [2:20:31<1:05:42, 67.98s/it, best=0.867][A[I 2026-02-27 20:53:34,040] Trial 2 finished with value: 0.8705845547672407 and parameters: {'activation': 'identity', 'solver': 'adam', 'lr': 6.290644294586145e-06, 'layer1': 262, 'layer2': 300, 'layer3': 32}. Best is trial 2 with value: 0.8705845547672407.

Klebsiella_Pneumoniae | Ceftriaxone | Optuna:   2%|▏         | 3/200 [02:55<3:46:10, 68.88s/it, best=0.782][A
Klebsiella_Pneumoniae | Ceftriaxone | Optuna:   2%|▏         | 3/200 [02:55<3:46:10, 68.88s/it, best=0.871][A[I 2026-02-27 20:53:46,986] Trial 142 finished with value: 0.861989010311891 and parameters: {'activation': 'relu', 'solver': 'adam', 'lr': 0.0002935629387103092, 'layer1': 495, 'layer2': 332, 'layer3': 55}. Best is trial 126 with value: 0.8664911301660769.

Pseudomonas_Aeruginosa | Imipenem | Optuna:  72%|███████▏  | 143/200 [2:21:41<1:05:01, 68.44s/it, best=0.867][A
Pseudomonas_Aeruginosa | Imipenem | Optuna:  72%|███████▏  | 143/200 [2:21:41<1:05:01, 68.44s/it, best=0.867][A[I 2026-02-27 20:54:12,993] Trial 145 finished with value: 0.8053717966528566 and parameters: {'activation': 'tanh', 'solver': 'adam', 'lr': 9.387524368330678e-06, 'layer1': 151, 'layer2': 159, 'layer3': 30}. Best is trial 124 with value: 0.8095465376114227.

Escherichia_Coli | Ciprofloxacin | Optuna:  73%|███████▎  | 146/200 [6:06:42<2:36:32, 173.94s/it, best=0.809][A
Escherichia_Coli | Ciprofloxacin | Optuna:  73%|███████▎  | 146/200 [6:06:42<2:36:32, 173.94s/it, best=0.809][A[I 2026-02-27 20:54:28,455] Trial 168 finished with value: 0.9053541783752573 and parameters: {'activation': 'identity', 'solver': 'adam', 'lr': 9.529059594989711e-05, 'layer1': 259, 'layer2': 378, 'layer3': 473}. Best is trial 152 with value: 0.9102139153966748.

Staphylococcus_Aureus | Oxacillin | Optuna:  84%|████████▍ | 169/200 [6:06:58<1:07:04, 129.83s/it, best=0.91][A
Staphylococcus_Aureus | Oxacillin | Optuna:  84%|████████▍ | 169/200 [6:06:58<1:07:04, 129.83s/it, best=0.91][A[I 2026-02-27 20:54:37,371] Trial 3 finished with value: 0.7819438398133461 and parameters: {'activation': 'relu', 'solver': 'sgd', 'lr': 1.6536937182824424e-05, 'layer1': 57, 'layer2': 345, 'layer3': 226}. Best is trial 2 with value: 0.8705845547672407.

Klebsiella_Pneumoniae | Ceftriaxone | Optuna:   2%|▏         | 4/200 [03:58<3:37:51, 66.69s/it, best=0.871][A
Klebsiella_Pneumoniae | Ceftriaxone | Optuna:   2%|▏         | 4/200 [03:58<3:37:51, 66.69s/it, best=0.871][A[I 2026-02-27 20:54:41,239] Trial 146 finished with value: 0.49974688119857913 and parameters: {'activation': 'logistic', 'solver': 'sgd', 'lr': 6.183228076741343e-05, 'layer1': 96, 'layer2': 77, 'layer3': 40}. Best is trial 124 with value: 0.8095465376114227.

Escherichia_Coli | Ciprofloxacin | Optuna:  74%|███████▎  | 147/200 [6:07:10<1:55:02, 130.23s/it, best=0.809][A
Escherichia_Coli | Ciprofloxacin | Optuna:  74%|███████▎  | 147/200 [6:07:10<1:55:02, 130.23s/it, best=0.809][A[I 2026-02-27 20:55:01,033] Trial 143 finished with value: 0.8628454811499312 and parameters: {'activation': 'relu', 'solver': 'adam', 'lr': 0.0001986322045841879, 'layer1': 483, 'layer2': 279, 'layer3': 64}. Best is trial 126 with value: 0.8664911301660769.

Pseudomonas_Aeruginosa | Imipenem | Optuna:  72%|███████▏  | 144/200 [2:22:55<1:05:26, 70.12s/it, best=0.867][A
Pseudomonas_Aeruginosa | Imipenem | Optuna:  72%|███████▏  | 144/200 [2:22:55<1:05:26, 70.12s/it, best=0.867][A[I 2026-02-27 20:55:45,401] Trial 4 finished with value: 0.8101225177998657 and parameters: {'activation': 'relu', 'solver': 'adam', 'lr': 1.7654048052495086e-05, 'layer1': 265, 'layer2': 278, 'layer3': 100}. Best is trial 2 with value: 0.8705845547672407.

Klebsiella_Pneumoniae | Ceftriaxone | Optuna:   2%|▎         | 5/200 [05:06<3:38:18, 67.17s/it, best=0.871][A
Klebsiella_Pneumoniae | Ceftriaxone | Optuna:   2%|▎         | 5/200 [05:06<3:38:18, 67.17s/it, best=0.871][A[I 2026-02-27 20:56:18,730] Trial 147 finished with value: 0.8016873632633127 and parameters: {'activation': 'tanh', 'solver': 'adam', 'lr': 8.457815198372124e-05, 'layer1': 179, 'layer2': 309, 'layer3': 102}. Best is trial 124 with value: 0.8095465376114227.

Escherichia_Coli | Ciprofloxacin | Optuna:  74%|███████▍  | 148/200 [6:08:48<1:44:21, 120.41s/it, best=0.809][A
Escherichia_Coli | Ciprofloxacin | Optuna:  74%|███████▍  | 148/200 [6:08:48<1:44:21, 120.41s/it, best=0.809][A[I 2026-02-27 20:56:20,430] Trial 144 finished with value: 0.8601702545932067 and parameters: {'activation': 'relu', 'solver': 'adam', 'lr': 0.00026834670402706807, 'layer1': 465, 'layer2': 419, 'layer3': 49}. Best is trial 126 with value: 0.8664911301660769.

Pseudomonas_Aeruginosa | Imipenem | Optuna:  72%|███████▎  | 145/200 [2:24:14<1:06:49, 72.90s/it, best=0.867][A
Pseudomonas_Aeruginosa | Imipenem | Optuna:  72%|███████▎  | 145/200 [2:24:14<1:06:49, 72.90s/it, best=0.867][A[I 2026-02-27 20:56:39,917] Trial 169 finished with value: 0.9078466506611467 and parameters: {'activation': 'identity', 'solver': 'adam', 'lr': 0.00011962660947256264, 'layer1': 327, 'layer2': 420, 'layer3': 450}. Best is trial 152 with value: 0.9102139153966748.

Staphylococcus_Aureus | Oxacillin | Optuna:  85%|████████▌ | 170/200 [6:09:09<1:05:09, 130.32s/it, best=0.91][A
Staphylococcus_Aureus | Oxacillin | Optuna:  85%|████████▌ | 170/200 [6:09:09<1:05:09, 130.32s/it, best=0.91][A[I 2026-02-27 20:56:50,893] Trial 5 finished with value: 0.8198679048031543 and parameters: {'activation': 'identity', 'solver': 'adam', 'lr': 2.259279742015697e-06, 'layer1': 106, 'layer2': 32, 'layer3': 169}. Best is trial 2 with value: 0.8705845547672407.

Klebsiella_Pneumoniae | Ceftriaxone | Optuna:   3%|▎         | 6/200 [06:12<3:35:20, 66.60s/it, best=0.871][A
Klebsiella_Pneumoniae | Ceftriaxone | Optuna:   3%|▎         | 6/200 [06:12<3:35:20, 66.60s/it, best=0.871][A[I 2026-02-27 20:57:48,781] Trial 148 finished with value: 0.8037218751904296 and parameters: {'activation': 'tanh', 'solver': 'adam', 'lr': 0.00014147738425059972, 'layer1': 194, 'layer2': 335, 'layer3': 22}. Best is trial 124 with value: 0.8095465376114227.

Escherichia_Coli | Ciprofloxacin | Optuna:  74%|███████▍  | 149/200 [6:10:18<1:34:36, 111.30s/it, best=0.809][A
Escherichia_Coli | Ciprofloxacin | Optuna:  74%|███████▍  | 149/200 [6:10:18<1:34:36, 111.30s/it, best=0.809][A[I 2026-02-27 20:57:49,543] Trial 145 finished with value: 0.8630181254425514 and parameters: {'activation': 'relu', 'solver': 'adam', 'lr': 0.00015045019597998175, 'layer1': 430, 'layer2': 293, 'layer3': 78}. Best is trial 126 with value: 0.8664911301660769.

Pseudomonas_Aeruginosa | Imipenem | Optuna:  73%|███████▎  | 146/200 [2:25:43<1:09:59, 77.77s/it, best=0.867][A
Pseudomonas_Aeruginosa | Imipenem | Optuna:  73%|███████▎  | 146/200 [2:25:43<1:09:59, 77.77s/it, best=0.867][A[I 2026-02-27 20:58:16,919] Trial 146 finished with value: 0.8175565662034809 and parameters: {'activation': 'logistic', 'solver': 'adam', 'lr': 0.0003580839165739133, 'layer1': 444, 'layer2': 367, 'layer3': 10}. Best is trial 126 with value: 0.8664911301660769.

Pseudomonas_Aeruginosa | Imipenem | Optuna:  74%|███████▎  | 147/200 [2:26:11<55:20, 62.65s/it, best=0.867]  [A
