Pseudomonas_Aeruginosa | Meropenem | Optuna:  20%|██        | 40/200 [44:37<2:59:31, 67.32s/it, best=0.885][A[I 2026-02-27 22:49:22,491] Trial 34 finished with value: 0.8457869208092648 and parameters: {'activation': 'logistic', 'solver': 'adam', 'lr': 0.0007735296961565813, 'layer1': 148, 'layer2': 125, 'layer3': 417}. Best is trial 33 with value: 0.8559196107911822.

Staphylococcus_Aureus | Clindamycin | Optuna:  18%|█▊        | 35/200 [51:24<3:38:37, 79.50s/it, best=0.856][A
Staphylococcus_Aureus | Clindamycin | Optuna:  18%|█▊        | 35/200 [51:24<3:38:37, 79.50s/it, best=0.856][A[I 2026-02-27 22:49:52,357] Trial 35 finished with value: 0.7888558471217525 and parameters: {'activation': 'logistic', 'solver': 'adam', 'lr': 2.6979987468263632e-05, 'layer1': 136, 'layer2': 99, 'layer3': 218}. Best is trial 33 with value: 0.8559196107911822.

Staphylococcus_Aureus | Clindamycin | Optuna:  18%|█▊        | 36/200 [51:54<2:56:35, 64.61s/it, best=0.856][A
Staphylococcus_Aureus | Clindamycin | Optuna:  18%|█▊        | 36/200 [51:54<2:56:35, 64.61s/it, best=0.856][A[I 2026-02-27 22:50:07,849] Trial 40 finished with value: 0.8729357259139657 and parameters: {'activation': 'relu', 'solver': 'adam', 'lr': 8.826611607878154e-05, 'layer1': 249, 'layer2': 457, 'layer3': 177}. Best is trial 8 with value: 0.8854975788426769.

Pseudomonas_Aeruginosa | Meropenem | Optuna:  20%|██        | 41/200 [45:43<2:57:08, 66.84s/it, best=0.885][A
Pseudomonas_Aeruginosa | Meropenem | Optuna:  20%|██        | 41/200 [45:43<2:57:08, 66.84s/it, best=0.885][A[I 2026-02-27 22:50:35,437] Trial 70 finished with value: 0.9052652464216591 and parameters: {'activation': 'identity', 'solver': 'adam', 'lr': 3.360975410787876e-05, 'layer1': 169, 'layer2': 476, 'layer3': 205}. Best is trial 25 with value: 0.9080365798965563.

Klebsiella_Pneumoniae | Ceftriaxone | Optuna:  36%|███▌      | 71/200 [1:59:56<3:43:02, 103.74s/it, best=0.908][A
Klebsiella_Pneumoniae | Ceftriaxone | Optuna:  36%|███▌      | 71/200 [1:59:56<3:43:02, 103.74s/it, best=0.908][A[I 2026-02-27 22:51:15,476] Trial 193 finished with value: 0.8065341839602201 and parameters: {'activation': 'tanh', 'solver': 'adam', 'lr': 2.6877710363868314e-05, 'layer1': 450, 'layer2': 308, 'layer3': 10}. Best is trial 191 with value: 0.8109607364737272.

Escherichia_Coli | Ciprofloxacin | Optuna:  97%|█████████▋| 194/200 [8:03:44<17:44, 177.47s/it, best=0.811][A
Escherichia_Coli | Ciprofloxacin | Optuna:  97%|█████████▋| 194/200 [8:03:44<17:44, 177.47s/it, best=0.811][A[I 2026-02-27 22:51:16,453] Trial 41 finished with value: 0.8810722653163939 and parameters: {'activation': 'identity', 'solver': 'adam', 'lr': 9.676761185196645e-05, 'layer1': 275, 'layer2': 280, 'layer3': 406}. Best is trial 8 with value: 0.8854975788426769.

Pseudomonas_Aeruginosa | Meropenem | Optuna:  21%|██        | 42/200 [46:51<2:57:24, 67.37s/it, best=0.885][A
Pseudomonas_Aeruginosa | Meropenem | Optuna:  21%|██        | 42/200 [46:51<2:57:24, 67.37s/it, best=0.885][A[I 2026-02-27 22:51:25,521] Trial 36 finished with value: 0.850352762417713 and parameters: {'activation': 'tanh', 'solver': 'adam', 'lr': 0.0001991362581515697, 'layer1': 190, 'layer2': 269, 'layer3': 338}. Best is trial 33 with value: 0.8559196107911822.

Staphylococcus_Aureus | Clindamycin | Optuna:  18%|█▊        | 37/200 [53:27<3:18:47, 73.17s/it, best=0.856][A
Staphylococcus_Aureus | Clindamycin | Optuna:  18%|█▊        | 37/200 [53:27<3:18:47, 73.17s/it, best=0.856][A[I 2026-02-27 22:52:21,439] Trial 42 finished with value: 0.88105168074076 and parameters: {'activation': 'identity', 'solver': 'adam', 'lr': 0.0006966654636812804, 'layer1': 158, 'layer2': 394, 'layer3': 477}. Best is trial 8 with value: 0.8854975788426769.

Pseudomonas_Aeruginosa | Meropenem | Optuna:  22%|██▏       | 43/200 [47:56<2:54:25, 66.66s/it, best=0.885][A
Pseudomonas_Aeruginosa | Meropenem | Optuna:  22%|██▏       | 43/200 [47:56<2:54:25, 66.66s/it, best=0.885][A[I 2026-02-27 22:52:36,125] Trial 71 finished with value: 0.9012833192103417 and parameters: {'activation': 'identity', 'solver': 'adam', 'lr': 4.126955895404982e-05, 'layer1': 500, 'layer2': 407, 'layer3': 441}. Best is trial 25 with value: 0.9080365798965563.

Klebsiella_Pneumoniae | Ceftriaxone | Optuna:  36%|███▌      | 72/200 [2:01:57<3:52:09, 108.82s/it, best=0.908][A
Klebsiella_Pneumoniae | Ceftriaxone | Optuna:  36%|███▌      | 72/200 [2:01:57<3:52:09, 108.82s/it, best=0.908][A[I 2026-02-27 22:53:00,340] Trial 43 finished with value: 0.8444798224570566 and parameters: {'activation': 'identity', 'solver': 'adam', 'lr': 1.2403668302547623e-06, 'layer1': 185, 'layer2': 434, 'layer3': 499}. Best is trial 8 with value: 0.8854975788426769.

Pseudomonas_Aeruginosa | Meropenem | Optuna:  22%|██▏       | 44/200 [48:35<2:31:39, 58.33s/it, best=0.885][A
Pseudomonas_Aeruginosa | Meropenem | Optuna:  22%|██▏       | 44/200 [48:35<2:31:39, 58.33s/it, best=0.885][A[I 2026-02-27 22:53:00,575] Trial 37 finished with value: 0.8505598257634597 and parameters: {'activation': 'logistic', 'solver': 'adam', 'lr': 0.0004975535157946716, 'layer1': 95, 'layer2': 320, 'layer3': 382}. Best is trial 33 with value: 0.8559196107911822.

Staphylococcus_Aureus | Clindamycin | Optuna:  19%|█▉        | 38/200 [55:02<3:35:17, 79.74s/it, best=0.856][A
Staphylococcus_Aureus | Clindamycin | Optuna:  19%|█▉        | 38/200 [55:02<3:35:17, 79.74s/it, best=0.856][A[I 2026-02-27 22:53:26,394] Trial 38 finished with value: 0.7888558471217525 and parameters: {'activation': 'logistic', 'solver': 'sgd', 'lr': 0.0016270737620779272, 'layer1': 236, 'layer2': 49, 'layer3': 411}. Best is trial 33 with value: 0.8559196107911822.

Staphylococcus_Aureus | Clindamycin | Optuna:  20%|█▉        | 39/200 [55:28<2:50:33, 63.56s/it, best=0.856][A
Staphylococcus_Aureus | Clindamycin | Optuna:  20%|█▉        | 39/200 [55:28<2:50:33, 63.56s/it, best=0.856][A[I 2026-02-27 22:54:08,482] Trial 44 finished with value: 0.88243555529129 and parameters: {'activation': 'identity', 'solver': 'adam', 'lr': 0.0020423608016860075, 'layer1': 104, 'layer2': 478, 'layer3': 441}. Best is trial 8 with value: 0.8854975788426769.

Pseudomonas_Aeruginosa | Meropenem | Optuna:  22%|██▎       | 45/200 [49:43<2:38:17, 61.27s/it, best=0.885][A
Pseudomonas_Aeruginosa | Meropenem | Optuna:  22%|██▎       | 45/200 [49:43<2:38:17, 61.27s/it, best=0.885][A[I 2026-02-27 22:54:09,247] Trial 39 finished with value: 0.7888558471217525 and parameters: {'activation': 'logistic', 'solver': 'adam', 'lr': 9.07330211440507e-06, 'layer1': 293, 'layer2': 15, 'layer3': 149}. Best is trial 33 with value: 0.8559196107911822.

Staphylococcus_Aureus | Clindamycin | Optuna:  20%|██        | 40/200 [56:10<2:32:55, 57.35s/it, best=0.856][A
Staphylococcus_Aureus | Clindamycin | Optuna:  20%|██        | 40/200 [56:10<2:32:55, 57.35s/it, best=0.856][A[I 2026-02-27 22:54:25,949] Trial 194 finished with value: 0.8045072249493058 and parameters: {'activation': 'tanh', 'solver': 'adam', 'lr': 1.7542081307046273e-05, 'layer1': 402, 'layer2': 325, 'layer3': 32}. Best is trial 191 with value: 0.8109607364737272.

Escherichia_Coli | Ciprofloxacin | Optuna:  98%|█████████▊| 195/200 [8:06:55<15:06, 181.37s/it, best=0.811][A
Escherichia_Coli | Ciprofloxacin | Optuna:  98%|█████████▊| 195/200 [8:06:55<15:06, 181.37s/it, best=0.811][A[I 2026-02-27 22:54:41,608] Trial 72 finished with value: 0.8573587959441091 and parameters: {'activation': 'identity', 'solver': 'adam', 'lr': 4.212945180057304e-06, 'layer1': 468, 'layer2': 376, 'layer3': 463}. Best is trial 25 with value: 0.9080365798965563.

Klebsiella_Pneumoniae | Ceftriaxone | Optuna:  36%|███▋      | 73/200 [2:04:03<4:00:55, 113.82s/it, best=0.908][A
Klebsiella_Pneumoniae | Ceftriaxone | Optuna:  36%|███▋      | 73/200 [2:04:03<4:00:55, 113.82s/it, best=0.908][A[I 2026-02-27 22:55:12,886] Trial 45 finished with value: 0.8825520617758056 and parameters: {'activation': 'identity', 'solver': 'adam', 'lr': 0.00029426053132682153, 'layer1': 347, 'layer2': 371, 'layer3': 406}. Best is trial 8 with value: 0.8854975788426769.

Pseudomonas_Aeruginosa | Meropenem | Optuna:  23%|██▎       | 46/200 [50:48<2:39:40, 62.21s/it, best=0.885][A
Pseudomonas_Aeruginosa | Meropenem | Optuna:  23%|██▎       | 46/200 [50:48<2:39:40, 62.21s/it, best=0.885][A[I 2026-02-27 22:55:45,030] Trial 40 finished with value: 0.8529192212431699 and parameters: {'activation': 'tanh', 'solver': 'adam', 'lr': 9.635046388957142e-05, 'layer1': 49, 'layer2': 159, 'layer3': 339}. Best is trial 33 with value: 0.8559196107911822.

Staphylococcus_Aureus | Clindamycin | Optuna:  20%|██        | 41/200 [57:46<3:02:31, 68.88s/it, best=0.856][A
Staphylococcus_Aureus | Clindamycin | Optuna:  20%|██        | 41/200 [57:46<3:02:31, 68.88s/it, best=0.856][A[I 2026-02-27 22:56:07,631] Trial 46 finished with value: 0.8454817117678173 and parameters: {'activation': 'identity', 'solver': 'sgd', 'lr': 0.00013755654365821873, 'layer1': 234, 'layer2': 335, 'layer3': 263}. Best is trial 8 with value: 0.8854975788426769.

Pseudomonas_Aeruginosa | Meropenem | Optuna:  24%|██▎       | 47/200 [51:42<2:32:55, 59.97s/it, best=0.885][A
Pseudomonas_Aeruginosa | Meropenem | Optuna:  24%|██▎       | 47/200 [51:42<2:32:55, 59.97s/it, best=0.885][A[I 2026-02-27 22:56:27,822] Trial 73 finished with value: 0.90577177573242 and parameters: {'activation': 'identity', 'solver': 'adam', 'lr': 5.986967933909598e-05, 'layer1': 486, 'layer2': 418, 'layer3': 484}. Best is trial 25 with value: 0.9080365798965563.

Klebsiella_Pneumoniae | Ceftriaxone | Optuna:  37%|███▋      | 74/200 [2:05:49<3:54:13, 111.54s/it, best=0.908][A
Klebsiella_Pneumoniae | Ceftriaxone | Optuna:  37%|███▋      | 74/200 [2:05:49<3:54:13, 111.54s/it, best=0.908][A[I 2026-02-27 22:56:34,081] Trial 47 finished with value: 0.8429744308639442 and parameters: {'activation': 'relu', 'solver': 'adam', 'lr': 3.3821163079435e-05, 'layer1': 289, 'layer2': 268, 'layer3': 23}. Best is trial 8 with value: 0.8854975788426769.

Pseudomonas_Aeruginosa | Meropenem | Optuna:  24%|██▍       | 48/200 [52:09<2:06:27, 49.92s/it, best=0.885][A
Pseudomonas_Aeruginosa | Meropenem | Optuna:  24%|██▍       | 48/200 [52:09<2:06:27, 49.92s/it, best=0.885][A[I 2026-02-27 22:57:22,544] Trial 41 finished with value: 0.8513430970552491 and parameters: {'activation': 'logistic', 'solver': 'adam', 'lr': 0.0003414649334113034, 'layer1': 74, 'layer2': 47, 'layer3': 476}. Best is trial 33 with value: 0.8559196107911822.

Staphylococcus_Aureus | Clindamycin | Optuna:  21%|██        | 42/200 [59:24<3:24:00, 77.47s/it, best=0.856][A
Staphylococcus_Aureus | Clindamycin | Optuna:  21%|██        | 42/200 [59:24<3:24:00, 77.47s/it, best=0.856][A[I 2026-02-27 22:57:50,435] Trial 42 finished with value: 0.7888558471217525 and parameters: {'activation': 'logistic', 'solver': 'adam', 'lr': 0.00017482936357782615, 'layer1': 97, 'layer2': 72, 'layer3': 455}. Best is trial 33 with value: 0.8559196107911822.

Staphylococcus_Aureus | Clindamycin | Optuna:  22%|██▏       | 43/200 [59:52<2:43:47, 62.60s/it, best=0.856][A
Staphylococcus_Aureus | Clindamycin | Optuna:  22%|██▏       | 43/200 [59:52<2:43:47, 62.60s/it, best=0.856][A[I 2026-02-27 22:58:07,537] Trial 48 finished with value: 0.8848651054084229 and parameters: {'activation': 'identity', 'solver': 'adam', 'lr': 0.0011097741494460686, 'layer1': 337, 'layer2': 297, 'layer3': 463}. Best is trial 8 with value: 0.8854975788426769.

Pseudomonas_Aeruginosa | Meropenem | Optuna:  24%|██▍       | 49/200 [53:42<2:38:29, 62.98s/it, best=0.885][A
Pseudomonas_Aeruginosa | Meropenem | Optuna:  24%|██▍       | 49/200 [53:42<2:38:29, 62.98s/it, best=0.885][A[I 2026-02-27 22:58:17,216] Trial 74 finished with value: 0.9062383087714606 and parameters: {'activation': 'identity', 'solver': 'adam', 'lr': 0.00020675225198833126, 'layer1': 437, 'layer2': 434, 'layer3': 416}. Best is trial 25 with value: 0.9080365798965563.

Klebsiella_Pneumoniae | Ceftriaxone | Optuna:  38%|███▊      | 75/200 [2:07:38<3:51:01, 110.90s/it, best=0.908][A
Klebsiella_Pneumoniae | Ceftriaxone | Optuna:  38%|███▊      | 75/200 [2:07:38<3:51:01, 110.90s/it, best=0.908][A[I 2026-02-27 22:58:23,094] Trial 43 finished with value: 0.639330567141194 and parameters: {'activation': 'logistic', 'solver': 'adam', 'lr': 1.2403668302547623e-06, 'layer1': 37, 'layer2': 121, 'layer3': 499}. Best is trial 33 with value: 0.8559196107911822.

Staphylococcus_Aureus | Clindamycin | Optuna:  22%|██▏       | 44/200 [1:00:24<2:19:23, 53.62s/it, best=0.856][A
Staphylococcus_Aureus | Clindamycin | Optuna:  22%|██▏       | 44/200 [1:00:24<2:19:23, 53.62s/it, best=0.856][A[I 2026-02-27 22:58:51,080] Trial 195 finished with value: 0.801091435814131 and parameters: {'activation': 'identity', 'solver': 'adam', 'lr': 2.0420339791055347e-05, 'layer1': 483, 'layer2': 338, 'layer3': 25}. Best is trial 191 with value: 0.8109607364737272.

Escherichia_Coli | Ciprofloxacin | Optuna:  98%|█████████▊| 196/200 [8:11:20<13:46, 206.50s/it, best=0.811][A
Escherichia_Coli | Ciprofloxacin | Optuna:  98%|█████████▊| 196/200 [8:11:20<13:46, 206.50s/it, best=0.811][A[I 2026-02-27 22:59:27,003] Trial 49 finished with value: 0.8820462102390039 and parameters: {'activation': 'identity', 'solver': 'adam', 'lr': 0.0006726404342318267, 'layer1': 332, 'layer2': 300, 'layer3': 297}. Best is trial 8 with value: 0.8854975788426769.

Pseudomonas_Aeruginosa | Meropenem | Optuna:  25%|██▌       | 50/200 [55:02<2:49:48, 67.92s/it, best=0.885][A
Pseudomonas_Aeruginosa | Meropenem | Optuna:  25%|██▌       | 50/200 [55:02<2:49:48, 67.92s/it, best=0.885][A[I 2026-02-27 22:59:41,379] Trial 44 finished with value: 0.8459967922537498 and parameters: {'activation': 'logistic', 'solver': 'adam', 'lr': 0.000905861940674123, 'layer1': 186, 'layer2': 44, 'layer3': 424}. Best is trial 33 with value: 0.8559196107911822.

Staphylococcus_Aureus | Clindamycin | Optuna:  22%|██▎       | 45/200 [1:01:43<2:37:37, 61.02s/it, best=0.856][A
Staphylococcus_Aureus | Clindamycin | Optuna:  22%|██▎       | 45/200 [1:01:43<2:37:37, 61.02s/it, best=0.856][A[I 2026-02-27 23:00:04,872] Trial 75 finished with value: 0.904170363036766 and parameters: {'activation': 'identity', 'solver': 'adam', 'lr': 0.00020957075482313747, 'layer1': 419, 'layer2': 459, 'layer3': 410}. Best is trial 25 with value: 0.9080365798965563.

Klebsiella_Pneumoniae | Ceftriaxone | Optuna:  38%|███▊      | 76/200 [2:09:26<3:47:10, 109.92s/it, best=0.908][A
Klebsiella_Pneumoniae | Ceftriaxone | Optuna:  38%|███▊      | 76/200 [2:09:26<3:47:10, 109.92s/it, best=0.908][A[I 2026-02-27 23:00:11,873] Trial 45 finished with value: 0.7888558471217525 and parameters: {'activation': 'logistic', 'solver': 'adam', 'lr': 0.00014248792481281208, 'layer1': 127, 'layer2': 86, 'layer3': 476}. Best is trial 33 with value: 0.8559196107911822.

Staphylococcus_Aureus | Clindamycin | Optuna:  23%|██▎       | 46/200 [1:02:13<2:13:06, 51.86s/it, best=0.856][A
Staphylococcus_Aureus | Clindamycin | Optuna:  23%|██▎       | 46/200 [1:02:13<2:13:06, 51.86s/it, best=0.856][A[I 2026-02-27 23:00:30,047] Trial 50 finished with value: 0.8773879129303322 and parameters: {'activation': 'tanh', 'solver': 'adam', 'lr': 0.0001687105251789265, 'layer1': 268, 'layer2': 401, 'layer3': 465}. Best is trial 8 with value: 0.8854975788426769.

Pseudomonas_Aeruginosa | Meropenem | Optuna:  26%|██▌       | 51/200 [56:05<2:45:02, 66.46s/it, best=0.885][A
Pseudomonas_Aeruginosa | Meropenem | Optuna:  26%|██▌       | 51/200 [56:05<2:45:02, 66.46s/it, best=0.885][A[I 2026-02-27 23:00:40,377] Trial 46 finished with value: 0.7888558471217525 and parameters: {'activation': 'logistic', 'solver': 'adam', 'lr': 6.634743269927414e-05, 'layer1': 65, 'layer2': 182, 'layer3': 356}. Best is trial 33 with value: 0.8559196107911822.

Staphylococcus_Aureus | Clindamycin | Optuna:  24%|██▎       | 47/200 [1:02:42<1:54:22, 44.85s/it, best=0.856][A
Staphylococcus_Aureus | Clindamycin | Optuna:  24%|██▎       | 47/200 [1:02:42<1:54:22, 44.85s/it, best=0.856][A[I 2026-02-27 23:01:04,198] Trial 47 finished with value: 0.792461674045142 and parameters: {'activation': 'tanh', 'solver': 'sgd', 'lr': 0.0006500938422440957, 'layer1': 91, 'layer2': 34, 'layer3': 385}. Best is trial 33 with value: 0.8559196107911822.

Staphylococcus_Aureus | Clindamycin | Optuna:  24%|██▍       | 48/200 [1:03:05<1:37:38, 38.54s/it, best=0.856][A
Staphylococcus_Aureus | Clindamycin | Optuna:  24%|██▍       | 48/200 [1:03:05<1:37:38, 38.54s/it, best=0.856][A[I 2026-02-27 23:01:08,265] Trial 196 finished with value: 0.8041549296252584 and parameters: {'activation': 'tanh', 'solver': 'adam', 'lr': 3.614166440641321e-05, 'layer1': 425, 'layer2': 359, 'layer3': 37}. Best is trial 191 with value: 0.8109607364737272.

Escherichia_Coli | Ciprofloxacin | Optuna:  98%|█████████▊| 197/200 [8:13:37<09:17, 185.71s/it, best=0.811][A
Escherichia_Coli | Ciprofloxacin | Optuna:  98%|█████████▊| 197/200 [8:13:37<09:17, 185.71s/it, best=0.811][A[I 2026-02-27 23:01:16,012] Trial 51 finished with value: 0.8822140564474591 and parameters: {'activation': 'identity', 'solver': 'adam', 'lr': 0.0012874582440260852, 'layer1': 11, 'layer2': 165, 'layer3': 438}. Best is trial 8 with value: 0.8854975788426769.

Pseudomonas_Aeruginosa | Meropenem | Optuna:  26%|██▌       | 52/200 [56:51<2:28:46, 60.31s/it, best=0.885][A
Pseudomonas_Aeruginosa | Meropenem | Optuna:  26%|██▌       | 52/200 [56:51<2:28:46, 60.31s/it, best=0.885][A[I 2026-02-27 23:01:36,004] Trial 76 finished with value: 0.8985861632542516 and parameters: {'activation': 'identity', 'solver': 'adam', 'lr': 0.0003011405485252098, 'layer1': 442, 'layer2': 429, 'layer3': 384}. Best is trial 25 with value: 0.9080365798965563.

Klebsiella_Pneumoniae | Ceftriaxone | Optuna:  38%|███▊      | 77/200 [2:10:57<3:33:47, 104.29s/it, best=0.908][A
Klebsiella_Pneumoniae | Ceftriaxone | Optuna:  38%|███▊      | 77/200 [2:10:57<3:33:47, 104.29s/it, best=0.908][A[I 2026-02-27 23:02:33,919] Trial 48 finished with value: 0.8097776294242435 and parameters: {'activation': 'relu', 'solver': 'adam', 'lr': 3.1754617408065694e-05, 'layer1': 143, 'layer2': 138, 'layer3': 200}. Best is trial 33 with value: 0.8559196107911822.

Staphylococcus_Aureus | Clindamycin | Optuna:  24%|██▍       | 49/200 [1:04:35<2:15:38, 53.90s/it, best=0.856][A
Staphylococcus_Aureus | Clindamycin | Optuna:  24%|██▍       | 49/200 [1:04:35<2:15:38, 53.90s/it, best=0.856][A[I 2026-02-27 23:02:46,383] Trial 52 finished with value: 0.8846422148265283 and parameters: {'activation': 'identity', 'solver': 'adam', 'lr': 0.0010231298666212342, 'layer1': 410, 'layer2': 217, 'layer3': 481}. Best is trial 8 with value: 0.8854975788426769.

Pseudomonas_Aeruginosa | Meropenem | Optuna:  26%|██▋       | 53/200 [58:21<2:49:51, 69.33s/it, best=0.885][A
Pseudomonas_Aeruginosa | Meropenem | Optuna:  26%|██▋       | 53/200 [58:21<2:49:51, 69.33s/it, best=0.885][A[I 2026-02-27 23:03:18,973] Trial 77 finished with value: 0.9049345245127443 and parameters: {'activation': 'identity', 'solver': 'adam', 'lr': 0.00041827590470809594, 'layer1': 379, 'layer2': 437, 'layer3': 369}. Best is trial 25 with value: 0.9080365798965563.

Klebsiella_Pneumoniae | Ceftriaxone | Optuna:  39%|███▉      | 78/200 [2:12:40<3:31:14, 103.89s/it, best=0.908][A
Klebsiella_Pneumoniae | Ceftriaxone | Optuna:  39%|███▉      | 78/200 [2:12:40<3:31:14, 103.89s/it, best=0.908][A[I 2026-02-27 23:03:57,662] Trial 197 finished with value: 0.8072457410623542 and parameters: {'activation': 'tanh', 'solver': 'adam', 'lr': 2.92092269922577e-05, 'layer1': 356, 'layer2': 314, 'layer3': 18}. Best is trial 191 with value: 0.8109607364737272.

Escherichia_Coli | Ciprofloxacin | Optuna:  99%|█████████▉| 198/200 [8:16:27<06:01, 180.81s/it, best=0.811][A
Escherichia_Coli | Ciprofloxacin | Optuna:  99%|█████████▉| 198/200 [8:16:27<06:01, 180.81s/it, best=0.811][A[I 2026-02-27 23:04:16,882] Trial 49 finished with value: 0.8511568145339196 and parameters: {'activation': 'logistic', 'solver': 'adam', 'lr': 0.0004153450392894956, 'layer1': 178, 'layer2': 117, 'layer3': 415}. Best is trial 33 with value: 0.8559196107911822.

Staphylococcus_Aureus | Clindamycin | Optuna:  25%|██▌       | 50/200 [1:06:18<2:51:32, 68.62s/it, best=0.856][A
Staphylococcus_Aureus | Clindamycin | Optuna:  25%|██▌       | 50/200 [1:06:18<2:51:32, 68.62s/it, best=0.856][A[I 2026-02-27 23:04:21,438] Trial 53 finished with value: 0.8806765002684898 and parameters: {'activation': 'identity', 'solver': 'adam', 'lr': 0.002204187098008435, 'layer1': 305, 'layer2': 416, 'layer3': 378}. Best is trial 8 with value: 0.8854975788426769.

Pseudomonas_Aeruginosa | Meropenem | Optuna:  27%|██▋       | 54/200 [59:56<3:07:28, 77.05s/it, best=0.885][A
Pseudomonas_Aeruginosa | Meropenem | Optuna:  27%|██▋       | 54/200 [59:56<3:07:28, 77.05s/it, best=0.885][A[I 2026-02-27 23:04:53,153] Trial 78 finished with value: 0.9018577586231707 and parameters: {'activation': 'identity', 'solver': 'adam', 'lr': 0.00011006341297741925, 'layer1': 432, 'layer2': 363, 'layer3': 419}. Best is trial 25 with value: 0.9080365798965563.

Klebsiella_Pneumoniae | Ceftriaxone | Optuna:  40%|███▉      | 79/200 [2:14:14<3:23:38, 100.98s/it, best=0.908][A
Klebsiella_Pneumoniae | Ceftriaxone | Optuna:  40%|███▉      | 79/200 [2:14:14<3:23:38, 100.98s/it, best=0.908][A[I 2026-02-27 23:05:24,239] Trial 50 finished with value: 0.8478286270936037 and parameters: {'activation': 'logistic', 'solver': 'adam', 'lr': 0.0011276735317721244, 'layer1': 239, 'layer2': 11, 'layer3': 455}. Best is trial 33 with value: 0.8559196107911822.

Staphylococcus_Aureus | Clindamycin | Optuna:  26%|██▌       | 51/200 [1:07:25<2:49:27, 68.24s/it, best=0.856][A
