Staphylococcus_Aureus | DirectMulti | Optuna:  70%|██████▉   | 139/200 [4:49:51<2:19:51, 137.57s/it, best=0.889]Staphylococcus_Aureus | DirectMulti | Optuna:  70%|██████▉   | 139/200 [4:49:51<2:19:51, 137.57s/it, best=0.889][I 2026-02-28 19:21:17,574] Trial 145 finished with value: 0.8906142544389443 and parameters: {'activation': 'relu', 'solver': 'adam', 'lr': 8.801794776144736e-05, 'layer1': 490, 'layer2': 298, 'layer3': 482}. Best is trial 84 with value: 0.8915097750553358.

Escherichia_Coli | Cefepime | Optuna:  73%|███████▎  | 146/200 [4:23:42<1:46:13, 118.03s/it, best=0.891][A
Escherichia_Coli | Cefepime | Optuna:  73%|███████▎  | 146/200 [4:23:42<1:46:13, 118.03s/it, best=0.891][A[I 2026-02-28 19:22:17,537] Trial 139 finished with value: 0.8879886298052426 and parameters: {'activation': 'relu', 'solver': 'adam', 'lr': 0.00010551497169185753, 'layer1': 327, 'layer2': 430, 'layer3': 290}. Best is trial 128 with value: 0.8887929505840375.
Staphylococcus_Aureus | DirectMulti | Optuna:  70%|███████   | 140/200 [4:52:22<2:21:39, 141.65s/it, best=0.889]Staphylococcus_Aureus | DirectMulti | Optuna:  70%|███████   | 140/200 [4:52:22<2:21:39, 141.65s/it, best=0.889][I 2026-02-28 19:23:19,152] Trial 146 finished with value: 0.8818628134857738 and parameters: {'activation': 'logistic', 'solver': 'adam', 'lr': 9.174071049576826e-05, 'layer1': 492, 'layer2': 396, 'layer3': 472}. Best is trial 84 with value: 0.8915097750553358.

Escherichia_Coli | Cefepime | Optuna:  74%|███████▎  | 147/200 [4:25:43<1:45:12, 119.10s/it, best=0.891][A
Escherichia_Coli | Cefepime | Optuna:  74%|███████▎  | 147/200 [4:25:43<1:45:12, 119.10s/it, best=0.891][A[I 2026-02-28 19:24:13,737] Trial 140 finished with value: 0.8848837438901981 and parameters: {'activation': 'relu', 'solver': 'adam', 'lr': 0.00010503386840088093, 'layer1': 332, 'layer2': 452, 'layer3': 283}. Best is trial 128 with value: 0.8887929505840375.
