Klebsiella_Pneumoniae | LPS | Optuna:  88%|████████▊ | 176/200 [4:13:59<27:40, 69.17s/it, best=0.926]Klebsiella_Pneumoniae | LPS | Optuna:  88%|████████▊ | 176/200 [4:13:59<27:40, 69.17s/it, best=0.926][I 2026-02-28 13:02:46,190] Trial 176 finished with value: 0.9259010571783157 and parameters: {'activation': 'identity', 'solver': 'adam', 'lr': 0.00040226027906096475, 'layer1': 66, 'layer2': 461, 'layer3': 33}. Best is trial 176 with value: 0.9259010571783157.
Klebsiella_Pneumoniae | LPS | Optuna:  88%|████████▊ | 177/200 [4:15:02<25:46, 67.24s/it, best=0.926]Klebsiella_Pneumoniae | LPS | Optuna:  88%|████████▊ | 177/200 [4:15:02<25:46, 67.24s/it, best=0.926][I 2026-02-28 13:02:51,648] Trial 137 finished with value: 0.8856482666311776 and parameters: {'activation': 'identity', 'solver': 'adam', 'lr': 0.0003732458035508365, 'layer1': 184, 'layer2': 87, 'layer3': 324}. Best is trial 8 with value: 0.8879562150966016.
Staphylococcus_Aureus | LPS | Optuna:  69%|██████▉   | 138/200 [4:56:37<1:33:15, 90.25s/it, best=0.888]Staphylococcus_Aureus | LPS | Optuna:  69%|██████▉   | 138/200 [4:56:37<1:33:15, 90.25s/it, best=0.888][I 2026-02-28 13:03:20,925] Trial 141 finished with value: 0.9132029645194724 and parameters: {'activation': 'relu', 'solver': 'adam', 'lr': 0.00027347473296159886, 'layer1': 331, 'layer2': 447, 'layer3': 187}. Best is trial 74 with value: 0.9166002918687234.

Escherichia_Coli | Piperacillin-Tazobactam | Optuna:  71%|███████   | 142/200 [4:59:13<1:40:29, 103.96s/it, best=0.917][A
Escherichia_Coli | Piperacillin-Tazobactam | Optuna:  71%|███████   | 142/200 [4:59:13<1:40:29, 103.96s/it, best=0.917][A[I 2026-02-28 13:03:46,231] Trial 177 finished with value: 0.9233526772527005 and parameters: {'activation': 'identity', 'solver': 'adam', 'lr': 0.0007416905152251265, 'layer1': 69, 'layer2': 462, 'layer3': 31}. Best is trial 176 with value: 0.9259010571783157.
Klebsiella_Pneumoniae | LPS | Optuna:  89%|████████▉ | 178/200 [4:16:02<23:51, 65.08s/it, best=0.926]Klebsiella_Pneumoniae | LPS | Optuna:  89%|████████▉ | 178/200 [4:16:02<23:51, 65.08s/it, best=0.926][I 2026-02-28 13:04:43,674] Trial 138 finished with value: 0.8786399291570888 and parameters: {'activation': 'logistic', 'solver': 'adam', 'lr': 0.00024099134297207722, 'layer1': 156, 'layer2': 144, 'layer3': 340}. Best is trial 8 with value: 0.8879562150966016.
Staphylococcus_Aureus | LPS | Optuna:  70%|██████▉   | 139/200 [4:58:30<1:38:23, 96.78s/it, best=0.888]Staphylococcus_Aureus | LPS | Optuna:  70%|██████▉   | 139/200 [4:58:30<1:38:23, 96.78s/it, best=0.888][I 2026-02-28 13:04:45,867] Trial 178 finished with value: 0.923669012015184 and parameters: {'activation': 'identity', 'solver': 'adam', 'lr': 0.00038313447231022715, 'layer1': 56, 'layer2': 488, 'layer3': 266}. Best is trial 176 with value: 0.9259010571783157.
Klebsiella_Pneumoniae | LPS | Optuna:  90%|████████▉ | 179/200 [4:17:01<22:12, 63.45s/it, best=0.926]Klebsiella_Pneumoniae | LPS | Optuna:  90%|████████▉ | 179/200 [4:17:01<22:12, 63.45s/it, best=0.926][I 2026-02-28 13:05:32,934] Trial 142 finished with value: 0.910462563390246 and parameters: {'activation': 'relu', 'solver': 'adam', 'lr': 0.00036402889310100197, 'layer1': 312, 'layer2': 411, 'layer3': 205}. Best is trial 74 with value: 0.9166002918687234.

Escherichia_Coli | Piperacillin-Tazobactam | Optuna:  72%|███████▏  | 143/200 [5:01:25<1:46:45, 112.37s/it, best=0.917][A
Escherichia_Coli | Piperacillin-Tazobactam | Optuna:  72%|███████▏  | 143/200 [5:01:25<1:46:45, 112.37s/it, best=0.917][A[I 2026-02-28 13:06:00,915] Trial 179 finished with value: 0.9230023841571832 and parameters: {'activation': 'identity', 'solver': 'adam', 'lr': 0.0008700879901515615, 'layer1': 88, 'layer2': 476, 'layer3': 483}. Best is trial 176 with value: 0.9259010571783157.
Klebsiella_Pneumoniae | LPS | Optuna:  90%|█████████ | 180/200 [4:18:16<22:18, 66.93s/it, best=0.926]Klebsiella_Pneumoniae | LPS | Optuna:  90%|█████████ | 180/200 [4:18:16<22:18, 66.93s/it, best=0.926][I 2026-02-28 13:06:14,648] Trial 139 finished with value: 0.8862883566464648 and parameters: {'activation': 'identity', 'solver': 'adam', 'lr': 0.0004894068327761918, 'layer1': 205, 'layer2': 132, 'layer3': 288}. Best is trial 8 with value: 0.8879562150966016.
Staphylococcus_Aureus | LPS | Optuna:  70%|███████   | 140/200 [5:00:00<1:35:02, 95.04s/it, best=0.888]Staphylococcus_Aureus | LPS | Optuna:  70%|███████   | 140/200 [5:00:00<1:35:02, 95.04s/it, best=0.888][I 2026-02-28 13:06:52,721] Trial 180 finished with value: 0.9233257763085204 and parameters: {'activation': 'identity', 'solver': 'adam', 'lr': 0.00020906455827672204, 'layer1': 75, 'layer2': 445, 'layer3': 97}. Best is trial 176 with value: 0.9259010571783157.
Klebsiella_Pneumoniae | LPS | Optuna:  90%|█████████ | 181/200 [4:19:08<19:45, 62.39s/it, best=0.926]Klebsiella_Pneumoniae | LPS | Optuna:  90%|█████████ | 181/200 [4:19:08<19:45, 62.39s/it, best=0.926][I 2026-02-28 13:06:53,667] Trial 140 finished with value: 0.8033627337115729 and parameters: {'activation': 'identity', 'solver': 'sgd', 'lr': 0.00020601684490316875, 'layer1': 173, 'layer2': 66, 'layer3': 274}. Best is trial 8 with value: 0.8879562150966016.
Staphylococcus_Aureus | LPS | Optuna:  70%|███████   | 141/200 [5:00:40<1:16:55, 78.23s/it, best=0.888]Staphylococcus_Aureus | LPS | Optuna:  70%|███████   | 141/200 [5:00:40<1:16:55, 78.23s/it, best=0.888][I 2026-02-28 13:07:23,428] Trial 143 finished with value: 0.9153912155025857 and parameters: {'activation': 'relu', 'solver': 'adam', 'lr': 0.00023377750454740172, 'layer1': 343, 'layer2': 394, 'layer3': 266}. Best is trial 74 with value: 0.9166002918687234.

Escherichia_Coli | Piperacillin-Tazobactam | Optuna:  72%|███████▏  | 144/200 [5:03:16<1:44:21, 111.81s/it, best=0.917][A
Escherichia_Coli | Piperacillin-Tazobactam | Optuna:  72%|███████▏  | 144/200 [5:03:16<1:44:21, 111.81s/it, best=0.917][A[I 2026-02-28 13:07:45,280] Trial 181 finished with value: 0.9234876916092105 and parameters: {'activation': 'identity', 'solver': 'adam', 'lr': 0.0006169881283760167, 'layer1': 60, 'layer2': 435, 'layer3': 58}. Best is trial 176 with value: 0.9259010571783157.
Klebsiella_Pneumoniae | LPS | Optuna:  91%|█████████ | 182/200 [4:20:01<17:49, 59.44s/it, best=0.926]Klebsiella_Pneumoniae | LPS | Optuna:  91%|█████████ | 182/200 [4:20:01<17:49, 59.44s/it, best=0.926][I 2026-02-28 13:08:18,564] Trial 141 finished with value: 0.8868889269291929 and parameters: {'activation': 'identity', 'solver': 'adam', 'lr': 0.00032169116019213406, 'layer1': 92, 'layer2': 114, 'layer3': 355}. Best is trial 8 with value: 0.8879562150966016.
Staphylococcus_Aureus | LPS | Optuna:  71%|███████   | 142/200 [5:02:04<1:17:33, 80.23s/it, best=0.888]Staphylococcus_Aureus | LPS | Optuna:  71%|███████   | 142/200 [5:02:04<1:17:33, 80.23s/it, best=0.888][I 2026-02-28 13:08:40,093] Trial 182 finished with value: 0.9248785390205747 and parameters: {'activation': 'identity', 'solver': 'adam', 'lr': 0.00047216284931234933, 'layer1': 48, 'layer2': 460, 'layer3': 35}. Best is trial 176 with value: 0.9259010571783157.
Klebsiella_Pneumoniae | LPS | Optuna:  92%|█████████▏| 183/200 [4:20:56<16:26, 58.05s/it, best=0.926]Klebsiella_Pneumoniae | LPS | Optuna:  92%|█████████▏| 183/200 [4:20:56<16:26, 58.05s/it, best=0.926][I 2026-02-28 13:08:47,722] Trial 144 finished with value: 0.91287710090104 and parameters: {'activation': 'relu', 'solver': 'adam', 'lr': 0.0002282854540063421, 'layer1': 262, 'layer2': 397, 'layer3': 171}. Best is trial 74 with value: 0.9166002918687234.

Escherichia_Coli | Piperacillin-Tazobactam | Optuna:  72%|███████▎  | 145/200 [5:04:40<1:34:55, 103.55s/it, best=0.917][A
Escherichia_Coli | Piperacillin-Tazobactam | Optuna:  72%|███████▎  | 145/200 [5:04:40<1:34:55, 103.55s/it, best=0.917][A[I 2026-02-28 13:09:29,276] Trial 142 finished with value: 0.8852469766837396 and parameters: {'activation': 'identity', 'solver': 'adam', 'lr': 0.00031720612576853626, 'layer1': 85, 'layer2': 113, 'layer3': 330}. Best is trial 8 with value: 0.8879562150966016.
Staphylococcus_Aureus | LPS | Optuna:  72%|███████▏  | 143/200 [5:03:15<1:13:30, 77.38s/it, best=0.888]Staphylococcus_Aureus | LPS | Optuna:  72%|███████▏  | 143/200 [5:03:15<1:13:30, 77.38s/it, best=0.888][I 2026-02-28 13:10:13,695] Trial 183 finished with value: 0.9239444387046942 and parameters: {'activation': 'identity', 'solver': 'adam', 'lr': 0.0004327672649029943, 'layer1': 429, 'layer2': 458, 'layer3': 33}. Best is trial 176 with value: 0.9259010571783157.
Klebsiella_Pneumoniae | LPS | Optuna:  92%|█████████▏| 184/200 [4:22:29<18:19, 68.72s/it, best=0.926]Klebsiella_Pneumoniae | LPS | Optuna:  92%|█████████▏| 184/200 [4:22:29<18:19, 68.72s/it, best=0.926][I 2026-02-28 13:10:54,841] Trial 143 finished with value: 0.8849651820531902 and parameters: {'activation': 'identity', 'solver': 'adam', 'lr': 0.0002629867554847491, 'layer1': 102, 'layer2': 100, 'layer3': 310}. Best is trial 8 with value: 0.8879562150966016.
Staphylococcus_Aureus | LPS | Optuna:  72%|███████▏  | 144/200 [5:04:41<1:14:30, 79.83s/it, best=0.888]Staphylococcus_Aureus | LPS | Optuna:  72%|███████▏  | 144/200 [5:04:41<1:14:30, 79.83s/it, best=0.888][I 2026-02-28 13:11:03,481] Trial 145 finished with value: 0.9133737911559351 and parameters: {'activation': 'relu', 'solver': 'adam', 'lr': 0.00017815399986058925, 'layer1': 346, 'layer2': 227, 'layer3': 144}. Best is trial 74 with value: 0.9166002918687234.

Escherichia_Coli | Piperacillin-Tazobactam | Optuna:  73%|███████▎  | 146/200 [5:06:56<1:41:53, 113.22s/it, best=0.917][A
Escherichia_Coli | Piperacillin-Tazobactam | Optuna:  73%|███████▎  | 146/200 [5:06:56<1:41:53, 113.22s/it, best=0.917][A[I 2026-02-28 13:11:09,055] Trial 184 finished with value: 0.924260623100334 and parameters: {'activation': 'identity', 'solver': 'adam', 'lr': 0.00031841918597819125, 'layer1': 34, 'layer2': 474, 'layer3': 21}. Best is trial 176 with value: 0.9259010571783157.
Klebsiella_Pneumoniae | LPS | Optuna:  92%|█████████▎| 185/200 [4:23:25<16:10, 64.71s/it, best=0.926]Klebsiella_Pneumoniae | LPS | Optuna:  92%|█████████▎| 185/200 [4:23:25<16:10, 64.71s/it, best=0.926][I 2026-02-28 13:12:20,507] Trial 185 finished with value: 0.9233131922826388 and parameters: {'activation': 'identity', 'solver': 'adam', 'lr': 0.00026571257755781004, 'layer1': 211, 'layer2': 469, 'layer3': 40}. Best is trial 176 with value: 0.9259010571783157.
Klebsiella_Pneumoniae | LPS | Optuna:  93%|█████████▎| 186/200 [4:24:36<15:34, 66.73s/it, best=0.926]Klebsiella_Pneumoniae | LPS | Optuna:  93%|█████████▎| 186/200 [4:24:36<15:34, 66.73s/it, best=0.926][I 2026-02-28 13:12:31,620] Trial 144 finished with value: 0.8848977811367836 and parameters: {'activation': 'identity', 'solver': 'adam', 'lr': 0.0005803332417524847, 'layer1': 217, 'layer2': 125, 'layer3': 341}. Best is trial 8 with value: 0.8879562150966016.
Staphylococcus_Aureus | LPS | Optuna:  72%|███████▎  | 145/200 [5:06:17<1:17:50, 84.92s/it, best=0.888]Staphylococcus_Aureus | LPS | Optuna:  72%|███████▎  | 145/200 [5:06:17<1:17:50, 84.92s/it, best=0.888][I 2026-02-28 13:12:54,663] Trial 146 finished with value: 0.9154058158412338 and parameters: {'activation': 'relu', 'solver': 'adam', 'lr': 0.0002925649055715792, 'layer1': 369, 'layer2': 318, 'layer3': 263}. Best is trial 74 with value: 0.9166002918687234.

Escherichia_Coli | Piperacillin-Tazobactam | Optuna:  74%|███████▎  | 147/200 [5:08:47<1:39:28, 112.61s/it, best=0.917][A
Escherichia_Coli | Piperacillin-Tazobactam | Optuna:  74%|███████▎  | 147/200 [5:08:47<1:39:28, 112.61s/it, best=0.917][A[I 2026-02-28 13:13:25,858] Trial 186 finished with value: 0.923449976264401 and parameters: {'activation': 'identity', 'solver': 'adam', 'lr': 0.00014774323450038104, 'layer1': 50, 'layer2': 452, 'layer3': 75}. Best is trial 176 with value: 0.9259010571783157.
Klebsiella_Pneumoniae | LPS | Optuna:  94%|█████████▎| 187/200 [4:25:41<14:22, 66.32s/it, best=0.926]Klebsiella_Pneumoniae | LPS | Optuna:  94%|█████████▎| 187/200 [4:25:41<14:22, 66.32s/it, best=0.926][I 2026-02-28 13:13:57,971] Trial 145 finished with value: 0.8863422926115565 and parameters: {'activation': 'identity', 'solver': 'adam', 'lr': 0.0003513431543782716, 'layer1': 143, 'layer2': 141, 'layer3': 318}. Best is trial 8 with value: 0.8879562150966016.
Staphylococcus_Aureus | LPS | Optuna:  73%|███████▎  | 146/200 [5:07:44<1:16:48, 85.35s/it, best=0.888]Staphylococcus_Aureus | LPS | Optuna:  73%|███████▎  | 146/200 [5:07:44<1:16:48, 85.35s/it, best=0.888][I 2026-02-28 13:14:36,897] Trial 187 finished with value: 0.9233436569876134 and parameters: {'activation': 'identity', 'solver': 'adam', 'lr': 0.0002296645144746359, 'layer1': 59, 'layer2': 444, 'layer3': 251}. Best is trial 176 with value: 0.9259010571783157.
Klebsiella_Pneumoniae | LPS | Optuna:  94%|█████████▍| 188/200 [4:26:52<13:32, 67.73s/it, best=0.926]Klebsiella_Pneumoniae | LPS | Optuna:  94%|█████████▍| 188/200 [4:26:52<13:32, 67.73s/it, best=0.926][I 2026-02-28 13:15:11,266] Trial 147 finished with value: 0.9163081933557752 and parameters: {'activation': 'relu', 'solver': 'adam', 'lr': 0.00029992556224657486, 'layer1': 368, 'layer2': 318, 'layer3': 263}. Best is trial 74 with value: 0.9166002918687234.

Escherichia_Coli | Piperacillin-Tazobactam | Optuna:  74%|███████▍  | 148/200 [5:11:03<1:43:49, 119.80s/it, best=0.917][A
Escherichia_Coli | Piperacillin-Tazobactam | Optuna:  74%|███████▍  | 148/200 [5:11:03<1:43:49, 119.80s/it, best=0.917][A[I 2026-02-28 13:15:31,496] Trial 146 finished with value: 0.8871200249308796 and parameters: {'activation': 'identity', 'solver': 'adam', 'lr': 0.0004498055493369508, 'layer1': 134, 'layer2': 87, 'layer3': 353}. Best is trial 8 with value: 0.8879562150966016.
Staphylococcus_Aureus | LPS | Optuna:  74%|███████▎  | 147/200 [5:09:17<1:17:33, 87.80s/it, best=0.888]Staphylococcus_Aureus | LPS | Optuna:  74%|███████▎  | 147/200 [5:09:17<1:17:33, 87.80s/it, best=0.888][I 2026-02-28 13:15:40,161] Trial 188 finished with value: 0.9234317120837501 and parameters: {'activation': 'identity', 'solver': 'adam', 'lr': 0.00037279582362143753, 'layer1': 68, 'layer2': 483, 'layer3': 64}. Best is trial 176 with value: 0.9259010571783157.
Klebsiella_Pneumoniae | LPS | Optuna:  94%|█████████▍| 189/200 [4:27:56<12:10, 66.39s/it, best=0.926]Klebsiella_Pneumoniae | LPS | Optuna:  94%|█████████▍| 189/200 [4:27:56<12:10, 66.39s/it, best=0.926][I 2026-02-28 13:16:45,720] Trial 147 finished with value: 0.8853149718103503 and parameters: {'activation': 'identity', 'solver': 'adam', 'lr': 0.0008138705726328439, 'layer1': 129, 'layer2': 58, 'layer3': 366}. Best is trial 8 with value: 0.8879562150966016.
Staphylococcus_Aureus | LPS | Optuna:  74%|███████▍  | 148/200 [5:10:32<1:12:33, 83.73s/it, best=0.888]Staphylococcus_Aureus | LPS | Optuna:  74%|███████▍  | 148/200 [5:10:32<1:12:33, 83.73s/it, best=0.888][I 2026-02-28 13:17:04,457] Trial 189 finished with value: 0.9226685418743938 and parameters: {'activation': 'identity', 'solver': 'adam', 'lr': 0.0003254188330196852, 'layer1': 401, 'layer2': 460, 'layer3': 30}. Best is trial 176 with value: 0.9259010571783157.
Klebsiella_Pneumoniae | LPS | Optuna:  95%|█████████▌| 190/200 [4:29:20<11:57, 71.76s/it, best=0.926]Klebsiella_Pneumoniae | LPS | Optuna:  95%|█████████▌| 190/200 [4:29:20<11:57, 71.76s/it, best=0.926][I 2026-02-28 13:17:16,352] Trial 148 finished with value: 0.9136531383578974 and parameters: {'activation': 'relu', 'solver': 'adam', 'lr': 0.00013569828831155813, 'layer1': 370, 'layer2': 316, 'layer3': 219}. Best is trial 74 with value: 0.9166002918687234.

Escherichia_Coli | Piperacillin-Tazobactam | Optuna:  74%|███████▍  | 149/200 [5:13:09<1:43:10, 121.39s/it, best=0.917][A
Escherichia_Coli | Piperacillin-Tazobactam | Optuna:  74%|███████▍  | 149/200 [5:13:09<1:43:10, 121.39s/it, best=0.917][A[I 2026-02-28 13:18:06,605] Trial 190 finished with value: 0.9248278275720084 and parameters: {'activation': 'identity', 'solver': 'adam', 'lr': 0.000496066265978238, 'layer1': 40, 'layer2': 425, 'layer3': 84}. Best is trial 176 with value: 0.9259010571783157.
Klebsiella_Pneumoniae | LPS | Optuna:  96%|█████████▌| 191/200 [4:30:22<10:19, 68.88s/it, best=0.926]Klebsiella_Pneumoniae | LPS | Optuna:  96%|█████████▌| 191/200 [4:30:22<10:19, 68.88s/it, best=0.926][I 2026-02-28 13:18:07,293] Trial 148 finished with value: 0.8870501117169864 and parameters: {'activation': 'identity', 'solver': 'adam', 'lr': 0.00046440269181254756, 'layer1': 123, 'layer2': 90, 'layer3': 347}. Best is trial 8 with value: 0.8879562150966016.
Staphylococcus_Aureus | LPS | Optuna:  74%|███████▍  | 149/200 [5:11:53<1:10:37, 83.08s/it, best=0.888]Staphylococcus_Aureus | LPS | Optuna:  74%|███████▍  | 149/200 [5:11:53<1:10:37, 83.08s/it, best=0.888][I 2026-02-28 13:18:51,692] Trial 191 finished with value: 0.9236902882281308 and parameters: {'activation': 'identity', 'solver': 'adam', 'lr': 0.00047334584952990325, 'layer1': 31, 'layer2': 414, 'layer3': 82}. Best is trial 176 with value: 0.9259010571783157.
Klebsiella_Pneumoniae | LPS | Optuna:  96%|█████████▌| 192/200 [4:31:07<08:13, 61.74s/it, best=0.926]Klebsiella_Pneumoniae | LPS | Optuna:  96%|█████████▌| 192/200 [4:31:07<08:13, 61.74s/it, best=0.926][I 2026-02-28 13:19:00,058] Trial 149 finished with value: 0.9144984320344269 and parameters: {'activation': 'relu', 'solver': 'adam', 'lr': 0.00041802422674513885, 'layer1': 381, 'layer2': 303, 'layer3': 271}. Best is trial 74 with value: 0.9166002918687234.

Escherichia_Coli | Piperacillin-Tazobactam | Optuna:  75%|███████▌  | 150/200 [5:14:52<1:36:44, 116.08s/it, best=0.917][A
Escherichia_Coli | Piperacillin-Tazobactam | Optuna:  75%|███████▌  | 150/200 [5:14:52<1:36:44, 116.08s/it, best=0.917][A[I 2026-02-28 13:19:27,402] Trial 149 finished with value: 0.88494936156829 and parameters: {'activation': 'identity', 'solver': 'adam', 'lr': 0.00047001470188896697, 'layer1': 112, 'layer2': 92, 'layer3': 355}. Best is trial 8 with value: 0.8879562150966016.
Staphylococcus_Aureus | LPS | Optuna:  75%|███████▌  | 150/200 [5:13:13<1:08:29, 82.19s/it, best=0.888]Staphylococcus_Aureus | LPS | Optuna:  75%|███████▌  | 150/200 [5:13:13<1:08:29, 82.19s/it, best=0.888][I 2026-02-28 13:19:45,429] Trial 192 finished with value: 0.9249151743840123 and parameters: {'activation': 'identity', 'solver': 'adam', 'lr': 0.0007165010005660773, 'layer1': 42, 'layer2': 424, 'layer3': 50}. Best is trial 176 with value: 0.9259010571783157.
Klebsiella_Pneumoniae | LPS | Optuna:  96%|█████████▋| 193/200 [4:32:01<06:55, 59.34s/it, best=0.926]Klebsiella_Pneumoniae | LPS | Optuna:  96%|█████████▋| 193/200 [4:32:01<06:55, 59.34s/it, best=0.926][I 2026-02-28 13:20:27,826] Trial 150 finished with value: 0.884100496330746 and parameters: {'activation': 'identity', 'solver': 'adam', 'lr': 0.0006578415531480091, 'layer1': 106, 'layer2': 74, 'layer3': 332}. Best is trial 8 with value: 0.8879562150966016.
Staphylococcus_Aureus | LPS | Optuna:  76%|███████▌  | 151/200 [5:14:14<1:01:47, 75.66s/it, best=0.888]Staphylococcus_Aureus | LPS | Optuna:  76%|███████▌  | 151/200 [5:14:14<1:01:47, 75.66s/it, best=0.888][I 2026-02-28 13:20:39,582] Trial 193 finished with value: 0.9233833979337487 and parameters: {'activation': 'identity', 'solver': 'adam', 'lr': 0.0010048147639329667, 'layer1': 40, 'layer2': 422, 'layer3': 51}. Best is trial 176 with value: 0.9259010571783157.
Klebsiella_Pneumoniae | LPS | Optuna:  97%|█████████▋| 194/200 [4:32:55<05:46, 57.78s/it, best=0.926]Klebsiella_Pneumoniae | LPS | Optuna:  97%|█████████▋| 194/200 [4:32:55<05:46, 57.78s/it, best=0.926][I 2026-02-28 13:21:16,661] Trial 150 finished with value: 0.9141711680888717 and parameters: {'activation': 'relu', 'solver': 'adam', 'lr': 0.0005401534162426657, 'layer1': 363, 'layer2': 427, 'layer3': 291}. Best is trial 74 with value: 0.9166002918687234.

Escherichia_Coli | Piperacillin-Tazobactam | Optuna:  76%|███████▌  | 151/200 [5:17:09<1:39:49, 122.24s/it, best=0.917][A
Escherichia_Coli | Piperacillin-Tazobactam | Optuna:  76%|███████▌  | 151/200 [5:17:09<1:39:49, 122.24s/it, best=0.917][A[I 2026-02-28 13:21:30,845] Trial 194 finished with value: 0.9227333772739413 and parameters: {'activation': 'identity', 'solver': 'adam', 'lr': 0.0008216388245088426, 'layer1': 49, 'layer2': 426, 'layer3': 42}. Best is trial 176 with value: 0.9259010571783157.
Klebsiella_Pneumoniae | LPS | Optuna:  98%|█████████▊| 195/200 [4:33:46<04:39, 55.83s/it, best=0.926]Klebsiella_Pneumoniae | LPS | Optuna:  98%|█████████▊| 195/200 [4:33:46<04:39, 55.83s/it, best=0.926][I 2026-02-28 13:21:39,901] Trial 151 finished with value: 0.8864817881367975 and parameters: {'activation': 'identity', 'solver': 'adam', 'lr': 0.0004154420503616172, 'layer1': 126, 'layer2': 114, 'layer3': 380}. Best is trial 8 with value: 0.8879562150966016.
Staphylococcus_Aureus | LPS | Optuna:  76%|███████▌  | 152/200 [5:15:26<59:40, 74.58s/it, best=0.888]  Staphylococcus_Aureus | LPS | Optuna:  76%|███████▌  | 152/200 [5:15:26<59:40, 74.58s/it, best=0.888][I 2026-02-28 13:22:38,153] Trial 195 finished with value: 0.8977370124277468 and parameters: {'activation': 'identity', 'solver': 'adam', 'lr': 2.50052905992964e-05, 'layer1': 20, 'layer2': 406, 'layer3': 16}. Best is trial 176 with value: 0.9259010571783157.
Klebsiella_Pneumoniae | LPS | Optuna:  98%|█████████▊| 196/200 [4:34:54<03:57, 59.27s/it, best=0.926]Klebsiella_Pneumoniae | LPS | Optuna:  98%|█████████▊| 196/200 [4:34:54<03:57, 59.27s/it, best=0.926][I 2026-02-28 13:22:48,786] Trial 152 finished with value: 0.8854535550830285 and parameters: {'activation': 'identity', 'solver': 'adam', 'lr': 0.0010685996825771558, 'layer1': 139, 'layer2': 86, 'layer3': 352}. Best is trial 8 with value: 0.8879562150966016.
