Escherichia_Coli | Piperacillin-Tazobactam | Optuna:  23%|██▎       | 46/200 [1:36:21<7:10:22, 167.68s/it, best=0.915][A[I 2026-02-28 09:41:17,088] Trial 94 finished with value: 0.8644931004364571 and parameters: {'activation': 'identity', 'solver': 'adam', 'lr': 0.00015775449859331005, 'layer1': 427, 'layer2': 230, 'layer3': 173}. Best is trial 65 with value: 0.8669592494429758.
Pseudomonas_Aeruginosa | DirectMulti | Optuna:  48%|████▊     | 95/200 [2:45:03<3:21:16, 115.02s/it, best=0.867]Pseudomonas_Aeruginosa | DirectMulti | Optuna:  48%|████▊     | 95/200 [2:45:03<3:21:16, 115.02s/it, best=0.867]/export/usuarios01/egarroyo/MALDI_for_AMR_prediction/venv/lib/python3.13/site-packages/sklearn/model_selection/_split.py:813: UserWarning: The least populated class in y has only 4 members, which is less than n_splits=5.
  warnings.warn(
[I 2026-02-28 09:41:24,043] Trial 46 finished with value: 0.8961981956527462 and parameters: {'activation': 'relu', 'solver': 'adam', 'lr': 4.9780058081786565e-06, 'layer1': 446, 'layer2': 174, 'layer3': 193}. Best is trial 32 with value: 0.9150071905057106.

Escherichia_Coli | Piperacillin-Tazobactam | Optuna:  24%|██▎       | 47/200 [1:37:16<5:41:25, 133.89s/it, best=0.915][A
Escherichia_Coli | Piperacillin-Tazobactam | Optuna:  24%|██▎       | 47/200 [1:37:16<5:41:25, 133.89s/it, best=0.915][A[I 2026-02-28 09:42:19,983] Trial 32 finished with value: 0.9248600086969752 and parameters: {'activation': 'identity', 'solver': 'adam', 'lr': 0.0002118482693534742, 'layer1': 353, 'layer2': 265, 'layer3': 194}. Best is trial 23 with value: 0.9252230330428246.
Klebsiella_Pneumoniae | LPS | Optuna:  16%|█▋        | 33/200 [54:36<4:11:32, 90.37s/it, best=0.925]Klebsiella_Pneumoniae | LPS | Optuna:  16%|█▋        | 33/200 [54:36<4:11:32, 90.37s/it, best=0.925][I 2026-02-28 09:42:29,268] Trial 41 finished with value: 0.8838054941839987 and parameters: {'activation': 'identity', 'solver': 'adam', 'lr': 0.0024042376351904207, 'layer1': 286, 'layer2': 410, 'layer3': 395}. Best is trial 8 with value: 0.8879562150966016.
Staphylococcus_Aureus | LPS | Optuna:  21%|██        | 42/200 [1:36:15<6:37:55, 151.11s/it, best=0.888]Staphylococcus_Aureus | LPS | Optuna:  21%|██        | 42/200 [1:36:15<6:37:55, 151.11s/it, best=0.888][I 2026-02-28 09:42:55,534] Trial 47 finished with value: 0.897701095063842 and parameters: {'activation': 'identity', 'solver': 'sgd', 'lr': 0.00018466762695440583, 'layer1': 406, 'layer2': 75, 'layer3': 116}. Best is trial 32 with value: 0.9150071905057106.

Escherichia_Coli | Piperacillin-Tazobactam | Optuna:  24%|██▍       | 48/200 [1:38:48<5:06:57, 121.17s/it, best=0.915][A
Escherichia_Coli | Piperacillin-Tazobactam | Optuna:  24%|██▍       | 48/200 [1:38:48<5:06:57, 121.17s/it, best=0.915][A[I 2026-02-28 09:43:12,023] Trial 95 finished with value: 0.865971822725359 and parameters: {'activation': 'identity', 'solver': 'adam', 'lr': 0.00019787397182980982, 'layer1': 447, 'layer2': 357, 'layer3': 187}. Best is trial 65 with value: 0.8669592494429758.
Pseudomonas_Aeruginosa | DirectMulti | Optuna:  48%|████▊     | 96/200 [2:46:58<3:19:19, 114.99s/it, best=0.867]Pseudomonas_Aeruginosa | DirectMulti | Optuna:  48%|████▊     | 96/200 [2:46:58<3:19:19, 114.99s/it, best=0.867]/export/usuarios01/egarroyo/MALDI_for_AMR_prediction/venv/lib/python3.13/site-packages/sklearn/model_selection/_split.py:813: UserWarning: The least populated class in y has only 4 members, which is less than n_splits=5.
  warnings.warn(
[I 2026-02-28 09:44:30,039] Trial 33 finished with value: 0.9243328554676673 and parameters: {'activation': 'identity', 'solver': 'adam', 'lr': 0.00023445351115908197, 'layer1': 359, 'layer2': 299, 'layer3': 144}. Best is trial 23 with value: 0.9252230330428246.
Klebsiella_Pneumoniae | LPS | Optuna:  17%|█▋        | 34/200 [56:46<4:42:58, 102.28s/it, best=0.925]Klebsiella_Pneumoniae | LPS | Optuna:  17%|█▋        | 34/200 [56:46<4:42:58, 102.28s/it, best=0.925][I 2026-02-28 09:44:58,700] Trial 96 finished with value: 0.8635587838229869 and parameters: {'activation': 'identity', 'solver': 'adam', 'lr': 0.0003363422145089659, 'layer1': 445, 'layer2': 267, 'layer3': 192}. Best is trial 65 with value: 0.8669592494429758.
Pseudomonas_Aeruginosa | DirectMulti | Optuna:  48%|████▊     | 97/200 [2:48:44<3:13:07, 112.50s/it, best=0.867]Pseudomonas_Aeruginosa | DirectMulti | Optuna:  48%|████▊     | 97/200 [2:48:44<3:13:07, 112.50s/it, best=0.867]/export/usuarios01/egarroyo/MALDI_for_AMR_prediction/venv/lib/python3.13/site-packages/sklearn/model_selection/_split.py:813: UserWarning: The least populated class in y has only 4 members, which is less than n_splits=5.
  warnings.warn(
[I 2026-02-28 09:45:00,946] Trial 42 finished with value: 0.8819159444978901 and parameters: {'activation': 'identity', 'solver': 'adam', 'lr': 0.004754281304459337, 'layer1': 332, 'layer2': 378, 'layer3': 477}. Best is trial 8 with value: 0.8879562150966016.
Staphylococcus_Aureus | LPS | Optuna:  22%|██▏       | 43/200 [1:38:47<6:35:51, 151.28s/it, best=0.888]Staphylococcus_Aureus | LPS | Optuna:  22%|██▏       | 43/200 [1:38:47<6:35:51, 151.28s/it, best=0.888][I 2026-02-28 09:45:28,918] Trial 48 finished with value: 0.9153464356833068 and parameters: {'activation': 'relu', 'solver': 'adam', 'lr': 0.00038144071461818297, 'layer1': 476, 'layer2': 217, 'layer3': 367}. Best is trial 48 with value: 0.9153464356833068.

Escherichia_Coli | Piperacillin-Tazobactam | Optuna:  24%|██▍       | 49/200 [1:41:21<5:29:16, 130.83s/it, best=0.915][A
Escherichia_Coli | Piperacillin-Tazobactam | Optuna:  24%|██▍       | 49/200 [1:41:21<5:29:16, 130.83s/it, best=0.915][A[I 2026-02-28 09:45:57,156] Trial 34 finished with value: 0.8949725841119432 and parameters: {'activation': 'identity', 'solver': 'adam', 'lr': 8.611573651275688e-06, 'layer1': 352, 'layer2': 301, 'layer3': 126}. Best is trial 23 with value: 0.9252230330428246.
Klebsiella_Pneumoniae | LPS | Optuna:  18%|█▊        | 35/200 [58:13<4:28:45, 97.73s/it, best=0.925] Klebsiella_Pneumoniae | LPS | Optuna:  18%|█▊        | 35/200 [58:13<4:28:45, 97.73s/it, best=0.925][I 2026-02-28 09:46:26,673] Trial 97 finished with value: 0.8613352033123401 and parameters: {'activation': 'identity', 'solver': 'adam', 'lr': 0.00020855259358514353, 'layer1': 462, 'layer2': 331, 'layer3': 425}. Best is trial 65 with value: 0.8669592494429758.
Pseudomonas_Aeruginosa | DirectMulti | Optuna:  49%|████▉     | 98/200 [2:50:12<2:58:44, 105.14s/it, best=0.867]Pseudomonas_Aeruginosa | DirectMulti | Optuna:  49%|████▉     | 98/200 [2:50:12<2:58:44, 105.14s/it, best=0.867]/export/usuarios01/egarroyo/MALDI_for_AMR_prediction/venv/lib/python3.13/site-packages/sklearn/model_selection/_split.py:813: UserWarning: The least populated class in y has only 4 members, which is less than n_splits=5.
  warnings.warn(
[I 2026-02-28 09:46:29,756] Trial 35 finished with value: 0.8702461473038209 and parameters: {'activation': 'logistic', 'solver': 'adam', 'lr': 9.099237909899591e-05, 'layer1': 222, 'layer2': 271, 'layer3': 161}. Best is trial 23 with value: 0.9252230330428246.
Klebsiella_Pneumoniae | LPS | Optuna:  18%|█▊        | 36/200 [58:45<3:33:43, 78.19s/it, best=0.925]Klebsiella_Pneumoniae | LPS | Optuna:  18%|█▊        | 36/200 [58:45<3:33:43, 78.19s/it, best=0.925][I 2026-02-28 09:47:19,041] Trial 43 finished with value: 0.820392151773361 and parameters: {'activation': 'identity', 'solver': 'adam', 'lr': 1.2403668302547623e-06, 'layer1': 235, 'layer2': 485, 'layer3': 500}. Best is trial 8 with value: 0.8879562150966016.
Staphylococcus_Aureus | LPS | Optuna:  22%|██▏       | 44/200 [1:41:05<6:23:02, 147.32s/it, best=0.888]Staphylococcus_Aureus | LPS | Optuna:  22%|██▏       | 44/200 [1:41:05<6:23:02, 147.32s/it, best=0.888][I 2026-02-28 09:48:20,072] Trial 98 finished with value: 0.8252838029405283 and parameters: {'activation': 'identity', 'solver': 'sgd', 'lr': 0.0001762387572559838, 'layer1': 407, 'layer2': 295, 'layer3': 468}. Best is trial 65 with value: 0.8669592494429758.
Pseudomonas_Aeruginosa | DirectMulti | Optuna:  50%|████▉     | 99/200 [2:52:06<3:01:09, 107.62s/it, best=0.867]Pseudomonas_Aeruginosa | DirectMulti | Optuna:  50%|████▉     | 99/200 [2:52:06<3:01:09, 107.62s/it, best=0.867]/export/usuarios01/egarroyo/MALDI_for_AMR_prediction/venv/lib/python3.13/site-packages/sklearn/model_selection/_split.py:813: UserWarning: The least populated class in y has only 4 members, which is less than n_splits=5.
  warnings.warn(
[I 2026-02-28 09:48:27,622] Trial 49 finished with value: 0.9133697801167406 and parameters: {'activation': 'relu', 'solver': 'adam', 'lr': 0.0010466296115714969, 'layer1': 377, 'layer2': 219, 'layer3': 434}. Best is trial 48 with value: 0.9153464356833068.

Escherichia_Coli | Piperacillin-Tazobactam | Optuna:  25%|██▌       | 50/200 [1:44:20<6:02:59, 145.20s/it, best=0.915][A
Escherichia_Coli | Piperacillin-Tazobactam | Optuna:  25%|██▌       | 50/200 [1:44:20<6:02:59, 145.20s/it, best=0.915][A[I 2026-02-28 09:48:46,616] Trial 36 finished with value: 0.9237054628461289 and parameters: {'activation': 'relu', 'solver': 'adam', 'lr': 0.00019121854924991608, 'layer1': 412, 'layer2': 323, 'layer3': 128}. Best is trial 23 with value: 0.9252230330428246.
Klebsiella_Pneumoniae | LPS | Optuna:  18%|█▊        | 37/200 [1:01:02<4:20:14, 95.79s/it, best=0.925]Klebsiella_Pneumoniae | LPS | Optuna:  18%|█▊        | 37/200 [1:01:02<4:20:14, 95.79s/it, best=0.925][I 2026-02-28 09:49:29,147] Trial 44 finished with value: 0.885088247091067 and parameters: {'activation': 'identity', 'solver': 'adam', 'lr': 0.0012839668489761128, 'layer1': 194, 'layer2': 317, 'layer3': 326}. Best is trial 8 with value: 0.8879562150966016.
Staphylococcus_Aureus | LPS | Optuna:  22%|██▎       | 45/200 [1:43:15<6:07:14, 142.16s/it, best=0.888]Staphylococcus_Aureus | LPS | Optuna:  22%|██▎       | 45/200 [1:43:15<6:07:14, 142.16s/it, best=0.888][I 2026-02-28 09:50:23,923] Trial 99 finished with value: 0.8632441460168149 and parameters: {'activation': 'identity', 'solver': 'adam', 'lr': 0.00014385480070441692, 'layer1': 441, 'layer2': 360, 'layer3': 500}. Best is trial 65 with value: 0.8669592494429758.
Pseudomonas_Aeruginosa | DirectMulti | Optuna:  50%|█████     | 100/200 [2:54:10<3:07:28, 112.49s/it, best=0.867]Pseudomonas_Aeruginosa | DirectMulti | Optuna:  50%|█████     | 100/200 [2:54:10<3:07:28, 112.49s/it, best=0.867]/export/usuarios01/egarroyo/MALDI_for_AMR_prediction/venv/lib/python3.13/site-packages/sklearn/model_selection/_split.py:813: UserWarning: The least populated class in y has only 4 members, which is less than n_splits=5.
  warnings.warn(
[I 2026-02-28 09:51:24,238] Trial 37 finished with value: 0.9174896267432061 and parameters: {'activation': 'identity', 'solver': 'adam', 'lr': 2.10631166205952e-05, 'layer1': 375, 'layer2': 216, 'layer3': 185}. Best is trial 23 with value: 0.9252230330428246.
Klebsiella_Pneumoniae | LPS | Optuna:  19%|█▉        | 38/200 [1:03:40<5:08:43, 114.34s/it, best=0.925]Klebsiella_Pneumoniae | LPS | Optuna:  19%|█▉        | 38/200 [1:03:40<5:08:43, 114.34s/it, best=0.925][I 2026-02-28 09:51:45,641] Trial 50 finished with value: 0.9133895850116536 and parameters: {'activation': 'relu', 'solver': 'adam', 'lr': 0.001523475071683518, 'layer1': 475, 'layer2': 255, 'layer3': 472}. Best is trial 48 with value: 0.9153464356833068.

Escherichia_Coli | Piperacillin-Tazobactam | Optuna:  26%|██▌       | 51/200 [1:47:38<6:39:55, 161.04s/it, best=0.915][A
Escherichia_Coli | Piperacillin-Tazobactam | Optuna:  26%|██▌       | 51/200 [1:47:38<6:39:55, 161.04s/it, best=0.915][A[I 2026-02-28 09:51:55,585] Trial 45 finished with value: 0.8837989833847801 and parameters: {'activation': 'identity', 'solver': 'adam', 'lr': 0.005883124395874299, 'layer1': 313, 'layer2': 460, 'layer3': 357}. Best is trial 8 with value: 0.8879562150966016.
Staphylococcus_Aureus | LPS | Optuna:  23%|██▎       | 46/200 [1:45:41<6:08:10, 143.44s/it, best=0.888]Staphylococcus_Aureus | LPS | Optuna:  23%|██▎       | 46/200 [1:45:41<6:08:10, 143.44s/it, best=0.888][I 2026-02-28 09:52:12,937] Trial 100 finished with value: 0.8584119259677394 and parameters: {'activation': 'relu', 'solver': 'adam', 'lr': 0.0001259656529411983, 'layer1': 492, 'layer2': 378, 'layer3': 155}. Best is trial 65 with value: 0.8669592494429758.
Pseudomonas_Aeruginosa | DirectMulti | Optuna:  50%|█████     | 101/200 [2:55:59<3:03:53, 111.45s/it, best=0.867]Pseudomonas_Aeruginosa | DirectMulti | Optuna:  50%|█████     | 101/200 [2:55:59<3:03:53, 111.45s/it, best=0.867]/export/usuarios01/egarroyo/MALDI_for_AMR_prediction/venv/lib/python3.13/site-packages/sklearn/model_selection/_split.py:813: UserWarning: The least populated class in y has only 4 members, which is less than n_splits=5.
  warnings.warn(
[I 2026-02-28 09:52:49,667] Trial 46 finished with value: 0.8026706773213022 and parameters: {'activation': 'identity', 'solver': 'sgd', 'lr': 0.00018901561898528616, 'layer1': 283, 'layer2': 57, 'layer3': 438}. Best is trial 8 with value: 0.8879562150966016.
Staphylococcus_Aureus | LPS | Optuna:  24%|██▎       | 47/200 [1:46:36<4:57:25, 116.63s/it, best=0.888]Staphylococcus_Aureus | LPS | Optuna:  24%|██▎       | 47/200 [1:46:36<4:57:25, 116.63s/it, best=0.888][I 2026-02-28 09:53:15,246] Trial 38 finished with value: 0.8723096758335422 and parameters: {'activation': 'identity', 'solver': 'sgd', 'lr': 7.154446905661972e-05, 'layer1': 285, 'layer2': 277, 'layer3': 260}. Best is trial 23 with value: 0.9252230330428246.
Klebsiella_Pneumoniae | LPS | Optuna:  20%|█▉        | 39/200 [1:05:31<5:04:07, 113.34s/it, best=0.925]Klebsiella_Pneumoniae | LPS | Optuna:  20%|█▉        | 39/200 [1:05:31<5:04:07, 113.34s/it, best=0.925][I 2026-02-28 09:53:53,750] Trial 39 finished with value: 0.8709083645850682 and parameters: {'activation': 'relu', 'solver': 'adam', 'lr': 9.07330211440507e-06, 'layer1': 337, 'layer2': 325, 'layer3': 20}. Best is trial 23 with value: 0.9252230330428246.
Klebsiella_Pneumoniae | LPS | Optuna:  20%|██        | 40/200 [1:06:09<4:02:22, 90.89s/it, best=0.925] Klebsiella_Pneumoniae | LPS | Optuna:  20%|██        | 40/200 [1:06:09<4:02:22, 90.89s/it, best=0.925][I 2026-02-28 09:54:07,550] Trial 101 finished with value: 0.8646515511166932 and parameters: {'activation': 'identity', 'solver': 'adam', 'lr': 8.038314235015833e-05, 'layer1': 392, 'layer2': 356, 'layer3': 138}. Best is trial 65 with value: 0.8669592494429758.
Pseudomonas_Aeruginosa | DirectMulti | Optuna:  51%|█████     | 102/200 [2:57:53<3:03:34, 112.40s/it, best=0.867]Pseudomonas_Aeruginosa | DirectMulti | Optuna:  51%|█████     | 102/200 [2:57:53<3:03:34, 112.40s/it, best=0.867]/export/usuarios01/egarroyo/MALDI_for_AMR_prediction/venv/lib/python3.13/site-packages/sklearn/model_selection/_split.py:813: UserWarning: The least populated class in y has only 4 members, which is less than n_splits=5.
  warnings.warn(
[I 2026-02-28 09:54:37,979] Trial 51 finished with value: 0.9138011783612351 and parameters: {'activation': 'relu', 'solver': 'adam', 'lr': 0.00010175631160444798, 'layer1': 445, 'layer2': 335, 'layer3': 400}. Best is trial 48 with value: 0.9153464356833068.

Escherichia_Coli | Piperacillin-Tazobactam | Optuna:  26%|██▌       | 52/200 [1:50:30<6:45:35, 164.43s/it, best=0.915][A
Escherichia_Coli | Piperacillin-Tazobactam | Optuna:  26%|██▌       | 52/200 [1:50:30<6:45:35, 164.43s/it, best=0.915][A[I 2026-02-28 09:55:09,458] Trial 47 finished with value: 0.8843806961364692 and parameters: {'activation': 'relu', 'solver': 'adam', 'lr': 0.00043499771592785667, 'layer1': 339, 'layer2': 362, 'layer3': 406}. Best is trial 8 with value: 0.8879562150966016.
Staphylococcus_Aureus | LPS | Optuna:  24%|██▍       | 48/200 [1:48:55<5:13:04, 123.58s/it, best=0.888]Staphylococcus_Aureus | LPS | Optuna:  24%|██▍       | 48/200 [1:48:55<5:13:04, 123.58s/it, best=0.888][I 2026-02-28 09:55:23,144] Trial 40 finished with value: 0.922498685747309 and parameters: {'activation': 'tanh', 'solver': 'adam', 'lr': 0.00014149596885608637, 'layer1': 267, 'layer2': 239, 'layer3': 217}. Best is trial 23 with value: 0.9252230330428246.
Klebsiella_Pneumoniae | LPS | Optuna:  20%|██        | 41/200 [1:07:39<3:59:40, 90.44s/it, best=0.925]Klebsiella_Pneumoniae | LPS | Optuna:  20%|██        | 41/200 [1:07:39<3:59:40, 90.44s/it, best=0.925][I 2026-02-28 09:56:45,659] Trial 41 finished with value: 0.921431265944707 and parameters: {'activation': 'identity', 'solver': 'adam', 'lr': 0.000293124459851906, 'layer1': 416, 'layer2': 62, 'layer3': 137}. Best is trial 23 with value: 0.9252230330428246.
Klebsiella_Pneumoniae | LPS | Optuna:  21%|██        | 42/200 [1:09:01<3:51:53, 88.06s/it, best=0.925]Klebsiella_Pneumoniae | LPS | Optuna:  21%|██        | 42/200 [1:09:01<3:51:53, 88.06s/it, best=0.925][I 2026-02-28 09:56:51,208] Trial 102 finished with value: 0.8672439264969375 and parameters: {'activation': 'identity', 'solver': 'adam', 'lr': 4.268129843575598e-05, 'layer1': 431, 'layer2': 316, 'layer3': 169}. Best is trial 102 with value: 0.8672439264969375.
Pseudomonas_Aeruginosa | DirectMulti | Optuna:  52%|█████▏    | 103/200 [3:00:37<3:26:34, 127.77s/it, best=0.867]Pseudomonas_Aeruginosa | DirectMulti | Optuna:  52%|█████▏    | 103/200 [3:00:37<3:26:34, 127.77s/it, best=0.867]/export/usuarios01/egarroyo/MALDI_for_AMR_prediction/venv/lib/python3.13/site-packages/sklearn/model_selection/_split.py:813: UserWarning: The least populated class in y has only 4 members, which is less than n_splits=5.
  warnings.warn(
[I 2026-02-28 09:56:58,944] Trial 52 finished with value: 0.9122524531631158 and parameters: {'activation': 'relu', 'solver': 'adam', 'lr': 0.0004773588469376987, 'layer1': 445, 'layer2': 421, 'layer3': 398}. Best is trial 48 with value: 0.9153464356833068.

Escherichia_Coli | Piperacillin-Tazobactam | Optuna:  26%|██▋       | 53/200 [1:52:51<6:25:36, 157.39s/it, best=0.915][A
Escherichia_Coli | Piperacillin-Tazobactam | Optuna:  26%|██▋       | 53/200 [1:52:51<6:25:36, 157.39s/it, best=0.915][A[I 2026-02-28 09:57:57,512] Trial 48 finished with value: 0.8846338251267195 and parameters: {'activation': 'identity', 'solver': 'adam', 'lr': 0.0008725302948802778, 'layer1': 361, 'layer2': 424, 'layer3': 307}. Best is trial 8 with value: 0.8879562150966016.
Staphylococcus_Aureus | LPS | Optuna:  24%|██▍       | 49/200 [1:51:43<5:44:35, 136.92s/it, best=0.888]Staphylococcus_Aureus | LPS | Optuna:  24%|██▍       | 49/200 [1:51:43<5:44:35, 136.92s/it, best=0.888][I 2026-02-28 09:58:23,809] Trial 42 finished with value: 0.9239507899974548 and parameters: {'activation': 'identity', 'solver': 'adam', 'lr': 0.0005452626038243412, 'layer1': 367, 'layer2': 205, 'layer3': 94}. Best is trial 23 with value: 0.9252230330428246.
Klebsiella_Pneumoniae | LPS | Optuna:  22%|██▏       | 43/200 [1:10:39<3:58:20, 91.09s/it, best=0.925]Klebsiella_Pneumoniae | LPS | Optuna:  22%|██▏       | 43/200 [1:10:39<3:58:20, 91.09s/it, best=0.925][I 2026-02-28 09:58:39,013] Trial 103 finished with value: 0.8616507744833308 and parameters: {'activation': 'identity', 'solver': 'adam', 'lr': 0.00011648817929589402, 'layer1': 471, 'layer2': 339, 'layer3': 205}. Best is trial 102 with value: 0.8672439264969375.
Pseudomonas_Aeruginosa | DirectMulti | Optuna:  52%|█████▏    | 104/200 [3:02:25<3:14:51, 121.78s/it, best=0.867]Pseudomonas_Aeruginosa | DirectMulti | Optuna:  52%|█████▏    | 104/200 [3:02:25<3:14:51, 121.78s/it, best=0.867]/export/usuarios01/egarroyo/MALDI_for_AMR_prediction/venv/lib/python3.13/site-packages/sklearn/model_selection/_split.py:813: UserWarning: The least populated class in y has only 4 members, which is less than n_splits=5.
  warnings.warn(
[I 2026-02-28 09:59:46,446] Trial 53 finished with value: 0.9143209231545851 and parameters: {'activation': 'relu', 'solver': 'adam', 'lr': 0.00011192452678802127, 'layer1': 481, 'layer2': 354, 'layer3': 363}. Best is trial 48 with value: 0.9153464356833068.

Escherichia_Coli | Piperacillin-Tazobactam | Optuna:  27%|██▋       | 54/200 [1:55:39<6:30:21, 160.42s/it, best=0.915][A
Escherichia_Coli | Piperacillin-Tazobactam | Optuna:  27%|██▋       | 54/200 [1:55:39<6:30:21, 160.42s/it, best=0.915][A[I 2026-02-28 10:00:34,762] Trial 49 finished with value: 0.8838786815846961 and parameters: {'activation': 'identity', 'solver': 'adam', 'lr': 0.001556539197532245, 'layer1': 419, 'layer2': 493, 'layer3': 385}. Best is trial 8 with value: 0.8879562150966016.
Staphylococcus_Aureus | LPS | Optuna:  25%|██▌       | 50/200 [1:54:21<5:57:33, 143.02s/it, best=0.888]Staphylococcus_Aureus | LPS | Optuna:  25%|██▌       | 50/200 [1:54:21<5:57:33, 143.02s/it, best=0.888][I 2026-02-28 10:00:50,725] Trial 104 finished with value: 0.8505172906589472 and parameters: {'activation': 'identity', 'solver': 'adam', 'lr': 1.9170368430186192e-05, 'layer1': 432, 'layer2': 313, 'layer3': 225}. Best is trial 102 with value: 0.8672439264969375.
Pseudomonas_Aeruginosa | DirectMulti | Optuna:  52%|█████▎    | 105/200 [3:04:36<3:17:32, 124.76s/it, best=0.867]Pseudomonas_Aeruginosa | DirectMulti | Optuna:  52%|█████▎    | 105/200 [3:04:36<3:17:32, 124.76s/it, best=0.867]/export/usuarios01/egarroyo/MALDI_for_AMR_prediction/venv/lib/python3.13/site-packages/sklearn/model_selection/_split.py:813: UserWarning: The least populated class in y has only 4 members, which is less than n_splits=5.
  warnings.warn(
[I 2026-02-28 10:01:46,955] Trial 50 finished with value: 0.8657579629671991 and parameters: {'activation': 'tanh', 'solver': 'adam', 'lr': 0.00248881066543273, 'layer1': 311, 'layer2': 11, 'layer3': 236}. Best is trial 8 with value: 0.8879562150966016.
