Escherichia_Coli | Ceftriaxone | Optuna:  14%|█▍        | 28/200 [1:07:46<5:41:21, 119.08s/it, best=0.897][A[I 2026-02-28 00:18:09,977] Trial 114 finished with value: 0.8830616075296744 and parameters: {'activation': 'identity', 'solver': 'adam', 'lr': 0.0021285354138232027, 'layer1': 347, 'layer2': 142, 'layer3': 289}. Best is trial 73 with value: 0.8861579932511299.

Pseudomonas_Aeruginosa | Meropenem | Optuna:  57%|█████▊    | 115/200 [2:13:45<1:48:42, 76.74s/it, best=0.886][A
Pseudomonas_Aeruginosa | Meropenem | Optuna:  57%|█████▊    | 115/200 [2:13:45<1:48:42, 76.74s/it, best=0.886][A[I 2026-02-28 00:18:42,903] Trial 105 finished with value: 0.857392473801258 and parameters: {'activation': 'logistic', 'solver': 'adam', 'lr': 0.0006271042443635887, 'layer1': 184, 'layer2': 131, 'layer3': 25}. Best is trial 105 with value: 0.857392473801258.

Staphylococcus_Aureus | Clindamycin | Optuna:  53%|█████▎    | 106/200 [2:20:44<1:59:28, 76.26s/it, best=0.857][A
Staphylococcus_Aureus | Clindamycin | Optuna:  53%|█████▎    | 106/200 [2:20:44<1:59:28, 76.26s/it, best=0.857][A[I 2026-02-28 00:19:25,867] Trial 28 finished with value: 0.889517196286762 and parameters: {'activation': 'tanh', 'solver': 'adam', 'lr': 5.876708783455224e-05, 'layer1': 212, 'layer2': 130, 'layer3': 87}. Best is trial 14 with value: 0.8971256036318559.

Escherichia_Coli | Ceftriaxone | Optuna:  14%|█▍        | 29/200 [1:09:27<5:23:43, 113.59s/it, best=0.897][A
Escherichia_Coli | Ceftriaxone | Optuna:  14%|█▍        | 29/200 [1:09:27<5:23:43, 113.59s/it, best=0.897][A[I 2026-02-28 00:19:35,461] Trial 115 finished with value: 0.8841333845479815 and parameters: {'activation': 'identity', 'solver': 'adam', 'lr': 0.0005848396414281964, 'layer1': 424, 'layer2': 195, 'layer3': 464}. Best is trial 73 with value: 0.8861579932511299.

Pseudomonas_Aeruginosa | Meropenem | Optuna:  58%|█████▊    | 116/200 [2:15:10<1:51:06, 79.36s/it, best=0.886][A
Pseudomonas_Aeruginosa | Meropenem | Optuna:  58%|█████▊    | 116/200 [2:15:10<1:51:06, 79.36s/it, best=0.886][A[I 2026-02-28 00:19:48,872] Trial 112 finished with value: 0.9069952130468322 and parameters: {'activation': 'tanh', 'solver': 'adam', 'lr': 1.778299940959936e-05, 'layer1': 239, 'layer2': 489, 'layer3': 387}. Best is trial 102 with value: 0.9090522215791805.

Klebsiella_Pneumoniae | Ceftriaxone | Optuna:  56%|█████▋    | 113/200 [3:29:10<4:05:00, 168.97s/it, best=0.909][A
Klebsiella_Pneumoniae | Ceftriaxone | Optuna:  56%|█████▋    | 113/200 [3:29:10<4:05:00, 168.97s/it, best=0.909][A[I 2026-02-28 00:20:04,954] Trial 29 finished with value: 0.5786803533236883 and parameters: {'activation': 'logistic', 'solver': 'sgd', 'lr': 1.916780830347334e-06, 'layer1': 459, 'layer2': 65, 'layer3': 114}. Best is trial 14 with value: 0.8971256036318559.

Escherichia_Coli | Ceftriaxone | Optuna:  15%|█▌        | 30/200 [1:10:06<4:18:30, 91.24s/it, best=0.897] [A
Escherichia_Coli | Ceftriaxone | Optuna:  15%|█▌        | 30/200 [1:10:06<4:18:30, 91.24s/it, best=0.897][A[I 2026-02-28 00:20:13,178] Trial 106 finished with value: 0.8496053470571047 and parameters: {'activation': 'logistic', 'solver': 'adam', 'lr': 0.000677893933010738, 'layer1': 279, 'layer2': 131, 'layer3': 19}. Best is trial 105 with value: 0.857392473801258.

Staphylococcus_Aureus | Clindamycin | Optuna:  54%|█████▎    | 107/200 [2:22:14<2:04:43, 80.46s/it, best=0.857][A
Staphylococcus_Aureus | Clindamycin | Optuna:  54%|█████▎    | 107/200 [2:22:14<2:04:43, 80.46s/it, best=0.857][A[I 2026-02-28 00:20:43,658] Trial 116 finished with value: 0.8834108842645207 and parameters: {'activation': 'identity', 'solver': 'adam', 'lr': 0.0004017506917181067, 'layer1': 386, 'layer2': 285, 'layer3': 216}. Best is trial 73 with value: 0.8861579932511299.

Pseudomonas_Aeruginosa | Meropenem | Optuna:  58%|█████▊    | 117/200 [2:16:18<1:45:09, 76.01s/it, best=0.886][A
Pseudomonas_Aeruginosa | Meropenem | Optuna:  58%|█████▊    | 117/200 [2:16:18<1:45:09, 76.01s/it, best=0.886][A[I 2026-02-28 00:21:47,122] Trial 113 finished with value: 0.9064987182534912 and parameters: {'activation': 'tanh', 'solver': 'adam', 'lr': 1.9402506002942375e-05, 'layer1': 245, 'layer2': 487, 'layer3': 386}. Best is trial 102 with value: 0.9090522215791805.

Klebsiella_Pneumoniae | Ceftriaxone | Optuna:  57%|█████▋    | 114/200 [3:31:08<3:40:22, 153.75s/it, best=0.909][A
Klebsiella_Pneumoniae | Ceftriaxone | Optuna:  57%|█████▋    | 114/200 [3:31:08<3:40:22, 153.75s/it, best=0.909][A[I 2026-02-28 00:21:57,072] Trial 117 finished with value: 0.8816954204509914 and parameters: {'activation': 'identity', 'solver': 'adam', 'lr': 0.0007642387503333166, 'layer1': 323, 'layer2': 175, 'layer3': 457}. Best is trial 73 with value: 0.8861579932511299.

Pseudomonas_Aeruginosa | Meropenem | Optuna:  59%|█████▉    | 118/200 [2:17:32<1:42:49, 75.23s/it, best=0.886][A
Pseudomonas_Aeruginosa | Meropenem | Optuna:  59%|█████▉    | 118/200 [2:17:32<1:42:49, 75.23s/it, best=0.886][A[I 2026-02-28 00:21:57,840] Trial 30 finished with value: 0.8946766396738417 and parameters: {'activation': 'relu', 'solver': 'adam', 'lr': 0.0001904511284275026, 'layer1': 415, 'layer2': 15, 'layer3': 65}. Best is trial 14 with value: 0.8971256036318559.

Escherichia_Coli | Ceftriaxone | Optuna:  16%|█▌        | 31/200 [1:11:59<4:35:16, 97.73s/it, best=0.897][A
Escherichia_Coli | Ceftriaxone | Optuna:  16%|█▌        | 31/200 [1:11:59<4:35:16, 97.73s/it, best=0.897][A[I 2026-02-28 00:21:58,217] Trial 107 finished with value: 0.8470452179862995 and parameters: {'activation': 'logistic', 'solver': 'adam', 'lr': 0.0005192198627879928, 'layer1': 248, 'layer2': 68, 'layer3': 35}. Best is trial 105 with value: 0.857392473801258.

Staphylococcus_Aureus | Clindamycin | Optuna:  54%|█████▍    | 108/200 [2:23:59<2:14:40, 87.84s/it, best=0.857][A
Staphylococcus_Aureus | Clindamycin | Optuna:  54%|█████▍    | 108/200 [2:23:59<2:14:40, 87.84s/it, best=0.857][A[I 2026-02-28 00:23:25,067] Trial 108 finished with value: 0.8174134856058375 and parameters: {'activation': 'logistic', 'solver': 'adam', 'lr': 0.005724899948442512, 'layer1': 164, 'layer2': 110, 'layer3': 55}. Best is trial 105 with value: 0.857392473801258.

Staphylococcus_Aureus | Clindamycin | Optuna:  55%|█████▍    | 109/200 [2:25:26<2:12:46, 87.54s/it, best=0.857][A
Staphylococcus_Aureus | Clindamycin | Optuna:  55%|█████▍    | 109/200 [2:25:26<2:12:46, 87.54s/it, best=0.857][A[I 2026-02-28 00:23:29,271] Trial 118 finished with value: 0.8830819778715899 and parameters: {'activation': 'identity', 'solver': 'adam', 'lr': 0.002796330111610583, 'layer1': 341, 'layer2': 371, 'layer3': 266}. Best is trial 73 with value: 0.8861579932511299.

Pseudomonas_Aeruginosa | Meropenem | Optuna:  60%|█████▉    | 119/200 [2:19:04<1:48:26, 80.32s/it, best=0.886][A
Pseudomonas_Aeruginosa | Meropenem | Optuna:  60%|█████▉    | 119/200 [2:19:04<1:48:26, 80.32s/it, best=0.886][A[I 2026-02-28 00:23:37,543] Trial 114 finished with value: 0.9072527236608231 and parameters: {'activation': 'tanh', 'solver': 'adam', 'lr': 2.746604774060756e-05, 'layer1': 263, 'layer2': 493, 'layer3': 394}. Best is trial 102 with value: 0.9090522215791805.

Klebsiella_Pneumoniae | Ceftriaxone | Optuna:  57%|█████▊    | 115/200 [3:32:59<3:19:24, 140.75s/it, best=0.909][A
Klebsiella_Pneumoniae | Ceftriaxone | Optuna:  57%|█████▊    | 115/200 [3:32:59<3:19:24, 140.75s/it, best=0.909][A[I 2026-02-28 00:23:49,302] Trial 31 finished with value: 0.8934862619776516 and parameters: {'activation': 'relu', 'solver': 'adam', 'lr': 0.00020066851878114522, 'layer1': 382, 'layer2': 65, 'layer3': 51}. Best is trial 14 with value: 0.8971256036318559.

Escherichia_Coli | Ceftriaxone | Optuna:  16%|█▌        | 32/200 [1:13:50<4:45:10, 101.85s/it, best=0.897][A
Escherichia_Coli | Ceftriaxone | Optuna:  16%|█▌        | 32/200 [1:13:50<4:45:10, 101.85s/it, best=0.897][A[I 2026-02-28 00:24:07,955] Trial 119 finished with value: 0.8642112488919238 and parameters: {'activation': 'tanh', 'solver': 'adam', 'lr': 0.0012645427881698753, 'layer1': 406, 'layer2': 211, 'layer3': 499}. Best is trial 73 with value: 0.8861579932511299.

Pseudomonas_Aeruginosa | Meropenem | Optuna:  60%|██████    | 120/200 [2:19:43<1:30:26, 67.83s/it, best=0.886][A
Pseudomonas_Aeruginosa | Meropenem | Optuna:  60%|██████    | 120/200 [2:19:43<1:30:26, 67.83s/it, best=0.886][A[I 2026-02-28 00:24:38,602] Trial 109 finished with value: 0.8444492703074913 and parameters: {'activation': 'logistic', 'solver': 'adam', 'lr': 0.0013842783558419367, 'layer1': 184, 'layer2': 98, 'layer3': 96}. Best is trial 105 with value: 0.857392473801258.

Staphylococcus_Aureus | Clindamycin | Optuna:  55%|█████▌    | 110/200 [2:26:40<2:05:00, 83.34s/it, best=0.857][A
Staphylococcus_Aureus | Clindamycin | Optuna:  55%|█████▌    | 110/200 [2:26:40<2:05:00, 83.34s/it, best=0.857][A[I 2026-02-28 00:25:20,205] Trial 120 finished with value: 0.8832677218466707 and parameters: {'activation': 'identity', 'solver': 'adam', 'lr': 0.0008841430815689915, 'layer1': 395, 'layer2': 239, 'layer3': 439}. Best is trial 73 with value: 0.8861579932511299.

Pseudomonas_Aeruginosa | Meropenem | Optuna:  60%|██████    | 121/200 [2:20:55<1:31:03, 69.16s/it, best=0.886][A
Pseudomonas_Aeruginosa | Meropenem | Optuna:  60%|██████    | 121/200 [2:20:55<1:31:03, 69.16s/it, best=0.886][A[I 2026-02-28 00:25:41,211] Trial 115 finished with value: 0.9092132916762997 and parameters: {'activation': 'tanh', 'solver': 'adam', 'lr': 2.798157756390542e-05, 'layer1': 252, 'layer2': 472, 'layer3': 396}. Best is trial 115 with value: 0.9092132916762997.

Klebsiella_Pneumoniae | Ceftriaxone | Optuna:  58%|█████▊    | 116/200 [3:35:02<3:09:52, 135.63s/it, best=0.909][A
Klebsiella_Pneumoniae | Ceftriaxone | Optuna:  58%|█████▊    | 116/200 [3:35:02<3:09:52, 135.63s/it, best=0.909][A[I 2026-02-28 00:25:50,759] Trial 32 finished with value: 0.8947337930783764 and parameters: {'activation': 'relu', 'solver': 'adam', 'lr': 0.00039845577693560204, 'layer1': 470, 'layer2': 110, 'layer3': 47}. Best is trial 14 with value: 0.8971256036318559.

Escherichia_Coli | Ceftriaxone | Optuna:  16%|█▋        | 33/200 [1:15:52<4:59:51, 107.73s/it, best=0.897][A
Escherichia_Coli | Ceftriaxone | Optuna:  16%|█▋        | 33/200 [1:15:52<4:59:51, 107.73s/it, best=0.897][A[I 2026-02-28 00:26:56,516] Trial 110 finished with value: 0.8411058150907962 and parameters: {'activation': 'logistic', 'solver': 'adam', 'lr': 0.00018538616370764982, 'layer1': 180, 'layer2': 368, 'layer3': 123}. Best is trial 105 with value: 0.857392473801258.

Staphylococcus_Aureus | Clindamycin | Optuna:  56%|█████▌    | 111/200 [2:28:58<2:27:54, 99.71s/it, best=0.857][A
Staphylococcus_Aureus | Clindamycin | Optuna:  56%|█████▌    | 111/200 [2:28:58<2:27:54, 99.71s/it, best=0.857][A[I 2026-02-28 00:27:01,753] Trial 121 finished with value: 0.8850906980888527 and parameters: {'activation': 'identity', 'solver': 'adam', 'lr': 0.0005723793813116602, 'layer1': 366, 'layer2': 467, 'layer3': 415}. Best is trial 73 with value: 0.8861579932511299.

Pseudomonas_Aeruginosa | Meropenem | Optuna:  61%|██████    | 122/200 [2:22:36<1:42:32, 78.87s/it, best=0.886][A
Pseudomonas_Aeruginosa | Meropenem | Optuna:  61%|██████    | 122/200 [2:22:36<1:42:32, 78.87s/it, best=0.886][A[I 2026-02-28 00:27:48,564] Trial 116 finished with value: 0.9065398336985796 and parameters: {'activation': 'tanh', 'solver': 'adam', 'lr': 2.359479318406534e-05, 'layer1': 236, 'layer2': 477, 'layer3': 374}. Best is trial 115 with value: 0.9092132916762997.

Klebsiella_Pneumoniae | Ceftriaxone | Optuna:  58%|█████▊    | 117/200 [3:37:10<3:04:11, 133.15s/it, best=0.909][A
Klebsiella_Pneumoniae | Ceftriaxone | Optuna:  58%|█████▊    | 117/200 [3:37:10<3:04:11, 133.15s/it, best=0.909][A[I 2026-02-28 00:28:40,304] Trial 122 finished with value: 0.8842617690813211 and parameters: {'activation': 'identity', 'solver': 'adam', 'lr': 0.000548959276492714, 'layer1': 367, 'layer2': 466, 'layer3': 420}. Best is trial 73 with value: 0.8861579932511299.

Pseudomonas_Aeruginosa | Meropenem | Optuna:  62%|██████▏   | 123/200 [2:24:15<1:48:47, 84.78s/it, best=0.886][A
Pseudomonas_Aeruginosa | Meropenem | Optuna:  62%|██████▏   | 123/200 [2:24:15<1:48:47, 84.78s/it, best=0.886][A[I 2026-02-28 00:28:55,471] Trial 111 finished with value: 0.848859596697079 and parameters: {'activation': 'identity', 'solver': 'adam', 'lr': 0.000620093424291447, 'layer1': 130, 'layer2': 125, 'layer3': 22}. Best is trial 105 with value: 0.857392473801258.

Staphylococcus_Aureus | Clindamycin | Optuna:  56%|█████▌    | 112/200 [2:30:57<2:34:42, 105.48s/it, best=0.857][A
Staphylococcus_Aureus | Clindamycin | Optuna:  56%|█████▌    | 112/200 [2:30:57<2:34:42, 105.48s/it, best=0.857][A[I 2026-02-28 00:29:24,693] Trial 33 finished with value: 0.8940457592966423 and parameters: {'activation': 'relu', 'solver': 'adam', 'lr': 2.5091349759867103e-05, 'layer1': 306, 'layer2': 153, 'layer3': 170}. Best is trial 14 with value: 0.8971256036318559.

Escherichia_Coli | Ceftriaxone | Optuna:  17%|█▋        | 34/200 [1:19:26<6:26:12, 139.59s/it, best=0.897][A
Escherichia_Coli | Ceftriaxone | Optuna:  17%|█▋        | 34/200 [1:19:26<6:26:12, 139.59s/it, best=0.897][A[I 2026-02-28 00:30:03,916] Trial 123 finished with value: 0.8826006727675713 and parameters: {'activation': 'identity', 'solver': 'adam', 'lr': 0.0010888785704443447, 'layer1': 353, 'layer2': 493, 'layer3': 382}. Best is trial 73 with value: 0.8861579932511299.

Pseudomonas_Aeruginosa | Meropenem | Optuna:  62%|██████▏   | 124/200 [2:25:39<1:46:56, 84.43s/it, best=0.886][A
Pseudomonas_Aeruginosa | Meropenem | Optuna:  62%|██████▏   | 124/200 [2:25:39<1:46:56, 84.43s/it, best=0.886][A[I 2026-02-28 00:30:05,295] Trial 117 finished with value: 0.7792993034229465 and parameters: {'activation': 'tanh', 'solver': 'sgd', 'lr': 2.9683841564243907e-05, 'layer1': 265, 'layer2': 455, 'layer3': 400}. Best is trial 115 with value: 0.9092132916762997.

Klebsiella_Pneumoniae | Ceftriaxone | Optuna:  59%|█████▉    | 118/200 [3:39:26<3:03:26, 134.22s/it, best=0.909][A
Klebsiella_Pneumoniae | Ceftriaxone | Optuna:  59%|█████▉    | 118/200 [3:39:26<3:03:26, 134.22s/it, best=0.909][A[I 2026-02-28 00:30:12,146] Trial 34 finished with value: 0.7073092672111462 and parameters: {'activation': 'relu', 'solver': 'adam', 'lr': 9.896521951224746e-06, 'layer1': 424, 'layer2': 53, 'layer3': 80}. Best is trial 14 with value: 0.8971256036318559.

Escherichia_Coli | Ceftriaxone | Optuna:  18%|█▊        | 35/200 [1:20:13<5:07:51, 111.95s/it, best=0.897][A
Escherichia_Coli | Ceftriaxone | Optuna:  18%|█▊        | 35/200 [1:20:13<5:07:51, 111.95s/it, best=0.897][A[I 2026-02-28 00:30:26,641] Trial 112 finished with value: 0.8531012999897379 and parameters: {'activation': 'logistic', 'solver': 'adam', 'lr': 0.0004702661883490975, 'layer1': 195, 'layer2': 427, 'layer3': 40}. Best is trial 105 with value: 0.857392473801258.

Staphylococcus_Aureus | Clindamycin | Optuna:  56%|█████▋    | 113/200 [2:32:28<2:26:43, 101.19s/it, best=0.857][A
Staphylococcus_Aureus | Clindamycin | Optuna:  56%|█████▋    | 113/200 [2:32:28<2:26:43, 101.19s/it, best=0.857][A[I 2026-02-28 00:31:04,503] Trial 35 finished with value: 0.7063623135534863 and parameters: {'activation': 'logistic', 'solver': 'adam', 'lr': 1.330482885398595e-05, 'layer1': 373, 'layer2': 345, 'layer3': 32}. Best is trial 14 with value: 0.8971256036318559.

Escherichia_Coli | Ceftriaxone | Optuna:  18%|█▊        | 36/200 [1:21:06<4:17:07, 94.07s/it, best=0.897] [A
Escherichia_Coli | Ceftriaxone | Optuna:  18%|█▊        | 36/200 [1:21:06<4:17:07, 94.07s/it, best=0.897][A[I 2026-02-28 00:31:05,922] Trial 113 finished with value: 0.8022884762324072 and parameters: {'activation': 'logistic', 'solver': 'adam', 'lr': 0.0003170304559468959, 'layer1': 155, 'layer2': 91, 'layer3': 29}. Best is trial 105 with value: 0.857392473801258.

Staphylococcus_Aureus | Clindamycin | Optuna:  57%|█████▋    | 114/200 [2:33:07<1:58:25, 82.62s/it, best=0.857] [A
Staphylococcus_Aureus | Clindamycin | Optuna:  57%|█████▋    | 114/200 [2:33:07<1:58:25, 82.62s/it, best=0.857][A[I 2026-02-28 00:31:31,284] Trial 118 finished with value: 0.9037029129599439 and parameters: {'activation': 'tanh', 'solver': 'adam', 'lr': 4.072238027321733e-05, 'layer1': 208, 'layer2': 489, 'layer3': 327}. Best is trial 115 with value: 0.9092132916762997.

Klebsiella_Pneumoniae | Ceftriaxone | Optuna:  60%|█████▉    | 119/200 [3:40:52<2:41:39, 119.75s/it, best=0.909][A
Klebsiella_Pneumoniae | Ceftriaxone | Optuna:  60%|█████▉    | 119/200 [3:40:52<2:41:39, 119.75s/it, best=0.909][A[I 2026-02-28 00:31:36,043] Trial 124 finished with value: 0.8841610224737717 and parameters: {'activation': 'identity', 'solver': 'adam', 'lr': 0.0007001199837612291, 'layer1': 382, 'layer2': 437, 'layer3': 399}. Best is trial 73 with value: 0.8861579932511299.

Pseudomonas_Aeruginosa | Meropenem | Optuna:  62%|██████▎   | 125/200 [2:27:11<1:48:25, 86.74s/it, best=0.886][A
Pseudomonas_Aeruginosa | Meropenem | Optuna:  62%|██████▎   | 125/200 [2:27:11<1:48:25, 86.74s/it, best=0.886][A[I 2026-02-28 00:32:32,481] Trial 125 finished with value: 0.874663311134627 and parameters: {'activation': 'relu', 'solver': 'adam', 'lr': 0.00034473542732791577, 'layer1': 328, 'layer2': 497, 'layer3': 310}. Best is trial 73 with value: 0.8861579932511299.

Pseudomonas_Aeruginosa | Meropenem | Optuna:  63%|██████▎   | 126/200 [2:28:07<1:35:45, 77.65s/it, best=0.886][A
Pseudomonas_Aeruginosa | Meropenem | Optuna:  63%|██████▎   | 126/200 [2:28:07<1:35:45, 77.65s/it, best=0.886][A[I 2026-02-28 00:32:59,273] Trial 119 finished with value: 0.9063322747811376 and parameters: {'activation': 'tanh', 'solver': 'adam', 'lr': 4.752363287826048e-05, 'layer1': 253, 'layer2': 211, 'layer3': 425}. Best is trial 115 with value: 0.9092132916762997.

Klebsiella_Pneumoniae | Ceftriaxone | Optuna:  60%|██████    | 120/200 [3:42:20<2:26:57, 110.22s/it, best=0.909][A
Klebsiella_Pneumoniae | Ceftriaxone | Optuna:  60%|██████    | 120/200 [3:42:20<2:26:57, 110.22s/it, best=0.909][A[I 2026-02-28 00:33:01,286] Trial 114 finished with value: 0.8459529158793575 and parameters: {'activation': 'logistic', 'solver': 'adam', 'lr': 0.00025648867709620167, 'layer1': 208, 'layer2': 309, 'layer3': 50}. Best is trial 105 with value: 0.857392473801258.

Staphylococcus_Aureus | Clindamycin | Optuna:  57%|█████▊    | 115/200 [2:35:02<2:10:57, 92.44s/it, best=0.857][A
Staphylococcus_Aureus | Clindamycin | Optuna:  57%|█████▊    | 115/200 [2:35:02<2:10:57, 92.44s/it, best=0.857][A[I 2026-02-28 00:33:54,712] Trial 126 finished with value: 0.8834963829024686 and parameters: {'activation': 'identity', 'solver': 'adam', 'lr': 0.00026685420878212735, 'layer1': 374, 'layer2': 468, 'layer3': 483}. Best is trial 73 with value: 0.8861579932511299.

Pseudomonas_Aeruginosa | Meropenem | Optuna:  64%|██████▎   | 127/200 [2:29:29<1:36:08, 79.02s/it, best=0.886][A
Pseudomonas_Aeruginosa | Meropenem | Optuna:  64%|██████▎   | 127/200 [2:29:29<1:36:08, 79.02s/it, best=0.886][A[I 2026-02-28 00:35:14,582] Trial 127 finished with value: 0.883665048042084 and parameters: {'activation': 'identity', 'solver': 'adam', 'lr': 0.0016221498120813779, 'layer1': 357, 'layer2': 485, 'layer3': 231}. Best is trial 73 with value: 0.8861579932511299.

Pseudomonas_Aeruginosa | Meropenem | Optuna:  64%|██████▍   | 128/200 [2:30:49<1:35:07, 79.28s/it, best=0.886][A
Pseudomonas_Aeruginosa | Meropenem | Optuna:  64%|██████▍   | 128/200 [2:30:49<1:35:07, 79.28s/it, best=0.886][A[I 2026-02-28 00:35:19,028] Trial 115 finished with value: 0.8539774414389403 and parameters: {'activation': 'relu', 'solver': 'adam', 'lr': 0.00038708726776445947, 'layer1': 409, 'layer2': 114, 'layer3': 253}. Best is trial 105 with value: 0.857392473801258.

Staphylococcus_Aureus | Clindamycin | Optuna:  58%|█████▊    | 116/200 [2:37:20<2:28:26, 106.03s/it, best=0.857][A
Staphylococcus_Aureus | Clindamycin | Optuna:  58%|█████▊    | 116/200 [2:37:20<2:28:26, 106.03s/it, best=0.857][A[I 2026-02-28 00:36:09,813] Trial 120 finished with value: 0.9048014484809093 and parameters: {'activation': 'tanh', 'solver': 'adam', 'lr': 9.531253507803409e-06, 'layer1': 235, 'layer2': 474, 'layer3': 394}. Best is trial 115 with value: 0.9092132916762997.

Klebsiella_Pneumoniae | Ceftriaxone | Optuna:  60%|██████    | 121/200 [3:45:31<2:56:51, 134.32s/it, best=0.909][A
Klebsiella_Pneumoniae | Ceftriaxone | Optuna:  60%|██████    | 121/200 [3:45:31<2:56:51, 134.32s/it, best=0.909][A[I 2026-02-28 00:36:23,035] Trial 128 finished with value: 0.8828966792599807 and parameters: {'activation': 'identity', 'solver': 'adam', 'lr': 0.0004435432313720365, 'layer1': 173, 'layer2': 477, 'layer3': 367}. Best is trial 73 with value: 0.8861579932511299.

Pseudomonas_Aeruginosa | Meropenem | Optuna:  64%|██████▍   | 129/200 [2:31:58<1:29:58, 76.03s/it, best=0.886][A
Pseudomonas_Aeruginosa | Meropenem | Optuna:  64%|██████▍   | 129/200 [2:31:58<1:29:58, 76.03s/it, best=0.886][A[I 2026-02-28 00:36:38,761] Trial 36 finished with value: 0.8532473550108687 and parameters: {'activation': 'identity', 'solver': 'adam', 'lr': 4.563571019163555e-06, 'layer1': 470, 'layer2': 206, 'layer3': 126}. Best is trial 14 with value: 0.8971256036318559.

Escherichia_Coli | Ceftriaxone | Optuna:  18%|█▊        | 37/200 [1:26:40<7:31:18, 166.13s/it, best=0.897][A
