Escherichia_Coli | Cefepime | Optuna:  53%|█████▎    | 106/200 [3:12:31<2:48:30, 107.56s/it, best=0.891][A[I 2026-02-28 18:10:17,964] Trial 190 finished with value: 0.8702461473038209 and parameters: {'activation': 'logistic', 'solver': 'adam', 'lr': 4.235354204598331e-05, 'layer1': 35, 'layer2': 147, 'layer3': 409}. Best is trial 152 with value: 0.9236023804402054.
Klebsiella_Pneumoniae | DirectMulti | Optuna:  96%|█████████▌| 191/200 [4:44:03<08:36, 57.41s/it, best=0.924]Klebsiella_Pneumoniae | DirectMulti | Optuna:  96%|█████████▌| 191/200 [4:44:03<08:36, 57.41s/it, best=0.924][I 2026-02-28 18:11:18,426] Trial 99 finished with value: 0.8820240302146585 and parameters: {'activation': 'relu', 'solver': 'adam', 'lr': 0.0033510856765516747, 'layer1': 216, 'layer2': 340, 'layer3': 55}. Best is trial 72 with value: 0.8879714231951876.
Staphylococcus_Aureus | DirectMulti | Optuna:  50%|█████     | 100/200 [3:41:23<2:12:46, 79.66s/it, best=0.888]Staphylococcus_Aureus | DirectMulti | Optuna:  50%|█████     | 100/200 [3:41:23<2:12:46, 79.66s/it, best=0.888][I 2026-02-28 18:11:23,059] Trial 191 finished with value: 0.920861530730711 and parameters: {'activation': 'tanh', 'solver': 'adam', 'lr': 7.297643439442873e-05, 'layer1': 42, 'layer2': 103, 'layer3': 438}. Best is trial 152 with value: 0.9236023804402054.
Klebsiella_Pneumoniae | DirectMulti | Optuna:  96%|█████████▌| 192/200 [4:45:08<07:57, 59.72s/it, best=0.924]Klebsiella_Pneumoniae | DirectMulti | Optuna:  96%|█████████▌| 192/200 [4:45:08<07:57, 59.72s/it, best=0.924][I 2026-02-28 18:12:15,960] Trial 106 finished with value: 0.8896087958690562 and parameters: {'activation': 'relu', 'solver': 'adam', 'lr': 7.845712998284236e-05, 'layer1': 441, 'layer2': 342, 'layer3': 158}. Best is trial 84 with value: 0.8915097750553358.

Escherichia_Coli | Cefepime | Optuna:  54%|█████▎    | 107/200 [3:14:40<2:56:53, 114.12s/it, best=0.891][A
Escherichia_Coli | Cefepime | Optuna:  54%|█████▎    | 107/200 [3:14:40<2:56:53, 114.12s/it, best=0.891][A[I 2026-02-28 18:12:23,390] Trial 100 finished with value: 0.8054425442888966 and parameters: {'activation': 'relu', 'solver': 'sgd', 'lr': 0.0002967743524884704, 'layer1': 186, 'layer2': 303, 'layer3': 67}. Best is trial 72 with value: 0.8879714231951876.
Staphylococcus_Aureus | DirectMulti | Optuna:  50%|█████     | 101/200 [3:42:28<2:04:10, 75.25s/it, best=0.888]Staphylococcus_Aureus | DirectMulti | Optuna:  50%|█████     | 101/200 [3:42:28<2:04:10, 75.25s/it, best=0.888][I 2026-02-28 18:12:32,999] Trial 192 finished with value: 0.9228264768076772 and parameters: {'activation': 'tanh', 'solver': 'adam', 'lr': 6.71756253093304e-05, 'layer1': 54, 'layer2': 10, 'layer3': 430}. Best is trial 152 with value: 0.9236023804402054.
Klebsiella_Pneumoniae | DirectMulti | Optuna:  96%|█████████▋| 193/200 [4:46:18<07:19, 62.78s/it, best=0.924]Klebsiella_Pneumoniae | DirectMulti | Optuna:  96%|█████████▋| 193/200 [4:46:18<07:19, 62.78s/it, best=0.924][I 2026-02-28 18:13:38,024] Trial 101 finished with value: 0.8812741557597633 and parameters: {'activation': 'relu', 'solver': 'adam', 'lr': 0.0005650565133252124, 'layer1': 272, 'layer2': 394, 'layer3': 478}. Best is trial 72 with value: 0.8879714231951876.
Staphylococcus_Aureus | DirectMulti | Optuna:  51%|█████     | 102/200 [3:43:43<2:02:36, 75.07s/it, best=0.888]Staphylococcus_Aureus | DirectMulti | Optuna:  51%|█████     | 102/200 [3:43:43<2:02:36, 75.07s/it, best=0.888][I 2026-02-28 18:13:43,511] Trial 107 finished with value: 0.8829679496488841 and parameters: {'activation': 'tanh', 'solver': 'adam', 'lr': 0.0003376083669497325, 'layer1': 460, 'layer2': 362, 'layer3': 145}. Best is trial 84 with value: 0.8915097750553358.

Escherichia_Coli | Cefepime | Optuna:  54%|█████▍    | 108/200 [3:16:08<2:42:45, 106.15s/it, best=0.891][A
Escherichia_Coli | Cefepime | Optuna:  54%|█████▍    | 108/200 [3:16:08<2:42:45, 106.15s/it, best=0.891][A[I 2026-02-28 18:13:54,989] Trial 193 finished with value: 0.9232392013719293 and parameters: {'activation': 'tanh', 'solver': 'adam', 'lr': 8.67977930357693e-05, 'layer1': 60, 'layer2': 467, 'layer3': 452}. Best is trial 152 with value: 0.9236023804402054.
Klebsiella_Pneumoniae | DirectMulti | Optuna:  97%|█████████▋| 194/200 [4:47:40<06:51, 68.54s/it, best=0.924]Klebsiella_Pneumoniae | DirectMulti | Optuna:  97%|█████████▋| 194/200 [4:47:40<06:51, 68.54s/it, best=0.924][I 2026-02-28 18:15:13,045] Trial 102 finished with value: 0.8858972976151623 and parameters: {'activation': 'relu', 'solver': 'adam', 'lr': 0.00032977108799117335, 'layer1': 182, 'layer2': 291, 'layer3': 110}. Best is trial 72 with value: 0.8879714231951876.
Staphylococcus_Aureus | DirectMulti | Optuna:  52%|█████▏    | 103/200 [3:45:18<2:11:02, 81.05s/it, best=0.888]Staphylococcus_Aureus | DirectMulti | Optuna:  52%|█████▏    | 103/200 [3:45:18<2:11:02, 81.05s/it, best=0.888][I 2026-02-28 18:15:15,353] Trial 108 finished with value: 0.8889348023530935 and parameters: {'activation': 'relu', 'solver': 'adam', 'lr': 0.0001705599438990651, 'layer1': 395, 'layer2': 320, 'layer3': 255}. Best is trial 84 with value: 0.8915097750553358.

Escherichia_Coli | Cefepime | Optuna:  55%|█████▍    | 109/200 [3:17:40<2:34:29, 101.86s/it, best=0.891][A
Escherichia_Coli | Cefepime | Optuna:  55%|█████▍    | 109/200 [3:17:40<2:34:29, 101.86s/it, best=0.891][A[I 2026-02-28 18:15:18,591] Trial 194 finished with value: 0.920755521295779 and parameters: {'activation': 'tanh', 'solver': 'adam', 'lr': 8.773065352702652e-05, 'layer1': 66, 'layer2': 472, 'layer3': 465}. Best is trial 152 with value: 0.9236023804402054.
Klebsiella_Pneumoniae | DirectMulti | Optuna:  98%|█████████▊| 195/200 [4:49:04<06:05, 73.06s/it, best=0.924]Klebsiella_Pneumoniae | DirectMulti | Optuna:  98%|█████████▊| 195/200 [4:49:04<06:05, 73.06s/it, best=0.924][I 2026-02-28 18:16:34,070] Trial 195 finished with value: 0.9228495171905251 and parameters: {'activation': 'tanh', 'solver': 'adam', 'lr': 0.00012341305534862887, 'layer1': 82, 'layer2': 460, 'layer3': 448}. Best is trial 152 with value: 0.9236023804402054.
Klebsiella_Pneumoniae | DirectMulti | Optuna:  98%|█████████▊| 196/200 [4:50:19<04:55, 73.79s/it, best=0.924]Klebsiella_Pneumoniae | DirectMulti | Optuna:  98%|█████████▊| 196/200 [4:50:19<04:55, 73.79s/it, best=0.924][I 2026-02-28 18:16:55,419] Trial 103 finished with value: 0.8872321971198465 and parameters: {'activation': 'identity', 'solver': 'adam', 'lr': 0.0002322934142844121, 'layer1': 146, 'layer2': 350, 'layer3': 121}. Best is trial 72 with value: 0.8879714231951876.
Staphylococcus_Aureus | DirectMulti | Optuna:  52%|█████▏    | 104/200 [3:47:00<2:19:55, 87.45s/it, best=0.888]Staphylococcus_Aureus | DirectMulti | Optuna:  52%|█████▏    | 104/200 [3:47:00<2:19:55, 87.45s/it, best=0.888][I 2026-02-28 18:16:59,184] Trial 109 finished with value: 0.8910271755591014 and parameters: {'activation': 'relu', 'solver': 'adam', 'lr': 0.00011851398223834354, 'layer1': 415, 'layer2': 292, 'layer3': 183}. Best is trial 84 with value: 0.8915097750553358.

Escherichia_Coli | Cefepime | Optuna:  55%|█████▌    | 110/200 [3:19:23<2:33:40, 102.45s/it, best=0.891][A
Escherichia_Coli | Cefepime | Optuna:  55%|█████▌    | 110/200 [3:19:23<2:33:40, 102.45s/it, best=0.891][A[I 2026-02-28 18:17:43,993] Trial 196 finished with value: 0.9206268834243101 and parameters: {'activation': 'tanh', 'solver': 'adam', 'lr': 0.00015774470149396816, 'layer1': 85, 'layer2': 466, 'layer3': 458}. Best is trial 152 with value: 0.9236023804402054.
Klebsiella_Pneumoniae | DirectMulti | Optuna:  98%|█████████▊| 197/200 [4:51:29<03:37, 72.63s/it, best=0.924]Klebsiella_Pneumoniae | DirectMulti | Optuna:  98%|█████████▊| 197/200 [4:51:29<03:37, 72.63s/it, best=0.924][I 2026-02-28 18:18:31,128] Trial 104 finished with value: 0.8855355556386089 and parameters: {'activation': 'identity', 'solver': 'adam', 'lr': 0.00024935860669026235, 'layer1': 129, 'layer2': 353, 'layer3': 86}. Best is trial 72 with value: 0.8879714231951876.
Staphylococcus_Aureus | DirectMulti | Optuna:  52%|█████▎    | 105/200 [3:48:36<2:22:23, 89.93s/it, best=0.888]Staphylococcus_Aureus | DirectMulti | Optuna:  52%|█████▎    | 105/200 [3:48:36<2:22:23, 89.93s/it, best=0.888][I 2026-02-28 18:18:38,719] Trial 110 finished with value: 0.888023568645764 and parameters: {'activation': 'relu', 'solver': 'adam', 'lr': 0.0001067435225914871, 'layer1': 411, 'layer2': 292, 'layer3': 174}. Best is trial 84 with value: 0.8915097750553358.

Escherichia_Coli | Cefepime | Optuna:  56%|█████▌    | 111/200 [3:21:03<2:30:40, 101.58s/it, best=0.891][A
Escherichia_Coli | Cefepime | Optuna:  56%|█████▌    | 111/200 [3:21:03<2:30:40, 101.58s/it, best=0.891][A[I 2026-02-28 18:18:45,604] Trial 197 finished with value: 0.9207891859038557 and parameters: {'activation': 'tanh', 'solver': 'adam', 'lr': 0.00012419610544475078, 'layer1': 79, 'layer2': 177, 'layer3': 450}. Best is trial 152 with value: 0.9236023804402054.
Klebsiella_Pneumoniae | DirectMulti | Optuna:  99%|█████████▉| 198/200 [4:52:31<02:18, 69.32s/it, best=0.924]Klebsiella_Pneumoniae | DirectMulti | Optuna:  99%|█████████▉| 198/200 [4:52:31<02:18, 69.32s/it, best=0.924][I 2026-02-28 18:19:42,225] Trial 198 finished with value: 0.9215483609580895 and parameters: {'activation': 'tanh', 'solver': 'adam', 'lr': 0.00010149417054306794, 'layer1': 50, 'layer2': 133, 'layer3': 446}. Best is trial 152 with value: 0.9236023804402054.
Klebsiella_Pneumoniae | DirectMulti | Optuna: 100%|█████████▉| 199/200 [4:53:27<01:05, 65.51s/it, best=0.924]Klebsiella_Pneumoniae | DirectMulti | Optuna: 100%|█████████▉| 199/200 [4:53:27<01:05, 65.51s/it, best=0.924][I 2026-02-28 18:19:58,805] Trial 105 finished with value: 0.8844433576923235 and parameters: {'activation': 'identity', 'solver': 'adam', 'lr': 0.0001543250703557365, 'layer1': 149, 'layer2': 376, 'layer3': 22}. Best is trial 72 with value: 0.8879714231951876.
Staphylococcus_Aureus | DirectMulti | Optuna:  53%|█████▎    | 106/200 [3:50:04<2:19:49, 89.25s/it, best=0.888]Staphylococcus_Aureus | DirectMulti | Optuna:  53%|█████▎    | 106/200 [3:50:04<2:19:49, 89.25s/it, best=0.888][I 2026-02-28 18:20:19,563] Trial 111 finished with value: 0.8893298232396216 and parameters: {'activation': 'relu', 'solver': 'adam', 'lr': 0.00020336463698994228, 'layer1': 421, 'layer2': 346, 'layer3': 186}. Best is trial 84 with value: 0.8915097750553358.

Escherichia_Coli | Cefepime | Optuna:  56%|█████▌    | 112/200 [3:22:44<2:28:39, 101.36s/it, best=0.891][A
Escherichia_Coli | Cefepime | Optuna:  56%|█████▌    | 112/200 [3:22:44<2:28:39, 101.36s/it, best=0.891][A[I 2026-02-28 18:21:30,563] Trial 106 finished with value: 0.8868519461773957 and parameters: {'activation': 'identity', 'solver': 'adam', 'lr': 0.00020678859682149764, 'layer1': 71, 'layer2': 388, 'layer3': 112}. Best is trial 72 with value: 0.8879714231951876.
Staphylococcus_Aureus | DirectMulti | Optuna:  54%|█████▎    | 107/200 [3:51:35<2:19:30, 90.00s/it, best=0.888]Staphylococcus_Aureus | DirectMulti | Optuna:  54%|█████▎    | 107/200 [3:51:35<2:19:30, 90.00s/it, best=0.888][I 2026-02-28 18:21:37,576] Trial 199 finished with value: 0.8696627761301965 and parameters: {'activation': 'tanh', 'solver': 'sgd', 'lr': 0.0001150135639313626, 'layer1': 56, 'layer2': 50, 'layer3': 421}. Best is trial 152 with value: 0.9236023804402054.
Klebsiella_Pneumoniae | DirectMulti | Optuna: 100%|██████████| 200/200 [4:55:23<00:00, 80.46s/it, best=0.924]Klebsiella_Pneumoniae | DirectMulti | Optuna: 100%|██████████| 200/200 [4:55:23<00:00, 80.46s/it, best=0.924]                                                                                                             [Klebsiella_Pneumoniae | DirectMulti] [OPTUNA DONE] Best CV WF1=0.9236 | params={'activation': 'tanh', 'solver': 'adam', 'lr': 0.00012988513649776325, 'layer1': 37, 'layer2': 470, 'layer3': 411}
[Klebsiella_Pneumoniae | DirectMulti] Retraining with validation early stopping (10% split)...
[Klebsiella_Pneumoniae | DirectMulti] Testing...
[Klebsiella_Pneumoniae | DirectMulti] [TEST] WF1=0.9205 | ACC=0.9195 | HL=0.0805 | best_val_WF1=0.9217

[END] Species: Klebsiella_Pneumoniae done.
[Parallel(n_jobs=5)]: Done   2 out of   4 | elapsed: 1654.5min remaining: 1654.5min
[I 2026-02-28 18:22:20,301] Trial 112 finished with value: 0.8905450543687424 and parameters: {'activation': 'relu', 'solver': 'adam', 'lr': 0.00012029612775990478, 'layer1': 484, 'layer2': 379, 'layer3': 193}. Best is trial 84 with value: 0.8915097750553358.

Escherichia_Coli | Cefepime | Optuna:  56%|█████▋    | 113/200 [3:24:45<2:35:23, 107.17s/it, best=0.891][A
Escherichia_Coli | Cefepime | Optuna:  56%|█████▋    | 113/200 [3:24:45<2:35:23, 107.17s/it, best=0.891][A[I 2026-02-28 18:22:36,516] Trial 107 finished with value: 0.8820443538438191 and parameters: {'activation': 'identity', 'solver': 'adam', 'lr': 0.00021277728953724066, 'layer1': 64, 'layer2': 388, 'layer3': 118}. Best is trial 72 with value: 0.8879714231951876.
Staphylococcus_Aureus | DirectMulti | Optuna:  54%|█████▍    | 108/200 [3:52:41<2:06:56, 82.79s/it, best=0.888]Staphylococcus_Aureus | DirectMulti | Optuna:  54%|█████▍    | 108/200 [3:52:41<2:06:56, 82.79s/it, best=0.888][I 2026-02-28 18:23:44,697] Trial 108 finished with value: 0.8856270317511636 and parameters: {'activation': 'identity', 'solver': 'adam', 'lr': 0.00041043631211168266, 'layer1': 32, 'layer2': 412, 'layer3': 104}. Best is trial 72 with value: 0.8879714231951876.
Staphylococcus_Aureus | DirectMulti | Optuna:  55%|█████▍    | 109/200 [3:53:50<1:58:54, 78.41s/it, best=0.888]Staphylococcus_Aureus | DirectMulti | Optuna:  55%|█████▍    | 109/200 [3:53:50<1:58:54, 78.41s/it, best=0.888][I 2026-02-28 18:24:02,324] Trial 113 finished with value: 0.8883978403037478 and parameters: {'activation': 'relu', 'solver': 'adam', 'lr': 5.222997405646493e-05, 'layer1': 486, 'layer2': 449, 'layer3': 197}. Best is trial 84 with value: 0.8915097750553358.

Escherichia_Coli | Cefepime | Optuna:  57%|█████▋    | 114/200 [3:26:27<2:31:23, 105.63s/it, best=0.891][A
Escherichia_Coli | Cefepime | Optuna:  57%|█████▋    | 114/200 [3:26:27<2:31:23, 105.63s/it, best=0.891][A[I 2026-02-28 18:25:16,979] Trial 109 finished with value: 0.886312696998219 and parameters: {'activation': 'identity', 'solver': 'adam', 'lr': 0.00018458362249591315, 'layer1': 91, 'layer2': 441, 'layer3': 126}. Best is trial 72 with value: 0.8879714231951876.
Staphylococcus_Aureus | DirectMulti | Optuna:  55%|█████▌    | 110/200 [3:55:22<2:03:51, 82.57s/it, best=0.888]Staphylococcus_Aureus | DirectMulti | Optuna:  55%|█████▌    | 110/200 [3:55:22<2:03:51, 82.57s/it, best=0.888][I 2026-02-28 18:25:18,565] Trial 114 finished with value: 0.8849220407731805 and parameters: {'activation': 'relu', 'solver': 'adam', 'lr': 0.00025627500398938145, 'layer1': 476, 'layer2': 377, 'layer3': 148}. Best is trial 84 with value: 0.8915097750553358.

Escherichia_Coli | Cefepime | Optuna:  57%|█████▊    | 115/200 [3:27:43<2:17:08, 96.81s/it, best=0.891] [A
Escherichia_Coli | Cefepime | Optuna:  57%|█████▊    | 115/200 [3:27:43<2:17:08, 96.81s/it, best=0.891][A[I 2026-02-28 18:26:37,307] Trial 110 finished with value: 0.8852231459655842 and parameters: {'activation': 'identity', 'solver': 'adam', 'lr': 0.0006606564740719656, 'layer1': 77, 'layer2': 419, 'layer3': 39}. Best is trial 72 with value: 0.8879714231951876.
Staphylococcus_Aureus | DirectMulti | Optuna:  56%|█████▌    | 111/200 [3:56:42<2:01:28, 81.90s/it, best=0.888]Staphylococcus_Aureus | DirectMulti | Optuna:  56%|█████▌    | 111/200 [3:56:42<2:01:28, 81.90s/it, best=0.888][I 2026-02-28 18:26:43,714] Trial 115 finished with value: 0.8878336575894856 and parameters: {'activation': 'relu', 'solver': 'adam', 'lr': 7.032812040111743e-05, 'layer1': 490, 'layer2': 433, 'layer3': 169}. Best is trial 84 with value: 0.8915097750553358.

Escherichia_Coli | Cefepime | Optuna:  58%|█████▊    | 116/200 [3:29:08<2:10:38, 93.31s/it, best=0.891][A
Escherichia_Coli | Cefepime | Optuna:  58%|█████▊    | 116/200 [3:29:08<2:10:38, 93.31s/it, best=0.891][A[I 2026-02-28 18:28:05,814] Trial 111 finished with value: 0.884610760377258 and parameters: {'activation': 'identity', 'solver': 'adam', 'lr': 0.0001265971441831895, 'layer1': 149, 'layer2': 351, 'layer3': 269}. Best is trial 72 with value: 0.8879714231951876.
Staphylococcus_Aureus | DirectMulti | Optuna:  56%|█████▌    | 112/200 [3:58:11<2:03:01, 83.88s/it, best=0.888]Staphylococcus_Aureus | DirectMulti | Optuna:  56%|█████▌    | 112/200 [3:58:11<2:03:01, 83.88s/it, best=0.888][I 2026-02-28 18:29:01,192] Trial 116 finished with value: 0.8832850858285944 and parameters: {'activation': 'logistic', 'solver': 'adam', 'lr': 8.74433565446488e-05, 'layer1': 370, 'layer2': 405, 'layer3': 122}. Best is trial 84 with value: 0.8915097750553358.

Escherichia_Coli | Cefepime | Optuna:  58%|█████▊    | 117/200 [3:31:25<2:27:24, 106.56s/it, best=0.891][A
Escherichia_Coli | Cefepime | Optuna:  58%|█████▊    | 117/200 [3:31:25<2:27:24, 106.56s/it, best=0.891][A[I 2026-02-28 18:29:37,441] Trial 112 finished with value: 0.8823619079053865 and parameters: {'activation': 'identity', 'solver': 'adam', 'lr': 7.513526679065132e-05, 'layer1': 230, 'layer2': 339, 'layer3': 251}. Best is trial 72 with value: 0.8879714231951876.
Staphylococcus_Aureus | DirectMulti | Optuna:  56%|█████▋    | 113/200 [3:59:42<2:04:59, 86.20s/it, best=0.888]Staphylococcus_Aureus | DirectMulti | Optuna:  56%|█████▋    | 113/200 [3:59:42<2:04:59, 86.20s/it, best=0.888][I 2026-02-28 18:30:30,914] Trial 117 finished with value: 0.8910783342769438 and parameters: {'activation': 'relu', 'solver': 'adam', 'lr': 0.00011354847052440057, 'layer1': 452, 'layer2': 381, 'layer3': 181}. Best is trial 84 with value: 0.8915097750553358.

Escherichia_Coli | Cefepime | Optuna:  59%|█████▉    | 118/200 [3:32:55<2:18:43, 101.51s/it, best=0.891][A
Escherichia_Coli | Cefepime | Optuna:  59%|█████▉    | 118/200 [3:32:55<2:18:43, 101.51s/it, best=0.891][A[I 2026-02-28 18:30:53,855] Trial 113 finished with value: 0.8851981669510867 and parameters: {'activation': 'relu', 'solver': 'adam', 'lr': 0.00023058550053269038, 'layer1': 165, 'layer2': 363, 'layer3': 64}. Best is trial 72 with value: 0.8879714231951876.
Staphylococcus_Aureus | DirectMulti | Optuna:  57%|█████▋    | 114/200 [4:00:59<1:59:20, 83.27s/it, best=0.888]Staphylococcus_Aureus | DirectMulti | Optuna:  57%|█████▋    | 114/200 [4:00:59<1:59:20, 83.27s/it, best=0.888][I 2026-02-28 18:32:29,134] Trial 118 finished with value: 0.8875929819613766 and parameters: {'activation': 'relu', 'solver': 'adam', 'lr': 4.750554185622051e-05, 'layer1': 433, 'layer2': 401, 'layer3': 155}. Best is trial 84 with value: 0.8915097750553358.

Escherichia_Coli | Cefepime | Optuna:  60%|█████▉    | 119/200 [3:34:53<2:23:48, 106.52s/it, best=0.891][A
Escherichia_Coli | Cefepime | Optuna:  60%|█████▉    | 119/200 [3:34:53<2:23:48, 106.52s/it, best=0.891][A[I 2026-02-28 18:32:54,083] Trial 114 finished with value: 0.8823403342836146 and parameters: {'activation': 'logistic', 'solver': 'adam', 'lr': 0.0002843312447337888, 'layer1': 206, 'layer2': 459, 'layer3': 148}. Best is trial 72 with value: 0.8879714231951876.
Staphylococcus_Aureus | DirectMulti | Optuna:  57%|█████▊    | 115/200 [4:02:59<2:13:40, 94.36s/it, best=0.888]Staphylococcus_Aureus | DirectMulti | Optuna:  57%|█████▊    | 115/200 [4:02:59<2:13:40, 94.36s/it, best=0.888][I 2026-02-28 18:34:10,996] Trial 115 finished with value: 0.8853635661722402 and parameters: {'activation': 'identity', 'solver': 'adam', 'lr': 0.0005216093635468715, 'layer1': 192, 'layer2': 328, 'layer3': 162}. Best is trial 72 with value: 0.8879714231951876.
Staphylococcus_Aureus | DirectMulti | Optuna:  58%|█████▊    | 116/200 [4:04:16<2:04:46, 89.12s/it, best=0.888]Staphylococcus_Aureus | DirectMulti | Optuna:  58%|█████▊    | 116/200 [4:04:16<2:04:46, 89.12s/it, best=0.888][I 2026-02-28 18:35:20,731] Trial 119 finished with value: 0.7581859175634579 and parameters: {'activation': 'identity', 'solver': 'sgd', 'lr': 3.2084269626749286e-05, 'layer1': 450, 'layer2': 377, 'layer3': 181}. Best is trial 84 with value: 0.8915097750553358.

Escherichia_Coli | Cefepime | Optuna:  60%|██████    | 120/200 [3:37:45<2:48:03, 126.05s/it, best=0.891][A
Escherichia_Coli | Cefepime | Optuna:  60%|██████    | 120/200 [3:37:45<2:48:03, 126.05s/it, best=0.891][A[I 2026-02-28 18:35:53,368] Trial 116 finished with value: 0.8870174777981923 and parameters: {'activation': 'relu', 'solver': 'adam', 'lr': 0.00015430092124979342, 'layer1': 239, 'layer2': 392, 'layer3': 89}. Best is trial 72 with value: 0.8879714231951876.
Staphylococcus_Aureus | DirectMulti | Optuna:  58%|█████▊    | 117/200 [4:05:58<2:08:47, 93.10s/it, best=0.888]Staphylococcus_Aureus | DirectMulti | Optuna:  58%|█████▊    | 117/200 [4:05:58<2:08:47, 93.10s/it, best=0.888][I 2026-02-28 18:36:55,835] Trial 120 finished with value: 0.8888908002662804 and parameters: {'activation': 'relu', 'solver': 'adam', 'lr': 0.00011195622502327467, 'layer1': 463, 'layer2': 419, 'layer3': 212}. Best is trial 84 with value: 0.8915097750553358.

Escherichia_Coli | Cefepime | Optuna:  60%|██████    | 121/200 [3:39:20<2:33:44, 116.76s/it, best=0.891][A
Escherichia_Coli | Cefepime | Optuna:  60%|██████    | 121/200 [3:39:20<2:33:44, 116.76s/it, best=0.891][A[I 2026-02-28 18:37:50,640] Trial 117 finished with value: 0.8878656404811608 and parameters: {'activation': 'relu', 'solver': 'adam', 'lr': 0.00015374156697279704, 'layer1': 259, 'layer2': 397, 'layer3': 87}. Best is trial 72 with value: 0.8879714231951876.
