Klebsiella_Pneumoniae | LPS | Optuna:  68%|██████▊   | 135/200 [3:20:44<1:34:31, 87.25s/it, best=0.926]Klebsiella_Pneumoniae | LPS | Optuna:  68%|██████▊   | 135/200 [3:20:44<1:34:31, 87.25s/it, best=0.926][I 2026-02-28 12:08:30,478] Trial 108 finished with value: 0.886613223679125 and parameters: {'activation': 'identity', 'solver': 'adam', 'lr': 0.0001467571034830327, 'layer1': 161, 'layer2': 430, 'layer3': 376}. Best is trial 8 with value: 0.8879562150966016.
Staphylococcus_Aureus | LPS | Optuna:  55%|█████▍    | 109/200 [4:02:16<3:36:07, 142.50s/it, best=0.888]Staphylococcus_Aureus | LPS | Optuna:  55%|█████▍    | 109/200 [4:02:16<3:36:07, 142.50s/it, best=0.888][I 2026-02-28 12:09:44,605] Trial 175 finished with value: 0.8653955236425904 and parameters: {'activation': 'identity', 'solver': 'adam', 'lr': 0.00028524953591208056, 'layer1': 419, 'layer2': 259, 'layer3': 175}. Best is trial 155 with value: 0.8677633336625616.
Pseudomonas_Aeruginosa | DirectMulti | Optuna:  88%|████████▊ | 176/200 [5:13:30<36:55, 92.32s/it, best=0.868]Pseudomonas_Aeruginosa | DirectMulti | Optuna:  88%|████████▊ | 176/200 [5:13:30<36:55, 92.32s/it, best=0.868]/export/usuarios01/egarroyo/MALDI_for_AMR_prediction/venv/lib/python3.13/site-packages/sklearn/model_selection/_split.py:813: UserWarning: The least populated class in y has only 4 members, which is less than n_splits=5.
  warnings.warn(
[I 2026-02-28 12:09:45,491] Trial 135 finished with value: 0.9243231652748148 and parameters: {'activation': 'identity', 'solver': 'adam', 'lr': 0.00022343488889251269, 'layer1': 42, 'layer2': 439, 'layer3': 394}. Best is trial 71 with value: 0.9257111996592865.
Klebsiella_Pneumoniae | LPS | Optuna:  68%|██████▊   | 136/200 [3:22:01<1:29:43, 84.11s/it, best=0.926]Klebsiella_Pneumoniae | LPS | Optuna:  68%|██████▊   | 136/200 [3:22:01<1:29:43, 84.11s/it, best=0.926][I 2026-02-28 12:10:33,081] Trial 115 finished with value: 0.9136657705422417 and parameters: {'activation': 'relu', 'solver': 'adam', 'lr': 0.0003460708910692878, 'layer1': 330, 'layer2': 219, 'layer3': 145}. Best is trial 74 with value: 0.9166002918687234.

Escherichia_Coli | Piperacillin-Tazobactam | Optuna:  58%|█████▊    | 116/200 [4:06:25<3:07:02, 133.60s/it, best=0.917][A
Escherichia_Coli | Piperacillin-Tazobactam | Optuna:  58%|█████▊    | 116/200 [4:06:25<3:07:02, 133.60s/it, best=0.917][A[I 2026-02-28 12:11:05,670] Trial 136 finished with value: 0.923817386468673 and parameters: {'activation': 'identity', 'solver': 'adam', 'lr': 0.00016766446490248092, 'layer1': 66, 'layer2': 492, 'layer3': 375}. Best is trial 71 with value: 0.9257111996592865.
Klebsiella_Pneumoniae | LPS | Optuna:  68%|██████▊   | 137/200 [3:23:21<1:27:04, 82.93s/it, best=0.926]Klebsiella_Pneumoniae | LPS | Optuna:  68%|██████▊   | 137/200 [3:23:21<1:27:04, 82.93s/it, best=0.926][I 2026-02-28 12:11:16,218] Trial 176 finished with value: 0.8635996569936237 and parameters: {'activation': 'identity', 'solver': 'adam', 'lr': 0.00019750467600895003, 'layer1': 428, 'layer2': 366, 'layer3': 161}. Best is trial 155 with value: 0.8677633336625616.
Pseudomonas_Aeruginosa | DirectMulti | Optuna:  88%|████████▊ | 177/200 [5:15:02<35:18, 92.11s/it, best=0.868]Pseudomonas_Aeruginosa | DirectMulti | Optuna:  88%|████████▊ | 177/200 [5:15:02<35:18, 92.11s/it, best=0.868]/export/usuarios01/egarroyo/MALDI_for_AMR_prediction/venv/lib/python3.13/site-packages/sklearn/model_selection/_split.py:813: UserWarning: The least populated class in y has only 4 members, which is less than n_splits=5.
  warnings.warn(
[I 2026-02-28 12:12:00,983] Trial 109 finished with value: 0.8743199376888228 and parameters: {'activation': 'logistic', 'solver': 'adam', 'lr': 0.0001072019066756972, 'layer1': 167, 'layer2': 452, 'layer3': 373}. Best is trial 8 with value: 0.8879562150966016.
Staphylococcus_Aureus | LPS | Optuna:  55%|█████▌    | 110/200 [4:05:47<4:04:21, 162.90s/it, best=0.888]Staphylococcus_Aureus | LPS | Optuna:  55%|█████▌    | 110/200 [4:05:47<4:04:21, 162.90s/it, best=0.888][I 2026-02-28 12:12:29,307] Trial 137 finished with value: 0.9240742465735746 and parameters: {'activation': 'identity', 'solver': 'adam', 'lr': 0.0004101275947196868, 'layer1': 55, 'layer2': 454, 'layer3': 352}. Best is trial 71 with value: 0.9257111996592865.
Klebsiella_Pneumoniae | LPS | Optuna:  69%|██████▉   | 138/200 [3:24:45<1:25:54, 83.14s/it, best=0.926]Klebsiella_Pneumoniae | LPS | Optuna:  69%|██████▉   | 138/200 [3:24:45<1:25:54, 83.14s/it, best=0.926][I 2026-02-28 12:12:42,079] Trial 116 finished with value: 0.9148512172407542 and parameters: {'activation': 'relu', 'solver': 'adam', 'lr': 0.00014762112694663537, 'layer1': 358, 'layer2': 362, 'layer3': 110}. Best is trial 74 with value: 0.9166002918687234.

Escherichia_Coli | Piperacillin-Tazobactam | Optuna:  58%|█████▊    | 117/200 [4:08:34<3:02:54, 132.22s/it, best=0.917][A
Escherichia_Coli | Piperacillin-Tazobactam | Optuna:  58%|█████▊    | 117/200 [4:08:34<3:02:54, 132.22s/it, best=0.917][A[I 2026-02-28 12:12:44,491] Trial 177 finished with value: 0.8633794552709991 and parameters: {'activation': 'identity', 'solver': 'adam', 'lr': 0.00023584553543358616, 'layer1': 409, 'layer2': 304, 'layer3': 191}. Best is trial 155 with value: 0.8677633336625616.
Pseudomonas_Aeruginosa | DirectMulti | Optuna:  89%|████████▉ | 178/200 [5:16:30<33:21, 90.96s/it, best=0.868]Pseudomonas_Aeruginosa | DirectMulti | Optuna:  89%|████████▉ | 178/200 [5:16:30<33:21, 90.96s/it, best=0.868]/export/usuarios01/egarroyo/MALDI_for_AMR_prediction/venv/lib/python3.13/site-packages/sklearn/model_selection/_split.py:813: UserWarning: The least populated class in y has only 4 members, which is less than n_splits=5.
  warnings.warn(
[I 2026-02-28 12:13:54,698] Trial 110 finished with value: 0.8865186662572887 and parameters: {'activation': 'identity', 'solver': 'adam', 'lr': 0.00015021564001435877, 'layer1': 116, 'layer2': 420, 'layer3': 353}. Best is trial 8 with value: 0.8879562150966016.
Staphylococcus_Aureus | LPS | Optuna:  56%|█████▌    | 111/200 [4:07:41<3:39:44, 148.15s/it, best=0.888]Staphylococcus_Aureus | LPS | Optuna:  56%|█████▌    | 111/200 [4:07:41<3:39:44, 148.15s/it, best=0.888][I 2026-02-28 12:14:24,204] Trial 138 finished with value: 0.9221884131196957 and parameters: {'activation': 'logistic', 'solver': 'adam', 'lr': 0.00026521935167499443, 'layer1': 25, 'layer2': 470, 'layer3': 366}. Best is trial 71 with value: 0.9257111996592865.
Klebsiella_Pneumoniae | LPS | Optuna:  70%|██████▉   | 139/200 [3:26:40<1:34:12, 92.67s/it, best=0.926]Klebsiella_Pneumoniae | LPS | Optuna:  70%|██████▉   | 139/200 [3:26:40<1:34:12, 92.67s/it, best=0.926][I 2026-02-28 12:14:38,255] Trial 178 finished with value: 0.8639885145575977 and parameters: {'activation': 'identity', 'solver': 'adam', 'lr': 0.00010773211739902285, 'layer1': 372, 'layer2': 345, 'layer3': 220}. Best is trial 155 with value: 0.8677633336625616.
Pseudomonas_Aeruginosa | DirectMulti | Optuna:  90%|████████▉ | 179/200 [5:18:24<34:13, 97.80s/it, best=0.868]Pseudomonas_Aeruginosa | DirectMulti | Optuna:  90%|████████▉ | 179/200 [5:18:24<34:13, 97.80s/it, best=0.868]/export/usuarios01/egarroyo/MALDI_for_AMR_prediction/venv/lib/python3.13/site-packages/sklearn/model_selection/_split.py:813: UserWarning: The least populated class in y has only 4 members, which is less than n_splits=5.
  warnings.warn(
[I 2026-02-28 12:15:00,240] Trial 117 finished with value: 0.9121885563314873 and parameters: {'activation': 'relu', 'solver': 'adam', 'lr': 0.00045064902302722614, 'layer1': 311, 'layer2': 408, 'layer3': 191}. Best is trial 74 with value: 0.9166002918687234.

Escherichia_Coli | Piperacillin-Tazobactam | Optuna:  59%|█████▉    | 118/200 [4:10:52<3:03:08, 134.00s/it, best=0.917][A
Escherichia_Coli | Piperacillin-Tazobactam | Optuna:  59%|█████▉    | 118/200 [4:10:52<3:03:08, 134.00s/it, best=0.917][A[I 2026-02-28 12:15:47,278] Trial 139 finished with value: 0.9246392298454547 and parameters: {'activation': 'identity', 'solver': 'adam', 'lr': 0.0005231564779708213, 'layer1': 44, 'layer2': 433, 'layer3': 48}. Best is trial 71 with value: 0.9257111996592865.
Klebsiella_Pneumoniae | LPS | Optuna:  70%|███████   | 140/200 [3:28:03<1:29:47, 89.79s/it, best=0.926]Klebsiella_Pneumoniae | LPS | Optuna:  70%|███████   | 140/200 [3:28:03<1:29:47, 89.79s/it, best=0.926][I 2026-02-28 12:16:07,591] Trial 179 finished with value: 0.8640522594934097 and parameters: {'activation': 'identity', 'solver': 'adam', 'lr': 0.0001368019551894786, 'layer1': 440, 'layer2': 276, 'layer3': 148}. Best is trial 155 with value: 0.8677633336625616.
Pseudomonas_Aeruginosa | DirectMulti | Optuna:  90%|█████████ | 180/200 [5:19:53<31:45, 95.26s/it, best=0.868]Pseudomonas_Aeruginosa | DirectMulti | Optuna:  90%|█████████ | 180/200 [5:19:53<31:45, 95.26s/it, best=0.868]/export/usuarios01/egarroyo/MALDI_for_AMR_prediction/venv/lib/python3.13/site-packages/sklearn/model_selection/_split.py:813: UserWarning: The least populated class in y has only 4 members, which is less than n_splits=5.
  warnings.warn(
[I 2026-02-28 12:16:19,003] Trial 140 finished with value: 0.8703835562403125 and parameters: {'activation': 'identity', 'solver': 'sgd', 'lr': 0.0003455964497705077, 'layer1': 45, 'layer2': 433, 'layer3': 312}. Best is trial 71 with value: 0.9257111996592865.
Klebsiella_Pneumoniae | LPS | Optuna:  70%|███████   | 141/200 [3:28:35<1:11:09, 72.37s/it, best=0.926]Klebsiella_Pneumoniae | LPS | Optuna:  70%|███████   | 141/200 [3:28:35<1:11:09, 72.37s/it, best=0.926][I 2026-02-28 12:16:22,719] Trial 111 finished with value: 0.885429943994996 and parameters: {'activation': 'identity', 'solver': 'adam', 'lr': 7.90288099640716e-05, 'layer1': 116, 'layer2': 430, 'layer3': 350}. Best is trial 8 with value: 0.8879562150966016.
Staphylococcus_Aureus | LPS | Optuna:  56%|█████▌    | 112/200 [4:10:09<3:37:13, 148.11s/it, best=0.888]Staphylococcus_Aureus | LPS | Optuna:  56%|█████▌    | 112/200 [4:10:09<3:37:13, 148.11s/it, best=0.888][I 2026-02-28 12:17:10,604] Trial 118 finished with value: 0.9140781478039909 and parameters: {'activation': 'relu', 'solver': 'adam', 'lr': 0.00021236276783280402, 'layer1': 343, 'layer2': 314, 'layer3': 171}. Best is trial 74 with value: 0.9166002918687234.

Escherichia_Coli | Piperacillin-Tazobactam | Optuna:  60%|█████▉    | 119/200 [4:13:03<2:59:25, 132.91s/it, best=0.917][A
Escherichia_Coli | Piperacillin-Tazobactam | Optuna:  60%|█████▉    | 119/200 [4:13:03<2:59:25, 132.91s/it, best=0.917][A[I 2026-02-28 12:17:25,195] Trial 141 finished with value: 0.9250028387220421 and parameters: {'activation': 'identity', 'solver': 'adam', 'lr': 0.0004952738902592334, 'layer1': 34, 'layer2': 457, 'layer3': 48}. Best is trial 71 with value: 0.9257111996592865.
Klebsiella_Pneumoniae | LPS | Optuna:  71%|███████   | 142/200 [3:29:41<1:08:10, 70.52s/it, best=0.926]Klebsiella_Pneumoniae | LPS | Optuna:  71%|███████   | 142/200 [3:29:41<1:08:10, 70.52s/it, best=0.926][I 2026-02-28 12:17:42,695] Trial 180 finished with value: 0.8636101387868855 and parameters: {'activation': 'identity', 'solver': 'adam', 'lr': 0.0006245270613973621, 'layer1': 385, 'layer2': 321, 'layer3': 201}. Best is trial 155 with value: 0.8677633336625616.
Pseudomonas_Aeruginosa | DirectMulti | Optuna:  90%|█████████ | 181/200 [5:21:28<30:09, 95.21s/it, best=0.868]Pseudomonas_Aeruginosa | DirectMulti | Optuna:  90%|█████████ | 181/200 [5:21:28<30:09, 95.21s/it, best=0.868]/export/usuarios01/egarroyo/MALDI_for_AMR_prediction/venv/lib/python3.13/site-packages/sklearn/model_selection/_split.py:813: UserWarning: The least populated class in y has only 4 members, which is less than n_splits=5.
  warnings.warn(
[I 2026-02-28 12:17:55,320] Trial 119 finished with value: 0.8965621130822248 and parameters: {'activation': 'relu', 'solver': 'sgd', 'lr': 0.00016525510234273393, 'layer1': 273, 'layer2': 206, 'layer3': 236}. Best is trial 74 with value: 0.9166002918687234.

Escherichia_Coli | Piperacillin-Tazobactam | Optuna:  60%|██████    | 120/200 [4:13:47<2:21:56, 106.45s/it, best=0.917][A
Escherichia_Coli | Piperacillin-Tazobactam | Optuna:  60%|██████    | 120/200 [4:13:47<2:21:56, 106.45s/it, best=0.917][A[I 2026-02-28 12:18:04,117] Trial 112 finished with value: 0.8855678958031046 and parameters: {'activation': 'identity', 'solver': 'adam', 'lr': 0.00016624800411755585, 'layer1': 63, 'layer2': 443, 'layer3': 389}. Best is trial 8 with value: 0.8879562150966016.
Staphylococcus_Aureus | LPS | Optuna:  56%|█████▋    | 113/200 [4:11:50<3:14:26, 134.09s/it, best=0.888]Staphylococcus_Aureus | LPS | Optuna:  56%|█████▋    | 113/200 [4:11:50<3:14:26, 134.09s/it, best=0.888][I 2026-02-28 12:18:37,182] Trial 142 finished with value: 0.9246268937758337 and parameters: {'activation': 'identity', 'solver': 'adam', 'lr': 0.0005401930325841619, 'layer1': 61, 'layer2': 466, 'layer3': 25}. Best is trial 71 with value: 0.9257111996592865.
Klebsiella_Pneumoniae | LPS | Optuna:  72%|███████▏  | 143/200 [3:30:53<1:07:24, 70.96s/it, best=0.926]Klebsiella_Pneumoniae | LPS | Optuna:  72%|███████▏  | 143/200 [3:30:53<1:07:24, 70.96s/it, best=0.926][I 2026-02-28 12:19:18,939] Trial 181 finished with value: 0.8639305645892679 and parameters: {'activation': 'identity', 'solver': 'adam', 'lr': 0.00016504273493495383, 'layer1': 399, 'layer2': 286, 'layer3': 173}. Best is trial 155 with value: 0.8677633336625616.
Pseudomonas_Aeruginosa | DirectMulti | Optuna:  91%|█████████ | 182/200 [5:23:05<28:39, 95.52s/it, best=0.868]Pseudomonas_Aeruginosa | DirectMulti | Optuna:  91%|█████████ | 182/200 [5:23:05<28:39, 95.52s/it, best=0.868]/export/usuarios01/egarroyo/MALDI_for_AMR_prediction/venv/lib/python3.13/site-packages/sklearn/model_selection/_split.py:813: UserWarning: The least populated class in y has only 4 members, which is less than n_splits=5.
  warnings.warn(
[I 2026-02-28 12:19:32,412] Trial 120 finished with value: 0.9133941659269864 and parameters: {'activation': 'relu', 'solver': 'adam', 'lr': 0.0005986334868311752, 'layer1': 321, 'layer2': 244, 'layer3': 48}. Best is trial 74 with value: 0.9166002918687234.

Escherichia_Coli | Piperacillin-Tazobactam | Optuna:  60%|██████    | 121/200 [4:15:25<2:16:27, 103.64s/it, best=0.917][A
Escherichia_Coli | Piperacillin-Tazobactam | Optuna:  60%|██████    | 121/200 [4:15:25<2:16:27, 103.64s/it, best=0.917][A[I 2026-02-28 12:19:46,008] Trial 113 finished with value: 0.8843880924915117 and parameters: {'activation': 'identity', 'solver': 'adam', 'lr': 0.00021044678270166063, 'layer1': 142, 'layer2': 482, 'layer3': 410}. Best is trial 8 with value: 0.8879562150966016.
Staphylococcus_Aureus | LPS | Optuna:  57%|█████▋    | 114/200 [4:13:32<2:58:21, 124.43s/it, best=0.888]Staphylococcus_Aureus | LPS | Optuna:  57%|█████▋    | 114/200 [4:13:32<2:58:21, 124.43s/it, best=0.888][I 2026-02-28 12:19:46,935] Trial 143 finished with value: 0.9234800822236474 and parameters: {'activation': 'identity', 'solver': 'adam', 'lr': 0.0004925096139588379, 'layer1': 55, 'layer2': 462, 'layer3': 25}. Best is trial 71 with value: 0.9257111996592865.
Klebsiella_Pneumoniae | LPS | Optuna:  72%|███████▏  | 144/200 [3:32:02<1:05:53, 70.60s/it, best=0.926]Klebsiella_Pneumoniae | LPS | Optuna:  72%|███████▏  | 144/200 [3:32:02<1:05:53, 70.60s/it, best=0.926][I 2026-02-28 12:20:40,021] Trial 144 finished with value: 0.9236804336689503 and parameters: {'activation': 'identity', 'solver': 'adam', 'lr': 0.0015547853735732604, 'layer1': 37, 'layer2': 477, 'layer3': 35}. Best is trial 71 with value: 0.9257111996592865.
Klebsiella_Pneumoniae | LPS | Optuna:  72%|███████▎  | 145/200 [3:32:56<59:53, 65.34s/it, best=0.926]  Klebsiella_Pneumoniae | LPS | Optuna:  72%|███████▎  | 145/200 [3:32:56<59:53, 65.34s/it, best=0.926][I 2026-02-28 12:20:59,013] Trial 182 finished with value: 0.8640102921679782 and parameters: {'activation': 'identity', 'solver': 'adam', 'lr': 8.419758705875006e-05, 'layer1': 418, 'layer2': 301, 'layer3': 136}. Best is trial 155 with value: 0.8677633336625616.
Pseudomonas_Aeruginosa | DirectMulti | Optuna:  92%|█████████▏| 183/200 [5:24:45<27:27, 96.89s/it, best=0.868]Pseudomonas_Aeruginosa | DirectMulti | Optuna:  92%|█████████▏| 183/200 [5:24:45<27:27, 96.89s/it, best=0.868]/export/usuarios01/egarroyo/MALDI_for_AMR_prediction/venv/lib/python3.13/site-packages/sklearn/model_selection/_split.py:813: UserWarning: The least populated class in y has only 4 members, which is less than n_splits=5.
  warnings.warn(
[I 2026-02-28 12:21:17,685] Trial 121 finished with value: 0.9109305991442938 and parameters: {'activation': 'tanh', 'solver': 'adam', 'lr': 0.00029592675542842176, 'layer1': 454, 'layer2': 348, 'layer3': 68}. Best is trial 74 with value: 0.9166002918687234.

Escherichia_Coli | Piperacillin-Tazobactam | Optuna:  61%|██████    | 122/200 [4:17:10<2:15:22, 104.13s/it, best=0.917][A
Escherichia_Coli | Piperacillin-Tazobactam | Optuna:  61%|██████    | 122/200 [4:17:10<2:15:22, 104.13s/it, best=0.917][A[I 2026-02-28 12:21:26,920] Trial 114 finished with value: 0.8824062651130926 and parameters: {'activation': 'identity', 'solver': 'adam', 'lr': 0.00013267866917814484, 'layer1': 73, 'layer2': 426, 'layer3': 378}. Best is trial 8 with value: 0.8879562150966016.
Staphylococcus_Aureus | LPS | Optuna:  57%|█████▊    | 115/200 [4:15:13<2:46:17, 117.38s/it, best=0.888]Staphylococcus_Aureus | LPS | Optuna:  57%|█████▊    | 115/200 [4:15:13<2:46:17, 117.38s/it, best=0.888][I 2026-02-28 12:21:45,561] Trial 145 finished with value: 0.9238395164326271 and parameters: {'activation': 'identity', 'solver': 'adam', 'lr': 0.0010118183653702393, 'layer1': 67, 'layer2': 461, 'layer3': 49}. Best is trial 71 with value: 0.9257111996592865.
Klebsiella_Pneumoniae | LPS | Optuna:  73%|███████▎  | 146/200 [3:34:01<58:51, 65.40s/it, best=0.926]Klebsiella_Pneumoniae | LPS | Optuna:  73%|███████▎  | 146/200 [3:34:01<58:51, 65.40s/it, best=0.926][I 2026-02-28 12:23:00,353] Trial 146 finished with value: 0.9236882089964483 and parameters: {'activation': 'identity', 'solver': 'adam', 'lr': 0.0007698206435309032, 'layer1': 79, 'layer2': 445, 'layer3': 10}. Best is trial 71 with value: 0.9257111996592865.
Klebsiella_Pneumoniae | LPS | Optuna:  74%|███████▎  | 147/200 [3:35:16<1:00:15, 68.22s/it, best=0.926]Klebsiella_Pneumoniae | LPS | Optuna:  74%|███████▎  | 147/200 [3:35:16<1:00:15, 68.22s/it, best=0.926][I 2026-02-28 12:23:24,179] Trial 115 finished with value: 0.8846155181023765 and parameters: {'activation': 'identity', 'solver': 'adam', 'lr': 0.00038656903216262333, 'layer1': 98, 'layer2': 417, 'layer3': 430}. Best is trial 8 with value: 0.8879562150966016.
Staphylococcus_Aureus | LPS | Optuna:  58%|█████▊    | 116/200 [4:17:10<2:44:16, 117.34s/it, best=0.888]Staphylococcus_Aureus | LPS | Optuna:  58%|█████▊    | 116/200 [4:17:10<2:44:16, 117.34s/it, best=0.888][I 2026-02-28 12:23:30,978] Trial 183 finished with value: 0.8668775668958453 and parameters: {'activation': 'identity', 'solver': 'adam', 'lr': 3.97538584871565e-05, 'layer1': 438, 'layer2': 330, 'layer3': 186}. Best is trial 155 with value: 0.8677633336625616.
Pseudomonas_Aeruginosa | DirectMulti | Optuna:  92%|█████████▏| 184/200 [5:27:17<30:14, 113.41s/it, best=0.868]Pseudomonas_Aeruginosa | DirectMulti | Optuna:  92%|█████████▏| 184/200 [5:27:17<30:14, 113.41s/it, best=0.868]/export/usuarios01/egarroyo/MALDI_for_AMR_prediction/venv/lib/python3.13/site-packages/sklearn/model_selection/_split.py:813: UserWarning: The least populated class in y has only 4 members, which is less than n_splits=5.
  warnings.warn(
[I 2026-02-28 12:23:40,040] Trial 122 finished with value: 0.9146638804834707 and parameters: {'activation': 'relu', 'solver': 'adam', 'lr': 0.00011813932296229413, 'layer1': 333, 'layer2': 333, 'layer3': 342}. Best is trial 74 with value: 0.9166002918687234.

Escherichia_Coli | Piperacillin-Tazobactam | Optuna:  62%|██████▏   | 123/200 [4:19:32<2:28:21, 115.60s/it, best=0.917][A
Escherichia_Coli | Piperacillin-Tazobactam | Optuna:  62%|██████▏   | 123/200 [4:19:32<2:28:21, 115.60s/it, best=0.917][A[I 2026-02-28 12:23:47,865] Trial 147 finished with value: 0.9213396252673076 and parameters: {'activation': 'identity', 'solver': 'adam', 'lr': 0.0005213036524688995, 'layer1': 47, 'layer2': 421, 'layer3': 42}. Best is trial 71 with value: 0.9257111996592865.
Klebsiella_Pneumoniae | LPS | Optuna:  74%|███████▍  | 148/200 [3:36:03<53:44, 62.01s/it, best=0.926]  Klebsiella_Pneumoniae | LPS | Optuna:  74%|███████▍  | 148/200 [3:36:03<53:44, 62.01s/it, best=0.926][I 2026-02-28 12:24:14,469] Trial 116 finished with value: 0.8031304917249379 and parameters: {'activation': 'identity', 'solver': 'sgd', 'lr': 0.0009028365494966106, 'layer1': 279, 'layer2': 378, 'layer3': 451}. Best is trial 8 with value: 0.8879562150966016.
Staphylococcus_Aureus | LPS | Optuna:  58%|█████▊    | 117/200 [4:18:00<2:14:29, 97.23s/it, best=0.888] Staphylococcus_Aureus | LPS | Optuna:  58%|█████▊    | 117/200 [4:18:00<2:14:29, 97.23s/it, best=0.888][I 2026-02-28 12:25:02,993] Trial 148 finished with value: 0.9244055749070725 and parameters: {'activation': 'identity', 'solver': 'adam', 'lr': 0.0003666989369590899, 'layer1': 23, 'layer2': 481, 'layer3': 62}. Best is trial 71 with value: 0.9257111996592865.
