Klebsiella_Pneumoniae | Imipenem | Optuna:  94%|█████████▍| 189/200 [2:23:07<08:11, 44.69s/it, best=0.986][A[I 2026-02-28 05:52:26,649] Trial 189 finished with value: 0.9826571531160605 and parameters: {'activation': 'relu', 'solver': 'adam', 'lr': 0.0068550904527773255, 'layer1': 91, 'layer2': 224, 'layer3': 423}. Best is trial 13 with value: 0.9860492846658779.

Klebsiella_Pneumoniae | Imipenem | Optuna:  95%|█████████▌| 190/200 [2:23:39<06:46, 40.69s/it, best=0.986][A
Klebsiella_Pneumoniae | Imipenem | Optuna:  95%|█████████▌| 190/200 [2:23:39<06:46, 40.69s/it, best=0.986][A[I 2026-02-28 05:53:08,569] Trial 157 finished with value: 0.8875428765174694 and parameters: {'activation': 'tanh', 'solver': 'adam', 'lr': 0.00011148578892274783, 'layer1': 457, 'layer2': 49, 'layer3': 144}. Best is trial 137 with value: 0.8979080367540411.

Escherichia_Coli | Ceftriaxone | Optuna:  79%|███████▉  | 158/200 [6:43:10<1:48:43, 155.31s/it, best=0.898][A
Escherichia_Coli | Ceftriaxone | Optuna:  79%|███████▉  | 158/200 [6:43:10<1:48:43, 155.31s/it, best=0.898][A[I 2026-02-28 05:53:11,062] Trial 190 finished with value: 0.983637081256328 and parameters: {'activation': 'relu', 'solver': 'adam', 'lr': 0.006269659364565481, 'layer1': 115, 'layer2': 231, 'layer3': 432}. Best is trial 13 with value: 0.9860492846658779.

Klebsiella_Pneumoniae | Imipenem | Optuna:  96%|█████████▌| 191/200 [2:24:23<06:16, 41.81s/it, best=0.986][A
Klebsiella_Pneumoniae | Imipenem | Optuna:  96%|█████████▌| 191/200 [2:24:23<06:16, 41.81s/it, best=0.986][A[I 2026-02-28 05:53:15,205] Trial 117 finished with value: 0.8952023247890004 and parameters: {'activation': 'tanh', 'solver': 'sgd', 'lr': 0.00017634354027365944, 'layer1': 411, 'layer2': 428, 'layer3': 147}. Best is trial 77 with value: 0.9283869597728589.

Staphylococcus_Aureus | Fusidic acid | Optuna:  59%|█████▉    | 118/200 [3:12:24<2:05:05, 91.53s/it, best=0.928][A
Staphylococcus_Aureus | Fusidic acid | Optuna:  59%|█████▉    | 118/200 [3:12:24<2:05:05, 91.53s/it, best=0.928][A[I 2026-02-28 05:53:33,279] Trial 155 finished with value: 0.8667833054425204 and parameters: {'activation': 'identity', 'solver': 'adam', 'lr': 0.0008975064669483947, 'layer1': 378, 'layer2': 342, 'layer3': 466}. Best is trial 140 with value: 0.8705750568176336.
Pseudomonas_Aeruginosa | LPS | Optuna:  78%|███████▊  | 156/200 [3:48:35<1:11:14, 97.15s/it, best=0.871]Pseudomonas_Aeruginosa | LPS | Optuna:  78%|███████▊  | 156/200 [3:48:35<1:11:14, 97.15s/it, best=0.871]/export/usuarios01/egarroyo/MALDI_for_AMR_prediction/venv/lib/python3.13/site-packages/sklearn/model_selection/_split.py:813: UserWarning: The least populated class in y has only 4 members, which is less than n_splits=5.
  warnings.warn(
[I 2026-02-28 05:53:49,088] Trial 191 finished with value: 0.9826556815912364 and parameters: {'activation': 'relu', 'solver': 'adam', 'lr': 0.004596208627831821, 'layer1': 83, 'layer2': 260, 'layer3': 447}. Best is trial 13 with value: 0.9860492846658779.

Klebsiella_Pneumoniae | Imipenem | Optuna:  96%|█████████▌| 192/200 [2:25:01<05:25, 40.67s/it, best=0.986][A
Klebsiella_Pneumoniae | Imipenem | Optuna:  96%|█████████▌| 192/200 [2:25:01<05:25, 40.67s/it, best=0.986][A[I 2026-02-28 05:54:28,011] Trial 192 finished with value: 0.9823564641501271 and parameters: {'activation': 'relu', 'solver': 'adam', 'lr': 0.005082392963645855, 'layer1': 73, 'layer2': 229, 'layer3': 446}. Best is trial 13 with value: 0.9860492846658779.

Klebsiella_Pneumoniae | Imipenem | Optuna:  96%|█████████▋| 193/200 [2:25:40<04:41, 40.15s/it, best=0.986][A
Klebsiella_Pneumoniae | Imipenem | Optuna:  96%|█████████▋| 193/200 [2:25:40<04:41, 40.15s/it, best=0.986][A[I 2026-02-28 05:54:40,426] Trial 156 finished with value: 0.8641770336717831 and parameters: {'activation': 'identity', 'solver': 'adam', 'lr': 0.0008449181202624614, 'layer1': 50, 'layer2': 339, 'layer3': 444}. Best is trial 140 with value: 0.8705750568176336.
Pseudomonas_Aeruginosa | LPS | Optuna:  78%|███████▊  | 157/200 [3:49:42<1:03:10, 88.15s/it, best=0.871]Pseudomonas_Aeruginosa | LPS | Optuna:  78%|███████▊  | 157/200 [3:49:42<1:03:10, 88.15s/it, best=0.871]/export/usuarios01/egarroyo/MALDI_for_AMR_prediction/venv/lib/python3.13/site-packages/sklearn/model_selection/_split.py:813: UserWarning: The least populated class in y has only 4 members, which is less than n_splits=5.
  warnings.warn(
[I 2026-02-28 05:54:48,614] Trial 118 finished with value: 0.9264690442920841 and parameters: {'activation': 'identity', 'solver': 'adam', 'lr': 0.0003192090872634381, 'layer1': 436, 'layer2': 108, 'layer3': 38}. Best is trial 77 with value: 0.9283869597728589.

Staphylococcus_Aureus | Fusidic acid | Optuna:  60%|█████▉    | 119/200 [3:13:57<2:04:19, 92.10s/it, best=0.928][A
Staphylococcus_Aureus | Fusidic acid | Optuna:  60%|█████▉    | 119/200 [3:13:57<2:04:19, 92.10s/it, best=0.928][A[I 2026-02-28 05:55:09,122] Trial 193 finished with value: 0.98298984779145 and parameters: {'activation': 'relu', 'solver': 'adam', 'lr': 0.0037606805182812553, 'layer1': 95, 'layer2': 216, 'layer3': 426}. Best is trial 13 with value: 0.9860492846658779.

Klebsiella_Pneumoniae | Imipenem | Optuna:  97%|█████████▋| 194/200 [2:26:21<04:02, 40.44s/it, best=0.986][A
Klebsiella_Pneumoniae | Imipenem | Optuna:  97%|█████████▋| 194/200 [2:26:21<04:02, 40.44s/it, best=0.986][A[I 2026-02-28 05:55:53,720] Trial 194 finished with value: 0.9839569633597328 and parameters: {'activation': 'relu', 'solver': 'adam', 'lr': 0.003426802277280891, 'layer1': 108, 'layer2': 254, 'layer3': 420}. Best is trial 13 with value: 0.9860492846658779.

Klebsiella_Pneumoniae | Imipenem | Optuna:  98%|█████████▊| 195/200 [2:27:06<03:28, 41.69s/it, best=0.986][A
Klebsiella_Pneumoniae | Imipenem | Optuna:  98%|█████████▊| 195/200 [2:27:06<03:28, 41.69s/it, best=0.986][A[I 2026-02-28 05:56:07,737] Trial 158 finished with value: 0.8973934328428314 and parameters: {'activation': 'relu', 'solver': 'adam', 'lr': 4.929526596283103e-05, 'layer1': 489, 'layer2': 132, 'layer3': 44}. Best is trial 137 with value: 0.8979080367540411.

Escherichia_Coli | Ceftriaxone | Optuna:  80%|███████▉  | 159/200 [6:46:09<1:51:01, 162.47s/it, best=0.898][A
Escherichia_Coli | Ceftriaxone | Optuna:  80%|███████▉  | 159/200 [6:46:09<1:51:01, 162.47s/it, best=0.898][A[I 2026-02-28 05:56:13,742] Trial 195 finished with value: 0.9800270054346416 and parameters: {'activation': 'relu', 'solver': 'sgd', 'lr': 0.0027958634334831088, 'layer1': 77, 'layer2': 241, 'layer3': 401}. Best is trial 13 with value: 0.9860492846658779.

Klebsiella_Pneumoniae | Imipenem | Optuna:  98%|█████████▊| 196/200 [2:27:26<02:20, 35.19s/it, best=0.986][A
Klebsiella_Pneumoniae | Imipenem | Optuna:  98%|█████████▊| 196/200 [2:27:26<02:20, 35.19s/it, best=0.986][A[I 2026-02-28 05:56:16,828] Trial 119 finished with value: 0.9204794923134532 and parameters: {'activation': 'relu', 'solver': 'adam', 'lr': 9.615236134484799e-05, 'layer1': 397, 'layer2': 479, 'layer3': 21}. Best is trial 77 with value: 0.9283869597728589.

Staphylococcus_Aureus | Fusidic acid | Optuna:  60%|██████    | 120/200 [3:15:26<2:01:14, 90.93s/it, best=0.928][A
Staphylococcus_Aureus | Fusidic acid | Optuna:  60%|██████    | 120/200 [3:15:26<2:01:14, 90.93s/it, best=0.928][A[I 2026-02-28 05:56:30,916] Trial 157 finished with value: 0.8627976639236353 and parameters: {'activation': 'identity', 'solver': 'adam', 'lr': 0.0006503905662852615, 'layer1': 380, 'layer2': 354, 'layer3': 467}. Best is trial 140 with value: 0.8705750568176336.
Pseudomonas_Aeruginosa | LPS | Optuna:  79%|███████▉  | 158/200 [3:51:32<1:06:23, 94.85s/it, best=0.871]Pseudomonas_Aeruginosa | LPS | Optuna:  79%|███████▉  | 158/200 [3:51:32<1:06:23, 94.85s/it, best=0.871]/export/usuarios01/egarroyo/MALDI_for_AMR_prediction/venv/lib/python3.13/site-packages/sklearn/model_selection/_split.py:813: UserWarning: The least populated class in y has only 4 members, which is less than n_splits=5.
  warnings.warn(
[I 2026-02-28 05:56:46,279] Trial 196 finished with value: 0.9826556815912362 and parameters: {'activation': 'tanh', 'solver': 'adam', 'lr': 0.005459050280174711, 'layer1': 64, 'layer2': 212, 'layer3': 438}. Best is trial 13 with value: 0.9860492846658779.

Klebsiella_Pneumoniae | Imipenem | Optuna:  98%|█████████▊| 197/200 [2:27:58<01:43, 34.39s/it, best=0.986][A
Klebsiella_Pneumoniae | Imipenem | Optuna:  98%|█████████▊| 197/200 [2:27:58<01:43, 34.39s/it, best=0.986][A[I 2026-02-28 05:57:34,823] Trial 197 finished with value: 0.9840318204139595 and parameters: {'activation': 'relu', 'solver': 'adam', 'lr': 0.0009995590731899145, 'layer1': 165, 'layer2': 377, 'layer3': 456}. Best is trial 13 with value: 0.9860492846658779.

Klebsiella_Pneumoniae | Imipenem | Optuna:  99%|█████████▉| 198/200 [2:28:47<01:17, 38.64s/it, best=0.986][A
Klebsiella_Pneumoniae | Imipenem | Optuna:  99%|█████████▉| 198/200 [2:28:47<01:17, 38.64s/it, best=0.986][A[I 2026-02-28 05:57:45,728] Trial 120 finished with value: 0.9259668217833934 and parameters: {'activation': 'identity', 'solver': 'adam', 'lr': 0.00021196998324159085, 'layer1': 423, 'layer2': 129, 'layer3': 73}. Best is trial 77 with value: 0.9283869597728589.

Staphylococcus_Aureus | Fusidic acid | Optuna:  60%|██████    | 121/200 [3:16:54<1:58:55, 90.32s/it, best=0.928][A
Staphylococcus_Aureus | Fusidic acid | Optuna:  60%|██████    | 121/200 [3:16:54<1:58:55, 90.32s/it, best=0.928][A[I 2026-02-28 05:57:47,652] Trial 158 finished with value: 0.8570653819233683 and parameters: {'activation': 'tanh', 'solver': 'adam', 'lr': 0.0002451424730303536, 'layer1': 406, 'layer2': 477, 'layer3': 456}. Best is trial 140 with value: 0.8705750568176336.
Pseudomonas_Aeruginosa | LPS | Optuna:  80%|███████▉  | 159/200 [3:52:49<1:01:06, 89.42s/it, best=0.871]Pseudomonas_Aeruginosa | LPS | Optuna:  80%|███████▉  | 159/200 [3:52:49<1:01:06, 89.42s/it, best=0.871]/export/usuarios01/egarroyo/MALDI_for_AMR_prediction/venv/lib/python3.13/site-packages/sklearn/model_selection/_split.py:813: UserWarning: The least populated class in y has only 4 members, which is less than n_splits=5.
  warnings.warn(
[I 2026-02-28 05:58:25,267] Trial 198 finished with value: 0.984326270952112 and parameters: {'activation': 'relu', 'solver': 'adam', 'lr': 0.003334327137632323, 'layer1': 95, 'layer2': 222, 'layer3': 414}. Best is trial 13 with value: 0.9860492846658779.

Klebsiella_Pneumoniae | Imipenem | Optuna: 100%|█████████▉| 199/200 [2:29:37<00:42, 42.18s/it, best=0.986][A
Klebsiella_Pneumoniae | Imipenem | Optuna: 100%|█████████▉| 199/200 [2:29:37<00:42, 42.18s/it, best=0.986][A[I 2026-02-28 05:59:11,255] Trial 199 finished with value: 0.9831298338507072 and parameters: {'activation': 'relu', 'solver': 'adam', 'lr': 0.0016295016052837142, 'layer1': 139, 'layer2': 206, 'layer3': 200}. Best is trial 13 with value: 0.9860492846658779.

Klebsiella_Pneumoniae | Imipenem | Optuna: 100%|██████████| 200/200 [2:30:23<00:00, 43.32s/it, best=0.986][A
Klebsiella_Pneumoniae | Imipenem | Optuna: 100%|██████████| 200/200 [2:30:23<00:00, 43.32s/it, best=0.986][A
                                                                                                          [A[Klebsiella_Pneumoniae | Imipenem] [OPTUNA DONE] Best CV WF1=0.9860 | params={'activation': 'relu', 'solver': 'adam', 'lr': 0.001163276039561687, 'layer1': 499, 'layer2': 137, 'layer3': 404}
[Klebsiella_Pneumoniae | Imipenem] Retraining with validation early stopping (10% split)...
[I 2026-02-28 05:59:13,072] Trial 159 finished with value: 0.8950095948234912 and parameters: {'activation': 'relu', 'solver': 'adam', 'lr': 4.4717922886638386e-05, 'layer1': 442, 'layer2': 132, 'layer3': 42}. Best is trial 137 with value: 0.8979080367540411.

Escherichia_Coli | Ceftriaxone | Optuna:  80%|████████  | 160/200 [6:49:14<1:52:53, 169.33s/it, best=0.898][A
Escherichia_Coli | Ceftriaxone | Optuna:  80%|████████  | 160/200 [6:49:14<1:52:53, 169.33s/it, best=0.898][A[Klebsiella_Pneumoniae | Imipenem] [TEST] WF1=0.9787 | ACC=0.9858 | HL=0.0142 | best_val_WF1=0.9800
Klebsiella_Pneumoniae | Binary antibiotics:  75%|███████▌  | 3/4 [15:11:49<4:37:14, 16634.93s/it] 
[Klebsiella_Pneumoniae | Meropenem] Optuna search starting... (trials=200, cv=5)
[I 2026-02-28 05:59:19,498] A new study created in memory with name: no-name-87655029-c1d5-407e-b47a-2106908dbf47

Klebsiella_Pneumoniae | Meropenem | Optuna:   0%|          | 0/200 [00:00<?, ?it/s][A[I 2026-02-28 05:59:30,304] Trial 159 finished with value: 0.8625066561958924 and parameters: {'activation': 'identity', 'solver': 'adam', 'lr': 0.0009641923184339669, 'layer1': 371, 'layer2': 496, 'layer3': 434}. Best is trial 140 with value: 0.8705750568176336.
Pseudomonas_Aeruginosa | LPS | Optuna:  80%|████████  | 160/200 [3:54:32<1:02:15, 93.39s/it, best=0.871]Pseudomonas_Aeruginosa | LPS | Optuna:  80%|████████  | 160/200 [3:54:32<1:02:15, 93.39s/it, best=0.871]/export/usuarios01/egarroyo/MALDI_for_AMR_prediction/venv/lib/python3.13/site-packages/sklearn/model_selection/_split.py:813: UserWarning: The least populated class in y has only 4 members, which is less than n_splits=5.
  warnings.warn(
[I 2026-02-28 05:59:39,314] Trial 121 finished with value: 0.9278749747707323 and parameters: {'activation': 'identity', 'solver': 'adam', 'lr': 0.00013786794782989477, 'layer1': 380, 'layer2': 45, 'layer3': 94}. Best is trial 77 with value: 0.9283869597728589.

Staphylococcus_Aureus | Fusidic acid | Optuna:  61%|██████    | 122/200 [3:18:48<2:06:29, 97.30s/it, best=0.928][A
Staphylococcus_Aureus | Fusidic acid | Optuna:  61%|██████    | 122/200 [3:18:48<2:06:29, 97.30s/it, best=0.928][A[I 2026-02-28 05:59:48,819] Trial 0 finished with value: 0.3909562988036945 and parameters: {'activation': 'logistic', 'solver': 'sgd', 'lr': 1.7073967431528114e-06, 'layer1': 435, 'layer2': 305, 'layer3': 357}. Best is trial 0 with value: 0.3909562988036945.

Klebsiella_Pneumoniae | Meropenem | Optuna:   0%|          | 1/200 [00:29<1:37:14, 29.32s/it][A
Klebsiella_Pneumoniae | Meropenem | Optuna:   0%|          | 1/200 [00:29<1:37:14, 29.32s/it, best=0.391][A[I 2026-02-28 06:00:06,472] Trial 160 finished with value: 0.8284193550148073 and parameters: {'activation': 'identity', 'solver': 'sgd', 'lr': 0.001225009291754358, 'layer1': 355, 'layer2': 343, 'layer3': 487}. Best is trial 140 with value: 0.8705750568176336.
Pseudomonas_Aeruginosa | LPS | Optuna:  80%|████████  | 161/200 [3:55:08<49:32, 76.22s/it, best=0.871]  Pseudomonas_Aeruginosa | LPS | Optuna:  80%|████████  | 161/200 [3:55:08<49:32, 76.22s/it, best=0.871]/export/usuarios01/egarroyo/MALDI_for_AMR_prediction/venv/lib/python3.13/site-packages/sklearn/model_selection/_split.py:813: UserWarning: The least populated class in y has only 4 members, which is less than n_splits=5.
  warnings.warn(
[I 2026-02-28 06:00:20,938] Trial 1 finished with value: 0.9767069569332589 and parameters: {'activation': 'logistic', 'solver': 'adam', 'lr': 1.6480446427978994e-05, 'layer1': 267, 'layer2': 222, 'layer3': 152}. Best is trial 1 with value: 0.9767069569332589.

Klebsiella_Pneumoniae | Meropenem | Optuna:   1%|          | 2/200 [01:01<1:42:11, 30.97s/it, best=0.391][A
Klebsiella_Pneumoniae | Meropenem | Optuna:   1%|          | 2/200 [01:01<1:42:11, 30.97s/it, best=0.977][A[I 2026-02-28 06:00:57,809] Trial 160 finished with value: 0.7107186096109388 and parameters: {'activation': 'relu', 'solver': 'sgd', 'lr': 6.068467504469088e-05, 'layer1': 488, 'layer2': 300, 'layer3': 70}. Best is trial 137 with value: 0.8979080367540411.

Escherichia_Coli | Ceftriaxone | Optuna:  80%|████████  | 161/200 [6:50:59<1:37:28, 149.95s/it, best=0.898][A
Escherichia_Coli | Ceftriaxone | Optuna:  80%|████████  | 161/200 [6:50:59<1:37:28, 149.95s/it, best=0.898][A[I 2026-02-28 06:01:31,786] Trial 161 finished with value: 0.8625600816138457 and parameters: {'activation': 'identity', 'solver': 'adam', 'lr': 0.0014661860176092456, 'layer1': 304, 'layer2': 323, 'layer3': 475}. Best is trial 140 with value: 0.8705750568176336.
Pseudomonas_Aeruginosa | LPS | Optuna:  81%|████████  | 162/200 [3:56:33<50:00, 78.95s/it, best=0.871]Pseudomonas_Aeruginosa | LPS | Optuna:  81%|████████  | 162/200 [3:56:33<50:00, 78.95s/it, best=0.871]/export/usuarios01/egarroyo/MALDI_for_AMR_prediction/venv/lib/python3.13/site-packages/sklearn/model_selection/_split.py:813: UserWarning: The least populated class in y has only 4 members, which is less than n_splits=5.
  warnings.warn(
[I 2026-02-28 06:01:33,430] Trial 122 finished with value: 0.9272767772876145 and parameters: {'activation': 'identity', 'solver': 'adam', 'lr': 0.000111265136418069, 'layer1': 381, 'layer2': 411, 'layer3': 127}. Best is trial 77 with value: 0.9283869597728589.

Staphylococcus_Aureus | Fusidic acid | Optuna:  62%|██████▏   | 123/200 [3:20:42<2:11:20, 102.35s/it, best=0.928][A
Staphylococcus_Aureus | Fusidic acid | Optuna:  62%|██████▏   | 123/200 [3:20:42<2:11:20, 102.35s/it, best=0.928][A[I 2026-02-28 06:01:36,678] Trial 2 finished with value: 0.9759183001142556 and parameters: {'activation': 'identity', 'solver': 'adam', 'lr': 6.290644294586145e-06, 'layer1': 262, 'layer2': 300, 'layer3': 32}. Best is trial 1 with value: 0.9767069569332589.

Klebsiella_Pneumoniae | Meropenem | Optuna:   2%|▏         | 3/200 [02:17<2:48:47, 51.41s/it, best=0.977][A
Klebsiella_Pneumoniae | Meropenem | Optuna:   2%|▏         | 3/200 [02:17<2:48:47, 51.41s/it, best=0.977][A[I 2026-02-28 06:02:27,578] Trial 3 finished with value: 0.9767069569332589 and parameters: {'activation': 'relu', 'solver': 'sgd', 'lr': 1.6536937182824424e-05, 'layer1': 57, 'layer2': 345, 'layer3': 226}. Best is trial 1 with value: 0.9767069569332589.

Klebsiella_Pneumoniae | Meropenem | Optuna:   2%|▏         | 4/200 [03:08<2:47:17, 51.21s/it, best=0.977][A
Klebsiella_Pneumoniae | Meropenem | Optuna:   2%|▏         | 4/200 [03:08<2:47:17, 51.21s/it, best=0.977][A[I 2026-02-28 06:02:58,691] Trial 4 finished with value: 0.9767069569332589 and parameters: {'activation': 'relu', 'solver': 'adam', 'lr': 1.7654048052495086e-05, 'layer1': 265, 'layer2': 278, 'layer3': 100}. Best is trial 1 with value: 0.9767069569332589.

Klebsiella_Pneumoniae | Meropenem | Optuna:   2%|▎         | 5/200 [03:39<2:22:52, 43.96s/it, best=0.977][A
Klebsiella_Pneumoniae | Meropenem | Optuna:   2%|▎         | 5/200 [03:39<2:22:52, 43.96s/it, best=0.977][A[I 2026-02-28 06:03:05,848] Trial 123 finished with value: 0.9257298138288064 and parameters: {'activation': 'identity', 'solver': 'adam', 'lr': 0.00013293479852842516, 'layer1': 403, 'layer2': 80, 'layer3': 63}. Best is trial 77 with value: 0.9283869597728589.

Staphylococcus_Aureus | Fusidic acid | Optuna:  62%|██████▏   | 124/200 [3:22:15<2:05:51, 99.37s/it, best=0.928] [A
Staphylococcus_Aureus | Fusidic acid | Optuna:  62%|██████▏   | 124/200 [3:22:15<2:05:51, 99.37s/it, best=0.928][A[I 2026-02-28 06:03:08,351] Trial 162 finished with value: 0.8646790030864626 and parameters: {'activation': 'identity', 'solver': 'adam', 'lr': 0.0019547602451277955, 'layer1': 394, 'layer2': 331, 'layer3': 464}. Best is trial 140 with value: 0.8705750568176336.
Pseudomonas_Aeruginosa | LPS | Optuna:  82%|████████▏ | 163/200 [3:58:10<51:56, 84.23s/it, best=0.871]Pseudomonas_Aeruginosa | LPS | Optuna:  82%|████████▏ | 163/200 [3:58:10<51:56, 84.23s/it, best=0.871]/export/usuarios01/egarroyo/MALDI_for_AMR_prediction/venv/lib/python3.13/site-packages/sklearn/model_selection/_split.py:813: UserWarning: The least populated class in y has only 4 members, which is less than n_splits=5.
  warnings.warn(
[I 2026-02-28 06:03:22,875] Trial 161 finished with value: 0.8932621236003797 and parameters: {'activation': 'relu', 'solver': 'adam', 'lr': 8.368780039629266e-05, 'layer1': 476, 'layer2': 105, 'layer3': 27}. Best is trial 137 with value: 0.8979080367540411.

Escherichia_Coli | Ceftriaxone | Optuna:  81%|████████  | 162/200 [6:53:24<1:34:02, 148.49s/it, best=0.898][A
Escherichia_Coli | Ceftriaxone | Optuna:  81%|████████  | 162/200 [6:53:24<1:34:02, 148.49s/it, best=0.898][A[I 2026-02-28 06:04:06,010] Trial 163 finished with value: 0.8640507551151948 and parameters: {'activation': 'identity', 'solver': 'adam', 'lr': 0.0016228575976498045, 'layer1': 31, 'layer2': 364, 'layer3': 448}. Best is trial 140 with value: 0.8705750568176336.
Pseudomonas_Aeruginosa | LPS | Optuna:  82%|████████▏ | 164/200 [3:59:08<45:45, 76.26s/it, best=0.871]Pseudomonas_Aeruginosa | LPS | Optuna:  82%|████████▏ | 164/200 [3:59:08<45:45, 76.26s/it, best=0.871]/export/usuarios01/egarroyo/MALDI_for_AMR_prediction/venv/lib/python3.13/site-packages/sklearn/model_selection/_split.py:813: UserWarning: The least populated class in y has only 4 members, which is less than n_splits=5.
  warnings.warn(
[I 2026-02-28 06:04:08,964] Trial 5 finished with value: 0.9765030270715342 and parameters: {'activation': 'identity', 'solver': 'adam', 'lr': 2.259279742015697e-06, 'layer1': 106, 'layer2': 32, 'layer3': 169}. Best is trial 1 with value: 0.9767069569332589.

Klebsiella_Pneumoniae | Meropenem | Optuna:   3%|▎         | 6/200 [04:49<2:51:04, 52.91s/it, best=0.977][A
Klebsiella_Pneumoniae | Meropenem | Optuna:   3%|▎         | 6/200 [04:49<2:51:04, 52.91s/it, best=0.977][A[I 2026-02-28 06:05:01,114] Trial 124 finished with value: 0.9266725173923209 and parameters: {'activation': 'identity', 'solver': 'adam', 'lr': 7.555465972948165e-05, 'layer1': 343, 'layer2': 97, 'layer3': 78}. Best is trial 77 with value: 0.9283869597728589.

Staphylococcus_Aureus | Fusidic acid | Optuna:  62%|██████▎   | 125/200 [3:24:10<2:10:10, 104.14s/it, best=0.928][A
