Escherichia_Coli | Piperacillin-Tazobactam | Optuna:  82%|████████▏ | 164/200 [5:43:48<1:16:08, 126.89s/it, best=0.917][A[I 2026-02-28 13:48:36,626] Trial 9 finished with value: 0.8674694318623694 and parameters: {'activation': 'tanh', 'solver': 'sgd', 'lr': 0.00012329098365270507, 'layer1': 219, 'layer2': 22, 'layer3': 62}. Best is trial 8 with value: 0.9193151399717422.
Klebsiella_Pneumoniae | DirectMulti | Optuna:   5%|▌         | 10/200 [22:22<8:46:08, 166.15s/it, best=0.919]Klebsiella_Pneumoniae | DirectMulti | Optuna:   5%|▌         | 10/200 [22:22<8:46:08, 166.15s/it, best=0.919][I 2026-02-28 13:48:43,340] Trial 171 finished with value: 0.8862565301180945 and parameters: {'activation': 'identity', 'solver': 'adam', 'lr': 0.00020484853788515223, 'layer1': 195, 'layer2': 126, 'layer3': 297}. Best is trial 8 with value: 0.8879562150966016.
Staphylococcus_Aureus | LPS | Optuna:  86%|████████▌ | 172/200 [5:42:29<40:55, 87.69s/it, best=0.888]Staphylococcus_Aureus | LPS | Optuna:  86%|████████▌ | 172/200 [5:42:29<40:55, 87.69s/it, best=0.888][I 2026-02-28 13:49:07,998] Trial 10 finished with value: 0.871140255384271 and parameters: {'activation': 'identity', 'solver': 'sgd', 'lr': 0.007553503645583194, 'layer1': 366, 'layer2': 492, 'layer3': 320}. Best is trial 8 with value: 0.9193151399717422.
Klebsiella_Pneumoniae | DirectMulti | Optuna:   6%|▌         | 11/200 [22:53<6:33:26, 124.90s/it, best=0.919]Klebsiella_Pneumoniae | DirectMulti | Optuna:   6%|▌         | 11/200 [22:53<6:33:26, 124.90s/it, best=0.919][I 2026-02-28 13:49:48,030] Trial 164 finished with value: 0.9137733526570896 and parameters: {'activation': 'relu', 'solver': 'adam', 'lr': 0.00015749742368497294, 'layer1': 348, 'layer2': 324, 'layer3': 127}. Best is trial 74 with value: 0.9166002918687234.

Escherichia_Coli | Piperacillin-Tazobactam | Optuna:  82%|████████▎ | 165/200 [5:45:40<1:11:31, 122.62s/it, best=0.917][A
Escherichia_Coli | Piperacillin-Tazobactam | Optuna:  82%|████████▎ | 165/200 [5:45:40<1:11:31, 122.62s/it, best=0.917][A[I 2026-02-28 13:50:00,245] Trial 172 finished with value: 0.8858739403889736 and parameters: {'activation': 'identity', 'solver': 'adam', 'lr': 0.00028239413768407865, 'layer1': 177, 'layer2': 106, 'layer3': 319}. Best is trial 8 with value: 0.8879562150966016.
Staphylococcus_Aureus | LPS | Optuna:  86%|████████▋ | 173/200 [5:43:46<38:00, 84.45s/it, best=0.888]Staphylococcus_Aureus | LPS | Optuna:  86%|████████▋ | 173/200 [5:43:46<38:00, 84.45s/it, best=0.888][I 2026-02-28 13:50:20,522] Trial 11 finished with value: 0.9182771528269822 and parameters: {'activation': 'relu', 'solver': 'adam', 'lr': 0.0013124793805688133, 'layer1': 150, 'layer2': 163, 'layer3': 284}. Best is trial 8 with value: 0.9193151399717422.
Klebsiella_Pneumoniae | DirectMulti | Optuna:   6%|▌         | 12/200 [24:06<5:41:25, 108.97s/it, best=0.919]Klebsiella_Pneumoniae | DirectMulti | Optuna:   6%|▌         | 12/200 [24:06<5:41:25, 108.97s/it, best=0.919][I 2026-02-28 13:51:04,629] Trial 165 finished with value: 0.9091545566841331 and parameters: {'activation': 'identity', 'solver': 'adam', 'lr': 0.0002490051832788218, 'layer1': 105, 'layer2': 211, 'layer3': 154}. Best is trial 74 with value: 0.9166002918687234.

Escherichia_Coli | Piperacillin-Tazobactam | Optuna:  83%|████████▎ | 166/200 [5:46:57<1:01:39, 108.81s/it, best=0.917][A
Escherichia_Coli | Piperacillin-Tazobactam | Optuna:  83%|████████▎ | 166/200 [5:46:57<1:01:39, 108.81s/it, best=0.917][A[I 2026-02-28 13:51:24,877] Trial 173 finished with value: 0.8849268444647234 and parameters: {'activation': 'identity', 'solver': 'adam', 'lr': 0.00033777726071180207, 'layer1': 157, 'layer2': 130, 'layer3': 306}. Best is trial 8 with value: 0.8879562150966016.
Staphylococcus_Aureus | LPS | Optuna:  87%|████████▋ | 174/200 [5:45:11<36:37, 84.51s/it, best=0.888]Staphylococcus_Aureus | LPS | Optuna:  87%|████████▋ | 174/200 [5:45:11<36:37, 84.51s/it, best=0.888][I 2026-02-28 13:52:05,134] Trial 12 finished with value: 0.9208852862771488 and parameters: {'activation': 'identity', 'solver': 'adam', 'lr': 0.00046544039809979403, 'layer1': 347, 'layer2': 434, 'layer3': 419}. Best is trial 12 with value: 0.9208852862771488.
Klebsiella_Pneumoniae | DirectMulti | Optuna:   6%|▋         | 13/200 [25:50<5:35:30, 107.65s/it, best=0.919]Klebsiella_Pneumoniae | DirectMulti | Optuna:   6%|▋         | 13/200 [25:50<5:35:30, 107.65s/it, best=0.921][I 2026-02-28 13:53:09,997] Trial 174 finished with value: 0.8852445358456109 and parameters: {'activation': 'identity', 'solver': 'adam', 'lr': 0.0001256966479094944, 'layer1': 170, 'layer2': 95, 'layer3': 278}. Best is trial 8 with value: 0.8879562150966016.
Staphylococcus_Aureus | LPS | Optuna:  88%|████████▊ | 175/200 [5:46:56<37:47, 90.69s/it, best=0.888]Staphylococcus_Aureus | LPS | Optuna:  88%|████████▊ | 175/200 [5:46:56<37:47, 90.69s/it, best=0.888][I 2026-02-28 13:53:22,905] Trial 166 finished with value: 0.9135801383692576 and parameters: {'activation': 'relu', 'solver': 'adam', 'lr': 0.0002653233729252928, 'layer1': 364, 'layer2': 334, 'layer3': 262}. Best is trial 74 with value: 0.9166002918687234.

Escherichia_Coli | Piperacillin-Tazobactam | Optuna:  84%|████████▎ | 167/200 [5:49:15<1:04:42, 117.65s/it, best=0.917][A
Escherichia_Coli | Piperacillin-Tazobactam | Optuna:  84%|████████▎ | 167/200 [5:49:15<1:04:42, 117.65s/it, best=0.917][A[I 2026-02-28 13:54:04,891] Trial 13 finished with value: 0.9199564628389065 and parameters: {'activation': 'identity', 'solver': 'adam', 'lr': 0.00025548240574830476, 'layer1': 499, 'layer2': 471, 'layer3': 419}. Best is trial 12 with value: 0.9208852862771488.
Klebsiella_Pneumoniae | DirectMulti | Optuna:   7%|▋         | 14/200 [27:50<5:45:02, 111.31s/it, best=0.921]Klebsiella_Pneumoniae | DirectMulti | Optuna:   7%|▋         | 14/200 [27:50<5:45:02, 111.31s/it, best=0.921][I 2026-02-28 13:54:25,520] Trial 175 finished with value: 0.885475611552943 and parameters: {'activation': 'identity', 'solver': 'adam', 'lr': 0.0005352924171495711, 'layer1': 53, 'layer2': 259, 'layer3': 354}. Best is trial 8 with value: 0.8879562150966016.
Staphylococcus_Aureus | LPS | Optuna:  88%|████████▊ | 176/200 [5:48:11<34:27, 86.14s/it, best=0.888]Staphylococcus_Aureus | LPS | Optuna:  88%|████████▊ | 176/200 [5:48:11<34:27, 86.14s/it, best=0.888][I 2026-02-28 13:55:40,161] Trial 167 finished with value: 0.916162460029517 and parameters: {'activation': 'relu', 'solver': 'adam', 'lr': 0.0006898678498873315, 'layer1': 317, 'layer2': 408, 'layer3': 320}. Best is trial 74 with value: 0.9166002918687234.

Escherichia_Coli | Piperacillin-Tazobactam | Optuna:  84%|████████▍ | 168/200 [5:51:32<1:05:53, 123.53s/it, best=0.917][A
Escherichia_Coli | Piperacillin-Tazobactam | Optuna:  84%|████████▍ | 168/200 [5:51:32<1:05:53, 123.53s/it, best=0.917][A[I 2026-02-28 13:56:03,617] Trial 176 finished with value: 0.884862558634613 and parameters: {'activation': 'identity', 'solver': 'adam', 'lr': 0.00023493516375088725, 'layer1': 144, 'layer2': 119, 'layer3': 287}. Best is trial 8 with value: 0.8879562150966016.
Staphylococcus_Aureus | LPS | Optuna:  88%|████████▊ | 177/200 [5:49:49<34:23, 89.73s/it, best=0.888]Staphylococcus_Aureus | LPS | Optuna:  88%|████████▊ | 177/200 [5:49:49<34:23, 89.73s/it, best=0.888][I 2026-02-28 13:56:04,250] Trial 14 finished with value: 0.9196628290925061 and parameters: {'activation': 'identity', 'solver': 'adam', 'lr': 0.00013839971926370072, 'layer1': 499, 'layer2': 394, 'layer3': 414}. Best is trial 12 with value: 0.9208852862771488.
Klebsiella_Pneumoniae | DirectMulti | Optuna:   8%|▊         | 15/200 [29:49<5:50:40, 113.73s/it, best=0.921]Klebsiella_Pneumoniae | DirectMulti | Optuna:   8%|▊         | 15/200 [29:49<5:50:40, 113.73s/it, best=0.921][I 2026-02-28 13:56:09,601] Trial 168 finished with value: 0.8958344038173316 and parameters: {'activation': 'relu', 'solver': 'sgd', 'lr': 0.0014154323913405642, 'layer1': 316, 'layer2': 407, 'layer3': 37}. Best is trial 74 with value: 0.9166002918687234.

Escherichia_Coli | Piperacillin-Tazobactam | Optuna:  84%|████████▍ | 169/200 [5:52:02<49:14, 95.30s/it, best=0.917]   [A
Escherichia_Coli | Piperacillin-Tazobactam | Optuna:  84%|████████▍ | 169/200 [5:52:02<49:14, 95.30s/it, best=0.917][A[I 2026-02-28 13:57:27,975] Trial 177 finished with value: 0.8864622821032604 and parameters: {'activation': 'identity', 'solver': 'adam', 'lr': 0.0004233124242290559, 'layer1': 187, 'layer2': 103, 'layer3': 376}. Best is trial 8 with value: 0.8879562150966016.
Staphylococcus_Aureus | LPS | Optuna:  89%|████████▉ | 178/200 [5:51:14<32:18, 88.12s/it, best=0.888]Staphylococcus_Aureus | LPS | Optuna:  89%|████████▉ | 178/200 [5:51:14<32:18, 88.12s/it, best=0.888][I 2026-02-28 13:57:40,600] Trial 15 finished with value: 0.917196632699174 and parameters: {'activation': 'identity', 'solver': 'adam', 'lr': 0.0003521954261532511, 'layer1': 497, 'layer2': 499, 'layer3': 500}. Best is trial 12 with value: 0.9208852862771488.
Klebsiella_Pneumoniae | DirectMulti | Optuna:   8%|▊         | 16/200 [31:26<5:32:44, 108.50s/it, best=0.921]Klebsiella_Pneumoniae | DirectMulti | Optuna:   8%|▊         | 16/200 [31:26<5:32:44, 108.50s/it, best=0.921][I 2026-02-28 13:57:53,444] Trial 169 finished with value: 0.9127677839860194 and parameters: {'activation': 'relu', 'solver': 'adam', 'lr': 0.0007114954619836941, 'layer1': 337, 'layer2': 376, 'layer3': 372}. Best is trial 74 with value: 0.9166002918687234.

Escherichia_Coli | Piperacillin-Tazobactam | Optuna:  85%|████████▌ | 170/200 [5:53:46<48:55, 97.87s/it, best=0.917][A
Escherichia_Coli | Piperacillin-Tazobactam | Optuna:  85%|████████▌ | 170/200 [5:53:46<48:55, 97.87s/it, best=0.917][A[I 2026-02-28 13:59:21,850] Trial 178 finished with value: 0.8857778698218752 and parameters: {'activation': 'identity', 'solver': 'adam', 'lr': 0.00018122850586538357, 'layer1': 110, 'layer2': 451, 'layer3': 332}. Best is trial 8 with value: 0.8879562150966016.
Staphylococcus_Aureus | LPS | Optuna:  90%|████████▉ | 179/200 [5:53:08<33:32, 95.84s/it, best=0.888]Staphylococcus_Aureus | LPS | Optuna:  90%|████████▉ | 179/200 [5:53:08<33:32, 95.84s/it, best=0.888][I 2026-02-28 13:59:29,982] Trial 16 finished with value: 0.9204370528726674 and parameters: {'activation': 'identity', 'solver': 'adam', 'lr': 0.004512428606443835, 'layer1': 441, 'layer2': 393, 'layer3': 405}. Best is trial 12 with value: 0.9208852862771488.
Klebsiella_Pneumoniae | DirectMulti | Optuna:   8%|▊         | 17/200 [33:15<5:31:44, 108.77s/it, best=0.921]Klebsiella_Pneumoniae | DirectMulti | Optuna:   8%|▊         | 17/200 [33:15<5:31:44, 108.77s/it, best=0.921][I 2026-02-28 14:00:15,906] Trial 170 finished with value: 0.9143916158981835 and parameters: {'activation': 'relu', 'solver': 'adam', 'lr': 0.0010423483334442464, 'layer1': 308, 'layer2': 350, 'layer3': 279}. Best is trial 74 with value: 0.9166002918687234.

Escherichia_Coli | Piperacillin-Tazobactam | Optuna:  86%|████████▌ | 171/200 [5:56:08<53:46, 111.24s/it, best=0.917][A
Escherichia_Coli | Piperacillin-Tazobactam | Optuna:  86%|████████▌ | 171/200 [5:56:08<53:46, 111.24s/it, best=0.917][A[I 2026-02-28 14:00:28,899] Trial 179 finished with value: 0.8848497627150254 and parameters: {'activation': 'identity', 'solver': 'adam', 'lr': 0.0007351139806281948, 'layer1': 96, 'layer2': 114, 'layer3': 299}. Best is trial 8 with value: 0.8879562150966016.
Staphylococcus_Aureus | LPS | Optuna:  90%|█████████ | 180/200 [5:54:15<29:04, 87.21s/it, best=0.888]Staphylococcus_Aureus | LPS | Optuna:  90%|█████████ | 180/200 [5:54:15<29:04, 87.21s/it, best=0.888][I 2026-02-28 14:00:58,688] Trial 17 finished with value: 0.9206262118218073 and parameters: {'activation': 'identity', 'solver': 'adam', 'lr': 0.005203193033445127, 'layer1': 336, 'layer2': 396, 'layer3': 400}. Best is trial 12 with value: 0.9208852862771488.
Klebsiella_Pneumoniae | DirectMulti | Optuna:   9%|▉         | 18/200 [34:44<5:11:38, 102.74s/it, best=0.921]Klebsiella_Pneumoniae | DirectMulti | Optuna:   9%|▉         | 18/200 [34:44<5:11:38, 102.74s/it, best=0.921][I 2026-02-28 14:01:36,181] Trial 180 finished with value: 0.8844945945922577 and parameters: {'activation': 'identity', 'solver': 'adam', 'lr': 0.00038024979925369506, 'layer1': 160, 'layer2': 77, 'layer3': 320}. Best is trial 8 with value: 0.8879562150966016.
Staphylococcus_Aureus | LPS | Optuna:  90%|█████████ | 181/200 [5:55:22<25:43, 81.23s/it, best=0.888]Staphylococcus_Aureus | LPS | Optuna:  90%|█████████ | 181/200 [5:55:22<25:43, 81.23s/it, best=0.888][I 2026-02-28 14:01:40,524] Trial 18 finished with value: 0.8706310309165138 and parameters: {'activation': 'tanh', 'solver': 'sgd', 'lr': 0.0038366465576363585, 'layer1': 334, 'layer2': 408, 'layer3': 356}. Best is trial 12 with value: 0.9208852862771488.
Klebsiella_Pneumoniae | DirectMulti | Optuna:  10%|▉         | 19/200 [35:26<4:14:44, 84.45s/it, best=0.921] Klebsiella_Pneumoniae | DirectMulti | Optuna:  10%|▉         | 19/200 [35:26<4:14:44, 84.45s/it, best=0.921][I 2026-02-28 14:02:26,045] Trial 171 finished with value: 0.9160256752880818 and parameters: {'activation': 'relu', 'solver': 'adam', 'lr': 0.00038453895425323933, 'layer1': 343, 'layer2': 307, 'layer3': 240}. Best is trial 74 with value: 0.9166002918687234.

Escherichia_Coli | Piperacillin-Tazobactam | Optuna:  86%|████████▌ | 172/200 [5:58:18<54:33, 116.91s/it, best=0.917][A
Escherichia_Coli | Piperacillin-Tazobactam | Optuna:  86%|████████▌ | 172/200 [5:58:18<54:33, 116.91s/it, best=0.917][A[I 2026-02-28 14:02:35,538] Trial 19 finished with value: 0.9074806437416452 and parameters: {'activation': 'logistic', 'solver': 'adam', 'lr': 0.0022811669873826347, 'layer1': 195, 'layer2': 355, 'layer3': 445}. Best is trial 12 with value: 0.9208852862771488.
Klebsiella_Pneumoniae | DirectMulti | Optuna:  10%|█         | 20/200 [36:21<3:46:49, 75.61s/it, best=0.921]Klebsiella_Pneumoniae | DirectMulti | Optuna:  10%|█         | 20/200 [36:21<3:46:49, 75.61s/it, best=0.921][I 2026-02-28 14:03:22,802] Trial 181 finished with value: 0.8859569454611899 and parameters: {'activation': 'identity', 'solver': 'adam', 'lr': 0.0001555683709894598, 'layer1': 115, 'layer2': 436, 'layer3': 360}. Best is trial 8 with value: 0.8879562150966016.
Staphylococcus_Aureus | LPS | Optuna:  91%|█████████ | 182/200 [5:57:09<26:39, 88.85s/it, best=0.888]Staphylococcus_Aureus | LPS | Optuna:  91%|█████████ | 182/200 [5:57:09<26:39, 88.85s/it, best=0.888][I 2026-02-28 14:04:23,712] Trial 20 finished with value: 0.9222781385346849 and parameters: {'activation': 'identity', 'solver': 'adam', 'lr': 0.00046359907122990227, 'layer1': 318, 'layer2': 437, 'layer3': 352}. Best is trial 20 with value: 0.9222781385346849.
Klebsiella_Pneumoniae | DirectMulti | Optuna:  10%|█         | 21/200 [38:09<4:14:43, 85.38s/it, best=0.921]Klebsiella_Pneumoniae | DirectMulti | Optuna:  10%|█         | 21/200 [38:09<4:14:43, 85.38s/it, best=0.922][I 2026-02-28 14:04:26,436] Trial 172 finished with value: 0.9133214910463741 and parameters: {'activation': 'relu', 'solver': 'adam', 'lr': 0.0006208392575495308, 'layer1': 342, 'layer2': 401, 'layer3': 318}. Best is trial 74 with value: 0.9166002918687234.

Escherichia_Coli | Piperacillin-Tazobactam | Optuna:  86%|████████▋ | 173/200 [6:00:19<53:04, 117.96s/it, best=0.917][A
Escherichia_Coli | Piperacillin-Tazobactam | Optuna:  86%|████████▋ | 173/200 [6:00:19<53:04, 117.96s/it, best=0.917][A[I 2026-02-28 14:04:48,863] Trial 182 finished with value: 0.8831871628046326 and parameters: {'activation': 'identity', 'solver': 'adam', 'lr': 0.00013907733382889374, 'layer1': 125, 'layer2': 430, 'layer3': 389}. Best is trial 8 with value: 0.8879562150966016.
Staphylococcus_Aureus | LPS | Optuna:  92%|█████████▏| 183/200 [5:58:35<24:56, 88.01s/it, best=0.888]Staphylococcus_Aureus | LPS | Optuna:  92%|█████████▏| 183/200 [5:58:35<24:56, 88.01s/it, best=0.888][I 2026-02-28 14:05:59,223] Trial 21 finished with value: 0.9217721494500953 and parameters: {'activation': 'identity', 'solver': 'adam', 'lr': 0.0004993918790221443, 'layer1': 316, 'layer2': 436, 'layer3': 350}. Best is trial 20 with value: 0.9222781385346849.
Klebsiella_Pneumoniae | DirectMulti | Optuna:  11%|█         | 22/200 [39:44<4:22:19, 88.42s/it, best=0.922]Klebsiella_Pneumoniae | DirectMulti | Optuna:  11%|█         | 22/200 [39:44<4:22:19, 88.42s/it, best=0.922][I 2026-02-28 14:06:37,266] Trial 183 finished with value: 0.8876058717639671 and parameters: {'activation': 'identity', 'solver': 'adam', 'lr': 0.0002326854802393619, 'layer1': 134, 'layer2': 423, 'layer3': 353}. Best is trial 8 with value: 0.8879562150966016.
Staphylococcus_Aureus | LPS | Optuna:  92%|█████████▏| 184/200 [6:00:23<25:06, 94.13s/it, best=0.888]Staphylococcus_Aureus | LPS | Optuna:  92%|█████████▏| 184/200 [6:00:23<25:06, 94.13s/it, best=0.888][I 2026-02-28 14:07:00,493] Trial 173 finished with value: 0.913465848142137 and parameters: {'activation': 'relu', 'solver': 'adam', 'lr': 0.00039665568171889297, 'layer1': 323, 'layer2': 417, 'layer3': 298}. Best is trial 74 with value: 0.9166002918687234.

Escherichia_Coli | Piperacillin-Tazobactam | Optuna:  87%|████████▋ | 174/200 [6:02:53<55:48, 128.79s/it, best=0.917][A
Escherichia_Coli | Piperacillin-Tazobactam | Optuna:  87%|████████▋ | 174/200 [6:02:53<55:48, 128.79s/it, best=0.917][A[I 2026-02-28 14:07:42,306] Trial 22 finished with value: 0.919508051597527 and parameters: {'activation': 'identity', 'solver': 'adam', 'lr': 0.00042914652653819454, 'layer1': 379, 'layer2': 442, 'layer3': 336}. Best is trial 20 with value: 0.9222781385346849.
Klebsiella_Pneumoniae | DirectMulti | Optuna:  12%|█▏        | 23/200 [41:27<4:33:49, 92.82s/it, best=0.922]Klebsiella_Pneumoniae | DirectMulti | Optuna:  12%|█▏        | 23/200 [41:27<4:33:49, 92.82s/it, best=0.922][I 2026-02-28 14:08:08,986] Trial 184 finished with value: 0.8853812543958577 and parameters: {'activation': 'identity', 'solver': 'adam', 'lr': 0.000240427632152, 'layer1': 137, 'layer2': 443, 'layer3': 342}. Best is trial 8 with value: 0.8879562150966016.
Staphylococcus_Aureus | LPS | Optuna:  92%|█████████▎| 185/200 [6:01:55<23:21, 93.41s/it, best=0.888]Staphylococcus_Aureus | LPS | Optuna:  92%|█████████▎| 185/200 [6:01:55<23:21, 93.41s/it, best=0.888][I 2026-02-28 14:09:06,578] Trial 174 finished with value: 0.9149483011246631 and parameters: {'activation': 'relu', 'solver': 'adam', 'lr': 0.00031664683868838156, 'layer1': 332, 'layer2': 317, 'layer3': 342}. Best is trial 74 with value: 0.9166002918687234.

Escherichia_Coli | Piperacillin-Tazobactam | Optuna:  88%|████████▊ | 175/200 [6:04:59<53:19, 127.98s/it, best=0.917][A
Escherichia_Coli | Piperacillin-Tazobactam | Optuna:  88%|████████▊ | 175/200 [6:04:59<53:19, 127.98s/it, best=0.917][A[I 2026-02-28 14:09:43,143] Trial 23 finished with value: 0.9201709763101308 and parameters: {'activation': 'identity', 'solver': 'adam', 'lr': 4.74732464224605e-05, 'layer1': 304, 'layer2': 451, 'layer3': 287}. Best is trial 20 with value: 0.9222781385346849.
Klebsiella_Pneumoniae | DirectMulti | Optuna:  12%|█▏        | 24/200 [43:28<4:56:56, 101.23s/it, best=0.922]Klebsiella_Pneumoniae | DirectMulti | Optuna:  12%|█▏        | 24/200 [43:28<4:56:56, 101.23s/it, best=0.922][I 2026-02-28 14:09:53,059] Trial 185 finished with value: 0.8863860022583898 and parameters: {'activation': 'identity', 'solver': 'adam', 'lr': 0.00030374649905156844, 'layer1': 330, 'layer2': 89, 'layer3': 309}. Best is trial 8 with value: 0.8879562150966016.
Staphylococcus_Aureus | LPS | Optuna:  93%|█████████▎| 186/200 [6:03:39<22:32, 96.61s/it, best=0.888]Staphylococcus_Aureus | LPS | Optuna:  93%|█████████▎| 186/200 [6:03:39<22:32, 96.61s/it, best=0.888][I 2026-02-28 14:11:02,520] Trial 24 finished with value: 0.9197978796858385 and parameters: {'activation': 'identity', 'solver': 'adam', 'lr': 0.0006671724260361015, 'layer1': 210, 'layer2': 356, 'layer3': 460}. Best is trial 20 with value: 0.9222781385346849.
Klebsiella_Pneumoniae | DirectMulti | Optuna:  12%|█▎        | 25/200 [44:48<4:36:07, 94.67s/it, best=0.922] Klebsiella_Pneumoniae | DirectMulti | Optuna:  12%|█▎        | 25/200 [44:48<4:36:07, 94.67s/it, best=0.922][I 2026-02-28 14:11:17,324] Trial 175 finished with value: 0.9170284245835123 and parameters: {'activation': 'relu', 'solver': 'adam', 'lr': 0.00048704292933464703, 'layer1': 354, 'layer2': 294, 'layer3': 143}. Best is trial 175 with value: 0.9170284245835123.

Escherichia_Coli | Piperacillin-Tazobactam | Optuna:  88%|████████▊ | 176/200 [6:07:09<51:31, 128.81s/it, best=0.917][A
Escherichia_Coli | Piperacillin-Tazobactam | Optuna:  88%|████████▊ | 176/200 [6:07:09<51:31, 128.81s/it, best=0.917][A[I 2026-02-28 14:11:30,537] Trial 186 finished with value: 0.8857890262577376 and parameters: {'activation': 'identity', 'solver': 'adam', 'lr': 0.00046450184681611834, 'layer1': 149, 'layer2': 411, 'layer3': 330}. Best is trial 8 with value: 0.8879562150966016.
Staphylococcus_Aureus | LPS | Optuna:  94%|█████████▎| 187/200 [6:05:16<20:59, 96.87s/it, best=0.888]Staphylococcus_Aureus | LPS | Optuna:  94%|█████████▎| 187/200 [6:05:16<20:59, 96.87s/it, best=0.888][I 2026-02-28 14:12:46,609] Trial 25 finished with value: 0.9202861644902882 and parameters: {'activation': 'identity', 'solver': 'adam', 'lr': 5.799026941939013e-05, 'layer1': 295, 'layer2': 426, 'layer3': 375}. Best is trial 20 with value: 0.9222781385346849.
