Escherichia_Coli | Cefepime | Optuna:   2%|▏         | 3/200 [03:37<4:41:09, 85.63s/it, best=0.839][A[I 2026-02-28 15:02:20,688] Trial 60 finished with value: 0.9208437837154924 and parameters: {'activation': 'identity', 'solver': 'adam', 'lr': 0.0004077492646950723, 'layer1': 466, 'layer2': 277, 'layer3': 345}. Best is trial 20 with value: 0.9222781385346849.
Klebsiella_Pneumoniae | DirectMulti | Optuna:  30%|███       | 61/200 [1:36:06<3:10:31, 82.24s/it, best=0.922]Klebsiella_Pneumoniae | DirectMulti | Optuna:  30%|███       | 61/200 [1:36:06<3:10:31, 82.24s/it, best=0.922][I 2026-02-28 15:02:28,630] Trial 3 finished with value: 0.7594152198599939 and parameters: {'activation': 'relu', 'solver': 'sgd', 'lr': 1.6536937182824424e-05, 'layer1': 57, 'layer2': 345, 'layer3': 226}. Best is trial 2 with value: 0.838760235685536.

Escherichia_Coli | Cefepime | Optuna:   2%|▏         | 4/200 [04:53<4:26:53, 81.70s/it, best=0.839][A
Escherichia_Coli | Cefepime | Optuna:   2%|▏         | 4/200 [04:53<4:26:53, 81.70s/it, best=0.839][A[I 2026-02-28 15:03:07,127] Trial 13 finished with value: 0.8854966355859718 and parameters: {'activation': 'identity', 'solver': 'adam', 'lr': 0.00025548240574830476, 'layer1': 499, 'layer2': 471, 'layer3': 419}. Best is trial 13 with value: 0.8854966355859718.
Staphylococcus_Aureus | DirectMulti | Optuna:   7%|▋         | 14/200 [33:12<7:40:02, 148.40s/it, best=0.884]Staphylococcus_Aureus | DirectMulti | Optuna:   7%|▋         | 14/200 [33:12<7:40:02, 148.40s/it, best=0.885][I 2026-02-28 15:03:45,478] Trial 61 finished with value: 0.919974074340281 and parameters: {'activation': 'identity', 'solver': 'adam', 'lr': 0.0009778946500610033, 'layer1': 371, 'layer2': 457, 'layer3': 276}. Best is trial 20 with value: 0.9222781385346849.
Klebsiella_Pneumoniae | DirectMulti | Optuna:  31%|███       | 62/200 [1:37:31<3:10:54, 83.00s/it, best=0.922]Klebsiella_Pneumoniae | DirectMulti | Optuna:  31%|███       | 62/200 [1:37:31<3:10:54, 83.00s/it, best=0.922][I 2026-02-28 15:04:52,214] Trial 4 finished with value: 0.860890130658351 and parameters: {'activation': 'relu', 'solver': 'adam', 'lr': 1.7654048052495086e-05, 'layer1': 265, 'layer2': 278, 'layer3': 100}. Best is trial 4 with value: 0.860890130658351.

Escherichia_Coli | Cefepime | Optuna:   2%|▎         | 5/200 [07:16<5:38:03, 104.02s/it, best=0.839][A
Escherichia_Coli | Cefepime | Optuna:   2%|▎         | 5/200 [07:16<5:38:03, 104.02s/it, best=0.861][A[I 2026-02-28 15:05:18,280] Trial 62 finished with value: 0.9209267889568122 and parameters: {'activation': 'identity', 'solver': 'adam', 'lr': 0.0003756238966333874, 'layer1': 294, 'layer2': 433, 'layer3': 320}. Best is trial 20 with value: 0.9222781385346849.
Klebsiella_Pneumoniae | DirectMulti | Optuna:  32%|███▏      | 63/200 [1:39:03<3:16:14, 85.94s/it, best=0.922]Klebsiella_Pneumoniae | DirectMulti | Optuna:  32%|███▏      | 63/200 [1:39:03<3:16:14, 85.94s/it, best=0.922][I 2026-02-28 15:05:34,680] Trial 14 finished with value: 0.8842484380440456 and parameters: {'activation': 'identity', 'solver': 'adam', 'lr': 0.00013839971926370072, 'layer1': 499, 'layer2': 394, 'layer3': 414}. Best is trial 13 with value: 0.8854966355859718.
Staphylococcus_Aureus | DirectMulti | Optuna:   8%|▊         | 15/200 [35:40<7:36:46, 148.14s/it, best=0.885]Staphylococcus_Aureus | DirectMulti | Optuna:   8%|▊         | 15/200 [35:40<7:36:46, 148.14s/it, best=0.885][I 2026-02-28 15:07:12,372] Trial 63 finished with value: 0.9200857567443167 and parameters: {'activation': 'identity', 'solver': 'adam', 'lr': 0.000832179522896472, 'layer1': 347, 'layer2': 476, 'layer3': 305}. Best is trial 20 with value: 0.9222781385346849.
Klebsiella_Pneumoniae | DirectMulti | Optuna:  32%|███▏      | 64/200 [1:40:58<3:33:56, 94.39s/it, best=0.922]Klebsiella_Pneumoniae | DirectMulti | Optuna:  32%|███▏      | 64/200 [1:40:58<3:33:56, 94.39s/it, best=0.922][I 2026-02-28 15:08:19,963] Trial 15 finished with value: 0.8852187787075678 and parameters: {'activation': 'identity', 'solver': 'adam', 'lr': 0.0003521954261532511, 'layer1': 497, 'layer2': 499, 'layer3': 500}. Best is trial 13 with value: 0.8854966355859718.
Staphylococcus_Aureus | DirectMulti | Optuna:   8%|▊         | 16/200 [38:25<7:50:07, 153.30s/it, best=0.885]Staphylococcus_Aureus | DirectMulti | Optuna:   8%|▊         | 16/200 [38:25<7:50:07, 153.30s/it, best=0.885][I 2026-02-28 15:08:29,612] Trial 5 finished with value: 0.8050712241721678 and parameters: {'activation': 'identity', 'solver': 'adam', 'lr': 2.259279742015697e-06, 'layer1': 106, 'layer2': 32, 'layer3': 169}. Best is trial 4 with value: 0.860890130658351.

Escherichia_Coli | Cefepime | Optuna:   3%|▎         | 6/200 [10:54<7:40:57, 142.57s/it, best=0.861][A
Escherichia_Coli | Cefepime | Optuna:   3%|▎         | 6/200 [10:54<7:40:57, 142.57s/it, best=0.861][A[I 2026-02-28 15:09:30,994] Trial 64 finished with value: 0.8855869037725197 and parameters: {'activation': 'identity', 'solver': 'adam', 'lr': 1.099303223166819e-06, 'layer1': 319, 'layer2': 499, 'layer3': 399}. Best is trial 20 with value: 0.9222781385346849.
Klebsiella_Pneumoniae | DirectMulti | Optuna:  32%|███▎      | 65/200 [1:43:16<4:02:13, 107.66s/it, best=0.922]Klebsiella_Pneumoniae | DirectMulti | Optuna:  32%|███▎      | 65/200 [1:43:16<4:02:13, 107.66s/it, best=0.922][I 2026-02-28 15:10:39,376] Trial 65 finished with value: 0.9208823129484637 and parameters: {'activation': 'identity', 'solver': 'adam', 'lr': 0.00015279343514102697, 'layer1': 107, 'layer2': 416, 'layer3': 224}. Best is trial 20 with value: 0.9222781385346849.
Klebsiella_Pneumoniae | DirectMulti | Optuna:  33%|███▎      | 66/200 [1:44:25<3:34:07, 95.88s/it, best=0.922] Klebsiella_Pneumoniae | DirectMulti | Optuna:  33%|███▎      | 66/200 [1:44:25<3:34:07, 95.88s/it, best=0.922][I 2026-02-28 15:11:28,253] Trial 16 finished with value: 0.8803725036856488 and parameters: {'activation': 'identity', 'solver': 'adam', 'lr': 0.004672039002891583, 'layer1': 499, 'layer2': 500, 'layer3': 487}. Best is trial 13 with value: 0.8854966355859718.
Staphylococcus_Aureus | DirectMulti | Optuna:   8%|▊         | 17/200 [41:33<8:19:39, 163.82s/it, best=0.885]Staphylococcus_Aureus | DirectMulti | Optuna:   8%|▊         | 17/200 [41:33<8:19:39, 163.82s/it, best=0.885][I 2026-02-28 15:11:49,342] Trial 66 finished with value: 0.9198921496086732 and parameters: {'activation': 'identity', 'solver': 'adam', 'lr': 0.0005708580266368372, 'layer1': 338, 'layer2': 98, 'layer3': 249}. Best is trial 20 with value: 0.9222781385346849.
Klebsiella_Pneumoniae | DirectMulti | Optuna:  34%|███▎      | 67/200 [1:45:35<3:15:17, 88.10s/it, best=0.922]Klebsiella_Pneumoniae | DirectMulti | Optuna:  34%|███▎      | 67/200 [1:45:35<3:15:17, 88.10s/it, best=0.922][I 2026-02-28 15:12:30,761] Trial 67 finished with value: 0.9214038877723327 and parameters: {'activation': 'tanh', 'solver': 'adam', 'lr': 0.00025795286911283794, 'layer1': 33, 'layer2': 448, 'layer3': 295}. Best is trial 20 with value: 0.9222781385346849.
Klebsiella_Pneumoniae | DirectMulti | Optuna:  34%|███▍      | 68/200 [1:46:16<2:43:00, 74.10s/it, best=0.922]Klebsiella_Pneumoniae | DirectMulti | Optuna:  34%|███▍      | 68/200 [1:46:16<2:43:00, 74.10s/it, best=0.922][I 2026-02-28 15:14:00,631] Trial 68 finished with value: 0.9185596822825559 and parameters: {'activation': 'tanh', 'solver': 'adam', 'lr': 0.00032324481519442134, 'layer1': 387, 'layer2': 388, 'layer3': 330}. Best is trial 20 with value: 0.9222781385346849.
Klebsiella_Pneumoniae | DirectMulti | Optuna:  34%|███▍      | 69/200 [1:47:46<2:52:06, 78.83s/it, best=0.922]Klebsiella_Pneumoniae | DirectMulti | Optuna:  34%|███▍      | 69/200 [1:47:46<2:52:06, 78.83s/it, best=0.922][I 2026-02-28 15:14:16,483] Trial 17 finished with value: 0.8849716193254004 and parameters: {'activation': 'identity', 'solver': 'adam', 'lr': 0.0003599385347305055, 'layer1': 438, 'layer2': 381, 'layer3': 421}. Best is trial 13 with value: 0.8854966355859718.
Staphylococcus_Aureus | DirectMulti | Optuna:   9%|▉         | 18/200 [44:21<8:20:56, 165.15s/it, best=0.885]Staphylococcus_Aureus | DirectMulti | Optuna:   9%|▉         | 18/200 [44:21<8:20:56, 165.15s/it, best=0.885][I 2026-02-28 15:14:36,361] Trial 6 finished with value: 0.8698505653024711 and parameters: {'activation': 'tanh', 'solver': 'adam', 'lr': 3.6618192203924288e-06, 'layer1': 403, 'layer2': 46, 'layer3': 494}. Best is trial 6 with value: 0.8698505653024711.

Escherichia_Coli | Cefepime | Optuna:   4%|▎         | 7/200 [17:01<11:34:20, 215.86s/it, best=0.861][A
Escherichia_Coli | Cefepime | Optuna:   4%|▎         | 7/200 [17:01<11:34:20, 215.86s/it, best=0.87] [A[I 2026-02-28 15:15:16,609] Trial 7 finished with value: 0.8840705018515047 and parameters: {'activation': 'relu', 'solver': 'adam', 'lr': 0.0012164139351417069, 'layer1': 46, 'layer2': 186, 'layer3': 66}. Best is trial 7 with value: 0.8840705018515047.

Escherichia_Coli | Cefepime | Optuna:   4%|▍         | 8/200 [17:41<8:31:50, 159.95s/it, best=0.87] [A
Escherichia_Coli | Cefepime | Optuna:   4%|▍         | 8/200 [17:41<8:31:50, 159.95s/it, best=0.884][A[I 2026-02-28 15:15:22,372] Trial 69 finished with value: 0.9201631242825933 and parameters: {'activation': 'tanh', 'solver': 'adam', 'lr': 0.00024775717104759127, 'layer1': 268, 'layer2': 447, 'layer3': 297}. Best is trial 20 with value: 0.9222781385346849.
Klebsiella_Pneumoniae | DirectMulti | Optuna:  35%|███▌      | 70/200 [1:49:08<2:52:41, 79.70s/it, best=0.922]Klebsiella_Pneumoniae | DirectMulti | Optuna:  35%|███▌      | 70/200 [1:49:08<2:52:41, 79.70s/it, best=0.922][I 2026-02-28 15:15:47,253] Trial 70 finished with value: 0.8707845325150105 and parameters: {'activation': 'tanh', 'solver': 'sgd', 'lr': 0.0032781875342319717, 'layer1': 39, 'layer2': 335, 'layer3': 369}. Best is trial 20 with value: 0.9222781385346849.
Klebsiella_Pneumoniae | DirectMulti | Optuna:  36%|███▌      | 71/200 [1:49:32<2:16:00, 63.26s/it, best=0.922]Klebsiella_Pneumoniae | DirectMulti | Optuna:  36%|███▌      | 71/200 [1:49:32<2:16:00, 63.26s/it, best=0.922][I 2026-02-28 15:16:51,449] Trial 71 finished with value: 0.9223964650152305 and parameters: {'activation': 'tanh', 'solver': 'adam', 'lr': 0.00011326045034656219, 'layer1': 33, 'layer2': 469, 'layer3': 273}. Best is trial 71 with value: 0.9223964650152305.
Klebsiella_Pneumoniae | DirectMulti | Optuna:  36%|███▌      | 72/200 [1:50:37<2:15:32, 63.54s/it, best=0.922]Klebsiella_Pneumoniae | DirectMulti | Optuna:  36%|███▌      | 72/200 [1:50:37<2:15:32, 63.54s/it, best=0.922][I 2026-02-28 15:17:21,769] Trial 8 finished with value: 0.8789075818517326 and parameters: {'activation': 'identity', 'solver': 'adam', 'lr': 0.000828752236376816, 'layer1': 323, 'layer2': 445, 'layer3': 241}. Best is trial 7 with value: 0.8840705018515047.

Escherichia_Coli | Cefepime | Optuna:   4%|▍         | 9/200 [19:46<7:54:33, 149.08s/it, best=0.884][A
Escherichia_Coli | Cefepime | Optuna:   4%|▍         | 9/200 [19:46<7:54:33, 149.08s/it, best=0.884][A[I 2026-02-28 15:18:20,152] Trial 72 finished with value: 0.9204748750609999 and parameters: {'activation': 'tanh', 'solver': 'adam', 'lr': 9.826739866792979e-05, 'layer1': 306, 'layer2': 463, 'layer3': 271}. Best is trial 71 with value: 0.9223964650152305.
Klebsiella_Pneumoniae | DirectMulti | Optuna:  36%|███▋      | 73/200 [1:52:05<2:30:28, 71.09s/it, best=0.922]Klebsiella_Pneumoniae | DirectMulti | Optuna:  36%|███▋      | 73/200 [1:52:05<2:30:28, 71.09s/it, best=0.922][I 2026-02-28 15:18:40,442] Trial 9 finished with value: 0.7604092865081536 and parameters: {'activation': 'tanh', 'solver': 'sgd', 'lr': 0.00012329098365270507, 'layer1': 219, 'layer2': 22, 'layer3': 62}. Best is trial 7 with value: 0.8840705018515047.

Escherichia_Coli | Cefepime | Optuna:   5%|▌         | 10/200 [21:05<6:43:14, 127.34s/it, best=0.884][A
Escherichia_Coli | Cefepime | Optuna:   5%|▌         | 10/200 [21:05<6:43:14, 127.34s/it, best=0.884][A[I 2026-02-28 15:19:01,361] Trial 10 finished with value: 0.7550013187334347 and parameters: {'activation': 'relu', 'solver': 'sgd', 'lr': 0.007553503645583194, 'layer1': 18, 'layer2': 151, 'layer3': 348}. Best is trial 7 with value: 0.8840705018515047.

Escherichia_Coli | Cefepime | Optuna:   6%|▌         | 11/200 [21:26<4:58:31, 94.77s/it, best=0.884] [A
Escherichia_Coli | Cefepime | Optuna:   6%|▌         | 11/200 [21:26<4:58:31, 94.77s/it, best=0.884][A[I 2026-02-28 15:19:04,865] Trial 18 finished with value: 0.7484612288417706 and parameters: {'activation': 'tanh', 'solver': 'sgd', 'lr': 4.461490172540617e-05, 'layer1': 460, 'layer2': 452, 'layer3': 379}. Best is trial 13 with value: 0.8854966355859718.
Staphylococcus_Aureus | DirectMulti | Optuna:  10%|▉         | 19/200 [49:10<10:09:50, 202.16s/it, best=0.885]Staphylococcus_Aureus | DirectMulti | Optuna:  10%|▉         | 19/200 [49:10<10:09:50, 202.16s/it, best=0.885][I 2026-02-28 15:19:33,127] Trial 73 finished with value: 0.9223216659905829 and parameters: {'activation': 'tanh', 'solver': 'adam', 'lr': 7.40460986796027e-05, 'layer1': 36, 'layer2': 434, 'layer3': 350}. Best is trial 71 with value: 0.9223964650152305.
Klebsiella_Pneumoniae | DirectMulti | Optuna:  37%|███▋      | 74/200 [1:53:18<2:30:28, 71.65s/it, best=0.922]Klebsiella_Pneumoniae | DirectMulti | Optuna:  37%|███▋      | 74/200 [1:53:18<2:30:28, 71.65s/it, best=0.922][I 2026-02-28 15:21:00,856] Trial 19 finished with value: 0.8746119581154023 and parameters: {'activation': 'logistic', 'solver': 'adam', 'lr': 0.0022811669873826347, 'layer1': 402, 'layer2': 384, 'layer3': 466}. Best is trial 13 with value: 0.8854966355859718.
Staphylococcus_Aureus | DirectMulti | Optuna:  10%|█         | 20/200 [51:06<8:48:51, 176.29s/it, best=0.885] Staphylococcus_Aureus | DirectMulti | Optuna:  10%|█         | 20/200 [51:06<8:48:51, 176.29s/it, best=0.885][I 2026-02-28 15:21:16,534] Trial 11 finished with value: 0.8815404378001434 and parameters: {'activation': 'identity', 'solver': 'adam', 'lr': 0.0013124793805688133, 'layer1': 347, 'layer2': 497, 'layer3': 312}. Best is trial 7 with value: 0.8840705018515047.

Escherichia_Coli | Cefepime | Optuna:   6%|▌         | 12/200 [23:41<5:35:27, 107.06s/it, best=0.884][A
Escherichia_Coli | Cefepime | Optuna:   6%|▌         | 12/200 [23:41<5:35:27, 107.06s/it, best=0.884][A[I 2026-02-28 15:21:23,224] Trial 74 finished with value: 0.9214666543853969 and parameters: {'activation': 'tanh', 'solver': 'adam', 'lr': 2.9654935407327846e-05, 'layer1': 60, 'layer2': 432, 'layer3': 347}. Best is trial 71 with value: 0.9223964650152305.
Klebsiella_Pneumoniae | DirectMulti | Optuna:  38%|███▊      | 75/200 [1:55:08<2:53:18, 83.19s/it, best=0.922]Klebsiella_Pneumoniae | DirectMulti | Optuna:  38%|███▊      | 75/200 [1:55:08<2:53:18, 83.19s/it, best=0.922][I 2026-02-28 15:22:40,227] Trial 20 finished with value: 0.8838054275562793 and parameters: {'activation': 'identity', 'solver': 'adam', 'lr': 0.0002900164996271944, 'layer1': 201, 'layer2': 119, 'layer3': 448}. Best is trial 13 with value: 0.8854966355859718.
Staphylococcus_Aureus | DirectMulti | Optuna:  10%|█         | 21/200 [52:45<7:37:02, 153.20s/it, best=0.885]Staphylococcus_Aureus | DirectMulti | Optuna:  10%|█         | 21/200 [52:45<7:37:02, 153.20s/it, best=0.885][I 2026-02-28 15:22:44,936] Trial 75 finished with value: 0.9196957586315333 and parameters: {'activation': 'tanh', 'solver': 'adam', 'lr': 3.606639082493287e-05, 'layer1': 61, 'layer2': 431, 'layer3': 293}. Best is trial 71 with value: 0.9223964650152305.
Klebsiella_Pneumoniae | DirectMulti | Optuna:  38%|███▊      | 76/200 [1:56:30<2:51:00, 82.74s/it, best=0.922]Klebsiella_Pneumoniae | DirectMulti | Optuna:  38%|███▊      | 76/200 [1:56:30<2:51:00, 82.74s/it, best=0.922][I 2026-02-28 15:23:07,916] Trial 12 finished with value: 0.8804735593348593 and parameters: {'activation': 'identity', 'solver': 'adam', 'lr': 0.0016137610321187168, 'layer1': 166, 'layer2': 496, 'layer3': 351}. Best is trial 7 with value: 0.8840705018515047.

Escherichia_Coli | Cefepime | Optuna:   6%|▋         | 13/200 [25:32<5:37:45, 108.37s/it, best=0.884][A
Escherichia_Coli | Cefepime | Optuna:   6%|▋         | 13/200 [25:32<5:37:45, 108.37s/it, best=0.884][A[I 2026-02-28 15:24:49,556] Trial 76 finished with value: 0.9021487031354848 and parameters: {'activation': 'tanh', 'solver': 'adam', 'lr': 1.2452295359385467e-05, 'layer1': 38, 'layer2': 472, 'layer3': 397}. Best is trial 71 with value: 0.9223964650152305.
Klebsiella_Pneumoniae | DirectMulti | Optuna:  38%|███▊      | 77/200 [1:58:35<3:15:22, 95.31s/it, best=0.922]Klebsiella_Pneumoniae | DirectMulti | Optuna:  38%|███▊      | 77/200 [1:58:35<3:15:22, 95.31s/it, best=0.922][I 2026-02-28 15:25:07,046] Trial 13 finished with value: 0.8883508463272966 and parameters: {'activation': 'relu', 'solver': 'adam', 'lr': 0.00037540926788082424, 'layer1': 494, 'layer2': 131, 'layer3': 438}. Best is trial 13 with value: 0.8883508463272966.

Escherichia_Coli | Cefepime | Optuna:   7%|▋         | 14/200 [27:31<5:46:01, 111.62s/it, best=0.884][A
Escherichia_Coli | Cefepime | Optuna:   7%|▋         | 14/200 [27:31<5:46:01, 111.62s/it, best=0.888][A[I 2026-02-28 15:25:22,854] Trial 21 finished with value: 0.8846854591202638 and parameters: {'activation': 'identity', 'solver': 'adam', 'lr': 0.0003999508858896578, 'layer1': 448, 'layer2': 398, 'layer3': 368}. Best is trial 13 with value: 0.8854966355859718.
Staphylococcus_Aureus | DirectMulti | Optuna:  11%|█         | 22/200 [55:28<7:42:53, 156.03s/it, best=0.885]Staphylococcus_Aureus | DirectMulti | Optuna:  11%|█         | 22/200 [55:28<7:42:53, 156.03s/it, best=0.885][I 2026-02-28 15:26:04,680] Trial 77 finished with value: 0.920823941078486 and parameters: {'activation': 'tanh', 'solver': 'adam', 'lr': 7.29919486387923e-05, 'layer1': 61, 'layer2': 452, 'layer3': 344}. Best is trial 71 with value: 0.9223964650152305.
Klebsiella_Pneumoniae | DirectMulti | Optuna:  39%|███▉      | 78/200 [1:59:50<3:01:28, 89.25s/it, best=0.922]Klebsiella_Pneumoniae | DirectMulti | Optuna:  39%|███▉      | 78/200 [1:59:50<3:01:28, 89.25s/it, best=0.922][I 2026-02-28 15:27:01,440] Trial 14 finished with value: 0.8911503569339929 and parameters: {'activation': 'relu', 'solver': 'adam', 'lr': 0.00017418893870326793, 'layer1': 499, 'layer2': 142, 'layer3': 475}. Best is trial 14 with value: 0.8911503569339929.

Escherichia_Coli | Cefepime | Optuna:   8%|▊         | 15/200 [29:26<5:46:44, 112.46s/it, best=0.888][A
Escherichia_Coli | Cefepime | Optuna:   8%|▊         | 15/200 [29:26<5:46:44, 112.46s/it, best=0.891][A[I 2026-02-28 15:27:56,215] Trial 78 finished with value: 0.919603872812526 and parameters: {'activation': 'tanh', 'solver': 'adam', 'lr': 2.5572516400571706e-05, 'layer1': 29, 'layer2': 418, 'layer3': 326}. Best is trial 71 with value: 0.9223964650152305.
Klebsiella_Pneumoniae | DirectMulti | Optuna:  40%|███▉      | 79/200 [2:01:41<3:13:28, 95.94s/it, best=0.922]Klebsiella_Pneumoniae | DirectMulti | Optuna:  40%|███▉      | 79/200 [2:01:41<3:13:28, 95.94s/it, best=0.922][I 2026-02-28 15:28:05,402] Trial 22 finished with value: 0.8834019715407676 and parameters: {'activation': 'identity', 'solver': 'adam', 'lr': 6.199395279584059e-05, 'layer1': 474, 'layer2': 466, 'layer3': 426}. Best is trial 13 with value: 0.8854966355859718.
Staphylococcus_Aureus | DirectMulti | Optuna:  12%|█▏        | 23/200 [58:10<7:46:03, 157.99s/it, best=0.885]Staphylococcus_Aureus | DirectMulti | Optuna:  12%|█▏        | 23/200 [58:10<7:46:03, 157.99s/it, best=0.885][I 2026-02-28 15:28:52,925] Trial 15 finished with value: 0.8885138332097625 and parameters: {'activation': 'relu', 'solver': 'adam', 'lr': 0.00013585468194914787, 'layer1': 499, 'layer2': 125, 'layer3': 500}. Best is trial 14 with value: 0.8911503569339929.

Escherichia_Coli | Cefepime | Optuna:   8%|▊         | 16/200 [31:17<5:43:58, 112.16s/it, best=0.891][A
Escherichia_Coli | Cefepime | Optuna:   8%|▊         | 16/200 [31:17<5:43:58, 112.16s/it, best=0.891][A[I 2026-02-28 15:30:16,527] Trial 79 finished with value: 0.9203116127186307 and parameters: {'activation': 'tanh', 'solver': 'adam', 'lr': 2.0163455691620963e-05, 'layer1': 96, 'layer2': 435, 'layer3': 250}. Best is trial 71 with value: 0.9223964650152305.
Klebsiella_Pneumoniae | DirectMulti | Optuna:  40%|████      | 80/200 [2:04:02<3:38:29, 109.25s/it, best=0.922]Klebsiella_Pneumoniae | DirectMulti | Optuna:  40%|████      | 80/200 [2:04:02<3:38:29, 109.25s/it, best=0.922][I 2026-02-28 15:30:16,743] Trial 23 finished with value: 0.8843484783266963 and parameters: {'activation': 'identity', 'solver': 'adam', 'lr': 0.0002201025770024091, 'layer1': 406, 'layer2': 364, 'layer3': 340}. Best is trial 13 with value: 0.8854966355859718.
Staphylococcus_Aureus | DirectMulti | Optuna:  12%|█▏        | 24/200 [1:00:22<7:19:58, 149.99s/it, best=0.885]Staphylococcus_Aureus | DirectMulti | Optuna:  12%|█▏        | 24/200 [1:00:22<7:19:58, 149.99s/it, best=0.885][I 2026-02-28 15:31:13,790] Trial 16 finished with value: 0.8893449892028567 and parameters: {'activation': 'relu', 'solver': 'adam', 'lr': 7.054382978969143e-05, 'layer1': 499, 'layer2': 104, 'layer3': 488}. Best is trial 14 with value: 0.8911503569339929.

Escherichia_Coli | Cefepime | Optuna:   8%|▊         | 17/200 [33:38<6:08:25, 120.79s/it, best=0.891][A
Escherichia_Coli | Cefepime | Optuna:   8%|▊         | 17/200 [33:38<6:08:25, 120.79s/it, best=0.891][A[I 2026-02-28 15:33:03,875] Trial 17 finished with value: 0.8876432249526834 and parameters: {'activation': 'relu', 'solver': 'adam', 'lr': 6.446221903608035e-05, 'layer1': 423, 'layer2': 93, 'layer3': 427}. Best is trial 14 with value: 0.8911503569339929.

Escherichia_Coli | Cefepime | Optuna:   9%|▉         | 18/200 [35:28<5:56:38, 117.58s/it, best=0.891][A
