Escherichia_Coli | Cefepime | Optuna:  18%|█▊        | 35/200 [1:02:46<5:05:54, 111.24s/it, best=0.891][A[I 2026-02-28 16:00:56,122] Trial 98 finished with value: 0.9216153276323261 and parameters: {'activation': 'tanh', 'solver': 'adam', 'lr': 6.048784514978431e-05, 'layer1': 66, 'layer2': 500, 'layer3': 461}. Best is trial 84 with value: 0.9228685877627578.
Klebsiella_Pneumoniae | DirectMulti | Optuna:  50%|████▉     | 99/200 [2:34:41<2:40:43, 95.48s/it, best=0.923]Klebsiella_Pneumoniae | DirectMulti | Optuna:  50%|████▉     | 99/200 [2:34:41<2:40:43, 95.48s/it, best=0.923][I 2026-02-28 16:01:00,890] Trial 35 finished with value: 0.7558753267241649 and parameters: {'activation': 'relu', 'solver': 'adam', 'lr': 7.811352829507434e-06, 'layer1': 222, 'layer2': 193, 'layer3': 474}. Best is trial 14 with value: 0.8911503569339929.

Escherichia_Coli | Cefepime | Optuna:  18%|█▊        | 36/200 [1:03:25<4:05:11, 89.71s/it, best=0.891] [A
Escherichia_Coli | Cefepime | Optuna:  18%|█▊        | 36/200 [1:03:25<4:05:11, 89.71s/it, best=0.891][A[I 2026-02-28 16:02:55,422] Trial 35 finished with value: 0.8576258532990684 and parameters: {'activation': 'logistic', 'solver': 'adam', 'lr': 8.812713149924837e-05, 'layer1': 466, 'layer2': 342, 'layer3': 212}. Best is trial 30 with value: 0.8867563884140054.
Staphylococcus_Aureus | DirectMulti | Optuna:  18%|█▊        | 36/200 [1:33:00<8:28:52, 186.17s/it, best=0.887]Staphylococcus_Aureus | DirectMulti | Optuna:  18%|█▊        | 36/200 [1:33:00<8:28:52, 186.17s/it, best=0.887][I 2026-02-28 16:03:00,094] Trial 99 finished with value: 0.9211295868385319 and parameters: {'activation': 'tanh', 'solver': 'adam', 'lr': 3.779576035633486e-05, 'layer1': 91, 'layer2': 456, 'layer3': 395}. Best is trial 84 with value: 0.9228685877627578.
Klebsiella_Pneumoniae | DirectMulti | Optuna:  50%|█████     | 100/200 [2:36:45<2:53:22, 104.03s/it, best=0.923]Klebsiella_Pneumoniae | DirectMulti | Optuna:  50%|█████     | 100/200 [2:36:45<2:53:22, 104.03s/it, best=0.923][I 2026-02-28 16:03:20,176] Trial 100 finished with value: 0.4626531348877404 and parameters: {'activation': 'logistic', 'solver': 'sgd', 'lr': 3.712230363602767e-06, 'layer1': 20, 'layer2': 469, 'layer3': 436}. Best is trial 84 with value: 0.9228685877627578.
Klebsiella_Pneumoniae | DirectMulti | Optuna:  50%|█████     | 101/200 [2:37:05<2:10:05, 78.84s/it, best=0.923] Klebsiella_Pneumoniae | DirectMulti | Optuna:  50%|█████     | 101/200 [2:37:05<2:10:05, 78.84s/it, best=0.923][I 2026-02-28 16:03:30,809] Trial 36 finished with value: 0.8891773033311852 and parameters: {'activation': 'relu', 'solver': 'adam', 'lr': 0.00022278341994708825, 'layer1': 468, 'layer2': 244, 'layer3': 423}. Best is trial 14 with value: 0.8911503569339929.

Escherichia_Coli | Cefepime | Optuna:  18%|█▊        | 37/200 [1:05:55<4:52:46, 107.77s/it, best=0.891][A
Escherichia_Coli | Cefepime | Optuna:  18%|█▊        | 37/200 [1:05:55<4:52:46, 107.77s/it, best=0.891][A[I 2026-02-28 16:04:09,231] Trial 37 finished with value: 0.7550013187334347 and parameters: {'activation': 'logistic', 'solver': 'adam', 'lr': 2.191703007719964e-05, 'layer1': 300, 'layer2': 314, 'layer3': 154}. Best is trial 14 with value: 0.8911503569339929.

Escherichia_Coli | Cefepime | Optuna:  19%|█▉        | 38/200 [1:06:34<3:54:48, 86.97s/it, best=0.891] [A
Escherichia_Coli | Cefepime | Optuna:  19%|█▉        | 38/200 [1:06:34<3:54:48, 86.97s/it, best=0.891][A[I 2026-02-28 16:04:48,304] Trial 101 finished with value: 0.9215087339173307 and parameters: {'activation': 'tanh', 'solver': 'adam', 'lr': 5.300941149146894e-05, 'layer1': 13, 'layer2': 478, 'layer3': 369}. Best is trial 84 with value: 0.9228685877627578.
Klebsiella_Pneumoniae | DirectMulti | Optuna:  51%|█████     | 102/200 [2:38:33<2:13:19, 81.63s/it, best=0.923]Klebsiella_Pneumoniae | DirectMulti | Optuna:  51%|█████     | 102/200 [2:38:33<2:13:19, 81.63s/it, best=0.923][I 2026-02-28 16:04:51,272] Trial 36 finished with value: 0.8810326909245518 and parameters: {'activation': 'relu', 'solver': 'adam', 'lr': 0.0006471847171123247, 'layer1': 425, 'layer2': 454, 'layer3': 309}. Best is trial 30 with value: 0.8867563884140054.
Staphylococcus_Aureus | DirectMulti | Optuna:  18%|█▊        | 37/200 [1:34:56<7:28:27, 165.08s/it, best=0.887]Staphylococcus_Aureus | DirectMulti | Optuna:  18%|█▊        | 37/200 [1:34:56<7:28:27, 165.08s/it, best=0.887][I 2026-02-28 16:05:56,635] Trial 102 finished with value: 0.9207009138604304 and parameters: {'activation': 'tanh', 'solver': 'adam', 'lr': 0.00011626836993204752, 'layer1': 30, 'layer2': 491, 'layer3': 378}. Best is trial 84 with value: 0.9228685877627578.
Klebsiella_Pneumoniae | DirectMulti | Optuna:  52%|█████▏    | 103/200 [2:39:42<2:05:30, 77.64s/it, best=0.923]Klebsiella_Pneumoniae | DirectMulti | Optuna:  52%|█████▏    | 103/200 [2:39:42<2:05:30, 77.64s/it, best=0.923][I 2026-02-28 16:06:56,186] Trial 37 finished with value: 0.8782052361445233 and parameters: {'activation': 'identity', 'solver': 'adam', 'lr': 0.009659354325802812, 'layer1': 381, 'layer2': 360, 'layer3': 461}. Best is trial 30 with value: 0.8867563884140054.
Staphylococcus_Aureus | DirectMulti | Optuna:  19%|█▉        | 38/200 [1:37:01<6:53:10, 153.03s/it, best=0.887]Staphylococcus_Aureus | DirectMulti | Optuna:  19%|█▉        | 38/200 [1:37:01<6:53:10, 153.03s/it, best=0.887][I 2026-02-28 16:07:13,763] Trial 103 finished with value: 0.9206171273111707 and parameters: {'activation': 'tanh', 'solver': 'adam', 'lr': 7.699530679541807e-05, 'layer1': 54, 'layer2': 464, 'layer3': 422}. Best is trial 84 with value: 0.9228685877627578.
Klebsiella_Pneumoniae | DirectMulti | Optuna:  52%|█████▏    | 104/200 [2:40:59<2:03:58, 77.49s/it, best=0.923]Klebsiella_Pneumoniae | DirectMulti | Optuna:  52%|█████▏    | 104/200 [2:40:59<2:03:58, 77.49s/it, best=0.923][I 2026-02-28 16:07:36,400] Trial 38 finished with value: 0.8032720728585186 and parameters: {'activation': 'identity', 'solver': 'sgd', 'lr': 0.002434988088773464, 'layer1': 479, 'layer2': 295, 'layer3': 434}. Best is trial 30 with value: 0.8867563884140054.
Staphylococcus_Aureus | DirectMulti | Optuna:  20%|█▉        | 39/200 [1:37:41<5:19:48, 119.18s/it, best=0.887]Staphylococcus_Aureus | DirectMulti | Optuna:  20%|█▉        | 39/200 [1:37:41<5:19:48, 119.18s/it, best=0.887][I 2026-02-28 16:08:17,743] Trial 39 finished with value: 0.8029672594930959 and parameters: {'activation': 'relu', 'solver': 'adam', 'lr': 9.88773796081105e-06, 'layer1': 434, 'layer2': 468, 'layer3': 499}. Best is trial 30 with value: 0.8867563884140054.
Staphylococcus_Aureus | DirectMulti | Optuna:  20%|██        | 40/200 [1:38:23<4:15:33, 95.83s/it, best=0.887] Staphylococcus_Aureus | DirectMulti | Optuna:  20%|██        | 40/200 [1:38:23<4:15:33, 95.83s/it, best=0.887][I 2026-02-28 16:08:22,008] Trial 38 finished with value: 0.7606503745983625 and parameters: {'activation': 'relu', 'solver': 'sgd', 'lr': 7.1915691584183725e-06, 'layer1': 469, 'layer2': 251, 'layer3': 415}. Best is trial 14 with value: 0.8911503569339929.

Escherichia_Coli | Cefepime | Optuna:  20%|█▉        | 39/200 [1:10:46<6:06:50, 136.71s/it, best=0.891][A
Escherichia_Coli | Cefepime | Optuna:  20%|█▉        | 39/200 [1:10:46<6:06:50, 136.71s/it, best=0.891][A[I 2026-02-28 16:08:26,360] Trial 104 finished with value: 0.9165823073171854 and parameters: {'activation': 'relu', 'solver': 'adam', 'lr': 0.0001483424813656371, 'layer1': 68, 'layer2': 453, 'layer3': 362}. Best is trial 84 with value: 0.9228685877627578.
Klebsiella_Pneumoniae | DirectMulti | Optuna:  52%|█████▎    | 105/200 [2:42:12<2:00:21, 76.02s/it, best=0.923]Klebsiella_Pneumoniae | DirectMulti | Optuna:  52%|█████▎    | 105/200 [2:42:12<2:00:21, 76.02s/it, best=0.923][I 2026-02-28 16:09:37,486] Trial 105 finished with value: 0.9205284550853019 and parameters: {'activation': 'tanh', 'solver': 'adam', 'lr': 0.0001018345737470803, 'layer1': 44, 'layer2': 444, 'layer3': 338}. Best is trial 84 with value: 0.9228685877627578.
Klebsiella_Pneumoniae | DirectMulti | Optuna:  53%|█████▎    | 106/200 [2:43:23<1:56:47, 74.55s/it, best=0.923]Klebsiella_Pneumoniae | DirectMulti | Optuna:  53%|█████▎    | 106/200 [2:43:23<1:56:47, 74.55s/it, best=0.923][I 2026-02-28 16:10:10,306] Trial 40 finished with value: 0.8869621040536522 and parameters: {'activation': 'tanh', 'solver': 'adam', 'lr': 0.00017876211704882054, 'layer1': 463, 'layer2': 325, 'layer3': 262}. Best is trial 40 with value: 0.8869621040536522.
Staphylococcus_Aureus | DirectMulti | Optuna:  20%|██        | 41/200 [1:40:15<4:27:15, 100.85s/it, best=0.887]Staphylococcus_Aureus | DirectMulti | Optuna:  20%|██        | 41/200 [1:40:15<4:27:15, 100.85s/it, best=0.887][I 2026-02-28 16:10:27,920] Trial 39 finished with value: 0.8903881858061059 and parameters: {'activation': 'relu', 'solver': 'adam', 'lr': 6.280641897607636e-05, 'layer1': 364, 'layer2': 364, 'layer3': 212}. Best is trial 14 with value: 0.8911503569339929.

Escherichia_Coli | Cefepime | Optuna:  20%|██        | 40/200 [1:12:52<5:55:55, 133.47s/it, best=0.891][A
Escherichia_Coli | Cefepime | Optuna:  20%|██        | 40/200 [1:12:52<5:55:55, 133.47s/it, best=0.891][A[I 2026-02-28 16:11:50,237] Trial 41 finished with value: 0.8859612645172623 and parameters: {'activation': 'tanh', 'solver': 'adam', 'lr': 0.0001686451596039753, 'layer1': 464, 'layer2': 211, 'layer3': 190}. Best is trial 40 with value: 0.8869621040536522.
Staphylococcus_Aureus | DirectMulti | Optuna:  21%|██        | 42/200 [1:41:55<4:24:50, 100.57s/it, best=0.887]Staphylococcus_Aureus | DirectMulti | Optuna:  21%|██        | 42/200 [1:41:55<4:24:50, 100.57s/it, best=0.887][I 2026-02-28 16:11:56,128] Trial 106 finished with value: 0.9194693727030963 and parameters: {'activation': 'tanh', 'solver': 'adam', 'lr': 2.4104676612915417e-05, 'layer1': 84, 'layer2': 491, 'layer3': 388}. Best is trial 84 with value: 0.9228685877627578.
Klebsiella_Pneumoniae | DirectMulti | Optuna:  54%|█████▎    | 107/200 [2:45:41<2:25:21, 93.78s/it, best=0.923]Klebsiella_Pneumoniae | DirectMulti | Optuna:  54%|█████▎    | 107/200 [2:45:41<2:25:21, 93.78s/it, best=0.923][I 2026-02-28 16:12:49,625] Trial 40 finished with value: 0.8809733010027415 and parameters: {'activation': 'tanh', 'solver': 'adam', 'lr': 1.393598605083087e-05, 'layer1': 360, 'layer2': 348, 'layer3': 263}. Best is trial 14 with value: 0.8911503569339929.

Escherichia_Coli | Cefepime | Optuna:  20%|██        | 41/200 [1:15:14<6:00:14, 135.94s/it, best=0.891][A
Escherichia_Coli | Cefepime | Optuna:  20%|██        | 41/200 [1:15:14<6:00:14, 135.94s/it, best=0.891][A[I 2026-02-28 16:13:19,883] Trial 42 finished with value: 0.8849524453030947 and parameters: {'activation': 'tanh', 'solver': 'adam', 'lr': 0.00016841730034292213, 'layer1': 460, 'layer2': 229, 'layer3': 156}. Best is trial 40 with value: 0.8869621040536522.
Staphylococcus_Aureus | DirectMulti | Optuna:  22%|██▏       | 43/200 [1:43:25<4:14:35, 97.30s/it, best=0.887] Staphylococcus_Aureus | DirectMulti | Optuna:  22%|██▏       | 43/200 [1:43:25<4:14:35, 97.30s/it, best=0.887][I 2026-02-28 16:13:24,761] Trial 107 finished with value: 0.9200102711698518 and parameters: {'activation': 'tanh', 'solver': 'adam', 'lr': 4.561475545011092e-05, 'layer1': 10, 'layer2': 256, 'layer3': 352}. Best is trial 84 with value: 0.9228685877627578.
Klebsiella_Pneumoniae | DirectMulti | Optuna:  54%|█████▍    | 108/200 [2:47:10<2:21:25, 92.23s/it, best=0.923]Klebsiella_Pneumoniae | DirectMulti | Optuna:  54%|█████▍    | 108/200 [2:47:10<2:21:25, 92.23s/it, best=0.923][I 2026-02-28 16:13:51,472] Trial 108 finished with value: 0.8702461473038209 and parameters: {'activation': 'logistic', 'solver': 'adam', 'lr': 1.326245488633159e-05, 'layer1': 24, 'layer2': 476, 'layer3': 404}. Best is trial 84 with value: 0.9228685877627578.
Klebsiella_Pneumoniae | DirectMulti | Optuna:  55%|█████▍    | 109/200 [2:47:37<1:50:04, 72.58s/it, best=0.923]Klebsiella_Pneumoniae | DirectMulti | Optuna:  55%|█████▍    | 109/200 [2:47:37<1:50:04, 72.58s/it, best=0.923][I 2026-02-28 16:14:25,329] Trial 41 finished with value: 0.8873721432878856 and parameters: {'activation': 'relu', 'solver': 'adam', 'lr': 0.00016388569945283873, 'layer1': 475, 'layer2': 393, 'layer3': 195}. Best is trial 14 with value: 0.8911503569339929.

Escherichia_Coli | Cefepime | Optuna:  21%|██        | 42/200 [1:16:50<5:26:11, 123.87s/it, best=0.891][A
Escherichia_Coli | Cefepime | Optuna:  21%|██        | 42/200 [1:16:50<5:26:11, 123.87s/it, best=0.891][A[I 2026-02-28 16:14:50,995] Trial 109 finished with value: 0.9207982975240941 and parameters: {'activation': 'tanh', 'solver': 'adam', 'lr': 0.00018328768252640393, 'layer1': 34, 'layer2': 456, 'layer3': 376}. Best is trial 84 with value: 0.9228685877627578.
Klebsiella_Pneumoniae | DirectMulti | Optuna:  55%|█████▌    | 110/200 [2:48:36<1:42:59, 68.66s/it, best=0.923]Klebsiella_Pneumoniae | DirectMulti | Optuna:  55%|█████▌    | 110/200 [2:48:36<1:42:59, 68.66s/it, best=0.923][I 2026-02-28 16:16:24,067] Trial 42 finished with value: 0.8910017660043359 and parameters: {'activation': 'relu', 'solver': 'adam', 'lr': 9.819636333045995e-05, 'layer1': 500, 'layer2': 296, 'layer3': 206}. Best is trial 14 with value: 0.8911503569339929.

Escherichia_Coli | Cefepime | Optuna:  22%|██▏       | 43/200 [1:18:48<5:20:05, 122.33s/it, best=0.891][A
Escherichia_Coli | Cefepime | Optuna:  22%|██▏       | 43/200 [1:18:48<5:20:05, 122.33s/it, best=0.891][A[I 2026-02-28 16:16:30,061] Trial 110 finished with value: 0.9217573969336034 and parameters: {'activation': 'tanh', 'solver': 'adam', 'lr': 6.67772984598126e-05, 'layer1': 105, 'layer2': 439, 'layer3': 361}. Best is trial 84 with value: 0.9228685877627578.
Klebsiella_Pneumoniae | DirectMulti | Optuna:  56%|█████▌    | 111/200 [2:50:15<1:55:22, 77.78s/it, best=0.923]Klebsiella_Pneumoniae | DirectMulti | Optuna:  56%|█████▌    | 111/200 [2:50:15<1:55:22, 77.78s/it, best=0.923][I 2026-02-28 16:17:31,421] Trial 43 finished with value: 0.7572219943982081 and parameters: {'activation': 'relu', 'solver': 'adam', 'lr': 1.2403668302547623e-06, 'layer1': 498, 'layer2': 304, 'layer3': 204}. Best is trial 14 with value: 0.8911503569339929.

Escherichia_Coli | Cefepime | Optuna:  22%|██▏       | 44/200 [1:19:56<4:35:10, 105.84s/it, best=0.891][A
Escherichia_Coli | Cefepime | Optuna:  22%|██▏       | 44/200 [1:19:56<4:35:10, 105.84s/it, best=0.891][A[I 2026-02-28 16:17:56,228] Trial 111 finished with value: 0.9219457104537856 and parameters: {'activation': 'tanh', 'solver': 'adam', 'lr': 6.07962117858784e-05, 'layer1': 73, 'layer2': 423, 'layer3': 394}. Best is trial 84 with value: 0.9228685877627578.
Klebsiella_Pneumoniae | DirectMulti | Optuna:  56%|█████▌    | 112/200 [2:51:41<1:57:46, 80.30s/it, best=0.923]Klebsiella_Pneumoniae | DirectMulti | Optuna:  56%|█████▌    | 112/200 [2:51:41<1:57:46, 80.30s/it, best=0.923][I 2026-02-28 16:19:37,255] Trial 112 finished with value: 0.9219929748416676 and parameters: {'activation': 'tanh', 'solver': 'adam', 'lr': 3.12527406869818e-05, 'layer1': 72, 'layer2': 421, 'layer3': 490}. Best is trial 84 with value: 0.9228685877627578.
Klebsiella_Pneumoniae | DirectMulti | Optuna:  56%|█████▋    | 113/200 [2:53:22<2:05:26, 86.52s/it, best=0.923]Klebsiella_Pneumoniae | DirectMulti | Optuna:  56%|█████▋    | 113/200 [2:53:22<2:05:26, 86.52s/it, best=0.923][I 2026-02-28 16:19:40,433] Trial 44 finished with value: 0.8771525820272428 and parameters: {'activation': 'identity', 'solver': 'adam', 'lr': 8.365620342284309e-05, 'layer1': 408, 'layer2': 409, 'layer3': 113}. Best is trial 14 with value: 0.8911503569339929.

Escherichia_Coli | Cefepime | Optuna:  22%|██▎       | 45/200 [1:22:05<4:51:22, 112.79s/it, best=0.891][A
Escherichia_Coli | Cefepime | Optuna:  22%|██▎       | 45/200 [1:22:05<4:51:22, 112.79s/it, best=0.891][A[I 2026-02-28 16:21:15,613] Trial 113 finished with value: 0.921701950588788 and parameters: {'activation': 'tanh', 'solver': 'adam', 'lr': 3.845445490959772e-05, 'layer1': 70, 'layer2': 420, 'layer3': 494}. Best is trial 84 with value: 0.9228685877627578.
Klebsiella_Pneumoniae | DirectMulti | Optuna:  57%|█████▋    | 114/200 [2:55:01<2:09:05, 90.07s/it, best=0.923]Klebsiella_Pneumoniae | DirectMulti | Optuna:  57%|█████▋    | 114/200 [2:55:01<2:09:05, 90.07s/it, best=0.923][I 2026-02-28 16:21:37,847] Trial 45 finished with value: 0.8867211094518226 and parameters: {'activation': 'relu', 'solver': 'adam', 'lr': 5.3373480011302074e-05, 'layer1': 439, 'layer2': 360, 'layer3': 249}. Best is trial 14 with value: 0.8911503569339929.

Escherichia_Coli | Cefepime | Optuna:  23%|██▎       | 46/200 [1:24:02<4:53:03, 114.18s/it, best=0.891][A
Escherichia_Coli | Cefepime | Optuna:  23%|██▎       | 46/200 [1:24:02<4:53:03, 114.18s/it, best=0.891][A[I 2026-02-28 16:22:24,625] Trial 114 finished with value: 0.9216569790776485 and parameters: {'activation': 'tanh', 'solver': 'adam', 'lr': 8.835700467555162e-05, 'layer1': 54, 'layer2': 484, 'layer3': 472}. Best is trial 84 with value: 0.9228685877627578.
Klebsiella_Pneumoniae | DirectMulti | Optuna:  57%|█████▊    | 115/200 [2:56:10<1:58:38, 83.75s/it, best=0.923]Klebsiella_Pneumoniae | DirectMulti | Optuna:  57%|█████▊    | 115/200 [2:56:10<1:58:38, 83.75s/it, best=0.923][I 2026-02-28 16:24:12,971] Trial 46 finished with value: 0.8336903761686998 and parameters: {'activation': 'relu', 'solver': 'adam', 'lr': 1.3286804670646454e-05, 'layer1': 334, 'layer2': 316, 'layer3': 188}. Best is trial 14 with value: 0.8911503569339929.

Escherichia_Coli | Cefepime | Optuna:  24%|██▎       | 47/200 [1:26:37<5:22:28, 126.46s/it, best=0.891][A
Escherichia_Coli | Cefepime | Optuna:  24%|██▎       | 47/200 [1:26:37<5:22:28, 126.46s/it, best=0.891][A[I 2026-02-28 16:24:17,535] Trial 115 finished with value: 0.9220301147212098 and parameters: {'activation': 'tanh', 'solver': 'adam', 'lr': 3.208119339290502e-05, 'layer1': 38, 'layer2': 410, 'layer3': 485}. Best is trial 84 with value: 0.9228685877627578.
Klebsiella_Pneumoniae | DirectMulti | Optuna:  58%|█████▊    | 116/200 [2:58:03<2:09:29, 92.50s/it, best=0.923]Klebsiella_Pneumoniae | DirectMulti | Optuna:  58%|█████▊    | 116/200 [2:58:03<2:09:29, 92.50s/it, best=0.923][I 2026-02-28 16:24:32,799] Trial 43 finished with value: 0.8490679101619157 and parameters: {'activation': 'tanh', 'solver': 'adam', 'lr': 1.2403668302547623e-06, 'layer1': 422, 'layer2': 205, 'layer3': 193}. Best is trial 40 with value: 0.8869621040536522.
Staphylococcus_Aureus | DirectMulti | Optuna:  22%|██▏       | 44/200 [1:54:38<11:41:57, 269.98s/it, best=0.887]Staphylococcus_Aureus | DirectMulti | Optuna:  22%|██▏       | 44/200 [1:54:38<11:41:57, 269.98s/it, best=0.887][I 2026-02-28 16:25:39,797] Trial 47 finished with value: 0.762692029759339 and parameters: {'activation': 'identity', 'solver': 'sgd', 'lr': 9.898121540906932e-05, 'layer1': 381, 'layer2': 276, 'layer3': 274}. Best is trial 14 with value: 0.8911503569339929.

Escherichia_Coli | Cefepime | Optuna:  24%|██▍       | 48/200 [1:28:04<4:50:14, 114.57s/it, best=0.891][A
Escherichia_Coli | Cefepime | Optuna:  24%|██▍       | 48/200 [1:28:04<4:50:14, 114.57s/it, best=0.891][A[I 2026-02-28 16:26:20,743] Trial 44 finished with value: 0.8810798757550289 and parameters: {'activation': 'tanh', 'solver': 'adam', 'lr': 7.071542129137749e-05, 'layer1': 385, 'layer2': 141, 'layer3': 113}. Best is trial 40 with value: 0.8869621040536522.
Staphylococcus_Aureus | DirectMulti | Optuna:  22%|██▎       | 45/200 [1:56:26<9:31:52, 221.37s/it, best=0.887] Staphylococcus_Aureus | DirectMulti | Optuna:  22%|██▎       | 45/200 [1:56:26<9:31:52, 221.37s/it, best=0.887][I 2026-02-28 16:26:28,158] Trial 116 finished with value: 0.9230019854081373 and parameters: {'activation': 'tanh', 'solver': 'adam', 'lr': 3.068162006743576e-05, 'layer1': 47, 'layer2': 472, 'layer3': 453}. Best is trial 116 with value: 0.9230019854081373.
Klebsiella_Pneumoniae | DirectMulti | Optuna:  58%|█████▊    | 117/200 [3:00:13<2:23:46, 103.94s/it, best=0.923]Klebsiella_Pneumoniae | DirectMulti | Optuna:  58%|█████▊    | 117/200 [3:00:13<2:23:46, 103.94s/it, best=0.923][I 2026-02-28 16:27:25,654] Trial 48 finished with value: 0.8879869442455817 and parameters: {'activation': 'relu', 'solver': 'adam', 'lr': 0.00014576344528820524, 'layer1': 288, 'layer2': 417, 'layer3': 227}. Best is trial 14 with value: 0.8911503569339929.

Escherichia_Coli | Cefepime | Optuna:  24%|██▍       | 49/200 [1:29:50<4:41:45, 111.96s/it, best=0.891][A
Escherichia_Coli | Cefepime | Optuna:  24%|██▍       | 49/200 [1:29:50<4:41:45, 111.96s/it, best=0.891][A[I 2026-02-28 16:28:40,237] Trial 117 finished with value: 0.9196134592934625 and parameters: {'activation': 'tanh', 'solver': 'adam', 'lr': 1.746293012523834e-05, 'layer1': 37, 'layer2': 451, 'layer3': 488}. Best is trial 116 with value: 0.9230019854081373.
Klebsiella_Pneumoniae | DirectMulti | Optuna:  59%|█████▉    | 118/200 [3:02:25<2:33:35, 112.38s/it, best=0.923]Klebsiella_Pneumoniae | DirectMulti | Optuna:  59%|█████▉    | 118/200 [3:02:25<2:33:35, 112.38s/it, best=0.923][I 2026-02-28 16:28:44,675] Trial 49 finished with value: 0.8882252242459316 and parameters: {'activation': 'relu', 'solver': 'adam', 'lr': 0.0010062805129244636, 'layer1': 421, 'layer2': 40, 'layer3': 131}. Best is trial 14 with value: 0.8911503569339929.

Escherichia_Coli | Cefepime | Optuna:  25%|██▌       | 50/200 [1:31:09<4:15:11, 102.08s/it, best=0.891][A
Escherichia_Coli | Cefepime | Optuna:  25%|██▌       | 50/200 [1:31:09<4:15:11, 102.08s/it, best=0.891][A[I 2026-02-28 16:29:22,751] Trial 45 finished with value: 0.8796051695555527 and parameters: {'activation': 'tanh', 'solver': 'adam', 'lr': 2.234090863841757e-05, 'layer1': 458, 'layer2': 107, 'layer3': 249}. Best is trial 40 with value: 0.8869621040536522.
