Escherichia_Coli | Ceftriaxone | Optuna:  90%|█████████ | 180/200 [7:51:24<1:05:25, 196.25s/it, best=0.898][A[I 2026-02-28 07:01:26,778] Trial 71 finished with value: 0.9797287487063496 and parameters: {'activation': 'relu', 'solver': 'adam', 'lr': 0.00026106524265013425, 'layer1': 438, 'layer2': 152, 'layer3': 500}. Best is trial 27 with value: 0.9821048418402821.

Klebsiella_Pneumoniae | Meropenem | Optuna:  36%|███▌      | 72/200 [1:02:07<1:48:52, 51.04s/it, best=0.982][A
Klebsiella_Pneumoniae | Meropenem | Optuna:  36%|███▌      | 72/200 [1:02:07<1:48:52, 51.04s/it, best=0.982][A[I 2026-02-28 07:01:31,906] Trial 4 finished with value: 0.8261852645009518 and parameters: {'activation': 'relu', 'solver': 'adam', 'lr': 1.7654048052495086e-05, 'layer1': 265, 'layer2': 278, 'layer3': 100}. Best is trial 2 with value: 0.8353664179654814.
Pseudomonas_Aeruginosa | DirectMulti | Optuna:   2%|▎         | 5/200 [05:18<3:33:12, 65.60s/it, best=0.835]Pseudomonas_Aeruginosa | DirectMulti | Optuna:   2%|▎         | 5/200 [05:18<3:33:12, 65.60s/it, best=0.835]/export/usuarios01/egarroyo/MALDI_for_AMR_prediction/venv/lib/python3.13/site-packages/sklearn/model_selection/_split.py:813: UserWarning: The least populated class in y has only 4 members, which is less than n_splits=5.
  warnings.warn(
[I 2026-02-28 07:01:36,507] Trial 161 finished with value: 0.9261380568778659 and parameters: {'activation': 'identity', 'solver': 'adam', 'lr': 0.00015096720866928027, 'layer1': 368, 'layer2': 59, 'layer3': 93}. Best is trial 77 with value: 0.9283869597728589.

Staphylococcus_Aureus | Fusidic acid | Optuna:  81%|████████  | 162/200 [4:20:45<54:00, 85.28s/it, best=0.928][A
Staphylococcus_Aureus | Fusidic acid | Optuna:  81%|████████  | 162/200 [4:20:45<54:00, 85.28s/it, best=0.928][A[I 2026-02-28 07:02:51,597] Trial 72 finished with value: 0.9825505487984216 and parameters: {'activation': 'relu', 'solver': 'adam', 'lr': 0.0003183993541744306, 'layer1': 480, 'layer2': 134, 'layer3': 486}. Best is trial 72 with value: 0.9825505487984216.

Klebsiella_Pneumoniae | Meropenem | Optuna:  36%|███▋      | 73/200 [1:03:32<2:09:28, 61.17s/it, best=0.982][A
Klebsiella_Pneumoniae | Meropenem | Optuna:  36%|███▋      | 73/200 [1:03:32<2:09:28, 61.17s/it, best=0.983][A[I 2026-02-28 07:03:19,490] Trial 162 finished with value: 0.9063617738635692 and parameters: {'activation': 'identity', 'solver': 'adam', 'lr': 4.506281612476286e-06, 'layer1': 155, 'layer2': 103, 'layer3': 104}. Best is trial 77 with value: 0.9283869597728589.

Staphylococcus_Aureus | Fusidic acid | Optuna:  82%|████████▏ | 163/200 [4:22:28<55:51, 90.59s/it, best=0.928][A
Staphylococcus_Aureus | Fusidic acid | Optuna:  82%|████████▏ | 163/200 [4:22:28<55:51, 90.59s/it, best=0.928][A[I 2026-02-28 07:03:44,311] Trial 73 finished with value: 0.9794288069111655 and parameters: {'activation': 'relu', 'solver': 'adam', 'lr': 0.0003462984241725245, 'layer1': 466, 'layer2': 177, 'layer3': 457}. Best is trial 72 with value: 0.9825505487984216.

Klebsiella_Pneumoniae | Meropenem | Optuna:  37%|███▋      | 74/200 [1:04:24<2:03:07, 58.63s/it, best=0.983][A
Klebsiella_Pneumoniae | Meropenem | Optuna:  37%|███▋      | 74/200 [1:04:24<2:03:07, 58.63s/it, best=0.983][A[I 2026-02-28 07:04:17,536] Trial 5 finished with value: 0.8273283813956281 and parameters: {'activation': 'identity', 'solver': 'adam', 'lr': 2.259279742015697e-06, 'layer1': 106, 'layer2': 32, 'layer3': 169}. Best is trial 2 with value: 0.8353664179654814.
Pseudomonas_Aeruginosa | DirectMulti | Optuna:   3%|▎         | 6/200 [08:03<5:22:04, 99.61s/it, best=0.835]Pseudomonas_Aeruginosa | DirectMulti | Optuna:   3%|▎         | 6/200 [08:03<5:22:04, 99.61s/it, best=0.835]/export/usuarios01/egarroyo/MALDI_for_AMR_prediction/venv/lib/python3.13/site-packages/sklearn/model_selection/_split.py:813: UserWarning: The least populated class in y has only 4 members, which is less than n_splits=5.
  warnings.warn(
[I 2026-02-28 07:04:48,631] Trial 74 finished with value: 0.9793365623477992 and parameters: {'activation': 'relu', 'solver': 'adam', 'lr': 9.808921945433036e-05, 'layer1': 445, 'layer2': 122, 'layer3': 412}. Best is trial 72 with value: 0.9825505487984216.

Klebsiella_Pneumoniae | Meropenem | Optuna:  38%|███▊      | 75/200 [1:05:29<2:05:42, 60.34s/it, best=0.983][A
Klebsiella_Pneumoniae | Meropenem | Optuna:  38%|███▊      | 75/200 [1:05:29<2:05:42, 60.34s/it, best=0.983][A[I 2026-02-28 07:04:54,752] Trial 163 finished with value: 0.9259480291268913 and parameters: {'activation': 'identity', 'solver': 'adam', 'lr': 0.00013234517180561064, 'layer1': 381, 'layer2': 35, 'layer3': 74}. Best is trial 77 with value: 0.9283869597728589.

Staphylococcus_Aureus | Fusidic acid | Optuna:  82%|████████▏ | 164/200 [4:24:03<55:11, 91.99s/it, best=0.928][A
Staphylococcus_Aureus | Fusidic acid | Optuna:  82%|████████▏ | 164/200 [4:24:03<55:11, 91.99s/it, best=0.928][A[I 2026-02-28 07:05:02,556] Trial 180 finished with value: 0.8964895717577417 and parameters: {'activation': 'relu', 'solver': 'adam', 'lr': 3.359813174072556e-05, 'layer1': 429, 'layer2': 125, 'layer3': 38}. Best is trial 137 with value: 0.8979080367540411.

Escherichia_Coli | Ceftriaxone | Optuna:  90%|█████████ | 181/200 [7:55:04<1:04:18, 203.10s/it, best=0.898][A
Escherichia_Coli | Ceftriaxone | Optuna:  90%|█████████ | 181/200 [7:55:04<1:04:18, 203.10s/it, best=0.898][A[I 2026-02-28 07:05:46,952] Trial 75 finished with value: 0.9801142696323218 and parameters: {'activation': 'relu', 'solver': 'adam', 'lr': 0.0005766408192566654, 'layer1': 430, 'layer2': 75, 'layer3': 485}. Best is trial 72 with value: 0.9825505487984216.

Klebsiella_Pneumoniae | Meropenem | Optuna:  38%|███▊      | 76/200 [1:06:27<2:03:27, 59.73s/it, best=0.983][A
Klebsiella_Pneumoniae | Meropenem | Optuna:  38%|███▊      | 76/200 [1:06:27<2:03:27, 59.73s/it, best=0.983][A[I 2026-02-28 07:06:33,175] Trial 164 finished with value: 0.9262049205370075 and parameters: {'activation': 'identity', 'solver': 'adam', 'lr': 0.00024262129887516436, 'layer1': 394, 'layer2': 461, 'layer3': 84}. Best is trial 77 with value: 0.9283869597728589.

Staphylococcus_Aureus | Fusidic acid | Optuna:  82%|████████▎ | 165/200 [4:25:42<54:47, 93.92s/it, best=0.928][A
Staphylococcus_Aureus | Fusidic acid | Optuna:  82%|████████▎ | 165/200 [4:25:42<54:47, 93.92s/it, best=0.928][A[I 2026-02-28 07:06:47,835] Trial 76 finished with value: 0.9792802108377151 and parameters: {'activation': 'relu', 'solver': 'adam', 'lr': 0.0015108643472040992, 'layer1': 484, 'layer2': 135, 'layer3': 198}. Best is trial 72 with value: 0.9825505487984216.

Klebsiella_Pneumoniae | Meropenem | Optuna:  38%|███▊      | 77/200 [1:07:28<2:03:09, 60.08s/it, best=0.983][A
Klebsiella_Pneumoniae | Meropenem | Optuna:  38%|███▊      | 77/200 [1:07:28<2:03:09, 60.08s/it, best=0.983][A[I 2026-02-28 07:07:15,265] Trial 77 finished with value: 0.9787027197002102 and parameters: {'activation': 'identity', 'solver': 'adam', 'lr': 0.00043360947358854333, 'layer1': 117, 'layer2': 205, 'layer3': 236}. Best is trial 72 with value: 0.9825505487984216.

Klebsiella_Pneumoniae | Meropenem | Optuna:  39%|███▉      | 78/200 [1:07:55<1:42:14, 50.28s/it, best=0.983][A
Klebsiella_Pneumoniae | Meropenem | Optuna:  39%|███▉      | 78/200 [1:07:55<1:42:14, 50.28s/it, best=0.983][A[I 2026-02-28 07:07:39,762] Trial 6 finished with value: 0.8327319450302036 and parameters: {'activation': 'tanh', 'solver': 'adam', 'lr': 3.6618192203924288e-06, 'layer1': 403, 'layer2': 46, 'layer3': 494}. Best is trial 2 with value: 0.8353664179654814.
Pseudomonas_Aeruginosa | DirectMulti | Optuna:   4%|▎         | 7/200 [11:26<7:08:19, 133.16s/it, best=0.835]Pseudomonas_Aeruginosa | DirectMulti | Optuna:   4%|▎         | 7/200 [11:26<7:08:19, 133.16s/it, best=0.835]/export/usuarios01/egarroyo/MALDI_for_AMR_prediction/venv/lib/python3.13/site-packages/sklearn/model_selection/_split.py:813: UserWarning: The least populated class in y has only 4 members, which is less than n_splits=5.
  warnings.warn(
[I 2026-02-28 07:07:51,555] Trial 78 finished with value: 0.9767069569332589 and parameters: {'activation': 'relu', 'solver': 'adam', 'lr': 4.297951680427721e-05, 'layer1': 491, 'layer2': 31, 'layer3': 439}. Best is trial 72 with value: 0.9825505487984216.

Klebsiella_Pneumoniae | Meropenem | Optuna:  40%|███▉      | 79/200 [1:08:32<1:32:56, 46.09s/it, best=0.983][A
Klebsiella_Pneumoniae | Meropenem | Optuna:  40%|███▉      | 79/200 [1:08:32<1:32:56, 46.09s/it, best=0.983][A[I 2026-02-28 07:07:58,066] Trial 165 finished with value: 0.9257104682880357 and parameters: {'activation': 'identity', 'solver': 'adam', 'lr': 0.00017699841863984167, 'layer1': 414, 'layer2': 82, 'layer3': 157}. Best is trial 77 with value: 0.9283869597728589.

Staphylococcus_Aureus | Fusidic acid | Optuna:  83%|████████▎ | 166/200 [4:27:07<51:41, 91.21s/it, best=0.928][A
Staphylococcus_Aureus | Fusidic acid | Optuna:  83%|████████▎ | 166/200 [4:27:07<51:41, 91.21s/it, best=0.928][A[I 2026-02-28 07:08:25,124] Trial 7 finished with value: 0.8549472773908191 and parameters: {'activation': 'relu', 'solver': 'adam', 'lr': 0.0012164139351417069, 'layer1': 46, 'layer2': 186, 'layer3': 66}. Best is trial 7 with value: 0.8549472773908191.
Pseudomonas_Aeruginosa | DirectMulti | Optuna:   4%|▍         | 8/200 [12:11<5:36:40, 105.21s/it, best=0.835]Pseudomonas_Aeruginosa | DirectMulti | Optuna:   4%|▍         | 8/200 [12:11<5:36:40, 105.21s/it, best=0.855]/export/usuarios01/egarroyo/MALDI_for_AMR_prediction/venv/lib/python3.13/site-packages/sklearn/model_selection/_split.py:813: UserWarning: The least populated class in y has only 4 members, which is less than n_splits=5.
  warnings.warn(
[I 2026-02-28 07:08:34,018] Trial 181 finished with value: 0.8931523721975709 and parameters: {'activation': 'relu', 'solver': 'adam', 'lr': 3.4231122204283386e-05, 'layer1': 429, 'layer2': 125, 'layer3': 37}. Best is trial 137 with value: 0.8979080367540411.

Escherichia_Coli | Ceftriaxone | Optuna:  91%|█████████ | 182/200 [7:58:35<1:01:40, 205.61s/it, best=0.898][A
Escherichia_Coli | Ceftriaxone | Optuna:  91%|█████████ | 182/200 [7:58:35<1:01:40, 205.61s/it, best=0.898][A[I 2026-02-28 07:08:51,279] Trial 79 finished with value: 0.9794288069111655 and parameters: {'activation': 'relu', 'solver': 'adam', 'lr': 0.0001921460234280769, 'layer1': 422, 'layer2': 281, 'layer3': 303}. Best is trial 72 with value: 0.9825505487984216.

Klebsiella_Pneumoniae | Meropenem | Optuna:  40%|████      | 80/200 [1:09:31<1:40:21, 50.18s/it, best=0.983][A
Klebsiella_Pneumoniae | Meropenem | Optuna:  40%|████      | 80/200 [1:09:31<1:40:21, 50.18s/it, best=0.983][A[I 2026-02-28 07:09:21,046] Trial 80 finished with value: 0.9767069569332589 and parameters: {'activation': 'relu', 'solver': 'sgd', 'lr': 0.0008703466613126058, 'layer1': 458, 'layer2': 164, 'layer3': 166}. Best is trial 72 with value: 0.9825505487984216.

Klebsiella_Pneumoniae | Meropenem | Optuna:  40%|████      | 81/200 [1:10:01<1:27:22, 44.05s/it, best=0.983][A
Klebsiella_Pneumoniae | Meropenem | Optuna:  40%|████      | 81/200 [1:10:01<1:27:22, 44.05s/it, best=0.983][A[I 2026-02-28 07:09:24,905] Trial 166 finished with value: 0.9258808489127739 and parameters: {'activation': 'identity', 'solver': 'adam', 'lr': 8.831406867204404e-05, 'layer1': 432, 'layer2': 71, 'layer3': 50}. Best is trial 77 with value: 0.9283869597728589.

Staphylococcus_Aureus | Fusidic acid | Optuna:  84%|████████▎ | 167/200 [4:28:34<49:26, 89.90s/it, best=0.928][A
Staphylococcus_Aureus | Fusidic acid | Optuna:  84%|████████▎ | 167/200 [4:28:34<49:26, 89.90s/it, best=0.928][A[I 2026-02-28 07:10:05,680] Trial 8 finished with value: 0.8650188630864708 and parameters: {'activation': 'identity', 'solver': 'adam', 'lr': 0.000828752236376816, 'layer1': 323, 'layer2': 445, 'layer3': 241}. Best is trial 8 with value: 0.8650188630864708.
Pseudomonas_Aeruginosa | DirectMulti | Optuna:   4%|▍         | 9/200 [13:51<5:30:17, 103.75s/it, best=0.855]Pseudomonas_Aeruginosa | DirectMulti | Optuna:   4%|▍         | 9/200 [13:51<5:30:17, 103.75s/it, best=0.865]/export/usuarios01/egarroyo/MALDI_for_AMR_prediction/venv/lib/python3.13/site-packages/sklearn/model_selection/_split.py:813: UserWarning: The least populated class in y has only 4 members, which is less than n_splits=5.
  warnings.warn(
[I 2026-02-28 07:10:25,810] Trial 81 finished with value: 0.9813660443675756 and parameters: {'activation': 'relu', 'solver': 'adam', 'lr': 0.0003777522789847833, 'layer1': 485, 'layer2': 139, 'layer3': 500}. Best is trial 72 with value: 0.9825505487984216.

Klebsiella_Pneumoniae | Meropenem | Optuna:  41%|████      | 82/200 [1:11:06<1:38:51, 50.27s/it, best=0.983][A
Klebsiella_Pneumoniae | Meropenem | Optuna:  41%|████      | 82/200 [1:11:06<1:38:51, 50.27s/it, best=0.983][A[I 2026-02-28 07:10:43,054] Trial 167 finished with value: 0.9213478781580244 and parameters: {'activation': 'identity', 'solver': 'adam', 'lr': 0.0003207048317603417, 'layer1': 345, 'layer2': 51, 'layer3': 113}. Best is trial 77 with value: 0.9283869597728589.

Staphylococcus_Aureus | Fusidic acid | Optuna:  84%|████████▍ | 168/200 [4:29:52<46:04, 86.38s/it, best=0.928][A
Staphylococcus_Aureus | Fusidic acid | Optuna:  84%|████████▍ | 168/200 [4:29:52<46:04, 86.38s/it, best=0.928][A[I 2026-02-28 07:11:13,663] Trial 82 finished with value: 0.9788165202715506 and parameters: {'activation': 'relu', 'solver': 'adam', 'lr': 0.0006326673632728545, 'layer1': 469, 'layer2': 104, 'layer3': 469}. Best is trial 72 with value: 0.9825505487984216.

Klebsiella_Pneumoniae | Meropenem | Optuna:  42%|████▏     | 83/200 [1:11:54<1:36:36, 49.54s/it, best=0.983][A
Klebsiella_Pneumoniae | Meropenem | Optuna:  42%|████▏     | 83/200 [1:11:54<1:36:36, 49.54s/it, best=0.983][A[I 2026-02-28 07:11:30,601] Trial 182 finished with value: 0.8964896997281828 and parameters: {'activation': 'relu', 'solver': 'adam', 'lr': 4.808435951345824e-05, 'layer1': 445, 'layer2': 136, 'layer3': 24}. Best is trial 137 with value: 0.8979080367540411.

Escherichia_Coli | Ceftriaxone | Optuna:  92%|█████████▏| 183/200 [8:01:32<55:47, 196.90s/it, best=0.898]  [A
Escherichia_Coli | Ceftriaxone | Optuna:  92%|█████████▏| 183/200 [8:01:32<55:47, 196.90s/it, best=0.898][A[I 2026-02-28 07:12:14,583] Trial 83 finished with value: 0.9799216025376347 and parameters: {'activation': 'relu', 'solver': 'adam', 'lr': 0.00015866794450294396, 'layer1': 483, 'layer2': 118, 'layer3': 486}. Best is trial 72 with value: 0.9825505487984216.

Klebsiella_Pneumoniae | Meropenem | Optuna:  42%|████▏     | 84/200 [1:12:55<1:42:22, 52.96s/it, best=0.983][A
Klebsiella_Pneumoniae | Meropenem | Optuna:  42%|████▏     | 84/200 [1:12:55<1:42:22, 52.96s/it, best=0.983][A[I 2026-02-28 07:12:42,697] Trial 168 finished with value: 0.9272953007918279 and parameters: {'activation': 'identity', 'solver': 'adam', 'lr': 0.00012634956653524455, 'layer1': 374, 'layer2': 111, 'layer3': 216}. Best is trial 77 with value: 0.9283869597728589.

Staphylococcus_Aureus | Fusidic acid | Optuna:  84%|████████▍ | 169/200 [4:31:51<49:47, 96.36s/it, best=0.928][A
Staphylococcus_Aureus | Fusidic acid | Optuna:  84%|████████▍ | 169/200 [4:31:51<49:47, 96.36s/it, best=0.928][A[I 2026-02-28 07:12:52,403] Trial 9 finished with value: 0.8014317103816548 and parameters: {'activation': 'tanh', 'solver': 'sgd', 'lr': 0.00012329098365270507, 'layer1': 219, 'layer2': 22, 'layer3': 62}. Best is trial 8 with value: 0.8650188630864708.
Pseudomonas_Aeruginosa | DirectMulti | Optuna:   5%|▌         | 10/200 [16:38<6:30:06, 123.19s/it, best=0.865]Pseudomonas_Aeruginosa | DirectMulti | Optuna:   5%|▌         | 10/200 [16:38<6:30:06, 123.19s/it, best=0.865]/export/usuarios01/egarroyo/MALDI_for_AMR_prediction/venv/lib/python3.13/site-packages/sklearn/model_selection/_split.py:813: UserWarning: The least populated class in y has only 4 members, which is less than n_splits=5.
  warnings.warn(
[I 2026-02-28 07:13:24,095] Trial 10 finished with value: 0.8263751726854561 and parameters: {'activation': 'identity', 'solver': 'sgd', 'lr': 0.007553503645583194, 'layer1': 366, 'layer2': 492, 'layer3': 320}. Best is trial 8 with value: 0.8650188630864708.
Pseudomonas_Aeruginosa | DirectMulti | Optuna:   6%|▌         | 11/200 [17:10<4:59:50, 95.19s/it, best=0.865] Pseudomonas_Aeruginosa | DirectMulti | Optuna:   6%|▌         | 11/200 [17:10<4:59:50, 95.19s/it, best=0.865]/export/usuarios01/egarroyo/MALDI_for_AMR_prediction/venv/lib/python3.13/site-packages/sklearn/model_selection/_split.py:813: UserWarning: The least populated class in y has only 4 members, which is less than n_splits=5.
  warnings.warn(
[I 2026-02-28 07:13:30,478] Trial 84 finished with value: 0.9826162364333169 and parameters: {'activation': 'relu', 'solver': 'adam', 'lr': 0.0003159358710142293, 'layer1': 495, 'layer2': 145, 'layer3': 465}. Best is trial 84 with value: 0.9826162364333169.

Klebsiella_Pneumoniae | Meropenem | Optuna:  42%|████▎     | 85/200 [1:14:10<1:54:41, 59.84s/it, best=0.983][A
Klebsiella_Pneumoniae | Meropenem | Optuna:  42%|████▎     | 85/200 [1:14:10<1:54:41, 59.84s/it, best=0.983][A[I 2026-02-28 07:14:09,771] Trial 11 finished with value: 0.8540378381363609 and parameters: {'activation': 'relu', 'solver': 'adam', 'lr': 0.0013124793805688133, 'layer1': 150, 'layer2': 163, 'layer3': 284}. Best is trial 8 with value: 0.8650188630864708.
Pseudomonas_Aeruginosa | DirectMulti | Optuna:   6%|▌         | 12/200 [17:56<4:11:03, 80.13s/it, best=0.865]Pseudomonas_Aeruginosa | DirectMulti | Optuna:   6%|▌         | 12/200 [17:56<4:11:03, 80.13s/it, best=0.865]/export/usuarios01/egarroyo/MALDI_for_AMR_prediction/venv/lib/python3.13/site-packages/sklearn/model_selection/_split.py:813: UserWarning: The least populated class in y has only 4 members, which is less than n_splits=5.
  warnings.warn(
[I 2026-02-28 07:14:29,784] Trial 169 finished with value: 0.926929695769461 and parameters: {'activation': 'identity', 'solver': 'adam', 'lr': 0.00020012205242398806, 'layer1': 399, 'layer2': 95, 'layer3': 65}. Best is trial 77 with value: 0.9283869597728589.

Staphylococcus_Aureus | Fusidic acid | Optuna:  85%|████████▌ | 170/200 [4:33:38<49:47, 99.57s/it, best=0.928][A
Staphylococcus_Aureus | Fusidic acid | Optuna:  85%|████████▌ | 170/200 [4:33:38<49:47, 99.57s/it, best=0.928][A[I 2026-02-28 07:14:33,459] Trial 85 finished with value: 0.9817918093579348 and parameters: {'activation': 'tanh', 'solver': 'adam', 'lr': 0.0003238712995108118, 'layer1': 500, 'layer2': 265, 'layer3': 42}. Best is trial 84 with value: 0.9826162364333169.

Klebsiella_Pneumoniae | Meropenem | Optuna:  43%|████▎     | 86/200 [1:15:13<1:55:28, 60.78s/it, best=0.983][A
Klebsiella_Pneumoniae | Meropenem | Optuna:  43%|████▎     | 86/200 [1:15:13<1:55:28, 60.78s/it, best=0.983][A[I 2026-02-28 07:14:57,486] Trial 183 finished with value: 0.8929339421113676 and parameters: {'activation': 'relu', 'solver': 'adam', 'lr': 4.496385819025323e-05, 'layer1': 447, 'layer2': 135, 'layer3': 46}. Best is trial 137 with value: 0.8979080367540411.

Escherichia_Coli | Ceftriaxone | Optuna:  92%|█████████▏| 184/200 [8:04:58<53:18, 199.90s/it, best=0.898][A
Escherichia_Coli | Ceftriaxone | Optuna:  92%|█████████▏| 184/200 [8:04:58<53:18, 199.90s/it, best=0.898][A[I 2026-02-28 07:15:11,848] Trial 170 finished with value: 0.9050666137971211 and parameters: {'activation': 'logistic', 'solver': 'adam', 'lr': 8.069136351768154e-05, 'layer1': 361, 'layer2': 413, 'layer3': 135}. Best is trial 77 with value: 0.9283869597728589.

Staphylococcus_Aureus | Fusidic acid | Optuna:  86%|████████▌ | 171/200 [4:34:21<39:47, 82.32s/it, best=0.928][A
Staphylococcus_Aureus | Fusidic acid | Optuna:  86%|████████▌ | 171/200 [4:34:21<39:47, 82.32s/it, best=0.928][A[I 2026-02-28 07:15:46,103] Trial 86 finished with value: 0.9802411215529375 and parameters: {'activation': 'tanh', 'solver': 'adam', 'lr': 0.00030670006519084586, 'layer1': 496, 'layer2': 268, 'layer3': 62}. Best is trial 84 with value: 0.9826162364333169.

Klebsiella_Pneumoniae | Meropenem | Optuna:  44%|████▎     | 87/200 [1:16:26<2:01:10, 64.34s/it, best=0.983][A
Klebsiella_Pneumoniae | Meropenem | Optuna:  44%|████▎     | 87/200 [1:16:26<2:01:10, 64.34s/it, best=0.983][A[I 2026-02-28 07:15:51,110] Trial 12 finished with value: 0.8629686600980573 and parameters: {'activation': 'identity', 'solver': 'adam', 'lr': 0.00046544039809979403, 'layer1': 347, 'layer2': 434, 'layer3': 419}. Best is trial 8 with value: 0.8650188630864708.
Pseudomonas_Aeruginosa | DirectMulti | Optuna:   6%|▋         | 13/200 [19:37<4:29:45, 86.55s/it, best=0.865]Pseudomonas_Aeruginosa | DirectMulti | Optuna:   6%|▋         | 13/200 [19:37<4:29:45, 86.55s/it, best=0.865]/export/usuarios01/egarroyo/MALDI_for_AMR_prediction/venv/lib/python3.13/site-packages/sklearn/model_selection/_split.py:813: UserWarning: The least populated class in y has only 4 members, which is less than n_splits=5.
  warnings.warn(
[I 2026-02-28 07:16:37,493] Trial 87 finished with value: 0.9798923800107506 and parameters: {'activation': 'tanh', 'solver': 'adam', 'lr': 0.00024728957337714913, 'layer1': 453, 'layer2': 134, 'layer3': 488}. Best is trial 84 with value: 0.9826162364333169.

Klebsiella_Pneumoniae | Meropenem | Optuna:  44%|████▍     | 88/200 [1:17:17<1:52:50, 60.45s/it, best=0.983][A
