Staphylococcus_Aureus | Fusidic acid | Optuna:  14%|█▎        | 27/200 [38:27<3:36:29, 75.08s/it, best=0.928][A[I 2026-02-28 03:19:45,508] Trial 100 finished with value: 0.8878065938485094 and parameters: {'activation': 'tanh', 'solver': 'adam', 'lr': 4.28232662500623e-05, 'layer1': 474, 'layer2': 55, 'layer3': 218}. Best is trial 14 with value: 0.8971256036318559.

Escherichia_Coli | Ceftriaxone | Optuna:  50%|█████     | 101/200 [4:09:47<3:37:03, 131.55s/it, best=0.897][A
Escherichia_Coli | Ceftriaxone | Optuna:  50%|█████     | 101/200 [4:09:47<3:37:03, 131.55s/it, best=0.897][A[I 2026-02-28 03:20:11,991] Trial 194 finished with value: 0.9062335747188257 and parameters: {'activation': 'tanh', 'solver': 'adam', 'lr': 3.545555917756929e-05, 'layer1': 181, 'layer2': 498, 'layer3': 222}. Best is trial 174 with value: 0.9115644647823175.

Klebsiella_Pneumoniae | Ceftriaxone | Optuna:  98%|█████████▊| 195/200 [6:29:33<08:52, 106.52s/it, best=0.912][A
Klebsiella_Pneumoniae | Ceftriaxone | Optuna:  98%|█████████▊| 195/200 [6:29:33<08:52, 106.52s/it, best=0.912][A[I 2026-02-28 03:20:26,677] Trial 53 finished with value: 0.863026736226626 and parameters: {'activation': 'identity', 'solver': 'adam', 'lr': 0.0004801616976734602, 'layer1': 84, 'layer2': 378, 'layer3': 464}. Best is trial 34 with value: 0.8674293894305268.
Pseudomonas_Aeruginosa | LPS | Optuna:  27%|██▋       | 54/200 [1:15:28<3:06:54, 76.81s/it, best=0.867]Pseudomonas_Aeruginosa | LPS | Optuna:  27%|██▋       | 54/200 [1:15:28<3:06:54, 76.81s/it, best=0.867]/export/usuarios01/egarroyo/MALDI_for_AMR_prediction/venv/lib/python3.13/site-packages/sklearn/model_selection/_split.py:813: UserWarning: The least populated class in y has only 4 members, which is less than n_splits=5.
  warnings.warn(
[I 2026-02-28 03:21:29,211] Trial 27 finished with value: 0.9264119609955712 and parameters: {'activation': 'identity', 'solver': 'adam', 'lr': 0.00018971116611271984, 'layer1': 462, 'layer2': 457, 'layer3': 316}. Best is trial 20 with value: 0.9283335834984147.

Staphylococcus_Aureus | Fusidic acid | Optuna:  14%|█▍        | 28/200 [40:38<4:23:15, 91.83s/it, best=0.928][A
Staphylococcus_Aureus | Fusidic acid | Optuna:  14%|█▍        | 28/200 [40:38<4:23:15, 91.83s/it, best=0.928][A[I 2026-02-28 03:21:42,761] Trial 195 finished with value: 0.9090562143801837 and parameters: {'activation': 'tanh', 'solver': 'adam', 'lr': 4.5731525956978944e-05, 'layer1': 167, 'layer2': 485, 'layer3': 221}. Best is trial 174 with value: 0.9115644647823175.

Klebsiella_Pneumoniae | Ceftriaxone | Optuna:  98%|█████████▊| 196/200 [6:31:04<06:47, 101.79s/it, best=0.912][A
Klebsiella_Pneumoniae | Ceftriaxone | Optuna:  98%|█████████▊| 196/200 [6:31:04<06:47, 101.79s/it, best=0.912][A[I 2026-02-28 03:21:54,738] Trial 54 finished with value: 0.864085912600418 and parameters: {'activation': 'identity', 'solver': 'adam', 'lr': 0.00028143835146898614, 'layer1': 177, 'layer2': 483, 'layer3': 500}. Best is trial 34 with value: 0.8674293894305268.
Pseudomonas_Aeruginosa | LPS | Optuna:  28%|██▊       | 55/200 [1:16:56<3:13:46, 80.19s/it, best=0.867]Pseudomonas_Aeruginosa | LPS | Optuna:  28%|██▊       | 55/200 [1:16:56<3:13:46, 80.19s/it, best=0.867]/export/usuarios01/egarroyo/MALDI_for_AMR_prediction/venv/lib/python3.13/site-packages/sklearn/model_selection/_split.py:813: UserWarning: The least populated class in y has only 4 members, which is less than n_splits=5.
  warnings.warn(
[I 2026-02-28 03:23:03,075] Trial 28 finished with value: 0.9215678492382118 and parameters: {'activation': 'identity', 'solver': 'adam', 'lr': 3.7481972718826746e-05, 'layer1': 402, 'layer2': 456, 'layer3': 280}. Best is trial 20 with value: 0.9283335834984147.

Staphylococcus_Aureus | Fusidic acid | Optuna:  14%|█▍        | 29/200 [42:12<4:23:27, 92.44s/it, best=0.928][A
Staphylococcus_Aureus | Fusidic acid | Optuna:  14%|█▍        | 29/200 [42:12<4:23:27, 92.44s/it, best=0.928][A[I 2026-02-28 03:23:08,516] Trial 196 finished with value: 0.9044714384466614 and parameters: {'activation': 'tanh', 'solver': 'adam', 'lr': 4.600690363700757e-05, 'layer1': 164, 'layer2': 483, 'layer3': 192}. Best is trial 174 with value: 0.9115644647823175.

Klebsiella_Pneumoniae | Ceftriaxone | Optuna:  98%|█████████▊| 197/200 [6:32:30<04:50, 96.98s/it, best=0.912] [A
Klebsiella_Pneumoniae | Ceftriaxone | Optuna:  98%|█████████▊| 197/200 [6:32:30<04:50, 96.98s/it, best=0.912][A[I 2026-02-28 03:23:16,393] Trial 101 finished with value: 0.8944030680051703 and parameters: {'activation': 'relu', 'solver': 'adam', 'lr': 3.247749783318936e-05, 'layer1': 464, 'layer2': 71, 'layer3': 442}. Best is trial 14 with value: 0.8971256036318559.

Escherichia_Coli | Ceftriaxone | Optuna:  51%|█████     | 102/200 [4:13:17<4:13:44, 155.35s/it, best=0.897][A
Escherichia_Coli | Ceftriaxone | Optuna:  51%|█████     | 102/200 [4:13:17<4:13:44, 155.35s/it, best=0.897][A[I 2026-02-28 03:23:26,390] Trial 55 finished with value: 0.8635505614165748 and parameters: {'activation': 'identity', 'solver': 'adam', 'lr': 0.00014877536241125232, 'layer1': 131, 'layer2': 416, 'layer3': 355}. Best is trial 34 with value: 0.8674293894305268.
Pseudomonas_Aeruginosa | LPS | Optuna:  28%|██▊       | 56/200 [1:18:28<3:20:42, 83.63s/it, best=0.867]Pseudomonas_Aeruginosa | LPS | Optuna:  28%|██▊       | 56/200 [1:18:28<3:20:42, 83.63s/it, best=0.867]/export/usuarios01/egarroyo/MALDI_for_AMR_prediction/venv/lib/python3.13/site-packages/sklearn/model_selection/_split.py:813: UserWarning: The least populated class in y has only 4 members, which is less than n_splits=5.
  warnings.warn(
[I 2026-02-28 03:23:36,036] Trial 29 finished with value: 0.9050666137971211 and parameters: {'activation': 'logistic', 'solver': 'sgd', 'lr': 0.0002617774308480782, 'layer1': 422, 'layer2': 358, 'layer3': 240}. Best is trial 20 with value: 0.9283335834984147.

Staphylococcus_Aureus | Fusidic acid | Optuna:  15%|█▌        | 30/200 [42:45<3:31:21, 74.60s/it, best=0.928][A
Staphylococcus_Aureus | Fusidic acid | Optuna:  15%|█▌        | 30/200 [42:45<3:31:21, 74.60s/it, best=0.928][A[I 2026-02-28 03:24:50,149] Trial 197 finished with value: 0.8992677300921518 and parameters: {'activation': 'relu', 'solver': 'adam', 'lr': 3.625570721379391e-05, 'layer1': 129, 'layer2': 460, 'layer3': 237}. Best is trial 174 with value: 0.9115644647823175.

Klebsiella_Pneumoniae | Ceftriaxone | Optuna:  99%|█████████▉| 198/200 [6:34:11<03:16, 98.38s/it, best=0.912][A
Klebsiella_Pneumoniae | Ceftriaxone | Optuna:  99%|█████████▉| 198/200 [6:34:11<03:16, 98.38s/it, best=0.912][A[I 2026-02-28 03:25:17,461] Trial 30 finished with value: 0.9263260892535861 and parameters: {'activation': 'identity', 'solver': 'adam', 'lr': 0.00015294172905855937, 'layer1': 320, 'layer2': 409, 'layer3': 387}. Best is trial 20 with value: 0.9283335834984147.

Staphylococcus_Aureus | Fusidic acid | Optuna:  16%|█▌        | 31/200 [44:26<3:52:47, 82.65s/it, best=0.928][A
Staphylococcus_Aureus | Fusidic acid | Optuna:  16%|█▌        | 31/200 [44:26<3:52:47, 82.65s/it, best=0.928][A[I 2026-02-28 03:25:29,932] Trial 56 finished with value: 0.8636494148014678 and parameters: {'activation': 'identity', 'solver': 'adam', 'lr': 6.892127714329487e-05, 'layer1': 338, 'layer2': 389, 'layer3': 419}. Best is trial 34 with value: 0.8674293894305268.
Pseudomonas_Aeruginosa | LPS | Optuna:  28%|██▊       | 57/200 [1:20:31<3:47:50, 95.60s/it, best=0.867]Pseudomonas_Aeruginosa | LPS | Optuna:  28%|██▊       | 57/200 [1:20:31<3:47:50, 95.60s/it, best=0.867]/export/usuarios01/egarroyo/MALDI_for_AMR_prediction/venv/lib/python3.13/site-packages/sklearn/model_selection/_split.py:813: UserWarning: The least populated class in y has only 4 members, which is less than n_splits=5.
  warnings.warn(
[I 2026-02-28 03:26:41,283] Trial 198 finished with value: 0.9072998822047069 and parameters: {'activation': 'tanh', 'solver': 'adam', 'lr': 3.0291235290200794e-05, 'layer1': 157, 'layer2': 488, 'layer3': 256}. Best is trial 174 with value: 0.9115644647823175.

Klebsiella_Pneumoniae | Ceftriaxone | Optuna: 100%|█████████▉| 199/200 [6:36:02<01:42, 102.20s/it, best=0.912][A
Klebsiella_Pneumoniae | Ceftriaxone | Optuna: 100%|█████████▉| 199/200 [6:36:02<01:42, 102.20s/it, best=0.912][A[I 2026-02-28 03:26:48,715] Trial 31 finished with value: 0.9214700083372801 and parameters: {'activation': 'identity', 'solver': 'adam', 'lr': 0.00015214421128978596, 'layer1': 313, 'layer2': 419, 'layer3': 387}. Best is trial 20 with value: 0.9283335834984147.

Staphylococcus_Aureus | Fusidic acid | Optuna:  16%|█▌        | 32/200 [45:57<3:58:38, 85.23s/it, best=0.928][A
Staphylococcus_Aureus | Fusidic acid | Optuna:  16%|█▌        | 32/200 [45:57<3:58:38, 85.23s/it, best=0.928][A[I 2026-02-28 03:27:01,101] Trial 102 finished with value: 0.8936012376432236 and parameters: {'activation': 'relu', 'solver': 'adam', 'lr': 2.7560248392607776e-05, 'layer1': 462, 'layer2': 36, 'layer3': 334}. Best is trial 14 with value: 0.8971256036318559.

Escherichia_Coli | Ceftriaxone | Optuna:  52%|█████▏    | 103/200 [4:17:02<4:44:47, 176.16s/it, best=0.897][A
Escherichia_Coli | Ceftriaxone | Optuna:  52%|█████▏    | 103/200 [4:17:02<4:44:47, 176.16s/it, best=0.897][A[I 2026-02-28 03:27:20,059] Trial 57 finished with value: 0.8465674184383817 and parameters: {'activation': 'identity', 'solver': 'adam', 'lr': 2.862579512481209e-05, 'layer1': 458, 'layer2': 347, 'layer3': 448}. Best is trial 34 with value: 0.8674293894305268.
Pseudomonas_Aeruginosa | LPS | Optuna:  29%|██▉       | 58/200 [1:22:22<3:56:34, 99.96s/it, best=0.867]Pseudomonas_Aeruginosa | LPS | Optuna:  29%|██▉       | 58/200 [1:22:22<3:56:34, 99.96s/it, best=0.867]/export/usuarios01/egarroyo/MALDI_for_AMR_prediction/venv/lib/python3.13/site-packages/sklearn/model_selection/_split.py:813: UserWarning: The least populated class in y has only 4 members, which is less than n_splits=5.
  warnings.warn(
[I 2026-02-28 03:28:05,091] Trial 58 finished with value: 0.8276770926371428 and parameters: {'activation': 'identity', 'solver': 'sgd', 'lr': 0.0003758855111336655, 'layer1': 392, 'layer2': 461, 'layer3': 385}. Best is trial 34 with value: 0.8674293894305268.
Pseudomonas_Aeruginosa | LPS | Optuna:  30%|██▉       | 59/200 [1:23:07<3:16:10, 83.48s/it, best=0.867]Pseudomonas_Aeruginosa | LPS | Optuna:  30%|██▉       | 59/200 [1:23:07<3:16:10, 83.48s/it, best=0.867]/export/usuarios01/egarroyo/MALDI_for_AMR_prediction/venv/lib/python3.13/site-packages/sklearn/model_selection/_split.py:813: UserWarning: The least populated class in y has only 4 members, which is less than n_splits=5.
  warnings.warn(
[I 2026-02-28 03:28:21,928] Trial 199 finished with value: 0.7870796371619283 and parameters: {'activation': 'tanh', 'solver': 'sgd', 'lr': 5.36112480760316e-05, 'layer1': 141, 'layer2': 192, 'layer3': 226}. Best is trial 174 with value: 0.9115644647823175.

Klebsiella_Pneumoniae | Ceftriaxone | Optuna: 100%|██████████| 200/200 [6:37:43<00:00, 101.74s/it, best=0.912][A
Klebsiella_Pneumoniae | Ceftriaxone | Optuna: 100%|██████████| 200/200 [6:37:43<00:00, 101.74s/it, best=0.912][A
                                                                                                              [A[Klebsiella_Pneumoniae | Ceftriaxone] [OPTUNA DONE] Best CV WF1=0.9116 | params={'activation': 'tanh', 'solver': 'adam', 'lr': 1.887929430821984e-05, 'layer1': 248, 'layer2': 457, 'layer3': 431}
[Klebsiella_Pneumoniae | Ceftriaxone] Retraining with validation early stopping (10% split)...
[I 2026-02-28 03:28:29,501] Trial 59 finished with value: 0.8255018342260501 and parameters: {'activation': 'logistic', 'solver': 'adam', 'lr': 0.0032725316803120953, 'layer1': 352, 'layer2': 83, 'layer3': 14}. Best is trial 34 with value: 0.8674293894305268.
Pseudomonas_Aeruginosa | LPS | Optuna:  30%|███       | 60/200 [1:23:31<2:33:26, 65.76s/it, best=0.867]Pseudomonas_Aeruginosa | LPS | Optuna:  30%|███       | 60/200 [1:23:31<2:33:26, 65.76s/it, best=0.867]/export/usuarios01/egarroyo/MALDI_for_AMR_prediction/venv/lib/python3.13/site-packages/sklearn/model_selection/_split.py:813: UserWarning: The least populated class in y has only 4 members, which is less than n_splits=5.
  warnings.warn(
[I 2026-02-28 03:28:34,609] Trial 32 finished with value: 0.9215643999361329 and parameters: {'activation': 'identity', 'solver': 'adam', 'lr': 2.761487066375439e-05, 'layer1': 229, 'layer2': 464, 'layer3': 323}. Best is trial 20 with value: 0.9283335834984147.

Staphylococcus_Aureus | Fusidic acid | Optuna:  16%|█▋        | 33/200 [47:43<4:14:28, 91.43s/it, best=0.928][A
Staphylococcus_Aureus | Fusidic acid | Optuna:  16%|█▋        | 33/200 [47:43<4:14:28, 91.43s/it, best=0.928][A[Klebsiella_Pneumoniae | Ceftriaxone] [TEST] WF1=0.9107 | ACC=0.9164 | HL=0.0836 | best_val_WF1=0.9022
Klebsiella_Pneumoniae | Binary antibiotics:  50%|█████     | 2/4 [12:41:16<12:47:27, 23023.86s/it]
[Klebsiella_Pneumoniae | Imipenem] Optuna search starting... (trials=200, cv=5)
[I 2026-02-28 03:28:47,396] A new study created in memory with name: no-name-49ef8c12-f1be-4976-a956-84fa1e7953ff

Klebsiella_Pneumoniae | Imipenem | Optuna:   0%|          | 0/200 [00:00<?, ?it/s][A[I 2026-02-28 03:29:17,371] Trial 33 finished with value: 0.9050666137971211 and parameters: {'activation': 'logistic', 'solver': 'adam', 'lr': 7.228236187517391e-05, 'layer1': 352, 'layer2': 389, 'layer3': 440}. Best is trial 20 with value: 0.9283335834984147.

Staphylococcus_Aureus | Fusidic acid | Optuna:  17%|█▋        | 34/200 [48:26<3:32:33, 76.83s/it, best=0.928][A
Staphylococcus_Aureus | Fusidic acid | Optuna:  17%|█▋        | 34/200 [48:26<3:32:33, 76.83s/it, best=0.928][A[I 2026-02-28 03:29:19,745] Trial 0 finished with value: 0.39222904514345214 and parameters: {'activation': 'logistic', 'solver': 'sgd', 'lr': 1.7073967431528114e-06, 'layer1': 435, 'layer2': 305, 'layer3': 357}. Best is trial 0 with value: 0.39222904514345214.

Klebsiella_Pneumoniae | Imipenem | Optuna:   0%|          | 1/200 [00:32<1:47:17, 32.35s/it][A
Klebsiella_Pneumoniae | Imipenem | Optuna:   0%|          | 1/200 [00:32<1:47:17, 32.35s/it, best=0.392][A[I 2026-02-28 03:29:47,256] Trial 60 finished with value: 0.8650552999989595 and parameters: {'activation': 'identity', 'solver': 'adam', 'lr': 0.0001623005212683818, 'layer1': 63, 'layer2': 433, 'layer3': 403}. Best is trial 34 with value: 0.8674293894305268.
Pseudomonas_Aeruginosa | LPS | Optuna:  30%|███       | 61/200 [1:24:49<2:40:40, 69.36s/it, best=0.867]Pseudomonas_Aeruginosa | LPS | Optuna:  30%|███       | 61/200 [1:24:49<2:40:40, 69.36s/it, best=0.867]/export/usuarios01/egarroyo/MALDI_for_AMR_prediction/venv/lib/python3.13/site-packages/sklearn/model_selection/_split.py:813: UserWarning: The least populated class in y has only 4 members, which is less than n_splits=5.
  warnings.warn(
[I 2026-02-28 03:29:47,469] Trial 103 finished with value: 0.8958669253865456 and parameters: {'activation': 'relu', 'solver': 'adam', 'lr': 5.438030770145148e-05, 'layer1': 432, 'layer2': 23, 'layer3': 407}. Best is trial 14 with value: 0.8971256036318559.

Escherichia_Coli | Ceftriaxone | Optuna:  52%|█████▏    | 104/200 [4:19:48<4:37:09, 173.22s/it, best=0.897][A
Escherichia_Coli | Ceftriaxone | Optuna:  52%|█████▏    | 104/200 [4:19:48<4:37:09, 173.22s/it, best=0.897][A[I 2026-02-28 03:29:50,252] Trial 1 finished with value: 0.9800270054346416 and parameters: {'activation': 'logistic', 'solver': 'adam', 'lr': 1.6480446427978994e-05, 'layer1': 267, 'layer2': 222, 'layer3': 152}. Best is trial 1 with value: 0.9800270054346416.

Klebsiella_Pneumoniae | Imipenem | Optuna:   1%|          | 2/200 [01:02<1:43:10, 31.26s/it, best=0.392][A
Klebsiella_Pneumoniae | Imipenem | Optuna:   1%|          | 2/200 [01:02<1:43:10, 31.26s/it, best=0.98] [A[I 2026-02-28 03:30:36,102] Trial 34 finished with value: 0.9215908014819121 and parameters: {'activation': 'identity', 'solver': 'adam', 'lr': 0.00042739184421278486, 'layer1': 279, 'layer2': 336, 'layer3': 283}. Best is trial 20 with value: 0.9283335834984147.

Staphylococcus_Aureus | Fusidic acid | Optuna:  18%|█▊        | 35/200 [49:45<3:32:50, 77.40s/it, best=0.928][A
Staphylococcus_Aureus | Fusidic acid | Optuna:  18%|█▊        | 35/200 [49:45<3:32:50, 77.40s/it, best=0.928][A[I 2026-02-28 03:31:00,467] Trial 2 finished with value: 0.9793398942603508 and parameters: {'activation': 'identity', 'solver': 'adam', 'lr': 6.290644294586145e-06, 'layer1': 262, 'layer2': 300, 'layer3': 32}. Best is trial 1 with value: 0.9800270054346416.

Klebsiella_Pneumoniae | Imipenem | Optuna:   2%|▏         | 3/200 [02:13<2:41:02, 49.05s/it, best=0.98][A
Klebsiella_Pneumoniae | Imipenem | Optuna:   2%|▏         | 3/200 [02:13<2:41:02, 49.05s/it, best=0.98][A[I 2026-02-28 03:31:42,700] Trial 3 finished with value: 0.9800270054346416 and parameters: {'activation': 'relu', 'solver': 'sgd', 'lr': 1.6536937182824424e-05, 'layer1': 57, 'layer2': 345, 'layer3': 226}. Best is trial 1 with value: 0.9800270054346416.

Klebsiella_Pneumoniae | Imipenem | Optuna:   2%|▏         | 4/200 [02:55<2:31:26, 46.36s/it, best=0.98][A
Klebsiella_Pneumoniae | Imipenem | Optuna:   2%|▏         | 4/200 [02:55<2:31:26, 46.36s/it, best=0.98][A[I 2026-02-28 03:31:46,686] Trial 35 finished with value: 0.9101817129195535 and parameters: {'activation': 'identity', 'solver': 'adam', 'lr': 7.811352829507434e-06, 'layer1': 288, 'layer2': 314, 'layer3': 387}. Best is trial 20 with value: 0.9283335834984147.

Staphylococcus_Aureus | Fusidic acid | Optuna:  18%|█▊        | 36/200 [50:55<3:25:58, 75.35s/it, best=0.928][A
Staphylococcus_Aureus | Fusidic acid | Optuna:  18%|█▊        | 36/200 [50:55<3:25:58, 75.35s/it, best=0.928][A[I 2026-02-28 03:31:59,337] Trial 104 finished with value: 0.8936305026301546 and parameters: {'activation': 'relu', 'solver': 'adam', 'lr': 7.755666772075874e-05, 'layer1': 381, 'layer2': 19, 'layer3': 404}. Best is trial 14 with value: 0.8971256036318559.

Escherichia_Coli | Ceftriaxone | Optuna:  52%|█████▎    | 105/200 [4:22:00<4:14:37, 160.82s/it, best=0.897][A
Escherichia_Coli | Ceftriaxone | Optuna:  52%|█████▎    | 105/200 [4:22:00<4:14:37, 160.82s/it, best=0.897][A[I 2026-02-28 03:32:03,010] Trial 61 finished with value: 0.865100485222249 and parameters: {'activation': 'identity', 'solver': 'adam', 'lr': 0.00025624081049903906, 'layer1': 480, 'layer2': 474, 'layer3': 415}. Best is trial 34 with value: 0.8674293894305268.
Pseudomonas_Aeruginosa | LPS | Optuna:  31%|███       | 62/200 [1:27:05<3:25:20, 89.28s/it, best=0.867]Pseudomonas_Aeruginosa | LPS | Optuna:  31%|███       | 62/200 [1:27:05<3:25:20, 89.28s/it, best=0.867]/export/usuarios01/egarroyo/MALDI_for_AMR_prediction/venv/lib/python3.13/site-packages/sklearn/model_selection/_split.py:813: UserWarning: The least populated class in y has only 4 members, which is less than n_splits=5.
  warnings.warn(
[I 2026-02-28 03:32:14,750] Trial 4 finished with value: 0.9800270054346416 and parameters: {'activation': 'relu', 'solver': 'adam', 'lr': 1.7654048052495086e-05, 'layer1': 265, 'layer2': 278, 'layer3': 100}. Best is trial 1 with value: 0.9800270054346416.

Klebsiella_Pneumoniae | Imipenem | Optuna:   2%|▎         | 5/200 [03:27<2:13:53, 41.20s/it, best=0.98][A
Klebsiella_Pneumoniae | Imipenem | Optuna:   2%|▎         | 5/200 [03:27<2:13:53, 41.20s/it, best=0.98][A[I 2026-02-28 03:33:18,837] Trial 5 finished with value: 0.9783295496554105 and parameters: {'activation': 'identity', 'solver': 'adam', 'lr': 2.259279742015697e-06, 'layer1': 106, 'layer2': 32, 'layer3': 169}. Best is trial 1 with value: 0.9800270054346416.

Klebsiella_Pneumoniae | Imipenem | Optuna:   3%|▎         | 6/200 [04:31<2:38:22, 48.98s/it, best=0.98][A
Klebsiella_Pneumoniae | Imipenem | Optuna:   3%|▎         | 6/200 [04:31<2:38:22, 48.98s/it, best=0.98][A[I 2026-02-28 03:33:57,939] Trial 62 finished with value: 0.8621994602997665 and parameters: {'activation': 'identity', 'solver': 'adam', 'lr': 0.00045047524818741424, 'layer1': 430, 'layer2': 358, 'layer3': 463}. Best is trial 34 with value: 0.8674293894305268.
Pseudomonas_Aeruginosa | LPS | Optuna:  32%|███▏      | 63/200 [1:28:59<3:41:25, 96.97s/it, best=0.867]Pseudomonas_Aeruginosa | LPS | Optuna:  32%|███▏      | 63/200 [1:28:59<3:41:25, 96.97s/it, best=0.867]/export/usuarios01/egarroyo/MALDI_for_AMR_prediction/venv/lib/python3.13/site-packages/sklearn/model_selection/_split.py:813: UserWarning: The least populated class in y has only 4 members, which is less than n_splits=5.
  warnings.warn(
[I 2026-02-28 03:34:18,232] Trial 105 finished with value: 0.8930591384156259 and parameters: {'activation': 'relu', 'solver': 'adam', 'lr': 6.0352808544234116e-05, 'layer1': 430, 'layer2': 176, 'layer3': 244}. Best is trial 14 with value: 0.8971256036318559.

Escherichia_Coli | Ceftriaxone | Optuna:  53%|█████▎    | 106/200 [4:24:19<4:01:38, 154.24s/it, best=0.897][A
Escherichia_Coli | Ceftriaxone | Optuna:  53%|█████▎    | 106/200 [4:24:19<4:01:38, 154.24s/it, best=0.897][A[I 2026-02-28 03:34:18,830] Trial 36 finished with value: 0.927585667082418 and parameters: {'activation': 'identity', 'solver': 'adam', 'lr': 0.00016018896491766854, 'layer1': 467, 'layer2': 464, 'layer3': 189}. Best is trial 20 with value: 0.9283335834984147.

Staphylococcus_Aureus | Fusidic acid | Optuna:  18%|█▊        | 37/200 [53:28<4:27:17, 98.39s/it, best=0.928][A
