Pseudomonas_Aeruginosa | Ciprofloxacin | Optuna:  36%|███▌      | 71/200 [1:09:27<2:06:15, 58.72s/it, best=0.875][A[I 2026-02-27 15:57:34,242] Trial 31 finished with value: 0.908113101958041 and parameters: {'activation': 'identity', 'solver': 'adam', 'lr': 0.0035013912053278727, 'layer1': 333, 'layer2': 419, 'layer3': 243}. Best is trial 12 with value: 0.9088083331363105.

Staphylococcus_Aureus | Oxacillin | Optuna:  16%|█▌        | 32/200 [1:10:03<5:00:02, 107.16s/it, best=0.909][A
Staphylococcus_Aureus | Oxacillin | Optuna:  16%|█▌        | 32/200 [1:10:03<5:00:02, 107.16s/it, best=0.909][A[I 2026-02-27 15:58:16,075] Trial 42 finished with value: 0.8285034263433643 and parameters: {'activation': 'identity', 'solver': 'adam', 'lr': 0.00016816699908818081, 'layer1': 474, 'layer2': 459, 'layer3': 166}. Best is trial 42 with value: 0.8285034263433643.

Klebsiella_Pneumoniae | Ciprofloxacin | Optuna:  22%|██▏       | 43/200 [1:10:45<4:47:49, 110.00s/it, best=0.827][A
Klebsiella_Pneumoniae | Ciprofloxacin | Optuna:  22%|██▏       | 43/200 [1:10:45<4:47:49, 110.00s/it, best=0.829][A[I 2026-02-27 15:58:18,683] Trial 71 finished with value: 0.8739088884136649 and parameters: {'activation': 'logistic', 'solver': 'adam', 'lr': 0.0002763255458737026, 'layer1': 313, 'layer2': 169, 'layer3': 500}. Best is trial 46 with value: 0.8754031846375991.

Pseudomonas_Aeruginosa | Ciprofloxacin | Optuna:  36%|███▌      | 72/200 [1:10:48<2:19:19, 65.31s/it, best=0.875][A
Pseudomonas_Aeruginosa | Ciprofloxacin | Optuna:  36%|███▌      | 72/200 [1:10:48<2:19:19, 65.31s/it, best=0.875][A[I 2026-02-27 15:59:21,562] Trial 72 finished with value: 0.8734300800216174 and parameters: {'activation': 'logistic', 'solver': 'adam', 'lr': 0.0004416787785251337, 'layer1': 309, 'layer2': 168, 'layer3': 499}. Best is trial 46 with value: 0.8754031846375991.

Pseudomonas_Aeruginosa | Ciprofloxacin | Optuna:  36%|███▋      | 73/200 [1:11:51<2:16:41, 64.58s/it, best=0.875][A
Pseudomonas_Aeruginosa | Ciprofloxacin | Optuna:  36%|███▋      | 73/200 [1:11:51<2:16:41, 64.58s/it, best=0.875][A[I 2026-02-27 16:00:12,493] Trial 43 finished with value: 0.8268967845321147 and parameters: {'activation': 'identity', 'solver': 'adam', 'lr': 0.0014217219629031777, 'layer1': 428, 'layer2': 417, 'layer3': 170}. Best is trial 42 with value: 0.8285034263433643.

Klebsiella_Pneumoniae | Ciprofloxacin | Optuna:  22%|██▏       | 44/200 [1:12:42<4:51:00, 111.92s/it, best=0.829][A
Klebsiella_Pneumoniae | Ciprofloxacin | Optuna:  22%|██▏       | 44/200 [1:12:42<4:51:00, 111.92s/it, best=0.829][A[I 2026-02-27 16:00:14,852] Trial 32 finished with value: 0.9048165032008757 and parameters: {'activation': 'identity', 'solver': 'adam', 'lr': 0.004768845380805212, 'layer1': 407, 'layer2': 406, 'layer3': 194}. Best is trial 12 with value: 0.9088083331363105.

Staphylococcus_Aureus | Oxacillin | Optuna:  16%|█▋        | 33/200 [1:12:44<5:42:53, 123.19s/it, best=0.909][A
Staphylococcus_Aureus | Oxacillin | Optuna:  16%|█▋        | 33/200 [1:12:44<5:42:53, 123.19s/it, best=0.909][A[I 2026-02-27 16:00:46,741] Trial 73 finished with value: 0.8752154077244544 and parameters: {'activation': 'logistic', 'solver': 'adam', 'lr': 0.0002317694853556345, 'layer1': 266, 'layer2': 136, 'layer3': 427}. Best is trial 46 with value: 0.8754031846375991.

Pseudomonas_Aeruginosa | Ciprofloxacin | Optuna:  37%|███▋      | 74/200 [1:13:16<2:28:35, 70.76s/it, best=0.875][A
Pseudomonas_Aeruginosa | Ciprofloxacin | Optuna:  37%|███▋      | 74/200 [1:13:16<2:28:35, 70.76s/it, best=0.875][A[I 2026-02-27 16:01:41,088] Trial 22 finished with value: 0.8056198592051895 and parameters: {'activation': 'logistic', 'solver': 'adam', 'lr': 4.357663115281137e-05, 'layer1': 374, 'layer2': 434, 'layer3': 454}. Best is trial 22 with value: 0.8056198592051895.

Escherichia_Coli | Ciprofloxacin | Optuna:  12%|█▏        | 23/200 [1:14:10<13:50:16, 281.45s/it, best=0.805][A
Escherichia_Coli | Ciprofloxacin | Optuna:  12%|█▏        | 23/200 [1:14:10<13:50:16, 281.45s/it, best=0.806][A[I 2026-02-27 16:02:07,101] Trial 33 finished with value: 0.9070823632653122 and parameters: {'activation': 'identity', 'solver': 'adam', 'lr': 0.0005851233434040687, 'layer1': 282, 'layer2': 367, 'layer3': 247}. Best is trial 12 with value: 0.9088083331363105.

Staphylococcus_Aureus | Oxacillin | Optuna:  17%|█▋        | 34/200 [1:14:36<5:31:45, 119.91s/it, best=0.909][A
Staphylococcus_Aureus | Oxacillin | Optuna:  17%|█▋        | 34/200 [1:14:36<5:31:45, 119.91s/it, best=0.909][A[I 2026-02-27 16:02:10,663] Trial 74 finished with value: 0.8716834351471864 and parameters: {'activation': 'logistic', 'solver': 'adam', 'lr': 0.00020540421234091472, 'layer1': 351, 'layer2': 124, 'layer3': 436}. Best is trial 46 with value: 0.8754031846375991.

Pseudomonas_Aeruginosa | Ciprofloxacin | Optuna:  38%|███▊      | 75/200 [1:14:40<2:35:38, 74.71s/it, best=0.875][A
Pseudomonas_Aeruginosa | Ciprofloxacin | Optuna:  38%|███▊      | 75/200 [1:14:40<2:35:38, 74.71s/it, best=0.875][A[I 2026-02-27 16:02:27,012] Trial 44 finished with value: 0.8265073641546644 and parameters: {'activation': 'identity', 'solver': 'adam', 'lr': 0.0017524246100417797, 'layer1': 427, 'layer2': 416, 'layer3': 86}. Best is trial 42 with value: 0.8285034263433643.

Klebsiella_Pneumoniae | Ciprofloxacin | Optuna:  22%|██▎       | 45/200 [1:14:56<5:06:38, 118.70s/it, best=0.829][A
Klebsiella_Pneumoniae | Ciprofloxacin | Optuna:  22%|██▎       | 45/200 [1:14:56<5:06:38, 118.70s/it, best=0.829][A[I 2026-02-27 16:03:36,115] Trial 75 finished with value: 0.8750526560486322 and parameters: {'activation': 'logistic', 'solver': 'adam', 'lr': 0.00024681620052749263, 'layer1': 261, 'layer2': 77, 'layer3': 410}. Best is trial 46 with value: 0.8754031846375991.

Pseudomonas_Aeruginosa | Ciprofloxacin | Optuna:  38%|███▊      | 76/200 [1:16:05<2:41:03, 77.93s/it, best=0.875][A
Pseudomonas_Aeruginosa | Ciprofloxacin | Optuna:  38%|███▊      | 76/200 [1:16:05<2:41:03, 77.93s/it, best=0.875][A[I 2026-02-27 16:04:00,628] Trial 34 finished with value: 0.9071241888521477 and parameters: {'activation': 'identity', 'solver': 'adam', 'lr': 0.002059375886769024, 'layer1': 248, 'layer2': 229, 'layer3': 205}. Best is trial 12 with value: 0.9088083331363105.

Staphylococcus_Aureus | Oxacillin | Optuna:  18%|█▊        | 35/200 [1:16:30<5:24:29, 117.99s/it, best=0.909][A
Staphylococcus_Aureus | Oxacillin | Optuna:  18%|█▊        | 35/200 [1:16:30<5:24:29, 117.99s/it, best=0.909][A[I 2026-02-27 16:04:35,498] Trial 76 finished with value: 0.8732193612945848 and parameters: {'activation': 'logistic', 'solver': 'adam', 'lr': 0.0005657090333922963, 'layer1': 259, 'layer2': 43, 'layer3': 408}. Best is trial 46 with value: 0.8754031846375991.

Pseudomonas_Aeruginosa | Ciprofloxacin | Optuna:  38%|███▊      | 77/200 [1:17:05<2:28:21, 72.37s/it, best=0.875][A
Pseudomonas_Aeruginosa | Ciprofloxacin | Optuna:  38%|███▊      | 77/200 [1:17:05<2:28:21, 72.37s/it, best=0.875][A[I 2026-02-27 16:04:40,045] Trial 45 finished with value: 0.8280700504363938 and parameters: {'activation': 'identity', 'solver': 'adam', 'lr': 0.002582869024777003, 'layer1': 426, 'layer2': 412, 'layer3': 82}. Best is trial 42 with value: 0.8285034263433643.

Klebsiella_Pneumoniae | Ciprofloxacin | Optuna:  23%|██▎       | 46/200 [1:17:09<5:15:42, 123.00s/it, best=0.829][A
Klebsiella_Pneumoniae | Ciprofloxacin | Optuna:  23%|██▎       | 46/200 [1:17:09<5:15:42, 123.00s/it, best=0.829][A[I 2026-02-27 16:05:27,281] Trial 77 finished with value: 0.8659844297500564 and parameters: {'activation': 'relu', 'solver': 'adam', 'lr': 0.00023578303338062635, 'layer1': 237, 'layer2': 87, 'layer3': 367}. Best is trial 46 with value: 0.8754031846375991.

Pseudomonas_Aeruginosa | Ciprofloxacin | Optuna:  39%|███▉      | 78/200 [1:17:56<2:14:35, 66.19s/it, best=0.875][A
Pseudomonas_Aeruginosa | Ciprofloxacin | Optuna:  39%|███▉      | 78/200 [1:17:56<2:14:35, 66.19s/it, best=0.875][A[I 2026-02-27 16:06:21,526] Trial 35 finished with value: 0.9039365321150175 and parameters: {'activation': 'logistic', 'solver': 'adam', 'lr': 0.00017533346432679523, 'layer1': 340, 'layer2': 468, 'layer3': 275}. Best is trial 12 with value: 0.9088083331363105.

Staphylococcus_Aureus | Oxacillin | Optuna:  18%|█▊        | 36/200 [1:18:51<5:41:18, 124.87s/it, best=0.909][A
Staphylococcus_Aureus | Oxacillin | Optuna:  18%|█▊        | 36/200 [1:18:51<5:41:18, 124.87s/it, best=0.909][A[I 2026-02-27 16:06:29,142] Trial 23 finished with value: 0.7997588376405081 and parameters: {'activation': 'logistic', 'solver': 'adam', 'lr': 4.6171396382943845e-05, 'layer1': 304, 'layer2': 370, 'layer3': 367}. Best is trial 22 with value: 0.8056198592051895.

Escherichia_Coli | Ciprofloxacin | Optuna:  12%|█▏        | 24/200 [1:18:58<13:51:23, 283.43s/it, best=0.806][A
Escherichia_Coli | Ciprofloxacin | Optuna:  12%|█▏        | 24/200 [1:18:58<13:51:23, 283.43s/it, best=0.806][A[I 2026-02-27 16:06:40,917] Trial 46 finished with value: 0.822914181319845 and parameters: {'activation': 'identity', 'solver': 'adam', 'lr': 0.0021775884230266014, 'layer1': 476, 'layer2': 364, 'layer3': 54}. Best is trial 42 with value: 0.8285034263433643.

Klebsiella_Pneumoniae | Ciprofloxacin | Optuna:  24%|██▎       | 47/200 [1:19:10<5:12:01, 122.36s/it, best=0.829][A
Klebsiella_Pneumoniae | Ciprofloxacin | Optuna:  24%|██▎       | 47/200 [1:19:10<5:12:01, 122.36s/it, best=0.829][A[I 2026-02-27 16:06:47,285] Trial 78 finished with value: 0.8563725412432559 and parameters: {'activation': 'logistic', 'solver': 'adam', 'lr': 0.0001347354402366242, 'layer1': 201, 'layer2': 434, 'layer3': 390}. Best is trial 46 with value: 0.8754031846375991.

Pseudomonas_Aeruginosa | Ciprofloxacin | Optuna:  40%|███▉      | 79/200 [1:19:16<2:21:50, 70.34s/it, best=0.875][A
Pseudomonas_Aeruginosa | Ciprofloxacin | Optuna:  40%|███▉      | 79/200 [1:19:16<2:21:50, 70.34s/it, best=0.875][A[I 2026-02-27 16:07:08,748] Trial 47 finished with value: 0.7452698739505725 and parameters: {'activation': 'identity', 'solver': 'sgd', 'lr': 0.003697368817112275, 'layer1': 425, 'layer2': 320, 'layer3': 23}. Best is trial 42 with value: 0.8285034263433643.

Klebsiella_Pneumoniae | Ciprofloxacin | Optuna:  24%|██▍       | 48/200 [1:19:38<3:58:08, 94.00s/it, best=0.829] [A
Klebsiella_Pneumoniae | Ciprofloxacin | Optuna:  24%|██▍       | 48/200 [1:19:38<3:58:08, 94.00s/it, best=0.829][A[I 2026-02-27 16:07:27,282] Trial 24 finished with value: 0.5956556079730723 and parameters: {'activation': 'logistic', 'solver': 'adam', 'lr': 9.536415403886372e-06, 'layer1': 372, 'layer2': 419, 'layer3': 462}. Best is trial 22 with value: 0.8056198592051895.

Escherichia_Coli | Ciprofloxacin | Optuna:  12%|█▎        | 25/200 [1:19:56<10:29:30, 215.83s/it, best=0.806][A
Escherichia_Coli | Ciprofloxacin | Optuna:  12%|█▎        | 25/200 [1:19:56<10:29:30, 215.83s/it, best=0.806][A[I 2026-02-27 16:07:46,057] Trial 79 finished with value: 0.858412111040715 and parameters: {'activation': 'identity', 'solver': 'adam', 'lr': 0.00010333905808792696, 'layer1': 247, 'layer2': 61, 'layer3': 425}. Best is trial 46 with value: 0.8754031846375991.

Pseudomonas_Aeruginosa | Ciprofloxacin | Optuna:  40%|████      | 80/200 [1:20:15<2:13:43, 66.87s/it, best=0.875][A
Pseudomonas_Aeruginosa | Ciprofloxacin | Optuna:  40%|████      | 80/200 [1:20:15<2:13:43, 66.87s/it, best=0.875][A[I 2026-02-27 16:07:48,183] Trial 48 finished with value: 0.7443458229675889 and parameters: {'activation': 'relu', 'solver': 'adam', 'lr': 0.00974806895715664, 'layer1': 446, 'layer2': 415, 'layer3': 164}. Best is trial 42 with value: 0.8285034263433643.

Klebsiella_Pneumoniae | Ciprofloxacin | Optuna:  24%|██▍       | 49/200 [1:20:17<3:15:22, 77.63s/it, best=0.829][A
Klebsiella_Pneumoniae | Ciprofloxacin | Optuna:  24%|██▍       | 49/200 [1:20:17<3:15:22, 77.63s/it, best=0.829][A[I 2026-02-27 16:07:58,258] Trial 36 finished with value: 0.9007840075563198 and parameters: {'activation': 'relu', 'solver': 'adam', 'lr': 0.001094595519475381, 'layer1': 254, 'layer2': 429, 'layer3': 172}. Best is trial 12 with value: 0.9088083331363105.

Staphylococcus_Aureus | Oxacillin | Optuna:  18%|█▊        | 37/200 [1:20:27<5:16:17, 116.43s/it, best=0.909][A
Staphylococcus_Aureus | Oxacillin | Optuna:  18%|█▊        | 37/200 [1:20:27<5:16:17, 116.43s/it, best=0.909][A[I 2026-02-27 16:08:10,078] Trial 80 finished with value: 0.8159756916186209 and parameters: {'activation': 'logistic', 'solver': 'adam', 'lr': 6.770912694796283e-05, 'layer1': 275, 'layer2': 137, 'layer3': 430}. Best is trial 46 with value: 0.8754031846375991.

Pseudomonas_Aeruginosa | Ciprofloxacin | Optuna:  40%|████      | 81/200 [1:20:39<1:47:07, 54.01s/it, best=0.875][A
Pseudomonas_Aeruginosa | Ciprofloxacin | Optuna:  40%|████      | 81/200 [1:20:39<1:47:07, 54.01s/it, best=0.875][A[I 2026-02-27 16:08:56,426] Trial 81 finished with value: 0.8413909479131918 and parameters: {'activation': 'logistic', 'solver': 'adam', 'lr': 0.0002616630683595358, 'layer1': 286, 'layer2': 109, 'layer3': 127}. Best is trial 46 with value: 0.8754031846375991.

Pseudomonas_Aeruginosa | Ciprofloxacin | Optuna:  41%|████      | 82/200 [1:21:26<1:41:42, 51.71s/it, best=0.875][A
Pseudomonas_Aeruginosa | Ciprofloxacin | Optuna:  41%|████      | 82/200 [1:21:26<1:41:42, 51.71s/it, best=0.875][A[I 2026-02-27 16:09:44,186] Trial 49 finished with value: 0.8238401509648702 and parameters: {'activation': 'identity', 'solver': 'adam', 'lr': 0.005167655104369546, 'layer1': 395, 'layer2': 471, 'layer3': 103}. Best is trial 42 with value: 0.8285034263433643.

Klebsiella_Pneumoniae | Ciprofloxacin | Optuna:  25%|██▌       | 50/200 [1:22:13<3:42:51, 89.14s/it, best=0.829][A
Klebsiella_Pneumoniae | Ciprofloxacin | Optuna:  25%|██▌       | 50/200 [1:22:13<3:42:51, 89.14s/it, best=0.829][A[I 2026-02-27 16:10:09,257] Trial 82 finished with value: 0.8738572694634396 and parameters: {'activation': 'logistic', 'solver': 'adam', 'lr': 0.00034842029077056843, 'layer1': 331, 'layer2': 194, 'layer3': 444}. Best is trial 46 with value: 0.8754031846375991.

Pseudomonas_Aeruginosa | Ciprofloxacin | Optuna:  42%|████▏     | 83/200 [1:22:38<1:53:11, 58.05s/it, best=0.875][A
Pseudomonas_Aeruginosa | Ciprofloxacin | Optuna:  42%|████▏     | 83/200 [1:22:38<1:53:11, 58.05s/it, best=0.875][A[I 2026-02-27 16:10:20,895] Trial 37 finished with value: 0.8995679923891485 and parameters: {'activation': 'identity', 'solver': 'adam', 'lr': 2.6932040886167545e-05, 'layer1': 418, 'layer2': 329, 'layer3': 139}. Best is trial 12 with value: 0.9088083331363105.

Staphylococcus_Aureus | Oxacillin | Optuna:  19%|█▉        | 38/200 [1:22:50<5:35:34, 124.29s/it, best=0.909][A
Staphylococcus_Aureus | Oxacillin | Optuna:  19%|█▉        | 38/200 [1:22:50<5:35:34, 124.29s/it, best=0.909][A[I 2026-02-27 16:10:29,750] Trial 83 finished with value: 0.8159756916186209 and parameters: {'activation': 'logistic', 'solver': 'adam', 'lr': 0.00018898392259892062, 'layer1': 227, 'layer2': 16, 'layer3': 487}. Best is trial 46 with value: 0.8754031846375991.

Pseudomonas_Aeruginosa | Ciprofloxacin | Optuna:  42%|████▏     | 84/200 [1:22:59<1:30:26, 46.78s/it, best=0.875][A
Pseudomonas_Aeruginosa | Ciprofloxacin | Optuna:  42%|████▏     | 84/200 [1:22:59<1:30:26, 46.78s/it, best=0.875][A[I 2026-02-27 16:11:03,207] Trial 50 finished with value: 0.8092285490901417 and parameters: {'activation': 'tanh', 'solver': 'adam', 'lr': 0.0008416327053639089, 'layer1': 489, 'layer2': 403, 'layer3': 134}. Best is trial 42 with value: 0.8285034263433643.

Klebsiella_Pneumoniae | Ciprofloxacin | Optuna:  26%|██▌       | 51/200 [1:23:32<3:33:49, 86.11s/it, best=0.829][A
Klebsiella_Pneumoniae | Ciprofloxacin | Optuna:  26%|██▌       | 51/200 [1:23:32<3:33:49, 86.11s/it, best=0.829][A[I 2026-02-27 16:11:30,873] Trial 84 finished with value: 0.8705294228619372 and parameters: {'activation': 'logistic', 'solver': 'adam', 'lr': 0.0006505585238076546, 'layer1': 293, 'layer2': 226, 'layer3': 467}. Best is trial 46 with value: 0.8754031846375991.

Pseudomonas_Aeruginosa | Ciprofloxacin | Optuna:  42%|████▎     | 85/200 [1:24:00<1:37:54, 51.08s/it, best=0.875][A
Pseudomonas_Aeruginosa | Ciprofloxacin | Optuna:  42%|████▎     | 85/200 [1:24:00<1:37:54, 51.08s/it, best=0.875][A[I 2026-02-27 16:12:05,058] Trial 51 finished with value: 0.8238216605575903 and parameters: {'activation': 'identity', 'solver': 'adam', 'lr': 0.001453634923800186, 'layer1': 11, 'layer2': 437, 'layer3': 80}. Best is trial 42 with value: 0.8285034263433643.

Klebsiella_Pneumoniae | Ciprofloxacin | Optuna:  26%|██▌       | 52/200 [1:24:34<3:14:26, 78.83s/it, best=0.829][A
Klebsiella_Pneumoniae | Ciprofloxacin | Optuna:  26%|██▌       | 52/200 [1:24:34<3:14:26, 78.83s/it, best=0.829][A[I 2026-02-27 16:12:12,698] Trial 25 finished with value: 0.7545544880497281 and parameters: {'activation': 'logistic', 'solver': 'adam', 'lr': 3.274756987209483e-05, 'layer1': 203, 'layer2': 335, 'layer3': 375}. Best is trial 22 with value: 0.8056198592051895.

Escherichia_Coli | Ciprofloxacin | Optuna:  13%|█▎        | 26/200 [1:24:42<11:26:27, 236.71s/it, best=0.806][A
Escherichia_Coli | Ciprofloxacin | Optuna:  13%|█▎        | 26/200 [1:24:42<11:26:27, 236.71s/it, best=0.806][A[I 2026-02-27 16:12:37,210] Trial 85 finished with value: 0.8727721582773696 and parameters: {'activation': 'logistic', 'solver': 'adam', 'lr': 0.0004075429656403836, 'layer1': 322, 'layer2': 243, 'layer3': 453}. Best is trial 46 with value: 0.8754031846375991.

Pseudomonas_Aeruginosa | Ciprofloxacin | Optuna:  43%|████▎     | 86/200 [1:25:06<1:45:45, 55.66s/it, best=0.875][A
Pseudomonas_Aeruginosa | Ciprofloxacin | Optuna:  43%|████▎     | 86/200 [1:25:06<1:45:45, 55.66s/it, best=0.875][A[I 2026-02-27 16:12:54,755] Trial 26 finished with value: 0.5920038260220011 and parameters: {'activation': 'logistic', 'solver': 'sgd', 'lr': 7.983524319947907e-05, 'layer1': 323, 'layer2': 346, 'layer3': 307}. Best is trial 22 with value: 0.8056198592051895.

Escherichia_Coli | Ciprofloxacin | Optuna:  14%|█▎        | 27/200 [1:25:24<8:34:07, 178.31s/it, best=0.806] [A
Escherichia_Coli | Ciprofloxacin | Optuna:  14%|█▎        | 27/200 [1:25:24<8:34:07, 178.31s/it, best=0.806][A[I 2026-02-27 16:12:58,328] Trial 86 finished with value: 0.8159756916186209 and parameters: {'activation': 'logistic', 'solver': 'sgd', 'lr': 0.0001614593366624966, 'layer1': 255, 'layer2': 416, 'layer3': 488}. Best is trial 46 with value: 0.8754031846375991.

Pseudomonas_Aeruginosa | Ciprofloxacin | Optuna:  44%|████▎     | 87/200 [1:25:28<1:25:18, 45.30s/it, best=0.875][A
Pseudomonas_Aeruginosa | Ciprofloxacin | Optuna:  44%|████▎     | 87/200 [1:25:28<1:25:18, 45.30s/it, best=0.875][A[I 2026-02-27 16:13:29,524] Trial 38 finished with value: 0.8977219486923793 and parameters: {'activation': 'identity', 'solver': 'sgd', 'lr': 0.0053539491895446, 'layer1': 380, 'layer2': 291, 'layer3': 324}. Best is trial 12 with value: 0.9088083331363105.

Staphylococcus_Aureus | Oxacillin | Optuna:  20%|█▉        | 39/200 [1:25:59<6:25:18, 143.59s/it, best=0.909][A
Staphylococcus_Aureus | Oxacillin | Optuna:  20%|█▉        | 39/200 [1:25:59<6:25:18, 143.59s/it, best=0.909][A[I 2026-02-27 16:13:44,757] Trial 87 finished with value: 0.8685296131648794 and parameters: {'activation': 'logistic', 'solver': 'adam', 'lr': 0.0008603161658365495, 'layer1': 269, 'layer2': 91, 'layer3': 411}. Best is trial 46 with value: 0.8754031846375991.

Pseudomonas_Aeruginosa | Ciprofloxacin | Optuna:  44%|████▍     | 88/200 [1:26:14<1:25:11, 45.64s/it, best=0.875][A
Pseudomonas_Aeruginosa | Ciprofloxacin | Optuna:  44%|████▍     | 88/200 [1:26:14<1:25:11, 45.64s/it, best=0.875][A[I 2026-02-27 16:13:48,365] Trial 27 finished with value: 0.5920038260220011 and parameters: {'activation': 'logistic', 'solver': 'adam', 'lr': 2.6260574948641315e-05, 'layer1': 234, 'layer2': 413, 'layer3': 444}. Best is trial 22 with value: 0.8056198592051895.

Escherichia_Coli | Ciprofloxacin | Optuna:  14%|█▍        | 28/200 [1:26:17<6:43:54, 140.90s/it, best=0.806][A
Escherichia_Coli | Ciprofloxacin | Optuna:  14%|█▍        | 28/200 [1:26:17<6:43:54, 140.90s/it, best=0.806][A[I 2026-02-27 16:13:48,672] Trial 52 finished with value: 0.8218252874004008 and parameters: {'activation': 'identity', 'solver': 'adam', 'lr': 0.002091679488777758, 'layer1': 419, 'layer2': 410, 'layer3': 91}. Best is trial 42 with value: 0.8285034263433643.

Klebsiella_Pneumoniae | Ciprofloxacin | Optuna:  26%|██▋       | 53/200 [1:26:18<3:31:21, 86.27s/it, best=0.829][A
Klebsiella_Pneumoniae | Ciprofloxacin | Optuna:  26%|██▋       | 53/200 [1:26:18<3:31:21, 86.27s/it, best=0.829][A[I 2026-02-27 16:15:18,218] Trial 88 finished with value: 0.8745811631544308 and parameters: {'activation': 'logistic', 'solver': 'adam', 'lr': 0.0002490983772827246, 'layer1': 354, 'layer2': 179, 'layer3': 391}. Best is trial 46 with value: 0.8754031846375991.

Pseudomonas_Aeruginosa | Ciprofloxacin | Optuna:  44%|████▍     | 89/200 [1:27:47<1:50:58, 59.98s/it, best=0.875][A
Pseudomonas_Aeruginosa | Ciprofloxacin | Optuna:  44%|████▍     | 89/200 [1:27:47<1:50:58, 59.98s/it, best=0.875][A[I 2026-02-27 16:15:28,559] Trial 53 finished with value: 0.8174164051564693 and parameters: {'activation': 'identity', 'solver': 'adam', 'lr': 0.0002666556981858219, 'layer1': 445, 'layer2': 477, 'layer3': 113}. Best is trial 42 with value: 0.8285034263433643.

Klebsiella_Pneumoniae | Ciprofloxacin | Optuna:  27%|██▋       | 54/200 [1:27:58<3:39:51, 90.35s/it, best=0.829][A
