Staphylococcus_Aureus | LPS | Optuna:  76%|███████▋  | 153/200 [5:16:35<57:05, 72.87s/it, best=0.888]Staphylococcus_Aureus | LPS | Optuna:  76%|███████▋  | 153/200 [5:16:35<57:05, 72.87s/it, best=0.888][I 2026-02-28 13:23:29,370] Trial 196 finished with value: 0.9224300910402453 and parameters: {'activation': 'identity', 'solver': 'adam', 'lr': 0.0007018958665560902, 'layer1': 39, 'layer2': 439, 'layer3': 64}. Best is trial 176 with value: 0.9259010571783157.
Klebsiella_Pneumoniae | LPS | Optuna:  98%|█████████▊| 197/200 [4:35:45<02:50, 56.86s/it, best=0.926]Klebsiella_Pneumoniae | LPS | Optuna:  98%|█████████▊| 197/200 [4:35:45<02:50, 56.86s/it, best=0.926][I 2026-02-28 13:23:39,069] Trial 151 finished with value: 0.9155515969001051 and parameters: {'activation': 'relu', 'solver': 'adam', 'lr': 0.00031204895090821967, 'layer1': 339, 'layer2': 329, 'layer3': 273}. Best is trial 74 with value: 0.9166002918687234.

Escherichia_Coli | Piperacillin-Tazobactam | Optuna:  76%|███████▌  | 152/200 [5:19:31<1:42:37, 128.29s/it, best=0.917][A
Escherichia_Coli | Piperacillin-Tazobactam | Optuna:  76%|███████▌  | 152/200 [5:19:31<1:42:37, 128.29s/it, best=0.917][A[I 2026-02-28 13:24:01,437] Trial 153 finished with value: 0.8846448623467049 and parameters: {'activation': 'identity', 'solver': 'adam', 'lr': 0.00031705749785591555, 'layer1': 152, 'layer2': 111, 'layer3': 340}. Best is trial 8 with value: 0.8879562150966016.
Staphylococcus_Aureus | LPS | Optuna:  77%|███████▋  | 154/200 [5:17:47<55:49, 72.81s/it, best=0.888]Staphylococcus_Aureus | LPS | Optuna:  77%|███████▋  | 154/200 [5:17:47<55:49, 72.81s/it, best=0.888][I 2026-02-28 13:24:20,194] Trial 197 finished with value: 0.9193984562644356 and parameters: {'activation': 'relu', 'solver': 'adam', 'lr': 0.0006337406423665775, 'layer1': 56, 'layer2': 395, 'layer3': 55}. Best is trial 176 with value: 0.9259010571783157.
Klebsiella_Pneumoniae | LPS | Optuna:  99%|█████████▉| 198/200 [4:36:36<01:50, 55.05s/it, best=0.926]Klebsiella_Pneumoniae | LPS | Optuna:  99%|█████████▉| 198/200 [4:36:36<01:50, 55.05s/it, best=0.926][I 2026-02-28 13:25:13,011] Trial 154 finished with value: 0.885296570042686 and parameters: {'activation': 'identity', 'solver': 'adam', 'lr': 0.0005313978716559324, 'layer1': 164, 'layer2': 102, 'layer3': 369}. Best is trial 8 with value: 0.8879562150966016.
Staphylococcus_Aureus | LPS | Optuna:  78%|███████▊  | 155/200 [5:18:59<54:19, 72.44s/it, best=0.888]Staphylococcus_Aureus | LPS | Optuna:  78%|███████▊  | 155/200 [5:18:59<54:19, 72.44s/it, best=0.888][I 2026-02-28 13:25:23,346] Trial 198 finished with value: 0.9230226264917386 and parameters: {'activation': 'identity', 'solver': 'adam', 'lr': 0.00018984000428414277, 'layer1': 31, 'layer2': 445, 'layer3': 343}. Best is trial 176 with value: 0.9259010571783157.
Klebsiella_Pneumoniae | LPS | Optuna: 100%|█████████▉| 199/200 [4:37:39<00:57, 57.48s/it, best=0.926]Klebsiella_Pneumoniae | LPS | Optuna: 100%|█████████▉| 199/200 [4:37:39<00:57, 57.48s/it, best=0.926][I 2026-02-28 13:25:55,527] Trial 152 finished with value: 0.9146916321892633 and parameters: {'activation': 'relu', 'solver': 'adam', 'lr': 0.0002918591761238229, 'layer1': 348, 'layer2': 394, 'layer3': 239}. Best is trial 74 with value: 0.9166002918687234.

Escherichia_Coli | Piperacillin-Tazobactam | Optuna:  76%|███████▋  | 153/200 [5:21:48<1:42:24, 130.74s/it, best=0.917][A
Escherichia_Coli | Piperacillin-Tazobactam | Optuna:  76%|███████▋  | 153/200 [5:21:48<1:42:24, 130.74s/it, best=0.917][A[I 2026-02-28 13:26:05,519] Trial 199 finished with value: 0.8710171143541545 and parameters: {'activation': 'tanh', 'solver': 'sgd', 'lr': 0.0005356867807250672, 'layer1': 80, 'layer2': 466, 'layer3': 35}. Best is trial 176 with value: 0.9259010571783157.
Klebsiella_Pneumoniae | LPS | Optuna: 100%|██████████| 200/200 [4:38:21<00:00, 52.89s/it, best=0.926]Klebsiella_Pneumoniae | LPS | Optuna: 100%|██████████| 200/200 [4:38:21<00:00, 52.89s/it, best=0.926]                                                                                                     [Klebsiella_Pneumoniae | LPS] [OPTUNA DONE] Best CV WF1=0.9259 | params={'activation': 'identity', 'solver': 'adam', 'lr': 0.00040226027906096475, 'layer1': 66, 'layer2': 461, 'layer3': 33}
[Klebsiella_Pneumoniae | LPS] Retraining with validation early stopping (10% split)...
[Klebsiella_Pneumoniae | LPS] Testing...
[Klebsiella_Pneumoniae | LPS] [TEST] WF1=0.9203 | ACC=0.9315 | HL=0.0685 | best_val_WF1=0.9283

[Klebsiella_Pneumoniae] ===== Direct multilabel training =====
[I 2026-02-28 13:26:14,339] A new study created in memory with name: no-name-2a0021b2-f10e-4071-909f-81b23d727a11
Klebsiella_Pneumoniae | DirectMulti | Optuna:   0%|          | 0/200 [00:00<?, ?it/s][I 2026-02-28 13:26:18,054] Trial 155 finished with value: 0.8857373128316798 and parameters: {'activation': 'identity', 'solver': 'adam', 'lr': 0.00039827627828786094, 'layer1': 66, 'layer2': 92, 'layer3': 347}. Best is trial 8 with value: 0.8879562150966016.
Staphylococcus_Aureus | LPS | Optuna:  78%|███████▊  | 156/200 [5:20:04<51:29, 70.22s/it, best=0.888]Staphylococcus_Aureus | LPS | Optuna:  78%|███████▊  | 156/200 [5:20:04<51:29, 70.22s/it, best=0.888][I 2026-02-28 13:26:45,565] Trial 0 finished with value: 0.45091038134788536 and parameters: {'activation': 'logistic', 'solver': 'sgd', 'lr': 1.7073967431528114e-06, 'layer1': 435, 'layer2': 305, 'layer3': 357}. Best is trial 0 with value: 0.45091038134788536.
Klebsiella_Pneumoniae | DirectMulti | Optuna:   0%|          | 1/200 [00:31<1:43:33, 31.23s/it]Klebsiella_Pneumoniae | DirectMulti | Optuna:   0%|          | 1/200 [00:31<1:43:33, 31.23s/it, best=0.451][I 2026-02-28 13:27:04,885] Trial 153 finished with value: 0.9101573161933917 and parameters: {'activation': 'relu', 'solver': 'adam', 'lr': 0.00020595901110156674, 'layer1': 34, 'layer2': 330, 'layer3': 260}. Best is trial 74 with value: 0.9166002918687234.

Escherichia_Coli | Piperacillin-Tazobactam | Optuna:  77%|███████▋  | 154/200 [5:22:57<1:26:06, 112.33s/it, best=0.917][A
Escherichia_Coli | Piperacillin-Tazobactam | Optuna:  77%|███████▋  | 154/200 [5:22:57<1:26:06, 112.33s/it, best=0.917][A[I 2026-02-28 13:27:12,845] Trial 1 finished with value: 0.8702461473038209 and parameters: {'activation': 'logistic', 'solver': 'adam', 'lr': 1.6480446427978994e-05, 'layer1': 267, 'layer2': 222, 'layer3': 152}. Best is trial 1 with value: 0.8702461473038209.
Klebsiella_Pneumoniae | DirectMulti | Optuna:   1%|          | 2/200 [00:58<1:35:23, 28.90s/it, best=0.451]Klebsiella_Pneumoniae | DirectMulti | Optuna:   1%|          | 2/200 [00:58<1:35:23, 28.90s/it, best=0.87] [I 2026-02-28 13:27:41,685] Trial 156 finished with value: 0.886310365286248 and parameters: {'activation': 'identity', 'solver': 'adam', 'lr': 0.00027498485176295973, 'layer1': 320, 'layer2': 79, 'layer3': 312}. Best is trial 8 with value: 0.8879562150966016.
Staphylococcus_Aureus | LPS | Optuna:  78%|███████▊  | 157/200 [5:21:28<53:12, 74.24s/it, best=0.888]Staphylococcus_Aureus | LPS | Optuna:  78%|███████▊  | 157/200 [5:21:28<53:12, 74.24s/it, best=0.888][I 2026-02-28 13:28:26,606] Trial 157 finished with value: 0.8791465037065869 and parameters: {'activation': 'tanh', 'solver': 'adam', 'lr': 0.0006868256272501808, 'layer1': 90, 'layer2': 45, 'layer3': 266}. Best is trial 8 with value: 0.8879562150966016.
Staphylococcus_Aureus | LPS | Optuna:  79%|███████▉  | 158/200 [5:22:12<45:48, 65.45s/it, best=0.888]Staphylococcus_Aureus | LPS | Optuna:  79%|███████▉  | 158/200 [5:22:12<45:48, 65.45s/it, best=0.888][I 2026-02-28 13:28:54,764] Trial 154 finished with value: 0.9133579919038148 and parameters: {'activation': 'relu', 'solver': 'adam', 'lr': 0.00034145204149421194, 'layer1': 329, 'layer2': 340, 'layer3': 260}. Best is trial 74 with value: 0.9166002918687234.

Escherichia_Coli | Piperacillin-Tazobactam | Optuna:  78%|███████▊  | 155/200 [5:24:47<1:23:41, 111.59s/it, best=0.917][A
Escherichia_Coli | Piperacillin-Tazobactam | Optuna:  78%|███████▊  | 155/200 [5:24:47<1:23:41, 111.59s/it, best=0.917][A[I 2026-02-28 13:29:46,298] Trial 2 finished with value: 0.896646239815564 and parameters: {'activation': 'identity', 'solver': 'adam', 'lr': 6.290644294586145e-06, 'layer1': 262, 'layer2': 300, 'layer3': 32}. Best is trial 2 with value: 0.896646239815564.
Klebsiella_Pneumoniae | DirectMulti | Optuna:   2%|▏         | 3/200 [03:31<4:41:37, 85.78s/it, best=0.87]Klebsiella_Pneumoniae | DirectMulti | Optuna:   2%|▏         | 3/200 [03:31<4:41:37, 85.78s/it, best=0.897][I 2026-02-28 13:29:57,593] Trial 158 finished with value: 0.8855908707255111 and parameters: {'activation': 'identity', 'solver': 'adam', 'lr': 0.0004878917823661556, 'layer1': 298, 'layer2': 103, 'layer3': 322}. Best is trial 8 with value: 0.8879562150966016.
Staphylococcus_Aureus | LPS | Optuna:  80%|███████▉  | 159/200 [5:23:43<49:57, 73.11s/it, best=0.888]Staphylococcus_Aureus | LPS | Optuna:  80%|███████▉  | 159/200 [5:23:43<49:57, 73.11s/it, best=0.888][I 2026-02-28 13:30:58,113] Trial 155 finished with value: 0.9133374427940725 and parameters: {'activation': 'relu', 'solver': 'adam', 'lr': 0.00027927323072640046, 'layer1': 338, 'layer2': 319, 'layer3': 283}. Best is trial 74 with value: 0.9166002918687234.

Escherichia_Coli | Piperacillin-Tazobactam | Optuna:  78%|███████▊  | 156/200 [5:26:50<1:24:25, 115.12s/it, best=0.917][A
Escherichia_Coli | Piperacillin-Tazobactam | Optuna:  78%|███████▊  | 156/200 [5:26:50<1:24:25, 115.12s/it, best=0.917][A[I 2026-02-28 13:31:10,274] Trial 159 finished with value: 0.8824778050497215 and parameters: {'activation': 'relu', 'solver': 'adam', 'lr': 0.0003438479643288776, 'layer1': 124, 'layer2': 69, 'layer3': 332}. Best is trial 8 with value: 0.8879562150966016.
Staphylococcus_Aureus | LPS | Optuna:  80%|████████  | 160/200 [5:24:56<48:39, 72.98s/it, best=0.888]Staphylococcus_Aureus | LPS | Optuna:  80%|████████  | 160/200 [5:24:56<48:39, 72.98s/it, best=0.888][I 2026-02-28 13:32:49,250] Trial 160 finished with value: 0.8862130094472137 and parameters: {'activation': 'identity', 'solver': 'adam', 'lr': 0.0008577754278743028, 'layer1': 235, 'layer2': 119, 'layer3': 292}. Best is trial 8 with value: 0.8879562150966016.
Staphylococcus_Aureus | LPS | Optuna:  80%|████████  | 161/200 [5:26:35<52:30, 80.78s/it, best=0.888]Staphylococcus_Aureus | LPS | Optuna:  80%|████████  | 161/200 [5:26:35<52:30, 80.78s/it, best=0.888][I 2026-02-28 13:33:04,742] Trial 156 finished with value: 0.9134335630607368 and parameters: {'activation': 'relu', 'solver': 'adam', 'lr': 0.0004071950364518407, 'layer1': 389, 'layer2': 287, 'layer3': 282}. Best is trial 74 with value: 0.9166002918687234.

Escherichia_Coli | Piperacillin-Tazobactam | Optuna:  78%|███████▊  | 157/200 [5:28:57<1:24:58, 118.57s/it, best=0.917][A
Escherichia_Coli | Piperacillin-Tazobactam | Optuna:  78%|███████▊  | 157/200 [5:28:57<1:24:58, 118.57s/it, best=0.917][A[I 2026-02-28 13:33:06,643] Trial 3 finished with value: 0.7819090842468113 and parameters: {'activation': 'relu', 'solver': 'sgd', 'lr': 1.6536937182824424e-05, 'layer1': 57, 'layer2': 345, 'layer3': 226}. Best is trial 2 with value: 0.896646239815564.
Klebsiella_Pneumoniae | DirectMulti | Optuna:   2%|▏         | 4/200 [06:52<7:07:57, 131.01s/it, best=0.897]Klebsiella_Pneumoniae | DirectMulti | Optuna:   2%|▏         | 4/200 [06:52<7:07:57, 131.01s/it, best=0.897][I 2026-02-28 13:33:36,913] Trial 4 finished with value: 0.8709758857727044 and parameters: {'activation': 'relu', 'solver': 'adam', 'lr': 1.7654048052495086e-05, 'layer1': 265, 'layer2': 278, 'layer3': 100}. Best is trial 2 with value: 0.896646239815564.
Klebsiella_Pneumoniae | DirectMulti | Optuna:   2%|▎         | 5/200 [07:22<5:07:42, 94.68s/it, best=0.897] Klebsiella_Pneumoniae | DirectMulti | Optuna:   2%|▎         | 5/200 [07:22<5:07:42, 94.68s/it, best=0.897][I 2026-02-28 13:34:13,251] Trial 161 finished with value: 0.8846920813949071 and parameters: {'activation': 'identity', 'solver': 'adam', 'lr': 0.0002144533579037868, 'layer1': 180, 'layer2': 125, 'layer3': 300}. Best is trial 8 with value: 0.8879562150966016.
Staphylococcus_Aureus | LPS | Optuna:  81%|████████  | 162/200 [5:27:59<51:46, 81.75s/it, best=0.888]Staphylococcus_Aureus | LPS | Optuna:  81%|████████  | 162/200 [5:27:59<51:46, 81.75s/it, best=0.888][I 2026-02-28 13:34:54,323] Trial 157 finished with value: 0.9151911998147838 and parameters: {'activation': 'relu', 'solver': 'adam', 'lr': 0.00016764732969551271, 'layer1': 410, 'layer2': 305, 'layer3': 248}. Best is trial 74 with value: 0.9166002918687234.

Escherichia_Coli | Piperacillin-Tazobactam | Optuna:  79%|███████▉  | 158/200 [5:30:46<1:21:06, 115.87s/it, best=0.917][A
Escherichia_Coli | Piperacillin-Tazobactam | Optuna:  79%|███████▉  | 158/200 [5:30:46<1:21:06, 115.87s/it, best=0.917][A[I 2026-02-28 13:35:16,474] Trial 5 finished with value: 0.7687152693644143 and parameters: {'activation': 'identity', 'solver': 'adam', 'lr': 2.259279742015697e-06, 'layer1': 106, 'layer2': 32, 'layer3': 169}. Best is trial 2 with value: 0.896646239815564.
Klebsiella_Pneumoniae | DirectMulti | Optuna:   3%|▎         | 6/200 [09:02<5:11:29, 96.34s/it, best=0.897]Klebsiella_Pneumoniae | DirectMulti | Optuna:   3%|▎         | 6/200 [09:02<5:11:29, 96.34s/it, best=0.897][I 2026-02-28 13:35:46,093] Trial 162 finished with value: 0.886581398414927 and parameters: {'activation': 'identity', 'solver': 'adam', 'lr': 0.00019046705864264577, 'layer1': 168, 'layer2': 108, 'layer3': 306}. Best is trial 8 with value: 0.8879562150966016.
Staphylococcus_Aureus | LPS | Optuna:  82%|████████▏ | 163/200 [5:29:32<52:27, 85.07s/it, best=0.888]Staphylococcus_Aureus | LPS | Optuna:  82%|████████▏ | 163/200 [5:29:32<52:27, 85.07s/it, best=0.888][I 2026-02-28 13:37:10,712] Trial 158 finished with value: 0.9100962030299915 and parameters: {'activation': 'logistic', 'solver': 'adam', 'lr': 0.00022633667202245298, 'layer1': 354, 'layer2': 385, 'layer3': 299}. Best is trial 74 with value: 0.9166002918687234.

Escherichia_Coli | Piperacillin-Tazobactam | Optuna:  80%|███████▉  | 159/200 [5:33:03<1:23:23, 122.03s/it, best=0.917][A
Escherichia_Coli | Piperacillin-Tazobactam | Optuna:  80%|███████▉  | 159/200 [5:33:03<1:23:23, 122.03s/it, best=0.917][A[I 2026-02-28 13:37:19,563] Trial 163 finished with value: 0.8856365974776704 and parameters: {'activation': 'identity', 'solver': 'adam', 'lr': 0.0002797027687416121, 'layer1': 150, 'layer2': 215, 'layer3': 363}. Best is trial 8 with value: 0.8879562150966016.
Staphylococcus_Aureus | LPS | Optuna:  82%|████████▏ | 164/200 [5:31:05<52:33, 87.59s/it, best=0.888]Staphylococcus_Aureus | LPS | Optuna:  82%|████████▏ | 164/200 [5:31:05<52:33, 87.59s/it, best=0.888][I 2026-02-28 13:38:32,738] Trial 164 finished with value: 0.8849951644231355 and parameters: {'activation': 'identity', 'solver': 'adam', 'lr': 0.00041530651345310474, 'layer1': 136, 'layer2': 107, 'layer3': 313}. Best is trial 8 with value: 0.8879562150966016.
Staphylococcus_Aureus | LPS | Optuna:  82%|████████▎ | 165/200 [5:32:19<48:34, 83.27s/it, best=0.888]Staphylococcus_Aureus | LPS | Optuna:  82%|████████▎ | 165/200 [5:32:19<48:34, 83.27s/it, best=0.888][I 2026-02-28 13:39:45,901] Trial 159 finished with value: 0.9134492337541102 and parameters: {'activation': 'relu', 'solver': 'adam', 'lr': 0.0003233456135024905, 'layer1': 372, 'layer2': 310, 'layer3': 227}. Best is trial 74 with value: 0.9166002918687234.

Escherichia_Coli | Piperacillin-Tazobactam | Optuna:  80%|████████  | 160/200 [5:35:38<1:27:59, 131.98s/it, best=0.917][A
Escherichia_Coli | Piperacillin-Tazobactam | Optuna:  80%|████████  | 160/200 [5:35:38<1:27:59, 131.98s/it, best=0.917][A[I 2026-02-28 13:39:51,256] Trial 165 finished with value: 0.8854728545842979 and parameters: {'activation': 'identity', 'solver': 'adam', 'lr': 0.0005784749912433102, 'layer1': 166, 'layer2': 90, 'layer3': 327}. Best is trial 8 with value: 0.8879562150966016.
Staphylococcus_Aureus | LPS | Optuna:  83%|████████▎ | 166/200 [5:33:37<46:22, 81.84s/it, best=0.888]Staphylococcus_Aureus | LPS | Optuna:  83%|████████▎ | 166/200 [5:33:37<46:22, 81.84s/it, best=0.888][I 2026-02-28 13:41:29,844] Trial 160 finished with value: 0.9137548167965374 and parameters: {'activation': 'relu', 'solver': 'adam', 'lr': 0.0005035647548294603, 'layer1': 325, 'layer2': 326, 'layer3': 61}. Best is trial 74 with value: 0.9166002918687234.

Escherichia_Coli | Piperacillin-Tazobactam | Optuna:  80%|████████  | 161/200 [5:37:22<1:20:19, 123.57s/it, best=0.917][A
Escherichia_Coli | Piperacillin-Tazobactam | Optuna:  80%|████████  | 161/200 [5:37:22<1:20:19, 123.57s/it, best=0.917][A[I 2026-02-28 13:41:34,041] Trial 166 finished with value: 0.8848375676106489 and parameters: {'activation': 'identity', 'solver': 'adam', 'lr': 0.00032590554207575877, 'layer1': 311, 'layer2': 149, 'layer3': 348}. Best is trial 8 with value: 0.8879562150966016.
Staphylococcus_Aureus | LPS | Optuna:  84%|████████▎ | 167/200 [5:35:20<48:28, 88.13s/it, best=0.888]Staphylococcus_Aureus | LPS | Optuna:  84%|████████▎ | 167/200 [5:35:20<48:28, 88.13s/it, best=0.888][I 2026-02-28 13:42:23,500] Trial 6 finished with value: 0.9077731678930426 and parameters: {'activation': 'tanh', 'solver': 'adam', 'lr': 3.6618192203924288e-06, 'layer1': 403, 'layer2': 46, 'layer3': 494}. Best is trial 6 with value: 0.9077731678930426.
Klebsiella_Pneumoniae | DirectMulti | Optuna:   4%|▎         | 7/200 [16:09<10:57:38, 204.45s/it, best=0.897]Klebsiella_Pneumoniae | DirectMulti | Optuna:   4%|▎         | 7/200 [16:09<10:57:38, 204.45s/it, best=0.908][I 2026-02-28 13:42:48,714] Trial 167 finished with value: 0.8044206995024726 and parameters: {'activation': 'identity', 'solver': 'sgd', 'lr': 0.00016608899766068985, 'layer1': 253, 'layer2': 99, 'layer3': 306}. Best is trial 8 with value: 0.8879562150966016.
Staphylococcus_Aureus | LPS | Optuna:  84%|████████▍ | 168/200 [5:36:35<44:50, 84.09s/it, best=0.888]Staphylococcus_Aureus | LPS | Optuna:  84%|████████▍ | 168/200 [5:36:35<44:50, 84.09s/it, best=0.888][I 2026-02-28 13:43:16,432] Trial 7 finished with value: 0.9191426909857505 and parameters: {'activation': 'relu', 'solver': 'adam', 'lr': 0.0012164139351417069, 'layer1': 46, 'layer2': 186, 'layer3': 66}. Best is trial 7 with value: 0.9191426909857505.
Klebsiella_Pneumoniae | DirectMulti | Optuna:   4%|▍         | 8/200 [17:02<8:19:52, 156.21s/it, best=0.908] Klebsiella_Pneumoniae | DirectMulti | Optuna:   4%|▍         | 8/200 [17:02<8:19:52, 156.21s/it, best=0.919][I 2026-02-28 13:43:34,535] Trial 161 finished with value: 0.9132079512077018 and parameters: {'activation': 'relu', 'solver': 'adam', 'lr': 0.0001681755211376201, 'layer1': 399, 'layer2': 301, 'layer3': 249}. Best is trial 74 with value: 0.9166002918687234.

Escherichia_Coli | Piperacillin-Tazobactam | Optuna:  81%|████████  | 162/200 [5:39:27<1:18:28, 123.90s/it, best=0.917][A
Escherichia_Coli | Piperacillin-Tazobactam | Optuna:  81%|████████  | 162/200 [5:39:27<1:18:28, 123.90s/it, best=0.917][A[I 2026-02-28 13:44:31,262] Trial 8 finished with value: 0.9193151399717422 and parameters: {'activation': 'identity', 'solver': 'adam', 'lr': 0.000828752236376816, 'layer1': 323, 'layer2': 445, 'layer3': 241}. Best is trial 8 with value: 0.9193151399717422.
Klebsiella_Pneumoniae | DirectMulti | Optuna:   4%|▍         | 9/200 [18:16<6:56:17, 130.77s/it, best=0.919]Klebsiella_Pneumoniae | DirectMulti | Optuna:   4%|▍         | 9/200 [18:16<6:56:17, 130.77s/it, best=0.919][I 2026-02-28 13:44:41,046] Trial 168 finished with value: 0.8861913994309066 and parameters: {'activation': 'identity', 'solver': 'adam', 'lr': 0.00018936608476013874, 'layer1': 289, 'layer2': 136, 'layer3': 284}. Best is trial 8 with value: 0.8879562150966016.
Staphylococcus_Aureus | LPS | Optuna:  84%|████████▍ | 169/200 [5:38:27<47:49, 92.56s/it, best=0.888]Staphylococcus_Aureus | LPS | Optuna:  84%|████████▍ | 169/200 [5:38:27<47:49, 92.56s/it, best=0.888][I 2026-02-28 13:45:43,525] Trial 169 finished with value: 0.8835279584797175 and parameters: {'activation': 'identity', 'solver': 'adam', 'lr': 0.0002437739722292601, 'layer1': 41, 'layer2': 83, 'layer3': 255}. Best is trial 8 with value: 0.8879562150966016.
Staphylococcus_Aureus | LPS | Optuna:  85%|████████▌ | 170/200 [5:39:29<41:46, 83.54s/it, best=0.888]Staphylococcus_Aureus | LPS | Optuna:  85%|████████▌ | 170/200 [5:39:29<41:46, 83.54s/it, best=0.888][I 2026-02-28 13:45:48,733] Trial 162 finished with value: 0.9150390539764484 and parameters: {'activation': 'relu', 'solver': 'adam', 'lr': 0.00012132034880135294, 'layer1': 407, 'layer2': 291, 'layer3': 313}. Best is trial 74 with value: 0.9166002918687234.

Escherichia_Coli | Piperacillin-Tazobactam | Optuna:  82%|████████▏ | 163/200 [5:41:41<1:18:18, 126.99s/it, best=0.917][A
Escherichia_Coli | Piperacillin-Tazobactam | Optuna:  82%|████████▏ | 163/200 [5:41:41<1:18:18, 126.99s/it, best=0.917][A[I 2026-02-28 13:47:03,429] Trial 170 finished with value: 0.8771694519161564 and parameters: {'activation': 'logistic', 'solver': 'adam', 'lr': 0.001253558911815314, 'layer1': 275, 'layer2': 114, 'layer3': 341}. Best is trial 8 with value: 0.8879562150966016.
Staphylococcus_Aureus | LPS | Optuna:  86%|████████▌ | 171/200 [5:40:49<39:50, 82.45s/it, best=0.888]Staphylococcus_Aureus | LPS | Optuna:  86%|████████▌ | 171/200 [5:40:49<39:50, 82.45s/it, best=0.888][I 2026-02-28 13:47:55,398] Trial 163 finished with value: 0.9134295534903665 and parameters: {'activation': 'relu', 'solver': 'adam', 'lr': 0.00019163270464715747, 'layer1': 409, 'layer2': 313, 'layer3': 270}. Best is trial 74 with value: 0.9166002918687234.

Escherichia_Coli | Piperacillin-Tazobactam | Optuna:  82%|████████▏ | 164/200 [5:43:48<1:16:08, 126.89s/it, best=0.917][A
