Klebsiella_Pneumoniae | Imipenem | Optuna:  86%|████████▌ | 171/200 [2:08:39<17:28, 36.15s/it, best=0.986][A[I 2026-02-28 05:38:15,239] Trial 171 finished with value: 0.9830573194115487 and parameters: {'activation': 'relu', 'solver': 'adam', 'lr': 0.003246210685211334, 'layer1': 379, 'layer2': 199, 'layer3': 381}. Best is trial 13 with value: 0.9860492846658779.

Klebsiella_Pneumoniae | Imipenem | Optuna:  86%|████████▌ | 172/200 [2:09:27<18:31, 39.68s/it, best=0.986][A
Klebsiella_Pneumoniae | Imipenem | Optuna:  86%|████████▌ | 172/200 [2:09:27<18:31, 39.68s/it, best=0.986][A[I 2026-02-28 05:38:37,234] Trial 146 finished with value: 0.8654486423081167 and parameters: {'activation': 'identity', 'solver': 'adam', 'lr': 0.0010290118226654928, 'layer1': 108, 'layer2': 486, 'layer3': 415}. Best is trial 140 with value: 0.8705750568176336.
Pseudomonas_Aeruginosa | LPS | Optuna:  74%|███████▎  | 147/200 [3:33:39<1:07:45, 76.70s/it, best=0.871]Pseudomonas_Aeruginosa | LPS | Optuna:  74%|███████▎  | 147/200 [3:33:39<1:07:45, 76.70s/it, best=0.871]/export/usuarios01/egarroyo/MALDI_for_AMR_prediction/venv/lib/python3.13/site-packages/sklearn/model_selection/_split.py:813: UserWarning: The least populated class in y has only 4 members, which is less than n_splits=5.
  warnings.warn(
[I 2026-02-28 05:38:51,786] Trial 108 finished with value: 0.9272175704808525 and parameters: {'activation': 'identity', 'solver': 'adam', 'lr': 4.0778615372186654e-05, 'layer1': 349, 'layer2': 51, 'layer3': 114}. Best is trial 77 with value: 0.9283869597728589.

Staphylococcus_Aureus | Fusidic acid | Optuna:  55%|█████▍    | 109/200 [2:58:00<2:30:47, 99.43s/it, best=0.928][A
Staphylococcus_Aureus | Fusidic acid | Optuna:  55%|█████▍    | 109/200 [2:58:00<2:30:47, 99.43s/it, best=0.928][A[I 2026-02-28 05:39:05,658] Trial 172 finished with value: 0.984004548955552 and parameters: {'activation': 'relu', 'solver': 'adam', 'lr': 0.002334506713755008, 'layer1': 396, 'layer2': 234, 'layer3': 363}. Best is trial 13 with value: 0.9860492846658779.

Klebsiella_Pneumoniae | Imipenem | Optuna:  86%|████████▋ | 173/200 [2:10:18<19:18, 42.90s/it, best=0.986][A
Klebsiella_Pneumoniae | Imipenem | Optuna:  86%|████████▋ | 173/200 [2:10:18<19:18, 42.90s/it, best=0.986][A[I 2026-02-28 05:39:47,475] Trial 152 finished with value: 0.8951109006739353 and parameters: {'activation': 'relu', 'solver': 'adam', 'lr': 7.932742294125025e-05, 'layer1': 452, 'layer2': 42, 'layer3': 50}. Best is trial 137 with value: 0.8979080367540411.

Escherichia_Coli | Ceftriaxone | Optuna:  76%|███████▋  | 153/200 [6:29:48<2:06:38, 161.67s/it, best=0.898][A
Escherichia_Coli | Ceftriaxone | Optuna:  76%|███████▋  | 153/200 [6:29:48<2:06:38, 161.67s/it, best=0.898][A[I 2026-02-28 05:40:23,578] Trial 173 finished with value: 0.9840601309800945 and parameters: {'activation': 'relu', 'solver': 'adam', 'lr': 0.001402545124201135, 'layer1': 419, 'layer2': 274, 'layer3': 402}. Best is trial 13 with value: 0.9860492846658779.

Klebsiella_Pneumoniae | Imipenem | Optuna:  87%|████████▋ | 174/200 [2:11:36<23:08, 53.41s/it, best=0.986][A
Klebsiella_Pneumoniae | Imipenem | Optuna:  87%|████████▋ | 174/200 [2:11:36<23:08, 53.41s/it, best=0.986][A[I 2026-02-28 05:40:30,396] Trial 109 finished with value: 0.9260000838735596 and parameters: {'activation': 'identity', 'solver': 'adam', 'lr': 8.709425980666878e-05, 'layer1': 413, 'layer2': 87, 'layer3': 130}. Best is trial 77 with value: 0.9283869597728589.

Staphylococcus_Aureus | Fusidic acid | Optuna:  55%|█████▌    | 110/200 [2:59:39<2:28:46, 99.18s/it, best=0.928][A
Staphylococcus_Aureus | Fusidic acid | Optuna:  55%|█████▌    | 110/200 [2:59:39<2:28:46, 99.18s/it, best=0.928][A[I 2026-02-28 05:40:46,078] Trial 147 finished with value: 0.8635861707520356 and parameters: {'activation': 'identity', 'solver': 'adam', 'lr': 0.002802043392995609, 'layer1': 448, 'layer2': 396, 'layer3': 490}. Best is trial 140 with value: 0.8705750568176336.
Pseudomonas_Aeruginosa | LPS | Optuna:  74%|███████▍  | 148/200 [3:35:48<1:20:01, 92.34s/it, best=0.871]Pseudomonas_Aeruginosa | LPS | Optuna:  74%|███████▍  | 148/200 [3:35:48<1:20:01, 92.34s/it, best=0.871]/export/usuarios01/egarroyo/MALDI_for_AMR_prediction/venv/lib/python3.13/site-packages/sklearn/model_selection/_split.py:813: UserWarning: The least populated class in y has only 4 members, which is less than n_splits=5.
  warnings.warn(
[I 2026-02-28 05:41:20,154] Trial 174 finished with value: 0.983637081256328 and parameters: {'activation': 'relu', 'solver': 'adam', 'lr': 0.0015833996483227298, 'layer1': 354, 'layer2': 476, 'layer3': 377}. Best is trial 13 with value: 0.9860492846658779.

Klebsiella_Pneumoniae | Imipenem | Optuna:  88%|████████▊ | 175/200 [2:12:32<22:38, 54.36s/it, best=0.986][A
Klebsiella_Pneumoniae | Imipenem | Optuna:  88%|████████▊ | 175/200 [2:12:32<22:38, 54.36s/it, best=0.986][A[I 2026-02-28 05:42:07,107] Trial 175 finished with value: 0.9840085684810695 and parameters: {'activation': 'relu', 'solver': 'adam', 'lr': 0.0026302940767548954, 'layer1': 73, 'layer2': 354, 'layer3': 390}. Best is trial 13 with value: 0.9860492846658779.

Klebsiella_Pneumoniae | Imipenem | Optuna:  88%|████████▊ | 176/200 [2:13:19<20:51, 52.14s/it, best=0.986][A
Klebsiella_Pneumoniae | Imipenem | Optuna:  88%|████████▊ | 176/200 [2:13:19<20:51, 52.14s/it, best=0.986][A[I 2026-02-28 05:42:43,708] Trial 153 finished with value: 0.8932787045958813 and parameters: {'activation': 'relu', 'solver': 'adam', 'lr': 5.5264104345100877e-05, 'layer1': 500, 'layer2': 122, 'layer3': 21}. Best is trial 137 with value: 0.8979080367540411.

Escherichia_Coli | Ceftriaxone | Optuna:  77%|███████▋  | 154/200 [6:32:45<2:07:17, 166.04s/it, best=0.898][A
Escherichia_Coli | Ceftriaxone | Optuna:  77%|███████▋  | 154/200 [6:32:45<2:07:17, 166.04s/it, best=0.898][A[I 2026-02-28 05:42:47,266] Trial 110 finished with value: 0.9245272686242629 and parameters: {'activation': 'identity', 'solver': 'adam', 'lr': 3.172584701289658e-05, 'layer1': 373, 'layer2': 75, 'layer3': 153}. Best is trial 77 with value: 0.9283869597728589.

Staphylococcus_Aureus | Fusidic acid | Optuna:  56%|█████▌    | 111/200 [3:01:56<2:43:53, 110.49s/it, best=0.928][A
Staphylococcus_Aureus | Fusidic acid | Optuna:  56%|█████▌    | 111/200 [3:01:56<2:43:53, 110.49s/it, best=0.928][A[I 2026-02-28 05:42:52,510] Trial 148 finished with value: 0.8653603382507458 and parameters: {'activation': 'identity', 'solver': 'adam', 'lr': 0.0015312821508495864, 'layer1': 396, 'layer2': 333, 'layer3': 455}. Best is trial 140 with value: 0.8705750568176336.
Pseudomonas_Aeruginosa | LPS | Optuna:  74%|███████▍  | 149/200 [3:37:54<1:27:11, 102.57s/it, best=0.871]Pseudomonas_Aeruginosa | LPS | Optuna:  74%|███████▍  | 149/200 [3:37:54<1:27:11, 102.57s/it, best=0.871]/export/usuarios01/egarroyo/MALDI_for_AMR_prediction/venv/lib/python3.13/site-packages/sklearn/model_selection/_split.py:813: UserWarning: The least populated class in y has only 4 members, which is less than n_splits=5.
  warnings.warn(
[I 2026-02-28 05:43:07,081] Trial 176 finished with value: 0.9838785426718891 and parameters: {'activation': 'relu', 'solver': 'adam', 'lr': 0.0018656443870421577, 'layer1': 373, 'layer2': 175, 'layer3': 465}. Best is trial 13 with value: 0.9860492846658779.

Klebsiella_Pneumoniae | Imipenem | Optuna:  88%|████████▊ | 177/200 [2:14:19<20:53, 54.49s/it, best=0.986][A
Klebsiella_Pneumoniae | Imipenem | Optuna:  88%|████████▊ | 177/200 [2:14:19<20:53, 54.49s/it, best=0.986][A[I 2026-02-28 05:43:33,188] Trial 177 finished with value: 0.9819919843971873 and parameters: {'activation': 'identity', 'solver': 'adam', 'lr': 0.0009061140353489598, 'layer1': 103, 'layer2': 119, 'layer3': 500}. Best is trial 13 with value: 0.9860492846658779.

Klebsiella_Pneumoniae | Imipenem | Optuna:  89%|████████▉ | 178/200 [2:14:45<16:51, 45.97s/it, best=0.986][A
Klebsiella_Pneumoniae | Imipenem | Optuna:  89%|████████▉ | 178/200 [2:14:45<16:51, 45.97s/it, best=0.986][A[I 2026-02-28 05:44:21,004] Trial 111 finished with value: 0.9267602930309533 and parameters: {'activation': 'identity', 'solver': 'adam', 'lr': 0.00019609966919889224, 'layer1': 459, 'layer2': 33, 'layer3': 120}. Best is trial 77 with value: 0.9283869597728589.

Staphylococcus_Aureus | Fusidic acid | Optuna:  56%|█████▌    | 112/200 [3:03:30<2:34:40, 105.46s/it, best=0.928][A
Staphylococcus_Aureus | Fusidic acid | Optuna:  56%|█████▌    | 112/200 [3:03:30<2:34:40, 105.46s/it, best=0.928][A[I 2026-02-28 05:44:32,082] Trial 178 finished with value: 0.9836385527811521 and parameters: {'activation': 'relu', 'solver': 'adam', 'lr': 0.001334779225401098, 'layer1': 466, 'layer2': 309, 'layer3': 480}. Best is trial 13 with value: 0.9860492846658779.

Klebsiella_Pneumoniae | Imipenem | Optuna:  90%|████████▉ | 179/200 [2:15:44<17:26, 49.85s/it, best=0.986][A
Klebsiella_Pneumoniae | Imipenem | Optuna:  90%|████████▉ | 179/200 [2:15:44<17:26, 49.85s/it, best=0.986][A[I 2026-02-28 05:44:48,564] Trial 149 finished with value: 0.8650683167282563 and parameters: {'activation': 'identity', 'solver': 'adam', 'lr': 0.0033846141005902503, 'layer1': 273, 'layer2': 349, 'layer3': 476}. Best is trial 140 with value: 0.8705750568176336.
Pseudomonas_Aeruginosa | LPS | Optuna:  75%|███████▌  | 150/200 [3:39:50<1:28:50, 106.62s/it, best=0.871]Pseudomonas_Aeruginosa | LPS | Optuna:  75%|███████▌  | 150/200 [3:39:50<1:28:50, 106.62s/it, best=0.871]/export/usuarios01/egarroyo/MALDI_for_AMR_prediction/venv/lib/python3.13/site-packages/sklearn/model_selection/_split.py:813: UserWarning: The least populated class in y has only 4 members, which is less than n_splits=5.
  warnings.warn(
[I 2026-02-28 05:44:53,369] Trial 154 finished with value: 0.8939982702707747 and parameters: {'activation': 'relu', 'solver': 'adam', 'lr': 0.00013336755881810053, 'layer1': 488, 'layer2': 157, 'layer3': 34}. Best is trial 137 with value: 0.8979080367540411.

Escherichia_Coli | Ceftriaxone | Optuna:  78%|███████▊  | 155/200 [6:34:54<1:56:20, 155.12s/it, best=0.898][A
Escherichia_Coli | Ceftriaxone | Optuna:  78%|███████▊  | 155/200 [6:34:54<1:56:20, 155.12s/it, best=0.898][A[I 2026-02-28 05:45:08,553] Trial 179 finished with value: 0.9840408987090028 and parameters: {'activation': 'relu', 'solver': 'adam', 'lr': 0.0022969052900754954, 'layer1': 123, 'layer2': 130, 'layer3': 367}. Best is trial 13 with value: 0.9860492846658779.

Klebsiella_Pneumoniae | Imipenem | Optuna:  90%|█████████ | 180/200 [2:16:21<15:16, 45.84s/it, best=0.986][A
Klebsiella_Pneumoniae | Imipenem | Optuna:  90%|█████████ | 180/200 [2:16:21<15:16, 45.84s/it, best=0.986][A[I 2026-02-28 05:45:34,125] Trial 150 finished with value: 0.8581140215189187 and parameters: {'activation': 'relu', 'solver': 'adam', 'lr': 0.0011979805291097694, 'layer1': 12, 'layer2': 454, 'layer3': 429}. Best is trial 140 with value: 0.8705750568176336.
Pseudomonas_Aeruginosa | LPS | Optuna:  76%|███████▌  | 151/200 [3:40:36<1:12:06, 88.30s/it, best=0.871] Pseudomonas_Aeruginosa | LPS | Optuna:  76%|███████▌  | 151/200 [3:40:36<1:12:06, 88.30s/it, best=0.871]/export/usuarios01/egarroyo/MALDI_for_AMR_prediction/venv/lib/python3.13/site-packages/sklearn/model_selection/_split.py:813: UserWarning: The least populated class in y has only 4 members, which is less than n_splits=5.
  warnings.warn(
[I 2026-02-28 05:45:56,141] Trial 112 finished with value: 0.9278452188177896 and parameters: {'activation': 'identity', 'solver': 'adam', 'lr': 0.0002495655869114759, 'layer1': 395, 'layer2': 98, 'layer3': 90}. Best is trial 77 with value: 0.9283869597728589.

Staphylococcus_Aureus | Fusidic acid | Optuna:  56%|█████▋    | 113/200 [3:05:05<2:28:25, 102.37s/it, best=0.928][A
Staphylococcus_Aureus | Fusidic acid | Optuna:  56%|█████▋    | 113/200 [3:05:05<2:28:25, 102.37s/it, best=0.928][A[I 2026-02-28 05:46:20,951] Trial 180 finished with value: 0.9839569633597328 and parameters: {'activation': 'relu', 'solver': 'adam', 'lr': 0.001148858207425968, 'layer1': 487, 'layer2': 420, 'layer3': 410}. Best is trial 13 with value: 0.9860492846658779.

Klebsiella_Pneumoniae | Imipenem | Optuna:  90%|█████████ | 181/200 [2:17:33<17:02, 53.80s/it, best=0.986][A
Klebsiella_Pneumoniae | Imipenem | Optuna:  90%|█████████ | 181/200 [2:17:33<17:02, 53.80s/it, best=0.986][A[I 2026-02-28 05:46:56,320] Trial 181 finished with value: 0.9834440729218077 and parameters: {'activation': 'relu', 'solver': 'adam', 'lr': 0.002099539292623911, 'layer1': 48, 'layer2': 160, 'layer3': 464}. Best is trial 13 with value: 0.9860492846658779.

Klebsiella_Pneumoniae | Imipenem | Optuna:  91%|█████████ | 182/200 [2:18:08<14:28, 48.27s/it, best=0.986][A
Klebsiella_Pneumoniae | Imipenem | Optuna:  91%|█████████ | 182/200 [2:18:08<14:28, 48.27s/it, best=0.986][A[I 2026-02-28 05:47:00,767] Trial 151 finished with value: 0.8639107194547643 and parameters: {'activation': 'identity', 'solver': 'adam', 'lr': 0.0024302471214154714, 'layer1': 289, 'layer2': 317, 'layer3': 472}. Best is trial 140 with value: 0.8705750568176336.
Pseudomonas_Aeruginosa | LPS | Optuna:  76%|███████▌  | 152/200 [3:42:02<1:10:14, 87.80s/it, best=0.871]Pseudomonas_Aeruginosa | LPS | Optuna:  76%|███████▌  | 152/200 [3:42:02<1:10:14, 87.80s/it, best=0.871]/export/usuarios01/egarroyo/MALDI_for_AMR_prediction/venv/lib/python3.13/site-packages/sklearn/model_selection/_split.py:813: UserWarning: The least populated class in y has only 4 members, which is less than n_splits=5.
  warnings.warn(
[I 2026-02-28 05:47:15,238] Trial 113 finished with value: 0.9223685480835314 and parameters: {'activation': 'identity', 'solver': 'adam', 'lr': 0.00037032253314617757, 'layer1': 389, 'layer2': 67, 'layer3': 87}. Best is trial 77 with value: 0.9283869597728589.

Staphylococcus_Aureus | Fusidic acid | Optuna:  57%|█████▋    | 114/200 [3:06:24<2:16:43, 95.38s/it, best=0.928] [A
Staphylococcus_Aureus | Fusidic acid | Optuna:  57%|█████▋    | 114/200 [3:06:24<2:16:43, 95.38s/it, best=0.928][A[I 2026-02-28 05:47:36,540] Trial 182 finished with value: 0.9840609928339596 and parameters: {'activation': 'relu', 'solver': 'adam', 'lr': 0.0017084253920726703, 'layer1': 49, 'layer2': 186, 'layer3': 456}. Best is trial 13 with value: 0.9860492846658779.

Klebsiella_Pneumoniae | Imipenem | Optuna:  92%|█████████▏| 183/200 [2:18:49<12:59, 45.86s/it, best=0.986][A
Klebsiella_Pneumoniae | Imipenem | Optuna:  92%|█████████▏| 183/200 [2:18:49<12:59, 45.86s/it, best=0.986][A[I 2026-02-28 05:47:40,485] Trial 155 finished with value: 0.8941089186708421 and parameters: {'activation': 'relu', 'solver': 'adam', 'lr': 7.206429192140653e-05, 'layer1': 464, 'layer2': 26, 'layer3': 21}. Best is trial 137 with value: 0.8979080367540411.

Escherichia_Coli | Ceftriaxone | Optuna:  78%|███████▊  | 156/200 [6:37:41<1:56:23, 158.72s/it, best=0.898][A
Escherichia_Coli | Ceftriaxone | Optuna:  78%|███████▊  | 156/200 [6:37:41<1:56:23, 158.72s/it, best=0.898][A[I 2026-02-28 05:48:16,577] Trial 183 finished with value: 0.9840588132015972 and parameters: {'activation': 'relu', 'solver': 'adam', 'lr': 0.0030525083869263367, 'layer1': 58, 'layer2': 178, 'layer3': 483}. Best is trial 13 with value: 0.9860492846658779.

Klebsiella_Pneumoniae | Imipenem | Optuna:  92%|█████████▏| 184/200 [2:19:29<11:45, 44.11s/it, best=0.986][A
Klebsiella_Pneumoniae | Imipenem | Optuna:  92%|█████████▏| 184/200 [2:19:29<11:45, 44.11s/it, best=0.986][A[I 2026-02-28 05:48:25,392] Trial 152 finished with value: 0.862588431961713 and parameters: {'activation': 'identity', 'solver': 'adam', 'lr': 0.002283215471049198, 'layer1': 259, 'layer2': 324, 'layer3': 500}. Best is trial 140 with value: 0.8705750568176336.
Pseudomonas_Aeruginosa | LPS | Optuna:  76%|███████▋  | 153/200 [3:43:27<1:08:01, 86.85s/it, best=0.871]Pseudomonas_Aeruginosa | LPS | Optuna:  76%|███████▋  | 153/200 [3:43:27<1:08:01, 86.85s/it, best=0.871]/export/usuarios01/egarroyo/MALDI_for_AMR_prediction/venv/lib/python3.13/site-packages/sklearn/model_selection/_split.py:813: UserWarning: The least populated class in y has only 4 members, which is less than n_splits=5.
  warnings.warn(
[I 2026-02-28 05:48:50,902] Trial 184 finished with value: 0.9837224881304218 and parameters: {'activation': 'relu', 'solver': 'adam', 'lr': 0.0020736701740310818, 'layer1': 84, 'layer2': 200, 'layer3': 382}. Best is trial 13 with value: 0.9860492846658779.

Klebsiella_Pneumoniae | Imipenem | Optuna:  92%|█████████▎| 185/200 [2:20:03<10:17, 41.18s/it, best=0.986][A
Klebsiella_Pneumoniae | Imipenem | Optuna:  92%|█████████▎| 185/200 [2:20:03<10:17, 41.18s/it, best=0.986][A[I 2026-02-28 05:48:56,981] Trial 114 finished with value: 0.9257427785450197 and parameters: {'activation': 'identity', 'solver': 'adam', 'lr': 0.0002547895972725115, 'layer1': 394, 'layer2': 97, 'layer3': 103}. Best is trial 77 with value: 0.9283869597728589.

Staphylococcus_Aureus | Fusidic acid | Optuna:  57%|█████▊    | 115/200 [3:08:06<2:17:49, 97.29s/it, best=0.928][A
Staphylococcus_Aureus | Fusidic acid | Optuna:  57%|█████▊    | 115/200 [3:08:06<2:17:49, 97.29s/it, best=0.928][A[I 2026-02-28 05:49:40,390] Trial 185 finished with value: 0.984620660553782 and parameters: {'activation': 'relu', 'solver': 'adam', 'lr': 0.0035283574675331413, 'layer1': 78, 'layer2': 228, 'layer3': 448}. Best is trial 13 with value: 0.9860492846658779.

Klebsiella_Pneumoniae | Imipenem | Optuna:  93%|█████████▎| 186/200 [2:20:52<10:11, 43.67s/it, best=0.986][A
Klebsiella_Pneumoniae | Imipenem | Optuna:  93%|█████████▎| 186/200 [2:20:52<10:11, 43.67s/it, best=0.986][A[I 2026-02-28 05:50:12,640] Trial 153 finished with value: 0.8621718951898641 and parameters: {'activation': 'identity', 'solver': 'adam', 'lr': 0.0018372732338855604, 'layer1': 422, 'layer2': 307, 'layer3': 193}. Best is trial 140 with value: 0.8705750568176336.
Pseudomonas_Aeruginosa | LPS | Optuna:  77%|███████▋  | 154/200 [3:45:14<1:11:16, 92.97s/it, best=0.871]Pseudomonas_Aeruginosa | LPS | Optuna:  77%|███████▋  | 154/200 [3:45:14<1:11:16, 92.97s/it, best=0.871]/export/usuarios01/egarroyo/MALDI_for_AMR_prediction/venv/lib/python3.13/site-packages/sklearn/model_selection/_split.py:813: UserWarning: The least populated class in y has only 4 members, which is less than n_splits=5.
  warnings.warn(
[I 2026-02-28 05:50:29,756] Trial 186 finished with value: 0.9847448300867775 and parameters: {'activation': 'relu', 'solver': 'adam', 'lr': 0.00374715813642754, 'layer1': 96, 'layer2': 241, 'layer3': 448}. Best is trial 13 with value: 0.9860492846658779.

Klebsiella_Pneumoniae | Imipenem | Optuna:  94%|█████████▎| 187/200 [2:21:42<09:49, 45.38s/it, best=0.986][A
Klebsiella_Pneumoniae | Imipenem | Optuna:  94%|█████████▎| 187/200 [2:21:42<09:49, 45.38s/it, best=0.986][A[I 2026-02-28 05:50:41,876] Trial 115 finished with value: 0.9275021821308016 and parameters: {'activation': 'identity', 'solver': 'adam', 'lr': 0.00013795367473178773, 'layer1': 409, 'layer2': 84, 'layer3': 62}. Best is trial 77 with value: 0.9283869597728589.

Staphylococcus_Aureus | Fusidic acid | Optuna:  58%|█████▊    | 116/200 [3:09:51<2:19:24, 99.57s/it, best=0.928][A
Staphylococcus_Aureus | Fusidic acid | Optuna:  58%|█████▊    | 116/200 [3:09:51<2:19:24, 99.57s/it, best=0.928][A[I 2026-02-28 05:51:05,375] Trial 187 finished with value: 0.9836392608886904 and parameters: {'activation': 'relu', 'solver': 'adam', 'lr': 0.004285811757022067, 'layer1': 98, 'layer2': 241, 'layer3': 434}. Best is trial 13 with value: 0.9860492846658779.

Klebsiella_Pneumoniae | Imipenem | Optuna:  94%|█████████▍| 188/200 [2:22:17<08:29, 42.45s/it, best=0.986][A
Klebsiella_Pneumoniae | Imipenem | Optuna:  94%|█████████▍| 188/200 [2:22:17<08:29, 42.45s/it, best=0.986][A[I 2026-02-28 05:51:18,067] Trial 116 finished with value: 0.9050666137971211 and parameters: {'activation': 'logistic', 'solver': 'adam', 'lr': 6.625839757637575e-05, 'layer1': 423, 'layer2': 84, 'layer3': 56}. Best is trial 77 with value: 0.9283869597728589.

Staphylococcus_Aureus | Fusidic acid | Optuna:  58%|█████▊    | 117/200 [3:10:27<1:51:26, 80.56s/it, best=0.928][A
Staphylococcus_Aureus | Fusidic acid | Optuna:  58%|█████▊    | 117/200 [3:10:27<1:51:26, 80.56s/it, best=0.928][A[I 2026-02-28 05:51:32,539] Trial 156 finished with value: 0.8943985605410125 and parameters: {'activation': 'relu', 'solver': 'adam', 'lr': 3.564597504649209e-05, 'layer1': 477, 'layer2': 19, 'layer3': 87}. Best is trial 137 with value: 0.8979080367540411.

Escherichia_Coli | Ceftriaxone | Optuna:  78%|███████▊  | 157/200 [6:41:34<2:09:31, 180.72s/it, best=0.898][A
Escherichia_Coli | Ceftriaxone | Optuna:  78%|███████▊  | 157/200 [6:41:34<2:09:31, 180.72s/it, best=0.898][A[I 2026-02-28 05:51:48,111] Trial 154 finished with value: 0.8640909680976485 and parameters: {'activation': 'identity', 'solver': 'adam', 'lr': 0.004468239543051776, 'layer1': 281, 'layer2': 370, 'layer3': 479}. Best is trial 140 with value: 0.8705750568176336.
Pseudomonas_Aeruginosa | LPS | Optuna:  78%|███████▊  | 155/200 [3:46:50<1:10:17, 93.72s/it, best=0.871]Pseudomonas_Aeruginosa | LPS | Optuna:  78%|███████▊  | 155/200 [3:46:50<1:10:17, 93.72s/it, best=0.871]/export/usuarios01/egarroyo/MALDI_for_AMR_prediction/venv/lib/python3.13/site-packages/sklearn/model_selection/_split.py:813: UserWarning: The least populated class in y has only 4 members, which is less than n_splits=5.
  warnings.warn(
[I 2026-02-28 05:51:55,281] Trial 188 finished with value: 0.9846199524462437 and parameters: {'activation': 'relu', 'solver': 'adam', 'lr': 0.0049446771333313206, 'layer1': 91, 'layer2': 224, 'layer3': 423}. Best is trial 13 with value: 0.9860492846658779.

Klebsiella_Pneumoniae | Imipenem | Optuna:  94%|█████████▍| 189/200 [2:23:07<08:11, 44.69s/it, best=0.986][A
