[I 2026-02-28 02:09:05,144] Trial 178 finished with value: 0.8440656724850799 and parameters: {'activation': 'logistic', 'solver': 'adam', 'lr': 0.00035748170084619313, 'layer1': 229, 'layer2': 67, 'layer3': 75}. Best is trial 156 with value: 0.8585541372555268.

Staphylococcus_Aureus | Clindamycin | Optuna:  90%|████████▉ | 179/200 [4:11:06<32:54, 94.04s/it, best=0.859][A
Staphylococcus_Aureus | Clindamycin | Optuna:  90%|████████▉ | 179/200 [4:11:06<32:54, 94.04s/it, best=0.859][A[I 2026-02-28 02:10:08,009] Trial 162 finished with value: 0.9050872739658737 and parameters: {'activation': 'tanh', 'solver': 'adam', 'lr': 1.751802734635985e-05, 'layer1': 258, 'layer2': 469, 'layer3': 278}. Best is trial 130 with value: 0.9107197512148748.

Klebsiella_Pneumoniae | Ceftriaxone | Optuna:  82%|████████▏ | 163/200 [5:19:29<1:28:53, 144.15s/it, best=0.911][A
Klebsiella_Pneumoniae | Ceftriaxone | Optuna:  82%|████████▏ | 163/200 [5:19:29<1:28:53, 144.15s/it, best=0.911][A[I 2026-02-28 02:10:12,918] Trial 179 finished with value: 0.8201067780229682 and parameters: {'activation': 'logistic', 'solver': 'adam', 'lr': 0.0002548270418949869, 'layer1': 218, 'layer2': 48, 'layer3': 106}. Best is trial 156 with value: 0.8585541372555268.

Staphylococcus_Aureus | Clindamycin | Optuna:  90%|█████████ | 180/200 [4:12:14<28:43, 86.16s/it, best=0.859][A
Staphylococcus_Aureus | Clindamycin | Optuna:  90%|█████████ | 180/200 [4:12:14<28:43, 86.16s/it, best=0.859][A[I 2026-02-28 02:10:36,736] Trial 5 finished with value: 0.7768466348263503 and parameters: {'activation': 'identity', 'solver': 'adam', 'lr': 2.259279742015697e-06, 'layer1': 106, 'layer2': 32, 'layer3': 169}. Best is trial 2 with value: 0.8302838912374095.
Pseudomonas_Aeruginosa | LPS | Optuna:   3%|▎         | 6/200 [05:38<3:28:45, 64.56s/it, best=0.83]Pseudomonas_Aeruginosa | LPS | Optuna:   3%|▎         | 6/200 [05:38<3:28:45, 64.56s/it, best=0.83]/export/usuarios01/egarroyo/MALDI_for_AMR_prediction/venv/lib/python3.13/site-packages/sklearn/model_selection/_split.py:813: UserWarning: The least populated class in y has only 4 members, which is less than n_splits=5.
  warnings.warn(
[I 2026-02-28 02:10:55,297] Trial 75 finished with value: 0.895315009385142 and parameters: {'activation': 'relu', 'solver': 'adam', 'lr': 5.332090680760774e-05, 'layer1': 489, 'layer2': 92, 'layer3': 160}. Best is trial 14 with value: 0.8971256036318559.

Escherichia_Coli | Ceftriaxone | Optuna:  38%|███▊      | 76/200 [3:00:56<5:07:46, 148.92s/it, best=0.897][A
Escherichia_Coli | Ceftriaxone | Optuna:  38%|███▊      | 76/200 [3:00:56<5:07:46, 148.92s/it, best=0.897][A[I 2026-02-28 02:11:02,100] Trial 180 finished with value: 0.8460426901890171 and parameters: {'activation': 'tanh', 'solver': 'adam', 'lr': 0.0005285687753325542, 'layer1': 24, 'layer2': 85, 'layer3': 58}. Best is trial 156 with value: 0.8585541372555268.

Staphylococcus_Aureus | Clindamycin | Optuna:  90%|█████████ | 181/200 [4:13:03<23:46, 75.07s/it, best=0.859][A
Staphylococcus_Aureus | Clindamycin | Optuna:  90%|█████████ | 181/200 [4:13:03<23:46, 75.07s/it, best=0.859][A[I 2026-02-28 02:12:06,293] Trial 163 finished with value: 0.9095209040490179 and parameters: {'activation': 'tanh', 'solver': 'adam', 'lr': 2.8510807668011742e-05, 'layer1': 271, 'layer2': 451, 'layer3': 420}. Best is trial 130 with value: 0.9107197512148748.

Klebsiella_Pneumoniae | Ceftriaxone | Optuna:  82%|████████▏ | 164/200 [5:21:27<1:21:50, 136.39s/it, best=0.911][A
Klebsiella_Pneumoniae | Ceftriaxone | Optuna:  82%|████████▏ | 164/200 [5:21:27<1:21:50, 136.39s/it, best=0.911][A[I 2026-02-28 02:12:25,732] Trial 181 finished with value: 0.8547531676397069 and parameters: {'activation': 'logistic', 'solver': 'adam', 'lr': 0.0006498566338528937, 'layer1': 201, 'layer2': 38, 'layer3': 79}. Best is trial 156 with value: 0.8585541372555268.

Staphylococcus_Aureus | Clindamycin | Optuna:  91%|█████████ | 182/200 [4:14:27<23:17, 77.64s/it, best=0.859][A
Staphylococcus_Aureus | Clindamycin | Optuna:  91%|█████████ | 182/200 [4:14:27<23:17, 77.64s/it, best=0.859][A[I 2026-02-28 02:12:41,367] Trial 6 finished with value: 0.817589679282799 and parameters: {'activation': 'tanh', 'solver': 'adam', 'lr': 3.6618192203924288e-06, 'layer1': 403, 'layer2': 46, 'layer3': 494}. Best is trial 2 with value: 0.8302838912374095.
Pseudomonas_Aeruginosa | LPS | Optuna:   4%|▎         | 7/200 [07:43<4:30:50, 84.20s/it, best=0.83]Pseudomonas_Aeruginosa | LPS | Optuna:   4%|▎         | 7/200 [07:43<4:30:50, 84.20s/it, best=0.83]/export/usuarios01/egarroyo/MALDI_for_AMR_prediction/venv/lib/python3.13/site-packages/sklearn/model_selection/_split.py:813: UserWarning: The least populated class in y has only 4 members, which is less than n_splits=5.
  warnings.warn(
[I 2026-02-28 02:13:07,626] Trial 76 finished with value: 0.8871156015425605 and parameters: {'activation': 'identity', 'solver': 'adam', 'lr': 4.775803903880057e-05, 'layer1': 490, 'layer2': 93, 'layer3': 161}. Best is trial 14 with value: 0.8971256036318559.

Escherichia_Coli | Ceftriaxone | Optuna:  38%|███▊      | 77/200 [3:03:09<4:55:05, 143.94s/it, best=0.897][A
Escherichia_Coli | Ceftriaxone | Optuna:  38%|███▊      | 77/200 [3:03:09<4:55:05, 143.94s/it, best=0.897][A[I 2026-02-28 02:13:19,664] Trial 7 finished with value: 0.8587599184399259 and parameters: {'activation': 'relu', 'solver': 'adam', 'lr': 0.0012164139351417069, 'layer1': 46, 'layer2': 186, 'layer3': 66}. Best is trial 7 with value: 0.8587599184399259.
Pseudomonas_Aeruginosa | LPS | Optuna:   4%|▍         | 8/200 [08:21<3:42:40, 69.59s/it, best=0.83]Pseudomonas_Aeruginosa | LPS | Optuna:   4%|▍         | 8/200 [08:21<3:42:40, 69.59s/it, best=0.859]/export/usuarios01/egarroyo/MALDI_for_AMR_prediction/venv/lib/python3.13/site-packages/sklearn/model_selection/_split.py:813: UserWarning: The least populated class in y has only 4 members, which is less than n_splits=5.
  warnings.warn(
[I 2026-02-28 02:13:53,304] Trial 164 finished with value: 0.9064719561553062 and parameters: {'activation': 'tanh', 'solver': 'adam', 'lr': 2.6554579246819642e-05, 'layer1': 66, 'layer2': 455, 'layer3': 415}. Best is trial 130 with value: 0.9107197512148748.

Klebsiella_Pneumoniae | Ceftriaxone | Optuna:  82%|████████▎ | 165/200 [5:23:14<1:14:25, 127.58s/it, best=0.911][A
Klebsiella_Pneumoniae | Ceftriaxone | Optuna:  82%|████████▎ | 165/200 [5:23:14<1:14:25, 127.58s/it, best=0.911][A[I 2026-02-28 02:14:26,071] Trial 182 finished with value: 0.8563209678885666 and parameters: {'activation': 'logistic', 'solver': 'adam', 'lr': 0.00045979911873159264, 'layer1': 248, 'layer2': 32, 'layer3': 95}. Best is trial 156 with value: 0.8585541372555268.

Staphylococcus_Aureus | Clindamycin | Optuna:  92%|█████████▏| 183/200 [4:16:27<25:37, 90.45s/it, best=0.859][A
Staphylococcus_Aureus | Clindamycin | Optuna:  92%|█████████▏| 183/200 [4:16:27<25:37, 90.45s/it, best=0.859][A[I 2026-02-28 02:14:49,981] Trial 8 finished with value: 0.8632209576436456 and parameters: {'activation': 'identity', 'solver': 'adam', 'lr': 0.000828752236376816, 'layer1': 323, 'layer2': 445, 'layer3': 241}. Best is trial 8 with value: 0.8632209576436456.
Pseudomonas_Aeruginosa | LPS | Optuna:   4%|▍         | 9/200 [09:52<4:02:08, 76.07s/it, best=0.859]Pseudomonas_Aeruginosa | LPS | Optuna:   4%|▍         | 9/200 [09:52<4:02:08, 76.07s/it, best=0.863]/export/usuarios01/egarroyo/MALDI_for_AMR_prediction/venv/lib/python3.13/site-packages/sklearn/model_selection/_split.py:813: UserWarning: The least populated class in y has only 4 members, which is less than n_splits=5.
  warnings.warn(
[I 2026-02-28 02:14:59,183] Trial 165 finished with value: 0.8770707945865046 and parameters: {'activation': 'tanh', 'solver': 'adam', 'lr': 0.0014509416317914014, 'layer1': 286, 'layer2': 490, 'layer3': 406}. Best is trial 130 with value: 0.9107197512148748.

Klebsiella_Pneumoniae | Ceftriaxone | Optuna:  83%|████████▎ | 166/200 [5:24:20<1:01:48, 109.07s/it, best=0.911][A
Klebsiella_Pneumoniae | Ceftriaxone | Optuna:  83%|████████▎ | 166/200 [5:24:20<1:01:48, 109.07s/it, best=0.911][A[I 2026-02-28 02:16:15,747] Trial 183 finished with value: 0.8560071743843874 and parameters: {'activation': 'logistic', 'solver': 'adam', 'lr': 0.00043454089002815173, 'layer1': 252, 'layer2': 53, 'layer3': 119}. Best is trial 156 with value: 0.8585541372555268.

Staphylococcus_Aureus | Clindamycin | Optuna:  92%|█████████▏| 184/200 [4:18:17<25:39, 96.22s/it, best=0.859][A
Staphylococcus_Aureus | Clindamycin | Optuna:  92%|█████████▏| 184/200 [4:18:17<25:39, 96.22s/it, best=0.859][A[I 2026-02-28 02:16:28,112] Trial 9 finished with value: 0.813523100049404 and parameters: {'activation': 'tanh', 'solver': 'sgd', 'lr': 0.00012329098365270507, 'layer1': 219, 'layer2': 22, 'layer3': 62}. Best is trial 8 with value: 0.8632209576436456.
Pseudomonas_Aeruginosa | LPS | Optuna:   5%|▌         | 10/200 [11:30<4:22:27, 82.88s/it, best=0.863]Pseudomonas_Aeruginosa | LPS | Optuna:   5%|▌         | 10/200 [11:30<4:22:27, 82.88s/it, best=0.863]/export/usuarios01/egarroyo/MALDI_for_AMR_prediction/venv/lib/python3.13/site-packages/sklearn/model_selection/_split.py:813: UserWarning: The least populated class in y has only 4 members, which is less than n_splits=5.
  warnings.warn(
[I 2026-02-28 02:17:02,441] Trial 166 finished with value: 0.9032965521542046 and parameters: {'activation': 'tanh', 'solver': 'adam', 'lr': 2.0725621764411474e-05, 'layer1': 249, 'layer2': 474, 'layer3': 429}. Best is trial 130 with value: 0.9107197512148748.

Klebsiella_Pneumoniae | Ceftriaxone | Optuna:  84%|████████▎ | 167/200 [5:26:23<1:02:19, 113.32s/it, best=0.911][A
Klebsiella_Pneumoniae | Ceftriaxone | Optuna:  84%|████████▎ | 167/200 [5:26:23<1:02:19, 113.32s/it, best=0.911][A[I 2026-02-28 02:17:21,711] Trial 10 finished with value: 0.8298041703710812 and parameters: {'activation': 'identity', 'solver': 'sgd', 'lr': 0.007553503645583194, 'layer1': 366, 'layer2': 492, 'layer3': 320}. Best is trial 8 with value: 0.8632209576436456.
Pseudomonas_Aeruginosa | LPS | Optuna:   6%|▌         | 11/200 [12:23<3:52:50, 73.92s/it, best=0.863]Pseudomonas_Aeruginosa | LPS | Optuna:   6%|▌         | 11/200 [12:23<3:52:50, 73.92s/it, best=0.863]/export/usuarios01/egarroyo/MALDI_for_AMR_prediction/venv/lib/python3.13/site-packages/sklearn/model_selection/_split.py:813: UserWarning: The least populated class in y has only 4 members, which is less than n_splits=5.
  warnings.warn(
[I 2026-02-28 02:17:24,816] Trial 77 finished with value: 0.8561765983987751 and parameters: {'activation': 'relu', 'solver': 'adam', 'lr': 1.1145934261267918e-05, 'layer1': 500, 'layer2': 136, 'layer3': 183}. Best is trial 14 with value: 0.8971256036318559.

Escherichia_Coli | Ceftriaxone | Optuna:  39%|███▉      | 78/200 [3:07:26<6:01:45, 177.92s/it, best=0.897][A
Escherichia_Coli | Ceftriaxone | Optuna:  39%|███▉      | 78/200 [3:07:26<6:01:45, 177.92s/it, best=0.897][A[I 2026-02-28 02:18:05,144] Trial 184 finished with value: 0.8553654026226427 and parameters: {'activation': 'logistic', 'solver': 'adam', 'lr': 0.00042572999705531533, 'layer1': 255, 'layer2': 57, 'layer3': 117}. Best is trial 156 with value: 0.8585541372555268.

Staphylococcus_Aureus | Clindamycin | Optuna:  92%|█████████▎| 185/200 [4:20:06<25:02, 100.17s/it, best=0.859][A
Staphylococcus_Aureus | Clindamycin | Optuna:  92%|█████████▎| 185/200 [4:20:06<25:02, 100.17s/it, best=0.859][A[I 2026-02-28 02:18:15,995] Trial 11 finished with value: 0.8581534678456363 and parameters: {'activation': 'relu', 'solver': 'adam', 'lr': 0.0013124793805688133, 'layer1': 150, 'layer2': 163, 'layer3': 284}. Best is trial 8 with value: 0.8632209576436456.
Pseudomonas_Aeruginosa | LPS | Optuna:   6%|▌         | 12/200 [13:18<3:32:53, 67.94s/it, best=0.863]Pseudomonas_Aeruginosa | LPS | Optuna:   6%|▌         | 12/200 [13:18<3:32:53, 67.94s/it, best=0.863]/export/usuarios01/egarroyo/MALDI_for_AMR_prediction/venv/lib/python3.13/site-packages/sklearn/model_selection/_split.py:813: UserWarning: The least populated class in y has only 4 members, which is less than n_splits=5.
  warnings.warn(
[I 2026-02-28 02:19:46,761] Trial 185 finished with value: 0.8545535485372481 and parameters: {'activation': 'logistic', 'solver': 'adam', 'lr': 0.00036368854067880824, 'layer1': 268, 'layer2': 61, 'layer3': 122}. Best is trial 156 with value: 0.8585541372555268.

Staphylococcus_Aureus | Clindamycin | Optuna:  93%|█████████▎| 186/200 [4:21:48<23:28, 100.60s/it, best=0.859][A
Staphylococcus_Aureus | Clindamycin | Optuna:  93%|█████████▎| 186/200 [4:21:48<23:28, 100.60s/it, best=0.859][A[I 2026-02-28 02:20:04,801] Trial 12 finished with value: 0.864591095927125 and parameters: {'activation': 'identity', 'solver': 'adam', 'lr': 0.00046544039809979403, 'layer1': 347, 'layer2': 434, 'layer3': 419}. Best is trial 12 with value: 0.864591095927125.
Pseudomonas_Aeruginosa | LPS | Optuna:   6%|▋         | 13/200 [15:06<4:10:20, 80.32s/it, best=0.863]Pseudomonas_Aeruginosa | LPS | Optuna:   6%|▋         | 13/200 [15:06<4:10:20, 80.32s/it, best=0.865]/export/usuarios01/egarroyo/MALDI_for_AMR_prediction/venv/lib/python3.13/site-packages/sklearn/model_selection/_split.py:813: UserWarning: The least populated class in y has only 4 members, which is less than n_splits=5.
  warnings.warn(
[I 2026-02-28 02:20:46,020] Trial 167 finished with value: 0.761477750398343 and parameters: {'activation': 'tanh', 'solver': 'sgd', 'lr': 2.911242655887827e-05, 'layer1': 267, 'layer2': 450, 'layer3': 419}. Best is trial 130 with value: 0.9107197512148748.

Klebsiella_Pneumoniae | Ceftriaxone | Optuna:  84%|████████▍ | 168/200 [5:30:07<1:18:04, 146.40s/it, best=0.911][A
Klebsiella_Pneumoniae | Ceftriaxone | Optuna:  84%|████████▍ | 168/200 [5:30:07<1:18:04, 146.40s/it, best=0.911][A[I 2026-02-28 02:21:34,706] Trial 186 finished with value: 0.8535810174975206 and parameters: {'activation': 'logistic', 'solver': 'adam', 'lr': 0.00042374951992630585, 'layer1': 254, 'layer2': 51, 'layer3': 141}. Best is trial 156 with value: 0.8585541372555268.

Staphylococcus_Aureus | Clindamycin | Optuna:  94%|█████████▎| 187/200 [4:23:36<22:16, 102.81s/it, best=0.859][A
Staphylococcus_Aureus | Clindamycin | Optuna:  94%|█████████▎| 187/200 [4:23:36<22:16, 102.81s/it, best=0.859][A[I 2026-02-28 02:21:48,294] Trial 78 finished with value: 0.8904425135389097 and parameters: {'activation': 'relu', 'solver': 'adam', 'lr': 1.9200110535491322e-05, 'layer1': 425, 'layer2': 59, 'layer3': 43}. Best is trial 14 with value: 0.8971256036318559.

Escherichia_Coli | Ceftriaxone | Optuna:  40%|███▉      | 79/200 [3:11:49<6:50:33, 203.59s/it, best=0.897][A
Escherichia_Coli | Ceftriaxone | Optuna:  40%|███▉      | 79/200 [3:11:49<6:50:33, 203.59s/it, best=0.897][A[I 2026-02-28 02:22:12,692] Trial 13 finished with value: 0.865599468881024 and parameters: {'activation': 'identity', 'solver': 'adam', 'lr': 0.00025548240574830476, 'layer1': 499, 'layer2': 471, 'layer3': 419}. Best is trial 13 with value: 0.865599468881024.
Pseudomonas_Aeruginosa | LPS | Optuna:   7%|▋         | 14/200 [17:14<4:53:32, 94.69s/it, best=0.865]Pseudomonas_Aeruginosa | LPS | Optuna:   7%|▋         | 14/200 [17:14<4:53:32, 94.69s/it, best=0.866]/export/usuarios01/egarroyo/MALDI_for_AMR_prediction/venv/lib/python3.13/site-packages/sklearn/model_selection/_split.py:813: UserWarning: The least populated class in y has only 4 members, which is less than n_splits=5.
  warnings.warn(
[I 2026-02-28 02:22:37,716] Trial 168 finished with value: 0.904682546287631 and parameters: {'activation': 'tanh', 'solver': 'adam', 'lr': 3.900372375623628e-05, 'layer1': 271, 'layer2': 480, 'layer3': 446}. Best is trial 130 with value: 0.9107197512148748.

Klebsiella_Pneumoniae | Ceftriaxone | Optuna:  84%|████████▍ | 169/200 [5:31:59<1:10:15, 135.99s/it, best=0.911][A
Klebsiella_Pneumoniae | Ceftriaxone | Optuna:  84%|████████▍ | 169/200 [5:31:59<1:10:15, 135.99s/it, best=0.911][A[I 2026-02-28 02:23:05,307] Trial 187 finished with value: 0.8396482575094776 and parameters: {'activation': 'logistic', 'solver': 'adam', 'lr': 0.0003046651364254431, 'layer1': 282, 'layer2': 75, 'layer3': 114}. Best is trial 156 with value: 0.8585541372555268.

Staphylococcus_Aureus | Clindamycin | Optuna:  94%|█████████▍| 188/200 [4:25:06<19:49, 99.14s/it, best=0.859] [A
Staphylococcus_Aureus | Clindamycin | Optuna:  94%|█████████▍| 188/200 [4:25:06<19:49, 99.14s/it, best=0.859][A[I 2026-02-28 02:24:17,735] Trial 14 finished with value: 0.8641768209111362 and parameters: {'activation': 'identity', 'solver': 'adam', 'lr': 0.00013839971926370072, 'layer1': 499, 'layer2': 394, 'layer3': 414}. Best is trial 13 with value: 0.865599468881024.
Pseudomonas_Aeruginosa | LPS | Optuna:   8%|▊         | 15/200 [19:19<5:20:10, 103.84s/it, best=0.866]Pseudomonas_Aeruginosa | LPS | Optuna:   8%|▊         | 15/200 [19:19<5:20:10, 103.84s/it, best=0.866]/export/usuarios01/egarroyo/MALDI_for_AMR_prediction/venv/lib/python3.13/site-packages/sklearn/model_selection/_split.py:813: UserWarning: The least populated class in y has only 4 members, which is less than n_splits=5.
  warnings.warn(
[I 2026-02-28 02:24:25,862] Trial 188 finished with value: 0.850168364957554 and parameters: {'activation': 'logistic', 'solver': 'adam', 'lr': 0.0005452038633802525, 'layer1': 245, 'layer2': 44, 'layer3': 157}. Best is trial 156 with value: 0.8585541372555268.

Staphylococcus_Aureus | Clindamycin | Optuna:  94%|█████████▍| 189/200 [4:26:27<17:09, 93.57s/it, best=0.859][A
Staphylococcus_Aureus | Clindamycin | Optuna:  94%|█████████▍| 189/200 [4:26:27<17:09, 93.57s/it, best=0.859][A[I 2026-02-28 02:25:06,866] Trial 169 finished with value: 0.9082932838879205 and parameters: {'activation': 'tanh', 'solver': 'adam', 'lr': 1.4403711148762783e-05, 'layer1': 262, 'layer2': 463, 'layer3': 400}. Best is trial 130 with value: 0.9107197512148748.

Klebsiella_Pneumoniae | Ceftriaxone | Optuna:  85%|████████▌ | 170/200 [5:34:28<1:09:58, 139.94s/it, best=0.911][A
Klebsiella_Pneumoniae | Ceftriaxone | Optuna:  85%|████████▌ | 170/200 [5:34:28<1:09:58, 139.94s/it, best=0.911][A[I 2026-02-28 02:25:28,964] Trial 79 finished with value: 0.8955328372423554 and parameters: {'activation': 'relu', 'solver': 'adam', 'lr': 2.8961851878335684e-05, 'layer1': 476, 'layer2': 79, 'layer3': 215}. Best is trial 14 with value: 0.8971256036318559.

Escherichia_Coli | Ceftriaxone | Optuna:  40%|████      | 80/200 [3:15:30<6:57:25, 208.71s/it, best=0.897][A
Escherichia_Coli | Ceftriaxone | Optuna:  40%|████      | 80/200 [3:15:30<6:57:25, 208.71s/it, best=0.897][A[I 2026-02-28 02:25:40,215] Trial 189 finished with value: 0.8517903704723085 and parameters: {'activation': 'logistic', 'solver': 'adam', 'lr': 0.0008233362773257823, 'layer1': 243, 'layer2': 61, 'layer3': 103}. Best is trial 156 with value: 0.8585541372555268.

Staphylococcus_Aureus | Clindamycin | Optuna:  95%|█████████▌| 190/200 [4:27:41<14:38, 87.80s/it, best=0.859][A
Staphylococcus_Aureus | Clindamycin | Optuna:  95%|█████████▌| 190/200 [4:27:41<14:38, 87.80s/it, best=0.859][A[I 2026-02-28 02:25:59,590] Trial 15 finished with value: 0.8622982020128968 and parameters: {'activation': 'identity', 'solver': 'adam', 'lr': 0.0003521954261532511, 'layer1': 497, 'layer2': 499, 'layer3': 500}. Best is trial 13 with value: 0.865599468881024.
Pseudomonas_Aeruginosa | LPS | Optuna:   8%|▊         | 16/200 [21:01<5:16:36, 103.24s/it, best=0.866]Pseudomonas_Aeruginosa | LPS | Optuna:   8%|▊         | 16/200 [21:01<5:16:36, 103.24s/it, best=0.866]/export/usuarios01/egarroyo/MALDI_for_AMR_prediction/venv/lib/python3.13/site-packages/sklearn/model_selection/_split.py:813: UserWarning: The least populated class in y has only 4 members, which is less than n_splits=5.
  warnings.warn(
[I 2026-02-28 02:27:27,608] Trial 170 finished with value: 0.9040697281141874 and parameters: {'activation': 'tanh', 'solver': 'adam', 'lr': 1.746093179468678e-05, 'layer1': 263, 'layer2': 463, 'layer3': 403}. Best is trial 130 with value: 0.9107197512148748.

Klebsiella_Pneumoniae | Ceftriaxone | Optuna:  86%|████████▌ | 171/200 [5:36:49<1:07:45, 140.18s/it, best=0.911][A
Klebsiella_Pneumoniae | Ceftriaxone | Optuna:  86%|████████▌ | 171/200 [5:36:49<1:07:45, 140.18s/it, best=0.911][A[I 2026-02-28 02:27:33,664] Trial 190 finished with value: 0.8543216926694243 and parameters: {'activation': 'logistic', 'solver': 'adam', 'lr': 0.0003747111704480218, 'layer1': 263, 'layer2': 80, 'layer3': 126}. Best is trial 156 with value: 0.8585541372555268.

Staphylococcus_Aureus | Clindamycin | Optuna:  96%|█████████▌| 191/200 [4:29:35<14:19, 95.50s/it, best=0.859][A
Staphylococcus_Aureus | Clindamycin | Optuna:  96%|█████████▌| 191/200 [4:29:35<14:19, 95.50s/it, best=0.859][A[I 2026-02-28 02:27:55,237] Trial 16 finished with value: 0.8615814682171694 and parameters: {'activation': 'identity', 'solver': 'adam', 'lr': 0.004512428606443835, 'layer1': 441, 'layer2': 393, 'layer3': 405}. Best is trial 13 with value: 0.865599468881024.
Pseudomonas_Aeruginosa | LPS | Optuna:   8%|▊         | 17/200 [22:57<5:26:15, 106.97s/it, best=0.866]Pseudomonas_Aeruginosa | LPS | Optuna:   8%|▊         | 17/200 [22:57<5:26:15, 106.97s/it, best=0.866]/export/usuarios01/egarroyo/MALDI_for_AMR_prediction/venv/lib/python3.13/site-packages/sklearn/model_selection/_split.py:813: UserWarning: The least populated class in y has only 4 members, which is less than n_splits=5.
  warnings.warn(
