Staphylococcus_Aureus | Fusidic acid | Optuna:  72%|███████▏  | 144/200 [3:53:22<1:21:15, 87.07s/it, best=0.928][A[I 2026-02-28 06:34:32,643] Trial 38 finished with value: 0.9772605299904569 and parameters: {'activation': 'relu', 'solver': 'sgd', 'lr': 2.7580921462044736e-05, 'layer1': 176, 'layer2': 368, 'layer3': 206}. Best is trial 27 with value: 0.9821048418402821.

Klebsiella_Pneumoniae | Meropenem | Optuna:  20%|█▉        | 39/200 [35:13<2:41:31, 60.19s/it, best=0.982][A
Klebsiella_Pneumoniae | Meropenem | Optuna:  20%|█▉        | 39/200 [35:13<2:41:31, 60.19s/it, best=0.982][A[I 2026-02-28 06:35:06,844] Trial 39 finished with value: 0.9767069569332589 and parameters: {'activation': 'relu', 'solver': 'adam', 'lr': 9.07330211440507e-06, 'layer1': 233, 'layer2': 261, 'layer3': 149}. Best is trial 27 with value: 0.9821048418402821.

Klebsiella_Pneumoniae | Meropenem | Optuna:  20%|██        | 40/200 [35:47<2:19:43, 52.40s/it, best=0.982][A
Klebsiella_Pneumoniae | Meropenem | Optuna:  20%|██        | 40/200 [35:47<2:19:43, 52.40s/it, best=0.982][A[I 2026-02-28 06:35:32,810] Trial 184 finished with value: 0.8648046574079358 and parameters: {'activation': 'identity', 'solver': 'adam', 'lr': 0.0013465487609618174, 'layer1': 343, 'layer2': 295, 'layer3': 416}. Best is trial 140 with value: 0.8705750568176336.
Pseudomonas_Aeruginosa | LPS | Optuna:  92%|█████████▎| 185/200 [4:30:34<23:42, 94.81s/it, best=0.871]Pseudomonas_Aeruginosa | LPS | Optuna:  92%|█████████▎| 185/200 [4:30:34<23:42, 94.81s/it, best=0.871]/export/usuarios01/egarroyo/MALDI_for_AMR_prediction/venv/lib/python3.13/site-packages/sklearn/model_selection/_split.py:813: UserWarning: The least populated class in y has only 4 members, which is less than n_splits=5.
  warnings.warn(
[I 2026-02-28 06:35:58,660] Trial 40 finished with value: 0.9801653980280394 and parameters: {'activation': 'tanh', 'solver': 'adam', 'lr': 0.0019856165403589914, 'layer1': 380, 'layer2': 217, 'layer3': 262}. Best is trial 27 with value: 0.9821048418402821.

Klebsiella_Pneumoniae | Meropenem | Optuna:  20%|██        | 41/200 [36:39<2:18:23, 52.22s/it, best=0.982][A
Klebsiella_Pneumoniae | Meropenem | Optuna:  20%|██        | 41/200 [36:39<2:18:23, 52.22s/it, best=0.982][A[I 2026-02-28 06:36:01,127] Trial 144 finished with value: 0.9282118187566093 and parameters: {'activation': 'identity', 'solver': 'adam', 'lr': 0.00016514791725693405, 'layer1': 437, 'layer2': 137, 'layer3': 206}. Best is trial 77 with value: 0.9283869597728589.

Staphylococcus_Aureus | Fusidic acid | Optuna:  72%|███████▎  | 145/200 [3:55:10<1:25:29, 93.26s/it, best=0.928][A
Staphylococcus_Aureus | Fusidic acid | Optuna:  72%|███████▎  | 145/200 [3:55:10<1:25:29, 93.26s/it, best=0.928][A[I 2026-02-28 06:36:24,088] Trial 185 finished with value: 0.858117015091502 and parameters: {'activation': 'identity', 'solver': 'adam', 'lr': 0.0021793251820491242, 'layer1': 10, 'layer2': 278, 'layer3': 429}. Best is trial 140 with value: 0.8705750568176336.
Pseudomonas_Aeruginosa | LPS | Optuna:  93%|█████████▎| 186/200 [4:31:26<19:04, 81.75s/it, best=0.871]Pseudomonas_Aeruginosa | LPS | Optuna:  93%|█████████▎| 186/200 [4:31:26<19:04, 81.75s/it, best=0.871]/export/usuarios01/egarroyo/MALDI_for_AMR_prediction/venv/lib/python3.13/site-packages/sklearn/model_selection/_split.py:813: UserWarning: The least populated class in y has only 4 members, which is less than n_splits=5.
  warnings.warn(
[I 2026-02-28 06:36:42,131] Trial 171 finished with value: 0.8948347220829385 and parameters: {'activation': 'relu', 'solver': 'adam', 'lr': 9.941824903145816e-05, 'layer1': 486, 'layer2': 39, 'layer3': 27}. Best is trial 137 with value: 0.8979080367540411.

Escherichia_Coli | Ceftriaxone | Optuna:  86%|████████▌ | 172/200 [7:26:43<1:32:26, 198.10s/it, best=0.898][A
Escherichia_Coli | Ceftriaxone | Optuna:  86%|████████▌ | 172/200 [7:26:43<1:32:26, 198.10s/it, best=0.898][A[I 2026-02-28 06:37:30,815] Trial 41 finished with value: 0.9818297349337402 and parameters: {'activation': 'relu', 'solver': 'adam', 'lr': 0.0009018184231939435, 'layer1': 414, 'layer2': 286, 'layer3': 476}. Best is trial 27 with value: 0.9821048418402821.

Klebsiella_Pneumoniae | Meropenem | Optuna:  21%|██        | 42/200 [38:11<2:49:03, 64.20s/it, best=0.982][A
Klebsiella_Pneumoniae | Meropenem | Optuna:  21%|██        | 42/200 [38:11<2:49:03, 64.20s/it, best=0.982][A[I 2026-02-28 06:37:31,361] Trial 145 finished with value: 0.9266915389792241 and parameters: {'activation': 'identity', 'solver': 'adam', 'lr': 0.000155070251609141, 'layer1': 439, 'layer2': 65, 'layer3': 204}. Best is trial 77 with value: 0.9283869597728589.

Staphylococcus_Aureus | Fusidic acid | Optuna:  73%|███████▎  | 146/200 [3:56:40<1:23:07, 92.35s/it, best=0.928][A
Staphylococcus_Aureus | Fusidic acid | Optuna:  73%|███████▎  | 146/200 [3:56:40<1:23:07, 92.35s/it, best=0.928][A[I 2026-02-28 06:38:05,624] Trial 186 finished with value: 0.8633247860800598 and parameters: {'activation': 'identity', 'solver': 'adam', 'lr': 0.0009549638827493391, 'layer1': 385, 'layer2': 305, 'layer3': 409}. Best is trial 140 with value: 0.8705750568176336.
Pseudomonas_Aeruginosa | LPS | Optuna:  94%|█████████▎| 187/200 [4:33:07<18:59, 87.68s/it, best=0.871]Pseudomonas_Aeruginosa | LPS | Optuna:  94%|█████████▎| 187/200 [4:33:07<18:59, 87.68s/it, best=0.871]/export/usuarios01/egarroyo/MALDI_for_AMR_prediction/venv/lib/python3.13/site-packages/sklearn/model_selection/_split.py:813: UserWarning: The least populated class in y has only 4 members, which is less than n_splits=5.
  warnings.warn(
[I 2026-02-28 06:38:19,246] Trial 42 finished with value: 0.9768229702609773 and parameters: {'activation': 'relu', 'solver': 'adam', 'lr': 0.006855484044351041, 'layer1': 418, 'layer2': 315, 'layer3': 477}. Best is trial 27 with value: 0.9821048418402821.

Klebsiella_Pneumoniae | Meropenem | Optuna:  22%|██▏       | 43/200 [38:59<2:35:36, 59.47s/it, best=0.982][A
Klebsiella_Pneumoniae | Meropenem | Optuna:  22%|██▏       | 43/200 [38:59<2:35:36, 59.47s/it, best=0.982][A[I 2026-02-28 06:38:50,814] Trial 172 finished with value: 0.8932706319035546 and parameters: {'activation': 'relu', 'solver': 'adam', 'lr': 0.00012606524335757836, 'layer1': 479, 'layer2': 56, 'layer3': 91}. Best is trial 137 with value: 0.8979080367540411.

Escherichia_Coli | Ceftriaxone | Optuna:  86%|████████▋ | 173/200 [7:28:52<1:19:46, 177.28s/it, best=0.898][A
Escherichia_Coli | Ceftriaxone | Optuna:  86%|████████▋ | 173/200 [7:28:52<1:19:46, 177.28s/it, best=0.898][A[I 2026-02-28 06:38:55,791] Trial 146 finished with value: 0.925867383253007 and parameters: {'activation': 'tanh', 'solver': 'adam', 'lr': 0.00011034576422368485, 'layer1': 422, 'layer2': 139, 'layer3': 190}. Best is trial 77 with value: 0.9283869597728589.

Staphylococcus_Aureus | Fusidic acid | Optuna:  74%|███████▎  | 147/200 [3:58:04<1:19:28, 89.98s/it, best=0.928][A
Staphylococcus_Aureus | Fusidic acid | Optuna:  74%|███████▎  | 147/200 [3:58:04<1:19:28, 89.98s/it, best=0.928][A[I 2026-02-28 06:39:20,171] Trial 43 finished with value: 0.9815430177096769 and parameters: {'activation': 'relu', 'solver': 'adam', 'lr': 0.0009622265893397815, 'layer1': 297, 'layer2': 283, 'layer3': 117}. Best is trial 27 with value: 0.9821048418402821.

Klebsiella_Pneumoniae | Meropenem | Optuna:  22%|██▏       | 44/200 [40:00<2:35:45, 59.91s/it, best=0.982][A
Klebsiella_Pneumoniae | Meropenem | Optuna:  22%|██▏       | 44/200 [40:00<2:35:45, 59.91s/it, best=0.982][A[I 2026-02-28 06:39:38,660] Trial 187 finished with value: 0.8649403577823289 and parameters: {'activation': 'identity', 'solver': 'adam', 'lr': 0.0011079934724565073, 'layer1': 335, 'layer2': 267, 'layer3': 424}. Best is trial 140 with value: 0.8705750568176336.
Pseudomonas_Aeruginosa | LPS | Optuna:  94%|█████████▍| 188/200 [4:34:40<17:51, 89.29s/it, best=0.871]Pseudomonas_Aeruginosa | LPS | Optuna:  94%|█████████▍| 188/200 [4:34:40<17:51, 89.29s/it, best=0.871]/export/usuarios01/egarroyo/MALDI_for_AMR_prediction/venv/lib/python3.13/site-packages/sklearn/model_selection/_split.py:813: UserWarning: The least populated class in y has only 4 members, which is less than n_splits=5.
  warnings.warn(
[I 2026-02-28 06:40:02,344] Trial 44 finished with value: 0.9798273644076663 and parameters: {'activation': 'identity', 'solver': 'adam', 'lr': 0.0012643210335505752, 'layer1': 350, 'layer2': 345, 'layer3': 113}. Best is trial 27 with value: 0.9821048418402821.

Klebsiella_Pneumoniae | Meropenem | Optuna:  22%|██▎       | 45/200 [40:42<2:21:00, 54.59s/it, best=0.982][A
Klebsiella_Pneumoniae | Meropenem | Optuna:  22%|██▎       | 45/200 [40:42<2:21:00, 54.59s/it, best=0.982][A[I 2026-02-28 06:40:48,247] Trial 45 finished with value: 0.9788165202715506 and parameters: {'activation': 'relu', 'solver': 'adam', 'lr': 0.0019049517975798847, 'layer1': 277, 'layer2': 276, 'layer3': 497}. Best is trial 27 with value: 0.9821048418402821.

Klebsiella_Pneumoniae | Meropenem | Optuna:  23%|██▎       | 46/200 [41:28<2:13:25, 51.98s/it, best=0.982][A
Klebsiella_Pneumoniae | Meropenem | Optuna:  23%|██▎       | 46/200 [41:28<2:13:25, 51.98s/it, best=0.982][A[I 2026-02-28 06:41:01,300] Trial 147 finished with value: 0.9270120930464433 and parameters: {'activation': 'identity', 'solver': 'adam', 'lr': 0.0001832244824701754, 'layer1': 451, 'layer2': 443, 'layer3': 152}. Best is trial 77 with value: 0.9283869597728589.

Staphylococcus_Aureus | Fusidic acid | Optuna:  74%|███████▍  | 148/200 [4:00:10<1:27:13, 100.64s/it, best=0.928][A
Staphylococcus_Aureus | Fusidic acid | Optuna:  74%|███████▍  | 148/200 [4:00:10<1:27:13, 100.64s/it, best=0.928][A[I 2026-02-28 06:41:17,246] Trial 188 finished with value: 0.8649389035724264 and parameters: {'activation': 'identity', 'solver': 'adam', 'lr': 0.0015421314875789375, 'layer1': 353, 'layer2': 295, 'layer3': 441}. Best is trial 140 with value: 0.8705750568176336.
Pseudomonas_Aeruginosa | LPS | Optuna:  94%|█████████▍| 189/200 [4:36:19<16:52, 92.08s/it, best=0.871]Pseudomonas_Aeruginosa | LPS | Optuna:  94%|█████████▍| 189/200 [4:36:19<16:52, 92.08s/it, best=0.871]/export/usuarios01/egarroyo/MALDI_for_AMR_prediction/venv/lib/python3.13/site-packages/sklearn/model_selection/_split.py:813: UserWarning: The least populated class in y has only 4 members, which is less than n_splits=5.
  warnings.warn(
[I 2026-02-28 06:41:34,936] Trial 46 finished with value: 0.9790971754622527 and parameters: {'activation': 'relu', 'solver': 'adam', 'lr': 0.000990416201818258, 'layer1': 462, 'layer2': 171, 'layer3': 404}. Best is trial 27 with value: 0.9821048418402821.

Klebsiella_Pneumoniae | Meropenem | Optuna:  24%|██▎       | 47/200 [42:15<2:08:30, 50.39s/it, best=0.982][A
Klebsiella_Pneumoniae | Meropenem | Optuna:  24%|██▎       | 47/200 [42:15<2:08:30, 50.39s/it, best=0.982][A[I 2026-02-28 06:41:46,100] Trial 173 finished with value: 0.8968005035563316 and parameters: {'activation': 'relu', 'solver': 'adam', 'lr': 6.342905291235137e-05, 'layer1': 464, 'layer2': 129, 'layer3': 10}. Best is trial 137 with value: 0.8979080367540411.

Escherichia_Coli | Ceftriaxone | Optuna:  87%|████████▋ | 174/200 [7:31:47<1:16:33, 176.68s/it, best=0.898][A
Escherichia_Coli | Ceftriaxone | Optuna:  87%|████████▋ | 174/200 [7:31:47<1:16:33, 176.68s/it, best=0.898][A[I 2026-02-28 06:42:03,443] Trial 47 finished with value: 0.977819745266264 and parameters: {'activation': 'identity', 'solver': 'sgd', 'lr': 0.005465282301110395, 'layer1': 420, 'layer2': 390, 'layer3': 23}. Best is trial 27 with value: 0.9821048418402821.

Klebsiella_Pneumoniae | Meropenem | Optuna:  24%|██▍       | 48/200 [42:43<1:51:01, 43.83s/it, best=0.982][A
Klebsiella_Pneumoniae | Meropenem | Optuna:  24%|██▍       | 48/200 [42:43<1:51:01, 43.83s/it, best=0.982][A[I 2026-02-28 06:42:43,065] Trial 48 finished with value: 0.9767069569332589 and parameters: {'activation': 'relu', 'solver': 'adam', 'lr': 1.625638715194242e-06, 'layer1': 199, 'layer2': 274, 'layer3': 144}. Best is trial 27 with value: 0.9821048418402821.

Klebsiella_Pneumoniae | Meropenem | Optuna:  24%|██▍       | 49/200 [43:23<1:47:07, 42.57s/it, best=0.982][A
Klebsiella_Pneumoniae | Meropenem | Optuna:  24%|██▍       | 49/200 [43:23<1:47:07, 42.57s/it, best=0.982][A[I 2026-02-28 06:42:45,279] Trial 148 finished with value: 0.9278757354615663 and parameters: {'activation': 'identity', 'solver': 'adam', 'lr': 0.00013535043556912627, 'layer1': 379, 'layer2': 160, 'layer3': 77}. Best is trial 77 with value: 0.9283869597728589.

Staphylococcus_Aureus | Fusidic acid | Optuna:  74%|███████▍  | 149/200 [4:01:54<1:26:23, 101.64s/it, best=0.928][A
Staphylococcus_Aureus | Fusidic acid | Optuna:  74%|███████▍  | 149/200 [4:01:54<1:26:23, 101.64s/it, best=0.928][A[I 2026-02-28 06:42:55,461] Trial 189 finished with value: 0.8636210973267188 and parameters: {'activation': 'relu', 'solver': 'adam', 'lr': 0.0026548862137063464, 'layer1': 377, 'layer2': 317, 'layer3': 456}. Best is trial 140 with value: 0.8705750568176336.
Pseudomonas_Aeruginosa | LPS | Optuna:  95%|█████████▌| 190/200 [4:37:57<15:39, 93.92s/it, best=0.871]Pseudomonas_Aeruginosa | LPS | Optuna:  95%|█████████▌| 190/200 [4:37:57<15:39, 93.92s/it, best=0.871]/export/usuarios01/egarroyo/MALDI_for_AMR_prediction/venv/lib/python3.13/site-packages/sklearn/model_selection/_split.py:813: UserWarning: The least populated class in y has only 4 members, which is less than n_splits=5.
  warnings.warn(
[I 2026-02-28 06:43:19,660] Trial 190 finished with value: 0.8266585471143675 and parameters: {'activation': 'identity', 'solver': 'adam', 'lr': 1.723891167715232e-05, 'layer1': 24, 'layer2': 323, 'layer3': 405}. Best is trial 140 with value: 0.8705750568176336.
Pseudomonas_Aeruginosa | LPS | Optuna:  96%|█████████▌| 191/200 [4:38:21<10:57, 73.00s/it, best=0.871]Pseudomonas_Aeruginosa | LPS | Optuna:  96%|█████████▌| 191/200 [4:38:21<10:57, 73.00s/it, best=0.871]/export/usuarios01/egarroyo/MALDI_for_AMR_prediction/venv/lib/python3.13/site-packages/sklearn/model_selection/_split.py:813: UserWarning: The least populated class in y has only 4 members, which is less than n_splits=5.
  warnings.warn(
[I 2026-02-28 06:43:33,098] Trial 49 finished with value: 0.9796365041429835 and parameters: {'activation': 'relu', 'solver': 'adam', 'lr': 0.0002079712372833856, 'layer1': 390, 'layer2': 219, 'layer3': 55}. Best is trial 27 with value: 0.9821048418402821.

Klebsiella_Pneumoniae | Meropenem | Optuna:  25%|██▌       | 50/200 [44:13<1:52:00, 44.81s/it, best=0.982][A
Klebsiella_Pneumoniae | Meropenem | Optuna:  25%|██▌       | 50/200 [44:13<1:52:00, 44.81s/it, best=0.982][A[I 2026-02-28 06:44:17,990] Trial 50 finished with value: 0.9777059446949237 and parameters: {'activation': 'tanh', 'solver': 'adam', 'lr': 0.009875605439892077, 'layer1': 339, 'layer2': 345, 'layer3': 325}. Best is trial 27 with value: 0.9821048418402821.

Klebsiella_Pneumoniae | Meropenem | Optuna:  26%|██▌       | 51/200 [44:58<1:51:19, 44.83s/it, best=0.982][A
Klebsiella_Pneumoniae | Meropenem | Optuna:  26%|██▌       | 51/200 [44:58<1:51:19, 44.83s/it, best=0.982][A[I 2026-02-28 06:44:28,269] Trial 149 finished with value: 0.9205217083714112 and parameters: {'activation': 'relu', 'solver': 'adam', 'lr': 7.026790016228378e-05, 'layer1': 401, 'layer2': 203, 'layer3': 178}. Best is trial 77 with value: 0.9283869597728589.

Staphylococcus_Aureus | Fusidic acid | Optuna:  75%|███████▌  | 150/200 [4:03:37<1:25:02, 102.04s/it, best=0.928][A
Staphylococcus_Aureus | Fusidic acid | Optuna:  75%|███████▌  | 150/200 [4:03:37<1:25:02, 102.04s/it, best=0.928][A[I 2026-02-28 06:44:54,835] Trial 191 finished with value: 0.8685778449817345 and parameters: {'activation': 'identity', 'solver': 'adam', 'lr': 0.001720957184521368, 'layer1': 304, 'layer2': 305, 'layer3': 464}. Best is trial 140 with value: 0.8705750568176336.
Pseudomonas_Aeruginosa | LPS | Optuna:  96%|█████████▌| 192/200 [4:39:56<10:37, 79.66s/it, best=0.871]Pseudomonas_Aeruginosa | LPS | Optuna:  96%|█████████▌| 192/200 [4:39:56<10:37, 79.66s/it, best=0.871]/export/usuarios01/egarroyo/MALDI_for_AMR_prediction/venv/lib/python3.13/site-packages/sklearn/model_selection/_split.py:813: UserWarning: The least populated class in y has only 4 members, which is less than n_splits=5.
  warnings.warn(
[I 2026-02-28 06:44:56,357] Trial 51 finished with value: 0.9791641975099967 and parameters: {'activation': 'relu', 'solver': 'adam', 'lr': 0.0006967702170464318, 'layer1': 292, 'layer2': 296, 'layer3': 88}. Best is trial 27 with value: 0.9821048418402821.

Klebsiella_Pneumoniae | Meropenem | Optuna:  26%|██▌       | 52/200 [45:36<1:45:48, 42.89s/it, best=0.982][A
Klebsiella_Pneumoniae | Meropenem | Optuna:  26%|██▌       | 52/200 [45:36<1:45:48, 42.89s/it, best=0.982][A[I 2026-02-28 06:45:06,548] Trial 174 finished with value: 0.8959067603378277 and parameters: {'activation': 'relu', 'solver': 'adam', 'lr': 6.548577952759746e-05, 'layer1': 464, 'layer2': 127, 'layer3': 18}. Best is trial 137 with value: 0.8979080367540411.

Escherichia_Coli | Ceftriaxone | Optuna:  88%|████████▊ | 175/200 [7:35:08<1:16:35, 183.81s/it, best=0.898][A
Escherichia_Coli | Ceftriaxone | Optuna:  88%|████████▊ | 175/200 [7:35:08<1:16:35, 183.81s/it, best=0.898][A[I 2026-02-28 06:45:50,081] Trial 52 finished with value: 0.9800674743312989 and parameters: {'activation': 'relu', 'solver': 'adam', 'lr': 0.0005393192694939947, 'layer1': 324, 'layer2': 293, 'layer3': 216}. Best is trial 27 with value: 0.9821048418402821.

Klebsiella_Pneumoniae | Meropenem | Optuna:  26%|██▋       | 53/200 [46:30<1:53:02, 46.14s/it, best=0.982][A
Klebsiella_Pneumoniae | Meropenem | Optuna:  26%|██▋       | 53/200 [46:30<1:53:02, 46.14s/it, best=0.982][A[I 2026-02-28 06:46:05,914] Trial 150 finished with value: 0.9255401126474844 and parameters: {'activation': 'identity', 'solver': 'adam', 'lr': 8.467034386382286e-05, 'layer1': 460, 'layer2': 164, 'layer3': 77}. Best is trial 77 with value: 0.9283869597728589.

Staphylococcus_Aureus | Fusidic acid | Optuna:  76%|███████▌  | 151/200 [4:05:15<1:22:15, 100.72s/it, best=0.928][A
Staphylococcus_Aureus | Fusidic acid | Optuna:  76%|███████▌  | 151/200 [4:05:15<1:22:15, 100.72s/it, best=0.928][A[I 2026-02-28 06:46:40,246] Trial 53 finished with value: 0.9797865934581376 and parameters: {'activation': 'relu', 'solver': 'adam', 'lr': 0.0023066132336731905, 'layer1': 255, 'layer2': 325, 'layer3': 122}. Best is trial 27 with value: 0.9821048418402821.

Klebsiella_Pneumoniae | Meropenem | Optuna:  27%|██▋       | 54/200 [47:20<1:55:12, 47.35s/it, best=0.982][A
Klebsiella_Pneumoniae | Meropenem | Optuna:  27%|██▋       | 54/200 [47:20<1:55:12, 47.35s/it, best=0.982][A[I 2026-02-28 06:46:44,668] Trial 192 finished with value: 0.8670095318471509 and parameters: {'activation': 'identity', 'solver': 'adam', 'lr': 0.0019191717394907784, 'layer1': 306, 'layer2': 300, 'layer3': 464}. Best is trial 140 with value: 0.8705750568176336.
Pseudomonas_Aeruginosa | LPS | Optuna:  96%|█████████▋| 193/200 [4:41:46<10:20, 88.71s/it, best=0.871]Pseudomonas_Aeruginosa | LPS | Optuna:  96%|█████████▋| 193/200 [4:41:46<10:20, 88.71s/it, best=0.871]/export/usuarios01/egarroyo/MALDI_for_AMR_prediction/venv/lib/python3.13/site-packages/sklearn/model_selection/_split.py:813: UserWarning: The least populated class in y has only 4 members, which is less than n_splits=5.
  warnings.warn(
[I 2026-02-28 06:47:30,418] Trial 54 finished with value: 0.9795089102777039 and parameters: {'activation': 'relu', 'solver': 'adam', 'lr': 0.0011631473190423995, 'layer1': 479, 'layer2': 247, 'layer3': 176}. Best is trial 27 with value: 0.9821048418402821.

Klebsiella_Pneumoniae | Meropenem | Optuna:  28%|██▊       | 55/200 [48:10<1:56:28, 48.20s/it, best=0.982][A
Klebsiella_Pneumoniae | Meropenem | Optuna:  28%|██▊       | 55/200 [48:10<1:56:28, 48.20s/it, best=0.982][A[I 2026-02-28 06:47:44,224] Trial 151 finished with value: 0.9271927707748245 and parameters: {'activation': 'identity', 'solver': 'adam', 'lr': 0.00013267498742374186, 'layer1': 377, 'layer2': 125, 'layer3': 97}. Best is trial 77 with value: 0.9283869597728589.

Staphylococcus_Aureus | Fusidic acid | Optuna:  76%|███████▌  | 152/200 [4:06:53<1:20:00, 100.00s/it, best=0.928][A
Staphylococcus_Aureus | Fusidic acid | Optuna:  76%|███████▌  | 152/200 [4:06:53<1:20:00, 100.00s/it, best=0.928][A[I 2026-02-28 06:48:11,057] Trial 193 finished with value: 0.8593714145223382 and parameters: {'activation': 'identity', 'solver': 'adam', 'lr': 0.0019022499630888048, 'layer1': 300, 'layer2': 289, 'layer3': 450}. Best is trial 140 with value: 0.8705750568176336.
Pseudomonas_Aeruginosa | LPS | Optuna:  97%|█████████▋| 194/200 [4:43:13<08:48, 88.01s/it, best=0.871]Pseudomonas_Aeruginosa | LPS | Optuna:  97%|█████████▋| 194/200 [4:43:13<08:48, 88.01s/it, best=0.871][I 2026-02-28 06:48:11,082] Trial 55 finished with value: 0.9792175770098124 and parameters: {'activation': 'relu', 'solver': 'adam', 'lr': 0.0002361961721475527, 'layer1': 118, 'layer2': 203, 'layer3': 273}. Best is trial 27 with value: 0.9821048418402821.

Klebsiella_Pneumoniae | Meropenem | Optuna:  28%|██▊       | 56/200 [48:51<1:50:14, 45.94s/it, best=0.982][A
Klebsiella_Pneumoniae | Meropenem | Optuna:  28%|██▊       | 56/200 [48:51<1:50:14, 45.94s/it, best=0.982][A/export/usuarios01/egarroyo/MALDI_for_AMR_prediction/venv/lib/python3.13/site-packages/sklearn/model_selection/_split.py:813: UserWarning: The least populated class in y has only 4 members, which is less than n_splits=5.
  warnings.warn(
