Pseudomonas_Aeruginosa | Ciprofloxacin | Optuna:  93%|█████████▎| 186/200 [3:27:13<18:04, 77.49s/it, best=0.876][A[I 2026-02-27 18:14:50,486] Trial 92 finished with value: 0.9035388094283021 and parameters: {'activation': 'identity', 'solver': 'adam', 'lr': 0.00010226557016159357, 'layer1': 345, 'layer2': 396, 'layer3': 448}. Best is trial 84 with value: 0.9099428178723615.

Staphylococcus_Aureus | Oxacillin | Optuna:  46%|████▋     | 93/200 [3:27:20<4:06:04, 137.99s/it, best=0.91][A
Staphylococcus_Aureus | Oxacillin | Optuna:  46%|████▋     | 93/200 [3:27:20<4:06:04, 137.99s/it, best=0.91][A[I 2026-02-27 18:15:34,845] Trial 85 finished with value: 0.7942145229262827 and parameters: {'activation': 'tanh', 'solver': 'adam', 'lr': 0.00017000282981444696, 'layer1': 207, 'layer2': 260, 'layer3': 72}. Best is trial 55 with value: 0.8076668303114959.

Escherichia_Coli | Ciprofloxacin | Optuna:  43%|████▎     | 86/200 [3:28:04<3:18:37, 104.54s/it, best=0.808][A
Escherichia_Coli | Ciprofloxacin | Optuna:  43%|████▎     | 86/200 [3:28:04<3:18:37, 104.54s/it, best=0.808][A[I 2026-02-27 18:15:38,788] Trial 111 finished with value: 0.8291338352880077 and parameters: {'activation': 'identity', 'solver': 'adam', 'lr': 3.617345924330302e-05, 'layer1': 239, 'layer2': 490, 'layer3': 256}. Best is trial 91 with value: 0.8315336183309556.

Klebsiella_Pneumoniae | Ciprofloxacin | Optuna:  56%|█████▌    | 112/200 [3:28:08<3:04:42, 125.93s/it, best=0.832][A
Klebsiella_Pneumoniae | Ciprofloxacin | Optuna:  56%|█████▌    | 112/200 [3:28:08<3:04:42, 125.93s/it, best=0.832][A[I 2026-02-27 18:15:40,974] Trial 186 finished with value: 0.8533789429351225 and parameters: {'activation': 'identity', 'solver': 'adam', 'lr': 0.0006439290052735031, 'layer1': 298, 'layer2': 439, 'layer3': 423}. Best is trial 126 with value: 0.8764399491217574.

Pseudomonas_Aeruginosa | Ciprofloxacin | Optuna:  94%|█████████▎| 187/200 [3:28:10<15:30, 71.54s/it, best=0.876][A
Pseudomonas_Aeruginosa | Ciprofloxacin | Optuna:  94%|█████████▎| 187/200 [3:28:10<15:30, 71.54s/it, best=0.876][A[I 2026-02-27 18:16:54,696] Trial 187 finished with value: 0.873614390389986 and parameters: {'activation': 'logistic', 'solver': 'adam', 'lr': 0.00036475588779183167, 'layer1': 327, 'layer2': 397, 'layer3': 470}. Best is trial 126 with value: 0.8764399491217574.

Pseudomonas_Aeruginosa | Ciprofloxacin | Optuna:  94%|█████████▍| 188/200 [3:29:24<14:26, 72.19s/it, best=0.876][A
Pseudomonas_Aeruginosa | Ciprofloxacin | Optuna:  94%|█████████▍| 188/200 [3:29:24<14:26, 72.19s/it, best=0.876][A[I 2026-02-27 18:17:29,693] Trial 112 finished with value: 0.8089013638189021 and parameters: {'activation': 'identity', 'solver': 'adam', 'lr': 2.746803748372481e-05, 'layer1': 227, 'layer2': 487, 'layer3': 256}. Best is trial 91 with value: 0.8315336183309556.

Klebsiella_Pneumoniae | Ciprofloxacin | Optuna:  56%|█████▋    | 113/200 [3:29:59<2:56:03, 121.42s/it, best=0.832][A
Klebsiella_Pneumoniae | Ciprofloxacin | Optuna:  56%|█████▋    | 113/200 [3:29:59<2:56:03, 121.42s/it, best=0.832][A[I 2026-02-27 18:18:14,370] Trial 188 finished with value: 0.8747354545326015 and parameters: {'activation': 'logistic', 'solver': 'adam', 'lr': 0.0003165445962739643, 'layer1': 277, 'layer2': 474, 'layer3': 450}. Best is trial 126 with value: 0.8764399491217574.

Pseudomonas_Aeruginosa | Ciprofloxacin | Optuna:  94%|█████████▍| 189/200 [3:30:44<13:38, 74.44s/it, best=0.876][A
Pseudomonas_Aeruginosa | Ciprofloxacin | Optuna:  94%|█████████▍| 189/200 [3:30:44<13:38, 74.44s/it, best=0.876][A[I 2026-02-27 18:19:10,651] Trial 189 finished with value: 0.8716004011561658 and parameters: {'activation': 'logistic', 'solver': 'adam', 'lr': 0.00048772190298442577, 'layer1': 51, 'layer2': 475, 'layer3': 452}. Best is trial 126 with value: 0.8764399491217574.

Pseudomonas_Aeruginosa | Ciprofloxacin | Optuna:  95%|█████████▌| 190/200 [3:31:40<11:29, 68.99s/it, best=0.876][A
Pseudomonas_Aeruginosa | Ciprofloxacin | Optuna:  95%|█████████▌| 190/200 [3:31:40<11:29, 68.99s/it, best=0.876][A[I 2026-02-27 18:19:33,995] Trial 86 finished with value: 0.8048818580100361 and parameters: {'activation': 'tanh', 'solver': 'adam', 'lr': 1.2940900582365748e-05, 'layer1': 230, 'layer2': 191, 'layer3': 97}. Best is trial 55 with value: 0.8076668303114959.

Escherichia_Coli | Ciprofloxacin | Optuna:  44%|████▎     | 87/200 [3:32:03<4:32:56, 144.92s/it, best=0.808][A
Escherichia_Coli | Ciprofloxacin | Optuna:  44%|████▎     | 87/200 [3:32:03<4:32:56, 144.92s/it, best=0.808][A[I 2026-02-27 18:19:41,262] Trial 113 finished with value: 0.8241346352976638 and parameters: {'activation': 'identity', 'solver': 'adam', 'lr': 3.481606847723025e-05, 'layer1': 212, 'layer2': 476, 'layer3': 305}. Best is trial 91 with value: 0.8315336183309556.

Klebsiella_Pneumoniae | Ciprofloxacin | Optuna:  57%|█████▋    | 114/200 [3:32:10<2:58:24, 124.47s/it, best=0.832][A
Klebsiella_Pneumoniae | Ciprofloxacin | Optuna:  57%|█████▋    | 114/200 [3:32:10<2:58:24, 124.47s/it, best=0.832][A[I 2026-02-27 18:20:22,415] Trial 93 finished with value: 0.8835630374500006 and parameters: {'activation': 'identity', 'solver': 'adam', 'lr': 3.013779041432989e-06, 'layer1': 271, 'layer2': 420, 'layer3': 406}. Best is trial 84 with value: 0.9099428178723615.

Staphylococcus_Aureus | Oxacillin | Optuna:  47%|████▋     | 94/200 [3:32:52<5:46:34, 196.17s/it, best=0.91][A
Staphylococcus_Aureus | Oxacillin | Optuna:  47%|████▋     | 94/200 [3:32:52<5:46:34, 196.17s/it, best=0.91][A[I 2026-02-27 18:20:46,341] Trial 190 finished with value: 0.8732873706451081 and parameters: {'activation': 'logistic', 'solver': 'adam', 'lr': 0.00022267682811617643, 'layer1': 263, 'layer2': 490, 'layer3': 435}. Best is trial 126 with value: 0.8764399491217574.

Pseudomonas_Aeruginosa | Ciprofloxacin | Optuna:  96%|█████████▌| 191/200 [3:33:16<11:33, 77.00s/it, best=0.876][A
Pseudomonas_Aeruginosa | Ciprofloxacin | Optuna:  96%|█████████▌| 191/200 [3:33:16<11:33, 77.00s/it, best=0.876][A[I 2026-02-27 18:21:06,793] Trial 87 finished with value: 0.5320352637334032 and parameters: {'activation': 'tanh', 'solver': 'sgd', 'lr': 5.582785431334152e-05, 'layer1': 106, 'layer2': 223, 'layer3': 36}. Best is trial 55 with value: 0.8076668303114959.

Escherichia_Coli | Ciprofloxacin | Optuna:  44%|████▍     | 88/200 [3:33:36<4:01:20, 129.29s/it, best=0.808][A
Escherichia_Coli | Ciprofloxacin | Optuna:  44%|████▍     | 88/200 [3:33:36<4:01:20, 129.29s/it, best=0.808][A[I 2026-02-27 18:21:18,284] Trial 114 finished with value: 0.824463446028869 and parameters: {'activation': 'identity', 'solver': 'adam', 'lr': 0.0006664328549901353, 'layer1': 239, 'layer2': 442, 'layer3': 212}. Best is trial 91 with value: 0.8315336183309556.

Klebsiella_Pneumoniae | Ciprofloxacin | Optuna:  57%|█████▊    | 115/200 [3:33:47<2:44:39, 116.23s/it, best=0.832][A
Klebsiella_Pneumoniae | Ciprofloxacin | Optuna:  57%|█████▊    | 115/200 [3:33:47<2:44:39, 116.23s/it, best=0.832][A[I 2026-02-27 18:22:03,343] Trial 191 finished with value: 0.8736221398475725 and parameters: {'activation': 'logistic', 'solver': 'adam', 'lr': 0.00029995991187786454, 'layer1': 279, 'layer2': 472, 'layer3': 444}. Best is trial 126 with value: 0.8764399491217574.

Pseudomonas_Aeruginosa | Ciprofloxacin | Optuna:  96%|█████████▌| 192/200 [3:34:33<10:16, 77.00s/it, best=0.876][A
Pseudomonas_Aeruginosa | Ciprofloxacin | Optuna:  96%|█████████▌| 192/200 [3:34:33<10:16, 77.00s/it, best=0.876][A[I 2026-02-27 18:22:20,379] Trial 94 finished with value: 0.9021857171095174 and parameters: {'activation': 'identity', 'solver': 'adam', 'lr': 6.776608063540737e-05, 'layer1': 242, 'layer2': 470, 'layer3': 263}. Best is trial 84 with value: 0.9099428178723615.

Staphylococcus_Aureus | Oxacillin | Optuna:  48%|████▊     | 95/200 [3:34:50<5:02:14, 172.71s/it, best=0.91][A
Staphylococcus_Aureus | Oxacillin | Optuna:  48%|████▊     | 95/200 [3:34:50<5:02:14, 172.71s/it, best=0.91][A[I 2026-02-27 18:22:35,488] Trial 88 finished with value: 0.8024097091234038 and parameters: {'activation': 'tanh', 'solver': 'adam', 'lr': 9.775560194143324e-05, 'layer1': 163, 'layer2': 244, 'layer3': 57}. Best is trial 55 with value: 0.8076668303114959.

Escherichia_Coli | Ciprofloxacin | Optuna:  44%|████▍     | 89/200 [3:35:04<3:36:39, 117.11s/it, best=0.808][A
Escherichia_Coli | Ciprofloxacin | Optuna:  44%|████▍     | 89/200 [3:35:04<3:36:39, 117.11s/it, best=0.808][A[I 2026-02-27 18:23:19,923] Trial 192 finished with value: 0.8738656755793837 and parameters: {'activation': 'logistic', 'solver': 'adam', 'lr': 0.00033850229086291944, 'layer1': 290, 'layer2': 52, 'layer3': 423}. Best is trial 126 with value: 0.8764399491217574.

Pseudomonas_Aeruginosa | Ciprofloxacin | Optuna:  96%|█████████▋| 193/200 [3:35:49<08:58, 76.87s/it, best=0.876][A
Pseudomonas_Aeruginosa | Ciprofloxacin | Optuna:  96%|█████████▋| 193/200 [3:35:49<08:58, 76.87s/it, best=0.876][A[I 2026-02-27 18:23:23,773] Trial 115 finished with value: 0.8230174469019766 and parameters: {'activation': 'identity', 'solver': 'adam', 'lr': 7.073970689808884e-05, 'layer1': 257, 'layer2': 427, 'layer3': 231}. Best is trial 91 with value: 0.8315336183309556.

Klebsiella_Pneumoniae | Ciprofloxacin | Optuna:  58%|█████▊    | 116/200 [3:35:53<2:46:36, 119.01s/it, best=0.832][A
Klebsiella_Pneumoniae | Ciprofloxacin | Optuna:  58%|█████▊    | 116/200 [3:35:53<2:46:36, 119.01s/it, best=0.832][A[I 2026-02-27 18:23:57,442] Trial 116 finished with value: 0.7417840809323848 and parameters: {'activation': 'logistic', 'solver': 'adam', 'lr': 5.0340996603096844e-05, 'layer1': 347, 'layer2': 452, 'layer3': 184}. Best is trial 91 with value: 0.8315336183309556.

Klebsiella_Pneumoniae | Ciprofloxacin | Optuna:  58%|█████▊    | 117/200 [3:36:27<2:09:12, 93.41s/it, best=0.832] [A
Klebsiella_Pneumoniae | Ciprofloxacin | Optuna:  58%|█████▊    | 117/200 [3:36:27<2:09:12, 93.41s/it, best=0.832][A[I 2026-02-27 18:24:11,039] Trial 95 finished with value: 0.9063143606091923 and parameters: {'activation': 'identity', 'solver': 'adam', 'lr': 0.00012316651876927655, 'layer1': 258, 'layer2': 444, 'layer3': 374}. Best is trial 84 with value: 0.9099428178723615.

Staphylococcus_Aureus | Oxacillin | Optuna:  48%|████▊     | 96/200 [3:36:40<4:27:05, 154.09s/it, best=0.91][A
Staphylococcus_Aureus | Oxacillin | Optuna:  48%|████▊     | 96/200 [3:36:40<4:27:05, 154.09s/it, best=0.91][A[I 2026-02-27 18:24:43,306] Trial 193 finished with value: 0.875370299341456 and parameters: {'activation': 'logistic', 'solver': 'adam', 'lr': 0.00026047683565008905, 'layer1': 255, 'layer2': 466, 'layer3': 409}. Best is trial 126 with value: 0.8764399491217574.

Pseudomonas_Aeruginosa | Ciprofloxacin | Optuna:  97%|█████████▋| 194/200 [3:37:12<07:52, 78.83s/it, best=0.876][A
Pseudomonas_Aeruginosa | Ciprofloxacin | Optuna:  97%|█████████▋| 194/200 [3:37:12<07:52, 78.83s/it, best=0.876][A[I 2026-02-27 18:24:59,443] Trial 89 finished with value: 0.8076365345089455 and parameters: {'activation': 'tanh', 'solver': 'adam', 'lr': 3.1436934605990955e-05, 'layer1': 194, 'layer2': 253, 'layer3': 79}. Best is trial 55 with value: 0.8076668303114959.

Escherichia_Coli | Ciprofloxacin | Optuna:  45%|████▌     | 90/200 [3:37:28<3:49:27, 125.16s/it, best=0.808][A
Escherichia_Coli | Ciprofloxacin | Optuna:  45%|████▌     | 90/200 [3:37:28<3:49:27, 125.16s/it, best=0.808][A[I 2026-02-27 18:26:02,442] Trial 96 finished with value: 0.9066462811045165 and parameters: {'activation': 'identity', 'solver': 'adam', 'lr': 0.0009463520067261713, 'layer1': 287, 'layer2': 478, 'layer3': 464}. Best is trial 84 with value: 0.9099428178723615.

Staphylococcus_Aureus | Oxacillin | Optuna:  48%|████▊     | 97/200 [3:38:32<4:02:32, 141.29s/it, best=0.91][A
Staphylococcus_Aureus | Oxacillin | Optuna:  48%|████▊     | 97/200 [3:38:32<4:02:32, 141.29s/it, best=0.91][A[I 2026-02-27 18:26:09,439] Trial 194 finished with value: 0.872300819143663 and parameters: {'activation': 'logistic', 'solver': 'adam', 'lr': 0.00017930573070122952, 'layer1': 256, 'layer2': 427, 'layer3': 462}. Best is trial 126 with value: 0.8764399491217574.

Pseudomonas_Aeruginosa | Ciprofloxacin | Optuna:  98%|█████████▊| 195/200 [3:38:39<06:45, 81.02s/it, best=0.876][A
Pseudomonas_Aeruginosa | Ciprofloxacin | Optuna:  98%|█████████▊| 195/200 [3:38:39<06:45, 81.02s/it, best=0.876][A[I 2026-02-27 18:26:43,092] Trial 117 finished with value: 0.8249504789015203 and parameters: {'activation': 'identity', 'solver': 'adam', 'lr': 0.00010038063327207128, 'layer1': 454, 'layer2': 397, 'layer3': 293}. Best is trial 91 with value: 0.8315336183309556.

Klebsiella_Pneumoniae | Ciprofloxacin | Optuna:  59%|█████▉    | 118/200 [3:39:12<2:37:16, 115.08s/it, best=0.832][A
Klebsiella_Pneumoniae | Ciprofloxacin | Optuna:  59%|█████▉    | 118/200 [3:39:12<2:37:16, 115.08s/it, best=0.832][A[I 2026-02-27 18:27:01,083] Trial 97 finished with value: 0.7185662903291514 and parameters: {'activation': 'identity', 'solver': 'sgd', 'lr': 0.00018219048616399593, 'layer1': 333, 'layer2': 377, 'layer3': 422}. Best is trial 84 with value: 0.9099428178723615.

Staphylococcus_Aureus | Oxacillin | Optuna:  49%|████▉     | 98/200 [3:39:30<3:18:02, 116.49s/it, best=0.91][A
Staphylococcus_Aureus | Oxacillin | Optuna:  49%|████▉     | 98/200 [3:39:30<3:18:02, 116.49s/it, best=0.91][A[I 2026-02-27 18:27:32,722] Trial 90 finished with value: 0.8047826158733085 and parameters: {'activation': 'tanh', 'solver': 'adam', 'lr': 2.908381944552416e-05, 'layer1': 223, 'layer2': 255, 'layer3': 84}. Best is trial 55 with value: 0.8076668303114959.

Escherichia_Coli | Ciprofloxacin | Optuna:  46%|████▌     | 91/200 [3:40:02<4:02:42, 133.60s/it, best=0.808][A
Escherichia_Coli | Ciprofloxacin | Optuna:  46%|████▌     | 91/200 [3:40:02<4:02:42, 133.60s/it, best=0.808][A[I 2026-02-27 18:27:46,812] Trial 195 finished with value: 0.8728755790235793 and parameters: {'activation': 'logistic', 'solver': 'adam', 'lr': 0.0002568277722803458, 'layer1': 267, 'layer2': 470, 'layer3': 402}. Best is trial 126 with value: 0.8764399491217574.

Pseudomonas_Aeruginosa | Ciprofloxacin | Optuna:  98%|█████████▊| 196/200 [3:40:16<05:43, 85.93s/it, best=0.876][A
Pseudomonas_Aeruginosa | Ciprofloxacin | Optuna:  98%|█████████▊| 196/200 [3:40:16<05:43, 85.93s/it, best=0.876][A[I 2026-02-27 18:29:01,334] Trial 118 finished with value: 0.8138562343929037 and parameters: {'activation': 'identity', 'solver': 'adam', 'lr': 1.664562832971716e-05, 'layer1': 423, 'layer2': 163, 'layer3': 274}. Best is trial 91 with value: 0.8315336183309556.

Klebsiella_Pneumoniae | Ciprofloxacin | Optuna:  60%|█████▉    | 119/200 [3:41:30<2:44:44, 122.03s/it, best=0.832][A
Klebsiella_Pneumoniae | Ciprofloxacin | Optuna:  60%|█████▉    | 119/200 [3:41:30<2:44:44, 122.03s/it, best=0.832][A[I 2026-02-27 18:29:10,342] Trial 196 finished with value: 0.8649806085820494 and parameters: {'activation': 'logistic', 'solver': 'adam', 'lr': 0.0001453266440698579, 'layer1': 247, 'layer2': 447, 'layer3': 434}. Best is trial 126 with value: 0.8764399491217574.

Pseudomonas_Aeruginosa | Ciprofloxacin | Optuna:  98%|█████████▊| 197/200 [3:41:40<04:15, 85.21s/it, best=0.876][A
Pseudomonas_Aeruginosa | Ciprofloxacin | Optuna:  98%|█████████▊| 197/200 [3:41:40<04:15, 85.21s/it, best=0.876][A[I 2026-02-27 18:29:34,031] Trial 98 finished with value: 0.9084684381365346 and parameters: {'activation': 'identity', 'solver': 'adam', 'lr': 8.426988195855304e-05, 'layer1': 222, 'layer2': 360, 'layer3': 480}. Best is trial 84 with value: 0.9099428178723615.

Staphylococcus_Aureus | Oxacillin | Optuna:  50%|████▉     | 99/200 [3:42:03<3:34:30, 127.43s/it, best=0.91][A
Staphylococcus_Aureus | Oxacillin | Optuna:  50%|████▉     | 99/200 [3:42:03<3:34:30, 127.43s/it, best=0.91][A[I 2026-02-27 18:30:00,501] Trial 91 finished with value: 0.8028631285426467 and parameters: {'activation': 'tanh', 'solver': 'adam', 'lr': 3.904942189644952e-05, 'layer1': 195, 'layer2': 267, 'layer3': 123}. Best is trial 55 with value: 0.8076668303114959.

Escherichia_Coli | Ciprofloxacin | Optuna:  46%|████▌     | 92/200 [3:42:29<4:08:08, 137.85s/it, best=0.808][A
Escherichia_Coli | Ciprofloxacin | Optuna:  46%|████▌     | 92/200 [3:42:29<4:08:08, 137.85s/it, best=0.808][A[I 2026-02-27 18:30:16,393] Trial 197 finished with value: 0.8723298424978694 and parameters: {'activation': 'logistic', 'solver': 'adam', 'lr': 0.0004394716200494284, 'layer1': 129, 'layer2': 479, 'layer3': 454}. Best is trial 126 with value: 0.8764399491217574.

Pseudomonas_Aeruginosa | Ciprofloxacin | Optuna:  99%|█████████▉| 198/200 [3:42:46<02:38, 79.46s/it, best=0.876][A
Pseudomonas_Aeruginosa | Ciprofloxacin | Optuna:  99%|█████████▉| 198/200 [3:42:46<02:38, 79.46s/it, best=0.876][A[I 2026-02-27 18:30:48,530] Trial 99 finished with value: 0.9009949660833632 and parameters: {'activation': 'tanh', 'solver': 'adam', 'lr': 0.0006086567002144078, 'layer1': 309, 'layer2': 407, 'layer3': 447}. Best is trial 84 with value: 0.9099428178723615.

Staphylococcus_Aureus | Oxacillin | Optuna:  50%|█████     | 100/200 [3:43:18<3:05:55, 111.55s/it, best=0.91][A
Staphylococcus_Aureus | Oxacillin | Optuna:  50%|█████     | 100/200 [3:43:18<3:05:55, 111.55s/it, best=0.91][A[I 2026-02-27 18:31:25,021] Trial 198 finished with value: 0.8716895956114048 and parameters: {'activation': 'logistic', 'solver': 'adam', 'lr': 0.0002197569620202561, 'layer1': 236, 'layer2': 163, 'layer3': 472}. Best is trial 126 with value: 0.8764399491217574.

Pseudomonas_Aeruginosa | Ciprofloxacin | Optuna: 100%|█████████▉| 199/200 [3:43:54<01:16, 76.21s/it, best=0.876][A
Pseudomonas_Aeruginosa | Ciprofloxacin | Optuna: 100%|█████████▉| 199/200 [3:43:54<01:16, 76.21s/it, best=0.876][A[I 2026-02-27 18:31:48,137] Trial 199 finished with value: 0.8159756916186209 and parameters: {'activation': 'logistic', 'solver': 'sgd', 'lr': 0.00026969243801711095, 'layer1': 395, 'layer2': 421, 'layer3': 429}. Best is trial 126 with value: 0.8764399491217574.

Pseudomonas_Aeruginosa | Ciprofloxacin | Optuna: 100%|██████████| 200/200 [3:44:17<00:00, 60.28s/it, best=0.876][A
Pseudomonas_Aeruginosa | Ciprofloxacin | Optuna: 100%|██████████| 200/200 [3:44:17<00:00, 60.28s/it, best=0.876][A
                                                                                                                [A[Pseudomonas_Aeruginosa | Ciprofloxacin] [OPTUNA DONE] Best CV WF1=0.8764 | params={'activation': 'logistic', 'solver': 'adam', 'lr': 0.00038783005292880547, 'layer1': 435, 'layer2': 148, 'layer3': 404}
[Pseudomonas_Aeruginosa | Ciprofloxacin] Retraining with validation early stopping (10% split)...
[Pseudomonas_Aeruginosa | Ciprofloxacin] [TEST] WF1=0.8351 | ACC=0.8543 | HL=0.1457 | best_val_WF1=0.8544
Pseudomonas_Aeruginosa | Binary antibiotics:  33%|███▎      | 1/3 [3:44:35<7:29:10, 13475.46s/it]
[Pseudomonas_Aeruginosa | Imipenem] Optuna search starting... (trials=200, cv=5)
[I 2026-02-27 18:32:05,776] A new study created in memory with name: no-name-62303b67-9452-4cac-a53c-8d8d3505c081

Pseudomonas_Aeruginosa | Imipenem | Optuna:   0%|          | 0/200 [00:00<?, ?it/s][A[I 2026-02-27 18:32:18,301] Trial 119 finished with value: 0.7526755920737829 and parameters: {'activation': 'identity', 'solver': 'sgd', 'lr': 4.1731248839494004e-05, 'layer1': 404, 'layer2': 463, 'layer3': 94}. Best is trial 91 with value: 0.8315336183309556.

Klebsiella_Pneumoniae | Ciprofloxacin | Optuna:  60%|██████    | 120/200 [3:44:47<3:12:40, 144.51s/it, best=0.832][A
Klebsiella_Pneumoniae | Ciprofloxacin | Optuna:  60%|██████    | 120/200 [3:44:47<3:12:40, 144.51s/it, best=0.832][A[I 2026-02-27 18:32:30,159] Trial 0 finished with value: 0.6599503093530644 and parameters: {'activation': 'logistic', 'solver': 'sgd', 'lr': 1.7073967431528114e-06, 'layer1': 435, 'layer2': 305, 'layer3': 357}. Best is trial 0 with value: 0.6599503093530644.

Pseudomonas_Aeruginosa | Imipenem | Optuna:   0%|          | 1/200 [00:24<1:20:51, 24.38s/it][A
Pseudomonas_Aeruginosa | Imipenem | Optuna:   0%|          | 1/200 [00:24<1:20:51, 24.38s/it, best=0.66][A[I 2026-02-27 18:32:54,155] Trial 1 finished with value: 0.8175565662034809 and parameters: {'activation': 'logistic', 'solver': 'adam', 'lr': 1.6480446427978994e-05, 'layer1': 267, 'layer2': 222, 'layer3': 152}. Best is trial 1 with value: 0.8175565662034809.

Pseudomonas_Aeruginosa | Imipenem | Optuna:   1%|          | 2/200 [00:48<1:19:42, 24.15s/it, best=0.66][A
Pseudomonas_Aeruginosa | Imipenem | Optuna:   1%|          | 2/200 [00:48<1:19:42, 24.15s/it, best=0.818][A[I 2026-02-27 18:32:56,652] Trial 92 finished with value: 0.8065816040728471 and parameters: {'activation': 'tanh', 'solver': 'adam', 'lr': 1.9509064928338208e-05, 'layer1': 173, 'layer2': 232, 'layer3': 27}. Best is trial 55 with value: 0.8076668303114959.

Escherichia_Coli | Ciprofloxacin | Optuna:  46%|████▋     | 93/200 [3:45:26<4:26:19, 149.34s/it, best=0.808][A
Escherichia_Coli | Ciprofloxacin | Optuna:  46%|████▋     | 93/200 [3:45:26<4:26:19, 149.34s/it, best=0.808][A[I 2026-02-27 18:33:05,514] Trial 100 finished with value: 0.902365774812588 and parameters: {'activation': 'identity', 'solver': 'adam', 'lr': 3.1247064621758175e-05, 'layer1': 361, 'layer2': 424, 'layer3': 414}. Best is trial 84 with value: 0.9099428178723615.

Staphylococcus_Aureus | Oxacillin | Optuna:  50%|█████     | 101/200 [3:45:35<3:16:38, 119.18s/it, best=0.91][A
