Staphylococcus_Aureus | Fusidic acid | Optuna:  41%|████      | 82/200 [2:18:32<3:29:59, 106.78s/it, best=0.928][A[I 2026-02-28 04:59:29,553] Trial 116 finished with value: 0.9800270054346416 and parameters: {'activation': 'relu', 'solver': 'sgd', 'lr': 0.003188632227895076, 'layer1': 484, 'layer2': 219, 'layer3': 478}. Best is trial 13 with value: 0.9860492846658779.

Klebsiella_Pneumoniae | Imipenem | Optuna:  58%|█████▊    | 117/200 [1:30:42<54:45, 39.58s/it, best=0.986]  [A
Klebsiella_Pneumoniae | Imipenem | Optuna:  58%|█████▊    | 117/200 [1:30:42<54:45, 39.58s/it, best=0.986][A[I 2026-02-28 04:59:54,787] Trial 119 finished with value: 0.8636144851637558 and parameters: {'activation': 'identity', 'solver': 'adam', 'lr': 0.0019039253941753693, 'layer1': 29, 'layer2': 479, 'layer3': 500}. Best is trial 63 with value: 0.8682133709784562.
Pseudomonas_Aeruginosa | LPS | Optuna:  60%|██████    | 120/200 [2:54:56<1:22:32, 61.91s/it, best=0.868]Pseudomonas_Aeruginosa | LPS | Optuna:  60%|██████    | 120/200 [2:54:56<1:22:32, 61.91s/it, best=0.868]/export/usuarios01/egarroyo/MALDI_for_AMR_prediction/venv/lib/python3.13/site-packages/sklearn/model_selection/_split.py:813: UserWarning: The least populated class in y has only 4 members, which is less than n_splits=5.
  warnings.warn(
[I 2026-02-28 05:00:01,126] Trial 117 finished with value: 0.9833208503101094 and parameters: {'activation': 'identity', 'solver': 'adam', 'lr': 0.0018719954485350208, 'layer1': 135, 'layer2': 133, 'layer3': 366}. Best is trial 13 with value: 0.9860492846658779.

Klebsiella_Pneumoniae | Imipenem | Optuna:  59%|█████▉    | 118/200 [1:31:13<50:48, 37.18s/it, best=0.986][A
Klebsiella_Pneumoniae | Imipenem | Optuna:  59%|█████▉    | 118/200 [1:31:13<50:48, 37.18s/it, best=0.986][A[I 2026-02-28 05:00:43,676] Trial 82 finished with value: 0.9210914050257604 and parameters: {'activation': 'identity', 'solver': 'adam', 'lr': 3.7024936144699584e-05, 'layer1': 287, 'layer2': 73, 'layer3': 227}. Best is trial 77 with value: 0.9283869597728589.

Staphylococcus_Aureus | Fusidic acid | Optuna:  42%|████▏     | 83/200 [2:19:52<3:12:34, 98.75s/it, best=0.928] [A
Staphylococcus_Aureus | Fusidic acid | Optuna:  42%|████▏     | 83/200 [2:19:52<3:12:34, 98.75s/it, best=0.928][A[I 2026-02-28 05:00:58,040] Trial 118 finished with value: 0.9840318204139595 and parameters: {'activation': 'relu', 'solver': 'adam', 'lr': 0.0023830609330418406, 'layer1': 391, 'layer2': 268, 'layer3': 414}. Best is trial 13 with value: 0.9860492846658779.

Klebsiella_Pneumoniae | Imipenem | Optuna:  60%|█████▉    | 119/200 [1:32:10<58:11, 43.10s/it, best=0.986][A
Klebsiella_Pneumoniae | Imipenem | Optuna:  60%|█████▉    | 119/200 [1:32:10<58:11, 43.10s/it, best=0.986][A[I 2026-02-28 05:01:07,774] Trial 120 finished with value: 0.8618129081688526 and parameters: {'activation': 'identity', 'solver': 'adam', 'lr': 0.0005645972638060542, 'layer1': 39, 'layer2': 491, 'layer3': 446}. Best is trial 63 with value: 0.8682133709784562.
Pseudomonas_Aeruginosa | LPS | Optuna:  60%|██████    | 121/200 [2:56:09<1:25:53, 65.23s/it, best=0.868]Pseudomonas_Aeruginosa | LPS | Optuna:  60%|██████    | 121/200 [2:56:09<1:25:53, 65.23s/it, best=0.868]/export/usuarios01/egarroyo/MALDI_for_AMR_prediction/venv/lib/python3.13/site-packages/sklearn/model_selection/_split.py:813: UserWarning: The least populated class in y has only 4 members, which is less than n_splits=5.
  warnings.warn(
[I 2026-02-28 05:01:11,190] Trial 138 finished with value: 0.5860518482349739 and parameters: {'activation': 'relu', 'solver': 'sgd', 'lr': 3.931939447599117e-05, 'layer1': 450, 'layer2': 343, 'layer3': 24}. Best is trial 137 with value: 0.8979080367540411.

Escherichia_Coli | Ceftriaxone | Optuna:  70%|██████▉   | 139/200 [5:51:12<2:57:45, 174.85s/it, best=0.898][A
Escherichia_Coli | Ceftriaxone | Optuna:  70%|██████▉   | 139/200 [5:51:12<2:57:45, 174.85s/it, best=0.898][A[I 2026-02-28 05:01:47,732] Trial 119 finished with value: 0.983637081256328 and parameters: {'activation': 'relu', 'solver': 'adam', 'lr': 0.0014623075201361101, 'layer1': 444, 'layer2': 146, 'layer3': 289}. Best is trial 13 with value: 0.9860492846658779.

Klebsiella_Pneumoniae | Imipenem | Optuna:  60%|██████    | 120/200 [1:33:00<1:00:06, 45.08s/it, best=0.986][A
Klebsiella_Pneumoniae | Imipenem | Optuna:  60%|██████    | 120/200 [1:33:00<1:00:06, 45.08s/it, best=0.986][A[I 2026-02-28 05:02:12,626] Trial 121 finished with value: 0.8639538821285768 and parameters: {'activation': 'identity', 'solver': 'adam', 'lr': 0.0008315755931824684, 'layer1': 48, 'layer2': 344, 'layer3': 469}. Best is trial 63 with value: 0.8682133709784562.
Pseudomonas_Aeruginosa | LPS | Optuna:  61%|██████    | 122/200 [2:57:14<1:24:39, 65.12s/it, best=0.868]Pseudomonas_Aeruginosa | LPS | Optuna:  61%|██████    | 122/200 [2:57:14<1:24:39, 65.12s/it, best=0.868]/export/usuarios01/egarroyo/MALDI_for_AMR_prediction/venv/lib/python3.13/site-packages/sklearn/model_selection/_split.py:813: UserWarning: The least populated class in y has only 4 members, which is less than n_splits=5.
  warnings.warn(
[I 2026-02-28 05:02:15,715] Trial 83 finished with value: 0.9269166318444606 and parameters: {'activation': 'identity', 'solver': 'adam', 'lr': 6.912608946959679e-05, 'layer1': 275, 'layer2': 57, 'layer3': 181}. Best is trial 77 with value: 0.9283869597728589.

Staphylococcus_Aureus | Fusidic acid | Optuna:  42%|████▏     | 84/200 [2:21:24<3:07:01, 96.74s/it, best=0.928][A
Staphylococcus_Aureus | Fusidic acid | Optuna:  42%|████▏     | 84/200 [2:21:24<3:07:01, 96.74s/it, best=0.928][A[I 2026-02-28 05:02:25,385] Trial 120 finished with value: 0.9800270054346416 and parameters: {'activation': 'relu', 'solver': 'adam', 'lr': 2.711595994363398e-06, 'layer1': 158, 'layer2': 234, 'layer3': 245}. Best is trial 13 with value: 0.9860492846658779.

Klebsiella_Pneumoniae | Imipenem | Optuna:  60%|██████    | 121/200 [1:33:37<56:25, 42.85s/it, best=0.986]  [A
Klebsiella_Pneumoniae | Imipenem | Optuna:  60%|██████    | 121/200 [1:33:37<56:25, 42.85s/it, best=0.986][A[I 2026-02-28 05:03:03,813] Trial 121 finished with value: 0.9844069875569661 and parameters: {'activation': 'relu', 'solver': 'adam', 'lr': 0.0011450010067654457, 'layer1': 65, 'layer2': 117, 'layer3': 451}. Best is trial 13 with value: 0.9860492846658779.

Klebsiella_Pneumoniae | Imipenem | Optuna:  61%|██████    | 122/200 [1:34:16<53:58, 41.52s/it, best=0.986][A
Klebsiella_Pneumoniae | Imipenem | Optuna:  61%|██████    | 122/200 [1:34:16<53:58, 41.52s/it, best=0.986][A[I 2026-02-28 05:03:12,912] Trial 122 finished with value: 0.8632295041313208 and parameters: {'activation': 'identity', 'solver': 'adam', 'lr': 0.0011036655568987422, 'layer1': 12, 'layer2': 332, 'layer3': 438}. Best is trial 63 with value: 0.8682133709784562.
Pseudomonas_Aeruginosa | LPS | Optuna:  62%|██████▏   | 123/200 [2:58:14<1:21:42, 63.67s/it, best=0.868]Pseudomonas_Aeruginosa | LPS | Optuna:  62%|██████▏   | 123/200 [2:58:14<1:21:42, 63.67s/it, best=0.868]/export/usuarios01/egarroyo/MALDI_for_AMR_prediction/venv/lib/python3.13/site-packages/sklearn/model_selection/_split.py:813: UserWarning: The least populated class in y has only 4 members, which is less than n_splits=5.
  warnings.warn(
[I 2026-02-28 05:03:39,508] Trial 122 finished with value: 0.983714117942917 and parameters: {'activation': 'relu', 'solver': 'adam', 'lr': 0.0009578403129495465, 'layer1': 68, 'layer2': 86, 'layer3': 492}. Best is trial 13 with value: 0.9860492846658779.

Klebsiella_Pneumoniae | Imipenem | Optuna:  62%|██████▏   | 123/200 [1:34:52<51:02, 39.77s/it, best=0.986][A
Klebsiella_Pneumoniae | Imipenem | Optuna:  62%|██████▏   | 123/200 [1:34:52<51:02, 39.77s/it, best=0.986][A[I 2026-02-28 05:03:45,611] Trial 84 finished with value: 0.9265082697959397 and parameters: {'activation': 'identity', 'solver': 'adam', 'lr': 0.00016986610885179419, 'layer1': 343, 'layer2': 90, 'layer3': 157}. Best is trial 77 with value: 0.9283869597728589.

Staphylococcus_Aureus | Fusidic acid | Optuna:  42%|████▎     | 85/200 [2:22:54<3:01:28, 94.69s/it, best=0.928][A
Staphylococcus_Aureus | Fusidic acid | Optuna:  42%|████▎     | 85/200 [2:22:54<3:01:28, 94.69s/it, best=0.928][A[I 2026-02-28 05:04:09,828] Trial 123 finished with value: 0.9800270054346416 and parameters: {'activation': 'relu', 'solver': 'adam', 'lr': 7.254179081171521e-05, 'layer1': 287, 'layer2': 114, 'layer3': 393}. Best is trial 13 with value: 0.9860492846658779.

Klebsiella_Pneumoniae | Imipenem | Optuna:  62%|██████▏   | 124/200 [1:35:22<46:47, 36.94s/it, best=0.986][A
Klebsiella_Pneumoniae | Imipenem | Optuna:  62%|██████▏   | 124/200 [1:35:22<46:47, 36.94s/it, best=0.986][A[I 2026-02-28 05:04:55,611] Trial 139 finished with value: 0.8941596984699377 and parameters: {'activation': 'relu', 'solver': 'adam', 'lr': 4.8240260612036806e-05, 'layer1': 422, 'layer2': 338, 'layer3': 10}. Best is trial 137 with value: 0.8979080367540411.

Escherichia_Coli | Ceftriaxone | Optuna:  70%|███████   | 140/200 [5:54:57<3:09:43, 189.72s/it, best=0.898][A
Escherichia_Coli | Ceftriaxone | Optuna:  70%|███████   | 140/200 [5:54:57<3:09:43, 189.72s/it, best=0.898][A[I 2026-02-28 05:05:19,858] Trial 85 finished with value: 0.9278772786795748 and parameters: {'activation': 'identity', 'solver': 'adam', 'lr': 0.00011506762507452171, 'layer1': 252, 'layer2': 106, 'layer3': 141}. Best is trial 77 with value: 0.9283869597728589.

Staphylococcus_Aureus | Fusidic acid | Optuna:  43%|████▎     | 86/200 [2:24:29<2:59:39, 94.55s/it, best=0.928][A
Staphylococcus_Aureus | Fusidic acid | Optuna:  43%|████▎     | 86/200 [2:24:29<2:59:39, 94.55s/it, best=0.928][A[I 2026-02-28 05:05:20,487] Trial 124 finished with value: 0.9850128124408192 and parameters: {'activation': 'relu', 'solver': 'adam', 'lr': 0.0005975307093638801, 'layer1': 366, 'layer2': 350, 'layer3': 456}. Best is trial 13 with value: 0.9860492846658779.

Klebsiella_Pneumoniae | Imipenem | Optuna:  62%|██████▎   | 125/200 [1:36:33<58:49, 47.05s/it, best=0.986][A
Klebsiella_Pneumoniae | Imipenem | Optuna:  62%|██████▎   | 125/200 [1:36:33<58:49, 47.05s/it, best=0.986][A[I 2026-02-28 05:05:27,866] Trial 123 finished with value: 0.8617818105778825 and parameters: {'activation': 'identity', 'solver': 'adam', 'lr': 7.122425704553009e-05, 'layer1': 414, 'layer2': 470, 'layer3': 427}. Best is trial 63 with value: 0.8682133709784562.
Pseudomonas_Aeruginosa | LPS | Optuna:  62%|██████▏   | 124/200 [3:00:29<1:47:44, 85.05s/it, best=0.868]Pseudomonas_Aeruginosa | LPS | Optuna:  62%|██████▏   | 124/200 [3:00:29<1:47:44, 85.05s/it, best=0.868]/export/usuarios01/egarroyo/MALDI_for_AMR_prediction/venv/lib/python3.13/site-packages/sklearn/model_selection/_split.py:813: UserWarning: The least populated class in y has only 4 members, which is less than n_splits=5.
  warnings.warn(
[I 2026-02-28 05:06:25,587] Trial 125 finished with value: 0.9847453546903043 and parameters: {'activation': 'relu', 'solver': 'adam', 'lr': 0.0006913257420548653, 'layer1': 374, 'layer2': 299, 'layer3': 443}. Best is trial 13 with value: 0.9860492846658779.

Klebsiella_Pneumoniae | Imipenem | Optuna:  63%|██████▎   | 126/200 [1:37:38<1:04:42, 52.47s/it, best=0.986][A
Klebsiella_Pneumoniae | Imipenem | Optuna:  63%|██████▎   | 126/200 [1:37:38<1:04:42, 52.47s/it, best=0.986][A[I 2026-02-28 05:06:51,946] Trial 86 finished with value: 0.9256307247436066 and parameters: {'activation': 'identity', 'solver': 'adam', 'lr': 5.655660516865962e-05, 'layer1': 302, 'layer2': 104, 'layer3': 218}. Best is trial 77 with value: 0.9283869597728589.

Staphylococcus_Aureus | Fusidic acid | Optuna:  44%|████▎     | 87/200 [2:26:01<2:56:41, 93.81s/it, best=0.928][A
Staphylococcus_Aureus | Fusidic acid | Optuna:  44%|████▎     | 87/200 [2:26:01<2:56:41, 93.81s/it, best=0.928][A[I 2026-02-28 05:07:03,591] Trial 124 finished with value: 0.8642839719642621 and parameters: {'activation': 'identity', 'solver': 'adam', 'lr': 0.0015043246856109983, 'layer1': 399, 'layer2': 305, 'layer3': 162}. Best is trial 63 with value: 0.8682133709784562.
Pseudomonas_Aeruginosa | LPS | Optuna:  62%|██████▎   | 125/200 [3:02:05<1:50:19, 88.26s/it, best=0.868]Pseudomonas_Aeruginosa | LPS | Optuna:  62%|██████▎   | 125/200 [3:02:05<1:50:19, 88.26s/it, best=0.868]/export/usuarios01/egarroyo/MALDI_for_AMR_prediction/venv/lib/python3.13/site-packages/sklearn/model_selection/_split.py:813: UserWarning: The least populated class in y has only 4 members, which is less than n_splits=5.
  warnings.warn(
[I 2026-02-28 05:07:30,212] Trial 126 finished with value: 0.9841395994368165 and parameters: {'activation': 'relu', 'solver': 'adam', 'lr': 0.0006115637593293675, 'layer1': 368, 'layer2': 346, 'layer3': 442}. Best is trial 13 with value: 0.9860492846658779.

Klebsiella_Pneumoniae | Imipenem | Optuna:  64%|██████▎   | 127/200 [1:38:42<1:08:16, 56.12s/it, best=0.986][A
Klebsiella_Pneumoniae | Imipenem | Optuna:  64%|██████▎   | 127/200 [1:38:42<1:08:16, 56.12s/it, best=0.986][A[I 2026-02-28 05:07:37,591] Trial 140 finished with value: 0.8861671306591969 and parameters: {'activation': 'identity', 'solver': 'adam', 'lr': 6.231874801241096e-05, 'layer1': 464, 'layer2': 309, 'layer3': 18}. Best is trial 137 with value: 0.8979080367540411.

Escherichia_Coli | Ceftriaxone | Optuna:  70%|███████   | 141/200 [5:57:39<2:58:22, 181.40s/it, best=0.898][A
Escherichia_Coli | Ceftriaxone | Optuna:  70%|███████   | 141/200 [5:57:39<2:58:22, 181.40s/it, best=0.898][A[I 2026-02-28 05:08:03,629] Trial 87 finished with value: 0.9212477590167257 and parameters: {'activation': 'identity', 'solver': 'adam', 'lr': 0.0001245465373043449, 'layer1': 262, 'layer2': 121, 'layer3': 144}. Best is trial 77 with value: 0.9283869597728589.

Staphylococcus_Aureus | Fusidic acid | Optuna:  44%|████▍     | 88/200 [2:27:12<2:42:43, 87.17s/it, best=0.928][A
Staphylococcus_Aureus | Fusidic acid | Optuna:  44%|████▍     | 88/200 [2:27:12<2:42:43, 87.17s/it, best=0.928][A[I 2026-02-28 05:08:13,592] Trial 125 finished with value: 0.8613435725609182 and parameters: {'activation': 'identity', 'solver': 'adam', 'lr': 0.00019991809050536543, 'layer1': 24, 'layer2': 361, 'layer3': 456}. Best is trial 63 with value: 0.8682133709784562.
Pseudomonas_Aeruginosa | LPS | Optuna:  63%|██████▎   | 126/200 [3:03:15<1:42:05, 82.78s/it, best=0.868]Pseudomonas_Aeruginosa | LPS | Optuna:  63%|██████▎   | 126/200 [3:03:15<1:42:05, 82.78s/it, best=0.868]/export/usuarios01/egarroyo/MALDI_for_AMR_prediction/venv/lib/python3.13/site-packages/sklearn/model_selection/_split.py:813: UserWarning: The least populated class in y has only 4 members, which is less than n_splits=5.
  warnings.warn(
[I 2026-02-28 05:08:17,032] Trial 127 finished with value: 0.9819898047648248 and parameters: {'activation': 'relu', 'solver': 'adam', 'lr': 0.00035424637581829446, 'layer1': 356, 'layer2': 379, 'layer3': 455}. Best is trial 13 with value: 0.9860492846658779.

Klebsiella_Pneumoniae | Imipenem | Optuna:  64%|██████▍   | 128/200 [1:39:29<1:03:59, 53.33s/it, best=0.986][A
Klebsiella_Pneumoniae | Imipenem | Optuna:  64%|██████▍   | 128/200 [1:39:29<1:03:59, 53.33s/it, best=0.986][A[I 2026-02-28 05:09:09,278] Trial 128 finished with value: 0.9836385527811521 and parameters: {'activation': 'tanh', 'solver': 'adam', 'lr': 0.0007986214717842617, 'layer1': 425, 'layer2': 321, 'layer3': 433}. Best is trial 13 with value: 0.9860492846658779.

Klebsiella_Pneumoniae | Imipenem | Optuna:  64%|██████▍   | 129/200 [1:40:21<1:02:43, 53.00s/it, best=0.986][A
Klebsiella_Pneumoniae | Imipenem | Optuna:  64%|██████▍   | 129/200 [1:40:21<1:02:43, 53.00s/it, best=0.986][A[I 2026-02-28 05:09:35,331] Trial 126 finished with value: 0.8587352605940639 and parameters: {'activation': 'relu', 'solver': 'adam', 'lr': 0.0006857568546487692, 'layer1': 362, 'layer2': 373, 'layer3': 409}. Best is trial 63 with value: 0.8682133709784562.
Pseudomonas_Aeruginosa | LPS | Optuna:  64%|██████▎   | 127/200 [3:04:37<1:40:20, 82.47s/it, best=0.868]Pseudomonas_Aeruginosa | LPS | Optuna:  64%|██████▎   | 127/200 [3:04:37<1:40:20, 82.47s/it, best=0.868]/export/usuarios01/egarroyo/MALDI_for_AMR_prediction/venv/lib/python3.13/site-packages/sklearn/model_selection/_split.py:813: UserWarning: The least populated class in y has only 4 members, which is less than n_splits=5.
  warnings.warn(
[I 2026-02-28 05:09:47,279] Trial 141 finished with value: 0.8943456718877686 and parameters: {'activation': 'relu', 'solver': 'adam', 'lr': 9.649996228641083e-05, 'layer1': 476, 'layer2': 374, 'layer3': 45}. Best is trial 137 with value: 0.8979080367540411.

Escherichia_Coli | Ceftriaxone | Optuna:  71%|███████   | 142/200 [5:59:48<2:40:21, 165.89s/it, best=0.898][A
Escherichia_Coli | Ceftriaxone | Optuna:  71%|███████   | 142/200 [5:59:48<2:40:21, 165.89s/it, best=0.898][A[I 2026-02-28 05:09:48,126] Trial 88 finished with value: 0.9271222343198474 and parameters: {'activation': 'identity', 'solver': 'adam', 'lr': 7.91630905863477e-05, 'layer1': 247, 'layer2': 146, 'layer3': 138}. Best is trial 77 with value: 0.9283869597728589.

Staphylococcus_Aureus | Fusidic acid | Optuna:  44%|████▍     | 89/200 [2:28:57<2:50:53, 92.37s/it, best=0.928][A
Staphylococcus_Aureus | Fusidic acid | Optuna:  44%|████▍     | 89/200 [2:28:57<2:50:53, 92.37s/it, best=0.928][A[I 2026-02-28 05:10:04,173] Trial 129 finished with value: 0.9833171190756502 and parameters: {'activation': 'relu', 'solver': 'adam', 'lr': 0.0004898834247770293, 'layer1': 389, 'layer2': 300, 'layer3': 419}. Best is trial 13 with value: 0.9860492846658779.

Klebsiella_Pneumoniae | Imipenem | Optuna:  65%|██████▌   | 130/200 [1:41:16<1:02:29, 53.57s/it, best=0.986][A
Klebsiella_Pneumoniae | Imipenem | Optuna:  65%|██████▌   | 130/200 [1:41:16<1:02:29, 53.57s/it, best=0.986][A[I 2026-02-28 05:10:17,841] Trial 89 finished with value: 0.9050666137971211 and parameters: {'activation': 'logistic', 'solver': 'adam', 'lr': 0.00010036903490971466, 'layer1': 222, 'layer2': 30, 'layer3': 182}. Best is trial 77 with value: 0.9283869597728589.

Staphylococcus_Aureus | Fusidic acid | Optuna:  45%|████▌     | 90/200 [2:29:27<2:14:53, 73.57s/it, best=0.928][A
Staphylococcus_Aureus | Fusidic acid | Optuna:  45%|████▌     | 90/200 [2:29:27<2:14:53, 73.57s/it, best=0.928][A[I 2026-02-28 05:10:53,139] Trial 130 finished with value: 0.9830528681877911 and parameters: {'activation': 'relu', 'solver': 'adam', 'lr': 0.0002677517684722865, 'layer1': 381, 'layer2': 99, 'layer3': 472}. Best is trial 13 with value: 0.9860492846658779.

Klebsiella_Pneumoniae | Imipenem | Optuna:  66%|██████▌   | 131/200 [1:42:05<1:00:01, 52.19s/it, best=0.986][A
Klebsiella_Pneumoniae | Imipenem | Optuna:  66%|██████▌   | 131/200 [1:42:05<1:00:01, 52.19s/it, best=0.986][A[I 2026-02-28 05:10:59,667] Trial 127 finished with value: 0.8647629630615503 and parameters: {'activation': 'identity', 'solver': 'adam', 'lr': 0.001235565979166082, 'layer1': 64, 'layer2': 500, 'layer3': 480}. Best is trial 63 with value: 0.8682133709784562.
Pseudomonas_Aeruginosa | LPS | Optuna:  64%|██████▍   | 128/200 [3:06:01<1:39:37, 83.03s/it, best=0.868]Pseudomonas_Aeruginosa | LPS | Optuna:  64%|██████▍   | 128/200 [3:06:01<1:39:37, 83.03s/it, best=0.868]/export/usuarios01/egarroyo/MALDI_for_AMR_prediction/venv/lib/python3.13/site-packages/sklearn/model_selection/_split.py:813: UserWarning: The least populated class in y has only 4 members, which is less than n_splits=5.
  warnings.warn(
[I 2026-02-28 05:11:27,531] Trial 131 finished with value: 0.982359050812925 and parameters: {'activation': 'relu', 'solver': 'adam', 'lr': 0.0010746962173375355, 'layer1': 30, 'layer2': 362, 'layer3': 462}. Best is trial 13 with value: 0.9860492846658779.

Klebsiella_Pneumoniae | Imipenem | Optuna:  66%|██████▌   | 132/200 [1:42:40<53:05, 46.85s/it, best=0.986]  [A
Klebsiella_Pneumoniae | Imipenem | Optuna:  66%|██████▌   | 132/200 [1:42:40<53:05, 46.85s/it, best=0.986][A[I 2026-02-28 05:11:49,999] Trial 128 finished with value: 0.8549596251152968 and parameters: {'activation': 'tanh', 'solver': 'adam', 'lr': 0.0020805313813340017, 'layer1': 46, 'layer2': 312, 'layer3': 418}. Best is trial 63 with value: 0.8682133709784562.
Pseudomonas_Aeruginosa | LPS | Optuna:  64%|██████▍   | 129/200 [3:06:52<1:26:38, 73.22s/it, best=0.868]Pseudomonas_Aeruginosa | LPS | Optuna:  64%|██████▍   | 129/200 [3:06:52<1:26:38, 73.22s/it, best=0.868]/export/usuarios01/egarroyo/MALDI_for_AMR_prediction/venv/lib/python3.13/site-packages/sklearn/model_selection/_split.py:813: UserWarning: The least populated class in y has only 4 members, which is less than n_splits=5.
  warnings.warn(
[I 2026-02-28 05:11:51,311] Trial 90 finished with value: 0.9266590367525499 and parameters: {'activation': 'tanh', 'solver': 'adam', 'lr': 4.494519853155988e-05, 'layer1': 205, 'layer2': 92, 'layer3': 494}. Best is trial 77 with value: 0.9283869597728589.

Staphylococcus_Aureus | Fusidic acid | Optuna:  46%|████▌     | 91/200 [2:31:00<2:24:30, 79.54s/it, best=0.928][A
Staphylococcus_Aureus | Fusidic acid | Optuna:  46%|████▌     | 91/200 [2:31:00<2:24:30, 79.54s/it, best=0.928][A[I 2026-02-28 05:11:59,519] Trial 132 finished with value: 0.9819898047648248 and parameters: {'activation': 'relu', 'solver': 'adam', 'lr': 0.0012703043559862798, 'layer1': 14, 'layer2': 401, 'layer3': 452}. Best is trial 13 with value: 0.9860492846658779.

Klebsiella_Pneumoniae | Imipenem | Optuna:  66%|██████▋   | 133/200 [1:43:12<47:20, 42.39s/it, best=0.986][A
