Escherichia_Coli | Ciprofloxacin | Optuna:   3%|▎         | 6/200 [10:41<6:21:18, 117.93s/it, best=0.769][A[I 2026-02-27 14:59:00,432] Trial 13 finished with value: 0.8639169682495554 and parameters: {'activation': 'relu', 'solver': 'adam', 'lr': 0.00037540926788082424, 'layer1': 494, 'layer2': 131, 'layer3': 438}. Best is trial 7 with value: 0.8642049402395562.

Pseudomonas_Aeruginosa | Ciprofloxacin | Optuna:   7%|▋         | 14/200 [11:30<3:05:51, 59.95s/it, best=0.864][A
Pseudomonas_Aeruginosa | Ciprofloxacin | Optuna:   7%|▋         | 14/200 [11:30<3:05:51, 59.95s/it, best=0.864][A[I 2026-02-27 14:59:12,105] Trial 9 finished with value: 0.7426142523032032 and parameters: {'activation': 'tanh', 'solver': 'sgd', 'lr': 0.00012329098365270507, 'layer1': 219, 'layer2': 22, 'layer3': 62}. Best is trial 8 with value: 0.826402964334112.

Klebsiella_Pneumoniae | Ciprofloxacin | Optuna:   5%|▌         | 10/200 [11:41<4:19:25, 81.93s/it, best=0.826][A
Klebsiella_Pneumoniae | Ciprofloxacin | Optuna:   5%|▌         | 10/200 [11:41<4:19:25, 81.93s/it, best=0.826][A[I 2026-02-27 15:00:23,416] Trial 14 finished with value: 0.8652363030878789 and parameters: {'activation': 'relu', 'solver': 'adam', 'lr': 0.00017418893870326793, 'layer1': 499, 'layer2': 142, 'layer3': 475}. Best is trial 14 with value: 0.8652363030878789.

Pseudomonas_Aeruginosa | Ciprofloxacin | Optuna:   8%|▊         | 15/200 [12:53<3:26:15, 66.90s/it, best=0.864][A
Pseudomonas_Aeruginosa | Ciprofloxacin | Optuna:   8%|▊         | 15/200 [12:53<3:26:15, 66.90s/it, best=0.865][A[I 2026-02-27 15:00:49,316] Trial 10 finished with value: 0.7687035216036747 and parameters: {'activation': 'identity', 'solver': 'sgd', 'lr': 0.007553503645583194, 'layer1': 366, 'layer2': 492, 'layer3': 320}. Best is trial 8 with value: 0.826402964334112.

Klebsiella_Pneumoniae | Ciprofloxacin | Optuna:   6%|▌         | 11/200 [13:18<4:32:48, 86.60s/it, best=0.826][A
Klebsiella_Pneumoniae | Ciprofloxacin | Optuna:   6%|▌         | 11/200 [13:18<4:32:48, 86.60s/it, best=0.826][A[I 2026-02-27 15:01:05,443] Trial 15 finished with value: 0.8608344259154211 and parameters: {'activation': 'relu', 'solver': 'adam', 'lr': 0.00012367302017366277, 'layer1': 149, 'layer2': 178, 'layer3': 436}. Best is trial 14 with value: 0.8652363030878789.

Pseudomonas_Aeruginosa | Ciprofloxacin | Optuna:   8%|▊         | 16/200 [13:35<3:02:11, 59.41s/it, best=0.865][A
Pseudomonas_Aeruginosa | Ciprofloxacin | Optuna:   8%|▊         | 16/200 [13:35<3:02:11, 59.41s/it, best=0.865][A[I 2026-02-27 15:01:30,647] Trial 5 finished with value: 0.8319685025290025 and parameters: {'activation': 'identity', 'solver': 'adam', 'lr': 2.259279742015697e-06, 'layer1': 106, 'layer2': 32, 'layer3': 169}. Best is trial 4 with value: 0.8965181545772708.

Staphylococcus_Aureus | Oxacillin | Optuna:   3%|▎         | 6/200 [14:00<10:04:02, 186.82s/it, best=0.896][A
Staphylococcus_Aureus | Oxacillin | Optuna:   3%|▎         | 6/200 [14:00<10:04:02, 186.82s/it, best=0.896][A[I 2026-02-27 15:01:47,279] Trial 16 finished with value: 0.8216008859986135 and parameters: {'activation': 'relu', 'solver': 'adam', 'lr': 0.007077044665971324, 'layer1': 499, 'layer2': 104, 'layer3': 154}. Best is trial 14 with value: 0.8652363030878789.

Pseudomonas_Aeruginosa | Ciprofloxacin | Optuna:   8%|▊         | 17/200 [14:16<2:45:05, 54.13s/it, best=0.865][A
Pseudomonas_Aeruginosa | Ciprofloxacin | Optuna:   8%|▊         | 17/200 [14:16<2:45:05, 54.13s/it, best=0.865][A[I 2026-02-27 15:02:05,746] Trial 11 finished with value: 0.815209711214217 and parameters: {'activation': 'relu', 'solver': 'adam', 'lr': 0.0013124793805688133, 'layer1': 150, 'layer2': 163, 'layer3': 284}. Best is trial 8 with value: 0.826402964334112.

Klebsiella_Pneumoniae | Ciprofloxacin | Optuna:   6%|▌         | 12/200 [14:35<4:21:39, 83.51s/it, best=0.826][A
Klebsiella_Pneumoniae | Ciprofloxacin | Optuna:   6%|▌         | 12/200 [14:35<4:21:39, 83.51s/it, best=0.826][A[I 2026-02-27 15:03:21,965] Trial 17 finished with value: 0.8608614099781692 and parameters: {'activation': 'relu', 'solver': 'adam', 'lr': 5.043030566283627e-05, 'layer1': 360, 'layer2': 217, 'layer3': 11}. Best is trial 14 with value: 0.8652363030878789.

Pseudomonas_Aeruginosa | Ciprofloxacin | Optuna:   9%|▉         | 18/200 [15:51<3:21:09, 66.31s/it, best=0.865][A
Pseudomonas_Aeruginosa | Ciprofloxacin | Optuna:   9%|▉         | 18/200 [15:51<3:21:09, 66.31s/it, best=0.865][A[I 2026-02-27 15:03:41,149] Trial 18 finished with value: 0.8180160288881716 and parameters: {'activation': 'relu', 'solver': 'sgd', 'lr': 0.00031731685187277224, 'layer1': 178, 'layer2': 85, 'layer3': 290}. Best is trial 14 with value: 0.8652363030878789.

Pseudomonas_Aeruginosa | Ciprofloxacin | Optuna:  10%|▉         | 19/200 [16:10<2:37:20, 52.16s/it, best=0.865][A
Pseudomonas_Aeruginosa | Ciprofloxacin | Optuna:  10%|▉         | 19/200 [16:10<2:37:20, 52.16s/it, best=0.865][A[I 2026-02-27 15:04:06,825] Trial 12 finished with value: 0.824938982188141 and parameters: {'activation': 'identity', 'solver': 'adam', 'lr': 0.00046544039809979403, 'layer1': 347, 'layer2': 434, 'layer3': 419}. Best is trial 8 with value: 0.826402964334112.

Klebsiella_Pneumoniae | Ciprofloxacin | Optuna:   6%|▋         | 13/200 [16:36<4:55:44, 94.89s/it, best=0.826][A
Klebsiella_Pneumoniae | Ciprofloxacin | Optuna:   6%|▋         | 13/200 [16:36<4:55:44, 94.89s/it, best=0.826][A[I 2026-02-27 15:04:16,731] Trial 19 finished with value: 0.84928374402814 and parameters: {'activation': 'tanh', 'solver': 'adam', 'lr': 0.0028172981645942226, 'layer1': 90, 'layer2': 364, 'layer3': 99}. Best is trial 14 with value: 0.8652363030878789.

Pseudomonas_Aeruginosa | Ciprofloxacin | Optuna:  10%|█         | 20/200 [16:46<2:21:32, 47.18s/it, best=0.865][A
Pseudomonas_Aeruginosa | Ciprofloxacin | Optuna:  10%|█         | 20/200 [16:46<2:21:32, 47.18s/it, best=0.865][A[I 2026-02-27 15:05:11,973] Trial 20 finished with value: 0.8693133976281601 and parameters: {'activation': 'logistic', 'solver': 'adam', 'lr': 0.0004272754279986514, 'layer1': 14, 'layer2': 202, 'layer3': 402}. Best is trial 20 with value: 0.8693133976281601.

Pseudomonas_Aeruginosa | Ciprofloxacin | Optuna:  10%|█         | 21/200 [17:41<2:27:58, 49.60s/it, best=0.865][A
Pseudomonas_Aeruginosa | Ciprofloxacin | Optuna:  10%|█         | 21/200 [17:41<2:27:58, 49.60s/it, best=0.869][A[I 2026-02-27 15:05:35,176] Trial 6 finished with value: 0.7892293407169519 and parameters: {'activation': 'tanh', 'solver': 'adam', 'lr': 3.6618192203924288e-06, 'layer1': 403, 'layer2': 46, 'layer3': 494}. Best is trial 6 with value: 0.7892293407169519.

Escherichia_Coli | Ciprofloxacin | Optuna:   4%|▎         | 7/200 [18:04<12:01:09, 224.20s/it, best=0.769][A
Escherichia_Coli | Ciprofloxacin | Optuna:   4%|▎         | 7/200 [18:04<12:01:09, 224.20s/it, best=0.789][A[I 2026-02-27 15:06:03,674] Trial 13 finished with value: 0.8206897641210288 and parameters: {'activation': 'identity', 'solver': 'adam', 'lr': 0.00025548240574830476, 'layer1': 499, 'layer2': 471, 'layer3': 419}. Best is trial 8 with value: 0.826402964334112.

Klebsiella_Pneumoniae | Ciprofloxacin | Optuna:   7%|▋         | 14/200 [18:33<5:14:43, 101.52s/it, best=0.826][A
Klebsiella_Pneumoniae | Ciprofloxacin | Optuna:   7%|▋         | 14/200 [18:33<5:14:43, 101.52s/it, best=0.826][A[I 2026-02-27 15:06:06,160] Trial 21 finished with value: 0.8689066735834026 and parameters: {'activation': 'logistic', 'solver': 'adam', 'lr': 0.00040182349832289835, 'layer1': 19, 'layer2': 215, 'layer3': 490}. Best is trial 20 with value: 0.8693133976281601.

Pseudomonas_Aeruginosa | Ciprofloxacin | Optuna:  11%|█         | 22/200 [18:35<2:31:13, 50.98s/it, best=0.869][A
Pseudomonas_Aeruginosa | Ciprofloxacin | Optuna:  11%|█         | 22/200 [18:35<2:31:13, 50.98s/it, best=0.869][A[I 2026-02-27 15:06:07,502] Trial 6 finished with value: 0.8588947266093012 and parameters: {'activation': 'tanh', 'solver': 'adam', 'lr': 3.6618192203924288e-06, 'layer1': 403, 'layer2': 46, 'layer3': 494}. Best is trial 4 with value: 0.8965181545772708.

Staphylococcus_Aureus | Oxacillin | Optuna:   4%|▎         | 7/200 [18:37<11:35:36, 216.25s/it, best=0.896][A
Staphylococcus_Aureus | Oxacillin | Optuna:   4%|▎         | 7/200 [18:37<11:35:36, 216.25s/it, best=0.896][A[I 2026-02-27 15:06:48,568] Trial 22 finished with value: 0.8564510156718518 and parameters: {'activation': 'logistic', 'solver': 'adam', 'lr': 0.00034957853474420954, 'layer1': 11, 'layer2': 233, 'layer3': 491}. Best is trial 20 with value: 0.8693133976281601.

Pseudomonas_Aeruginosa | Ciprofloxacin | Optuna:  12%|█▏        | 23/200 [19:18<2:22:47, 48.41s/it, best=0.869][A
Pseudomonas_Aeruginosa | Ciprofloxacin | Optuna:  12%|█▏        | 23/200 [19:18<2:22:47, 48.41s/it, best=0.869][A[I 2026-02-27 15:06:53,459] Trial 7 finished with value: 0.7955083613547373 and parameters: {'activation': 'relu', 'solver': 'adam', 'lr': 0.0012164139351417069, 'layer1': 46, 'layer2': 186, 'layer3': 66}. Best is trial 7 with value: 0.7955083613547373.

Escherichia_Coli | Ciprofloxacin | Optuna:   4%|▍         | 8/200 [19:22<9:28:46, 177.74s/it, best=0.789] [A
Escherichia_Coli | Ciprofloxacin | Optuna:   4%|▍         | 8/200 [19:22<9:28:46, 177.74s/it, best=0.795][A[I 2026-02-27 15:07:07,449] Trial 23 finished with value: 0.8159756916186209 and parameters: {'activation': 'logistic', 'solver': 'adam', 'lr': 5.999407903530581e-05, 'layer1': 105, 'layer2': 173, 'layer3': 441}. Best is trial 20 with value: 0.8693133976281601.

Pseudomonas_Aeruginosa | Ciprofloxacin | Optuna:  12%|█▏        | 24/200 [19:37<1:56:00, 39.55s/it, best=0.869][A
Pseudomonas_Aeruginosa | Ciprofloxacin | Optuna:  12%|█▏        | 24/200 [19:37<1:56:00, 39.55s/it, best=0.869][A[I 2026-02-27 15:07:08,738] Trial 7 finished with value: 0.9012006262159898 and parameters: {'activation': 'relu', 'solver': 'adam', 'lr': 0.0012164139351417069, 'layer1': 46, 'layer2': 186, 'layer3': 66}. Best is trial 7 with value: 0.9012006262159898.

Staphylococcus_Aureus | Oxacillin | Optuna:   4%|▍         | 8/200 [19:38<8:54:05, 166.90s/it, best=0.896] [A
Staphylococcus_Aureus | Oxacillin | Optuna:   4%|▍         | 8/200 [19:38<8:54:05, 166.90s/it, best=0.901][A[I 2026-02-27 15:07:32,178] Trial 24 finished with value: 0.8267168278970228 and parameters: {'activation': 'logistic', 'solver': 'adam', 'lr': 0.00021272238306365533, 'layer1': 79, 'layer2': 120, 'layer3': 419}. Best is trial 20 with value: 0.8693133976281601.

Pseudomonas_Aeruginosa | Ciprofloxacin | Optuna:  12%|█▎        | 25/200 [20:01<1:42:22, 35.10s/it, best=0.869][A
Pseudomonas_Aeruginosa | Ciprofloxacin | Optuna:  12%|█▎        | 25/200 [20:01<1:42:22, 35.10s/it, best=0.869][A[I 2026-02-27 15:07:34,419] Trial 14 finished with value: 0.8223986974224002 and parameters: {'activation': 'identity', 'solver': 'adam', 'lr': 0.0007479355404409705, 'layer1': 340, 'layer2': 392, 'layer3': 396}. Best is trial 8 with value: 0.826402964334112.

Klebsiella_Pneumoniae | Ciprofloxacin | Optuna:   8%|▊         | 15/200 [20:03<5:03:00, 98.27s/it, best=0.826] [A
Klebsiella_Pneumoniae | Ciprofloxacin | Optuna:   8%|▊         | 15/200 [20:03<5:03:00, 98.27s/it, best=0.826][A[I 2026-02-27 15:08:48,671] Trial 25 finished with value: 0.8742256033469008 and parameters: {'activation': 'logistic', 'solver': 'adam', 'lr': 0.00047950731932675834, 'layer1': 307, 'layer2': 254, 'layer3': 408}. Best is trial 25 with value: 0.8742256033469008.

Pseudomonas_Aeruginosa | Ciprofloxacin | Optuna:  13%|█▎        | 26/200 [21:18<2:17:48, 47.52s/it, best=0.869][A
Pseudomonas_Aeruginosa | Ciprofloxacin | Optuna:  13%|█▎        | 26/200 [21:18<2:17:48, 47.52s/it, best=0.874][A[I 2026-02-27 15:09:09,969] Trial 26 finished with value: 0.8159756916186209 and parameters: {'activation': 'logistic', 'solver': 'sgd', 'lr': 0.000629844729874056, 'layer1': 302, 'layer2': 255, 'layer3': 397}. Best is trial 25 with value: 0.8742256033469008.

Pseudomonas_Aeruginosa | Ciprofloxacin | Optuna:  14%|█▎        | 27/200 [21:39<1:54:19, 39.65s/it, best=0.874][A
Pseudomonas_Aeruginosa | Ciprofloxacin | Optuna:  14%|█▎        | 27/200 [21:39<1:54:19, 39.65s/it, best=0.874][A[I 2026-02-27 15:09:12,095] Trial 15 finished with value: 0.8185972807387476 and parameters: {'activation': 'identity', 'solver': 'adam', 'lr': 0.0028522646033228415, 'layer1': 324, 'layer2': 424, 'layer3': 236}. Best is trial 8 with value: 0.826402964334112.

Klebsiella_Pneumoniae | Ciprofloxacin | Optuna:   8%|▊         | 16/200 [21:41<5:00:49, 98.09s/it, best=0.826][A
Klebsiella_Pneumoniae | Ciprofloxacin | Optuna:   8%|▊         | 16/200 [21:41<5:00:49, 98.09s/it, best=0.826][A[I 2026-02-27 15:09:25,323] Trial 8 finished with value: 0.8005508709469982 and parameters: {'activation': 'identity', 'solver': 'adam', 'lr': 0.000828752236376816, 'layer1': 323, 'layer2': 445, 'layer3': 241}. Best is trial 8 with value: 0.8005508709469982.

Escherichia_Coli | Ciprofloxacin | Optuna:   4%|▍         | 9/200 [21:54<9:00:03, 169.65s/it, best=0.795][A
Escherichia_Coli | Ciprofloxacin | Optuna:   4%|▍         | 9/200 [21:54<9:00:03, 169.65s/it, best=0.801][A[I 2026-02-27 15:09:47,189] Trial 8 finished with value: 0.9087712261031256 and parameters: {'activation': 'identity', 'solver': 'adam', 'lr': 0.000828752236376816, 'layer1': 323, 'layer2': 445, 'layer3': 241}. Best is trial 8 with value: 0.9087712261031256.

Staphylococcus_Aureus | Oxacillin | Optuna:   4%|▍         | 9/200 [22:16<8:42:53, 164.26s/it, best=0.901][A
Staphylococcus_Aureus | Oxacillin | Optuna:   4%|▍         | 9/200 [22:16<8:42:53, 164.26s/it, best=0.909][A[I 2026-02-27 15:09:54,077] Trial 27 finished with value: 0.8608004903672068 and parameters: {'activation': 'logistic', 'solver': 'adam', 'lr': 0.002526204652054459, 'layer1': 132, 'layer2': 356, 'layer3': 383}. Best is trial 25 with value: 0.8742256033469008.

Pseudomonas_Aeruginosa | Ciprofloxacin | Optuna:  14%|█▍        | 28/200 [22:23<1:57:30, 40.99s/it, best=0.874][A
Pseudomonas_Aeruginosa | Ciprofloxacin | Optuna:  14%|█▍        | 28/200 [22:23<1:57:30, 40.99s/it, best=0.874][A[I 2026-02-27 15:10:18,004] Trial 28 finished with value: 0.8159756916186209 and parameters: {'activation': 'logistic', 'solver': 'adam', 'lr': 5.520350166411609e-05, 'layer1': 212, 'layer2': 405, 'layer3': 458}. Best is trial 25 with value: 0.8742256033469008.

Pseudomonas_Aeruginosa | Ciprofloxacin | Optuna:  14%|█▍        | 29/200 [22:47<1:42:13, 35.87s/it, best=0.874][A
Pseudomonas_Aeruginosa | Ciprofloxacin | Optuna:  14%|█▍        | 29/200 [22:47<1:42:13, 35.87s/it, best=0.874][A[I 2026-02-27 15:10:34,970] Trial 16 finished with value: 0.8222933208414652 and parameters: {'activation': 'identity', 'solver': 'adam', 'lr': 0.00017184915692664145, 'layer1': 193, 'layer2': 409, 'layer3': 472}. Best is trial 8 with value: 0.826402964334112.

Klebsiella_Pneumoniae | Ciprofloxacin | Optuna:   8%|▊         | 17/200 [23:04<4:45:13, 93.52s/it, best=0.826][A
Klebsiella_Pneumoniae | Ciprofloxacin | Optuna:   8%|▊         | 17/200 [23:04<4:45:13, 93.52s/it, best=0.826][A[I 2026-02-27 15:10:35,705] Trial 29 finished with value: 0.8159756916186209 and parameters: {'activation': 'logistic', 'solver': 'sgd', 'lr': 0.0005658355183973691, 'layer1': 217, 'layer2': 324, 'layer3': 389}. Best is trial 25 with value: 0.8742256033469008.

Pseudomonas_Aeruginosa | Ciprofloxacin | Optuna:  15%|█▌        | 30/200 [23:05<1:26:11, 30.42s/it, best=0.874][A
Pseudomonas_Aeruginosa | Ciprofloxacin | Optuna:  15%|█▌        | 30/200 [23:05<1:26:11, 30.42s/it, best=0.874][A[I 2026-02-27 15:11:02,980] Trial 9 finished with value: 0.7220546320546328 and parameters: {'activation': 'tanh', 'solver': 'sgd', 'lr': 0.00012329098365270507, 'layer1': 219, 'layer2': 22, 'layer3': 62}. Best is trial 8 with value: 0.9087712261031256.

Staphylococcus_Aureus | Oxacillin | Optuna:   5%|▌         | 10/200 [23:32<7:13:40, 136.95s/it, best=0.909][A
Staphylococcus_Aureus | Oxacillin | Optuna:   5%|▌         | 10/200 [23:32<7:13:40, 136.95s/it, best=0.909][A[I 2026-02-27 15:11:18,377] Trial 9 finished with value: 0.6201566876328444 and parameters: {'activation': 'tanh', 'solver': 'sgd', 'lr': 0.00012329098365270507, 'layer1': 219, 'layer2': 22, 'layer3': 62}. Best is trial 8 with value: 0.8005508709469982.

Escherichia_Coli | Ciprofloxacin | Optuna:   5%|▌         | 10/200 [23:47<8:01:54, 152.18s/it, best=0.801][A
Escherichia_Coli | Ciprofloxacin | Optuna:   5%|▌         | 10/200 [23:47<8:01:54, 152.18s/it, best=0.801][A[I 2026-02-27 15:11:41,350] Trial 30 finished with value: 0.851339036882146 and parameters: {'activation': 'logistic', 'solver': 'adam', 'lr': 0.003802885545292764, 'layer1': 412, 'layer2': 273, 'layer3': 311}. Best is trial 25 with value: 0.8742256033469008.

Pseudomonas_Aeruginosa | Ciprofloxacin | Optuna:  16%|█▌        | 31/200 [24:11<1:55:26, 40.99s/it, best=0.874][A
Pseudomonas_Aeruginosa | Ciprofloxacin | Optuna:  16%|█▌        | 31/200 [24:11<1:55:26, 40.99s/it, best=0.874][A[I 2026-02-27 15:12:09,511] Trial 17 finished with value: 0.8236718584089662 and parameters: {'activation': 'identity', 'solver': 'adam', 'lr': 0.0004473029764903099, 'layer1': 450, 'layer2': 360, 'layer3': 299}. Best is trial 8 with value: 0.826402964334112.

Klebsiella_Pneumoniae | Ciprofloxacin | Optuna:   9%|▉         | 18/200 [24:39<4:44:36, 93.83s/it, best=0.826][A
Klebsiella_Pneumoniae | Ciprofloxacin | Optuna:   9%|▉         | 18/200 [24:39<4:44:36, 93.83s/it, best=0.826][A[I 2026-02-27 15:13:35,096] Trial 31 finished with value: 0.8710025779695887 and parameters: {'activation': 'logistic', 'solver': 'adam', 'lr': 0.0001837870463724189, 'layer1': 463, 'layer2': 212, 'layer3': 471}. Best is trial 25 with value: 0.8742256033469008.

Pseudomonas_Aeruginosa | Ciprofloxacin | Optuna:  16%|█▌        | 32/200 [26:04<2:55:52, 62.82s/it, best=0.874][A
Pseudomonas_Aeruginosa | Ciprofloxacin | Optuna:  16%|█▌        | 32/200 [26:04<2:55:52, 62.82s/it, best=0.874][A[I 2026-02-27 15:14:02,376] Trial 10 finished with value: 0.896001025743446 and parameters: {'activation': 'identity', 'solver': 'sgd', 'lr': 0.007553503645583194, 'layer1': 366, 'layer2': 492, 'layer3': 320}. Best is trial 8 with value: 0.9087712261031256.

Staphylococcus_Aureus | Oxacillin | Optuna:   6%|▌         | 11/200 [26:32<7:52:18, 149.94s/it, best=0.909][A
Staphylococcus_Aureus | Oxacillin | Optuna:   6%|▌         | 11/200 [26:32<7:52:18, 149.94s/it, best=0.909][A[I 2026-02-27 15:14:42,835] Trial 18 finished with value: 0.6146197729818197 and parameters: {'activation': 'tanh', 'solver': 'sgd', 'lr': 5.6512812063308935e-05, 'layer1': 316, 'layer2': 450, 'layer3': 199}. Best is trial 8 with value: 0.826402964334112.

Klebsiella_Pneumoniae | Ciprofloxacin | Optuna:  10%|▉         | 19/200 [27:12<5:36:56, 111.70s/it, best=0.826][A
Klebsiella_Pneumoniae | Ciprofloxacin | Optuna:  10%|▉         | 19/200 [27:12<5:36:56, 111.70s/it, best=0.826][A[I 2026-02-27 15:15:05,664] Trial 32 finished with value: 0.8749825617667517 and parameters: {'activation': 'logistic', 'solver': 'adam', 'lr': 0.00025351314405930986, 'layer1': 454, 'layer2': 228, 'layer3': 465}. Best is trial 32 with value: 0.8749825617667517.

Pseudomonas_Aeruginosa | Ciprofloxacin | Optuna:  16%|█▋        | 33/200 [27:35<3:18:00, 71.14s/it, best=0.874][A
Pseudomonas_Aeruginosa | Ciprofloxacin | Optuna:  16%|█▋        | 33/200 [27:35<3:18:00, 71.14s/it, best=0.875][A[I 2026-02-27 15:15:29,797] Trial 10 finished with value: 0.7876744491841354 and parameters: {'activation': 'identity', 'solver': 'sgd', 'lr': 0.007553503645583194, 'layer1': 366, 'layer2': 492, 'layer3': 320}. Best is trial 8 with value: 0.8005508709469982.

Escherichia_Coli | Ciprofloxacin | Optuna:   6%|▌         | 11/200 [27:59<9:35:02, 182.55s/it, best=0.801][A
Escherichia_Coli | Ciprofloxacin | Optuna:   6%|▌         | 11/200 [27:59<9:35:02, 182.55s/it, best=0.801][A[I 2026-02-27 15:15:34,347] Trial 33 finished with value: 0.8159756916186209 and parameters: {'activation': 'logistic', 'solver': 'adam', 'lr': 7.711137471289654e-05, 'layer1': 463, 'layer2': 239, 'layer3': 420}. Best is trial 32 with value: 0.8749825617667517.

Pseudomonas_Aeruginosa | Ciprofloxacin | Optuna:  17%|█▋        | 34/200 [28:04<2:41:34, 58.40s/it, best=0.875][A
Pseudomonas_Aeruginosa | Ciprofloxacin | Optuna:  17%|█▋        | 34/200 [28:04<2:41:34, 58.40s/it, best=0.875][A[I 2026-02-27 15:15:39,626] Trial 11 finished with value: 0.8993622771989946 and parameters: {'activation': 'relu', 'solver': 'adam', 'lr': 0.0013124793805688133, 'layer1': 150, 'layer2': 163, 'layer3': 284}. Best is trial 8 with value: 0.9087712261031256.

Staphylococcus_Aureus | Oxacillin | Optuna:   6%|▌         | 12/200 [28:09<6:59:35, 133.91s/it, best=0.909][A
Staphylococcus_Aureus | Oxacillin | Optuna:   6%|▌         | 12/200 [28:09<6:59:35, 133.91s/it, best=0.909][A[I 2026-02-27 15:16:03,338] Trial 34 finished with value: 0.8159756916186209 and parameters: {'activation': 'logistic', 'solver': 'adam', 'lr': 3.5486959508932417e-05, 'layer1': 442, 'layer2': 303, 'layer3': 381}. Best is trial 32 with value: 0.8749825617667517.

Pseudomonas_Aeruginosa | Ciprofloxacin | Optuna:  18%|█▊        | 35/200 [28:33<2:16:20, 49.58s/it, best=0.875][A
Pseudomonas_Aeruginosa | Ciprofloxacin | Optuna:  18%|█▊        | 35/200 [28:33<2:16:20, 49.58s/it, best=0.875][A[I 2026-02-27 15:16:32,906] Trial 19 finished with value: 0.7875247841308418 and parameters: {'activation': 'logistic', 'solver': 'adam', 'lr': 0.0037119440897972695, 'layer1': 400, 'layer2': 353, 'layer3': 424}. Best is trial 8 with value: 0.826402964334112.

Klebsiella_Pneumoniae | Ciprofloxacin | Optuna:  10%|█         | 20/200 [29:02<5:33:37, 111.21s/it, best=0.826][A
