Staphylococcus_Aureus | Clindamycin | Optuna:  77%|███████▋  | 154/200 [3:36:41<58:04, 75.75s/it, best=0.857][A[I 2026-02-28 01:34:42,461] Trial 173 finished with value: 0.8841306366229673 and parameters: {'activation': 'identity', 'solver': 'adam', 'lr': 0.0005623610057163593, 'layer1': 396, 'layer2': 478, 'layer3': 398}. Best is trial 73 with value: 0.8861579932511299.

Pseudomonas_Aeruginosa | Meropenem | Optuna:  87%|████████▋ | 174/200 [3:30:17<36:46, 84.86s/it, best=0.886][A
Pseudomonas_Aeruginosa | Meropenem | Optuna:  87%|████████▋ | 174/200 [3:30:17<36:46, 84.86s/it, best=0.886][A[I 2026-02-28 01:35:24,302] Trial 61 finished with value: 0.8930188192018074 and parameters: {'activation': 'relu', 'solver': 'adam', 'lr': 3.892143506859885e-05, 'layer1': 451, 'layer2': 161, 'layer3': 119}. Best is trial 14 with value: 0.8971256036318559.

Escherichia_Coli | Ceftriaxone | Optuna:  31%|███       | 62/200 [2:25:25<5:44:43, 149.88s/it, best=0.897][A
Escherichia_Coli | Ceftriaxone | Optuna:  31%|███       | 62/200 [2:25:25<5:44:43, 149.88s/it, best=0.897][A[I 2026-02-28 01:36:03,583] Trial 154 finished with value: 0.8544208809517523 and parameters: {'activation': 'logistic', 'solver': 'adam', 'lr': 0.0007579099250533699, 'layer1': 184, 'layer2': 33, 'layer3': 87}. Best is trial 105 with value: 0.857392473801258.

Staphylococcus_Aureus | Clindamycin | Optuna:  78%|███████▊  | 155/200 [3:38:05<58:42, 78.28s/it, best=0.857][A
Staphylococcus_Aureus | Clindamycin | Optuna:  78%|███████▊  | 155/200 [3:38:05<58:42, 78.28s/it, best=0.857][A[I 2026-02-28 01:36:07,189] Trial 147 finished with value: 0.9042889992621262 and parameters: {'activation': 'tanh', 'solver': 'adam', 'lr': 2.8263155293200998e-05, 'layer1': 229, 'layer2': 452, 'layer3': 427}. Best is trial 130 with value: 0.9107197512148748.

Klebsiella_Pneumoniae | Ceftriaxone | Optuna:  74%|███████▍  | 148/200 [4:45:28<1:44:43, 120.83s/it, best=0.911][A
Klebsiella_Pneumoniae | Ceftriaxone | Optuna:  74%|███████▍  | 148/200 [4:45:28<1:44:43, 120.83s/it, best=0.911][A[I 2026-02-28 01:36:23,105] Trial 174 finished with value: 0.8861185322123155 and parameters: {'activation': 'identity', 'solver': 'adam', 'lr': 0.0008862314504259482, 'layer1': 375, 'layer2': 454, 'layer3': 439}. Best is trial 73 with value: 0.8861579932511299.

Pseudomonas_Aeruginosa | Meropenem | Optuna:  88%|████████▊ | 175/200 [3:31:58<37:19, 89.60s/it, best=0.886][A
Pseudomonas_Aeruginosa | Meropenem | Optuna:  88%|████████▊ | 175/200 [3:31:58<37:19, 89.60s/it, best=0.886][A[I 2026-02-28 01:37:39,376] Trial 155 finished with value: 0.8540911242329988 and parameters: {'activation': 'logistic', 'solver': 'adam', 'lr': 0.0005972391136686383, 'layer1': 200, 'layer2': 56, 'layer3': 80}. Best is trial 105 with value: 0.857392473801258.

Staphylococcus_Aureus | Clindamycin | Optuna:  78%|███████▊  | 156/200 [3:39:41<1:01:15, 83.54s/it, best=0.857][A
Staphylococcus_Aureus | Clindamycin | Optuna:  78%|███████▊  | 156/200 [3:39:41<1:01:15, 83.54s/it, best=0.857][A[I 2026-02-28 01:37:47,812] Trial 148 finished with value: 0.906773494813914 and parameters: {'activation': 'tanh', 'solver': 'adam', 'lr': 5.0309797084125235e-05, 'layer1': 309, 'layer2': 246, 'layer3': 458}. Best is trial 130 with value: 0.9107197512148748.

Klebsiella_Pneumoniae | Ceftriaxone | Optuna:  74%|███████▍  | 149/200 [4:47:09<1:37:33, 114.77s/it, best=0.911][A
Klebsiella_Pneumoniae | Ceftriaxone | Optuna:  74%|███████▍  | 149/200 [4:47:09<1:37:33, 114.77s/it, best=0.911][A[I 2026-02-28 01:37:49,065] Trial 175 finished with value: 0.8819709374961487 and parameters: {'activation': 'identity', 'solver': 'adam', 'lr': 0.0010581930282172005, 'layer1': 377, 'layer2': 438, 'layer3': 437}. Best is trial 73 with value: 0.8861579932511299.

Pseudomonas_Aeruginosa | Meropenem | Optuna:  88%|████████▊ | 176/200 [3:33:24<35:24, 88.51s/it, best=0.886][A
Pseudomonas_Aeruginosa | Meropenem | Optuna:  88%|████████▊ | 176/200 [3:33:24<35:24, 88.51s/it, best=0.886][A[I 2026-02-28 01:39:06,947] Trial 176 finished with value: 0.885064264639638 and parameters: {'activation': 'identity', 'solver': 'adam', 'lr': 0.0008754797055295228, 'layer1': 203, 'layer2': 455, 'layer3': 229}. Best is trial 73 with value: 0.8861579932511299.

Pseudomonas_Aeruginosa | Meropenem | Optuna:  88%|████████▊ | 177/200 [3:34:42<32:42, 85.32s/it, best=0.886][A
Pseudomonas_Aeruginosa | Meropenem | Optuna:  88%|████████▊ | 177/200 [3:34:42<32:42, 85.32s/it, best=0.886][A[I 2026-02-28 01:39:10,995] Trial 156 finished with value: 0.8585541372555268 and parameters: {'activation': 'logistic', 'solver': 'adam', 'lr': 0.0004700352761504984, 'layer1': 141, 'layer2': 44, 'layer3': 94}. Best is trial 156 with value: 0.8585541372555268.

Staphylococcus_Aureus | Clindamycin | Optuna:  78%|███████▊  | 157/200 [3:41:12<1:01:36, 85.96s/it, best=0.857][A
Staphylococcus_Aureus | Clindamycin | Optuna:  78%|███████▊  | 157/200 [3:41:12<1:01:36, 85.96s/it, best=0.859][A[I 2026-02-28 01:39:47,174] Trial 149 finished with value: 0.9061053374387086 and parameters: {'activation': 'tanh', 'solver': 'adam', 'lr': 3.045230096611393e-05, 'layer1': 419, 'layer2': 470, 'layer3': 423}. Best is trial 130 with value: 0.9107197512148748.

Klebsiella_Pneumoniae | Ceftriaxone | Optuna:  75%|███████▌  | 150/200 [4:49:08<1:36:47, 116.15s/it, best=0.911][A
Klebsiella_Pneumoniae | Ceftriaxone | Optuna:  75%|███████▌  | 150/200 [4:49:08<1:36:47, 116.15s/it, best=0.911][A[I 2026-02-28 01:40:17,718] Trial 157 finished with value: 0.8536969175866023 and parameters: {'activation': 'logistic', 'solver': 'adam', 'lr': 0.0007715854844797804, 'layer1': 161, 'layer2': 44, 'layer3': 108}. Best is trial 156 with value: 0.8585541372555268.

Staphylococcus_Aureus | Clindamycin | Optuna:  79%|███████▉  | 158/200 [3:42:19<56:07, 80.19s/it, best=0.859]  [A
Staphylococcus_Aureus | Clindamycin | Optuna:  79%|███████▉  | 158/200 [3:42:19<56:07, 80.19s/it, best=0.859][A[I 2026-02-28 01:40:32,482] Trial 62 finished with value: 0.8946609875398647 and parameters: {'activation': 'relu', 'solver': 'adam', 'lr': 1.8174365608795252e-05, 'layer1': 431, 'layer2': 212, 'layer3': 154}. Best is trial 14 with value: 0.8971256036318559.

Escherichia_Coli | Ceftriaxone | Optuna:  32%|███▏      | 63/200 [2:30:33<7:30:39, 197.37s/it, best=0.897][A
Escherichia_Coli | Ceftriaxone | Optuna:  32%|███▏      | 63/200 [2:30:33<7:30:39, 197.37s/it, best=0.897][A[I 2026-02-28 01:40:33,589] Trial 177 finished with value: 0.8814767088406512 and parameters: {'activation': 'identity', 'solver': 'adam', 'lr': 0.000833190431994142, 'layer1': 340, 'layer2': 458, 'layer3': 247}. Best is trial 73 with value: 0.8861579932511299.

Pseudomonas_Aeruginosa | Meropenem | Optuna:  89%|████████▉ | 178/200 [3:36:08<31:25, 85.72s/it, best=0.886][A
Pseudomonas_Aeruginosa | Meropenem | Optuna:  89%|████████▉ | 178/200 [3:36:08<31:25, 85.72s/it, best=0.886][A[I 2026-02-28 01:41:23,283] Trial 158 finished with value: 0.8444319191139819 and parameters: {'activation': 'logistic', 'solver': 'adam', 'lr': 0.0013571258226407952, 'layer1': 146, 'layer2': 23, 'layer3': 117}. Best is trial 156 with value: 0.8585541372555268.

Staphylococcus_Aureus | Clindamycin | Optuna:  80%|███████▉  | 159/200 [3:43:24<51:47, 75.80s/it, best=0.859][A
Staphylococcus_Aureus | Clindamycin | Optuna:  80%|███████▉  | 159/200 [3:43:24<51:47, 75.80s/it, best=0.859][A[I 2026-02-28 01:41:33,981] Trial 178 finished with value: 0.8849091103668385 and parameters: {'activation': 'identity', 'solver': 'adam', 'lr': 0.0012229102786160528, 'layer1': 144, 'layer2': 440, 'layer3': 227}. Best is trial 73 with value: 0.8861579932511299.

Pseudomonas_Aeruginosa | Meropenem | Optuna:  90%|████████▉ | 179/200 [3:37:09<27:20, 78.12s/it, best=0.886][A
Pseudomonas_Aeruginosa | Meropenem | Optuna:  90%|████████▉ | 179/200 [3:37:09<27:20, 78.12s/it, best=0.886][A[I 2026-02-28 01:42:01,639] Trial 179 finished with value: 0.846287984809279 and parameters: {'activation': 'tanh', 'solver': 'sgd', 'lr': 0.0018659238050795462, 'layer1': 148, 'layer2': 429, 'layer3': 232}. Best is trial 73 with value: 0.8861579932511299.

Pseudomonas_Aeruginosa | Meropenem | Optuna:  90%|█████████ | 180/200 [3:37:36<20:59, 62.98s/it, best=0.886][A
Pseudomonas_Aeruginosa | Meropenem | Optuna:  90%|█████████ | 180/200 [3:37:36<20:59, 62.98s/it, best=0.886][A[I 2026-02-28 01:42:08,474] Trial 150 finished with value: 0.9075388449480389 and parameters: {'activation': 'tanh', 'solver': 'adam', 'lr': 2.30768475333117e-05, 'layer1': 287, 'layer2': 441, 'layer3': 466}. Best is trial 130 with value: 0.9107197512148748.

Klebsiella_Pneumoniae | Ceftriaxone | Optuna:  76%|███████▌  | 151/200 [4:51:30<1:41:00, 123.69s/it, best=0.911][A
Klebsiella_Pneumoniae | Ceftriaxone | Optuna:  76%|███████▌  | 151/200 [4:51:30<1:41:00, 123.69s/it, best=0.911][A[I 2026-02-28 01:42:32,161] Trial 159 finished with value: 0.852764252759545 and parameters: {'activation': 'logistic', 'solver': 'adam', 'lr': 0.0005454726047755659, 'layer1': 190, 'layer2': 34, 'layer3': 138}. Best is trial 156 with value: 0.8585541372555268.

Staphylococcus_Aureus | Clindamycin | Optuna:  80%|████████  | 160/200 [3:44:33<49:08, 73.72s/it, best=0.859][A
Staphylococcus_Aureus | Clindamycin | Optuna:  80%|████████  | 160/200 [3:44:33<49:08, 73.72s/it, best=0.859][A[I 2026-02-28 01:42:45,987] Trial 63 finished with value: 0.8961969923885343 and parameters: {'activation': 'relu', 'solver': 'adam', 'lr': 0.00015670446172115547, 'layer1': 460, 'layer2': 138, 'layer3': 98}. Best is trial 14 with value: 0.8971256036318559.

Escherichia_Coli | Ceftriaxone | Optuna:  32%|███▏      | 64/200 [2:32:47<6:43:56, 178.21s/it, best=0.897][A
Escherichia_Coli | Ceftriaxone | Optuna:  32%|███▏      | 64/200 [2:32:47<6:43:56, 178.21s/it, best=0.897][A[I 2026-02-28 01:43:16,033] Trial 180 finished with value: 0.8828247098263571 and parameters: {'activation': 'identity', 'solver': 'adam', 'lr': 0.0011725834004834607, 'layer1': 183, 'layer2': 449, 'layer3': 213}. Best is trial 73 with value: 0.8861579932511299.

Pseudomonas_Aeruginosa | Meropenem | Optuna:  90%|█████████ | 181/200 [3:38:51<21:01, 66.40s/it, best=0.886][A
Pseudomonas_Aeruginosa | Meropenem | Optuna:  90%|█████████ | 181/200 [3:38:51<21:01, 66.40s/it, best=0.886][A[I 2026-02-28 01:43:43,241] Trial 160 finished with value: 0.8513588314912877 and parameters: {'activation': 'logistic', 'solver': 'adam', 'lr': 0.0010255466255327588, 'layer1': 137, 'layer2': 49, 'layer3': 160}. Best is trial 156 with value: 0.8585541372555268.

Staphylococcus_Aureus | Clindamycin | Optuna:  80%|████████  | 161/200 [3:45:44<47:24, 72.93s/it, best=0.859][A
Staphylococcus_Aureus | Clindamycin | Optuna:  80%|████████  | 161/200 [3:45:44<47:24, 72.93s/it, best=0.859][A[I 2026-02-28 01:44:00,793] Trial 151 finished with value: 0.9056538993501443 and parameters: {'activation': 'tanh', 'solver': 'adam', 'lr': 2.1046527266642773e-05, 'layer1': 282, 'layer2': 449, 'layer3': 471}. Best is trial 130 with value: 0.9107197512148748.

Klebsiella_Pneumoniae | Ceftriaxone | Optuna:  76%|███████▌  | 152/200 [4:53:22<1:36:13, 120.28s/it, best=0.911][A
Klebsiella_Pneumoniae | Ceftriaxone | Optuna:  76%|███████▌  | 152/200 [4:53:22<1:36:13, 120.28s/it, best=0.911][A[I 2026-02-28 01:44:23,117] Trial 181 finished with value: 0.8809631003651957 and parameters: {'activation': 'identity', 'solver': 'adam', 'lr': 0.0015194825559367575, 'layer1': 159, 'layer2': 437, 'layer3': 267}. Best is trial 73 with value: 0.8861579932511299.

Pseudomonas_Aeruginosa | Meropenem | Optuna:  91%|█████████ | 182/200 [3:39:58<19:58, 66.61s/it, best=0.886][A
Pseudomonas_Aeruginosa | Meropenem | Optuna:  91%|█████████ | 182/200 [3:39:58<19:58, 66.61s/it, best=0.886][A[I 2026-02-28 01:44:27,669] Trial 161 finished with value: 0.8044631175067242 and parameters: {'activation': 'logistic', 'solver': 'adam', 'lr': 0.00043912475022025863, 'layer1': 167, 'layer2': 10, 'layer3': 91}. Best is trial 156 with value: 0.8585541372555268.

Staphylococcus_Aureus | Clindamycin | Optuna:  81%|████████  | 162/200 [3:46:29<40:46, 64.38s/it, best=0.859][A
Staphylococcus_Aureus | Clindamycin | Optuna:  81%|████████  | 162/200 [3:46:29<40:46, 64.38s/it, best=0.859][A[I 2026-02-28 01:44:55,986] Trial 64 finished with value: 0.8944226645592647 and parameters: {'activation': 'relu', 'solver': 'adam', 'lr': 0.00014925161394918407, 'layer1': 481, 'layer2': 140, 'layer3': 187}. Best is trial 14 with value: 0.8971256036318559.

Escherichia_Coli | Ceftriaxone | Optuna:  32%|███▎      | 65/200 [2:34:57<6:08:25, 163.75s/it, best=0.897][A
Escherichia_Coli | Ceftriaxone | Optuna:  32%|███▎      | 65/200 [2:34:57<6:08:25, 163.75s/it, best=0.897][A[I 2026-02-28 01:45:30,308] Trial 182 finished with value: 0.8840918986409603 and parameters: {'activation': 'identity', 'solver': 'adam', 'lr': 0.0009436916233831163, 'layer1': 174, 'layer2': 451, 'layer3': 226}. Best is trial 73 with value: 0.8861579932511299.

Pseudomonas_Aeruginosa | Meropenem | Optuna:  92%|█████████▏| 183/200 [3:41:05<18:55, 66.78s/it, best=0.886][A
Pseudomonas_Aeruginosa | Meropenem | Optuna:  92%|█████████▏| 183/200 [3:41:05<18:55, 66.78s/it, best=0.886][A[I 2026-02-28 01:45:30,442] Trial 162 finished with value: 0.8432572122666864 and parameters: {'activation': 'tanh', 'solver': 'adam', 'lr': 0.0004942136699113172, 'layer1': 152, 'layer2': 58, 'layer3': 97}. Best is trial 156 with value: 0.8585541372555268.

Staphylococcus_Aureus | Clindamycin | Optuna:  82%|████████▏ | 163/200 [3:47:32<39:24, 63.90s/it, best=0.859][A
Staphylococcus_Aureus | Clindamycin | Optuna:  82%|████████▏ | 163/200 [3:47:32<39:24, 63.90s/it, best=0.859][A[I 2026-02-28 01:45:57,828] Trial 152 finished with value: 0.906961163309884 and parameters: {'activation': 'tanh', 'solver': 'adam', 'lr': 2.4297395821423308e-05, 'layer1': 298, 'layer2': 437, 'layer3': 440}. Best is trial 130 with value: 0.9107197512148748.

Klebsiella_Pneumoniae | Ceftriaxone | Optuna:  76%|███████▋  | 153/200 [4:55:19<1:33:27, 119.31s/it, best=0.911][A
Klebsiella_Pneumoniae | Ceftriaxone | Optuna:  76%|███████▋  | 153/200 [4:55:19<1:33:27, 119.31s/it, best=0.911][A[I 2026-02-28 01:46:40,749] Trial 183 finished with value: 0.8829826367940019 and parameters: {'activation': 'identity', 'solver': 'adam', 'lr': 0.000681134402596489, 'layer1': 220, 'layer2': 418, 'layer3': 239}. Best is trial 73 with value: 0.8861579932511299.

Pseudomonas_Aeruginosa | Meropenem | Optuna:  92%|█████████▏| 184/200 [3:42:15<18:06, 67.88s/it, best=0.886][A
Pseudomonas_Aeruginosa | Meropenem | Optuna:  92%|█████████▏| 184/200 [3:42:15<18:06, 67.88s/it, best=0.886][A[I 2026-02-28 01:47:07,236] Trial 163 finished with value: 0.8551553715547258 and parameters: {'activation': 'logistic', 'solver': 'adam', 'lr': 0.0006331612118491175, 'layer1': 206, 'layer2': 28, 'layer3': 86}. Best is trial 156 with value: 0.8585541372555268.

Staphylococcus_Aureus | Clindamycin | Optuna:  82%|████████▏ | 164/200 [3:49:08<44:15, 73.77s/it, best=0.859][A
Staphylococcus_Aureus | Clindamycin | Optuna:  82%|████████▏ | 164/200 [3:49:08<44:15, 73.77s/it, best=0.859][A[I 2026-02-28 01:47:15,821] Trial 65 finished with value: 0.8946573055545359 and parameters: {'activation': 'relu', 'solver': 'adam', 'lr': 9.641818158796435e-05, 'layer1': 418, 'layer2': 265, 'layer3': 137}. Best is trial 14 with value: 0.8971256036318559.

Escherichia_Coli | Ceftriaxone | Optuna:  33%|███▎      | 66/200 [2:37:17<5:49:40, 156.57s/it, best=0.897][A
Escherichia_Coli | Ceftriaxone | Optuna:  33%|███▎      | 66/200 [2:37:17<5:49:40, 156.57s/it, best=0.897][A[I 2026-02-28 01:47:41,949] Trial 184 finished with value: 0.8823758534925418 and parameters: {'activation': 'identity', 'solver': 'adam', 'lr': 0.0013068923108124587, 'layer1': 144, 'layer2': 390, 'layer3': 452}. Best is trial 73 with value: 0.8861579932511299.

Pseudomonas_Aeruginosa | Meropenem | Optuna:  92%|█████████▎| 185/200 [3:43:17<16:28, 65.88s/it, best=0.886][A
Pseudomonas_Aeruginosa | Meropenem | Optuna:  92%|█████████▎| 185/200 [3:43:17<16:28, 65.88s/it, best=0.886][A[I 2026-02-28 01:48:26,500] Trial 164 finished with value: 0.855023127593272 and parameters: {'activation': 'logistic', 'solver': 'adam', 'lr': 0.0007164347380215458, 'layer1': 208, 'layer2': 21, 'layer3': 83}. Best is trial 156 with value: 0.8585541372555268.

Staphylococcus_Aureus | Clindamycin | Optuna:  82%|████████▎ | 165/200 [3:50:28<43:59, 75.42s/it, best=0.859][A
Staphylococcus_Aureus | Clindamycin | Optuna:  82%|████████▎ | 165/200 [3:50:28<43:59, 75.42s/it, best=0.859][A[I 2026-02-28 01:48:45,407] Trial 185 finished with value: 0.8841843328562596 and parameters: {'activation': 'identity', 'solver': 'adam', 'lr': 0.0008421513823412164, 'layer1': 118, 'layer2': 472, 'layer3': 251}. Best is trial 73 with value: 0.8861579932511299.

Pseudomonas_Aeruginosa | Meropenem | Optuna:  93%|█████████▎| 186/200 [3:44:20<15:12, 65.15s/it, best=0.886][A
Pseudomonas_Aeruginosa | Meropenem | Optuna:  93%|█████████▎| 186/200 [3:44:20<15:12, 65.15s/it, best=0.886][A[I 2026-02-28 01:49:11,414] Trial 66 finished with value: 0.887508345131665 and parameters: {'activation': 'tanh', 'solver': 'adam', 'lr': 5.95377716802731e-05, 'layer1': 450, 'layer2': 235, 'layer3': 95}. Best is trial 14 with value: 0.8971256036318559.

Escherichia_Coli | Ceftriaxone | Optuna:  34%|███▎      | 67/200 [2:39:12<5:19:49, 144.28s/it, best=0.897][A
Escherichia_Coli | Ceftriaxone | Optuna:  34%|███▎      | 67/200 [2:39:12<5:19:49, 144.28s/it, best=0.897][A[I 2026-02-28 01:49:12,636] Trial 153 finished with value: 0.90866343713944 and parameters: {'activation': 'tanh', 'solver': 'adam', 'lr': 1.7745965491162483e-05, 'layer1': 407, 'layer2': 476, 'layer3': 455}. Best is trial 130 with value: 0.9107197512148748.

Klebsiella_Pneumoniae | Ceftriaxone | Optuna:  77%|███████▋  | 154/200 [4:58:34<1:48:50, 141.96s/it, best=0.911][A
Klebsiella_Pneumoniae | Ceftriaxone | Optuna:  77%|███████▋  | 154/200 [4:58:34<1:48:50, 141.96s/it, best=0.911][A[I 2026-02-28 01:49:39,632] Trial 186 finished with value: 0.8765700419145579 and parameters: {'activation': 'relu', 'solver': 'adam', 'lr': 0.0011992574505993111, 'layer1': 111, 'layer2': 454, 'layer3': 191}. Best is trial 73 with value: 0.8861579932511299.

Pseudomonas_Aeruginosa | Meropenem | Optuna:  94%|█████████▎| 187/200 [3:45:14<13:24, 61.87s/it, best=0.886][A
Pseudomonas_Aeruginosa | Meropenem | Optuna:  94%|█████████▎| 187/200 [3:45:14<13:24, 61.87s/it, best=0.886][A[I 2026-02-28 01:49:59,827] Trial 165 finished with value: 0.8559517155966008 and parameters: {'activation': 'logistic', 'solver': 'adam', 'lr': 0.0005899595449668096, 'layer1': 238, 'layer2': 39, 'layer3': 115}. Best is trial 156 with value: 0.8585541372555268.

Staphylococcus_Aureus | Clindamycin | Optuna:  83%|████████▎ | 166/200 [3:52:01<45:46, 80.79s/it, best=0.859][A
Staphylococcus_Aureus | Clindamycin | Optuna:  83%|████████▎ | 166/200 [3:52:01<45:46, 80.79s/it, best=0.859][A[I 2026-02-28 01:50:06,570] Trial 187 finished with value: 0.8475368129923032 and parameters: {'activation': 'identity', 'solver': 'adam', 'lr': 1.4261161643142555e-05, 'layer1': 204, 'layer2': 408, 'layer3': 229}. Best is trial 73 with value: 0.8861579932511299.

Pseudomonas_Aeruginosa | Meropenem | Optuna:  94%|█████████▍| 188/200 [3:45:41<10:16, 51.39s/it, best=0.886][A
Pseudomonas_Aeruginosa | Meropenem | Optuna:  94%|█████████▍| 188/200 [3:45:41<10:16, 51.39s/it, best=0.886][A[I 2026-02-28 01:51:09,754] Trial 154 finished with value: 0.9056733385308716 and parameters: {'activation': 'tanh', 'solver': 'adam', 'lr': 3.593955605023738e-05, 'layer1': 322, 'layer2': 475, 'layer3': 454}. Best is trial 130 with value: 0.9107197512148748.

Klebsiella_Pneumoniae | Ceftriaxone | Optuna:  78%|███████▊  | 155/200 [5:00:31<1:40:52, 134.51s/it, best=0.911][A
Klebsiella_Pneumoniae | Ceftriaxone | Optuna:  78%|███████▊  | 155/200 [5:00:31<1:40:52, 134.51s/it, best=0.911][A[I 2026-02-28 01:51:19,417] Trial 188 finished with value: 0.8825523782243068 and parameters: {'activation': 'identity', 'solver': 'adam', 'lr': 0.0006283795339852452, 'layer1': 164, 'layer2': 444, 'layer3': 480}. Best is trial 73 with value: 0.8861579932511299.

Pseudomonas_Aeruginosa | Meropenem | Optuna:  94%|█████████▍| 189/200 [3:46:54<10:36, 57.83s/it, best=0.886][A
Pseudomonas_Aeruginosa | Meropenem | Optuna:  94%|█████████▍| 189/200 [3:46:54<10:36, 57.83s/it, best=0.886][A[I 2026-02-28 01:51:28,530] Trial 166 finished with value: 0.8520677206910203 and parameters: {'activation': 'logistic', 'solver': 'adam', 'lr': 0.0006046048772173097, 'layer1': 235, 'layer2': 44, 'layer3': 115}. Best is trial 156 with value: 0.8585541372555268.

Staphylococcus_Aureus | Clindamycin | Optuna:  84%|████████▎ | 167/200 [3:53:30<45:44, 83.16s/it, best=0.859][A
Staphylococcus_Aureus | Clindamycin | Optuna:  84%|████████▎ | 167/200 [3:53:30<45:44, 83.16s/it, best=0.859][A[I 2026-02-28 01:52:31,767] Trial 189 finished with value: 0.8821298181824879 and parameters: {'activation': 'identity', 'solver': 'adam', 'lr': 0.00028088088346174973, 'layer1': 232, 'layer2': 429, 'layer3': 494}. Best is trial 73 with value: 0.8861579932511299.

Pseudomonas_Aeruginosa | Meropenem | Optuna:  95%|█████████▌| 190/200 [3:48:06<10:21, 62.19s/it, best=0.886][A
Pseudomonas_Aeruginosa | Meropenem | Optuna:  95%|█████████▌| 190/200 [3:48:06<10:21, 62.19s/it, best=0.886][A[I 2026-02-28 01:52:43,859] Trial 67 finished with value: 0.8960538745831542 and parameters: {'activation': 'relu', 'solver': 'adam', 'lr': 3.3022341533956684e-05, 'layer1': 500, 'layer2': 317, 'layer3': 20}. Best is trial 14 with value: 0.8971256036318559.

Escherichia_Coli | Ceftriaxone | Optuna:  34%|███▍      | 68/200 [2:42:45<6:02:24, 164.73s/it, best=0.897][A
