Staphylococcus_Aureus | DirectMulti | Optuna:  59%|█████▉    | 118/200 [4:07:56<2:17:08, 100.35s/it, best=0.888]Staphylococcus_Aureus | DirectMulti | Optuna:  59%|█████▉    | 118/200 [4:07:56<2:17:08, 100.35s/it, best=0.888][I 2026-02-28 18:38:07,697] Trial 121 finished with value: 0.8859763136972351 and parameters: {'activation': 'relu', 'solver': 'adam', 'lr': 0.0001270762881156925, 'layer1': 278, 'layer2': 387, 'layer3': 203}. Best is trial 84 with value: 0.8915097750553358.

Escherichia_Coli | Cefepime | Optuna:  61%|██████    | 122/200 [3:40:32<2:14:16, 103.29s/it, best=0.891][A
Escherichia_Coli | Cefepime | Optuna:  61%|██████    | 122/200 [3:40:32<2:14:16, 103.29s/it, best=0.891][A[I 2026-02-28 18:39:22,632] Trial 122 finished with value: 0.8879246263906075 and parameters: {'activation': 'relu', 'solver': 'adam', 'lr': 0.00018615379848130505, 'layer1': 480, 'layer2': 367, 'layer3': 224}. Best is trial 84 with value: 0.8915097750553358.

Escherichia_Coli | Cefepime | Optuna:  62%|██████▏   | 123/200 [3:41:47<2:01:38, 94.79s/it, best=0.891] [A
Escherichia_Coli | Cefepime | Optuna:  62%|██████▏   | 123/200 [3:41:47<2:01:38, 94.79s/it, best=0.891][A[I 2026-02-28 18:39:43,070] Trial 118 finished with value: 0.885050862425171 and parameters: {'activation': 'identity', 'solver': 'adam', 'lr': 0.0001646541455904392, 'layer1': 307, 'layer2': 397, 'layer3': 84}. Best is trial 72 with value: 0.8879714231951876.
Staphylococcus_Aureus | DirectMulti | Optuna:  60%|█████▉    | 119/200 [4:09:48<2:20:21, 103.97s/it, best=0.888]Staphylococcus_Aureus | DirectMulti | Optuna:  60%|█████▉    | 119/200 [4:09:48<2:20:21, 103.97s/it, best=0.888][I 2026-02-28 18:40:42,613] Trial 123 finished with value: 0.8896174725921098 and parameters: {'activation': 'relu', 'solver': 'adam', 'lr': 0.00014668663500794178, 'layer1': 454, 'layer2': 287, 'layer3': 193}. Best is trial 84 with value: 0.8915097750553358.

Escherichia_Coli | Cefepime | Optuna:  62%|██████▏   | 124/200 [3:43:07<1:54:26, 90.34s/it, best=0.891][A
Escherichia_Coli | Cefepime | Optuna:  62%|██████▏   | 124/200 [3:43:07<1:54:26, 90.34s/it, best=0.891][A[I 2026-02-28 18:41:19,342] Trial 119 finished with value: 0.8848316598441782 and parameters: {'activation': 'relu', 'solver': 'adam', 'lr': 0.00012889705091405154, 'layer1': 142, 'layer2': 432, 'layer3': 71}. Best is trial 72 with value: 0.8879714231951876.
Staphylococcus_Aureus | DirectMulti | Optuna:  60%|██████    | 120/200 [4:11:24<2:15:33, 101.66s/it, best=0.888]Staphylococcus_Aureus | DirectMulti | Optuna:  60%|██████    | 120/200 [4:11:24<2:15:33, 101.66s/it, best=0.888][I 2026-02-28 18:42:10,061] Trial 120 finished with value: 0.8032572372822868 and parameters: {'activation': 'relu', 'solver': 'sgd', 'lr': 0.00019910402462584997, 'layer1': 112, 'layer2': 390, 'layer3': 121}. Best is trial 72 with value: 0.8879714231951876.
Staphylococcus_Aureus | DirectMulti | Optuna:  60%|██████    | 121/200 [4:12:15<1:53:44, 86.38s/it, best=0.888] Staphylococcus_Aureus | DirectMulti | Optuna:  60%|██████    | 121/200 [4:12:15<1:53:44, 86.38s/it, best=0.888][I 2026-02-28 18:42:37,168] Trial 124 finished with value: 0.8878559115091766 and parameters: {'activation': 'relu', 'solver': 'adam', 'lr': 9.012700024339288e-05, 'layer1': 466, 'layer2': 301, 'layer3': 238}. Best is trial 84 with value: 0.8915097750553358.

Escherichia_Coli | Cefepime | Optuna:  62%|██████▎   | 125/200 [3:45:01<2:02:00, 97.61s/it, best=0.891][A
Escherichia_Coli | Cefepime | Optuna:  62%|██████▎   | 125/200 [3:45:01<2:02:00, 97.61s/it, best=0.891][A[I 2026-02-28 18:43:20,113] Trial 121 finished with value: 0.8866258531191006 and parameters: {'activation': 'relu', 'solver': 'adam', 'lr': 0.00037921297384202566, 'layer1': 259, 'layer2': 369, 'layer3': 55}. Best is trial 72 with value: 0.8879714231951876.
Staphylococcus_Aureus | DirectMulti | Optuna:  61%|██████    | 122/200 [4:13:25<1:45:55, 81.48s/it, best=0.888]Staphylococcus_Aureus | DirectMulti | Optuna:  61%|██████    | 122/200 [4:13:25<1:45:55, 81.48s/it, best=0.888][I 2026-02-28 18:44:33,541] Trial 125 finished with value: 0.8910458079242449 and parameters: {'activation': 'relu', 'solver': 'adam', 'lr': 7.057813906522274e-05, 'layer1': 494, 'layer2': 354, 'layer3': 166}. Best is trial 84 with value: 0.8915097750553358.

Escherichia_Coli | Cefepime | Optuna:  63%|██████▎   | 126/200 [3:46:58<2:07:19, 103.24s/it, best=0.891][A
Escherichia_Coli | Cefepime | Optuna:  63%|██████▎   | 126/200 [3:46:58<2:07:19, 103.24s/it, best=0.891][A[I 2026-02-28 18:44:48,429] Trial 122 finished with value: 0.8865565606511213 and parameters: {'activation': 'relu', 'solver': 'adam', 'lr': 0.00014652428845430692, 'layer1': 219, 'layer2': 374, 'layer3': 92}. Best is trial 72 with value: 0.8879714231951876.
Staphylococcus_Aureus | DirectMulti | Optuna:  62%|██████▏   | 123/200 [4:14:53<1:47:11, 83.53s/it, best=0.888]Staphylococcus_Aureus | DirectMulti | Optuna:  62%|██████▏   | 123/200 [4:14:53<1:47:11, 83.53s/it, best=0.888][I 2026-02-28 18:46:13,460] Trial 126 finished with value: 0.8895745013074876 and parameters: {'activation': 'relu', 'solver': 'adam', 'lr': 6.117643321390584e-05, 'layer1': 432, 'layer2': 351, 'layer3': 138}. Best is trial 84 with value: 0.8915097750553358.

Escherichia_Coli | Cefepime | Optuna:  64%|██████▎   | 127/200 [3:48:38<2:04:23, 102.24s/it, best=0.891][A
Escherichia_Coli | Cefepime | Optuna:  64%|██████▎   | 127/200 [3:48:38<2:04:23, 102.24s/it, best=0.891][A[I 2026-02-28 18:46:30,251] Trial 123 finished with value: 0.8879466710103932 and parameters: {'activation': 'relu', 'solver': 'adam', 'lr': 0.0001442108075197086, 'layer1': 226, 'layer2': 403, 'layer3': 86}. Best is trial 72 with value: 0.8879714231951876.
Staphylococcus_Aureus | DirectMulti | Optuna:  62%|██████▏   | 124/200 [4:16:35<1:52:45, 89.02s/it, best=0.888]Staphylococcus_Aureus | DirectMulti | Optuna:  62%|██████▏   | 124/200 [4:16:35<1:52:45, 89.02s/it, best=0.888][I 2026-02-28 18:48:09,582] Trial 127 finished with value: 0.8870460132145185 and parameters: {'activation': 'relu', 'solver': 'adam', 'lr': 3.953764913097726e-05, 'layer1': 347, 'layer2': 331, 'layer3': 164}. Best is trial 84 with value: 0.8915097750553358.

Escherichia_Coli | Cefepime | Optuna:  64%|██████▍   | 128/200 [3:50:34<2:07:41, 106.41s/it, best=0.891][A
Escherichia_Coli | Cefepime | Optuna:  64%|██████▍   | 128/200 [3:50:34<2:07:41, 106.41s/it, best=0.891][A[I 2026-02-28 18:49:05,717] Trial 124 finished with value: 0.888417570872028 and parameters: {'activation': 'relu', 'solver': 'adam', 'lr': 5.760272639412402e-05, 'layer1': 259, 'layer2': 403, 'layer3': 58}. Best is trial 124 with value: 0.888417570872028.
Staphylococcus_Aureus | DirectMulti | Optuna:  62%|██████▎   | 125/200 [4:19:11<2:16:11, 108.95s/it, best=0.888]Staphylococcus_Aureus | DirectMulti | Optuna:  62%|██████▎   | 125/200 [4:19:11<2:16:11, 108.95s/it, best=0.888][I 2026-02-28 18:50:01,783] Trial 128 finished with value: 0.8784227660757014 and parameters: {'activation': 'relu', 'solver': 'adam', 'lr': 0.005872563386787133, 'layer1': 493, 'layer2': 379, 'layer3': 173}. Best is trial 84 with value: 0.8915097750553358.

Escherichia_Coli | Cefepime | Optuna:  64%|██████▍   | 129/200 [3:52:26<2:07:58, 108.14s/it, best=0.891][A
Escherichia_Coli | Cefepime | Optuna:  64%|██████▍   | 129/200 [3:52:26<2:07:58, 108.14s/it, best=0.891][A[I 2026-02-28 18:51:11,129] Trial 125 finished with value: 0.8869873543014943 and parameters: {'activation': 'relu', 'solver': 'adam', 'lr': 9.191889668431316e-05, 'layer1': 260, 'layer2': 403, 'layer3': 146}. Best is trial 124 with value: 0.888417570872028.
Staphylococcus_Aureus | DirectMulti | Optuna:  63%|██████▎   | 126/200 [4:21:16<2:20:27, 113.89s/it, best=0.888]Staphylococcus_Aureus | DirectMulti | Optuna:  63%|██████▎   | 126/200 [4:21:16<2:20:27, 113.89s/it, best=0.888][I 2026-02-28 18:51:46,456] Trial 129 finished with value: 0.890754974949072 and parameters: {'activation': 'relu', 'solver': 'adam', 'lr': 7.231634747510101e-05, 'layer1': 470, 'layer2': 314, 'layer3': 401}. Best is trial 84 with value: 0.8915097750553358.

Escherichia_Coli | Cefepime | Optuna:  65%|██████▌   | 130/200 [3:54:11<2:04:57, 107.10s/it, best=0.891][A
Escherichia_Coli | Cefepime | Optuna:  65%|██████▌   | 130/200 [3:54:11<2:04:57, 107.10s/it, best=0.891][A[I 2026-02-28 18:52:54,776] Trial 126 finished with value: 0.8847280480790986 and parameters: {'activation': 'relu', 'solver': 'adam', 'lr': 9.00145836397347e-05, 'layer1': 239, 'layer2': 401, 'layer3': 149}. Best is trial 124 with value: 0.888417570872028.
Staphylococcus_Aureus | DirectMulti | Optuna:  64%|██████▎   | 127/200 [4:23:00<2:14:49, 110.82s/it, best=0.888]Staphylococcus_Aureus | DirectMulti | Optuna:  64%|██████▎   | 127/200 [4:23:00<2:14:49, 110.82s/it, best=0.888][I 2026-02-28 18:53:08,979] Trial 130 finished with value: 0.8828172028276058 and parameters: {'activation': 'tanh', 'solver': 'adam', 'lr': 7.112864941469563e-05, 'layer1': 443, 'layer2': 311, 'layer3': 444}. Best is trial 84 with value: 0.8915097750553358.

Escherichia_Coli | Cefepime | Optuna:  66%|██████▌   | 131/200 [3:55:33<1:54:41, 99.73s/it, best=0.891] [A
Escherichia_Coli | Cefepime | Optuna:  66%|██████▌   | 131/200 [3:55:33<1:54:41, 99.73s/it, best=0.891][A[I 2026-02-28 18:54:50,338] Trial 131 finished with value: 0.889574667170943 and parameters: {'activation': 'relu', 'solver': 'adam', 'lr': 0.00011193184807090115, 'layer1': 500, 'layer2': 293, 'layer3': 359}. Best is trial 84 with value: 0.8915097750553358.

Escherichia_Coli | Cefepime | Optuna:  66%|██████▌   | 132/200 [3:57:15<1:53:34, 100.22s/it, best=0.891][A
Escherichia_Coli | Cefepime | Optuna:  66%|██████▌   | 132/200 [3:57:15<1:53:34, 100.22s/it, best=0.891][A[I 2026-02-28 18:55:11,144] Trial 127 finished with value: 0.884627385089202 and parameters: {'activation': 'identity', 'solver': 'adam', 'lr': 4.9960565739789626e-05, 'layer1': 269, 'layer2': 423, 'layer3': 113}. Best is trial 124 with value: 0.888417570872028.
Staphylococcus_Aureus | DirectMulti | Optuna:  64%|██████▍   | 128/200 [4:25:16<2:22:10, 118.48s/it, best=0.888]Staphylococcus_Aureus | DirectMulti | Optuna:  64%|██████▍   | 128/200 [4:25:16<2:22:10, 118.48s/it, best=0.888][I 2026-02-28 18:56:45,894] Trial 132 finished with value: 0.8883976864401205 and parameters: {'activation': 'relu', 'solver': 'adam', 'lr': 7.589279736265635e-05, 'layer1': 470, 'layer2': 322, 'layer3': 329}. Best is trial 84 with value: 0.8915097750553358.

Escherichia_Coli | Cefepime | Optuna:  66%|██████▋   | 133/200 [3:59:10<1:57:02, 104.82s/it, best=0.891][A
Escherichia_Coli | Cefepime | Optuna:  66%|██████▋   | 133/200 [3:59:10<1:57:02, 104.82s/it, best=0.891][A[I 2026-02-28 18:57:32,099] Trial 128 finished with value: 0.8887929505840375 and parameters: {'activation': 'relu', 'solver': 'adam', 'lr': 7.763281381844322e-05, 'layer1': 227, 'layer2': 418, 'layer3': 105}. Best is trial 128 with value: 0.8887929505840375.
Staphylococcus_Aureus | DirectMulti | Optuna:  64%|██████▍   | 129/200 [4:27:37<2:28:10, 125.22s/it, best=0.888]Staphylococcus_Aureus | DirectMulti | Optuna:  64%|██████▍   | 129/200 [4:27:37<2:28:10, 125.22s/it, best=0.889][I 2026-02-28 18:58:40,807] Trial 133 finished with value: 0.8903141342186489 and parameters: {'activation': 'relu', 'solver': 'adam', 'lr': 5.8143929659989685e-05, 'layer1': 484, 'layer2': 305, 'layer3': 477}. Best is trial 84 with value: 0.8915097750553358.

Escherichia_Coli | Cefepime | Optuna:  67%|██████▋   | 134/200 [4:01:05<1:58:37, 107.85s/it, best=0.891][A
Escherichia_Coli | Cefepime | Optuna:  67%|██████▋   | 134/200 [4:01:05<1:58:37, 107.85s/it, best=0.891][A[I 2026-02-28 18:59:40,158] Trial 129 finished with value: 0.8859843429722197 and parameters: {'activation': 'relu', 'solver': 'adam', 'lr': 6.108599878211545e-05, 'layer1': 231, 'layer2': 410, 'layer3': 103}. Best is trial 128 with value: 0.8887929505840375.
Staphylococcus_Aureus | DirectMulti | Optuna:  65%|██████▌   | 130/200 [4:29:45<2:27:05, 126.07s/it, best=0.889]Staphylococcus_Aureus | DirectMulti | Optuna:  65%|██████▌   | 130/200 [4:29:45<2:27:05, 126.07s/it, best=0.889][I 2026-02-28 19:01:05,394] Trial 134 finished with value: 0.8908587568033338 and parameters: {'activation': 'relu', 'solver': 'adam', 'lr': 4.459105756733336e-05, 'layer1': 489, 'layer2': 307, 'layer3': 482}. Best is trial 84 with value: 0.8915097750553358.

Escherichia_Coli | Cefepime | Optuna:  68%|██████▊   | 135/200 [4:03:30<2:08:46, 118.87s/it, best=0.891][A
Escherichia_Coli | Cefepime | Optuna:  68%|██████▊   | 135/200 [4:03:30<2:08:46, 118.87s/it, best=0.891][A[I 2026-02-28 19:02:02,430] Trial 130 finished with value: 0.8877733623671155 and parameters: {'activation': 'relu', 'solver': 'adam', 'lr': 7.589816904749226e-05, 'layer1': 293, 'layer2': 441, 'layer3': 299}. Best is trial 128 with value: 0.8887929505840375.
Staphylococcus_Aureus | DirectMulti | Optuna:  66%|██████▌   | 131/200 [4:32:07<2:30:34, 130.93s/it, best=0.889]Staphylococcus_Aureus | DirectMulti | Optuna:  66%|██████▌   | 131/200 [4:32:07<2:30:34, 130.93s/it, best=0.889][I 2026-02-28 19:02:58,425] Trial 135 finished with value: 0.8914020772865332 and parameters: {'activation': 'relu', 'solver': 'adam', 'lr': 5.423661739586868e-05, 'layer1': 491, 'layer2': 351, 'layer3': 490}. Best is trial 84 with value: 0.8915097750553358.

Escherichia_Coli | Cefepime | Optuna:  68%|██████▊   | 136/200 [4:05:23<2:04:55, 117.12s/it, best=0.891][A
Escherichia_Coli | Cefepime | Optuna:  68%|██████▊   | 136/200 [4:05:23<2:04:55, 117.12s/it, best=0.891][A[I 2026-02-28 19:03:49,534] Trial 131 finished with value: 0.882758199132056 and parameters: {'activation': 'relu', 'solver': 'adam', 'lr': 7.160940202334377e-05, 'layer1': 277, 'layer2': 446, 'layer3': 296}. Best is trial 128 with value: 0.8887929505840375.
Staphylococcus_Aureus | DirectMulti | Optuna:  66%|██████▌   | 132/200 [4:33:54<2:20:17, 123.78s/it, best=0.889]Staphylococcus_Aureus | DirectMulti | Optuna:  66%|██████▌   | 132/200 [4:33:54<2:20:17, 123.78s/it, best=0.889][I 2026-02-28 19:04:49,364] Trial 136 finished with value: 0.887191987252591 and parameters: {'activation': 'relu', 'solver': 'adam', 'lr': 9.573732302939166e-05, 'layer1': 487, 'layer2': 357, 'layer3': 490}. Best is trial 84 with value: 0.8915097750553358.

Escherichia_Coli | Cefepime | Optuna:  68%|██████▊   | 137/200 [4:07:14<2:01:01, 115.26s/it, best=0.891][A
Escherichia_Coli | Cefepime | Optuna:  68%|██████▊   | 137/200 [4:07:14<2:01:01, 115.26s/it, best=0.891][A[I 2026-02-28 19:05:57,947] Trial 132 finished with value: 0.8877337612223307 and parameters: {'activation': 'relu', 'solver': 'adam', 'lr': 5.9546515417228695e-05, 'layer1': 298, 'layer2': 427, 'layer3': 267}. Best is trial 128 with value: 0.8887929505840375.
Staphylococcus_Aureus | DirectMulti | Optuna:  66%|██████▋   | 133/200 [4:36:03<2:19:46, 125.17s/it, best=0.889]Staphylococcus_Aureus | DirectMulti | Optuna:  66%|██████▋   | 133/200 [4:36:03<2:19:46, 125.17s/it, best=0.889][I 2026-02-28 19:06:33,124] Trial 137 finished with value: 0.8879280959726537 and parameters: {'activation': 'relu', 'solver': 'adam', 'lr': 4.544428375438734e-05, 'layer1': 312, 'layer2': 343, 'layer3': 478}. Best is trial 84 with value: 0.8915097750553358.

Escherichia_Coli | Cefepime | Optuna:  69%|██████▉   | 138/200 [4:08:57<1:55:32, 111.81s/it, best=0.891][A
Escherichia_Coli | Cefepime | Optuna:  69%|██████▉   | 138/200 [4:08:57<1:55:32, 111.81s/it, best=0.891][A[I 2026-02-28 19:08:04,410] Trial 138 finished with value: 0.8887382101508438 and parameters: {'activation': 'relu', 'solver': 'adam', 'lr': 7.862928393459611e-05, 'layer1': 493, 'layer2': 367, 'layer3': 458}. Best is trial 84 with value: 0.8915097750553358.

Escherichia_Coli | Cefepime | Optuna:  70%|██████▉   | 139/200 [4:10:29<1:47:24, 105.65s/it, best=0.891][A
Escherichia_Coli | Cefepime | Optuna:  70%|██████▉   | 139/200 [4:10:29<1:47:24, 105.65s/it, best=0.891][A[I 2026-02-28 19:08:32,364] Trial 133 finished with value: 0.8848552923248638 and parameters: {'activation': 'relu', 'solver': 'adam', 'lr': 4.350276545889352e-05, 'layer1': 293, 'layer2': 425, 'layer3': 265}. Best is trial 128 with value: 0.8887929505840375.
Staphylococcus_Aureus | DirectMulti | Optuna:  67%|██████▋   | 134/200 [4:38:37<2:27:20, 133.95s/it, best=0.889]Staphylococcus_Aureus | DirectMulti | Optuna:  67%|██████▋   | 134/200 [4:38:37<2:27:20, 133.95s/it, best=0.889][I 2026-02-28 19:09:56,254] Trial 139 finished with value: 0.8896093361185228 and parameters: {'activation': 'relu', 'solver': 'adam', 'lr': 6.250895818880562e-05, 'layer1': 462, 'layer2': 331, 'layer3': 401}. Best is trial 84 with value: 0.8915097750553358.

Escherichia_Coli | Cefepime | Optuna:  70%|███████   | 140/200 [4:12:21<1:47:30, 107.51s/it, best=0.891][A
Escherichia_Coli | Cefepime | Optuna:  70%|███████   | 140/200 [4:12:21<1:47:30, 107.51s/it, best=0.891][A[I 2026-02-28 19:10:21,800] Trial 134 finished with value: 0.8876466309172926 and parameters: {'activation': 'relu', 'solver': 'adam', 'lr': 8.517149835224441e-05, 'layer1': 261, 'layer2': 415, 'layer3': 289}. Best is trial 128 with value: 0.8887929505840375.
Staphylococcus_Aureus | DirectMulti | Optuna:  68%|██████▊   | 135/200 [4:40:27<2:17:08, 126.59s/it, best=0.889]Staphylococcus_Aureus | DirectMulti | Optuna:  68%|██████▊   | 135/200 [4:40:27<2:17:08, 126.59s/it, best=0.889][I 2026-02-28 19:10:44,849] Trial 140 finished with value: 0.7569441412554121 and parameters: {'activation': 'relu', 'solver': 'sgd', 'lr': 4.98751865828569e-05, 'layer1': 500, 'layer2': 316, 'layer3': 483}. Best is trial 84 with value: 0.8915097750553358.

Escherichia_Coli | Cefepime | Optuna:  70%|███████   | 141/200 [4:13:09<1:28:20, 89.84s/it, best=0.891] [A
Escherichia_Coli | Cefepime | Optuna:  70%|███████   | 141/200 [4:13:09<1:28:20, 89.84s/it, best=0.891][A[I 2026-02-28 19:12:24,569] Trial 141 finished with value: 0.8857545721895406 and parameters: {'activation': 'relu', 'solver': 'adam', 'lr': 5.741982300412689e-05, 'layer1': 482, 'layer2': 306, 'layer3': 495}. Best is trial 84 with value: 0.8915097750553358.

Escherichia_Coli | Cefepime | Optuna:  71%|███████   | 142/200 [4:14:49<1:29:42, 92.80s/it, best=0.891][A
Escherichia_Coli | Cefepime | Optuna:  71%|███████   | 142/200 [4:14:49<1:29:42, 92.80s/it, best=0.891][A[I 2026-02-28 19:12:32,372] Trial 135 finished with value: 0.886116547463247 and parameters: {'activation': 'relu', 'solver': 'adam', 'lr': 5.718237466031395e-05, 'layer1': 259, 'layer2': 437, 'layer3': 302}. Best is trial 128 with value: 0.8887929505840375.
Staphylococcus_Aureus | DirectMulti | Optuna:  68%|██████▊   | 136/200 [4:42:37<2:16:18, 127.79s/it, best=0.889]Staphylococcus_Aureus | DirectMulti | Optuna:  68%|██████▊   | 136/200 [4:42:37<2:16:18, 127.79s/it, best=0.889][I 2026-02-28 19:14:40,403] Trial 136 finished with value: 0.8882977733717417 and parameters: {'activation': 'relu', 'solver': 'adam', 'lr': 0.00010150112983204682, 'layer1': 322, 'layer2': 411, 'layer3': 329}. Best is trial 128 with value: 0.8887929505840375.
Staphylococcus_Aureus | DirectMulti | Optuna:  68%|██████▊   | 137/200 [4:44:45<2:14:15, 127.86s/it, best=0.889]Staphylococcus_Aureus | DirectMulti | Optuna:  68%|██████▊   | 137/200 [4:44:45<2:14:15, 127.86s/it, best=0.889][I 2026-02-28 19:14:42,280] Trial 142 finished with value: 0.8880510129920974 and parameters: {'activation': 'relu', 'solver': 'adam', 'lr': 2.688497997094509e-05, 'layer1': 486, 'layer2': 353, 'layer3': 434}. Best is trial 84 with value: 0.8915097750553358.

Escherichia_Coli | Cefepime | Optuna:  72%|███████▏  | 143/200 [4:17:07<1:40:57, 106.27s/it, best=0.891][A
Escherichia_Coli | Cefepime | Optuna:  72%|███████▏  | 143/200 [4:17:07<1:40:57, 106.27s/it, best=0.891][A[I 2026-02-28 19:17:20,813] Trial 143 finished with value: 0.8869723144750301 and parameters: {'activation': 'relu', 'solver': 'adam', 'lr': 3.3868430803595056e-05, 'layer1': 474, 'layer2': 333, 'layer3': 450}. Best is trial 84 with value: 0.8915097750553358.

Escherichia_Coli | Cefepime | Optuna:  72%|███████▏  | 144/200 [4:19:45<1:53:49, 121.95s/it, best=0.891][A
Escherichia_Coli | Cefepime | Optuna:  72%|███████▏  | 144/200 [4:19:45<1:53:49, 121.95s/it, best=0.891][A[I 2026-02-28 19:17:47,841] Trial 137 finished with value: 0.8857795801791222 and parameters: {'activation': 'relu', 'solver': 'adam', 'lr': 3.0160768665186337e-05, 'layer1': 301, 'layer2': 416, 'layer3': 334}. Best is trial 128 with value: 0.8887929505840375.
Staphylococcus_Aureus | DirectMulti | Optuna:  69%|██████▉   | 138/200 [4:47:53<2:30:35, 145.73s/it, best=0.889]Staphylococcus_Aureus | DirectMulti | Optuna:  69%|██████▉   | 138/200 [4:47:53<2:30:35, 145.73s/it, best=0.889][I 2026-02-28 19:19:42,508] Trial 144 finished with value: 0.889146183121098 and parameters: {'activation': 'relu', 'solver': 'adam', 'lr': 0.00011304642923045877, 'layer1': 458, 'layer2': 383, 'layer3': 433}. Best is trial 84 with value: 0.8915097750553358.

Escherichia_Coli | Cefepime | Optuna:  72%|███████▎  | 145/200 [4:22:07<1:57:13, 127.87s/it, best=0.891][A
Escherichia_Coli | Cefepime | Optuna:  72%|███████▎  | 145/200 [4:22:07<1:57:13, 127.87s/it, best=0.891][A[I 2026-02-28 19:19:46,351] Trial 138 finished with value: 0.886000804390369 and parameters: {'activation': 'relu', 'solver': 'adam', 'lr': 8.565533649648011e-05, 'layer1': 321, 'layer2': 405, 'layer3': 351}. Best is trial 128 with value: 0.8887929505840375.
