Klebsiella_Pneumoniae | Meropenem | Optuna:  44%|████▍     | 88/200 [1:17:17<1:52:50, 60.45s/it, best=0.983][A[I 2026-02-28 07:17:07,526] Trial 171 finished with value: 0.9273465827740706 and parameters: {'activation': 'identity', 'solver': 'adam', 'lr': 0.0005312126665302701, 'layer1': 465, 'layer2': 123, 'layer3': 262}. Best is trial 77 with value: 0.9283869597728589.

Staphylococcus_Aureus | Fusidic acid | Optuna:  86%|████████▌ | 172/200 [4:36:16<43:05, 92.33s/it, best=0.928][A
Staphylococcus_Aureus | Fusidic acid | Optuna:  86%|████████▌ | 172/200 [4:36:16<43:05, 92.33s/it, best=0.928][A[I 2026-02-28 07:17:53,329] Trial 13 finished with value: 0.8652354934942956 and parameters: {'activation': 'identity', 'solver': 'adam', 'lr': 0.00025548240574830476, 'layer1': 499, 'layer2': 471, 'layer3': 419}. Best is trial 13 with value: 0.8652354934942956.
Pseudomonas_Aeruginosa | DirectMulti | Optuna:   7%|▋         | 14/200 [21:39<5:01:42, 97.33s/it, best=0.865]Pseudomonas_Aeruginosa | DirectMulti | Optuna:   7%|▋         | 14/200 [21:39<5:01:42, 97.33s/it, best=0.865]/export/usuarios01/egarroyo/MALDI_for_AMR_prediction/venv/lib/python3.13/site-packages/sklearn/model_selection/_split.py:813: UserWarning: The least populated class in y has only 4 members, which is less than n_splits=5.
  warnings.warn(
[I 2026-02-28 07:17:57,597] Trial 88 finished with value: 0.981188453332277 and parameters: {'activation': 'tanh', 'solver': 'adam', 'lr': 0.0003781680934306621, 'layer1': 499, 'layer2': 192, 'layer3': 52}. Best is trial 84 with value: 0.9826162364333169.

Klebsiella_Pneumoniae | Meropenem | Optuna:  44%|████▍     | 89/200 [1:18:38<2:02:44, 66.35s/it, best=0.983][A
Klebsiella_Pneumoniae | Meropenem | Optuna:  44%|████▍     | 89/200 [1:18:38<2:02:44, 66.35s/it, best=0.983][A[I 2026-02-28 07:18:53,331] Trial 184 finished with value: 0.8958478622796229 and parameters: {'activation': 'relu', 'solver': 'adam', 'lr': 3.1357583585023396e-05, 'layer1': 450, 'layer2': 149, 'layer3': 24}. Best is trial 137 with value: 0.8979080367540411.

Escherichia_Coli | Ceftriaxone | Optuna:  92%|█████████▎| 185/200 [8:08:54<52:40, 210.68s/it, best=0.898][A
Escherichia_Coli | Ceftriaxone | Optuna:  92%|█████████▎| 185/200 [8:08:54<52:40, 210.68s/it, best=0.898][A[I 2026-02-28 07:19:08,381] Trial 89 finished with value: 0.9799126991755329 and parameters: {'activation': 'tanh', 'solver': 'adam', 'lr': 0.0004509693549422963, 'layer1': 488, 'layer2': 247, 'layer3': 26}. Best is trial 84 with value: 0.9826162364333169.

Klebsiella_Pneumoniae | Meropenem | Optuna:  45%|████▌     | 90/200 [1:19:48<2:04:04, 67.68s/it, best=0.983][A
Klebsiella_Pneumoniae | Meropenem | Optuna:  45%|████▌     | 90/200 [1:19:48<2:04:04, 67.68s/it, best=0.983][A[I 2026-02-28 07:19:17,766] Trial 172 finished with value: 0.9265290466993783 and parameters: {'activation': 'identity', 'solver': 'adam', 'lr': 0.00010703623358294415, 'layer1': 478, 'layer2': 113, 'layer3': 245}. Best is trial 77 with value: 0.9283869597728589.

Staphylococcus_Aureus | Fusidic acid | Optuna:  86%|████████▋ | 173/200 [4:38:26<46:39, 103.70s/it, best=0.928][A
Staphylococcus_Aureus | Fusidic acid | Optuna:  86%|████████▋ | 173/200 [4:38:26<46:39, 103.70s/it, best=0.928][A[I 2026-02-28 07:19:45,166] Trial 14 finished with value: 0.8636372580693775 and parameters: {'activation': 'identity', 'solver': 'adam', 'lr': 0.0001289657517138117, 'layer1': 499, 'layer2': 394, 'layer3': 396}. Best is trial 13 with value: 0.8652354934942956.
Pseudomonas_Aeruginosa | DirectMulti | Optuna:   8%|▊         | 15/200 [23:31<5:13:34, 101.70s/it, best=0.865]Pseudomonas_Aeruginosa | DirectMulti | Optuna:   8%|▊         | 15/200 [23:31<5:13:34, 101.70s/it, best=0.865]/export/usuarios01/egarroyo/MALDI_for_AMR_prediction/venv/lib/python3.13/site-packages/sklearn/model_selection/_split.py:813: UserWarning: The least populated class in y has only 4 members, which is less than n_splits=5.
  warnings.warn(
[I 2026-02-28 07:20:24,318] Trial 90 finished with value: 0.9829493056230765 and parameters: {'activation': 'tanh', 'solver': 'adam', 'lr': 0.0009378582603998848, 'layer1': 437, 'layer2': 304, 'layer3': 97}. Best is trial 90 with value: 0.9829493056230765.

Klebsiella_Pneumoniae | Meropenem | Optuna:  46%|████▌     | 91/200 [1:21:04<2:07:27, 70.16s/it, best=0.983][A
Klebsiella_Pneumoniae | Meropenem | Optuna:  46%|████▌     | 91/200 [1:21:04<2:07:27, 70.16s/it, best=0.983][A[I 2026-02-28 07:21:04,051] Trial 173 finished with value: 0.9259163559513361 and parameters: {'activation': 'identity', 'solver': 'adam', 'lr': 0.00014362006291508133, 'layer1': 389, 'layer2': 132, 'layer3': 196}. Best is trial 77 with value: 0.9283869597728589.

Staphylococcus_Aureus | Fusidic acid | Optuna:  87%|████████▋ | 174/200 [4:40:13<45:16, 104.48s/it, best=0.928][A
Staphylococcus_Aureus | Fusidic acid | Optuna:  87%|████████▋ | 174/200 [4:40:13<45:16, 104.48s/it, best=0.928][A[I 2026-02-28 07:21:21,357] Trial 91 finished with value: 0.9796354992343635 and parameters: {'activation': 'tanh', 'solver': 'adam', 'lr': 0.0011080272884094438, 'layer1': 439, 'layer2': 329, 'layer3': 13}. Best is trial 90 with value: 0.9829493056230765.

Klebsiella_Pneumoniae | Meropenem | Optuna:  46%|████▌     | 92/200 [1:22:01<1:59:11, 66.22s/it, best=0.983][A
Klebsiella_Pneumoniae | Meropenem | Optuna:  46%|████▌     | 92/200 [1:22:01<1:59:11, 66.22s/it, best=0.983][A[I 2026-02-28 07:21:21,706] Trial 185 finished with value: 0.8935139329177838 and parameters: {'activation': 'relu', 'solver': 'adam', 'lr': 5.19654263268711e-05, 'layer1': 420, 'layer2': 123, 'layer3': 112}. Best is trial 137 with value: 0.8979080367540411.

Escherichia_Coli | Ceftriaxone | Optuna:  93%|█████████▎| 186/200 [8:11:23<44:47, 191.99s/it, best=0.898][A
Escherichia_Coli | Ceftriaxone | Optuna:  93%|█████████▎| 186/200 [8:11:23<44:47, 191.99s/it, best=0.898][A[I 2026-02-28 07:21:36,350] Trial 15 finished with value: 0.8617371561380722 and parameters: {'activation': 'identity', 'solver': 'adam', 'lr': 0.00037562448584352033, 'layer1': 497, 'layer2': 499, 'layer3': 236}. Best is trial 13 with value: 0.8652354934942956.
Pseudomonas_Aeruginosa | DirectMulti | Optuna:   8%|▊         | 16/200 [25:22<5:20:38, 104.55s/it, best=0.865]Pseudomonas_Aeruginosa | DirectMulti | Optuna:   8%|▊         | 16/200 [25:22<5:20:38, 104.55s/it, best=0.865]/export/usuarios01/egarroyo/MALDI_for_AMR_prediction/venv/lib/python3.13/site-packages/sklearn/model_selection/_split.py:813: UserWarning: The least populated class in y has only 4 members, which is less than n_splits=5.
  warnings.warn(
[I 2026-02-28 07:22:17,507] Trial 92 finished with value: 0.9802165647714773 and parameters: {'activation': 'tanh', 'solver': 'adam', 'lr': 0.0017975227555885852, 'layer1': 470, 'layer2': 304, 'layer3': 86}. Best is trial 90 with value: 0.9829493056230765.

Klebsiella_Pneumoniae | Meropenem | Optuna:  46%|████▋     | 93/200 [1:22:58<1:52:42, 63.20s/it, best=0.983][A
Klebsiella_Pneumoniae | Meropenem | Optuna:  46%|████▋     | 93/200 [1:22:58<1:52:42, 63.20s/it, best=0.983][A[I 2026-02-28 07:22:51,896] Trial 174 finished with value: 0.921362234797807 and parameters: {'activation': 'identity', 'solver': 'adam', 'lr': 0.00027066075477334705, 'layer1': 492, 'layer2': 488, 'layer3': 219}. Best is trial 77 with value: 0.9283869597728589.

Staphylococcus_Aureus | Fusidic acid | Optuna:  88%|████████▊ | 175/200 [4:42:01<43:57, 105.49s/it, best=0.928][A
Staphylococcus_Aureus | Fusidic acid | Optuna:  88%|████████▊ | 175/200 [4:42:01<43:57, 105.49s/it, best=0.928][A[I 2026-02-28 07:23:14,109] Trial 16 finished with value: 0.8631218681093731 and parameters: {'activation': 'identity', 'solver': 'adam', 'lr': 0.0076443071072698505, 'layer1': 330, 'layer2': 424, 'layer3': 472}. Best is trial 13 with value: 0.8652354934942956.
Pseudomonas_Aeruginosa | DirectMulti | Optuna:   8%|▊         | 17/200 [27:00<5:12:39, 102.51s/it, best=0.865]Pseudomonas_Aeruginosa | DirectMulti | Optuna:   8%|▊         | 17/200 [27:00<5:12:39, 102.51s/it, best=0.865]/export/usuarios01/egarroyo/MALDI_for_AMR_prediction/venv/lib/python3.13/site-packages/sklearn/model_selection/_split.py:813: UserWarning: The least populated class in y has only 4 members, which is less than n_splits=5.
  warnings.warn(
[I 2026-02-28 07:23:38,159] Trial 93 finished with value: 0.98311227086221 and parameters: {'activation': 'tanh', 'solver': 'adam', 'lr': 0.0009106312746051091, 'layer1': 404, 'layer2': 287, 'layer3': 86}. Best is trial 93 with value: 0.98311227086221.

Klebsiella_Pneumoniae | Meropenem | Optuna:  47%|████▋     | 94/200 [1:24:18<2:00:54, 68.44s/it, best=0.983][A
Klebsiella_Pneumoniae | Meropenem | Optuna:  47%|████▋     | 94/200 [1:24:18<2:00:54, 68.44s/it, best=0.983][A[I 2026-02-28 07:24:24,223] Trial 94 finished with value: 0.9795271467755923 and parameters: {'activation': 'tanh', 'solver': 'adam', 'lr': 0.001367762332877927, 'layer1': 408, 'layer2': 336, 'layer3': 119}. Best is trial 93 with value: 0.98311227086221.

Klebsiella_Pneumoniae | Meropenem | Optuna:  48%|████▊     | 95/200 [1:25:04<1:48:01, 61.72s/it, best=0.983][A
Klebsiella_Pneumoniae | Meropenem | Optuna:  48%|████▊     | 95/200 [1:25:04<1:48:01, 61.72s/it, best=0.983][A[I 2026-02-28 07:24:50,929] Trial 175 finished with value: 0.927268376378241 and parameters: {'activation': 'identity', 'solver': 'adam', 'lr': 9.626099419551078e-05, 'layer1': 469, 'layer2': 118, 'layer3': 207}. Best is trial 77 with value: 0.9283869597728589.

Staphylococcus_Aureus | Fusidic acid | Optuna:  88%|████████▊ | 176/200 [4:44:00<43:49, 109.55s/it, best=0.928][A
Staphylococcus_Aureus | Fusidic acid | Optuna:  88%|████████▊ | 176/200 [4:44:00<43:49, 109.55s/it, best=0.928][A[I 2026-02-28 07:25:03,958] Trial 17 finished with value: 0.8648829605552638 and parameters: {'activation': 'identity', 'solver': 'adam', 'lr': 0.0019137667848854478, 'layer1': 430, 'layer2': 375, 'layer3': 299}. Best is trial 13 with value: 0.8652354934942956.
Pseudomonas_Aeruginosa | DirectMulti | Optuna:   9%|▉         | 18/200 [28:50<5:17:38, 104.72s/it, best=0.865]Pseudomonas_Aeruginosa | DirectMulti | Optuna:   9%|▉         | 18/200 [28:50<5:17:38, 104.72s/it, best=0.865]/export/usuarios01/egarroyo/MALDI_for_AMR_prediction/venv/lib/python3.13/site-packages/sklearn/model_selection/_split.py:813: UserWarning: The least populated class in y has only 4 members, which is less than n_splits=5.
  warnings.warn(
[I 2026-02-28 07:25:20,867] Trial 95 finished with value: 0.9815206967861656 and parameters: {'activation': 'tanh', 'solver': 'adam', 'lr': 0.000882622845237277, 'layer1': 399, 'layer2': 312, 'layer3': 47}. Best is trial 93 with value: 0.98311227086221.

Klebsiella_Pneumoniae | Meropenem | Optuna:  48%|████▊     | 96/200 [1:26:01<1:44:20, 60.20s/it, best=0.983][A
Klebsiella_Pneumoniae | Meropenem | Optuna:  48%|████▊     | 96/200 [1:26:01<1:44:20, 60.20s/it, best=0.983][A[I 2026-02-28 07:25:28,747] Trial 186 finished with value: 0.893788923436159 and parameters: {'activation': 'relu', 'solver': 'adam', 'lr': 2.5495072316686408e-05, 'layer1': 399, 'layer2': 105, 'layer3': 81}. Best is trial 137 with value: 0.8979080367540411.

Escherichia_Coli | Ceftriaxone | Optuna:  94%|█████████▎| 187/200 [8:15:30<45:10, 208.50s/it, best=0.898][A
Escherichia_Coli | Ceftriaxone | Optuna:  94%|█████████▎| 187/200 [8:15:30<45:10, 208.50s/it, best=0.898][A[I 2026-02-28 07:26:10,406] Trial 96 finished with value: 0.9805261345372569 and parameters: {'activation': 'tanh', 'solver': 'adam', 'lr': 0.002420797460652195, 'layer1': 396, 'layer2': 362, 'layer3': 45}. Best is trial 93 with value: 0.98311227086221.

Klebsiella_Pneumoniae | Meropenem | Optuna:  48%|████▊     | 97/200 [1:26:50<1:37:51, 57.00s/it, best=0.983][A
Klebsiella_Pneumoniae | Meropenem | Optuna:  48%|████▊     | 97/200 [1:26:50<1:37:51, 57.00s/it, best=0.983][A[I 2026-02-28 07:26:28,611] Trial 176 finished with value: 0.9261933278982241 and parameters: {'activation': 'identity', 'solver': 'adam', 'lr': 0.00017876715749591044, 'layer1': 446, 'layer2': 91, 'layer3': 289}. Best is trial 77 with value: 0.9283869597728589.

Staphylococcus_Aureus | Fusidic acid | Optuna:  88%|████████▊ | 177/200 [4:45:37<40:37, 105.99s/it, best=0.928][A
Staphylococcus_Aureus | Fusidic acid | Optuna:  88%|████████▊ | 177/200 [4:45:37<40:37, 105.99s/it, best=0.928][A[I 2026-02-28 07:26:32,154] Trial 18 finished with value: 0.7904450414167215 and parameters: {'activation': 'tanh', 'solver': 'sgd', 'lr': 0.00031289309683729037, 'layer1': 176, 'layer2': 453, 'layer3': 199}. Best is trial 13 with value: 0.8652354934942956.
Pseudomonas_Aeruginosa | DirectMulti | Optuna:  10%|▉         | 19/200 [30:18<5:00:55, 99.75s/it, best=0.865] Pseudomonas_Aeruginosa | DirectMulti | Optuna:  10%|▉         | 19/200 [30:18<5:00:55, 99.75s/it, best=0.865]/export/usuarios01/egarroyo/MALDI_for_AMR_prediction/venv/lib/python3.13/site-packages/sklearn/model_selection/_split.py:813: UserWarning: The least populated class in y has only 4 members, which is less than n_splits=5.
  warnings.warn(
[I 2026-02-28 07:26:59,588] Trial 97 finished with value: 0.980759864337452 and parameters: {'activation': 'tanh', 'solver': 'adam', 'lr': 0.0009062023784739813, 'layer1': 427, 'layer2': 284, 'layer3': 80}. Best is trial 93 with value: 0.98311227086221.

Klebsiella_Pneumoniae | Meropenem | Optuna:  49%|████▉     | 98/200 [1:27:40<1:32:54, 54.66s/it, best=0.983][A
Klebsiella_Pneumoniae | Meropenem | Optuna:  49%|████▉     | 98/200 [1:27:40<1:32:54, 54.66s/it, best=0.983][A[I 2026-02-28 07:27:00,937] Trial 19 finished with value: 0.8255018342260501 and parameters: {'activation': 'logistic', 'solver': 'adam', 'lr': 6.897395462103526e-05, 'layer1': 307, 'layer2': 364, 'layer3': 424}. Best is trial 13 with value: 0.8652354934942956.
Pseudomonas_Aeruginosa | DirectMulti | Optuna:  10%|█         | 20/200 [30:47<3:55:20, 78.45s/it, best=0.865]Pseudomonas_Aeruginosa | DirectMulti | Optuna:  10%|█         | 20/200 [30:47<3:55:20, 78.45s/it, best=0.865]/export/usuarios01/egarroyo/MALDI_for_AMR_prediction/venv/lib/python3.13/site-packages/sklearn/model_selection/_split.py:813: UserWarning: The least populated class in y has only 4 members, which is less than n_splits=5.
  warnings.warn(
[I 2026-02-28 07:27:55,626] Trial 98 finished with value: 0.9825890068914355 and parameters: {'activation': 'tanh', 'solver': 'adam', 'lr': 0.0007829549513993136, 'layer1': 352, 'layer2': 312, 'layer3': 103}. Best is trial 93 with value: 0.98311227086221.

Klebsiella_Pneumoniae | Meropenem | Optuna:  50%|████▉     | 99/200 [1:28:36<1:32:42, 55.07s/it, best=0.983][A
Klebsiella_Pneumoniae | Meropenem | Optuna:  50%|████▉     | 99/200 [1:28:36<1:32:42, 55.07s/it, best=0.983][A[I 2026-02-28 07:28:18,185] Trial 177 finished with value: 0.9257158161087451 and parameters: {'activation': 'identity', 'solver': 'adam', 'lr': 6.229863636701996e-05, 'layer1': 500, 'layer2': 105, 'layer3': 98}. Best is trial 77 with value: 0.9283869597728589.

Staphylococcus_Aureus | Fusidic acid | Optuna:  89%|████████▉ | 178/200 [4:47:27<39:15, 107.07s/it, best=0.928][A
Staphylococcus_Aureus | Fusidic acid | Optuna:  89%|████████▉ | 178/200 [4:47:27<39:15, 107.07s/it, best=0.928][A[I 2026-02-28 07:28:20,358] Trial 99 finished with value: 0.9772185210141531 and parameters: {'activation': 'tanh', 'solver': 'sgd', 'lr': 0.0005690271034021298, 'layer1': 335, 'layer2': 11, 'layer3': 135}. Best is trial 93 with value: 0.98311227086221.

Klebsiella_Pneumoniae | Meropenem | Optuna:  50%|█████     | 100/200 [1:29:00<1:16:36, 45.97s/it, best=0.983][A
Klebsiella_Pneumoniae | Meropenem | Optuna:  50%|█████     | 100/200 [1:29:00<1:16:36, 45.97s/it, best=0.983][A[I 2026-02-28 07:28:45,589] Trial 20 finished with value: 0.8638879309580197 and parameters: {'activation': 'identity', 'solver': 'adam', 'lr': 0.0031022045797973667, 'layer1': 411, 'layer2': 119, 'layer3': 352}. Best is trial 13 with value: 0.8652354934942956.
Pseudomonas_Aeruginosa | DirectMulti | Optuna:  10%|█         | 21/200 [32:31<4:17:29, 86.31s/it, best=0.865]Pseudomonas_Aeruginosa | DirectMulti | Optuna:  10%|█         | 21/200 [32:31<4:17:29, 86.31s/it, best=0.865]/export/usuarios01/egarroyo/MALDI_for_AMR_prediction/venv/lib/python3.13/site-packages/sklearn/model_selection/_split.py:813: UserWarning: The least populated class in y has only 4 members, which is less than n_splits=5.
  warnings.warn(
[I 2026-02-28 07:29:10,956] Trial 100 finished with value: 0.9813301123583725 and parameters: {'activation': 'tanh', 'solver': 'adam', 'lr': 0.0007671521565243688, 'layer1': 379, 'layer2': 316, 'layer3': 100}. Best is trial 93 with value: 0.98311227086221.

Klebsiella_Pneumoniae | Meropenem | Optuna:  50%|█████     | 101/200 [1:29:51<1:18:08, 47.36s/it, best=0.983][A
Klebsiella_Pneumoniae | Meropenem | Optuna:  50%|█████     | 101/200 [1:29:51<1:18:08, 47.36s/it, best=0.983][A[I 2026-02-28 07:29:55,616] Trial 178 finished with value: 0.9199028162037486 and parameters: {'activation': 'relu', 'solver': 'adam', 'lr': 0.0008189073182444077, 'layer1': 425, 'layer2': 448, 'layer3': 180}. Best is trial 77 with value: 0.9283869597728589.

Staphylococcus_Aureus | Fusidic acid | Optuna:  90%|████████▉ | 179/200 [4:49:04<36:27, 104.17s/it, best=0.928][A
Staphylococcus_Aureus | Fusidic acid | Optuna:  90%|████████▉ | 179/200 [4:49:04<36:27, 104.17s/it, best=0.928][A[I 2026-02-28 07:30:10,302] Trial 101 finished with value: 0.9811621730333261 and parameters: {'activation': 'tanh', 'solver': 'adam', 'lr': 0.000997105127153649, 'layer1': 359, 'layer2': 309, 'layer3': 72}. Best is trial 93 with value: 0.98311227086221.

Klebsiella_Pneumoniae | Meropenem | Optuna:  51%|█████     | 102/200 [1:30:50<1:23:13, 50.95s/it, best=0.983][A
Klebsiella_Pneumoniae | Meropenem | Optuna:  51%|█████     | 102/200 [1:30:50<1:23:13, 50.95s/it, best=0.983][A[I 2026-02-28 07:30:38,722] Trial 187 finished with value: 0.8933446872317351 and parameters: {'activation': 'relu', 'solver': 'adam', 'lr': 1.9182352857462654e-05, 'layer1': 437, 'layer2': 115, 'layer3': 31}. Best is trial 137 with value: 0.8979080367540411.

Escherichia_Coli | Ceftriaxone | Optuna:  94%|█████████▍| 188/200 [8:20:40<47:47, 238.95s/it, best=0.898][A
Escherichia_Coli | Ceftriaxone | Optuna:  94%|█████████▍| 188/200 [8:20:40<47:47, 238.95s/it, best=0.898][A[I 2026-02-28 07:30:40,225] Trial 21 finished with value: 0.8644963340779281 and parameters: {'activation': 'identity', 'solver': 'adam', 'lr': 0.0014607871977155623, 'layer1': 440, 'layer2': 388, 'layer3': 280}. Best is trial 13 with value: 0.8652354934942956.
Pseudomonas_Aeruginosa | DirectMulti | Optuna:  11%|█         | 22/200 [34:26<4:41:16, 94.81s/it, best=0.865]Pseudomonas_Aeruginosa | DirectMulti | Optuna:  11%|█         | 22/200 [34:26<4:41:16, 94.81s/it, best=0.865]/export/usuarios01/egarroyo/MALDI_for_AMR_prediction/venv/lib/python3.13/site-packages/sklearn/model_selection/_split.py:813: UserWarning: The least populated class in y has only 4 members, which is less than n_splits=5.
  warnings.warn(
[I 2026-02-28 07:31:12,247] Trial 179 finished with value: 0.9264765778351309 and parameters: {'activation': 'tanh', 'solver': 'adam', 'lr': 0.00012092740212398465, 'layer1': 380, 'layer2': 77, 'layer3': 229}. Best is trial 77 with value: 0.9283869597728589.

Staphylococcus_Aureus | Fusidic acid | Optuna:  90%|█████████ | 180/200 [4:50:21<31:58, 95.91s/it, best=0.928] [A
Staphylococcus_Aureus | Fusidic acid | Optuna:  90%|█████████ | 180/200 [4:50:21<31:58, 95.91s/it, best=0.928][A[I 2026-02-28 07:31:28,351] Trial 102 finished with value: 0.9826226386047772 and parameters: {'activation': 'tanh', 'solver': 'adam', 'lr': 0.0012647663104060666, 'layer1': 402, 'layer2': 291, 'layer3': 107}. Best is trial 93 with value: 0.98311227086221.

Klebsiella_Pneumoniae | Meropenem | Optuna:  52%|█████▏    | 103/200 [1:32:08<1:35:31, 59.08s/it, best=0.983][A
Klebsiella_Pneumoniae | Meropenem | Optuna:  52%|█████▏    | 103/200 [1:32:08<1:35:31, 59.08s/it, best=0.983][A[I 2026-02-28 07:32:19,402] Trial 103 finished with value: 0.9813853069115099 and parameters: {'activation': 'tanh', 'solver': 'adam', 'lr': 0.0012544691080519177, 'layer1': 416, 'layer2': 286, 'layer3': 101}. Best is trial 93 with value: 0.98311227086221.

Klebsiella_Pneumoniae | Meropenem | Optuna:  52%|█████▏    | 104/200 [1:32:59<1:30:40, 56.67s/it, best=0.983][A
Klebsiella_Pneumoniae | Meropenem | Optuna:  52%|█████▏    | 104/200 [1:32:59<1:30:40, 56.67s/it, best=0.983][A[I 2026-02-28 07:32:48,933] Trial 22 finished with value: 0.8646484790847918 and parameters: {'activation': 'identity', 'solver': 'adam', 'lr': 0.0005554680614125038, 'layer1': 453, 'layer2': 458, 'layer3': 300}. Best is trial 13 with value: 0.8652354934942956.
Pseudomonas_Aeruginosa | DirectMulti | Optuna:  12%|█▏        | 23/200 [36:35<5:09:42, 104.98s/it, best=0.865]Pseudomonas_Aeruginosa | DirectMulti | Optuna:  12%|█▏        | 23/200 [36:35<5:09:42, 104.98s/it, best=0.865]/export/usuarios01/egarroyo/MALDI_for_AMR_prediction/venv/lib/python3.13/site-packages/sklearn/model_selection/_split.py:813: UserWarning: The least populated class in y has only 4 members, which is less than n_splits=5.
  warnings.warn(
[I 2026-02-28 07:32:52,721] Trial 180 finished with value: 0.9214700083372801 and parameters: {'activation': 'identity', 'solver': 'adam', 'lr': 3.40995701790188e-05, 'layer1': 407, 'layer2': 61, 'layer3': 85}. Best is trial 77 with value: 0.9283869597728589.

Staphylococcus_Aureus | Fusidic acid | Optuna:  90%|█████████ | 181/200 [4:52:01<30:48, 97.28s/it, best=0.928][A
