Klebsiella_Pneumoniae | Ciprofloxacin | Optuna:  10%|█         | 20/200 [29:02<5:33:37, 111.21s/it, best=0.826][A[I 2026-02-27 15:17:19,715] Trial 11 finished with value: 0.7949306900651939 and parameters: {'activation': 'relu', 'solver': 'adam', 'lr': 0.0013124793805688133, 'layer1': 150, 'layer2': 163, 'layer3': 284}. Best is trial 8 with value: 0.8005508709469982.

Escherichia_Coli | Ciprofloxacin | Optuna:   6%|▌         | 12/200 [29:49<8:22:45, 160.46s/it, best=0.801][A
Escherichia_Coli | Ciprofloxacin | Optuna:   6%|▌         | 12/200 [29:49<8:22:45, 160.46s/it, best=0.801][A[I 2026-02-27 15:17:36,483] Trial 35 finished with value: 0.8730778965870375 and parameters: {'activation': 'logistic', 'solver': 'adam', 'lr': 0.00020613218916089884, 'layer1': 392, 'layer2': 201, 'layer3': 452}. Best is trial 32 with value: 0.8749825617667517.

Pseudomonas_Aeruginosa | Ciprofloxacin | Optuna:  18%|█▊        | 36/200 [30:06<2:51:14, 62.65s/it, best=0.875][A
Pseudomonas_Aeruginosa | Ciprofloxacin | Optuna:  18%|█▊        | 36/200 [30:06<2:51:14, 62.65s/it, best=0.875][A[I 2026-02-27 15:18:08,083] Trial 20 finished with value: 0.8245408243584247 and parameters: {'activation': 'identity', 'solver': 'adam', 'lr': 0.00039381673450869054, 'layer1': 304, 'layer2': 119, 'layer3': 352}. Best is trial 8 with value: 0.826402964334112.

Klebsiella_Pneumoniae | Ciprofloxacin | Optuna:  10%|█         | 21/200 [30:37<5:17:24, 106.40s/it, best=0.826][A
Klebsiella_Pneumoniae | Ciprofloxacin | Optuna:  10%|█         | 21/200 [30:37<5:17:24, 106.40s/it, best=0.826][A[I 2026-02-27 15:18:38,022] Trial 12 finished with value: 0.9088083331363105 and parameters: {'activation': 'identity', 'solver': 'adam', 'lr': 0.00046544039809979403, 'layer1': 347, 'layer2': 434, 'layer3': 419}. Best is trial 12 with value: 0.9088083331363105.

Staphylococcus_Aureus | Oxacillin | Optuna:   6%|▋         | 13/200 [31:07<7:39:21, 147.39s/it, best=0.909][A
Staphylococcus_Aureus | Oxacillin | Optuna:   6%|▋         | 13/200 [31:07<7:39:21, 147.39s/it, best=0.909][A[I 2026-02-27 15:19:06,328] Trial 36 finished with value: 0.8735969695138183 and parameters: {'activation': 'logistic', 'solver': 'adam', 'lr': 0.00021473284314555053, 'layer1': 390, 'layer2': 267, 'layer3': 461}. Best is trial 32 with value: 0.8749825617667517.

Pseudomonas_Aeruginosa | Ciprofloxacin | Optuna:  18%|█▊        | 37/200 [31:36<3:12:21, 70.81s/it, best=0.875][A
Pseudomonas_Aeruginosa | Ciprofloxacin | Optuna:  18%|█▊        | 37/200 [31:36<3:12:21, 70.81s/it, best=0.875][A[I 2026-02-27 15:19:36,064] Trial 37 finished with value: 0.8159756916186209 and parameters: {'activation': 'logistic', 'solver': 'adam', 'lr': 3.222383768739893e-05, 'layer1': 385, 'layer2': 289, 'layer3': 449}. Best is trial 32 with value: 0.8749825617667517.

Pseudomonas_Aeruginosa | Ciprofloxacin | Optuna:  19%|█▉        | 38/200 [32:05<2:37:54, 58.49s/it, best=0.875][A
Pseudomonas_Aeruginosa | Ciprofloxacin | Optuna:  19%|█▉        | 38/200 [32:05<2:37:54, 58.49s/it, best=0.875][A[I 2026-02-27 15:19:58,268] Trial 38 finished with value: 0.8159756916186209 and parameters: {'activation': 'logistic', 'solver': 'sgd', 'lr': 0.000859881743291963, 'layer1': 298, 'layer2': 256, 'layer3': 346}. Best is trial 32 with value: 0.8749825617667517.

Pseudomonas_Aeruginosa | Ciprofloxacin | Optuna:  20%|█▉        | 39/200 [32:27<2:07:43, 47.60s/it, best=0.875][A
Pseudomonas_Aeruginosa | Ciprofloxacin | Optuna:  20%|█▉        | 39/200 [32:27<2:07:43, 47.60s/it, best=0.875][A[I 2026-02-27 15:20:25,361] Trial 21 finished with value: 0.8254923723482539 and parameters: {'activation': 'identity', 'solver': 'adam', 'lr': 5.551359264911533e-05, 'layer1': 303, 'layer2': 108, 'layer3': 350}. Best is trial 8 with value: 0.826402964334112.

Klebsiella_Pneumoniae | Ciprofloxacin | Optuna:  11%|█         | 22/200 [32:54<5:43:08, 115.66s/it, best=0.826][A
Klebsiella_Pneumoniae | Ciprofloxacin | Optuna:  11%|█         | 22/200 [32:54<5:43:08, 115.66s/it, best=0.826][A[I 2026-02-27 15:20:46,055] Trial 12 finished with value: 0.8011504591048558 and parameters: {'activation': 'identity', 'solver': 'adam', 'lr': 0.00046544039809979403, 'layer1': 347, 'layer2': 434, 'layer3': 419}. Best is trial 12 with value: 0.8011504591048558.

Escherichia_Coli | Ciprofloxacin | Optuna:   6%|▋         | 13/200 [33:15<9:03:24, 174.36s/it, best=0.801][A
Escherichia_Coli | Ciprofloxacin | Optuna:   6%|▋         | 13/200 [33:15<9:03:24, 174.36s/it, best=0.801][A[I 2026-02-27 15:21:03,370] Trial 13 finished with value: 0.9063103102535794 and parameters: {'activation': 'identity', 'solver': 'adam', 'lr': 0.00025548240574830476, 'layer1': 499, 'layer2': 471, 'layer3': 419}. Best is trial 12 with value: 0.9088083331363105.

Staphylococcus_Aureus | Oxacillin | Optuna:   7%|▋         | 14/200 [33:33<7:34:59, 146.77s/it, best=0.909][A
Staphylococcus_Aureus | Oxacillin | Optuna:   7%|▋         | 14/200 [33:33<7:34:59, 146.77s/it, best=0.909][A[I 2026-02-27 15:22:05,311] Trial 39 finished with value: 0.8564362983408028 and parameters: {'activation': 'tanh', 'solver': 'adam', 'lr': 9.07330211440507e-06, 'layer1': 368, 'layer2': 262, 'layer3': 212}. Best is trial 32 with value: 0.8749825617667517.

Pseudomonas_Aeruginosa | Ciprofloxacin | Optuna:  20%|██        | 40/200 [34:34<3:10:29, 71.43s/it, best=0.875][A
Pseudomonas_Aeruginosa | Ciprofloxacin | Optuna:  20%|██        | 40/200 [34:34<3:10:29, 71.43s/it, best=0.875][A[I 2026-02-27 15:22:11,083] Trial 22 finished with value: 0.8239978889222712 and parameters: {'activation': 'identity', 'solver': 'adam', 'lr': 5.52063832617726e-05, 'layer1': 367, 'layer2': 99, 'layer3': 376}. Best is trial 8 with value: 0.826402964334112.

Klebsiella_Pneumoniae | Ciprofloxacin | Optuna:  12%|█▏        | 23/200 [34:40<5:32:24, 112.68s/it, best=0.826][A
Klebsiella_Pneumoniae | Ciprofloxacin | Optuna:  12%|█▏        | 23/200 [34:40<5:32:24, 112.68s/it, best=0.826][A[I 2026-02-27 15:23:17,796] Trial 40 finished with value: 0.8353535022056645 and parameters: {'activation': 'logistic', 'solver': 'adam', 'lr': 0.00011657440001275244, 'layer1': 411, 'layer2': 189, 'layer3': 498}. Best is trial 32 with value: 0.8749825617667517.

Pseudomonas_Aeruginosa | Ciprofloxacin | Optuna:  20%|██        | 41/200 [35:47<3:10:08, 71.75s/it, best=0.875][A
Pseudomonas_Aeruginosa | Ciprofloxacin | Optuna:  20%|██        | 41/200 [35:47<3:10:08, 71.75s/it, best=0.875][A[I 2026-02-27 15:23:20,643] Trial 14 finished with value: 0.9069066142003976 and parameters: {'activation': 'identity', 'solver': 'adam', 'lr': 0.0007479355404409705, 'layer1': 340, 'layer2': 392, 'layer3': 396}. Best is trial 12 with value: 0.9088083331363105.

Staphylococcus_Aureus | Oxacillin | Optuna:   8%|▊         | 15/200 [35:50<7:23:42, 143.91s/it, best=0.909][A
Staphylococcus_Aureus | Oxacillin | Optuna:   8%|▊         | 15/200 [35:50<7:23:42, 143.91s/it, best=0.909][A[I 2026-02-27 15:24:04,076] Trial 23 finished with value: 0.8230608370329602 and parameters: {'activation': 'identity', 'solver': 'adam', 'lr': 7.405992285591098e-05, 'layer1': 208, 'layer2': 244, 'layer3': 441}. Best is trial 8 with value: 0.826402964334112.

Klebsiella_Pneumoniae | Ciprofloxacin | Optuna:  12%|█▏        | 24/200 [36:33<5:30:48, 112.77s/it, best=0.826][A
Klebsiella_Pneumoniae | Ciprofloxacin | Optuna:  12%|█▏        | 24/200 [36:33<5:30:48, 112.77s/it, best=0.826][A[I 2026-02-27 15:24:38,108] Trial 41 finished with value: 0.868065926328174 and parameters: {'activation': 'logistic', 'solver': 'adam', 'lr': 0.0001865006399252286, 'layer1': 445, 'layer2': 236, 'layer3': 462}. Best is trial 32 with value: 0.8749825617667517.

Pseudomonas_Aeruginosa | Ciprofloxacin | Optuna:  21%|██        | 42/200 [37:07<3:15:42, 74.32s/it, best=0.875][A
Pseudomonas_Aeruginosa | Ciprofloxacin | Optuna:  21%|██        | 42/200 [37:07<3:15:42, 74.32s/it, best=0.875][A[I 2026-02-27 15:25:22,111] Trial 13 finished with value: 0.8026816432211821 and parameters: {'activation': 'identity', 'solver': 'adam', 'lr': 0.00025548240574830476, 'layer1': 499, 'layer2': 471, 'layer3': 419}. Best is trial 13 with value: 0.8026816432211821.

Escherichia_Coli | Ciprofloxacin | Optuna:   7%|▋         | 14/200 [37:51<10:35:43, 205.07s/it, best=0.801][A
Escherichia_Coli | Ciprofloxacin | Optuna:   7%|▋         | 14/200 [37:51<10:35:43, 205.07s/it, best=0.803][A[I 2026-02-27 15:25:46,339] Trial 15 finished with value: 0.9080171641748285 and parameters: {'activation': 'identity', 'solver': 'adam', 'lr': 0.0028522646033228415, 'layer1': 324, 'layer2': 424, 'layer3': 236}. Best is trial 12 with value: 0.9088083331363105.

Staphylococcus_Aureus | Oxacillin | Optuna:   8%|▊         | 16/200 [38:16<7:22:58, 144.45s/it, best=0.909][A
Staphylococcus_Aureus | Oxacillin | Optuna:   8%|▊         | 16/200 [38:16<7:22:58, 144.45s/it, best=0.909][A[I 2026-02-27 15:26:18,587] Trial 42 finished with value: 0.8735999534624164 and parameters: {'activation': 'logistic', 'solver': 'adam', 'lr': 0.00028942276098647295, 'layer1': 459, 'layer2': 315, 'layer3': 475}. Best is trial 32 with value: 0.8749825617667517.

Pseudomonas_Aeruginosa | Ciprofloxacin | Optuna:  22%|██▏       | 43/200 [38:48<3:35:00, 82.17s/it, best=0.875][A
Pseudomonas_Aeruginosa | Ciprofloxacin | Optuna:  22%|██▏       | 43/200 [38:48<3:35:00, 82.17s/it, best=0.875][A[I 2026-02-27 15:26:26,284] Trial 24 finished with value: 0.8262159075578592 and parameters: {'activation': 'identity', 'solver': 'adam', 'lr': 3.2887407436977886e-05, 'layer1': 295, 'layer2': 500, 'layer3': 270}. Best is trial 8 with value: 0.826402964334112.

Klebsiella_Pneumoniae | Ciprofloxacin | Optuna:  12%|█▎        | 25/200 [38:55<5:54:41, 121.61s/it, best=0.826][A
Klebsiella_Pneumoniae | Ciprofloxacin | Optuna:  12%|█▎        | 25/200 [38:55<5:54:41, 121.61s/it, best=0.826][A[I 2026-02-27 15:26:48,159] Trial 43 finished with value: 0.8159756916186209 and parameters: {'activation': 'logistic', 'solver': 'adam', 'lr': 1.2403668302547623e-06, 'layer1': 391, 'layer2': 322, 'layer3': 418}. Best is trial 32 with value: 0.8749825617667517.

Pseudomonas_Aeruginosa | Ciprofloxacin | Optuna:  22%|██▏       | 44/200 [39:17<2:52:36, 66.39s/it, best=0.875][A
Pseudomonas_Aeruginosa | Ciprofloxacin | Optuna:  22%|██▏       | 44/200 [39:17<2:52:36, 66.39s/it, best=0.875][A[I 2026-02-27 15:27:46,008] Trial 16 finished with value: 0.9086916027151535 and parameters: {'activation': 'identity', 'solver': 'adam', 'lr': 0.00017184915692664145, 'layer1': 193, 'layer2': 409, 'layer3': 472}. Best is trial 12 with value: 0.9088083331363105.

Staphylococcus_Aureus | Oxacillin | Optuna:   8%|▊         | 17/200 [40:15<6:57:50, 137.00s/it, best=0.909][A
Staphylococcus_Aureus | Oxacillin | Optuna:   8%|▊         | 17/200 [40:15<6:57:50, 137.00s/it, best=0.909][A[I 2026-02-27 15:28:25,923] Trial 44 finished with value: 0.8747728674960967 and parameters: {'activation': 'logistic', 'solver': 'adam', 'lr': 0.00024523351786637703, 'layer1': 338, 'layer2': 380, 'layer3': 467}. Best is trial 32 with value: 0.8749825617667517.

Pseudomonas_Aeruginosa | Ciprofloxacin | Optuna:  22%|██▎       | 45/200 [40:55<3:15:49, 75.80s/it, best=0.875][A
Pseudomonas_Aeruginosa | Ciprofloxacin | Optuna:  22%|██▎       | 45/200 [40:55<3:15:49, 75.80s/it, best=0.875][A[I 2026-02-27 15:28:31,850] Trial 14 finished with value: 0.8005882551869512 and parameters: {'activation': 'identity', 'solver': 'adam', 'lr': 0.00013839971926370072, 'layer1': 499, 'layer2': 394, 'layer3': 414}. Best is trial 13 with value: 0.8026816432211821.

Escherichia_Coli | Ciprofloxacin | Optuna:   8%|▊         | 15/200 [41:01<10:18:03, 200.45s/it, best=0.803][A
Escherichia_Coli | Ciprofloxacin | Optuna:   8%|▊         | 15/200 [41:01<10:18:03, 200.45s/it, best=0.803][A[I 2026-02-27 15:28:46,580] Trial 25 finished with value: 0.8268937643839351 and parameters: {'activation': 'identity', 'solver': 'adam', 'lr': 3.659199406029746e-05, 'layer1': 294, 'layer2': 500, 'layer3': 262}. Best is trial 25 with value: 0.8268937643839351.

Klebsiella_Pneumoniae | Ciprofloxacin | Optuna:  13%|█▎        | 26/200 [41:16<6:08:55, 127.21s/it, best=0.826][A
Klebsiella_Pneumoniae | Ciprofloxacin | Optuna:  13%|█▎        | 26/200 [41:16<6:08:55, 127.21s/it, best=0.827][A[I 2026-02-27 15:29:41,567] Trial 45 finished with value: 0.8610794524393501 and parameters: {'activation': 'identity', 'solver': 'adam', 'lr': 0.0007068841806736867, 'layer1': 325, 'layer2': 406, 'layer3': 477}. Best is trial 32 with value: 0.8749825617667517.

Pseudomonas_Aeruginosa | Ciprofloxacin | Optuna:  23%|██▎       | 46/200 [42:11<3:14:26, 75.75s/it, best=0.875][A
Pseudomonas_Aeruginosa | Ciprofloxacin | Optuna:  23%|██▎       | 46/200 [42:11<3:14:26, 75.75s/it, best=0.875][A[I 2026-02-27 15:30:22,249] Trial 17 finished with value: 0.9069573885983335 and parameters: {'activation': 'identity', 'solver': 'adam', 'lr': 0.0004473029764903099, 'layer1': 450, 'layer2': 360, 'layer3': 299}. Best is trial 12 with value: 0.9088083331363105.

Staphylococcus_Aureus | Oxacillin | Optuna:   9%|▉         | 18/200 [42:51<7:13:05, 142.78s/it, best=0.909][A
Staphylococcus_Aureus | Oxacillin | Optuna:   9%|▉         | 18/200 [42:51<7:13:05, 142.78s/it, best=0.909][A[I 2026-02-27 15:31:00,622] Trial 26 finished with value: 0.6653171237182145 and parameters: {'activation': 'identity', 'solver': 'sgd', 'lr': 2.6154910812411895e-05, 'layer1': 156, 'layer2': 494, 'layer3': 289}. Best is trial 25 with value: 0.8268937643839351.

Klebsiella_Pneumoniae | Ciprofloxacin | Optuna:  14%|█▎        | 27/200 [43:30<6:12:42, 129.26s/it, best=0.827][A
Klebsiella_Pneumoniae | Ciprofloxacin | Optuna:  14%|█▎        | 27/200 [43:30<6:12:42, 129.26s/it, best=0.827][A[I 2026-02-27 15:31:05,998] Trial 46 finished with value: 0.8754031846375991 and parameters: {'activation': 'logistic', 'solver': 'adam', 'lr': 0.0002684110565972457, 'layer1': 289, 'layer2': 387, 'layer3': 422}. Best is trial 46 with value: 0.8754031846375991.

Pseudomonas_Aeruginosa | Ciprofloxacin | Optuna:  24%|██▎       | 47/200 [43:35<3:19:48, 78.36s/it, best=0.875][A
Pseudomonas_Aeruginosa | Ciprofloxacin | Optuna:  24%|██▎       | 47/200 [43:35<3:19:48, 78.36s/it, best=0.875][A[I 2026-02-27 15:31:33,754] Trial 27 finished with value: 0.7417840809323848 and parameters: {'activation': 'logistic', 'solver': 'adam', 'lr': 2.625377899435633e-05, 'layer1': 225, 'layer2': 457, 'layer3': 256}. Best is trial 25 with value: 0.8268937643839351.

Klebsiella_Pneumoniae | Ciprofloxacin | Optuna:  14%|█▍        | 28/200 [44:03<4:47:52, 100.42s/it, best=0.827][A
Klebsiella_Pneumoniae | Ciprofloxacin | Optuna:  14%|█▍        | 28/200 [44:03<4:47:52, 100.42s/it, best=0.827][A[I 2026-02-27 15:31:42,305] Trial 15 finished with value: 0.7988843035635061 and parameters: {'activation': 'identity', 'solver': 'adam', 'lr': 0.0003521954261532511, 'layer1': 497, 'layer2': 499, 'layer3': 500}. Best is trial 13 with value: 0.8026816432211821.

Escherichia_Coli | Ciprofloxacin | Optuna:   8%|▊         | 16/200 [44:11<10:05:29, 197.44s/it, best=0.803][A
Escherichia_Coli | Ciprofloxacin | Optuna:   8%|▊         | 16/200 [44:11<10:05:29, 197.44s/it, best=0.803][A[I 2026-02-27 15:31:57,836] Trial 47 finished with value: 0.8242927012731991 and parameters: {'activation': 'tanh', 'solver': 'sgd', 'lr': 0.0010119563647011567, 'layer1': 255, 'layer2': 390, 'layer3': 425}. Best is trial 46 with value: 0.8754031846375991.

Pseudomonas_Aeruginosa | Ciprofloxacin | Optuna:  24%|██▍       | 48/200 [44:27<2:58:20, 70.40s/it, best=0.875][A
Pseudomonas_Aeruginosa | Ciprofloxacin | Optuna:  24%|██▍       | 48/200 [44:27<2:58:20, 70.40s/it, best=0.875][A[I 2026-02-27 15:32:44,036] Trial 48 finished with value: 0.8626947290425374 and parameters: {'activation': 'logistic', 'solver': 'adam', 'lr': 0.0016670856225776156, 'layer1': 280, 'layer2': 450, 'layer3': 334}. Best is trial 46 with value: 0.8754031846375991.

Pseudomonas_Aeruginosa | Ciprofloxacin | Optuna:  24%|██▍       | 49/200 [45:13<2:38:54, 63.14s/it, best=0.875][A
Pseudomonas_Aeruginosa | Ciprofloxacin | Optuna:  24%|██▍       | 49/200 [45:13<2:38:54, 63.14s/it, best=0.875][A[I 2026-02-27 15:32:55,227] Trial 18 finished with value: 0.7017430462235883 and parameters: {'activation': 'tanh', 'solver': 'sgd', 'lr': 5.6512812063308935e-05, 'layer1': 316, 'layer2': 450, 'layer3': 199}. Best is trial 12 with value: 0.9088083331363105.

Staphylococcus_Aureus | Oxacillin | Optuna:  10%|▉         | 19/200 [45:24<7:19:57, 145.84s/it, best=0.909][A
Staphylococcus_Aureus | Oxacillin | Optuna:  10%|▉         | 19/200 [45:24<7:19:57, 145.84s/it, best=0.909][A[I 2026-02-27 15:34:00,835] Trial 49 finished with value: 0.8597627938218597 and parameters: {'activation': 'identity', 'solver': 'adam', 'lr': 0.00011027941597354687, 'layer1': 335, 'layer2': 447, 'layer3': 369}. Best is trial 46 with value: 0.8754031846375991.

Pseudomonas_Aeruginosa | Ciprofloxacin | Optuna:  25%|██▌       | 50/200 [46:30<2:48:05, 67.24s/it, best=0.875][A
Pseudomonas_Aeruginosa | Ciprofloxacin | Optuna:  25%|██▌       | 50/200 [46:30<2:48:05, 67.24s/it, best=0.875][A[I 2026-02-27 15:34:34,420] Trial 28 finished with value: 0.7877478765890941 and parameters: {'activation': 'tanh', 'solver': 'adam', 'lr': 4.4491199832021246e-06, 'layer1': 287, 'layer2': 386, 'layer3': 151}. Best is trial 25 with value: 0.8268937643839351.

Klebsiella_Pneumoniae | Ciprofloxacin | Optuna:  14%|█▍        | 29/200 [47:03<5:54:48, 124.50s/it, best=0.827][A
Klebsiella_Pneumoniae | Ciprofloxacin | Optuna:  14%|█▍        | 29/200 [47:03<5:54:48, 124.50s/it, best=0.827][A[I 2026-02-27 15:34:51,503] Trial 19 finished with value: 0.8908963111288191 and parameters: {'activation': 'logistic', 'solver': 'adam', 'lr': 0.0037119440897972695, 'layer1': 400, 'layer2': 353, 'layer3': 424}. Best is trial 12 with value: 0.9088083331363105.

Staphylococcus_Aureus | Oxacillin | Optuna:  10%|█         | 20/200 [47:21<6:50:53, 136.97s/it, best=0.909][A
Staphylococcus_Aureus | Oxacillin | Optuna:  10%|█         | 20/200 [47:21<6:50:53, 136.97s/it, best=0.909][A[I 2026-02-27 15:35:04,758] Trial 50 finished with value: 0.8670263667279308 and parameters: {'activation': 'logistic', 'solver': 'adam', 'lr': 0.0002875167224027506, 'layer1': 234, 'layer2': 329, 'layer3': 195}. Best is trial 46 with value: 0.8754031846375991.

Pseudomonas_Aeruginosa | Ciprofloxacin | Optuna:  26%|██▌       | 51/200 [47:34<2:44:30, 66.24s/it, best=0.875][A
Pseudomonas_Aeruginosa | Ciprofloxacin | Optuna:  26%|██▌       | 51/200 [47:34<2:44:30, 66.24s/it, best=0.875][A[I 2026-02-27 15:35:10,581] Trial 29 finished with value: 0.6042716608492664 and parameters: {'activation': 'logistic', 'solver': 'sgd', 'lr': 1.141129445980879e-05, 'layer1': 402, 'layer2': 492, 'layer3': 259}. Best is trial 25 with value: 0.8268937643839351.

Klebsiella_Pneumoniae | Ciprofloxacin | Optuna:  15%|█▌        | 30/200 [47:40<4:37:39, 97.99s/it, best=0.827] [A
Klebsiella_Pneumoniae | Ciprofloxacin | Optuna:  15%|█▌        | 30/200 [47:40<4:37:39, 97.99s/it, best=0.827][A[I 2026-02-27 15:36:04,881] Trial 16 finished with value: 0.7989563910137202 and parameters: {'activation': 'identity', 'solver': 'adam', 'lr': 0.004512428606443835, 'layer1': 441, 'layer2': 393, 'layer3': 405}. Best is trial 13 with value: 0.8026816432211821.

Escherichia_Coli | Ciprofloxacin | Optuna:   8%|▊         | 17/200 [48:34<11:01:56, 217.03s/it, best=0.803][A
Escherichia_Coli | Ciprofloxacin | Optuna:   8%|▊         | 17/200 [48:34<11:01:56, 217.03s/it, best=0.803][A[I 2026-02-27 15:36:45,223] Trial 51 finished with value: 0.8730673653532921 and parameters: {'activation': 'logistic', 'solver': 'adam', 'lr': 0.00024738257053155623, 'layer1': 422, 'layer2': 369, 'layer3': 476}. Best is trial 46 with value: 0.8754031846375991.

Pseudomonas_Aeruginosa | Ciprofloxacin | Optuna:  26%|██▌       | 52/200 [49:14<3:08:43, 76.51s/it, best=0.875][A
Pseudomonas_Aeruginosa | Ciprofloxacin | Optuna:  26%|██▌       | 52/200 [49:14<3:08:43, 76.51s/it, best=0.875][A[I 2026-02-27 15:36:47,190] Trial 20 finished with value: 0.9059768750429604 and parameters: {'activation': 'identity', 'solver': 'adam', 'lr': 0.00039381673450869054, 'layer1': 304, 'layer2': 119, 'layer3': 352}. Best is trial 12 with value: 0.9088083331363105.

Staphylococcus_Aureus | Oxacillin | Optuna:  10%|█         | 21/200 [49:16<6:29:33, 130.58s/it, best=0.909][A
Staphylococcus_Aureus | Oxacillin | Optuna:  10%|█         | 21/200 [49:16<6:29:33, 130.58s/it, best=0.909][A[I 2026-02-27 15:37:42,137] Trial 30 finished with value: 0.8257722254610252 and parameters: {'activation': 'identity', 'solver': 'adam', 'lr': 0.0001584580705846318, 'layer1': 469, 'layer2': 458, 'layer3': 199}. Best is trial 25 with value: 0.8268937643839351.

Klebsiella_Pneumoniae | Ciprofloxacin | Optuna:  16%|█▌        | 31/200 [50:11<5:21:16, 114.06s/it, best=0.827][A
Klebsiella_Pneumoniae | Ciprofloxacin | Optuna:  16%|█▌        | 31/200 [50:11<5:21:16, 114.06s/it, best=0.827][A[I 2026-02-27 15:37:58,744] Trial 52 finished with value: 0.8723300741924428 and parameters: {'activation': 'logistic', 'solver': 'adam', 'lr': 0.0005315438898787771, 'layer1': 311, 'layer2': 281, 'layer3': 414}. Best is trial 46 with value: 0.8754031846375991.

Pseudomonas_Aeruginosa | Ciprofloxacin | Optuna:  26%|██▋       | 53/200 [50:28<3:05:15, 75.61s/it, best=0.875][A
