Escherichia_Coli | Ciprofloxacin | Optuna:  49%|████▉     | 98/200 [4:04:37<5:55:38, 209.20s/it, best=0.808][A[I 2026-02-27 18:52:21,769] Trial 110 finished with value: 0.9029717190268626 and parameters: {'activation': 'identity', 'solver': 'adam', 'lr': 0.00012348199825166258, 'layer1': 296, 'layer2': 396, 'layer3': 397}. Best is trial 84 with value: 0.9099428178723615.

Staphylococcus_Aureus | Oxacillin | Optuna:  56%|█████▌    | 111/200 [4:04:51<2:49:14, 114.09s/it, best=0.91][A
Staphylococcus_Aureus | Oxacillin | Optuna:  56%|█████▌    | 111/200 [4:04:51<2:49:14, 114.09s/it, best=0.91][A[I 2026-02-27 18:52:36,490] Trial 23 finished with value: 0.8581760435666125 and parameters: {'activation': 'relu', 'solver': 'adam', 'lr': 0.003299118424061495, 'layer1': 136, 'layer2': 89, 'layer3': 83}. Best is trial 19 with value: 0.8620352129182731.

Pseudomonas_Aeruginosa | Imipenem | Optuna:  12%|█▏        | 24/200 [20:30<2:12:22, 45.13s/it, best=0.862][A
Pseudomonas_Aeruginosa | Imipenem | Optuna:  12%|█▏        | 24/200 [20:30<2:12:22, 45.13s/it, best=0.862][A[I 2026-02-27 18:53:25,239] Trial 24 finished with value: 0.8643155241429833 and parameters: {'activation': 'relu', 'solver': 'adam', 'lr': 0.005497461733934922, 'layer1': 160, 'layer2': 80, 'layer3': 43}. Best is trial 24 with value: 0.8643155241429833.

Pseudomonas_Aeruginosa | Imipenem | Optuna:  12%|█▎        | 25/200 [21:19<2:14:47, 46.21s/it, best=0.862][A
Pseudomonas_Aeruginosa | Imipenem | Optuna:  12%|█▎        | 25/200 [21:19<2:14:47, 46.21s/it, best=0.864][A[I 2026-02-27 18:53:42,607] Trial 130 finished with value: 0.8248646428692437 and parameters: {'activation': 'tanh', 'solver': 'adam', 'lr': 4.909486559280516e-05, 'layer1': 358, 'layer2': 467, 'layer3': 271}. Best is trial 91 with value: 0.8315336183309556.

Klebsiella_Pneumoniae | Ciprofloxacin | Optuna:  66%|██████▌   | 131/200 [4:06:12<2:05:02, 108.73s/it, best=0.832][A
Klebsiella_Pneumoniae | Ciprofloxacin | Optuna:  66%|██████▌   | 131/200 [4:06:12<2:05:02, 108.73s/it, best=0.832][A[I 2026-02-27 18:54:12,622] Trial 25 finished with value: 0.8543390498433914 and parameters: {'activation': 'relu', 'solver': 'adam', 'lr': 0.005531536842638039, 'layer1': 202, 'layer2': 73, 'layer3': 49}. Best is trial 24 with value: 0.8643155241429833.

Pseudomonas_Aeruginosa | Imipenem | Optuna:  13%|█▎        | 26/200 [22:06<2:15:02, 46.56s/it, best=0.864][A
Pseudomonas_Aeruginosa | Imipenem | Optuna:  13%|█▎        | 26/200 [22:06<2:15:02, 46.56s/it, best=0.864][A[I 2026-02-27 18:54:26,304] Trial 111 finished with value: 0.9045295183834149 and parameters: {'activation': 'identity', 'solver': 'adam', 'lr': 6.554287120214588e-05, 'layer1': 261, 'layer2': 417, 'layer3': 484}. Best is trial 84 with value: 0.9099428178723615.

Staphylococcus_Aureus | Oxacillin | Optuna:  56%|█████▌    | 112/200 [4:06:55<2:51:55, 117.23s/it, best=0.91][A
Staphylococcus_Aureus | Oxacillin | Optuna:  56%|█████▌    | 112/200 [4:06:55<2:51:55, 117.23s/it, best=0.91][A[I 2026-02-27 18:54:26,627] Trial 26 finished with value: 0.8175565662034809 and parameters: {'activation': 'relu', 'solver': 'sgd', 'lr': 0.009448679984400127, 'layer1': 166, 'layer2': 110, 'layer3': 16}. Best is trial 24 with value: 0.8643155241429833.

Pseudomonas_Aeruginosa | Imipenem | Optuna:  14%|█▎        | 27/200 [22:20<1:46:05, 36.80s/it, best=0.864][A
Pseudomonas_Aeruginosa | Imipenem | Optuna:  14%|█▎        | 27/200 [22:20<1:46:05, 36.80s/it, best=0.864][A[I 2026-02-27 18:54:35,862] Trial 98 finished with value: 0.8052836072873314 and parameters: {'activation': 'tanh', 'solver': 'adam', 'lr': 2.7195802108474573e-05, 'layer1': 149, 'layer2': 214, 'layer3': 67}. Best is trial 55 with value: 0.8076668303114959.

Escherichia_Coli | Ciprofloxacin | Optuna:  50%|████▉     | 99/200 [4:07:05<5:21:19, 190.88s/it, best=0.808][A
Escherichia_Coli | Ciprofloxacin | Optuna:  50%|████▉     | 99/200 [4:07:05<5:21:19, 190.88s/it, best=0.808][A[I 2026-02-27 18:55:26,803] Trial 27 finished with value: 0.8632893235043223 and parameters: {'activation': 'relu', 'solver': 'adam', 'lr': 0.0002423998647396679, 'layer1': 228, 'layer2': 61, 'layer3': 111}. Best is trial 24 with value: 0.8643155241429833.

Pseudomonas_Aeruginosa | Imipenem | Optuna:  14%|█▍        | 28/200 [23:21<2:05:35, 43.81s/it, best=0.864][A
Pseudomonas_Aeruginosa | Imipenem | Optuna:  14%|█▍        | 28/200 [23:21<2:05:35, 43.81s/it, best=0.864][A[I 2026-02-27 18:55:43,995] Trial 131 finished with value: 0.8231529381164424 and parameters: {'activation': 'identity', 'solver': 'adam', 'lr': 0.003544175768454464, 'layer1': 389, 'layer2': 455, 'layer3': 255}. Best is trial 91 with value: 0.8315336183309556.

Klebsiella_Pneumoniae | Ciprofloxacin | Optuna:  66%|██████▌   | 132/200 [4:08:13<2:07:31, 112.53s/it, best=0.832][A
Klebsiella_Pneumoniae | Ciprofloxacin | Optuna:  66%|██████▌   | 132/200 [4:08:13<2:07:31, 112.53s/it, best=0.832][A[I 2026-02-27 18:55:46,689] Trial 28 finished with value: 0.8212344378781168 and parameters: {'activation': 'relu', 'solver': 'adam', 'lr': 5.520350166411609e-05, 'layer1': 230, 'layer2': 54, 'layer3': 179}. Best is trial 24 with value: 0.8643155241429833.

Pseudomonas_Aeruginosa | Imipenem | Optuna:  14%|█▍        | 29/200 [23:40<1:44:24, 36.63s/it, best=0.864][A
Pseudomonas_Aeruginosa | Imipenem | Optuna:  14%|█▍        | 29/200 [23:40<1:44:24, 36.63s/it, best=0.864][A[I 2026-02-27 18:56:05,578] Trial 112 finished with value: 0.9037582893856808 and parameters: {'activation': 'identity', 'solver': 'adam', 'lr': 9.398001044701636e-05, 'layer1': 197, 'layer2': 390, 'layer3': 475}. Best is trial 84 with value: 0.9099428178723615.

Staphylococcus_Aureus | Oxacillin | Optuna:  56%|█████▋    | 113/200 [4:08:35<2:42:10, 111.84s/it, best=0.91][A
Staphylococcus_Aureus | Oxacillin | Optuna:  56%|█████▋    | 113/200 [4:08:35<2:42:10, 111.84s/it, best=0.91][A[I 2026-02-27 18:56:07,580] Trial 29 finished with value: 0.8175565662034809 and parameters: {'activation': 'logistic', 'solver': 'sgd', 'lr': 0.00025751562788980074, 'layer1': 291, 'layer2': 206, 'layer3': 127}. Best is trial 24 with value: 0.8643155241429833.

Pseudomonas_Aeruginosa | Imipenem | Optuna:  15%|█▌        | 30/200 [24:01<1:30:24, 31.91s/it, best=0.864][A
Pseudomonas_Aeruginosa | Imipenem | Optuna:  15%|█▌        | 30/200 [24:01<1:30:24, 31.91s/it, best=0.864][A[I 2026-02-27 18:56:35,648] Trial 99 finished with value: 0.8052839479643084 and parameters: {'activation': 'tanh', 'solver': 'adam', 'lr': 5.250410389605886e-05, 'layer1': 117, 'layer2': 303, 'layer3': 44}. Best is trial 55 with value: 0.8076668303114959.

Escherichia_Coli | Ciprofloxacin | Optuna:  50%|█████     | 100/200 [4:09:05<4:42:35, 169.55s/it, best=0.808][A
Escherichia_Coli | Ciprofloxacin | Optuna:  50%|█████     | 100/200 [4:09:05<4:42:35, 169.55s/it, best=0.808][A[I 2026-02-27 18:56:56,821] Trial 30 finished with value: 0.8534151804840764 and parameters: {'activation': 'relu', 'solver': 'adam', 'lr': 0.00019055495368765126, 'layer1': 97, 'layer2': 14, 'layer3': 115}. Best is trial 24 with value: 0.8643155241429833.

Pseudomonas_Aeruginosa | Imipenem | Optuna:  16%|█▌        | 31/200 [24:51<1:44:31, 37.11s/it, best=0.864][A
Pseudomonas_Aeruginosa | Imipenem | Optuna:  16%|█▌        | 31/200 [24:51<1:44:31, 37.11s/it, best=0.864][A[I 2026-02-27 18:57:13,565] Trial 132 finished with value: 0.814164327547952 and parameters: {'activation': 'identity', 'solver': 'adam', 'lr': 0.0021691979474920595, 'layer1': 414, 'layer2': 428, 'layer3': 248}. Best is trial 91 with value: 0.8315336183309556.

Klebsiella_Pneumoniae | Ciprofloxacin | Optuna:  66%|██████▋   | 133/200 [4:09:43<1:57:57, 105.64s/it, best=0.832][A
Klebsiella_Pneumoniae | Ciprofloxacin | Optuna:  66%|██████▋   | 133/200 [4:09:43<1:57:57, 105.64s/it, best=0.832][A[I 2026-02-27 18:57:36,757] Trial 31 finished with value: 0.858991179364898 and parameters: {'activation': 'relu', 'solver': 'adam', 'lr': 0.0020655557967181703, 'layer1': 186, 'layer2': 116, 'layer3': 47}. Best is trial 24 with value: 0.8643155241429833.

Pseudomonas_Aeruginosa | Imipenem | Optuna:  16%|█▌        | 32/200 [25:30<1:46:16, 37.96s/it, best=0.864][A
Pseudomonas_Aeruginosa | Imipenem | Optuna:  16%|█▌        | 32/200 [25:30<1:46:16, 37.96s/it, best=0.864][A[I 2026-02-27 18:58:07,717] Trial 113 finished with value: 0.9065928243587805 and parameters: {'activation': 'identity', 'solver': 'adam', 'lr': 0.00016315660346279397, 'layer1': 232, 'layer2': 449, 'layer3': 451}. Best is trial 84 with value: 0.9099428178723615.

Staphylococcus_Aureus | Oxacillin | Optuna:  57%|█████▋    | 114/200 [4:10:37<2:44:43, 114.93s/it, best=0.91][A
Staphylococcus_Aureus | Oxacillin | Optuna:  57%|█████▋    | 114/200 [4:10:37<2:44:43, 114.93s/it, best=0.91][A[I 2026-02-27 18:58:17,660] Trial 100 finished with value: 0.5417320519813462 and parameters: {'activation': 'tanh', 'solver': 'sgd', 'lr': 3.479112996755378e-05, 'layer1': 160, 'layer2': 151, 'layer3': 27}. Best is trial 55 with value: 0.8076668303114959.

Escherichia_Coli | Ciprofloxacin | Optuna:  50%|█████     | 101/200 [4:10:47<4:06:19, 149.29s/it, best=0.808][A
Escherichia_Coli | Ciprofloxacin | Optuna:  50%|█████     | 101/200 [4:10:47<4:06:19, 149.29s/it, best=0.808][A[I 2026-02-27 18:58:38,142] Trial 32 finished with value: 0.8600587764361988 and parameters: {'activation': 'relu', 'solver': 'adam', 'lr': 0.004768845380805212, 'layer1': 233, 'layer2': 56, 'layer3': 155}. Best is trial 24 with value: 0.8643155241429833.

Pseudomonas_Aeruginosa | Imipenem | Optuna:  16%|█▋        | 33/200 [26:32<2:05:12, 44.99s/it, best=0.864][A
Pseudomonas_Aeruginosa | Imipenem | Optuna:  16%|█▋        | 33/200 [26:32<2:05:12, 44.99s/it, best=0.864][A[I 2026-02-27 18:59:02,461] Trial 133 finished with value: 0.8206898308110839 and parameters: {'activation': 'identity', 'solver': 'adam', 'lr': 0.008582064598663197, 'layer1': 396, 'layer2': 444, 'layer3': 233}. Best is trial 91 with value: 0.8315336183309556.

Klebsiella_Pneumoniae | Ciprofloxacin | Optuna:  67%|██████▋   | 134/200 [4:11:32<1:57:16, 106.62s/it, best=0.832][A
Klebsiella_Pneumoniae | Ciprofloxacin | Optuna:  67%|██████▋   | 134/200 [4:11:32<1:57:16, 106.62s/it, best=0.832][A[I 2026-02-27 18:59:35,588] Trial 33 finished with value: 0.8583036261985943 and parameters: {'activation': 'logistic', 'solver': 'adam', 'lr': 0.0004912908705855878, 'layer1': 244, 'layer2': 95, 'layer3': 90}. Best is trial 24 with value: 0.8643155241429833.

Pseudomonas_Aeruginosa | Imipenem | Optuna:  17%|█▋        | 34/200 [27:29<2:14:48, 48.72s/it, best=0.864][A
Pseudomonas_Aeruginosa | Imipenem | Optuna:  17%|█▋        | 34/200 [27:29<2:14:48, 48.72s/it, best=0.864][A[I 2026-02-27 18:59:52,875] Trial 114 finished with value: 0.9066709751824431 and parameters: {'activation': 'identity', 'solver': 'adam', 'lr': 7.618585762019794e-05, 'layer1': 223, 'layer2': 210, 'layer3': 188}. Best is trial 84 with value: 0.9099428178723615.

Staphylococcus_Aureus | Oxacillin | Optuna:  57%|█████▊    | 115/200 [4:12:22<2:38:39, 112.00s/it, best=0.91][A
Staphylococcus_Aureus | Oxacillin | Optuna:  57%|█████▊    | 115/200 [4:12:22<2:38:39, 112.00s/it, best=0.91][A[I 2026-02-27 18:59:53,667] Trial 34 finished with value: 0.8185802286937287 and parameters: {'activation': 'relu', 'solver': 'adam', 'lr': 3.138812678676466e-05, 'layer1': 118, 'layer2': 251, 'layer3': 39}. Best is trial 24 with value: 0.8643155241429833.

Pseudomonas_Aeruginosa | Imipenem | Optuna:  18%|█▊        | 35/200 [27:47<1:48:42, 39.53s/it, best=0.864][A
Pseudomonas_Aeruginosa | Imipenem | Optuna:  18%|█▊        | 35/200 [27:47<1:48:42, 39.53s/it, best=0.864][A[I 2026-02-27 18:59:56,557] Trial 101 finished with value: 0.8032534195380885 and parameters: {'activation': 'tanh', 'solver': 'adam', 'lr': 8.718089012981637e-05, 'layer1': 139, 'layer2': 406, 'layer3': 37}. Best is trial 55 with value: 0.8076668303114959.

Escherichia_Coli | Ciprofloxacin | Optuna:  51%|█████     | 102/200 [4:12:25<3:39:08, 134.17s/it, best=0.808][A
Escherichia_Coli | Ciprofloxacin | Optuna:  51%|█████     | 102/200 [4:12:25<3:39:08, 134.17s/it, best=0.808][A[I 2026-02-27 19:00:28,414] Trial 35 finished with value: 0.8600689752644113 and parameters: {'activation': 'relu', 'solver': 'adam', 'lr': 0.0008365047330010581, 'layer1': 69, 'layer2': 134, 'layer3': 139}. Best is trial 24 with value: 0.8643155241429833.

Pseudomonas_Aeruginosa | Imipenem | Optuna:  18%|█▊        | 36/200 [28:22<1:44:07, 38.10s/it, best=0.864][A
Pseudomonas_Aeruginosa | Imipenem | Optuna:  18%|█▊        | 36/200 [28:22<1:44:07, 38.10s/it, best=0.864][A[I 2026-02-27 19:01:01,034] Trial 134 finished with value: 0.8241262594545106 and parameters: {'activation': 'identity', 'solver': 'adam', 'lr': 0.0013695532625766144, 'layer1': 440, 'layer2': 477, 'layer3': 166}. Best is trial 91 with value: 0.8315336183309556.

Klebsiella_Pneumoniae | Ciprofloxacin | Optuna:  68%|██████▊   | 135/200 [4:13:30<1:59:23, 110.20s/it, best=0.832][A
Klebsiella_Pneumoniae | Ciprofloxacin | Optuna:  68%|██████▊   | 135/200 [4:13:30<1:59:23, 110.20s/it, best=0.832][A[I 2026-02-27 19:01:25,830] Trial 36 finished with value: 0.8605565835166569 and parameters: {'activation': 'relu', 'solver': 'adam', 'lr': 0.0018248921802620688, 'layer1': 167, 'layer2': 166, 'layer3': 105}. Best is trial 24 with value: 0.8643155241429833.

Pseudomonas_Aeruginosa | Imipenem | Optuna:  18%|█▊        | 37/200 [29:20<1:59:14, 43.89s/it, best=0.864][A
Pseudomonas_Aeruginosa | Imipenem | Optuna:  18%|█▊        | 37/200 [29:20<1:59:14, 43.89s/it, best=0.864][A[I 2026-02-27 19:01:59,614] Trial 102 finished with value: 0.8016077719154138 and parameters: {'activation': 'tanh', 'solver': 'adam', 'lr': 4.268129843575598e-05, 'layer1': 92, 'layer2': 454, 'layer3': 58}. Best is trial 55 with value: 0.8076668303114959.

Escherichia_Coli | Ciprofloxacin | Optuna:  52%|█████▏    | 103/200 [4:14:28<3:31:31, 130.84s/it, best=0.808][A
Escherichia_Coli | Ciprofloxacin | Optuna:  52%|█████▏    | 103/200 [4:14:28<3:31:31, 130.84s/it, best=0.808][A[I 2026-02-27 19:02:01,314] Trial 115 finished with value: 0.9050422714766239 and parameters: {'activation': 'identity', 'solver': 'adam', 'lr': 4.270941484982785e-05, 'layer1': 315, 'layer2': 295, 'layer3': 464}. Best is trial 84 with value: 0.9099428178723615.

Staphylococcus_Aureus | Oxacillin | Optuna:  58%|█████▊    | 116/200 [4:14:30<2:43:42, 116.93s/it, best=0.91][A
Staphylococcus_Aureus | Oxacillin | Optuna:  58%|█████▊    | 116/200 [4:14:30<2:43:42, 116.93s/it, best=0.91][A[I 2026-02-27 19:02:04,724] Trial 37 finished with value: 0.8398259154109929 and parameters: {'activation': 'tanh', 'solver': 'adam', 'lr': 0.004860364207427059, 'layer1': 257, 'layer2': 62, 'layer3': 166}. Best is trial 24 with value: 0.8643155241429833.

Pseudomonas_Aeruginosa | Imipenem | Optuna:  19%|█▉        | 38/200 [29:58<1:54:27, 42.39s/it, best=0.864][A
Pseudomonas_Aeruginosa | Imipenem | Optuna:  19%|█▉        | 38/200 [29:58<1:54:27, 42.39s/it, best=0.864][A[I 2026-02-27 19:02:20,881] Trial 38 finished with value: 0.8175565662034809 and parameters: {'activation': 'relu', 'solver': 'sgd', 'lr': 0.0007863406555837861, 'layer1': 269, 'layer2': 41, 'layer3': 69}. Best is trial 24 with value: 0.8643155241429833.

Pseudomonas_Aeruginosa | Imipenem | Optuna:  20%|█▉        | 39/200 [30:15<1:32:38, 34.52s/it, best=0.864][A
Pseudomonas_Aeruginosa | Imipenem | Optuna:  20%|█▉        | 39/200 [30:15<1:32:38, 34.52s/it, best=0.864][A[I 2026-02-27 19:02:37,926] Trial 135 finished with value: 0.8212637144335526 and parameters: {'activation': 'identity', 'solver': 'adam', 'lr': 0.0031560194148251087, 'layer1': 430, 'layer2': 462, 'layer3': 221}. Best is trial 91 with value: 0.8315336183309556.

Klebsiella_Pneumoniae | Ciprofloxacin | Optuna:  68%|██████▊   | 136/200 [4:15:07<1:53:17, 106.21s/it, best=0.832][A
Klebsiella_Pneumoniae | Ciprofloxacin | Optuna:  68%|██████▊   | 136/200 [4:15:07<1:53:17, 106.21s/it, best=0.832][A[I 2026-02-27 19:02:47,327] Trial 39 finished with value: 0.8175565662034809 and parameters: {'activation': 'logistic', 'solver': 'adam', 'lr': 9.07330211440507e-06, 'layer1': 150, 'layer2': 241, 'layer3': 32}. Best is trial 24 with value: 0.8643155241429833.

Pseudomonas_Aeruginosa | Imipenem | Optuna:  20%|██        | 40/200 [30:41<1:25:35, 32.10s/it, best=0.864][A
Pseudomonas_Aeruginosa | Imipenem | Optuna:  20%|██        | 40/200 [30:41<1:25:35, 32.10s/it, best=0.864][A[I 2026-02-27 19:02:47,985] Trial 116 finished with value: 0.7192401026996285 and parameters: {'activation': 'identity', 'solver': 'sgd', 'lr': 0.0004410772410885127, 'layer1': 351, 'layer2': 434, 'layer3': 500}. Best is trial 84 with value: 0.9099428178723615.

Staphylococcus_Aureus | Oxacillin | Optuna:  58%|█████▊    | 117/200 [4:15:17<2:12:35, 95.85s/it, best=0.91] [A
Staphylococcus_Aureus | Oxacillin | Optuna:  58%|█████▊    | 117/200 [4:15:17<2:12:35, 95.85s/it, best=0.91][A[I 2026-02-27 19:03:19,764] Trial 103 finished with value: 0.7994369449681942 and parameters: {'activation': 'tanh', 'solver': 'adam', 'lr': 0.00013429668325419853, 'layer1': 130, 'layer2': 353, 'layer3': 29}. Best is trial 55 with value: 0.8076668303114959.

Escherichia_Coli | Ciprofloxacin | Optuna:  52%|█████▏    | 104/200 [4:15:49<3:05:00, 115.63s/it, best=0.808][A
Escherichia_Coli | Ciprofloxacin | Optuna:  52%|█████▏    | 104/200 [4:15:49<3:05:00, 115.63s/it, best=0.808][A[I 2026-02-27 19:03:59,312] Trial 40 finished with value: 0.8635292072041644 and parameters: {'activation': 'relu', 'solver': 'adam', 'lr': 0.00321153409871737, 'layer1': 206, 'layer2': 286, 'layer3': 99}. Best is trial 24 with value: 0.8643155241429833.

Pseudomonas_Aeruginosa | Imipenem | Optuna:  20%|██        | 41/200 [31:53<1:56:46, 44.06s/it, best=0.864][A
Pseudomonas_Aeruginosa | Imipenem | Optuna:  20%|██        | 41/200 [31:53<1:56:46, 44.06s/it, best=0.864][A[I 2026-02-27 19:04:39,321] Trial 117 finished with value: 0.9075490168825265 and parameters: {'activation': 'identity', 'solver': 'adam', 'lr': 0.000195170145317028, 'layer1': 161, 'layer2': 243, 'layer3': 436}. Best is trial 84 with value: 0.9099428178723615.

Staphylococcus_Aureus | Oxacillin | Optuna:  59%|█████▉    | 118/200 [4:17:08<2:17:20, 100.50s/it, best=0.91][A
Staphylococcus_Aureus | Oxacillin | Optuna:  59%|█████▉    | 118/200 [4:17:08<2:17:20, 100.50s/it, best=0.91][A[I 2026-02-27 19:04:55,804] Trial 41 finished with value: 0.8625977733114386 and parameters: {'activation': 'relu', 'solver': 'adam', 'lr': 0.003299101764208879, 'layer1': 196, 'layer2': 315, 'layer3': 99}. Best is trial 24 with value: 0.8643155241429833.

Pseudomonas_Aeruginosa | Imipenem | Optuna:  21%|██        | 42/200 [32:50<2:05:51, 47.79s/it, best=0.864][A
Pseudomonas_Aeruginosa | Imipenem | Optuna:  21%|██        | 42/200 [32:50<2:05:51, 47.79s/it, best=0.864][A[I 2026-02-27 19:05:16,189] Trial 136 finished with value: 0.8260883678829666 and parameters: {'activation': 'identity', 'solver': 'adam', 'lr': 3.516556040021647e-05, 'layer1': 448, 'layer2': 384, 'layer3': 190}. Best is trial 91 with value: 0.8315336183309556.

Klebsiella_Pneumoniae | Ciprofloxacin | Optuna:  68%|██████▊   | 137/200 [4:17:45<2:07:55, 121.83s/it, best=0.832][A
Klebsiella_Pneumoniae | Ciprofloxacin | Optuna:  68%|██████▊   | 137/200 [4:17:45<2:07:55, 121.83s/it, best=0.832][A[I 2026-02-27 19:06:07,668] Trial 42 finished with value: 0.8645324176837453 and parameters: {'activation': 'relu', 'solver': 'adam', 'lr': 0.0059382030955676905, 'layer1': 212, 'layer2': 315, 'layer3': 102}. Best is trial 42 with value: 0.8645324176837453.

Pseudomonas_Aeruginosa | Imipenem | Optuna:  22%|██▏       | 43/200 [34:01<2:23:57, 55.01s/it, best=0.864][A
Pseudomonas_Aeruginosa | Imipenem | Optuna:  22%|██▏       | 43/200 [34:01<2:23:57, 55.01s/it, best=0.865][A[I 2026-02-27 19:06:33,744] Trial 43 finished with value: 0.8203387075715627 and parameters: {'activation': 'relu', 'solver': 'adam', 'lr': 1.2403668302547623e-06, 'layer1': 281, 'layer2': 311, 'layer3': 189}. Best is trial 42 with value: 0.8645324176837453.

Pseudomonas_Aeruginosa | Imipenem | Optuna:  22%|██▏       | 44/200 [34:27<2:00:27, 46.33s/it, best=0.865][A
Pseudomonas_Aeruginosa | Imipenem | Optuna:  22%|██▏       | 44/200 [34:27<2:00:27, 46.33s/it, best=0.865][A[I 2026-02-27 19:07:01,834] Trial 104 finished with value: 0.8047403881196835 and parameters: {'activation': 'tanh', 'solver': 'adam', 'lr': 1.64979826165799e-05, 'layer1': 174, 'layer2': 420, 'layer3': 91}. Best is trial 55 with value: 0.8076668303114959.

Escherichia_Coli | Ciprofloxacin | Optuna:  52%|█████▎    | 105/200 [4:19:31<3:53:38, 147.56s/it, best=0.808][A
Escherichia_Coli | Ciprofloxacin | Optuna:  52%|█████▎    | 105/200 [4:19:31<3:53:38, 147.56s/it, best=0.808][A[I 2026-02-27 19:07:18,518] Trial 118 finished with value: 0.907525689599866 and parameters: {'activation': 'identity', 'solver': 'adam', 'lr': 0.00010687194966649011, 'layer1': 373, 'layer2': 405, 'layer3': 231}. Best is trial 84 with value: 0.9099428178723615.

Staphylococcus_Aureus | Oxacillin | Optuna:  60%|█████▉    | 119/200 [4:19:48<2:39:26, 118.11s/it, best=0.91][A
Staphylococcus_Aureus | Oxacillin | Optuna:  60%|█████▉    | 119/200 [4:19:48<2:39:26, 118.11s/it, best=0.91][A[I 2026-02-27 19:07:26,857] Trial 44 finished with value: 0.8499907579254902 and parameters: {'activation': 'relu', 'solver': 'adam', 'lr': 0.006122963494766668, 'layer1': 221, 'layer2': 286, 'layer3': 152}. Best is trial 42 with value: 0.8645324176837453.

Pseudomonas_Aeruginosa | Imipenem | Optuna:  22%|██▎       | 45/200 [35:21<2:04:56, 48.37s/it, best=0.865][A
