Klebsiella_Pneumoniae | Imipenem | Optuna:  66%|██████▋   | 133/200 [1:43:12<47:20, 42.39s/it, best=0.986][A[I 2026-02-28 05:12:02,774] Trial 142 finished with value: 0.8955026403626928 and parameters: {'activation': 'relu', 'solver': 'adam', 'lr': 7.172902582556932e-05, 'layer1': 491, 'layer2': 388, 'layer3': 77}. Best is trial 137 with value: 0.8979080367540411.

Escherichia_Coli | Ceftriaxone | Optuna:  72%|███████▏  | 143/200 [6:02:04<2:28:55, 156.77s/it, best=0.898][A
Escherichia_Coli | Ceftriaxone | Optuna:  72%|███████▏  | 143/200 [6:02:04<2:28:55, 156.77s/it, best=0.898][A[I 2026-02-28 05:12:42,228] Trial 133 finished with value: 0.9837115306723228 and parameters: {'activation': 'relu', 'solver': 'adam', 'lr': 0.0017567371110287922, 'layer1': 56, 'layer2': 282, 'layer3': 481}. Best is trial 13 with value: 0.9860492846658779.

Klebsiella_Pneumoniae | Imipenem | Optuna:  67%|██████▋   | 134/200 [1:43:54<46:44, 42.49s/it, best=0.986][A
Klebsiella_Pneumoniae | Imipenem | Optuna:  67%|██████▋   | 134/200 [1:43:54<46:44, 42.49s/it, best=0.986][A[I 2026-02-28 05:13:25,766] Trial 91 finished with value: 0.9268604225793433 and parameters: {'activation': 'identity', 'solver': 'adam', 'lr': 6.261434794968556e-05, 'layer1': 248, 'layer2': 144, 'layer3': 239}. Best is trial 77 with value: 0.9283869597728589.

Staphylococcus_Aureus | Fusidic acid | Optuna:  46%|████▌     | 92/200 [2:32:34<2:31:13, 84.02s/it, best=0.928][A
Staphylococcus_Aureus | Fusidic acid | Optuna:  46%|████▌     | 92/200 [2:32:34<2:31:13, 84.02s/it, best=0.928][A[I 2026-02-28 05:13:44,472] Trial 134 finished with value: 0.9840609928339596 and parameters: {'activation': 'relu', 'solver': 'adam', 'lr': 0.0021465028062557295, 'layer1': 404, 'layer2': 355, 'layer3': 444}. Best is trial 13 with value: 0.9860492846658779.

Klebsiella_Pneumoniae | Imipenem | Optuna:  68%|██████▊   | 135/200 [1:44:57<52:26, 48.41s/it, best=0.986][A
Klebsiella_Pneumoniae | Imipenem | Optuna:  68%|██████▊   | 135/200 [1:44:57<52:26, 48.41s/it, best=0.986][A[I 2026-02-28 05:13:59,898] Trial 129 finished with value: 0.86753909189995 and parameters: {'activation': 'identity', 'solver': 'adam', 'lr': 0.0009453892084706306, 'layer1': 440, 'layer2': 322, 'layer3': 449}. Best is trial 63 with value: 0.8682133709784562.
Pseudomonas_Aeruginosa | LPS | Optuna:  65%|██████▌   | 130/200 [3:09:01<1:45:15, 90.22s/it, best=0.868]Pseudomonas_Aeruginosa | LPS | Optuna:  65%|██████▌   | 130/200 [3:09:01<1:45:15, 90.22s/it, best=0.868]/export/usuarios01/egarroyo/MALDI_for_AMR_prediction/venv/lib/python3.13/site-packages/sklearn/model_selection/_split.py:813: UserWarning: The least populated class in y has only 4 members, which is less than n_splits=5.
  warnings.warn(
[I 2026-02-28 05:14:20,005] Trial 135 finished with value: 0.9834510344392171 and parameters: {'activation': 'relu', 'solver': 'adam', 'lr': 0.002813312753449278, 'layer1': 36, 'layer2': 305, 'layer3': 406}. Best is trial 13 with value: 0.9860492846658779.

Klebsiella_Pneumoniae | Imipenem | Optuna:  68%|██████▊   | 136/200 [1:45:32<47:31, 44.55s/it, best=0.986][A
Klebsiella_Pneumoniae | Imipenem | Optuna:  68%|██████▊   | 136/200 [1:45:32<47:31, 44.55s/it, best=0.986][A[I 2026-02-28 05:14:42,330] Trial 92 finished with value: 0.9249914522635475 and parameters: {'activation': 'identity', 'solver': 'adam', 'lr': 7.852387501155199e-05, 'layer1': 238, 'layer2': 116, 'layer3': 135}. Best is trial 77 with value: 0.9283869597728589.

Staphylococcus_Aureus | Fusidic acid | Optuna:  46%|████▋     | 93/200 [2:33:51<2:25:50, 81.78s/it, best=0.928][A
Staphylococcus_Aureus | Fusidic acid | Optuna:  46%|████▋     | 93/200 [2:33:51<2:25:50, 81.78s/it, best=0.928][A[I 2026-02-28 05:15:12,631] Trial 136 finished with value: 0.983395116007548 and parameters: {'activation': 'relu', 'solver': 'adam', 'lr': 0.0005910194971173408, 'layer1': 194, 'layer2': 375, 'layer3': 466}. Best is trial 13 with value: 0.9860492846658779.

Klebsiella_Pneumoniae | Imipenem | Optuna:  68%|██████▊   | 137/200 [1:46:25<49:19, 46.97s/it, best=0.986][A
Klebsiella_Pneumoniae | Imipenem | Optuna:  68%|██████▊   | 137/200 [1:46:25<49:19, 46.97s/it, best=0.986][A[I 2026-02-28 05:15:34,052] Trial 143 finished with value: 0.8937068254380389 and parameters: {'activation': 'relu', 'solver': 'adam', 'lr': 3.4068615109433494e-05, 'layer1': 482, 'layer2': 412, 'layer3': 33}. Best is trial 137 with value: 0.8979080367540411.

Escherichia_Coli | Ceftriaxone | Optuna:  72%|███████▏  | 144/200 [6:05:35<2:41:34, 173.12s/it, best=0.898][A
Escherichia_Coli | Ceftriaxone | Optuna:  72%|███████▏  | 144/200 [6:05:35<2:41:34, 173.12s/it, best=0.898][A[I 2026-02-28 05:15:47,297] Trial 137 finished with value: 0.9800270054346416 and parameters: {'activation': 'logistic', 'solver': 'sgd', 'lr': 0.0008702231987101717, 'layer1': 476, 'layer2': 343, 'layer3': 499}. Best is trial 13 with value: 0.9860492846658779.

Klebsiella_Pneumoniae | Imipenem | Optuna:  69%|██████▉   | 138/200 [1:46:59<44:43, 43.28s/it, best=0.986][A
Klebsiella_Pneumoniae | Imipenem | Optuna:  69%|██████▉   | 138/200 [1:46:59<44:43, 43.28s/it, best=0.986][A[I 2026-02-28 05:15:47,303] Trial 130 finished with value: 0.8632894104832953 and parameters: {'activation': 'identity', 'solver': 'adam', 'lr': 0.001010817867604806, 'layer1': 434, 'layer2': 483, 'layer3': 446}. Best is trial 63 with value: 0.8682133709784562.
Pseudomonas_Aeruginosa | LPS | Optuna:  66%|██████▌   | 131/200 [3:10:49<1:49:41, 95.38s/it, best=0.868]Pseudomonas_Aeruginosa | LPS | Optuna:  66%|██████▌   | 131/200 [3:10:49<1:49:41, 95.38s/it, best=0.868]/export/usuarios01/egarroyo/MALDI_for_AMR_prediction/venv/lib/python3.13/site-packages/sklearn/model_selection/_split.py:813: UserWarning: The least populated class in y has only 4 members, which is less than n_splits=5.
  warnings.warn(
[I 2026-02-28 05:16:03,776] Trial 93 finished with value: 0.9215678492382118 and parameters: {'activation': 'identity', 'solver': 'adam', 'lr': 0.002772216070171992, 'layer1': 360, 'layer2': 174, 'layer3': 163}. Best is trial 77 with value: 0.9283869597728589.

Staphylococcus_Aureus | Fusidic acid | Optuna:  47%|████▋     | 94/200 [2:35:12<2:24:18, 81.68s/it, best=0.928][A
Staphylococcus_Aureus | Fusidic acid | Optuna:  47%|████▋     | 94/200 [2:35:12<2:24:18, 81.68s/it, best=0.928][A[I 2026-02-28 05:16:33,427] Trial 138 finished with value: 0.9819898047648248 and parameters: {'activation': 'relu', 'solver': 'adam', 'lr': 0.0006949978575392864, 'layer1': 461, 'layer2': 291, 'layer3': 426}. Best is trial 13 with value: 0.9860492846658779.

Klebsiella_Pneumoniae | Imipenem | Optuna:  70%|██████▉   | 139/200 [1:47:46<44:52, 44.14s/it, best=0.986][A
Klebsiella_Pneumoniae | Imipenem | Optuna:  70%|██████▉   | 139/200 [1:47:46<44:52, 44.14s/it, best=0.986][A[I 2026-02-28 05:17:20,012] Trial 139 finished with value: 0.9848340719246211 and parameters: {'activation': 'relu', 'solver': 'adam', 'lr': 0.0014140027373007755, 'layer1': 81, 'layer2': 183, 'layer3': 386}. Best is trial 13 with value: 0.9860492846658779.

Klebsiella_Pneumoniae | Imipenem | Optuna:  70%|███████   | 140/200 [1:48:32<44:52, 44.87s/it, best=0.986][A
Klebsiella_Pneumoniae | Imipenem | Optuna:  70%|███████   | 140/200 [1:48:32<44:52, 44.87s/it, best=0.986][A[I 2026-02-28 05:17:36,702] Trial 131 finished with value: 0.8649585860776237 and parameters: {'activation': 'identity', 'solver': 'adam', 'lr': 0.0015507525205229408, 'layer1': 420, 'layer2': 327, 'layer3': 433}. Best is trial 63 with value: 0.8682133709784562.
Pseudomonas_Aeruginosa | LPS | Optuna:  66%|██████▌   | 132/200 [3:12:38<1:52:51, 99.58s/it, best=0.868]Pseudomonas_Aeruginosa | LPS | Optuna:  66%|██████▌   | 132/200 [3:12:38<1:52:51, 99.58s/it, best=0.868]/export/usuarios01/egarroyo/MALDI_for_AMR_prediction/venv/lib/python3.13/site-packages/sklearn/model_selection/_split.py:813: UserWarning: The least populated class in y has only 4 members, which is less than n_splits=5.
  warnings.warn(
[I 2026-02-28 05:17:54,487] Trial 140 finished with value: 0.9840340984377658 and parameters: {'activation': 'relu', 'solver': 'adam', 'lr': 0.001312035538629434, 'layer1': 124, 'layer2': 66, 'layer3': 384}. Best is trial 13 with value: 0.9860492846658779.

Klebsiella_Pneumoniae | Imipenem | Optuna:  70%|███████   | 141/200 [1:49:07<41:03, 41.75s/it, best=0.986][A
Klebsiella_Pneumoniae | Imipenem | Optuna:  70%|███████   | 141/200 [1:49:07<41:03, 41.75s/it, best=0.986][A[I 2026-02-28 05:17:55,049] Trial 94 finished with value: 0.9204748346146179 and parameters: {'activation': 'identity', 'solver': 'adam', 'lr': 2.1923782004566022e-05, 'layer1': 300, 'layer2': 151, 'layer3': 176}. Best is trial 77 with value: 0.9283869597728589.

Staphylococcus_Aureus | Fusidic acid | Optuna:  48%|████▊     | 95/200 [2:37:04<2:38:28, 90.56s/it, best=0.928][A
Staphylococcus_Aureus | Fusidic acid | Optuna:  48%|████▊     | 95/200 [2:37:04<2:38:28, 90.56s/it, best=0.928][A[I 2026-02-28 05:18:28,647] Trial 141 finished with value: 0.9829733840622789 and parameters: {'activation': 'relu', 'solver': 'adam', 'lr': 0.0016303361655984761, 'layer1': 93, 'layer2': 189, 'layer3': 397}. Best is trial 13 with value: 0.9860492846658779.

Klebsiella_Pneumoniae | Imipenem | Optuna:  71%|███████   | 142/200 [1:49:41<38:09, 39.47s/it, best=0.986][A
Klebsiella_Pneumoniae | Imipenem | Optuna:  71%|███████   | 142/200 [1:49:41<38:09, 39.47s/it, best=0.986][A[I 2026-02-28 05:18:49,327] Trial 144 finished with value: 0.8951276644542553 and parameters: {'activation': 'relu', 'solver': 'adam', 'lr': 5.722887150691949e-05, 'layer1': 470, 'layer2': 10, 'layer3': 64}. Best is trial 137 with value: 0.8979080367540411.

Escherichia_Coli | Ceftriaxone | Optuna:  72%|███████▎  | 145/200 [6:08:50<2:44:47, 179.77s/it, best=0.898][A
Escherichia_Coli | Ceftriaxone | Optuna:  72%|███████▎  | 145/200 [6:08:50<2:44:47, 179.77s/it, best=0.898][A[I 2026-02-28 05:19:10,679] Trial 142 finished with value: 0.9847501365753514 and parameters: {'activation': 'relu', 'solver': 'adam', 'lr': 0.0011277977077322847, 'layer1': 83, 'layer2': 337, 'layer3': 375}. Best is trial 13 with value: 0.9860492846658779.

Klebsiella_Pneumoniae | Imipenem | Optuna:  72%|███████▏  | 143/200 [1:50:23<38:13, 40.24s/it, best=0.986][A
Klebsiella_Pneumoniae | Imipenem | Optuna:  72%|███████▏  | 143/200 [1:50:23<38:13, 40.24s/it, best=0.986][A[I 2026-02-28 05:19:12,111] Trial 95 finished with value: 0.9254212414492609 and parameters: {'activation': 'identity', 'solver': 'adam', 'lr': 0.00011619307453316228, 'layer1': 254, 'layer2': 102, 'layer3': 199}. Best is trial 77 with value: 0.9283869597728589.

Staphylococcus_Aureus | Fusidic acid | Optuna:  48%|████▊     | 96/200 [2:38:21<2:29:56, 86.51s/it, best=0.928][A
Staphylococcus_Aureus | Fusidic acid | Optuna:  48%|████▊     | 96/200 [2:38:21<2:29:56, 86.51s/it, best=0.928][A[I 2026-02-28 05:19:28,552] Trial 132 finished with value: 0.8619422820467522 and parameters: {'activation': 'identity', 'solver': 'adam', 'lr': 0.0008489732181870904, 'layer1': 476, 'layer2': 352, 'layer3': 485}. Best is trial 63 with value: 0.8682133709784562.
Pseudomonas_Aeruginosa | LPS | Optuna:  66%|██████▋   | 133/200 [3:14:30<1:55:18, 103.26s/it, best=0.868]Pseudomonas_Aeruginosa | LPS | Optuna:  66%|██████▋   | 133/200 [3:14:30<1:55:18, 103.26s/it, best=0.868]/export/usuarios01/egarroyo/MALDI_for_AMR_prediction/venv/lib/python3.13/site-packages/sklearn/model_selection/_split.py:813: UserWarning: The least populated class in y has only 4 members, which is less than n_splits=5.
  warnings.warn(
[I 2026-02-28 05:19:55,124] Trial 143 finished with value: 0.9830528681877911 and parameters: {'activation': 'relu', 'solver': 'adam', 'lr': 0.0010328643102912973, 'layer1': 81, 'layer2': 341, 'layer3': 373}. Best is trial 13 with value: 0.9860492846658779.

Klebsiella_Pneumoniae | Imipenem | Optuna:  72%|███████▏  | 144/200 [1:51:07<38:44, 41.50s/it, best=0.986][A
Klebsiella_Pneumoniae | Imipenem | Optuna:  72%|███████▏  | 144/200 [1:51:07<38:44, 41.50s/it, best=0.986][A[I 2026-02-28 05:19:58,350] Trial 96 finished with value: 0.9137109635168146 and parameters: {'activation': 'relu', 'solver': 'adam', 'lr': 0.006367890289984826, 'layer1': 206, 'layer2': 195, 'layer3': 102}. Best is trial 77 with value: 0.9283869597728589.

Staphylococcus_Aureus | Fusidic acid | Optuna:  48%|████▊     | 97/200 [2:39:07<2:07:46, 74.43s/it, best=0.928][A
Staphylococcus_Aureus | Fusidic acid | Optuna:  48%|████▊     | 97/200 [2:39:07<2:07:46, 74.43s/it, best=0.928][A[I 2026-02-28 05:20:34,115] Trial 144 finished with value: 0.9836625737580629 and parameters: {'activation': 'relu', 'solver': 'adam', 'lr': 0.0011478251360519094, 'layer1': 106, 'layer2': 334, 'layer3': 413}. Best is trial 13 with value: 0.9860492846658779.

Klebsiella_Pneumoniae | Imipenem | Optuna:  72%|███████▎  | 145/200 [1:51:46<37:21, 40.75s/it, best=0.986][A
Klebsiella_Pneumoniae | Imipenem | Optuna:  72%|███████▎  | 145/200 [1:51:46<37:21, 40.75s/it, best=0.986][A[I 2026-02-28 05:20:50,685] Trial 97 finished with value: 0.9049680400752169 and parameters: {'activation': 'identity', 'solver': 'sgd', 'lr': 0.000733858253562629, 'layer1': 322, 'layer2': 467, 'layer3': 70}. Best is trial 77 with value: 0.9283869597728589.

Staphylococcus_Aureus | Fusidic acid | Optuna:  49%|████▉     | 98/200 [2:39:59<1:55:15, 67.80s/it, best=0.928][A
Staphylococcus_Aureus | Fusidic acid | Optuna:  49%|████▉     | 98/200 [2:39:59<1:55:15, 67.80s/it, best=0.928][A[I 2026-02-28 05:21:08,709] Trial 145 finished with value: 0.9823572724640488 and parameters: {'activation': 'relu', 'solver': 'adam', 'lr': 0.0013761008571108349, 'layer1': 69, 'layer2': 316, 'layer3': 387}. Best is trial 13 with value: 0.9860492846658779.

Klebsiella_Pneumoniae | Imipenem | Optuna:  73%|███████▎  | 146/200 [1:52:21<35:00, 38.90s/it, best=0.986][A
Klebsiella_Pneumoniae | Imipenem | Optuna:  73%|███████▎  | 146/200 [1:52:21<35:00, 38.90s/it, best=0.986][A[I 2026-02-28 05:21:14,278] Trial 133 finished with value: 0.8627261799798867 and parameters: {'activation': 'identity', 'solver': 'adam', 'lr': 0.002905951946474209, 'layer1': 443, 'layer2': 341, 'layer3': 472}. Best is trial 63 with value: 0.8682133709784562.
Pseudomonas_Aeruginosa | LPS | Optuna:  67%|██████▋   | 134/200 [3:16:16<1:54:24, 104.00s/it, best=0.868]Pseudomonas_Aeruginosa | LPS | Optuna:  67%|██████▋   | 134/200 [3:16:16<1:54:24, 104.00s/it, best=0.868]/export/usuarios01/egarroyo/MALDI_for_AMR_prediction/venv/lib/python3.13/site-packages/sklearn/model_selection/_split.py:813: UserWarning: The least populated class in y has only 4 members, which is less than n_splits=5.
  warnings.warn(
[I 2026-02-28 05:21:15,523] Trial 145 finished with value: 0.8943995640819239 and parameters: {'activation': 'relu', 'solver': 'adam', 'lr': 0.00011757481905277331, 'layer1': 437, 'layer2': 365, 'layer3': 456}. Best is trial 137 with value: 0.8979080367540411.

Escherichia_Coli | Ceftriaxone | Optuna:  73%|███████▎  | 146/200 [6:11:17<2:32:43, 169.70s/it, best=0.898][A
Escherichia_Coli | Ceftriaxone | Optuna:  73%|███████▎  | 146/200 [6:11:17<2:32:43, 169.70s/it, best=0.898][A[I 2026-02-28 05:21:46,572] Trial 146 finished with value: 0.9826556815912362 and parameters: {'activation': 'identity', 'solver': 'adam', 'lr': 0.0008809477744315011, 'layer1': 156, 'layer2': 452, 'layer3': 358}. Best is trial 13 with value: 0.9860492846658779.

Klebsiella_Pneumoniae | Imipenem | Optuna:  74%|███████▎  | 147/200 [1:52:59<34:05, 38.59s/it, best=0.986][A
Klebsiella_Pneumoniae | Imipenem | Optuna:  74%|███████▎  | 147/200 [1:52:59<34:05, 38.59s/it, best=0.986][A[I 2026-02-28 05:22:23,141] Trial 147 finished with value: 0.9800270054346416 and parameters: {'activation': 'relu', 'solver': 'adam', 'lr': 3.514010683327813e-05, 'layer1': 345, 'layer2': 324, 'layer3': 348}. Best is trial 13 with value: 0.9860492846658779.

Klebsiella_Pneumoniae | Imipenem | Optuna:  74%|███████▍  | 148/200 [1:53:35<32:55, 37.98s/it, best=0.986][A
Klebsiella_Pneumoniae | Imipenem | Optuna:  74%|███████▍  | 148/200 [1:53:35<32:55, 37.98s/it, best=0.986][A[I 2026-02-28 05:22:42,996] Trial 98 finished with value: 0.9277054138643749 and parameters: {'activation': 'identity', 'solver': 'adam', 'lr': 8.585336982151198e-05, 'layer1': 399, 'layer2': 77, 'layer3': 143}. Best is trial 77 with value: 0.9283869597728589.

Staphylococcus_Aureus | Fusidic acid | Optuna:  50%|████▉     | 99/200 [2:41:52<2:16:36, 81.15s/it, best=0.928][A
Staphylococcus_Aureus | Fusidic acid | Optuna:  50%|████▉     | 99/200 [2:41:52<2:16:36, 81.15s/it, best=0.928][A[I 2026-02-28 05:22:51,559] Trial 134 finished with value: 0.865820024024093 and parameters: {'activation': 'identity', 'solver': 'adam', 'lr': 0.0004953152269860955, 'layer1': 383, 'layer2': 322, 'layer3': 131}. Best is trial 63 with value: 0.8682133709784562.
Pseudomonas_Aeruginosa | LPS | Optuna:  68%|██████▊   | 135/200 [3:17:53<1:50:29, 101.99s/it, best=0.868]Pseudomonas_Aeruginosa | LPS | Optuna:  68%|██████▊   | 135/200 [3:17:53<1:50:29, 101.99s/it, best=0.868]/export/usuarios01/egarroyo/MALDI_for_AMR_prediction/venv/lib/python3.13/site-packages/sklearn/model_selection/_split.py:813: UserWarning: The least populated class in y has only 4 members, which is less than n_splits=5.
  warnings.warn(
[I 2026-02-28 05:23:26,745] Trial 148 finished with value: 0.984302249975201 and parameters: {'activation': 'relu', 'solver': 'adam', 'lr': 0.0017778536763197886, 'layer1': 487, 'layer2': 356, 'layer3': 401}. Best is trial 13 with value: 0.9860492846658779.

Klebsiella_Pneumoniae | Imipenem | Optuna:  74%|███████▍  | 149/200 [1:54:39<38:49, 45.67s/it, best=0.986][A
Klebsiella_Pneumoniae | Imipenem | Optuna:  74%|███████▍  | 149/200 [1:54:39<38:49, 45.67s/it, best=0.986][A[I 2026-02-28 05:24:27,337] Trial 146 finished with value: 0.8952994369718411 and parameters: {'activation': 'relu', 'solver': 'adam', 'lr': 4.3970738920216546e-05, 'layer1': 492, 'layer2': 347, 'layer3': 99}. Best is trial 137 with value: 0.8979080367540411.

Escherichia_Coli | Ceftriaxone | Optuna:  74%|███████▎  | 147/200 [6:14:28<2:35:45, 176.33s/it, best=0.898][A
Escherichia_Coli | Ceftriaxone | Optuna:  74%|███████▎  | 147/200 [6:14:28<2:35:45, 176.33s/it, best=0.898][A[I 2026-02-28 05:24:29,532] Trial 149 finished with value: 0.9837163959667233 and parameters: {'activation': 'relu', 'solver': 'adam', 'lr': 0.0004744063473810143, 'layer1': 499, 'layer2': 389, 'layer3': 164}. Best is trial 13 with value: 0.9860492846658779.

Klebsiella_Pneumoniae | Imipenem | Optuna:  75%|███████▌  | 150/200 [1:55:42<42:20, 50.81s/it, best=0.986][A
Klebsiella_Pneumoniae | Imipenem | Optuna:  75%|███████▌  | 150/200 [1:55:42<42:20, 50.81s/it, best=0.986][A[I 2026-02-28 05:24:37,178] Trial 99 finished with value: 0.9280569496917378 and parameters: {'activation': 'identity', 'solver': 'adam', 'lr': 0.0002496030895125129, 'layer1': 400, 'layer2': 80, 'layer3': 118}. Best is trial 77 with value: 0.9283869597728589.

Staphylococcus_Aureus | Fusidic acid | Optuna:  50%|█████     | 100/200 [2:43:46<2:31:46, 91.06s/it, best=0.928][A
Staphylococcus_Aureus | Fusidic acid | Optuna:  50%|█████     | 100/200 [2:43:46<2:31:46, 91.06s/it, best=0.928][A[I 2026-02-28 05:24:42,053] Trial 135 finished with value: 0.8625529273758967 and parameters: {'activation': 'identity', 'solver': 'adam', 'lr': 0.0001376817927206078, 'layer1': 406, 'layer2': 299, 'layer3': 460}. Best is trial 63 with value: 0.8682133709784562.
Pseudomonas_Aeruginosa | LPS | Optuna:  68%|██████▊   | 136/200 [3:19:44<1:51:30, 104.54s/it, best=0.868]Pseudomonas_Aeruginosa | LPS | Optuna:  68%|██████▊   | 136/200 [3:19:44<1:51:30, 104.54s/it, best=0.868]/export/usuarios01/egarroyo/MALDI_for_AMR_prediction/venv/lib/python3.13/site-packages/sklearn/model_selection/_split.py:813: UserWarning: The least populated class in y has only 4 members, which is less than n_splits=5.
  warnings.warn(
[I 2026-02-28 05:25:11,808] Trial 150 finished with value: 0.9840364474852452 and parameters: {'activation': 'relu', 'solver': 'adam', 'lr': 0.0007714667203359306, 'layer1': 133, 'layer2': 332, 'layer3': 373}. Best is trial 13 with value: 0.9860492846658779.

Klebsiella_Pneumoniae | Imipenem | Optuna:  76%|███████▌  | 151/200 [1:56:24<39:24, 48.25s/it, best=0.986][A
Klebsiella_Pneumoniae | Imipenem | Optuna:  76%|███████▌  | 151/200 [1:56:24<39:24, 48.25s/it, best=0.986][A[I 2026-02-28 05:25:56,814] Trial 136 finished with value: 0.8604567156318836 and parameters: {'activation': 'identity', 'solver': 'adam', 'lr': 0.0017388839514269887, 'layer1': 267, 'layer2': 455, 'layer3': 423}. Best is trial 63 with value: 0.8682133709784562.
Pseudomonas_Aeruginosa | LPS | Optuna:  68%|██████▊   | 137/200 [3:20:58<1:40:23, 95.61s/it, best=0.868] Pseudomonas_Aeruginosa | LPS | Optuna:  68%|██████▊   | 137/200 [3:20:58<1:40:23, 95.61s/it, best=0.868]/export/usuarios01/egarroyo/MALDI_for_AMR_prediction/venv/lib/python3.13/site-packages/sklearn/model_selection/_split.py:813: UserWarning: The least populated class in y has only 4 members, which is less than n_splits=5.
  warnings.warn(
[I 2026-02-28 05:25:56,893] Trial 151 finished with value: 0.9859967993765052 and parameters: {'activation': 'relu', 'solver': 'adam', 'lr': 0.0021590522227910944, 'layer1': 73, 'layer2': 168, 'layer3': 491}. Best is trial 13 with value: 0.9860492846658779.

Klebsiella_Pneumoniae | Imipenem | Optuna:  76%|███████▌  | 152/200 [1:57:09<37:50, 47.30s/it, best=0.986][A
