Klebsiella_Pneumoniae | Imipenem | Optuna:  76%|███████▌  | 152/200 [1:57:09<37:50, 47.30s/it, best=0.986][A[I 2026-02-28 05:26:00,243] Trial 100 finished with value: 0.9254341604127955 and parameters: {'activation': 'identity', 'solver': 'adam', 'lr': 0.00023986351741254764, 'layer1': 404, 'layer2': 79, 'layer3': 112}. Best is trial 77 with value: 0.9283869597728589.

Staphylococcus_Aureus | Fusidic acid | Optuna:  50%|█████     | 101/200 [2:45:09<2:26:17, 88.66s/it, best=0.928][A
Staphylococcus_Aureus | Fusidic acid | Optuna:  50%|█████     | 101/200 [2:45:09<2:26:17, 88.66s/it, best=0.928][A[I 2026-02-28 05:26:10,388] Trial 147 finished with value: 0.8950371463170621 and parameters: {'activation': 'relu', 'solver': 'adam', 'lr': 0.00017019546382632622, 'layer1': 201, 'layer2': 326, 'layer3': 130}. Best is trial 137 with value: 0.8979080367540411.

Escherichia_Coli | Ceftriaxone | Optuna:  74%|███████▍  | 148/200 [6:16:11<2:13:46, 154.35s/it, best=0.898][A
Escherichia_Coli | Ceftriaxone | Optuna:  74%|███████▍  | 148/200 [6:16:11<2:13:46, 154.35s/it, best=0.898][A[I 2026-02-28 05:26:10,880] Trial 137 finished with value: 0.8255018342260501 and parameters: {'activation': 'logistic', 'solver': 'sgd', 'lr': 0.0012856919258597067, 'layer1': 19, 'layer2': 131, 'layer3': 452}. Best is trial 63 with value: 0.8682133709784562.
Pseudomonas_Aeruginosa | LPS | Optuna:  69%|██████▉   | 138/200 [3:21:12<1:13:30, 71.14s/it, best=0.868]Pseudomonas_Aeruginosa | LPS | Optuna:  69%|██████▉   | 138/200 [3:21:12<1:13:30, 71.14s/it, best=0.868]/export/usuarios01/egarroyo/MALDI_for_AMR_prediction/venv/lib/python3.13/site-packages/sklearn/model_selection/_split.py:813: UserWarning: The least populated class in y has only 4 members, which is less than n_splits=5.
  warnings.warn(
[I 2026-02-28 05:26:32,503] Trial 152 finished with value: 0.983637081256328 and parameters: {'activation': 'relu', 'solver': 'adam', 'lr': 0.002902061774721497, 'layer1': 95, 'layer2': 162, 'layer3': 480}. Best is trial 13 with value: 0.9860492846658779.

Klebsiella_Pneumoniae | Imipenem | Optuna:  76%|███████▋  | 153/200 [1:57:45<34:18, 43.79s/it, best=0.986][A
Klebsiella_Pneumoniae | Imipenem | Optuna:  76%|███████▋  | 153/200 [1:57:45<34:18, 43.79s/it, best=0.986][A[I 2026-02-28 05:27:16,694] Trial 153 finished with value: 0.9857068674310041 and parameters: {'activation': 'relu', 'solver': 'adam', 'lr': 0.002147736108088567, 'layer1': 83, 'layer2': 216, 'layer3': 488}. Best is trial 13 with value: 0.9860492846658779.

Klebsiella_Pneumoniae | Imipenem | Optuna:  77%|███████▋  | 154/200 [1:58:29<33:39, 43.91s/it, best=0.986][A
Klebsiella_Pneumoniae | Imipenem | Optuna:  77%|███████▋  | 154/200 [1:58:29<33:39, 43.91s/it, best=0.986][A[I 2026-02-28 05:27:35,284] Trial 138 finished with value: 0.8567443648963853 and parameters: {'activation': 'identity', 'solver': 'adam', 'lr': 0.009918085343130302, 'layer1': 431, 'layer2': 284, 'layer3': 435}. Best is trial 63 with value: 0.8682133709784562.
Pseudomonas_Aeruginosa | LPS | Optuna:  70%|██████▉   | 139/200 [3:22:37<1:16:22, 75.12s/it, best=0.868]Pseudomonas_Aeruginosa | LPS | Optuna:  70%|██████▉   | 139/200 [3:22:37<1:16:22, 75.12s/it, best=0.868]/export/usuarios01/egarroyo/MALDI_for_AMR_prediction/venv/lib/python3.13/site-packages/sklearn/model_selection/_split.py:813: UserWarning: The least populated class in y has only 4 members, which is less than n_splits=5.
  warnings.warn(
[I 2026-02-28 05:27:38,868] Trial 101 finished with value: 0.9278220912099652 and parameters: {'activation': 'identity', 'solver': 'adam', 'lr': 9.920272221209364e-05, 'layer1': 374, 'layer2': 58, 'layer3': 96}. Best is trial 77 with value: 0.9283869597728589.

Staphylococcus_Aureus | Fusidic acid | Optuna:  51%|█████     | 102/200 [2:46:48<2:29:41, 91.65s/it, best=0.928][A
Staphylococcus_Aureus | Fusidic acid | Optuna:  51%|█████     | 102/200 [2:46:48<2:29:41, 91.65s/it, best=0.928][A[I 2026-02-28 05:27:46,184] Trial 154 finished with value: 0.9826556815912362 and parameters: {'activation': 'relu', 'solver': 'adam', 'lr': 0.0013943092775371875, 'layer1': 71, 'layer2': 220, 'layer3': 489}. Best is trial 13 with value: 0.9860492846658779.

Klebsiella_Pneumoniae | Imipenem | Optuna:  78%|███████▊  | 155/200 [1:58:58<29:41, 39.58s/it, best=0.986][A
Klebsiella_Pneumoniae | Imipenem | Optuna:  78%|███████▊  | 155/200 [1:58:58<29:41, 39.58s/it, best=0.986][A[I 2026-02-28 05:28:06,464] Trial 148 finished with value: 0.8924000375394415 and parameters: {'activation': 'relu', 'solver': 'adam', 'lr': 0.0002877473347354237, 'layer1': 461, 'layer2': 275, 'layer3': 109}. Best is trial 137 with value: 0.8979080367540411.

Escherichia_Coli | Ceftriaxone | Optuna:  74%|███████▍  | 149/200 [6:18:07<2:01:26, 142.87s/it, best=0.898][A
Escherichia_Coli | Ceftriaxone | Optuna:  74%|███████▍  | 149/200 [6:18:07<2:01:26, 142.87s/it, best=0.898][A[I 2026-02-28 05:28:28,692] Trial 155 finished with value: 0.9827351657167487 and parameters: {'activation': 'relu', 'solver': 'adam', 'lr': 0.0020286046065966534, 'layer1': 82, 'layer2': 207, 'layer3': 499}. Best is trial 13 with value: 0.9860492846658779.

Klebsiella_Pneumoniae | Imipenem | Optuna:  78%|███████▊  | 156/200 [1:59:41<29:40, 40.46s/it, best=0.986][A
Klebsiella_Pneumoniae | Imipenem | Optuna:  78%|███████▊  | 156/200 [1:59:41<29:40, 40.46s/it, best=0.986][A[I 2026-02-28 05:29:14,182] Trial 156 finished with value: 0.9840085684810695 and parameters: {'activation': 'relu', 'solver': 'adam', 'lr': 0.0011282118320186988, 'layer1': 62, 'layer2': 181, 'layer3': 469}. Best is trial 13 with value: 0.9860492846658779.

Klebsiella_Pneumoniae | Imipenem | Optuna:  78%|███████▊  | 157/200 [2:00:26<30:04, 41.97s/it, best=0.986][A
Klebsiella_Pneumoniae | Imipenem | Optuna:  78%|███████▊  | 157/200 [2:00:26<30:04, 41.97s/it, best=0.986][A[I 2026-02-28 05:29:19,022] Trial 102 finished with value: 0.9270544364380061 and parameters: {'activation': 'identity', 'solver': 'adam', 'lr': 9.622332218969856e-05, 'layer1': 426, 'layer2': 55, 'layer3': 97}. Best is trial 77 with value: 0.9283869597728589.

Staphylococcus_Aureus | Fusidic acid | Optuna:  52%|█████▏    | 103/200 [2:48:28<2:32:17, 94.20s/it, best=0.928][A
Staphylococcus_Aureus | Fusidic acid | Optuna:  52%|█████▏    | 103/200 [2:48:28<2:32:17, 94.20s/it, best=0.928][A[I 2026-02-28 05:29:30,886] Trial 139 finished with value: 0.8633279969108809 and parameters: {'activation': 'identity', 'solver': 'adam', 'lr': 0.0007208636876137141, 'layer1': 412, 'layer2': 381, 'layer3': 392}. Best is trial 63 with value: 0.8682133709784562.
Pseudomonas_Aeruginosa | LPS | Optuna:  70%|███████   | 140/200 [3:24:32<1:27:15, 87.27s/it, best=0.868]Pseudomonas_Aeruginosa | LPS | Optuna:  70%|███████   | 140/200 [3:24:32<1:27:15, 87.27s/it, best=0.868]/export/usuarios01/egarroyo/MALDI_for_AMR_prediction/venv/lib/python3.13/site-packages/sklearn/model_selection/_split.py:813: UserWarning: The least populated class in y has only 4 members, which is less than n_splits=5.
  warnings.warn(
[I 2026-02-28 05:29:48,742] Trial 157 finished with value: 0.9840578815676346 and parameters: {'activation': 'relu', 'solver': 'adam', 'lr': 0.0035176642081740186, 'layer1': 78, 'layer2': 196, 'layer3': 485}. Best is trial 13 with value: 0.9860492846658779.

Klebsiella_Pneumoniae | Imipenem | Optuna:  79%|███████▉  | 158/200 [2:01:01<27:49, 39.75s/it, best=0.986][A
Klebsiella_Pneumoniae | Imipenem | Optuna:  79%|███████▉  | 158/200 [2:01:01<27:49, 39.75s/it, best=0.986][A[I 2026-02-28 05:30:25,599] Trial 158 finished with value: 0.9830833519538775 and parameters: {'activation': 'relu', 'solver': 'adam', 'lr': 0.0015629316619531282, 'layer1': 86, 'layer2': 169, 'layer3': 475}. Best is trial 13 with value: 0.9860492846658779.

Klebsiella_Pneumoniae | Imipenem | Optuna:  80%|███████▉  | 159/200 [2:01:38<26:34, 38.88s/it, best=0.986][A
Klebsiella_Pneumoniae | Imipenem | Optuna:  80%|███████▉  | 159/200 [2:01:38<26:34, 38.88s/it, best=0.986][A[I 2026-02-28 05:30:53,374] Trial 140 finished with value: 0.8705750568176336 and parameters: {'activation': 'identity', 'solver': 'adam', 'lr': 0.003622633001993711, 'layer1': 34, 'layer2': 443, 'layer3': 467}. Best is trial 140 with value: 0.8705750568176336.
Pseudomonas_Aeruginosa | LPS | Optuna:  70%|███████   | 141/200 [3:25:55<1:24:24, 85.83s/it, best=0.868]Pseudomonas_Aeruginosa | LPS | Optuna:  70%|███████   | 141/200 [3:25:55<1:24:24, 85.83s/it, best=0.871]/export/usuarios01/egarroyo/MALDI_for_AMR_prediction/venv/lib/python3.13/site-packages/sklearn/model_selection/_split.py:813: UserWarning: The least populated class in y has only 4 members, which is less than n_splits=5.
  warnings.warn(
[I 2026-02-28 05:31:03,506] Trial 103 finished with value: 0.9274796137954228 and parameters: {'activation': 'identity', 'solver': 'adam', 'lr': 0.00014163287937237954, 'layer1': 372, 'layer2': 46, 'layer3': 90}. Best is trial 77 with value: 0.9283869597728589.

Staphylococcus_Aureus | Fusidic acid | Optuna:  52%|█████▏    | 104/200 [2:50:12<2:35:39, 97.29s/it, best=0.928][A
Staphylococcus_Aureus | Fusidic acid | Optuna:  52%|█████▏    | 104/200 [2:50:12<2:35:39, 97.29s/it, best=0.928][A[I 2026-02-28 05:31:09,390] Trial 159 finished with value: 0.9846976972403709 and parameters: {'activation': 'relu', 'solver': 'adam', 'lr': 0.0023664130433922485, 'layer1': 118, 'layer2': 134, 'layer3': 451}. Best is trial 13 with value: 0.9860492846658779.

Klebsiella_Pneumoniae | Imipenem | Optuna:  80%|████████  | 160/200 [2:02:21<26:54, 40.35s/it, best=0.986][A
Klebsiella_Pneumoniae | Imipenem | Optuna:  80%|████████  | 160/200 [2:02:21<26:54, 40.35s/it, best=0.986][A[I 2026-02-28 05:31:30,700] Trial 160 finished with value: 0.9800270054346416 and parameters: {'activation': 'relu', 'solver': 'sgd', 'lr': 0.004249833456617945, 'layer1': 116, 'layer2': 252, 'layer3': 487}. Best is trial 13 with value: 0.9860492846658779.

Klebsiella_Pneumoniae | Imipenem | Optuna:  80%|████████  | 161/200 [2:02:43<22:30, 34.64s/it, best=0.986][A
Klebsiella_Pneumoniae | Imipenem | Optuna:  80%|████████  | 161/200 [2:02:43<22:30, 34.64s/it, best=0.986][A[I 2026-02-28 05:31:43,944] Trial 149 finished with value: 0.8950477284453235 and parameters: {'activation': 'relu', 'solver': 'adam', 'lr': 2.671811443959963e-05, 'layer1': 482, 'layer2': 340, 'layer3': 485}. Best is trial 137 with value: 0.8979080367540411.

Escherichia_Coli | Ceftriaxone | Optuna:  75%|███████▌  | 150/200 [6:21:45<2:17:42, 165.25s/it, best=0.898][A
Escherichia_Coli | Ceftriaxone | Optuna:  75%|███████▌  | 150/200 [6:21:45<2:17:42, 165.25s/it, best=0.898][A[I 2026-02-28 05:32:15,033] Trial 161 finished with value: 0.9840846962919665 and parameters: {'activation': 'relu', 'solver': 'adam', 'lr': 0.002261900696038112, 'layer1': 146, 'layer2': 134, 'layer3': 453}. Best is trial 13 with value: 0.9860492846658779.

Klebsiella_Pneumoniae | Imipenem | Optuna:  81%|████████  | 162/200 [2:03:27<23:46, 37.55s/it, best=0.986][A
Klebsiella_Pneumoniae | Imipenem | Optuna:  81%|████████  | 162/200 [2:03:27<23:46, 37.55s/it, best=0.986][A[I 2026-02-28 05:32:21,393] Trial 141 finished with value: 0.8639427438157881 and parameters: {'activation': 'identity', 'solver': 'adam', 'lr': 0.0038535470984558612, 'layer1': 35, 'layer2': 443, 'layer3': 469}. Best is trial 140 with value: 0.8705750568176336.
Pseudomonas_Aeruginosa | LPS | Optuna:  71%|███████   | 142/200 [3:27:23<1:23:36, 86.49s/it, best=0.871]Pseudomonas_Aeruginosa | LPS | Optuna:  71%|███████   | 142/200 [3:27:23<1:23:36, 86.49s/it, best=0.871]/export/usuarios01/egarroyo/MALDI_for_AMR_prediction/venv/lib/python3.13/site-packages/sklearn/model_selection/_split.py:813: UserWarning: The least populated class in y has only 4 members, which is less than n_splits=5.
  warnings.warn(
[I 2026-02-28 05:32:40,820] Trial 104 finished with value: 0.9270339031816747 and parameters: {'activation': 'identity', 'solver': 'adam', 'lr': 0.00014093843551903242, 'layer1': 396, 'layer2': 41, 'layer3': 47}. Best is trial 77 with value: 0.9283869597728589.

Staphylococcus_Aureus | Fusidic acid | Optuna:  52%|█████▎    | 105/200 [2:51:49<2:34:03, 97.29s/it, best=0.928][A
Staphylococcus_Aureus | Fusidic acid | Optuna:  52%|█████▎    | 105/200 [2:51:49<2:34:03, 97.29s/it, best=0.928][A[I 2026-02-28 05:32:55,909] Trial 162 finished with value: 0.9837165653818403 and parameters: {'activation': 'relu', 'solver': 'adam', 'lr': 0.0027864588480606186, 'layer1': 113, 'layer2': 148, 'layer3': 443}. Best is trial 13 with value: 0.9860492846658779.

Klebsiella_Pneumoniae | Imipenem | Optuna:  82%|████████▏ | 163/200 [2:04:08<23:46, 38.55s/it, best=0.986][A
Klebsiella_Pneumoniae | Imipenem | Optuna:  82%|████████▏ | 163/200 [2:04:08<23:46, 38.55s/it, best=0.986][A[I 2026-02-28 05:33:28,089] Trial 163 finished with value: 0.9830788850613296 and parameters: {'activation': 'tanh', 'solver': 'adam', 'lr': 0.0018896513625258071, 'layer1': 45, 'layer2': 119, 'layer3': 426}. Best is trial 13 with value: 0.9860492846658779.

Klebsiella_Pneumoniae | Imipenem | Optuna:  82%|████████▏ | 164/200 [2:04:40<21:58, 36.64s/it, best=0.986][A
Klebsiella_Pneumoniae | Imipenem | Optuna:  82%|████████▏ | 164/200 [2:04:40<21:58, 36.64s/it, best=0.986][A[I 2026-02-28 05:33:48,065] Trial 142 finished with value: 0.8634993570130064 and parameters: {'activation': 'identity', 'solver': 'adam', 'lr': 0.002495076795115287, 'layer1': 74, 'layer2': 466, 'layer3': 485}. Best is trial 140 with value: 0.8705750568176336.
Pseudomonas_Aeruginosa | LPS | Optuna:  72%|███████▏  | 143/200 [3:28:50<1:22:12, 86.54s/it, best=0.871]Pseudomonas_Aeruginosa | LPS | Optuna:  72%|███████▏  | 143/200 [3:28:50<1:22:12, 86.54s/it, best=0.871]/export/usuarios01/egarroyo/MALDI_for_AMR_prediction/venv/lib/python3.13/site-packages/sklearn/model_selection/_split.py:813: UserWarning: The least populated class in y has only 4 members, which is less than n_splits=5.
  warnings.warn(
[I 2026-02-28 05:33:58,036] Trial 105 finished with value: 0.9260042106933934 and parameters: {'activation': 'identity', 'solver': 'adam', 'lr': 0.00011487601437611796, 'layer1': 372, 'layer2': 72, 'layer3': 31}. Best is trial 77 with value: 0.9283869597728589.

Staphylococcus_Aureus | Fusidic acid | Optuna:  53%|█████▎    | 106/200 [2:53:07<2:22:59, 91.27s/it, best=0.928][A
Staphylococcus_Aureus | Fusidic acid | Optuna:  53%|█████▎    | 106/200 [2:53:07<2:22:59, 91.27s/it, best=0.928][A[I 2026-02-28 05:34:10,072] Trial 164 finished with value: 0.9840364474852452 and parameters: {'activation': 'relu', 'solver': 'adam', 'lr': 0.0024859428608319818, 'layer1': 138, 'layer2': 140, 'layer3': 457}. Best is trial 13 with value: 0.9860492846658779.

Klebsiella_Pneumoniae | Imipenem | Optuna:  82%|████████▎ | 165/200 [2:05:22<22:18, 38.24s/it, best=0.986][A
Klebsiella_Pneumoniae | Imipenem | Optuna:  82%|████████▎ | 165/200 [2:05:22<22:18, 38.24s/it, best=0.986][A[I 2026-02-28 05:34:35,088] Trial 165 finished with value: 0.9810084050997332 and parameters: {'activation': 'relu', 'solver': 'adam', 'lr': 0.00014590147242701923, 'layer1': 127, 'layer2': 157, 'layer3': 70}. Best is trial 13 with value: 0.9860492846658779.

Klebsiella_Pneumoniae | Imipenem | Optuna:  83%|████████▎ | 166/200 [2:05:47<19:25, 34.27s/it, best=0.986][A
Klebsiella_Pneumoniae | Imipenem | Optuna:  83%|████████▎ | 166/200 [2:05:47<19:25, 34.27s/it, best=0.986][A[I 2026-02-28 05:34:38,418] Trial 150 finished with value: 0.8959812048221764 and parameters: {'activation': 'relu', 'solver': 'adam', 'lr': 8.470593465961528e-05, 'layer1': 470, 'layer2': 21, 'layer3': 19}. Best is trial 137 with value: 0.8979080367540411.

Escherichia_Coli | Ceftriaxone | Optuna:  76%|███████▌  | 151/200 [6:24:39<2:17:12, 168.02s/it, best=0.898][A
Escherichia_Coli | Ceftriaxone | Optuna:  76%|███████▌  | 151/200 [6:24:39<2:17:12, 168.02s/it, best=0.898][A[I 2026-02-28 05:34:57,833] Trial 143 finished with value: 0.8598278865292555 and parameters: {'activation': 'identity', 'solver': 'adam', 'lr': 0.004852756730508892, 'layer1': 56, 'layer2': 432, 'layer3': 462}. Best is trial 140 with value: 0.8705750568176336.
Pseudomonas_Aeruginosa | LPS | Optuna:  72%|███████▏  | 144/200 [3:29:59<1:16:04, 81.51s/it, best=0.871]Pseudomonas_Aeruginosa | LPS | Optuna:  72%|███████▏  | 144/200 [3:29:59<1:16:04, 81.51s/it, best=0.871]/export/usuarios01/egarroyo/MALDI_for_AMR_prediction/venv/lib/python3.13/site-packages/sklearn/model_selection/_split.py:813: UserWarning: The least populated class in y has only 4 members, which is less than n_splits=5.
  warnings.warn(
[I 2026-02-28 05:35:05,791] Trial 166 finished with value: 0.9826556815912362 and parameters: {'activation': 'relu', 'solver': 'adam', 'lr': 0.001573302611677895, 'layer1': 91, 'layer2': 212, 'layer3': 413}. Best is trial 13 with value: 0.9860492846658779.

Klebsiella_Pneumoniae | Imipenem | Optuna:  84%|████████▎ | 167/200 [2:06:18<18:15, 33.20s/it, best=0.986][A
Klebsiella_Pneumoniae | Imipenem | Optuna:  84%|████████▎ | 167/200 [2:06:18<18:15, 33.20s/it, best=0.986][A[I 2026-02-28 05:35:10,320] Trial 106 finished with value: 0.9266366956197338 and parameters: {'activation': 'tanh', 'solver': 'adam', 'lr': 0.00015017896672647833, 'layer1': 383, 'layer2': 21, 'layer3': 89}. Best is trial 77 with value: 0.9283869597728589.

Staphylococcus_Aureus | Fusidic acid | Optuna:  54%|█████▎    | 107/200 [2:54:19<2:12:38, 85.58s/it, best=0.928][A
Staphylococcus_Aureus | Fusidic acid | Optuna:  54%|█████▎    | 107/200 [2:54:19<2:12:38, 85.58s/it, best=0.928][A[I 2026-02-28 05:35:38,552] Trial 167 finished with value: 0.9830774135365055 and parameters: {'activation': 'relu', 'solver': 'adam', 'lr': 0.0011781737282201272, 'layer1': 151, 'layer2': 104, 'layer3': 392}. Best is trial 13 with value: 0.9860492846658779.

Klebsiella_Pneumoniae | Imipenem | Optuna:  84%|████████▍ | 168/200 [2:06:51<17:38, 33.07s/it, best=0.986][A
Klebsiella_Pneumoniae | Imipenem | Optuna:  84%|████████▍ | 168/200 [2:06:51<17:38, 33.07s/it, best=0.986][A[I 2026-02-28 05:36:11,166] Trial 168 finished with value: 0.9810084050997332 and parameters: {'activation': 'logistic', 'solver': 'adam', 'lr': 0.0009941052650527592, 'layer1': 105, 'layer2': 369, 'layer3': 438}. Best is trial 13 with value: 0.9860492846658779.

Klebsiella_Pneumoniae | Imipenem | Optuna:  84%|████████▍ | 169/200 [2:07:23<17:00, 32.93s/it, best=0.986][A
Klebsiella_Pneumoniae | Imipenem | Optuna:  84%|████████▍ | 169/200 [2:07:23<17:00, 32.93s/it, best=0.986][A[I 2026-02-28 05:36:13,351] Trial 144 finished with value: 0.8632345363241877 and parameters: {'activation': 'identity', 'solver': 'adam', 'lr': 0.00648928817363768, 'layer1': 159, 'layer2': 472, 'layer3': 446}. Best is trial 140 with value: 0.8705750568176336.
Pseudomonas_Aeruginosa | LPS | Optuna:  72%|███████▎  | 145/200 [3:31:15<1:13:04, 79.71s/it, best=0.871]Pseudomonas_Aeruginosa | LPS | Optuna:  72%|███████▎  | 145/200 [3:31:15<1:13:04, 79.71s/it, best=0.871]/export/usuarios01/egarroyo/MALDI_for_AMR_prediction/venv/lib/python3.13/site-packages/sklearn/model_selection/_split.py:813: UserWarning: The least populated class in y has only 4 members, which is less than n_splits=5.
  warnings.warn(
[I 2026-02-28 05:36:42,640] Trial 169 finished with value: 0.9823564641501271 and parameters: {'activation': 'relu', 'solver': 'adam', 'lr': 0.000703928677836599, 'layer1': 63, 'layer2': 185, 'layer3': 471}. Best is trial 13 with value: 0.9860492846658779.

Klebsiella_Pneumoniae | Imipenem | Optuna:  85%|████████▌ | 170/200 [2:07:55<16:14, 32.50s/it, best=0.986][A
Klebsiella_Pneumoniae | Imipenem | Optuna:  85%|████████▌ | 170/200 [2:07:55<16:14, 32.50s/it, best=0.986][A[I 2026-02-28 05:36:49,703] Trial 107 finished with value: 0.9263881668073907 and parameters: {'activation': 'identity', 'solver': 'adam', 'lr': 5.564048973132091e-05, 'layer1': 362, 'layer2': 59, 'layer3': 72}. Best is trial 77 with value: 0.9283869597728589.

Staphylococcus_Aureus | Fusidic acid | Optuna:  54%|█████▍    | 108/200 [2:55:58<2:17:34, 89.72s/it, best=0.928][A
Staphylococcus_Aureus | Fusidic acid | Optuna:  54%|█████▍    | 108/200 [2:55:58<2:17:34, 89.72s/it, best=0.928][A[I 2026-02-28 05:37:07,055] Trial 151 finished with value: 0.8954322049907155 and parameters: {'activation': 'relu', 'solver': 'adam', 'lr': 9.552513233165517e-05, 'layer1': 472, 'layer2': 27, 'layer3': 11}. Best is trial 137 with value: 0.8979080367540411.

Escherichia_Coli | Ceftriaxone | Optuna:  76%|███████▌  | 152/200 [6:27:08<2:09:45, 162.20s/it, best=0.898][A
Escherichia_Coli | Ceftriaxone | Optuna:  76%|███████▌  | 152/200 [6:27:08<2:09:45, 162.20s/it, best=0.898][A[I 2026-02-28 05:37:14,726] Trial 145 finished with value: 0.8627576225824265 and parameters: {'activation': 'identity', 'solver': 'adam', 'lr': 0.001958063608320229, 'layer1': 28, 'layer2': 359, 'layer3': 403}. Best is trial 140 with value: 0.8705750568176336.
Pseudomonas_Aeruginosa | LPS | Optuna:  73%|███████▎  | 146/200 [3:32:16<1:06:47, 74.21s/it, best=0.871]Pseudomonas_Aeruginosa | LPS | Optuna:  73%|███████▎  | 146/200 [3:32:16<1:06:47, 74.21s/it, best=0.871]/export/usuarios01/egarroyo/MALDI_for_AMR_prediction/venv/lib/python3.13/site-packages/sklearn/model_selection/_split.py:813: UserWarning: The least populated class in y has only 4 members, which is less than n_splits=5.
  warnings.warn(
[I 2026-02-28 05:37:27,333] Trial 170 finished with value: 0.9840408987090028 and parameters: {'activation': 'relu', 'solver': 'adam', 'lr': 0.0019851990649618757, 'layer1': 172, 'layer2': 171, 'layer3': 494}. Best is trial 13 with value: 0.9860492846658779.

Klebsiella_Pneumoniae | Imipenem | Optuna:  86%|████████▌ | 171/200 [2:08:39<17:28, 36.15s/it, best=0.986][A
