Escherichia_Coli | Cefepime | Optuna:  40%|████      | 81/200 [2:30:39<3:55:01, 118.50s/it, best=0.891][A[I 2026-02-28 17:28:39,946] Trial 72 finished with value: 0.8879714231951876 and parameters: {'activation': 'relu', 'solver': 'adam', 'lr': 9.86890142451917e-05, 'layer1': 242, 'layer2': 199, 'layer3': 263}. Best is trial 72 with value: 0.8879714231951876.
Staphylococcus_Aureus | DirectMulti | Optuna:  36%|███▋      | 73/200 [2:58:45<4:13:18, 119.67s/it, best=0.887]Staphylococcus_Aureus | DirectMulti | Optuna:  36%|███▋      | 73/200 [2:58:45<4:13:18, 119.67s/it, best=0.888][I 2026-02-28 17:28:52,596] Trial 151 finished with value: 0.9219848830396078 and parameters: {'activation': 'tanh', 'solver': 'adam', 'lr': 4.7037745801743954e-05, 'layer1': 21, 'layer2': 488, 'layer3': 448}. Best is trial 142 with value: 0.923254189373387.
Klebsiella_Pneumoniae | DirectMulti | Optuna:  76%|███████▌  | 152/200 [4:02:38<58:59, 73.73s/it, best=0.923]Klebsiella_Pneumoniae | DirectMulti | Optuna:  76%|███████▌  | 152/200 [4:02:38<58:59, 73.73s/it, best=0.923][I 2026-02-28 17:30:04,537] Trial 152 finished with value: 0.9236023804402054 and parameters: {'activation': 'tanh', 'solver': 'adam', 'lr': 0.00012988513649776325, 'layer1': 37, 'layer2': 470, 'layer3': 411}. Best is trial 152 with value: 0.9236023804402054.
Klebsiella_Pneumoniae | DirectMulti | Optuna:  76%|███████▋  | 153/200 [4:03:50<57:20, 73.19s/it, best=0.923]Klebsiella_Pneumoniae | DirectMulti | Optuna:  76%|███████▋  | 153/200 [4:03:50<57:20, 73.19s/it, best=0.924][I 2026-02-28 17:30:22,831] Trial 81 finished with value: 0.8897475600609781 and parameters: {'activation': 'relu', 'solver': 'adam', 'lr': 0.0002343490412493324, 'layer1': 482, 'layer2': 245, 'layer3': 194}. Best is trial 66 with value: 0.891283029406553.

Escherichia_Coli | Cefepime | Optuna:  41%|████      | 82/200 [2:32:47<3:58:43, 121.39s/it, best=0.891][A
Escherichia_Coli | Cefepime | Optuna:  41%|████      | 82/200 [2:32:47<3:58:43, 121.39s/it, best=0.891][A[I 2026-02-28 17:30:52,360] Trial 73 finished with value: 0.8862448576030351 and parameters: {'activation': 'relu', 'solver': 'adam', 'lr': 9.433712822178913e-05, 'layer1': 246, 'layer2': 195, 'layer3': 316}. Best is trial 72 with value: 0.8879714231951876.
Staphylococcus_Aureus | DirectMulti | Optuna:  37%|███▋      | 74/200 [3:00:57<4:19:20, 123.50s/it, best=0.888]Staphylococcus_Aureus | DirectMulti | Optuna:  37%|███▋      | 74/200 [3:00:57<4:19:20, 123.50s/it, best=0.888][I 2026-02-28 17:31:05,642] Trial 153 finished with value: 0.922138912695794 and parameters: {'activation': 'tanh', 'solver': 'adam', 'lr': 0.0001284254565734458, 'layer1': 34, 'layer2': 481, 'layer3': 411}. Best is trial 152 with value: 0.9236023804402054.
Klebsiella_Pneumoniae | DirectMulti | Optuna:  77%|███████▋  | 154/200 [4:04:51<53:20, 69.57s/it, best=0.924]Klebsiella_Pneumoniae | DirectMulti | Optuna:  77%|███████▋  | 154/200 [4:04:51<53:20, 69.57s/it, best=0.924][I 2026-02-28 17:31:54,078] Trial 82 finished with value: 0.8860662037383038 and parameters: {'activation': 'relu', 'solver': 'adam', 'lr': 0.00026508688094027135, 'layer1': 447, 'layer2': 356, 'layer3': 191}. Best is trial 66 with value: 0.891283029406553.

Escherichia_Coli | Cefepime | Optuna:  42%|████▏     | 83/200 [2:34:18<3:39:04, 112.35s/it, best=0.891][A
Escherichia_Coli | Cefepime | Optuna:  42%|████▏     | 83/200 [2:34:18<3:39:04, 112.35s/it, best=0.891][A[I 2026-02-28 17:31:58,876] Trial 154 finished with value: 0.921100127866414 and parameters: {'activation': 'tanh', 'solver': 'adam', 'lr': 0.00012895306081985827, 'layer1': 54, 'layer2': 479, 'layer3': 418}. Best is trial 152 with value: 0.9236023804402054.
Klebsiella_Pneumoniae | DirectMulti | Optuna:  78%|███████▊  | 155/200 [4:05:44<48:30, 64.67s/it, best=0.924]Klebsiella_Pneumoniae | DirectMulti | Optuna:  78%|███████▊  | 155/200 [4:05:44<48:30, 64.67s/it, best=0.924][I 2026-02-28 17:32:49,357] Trial 74 finished with value: 0.8834431139953395 and parameters: {'activation': 'relu', 'solver': 'adam', 'lr': 0.0001003070381545439, 'layer1': 240, 'layer2': 83, 'layer3': 312}. Best is trial 72 with value: 0.8879714231951876.
Staphylococcus_Aureus | DirectMulti | Optuna:  38%|███▊      | 75/200 [3:02:54<4:13:13, 121.55s/it, best=0.888]Staphylococcus_Aureus | DirectMulti | Optuna:  38%|███▊      | 75/200 [3:02:54<4:13:13, 121.55s/it, best=0.888][I 2026-02-28 17:33:03,008] Trial 155 finished with value: 0.9196681035886153 and parameters: {'activation': 'tanh', 'solver': 'adam', 'lr': 0.00011493642923814421, 'layer1': 34, 'layer2': 461, 'layer3': 398}. Best is trial 152 with value: 0.9236023804402054.
Klebsiella_Pneumoniae | DirectMulti | Optuna:  78%|███████▊  | 156/200 [4:06:48<47:18, 64.51s/it, best=0.924]Klebsiella_Pneumoniae | DirectMulti | Optuna:  78%|███████▊  | 156/200 [4:06:48<47:18, 64.51s/it, best=0.924][I 2026-02-28 17:33:55,805] Trial 83 finished with value: 0.8859811042752801 and parameters: {'activation': 'relu', 'solver': 'adam', 'lr': 0.0004129267940312193, 'layer1': 484, 'layer2': 207, 'layer3': 222}. Best is trial 66 with value: 0.891283029406553.

Escherichia_Coli | Cefepime | Optuna:  42%|████▏     | 84/200 [2:36:20<3:42:38, 115.16s/it, best=0.891][A
Escherichia_Coli | Cefepime | Optuna:  42%|████▏     | 84/200 [2:36:20<3:42:38, 115.16s/it, best=0.891][A[I 2026-02-28 17:34:17,611] Trial 156 finished with value: 0.9227779351738553 and parameters: {'activation': 'tanh', 'solver': 'adam', 'lr': 9.774592747904252e-05, 'layer1': 68, 'layer2': 138, 'layer3': 408}. Best is trial 152 with value: 0.9236023804402054.
Klebsiella_Pneumoniae | DirectMulti | Optuna:  78%|███████▊  | 157/200 [4:08:03<48:24, 67.54s/it, best=0.924]Klebsiella_Pneumoniae | DirectMulti | Optuna:  78%|███████▊  | 157/200 [4:08:03<48:24, 67.54s/it, best=0.924][I 2026-02-28 17:35:23,889] Trial 157 finished with value: 0.9215197009530398 and parameters: {'activation': 'tanh', 'solver': 'adam', 'lr': 0.00017298401778010784, 'layer1': 70, 'layer2': 29, 'layer3': 410}. Best is trial 152 with value: 0.9236023804402054.
Klebsiella_Pneumoniae | DirectMulti | Optuna:  79%|███████▉  | 158/200 [4:09:09<47:00, 67.16s/it, best=0.924]Klebsiella_Pneumoniae | DirectMulti | Optuna:  79%|███████▉  | 158/200 [4:09:09<47:00, 67.16s/it, best=0.924][I 2026-02-28 17:35:27,732] Trial 75 finished with value: 0.8862429746079215 and parameters: {'activation': 'relu', 'solver': 'adam', 'lr': 5.332090680760774e-05, 'layer1': 209, 'layer2': 165, 'layer3': 281}. Best is trial 72 with value: 0.8879714231951876.
Staphylococcus_Aureus | DirectMulti | Optuna:  38%|███▊      | 76/200 [3:05:33<4:34:01, 132.60s/it, best=0.888]Staphylococcus_Aureus | DirectMulti | Optuna:  38%|███▊      | 76/200 [3:05:33<4:34:01, 132.60s/it, best=0.888][I 2026-02-28 17:35:42,047] Trial 84 finished with value: 0.8915097750553358 and parameters: {'activation': 'relu', 'solver': 'adam', 'lr': 0.00016117530897587654, 'layer1': 469, 'layer2': 286, 'layer3': 118}. Best is trial 84 with value: 0.8915097750553358.

Escherichia_Coli | Cefepime | Optuna:  42%|████▎     | 85/200 [2:38:06<3:35:35, 112.48s/it, best=0.891][A
Escherichia_Coli | Cefepime | Optuna:  42%|████▎     | 85/200 [2:38:06<3:35:35, 112.48s/it, best=0.891][A[I 2026-02-28 17:35:48,237] Trial 158 finished with value: 0.8702461473038209 and parameters: {'activation': 'logistic', 'solver': 'adam', 'lr': 9.492859763786707e-05, 'layer1': 100, 'layer2': 295, 'layer3': 386}. Best is trial 152 with value: 0.9236023804402054.
Klebsiella_Pneumoniae | DirectMulti | Optuna:  80%|███████▉  | 159/200 [4:09:33<37:06, 54.31s/it, best=0.924]Klebsiella_Pneumoniae | DirectMulti | Optuna:  80%|███████▉  | 159/200 [4:09:33<37:06, 54.31s/it, best=0.924][I 2026-02-28 17:36:37,579] Trial 159 finished with value: 0.9214602797115145 and parameters: {'activation': 'tanh', 'solver': 'adam', 'lr': 0.00013845371409539092, 'layer1': 28, 'layer2': 148, 'layer3': 378}. Best is trial 152 with value: 0.9236023804402054.
Klebsiella_Pneumoniae | DirectMulti | Optuna:  80%|████████  | 160/200 [4:10:23<35:12, 52.82s/it, best=0.924]Klebsiella_Pneumoniae | DirectMulti | Optuna:  80%|████████  | 160/200 [4:10:23<35:12, 52.82s/it, best=0.924][I 2026-02-28 17:37:31,792] Trial 85 finished with value: 0.8895718863178608 and parameters: {'activation': 'relu', 'solver': 'adam', 'lr': 0.00014088723852617802, 'layer1': 500, 'layer2': 271, 'layer3': 85}. Best is trial 84 with value: 0.8915097750553358.

Escherichia_Coli | Cefepime | Optuna:  43%|████▎     | 86/200 [2:39:56<3:32:09, 111.66s/it, best=0.891][A
Escherichia_Coli | Cefepime | Optuna:  43%|████▎     | 86/200 [2:39:56<3:32:09, 111.66s/it, best=0.891][A[I 2026-02-28 17:37:52,117] Trial 160 finished with value: 0.9195914903741895 and parameters: {'activation': 'tanh', 'solver': 'adam', 'lr': 7.452198665442068e-05, 'layer1': 88, 'layer2': 470, 'layer3': 402}. Best is trial 152 with value: 0.9236023804402054.
Klebsiella_Pneumoniae | DirectMulti | Optuna:  80%|████████  | 161/200 [4:11:37<38:34, 59.34s/it, best=0.924]Klebsiella_Pneumoniae | DirectMulti | Optuna:  80%|████████  | 161/200 [4:11:37<38:34, 59.34s/it, best=0.924][I 2026-02-28 17:38:50,290] Trial 76 finished with value: 0.8858472678342297 and parameters: {'activation': 'relu', 'solver': 'adam', 'lr': 3.959906548372067e-05, 'layer1': 265, 'layer2': 195, 'layer3': 244}. Best is trial 72 with value: 0.8879714231951876.
Staphylococcus_Aureus | DirectMulti | Optuna:  38%|███▊      | 77/200 [3:08:55<5:14:50, 153.58s/it, best=0.888]Staphylococcus_Aureus | DirectMulti | Optuna:  38%|███▊      | 77/200 [3:08:55<5:14:50, 153.58s/it, best=0.888][I 2026-02-28 17:38:50,580] Trial 161 finished with value: 0.9209318893309186 and parameters: {'activation': 'tanh', 'solver': 'adam', 'lr': 0.00010948932088237625, 'layer1': 44, 'layer2': 157, 'layer3': 419}. Best is trial 152 with value: 0.9236023804402054.
Klebsiella_Pneumoniae | DirectMulti | Optuna:  81%|████████  | 162/200 [4:12:36<37:24, 59.08s/it, best=0.924]Klebsiella_Pneumoniae | DirectMulti | Optuna:  81%|████████  | 162/200 [4:12:36<37:24, 59.08s/it, best=0.924][I 2026-02-28 17:39:15,288] Trial 77 finished with value: 0.8017436542723116 and parameters: {'activation': 'relu', 'solver': 'adam', 'lr': 2.477997448740891e-05, 'layer1': 175, 'layer2': 119, 'layer3': 327}. Best is trial 72 with value: 0.8879714231951876.
Staphylococcus_Aureus | DirectMulti | Optuna:  39%|███▉      | 78/200 [3:09:20<3:53:51, 115.01s/it, best=0.888]Staphylococcus_Aureus | DirectMulti | Optuna:  39%|███▉      | 78/200 [3:09:20<3:53:51, 115.01s/it, best=0.888][I 2026-02-28 17:39:20,986] Trial 86 finished with value: 0.7459927813619298 and parameters: {'activation': 'tanh', 'solver': 'sgd', 'lr': 0.0001129495341407761, 'layer1': 469, 'layer2': 308, 'layer3': 145}. Best is trial 84 with value: 0.8915097750553358.

Escherichia_Coli | Cefepime | Optuna:  44%|████▎     | 87/200 [2:41:45<3:28:54, 110.92s/it, best=0.891][A
Escherichia_Coli | Cefepime | Optuna:  44%|████▎     | 87/200 [2:41:45<3:28:54, 110.92s/it, best=0.891][A[I 2026-02-28 17:40:00,075] Trial 162 finished with value: 0.9223186679366231 and parameters: {'activation': 'tanh', 'solver': 'adam', 'lr': 8.3752020950843e-05, 'layer1': 64, 'layer2': 90, 'layer3': 432}. Best is trial 152 with value: 0.9236023804402054.
Klebsiella_Pneumoniae | DirectMulti | Optuna:  82%|████████▏ | 163/200 [4:13:45<38:21, 62.20s/it, best=0.924]Klebsiella_Pneumoniae | DirectMulti | Optuna:  82%|████████▏ | 163/200 [4:13:45<38:21, 62.20s/it, best=0.924][I 2026-02-28 17:40:32,009] Trial 87 finished with value: 0.8846583806924734 and parameters: {'activation': 'relu', 'solver': 'adam', 'lr': 0.00015934612159319546, 'layer1': 176, 'layer2': 234, 'layer3': 362}. Best is trial 84 with value: 0.8915097750553358.

Escherichia_Coli | Cefepime | Optuna:  44%|████▍     | 88/200 [2:42:56<3:04:42, 98.95s/it, best=0.891] [A
Escherichia_Coli | Cefepime | Optuna:  44%|████▍     | 88/200 [2:42:56<3:04:42, 98.95s/it, best=0.891][A[I 2026-02-28 17:41:03,890] Trial 163 finished with value: 0.9197413744324159 and parameters: {'activation': 'tanh', 'solver': 'adam', 'lr': 9.089817427911902e-05, 'layer1': 74, 'layer2': 77, 'layer3': 392}. Best is trial 152 with value: 0.9236023804402054.
Klebsiella_Pneumoniae | DirectMulti | Optuna:  82%|████████▏ | 164/200 [4:14:49<37:36, 62.69s/it, best=0.924]Klebsiella_Pneumoniae | DirectMulti | Optuna:  82%|████████▏ | 164/200 [4:14:49<37:36, 62.69s/it, best=0.924][I 2026-02-28 17:41:25,724] Trial 78 finished with value: 0.8861554749611518 and parameters: {'activation': 'relu', 'solver': 'adam', 'lr': 8.21950289445685e-05, 'layer1': 224, 'layer2': 146, 'layer3': 290}. Best is trial 72 with value: 0.8879714231951876.
Staphylococcus_Aureus | DirectMulti | Optuna:  40%|███▉      | 79/200 [3:11:31<4:01:16, 119.64s/it, best=0.888]Staphylococcus_Aureus | DirectMulti | Optuna:  40%|███▉      | 79/200 [3:11:31<4:01:16, 119.64s/it, best=0.888][I 2026-02-28 17:41:55,604] Trial 164 finished with value: 0.920513766287757 and parameters: {'activation': 'tanh', 'solver': 'adam', 'lr': 0.00020522621220699506, 'layer1': 66, 'layer2': 66, 'layer3': 409}. Best is trial 152 with value: 0.9236023804402054.
Klebsiella_Pneumoniae | DirectMulti | Optuna:  82%|████████▎ | 165/200 [4:15:41<34:38, 59.39s/it, best=0.924]Klebsiella_Pneumoniae | DirectMulti | Optuna:  82%|████████▎ | 165/200 [4:15:41<34:38, 59.39s/it, best=0.924][I 2026-02-28 17:41:59,994] Trial 88 finished with value: 0.888849107137912 and parameters: {'activation': 'relu', 'solver': 'adam', 'lr': 0.00025953192383558097, 'layer1': 398, 'layer2': 293, 'layer3': 14}. Best is trial 84 with value: 0.8915097750553358.

Escherichia_Coli | Cefepime | Optuna:  44%|████▍     | 89/200 [2:44:24<2:56:58, 95.66s/it, best=0.891][A
Escherichia_Coli | Cefepime | Optuna:  44%|████▍     | 89/200 [2:44:24<2:56:58, 95.66s/it, best=0.891][A[I 2026-02-28 17:42:41,787] Trial 79 finished with value: 0.8839842590153972 and parameters: {'activation': 'relu', 'solver': 'adam', 'lr': 0.00027466686280391806, 'layer1': 292, 'layer2': 230, 'layer3': 303}. Best is trial 72 with value: 0.8879714231951876.
Staphylococcus_Aureus | DirectMulti | Optuna:  40%|████      | 80/200 [3:12:47<3:33:07, 106.56s/it, best=0.888]Staphylococcus_Aureus | DirectMulti | Optuna:  40%|████      | 80/200 [3:12:47<3:33:07, 106.56s/it, best=0.888][I 2026-02-28 17:43:09,828] Trial 165 finished with value: 0.92358473623253 and parameters: {'activation': 'tanh', 'solver': 'adam', 'lr': 7.599317652734082e-05, 'layer1': 32, 'layer2': 137, 'layer3': 433}. Best is trial 152 with value: 0.9236023804402054.
Klebsiella_Pneumoniae | DirectMulti | Optuna:  83%|████████▎ | 166/200 [4:16:55<36:10, 63.84s/it, best=0.924]Klebsiella_Pneumoniae | DirectMulti | Optuna:  83%|████████▎ | 166/200 [4:16:55<36:10, 63.84s/it, best=0.924][I 2026-02-28 17:43:52,260] Trial 89 finished with value: 0.8885504283267599 and parameters: {'activation': 'relu', 'solver': 'adam', 'lr': 6.71328028157675e-05, 'layer1': 489, 'layer2': 282, 'layer3': 161}. Best is trial 84 with value: 0.8915097750553358.

Escherichia_Coli | Cefepime | Optuna:  45%|████▌     | 90/200 [2:46:17<3:04:30, 100.64s/it, best=0.891][A
Escherichia_Coli | Cefepime | Optuna:  45%|████▌     | 90/200 [2:46:17<3:04:30, 100.64s/it, best=0.891][A[I 2026-02-28 17:44:12,436] Trial 166 finished with value: 0.9197978475258534 and parameters: {'activation': 'tanh', 'solver': 'adam', 'lr': 7.684995424652766e-05, 'layer1': 59, 'layer2': 116, 'layer3': 442}. Best is trial 152 with value: 0.9236023804402054.
Klebsiella_Pneumoniae | DirectMulti | Optuna:  84%|████████▎ | 167/200 [4:17:58<34:54, 63.47s/it, best=0.924]Klebsiella_Pneumoniae | DirectMulti | Optuna:  84%|████████▎ | 167/200 [4:17:58<34:54, 63.47s/it, best=0.924][I 2026-02-28 17:44:12,634] Trial 80 finished with value: 0.8865093737880612 and parameters: {'activation': 'relu', 'solver': 'adam', 'lr': 0.0004377858982687435, 'layer1': 256, 'layer2': 362, 'layer3': 51}. Best is trial 72 with value: 0.8879714231951876.
Staphylococcus_Aureus | DirectMulti | Optuna:  40%|████      | 81/200 [3:14:18<3:22:00, 101.85s/it, best=0.888]Staphylococcus_Aureus | DirectMulti | Optuna:  40%|████      | 81/200 [3:14:18<3:22:00, 101.85s/it, best=0.888][I 2026-02-28 17:44:35,060] Trial 90 finished with value: 0.7550013187334347 and parameters: {'activation': 'logistic', 'solver': 'adam', 'lr': 1.8245399657320885e-05, 'layer1': 414, 'layer2': 261, 'layer3': 129}. Best is trial 84 with value: 0.8915097750553358.

Escherichia_Coli | Cefepime | Optuna:  46%|████▌     | 91/200 [2:46:59<2:31:18, 83.29s/it, best=0.891] [A
Escherichia_Coli | Cefepime | Optuna:  46%|████▌     | 91/200 [2:46:59<2:31:18, 83.29s/it, best=0.891][A[I 2026-02-28 17:45:13,952] Trial 167 finished with value: 0.9233313846031377 and parameters: {'activation': 'tanh', 'solver': 'adam', 'lr': 0.00012069974009111127, 'layer1': 32, 'layer2': 131, 'layer3': 432}. Best is trial 152 with value: 0.9236023804402054.
Klebsiella_Pneumoniae | DirectMulti | Optuna:  84%|████████▍ | 168/200 [4:18:59<33:32, 62.89s/it, best=0.924]Klebsiella_Pneumoniae | DirectMulti | Optuna:  84%|████████▍ | 168/200 [4:18:59<33:32, 62.89s/it, best=0.924][I 2026-02-28 17:45:24,360] Trial 81 finished with value: 0.8821207443077087 and parameters: {'activation': 'relu', 'solver': 'adam', 'lr': 0.0008480054000034391, 'layer1': 253, 'layer2': 355, 'layer3': 51}. Best is trial 72 with value: 0.8879714231951876.
Staphylococcus_Aureus | DirectMulti | Optuna:  41%|████      | 82/200 [3:15:29<3:02:31, 92.81s/it, best=0.888] Staphylococcus_Aureus | DirectMulti | Optuna:  41%|████      | 82/200 [3:15:29<3:02:31, 92.81s/it, best=0.888][I 2026-02-28 17:46:07,255] Trial 168 finished with value: 0.9205743987441444 and parameters: {'activation': 'tanh', 'solver': 'adam', 'lr': 0.0001129629295042381, 'layer1': 32, 'layer2': 129, 'layer3': 125}. Best is trial 152 with value: 0.9236023804402054.
Klebsiella_Pneumoniae | DirectMulti | Optuna:  84%|████████▍ | 169/200 [4:19:52<31:00, 60.01s/it, best=0.924]Klebsiella_Pneumoniae | DirectMulti | Optuna:  84%|████████▍ | 169/200 [4:19:52<31:00, 60.01s/it, best=0.924][I 2026-02-28 17:46:19,134] Trial 91 finished with value: 0.8887939607350788 and parameters: {'activation': 'relu', 'solver': 'adam', 'lr': 0.00017180617255583715, 'layer1': 499, 'layer2': 264, 'layer3': 74}. Best is trial 84 with value: 0.8915097750553358.

Escherichia_Coli | Cefepime | Optuna:  46%|████▌     | 92/200 [2:48:43<2:41:08, 89.53s/it, best=0.891][A
Escherichia_Coli | Cefepime | Optuna:  46%|████▌     | 92/200 [2:48:43<2:41:08, 89.53s/it, best=0.891][A[I 2026-02-28 17:46:46,032] Trial 82 finished with value: 0.8842345223332208 and parameters: {'activation': 'relu', 'solver': 'adam', 'lr': 0.0004556084052560026, 'layer1': 139, 'layer2': 379, 'layer3': 208}. Best is trial 72 with value: 0.8879714231951876.
Staphylococcus_Aureus | DirectMulti | Optuna:  42%|████▏     | 83/200 [3:16:51<2:54:28, 89.47s/it, best=0.888]Staphylococcus_Aureus | DirectMulti | Optuna:  42%|████▏     | 83/200 [3:16:51<2:54:28, 89.47s/it, best=0.888][I 2026-02-28 17:47:51,628] Trial 169 finished with value: 0.8704365367922724 and parameters: {'activation': 'tanh', 'solver': 'sgd', 'lr': 0.00013405257499592957, 'layer1': 21, 'layer2': 141, 'layer3': 426}. Best is trial 152 with value: 0.9236023804402054.
Klebsiella_Pneumoniae | DirectMulti | Optuna:  85%|████████▌ | 170/200 [4:21:37<36:39, 73.32s/it, best=0.924]Klebsiella_Pneumoniae | DirectMulti | Optuna:  85%|████████▌ | 170/200 [4:21:37<36:39, 73.32s/it, best=0.924][I 2026-02-28 17:48:01,824] Trial 92 finished with value: 0.8899940518945841 and parameters: {'activation': 'relu', 'solver': 'adam', 'lr': 0.000132355845133051, 'layer1': 475, 'layer2': 275, 'layer3': 99}. Best is trial 84 with value: 0.8915097750553358.

Escherichia_Coli | Cefepime | Optuna:  46%|████▋     | 93/200 [2:50:26<2:46:41, 93.47s/it, best=0.891][A
Escherichia_Coli | Cefepime | Optuna:  46%|████▋     | 93/200 [2:50:26<2:46:41, 93.47s/it, best=0.891][A[I 2026-02-28 17:48:46,555] Trial 83 finished with value: 0.8858821346094536 and parameters: {'activation': 'relu', 'solver': 'adam', 'lr': 0.0001184919546487195, 'layer1': 283, 'layer2': 196, 'layer3': 235}. Best is trial 72 with value: 0.8879714231951876.
Staphylococcus_Aureus | DirectMulti | Optuna:  42%|████▏     | 84/200 [3:18:51<3:10:59, 98.79s/it, best=0.888]Staphylococcus_Aureus | DirectMulti | Optuna:  42%|████▏     | 84/200 [3:18:51<3:10:59, 98.79s/it, best=0.888][I 2026-02-28 17:49:00,588] Trial 170 finished with value: 0.9199500970973258 and parameters: {'activation': 'tanh', 'solver': 'adam', 'lr': 9.157807255787111e-05, 'layer1': 114, 'layer2': 174, 'layer3': 413}. Best is trial 152 with value: 0.9236023804402054.
Klebsiella_Pneumoniae | DirectMulti | Optuna:  86%|████████▌ | 171/200 [4:22:46<34:48, 72.01s/it, best=0.924]Klebsiella_Pneumoniae | DirectMulti | Optuna:  86%|████████▌ | 171/200 [4:22:46<34:48, 72.01s/it, best=0.924][I 2026-02-28 17:49:50,976] Trial 93 finished with value: 0.8894819964827294 and parameters: {'activation': 'relu', 'solver': 'adam', 'lr': 0.0001024298679652658, 'layer1': 478, 'layer2': 280, 'layer3': 107}. Best is trial 84 with value: 0.8915097750553358.

Escherichia_Coli | Cefepime | Optuna:  47%|████▋     | 94/200 [2:52:15<2:53:26, 98.18s/it, best=0.891][A
Escherichia_Coli | Cefepime | Optuna:  47%|████▋     | 94/200 [2:52:15<2:53:26, 98.18s/it, best=0.891][A[I 2026-02-28 17:50:08,338] Trial 171 finished with value: 0.9220724466850516 and parameters: {'activation': 'tanh', 'solver': 'adam', 'lr': 6.843684900676088e-05, 'layer1': 40, 'layer2': 102, 'layer3': 432}. Best is trial 152 with value: 0.9236023804402054.
