Staphylococcus_Aureus | LPS | Optuna:  63%|██████▎   | 126/200 [4:37:10<2:28:30, 120.41s/it, best=0.888]Staphylococcus_Aureus | LPS | Optuna:  63%|██████▎   | 126/200 [4:37:10<2:28:30, 120.41s/it, best=0.888][I 2026-02-28 12:43:50,378] Trial 193 finished with value: 0.8578580575509089 and parameters: {'activation': 'identity', 'solver': 'adam', 'lr': 2.4518672671845947e-05, 'layer1': 447, 'layer2': 313, 'layer3': 181}. Best is trial 187 with value: 0.867960593593898.
Pseudomonas_Aeruginosa | DirectMulti | Optuna:  97%|█████████▋| 194/200 [5:47:36<12:29, 124.98s/it, best=0.868]Pseudomonas_Aeruginosa | DirectMulti | Optuna:  97%|█████████▋| 194/200 [5:47:36<12:29, 124.98s/it, best=0.868]/export/usuarios01/egarroyo/MALDI_for_AMR_prediction/venv/lib/python3.13/site-packages/sklearn/model_selection/_split.py:813: UserWarning: The least populated class in y has only 4 members, which is less than n_splits=5.
  warnings.warn(
[I 2026-02-28 12:44:28,221] Trial 162 finished with value: 0.9236394851290166 and parameters: {'activation': 'identity', 'solver': 'adam', 'lr': 0.000272223720632354, 'layer1': 440, 'layer2': 430, 'layer3': 39}. Best is trial 71 with value: 0.9257111996592865.
Klebsiella_Pneumoniae | LPS | Optuna:  82%|████████▏ | 163/200 [3:56:44<56:49, 92.16s/it, best=0.926]Klebsiella_Pneumoniae | LPS | Optuna:  82%|████████▏ | 163/200 [3:56:44<56:49, 92.16s/it, best=0.926][I 2026-02-28 12:45:02,595] Trial 132 finished with value: 0.9128900969180375 and parameters: {'activation': 'relu', 'solver': 'adam', 'lr': 6.317921913520595e-05, 'layer1': 341, 'layer2': 361, 'layer3': 116}. Best is trial 74 with value: 0.9166002918687234.

Escherichia_Coli | Piperacillin-Tazobactam | Optuna:  66%|██████▋   | 133/200 [4:40:55<2:26:53, 131.54s/it, best=0.917][A
Escherichia_Coli | Piperacillin-Tazobactam | Optuna:  66%|██████▋   | 133/200 [4:40:55<2:26:53, 131.54s/it, best=0.917][A[I 2026-02-28 12:45:06,076] Trial 126 finished with value: 0.8854374469256049 and parameters: {'activation': 'identity', 'solver': 'adam', 'lr': 0.0002748248868798156, 'layer1': 172, 'layer2': 82, 'layer3': 326}. Best is trial 8 with value: 0.8879562150966016.
Staphylococcus_Aureus | LPS | Optuna:  64%|██████▎   | 127/200 [4:38:52<2:19:53, 114.98s/it, best=0.888]Staphylococcus_Aureus | LPS | Optuna:  64%|██████▎   | 127/200 [4:38:52<2:19:53, 114.98s/it, best=0.888][I 2026-02-28 12:45:46,547] Trial 194 finished with value: 0.8658444483129923 and parameters: {'activation': 'identity', 'solver': 'adam', 'lr': 0.0001792968640057981, 'layer1': 417, 'layer2': 371, 'layer3': 154}. Best is trial 187 with value: 0.867960593593898.
Pseudomonas_Aeruginosa | DirectMulti | Optuna:  98%|█████████▊| 195/200 [5:49:32<10:11, 122.34s/it, best=0.868]Pseudomonas_Aeruginosa | DirectMulti | Optuna:  98%|█████████▊| 195/200 [5:49:32<10:11, 122.34s/it, best=0.868]/export/usuarios01/egarroyo/MALDI_for_AMR_prediction/venv/lib/python3.13/site-packages/sklearn/model_selection/_split.py:813: UserWarning: The least populated class in y has only 4 members, which is less than n_splits=5.
  warnings.warn(
[I 2026-02-28 12:46:45,069] Trial 163 finished with value: 0.9242232124001697 and parameters: {'activation': 'identity', 'solver': 'adam', 'lr': 0.00017020313421531742, 'layer1': 416, 'layer2': 394, 'layer3': 55}. Best is trial 71 with value: 0.9257111996592865.
Klebsiella_Pneumoniae | LPS | Optuna:  82%|████████▏ | 164/200 [3:59:01<1:03:20, 105.57s/it, best=0.926]Klebsiella_Pneumoniae | LPS | Optuna:  82%|████████▏ | 164/200 [3:59:01<1:03:20, 105.57s/it, best=0.926][I 2026-02-28 12:46:51,111] Trial 127 finished with value: 0.8865626254910349 and parameters: {'activation': 'identity', 'solver': 'adam', 'lr': 0.00021529475126674135, 'layer1': 181, 'layer2': 127, 'layer3': 301}. Best is trial 8 with value: 0.8879562150966016.
Staphylococcus_Aureus | LPS | Optuna:  64%|██████▍   | 128/200 [4:40:37<2:14:23, 112.00s/it, best=0.888]Staphylococcus_Aureus | LPS | Optuna:  64%|██████▍   | 128/200 [4:40:37<2:14:23, 112.00s/it, best=0.888][I 2026-02-28 12:47:16,094] Trial 195 finished with value: 0.8632729659406996 and parameters: {'activation': 'identity', 'solver': 'adam', 'lr': 0.00012341305534862887, 'layer1': 419, 'layer2': 373, 'layer3': 150}. Best is trial 187 with value: 0.867960593593898.
Pseudomonas_Aeruginosa | DirectMulti | Optuna:  98%|█████████▊| 196/200 [5:51:02<07:30, 112.50s/it, best=0.868]Pseudomonas_Aeruginosa | DirectMulti | Optuna:  98%|█████████▊| 196/200 [5:51:02<07:30, 112.50s/it, best=0.868]/export/usuarios01/egarroyo/MALDI_for_AMR_prediction/venv/lib/python3.13/site-packages/sklearn/model_selection/_split.py:813: UserWarning: The least populated class in y has only 4 members, which is less than n_splits=5.
  warnings.warn(
[I 2026-02-28 12:47:23,851] Trial 133 finished with value: 0.9126481420667789 and parameters: {'activation': 'relu', 'solver': 'adam', 'lr': 0.00016320332201016758, 'layer1': 356, 'layer2': 341, 'layer3': 138}. Best is trial 74 with value: 0.9166002918687234.

Escherichia_Coli | Piperacillin-Tazobactam | Optuna:  67%|██████▋   | 134/200 [4:43:16<2:27:54, 134.46s/it, best=0.917][A
Escherichia_Coli | Piperacillin-Tazobactam | Optuna:  67%|██████▋   | 134/200 [4:43:16<2:27:54, 134.46s/it, best=0.917][A[I 2026-02-28 12:48:05,389] Trial 164 finished with value: 0.9256527167072667 and parameters: {'activation': 'identity', 'solver': 'adam', 'lr': 0.000329123419592903, 'layer1': 49, 'layer2': 449, 'layer3': 69}. Best is trial 71 with value: 0.9257111996592865.
Klebsiella_Pneumoniae | LPS | Optuna:  82%|████████▎ | 165/200 [4:00:21<57:09, 97.99s/it, best=0.926]   Klebsiella_Pneumoniae | LPS | Optuna:  82%|████████▎ | 165/200 [4:00:21<57:09, 97.99s/it, best=0.926][I 2026-02-28 12:48:10,575] Trial 128 finished with value: 0.8834389342844894 and parameters: {'activation': 'tanh', 'solver': 'adam', 'lr': 0.0003537252657146066, 'layer1': 188, 'layer2': 120, 'layer3': 278}. Best is trial 8 with value: 0.8879562150966016.
Staphylococcus_Aureus | LPS | Optuna:  64%|██████▍   | 129/200 [4:41:56<2:00:58, 102.24s/it, best=0.888]Staphylococcus_Aureus | LPS | Optuna:  64%|██████▍   | 129/200 [4:41:56<2:00:58, 102.24s/it, best=0.888][I 2026-02-28 12:49:02,309] Trial 196 finished with value: 0.8617219273677353 and parameters: {'activation': 'identity', 'solver': 'adam', 'lr': 0.00016729488771167423, 'layer1': 434, 'layer2': 333, 'layer3': 128}. Best is trial 187 with value: 0.867960593593898.
Pseudomonas_Aeruginosa | DirectMulti | Optuna:  98%|█████████▊| 197/200 [5:52:48<05:31, 110.62s/it, best=0.868]Pseudomonas_Aeruginosa | DirectMulti | Optuna:  98%|█████████▊| 197/200 [5:52:48<05:31, 110.62s/it, best=0.868]/export/usuarios01/egarroyo/MALDI_for_AMR_prediction/venv/lib/python3.13/site-packages/sklearn/model_selection/_split.py:813: UserWarning: The least populated class in y has only 4 members, which is less than n_splits=5.
  warnings.warn(
[I 2026-02-28 12:49:26,805] Trial 165 finished with value: 0.9233886410836117 and parameters: {'activation': 'identity', 'solver': 'adam', 'lr': 0.0023049525475659547, 'layer1': 44, 'layer2': 453, 'layer3': 70}. Best is trial 71 with value: 0.9257111996592865.
Klebsiella_Pneumoniae | LPS | Optuna:  83%|████████▎ | 166/200 [4:01:42<52:42, 93.02s/it, best=0.926]Klebsiella_Pneumoniae | LPS | Optuna:  83%|████████▎ | 166/200 [4:01:42<52:42, 93.02s/it, best=0.926][I 2026-02-28 12:49:47,761] Trial 129 finished with value: 0.884068843369737 and parameters: {'activation': 'identity', 'solver': 'adam', 'lr': 0.00020593287870468048, 'layer1': 159, 'layer2': 160, 'layer3': 283}. Best is trial 8 with value: 0.8879562150966016.
Staphylococcus_Aureus | LPS | Optuna:  65%|██████▌   | 130/200 [4:43:34<1:57:30, 100.72s/it, best=0.888]Staphylococcus_Aureus | LPS | Optuna:  65%|██████▌   | 130/200 [4:43:34<1:57:30, 100.72s/it, best=0.888][I 2026-02-28 12:49:59,730] Trial 134 finished with value: 0.9142023114108472 and parameters: {'activation': 'relu', 'solver': 'adam', 'lr': 9.748122416750982e-05, 'layer1': 485, 'layer2': 353, 'layer3': 88}. Best is trial 74 with value: 0.9166002918687234.

Escherichia_Coli | Piperacillin-Tazobactam | Optuna:  68%|██████▊   | 135/200 [4:45:52<2:32:37, 140.88s/it, best=0.917][A
Escherichia_Coli | Piperacillin-Tazobactam | Optuna:  68%|██████▊   | 135/200 [4:45:52<2:32:37, 140.88s/it, best=0.917][A[I 2026-02-28 12:50:43,578] Trial 197 finished with value: 0.8633033896798464 and parameters: {'activation': 'identity', 'solver': 'adam', 'lr': 0.0001882571263532296, 'layer1': 424, 'layer2': 364, 'layer3': 115}. Best is trial 187 with value: 0.867960593593898.
Pseudomonas_Aeruginosa | DirectMulti | Optuna:  99%|█████████▉| 198/200 [5:54:29<03:35, 107.81s/it, best=0.868]Pseudomonas_Aeruginosa | DirectMulti | Optuna:  99%|█████████▉| 198/200 [5:54:29<03:35, 107.81s/it, best=0.868]/export/usuarios01/egarroyo/MALDI_for_AMR_prediction/venv/lib/python3.13/site-packages/sklearn/model_selection/_split.py:813: UserWarning: The least populated class in y has only 4 members, which is less than n_splits=5.
  warnings.warn(
[I 2026-02-28 12:50:51,656] Trial 166 finished with value: 0.9226057937980634 and parameters: {'activation': 'identity', 'solver': 'adam', 'lr': 0.0003513088387459039, 'layer1': 392, 'layer2': 441, 'layer3': 90}. Best is trial 71 with value: 0.9257111996592865.
Klebsiella_Pneumoniae | LPS | Optuna:  84%|████████▎ | 167/200 [4:03:07<49:48, 90.57s/it, best=0.926]Klebsiella_Pneumoniae | LPS | Optuna:  84%|████████▎ | 167/200 [4:03:07<49:48, 90.57s/it, best=0.926][I 2026-02-28 12:51:33,914] Trial 130 finished with value: 0.8832061429458401 and parameters: {'activation': 'relu', 'solver': 'adam', 'lr': 0.00024233305544093443, 'layer1': 147, 'layer2': 134, 'layer3': 303}. Best is trial 8 with value: 0.8879562150966016.
Staphylococcus_Aureus | LPS | Optuna:  66%|██████▌   | 131/200 [4:45:20<1:57:42, 102.35s/it, best=0.888]Staphylococcus_Aureus | LPS | Optuna:  66%|██████▌   | 131/200 [4:45:20<1:57:42, 102.35s/it, best=0.888][I 2026-02-28 12:52:32,118] Trial 135 finished with value: 0.9163063219980112 and parameters: {'activation': 'relu', 'solver': 'adam', 'lr': 0.00021958668945246508, 'layer1': 322, 'layer2': 399, 'layer3': 163}. Best is trial 74 with value: 0.9166002918687234.

Escherichia_Coli | Piperacillin-Tazobactam | Optuna:  68%|██████▊   | 136/200 [4:48:24<2:33:57, 144.33s/it, best=0.917][A
Escherichia_Coli | Piperacillin-Tazobactam | Optuna:  68%|██████▊   | 136/200 [4:48:24<2:33:57, 144.33s/it, best=0.917][A[I 2026-02-28 12:52:43,265] Trial 167 finished with value: 0.9231446245089137 and parameters: {'activation': 'identity', 'solver': 'adam', 'lr': 0.00021939293873560537, 'layer1': 365, 'layer2': 420, 'layer3': 63}. Best is trial 71 with value: 0.9257111996592865.
Klebsiella_Pneumoniae | LPS | Optuna:  84%|████████▍ | 168/200 [4:04:59<51:40, 96.88s/it, best=0.926]Klebsiella_Pneumoniae | LPS | Optuna:  84%|████████▍ | 168/200 [4:04:59<51:40, 96.88s/it, best=0.926][I 2026-02-28 12:53:09,660] Trial 168 finished with value: 0.8717803189505382 and parameters: {'activation': 'identity', 'solver': 'sgd', 'lr': 0.0004252776221695796, 'layer1': 52, 'layer2': 477, 'layer3': 80}. Best is trial 71 with value: 0.9257111996592865.
Klebsiella_Pneumoniae | LPS | Optuna:  84%|████████▍ | 169/200 [4:05:25<39:07, 75.74s/it, best=0.926]Klebsiella_Pneumoniae | LPS | Optuna:  84%|████████▍ | 169/200 [4:05:25<39:07, 75.74s/it, best=0.926][I 2026-02-28 12:53:41,686] Trial 131 finished with value: 0.885816822432262 and parameters: {'activation': 'identity', 'solver': 'adam', 'lr': 0.0003013967521909556, 'layer1': 178, 'layer2': 97, 'layer3': 315}. Best is trial 8 with value: 0.8879562150966016.
Staphylococcus_Aureus | LPS | Optuna:  66%|██████▌   | 132/200 [4:47:28<2:04:38, 109.98s/it, best=0.888]Staphylococcus_Aureus | LPS | Optuna:  66%|██████▌   | 132/200 [4:47:28<2:04:38, 109.98s/it, best=0.888][I 2026-02-28 12:54:41,154] Trial 136 finished with value: 0.9126566040618931 and parameters: {'activation': 'relu', 'solver': 'adam', 'lr': 0.0003226761543872455, 'layer1': 323, 'layer2': 457, 'layer3': 163}. Best is trial 74 with value: 0.9166002918687234.

Escherichia_Coli | Piperacillin-Tazobactam | Optuna:  68%|██████▊   | 137/200 [4:50:33<2:26:43, 139.74s/it, best=0.917][A
Escherichia_Coli | Piperacillin-Tazobactam | Optuna:  68%|██████▊   | 137/200 [4:50:33<2:26:43, 139.74s/it, best=0.917][A[I 2026-02-28 12:54:54,292] Trial 169 finished with value: 0.9244538004569189 and parameters: {'activation': 'identity', 'solver': 'adam', 'lr': 0.00011321794921272358, 'layer1': 253, 'layer2': 451, 'layer3': 284}. Best is trial 71 with value: 0.9257111996592865.
Klebsiella_Pneumoniae | LPS | Optuna:  85%|████████▌ | 170/200 [4:07:10<42:12, 84.40s/it, best=0.926]Klebsiella_Pneumoniae | LPS | Optuna:  85%|████████▌ | 170/200 [4:07:10<42:12, 84.40s/it, best=0.926][I 2026-02-28 12:55:28,347] Trial 132 finished with value: 0.8845748951006607 and parameters: {'activation': 'identity', 'solver': 'adam', 'lr': 0.00016045235281051022, 'layer1': 135, 'layer2': 74, 'layer3': 335}. Best is trial 8 with value: 0.8879562150966016.
Staphylococcus_Aureus | LPS | Optuna:  66%|██████▋   | 133/200 [4:49:14<2:01:41, 108.98s/it, best=0.888]Staphylococcus_Aureus | LPS | Optuna:  66%|██████▋   | 133/200 [4:49:14<2:01:41, 108.98s/it, best=0.888][I 2026-02-28 12:56:05,813] Trial 170 finished with value: 0.9240698996631792 and parameters: {'activation': 'identity', 'solver': 'adam', 'lr': 0.0003049549194109406, 'layer1': 51, 'layer2': 437, 'layer3': 46}. Best is trial 71 with value: 0.9257111996592865.
Klebsiella_Pneumoniae | LPS | Optuna:  86%|████████▌ | 171/200 [4:08:21<38:55, 80.54s/it, best=0.926]Klebsiella_Pneumoniae | LPS | Optuna:  86%|████████▌ | 171/200 [4:08:21<38:55, 80.54s/it, best=0.926][I 2026-02-28 12:56:55,955] Trial 198 finished with value: 0.7649860130965951 and parameters: {'activation': 'identity', 'solver': 'sgd', 'lr': 3.1024473985849837e-05, 'layer1': 452, 'layer2': 352, 'layer3': 163}. Best is trial 187 with value: 0.867960593593898.
Pseudomonas_Aeruginosa | DirectMulti | Optuna: 100%|█████████▉| 199/200 [6:00:42<03:07, 187.18s/it, best=0.868]Pseudomonas_Aeruginosa | DirectMulti | Optuna: 100%|█████████▉| 199/200 [6:00:42<03:07, 187.18s/it, best=0.868]/export/usuarios01/egarroyo/MALDI_for_AMR_prediction/venv/lib/python3.13/site-packages/sklearn/model_selection/_split.py:813: UserWarning: The least populated class in y has only 4 members, which is less than n_splits=5.
  warnings.warn(
[I 2026-02-28 12:57:03,675] Trial 171 finished with value: 0.9228040355920161 and parameters: {'activation': 'identity', 'solver': 'adam', 'lr': 0.0002549184260411413, 'layer1': 34, 'layer2': 428, 'layer3': 54}. Best is trial 71 with value: 0.9257111996592865.
Klebsiella_Pneumoniae | LPS | Optuna:  86%|████████▌ | 172/200 [4:09:19<34:24, 73.74s/it, best=0.926]Klebsiella_Pneumoniae | LPS | Optuna:  86%|████████▌ | 172/200 [4:09:19<34:24, 73.74s/it, best=0.926][I 2026-02-28 12:57:06,279] Trial 137 finished with value: 0.9150157859275112 and parameters: {'activation': 'relu', 'solver': 'adam', 'lr': 0.00023349735889501846, 'layer1': 298, 'layer2': 445, 'layer3': 175}. Best is trial 74 with value: 0.9166002918687234.

Escherichia_Coli | Piperacillin-Tazobactam | Optuna:  69%|██████▉   | 138/200 [4:52:58<2:26:04, 141.36s/it, best=0.917][A
Escherichia_Coli | Piperacillin-Tazobactam | Optuna:  69%|██████▉   | 138/200 [4:52:58<2:26:04, 141.36s/it, best=0.917][A[I 2026-02-28 12:57:07,828] Trial 133 finished with value: 0.886918732597127 and parameters: {'activation': 'identity', 'solver': 'adam', 'lr': 0.0005432505181288236, 'layer1': 184, 'layer2': 117, 'layer3': 321}. Best is trial 8 with value: 0.8879562150966016.
Staphylococcus_Aureus | LPS | Optuna:  67%|██████▋   | 134/200 [4:50:54<1:56:44, 106.13s/it, best=0.888]Staphylococcus_Aureus | LPS | Optuna:  67%|██████▋   | 134/200 [4:50:54<1:56:44, 106.13s/it, best=0.888][I 2026-02-28 12:57:52,129] Trial 199 finished with value: 0.8592123113277103 and parameters: {'activation': 'tanh', 'solver': 'adam', 'lr': 9.887337966896753e-05, 'layer1': 300, 'layer2': 371, 'layer3': 231}. Best is trial 187 with value: 0.867960593593898.
Pseudomonas_Aeruginosa | DirectMulti | Optuna: 100%|██████████| 200/200 [6:01:38<00:00, 147.88s/it, best=0.868]Pseudomonas_Aeruginosa | DirectMulti | Optuna: 100%|██████████| 200/200 [6:01:38<00:00, 147.88s/it, best=0.868]                                                                                                               [Pseudomonas_Aeruginosa | DirectMulti] [OPTUNA DONE] Best CV WF1=0.8680 | params={'activation': 'identity', 'solver': 'adam', 'lr': 3.812366426519962e-05, 'layer1': 446, 'layer2': 350, 'layer3': 198}
[Pseudomonas_Aeruginosa | DirectMulti] Retraining with validation early stopping (10% split)...
[I 2026-02-28 12:58:16,270] Trial 172 finished with value: 0.9225661053128109 and parameters: {'activation': 'identity', 'solver': 'adam', 'lr': 0.00018200403012357195, 'layer1': 23, 'layer2': 456, 'layer3': 437}. Best is trial 71 with value: 0.9257111996592865.
Klebsiella_Pneumoniae | LPS | Optuna:  86%|████████▋ | 173/200 [4:10:32<33:01, 73.39s/it, best=0.926]Klebsiella_Pneumoniae | LPS | Optuna:  86%|████████▋ | 173/200 [4:10:32<33:01, 73.39s/it, best=0.926][Pseudomonas_Aeruginosa | DirectMulti] Testing...
[Pseudomonas_Aeruginosa | DirectMulti] [TEST] WF1=0.8412 | ACC=0.8705 | HL=0.1295 | best_val_WF1=0.8594

[END] Species: Pseudomonas_Aeruginosa done.
[Parallel(n_jobs=5)]: Done   1 tasks      | elapsed: 1330.9min
[I 2026-02-28 12:58:46,202] Trial 134 finished with value: 0.8846062833288884 and parameters: {'activation': 'identity', 'solver': 'adam', 'lr': 0.0005284942791960408, 'layer1': 191, 'layer2': 122, 'layer3': 304}. Best is trial 8 with value: 0.8879562150966016.
Staphylococcus_Aureus | LPS | Optuna:  68%|██████▊   | 135/200 [4:52:32<1:52:27, 103.80s/it, best=0.888]Staphylococcus_Aureus | LPS | Optuna:  68%|██████▊   | 135/200 [4:52:32<1:52:27, 103.80s/it, best=0.888][I 2026-02-28 12:59:02,223] Trial 138 finished with value: 0.9146766263498378 and parameters: {'activation': 'relu', 'solver': 'adam', 'lr': 0.00020474019969141544, 'layer1': 282, 'layer2': 420, 'layer3': 176}. Best is trial 74 with value: 0.9166002918687234.

Escherichia_Coli | Piperacillin-Tazobactam | Optuna:  70%|██████▉   | 139/200 [4:54:54<2:15:57, 133.73s/it, best=0.917][A
Escherichia_Coli | Piperacillin-Tazobactam | Optuna:  70%|██████▉   | 139/200 [4:54:54<2:15:57, 133.73s/it, best=0.917][A[I 2026-02-28 12:59:21,092] Trial 173 finished with value: 0.925310298454128 and parameters: {'activation': 'identity', 'solver': 'adam', 'lr': 0.0006583021842783204, 'layer1': 42, 'layer2': 443, 'layer3': 33}. Best is trial 71 with value: 0.9257111996592865.
Klebsiella_Pneumoniae | LPS | Optuna:  87%|████████▋ | 174/200 [4:11:37<30:41, 70.82s/it, best=0.926]Klebsiella_Pneumoniae | LPS | Optuna:  87%|████████▋ | 174/200 [4:11:37<30:41, 70.82s/it, best=0.926][I 2026-02-28 13:00:03,903] Trial 135 finished with value: 0.8863716655257596 and parameters: {'activation': 'identity', 'solver': 'adam', 'lr': 0.0006626497960547445, 'layer1': 163, 'layer2': 104, 'layer3': 321}. Best is trial 8 with value: 0.8879562150966016.
Staphylococcus_Aureus | LPS | Optuna:  68%|██████▊   | 136/200 [4:53:50<1:42:22, 95.97s/it, best=0.888] Staphylococcus_Aureus | LPS | Optuna:  68%|██████▊   | 136/200 [4:53:50<1:42:22, 95.97s/it, best=0.888][I 2026-02-28 13:00:49,878] Trial 139 finished with value: 0.9137742556885129 and parameters: {'activation': 'relu', 'solver': 'adam', 'lr': 0.00024675638189055243, 'layer1': 317, 'layer2': 193, 'layer3': 152}. Best is trial 74 with value: 0.9166002918687234.

Escherichia_Coli | Piperacillin-Tazobactam | Optuna:  70%|███████   | 140/200 [4:56:42<2:05:54, 125.91s/it, best=0.917][A
Escherichia_Coli | Piperacillin-Tazobactam | Optuna:  70%|███████   | 140/200 [4:56:42<2:05:54, 125.91s/it, best=0.917][A[I 2026-02-28 13:00:52,662] Trial 174 finished with value: 0.9220808554109622 and parameters: {'activation': 'identity', 'solver': 'adam', 'lr': 0.0006355600087584304, 'layer1': 451, 'layer2': 445, 'layer3': 41}. Best is trial 71 with value: 0.9257111996592865.
Klebsiella_Pneumoniae | LPS | Optuna:  88%|████████▊ | 175/200 [4:13:08<32:06, 77.05s/it, best=0.926]Klebsiella_Pneumoniae | LPS | Optuna:  88%|████████▊ | 175/200 [4:13:08<32:06, 77.05s/it, best=0.926][I 2026-02-28 13:01:22,804] Trial 136 finished with value: 0.8843566084548777 and parameters: {'activation': 'identity', 'solver': 'adam', 'lr': 0.0004162605377294999, 'layer1': 200, 'layer2': 115, 'layer3': 298}. Best is trial 8 with value: 0.8879562150966016.
Staphylococcus_Aureus | LPS | Optuna:  68%|██████▊   | 137/200 [4:55:09<1:35:23, 90.85s/it, best=0.888]Staphylococcus_Aureus | LPS | Optuna:  68%|██████▊   | 137/200 [4:55:09<1:35:23, 90.85s/it, best=0.888][I 2026-02-28 13:01:23,797] Trial 140 finished with value: 0.8969836260061745 and parameters: {'activation': 'relu', 'solver': 'sgd', 'lr': 0.00046378623594413933, 'layer1': 300, 'layer2': 471, 'layer3': 161}. Best is trial 74 with value: 0.9166002918687234.

Escherichia_Coli | Piperacillin-Tazobactam | Optuna:  70%|███████   | 141/200 [4:57:16<1:36:40, 98.31s/it, best=0.917] [A
Escherichia_Coli | Piperacillin-Tazobactam | Optuna:  70%|███████   | 141/200 [4:57:16<1:36:40, 98.31s/it, best=0.917][A[I 2026-02-28 13:01:43,466] Trial 175 finished with value: 0.9187658016810563 and parameters: {'activation': 'logistic', 'solver': 'adam', 'lr': 0.0012314111525553984, 'layer1': 44, 'layer2': 420, 'layer3': 69}. Best is trial 71 with value: 0.9257111996592865.
