Staphylococcus_Aureus | Clindamycin | Optuna:  45%|████▌     | 90/200 [2:01:47<2:39:36, 87.06s/it, best=0.857][A[I 2026-02-28 00:00:09,247] Trial 19 finished with value: 0.7459176854620185 and parameters: {'activation': 'relu', 'solver': 'adam', 'lr': 8.337515646422249e-06, 'layer1': 439, 'layer2': 73, 'layer3': 445}. Best is trial 14 with value: 0.8971256036318559.

Escherichia_Coli | Ceftriaxone | Optuna:  10%|█         | 20/200 [50:10<5:39:47, 113.26s/it, best=0.897][A
Escherichia_Coli | Ceftriaxone | Optuna:  10%|█         | 20/200 [50:10<5:39:47, 113.26s/it, best=0.897][A[I 2026-02-28 00:00:20,684] Trial 100 finished with value: 0.8830425365792804 and parameters: {'activation': 'identity', 'solver': 'adam', 'lr': 0.00048513088558740567, 'layer1': 207, 'layer2': 460, 'layer3': 476}. Best is trial 73 with value: 0.8861579932511299.

Pseudomonas_Aeruginosa | Meropenem | Optuna:  50%|█████     | 101/200 [1:55:55<1:55:55, 70.26s/it, best=0.886][A
Pseudomonas_Aeruginosa | Meropenem | Optuna:  50%|█████     | 101/200 [1:55:55<1:55:55, 70.26s/it, best=0.886][A[I 2026-02-28 00:01:11,676] Trial 90 finished with value: 0.8554277722289969 and parameters: {'activation': 'logistic', 'solver': 'adam', 'lr': 0.000718763815452314, 'layer1': 170, 'layer2': 32, 'layer3': 62}. Best is trial 71 with value: 0.8566270523015425.

Staphylococcus_Aureus | Clindamycin | Optuna:  46%|████▌     | 91/200 [2:03:13<2:37:21, 86.62s/it, best=0.857][A
Staphylococcus_Aureus | Clindamycin | Optuna:  46%|████▌     | 91/200 [2:03:13<2:37:21, 86.62s/it, best=0.857][A[I 2026-02-28 00:01:27,700] Trial 101 finished with value: 0.8838226683274474 and parameters: {'activation': 'identity', 'solver': 'adam', 'lr': 0.000703945093094203, 'layer1': 403, 'layer2': 208, 'layer3': 483}. Best is trial 73 with value: 0.8861579932511299.

Pseudomonas_Aeruginosa | Meropenem | Optuna:  51%|█████     | 102/200 [1:57:02<1:53:10, 69.29s/it, best=0.886][A
Pseudomonas_Aeruginosa | Meropenem | Optuna:  51%|█████     | 102/200 [1:57:02<1:53:10, 69.29s/it, best=0.886][A[I 2026-02-28 00:01:40,069] Trial 106 finished with value: 0.9041371007469003 and parameters: {'activation': 'tanh', 'solver': 'adam', 'lr': 1.0342146222037938e-05, 'layer1': 332, 'layer2': 500, 'layer3': 372}. Best is trial 102 with value: 0.9090522215791805.

Klebsiella_Pneumoniae | Ceftriaxone | Optuna:  54%|█████▎    | 107/200 [3:11:01<3:55:25, 151.89s/it, best=0.909][A
Klebsiella_Pneumoniae | Ceftriaxone | Optuna:  54%|█████▎    | 107/200 [3:11:01<3:55:25, 151.89s/it, best=0.909][A[I 2026-02-28 00:02:08,448] Trial 20 finished with value: 0.891720868281304 and parameters: {'activation': 'relu', 'solver': 'adam', 'lr': 0.00046359907122990227, 'layer1': 486, 'layer2': 398, 'layer3': 210}. Best is trial 14 with value: 0.8971256036318559.

Escherichia_Coli | Ceftriaxone | Optuna:  10%|█         | 21/200 [52:09<5:43:13, 115.05s/it, best=0.897][A
Escherichia_Coli | Ceftriaxone | Optuna:  10%|█         | 21/200 [52:09<5:43:13, 115.05s/it, best=0.897][A[I 2026-02-28 00:02:26,834] Trial 91 finished with value: 0.8499179996893533 and parameters: {'activation': 'logistic', 'solver': 'adam', 'lr': 0.0007492961621214296, 'layer1': 173, 'layer2': 35, 'layer3': 85}. Best is trial 71 with value: 0.8566270523015425.

Staphylococcus_Aureus | Clindamycin | Optuna:  46%|████▌     | 92/200 [2:04:28<2:29:43, 83.18s/it, best=0.857][A
Staphylococcus_Aureus | Clindamycin | Optuna:  46%|████▌     | 92/200 [2:04:28<2:29:43, 83.18s/it, best=0.857][A[I 2026-02-28 00:02:56,278] Trial 102 finished with value: 0.8794859111507067 and parameters: {'activation': 'identity', 'solver': 'adam', 'lr': 4.268129843575598e-05, 'layer1': 444, 'layer2': 228, 'layer3': 450}. Best is trial 73 with value: 0.8861579932511299.

Pseudomonas_Aeruginosa | Meropenem | Optuna:  52%|█████▏    | 103/200 [1:58:31<2:01:22, 75.07s/it, best=0.886][A
Pseudomonas_Aeruginosa | Meropenem | Optuna:  52%|█████▏    | 103/200 [1:58:31<2:01:22, 75.07s/it, best=0.886][A[I 2026-02-28 00:03:52,685] Trial 92 finished with value: 0.8431039204552182 and parameters: {'activation': 'logistic', 'solver': 'adam', 'lr': 0.0005306271865356919, 'layer1': 201, 'layer2': 23, 'layer3': 51}. Best is trial 71 with value: 0.8566270523015425.

Staphylococcus_Aureus | Clindamycin | Optuna:  46%|████▋     | 93/200 [2:05:54<2:29:45, 83.98s/it, best=0.857][A
Staphylococcus_Aureus | Clindamycin | Optuna:  46%|████▋     | 93/200 [2:05:54<2:29:45, 83.98s/it, best=0.857][A[I 2026-02-28 00:04:15,229] Trial 103 finished with value: 0.8807140525727222 and parameters: {'activation': 'identity', 'solver': 'adam', 'lr': 0.00107426883456639, 'layer1': 349, 'layer2': 183, 'layer3': 431}. Best is trial 73 with value: 0.8861579932511299.

Pseudomonas_Aeruginosa | Meropenem | Optuna:  52%|█████▏    | 104/200 [1:59:50<2:01:58, 76.24s/it, best=0.886][A
Pseudomonas_Aeruginosa | Meropenem | Optuna:  52%|█████▏    | 104/200 [1:59:50<2:01:58, 76.24s/it, best=0.886][A[I 2026-02-28 00:04:52,247] Trial 107 finished with value: 0.9026731654937737 and parameters: {'activation': 'tanh', 'solver': 'adam', 'lr': 7.937169079424336e-06, 'layer1': 305, 'layer2': 469, 'layer3': 355}. Best is trial 102 with value: 0.9090522215791805.

Klebsiella_Pneumoniae | Ceftriaxone | Optuna:  54%|█████▍    | 108/200 [3:14:13<4:11:25, 163.98s/it, best=0.909][A
Klebsiella_Pneumoniae | Ceftriaxone | Optuna:  54%|█████▍    | 108/200 [3:14:13<4:11:25, 163.98s/it, best=0.909][A[I 2026-02-28 00:05:00,749] Trial 93 finished with value: 0.8481682437687981 and parameters: {'activation': 'logistic', 'solver': 'adam', 'lr': 0.001101828426105968, 'layer1': 262, 'layer2': 52, 'layer3': 78}. Best is trial 71 with value: 0.8566270523015425.

Staphylococcus_Aureus | Clindamycin | Optuna:  47%|████▋     | 94/200 [2:07:02<2:19:55, 79.21s/it, best=0.857][A
Staphylococcus_Aureus | Clindamycin | Optuna:  47%|████▋     | 94/200 [2:07:02<2:19:55, 79.21s/it, best=0.857][A[I 2026-02-28 00:05:09,764] Trial 21 finished with value: 0.8943745134382288 and parameters: {'activation': 'relu', 'solver': 'adam', 'lr': 4.5358664965132195e-05, 'layer1': 473, 'layer2': 136, 'layer3': 103}. Best is trial 14 with value: 0.8971256036318559.

Escherichia_Coli | Ceftriaxone | Optuna:  11%|█         | 22/200 [55:11<6:40:18, 134.93s/it, best=0.897][A
Escherichia_Coli | Ceftriaxone | Optuna:  11%|█         | 22/200 [55:11<6:40:18, 134.93s/it, best=0.897][A[I 2026-02-28 00:05:55,446] Trial 104 finished with value: 0.8823534306018603 and parameters: {'activation': 'identity', 'solver': 'adam', 'lr': 0.0009073945716896696, 'layer1': 500, 'layer2': 483, 'layer3': 476}. Best is trial 73 with value: 0.8861579932511299.

Pseudomonas_Aeruginosa | Meropenem | Optuna:  52%|█████▎    | 105/200 [2:01:30<2:12:05, 83.43s/it, best=0.886][A
Pseudomonas_Aeruginosa | Meropenem | Optuna:  52%|█████▎    | 105/200 [2:01:30<2:12:05, 83.43s/it, best=0.886][A[I 2026-02-28 00:06:04,186] Trial 94 finished with value: 0.814749854669006 and parameters: {'activation': 'logistic', 'solver': 'adam', 'lr': 0.000654254732143139, 'layer1': 245, 'layer2': 44, 'layer3': 10}. Best is trial 71 with value: 0.8566270523015425.

Staphylococcus_Aureus | Clindamycin | Optuna:  48%|████▊     | 95/200 [2:08:05<2:10:19, 74.48s/it, best=0.857][A
Staphylococcus_Aureus | Clindamycin | Optuna:  48%|████▊     | 95/200 [2:08:05<2:10:19, 74.48s/it, best=0.857][A[I 2026-02-28 00:07:04,065] Trial 95 finished with value: 0.8403256984627839 and parameters: {'activation': 'logistic', 'solver': 'adam', 'lr': 0.0015459913633362186, 'layer1': 157, 'layer2': 12, 'layer3': 133}. Best is trial 71 with value: 0.8566270523015425.

Staphylococcus_Aureus | Clindamycin | Optuna:  48%|████▊     | 96/200 [2:09:05<2:01:30, 70.10s/it, best=0.857][A
Staphylococcus_Aureus | Clindamycin | Optuna:  48%|████▊     | 96/200 [2:09:05<2:01:30, 70.10s/it, best=0.857][A[I 2026-02-28 00:07:20,651] Trial 105 finished with value: 0.8814894864307602 and parameters: {'activation': 'identity', 'solver': 'adam', 'lr': 0.0016115757117196195, 'layer1': 412, 'layer2': 251, 'layer3': 492}. Best is trial 73 with value: 0.8861579932511299.

Pseudomonas_Aeruginosa | Meropenem | Optuna:  53%|█████▎    | 106/200 [2:02:55<2:11:32, 83.96s/it, best=0.886][A
Pseudomonas_Aeruginosa | Meropenem | Optuna:  53%|█████▎    | 106/200 [2:02:55<2:11:32, 83.96s/it, best=0.886][A[I 2026-02-28 00:08:19,090] Trial 96 finished with value: 0.8340393101646288 and parameters: {'activation': 'logistic', 'solver': 'adam', 'lr': 0.002067908328723676, 'layer1': 185, 'layer2': 28, 'layer3': 55}. Best is trial 71 with value: 0.8566270523015425.

Staphylococcus_Aureus | Clindamycin | Optuna:  48%|████▊     | 97/200 [2:10:20<2:02:52, 71.58s/it, best=0.857][A
Staphylococcus_Aureus | Clindamycin | Optuna:  48%|████▊     | 97/200 [2:10:20<2:02:52, 71.58s/it, best=0.857][A[I 2026-02-28 00:08:26,898] Trial 22 finished with value: 0.8963180293570382 and parameters: {'activation': 'relu', 'solver': 'adam', 'lr': 3.9254793913892974e-05, 'layer1': 453, 'layer2': 140, 'layer3': 58}. Best is trial 14 with value: 0.8971256036318559.

Escherichia_Coli | Ceftriaxone | Optuna:  12%|█▏        | 23/200 [58:28<7:33:07, 153.60s/it, best=0.897][A
Escherichia_Coli | Ceftriaxone | Optuna:  12%|█▏        | 23/200 [58:28<7:33:07, 153.60s/it, best=0.897][A[I 2026-02-28 00:08:49,521] Trial 106 finished with value: 0.8853818593995026 and parameters: {'activation': 'identity', 'solver': 'adam', 'lr': 0.0005814182844227328, 'layer1': 359, 'layer2': 173, 'layer3': 248}. Best is trial 73 with value: 0.8861579932511299.

Pseudomonas_Aeruginosa | Meropenem | Optuna:  54%|█████▎    | 107/200 [2:04:24<2:12:25, 85.44s/it, best=0.886][A
Pseudomonas_Aeruginosa | Meropenem | Optuna:  54%|█████▎    | 107/200 [2:04:24<2:12:25, 85.44s/it, best=0.886][A[I 2026-02-28 00:09:07,203] Trial 108 finished with value: 0.9023084978215008 and parameters: {'activation': 'tanh', 'solver': 'adam', 'lr': 5.672194706757272e-06, 'layer1': 364, 'layer2': 482, 'layer3': 365}. Best is trial 102 with value: 0.9090522215791805.

Klebsiella_Pneumoniae | Ceftriaxone | Optuna:  55%|█████▍    | 109/200 [3:18:28<4:50:05, 191.27s/it, best=0.909][A
Klebsiella_Pneumoniae | Ceftriaxone | Optuna:  55%|█████▍    | 109/200 [3:18:28<4:50:05, 191.27s/it, best=0.909][A[I 2026-02-28 00:09:56,420] Trial 107 finished with value: 0.8825775708689598 and parameters: {'activation': 'identity', 'solver': 'adam', 'lr': 0.00011232482814673343, 'layer1': 330, 'layer2': 155, 'layer3': 237}. Best is trial 73 with value: 0.8861579932511299.

Pseudomonas_Aeruginosa | Meropenem | Optuna:  54%|█████▍    | 108/200 [2:05:31<2:02:28, 79.87s/it, best=0.886][A
Pseudomonas_Aeruginosa | Meropenem | Optuna:  54%|█████▍    | 108/200 [2:05:31<2:02:28, 79.87s/it, best=0.886][A[I 2026-02-28 00:10:09,913] Trial 97 finished with value: 0.8556108760419839 and parameters: {'activation': 'logistic', 'solver': 'adam', 'lr': 0.0004453523561913981, 'layer1': 215, 'layer2': 40, 'layer3': 69}. Best is trial 71 with value: 0.8566270523015425.

Staphylococcus_Aureus | Clindamycin | Optuna:  49%|████▉     | 98/200 [2:12:11<2:21:41, 83.35s/it, best=0.857][A
Staphylococcus_Aureus | Clindamycin | Optuna:  49%|████▉     | 98/200 [2:12:11<2:21:41, 83.35s/it, best=0.857][A[I 2026-02-28 00:10:20,149] Trial 23 finished with value: 0.8948252739027645 and parameters: {'activation': 'relu', 'solver': 'adam', 'lr': 0.0001909628723888164, 'layer1': 390, 'layer2': 75, 'layer3': 58}. Best is trial 14 with value: 0.8971256036318559.

Escherichia_Coli | Ceftriaxone | Optuna:  12%|█▏        | 24/200 [1:00:21<6:55:02, 141.49s/it, best=0.897][A
Escherichia_Coli | Ceftriaxone | Optuna:  12%|█▏        | 24/200 [1:00:21<6:55:02, 141.49s/it, best=0.897][A[I 2026-02-28 00:11:05,232] Trial 108 finished with value: 0.8797219832598225 and parameters: {'activation': 'logistic', 'solver': 'adam', 'lr': 0.0006162791771905137, 'layer1': 362, 'layer2': 175, 'layer3': 251}. Best is trial 73 with value: 0.8861579932511299.

Pseudomonas_Aeruginosa | Meropenem | Optuna:  55%|█████▍    | 109/200 [2:06:40<1:56:06, 76.56s/it, best=0.886][A
Pseudomonas_Aeruginosa | Meropenem | Optuna:  55%|█████▍    | 109/200 [2:06:40<1:56:06, 76.56s/it, best=0.886][A[I 2026-02-28 00:11:20,654] Trial 109 finished with value: 0.9036601710037452 and parameters: {'activation': 'tanh', 'solver': 'adam', 'lr': 1.6804384213413584e-05, 'layer1': 333, 'layer2': 471, 'layer3': 343}. Best is trial 102 with value: 0.9090522215791805.

Klebsiella_Pneumoniae | Ceftriaxone | Optuna:  55%|█████▌    | 110/200 [3:20:42<4:20:53, 173.92s/it, best=0.909][A
Klebsiella_Pneumoniae | Ceftriaxone | Optuna:  55%|█████▌    | 110/200 [3:20:42<4:20:53, 173.92s/it, best=0.909][A[I 2026-02-28 00:11:36,980] Trial 98 finished with value: 0.8510175069083259 and parameters: {'activation': 'relu', 'solver': 'adam', 'lr': 0.0003910921339401702, 'layer1': 214, 'layer2': 68, 'layer3': 30}. Best is trial 71 with value: 0.8566270523015425.

Staphylococcus_Aureus | Clindamycin | Optuna:  50%|████▉     | 99/200 [2:13:38<2:22:10, 84.46s/it, best=0.857][A
Staphylococcus_Aureus | Clindamycin | Optuna:  50%|████▉     | 99/200 [2:13:38<2:22:10, 84.46s/it, best=0.857][A[I 2026-02-28 00:11:50,774] Trial 109 finished with value: 0.8440603374509736 and parameters: {'activation': 'identity', 'solver': 'sgd', 'lr': 0.00030735379463756024, 'layer1': 313, 'layer2': 305, 'layer3': 405}. Best is trial 73 with value: 0.8861579932511299.

Pseudomonas_Aeruginosa | Meropenem | Optuna:  55%|█████▌    | 110/200 [2:07:25<1:40:52, 67.25s/it, best=0.886][A
Pseudomonas_Aeruginosa | Meropenem | Optuna:  55%|█████▌    | 110/200 [2:07:25<1:40:52, 67.25s/it, best=0.886][A[I 2026-02-28 00:12:01,289] Trial 99 finished with value: 0.7888558471217525 and parameters: {'activation': 'logistic', 'solver': 'sgd', 'lr': 0.0003237663557990053, 'layer1': 171, 'layer2': 39, 'layer3': 74}. Best is trial 71 with value: 0.8566270523015425.

Staphylococcus_Aureus | Clindamycin | Optuna:  50%|█████     | 100/200 [2:14:02<1:50:41, 66.42s/it, best=0.857][A
Staphylococcus_Aureus | Clindamycin | Optuna:  50%|█████     | 100/200 [2:14:02<1:50:41, 66.42s/it, best=0.857][A[I 2026-02-28 00:12:38,283] Trial 100 finished with value: 0.7893828739292601 and parameters: {'activation': 'logistic', 'solver': 'adam', 'lr': 3.712230363602767e-06, 'layer1': 150, 'layer2': 54, 'layer3': 186}. Best is trial 71 with value: 0.8566270523015425.

Staphylococcus_Aureus | Clindamycin | Optuna:  50%|█████     | 101/200 [2:14:39<1:35:01, 57.59s/it, best=0.857][A
Staphylococcus_Aureus | Clindamycin | Optuna:  50%|█████     | 101/200 [2:14:39<1:35:01, 57.59s/it, best=0.857][A[I 2026-02-28 00:12:43,001] Trial 110 finished with value: 0.8821040473324328 and parameters: {'activation': 'identity', 'solver': 'adam', 'lr': 0.0007920822855846478, 'layer1': 135, 'layer2': 330, 'layer3': 346}. Best is trial 73 with value: 0.8861579932511299.

Pseudomonas_Aeruginosa | Meropenem | Optuna:  56%|█████▌    | 111/200 [2:08:18<1:33:04, 62.74s/it, best=0.886][A
Pseudomonas_Aeruginosa | Meropenem | Optuna:  56%|█████▌    | 111/200 [2:08:18<1:33:04, 62.74s/it, best=0.886][A[I 2026-02-28 00:13:06,493] Trial 101 finished with value: 0.7888558471217525 and parameters: {'activation': 'logistic', 'solver': 'adam', 'lr': 0.0002503659955688609, 'layer1': 208, 'layer2': 22, 'layer3': 67}. Best is trial 71 with value: 0.8566270523015425.

Staphylococcus_Aureus | Clindamycin | Optuna:  51%|█████     | 102/200 [2:15:08<1:19:40, 48.78s/it, best=0.857][A
Staphylococcus_Aureus | Clindamycin | Optuna:  51%|█████     | 102/200 [2:15:08<1:19:40, 48.78s/it, best=0.857][A[I 2026-02-28 00:13:25,213] Trial 24 finished with value: 0.8919165194080652 and parameters: {'activation': 'relu', 'solver': 'adam', 'lr': 2.3902159027533945e-05, 'layer1': 320, 'layer2': 232, 'layer3': 192}. Best is trial 14 with value: 0.8971256036318559.

Escherichia_Coli | Ceftriaxone | Optuna:  12%|█▎        | 25/200 [1:03:26<7:30:49, 154.57s/it, best=0.897][A
Escherichia_Coli | Ceftriaxone | Optuna:  12%|█▎        | 25/200 [1:03:26<7:30:49, 154.57s/it, best=0.897][A[I 2026-02-28 00:13:50,722] Trial 110 finished with value: 0.9051277848370283 and parameters: {'activation': 'tanh', 'solver': 'adam', 'lr': 1.3637300289057336e-05, 'layer1': 276, 'layer2': 462, 'layer3': 431}. Best is trial 102 with value: 0.9090522215791805.

Klebsiella_Pneumoniae | Ceftriaxone | Optuna:  56%|█████▌    | 111/200 [3:23:12<4:07:22, 166.77s/it, best=0.909][A
Klebsiella_Pneumoniae | Ceftriaxone | Optuna:  56%|█████▌    | 111/200 [3:23:12<4:07:22, 166.77s/it, best=0.909][A[I 2026-02-28 00:14:04,727] Trial 111 finished with value: 0.881653926022057 and parameters: {'activation': 'identity', 'solver': 'adam', 'lr': 0.001405841171171507, 'layer1': 376, 'layer2': 219, 'layer3': 208}. Best is trial 73 with value: 0.8861579932511299.

Pseudomonas_Aeruginosa | Meropenem | Optuna:  56%|█████▌    | 112/200 [2:09:39<1:40:22, 68.44s/it, best=0.886][A
Pseudomonas_Aeruginosa | Meropenem | Optuna:  56%|█████▌    | 112/200 [2:09:39<1:40:22, 68.44s/it, best=0.886][A[I 2026-02-28 00:14:18,036] Trial 25 finished with value: 0.7110769833256602 and parameters: {'activation': 'relu', 'solver': 'adam', 'lr': 8.308724627482064e-06, 'layer1': 448, 'layer2': 165, 'layer3': 46}. Best is trial 14 with value: 0.8971256036318559.

Escherichia_Coli | Ceftriaxone | Optuna:  13%|█▎        | 26/200 [1:04:19<5:59:42, 124.04s/it, best=0.897][A
Escherichia_Coli | Ceftriaxone | Optuna:  13%|█▎        | 26/200 [1:04:19<5:59:42, 124.04s/it, best=0.897][A[I 2026-02-28 00:14:19,257] Trial 102 finished with value: 0.849825483727949 and parameters: {'activation': 'logistic', 'solver': 'adam', 'lr': 0.000983763624744667, 'layer1': 231, 'layer2': 38, 'layer3': 115}. Best is trial 71 with value: 0.8566270523015425.

Staphylococcus_Aureus | Clindamycin | Optuna:  52%|█████▏    | 103/200 [2:16:20<1:30:29, 55.97s/it, best=0.857][A
Staphylococcus_Aureus | Clindamycin | Optuna:  52%|█████▏    | 103/200 [2:16:20<1:30:29, 55.97s/it, best=0.857][A[I 2026-02-28 00:15:00,463] Trial 26 finished with value: 0.7068100977475185 and parameters: {'activation': 'logistic', 'solver': 'sgd', 'lr': 0.00010537066376518079, 'layer1': 402, 'layer2': 90, 'layer3': 13}. Best is trial 14 with value: 0.8971256036318559.

Escherichia_Coli | Ceftriaxone | Optuna:  14%|█▎        | 27/200 [1:05:01<4:47:02, 99.55s/it, best=0.897] [A
Escherichia_Coli | Ceftriaxone | Optuna:  14%|█▎        | 27/200 [1:05:01<4:47:02, 99.55s/it, best=0.897][A[I 2026-02-28 00:15:28,489] Trial 112 finished with value: 0.8814184927494869 and parameters: {'activation': 'identity', 'solver': 'adam', 'lr': 0.0010459416609109498, 'layer1': 475, 'layer2': 236, 'layer3': 189}. Best is trial 73 with value: 0.8861579932511299.

Pseudomonas_Aeruginosa | Meropenem | Optuna:  56%|█████▋    | 113/200 [2:11:03<1:45:54, 73.04s/it, best=0.886][A
Pseudomonas_Aeruginosa | Meropenem | Optuna:  56%|█████▋    | 113/200 [2:11:03<1:45:54, 73.04s/it, best=0.886][A[I 2026-02-28 00:16:13,445] Trial 103 finished with value: 0.8558570139049 and parameters: {'activation': 'logistic', 'solver': 'adam', 'lr': 0.000499457763460616, 'layer1': 246, 'layer2': 85, 'layer3': 37}. Best is trial 71 with value: 0.8566270523015425.

Staphylococcus_Aureus | Clindamycin | Optuna:  52%|█████▏    | 104/200 [2:18:15<1:57:29, 73.44s/it, best=0.857][A
Staphylococcus_Aureus | Clindamycin | Optuna:  52%|█████▏    | 104/200 [2:18:15<1:57:29, 73.44s/it, best=0.857][A[I 2026-02-28 00:16:51,747] Trial 113 finished with value: 0.8822591662026416 and parameters: {'activation': 'identity', 'solver': 'adam', 'lr': 0.0004978469581635496, 'layer1': 361, 'layer2': 397, 'layer3': 280}. Best is trial 73 with value: 0.8861579932511299.

Pseudomonas_Aeruginosa | Meropenem | Optuna:  57%|█████▋    | 114/200 [2:12:26<1:49:04, 76.10s/it, best=0.886][A
Pseudomonas_Aeruginosa | Meropenem | Optuna:  57%|█████▋    | 114/200 [2:12:26<1:49:04, 76.10s/it, best=0.886][A[I 2026-02-28 00:17:04,129] Trial 104 finished with value: 0.8150890359912804 and parameters: {'activation': 'logistic', 'solver': 'adam', 'lr': 0.0004478869135607141, 'layer1': 141, 'layer2': 84, 'layer3': 44}. Best is trial 71 with value: 0.8566270523015425.

Staphylococcus_Aureus | Clindamycin | Optuna:  52%|█████▎    | 105/200 [2:19:05<1:45:28, 66.61s/it, best=0.857][A
Staphylococcus_Aureus | Clindamycin | Optuna:  52%|█████▎    | 105/200 [2:19:05<1:45:28, 66.61s/it, best=0.857][A[I 2026-02-28 00:17:35,075] Trial 111 finished with value: 0.902200794548474 and parameters: {'activation': 'tanh', 'solver': 'adam', 'lr': 6.3463203914143114e-06, 'layer1': 310, 'layer2': 439, 'layer3': 407}. Best is trial 102 with value: 0.9090522215791805.

Klebsiella_Pneumoniae | Ceftriaxone | Optuna:  56%|█████▌    | 112/200 [3:26:56<4:29:55, 184.04s/it, best=0.909][A
Klebsiella_Pneumoniae | Ceftriaxone | Optuna:  56%|█████▌    | 112/200 [3:26:56<4:29:55, 184.04s/it, best=0.909][A[I 2026-02-28 00:17:45,101] Trial 27 finished with value: 0.8880987038896873 and parameters: {'activation': 'identity', 'solver': 'adam', 'lr': 0.002526204652054459, 'layer1': 453, 'layer2': 247, 'layer3': 286}. Best is trial 14 with value: 0.8971256036318559.

Escherichia_Coli | Ceftriaxone | Optuna:  14%|█▍        | 28/200 [1:07:46<5:41:21, 119.08s/it, best=0.897][A
