Klebsiella_Pneumoniae | LPS | Optuna:  10%|▉         | 19/200 [33:21<4:56:34, 98.31s/it, best=0.924] Klebsiella_Pneumoniae | LPS | Optuna:  10%|▉         | 19/200 [33:21<4:56:34, 98.31s/it, best=0.924][I 2026-02-28 09:21:46,489] Trial 19 finished with value: 0.8702461473038209 and parameters: {'activation': 'logistic', 'solver': 'adam', 'lr': 4.375575814125845e-05, 'layer1': 468, 'layer2': 351, 'layer3': 321}. Best is trial 13 with value: 0.9241592664119492.
Klebsiella_Pneumoniae | LPS | Optuna:  10%|█         | 20/200 [34:02<4:03:45, 81.25s/it, best=0.924]Klebsiella_Pneumoniae | LPS | Optuna:  10%|█         | 20/200 [34:02<4:03:45, 81.25s/it, best=0.924][I 2026-02-28 09:22:23,049] Trial 83 finished with value: 0.8652286499667585 and parameters: {'activation': 'identity', 'solver': 'adam', 'lr': 4.583979989419545e-05, 'layer1': 417, 'layer2': 353, 'layer3': 174}. Best is trial 65 with value: 0.8669592494429758.
Pseudomonas_Aeruginosa | DirectMulti | Optuna:  42%|████▏     | 84/200 [2:26:09<4:02:53, 125.64s/it, best=0.867]Pseudomonas_Aeruginosa | DirectMulti | Optuna:  42%|████▏     | 84/200 [2:26:09<4:02:53, 125.64s/it, best=0.867]/export/usuarios01/egarroyo/MALDI_for_AMR_prediction/venv/lib/python3.13/site-packages/sklearn/model_selection/_split.py:813: UserWarning: The least populated class in y has only 4 members, which is less than n_splits=5.
  warnings.warn(
[I 2026-02-28 09:22:26,472] Trial 38 finished with value: 0.8597028566561683 and parameters: {'activation': 'tanh', 'solver': 'sgd', 'lr': 1.5258862626954865e-05, 'layer1': 298, 'layer2': 154, 'layer3': 439}. Best is trial 32 with value: 0.9150071905057106.

Escherichia_Coli | Piperacillin-Tazobactam | Optuna:  20%|█▉        | 39/200 [1:18:19<9:16:53, 207.54s/it, best=0.915][A
Escherichia_Coli | Piperacillin-Tazobactam | Optuna:  20%|█▉        | 39/200 [1:18:19<9:16:53, 207.54s/it, best=0.915][A[I 2026-02-28 09:23:27,712] Trial 20 finished with value: 0.9242139892835837 and parameters: {'activation': 'identity', 'solver': 'adam', 'lr': 0.0002900164996271944, 'layer1': 396, 'layer2': 119, 'layer3': 380}. Best is trial 20 with value: 0.9242139892835837.
Klebsiella_Pneumoniae | LPS | Optuna:  10%|█         | 21/200 [35:43<4:20:16, 87.25s/it, best=0.924]Klebsiella_Pneumoniae | LPS | Optuna:  10%|█         | 21/200 [35:43<4:20:16, 87.25s/it, best=0.924][I 2026-02-28 09:23:53,495] Trial 39 finished with value: 0.8959112684163661 and parameters: {'activation': 'relu', 'solver': 'adam', 'lr': 1.1283648794423463e-06, 'layer1': 427, 'layer2': 46, 'layer3': 212}. Best is trial 32 with value: 0.9150071905057106.

Escherichia_Coli | Piperacillin-Tazobactam | Optuna:  20%|██        | 40/200 [1:19:46<7:37:01, 171.38s/it, best=0.915][A
Escherichia_Coli | Piperacillin-Tazobactam | Optuna:  20%|██        | 40/200 [1:19:46<7:37:01, 171.38s/it, best=0.915][A[I 2026-02-28 09:23:57,942] Trial 84 finished with value: 0.8640319474675205 and parameters: {'activation': 'identity', 'solver': 'adam', 'lr': 0.00024060181477447712, 'layer1': 404, 'layer2': 347, 'layer3': 144}. Best is trial 65 with value: 0.8669592494429758.
Pseudomonas_Aeruginosa | DirectMulti | Optuna:  42%|████▎     | 85/200 [2:27:44<3:43:07, 116.41s/it, best=0.867]Pseudomonas_Aeruginosa | DirectMulti | Optuna:  42%|████▎     | 85/200 [2:27:44<3:43:07, 116.41s/it, best=0.867]/export/usuarios01/egarroyo/MALDI_for_AMR_prediction/venv/lib/python3.13/site-packages/sklearn/model_selection/_split.py:813: UserWarning: The least populated class in y has only 4 members, which is less than n_splits=5.
  warnings.warn(
[I 2026-02-28 09:24:06,897] Trial 34 finished with value: 0.8807524528089005 and parameters: {'activation': 'identity', 'solver': 'adam', 'lr': 3.5486959508932417e-05, 'layer1': 248, 'layer2': 336, 'layer3': 461}. Best is trial 8 with value: 0.8879562150966016.
Staphylococcus_Aureus | LPS | Optuna:  18%|█▊        | 35/200 [1:17:53<6:48:25, 148.52s/it, best=0.888]Staphylococcus_Aureus | LPS | Optuna:  18%|█▊        | 35/200 [1:17:53<6:48:25, 148.52s/it, best=0.888][I 2026-02-28 09:25:13,849] Trial 21 finished with value: 0.9235147933656236 and parameters: {'activation': 'identity', 'solver': 'adam', 'lr': 0.00020663617091153355, 'layer1': 399, 'layer2': 108, 'layer3': 370}. Best is trial 20 with value: 0.9242139892835837.
Klebsiella_Pneumoniae | LPS | Optuna:  11%|█         | 22/200 [37:29<4:35:38, 92.92s/it, best=0.924]Klebsiella_Pneumoniae | LPS | Optuna:  11%|█         | 22/200 [37:29<4:35:38, 92.92s/it, best=0.924][I 2026-02-28 09:25:55,432] Trial 85 finished with value: 0.8662002377639668 and parameters: {'activation': 'identity', 'solver': 'adam', 'lr': 0.00010529931234274849, 'layer1': 387, 'layer2': 337, 'layer3': 167}. Best is trial 65 with value: 0.8669592494429758.
Pseudomonas_Aeruginosa | DirectMulti | Optuna:  43%|████▎     | 86/200 [2:29:41<3:41:47, 116.74s/it, best=0.867]Pseudomonas_Aeruginosa | DirectMulti | Optuna:  43%|████▎     | 86/200 [2:29:41<3:41:47, 116.74s/it, best=0.867]/export/usuarios01/egarroyo/MALDI_for_AMR_prediction/venv/lib/python3.13/site-packages/sklearn/model_selection/_split.py:813: UserWarning: The least populated class in y has only 4 members, which is less than n_splits=5.
  warnings.warn(
[I 2026-02-28 09:26:20,266] Trial 40 finished with value: 0.9082577633286976 and parameters: {'activation': 'identity', 'solver': 'adam', 'lr': 0.0006593415157874059, 'layer1': 358, 'layer2': 286, 'layer3': 404}. Best is trial 32 with value: 0.9150071905057106.

Escherichia_Coli | Piperacillin-Tazobactam | Optuna:  20%|██        | 41/200 [1:22:12<7:14:35, 164.00s/it, best=0.915][A
Escherichia_Coli | Piperacillin-Tazobactam | Optuna:  20%|██        | 41/200 [1:22:12<7:14:35, 164.00s/it, best=0.915][A[I 2026-02-28 09:26:35,494] Trial 35 finished with value: 0.8823802527431759 and parameters: {'activation': 'logistic', 'solver': 'adam', 'lr': 0.00038408018710641513, 'layer1': 333, 'layer2': 276, 'layer3': 446}. Best is trial 8 with value: 0.8879562150966016.
Staphylococcus_Aureus | LPS | Optuna:  18%|█▊        | 36/200 [1:20:21<6:46:00, 148.54s/it, best=0.888]Staphylococcus_Aureus | LPS | Optuna:  18%|█▊        | 36/200 [1:20:21<6:46:00, 148.54s/it, best=0.888][I 2026-02-28 09:26:53,285] Trial 22 finished with value: 0.9212199242440331 and parameters: {'activation': 'identity', 'solver': 'adam', 'lr': 0.003359959928977612, 'layer1': 432, 'layer2': 99, 'layer3': 444}. Best is trial 20 with value: 0.9242139892835837.
Klebsiella_Pneumoniae | LPS | Optuna:  12%|█▏        | 23/200 [39:09<4:39:52, 94.87s/it, best=0.924]Klebsiella_Pneumoniae | LPS | Optuna:  12%|█▏        | 23/200 [39:09<4:39:52, 94.87s/it, best=0.924][I 2026-02-28 09:27:26,095] Trial 86 finished with value: 0.8585168299754338 and parameters: {'activation': 'tanh', 'solver': 'adam', 'lr': 4.451124422650726e-05, 'layer1': 412, 'layer2': 317, 'layer3': 190}. Best is trial 65 with value: 0.8669592494429758.
Pseudomonas_Aeruginosa | DirectMulti | Optuna:  44%|████▎     | 87/200 [2:31:12<3:25:07, 108.91s/it, best=0.867]Pseudomonas_Aeruginosa | DirectMulti | Optuna:  44%|████▎     | 87/200 [2:31:12<3:25:07, 108.91s/it, best=0.867]/export/usuarios01/egarroyo/MALDI_for_AMR_prediction/venv/lib/python3.13/site-packages/sklearn/model_selection/_split.py:813: UserWarning: The least populated class in y has only 4 members, which is less than n_splits=5.
  warnings.warn(
[I 2026-02-28 09:28:18,292] Trial 41 finished with value: 0.9134083912644207 and parameters: {'activation': 'tanh', 'solver': 'adam', 'lr': 7.32207540063015e-05, 'layer1': 496, 'layer2': 96, 'layer3': 333}. Best is trial 32 with value: 0.9150071905057106.

Escherichia_Coli | Piperacillin-Tazobactam | Optuna:  21%|██        | 42/200 [1:24:10<6:35:32, 150.21s/it, best=0.915][A
Escherichia_Coli | Piperacillin-Tazobactam | Optuna:  21%|██        | 42/200 [1:24:10<6:35:32, 150.21s/it, best=0.915][A[I 2026-02-28 09:28:37,486] Trial 36 finished with value: 0.8828543423107087 and parameters: {'activation': 'relu', 'solver': 'adam', 'lr': 0.00026989952932545157, 'layer1': 273, 'layer2': 450, 'layer3': 406}. Best is trial 8 with value: 0.8879562150966016.
Staphylococcus_Aureus | LPS | Optuna:  18%|█▊        | 37/200 [1:22:23<6:21:54, 140.58s/it, best=0.888]Staphylococcus_Aureus | LPS | Optuna:  18%|█▊        | 37/200 [1:22:23<6:21:54, 140.58s/it, best=0.888][I 2026-02-28 09:29:06,394] Trial 87 finished with value: 0.8648161487546242 and parameters: {'activation': 'identity', 'solver': 'adam', 'lr': 9.132449940203655e-05, 'layer1': 382, 'layer2': 336, 'layer3': 168}. Best is trial 65 with value: 0.8669592494429758.
Pseudomonas_Aeruginosa | DirectMulti | Optuna:  44%|████▍     | 88/200 [2:32:52<3:18:28, 106.33s/it, best=0.867]Pseudomonas_Aeruginosa | DirectMulti | Optuna:  44%|████▍     | 88/200 [2:32:52<3:18:28, 106.33s/it, best=0.867]/export/usuarios01/egarroyo/MALDI_for_AMR_prediction/venv/lib/python3.13/site-packages/sklearn/model_selection/_split.py:813: UserWarning: The least populated class in y has only 4 members, which is less than n_splits=5.
  warnings.warn(
[I 2026-02-28 09:29:34,984] Trial 23 finished with value: 0.9252230330428246 and parameters: {'activation': 'identity', 'solver': 'adam', 'lr': 5.058462634659956e-05, 'layer1': 389, 'layer2': 220, 'layer3': 306}. Best is trial 23 with value: 0.9252230330428246.
Klebsiella_Pneumoniae | LPS | Optuna:  12%|█▏        | 24/200 [41:51<5:37:06, 114.92s/it, best=0.924]Klebsiella_Pneumoniae | LPS | Optuna:  12%|█▏        | 24/200 [41:51<5:37:06, 114.92s/it, best=0.925][I 2026-02-28 09:30:45,511] Trial 88 finished with value: 0.8663447904679564 and parameters: {'activation': 'identity', 'solver': 'adam', 'lr': 0.00011971078490032322, 'layer1': 391, 'layer2': 293, 'layer3': 163}. Best is trial 65 with value: 0.8669592494429758.
Pseudomonas_Aeruginosa | DirectMulti | Optuna:  44%|████▍     | 89/200 [2:34:31<3:12:42, 104.17s/it, best=0.867]Pseudomonas_Aeruginosa | DirectMulti | Optuna:  44%|████▍     | 89/200 [2:34:31<3:12:42, 104.17s/it, best=0.867]/export/usuarios01/egarroyo/MALDI_for_AMR_prediction/venv/lib/python3.13/site-packages/sklearn/model_selection/_split.py:813: UserWarning: The least populated class in y has only 4 members, which is less than n_splits=5.
  warnings.warn(
[I 2026-02-28 09:31:13,522] Trial 42 finished with value: 0.9137001358579357 and parameters: {'activation': 'tanh', 'solver': 'adam', 'lr': 2.443051210330755e-05, 'layer1': 471, 'layer2': 104, 'layer3': 328}. Best is trial 32 with value: 0.9150071905057106.

Escherichia_Coli | Piperacillin-Tazobactam | Optuna:  22%|██▏       | 43/200 [1:27:06<6:52:41, 157.71s/it, best=0.915][A
Escherichia_Coli | Piperacillin-Tazobactam | Optuna:  22%|██▏       | 43/200 [1:27:06<6:52:41, 157.71s/it, best=0.915][A[I 2026-02-28 09:31:15,376] Trial 89 finished with value: 0.8255018342260501 and parameters: {'activation': 'logistic', 'solver': 'adam', 'lr': 9.882698487643489e-05, 'layer1': 390, 'layer2': 267, 'layer3': 163}. Best is trial 65 with value: 0.8669592494429758.
Pseudomonas_Aeruginosa | DirectMulti | Optuna:  45%|████▌     | 90/200 [2:35:01<2:30:06, 81.88s/it, best=0.867] Pseudomonas_Aeruginosa | DirectMulti | Optuna:  45%|████▌     | 90/200 [2:35:01<2:30:06, 81.88s/it, best=0.867]/export/usuarios01/egarroyo/MALDI_for_AMR_prediction/venv/lib/python3.13/site-packages/sklearn/model_selection/_split.py:813: UserWarning: The least populated class in y has only 4 members, which is less than n_splits=5.
  warnings.warn(
[I 2026-02-28 09:31:38,976] Trial 24 finished with value: 0.9224571526820841 and parameters: {'activation': 'identity', 'solver': 'adam', 'lr': 5.585589982897651e-05, 'layer1': 378, 'layer2': 232, 'layer3': 359}. Best is trial 23 with value: 0.9252230330428246.
Klebsiella_Pneumoniae | LPS | Optuna:  12%|█▎        | 25/200 [43:55<5:43:07, 117.64s/it, best=0.925]Klebsiella_Pneumoniae | LPS | Optuna:  12%|█▎        | 25/200 [43:55<5:43:07, 117.64s/it, best=0.925][I 2026-02-28 09:32:03,395] Trial 37 finished with value: 0.8793745752507581 and parameters: {'activation': 'identity', 'solver': 'adam', 'lr': 2.7428237811978283e-05, 'layer1': 254, 'layer2': 360, 'layer3': 139}. Best is trial 8 with value: 0.8879562150966016.
Staphylococcus_Aureus | LPS | Optuna:  19%|█▉        | 38/200 [1:25:49<7:12:28, 160.18s/it, best=0.888]Staphylococcus_Aureus | LPS | Optuna:  19%|█▉        | 38/200 [1:25:49<7:12:28, 160.18s/it, best=0.888][I 2026-02-28 09:32:51,156] Trial 90 finished with value: 0.8642814834008063 and parameters: {'activation': 'identity', 'solver': 'adam', 'lr': 0.00011074779975080965, 'layer1': 344, 'layer2': 296, 'layer3': 218}. Best is trial 65 with value: 0.8669592494429758.
Pseudomonas_Aeruginosa | DirectMulti | Optuna:  46%|████▌     | 91/200 [2:36:37<2:36:19, 86.05s/it, best=0.867]Pseudomonas_Aeruginosa | DirectMulti | Optuna:  46%|████▌     | 91/200 [2:36:37<2:36:19, 86.05s/it, best=0.867]/export/usuarios01/egarroyo/MALDI_for_AMR_prediction/venv/lib/python3.13/site-packages/sklearn/model_selection/_split.py:813: UserWarning: The least populated class in y has only 4 members, which is less than n_splits=5.
  warnings.warn(
[I 2026-02-28 09:32:57,096] Trial 25 finished with value: 0.9238081094418821 and parameters: {'activation': 'identity', 'solver': 'adam', 'lr': 0.00033950499111728684, 'layer1': 307, 'layer2': 130, 'layer3': 383}. Best is trial 23 with value: 0.9252230330428246.
Klebsiella_Pneumoniae | LPS | Optuna:  13%|█▎        | 26/200 [45:13<5:06:46, 105.79s/it, best=0.925]Klebsiella_Pneumoniae | LPS | Optuna:  13%|█▎        | 26/200 [45:13<5:06:46, 105.79s/it, best=0.925][I 2026-02-28 09:33:52,366] Trial 38 finished with value: 0.8029911761233983 and parameters: {'activation': 'identity', 'solver': 'sgd', 'lr': 0.0001168075559822208, 'layer1': 369, 'layer2': 199, 'layer3': 462}. Best is trial 8 with value: 0.8879562150966016.
Staphylococcus_Aureus | LPS | Optuna:  20%|█▉        | 39/200 [1:27:38<6:28:35, 144.81s/it, best=0.888]Staphylococcus_Aureus | LPS | Optuna:  20%|█▉        | 39/200 [1:27:38<6:28:35, 144.81s/it, best=0.888][I 2026-02-28 09:34:44,646] Trial 26 finished with value: 0.8708352793043647 and parameters: {'activation': 'identity', 'solver': 'sgd', 'lr': 4.951429010648817e-05, 'layer1': 197, 'layer2': 185, 'layer3': 459}. Best is trial 23 with value: 0.9252230330428246.
Klebsiella_Pneumoniae | LPS | Optuna:  14%|█▎        | 27/200 [47:00<5:06:32, 106.32s/it, best=0.925]Klebsiella_Pneumoniae | LPS | Optuna:  14%|█▎        | 27/200 [47:00<5:06:32, 106.32s/it, best=0.925][I 2026-02-28 09:34:46,354] Trial 91 finished with value: 0.8642751520745489 and parameters: {'activation': 'identity', 'solver': 'adam', 'lr': 5.965250988486819e-05, 'layer1': 420, 'layer2': 329, 'layer3': 150}. Best is trial 65 with value: 0.8669592494429758.
Pseudomonas_Aeruginosa | DirectMulti | Optuna:  46%|████▌     | 92/200 [2:38:32<2:50:37, 94.79s/it, best=0.867]Pseudomonas_Aeruginosa | DirectMulti | Optuna:  46%|████▌     | 92/200 [2:38:32<2:50:37, 94.79s/it, best=0.867]/export/usuarios01/egarroyo/MALDI_for_AMR_prediction/venv/lib/python3.13/site-packages/sklearn/model_selection/_split.py:813: UserWarning: The least populated class in y has only 4 members, which is less than n_splits=5.
  warnings.warn(
[I 2026-02-28 09:35:16,244] Trial 43 finished with value: 0.9001485955561987 and parameters: {'activation': 'tanh', 'solver': 'adam', 'lr': 3.514719745599928e-06, 'layer1': 416, 'layer2': 118, 'layer3': 275}. Best is trial 32 with value: 0.9150071905057106.

Escherichia_Coli | Piperacillin-Tazobactam | Optuna:  22%|██▏       | 44/200 [1:31:08<7:56:21, 183.22s/it, best=0.915][A
Escherichia_Coli | Piperacillin-Tazobactam | Optuna:  22%|██▏       | 44/200 [1:31:08<7:56:21, 183.22s/it, best=0.915][A[I 2026-02-28 09:36:10,041] Trial 27 finished with value: 0.9206327994729182 and parameters: {'activation': 'tanh', 'solver': 'adam', 'lr': 0.0002038367593598339, 'layer1': 473, 'layer2': 81, 'layer3': 331}. Best is trial 23 with value: 0.9252230330428246.
Klebsiella_Pneumoniae | LPS | Optuna:  14%|█▍        | 28/200 [48:26<4:46:46, 100.04s/it, best=0.925]Klebsiella_Pneumoniae | LPS | Optuna:  14%|█▍        | 28/200 [48:26<4:46:46, 100.04s/it, best=0.925][I 2026-02-28 09:36:44,990] Trial 28 finished with value: 0.8702461473038209 and parameters: {'activation': 'logistic', 'solver': 'adam', 'lr': 8.408751060903704e-05, 'layer1': 395, 'layer2': 147, 'layer3': 270}. Best is trial 23 with value: 0.9252230330428246.
Klebsiella_Pneumoniae | LPS | Optuna:  14%|█▍        | 29/200 [49:01<3:49:27, 80.51s/it, best=0.925] Klebsiella_Pneumoniae | LPS | Optuna:  14%|█▍        | 29/200 [49:01<3:49:27, 80.51s/it, best=0.925][I 2026-02-28 09:37:03,564] Trial 92 finished with value: 0.863982964088898 and parameters: {'activation': 'identity', 'solver': 'adam', 'lr': 3.636188355399906e-05, 'layer1': 373, 'layer2': 357, 'layer3': 115}. Best is trial 65 with value: 0.8669592494429758.
Pseudomonas_Aeruginosa | DirectMulti | Optuna:  46%|████▋     | 93/200 [2:40:49<3:11:44, 107.52s/it, best=0.867]Pseudomonas_Aeruginosa | DirectMulti | Optuna:  46%|████▋     | 93/200 [2:40:49<3:11:44, 107.52s/it, best=0.867]/export/usuarios01/egarroyo/MALDI_for_AMR_prediction/venv/lib/python3.13/site-packages/sklearn/model_selection/_split.py:813: UserWarning: The least populated class in y has only 4 members, which is less than n_splits=5.
  warnings.warn(
[I 2026-02-28 09:37:22,846] Trial 29 finished with value: 0.8702461473038209 and parameters: {'activation': 'logistic', 'solver': 'sgd', 'lr': 2.8912644384523117e-05, 'layer1': 457, 'layer2': 249, 'layer3': 409}. Best is trial 23 with value: 0.9252230330428246.
Klebsiella_Pneumoniae | LPS | Optuna:  15%|█▌        | 30/200 [49:38<3:11:51, 67.71s/it, best=0.925]Klebsiella_Pneumoniae | LPS | Optuna:  15%|█▌        | 30/200 [49:38<3:11:51, 67.71s/it, best=0.925][I 2026-02-28 09:38:13,159] Trial 44 finished with value: 0.9067796178357097 and parameters: {'activation': 'tanh', 'solver': 'adam', 'lr': 1.1493914729812283e-05, 'layer1': 474, 'layer2': 40, 'layer3': 348}. Best is trial 32 with value: 0.9150071905057106.

Escherichia_Coli | Piperacillin-Tazobactam | Optuna:  22%|██▎       | 45/200 [1:34:05<7:48:25, 181.33s/it, best=0.915][A
Escherichia_Coli | Piperacillin-Tazobactam | Optuna:  22%|██▎       | 45/200 [1:34:05<7:48:25, 181.33s/it, best=0.915][A[I 2026-02-28 09:38:38,891] Trial 39 finished with value: 0.8732420001354135 and parameters: {'activation': 'tanh', 'solver': 'adam', 'lr': 9.07330211440507e-06, 'layer1': 132, 'layer2': 312, 'layer3': 212}. Best is trial 8 with value: 0.8879562150966016.
Staphylococcus_Aureus | LPS | Optuna:  20%|██        | 40/200 [1:32:25<8:19:32, 187.33s/it, best=0.888]Staphylococcus_Aureus | LPS | Optuna:  20%|██        | 40/200 [1:32:25<8:19:32, 187.33s/it, best=0.888][I 2026-02-28 09:38:49,644] Trial 30 finished with value: 0.9240381593702895 and parameters: {'activation': 'identity', 'solver': 'adam', 'lr': 0.0006289066817189854, 'layer1': 301, 'layer2': 176, 'layer3': 194}. Best is trial 23 with value: 0.9252230330428246.
Klebsiella_Pneumoniae | LPS | Optuna:  16%|█▌        | 31/200 [51:05<3:26:51, 73.44s/it, best=0.925]Klebsiella_Pneumoniae | LPS | Optuna:  16%|█▌        | 31/200 [51:05<3:26:51, 73.44s/it, best=0.925][I 2026-02-28 09:39:36,057] Trial 93 finished with value: 0.8317774143664932 and parameters: {'activation': 'identity', 'solver': 'adam', 'lr': 3.013779041432989e-06, 'layer1': 458, 'layer2': 309, 'layer3': 189}. Best is trial 65 with value: 0.8669592494429758.
Pseudomonas_Aeruginosa | DirectMulti | Optuna:  47%|████▋     | 94/200 [2:43:22<3:33:47, 121.01s/it, best=0.867]Pseudomonas_Aeruginosa | DirectMulti | Optuna:  47%|████▋     | 94/200 [2:43:22<3:33:47, 121.01s/it, best=0.867]/export/usuarios01/egarroyo/MALDI_for_AMR_prediction/venv/lib/python3.13/site-packages/sklearn/model_selection/_split.py:813: UserWarning: The least populated class in y has only 4 members, which is less than n_splits=5.
  warnings.warn(
[I 2026-02-28 09:40:26,472] Trial 31 finished with value: 0.9235491279450978 and parameters: {'activation': 'identity', 'solver': 'adam', 'lr': 0.000831830683951487, 'layer1': 294, 'layer2': 207, 'layer3': 205}. Best is trial 23 with value: 0.9252230330428246.
Klebsiella_Pneumoniae | LPS | Optuna:  16%|█▌        | 32/200 [52:42<3:45:16, 80.46s/it, best=0.925]Klebsiella_Pneumoniae | LPS | Optuna:  16%|█▌        | 32/200 [52:42<3:45:16, 80.46s/it, best=0.925][I 2026-02-28 09:40:27,708] Trial 40 finished with value: 0.8797509095212048 and parameters: {'activation': 'relu', 'solver': 'adam', 'lr': 0.0009199573552832457, 'layer1': 269, 'layer2': 269, 'layer3': 356}. Best is trial 8 with value: 0.8879562150966016.
Staphylococcus_Aureus | LPS | Optuna:  20%|██        | 41/200 [1:34:14<7:14:00, 163.77s/it, best=0.888]Staphylococcus_Aureus | LPS | Optuna:  20%|██        | 41/200 [1:34:14<7:14:00, 163.77s/it, best=0.888][I 2026-02-28 09:40:28,989] Trial 45 finished with value: 0.9123763988769744 and parameters: {'activation': 'tanh', 'solver': 'adam', 'lr': 2.652221123751714e-05, 'layer1': 232, 'layer2': 136, 'layer3': 329}. Best is trial 32 with value: 0.9150071905057106.

Escherichia_Coli | Piperacillin-Tazobactam | Optuna:  23%|██▎       | 46/200 [1:36:21<7:10:22, 167.68s/it, best=0.915][A
