Klebsiella_Pneumoniae | LPS | Optuna:  42%|████▎     | 85/200 [2:09:59<2:16:08, 71.03s/it, best=0.926]Klebsiella_Pneumoniae | LPS | Optuna:  42%|████▎     | 85/200 [2:09:59<2:16:08, 71.03s/it, best=0.926][I 2026-02-28 10:57:57,644] Trial 80 finished with value: 0.91031666339035 and parameters: {'activation': 'relu', 'solver': 'adam', 'lr': 7.615762184295858e-05, 'layer1': 274, 'layer2': 270, 'layer3': 159}. Best is trial 74 with value: 0.9166002918687234.

Escherichia_Coli | Piperacillin-Tazobactam | Optuna:  40%|████      | 81/200 [2:53:50<4:25:24, 133.82s/it, best=0.917][A
Escherichia_Coli | Piperacillin-Tazobactam | Optuna:  40%|████      | 81/200 [2:53:50<4:25:24, 133.82s/it, best=0.917][A[I 2026-02-28 10:58:01,744] Trial 76 finished with value: 0.8862819719990419 and parameters: {'activation': 'identity', 'solver': 'adam', 'lr': 0.000259990365934177, 'layer1': 341, 'layer2': 435, 'layer3': 330}. Best is trial 8 with value: 0.8879562150966016.
Staphylococcus_Aureus | LPS | Optuna:  38%|███▊      | 77/200 [2:51:48<4:55:18, 144.05s/it, best=0.888]Staphylococcus_Aureus | LPS | Optuna:  38%|███▊      | 77/200 [2:51:48<4:55:18, 144.05s/it, best=0.888][I 2026-02-28 10:58:58,670] Trial 134 finished with value: 0.8628896951457709 and parameters: {'activation': 'identity', 'solver': 'adam', 'lr': 0.00024413760801108558, 'layer1': 446, 'layer2': 334, 'layer3': 330}. Best is trial 102 with value: 0.8672439264969375.
Pseudomonas_Aeruginosa | DirectMulti | Optuna:  68%|██████▊   | 135/200 [4:02:44<1:59:36, 110.41s/it, best=0.867]Pseudomonas_Aeruginosa | DirectMulti | Optuna:  68%|██████▊   | 135/200 [4:02:44<1:59:36, 110.41s/it, best=0.867]/export/usuarios01/egarroyo/MALDI_for_AMR_prediction/venv/lib/python3.13/site-packages/sklearn/model_selection/_split.py:813: UserWarning: The least populated class in y has only 4 members, which is less than n_splits=5.
  warnings.warn(
[I 2026-02-28 10:59:06,377] Trial 85 finished with value: 0.9188047584508572 and parameters: {'activation': 'relu', 'solver': 'adam', 'lr': 0.0001555203887270623, 'layer1': 51, 'layer2': 227, 'layer3': 58}. Best is trial 71 with value: 0.9257111996592865.
Klebsiella_Pneumoniae | LPS | Optuna:  43%|████▎     | 86/200 [2:11:22<2:21:57, 74.72s/it, best=0.926]Klebsiella_Pneumoniae | LPS | Optuna:  43%|████▎     | 86/200 [2:11:22<2:21:57, 74.72s/it, best=0.926][I 2026-02-28 11:00:01,226] Trial 81 finished with value: 0.9141975670620672 and parameters: {'activation': 'relu', 'solver': 'adam', 'lr': 0.0011866073621217383, 'layer1': 304, 'layer2': 228, 'layer3': 58}. Best is trial 74 with value: 0.9166002918687234.

Escherichia_Coli | Piperacillin-Tazobactam | Optuna:  41%|████      | 82/200 [2:55:53<4:17:08, 130.75s/it, best=0.917][A
Escherichia_Coli | Piperacillin-Tazobactam | Optuna:  41%|████      | 82/200 [2:55:53<4:17:08, 130.75s/it, best=0.917][A[I 2026-02-28 11:00:09,943] Trial 86 finished with value: 0.8717925103246055 and parameters: {'activation': 'tanh', 'solver': 'sgd', 'lr': 0.00032517626566156115, 'layer1': 63, 'layer2': 202, 'layer3': 95}. Best is trial 71 with value: 0.9257111996592865.
Klebsiella_Pneumoniae | LPS | Optuna:  44%|████▎     | 87/200 [2:12:26<2:14:24, 71.37s/it, best=0.926]Klebsiella_Pneumoniae | LPS | Optuna:  44%|████▎     | 87/200 [2:12:26<2:14:24, 71.37s/it, best=0.926][I 2026-02-28 11:00:16,045] Trial 77 finished with value: 0.885482637469708 and parameters: {'activation': 'identity', 'solver': 'adam', 'lr': 9.924166700541868e-05, 'layer1': 321, 'layer2': 90, 'layer3': 249}. Best is trial 8 with value: 0.8879562150966016.
Staphylococcus_Aureus | LPS | Optuna:  39%|███▉      | 78/200 [2:54:02<4:46:57, 141.13s/it, best=0.888]Staphylococcus_Aureus | LPS | Optuna:  39%|███▉      | 78/200 [2:54:02<4:46:57, 141.13s/it, best=0.888][I 2026-02-28 11:00:27,046] Trial 135 finished with value: 0.8635836090112953 and parameters: {'activation': 'identity', 'solver': 'adam', 'lr': 0.00013423857389014898, 'layer1': 380, 'layer2': 314, 'layer3': 184}. Best is trial 102 with value: 0.8672439264969375.
Pseudomonas_Aeruginosa | DirectMulti | Optuna:  68%|██████▊   | 136/200 [4:04:13<1:50:43, 103.80s/it, best=0.867]Pseudomonas_Aeruginosa | DirectMulti | Optuna:  68%|██████▊   | 136/200 [4:04:13<1:50:43, 103.80s/it, best=0.867]/export/usuarios01/egarroyo/MALDI_for_AMR_prediction/venv/lib/python3.13/site-packages/sklearn/model_selection/_split.py:813: UserWarning: The least populated class in y has only 4 members, which is less than n_splits=5.
  warnings.warn(
[I 2026-02-28 11:01:17,382] Trial 87 finished with value: 0.9239667454379225 and parameters: {'activation': 'identity', 'solver': 'adam', 'lr': 0.0006533878400730844, 'layer1': 90, 'layer2': 174, 'layer3': 276}. Best is trial 71 with value: 0.9257111996592865.
Klebsiella_Pneumoniae | LPS | Optuna:  44%|████▍     | 88/200 [2:13:33<2:11:01, 70.19s/it, best=0.926]Klebsiella_Pneumoniae | LPS | Optuna:  44%|████▍     | 88/200 [2:13:33<2:11:01, 70.19s/it, best=0.926][I 2026-02-28 11:01:48,399] Trial 78 finished with value: 0.885308863059247 and parameters: {'activation': 'identity', 'solver': 'adam', 'lr': 0.0007029171410404779, 'layer1': 240, 'layer2': 36, 'layer3': 425}. Best is trial 8 with value: 0.8879562150966016.
Staphylococcus_Aureus | LPS | Optuna:  40%|███▉      | 79/200 [2:55:34<4:15:05, 126.49s/it, best=0.888]Staphylococcus_Aureus | LPS | Optuna:  40%|███▉      | 79/200 [2:55:34<4:15:05, 126.49s/it, best=0.888][I 2026-02-28 11:01:50,810] Trial 82 finished with value: 0.9101712096707688 and parameters: {'activation': 'relu', 'solver': 'adam', 'lr': 0.0015637545215788444, 'layer1': 321, 'layer2': 293, 'layer3': 79}. Best is trial 74 with value: 0.9166002918687234.

Escherichia_Coli | Piperacillin-Tazobactam | Optuna:  42%|████▏     | 83/200 [2:57:43<4:02:34, 124.40s/it, best=0.917][A
Escherichia_Coli | Piperacillin-Tazobactam | Optuna:  42%|████▏     | 83/200 [2:57:43<4:02:34, 124.40s/it, best=0.917][A[I 2026-02-28 11:01:58,332] Trial 136 finished with value: 0.8648799728339507 and parameters: {'activation': 'identity', 'solver': 'adam', 'lr': 0.0003447737378337123, 'layer1': 499, 'layer2': 295, 'layer3': 164}. Best is trial 102 with value: 0.8672439264969375.
Pseudomonas_Aeruginosa | DirectMulti | Optuna:  68%|██████▊   | 137/200 [4:05:44<1:45:02, 100.05s/it, best=0.867]Pseudomonas_Aeruginosa | DirectMulti | Optuna:  68%|██████▊   | 137/200 [4:05:44<1:45:02, 100.05s/it, best=0.867]/export/usuarios01/egarroyo/MALDI_for_AMR_prediction/venv/lib/python3.13/site-packages/sklearn/model_selection/_split.py:813: UserWarning: The least populated class in y has only 4 members, which is less than n_splits=5.
  warnings.warn(
[I 2026-02-28 11:02:19,791] Trial 88 finished with value: 0.9223602844512842 and parameters: {'activation': 'identity', 'solver': 'adam', 'lr': 0.00046858586476531826, 'layer1': 80, 'layer2': 382, 'layer3': 70}. Best is trial 71 with value: 0.9257111996592865.
Klebsiella_Pneumoniae | LPS | Optuna:  44%|████▍     | 89/200 [2:14:35<2:05:32, 67.86s/it, best=0.926]Klebsiella_Pneumoniae | LPS | Optuna:  44%|████▍     | 89/200 [2:14:35<2:05:32, 67.86s/it, best=0.926][I 2026-02-28 11:03:53,209] Trial 83 finished with value: 0.9119160296628592 and parameters: {'activation': 'relu', 'solver': 'adam', 'lr': 0.0005311666850719533, 'layer1': 293, 'layer2': 309, 'layer3': 183}. Best is trial 74 with value: 0.9166002918687234.

Escherichia_Coli | Piperacillin-Tazobactam | Optuna:  42%|████▏     | 84/200 [2:59:45<3:59:20, 123.80s/it, best=0.917][A
Escherichia_Coli | Piperacillin-Tazobactam | Optuna:  42%|████▏     | 84/200 [2:59:45<3:59:20, 123.80s/it, best=0.917][A[I 2026-02-28 11:04:08,415] Trial 137 finished with value: 0.8622619493407969 and parameters: {'activation': 'identity', 'solver': 'adam', 'lr': 5.4678740980279976e-05, 'layer1': 423, 'layer2': 344, 'layer3': 99}. Best is trial 102 with value: 0.8672439264969375.
Pseudomonas_Aeruginosa | DirectMulti | Optuna:  69%|██████▉   | 138/200 [4:07:54<1:52:41, 109.06s/it, best=0.867]Pseudomonas_Aeruginosa | DirectMulti | Optuna:  69%|██████▉   | 138/200 [4:07:54<1:52:41, 109.06s/it, best=0.867]/export/usuarios01/egarroyo/MALDI_for_AMR_prediction/venv/lib/python3.13/site-packages/sklearn/model_selection/_split.py:813: UserWarning: The least populated class in y has only 4 members, which is less than n_splits=5.
  warnings.warn(
[I 2026-02-28 11:04:44,451] Trial 138 finished with value: 0.8255018342260501 and parameters: {'activation': 'logistic', 'solver': 'sgd', 'lr': 7.570444581329767e-05, 'layer1': 483, 'layer2': 491, 'layer3': 236}. Best is trial 102 with value: 0.8672439264969375.
Pseudomonas_Aeruginosa | DirectMulti | Optuna:  70%|██████▉   | 139/200 [4:08:30<1:28:36, 87.15s/it, best=0.867] Pseudomonas_Aeruginosa | DirectMulti | Optuna:  70%|██████▉   | 139/200 [4:08:30<1:28:36, 87.15s/it, best=0.867]/export/usuarios01/egarroyo/MALDI_for_AMR_prediction/venv/lib/python3.13/site-packages/sklearn/model_selection/_split.py:813: UserWarning: The least populated class in y has only 4 members, which is less than n_splits=5.
  warnings.warn(
[I 2026-02-28 11:04:48,746] Trial 89 finished with value: 0.9255968328860934 and parameters: {'activation': 'identity', 'solver': 'adam', 'lr': 8.683537868723045e-05, 'layer1': 411, 'layer2': 415, 'layer3': 42}. Best is trial 71 with value: 0.9257111996592865.
Klebsiella_Pneumoniae | LPS | Optuna:  45%|████▌     | 90/200 [2:17:04<2:49:00, 92.19s/it, best=0.926]Klebsiella_Pneumoniae | LPS | Optuna:  45%|████▌     | 90/200 [2:17:04<2:49:00, 92.19s/it, best=0.926][I 2026-02-28 11:05:25,079] Trial 90 finished with value: 0.8702461473038209 and parameters: {'activation': 'logistic', 'solver': 'adam', 'lr': 3.876181897873741e-05, 'layer1': 410, 'layer2': 417, 'layer3': 41}. Best is trial 71 with value: 0.9257111996592865.
Klebsiella_Pneumoniae | LPS | Optuna:  46%|████▌     | 91/200 [2:17:41<2:17:01, 75.43s/it, best=0.926]Klebsiella_Pneumoniae | LPS | Optuna:  46%|████▌     | 91/200 [2:17:41<2:17:01, 75.43s/it, best=0.926][I 2026-02-28 11:05:46,792] Trial 84 finished with value: 0.9147360762877776 and parameters: {'activation': 'relu', 'solver': 'adam', 'lr': 0.00017047279209437844, 'layer1': 242, 'layer2': 238, 'layer3': 50}. Best is trial 74 with value: 0.9166002918687234.

Escherichia_Coli | Piperacillin-Tazobactam | Optuna:  42%|████▎     | 85/200 [3:01:39<3:51:24, 120.73s/it, best=0.917][A
Escherichia_Coli | Piperacillin-Tazobactam | Optuna:  42%|████▎     | 85/200 [3:01:39<3:51:24, 120.73s/it, best=0.917][A[I 2026-02-28 11:06:28,453] Trial 79 finished with value: 0.7784643661685001 and parameters: {'activation': 'tanh', 'solver': 'sgd', 'lr': 6.946144565139517e-05, 'layer1': 451, 'layer2': 293, 'layer3': 208}. Best is trial 8 with value: 0.8879562150966016.
Staphylococcus_Aureus | LPS | Optuna:  40%|████      | 80/200 [3:00:14<5:45:07, 172.56s/it, best=0.888]Staphylococcus_Aureus | LPS | Optuna:  40%|████      | 80/200 [3:00:14<5:45:07, 172.56s/it, best=0.888][I 2026-02-28 11:06:51,954] Trial 139 finished with value: 0.8645565408356457 and parameters: {'activation': 'identity', 'solver': 'adam', 'lr': 9.622976497030599e-05, 'layer1': 466, 'layer2': 459, 'layer3': 490}. Best is trial 102 with value: 0.8672439264969375.
Pseudomonas_Aeruginosa | DirectMulti | Optuna:  70%|███████   | 140/200 [4:10:38<1:39:15, 99.26s/it, best=0.867]Pseudomonas_Aeruginosa | DirectMulti | Optuna:  70%|███████   | 140/200 [4:10:38<1:39:15, 99.26s/it, best=0.867]/export/usuarios01/egarroyo/MALDI_for_AMR_prediction/venv/lib/python3.13/site-packages/sklearn/model_selection/_split.py:813: UserWarning: The least populated class in y has only 4 members, which is less than n_splits=5.
  warnings.warn(
[I 2026-02-28 11:07:14,113] Trial 91 finished with value: 0.9237561704432183 and parameters: {'activation': 'identity', 'solver': 'adam', 'lr': 0.00016853700172225438, 'layer1': 449, 'layer2': 458, 'layer3': 30}. Best is trial 71 with value: 0.9257111996592865.
Klebsiella_Pneumoniae | LPS | Optuna:  46%|████▌     | 92/200 [2:19:30<2:33:55, 85.51s/it, best=0.926]Klebsiella_Pneumoniae | LPS | Optuna:  46%|████▌     | 92/200 [2:19:30<2:33:55, 85.51s/it, best=0.926][I 2026-02-28 11:08:26,863] Trial 85 finished with value: 0.916077548948711 and parameters: {'activation': 'relu', 'solver': 'adam', 'lr': 0.0003956198867145451, 'layer1': 334, 'layer2': 206, 'layer3': 138}. Best is trial 74 with value: 0.9166002918687234.

Escherichia_Coli | Piperacillin-Tazobactam | Optuna:  43%|████▎     | 86/200 [3:04:19<4:11:48, 132.54s/it, best=0.917][A
Escherichia_Coli | Piperacillin-Tazobactam | Optuna:  43%|████▎     | 86/200 [3:04:19<4:11:48, 132.54s/it, best=0.917][A[I 2026-02-28 11:08:27,325] Trial 80 finished with value: 0.8805381154074936 and parameters: {'activation': 'relu', 'solver': 'adam', 'lr': 0.0003972828719492231, 'layer1': 364, 'layer2': 329, 'layer3': 270}. Best is trial 8 with value: 0.8879562150966016.
Staphylococcus_Aureus | LPS | Optuna:  40%|████      | 81/200 [3:02:13<5:10:18, 156.46s/it, best=0.888]Staphylococcus_Aureus | LPS | Optuna:  40%|████      | 81/200 [3:02:13<5:10:18, 156.46s/it, best=0.888][I 2026-02-28 11:08:58,144] Trial 140 finished with value: 0.8642989893829514 and parameters: {'activation': 'identity', 'solver': 'adam', 'lr': 0.00030018882923094444, 'layer1': 455, 'layer2': 381, 'layer3': 205}. Best is trial 102 with value: 0.8672439264969375.
Pseudomonas_Aeruginosa | DirectMulti | Optuna:  70%|███████   | 141/200 [4:12:44<1:45:32, 107.34s/it, best=0.867]Pseudomonas_Aeruginosa | DirectMulti | Optuna:  70%|███████   | 141/200 [4:12:44<1:45:32, 107.34s/it, best=0.867]/export/usuarios01/egarroyo/MALDI_for_AMR_prediction/venv/lib/python3.13/site-packages/sklearn/model_selection/_split.py:813: UserWarning: The least populated class in y has only 4 members, which is less than n_splits=5.
  warnings.warn(
[I 2026-02-28 11:08:59,165] Trial 92 finished with value: 0.917395674307824 and parameters: {'activation': 'identity', 'solver': 'adam', 'lr': 5.107645065947276e-05, 'layer1': 388, 'layer2': 400, 'layer3': 49}. Best is trial 71 with value: 0.9257111996592865.
Klebsiella_Pneumoniae | LPS | Optuna:  46%|████▋     | 93/200 [2:21:15<2:42:56, 91.37s/it, best=0.926]Klebsiella_Pneumoniae | LPS | Optuna:  46%|████▋     | 93/200 [2:21:15<2:42:56, 91.37s/it, best=0.926][I 2026-02-28 11:10:09,063] Trial 86 finished with value: 0.9130811996009864 and parameters: {'activation': 'relu', 'solver': 'adam', 'lr': 0.0003804574007301915, 'layer1': 334, 'layer2': 213, 'layer3': 129}. Best is trial 74 with value: 0.9166002918687234.

Escherichia_Coli | Piperacillin-Tazobactam | Optuna:  44%|████▎     | 87/200 [3:06:01<3:52:28, 123.43s/it, best=0.917][A
Escherichia_Coli | Piperacillin-Tazobactam | Optuna:  44%|████▎     | 87/200 [3:06:01<3:52:28, 123.43s/it, best=0.917][A[I 2026-02-28 11:10:23,757] Trial 81 finished with value: 0.8829640418432246 and parameters: {'activation': 'identity', 'solver': 'adam', 'lr': 0.00024752190151986186, 'layer1': 337, 'layer2': 442, 'layer3': 323}. Best is trial 8 with value: 0.8879562150966016.
Staphylococcus_Aureus | LPS | Optuna:  41%|████      | 82/200 [3:04:10<4:44:04, 144.45s/it, best=0.888]Staphylococcus_Aureus | LPS | Optuna:  41%|████      | 82/200 [3:04:10<4:44:04, 144.45s/it, best=0.888][I 2026-02-28 11:10:50,773] Trial 87 finished with value: 0.8958344038173316 and parameters: {'activation': 'logistic', 'solver': 'sgd', 'lr': 0.00021620276955825054, 'layer1': 394, 'layer2': 329, 'layer3': 113}. Best is trial 74 with value: 0.9166002918687234.

Escherichia_Coli | Piperacillin-Tazobactam | Optuna:  44%|████▍     | 88/200 [3:06:43<3:04:38, 98.92s/it, best=0.917] [A
Escherichia_Coli | Piperacillin-Tazobactam | Optuna:  44%|████▍     | 88/200 [3:06:43<3:04:38, 98.92s/it, best=0.917][A[I 2026-02-28 11:10:53,177] Trial 93 finished with value: 0.9238494366106647 and parameters: {'activation': 'identity', 'solver': 'adam', 'lr': 8.439503743925253e-05, 'layer1': 418, 'layer2': 372, 'layer3': 311}. Best is trial 71 with value: 0.9257111996592865.
Klebsiella_Pneumoniae | LPS | Optuna:  47%|████▋     | 94/200 [2:23:09<2:53:25, 98.17s/it, best=0.926]Klebsiella_Pneumoniae | LPS | Optuna:  47%|████▋     | 94/200 [2:23:09<2:53:25, 98.17s/it, best=0.926][I 2026-02-28 11:11:00,506] Trial 141 finished with value: 0.863749685680639 and parameters: {'activation': 'identity', 'solver': 'adam', 'lr': 4.6397269911373745e-05, 'layer1': 413, 'layer2': 354, 'layer3': 177}. Best is trial 102 with value: 0.8672439264969375.
Pseudomonas_Aeruginosa | DirectMulti | Optuna:  71%|███████   | 142/200 [4:14:46<1:48:06, 111.84s/it, best=0.867]Pseudomonas_Aeruginosa | DirectMulti | Optuna:  71%|███████   | 142/200 [4:14:46<1:48:06, 111.84s/it, best=0.867]/export/usuarios01/egarroyo/MALDI_for_AMR_prediction/venv/lib/python3.13/site-packages/sklearn/model_selection/_split.py:813: UserWarning: The least populated class in y has only 4 members, which is less than n_splits=5.
  warnings.warn(
[I 2026-02-28 11:12:40,158] Trial 94 finished with value: 0.9238513768070561 and parameters: {'activation': 'identity', 'solver': 'adam', 'lr': 0.00013060862871198617, 'layer1': 29, 'layer2': 450, 'layer3': 207}. Best is trial 71 with value: 0.9257111996592865.
Klebsiella_Pneumoniae | LPS | Optuna:  48%|████▊     | 95/200 [2:24:56<2:56:25, 100.81s/it, best=0.926]Klebsiella_Pneumoniae | LPS | Optuna:  48%|████▊     | 95/200 [2:24:56<2:56:25, 100.81s/it, best=0.926][I 2026-02-28 11:12:58,987] Trial 82 finished with value: 0.8861202072964005 and parameters: {'activation': 'identity', 'solver': 'adam', 'lr': 0.00016937508977200047, 'layer1': 292, 'layer2': 419, 'layer3': 292}. Best is trial 8 with value: 0.8879562150966016.
Staphylococcus_Aureus | LPS | Optuna:  42%|████▏     | 83/200 [3:06:45<4:47:58, 147.68s/it, best=0.888]Staphylococcus_Aureus | LPS | Optuna:  42%|████▏     | 83/200 [3:06:45<4:47:58, 147.68s/it, best=0.888][I 2026-02-28 11:13:11,961] Trial 88 finished with value: 0.914345455973228 and parameters: {'activation': 'relu', 'solver': 'adam', 'lr': 0.0002721628353796118, 'layer1': 367, 'layer2': 348, 'layer3': 138}. Best is trial 74 with value: 0.9166002918687234.

Escherichia_Coli | Piperacillin-Tazobactam | Optuna:  44%|████▍     | 89/200 [3:09:04<3:26:27, 111.60s/it, best=0.917][A
Escherichia_Coli | Piperacillin-Tazobactam | Optuna:  44%|████▍     | 89/200 [3:09:04<3:26:27, 111.60s/it, best=0.917][A[I 2026-02-28 11:13:27,664] Trial 142 finished with value: 0.865574879951765 and parameters: {'activation': 'identity', 'solver': 'adam', 'lr': 3.94186098058014e-05, 'layer1': 431, 'layer2': 363, 'layer3': 191}. Best is trial 102 with value: 0.8672439264969375.
Pseudomonas_Aeruginosa | DirectMulti | Optuna:  72%|███████▏  | 143/200 [4:17:13<1:56:18, 122.44s/it, best=0.867]Pseudomonas_Aeruginosa | DirectMulti | Optuna:  72%|███████▏  | 143/200 [4:17:13<1:56:18, 122.44s/it, best=0.867]/export/usuarios01/egarroyo/MALDI_for_AMR_prediction/venv/lib/python3.13/site-packages/sklearn/model_selection/_split.py:813: UserWarning: The least populated class in y has only 4 members, which is less than n_splits=5.
  warnings.warn(
[I 2026-02-28 11:14:09,589] Trial 95 finished with value: 0.9230909746807141 and parameters: {'activation': 'identity', 'solver': 'adam', 'lr': 0.00021928262659655758, 'layer1': 339, 'layer2': 279, 'layer3': 67}. Best is trial 71 with value: 0.9257111996592865.
Klebsiella_Pneumoniae | LPS | Optuna:  48%|████▊     | 96/200 [2:26:25<2:48:49, 97.40s/it, best=0.926] Klebsiella_Pneumoniae | LPS | Optuna:  48%|████▊     | 96/200 [2:26:25<2:48:49, 97.40s/it, best=0.926][I 2026-02-28 11:15:25,819] Trial 89 finished with value: 0.9104579390534951 and parameters: {'activation': 'identity', 'solver': 'adam', 'lr': 0.00015274274768220316, 'layer1': 316, 'layer2': 206, 'layer3': 160}. Best is trial 74 with value: 0.9166002918687234.

Escherichia_Coli | Piperacillin-Tazobactam | Optuna:  45%|████▌     | 90/200 [3:11:18<3:36:50, 118.28s/it, best=0.917][A
Escherichia_Coli | Piperacillin-Tazobactam | Optuna:  45%|████▌     | 90/200 [3:11:18<3:36:50, 118.28s/it, best=0.917][A[I 2026-02-28 11:15:27,335] Trial 83 finished with value: 0.884974453454156 and parameters: {'activation': 'identity', 'solver': 'adam', 'lr': 0.00031578944491252476, 'layer1': 304, 'layer2': 471, 'layer3': 371}. Best is trial 8 with value: 0.8879562150966016.
Staphylococcus_Aureus | LPS | Optuna:  42%|████▏     | 84/200 [3:09:13<4:45:54, 147.88s/it, best=0.888]Staphylococcus_Aureus | LPS | Optuna:  42%|████▏     | 84/200 [3:09:13<4:45:54, 147.88s/it, best=0.888][I 2026-02-28 11:15:28,199] Trial 143 finished with value: 0.8626566608890018 and parameters: {'activation': 'identity', 'solver': 'adam', 'lr': 3.85019830487377e-05, 'layer1': 432, 'layer2': 363, 'layer3': 153}. Best is trial 102 with value: 0.8672439264969375.
Pseudomonas_Aeruginosa | DirectMulti | Optuna:  72%|███████▏  | 144/200 [4:19:14<1:53:44, 121.87s/it, best=0.867]Pseudomonas_Aeruginosa | DirectMulti | Optuna:  72%|███████▏  | 144/200 [4:19:14<1:53:44, 121.87s/it, best=0.867]/export/usuarios01/egarroyo/MALDI_for_AMR_prediction/venv/lib/python3.13/site-packages/sklearn/model_selection/_split.py:813: UserWarning: The least populated class in y has only 4 members, which is less than n_splits=5.
  warnings.warn(
[I 2026-02-28 11:16:10,295] Trial 96 finished with value: 0.9129786158711817 and parameters: {'activation': 'identity', 'solver': 'adam', 'lr': 2.1108350003598293e-05, 'layer1': 370, 'layer2': 429, 'layer3': 232}. Best is trial 71 with value: 0.9257111996592865.
