Klebsiella_Pneumoniae | Ciprofloxacin | Optuna:  27%|██▋       | 54/200 [1:27:58<3:39:51, 90.35s/it, best=0.829][A[I 2026-02-27 16:16:05,090] Trial 39 finished with value: 0.896507333661992 and parameters: {'activation': 'tanh', 'solver': 'adam', 'lr': 9.07330211440507e-06, 'layer1': 282, 'layer2': 377, 'layer3': 500}. Best is trial 12 with value: 0.9088083331363105.

Staphylococcus_Aureus | Oxacillin | Optuna:  20%|██        | 40/200 [1:28:34<6:32:29, 147.18s/it, best=0.909][A
Staphylococcus_Aureus | Oxacillin | Optuna:  20%|██        | 40/200 [1:28:34<6:32:29, 147.18s/it, best=0.909][A[I 2026-02-27 16:16:32,980] Trial 89 finished with value: 0.8709716910565188 and parameters: {'activation': 'logistic', 'solver': 'adam', 'lr': 0.0005608665070431903, 'layer1': 376, 'layer2': 397, 'layer3': 360}. Best is trial 46 with value: 0.8754031846375991.

Pseudomonas_Aeruginosa | Ciprofloxacin | Optuna:  45%|████▌     | 90/200 [1:29:02<1:58:05, 64.42s/it, best=0.875][A
Pseudomonas_Aeruginosa | Ciprofloxacin | Optuna:  45%|████▌     | 90/200 [1:29:02<1:58:05, 64.42s/it, best=0.875][A[I 2026-02-27 16:17:32,544] Trial 54 finished with value: 0.8218254135074554 and parameters: {'activation': 'identity', 'solver': 'adam', 'lr': 0.0008036978337567876, 'layer1': 386, 'layer2': 374, 'layer3': 44}. Best is trial 42 with value: 0.8285034263433643.

Klebsiella_Pneumoniae | Ciprofloxacin | Optuna:  28%|██▊       | 55/200 [1:30:02<4:02:44, 100.44s/it, best=0.829][A
Klebsiella_Pneumoniae | Ciprofloxacin | Optuna:  28%|██▊       | 55/200 [1:30:02<4:02:44, 100.44s/it, best=0.829][A[I 2026-02-27 16:17:33,017] Trial 90 finished with value: 0.8678407220945109 and parameters: {'activation': 'tanh', 'solver': 'adam', 'lr': 0.00023121079949165032, 'layer1': 355, 'layer2': 371, 'layer3': 331}. Best is trial 46 with value: 0.8754031846375991.

Pseudomonas_Aeruginosa | Ciprofloxacin | Optuna:  46%|████▌     | 91/200 [1:30:02<1:54:38, 63.10s/it, best=0.875][A
Pseudomonas_Aeruginosa | Ciprofloxacin | Optuna:  46%|████▌     | 91/200 [1:30:02<1:54:38, 63.10s/it, best=0.875][A[I 2026-02-27 16:18:21,293] Trial 28 finished with value: 0.8029827877298757 and parameters: {'activation': 'logistic', 'solver': 'adam', 'lr': 7.113886925083865e-05, 'layer1': 395, 'layer2': 238, 'layer3': 388}. Best is trial 22 with value: 0.8056198592051895.

Escherichia_Coli | Ciprofloxacin | Optuna:  14%|█▍        | 29/200 [1:30:50<8:34:26, 180.51s/it, best=0.806][A
Escherichia_Coli | Ciprofloxacin | Optuna:  14%|█▍        | 29/200 [1:30:50<8:34:26, 180.51s/it, best=0.806][A[I 2026-02-27 16:18:35,097] Trial 40 finished with value: 0.9057548368680282 and parameters: {'activation': 'relu', 'solver': 'adam', 'lr': 0.0003187416798338789, 'layer1': 339, 'layer2': 445, 'layer3': 221}. Best is trial 12 with value: 0.9088083331363105.

Staphylococcus_Aureus | Oxacillin | Optuna:  20%|██        | 41/200 [1:31:04<6:32:16, 148.03s/it, best=0.909][A
Staphylococcus_Aureus | Oxacillin | Optuna:  20%|██        | 41/200 [1:31:04<6:32:16, 148.03s/it, best=0.909][A[I 2026-02-27 16:18:58,350] Trial 55 finished with value: 0.821499155357241 and parameters: {'activation': 'identity', 'solver': 'adam', 'lr': 0.0014369798085596842, 'layer1': 348, 'layer2': 429, 'layer3': 177}. Best is trial 42 with value: 0.8285034263433643.

Klebsiella_Pneumoniae | Ciprofloxacin | Optuna:  28%|██▊       | 56/200 [1:31:27<3:50:31, 96.05s/it, best=0.829] [A
Klebsiella_Pneumoniae | Ciprofloxacin | Optuna:  28%|██▊       | 56/200 [1:31:27<3:50:31, 96.05s/it, best=0.829][A[I 2026-02-27 16:18:59,671] Trial 91 finished with value: 0.8738712910041668 and parameters: {'activation': 'logistic', 'solver': 'adam', 'lr': 0.0003337489166592474, 'layer1': 340, 'layer2': 211, 'layer3': 391}. Best is trial 46 with value: 0.8754031846375991.

Pseudomonas_Aeruginosa | Ciprofloxacin | Optuna:  46%|████▌     | 92/200 [1:31:29<2:06:18, 70.17s/it, best=0.875][A
Pseudomonas_Aeruginosa | Ciprofloxacin | Optuna:  46%|████▌     | 92/200 [1:31:29<2:06:18, 70.17s/it, best=0.875][A[I 2026-02-27 16:19:06,460] Trial 29 finished with value: 0.3139643961147455 and parameters: {'activation': 'logistic', 'solver': 'sgd', 'lr': 3.931356287024421e-06, 'layer1': 427, 'layer2': 314, 'layer3': 338}. Best is trial 22 with value: 0.8056198592051895.

Escherichia_Coli | Ciprofloxacin | Optuna:  15%|█▌        | 30/200 [1:31:35<6:36:23, 139.91s/it, best=0.806][A
Escherichia_Coli | Ciprofloxacin | Optuna:  15%|█▌        | 30/200 [1:31:35<6:36:23, 139.91s/it, best=0.806][A[I 2026-02-27 16:20:25,726] Trial 92 finished with value: 0.8751650371434 and parameters: {'activation': 'logistic', 'solver': 'adam', 'lr': 0.0002623055587483567, 'layer1': 313, 'layer2': 161, 'layer3': 424}. Best is trial 46 with value: 0.8754031846375991.

Pseudomonas_Aeruginosa | Ciprofloxacin | Optuna:  46%|████▋     | 93/200 [1:32:55<2:13:37, 74.93s/it, best=0.875][A
Pseudomonas_Aeruginosa | Ciprofloxacin | Optuna:  46%|████▋     | 93/200 [1:32:55<2:13:37, 74.93s/it, best=0.875][A[I 2026-02-27 16:20:54,122] Trial 41 finished with value: 0.9068118941955646 and parameters: {'activation': 'identity', 'solver': 'adam', 'lr': 0.0026490128693232333, 'layer1': 318, 'layer2': 418, 'layer3': 241}. Best is trial 12 with value: 0.9088083331363105.

Staphylococcus_Aureus | Oxacillin | Optuna:  21%|██        | 42/200 [1:33:23<6:22:41, 145.33s/it, best=0.909][A
Staphylococcus_Aureus | Oxacillin | Optuna:  21%|██        | 42/200 [1:33:23<6:22:41, 145.33s/it, best=0.909][A[I 2026-02-27 16:21:01,763] Trial 93 finished with value: 0.8175861218829372 and parameters: {'activation': 'logistic', 'solver': 'adam', 'lr': 3.013779041432989e-06, 'layer1': 364, 'layer2': 247, 'layer3': 423}. Best is trial 46 with value: 0.8754031846375991.

Pseudomonas_Aeruginosa | Ciprofloxacin | Optuna:  47%|████▋     | 94/200 [1:33:31<1:51:46, 63.27s/it, best=0.875][A
Pseudomonas_Aeruginosa | Ciprofloxacin | Optuna:  47%|████▋     | 94/200 [1:33:31<1:51:46, 63.27s/it, best=0.875][A[I 2026-02-27 16:21:04,061] Trial 56 finished with value: 0.8236599835008347 and parameters: {'activation': 'identity', 'solver': 'adam', 'lr': 0.0005642399527434008, 'layer1': 479, 'layer2': 338, 'layer3': 78}. Best is trial 42 with value: 0.8285034263433643.

Klebsiella_Pneumoniae | Ciprofloxacin | Optuna:  28%|██▊       | 57/200 [1:33:33<4:10:07, 104.95s/it, best=0.829][A
Klebsiella_Pneumoniae | Ciprofloxacin | Optuna:  28%|██▊       | 57/200 [1:33:33<4:10:07, 104.95s/it, best=0.829][A[I 2026-02-27 16:21:27,266] Trial 94 finished with value: 0.8159756916186209 and parameters: {'activation': 'logistic', 'solver': 'adam', 'lr': 9.710365612971929e-05, 'layer1': 305, 'layer2': 146, 'layer3': 383}. Best is trial 46 with value: 0.8754031846375991.

Pseudomonas_Aeruginosa | Ciprofloxacin | Optuna:  48%|████▊     | 95/200 [1:33:56<1:30:53, 51.94s/it, best=0.875][A
Pseudomonas_Aeruginosa | Ciprofloxacin | Optuna:  48%|████▊     | 95/200 [1:33:56<1:30:53, 51.94s/it, best=0.875][A[I 2026-02-27 16:22:36,543] Trial 95 finished with value: 0.8723151986875346 and parameters: {'activation': 'logistic', 'solver': 'adam', 'lr': 0.00043840033971314317, 'layer1': 401, 'layer2': 186, 'layer3': 400}. Best is trial 46 with value: 0.8754031846375991.

Pseudomonas_Aeruginosa | Ciprofloxacin | Optuna:  48%|████▊     | 96/200 [1:35:06<1:39:02, 57.14s/it, best=0.875][A
Pseudomonas_Aeruginosa | Ciprofloxacin | Optuna:  48%|████▊     | 96/200 [1:35:06<1:39:02, 57.14s/it, best=0.875][A[I 2026-02-27 16:22:44,490] Trial 57 finished with value: 0.8096422044698179 and parameters: {'activation': 'identity', 'solver': 'adam', 'lr': 0.005444975341560854, 'layer1': 462, 'layer2': 446, 'layer3': 150}. Best is trial 42 with value: 0.8285034263433643.

Klebsiella_Pneumoniae | Ciprofloxacin | Optuna:  29%|██▉       | 58/200 [1:35:14<4:05:10, 103.59s/it, best=0.829][A
Klebsiella_Pneumoniae | Ciprofloxacin | Optuna:  29%|██▉       | 58/200 [1:35:14<4:05:10, 103.59s/it, best=0.829][A[I 2026-02-27 16:22:59,435] Trial 42 finished with value: 0.9002645614931 and parameters: {'activation': 'identity', 'solver': 'adam', 'lr': 0.009843155468624213, 'layer1': 329, 'layer2': 411, 'layer3': 256}. Best is trial 12 with value: 0.9088083331363105.

Staphylococcus_Aureus | Oxacillin | Optuna:  22%|██▏       | 43/200 [1:35:29<6:04:33, 139.32s/it, best=0.909][A
Staphylococcus_Aureus | Oxacillin | Optuna:  22%|██▏       | 43/200 [1:35:29<6:04:33, 139.32s/it, best=0.909][A[I 2026-02-27 16:23:29,403] Trial 58 finished with value: 0.6840590694180204 and parameters: {'activation': 'identity', 'solver': 'sgd', 'lr': 0.000290301125935307, 'layer1': 420, 'layer2': 251, 'layer3': 15}. Best is trial 42 with value: 0.8285034263433643.

Klebsiella_Pneumoniae | Ciprofloxacin | Optuna:  30%|██▉       | 59/200 [1:35:58<3:22:04, 85.99s/it, best=0.829] [A
Klebsiella_Pneumoniae | Ciprofloxacin | Optuna:  30%|██▉       | 59/200 [1:35:58<3:22:04, 85.99s/it, best=0.829][A[I 2026-02-27 16:23:32,962] Trial 30 finished with value: 0.7991213362714986 and parameters: {'activation': 'tanh', 'solver': 'adam', 'lr': 9.76163376478893e-06, 'layer1': 454, 'layer2': 465, 'layer3': 277}. Best is trial 22 with value: 0.8056198592051895.

Escherichia_Coli | Ciprofloxacin | Optuna:  16%|█▌        | 31/200 [1:36:02<8:21:02, 177.88s/it, best=0.806][A
Escherichia_Coli | Ciprofloxacin | Optuna:  16%|█▌        | 31/200 [1:36:02<8:21:02, 177.88s/it, best=0.806][A[I 2026-02-27 16:23:58,091] Trial 96 finished with value: 0.8664904964401223 and parameters: {'activation': 'logistic', 'solver': 'adam', 'lr': 0.00016148616680268754, 'layer1': 321, 'layer2': 200, 'layer3': 428}. Best is trial 46 with value: 0.8754031846375991.

Pseudomonas_Aeruginosa | Ciprofloxacin | Optuna:  48%|████▊     | 97/200 [1:36:27<1:50:39, 64.46s/it, best=0.875][A
Pseudomonas_Aeruginosa | Ciprofloxacin | Optuna:  48%|████▊     | 97/200 [1:36:27<1:50:39, 64.46s/it, best=0.875][A[I 2026-02-27 16:25:01,532] Trial 97 finished with value: 0.8617624216893146 and parameters: {'activation': 'identity', 'solver': 'adam', 'lr': 0.00023871194962057625, 'layer1': 332, 'layer2': 103, 'layer3': 448}. Best is trial 46 with value: 0.8754031846375991.

Pseudomonas_Aeruginosa | Ciprofloxacin | Optuna:  49%|████▉     | 98/200 [1:37:31<1:49:03, 64.16s/it, best=0.875][A
Pseudomonas_Aeruginosa | Ciprofloxacin | Optuna:  49%|████▉     | 98/200 [1:37:31<1:49:03, 64.16s/it, best=0.875][A[I 2026-02-27 16:25:32,464] Trial 59 finished with value: 0.7917066782002806 and parameters: {'activation': 'logistic', 'solver': 'adam', 'lr': 0.0026901288086219393, 'layer1': 439, 'layer2': 191, 'layer3': 41}. Best is trial 42 with value: 0.8285034263433643.

Klebsiella_Pneumoniae | Ciprofloxacin | Optuna:  30%|███       | 60/200 [1:38:02<3:46:35, 97.11s/it, best=0.829][A
Klebsiella_Pneumoniae | Ciprofloxacin | Optuna:  30%|███       | 60/200 [1:38:02<3:46:35, 97.11s/it, best=0.829][A[I 2026-02-27 16:26:22,331] Trial 98 finished with value: 0.8615244422631625 and parameters: {'activation': 'relu', 'solver': 'adam', 'lr': 4.876397678995234e-05, 'layer1': 295, 'layer2': 129, 'layer3': 410}. Best is trial 46 with value: 0.8754031846375991.

Pseudomonas_Aeruginosa | Ciprofloxacin | Optuna:  50%|████▉     | 99/200 [1:38:52<1:56:23, 69.15s/it, best=0.875][A
Pseudomonas_Aeruginosa | Ciprofloxacin | Optuna:  50%|████▉     | 99/200 [1:38:52<1:56:23, 69.15s/it, best=0.875][A[I 2026-02-27 16:26:41,752] Trial 99 finished with value: 0.8159756916186209 and parameters: {'activation': 'logistic', 'solver': 'sgd', 'lr': 0.00012196703923512546, 'layer1': 264, 'layer2': 177, 'layer3': 377}. Best is trial 46 with value: 0.8754031846375991.

Pseudomonas_Aeruginosa | Ciprofloxacin | Optuna:  50%|█████     | 100/200 [1:39:11<1:30:23, 54.23s/it, best=0.875][A
Pseudomonas_Aeruginosa | Ciprofloxacin | Optuna:  50%|█████     | 100/200 [1:39:11<1:30:23, 54.23s/it, best=0.875][A[I 2026-02-27 16:27:31,771] Trial 60 finished with value: 0.8237808172244094 and parameters: {'activation': 'identity', 'solver': 'adam', 'lr': 0.0011605709644922921, 'layer1': 383, 'layer2': 400, 'layer3': 163}. Best is trial 42 with value: 0.8285034263433643.

Klebsiella_Pneumoniae | Ciprofloxacin | Optuna:  30%|███       | 61/200 [1:40:01<4:00:23, 103.77s/it, best=0.829][A
Klebsiella_Pneumoniae | Ciprofloxacin | Optuna:  30%|███       | 61/200 [1:40:01<4:00:23, 103.77s/it, best=0.829][A[I 2026-02-27 16:27:47,460] Trial 100 finished with value: 0.8694607423634642 and parameters: {'activation': 'logistic', 'solver': 'adam', 'lr': 0.0003370899170904935, 'layer1': 289, 'layer2': 438, 'layer3': 276}. Best is trial 46 with value: 0.8754031846375991.

Pseudomonas_Aeruginosa | Ciprofloxacin | Optuna:  50%|█████     | 101/200 [1:40:17<1:35:09, 57.67s/it, best=0.875][A
Pseudomonas_Aeruginosa | Ciprofloxacin | Optuna:  50%|█████     | 101/200 [1:40:17<1:35:09, 57.67s/it, best=0.875][A[I 2026-02-27 16:28:02,476] Trial 31 finished with value: 0.8005405479760789 and parameters: {'activation': 'logistic', 'solver': 'adam', 'lr': 6.097369742697022e-05, 'layer1': 379, 'layer2': 246, 'layer3': 383}. Best is trial 22 with value: 0.8056198592051895.

Escherichia_Coli | Ciprofloxacin | Optuna:  16%|█▌        | 32/200 [1:40:31<9:35:02, 205.37s/it, best=0.806][A
Escherichia_Coli | Ciprofloxacin | Optuna:  16%|█▌        | 32/200 [1:40:31<9:35:02, 205.37s/it, best=0.806][A[I 2026-02-27 16:28:52,625] Trial 101 finished with value: 0.8700413601105691 and parameters: {'activation': 'logistic', 'solver': 'adam', 'lr': 0.000278262819546165, 'layer1': 310, 'layer2': 160, 'layer3': 474}. Best is trial 46 with value: 0.8754031846375991.

Pseudomonas_Aeruginosa | Ciprofloxacin | Optuna:  51%|█████     | 102/200 [1:41:22<1:37:52, 59.92s/it, best=0.875][A
Pseudomonas_Aeruginosa | Ciprofloxacin | Optuna:  51%|█████     | 102/200 [1:41:22<1:37:52, 59.92s/it, best=0.875][A[I 2026-02-27 16:28:54,804] Trial 43 finished with value: 0.8148378788620565 and parameters: {'activation': 'identity', 'solver': 'adam', 'lr': 1.2403668302547623e-06, 'layer1': 208, 'layer2': 472, 'layer3': 176}. Best is trial 12 with value: 0.9088083331363105.

Staphylococcus_Aureus | Oxacillin | Optuna:  22%|██▏       | 44/200 [1:41:24<8:50:45, 204.14s/it, best=0.909][A
Staphylococcus_Aureus | Oxacillin | Optuna:  22%|██▏       | 44/200 [1:41:24<8:50:45, 204.14s/it, best=0.909][A[I 2026-02-27 16:29:33,140] Trial 61 finished with value: 0.8257372578030229 and parameters: {'activation': 'identity', 'solver': 'adam', 'lr': 0.0009251905890515005, 'layer1': 328, 'layer2': 447, 'layer3': 305}. Best is trial 42 with value: 0.8285034263433643.

Klebsiella_Pneumoniae | Ciprofloxacin | Optuna:  31%|███       | 62/200 [1:42:02<4:10:48, 109.05s/it, best=0.829][A
Klebsiella_Pneumoniae | Ciprofloxacin | Optuna:  31%|███       | 62/200 [1:42:02<4:10:48, 109.05s/it, best=0.829][A[I 2026-02-27 16:30:28,085] Trial 102 finished with value: 0.8728666368175885 and parameters: {'activation': 'logistic', 'solver': 'adam', 'lr': 0.00020093797488989574, 'layer1': 314, 'layer2': 230, 'layer3': 463}. Best is trial 46 with value: 0.8754031846375991.

Pseudomonas_Aeruginosa | Ciprofloxacin | Optuna:  52%|█████▏    | 103/200 [1:42:57<1:54:06, 70.58s/it, best=0.875][A
Pseudomonas_Aeruginosa | Ciprofloxacin | Optuna:  52%|█████▏    | 103/200 [1:42:57<1:54:06, 70.58s/it, best=0.875][A[I 2026-02-27 16:31:19,633] Trial 44 finished with value: 0.9073433984090242 and parameters: {'activation': 'identity', 'solver': 'adam', 'lr': 0.0018264355071860455, 'layer1': 298, 'layer2': 488, 'layer3': 226}. Best is trial 12 with value: 0.9088083331363105.

Staphylococcus_Aureus | Oxacillin | Optuna:  22%|██▎       | 45/200 [1:43:49<8:01:23, 186.35s/it, best=0.909][A
Staphylococcus_Aureus | Oxacillin | Optuna:  22%|██▎       | 45/200 [1:43:49<8:01:23, 186.35s/it, best=0.909][A[I 2026-02-27 16:31:25,397] Trial 32 finished with value: 0.8031958859740765 and parameters: {'activation': 'logistic', 'solver': 'adam', 'lr': 0.0001282917667907884, 'layer1': 316, 'layer2': 217, 'layer3': 470}. Best is trial 22 with value: 0.8056198592051895.

Escherichia_Coli | Ciprofloxacin | Optuna:  16%|█▋        | 33/200 [1:43:54<9:29:34, 204.64s/it, best=0.806][A
Escherichia_Coli | Ciprofloxacin | Optuna:  16%|█▋        | 33/200 [1:43:54<9:29:34, 204.64s/it, best=0.806][A[I 2026-02-27 16:31:30,327] Trial 62 finished with value: 0.8215195201033889 and parameters: {'activation': 'identity', 'solver': 'adam', 'lr': 0.0005403682405009279, 'layer1': 414, 'layer2': 480, 'layer3': 247}. Best is trial 42 with value: 0.8285034263433643.

Klebsiella_Pneumoniae | Ciprofloxacin | Optuna:  32%|███▏      | 63/200 [1:43:59<4:14:34, 111.49s/it, best=0.829][A
Klebsiella_Pneumoniae | Ciprofloxacin | Optuna:  32%|███▏      | 63/200 [1:43:59<4:14:34, 111.49s/it, best=0.829][A[I 2026-02-27 16:31:38,136] Trial 103 finished with value: 0.8742172738717429 and parameters: {'activation': 'logistic', 'solver': 'adam', 'lr': 0.00047906887193885936, 'layer1': 276, 'layer2': 184, 'layer3': 446}. Best is trial 46 with value: 0.8754031846375991.

Pseudomonas_Aeruginosa | Ciprofloxacin | Optuna:  52%|█████▏    | 104/200 [1:44:07<1:52:40, 70.42s/it, best=0.875][A
Pseudomonas_Aeruginosa | Ciprofloxacin | Optuna:  52%|█████▏    | 104/200 [1:44:07<1:52:40, 70.42s/it, best=0.875][A[I 2026-02-27 16:32:19,115] Trial 33 finished with value: 0.5976367705887482 and parameters: {'activation': 'logistic', 'solver': 'adam', 'lr': 1.1087339750072597e-06, 'layer1': 297, 'layer2': 216, 'layer3': 474}. Best is trial 22 with value: 0.8056198592051895.

Escherichia_Coli | Ciprofloxacin | Optuna:  17%|█▋        | 34/200 [1:44:48<7:20:54, 159.36s/it, best=0.806][A
Escherichia_Coli | Ciprofloxacin | Optuna:  17%|█▋        | 34/200 [1:44:48<7:20:54, 159.36s/it, best=0.806][A[I 2026-02-27 16:32:52,336] Trial 104 finished with value: 0.8736228880704402 and parameters: {'activation': 'logistic', 'solver': 'adam', 'lr': 0.0004202719772023332, 'layer1': 272, 'layer2': 216, 'layer3': 442}. Best is trial 46 with value: 0.8754031846375991.

Pseudomonas_Aeruginosa | Ciprofloxacin | Optuna:  52%|█████▎    | 105/200 [1:45:22<1:53:17, 71.56s/it, best=0.875][A
Pseudomonas_Aeruginosa | Ciprofloxacin | Optuna:  52%|█████▎    | 105/200 [1:45:22<1:53:17, 71.56s/it, best=0.875][A[I 2026-02-27 16:33:12,943] Trial 45 finished with value: 0.9071148471531764 and parameters: {'activation': 'identity', 'solver': 'adam', 'lr': 0.0006998918148062597, 'layer1': 232, 'layer2': 338, 'layer3': 297}. Best is trial 12 with value: 0.9088083331363105.

Staphylococcus_Aureus | Oxacillin | Optuna:  23%|██▎       | 46/200 [1:45:42<7:02:02, 164.43s/it, best=0.909][A
Staphylococcus_Aureus | Oxacillin | Optuna:  23%|██▎       | 46/200 [1:45:42<7:02:02, 164.43s/it, best=0.909][A[I 2026-02-27 16:33:14,666] Trial 63 finished with value: 0.826863907317876 and parameters: {'activation': 'identity', 'solver': 'adam', 'lr': 0.0018312052066403114, 'layer1': 353, 'layer2': 419, 'layer3': 206}. Best is trial 42 with value: 0.8285034263433643.

Klebsiella_Pneumoniae | Ciprofloxacin | Optuna:  32%|███▏      | 64/200 [1:45:44<4:07:50, 109.35s/it, best=0.829][A
Klebsiella_Pneumoniae | Ciprofloxacin | Optuna:  32%|███▏      | 64/200 [1:45:44<4:07:50, 109.35s/it, best=0.829][A[I 2026-02-27 16:33:48,469] Trial 105 finished with value: 0.8695952254468523 and parameters: {'activation': 'logistic', 'solver': 'adam', 'lr': 0.0006284306947884343, 'layer1': 347, 'layer2': 182, 'layer3': 415}. Best is trial 46 with value: 0.8754031846375991.

Pseudomonas_Aeruginosa | Ciprofloxacin | Optuna:  53%|█████▎    | 106/200 [1:46:18<1:44:51, 66.93s/it, best=0.875][A
Pseudomonas_Aeruginosa | Ciprofloxacin | Optuna:  53%|█████▎    | 106/200 [1:46:18<1:44:51, 66.93s/it, best=0.875][A[I 2026-02-27 16:33:50,767] Trial 46 finished with value: 0.7172276085857504 and parameters: {'activation': 'identity', 'solver': 'sgd', 'lr': 0.0013353380026826396, 'layer1': 383, 'layer2': 434, 'layer3': 480}. Best is trial 12 with value: 0.9088083331363105.

Staphylococcus_Aureus | Oxacillin | Optuna:  24%|██▎       | 47/200 [1:46:20<5:22:27, 126.45s/it, best=0.909][A
Staphylococcus_Aureus | Oxacillin | Optuna:  24%|██▎       | 47/200 [1:46:20<5:22:27, 126.45s/it, best=0.909][A[I 2026-02-27 16:34:50,560] Trial 106 finished with value: 0.8653488506378576 and parameters: {'activation': 'logistic', 'solver': 'adam', 'lr': 0.0009832892417631649, 'layer1': 254, 'layer2': 411, 'layer3': 431}. Best is trial 46 with value: 0.8754031846375991.

Pseudomonas_Aeruginosa | Ciprofloxacin | Optuna:  54%|█████▎    | 107/200 [1:47:20<1:41:29, 65.48s/it, best=0.875][A
Pseudomonas_Aeruginosa | Ciprofloxacin | Optuna:  54%|█████▎    | 107/200 [1:47:20<1:41:29, 65.48s/it, best=0.875][A[I 2026-02-27 16:35:19,514] Trial 64 finished with value: 0.8298953923751187 and parameters: {'activation': 'identity', 'solver': 'adam', 'lr': 0.0017837792187369833, 'layer1': 345, 'layer2': 419, 'layer3': 183}. Best is trial 64 with value: 0.8298953923751187.

Klebsiella_Pneumoniae | Ciprofloxacin | Optuna:  32%|███▎      | 65/200 [1:47:49<4:16:29, 114.00s/it, best=0.829][A
Klebsiella_Pneumoniae | Ciprofloxacin | Optuna:  32%|███▎      | 65/200 [1:47:49<4:16:29, 114.00s/it, best=0.83] [A[I 2026-02-27 16:35:50,607] Trial 47 finished with value: 0.9058161994307274 and parameters: {'activation': 'relu', 'solver': 'adam', 'lr': 0.00014673729525196502, 'layer1': 359, 'layer2': 391, 'layer3': 111}. Best is trial 12 with value: 0.9088083331363105.

Staphylococcus_Aureus | Oxacillin | Optuna:  24%|██▍       | 48/200 [1:48:20<5:15:19, 124.47s/it, best=0.909][A
