Staphylococcus_Aureus | LPS | Optuna:  26%|██▌       | 51/200 [1:55:33<5:02:24, 121.77s/it, best=0.888]Staphylococcus_Aureus | LPS | Optuna:  26%|██▌       | 51/200 [1:55:33<5:02:24, 121.77s/it, best=0.888][I 2026-02-28 10:02:12,862] Trial 105 finished with value: 0.8630546689260077 and parameters: {'activation': 'identity', 'solver': 'adam', 'lr': 0.00047406593244498334, 'layer1': 450, 'layer2': 303, 'layer3': 120}. Best is trial 102 with value: 0.8672439264969375.
Pseudomonas_Aeruginosa | DirectMulti | Optuna:  53%|█████▎    | 106/200 [3:05:59<2:55:25, 111.97s/it, best=0.867]Pseudomonas_Aeruginosa | DirectMulti | Optuna:  53%|█████▎    | 106/200 [3:05:59<2:55:25, 111.97s/it, best=0.867]/export/usuarios01/egarroyo/MALDI_for_AMR_prediction/venv/lib/python3.13/site-packages/sklearn/model_selection/_split.py:813: UserWarning: The least populated class in y has only 4 members, which is less than n_splits=5.
  warnings.warn(
[I 2026-02-28 10:02:28,583] Trial 54 finished with value: 0.9147372827142604 and parameters: {'activation': 'relu', 'solver': 'adam', 'lr': 0.00014834017423665503, 'layer1': 449, 'layer2': 368, 'layer3': 361}. Best is trial 48 with value: 0.9153464356833068.

Escherichia_Coli | Piperacillin-Tazobactam | Optuna:  28%|██▊       | 55/200 [1:58:21<6:28:56, 160.94s/it, best=0.915][A
Escherichia_Coli | Piperacillin-Tazobactam | Optuna:  28%|██▊       | 55/200 [1:58:21<6:28:56, 160.94s/it, best=0.915][A[I 2026-02-28 10:02:54,063] Trial 51 finished with value: 0.8832791441790799 and parameters: {'activation': 'identity', 'solver': 'adam', 'lr': 0.00032762864119056045, 'layer1': 11, 'layer2': 130, 'layer3': 349}. Best is trial 8 with value: 0.8879562150966016.
Staphylococcus_Aureus | LPS | Optuna:  26%|██▌       | 52/200 [1:56:40<4:19:55, 105.37s/it, best=0.888]Staphylococcus_Aureus | LPS | Optuna:  26%|██▌       | 52/200 [1:56:40<4:19:55, 105.37s/it, best=0.888][I 2026-02-28 10:02:56,440] Trial 43 finished with value: 0.8942161078734555 and parameters: {'activation': 'identity', 'solver': 'adam', 'lr': 1.2403668302547623e-06, 'layer1': 443, 'layer2': 269, 'layer3': 346}. Best is trial 23 with value: 0.9252230330428246.
Klebsiella_Pneumoniae | LPS | Optuna:  22%|██▏       | 44/200 [1:15:12<6:18:26, 145.55s/it, best=0.925]Klebsiella_Pneumoniae | LPS | Optuna:  22%|██▏       | 44/200 [1:15:12<6:18:26, 145.55s/it, best=0.925][I 2026-02-28 10:03:05,852] Trial 106 finished with value: 0.8580572103327384 and parameters: {'activation': 'tanh', 'solver': 'adam', 'lr': 0.0003229418000074319, 'layer1': 356, 'layer2': 280, 'layer3': 186}. Best is trial 102 with value: 0.8672439264969375.
Pseudomonas_Aeruginosa | DirectMulti | Optuna:  54%|█████▎    | 107/200 [3:06:52<2:26:07, 94.28s/it, best=0.867] Pseudomonas_Aeruginosa | DirectMulti | Optuna:  54%|█████▎    | 107/200 [3:06:52<2:26:07, 94.28s/it, best=0.867]/export/usuarios01/egarroyo/MALDI_for_AMR_prediction/venv/lib/python3.13/site-packages/sklearn/model_selection/_split.py:813: UserWarning: The least populated class in y has only 4 members, which is less than n_splits=5.
  warnings.warn(
[I 2026-02-28 10:04:08,835] Trial 55 finished with value: 0.9109981768259863 and parameters: {'activation': 'relu', 'solver': 'adam', 'lr': 0.00014161720627405044, 'layer1': 103, 'layer2': 368, 'layer3': 296}. Best is trial 48 with value: 0.9153464356833068.

Escherichia_Coli | Piperacillin-Tazobactam | Optuna:  28%|██▊       | 56/200 [2:00:01<5:42:33, 142.73s/it, best=0.915][A
Escherichia_Coli | Piperacillin-Tazobactam | Optuna:  28%|██▊       | 56/200 [2:00:01<5:42:33, 142.73s/it, best=0.915][A[I 2026-02-28 10:04:31,535] Trial 44 finished with value: 0.9243045783799768 and parameters: {'activation': 'identity', 'solver': 'adam', 'lr': 0.00026056590186213324, 'layer1': 382, 'layer2': 141, 'layer3': 295}. Best is trial 23 with value: 0.9252230330428246.
Klebsiella_Pneumoniae | LPS | Optuna:  22%|██▎       | 45/200 [1:16:47<5:36:54, 130.41s/it, best=0.925]Klebsiella_Pneumoniae | LPS | Optuna:  22%|██▎       | 45/200 [1:16:47<5:36:54, 130.41s/it, best=0.925][I 2026-02-28 10:04:44,870] Trial 52 finished with value: 0.8863511836513164 and parameters: {'activation': 'identity', 'solver': 'adam', 'lr': 0.0002768072161241762, 'layer1': 303, 'layer2': 129, 'layer3': 289}. Best is trial 8 with value: 0.8879562150966016.
Staphylococcus_Aureus | LPS | Optuna:  26%|██▋       | 53/200 [1:58:31<4:22:09, 107.00s/it, best=0.888]Staphylococcus_Aureus | LPS | Optuna:  26%|██▋       | 53/200 [1:58:31<4:22:09, 107.00s/it, best=0.888][I 2026-02-28 10:04:52,129] Trial 107 finished with value: 0.8630230379358881 and parameters: {'activation': 'identity', 'solver': 'adam', 'lr': 7.146526714213314e-05, 'layer1': 328, 'layer2': 378, 'layer3': 156}. Best is trial 102 with value: 0.8672439264969375.
Pseudomonas_Aeruginosa | DirectMulti | Optuna:  54%|█████▍    | 108/200 [3:08:38<2:30:04, 97.88s/it, best=0.867]Pseudomonas_Aeruginosa | DirectMulti | Optuna:  54%|█████▍    | 108/200 [3:08:38<2:30:04, 97.88s/it, best=0.867]/export/usuarios01/egarroyo/MALDI_for_AMR_prediction/venv/lib/python3.13/site-packages/sklearn/model_selection/_split.py:813: UserWarning: The least populated class in y has only 4 members, which is less than n_splits=5.
  warnings.warn(
[I 2026-02-28 10:06:20,077] Trial 45 finished with value: 0.9234228779290051 and parameters: {'activation': 'identity', 'solver': 'adam', 'lr': 0.00014246595196388686, 'layer1': 351, 'layer2': 130, 'layer3': 293}. Best is trial 23 with value: 0.9252230330428246.
Klebsiella_Pneumoniae | LPS | Optuna:  23%|██▎       | 46/200 [1:18:36<5:17:53, 123.85s/it, best=0.925]Klebsiella_Pneumoniae | LPS | Optuna:  23%|██▎       | 46/200 [1:18:36<5:17:53, 123.85s/it, best=0.925][I 2026-02-28 10:06:55,827] Trial 53 finished with value: 0.8846205002283577 and parameters: {'activation': 'identity', 'solver': 'adam', 'lr': 0.0006545802731448522, 'layer1': 254, 'layer2': 52, 'layer3': 282}. Best is trial 8 with value: 0.8879562150966016.
Staphylococcus_Aureus | LPS | Optuna:  27%|██▋       | 54/200 [2:00:42<4:37:51, 114.19s/it, best=0.888]Staphylococcus_Aureus | LPS | Optuna:  27%|██▋       | 54/200 [2:00:42<4:37:51, 114.19s/it, best=0.888][I 2026-02-28 10:07:21,329] Trial 108 finished with value: 0.8652289354129419 and parameters: {'activation': 'identity', 'solver': 'adam', 'lr': 3.1633143363315767e-05, 'layer1': 458, 'layer2': 409, 'layer3': 256}. Best is trial 102 with value: 0.8672439264969375.
Pseudomonas_Aeruginosa | DirectMulti | Optuna:  55%|█████▍    | 109/200 [3:11:07<2:51:48, 113.28s/it, best=0.867]Pseudomonas_Aeruginosa | DirectMulti | Optuna:  55%|█████▍    | 109/200 [3:11:07<2:51:48, 113.28s/it, best=0.867]/export/usuarios01/egarroyo/MALDI_for_AMR_prediction/venv/lib/python3.13/site-packages/sklearn/model_selection/_split.py:813: UserWarning: The least populated class in y has only 4 members, which is less than n_splits=5.
  warnings.warn(
[I 2026-02-28 10:07:34,037] Trial 46 finished with value: 0.9228593841255879 and parameters: {'activation': 'identity', 'solver': 'adam', 'lr': 0.0006018171758761248, 'layer1': 380, 'layer2': 152, 'layer3': 243}. Best is trial 23 with value: 0.9252230330428246.
Klebsiella_Pneumoniae | LPS | Optuna:  24%|██▎       | 47/200 [1:19:50<4:37:39, 108.89s/it, best=0.925]Klebsiella_Pneumoniae | LPS | Optuna:  24%|██▎       | 47/200 [1:19:50<4:37:39, 108.89s/it, best=0.925][I 2026-02-28 10:07:35,663] Trial 56 finished with value: 0.9101072687485061 and parameters: {'activation': 'relu', 'solver': 'adam', 'lr': 3.795885627582688e-05, 'layer1': 483, 'layer2': 389, 'layer3': 360}. Best is trial 48 with value: 0.9153464356833068.

Escherichia_Coli | Piperacillin-Tazobactam | Optuna:  28%|██▊       | 57/200 [2:03:28<6:26:00, 161.96s/it, best=0.915][A
Escherichia_Coli | Piperacillin-Tazobactam | Optuna:  28%|██▊       | 57/200 [2:03:28<6:26:00, 161.96s/it, best=0.915][A[I 2026-02-28 10:08:48,361] Trial 109 finished with value: 0.8606216068176105 and parameters: {'activation': 'identity', 'solver': 'adam', 'lr': 5.201915480451097e-05, 'layer1': 118, 'layer2': 327, 'layer3': 487}. Best is trial 102 with value: 0.8672439264969375.
Pseudomonas_Aeruginosa | DirectMulti | Optuna:  55%|█████▌    | 110/200 [3:12:34<2:38:06, 105.40s/it, best=0.867]Pseudomonas_Aeruginosa | DirectMulti | Optuna:  55%|█████▌    | 110/200 [3:12:34<2:38:06, 105.40s/it, best=0.867]/export/usuarios01/egarroyo/MALDI_for_AMR_prediction/venv/lib/python3.13/site-packages/sklearn/model_selection/_split.py:813: UserWarning: The least populated class in y has only 4 members, which is less than n_splits=5.
  warnings.warn(
[I 2026-02-28 10:09:07,162] Trial 54 finished with value: 0.8849507708536851 and parameters: {'activation': 'identity', 'solver': 'adam', 'lr': 0.00022675671091412916, 'layer1': 355, 'layer2': 136, 'layer3': 306}. Best is trial 8 with value: 0.8879562150966016.
Staphylococcus_Aureus | LPS | Optuna:  28%|██▊       | 55/200 [2:02:53<4:48:23, 119.33s/it, best=0.888]Staphylococcus_Aureus | LPS | Optuna:  28%|██▊       | 55/200 [2:02:53<4:48:23, 119.33s/it, best=0.888][I 2026-02-28 10:09:37,092] Trial 110 finished with value: 0.8310529827700531 and parameters: {'activation': 'logistic', 'solver': 'adam', 'lr': 0.00021668357755701777, 'layer1': 370, 'layer2': 323, 'layer3': 167}. Best is trial 102 with value: 0.8672439264969375.
Pseudomonas_Aeruginosa | DirectMulti | Optuna:  56%|█████▌    | 111/200 [3:13:23<2:11:07, 88.40s/it, best=0.867] Pseudomonas_Aeruginosa | DirectMulti | Optuna:  56%|█████▌    | 111/200 [3:13:23<2:11:07, 88.40s/it, best=0.867]/export/usuarios01/egarroyo/MALDI_for_AMR_prediction/venv/lib/python3.13/site-packages/sklearn/model_selection/_split.py:813: UserWarning: The least populated class in y has only 4 members, which is less than n_splits=5.
  warnings.warn(
[I 2026-02-28 10:09:48,426] Trial 57 finished with value: 0.9154126247656695 and parameters: {'activation': 'relu', 'solver': 'adam', 'lr': 0.00023900462680811918, 'layer1': 405, 'layer2': 312, 'layer3': 452}. Best is trial 57 with value: 0.9154126247656695.

Escherichia_Coli | Piperacillin-Tazobactam | Optuna:  29%|██▉       | 58/200 [2:05:41<6:02:34, 153.20s/it, best=0.915][A
Escherichia_Coli | Piperacillin-Tazobactam | Optuna:  29%|██▉       | 58/200 [2:05:41<6:02:34, 153.20s/it, best=0.915][A[I 2026-02-28 10:10:31,294] Trial 58 finished with value: 0.8958344038173316 and parameters: {'activation': 'relu', 'solver': 'sgd', 'lr': 0.0002989463529779894, 'layer1': 325, 'layer2': 315, 'layer3': 487}. Best is trial 57 with value: 0.9154126247656695.

Escherichia_Coli | Piperacillin-Tazobactam | Optuna:  30%|██▉       | 59/200 [2:06:23<4:42:14, 120.10s/it, best=0.915][A
Escherichia_Coli | Piperacillin-Tazobactam | Optuna:  30%|██▉       | 59/200 [2:06:23<4:42:14, 120.10s/it, best=0.915][A[I 2026-02-28 10:11:16,133] Trial 47 finished with value: 0.8703146133228185 and parameters: {'activation': 'identity', 'solver': 'sgd', 'lr': 3.0426839962124794e-05, 'layer1': 238, 'layer2': 295, 'layer3': 172}. Best is trial 23 with value: 0.9252230330428246.
Klebsiella_Pneumoniae | LPS | Optuna:  24%|██▍       | 48/200 [1:23:32<6:01:52, 142.85s/it, best=0.925]Klebsiella_Pneumoniae | LPS | Optuna:  24%|██▍       | 48/200 [1:23:32<6:01:52, 142.85s/it, best=0.925][I 2026-02-28 10:11:43,946] Trial 55 finished with value: 0.884118120150989 and parameters: {'activation': 'identity', 'solver': 'adam', 'lr': 7.086513399245742e-05, 'layer1': 326, 'layer2': 72, 'layer3': 279}. Best is trial 8 with value: 0.8879562150966016.
Staphylococcus_Aureus | LPS | Optuna:  28%|██▊       | 56/200 [2:05:30<5:13:21, 130.57s/it, best=0.888]Staphylococcus_Aureus | LPS | Optuna:  28%|██▊       | 56/200 [2:05:30<5:13:21, 130.57s/it, best=0.888][I 2026-02-28 10:11:53,434] Trial 111 finished with value: 0.8586424969379152 and parameters: {'activation': 'identity', 'solver': 'adam', 'lr': 2.5819764151330718e-05, 'layer1': 460, 'layer2': 396, 'layer3': 195}. Best is trial 102 with value: 0.8672439264969375.
Pseudomonas_Aeruginosa | DirectMulti | Optuna:  56%|█████▌    | 112/200 [3:15:39<2:30:44, 102.78s/it, best=0.867]Pseudomonas_Aeruginosa | DirectMulti | Optuna:  56%|█████▌    | 112/200 [3:15:39<2:30:44, 102.78s/it, best=0.867]/export/usuarios01/egarroyo/MALDI_for_AMR_prediction/venv/lib/python3.13/site-packages/sklearn/model_selection/_split.py:813: UserWarning: The least populated class in y has only 4 members, which is less than n_splits=5.
  warnings.warn(
[I 2026-02-28 10:12:22,675] Trial 48 finished with value: 0.9161486528792981 and parameters: {'activation': 'relu', 'solver': 'adam', 'lr': 0.0012369470473964624, 'layer1': 319, 'layer2': 52, 'layer3': 298}. Best is trial 23 with value: 0.9252230330428246.
Klebsiella_Pneumoniae | LPS | Optuna:  24%|██▍       | 49/200 [1:24:38<5:01:53, 119.96s/it, best=0.925]Klebsiella_Pneumoniae | LPS | Optuna:  24%|██▍       | 49/200 [1:24:38<5:01:53, 119.96s/it, best=0.925][I 2026-02-28 10:13:01,492] Trial 59 finished with value: 0.9143460995098394 and parameters: {'activation': 'relu', 'solver': 'adam', 'lr': 0.00019448682772217792, 'layer1': 407, 'layer2': 379, 'layer3': 14}. Best is trial 57 with value: 0.9154126247656695.

Escherichia_Coli | Piperacillin-Tazobactam | Optuna:  30%|███       | 60/200 [2:08:54<5:01:18, 129.13s/it, best=0.915][A
Escherichia_Coli | Piperacillin-Tazobactam | Optuna:  30%|███       | 60/200 [2:08:54<5:01:18, 129.13s/it, best=0.915][A[I 2026-02-28 10:14:11,087] Trial 49 finished with value: 0.9246798097267288 and parameters: {'activation': 'identity', 'solver': 'adam', 'lr': 0.0003986110565539168, 'layer1': 393, 'layer2': 255, 'layer3': 81}. Best is trial 23 with value: 0.9252230330428246.
Klebsiella_Pneumoniae | LPS | Optuna:  25%|██▌       | 50/200 [1:26:27<4:51:13, 116.49s/it, best=0.925]Klebsiella_Pneumoniae | LPS | Optuna:  25%|██▌       | 50/200 [1:26:27<4:51:13, 116.49s/it, best=0.925][I 2026-02-28 10:14:11,867] Trial 112 finished with value: 0.8627976586778227 and parameters: {'activation': 'identity', 'solver': 'adam', 'lr': 4.059500029176243e-05, 'layer1': 491, 'layer2': 401, 'layer3': 257}. Best is trial 102 with value: 0.8672439264969375.
Pseudomonas_Aeruginosa | DirectMulti | Optuna:  56%|█████▋    | 113/200 [3:17:58<2:44:32, 113.48s/it, best=0.867]Pseudomonas_Aeruginosa | DirectMulti | Optuna:  56%|█████▋    | 113/200 [3:17:58<2:44:32, 113.48s/it, best=0.867]/export/usuarios01/egarroyo/MALDI_for_AMR_prediction/venv/lib/python3.13/site-packages/sklearn/model_selection/_split.py:813: UserWarning: The least populated class in y has only 4 members, which is less than n_splits=5.
  warnings.warn(
[I 2026-02-28 10:14:31,191] Trial 56 finished with value: 0.8862651268941676 and parameters: {'activation': 'identity', 'solver': 'adam', 'lr': 0.00012853870116718053, 'layer1': 383, 'layer2': 178, 'layer3': 186}. Best is trial 8 with value: 0.8879562150966016.
Staphylococcus_Aureus | LPS | Optuna:  28%|██▊       | 57/200 [2:08:17<5:37:24, 141.57s/it, best=0.888]Staphylococcus_Aureus | LPS | Optuna:  28%|██▊       | 57/200 [2:08:17<5:37:24, 141.57s/it, best=0.888][I 2026-02-28 10:15:35,430] Trial 60 finished with value: 0.9134526796960267 and parameters: {'activation': 'relu', 'solver': 'adam', 'lr': 0.00048321711382711877, 'layer1': 405, 'layer2': 398, 'layer3': 41}. Best is trial 57 with value: 0.9154126247656695.

Escherichia_Coli | Piperacillin-Tazobactam | Optuna:  30%|███       | 61/200 [2:11:28<5:16:23, 136.57s/it, best=0.915][A
Escherichia_Coli | Piperacillin-Tazobactam | Optuna:  30%|███       | 61/200 [2:11:28<5:16:23, 136.57s/it, best=0.915][A[I 2026-02-28 10:15:39,912] Trial 50 finished with value: 0.9223755499956106 and parameters: {'activation': 'tanh', 'solver': 'adam', 'lr': 0.00011224442245404805, 'layer1': 355, 'layer2': 257, 'layer3': 78}. Best is trial 23 with value: 0.9252230330428246.
Klebsiella_Pneumoniae | LPS | Optuna:  26%|██▌       | 51/200 [1:27:55<4:28:40, 108.19s/it, best=0.925]Klebsiella_Pneumoniae | LPS | Optuna:  26%|██▌       | 51/200 [1:27:55<4:28:40, 108.19s/it, best=0.925][I 2026-02-28 10:16:17,889] Trial 57 finished with value: 0.8010506508624555 and parameters: {'activation': 'identity', 'solver': 'sgd', 'lr': 0.00013670230960893917, 'layer1': 388, 'layer2': 174, 'layer3': 184}. Best is trial 8 with value: 0.8879562150966016.
Staphylococcus_Aureus | LPS | Optuna:  29%|██▉       | 58/200 [2:10:04<5:10:17, 131.11s/it, best=0.888]Staphylococcus_Aureus | LPS | Optuna:  29%|██▉       | 58/200 [2:10:04<5:10:17, 131.11s/it, best=0.888][I 2026-02-28 10:16:29,393] Trial 113 finished with value: 0.8652106229351693 and parameters: {'activation': 'identity', 'solver': 'adam', 'lr': 8.181674774273006e-05, 'layer1': 473, 'layer2': 411, 'layer3': 132}. Best is trial 102 with value: 0.8672439264969375.
Pseudomonas_Aeruginosa | DirectMulti | Optuna:  57%|█████▋    | 114/200 [3:20:15<2:52:59, 120.69s/it, best=0.867]Pseudomonas_Aeruginosa | DirectMulti | Optuna:  57%|█████▋    | 114/200 [3:20:15<2:52:59, 120.69s/it, best=0.867]/export/usuarios01/egarroyo/MALDI_for_AMR_prediction/venv/lib/python3.13/site-packages/sklearn/model_selection/_split.py:813: UserWarning: The least populated class in y has only 4 members, which is less than n_splits=5.
  warnings.warn(
[I 2026-02-28 10:16:39,177] Trial 51 finished with value: 0.9246294150561797 and parameters: {'activation': 'identity', 'solver': 'adam', 'lr': 0.0002832716143938097, 'layer1': 11, 'layer2': 319, 'layer3': 48}. Best is trial 23 with value: 0.9252230330428246.
Klebsiella_Pneumoniae | LPS | Optuna:  26%|██▌       | 52/200 [1:28:55<3:50:40, 93.51s/it, best=0.925] Klebsiella_Pneumoniae | LPS | Optuna:  26%|██▌       | 52/200 [1:28:55<3:50:40, 93.51s/it, best=0.925][I 2026-02-28 10:17:32,339] Trial 52 finished with value: 0.923543973974312 and parameters: {'activation': 'identity', 'solver': 'adam', 'lr': 0.00038062952035383386, 'layer1': 21, 'layer2': 328, 'layer3': 47}. Best is trial 23 with value: 0.9252230330428246.
Klebsiella_Pneumoniae | LPS | Optuna:  26%|██▋       | 53/200 [1:29:48<3:19:27, 81.41s/it, best=0.925]Klebsiella_Pneumoniae | LPS | Optuna:  26%|██▋       | 53/200 [1:29:48<3:19:27, 81.41s/it, best=0.925][I 2026-02-28 10:18:14,428] Trial 61 finished with value: 0.9154206699278487 and parameters: {'activation': 'relu', 'solver': 'adam', 'lr': 0.0002042365521661546, 'layer1': 415, 'layer2': 359, 'layer3': 167}. Best is trial 61 with value: 0.9154206699278487.

Escherichia_Coli | Piperacillin-Tazobactam | Optuna:  31%|███       | 62/200 [2:14:07<5:29:35, 143.30s/it, best=0.915][A
Escherichia_Coli | Piperacillin-Tazobactam | Optuna:  31%|███       | 62/200 [2:14:07<5:29:35, 143.30s/it, best=0.915][A[I 2026-02-28 10:18:29,203] Trial 114 finished with value: 0.8443986549833624 and parameters: {'activation': 'identity', 'solver': 'adam', 'lr': 1.1811427132921186e-05, 'layer1': 435, 'layer2': 370, 'layer3': 250}. Best is trial 102 with value: 0.8672439264969375.
Pseudomonas_Aeruginosa | DirectMulti | Optuna:  57%|█████▊    | 115/200 [3:22:15<2:50:36, 120.43s/it, best=0.867]Pseudomonas_Aeruginosa | DirectMulti | Optuna:  57%|█████▊    | 115/200 [3:22:15<2:50:36, 120.43s/it, best=0.867]/export/usuarios01/egarroyo/MALDI_for_AMR_prediction/venv/lib/python3.13/site-packages/sklearn/model_selection/_split.py:813: UserWarning: The least populated class in y has only 4 members, which is less than n_splits=5.
  warnings.warn(
[I 2026-02-28 10:18:34,379] Trial 58 finished with value: 0.8798307664742092 and parameters: {'activation': 'logistic', 'solver': 'adam', 'lr': 0.00047469156733786263, 'layer1': 381, 'layer2': 155, 'layer3': 153}. Best is trial 8 with value: 0.8879562150966016.
Staphylococcus_Aureus | LPS | Optuna:  30%|██▉       | 59/200 [2:12:20<5:11:54, 132.72s/it, best=0.888]Staphylococcus_Aureus | LPS | Optuna:  30%|██▉       | 59/200 [2:12:20<5:11:54, 132.72s/it, best=0.888][I 2026-02-28 10:18:50,483] Trial 53 finished with value: 0.9236091650881113 and parameters: {'activation': 'identity', 'solver': 'adam', 'lr': 0.0008248429095218654, 'layer1': 84, 'layer2': 294, 'layer3': 105}. Best is trial 23 with value: 0.9252230330428246.
Klebsiella_Pneumoniae | LPS | Optuna:  27%|██▋       | 54/200 [1:31:06<3:15:42, 80.43s/it, best=0.925]Klebsiella_Pneumoniae | LPS | Optuna:  27%|██▋       | 54/200 [1:31:06<3:15:42, 80.43s/it, best=0.925][I 2026-02-28 10:20:20,714] Trial 54 finished with value: 0.9251558569514705 and parameters: {'activation': 'identity', 'solver': 'adam', 'lr': 0.00019404400936333055, 'layer1': 177, 'layer2': 367, 'layer3': 45}. Best is trial 23 with value: 0.9252230330428246.
Klebsiella_Pneumoniae | LPS | Optuna:  28%|██▊       | 55/200 [1:32:36<3:21:28, 83.37s/it, best=0.925]Klebsiella_Pneumoniae | LPS | Optuna:  28%|██▊       | 55/200 [1:32:36<3:21:28, 83.37s/it, best=0.925][I 2026-02-28 10:20:40,150] Trial 115 finished with value: 0.8650564422813257 and parameters: {'activation': 'identity', 'solver': 'adam', 'lr': 0.00026748393671270935, 'layer1': 450, 'layer2': 344, 'layer3': 292}. Best is trial 102 with value: 0.8672439264969375.
Pseudomonas_Aeruginosa | DirectMulti | Optuna:  58%|█████▊    | 116/200 [3:24:26<2:53:01, 123.58s/it, best=0.867]Pseudomonas_Aeruginosa | DirectMulti | Optuna:  58%|█████▊    | 116/200 [3:24:26<2:53:01, 123.58s/it, best=0.867]/export/usuarios01/egarroyo/MALDI_for_AMR_prediction/venv/lib/python3.13/site-packages/sklearn/model_selection/_split.py:813: UserWarning: The least populated class in y has only 4 members, which is less than n_splits=5.
  warnings.warn(
