Staphylococcus_Aureus | Oxacillin | Optuna:  50%|█████     | 101/200 [3:45:35<3:16:38, 119.18s/it, best=0.91][A[I 2026-02-27 18:33:48,684] Trial 120 finished with value: 0.8263100872189639 and parameters: {'activation': 'identity', 'solver': 'adam', 'lr': 8.226390224906113e-05, 'layer1': 194, 'layer2': 493, 'layer3': 155}. Best is trial 91 with value: 0.8315336183309556.

Klebsiella_Pneumoniae | Ciprofloxacin | Optuna:  60%|██████    | 121/200 [3:46:18<2:48:53, 128.27s/it, best=0.832][A
Klebsiella_Pneumoniae | Ciprofloxacin | Optuna:  60%|██████    | 121/200 [3:46:18<2:48:53, 128.27s/it, best=0.832][A[I 2026-02-27 18:33:54,038] Trial 2 finished with value: 0.8263103852939013 and parameters: {'activation': 'identity', 'solver': 'adam', 'lr': 6.290644294586145e-06, 'layer1': 262, 'layer2': 300, 'layer3': 32}. Best is trial 2 with value: 0.8263103852939013.

Pseudomonas_Aeruginosa | Imipenem | Optuna:   2%|▏         | 3/200 [01:48<2:12:52, 40.47s/it, best=0.818][A
Pseudomonas_Aeruginosa | Imipenem | Optuna:   2%|▏         | 3/200 [01:48<2:12:52, 40.47s/it, best=0.826][A[I 2026-02-27 18:34:30,283] Trial 3 finished with value: 0.5059931398968448 and parameters: {'activation': 'relu', 'solver': 'sgd', 'lr': 1.6536937182824424e-05, 'layer1': 57, 'layer2': 345, 'layer3': 226}. Best is trial 2 with value: 0.8263103852939013.

Pseudomonas_Aeruginosa | Imipenem | Optuna:   2%|▏         | 4/200 [02:24<2:06:45, 38.80s/it, best=0.826][A
Pseudomonas_Aeruginosa | Imipenem | Optuna:   2%|▏         | 4/200 [02:24<2:06:45, 38.80s/it, best=0.826][A[I 2026-02-27 18:34:42,581] Trial 101 finished with value: 0.9055256418223452 and parameters: {'activation': 'identity', 'solver': 'adam', 'lr': 7.933310804160689e-05, 'layer1': 194, 'layer2': 358, 'layer3': 483}. Best is trial 84 with value: 0.9099428178723615.

Staphylococcus_Aureus | Oxacillin | Optuna:  51%|█████     | 102/200 [3:47:12<3:03:49, 112.55s/it, best=0.91][A
Staphylococcus_Aureus | Oxacillin | Optuna:  51%|█████     | 102/200 [3:47:12<3:03:49, 112.55s/it, best=0.91][A[I 2026-02-27 18:34:54,810] Trial 4 finished with value: 0.8175565662034809 and parameters: {'activation': 'relu', 'solver': 'adam', 'lr': 1.7654048052495086e-05, 'layer1': 265, 'layer2': 278, 'layer3': 100}. Best is trial 2 with value: 0.8263103852939013.

Pseudomonas_Aeruginosa | Imipenem | Optuna:   2%|▎         | 5/200 [02:49<1:49:22, 33.65s/it, best=0.826][A
Pseudomonas_Aeruginosa | Imipenem | Optuna:   2%|▎         | 5/200 [02:49<1:49:22, 33.65s/it, best=0.826][A[I 2026-02-27 18:35:46,147] Trial 5 finished with value: 0.81502082971646 and parameters: {'activation': 'identity', 'solver': 'adam', 'lr': 2.259279742015697e-06, 'layer1': 106, 'layer2': 32, 'layer3': 169}. Best is trial 2 with value: 0.8263103852939013.

Pseudomonas_Aeruginosa | Imipenem | Optuna:   3%|▎         | 6/200 [03:40<2:08:15, 39.67s/it, best=0.826][A
Pseudomonas_Aeruginosa | Imipenem | Optuna:   3%|▎         | 6/200 [03:40<2:08:15, 39.67s/it, best=0.826][A[I 2026-02-27 18:35:55,744] Trial 121 finished with value: 0.8255929306474693 and parameters: {'activation': 'identity', 'solver': 'adam', 'lr': 2.985463816596223e-05, 'layer1': 278, 'layer2': 478, 'layer3': 223}. Best is trial 91 with value: 0.8315336183309556.

Klebsiella_Pneumoniae | Ciprofloxacin | Optuna:  61%|██████    | 122/200 [3:48:25<2:46:16, 127.91s/it, best=0.832][A
Klebsiella_Pneumoniae | Ciprofloxacin | Optuna:  61%|██████    | 122/200 [3:48:25<2:46:16, 127.91s/it, best=0.832][A[I 2026-02-27 18:36:03,219] Trial 93 finished with value: 0.8048898743078887 and parameters: {'activation': 'tanh', 'solver': 'adam', 'lr': 1.8961819854439123e-05, 'layer1': 184, 'layer2': 208, 'layer3': 75}. Best is trial 55 with value: 0.8076668303114959.

Escherichia_Coli | Ciprofloxacin | Optuna:  47%|████▋     | 94/200 [3:48:32<4:43:33, 160.51s/it, best=0.808][A
Escherichia_Coli | Ciprofloxacin | Optuna:  47%|████▋     | 94/200 [3:48:32<4:43:33, 160.51s/it, best=0.808][A[I 2026-02-27 18:36:35,842] Trial 102 finished with value: 0.9086871959150293 and parameters: {'activation': 'identity', 'solver': 'adam', 'lr': 9.686268567471603e-05, 'layer1': 225, 'layer2': 241, 'layer3': 475}. Best is trial 84 with value: 0.9099428178723615.

Staphylococcus_Aureus | Oxacillin | Optuna:  52%|█████▏    | 103/200 [3:49:05<3:02:17, 112.76s/it, best=0.91][A
Staphylococcus_Aureus | Oxacillin | Optuna:  52%|█████▏    | 103/200 [3:49:05<3:02:17, 112.76s/it, best=0.91][A[I 2026-02-27 18:37:43,150] Trial 6 finished with value: 0.8120367677194908 and parameters: {'activation': 'tanh', 'solver': 'adam', 'lr': 3.6618192203924288e-06, 'layer1': 403, 'layer2': 46, 'layer3': 494}. Best is trial 2 with value: 0.8263103852939013.

Pseudomonas_Aeruginosa | Imipenem | Optuna:   4%|▎         | 7/200 [05:37<3:28:55, 64.95s/it, best=0.826][A
Pseudomonas_Aeruginosa | Imipenem | Optuna:   4%|▎         | 7/200 [05:37<3:28:55, 64.95s/it, best=0.826][A[I 2026-02-27 18:38:04,499] Trial 122 finished with value: 0.8237901126045355 and parameters: {'activation': 'identity', 'solver': 'adam', 'lr': 5.930354516390084e-05, 'layer1': 377, 'layer2': 491, 'layer3': 260}. Best is trial 91 with value: 0.8315336183309556.

Klebsiella_Pneumoniae | Ciprofloxacin | Optuna:  62%|██████▏   | 123/200 [3:50:34<2:44:28, 128.16s/it, best=0.832][A
Klebsiella_Pneumoniae | Ciprofloxacin | Optuna:  62%|██████▏   | 123/200 [3:50:34<2:44:28, 128.16s/it, best=0.832][A[I 2026-02-27 18:38:20,836] Trial 7 finished with value: 0.8591511465281554 and parameters: {'activation': 'relu', 'solver': 'adam', 'lr': 0.0012164139351417069, 'layer1': 46, 'layer2': 186, 'layer3': 66}. Best is trial 7 with value: 0.8591511465281554.

Pseudomonas_Aeruginosa | Imipenem | Optuna:   4%|▍         | 8/200 [06:15<3:00:03, 56.27s/it, best=0.826][A
Pseudomonas_Aeruginosa | Imipenem | Optuna:   4%|▍         | 8/200 [06:15<3:00:03, 56.27s/it, best=0.859][A[I 2026-02-27 18:38:26,995] Trial 103 finished with value: 0.905546509059335 and parameters: {'activation': 'identity', 'solver': 'adam', 'lr': 0.00010202663192406527, 'layer1': 176, 'layer2': 251, 'layer3': 429}. Best is trial 84 with value: 0.9099428178723615.

Staphylococcus_Aureus | Oxacillin | Optuna:  52%|█████▏    | 104/200 [3:50:56<2:59:38, 112.28s/it, best=0.91][A
Staphylococcus_Aureus | Oxacillin | Optuna:  52%|█████▏    | 104/200 [3:50:56<2:59:38, 112.28s/it, best=0.91][A[I 2026-02-27 18:39:51,308] Trial 8 finished with value: 0.8593369016165944 and parameters: {'activation': 'identity', 'solver': 'adam', 'lr': 0.000828752236376816, 'layer1': 323, 'layer2': 445, 'layer3': 241}. Best is trial 8 with value: 0.8593369016165944.

Pseudomonas_Aeruginosa | Imipenem | Optuna:   4%|▍         | 9/200 [07:45<3:33:09, 66.96s/it, best=0.859][A
Pseudomonas_Aeruginosa | Imipenem | Optuna:   4%|▍         | 9/200 [07:45<3:33:09, 66.96s/it, best=0.859][A[I 2026-02-27 18:40:01,341] Trial 94 finished with value: 0.8026464016076629 and parameters: {'activation': 'tanh', 'solver': 'adam', 'lr': 1.0450189951569077e-05, 'layer1': 172, 'layer2': 228, 'layer3': 10}. Best is trial 55 with value: 0.8076668303114959.

Escherichia_Coli | Ciprofloxacin | Optuna:  48%|████▊     | 95/200 [3:52:30<5:21:38, 183.79s/it, best=0.808][A
Escherichia_Coli | Ciprofloxacin | Optuna:  48%|████▊     | 95/200 [3:52:30<5:21:38, 183.79s/it, best=0.808][A[I 2026-02-27 18:40:20,674] Trial 123 finished with value: 0.8263263784366204 and parameters: {'activation': 'identity', 'solver': 'adam', 'lr': 3.919793862756415e-05, 'layer1': 295, 'layer2': 499, 'layer3': 337}. Best is trial 91 with value: 0.8315336183309556.

Klebsiella_Pneumoniae | Ciprofloxacin | Optuna:  62%|██████▏   | 124/200 [3:52:50<2:45:23, 130.57s/it, best=0.832][A
Klebsiella_Pneumoniae | Ciprofloxacin | Optuna:  62%|██████▏   | 124/200 [3:52:50<2:45:23, 130.57s/it, best=0.832][A[I 2026-02-27 18:40:40,758] Trial 104 finished with value: 0.9066246795130976 and parameters: {'activation': 'identity', 'solver': 'adam', 'lr': 5.691175662470589e-05, 'layer1': 203, 'layer2': 460, 'layer3': 438}. Best is trial 84 with value: 0.9099428178723615.

Staphylococcus_Aureus | Oxacillin | Optuna:  52%|█████▎    | 105/200 [3:53:10<3:07:58, 118.72s/it, best=0.91][A
Staphylococcus_Aureus | Oxacillin | Optuna:  52%|█████▎    | 105/200 [3:53:10<3:07:58, 118.72s/it, best=0.91][A[I 2026-02-27 18:41:01,115] Trial 9 finished with value: 0.8079744801696751 and parameters: {'activation': 'tanh', 'solver': 'sgd', 'lr': 0.00012329098365270507, 'layer1': 219, 'layer2': 22, 'layer3': 62}. Best is trial 8 with value: 0.8593369016165944.

Pseudomonas_Aeruginosa | Imipenem | Optuna:   5%|▌         | 10/200 [08:55<3:34:49, 67.84s/it, best=0.859][A
Pseudomonas_Aeruginosa | Imipenem | Optuna:   5%|▌         | 10/200 [08:55<3:34:49, 67.84s/it, best=0.859][A[I 2026-02-27 18:41:24,272] Trial 10 finished with value: 0.8175565662034809 and parameters: {'activation': 'identity', 'solver': 'sgd', 'lr': 0.007553503645583194, 'layer1': 366, 'layer2': 492, 'layer3': 320}. Best is trial 8 with value: 0.8593369016165944.

Pseudomonas_Aeruginosa | Imipenem | Optuna:   6%|▌         | 11/200 [09:18<2:50:37, 54.16s/it, best=0.859][A
Pseudomonas_Aeruginosa | Imipenem | Optuna:   6%|▌         | 11/200 [09:18<2:50:37, 54.16s/it, best=0.859][A[I 2026-02-27 18:42:19,893] Trial 11 finished with value: 0.8586402983342989 and parameters: {'activation': 'relu', 'solver': 'adam', 'lr': 0.0013124793805688133, 'layer1': 150, 'layer2': 163, 'layer3': 284}. Best is trial 8 with value: 0.8593369016165944.

Pseudomonas_Aeruginosa | Imipenem | Optuna:   6%|▌         | 12/200 [10:14<2:51:06, 54.61s/it, best=0.859][A
Pseudomonas_Aeruginosa | Imipenem | Optuna:   6%|▌         | 12/200 [10:14<2:51:06, 54.61s/it, best=0.859][A[I 2026-02-27 18:42:29,475] Trial 105 finished with value: 0.9073264471080094 and parameters: {'activation': 'identity', 'solver': 'adam', 'lr': 0.0001438962381328397, 'layer1': 247, 'layer2': 254, 'layer3': 456}. Best is trial 84 with value: 0.9099428178723615.

Staphylococcus_Aureus | Oxacillin | Optuna:  53%|█████▎    | 106/200 [3:54:59<3:01:17, 115.72s/it, best=0.91][A
Staphylococcus_Aureus | Oxacillin | Optuna:  53%|█████▎    | 106/200 [3:54:59<3:01:17, 115.72s/it, best=0.91][A[I 2026-02-27 18:43:18,332] Trial 124 finished with value: 0.8270914953727211 and parameters: {'activation': 'identity', 'solver': 'adam', 'lr': 2.4224690023569828e-05, 'layer1': 439, 'layer2': 453, 'layer3': 248}. Best is trial 91 with value: 0.8315336183309556.

Klebsiella_Pneumoniae | Ciprofloxacin | Optuna:  62%|██████▎   | 125/200 [3:55:47<3:00:52, 144.69s/it, best=0.832][A
Klebsiella_Pneumoniae | Ciprofloxacin | Optuna:  62%|██████▎   | 125/200 [3:55:47<3:00:52, 144.69s/it, best=0.832][A[I 2026-02-27 18:43:26,790] Trial 12 finished with value: 0.8536677213381241 and parameters: {'activation': 'identity', 'solver': 'adam', 'lr': 0.00046544039809979403, 'layer1': 347, 'layer2': 434, 'layer3': 419}. Best is trial 8 with value: 0.8593369016165944.

Pseudomonas_Aeruginosa | Imipenem | Optuna:   6%|▋         | 13/200 [11:21<3:01:47, 58.33s/it, best=0.859][A
Pseudomonas_Aeruginosa | Imipenem | Optuna:   6%|▋         | 13/200 [11:21<3:01:47, 58.33s/it, best=0.859][A[I 2026-02-27 18:44:27,040] Trial 106 finished with value: 0.9079324352146821 and parameters: {'activation': 'identity', 'solver': 'adam', 'lr': 0.00037800063883104495, 'layer1': 231, 'layer2': 265, 'layer3': 465}. Best is trial 84 with value: 0.9099428178723615.

Staphylococcus_Aureus | Oxacillin | Optuna:  54%|█████▎    | 107/200 [3:56:56<3:00:13, 116.27s/it, best=0.91][A
Staphylococcus_Aureus | Oxacillin | Optuna:  54%|█████▎    | 107/200 [3:56:56<3:00:13, 116.27s/it, best=0.91][A[I 2026-02-27 18:44:44,293] Trial 13 finished with value: 0.8563603955838255 and parameters: {'activation': 'relu', 'solver': 'adam', 'lr': 0.00214516912368351, 'layer1': 494, 'layer2': 157, 'layer3': 209}. Best is trial 8 with value: 0.8593369016165944.

Pseudomonas_Aeruginosa | Imipenem | Optuna:   7%|▋         | 14/200 [12:38<3:18:46, 64.12s/it, best=0.859][A
Pseudomonas_Aeruginosa | Imipenem | Optuna:   7%|▋         | 14/200 [12:38<3:18:46, 64.12s/it, best=0.859][A[I 2026-02-27 18:45:40,770] Trial 95 finished with value: 0.8010193767241972 and parameters: {'activation': 'tanh', 'solver': 'adam', 'lr': 6.186057921676945e-06, 'layer1': 244, 'layer2': 184, 'layer3': 50}. Best is trial 55 with value: 0.8076668303114959.

Escherichia_Coli | Ciprofloxacin | Optuna:  48%|████▊     | 96/200 [3:58:10<6:39:30, 230.48s/it, best=0.808][A
Escherichia_Coli | Ciprofloxacin | Optuna:  48%|████▊     | 96/200 [3:58:10<6:39:30, 230.48s/it, best=0.808][A[I 2026-02-27 18:45:41,965] Trial 125 finished with value: 0.8101733141876661 and parameters: {'activation': 'identity', 'solver': 'adam', 'lr': 2.3784953033350365e-05, 'layer1': 439, 'layer2': 424, 'layer3': 243}. Best is trial 91 with value: 0.8315336183309556.

Klebsiella_Pneumoniae | Ciprofloxacin | Optuna:  63%|██████▎   | 126/200 [3:58:11<2:58:03, 144.38s/it, best=0.832][A
Klebsiella_Pneumoniae | Ciprofloxacin | Optuna:  63%|██████▎   | 126/200 [3:58:11<2:58:03, 144.38s/it, best=0.832][A[I 2026-02-27 18:45:46,025] Trial 14 finished with value: 0.8540071960932754 and parameters: {'activation': 'relu', 'solver': 'adam', 'lr': 0.0002523488569948534, 'layer1': 178, 'layer2': 411, 'layer3': 11}. Best is trial 8 with value: 0.8593369016165944.

Pseudomonas_Aeruginosa | Imipenem | Optuna:   8%|▊         | 15/200 [13:40<3:15:29, 63.40s/it, best=0.859][A
Pseudomonas_Aeruginosa | Imipenem | Optuna:   8%|▊         | 15/200 [13:40<3:15:29, 63.40s/it, best=0.859][A[I 2026-02-27 18:46:38,812] Trial 15 finished with value: 0.8589547361118559 and parameters: {'activation': 'identity', 'solver': 'adam', 'lr': 0.0012799605038675433, 'layer1': 27, 'layer2': 140, 'layer3': 119}. Best is trial 8 with value: 0.8593369016165944.

Pseudomonas_Aeruginosa | Imipenem | Optuna:   8%|▊         | 16/200 [14:33<3:04:38, 60.21s/it, best=0.859][A
Pseudomonas_Aeruginosa | Imipenem | Optuna:   8%|▊         | 16/200 [14:33<3:04:38, 60.21s/it, best=0.859][A[I 2026-02-27 18:47:00,337] Trial 107 finished with value: 0.9039971934369451 and parameters: {'activation': 'relu', 'solver': 'adam', 'lr': 4.843344979409407e-05, 'layer1': 324, 'layer2': 223, 'layer3': 496}. Best is trial 84 with value: 0.9099428178723615.

Staphylococcus_Aureus | Oxacillin | Optuna:  54%|█████▍    | 108/200 [3:59:30<3:15:19, 127.38s/it, best=0.91][A
Staphylococcus_Aureus | Oxacillin | Optuna:  54%|█████▍    | 108/200 [3:59:30<3:15:19, 127.38s/it, best=0.91][A[I 2026-02-27 18:47:51,393] Trial 126 finished with value: 0.8242152834293565 and parameters: {'activation': 'identity', 'solver': 'adam', 'lr': 0.00013537824327826493, 'layer1': 473, 'layer2': 450, 'layer3': 197}. Best is trial 91 with value: 0.8315336183309556.

Klebsiella_Pneumoniae | Ciprofloxacin | Optuna:  64%|██████▎   | 127/200 [4:00:20<2:50:12, 139.89s/it, best=0.832][A
Klebsiella_Pneumoniae | Ciprofloxacin | Optuna:  64%|██████▎   | 127/200 [4:00:20<2:50:12, 139.89s/it, best=0.832][A[I 2026-02-27 18:47:55,529] Trial 16 finished with value: 0.842579781017557 and parameters: {'activation': 'tanh', 'solver': 'adam', 'lr': 0.008761443946772317, 'layer1': 328, 'layer2': 217, 'layer3': 387}. Best is trial 8 with value: 0.8593369016165944.

Pseudomonas_Aeruginosa | Imipenem | Optuna:   8%|▊         | 17/200 [15:49<3:18:46, 65.17s/it, best=0.859][A
Pseudomonas_Aeruginosa | Imipenem | Optuna:   8%|▊         | 17/200 [15:49<3:18:46, 65.17s/it, best=0.859][A[I 2026-02-27 18:48:15,737] Trial 17 finished with value: 0.8175565662034809 and parameters: {'activation': 'logistic', 'solver': 'adam', 'lr': 6.446221903608035e-05, 'layer1': 91, 'layer2': 359, 'layer3': 273}. Best is trial 8 with value: 0.8593369016165944.

Pseudomonas_Aeruginosa | Imipenem | Optuna:   9%|▉         | 18/200 [16:09<2:36:42, 51.66s/it, best=0.859][A
Pseudomonas_Aeruginosa | Imipenem | Optuna:   9%|▉         | 18/200 [16:09<2:36:42, 51.66s/it, best=0.859][A[I 2026-02-27 18:48:46,956] Trial 108 finished with value: 0.9049136504194779 and parameters: {'activation': 'logistic', 'solver': 'adam', 'lr': 0.0002586821614807128, 'layer1': 212, 'layer2': 175, 'layer3': 213}. Best is trial 84 with value: 0.9099428178723615.

Staphylococcus_Aureus | Oxacillin | Optuna:  55%|█████▍    | 109/200 [4:01:16<3:03:44, 121.15s/it, best=0.91][A
Staphylococcus_Aureus | Oxacillin | Optuna:  55%|█████▍    | 109/200 [4:01:16<3:03:44, 121.15s/it, best=0.91][A[I 2026-02-27 18:48:48,623] Trial 18 finished with value: 0.8176606709720691 and parameters: {'activation': 'identity', 'solver': 'sgd', 'lr': 0.0005384043963252403, 'layer1': 308, 'layer2': 486, 'layer3': 196}. Best is trial 8 with value: 0.8593369016165944.

Pseudomonas_Aeruginosa | Imipenem | Optuna:  10%|▉         | 19/200 [16:42<2:18:49, 46.02s/it, best=0.859][A
Pseudomonas_Aeruginosa | Imipenem | Optuna:  10%|▉         | 19/200 [16:42<2:18:49, 46.02s/it, best=0.859][A[I 2026-02-27 18:48:55,584] Trial 127 finished with value: 0.7829356070313976 and parameters: {'activation': 'identity', 'solver': 'adam', 'lr': 1.0830672202767949e-05, 'layer1': 268, 'layer2': 437, 'layer3': 128}. Best is trial 91 with value: 0.8315336183309556.

Klebsiella_Pneumoniae | Ciprofloxacin | Optuna:  64%|██████▍   | 128/200 [4:01:25<2:20:37, 117.18s/it, best=0.832][A
Klebsiella_Pneumoniae | Ciprofloxacin | Optuna:  64%|██████▍   | 128/200 [4:01:25<2:20:37, 117.18s/it, best=0.832][A[I 2026-02-27 18:49:20,990] Trial 96 finished with value: 0.798595060678901 and parameters: {'activation': 'relu', 'solver': 'adam', 'lr': 1.610207333473351e-05, 'layer1': 198, 'layer2': 249, 'layer3': 300}. Best is trial 55 with value: 0.8076668303114959.

Escherichia_Coli | Ciprofloxacin | Optuna:  48%|████▊     | 97/200 [4:01:50<6:30:22, 227.40s/it, best=0.808][A
Escherichia_Coli | Ciprofloxacin | Optuna:  48%|████▊     | 97/200 [4:01:50<6:30:22, 227.40s/it, best=0.808][A[I 2026-02-27 18:49:35,246] Trial 128 finished with value: 0.7466500312967053 and parameters: {'activation': 'relu', 'solver': 'adam', 'lr': 2.152369437467957e-06, 'layer1': 459, 'layer2': 411, 'layer3': 210}. Best is trial 91 with value: 0.8315336183309556.

Klebsiella_Pneumoniae | Ciprofloxacin | Optuna:  64%|██████▍   | 129/200 [4:02:04<1:51:08, 93.93s/it, best=0.832] [A
Klebsiella_Pneumoniae | Ciprofloxacin | Optuna:  64%|██████▍   | 129/200 [4:02:04<1:51:08, 93.93s/it, best=0.832][A[I 2026-02-27 18:49:40,493] Trial 19 finished with value: 0.8620352129182731 and parameters: {'activation': 'relu', 'solver': 'adam', 'lr': 0.0028172981645942226, 'layer1': 200, 'layer2': 93, 'layer3': 87}. Best is trial 19 with value: 0.8620352129182731.

Pseudomonas_Aeruginosa | Imipenem | Optuna:  10%|█         | 20/200 [17:34<2:23:19, 47.78s/it, best=0.859][A
Pseudomonas_Aeruginosa | Imipenem | Optuna:  10%|█         | 20/200 [17:34<2:23:19, 47.78s/it, best=0.862][A[I 2026-02-27 18:50:24,020] Trial 20 finished with value: 0.8582607807400201 and parameters: {'activation': 'relu', 'solver': 'adam', 'lr': 0.003988956930078274, 'layer1': 203, 'layer2': 119, 'layer3': 134}. Best is trial 19 with value: 0.8620352129182731.

Pseudomonas_Aeruginosa | Imipenem | Optuna:  10%|█         | 21/200 [18:18<2:18:43, 46.50s/it, best=0.862][A
Pseudomonas_Aeruginosa | Imipenem | Optuna:  10%|█         | 21/200 [18:18<2:18:43, 46.50s/it, best=0.862][A[I 2026-02-27 18:50:34,900] Trial 109 finished with value: 0.9052145140388973 and parameters: {'activation': 'identity', 'solver': 'adam', 'lr': 0.0011329014330192975, 'layer1': 339, 'layer2': 438, 'layer3': 309}. Best is trial 84 with value: 0.9099428178723615.

Staphylococcus_Aureus | Oxacillin | Optuna:  55%|█████▌    | 110/200 [4:03:04<2:55:47, 117.19s/it, best=0.91][A
Staphylococcus_Aureus | Oxacillin | Optuna:  55%|█████▌    | 110/200 [4:03:04<2:55:47, 117.19s/it, best=0.91][A[I 2026-02-27 18:51:06,883] Trial 21 finished with value: 0.8601115793569267 and parameters: {'activation': 'relu', 'solver': 'adam', 'lr': 0.002677173920366135, 'layer1': 132, 'layer2': 83, 'layer3': 81}. Best is trial 19 with value: 0.8620352129182731.

Pseudomonas_Aeruginosa | Imipenem | Optuna:  11%|█         | 22/200 [19:01<2:14:42, 45.41s/it, best=0.862][A
Pseudomonas_Aeruginosa | Imipenem | Optuna:  11%|█         | 22/200 [19:01<2:14:42, 45.41s/it, best=0.862][A[I 2026-02-27 18:51:43,043] Trial 129 finished with value: 0.8287903051544598 and parameters: {'activation': 'identity', 'solver': 'adam', 'lr': 0.0031056313944723257, 'layer1': 391, 'layer2': 466, 'layer3': 249}. Best is trial 91 with value: 0.8315336183309556.

Klebsiella_Pneumoniae | Ciprofloxacin | Optuna:  65%|██████▌   | 130/200 [4:04:12<2:01:26, 104.09s/it, best=0.832][A
Klebsiella_Pneumoniae | Ciprofloxacin | Optuna:  65%|██████▌   | 130/200 [4:04:12<2:01:26, 104.09s/it, best=0.832][A[I 2026-02-27 18:51:51,413] Trial 22 finished with value: 0.86108812823939 and parameters: {'activation': 'relu', 'solver': 'adam', 'lr': 0.0028045818274756978, 'layer1': 151, 'layer2': 85, 'layer3': 86}. Best is trial 19 with value: 0.8620352129182731.

Pseudomonas_Aeruginosa | Imipenem | Optuna:  12%|█▏        | 23/200 [19:45<2:13:10, 45.15s/it, best=0.862][A
Pseudomonas_Aeruginosa | Imipenem | Optuna:  12%|█▏        | 23/200 [19:45<2:13:10, 45.15s/it, best=0.862][A[I 2026-02-27 18:52:07,722] Trial 97 finished with value: 0.8047791526675857 and parameters: {'activation': 'tanh', 'solver': 'adam', 'lr': 2.2395891081296104e-05, 'layer1': 214, 'layer2': 235, 'layer3': 23}. Best is trial 55 with value: 0.8076668303114959.

Escherichia_Coli | Ciprofloxacin | Optuna:  49%|████▉     | 98/200 [4:04:37<5:55:38, 209.20s/it, best=0.808][A
