[I 2026-02-28 06:48:46,014] Trial 175 finished with value: 0.8935538363960001 and parameters: {'activation': 'relu', 'solver': 'adam', 'lr': 4.70543718283982e-05, 'layer1': 493, 'layer2': 166, 'layer3': 14}. Best is trial 137 with value: 0.8979080367540411.

Escherichia_Coli | Ceftriaxone | Optuna:  88%|████████▊ | 176/200 [7:38:47<1:17:48, 194.51s/it, best=0.898][A
Escherichia_Coli | Ceftriaxone | Optuna:  88%|████████▊ | 176/200 [7:38:47<1:17:48, 194.51s/it, best=0.898][A[I 2026-02-28 06:49:06,287] Trial 152 finished with value: 0.9262650597537956 and parameters: {'activation': 'identity', 'solver': 'adam', 'lr': 0.00020829222368271407, 'layer1': 388, 'layer2': 76, 'layer3': 59}. Best is trial 77 with value: 0.9283869597728589.

Staphylococcus_Aureus | Fusidic acid | Optuna:  76%|███████▋  | 153/200 [4:08:15<1:14:07, 94.62s/it, best=0.928] [A
Staphylococcus_Aureus | Fusidic acid | Optuna:  76%|███████▋  | 153/200 [4:08:15<1:14:07, 94.62s/it, best=0.928][A[I 2026-02-28 06:49:20,295] Trial 56 finished with value: 0.9812111270203857 and parameters: {'activation': 'relu', 'solver': 'adam', 'lr': 0.0001262688524210684, 'layer1': 476, 'layer2': 168, 'layer3': 463}. Best is trial 27 with value: 0.9821048418402821.

Klebsiella_Pneumoniae | Meropenem | Optuna:  28%|██▊       | 57/200 [50:00<2:06:07, 52.92s/it, best=0.982][A
Klebsiella_Pneumoniae | Meropenem | Optuna:  28%|██▊       | 57/200 [50:00<2:06:07, 52.92s/it, best=0.982][A[I 2026-02-28 06:49:42,043] Trial 194 finished with value: 0.8648337657264935 and parameters: {'activation': 'identity', 'solver': 'adam', 'lr': 0.002174398047749853, 'layer1': 312, 'layer2': 301, 'layer3': 465}. Best is trial 140 with value: 0.8705750568176336.
Pseudomonas_Aeruginosa | LPS | Optuna:  98%|█████████▊| 195/200 [4:44:44<07:24, 88.90s/it, best=0.871]Pseudomonas_Aeruginosa | LPS | Optuna:  98%|█████████▊| 195/200 [4:44:44<07:24, 88.90s/it, best=0.871]/export/usuarios01/egarroyo/MALDI_for_AMR_prediction/venv/lib/python3.13/site-packages/sklearn/model_selection/_split.py:813: UserWarning: The least populated class in y has only 4 members, which is less than n_splits=5.
  warnings.warn(
[I 2026-02-28 06:49:57,538] Trial 57 finished with value: 0.9789047140153248 and parameters: {'activation': 'identity', 'solver': 'adam', 'lr': 0.0015213915070129654, 'layer1': 243, 'layer2': 280, 'layer3': 360}. Best is trial 27 with value: 0.9821048418402821.

Klebsiella_Pneumoniae | Meropenem | Optuna:  29%|██▉       | 58/200 [50:38<1:54:06, 48.22s/it, best=0.982][A
Klebsiella_Pneumoniae | Meropenem | Optuna:  29%|██▉       | 58/200 [50:38<1:54:06, 48.22s/it, best=0.982][A[I 2026-02-28 06:50:25,105] Trial 153 finished with value: 0.9275999552738394 and parameters: {'activation': 'identity', 'solver': 'adam', 'lr': 9.660606681275055e-05, 'layer1': 162, 'layer2': 112, 'layer3': 90}. Best is trial 77 with value: 0.9283869597728589.

Staphylococcus_Aureus | Fusidic acid | Optuna:  77%|███████▋  | 154/200 [4:09:34<1:08:54, 89.88s/it, best=0.928][A
Staphylococcus_Aureus | Fusidic acid | Optuna:  77%|███████▋  | 154/200 [4:09:34<1:08:54, 89.88s/it, best=0.928][A[I 2026-02-28 06:50:26,021] Trial 58 finished with value: 0.9767069569332589 and parameters: {'activation': 'relu', 'solver': 'sgd', 'lr': 0.0004664229982282119, 'layer1': 278, 'layer2': 415, 'layer3': 480}. Best is trial 27 with value: 0.9821048418402821.

Klebsiella_Pneumoniae | Meropenem | Optuna:  30%|██▉       | 59/200 [51:06<1:39:23, 42.30s/it, best=0.982][A
Klebsiella_Pneumoniae | Meropenem | Optuna:  30%|██▉       | 59/200 [51:06<1:39:23, 42.30s/it, best=0.982][A[I 2026-02-28 06:51:17,645] Trial 195 finished with value: 0.8627064795901461 and parameters: {'activation': 'identity', 'solver': 'adam', 'lr': 0.001278657521095497, 'layer1': 323, 'layer2': 209, 'layer3': 433}. Best is trial 140 with value: 0.8705750568176336.
Pseudomonas_Aeruginosa | LPS | Optuna:  98%|█████████▊| 196/200 [4:46:19<06:03, 90.91s/it, best=0.871]Pseudomonas_Aeruginosa | LPS | Optuna:  98%|█████████▊| 196/200 [4:46:19<06:03, 90.91s/it, best=0.871]/export/usuarios01/egarroyo/MALDI_for_AMR_prediction/venv/lib/python3.13/site-packages/sklearn/model_selection/_split.py:813: UserWarning: The least populated class in y has only 4 members, which is less than n_splits=5.
  warnings.warn(
[I 2026-02-28 06:51:19,776] Trial 59 finished with value: 0.9790385697649409 and parameters: {'activation': 'logistic', 'solver': 'adam', 'lr': 0.0008933908145743768, 'layer1': 429, 'layer2': 263, 'layer3': 448}. Best is trial 27 with value: 0.9821048418402821.

Klebsiella_Pneumoniae | Meropenem | Optuna:  30%|███       | 60/200 [52:00<1:46:42, 45.73s/it, best=0.982][A
Klebsiella_Pneumoniae | Meropenem | Optuna:  30%|███       | 60/200 [52:00<1:46:42, 45.73s/it, best=0.982][A[I 2026-02-28 06:51:21,616] Trial 176 finished with value: 0.887417714873223 and parameters: {'activation': 'identity', 'solver': 'adam', 'lr': 5.6213974517879796e-05, 'layer1': 460, 'layer2': 154, 'layer3': 32}. Best is trial 137 with value: 0.8979080367540411.

Escherichia_Coli | Ceftriaxone | Optuna:  88%|████████▊ | 177/200 [7:41:23<1:10:05, 182.84s/it, best=0.898][A
Escherichia_Coli | Ceftriaxone | Optuna:  88%|████████▊ | 177/200 [7:41:23<1:10:05, 182.84s/it, best=0.898][A[I 2026-02-28 06:52:02,468] Trial 60 finished with value: 0.9790971754622527 and parameters: {'activation': 'relu', 'solver': 'adam', 'lr': 0.0002888845700570665, 'layer1': 307, 'layer2': 229, 'layer3': 246}. Best is trial 27 with value: 0.9821048418402821.

Klebsiella_Pneumoniae | Meropenem | Optuna:  30%|███       | 61/200 [52:42<1:43:50, 44.82s/it, best=0.982][A
Klebsiella_Pneumoniae | Meropenem | Optuna:  30%|███       | 61/200 [52:42<1:43:50, 44.82s/it, best=0.982][A[I 2026-02-28 06:52:16,346] Trial 154 finished with value: 0.9268260785260323 and parameters: {'activation': 'identity', 'solver': 'adam', 'lr': 9.256526559401083e-05, 'layer1': 356, 'layer2': 134, 'layer3': 103}. Best is trial 77 with value: 0.9283869597728589.

Staphylococcus_Aureus | Fusidic acid | Optuna:  78%|███████▊  | 155/200 [4:11:25<1:12:12, 96.29s/it, best=0.928][A
Staphylococcus_Aureus | Fusidic acid | Optuna:  78%|███████▊  | 155/200 [4:11:25<1:12:12, 96.29s/it, best=0.928][A[I 2026-02-28 06:52:36,532] Trial 196 finished with value: 0.8621544242077231 and parameters: {'activation': 'identity', 'solver': 'adam', 'lr': 0.0015265345179621863, 'layer1': 308, 'layer2': 273, 'layer3': 284}. Best is trial 140 with value: 0.8705750568176336.
Pseudomonas_Aeruginosa | LPS | Optuna:  98%|█████████▊| 197/200 [4:47:38<04:21, 87.31s/it, best=0.871]Pseudomonas_Aeruginosa | LPS | Optuna:  98%|█████████▊| 197/200 [4:47:38<04:21, 87.31s/it, best=0.871]/export/usuarios01/egarroyo/MALDI_for_AMR_prediction/venv/lib/python3.13/site-packages/sklearn/model_selection/_split.py:813: UserWarning: The least populated class in y has only 4 members, which is less than n_splits=5.
  warnings.warn(
[I 2026-02-28 06:52:51,784] Trial 61 finished with value: 0.9791641975099967 and parameters: {'activation': 'relu', 'solver': 'adam', 'lr': 0.00013363467111926356, 'layer1': 479, 'layer2': 160, 'layer3': 457}. Best is trial 27 with value: 0.9821048418402821.

Klebsiella_Pneumoniae | Meropenem | Optuna:  31%|███       | 62/200 [53:32<1:46:11, 46.17s/it, best=0.982][A
Klebsiella_Pneumoniae | Meropenem | Optuna:  31%|███       | 62/200 [53:32<1:46:11, 46.17s/it, best=0.982][A[I 2026-02-28 06:53:04,889] Trial 197 finished with value: 0.8270493748170094 and parameters: {'activation': 'identity', 'solver': 'sgd', 'lr': 0.00175054250087966, 'layer1': 281, 'layer2': 299, 'layer3': 451}. Best is trial 140 with value: 0.8705750568176336.
Pseudomonas_Aeruginosa | LPS | Optuna:  99%|█████████▉| 198/200 [4:48:06<02:19, 69.62s/it, best=0.871]Pseudomonas_Aeruginosa | LPS | Optuna:  99%|█████████▉| 198/200 [4:48:06<02:19, 69.62s/it, best=0.871]/export/usuarios01/egarroyo/MALDI_for_AMR_prediction/venv/lib/python3.13/site-packages/sklearn/model_selection/_split.py:813: UserWarning: The least populated class in y has only 4 members, which is less than n_splits=5.
  warnings.warn(
[I 2026-02-28 06:53:07,162] Trial 155 finished with value: 0.9154461516663552 and parameters: {'activation': 'identity', 'solver': 'adam', 'lr': 4.570282440159236e-05, 'layer1': 51, 'layer2': 113, 'layer3': 117}. Best is trial 77 with value: 0.9283869597728589.

Staphylococcus_Aureus | Fusidic acid | Optuna:  78%|███████▊  | 156/200 [4:12:16<1:00:36, 82.65s/it, best=0.928][A
Staphylococcus_Aureus | Fusidic acid | Optuna:  78%|███████▊  | 156/200 [4:12:16<1:00:36, 82.65s/it, best=0.928][A[I 2026-02-28 06:53:36,949] Trial 62 finished with value: 0.9785281590139275 and parameters: {'activation': 'relu', 'solver': 'adam', 'lr': 0.00012437781571956303, 'layer1': 447, 'layer2': 125, 'layer3': 484}. Best is trial 27 with value: 0.9821048418402821.

Klebsiella_Pneumoniae | Meropenem | Optuna:  32%|███▏      | 63/200 [54:17<1:44:43, 45.87s/it, best=0.982][A
Klebsiella_Pneumoniae | Meropenem | Optuna:  32%|███▏      | 63/200 [54:17<1:44:43, 45.87s/it, best=0.982][A[I 2026-02-28 06:53:50,255] Trial 177 finished with value: 0.8939135186834178 and parameters: {'activation': 'relu', 'solver': 'adam', 'lr': 7.10391083314332e-05, 'layer1': 500, 'layer2': 319, 'layer3': 59}. Best is trial 137 with value: 0.8979080367540411.

Escherichia_Coli | Ceftriaxone | Optuna:  89%|████████▉ | 178/200 [7:43:51<1:03:16, 172.58s/it, best=0.898][A
Escherichia_Coli | Ceftriaxone | Optuna:  89%|████████▉ | 178/200 [7:43:51<1:03:16, 172.58s/it, best=0.898][A[I 2026-02-28 06:54:20,573] Trial 156 finished with value: 0.9221263531669944 and parameters: {'activation': 'identity', 'solver': 'adam', 'lr': 0.00010439971825497294, 'layer1': 122, 'layer2': 99, 'layer3': 166}. Best is trial 77 with value: 0.9283869597728589.

Staphylococcus_Aureus | Fusidic acid | Optuna:  78%|███████▊  | 157/200 [4:13:29<57:14, 79.88s/it, best=0.928]  [A
Staphylococcus_Aureus | Fusidic acid | Optuna:  78%|███████▊  | 157/200 [4:13:29<57:14, 79.88s/it, best=0.928][A[I 2026-02-28 06:54:29,386] Trial 63 finished with value: 0.9792247693275324 and parameters: {'activation': 'relu', 'solver': 'adam', 'lr': 0.0006685854023372435, 'layer1': 473, 'layer2': 183, 'layer3': 471}. Best is trial 27 with value: 0.9821048418402821.

Klebsiella_Pneumoniae | Meropenem | Optuna:  32%|███▏      | 64/200 [55:09<1:48:26, 47.84s/it, best=0.982][A
Klebsiella_Pneumoniae | Meropenem | Optuna:  32%|███▏      | 64/200 [55:09<1:48:26, 47.84s/it, best=0.982][A[I 2026-02-28 06:54:43,748] Trial 198 finished with value: 0.8634889427764044 and parameters: {'activation': 'identity', 'solver': 'adam', 'lr': 0.0024345928946256, 'layer1': 329, 'layer2': 338, 'layer3': 466}. Best is trial 140 with value: 0.8705750568176336.
Pseudomonas_Aeruginosa | LPS | Optuna: 100%|█████████▉| 199/200 [4:49:45<01:18, 78.39s/it, best=0.871]Pseudomonas_Aeruginosa | LPS | Optuna: 100%|█████████▉| 199/200 [4:49:45<01:18, 78.39s/it, best=0.871]/export/usuarios01/egarroyo/MALDI_for_AMR_prediction/venv/lib/python3.13/site-packages/sklearn/model_selection/_split.py:813: UserWarning: The least populated class in y has only 4 members, which is less than n_splits=5.
  warnings.warn(
[I 2026-02-28 06:55:15,146] Trial 64 finished with value: 0.9767069569332589 and parameters: {'activation': 'relu', 'solver': 'adam', 'lr': 1.099303223166819e-06, 'layer1': 454, 'layer2': 210, 'layer3': 402}. Best is trial 27 with value: 0.9821048418402821.

Klebsiella_Pneumoniae | Meropenem | Optuna:  32%|███▎      | 65/200 [55:55<1:46:14, 47.22s/it, best=0.982][A
Klebsiella_Pneumoniae | Meropenem | Optuna:  32%|███▎      | 65/200 [55:55<1:46:14, 47.22s/it, best=0.982][A[I 2026-02-28 06:55:32,832] Trial 157 finished with value: 0.9269977125367979 and parameters: {'activation': 'identity', 'solver': 'adam', 'lr': 0.00015858349956640873, 'layer1': 168, 'layer2': 88, 'layer3': 81}. Best is trial 77 with value: 0.9283869597728589.

Staphylococcus_Aureus | Fusidic acid | Optuna:  79%|███████▉  | 158/200 [4:14:42<54:18, 77.59s/it, best=0.928][A
Staphylococcus_Aureus | Fusidic acid | Optuna:  79%|███████▉  | 158/200 [4:14:42<54:18, 77.59s/it, best=0.928][A[I 2026-02-28 06:55:59,176] Trial 199 finished with value: 0.8548890870012071 and parameters: {'activation': 'tanh', 'solver': 'adam', 'lr': 0.0011114987233385664, 'layer1': 296, 'layer2': 285, 'layer3': 439}. Best is trial 140 with value: 0.8705750568176336.
Pseudomonas_Aeruginosa | LPS | Optuna: 100%|██████████| 200/200 [4:51:01<00:00, 77.50s/it, best=0.871]Pseudomonas_Aeruginosa | LPS | Optuna: 100%|██████████| 200/200 [4:51:01<00:00, 77.50s/it, best=0.871]                                                                                                      [Pseudomonas_Aeruginosa | LPS] [OPTUNA DONE] Best CV WF1=0.8706 | params={'activation': 'identity', 'solver': 'adam', 'lr': 0.003622633001993711, 'layer1': 34, 'layer2': 443, 'layer3': 467}
[Pseudomonas_Aeruginosa | LPS] Retraining with validation early stopping (10% split)...
[Pseudomonas_Aeruginosa | LPS] Testing...
[Pseudomonas_Aeruginosa | LPS] [TEST] WF1=0.8440 | ACC=0.8837 | HL=0.1163 | best_val_WF1=0.8613

[Pseudomonas_Aeruginosa] ===== Direct multilabel training =====
[I 2026-02-28 06:56:13,734] A new study created in memory with name: no-name-de10c2ae-56d2-4c7f-baa3-aa028cdf9c03
Pseudomonas_Aeruginosa | DirectMulti | Optuna:   0%|          | 0/200 [00:00<?, ?it/s]/export/usuarios01/egarroyo/MALDI_for_AMR_prediction/venv/lib/python3.13/site-packages/sklearn/model_selection/_split.py:813: UserWarning: The least populated class in y has only 4 members, which is less than n_splits=5.
  warnings.warn(
[I 2026-02-28 06:56:29,558] Trial 65 finished with value: 0.9811951032788754 and parameters: {'activation': 'relu', 'solver': 'adam', 'lr': 0.0003721419319454462, 'layer1': 482, 'layer2': 148, 'layer3': 500}. Best is trial 27 with value: 0.9821048418402821.

Klebsiella_Pneumoniae | Meropenem | Optuna:  33%|███▎      | 66/200 [57:10<2:03:40, 55.37s/it, best=0.982][A
Klebsiella_Pneumoniae | Meropenem | Optuna:  33%|███▎      | 66/200 [57:10<2:03:40, 55.37s/it, best=0.982][A[I 2026-02-28 06:56:58,082] Trial 0 finished with value: 0.5087625834858446 and parameters: {'activation': 'logistic', 'solver': 'sgd', 'lr': 1.7073967431528114e-06, 'layer1': 435, 'layer2': 305, 'layer3': 357}. Best is trial 0 with value: 0.5087625834858446.
Pseudomonas_Aeruginosa | DirectMulti | Optuna:   0%|          | 1/200 [00:44<2:27:05, 44.35s/it]Pseudomonas_Aeruginosa | DirectMulti | Optuna:   0%|          | 1/200 [00:44<2:27:05, 44.35s/it, best=0.509]/export/usuarios01/egarroyo/MALDI_for_AMR_prediction/venv/lib/python3.13/site-packages/sklearn/model_selection/_split.py:813: UserWarning: The least populated class in y has only 4 members, which is less than n_splits=5.
  warnings.warn(
[I 2026-02-28 06:57:23,656] Trial 158 finished with value: 0.9253814164585183 and parameters: {'activation': 'identity', 'solver': 'adam', 'lr': 7.012916040124557e-05, 'layer1': 407, 'layer2': 155, 'layer3': 127}. Best is trial 77 with value: 0.9283869597728589.

Staphylococcus_Aureus | Fusidic acid | Optuna:  80%|███████▉  | 159/200 [4:16:32<59:49, 87.56s/it, best=0.928][A
Staphylococcus_Aureus | Fusidic acid | Optuna:  80%|███████▉  | 159/200 [4:16:32<59:49, 87.56s/it, best=0.928][A[I 2026-02-28 06:57:25,267] Trial 66 finished with value: 0.9792175770098126 and parameters: {'activation': 'relu', 'solver': 'adam', 'lr': 7.68777454653095e-05, 'layer1': 412, 'layer2': 182, 'layer3': 429}. Best is trial 27 with value: 0.9821048418402821.

Klebsiella_Pneumoniae | Meropenem | Optuna:  34%|███▎      | 67/200 [58:05<2:02:58, 55.47s/it, best=0.982][A
Klebsiella_Pneumoniae | Meropenem | Optuna:  34%|███▎      | 67/200 [58:05<2:02:58, 55.47s/it, best=0.982][A[I 2026-02-28 06:57:25,519] Trial 1 finished with value: 0.8255018342260501 and parameters: {'activation': 'logistic', 'solver': 'adam', 'lr': 1.6480446427978994e-05, 'layer1': 267, 'layer2': 222, 'layer3': 152}. Best is trial 1 with value: 0.8255018342260501.
Pseudomonas_Aeruginosa | DirectMulti | Optuna:   1%|          | 2/200 [01:11<1:53:31, 34.40s/it, best=0.509]Pseudomonas_Aeruginosa | DirectMulti | Optuna:   1%|          | 2/200 [01:11<1:53:31, 34.40s/it, best=0.826]/export/usuarios01/egarroyo/MALDI_for_AMR_prediction/venv/lib/python3.13/site-packages/sklearn/model_selection/_split.py:813: UserWarning: The least populated class in y has only 4 members, which is less than n_splits=5.
  warnings.warn(
[I 2026-02-28 06:58:19,969] Trial 178 finished with value: 0.8939480420205278 and parameters: {'activation': 'relu', 'solver': 'adam', 'lr': 2.280325180713958e-05, 'layer1': 439, 'layer2': 110, 'layer3': 11}. Best is trial 137 with value: 0.8979080367540411.

Escherichia_Coli | Ceftriaxone | Optuna:  90%|████████▉ | 179/200 [7:48:21<1:10:36, 201.72s/it, best=0.898][A
Escherichia_Coli | Ceftriaxone | Optuna:  90%|████████▉ | 179/200 [7:48:21<1:10:36, 201.72s/it, best=0.898][A[I 2026-02-28 06:58:20,599] Trial 67 finished with value: 0.9805430335017666 and parameters: {'activation': 'tanh', 'solver': 'adam', 'lr': 0.0010835168292917103, 'layer1': 500, 'layer2': 252, 'layer3': 366}. Best is trial 27 with value: 0.9821048418402821.

Klebsiella_Pneumoniae | Meropenem | Optuna:  34%|███▍      | 68/200 [59:01<2:01:57, 55.43s/it, best=0.982][A
Klebsiella_Pneumoniae | Meropenem | Optuna:  34%|███▍      | 68/200 [59:01<2:01:57, 55.43s/it, best=0.982][A[I 2026-02-28 06:58:44,694] Trial 159 finished with value: 0.9258176329883969 and parameters: {'activation': 'identity', 'solver': 'adam', 'lr': 5.525986960879382e-05, 'layer1': 180, 'layer2': 428, 'layer3': 68}. Best is trial 77 with value: 0.9283869597728589.

Staphylococcus_Aureus | Fusidic acid | Optuna:  80%|████████  | 160/200 [4:17:53<57:04, 85.60s/it, best=0.928][A
Staphylococcus_Aureus | Fusidic acid | Optuna:  80%|████████  | 160/200 [4:17:53<57:04, 85.60s/it, best=0.928][A[I 2026-02-28 06:58:57,425] Trial 68 finished with value: 0.9768227246062476 and parameters: {'activation': 'relu', 'solver': 'sgd', 'lr': 0.00015560880775356196, 'layer1': 464, 'layer2': 312, 'layer3': 461}. Best is trial 27 with value: 0.9821048418402821.

Klebsiella_Pneumoniae | Meropenem | Optuna:  34%|███▍      | 69/200 [59:37<1:48:50, 49.85s/it, best=0.982][A
Klebsiella_Pneumoniae | Meropenem | Optuna:  34%|███▍      | 69/200 [59:37<1:48:50, 49.85s/it, best=0.982][A[I 2026-02-28 06:59:01,087] Trial 2 finished with value: 0.8353664179654814 and parameters: {'activation': 'identity', 'solver': 'adam', 'lr': 6.290644294586145e-06, 'layer1': 262, 'layer2': 300, 'layer3': 32}. Best is trial 2 with value: 0.8353664179654814.
Pseudomonas_Aeruginosa | DirectMulti | Optuna:   2%|▏         | 3/200 [02:47<3:24:39, 62.33s/it, best=0.826]Pseudomonas_Aeruginosa | DirectMulti | Optuna:   2%|▏         | 3/200 [02:47<3:24:39, 62.33s/it, best=0.835]/export/usuarios01/egarroyo/MALDI_for_AMR_prediction/venv/lib/python3.13/site-packages/sklearn/model_selection/_split.py:813: UserWarning: The least populated class in y has only 4 members, which is less than n_splits=5.
  warnings.warn(
[I 2026-02-28 06:59:41,383] Trial 69 finished with value: 0.9792044863226496 and parameters: {'activation': 'relu', 'solver': 'adam', 'lr': 0.0004838070752795364, 'layer1': 372, 'layer2': 84, 'layer3': 433}. Best is trial 27 with value: 0.9821048418402821.

Klebsiella_Pneumoniae | Meropenem | Optuna:  35%|███▌      | 70/200 [1:00:21<1:44:10, 48.08s/it, best=0.982][A
Klebsiella_Pneumoniae | Meropenem | Optuna:  35%|███▌      | 70/200 [1:00:21<1:44:10, 48.08s/it, best=0.982][A[I 2026-02-28 07:00:15,926] Trial 160 finished with value: 0.9047138053135744 and parameters: {'activation': 'tanh', 'solver': 'sgd', 'lr': 0.0001126252607512939, 'layer1': 76, 'layer2': 142, 'layer3': 90}. Best is trial 77 with value: 0.9283869597728589.

Staphylococcus_Aureus | Fusidic acid | Optuna:  80%|████████  | 161/200 [4:19:25<56:44, 87.29s/it, best=0.928][A
Staphylococcus_Aureus | Fusidic acid | Optuna:  80%|████████  | 161/200 [4:19:25<56:44, 87.29s/it, best=0.928][A[I 2026-02-28 07:00:27,395] Trial 70 finished with value: 0.9777059446949237 and parameters: {'activation': 'logistic', 'solver': 'adam', 'lr': 0.0029305604916943454, 'layer1': 392, 'layer2': 233, 'layer3': 479}. Best is trial 27 with value: 0.9821048418402821.

Klebsiella_Pneumoniae | Meropenem | Optuna:  36%|███▌      | 71/200 [1:01:07<1:42:02, 47.46s/it, best=0.982][A
Klebsiella_Pneumoniae | Meropenem | Optuna:  36%|███▌      | 71/200 [1:01:07<1:42:02, 47.46s/it, best=0.982][A[I 2026-02-28 07:01:00,351] Trial 3 finished with value: 0.7698834292695824 and parameters: {'activation': 'relu', 'solver': 'sgd', 'lr': 1.6536937182824424e-05, 'layer1': 57, 'layer2': 345, 'layer3': 226}. Best is trial 2 with value: 0.8353664179654814.
Pseudomonas_Aeruginosa | DirectMulti | Optuna:   2%|▏         | 4/200 [04:46<4:37:02, 84.81s/it, best=0.835]Pseudomonas_Aeruginosa | DirectMulti | Optuna:   2%|▏         | 4/200 [04:46<4:37:02, 84.81s/it, best=0.835]/export/usuarios01/egarroyo/MALDI_for_AMR_prediction/venv/lib/python3.13/site-packages/sklearn/model_selection/_split.py:813: UserWarning: The least populated class in y has only 4 members, which is less than n_splits=5.
  warnings.warn(
[I 2026-02-28 07:01:23,477] Trial 179 finished with value: 0.8937185833949508 and parameters: {'activation': 'relu', 'solver': 'adam', 'lr': 4.0948529971848025e-05, 'layer1': 470, 'layer2': 363, 'layer3': 71}. Best is trial 137 with value: 0.8979080367540411.

Escherichia_Coli | Ceftriaxone | Optuna:  90%|█████████ | 180/200 [7:51:24<1:05:25, 196.25s/it, best=0.898][A
