Escherichia_Coli | Piperacillin-Tazobactam | Optuna:  36%|███▌      | 72/200 [2:35:33<4:01:42, 113.30s/it, best=0.916][A[I 2026-02-28 10:39:51,612] Trial 68 finished with value: 0.8038448716645418 and parameters: {'activation': 'identity', 'solver': 'sgd', 'lr': 0.0004447813589818876, 'layer1': 408, 'layer2': 112, 'layer3': 14}. Best is trial 8 with value: 0.8879562150966016.
Staphylococcus_Aureus | LPS | Optuna:  34%|███▍      | 69/200 [2:33:37<4:01:00, 110.39s/it, best=0.888]Staphylococcus_Aureus | LPS | Optuna:  34%|███▍      | 69/200 [2:33:37<4:01:00, 110.39s/it, best=0.888][I 2026-02-28 10:39:56,235] Trial 70 finished with value: 0.870127702661236 and parameters: {'activation': 'identity', 'solver': 'sgd', 'lr': 0.00046212832225936163, 'layer1': 72, 'layer2': 312, 'layer3': 91}. Best is trial 23 with value: 0.9252230330428246.
Klebsiella_Pneumoniae | LPS | Optuna:  36%|███▌      | 71/200 [1:52:12<2:37:38, 73.32s/it, best=0.925]Klebsiella_Pneumoniae | LPS | Optuna:  36%|███▌      | 71/200 [1:52:12<2:37:38, 73.32s/it, best=0.925][I 2026-02-28 10:40:41,713] Trial 124 finished with value: 0.863879567255481 and parameters: {'activation': 'identity', 'solver': 'adam', 'lr': 0.0005549074260491961, 'layer1': 402, 'layer2': 338, 'layer3': 197}. Best is trial 102 with value: 0.8672439264969375.
Pseudomonas_Aeruginosa | DirectMulti | Optuna:  62%|██████▎   | 125/200 [3:44:27<2:16:33, 109.25s/it, best=0.867]Pseudomonas_Aeruginosa | DirectMulti | Optuna:  62%|██████▎   | 125/200 [3:44:27<2:16:33, 109.25s/it, best=0.867]/export/usuarios01/egarroyo/MALDI_for_AMR_prediction/venv/lib/python3.13/site-packages/sklearn/model_selection/_split.py:813: UserWarning: The least populated class in y has only 4 members, which is less than n_splits=5.
  warnings.warn(
[I 2026-02-28 10:41:28,953] Trial 69 finished with value: 0.8769634769172152 and parameters: {'activation': 'logistic', 'solver': 'adam', 'lr': 0.001216215074367756, 'layer1': 276, 'layer2': 84, 'layer3': 112}. Best is trial 8 with value: 0.8879562150966016.
Staphylococcus_Aureus | LPS | Optuna:  35%|███▌      | 70/200 [2:35:15<3:50:41, 106.47s/it, best=0.888]Staphylococcus_Aureus | LPS | Optuna:  35%|███▌      | 70/200 [2:35:15<3:50:41, 106.47s/it, best=0.888][I 2026-02-28 10:41:35,746] Trial 71 finished with value: 0.9257111996592865 and parameters: {'activation': 'identity', 'solver': 'adam', 'lr': 0.00023372221657107296, 'layer1': 95, 'layer2': 265, 'layer3': 150}. Best is trial 71 with value: 0.9257111996592865.
Klebsiella_Pneumoniae | LPS | Optuna:  36%|███▌      | 72/200 [1:53:51<2:53:10, 81.18s/it, best=0.925]Klebsiella_Pneumoniae | LPS | Optuna:  36%|███▌      | 72/200 [1:53:51<2:53:10, 81.18s/it, best=0.926][I 2026-02-28 10:42:00,239] Trial 72 finished with value: 0.9130212153193312 and parameters: {'activation': 'relu', 'solver': 'adam', 'lr': 8.882397317492773e-05, 'layer1': 314, 'layer2': 355, 'layer3': 171}. Best is trial 64 with value: 0.915999331951523.

Escherichia_Coli | Piperacillin-Tazobactam | Optuna:  36%|███▋      | 73/200 [2:37:52<4:16:32, 121.20s/it, best=0.916][A
Escherichia_Coli | Piperacillin-Tazobactam | Optuna:  36%|███▋      | 73/200 [2:37:52<4:16:32, 121.20s/it, best=0.916][A[I 2026-02-28 10:42:39,049] Trial 125 finished with value: 0.8637913506706125 and parameters: {'activation': 'identity', 'solver': 'adam', 'lr': 8.920755734079666e-05, 'layer1': 457, 'layer2': 388, 'layer3': 202}. Best is trial 102 with value: 0.8672439264969375.
Pseudomonas_Aeruginosa | DirectMulti | Optuna:  63%|██████▎   | 126/200 [3:46:25<2:17:43, 111.67s/it, best=0.867]Pseudomonas_Aeruginosa | DirectMulti | Optuna:  63%|██████▎   | 126/200 [3:46:25<2:17:43, 111.67s/it, best=0.867]/export/usuarios01/egarroyo/MALDI_for_AMR_prediction/venv/lib/python3.13/site-packages/sklearn/model_selection/_split.py:813: UserWarning: The least populated class in y has only 4 members, which is less than n_splits=5.
  warnings.warn(
[I 2026-02-28 10:42:49,827] Trial 73 finished with value: 0.8958344038173316 and parameters: {'activation': 'logistic', 'solver': 'adam', 'lr': 0.00013369292921847428, 'layer1': 379, 'layer2': 234, 'layer3': 232}. Best is trial 64 with value: 0.915999331951523.

Escherichia_Coli | Piperacillin-Tazobactam | Optuna:  37%|███▋      | 74/200 [2:38:42<3:29:24, 99.72s/it, best=0.916] [A
Escherichia_Coli | Piperacillin-Tazobactam | Optuna:  37%|███▋      | 74/200 [2:38:42<3:29:24, 99.72s/it, best=0.916][A[I 2026-02-28 10:43:04,989] Trial 72 finished with value: 0.924439978642568 and parameters: {'activation': 'identity', 'solver': 'adam', 'lr': 0.0003218224955195186, 'layer1': 105, 'layer2': 266, 'layer3': 111}. Best is trial 71 with value: 0.9257111996592865.
Klebsiella_Pneumoniae | LPS | Optuna:  36%|███▋      | 73/200 [1:55:21<2:56:56, 83.60s/it, best=0.926]Klebsiella_Pneumoniae | LPS | Optuna:  36%|███▋      | 73/200 [1:55:21<2:56:56, 83.60s/it, best=0.926][I 2026-02-28 10:43:16,249] Trial 70 finished with value: 0.8851164910610076 and parameters: {'activation': 'identity', 'solver': 'adam', 'lr': 0.0005479242390690171, 'layer1': 304, 'layer2': 66, 'layer3': 89}. Best is trial 8 with value: 0.8879562150966016.
Staphylococcus_Aureus | LPS | Optuna:  36%|███▌      | 71/200 [2:37:02<3:49:27, 106.72s/it, best=0.888]Staphylococcus_Aureus | LPS | Optuna:  36%|███▌      | 71/200 [2:37:02<3:49:27, 106.72s/it, best=0.888][I 2026-02-28 10:44:27,524] Trial 73 finished with value: 0.9229788778431349 and parameters: {'activation': 'identity', 'solver': 'adam', 'lr': 7.365728938738968e-05, 'layer1': 87, 'layer2': 241, 'layer3': 162}. Best is trial 71 with value: 0.9257111996592865.
Klebsiella_Pneumoniae | LPS | Optuna:  37%|███▋      | 74/200 [1:56:43<2:54:53, 83.28s/it, best=0.926]Klebsiella_Pneumoniae | LPS | Optuna:  37%|███▋      | 74/200 [1:56:43<2:54:53, 83.28s/it, best=0.926][I 2026-02-28 10:44:48,400] Trial 126 finished with value: 0.8661068438041436 and parameters: {'activation': 'identity', 'solver': 'adam', 'lr': 5.970720844998612e-05, 'layer1': 439, 'layer2': 308, 'layer3': 226}. Best is trial 102 with value: 0.8672439264969375.
Pseudomonas_Aeruginosa | DirectMulti | Optuna:  64%|██████▎   | 127/200 [3:48:34<2:22:19, 116.98s/it, best=0.867]Pseudomonas_Aeruginosa | DirectMulti | Optuna:  64%|██████▎   | 127/200 [3:48:34<2:22:19, 116.98s/it, best=0.867]/export/usuarios01/egarroyo/MALDI_for_AMR_prediction/venv/lib/python3.13/site-packages/sklearn/model_selection/_split.py:813: UserWarning: The least populated class in y has only 4 members, which is less than n_splits=5.
  warnings.warn(
[I 2026-02-28 10:45:00,216] Trial 74 finished with value: 0.9166002918687234 and parameters: {'activation': 'relu', 'solver': 'adam', 'lr': 0.00035814079426700575, 'layer1': 292, 'layer2': 296, 'layer3': 72}. Best is trial 74 with value: 0.9166002918687234.

Escherichia_Coli | Piperacillin-Tazobactam | Optuna:  38%|███▊      | 75/200 [2:40:52<3:46:54, 108.92s/it, best=0.916][A
Escherichia_Coli | Piperacillin-Tazobactam | Optuna:  38%|███▊      | 75/200 [2:40:52<3:46:54, 108.92s/it, best=0.917][A[I 2026-02-28 10:45:33,056] Trial 71 finished with value: 0.8851334323066 and parameters: {'activation': 'identity', 'solver': 'adam', 'lr': 0.0001626849886650002, 'layer1': 380, 'layer2': 143, 'layer3': 196}. Best is trial 8 with value: 0.8879562150966016.
Staphylococcus_Aureus | LPS | Optuna:  36%|███▌      | 72/200 [2:39:19<4:06:55, 115.75s/it, best=0.888]Staphylococcus_Aureus | LPS | Optuna:  36%|███▌      | 72/200 [2:39:19<4:06:55, 115.75s/it, best=0.888][I 2026-02-28 10:45:53,538] Trial 74 finished with value: 0.9235395505732772 and parameters: {'activation': 'identity', 'solver': 'adam', 'lr': 0.00018874734899629507, 'layer1': 121, 'layer2': 253, 'layer3': 189}. Best is trial 71 with value: 0.9257111996592865.
Klebsiella_Pneumoniae | LPS | Optuna:  38%|███▊      | 75/200 [1:58:09<2:55:12, 84.10s/it, best=0.926]Klebsiella_Pneumoniae | LPS | Optuna:  38%|███▊      | 75/200 [1:58:09<2:55:12, 84.10s/it, best=0.926][I 2026-02-28 10:46:24,735] Trial 127 finished with value: 0.8562042167439721 and parameters: {'activation': 'relu', 'solver': 'adam', 'lr': 0.00011667820101386537, 'layer1': 439, 'layer2': 305, 'layer3': 222}. Best is trial 102 with value: 0.8672439264969375.
Pseudomonas_Aeruginosa | DirectMulti | Optuna:  64%|██████▍   | 128/200 [3:50:11<2:12:56, 110.78s/it, best=0.867]Pseudomonas_Aeruginosa | DirectMulti | Optuna:  64%|██████▍   | 128/200 [3:50:11<2:12:56, 110.78s/it, best=0.867]/export/usuarios01/egarroyo/MALDI_for_AMR_prediction/venv/lib/python3.13/site-packages/sklearn/model_selection/_split.py:813: UserWarning: The least populated class in y has only 4 members, which is less than n_splits=5.
  warnings.warn(
[I 2026-02-28 10:46:33,707] Trial 75 finished with value: 0.9133642336495648 and parameters: {'activation': 'relu', 'solver': 'adam', 'lr': 0.0003834512838734378, 'layer1': 287, 'layer2': 298, 'layer3': 80}. Best is trial 74 with value: 0.9166002918687234.

Escherichia_Coli | Piperacillin-Tazobactam | Optuna:  38%|███▊      | 76/200 [2:42:26<3:35:31, 104.29s/it, best=0.917][A
Escherichia_Coli | Piperacillin-Tazobactam | Optuna:  38%|███▊      | 76/200 [2:42:26<3:35:31, 104.29s/it, best=0.917][A[I 2026-02-28 10:47:16,956] Trial 75 finished with value: 0.9201560179827755 and parameters: {'activation': 'logistic', 'solver': 'adam', 'lr': 0.0006728262677205178, 'layer1': 180, 'layer2': 282, 'layer3': 218}. Best is trial 71 with value: 0.9257111996592865.
Klebsiella_Pneumoniae | LPS | Optuna:  38%|███▊      | 76/200 [1:59:33<2:53:23, 83.90s/it, best=0.926]Klebsiella_Pneumoniae | LPS | Optuna:  38%|███▊      | 76/200 [1:59:33<2:53:23, 83.90s/it, best=0.926][I 2026-02-28 10:47:47,151] Trial 72 finished with value: 0.8851639138822864 and parameters: {'activation': 'identity', 'solver': 'adam', 'lr': 0.0001295240389280657, 'layer1': 429, 'layer2': 174, 'layer3': 163}. Best is trial 8 with value: 0.8879562150966016.
Staphylococcus_Aureus | LPS | Optuna:  36%|███▋      | 73/200 [2:41:33<4:16:38, 121.25s/it, best=0.888]Staphylococcus_Aureus | LPS | Optuna:  36%|███▋      | 73/200 [2:41:33<4:16:38, 121.25s/it, best=0.888][I 2026-02-28 10:48:20,132] Trial 128 finished with value: 0.8641878798668159 and parameters: {'activation': 'identity', 'solver': 'adam', 'lr': 6.299624189146975e-05, 'layer1': 430, 'layer2': 283, 'layer3': 229}. Best is trial 102 with value: 0.8672439264969375.
Pseudomonas_Aeruginosa | DirectMulti | Optuna:  64%|██████▍   | 129/200 [3:52:06<2:12:43, 112.17s/it, best=0.867]Pseudomonas_Aeruginosa | DirectMulti | Optuna:  64%|██████▍   | 129/200 [3:52:06<2:12:43, 112.17s/it, best=0.867]/export/usuarios01/egarroyo/MALDI_for_AMR_prediction/venv/lib/python3.13/site-packages/sklearn/model_selection/_split.py:813: UserWarning: The least populated class in y has only 4 members, which is less than n_splits=5.
  warnings.warn(
[I 2026-02-28 10:48:45,065] Trial 76 finished with value: 0.924349006181747 and parameters: {'activation': 'identity', 'solver': 'adam', 'lr': 0.0001213004723508475, 'layer1': 157, 'layer2': 219, 'layer3': 133}. Best is trial 71 with value: 0.9257111996592865.
Klebsiella_Pneumoniae | LPS | Optuna:  38%|███▊      | 77/200 [2:01:01<2:54:34, 85.16s/it, best=0.926]Klebsiella_Pneumoniae | LPS | Optuna:  38%|███▊      | 77/200 [2:01:01<2:54:34, 85.16s/it, best=0.926][I 2026-02-28 10:48:47,625] Trial 76 finished with value: 0.9136080299905615 and parameters: {'activation': 'relu', 'solver': 'adam', 'lr': 0.0005670851471671195, 'layer1': 262, 'layer2': 319, 'layer3': 126}. Best is trial 74 with value: 0.9166002918687234.

Escherichia_Coli | Piperacillin-Tazobactam | Optuna:  38%|███▊      | 77/200 [2:44:40<3:52:00, 113.18s/it, best=0.917][A
Escherichia_Coli | Piperacillin-Tazobactam | Optuna:  38%|███▊      | 77/200 [2:44:40<3:52:00, 113.18s/it, best=0.917][A[I 2026-02-28 10:49:18,405] Trial 129 finished with value: 0.8589539451985496 and parameters: {'activation': 'tanh', 'solver': 'adam', 'lr': 0.00014446471922935686, 'layer1': 443, 'layer2': 307, 'layer3': 241}. Best is trial 102 with value: 0.8672439264969375.
Pseudomonas_Aeruginosa | DirectMulti | Optuna:  65%|██████▌   | 130/200 [3:53:04<1:51:59, 96.00s/it, best=0.867] Pseudomonas_Aeruginosa | DirectMulti | Optuna:  65%|██████▌   | 130/200 [3:53:04<1:51:59, 96.00s/it, best=0.867]/export/usuarios01/egarroyo/MALDI_for_AMR_prediction/venv/lib/python3.13/site-packages/sklearn/model_selection/_split.py:813: UserWarning: The least populated class in y has only 4 members, which is less than n_splits=5.
  warnings.warn(
[I 2026-02-28 10:49:39,764] Trial 77 finished with value: 0.9224003291764571 and parameters: {'activation': 'identity', 'solver': 'adam', 'lr': 0.00036678997610889083, 'layer1': 14, 'layer2': 308, 'layer3': 153}. Best is trial 71 with value: 0.9257111996592865.
Klebsiella_Pneumoniae | LPS | Optuna:  39%|███▉      | 78/200 [2:01:55<2:34:34, 76.02s/it, best=0.926]Klebsiella_Pneumoniae | LPS | Optuna:  39%|███▉      | 78/200 [2:01:55<2:34:34, 76.02s/it, best=0.926][I 2026-02-28 10:50:17,866] Trial 73 finished with value: 0.8864096266021235 and parameters: {'activation': 'identity', 'solver': 'adam', 'lr': 0.00010149699227935809, 'layer1': 403, 'layer2': 109, 'layer3': 223}. Best is trial 8 with value: 0.8879562150966016.
Staphylococcus_Aureus | LPS | Optuna:  37%|███▋      | 74/200 [2:44:04<4:33:11, 130.09s/it, best=0.888]Staphylococcus_Aureus | LPS | Optuna:  37%|███▋      | 74/200 [2:44:04<4:33:11, 130.09s/it, best=0.888][I 2026-02-28 10:50:54,779] Trial 77 finished with value: 0.9083695746349724 and parameters: {'activation': 'identity', 'solver': 'adam', 'lr': 0.00023037079582799783, 'layer1': 340, 'layer2': 279, 'layer3': 202}. Best is trial 74 with value: 0.9166002918687234.

Escherichia_Coli | Piperacillin-Tazobactam | Optuna:  39%|███▉      | 78/200 [2:46:47<3:58:39, 117.37s/it, best=0.917][A
Escherichia_Coli | Piperacillin-Tazobactam | Optuna:  39%|███▉      | 78/200 [2:46:47<3:58:39, 117.37s/it, best=0.917][A[I 2026-02-28 10:50:56,522] Trial 130 finished with value: 0.8628865384655089 and parameters: {'activation': 'identity', 'solver': 'adam', 'lr': 0.0001937551063000874, 'layer1': 475, 'layer2': 258, 'layer3': 270}. Best is trial 102 with value: 0.8672439264969375.
Pseudomonas_Aeruginosa | DirectMulti | Optuna:  66%|██████▌   | 131/200 [3:54:42<1:51:07, 96.63s/it, best=0.867]Pseudomonas_Aeruginosa | DirectMulti | Optuna:  66%|██████▌   | 131/200 [3:54:42<1:51:07, 96.63s/it, best=0.867]/export/usuarios01/egarroyo/MALDI_for_AMR_prediction/venv/lib/python3.13/site-packages/sklearn/model_selection/_split.py:813: UserWarning: The least populated class in y has only 4 members, which is less than n_splits=5.
  warnings.warn(
[I 2026-02-28 10:50:57,536] Trial 78 finished with value: 0.924709696411049 and parameters: {'activation': 'identity', 'solver': 'adam', 'lr': 0.00021946132895838834, 'layer1': 41, 'layer2': 447, 'layer3': 55}. Best is trial 71 with value: 0.9257111996592865.
Klebsiella_Pneumoniae | LPS | Optuna:  40%|███▉      | 79/200 [2:03:13<2:34:22, 76.55s/it, best=0.926]Klebsiella_Pneumoniae | LPS | Optuna:  40%|███▉      | 79/200 [2:03:13<2:34:22, 76.55s/it, best=0.926][I 2026-02-28 10:52:06,163] Trial 79 finished with value: 0.9239776499250094 and parameters: {'activation': 'identity', 'solver': 'adam', 'lr': 0.00047098469404860844, 'layer1': 58, 'layer2': 471, 'layer3': 54}. Best is trial 71 with value: 0.9257111996592865.
Klebsiella_Pneumoniae | LPS | Optuna:  40%|████      | 80/200 [2:04:22<2:28:20, 74.17s/it, best=0.926]Klebsiella_Pneumoniae | LPS | Optuna:  40%|████      | 80/200 [2:04:22<2:28:20, 74.17s/it, best=0.926][I 2026-02-28 10:53:03,273] Trial 80 finished with value: 0.9240366617070673 and parameters: {'activation': 'identity', 'solver': 'adam', 'lr': 0.00100953190601331, 'layer1': 35, 'layer2': 470, 'layer3': 10}. Best is trial 71 with value: 0.9257111996592865.
Klebsiella_Pneumoniae | LPS | Optuna:  40%|████      | 81/200 [2:05:19<2:16:57, 69.05s/it, best=0.926]Klebsiella_Pneumoniae | LPS | Optuna:  40%|████      | 81/200 [2:05:19<2:16:57, 69.05s/it, best=0.926][I 2026-02-28 10:53:10,995] Trial 78 finished with value: 0.9152293327827203 and parameters: {'activation': 'relu', 'solver': 'adam', 'lr': 0.0009825568783684126, 'layer1': 300, 'layer2': 239, 'layer3': 56}. Best is trial 74 with value: 0.9166002918687234.

Escherichia_Coli | Piperacillin-Tazobactam | Optuna:  40%|███▉      | 79/200 [2:49:03<4:08:05, 123.02s/it, best=0.917][A
Escherichia_Coli | Piperacillin-Tazobactam | Optuna:  40%|███▉      | 79/200 [2:49:03<4:08:05, 123.02s/it, best=0.917][A[I 2026-02-28 10:53:12,386] Trial 74 finished with value: 0.8823766828126665 and parameters: {'activation': 'identity', 'solver': 'adam', 'lr': 4.06486595729055e-05, 'layer1': 470, 'layer2': 115, 'layer3': 253}. Best is trial 8 with value: 0.8879562150966016.
Staphylococcus_Aureus | LPS | Optuna:  38%|███▊      | 75/200 [2:46:58<4:58:47, 143.42s/it, best=0.888]Staphylococcus_Aureus | LPS | Optuna:  38%|███▊      | 75/200 [2:46:58<4:58:47, 143.42s/it, best=0.888][I 2026-02-28 10:53:20,230] Trial 131 finished with value: 0.8632016989522772 and parameters: {'activation': 'identity', 'solver': 'adam', 'lr': 3.4319232263849214e-05, 'layer1': 460, 'layer2': 321, 'layer3': 165}. Best is trial 102 with value: 0.8672439264969375.
Pseudomonas_Aeruginosa | DirectMulti | Optuna:  66%|██████▌   | 132/200 [3:57:06<2:05:31, 110.76s/it, best=0.867]Pseudomonas_Aeruginosa | DirectMulti | Optuna:  66%|██████▌   | 132/200 [3:57:06<2:05:31, 110.76s/it, best=0.867]/export/usuarios01/egarroyo/MALDI_for_AMR_prediction/venv/lib/python3.13/site-packages/sklearn/model_selection/_split.py:813: UserWarning: The least populated class in y has only 4 members, which is less than n_splits=5.
  warnings.warn(
[I 2026-02-28 10:54:12,899] Trial 81 finished with value: 0.9245501523688322 and parameters: {'activation': 'identity', 'solver': 'adam', 'lr': 0.0002343490412493324, 'layer1': 11, 'layer2': 264, 'layer3': 83}. Best is trial 71 with value: 0.9257111996592865.
Klebsiella_Pneumoniae | LPS | Optuna:  41%|████      | 82/200 [2:06:28<2:16:08, 69.22s/it, best=0.926]Klebsiella_Pneumoniae | LPS | Optuna:  41%|████      | 82/200 [2:06:28<2:16:08, 69.22s/it, best=0.926][I 2026-02-28 10:55:07,599] Trial 132 finished with value: 0.8616352611682455 and parameters: {'activation': 'identity', 'solver': 'adam', 'lr': 4.4491092287250065e-05, 'layer1': 255, 'layer2': 357, 'layer3': 213}. Best is trial 102 with value: 0.8672439264969375.
Pseudomonas_Aeruginosa | DirectMulti | Optuna:  66%|██████▋   | 133/200 [3:58:53<2:02:32, 109.74s/it, best=0.867]Pseudomonas_Aeruginosa | DirectMulti | Optuna:  66%|██████▋   | 133/200 [3:58:53<2:02:32, 109.74s/it, best=0.867]/export/usuarios01/egarroyo/MALDI_for_AMR_prediction/venv/lib/python3.13/site-packages/sklearn/model_selection/_split.py:813: UserWarning: The least populated class in y has only 4 members, which is less than n_splits=5.
  warnings.warn(
[I 2026-02-28 10:55:17,353] Trial 82 finished with value: 0.9225434883882857 and parameters: {'activation': 'identity', 'solver': 'adam', 'lr': 0.00025327961940156766, 'layer1': 33, 'layer2': 441, 'layer3': 76}. Best is trial 71 with value: 0.9257111996592865.
Klebsiella_Pneumoniae | LPS | Optuna:  42%|████▏     | 83/200 [2:07:33<2:12:11, 67.79s/it, best=0.926]Klebsiella_Pneumoniae | LPS | Optuna:  42%|████▏     | 83/200 [2:07:33<2:12:11, 67.79s/it, best=0.926][I 2026-02-28 10:55:29,414] Trial 79 finished with value: 0.9125531357652831 and parameters: {'activation': 'relu', 'solver': 'adam', 'lr': 0.00031710061069215414, 'layer1': 359, 'layer2': 343, 'layer3': 100}. Best is trial 74 with value: 0.9166002918687234.

Escherichia_Coli | Piperacillin-Tazobactam | Optuna:  40%|████      | 80/200 [2:51:22<4:15:17, 127.64s/it, best=0.917][A
Escherichia_Coli | Piperacillin-Tazobactam | Optuna:  40%|████      | 80/200 [2:51:22<4:15:17, 127.64s/it, best=0.917][A[I 2026-02-28 10:55:37,168] Trial 75 finished with value: 0.8816902726518231 and parameters: {'activation': 'identity', 'solver': 'adam', 'lr': 5.332090680760774e-05, 'layer1': 400, 'layer2': 395, 'layer3': 227}. Best is trial 8 with value: 0.8879562150966016.
Staphylococcus_Aureus | LPS | Optuna:  38%|███▊      | 76/200 [2:49:23<4:57:14, 143.83s/it, best=0.888]Staphylococcus_Aureus | LPS | Optuna:  38%|███▊      | 76/200 [2:49:23<4:57:14, 143.83s/it, best=0.888][I 2026-02-28 10:56:22,925] Trial 83 finished with value: 0.9230203161493276 and parameters: {'activation': 'identity', 'solver': 'adam', 'lr': 0.00019366298887572454, 'layer1': 15, 'layer2': 247, 'layer3': 35}. Best is trial 71 with value: 0.9257111996592865.
Klebsiella_Pneumoniae | LPS | Optuna:  42%|████▏     | 84/200 [2:08:38<2:09:46, 67.13s/it, best=0.926]Klebsiella_Pneumoniae | LPS | Optuna:  42%|████▏     | 84/200 [2:08:38<2:09:46, 67.13s/it, best=0.926][I 2026-02-28 10:57:28,515] Trial 133 finished with value: 0.8552757541637133 and parameters: {'activation': 'identity', 'solver': 'adam', 'lr': 1.918277050217574e-05, 'layer1': 398, 'layer2': 373, 'layer3': 142}. Best is trial 102 with value: 0.8672439264969375.
Pseudomonas_Aeruginosa | DirectMulti | Optuna:  67%|██████▋   | 134/200 [4:01:14<2:11:00, 119.09s/it, best=0.867]Pseudomonas_Aeruginosa | DirectMulti | Optuna:  67%|██████▋   | 134/200 [4:01:14<2:11:00, 119.09s/it, best=0.867]/export/usuarios01/egarroyo/MALDI_for_AMR_prediction/venv/lib/python3.13/site-packages/sklearn/model_selection/_split.py:813: UserWarning: The least populated class in y has only 4 members, which is less than n_splits=5.
  warnings.warn(
[I 2026-02-28 10:57:43,052] Trial 84 finished with value: 0.9256636120537541 and parameters: {'activation': 'identity', 'solver': 'adam', 'lr': 0.0001685284925910436, 'layer1': 57, 'layer2': 264, 'layer3': 70}. Best is trial 71 with value: 0.9257111996592865.
