[I 2026-02-28 08:03:27,838] Trial 138 finished with value: 0.9815545733387309 and parameters: {'activation': 'tanh', 'solver': 'adam', 'lr': 0.0005388042380748721, 'layer1': 475, 'layer2': 355, 'layer3': 346}. Best is trial 119 with value: 0.983615836127451.

Klebsiella_Pneumoniae | Meropenem | Optuna:  70%|██████▉   | 139/200 [2:04:08<1:03:57, 62.91s/it, best=0.984][A
Klebsiella_Pneumoniae | Meropenem | Optuna:  70%|██████▉   | 139/200 [2:04:08<1:03:57, 62.91s/it, best=0.984][A[I 2026-02-28 08:03:42,713] Trial 199 finished with value: 0.8945246949208034 and parameters: {'activation': 'relu', 'solver': 'adam', 'lr': 0.0001506942578817218, 'layer1': 491, 'layer2': 153, 'layer3': 462}. Best is trial 137 with value: 0.8979080367540411.

Escherichia_Coli | Ceftriaxone | Optuna: 100%|██████████| 200/200 [8:53:44<00:00, 155.09s/it, best=0.898][A
Escherichia_Coli | Ceftriaxone | Optuna: 100%|██████████| 200/200 [8:53:44<00:00, 155.09s/it, best=0.898][A
                                                                                                         [A[Escherichia_Coli | Ceftriaxone] [OPTUNA DONE] Best CV WF1=0.8979 | params={'activation': 'relu', 'solver': 'adam', 'lr': 6.040834595633592e-05, 'layer1': 471, 'layer2': 338, 'layer3': 11}
[Escherichia_Coli | Ceftriaxone] Retraining with validation early stopping (10% split)...
[Escherichia_Coli | Ceftriaxone] [TEST] WF1=0.8635 | ACC=0.8766 | HL=0.1234 | best_val_WF1=0.9097
Escherichia_Coli | Binary antibiotics:  50%|█████     | 2/4 [17:16:36<17:22:12, 31266.09s/it]
[Escherichia_Coli | Piperacillin-Tazobactam] Optuna search starting... (trials=200, cv=5)
[I 2026-02-28 08:04:07,341] A new study created in memory with name: no-name-375838c7-6567-4e22-8201-5cab3ede9d60

Escherichia_Coli | Piperacillin-Tazobactam | Optuna:   0%|          | 0/200 [00:00<?, ?it/s][A[I 2026-02-28 08:04:12,510] Trial 198 finished with value: 0.9260166393795078 and parameters: {'activation': 'tanh', 'solver': 'adam', 'lr': 6.681391459937198e-05, 'layer1': 411, 'layer2': 188, 'layer3': 101}. Best is trial 77 with value: 0.9283869597728589.

Staphylococcus_Aureus | Fusidic acid | Optuna: 100%|█████████▉| 199/200 [5:23:21<01:47, 107.95s/it, best=0.928][A
Staphylococcus_Aureus | Fusidic acid | Optuna: 100%|█████████▉| 199/200 [5:23:21<01:47, 107.95s/it, best=0.928][A[I 2026-02-28 08:04:26,342] Trial 41 finished with value: 0.864757202099599 and parameters: {'activation': 'identity', 'solver': 'adam', 'lr': 0.001883419235183059, 'layer1': 443, 'layer2': 366, 'layer3': 210}. Best is trial 31 with value: 0.866367214803268.
Pseudomonas_Aeruginosa | DirectMulti | Optuna:  21%|██        | 42/200 [1:08:12<4:38:41, 105.83s/it, best=0.866]Pseudomonas_Aeruginosa | DirectMulti | Optuna:  21%|██        | 42/200 [1:08:12<4:38:41, 105.83s/it, best=0.866]/export/usuarios01/egarroyo/MALDI_for_AMR_prediction/venv/lib/python3.13/site-packages/sklearn/model_selection/_split.py:813: UserWarning: The least populated class in y has only 4 members, which is less than n_splits=5.
  warnings.warn(
[I 2026-02-28 08:04:29,225] Trial 139 finished with value: 0.9818816030038293 and parameters: {'activation': 'tanh', 'solver': 'adam', 'lr': 0.0011031270793307648, 'layer1': 500, 'layer2': 307, 'layer3': 84}. Best is trial 119 with value: 0.983615836127451.

Klebsiella_Pneumoniae | Meropenem | Optuna:  70%|███████   | 140/200 [2:05:09<1:02:27, 62.45s/it, best=0.984][A
Klebsiella_Pneumoniae | Meropenem | Optuna:  70%|███████   | 140/200 [2:05:09<1:02:27, 62.45s/it, best=0.984][A[I 2026-02-28 08:04:53,759] Trial 0 finished with value: 0.18629784834612093 and parameters: {'activation': 'logistic', 'solver': 'sgd', 'lr': 1.7073967431528114e-06, 'layer1': 435, 'layer2': 305, 'layer3': 357}. Best is trial 0 with value: 0.18629784834612093.

Escherichia_Coli | Piperacillin-Tazobactam | Optuna:   0%|          | 1/200 [00:46<2:33:56, 46.42s/it][A
Escherichia_Coli | Piperacillin-Tazobactam | Optuna:   0%|          | 1/200 [00:46<2:33:56, 46.42s/it, best=0.186][A[I 2026-02-28 08:05:08,338] Trial 140 finished with value: 0.9767069569332589 and parameters: {'activation': 'tanh', 'solver': 'sgd', 'lr': 0.001453526689138752, 'layer1': 198, 'layer2': 309, 'layer3': 60}. Best is trial 119 with value: 0.983615836127451.

Klebsiella_Pneumoniae | Meropenem | Optuna:  70%|███████   | 141/200 [2:05:48<54:31, 55.45s/it, best=0.984]  [A
Klebsiella_Pneumoniae | Meropenem | Optuna:  70%|███████   | 141/200 [2:05:48<54:31, 55.45s/it, best=0.984][A[I 2026-02-28 08:05:41,823] Trial 1 finished with value: 0.8962085623250491 and parameters: {'activation': 'logistic', 'solver': 'adam', 'lr': 1.6480446427978994e-05, 'layer1': 267, 'layer2': 222, 'layer3': 152}. Best is trial 1 with value: 0.8962085623250491.

Escherichia_Coli | Piperacillin-Tazobactam | Optuna:   1%|          | 2/200 [01:34<2:36:22, 47.39s/it, best=0.186][A
Escherichia_Coli | Piperacillin-Tazobactam | Optuna:   1%|          | 2/200 [01:34<2:36:22, 47.39s/it, best=0.896][A[I 2026-02-28 08:06:05,112] Trial 199 finished with value: 0.9274796137954228 and parameters: {'activation': 'identity', 'solver': 'adam', 'lr': 0.00010960327142384706, 'layer1': 431, 'layer2': 175, 'layer3': 91}. Best is trial 77 with value: 0.9283869597728589.

Staphylococcus_Aureus | Fusidic acid | Optuna: 100%|██████████| 200/200 [5:25:14<00:00, 109.35s/it, best=0.928][A
Staphylococcus_Aureus | Fusidic acid | Optuna: 100%|██████████| 200/200 [5:25:14<00:00, 109.35s/it, best=0.928][A
                                                                                                               [A[Staphylococcus_Aureus | Fusidic acid] [OPTUNA DONE] Best CV WF1=0.9284 | params={'activation': 'identity', 'solver': 'adam', 'lr': 5.3237019751895146e-05, 'layer1': 336, 'layer2': 122, 'layer3': 183}
[Staphylococcus_Aureus | Fusidic acid] Retraining with validation early stopping (10% split)...
[I 2026-02-28 08:06:08,992] Trial 141 finished with value: 0.9811514140584159 and parameters: {'activation': 'tanh', 'solver': 'adam', 'lr': 0.0010318780414245636, 'layer1': 498, 'layer2': 267, 'layer3': 85}. Best is trial 119 with value: 0.983615836127451.

Klebsiella_Pneumoniae | Meropenem | Optuna:  71%|███████   | 142/200 [2:06:49<55:06, 57.01s/it, best=0.984][A
Klebsiella_Pneumoniae | Meropenem | Optuna:  71%|███████   | 142/200 [2:06:49<55:06, 57.01s/it, best=0.984][A[Staphylococcus_Aureus | Fusidic acid] [TEST] WF1=0.8998 | ACC=0.9199 | HL=0.0801 | best_val_WF1=0.9199
Staphylococcus_Aureus | Binary antibiotics: 100%|██████████| 3/3 [17:18:43<00:00, 20118.40s/it]  Staphylococcus_Aureus | Binary antibiotics: 100%|██████████| 3/3 [17:18:43<00:00, 20774.44s/it]

[Staphylococcus_Aureus] ===== LPS multiclass training (patterns) =====
[Staphylococcus_Aureus] LPS classes (patterns) on train: 8
[I 2026-02-28 08:06:13,649] A new study created in memory with name: no-name-b81a5a1b-b313-494a-b160-7b98b213b56a
Staphylococcus_Aureus | LPS | Optuna:   0%|          | 0/200 [00:00<?, ?it/s][I 2026-02-28 08:06:14,608] Trial 42 finished with value: 0.8610609005907437 and parameters: {'activation': 'identity', 'solver': 'adam', 'lr': 0.004614694137154407, 'layer1': 457, 'layer2': 404, 'layer3': 156}. Best is trial 31 with value: 0.866367214803268.
Pseudomonas_Aeruginosa | DirectMulti | Optuna:  22%|██▏       | 43/200 [1:10:00<4:38:50, 106.56s/it, best=0.866]Pseudomonas_Aeruginosa | DirectMulti | Optuna:  22%|██▏       | 43/200 [1:10:00<4:38:50, 106.56s/it, best=0.866]/export/usuarios01/egarroyo/MALDI_for_AMR_prediction/venv/lib/python3.13/site-packages/sklearn/model_selection/_split.py:813: UserWarning: The least populated class in y has only 4 members, which is less than n_splits=5.
  warnings.warn(
[I 2026-02-28 08:06:49,770] Trial 0 finished with value: 0.4195287966056325 and parameters: {'activation': 'logistic', 'solver': 'sgd', 'lr': 1.7073967431528114e-06, 'layer1': 435, 'layer2': 305, 'layer3': 357}. Best is trial 0 with value: 0.4195287966056325.
Staphylococcus_Aureus | LPS | Optuna:   0%|          | 1/200 [00:36<1:59:48, 36.12s/it]Staphylococcus_Aureus | LPS | Optuna:   0%|          | 1/200 [00:36<1:59:48, 36.12s/it, best=0.419][I 2026-02-28 08:06:59,482] Trial 142 finished with value: 0.9800516849961822 and parameters: {'activation': 'tanh', 'solver': 'adam', 'lr': 0.0007686170492099954, 'layer1': 461, 'layer2': 286, 'layer3': 73}. Best is trial 119 with value: 0.983615836127451.

Klebsiella_Pneumoniae | Meropenem | Optuna:  72%|███████▏  | 143/200 [2:07:39<52:18, 55.05s/it, best=0.984][A
Klebsiella_Pneumoniae | Meropenem | Optuna:  72%|███████▏  | 143/200 [2:07:39<52:18, 55.05s/it, best=0.984][A[I 2026-02-28 08:07:29,344] Trial 1 finished with value: 0.8019269392286317 and parameters: {'activation': 'logistic', 'solver': 'adam', 'lr': 1.6480446427978994e-05, 'layer1': 267, 'layer2': 222, 'layer3': 152}. Best is trial 1 with value: 0.8019269392286317.
Staphylococcus_Aureus | LPS | Optuna:   1%|          | 2/200 [01:15<2:05:54, 38.15s/it, best=0.419]Staphylococcus_Aureus | LPS | Optuna:   1%|          | 2/200 [01:15<2:05:54, 38.15s/it, best=0.802][I 2026-02-28 08:07:38,199] Trial 2 finished with value: 0.8999917687811966 and parameters: {'activation': 'identity', 'solver': 'adam', 'lr': 6.290644294586145e-06, 'layer1': 262, 'layer2': 300, 'layer3': 32}. Best is trial 2 with value: 0.8999917687811966.

Escherichia_Coli | Piperacillin-Tazobactam | Optuna:   2%|▏         | 3/200 [03:30<4:19:00, 78.89s/it, best=0.896][A
Escherichia_Coli | Piperacillin-Tazobactam | Optuna:   2%|▏         | 3/200 [03:30<4:19:00, 78.89s/it, best=0.9]  [A[I 2026-02-28 08:08:07,629] Trial 143 finished with value: 0.9816418397227116 and parameters: {'activation': 'tanh', 'solver': 'adam', 'lr': 0.0011123574456553113, 'layer1': 479, 'layer2': 335, 'layer3': 107}. Best is trial 119 with value: 0.983615836127451.

Klebsiella_Pneumoniae | Meropenem | Optuna:  72%|███████▏  | 144/200 [2:08:48<55:03, 58.98s/it, best=0.984][A
Klebsiella_Pneumoniae | Meropenem | Optuna:  72%|███████▏  | 144/200 [2:08:48<55:03, 58.98s/it, best=0.984][A[I 2026-02-28 08:08:45,749] Trial 3 finished with value: 0.8963415750649831 and parameters: {'activation': 'relu', 'solver': 'sgd', 'lr': 1.6536937182824424e-05, 'layer1': 57, 'layer2': 345, 'layer3': 226}. Best is trial 2 with value: 0.8999917687811966.

Escherichia_Coli | Piperacillin-Tazobactam | Optuna:   2%|▏         | 4/200 [04:38<4:03:04, 74.41s/it, best=0.9][A
Escherichia_Coli | Piperacillin-Tazobactam | Optuna:   2%|▏         | 4/200 [04:38<4:03:04, 74.41s/it, best=0.9][A[I 2026-02-28 08:09:12,328] Trial 144 finished with value: 0.9792044863226496 and parameters: {'activation': 'relu', 'solver': 'adam', 'lr': 0.0008757756550279196, 'layer1': 487, 'layer2': 304, 'layer3': 397}. Best is trial 119 with value: 0.983615836127451.

Klebsiella_Pneumoniae | Meropenem | Optuna:  72%|███████▎  | 145/200 [2:09:52<55:38, 60.70s/it, best=0.984][A
Klebsiella_Pneumoniae | Meropenem | Optuna:  72%|███████▎  | 145/200 [2:09:52<55:38, 60.70s/it, best=0.984][A[I 2026-02-28 08:09:36,185] Trial 2 finished with value: 0.843941952320273 and parameters: {'activation': 'identity', 'solver': 'adam', 'lr': 6.290644294586145e-06, 'layer1': 262, 'layer2': 300, 'layer3': 32}. Best is trial 2 with value: 0.843941952320273.
Staphylococcus_Aureus | LPS | Optuna:   2%|▏         | 3/200 [03:22<4:18:13, 78.65s/it, best=0.802]Staphylococcus_Aureus | LPS | Optuna:   2%|▏         | 3/200 [03:22<4:18:13, 78.65s/it, best=0.844][I 2026-02-28 08:09:39,897] Trial 4 finished with value: 0.8971181972870159 and parameters: {'activation': 'relu', 'solver': 'adam', 'lr': 1.7654048052495086e-05, 'layer1': 265, 'layer2': 278, 'layer3': 100}. Best is trial 2 with value: 0.8999917687811966.

Escherichia_Coli | Piperacillin-Tazobactam | Optuna:   2%|▎         | 5/200 [05:32<3:38:05, 67.10s/it, best=0.9][A
Escherichia_Coli | Piperacillin-Tazobactam | Optuna:   2%|▎         | 5/200 [05:32<3:38:05, 67.10s/it, best=0.9][A[I 2026-02-28 08:09:47,640] Trial 43 finished with value: 0.8255181832359135 and parameters: {'activation': 'identity', 'solver': 'adam', 'lr': 1.2403668302547623e-06, 'layer1': 379, 'layer2': 304, 'layer3': 256}. Best is trial 31 with value: 0.866367214803268.
Pseudomonas_Aeruginosa | DirectMulti | Optuna:  22%|██▏       | 44/200 [1:13:33<6:00:06, 138.50s/it, best=0.866]Pseudomonas_Aeruginosa | DirectMulti | Optuna:  22%|██▏       | 44/200 [1:13:33<6:00:06, 138.50s/it, best=0.866]/export/usuarios01/egarroyo/MALDI_for_AMR_prediction/venv/lib/python3.13/site-packages/sklearn/model_selection/_split.py:813: UserWarning: The least populated class in y has only 4 members, which is less than n_splits=5.
  warnings.warn(
[I 2026-02-28 08:10:03,232] Trial 145 finished with value: 0.9801653980280394 and parameters: {'activation': 'tanh', 'solver': 'adam', 'lr': 0.002027552502089702, 'layer1': 450, 'layer2': 276, 'layer3': 489}. Best is trial 119 with value: 0.983615836127451.

Klebsiella_Pneumoniae | Meropenem | Optuna:  73%|███████▎  | 146/200 [2:10:43<51:59, 57.76s/it, best=0.984][A
Klebsiella_Pneumoniae | Meropenem | Optuna:  73%|███████▎  | 146/200 [2:10:43<51:59, 57.76s/it, best=0.984][A[I 2026-02-28 08:10:35,460] Trial 146 finished with value: 0.9767069569332589 and parameters: {'activation': 'logistic', 'solver': 'adam', 'lr': 0.0006325842032133098, 'layer1': 430, 'layer2': 322, 'layer3': 96}. Best is trial 119 with value: 0.983615836127451.

Klebsiella_Pneumoniae | Meropenem | Optuna:  74%|███████▎  | 147/200 [2:11:15<44:15, 50.10s/it, best=0.984][A
Klebsiella_Pneumoniae | Meropenem | Optuna:  74%|███████▎  | 147/200 [2:11:15<44:15, 50.10s/it, best=0.984][A[I 2026-02-28 08:11:13,127] Trial 5 finished with value: 0.8976326890544684 and parameters: {'activation': 'identity', 'solver': 'adam', 'lr': 2.259279742015697e-06, 'layer1': 106, 'layer2': 32, 'layer3': 169}. Best is trial 2 with value: 0.8999917687811966.

Escherichia_Coli | Piperacillin-Tazobactam | Optuna:   3%|▎         | 6/200 [07:05<4:05:41, 75.99s/it, best=0.9][A
Escherichia_Coli | Piperacillin-Tazobactam | Optuna:   3%|▎         | 6/200 [07:05<4:05:41, 75.99s/it, best=0.9][A[I 2026-02-28 08:11:37,809] Trial 3 finished with value: 0.7097423558950435 and parameters: {'activation': 'relu', 'solver': 'sgd', 'lr': 1.6536937182824424e-05, 'layer1': 57, 'layer2': 345, 'layer3': 226}. Best is trial 2 with value: 0.843941952320273.
Staphylococcus_Aureus | LPS | Optuna:   2%|▏         | 4/200 [05:24<5:12:20, 95.62s/it, best=0.844]Staphylococcus_Aureus | LPS | Optuna:   2%|▏         | 4/200 [05:24<5:12:20, 95.62s/it, best=0.844][I 2026-02-28 08:11:43,385] Trial 44 finished with value: 0.8629653040819532 and parameters: {'activation': 'identity', 'solver': 'adam', 'lr': 0.00012946472930506524, 'layer1': 423, 'layer2': 486, 'layer3': 479}. Best is trial 31 with value: 0.866367214803268.
Pseudomonas_Aeruginosa | DirectMulti | Optuna:  22%|██▎       | 45/200 [1:15:29<5:40:09, 131.68s/it, best=0.866]Pseudomonas_Aeruginosa | DirectMulti | Optuna:  22%|██▎       | 45/200 [1:15:29<5:40:09, 131.68s/it, best=0.866]/export/usuarios01/egarroyo/MALDI_for_AMR_prediction/venv/lib/python3.13/site-packages/sklearn/model_selection/_split.py:813: UserWarning: The least populated class in y has only 4 members, which is less than n_splits=5.
  warnings.warn(
[I 2026-02-28 08:11:46,346] Trial 147 finished with value: 0.9806669038561424 and parameters: {'activation': 'relu', 'solver': 'adam', 'lr': 0.0016247106350572194, 'layer1': 463, 'layer2': 259, 'layer3': 66}. Best is trial 119 with value: 0.983615836127451.

Klebsiella_Pneumoniae | Meropenem | Optuna:  74%|███████▍  | 148/200 [2:12:26<48:49, 56.34s/it, best=0.984][A
Klebsiella_Pneumoniae | Meropenem | Optuna:  74%|███████▍  | 148/200 [2:12:26<48:49, 56.34s/it, best=0.984][A[I 2026-02-28 08:12:13,763] Trial 148 finished with value: 0.9818117320388724 and parameters: {'activation': 'tanh', 'solver': 'adam', 'lr': 0.0012732233751524963, 'layer1': 14, 'layer2': 292, 'layer3': 115}. Best is trial 119 with value: 0.983615836127451.

Klebsiella_Pneumoniae | Meropenem | Optuna:  74%|███████▍  | 149/200 [2:12:54<40:30, 47.66s/it, best=0.984][A
Klebsiella_Pneumoniae | Meropenem | Optuna:  74%|███████▍  | 149/200 [2:12:54<40:30, 47.66s/it, best=0.984][A[I 2026-02-28 08:12:17,268] Trial 4 finished with value: 0.8036880448434719 and parameters: {'activation': 'relu', 'solver': 'adam', 'lr': 1.7654048052495086e-05, 'layer1': 265, 'layer2': 278, 'layer3': 100}. Best is trial 2 with value: 0.843941952320273.
Staphylococcus_Aureus | LPS | Optuna:   2%|▎         | 5/200 [06:03<4:04:56, 75.37s/it, best=0.844]Staphylococcus_Aureus | LPS | Optuna:   2%|▎         | 5/200 [06:03<4:04:56, 75.37s/it, best=0.844][I 2026-02-28 08:12:49,637] Trial 149 finished with value: 0.9798270885707765 and parameters: {'activation': 'tanh', 'solver': 'adam', 'lr': 0.0012885461069574668, 'layer1': 187, 'layer2': 290, 'layer3': 153}. Best is trial 119 with value: 0.983615836127451.

Klebsiella_Pneumoniae | Meropenem | Optuna:  75%|███████▌  | 150/200 [2:13:30<36:46, 44.12s/it, best=0.984][A
Klebsiella_Pneumoniae | Meropenem | Optuna:  75%|███████▌  | 150/200 [2:13:30<36:46, 44.12s/it, best=0.984][A[I 2026-02-28 08:13:14,798] Trial 45 finished with value: 0.8638926921839488 and parameters: {'activation': 'identity', 'solver': 'adam', 'lr': 0.0002920064994802245, 'layer1': 232, 'layer2': 435, 'layer3': 316}. Best is trial 31 with value: 0.866367214803268.
Pseudomonas_Aeruginosa | DirectMulti | Optuna:  23%|██▎       | 46/200 [1:17:01<5:06:57, 119.60s/it, best=0.866]Pseudomonas_Aeruginosa | DirectMulti | Optuna:  23%|██▎       | 46/200 [1:17:01<5:06:57, 119.60s/it, best=0.866]/export/usuarios01/egarroyo/MALDI_for_AMR_prediction/venv/lib/python3.13/site-packages/sklearn/model_selection/_split.py:813: UserWarning: The least populated class in y has only 4 members, which is less than n_splits=5.
  warnings.warn(
[I 2026-02-28 08:13:35,076] Trial 150 finished with value: 0.9826537465273584 and parameters: {'activation': 'tanh', 'solver': 'adam', 'lr': 0.001040136818863244, 'layer1': 138, 'layer2': 304, 'layer3': 113}. Best is trial 119 with value: 0.983615836127451.

Klebsiella_Pneumoniae | Meropenem | Optuna:  76%|███████▌  | 151/200 [2:14:15<36:21, 44.52s/it, best=0.984][A
Klebsiella_Pneumoniae | Meropenem | Optuna:  76%|███████▌  | 151/200 [2:14:15<36:21, 44.52s/it, best=0.984][A[I 2026-02-28 08:13:51,396] Trial 46 finished with value: 0.8281986232855256 and parameters: {'activation': 'identity', 'solver': 'sgd', 'lr': 0.0011939554182272326, 'layer1': 348, 'layer2': 366, 'layer3': 414}. Best is trial 31 with value: 0.866367214803268.
Pseudomonas_Aeruginosa | DirectMulti | Optuna:  24%|██▎       | 47/200 [1:17:37<4:01:28, 94.70s/it, best=0.866] Pseudomonas_Aeruginosa | DirectMulti | Optuna:  24%|██▎       | 47/200 [1:17:37<4:01:28, 94.70s/it, best=0.866]/export/usuarios01/egarroyo/MALDI_for_AMR_prediction/venv/lib/python3.13/site-packages/sklearn/model_selection/_split.py:813: UserWarning: The least populated class in y has only 4 members, which is less than n_splits=5.
  warnings.warn(
[I 2026-02-28 08:14:07,169] Trial 151 finished with value: 0.9801589958565791 and parameters: {'activation': 'tanh', 'solver': 'adam', 'lr': 0.0010519823005831622, 'layer1': 19, 'layer2': 302, 'layer3': 111}. Best is trial 119 with value: 0.983615836127451.

Klebsiella_Pneumoniae | Meropenem | Optuna:  76%|███████▌  | 152/200 [2:14:47<32:37, 40.79s/it, best=0.984][A
Klebsiella_Pneumoniae | Meropenem | Optuna:  76%|███████▌  | 152/200 [2:14:47<32:37, 40.79s/it, best=0.984][A[I 2026-02-28 08:14:46,024] Trial 152 finished with value: 0.9805167824035512 and parameters: {'activation': 'tanh', 'solver': 'adam', 'lr': 0.0027466630273229307, 'layer1': 84, 'layer2': 308, 'layer3': 81}. Best is trial 119 with value: 0.983615836127451.

Klebsiella_Pneumoniae | Meropenem | Optuna:  76%|███████▋  | 153/200 [2:15:26<31:29, 40.21s/it, best=0.984][A
Klebsiella_Pneumoniae | Meropenem | Optuna:  76%|███████▋  | 153/200 [2:15:26<31:29, 40.21s/it, best=0.984][A[I 2026-02-28 08:14:48,484] Trial 6 finished with value: 0.8909655354107884 and parameters: {'activation': 'tanh', 'solver': 'adam', 'lr': 3.6618192203924288e-06, 'layer1': 403, 'layer2': 46, 'layer3': 494}. Best is trial 2 with value: 0.8999917687811966.

Escherichia_Coli | Piperacillin-Tazobactam | Optuna:   4%|▎         | 7/200 [10:41<6:30:59, 121.55s/it, best=0.9][A
Escherichia_Coli | Piperacillin-Tazobactam | Optuna:   4%|▎         | 7/200 [10:41<6:30:59, 121.55s/it, best=0.9][A[I 2026-02-28 08:14:53,466] Trial 47 finished with value: 0.8574147733844487 and parameters: {'activation': 'relu', 'solver': 'adam', 'lr': 0.0005039681221732372, 'layer1': 484, 'layer2': 274, 'layer3': 23}. Best is trial 31 with value: 0.866367214803268.
Pseudomonas_Aeruginosa | DirectMulti | Optuna:  24%|██▍       | 48/200 [1:18:39<3:35:06, 84.91s/it, best=0.866]Pseudomonas_Aeruginosa | DirectMulti | Optuna:  24%|██▍       | 48/200 [1:18:39<3:35:06, 84.91s/it, best=0.866]/export/usuarios01/egarroyo/MALDI_for_AMR_prediction/venv/lib/python3.13/site-packages/sklearn/model_selection/_split.py:813: UserWarning: The least populated class in y has only 4 members, which is less than n_splits=5.
  warnings.warn(
[I 2026-02-28 08:14:55,314] Trial 5 finished with value: 0.7489600655960797 and parameters: {'activation': 'identity', 'solver': 'adam', 'lr': 2.259279742015697e-06, 'layer1': 106, 'layer2': 32, 'layer3': 169}. Best is trial 2 with value: 0.843941952320273.
