Klebsiella_Pneumoniae | DirectMulti | Optuna:  67%|██████▋   | 134/200 [3:33:34<1:29:09, 81.06s/it, best=0.923]Klebsiella_Pneumoniae | DirectMulti | Optuna:  67%|██████▋   | 134/200 [3:33:34<1:29:09, 81.06s/it, best=0.923][I 2026-02-28 17:01:26,221] Trial 66 finished with value: 0.891283029406553 and parameters: {'activation': 'relu', 'solver': 'adam', 'lr': 6.764293723996916e-05, 'layer1': 406, 'layer2': 295, 'layer3': 278}. Best is trial 66 with value: 0.891283029406553.

Escherichia_Coli | Cefepime | Optuna:  34%|███▎      | 67/200 [2:03:50<4:30:11, 121.89s/it, best=0.891][A
Escherichia_Coli | Cefepime | Optuna:  34%|███▎      | 67/200 [2:03:50<4:30:11, 121.89s/it, best=0.891][A[I 2026-02-28 17:01:38,051] Trial 134 finished with value: 0.9217819027702898 and parameters: {'activation': 'tanh', 'solver': 'adam', 'lr': 3.958911684948059e-05, 'layer1': 42, 'layer2': 490, 'layer3': 471}. Best is trial 116 with value: 0.9230019854081373.
Klebsiella_Pneumoniae | DirectMulti | Optuna:  68%|██████▊   | 135/200 [3:35:23<1:36:54, 89.46s/it, best=0.923]Klebsiella_Pneumoniae | DirectMulti | Optuna:  68%|██████▊   | 135/200 [3:35:23<1:36:54, 89.46s/it, best=0.923][I 2026-02-28 17:03:08,010] Trial 135 finished with value: 0.9221379051990262 and parameters: {'activation': 'tanh', 'solver': 'adam', 'lr': 5.550742811770547e-05, 'layer1': 62, 'layer2': 450, 'layer3': 432}. Best is trial 116 with value: 0.9230019854081373.
Klebsiella_Pneumoniae | DirectMulti | Optuna:  68%|██████▊   | 136/200 [3:36:53<1:35:35, 89.61s/it, best=0.923]Klebsiella_Pneumoniae | DirectMulti | Optuna:  68%|██████▊   | 136/200 [3:36:53<1:35:35, 89.61s/it, best=0.923][I 2026-02-28 17:03:32,733] Trial 136 finished with value: 0.8702461473038209 and parameters: {'activation': 'logistic', 'solver': 'adam', 'lr': 5.525426466366602e-05, 'layer1': 25, 'layer2': 452, 'layer3': 427}. Best is trial 116 with value: 0.9230019854081373.
Klebsiella_Pneumoniae | DirectMulti | Optuna:  68%|██████▊   | 137/200 [3:37:18<1:13:39, 70.14s/it, best=0.923]Klebsiella_Pneumoniae | DirectMulti | Optuna:  68%|██████▊   | 137/200 [3:37:18<1:13:39, 70.14s/it, best=0.923][I 2026-02-28 17:03:43,896] Trial 67 finished with value: 0.8864640549772821 and parameters: {'activation': 'relu', 'solver': 'adam', 'lr': 3.07060756654581e-05, 'layer1': 399, 'layer2': 331, 'layer3': 274}. Best is trial 66 with value: 0.891283029406553.

Escherichia_Coli | Cefepime | Optuna:  34%|███▍      | 68/200 [2:06:08<4:38:34, 126.63s/it, best=0.891][A
Escherichia_Coli | Cefepime | Optuna:  34%|███▍      | 68/200 [2:06:08<4:38:34, 126.63s/it, best=0.891][A[I 2026-02-28 17:04:30,998] Trial 59 finished with value: 0.8403144303320129 and parameters: {'activation': 'tanh', 'solver': 'adam', 'lr': 3.4136179319093713e-06, 'layer1': 446, 'layer2': 345, 'layer3': 14}. Best is trial 40 with value: 0.8869621040536522.
Staphylococcus_Aureus | DirectMulti | Optuna:  30%|███       | 60/200 [2:34:36<7:38:42, 196.59s/it, best=0.887]Staphylococcus_Aureus | DirectMulti | Optuna:  30%|███       | 60/200 [2:34:36<7:38:42, 196.59s/it, best=0.887][I 2026-02-28 17:04:57,419] Trial 137 finished with value: 0.9215303444148173 and parameters: {'activation': 'tanh', 'solver': 'adam', 'lr': 8.590143006387582e-05, 'layer1': 51, 'layer2': 470, 'layer3': 437}. Best is trial 116 with value: 0.9230019854081373.
Klebsiella_Pneumoniae | DirectMulti | Optuna:  69%|██████▉   | 138/200 [3:38:43<1:16:59, 74.51s/it, best=0.923]Klebsiella_Pneumoniae | DirectMulti | Optuna:  69%|██████▉   | 138/200 [3:38:43<1:16:59, 74.51s/it, best=0.923][I 2026-02-28 17:06:01,665] Trial 60 finished with value: 0.8862714290775013 and parameters: {'activation': 'tanh', 'solver': 'adam', 'lr': 0.0003422023168260579, 'layer1': 422, 'layer2': 309, 'layer3': 135}. Best is trial 40 with value: 0.8869621040536522.
Staphylococcus_Aureus | DirectMulti | Optuna:  30%|███       | 61/200 [2:36:07<6:21:49, 164.81s/it, best=0.887]Staphylococcus_Aureus | DirectMulti | Optuna:  30%|███       | 61/200 [2:36:07<6:21:49, 164.81s/it, best=0.887][I 2026-02-28 17:06:03,937] Trial 138 finished with value: 0.921879362510414 and parameters: {'activation': 'tanh', 'solver': 'adam', 'lr': 6.02744708156004e-05, 'layer1': 34, 'layer2': 480, 'layer3': 404}. Best is trial 116 with value: 0.9230019854081373.
Klebsiella_Pneumoniae | DirectMulti | Optuna:  70%|██████▉   | 139/200 [3:39:49<1:13:18, 72.11s/it, best=0.923]Klebsiella_Pneumoniae | DirectMulti | Optuna:  70%|██████▉   | 139/200 [3:39:49<1:13:18, 72.11s/it, best=0.923][I 2026-02-28 17:06:44,896] Trial 68 finished with value: 0.8807758806219297 and parameters: {'activation': 'tanh', 'solver': 'adam', 'lr': 1.0069543179973098e-05, 'layer1': 332, 'layer2': 292, 'layer3': 330}. Best is trial 66 with value: 0.891283029406553.

Escherichia_Coli | Cefepime | Optuna:  34%|███▍      | 69/200 [2:09:09<5:12:04, 142.94s/it, best=0.891][A
Escherichia_Coli | Cefepime | Optuna:  34%|███▍      | 69/200 [2:09:09<5:12:04, 142.94s/it, best=0.891][A[I 2026-02-28 17:07:08,949] Trial 139 finished with value: 0.921353911138296 and parameters: {'activation': 'tanh', 'solver': 'adam', 'lr': 0.00013675106946676028, 'layer1': 63, 'layer2': 459, 'layer3': 275}. Best is trial 116 with value: 0.9230019854081373.
Klebsiella_Pneumoniae | DirectMulti | Optuna:  70%|███████   | 140/200 [3:40:54<1:09:58, 69.98s/it, best=0.923]Klebsiella_Pneumoniae | DirectMulti | Optuna:  70%|███████   | 140/200 [3:40:54<1:09:58, 69.98s/it, best=0.923][I 2026-02-28 17:07:29,453] Trial 61 finished with value: 0.8852347954091606 and parameters: {'activation': 'tanh', 'solver': 'adam', 'lr': 0.0003578857631203486, 'layer1': 417, 'layer2': 312, 'layer3': 136}. Best is trial 40 with value: 0.8869621040536522.
Staphylococcus_Aureus | DirectMulti | Optuna:  31%|███       | 62/200 [2:37:34<5:25:55, 141.71s/it, best=0.887]Staphylococcus_Aureus | DirectMulti | Optuna:  31%|███       | 62/200 [2:37:34<5:25:55, 141.71s/it, best=0.887][I 2026-02-28 17:08:43,525] Trial 69 finished with value: 0.887031189993133 and parameters: {'activation': 'relu', 'solver': 'adam', 'lr': 6.164556572341146e-05, 'layer1': 415, 'layer2': 391, 'layer3': 267}. Best is trial 66 with value: 0.891283029406553.

Escherichia_Coli | Cefepime | Optuna:  35%|███▌      | 70/200 [2:11:08<4:53:53, 135.65s/it, best=0.891][A
Escherichia_Coli | Cefepime | Optuna:  35%|███▌      | 70/200 [2:11:08<4:53:53, 135.65s/it, best=0.891][A[I 2026-02-28 17:09:19,264] Trial 62 finished with value: 0.8858557601867162 and parameters: {'activation': 'tanh', 'solver': 'adam', 'lr': 0.00018714919355996147, 'layer1': 487, 'layer2': 267, 'layer3': 218}. Best is trial 40 with value: 0.8869621040536522.
Staphylococcus_Aureus | DirectMulti | Optuna:  32%|███▏      | 63/200 [2:39:24<5:01:42, 132.14s/it, best=0.887]Staphylococcus_Aureus | DirectMulti | Optuna:  32%|███▏      | 63/200 [2:39:24<5:01:42, 132.14s/it, best=0.887][I 2026-02-28 17:10:17,001] Trial 70 finished with value: 0.7580300890169093 and parameters: {'activation': 'relu', 'solver': 'sgd', 'lr': 4.55997022375339e-05, 'layer1': 376, 'layer2': 353, 'layer3': 232}. Best is trial 66 with value: 0.891283029406553.

Escherichia_Coli | Cefepime | Optuna:  36%|███▌      | 71/200 [2:12:41<4:24:26, 122.99s/it, best=0.891][A
Escherichia_Coli | Cefepime | Optuna:  36%|███▌      | 71/200 [2:12:41<4:24:26, 122.99s/it, best=0.891][A[I 2026-02-28 17:11:01,037] Trial 63 finished with value: 0.8859403788418992 and parameters: {'activation': 'tanh', 'solver': 'adam', 'lr': 0.00011415915262037817, 'layer1': 484, 'layer2': 268, 'layer3': 263}. Best is trial 40 with value: 0.8869621040536522.
Staphylococcus_Aureus | DirectMulti | Optuna:  32%|███▏      | 64/200 [2:41:06<4:38:51, 123.03s/it, best=0.887]Staphylococcus_Aureus | DirectMulti | Optuna:  32%|███▏      | 64/200 [2:41:06<4:38:51, 123.03s/it, best=0.887][I 2026-02-28 17:12:04,163] Trial 71 finished with value: 0.8886889938062241 and parameters: {'activation': 'relu', 'solver': 'adam', 'lr': 9.893707915174553e-05, 'layer1': 436, 'layer2': 267, 'layer3': 154}. Best is trial 66 with value: 0.891283029406553.

Escherichia_Coli | Cefepime | Optuna:  36%|███▌      | 72/200 [2:14:28<4:12:15, 118.24s/it, best=0.891][A
Escherichia_Coli | Cefepime | Optuna:  36%|███▌      | 72/200 [2:14:28<4:12:15, 118.24s/it, best=0.891][A[I 2026-02-28 17:12:40,830] Trial 64 finished with value: 0.8850179219185176 and parameters: {'activation': 'tanh', 'solver': 'adam', 'lr': 0.00019718067177448113, 'layer1': 485, 'layer2': 237, 'layer3': 179}. Best is trial 40 with value: 0.8869621040536522.
Staphylococcus_Aureus | DirectMulti | Optuna:  32%|███▎      | 65/200 [2:42:46<4:21:07, 116.06s/it, best=0.887]Staphylococcus_Aureus | DirectMulti | Optuna:  32%|███▎      | 65/200 [2:42:46<4:21:07, 116.06s/it, best=0.887][I 2026-02-28 17:12:55,339] Trial 72 finished with value: 0.7584428424512062 and parameters: {'activation': 'relu', 'solver': 'adam', 'lr': 4.212945180057304e-06, 'layer1': 463, 'layer2': 301, 'layer3': 168}. Best is trial 66 with value: 0.891283029406553.

Escherichia_Coli | Cefepime | Optuna:  36%|███▋      | 73/200 [2:15:20<3:27:41, 98.12s/it, best=0.891] [A
Escherichia_Coli | Cefepime | Optuna:  36%|███▋      | 73/200 [2:15:20<3:27:41, 98.12s/it, best=0.891][A[I 2026-02-28 17:13:40,870] Trial 140 finished with value: 0.8310285999926406 and parameters: {'activation': 'tanh', 'solver': 'sgd', 'lr': 7.19423970415993e-05, 'layer1': 143, 'layer2': 443, 'layer3': 450}. Best is trial 116 with value: 0.9230019854081373.
Klebsiella_Pneumoniae | DirectMulti | Optuna:  70%|███████   | 141/200 [3:47:26<2:43:47, 166.56s/it, best=0.923]Klebsiella_Pneumoniae | DirectMulti | Optuna:  70%|███████   | 141/200 [3:47:26<2:43:47, 166.56s/it, best=0.923][I 2026-02-28 17:14:20,032] Trial 65 finished with value: 0.8837626629515363 and parameters: {'activation': 'tanh', 'solver': 'adam', 'lr': 0.0003534260110976678, 'layer1': 486, 'layer2': 259, 'layer3': 258}. Best is trial 40 with value: 0.8869621040536522.
Staphylococcus_Aureus | DirectMulti | Optuna:  33%|███▎      | 66/200 [2:44:25<4:07:54, 111.00s/it, best=0.887]Staphylococcus_Aureus | DirectMulti | Optuna:  33%|███▎      | 66/200 [2:44:25<4:07:54, 111.00s/it, best=0.887][I 2026-02-28 17:14:38,919] Trial 73 finished with value: 0.8872883398623767 and parameters: {'activation': 'relu', 'solver': 'adam', 'lr': 0.00018001672920155875, 'layer1': 446, 'layer2': 227, 'layer3': 204}. Best is trial 66 with value: 0.891283029406553.

Escherichia_Coli | Cefepime | Optuna:  37%|███▋      | 74/200 [2:17:03<3:29:29, 99.76s/it, best=0.891][A
Escherichia_Coli | Cefepime | Optuna:  37%|███▋      | 74/200 [2:17:03<3:29:29, 99.76s/it, best=0.891][A[I 2026-02-28 17:15:30,788] Trial 141 finished with value: 0.9201071212907689 and parameters: {'activation': 'tanh', 'solver': 'adam', 'lr': 3.4839370114395366e-05, 'layer1': 82, 'layer2': 429, 'layer3': 483}. Best is trial 116 with value: 0.9230019854081373.
Klebsiella_Pneumoniae | DirectMulti | Optuna:  71%|███████   | 142/200 [3:49:16<2:24:35, 149.57s/it, best=0.923]Klebsiella_Pneumoniae | DirectMulti | Optuna:  71%|███████   | 142/200 [3:49:16<2:24:35, 149.57s/it, best=0.923][I 2026-02-28 17:16:21,233] Trial 66 finished with value: 0.8862680371823444 and parameters: {'activation': 'relu', 'solver': 'adam', 'lr': 0.00011268846551714349, 'layer1': 234, 'layer2': 176, 'layer3': 205}. Best is trial 40 with value: 0.8869621040536522.
Staphylococcus_Aureus | DirectMulti | Optuna:  34%|███▎      | 67/200 [2:46:26<4:12:50, 114.06s/it, best=0.887]Staphylococcus_Aureus | DirectMulti | Optuna:  34%|███▎      | 67/200 [2:46:26<4:12:50, 114.06s/it, best=0.887][I 2026-02-28 17:16:31,496] Trial 74 finished with value: 0.8909740033377769 and parameters: {'activation': 'relu', 'solver': 'adam', 'lr': 0.00012115318941764388, 'layer1': 490, 'layer2': 311, 'layer3': 216}. Best is trial 66 with value: 0.891283029406553.

Escherichia_Coli | Cefepime | Optuna:  38%|███▊      | 75/200 [2:18:56<3:35:50, 103.61s/it, best=0.891][A
Escherichia_Coli | Cefepime | Optuna:  38%|███▊      | 75/200 [2:18:56<3:35:50, 103.61s/it, best=0.891][A[I 2026-02-28 17:17:15,748] Trial 142 finished with value: 0.923254189373387 and parameters: {'activation': 'tanh', 'solver': 'adam', 'lr': 4.427568692839508e-05, 'layer1': 72, 'layer2': 473, 'layer3': 458}. Best is trial 142 with value: 0.923254189373387.
Klebsiella_Pneumoniae | DirectMulti | Optuna:  72%|███████▏  | 143/200 [3:51:01<2:09:22, 136.19s/it, best=0.923]Klebsiella_Pneumoniae | DirectMulti | Optuna:  72%|███████▏  | 143/200 [3:51:01<2:09:22, 136.19s/it, best=0.923][I 2026-02-28 17:17:45,470] Trial 67 finished with value: 0.8815417426811962 and parameters: {'activation': 'relu', 'solver': 'adam', 'lr': 0.0016763804895646105, 'layer1': 290, 'layer2': 175, 'layer3': 139}. Best is trial 40 with value: 0.8869621040536522.
Staphylococcus_Aureus | DirectMulti | Optuna:  34%|███▍      | 68/200 [2:47:50<3:51:15, 105.11s/it, best=0.887]Staphylococcus_Aureus | DirectMulti | Optuna:  34%|███▍      | 68/200 [2:47:50<3:51:15, 105.11s/it, best=0.887][I 2026-02-28 17:18:49,447] Trial 143 finished with value: 0.921084222807302 and parameters: {'activation': 'tanh', 'solver': 'adam', 'lr': 4.862918262566403e-05, 'layer1': 44, 'layer2': 492, 'layer3': 460}. Best is trial 142 with value: 0.923254189373387.
Klebsiella_Pneumoniae | DirectMulti | Optuna:  72%|███████▏  | 144/200 [3:52:35<1:55:12, 123.44s/it, best=0.923]Klebsiella_Pneumoniae | DirectMulti | Optuna:  72%|███████▏  | 144/200 [3:52:35<1:55:12, 123.44s/it, best=0.923][I 2026-02-28 17:18:50,728] Trial 75 finished with value: 0.802920977528126 and parameters: {'activation': 'logistic', 'solver': 'adam', 'lr': 3.606639082493287e-05, 'layer1': 487, 'layer2': 325, 'layer3': 251}. Best is trial 66 with value: 0.891283029406553.

Escherichia_Coli | Cefepime | Optuna:  38%|███▊      | 76/200 [2:21:15<3:56:12, 114.29s/it, best=0.891][A
Escherichia_Coli | Cefepime | Optuna:  38%|███▊      | 76/200 [2:21:15<3:56:12, 114.29s/it, best=0.891][A[I 2026-02-28 17:19:56,945] Trial 144 finished with value: 0.9226145336636176 and parameters: {'activation': 'tanh', 'solver': 'adam', 'lr': 9.048907464329567e-05, 'layer1': 21, 'layer2': 472, 'layer3': 415}. Best is trial 142 with value: 0.923254189373387.
Klebsiella_Pneumoniae | DirectMulti | Optuna:  72%|███████▎  | 145/200 [3:53:42<1:37:46, 106.66s/it, best=0.923]Klebsiella_Pneumoniae | DirectMulti | Optuna:  72%|███████▎  | 145/200 [3:53:42<1:37:46, 106.66s/it, best=0.923][I 2026-02-28 17:20:38,468] Trial 76 finished with value: 0.8882414986809554 and parameters: {'activation': 'relu', 'solver': 'adam', 'lr': 7.554698678944841e-05, 'layer1': 357, 'layer2': 311, 'layer3': 298}. Best is trial 66 with value: 0.891283029406553.

Escherichia_Coli | Cefepime | Optuna:  38%|███▊      | 77/200 [2:23:03<3:50:16, 112.33s/it, best=0.891][A
Escherichia_Coli | Cefepime | Optuna:  38%|███▊      | 77/200 [2:23:03<3:50:16, 112.33s/it, best=0.891][A[I 2026-02-28 17:20:54,811] Trial 68 finished with value: 0.8772347615670688 and parameters: {'activation': 'relu', 'solver': 'adam', 'lr': 3.62556848631481e-05, 'layer1': 249, 'layer2': 157, 'layer3': 95}. Best is trial 40 with value: 0.8869621040536522.
Staphylococcus_Aureus | DirectMulti | Optuna:  34%|███▍      | 69/200 [2:51:00<4:44:40, 130.38s/it, best=0.887]Staphylococcus_Aureus | DirectMulti | Optuna:  34%|███▍      | 69/200 [2:51:00<4:44:40, 130.38s/it, best=0.887][I 2026-02-28 17:21:18,627] Trial 145 finished with value: 0.9212043035739887 and parameters: {'activation': 'tanh', 'solver': 'adam', 'lr': 0.0001020442618261385, 'layer1': 231, 'layer2': 477, 'layer3': 417}. Best is trial 142 with value: 0.923254189373387.
Klebsiella_Pneumoniae | DirectMulti | Optuna:  73%|███████▎  | 146/200 [3:55:04<1:29:14, 99.16s/it, best=0.923] Klebsiella_Pneumoniae | DirectMulti | Optuna:  73%|███████▎  | 146/200 [3:55:04<1:29:14, 99.16s/it, best=0.923][I 2026-02-28 17:21:41,806] Trial 77 finished with value: 0.8870179379463543 and parameters: {'activation': 'relu', 'solver': 'adam', 'lr': 0.0001183735509694101, 'layer1': 61, 'layer2': 298, 'layer3': 53}. Best is trial 66 with value: 0.891283029406553.

Escherichia_Coli | Cefepime | Optuna:  39%|███▉      | 78/200 [2:24:06<3:18:30, 97.63s/it, best=0.891] [A
Escherichia_Coli | Cefepime | Optuna:  39%|███▉      | 78/200 [2:24:06<3:18:30, 97.63s/it, best=0.891][A[I 2026-02-28 17:23:02,153] Trial 69 finished with value: 0.8863995076265546 and parameters: {'activation': 'relu', 'solver': 'adam', 'lr': 0.00010586817555752567, 'layer1': 246, 'layer2': 208, 'layer3': 202}. Best is trial 40 with value: 0.8869621040536522.
Staphylococcus_Aureus | DirectMulti | Optuna:  35%|███▌      | 70/200 [2:53:07<4:40:31, 129.47s/it, best=0.887]Staphylococcus_Aureus | DirectMulti | Optuna:  35%|███▌      | 70/200 [2:53:07<4:40:31, 129.47s/it, best=0.887][I 2026-02-28 17:23:29,411] Trial 146 finished with value: 0.9203747589924094 and parameters: {'activation': 'tanh', 'solver': 'adam', 'lr': 2.4789005184331852e-05, 'layer1': 25, 'layer2': 453, 'layer3': 436}. Best is trial 142 with value: 0.923254189373387.
Klebsiella_Pneumoniae | DirectMulti | Optuna:  74%|███████▎  | 147/200 [3:57:15<1:35:58, 108.65s/it, best=0.923]Klebsiella_Pneumoniae | DirectMulti | Optuna:  74%|███████▎  | 147/200 [3:57:15<1:35:58, 108.65s/it, best=0.923][I 2026-02-28 17:24:06,148] Trial 78 finished with value: 0.8788705596452863 and parameters: {'activation': 'identity', 'solver': 'adam', 'lr': 5.510696630774531e-05, 'layer1': 462, 'layer2': 369, 'layer3': 212}. Best is trial 66 with value: 0.891283029406553.

Escherichia_Coli | Cefepime | Optuna:  40%|███▉      | 79/200 [2:26:30<3:45:08, 111.64s/it, best=0.891][A
Escherichia_Coli | Cefepime | Optuna:  40%|███▉      | 79/200 [2:26:30<3:45:08, 111.64s/it, best=0.891][A[I 2026-02-28 17:24:33,872] Trial 147 finished with value: 0.922146264890357 and parameters: {'activation': 'tanh', 'solver': 'adam', 'lr': 8.566731647836055e-05, 'layer1': 17, 'layer2': 292, 'layer3': 410}. Best is trial 142 with value: 0.923254189373387.
Klebsiella_Pneumoniae | DirectMulti | Optuna:  74%|███████▍  | 148/200 [3:58:19<1:22:40, 95.39s/it, best=0.923] Klebsiella_Pneumoniae | DirectMulti | Optuna:  74%|███████▍  | 148/200 [3:58:19<1:22:40, 95.39s/it, best=0.923][I 2026-02-28 17:25:10,784] Trial 70 finished with value: 0.8034573654767942 and parameters: {'activation': 'relu', 'solver': 'sgd', 'lr': 6.595593177805376e-05, 'layer1': 232, 'layer2': 208, 'layer3': 201}. Best is trial 40 with value: 0.8869621040536522.
Staphylococcus_Aureus | DirectMulti | Optuna:  36%|███▌      | 71/200 [2:55:16<4:37:49, 129.22s/it, best=0.887]Staphylococcus_Aureus | DirectMulti | Optuna:  36%|███▌      | 71/200 [2:55:16<4:37:49, 129.22s/it, best=0.887][I 2026-02-28 17:25:29,431] Trial 148 finished with value: 0.9198152986245228 and parameters: {'activation': 'tanh', 'solver': 'adam', 'lr': 8.577166475955013e-05, 'layer1': 60, 'layer2': 299, 'layer3': 405}. Best is trial 142 with value: 0.923254189373387.
Klebsiella_Pneumoniae | DirectMulti | Optuna:  74%|███████▍  | 149/200 [3:59:15<1:10:55, 83.44s/it, best=0.923]Klebsiella_Pneumoniae | DirectMulti | Optuna:  74%|███████▍  | 149/200 [3:59:15<1:10:55, 83.44s/it, best=0.923][I 2026-02-28 17:26:05,839] Trial 79 finished with value: 0.8886200379995381 and parameters: {'activation': 'relu', 'solver': 'adam', 'lr': 8.535528373382296e-05, 'layer1': 492, 'layer2': 390, 'layer3': 289}. Best is trial 66 with value: 0.891283029406553.

Escherichia_Coli | Cefepime | Optuna:  40%|████      | 80/200 [2:28:30<3:48:06, 114.06s/it, best=0.891][A
Escherichia_Coli | Cefepime | Optuna:  40%|████      | 80/200 [2:28:30<3:48:06, 114.06s/it, best=0.891][A[I 2026-02-28 17:26:21,794] Trial 71 finished with value: 0.878507279127678 and parameters: {'activation': 'relu', 'solver': 'adam', 'lr': 0.00338017430449936, 'layer1': 193, 'layer2': 182, 'layer3': 168}. Best is trial 40 with value: 0.8869621040536522.
Staphylococcus_Aureus | DirectMulti | Optuna:  36%|███▌      | 72/200 [2:56:27<3:58:24, 111.76s/it, best=0.887]Staphylococcus_Aureus | DirectMulti | Optuna:  36%|███▌      | 72/200 [2:56:27<3:58:24, 111.76s/it, best=0.887][I 2026-02-28 17:26:42,440] Trial 149 finished with value: 0.9195776139747724 and parameters: {'activation': 'relu', 'solver': 'adam', 'lr': 0.00016006348080737279, 'layer1': 47, 'layer2': 203, 'layer3': 388}. Best is trial 142 with value: 0.923254189373387.
Klebsiella_Pneumoniae | DirectMulti | Optuna:  75%|███████▌  | 150/200 [4:00:28<1:06:55, 80.31s/it, best=0.923]Klebsiella_Pneumoniae | DirectMulti | Optuna:  75%|███████▌  | 150/200 [4:00:28<1:06:55, 80.31s/it, best=0.923][I 2026-02-28 17:27:34,341] Trial 150 finished with value: 0.9206621873855869 and parameters: {'activation': 'tanh', 'solver': 'adam', 'lr': 0.00022298401697709529, 'layer1': 12, 'layer2': 499, 'layer3': 430}. Best is trial 142 with value: 0.923254189373387.
Klebsiella_Pneumoniae | DirectMulti | Optuna:  76%|███████▌  | 151/200 [4:01:20<58:37, 71.79s/it, best=0.923]  Klebsiella_Pneumoniae | DirectMulti | Optuna:  76%|███████▌  | 151/200 [4:01:20<58:37, 71.79s/it, best=0.923][I 2026-02-28 17:28:14,705] Trial 80 finished with value: 0.884099425755586 and parameters: {'activation': 'relu', 'solver': 'adam', 'lr': 2.750355217587813e-05, 'layer1': 426, 'layer2': 339, 'layer3': 239}. Best is trial 66 with value: 0.891283029406553.

Escherichia_Coli | Cefepime | Optuna:  40%|████      | 81/200 [2:30:39<3:55:01, 118.50s/it, best=0.891][A
