Staphylococcus_Aureus | Oxacillin | Optuna:  33%|███▎      | 66/200 [2:26:34<4:30:42, 121.21s/it, best=0.909][A[I 2026-02-27 17:15:11,804] Trial 53 finished with value: 0.8031306166389347 and parameters: {'activation': 'tanh', 'solver': 'adam', 'lr': 6.219647467707537e-05, 'layer1': 331, 'layer2': 483, 'layer3': 168}. Best is trial 34 with value: 0.8072405041442254.

Escherichia_Coli | Ciprofloxacin | Optuna:  27%|██▋       | 54/200 [2:27:41<5:18:51, 131.04s/it, best=0.807][A
Escherichia_Coli | Ciprofloxacin | Optuna:  27%|██▋       | 54/200 [2:27:41<5:18:51, 131.04s/it, best=0.807][A[I 2026-02-27 17:15:15,255] Trial 84 finished with value: 0.8253834676975833 and parameters: {'activation': 'identity', 'solver': 'adam', 'lr': 4.435717314028229e-05, 'layer1': 486, 'layer2': 429, 'layer3': 170}. Best is trial 64 with value: 0.8298953923751187.

Klebsiella_Pneumoniae | Ciprofloxacin | Optuna:  42%|████▎     | 85/200 [2:27:44<4:21:57, 136.67s/it, best=0.83][A
Klebsiella_Pneumoniae | Ciprofloxacin | Optuna:  42%|████▎     | 85/200 [2:27:44<4:21:57, 136.67s/it, best=0.83][A[I 2026-02-27 17:15:24,317] Trial 139 finished with value: 0.8741869462436878 and parameters: {'activation': 'logistic', 'solver': 'adam', 'lr': 0.00022555764551765618, 'layer1': 296, 'layer2': 431, 'layer3': 477}. Best is trial 126 with value: 0.8764399491217574.

Pseudomonas_Aeruginosa | Ciprofloxacin | Optuna:  70%|███████   | 140/200 [2:27:54<1:09:22, 69.38s/it, best=0.876][A
Pseudomonas_Aeruginosa | Ciprofloxacin | Optuna:  70%|███████   | 140/200 [2:27:54<1:09:22, 69.38s/it, best=0.876][A[I 2026-02-27 17:15:45,609] Trial 140 finished with value: 0.8159756916186209 and parameters: {'activation': 'logistic', 'solver': 'sgd', 'lr': 0.00016709535298768967, 'layer1': 262, 'layer2': 438, 'layer3': 483}. Best is trial 126 with value: 0.8764399491217574.

Pseudomonas_Aeruginosa | Ciprofloxacin | Optuna:  70%|███████   | 141/200 [2:28:15<54:02, 54.95s/it, best=0.876]  [A
Pseudomonas_Aeruginosa | Ciprofloxacin | Optuna:  70%|███████   | 141/200 [2:28:15<54:02, 54.95s/it, best=0.876][A[I 2026-02-27 17:15:54,632] Trial 66 finished with value: 0.9051248568157954 and parameters: {'activation': 'identity', 'solver': 'adam', 'lr': 6.89782081376516e-05, 'layer1': 129, 'layer2': 428, 'layer3': 457}. Best is trial 56 with value: 0.9091525983132491.

Staphylococcus_Aureus | Oxacillin | Optuna:  34%|███▎      | 67/200 [2:28:24<4:21:07, 117.80s/it, best=0.909][A
Staphylococcus_Aureus | Oxacillin | Optuna:  34%|███▎      | 67/200 [2:28:24<4:21:07, 117.80s/it, best=0.909][A[I 2026-02-27 17:16:23,707] Trial 67 finished with value: 0.7122456060554638 and parameters: {'activation': 'relu', 'solver': 'sgd', 'lr': 0.000780449107145627, 'layer1': 263, 'layer2': 188, 'layer3': 486}. Best is trial 56 with value: 0.9091525983132491.

Staphylococcus_Aureus | Oxacillin | Optuna:  34%|███▍      | 68/200 [2:28:53<3:20:35, 91.18s/it, best=0.909] [A
Staphylococcus_Aureus | Oxacillin | Optuna:  34%|███▍      | 68/200 [2:28:53<3:20:35, 91.18s/it, best=0.909][A[I 2026-02-27 17:17:07,676] Trial 141 finished with value: 0.8750601835391167 and parameters: {'activation': 'logistic', 'solver': 'adam', 'lr': 0.00023766555403495712, 'layer1': 295, 'layer2': 448, 'layer3': 449}. Best is trial 126 with value: 0.8764399491217574.

Pseudomonas_Aeruginosa | Ciprofloxacin | Optuna:  71%|███████   | 142/200 [2:29:37<1:00:59, 63.09s/it, best=0.876][A
Pseudomonas_Aeruginosa | Ciprofloxacin | Optuna:  71%|███████   | 142/200 [2:29:37<1:00:59, 63.09s/it, best=0.876][A[I 2026-02-27 17:17:45,723] Trial 54 finished with value: 0.8035091996000749 and parameters: {'activation': 'tanh', 'solver': 'adam', 'lr': 4.128904818864089e-05, 'layer1': 263, 'layer2': 430, 'layer3': 72}. Best is trial 34 with value: 0.8072405041442254.

Escherichia_Coli | Ciprofloxacin | Optuna:  28%|██▊       | 55/200 [2:30:15<5:33:15, 137.90s/it, best=0.807][A
Escherichia_Coli | Ciprofloxacin | Optuna:  28%|██▊       | 55/200 [2:30:15<5:33:15, 137.90s/it, best=0.807][A[I 2026-02-27 17:18:02,489] Trial 85 finished with value: 0.8246759342607376 and parameters: {'activation': 'identity', 'solver': 'adam', 'lr': 3.216999206713765e-05, 'layer1': 409, 'layer2': 457, 'layer3': 194}. Best is trial 64 with value: 0.8298953923751187.

Klebsiella_Pneumoniae | Ciprofloxacin | Optuna:  43%|████▎     | 86/200 [2:30:32<4:37:05, 145.84s/it, best=0.83][A
Klebsiella_Pneumoniae | Ciprofloxacin | Optuna:  43%|████▎     | 86/200 [2:30:32<4:37:05, 145.84s/it, best=0.83][A[I 2026-02-27 17:18:25,355] Trial 142 finished with value: 0.8721361409267357 and parameters: {'activation': 'logistic', 'solver': 'adam', 'lr': 0.00023435200887877083, 'layer1': 301, 'layer2': 478, 'layer3': 450}. Best is trial 126 with value: 0.8764399491217574.

Pseudomonas_Aeruginosa | Ciprofloxacin | Optuna:  72%|███████▏  | 143/200 [2:30:55<1:04:05, 67.46s/it, best=0.876][A
Pseudomonas_Aeruginosa | Ciprofloxacin | Optuna:  72%|███████▏  | 143/200 [2:30:55<1:04:05, 67.46s/it, best=0.876][A[I 2026-02-27 17:18:56,300] Trial 68 finished with value: 0.9060470185952779 and parameters: {'activation': 'identity', 'solver': 'adam', 'lr': 0.00027127078494987853, 'layer1': 371, 'layer2': 454, 'layer3': 437}. Best is trial 56 with value: 0.9091525983132491.

Staphylococcus_Aureus | Oxacillin | Optuna:  34%|███▍      | 69/200 [2:31:25<3:59:18, 109.60s/it, best=0.909][A
Staphylococcus_Aureus | Oxacillin | Optuna:  34%|███▍      | 69/200 [2:31:25<3:59:18, 109.60s/it, best=0.909][A[I 2026-02-27 17:19:15,172] Trial 55 finished with value: 0.8076668303114959 and parameters: {'activation': 'tanh', 'solver': 'adam', 'lr': 9.62383982945482e-05, 'layer1': 103, 'layer2': 360, 'layer3': 17}. Best is trial 55 with value: 0.8076668303114959.

Escherichia_Coli | Ciprofloxacin | Optuna:  28%|██▊       | 56/200 [2:31:44<4:56:04, 123.37s/it, best=0.807][A
Escherichia_Coli | Ciprofloxacin | Optuna:  28%|██▊       | 56/200 [2:31:44<4:56:04, 123.37s/it, best=0.808][A[I 2026-02-27 17:19:46,371] Trial 143 finished with value: 0.8761891540917979 and parameters: {'activation': 'logistic', 'solver': 'adam', 'lr': 0.00037714554181403787, 'layer1': 288, 'layer2': 450, 'layer3': 423}. Best is trial 126 with value: 0.8764399491217574.

Pseudomonas_Aeruginosa | Ciprofloxacin | Optuna:  72%|███████▏  | 144/200 [2:32:16<1:06:45, 71.53s/it, best=0.876][A
Pseudomonas_Aeruginosa | Ciprofloxacin | Optuna:  72%|███████▏  | 144/200 [2:32:16<1:06:45, 71.53s/it, best=0.876][A[I 2026-02-27 17:20:45,450] Trial 69 finished with value: 0.9020985886469279 and parameters: {'activation': 'logistic', 'solver': 'adam', 'lr': 0.000430572713079474, 'layer1': 442, 'layer2': 437, 'layer3': 368}. Best is trial 56 with value: 0.9091525983132491.

Staphylococcus_Aureus | Oxacillin | Optuna:  35%|███▌      | 70/200 [2:33:15<3:57:10, 109.47s/it, best=0.909][A
Staphylococcus_Aureus | Oxacillin | Optuna:  35%|███▌      | 70/200 [2:33:15<3:57:10, 109.47s/it, best=0.909][A[I 2026-02-27 17:20:56,385] Trial 144 finished with value: 0.8718693672166478 and parameters: {'activation': 'logistic', 'solver': 'adam', 'lr': 0.0003589086427342831, 'layer1': 282, 'layer2': 455, 'layer3': 418}. Best is trial 126 with value: 0.8764399491217574.

Pseudomonas_Aeruginosa | Ciprofloxacin | Optuna:  72%|███████▎  | 145/200 [2:33:26<1:05:09, 71.07s/it, best=0.876][A
Pseudomonas_Aeruginosa | Ciprofloxacin | Optuna:  72%|███████▎  | 145/200 [2:33:26<1:05:09, 71.07s/it, best=0.876][A[I 2026-02-27 17:21:13,897] Trial 56 finished with value: 0.8021649008938914 and parameters: {'activation': 'identity', 'solver': 'adam', 'lr': 0.0007997938248169591, 'layer1': 96, 'layer2': 350, 'layer3': 23}. Best is trial 55 with value: 0.8076668303114959.

Escherichia_Coli | Ciprofloxacin | Optuna:  28%|██▊       | 57/200 [2:33:43<4:50:42, 121.97s/it, best=0.808][A
Escherichia_Coli | Ciprofloxacin | Optuna:  28%|██▊       | 57/200 [2:33:43<4:50:42, 121.97s/it, best=0.808][A[I 2026-02-27 17:21:43,330] Trial 86 finished with value: 0.7098687464682929 and parameters: {'activation': 'tanh', 'solver': 'sgd', 'lr': 1.339381378924216e-05, 'layer1': 468, 'layer2': 419, 'layer3': 135}. Best is trial 64 with value: 0.8298953923751187.

Klebsiella_Pneumoniae | Ciprofloxacin | Optuna:  44%|████▎     | 87/200 [2:34:12<5:17:02, 168.34s/it, best=0.83][A
Klebsiella_Pneumoniae | Ciprofloxacin | Optuna:  44%|████▎     | 87/200 [2:34:12<5:17:02, 168.34s/it, best=0.83][A[I 2026-02-27 17:22:04,023] Trial 145 finished with value: 0.8728080722402691 and parameters: {'activation': 'logistic', 'solver': 'adam', 'lr': 0.0005825191948031259, 'layer1': 267, 'layer2': 445, 'layer3': 177}. Best is trial 126 with value: 0.8764399491217574.

Pseudomonas_Aeruginosa | Ciprofloxacin | Optuna:  73%|███████▎  | 146/200 [2:34:33<1:03:02, 70.04s/it, best=0.876][A
Pseudomonas_Aeruginosa | Ciprofloxacin | Optuna:  73%|███████▎  | 146/200 [2:34:33<1:03:02, 70.04s/it, best=0.876][A[I 2026-02-27 17:22:30,323] Trial 70 finished with value: 0.9005016814155061 and parameters: {'activation': 'identity', 'solver': 'adam', 'lr': 4.909533561175987e-05, 'layer1': 169, 'layer2': 401, 'layer3': 388}. Best is trial 56 with value: 0.9091525983132491.

Staphylococcus_Aureus | Oxacillin | Optuna:  36%|███▌      | 71/200 [2:34:59<3:52:23, 108.09s/it, best=0.909][A
Staphylococcus_Aureus | Oxacillin | Optuna:  36%|███▌      | 71/200 [2:34:59<3:52:23, 108.09s/it, best=0.909][A[I 2026-02-27 17:22:32,643] Trial 146 finished with value: 0.8176186870260823 and parameters: {'activation': 'logistic', 'solver': 'adam', 'lr': 7.5747207188550066e-06, 'layer1': 254, 'layer2': 468, 'layer3': 429}. Best is trial 126 with value: 0.8764399491217574.

Pseudomonas_Aeruginosa | Ciprofloxacin | Optuna:  74%|███████▎  | 147/200 [2:35:02<50:53, 57.62s/it, best=0.876]  [A
Pseudomonas_Aeruginosa | Ciprofloxacin | Optuna:  74%|███████▎  | 147/200 [2:35:02<50:53, 57.62s/it, best=0.876][A[I 2026-02-27 17:23:35,660] Trial 147 finished with value: 0.8614029152860118 and parameters: {'activation': 'relu', 'solver': 'adam', 'lr': 0.0003570491421384036, 'layer1': 451, 'layer2': 420, 'layer3': 302}. Best is trial 126 with value: 0.8764399491217574.

Pseudomonas_Aeruginosa | Ciprofloxacin | Optuna:  74%|███████▍  | 148/200 [2:36:05<51:20, 59.24s/it, best=0.876][A
Pseudomonas_Aeruginosa | Ciprofloxacin | Optuna:  74%|███████▍  | 148/200 [2:36:05<51:20, 59.24s/it, best=0.876][A[I 2026-02-27 17:23:59,824] Trial 87 finished with value: 0.8257254464516123 and parameters: {'activation': 'relu', 'solver': 'adam', 'lr': 0.0003556332206281286, 'layer1': 453, 'layer2': 381, 'layer3': 238}. Best is trial 64 with value: 0.8298953923751187.

Klebsiella_Pneumoniae | Ciprofloxacin | Optuna:  44%|████▍     | 88/200 [2:36:29<4:56:24, 158.79s/it, best=0.83][A
Klebsiella_Pneumoniae | Ciprofloxacin | Optuna:  44%|████▍     | 88/200 [2:36:29<4:56:24, 158.79s/it, best=0.83][A[I 2026-02-27 17:24:38,015] Trial 57 finished with value: 0.8003042641878437 and parameters: {'activation': 'logistic', 'solver': 'adam', 'lr': 9.242165606427082e-05, 'layer1': 87, 'layer2': 327, 'layer3': 45}. Best is trial 55 with value: 0.8076668303114959.

Escherichia_Coli | Ciprofloxacin | Optuna:  29%|██▉       | 58/200 [2:37:07<5:46:59, 146.62s/it, best=0.808][A
Escherichia_Coli | Ciprofloxacin | Optuna:  29%|██▉       | 58/200 [2:37:07<5:46:59, 146.62s/it, best=0.808][A[I 2026-02-27 17:25:00,348] Trial 148 finished with value: 0.8749866650673596 and parameters: {'activation': 'logistic', 'solver': 'adam', 'lr': 0.0004778995211831102, 'layer1': 418, 'layer2': 443, 'layer3': 392}. Best is trial 126 with value: 0.8764399491217574.

Pseudomonas_Aeruginosa | Ciprofloxacin | Optuna:  74%|███████▍  | 149/200 [2:37:30<56:50, 66.87s/it, best=0.876][A
Pseudomonas_Aeruginosa | Ciprofloxacin | Optuna:  74%|███████▍  | 149/200 [2:37:30<56:50, 66.87s/it, best=0.876][A[I 2026-02-27 17:25:08,661] Trial 71 finished with value: 0.9084990547580676 and parameters: {'activation': 'identity', 'solver': 'adam', 'lr': 0.00013872301726310782, 'layer1': 335, 'layer2': 411, 'layer3': 466}. Best is trial 56 with value: 0.9091525983132491.

Staphylococcus_Aureus | Oxacillin | Optuna:  36%|███▌      | 72/200 [2:37:38<4:22:44, 123.16s/it, best=0.909][A
Staphylococcus_Aureus | Oxacillin | Optuna:  36%|███▌      | 72/200 [2:37:38<4:22:44, 123.16s/it, best=0.909][A[I 2026-02-27 17:26:19,710] Trial 58 finished with value: 0.6282044893196848 and parameters: {'activation': 'tanh', 'solver': 'sgd', 'lr': 0.00024083495591570748, 'layer1': 121, 'layer2': 386, 'layer3': 456}. Best is trial 55 with value: 0.8076668303114959.

Escherichia_Coli | Ciprofloxacin | Optuna:  30%|██▉       | 59/200 [2:38:49<5:12:52, 133.14s/it, best=0.808][A
Escherichia_Coli | Ciprofloxacin | Optuna:  30%|██▉       | 59/200 [2:38:49<5:12:52, 133.14s/it, best=0.808][A[I 2026-02-27 17:26:27,818] Trial 149 finished with value: 0.8610141195010984 and parameters: {'activation': 'identity', 'solver': 'adam', 'lr': 0.0002606848304299284, 'layer1': 406, 'layer2': 441, 'layer3': 391}. Best is trial 126 with value: 0.8764399491217574.

Pseudomonas_Aeruginosa | Ciprofloxacin | Optuna:  75%|███████▌  | 150/200 [2:38:57<1:00:52, 73.05s/it, best=0.876][A
Pseudomonas_Aeruginosa | Ciprofloxacin | Optuna:  75%|███████▌  | 150/200 [2:38:57<1:00:52, 73.05s/it, best=0.876][A[I 2026-02-27 17:26:44,765] Trial 88 finished with value: 0.822142056037641 and parameters: {'activation': 'identity', 'solver': 'adam', 'lr': 2.30647479170238e-05, 'layer1': 431, 'layer2': 224, 'layer3': 219}. Best is trial 64 with value: 0.8298953923751187.

Klebsiella_Pneumoniae | Ciprofloxacin | Optuna:  44%|████▍     | 89/200 [2:39:14<4:57:10, 160.63s/it, best=0.83][A
Klebsiella_Pneumoniae | Ciprofloxacin | Optuna:  44%|████▍     | 89/200 [2:39:14<4:57:10, 160.63s/it, best=0.83][A[I 2026-02-27 17:27:12,399] Trial 72 finished with value: 0.904751380275235 and parameters: {'activation': 'identity', 'solver': 'adam', 'lr': 0.00012035915843860722, 'layer1': 331, 'layer2': 473, 'layer3': 454}. Best is trial 56 with value: 0.9091525983132491.

Staphylococcus_Aureus | Oxacillin | Optuna:  36%|███▋      | 73/200 [2:39:42<4:21:03, 123.34s/it, best=0.909][A
Staphylococcus_Aureus | Oxacillin | Optuna:  36%|███▋      | 73/200 [2:39:42<4:21:03, 123.34s/it, best=0.909][A[I 2026-02-27 17:28:14,116] Trial 150 finished with value: 0.8700114168626133 and parameters: {'activation': 'logistic', 'solver': 'adam', 'lr': 0.00018578191899471517, 'layer1': 422, 'layer2': 427, 'layer3': 371}. Best is trial 126 with value: 0.8764399491217574.

Pseudomonas_Aeruginosa | Ciprofloxacin | Optuna:  76%|███████▌  | 151/200 [2:40:43<1:07:48, 83.03s/it, best=0.876][A
Pseudomonas_Aeruginosa | Ciprofloxacin | Optuna:  76%|███████▌  | 151/200 [2:40:43<1:07:48, 83.03s/it, best=0.876][A[I 2026-02-27 17:28:30,889] Trial 59 finished with value: 0.8001110999111726 and parameters: {'activation': 'identity', 'solver': 'adam', 'lr': 0.00014527364661270488, 'layer1': 36, 'layer2': 407, 'layer3': 257}. Best is trial 55 with value: 0.8076668303114959.

Escherichia_Coli | Ciprofloxacin | Optuna:  30%|███       | 60/200 [2:41:00<5:09:17, 132.55s/it, best=0.808][A
Escherichia_Coli | Ciprofloxacin | Optuna:  30%|███       | 60/200 [2:41:00<5:09:17, 132.55s/it, best=0.808][A[I 2026-02-27 17:28:53,029] Trial 89 finished with value: 0.8240117423301918 and parameters: {'activation': 'identity', 'solver': 'adam', 'lr': 0.00020253047823489548, 'layer1': 491, 'layer2': 466, 'layer3': 147}. Best is trial 64 with value: 0.8298953923751187.

Klebsiella_Pneumoniae | Ciprofloxacin | Optuna:  45%|████▌     | 90/200 [2:41:22<4:36:41, 150.92s/it, best=0.83][A
Klebsiella_Pneumoniae | Ciprofloxacin | Optuna:  45%|████▌     | 90/200 [2:41:22<4:36:41, 150.92s/it, best=0.83][A[I 2026-02-27 17:29:19,188] Trial 73 finished with value: 0.9067688512425323 and parameters: {'activation': 'identity', 'solver': 'adam', 'lr': 0.00020419292097048907, 'layer1': 346, 'layer2': 370, 'layer3': 470}. Best is trial 56 with value: 0.9091525983132491.

Staphylococcus_Aureus | Oxacillin | Optuna:  37%|███▋      | 74/200 [2:41:48<4:21:10, 124.37s/it, best=0.909][A
Staphylococcus_Aureus | Oxacillin | Optuna:  37%|███▋      | 74/200 [2:41:48<4:21:10, 124.37s/it, best=0.909][A[I 2026-02-27 17:29:20,412] Trial 90 finished with value: 0.7417840809323848 and parameters: {'activation': 'logistic', 'solver': 'adam', 'lr': 9.681016902248212e-05, 'layer1': 274, 'layer2': 78, 'layer3': 62}. Best is trial 64 with value: 0.8298953923751187.

Klebsiella_Pneumoniae | Ciprofloxacin | Optuna:  46%|████▌     | 91/200 [2:41:49<3:26:50, 113.86s/it, best=0.83][A
Klebsiella_Pneumoniae | Ciprofloxacin | Optuna:  46%|████▌     | 91/200 [2:41:49<3:26:50, 113.86s/it, best=0.83][A[I 2026-02-27 17:29:30,436] Trial 151 finished with value: 0.8708278495112343 and parameters: {'activation': 'logistic', 'solver': 'adam', 'lr': 0.0004569762153587841, 'layer1': 384, 'layer2': 498, 'layer3': 406}. Best is trial 126 with value: 0.8764399491217574.

Pseudomonas_Aeruginosa | Ciprofloxacin | Optuna:  76%|███████▌  | 152/200 [2:42:00<1:04:48, 81.01s/it, best=0.876][A
Pseudomonas_Aeruginosa | Ciprofloxacin | Optuna:  76%|███████▌  | 152/200 [2:42:00<1:04:48, 81.01s/it, best=0.876][A[I 2026-02-27 17:30:26,472] Trial 60 finished with value: 0.6290165859658432 and parameters: {'activation': 'logistic', 'solver': 'adam', 'lr': 2.615452980928211e-05, 'layer1': 313, 'layer2': 303, 'layer3': 330}. Best is trial 55 with value: 0.8076668303114959.

Escherichia_Coli | Ciprofloxacin | Optuna:  30%|███       | 61/200 [2:42:55<4:55:17, 127.46s/it, best=0.808][A
Escherichia_Coli | Ciprofloxacin | Optuna:  30%|███       | 61/200 [2:42:55<4:55:17, 127.46s/it, best=0.808][A[I 2026-02-27 17:30:52,606] Trial 152 finished with value: 0.8742843255892288 and parameters: {'activation': 'logistic', 'solver': 'adam', 'lr': 0.00031993759473590214, 'layer1': 293, 'layer2': 450, 'layer3': 424}. Best is trial 126 with value: 0.8764399491217574.

Pseudomonas_Aeruginosa | Ciprofloxacin | Optuna:  76%|███████▋  | 153/200 [2:43:22<1:03:43, 81.36s/it, best=0.876][A
Pseudomonas_Aeruginosa | Ciprofloxacin | Optuna:  76%|███████▋  | 153/200 [2:43:22<1:03:43, 81.36s/it, best=0.876][A[I 2026-02-27 17:31:14,678] Trial 74 finished with value: 0.9044727750601151 and parameters: {'activation': 'identity', 'solver': 'adam', 'lr': 0.001427099695762189, 'layer1': 288, 'layer2': 414, 'layer3': 407}. Best is trial 56 with value: 0.9091525983132491.

Staphylococcus_Aureus | Oxacillin | Optuna:  38%|███▊      | 75/200 [2:43:44<4:13:33, 121.71s/it, best=0.909][A
Staphylococcus_Aureus | Oxacillin | Optuna:  38%|███▊      | 75/200 [2:43:44<4:13:33, 121.71s/it, best=0.909][A[I 2026-02-27 17:31:30,982] Trial 91 finished with value: 0.8315336183309556 and parameters: {'activation': 'identity', 'solver': 'adam', 'lr': 4.214851096068479e-05, 'layer1': 296, 'layer2': 499, 'layer3': 252}. Best is trial 91 with value: 0.8315336183309556.

Klebsiella_Pneumoniae | Ciprofloxacin | Optuna:  46%|████▌     | 92/200 [2:44:00<3:33:58, 118.87s/it, best=0.83][A
Klebsiella_Pneumoniae | Ciprofloxacin | Optuna:  46%|████▌     | 92/200 [2:44:00<3:33:58, 118.87s/it, best=0.832][A[I 2026-02-27 17:32:07,264] Trial 153 finished with value: 0.874505034063328 and parameters: {'activation': 'logistic', 'solver': 'adam', 'lr': 0.0003185382733700881, 'layer1': 291, 'layer2': 453, 'layer3': 411}. Best is trial 126 with value: 0.8764399491217574.

Pseudomonas_Aeruginosa | Ciprofloxacin | Optuna:  77%|███████▋  | 154/200 [2:44:36<1:00:50, 79.35s/it, best=0.876][A
Pseudomonas_Aeruginosa | Ciprofloxacin | Optuna:  77%|███████▋  | 154/200 [2:44:36<1:00:50, 79.35s/it, best=0.876][A[I 2026-02-27 17:32:46,832] Trial 61 finished with value: 0.8018352642994822 and parameters: {'activation': 'tanh', 'solver': 'adam', 'lr': 3.6007113811828434e-05, 'layer1': 215, 'layer2': 432, 'layer3': 79}. Best is trial 55 with value: 0.8076668303114959.

Escherichia_Coli | Ciprofloxacin | Optuna:  31%|███       | 62/200 [2:45:16<5:02:03, 131.33s/it, best=0.808][A
Escherichia_Coli | Ciprofloxacin | Optuna:  31%|███       | 62/200 [2:45:16<5:02:03, 131.33s/it, best=0.808][A[I 2026-02-27 17:33:16,921] Trial 154 finished with value: 0.8729994646443512 and parameters: {'activation': 'logistic', 'solver': 'adam', 'lr': 0.0003302022691736195, 'layer1': 437, 'layer2': 453, 'layer3': 425}. Best is trial 126 with value: 0.8764399491217574.

Pseudomonas_Aeruginosa | Ciprofloxacin | Optuna:  78%|███████▊  | 155/200 [2:45:46<57:19, 76.44s/it, best=0.876]  [A
Pseudomonas_Aeruginosa | Ciprofloxacin | Optuna:  78%|███████▊  | 155/200 [2:45:46<57:19, 76.44s/it, best=0.876][A[I 2026-02-27 17:33:48,050] Trial 75 finished with value: 0.9090372650286473 and parameters: {'activation': 'identity', 'solver': 'adam', 'lr': 9.20251241741192e-05, 'layer1': 323, 'layer2': 430, 'layer3': 433}. Best is trial 56 with value: 0.9091525983132491.

Staphylococcus_Aureus | Oxacillin | Optuna:  38%|███▊      | 76/200 [2:46:17<4:31:09, 131.21s/it, best=0.909][A
Staphylococcus_Aureus | Oxacillin | Optuna:  38%|███▊      | 76/200 [2:46:17<4:31:09, 131.21s/it, best=0.909][A[I 2026-02-27 17:33:58,325] Trial 92 finished with value: 0.8261017626913164 and parameters: {'activation': 'identity', 'solver': 'adam', 'lr': 4.4303755903980474e-05, 'layer1': 338, 'layer2': 484, 'layer3': 184}. Best is trial 91 with value: 0.8315336183309556.

Klebsiella_Pneumoniae | Ciprofloxacin | Optuna:  46%|████▋     | 93/200 [2:46:27<3:47:13, 127.41s/it, best=0.832][A
