Pseudomonas_Aeruginosa | Imipenem | Optuna:  52%|█████▏    | 103/200 [1:30:29<1:42:24, 63.35s/it, best=0.865][A[I 2026-02-27 20:02:38,602] Trial 167 finished with value: 0.8280614840451147 and parameters: {'activation': 'tanh', 'solver': 'adam', 'lr': 0.0001624288064795161, 'layer1': 293, 'layer2': 472, 'layer3': 134}. Best is trial 91 with value: 0.8315336183309556.

Klebsiella_Pneumoniae | Ciprofloxacin | Optuna:  84%|████████▍ | 168/200 [5:15:08<43:02, 80.71s/it, best=0.832][A
Klebsiella_Pneumoniae | Ciprofloxacin | Optuna:  84%|████████▍ | 168/200 [5:15:08<43:02, 80.71s/it, best=0.832][A[I 2026-02-27 20:03:43,612] Trial 144 finished with value: 0.9069825298419966 and parameters: {'activation': 'identity', 'solver': 'adam', 'lr': 0.0003311334936797879, 'layer1': 279, 'layer2': 443, 'layer3': 474}. Best is trial 84 with value: 0.9099428178723615.

Staphylococcus_Aureus | Oxacillin | Optuna:  72%|███████▎  | 145/200 [5:16:13<2:01:10, 132.19s/it, best=0.91][A
Staphylococcus_Aureus | Oxacillin | Optuna:  72%|███████▎  | 145/200 [5:16:13<2:01:10, 132.19s/it, best=0.91][A[I 2026-02-27 20:03:57,584] Trial 168 finished with value: 0.7369833100182982 and parameters: {'activation': 'tanh', 'solver': 'sgd', 'lr': 0.00015689309660571045, 'layer1': 286, 'layer2': 475, 'layer3': 138}. Best is trial 91 with value: 0.8315336183309556.

Klebsiella_Pneumoniae | Ciprofloxacin | Optuna:  84%|████████▍ | 169/200 [5:16:27<41:25, 80.19s/it, best=0.832][A
Klebsiella_Pneumoniae | Ciprofloxacin | Optuna:  84%|████████▍ | 169/200 [5:16:27<41:25, 80.19s/it, best=0.832][A[I 2026-02-27 20:03:59,432] Trial 103 finished with value: 0.8640331787824749 and parameters: {'activation': 'relu', 'solver': 'adam', 'lr': 0.0004835198878832516, 'layer1': 463, 'layer2': 407, 'layer3': 139}. Best is trial 42 with value: 0.8645324176837453.

Pseudomonas_Aeruginosa | Imipenem | Optuna:  52%|█████▏    | 104/200 [1:31:53<1:51:16, 69.54s/it, best=0.865][A
Pseudomonas_Aeruginosa | Imipenem | Optuna:  52%|█████▏    | 104/200 [1:31:53<1:51:16, 69.54s/it, best=0.865][A[I 2026-02-27 20:05:03,761] Trial 104 finished with value: 0.8624176140416614 and parameters: {'activation': 'relu', 'solver': 'adam', 'lr': 0.00043968122820002873, 'layer1': 500, 'layer2': 404, 'layer3': 133}. Best is trial 42 with value: 0.8645324176837453.

Pseudomonas_Aeruginosa | Imipenem | Optuna:  52%|█████▎    | 105/200 [1:32:57<1:47:37, 67.98s/it, best=0.865][A
Pseudomonas_Aeruginosa | Imipenem | Optuna:  52%|█████▎    | 105/200 [1:32:57<1:47:37, 67.98s/it, best=0.865][A[I 2026-02-27 20:05:07,953] Trial 169 finished with value: 0.8228909385884471 and parameters: {'activation': 'tanh', 'solver': 'adam', 'lr': 0.00016546968896128392, 'layer1': 266, 'layer2': 495, 'layer3': 109}. Best is trial 91 with value: 0.8315336183309556.

Klebsiella_Pneumoniae | Ciprofloxacin | Optuna:  85%|████████▌ | 170/200 [5:17:37<38:37, 77.25s/it, best=0.832][A
Klebsiella_Pneumoniae | Ciprofloxacin | Optuna:  85%|████████▌ | 170/200 [5:17:37<38:37, 77.25s/it, best=0.832][A[I 2026-02-27 20:05:48,113] Trial 127 finished with value: 0.7804758989601533 and parameters: {'activation': 'identity', 'solver': 'adam', 'lr': 6.515292374958712e-06, 'layer1': 113, 'layer2': 235, 'layer3': 66}. Best is trial 124 with value: 0.8095465376114227.

Escherichia_Coli | Ciprofloxacin | Optuna:  64%|██████▍   | 128/200 [5:18:17<4:04:11, 203.50s/it, best=0.809][A
Escherichia_Coli | Ciprofloxacin | Optuna:  64%|██████▍   | 128/200 [5:18:17<4:04:11, 203.50s/it, best=0.809][A[I 2026-02-27 20:05:56,991] Trial 145 finished with value: 0.9080857179259754 and parameters: {'activation': 'identity', 'solver': 'adam', 'lr': 0.00021747904778645098, 'layer1': 232, 'layer2': 387, 'layer3': 405}. Best is trial 84 with value: 0.9099428178723615.

Staphylococcus_Aureus | Oxacillin | Optuna:  73%|███████▎  | 146/200 [5:18:26<1:59:17, 132.55s/it, best=0.91][A
Staphylococcus_Aureus | Oxacillin | Optuna:  73%|███████▎  | 146/200 [5:18:26<1:59:17, 132.55s/it, best=0.91][A[I 2026-02-27 20:06:25,300] Trial 105 finished with value: 0.8618367090169128 and parameters: {'activation': 'relu', 'solver': 'adam', 'lr': 0.0005950661431851339, 'layer1': 471, 'layer2': 432, 'layer3': 97}. Best is trial 42 with value: 0.8645324176837453.

Pseudomonas_Aeruginosa | Imipenem | Optuna:  53%|█████▎    | 106/200 [1:34:19<1:52:52, 72.05s/it, best=0.865][A
Pseudomonas_Aeruginosa | Imipenem | Optuna:  53%|█████▎    | 106/200 [1:34:19<1:52:52, 72.05s/it, best=0.865][A[I 2026-02-27 20:06:35,283] Trial 128 finished with value: 0.5106318111252273 and parameters: {'activation': 'logistic', 'solver': 'adam', 'lr': 2.152369437467957e-06, 'layer1': 95, 'layer2': 250, 'layer3': 10}. Best is trial 124 with value: 0.8095465376114227.

Escherichia_Coli | Ciprofloxacin | Optuna:  64%|██████▍   | 129/200 [5:19:04<3:05:18, 156.60s/it, best=0.809][A
Escherichia_Coli | Ciprofloxacin | Optuna:  64%|██████▍   | 129/200 [5:19:04<3:05:18, 156.60s/it, best=0.809][A[I 2026-02-27 20:06:41,319] Trial 170 finished with value: 0.8273373455907287 and parameters: {'activation': 'tanh', 'solver': 'adam', 'lr': 0.00012486582545546466, 'layer1': 275, 'layer2': 471, 'layer3': 149}. Best is trial 91 with value: 0.8315336183309556.

Klebsiella_Pneumoniae | Ciprofloxacin | Optuna:  86%|████████▌ | 171/200 [5:19:10<39:40, 82.08s/it, best=0.832][A
Klebsiella_Pneumoniae | Ciprofloxacin | Optuna:  86%|████████▌ | 171/200 [5:19:10<39:40, 82.08s/it, best=0.832][A[I 2026-02-27 20:07:43,139] Trial 106 finished with value: 0.8634711779330516 and parameters: {'activation': 'relu', 'solver': 'adam', 'lr': 0.0004652533780667671, 'layer1': 455, 'layer2': 345, 'layer3': 58}. Best is trial 42 with value: 0.8645324176837453.

Pseudomonas_Aeruginosa | Imipenem | Optuna:  54%|█████▎    | 107/200 [1:35:37<1:54:21, 73.78s/it, best=0.865][A
Pseudomonas_Aeruginosa | Imipenem | Optuna:  54%|█████▎    | 107/200 [1:35:37<1:54:21, 73.78s/it, best=0.865][A[I 2026-02-27 20:08:06,710] Trial 171 finished with value: 0.82580303971174 and parameters: {'activation': 'tanh', 'solver': 'adam', 'lr': 0.0001422992263141623, 'layer1': 310, 'layer2': 462, 'layer3': 177}. Best is trial 91 with value: 0.8315336183309556.

Klebsiella_Pneumoniae | Ciprofloxacin | Optuna:  86%|████████▌ | 172/200 [5:20:36<38:46, 83.07s/it, best=0.832][A
Klebsiella_Pneumoniae | Ciprofloxacin | Optuna:  86%|████████▌ | 172/200 [5:20:36<38:46, 83.07s/it, best=0.832][A[I 2026-02-27 20:08:34,470] Trial 146 finished with value: 0.9094617365082571 and parameters: {'activation': 'identity', 'solver': 'adam', 'lr': 0.00016150425870542547, 'layer1': 254, 'layer2': 427, 'layer3': 490}. Best is trial 84 with value: 0.9099428178723615.

Staphylococcus_Aureus | Oxacillin | Optuna:  74%|███████▎  | 147/200 [5:21:04<2:03:41, 140.03s/it, best=0.91][A
Staphylococcus_Aureus | Oxacillin | Optuna:  74%|███████▎  | 147/200 [5:21:04<2:03:41, 140.03s/it, best=0.91][A[I 2026-02-27 20:09:05,222] Trial 107 finished with value: 0.8642290912461039 and parameters: {'activation': 'relu', 'solver': 'adam', 'lr': 0.0004538080774422475, 'layer1': 452, 'layer2': 350, 'layer3': 78}. Best is trial 42 with value: 0.8645324176837453.

Pseudomonas_Aeruginosa | Imipenem | Optuna:  54%|█████▍    | 108/200 [1:36:59<1:56:57, 76.27s/it, best=0.865][A
Pseudomonas_Aeruginosa | Imipenem | Optuna:  54%|█████▍    | 108/200 [1:36:59<1:56:57, 76.27s/it, best=0.865][A[I 2026-02-27 20:09:19,666] Trial 172 finished with value: 0.8258617668754068 and parameters: {'activation': 'tanh', 'solver': 'adam', 'lr': 0.00011514925272286769, 'layer1': 288, 'layer2': 483, 'layer3': 157}. Best is trial 91 with value: 0.8315336183309556.

Klebsiella_Pneumoniae | Ciprofloxacin | Optuna:  86%|████████▋ | 173/200 [5:21:49<36:01, 80.04s/it, best=0.832][A
Klebsiella_Pneumoniae | Ciprofloxacin | Optuna:  86%|████████▋ | 173/200 [5:21:49<36:01, 80.04s/it, best=0.832][A[I 2026-02-27 20:09:47,308] Trial 129 finished with value: 0.807430920618806 and parameters: {'activation': 'tanh', 'solver': 'adam', 'lr': 1.7238293284853234e-05, 'layer1': 181, 'layer2': 302, 'layer3': 39}. Best is trial 124 with value: 0.8095465376114227.

Escherichia_Coli | Ciprofloxacin | Optuna:  65%|██████▌   | 130/200 [5:22:16<3:15:05, 167.23s/it, best=0.809][A
Escherichia_Coli | Ciprofloxacin | Optuna:  65%|██████▌   | 130/200 [5:22:16<3:15:05, 167.23s/it, best=0.809][A[I 2026-02-27 20:09:59,066] Trial 108 finished with value: 0.8560708088219421 and parameters: {'activation': 'tanh', 'solver': 'adam', 'lr': 0.0009007098565087092, 'layer1': 459, 'layer2': 348, 'layer3': 77}. Best is trial 42 with value: 0.8645324176837453.

Pseudomonas_Aeruginosa | Imipenem | Optuna:  55%|█████▍    | 109/200 [1:37:53<1:45:28, 69.54s/it, best=0.865][A
Pseudomonas_Aeruginosa | Imipenem | Optuna:  55%|█████▍    | 109/200 [1:37:53<1:45:28, 69.54s/it, best=0.865][A[I 2026-02-27 20:10:32,731] Trial 147 finished with value: 0.9046504363625978 and parameters: {'activation': 'identity', 'solver': 'adam', 'lr': 9.223809411832955e-05, 'layer1': 252, 'layer2': 468, 'layer3': 495}. Best is trial 84 with value: 0.9099428178723615.

Staphylococcus_Aureus | Oxacillin | Optuna:  74%|███████▍  | 148/200 [5:23:02<1:55:41, 133.50s/it, best=0.91][A
Staphylococcus_Aureus | Oxacillin | Optuna:  74%|███████▍  | 148/200 [5:23:02<1:55:41, 133.50s/it, best=0.91][A[I 2026-02-27 20:10:54,032] Trial 173 finished with value: 0.8179663797647623 and parameters: {'activation': 'tanh', 'solver': 'adam', 'lr': 0.0003839337140583114, 'layer1': 303, 'layer2': 454, 'layer3': 143}. Best is trial 91 with value: 0.8315336183309556.

Klebsiella_Pneumoniae | Ciprofloxacin | Optuna:  87%|████████▋ | 174/200 [5:23:23<36:32, 84.34s/it, best=0.832][A
Klebsiella_Pneumoniae | Ciprofloxacin | Optuna:  87%|████████▋ | 174/200 [5:23:23<36:32, 84.34s/it, best=0.832][A[I 2026-02-27 20:11:07,949] Trial 109 finished with value: 0.859629743666941 and parameters: {'activation': 'relu', 'solver': 'adam', 'lr': 0.0007003510151786261, 'layer1': 447, 'layer2': 315, 'layer3': 309}. Best is trial 42 with value: 0.8645324176837453.

Pseudomonas_Aeruginosa | Imipenem | Optuna:  55%|█████▌    | 110/200 [1:39:02<1:44:01, 69.35s/it, best=0.865][A
Pseudomonas_Aeruginosa | Imipenem | Optuna:  55%|█████▌    | 110/200 [1:39:02<1:44:01, 69.35s/it, best=0.865][A[I 2026-02-27 20:12:17,403] Trial 110 finished with value: 0.8601480617063112 and parameters: {'activation': 'relu', 'solver': 'adam', 'lr': 0.0002922991120234531, 'layer1': 440, 'layer2': 368, 'layer3': 66}. Best is trial 42 with value: 0.8645324176837453.

Pseudomonas_Aeruginosa | Imipenem | Optuna:  56%|█████▌    | 111/200 [1:40:11<1:42:54, 69.38s/it, best=0.865][A
Pseudomonas_Aeruginosa | Imipenem | Optuna:  56%|█████▌    | 111/200 [1:40:11<1:42:54, 69.38s/it, best=0.865][A[I 2026-02-27 20:12:35,700] Trial 174 finished with value: 0.8231529051769163 and parameters: {'activation': 'tanh', 'solver': 'adam', 'lr': 0.00019061565636886198, 'layer1': 295, 'layer2': 468, 'layer3': 172}. Best is trial 91 with value: 0.8315336183309556.

Klebsiella_Pneumoniae | Ciprofloxacin | Optuna:  88%|████████▊ | 175/200 [5:25:05<37:18, 89.54s/it, best=0.832][A
Klebsiella_Pneumoniae | Ciprofloxacin | Optuna:  88%|████████▊ | 175/200 [5:25:05<37:18, 89.54s/it, best=0.832][A[I 2026-02-27 20:12:48,421] Trial 130 finished with value: 0.8014982915477488 and parameters: {'activation': 'tanh', 'solver': 'adam', 'lr': 1.7977120466109863e-05, 'layer1': 184, 'layer2': 301, 'layer3': 38}. Best is trial 124 with value: 0.8095465376114227.

Escherichia_Coli | Ciprofloxacin | Optuna:  66%|██████▌   | 131/200 [5:25:17<3:17:06, 171.39s/it, best=0.809][A
Escherichia_Coli | Ciprofloxacin | Optuna:  66%|██████▌   | 131/200 [5:25:17<3:17:06, 171.39s/it, best=0.809][A[I 2026-02-27 20:12:55,392] Trial 148 finished with value: 0.9064504690660616 and parameters: {'activation': 'identity', 'solver': 'adam', 'lr': 6.865393732347838e-05, 'layer1': 265, 'layer2': 265, 'layer3': 487}. Best is trial 84 with value: 0.9099428178723615.

Staphylococcus_Aureus | Oxacillin | Optuna:  74%|███████▍  | 149/200 [5:25:25<1:55:48, 136.25s/it, best=0.91][A
Staphylococcus_Aureus | Oxacillin | Optuna:  74%|███████▍  | 149/200 [5:25:25<1:55:48, 136.25s/it, best=0.91][A[I 2026-02-27 20:13:49,553] Trial 111 finished with value: 0.8612603425369094 and parameters: {'activation': 'relu', 'solver': 'adam', 'lr': 0.0004671718760493206, 'layer1': 470, 'layer2': 404, 'layer3': 105}. Best is trial 42 with value: 0.8645324176837453.

Pseudomonas_Aeruginosa | Imipenem | Optuna:  56%|█████▌    | 112/200 [1:41:43<1:51:46, 76.21s/it, best=0.865][A
Pseudomonas_Aeruginosa | Imipenem | Optuna:  56%|█████▌    | 112/200 [1:41:43<1:51:46, 76.21s/it, best=0.865][A[I 2026-02-27 20:13:50,028] Trial 175 finished with value: 0.8249623488119349 and parameters: {'activation': 'tanh', 'solver': 'adam', 'lr': 0.0002568687650046275, 'layer1': 330, 'layer2': 443, 'layer3': 133}. Best is trial 91 with value: 0.8315336183309556.

Klebsiella_Pneumoniae | Ciprofloxacin | Optuna:  88%|████████▊ | 176/200 [5:26:19<33:59, 84.97s/it, best=0.832][A
Klebsiella_Pneumoniae | Ciprofloxacin | Optuna:  88%|████████▊ | 176/200 [5:26:19<33:59, 84.97s/it, best=0.832][A[I 2026-02-27 20:13:56,942] Trial 149 finished with value: 0.8935295275648245 and parameters: {'activation': 'tanh', 'solver': 'adam', 'lr': 0.0014542794367113174, 'layer1': 219, 'layer2': 400, 'layer3': 473}. Best is trial 84 with value: 0.9099428178723615.

Staphylococcus_Aureus | Oxacillin | Optuna:  75%|███████▌  | 150/200 [5:26:26<1:34:51, 113.84s/it, best=0.91][A
Staphylococcus_Aureus | Oxacillin | Optuna:  75%|███████▌  | 150/200 [5:26:26<1:34:51, 113.84s/it, best=0.91][A[I 2026-02-27 20:14:57,894] Trial 112 finished with value: 0.863771457259787 and parameters: {'activation': 'relu', 'solver': 'adam', 'lr': 0.0005270431709733928, 'layer1': 492, 'layer2': 345, 'layer3': 89}. Best is trial 42 with value: 0.8645324176837453.

Pseudomonas_Aeruginosa | Imipenem | Optuna:  56%|█████▋    | 113/200 [1:42:52<1:47:04, 73.85s/it, best=0.865][A
Pseudomonas_Aeruginosa | Imipenem | Optuna:  56%|█████▋    | 113/200 [1:42:52<1:47:04, 73.85s/it, best=0.865][A[I 2026-02-27 20:15:12,753] Trial 176 finished with value: 0.8280117022731197 and parameters: {'activation': 'tanh', 'solver': 'adam', 'lr': 0.00010431010095085696, 'layer1': 316, 'layer2': 485, 'layer3': 166}. Best is trial 91 with value: 0.8315336183309556.

Klebsiella_Pneumoniae | Ciprofloxacin | Optuna:  88%|████████▊ | 177/200 [5:27:42<32:18, 84.30s/it, best=0.832][A
Klebsiella_Pneumoniae | Ciprofloxacin | Optuna:  88%|████████▊ | 177/200 [5:27:42<32:18, 84.30s/it, best=0.832][A[I 2026-02-27 20:15:50,468] Trial 150 finished with value: 0.9068994273799229 and parameters: {'activation': 'identity', 'solver': 'adam', 'lr': 0.00011819225736684543, 'layer1': 245, 'layer2': 138, 'layer3': 462}. Best is trial 84 with value: 0.9099428178723615.

Staphylococcus_Aureus | Oxacillin | Optuna:  76%|███████▌  | 151/200 [5:28:20<1:32:53, 113.74s/it, best=0.91][A
Staphylococcus_Aureus | Oxacillin | Optuna:  76%|███████▌  | 151/200 [5:28:20<1:32:53, 113.74s/it, best=0.91][A[I 2026-02-27 20:16:04,660] Trial 131 finished with value: 0.8020625679916391 and parameters: {'activation': 'tanh', 'solver': 'adam', 'lr': 1.4572865376499745e-05, 'layer1': 155, 'layer2': 259, 'layer3': 23}. Best is trial 124 with value: 0.8095465376114227.

Escherichia_Coli | Ciprofloxacin | Optuna:  66%|██████▌   | 132/200 [5:28:34<3:22:41, 178.85s/it, best=0.809][A
Escherichia_Coli | Ciprofloxacin | Optuna:  66%|██████▌   | 132/200 [5:28:34<3:22:41, 178.85s/it, best=0.809][A[I 2026-02-27 20:16:23,306] Trial 113 finished with value: 0.8634131876836116 and parameters: {'activation': 'relu', 'solver': 'adam', 'lr': 0.0005865680575689911, 'layer1': 452, 'layer2': 337, 'layer3': 90}. Best is trial 42 with value: 0.8645324176837453.

Pseudomonas_Aeruginosa | Imipenem | Optuna:  57%|█████▋    | 114/200 [1:44:17<1:50:49, 77.32s/it, best=0.865][A
Pseudomonas_Aeruginosa | Imipenem | Optuna:  57%|█████▋    | 114/200 [1:44:17<1:50:49, 77.32s/it, best=0.865][A[I 2026-02-27 20:16:44,625] Trial 177 finished with value: 0.8312688661007439 and parameters: {'activation': 'tanh', 'solver': 'adam', 'lr': 9.774013530629629e-05, 'layer1': 319, 'layer2': 490, 'layer3': 160}. Best is trial 91 with value: 0.8315336183309556.

Klebsiella_Pneumoniae | Ciprofloxacin | Optuna:  89%|████████▉ | 178/200 [5:29:14<31:44, 86.57s/it, best=0.832][A
Klebsiella_Pneumoniae | Ciprofloxacin | Optuna:  89%|████████▉ | 178/200 [5:29:14<31:44, 86.57s/it, best=0.832][A[I 2026-02-27 20:18:03,652] Trial 114 finished with value: 0.8625382201724496 and parameters: {'activation': 'relu', 'solver': 'adam', 'lr': 0.0005350813405563127, 'layer1': 487, 'layer2': 350, 'layer3': 88}. Best is trial 42 with value: 0.8645324176837453.

Pseudomonas_Aeruginosa | Imipenem | Optuna:  57%|█████▊    | 115/200 [1:45:57<1:59:19, 84.23s/it, best=0.865][A
Pseudomonas_Aeruginosa | Imipenem | Optuna:  57%|█████▊    | 115/200 [1:45:57<1:59:19, 84.23s/it, best=0.865][A[I 2026-02-27 20:18:05,314] Trial 178 finished with value: 0.823169947232478 and parameters: {'activation': 'tanh', 'solver': 'adam', 'lr': 0.00017719276688669562, 'layer1': 281, 'layer2': 500, 'layer3': 154}. Best is trial 91 with value: 0.8315336183309556.

Klebsiella_Pneumoniae | Ciprofloxacin | Optuna:  90%|████████▉ | 179/200 [5:30:34<29:40, 84.81s/it, best=0.832][A
Klebsiella_Pneumoniae | Ciprofloxacin | Optuna:  90%|████████▉ | 179/200 [5:30:34<29:40, 84.81s/it, best=0.832][A[I 2026-02-27 20:18:16,751] Trial 151 finished with value: 0.9065776051844304 and parameters: {'activation': 'identity', 'solver': 'adam', 'lr': 0.00015975977609963162, 'layer1': 327, 'layer2': 430, 'layer3': 499}. Best is trial 84 with value: 0.9099428178723615.

Staphylococcus_Aureus | Oxacillin | Optuna:  76%|███████▌  | 152/200 [5:30:46<1:38:48, 123.51s/it, best=0.91][A
Staphylococcus_Aureus | Oxacillin | Optuna:  76%|███████▌  | 152/200 [5:30:46<1:38:48, 123.51s/it, best=0.91][A[I 2026-02-27 20:19:17,075] Trial 115 finished with value: 0.861998590788424 and parameters: {'activation': 'relu', 'solver': 'adam', 'lr': 0.00027642274780979056, 'layer1': 451, 'layer2': 332, 'layer3': 116}. Best is trial 42 with value: 0.8645324176837453.

Pseudomonas_Aeruginosa | Imipenem | Optuna:  58%|█████▊    | 116/200 [1:47:11<1:53:22, 80.99s/it, best=0.865][A
Pseudomonas_Aeruginosa | Imipenem | Optuna:  58%|█████▊    | 116/200 [1:47:11<1:53:22, 80.99s/it, best=0.865][A[I 2026-02-27 20:19:27,206] Trial 179 finished with value: 0.820749426613203 and parameters: {'activation': 'tanh', 'solver': 'adam', 'lr': 0.00030255406248367185, 'layer1': 296, 'layer2': 487, 'layer3': 128}. Best is trial 91 with value: 0.8315336183309556.

Klebsiella_Pneumoniae | Ciprofloxacin | Optuna:  90%|█████████ | 180/200 [5:31:56<27:58, 83.93s/it, best=0.832][A
Klebsiella_Pneumoniae | Ciprofloxacin | Optuna:  90%|█████████ | 180/200 [5:31:56<27:58, 83.93s/it, best=0.832][A[I 2026-02-27 20:20:32,656] Trial 116 finished with value: 0.8615813052727745 and parameters: {'activation': 'logistic', 'solver': 'adam', 'lr': 0.0003871754002812565, 'layer1': 435, 'layer2': 342, 'layer3': 80}. Best is trial 42 with value: 0.8645324176837453.

Pseudomonas_Aeruginosa | Imipenem | Optuna:  58%|█████▊    | 117/200 [1:48:26<1:49:47, 79.36s/it, best=0.865][A
Pseudomonas_Aeruginosa | Imipenem | Optuna:  58%|█████▊    | 117/200 [1:48:26<1:49:47, 79.36s/it, best=0.865][A[I 2026-02-27 20:20:38,534] Trial 152 finished with value: 0.9102139153966748 and parameters: {'activation': 'identity', 'solver': 'adam', 'lr': 0.00018289210821592565, 'layer1': 338, 'layer2': 416, 'layer3': 379}. Best is trial 152 with value: 0.9102139153966748.

Staphylococcus_Aureus | Oxacillin | Optuna:  76%|███████▋  | 153/200 [5:33:08<1:41:02, 128.99s/it, best=0.91][A
Staphylococcus_Aureus | Oxacillin | Optuna:  76%|███████▋  | 153/200 [5:33:08<1:41:02, 128.99s/it, best=0.91][A[I 2026-02-27 20:20:53,413] Trial 132 finished with value: 0.8008326647524925 and parameters: {'activation': 'tanh', 'solver': 'adam', 'lr': 7.377694321220237e-06, 'layer1': 227, 'layer2': 293, 'layer3': 47}. Best is trial 124 with value: 0.8095465376114227.

Escherichia_Coli | Ciprofloxacin | Optuna:  66%|██████▋   | 133/200 [5:33:22<3:56:31, 211.82s/it, best=0.809][A
Escherichia_Coli | Ciprofloxacin | Optuna:  66%|██████▋   | 133/200 [5:33:22<3:56:31, 211.82s/it, best=0.809][A[I 2026-02-27 20:21:00,970] Trial 180 finished with value: 0.8272340559772783 and parameters: {'activation': 'tanh', 'solver': 'adam', 'lr': 7.711524126519318e-05, 'layer1': 317, 'layer2': 480, 'layer3': 187}. Best is trial 91 with value: 0.8315336183309556.

Klebsiella_Pneumoniae | Ciprofloxacin | Optuna:  90%|█████████ | 181/200 [5:33:30<27:30, 86.88s/it, best=0.832][A
Klebsiella_Pneumoniae | Ciprofloxacin | Optuna:  90%|█████████ | 181/200 [5:33:30<27:30, 86.88s/it, best=0.832][A[I 2026-02-27 20:21:56,437] Trial 117 finished with value: 0.859506961048187 and parameters: {'activation': 'relu', 'solver': 'adam', 'lr': 0.0007575042025824454, 'layer1': 457, 'layer2': 302, 'layer3': 382}. Best is trial 42 with value: 0.8645324176837453.

Pseudomonas_Aeruginosa | Imipenem | Optuna:  59%|█████▉    | 118/200 [1:49:50<1:50:16, 80.69s/it, best=0.865][A
