Escherichia_Coli | Ceftriaxone | Optuna:  27%|██▋       | 54/200 [2:05:37<5:42:11, 140.63s/it, best=0.897][A[I 2026-02-28 01:15:44,670] Trial 137 finished with value: 0.9058811774068468 and parameters: {'activation': 'tanh', 'solver': 'adam', 'lr': 5.649969348823222e-05, 'layer1': 215, 'layer2': 131, 'layer3': 423}. Best is trial 130 with value: 0.9107197512148748.

Klebsiella_Pneumoniae | Ceftriaxone | Optuna:  69%|██████▉   | 138/200 [4:25:06<2:17:34, 133.14s/it, best=0.911][A
Klebsiella_Pneumoniae | Ceftriaxone | Optuna:  69%|██████▉   | 138/200 [4:25:06<2:17:34, 133.14s/it, best=0.911][A[I 2026-02-28 01:16:32,307] Trial 159 finished with value: 0.8819586664357452 and parameters: {'activation': 'identity', 'solver': 'adam', 'lr': 0.0010172736753369016, 'layer1': 326, 'layer2': 229, 'layer3': 202}. Best is trial 73 with value: 0.8861579932511299.

Pseudomonas_Aeruginosa | Meropenem | Optuna:  80%|████████  | 160/200 [3:12:07<52:50, 79.26s/it, best=0.886][A
Pseudomonas_Aeruginosa | Meropenem | Optuna:  80%|████████  | 160/200 [3:12:07<52:50, 79.26s/it, best=0.886][A[I 2026-02-28 01:16:56,106] Trial 160 finished with value: 0.8429744308639442 and parameters: {'activation': 'logistic', 'solver': 'adam', 'lr': 0.0003519596838803728, 'layer1': 309, 'layer2': 189, 'layer3': 78}. Best is trial 73 with value: 0.8861579932511299.

Pseudomonas_Aeruginosa | Meropenem | Optuna:  80%|████████  | 161/200 [3:12:31<40:42, 62.62s/it, best=0.886][A
Pseudomonas_Aeruginosa | Meropenem | Optuna:  80%|████████  | 161/200 [3:12:31<40:42, 62.62s/it, best=0.886][A[I 2026-02-28 01:17:26,044] Trial 141 finished with value: 0.854813906814047 and parameters: {'activation': 'logistic', 'solver': 'adam', 'lr': 0.00033636798599252874, 'layer1': 422, 'layer2': 118, 'layer3': 71}. Best is trial 105 with value: 0.857392473801258.

Staphylococcus_Aureus | Clindamycin | Optuna:  71%|███████   | 142/200 [3:19:27<1:27:06, 90.11s/it, best=0.857][A
Staphylococcus_Aureus | Clindamycin | Optuna:  71%|███████   | 142/200 [3:19:27<1:27:06, 90.11s/it, best=0.857][A[I 2026-02-28 01:17:50,109] Trial 54 finished with value: 0.8940475072900298 and parameters: {'activation': 'relu', 'solver': 'adam', 'lr': 7.457515875006589e-05, 'layer1': 482, 'layer2': 149, 'layer3': 110}. Best is trial 14 with value: 0.8971256036318559.

Escherichia_Coli | Ceftriaxone | Optuna:  28%|██▊       | 55/200 [2:07:51<5:34:49, 138.55s/it, best=0.897][A
Escherichia_Coli | Ceftriaxone | Optuna:  28%|██▊       | 55/200 [2:07:51<5:34:49, 138.55s/it, best=0.897][A[I 2026-02-28 01:17:50,327] Trial 138 finished with value: 0.9020356799653731 and parameters: {'activation': 'tanh', 'solver': 'sgd', 'lr': 0.009918085343130302, 'layer1': 254, 'layer2': 446, 'layer3': 362}. Best is trial 130 with value: 0.9107197512148748.

Klebsiella_Pneumoniae | Ceftriaxone | Optuna:  70%|██████▉   | 139/200 [4:27:11<2:13:04, 130.89s/it, best=0.911][A
Klebsiella_Pneumoniae | Ceftriaxone | Optuna:  70%|██████▉   | 139/200 [4:27:11<2:13:04, 130.89s/it, best=0.911][A[I 2026-02-28 01:18:03,523] Trial 161 finished with value: 0.883383575154378 and parameters: {'activation': 'identity', 'solver': 'adam', 'lr': 0.0004898739713114526, 'layer1': 363, 'layer2': 256, 'layer3': 239}. Best is trial 73 with value: 0.8861579932511299.

Pseudomonas_Aeruginosa | Meropenem | Optuna:  81%|████████  | 162/200 [3:13:38<40:34, 64.06s/it, best=0.886][A
Pseudomonas_Aeruginosa | Meropenem | Optuna:  81%|████████  | 162/200 [3:13:38<40:34, 64.06s/it, best=0.886][A[I 2026-02-28 01:18:24,519] Trial 139 finished with value: 0.7839711692089227 and parameters: {'activation': 'relu', 'solver': 'adam', 'lr': 1.437462833276049e-05, 'layer1': 364, 'layer2': 474, 'layer3': 133}. Best is trial 130 with value: 0.9107197512148748.

Klebsiella_Pneumoniae | Ceftriaxone | Optuna:  70%|███████   | 140/200 [4:27:46<1:41:52, 101.88s/it, best=0.911][A
Klebsiella_Pneumoniae | Ceftriaxone | Optuna:  70%|███████   | 140/200 [4:27:46<1:41:52, 101.88s/it, best=0.911][A[I 2026-02-28 01:19:16,598] Trial 162 finished with value: 0.8817985464707666 and parameters: {'activation': 'identity', 'solver': 'adam', 'lr': 0.0005980880432713937, 'layer1': 347, 'layer2': 464, 'layer3': 432}. Best is trial 73 with value: 0.8861579932511299.

Pseudomonas_Aeruginosa | Meropenem | Optuna:  82%|████████▏ | 163/200 [3:14:51<41:10, 66.77s/it, best=0.886][A
Pseudomonas_Aeruginosa | Meropenem | Optuna:  82%|████████▏ | 163/200 [3:14:51<41:10, 66.77s/it, best=0.886][A[I 2026-02-28 01:19:19,168] Trial 142 finished with value: 0.8515677135345694 and parameters: {'activation': 'logistic', 'solver': 'adam', 'lr': 0.0006937588438926936, 'layer1': 430, 'layer2': 121, 'layer3': 65}. Best is trial 105 with value: 0.857392473801258.

Staphylococcus_Aureus | Clindamycin | Optuna:  72%|███████▏  | 143/200 [3:21:20<1:32:09, 97.01s/it, best=0.857][A
Staphylococcus_Aureus | Clindamycin | Optuna:  72%|███████▏  | 143/200 [3:21:20<1:32:09, 97.01s/it, best=0.857][A[I 2026-02-28 01:20:20,433] Trial 163 finished with value: 0.8819673310554201 and parameters: {'activation': 'identity', 'solver': 'adam', 'lr': 0.0007161068735027093, 'layer1': 379, 'layer2': 272, 'layer3': 420}. Best is trial 73 with value: 0.8861579932511299.

Pseudomonas_Aeruginosa | Meropenem | Optuna:  82%|████████▏ | 164/200 [3:15:55<39:31, 65.89s/it, best=0.886][A
Pseudomonas_Aeruginosa | Meropenem | Optuna:  82%|████████▏ | 164/200 [3:15:55<39:31, 65.89s/it, best=0.886][A[I 2026-02-28 01:20:52,783] Trial 55 finished with value: 0.8903166140892586 and parameters: {'activation': 'relu', 'solver': 'adam', 'lr': 2.9268878237132156e-05, 'layer1': 103, 'layer2': 150, 'layer3': 79}. Best is trial 14 with value: 0.8971256036318559.

Escherichia_Coli | Ceftriaxone | Optuna:  28%|██▊       | 56/200 [2:10:54<6:04:17, 151.79s/it, best=0.897][A
Escherichia_Coli | Ceftriaxone | Optuna:  28%|██▊       | 56/200 [2:10:54<6:04:17, 151.79s/it, best=0.897][A[I 2026-02-28 01:21:38,611] Trial 143 finished with value: 0.8568515355894611 and parameters: {'activation': 'logistic', 'solver': 'adam', 'lr': 0.00030928265457756785, 'layer1': 405, 'layer2': 140, 'layer3': 71}. Best is trial 105 with value: 0.857392473801258.

Staphylococcus_Aureus | Clindamycin | Optuna:  72%|███████▏  | 144/200 [3:23:40<1:42:25, 109.74s/it, best=0.857][A
Staphylococcus_Aureus | Clindamycin | Optuna:  72%|███████▏  | 144/200 [3:23:40<1:42:25, 109.74s/it, best=0.857][A[I 2026-02-28 01:21:40,247] Trial 140 finished with value: 0.9007630065819962 and parameters: {'activation': 'tanh', 'solver': 'adam', 'lr': 7.578932383516993e-06, 'layer1': 198, 'layer2': 458, 'layer3': 413}. Best is trial 130 with value: 0.9107197512148748.

Klebsiella_Pneumoniae | Ceftriaxone | Optuna:  70%|███████   | 141/200 [4:31:01<2:07:52, 130.04s/it, best=0.911][A
Klebsiella_Pneumoniae | Ceftriaxone | Optuna:  70%|███████   | 141/200 [4:31:01<2:07:52, 130.04s/it, best=0.911][A[I 2026-02-28 01:21:52,543] Trial 164 finished with value: 0.882914286956674 and parameters: {'activation': 'identity', 'solver': 'adam', 'lr': 0.001533146858383831, 'layer1': 370, 'layer2': 159, 'layer3': 440}. Best is trial 73 with value: 0.8861579932511299.

Pseudomonas_Aeruginosa | Meropenem | Optuna:  82%|████████▎ | 165/200 [3:17:27<43:01, 73.75s/it, best=0.886][A
Pseudomonas_Aeruginosa | Meropenem | Optuna:  82%|████████▎ | 165/200 [3:17:27<43:01, 73.75s/it, best=0.886][A[I 2026-02-28 01:23:18,299] Trial 165 finished with value: 0.884733303847165 and parameters: {'activation': 'identity', 'solver': 'adam', 'lr': 0.0009179434279831502, 'layer1': 355, 'layer2': 277, 'layer3': 452}. Best is trial 73 with value: 0.8861579932511299.

Pseudomonas_Aeruginosa | Meropenem | Optuna:  83%|████████▎ | 166/200 [3:18:53<43:50, 77.35s/it, best=0.886][A
Pseudomonas_Aeruginosa | Meropenem | Optuna:  83%|████████▎ | 166/200 [3:18:53<43:50, 77.35s/it, best=0.886][A[I 2026-02-28 01:24:02,080] Trial 56 finished with value: 0.8940496651334504 and parameters: {'activation': 'relu', 'solver': 'adam', 'lr': 4.841816040628688e-05, 'layer1': 466, 'layer2': 228, 'layer3': 213}. Best is trial 14 with value: 0.8971256036318559.

Escherichia_Coli | Ceftriaxone | Optuna:  28%|██▊       | 57/200 [2:14:03<6:28:34, 163.04s/it, best=0.897][A
Escherichia_Coli | Ceftriaxone | Optuna:  28%|██▊       | 57/200 [2:14:03<6:28:34, 163.04s/it, best=0.897][A[I 2026-02-28 01:24:04,307] Trial 141 finished with value: 0.9079078205063089 and parameters: {'activation': 'tanh', 'solver': 'adam', 'lr': 2.4356148083210088e-05, 'layer1': 410, 'layer2': 439, 'layer3': 431}. Best is trial 130 with value: 0.9107197512148748.

Klebsiella_Pneumoniae | Ceftriaxone | Optuna:  71%|███████   | 142/200 [4:33:25<2:09:46, 134.24s/it, best=0.911][A
Klebsiella_Pneumoniae | Ceftriaxone | Optuna:  71%|███████   | 142/200 [4:33:25<2:09:46, 134.24s/it, best=0.911][A[I 2026-02-28 01:24:07,537] Trial 144 finished with value: 0.8544124535754133 and parameters: {'activation': 'logistic', 'solver': 'adam', 'lr': 0.0002883749569605165, 'layer1': 415, 'layer2': 103, 'layer3': 94}. Best is trial 105 with value: 0.857392473801258.

Staphylococcus_Aureus | Clindamycin | Optuna:  72%|███████▎  | 145/200 [3:26:09<1:51:22, 121.50s/it, best=0.857][A
Staphylococcus_Aureus | Clindamycin | Optuna:  72%|███████▎  | 145/200 [3:26:09<1:51:22, 121.50s/it, best=0.857][A[I 2026-02-28 01:24:43,550] Trial 145 finished with value: 0.7888558471217525 and parameters: {'activation': 'logistic', 'solver': 'adam', 'lr': 0.00015280807203459388, 'layer1': 378, 'layer2': 75, 'layer3': 76}. Best is trial 105 with value: 0.857392473801258.

Staphylococcus_Aureus | Clindamycin | Optuna:  73%|███████▎  | 146/200 [3:26:45<1:26:16, 95.85s/it, best=0.857] [A
Staphylococcus_Aureus | Clindamycin | Optuna:  73%|███████▎  | 146/200 [3:26:45<1:26:16, 95.85s/it, best=0.857][A[I 2026-02-28 01:24:47,203] Trial 166 finished with value: 0.8837168214054365 and parameters: {'activation': 'identity', 'solver': 'adam', 'lr': 0.0009492860715503058, 'layer1': 353, 'layer2': 279, 'layer3': 455}. Best is trial 73 with value: 0.8861579932511299.

Pseudomonas_Aeruginosa | Meropenem | Optuna:  84%|████████▎ | 167/200 [3:20:22<44:27, 80.82s/it, best=0.886][A
Pseudomonas_Aeruginosa | Meropenem | Optuna:  84%|████████▎ | 167/200 [3:20:22<44:27, 80.82s/it, best=0.886][A[I 2026-02-28 01:25:23,325] Trial 146 finished with value: 0.7888558471217525 and parameters: {'activation': 'logistic', 'solver': 'adam', 'lr': 0.00010411976445308278, 'layer1': 400, 'layer2': 143, 'layer3': 73}. Best is trial 105 with value: 0.857392473801258.

Staphylococcus_Aureus | Clindamycin | Optuna:  74%|███████▎  | 147/200 [3:27:24<1:09:48, 79.03s/it, best=0.857][A
Staphylococcus_Aureus | Clindamycin | Optuna:  74%|███████▎  | 147/200 [3:27:24<1:09:48, 79.03s/it, best=0.857][A[I 2026-02-28 01:26:11,667] Trial 142 finished with value: 0.9060137253601559 and parameters: {'activation': 'tanh', 'solver': 'adam', 'lr': 2.4016573468275015e-05, 'layer1': 412, 'layer2': 500, 'layer3': 434}. Best is trial 130 with value: 0.9107197512148748.

Klebsiella_Pneumoniae | Ceftriaxone | Optuna:  72%|███████▏  | 143/200 [4:35:33<2:05:34, 132.18s/it, best=0.911][A
Klebsiella_Pneumoniae | Ceftriaxone | Optuna:  72%|███████▏  | 143/200 [4:35:33<2:05:34, 132.18s/it, best=0.911][A[I 2026-02-28 01:26:16,483] Trial 167 finished with value: 0.8800854093248075 and parameters: {'activation': 'identity', 'solver': 'adam', 'lr': 0.00010684259211758849, 'layer1': 417, 'layer2': 291, 'layer3': 480}. Best is trial 73 with value: 0.8861579932511299.

Pseudomonas_Aeruginosa | Meropenem | Optuna:  84%|████████▍ | 168/200 [3:21:51<44:27, 83.36s/it, best=0.886][A
Pseudomonas_Aeruginosa | Meropenem | Optuna:  84%|████████▍ | 168/200 [3:21:51<44:27, 83.36s/it, best=0.886][A[I 2026-02-28 01:26:22,015] Trial 57 finished with value: 0.7174906921122333 and parameters: {'activation': 'identity', 'solver': 'sgd', 'lr': 0.00012354061970078835, 'layer1': 499, 'layer2': 120, 'layer3': 32}. Best is trial 14 with value: 0.8971256036318559.

Escherichia_Coli | Ceftriaxone | Optuna:  29%|██▉       | 58/200 [2:16:23<6:09:27, 156.11s/it, best=0.897][A
Escherichia_Coli | Ceftriaxone | Optuna:  29%|██▉       | 58/200 [2:16:23<6:09:27, 156.11s/it, best=0.897][A[I 2026-02-28 01:26:54,044] Trial 147 finished with value: 0.8564860923773348 and parameters: {'activation': 'logistic', 'solver': 'adam', 'lr': 0.0005309781372109558, 'layer1': 150, 'layer2': 61, 'layer3': 82}. Best is trial 105 with value: 0.857392473801258.

Staphylococcus_Aureus | Clindamycin | Optuna:  74%|███████▍  | 148/200 [3:28:55<1:11:31, 82.54s/it, best=0.857][A
Staphylococcus_Aureus | Clindamycin | Optuna:  74%|███████▍  | 148/200 [3:28:55<1:11:31, 82.54s/it, best=0.857][A[I 2026-02-28 01:27:44,352] Trial 168 finished with value: 0.8830169373377933 and parameters: {'activation': 'identity', 'solver': 'adam', 'lr': 0.0008512564725190892, 'layer1': 337, 'layer2': 243, 'layer3': 471}. Best is trial 73 with value: 0.8861579932511299.

Pseudomonas_Aeruginosa | Meropenem | Optuna:  84%|████████▍ | 169/200 [3:23:19<43:46, 84.71s/it, best=0.886][A
Pseudomonas_Aeruginosa | Meropenem | Optuna:  84%|████████▍ | 169/200 [3:23:19<43:46, 84.71s/it, best=0.886][A[I 2026-02-28 01:27:53,335] Trial 58 finished with value: 0.8737951492359851 and parameters: {'activation': 'logistic', 'solver': 'adam', 'lr': 0.001506761058865246, 'layer1': 437, 'layer2': 186, 'layer3': 91}. Best is trial 14 with value: 0.8971256036318559.

Escherichia_Coli | Ceftriaxone | Optuna:  30%|██▉       | 59/200 [2:17:54<5:21:10, 136.67s/it, best=0.897][A
Escherichia_Coli | Ceftriaxone | Optuna:  30%|██▉       | 59/200 [2:17:54<5:21:10, 136.67s/it, best=0.897][A[I 2026-02-28 01:27:59,065] Trial 143 finished with value: 0.9060535155169713 and parameters: {'activation': 'tanh', 'solver': 'adam', 'lr': 3.856338553639544e-05, 'layer1': 398, 'layer2': 442, 'layer3': 400}. Best is trial 130 with value: 0.9107197512148748.

Klebsiella_Pneumoniae | Ceftriaxone | Optuna:  72%|███████▏  | 144/200 [4:37:20<1:56:25, 124.74s/it, best=0.911][A
Klebsiella_Pneumoniae | Ceftriaxone | Optuna:  72%|███████▏  | 144/200 [4:37:20<1:56:25, 124.74s/it, best=0.911][A[I 2026-02-28 01:28:21,736] Trial 148 finished with value: 0.8551250685606273 and parameters: {'activation': 'logistic', 'solver': 'adam', 'lr': 0.0006226849083606637, 'layer1': 149, 'layer2': 57, 'layer3': 84}. Best is trial 105 with value: 0.857392473801258.

Staphylococcus_Aureus | Clindamycin | Optuna:  74%|███████▍  | 149/200 [3:30:23<1:11:28, 84.08s/it, best=0.857][A
Staphylococcus_Aureus | Clindamycin | Optuna:  74%|███████▍  | 149/200 [3:30:23<1:11:28, 84.08s/it, best=0.857][A[I 2026-02-28 01:29:04,195] Trial 169 finished with value: 0.8813417833974772 and parameters: {'activation': 'identity', 'solver': 'adam', 'lr': 0.0013605281922132416, 'layer1': 387, 'layer2': 322, 'layer3': 447}. Best is trial 73 with value: 0.8861579932511299.

Pseudomonas_Aeruginosa | Meropenem | Optuna:  85%|████████▌ | 170/200 [3:24:39<41:37, 83.25s/it, best=0.886][A
Pseudomonas_Aeruginosa | Meropenem | Optuna:  85%|████████▌ | 170/200 [3:24:39<41:37, 83.25s/it, best=0.886][A[I 2026-02-28 01:29:55,471] Trial 149 finished with value: 0.8559866835287927 and parameters: {'activation': 'logistic', 'solver': 'adam', 'lr': 0.0005586419340804103, 'layer1': 177, 'layer2': 45, 'layer3': 106}. Best is trial 105 with value: 0.857392473801258.

Staphylococcus_Aureus | Clindamycin | Optuna:  75%|███████▌  | 150/200 [3:31:57<1:12:28, 86.98s/it, best=0.857][A
Staphylococcus_Aureus | Clindamycin | Optuna:  75%|███████▌  | 150/200 [3:31:57<1:12:28, 86.98s/it, best=0.857][A[I 2026-02-28 01:30:02,048] Trial 59 finished with value: 0.8951499811747639 and parameters: {'activation': 'relu', 'solver': 'adam', 'lr': 8.810764805282623e-05, 'layer1': 458, 'layer2': 250, 'layer3': 134}. Best is trial 14 with value: 0.8971256036318559.

Escherichia_Coli | Ceftriaxone | Optuna:  30%|███       | 60/200 [2:20:03<5:13:19, 134.28s/it, best=0.897][A
Escherichia_Coli | Ceftriaxone | Optuna:  30%|███       | 60/200 [2:20:03<5:13:19, 134.28s/it, best=0.897][A[I 2026-02-28 01:30:04,929] Trial 144 finished with value: 0.9065192719157997 and parameters: {'activation': 'tanh', 'solver': 'adam', 'lr': 1.615589318504779e-05, 'layer1': 342, 'layer2': 485, 'layer3': 378}. Best is trial 130 with value: 0.9107197512148748.

Klebsiella_Pneumoniae | Ceftriaxone | Optuna:  72%|███████▎  | 145/200 [4:39:26<1:54:39, 125.08s/it, best=0.911][A
Klebsiella_Pneumoniae | Ceftriaxone | Optuna:  72%|███████▎  | 145/200 [4:39:26<1:54:39, 125.08s/it, best=0.911][A[I 2026-02-28 01:30:16,403] Trial 170 finished with value: 0.8813817080824649 and parameters: {'activation': 'identity', 'solver': 'adam', 'lr': 0.00043308676869922386, 'layer1': 318, 'layer2': 263, 'layer3': 462}. Best is trial 73 with value: 0.8861579932511299.

Pseudomonas_Aeruginosa | Meropenem | Optuna:  86%|████████▌ | 171/200 [3:25:51<38:38, 79.94s/it, best=0.886][A
Pseudomonas_Aeruginosa | Meropenem | Optuna:  86%|████████▌ | 171/200 [3:25:51<38:38, 79.94s/it, best=0.886][A[I 2026-02-28 01:30:52,315] Trial 150 finished with value: 0.8457429981508126 and parameters: {'activation': 'tanh', 'solver': 'adam', 'lr': 0.0005320459667515907, 'layer1': 178, 'layer2': 44, 'layer3': 58}. Best is trial 105 with value: 0.857392473801258.

Staphylococcus_Aureus | Clindamycin | Optuna:  76%|███████▌  | 151/200 [3:32:53<1:03:38, 77.94s/it, best=0.857][A
Staphylococcus_Aureus | Clindamycin | Optuna:  76%|███████▌  | 151/200 [3:32:53<1:03:38, 77.94s/it, best=0.857][A[I 2026-02-28 01:31:54,982] Trial 171 finished with value: 0.8826969668323498 and parameters: {'activation': 'identity', 'solver': 'adam', 'lr': 0.0010690935973304576, 'layer1': 356, 'layer2': 301, 'layer3': 414}. Best is trial 73 with value: 0.8861579932511299.

Pseudomonas_Aeruginosa | Meropenem | Optuna:  86%|████████▌ | 172/200 [3:27:30<39:54, 85.53s/it, best=0.886][A
Pseudomonas_Aeruginosa | Meropenem | Optuna:  86%|████████▌ | 172/200 [3:27:30<39:54, 85.53s/it, best=0.886][A[I 2026-02-28 01:32:08,659] Trial 151 finished with value: 0.852286063487709 and parameters: {'activation': 'logistic', 'solver': 'adam', 'lr': 0.0006303617250748419, 'layer1': 150, 'layer2': 62, 'layer3': 105}. Best is trial 105 with value: 0.857392473801258.

Staphylococcus_Aureus | Clindamycin | Optuna:  76%|███████▌  | 152/200 [3:34:10<1:01:58, 77.46s/it, best=0.857][A
Staphylococcus_Aureus | Clindamycin | Optuna:  76%|███████▌  | 152/200 [3:34:10<1:01:58, 77.46s/it, best=0.857][A[I 2026-02-28 01:32:16,817] Trial 145 finished with value: 0.9065494936255906 and parameters: {'activation': 'tanh', 'solver': 'adam', 'lr': 1.856100405977815e-05, 'layer1': 387, 'layer2': 425, 'layer3': 411}. Best is trial 130 with value: 0.9107197512148748.

Klebsiella_Pneumoniae | Ceftriaxone | Optuna:  73%|███████▎  | 146/200 [4:41:38<1:54:24, 127.12s/it, best=0.911][A
Klebsiella_Pneumoniae | Ceftriaxone | Optuna:  73%|███████▎  | 146/200 [4:41:38<1:54:24, 127.12s/it, best=0.911][A[I 2026-02-28 01:32:21,988] Trial 60 finished with value: 0.8944094140147861 and parameters: {'activation': 'relu', 'solver': 'adam', 'lr': 8.710780948031632e-05, 'layer1': 485, 'layer2': 249, 'layer3': 141}. Best is trial 14 with value: 0.8971256036318559.

Escherichia_Coli | Ceftriaxone | Optuna:  30%|███       | 61/200 [2:22:23<5:15:01, 135.98s/it, best=0.897][A
Escherichia_Coli | Ceftriaxone | Optuna:  30%|███       | 61/200 [2:22:23<5:15:01, 135.98s/it, best=0.897][A[I 2026-02-28 01:33:15,965] Trial 172 finished with value: 0.884115966459286 and parameters: {'activation': 'identity', 'solver': 'adam', 'lr': 0.0007340780685411883, 'layer1': 364, 'layer2': 281, 'layer3': 424}. Best is trial 73 with value: 0.8861579932511299.

Pseudomonas_Aeruginosa | Meropenem | Optuna:  86%|████████▋ | 173/200 [3:28:51<37:52, 84.17s/it, best=0.886][A
Pseudomonas_Aeruginosa | Meropenem | Optuna:  86%|████████▋ | 173/200 [3:28:51<37:52, 84.17s/it, best=0.886][A[I 2026-02-28 01:33:31,166] Trial 152 finished with value: 0.8550958247173336 and parameters: {'activation': 'logistic', 'solver': 'adam', 'lr': 0.0007300241635660583, 'layer1': 186, 'layer2': 27, 'layer3': 87}. Best is trial 105 with value: 0.857392473801258.

Staphylococcus_Aureus | Clindamycin | Optuna:  76%|███████▋  | 153/200 [3:35:32<1:01:51, 78.97s/it, best=0.857][A
Staphylococcus_Aureus | Clindamycin | Optuna:  76%|███████▋  | 153/200 [3:35:32<1:01:51, 78.97s/it, best=0.857][A[I 2026-02-28 01:34:14,234] Trial 146 finished with value: 0.9075145041394244 and parameters: {'activation': 'tanh', 'solver': 'adam', 'lr': 2.662120396172064e-05, 'layer1': 406, 'layer2': 464, 'layer3': 425}. Best is trial 130 with value: 0.9107197512148748.

Klebsiella_Pneumoniae | Ceftriaxone | Optuna:  74%|███████▎  | 147/200 [4:43:35<1:49:43, 124.21s/it, best=0.911][A
Klebsiella_Pneumoniae | Ceftriaxone | Optuna:  74%|███████▎  | 147/200 [4:43:35<1:49:43, 124.21s/it, best=0.911][A[I 2026-02-28 01:34:39,395] Trial 153 finished with value: 0.8479457077195042 and parameters: {'activation': 'logistic', 'solver': 'adam', 'lr': 0.0009422046155021201, 'layer1': 170, 'layer2': 24, 'layer3': 128}. Best is trial 105 with value: 0.857392473801258.

Staphylococcus_Aureus | Clindamycin | Optuna:  77%|███████▋  | 154/200 [3:36:41<58:04, 75.75s/it, best=0.857]  [A
