Escherichia_Coli | Ceftriaxone | Optuna:   6%|▌         | 12/200 [30:58<5:44:19, 109.89s/it, best=0.894][A[I 2026-02-27 23:41:19,502] Trial 76 finished with value: 0.8378415330429207 and parameters: {'activation': 'relu', 'solver': 'adam', 'lr': 4.605080552309017e-05, 'layer1': 85, 'layer2': 112, 'layer3': 354}. Best is trial 71 with value: 0.8566270523015425.

Staphylococcus_Aureus | Clindamycin | Optuna:  38%|███▊      | 77/200 [1:43:21<3:35:25, 105.09s/it, best=0.857][A
Staphylococcus_Aureus | Clindamycin | Optuna:  38%|███▊      | 77/200 [1:43:21<3:35:25, 105.09s/it, best=0.857][A[I 2026-02-27 23:41:47,238] Trial 77 finished with value: 0.7888558471217525 and parameters: {'activation': 'logistic', 'solver': 'adam', 'lr': 7.587260254856606e-05, 'layer1': 120, 'layer2': 41, 'layer3': 389}. Best is trial 71 with value: 0.8566270523015425.

Staphylococcus_Aureus | Clindamycin | Optuna:  39%|███▉      | 78/200 [1:43:48<2:46:29, 81.88s/it, best=0.857] [A
Staphylococcus_Aureus | Clindamycin | Optuna:  39%|███▉      | 78/200 [1:43:48<2:46:29, 81.88s/it, best=0.857][A[I 2026-02-27 23:42:00,819] Trial 84 finished with value: 0.8826639467226707 and parameters: {'activation': 'identity', 'solver': 'adam', 'lr': 0.001193912807069144, 'layer1': 387, 'layer2': 151, 'layer3': 416}. Best is trial 73 with value: 0.8861579932511299.

Pseudomonas_Aeruginosa | Meropenem | Optuna:  42%|████▎     | 85/200 [1:37:36<2:20:15, 73.18s/it, best=0.886][A
Pseudomonas_Aeruginosa | Meropenem | Optuna:  42%|████▎     | 85/200 [1:37:36<2:20:15, 73.18s/it, best=0.886][A[I 2026-02-27 23:42:34,446] Trial 98 finished with value: 0.9002240049148087 and parameters: {'activation': 'identity', 'solver': 'adam', 'lr': 3.666299131867094e-05, 'layer1': 479, 'layer2': 393, 'layer3': 319}. Best is trial 25 with value: 0.9080365798965563.

Klebsiella_Pneumoniae | Ceftriaxone | Optuna:  50%|████▉     | 99/200 [2:51:55<2:51:08, 101.67s/it, best=0.908][A
Klebsiella_Pneumoniae | Ceftriaxone | Optuna:  50%|████▉     | 99/200 [2:51:55<2:51:08, 101.67s/it, best=0.908][A[I 2026-02-27 23:43:08,856] Trial 12 finished with value: 0.8927850923268992 and parameters: {'activation': 'relu', 'solver': 'adam', 'lr': 8.464188343830307e-05, 'layer1': 350, 'layer2': 200, 'layer3': 130}. Best is trial 4 with value: 0.8940585425996325.

Escherichia_Coli | Ceftriaxone | Optuna:   6%|▋         | 13/200 [33:10<6:03:15, 116.55s/it, best=0.894][A
Escherichia_Coli | Ceftriaxone | Optuna:   6%|▋         | 13/200 [33:10<6:03:15, 116.55s/it, best=0.894][A[I 2026-02-27 23:43:17,062] Trial 85 finished with value: 0.8823852284300105 and parameters: {'activation': 'identity', 'solver': 'adam', 'lr': 0.0003608669021040071, 'layer1': 371, 'layer2': 457, 'layer3': 197}. Best is trial 73 with value: 0.8861579932511299.

Pseudomonas_Aeruginosa | Meropenem | Optuna:  43%|████▎     | 86/200 [1:38:52<2:20:46, 74.10s/it, best=0.886][A
Pseudomonas_Aeruginosa | Meropenem | Optuna:  43%|████▎     | 86/200 [1:38:52<2:20:46, 74.10s/it, best=0.886][A[I 2026-02-27 23:43:55,078] Trial 78 finished with value: 0.8483604721666899 and parameters: {'activation': 'identity', 'solver': 'adam', 'lr': 0.00041141543598410303, 'layer1': 134, 'layer2': 195, 'layer3': 295}. Best is trial 71 with value: 0.8566270523015425.

Staphylococcus_Aureus | Clindamycin | Optuna:  40%|███▉      | 79/200 [1:45:56<3:12:55, 95.67s/it, best=0.857][A
Staphylococcus_Aureus | Clindamycin | Optuna:  40%|███▉      | 79/200 [1:45:56<3:12:55, 95.67s/it, best=0.857][A[I 2026-02-27 23:44:06,614] Trial 99 finished with value: 0.9068921786991503 and parameters: {'activation': 'tanh', 'solver': 'adam', 'lr': 9.208729617377591e-05, 'layer1': 433, 'layer2': 436, 'layer3': 446}. Best is trial 25 with value: 0.9080365798965563.

Klebsiella_Pneumoniae | Ceftriaxone | Optuna:  50%|█████     | 100/200 [2:53:28<2:44:41, 98.82s/it, best=0.908][A
Klebsiella_Pneumoniae | Ceftriaxone | Optuna:  50%|█████     | 100/200 [2:53:28<2:44:41, 98.82s/it, best=0.908][A[I 2026-02-27 23:44:27,068] Trial 79 finished with value: 0.789136742302659 and parameters: {'activation': 'logistic', 'solver': 'adam', 'lr': 4.020603124365574e-05, 'layer1': 197, 'layer2': 132, 'layer3': 212}. Best is trial 71 with value: 0.8566270523015425.

Staphylococcus_Aureus | Clindamycin | Optuna:  40%|████      | 80/200 [1:46:28<2:33:07, 76.57s/it, best=0.857][A
Staphylococcus_Aureus | Clindamycin | Optuna:  40%|████      | 80/200 [1:46:28<2:33:07, 76.57s/it, best=0.857][A[I 2026-02-27 23:44:28,962] Trial 86 finished with value: 0.8815409979599014 and parameters: {'activation': 'identity', 'solver': 'adam', 'lr': 0.0008458826733936658, 'layer1': 312, 'layer2': 268, 'layer3': 265}. Best is trial 73 with value: 0.8861579932511299.

Pseudomonas_Aeruginosa | Meropenem | Optuna:  44%|████▎     | 87/200 [1:40:04<2:18:18, 73.44s/it, best=0.886][A
Pseudomonas_Aeruginosa | Meropenem | Optuna:  44%|████▎     | 87/200 [1:40:04<2:18:18, 73.44s/it, best=0.886][A[I 2026-02-27 23:45:13,796] Trial 87 finished with value: 0.8499729186330557 and parameters: {'activation': 'logistic', 'solver': 'adam', 'lr': 0.0001376861279348429, 'layer1': 292, 'layer2': 436, 'layer3': 471}. Best is trial 73 with value: 0.8861579932511299.

Pseudomonas_Aeruginosa | Meropenem | Optuna:  44%|████▍     | 88/200 [1:40:49<2:01:03, 64.86s/it, best=0.886][A
Pseudomonas_Aeruginosa | Meropenem | Optuna:  44%|████▍     | 88/200 [1:40:49<2:01:03, 64.86s/it, best=0.886][A[I 2026-02-27 23:46:28,932] Trial 13 finished with value: 0.8941886531842688 and parameters: {'activation': 'relu', 'solver': 'adam', 'lr': 3.9734592527141585e-05, 'layer1': 497, 'layer2': 127, 'layer3': 144}. Best is trial 13 with value: 0.8941886531842688.

Escherichia_Coli | Ceftriaxone | Optuna:   7%|▋         | 14/200 [36:30<7:19:31, 141.78s/it, best=0.894][A
Escherichia_Coli | Ceftriaxone | Optuna:   7%|▋         | 14/200 [36:30<7:19:31, 141.78s/it, best=0.894][A[I 2026-02-27 23:46:33,803] Trial 100 finished with value: 0.908149918044165 and parameters: {'activation': 'tanh', 'solver': 'adam', 'lr': 2.8298795801154767e-05, 'layer1': 378, 'layer2': 464, 'layer3': 412}. Best is trial 100 with value: 0.908149918044165.

Klebsiella_Pneumoniae | Ceftriaxone | Optuna:  50%|█████     | 101/200 [2:55:55<3:06:59, 113.33s/it, best=0.908][A
Klebsiella_Pneumoniae | Ceftriaxone | Optuna:  50%|█████     | 101/200 [2:55:55<3:06:59, 113.33s/it, best=0.908][A[I 2026-02-27 23:46:48,400] Trial 88 finished with value: 0.8849671843216802 and parameters: {'activation': 'identity', 'solver': 'adam', 'lr': 0.00030622485168286807, 'layer1': 342, 'layer2': 325, 'layer3': 281}. Best is trial 73 with value: 0.8861579932511299.

Pseudomonas_Aeruginosa | Meropenem | Optuna:  44%|████▍     | 89/200 [1:42:23<2:16:29, 73.78s/it, best=0.886][A
Pseudomonas_Aeruginosa | Meropenem | Optuna:  44%|████▍     | 89/200 [1:42:23<2:16:29, 73.78s/it, best=0.886][A[I 2026-02-27 23:46:48,492] Trial 80 finished with value: 0.7951699973217877 and parameters: {'activation': 'tanh', 'solver': 'sgd', 'lr': 0.00017073752969910586, 'layer1': 276, 'layer2': 62, 'layer3': 145}. Best is trial 71 with value: 0.8566270523015425.

Staphylococcus_Aureus | Clindamycin | Optuna:  40%|████      | 81/200 [1:48:50<3:10:26, 96.02s/it, best=0.857][A
Staphylococcus_Aureus | Clindamycin | Optuna:  40%|████      | 81/200 [1:48:50<3:10:26, 96.02s/it, best=0.857][A[I 2026-02-27 23:47:59,032] Trial 81 finished with value: 0.8529102003431659 and parameters: {'activation': 'tanh', 'solver': 'adam', 'lr': 0.00015560156892321572, 'layer1': 108, 'layer2': 95, 'layer3': 419}. Best is trial 71 with value: 0.8566270523015425.

Staphylococcus_Aureus | Clindamycin | Optuna:  41%|████      | 82/200 [1:50:00<2:53:48, 88.38s/it, best=0.857][A
Staphylococcus_Aureus | Clindamycin | Optuna:  41%|████      | 82/200 [1:50:00<2:53:48, 88.38s/it, best=0.857][A[I 2026-02-27 23:48:10,602] Trial 89 finished with value: 0.8843189229919017 and parameters: {'activation': 'identity', 'solver': 'adam', 'lr': 0.00016875987465399356, 'layer1': 342, 'layer2': 333, 'layer3': 276}. Best is trial 73 with value: 0.8861579932511299.

Pseudomonas_Aeruginosa | Meropenem | Optuna:  45%|████▌     | 90/200 [1:43:45<2:19:53, 76.31s/it, best=0.886][A
Pseudomonas_Aeruginosa | Meropenem | Optuna:  45%|████▌     | 90/200 [1:43:45<2:19:53, 76.31s/it, best=0.886][A[I 2026-02-27 23:48:46,990] Trial 101 finished with value: 0.9061226079282306 and parameters: {'activation': 'tanh', 'solver': 'adam', 'lr': 2.188906185330543e-05, 'layer1': 387, 'layer2': 455, 'layer3': 416}. Best is trial 100 with value: 0.908149918044165.

Klebsiella_Pneumoniae | Ceftriaxone | Optuna:  51%|█████     | 102/200 [2:58:08<3:14:49, 119.29s/it, best=0.908][A
Klebsiella_Pneumoniae | Ceftriaxone | Optuna:  51%|█████     | 102/200 [2:58:08<3:14:49, 119.29s/it, best=0.908][A[I 2026-02-27 23:49:13,922] Trial 90 finished with value: 0.8825446652297156 and parameters: {'activation': 'identity', 'solver': 'adam', 'lr': 0.0002561442241158073, 'layer1': 279, 'layer2': 78, 'layer3': 488}. Best is trial 73 with value: 0.8861579932511299.

Pseudomonas_Aeruginosa | Meropenem | Optuna:  46%|████▌     | 91/200 [1:44:49<2:11:32, 72.41s/it, best=0.886][A
Pseudomonas_Aeruginosa | Meropenem | Optuna:  46%|████▌     | 91/200 [1:44:49<2:11:32, 72.41s/it, best=0.886][A[I 2026-02-27 23:49:20,962] Trial 82 finished with value: 0.8508989315932152 and parameters: {'activation': 'tanh', 'solver': 'adam', 'lr': 0.00011056556344037427, 'layer1': 91, 'layer2': 76, 'layer3': 448}. Best is trial 71 with value: 0.8566270523015425.

Staphylococcus_Aureus | Clindamycin | Optuna:  42%|████▏     | 83/200 [1:51:22<2:48:33, 86.44s/it, best=0.857][A
Staphylococcus_Aureus | Clindamycin | Optuna:  42%|████▏     | 83/200 [1:51:22<2:48:33, 86.44s/it, best=0.857][A[I 2026-02-27 23:50:16,316] Trial 91 finished with value: 0.8834234071839526 and parameters: {'activation': 'identity', 'solver': 'adam', 'lr': 0.0006042623960284767, 'layer1': 319, 'layer2': 316, 'layer3': 115}. Best is trial 73 with value: 0.8861579932511299.

Pseudomonas_Aeruginosa | Meropenem | Optuna:  46%|████▌     | 92/200 [1:45:51<2:04:55, 69.41s/it, best=0.886][A
Pseudomonas_Aeruginosa | Meropenem | Optuna:  46%|████▌     | 92/200 [1:45:51<2:04:55, 69.41s/it, best=0.886][A[I 2026-02-27 23:50:37,114] Trial 83 finished with value: 0.8503956564522765 and parameters: {'activation': 'tanh', 'solver': 'adam', 'lr': 0.00034205826388431323, 'layer1': 144, 'layer2': 103, 'layer3': 432}. Best is trial 71 with value: 0.8566270523015425.

Staphylococcus_Aureus | Clindamycin | Optuna:  42%|████▏     | 84/200 [1:52:38<2:41:09, 83.36s/it, best=0.857][A
Staphylococcus_Aureus | Clindamycin | Optuna:  42%|████▏     | 84/200 [1:52:38<2:41:09, 83.36s/it, best=0.857][A[I 2026-02-27 23:50:44,269] Trial 14 finished with value: 0.8971256036318559 and parameters: {'activation': 'relu', 'solver': 'adam', 'lr': 3.255135047553023e-05, 'layer1': 499, 'layer2': 118, 'layer3': 11}. Best is trial 14 with value: 0.8971256036318559.

Escherichia_Coli | Ceftriaxone | Optuna:   8%|▊         | 15/200 [40:45<9:02:41, 176.01s/it, best=0.894][A
Escherichia_Coli | Ceftriaxone | Optuna:   8%|▊         | 15/200 [40:45<9:02:41, 176.01s/it, best=0.897][A[I 2026-02-27 23:51:04,301] Trial 102 finished with value: 0.9090522215791805 and parameters: {'activation': 'tanh', 'solver': 'adam', 'lr': 2.6809180214515698e-05, 'layer1': 330, 'layer2': 482, 'layer3': 417}. Best is trial 102 with value: 0.9090522215791805.

Klebsiella_Pneumoniae | Ceftriaxone | Optuna:  52%|█████▏    | 103/200 [3:00:25<3:21:35, 124.69s/it, best=0.908][A
Klebsiella_Pneumoniae | Ceftriaxone | Optuna:  52%|█████▏    | 103/200 [3:00:25<3:21:35, 124.69s/it, best=0.909][A[I 2026-02-27 23:51:40,437] Trial 92 finished with value: 0.8828698913578709 and parameters: {'activation': 'identity', 'solver': 'adam', 'lr': 0.00032213274043667425, 'layer1': 353, 'layer2': 298, 'layer3': 430}. Best is trial 73 with value: 0.8861579932511299.

Pseudomonas_Aeruginosa | Meropenem | Optuna:  46%|████▋     | 93/200 [1:47:15<2:11:38, 73.82s/it, best=0.886][A
Pseudomonas_Aeruginosa | Meropenem | Optuna:  46%|████▋     | 93/200 [1:47:15<2:11:38, 73.82s/it, best=0.886][A[I 2026-02-27 23:52:03,735] Trial 84 finished with value: 0.8523361791569831 and parameters: {'activation': 'tanh', 'solver': 'adam', 'lr': 8.631251804570023e-05, 'layer1': 67, 'layer2': 147, 'layer3': 407}. Best is trial 71 with value: 0.8566270523015425.

Staphylococcus_Aureus | Clindamycin | Optuna:  42%|████▎     | 85/200 [1:54:05<2:41:38, 84.34s/it, best=0.857][A
Staphylococcus_Aureus | Clindamycin | Optuna:  42%|████▎     | 85/200 [1:54:05<2:41:38, 84.34s/it, best=0.857][A[I 2026-02-27 23:52:30,246] Trial 93 finished with value: 0.8496663753633568 and parameters: {'activation': 'identity', 'solver': 'adam', 'lr': 3.013779041432989e-06, 'layer1': 417, 'layer2': 354, 'layer3': 464}. Best is trial 73 with value: 0.8861579932511299.

Pseudomonas_Aeruginosa | Meropenem | Optuna:  47%|████▋     | 94/200 [1:48:05<1:57:41, 66.62s/it, best=0.886][A
Pseudomonas_Aeruginosa | Meropenem | Optuna:  47%|████▋     | 94/200 [1:48:05<1:57:41, 66.62s/it, best=0.886][A[I 2026-02-27 23:53:42,661] Trial 94 finished with value: 0.8833272559031041 and parameters: {'activation': 'identity', 'solver': 'adam', 'lr': 0.00043479565826002784, 'layer1': 334, 'layer2': 384, 'layer3': 224}. Best is trial 73 with value: 0.8861579932511299.

Pseudomonas_Aeruginosa | Meropenem | Optuna:  48%|████▊     | 95/200 [1:49:17<1:59:37, 68.36s/it, best=0.886][A
Pseudomonas_Aeruginosa | Meropenem | Optuna:  48%|████▊     | 95/200 [1:49:17<1:59:37, 68.36s/it, best=0.886][A[I 2026-02-27 23:53:49,307] Trial 85 finished with value: 0.8507725439005318 and parameters: {'activation': 'logistic', 'solver': 'adam', 'lr': 0.00022006948517960253, 'layer1': 119, 'layer2': 60, 'layer3': 478}. Best is trial 71 with value: 0.8566270523015425.

Staphylococcus_Aureus | Clindamycin | Optuna:  43%|████▎     | 86/200 [1:55:50<2:52:20, 90.71s/it, best=0.857][A
Staphylococcus_Aureus | Clindamycin | Optuna:  43%|████▎     | 86/200 [1:55:50<2:52:20, 90.71s/it, best=0.857][A[I 2026-02-27 23:53:59,799] Trial 15 finished with value: 0.8969471613368029 and parameters: {'activation': 'relu', 'solver': 'adam', 'lr': 5.863893644378838e-05, 'layer1': 499, 'layer2': 104, 'layer3': 19}. Best is trial 14 with value: 0.8971256036318559.

Escherichia_Coli | Ceftriaxone | Optuna:   8%|▊         | 16/200 [44:01<9:17:46, 181.89s/it, best=0.897][A
Escherichia_Coli | Ceftriaxone | Optuna:   8%|▊         | 16/200 [44:01<9:17:46, 181.89s/it, best=0.897][A[I 2026-02-27 23:54:24,668] Trial 103 finished with value: 0.9079827611588277 and parameters: {'activation': 'tanh', 'solver': 'adam', 'lr': 1.0072410514916903e-05, 'layer1': 311, 'layer2': 482, 'layer3': 373}. Best is trial 102 with value: 0.9090522215791805.

Klebsiella_Pneumoniae | Ceftriaxone | Optuna:  52%|█████▏    | 104/200 [3:03:46<3:55:49, 147.40s/it, best=0.909][A
Klebsiella_Pneumoniae | Ceftriaxone | Optuna:  52%|█████▏    | 104/200 [3:03:46<3:55:49, 147.40s/it, best=0.909][A[I 2026-02-27 23:55:08,270] Trial 95 finished with value: 0.8835360411741606 and parameters: {'activation': 'identity', 'solver': 'adam', 'lr': 7.774016765437209e-05, 'layer1': 299, 'layer2': 420, 'layer3': 296}. Best is trial 73 with value: 0.8861579932511299.

Pseudomonas_Aeruginosa | Meropenem | Optuna:  48%|████▊     | 96/200 [1:50:43<2:07:27, 73.53s/it, best=0.886][A
Pseudomonas_Aeruginosa | Meropenem | Optuna:  48%|████▊     | 96/200 [1:50:43<2:07:27, 73.53s/it, best=0.886][A[I 2026-02-27 23:55:21,337] Trial 86 finished with value: 0.8522232420467402 and parameters: {'activation': 'tanh', 'solver': 'adam', 'lr': 0.0001337631944209512, 'layer1': 101, 'layer2': 242, 'layer3': 379}. Best is trial 71 with value: 0.8566270523015425.

Staphylococcus_Aureus | Clindamycin | Optuna:  44%|████▎     | 87/200 [1:57:22<2:51:34, 91.10s/it, best=0.857][A
Staphylococcus_Aureus | Clindamycin | Optuna:  44%|████▎     | 87/200 [1:57:22<2:51:34, 91.10s/it, best=0.857][A[I 2026-02-27 23:55:26,507] Trial 96 finished with value: 0.8433928464223884 and parameters: {'activation': 'identity', 'solver': 'sgd', 'lr': 0.0009463520067261713, 'layer1': 64, 'layer2': 339, 'layer3': 413}. Best is trial 73 with value: 0.8861579932511299.

Pseudomonas_Aeruginosa | Meropenem | Optuna:  48%|████▊     | 97/200 [1:51:01<1:37:45, 56.94s/it, best=0.886][A
Pseudomonas_Aeruginosa | Meropenem | Optuna:  48%|████▊     | 97/200 [1:51:01<1:37:45, 56.94s/it, best=0.886][A[I 2026-02-27 23:55:42,375] Trial 16 finished with value: 0.8905259743103473 and parameters: {'activation': 'relu', 'solver': 'adam', 'lr': 0.0003577856947115646, 'layer1': 499, 'layer2': 104, 'layer3': 18}. Best is trial 14 with value: 0.8971256036318559.

Escherichia_Coli | Ceftriaxone | Optuna:   8%|▊         | 17/200 [45:43<8:02:00, 158.04s/it, best=0.897][A
Escherichia_Coli | Ceftriaxone | Optuna:   8%|▊         | 17/200 [45:43<8:02:00, 158.04s/it, best=0.897][A[I 2026-02-27 23:56:15,182] Trial 104 finished with value: 0.9055274328234791 and parameters: {'activation': 'tanh', 'solver': 'adam', 'lr': 2.752705559479424e-05, 'layer1': 294, 'layer2': 483, 'layer3': 394}. Best is trial 102 with value: 0.9090522215791805.

Klebsiella_Pneumoniae | Ceftriaxone | Optuna:  52%|█████▎    | 105/200 [3:05:36<3:35:51, 136.33s/it, best=0.909][A
Klebsiella_Pneumoniae | Ceftriaxone | Optuna:  52%|█████▎    | 105/200 [3:05:36<3:35:51, 136.33s/it, best=0.909][A[I 2026-02-27 23:56:46,074] Trial 97 finished with value: 0.8811647529748488 and parameters: {'activation': 'identity', 'solver': 'adam', 'lr': 0.0012837002885748463, 'layer1': 368, 'layer2': 272, 'layer3': 459}. Best is trial 73 with value: 0.8861579932511299.

Pseudomonas_Aeruginosa | Meropenem | Optuna:  49%|████▉     | 98/200 [1:52:21<1:48:20, 63.73s/it, best=0.886][A
Pseudomonas_Aeruginosa | Meropenem | Optuna:  49%|████▉     | 98/200 [1:52:21<1:48:20, 63.73s/it, best=0.886][A[I 2026-02-27 23:57:01,373] Trial 87 finished with value: 0.8552413653110692 and parameters: {'activation': 'logistic', 'solver': 'adam', 'lr': 0.0004604847031587796, 'layer1': 170, 'layer2': 24, 'layer3': 129}. Best is trial 71 with value: 0.8566270523015425.

Staphylococcus_Aureus | Clindamycin | Optuna:  44%|████▍     | 88/200 [1:59:03<2:55:03, 93.78s/it, best=0.857][A
Staphylococcus_Aureus | Clindamycin | Optuna:  44%|████▍     | 88/200 [1:59:03<2:55:03, 93.78s/it, best=0.857][A[I 2026-02-27 23:57:32,495] Trial 17 finished with value: 0.8876970241306934 and parameters: {'activation': 'tanh', 'solver': 'adam', 'lr': 6.446221903608035e-05, 'layer1': 430, 'layer2': 104, 'layer3': 10}. Best is trial 14 with value: 0.8971256036318559.

Escherichia_Coli | Ceftriaxone | Optuna:   9%|▉         | 18/200 [47:33<7:15:42, 143.64s/it, best=0.897][A
Escherichia_Coli | Ceftriaxone | Optuna:   9%|▉         | 18/200 [47:33<7:15:42, 143.64s/it, best=0.897][A[I 2026-02-27 23:57:41,661] Trial 98 finished with value: 0.8740167642862856 and parameters: {'activation': 'tanh', 'solver': 'adam', 'lr': 0.0002137538660397513, 'layer1': 379, 'layer2': 255, 'layer3': 159}. Best is trial 73 with value: 0.8861579932511299.

Pseudomonas_Aeruginosa | Meropenem | Optuna:  50%|████▉     | 99/200 [1:53:16<1:43:10, 61.29s/it, best=0.886][A
Pseudomonas_Aeruginosa | Meropenem | Optuna:  50%|████▉     | 99/200 [1:53:16<1:43:10, 61.29s/it, best=0.886][A[I 2026-02-27 23:58:18,271] Trial 18 finished with value: 0.7061551739098364 and parameters: {'activation': 'logistic', 'solver': 'sgd', 'lr': 3.3558011802749804e-05, 'layer1': 369, 'layer2': 150, 'layer3': 314}. Best is trial 14 with value: 0.8971256036318559.

Escherichia_Coli | Ceftriaxone | Optuna:  10%|▉         | 19/200 [48:19<5:44:38, 114.25s/it, best=0.897][A
Escherichia_Coli | Ceftriaxone | Optuna:  10%|▉         | 19/200 [48:19<5:44:38, 114.25s/it, best=0.897][A[I 2026-02-27 23:58:32,734] Trial 105 finished with value: 0.906544078928109 and parameters: {'activation': 'tanh', 'solver': 'adam', 'lr': 1.5634255695909416e-05, 'layer1': 333, 'layer2': 499, 'layer3': 367}. Best is trial 102 with value: 0.9090522215791805.

Klebsiella_Pneumoniae | Ceftriaxone | Optuna:  53%|█████▎    | 106/200 [3:07:54<3:34:09, 136.70s/it, best=0.909][A
Klebsiella_Pneumoniae | Ceftriaxone | Optuna:  53%|█████▎    | 106/200 [3:07:54<3:34:09, 136.70s/it, best=0.909][A[I 2026-02-27 23:58:33,688] Trial 88 finished with value: 0.8535889722476353 and parameters: {'activation': 'logistic', 'solver': 'adam', 'lr': 0.0007778021737429859, 'layer1': 225, 'layer2': 21, 'layer3': 64}. Best is trial 71 with value: 0.8566270523015425.

Staphylococcus_Aureus | Clindamycin | Optuna:  44%|████▍     | 89/200 [2:00:35<2:52:41, 93.34s/it, best=0.857][A
Staphylococcus_Aureus | Clindamycin | Optuna:  44%|████▍     | 89/200 [2:00:35<2:52:41, 93.34s/it, best=0.857][A[I 2026-02-27 23:59:04,764] Trial 99 finished with value: 0.877517461958994 and parameters: {'activation': 'relu', 'solver': 'adam', 'lr': 0.001820273947889791, 'layer1': 391, 'layer2': 288, 'layer3': 442}. Best is trial 73 with value: 0.8861579932511299.

Pseudomonas_Aeruginosa | Meropenem | Optuna:  50%|█████     | 100/200 [1:54:39<1:53:03, 67.83s/it, best=0.886][A
Pseudomonas_Aeruginosa | Meropenem | Optuna:  50%|█████     | 100/200 [1:54:39<1:53:03, 67.83s/it, best=0.886][A[I 2026-02-27 23:59:46,099] Trial 89 finished with value: 0.8355665525938628 and parameters: {'activation': 'logistic', 'solver': 'adam', 'lr': 0.0008679395280034001, 'layer1': 225, 'layer2': 18, 'layer3': 12}. Best is trial 71 with value: 0.8566270523015425.

Staphylococcus_Aureus | Clindamycin | Optuna:  45%|████▌     | 90/200 [2:01:47<2:39:36, 87.06s/it, best=0.857][A
