Staphylococcus_Aureus | Fusidic acid | Optuna:  62%|██████▎   | 125/200 [3:24:10<2:10:10, 104.14s/it, best=0.928][A[I 2026-02-28 06:05:28,063] Trial 164 finished with value: 0.8638301805765349 and parameters: {'activation': 'identity', 'solver': 'adam', 'lr': 0.0010302771524199237, 'layer1': 298, 'layer2': 313, 'layer3': 381}. Best is trial 140 with value: 0.8705750568176336.
Pseudomonas_Aeruginosa | LPS | Optuna:  82%|████████▎ | 165/200 [4:00:30<45:29, 78.00s/it, best=0.871]Pseudomonas_Aeruginosa | LPS | Optuna:  82%|████████▎ | 165/200 [4:00:30<45:29, 78.00s/it, best=0.871]/export/usuarios01/egarroyo/MALDI_for_AMR_prediction/venv/lib/python3.13/site-packages/sklearn/model_selection/_split.py:813: UserWarning: The least populated class in y has only 4 members, which is less than n_splits=5.
  warnings.warn(
[I 2026-02-28 06:06:16,302] Trial 162 finished with value: 0.8945918728664983 and parameters: {'activation': 'relu', 'solver': 'adam', 'lr': 5.1048624783360197e-05, 'layer1': 493, 'layer2': 142, 'layer3': 53}. Best is trial 137 with value: 0.8979080367540411.

Escherichia_Coli | Ceftriaxone | Optuna:  82%|████████▏ | 163/200 [6:56:17<1:36:10, 155.97s/it, best=0.898][A
Escherichia_Coli | Ceftriaxone | Optuna:  82%|████████▏ | 163/200 [6:56:17<1:36:10, 155.97s/it, best=0.898][A[I 2026-02-28 06:06:41,464] Trial 125 finished with value: 0.9271611235469932 and parameters: {'activation': 'identity', 'solver': 'adam', 'lr': 0.0002880374411648466, 'layer1': 361, 'layer2': 64, 'layer3': 109}. Best is trial 77 with value: 0.9283869597728589.

Staphylococcus_Aureus | Fusidic acid | Optuna:  63%|██████▎   | 126/200 [3:25:50<2:07:02, 103.00s/it, best=0.928][A
Staphylococcus_Aureus | Fusidic acid | Optuna:  63%|██████▎   | 126/200 [3:25:50<2:07:02, 103.00s/it, best=0.928][A[I 2026-02-28 06:07:05,903] Trial 6 finished with value: 0.971161025132596 and parameters: {'activation': 'tanh', 'solver': 'adam', 'lr': 3.6618192203924288e-06, 'layer1': 403, 'layer2': 46, 'layer3': 494}. Best is trial 1 with value: 0.9767069569332589.

Klebsiella_Pneumoniae | Meropenem | Optuna:   4%|▎         | 7/200 [07:46<5:00:37, 93.46s/it, best=0.977][A
Klebsiella_Pneumoniae | Meropenem | Optuna:   4%|▎         | 7/200 [07:46<5:00:37, 93.46s/it, best=0.977][A[I 2026-02-28 06:07:08,073] Trial 165 finished with value: 0.8627480419749955 and parameters: {'activation': 'identity', 'solver': 'adam', 'lr': 0.0028326052777940675, 'layer1': 425, 'layer2': 348, 'layer3': 493}. Best is trial 140 with value: 0.8705750568176336.
Pseudomonas_Aeruginosa | LPS | Optuna:  83%|████████▎ | 166/200 [4:02:10<47:56, 84.60s/it, best=0.871]Pseudomonas_Aeruginosa | LPS | Optuna:  83%|████████▎ | 166/200 [4:02:10<47:56, 84.60s/it, best=0.871]/export/usuarios01/egarroyo/MALDI_for_AMR_prediction/venv/lib/python3.13/site-packages/sklearn/model_selection/_split.py:813: UserWarning: The least populated class in y has only 4 members, which is less than n_splits=5.
  warnings.warn(
[I 2026-02-28 06:07:44,875] Trial 7 finished with value: 0.9806246630814478 and parameters: {'activation': 'relu', 'solver': 'adam', 'lr': 0.0012164139351417069, 'layer1': 46, 'layer2': 186, 'layer3': 66}. Best is trial 7 with value: 0.9806246630814478.

Klebsiella_Pneumoniae | Meropenem | Optuna:   4%|▍         | 8/200 [08:25<4:03:33, 76.11s/it, best=0.977][A
Klebsiella_Pneumoniae | Meropenem | Optuna:   4%|▍         | 8/200 [08:25<4:03:33, 76.11s/it, best=0.981][A[I 2026-02-28 06:08:09,323] Trial 126 finished with value: 0.9257217760135692 and parameters: {'activation': 'identity', 'solver': 'adam', 'lr': 0.00016879957706954205, 'layer1': 382, 'layer2': 11, 'layer3': 50}. Best is trial 77 with value: 0.9283869597728589.

Staphylococcus_Aureus | Fusidic acid | Optuna:  64%|██████▎   | 127/200 [3:27:18<1:59:47, 98.46s/it, best=0.928] [A
Staphylococcus_Aureus | Fusidic acid | Optuna:  64%|██████▎   | 127/200 [3:27:18<1:59:47, 98.46s/it, best=0.928][A[I 2026-02-28 06:08:27,330] Trial 8 finished with value: 0.9787027197002102 and parameters: {'activation': 'identity', 'solver': 'adam', 'lr': 0.000828752236376816, 'layer1': 323, 'layer2': 445, 'layer3': 241}. Best is trial 7 with value: 0.9806246630814478.

Klebsiella_Pneumoniae | Meropenem | Optuna:   4%|▍         | 9/200 [09:07<3:28:47, 65.59s/it, best=0.981][A
Klebsiella_Pneumoniae | Meropenem | Optuna:   4%|▍         | 9/200 [09:07<3:28:47, 65.59s/it, best=0.981][A[I 2026-02-28 06:08:45,681] Trial 166 finished with value: 0.8658475208896753 and parameters: {'activation': 'identity', 'solver': 'adam', 'lr': 0.0013465272219859716, 'layer1': 243, 'layer2': 331, 'layer3': 481}. Best is trial 140 with value: 0.8705750568176336.
Pseudomonas_Aeruginosa | LPS | Optuna:  84%|████████▎ | 167/200 [4:03:47<48:40, 88.50s/it, best=0.871]Pseudomonas_Aeruginosa | LPS | Optuna:  84%|████████▎ | 167/200 [4:03:47<48:40, 88.50s/it, best=0.871]/export/usuarios01/egarroyo/MALDI_for_AMR_prediction/venv/lib/python3.13/site-packages/sklearn/model_selection/_split.py:813: UserWarning: The least populated class in y has only 4 members, which is less than n_splits=5.
  warnings.warn(
[I 2026-02-28 06:09:07,987] Trial 167 finished with value: 0.8255018342260501 and parameters: {'activation': 'logistic', 'solver': 'adam', 'lr': 8.309026582510984e-05, 'layer1': 22, 'layer2': 489, 'layer3': 398}. Best is trial 140 with value: 0.8705750568176336.
Pseudomonas_Aeruginosa | LPS | Optuna:  84%|████████▍ | 168/200 [4:04:10<36:36, 68.64s/it, best=0.871]Pseudomonas_Aeruginosa | LPS | Optuna:  84%|████████▍ | 168/200 [4:04:10<36:36, 68.64s/it, best=0.871]/export/usuarios01/egarroyo/MALDI_for_AMR_prediction/venv/lib/python3.13/site-packages/sklearn/model_selection/_split.py:813: UserWarning: The least populated class in y has only 4 members, which is less than n_splits=5.
  warnings.warn(
[I 2026-02-28 06:09:16,370] Trial 9 finished with value: 0.9711709215116631 and parameters: {'activation': 'tanh', 'solver': 'sgd', 'lr': 0.00012329098365270507, 'layer1': 219, 'layer2': 22, 'layer3': 62}. Best is trial 7 with value: 0.9806246630814478.

Klebsiella_Pneumoniae | Meropenem | Optuna:   5%|▌         | 10/200 [09:56<3:11:31, 60.48s/it, best=0.981][A
Klebsiella_Pneumoniae | Meropenem | Optuna:   5%|▌         | 10/200 [09:56<3:11:31, 60.48s/it, best=0.981][A[I 2026-02-28 06:09:32,541] Trial 10 finished with value: 0.9767069569332589 and parameters: {'activation': 'relu', 'solver': 'sgd', 'lr': 0.007553503645583194, 'layer1': 18, 'layer2': 151, 'layer3': 348}. Best is trial 7 with value: 0.9806246630814478.

Klebsiella_Pneumoniae | Meropenem | Optuna:   6%|▌         | 11/200 [10:13<2:27:47, 46.92s/it, best=0.981][A
Klebsiella_Pneumoniae | Meropenem | Optuna:   6%|▌         | 11/200 [10:13<2:27:47, 46.92s/it, best=0.981][A[I 2026-02-28 06:10:10,092] Trial 163 finished with value: 0.8934688750871069 and parameters: {'activation': 'relu', 'solver': 'adam', 'lr': 3.1560052810180656e-05, 'layer1': 467, 'layer2': 145, 'layer3': 15}. Best is trial 137 with value: 0.8979080367540411.

Escherichia_Coli | Ceftriaxone | Optuna:  82%|████████▏ | 164/200 [7:00:11<1:47:35, 179.31s/it, best=0.898][A
Escherichia_Coli | Ceftriaxone | Optuna:  82%|████████▏ | 164/200 [7:00:11<1:47:35, 179.31s/it, best=0.898][A[I 2026-02-28 06:10:18,096] Trial 127 finished with value: 0.9271256265585484 and parameters: {'activation': 'identity', 'solver': 'adam', 'lr': 5.025099028331971e-05, 'layer1': 469, 'layer2': 111, 'layer3': 161}. Best is trial 77 with value: 0.9283869597728589.

Staphylococcus_Aureus | Fusidic acid | Optuna:  64%|██████▍   | 128/200 [3:29:27<2:09:03, 107.55s/it, best=0.928][A
Staphylococcus_Aureus | Fusidic acid | Optuna:  64%|██████▍   | 128/200 [3:29:27<2:09:03, 107.55s/it, best=0.928][A[I 2026-02-28 06:10:22,535] Trial 11 finished with value: 0.9798273644076663 and parameters: {'activation': 'identity', 'solver': 'adam', 'lr': 0.0013124793805688133, 'layer1': 347, 'layer2': 497, 'layer3': 312}. Best is trial 7 with value: 0.9806246630814478.

Klebsiella_Pneumoniae | Meropenem | Optuna:   6%|▌         | 12/200 [11:03<2:29:56, 47.85s/it, best=0.981][A
Klebsiella_Pneumoniae | Meropenem | Optuna:   6%|▌         | 12/200 [11:03<2:29:56, 47.85s/it, best=0.981][A[I 2026-02-28 06:10:23,322] Trial 168 finished with value: 0.8639612741621645 and parameters: {'activation': 'identity', 'solver': 'adam', 'lr': 0.0007806406414493271, 'layer1': 274, 'layer2': 24, 'layer3': 420}. Best is trial 140 with value: 0.8705750568176336.
Pseudomonas_Aeruginosa | LPS | Optuna:  84%|████████▍ | 169/200 [4:05:25<36:30, 70.65s/it, best=0.871]Pseudomonas_Aeruginosa | LPS | Optuna:  84%|████████▍ | 169/200 [4:05:25<36:30, 70.65s/it, best=0.871]/export/usuarios01/egarroyo/MALDI_for_AMR_prediction/venv/lib/python3.13/site-packages/sklearn/model_selection/_split.py:813: UserWarning: The least populated class in y has only 4 members, which is less than n_splits=5.
  warnings.warn(
[I 2026-02-28 06:10:59,077] Trial 12 finished with value: 0.9790810436225316 and parameters: {'activation': 'identity', 'solver': 'adam', 'lr': 0.0016137610321187168, 'layer1': 166, 'layer2': 496, 'layer3': 351}. Best is trial 7 with value: 0.9806246630814478.

Klebsiella_Pneumoniae | Meropenem | Optuna:   6%|▋         | 13/200 [11:39<2:18:27, 44.43s/it, best=0.981][A
Klebsiella_Pneumoniae | Meropenem | Optuna:   6%|▋         | 13/200 [11:39<2:18:27, 44.43s/it, best=0.981][A[I 2026-02-28 06:11:29,023] Trial 128 finished with value: 0.9220516074395281 and parameters: {'activation': 'identity', 'solver': 'adam', 'lr': 0.0004594419488508322, 'layer1': 431, 'layer2': 33, 'layer3': 96}. Best is trial 77 with value: 0.9283869597728589.

Staphylococcus_Aureus | Fusidic acid | Optuna:  64%|██████▍   | 129/200 [3:30:38<1:54:16, 96.56s/it, best=0.928] [A
Staphylococcus_Aureus | Fusidic acid | Optuna:  64%|██████▍   | 129/200 [3:30:38<1:54:16, 96.56s/it, best=0.928][A[I 2026-02-28 06:11:58,045] Trial 169 finished with value: 0.8673350973799314 and parameters: {'activation': 'identity', 'solver': 'adam', 'lr': 0.0022423874006421993, 'layer1': 327, 'layer2': 296, 'layer3': 458}. Best is trial 140 with value: 0.8705750568176336.
Pseudomonas_Aeruginosa | LPS | Optuna:  85%|████████▌ | 170/200 [4:07:00<38:56, 77.87s/it, best=0.871]Pseudomonas_Aeruginosa | LPS | Optuna:  85%|████████▌ | 170/200 [4:07:00<38:56, 77.87s/it, best=0.871]/export/usuarios01/egarroyo/MALDI_for_AMR_prediction/venv/lib/python3.13/site-packages/sklearn/model_selection/_split.py:813: UserWarning: The least populated class in y has only 4 members, which is less than n_splits=5.
  warnings.warn(
[I 2026-02-28 06:12:09,682] Trial 13 finished with value: 0.981048798013917 and parameters: {'activation': 'relu', 'solver': 'adam', 'lr': 0.00037540926788082424, 'layer1': 494, 'layer2': 131, 'layer3': 438}. Best is trial 13 with value: 0.981048798013917.

Klebsiella_Pneumoniae | Meropenem | Optuna:   7%|▋         | 14/200 [12:50<2:42:14, 52.33s/it, best=0.981][A
Klebsiella_Pneumoniae | Meropenem | Optuna:   7%|▋         | 14/200 [12:50<2:42:14, 52.33s/it, best=0.981][A[I 2026-02-28 06:13:06,295] Trial 129 finished with value: 0.9258979019909489 and parameters: {'activation': 'tanh', 'solver': 'adam', 'lr': 6.38619678767888e-05, 'layer1': 448, 'layer2': 245, 'layer3': 138}. Best is trial 77 with value: 0.9283869597728589.

Staphylococcus_Aureus | Fusidic acid | Optuna:  65%|██████▌   | 130/200 [3:32:15<1:52:54, 96.78s/it, best=0.928][A
Staphylococcus_Aureus | Fusidic acid | Optuna:  65%|██████▌   | 130/200 [3:32:15<1:52:54, 96.78s/it, best=0.928][A[I 2026-02-28 06:13:19,077] Trial 14 finished with value: 0.9806430345678002 and parameters: {'activation': 'relu', 'solver': 'adam', 'lr': 0.00017418893870326793, 'layer1': 499, 'layer2': 142, 'layer3': 475}. Best is trial 13 with value: 0.981048798013917.

Klebsiella_Pneumoniae | Meropenem | Optuna:   8%|▊         | 15/200 [13:59<2:57:13, 57.48s/it, best=0.981][A
Klebsiella_Pneumoniae | Meropenem | Optuna:   8%|▊         | 15/200 [13:59<2:57:13, 57.48s/it, best=0.981][A[I 2026-02-28 06:13:23,009] Trial 164 finished with value: 0.8939013528794355 and parameters: {'activation': 'relu', 'solver': 'adam', 'lr': 4.016922359704472e-05, 'layer1': 477, 'layer2': 114, 'layer3': 34}. Best is trial 137 with value: 0.8979080367540411.

Escherichia_Coli | Ceftriaxone | Optuna:  82%|████████▎ | 165/200 [7:03:24<1:46:58, 183.40s/it, best=0.898][A
Escherichia_Coli | Ceftriaxone | Optuna:  82%|████████▎ | 165/200 [7:03:24<1:46:58, 183.40s/it, best=0.898][A[I 2026-02-28 06:13:38,947] Trial 170 finished with value: 0.8653553671148873 and parameters: {'activation': 'identity', 'solver': 'adam', 'lr': 0.00040431023271446403, 'layer1': 327, 'layer2': 292, 'layer3': 441}. Best is trial 140 with value: 0.8705750568176336.
Pseudomonas_Aeruginosa | LPS | Optuna:  86%|████████▌ | 171/200 [4:08:40<40:58, 84.78s/it, best=0.871]Pseudomonas_Aeruginosa | LPS | Optuna:  86%|████████▌ | 171/200 [4:08:41<40:58, 84.78s/it, best=0.871]/export/usuarios01/egarroyo/MALDI_for_AMR_prediction/venv/lib/python3.13/site-packages/sklearn/model_selection/_split.py:813: UserWarning: The least populated class in y has only 4 members, which is less than n_splits=5.
  warnings.warn(
[I 2026-02-28 06:14:26,827] Trial 15 finished with value: 0.9817428046183034 and parameters: {'activation': 'relu', 'solver': 'adam', 'lr': 0.00013585468194914787, 'layer1': 499, 'layer2': 125, 'layer3': 500}. Best is trial 15 with value: 0.9817428046183034.

Klebsiella_Pneumoniae | Meropenem | Optuna:   8%|▊         | 16/200 [15:07<3:05:44, 60.57s/it, best=0.981][A
Klebsiella_Pneumoniae | Meropenem | Optuna:   8%|▊         | 16/200 [15:07<3:05:44, 60.57s/it, best=0.982][A[I 2026-02-28 06:14:42,404] Trial 130 finished with value: 0.9264819601286988 and parameters: {'activation': 'identity', 'solver': 'adam', 'lr': 0.00022959991677989918, 'layer1': 405, 'layer2': 89, 'layer3': 172}. Best is trial 77 with value: 0.9283869597728589.

Staphylococcus_Aureus | Fusidic acid | Optuna:  66%|██████▌   | 131/200 [3:33:51<1:51:03, 96.58s/it, best=0.928][A
Staphylococcus_Aureus | Fusidic acid | Optuna:  66%|██████▌   | 131/200 [3:33:51<1:51:03, 96.58s/it, best=0.928][A[I 2026-02-28 06:15:15,671] Trial 171 finished with value: 0.8668219234762468 and parameters: {'activation': 'identity', 'solver': 'adam', 'lr': 0.0024502930611716056, 'layer1': 289, 'layer2': 314, 'layer3': 461}. Best is trial 140 with value: 0.8705750568176336.
Pseudomonas_Aeruginosa | LPS | Optuna:  86%|████████▌ | 172/200 [4:10:17<41:14, 88.36s/it, best=0.871]Pseudomonas_Aeruginosa | LPS | Optuna:  86%|████████▌ | 172/200 [4:10:17<41:14, 88.36s/it, best=0.871]/export/usuarios01/egarroyo/MALDI_for_AMR_prediction/venv/lib/python3.13/site-packages/sklearn/model_selection/_split.py:813: UserWarning: The least populated class in y has only 4 members, which is less than n_splits=5.
  warnings.warn(
[I 2026-02-28 06:15:28,176] Trial 16 finished with value: 0.9809183775429213 and parameters: {'activation': 'relu', 'solver': 'adam', 'lr': 0.00031301841818138647, 'layer1': 499, 'layer2': 104, 'layer3': 428}. Best is trial 15 with value: 0.9817428046183034.

Klebsiella_Pneumoniae | Meropenem | Optuna:   8%|▊         | 17/200 [16:08<3:05:27, 60.80s/it, best=0.982][A
Klebsiella_Pneumoniae | Meropenem | Optuna:   8%|▊         | 17/200 [16:08<3:05:27, 60.80s/it, best=0.982][A[I 2026-02-28 06:16:00,575] Trial 17 finished with value: 0.9767069569332589 and parameters: {'activation': 'relu', 'solver': 'adam', 'lr': 5.117388913967917e-05, 'layer1': 430, 'layer2': 88, 'layer3': 421}. Best is trial 15 with value: 0.9817428046183034.

Klebsiella_Pneumoniae | Meropenem | Optuna:   9%|▉         | 18/200 [16:41<2:38:32, 52.27s/it, best=0.982][A
Klebsiella_Pneumoniae | Meropenem | Optuna:   9%|▉         | 18/200 [16:41<2:38:32, 52.27s/it, best=0.982][A[I 2026-02-28 06:16:15,962] Trial 165 finished with value: 0.8961319406845124 and parameters: {'activation': 'relu', 'solver': 'adam', 'lr': 6.262940930351503e-05, 'layer1': 486, 'layer2': 33, 'layer3': 58}. Best is trial 137 with value: 0.8979080367540411.

Escherichia_Coli | Ceftriaxone | Optuna:  83%|████████▎ | 166/200 [7:06:17<1:42:08, 180.26s/it, best=0.898][A
Escherichia_Coli | Ceftriaxone | Optuna:  83%|████████▎ | 166/200 [7:06:17<1:42:08, 180.26s/it, best=0.898][A[I 2026-02-28 06:16:16,087] Trial 131 finished with value: 0.9258849204629233 and parameters: {'activation': 'identity', 'solver': 'adam', 'lr': 0.00014254363833270277, 'layer1': 354, 'layer2': 45, 'layer3': 86}. Best is trial 77 with value: 0.9283869597728589.

Staphylococcus_Aureus | Fusidic acid | Optuna:  66%|██████▌   | 132/200 [3:35:25<1:48:28, 95.71s/it, best=0.928][A
Staphylococcus_Aureus | Fusidic acid | Optuna:  66%|██████▌   | 132/200 [3:35:25<1:48:28, 95.71s/it, best=0.928][A[I 2026-02-28 06:16:32,262] Trial 18 finished with value: 0.9767069569332589 and parameters: {'activation': 'relu', 'solver': 'sgd', 'lr': 0.0003804040507078787, 'layer1': 369, 'layer2': 222, 'layer3': 417}. Best is trial 15 with value: 0.9817428046183034.

Klebsiella_Pneumoniae | Meropenem | Optuna:  10%|▉         | 19/200 [17:12<2:19:01, 46.09s/it, best=0.982][A
Klebsiella_Pneumoniae | Meropenem | Optuna:  10%|▉         | 19/200 [17:12<2:19:01, 46.09s/it, best=0.982][A[I 2026-02-28 06:17:03,462] Trial 172 finished with value: 0.8661365051342947 and parameters: {'activation': 'identity', 'solver': 'adam', 'lr': 0.002172285939897212, 'layer1': 409, 'layer2': 315, 'layer3': 457}. Best is trial 140 with value: 0.8705750568176336.
Pseudomonas_Aeruginosa | LPS | Optuna:  86%|████████▋ | 173/200 [4:12:05<42:23, 94.19s/it, best=0.871]Pseudomonas_Aeruginosa | LPS | Optuna:  86%|████████▋ | 173/200 [4:12:05<42:23, 94.19s/it, best=0.871]/export/usuarios01/egarroyo/MALDI_for_AMR_prediction/venv/lib/python3.13/site-packages/sklearn/model_selection/_split.py:813: UserWarning: The least populated class in y has only 4 members, which is less than n_splits=5.
  warnings.warn(
[I 2026-02-28 06:17:35,211] Trial 19 finished with value: 0.9789623558342286 and parameters: {'activation': 'tanh', 'solver': 'adam', 'lr': 5.526927121631758e-05, 'layer1': 439, 'layer2': 93, 'layer3': 466}. Best is trial 15 with value: 0.9817428046183034.

Klebsiella_Pneumoniae | Meropenem | Optuna:  10%|█         | 20/200 [18:15<2:33:26, 51.15s/it, best=0.982][A
Klebsiella_Pneumoniae | Meropenem | Optuna:  10%|█         | 20/200 [18:15<2:33:26, 51.15s/it, best=0.982][A[I 2026-02-28 06:18:00,461] Trial 132 finished with value: 0.9265376915383939 and parameters: {'activation': 'identity', 'solver': 'adam', 'lr': 9.002552879339124e-05, 'layer1': 370, 'layer2': 57, 'layer3': 94}. Best is trial 77 with value: 0.9283869597728589.

Staphylococcus_Aureus | Fusidic acid | Optuna:  66%|██████▋   | 133/200 [3:37:09<1:49:46, 98.31s/it, best=0.928][A
Staphylococcus_Aureus | Fusidic acid | Optuna:  66%|██████▋   | 133/200 [3:37:09<1:49:46, 98.31s/it, best=0.928][A[I 2026-02-28 06:18:20,696] Trial 20 finished with value: 0.9767069569332589 and parameters: {'activation': 'logistic', 'solver': 'adam', 'lr': 0.003988956930078274, 'layer1': 486, 'layer2': 384, 'layer3': 301}. Best is trial 15 with value: 0.9817428046183034.

Klebsiella_Pneumoniae | Meropenem | Optuna:  10%|█         | 21/200 [19:01<2:27:31, 49.45s/it, best=0.982][A
Klebsiella_Pneumoniae | Meropenem | Optuna:  10%|█         | 21/200 [19:01<2:27:31, 49.45s/it, best=0.982][A[I 2026-02-28 06:18:39,907] Trial 173 finished with value: 0.8615539417732517 and parameters: {'activation': 'identity', 'solver': 'adam', 'lr': 0.0021922609499214047, 'layer1': 316, 'layer2': 279, 'layer3': 459}. Best is trial 140 with value: 0.8705750568176336.
Pseudomonas_Aeruginosa | LPS | Optuna:  87%|████████▋ | 174/200 [4:13:41<41:06, 94.87s/it, best=0.871]Pseudomonas_Aeruginosa | LPS | Optuna:  87%|████████▋ | 174/200 [4:13:41<41:06, 94.87s/it, best=0.871]/export/usuarios01/egarroyo/MALDI_for_AMR_prediction/venv/lib/python3.13/site-packages/sklearn/model_selection/_split.py:813: UserWarning: The least populated class in y has only 4 members, which is less than n_splits=5.
  warnings.warn(
[I 2026-02-28 06:19:19,029] Trial 21 finished with value: 0.9799216025376347 and parameters: {'activation': 'relu', 'solver': 'adam', 'lr': 0.0003528349023655492, 'layer1': 473, 'layer2': 101, 'layer3': 407}. Best is trial 15 with value: 0.9817428046183034.

Klebsiella_Pneumoniae | Meropenem | Optuna:  11%|█         | 22/200 [19:59<2:34:36, 52.12s/it, best=0.982][A
Klebsiella_Pneumoniae | Meropenem | Optuna:  11%|█         | 22/200 [19:59<2:34:36, 52.12s/it, best=0.982][A[I 2026-02-28 06:19:31,241] Trial 133 finished with value: 0.9263829016094938 and parameters: {'activation': 'identity', 'solver': 'adam', 'lr': 0.00012299664952460234, 'layer1': 416, 'layer2': 71, 'layer3': 106}. Best is trial 77 with value: 0.9283869597728589.

Staphylococcus_Aureus | Fusidic acid | Optuna:  67%|██████▋   | 134/200 [3:38:40<1:45:39, 96.05s/it, best=0.928][A
Staphylococcus_Aureus | Fusidic acid | Optuna:  67%|██████▋   | 134/200 [3:38:40<1:45:39, 96.05s/it, best=0.928][A[I 2026-02-28 06:20:06,635] Trial 166 finished with value: 0.8467634148556169 and parameters: {'activation': 'logistic', 'solver': 'adam', 'lr': 6.618219887235904e-05, 'layer1': 499, 'layer2': 353, 'layer3': 59}. Best is trial 137 with value: 0.8979080367540411.

Escherichia_Coli | Ceftriaxone | Optuna:  84%|████████▎ | 167/200 [7:10:08<1:47:27, 195.39s/it, best=0.898][A
