Escherichia_Coli | Piperacillin-Tazobactam | Optuna:  16%|█▌        | 31/200 [55:21<4:43:08, 100.52s/it, best=0.914][A[I 2026-02-28 08:59:30,096] Trial 6 finished with value: 0.8683344605088201 and parameters: {'activation': 'tanh', 'solver': 'adam', 'lr': 3.6618192203924288e-06, 'layer1': 403, 'layer2': 46, 'layer3': 494}. Best is trial 2 with value: 0.8971464417416122.
Klebsiella_Pneumoniae | LPS | Optuna:   4%|▎         | 7/200 [11:46<7:10:22, 133.79s/it, best=0.897]Klebsiella_Pneumoniae | LPS | Optuna:   4%|▎         | 7/200 [11:46<7:10:22, 133.79s/it, best=0.897][I 2026-02-28 08:59:51,743] Trial 73 finished with value: 0.8633680620537456 and parameters: {'activation': 'identity', 'solver': 'adam', 'lr': 0.0003758209508993775, 'layer1': 430, 'layer2': 433, 'layer3': 124}. Best is trial 65 with value: 0.8669592494429758.
Pseudomonas_Aeruginosa | DirectMulti | Optuna:  37%|███▋      | 74/200 [2:03:38<3:41:43, 105.58s/it, best=0.867]Pseudomonas_Aeruginosa | DirectMulti | Optuna:  37%|███▋      | 74/200 [2:03:38<3:41:43, 105.58s/it, best=0.867]/export/usuarios01/egarroyo/MALDI_for_AMR_prediction/venv/lib/python3.13/site-packages/sklearn/model_selection/_split.py:813: UserWarning: The least populated class in y has only 4 members, which is less than n_splits=5.
  warnings.warn(
[I 2026-02-28 09:00:19,149] Trial 7 finished with value: 0.918075044576103 and parameters: {'activation': 'relu', 'solver': 'adam', 'lr': 0.0012164139351417069, 'layer1': 46, 'layer2': 186, 'layer3': 66}. Best is trial 7 with value: 0.918075044576103.
Klebsiella_Pneumoniae | LPS | Optuna:   4%|▍         | 8/200 [12:35<5:41:48, 106.82s/it, best=0.897]Klebsiella_Pneumoniae | LPS | Optuna:   4%|▍         | 8/200 [12:35<5:41:48, 106.82s/it, best=0.918][I 2026-02-28 09:00:29,709] Trial 23 finished with value: 0.8849193421739494 and parameters: {'activation': 'identity', 'solver': 'adam', 'lr': 0.0001889167242538732, 'layer1': 372, 'layer2': 244, 'layer3': 303}. Best is trial 8 with value: 0.8879562150966016.
Staphylococcus_Aureus | LPS | Optuna:  12%|█▏        | 24/200 [54:16<6:39:59, 136.36s/it, best=0.888]Staphylococcus_Aureus | LPS | Optuna:  12%|█▏        | 24/200 [54:16<6:39:59, 136.36s/it, best=0.888][I 2026-02-28 09:01:33,015] Trial 31 finished with value: 0.9127007392657557 and parameters: {'activation': 'tanh', 'solver': 'adam', 'lr': 9.281276969731972e-05, 'layer1': 499, 'layer2': 112, 'layer3': 383}. Best is trial 16 with value: 0.9144489703452822.

Escherichia_Coli | Piperacillin-Tazobactam | Optuna:  16%|█▌        | 32/200 [57:25<5:01:16, 107.60s/it, best=0.914][A
Escherichia_Coli | Piperacillin-Tazobactam | Optuna:  16%|█▌        | 32/200 [57:25<5:01:16, 107.60s/it, best=0.914][A[I 2026-02-28 09:01:48,523] Trial 74 finished with value: 0.8618631857335253 and parameters: {'activation': 'identity', 'solver': 'adam', 'lr': 0.0025578453609382133, 'layer1': 472, 'layer2': 393, 'layer3': 106}. Best is trial 65 with value: 0.8669592494429758.
Pseudomonas_Aeruginosa | DirectMulti | Optuna:  38%|███▊      | 75/200 [2:05:34<3:46:57, 108.94s/it, best=0.867]Pseudomonas_Aeruginosa | DirectMulti | Optuna:  38%|███▊      | 75/200 [2:05:34<3:46:57, 108.94s/it, best=0.867]/export/usuarios01/egarroyo/MALDI_for_AMR_prediction/venv/lib/python3.13/site-packages/sklearn/model_selection/_split.py:813: UserWarning: The least populated class in y has only 4 members, which is less than n_splits=5.
  warnings.warn(
[I 2026-02-28 09:02:01,804] Trial 8 finished with value: 0.9228661952648753 and parameters: {'activation': 'identity', 'solver': 'adam', 'lr': 0.000828752236376816, 'layer1': 323, 'layer2': 445, 'layer3': 241}. Best is trial 8 with value: 0.9228661952648753.
Klebsiella_Pneumoniae | LPS | Optuna:   4%|▍         | 9/200 [14:17<5:35:53, 105.52s/it, best=0.918]Klebsiella_Pneumoniae | LPS | Optuna:   4%|▍         | 9/200 [14:17<5:35:53, 105.52s/it, best=0.923][I 2026-02-28 09:03:22,358] Trial 24 finished with value: 0.8861285388840064 and parameters: {'activation': 'identity', 'solver': 'adam', 'lr': 0.0019146513643794264, 'layer1': 295, 'layer2': 380, 'layer3': 382}. Best is trial 8 with value: 0.8879562150966016.
Staphylococcus_Aureus | LPS | Optuna:  12%|█▎        | 25/200 [57:08<7:09:28, 147.25s/it, best=0.888]Staphylococcus_Aureus | LPS | Optuna:  12%|█▎        | 25/200 [57:08<7:09:28, 147.25s/it, best=0.888][I 2026-02-28 09:03:54,540] Trial 9 finished with value: 0.8669964587274042 and parameters: {'activation': 'tanh', 'solver': 'sgd', 'lr': 0.00012329098365270507, 'layer1': 219, 'layer2': 22, 'layer3': 62}. Best is trial 8 with value: 0.9228661952648753.
Klebsiella_Pneumoniae | LPS | Optuna:   5%|▌         | 10/200 [16:10<5:41:11, 107.74s/it, best=0.923]Klebsiella_Pneumoniae | LPS | Optuna:   5%|▌         | 10/200 [16:10<5:41:11, 107.74s/it, best=0.923][I 2026-02-28 09:04:03,187] Trial 32 finished with value: 0.9150071905057106 and parameters: {'activation': 'tanh', 'solver': 'adam', 'lr': 2.973167121361003e-05, 'layer1': 465, 'layer2': 89, 'layer3': 357}. Best is trial 32 with value: 0.9150071905057106.

Escherichia_Coli | Piperacillin-Tazobactam | Optuna:  16%|█▋        | 33/200 [59:55<5:35:02, 120.37s/it, best=0.914][A
Escherichia_Coli | Piperacillin-Tazobactam | Optuna:  16%|█▋        | 33/200 [59:55<5:35:02, 120.37s/it, best=0.915][A[I 2026-02-28 09:04:30,571] Trial 75 finished with value: 0.865755488339562 and parameters: {'activation': 'identity', 'solver': 'adam', 'lr': 5.332090680760774e-05, 'layer1': 486, 'layer2': 461, 'layer3': 147}. Best is trial 65 with value: 0.8669592494429758.
Pseudomonas_Aeruginosa | DirectMulti | Optuna:  38%|███▊      | 76/200 [2:08:16<4:18:04, 124.87s/it, best=0.867]Pseudomonas_Aeruginosa | DirectMulti | Optuna:  38%|███▊      | 76/200 [2:08:16<4:18:04, 124.87s/it, best=0.867]/export/usuarios01/egarroyo/MALDI_for_AMR_prediction/venv/lib/python3.13/site-packages/sklearn/model_selection/_split.py:813: UserWarning: The least populated class in y has only 4 members, which is less than n_splits=5.
  warnings.warn(
[I 2026-02-28 09:05:34,819] Trial 25 finished with value: 0.8787175850741005 and parameters: {'activation': 'identity', 'solver': 'adam', 'lr': 0.009658318826868338, 'layer1': 349, 'layer2': 343, 'layer3': 210}. Best is trial 8 with value: 0.8879562150966016.
Staphylococcus_Aureus | LPS | Optuna:  13%|█▎        | 26/200 [59:21<6:54:09, 142.81s/it, best=0.888]Staphylococcus_Aureus | LPS | Optuna:  13%|█▎        | 26/200 [59:21<6:54:09, 142.81s/it, best=0.888][I 2026-02-28 09:06:18,874] Trial 10 finished with value: 0.917129070395597 and parameters: {'activation': 'identity', 'solver': 'sgd', 'lr': 0.007553503645583194, 'layer1': 366, 'layer2': 492, 'layer3': 320}. Best is trial 8 with value: 0.9228661952648753.
Klebsiella_Pneumoniae | LPS | Optuna:   6%|▌         | 11/200 [18:34<6:14:40, 118.94s/it, best=0.923]Klebsiella_Pneumoniae | LPS | Optuna:   6%|▌         | 11/200 [18:34<6:14:40, 118.94s/it, best=0.923][I 2026-02-28 09:06:39,163] Trial 33 finished with value: 0.9127307162551356 and parameters: {'activation': 'tanh', 'solver': 'adam', 'lr': 2.797359321306519e-05, 'layer1': 428, 'layer2': 95, 'layer3': 333}. Best is trial 32 with value: 0.9150071905057106.

Escherichia_Coli | Piperacillin-Tazobactam | Optuna:  17%|█▋        | 34/200 [1:02:31<6:02:34, 131.05s/it, best=0.915][A
Escherichia_Coli | Piperacillin-Tazobactam | Optuna:  17%|█▋        | 34/200 [1:02:31<6:02:34, 131.05s/it, best=0.915][A[I 2026-02-28 09:07:14,300] Trial 26 finished with value: 0.8011304249280441 and parameters: {'activation': 'identity', 'solver': 'sgd', 'lr': 4.856570841052574e-05, 'layer1': 175, 'layer2': 90, 'layer3': 440}. Best is trial 8 with value: 0.8879562150966016.
Staphylococcus_Aureus | LPS | Optuna:  14%|█▎        | 27/200 [1:01:00<6:14:17, 129.81s/it, best=0.888]Staphylococcus_Aureus | LPS | Optuna:  14%|█▎        | 27/200 [1:01:00<6:14:17, 129.81s/it, best=0.888][I 2026-02-28 09:07:27,744] Trial 11 finished with value: 0.917579578262413 and parameters: {'activation': 'relu', 'solver': 'adam', 'lr': 0.0013124793805688133, 'layer1': 150, 'layer2': 163, 'layer3': 284}. Best is trial 8 with value: 0.9228661952648753.
Klebsiella_Pneumoniae | LPS | Optuna:   6%|▌         | 12/200 [19:43<5:24:57, 103.71s/it, best=0.923]Klebsiella_Pneumoniae | LPS | Optuna:   6%|▌         | 12/200 [19:43<5:24:57, 103.71s/it, best=0.923][I 2026-02-28 09:07:51,882] Trial 76 finished with value: 0.8643599641878075 and parameters: {'activation': 'identity', 'solver': 'adam', 'lr': 2.2382550112490978e-05, 'layer1': 500, 'layer2': 466, 'layer3': 87}. Best is trial 65 with value: 0.8669592494429758.
Pseudomonas_Aeruginosa | DirectMulti | Optuna:  38%|███▊      | 77/200 [2:11:38<5:02:59, 147.80s/it, best=0.867]Pseudomonas_Aeruginosa | DirectMulti | Optuna:  38%|███▊      | 77/200 [2:11:38<5:02:59, 147.80s/it, best=0.867]/export/usuarios01/egarroyo/MALDI_for_AMR_prediction/venv/lib/python3.13/site-packages/sklearn/model_selection/_split.py:813: UserWarning: The least populated class in y has only 4 members, which is less than n_splits=5.
  warnings.warn(
[I 2026-02-28 09:09:46,691] Trial 27 finished with value: 0.8838084246119889 and parameters: {'activation': 'logistic', 'solver': 'adam', 'lr': 0.0005477318367468982, 'layer1': 393, 'layer2': 471, 'layer3': 259}. Best is trial 8 with value: 0.8879562150966016.
Staphylococcus_Aureus | LPS | Optuna:  14%|█▍        | 28/200 [1:03:33<6:31:32, 136.59s/it, best=0.888]Staphylococcus_Aureus | LPS | Optuna:  14%|█▍        | 28/200 [1:03:33<6:31:32, 136.59s/it, best=0.888][I 2026-02-28 09:09:47,035] Trial 77 finished with value: 0.8622803592946369 and parameters: {'activation': 'identity', 'solver': 'adam', 'lr': 6.022096997089822e-05, 'layer1': 485, 'layer2': 499, 'layer3': 41}. Best is trial 65 with value: 0.8669592494429758.
Pseudomonas_Aeruginosa | DirectMulti | Optuna:  39%|███▉      | 78/200 [2:13:33<4:40:37, 138.01s/it, best=0.867]Pseudomonas_Aeruginosa | DirectMulti | Optuna:  39%|███▉      | 78/200 [2:13:33<4:40:37, 138.01s/it, best=0.867]/export/usuarios01/egarroyo/MALDI_for_AMR_prediction/venv/lib/python3.13/site-packages/sklearn/model_selection/_split.py:813: UserWarning: The least populated class in y has only 4 members, which is less than n_splits=5.
  warnings.warn(
[I 2026-02-28 09:09:55,220] Trial 12 finished with value: 0.9227889577131002 and parameters: {'activation': 'identity', 'solver': 'adam', 'lr': 0.00046544039809979403, 'layer1': 347, 'layer2': 434, 'layer3': 419}. Best is trial 8 with value: 0.9228661952648753.
Klebsiella_Pneumoniae | LPS | Optuna:   6%|▋         | 13/200 [22:11<6:04:33, 116.97s/it, best=0.923]Klebsiella_Pneumoniae | LPS | Optuna:   6%|▋         | 13/200 [22:11<6:04:33, 116.97s/it, best=0.923][I 2026-02-28 09:10:04,349] Trial 34 finished with value: 0.9079739457587545 and parameters: {'activation': 'tanh', 'solver': 'adam', 'lr': 8.89717596800042e-06, 'layer1': 467, 'layer2': 336, 'layer3': 275}. Best is trial 32 with value: 0.9150071905057106.

Escherichia_Coli | Piperacillin-Tazobactam | Optuna:  18%|█▊        | 35/200 [1:05:57<7:01:33, 153.29s/it, best=0.915][A
Escherichia_Coli | Piperacillin-Tazobactam | Optuna:  18%|█▊        | 35/200 [1:05:57<7:01:33, 153.29s/it, best=0.915][A[I 2026-02-28 09:10:52,090] Trial 28 finished with value: 0.8644017928225967 and parameters: {'activation': 'tanh', 'solver': 'adam', 'lr': 0.003948456519389333, 'layer1': 228, 'layer2': 162, 'layer3': 340}. Best is trial 8 with value: 0.8879562150966016.
Staphylococcus_Aureus | LPS | Optuna:  14%|█▍        | 29/200 [1:04:38<5:28:24, 115.23s/it, best=0.888]Staphylococcus_Aureus | LPS | Optuna:  14%|█▍        | 29/200 [1:04:38<5:28:24, 115.23s/it, best=0.888][I 2026-02-28 09:11:30,670] Trial 29 finished with value: 0.8016455484651599 and parameters: {'activation': 'logistic', 'solver': 'sgd', 'lr': 0.0007448022190272177, 'layer1': 467, 'layer2': 303, 'layer3': 369}. Best is trial 8 with value: 0.8879562150966016.
Staphylococcus_Aureus | LPS | Optuna:  15%|█▌        | 30/200 [1:05:17<4:21:19, 92.23s/it, best=0.888] Staphylococcus_Aureus | LPS | Optuna:  15%|█▌        | 30/200 [1:05:17<4:21:19, 92.23s/it, best=0.888][I 2026-02-28 09:12:06,091] Trial 78 finished with value: 0.8626882803380062 and parameters: {'activation': 'identity', 'solver': 'adam', 'lr': 3.32799252429743e-05, 'layer1': 468, 'layer2': 451, 'layer3': 111}. Best is trial 65 with value: 0.8669592494429758.
Pseudomonas_Aeruginosa | DirectMulti | Optuna:  40%|███▉      | 79/200 [2:15:52<4:38:57, 138.32s/it, best=0.867]Pseudomonas_Aeruginosa | DirectMulti | Optuna:  40%|███▉      | 79/200 [2:15:52<4:38:57, 138.32s/it, best=0.867]/export/usuarios01/egarroyo/MALDI_for_AMR_prediction/venv/lib/python3.13/site-packages/sklearn/model_selection/_split.py:813: UserWarning: The least populated class in y has only 4 members, which is less than n_splits=5.
  warnings.warn(
[I 2026-02-28 09:12:08,974] Trial 13 finished with value: 0.9241592664119492 and parameters: {'activation': 'identity', 'solver': 'adam', 'lr': 0.00025548240574830476, 'layer1': 499, 'layer2': 471, 'layer3': 419}. Best is trial 13 with value: 0.9241592664119492.
Klebsiella_Pneumoniae | LPS | Optuna:   7%|▋         | 14/200 [24:25<6:18:19, 122.04s/it, best=0.923]Klebsiella_Pneumoniae | LPS | Optuna:   7%|▋         | 14/200 [24:25<6:18:19, 122.04s/it, best=0.924][I 2026-02-28 09:12:50,058] Trial 35 finished with value: 0.9028545455998493 and parameters: {'activation': 'tanh', 'solver': 'adam', 'lr': 7.811352829507434e-06, 'layer1': 386, 'layer2': 196, 'layer3': 422}. Best is trial 32 with value: 0.9150071905057106.

Escherichia_Coli | Piperacillin-Tazobactam | Optuna:  18%|█▊        | 36/200 [1:08:42<7:09:10, 157.02s/it, best=0.915][A
Escherichia_Coli | Piperacillin-Tazobactam | Optuna:  18%|█▊        | 36/200 [1:08:42<7:09:10, 157.02s/it, best=0.915][A[I 2026-02-28 09:13:37,786] Trial 36 finished with value: 0.8958344038173316 and parameters: {'activation': 'relu', 'solver': 'adam', 'lr': 2.66285778407052e-05, 'layer1': 445, 'layer2': 11, 'layer3': 476}. Best is trial 32 with value: 0.9150071905057106.

Escherichia_Coli | Piperacillin-Tazobactam | Optuna:  18%|█▊        | 37/200 [1:09:30<5:37:29, 124.23s/it, best=0.915][A
Escherichia_Coli | Piperacillin-Tazobactam | Optuna:  18%|█▊        | 37/200 [1:09:30<5:37:29, 124.23s/it, best=0.915][A[I 2026-02-28 09:13:40,557] Trial 30 finished with value: 0.8847124588689488 and parameters: {'activation': 'identity', 'solver': 'adam', 'lr': 0.00016042647640590347, 'layer1': 415, 'layer2': 227, 'layer3': 265}. Best is trial 8 with value: 0.8879562150966016.
Staphylococcus_Aureus | LPS | Optuna:  16%|█▌        | 31/200 [1:07:26<4:51:36, 103.53s/it, best=0.888]Staphylococcus_Aureus | LPS | Optuna:  16%|█▌        | 31/200 [1:07:26<4:51:36, 103.53s/it, best=0.888][I 2026-02-28 09:14:19,975] Trial 14 finished with value: 0.9228482419821316 and parameters: {'activation': 'identity', 'solver': 'adam', 'lr': 0.0001289657517138117, 'layer1': 499, 'layer2': 394, 'layer3': 396}. Best is trial 13 with value: 0.9241592664119492.
Klebsiella_Pneumoniae | LPS | Optuna:   8%|▊         | 15/200 [26:36<6:24:36, 124.74s/it, best=0.924]Klebsiella_Pneumoniae | LPS | Optuna:   8%|▊         | 15/200 [26:36<6:24:36, 124.74s/it, best=0.924][I 2026-02-28 09:15:24,223] Trial 79 finished with value: 0.8238768576136921 and parameters: {'activation': 'identity', 'solver': 'sgd', 'lr': 0.00015524702957476423, 'layer1': 450, 'layer2': 480, 'layer3': 142}. Best is trial 65 with value: 0.8669592494429758.
Pseudomonas_Aeruginosa | DirectMulti | Optuna:  40%|████      | 80/200 [2:19:10<5:12:31, 156.27s/it, best=0.867]Pseudomonas_Aeruginosa | DirectMulti | Optuna:  40%|████      | 80/200 [2:19:10<5:12:31, 156.27s/it, best=0.867]/export/usuarios01/egarroyo/MALDI_for_AMR_prediction/venv/lib/python3.13/site-packages/sklearn/model_selection/_split.py:813: UserWarning: The least populated class in y has only 4 members, which is less than n_splits=5.
  warnings.warn(
[I 2026-02-28 09:15:50,470] Trial 37 finished with value: 0.9084911212911593 and parameters: {'activation': 'logistic', 'solver': 'adam', 'lr': 0.0002255423704075235, 'layer1': 472, 'layer2': 64, 'layer3': 375}. Best is trial 32 with value: 0.9150071905057106.

Escherichia_Coli | Piperacillin-Tazobactam | Optuna:  19%|█▉        | 38/200 [1:11:43<5:42:16, 126.77s/it, best=0.915][A
Escherichia_Coli | Piperacillin-Tazobactam | Optuna:  19%|█▉        | 38/200 [1:11:43<5:42:16, 126.77s/it, best=0.915][A[I 2026-02-28 09:16:03,230] Trial 80 finished with value: 0.8255018342260501 and parameters: {'activation': 'relu', 'solver': 'adam', 'lr': 1.1349347079155775e-05, 'layer1': 481, 'layer2': 426, 'layer3': 145}. Best is trial 65 with value: 0.8669592494429758.
Pseudomonas_Aeruginosa | DirectMulti | Optuna:  40%|████      | 81/200 [2:19:49<4:00:09, 121.09s/it, best=0.867]Pseudomonas_Aeruginosa | DirectMulti | Optuna:  40%|████      | 81/200 [2:19:49<4:00:09, 121.09s/it, best=0.867]/export/usuarios01/egarroyo/MALDI_for_AMR_prediction/venv/lib/python3.13/site-packages/sklearn/model_selection/_split.py:813: UserWarning: The least populated class in y has only 4 members, which is less than n_splits=5.
  warnings.warn(
[I 2026-02-28 09:16:19,647] Trial 31 finished with value: 0.8853501574335867 and parameters: {'activation': 'identity', 'solver': 'adam', 'lr': 0.001989384385070317, 'layer1': 294, 'layer2': 380, 'layer3': 383}. Best is trial 8 with value: 0.8879562150966016.
Staphylococcus_Aureus | LPS | Optuna:  16%|█▌        | 32/200 [1:10:05<5:36:33, 120.20s/it, best=0.888]Staphylococcus_Aureus | LPS | Optuna:  16%|█▌        | 32/200 [1:10:05<5:36:33, 120.20s/it, best=0.888][I 2026-02-28 09:16:23,040] Trial 15 finished with value: 0.9220552656991721 and parameters: {'activation': 'identity', 'solver': 'adam', 'lr': 0.00037562448584352033, 'layer1': 497, 'layer2': 499, 'layer3': 236}. Best is trial 13 with value: 0.9241592664119492.
Klebsiella_Pneumoniae | LPS | Optuna:   8%|▊         | 16/200 [28:39<6:20:59, 124.24s/it, best=0.924]Klebsiella_Pneumoniae | LPS | Optuna:   8%|▊         | 16/200 [28:39<6:20:59, 124.24s/it, best=0.924][I 2026-02-28 09:17:57,323] Trial 81 finished with value: 0.8663069122996699 and parameters: {'activation': 'identity', 'solver': 'adam', 'lr': 0.00022151923125441624, 'layer1': 408, 'layer2': 352, 'layer3': 184}. Best is trial 65 with value: 0.8669592494429758.
Pseudomonas_Aeruginosa | DirectMulti | Optuna:  41%|████      | 82/200 [2:21:43<3:54:00, 118.99s/it, best=0.867]Pseudomonas_Aeruginosa | DirectMulti | Optuna:  41%|████      | 82/200 [2:21:43<3:54:00, 118.99s/it, best=0.867]/export/usuarios01/egarroyo/MALDI_for_AMR_prediction/venv/lib/python3.13/site-packages/sklearn/model_selection/_split.py:813: UserWarning: The least populated class in y has only 4 members, which is less than n_splits=5.
  warnings.warn(
[I 2026-02-28 09:18:17,132] Trial 16 finished with value: 0.9208035799384516 and parameters: {'activation': 'identity', 'solver': 'adam', 'lr': 0.0076443071072698505, 'layer1': 330, 'layer2': 424, 'layer3': 472}. Best is trial 13 with value: 0.9241592664119492.
Klebsiella_Pneumoniae | LPS | Optuna:   8%|▊         | 17/200 [30:33<6:09:36, 121.19s/it, best=0.924]Klebsiella_Pneumoniae | LPS | Optuna:   8%|▊         | 17/200 [30:33<6:09:36, 121.19s/it, best=0.924][I 2026-02-28 09:18:36,418] Trial 32 finished with value: 0.8852054012279188 and parameters: {'activation': 'identity', 'solver': 'adam', 'lr': 0.001656200453583246, 'layer1': 296, 'layer2': 406, 'layer3': 321}. Best is trial 8 with value: 0.8879562150966016.
Staphylococcus_Aureus | LPS | Optuna:  16%|█▋        | 33/200 [1:12:22<5:48:23, 125.17s/it, best=0.888]Staphylococcus_Aureus | LPS | Optuna:  16%|█▋        | 33/200 [1:12:22<5:48:23, 125.17s/it, best=0.888][I 2026-02-28 09:20:14,953] Trial 82 finished with value: 0.8660552335654146 and parameters: {'activation': 'identity', 'solver': 'adam', 'lr': 0.00024244058554460943, 'layer1': 459, 'layer2': 355, 'layer3': 184}. Best is trial 65 with value: 0.8669592494429758.
Pseudomonas_Aeruginosa | DirectMulti | Optuna:  42%|████▏     | 83/200 [2:24:01<4:02:56, 124.58s/it, best=0.867]Pseudomonas_Aeruginosa | DirectMulti | Optuna:  42%|████▏     | 83/200 [2:24:01<4:02:56, 124.58s/it, best=0.867]/export/usuarios01/egarroyo/MALDI_for_AMR_prediction/venv/lib/python3.13/site-packages/sklearn/model_selection/_split.py:813: UserWarning: The least populated class in y has only 4 members, which is less than n_splits=5.
  warnings.warn(
[I 2026-02-28 09:20:23,854] Trial 17 finished with value: 0.9239833750177218 and parameters: {'activation': 'identity', 'solver': 'adam', 'lr': 0.0019137667848854478, 'layer1': 430, 'layer2': 375, 'layer3': 299}. Best is trial 13 with value: 0.9241592664119492.
Klebsiella_Pneumoniae | LPS | Optuna:   9%|▉         | 18/200 [32:39<6:12:38, 122.85s/it, best=0.924]Klebsiella_Pneumoniae | LPS | Optuna:   9%|▉         | 18/200 [32:39<6:12:38, 122.85s/it, best=0.924][I 2026-02-28 09:20:49,294] Trial 33 finished with value: 0.8864000782214673 and parameters: {'activation': 'identity', 'solver': 'adam', 'lr': 0.0002978304845469504, 'layer1': 282, 'layer2': 367, 'layer3': 453}. Best is trial 8 with value: 0.8879562150966016.
Staphylococcus_Aureus | LPS | Optuna:  17%|█▋        | 34/200 [1:14:35<5:52:41, 127.48s/it, best=0.888]Staphylococcus_Aureus | LPS | Optuna:  17%|█▋        | 34/200 [1:14:35<5:52:41, 127.48s/it, best=0.888][I 2026-02-28 09:21:04,998] Trial 18 finished with value: 0.8707718915382767 and parameters: {'activation': 'tanh', 'solver': 'sgd', 'lr': 0.0028011065420916635, 'layer1': 439, 'layer2': 383, 'layer3': 422}. Best is trial 13 with value: 0.9241592664119492.
