Escherichia_Coli | Ceftriaxone | Optuna:  67%|██████▋   | 134/200 [5:36:28<2:55:46, 159.80s/it, best=0.897][A[I 2026-02-28 04:46:34,131] Trial 98 finished with value: 0.9800270054346416 and parameters: {'activation': 'relu', 'solver': 'sgd', 'lr': 0.0004198953805167964, 'layer1': 133, 'layer2': 285, 'layer3': 109}. Best is trial 13 with value: 0.9860492846658779.

Klebsiella_Pneumoniae | Imipenem | Optuna:  50%|████▉     | 99/200 [1:17:46<55:28, 32.96s/it, best=0.986]  [A
Klebsiella_Pneumoniae | Imipenem | Optuna:  50%|████▉     | 99/200 [1:17:46<55:28, 32.96s/it, best=0.986][A[I 2026-02-28 04:47:11,209] Trial 99 finished with value: 0.9829733840622789 and parameters: {'activation': 'relu', 'solver': 'adam', 'lr': 0.001598489532914154, 'layer1': 86, 'layer2': 314, 'layer3': 390}. Best is trial 13 with value: 0.9860492846658779.

Klebsiella_Pneumoniae | Imipenem | Optuna:  50%|█████     | 100/200 [1:18:23<56:59, 34.19s/it, best=0.986][A
Klebsiella_Pneumoniae | Imipenem | Optuna:  50%|█████     | 100/200 [1:18:23<56:59, 34.19s/it, best=0.986][A[I 2026-02-28 04:47:41,473] Trial 108 finished with value: 0.863284161920595 and parameters: {'activation': 'identity', 'solver': 'adam', 'lr': 0.007656111767207858, 'layer1': 17, 'layer2': 388, 'layer3': 428}. Best is trial 63 with value: 0.8682133709784562.
Pseudomonas_Aeruginosa | LPS | Optuna:  55%|█████▍    | 109/200 [2:42:43<2:20:17, 92.51s/it, best=0.868]Pseudomonas_Aeruginosa | LPS | Optuna:  55%|█████▍    | 109/200 [2:42:43<2:20:17, 92.51s/it, best=0.868]/export/usuarios01/egarroyo/MALDI_for_AMR_prediction/venv/lib/python3.13/site-packages/sklearn/model_selection/_split.py:813: UserWarning: The least populated class in y has only 4 members, which is less than n_splits=5.
  warnings.warn(
[I 2026-02-28 04:47:48,898] Trial 75 finished with value: 0.9169828265684672 and parameters: {'activation': 'logistic', 'solver': 'adam', 'lr': 0.00047745443555263447, 'layer1': 485, 'layer2': 42, 'layer3': 227}. Best is trial 20 with value: 0.9283335834984147.

Staphylococcus_Aureus | Fusidic acid | Optuna:  38%|███▊      | 76/200 [2:06:58<3:17:52, 95.75s/it, best=0.928] [A
Staphylococcus_Aureus | Fusidic acid | Optuna:  38%|███▊      | 76/200 [2:06:58<3:17:52, 95.75s/it, best=0.928][A[I 2026-02-28 04:47:51,053] Trial 100 finished with value: 0.983714117942917 and parameters: {'activation': 'relu', 'solver': 'adam', 'lr': 0.0009692641386190007, 'layer1': 207, 'layer2': 181, 'layer3': 379}. Best is trial 13 with value: 0.9860492846658779.

Klebsiella_Pneumoniae | Imipenem | Optuna:  50%|█████     | 101/200 [1:19:03<59:13, 35.89s/it, best=0.986][A
Klebsiella_Pneumoniae | Imipenem | Optuna:  50%|█████     | 101/200 [1:19:03<59:13, 35.89s/it, best=0.986][A[I 2026-02-28 04:48:36,655] Trial 101 finished with value: 0.984326270952112 and parameters: {'activation': 'relu', 'solver': 'adam', 'lr': 0.002372882383180626, 'layer1': 57, 'layer2': 399, 'layer3': 419}. Best is trial 13 with value: 0.9860492846658779.

Klebsiella_Pneumoniae | Imipenem | Optuna:  51%|█████     | 102/200 [1:19:49<1:03:22, 38.80s/it, best=0.986][A
Klebsiella_Pneumoniae | Imipenem | Optuna:  51%|█████     | 102/200 [1:19:49<1:03:22, 38.80s/it, best=0.986][A[I 2026-02-28 04:48:37,398] Trial 109 finished with value: 0.8402886261407811 and parameters: {'activation': 'logistic', 'solver': 'adam', 'lr': 0.008090890333017594, 'layer1': 25, 'layer2': 338, 'layer3': 490}. Best is trial 63 with value: 0.8682133709784562.
Pseudomonas_Aeruginosa | LPS | Optuna:  55%|█████▌    | 110/200 [2:43:39<2:02:17, 81.53s/it, best=0.868]Pseudomonas_Aeruginosa | LPS | Optuna:  55%|█████▌    | 110/200 [2:43:39<2:02:17, 81.53s/it, best=0.868]/export/usuarios01/egarroyo/MALDI_for_AMR_prediction/venv/lib/python3.13/site-packages/sklearn/model_selection/_split.py:813: UserWarning: The least populated class in y has only 4 members, which is less than n_splits=5.
  warnings.warn(
[I 2026-02-28 04:49:12,528] Trial 102 finished with value: 0.9840845268768496 and parameters: {'activation': 'relu', 'solver': 'adam', 'lr': 0.003081414587754073, 'layer1': 71, 'layer2': 155, 'layer3': 437}. Best is trial 13 with value: 0.9860492846658779.

Klebsiella_Pneumoniae | Imipenem | Optuna:  52%|█████▏    | 103/200 [1:20:25<1:01:18, 37.92s/it, best=0.986][A
Klebsiella_Pneumoniae | Imipenem | Optuna:  52%|█████▏    | 103/200 [1:20:25<1:01:18, 37.92s/it, best=0.986][A[I 2026-02-28 04:49:21,760] Trial 134 finished with value: 0.893341141312861 and parameters: {'activation': 'relu', 'solver': 'adam', 'lr': 5.0994830009814656e-05, 'layer1': 409, 'layer2': 348, 'layer3': 123}. Best is trial 122 with value: 0.897309104499819.

Escherichia_Coli | Ceftriaxone | Optuna:  68%|██████▊   | 135/200 [5:39:23<2:57:50, 164.17s/it, best=0.897][A
Escherichia_Coli | Ceftriaxone | Optuna:  68%|██████▊   | 135/200 [5:39:23<2:57:50, 164.17s/it, best=0.897][A[I 2026-02-28 04:49:47,100] Trial 110 finished with value: 0.8656575550857356 and parameters: {'activation': 'identity', 'solver': 'adam', 'lr': 0.0004038520183687179, 'layer1': 10, 'layer2': 274, 'layer3': 497}. Best is trial 63 with value: 0.8682133709784562.
Pseudomonas_Aeruginosa | LPS | Optuna:  56%|█████▌    | 111/200 [2:44:49<1:55:40, 77.98s/it, best=0.868]Pseudomonas_Aeruginosa | LPS | Optuna:  56%|█████▌    | 111/200 [2:44:49<1:55:40, 77.98s/it, best=0.868]/export/usuarios01/egarroyo/MALDI_for_AMR_prediction/venv/lib/python3.13/site-packages/sklearn/model_selection/_split.py:813: UserWarning: The least populated class in y has only 4 members, which is less than n_splits=5.
  warnings.warn(
[I 2026-02-28 04:49:54,282] Trial 103 finished with value: 0.984058813201597 and parameters: {'activation': 'relu', 'solver': 'adam', 'lr': 0.001997730959440944, 'layer1': 158, 'layer2': 191, 'layer3': 458}. Best is trial 13 with value: 0.9860492846658779.

Klebsiella_Pneumoniae | Imipenem | Optuna:  52%|█████▏    | 104/200 [1:21:06<1:02:31, 39.07s/it, best=0.986][A
Klebsiella_Pneumoniae | Imipenem | Optuna:  52%|█████▏    | 104/200 [1:21:06<1:02:31, 39.07s/it, best=0.986][A[I 2026-02-28 04:49:58,163] Trial 76 finished with value: 0.9226113200936119 and parameters: {'activation': 'relu', 'solver': 'adam', 'lr': 0.0002277135479936649, 'layer1': 500, 'layer2': 108, 'layer3': 296}. Best is trial 20 with value: 0.9283335834984147.

Staphylococcus_Aureus | Fusidic acid | Optuna:  38%|███▊      | 77/200 [2:09:07<3:36:53, 105.80s/it, best=0.928][A
Staphylococcus_Aureus | Fusidic acid | Optuna:  38%|███▊      | 77/200 [2:09:07<3:36:53, 105.80s/it, best=0.928][A[I 2026-02-28 04:51:00,744] Trial 104 finished with value: 0.984058813201597 and parameters: {'activation': 'relu', 'solver': 'adam', 'lr': 0.0015405172866543746, 'layer1': 493, 'layer2': 207, 'layer3': 485}. Best is trial 13 with value: 0.9860492846658779.

Klebsiella_Pneumoniae | Imipenem | Optuna:  52%|█████▎    | 105/200 [1:22:13<1:14:52, 47.29s/it, best=0.986][A
Klebsiella_Pneumoniae | Imipenem | Optuna:  52%|█████▎    | 105/200 [1:22:13<1:14:52, 47.29s/it, best=0.986][A[I 2026-02-28 04:51:01,893] Trial 111 finished with value: 0.8664681460552158 and parameters: {'activation': 'identity', 'solver': 'adam', 'lr': 0.0015458998594141086, 'layer1': 30, 'layer2': 324, 'layer3': 457}. Best is trial 63 with value: 0.8682133709784562.
Pseudomonas_Aeruginosa | LPS | Optuna:  56%|█████▌    | 112/200 [2:46:03<1:52:58, 77.03s/it, best=0.868]Pseudomonas_Aeruginosa | LPS | Optuna:  56%|█████▌    | 112/200 [2:46:03<1:52:58, 77.03s/it, best=0.868]/export/usuarios01/egarroyo/MALDI_for_AMR_prediction/venv/lib/python3.13/site-packages/sklearn/model_selection/_split.py:813: UserWarning: The least populated class in y has only 4 members, which is less than n_splits=5.
  warnings.warn(
[I 2026-02-28 04:51:33,713] Trial 135 finished with value: 0.8941922089489172 and parameters: {'activation': 'relu', 'solver': 'adam', 'lr': 0.00014331260602525874, 'layer1': 458, 'layer2': 314, 'layer3': 54}. Best is trial 122 with value: 0.897309104499819.

Escherichia_Coli | Ceftriaxone | Optuna:  68%|██████▊   | 136/200 [5:41:35<2:44:48, 154.50s/it, best=0.897][A
Escherichia_Coli | Ceftriaxone | Optuna:  68%|██████▊   | 136/200 [5:41:35<2:44:48, 154.50s/it, best=0.897][A[I 2026-02-28 04:51:39,465] Trial 77 finished with value: 0.9283869597728589 and parameters: {'activation': 'identity', 'solver': 'adam', 'lr': 5.3237019751895146e-05, 'layer1': 336, 'layer2': 122, 'layer3': 183}. Best is trial 77 with value: 0.9283869597728589.

Staphylococcus_Aureus | Fusidic acid | Optuna:  39%|███▉      | 78/200 [2:10:48<3:32:23, 104.45s/it, best=0.928][A
Staphylococcus_Aureus | Fusidic acid | Optuna:  39%|███▉      | 78/200 [2:10:48<3:32:23, 104.45s/it, best=0.928][A[I 2026-02-28 04:51:53,651] Trial 105 finished with value: 0.9833171190756502 and parameters: {'activation': 'relu', 'solver': 'adam', 'lr': 0.0008066334176846554, 'layer1': 473, 'layer2': 166, 'layer3': 405}. Best is trial 13 with value: 0.9860492846658779.

Klebsiella_Pneumoniae | Imipenem | Optuna:  53%|█████▎    | 106/200 [1:23:06<1:16:43, 48.98s/it, best=0.986][A
Klebsiella_Pneumoniae | Imipenem | Optuna:  53%|█████▎    | 106/200 [1:23:06<1:16:43, 48.98s/it, best=0.986][A[I 2026-02-28 04:52:16,669] Trial 112 finished with value: 0.864205411589988 and parameters: {'activation': 'identity', 'solver': 'adam', 'lr': 0.0014182203020395867, 'layer1': 58, 'layer2': 251, 'layer3': 460}. Best is trial 63 with value: 0.8682133709784562.
Pseudomonas_Aeruginosa | LPS | Optuna:  56%|█████▋    | 113/200 [2:47:18<1:50:42, 76.35s/it, best=0.868]Pseudomonas_Aeruginosa | LPS | Optuna:  56%|█████▋    | 113/200 [2:47:18<1:50:42, 76.35s/it, best=0.868]/export/usuarios01/egarroyo/MALDI_for_AMR_prediction/venv/lib/python3.13/site-packages/sklearn/model_selection/_split.py:813: UserWarning: The least populated class in y has only 4 members, which is less than n_splits=5.
  warnings.warn(
[I 2026-02-28 04:52:30,208] Trial 106 finished with value: 0.9816742819261448 and parameters: {'activation': 'tanh', 'solver': 'adam', 'lr': 0.005568506084567636, 'layer1': 227, 'layer2': 179, 'layer3': 470}. Best is trial 13 with value: 0.9860492846658779.

Klebsiella_Pneumoniae | Imipenem | Optuna:  54%|█████▎    | 107/200 [1:23:42<1:10:08, 45.25s/it, best=0.986][A
Klebsiella_Pneumoniae | Imipenem | Optuna:  54%|█████▎    | 107/200 [1:23:42<1:10:08, 45.25s/it, best=0.986][A[I 2026-02-28 04:53:15,856] Trial 107 finished with value: 0.9831536169805759 and parameters: {'activation': 'relu', 'solver': 'adam', 'lr': 0.0022006430735463634, 'layer1': 34, 'layer2': 427, 'layer3': 348}. Best is trial 13 with value: 0.9860492846658779.

Klebsiella_Pneumoniae | Imipenem | Optuna:  54%|█████▍    | 108/200 [1:24:28<1:09:33, 45.37s/it, best=0.986][A
Klebsiella_Pneumoniae | Imipenem | Optuna:  54%|█████▍    | 108/200 [1:24:28<1:09:33, 45.37s/it, best=0.986][A[I 2026-02-28 04:53:30,039] Trial 113 finished with value: 0.8649483939078033 and parameters: {'activation': 'identity', 'solver': 'adam', 'lr': 0.0016846939877234574, 'layer1': 34, 'layer2': 316, 'layer3': 411}. Best is trial 63 with value: 0.8682133709784562.
Pseudomonas_Aeruginosa | LPS | Optuna:  57%|█████▋    | 114/200 [2:48:32<1:48:09, 75.46s/it, best=0.868]Pseudomonas_Aeruginosa | LPS | Optuna:  57%|█████▋    | 114/200 [2:48:32<1:48:09, 75.46s/it, best=0.868]/export/usuarios01/egarroyo/MALDI_for_AMR_prediction/venv/lib/python3.13/site-packages/sklearn/model_selection/_split.py:813: UserWarning: The least populated class in y has only 4 members, which is less than n_splits=5.
  warnings.warn(
[I 2026-02-28 04:53:55,764] Trial 78 finished with value: 0.9265483941588807 and parameters: {'activation': 'identity', 'solver': 'adam', 'lr': 2.114620322643335e-05, 'layer1': 324, 'layer2': 119, 'layer3': 189}. Best is trial 77 with value: 0.9283869597728589.

Staphylococcus_Aureus | Fusidic acid | Optuna:  40%|███▉      | 79/200 [2:13:04<3:49:54, 114.01s/it, best=0.928][A
Staphylococcus_Aureus | Fusidic acid | Optuna:  40%|███▉      | 79/200 [2:13:04<3:49:54, 114.01s/it, best=0.928][A[I 2026-02-28 04:54:10,450] Trial 108 finished with value: 0.9833400434475811 and parameters: {'activation': 'relu', 'solver': 'adam', 'lr': 0.0012395949651918712, 'layer1': 455, 'layer2': 244, 'layer3': 370}. Best is trial 13 with value: 0.9860492846658779.

Klebsiella_Pneumoniae | Imipenem | Optuna:  55%|█████▍    | 109/200 [1:25:23<1:13:00, 48.14s/it, best=0.986][A
Klebsiella_Pneumoniae | Imipenem | Optuna:  55%|█████▍    | 109/200 [1:25:23<1:13:00, 48.14s/it, best=0.986][A[I 2026-02-28 04:54:52,272] Trial 114 finished with value: 0.8601453181069723 and parameters: {'activation': 'identity', 'solver': 'adam', 'lr': 0.0029289924117933195, 'layer1': 392, 'layer2': 293, 'layer3': 441}. Best is trial 63 with value: 0.8682133709784562.
Pseudomonas_Aeruginosa | LPS | Optuna:  57%|█████▊    | 115/200 [2:49:54<1:49:46, 77.49s/it, best=0.868]Pseudomonas_Aeruginosa | LPS | Optuna:  57%|█████▊    | 115/200 [2:49:54<1:49:46, 77.49s/it, best=0.868]/export/usuarios01/egarroyo/MALDI_for_AMR_prediction/venv/lib/python3.13/site-packages/sklearn/model_selection/_split.py:813: UserWarning: The least populated class in y has only 4 members, which is less than n_splits=5.
  warnings.warn(
[I 2026-02-28 04:54:55,642] Trial 109 finished with value: 0.9839547837273704 and parameters: {'activation': 'relu', 'solver': 'adam', 'lr': 0.0037983280818306873, 'layer1': 116, 'layer2': 203, 'layer3': 399}. Best is trial 13 with value: 0.9860492846658779.

Klebsiella_Pneumoniae | Imipenem | Optuna:  55%|█████▌    | 110/200 [1:26:08<1:10:52, 47.25s/it, best=0.986][A
Klebsiella_Pneumoniae | Imipenem | Optuna:  55%|█████▌    | 110/200 [1:26:08<1:10:52, 47.25s/it, best=0.986][A[I 2026-02-28 04:55:22,688] Trial 136 finished with value: 0.8863981427957957 and parameters: {'activation': 'logistic', 'solver': 'adam', 'lr': 8.333216920227222e-05, 'layer1': 500, 'layer2': 414, 'layer3': 90}. Best is trial 122 with value: 0.897309104499819.

Escherichia_Coli | Ceftriaxone | Optuna:  68%|██████▊   | 137/200 [5:45:24<3:05:41, 176.85s/it, best=0.897][A
Escherichia_Coli | Ceftriaxone | Optuna:  68%|██████▊   | 137/200 [5:45:24<3:05:41, 176.85s/it, best=0.897][A[I 2026-02-28 04:55:31,798] Trial 110 finished with value: 0.9819919843971873 and parameters: {'activation': 'logistic', 'solver': 'adam', 'lr': 0.0025949018624062334, 'layer1': 171, 'layer2': 368, 'layer3': 429}. Best is trial 13 with value: 0.9860492846658779.

Klebsiella_Pneumoniae | Imipenem | Optuna:  56%|█████▌    | 111/200 [1:26:44<1:05:09, 43.92s/it, best=0.986][A
Klebsiella_Pneumoniae | Imipenem | Optuna:  56%|█████▌    | 111/200 [1:26:44<1:05:09, 43.92s/it, best=0.986][A[I 2026-02-28 04:56:13,400] Trial 111 finished with value: 0.9830528681877911 and parameters: {'activation': 'relu', 'solver': 'adam', 'lr': 0.0018201192159699106, 'layer1': 234, 'layer2': 176, 'layer3': 339}. Best is trial 13 with value: 0.9860492846658779.

Klebsiella_Pneumoniae | Imipenem | Optuna:  56%|█████▌    | 112/200 [1:27:26<1:03:24, 43.23s/it, best=0.986][A
Klebsiella_Pneumoniae | Imipenem | Optuna:  56%|█████▌    | 112/200 [1:27:26<1:03:24, 43.23s/it, best=0.986][A[I 2026-02-28 04:56:14,535] Trial 79 finished with value: 0.9045660385943396 and parameters: {'activation': 'identity', 'solver': 'sgd', 'lr': 4.966665245627616e-05, 'layer1': 385, 'layer2': 134, 'layer3': 203}. Best is trial 77 with value: 0.9283869597728589.

Staphylococcus_Aureus | Fusidic acid | Optuna:  40%|████      | 80/200 [2:15:23<4:02:52, 121.44s/it, best=0.928][A
Staphylococcus_Aureus | Fusidic acid | Optuna:  40%|████      | 80/200 [2:15:23<4:02:52, 121.44s/it, best=0.928][A[I 2026-02-28 04:56:17,077] Trial 115 finished with value: 0.8666781491523651 and parameters: {'activation': 'identity', 'solver': 'adam', 'lr': 0.0010124389011157556, 'layer1': 40, 'layer2': 486, 'layer3': 484}. Best is trial 63 with value: 0.8682133709784562.
Pseudomonas_Aeruginosa | LPS | Optuna:  58%|█████▊    | 116/200 [2:51:19<1:51:33, 79.68s/it, best=0.868]Pseudomonas_Aeruginosa | LPS | Optuna:  58%|█████▊    | 116/200 [2:51:19<1:51:33, 79.68s/it, best=0.868]/export/usuarios01/egarroyo/MALDI_for_AMR_prediction/venv/lib/python3.13/site-packages/sklearn/model_selection/_split.py:813: UserWarning: The least populated class in y has only 4 members, which is less than n_splits=5.
  warnings.warn(
[I 2026-02-28 04:56:44,300] Trial 112 finished with value: 0.9830528681877911 and parameters: {'activation': 'relu', 'solver': 'adam', 'lr': 0.0012494406256635636, 'layer1': 54, 'layer2': 150, 'layer3': 385}. Best is trial 13 with value: 0.9860492846658779.

Klebsiella_Pneumoniae | Imipenem | Optuna:  56%|█████▋    | 113/200 [1:27:56<57:19, 39.53s/it, best=0.986]  [A
Klebsiella_Pneumoniae | Imipenem | Optuna:  56%|█████▋    | 113/200 [1:27:56<57:19, 39.53s/it, best=0.986][A[I 2026-02-28 04:57:22,309] Trial 113 finished with value: 0.9824140108437274 and parameters: {'activation': 'relu', 'solver': 'adam', 'lr': 0.0015218390688442323, 'layer1': 103, 'layer2': 163, 'layer3': 357}. Best is trial 13 with value: 0.9860492846658779.

Klebsiella_Pneumoniae | Imipenem | Optuna:  57%|█████▋    | 114/200 [1:28:34<56:00, 39.07s/it, best=0.986][A
Klebsiella_Pneumoniae | Imipenem | Optuna:  57%|█████▋    | 114/200 [1:28:34<56:00, 39.07s/it, best=0.986][A[I 2026-02-28 04:57:38,661] Trial 116 finished with value: 0.865169479021626 and parameters: {'activation': 'identity', 'solver': 'adam', 'lr': 0.0009732342835658905, 'layer1': 79, 'layer2': 491, 'layer3': 479}. Best is trial 63 with value: 0.8682133709784562.
Pseudomonas_Aeruginosa | LPS | Optuna:  58%|█████▊    | 117/200 [2:52:40<1:51:01, 80.25s/it, best=0.868]Pseudomonas_Aeruginosa | LPS | Optuna:  58%|█████▊    | 117/200 [2:52:40<1:51:01, 80.25s/it, best=0.868]/export/usuarios01/egarroyo/MALDI_for_AMR_prediction/venv/lib/python3.13/site-packages/sklearn/model_selection/_split.py:813: UserWarning: The least populated class in y has only 4 members, which is less than n_splits=5.
  warnings.warn(
[I 2026-02-28 04:57:59,647] Trial 80 finished with value: 0.9257965368726714 and parameters: {'activation': 'tanh', 'solver': 'adam', 'lr': 3.6725636827459315e-05, 'layer1': 334, 'layer2': 164, 'layer3': 250}. Best is trial 77 with value: 0.9283869597728589.

Staphylococcus_Aureus | Fusidic acid | Optuna:  40%|████      | 81/200 [2:17:08<3:51:08, 116.54s/it, best=0.928][A
Staphylococcus_Aureus | Fusidic acid | Optuna:  40%|████      | 81/200 [2:17:08<3:51:08, 116.54s/it, best=0.928][A[I 2026-02-28 04:58:06,010] Trial 117 finished with value: 0.8273685689934831 and parameters: {'activation': 'identity', 'solver': 'adam', 'lr': 6.494852133845143e-06, 'layer1': 41, 'layer2': 480, 'layer3': 487}. Best is trial 63 with value: 0.8682133709784562.
Pseudomonas_Aeruginosa | LPS | Optuna:  59%|█████▉    | 118/200 [2:53:08<1:27:59, 64.38s/it, best=0.868]Pseudomonas_Aeruginosa | LPS | Optuna:  59%|█████▉    | 118/200 [2:53:08<1:27:59, 64.38s/it, best=0.868]/export/usuarios01/egarroyo/MALDI_for_AMR_prediction/venv/lib/python3.13/site-packages/sklearn/model_selection/_split.py:813: UserWarning: The least populated class in y has only 4 members, which is less than n_splits=5.
  warnings.warn(
[I 2026-02-28 04:58:11,306] Trial 114 finished with value: 0.983980816269699 and parameters: {'activation': 'relu', 'solver': 'adam', 'lr': 0.0007551713884195855, 'layer1': 262, 'layer2': 193, 'layer3': 375}. Best is trial 13 with value: 0.9860492846658779.

Klebsiella_Pneumoniae | Imipenem | Optuna:  57%|█████▊    | 115/200 [1:29:23<59:34, 42.05s/it, best=0.986][A
Klebsiella_Pneumoniae | Imipenem | Optuna:  57%|█████▊    | 115/200 [1:29:23<59:34, 42.05s/it, best=0.986][A[I 2026-02-28 04:58:24,411] Trial 137 finished with value: 0.8979080367540411 and parameters: {'activation': 'relu', 'solver': 'adam', 'lr': 6.040834595633592e-05, 'layer1': 471, 'layer2': 338, 'layer3': 11}. Best is trial 137 with value: 0.8979080367540411.

Escherichia_Coli | Ceftriaxone | Optuna:  69%|██████▉   | 138/200 [5:48:25<3:04:15, 178.31s/it, best=0.897][A
Escherichia_Coli | Ceftriaxone | Optuna:  69%|██████▉   | 138/200 [5:48:25<3:04:15, 178.31s/it, best=0.898][A[I 2026-02-28 04:58:31,264] Trial 118 finished with value: 0.8280005869350374 and parameters: {'activation': 'identity', 'solver': 'sgd', 'lr': 0.0013557415240217643, 'layer1': 85, 'layer2': 465, 'layer3': 460}. Best is trial 63 with value: 0.8682133709784562.
Pseudomonas_Aeruginosa | LPS | Optuna:  60%|█████▉    | 119/200 [2:53:33<1:11:04, 52.64s/it, best=0.868]Pseudomonas_Aeruginosa | LPS | Optuna:  60%|█████▉    | 119/200 [2:53:33<1:11:04, 52.64s/it, best=0.868]/export/usuarios01/egarroyo/MALDI_for_AMR_prediction/venv/lib/python3.13/site-packages/sklearn/model_selection/_split.py:813: UserWarning: The least populated class in y has only 4 members, which is less than n_splits=5.
  warnings.warn(
[I 2026-02-28 04:59:01,262] Trial 115 finished with value: 0.9828217243524702 and parameters: {'activation': 'relu', 'solver': 'adam', 'lr': 0.0010310474500931123, 'layer1': 409, 'layer2': 127, 'layer3': 322}. Best is trial 13 with value: 0.9860492846658779.

Klebsiella_Pneumoniae | Imipenem | Optuna:  58%|█████▊    | 116/200 [1:30:13<1:02:11, 44.42s/it, best=0.986][A
Klebsiella_Pneumoniae | Imipenem | Optuna:  58%|█████▊    | 116/200 [1:30:13<1:02:11, 44.42s/it, best=0.986][A[I 2026-02-28 04:59:23,649] Trial 81 finished with value: 0.9269947662275196 and parameters: {'activation': 'identity', 'solver': 'adam', 'lr': 0.00016577246624327593, 'layer1': 287, 'layer2': 66, 'layer3': 118}. Best is trial 77 with value: 0.9283869597728589.

Staphylococcus_Aureus | Fusidic acid | Optuna:  41%|████      | 82/200 [2:18:32<3:29:59, 106.78s/it, best=0.928][A
