Klebsiella_Pneumoniae | Ciprofloxacin | Optuna:  51%|█████     | 102/200 [3:06:49<3:57:23, 145.35s/it, best=0.832][A[I 2026-02-27 17:54:20,890] Trial 74 finished with value: 0.8028802855238879 and parameters: {'activation': 'tanh', 'solver': 'adam', 'lr': 7.555452037049087e-05, 'layer1': 190, 'layer2': 392, 'layer3': 11}. Best is trial 55 with value: 0.8076668303114959.

Escherichia_Coli | Ciprofloxacin | Optuna:  38%|███▊      | 75/200 [3:06:50<3:27:08, 99.43s/it, best=0.808][A
Escherichia_Coli | Ciprofloxacin | Optuna:  38%|███▊      | 75/200 [3:06:50<3:27:08, 99.43s/it, best=0.808][A[I 2026-02-27 17:54:37,164] Trial 84 finished with value: 0.9099428178723615 and parameters: {'activation': 'identity', 'solver': 'adam', 'lr': 5.658941272409374e-05, 'layer1': 274, 'layer2': 396, 'layer3': 395}. Best is trial 84 with value: 0.9099428178723615.

Staphylococcus_Aureus | Oxacillin | Optuna:  42%|████▎     | 85/200 [3:07:06<4:28:50, 140.27s/it, best=0.909][A
Staphylococcus_Aureus | Oxacillin | Optuna:  42%|████▎     | 85/200 [3:07:06<4:28:50, 140.27s/it, best=0.91] [A[I 2026-02-27 17:55:31,961] Trial 170 finished with value: 0.8707943756402404 and parameters: {'activation': 'logistic', 'solver': 'adam', 'lr': 0.00038346047132571556, 'layer1': 457, 'layer2': 394, 'layer3': 405}. Best is trial 126 with value: 0.8764399491217574.

Pseudomonas_Aeruginosa | Ciprofloxacin | Optuna:  86%|████████▌ | 171/200 [3:08:01<35:22, 73.19s/it, best=0.876][A
Pseudomonas_Aeruginosa | Ciprofloxacin | Optuna:  86%|████████▌ | 171/200 [3:08:01<35:22, 73.19s/it, best=0.876][A[I 2026-02-27 17:56:33,873] Trial 102 finished with value: 0.8003587579906182 and parameters: {'activation': 'identity', 'solver': 'adam', 'lr': 1.0558686590374364e-05, 'layer1': 330, 'layer2': 427, 'layer3': 176}. Best is trial 91 with value: 0.8315336183309556.

Klebsiella_Pneumoniae | Ciprofloxacin | Optuna:  52%|█████▏    | 103/200 [3:09:03<3:49:26, 141.92s/it, best=0.832][A
Klebsiella_Pneumoniae | Ciprofloxacin | Optuna:  52%|█████▏    | 103/200 [3:09:03<3:49:26, 141.92s/it, best=0.832][A[I 2026-02-27 17:56:47,989] Trial 75 finished with value: 0.8052941261393066 and parameters: {'activation': 'tanh', 'solver': 'adam', 'lr': 3.231446586861234e-05, 'layer1': 145, 'layer2': 140, 'layer3': 62}. Best is trial 55 with value: 0.8076668303114959.

Escherichia_Coli | Ciprofloxacin | Optuna:  38%|███▊      | 76/200 [3:09:17<3:55:02, 113.73s/it, best=0.808][A
Escherichia_Coli | Ciprofloxacin | Optuna:  38%|███▊      | 76/200 [3:09:17<3:55:02, 113.73s/it, best=0.808][A[I 2026-02-27 17:57:03,486] Trial 171 finished with value: 0.8751930936053787 and parameters: {'activation': 'logistic', 'solver': 'adam', 'lr': 0.00033230396107956705, 'layer1': 325, 'layer2': 418, 'layer3': 448}. Best is trial 126 with value: 0.8764399491217574.

Pseudomonas_Aeruginosa | Ciprofloxacin | Optuna:  86%|████████▌ | 172/200 [3:09:33<36:43, 78.69s/it, best=0.876][A
Pseudomonas_Aeruginosa | Ciprofloxacin | Optuna:  86%|████████▌ | 172/200 [3:09:33<36:43, 78.69s/it, best=0.876][A[I 2026-02-27 17:57:11,065] Trial 85 finished with value: 0.9056984197882944 and parameters: {'activation': 'relu', 'solver': 'adam', 'lr': 6.014142600721147e-05, 'layer1': 217, 'layer2': 397, 'layer3': 393}. Best is trial 84 with value: 0.9099428178723615.

Staphylococcus_Aureus | Oxacillin | Optuna:  43%|████▎     | 86/200 [3:09:40<4:34:16, 144.36s/it, best=0.91][A
Staphylococcus_Aureus | Oxacillin | Optuna:  43%|████▎     | 86/200 [3:09:40<4:34:16, 144.36s/it, best=0.91][A[I 2026-02-27 17:58:23,360] Trial 172 finished with value: 0.8747304813431566 and parameters: {'activation': 'logistic', 'solver': 'adam', 'lr': 0.00030794684121304505, 'layer1': 305, 'layer2': 416, 'layer3': 438}. Best is trial 126 with value: 0.8764399491217574.

Pseudomonas_Aeruginosa | Ciprofloxacin | Optuna:  86%|████████▋ | 173/200 [3:10:53<35:34, 79.05s/it, best=0.876][A
Pseudomonas_Aeruginosa | Ciprofloxacin | Optuna:  86%|████████▋ | 173/200 [3:10:53<35:34, 79.05s/it, best=0.876][A[I 2026-02-27 17:58:39,026] Trial 76 finished with value: 0.7820246257768744 and parameters: {'activation': 'tanh', 'solver': 'adam', 'lr': 0.0034261849708848765, 'layer1': 106, 'layer2': 285, 'layer3': 86}. Best is trial 55 with value: 0.8076668303114959.

Escherichia_Coli | Ciprofloxacin | Optuna:  38%|███▊      | 77/200 [3:11:08<3:51:29, 112.92s/it, best=0.808][A
Escherichia_Coli | Ciprofloxacin | Optuna:  38%|███▊      | 77/200 [3:11:08<3:51:29, 112.92s/it, best=0.808][A[I 2026-02-27 17:59:01,261] Trial 103 finished with value: 0.8217854105006486 and parameters: {'activation': 'identity', 'solver': 'adam', 'lr': 3.6782171695281264e-05, 'layer1': 477, 'layer2': 370, 'layer3': 224}. Best is trial 91 with value: 0.8315336183309556.

Klebsiella_Pneumoniae | Ciprofloxacin | Optuna:  52%|█████▏    | 104/200 [3:11:30<3:49:41, 143.56s/it, best=0.832][A
Klebsiella_Pneumoniae | Ciprofloxacin | Optuna:  52%|█████▏    | 104/200 [3:11:30<3:49:41, 143.56s/it, best=0.832][A[I 2026-02-27 17:59:38,536] Trial 173 finished with value: 0.8726479386382191 and parameters: {'activation': 'logistic', 'solver': 'adam', 'lr': 0.0003108619688694973, 'layer1': 308, 'layer2': 418, 'layer3': 441}. Best is trial 126 with value: 0.8764399491217574.

Pseudomonas_Aeruginosa | Ciprofloxacin | Optuna:  87%|████████▋ | 174/200 [3:12:08<33:45, 77.88s/it, best=0.876][A
Pseudomonas_Aeruginosa | Ciprofloxacin | Optuna:  87%|████████▋ | 174/200 [3:12:08<33:45, 77.88s/it, best=0.876][A[I 2026-02-27 17:59:45,745] Trial 77 finished with value: 0.7924745780804954 and parameters: {'activation': 'tanh', 'solver': 'adam', 'lr': 0.00027940588743768517, 'layer1': 71, 'layer2': 315, 'layer3': 35}. Best is trial 55 with value: 0.8076668303114959.

Escherichia_Coli | Ciprofloxacin | Optuna:  39%|███▉      | 78/200 [3:12:15<3:21:25, 99.06s/it, best=0.808] [A
Escherichia_Coli | Ciprofloxacin | Optuna:  39%|███▉      | 78/200 [3:12:15<3:21:25, 99.06s/it, best=0.808][A[I 2026-02-27 18:00:11,657] Trial 86 finished with value: 0.9025757879222729 and parameters: {'activation': 'identity', 'solver': 'adam', 'lr': 2.264523499579697e-05, 'layer1': 274, 'layer2': 442, 'layer3': 362}. Best is trial 84 with value: 0.9099428178723615.

Staphylococcus_Aureus | Oxacillin | Optuna:  44%|████▎     | 87/200 [3:12:41<4:52:20, 155.23s/it, best=0.91][A
Staphylococcus_Aureus | Oxacillin | Optuna:  44%|████▎     | 87/200 [3:12:41<4:52:20, 155.23s/it, best=0.91][A[I 2026-02-27 18:00:52,175] Trial 174 finished with value: 0.8748461245817747 and parameters: {'activation': 'logistic', 'solver': 'adam', 'lr': 0.0004350148914966821, 'layer1': 323, 'layer2': 428, 'layer3': 451}. Best is trial 126 with value: 0.8764399491217574.

Pseudomonas_Aeruginosa | Ciprofloxacin | Optuna:  88%|████████▊ | 175/200 [3:13:21<31:55, 76.61s/it, best=0.876][A
Pseudomonas_Aeruginosa | Ciprofloxacin | Optuna:  88%|████████▊ | 175/200 [3:13:21<31:55, 76.61s/it, best=0.876][A[I 2026-02-27 18:00:56,651] Trial 104 finished with value: 0.8236629126267833 and parameters: {'activation': 'identity', 'solver': 'adam', 'lr': 0.00013425410817929383, 'layer1': 463, 'layer2': 394, 'layer3': 188}. Best is trial 91 with value: 0.8315336183309556.

Klebsiella_Pneumoniae | Ciprofloxacin | Optuna:  52%|█████▎    | 105/200 [3:13:26<3:33:55, 135.11s/it, best=0.832][A
Klebsiella_Pneumoniae | Ciprofloxacin | Optuna:  52%|█████▎    | 105/200 [3:13:26<3:33:55, 135.11s/it, best=0.832][A[I 2026-02-27 18:01:27,829] Trial 78 finished with value: 0.8032119917727055 and parameters: {'activation': 'relu', 'solver': 'adam', 'lr': 8.993601825488445e-05, 'layer1': 131, 'layer2': 339, 'layer3': 105}. Best is trial 55 with value: 0.8076668303114959.

Escherichia_Coli | Ciprofloxacin | Optuna:  40%|███▉      | 79/200 [3:13:57<3:21:36, 99.97s/it, best=0.808][A
Escherichia_Coli | Ciprofloxacin | Optuna:  40%|███▉      | 79/200 [3:13:57<3:21:36, 99.97s/it, best=0.808][A[I 2026-02-27 18:02:01,730] Trial 175 finished with value: 0.8700748023788106 and parameters: {'activation': 'logistic', 'solver': 'adam', 'lr': 0.0005249197724583556, 'layer1': 353, 'layer2': 426, 'layer3': 453}. Best is trial 126 with value: 0.8764399491217574.

Pseudomonas_Aeruginosa | Ciprofloxacin | Optuna:  88%|████████▊ | 176/200 [3:14:31<29:47, 74.49s/it, best=0.876][A
Pseudomonas_Aeruginosa | Ciprofloxacin | Optuna:  88%|████████▊ | 176/200 [3:14:31<29:47, 74.49s/it, best=0.876][A[I 2026-02-27 18:02:22,628] Trial 87 finished with value: 0.9075886442569991 and parameters: {'activation': 'identity', 'solver': 'adam', 'lr': 8.988798707884397e-05, 'layer1': 280, 'layer2': 366, 'layer3': 400}. Best is trial 84 with value: 0.9099428178723615.

Staphylococcus_Aureus | Oxacillin | Optuna:  44%|████▍     | 88/200 [3:14:52<4:36:10, 147.95s/it, best=0.91][A
Staphylococcus_Aureus | Oxacillin | Optuna:  44%|████▍     | 88/200 [3:14:52<4:36:10, 147.95s/it, best=0.91][A[I 2026-02-27 18:02:43,281] Trial 105 finished with value: 0.8186802453333797 and parameters: {'activation': 'identity', 'solver': 'adam', 'lr': 0.004371619859323935, 'layer1': 447, 'layer2': 452, 'layer3': 203}. Best is trial 91 with value: 0.8315336183309556.

Klebsiella_Pneumoniae | Ciprofloxacin | Optuna:  53%|█████▎    | 106/200 [3:15:12<3:18:17, 126.57s/it, best=0.832][A
Klebsiella_Pneumoniae | Ciprofloxacin | Optuna:  53%|█████▎    | 106/200 [3:15:12<3:18:17, 126.57s/it, best=0.832][A[I 2026-02-27 18:03:21,126] Trial 176 finished with value: 0.8744721600015934 and parameters: {'activation': 'logistic', 'solver': 'adam', 'lr': 0.00043131862940879763, 'layer1': 324, 'layer2': 439, 'layer3': 455}. Best is trial 126 with value: 0.8764399491217574.

Pseudomonas_Aeruginosa | Ciprofloxacin | Optuna:  88%|████████▊ | 177/200 [3:15:50<29:07, 75.96s/it, best=0.876][A
Pseudomonas_Aeruginosa | Ciprofloxacin | Optuna:  88%|████████▊ | 177/200 [3:15:50<29:07, 75.96s/it, best=0.876][A[I 2026-02-27 18:04:34,092] Trial 79 finished with value: 0.8075616470245256 and parameters: {'activation': 'tanh', 'solver': 'adam', 'lr': 2.0163455691620963e-05, 'layer1': 161, 'layer2': 233, 'layer3': 63}. Best is trial 55 with value: 0.8076668303114959.

Escherichia_Coli | Ciprofloxacin | Optuna:  40%|████      | 80/200 [3:17:03<4:11:42, 125.86s/it, best=0.808][A
Escherichia_Coli | Ciprofloxacin | Optuna:  40%|████      | 80/200 [3:17:03<4:11:42, 125.86s/it, best=0.808][A[I 2026-02-27 18:04:42,703] Trial 177 finished with value: 0.8740534203168069 and parameters: {'activation': 'logistic', 'solver': 'adam', 'lr': 0.00037357609597744813, 'layer1': 343, 'layer2': 420, 'layer3': 431}. Best is trial 126 with value: 0.8764399491217574.

Pseudomonas_Aeruginosa | Ciprofloxacin | Optuna:  89%|████████▉ | 178/200 [3:17:12<28:28, 77.65s/it, best=0.876][A
Pseudomonas_Aeruginosa | Ciprofloxacin | Optuna:  89%|████████▉ | 178/200 [3:17:12<28:28, 77.65s/it, best=0.876][A[I 2026-02-27 18:05:13,512] Trial 106 finished with value: 0.7848269048129682 and parameters: {'activation': 'tanh', 'solver': 'adam', 'lr': 4.664588502526511e-06, 'layer1': 250, 'layer2': 416, 'layer3': 140}. Best is trial 91 with value: 0.8315336183309556.

Klebsiella_Pneumoniae | Ciprofloxacin | Optuna:  54%|█████▎    | 107/200 [3:17:43<3:27:10, 133.67s/it, best=0.832][A
Klebsiella_Pneumoniae | Ciprofloxacin | Optuna:  54%|█████▎    | 107/200 [3:17:43<3:27:10, 133.67s/it, best=0.832][A[I 2026-02-27 18:05:46,362] Trial 178 finished with value: 0.8724949677326734 and parameters: {'activation': 'logistic', 'solver': 'adam', 'lr': 0.0005744381683933749, 'layer1': 316, 'layer2': 381, 'layer3': 439}. Best is trial 126 with value: 0.8764399491217574.

Pseudomonas_Aeruginosa | Ciprofloxacin | Optuna:  90%|████████▉ | 179/200 [3:18:16<25:42, 73.45s/it, best=0.876][A
Pseudomonas_Aeruginosa | Ciprofloxacin | Optuna:  90%|████████▉ | 179/200 [3:18:16<25:42, 73.45s/it, best=0.876][A[I 2026-02-27 18:06:18,105] Trial 80 finished with value: 0.8063839705359577 and parameters: {'activation': 'tanh', 'solver': 'adam', 'lr': 5.747325447714065e-05, 'layer1': 163, 'layer2': 249, 'layer3': 65}. Best is trial 55 with value: 0.8076668303114959.

Escherichia_Coli | Ciprofloxacin | Optuna:  40%|████      | 81/200 [3:18:47<3:56:37, 119.30s/it, best=0.808][A
Escherichia_Coli | Ciprofloxacin | Optuna:  40%|████      | 81/200 [3:18:47<3:56:37, 119.30s/it, best=0.808][A[I 2026-02-27 18:06:23,981] Trial 88 finished with value: 0.8984707592504375 and parameters: {'activation': 'logistic', 'solver': 'adam', 'lr': 3.893187097469312e-05, 'layer1': 253, 'layer2': 462, 'layer3': 332}. Best is trial 84 with value: 0.9099428178723615.

Staphylococcus_Aureus | Oxacillin | Optuna:  44%|████▍     | 89/200 [3:18:53<5:25:32, 175.97s/it, best=0.91][A
Staphylococcus_Aureus | Oxacillin | Optuna:  44%|████▍     | 89/200 [3:18:53<5:25:32, 175.97s/it, best=0.91][A[I 2026-02-27 18:07:02,479] Trial 179 finished with value: 0.8724084533831142 and parameters: {'activation': 'logistic', 'solver': 'adam', 'lr': 0.00022957765818209166, 'layer1': 301, 'layer2': 406, 'layer3': 463}. Best is trial 126 with value: 0.8764399491217574.

Pseudomonas_Aeruginosa | Ciprofloxacin | Optuna:  90%|█████████ | 180/200 [3:19:32<24:45, 74.25s/it, best=0.876][A
Pseudomonas_Aeruginosa | Ciprofloxacin | Optuna:  90%|█████████ | 180/200 [3:19:32<24:45, 74.25s/it, best=0.876][A[I 2026-02-27 18:07:17,418] Trial 107 finished with value: 0.813883444037409 and parameters: {'activation': 'relu', 'solver': 'adam', 'lr': 0.00261487296505153, 'layer1': 488, 'layer2': 471, 'layer3': 266}. Best is trial 91 with value: 0.8315336183309556.

Klebsiella_Pneumoniae | Ciprofloxacin | Optuna:  54%|█████▍    | 108/200 [3:19:46<3:20:27, 130.74s/it, best=0.832][A
Klebsiella_Pneumoniae | Ciprofloxacin | Optuna:  54%|█████▍    | 108/200 [3:19:46<3:20:27, 130.74s/it, best=0.832][A[I 2026-02-27 18:08:01,839] Trial 81 finished with value: 0.8076144316847087 and parameters: {'activation': 'tanh', 'solver': 'adam', 'lr': 6.437081320185977e-05, 'layer1': 160, 'layer2': 235, 'layer3': 69}. Best is trial 55 with value: 0.8076668303114959.

Escherichia_Coli | Ciprofloxacin | Optuna:  41%|████      | 82/200 [3:20:31<3:45:26, 114.63s/it, best=0.808][A
Escherichia_Coli | Ciprofloxacin | Optuna:  41%|████      | 82/200 [3:20:31<3:45:26, 114.63s/it, best=0.808][A[I 2026-02-27 18:08:14,353] Trial 180 finished with value: 0.8661279905426834 and parameters: {'activation': 'relu', 'solver': 'adam', 'lr': 0.000196083304806362, 'layer1': 330, 'layer2': 431, 'layer3': 448}. Best is trial 126 with value: 0.8764399491217574.

Pseudomonas_Aeruginosa | Ciprofloxacin | Optuna:  90%|█████████ | 181/200 [3:20:44<23:17, 73.54s/it, best=0.876][A
Pseudomonas_Aeruginosa | Ciprofloxacin | Optuna:  90%|█████████ | 181/200 [3:20:44<23:17, 73.54s/it, best=0.876][A[I 2026-02-27 18:08:59,156] Trial 89 finished with value: 0.9061414352235252 and parameters: {'activation': 'identity', 'solver': 'adam', 'lr': 5.099250897699633e-05, 'layer1': 300, 'layer2': 382, 'layer3': 419}. Best is trial 84 with value: 0.9099428178723615.

Staphylococcus_Aureus | Oxacillin | Optuna:  45%|████▌     | 90/200 [3:21:28<5:11:10, 169.73s/it, best=0.91][A
Staphylococcus_Aureus | Oxacillin | Optuna:  45%|████▌     | 90/200 [3:21:28<5:11:10, 169.73s/it, best=0.91][A[I 2026-02-27 18:09:25,565] Trial 108 finished with value: 0.812272699494966 and parameters: {'activation': 'identity', 'solver': 'adam', 'lr': 2.024052558774572e-05, 'layer1': 432, 'layer2': 436, 'layer3': 72}. Best is trial 91 with value: 0.8315336183309556.

Klebsiella_Pneumoniae | Ciprofloxacin | Optuna:  55%|█████▍    | 109/200 [3:21:55<3:17:06, 129.96s/it, best=0.832][A
Klebsiella_Pneumoniae | Ciprofloxacin | Optuna:  55%|█████▍    | 109/200 [3:21:55<3:17:06, 129.96s/it, best=0.832][A[I 2026-02-27 18:09:44,044] Trial 181 finished with value: 0.873829723103173 and parameters: {'activation': 'logistic', 'solver': 'adam', 'lr': 0.0003029669153349945, 'layer1': 306, 'layer2': 450, 'layer3': 426}. Best is trial 126 with value: 0.8764399491217574.

Pseudomonas_Aeruginosa | Ciprofloxacin | Optuna:  91%|█████████ | 182/200 [3:22:13<23:30, 78.38s/it, best=0.876][A
Pseudomonas_Aeruginosa | Ciprofloxacin | Optuna:  91%|█████████ | 182/200 [3:22:13<23:30, 78.38s/it, best=0.876][A[I 2026-02-27 18:10:26,845] Trial 90 finished with value: 0.9053360375810031 and parameters: {'activation': 'identity', 'solver': 'adam', 'lr': 0.0003188654630065559, 'layer1': 87, 'layer2': 412, 'layer3': 386}. Best is trial 84 with value: 0.9099428178723615.

Staphylococcus_Aureus | Oxacillin | Optuna:  46%|████▌     | 91/200 [3:22:56<4:23:38, 145.12s/it, best=0.91][A
Staphylococcus_Aureus | Oxacillin | Optuna:  46%|████▌     | 91/200 [3:22:56<4:23:38, 145.12s/it, best=0.91][A[I 2026-02-27 18:10:49,613] Trial 82 finished with value: 0.8025313193979959 and parameters: {'activation': 'tanh', 'solver': 'adam', 'lr': 2.0902201141273434e-05, 'layer1': 167, 'layer2': 231, 'layer3': 63}. Best is trial 55 with value: 0.8076668303114959.

Escherichia_Coli | Ciprofloxacin | Optuna:  42%|████▏     | 83/200 [3:23:18<4:14:37, 130.57s/it, best=0.808][A
Escherichia_Coli | Ciprofloxacin | Optuna:  42%|████▏     | 83/200 [3:23:18<4:14:37, 130.57s/it, best=0.808][A[I 2026-02-27 18:10:52,959] Trial 182 finished with value: 0.8741376243012826 and parameters: {'activation': 'logistic', 'solver': 'adam', 'lr': 0.00035939301601935046, 'layer1': 288, 'layer2': 462, 'layer3': 436}. Best is trial 126 with value: 0.8764399491217574.

Pseudomonas_Aeruginosa | Ciprofloxacin | Optuna:  92%|█████████▏| 183/200 [3:23:22<21:24, 75.54s/it, best=0.876][A
Pseudomonas_Aeruginosa | Ciprofloxacin | Optuna:  92%|█████████▏| 183/200 [3:23:22<21:24, 75.54s/it, best=0.876][A[I 2026-02-27 18:11:59,360] Trial 109 finished with value: 0.8146447105237831 and parameters: {'activation': 'identity', 'solver': 'adam', 'lr': 1.475187022333583e-05, 'layer1': 308, 'layer2': 411, 'layer3': 243}. Best is trial 91 with value: 0.8315336183309556.

Klebsiella_Pneumoniae | Ciprofloxacin | Optuna:  55%|█████▌    | 110/200 [3:24:28<3:25:39, 137.11s/it, best=0.832][A
Klebsiella_Pneumoniae | Ciprofloxacin | Optuna:  55%|█████▌    | 110/200 [3:24:28<3:25:39, 137.11s/it, best=0.832][A[I 2026-02-27 18:12:00,690] Trial 183 finished with value: 0.8721172809652072 and parameters: {'activation': 'logistic', 'solver': 'adam', 'lr': 0.0004412093717655869, 'layer1': 272, 'layer2': 443, 'layer3': 415}. Best is trial 126 with value: 0.8764399491217574.

Pseudomonas_Aeruginosa | Ciprofloxacin | Optuna:  92%|█████████▏| 184/200 [3:24:30<19:31, 73.20s/it, best=0.876][A
Pseudomonas_Aeruginosa | Ciprofloxacin | Optuna:  92%|█████████▏| 184/200 [3:24:30<19:31, 73.20s/it, best=0.876][A[I 2026-02-27 18:12:42,552] Trial 91 finished with value: 0.9081307804452431 and parameters: {'activation': 'identity', 'solver': 'adam', 'lr': 0.000505754812919892, 'layer1': 317, 'layer2': 409, 'layer3': 479}. Best is trial 84 with value: 0.9099428178723615.

Staphylococcus_Aureus | Oxacillin | Optuna:  46%|████▌     | 92/200 [3:25:12<4:16:07, 142.30s/it, best=0.91][A
Staphylococcus_Aureus | Oxacillin | Optuna:  46%|████▌     | 92/200 [3:25:12<4:16:07, 142.30s/it, best=0.91][A[I 2026-02-27 18:12:46,035] Trial 83 finished with value: 0.8031480909003242 and parameters: {'activation': 'tanh', 'solver': 'adam', 'lr': 5.875064692412433e-05, 'layer1': 185, 'layer2': 203, 'layer3': 46}. Best is trial 55 with value: 0.8076668303114959.

Escherichia_Coli | Ciprofloxacin | Optuna:  42%|████▏     | 84/200 [3:25:15<4:04:14, 126.33s/it, best=0.808][A
Escherichia_Coli | Ciprofloxacin | Optuna:  42%|████▏     | 84/200 [3:25:15<4:04:14, 126.33s/it, best=0.808][A[I 2026-02-27 18:13:18,036] Trial 110 finished with value: 0.8230810234727028 and parameters: {'activation': 'identity', 'solver': 'adam', 'lr': 0.0017145682698428146, 'layer1': 322, 'layer2': 459, 'layer3': 172}. Best is trial 91 with value: 0.8315336183309556.

Klebsiella_Pneumoniae | Ciprofloxacin | Optuna:  56%|█████▌    | 111/200 [3:25:47<2:57:22, 119.58s/it, best=0.832][A
Klebsiella_Pneumoniae | Ciprofloxacin | Optuna:  56%|█████▌    | 111/200 [3:25:47<2:57:22, 119.58s/it, best=0.832][A[I 2026-02-27 18:13:20,303] Trial 184 finished with value: 0.8744992619142724 and parameters: {'activation': 'logistic', 'solver': 'adam', 'lr': 0.00028780061102285075, 'layer1': 336, 'layer2': 457, 'layer3': 445}. Best is trial 126 with value: 0.8764399491217574.

Pseudomonas_Aeruginosa | Ciprofloxacin | Optuna:  92%|█████████▎| 185/200 [3:25:49<18:46, 75.12s/it, best=0.876][A
Pseudomonas_Aeruginosa | Ciprofloxacin | Optuna:  92%|█████████▎| 185/200 [3:25:49<18:46, 75.12s/it, best=0.876][A[I 2026-02-27 18:14:14,953] Trial 84 finished with value: 0.7994748818069021 and parameters: {'activation': 'tanh', 'solver': 'adam', 'lr': 0.00011803909547440925, 'layer1': 133, 'layer2': 240, 'layer3': 113}. Best is trial 55 with value: 0.8076668303114959.

Escherichia_Coli | Ciprofloxacin | Optuna:  42%|████▎     | 85/200 [3:26:44<3:40:37, 115.11s/it, best=0.808][A
Escherichia_Coli | Ciprofloxacin | Optuna:  42%|████▎     | 85/200 [3:26:44<3:40:37, 115.11s/it, best=0.808][A[I 2026-02-27 18:14:43,325] Trial 185 finished with value: 0.8727405153070855 and parameters: {'activation': 'logistic', 'solver': 'adam', 'lr': 0.000249292713999667, 'layer1': 317, 'layer2': 415, 'layer3': 461}. Best is trial 126 with value: 0.8764399491217574.

Pseudomonas_Aeruginosa | Ciprofloxacin | Optuna:  93%|█████████▎| 186/200 [3:27:13<18:04, 77.49s/it, best=0.876][A
