[I 2026-02-28 02:29:06,340] Trial 191 finished with value: 0.8505985874861886 and parameters: {'activation': 'logistic', 'solver': 'adam', 'lr': 0.00047805578507715315, 'layer1': 252, 'layer2': 40, 'layer3': 94}. Best is trial 156 with value: 0.8585541372555268.

Staphylococcus_Aureus | Clindamycin | Optuna:  96%|█████████▌| 192/200 [4:31:07<12:37, 94.65s/it, best=0.859][A
Staphylococcus_Aureus | Clindamycin | Optuna:  96%|█████████▌| 192/200 [4:31:07<12:37, 94.65s/it, best=0.859][A[I 2026-02-28 02:29:20,555] Trial 17 finished with value: 0.8521499575395243 and parameters: {'activation': 'identity', 'solver': 'adam', 'lr': 4.76034794439584e-05, 'layer1': 339, 'layer2': 424, 'layer3': 405}. Best is trial 13 with value: 0.865599468881024.
Pseudomonas_Aeruginosa | LPS | Optuna:   9%|▉         | 18/200 [24:22<5:04:44, 100.47s/it, best=0.866]Pseudomonas_Aeruginosa | LPS | Optuna:   9%|▉         | 18/200 [24:22<5:04:44, 100.47s/it, best=0.866]/export/usuarios01/egarroyo/MALDI_for_AMR_prediction/venv/lib/python3.13/site-packages/sklearn/model_selection/_split.py:813: UserWarning: The least populated class in y has only 4 members, which is less than n_splits=5.
  warnings.warn(
[I 2026-02-28 02:30:37,828] Trial 80 finished with value: 0.5710372160888408 and parameters: {'activation': 'tanh', 'solver': 'sgd', 'lr': 6.5048581358870515e-06, 'layer1': 474, 'layer2': 33, 'layer3': 238}. Best is trial 14 with value: 0.8971256036318559.

Escherichia_Coli | Ceftriaxone | Optuna:  40%|████      | 81/200 [3:20:39<7:53:32, 238.76s/it, best=0.897][A
Escherichia_Coli | Ceftriaxone | Optuna:  40%|████      | 81/200 [3:20:39<7:53:32, 238.76s/it, best=0.897][A[I 2026-02-28 02:30:46,832] Trial 171 finished with value: 0.9051281266220839 and parameters: {'activation': 'tanh', 'solver': 'adam', 'lr': 1.2838801829848896e-05, 'layer1': 295, 'layer2': 446, 'layer3': 421}. Best is trial 130 with value: 0.9107197512148748.

Klebsiella_Pneumoniae | Ceftriaxone | Optuna:  86%|████████▌ | 172/200 [5:40:08<1:13:40, 157.89s/it, best=0.911][A
Klebsiella_Pneumoniae | Ceftriaxone | Optuna:  86%|████████▌ | 172/200 [5:40:08<1:13:40, 157.89s/it, best=0.911][A[I 2026-02-28 02:30:52,206] Trial 192 finished with value: 0.8557973549598599 and parameters: {'activation': 'logistic', 'solver': 'adam', 'lr': 0.00045327546017044553, 'layer1': 234, 'layer2': 94, 'layer3': 99}. Best is trial 156 with value: 0.8585541372555268.

Staphylococcus_Aureus | Clindamycin | Optuna:  96%|█████████▋| 193/200 [4:32:53<11:26, 98.02s/it, best=0.859][A
Staphylococcus_Aureus | Clindamycin | Optuna:  96%|█████████▋| 193/200 [4:32:53<11:26, 98.02s/it, best=0.859][A[I 2026-02-28 02:30:54,069] Trial 18 finished with value: 0.8294497372277154 and parameters: {'activation': 'tanh', 'solver': 'sgd', 'lr': 0.0003893591888528581, 'layer1': 209, 'layer2': 373, 'layer3': 447}. Best is trial 13 with value: 0.865599468881024.
Pseudomonas_Aeruginosa | LPS | Optuna:  10%|▉         | 19/200 [25:56<4:56:46, 98.38s/it, best=0.866] Pseudomonas_Aeruginosa | LPS | Optuna:  10%|▉         | 19/200 [25:56<4:56:46, 98.38s/it, best=0.866]/export/usuarios01/egarroyo/MALDI_for_AMR_prediction/venv/lib/python3.13/site-packages/sklearn/model_selection/_split.py:813: UserWarning: The least populated class in y has only 4 members, which is less than n_splits=5.
  warnings.warn(
[I 2026-02-28 02:32:15,798] Trial 19 finished with value: 0.8525790416132173 and parameters: {'activation': 'logistic', 'solver': 'adam', 'lr': 0.0022811669873826347, 'layer1': 388, 'layer2': 478, 'layer3': 348}. Best is trial 13 with value: 0.865599468881024.
Pseudomonas_Aeruginosa | LPS | Optuna:  10%|█         | 20/200 [27:17<4:40:08, 93.38s/it, best=0.866]Pseudomonas_Aeruginosa | LPS | Optuna:  10%|█         | 20/200 [27:17<4:40:08, 93.38s/it, best=0.866]/export/usuarios01/egarroyo/MALDI_for_AMR_prediction/venv/lib/python3.13/site-packages/sklearn/model_selection/_split.py:813: UserWarning: The least populated class in y has only 4 members, which is less than n_splits=5.
  warnings.warn(
[I 2026-02-28 02:32:39,879] Trial 193 finished with value: 0.8300166160763898 and parameters: {'activation': 'logistic', 'solver': 'adam', 'lr': 0.00024320250386770036, 'layer1': 234, 'layer2': 100, 'layer3': 103}. Best is trial 156 with value: 0.8585541372555268.

Staphylococcus_Aureus | Clindamycin | Optuna:  97%|█████████▋| 194/200 [4:34:41<10:05, 100.91s/it, best=0.859][A
Staphylococcus_Aureus | Clindamycin | Optuna:  97%|█████████▋| 194/200 [4:34:41<10:05, 100.91s/it, best=0.859][A[I 2026-02-28 02:32:58,046] Trial 172 finished with value: 0.9065593505000205 and parameters: {'activation': 'tanh', 'solver': 'adam', 'lr': 2.2655924542481994e-05, 'layer1': 385, 'layer2': 468, 'layer3': 395}. Best is trial 130 with value: 0.9107197512148748.

Klebsiella_Pneumoniae | Ceftriaxone | Optuna:  86%|████████▋ | 173/200 [5:42:19<1:07:27, 149.89s/it, best=0.911][A
Klebsiella_Pneumoniae | Ceftriaxone | Optuna:  86%|████████▋ | 173/200 [5:42:19<1:07:27, 149.89s/it, best=0.911][A[I 2026-02-28 02:33:39,247] Trial 20 finished with value: 0.863222008202249 and parameters: {'activation': 'identity', 'solver': 'adam', 'lr': 0.00032834339413882426, 'layer1': 443, 'layer2': 119, 'layer3': 448}. Best is trial 13 with value: 0.865599468881024.
Pseudomonas_Aeruginosa | LPS | Optuna:  10%|█         | 21/200 [28:41<4:29:41, 90.40s/it, best=0.866]Pseudomonas_Aeruginosa | LPS | Optuna:  10%|█         | 21/200 [28:41<4:29:41, 90.40s/it, best=0.866]/export/usuarios01/egarroyo/MALDI_for_AMR_prediction/venv/lib/python3.13/site-packages/sklearn/model_selection/_split.py:813: UserWarning: The least populated class in y has only 4 members, which is less than n_splits=5.
  warnings.warn(
[I 2026-02-28 02:33:57,095] Trial 81 finished with value: 0.8919130802604052 and parameters: {'activation': 'relu', 'solver': 'adam', 'lr': 3.104150376837089e-05, 'layer1': 485, 'layer2': 79, 'layer3': 208}. Best is trial 14 with value: 0.8971256036318559.

Escherichia_Coli | Ceftriaxone | Optuna:  41%|████      | 82/200 [3:23:58<7:26:15, 226.91s/it, best=0.897][A
Escherichia_Coli | Ceftriaxone | Optuna:  41%|████      | 82/200 [3:23:58<7:26:15, 226.91s/it, best=0.897][A[I 2026-02-28 02:34:16,272] Trial 194 finished with value: 0.8533398225747035 and parameters: {'activation': 'logistic', 'solver': 'adam', 'lr': 0.0005403354903685478, 'layer1': 215, 'layer2': 90, 'layer3': 115}. Best is trial 156 with value: 0.8585541372555268.

Staphylococcus_Aureus | Clindamycin | Optuna:  98%|█████████▊| 195/200 [4:36:17<08:17, 99.56s/it, best=0.859] [A
Staphylococcus_Aureus | Clindamycin | Optuna:  98%|█████████▊| 195/200 [4:36:17<08:17, 99.56s/it, best=0.859][A[I 2026-02-28 02:35:14,711] Trial 173 finished with value: 0.9049136577862672 and parameters: {'activation': 'tanh', 'solver': 'adam', 'lr': 1.4540061518141296e-05, 'layer1': 271, 'layer2': 492, 'layer3': 412}. Best is trial 130 with value: 0.9107197512148748.

Klebsiella_Pneumoniae | Ceftriaxone | Optuna:  87%|████████▋ | 174/200 [5:44:36<1:03:13, 145.92s/it, best=0.911][A
Klebsiella_Pneumoniae | Ceftriaxone | Optuna:  87%|████████▋ | 174/200 [5:44:36<1:03:13, 145.92s/it, best=0.911][A[I 2026-02-28 02:35:41,882] Trial 21 finished with value: 0.8637592363322536 and parameters: {'activation': 'identity', 'solver': 'adam', 'lr': 9.493660778326981e-05, 'layer1': 489, 'layer2': 432, 'layer3': 398}. Best is trial 13 with value: 0.865599468881024.
Pseudomonas_Aeruginosa | LPS | Optuna:  11%|█         | 22/200 [30:43<4:56:53, 100.07s/it, best=0.866]Pseudomonas_Aeruginosa | LPS | Optuna:  11%|█         | 22/200 [30:43<4:56:53, 100.07s/it, best=0.866]/export/usuarios01/egarroyo/MALDI_for_AMR_prediction/venv/lib/python3.13/site-packages/sklearn/model_selection/_split.py:813: UserWarning: The least populated class in y has only 4 members, which is less than n_splits=5.
  warnings.warn(
[I 2026-02-28 02:36:04,685] Trial 82 finished with value: 0.8932730685708273 and parameters: {'activation': 'relu', 'solver': 'adam', 'lr': 0.00011460805353372187, 'layer1': 441, 'layer2': 97, 'layer3': 197}. Best is trial 14 with value: 0.8971256036318559.

Escherichia_Coli | Ceftriaxone | Optuna:  42%|████▏     | 83/200 [3:26:06<6:24:22, 197.11s/it, best=0.897][A
Escherichia_Coli | Ceftriaxone | Optuna:  42%|████▏     | 83/200 [3:26:06<6:24:22, 197.11s/it, best=0.897][A[I 2026-02-28 02:36:06,191] Trial 195 finished with value: 0.8411303971175222 and parameters: {'activation': 'logistic', 'solver': 'adam', 'lr': 0.00029661500749951215, 'layer1': 227, 'layer2': 52, 'layer3': 95}. Best is trial 156 with value: 0.8585541372555268.

Staphylococcus_Aureus | Clindamycin | Optuna:  98%|█████████▊| 196/200 [4:38:07<06:50, 102.67s/it, best=0.859][A
Staphylococcus_Aureus | Clindamycin | Optuna:  98%|█████████▊| 196/200 [4:38:07<06:50, 102.67s/it, best=0.859][A[I 2026-02-28 02:37:34,054] Trial 22 finished with value: 0.8607313227603864 and parameters: {'activation': 'identity', 'solver': 'adam', 'lr': 0.0001318459888199297, 'layer1': 470, 'layer2': 367, 'layer3': 450}. Best is trial 13 with value: 0.865599468881024.
Pseudomonas_Aeruginosa | LPS | Optuna:  12%|█▏        | 23/200 [32:36<5:05:55, 103.70s/it, best=0.866]Pseudomonas_Aeruginosa | LPS | Optuna:  12%|█▏        | 23/200 [32:36<5:05:55, 103.70s/it, best=0.866]/export/usuarios01/egarroyo/MALDI_for_AMR_prediction/venv/lib/python3.13/site-packages/sklearn/model_selection/_split.py:813: UserWarning: The least populated class in y has only 4 members, which is less than n_splits=5.
  warnings.warn(
[I 2026-02-28 02:37:37,926] Trial 174 finished with value: 0.9115644647823175 and parameters: {'activation': 'tanh', 'solver': 'adam', 'lr': 1.887929430821984e-05, 'layer1': 248, 'layer2': 457, 'layer3': 431}. Best is trial 174 with value: 0.9115644647823175.

Klebsiella_Pneumoniae | Ceftriaxone | Optuna:  88%|████████▊ | 175/200 [5:46:59<1:00:27, 145.11s/it, best=0.911][A
Klebsiella_Pneumoniae | Ceftriaxone | Optuna:  88%|████████▊ | 175/200 [5:46:59<1:00:27, 145.11s/it, best=0.912][A[I 2026-02-28 02:38:01,974] Trial 196 finished with value: 0.8545926165852054 and parameters: {'activation': 'logistic', 'solver': 'adam', 'lr': 0.0004234948446568535, 'layer1': 222, 'layer2': 71, 'layer3': 147}. Best is trial 156 with value: 0.8585541372555268.

Staphylococcus_Aureus | Clindamycin | Optuna:  98%|█████████▊| 197/200 [4:40:03<05:19, 106.60s/it, best=0.859][A
Staphylococcus_Aureus | Clindamycin | Optuna:  98%|█████████▊| 197/200 [4:40:03<05:19, 106.60s/it, best=0.859][A[I 2026-02-28 02:38:35,041] Trial 83 finished with value: 0.895994903958408 and parameters: {'activation': 'relu', 'solver': 'adam', 'lr': 5.360545094013282e-05, 'layer1': 466, 'layer2': 68, 'layer3': 223}. Best is trial 14 with value: 0.8971256036318559.

Escherichia_Coli | Ceftriaxone | Optuna:  42%|████▏     | 84/200 [3:28:36<5:53:58, 183.09s/it, best=0.897][A
Escherichia_Coli | Ceftriaxone | Optuna:  42%|████▏     | 84/200 [3:28:36<5:53:58, 183.09s/it, best=0.897][A[I 2026-02-28 02:39:04,056] Trial 23 finished with value: 0.847498962535855 and parameters: {'activation': 'identity', 'solver': 'adam', 'lr': 3.955292386203551e-05, 'layer1': 315, 'layer2': 412, 'layer3': 306}. Best is trial 13 with value: 0.865599468881024.
Pseudomonas_Aeruginosa | LPS | Optuna:  12%|█▏        | 24/200 [34:06<4:52:08, 99.59s/it, best=0.866] Pseudomonas_Aeruginosa | LPS | Optuna:  12%|█▏        | 24/200 [34:06<4:52:08, 99.59s/it, best=0.866]/export/usuarios01/egarroyo/MALDI_for_AMR_prediction/venv/lib/python3.13/site-packages/sklearn/model_selection/_split.py:813: UserWarning: The least populated class in y has only 4 members, which is less than n_splits=5.
  warnings.warn(
[I 2026-02-28 02:39:26,109] Trial 175 finished with value: 0.9052285770813457 and parameters: {'activation': 'tanh', 'solver': 'adam', 'lr': 3.1369763576145134e-05, 'layer1': 255, 'layer2': 480, 'layer3': 433}. Best is trial 174 with value: 0.9115644647823175.

Klebsiella_Pneumoniae | Ceftriaxone | Optuna:  88%|████████▊ | 176/200 [5:48:47<53:36, 134.03s/it, best=0.912]  [A
Klebsiella_Pneumoniae | Ceftriaxone | Optuna:  88%|████████▊ | 176/200 [5:48:47<53:36, 134.03s/it, best=0.912][A[I 2026-02-28 02:39:37,471] Trial 197 finished with value: 0.8510252396027373 and parameters: {'activation': 'logistic', 'solver': 'adam', 'lr': 0.0007138714189560924, 'layer1': 241, 'layer2': 477, 'layer3': 107}. Best is trial 156 with value: 0.8585541372555268.

Staphylococcus_Aureus | Clindamycin | Optuna:  99%|█████████▉| 198/200 [4:41:39<03:26, 103.27s/it, best=0.859][A
Staphylococcus_Aureus | Clindamycin | Optuna:  99%|█████████▉| 198/200 [4:41:39<03:26, 103.27s/it, best=0.859][A[I 2026-02-28 02:40:01,650] Trial 198 finished with value: 0.7888558471217525 and parameters: {'activation': 'logistic', 'solver': 'adam', 'lr': 0.000350462558690053, 'layer1': 50, 'layer2': 34, 'layer3': 126}. Best is trial 156 with value: 0.8585541372555268.

Staphylococcus_Aureus | Clindamycin | Optuna: 100%|█████████▉| 199/200 [4:42:03<01:19, 79.54s/it, best=0.859] [A
Staphylococcus_Aureus | Clindamycin | Optuna: 100%|█████████▉| 199/200 [4:42:03<01:19, 79.54s/it, best=0.859][A[I 2026-02-28 02:40:25,360] Trial 199 finished with value: 0.7888558471217525 and parameters: {'activation': 'logistic', 'solver': 'sgd', 'lr': 0.0005619835805753989, 'layer1': 232, 'layer2': 14, 'layer3': 67}. Best is trial 156 with value: 0.8585541372555268.

Staphylococcus_Aureus | Clindamycin | Optuna: 100%|██████████| 200/200 [4:42:27<00:00, 62.79s/it, best=0.859][A
Staphylococcus_Aureus | Clindamycin | Optuna: 100%|██████████| 200/200 [4:42:27<00:00, 62.79s/it, best=0.859][A
                                                                                                             [A[Staphylococcus_Aureus | Clindamycin] [OPTUNA DONE] Best CV WF1=0.8586 | params={'activation': 'logistic', 'solver': 'adam', 'lr': 0.0004700352761504984, 'layer1': 141, 'layer2': 44, 'layer3': 94}
[Staphylococcus_Aureus | Clindamycin] Retraining with validation early stopping (10% split)...
[I 2026-02-28 02:40:32,733] Trial 24 finished with value: 0.8660481873616398 and parameters: {'activation': 'identity', 'solver': 'adam', 'lr': 0.00021747225779089805, 'layer1': 408, 'layer2': 331, 'layer3': 374}. Best is trial 24 with value: 0.8660481873616398.
Pseudomonas_Aeruginosa | LPS | Optuna:  12%|█▎        | 25/200 [35:34<4:40:55, 96.32s/it, best=0.866]Pseudomonas_Aeruginosa | LPS | Optuna:  12%|█▎        | 25/200 [35:34<4:40:55, 96.32s/it, best=0.866]/export/usuarios01/egarroyo/MALDI_for_AMR_prediction/venv/lib/python3.13/site-packages/sklearn/model_selection/_split.py:813: UserWarning: The least populated class in y has only 4 members, which is less than n_splits=5.
  warnings.warn(
[Staphylococcus_Aureus | Clindamycin] [TEST] WF1=0.8441 | ACC=0.8413 | HL=0.1587 | best_val_WF1=0.8610
Staphylococcus_Aureus | Binary antibiotics:  67%|██████▋   | 2/3 [11:53:20<5:43:38, 20618.88s/it]
[Staphylococcus_Aureus | Fusidic acid] Optuna search starting... (trials=200, cv=5)
[I 2026-02-28 02:40:50,822] A new study created in memory with name: no-name-ebec6e46-33f6-4cfa-b256-1187ba505339

Staphylococcus_Aureus | Fusidic acid | Optuna:   0%|          | 0/200 [00:00<?, ?it/s][A[I 2026-02-28 02:41:26,627] Trial 0 finished with value: 0.5462239846296895 and parameters: {'activation': 'logistic', 'solver': 'sgd', 'lr': 1.7073967431528114e-06, 'layer1': 435, 'layer2': 305, 'layer3': 357}. Best is trial 0 with value: 0.5462239846296895.

Staphylococcus_Aureus | Fusidic acid | Optuna:   0%|          | 1/200 [00:35<1:58:44, 35.80s/it][A
Staphylococcus_Aureus | Fusidic acid | Optuna:   0%|          | 1/200 [00:35<1:58:44, 35.80s/it, best=0.546][A[I 2026-02-28 02:41:42,068] Trial 176 finished with value: 0.9079237911769894 and parameters: {'activation': 'tanh', 'solver': 'adam', 'lr': 1.9024028197672715e-05, 'layer1': 242, 'layer2': 454, 'layer3': 406}. Best is trial 174 with value: 0.9115644647823175.

Klebsiella_Pneumoniae | Ceftriaxone | Optuna:  88%|████████▊ | 177/200 [5:51:03<51:36, 134.61s/it, best=0.912][A
Klebsiella_Pneumoniae | Ceftriaxone | Optuna:  88%|████████▊ | 177/200 [5:51:03<51:36, 134.61s/it, best=0.912][A[I 2026-02-28 02:41:52,873] Trial 84 finished with value: 0.8940255118225648 and parameters: {'activation': 'relu', 'solver': 'adam', 'lr': 2.533211949025051e-05, 'layer1': 468, 'layer2': 120, 'layer3': 229}. Best is trial 14 with value: 0.8971256036318559.

Escherichia_Coli | Ceftriaxone | Optuna:  42%|████▎     | 85/200 [3:31:54<5:59:23, 187.51s/it, best=0.897][A
Escherichia_Coli | Ceftriaxone | Optuna:  42%|████▎     | 85/200 [3:31:54<5:59:23, 187.51s/it, best=0.897][A[I 2026-02-28 02:42:03,587] Trial 1 finished with value: 0.9050666137971211 and parameters: {'activation': 'logistic', 'solver': 'adam', 'lr': 1.6480446427978994e-05, 'layer1': 267, 'layer2': 222, 'layer3': 152}. Best is trial 1 with value: 0.9050666137971211.

Staphylococcus_Aureus | Fusidic acid | Optuna:   1%|          | 2/200 [01:12<2:00:23, 36.48s/it, best=0.546][A
Staphylococcus_Aureus | Fusidic acid | Optuna:   1%|          | 2/200 [01:12<2:00:23, 36.48s/it, best=0.905][A[I 2026-02-28 02:42:18,590] Trial 25 finished with value: 0.867275854165397 and parameters: {'activation': 'identity', 'solver': 'adam', 'lr': 0.0005888945514033575, 'layer1': 397, 'layer2': 335, 'layer3': 364}. Best is trial 25 with value: 0.867275854165397.
Pseudomonas_Aeruginosa | LPS | Optuna:  13%|█▎        | 26/200 [37:20<4:47:37, 99.18s/it, best=0.866]Pseudomonas_Aeruginosa | LPS | Optuna:  13%|█▎        | 26/200 [37:20<4:47:37, 99.18s/it, best=0.867]/export/usuarios01/egarroyo/MALDI_for_AMR_prediction/venv/lib/python3.13/site-packages/sklearn/model_selection/_split.py:813: UserWarning: The least populated class in y has only 4 members, which is less than n_splits=5.
  warnings.warn(
[I 2026-02-28 02:43:11,916] Trial 26 finished with value: 0.8292251206191837 and parameters: {'activation': 'identity', 'solver': 'sgd', 'lr': 0.00022110337531066295, 'layer1': 398, 'layer2': 238, 'layer3': 360}. Best is trial 25 with value: 0.867275854165397.
Pseudomonas_Aeruginosa | LPS | Optuna:  14%|█▎        | 27/200 [38:13<4:06:18, 85.42s/it, best=0.867]Pseudomonas_Aeruginosa | LPS | Optuna:  14%|█▎        | 27/200 [38:13<4:06:18, 85.42s/it, best=0.867]/export/usuarios01/egarroyo/MALDI_for_AMR_prediction/venv/lib/python3.13/site-packages/sklearn/model_selection/_split.py:813: UserWarning: The least populated class in y has only 4 members, which is less than n_splits=5.
  warnings.warn(
[I 2026-02-28 02:43:36,279] Trial 2 finished with value: 0.9098413340470424 and parameters: {'activation': 'identity', 'solver': 'adam', 'lr': 6.290644294586145e-06, 'layer1': 262, 'layer2': 300, 'layer3': 32}. Best is trial 2 with value: 0.9098413340470424.

Staphylococcus_Aureus | Fusidic acid | Optuna:   2%|▏         | 3/200 [02:45<3:24:03, 62.15s/it, best=0.905][A
Staphylococcus_Aureus | Fusidic acid | Optuna:   2%|▏         | 3/200 [02:45<3:24:03, 62.15s/it, best=0.91] [A[I 2026-02-28 02:44:15,325] Trial 27 finished with value: 0.8551386534487403 and parameters: {'activation': 'tanh', 'solver': 'adam', 'lr': 0.0007498219215595536, 'layer1': 422, 'layer2': 331, 'layer3': 267}. Best is trial 25 with value: 0.867275854165397.
Pseudomonas_Aeruginosa | LPS | Optuna:  14%|█▍        | 28/200 [39:17<3:45:56, 78.82s/it, best=0.867]Pseudomonas_Aeruginosa | LPS | Optuna:  14%|█▍        | 28/200 [39:17<3:45:56, 78.82s/it, best=0.867]/export/usuarios01/egarroyo/MALDI_for_AMR_prediction/venv/lib/python3.13/site-packages/sklearn/model_selection/_split.py:813: UserWarning: The least populated class in y has only 4 members, which is less than n_splits=5.
  warnings.warn(
[I 2026-02-28 02:44:24,630] Trial 177 finished with value: 0.9055349089418122 and parameters: {'activation': 'tanh', 'solver': 'adam', 'lr': 1.1102145873802985e-05, 'layer1': 246, 'layer2': 459, 'layer3': 407}. Best is trial 174 with value: 0.9115644647823175.

Klebsiella_Pneumoniae | Ceftriaxone | Optuna:  89%|████████▉ | 178/200 [5:53:46<52:25, 143.00s/it, best=0.912][A
Klebsiella_Pneumoniae | Ceftriaxone | Optuna:  89%|████████▉ | 178/200 [5:53:46<52:25, 143.00s/it, best=0.912][A[I 2026-02-28 02:44:26,753] Trial 85 finished with value: 0.8940793144252016 and parameters: {'activation': 'relu', 'solver': 'adam', 'lr': 7.683479287428487e-05, 'layer1': 452, 'layer2': 75, 'layer3': 294}. Best is trial 14 with value: 0.8971256036318559.

Escherichia_Coli | Ceftriaxone | Optuna:  43%|████▎     | 86/200 [3:34:28<5:37:06, 177.42s/it, best=0.897][A
Escherichia_Coli | Ceftriaxone | Optuna:  43%|████▎     | 86/200 [3:34:28<5:37:06, 177.42s/it, best=0.897][A[I 2026-02-28 02:45:05,237] Trial 3 finished with value: 0.9053533750725735 and parameters: {'activation': 'relu', 'solver': 'sgd', 'lr': 1.6536937182824424e-05, 'layer1': 57, 'layer2': 345, 'layer3': 226}. Best is trial 2 with value: 0.9098413340470424.

Staphylococcus_Aureus | Fusidic acid | Optuna:   2%|▏         | 4/200 [04:14<3:57:35, 72.73s/it, best=0.91][A
