Klebsiella_Pneumoniae | LPS | Optuna:  74%|███████▍  | 149/200 [3:37:19<56:03, 65.94s/it, best=0.926]Klebsiella_Pneumoniae | LPS | Optuna:  74%|███████▍  | 149/200 [3:37:19<56:03, 65.94s/it, best=0.926][I 2026-02-28 12:25:23,216] Trial 184 finished with value: 0.8628111728847363 and parameters: {'activation': 'identity', 'solver': 'adam', 'lr': 4.2593900651126504e-05, 'layer1': 430, 'layer2': 326, 'layer3': 188}. Best is trial 155 with value: 0.8677633336625616.
Pseudomonas_Aeruginosa | DirectMulti | Optuna:  92%|█████████▎| 185/200 [5:29:09<28:15, 113.06s/it, best=0.868]Pseudomonas_Aeruginosa | DirectMulti | Optuna:  92%|█████████▎| 185/200 [5:29:09<28:15, 113.06s/it, best=0.868]/export/usuarios01/egarroyo/MALDI_for_AMR_prediction/venv/lib/python3.13/site-packages/sklearn/model_selection/_split.py:813: UserWarning: The least populated class in y has only 4 members, which is less than n_splits=5.
  warnings.warn(
[I 2026-02-28 12:26:01,443] Trial 149 finished with value: 0.9235522630463514 and parameters: {'activation': 'identity', 'solver': 'adam', 'lr': 0.0006209394424114812, 'layer1': 61, 'layer2': 448, 'layer3': 21}. Best is trial 71 with value: 0.9257111996592865.
Klebsiella_Pneumoniae | LPS | Optuna:  75%|███████▌  | 150/200 [3:38:17<53:04, 63.70s/it, best=0.926]Klebsiella_Pneumoniae | LPS | Optuna:  75%|███████▌  | 150/200 [3:38:17<53:04, 63.70s/it, best=0.926][I 2026-02-28 12:26:27,429] Trial 117 finished with value: 0.8790271323975798 and parameters: {'activation': 'identity', 'solver': 'adam', 'lr': 5.8190996704526655e-05, 'layer1': 37, 'layer2': 404, 'layer3': 417}. Best is trial 8 with value: 0.8879562150966016.
Staphylococcus_Aureus | LPS | Optuna:  59%|█████▉    | 118/200 [4:20:13<2:27:31, 107.95s/it, best=0.888]Staphylococcus_Aureus | LPS | Optuna:  59%|█████▉    | 118/200 [4:20:13<2:27:31, 107.95s/it, best=0.888][I 2026-02-28 12:26:31,006] Trial 123 finished with value: 0.9132065313905503 and parameters: {'activation': 'relu', 'solver': 'adam', 'lr': 5.112995327167426e-05, 'layer1': 291, 'layer2': 375, 'layer3': 307}. Best is trial 74 with value: 0.9166002918687234.

Escherichia_Coli | Piperacillin-Tazobactam | Optuna:  62%|██████▏   | 124/200 [4:22:23<2:47:27, 132.21s/it, best=0.917][A
Escherichia_Coli | Piperacillin-Tazobactam | Optuna:  62%|██████▏   | 124/200 [4:22:23<2:47:27, 132.21s/it, best=0.917][A[I 2026-02-28 12:26:59,838] Trial 150 finished with value: 0.9240974498375991 and parameters: {'activation': 'identity', 'solver': 'adam', 'lr': 0.00019327095113379718, 'layer1': 38, 'layer2': 411, 'layer3': 34}. Best is trial 71 with value: 0.9257111996592865.
Klebsiella_Pneumoniae | LPS | Optuna:  76%|███████▌  | 151/200 [3:39:15<50:43, 62.11s/it, best=0.926]Klebsiella_Pneumoniae | LPS | Optuna:  76%|███████▌  | 151/200 [3:39:15<50:43, 62.11s/it, best=0.926][I 2026-02-28 12:27:22,120] Trial 185 finished with value: 0.864739087584503 and parameters: {'activation': 'identity', 'solver': 'adam', 'lr': 5.189449434852447e-05, 'layer1': 341, 'layer2': 358, 'layer3': 158}. Best is trial 155 with value: 0.8677633336625616.
Pseudomonas_Aeruginosa | DirectMulti | Optuna:  93%|█████████▎| 186/200 [5:31:08<26:47, 114.81s/it, best=0.868]Pseudomonas_Aeruginosa | DirectMulti | Optuna:  93%|█████████▎| 186/200 [5:31:08<26:47, 114.81s/it, best=0.868]/export/usuarios01/egarroyo/MALDI_for_AMR_prediction/venv/lib/python3.13/site-packages/sklearn/model_selection/_split.py:813: UserWarning: The least populated class in y has only 4 members, which is less than n_splits=5.
  warnings.warn(
[I 2026-02-28 12:27:48,193] Trial 124 finished with value: 0.8995603874655382 and parameters: {'activation': 'logistic', 'solver': 'adam', 'lr': 0.000247714295902332, 'layer1': 395, 'layer2': 286, 'layer3': 120}. Best is trial 74 with value: 0.9166002918687234.

Escherichia_Coli | Piperacillin-Tazobactam | Optuna:  62%|██████▎   | 125/200 [4:23:40<2:24:37, 115.70s/it, best=0.917][A
Escherichia_Coli | Piperacillin-Tazobactam | Optuna:  62%|██████▎   | 125/200 [4:23:40<2:24:37, 115.70s/it, best=0.917][A[I 2026-02-28 12:28:19,635] Trial 151 finished with value: 0.9225216610732131 and parameters: {'activation': 'identity', 'solver': 'adam', 'lr': 0.00045649341061470194, 'layer1': 379, 'layer2': 499, 'layer3': 48}. Best is trial 71 with value: 0.9257111996592865.
Klebsiella_Pneumoniae | LPS | Optuna:  76%|███████▌  | 152/200 [3:40:35<53:55, 67.41s/it, best=0.926]Klebsiella_Pneumoniae | LPS | Optuna:  76%|███████▌  | 152/200 [3:40:35<53:55, 67.41s/it, best=0.926][I 2026-02-28 12:28:24,221] Trial 118 finished with value: 0.8857744972532509 and parameters: {'activation': 'identity', 'solver': 'adam', 'lr': 0.00014295945377795652, 'layer1': 120, 'layer2': 460, 'layer3': 344}. Best is trial 8 with value: 0.8879562150966016.
Staphylococcus_Aureus | LPS | Optuna:  60%|█████▉    | 119/200 [4:22:10<2:29:18, 110.60s/it, best=0.888]Staphylococcus_Aureus | LPS | Optuna:  60%|█████▉    | 119/200 [4:22:10<2:29:18, 110.60s/it, best=0.888][I 2026-02-28 12:28:53,011] Trial 186 finished with value: 0.8616050942164739 and parameters: {'activation': 'identity', 'solver': 'adam', 'lr': 0.0003076595613477531, 'layer1': 441, 'layer2': 340, 'layer3': 178}. Best is trial 155 with value: 0.8677633336625616.
Pseudomonas_Aeruginosa | DirectMulti | Optuna:  94%|█████████▎| 187/200 [5:32:39<23:19, 107.64s/it, best=0.868]Pseudomonas_Aeruginosa | DirectMulti | Optuna:  94%|█████████▎| 187/200 [5:32:39<23:19, 107.64s/it, best=0.868]/export/usuarios01/egarroyo/MALDI_for_AMR_prediction/venv/lib/python3.13/site-packages/sklearn/model_selection/_split.py:813: UserWarning: The least populated class in y has only 4 members, which is less than n_splits=5.
  warnings.warn(
[I 2026-02-28 12:29:38,464] Trial 152 finished with value: 0.9242070101748023 and parameters: {'activation': 'identity', 'solver': 'adam', 'lr': 0.00025278384744932764, 'layer1': 74, 'layer2': 429, 'layer3': 74}. Best is trial 71 with value: 0.9257111996592865.
Klebsiella_Pneumoniae | LPS | Optuna:  76%|███████▋  | 153/200 [3:41:54<55:29, 70.84s/it, best=0.926]Klebsiella_Pneumoniae | LPS | Optuna:  76%|███████▋  | 153/200 [3:41:54<55:29, 70.84s/it, best=0.926][I 2026-02-28 12:30:20,987] Trial 125 finished with value: 0.9146539722066102 and parameters: {'activation': 'relu', 'solver': 'adam', 'lr': 0.00038379505083469597, 'layer1': 420, 'layer2': 151, 'layer3': 381}. Best is trial 74 with value: 0.9166002918687234.

Escherichia_Coli | Piperacillin-Tazobactam | Optuna:  63%|██████▎   | 126/200 [4:26:13<2:36:25, 126.83s/it, best=0.917][A
Escherichia_Coli | Piperacillin-Tazobactam | Optuna:  63%|██████▎   | 126/200 [4:26:13<2:36:25, 126.83s/it, best=0.917][A[I 2026-02-28 12:30:33,178] Trial 119 finished with value: 0.8852006708620636 and parameters: {'activation': 'identity', 'solver': 'adam', 'lr': 0.0004532448787462531, 'layer1': 267, 'layer2': 393, 'layer3': 360}. Best is trial 8 with value: 0.8879562150966016.
Staphylococcus_Aureus | LPS | Optuna:  60%|██████    | 120/200 [4:24:19<2:34:48, 116.11s/it, best=0.888]Staphylococcus_Aureus | LPS | Optuna:  60%|██████    | 120/200 [4:24:19<2:34:48, 116.11s/it, best=0.888][I 2026-02-28 12:30:40,176] Trial 153 finished with value: 0.9248338159001619 and parameters: {'activation': 'identity', 'solver': 'adam', 'lr': 0.00040834747391995573, 'layer1': 31, 'layer2': 439, 'layer3': 62}. Best is trial 71 with value: 0.9257111996592865.
Klebsiella_Pneumoniae | LPS | Optuna:  77%|███████▋  | 154/200 [3:42:56<52:12, 68.10s/it, best=0.926]Klebsiella_Pneumoniae | LPS | Optuna:  77%|███████▋  | 154/200 [3:42:56<52:12, 68.10s/it, best=0.926][I 2026-02-28 12:31:31,446] Trial 187 finished with value: 0.867960593593898 and parameters: {'activation': 'identity', 'solver': 'adam', 'lr': 3.812366426519962e-05, 'layer1': 446, 'layer2': 350, 'layer3': 198}. Best is trial 187 with value: 0.867960593593898.
Pseudomonas_Aeruginosa | DirectMulti | Optuna:  94%|█████████▍| 188/200 [5:35:17<24:34, 122.88s/it, best=0.868]Pseudomonas_Aeruginosa | DirectMulti | Optuna:  94%|█████████▍| 188/200 [5:35:17<24:34, 122.88s/it, best=0.868]/export/usuarios01/egarroyo/MALDI_for_AMR_prediction/venv/lib/python3.13/site-packages/sklearn/model_selection/_split.py:813: UserWarning: The least populated class in y has only 4 members, which is less than n_splits=5.
  warnings.warn(
[I 2026-02-28 12:31:54,389] Trial 154 finished with value: 0.9236525142012469 and parameters: {'activation': 'identity', 'solver': 'adam', 'lr': 0.00031332075935164516, 'layer1': 35, 'layer2': 463, 'layer3': 67}. Best is trial 71 with value: 0.9257111996592865.
Klebsiella_Pneumoniae | LPS | Optuna:  78%|███████▊  | 155/200 [3:44:10<52:27, 69.93s/it, best=0.926]Klebsiella_Pneumoniae | LPS | Optuna:  78%|███████▊  | 155/200 [3:44:10<52:27, 69.93s/it, best=0.926][I 2026-02-28 12:33:07,777] Trial 155 finished with value: 0.9248128596968572 and parameters: {'activation': 'identity', 'solver': 'adam', 'lr': 0.0009518354753976558, 'layer1': 51, 'layer2': 439, 'layer3': 57}. Best is trial 71 with value: 0.9257111996592865.
Klebsiella_Pneumoniae | LPS | Optuna:  78%|███████▊  | 156/200 [3:45:23<52:02, 70.97s/it, best=0.926]Klebsiella_Pneumoniae | LPS | Optuna:  78%|███████▊  | 156/200 [3:45:23<52:02, 70.97s/it, best=0.926][I 2026-02-28 12:33:17,876] Trial 126 finished with value: 0.9141357204045493 and parameters: {'activation': 'relu', 'solver': 'adam', 'lr': 0.0009658315508761099, 'layer1': 436, 'layer2': 320, 'layer3': 151}. Best is trial 74 with value: 0.9166002918687234.

Escherichia_Coli | Piperacillin-Tazobactam | Optuna:  64%|██████▎   | 127/200 [4:29:10<2:52:34, 141.85s/it, best=0.917][A
Escherichia_Coli | Piperacillin-Tazobactam | Optuna:  64%|██████▎   | 127/200 [4:29:10<2:52:34, 141.85s/it, best=0.917][A[I 2026-02-28 12:33:20,412] Trial 120 finished with value: 0.886118099477082 and parameters: {'activation': 'identity', 'solver': 'adam', 'lr': 0.00010921039270567746, 'layer1': 396, 'layer2': 330, 'layer3': 221}. Best is trial 8 with value: 0.8879562150966016.
Staphylococcus_Aureus | LPS | Optuna:  60%|██████    | 121/200 [4:27:06<2:53:04, 131.45s/it, best=0.888]Staphylococcus_Aureus | LPS | Optuna:  60%|██████    | 121/200 [4:27:06<2:53:04, 131.45s/it, best=0.888][I 2026-02-28 12:33:39,914] Trial 188 finished with value: 0.8581512795015833 and parameters: {'activation': 'identity', 'solver': 'adam', 'lr': 3.942851143716175e-05, 'layer1': 449, 'layer2': 331, 'layer3': 224}. Best is trial 187 with value: 0.867960593593898.
Pseudomonas_Aeruginosa | DirectMulti | Optuna:  94%|█████████▍| 189/200 [5:37:26<22:50, 124.55s/it, best=0.868]Pseudomonas_Aeruginosa | DirectMulti | Optuna:  94%|█████████▍| 189/200 [5:37:26<22:50, 124.55s/it, best=0.868]/export/usuarios01/egarroyo/MALDI_for_AMR_prediction/venv/lib/python3.13/site-packages/sklearn/model_selection/_split.py:813: UserWarning: The least populated class in y has only 4 members, which is less than n_splits=5.
  warnings.warn(
[I 2026-02-28 12:34:22,481] Trial 156 finished with value: 0.9236672761746284 and parameters: {'activation': 'identity', 'solver': 'adam', 'lr': 0.00013317680902542978, 'layer1': 29, 'layer2': 440, 'layer3': 53}. Best is trial 71 with value: 0.9257111996592865.
Klebsiella_Pneumoniae | LPS | Optuna:  78%|███████▊  | 157/200 [3:46:38<51:39, 72.09s/it, best=0.926]Klebsiella_Pneumoniae | LPS | Optuna:  78%|███████▊  | 157/200 [3:46:38<51:39, 72.09s/it, best=0.926][I 2026-02-28 12:34:48,529] Trial 127 finished with value: 0.9023498597659213 and parameters: {'activation': 'identity', 'solver': 'adam', 'lr': 1.9056744074650573e-05, 'layer1': 250, 'layer2': 260, 'layer3': 27}. Best is trial 74 with value: 0.9166002918687234.

Escherichia_Coli | Piperacillin-Tazobactam | Optuna:  64%|██████▍   | 128/200 [4:30:41<2:31:47, 126.49s/it, best=0.917][A
Escherichia_Coli | Piperacillin-Tazobactam | Optuna:  64%|██████▍   | 128/200 [4:30:41<2:31:47, 126.49s/it, best=0.917][A[I 2026-02-28 12:35:34,213] Trial 121 finished with value: 0.8876801635132157 and parameters: {'activation': 'identity', 'solver': 'adam', 'lr': 0.0002760207260897148, 'layer1': 299, 'layer2': 118, 'layer3': 315}. Best is trial 8 with value: 0.8879562150966016.
Staphylococcus_Aureus | LPS | Optuna:  61%|██████    | 122/200 [4:29:20<2:51:47, 132.15s/it, best=0.888]Staphylococcus_Aureus | LPS | Optuna:  61%|██████    | 122/200 [4:29:20<2:51:47, 132.15s/it, best=0.888][I 2026-02-28 12:35:59,586] Trial 189 finished with value: 0.8633339920974361 and parameters: {'activation': 'identity', 'solver': 'adam', 'lr': 3.717248418777719e-05, 'layer1': 437, 'layer2': 350, 'layer3': 201}. Best is trial 187 with value: 0.867960593593898.
Pseudomonas_Aeruginosa | DirectMulti | Optuna:  95%|█████████▌| 190/200 [5:39:45<21:30, 129.09s/it, best=0.868]Pseudomonas_Aeruginosa | DirectMulti | Optuna:  95%|█████████▌| 190/200 [5:39:45<21:30, 129.09s/it, best=0.868]/export/usuarios01/egarroyo/MALDI_for_AMR_prediction/venv/lib/python3.13/site-packages/sklearn/model_selection/_split.py:813: UserWarning: The least populated class in y has only 4 members, which is less than n_splits=5.
  warnings.warn(
[I 2026-02-28 12:36:13,951] Trial 128 finished with value: 0.8998850778033847 and parameters: {'activation': 'tanh', 'solver': 'adam', 'lr': 0.005872563386787133, 'layer1': 379, 'layer2': 308, 'layer3': 130}. Best is trial 74 with value: 0.9166002918687234.

Escherichia_Coli | Piperacillin-Tazobactam | Optuna:  64%|██████▍   | 129/200 [4:32:06<2:15:06, 114.17s/it, best=0.917][A
Escherichia_Coli | Piperacillin-Tazobactam | Optuna:  64%|██████▍   | 129/200 [4:32:06<2:15:06, 114.17s/it, best=0.917][A[I 2026-02-28 12:36:41,022] Trial 157 finished with value: 0.9252414438885121 and parameters: {'activation': 'identity', 'solver': 'adam', 'lr': 0.00021300889107694941, 'layer1': 421, 'layer2': 434, 'layer3': 72}. Best is trial 71 with value: 0.9257111996592865.
Klebsiella_Pneumoniae | LPS | Optuna:  79%|███████▉  | 158/200 [3:48:57<1:04:25, 92.03s/it, best=0.926]Klebsiella_Pneumoniae | LPS | Optuna:  79%|███████▉  | 158/200 [3:48:57<1:04:25, 92.03s/it, best=0.926][I 2026-02-28 12:37:38,163] Trial 122 finished with value: 0.886769208817808 and parameters: {'activation': 'identity', 'solver': 'adam', 'lr': 0.0002023835637546525, 'layer1': 154, 'layer2': 89, 'layer3': 311}. Best is trial 8 with value: 0.8879562150966016.
Staphylococcus_Aureus | LPS | Optuna:  62%|██████▏   | 123/200 [4:31:24<2:46:26, 129.69s/it, best=0.888]Staphylococcus_Aureus | LPS | Optuna:  62%|██████▏   | 123/200 [4:31:24<2:46:26, 129.69s/it, best=0.888][I 2026-02-28 12:37:57,114] Trial 190 finished with value: 0.856107617030118 and parameters: {'activation': 'relu', 'solver': 'adam', 'lr': 4.938964697526609e-05, 'layer1': 427, 'layer2': 361, 'layer3': 210}. Best is trial 187 with value: 0.867960593593898.
Pseudomonas_Aeruginosa | DirectMulti | Optuna:  96%|█████████▌| 191/200 [5:41:43<18:50, 125.62s/it, best=0.868]Pseudomonas_Aeruginosa | DirectMulti | Optuna:  96%|█████████▌| 191/200 [5:41:43<18:50, 125.62s/it, best=0.868]/export/usuarios01/egarroyo/MALDI_for_AMR_prediction/venv/lib/python3.13/site-packages/sklearn/model_selection/_split.py:813: UserWarning: The least populated class in y has only 4 members, which is less than n_splits=5.
  warnings.warn(
[I 2026-02-28 12:38:05,080] Trial 129 finished with value: 0.9128926132420183 and parameters: {'activation': 'relu', 'solver': 'adam', 'lr': 0.00018606910013827527, 'layer1': 305, 'layer2': 276, 'layer3': 497}. Best is trial 74 with value: 0.9166002918687234.

Escherichia_Coli | Piperacillin-Tazobactam | Optuna:  65%|██████▌   | 130/200 [4:33:57<2:12:07, 113.26s/it, best=0.917][A
Escherichia_Coli | Piperacillin-Tazobactam | Optuna:  65%|██████▌   | 130/200 [4:33:57<2:12:07, 113.26s/it, best=0.917][A[I 2026-02-28 12:38:24,136] Trial 158 finished with value: 0.9223971768969683 and parameters: {'activation': 'identity', 'solver': 'adam', 'lr': 0.00015628048686692147, 'layer1': 463, 'layer2': 434, 'layer3': 86}. Best is trial 71 with value: 0.9257111996592865.
Klebsiella_Pneumoniae | LPS | Optuna:  80%|███████▉  | 159/200 [3:50:40<1:05:09, 95.35s/it, best=0.926]Klebsiella_Pneumoniae | LPS | Optuna:  80%|███████▉  | 159/200 [3:50:40<1:05:09, 95.35s/it, best=0.926][I 2026-02-28 12:39:28,781] Trial 191 finished with value: 0.8637413017318816 and parameters: {'activation': 'identity', 'solver': 'adam', 'lr': 0.00022342625896353574, 'layer1': 411, 'layer2': 381, 'layer3': 193}. Best is trial 187 with value: 0.867960593593898.
Pseudomonas_Aeruginosa | DirectMulti | Optuna:  96%|█████████▌| 192/200 [5:43:15<15:23, 115.43s/it, best=0.868]Pseudomonas_Aeruginosa | DirectMulti | Optuna:  96%|█████████▌| 192/200 [5:43:15<15:23, 115.43s/it, best=0.868]/export/usuarios01/egarroyo/MALDI_for_AMR_prediction/venv/lib/python3.13/site-packages/sklearn/model_selection/_split.py:813: UserWarning: The least populated class in y has only 4 members, which is less than n_splits=5.
  warnings.warn(
[I 2026-02-28 12:39:29,332] Trial 123 finished with value: 0.8842325774101039 and parameters: {'activation': 'identity', 'solver': 'adam', 'lr': 0.00018191663975739825, 'layer1': 152, 'layer2': 93, 'layer3': 310}. Best is trial 8 with value: 0.8879562150966016.
Staphylococcus_Aureus | LPS | Optuna:  62%|██████▏   | 124/200 [4:33:15<2:37:14, 124.13s/it, best=0.888]Staphylococcus_Aureus | LPS | Optuna:  62%|██████▏   | 124/200 [4:33:15<2:37:14, 124.13s/it, best=0.888][I 2026-02-28 12:40:16,416] Trial 130 finished with value: 0.9061356705714733 and parameters: {'activation': 'relu', 'solver': 'adam', 'lr': 3.3550146938187735e-05, 'layer1': 458, 'layer2': 299, 'layer3': 104}. Best is trial 74 with value: 0.9166002918687234.

Escherichia_Coli | Piperacillin-Tazobactam | Optuna:  66%|██████▌   | 131/200 [4:36:09<2:16:28, 118.68s/it, best=0.917][A
Escherichia_Coli | Piperacillin-Tazobactam | Optuna:  66%|██████▌   | 131/200 [4:36:09<2:16:28, 118.68s/it, best=0.917][A[I 2026-02-28 12:40:22,775] Trial 159 finished with value: 0.9192092947809345 and parameters: {'activation': 'relu', 'solver': 'adam', 'lr': 0.001006480693278927, 'layer1': 425, 'layer2': 450, 'layer3': 61}. Best is trial 71 with value: 0.9257111996592865.
Klebsiella_Pneumoniae | LPS | Optuna:  80%|████████  | 160/200 [3:52:38<1:08:13, 102.34s/it, best=0.926]Klebsiella_Pneumoniae | LPS | Optuna:  80%|████████  | 160/200 [3:52:38<1:08:13, 102.34s/it, best=0.926][I 2026-02-28 12:41:20,535] Trial 192 finished with value: 0.863795162510908 and parameters: {'activation': 'identity', 'solver': 'adam', 'lr': 6.032596470454922e-05, 'layer1': 398, 'layer2': 348, 'layer3': 167}. Best is trial 187 with value: 0.867960593593898.
Pseudomonas_Aeruginosa | DirectMulti | Optuna:  96%|█████████▋| 193/200 [5:45:06<13:20, 114.33s/it, best=0.868]Pseudomonas_Aeruginosa | DirectMulti | Optuna:  96%|█████████▋| 193/200 [5:45:06<13:20, 114.33s/it, best=0.868]/export/usuarios01/egarroyo/MALDI_for_AMR_prediction/venv/lib/python3.13/site-packages/sklearn/model_selection/_split.py:813: UserWarning: The least populated class in y has only 4 members, which is less than n_splits=5.
  warnings.warn(
[I 2026-02-28 12:41:28,751] Trial 124 finished with value: 0.886683574178809 and parameters: {'activation': 'identity', 'solver': 'adam', 'lr': 0.00029153345638145565, 'layer1': 154, 'layer2': 112, 'layer3': 327}. Best is trial 8 with value: 0.8879562150966016.
Staphylococcus_Aureus | LPS | Optuna:  62%|██████▎   | 125/200 [4:35:15<2:33:24, 122.72s/it, best=0.888]Staphylococcus_Aureus | LPS | Optuna:  62%|██████▎   | 125/200 [4:35:15<2:33:24, 122.72s/it, best=0.888][I 2026-02-28 12:41:31,391] Trial 160 finished with value: 0.9099603348678207 and parameters: {'activation': 'tanh', 'solver': 'adam', 'lr': 0.0014164561390598797, 'layer1': 404, 'layer2': 403, 'layer3': 74}. Best is trial 71 with value: 0.9257111996592865.
Klebsiella_Pneumoniae | LPS | Optuna:  80%|████████  | 161/200 [3:53:47<59:56, 92.22s/it, best=0.926]   Klebsiella_Pneumoniae | LPS | Optuna:  80%|████████  | 161/200 [3:53:47<59:56, 92.22s/it, best=0.926][I 2026-02-28 12:42:34,931] Trial 131 finished with value: 0.9142998157311437 and parameters: {'activation': 'relu', 'solver': 'adam', 'lr': 0.00014114305680657083, 'layer1': 357, 'layer2': 368, 'layer3': 107}. Best is trial 74 with value: 0.9166002918687234.

Escherichia_Coli | Piperacillin-Tazobactam | Optuna:  66%|██████▌   | 132/200 [4:38:27<2:21:14, 124.63s/it, best=0.917][A
Escherichia_Coli | Piperacillin-Tazobactam | Optuna:  66%|██████▌   | 132/200 [4:38:27<2:21:14, 124.63s/it, best=0.917][A[I 2026-02-28 12:42:38,925] Trial 161 finished with value: 0.9237693464491382 and parameters: {'activation': 'identity', 'solver': 'adam', 'lr': 0.00021151710858944675, 'layer1': 22, 'layer2': 415, 'layer3': 335}. Best is trial 71 with value: 0.9257111996592865.
Klebsiella_Pneumoniae | LPS | Optuna:  81%|████████  | 162/200 [3:54:54<53:42, 84.82s/it, best=0.926]Klebsiella_Pneumoniae | LPS | Optuna:  81%|████████  | 162/200 [3:54:54<53:42, 84.82s/it, best=0.926][I 2026-02-28 12:43:23,767] Trial 125 finished with value: 0.8867409220352183 and parameters: {'activation': 'identity', 'solver': 'adam', 'lr': 0.00027205607956216205, 'layer1': 170, 'layer2': 115, 'layer3': 280}. Best is trial 8 with value: 0.8879562150966016.
