Escherichia_Coli | Ceftriaxone | Optuna:  18%|█▊        | 37/200 [1:26:40<7:31:18, 166.13s/it, best=0.897][A[I 2026-02-28 00:36:46,233] Trial 129 finished with value: 0.8430895445638551 and parameters: {'activation': 'identity', 'solver': 'sgd', 'lr': 0.0037260448064479917, 'layer1': 337, 'layer2': 428, 'layer3': 448}. Best is trial 73 with value: 0.8861579932511299.

Pseudomonas_Aeruginosa | Meropenem | Optuna:  65%|██████▌   | 130/200 [2:32:21<1:10:12, 60.18s/it, best=0.886][A
Pseudomonas_Aeruginosa | Meropenem | Optuna:  65%|██████▌   | 130/200 [2:32:21<1:10:12, 60.18s/it, best=0.886][A[I 2026-02-28 00:37:24,904] Trial 116 finished with value: 0.8491103873132131 and parameters: {'activation': 'relu', 'solver': 'adam', 'lr': 0.00038994953268294577, 'layer1': 423, 'layer2': 153, 'layer3': 178}. Best is trial 105 with value: 0.857392473801258.

Staphylococcus_Aureus | Clindamycin | Optuna:  58%|█████▊    | 117/200 [2:39:26<2:34:54, 111.98s/it, best=0.857][A
Staphylococcus_Aureus | Clindamycin | Optuna:  58%|█████▊    | 117/200 [2:39:26<2:34:54, 111.98s/it, best=0.857][A[I 2026-02-28 00:38:06,744] Trial 121 finished with value: 0.9062968330895991 and parameters: {'activation': 'tanh', 'solver': 'adam', 'lr': 3.519957001372074e-05, 'layer1': 277, 'layer2': 491, 'layer3': 416}. Best is trial 115 with value: 0.9092132916762997.

Klebsiella_Pneumoniae | Ceftriaxone | Optuna:  61%|██████    | 122/200 [3:47:28<2:47:49, 129.10s/it, best=0.909][A
Klebsiella_Pneumoniae | Ceftriaxone | Optuna:  61%|██████    | 122/200 [3:47:28<2:47:49, 129.10s/it, best=0.909][A[I 2026-02-28 00:38:13,626] Trial 37 finished with value: 0.7118551110654706 and parameters: {'activation': 'relu', 'solver': 'adam', 'lr': 1.1141304452164877e-06, 'layer1': 392, 'layer2': 169, 'layer3': 34}. Best is trial 14 with value: 0.8971256036318559.

Escherichia_Coli | Ceftriaxone | Optuna:  19%|█▉        | 38/200 [1:28:15<6:30:49, 144.75s/it, best=0.897][A
Escherichia_Coli | Ceftriaxone | Optuna:  19%|█▉        | 38/200 [1:28:15<6:30:49, 144.75s/it, best=0.897][A[I 2026-02-28 00:38:15,061] Trial 130 finished with value: 0.8709638455575291 and parameters: {'activation': 'logistic', 'solver': 'adam', 'lr': 0.00018345613509971654, 'layer1': 428, 'layer2': 450, 'layer3': 424}. Best is trial 73 with value: 0.8861579932511299.

Pseudomonas_Aeruginosa | Meropenem | Optuna:  66%|██████▌   | 131/200 [2:33:50<1:19:05, 68.77s/it, best=0.886][A
Pseudomonas_Aeruginosa | Meropenem | Optuna:  66%|██████▌   | 131/200 [2:33:50<1:19:05, 68.77s/it, best=0.886][A[I 2026-02-28 00:38:57,425] Trial 117 finished with value: 0.8528320377652031 and parameters: {'activation': 'relu', 'solver': 'adam', 'lr': 0.00019713163996809617, 'layer1': 298, 'layer2': 84, 'layer3': 73}. Best is trial 105 with value: 0.857392473801258.

Staphylococcus_Aureus | Clindamycin | Optuna:  59%|█████▉    | 118/200 [2:40:59<2:25:03, 106.15s/it, best=0.857][A
Staphylococcus_Aureus | Clindamycin | Optuna:  59%|█████▉    | 118/200 [2:40:59<2:25:03, 106.15s/it, best=0.857][A[I 2026-02-28 00:39:05,106] Trial 38 finished with value: 0.7081745948785881 and parameters: {'activation': 'relu', 'solver': 'sgd', 'lr': 0.00013232545238808042, 'layer1': 353, 'layer2': 87, 'layer3': 409}. Best is trial 14 with value: 0.8971256036318559.

Escherichia_Coli | Ceftriaxone | Optuna:  20%|█▉        | 39/200 [1:29:06<5:13:19, 116.77s/it, best=0.897][A
Escherichia_Coli | Ceftriaxone | Optuna:  20%|█▉        | 39/200 [1:29:06<5:13:19, 116.77s/it, best=0.897][A[I 2026-02-28 00:39:27,689] Trial 118 finished with value: 0.7898753366230491 and parameters: {'activation': 'relu', 'solver': 'sgd', 'lr': 0.0002650882899604441, 'layer1': 251, 'layer2': 51, 'layer3': 258}. Best is trial 105 with value: 0.857392473801258.

Staphylococcus_Aureus | Clindamycin | Optuna:  60%|█████▉    | 119/200 [2:41:29<1:52:33, 83.38s/it, best=0.857] [A
Staphylococcus_Aureus | Clindamycin | Optuna:  60%|█████▉    | 119/200 [2:41:29<1:52:33, 83.38s/it, best=0.857][A[I 2026-02-28 00:39:36,720] Trial 131 finished with value: 0.8830977380053335 and parameters: {'activation': 'identity', 'solver': 'adam', 'lr': 0.000590004202745849, 'layer1': 365, 'layer2': 412, 'layer3': 412}. Best is trial 73 with value: 0.8861579932511299.

Pseudomonas_Aeruginosa | Meropenem | Optuna:  66%|██████▌   | 132/200 [2:35:11<1:22:19, 72.64s/it, best=0.886][A
Pseudomonas_Aeruginosa | Meropenem | Optuna:  66%|██████▌   | 132/200 [2:35:11<1:22:19, 72.64s/it, best=0.886][A[I 2026-02-28 00:40:11,195] Trial 122 finished with value: 0.9079988421472323 and parameters: {'activation': 'tanh', 'solver': 'adam', 'lr': 2.5998723440535658e-05, 'layer1': 177, 'layer2': 458, 'layer3': 401}. Best is trial 115 with value: 0.9092132916762997.

Klebsiella_Pneumoniae | Ceftriaxone | Optuna:  62%|██████▏   | 123/200 [3:49:32<2:43:53, 127.71s/it, best=0.909][A
Klebsiella_Pneumoniae | Ceftriaxone | Optuna:  62%|██████▏   | 123/200 [3:49:32<2:43:53, 127.71s/it, best=0.909][A[I 2026-02-28 00:40:51,296] Trial 132 finished with value: 0.8829247991392635 and parameters: {'activation': 'identity', 'solver': 'adam', 'lr': 0.0007124825042473917, 'layer1': 342, 'layer2': 443, 'layer3': 246}. Best is trial 73 with value: 0.8861579932511299.

Pseudomonas_Aeruginosa | Meropenem | Optuna:  66%|██████▋   | 133/200 [2:36:26<1:21:45, 73.22s/it, best=0.886][A
Pseudomonas_Aeruginosa | Meropenem | Optuna:  66%|██████▋   | 133/200 [2:36:26<1:21:45, 73.22s/it, best=0.886][A[I 2026-02-28 00:41:28,125] Trial 119 finished with value: 0.8513388124759139 and parameters: {'activation': 'relu', 'solver': 'adam', 'lr': 0.00034730579460248256, 'layer1': 486, 'layer2': 110, 'layer3': 228}. Best is trial 105 with value: 0.857392473801258.

Staphylococcus_Aureus | Clindamycin | Optuna:  60%|██████    | 120/200 [2:43:29<2:05:59, 94.50s/it, best=0.857][A
Staphylococcus_Aureus | Clindamycin | Optuna:  60%|██████    | 120/200 [2:43:29<2:05:59, 94.50s/it, best=0.857][A[I 2026-02-28 00:41:48,111] Trial 123 finished with value: 0.9048678694700933 and parameters: {'activation': 'tanh', 'solver': 'adam', 'lr': 2.7361904787945305e-05, 'layer1': 163, 'layer2': 460, 'layer3': 163}. Best is trial 115 with value: 0.9092132916762997.

Klebsiella_Pneumoniae | Ceftriaxone | Optuna:  62%|██████▏   | 124/200 [3:51:09<2:30:03, 118.47s/it, best=0.909][A
Klebsiella_Pneumoniae | Ceftriaxone | Optuna:  62%|██████▏   | 124/200 [3:51:09<2:30:03, 118.47s/it, best=0.909][A[I 2026-02-28 00:42:35,511] Trial 133 finished with value: 0.8854044166385234 and parameters: {'activation': 'identity', 'solver': 'adam', 'lr': 0.0009540485902802194, 'layer1': 392, 'layer2': 473, 'layer3': 426}. Best is trial 73 with value: 0.8861579932511299.

Pseudomonas_Aeruginosa | Meropenem | Optuna:  67%|██████▋   | 134/200 [2:38:10<1:30:46, 82.52s/it, best=0.886][A
Pseudomonas_Aeruginosa | Meropenem | Optuna:  67%|██████▋   | 134/200 [2:38:10<1:30:46, 82.52s/it, best=0.886][A[I 2026-02-28 00:43:06,199] Trial 120 finished with value: 0.8548822059678184 and parameters: {'activation': 'relu', 'solver': 'adam', 'lr': 0.00047460224629455546, 'layer1': 351, 'layer2': 73, 'layer3': 16}. Best is trial 105 with value: 0.857392473801258.

Staphylococcus_Aureus | Clindamycin | Optuna:  60%|██████    | 121/200 [2:45:07<2:05:50, 95.57s/it, best=0.857][A
Staphylococcus_Aureus | Clindamycin | Optuna:  60%|██████    | 121/200 [2:45:07<2:05:50, 95.57s/it, best=0.857][A[I 2026-02-28 00:43:46,614] Trial 39 finished with value: 0.8910542308546094 and parameters: {'activation': 'relu', 'solver': 'adam', 'lr': 2.0906552539175556e-05, 'layer1': 296, 'layer2': 35, 'layer3': 149}. Best is trial 14 with value: 0.8971256036318559.

Escherichia_Coli | Ceftriaxone | Optuna:  20%|██        | 40/200 [1:33:48<7:23:10, 166.19s/it, best=0.897][A
Escherichia_Coli | Ceftriaxone | Optuna:  20%|██        | 40/200 [1:33:48<7:23:10, 166.19s/it, best=0.897][A[I 2026-02-28 00:43:55,481] Trial 124 finished with value: 0.903677316404344 and parameters: {'activation': 'tanh', 'solver': 'adam', 'lr': 1.8541064124150452e-05, 'layer1': 146, 'layer2': 467, 'layer3': 382}. Best is trial 115 with value: 0.9092132916762997.

Klebsiella_Pneumoniae | Ceftriaxone | Optuna:  62%|██████▎   | 125/200 [3:53:17<2:31:25, 121.14s/it, best=0.909][A
Klebsiella_Pneumoniae | Ceftriaxone | Optuna:  62%|██████▎   | 125/200 [3:53:17<2:31:25, 121.14s/it, best=0.909][A[I 2026-02-28 00:44:00,028] Trial 134 finished with value: 0.883057312249757 and parameters: {'activation': 'identity', 'solver': 'adam', 'lr': 0.000952457974729447, 'layer1': 387, 'layer2': 322, 'layer3': 432}. Best is trial 73 with value: 0.8861579932511299.

Pseudomonas_Aeruginosa | Meropenem | Optuna:  68%|██████▊   | 135/200 [2:39:35<1:30:02, 83.12s/it, best=0.886][A
Pseudomonas_Aeruginosa | Meropenem | Optuna:  68%|██████▊   | 135/200 [2:39:35<1:30:02, 83.12s/it, best=0.886][A[I 2026-02-28 00:44:44,769] Trial 121 finished with value: 0.8501031555695141 and parameters: {'activation': 'relu', 'solver': 'adam', 'lr': 0.0004940037160349979, 'layer1': 382, 'layer2': 68, 'layer3': 17}. Best is trial 105 with value: 0.857392473801258.

Staphylococcus_Aureus | Clindamycin | Optuna:  61%|██████    | 122/200 [2:46:46<2:05:24, 96.47s/it, best=0.857][A
Staphylococcus_Aureus | Clindamycin | Optuna:  61%|██████    | 122/200 [2:46:46<2:05:24, 96.47s/it, best=0.857][A[I 2026-02-28 00:44:59,091] Trial 125 finished with value: 0.8368832656954698 and parameters: {'activation': 'tanh', 'solver': 'adam', 'lr': 0.003514819632601325, 'layer1': 188, 'layer2': 448, 'layer3': 404}. Best is trial 115 with value: 0.9092132916762997.

Klebsiella_Pneumoniae | Ceftriaxone | Optuna:  63%|██████▎   | 126/200 [3:54:20<2:08:07, 103.88s/it, best=0.909][A
Klebsiella_Pneumoniae | Ceftriaxone | Optuna:  63%|██████▎   | 126/200 [3:54:20<2:08:07, 103.88s/it, best=0.909][A[I 2026-02-28 00:45:24,090] Trial 135 finished with value: 0.8839685553298022 and parameters: {'activation': 'identity', 'solver': 'adam', 'lr': 0.001199374535571252, 'layer1': 411, 'layer2': 261, 'layer3': 473}. Best is trial 73 with value: 0.8861579932511299.

Pseudomonas_Aeruginosa | Meropenem | Optuna:  68%|██████▊   | 136/200 [2:40:59<1:28:57, 83.40s/it, best=0.886][A
Pseudomonas_Aeruginosa | Meropenem | Optuna:  68%|██████▊   | 136/200 [2:40:59<1:28:57, 83.40s/it, best=0.886][A[I 2026-02-28 00:46:01,495] Trial 40 finished with value: 0.8888823213836721 and parameters: {'activation': 'tanh', 'solver': 'adam', 'lr': 6.536056802835434e-05, 'layer1': 499, 'layer2': 286, 'layer3': 75}. Best is trial 14 with value: 0.8971256036318559.

Escherichia_Coli | Ceftriaxone | Optuna:  20%|██        | 41/200 [1:36:02<6:55:30, 156.80s/it, best=0.897][A
Escherichia_Coli | Ceftriaxone | Optuna:  20%|██        | 41/200 [1:36:02<6:55:30, 156.80s/it, best=0.897][A[I 2026-02-28 00:46:49,173] Trial 122 finished with value: 0.8504600052062001 and parameters: {'activation': 'relu', 'solver': 'adam', 'lr': 0.0010031255646844005, 'layer1': 476, 'layer2': 60, 'layer3': 28}. Best is trial 105 with value: 0.857392473801258.

Staphylococcus_Aureus | Clindamycin | Optuna:  62%|██████▏   | 123/200 [2:48:50<2:14:33, 104.85s/it, best=0.857][A
Staphylococcus_Aureus | Clindamycin | Optuna:  62%|██████▏   | 123/200 [2:48:50<2:14:33, 104.85s/it, best=0.857][A[I 2026-02-28 00:46:49,205] Trial 136 finished with value: 0.8831202853181445 and parameters: {'activation': 'identity', 'solver': 'adam', 'lr': 0.0008264822313352167, 'layer1': 395, 'layer2': 461, 'layer3': 442}. Best is trial 73 with value: 0.8861579932511299.

Pseudomonas_Aeruginosa | Meropenem | Optuna:  68%|██████▊   | 137/200 [2:42:24<1:28:06, 83.92s/it, best=0.886][A
Pseudomonas_Aeruginosa | Meropenem | Optuna:  68%|██████▊   | 137/200 [2:42:24<1:28:06, 83.92s/it, best=0.886][A[I 2026-02-28 00:47:37,603] Trial 126 finished with value: 0.9038817717144205 and parameters: {'activation': 'tanh', 'solver': 'adam', 'lr': 1.1669974034181981e-05, 'layer1': 275, 'layer2': 478, 'layer3': 435}. Best is trial 115 with value: 0.9092132916762997.

Klebsiella_Pneumoniae | Ceftriaxone | Optuna:  64%|██████▎   | 127/200 [3:56:59<2:26:19, 120.27s/it, best=0.909][A
Klebsiella_Pneumoniae | Ceftriaxone | Optuna:  64%|██████▎   | 127/200 [3:56:59<2:26:19, 120.27s/it, best=0.909][A[I 2026-02-28 00:47:54,514] Trial 137 finished with value: 0.882335992788606 and parameters: {'activation': 'identity', 'solver': 'adam', 'lr': 0.0013739560175340326, 'layer1': 303, 'layer2': 220, 'layer3': 459}. Best is trial 73 with value: 0.8861579932511299.

Pseudomonas_Aeruginosa | Meropenem | Optuna:  69%|██████▉   | 138/200 [2:43:29<1:20:56, 78.33s/it, best=0.886][A
Pseudomonas_Aeruginosa | Meropenem | Optuna:  69%|██████▉   | 138/200 [2:43:29<1:20:56, 78.33s/it, best=0.886][A[I 2026-02-28 00:47:57,413] Trial 41 finished with value: 0.8909720295435717 and parameters: {'activation': 'relu', 'solver': 'adam', 'lr': 0.0004651923049012195, 'layer1': 475, 'layer2': 129, 'layer3': 43}. Best is trial 14 with value: 0.8971256036318559.

Escherichia_Coli | Ceftriaxone | Optuna:  21%|██        | 42/200 [1:37:58<6:20:36, 144.53s/it, best=0.897][A
Escherichia_Coli | Ceftriaxone | Optuna:  21%|██        | 42/200 [1:37:58<6:20:36, 144.53s/it, best=0.897][A[I 2026-02-28 00:48:22,254] Trial 123 finished with value: 0.8506374889801066 and parameters: {'activation': 'relu', 'solver': 'adam', 'lr': 0.0005689053775715966, 'layer1': 323, 'layer2': 78, 'layer3': 62}. Best is trial 105 with value: 0.857392473801258.

Staphylococcus_Aureus | Clindamycin | Optuna:  62%|██████▏   | 124/200 [2:50:23<2:08:20, 101.32s/it, best=0.857][A
Staphylococcus_Aureus | Clindamycin | Optuna:  62%|██████▏   | 124/200 [2:50:23<2:08:20, 101.32s/it, best=0.857][A[I 2026-02-28 00:49:08,767] Trial 138 finished with value: 0.8836863875513427 and parameters: {'activation': 'identity', 'solver': 'adam', 'lr': 0.0004959087958893852, 'layer1': 270, 'layer2': 347, 'layer3': 389}. Best is trial 73 with value: 0.8861579932511299.

Pseudomonas_Aeruginosa | Meropenem | Optuna:  70%|██████▉   | 139/200 [2:44:43<1:18:23, 77.11s/it, best=0.886][A
Pseudomonas_Aeruginosa | Meropenem | Optuna:  70%|██████▉   | 139/200 [2:44:43<1:18:23, 77.11s/it, best=0.886][A[I 2026-02-28 00:49:18,463] Trial 127 finished with value: 0.9055852779110024 and parameters: {'activation': 'tanh', 'solver': 'adam', 'lr': 2.4269258950064297e-05, 'layer1': 116, 'layer2': 430, 'layer3': 446}. Best is trial 115 with value: 0.9092132916762997.

Klebsiella_Pneumoniae | Ceftriaxone | Optuna:  64%|██████▍   | 128/200 [3:58:40<2:17:20, 114.45s/it, best=0.909][A
Klebsiella_Pneumoniae | Ceftriaxone | Optuna:  64%|██████▍   | 128/200 [3:58:40<2:17:20, 114.45s/it, best=0.909][A[I 2026-02-28 00:50:04,182] Trial 42 finished with value: 0.8928595132068835 and parameters: {'activation': 'relu', 'solver': 'adam', 'lr': 0.0009935613839093156, 'layer1': 442, 'layer2': 104, 'layer3': 10}. Best is trial 14 with value: 0.8971256036318559.

Escherichia_Coli | Ceftriaxone | Optuna:  22%|██▏       | 43/200 [1:40:05<6:04:15, 139.20s/it, best=0.897][A
Escherichia_Coli | Ceftriaxone | Optuna:  22%|██▏       | 43/200 [1:40:05<6:04:15, 139.20s/it, best=0.897][A[I 2026-02-28 00:50:06,170] Trial 124 finished with value: 0.8515146858369119 and parameters: {'activation': 'relu', 'solver': 'adam', 'lr': 0.000436651249198135, 'layer1': 393, 'layer2': 97, 'layer3': 39}. Best is trial 105 with value: 0.857392473801258.

Staphylococcus_Aureus | Clindamycin | Optuna:  62%|██████▎   | 125/200 [2:52:07<2:07:37, 102.10s/it, best=0.857][A
Staphylococcus_Aureus | Clindamycin | Optuna:  62%|██████▎   | 125/200 [2:52:07<2:07:37, 102.10s/it, best=0.857][A[I 2026-02-28 00:50:42,591] Trial 139 finished with value: 0.8838082190232252 and parameters: {'activation': 'identity', 'solver': 'adam', 'lr': 0.0021678473867763914, 'layer1': 378, 'layer2': 474, 'layer3': 258}. Best is trial 73 with value: 0.8861579932511299.

Pseudomonas_Aeruginosa | Meropenem | Optuna:  70%|███████   | 140/200 [2:46:17<1:22:07, 82.12s/it, best=0.886][A
Pseudomonas_Aeruginosa | Meropenem | Optuna:  70%|███████   | 140/200 [2:46:17<1:22:07, 82.12s/it, best=0.886][A[I 2026-02-28 00:51:45,858] Trial 140 finished with value: 0.8823114801751597 and parameters: {'activation': 'identity', 'solver': 'adam', 'lr': 0.00014886393146253406, 'layer1': 286, 'layer2': 248, 'layer3': 453}. Best is trial 73 with value: 0.8861579932511299.

Pseudomonas_Aeruginosa | Meropenem | Optuna:  70%|███████   | 141/200 [2:47:21<1:15:11, 76.47s/it, best=0.886][A
Pseudomonas_Aeruginosa | Meropenem | Optuna:  70%|███████   | 141/200 [2:47:21<1:15:11, 76.47s/it, best=0.886][A[I 2026-02-28 00:51:52,680] Trial 125 finished with value: 0.8447048992988557 and parameters: {'activation': 'logistic', 'solver': 'adam', 'lr': 0.000828965002039096, 'layer1': 347, 'layer2': 116, 'layer3': 11}. Best is trial 105 with value: 0.857392473801258.

Staphylococcus_Aureus | Clindamycin | Optuna:  63%|██████▎   | 126/200 [2:53:54<2:07:33, 103.42s/it, best=0.857][A
Staphylococcus_Aureus | Clindamycin | Optuna:  63%|██████▎   | 126/200 [2:53:54<2:07:33, 103.42s/it, best=0.857][A[I 2026-02-28 00:52:19,578] Trial 43 finished with value: 0.8951193454867579 and parameters: {'activation': 'relu', 'solver': 'adam', 'lr': 0.000269083988404487, 'layer1': 461, 'layer2': 111, 'layer3': 56}. Best is trial 14 with value: 0.8971256036318559.

Escherichia_Coli | Ceftriaxone | Optuna:  22%|██▏       | 44/200 [1:42:21<5:58:57, 138.06s/it, best=0.897][A
Escherichia_Coli | Ceftriaxone | Optuna:  22%|██▏       | 44/200 [1:42:21<5:58:57, 138.06s/it, best=0.897][A[I 2026-02-28 00:52:29,828] Trial 128 finished with value: 0.9071237449591841 and parameters: {'activation': 'tanh', 'solver': 'adam', 'lr': 1.4086429074581536e-05, 'layer1': 377, 'layer2': 441, 'layer3': 456}. Best is trial 115 with value: 0.9092132916762997.

Klebsiella_Pneumoniae | Ceftriaxone | Optuna:  64%|██████▍   | 129/200 [4:01:51<2:42:44, 137.52s/it, best=0.909][A
Klebsiella_Pneumoniae | Ceftriaxone | Optuna:  64%|██████▍   | 129/200 [4:01:51<2:42:44, 137.52s/it, best=0.909][A[I 2026-02-28 00:53:16,261] Trial 141 finished with value: 0.8825405124960455 and parameters: {'activation': 'identity', 'solver': 'adam', 'lr': 0.0006488355371183156, 'layer1': 358, 'layer2': 458, 'layer3': 410}. Best is trial 73 with value: 0.8861579932511299.

Pseudomonas_Aeruginosa | Meropenem | Optuna:  71%|███████   | 142/200 [2:48:51<1:17:57, 80.65s/it, best=0.886][A
Pseudomonas_Aeruginosa | Meropenem | Optuna:  71%|███████   | 142/200 [2:48:51<1:17:57, 80.65s/it, best=0.886][A[I 2026-02-28 00:53:28,973] Trial 126 finished with value: 0.8377853563086457 and parameters: {'activation': 'relu', 'solver': 'adam', 'lr': 0.0002941451137576066, 'layer1': 366, 'layer2': 10, 'layer3': 46}. Best is trial 105 with value: 0.857392473801258.

Staphylococcus_Aureus | Clindamycin | Optuna:  64%|██████▎   | 127/200 [2:55:30<2:03:13, 101.28s/it, best=0.857][A
Staphylococcus_Aureus | Clindamycin | Optuna:  64%|██████▎   | 127/200 [2:55:30<2:03:13, 101.28s/it, best=0.857][A[I 2026-02-28 00:54:09,104] Trial 127 finished with value: 0.7888558471217525 and parameters: {'activation': 'logistic', 'solver': 'adam', 'lr': 0.00021219090808824302, 'layer1': 447, 'layer2': 172, 'layer3': 34}. Best is trial 105 with value: 0.857392473801258.

Staphylococcus_Aureus | Clindamycin | Optuna:  64%|██████▍   | 128/200 [2:56:10<1:39:31, 82.94s/it, best=0.857] [A
Staphylococcus_Aureus | Clindamycin | Optuna:  64%|██████▍   | 128/200 [2:56:10<1:39:31, 82.94s/it, best=0.857][A[I 2026-02-28 00:54:25,675] Trial 44 finished with value: 0.886748484535039 and parameters: {'activation': 'identity', 'solver': 'adam', 'lr': 0.0002482462487974896, 'layer1': 414, 'layer2': 47, 'layer3': 102}. Best is trial 14 with value: 0.8971256036318559.

Escherichia_Coli | Ceftriaxone | Optuna:  22%|██▎       | 45/200 [1:44:27<5:47:23, 134.47s/it, best=0.897][A
Escherichia_Coli | Ceftriaxone | Optuna:  22%|██▎       | 45/200 [1:44:27<5:47:23, 134.47s/it, best=0.897][A[I 2026-02-28 00:54:50,156] Trial 142 finished with value: 0.8811103499998097 and parameters: {'activation': 'identity', 'solver': 'adam', 'lr': 0.0010722852948676029, 'layer1': 372, 'layer2': 489, 'layer3': 429}. Best is trial 73 with value: 0.8861579932511299.

Pseudomonas_Aeruginosa | Meropenem | Optuna:  72%|███████▏  | 143/200 [2:50:25<1:20:23, 84.62s/it, best=0.886][A
Pseudomonas_Aeruginosa | Meropenem | Optuna:  72%|███████▏  | 143/200 [2:50:25<1:20:23, 84.62s/it, best=0.886][A[I 2026-02-28 00:55:18,297] Trial 129 finished with value: 0.9069390820729051 and parameters: {'activation': 'tanh', 'solver': 'adam', 'lr': 1.4546666027706518e-05, 'layer1': 397, 'layer2': 463, 'layer3': 394}. Best is trial 115 with value: 0.9092132916762997.

Klebsiella_Pneumoniae | Ceftriaxone | Optuna:  65%|██████▌   | 130/200 [4:04:39<2:51:16, 146.81s/it, best=0.909][A
Klebsiella_Pneumoniae | Ceftriaxone | Optuna:  65%|██████▌   | 130/200 [4:04:39<2:51:16, 146.81s/it, best=0.909][A[I 2026-02-28 00:56:13,119] Trial 128 finished with value: 0.8441866203208825 and parameters: {'activation': 'identity', 'solver': 'adam', 'lr': 0.0006759224575392878, 'layer1': 138, 'layer2': 283, 'layer3': 395}. Best is trial 105 with value: 0.857392473801258.

Staphylococcus_Aureus | Clindamycin | Optuna:  64%|██████▍   | 129/200 [2:58:14<1:52:43, 95.26s/it, best=0.857][A
