Staphylococcus_Aureus | Fusidic acid | Optuna:  95%|█████████▌| 190/200 [5:06:42<16:20, 98.07s/it, best=0.928][A[I 2026-02-28 07:48:29,893] Trial 121 finished with value: 0.9821122570544996 and parameters: {'activation': 'tanh', 'solver': 'adam', 'lr': 0.0008240549836563567, 'layer1': 250, 'layer2': 297, 'layer3': 82}. Best is trial 119 with value: 0.983615836127451.

Klebsiella_Pneumoniae | Meropenem | Optuna:  61%|██████    | 122/200 [1:49:10<1:04:21, 49.50s/it, best=0.984][A
Klebsiella_Pneumoniae | Meropenem | Optuna:  61%|██████    | 122/200 [1:49:10<1:04:21, 49.50s/it, best=0.984][A[I 2026-02-28 07:49:04,320] Trial 193 finished with value: 0.8927618657650663 and parameters: {'activation': 'relu', 'solver': 'adam', 'lr': 4.3588878557670316e-05, 'layer1': 415, 'layer2': 133, 'layer3': 10}. Best is trial 137 with value: 0.8979080367540411.

Escherichia_Coli | Ceftriaxone | Optuna:  97%|█████████▋| 194/200 [8:39:05<19:02, 190.42s/it, best=0.898][A
Escherichia_Coli | Ceftriaxone | Optuna:  97%|█████████▋| 194/200 [8:39:05<19:02, 190.42s/it, best=0.898][A[I 2026-02-28 07:49:20,970] Trial 122 finished with value: 0.9812133397767638 and parameters: {'activation': 'tanh', 'solver': 'adam', 'lr': 0.0015273509747850728, 'layer1': 226, 'layer2': 265, 'layer3': 94}. Best is trial 119 with value: 0.983615836127451.

Klebsiella_Pneumoniae | Meropenem | Optuna:  62%|██████▏   | 123/200 [1:50:01<1:04:08, 49.97s/it, best=0.984][A
Klebsiella_Pneumoniae | Meropenem | Optuna:  62%|██████▏   | 123/200 [1:50:01<1:04:08, 49.97s/it, best=0.984][A[I 2026-02-28 07:49:21,274] Trial 32 finished with value: 0.8647261612668838 and parameters: {'activation': 'identity', 'solver': 'adam', 'lr': 0.00024274151006448304, 'layer1': 444, 'layer2': 441, 'layer3': 433}. Best is trial 31 with value: 0.866367214803268.
Pseudomonas_Aeruginosa | DirectMulti | Optuna:  16%|█▋        | 33/200 [53:07<4:54:42, 105.88s/it, best=0.866]Pseudomonas_Aeruginosa | DirectMulti | Optuna:  16%|█▋        | 33/200 [53:07<4:54:42, 105.88s/it, best=0.866]/export/usuarios01/egarroyo/MALDI_for_AMR_prediction/venv/lib/python3.13/site-packages/sklearn/model_selection/_split.py:813: UserWarning: The least populated class in y has only 4 members, which is less than n_splits=5.
  warnings.warn(
[I 2026-02-28 07:49:43,352] Trial 190 finished with value: 0.9261983487063393 and parameters: {'activation': 'identity', 'solver': 'adam', 'lr': 5.390949872211396e-05, 'layer1': 399, 'layer2': 386, 'layer3': 121}. Best is trial 77 with value: 0.9283869597728589.

Staphylococcus_Aureus | Fusidic acid | Optuna:  96%|█████████▌| 191/200 [5:08:52<16:07, 107.53s/it, best=0.928][A
Staphylococcus_Aureus | Fusidic acid | Optuna:  96%|█████████▌| 191/200 [5:08:52<16:07, 107.53s/it, best=0.928][A[I 2026-02-28 07:50:08,586] Trial 123 finished with value: 0.9829855733356903 and parameters: {'activation': 'tanh', 'solver': 'adam', 'lr': 0.0008229088306903827, 'layer1': 264, 'layer2': 294, 'layer3': 83}. Best is trial 119 with value: 0.983615836127451.

Klebsiella_Pneumoniae | Meropenem | Optuna:  62%|██████▏   | 124/200 [1:50:49<1:02:24, 49.27s/it, best=0.984][A
Klebsiella_Pneumoniae | Meropenem | Optuna:  62%|██████▏   | 124/200 [1:50:49<1:02:24, 49.27s/it, best=0.984][A[I 2026-02-28 07:50:45,010] Trial 124 finished with value: 0.9793899249397171 and parameters: {'activation': 'tanh', 'solver': 'adam', 'lr': 0.0008183075031792517, 'layer1': 247, 'layer2': 294, 'layer3': 80}. Best is trial 119 with value: 0.983615836127451.

Klebsiella_Pneumoniae | Meropenem | Optuna:  62%|██████▎   | 125/200 [1:51:25<56:46, 45.41s/it, best=0.984]  [A
Klebsiella_Pneumoniae | Meropenem | Optuna:  62%|██████▎   | 125/200 [1:51:25<56:46, 45.41s/it, best=0.984][A[I 2026-02-28 07:51:36,793] Trial 33 finished with value: 0.8654380868249714 and parameters: {'activation': 'identity', 'solver': 'adam', 'lr': 0.0020737389083209986, 'layer1': 456, 'layer2': 299, 'layer3': 494}. Best is trial 31 with value: 0.866367214803268.
Pseudomonas_Aeruginosa | DirectMulti | Optuna:  17%|█▋        | 34/200 [55:23<5:17:32, 114.77s/it, best=0.866]Pseudomonas_Aeruginosa | DirectMulti | Optuna:  17%|█▋        | 34/200 [55:23<5:17:32, 114.77s/it, best=0.866]/export/usuarios01/egarroyo/MALDI_for_AMR_prediction/venv/lib/python3.13/site-packages/sklearn/model_selection/_split.py:813: UserWarning: The least populated class in y has only 4 members, which is less than n_splits=5.
  warnings.warn(
[I 2026-02-28 07:51:37,811] Trial 125 finished with value: 0.9820969835221451 and parameters: {'activation': 'tanh', 'solver': 'adam', 'lr': 0.0006481622449316051, 'layer1': 265, 'layer2': 277, 'layer3': 87}. Best is trial 119 with value: 0.983615836127451.

Klebsiella_Pneumoniae | Meropenem | Optuna:  63%|██████▎   | 126/200 [1:52:18<58:44, 47.63s/it, best=0.984][A
Klebsiella_Pneumoniae | Meropenem | Optuna:  63%|██████▎   | 126/200 [1:52:18<58:44, 47.63s/it, best=0.984][A[I 2026-02-28 07:51:40,856] Trial 191 finished with value: 0.9266805033210194 and parameters: {'activation': 'identity', 'solver': 'adam', 'lr': 0.00015338196762755256, 'layer1': 375, 'layer2': 130, 'layer3': 282}. Best is trial 77 with value: 0.9283869597728589.

Staphylococcus_Aureus | Fusidic acid | Optuna:  96%|█████████▌| 192/200 [5:10:50<14:44, 110.52s/it, best=0.928][A
Staphylococcus_Aureus | Fusidic acid | Optuna:  96%|█████████▌| 192/200 [5:10:50<14:44, 110.52s/it, best=0.928][A[I 2026-02-28 07:51:55,315] Trial 194 finished with value: 0.8964067880285527 and parameters: {'activation': 'relu', 'solver': 'adam', 'lr': 6.278789300359787e-05, 'layer1': 445, 'layer2': 328, 'layer3': 465}. Best is trial 137 with value: 0.8979080367540411.

Escherichia_Coli | Ceftriaxone | Optuna:  98%|█████████▊| 195/200 [8:41:56<15:22, 184.59s/it, best=0.898][A
Escherichia_Coli | Ceftriaxone | Optuna:  98%|█████████▊| 195/200 [8:41:56<15:22, 184.59s/it, best=0.898][A[I 2026-02-28 07:52:16,503] Trial 126 finished with value: 0.9805598537900819 and parameters: {'activation': 'tanh', 'solver': 'adam', 'lr': 0.0012874831915266449, 'layer1': 265, 'layer2': 280, 'layer3': 86}. Best is trial 119 with value: 0.983615836127451.

Klebsiella_Pneumoniae | Meropenem | Optuna:  64%|██████▎   | 127/200 [1:52:57<54:41, 44.95s/it, best=0.984][A
Klebsiella_Pneumoniae | Meropenem | Optuna:  64%|██████▎   | 127/200 [1:52:57<54:41, 44.95s/it, best=0.984][A[I 2026-02-28 07:53:01,464] Trial 127 finished with value: 0.9816421155596015 and parameters: {'activation': 'tanh', 'solver': 'adam', 'lr': 0.0006394290419628364, 'layer1': 209, 'layer2': 460, 'layer3': 64}. Best is trial 119 with value: 0.983615836127451.

Klebsiella_Pneumoniae | Meropenem | Optuna:  64%|██████▍   | 128/200 [1:53:41<53:56, 44.95s/it, best=0.984][A
Klebsiella_Pneumoniae | Meropenem | Optuna:  64%|██████▍   | 128/200 [1:53:41<53:56, 44.95s/it, best=0.984][A[I 2026-02-28 07:53:13,724] Trial 34 finished with value: 0.8629857156394237 and parameters: {'activation': 'identity', 'solver': 'adam', 'lr': 0.000620284769707958, 'layer1': 476, 'layer2': 318, 'layer3': 496}. Best is trial 31 with value: 0.866367214803268.
Pseudomonas_Aeruginosa | DirectMulti | Optuna:  18%|█▊        | 35/200 [56:59<5:00:54, 109.42s/it, best=0.866]Pseudomonas_Aeruginosa | DirectMulti | Optuna:  18%|█▊        | 35/200 [56:59<5:00:54, 109.42s/it, best=0.866]/export/usuarios01/egarroyo/MALDI_for_AMR_prediction/venv/lib/python3.13/site-packages/sklearn/model_selection/_split.py:813: UserWarning: The least populated class in y has only 4 members, which is less than n_splits=5.
  warnings.warn(
[I 2026-02-28 07:53:15,905] Trial 195 finished with value: 0.7083598888163722 and parameters: {'activation': 'relu', 'solver': 'sgd', 'lr': 6.26749347996558e-05, 'layer1': 441, 'layer2': 327, 'layer3': 459}. Best is trial 137 with value: 0.8979080367540411.

Escherichia_Coli | Ceftriaxone | Optuna:  98%|█████████▊| 196/200 [8:43:17<10:13, 153.39s/it, best=0.898][A
Escherichia_Coli | Ceftriaxone | Optuna:  98%|█████████▊| 196/200 [8:43:17<10:13, 153.39s/it, best=0.898][A[I 2026-02-28 07:53:39,414] Trial 35 finished with value: 0.825545300187693 and parameters: {'activation': 'logistic', 'solver': 'adam', 'lr': 2.6979987468263632e-05, 'layer1': 222, 'layer2': 288, 'layer3': 462}. Best is trial 31 with value: 0.866367214803268.
Pseudomonas_Aeruginosa | DirectMulti | Optuna:  18%|█▊        | 36/200 [57:25<3:50:25, 84.30s/it, best=0.866] Pseudomonas_Aeruginosa | DirectMulti | Optuna:  18%|█▊        | 36/200 [57:25<3:50:25, 84.30s/it, best=0.866]/export/usuarios01/egarroyo/MALDI_for_AMR_prediction/venv/lib/python3.13/site-packages/sklearn/model_selection/_split.py:813: UserWarning: The least populated class in y has only 4 members, which is less than n_splits=5.
  warnings.warn(
[I 2026-02-28 07:53:43,614] Trial 192 finished with value: 0.926130261689608 and parameters: {'activation': 'identity', 'solver': 'adam', 'lr': 0.0006241701695935746, 'layer1': 442, 'layer2': 99, 'layer3': 263}. Best is trial 77 with value: 0.9283869597728589.

Staphylococcus_Aureus | Fusidic acid | Optuna:  96%|█████████▋| 193/200 [5:12:52<13:19, 114.19s/it, best=0.928][A
Staphylococcus_Aureus | Fusidic acid | Optuna:  96%|█████████▋| 193/200 [5:12:52<13:19, 114.19s/it, best=0.928][A[I 2026-02-28 07:53:53,859] Trial 128 finished with value: 0.9816325427468247 and parameters: {'activation': 'tanh', 'solver': 'adam', 'lr': 0.00041426333483134657, 'layer1': 259, 'layer2': 258, 'layer3': 110}. Best is trial 119 with value: 0.983615836127451.

Klebsiella_Pneumoniae | Meropenem | Optuna:  64%|██████▍   | 129/200 [1:54:34<55:50, 47.19s/it, best=0.984][A
Klebsiella_Pneumoniae | Meropenem | Optuna:  64%|██████▍   | 129/200 [1:54:34<55:50, 47.19s/it, best=0.984][A[I 2026-02-28 07:54:45,547] Trial 129 finished with value: 0.9811622022340615 and parameters: {'activation': 'tanh', 'solver': 'adam', 'lr': 0.0005424948565577328, 'layer1': 269, 'layer2': 224, 'layer3': 76}. Best is trial 119 with value: 0.983615836127451.

Klebsiella_Pneumoniae | Meropenem | Optuna:  65%|██████▌   | 130/200 [1:55:26<56:37, 48.54s/it, best=0.984][A
Klebsiella_Pneumoniae | Meropenem | Optuna:  65%|██████▌   | 130/200 [1:55:26<56:37, 48.54s/it, best=0.984][A[I 2026-02-28 07:55:24,071] Trial 193 finished with value: 0.9222164888225164 and parameters: {'activation': 'identity', 'solver': 'adam', 'lr': 0.0015793320030681865, 'layer1': 382, 'layer2': 313, 'layer3': 259}. Best is trial 77 with value: 0.9283869597728589.

Staphylococcus_Aureus | Fusidic acid | Optuna:  97%|█████████▋| 194/200 [5:14:33<11:00, 110.07s/it, best=0.928][A
Staphylococcus_Aureus | Fusidic acid | Optuna:  97%|█████████▋| 194/200 [5:14:33<11:00, 110.07s/it, best=0.928][A[I 2026-02-28 07:55:33,004] Trial 36 finished with value: 0.8606981659881889 and parameters: {'activation': 'relu', 'solver': 'adam', 'lr': 0.0021642628848863765, 'layer1': 470, 'layer2': 250, 'layer3': 468}. Best is trial 31 with value: 0.866367214803268.
Pseudomonas_Aeruginosa | DirectMulti | Optuna:  18%|█▊        | 37/200 [59:19<4:12:53, 93.09s/it, best=0.866]Pseudomonas_Aeruginosa | DirectMulti | Optuna:  18%|█▊        | 37/200 [59:19<4:12:53, 93.09s/it, best=0.866]/export/usuarios01/egarroyo/MALDI_for_AMR_prediction/venv/lib/python3.13/site-packages/sklearn/model_selection/_split.py:813: UserWarning: The least populated class in y has only 4 members, which is less than n_splits=5.
  warnings.warn(
[I 2026-02-28 07:55:34,944] Trial 130 finished with value: 0.9811631990793719 and parameters: {'activation': 'tanh', 'solver': 'adam', 'lr': 0.0011632030641940945, 'layer1': 244, 'layer2': 296, 'layer3': 139}. Best is trial 119 with value: 0.983615836127451.

Klebsiella_Pneumoniae | Meropenem | Optuna:  66%|██████▌   | 131/200 [1:56:15<56:06, 48.79s/it, best=0.984][A
Klebsiella_Pneumoniae | Meropenem | Optuna:  66%|██████▌   | 131/200 [1:56:15<56:06, 48.79s/it, best=0.984][A[I 2026-02-28 07:56:04,319] Trial 196 finished with value: 0.8916720061220691 and parameters: {'activation': 'relu', 'solver': 'adam', 'lr': 3.4186702309730846e-05, 'layer1': 435, 'layer2': 335, 'layer3': 483}. Best is trial 137 with value: 0.8979080367540411.

Escherichia_Coli | Ceftriaxone | Optuna:  98%|█████████▊| 197/200 [8:46:05<07:53, 157.90s/it, best=0.898][A
Escherichia_Coli | Ceftriaxone | Optuna:  98%|█████████▊| 197/200 [8:46:05<07:53, 157.90s/it, best=0.898][A[I 2026-02-28 07:56:34,515] Trial 131 finished with value: 0.9811045856733929 and parameters: {'activation': 'tanh', 'solver': 'adam', 'lr': 0.0007787463854287708, 'layer1': 293, 'layer2': 274, 'layer3': 93}. Best is trial 119 with value: 0.983615836127451.

Klebsiella_Pneumoniae | Meropenem | Optuna:  66%|██████▌   | 132/200 [1:57:15<58:57, 52.03s/it, best=0.984][A
Klebsiella_Pneumoniae | Meropenem | Optuna:  66%|██████▌   | 132/200 [1:57:15<58:57, 52.03s/it, best=0.984][A[I 2026-02-28 07:57:01,505] Trial 194 finished with value: 0.925170227565985 and parameters: {'activation': 'identity', 'solver': 'adam', 'lr': 0.000539256426483579, 'layer1': 454, 'layer2': 114, 'layer3': 276}. Best is trial 77 with value: 0.9283869597728589.

Staphylococcus_Aureus | Fusidic acid | Optuna:  98%|█████████▊| 195/200 [5:16:10<08:51, 106.28s/it, best=0.928][A
Staphylococcus_Aureus | Fusidic acid | Optuna:  98%|█████████▊| 195/200 [5:16:10<08:51, 106.28s/it, best=0.928][A[I 2026-02-28 07:57:31,323] Trial 132 finished with value: 0.981609557620545 and parameters: {'activation': 'tanh', 'solver': 'adam', 'lr': 0.00033721773314588326, 'layer1': 218, 'layer2': 287, 'layer3': 473}. Best is trial 119 with value: 0.983615836127451.

Klebsiella_Pneumoniae | Meropenem | Optuna:  66%|██████▋   | 133/200 [1:58:11<59:41, 53.46s/it, best=0.984][A
Klebsiella_Pneumoniae | Meropenem | Optuna:  66%|██████▋   | 133/200 [1:58:11<59:41, 53.46s/it, best=0.984][A[I 2026-02-28 07:57:43,760] Trial 37 finished with value: 0.863571362877113 and parameters: {'activation': 'identity', 'solver': 'adam', 'lr': 7.78411497285345e-05, 'layer1': 398, 'layer2': 476, 'layer3': 497}. Best is trial 31 with value: 0.866367214803268.
Pseudomonas_Aeruginosa | DirectMulti | Optuna:  19%|█▉        | 38/200 [1:01:30<4:41:50, 104.39s/it, best=0.866]Pseudomonas_Aeruginosa | DirectMulti | Optuna:  19%|█▉        | 38/200 [1:01:30<4:41:50, 104.39s/it, best=0.866]/export/usuarios01/egarroyo/MALDI_for_AMR_prediction/venv/lib/python3.13/site-packages/sklearn/model_selection/_split.py:813: UserWarning: The least populated class in y has only 4 members, which is less than n_splits=5.
  warnings.warn(
[I 2026-02-28 07:58:17,260] Trial 38 finished with value: 0.8269600086534318 and parameters: {'activation': 'identity', 'solver': 'sgd', 'lr': 0.0053539491895446, 'layer1': 492, 'layer2': 192, 'layer3': 441}. Best is trial 31 with value: 0.866367214803268.
Pseudomonas_Aeruginosa | DirectMulti | Optuna:  20%|█▉        | 39/200 [1:02:03<3:43:02, 83.12s/it, best=0.866] Pseudomonas_Aeruginosa | DirectMulti | Optuna:  20%|█▉        | 39/200 [1:02:03<3:43:02, 83.12s/it, best=0.866]/export/usuarios01/egarroyo/MALDI_for_AMR_prediction/venv/lib/python3.13/site-packages/sklearn/model_selection/_split.py:813: UserWarning: The least populated class in y has only 4 members, which is less than n_splits=5.
  warnings.warn(
[I 2026-02-28 07:58:23,666] Trial 133 finished with value: 0.9807947585157585 and parameters: {'activation': 'tanh', 'solver': 'adam', 'lr': 0.000672962351290624, 'layer1': 234, 'layer2': 112, 'layer3': 453}. Best is trial 119 with value: 0.983615836127451.

Klebsiella_Pneumoniae | Meropenem | Optuna:  67%|██████▋   | 134/200 [1:59:04<58:26, 53.13s/it, best=0.984][A
Klebsiella_Pneumoniae | Meropenem | Optuna:  67%|██████▋   | 134/200 [1:59:04<58:26, 53.13s/it, best=0.984][A[I 2026-02-28 07:58:27,115] Trial 197 finished with value: 0.8948082983803054 and parameters: {'activation': 'relu', 'solver': 'adam', 'lr': 7.899383175020813e-05, 'layer1': 452, 'layer2': 344, 'layer3': 453}. Best is trial 137 with value: 0.8979080367540411.

Escherichia_Coli | Ceftriaxone | Optuna:  99%|█████████▉| 198/200 [8:48:28<05:06, 153.37s/it, best=0.898][A
Escherichia_Coli | Ceftriaxone | Optuna:  99%|█████████▉| 198/200 [8:48:28<05:06, 153.37s/it, best=0.898][A[I 2026-02-28 07:58:51,864] Trial 195 finished with value: 0.9255493537861981 and parameters: {'activation': 'identity', 'solver': 'adam', 'lr': 8.233697414505171e-05, 'layer1': 479, 'layer2': 131, 'layer3': 261}. Best is trial 77 with value: 0.9283869597728589.

Staphylococcus_Aureus | Fusidic acid | Optuna:  98%|█████████▊| 196/200 [5:18:01<07:10, 107.50s/it, best=0.928][A
Staphylococcus_Aureus | Fusidic acid | Optuna:  98%|█████████▊| 196/200 [5:18:01<07:10, 107.50s/it, best=0.928][A[I 2026-02-28 07:59:15,437] Trial 134 finished with value: 0.9814881604097755 and parameters: {'activation': 'tanh', 'solver': 'adam', 'lr': 0.0009234471712810392, 'layer1': 271, 'layer2': 238, 'layer3': 373}. Best is trial 119 with value: 0.983615836127451.

Klebsiella_Pneumoniae | Meropenem | Optuna:  68%|██████▊   | 135/200 [1:59:55<57:06, 52.72s/it, best=0.984][A
Klebsiella_Pneumoniae | Meropenem | Optuna:  68%|██████▊   | 135/200 [1:59:55<57:06, 52.72s/it, best=0.984][A[I 2026-02-28 08:00:06,109] Trial 135 finished with value: 0.981520753057873 and parameters: {'activation': 'tanh', 'solver': 'adam', 'lr': 0.0004298429874860776, 'layer1': 256, 'layer2': 148, 'layer3': 124}. Best is trial 119 with value: 0.983615836127451.

Klebsiella_Pneumoniae | Meropenem | Optuna:  68%|██████▊   | 136/200 [2:00:46<55:34, 52.11s/it, best=0.984][A
Klebsiella_Pneumoniae | Meropenem | Optuna:  68%|██████▊   | 136/200 [2:00:46<55:34, 52.11s/it, best=0.984][A[I 2026-02-28 08:00:27,346] Trial 196 finished with value: 0.923628785241784 and parameters: {'activation': 'identity', 'solver': 'adam', 'lr': 0.0001298527317472424, 'layer1': 395, 'layer2': 105, 'layer3': 87}. Best is trial 77 with value: 0.9283869597728589.

Staphylococcus_Aureus | Fusidic acid | Optuna:  98%|█████████▊| 197/200 [5:19:36<05:11, 103.90s/it, best=0.928][A
Staphylococcus_Aureus | Fusidic acid | Optuna:  98%|█████████▊| 197/200 [5:19:36<05:11, 103.90s/it, best=0.928][A[I 2026-02-28 08:01:00,231] Trial 39 finished with value: 0.8524882748491256 and parameters: {'activation': 'tanh', 'solver': 'adam', 'lr': 9.07330211440507e-06, 'layer1': 282, 'layer2': 345, 'layer3': 403}. Best is trial 31 with value: 0.866367214803268.
Pseudomonas_Aeruginosa | DirectMulti | Optuna:  20%|██        | 40/200 [1:04:46<4:45:32, 107.08s/it, best=0.866]Pseudomonas_Aeruginosa | DirectMulti | Optuna:  20%|██        | 40/200 [1:04:46<4:45:32, 107.08s/it, best=0.866]/export/usuarios01/egarroyo/MALDI_for_AMR_prediction/venv/lib/python3.13/site-packages/sklearn/model_selection/_split.py:813: UserWarning: The least populated class in y has only 4 members, which is less than n_splits=5.
  warnings.warn(
[I 2026-02-28 08:01:10,313] Trial 136 finished with value: 0.981628931642302 and parameters: {'activation': 'tanh', 'solver': 'adam', 'lr': 0.00018845607753912046, 'layer1': 283, 'layer2': 299, 'layer3': 321}. Best is trial 119 with value: 0.983615836127451.

Klebsiella_Pneumoniae | Meropenem | Optuna:  68%|██████▊   | 137/200 [2:01:50<58:31, 55.73s/it, best=0.984][A
Klebsiella_Pneumoniae | Meropenem | Optuna:  68%|██████▊   | 137/200 [2:01:50<58:31, 55.73s/it, best=0.984][A[I 2026-02-28 08:01:10,870] Trial 198 finished with value: 0.8943497753145934 and parameters: {'activation': 'relu', 'solver': 'adam', 'lr': 5.048557166415233e-05, 'layer1': 407, 'layer2': 263, 'layer3': 24}. Best is trial 137 with value: 0.8979080367540411.

Escherichia_Coli | Ceftriaxone | Optuna: 100%|█████████▉| 199/200 [8:51:12<02:36, 156.48s/it, best=0.898][A
Escherichia_Coli | Ceftriaxone | Optuna: 100%|█████████▉| 199/200 [8:51:12<02:36, 156.48s/it, best=0.898][A[I 2026-02-28 08:02:13,203] Trial 137 finished with value: 0.9789148264911024 and parameters: {'activation': 'tanh', 'solver': 'adam', 'lr': 0.0002635553872020824, 'layer1': 490, 'layer2': 319, 'layer3': 100}. Best is trial 119 with value: 0.983615836127451.

Klebsiella_Pneumoniae | Meropenem | Optuna:  69%|██████▉   | 138/200 [2:02:53<59:48, 57.88s/it, best=0.984][A
Klebsiella_Pneumoniae | Meropenem | Optuna:  69%|██████▉   | 138/200 [2:02:53<59:48, 57.88s/it, best=0.984][A[I 2026-02-28 08:02:24,090] Trial 197 finished with value: 0.9283093200029985 and parameters: {'activation': 'identity', 'solver': 'adam', 'lr': 0.00010653605165152839, 'layer1': 408, 'layer2': 178, 'layer3': 94}. Best is trial 77 with value: 0.9283869597728589.

Staphylococcus_Aureus | Fusidic acid | Optuna:  99%|█████████▉| 198/200 [5:21:33<03:35, 107.75s/it, best=0.928][A
Staphylococcus_Aureus | Fusidic acid | Optuna:  99%|█████████▉| 198/200 [5:21:33<03:35, 107.75s/it, best=0.928][A[I 2026-02-28 08:02:34,309] Trial 40 finished with value: 0.858800506584591 and parameters: {'activation': 'relu', 'solver': 'adam', 'lr': 0.0009199573552832457, 'layer1': 421, 'layer2': 223, 'layer3': 363}. Best is trial 31 with value: 0.866367214803268.
Pseudomonas_Aeruginosa | DirectMulti | Optuna:  20%|██        | 41/200 [1:06:20<4:33:25, 103.18s/it, best=0.866]Pseudomonas_Aeruginosa | DirectMulti | Optuna:  20%|██        | 41/200 [1:06:20<4:33:25, 103.18s/it, best=0.866]/export/usuarios01/egarroyo/MALDI_for_AMR_prediction/venv/lib/python3.13/site-packages/sklearn/model_selection/_split.py:813: UserWarning: The least populated class in y has only 4 members, which is less than n_splits=5.
  warnings.warn(
