Klebsiella_Pneumoniae | DirectMulti | Optuna:  13%|█▎        | 26/200 [46:32<4:42:44, 97.50s/it, best=0.922]Klebsiella_Pneumoniae | DirectMulti | Optuna:  13%|█▎        | 26/200 [46:32<4:42:44, 97.50s/it, best=0.922][I 2026-02-28 14:12:57,944] Trial 187 finished with value: 0.8831778420666794 and parameters: {'activation': 'identity', 'solver': 'adam', 'lr': 0.0002718998007994728, 'layer1': 301, 'layer2': 109, 'layer3': 358}. Best is trial 8 with value: 0.8879562150966016.
Staphylococcus_Aureus | LPS | Optuna:  94%|█████████▍| 188/200 [6:06:44<18:48, 94.03s/it, best=0.888]Staphylococcus_Aureus | LPS | Optuna:  94%|█████████▍| 188/200 [6:06:44<18:48, 94.03s/it, best=0.888][I 2026-02-28 14:13:21,162] Trial 176 finished with value: 0.9144917160982351 and parameters: {'activation': 'relu', 'solver': 'adam', 'lr': 0.0005078885450881427, 'layer1': 356, 'layer2': 295, 'layer3': 139}. Best is trial 175 with value: 0.9170284245835123.

Escherichia_Coli | Piperacillin-Tazobactam | Optuna:  88%|████████▊ | 177/200 [6:09:13<48:48, 127.32s/it, best=0.917][A
Escherichia_Coli | Piperacillin-Tazobactam | Optuna:  88%|████████▊ | 177/200 [6:09:13<48:48, 127.32s/it, best=0.917][A[I 2026-02-28 14:14:20,391] Trial 188 finished with value: 0.8856538514392408 and parameters: {'activation': 'identity', 'solver': 'adam', 'lr': 0.00020200800005799584, 'layer1': 82, 'layer2': 127, 'layer3': 368}. Best is trial 8 with value: 0.8879562150966016.
Staphylococcus_Aureus | LPS | Optuna:  94%|█████████▍| 189/200 [6:08:06<16:36, 90.55s/it, best=0.888]Staphylococcus_Aureus | LPS | Optuna:  94%|█████████▍| 189/200 [6:08:06<16:36, 90.55s/it, best=0.888][I 2026-02-28 14:14:23,030] Trial 26 finished with value: 0.8718370088435664 and parameters: {'activation': 'identity', 'solver': 'sgd', 'lr': 0.0002525077804195773, 'layer1': 390, 'layer2': 113, 'layer3': 303}. Best is trial 20 with value: 0.9222781385346849.
Klebsiella_Pneumoniae | DirectMulti | Optuna:  14%|█▎        | 27/200 [48:08<4:40:11, 97.17s/it, best=0.922]Klebsiella_Pneumoniae | DirectMulti | Optuna:  14%|█▎        | 27/200 [48:08<4:40:11, 97.17s/it, best=0.922][I 2026-02-28 14:15:09,956] Trial 177 finished with value: 0.9124688258046001 and parameters: {'activation': 'relu', 'solver': 'adam', 'lr': 0.00042336394808384836, 'layer1': 374, 'layer2': 278, 'layer3': 129}. Best is trial 175 with value: 0.9170284245835123.

Escherichia_Coli | Piperacillin-Tazobactam | Optuna:  89%|████████▉ | 178/200 [6:11:02<44:38, 121.76s/it, best=0.917][A
Escherichia_Coli | Piperacillin-Tazobactam | Optuna:  89%|████████▉ | 178/200 [6:11:02<44:38, 121.76s/it, best=0.917][A[I 2026-02-28 14:15:32,659] Trial 189 finished with value: 0.8817844164501765 and parameters: {'activation': 'tanh', 'solver': 'adam', 'lr': 0.00036289496226094746, 'layer1': 262, 'layer2': 99, 'layer3': 346}. Best is trial 8 with value: 0.8879562150966016.
Staphylococcus_Aureus | LPS | Optuna:  95%|█████████▌| 190/200 [6:09:19<14:10, 85.07s/it, best=0.888]Staphylococcus_Aureus | LPS | Optuna:  95%|█████████▌| 190/200 [6:09:19<14:10, 85.07s/it, best=0.888][I 2026-02-28 14:15:52,432] Trial 27 finished with value: 0.8991002414355471 and parameters: {'activation': 'tanh', 'solver': 'adam', 'lr': 0.002526204652054459, 'layer1': 438, 'layer2': 348, 'layer3': 455}. Best is trial 20 with value: 0.9222781385346849.
Klebsiella_Pneumoniae | DirectMulti | Optuna:  14%|█▍        | 28/200 [49:38<4:31:52, 94.84s/it, best=0.922]Klebsiella_Pneumoniae | DirectMulti | Optuna:  14%|█▍        | 28/200 [49:38<4:31:52, 94.84s/it, best=0.922][I 2026-02-28 14:16:23,564] Trial 28 finished with value: 0.8702461473038209 and parameters: {'activation': 'logistic', 'solver': 'adam', 'lr': 5.520350166411609e-05, 'layer1': 366, 'layer2': 233, 'layer3': 261}. Best is trial 20 with value: 0.9222781385346849.
Klebsiella_Pneumoniae | DirectMulti | Optuna:  14%|█▍        | 29/200 [50:09<3:35:49, 75.73s/it, best=0.922]Klebsiella_Pneumoniae | DirectMulti | Optuna:  14%|█▍        | 29/200 [50:09<3:35:49, 75.73s/it, best=0.922][I 2026-02-28 14:16:45,808] Trial 29 finished with value: 0.8702461473038209 and parameters: {'activation': 'logistic', 'solver': 'sgd', 'lr': 0.0006395569083988777, 'layer1': 233, 'layer2': 315, 'layer3': 360}. Best is trial 20 with value: 0.9222781385346849.
Klebsiella_Pneumoniae | DirectMulti | Optuna:  15%|█▌        | 30/200 [50:31<2:49:06, 59.68s/it, best=0.922]Klebsiella_Pneumoniae | DirectMulti | Optuna:  15%|█▌        | 30/200 [50:31<2:49:06, 59.68s/it, best=0.922][I 2026-02-28 14:17:04,742] Trial 190 finished with value: 0.8856678417488663 and parameters: {'activation': 'identity', 'solver': 'adam', 'lr': 0.000636084804365218, 'layer1': 170, 'layer2': 166, 'layer3': 319}. Best is trial 8 with value: 0.8879562150966016.
Staphylococcus_Aureus | LPS | Optuna:  96%|█████████▌| 191/200 [6:10:51<13:04, 87.17s/it, best=0.888]Staphylococcus_Aureus | LPS | Optuna:  96%|█████████▌| 191/200 [6:10:51<13:04, 87.17s/it, best=0.888][I 2026-02-28 14:17:33,359] Trial 178 finished with value: 0.9147293300828896 and parameters: {'activation': 'relu', 'solver': 'adam', 'lr': 0.0003384686470488253, 'layer1': 354, 'layer2': 430, 'layer3': 325}. Best is trial 175 with value: 0.9170284245835123.

Escherichia_Coli | Piperacillin-Tazobactam | Optuna:  90%|████████▉ | 179/200 [6:13:26<44:53, 128.25s/it, best=0.917][A
Escherichia_Coli | Piperacillin-Tazobactam | Optuna:  90%|████████▉ | 179/200 [6:13:26<44:53, 128.25s/it, best=0.917][A[I 2026-02-28 14:17:58,703] Trial 30 finished with value: 0.9208798782044985 and parameters: {'activation': 'identity', 'solver': 'adam', 'lr': 0.00021971485412517698, 'layer1': 175, 'layer2': 465, 'layer3': 215}. Best is trial 20 with value: 0.9222781385346849.
Klebsiella_Pneumoniae | DirectMulti | Optuna:  16%|█▌        | 31/200 [51:44<2:59:16, 63.65s/it, best=0.922]Klebsiella_Pneumoniae | DirectMulti | Optuna:  16%|█▌        | 31/200 [51:44<2:59:16, 63.65s/it, best=0.922][I 2026-02-28 14:18:24,117] Trial 191 finished with value: 0.8838169535145834 and parameters: {'activation': 'identity', 'solver': 'adam', 'lr': 0.0001577256140179316, 'layer1': 104, 'layer2': 470, 'layer3': 59}. Best is trial 8 with value: 0.8879562150966016.
Staphylococcus_Aureus | LPS | Optuna:  96%|█████████▌| 192/200 [6:12:10<11:18, 84.83s/it, best=0.888]Staphylococcus_Aureus | LPS | Optuna:  96%|█████████▌| 192/200 [6:12:10<11:18, 84.83s/it, best=0.888][I 2026-02-28 14:19:17,694] Trial 31 finished with value: 0.9202378762478418 and parameters: {'activation': 'identity', 'solver': 'adam', 'lr': 0.00019868646086599633, 'layer1': 151, 'layer2': 470, 'layer3': 205}. Best is trial 20 with value: 0.9222781385346849.
Klebsiella_Pneumoniae | DirectMulti | Optuna:  16%|█▌        | 32/200 [53:03<3:11:05, 68.25s/it, best=0.922]Klebsiella_Pneumoniae | DirectMulti | Optuna:  16%|█▌        | 32/200 [53:03<3:11:05, 68.25s/it, best=0.922][I 2026-02-28 14:19:52,472] Trial 179 finished with value: 0.9167279981324775 and parameters: {'activation': 'relu', 'solver': 'adam', 'lr': 0.00027796215395941106, 'layer1': 342, 'layer2': 306, 'layer3': 483}. Best is trial 175 with value: 0.9170284245835123.

Escherichia_Coli | Piperacillin-Tazobactam | Optuna:  90%|█████████ | 180/200 [6:15:45<43:50, 131.51s/it, best=0.917][A
Escherichia_Coli | Piperacillin-Tazobactam | Optuna:  90%|█████████ | 180/200 [6:15:45<43:50, 131.51s/it, best=0.917][A[I 2026-02-28 14:20:03,399] Trial 192 finished with value: 0.8830694738645379 and parameters: {'activation': 'identity', 'solver': 'adam', 'lr': 8.870910772307705e-05, 'layer1': 121, 'layer2': 422, 'layer3': 351}. Best is trial 8 with value: 0.8879562150966016.
Staphylococcus_Aureus | LPS | Optuna:  96%|█████████▋| 193/200 [6:13:49<10:24, 89.17s/it, best=0.888]Staphylococcus_Aureus | LPS | Optuna:  96%|█████████▋| 193/200 [6:13:49<10:24, 89.17s/it, best=0.888][I 2026-02-28 14:20:34,356] Trial 32 finished with value: 0.9202157554473389 and parameters: {'activation': 'identity', 'solver': 'adam', 'lr': 7.90172601603508e-05, 'layer1': 179, 'layer2': 424, 'layer3': 194}. Best is trial 20 with value: 0.9222781385346849.
Klebsiella_Pneumoniae | DirectMulti | Optuna:  16%|█▋        | 33/200 [54:20<3:16:59, 70.77s/it, best=0.922]Klebsiella_Pneumoniae | DirectMulti | Optuna:  16%|█▋        | 33/200 [54:20<3:16:59, 70.77s/it, best=0.922][I 2026-02-28 14:21:45,505] Trial 193 finished with value: 0.8839979951924132 and parameters: {'activation': 'identity', 'solver': 'adam', 'lr': 0.00011747286032969807, 'layer1': 140, 'layer2': 417, 'layer3': 337}. Best is trial 8 with value: 0.8879562150966016.
Staphylococcus_Aureus | LPS | Optuna:  97%|█████████▋| 194/200 [6:15:31<09:18, 93.05s/it, best=0.888]Staphylococcus_Aureus | LPS | Optuna:  97%|█████████▋| 194/200 [6:15:31<09:18, 93.05s/it, best=0.888][I 2026-02-28 14:22:16,984] Trial 180 finished with value: 0.9148729649372147 and parameters: {'activation': 'relu', 'solver': 'adam', 'lr': 0.00036502889244534645, 'layer1': 363, 'layer2': 299, 'layer3': 482}. Best is trial 175 with value: 0.9170284245835123.

Escherichia_Coli | Piperacillin-Tazobactam | Optuna:  90%|█████████ | 181/200 [6:18:09<42:52, 135.41s/it, best=0.917][A
Escherichia_Coli | Piperacillin-Tazobactam | Optuna:  90%|█████████ | 181/200 [6:18:09<42:52, 135.41s/it, best=0.917][A[I 2026-02-28 14:22:18,625] Trial 33 finished with value: 0.920725622714232 and parameters: {'activation': 'identity', 'solver': 'adam', 'lr': 0.0004912908705855878, 'layer1': 278, 'layer2': 460, 'layer3': 132}. Best is trial 20 with value: 0.9222781385346849.
Klebsiella_Pneumoniae | DirectMulti | Optuna:  17%|█▋        | 34/200 [56:04<3:43:36, 80.82s/it, best=0.922]Klebsiella_Pneumoniae | DirectMulti | Optuna:  17%|█▋        | 34/200 [56:04<3:43:36, 80.82s/it, best=0.922][I 2026-02-28 14:23:20,235] Trial 194 finished with value: 0.8858863829105074 and parameters: {'activation': 'identity', 'solver': 'adam', 'lr': 0.00019108490779708542, 'layer1': 156, 'layer2': 401, 'layer3': 326}. Best is trial 8 with value: 0.8879562150966016.
Staphylococcus_Aureus | LPS | Optuna:  98%|█████████▊| 195/200 [6:17:06<07:47, 93.55s/it, best=0.888]Staphylococcus_Aureus | LPS | Optuna:  98%|█████████▊| 195/200 [6:17:06<07:47, 93.55s/it, best=0.888][I 2026-02-28 14:23:55,917] Trial 34 finished with value: 0.92110873778858 and parameters: {'activation': 'identity', 'solver': 'adam', 'lr': 0.0014136800611986118, 'layer1': 248, 'layer2': 369, 'layer3': 384}. Best is trial 20 with value: 0.9222781385346849.
Klebsiella_Pneumoniae | DirectMulti | Optuna:  18%|█▊        | 35/200 [57:41<3:55:50, 85.76s/it, best=0.922]Klebsiella_Pneumoniae | DirectMulti | Optuna:  18%|█▊        | 35/200 [57:41<3:55:50, 85.76s/it, best=0.922][I 2026-02-28 14:24:17,052] Trial 181 finished with value: 0.9141857672713799 and parameters: {'activation': 'relu', 'solver': 'adam', 'lr': 0.00021301793299691104, 'layer1': 341, 'layer2': 317, 'layer3': 449}. Best is trial 175 with value: 0.9170284245835123.

Escherichia_Coli | Piperacillin-Tazobactam | Optuna:  91%|█████████ | 182/200 [6:20:09<39:14, 130.81s/it, best=0.917][A
Escherichia_Coli | Piperacillin-Tazobactam | Optuna:  91%|█████████ | 182/200 [6:20:09<39:14, 130.81s/it, best=0.917][A[I 2026-02-28 14:24:53,360] Trial 195 finished with value: 0.886370277385381 and parameters: {'activation': 'identity', 'solver': 'adam', 'lr': 0.00023536637418702575, 'layer1': 130, 'layer2': 429, 'layer3': 359}. Best is trial 8 with value: 0.8879562150966016.
Staphylococcus_Aureus | LPS | Optuna:  98%|█████████▊| 196/200 [6:18:39<06:13, 93.43s/it, best=0.888]Staphylococcus_Aureus | LPS | Optuna:  98%|█████████▊| 196/200 [6:18:39<06:13, 93.43s/it, best=0.888][I 2026-02-28 14:25:17,124] Trial 35 finished with value: 0.9196447284917433 and parameters: {'activation': 'logistic', 'solver': 'adam', 'lr': 0.0010073916079362181, 'layer1': 243, 'layer2': 373, 'layer3': 381}. Best is trial 20 with value: 0.9222781385346849.
Klebsiella_Pneumoniae | DirectMulti | Optuna:  18%|█▊        | 36/200 [59:02<3:50:40, 84.40s/it, best=0.922]Klebsiella_Pneumoniae | DirectMulti | Optuna:  18%|█▊        | 36/200 [59:02<3:50:40, 84.40s/it, best=0.922][I 2026-02-28 14:25:33,410] Trial 196 finished with value: 0.8031933171789166 and parameters: {'activation': 'identity', 'solver': 'sgd', 'lr': 0.0004704374492257498, 'layer1': 281, 'layer2': 139, 'layer3': 375}. Best is trial 8 with value: 0.8879562150966016.
Staphylococcus_Aureus | LPS | Optuna:  98%|█████████▊| 197/200 [6:19:19<03:52, 77.41s/it, best=0.888]Staphylococcus_Aureus | LPS | Optuna:  98%|█████████▊| 197/200 [6:19:19<03:52, 77.41s/it, best=0.888][I 2026-02-28 14:26:22,449] Trial 182 finished with value: 0.916224953674768 and parameters: {'activation': 'relu', 'solver': 'adam', 'lr': 0.000300959292105541, 'layer1': 350, 'layer2': 306, 'layer3': 147}. Best is trial 175 with value: 0.9170284245835123.

Escherichia_Coli | Piperacillin-Tazobactam | Optuna:  92%|█████████▏| 183/200 [6:22:15<36:36, 129.18s/it, best=0.917][A
Escherichia_Coli | Piperacillin-Tazobactam | Optuna:  92%|█████████▏| 183/200 [6:22:15<36:36, 129.18s/it, best=0.917][A[I 2026-02-28 14:26:45,534] Trial 197 finished with value: 0.8827811593230489 and parameters: {'activation': 'relu', 'solver': 'adam', 'lr': 0.0003096887225603634, 'layer1': 114, 'layer2': 121, 'layer3': 305}. Best is trial 8 with value: 0.8879562150966016.
Staphylococcus_Aureus | LPS | Optuna:  99%|█████████▉| 198/200 [6:20:31<02:31, 75.83s/it, best=0.888]Staphylococcus_Aureus | LPS | Optuna:  99%|█████████▉| 198/200 [6:20:31<02:31, 75.83s/it, best=0.888][I 2026-02-28 14:26:47,268] Trial 36 finished with value: 0.9176804682665797 and parameters: {'activation': 'relu', 'solver': 'adam', 'lr': 0.0021537620334372404, 'layer1': 285, 'layer2': 305, 'layer3': 332}. Best is trial 20 with value: 0.9222781385346849.
Klebsiella_Pneumoniae | DirectMulti | Optuna:  18%|█▊        | 37/200 [1:00:32<3:53:57, 86.12s/it, best=0.922]Klebsiella_Pneumoniae | DirectMulti | Optuna:  18%|█▊        | 37/200 [1:00:32<3:53:57, 86.12s/it, best=0.922][I 2026-02-28 14:28:06,127] Trial 198 finished with value: 0.8860797949632954 and parameters: {'activation': 'identity', 'solver': 'adam', 'lr': 0.00038322159672890706, 'layer1': 76, 'layer2': 93, 'layer3': 292}. Best is trial 8 with value: 0.8879562150966016.
Staphylococcus_Aureus | LPS | Optuna: 100%|█████████▉| 199/200 [6:21:52<01:17, 77.26s/it, best=0.888]Staphylococcus_Aureus | LPS | Optuna: 100%|█████████▉| 199/200 [6:21:52<01:17, 77.26s/it, best=0.888][I 2026-02-28 14:28:20,222] Trial 183 finished with value: 0.9130761655040439 and parameters: {'activation': 'relu', 'solver': 'adam', 'lr': 0.00045533419693682275, 'layer1': 332, 'layer2': 307, 'layer3': 467}. Best is trial 175 with value: 0.9170284245835123.

Escherichia_Coli | Piperacillin-Tazobactam | Optuna:  92%|█████████▏| 184/200 [6:24:12<33:32, 125.76s/it, best=0.917][A
Escherichia_Coli | Piperacillin-Tazobactam | Optuna:  92%|█████████▏| 184/200 [6:24:12<33:32, 125.76s/it, best=0.917][A[I 2026-02-28 14:28:26,527] Trial 37 finished with value: 0.9200939125515785 and parameters: {'activation': 'identity', 'solver': 'adam', 'lr': 0.0015613941341811332, 'layer1': 350, 'layer2': 320, 'layer3': 433}. Best is trial 20 with value: 0.9222781385346849.
Klebsiella_Pneumoniae | DirectMulti | Optuna:  19%|█▉        | 38/200 [1:02:12<4:03:10, 90.06s/it, best=0.922]Klebsiella_Pneumoniae | DirectMulti | Optuna:  19%|█▉        | 38/200 [1:02:12<4:03:10, 90.06s/it, best=0.922][I 2026-02-28 14:29:29,964] Trial 199 finished with value: 0.8838275420615792 and parameters: {'activation': 'identity', 'solver': 'adam', 'lr': 0.00027077644416725725, 'layer1': 309, 'layer2': 110, 'layer3': 344}. Best is trial 8 with value: 0.8879562150966016.
Staphylococcus_Aureus | LPS | Optuna: 100%|██████████| 200/200 [6:23:16<00:00, 79.23s/it, best=0.888]Staphylococcus_Aureus | LPS | Optuna: 100%|██████████| 200/200 [6:23:16<00:00, 79.23s/it, best=0.888]                                                                                                     [Staphylococcus_Aureus | LPS] [OPTUNA DONE] Best CV WF1=0.8880 | params={'activation': 'identity', 'solver': 'adam', 'lr': 0.000828752236376816, 'layer1': 323, 'layer2': 445, 'layer3': 241}
[Staphylococcus_Aureus | LPS] Retraining with validation early stopping (10% split)...
[Staphylococcus_Aureus | LPS] Testing...
[Staphylococcus_Aureus | LPS] [TEST] WF1=0.8969 | ACC=0.9059 | HL=0.0941 | best_val_WF1=0.8970

[Staphylococcus_Aureus] ===== Direct multilabel training =====
[I 2026-02-28 14:29:54,580] A new study created in memory with name: no-name-802f1c01-f01b-48ba-858c-3a5ec25fbf68
Staphylococcus_Aureus | DirectMulti | Optuna:   0%|          | 0/200 [00:00<?, ?it/s][I 2026-02-28 14:29:55,264] Trial 184 finished with value: 0.911844200339407 and parameters: {'activation': 'relu', 'solver': 'adam', 'lr': 0.0002865363589632879, 'layer1': 321, 'layer2': 285, 'layer3': 460}. Best is trial 175 with value: 0.9170284245835123.

Escherichia_Coli | Piperacillin-Tazobactam | Optuna:  92%|█████████▎| 185/200 [6:25:47<29:08, 116.55s/it, best=0.917][A
Escherichia_Coli | Piperacillin-Tazobactam | Optuna:  92%|█████████▎| 185/200 [6:25:47<29:08, 116.55s/it, best=0.917][A[I 2026-02-28 14:30:25,193] Trial 0 finished with value: 0.44607478944569595 and parameters: {'activation': 'logistic', 'solver': 'sgd', 'lr': 1.7073967431528114e-06, 'layer1': 435, 'layer2': 305, 'layer3': 357}. Best is trial 0 with value: 0.44607478944569595.
Staphylococcus_Aureus | DirectMulti | Optuna:   0%|          | 1/200 [00:30<1:41:32, 30.61s/it]Staphylococcus_Aureus | DirectMulti | Optuna:   0%|          | 1/200 [00:30<1:41:32, 30.61s/it, best=0.446][I 2026-02-28 14:30:55,189] Trial 1 finished with value: 0.8016824607776345 and parameters: {'activation': 'logistic', 'solver': 'adam', 'lr': 1.6480446427978994e-05, 'layer1': 267, 'layer2': 222, 'layer3': 152}. Best is trial 1 with value: 0.8016824607776345.
Staphylococcus_Aureus | DirectMulti | Optuna:   1%|          | 2/200 [01:00<1:39:49, 30.25s/it, best=0.446]Staphylococcus_Aureus | DirectMulti | Optuna:   1%|          | 2/200 [01:00<1:39:49, 30.25s/it, best=0.802][I 2026-02-28 14:32:06,448] Trial 185 finished with value: 0.9124277362573938 and parameters: {'activation': 'relu', 'solver': 'adam', 'lr': 0.0006220474475727993, 'layer1': 350, 'layer2': 333, 'layer3': 147}. Best is trial 175 with value: 0.9170284245835123.

Escherichia_Coli | Piperacillin-Tazobactam | Optuna:  93%|█████████▎| 186/200 [6:27:59<28:13, 120.94s/it, best=0.917][A
Escherichia_Coli | Piperacillin-Tazobactam | Optuna:  93%|█████████▎| 186/200 [6:27:59<28:13, 120.94s/it, best=0.917][A[I 2026-02-28 14:32:20,938] Trial 2 finished with value: 0.841994408512735 and parameters: {'activation': 'identity', 'solver': 'adam', 'lr': 6.290644294586145e-06, 'layer1': 262, 'layer2': 300, 'layer3': 32}. Best is trial 2 with value: 0.841994408512735.
Staphylococcus_Aureus | DirectMulti | Optuna:   2%|▏         | 3/200 [02:26<3:02:31, 55.59s/it, best=0.802]Staphylococcus_Aureus | DirectMulti | Optuna:   2%|▏         | 3/200 [02:26<3:02:31, 55.59s/it, best=0.842][I 2026-02-28 14:33:57,638] Trial 186 finished with value: 0.9152323332850063 and parameters: {'activation': 'relu', 'solver': 'adam', 'lr': 0.0003648874783450786, 'layer1': 384, 'layer2': 323, 'layer3': 160}. Best is trial 175 with value: 0.9170284245835123.

Escherichia_Coli | Piperacillin-Tazobactam | Optuna:  94%|█████████▎| 187/200 [6:29:50<25:34, 118.01s/it, best=0.917][A
Escherichia_Coli | Piperacillin-Tazobactam | Optuna:  94%|█████████▎| 187/200 [6:29:50<25:34, 118.01s/it, best=0.917][A[I 2026-02-28 14:34:24,605] Trial 38 finished with value: 0.8647920824717783 and parameters: {'activation': 'identity', 'solver': 'sgd', 'lr': 3.386349758284922e-05, 'layer1': 258, 'layer2': 272, 'layer3': 468}. Best is trial 20 with value: 0.9222781385346849.
Klebsiella_Pneumoniae | DirectMulti | Optuna:  20%|█▉        | 39/200 [1:08:10<7:37:25, 170.47s/it, best=0.922]Klebsiella_Pneumoniae | DirectMulti | Optuna:  20%|█▉        | 39/200 [1:08:10<7:37:25, 170.47s/it, best=0.922][I 2026-02-28 14:35:01,616] Trial 39 finished with value: 0.8712557172447306 and parameters: {'activation': 'relu', 'solver': 'adam', 'lr': 9.07330211440507e-06, 'layer1': 409, 'layer2': 375, 'layer3': 386}. Best is trial 20 with value: 0.9222781385346849.
Klebsiella_Pneumoniae | DirectMulti | Optuna:  20%|██        | 40/200 [1:08:47<5:47:48, 130.43s/it, best=0.922]Klebsiella_Pneumoniae | DirectMulti | Optuna:  20%|██        | 40/200 [1:08:47<5:47:48, 130.43s/it, best=0.922][I 2026-02-28 14:35:50,811] Trial 187 finished with value: 0.9141086900571352 and parameters: {'activation': 'relu', 'solver': 'adam', 'lr': 0.00023859357801629105, 'layer1': 339, 'layer2': 294, 'layer3': 427}. Best is trial 175 with value: 0.9170284245835123.

Escherichia_Coli | Piperacillin-Tazobactam | Optuna:  94%|█████████▍| 188/200 [6:31:43<23:18, 116.56s/it, best=0.917][A
Escherichia_Coli | Piperacillin-Tazobactam | Optuna:  94%|█████████▍| 188/200 [6:31:43<23:18, 116.56s/it, best=0.917][A[I 2026-02-28 14:35:52,901] Trial 40 finished with value: 0.9179115538686153 and parameters: {'activation': 'tanh', 'solver': 'adam', 'lr': 0.0004859782031304953, 'layer1': 328, 'layer2': 415, 'layer3': 354}. Best is trial 20 with value: 0.9222781385346849.
Klebsiella_Pneumoniae | DirectMulti | Optuna:  20%|██        | 41/200 [1:09:38<4:42:43, 106.69s/it, best=0.922]Klebsiella_Pneumoniae | DirectMulti | Optuna:  20%|██        | 41/200 [1:09:38<4:42:43, 106.69s/it, best=0.922][I 2026-02-28 14:36:36,201] Trial 3 finished with value: 0.7970052216461385 and parameters: {'activation': 'relu', 'solver': 'sgd', 'lr': 1.6536937182824424e-05, 'layer1': 57, 'layer2': 345, 'layer3': 226}. Best is trial 2 with value: 0.841994408512735.
