Klebsiella_Pneumoniae | Ceftriaxone | Optuna:  24%|██▍       | 48/200 [1:22:56<3:41:06, 87.28s/it, best=0.908][A[I 2026-02-27 22:13:59,126] Trial 9 finished with value: 0.8435360438720363 and parameters: {'activation': 'tanh', 'solver': 'sgd', 'lr': 0.00012329098365270507, 'layer1': 219, 'layer2': 22, 'layer3': 62}. Best is trial 8 with value: 0.8854975788426769.

Pseudomonas_Aeruginosa | Meropenem | Optuna:   5%|▌         | 10/200 [09:34<3:27:59, 65.68s/it, best=0.885][A
Pseudomonas_Aeruginosa | Meropenem | Optuna:   5%|▌         | 10/200 [09:34<3:27:59, 65.68s/it, best=0.885][A[I 2026-02-27 22:14:10,292] Trial 48 finished with value: 0.7876395198029357 and parameters: {'activation': 'relu', 'solver': 'adam', 'lr': 3.5775796671035755e-06, 'layer1': 291, 'layer2': 455, 'layer3': 476}. Best is trial 25 with value: 0.9080365798965563.

Klebsiella_Pneumoniae | Ceftriaxone | Optuna:  24%|██▍       | 49/200 [1:23:31<3:00:32, 71.74s/it, best=0.908][A
Klebsiella_Pneumoniae | Ceftriaxone | Optuna:  24%|██▍       | 49/200 [1:23:31<3:00:32, 71.74s/it, best=0.908][A[I 2026-02-27 22:14:21,938] Trial 10 finished with value: 0.8432586936382341 and parameters: {'activation': 'identity', 'solver': 'sgd', 'lr': 0.007553503645583194, 'layer1': 366, 'layer2': 492, 'layer3': 320}. Best is trial 8 with value: 0.8854975788426769.

Pseudomonas_Aeruginosa | Meropenem | Optuna:   6%|▌         | 11/200 [09:57<2:45:34, 52.56s/it, best=0.885][A
Pseudomonas_Aeruginosa | Meropenem | Optuna:   6%|▌         | 11/200 [09:57<2:45:34, 52.56s/it, best=0.885][A[I 2026-02-27 22:14:43,737] Trial 9 finished with value: 0.7952729603727878 and parameters: {'activation': 'tanh', 'solver': 'sgd', 'lr': 0.00012329098365270507, 'layer1': 219, 'layer2': 22, 'layer3': 62}. Best is trial 8 with value: 0.8460386109068014.

Staphylococcus_Aureus | Clindamycin | Optuna:   5%|▌         | 10/200 [16:45<6:45:22, 128.02s/it, best=0.846][A
Staphylococcus_Aureus | Clindamycin | Optuna:   5%|▌         | 10/200 [16:45<6:45:22, 128.02s/it, best=0.846][A[I 2026-02-27 22:15:16,054] Trial 11 finished with value: 0.8757114954732546 and parameters: {'activation': 'relu', 'solver': 'adam', 'lr': 0.0013124793805688133, 'layer1': 150, 'layer2': 163, 'layer3': 284}. Best is trial 8 with value: 0.8854975788426769.

Pseudomonas_Aeruginosa | Meropenem | Optuna:   6%|▌         | 12/200 [10:51<2:46:10, 53.03s/it, best=0.885][A
Pseudomonas_Aeruginosa | Meropenem | Optuna:   6%|▌         | 12/200 [10:51<2:46:10, 53.03s/it, best=0.885][A[I 2026-02-27 22:15:19,927] Trial 49 finished with value: 0.9049819427228869 and parameters: {'activation': 'identity', 'solver': 'adam', 'lr': 0.00031610931268844764, 'layer1': 223, 'layer2': 396, 'layer3': 379}. Best is trial 25 with value: 0.9080365798965563.

Klebsiella_Pneumoniae | Ceftriaxone | Optuna:  25%|██▌       | 50/200 [1:24:41<2:57:45, 71.11s/it, best=0.908][A
Klebsiella_Pneumoniae | Ceftriaxone | Optuna:  25%|██▌       | 50/200 [1:24:41<2:57:45, 71.11s/it, best=0.908][A[I 2026-02-27 22:15:38,797] Trial 181 finished with value: 0.8076753692679753 and parameters: {'activation': 'tanh', 'solver': 'adam', 'lr': 2.267265234017627e-05, 'layer1': 433, 'layer2': 354, 'layer3': 21}. Best is trial 124 with value: 0.8095465376114227.

Escherichia_Coli | Ciprofloxacin | Optuna:  91%|█████████ | 182/200 [7:28:08<48:37, 162.09s/it, best=0.809][A
Escherichia_Coli | Ciprofloxacin | Optuna:  91%|█████████ | 182/200 [7:28:08<48:37, 162.09s/it, best=0.809][A[I 2026-02-27 22:15:58,137] Trial 10 finished with value: 0.7988639845240131 and parameters: {'activation': 'identity', 'solver': 'sgd', 'lr': 0.007553503645583194, 'layer1': 366, 'layer2': 492, 'layer3': 320}. Best is trial 8 with value: 0.8460386109068014.

Staphylococcus_Aureus | Clindamycin | Optuna:   6%|▌         | 11/200 [17:59<5:51:33, 111.61s/it, best=0.846][A
Staphylococcus_Aureus | Clindamycin | Optuna:   6%|▌         | 11/200 [17:59<5:51:33, 111.61s/it, best=0.846][A[I 2026-02-27 22:16:39,428] Trial 50 finished with value: 0.9042076677826673 and parameters: {'activation': 'tanh', 'solver': 'adam', 'lr': 0.00014276067316321196, 'layer1': 421, 'layer2': 182, 'layer3': 417}. Best is trial 25 with value: 0.9080365798965563.

Klebsiella_Pneumoniae | Ceftriaxone | Optuna:  26%|██▌       | 51/200 [1:26:00<3:02:50, 73.62s/it, best=0.908][A
Klebsiella_Pneumoniae | Ceftriaxone | Optuna:  26%|██▌       | 51/200 [1:26:00<3:02:50, 73.62s/it, best=0.908][A[I 2026-02-27 22:16:45,306] Trial 12 finished with value: 0.8852462350590802 and parameters: {'activation': 'identity', 'solver': 'adam', 'lr': 0.00046544039809979403, 'layer1': 347, 'layer2': 434, 'layer3': 419}. Best is trial 8 with value: 0.8854975788426769.

Pseudomonas_Aeruginosa | Meropenem | Optuna:   6%|▋         | 13/200 [12:20<3:19:29, 64.01s/it, best=0.885][A
Pseudomonas_Aeruginosa | Meropenem | Optuna:   6%|▋         | 13/200 [12:20<3:19:29, 64.01s/it, best=0.885][A[I 2026-02-27 22:17:45,349] Trial 11 finished with value: 0.847725587041524 and parameters: {'activation': 'relu', 'solver': 'adam', 'lr': 0.0013124793805688133, 'layer1': 150, 'layer2': 163, 'layer3': 284}. Best is trial 11 with value: 0.847725587041524.

Staphylococcus_Aureus | Clindamycin | Optuna:   6%|▌         | 12/200 [19:47<5:45:30, 110.27s/it, best=0.846][A
Staphylococcus_Aureus | Clindamycin | Optuna:   6%|▌         | 12/200 [19:47<5:45:30, 110.27s/it, best=0.848][A[I 2026-02-27 22:17:55,467] Trial 51 finished with value: 0.9021796428496873 and parameters: {'activation': 'identity', 'solver': 'adam', 'lr': 8.044760758314394e-05, 'layer1': 11, 'layer2': 404, 'layer3': 453}. Best is trial 25 with value: 0.9080365798965563.

Klebsiella_Pneumoniae | Ceftriaxone | Optuna:  26%|██▌       | 52/200 [1:27:17<3:03:23, 74.35s/it, best=0.908][A
Klebsiella_Pneumoniae | Ceftriaxone | Optuna:  26%|██▌       | 52/200 [1:27:17<3:03:23, 74.35s/it, best=0.908][A[I 2026-02-27 22:18:19,011] Trial 13 finished with value: 0.8829675903867711 and parameters: {'activation': 'identity', 'solver': 'adam', 'lr': 0.00025548240574830476, 'layer1': 499, 'layer2': 471, 'layer3': 419}. Best is trial 8 with value: 0.8854975788426769.

Pseudomonas_Aeruginosa | Meropenem | Optuna:   7%|▋         | 14/200 [13:54<3:46:13, 72.98s/it, best=0.885][A
Pseudomonas_Aeruginosa | Meropenem | Optuna:   7%|▋         | 14/200 [13:54<3:46:13, 72.98s/it, best=0.885][A[I 2026-02-27 22:18:28,240] Trial 182 finished with value: 0.807827904769624 and parameters: {'activation': 'tanh', 'solver': 'adam', 'lr': 2.492697627737179e-05, 'layer1': 478, 'layer2': 352, 'layer3': 19}. Best is trial 124 with value: 0.8095465376114227.

Escherichia_Coli | Ciprofloxacin | Optuna:  92%|█████████▏| 183/200 [7:30:57<46:32, 164.29s/it, best=0.809][A
Escherichia_Coli | Ciprofloxacin | Optuna:  92%|█████████▏| 183/200 [7:30:57<46:32, 164.29s/it, best=0.809][A[I 2026-02-27 22:19:40,740] Trial 14 finished with value: 0.8816362093638048 and parameters: {'activation': 'identity', 'solver': 'adam', 'lr': 0.0007479355404409705, 'layer1': 340, 'layer2': 392, 'layer3': 396}. Best is trial 8 with value: 0.8854975788426769.

Pseudomonas_Aeruginosa | Meropenem | Optuna:   8%|▊         | 15/200 [15:15<3:53:08, 75.61s/it, best=0.885][A
Pseudomonas_Aeruginosa | Meropenem | Optuna:   8%|▊         | 15/200 [15:15<3:53:08, 75.61s/it, best=0.885][A[I 2026-02-27 22:19:49,746] Trial 52 finished with value: 0.9027434402505463 and parameters: {'activation': 'identity', 'solver': 'adam', 'lr': 9.246688159115882e-05, 'layer1': 483, 'layer2': 369, 'layer3': 473}. Best is trial 25 with value: 0.9080365798965563.

Klebsiella_Pneumoniae | Ceftriaxone | Optuna:  26%|██▋       | 53/200 [1:29:11<3:31:30, 86.33s/it, best=0.908][A
Klebsiella_Pneumoniae | Ceftriaxone | Optuna:  26%|██▋       | 53/200 [1:29:11<3:31:30, 86.33s/it, best=0.908][A[I 2026-02-27 22:20:10,264] Trial 12 finished with value: 0.8480119700404165 and parameters: {'activation': 'identity', 'solver': 'adam', 'lr': 0.000653831780412919, 'layer1': 166, 'layer2': 481, 'layer3': 300}. Best is trial 12 with value: 0.8480119700404165.

Staphylococcus_Aureus | Clindamycin | Optuna:   6%|▋         | 13/200 [22:11<6:16:22, 120.76s/it, best=0.848][A
Staphylococcus_Aureus | Clindamycin | Optuna:   6%|▋         | 13/200 [22:11<6:16:22, 120.76s/it, best=0.848][A[I 2026-02-27 22:21:03,447] Trial 15 finished with value: 0.8810253563713688 and parameters: {'activation': 'identity', 'solver': 'adam', 'lr': 0.0028522646033228415, 'layer1': 324, 'layer2': 424, 'layer3': 236}. Best is trial 8 with value: 0.8854975788426769.

Pseudomonas_Aeruginosa | Meropenem | Optuna:   8%|▊         | 16/200 [16:38<3:58:25, 77.75s/it, best=0.885][A
Pseudomonas_Aeruginosa | Meropenem | Optuna:   8%|▊         | 16/200 [16:38<3:58:25, 77.75s/it, best=0.885][A[I 2026-02-27 22:21:16,744] Trial 53 finished with value: 0.9022521249219579 and parameters: {'activation': 'identity', 'solver': 'adam', 'lr': 0.0016976561036233424, 'layer1': 451, 'layer2': 330, 'layer3': 482}. Best is trial 25 with value: 0.9080365798965563.

Klebsiella_Pneumoniae | Ceftriaxone | Optuna:  27%|██▋       | 54/200 [1:30:38<3:30:33, 86.53s/it, best=0.908][A
Klebsiella_Pneumoniae | Ceftriaxone | Optuna:  27%|██▋       | 54/200 [1:30:38<3:30:33, 86.53s/it, best=0.908][A[I 2026-02-27 22:21:30,080] Trial 183 finished with value: 0.8045382416013738 and parameters: {'activation': 'tanh', 'solver': 'adam', 'lr': 2.2847158266645215e-05, 'layer1': 443, 'layer2': 353, 'layer3': 22}. Best is trial 124 with value: 0.8095465376114227.

Escherichia_Coli | Ciprofloxacin | Optuna:  92%|█████████▏| 184/200 [7:33:59<45:12, 169.56s/it, best=0.809][A
Escherichia_Coli | Ciprofloxacin | Optuna:  92%|█████████▏| 184/200 [7:33:59<45:12, 169.56s/it, best=0.809][A[I 2026-02-27 22:21:36,900] Trial 13 finished with value: 0.8470664958579579 and parameters: {'activation': 'relu', 'solver': 'adam', 'lr': 0.00045702152519178725, 'layer1': 167, 'layer2': 138, 'layer3': 360}. Best is trial 12 with value: 0.8480119700404165.

Staphylococcus_Aureus | Clindamycin | Optuna:   7%|▋         | 14/200 [23:38<5:42:24, 110.46s/it, best=0.848][A
Staphylococcus_Aureus | Clindamycin | Optuna:   7%|▋         | 14/200 [23:38<5:42:24, 110.46s/it, best=0.848][A[I 2026-02-27 22:22:18,885] Trial 16 finished with value: 0.8827315082891449 and parameters: {'activation': 'identity', 'solver': 'adam', 'lr': 0.00017184915692664145, 'layer1': 193, 'layer2': 409, 'layer3': 472}. Best is trial 8 with value: 0.8854975788426769.

Pseudomonas_Aeruginosa | Meropenem | Optuna:   8%|▊         | 17/200 [17:54<3:55:01, 77.05s/it, best=0.885][A
Pseudomonas_Aeruginosa | Meropenem | Optuna:   8%|▊         | 17/200 [17:54<3:55:01, 77.05s/it, best=0.885][A[I 2026-02-27 22:22:32,822] Trial 14 finished with value: 0.7897000194121678 and parameters: {'activation': 'relu', 'solver': 'adam', 'lr': 0.009135190764330395, 'layer1': 499, 'layer2': 393, 'layer3': 463}. Best is trial 12 with value: 0.8480119700404165.

Staphylococcus_Aureus | Clindamycin | Optuna:   8%|▊         | 15/200 [24:34<4:49:53, 94.02s/it, best=0.848] [A
Staphylococcus_Aureus | Clindamycin | Optuna:   8%|▊         | 15/200 [24:34<4:49:53, 94.02s/it, best=0.848][A[I 2026-02-27 22:23:06,191] Trial 54 finished with value: 0.9009914603400399 and parameters: {'activation': 'identity', 'solver': 'adam', 'lr': 5.340217425314006e-05, 'layer1': 411, 'layer2': 290, 'layer3': 449}. Best is trial 25 with value: 0.9080365798965563.

Klebsiella_Pneumoniae | Ceftriaxone | Optuna:  28%|██▊       | 55/200 [1:32:27<3:45:43, 93.40s/it, best=0.908][A
Klebsiella_Pneumoniae | Ceftriaxone | Optuna:  28%|██▊       | 55/200 [1:32:27<3:45:43, 93.40s/it, best=0.908][A[I 2026-02-27 22:23:36,471] Trial 17 finished with value: 0.8816441896061917 and parameters: {'activation': 'identity', 'solver': 'adam', 'lr': 0.0004473029764903099, 'layer1': 450, 'layer2': 360, 'layer3': 299}. Best is trial 8 with value: 0.8854975788426769.

Pseudomonas_Aeruginosa | Meropenem | Optuna:   9%|▉         | 18/200 [19:11<3:54:12, 77.21s/it, best=0.885][A
Pseudomonas_Aeruginosa | Meropenem | Optuna:   9%|▉         | 18/200 [19:11<3:54:12, 77.21s/it, best=0.885][A[I 2026-02-27 22:24:10,139] Trial 55 finished with value: 0.905251711252699 and parameters: {'activation': 'identity', 'solver': 'adam', 'lr': 0.00018670658634928293, 'layer1': 103, 'layer2': 67, 'layer3': 427}. Best is trial 25 with value: 0.9080365798965563.

Klebsiella_Pneumoniae | Ceftriaxone | Optuna:  28%|██▊       | 56/200 [1:33:31<3:22:57, 84.57s/it, best=0.908][A
Klebsiella_Pneumoniae | Ceftriaxone | Optuna:  28%|██▊       | 56/200 [1:33:31<3:22:57, 84.57s/it, best=0.908][A[I 2026-02-27 22:24:22,703] Trial 15 finished with value: 0.8489517220147199 and parameters: {'activation': 'identity', 'solver': 'adam', 'lr': 0.0023228871312711043, 'layer1': 160, 'layer2': 125, 'layer3': 315}. Best is trial 15 with value: 0.8489517220147199.

Staphylococcus_Aureus | Clindamycin | Optuna:   8%|▊         | 16/200 [26:24<5:02:57, 98.79s/it, best=0.848][A
Staphylococcus_Aureus | Clindamycin | Optuna:   8%|▊         | 16/200 [26:24<5:02:57, 98.79s/it, best=0.849][A[I 2026-02-27 22:24:33,504] Trial 18 finished with value: 0.6546947697465721 and parameters: {'activation': 'tanh', 'solver': 'sgd', 'lr': 5.6512812063308935e-05, 'layer1': 316, 'layer2': 450, 'layer3': 199}. Best is trial 8 with value: 0.8854975788426769.

Pseudomonas_Aeruginosa | Meropenem | Optuna:  10%|▉         | 19/200 [20:08<3:34:38, 71.15s/it, best=0.885][A
Pseudomonas_Aeruginosa | Meropenem | Optuna:  10%|▉         | 19/200 [20:08<3:34:38, 71.15s/it, best=0.885][A[I 2026-02-27 22:24:43,148] Trial 184 finished with value: 0.8091152722869701 and parameters: {'activation': 'tanh', 'solver': 'adam', 'lr': 2.913363092566752e-05, 'layer1': 482, 'layer2': 338, 'layer3': 18}. Best is trial 124 with value: 0.8095465376114227.

Escherichia_Coli | Ciprofloxacin | Optuna:  92%|█████████▎| 185/200 [7:37:12<44:09, 176.61s/it, best=0.809][A
Escherichia_Coli | Ciprofloxacin | Optuna:  92%|█████████▎| 185/200 [7:37:12<44:09, 176.61s/it, best=0.809][A[I 2026-02-27 22:25:45,581] Trial 19 finished with value: 0.868501323300276 and parameters: {'activation': 'logistic', 'solver': 'adam', 'lr': 0.0037119440897972695, 'layer1': 400, 'layer2': 353, 'layer3': 424}. Best is trial 8 with value: 0.8854975788426769.

Pseudomonas_Aeruginosa | Meropenem | Optuna:  10%|█         | 20/200 [21:20<3:34:17, 71.43s/it, best=0.885][A
Pseudomonas_Aeruginosa | Meropenem | Optuna:  10%|█         | 20/200 [21:20<3:34:17, 71.43s/it, best=0.885][A[I 2026-02-27 22:26:04,505] Trial 56 finished with value: 0.9028622611524814 and parameters: {'activation': 'identity', 'solver': 'adam', 'lr': 2.8342842711541595e-05, 'layer1': 435, 'layer2': 376, 'layer3': 484}. Best is trial 25 with value: 0.9080365798965563.

Klebsiella_Pneumoniae | Ceftriaxone | Optuna:  28%|██▊       | 57/200 [1:35:26<3:42:51, 93.51s/it, best=0.908][A
Klebsiella_Pneumoniae | Ceftriaxone | Optuna:  28%|██▊       | 57/200 [1:35:26<3:42:51, 93.51s/it, best=0.908][A[I 2026-02-27 22:26:34,242] Trial 57 finished with value: 0.782466545914998 and parameters: {'activation': 'logistic', 'solver': 'sgd', 'lr': 0.0001468134680443279, 'layer1': 383, 'layer2': 431, 'layer3': 405}. Best is trial 25 with value: 0.9080365798965563.

Klebsiella_Pneumoniae | Ceftriaxone | Optuna:  29%|██▉       | 58/200 [1:35:55<2:56:01, 74.38s/it, best=0.908][A
Klebsiella_Pneumoniae | Ceftriaxone | Optuna:  29%|██▉       | 58/200 [1:35:55<2:56:01, 74.38s/it, best=0.908][A[I 2026-02-27 22:26:42,298] Trial 20 finished with value: 0.8834733833034172 and parameters: {'activation': 'identity', 'solver': 'adam', 'lr': 0.00039381673450869054, 'layer1': 304, 'layer2': 119, 'layer3': 352}. Best is trial 8 with value: 0.8854975788426769.

Pseudomonas_Aeruginosa | Meropenem | Optuna:  10%|█         | 21/200 [22:17<3:19:55, 67.01s/it, best=0.885][A
Pseudomonas_Aeruginosa | Meropenem | Optuna:  10%|█         | 21/200 [22:17<3:19:55, 67.01s/it, best=0.885][A[I 2026-02-27 22:26:46,296] Trial 16 finished with value: 0.846253705413395 and parameters: {'activation': 'identity', 'solver': 'adam', 'lr': 0.00015844826667722173, 'layer1': 187, 'layer2': 104, 'layer3': 389}. Best is trial 15 with value: 0.8489517220147199.

Staphylococcus_Aureus | Clindamycin | Optuna:   8%|▊         | 17/200 [28:47<5:42:24, 112.26s/it, best=0.849][A
Staphylococcus_Aureus | Clindamycin | Optuna:   8%|▊         | 17/200 [28:47<5:42:24, 112.26s/it, best=0.849][A[I 2026-02-27 22:27:30,282] Trial 185 finished with value: 0.805934691225479 and parameters: {'activation': 'tanh', 'solver': 'adam', 'lr': 2.8957335521157723e-05, 'layer1': 482, 'layer2': 368, 'layer3': 11}. Best is trial 124 with value: 0.8095465376114227.

Escherichia_Coli | Ciprofloxacin | Optuna:  93%|█████████▎| 186/200 [7:39:59<40:32, 173.77s/it, best=0.809][A
Escherichia_Coli | Ciprofloxacin | Optuna:  93%|█████████▎| 186/200 [7:39:59<40:32, 173.77s/it, best=0.809][A[I 2026-02-27 22:28:08,938] Trial 21 finished with value: 0.882174503706671 and parameters: {'activation': 'identity', 'solver': 'adam', 'lr': 5.551359264911533e-05, 'layer1': 303, 'layer2': 108, 'layer3': 350}. Best is trial 8 with value: 0.8854975788426769.

Pseudomonas_Aeruginosa | Meropenem | Optuna:  11%|█         | 22/200 [23:44<3:36:16, 72.90s/it, best=0.885][A
Pseudomonas_Aeruginosa | Meropenem | Optuna:  11%|█         | 22/200 [23:44<3:36:16, 72.90s/it, best=0.885][A[I 2026-02-27 22:28:35,792] Trial 58 finished with value: 0.9038506850554482 and parameters: {'activation': 'identity', 'solver': 'adam', 'lr': 0.0005581408828961985, 'layer1': 497, 'layer2': 261, 'layer3': 467}. Best is trial 25 with value: 0.9080365798965563.

Klebsiella_Pneumoniae | Ceftriaxone | Optuna:  30%|██▉       | 59/200 [1:37:57<3:28:02, 88.53s/it, best=0.908][A
Klebsiella_Pneumoniae | Ceftriaxone | Optuna:  30%|██▉       | 59/200 [1:37:57<3:28:02, 88.53s/it, best=0.908][A[I 2026-02-27 22:28:42,513] Trial 17 finished with value: 0.8500021716359875 and parameters: {'activation': 'identity', 'solver': 'adam', 'lr': 0.0032560969861539536, 'layer1': 110, 'layer2': 104, 'layer3': 400}. Best is trial 17 with value: 0.8500021716359875.

Staphylococcus_Aureus | Clindamycin | Optuna:   9%|▉         | 18/200 [30:44<5:44:08, 113.45s/it, best=0.849][A
Staphylococcus_Aureus | Clindamycin | Optuna:   9%|▉         | 18/200 [30:44<5:44:08, 113.45s/it, best=0.85] [A[I 2026-02-27 22:29:05,394] Trial 18 finished with value: 0.7922531978057352 and parameters: {'activation': 'identity', 'solver': 'sgd', 'lr': 0.0038034426403954023, 'layer1': 92, 'layer2': 104, 'layer3': 433}. Best is trial 17 with value: 0.8500021716359875.

Staphylococcus_Aureus | Clindamycin | Optuna:  10%|▉         | 19/200 [31:07<4:20:11, 86.25s/it, best=0.85] [A
Staphylococcus_Aureus | Clindamycin | Optuna:  10%|▉         | 19/200 [31:07<4:20:11, 86.25s/it, best=0.85][A[I 2026-02-27 22:29:20,119] Trial 22 finished with value: 0.8841991080923852 and parameters: {'activation': 'identity', 'solver': 'adam', 'lr': 0.0003984240795798994, 'layer1': 368, 'layer2': 99, 'layer3': 376}. Best is trial 8 with value: 0.8854975788426769.

Pseudomonas_Aeruginosa | Meropenem | Optuna:  12%|█▏        | 23/200 [24:55<3:33:32, 72.39s/it, best=0.885][A
Pseudomonas_Aeruginosa | Meropenem | Optuna:  12%|█▏        | 23/200 [24:55<3:33:32, 72.39s/it, best=0.885][A[I 2026-02-27 22:30:29,495] Trial 59 finished with value: 0.9028400665874594 and parameters: {'activation': 'identity', 'solver': 'adam', 'lr': 4.229693793087342e-05, 'layer1': 346, 'layer2': 479, 'layer3': 14}. Best is trial 25 with value: 0.9080365798965563.

Klebsiella_Pneumoniae | Ceftriaxone | Optuna:  30%|███       | 60/200 [1:39:51<3:44:11, 96.08s/it, best=0.908][A
Klebsiella_Pneumoniae | Ceftriaxone | Optuna:  30%|███       | 60/200 [1:39:51<3:44:11, 96.08s/it, best=0.908][A[I 2026-02-27 22:30:29,513] Trial 186 finished with value: 0.8058384925672712 and parameters: {'activation': 'tanh', 'solver': 'adam', 'lr': 2.2356057171395277e-05, 'layer1': 469, 'layer2': 337, 'layer3': 20}. Best is trial 124 with value: 0.8095465376114227.

Escherichia_Coli | Ciprofloxacin | Optuna:  94%|█████████▎| 187/200 [7:42:58<38:00, 175.41s/it, best=0.809][A
Escherichia_Coli | Ciprofloxacin | Optuna:  94%|█████████▎| 187/200 [7:42:58<38:00, 175.41s/it, best=0.809][A[I 2026-02-27 22:30:40,202] Trial 23 finished with value: 0.884698721443025 and parameters: {'activation': 'identity', 'solver': 'adam', 'lr': 0.0013226169040158056, 'layer1': 377, 'layer2': 244, 'layer3': 441}. Best is trial 8 with value: 0.8854975788426769.

Pseudomonas_Aeruginosa | Meropenem | Optuna:  12%|█▏        | 24/200 [26:15<3:39:06, 74.70s/it, best=0.885][A
Pseudomonas_Aeruginosa | Meropenem | Optuna:  12%|█▏        | 24/200 [26:15<3:39:06, 74.70s/it, best=0.885][A[I 2026-02-27 22:30:45,006] Trial 19 finished with value: 0.8462906605846978 and parameters: {'activation': 'identity', 'solver': 'adam', 'lr': 0.0030153759106876484, 'layer1': 12, 'layer2': 221, 'layer3': 432}. Best is trial 17 with value: 0.8500021716359875.

Staphylococcus_Aureus | Clindamycin | Optuna:  10%|█         | 20/200 [32:46<4:30:47, 90.26s/it, best=0.85][A
Staphylococcus_Aureus | Clindamycin | Optuna:  10%|█         | 20/200 [32:46<4:30:47, 90.26s/it, best=0.85][A[I 2026-02-27 22:32:05,470] Trial 24 finished with value: 0.884843394025393 and parameters: {'activation': 'identity', 'solver': 'adam', 'lr': 0.0011740701425542424, 'layer1': 477, 'layer2': 232, 'layer3': 447}. Best is trial 8 with value: 0.8854975788426769.

Pseudomonas_Aeruginosa | Meropenem | Optuna:  12%|█▎        | 25/200 [27:40<3:47:06, 77.87s/it, best=0.885][A
