Staphylococcus_Aureus | DirectMulti | Optuna:   2%|▏         | 4/200 [06:41<7:19:06, 134.42s/it, best=0.842]Staphylococcus_Aureus | DirectMulti | Optuna:   2%|▏         | 4/200 [06:41<7:19:06, 134.42s/it, best=0.842][I 2026-02-28 14:37:06,162] Trial 4 finished with value: 0.8025462836351759 and parameters: {'activation': 'relu', 'solver': 'adam', 'lr': 1.7654048052495086e-05, 'layer1': 265, 'layer2': 278, 'layer3': 100}. Best is trial 2 with value: 0.841994408512735.
Staphylococcus_Aureus | DirectMulti | Optuna:   2%|▎         | 5/200 [07:11<5:14:26, 96.75s/it, best=0.842] Staphylococcus_Aureus | DirectMulti | Optuna:   2%|▎         | 5/200 [07:11<5:14:26, 96.75s/it, best=0.842][I 2026-02-28 14:37:06,322] Trial 41 finished with value: 0.9211310868443213 and parameters: {'activation': 'identity', 'solver': 'adam', 'lr': 0.00017887801729481, 'layer1': 80, 'layer2': 488, 'layer3': 233}. Best is trial 20 with value: 0.9222781385346849.
Klebsiella_Pneumoniae | DirectMulti | Optuna:  21%|██        | 42/200 [1:10:51<4:14:39, 96.71s/it, best=0.922] Klebsiella_Pneumoniae | DirectMulti | Optuna:  21%|██        | 42/200 [1:10:51<4:14:39, 96.71s/it, best=0.922][I 2026-02-28 14:37:35,248] Trial 188 finished with value: 0.9145269159118369 and parameters: {'activation': 'relu', 'solver': 'adam', 'lr': 0.000292229633351728, 'layer1': 364, 'layer2': 174, 'layer3': 119}. Best is trial 175 with value: 0.9170284245835123.

Escherichia_Coli | Piperacillin-Tazobactam | Optuna:  94%|█████████▍| 189/200 [6:33:27<20:42, 112.92s/it, best=0.917][A
Escherichia_Coli | Piperacillin-Tazobactam | Optuna:  94%|█████████▍| 189/200 [6:33:27<20:42, 112.92s/it, best=0.917][A[I 2026-02-28 14:38:15,312] Trial 42 finished with value: 0.9197400257113368 and parameters: {'activation': 'identity', 'solver': 'adam', 'lr': 0.00032292076625869574, 'layer1': 77, 'layer2': 487, 'layer3': 259}. Best is trial 20 with value: 0.9222781385346849.
Klebsiella_Pneumoniae | DirectMulti | Optuna:  22%|██▏       | 43/200 [1:12:00<3:51:17, 88.39s/it, best=0.922]Klebsiella_Pneumoniae | DirectMulti | Optuna:  22%|██▏       | 43/200 [1:12:00<3:51:17, 88.39s/it, best=0.922][I 2026-02-28 14:38:49,359] Trial 189 finished with value: 0.9110405375362556 and parameters: {'activation': 'relu', 'solver': 'adam', 'lr': 0.00019825062655125982, 'layer1': 75, 'layer2': 342, 'layer3': 240}. Best is trial 175 with value: 0.9170284245835123.

Escherichia_Coli | Piperacillin-Tazobactam | Optuna:  95%|█████████▌| 190/200 [6:34:42<16:52, 101.28s/it, best=0.917][A
Escherichia_Coli | Piperacillin-Tazobactam | Optuna:  95%|█████████▌| 190/200 [6:34:42<16:52, 101.28s/it, best=0.917][A[I 2026-02-28 14:39:24,836] Trial 43 finished with value: 0.9205940983966704 and parameters: {'activation': 'identity', 'solver': 'adam', 'lr': 0.00015046803672060595, 'layer1': 121, 'layer2': 440, 'layer3': 169}. Best is trial 20 with value: 0.9222781385346849.
Klebsiella_Pneumoniae | DirectMulti | Optuna:  22%|██▏       | 44/200 [1:13:10<3:35:06, 82.73s/it, best=0.922]Klebsiella_Pneumoniae | DirectMulti | Optuna:  22%|██▏       | 44/200 [1:13:10<3:35:06, 82.73s/it, best=0.922][I 2026-02-28 14:39:57,171] Trial 5 finished with value: 0.8326013606707476 and parameters: {'activation': 'identity', 'solver': 'adam', 'lr': 2.259279742015697e-06, 'layer1': 106, 'layer2': 32, 'layer3': 169}. Best is trial 2 with value: 0.841994408512735.
Staphylococcus_Aureus | DirectMulti | Optuna:   3%|▎         | 6/200 [10:02<6:34:27, 122.00s/it, best=0.842]Staphylococcus_Aureus | DirectMulti | Optuna:   3%|▎         | 6/200 [10:02<6:34:27, 122.00s/it, best=0.842][I 2026-02-28 14:40:33,122] Trial 190 finished with value: 0.9086168346248293 and parameters: {'activation': 'logistic', 'solver': 'adam', 'lr': 0.0005603033774674562, 'layer1': 347, 'layer2': 313, 'layer3': 134}. Best is trial 175 with value: 0.9170284245835123.

Escherichia_Coli | Piperacillin-Tazobactam | Optuna:  96%|█████████▌| 191/200 [6:36:25<15:18, 102.02s/it, best=0.917][A
Escherichia_Coli | Piperacillin-Tazobactam | Optuna:  96%|█████████▌| 191/200 [6:36:25<15:18, 102.02s/it, best=0.917][A[I 2026-02-28 14:41:18,123] Trial 44 finished with value: 0.9213476606360611 and parameters: {'activation': 'identity', 'solver': 'adam', 'lr': 0.000782275035248413, 'layer1': 313, 'layer2': 426, 'layer3': 300}. Best is trial 20 with value: 0.9222781385346849.
Klebsiella_Pneumoniae | DirectMulti | Optuna:  22%|██▎       | 45/200 [1:15:03<3:57:24, 91.90s/it, best=0.922]Klebsiella_Pneumoniae | DirectMulti | Optuna:  22%|██▎       | 45/200 [1:15:03<3:57:24, 91.90s/it, best=0.922][I 2026-02-28 14:42:28,884] Trial 45 finished with value: 0.9220780599800268 and parameters: {'activation': 'identity', 'solver': 'adam', 'lr': 0.0008018904503588303, 'layer1': 15, 'layer2': 483, 'layer3': 295}. Best is trial 20 with value: 0.9222781385346849.
Klebsiella_Pneumoniae | DirectMulti | Optuna:  23%|██▎       | 46/200 [1:16:14<3:39:35, 85.56s/it, best=0.922]Klebsiella_Pneumoniae | DirectMulti | Optuna:  23%|██▎       | 46/200 [1:16:14<3:39:35, 85.56s/it, best=0.922][I 2026-02-28 14:42:37,659] Trial 191 finished with value: 0.9162298128196882 and parameters: {'activation': 'relu', 'solver': 'adam', 'lr': 0.0002633723210693743, 'layer1': 326, 'layer2': 306, 'layer3': 489}. Best is trial 175 with value: 0.9170284245835123.

Escherichia_Coli | Piperacillin-Tazobactam | Optuna:  96%|█████████▌| 192/200 [6:38:30<14:30, 108.78s/it, best=0.917][A
Escherichia_Coli | Piperacillin-Tazobactam | Optuna:  96%|█████████▌| 192/200 [6:38:30<14:30, 108.78s/it, best=0.917][A[I 2026-02-28 14:43:29,823] Trial 46 finished with value: 0.9205340198523899 and parameters: {'activation': 'identity', 'solver': 'adam', 'lr': 0.0008399495165152878, 'layer1': 24, 'layer2': 480, 'layer3': 241}. Best is trial 20 with value: 0.9222781385346849.
Klebsiella_Pneumoniae | DirectMulti | Optuna:  24%|██▎       | 47/200 [1:17:15<3:19:20, 78.17s/it, best=0.922]Klebsiella_Pneumoniae | DirectMulti | Optuna:  24%|██▎       | 47/200 [1:17:15<3:19:20, 78.17s/it, best=0.922][I 2026-02-28 14:44:48,294] Trial 192 finished with value: 0.9132437386162817 and parameters: {'activation': 'relu', 'solver': 'adam', 'lr': 0.0002625879926506061, 'layer1': 329, 'layer2': 305, 'layer3': 493}. Best is trial 175 with value: 0.9170284245835123.

Escherichia_Coli | Piperacillin-Tazobactam | Optuna:  96%|█████████▋| 193/200 [6:40:40<13:27, 115.34s/it, best=0.917][A
Escherichia_Coli | Piperacillin-Tazobactam | Optuna:  96%|█████████▋| 193/200 [6:40:40<13:27, 115.34s/it, best=0.917][A[I 2026-02-28 14:46:02,927] Trial 47 finished with value: 0.8280454226839025 and parameters: {'activation': 'identity', 'solver': 'sgd', 'lr': 0.0001034322108968535, 'layer1': 78, 'layer2': 480, 'layer3': 310}. Best is trial 20 with value: 0.9222781385346849.
Klebsiella_Pneumoniae | DirectMulti | Optuna:  24%|██▍       | 48/200 [1:19:48<4:14:58, 100.65s/it, best=0.922]Klebsiella_Pneumoniae | DirectMulti | Optuna:  24%|██▍       | 48/200 [1:19:48<4:14:58, 100.65s/it, best=0.922][I 2026-02-28 14:46:37,006] Trial 193 finished with value: 0.9142664044850639 and parameters: {'activation': 'relu', 'solver': 'adam', 'lr': 0.0004260121234994366, 'layer1': 314, 'layer2': 269, 'layer3': 273}. Best is trial 175 with value: 0.9170284245835123.

Escherichia_Coli | Piperacillin-Tazobactam | Optuna:  97%|█████████▋| 194/200 [6:42:29<11:20, 113.35s/it, best=0.917][A
Escherichia_Coli | Piperacillin-Tazobactam | Optuna:  97%|█████████▋| 194/200 [6:42:29<11:20, 113.35s/it, best=0.917][A[I 2026-02-28 14:46:38,166] Trial 48 finished with value: 0.871005321964591 and parameters: {'activation': 'relu', 'solver': 'adam', 'lr': 1.625638715194242e-06, 'layer1': 19, 'layer2': 498, 'layer3': 284}. Best is trial 20 with value: 0.9222781385346849.
Klebsiella_Pneumoniae | DirectMulti | Optuna:  24%|██▍       | 49/200 [1:20:23<3:23:55, 81.03s/it, best=0.922] Klebsiella_Pneumoniae | DirectMulti | Optuna:  24%|██▍       | 49/200 [1:20:23<3:23:55, 81.03s/it, best=0.922][I 2026-02-28 14:47:05,536] Trial 6 finished with value: 0.8709762582786741 and parameters: {'activation': 'tanh', 'solver': 'adam', 'lr': 3.6618192203924288e-06, 'layer1': 403, 'layer2': 46, 'layer3': 494}. Best is trial 6 with value: 0.8709762582786741.
Staphylococcus_Aureus | DirectMulti | Optuna:   4%|▎         | 7/200 [17:10<11:54:36, 222.16s/it, best=0.842]Staphylococcus_Aureus | DirectMulti | Optuna:   4%|▎         | 7/200 [17:10<11:54:36, 222.16s/it, best=0.871][I 2026-02-28 14:47:32,026] Trial 49 finished with value: 0.9187255767961741 and parameters: {'activation': 'identity', 'solver': 'adam', 'lr': 0.00018263997580760124, 'layer1': 48, 'layer2': 407, 'layer3': 266}. Best is trial 20 with value: 0.9222781385346849.
Klebsiella_Pneumoniae | DirectMulti | Optuna:  25%|██▌       | 50/200 [1:21:17<3:02:11, 72.88s/it, best=0.922]Klebsiella_Pneumoniae | DirectMulti | Optuna:  25%|██▌       | 50/200 [1:21:17<3:02:11, 72.88s/it, best=0.922][I 2026-02-28 14:48:02,639] Trial 7 finished with value: 0.8799349374698305 and parameters: {'activation': 'relu', 'solver': 'adam', 'lr': 0.0012164139351417069, 'layer1': 46, 'layer2': 186, 'layer3': 66}. Best is trial 7 with value: 0.8799349374698305.
Staphylococcus_Aureus | DirectMulti | Optuna:   4%|▍         | 8/200 [18:08<9:02:45, 169.61s/it, best=0.871] Staphylococcus_Aureus | DirectMulti | Optuna:   4%|▍         | 8/200 [18:08<9:02:45, 169.61s/it, best=0.88] [I 2026-02-28 14:49:01,966] Trial 194 finished with value: 0.9142321785722094 and parameters: {'activation': 'relu', 'solver': 'adam', 'lr': 0.000324184301568682, 'layer1': 339, 'layer2': 325, 'layer3': 478}. Best is trial 175 with value: 0.9170284245835123.

Escherichia_Coli | Piperacillin-Tazobactam | Optuna:  98%|█████████▊| 195/200 [6:44:54<10:14, 122.83s/it, best=0.917][A
Escherichia_Coli | Piperacillin-Tazobactam | Optuna:  98%|█████████▊| 195/200 [6:44:54<10:14, 122.83s/it, best=0.917][A[I 2026-02-28 14:49:06,321] Trial 50 finished with value: 0.8753300143017098 and parameters: {'activation': 'tanh', 'solver': 'adam', 'lr': 0.009875605439892077, 'layer1': 309, 'layer2': 455, 'layer3': 330}. Best is trial 20 with value: 0.9222781385346849.
Klebsiella_Pneumoniae | DirectMulti | Optuna:  26%|██▌       | 51/200 [1:22:51<3:16:56, 79.30s/it, best=0.922]Klebsiella_Pneumoniae | DirectMulti | Optuna:  26%|██▌       | 51/200 [1:22:51<3:16:56, 79.30s/it, best=0.922][I 2026-02-28 14:50:02,585] Trial 51 finished with value: 0.9200864355949065 and parameters: {'activation': 'identity', 'solver': 'adam', 'lr': 0.0015179589058230357, 'layer1': 11, 'layer2': 371, 'layer3': 302}. Best is trial 20 with value: 0.9222781385346849.
Klebsiella_Pneumoniae | DirectMulti | Optuna:  26%|██▌       | 52/200 [1:23:48<2:58:33, 72.39s/it, best=0.922]Klebsiella_Pneumoniae | DirectMulti | Optuna:  26%|██▌       | 52/200 [1:23:48<2:58:33, 72.39s/it, best=0.922][I 2026-02-28 14:50:24,301] Trial 8 finished with value: 0.8831343819710064 and parameters: {'activation': 'identity', 'solver': 'adam', 'lr': 0.000828752236376816, 'layer1': 323, 'layer2': 445, 'layer3': 241}. Best is trial 8 with value: 0.8831343819710064.
Staphylococcus_Aureus | DirectMulti | Optuna:   4%|▍         | 9/200 [20:29<8:32:07, 160.87s/it, best=0.88]Staphylococcus_Aureus | DirectMulti | Optuna:   4%|▍         | 9/200 [20:29<8:32:07, 160.87s/it, best=0.883][I 2026-02-28 14:51:00,398] Trial 195 finished with value: 0.9153359119680203 and parameters: {'activation': 'relu', 'solver': 'adam', 'lr': 0.0002209847114073794, 'layer1': 357, 'layer2': 296, 'layer3': 475}. Best is trial 175 with value: 0.9170284245835123.

Escherichia_Coli | Piperacillin-Tazobactam | Optuna:  98%|█████████▊| 196/200 [6:46:53<08:06, 121.51s/it, best=0.917][A
Escherichia_Coli | Piperacillin-Tazobactam | Optuna:  98%|█████████▊| 196/200 [6:46:53<08:06, 121.51s/it, best=0.917][A[I 2026-02-28 14:51:05,342] Trial 52 finished with value: 0.9191383648145608 and parameters: {'activation': 'identity', 'solver': 'adam', 'lr': 0.0007105939497490739, 'layer1': 76, 'layer2': 424, 'layer3': 237}. Best is trial 20 with value: 0.9222781385346849.
Klebsiella_Pneumoniae | DirectMulti | Optuna:  26%|██▋       | 53/200 [1:24:51<2:50:16, 69.50s/it, best=0.922]Klebsiella_Pneumoniae | DirectMulti | Optuna:  26%|██▋       | 53/200 [1:24:51<2:50:16, 69.50s/it, best=0.922][I 2026-02-28 14:52:40,253] Trial 53 finished with value: 0.9212127772957608 and parameters: {'activation': 'identity', 'solver': 'adam', 'lr': 0.0012077089763842586, 'layer1': 318, 'layer2': 391, 'layer3': 354}. Best is trial 20 with value: 0.9222781385346849.
Klebsiella_Pneumoniae | DirectMulti | Optuna:  27%|██▋       | 54/200 [1:26:25<3:07:40, 77.12s/it, best=0.922]Klebsiella_Pneumoniae | DirectMulti | Optuna:  27%|██▋       | 54/200 [1:26:25<3:07:40, 77.12s/it, best=0.922][I 2026-02-28 14:52:53,203] Trial 196 finished with value: 0.9139788030490514 and parameters: {'activation': 'relu', 'solver': 'adam', 'lr': 0.00021244222696237554, 'layer1': 371, 'layer2': 287, 'layer3': 488}. Best is trial 175 with value: 0.9170284245835123.

Escherichia_Coli | Piperacillin-Tazobactam | Optuna:  98%|█████████▊| 197/200 [6:48:45<05:56, 118.90s/it, best=0.917][A
Escherichia_Coli | Piperacillin-Tazobactam | Optuna:  98%|█████████▊| 197/200 [6:48:45<05:56, 118.90s/it, best=0.917][A[I 2026-02-28 14:53:58,655] Trial 54 finished with value: 0.9198890389669275 and parameters: {'activation': 'identity', 'solver': 'adam', 'lr': 0.0002935071951354155, 'layer1': 317, 'layer2': 442, 'layer3': 342}. Best is trial 20 with value: 0.9222781385346849.
Klebsiella_Pneumoniae | DirectMulti | Optuna:  28%|██▊       | 55/200 [1:27:44<3:07:18, 77.51s/it, best=0.922]Klebsiella_Pneumoniae | DirectMulti | Optuna:  28%|██▊       | 55/200 [1:27:44<3:07:18, 77.51s/it, best=0.922][I 2026-02-28 14:54:38,276] Trial 197 finished with value: 0.9122961893855848 and parameters: {'activation': 'relu', 'solver': 'adam', 'lr': 0.0003630457082500311, 'layer1': 362, 'layer2': 293, 'layer3': 500}. Best is trial 175 with value: 0.9170284245835123.

Escherichia_Coli | Piperacillin-Tazobactam | Optuna:  99%|█████████▉| 198/200 [6:50:30<03:49, 114.75s/it, best=0.917][A
Escherichia_Coli | Piperacillin-Tazobactam | Optuna:  99%|█████████▉| 198/200 [6:50:30<03:49, 114.75s/it, best=0.917][A[I 2026-02-28 14:54:48,441] Trial 9 finished with value: 0.7961346182518575 and parameters: {'activation': 'tanh', 'solver': 'sgd', 'lr': 0.00012329098365270507, 'layer1': 219, 'layer2': 22, 'layer3': 62}. Best is trial 8 with value: 0.8831343819710064.
Staphylococcus_Aureus | DirectMulti | Optuna:   5%|▌         | 10/200 [24:53<10:10:23, 192.75s/it, best=0.883]Staphylococcus_Aureus | DirectMulti | Optuna:   5%|▌         | 10/200 [24:53<10:10:23, 192.75s/it, best=0.883][I 2026-02-28 14:55:18,826] Trial 55 finished with value: 0.9197282707972916 and parameters: {'activation': 'identity', 'solver': 'adam', 'lr': 0.0011008589166263546, 'layer1': 277, 'layer2': 333, 'layer3': 286}. Best is trial 20 with value: 0.9222781385346849.
Klebsiella_Pneumoniae | DirectMulti | Optuna:  28%|██▊       | 56/200 [1:29:04<3:07:56, 78.31s/it, best=0.922]Klebsiella_Pneumoniae | DirectMulti | Optuna:  28%|██▊       | 56/200 [1:29:04<3:07:56, 78.31s/it, best=0.922][I 2026-02-28 14:56:42,815] Trial 198 finished with value: 0.9152390940748181 and parameters: {'activation': 'relu', 'solver': 'adam', 'lr': 0.00027771554823543203, 'layer1': 356, 'layer2': 305, 'layer3': 476}. Best is trial 175 with value: 0.9170284245835123.

Escherichia_Coli | Piperacillin-Tazobactam | Optuna: 100%|█████████▉| 199/200 [6:52:35<01:57, 117.69s/it, best=0.917][A
Escherichia_Coli | Piperacillin-Tazobactam | Optuna: 100%|█████████▉| 199/200 [6:52:35<01:57, 117.69s/it, best=0.917][A[I 2026-02-28 14:57:01,745] Trial 10 finished with value: 0.8287321232791316 and parameters: {'activation': 'identity', 'solver': 'sgd', 'lr': 0.007553503645583194, 'layer1': 366, 'layer2': 492, 'layer3': 320}. Best is trial 8 with value: 0.8831343819710064.
Staphylococcus_Aureus | DirectMulti | Optuna:   6%|▌         | 11/200 [27:07<9:09:51, 174.56s/it, best=0.883] Staphylococcus_Aureus | DirectMulti | Optuna:   6%|▌         | 11/200 [27:07<9:09:51, 174.56s/it, best=0.883][I 2026-02-28 14:57:01,995] Trial 56 finished with value: 0.9211604676713204 and parameters: {'activation': 'identity', 'solver': 'adam', 'lr': 0.0004245257137907403, 'layer1': 358, 'layer2': 389, 'layer3': 316}. Best is trial 20 with value: 0.9222781385346849.
Klebsiella_Pneumoniae | DirectMulti | Optuna:  28%|██▊       | 57/200 [1:30:47<3:24:24, 85.77s/it, best=0.922]Klebsiella_Pneumoniae | DirectMulti | Optuna:  28%|██▊       | 57/200 [1:30:47<3:24:24, 85.77s/it, best=0.922][I 2026-02-28 14:57:18,343] Trial 199 finished with value: 0.8966807347496839 and parameters: {'activation': 'relu', 'solver': 'sgd', 'lr': 0.0004915176620689793, 'layer1': 328, 'layer2': 388, 'layer3': 459}. Best is trial 175 with value: 0.9170284245835123.

Escherichia_Coli | Piperacillin-Tazobactam | Optuna: 100%|██████████| 200/200 [6:53:11<00:00, 93.04s/it, best=0.917] [A
Escherichia_Coli | Piperacillin-Tazobactam | Optuna: 100%|██████████| 200/200 [6:53:11<00:00, 93.04s/it, best=0.917][A
                                                                                                                    [A[Escherichia_Coli | Piperacillin-Tazobactam] [OPTUNA DONE] Best CV WF1=0.9170 | params={'activation': 'relu', 'solver': 'adam', 'lr': 0.00048704292933464703, 'layer1': 354, 'layer2': 294, 'layer3': 143}
[Escherichia_Coli | Piperacillin-Tazobactam] Retraining with validation early stopping (10% split)...
[Escherichia_Coli | Piperacillin-Tazobactam] [TEST] WF1=0.9030 | ACC=0.9152 | HL=0.0848 | best_val_WF1=0.9146
Escherichia_Coli | Binary antibiotics:  75%|███████▌  | 3/4 [24:10:04<7:51:57, 28317.14s/it] 
[Escherichia_Coli | Cefepime] Optuna search starting... (trials=200, cv=5)
[I 2026-02-28 14:57:35,224] A new study created in memory with name: no-name-0ce27561-3cb3-4a3b-a27c-2316b44e2721

Escherichia_Coli | Cefepime | Optuna:   0%|          | 0/200 [00:00<?, ?it/s][A[I 2026-02-28 14:57:56,590] Trial 11 finished with value: 0.8791155026220763 and parameters: {'activation': 'relu', 'solver': 'adam', 'lr': 0.0013124793805688133, 'layer1': 150, 'layer2': 163, 'layer3': 284}. Best is trial 8 with value: 0.8831343819710064.
Staphylococcus_Aureus | DirectMulti | Optuna:   6%|▌         | 12/200 [28:02<7:12:50, 138.14s/it, best=0.883]Staphylococcus_Aureus | DirectMulti | Optuna:   6%|▌         | 12/200 [28:02<7:12:50, 138.14s/it, best=0.883][I 2026-02-28 14:58:11,162] Trial 0 finished with value: 0.33119213370598183 and parameters: {'activation': 'logistic', 'solver': 'sgd', 'lr': 1.7073967431528114e-06, 'layer1': 435, 'layer2': 305, 'layer3': 357}. Best is trial 0 with value: 0.33119213370598183.

Escherichia_Coli | Cefepime | Optuna:   0%|          | 1/200 [00:35<1:59:11, 35.94s/it][A
Escherichia_Coli | Cefepime | Optuna:   0%|          | 1/200 [00:35<1:59:11, 35.94s/it, best=0.331][A[I 2026-02-28 14:58:35,502] Trial 57 finished with value: 0.9186093983054964 and parameters: {'activation': 'identity', 'solver': 'adam', 'lr': 0.0030336468565675683, 'layer1': 354, 'layer2': 387, 'layer3': 316}. Best is trial 20 with value: 0.9222781385346849.
Klebsiella_Pneumoniae | DirectMulti | Optuna:  29%|██▉       | 58/200 [1:32:21<3:28:28, 88.09s/it, best=0.922]Klebsiella_Pneumoniae | DirectMulti | Optuna:  29%|██▉       | 58/200 [1:32:21<3:28:28, 88.09s/it, best=0.922][I 2026-02-28 14:58:50,718] Trial 1 finished with value: 0.7551673893170594 and parameters: {'activation': 'logistic', 'solver': 'adam', 'lr': 1.6480446427978994e-05, 'layer1': 267, 'layer2': 222, 'layer3': 152}. Best is trial 1 with value: 0.7551673893170594.

Escherichia_Coli | Cefepime | Optuna:   1%|          | 2/200 [01:15<2:05:37, 38.07s/it, best=0.331][A
Escherichia_Coli | Cefepime | Optuna:   1%|          | 2/200 [01:15<2:05:37, 38.07s/it, best=0.755][A[I 2026-02-28 14:59:59,116] Trial 58 finished with value: 0.8706950279881234 and parameters: {'activation': 'identity', 'solver': 'sgd', 'lr': 0.0005846726250918988, 'layer1': 398, 'layer2': 402, 'layer3': 365}. Best is trial 20 with value: 0.9222781385346849.
Klebsiella_Pneumoniae | DirectMulti | Optuna:  30%|██▉       | 59/200 [1:33:44<3:23:51, 86.75s/it, best=0.922]Klebsiella_Pneumoniae | DirectMulti | Optuna:  30%|██▉       | 59/200 [1:33:44<3:23:51, 86.75s/it, best=0.922][I 2026-02-28 15:00:15,716] Trial 12 finished with value: 0.8845071747578412 and parameters: {'activation': 'identity', 'solver': 'adam', 'lr': 0.00046544039809979403, 'layer1': 347, 'layer2': 434, 'layer3': 419}. Best is trial 12 with value: 0.8845071747578412.
Staphylococcus_Aureus | DirectMulti | Optuna:   6%|▋         | 13/200 [30:21<7:11:28, 138.44s/it, best=0.883]Staphylococcus_Aureus | DirectMulti | Optuna:   6%|▋         | 13/200 [30:21<7:11:28, 138.44s/it, best=0.884][I 2026-02-28 15:00:29,532] Trial 59 finished with value: 0.8702461473038209 and parameters: {'activation': 'logistic', 'solver': 'adam', 'lr': 0.0019181032232690038, 'layer1': 422, 'layer2': 191, 'layer3': 14}. Best is trial 20 with value: 0.9222781385346849.
Klebsiella_Pneumoniae | DirectMulti | Optuna:  30%|███       | 60/200 [1:34:15<2:42:58, 69.85s/it, best=0.922]Klebsiella_Pneumoniae | DirectMulti | Optuna:  30%|███       | 60/200 [1:34:15<2:42:58, 69.85s/it, best=0.922][I 2026-02-28 15:01:12,958] Trial 2 finished with value: 0.838760235685536 and parameters: {'activation': 'identity', 'solver': 'adam', 'lr': 6.290644294586145e-06, 'layer1': 262, 'layer2': 300, 'layer3': 32}. Best is trial 2 with value: 0.838760235685536.

Escherichia_Coli | Cefepime | Optuna:   2%|▏         | 3/200 [03:37<4:41:09, 85.63s/it, best=0.755][A
