Klebsiella_Pneumoniae | DirectMulti | Optuna:  86%|████████▌ | 172/200 [4:23:53<33:00, 70.73s/it, best=0.924]Klebsiella_Pneumoniae | DirectMulti | Optuna:  86%|████████▌ | 172/200 [4:23:53<33:00, 70.73s/it, best=0.924][I 2026-02-28 17:50:43,553] Trial 84 finished with value: 0.8871746609539954 and parameters: {'activation': 'relu', 'solver': 'adam', 'lr': 0.00020358607773148866, 'layer1': 214, 'layer2': 330, 'layer3': 271}. Best is trial 72 with value: 0.8879714231951876.
Staphylococcus_Aureus | DirectMulti | Optuna:  42%|████▎     | 85/200 [3:20:48<3:19:48, 104.25s/it, best=0.888]Staphylococcus_Aureus | DirectMulti | Optuna:  42%|████▎     | 85/200 [3:20:48<3:19:48, 104.25s/it, best=0.888][I 2026-02-28 17:51:02,480] Trial 172 finished with value: 0.9216415651726451 and parameters: {'activation': 'tanh', 'solver': 'adam', 'lr': 0.0001576868447175901, 'layer1': 52, 'layer2': 97, 'layer3': 194}. Best is trial 152 with value: 0.9236023804402054.
Klebsiella_Pneumoniae | DirectMulti | Optuna:  86%|████████▋ | 173/200 [4:24:48<29:35, 65.76s/it, best=0.924]Klebsiella_Pneumoniae | DirectMulti | Optuna:  86%|████████▋ | 173/200 [4:24:48<29:35, 65.76s/it, best=0.924][I 2026-02-28 17:51:33,466] Trial 94 finished with value: 0.889083405960782 and parameters: {'activation': 'relu', 'solver': 'adam', 'lr': 0.0003101036929959158, 'layer1': 440, 'layer2': 248, 'layer3': 89}. Best is trial 84 with value: 0.8915097750553358.

Escherichia_Coli | Cefepime | Optuna:  48%|████▊     | 95/200 [2:53:58<2:54:04, 99.47s/it, best=0.891][A
Escherichia_Coli | Cefepime | Optuna:  48%|████▊     | 95/200 [2:53:58<2:54:04, 99.47s/it, best=0.891][A[I 2026-02-28 17:52:09,750] Trial 173 finished with value: 0.9213087495066672 and parameters: {'activation': 'tanh', 'solver': 'adam', 'lr': 8.153943174408045e-05, 'layer1': 10, 'layer2': 138, 'layer3': 435}. Best is trial 152 with value: 0.9236023804402054.
Klebsiella_Pneumoniae | DirectMulti | Optuna:  87%|████████▋ | 174/200 [4:25:55<28:41, 66.21s/it, best=0.924]Klebsiella_Pneumoniae | DirectMulti | Optuna:  87%|████████▋ | 174/200 [4:25:55<28:41, 66.21s/it, best=0.924][I 2026-02-28 17:52:50,066] Trial 85 finished with value: 0.8835027039550221 and parameters: {'activation': 'logistic', 'solver': 'adam', 'lr': 0.0003143388628003082, 'layer1': 217, 'layer2': 332, 'layer3': 276}. Best is trial 72 with value: 0.8879714231951876.
Staphylococcus_Aureus | DirectMulti | Optuna:  43%|████▎     | 86/200 [3:22:55<3:30:45, 110.93s/it, best=0.888]Staphylococcus_Aureus | DirectMulti | Optuna:  43%|████▎     | 86/200 [3:22:55<3:30:45, 110.93s/it, best=0.888][I 2026-02-28 17:53:02,251] Trial 174 finished with value: 0.920880576787043 and parameters: {'activation': 'tanh', 'solver': 'adam', 'lr': 9.948170143423675e-05, 'layer1': 30, 'layer2': 83, 'layer3': 400}. Best is trial 152 with value: 0.9236023804402054.
Klebsiella_Pneumoniae | DirectMulti | Optuna:  88%|████████▊ | 175/200 [4:26:47<25:52, 62.10s/it, best=0.924]Klebsiella_Pneumoniae | DirectMulti | Optuna:  88%|████████▊ | 175/200 [4:26:47<25:52, 62.10s/it, best=0.924][I 2026-02-28 17:53:23,240] Trial 95 finished with value: 0.888162372182481 and parameters: {'activation': 'relu', 'solver': 'adam', 'lr': 0.0001303677920747242, 'layer1': 430, 'layer2': 313, 'layer3': 182}. Best is trial 84 with value: 0.8915097750553358.

Escherichia_Coli | Cefepime | Optuna:  48%|████▊     | 96/200 [2:55:48<2:57:46, 102.56s/it, best=0.891][A
Escherichia_Coli | Cefepime | Optuna:  48%|████▊     | 96/200 [2:55:48<2:57:46, 102.56s/it, best=0.891][A[I 2026-02-28 17:54:15,753] Trial 175 finished with value: 0.9210963364001332 and parameters: {'activation': 'tanh', 'solver': 'adam', 'lr': 6.73420168086081e-05, 'layer1': 77, 'layer2': 172, 'layer3': 447}. Best is trial 152 with value: 0.9236023804402054.
Klebsiella_Pneumoniae | DirectMulti | Optuna:  88%|████████▊ | 176/200 [4:28:01<26:12, 65.52s/it, best=0.924]Klebsiella_Pneumoniae | DirectMulti | Optuna:  88%|████████▊ | 176/200 [4:28:01<26:12, 65.52s/it, best=0.924][I 2026-02-28 17:54:19,576] Trial 86 finished with value: 0.8871546722299568 and parameters: {'activation': 'relu', 'solver': 'adam', 'lr': 0.00022515852946773822, 'layer1': 176, 'layer2': 409, 'layer3': 44}. Best is trial 72 with value: 0.8879714231951876.
Staphylococcus_Aureus | DirectMulti | Optuna:  44%|████▎     | 87/200 [3:24:24<3:16:48, 104.50s/it, best=0.888]Staphylococcus_Aureus | DirectMulti | Optuna:  44%|████▎     | 87/200 [3:24:24<3:16:48, 104.50s/it, best=0.888][I 2026-02-28 17:54:49,774] Trial 96 finished with value: 0.8860167169304308 and parameters: {'activation': 'relu', 'solver': 'adam', 'lr': 0.00048598237211965934, 'layer1': 468, 'layer2': 168, 'layer3': 119}. Best is trial 84 with value: 0.8915097750553358.

Escherichia_Coli | Cefepime | Optuna:  48%|████▊     | 97/200 [2:57:14<2:47:48, 97.75s/it, best=0.891] [A
Escherichia_Coli | Cefepime | Optuna:  48%|████▊     | 97/200 [2:57:14<2:47:48, 97.75s/it, best=0.891][A[I 2026-02-28 17:55:07,504] Trial 176 finished with value: 0.9214780138261727 and parameters: {'activation': 'tanh', 'solver': 'adam', 'lr': 0.0001265110311664317, 'layer1': 64, 'layer2': 251, 'layer3': 421}. Best is trial 152 with value: 0.9236023804402054.
Klebsiella_Pneumoniae | DirectMulti | Optuna:  88%|████████▊ | 177/200 [4:28:53<23:31, 61.39s/it, best=0.924]Klebsiella_Pneumoniae | DirectMulti | Optuna:  88%|████████▊ | 177/200 [4:28:53<23:31, 61.39s/it, best=0.924][I 2026-02-28 17:55:40,091] Trial 87 finished with value: 0.8031451881084436 and parameters: {'activation': 'relu', 'solver': 'sgd', 'lr': 0.00023248116747069122, 'layer1': 186, 'layer2': 404, 'layer3': 42}. Best is trial 72 with value: 0.8879714231951876.
Staphylococcus_Aureus | DirectMulti | Optuna:  44%|████▍     | 88/200 [3:25:45<3:01:38, 97.31s/it, best=0.888] Staphylococcus_Aureus | DirectMulti | Optuna:  44%|████▍     | 88/200 [3:25:45<3:01:38, 97.31s/it, best=0.888][I 2026-02-28 17:56:33,624] Trial 97 finished with value: 0.8821005000702382 and parameters: {'activation': 'identity', 'solver': 'adam', 'lr': 0.00022665419464110322, 'layer1': 459, 'layer2': 148, 'layer3': 56}. Best is trial 84 with value: 0.8915097750553358.

Escherichia_Coli | Cefepime | Optuna:  49%|████▉     | 98/200 [2:58:58<2:49:17, 99.58s/it, best=0.891][A
Escherichia_Coli | Cefepime | Optuna:  49%|████▉     | 98/200 [2:58:58<2:49:17, 99.58s/it, best=0.891][A[I 2026-02-28 17:56:33,884] Trial 177 finished with value: 0.9207526186451854 and parameters: {'activation': 'tanh', 'solver': 'adam', 'lr': 4.158862425074743e-05, 'layer1': 41, 'layer2': 460, 'layer3': 377}. Best is trial 152 with value: 0.9236023804402054.
Klebsiella_Pneumoniae | DirectMulti | Optuna:  89%|████████▉ | 178/200 [4:30:19<25:15, 68.89s/it, best=0.924]Klebsiella_Pneumoniae | DirectMulti | Optuna:  89%|████████▉ | 178/200 [4:30:19<25:15, 68.89s/it, best=0.924][I 2026-02-28 17:57:05,194] Trial 88 finished with value: 0.8865154733782837 and parameters: {'activation': 'relu', 'solver': 'adam', 'lr': 0.0004321885076872389, 'layer1': 159, 'layer2': 373, 'layer3': 68}. Best is trial 72 with value: 0.8879714231951876.
Staphylococcus_Aureus | DirectMulti | Optuna:  44%|████▍     | 89/200 [3:27:10<2:53:14, 93.65s/it, best=0.888]Staphylococcus_Aureus | DirectMulti | Optuna:  44%|████▍     | 89/200 [3:27:10<2:53:14, 93.65s/it, best=0.888][I 2026-02-28 17:57:34,433] Trial 178 finished with value: 0.920967181745595 and parameters: {'activation': 'tanh', 'solver': 'adam', 'lr': 8.056145646581143e-05, 'layer1': 51, 'layer2': 128, 'layer3': 363}. Best is trial 152 with value: 0.9236023804402054.
Klebsiella_Pneumoniae | DirectMulti | Optuna:  90%|████████▉ | 179/200 [4:31:20<23:14, 66.38s/it, best=0.924]Klebsiella_Pneumoniae | DirectMulti | Optuna:  90%|████████▉ | 179/200 [4:31:20<23:14, 66.38s/it, best=0.924][I 2026-02-28 17:58:13,574] Trial 98 finished with value: 0.8895612585633307 and parameters: {'activation': 'relu', 'solver': 'adam', 'lr': 8.873895643427134e-05, 'layer1': 479, 'layer2': 238, 'layer3': 96}. Best is trial 84 with value: 0.8915097750553358.

Escherichia_Coli | Cefepime | Optuna:  50%|████▉     | 99/200 [3:00:38<2:47:48, 99.69s/it, best=0.891][A
Escherichia_Coli | Cefepime | Optuna:  50%|████▉     | 99/200 [3:00:38<2:47:48, 99.69s/it, best=0.891][A[I 2026-02-28 17:58:34,077] Trial 89 finished with value: 0.8837010908746965 and parameters: {'activation': 'relu', 'solver': 'adam', 'lr': 0.0006017342854968046, 'layer1': 159, 'layer2': 369, 'layer3': 10}. Best is trial 72 with value: 0.8879714231951876.
Staphylococcus_Aureus | DirectMulti | Optuna:  45%|████▌     | 90/200 [3:28:39<2:49:03, 92.22s/it, best=0.888]Staphylococcus_Aureus | DirectMulti | Optuna:  45%|████▌     | 90/200 [3:28:39<2:49:03, 92.22s/it, best=0.888][I 2026-02-28 17:58:48,083] Trial 99 finished with value: 0.760400229277217 and parameters: {'activation': 'relu', 'solver': 'sgd', 'lr': 0.0002019171937279661, 'layer1': 447, 'layer2': 303, 'layer3': 122}. Best is trial 84 with value: 0.8915097750553358.

Escherichia_Coli | Cefepime | Optuna:  50%|█████     | 100/200 [3:01:12<2:13:33, 80.14s/it, best=0.891][A
Escherichia_Coli | Cefepime | Optuna:  50%|█████     | 100/200 [3:01:12<2:13:33, 80.14s/it, best=0.891][A[I 2026-02-28 17:58:49,693] Trial 179 finished with value: 0.9192294848114673 and parameters: {'activation': 'tanh', 'solver': 'adam', 'lr': 5.1586769742011223e-05, 'layer1': 30, 'layer2': 38, 'layer3': 412}. Best is trial 152 with value: 0.9236023804402054.
Klebsiella_Pneumoniae | DirectMulti | Optuna:  90%|█████████ | 180/200 [4:32:35<23:00, 69.05s/it, best=0.924]Klebsiella_Pneumoniae | DirectMulti | Optuna:  90%|█████████ | 180/200 [4:32:35<23:00, 69.05s/it, best=0.924][I 2026-02-28 17:59:35,047] Trial 90 finished with value: 0.8849768266940442 and parameters: {'activation': 'relu', 'solver': 'adam', 'lr': 0.00044696603565541073, 'layer1': 128, 'layer2': 435, 'layer3': 76}. Best is trial 72 with value: 0.8879714231951876.
Staphylococcus_Aureus | DirectMulti | Optuna:  46%|████▌     | 91/200 [3:29:40<2:30:29, 82.84s/it, best=0.888]Staphylococcus_Aureus | DirectMulti | Optuna:  46%|████▌     | 91/200 [3:29:40<2:30:29, 82.84s/it, best=0.888][I 2026-02-28 18:00:05,407] Trial 180 finished with value: 0.9201325357625751 and parameters: {'activation': 'tanh', 'solver': 'adam', 'lr': 6.156845011404047e-05, 'layer1': 57, 'layer2': 114, 'layer3': 456}. Best is trial 152 with value: 0.9236023804402054.
Klebsiella_Pneumoniae | DirectMulti | Optuna:  90%|█████████ | 181/200 [4:33:51<22:29, 71.05s/it, best=0.924]Klebsiella_Pneumoniae | DirectMulti | Optuna:  90%|█████████ | 181/200 [4:33:51<22:29, 71.05s/it, best=0.924][I 2026-02-28 18:00:53,857] Trial 100 finished with value: 0.8871623954098847 and parameters: {'activation': 'relu', 'solver': 'adam', 'lr': 6.593981985285838e-05, 'layer1': 489, 'layer2': 220, 'layer3': 194}. Best is trial 84 with value: 0.8915097750553358.

Escherichia_Coli | Cefepime | Optuna:  50%|█████     | 101/200 [3:03:18<2:34:49, 93.83s/it, best=0.891][A
Escherichia_Coli | Cefepime | Optuna:  50%|█████     | 101/200 [3:03:18<2:34:49, 93.83s/it, best=0.891][A[I 2026-02-28 18:00:58,208] Trial 181 finished with value: 0.9200047914495044 and parameters: {'activation': 'identity', 'solver': 'adam', 'lr': 0.0017582259402106368, 'layer1': 21, 'layer2': 200, 'layer3': 396}. Best is trial 152 with value: 0.9236023804402054.
Klebsiella_Pneumoniae | DirectMulti | Optuna:  91%|█████████ | 182/200 [4:34:43<19:40, 65.57s/it, best=0.924]Klebsiella_Pneumoniae | DirectMulti | Optuna:  91%|█████████ | 182/200 [4:34:43<19:40, 65.57s/it, best=0.924][I 2026-02-28 18:01:10,418] Trial 91 finished with value: 0.8859257816971162 and parameters: {'activation': 'relu', 'solver': 'adam', 'lr': 0.0002153593681838522, 'layer1': 160, 'layer2': 408, 'layer3': 62}. Best is trial 72 with value: 0.8879714231951876.
Staphylococcus_Aureus | DirectMulti | Optuna:  46%|████▌     | 92/200 [3:31:15<2:35:52, 86.60s/it, best=0.888]Staphylococcus_Aureus | DirectMulti | Optuna:  46%|████▌     | 92/200 [3:31:15<2:35:52, 86.60s/it, best=0.888][I 2026-02-28 18:02:05,898] Trial 182 finished with value: 0.9216207612336464 and parameters: {'activation': 'tanh', 'solver': 'adam', 'lr': 0.00010964806192093621, 'layer1': 18, 'layer2': 160, 'layer3': 441}. Best is trial 152 with value: 0.9236023804402054.
Klebsiella_Pneumoniae | DirectMulti | Optuna:  92%|█████████▏| 183/200 [4:35:51<18:45, 66.21s/it, best=0.924]Klebsiella_Pneumoniae | DirectMulti | Optuna:  92%|█████████▏| 183/200 [4:35:51<18:45, 66.21s/it, best=0.924][I 2026-02-28 18:02:41,713] Trial 101 finished with value: 0.8885788241685356 and parameters: {'activation': 'relu', 'solver': 'adam', 'lr': 0.00015463097292384468, 'layer1': 499, 'layer2': 274, 'layer3': 208}. Best is trial 84 with value: 0.8915097750553358.

Escherichia_Coli | Cefepime | Optuna:  51%|█████     | 102/200 [3:05:06<2:40:07, 98.04s/it, best=0.891][A
Escherichia_Coli | Cefepime | Optuna:  51%|█████     | 102/200 [3:05:06<2:40:07, 98.04s/it, best=0.891][A[I 2026-02-28 18:02:48,559] Trial 92 finished with value: 0.8858672210302483 and parameters: {'activation': 'relu', 'solver': 'adam', 'lr': 0.00017015604053066783, 'layer1': 119, 'layer2': 286, 'layer3': 101}. Best is trial 72 with value: 0.8879714231951876.
Staphylococcus_Aureus | DirectMulti | Optuna:  46%|████▋     | 93/200 [3:32:53<2:40:36, 90.06s/it, best=0.888]Staphylococcus_Aureus | DirectMulti | Optuna:  46%|████▋     | 93/200 [3:32:53<2:40:36, 90.06s/it, best=0.888][I 2026-02-28 18:03:07,248] Trial 183 finished with value: 0.9205858418875987 and parameters: {'activation': 'tanh', 'solver': 'adam', 'lr': 9.516933913117419e-05, 'layer1': 38, 'layer2': 56, 'layer3': 267}. Best is trial 152 with value: 0.9236023804402054.
Klebsiella_Pneumoniae | DirectMulti | Optuna:  92%|█████████▏| 184/200 [4:36:52<17:16, 64.75s/it, best=0.924]Klebsiella_Pneumoniae | DirectMulti | Optuna:  92%|█████████▏| 184/200 [4:36:52<17:16, 64.75s/it, best=0.924][I 2026-02-28 18:03:22,875] Trial 93 finished with value: 0.8126439784349644 and parameters: {'activation': 'logistic', 'solver': 'adam', 'lr': 0.005737485852178802, 'layer1': 94, 'layer2': 385, 'layer3': 46}. Best is trial 72 with value: 0.8879714231951876.
Staphylococcus_Aureus | DirectMulti | Optuna:  47%|████▋     | 94/200 [3:33:28<2:09:33, 73.34s/it, best=0.888]Staphylococcus_Aureus | DirectMulti | Optuna:  47%|████▋     | 94/200 [3:33:28<2:09:33, 73.34s/it, best=0.888][I 2026-02-28 18:03:49,439] Trial 184 finished with value: 0.9137882418172106 and parameters: {'activation': 'tanh', 'solver': 'adam', 'lr': 0.0010058429536146305, 'layer1': 29, 'layer2': 358, 'layer3': 256}. Best is trial 152 with value: 0.9236023804402054.
Klebsiella_Pneumoniae | DirectMulti | Optuna:  92%|█████████▎| 185/200 [4:37:35<14:29, 57.98s/it, best=0.924]Klebsiella_Pneumoniae | DirectMulti | Optuna:  92%|█████████▎| 185/200 [4:37:35<14:29, 57.98s/it, best=0.924][I 2026-02-28 18:04:23,374] Trial 102 finished with value: 0.8896984229203981 and parameters: {'activation': 'relu', 'solver': 'adam', 'lr': 0.00013420230201811913, 'layer1': 473, 'layer2': 271, 'layer3': 88}. Best is trial 84 with value: 0.8915097750553358.

Escherichia_Coli | Cefepime | Optuna:  52%|█████▏    | 103/200 [3:06:48<2:40:15, 99.12s/it, best=0.891][A
Escherichia_Coli | Cefepime | Optuna:  52%|█████▏    | 103/200 [3:06:48<2:40:15, 99.12s/it, best=0.891][A[I 2026-02-28 18:04:40,442] Trial 185 finished with value: 0.9176790394938836 and parameters: {'activation': 'relu', 'solver': 'adam', 'lr': 0.00053938783489831, 'layer1': 10, 'layer2': 480, 'layer3': 431}. Best is trial 152 with value: 0.9236023804402054.
Klebsiella_Pneumoniae | DirectMulti | Optuna:  93%|█████████▎| 186/200 [4:38:26<13:02, 55.89s/it, best=0.924]Klebsiella_Pneumoniae | DirectMulti | Optuna:  93%|█████████▎| 186/200 [4:38:26<13:02, 55.89s/it, best=0.924][I 2026-02-28 18:04:44,749] Trial 94 finished with value: 0.886608498277764 and parameters: {'activation': 'relu', 'solver': 'adam', 'lr': 0.0007597577445526546, 'layer1': 181, 'layer2': 332, 'layer3': 79}. Best is trial 72 with value: 0.8879714231951876.
Staphylococcus_Aureus | DirectMulti | Optuna:  48%|████▊     | 95/200 [3:34:50<2:12:49, 75.90s/it, best=0.888]Staphylococcus_Aureus | DirectMulti | Optuna:  48%|████▊     | 95/200 [3:34:50<2:12:49, 75.90s/it, best=0.888][I 2026-02-28 18:05:25,228] Trial 186 finished with value: 0.9174691288555328 and parameters: {'activation': 'tanh', 'solver': 'adam', 'lr': 0.000747243331069245, 'layer1': 41, 'layer2': 472, 'layer3': 384}. Best is trial 152 with value: 0.9236023804402054.
Klebsiella_Pneumoniae | DirectMulti | Optuna:  94%|█████████▎| 187/200 [4:39:10<11:23, 52.56s/it, best=0.924]Klebsiella_Pneumoniae | DirectMulti | Optuna:  94%|█████████▎| 187/200 [4:39:10<11:23, 52.56s/it, best=0.924][I 2026-02-28 18:06:02,181] Trial 95 finished with value: 0.884244133523865 and parameters: {'activation': 'relu', 'solver': 'adam', 'lr': 0.0007491492889342278, 'layer1': 176, 'layer2': 357, 'layer3': 28}. Best is trial 72 with value: 0.8879714231951876.
Staphylococcus_Aureus | DirectMulti | Optuna:  48%|████▊     | 96/200 [3:36:07<2:12:21, 76.36s/it, best=0.888]Staphylococcus_Aureus | DirectMulti | Optuna:  48%|████▊     | 96/200 [3:36:07<2:12:21, 76.36s/it, best=0.888][I 2026-02-28 18:06:27,333] Trial 103 finished with value: 0.8874285344048559 and parameters: {'activation': 'relu', 'solver': 'adam', 'lr': 5.435690425222274e-05, 'layer1': 471, 'layer2': 253, 'layer3': 112}. Best is trial 84 with value: 0.8915097750553358.

Escherichia_Coli | Cefepime | Optuna:  52%|█████▏    | 104/200 [3:08:52<2:50:31, 106.57s/it, best=0.891][A
Escherichia_Coli | Cefepime | Optuna:  52%|█████▏    | 104/200 [3:08:52<2:50:31, 106.57s/it, best=0.891][A[I 2026-02-28 18:07:27,523] Trial 96 finished with value: 0.883058016578922 and parameters: {'activation': 'relu', 'solver': 'adam', 'lr': 0.0014492549480317788, 'layer1': 205, 'layer2': 334, 'layer3': 31}. Best is trial 72 with value: 0.8879714231951876.
Staphylococcus_Aureus | DirectMulti | Optuna:  48%|████▊     | 97/200 [3:37:32<2:15:42, 79.05s/it, best=0.888]Staphylococcus_Aureus | DirectMulti | Optuna:  48%|████▊     | 97/200 [3:37:32<2:15:42, 79.05s/it, best=0.888][I 2026-02-28 18:07:37,975] Trial 187 finished with value: 0.9207002516567773 and parameters: {'activation': 'tanh', 'solver': 'adam', 'lr': 5.577714826445577e-05, 'layer1': 475, 'layer2': 492, 'layer3': 423}. Best is trial 152 with value: 0.9236023804402054.
Klebsiella_Pneumoniae | DirectMulti | Optuna:  94%|█████████▍| 188/200 [4:41:23<15:19, 76.61s/it, best=0.924]Klebsiella_Pneumoniae | DirectMulti | Optuna:  94%|█████████▍| 188/200 [4:41:23<15:19, 76.61s/it, best=0.924][I 2026-02-28 18:08:23,101] Trial 104 finished with value: 0.8903254277158272 and parameters: {'activation': 'relu', 'solver': 'adam', 'lr': 0.00011833609999658679, 'layer1': 452, 'layer2': 345, 'layer3': 145}. Best is trial 84 with value: 0.8915097750553358.

Escherichia_Coli | Cefepime | Optuna:  52%|█████▎    | 105/200 [3:10:47<2:53:06, 109.33s/it, best=0.891][A
Escherichia_Coli | Cefepime | Optuna:  52%|█████▎    | 105/200 [3:10:47<2:53:06, 109.33s/it, best=0.891][A[I 2026-02-28 18:08:25,805] Trial 97 finished with value: 0.8824651264612653 and parameters: {'activation': 'relu', 'solver': 'adam', 'lr': 0.0010395650503565819, 'layer1': 163, 'layer2': 370, 'layer3': 75}. Best is trial 72 with value: 0.8879714231951876.
Staphylococcus_Aureus | DirectMulti | Optuna:  49%|████▉     | 98/200 [3:38:31<2:03:47, 72.82s/it, best=0.888]Staphylococcus_Aureus | DirectMulti | Optuna:  49%|████▉     | 98/200 [3:38:31<2:03:47, 72.82s/it, best=0.888][I 2026-02-28 18:08:44,938] Trial 188 finished with value: 0.9209002431959907 and parameters: {'activation': 'identity', 'solver': 'adam', 'lr': 0.00029456584662407775, 'layer1': 48, 'layer2': 484, 'layer3': 371}. Best is trial 152 with value: 0.9236023804402054.
Klebsiella_Pneumoniae | DirectMulti | Optuna:  94%|█████████▍| 189/200 [4:42:30<13:30, 73.72s/it, best=0.924]Klebsiella_Pneumoniae | DirectMulti | Optuna:  94%|█████████▍| 189/200 [4:42:30<13:30, 73.72s/it, best=0.924][I 2026-02-28 18:09:52,552] Trial 98 finished with value: 0.8839882067093674 and parameters: {'activation': 'relu', 'solver': 'adam', 'lr': 0.00041715570860372913, 'layer1': 198, 'layer2': 486, 'layer3': 93}. Best is trial 72 with value: 0.8879714231951876.
Staphylococcus_Aureus | DirectMulti | Optuna:  50%|████▉     | 99/200 [3:39:57<2:09:36, 77.00s/it, best=0.888]Staphylococcus_Aureus | DirectMulti | Optuna:  50%|████▉     | 99/200 [3:39:57<2:09:36, 77.00s/it, best=0.888][I 2026-02-28 18:09:58,500] Trial 189 finished with value: 0.9206794776279418 and parameters: {'activation': 'tanh', 'solver': 'adam', 'lr': 7.206234905031399e-05, 'layer1': 23, 'layer2': 450, 'layer3': 281}. Best is trial 152 with value: 0.9236023804402054.
Klebsiella_Pneumoniae | DirectMulti | Optuna:  95%|█████████▌| 190/200 [4:43:44<12:16, 73.67s/it, best=0.924]Klebsiella_Pneumoniae | DirectMulti | Optuna:  95%|█████████▌| 190/200 [4:43:44<12:16, 73.67s/it, best=0.924][I 2026-02-28 18:10:06,519] Trial 105 finished with value: 0.8886698744643435 and parameters: {'activation': 'relu', 'solver': 'adam', 'lr': 9.649978231905672e-05, 'layer1': 452, 'layer2': 331, 'layer3': 139}. Best is trial 84 with value: 0.8915097750553358.

Escherichia_Coli | Cefepime | Optuna:  53%|█████▎    | 106/200 [3:12:31<2:48:30, 107.56s/it, best=0.891][A
