[INFO] Output: /export/usuarios01/egarroyo/MALDI_for_AMR_prediction/saved_models/benchmark_mlp_20260227_144726
[INFO] Device: cpu
[INFO] Loaded X=(14925, 1600), amr=(14925, 9), species=(14925,), antibiotics=9
Removing duplicates:   0%|          | 0/14925 [00:00<?, ?it/s]Removing duplicates:  28%|██▊       | 4164/14925 [00:00<00:00, 41633.79it/s]Removing duplicates:  56%|█████▌    | 8328/14925 [00:00<00:00, 41300.72it/s]Removing duplicates:  84%|████████▍ | 12559/14925 [00:00<00:00, 41758.01it/s]                                                                             [INFO] After duplicates removal: X=(14924, 1600)

================ STARTING SPECIES PIPELINES ================

[Parallel(n_jobs=5)]: Using backend LokyBackend with 5 concurrent workers.

==========================================================================================
[START] Species: Staphylococcus_Aureus
         Antibiotics: ['Oxacillin', 'Clindamycin', 'Fusidic acid']
==========================================================================================
[Staphylococcus_Aureus] Loading + filtering...
[Staphylococcus_Aureus] isolates: 3791 -> after ab NaNs: 3556 -> after feature NaNs: 3556
[Staphylococcus_Aureus] Building LPS patterns...

==========================================================================================
[START] Species: Pseudomonas_Aeruginosa
         Antibiotics: ['Ciprofloxacin', 'Imipenem', 'Meropenem']
==========================================================================================
[Pseudomonas_Aeruginosa] Loading + filtering...
[Pseudomonas_Aeruginosa] isolates: 3274 -> after ab NaNs: 2262 -> after feature NaNs: 2262
[Pseudomonas_Aeruginosa] Building LPS patterns...

==========================================================================================
[START] Species: Klebsiella_Pneumoniae
         Antibiotics: ['Ciprofloxacin', 'Ceftriaxone', 'Imipenem', 'Meropenem']
==========================================================================================
[Klebsiella_Pneumoniae] Loading + filtering...
[Klebsiella_Pneumoniae] isolates: 2869 -> after ab NaNs: 2813 -> after feature NaNs: 2813
[Klebsiella_Pneumoniae] Building LPS patterns...

==========================================================================================
[START] Species: Escherichia_Coli
         Antibiotics: ['Ciprofloxacin', 'Ceftriaxone', 'Piperacillin-Tazobactam', 'Cefepime']
==========================================================================================
[Escherichia_Coli] Loading + filtering...
[Staphylococcus_Aureus] patterns: 8 -> kept: 8 (min_count=5)
[Staphylococcus_Aureus] isolates after pattern filtering: 3556
[Staphylococcus_Aureus] Train/test split stratified by pattern (test_size=0.2)...
[Staphylococcus_Aureus] Train size: 2844 | Test size: 712
[Staphylococcus_Aureus] StandardScaler fit on train...
[Escherichia_Coli] isolates: 4990 -> after ab NaNs: 4663 -> after feature NaNs: 4663
[Escherichia_Coli] Building LPS patterns...
[Pseudomonas_Aeruginosa] patterns: 7 -> kept: 7 (min_count=5)
[Pseudomonas_Aeruginosa] isolates after pattern filtering: 2262
[Pseudomonas_Aeruginosa] Train/test split stratified by pattern (test_size=0.2)...
[Pseudomonas_Aeruginosa] Train size: 1809 | Test size: 453
[Pseudomonas_Aeruginosa] StandardScaler fit on train...

[Pseudomonas_Aeruginosa] ===== Binary training (one model per antibiotic) =====
Pseudomonas_Aeruginosa | Binary antibiotics:   0%|          | 0/3 [00:00<?, ?it/s]
[Pseudomonas_Aeruginosa | Ciprofloxacin] Optuna search starting... (trials=200, cv=5)
[I 2026-02-27 14:47:30,317] A new study created in memory with name: no-name-0d98d5ff-dbf6-4c2e-8fad-7c63029d22a9

Pseudomonas_Aeruginosa | Ciprofloxacin | Optuna:   0%|          | 0/200 [00:00<?, ?it/s][A
[Staphylococcus_Aureus] ===== Binary training (one model per antibiotic) =====
Staphylococcus_Aureus | Binary antibiotics:   0%|          | 0/3 [00:00<?, ?it/s]
[Staphylococcus_Aureus | Oxacillin] Optuna search starting... (trials=200, cv=5)
[I 2026-02-27 14:47:30,329] A new study created in memory with name: no-name-08466419-99ec-4585-b640-6216e53b63ed

Staphylococcus_Aureus | Oxacillin | Optuna:   0%|          | 0/200 [00:00<?, ?it/s][A[Klebsiella_Pneumoniae] patterns: 9 -> kept: 7 (min_count=5)
[Klebsiella_Pneumoniae] isolates after pattern filtering: 2810
[Klebsiella_Pneumoniae] Train/test split stratified by pattern (test_size=0.2)...
[Klebsiella_Pneumoniae] Train size: 2248 | Test size: 562
[Klebsiella_Pneumoniae] StandardScaler fit on train...

[Klebsiella_Pneumoniae] ===== Binary training (one model per antibiotic) =====
Klebsiella_Pneumoniae | Binary antibiotics:   0%|          | 0/4 [00:00<?, ?it/s]
[Klebsiella_Pneumoniae | Ciprofloxacin] Optuna search starting... (trials=200, cv=5)
[I 2026-02-27 14:47:30,436] A new study created in memory with name: no-name-d543693c-8282-44ca-be01-8fcdd972a6f4

Klebsiella_Pneumoniae | Ciprofloxacin | Optuna:   0%|          | 0/200 [00:00<?, ?it/s][A[Escherichia_Coli] patterns: 13 -> kept: 12 (min_count=5)
[Escherichia_Coli] isolates after pattern filtering: 4659
[Escherichia_Coli] Train/test split stratified by pattern (test_size=0.2)...
[Escherichia_Coli] Train size: 3727 | Test size: 932
[Escherichia_Coli] StandardScaler fit on train...

[Escherichia_Coli] ===== Binary training (one model per antibiotic) =====
Escherichia_Coli | Binary antibiotics:   0%|          | 0/4 [00:00<?, ?it/s]
[Escherichia_Coli | Ciprofloxacin] Optuna search starting... (trials=200, cv=5)
[I 2026-02-27 14:47:30,629] A new study created in memory with name: no-name-b0b95158-f87f-4c77-96ec-31df37d3f76b

Escherichia_Coli | Ciprofloxacin | Optuna:   0%|          | 0/200 [00:00<?, ?it/s][A[I 2026-02-27 14:47:58,985] Trial 0 finished with value: 0.3289369980686764 and parameters: {'activation': 'logistic', 'solver': 'sgd', 'lr': 1.7073967431528114e-06, 'layer1': 435, 'layer2': 305, 'layer3': 357}. Best is trial 0 with value: 0.3289369980686764.

Klebsiella_Pneumoniae | Ciprofloxacin | Optuna:   0%|          | 1/200 [00:28<1:34:41, 28.55s/it][A
Klebsiella_Pneumoniae | Ciprofloxacin | Optuna:   0%|          | 1/200 [00:28<1:34:41, 28.55s/it, best=0.329][A[I 2026-02-27 14:48:00,387] Trial 0 finished with value: 0.6580697640688988 and parameters: {'activation': 'logistic', 'solver': 'sgd', 'lr': 1.7073967431528114e-06, 'layer1': 435, 'layer2': 305, 'layer3': 357}. Best is trial 0 with value: 0.6580697640688988.

Pseudomonas_Aeruginosa | Ciprofloxacin | Optuna:   0%|          | 1/200 [00:30<1:39:43, 30.07s/it][A
Pseudomonas_Aeruginosa | Ciprofloxacin | Optuna:   0%|          | 1/200 [00:30<1:39:43, 30.07s/it, best=0.658][A[I 2026-02-27 14:48:14,861] Trial 0 finished with value: 0.19778314412473774 and parameters: {'activation': 'logistic', 'solver': 'sgd', 'lr': 1.7073967431528114e-06, 'layer1': 435, 'layer2': 305, 'layer3': 357}. Best is trial 0 with value: 0.19778314412473774.

Staphylococcus_Aureus | Oxacillin | Optuna:   0%|          | 1/200 [00:44<2:27:41, 44.53s/it][A
Staphylococcus_Aureus | Oxacillin | Optuna:   0%|          | 1/200 [00:44<2:27:41, 44.53s/it, best=0.198][A[I 2026-02-27 14:48:25,332] Trial 1 finished with value: 0.8171974483951715 and parameters: {'activation': 'logistic', 'solver': 'adam', 'lr': 1.6480446427978994e-05, 'layer1': 267, 'layer2': 222, 'layer3': 152}. Best is trial 1 with value: 0.8171974483951715.

Pseudomonas_Aeruginosa | Ciprofloxacin | Optuna:   1%|          | 2/200 [00:55<1:29:16, 27.06s/it, best=0.658][A
Pseudomonas_Aeruginosa | Ciprofloxacin | Optuna:   1%|          | 2/200 [00:55<1:29:16, 27.06s/it, best=0.817][A[I 2026-02-27 14:48:27,215] Trial 0 finished with value: 0.32068082388921015 and parameters: {'activation': 'logistic', 'solver': 'sgd', 'lr': 1.7073967431528114e-06, 'layer1': 435, 'layer2': 305, 'layer3': 357}. Best is trial 0 with value: 0.32068082388921015.

Escherichia_Coli | Ciprofloxacin | Optuna:   0%|          | 1/200 [00:56<3:07:40, 56.59s/it][A
Escherichia_Coli | Ciprofloxacin | Optuna:   0%|          | 1/200 [00:56<3:07:40, 56.59s/it, best=0.321][A[I 2026-02-27 14:48:29,452] Trial 1 finished with value: 0.7417840809323848 and parameters: {'activation': 'logistic', 'solver': 'adam', 'lr': 1.6480446427978994e-05, 'layer1': 267, 'layer2': 222, 'layer3': 152}. Best is trial 1 with value: 0.7417840809323848.

Klebsiella_Pneumoniae | Ciprofloxacin | Optuna:   1%|          | 2/200 [00:59<1:37:56, 29.68s/it, best=0.329][A
Klebsiella_Pneumoniae | Ciprofloxacin | Optuna:   1%|          | 2/200 [00:59<1:37:56, 29.68s/it, best=0.742][A[I 2026-02-27 14:48:50,685] Trial 1 finished with value: 0.711014531661111 and parameters: {'activation': 'logistic', 'solver': 'adam', 'lr': 1.6480446427978994e-05, 'layer1': 267, 'layer2': 222, 'layer3': 152}. Best is trial 1 with value: 0.711014531661111.

Staphylococcus_Aureus | Oxacillin | Optuna:   1%|          | 2/200 [01:20<2:10:03, 39.41s/it, best=0.198][A
Staphylococcus_Aureus | Oxacillin | Optuna:   1%|          | 2/200 [01:20<2:10:03, 39.41s/it, best=0.711][A[I 2026-02-27 14:49:14,941] Trial 1 finished with value: 0.5988675179782096 and parameters: {'activation': 'logistic', 'solver': 'adam', 'lr': 1.6480446427978994e-05, 'layer1': 267, 'layer2': 222, 'layer3': 152}. Best is trial 1 with value: 0.5988675179782096.

Escherichia_Coli | Ciprofloxacin | Optuna:   1%|          | 2/200 [01:44<2:49:31, 51.37s/it, best=0.321][A
Escherichia_Coli | Ciprofloxacin | Optuna:   1%|          | 2/200 [01:44<2:49:31, 51.37s/it, best=0.599][A[I 2026-02-27 14:49:29,658] Trial 2 finished with value: 0.8404292594861917 and parameters: {'activation': 'identity', 'solver': 'adam', 'lr': 6.290644294586145e-06, 'layer1': 262, 'layer2': 300, 'layer3': 32}. Best is trial 2 with value: 0.8404292594861917.

Pseudomonas_Aeruginosa | Ciprofloxacin | Optuna:   2%|▏         | 3/200 [01:59<2:24:42, 44.07s/it, best=0.817][A
Pseudomonas_Aeruginosa | Ciprofloxacin | Optuna:   2%|▏         | 3/200 [01:59<2:24:42, 44.07s/it, best=0.84] [A[I 2026-02-27 14:49:50,209] Trial 2 finished with value: 0.7830809402676294 and parameters: {'activation': 'identity', 'solver': 'adam', 'lr': 6.290644294586145e-06, 'layer1': 262, 'layer2': 300, 'layer3': 32}. Best is trial 2 with value: 0.7830809402676294.

Klebsiella_Pneumoniae | Ciprofloxacin | Optuna:   2%|▏         | 3/200 [02:19<2:54:01, 53.00s/it, best=0.742][A
Klebsiella_Pneumoniae | Ciprofloxacin | Optuna:   2%|▏         | 3/200 [02:19<2:54:01, 53.00s/it, best=0.783][A[I 2026-02-27 14:50:17,641] Trial 3 finished with value: 0.6664938401412764 and parameters: {'activation': 'relu', 'solver': 'sgd', 'lr': 1.6536937182824424e-05, 'layer1': 57, 'layer2': 345, 'layer3': 226}. Best is trial 2 with value: 0.8404292594861917.

Pseudomonas_Aeruginosa | Ciprofloxacin | Optuna:   2%|▏         | 4/200 [02:47<2:29:00, 45.62s/it, best=0.84][A
Pseudomonas_Aeruginosa | Ciprofloxacin | Optuna:   2%|▏         | 4/200 [02:47<2:29:00, 45.62s/it, best=0.84][A[I 2026-02-27 14:50:40,457] Trial 4 finished with value: 0.8159756916186209 and parameters: {'activation': 'relu', 'solver': 'adam', 'lr': 1.7654048052495086e-05, 'layer1': 265, 'layer2': 278, 'layer3': 100}. Best is trial 2 with value: 0.8404292594861917.

Pseudomonas_Aeruginosa | Ciprofloxacin | Optuna:   2%|▎         | 5/200 [03:10<2:01:32, 37.39s/it, best=0.84][A
Pseudomonas_Aeruginosa | Ciprofloxacin | Optuna:   2%|▎         | 5/200 [03:10<2:01:32, 37.39s/it, best=0.84][A[I 2026-02-27 14:51:19,453] Trial 3 finished with value: 0.7557870240905655 and parameters: {'activation': 'relu', 'solver': 'sgd', 'lr': 1.6536937182824424e-05, 'layer1': 57, 'layer2': 345, 'layer3': 226}. Best is trial 2 with value: 0.7830809402676294.

Klebsiella_Pneumoniae | Ciprofloxacin | Optuna:   2%|▏         | 4/200 [03:49<3:39:52, 67.31s/it, best=0.783][A
Klebsiella_Pneumoniae | Ciprofloxacin | Optuna:   2%|▏         | 4/200 [03:49<3:39:52, 67.31s/it, best=0.783][A[I 2026-02-27 14:51:35,873] Trial 2 finished with value: 0.7264067713626701 and parameters: {'activation': 'identity', 'solver': 'adam', 'lr': 6.290644294586145e-06, 'layer1': 262, 'layer2': 300, 'layer3': 32}. Best is trial 2 with value: 0.7264067713626701.

Escherichia_Coli | Ciprofloxacin | Optuna:   2%|▏         | 3/200 [04:05<5:02:56, 92.27s/it, best=0.599][A
Escherichia_Coli | Ciprofloxacin | Optuna:   2%|▏         | 3/200 [04:05<5:02:56, 92.27s/it, best=0.726][A[I 2026-02-27 14:51:38,435] Trial 2 finished with value: 0.8784073908783002 and parameters: {'activation': 'identity', 'solver': 'adam', 'lr': 6.290644294586145e-06, 'layer1': 262, 'layer2': 300, 'layer3': 32}. Best is trial 2 with value: 0.8784073908783002.

Staphylococcus_Aureus | Oxacillin | Optuna:   2%|▏         | 3/200 [04:08<5:21:48, 98.01s/it, best=0.711][A
Staphylococcus_Aureus | Oxacillin | Optuna:   2%|▏         | 3/200 [04:08<5:21:48, 98.01s/it, best=0.878][A[I 2026-02-27 14:51:49,625] Trial 4 finished with value: 0.7463925926010274 and parameters: {'activation': 'relu', 'solver': 'adam', 'lr': 1.7654048052495086e-05, 'layer1': 265, 'layer2': 278, 'layer3': 100}. Best is trial 2 with value: 0.7830809402676294.

Klebsiella_Pneumoniae | Ciprofloxacin | Optuna:   2%|▎         | 5/200 [04:19<2:55:13, 53.92s/it, best=0.783][A
Klebsiella_Pneumoniae | Ciprofloxacin | Optuna:   2%|▎         | 5/200 [04:19<2:55:13, 53.92s/it, best=0.783][A[I 2026-02-27 14:52:01,101] Trial 5 finished with value: 0.8324282940990984 and parameters: {'activation': 'identity', 'solver': 'adam', 'lr': 2.259279742015697e-06, 'layer1': 106, 'layer2': 32, 'layer3': 169}. Best is trial 2 with value: 0.8404292594861917.

Pseudomonas_Aeruginosa | Ciprofloxacin | Optuna:   3%|▎         | 6/200 [04:30<2:48:27, 52.10s/it, best=0.84][A
Pseudomonas_Aeruginosa | Ciprofloxacin | Optuna:   3%|▎         | 6/200 [04:30<2:48:27, 52.10s/it, best=0.84][A[I 2026-02-27 14:52:40,976] Trial 5 finished with value: 0.7518653484403169 and parameters: {'activation': 'identity', 'solver': 'adam', 'lr': 2.259279742015697e-06, 'layer1': 106, 'layer2': 32, 'layer3': 169}. Best is trial 2 with value: 0.7830809402676294.

Klebsiella_Pneumoniae | Ciprofloxacin | Optuna:   3%|▎         | 6/200 [05:10<2:51:30, 53.04s/it, best=0.783][A
Klebsiella_Pneumoniae | Ciprofloxacin | Optuna:   3%|▎         | 6/200 [05:10<2:51:30, 53.04s/it, best=0.783][A[I 2026-02-27 14:52:44,718] Trial 6 finished with value: 0.7803740205282581 and parameters: {'activation': 'tanh', 'solver': 'adam', 'lr': 3.6618192203924288e-06, 'layer1': 403, 'layer2': 46, 'layer3': 494}. Best is trial 2 with value: 0.8404292594861917.

Pseudomonas_Aeruginosa | Ciprofloxacin | Optuna:   4%|▎         | 7/200 [05:14<2:38:40, 49.33s/it, best=0.84][A
Pseudomonas_Aeruginosa | Ciprofloxacin | Optuna:   4%|▎         | 7/200 [05:14<2:38:40, 49.33s/it, best=0.84][A[I 2026-02-27 14:53:23,333] Trial 7 finished with value: 0.8642049402395562 and parameters: {'activation': 'relu', 'solver': 'adam', 'lr': 0.0012164139351417069, 'layer1': 46, 'layer2': 186, 'layer3': 66}. Best is trial 7 with value: 0.8642049402395562.

Pseudomonas_Aeruginosa | Ciprofloxacin | Optuna:   4%|▍         | 8/200 [05:53<2:26:55, 45.92s/it, best=0.84][A
Pseudomonas_Aeruginosa | Ciprofloxacin | Optuna:   4%|▍         | 8/200 [05:53<2:26:55, 45.92s/it, best=0.864][A[I 2026-02-27 14:53:32,274] Trial 3 finished with value: 0.6109422087046822 and parameters: {'activation': 'relu', 'solver': 'sgd', 'lr': 1.6536937182824424e-05, 'layer1': 57, 'layer2': 345, 'layer3': 226}. Best is trial 2 with value: 0.7264067713626701.

Escherichia_Coli | Ciprofloxacin | Optuna:   2%|▏         | 4/200 [06:01<5:32:31, 101.80s/it, best=0.726][A
Escherichia_Coli | Ciprofloxacin | Optuna:   2%|▏         | 4/200 [06:01<5:32:31, 101.80s/it, best=0.726][A[I 2026-02-27 14:53:36,755] Trial 3 finished with value: 0.5841632441620455 and parameters: {'activation': 'relu', 'solver': 'sgd', 'lr': 1.6536937182824424e-05, 'layer1': 57, 'layer2': 345, 'layer3': 226}. Best is trial 2 with value: 0.8784073908783002.

Staphylococcus_Aureus | Oxacillin | Optuna:   2%|▏         | 4/200 [06:06<5:46:21, 106.03s/it, best=0.878][A
Staphylococcus_Aureus | Oxacillin | Optuna:   2%|▏         | 4/200 [06:06<5:46:21, 106.03s/it, best=0.878][A[I 2026-02-27 14:54:32,182] Trial 8 finished with value: 0.8575256652637231 and parameters: {'activation': 'identity', 'solver': 'adam', 'lr': 0.000828752236376816, 'layer1': 323, 'layer2': 445, 'layer3': 241}. Best is trial 7 with value: 0.8642049402395562.

Pseudomonas_Aeruginosa | Ciprofloxacin | Optuna:   4%|▍         | 9/200 [07:01<2:48:59, 53.09s/it, best=0.864][A
Pseudomonas_Aeruginosa | Ciprofloxacin | Optuna:   4%|▍         | 9/200 [07:01<2:48:59, 53.09s/it, best=0.864][A[I 2026-02-27 14:55:14,336] Trial 6 finished with value: 0.7808076246921194 and parameters: {'activation': 'tanh', 'solver': 'adam', 'lr': 3.6618192203924288e-06, 'layer1': 403, 'layer2': 46, 'layer3': 494}. Best is trial 2 with value: 0.7830809402676294.

Klebsiella_Pneumoniae | Ciprofloxacin | Optuna:   4%|▎         | 7/200 [07:43<4:36:07, 85.84s/it, best=0.783][A
Klebsiella_Pneumoniae | Ciprofloxacin | Optuna:   4%|▎         | 7/200 [07:43<4:36:07, 85.84s/it, best=0.783][A[I 2026-02-27 14:55:23,848] Trial 9 finished with value: 0.803033507294715 and parameters: {'activation': 'tanh', 'solver': 'sgd', 'lr': 0.00012329098365270507, 'layer1': 219, 'layer2': 22, 'layer3': 62}. Best is trial 7 with value: 0.8642049402395562.

Pseudomonas_Aeruginosa | Ciprofloxacin | Optuna:   5%|▌         | 10/200 [07:53<2:46:42, 52.65s/it, best=0.864][A
Pseudomonas_Aeruginosa | Ciprofloxacin | Optuna:   5%|▌         | 10/200 [07:53<2:46:42, 52.65s/it, best=0.864][A[I 2026-02-27 14:55:35,828] Trial 10 finished with value: 0.8159756916186209 and parameters: {'activation': 'relu', 'solver': 'sgd', 'lr': 0.007553503645583194, 'layer1': 18, 'layer2': 151, 'layer3': 348}. Best is trial 7 with value: 0.8642049402395562.

Pseudomonas_Aeruginosa | Ciprofloxacin | Optuna:   6%|▌         | 11/200 [08:05<2:06:38, 40.20s/it, best=0.864][A
Pseudomonas_Aeruginosa | Ciprofloxacin | Optuna:   6%|▌         | 11/200 [08:05<2:06:38, 40.20s/it, best=0.864][A[I 2026-02-27 14:56:17,020] Trial 7 finished with value: 0.8192416133305421 and parameters: {'activation': 'relu', 'solver': 'adam', 'lr': 0.0012164139351417069, 'layer1': 46, 'layer2': 186, 'layer3': 66}. Best is trial 7 with value: 0.8192416133305421.

Klebsiella_Pneumoniae | Ciprofloxacin | Optuna:   4%|▍         | 8/200 [08:46<4:11:05, 78.47s/it, best=0.783][A
Klebsiella_Pneumoniae | Ciprofloxacin | Optuna:   4%|▍         | 8/200 [08:46<4:11:05, 78.47s/it, best=0.819][A[I 2026-02-27 14:56:43,237] Trial 11 finished with value: 0.8591155330513871 and parameters: {'activation': 'identity', 'solver': 'adam', 'lr': 0.0013124793805688133, 'layer1': 347, 'layer2': 497, 'layer3': 312}. Best is trial 7 with value: 0.8642049402395562.

Pseudomonas_Aeruginosa | Ciprofloxacin | Optuna:   6%|▌         | 12/200 [09:12<2:31:53, 48.48s/it, best=0.864][A
Pseudomonas_Aeruginosa | Ciprofloxacin | Optuna:   6%|▌         | 12/200 [09:12<2:31:53, 48.48s/it, best=0.864][A[I 2026-02-27 14:56:43,541] Trial 4 finished with value: 0.8965181545772708 and parameters: {'activation': 'relu', 'solver': 'adam', 'lr': 1.7654048052495086e-05, 'layer1': 265, 'layer2': 278, 'layer3': 100}. Best is trial 4 with value: 0.8965181545772708.

Staphylococcus_Aureus | Oxacillin | Optuna:   2%|▎         | 5/200 [09:13<7:19:14, 135.15s/it, best=0.878][A
Staphylococcus_Aureus | Oxacillin | Optuna:   2%|▎         | 5/200 [09:13<7:19:14, 135.15s/it, best=0.896][A[I 2026-02-27 14:56:50,338] Trial 4 finished with value: 0.7693998292777101 and parameters: {'activation': 'relu', 'solver': 'adam', 'lr': 1.7654048052495086e-05, 'layer1': 265, 'layer2': 278, 'layer3': 100}. Best is trial 4 with value: 0.7693998292777101.

Escherichia_Coli | Ciprofloxacin | Optuna:   2%|▎         | 5/200 [09:19<7:23:39, 136.51s/it, best=0.726][A
Escherichia_Coli | Ciprofloxacin | Optuna:   2%|▎         | 5/200 [09:19<7:23:39, 136.51s/it, best=0.769][A[I 2026-02-27 14:57:39,195] Trial 12 finished with value: 0.8569532763839579 and parameters: {'activation': 'identity', 'solver': 'adam', 'lr': 0.0016137610321187168, 'layer1': 166, 'layer2': 496, 'layer3': 351}. Best is trial 7 with value: 0.8642049402395562.

Pseudomonas_Aeruginosa | Ciprofloxacin | Optuna:   6%|▋         | 13/200 [10:08<2:38:09, 50.74s/it, best=0.864][A
Pseudomonas_Aeruginosa | Ciprofloxacin | Optuna:   6%|▋         | 13/200 [10:08<2:38:09, 50.74s/it, best=0.864][A[I 2026-02-27 14:57:58,648] Trial 8 finished with value: 0.826402964334112 and parameters: {'activation': 'identity', 'solver': 'adam', 'lr': 0.000828752236376816, 'layer1': 323, 'layer2': 445, 'layer3': 241}. Best is trial 8 with value: 0.826402964334112.

Klebsiella_Pneumoniae | Ciprofloxacin | Optuna:   4%|▍         | 9/200 [10:28<4:32:50, 85.71s/it, best=0.819][A
Klebsiella_Pneumoniae | Ciprofloxacin | Optuna:   4%|▍         | 9/200 [10:28<4:32:50, 85.71s/it, best=0.826][A[I 2026-02-27 14:58:12,198] Trial 5 finished with value: 0.6394716656724245 and parameters: {'activation': 'identity', 'solver': 'adam', 'lr': 2.259279742015697e-06, 'layer1': 106, 'layer2': 32, 'layer3': 169}. Best is trial 4 with value: 0.7693998292777101.

Escherichia_Coli | Ciprofloxacin | Optuna:   3%|▎         | 6/200 [10:41<6:21:18, 117.93s/it, best=0.769][A
