Pseudomonas_Aeruginosa | Meropenem | Optuna:  12%|█▎        | 25/200 [27:40<3:47:06, 77.87s/it, best=0.885][A[I 2026-02-27 22:32:21,037] Trial 60 finished with value: 0.9049792102474339 and parameters: {'activation': 'identity', 'solver': 'adam', 'lr': 0.0002781615013978431, 'layer1': 464, 'layer2': 402, 'layer3': 254}. Best is trial 25 with value: 0.9080365798965563.

Klebsiella_Pneumoniae | Ceftriaxone | Optuna:  30%|███       | 61/200 [1:41:42<3:53:19, 100.72s/it, best=0.908][A
Klebsiella_Pneumoniae | Ceftriaxone | Optuna:  30%|███       | 61/200 [1:41:42<3:53:19, 100.72s/it, best=0.908][A[I 2026-02-27 22:32:36,882] Trial 20 finished with value: 0.8547768299514218 and parameters: {'activation': 'logistic', 'solver': 'adam', 'lr': 0.00030240963997002864, 'layer1': 114, 'layer2': 86, 'layer3': 392}. Best is trial 20 with value: 0.8547768299514218.

Staphylococcus_Aureus | Clindamycin | Optuna:  10%|█         | 21/200 [34:38<4:48:38, 96.75s/it, best=0.85][A
Staphylococcus_Aureus | Clindamycin | Optuna:  10%|█         | 21/200 [34:38<4:48:38, 96.75s/it, best=0.855][A[I 2026-02-27 22:33:07,723] Trial 187 finished with value: 0.8059519581276875 and parameters: {'activation': 'tanh', 'solver': 'adam', 'lr': 3.214578539978841e-05, 'layer1': 494, 'layer2': 350, 'layer3': 29}. Best is trial 124 with value: 0.8095465376114227.

Escherichia_Coli | Ciprofloxacin | Optuna:  94%|█████████▍| 188/200 [7:45:37<34:02, 170.25s/it, best=0.809][A
Escherichia_Coli | Ciprofloxacin | Optuna:  94%|█████████▍| 188/200 [7:45:37<34:02, 170.25s/it, best=0.809][A[I 2026-02-27 22:33:49,633] Trial 25 finished with value: 0.8810780509358802 and parameters: {'activation': 'identity', 'solver': 'adam', 'lr': 0.0031064248586068948, 'layer1': 489, 'layer2': 442, 'layer3': 275}. Best is trial 8 with value: 0.8854975788426769.

Pseudomonas_Aeruginosa | Meropenem | Optuna:  13%|█▎        | 26/200 [29:24<4:08:41, 85.76s/it, best=0.885][A
Pseudomonas_Aeruginosa | Meropenem | Optuna:  13%|█▎        | 26/200 [29:24<4:08:41, 85.76s/it, best=0.885][A[I 2026-02-27 22:34:13,169] Trial 26 finished with value: 0.8429744308639442 and parameters: {'activation': 'identity', 'solver': 'sgd', 'lr': 0.009448679984400127, 'layer1': 436, 'layer2': 385, 'layer3': 444}. Best is trial 8 with value: 0.8854975788426769.

Pseudomonas_Aeruginosa | Meropenem | Optuna:  14%|█▎        | 27/200 [29:48<3:13:26, 67.09s/it, best=0.885][A
Pseudomonas_Aeruginosa | Meropenem | Optuna:  14%|█▎        | 27/200 [29:48<3:13:26, 67.09s/it, best=0.885][A[I 2026-02-27 22:34:15,240] Trial 61 finished with value: 0.9047374506988237 and parameters: {'activation': 'identity', 'solver': 'adam', 'lr': 0.00011851013032354021, 'layer1': 482, 'layer2': 394, 'layer3': 500}. Best is trial 25 with value: 0.9080365798965563.

Klebsiella_Pneumoniae | Ceftriaxone | Optuna:  31%|███       | 62/200 [1:43:36<4:00:57, 104.76s/it, best=0.908][A
Klebsiella_Pneumoniae | Ceftriaxone | Optuna:  31%|███       | 62/200 [1:43:36<4:00:57, 104.76s/it, best=0.908][A[I 2026-02-27 22:34:16,901] Trial 21 finished with value: 0.8534295926201129 and parameters: {'activation': 'logistic', 'solver': 'adam', 'lr': 0.00029394176080578944, 'layer1': 116, 'layer2': 88, 'layer3': 401}. Best is trial 20 with value: 0.8547768299514218.

Staphylococcus_Aureus | Clindamycin | Optuna:  11%|█         | 22/200 [36:18<4:49:56, 97.73s/it, best=0.855][A
Staphylococcus_Aureus | Clindamycin | Optuna:  11%|█         | 22/200 [36:18<4:49:56, 97.73s/it, best=0.855][A[I 2026-02-27 22:35:09,581] Trial 27 finished with value: 0.8759768078205159 and parameters: {'activation': 'logistic', 'solver': 'adam', 'lr': 0.0007498219215595536, 'layer1': 213, 'layer2': 197, 'layer3': 324}. Best is trial 8 with value: 0.8854975788426769.

Pseudomonas_Aeruginosa | Meropenem | Optuna:  14%|█▍        | 28/200 [30:44<3:03:08, 63.89s/it, best=0.885][A
Pseudomonas_Aeruginosa | Meropenem | Optuna:  14%|█▍        | 28/200 [30:44<3:03:08, 63.89s/it, best=0.885][A[I 2026-02-27 22:35:56,901] Trial 62 finished with value: 0.9031495418052747 and parameters: {'activation': 'identity', 'solver': 'adam', 'lr': 0.00016112626611408684, 'layer1': 485, 'layer2': 346, 'layer3': 500}. Best is trial 25 with value: 0.9080365798965563.

Klebsiella_Pneumoniae | Ceftriaxone | Optuna:  32%|███▏      | 63/200 [1:45:18<3:57:05, 103.83s/it, best=0.908][A
Klebsiella_Pneumoniae | Ceftriaxone | Optuna:  32%|███▏      | 63/200 [1:45:18<3:57:05, 103.83s/it, best=0.908][A[I 2026-02-27 22:36:18,605] Trial 22 finished with value: 0.8546055945921642 and parameters: {'activation': 'logistic', 'solver': 'adam', 'lr': 0.0002672693913896987, 'layer1': 122, 'layer2': 71, 'layer3': 416}. Best is trial 20 with value: 0.8547768299514218.

Staphylococcus_Aureus | Clindamycin | Optuna:  12%|█▏        | 23/200 [38:20<5:09:31, 104.92s/it, best=0.855][A
Staphylococcus_Aureus | Clindamycin | Optuna:  12%|█▏        | 23/200 [38:20<5:09:31, 104.92s/it, best=0.855][A[I 2026-02-27 22:36:34,886] Trial 188 finished with value: 0.8052946460832586 and parameters: {'activation': 'tanh', 'solver': 'adam', 'lr': 1.8289320054067515e-05, 'layer1': 433, 'layer2': 376, 'layer3': 10}. Best is trial 124 with value: 0.8095465376114227.

Escherichia_Coli | Ciprofloxacin | Optuna:  94%|█████████▍| 189/200 [7:49:04<33:14, 181.32s/it, best=0.809][A
Escherichia_Coli | Ciprofloxacin | Optuna:  94%|█████████▍| 189/200 [7:49:04<33:14, 181.32s/it, best=0.809][A[I 2026-02-27 22:36:37,841] Trial 28 finished with value: 0.8774762374097371 and parameters: {'activation': 'tanh', 'solver': 'adam', 'lr': 5.520350166411609e-05, 'layer1': 460, 'layer2': 493, 'layer3': 496}. Best is trial 8 with value: 0.8854975788426769.

Pseudomonas_Aeruginosa | Meropenem | Optuna:  14%|█▍        | 29/200 [32:13<3:22:54, 71.20s/it, best=0.885][A
Pseudomonas_Aeruginosa | Meropenem | Optuna:  14%|█▍        | 29/200 [32:13<3:22:54, 71.20s/it, best=0.885][A[I 2026-02-27 22:37:00,575] Trial 29 finished with value: 0.8429744308639442 and parameters: {'activation': 'logistic', 'solver': 'sgd', 'lr': 0.001863076747058178, 'layer1': 416, 'layer2': 323, 'layer3': 389}. Best is trial 8 with value: 0.8854975788426769.

Pseudomonas_Aeruginosa | Meropenem | Optuna:  15%|█▌        | 30/200 [32:35<2:40:32, 56.66s/it, best=0.885][A
Pseudomonas_Aeruginosa | Meropenem | Optuna:  15%|█▌        | 30/200 [32:35<2:40:32, 56.66s/it, best=0.885][A[I 2026-02-27 22:37:55,424] Trial 23 finished with value: 0.8529382330460145 and parameters: {'activation': 'logistic', 'solver': 'adam', 'lr': 0.00027936015257881767, 'layer1': 73, 'layer2': 69, 'layer3': 465}. Best is trial 20 with value: 0.8547768299514218.

Staphylococcus_Aureus | Clindamycin | Optuna:  12%|█▏        | 24/200 [39:57<5:00:38, 102.49s/it, best=0.855][A
Staphylococcus_Aureus | Clindamycin | Optuna:  12%|█▏        | 24/200 [39:57<5:00:38, 102.49s/it, best=0.855][A[I 2026-02-27 22:37:58,244] Trial 63 finished with value: 0.9060277542443705 and parameters: {'activation': 'identity', 'solver': 'adam', 'lr': 6.93041773010295e-05, 'layer1': 497, 'layer2': 447, 'layer3': 443}. Best is trial 25 with value: 0.9080365798965563.

Klebsiella_Pneumoniae | Ceftriaxone | Optuna:  32%|███▏      | 64/200 [1:47:19<4:07:15, 109.09s/it, best=0.908][A
Klebsiella_Pneumoniae | Ceftriaxone | Optuna:  32%|███▏      | 64/200 [1:47:19<4:07:15, 109.09s/it, best=0.908][A[I 2026-02-27 22:38:23,437] Trial 30 finished with value: 0.8833469369154294 and parameters: {'activation': 'identity', 'solver': 'adam', 'lr': 0.005297952340285105, 'layer1': 346, 'layer2': 257, 'layer3': 129}. Best is trial 8 with value: 0.8854975788426769.

Pseudomonas_Aeruginosa | Meropenem | Optuna:  16%|█▌        | 31/200 [33:58<3:01:43, 64.52s/it, best=0.885][A
Pseudomonas_Aeruginosa | Meropenem | Optuna:  16%|█▌        | 31/200 [33:58<3:01:43, 64.52s/it, best=0.885][A[I 2026-02-27 22:38:28,723] Trial 24 finished with value: 0.7888558471217525 and parameters: {'activation': 'logistic', 'solver': 'adam', 'lr': 5.314374137904486e-05, 'layer1': 212, 'layer2': 85, 'layer3': 361}. Best is trial 20 with value: 0.8547768299514218.

Staphylococcus_Aureus | Clindamycin | Optuna:  12%|█▎        | 25/200 [40:30<3:58:23, 81.73s/it, best=0.855] [A
Staphylococcus_Aureus | Clindamycin | Optuna:  12%|█▎        | 25/200 [40:30<3:58:23, 81.73s/it, best=0.855][A[I 2026-02-27 22:39:01,256] Trial 25 finished with value: 0.7888558471217525 and parameters: {'activation': 'logistic', 'solver': 'adam', 'lr': 4.861532748138572e-05, 'layer1': 127, 'layer2': 178, 'layer3': 402}. Best is trial 20 with value: 0.8547768299514218.

Staphylococcus_Aureus | Clindamycin | Optuna:  13%|█▎        | 26/200 [41:02<3:14:12, 66.97s/it, best=0.855][A
Staphylococcus_Aureus | Clindamycin | Optuna:  13%|█▎        | 26/200 [41:02<3:14:12, 66.97s/it, best=0.855][A[I 2026-02-27 22:39:21,192] Trial 26 finished with value: 0.7888558471217525 and parameters: {'activation': 'logistic', 'solver': 'sgd', 'lr': 0.00029212986813211385, 'layer1': 10, 'layer2': 63, 'layer3': 440}. Best is trial 20 with value: 0.8547768299514218.

Staphylococcus_Aureus | Clindamycin | Optuna:  14%|█▎        | 27/200 [41:22<2:32:24, 52.86s/it, best=0.855][A
Staphylococcus_Aureus | Clindamycin | Optuna:  14%|█▎        | 27/200 [41:22<2:32:24, 52.86s/it, best=0.855][A[I 2026-02-27 22:39:36,180] Trial 189 finished with value: 0.8066541006922303 and parameters: {'activation': 'tanh', 'solver': 'adam', 'lr': 2.345225287514615e-05, 'layer1': 471, 'layer2': 319, 'layer3': 20}. Best is trial 124 with value: 0.8095465376114227.

Escherichia_Coli | Ciprofloxacin | Optuna:  95%|█████████▌| 190/200 [7:52:05<30:13, 181.31s/it, best=0.809][A
Escherichia_Coli | Ciprofloxacin | Optuna:  95%|█████████▌| 190/200 [7:52:05<30:13, 181.31s/it, best=0.809][A[I 2026-02-27 22:39:45,125] Trial 31 finished with value: 0.8812978179801668 and parameters: {'activation': 'identity', 'solver': 'adam', 'lr': 0.0009381585258743187, 'layer1': 383, 'layer2': 245, 'layer3': 456}. Best is trial 8 with value: 0.8854975788426769.

Pseudomonas_Aeruginosa | Meropenem | Optuna:  16%|█▌        | 32/200 [35:20<3:15:04, 69.67s/it, best=0.885][A
Pseudomonas_Aeruginosa | Meropenem | Optuna:  16%|█▌        | 32/200 [35:20<3:15:04, 69.67s/it, best=0.885][A[I 2026-02-27 22:39:48,579] Trial 64 finished with value: 0.9047323178212082 and parameters: {'activation': 'identity', 'solver': 'adam', 'lr': 9.447719350795904e-05, 'layer1': 454, 'layer2': 450, 'layer3': 441}. Best is trial 25 with value: 0.9080365798965563.

Klebsiella_Pneumoniae | Ceftriaxone | Optuna:  32%|███▎      | 65/200 [1:49:10<4:06:17, 109.46s/it, best=0.908][A
Klebsiella_Pneumoniae | Ceftriaxone | Optuna:  32%|███▎      | 65/200 [1:49:10<4:06:17, 109.46s/it, best=0.908][A[I 2026-02-27 22:39:56,229] Trial 27 finished with value: 0.7888558471217525 and parameters: {'activation': 'logistic', 'solver': 'adam', 'lr': 4.9258768803972336e-05, 'layer1': 309, 'layer2': 18, 'layer3': 495}. Best is trial 20 with value: 0.8547768299514218.

Staphylococcus_Aureus | Clindamycin | Optuna:  14%|█▍        | 28/200 [41:57<2:16:12, 47.51s/it, best=0.855][A
Staphylococcus_Aureus | Clindamycin | Optuna:  14%|█▍        | 28/200 [41:57<2:16:12, 47.51s/it, best=0.855][A[I 2026-02-27 22:41:16,208] Trial 32 finished with value: 0.8812674573014109 and parameters: {'activation': 'identity', 'solver': 'adam', 'lr': 0.0016326675751290808, 'layer1': 466, 'layer2': 221, 'layer3': 421}. Best is trial 8 with value: 0.8854975788426769.

Pseudomonas_Aeruginosa | Meropenem | Optuna:  16%|█▋        | 33/200 [36:51<3:31:47, 76.09s/it, best=0.885][A
Pseudomonas_Aeruginosa | Meropenem | Optuna:  16%|█▋        | 33/200 [36:51<3:31:47, 76.09s/it, best=0.885][A[I 2026-02-27 22:41:28,745] Trial 65 finished with value: 0.9058098135966988 and parameters: {'activation': 'tanh', 'solver': 'adam', 'lr': 5.9241901496093105e-05, 'layer1': 431, 'layer2': 468, 'layer3': 383}. Best is trial 25 with value: 0.9080365798965563.

Klebsiella_Pneumoniae | Ceftriaxone | Optuna:  33%|███▎      | 66/200 [1:50:50<3:58:14, 106.67s/it, best=0.908][A
Klebsiella_Pneumoniae | Ceftriaxone | Optuna:  33%|███▎      | 66/200 [1:50:50<3:58:14, 106.67s/it, best=0.908][A[I 2026-02-27 22:42:00,378] Trial 28 finished with value: 0.8523600886302718 and parameters: {'activation': 'logistic', 'solver': 'adam', 'lr': 0.0002293421633619348, 'layer1': 119, 'layer2': 147, 'layer3': 272}. Best is trial 20 with value: 0.8547768299514218.

Staphylococcus_Aureus | Clindamycin | Optuna:  14%|█▍        | 29/200 [44:02<3:20:56, 70.50s/it, best=0.855][A
Staphylococcus_Aureus | Clindamycin | Optuna:  14%|█▍        | 29/200 [44:02<3:20:56, 70.50s/it, best=0.855][A[I 2026-02-27 22:42:09,100] Trial 190 finished with value: 0.8046751170264242 and parameters: {'activation': 'tanh', 'solver': 'adam', 'lr': 2.6312015008249985e-05, 'layer1': 364, 'layer2': 330, 'layer3': 30}. Best is trial 124 with value: 0.8095465376114227.

Escherichia_Coli | Ciprofloxacin | Optuna:  96%|█████████▌| 191/200 [7:54:38<25:55, 172.80s/it, best=0.809][A
Escherichia_Coli | Ciprofloxacin | Optuna:  96%|█████████▌| 191/200 [7:54:38<25:55, 172.80s/it, best=0.809][A[I 2026-02-27 22:42:28,521] Trial 29 finished with value: 0.7888558471217525 and parameters: {'activation': 'logistic', 'solver': 'sgd', 'lr': 8.283875449665634e-05, 'layer1': 214, 'layer2': 234, 'layer3': 338}. Best is trial 20 with value: 0.8547768299514218.

Staphylococcus_Aureus | Clindamycin | Optuna:  15%|█▌        | 30/200 [44:30<2:43:45, 57.80s/it, best=0.855][A
Staphylococcus_Aureus | Clindamycin | Optuna:  15%|█▌        | 30/200 [44:30<2:43:45, 57.80s/it, best=0.855][A[I 2026-02-27 22:42:30,514] Trial 33 finished with value: 0.8852779689861283 and parameters: {'activation': 'identity', 'solver': 'adam', 'lr': 0.0005851104984887849, 'layer1': 282, 'layer2': 307, 'layer3': 465}. Best is trial 8 with value: 0.8854975788426769.

Pseudomonas_Aeruginosa | Meropenem | Optuna:  17%|█▋        | 34/200 [38:05<3:29:02, 75.56s/it, best=0.885][A
Pseudomonas_Aeruginosa | Meropenem | Optuna:  17%|█▋        | 34/200 [38:05<3:29:02, 75.56s/it, best=0.885][A[I 2026-02-27 22:43:50,073] Trial 34 finished with value: 0.8844290830133252 and parameters: {'activation': 'identity', 'solver': 'adam', 'lr': 0.000530710054252636, 'layer1': 285, 'layer2': 294, 'layer3': 469}. Best is trial 8 with value: 0.8854975788426769.

Pseudomonas_Aeruginosa | Meropenem | Optuna:  18%|█▊        | 35/200 [39:25<3:31:05, 76.76s/it, best=0.885][A
Pseudomonas_Aeruginosa | Meropenem | Optuna:  18%|█▊        | 35/200 [39:25<3:31:05, 76.76s/it, best=0.885][A[I 2026-02-27 22:43:51,318] Trial 66 finished with value: 0.9067009625540876 and parameters: {'activation': 'identity', 'solver': 'adam', 'lr': 1.9153507629781246e-05, 'layer1': 470, 'layer2': 417, 'layer3': 458}. Best is trial 25 with value: 0.9080365798965563.

Klebsiella_Pneumoniae | Ceftriaxone | Optuna:  34%|███▎      | 67/200 [1:53:12<4:20:19, 117.44s/it, best=0.908][A
Klebsiella_Pneumoniae | Ceftriaxone | Optuna:  34%|███▎      | 67/200 [1:53:12<4:20:19, 117.44s/it, best=0.908][A[I 2026-02-27 22:43:56,183] Trial 30 finished with value: 0.8520631674033765 and parameters: {'activation': 'logistic', 'solver': 'adam', 'lr': 0.0004180513660080553, 'layer1': 36, 'layer2': 203, 'layer3': 378}. Best is trial 20 with value: 0.8547768299514218.

Staphylococcus_Aureus | Clindamycin | Optuna:  16%|█▌        | 31/200 [45:57<3:08:01, 66.76s/it, best=0.855][A
Staphylococcus_Aureus | Clindamycin | Optuna:  16%|█▌        | 31/200 [45:57<3:08:01, 66.76s/it, best=0.855][A[I 2026-02-27 22:44:13,674] Trial 35 finished with value: 0.8429744308639442 and parameters: {'activation': 'logistic', 'solver': 'adam', 'lr': 0.00020241707944837004, 'layer1': 222, 'layer2': 335, 'layer3': 244}. Best is trial 8 with value: 0.8854975788426769.

Pseudomonas_Aeruginosa | Meropenem | Optuna:  18%|█▊        | 36/200 [39:48<2:46:12, 60.81s/it, best=0.885][A
Pseudomonas_Aeruginosa | Meropenem | Optuna:  18%|█▊        | 36/200 [39:48<2:46:12, 60.81s/it, best=0.885][A[I 2026-02-27 22:44:32,160] Trial 67 finished with value: 0.7851336848970427 and parameters: {'activation': 'relu', 'solver': 'adam', 'lr': 1.149492309555082e-05, 'layer1': 471, 'layer2': 420, 'layer3': 458}. Best is trial 25 with value: 0.9080365798965563.

Klebsiella_Pneumoniae | Ceftriaxone | Optuna:  34%|███▍      | 68/200 [1:53:53<3:27:49, 94.46s/it, best=0.908] [A
Klebsiella_Pneumoniae | Ceftriaxone | Optuna:  34%|███▍      | 68/200 [1:53:53<3:27:49, 94.46s/it, best=0.908][A[I 2026-02-27 22:45:13,403] Trial 36 finished with value: 0.8785040954463341 and parameters: {'activation': 'relu', 'solver': 'adam', 'lr': 0.0002735816975838401, 'layer1': 249, 'layer2': 311, 'layer3': 206}. Best is trial 8 with value: 0.8854975788426769.

Pseudomonas_Aeruginosa | Meropenem | Optuna:  18%|█▊        | 37/200 [40:48<2:44:19, 60.49s/it, best=0.885][A
Pseudomonas_Aeruginosa | Meropenem | Optuna:  18%|█▊        | 37/200 [40:48<2:44:19, 60.49s/it, best=0.885][A[I 2026-02-27 22:45:29,662] Trial 31 finished with value: 0.8383450778578687 and parameters: {'activation': 'logistic', 'solver': 'adam', 'lr': 0.00027490675107872027, 'layer1': 75, 'layer2': 62, 'layer3': 444}. Best is trial 20 with value: 0.8547768299514218.

Staphylococcus_Aureus | Clindamycin | Optuna:  16%|█▌        | 32/200 [47:31<3:29:21, 74.77s/it, best=0.855][A
Staphylococcus_Aureus | Clindamycin | Optuna:  16%|█▌        | 32/200 [47:31<3:29:21, 74.77s/it, best=0.855][A[I 2026-02-27 22:45:30,137] Trial 191 finished with value: 0.8109607364737272 and parameters: {'activation': 'tanh', 'solver': 'adam', 'lr': 2.4264833651187717e-05, 'layer1': 385, 'layer2': 320, 'layer3': 21}. Best is trial 191 with value: 0.8109607364737272.

Escherichia_Coli | Ciprofloxacin | Optuna:  96%|█████████▌| 192/200 [7:57:59<24:10, 181.27s/it, best=0.809][A
Escherichia_Coli | Ciprofloxacin | Optuna:  96%|█████████▌| 192/200 [7:57:59<24:10, 181.27s/it, best=0.811][A[I 2026-02-27 22:45:57,309] Trial 32 finished with value: 0.7888558471217525 and parameters: {'activation': 'logistic', 'solver': 'adam', 'lr': 0.00010092533855313498, 'layer1': 75, 'layer2': 76, 'layer3': 468}. Best is trial 20 with value: 0.8547768299514218.

Staphylococcus_Aureus | Clindamycin | Optuna:  16%|█▋        | 33/200 [47:58<2:48:45, 60.63s/it, best=0.855][A
Staphylococcus_Aureus | Clindamycin | Optuna:  16%|█▋        | 33/200 [47:58<2:48:45, 60.63s/it, best=0.855][A[I 2026-02-27 22:46:36,746] Trial 37 finished with value: 0.8852310900545401 and parameters: {'activation': 'identity', 'solver': 'adam', 'lr': 9.335004302260025e-05, 'layer1': 172, 'layer2': 378, 'layer3': 394}. Best is trial 8 with value: 0.8854975788426769.

Pseudomonas_Aeruginosa | Meropenem | Optuna:  19%|█▉        | 38/200 [42:11<3:01:49, 67.34s/it, best=0.885][A
Pseudomonas_Aeruginosa | Meropenem | Optuna:  19%|█▉        | 38/200 [42:11<3:01:49, 67.34s/it, best=0.885][A[I 2026-02-27 22:48:08,071] Trial 33 finished with value: 0.8559196107911822 and parameters: {'activation': 'logistic', 'solver': 'adam', 'lr': 0.00020770167851080846, 'layer1': 131, 'layer2': 128, 'layer3': 416}. Best is trial 33 with value: 0.8559196107911822.

Staphylococcus_Aureus | Clindamycin | Optuna:  17%|█▋        | 34/200 [50:09<3:45:57, 81.67s/it, best=0.855][A
Staphylococcus_Aureus | Clindamycin | Optuna:  17%|█▋        | 34/200 [50:09<3:45:57, 81.67s/it, best=0.856][A[I 2026-02-27 22:48:15,480] Trial 68 finished with value: 0.7385422812472622 and parameters: {'activation': 'identity', 'solver': 'sgd', 'lr': 2.2011734307217482e-05, 'layer1': 455, 'layer2': 443, 'layer3': 427}. Best is trial 25 with value: 0.9080365798965563.

Klebsiella_Pneumoniae | Ceftriaxone | Optuna:  34%|███▍      | 69/200 [1:57:37<4:50:38, 133.12s/it, best=0.908][A
Klebsiella_Pneumoniae | Ceftriaxone | Optuna:  34%|███▍      | 69/200 [1:57:37<4:50:38, 133.12s/it, best=0.908][A[I 2026-02-27 22:48:16,250] Trial 192 finished with value: 0.8058223147621352 and parameters: {'activation': 'tanh', 'solver': 'adam', 'lr': 3.354123805872155e-05, 'layer1': 386, 'layer2': 346, 'layer3': 19}. Best is trial 191 with value: 0.8109607364737272.

Escherichia_Coli | Ciprofloxacin | Optuna:  96%|█████████▋| 193/200 [8:00:45<20:37, 176.72s/it, best=0.811][A
Escherichia_Coli | Ciprofloxacin | Optuna:  96%|█████████▋| 193/200 [8:00:45<20:37, 176.72s/it, best=0.811][A[I 2026-02-27 22:48:19,951] Trial 38 finished with value: 0.8449403314026821 and parameters: {'activation': 'identity', 'solver': 'sgd', 'lr': 3.386349758284922e-05, 'layer1': 157, 'layer2': 371, 'layer3': 370}. Best is trial 8 with value: 0.8854975788426769.

Pseudomonas_Aeruginosa | Meropenem | Optuna:  20%|█▉        | 39/200 [43:55<3:29:34, 78.10s/it, best=0.885][A
Pseudomonas_Aeruginosa | Meropenem | Optuna:  20%|█▉        | 39/200 [43:55<3:29:34, 78.10s/it, best=0.885][A[I 2026-02-27 22:48:54,094] Trial 69 finished with value: 0.782466545914998 and parameters: {'activation': 'logistic', 'solver': 'adam', 'lr': 1.3545815356725416e-05, 'layer1': 396, 'layer2': 494, 'layer3': 353}. Best is trial 25 with value: 0.9080365798965563.

Klebsiella_Pneumoniae | Ceftriaxone | Optuna:  35%|███▌      | 70/200 [1:58:15<3:46:59, 104.77s/it, best=0.908][A
Klebsiella_Pneumoniae | Ceftriaxone | Optuna:  35%|███▌      | 70/200 [1:58:15<3:46:59, 104.77s/it, best=0.908][A[I 2026-02-27 22:49:02,119] Trial 39 finished with value: 0.847962518411272 and parameters: {'activation': 'tanh', 'solver': 'adam', 'lr': 9.07330211440507e-06, 'layer1': 89, 'layer2': 413, 'layer3': 330}. Best is trial 8 with value: 0.8854975788426769.

Pseudomonas_Aeruginosa | Meropenem | Optuna:  20%|██        | 40/200 [44:37<2:59:31, 67.32s/it, best=0.885][A
