Pseudomonas_Aeruginosa | Imipenem | Optuna:  42%|████▏     | 84/200 [1:12:09<1:45:26, 54.54s/it, best=0.865][A[I 2026-02-27 19:44:41,242] Trial 135 finished with value: 0.9058835453810744 and parameters: {'activation': 'logistic', 'solver': 'adam', 'lr': 0.00029184149811299187, 'layer1': 331, 'layer2': 438, 'layer3': 453}. Best is trial 84 with value: 0.9099428178723615.

Staphylococcus_Aureus | Oxacillin | Optuna:  68%|██████▊   | 136/200 [4:57:10<2:21:09, 132.34s/it, best=0.91][A
Staphylococcus_Aureus | Oxacillin | Optuna:  68%|██████▊   | 136/200 [4:57:10<2:21:09, 132.34s/it, best=0.91][A[I 2026-02-27 19:44:51,889] Trial 84 finished with value: 0.823485123831377 and parameters: {'activation': 'relu', 'solver': 'adam', 'lr': 4.579241455427956e-05, 'layer1': 425, 'layer2': 105, 'layer3': 177}. Best is trial 42 with value: 0.8645324176837453.

Pseudomonas_Aeruginosa | Imipenem | Optuna:  42%|████▎     | 85/200 [1:12:46<1:34:25, 49.27s/it, best=0.865][A
Pseudomonas_Aeruginosa | Imipenem | Optuna:  42%|████▎     | 85/200 [1:12:46<1:34:25, 49.27s/it, best=0.865][A[I 2026-02-27 19:45:26,756] Trial 136 finished with value: 0.7139854503902909 and parameters: {'activation': 'identity', 'solver': 'sgd', 'lr': 0.0004542104988270262, 'layer1': 319, 'layer2': 424, 'layer3': 283}. Best is trial 84 with value: 0.9099428178723615.

Staphylococcus_Aureus | Oxacillin | Optuna:  68%|██████▊   | 137/200 [4:57:56<1:51:36, 106.29s/it, best=0.91][A
Staphylococcus_Aureus | Oxacillin | Optuna:  68%|██████▊   | 137/200 [4:57:56<1:51:36, 106.29s/it, best=0.91][A[I 2026-02-27 19:46:12,454] Trial 156 finished with value: 0.8182672355485842 and parameters: {'activation': 'identity', 'solver': 'adam', 'lr': 2.1433137445756304e-05, 'layer1': 353, 'layer2': 432, 'layer3': 240}. Best is trial 91 with value: 0.8315336183309556.

Klebsiella_Pneumoniae | Ciprofloxacin | Optuna:  78%|███████▊  | 157/200 [4:58:42<1:31:32, 127.74s/it, best=0.832][A
Klebsiella_Pneumoniae | Ciprofloxacin | Optuna:  78%|███████▊  | 157/200 [4:58:42<1:31:32, 127.74s/it, best=0.832][A[I 2026-02-27 19:46:18,707] Trial 85 finished with value: 0.8540885232353114 and parameters: {'activation': 'relu', 'solver': 'adam', 'lr': 8.777520543861311e-05, 'layer1': 477, 'layer2': 43, 'layer3': 23}. Best is trial 42 with value: 0.8645324176837453.

Pseudomonas_Aeruginosa | Imipenem | Optuna:  43%|████▎     | 86/200 [1:14:12<1:55:00, 60.53s/it, best=0.865][A
Pseudomonas_Aeruginosa | Imipenem | Optuna:  43%|████▎     | 86/200 [1:14:12<1:55:00, 60.53s/it, best=0.865][A[I 2026-02-27 19:47:33,859] Trial 86 finished with value: 0.8636163408120456 and parameters: {'activation': 'relu', 'solver': 'adam', 'lr': 0.0014701474055012365, 'layer1': 406, 'layer2': 23, 'layer3': 63}. Best is trial 42 with value: 0.8645324176837453.

Pseudomonas_Aeruginosa | Imipenem | Optuna:  44%|████▎     | 87/200 [1:15:28<2:02:15, 64.92s/it, best=0.865][A
Pseudomonas_Aeruginosa | Imipenem | Optuna:  44%|████▎     | 87/200 [1:15:28<2:02:15, 64.92s/it, best=0.865][A[I 2026-02-27 19:47:42,266] Trial 121 finished with value: 0.8061479823281656 and parameters: {'activation': 'tanh', 'solver': 'adam', 'lr': 1.5099189327120554e-05, 'layer1': 304, 'layer2': 278, 'layer3': 41}. Best is trial 107 with value: 0.8083747566869277.

Escherichia_Coli | Ciprofloxacin | Optuna:  61%|██████    | 122/200 [5:00:11<3:39:17, 168.69s/it, best=0.808][A
Escherichia_Coli | Ciprofloxacin | Optuna:  61%|██████    | 122/200 [5:00:11<3:39:17, 168.69s/it, best=0.808][A[I 2026-02-27 19:47:51,082] Trial 137 finished with value: 0.908063454575939 and parameters: {'activation': 'identity', 'solver': 'adam', 'lr': 7.789686723482063e-05, 'layer1': 293, 'layer2': 330, 'layer3': 466}. Best is trial 84 with value: 0.9099428178723615.

Staphylococcus_Aureus | Oxacillin | Optuna:  69%|██████▉   | 138/200 [5:00:20<2:01:37, 117.70s/it, best=0.91][A
Staphylococcus_Aureus | Oxacillin | Optuna:  69%|██████▉   | 138/200 [5:00:20<2:01:37, 117.70s/it, best=0.91][A[I 2026-02-27 19:48:15,357] Trial 87 finished with value: 0.8525280848519875 and parameters: {'activation': 'tanh', 'solver': 'adam', 'lr': 0.00138083415231591, 'layer1': 392, 'layer2': 264, 'layer3': 36}. Best is trial 42 with value: 0.8645324176837453.

Pseudomonas_Aeruginosa | Imipenem | Optuna:  44%|████▍     | 88/200 [1:16:09<1:48:04, 57.89s/it, best=0.865][A
Pseudomonas_Aeruginosa | Imipenem | Optuna:  44%|████▍     | 88/200 [1:16:09<1:48:04, 57.89s/it, best=0.865][A[I 2026-02-27 19:48:24,045] Trial 157 finished with value: 0.8229391550135194 and parameters: {'activation': 'identity', 'solver': 'adam', 'lr': 4.4894086385055035e-05, 'layer1': 366, 'layer2': 479, 'layer3': 215}. Best is trial 91 with value: 0.8315336183309556.

Klebsiella_Pneumoniae | Ciprofloxacin | Optuna:  79%|███████▉  | 158/200 [5:00:53<1:30:13, 128.90s/it, best=0.832][A
Klebsiella_Pneumoniae | Ciprofloxacin | Optuna:  79%|███████▉  | 158/200 [5:00:53<1:30:13, 128.90s/it, best=0.832][A[I 2026-02-27 19:49:15,274] Trial 88 finished with value: 0.8614537371643868 and parameters: {'activation': 'relu', 'solver': 'adam', 'lr': 0.002706415894056503, 'layer1': 274, 'layer2': 154, 'layer3': 67}. Best is trial 42 with value: 0.8645324176837453.

Pseudomonas_Aeruginosa | Imipenem | Optuna:  44%|████▍     | 89/200 [1:17:09<1:48:13, 58.50s/it, best=0.865][A
Pseudomonas_Aeruginosa | Imipenem | Optuna:  44%|████▍     | 89/200 [1:17:09<1:48:13, 58.50s/it, best=0.865][A[I 2026-02-27 19:49:44,535] Trial 122 finished with value: 0.8043533150796343 and parameters: {'activation': 'tanh', 'solver': 'adam', 'lr': 3.5604509354382016e-05, 'layer1': 128, 'layer2': 264, 'layer3': 18}. Best is trial 107 with value: 0.8083747566869277.

Escherichia_Coli | Ciprofloxacin | Optuna:  62%|██████▏   | 123/200 [5:02:13<3:18:36, 154.76s/it, best=0.808][A
Escherichia_Coli | Ciprofloxacin | Optuna:  62%|██████▏   | 123/200 [5:02:13<3:18:36, 154.76s/it, best=0.808][A[I 2026-02-27 19:50:14,595] Trial 158 finished with value: 0.8274310041852688 and parameters: {'activation': 'identity', 'solver': 'adam', 'lr': 8.849609571768107e-05, 'layer1': 308, 'layer2': 458, 'layer3': 205}. Best is trial 91 with value: 0.8315336183309556.

Klebsiella_Pneumoniae | Ciprofloxacin | Optuna:  80%|███████▉  | 159/200 [5:02:44<1:24:19, 123.39s/it, best=0.832][A
Klebsiella_Pneumoniae | Ciprofloxacin | Optuna:  80%|███████▉  | 159/200 [5:02:44<1:24:19, 123.39s/it, best=0.832][A[I 2026-02-27 19:50:23,180] Trial 138 finished with value: 0.9074835620560162 and parameters: {'activation': 'identity', 'solver': 'adam', 'lr': 0.0005637190977235356, 'layer1': 369, 'layer2': 453, 'layer3': 417}. Best is trial 84 with value: 0.9099428178723615.

Staphylococcus_Aureus | Oxacillin | Optuna:  70%|██████▉   | 139/200 [5:02:52<2:10:09, 128.02s/it, best=0.91][A
Staphylococcus_Aureus | Oxacillin | Optuna:  70%|██████▉   | 139/200 [5:02:52<2:10:09, 128.02s/it, best=0.91][A[I 2026-02-27 19:50:39,992] Trial 89 finished with value: 0.8602420442264329 and parameters: {'activation': 'relu', 'solver': 'adam', 'lr': 0.004754301700389947, 'layer1': 447, 'layer2': 288, 'layer3': 49}. Best is trial 42 with value: 0.8645324176837453.

Pseudomonas_Aeruginosa | Imipenem | Optuna:  45%|████▌     | 90/200 [1:18:34<2:01:40, 66.37s/it, best=0.865][A
Pseudomonas_Aeruginosa | Imipenem | Optuna:  45%|████▌     | 90/200 [1:18:34<2:01:40, 66.37s/it, best=0.865][A[I 2026-02-27 19:51:12,894] Trial 90 finished with value: 0.8534669977801771 and parameters: {'activation': 'logistic', 'solver': 'adam', 'lr': 0.002208658558946321, 'layer1': 126, 'layer2': 78, 'layer3': 95}. Best is trial 42 with value: 0.8645324176837453.

Pseudomonas_Aeruginosa | Imipenem | Optuna:  46%|████▌     | 91/200 [1:19:07<1:42:19, 56.33s/it, best=0.865][A
Pseudomonas_Aeruginosa | Imipenem | Optuna:  46%|████▌     | 91/200 [1:19:07<1:42:19, 56.33s/it, best=0.865][A[I 2026-02-27 19:51:45,002] Trial 159 finished with value: 0.823081788070007 and parameters: {'activation': 'relu', 'solver': 'adam', 'lr': 9.186166477399852e-05, 'layer1': 288, 'layer2': 490, 'layer3': 203}. Best is trial 91 with value: 0.8315336183309556.

Klebsiella_Pneumoniae | Ciprofloxacin | Optuna:  80%|████████  | 160/200 [5:04:14<1:15:39, 113.50s/it, best=0.832][A
Klebsiella_Pneumoniae | Ciprofloxacin | Optuna:  80%|████████  | 160/200 [5:04:14<1:15:39, 113.50s/it, best=0.832][A[I 2026-02-27 19:52:00,797] Trial 123 finished with value: 0.8046611072947197 and parameters: {'activation': 'tanh', 'solver': 'adam', 'lr': 2.6266677391539625e-05, 'layer1': 287, 'layer2': 288, 'layer3': 50}. Best is trial 107 with value: 0.8083747566869277.

Escherichia_Coli | Ciprofloxacin | Optuna:  62%|██████▏   | 124/200 [5:04:30<3:09:00, 149.21s/it, best=0.808][A
Escherichia_Coli | Ciprofloxacin | Optuna:  62%|██████▏   | 124/200 [5:04:30<3:09:00, 149.21s/it, best=0.808][A[I 2026-02-27 19:52:16,944] Trial 91 finished with value: 0.8610442957736723 and parameters: {'activation': 'relu', 'solver': 'adam', 'lr': 0.00030572449099261733, 'layer1': 409, 'layer2': 32, 'layer3': 81}. Best is trial 42 with value: 0.8645324176837453.

Pseudomonas_Aeruginosa | Imipenem | Optuna:  46%|████▌     | 92/200 [1:20:11<1:45:33, 58.64s/it, best=0.865][A
Pseudomonas_Aeruginosa | Imipenem | Optuna:  46%|████▌     | 92/200 [1:20:11<1:45:33, 58.64s/it, best=0.865][A[I 2026-02-27 19:52:38,088] Trial 139 finished with value: 0.9089010903386352 and parameters: {'activation': 'identity', 'solver': 'adam', 'lr': 0.000168049830990081, 'layer1': 210, 'layer2': 235, 'layer3': 460}. Best is trial 84 with value: 0.9099428178723615.

Staphylococcus_Aureus | Oxacillin | Optuna:  70%|███████   | 140/200 [5:05:07<2:10:05, 130.09s/it, best=0.91][A
Staphylococcus_Aureus | Oxacillin | Optuna:  70%|███████   | 140/200 [5:05:07<2:10:05, 130.09s/it, best=0.91][A[I 2026-02-27 19:53:16,266] Trial 160 finished with value: 0.8289000363436811 and parameters: {'activation': 'tanh', 'solver': 'adam', 'lr': 0.00011406614799538617, 'layer1': 309, 'layer2': 440, 'layer3': 178}. Best is trial 91 with value: 0.8315336183309556.

Klebsiella_Pneumoniae | Ciprofloxacin | Optuna:  80%|████████  | 161/200 [5:05:45<1:09:26, 106.83s/it, best=0.832][A
Klebsiella_Pneumoniae | Ciprofloxacin | Optuna:  80%|████████  | 161/200 [5:05:45<1:09:26, 106.83s/it, best=0.832][A[I 2026-02-27 19:53:20,101] Trial 92 finished with value: 0.8573493910890878 and parameters: {'activation': 'relu', 'solver': 'adam', 'lr': 0.00012367000484647428, 'layer1': 144, 'layer2': 52, 'layer3': 145}. Best is trial 42 with value: 0.8645324176837453.

Pseudomonas_Aeruginosa | Imipenem | Optuna:  46%|████▋     | 93/200 [1:21:14<1:46:59, 60.00s/it, best=0.865][A
Pseudomonas_Aeruginosa | Imipenem | Optuna:  46%|████▋     | 93/200 [1:21:14<1:46:59, 60.00s/it, best=0.865][A[I 2026-02-27 19:54:11,871] Trial 93 finished with value: 0.8517337315485942 and parameters: {'activation': 'relu', 'solver': 'adam', 'lr': 0.00018543276667131055, 'layer1': 207, 'layer2': 26, 'layer3': 108}. Best is trial 42 with value: 0.8645324176837453.

Pseudomonas_Aeruginosa | Imipenem | Optuna:  47%|████▋     | 94/200 [1:22:06<1:41:38, 57.53s/it, best=0.865][A
Pseudomonas_Aeruginosa | Imipenem | Optuna:  47%|████▋     | 94/200 [1:22:06<1:41:38, 57.53s/it, best=0.865][A[I 2026-02-27 19:54:54,094] Trial 140 finished with value: 0.9037187265852497 and parameters: {'activation': 'identity', 'solver': 'adam', 'lr': 3.330111823599865e-05, 'layer1': 213, 'layer2': 206, 'layer3': 485}. Best is trial 84 with value: 0.9099428178723615.

Staphylococcus_Aureus | Oxacillin | Optuna:  70%|███████   | 141/200 [5:07:23<2:09:39, 131.86s/it, best=0.91][A
Staphylococcus_Aureus | Oxacillin | Optuna:  70%|███████   | 141/200 [5:07:23<2:09:39, 131.86s/it, best=0.91][A[I 2026-02-27 19:54:56,950] Trial 94 finished with value: 0.8590773055540399 and parameters: {'activation': 'relu', 'solver': 'adam', 'lr': 0.000696630249340309, 'layer1': 184, 'layer2': 66, 'layer3': 62}. Best is trial 42 with value: 0.8645324176837453.

Pseudomonas_Aeruginosa | Imipenem | Optuna:  48%|████▊     | 95/200 [1:22:51<1:34:08, 53.79s/it, best=0.865][A
Pseudomonas_Aeruginosa | Imipenem | Optuna:  48%|████▊     | 95/200 [1:22:51<1:34:08, 53.79s/it, best=0.865][A[I 2026-02-27 19:55:00,642] Trial 161 finished with value: 0.8310387032966065 and parameters: {'activation': 'tanh', 'solver': 'adam', 'lr': 0.00020189448677296716, 'layer1': 309, 'layer2': 440, 'layer3': 179}. Best is trial 91 with value: 0.8315336183309556.

Klebsiella_Pneumoniae | Ciprofloxacin | Optuna:  81%|████████  | 162/200 [5:07:30<1:07:11, 106.09s/it, best=0.832][A
Klebsiella_Pneumoniae | Ciprofloxacin | Optuna:  81%|████████  | 162/200 [5:07:30<1:07:11, 106.09s/it, best=0.832][A[I 2026-02-27 19:55:24,185] Trial 124 finished with value: 0.8095465376114227 and parameters: {'activation': 'tanh', 'solver': 'adam', 'lr': 1.7837965637904262e-05, 'layer1': 265, 'layer2': 243, 'layer3': 35}. Best is trial 124 with value: 0.8095465376114227.

Escherichia_Coli | Ciprofloxacin | Optuna:  62%|██████▎   | 125/200 [5:07:53<3:26:49, 165.47s/it, best=0.808][A
Escherichia_Coli | Ciprofloxacin | Optuna:  62%|██████▎   | 125/200 [5:07:53<3:26:49, 165.47s/it, best=0.809][A[I 2026-02-27 19:55:39,785] Trial 95 finished with value: 0.8611056344104823 and parameters: {'activation': 'relu', 'solver': 'adam', 'lr': 0.0017292854385270004, 'layer1': 159, 'layer2': 18, 'layer3': 75}. Best is trial 42 with value: 0.8645324176837453.

Pseudomonas_Aeruginosa | Imipenem | Optuna:  48%|████▊     | 96/200 [1:23:34<1:27:32, 50.51s/it, best=0.865][A
Pseudomonas_Aeruginosa | Imipenem | Optuna:  48%|████▊     | 96/200 [1:23:34<1:27:32, 50.51s/it, best=0.865][A[I 2026-02-27 19:56:21,408] Trial 162 finished with value: 0.8288153348173545 and parameters: {'activation': 'tanh', 'solver': 'adam', 'lr': 0.00011632235434785808, 'layer1': 306, 'layer2': 442, 'layer3': 171}. Best is trial 91 with value: 0.8315336183309556.

Klebsiella_Pneumoniae | Ciprofloxacin | Optuna:  82%|████████▏ | 163/200 [5:08:50<1:00:44, 98.49s/it, best=0.832] [A
Klebsiella_Pneumoniae | Ciprofloxacin | Optuna:  82%|████████▏ | 163/200 [5:08:50<1:00:44, 98.49s/it, best=0.832][A[I 2026-02-27 19:56:43,912] Trial 96 finished with value: 0.8572534993913485 and parameters: {'activation': 'relu', 'solver': 'adam', 'lr': 0.003104726396881987, 'layer1': 397, 'layer2': 35, 'layer3': 125}. Best is trial 42 with value: 0.8645324176837453.

Pseudomonas_Aeruginosa | Imipenem | Optuna:  48%|████▊     | 97/200 [1:24:38<1:33:43, 54.59s/it, best=0.865][A
Pseudomonas_Aeruginosa | Imipenem | Optuna:  48%|████▊     | 97/200 [1:24:38<1:33:43, 54.59s/it, best=0.865][A[I 2026-02-27 19:57:14,944] Trial 141 finished with value: 0.9072775761316118 and parameters: {'activation': 'identity', 'solver': 'adam', 'lr': 0.0001721396025216646, 'layer1': 207, 'layer2': 240, 'layer3': 456}. Best is trial 84 with value: 0.9099428178723615.

Staphylococcus_Aureus | Oxacillin | Optuna:  71%|███████   | 142/200 [5:09:44<2:10:04, 134.56s/it, best=0.91][A
Staphylococcus_Aureus | Oxacillin | Optuna:  71%|███████   | 142/200 [5:09:44<2:10:04, 134.56s/it, best=0.91][A[I 2026-02-27 19:57:30,668] Trial 163 finished with value: 0.8249407849155144 and parameters: {'activation': 'tanh', 'solver': 'adam', 'lr': 0.00020701690984896082, 'layer1': 301, 'layer2': 439, 'layer3': 170}. Best is trial 91 with value: 0.8315336183309556.

Klebsiella_Pneumoniae | Ciprofloxacin | Optuna:  82%|████████▏ | 164/200 [5:10:00<53:50, 89.72s/it, best=0.832]  [A
Klebsiella_Pneumoniae | Ciprofloxacin | Optuna:  82%|████████▏ | 164/200 [5:10:00<53:50, 89.72s/it, best=0.832][A[I 2026-02-27 19:57:50,610] Trial 97 finished with value: 0.8564861238208883 and parameters: {'activation': 'identity', 'solver': 'adam', 'lr': 0.0011172582463683555, 'layer1': 377, 'layer2': 96, 'layer3': 93}. Best is trial 42 with value: 0.8645324176837453.

Pseudomonas_Aeruginosa | Imipenem | Optuna:  49%|████▉     | 98/200 [1:25:44<1:38:58, 58.22s/it, best=0.865][A
Pseudomonas_Aeruginosa | Imipenem | Optuna:  49%|████▉     | 98/200 [1:25:44<1:38:58, 58.22s/it, best=0.865][A[I 2026-02-27 19:58:21,506] Trial 125 finished with value: 0.8034608801421369 and parameters: {'activation': 'tanh', 'solver': 'adam', 'lr': 1.2741259609463659e-05, 'layer1': 139, 'layer2': 224, 'layer3': 56}. Best is trial 124 with value: 0.8095465376114227.

Escherichia_Coli | Ciprofloxacin | Optuna:  63%|██████▎   | 126/200 [5:10:50<3:28:27, 169.02s/it, best=0.809][A
Escherichia_Coli | Ciprofloxacin | Optuna:  63%|██████▎   | 126/200 [5:10:50<3:28:27, 169.02s/it, best=0.809][A[I 2026-02-27 19:58:38,798] Trial 164 finished with value: 0.8249026668726451 and parameters: {'activation': 'tanh', 'solver': 'adam', 'lr': 0.00011829146239699839, 'layer1': 319, 'layer2': 444, 'layer3': 182}. Best is trial 91 with value: 0.8315336183309556.

Klebsiella_Pneumoniae | Ciprofloxacin | Optuna:  82%|████████▎ | 165/200 [5:11:08<48:33, 83.25s/it, best=0.832][A
Klebsiella_Pneumoniae | Ciprofloxacin | Optuna:  82%|████████▎ | 165/200 [5:11:08<48:33, 83.25s/it, best=0.832][A[I 2026-02-27 19:58:56,826] Trial 98 finished with value: 0.862558437330098 and parameters: {'activation': 'relu', 'solver': 'adam', 'lr': 0.003906398164261906, 'layer1': 431, 'layer2': 54, 'layer3': 44}. Best is trial 42 with value: 0.8645324176837453.

Pseudomonas_Aeruginosa | Imipenem | Optuna:  50%|████▉     | 99/200 [1:26:51<1:42:02, 60.62s/it, best=0.865][A
Pseudomonas_Aeruginosa | Imipenem | Optuna:  50%|████▉     | 99/200 [1:26:51<1:42:02, 60.62s/it, best=0.865][A[I 2026-02-27 19:59:13,794] Trial 99 finished with value: 0.8175565662034809 and parameters: {'activation': 'relu', 'solver': 'sgd', 'lr': 0.008212764001715703, 'layer1': 248, 'layer2': 325, 'layer3': 28}. Best is trial 42 with value: 0.8645324176837453.

Pseudomonas_Aeruginosa | Imipenem | Optuna:  50%|█████     | 100/200 [1:27:08<1:19:12, 47.53s/it, best=0.865][A
Pseudomonas_Aeruginosa | Imipenem | Optuna:  50%|█████     | 100/200 [1:27:08<1:19:12, 47.53s/it, best=0.865][A[I 2026-02-27 19:59:22,501] Trial 142 finished with value: 0.9065101649484155 and parameters: {'activation': 'identity', 'solver': 'adam', 'lr': 0.0001340455135033119, 'layer1': 188, 'layer2': 230, 'layer3': 446}. Best is trial 84 with value: 0.9099428178723615.

Staphylococcus_Aureus | Oxacillin | Optuna:  72%|███████▏  | 143/200 [5:11:52<2:05:50, 132.46s/it, best=0.91][A
Staphylococcus_Aureus | Oxacillin | Optuna:  72%|███████▏  | 143/200 [5:11:52<2:05:50, 132.46s/it, best=0.91][A[I 2026-02-27 19:59:50,095] Trial 100 finished with value: 0.820393477384199 and parameters: {'activation': 'relu', 'solver': 'adam', 'lr': 3.712230363602767e-06, 'layer1': 488, 'layer2': 276, 'layer3': 112}. Best is trial 42 with value: 0.8645324176837453.

Pseudomonas_Aeruginosa | Imipenem | Optuna:  50%|█████     | 101/200 [1:27:44<1:12:51, 44.16s/it, best=0.865][A
Pseudomonas_Aeruginosa | Imipenem | Optuna:  50%|█████     | 101/200 [1:27:44<1:12:51, 44.16s/it, best=0.865][A[I 2026-02-27 20:00:02,086] Trial 165 finished with value: 0.8226020116794451 and parameters: {'activation': 'tanh', 'solver': 'adam', 'lr': 0.00023351493151706635, 'layer1': 336, 'layer2': 424, 'layer3': 162}. Best is trial 91 with value: 0.8315336183309556.

Klebsiella_Pneumoniae | Ciprofloxacin | Optuna:  83%|████████▎ | 166/200 [5:12:31<47:10, 83.26s/it, best=0.832][A
Klebsiella_Pneumoniae | Ciprofloxacin | Optuna:  83%|████████▎ | 166/200 [5:12:31<47:10, 83.26s/it, best=0.832][A[I 2026-02-27 20:00:49,320] Trial 126 finished with value: 0.8035821167477242 and parameters: {'activation': 'tanh', 'solver': 'adam', 'lr': 2.184005456604269e-05, 'layer1': 255, 'layer2': 244, 'layer3': 29}. Best is trial 124 with value: 0.8095465376114227.

Escherichia_Coli | Ciprofloxacin | Optuna:  64%|██████▎   | 127/200 [5:13:18<3:17:54, 162.66s/it, best=0.809][A
Escherichia_Coli | Ciprofloxacin | Optuna:  64%|██████▎   | 127/200 [5:13:18<3:17:54, 162.66s/it, best=0.809][A[I 2026-02-27 20:01:17,800] Trial 101 finished with value: 0.8631436516699601 and parameters: {'activation': 'relu', 'solver': 'adam', 'lr': 0.0004371928569703438, 'layer1': 421, 'layer2': 406, 'layer3': 135}. Best is trial 42 with value: 0.8645324176837453.

Pseudomonas_Aeruginosa | Imipenem | Optuna:  51%|█████     | 102/200 [1:29:12<1:33:27, 57.22s/it, best=0.865][A
Pseudomonas_Aeruginosa | Imipenem | Optuna:  51%|█████     | 102/200 [1:29:12<1:33:27, 57.22s/it, best=0.865][A[I 2026-02-27 20:01:20,296] Trial 166 finished with value: 0.8282708735776989 and parameters: {'activation': 'tanh', 'solver': 'adam', 'lr': 0.0001456095846218475, 'layer1': 284, 'layer2': 472, 'layer3': 177}. Best is trial 91 with value: 0.8315336183309556.

Klebsiella_Pneumoniae | Ciprofloxacin | Optuna:  84%|████████▎ | 167/200 [5:13:49<44:57, 81.74s/it, best=0.832][A
Klebsiella_Pneumoniae | Ciprofloxacin | Optuna:  84%|████████▎ | 167/200 [5:13:49<44:57, 81.74s/it, best=0.832][A[I 2026-02-27 20:01:25,225] Trial 143 finished with value: 0.9064897661351919 and parameters: {'activation': 'identity', 'solver': 'adam', 'lr': 0.00010490620205363159, 'layer1': 242, 'layer2': 407, 'layer3': 434}. Best is trial 84 with value: 0.9099428178723615.

Staphylococcus_Aureus | Oxacillin | Optuna:  72%|███████▏  | 144/200 [5:13:54<2:00:54, 129.54s/it, best=0.91][A
Staphylococcus_Aureus | Oxacillin | Optuna:  72%|███████▏  | 144/200 [5:13:54<2:00:54, 129.54s/it, best=0.91][A[I 2026-02-27 20:02:35,432] Trial 102 finished with value: 0.8624096440000706 and parameters: {'activation': 'relu', 'solver': 'adam', 'lr': 0.0003251112575682768, 'layer1': 422, 'layer2': 193, 'layer3': 160}. Best is trial 42 with value: 0.8645324176837453.

Pseudomonas_Aeruginosa | Imipenem | Optuna:  52%|█████▏    | 103/200 [1:30:29<1:42:24, 63.35s/it, best=0.865][A
