Pseudomonas_Aeruginosa | Ciprofloxacin | Optuna:  26%|██▋       | 53/200 [50:28<3:05:15, 75.61s/it, best=0.875][A[I 2026-02-27 15:38:26,895] Trial 53 finished with value: 0.8159756916186209 and parameters: {'activation': 'logistic', 'solver': 'adam', 'lr': 7.975709442638334e-05, 'layer1': 362, 'layer2': 385, 'layer3': 264}. Best is trial 46 with value: 0.8754031846375991.

Pseudomonas_Aeruginosa | Ciprofloxacin | Optuna:  27%|██▋       | 54/200 [50:56<2:29:20, 61.37s/it, best=0.875][A
Pseudomonas_Aeruginosa | Ciprofloxacin | Optuna:  27%|██▋       | 54/200 [50:56<2:29:20, 61.37s/it, best=0.875][A[I 2026-02-27 15:39:02,332] Trial 21 finished with value: 0.9070539606430822 and parameters: {'activation': 'identity', 'solver': 'adam', 'lr': 0.00010529981879102522, 'layer1': 198, 'layer2': 414, 'layer3': 491}. Best is trial 12 with value: 0.9088083331363105.

Staphylococcus_Aureus | Oxacillin | Optuna:  11%|█         | 22/200 [51:32<6:31:26, 131.95s/it, best=0.909][A
Staphylococcus_Aureus | Oxacillin | Optuna:  11%|█         | 22/200 [51:32<6:31:26, 131.95s/it, best=0.909][A[I 2026-02-27 15:39:39,567] Trial 17 finished with value: 0.8047117579353185 and parameters: {'activation': 'identity', 'solver': 'adam', 'lr': 4.76034794439584e-05, 'layer1': 339, 'layer2': 424, 'layer3': 405}. Best is trial 17 with value: 0.8047117579353185.

Escherichia_Coli | Ciprofloxacin | Optuna:   9%|▉         | 18/200 [52:08<10:56:11, 216.32s/it, best=0.803][A
Escherichia_Coli | Ciprofloxacin | Optuna:   9%|▉         | 18/200 [52:08<10:56:11, 216.32s/it, best=0.805][A[I 2026-02-27 15:39:46,123] Trial 31 finished with value: 0.8249852522143455 and parameters: {'activation': 'identity', 'solver': 'adam', 'lr': 0.00015941685639292018, 'layer1': 497, 'layer2': 462, 'layer3': 193}. Best is trial 25 with value: 0.8268937643839351.

Klebsiella_Pneumoniae | Ciprofloxacin | Optuna:  16%|█▌        | 32/200 [52:15<5:27:42, 117.04s/it, best=0.827][A
Klebsiella_Pneumoniae | Ciprofloxacin | Optuna:  16%|█▌        | 32/200 [52:15<5:27:42, 117.04s/it, best=0.827][A[I 2026-02-27 15:40:06,288] Trial 54 finished with value: 0.8666096373694849 and parameters: {'activation': 'logistic', 'solver': 'adam', 'lr': 0.00014960379363522695, 'layer1': 480, 'layer2': 339, 'layer3': 500}. Best is trial 46 with value: 0.8754031846375991.

Pseudomonas_Aeruginosa | Ciprofloxacin | Optuna:  28%|██▊       | 55/200 [52:35<2:55:53, 72.78s/it, best=0.875][A
Pseudomonas_Aeruginosa | Ciprofloxacin | Optuna:  28%|██▊       | 55/200 [52:35<2:55:53, 72.78s/it, best=0.875][A[I 2026-02-27 15:41:08,947] Trial 22 finished with value: 0.9050178192942558 and parameters: {'activation': 'identity', 'solver': 'adam', 'lr': 0.00020175060964083984, 'layer1': 185, 'layer2': 450, 'layer3': 449}. Best is trial 12 with value: 0.9088083331363105.

Staphylococcus_Aureus | Oxacillin | Optuna:  12%|█▏        | 23/200 [53:38<6:24:31, 130.35s/it, best=0.909][A
Staphylococcus_Aureus | Oxacillin | Optuna:  12%|█▏        | 23/200 [53:38<6:24:31, 130.35s/it, best=0.909][A[I 2026-02-27 15:41:10,941] Trial 18 finished with value: 0.6288784095269832 and parameters: {'activation': 'tanh', 'solver': 'sgd', 'lr': 6.636023261323668e-05, 'layer1': 168, 'layer2': 383, 'layer3': 356}. Best is trial 17 with value: 0.8047117579353185.

Escherichia_Coli | Ciprofloxacin | Optuna:  10%|▉         | 19/200 [53:40<8:59:22, 178.80s/it, best=0.805] [A
Escherichia_Coli | Ciprofloxacin | Optuna:  10%|▉         | 19/200 [53:40<8:59:22, 178.80s/it, best=0.805][A[I 2026-02-27 15:41:35,294] Trial 55 finished with value: 0.8727426471572434 and parameters: {'activation': 'logistic', 'solver': 'adam', 'lr': 0.00046576658193569283, 'layer1': 344, 'layer2': 429, 'layer3': 438}. Best is trial 46 with value: 0.8754031846375991.

Pseudomonas_Aeruginosa | Ciprofloxacin | Optuna:  28%|██▊       | 56/200 [54:04<3:06:21, 77.65s/it, best=0.875][A
Pseudomonas_Aeruginosa | Ciprofloxacin | Optuna:  28%|██▊       | 56/200 [54:04<3:06:21, 77.65s/it, best=0.875][A[I 2026-02-27 15:42:02,720] Trial 32 finished with value: 0.8271479218909125 and parameters: {'activation': 'identity', 'solver': 'adam', 'lr': 3.9773750946359844e-05, 'layer1': 451, 'layer2': 429, 'layer3': 221}. Best is trial 32 with value: 0.8271479218909125.

Klebsiella_Pneumoniae | Ciprofloxacin | Optuna:  16%|█▋        | 33/200 [54:32<5:42:05, 122.91s/it, best=0.827][A
Klebsiella_Pneumoniae | Ciprofloxacin | Optuna:  16%|█▋        | 33/200 [54:32<5:42:05, 122.91s/it, best=0.827][A[I 2026-02-27 15:42:33,034] Trial 56 finished with value: 0.8703552984144931 and parameters: {'activation': 'tanh', 'solver': 'adam', 'lr': 0.00029361723191638077, 'layer1': 281, 'layer2': 310, 'layer3': 471}. Best is trial 46 with value: 0.8754031846375991.

Pseudomonas_Aeruginosa | Ciprofloxacin | Optuna:  28%|██▊       | 57/200 [55:02<2:50:49, 71.68s/it, best=0.875][A
Pseudomonas_Aeruginosa | Ciprofloxacin | Optuna:  28%|██▊       | 57/200 [55:02<2:50:49, 71.68s/it, best=0.875][A[I 2026-02-27 15:43:02,059] Trial 57 finished with value: 0.8159756916186209 and parameters: {'activation': 'logistic', 'solver': 'adam', 'lr': 8.700196775540797e-05, 'layer1': 427, 'layer2': 297, 'layer3': 400}. Best is trial 46 with value: 0.8754031846375991.

Pseudomonas_Aeruginosa | Ciprofloxacin | Optuna:  29%|██▉       | 58/200 [55:31<2:19:21, 58.88s/it, best=0.875][A
Pseudomonas_Aeruginosa | Ciprofloxacin | Optuna:  29%|██▉       | 58/200 [55:31<2:19:21, 58.88s/it, best=0.875][A[I 2026-02-27 15:43:25,555] Trial 23 finished with value: 0.9052637990651299 and parameters: {'activation': 'identity', 'solver': 'adam', 'lr': 3.955292386203551e-05, 'layer1': 144, 'layer2': 389, 'layer3': 363}. Best is trial 12 with value: 0.9088083331363105.

Staphylococcus_Aureus | Oxacillin | Optuna:  12%|█▏        | 24/200 [55:55<6:27:51, 132.23s/it, best=0.909][A
Staphylococcus_Aureus | Oxacillin | Optuna:  12%|█▏        | 24/200 [55:55<6:27:51, 132.23s/it, best=0.909][A[I 2026-02-27 15:43:30,172] Trial 33 finished with value: 0.7608267342172155 and parameters: {'activation': 'identity', 'solver': 'adam', 'lr': 1.0833477002137755e-06, 'layer1': 244, 'layer2': 394, 'layer3': 138}. Best is trial 32 with value: 0.8271479218909125.

Klebsiella_Pneumoniae | Ciprofloxacin | Optuna:  17%|█▋        | 34/200 [55:59<5:10:36, 112.27s/it, best=0.827][A
Klebsiella_Pneumoniae | Ciprofloxacin | Optuna:  17%|█▋        | 34/200 [55:59<5:10:36, 112.27s/it, best=0.827][A[I 2026-02-27 15:43:43,671] Trial 58 finished with value: 0.821489168045853 and parameters: {'activation': 'identity', 'solver': 'sgd', 'lr': 0.001387063274712621, 'layer1': 374, 'layer2': 379, 'layer3': 455}. Best is trial 46 with value: 0.8754031846375991.

Pseudomonas_Aeruginosa | Ciprofloxacin | Optuna:  30%|██▉       | 59/200 [56:13<2:06:11, 53.70s/it, best=0.875][A
Pseudomonas_Aeruginosa | Ciprofloxacin | Optuna:  30%|██▉       | 59/200 [56:13<2:06:11, 53.70s/it, best=0.875][A[I 2026-02-27 15:45:15,163] Trial 59 finished with value: 0.8680648620600897 and parameters: {'activation': 'logistic', 'solver': 'adam', 'lr': 0.00016329222295562181, 'layer1': 460, 'layer2': 352, 'layer3': 434}. Best is trial 46 with value: 0.8754031846375991.

Pseudomonas_Aeruginosa | Ciprofloxacin | Optuna:  30%|███       | 60/200 [57:44<2:31:45, 65.04s/it, best=0.875][A
Pseudomonas_Aeruginosa | Ciprofloxacin | Optuna:  30%|███       | 60/200 [57:44<2:31:45, 65.04s/it, best=0.875][A[I 2026-02-27 15:45:53,119] Trial 24 finished with value: 0.9072609722300966 and parameters: {'activation': 'identity', 'solver': 'adam', 'lr': 0.0008919348768297585, 'layer1': 231, 'layer2': 500, 'layer3': 458}. Best is trial 12 with value: 0.9088083331363105.

Staphylococcus_Aureus | Oxacillin | Optuna:  12%|█▎        | 25/200 [58:22<6:39:04, 136.83s/it, best=0.909][A
Staphylococcus_Aureus | Oxacillin | Optuna:  12%|█▎        | 25/200 [58:22<6:39:04, 136.83s/it, best=0.909][A[I 2026-02-27 15:46:05,792] Trial 34 finished with value: 0.8005614672783399 and parameters: {'activation': 'identity', 'solver': 'adam', 'lr': 8.509606472532834e-06, 'layer1': 427, 'layer2': 336, 'layer3': 322}. Best is trial 32 with value: 0.8271479218909125.

Klebsiella_Pneumoniae | Ciprofloxacin | Optuna:  18%|█▊        | 35/200 [58:35<5:44:30, 125.28s/it, best=0.827][A
Klebsiella_Pneumoniae | Ciprofloxacin | Optuna:  18%|█▊        | 35/200 [58:35<5:44:30, 125.28s/it, best=0.827][A[I 2026-02-27 15:46:39,134] Trial 35 finished with value: 0.7417840809323848 and parameters: {'activation': 'logistic', 'solver': 'adam', 'lr': 3.143088564088207e-05, 'layer1': 279, 'layer2': 314, 'layer3': 230}. Best is trial 32 with value: 0.8271479218909125.

Klebsiella_Pneumoniae | Ciprofloxacin | Optuna:  18%|█▊        | 36/200 [59:08<4:27:02, 97.70s/it, best=0.827] [A
Klebsiella_Pneumoniae | Ciprofloxacin | Optuna:  18%|█▊        | 36/200 [59:08<4:27:02, 97.70s/it, best=0.827][A[I 2026-02-27 15:46:40,246] Trial 60 finished with value: 0.8749085543677853 and parameters: {'activation': 'logistic', 'solver': 'adam', 'lr': 0.0003846466190670002, 'layer1': 345, 'layer2': 425, 'layer3': 486}. Best is trial 46 with value: 0.8754031846375991.

Pseudomonas_Aeruginosa | Ciprofloxacin | Optuna:  30%|███       | 61/200 [59:09<2:44:36, 71.05s/it, best=0.875][A
Pseudomonas_Aeruginosa | Ciprofloxacin | Optuna:  30%|███       | 61/200 [59:09<2:44:36, 71.05s/it, best=0.875][A[I 2026-02-27 15:46:45,670] Trial 19 finished with value: 0.8037009292859645 and parameters: {'activation': 'logistic', 'solver': 'adam', 'lr': 4.375575814125845e-05, 'layer1': 313, 'layer2': 449, 'layer3': 445}. Best is trial 17 with value: 0.8047117579353185.

Escherichia_Coli | Ciprofloxacin | Optuna:  10%|█         | 20/200 [59:15<11:16:50, 225.61s/it, best=0.805][A
Escherichia_Coli | Ciprofloxacin | Optuna:  10%|█         | 20/200 [59:15<11:16:50, 225.61s/it, best=0.805][A[I 2026-02-27 15:47:53,969] Trial 61 finished with value: 0.8744016012941842 and parameters: {'activation': 'logistic', 'solver': 'adam', 'lr': 0.00036524931335269064, 'layer1': 322, 'layer2': 417, 'layer3': 485}. Best is trial 46 with value: 0.8754031846375991.

Pseudomonas_Aeruginosa | Ciprofloxacin | Optuna:  31%|███       | 62/200 [1:00:23<2:45:15, 71.85s/it, best=0.875][A
Pseudomonas_Aeruginosa | Ciprofloxacin | Optuna:  31%|███       | 62/200 [1:00:23<2:45:15, 71.85s/it, best=0.875][A[I 2026-02-27 15:48:02,773] Trial 25 finished with value: 0.9073243350453286 and parameters: {'activation': 'identity', 'solver': 'adam', 'lr': 0.0027476966841855914, 'layer1': 367, 'layer2': 436, 'layer3': 275}. Best is trial 12 with value: 0.9088083331363105.

Staphylococcus_Aureus | Oxacillin | Optuna:  13%|█▎        | 26/200 [1:00:32<6:30:33, 134.68s/it, best=0.909][A
Staphylococcus_Aureus | Oxacillin | Optuna:  13%|█▎        | 26/200 [1:00:32<6:30:33, 134.68s/it, best=0.909][A[I 2026-02-27 15:48:20,989] Trial 36 finished with value: 0.8171360082370986 and parameters: {'activation': 'relu', 'solver': 'adam', 'lr': 4.252027578964465e-05, 'layer1': 246, 'layer2': 426, 'layer3': 267}. Best is trial 32 with value: 0.8271479218909125.

Klebsiella_Pneumoniae | Ciprofloxacin | Optuna:  18%|█▊        | 37/200 [1:00:50<4:28:47, 98.94s/it, best=0.827][A
Klebsiella_Pneumoniae | Ciprofloxacin | Optuna:  18%|█▊        | 37/200 [1:00:50<4:28:47, 98.94s/it, best=0.827][A[I 2026-02-27 15:49:00,233] Trial 62 finished with value: 0.8726920156913106 and parameters: {'activation': 'logistic', 'solver': 'adam', 'lr': 0.00038520261194979, 'layer1': 317, 'layer2': 462, 'layer3': 480}. Best is trial 46 with value: 0.8754031846375991.

Pseudomonas_Aeruginosa | Ciprofloxacin | Optuna:  32%|███▏      | 63/200 [1:01:29<2:40:14, 70.18s/it, best=0.875][A
Pseudomonas_Aeruginosa | Ciprofloxacin | Optuna:  32%|███▏      | 63/200 [1:01:29<2:40:14, 70.18s/it, best=0.875][A[I 2026-02-27 15:49:54,721] Trial 63 finished with value: 0.8674408852585032 and parameters: {'activation': 'logistic', 'solver': 'adam', 'lr': 0.0007203660826833804, 'layer1': 244, 'layer2': 426, 'layer3': 490}. Best is trial 46 with value: 0.8754031846375991.

Pseudomonas_Aeruginosa | Ciprofloxacin | Optuna:  32%|███▏      | 64/200 [1:02:24<2:28:23, 65.47s/it, best=0.875][A
Pseudomonas_Aeruginosa | Ciprofloxacin | Optuna:  32%|███▏      | 64/200 [1:02:24<2:28:23, 65.47s/it, best=0.875][A[I 2026-02-27 15:50:14,919] Trial 26 finished with value: 0.7176693479500036 and parameters: {'activation': 'identity', 'solver': 'sgd', 'lr': 5.042357562131766e-05, 'layer1': 290, 'layer2': 327, 'layer3': 397}. Best is trial 12 with value: 0.9088083331363105.

Staphylococcus_Aureus | Oxacillin | Optuna:  14%|█▎        | 27/200 [1:02:44<6:26:07, 133.92s/it, best=0.909][A
Staphylococcus_Aureus | Oxacillin | Optuna:  14%|█▎        | 27/200 [1:02:44<6:26:07, 133.92s/it, best=0.909][A[I 2026-02-27 15:50:30,739] Trial 37 finished with value: 0.8044692024818618 and parameters: {'activation': 'identity', 'solver': 'adam', 'lr': 1.3936423795611331e-05, 'layer1': 372, 'layer2': 477, 'layer3': 120}. Best is trial 32 with value: 0.8271479218909125.

Klebsiella_Pneumoniae | Ciprofloxacin | Optuna:  19%|█▉        | 38/200 [1:03:00<4:52:06, 108.19s/it, best=0.827][A
Klebsiella_Pneumoniae | Ciprofloxacin | Optuna:  19%|█▉        | 38/200 [1:03:00<4:52:06, 108.19s/it, best=0.827][A[I 2026-02-27 15:50:48,902] Trial 64 finished with value: 0.8686967181736882 and parameters: {'activation': 'logistic', 'solver': 'adam', 'lr': 0.001085964244471869, 'layer1': 284, 'layer2': 486, 'layer3': 441}. Best is trial 46 with value: 0.8754031846375991.

Pseudomonas_Aeruginosa | Ciprofloxacin | Optuna:  32%|███▎      | 65/200 [1:03:18<2:19:41, 62.08s/it, best=0.875][A
Pseudomonas_Aeruginosa | Ciprofloxacin | Optuna:  32%|███▎      | 65/200 [1:03:18<2:19:41, 62.08s/it, best=0.875][A[I 2026-02-27 15:51:31,368] Trial 27 finished with value: 0.9041091828889222 and parameters: {'activation': 'logistic', 'solver': 'adam', 'lr': 0.00047083850570623086, 'layer1': 157, 'layer2': 387, 'layer3': 329}. Best is trial 12 with value: 0.9088083331363105.

Staphylococcus_Aureus | Oxacillin | Optuna:  14%|█▍        | 28/200 [1:04:01<5:34:28, 116.68s/it, best=0.909][A
Staphylococcus_Aureus | Oxacillin | Optuna:  14%|█▍        | 28/200 [1:04:01<5:34:28, 116.68s/it, best=0.909][A[I 2026-02-27 15:51:46,355] Trial 38 finished with value: 0.7466903888795106 and parameters: {'activation': 'identity', 'solver': 'sgd', 'lr': 7.813443356335244e-05, 'layer1': 176, 'layer2': 438, 'layer3': 219}. Best is trial 32 with value: 0.8271479218909125.

Klebsiella_Pneumoniae | Ciprofloxacin | Optuna:  20%|█▉        | 39/200 [1:04:15<4:24:04, 98.41s/it, best=0.827] [A
Klebsiella_Pneumoniae | Ciprofloxacin | Optuna:  20%|█▉        | 39/200 [1:04:15<4:24:04, 98.41s/it, best=0.827][A[I 2026-02-27 15:51:52,763] Trial 20 finished with value: 0.7973525308911114 and parameters: {'activation': 'logistic', 'solver': 'adam', 'lr': 3.667052504991214e-05, 'layer1': 304, 'layer2': 119, 'layer3': 467}. Best is trial 17 with value: 0.8047117579353185.

Escherichia_Coli | Ciprofloxacin | Optuna:  10%|█         | 21/200 [1:04:22<12:26:02, 250.07s/it, best=0.805][A
Escherichia_Coli | Ciprofloxacin | Optuna:  10%|█         | 21/200 [1:04:22<12:26:02, 250.07s/it, best=0.805][A[I 2026-02-27 15:51:58,363] Trial 65 finished with value: 0.8733328030602173 and parameters: {'activation': 'logistic', 'solver': 'adam', 'lr': 0.00030114332228691913, 'layer1': 344, 'layer2': 404, 'layer3': 404}. Best is trial 46 with value: 0.8754031846375991.

Pseudomonas_Aeruginosa | Ciprofloxacin | Optuna:  33%|███▎      | 66/200 [1:04:28<2:23:35, 64.30s/it, best=0.875][A
Pseudomonas_Aeruginosa | Ciprofloxacin | Optuna:  33%|███▎      | 66/200 [1:04:28<2:23:35, 64.30s/it, best=0.875][A[I 2026-02-27 15:52:48,032] Trial 28 finished with value: 0.9032711938188257 and parameters: {'activation': 'tanh', 'solver': 'adam', 'lr': 0.00024512459868286673, 'layer1': 109, 'layer2': 468, 'layer3': 455}. Best is trial 12 with value: 0.9088083331363105.

Staphylococcus_Aureus | Oxacillin | Optuna:  14%|█▍        | 29/200 [1:05:17<4:58:18, 104.67s/it, best=0.909][A
Staphylococcus_Aureus | Oxacillin | Optuna:  14%|█▍        | 29/200 [1:05:17<4:58:18, 104.67s/it, best=0.909][A[I 2026-02-27 15:52:54,017] Trial 66 finished with value: 0.8637606312064809 and parameters: {'activation': 'relu', 'solver': 'adam', 'lr': 0.0004969983002072198, 'layer1': 269, 'layer2': 420, 'layer3': 373}. Best is trial 46 with value: 0.8754031846375991.

Pseudomonas_Aeruginosa | Ciprofloxacin | Optuna:  34%|███▎      | 67/200 [1:05:23<2:16:46, 61.70s/it, best=0.875][A
Pseudomonas_Aeruginosa | Ciprofloxacin | Optuna:  34%|███▎      | 67/200 [1:05:23<2:16:46, 61.70s/it, best=0.875][A[I 2026-02-27 15:53:09,387] Trial 39 finished with value: 0.7647245317310548 and parameters: {'activation': 'tanh', 'solver': 'adam', 'lr': 7.12567038017915e-06, 'layer1': 123, 'layer2': 377, 'layer3': 181}. Best is trial 32 with value: 0.8271479218909125.

Klebsiella_Pneumoniae | Ciprofloxacin | Optuna:  20%|██        | 40/200 [1:05:38<4:10:07, 93.80s/it, best=0.827][A
Klebsiella_Pneumoniae | Ciprofloxacin | Optuna:  20%|██        | 40/200 [1:05:38<4:10:07, 93.80s/it, best=0.827][A[I 2026-02-27 15:53:23,402] Trial 29 finished with value: 0.711014531661111 and parameters: {'activation': 'logistic', 'solver': 'sgd', 'lr': 0.0017933697099232098, 'layer1': 467, 'layer2': 263, 'layer3': 376}. Best is trial 12 with value: 0.9088083331363105.

Staphylococcus_Aureus | Oxacillin | Optuna:  15%|█▌        | 30/200 [1:05:53<3:57:39, 83.88s/it, best=0.909] [A
Staphylococcus_Aureus | Oxacillin | Optuna:  15%|█▌        | 30/200 [1:05:53<3:57:39, 83.88s/it, best=0.909][A[I 2026-02-27 15:53:39,950] Trial 40 finished with value: 0.7434397650259825 and parameters: {'activation': 'relu', 'solver': 'adam', 'lr': 2.394739752960538e-05, 'layer1': 261, 'layer2': 286, 'layer3': 241}. Best is trial 32 with value: 0.8271479218909125.

Klebsiella_Pneumoniae | Ciprofloxacin | Optuna:  20%|██        | 41/200 [1:06:09<3:18:17, 74.83s/it, best=0.827][A
Klebsiella_Pneumoniae | Ciprofloxacin | Optuna:  20%|██        | 41/200 [1:06:09<3:18:17, 74.83s/it, best=0.827][A[I 2026-02-27 15:53:49,723] Trial 67 finished with value: 0.8599690890519606 and parameters: {'activation': 'logistic', 'solver': 'adam', 'lr': 0.00189576097024466, 'layer1': 191, 'layer2': 470, 'layer3': 482}. Best is trial 46 with value: 0.8754031846375991.

Pseudomonas_Aeruginosa | Ciprofloxacin | Optuna:  34%|███▍      | 68/200 [1:06:19<2:11:47, 59.90s/it, best=0.875][A
Pseudomonas_Aeruginosa | Ciprofloxacin | Optuna:  34%|███▍      | 68/200 [1:06:19<2:11:47, 59.90s/it, best=0.875][A[I 2026-02-27 15:55:03,547] Trial 68 finished with value: 0.8736708886183278 and parameters: {'activation': 'logistic', 'solver': 'adam', 'lr': 0.00035926405585994247, 'layer1': 302, 'layer2': 159, 'layer3': 464}. Best is trial 46 with value: 0.8754031846375991.

Pseudomonas_Aeruginosa | Ciprofloxacin | Optuna:  34%|███▍      | 69/200 [1:07:33<2:19:54, 64.08s/it, best=0.875][A
Pseudomonas_Aeruginosa | Ciprofloxacin | Optuna:  34%|███▍      | 69/200 [1:07:33<2:19:54, 64.08s/it, best=0.875][A[I 2026-02-27 15:55:05,592] Trial 30 finished with value: 0.9023226520430768 and parameters: {'activation': 'identity', 'solver': 'adam', 'lr': 0.008187801926920688, 'layer1': 363, 'layer2': 312, 'layer3': 129}. Best is trial 12 with value: 0.9088083331363105.

Staphylococcus_Aureus | Oxacillin | Optuna:  16%|█▌        | 31/200 [1:07:35<4:11:44, 89.37s/it, best=0.909][A
Staphylococcus_Aureus | Oxacillin | Optuna:  16%|█▌        | 31/200 [1:07:35<4:11:44, 89.37s/it, best=0.909][A[I 2026-02-27 15:55:08,253] Trial 21 finished with value: 0.8029561499534994 and parameters: {'activation': 'logistic', 'solver': 'adam', 'lr': 0.00020663617091153355, 'layer1': 409, 'layer2': 449, 'layer3': 445}. Best is trial 17 with value: 0.8047117579353185.

Escherichia_Coli | Ciprofloxacin | Optuna:  11%|█         | 22/200 [1:07:37<11:33:16, 233.69s/it, best=0.805][A
Escherichia_Coli | Ciprofloxacin | Optuna:  11%|█         | 22/200 [1:07:37<11:33:16, 233.69s/it, best=0.805][A[I 2026-02-27 15:55:25,577] Trial 41 finished with value: 0.8187048402544364 and parameters: {'activation': 'identity', 'solver': 'adam', 'lr': 0.00010767611220085416, 'layer1': 460, 'layer2': 497, 'layer3': 210}. Best is trial 32 with value: 0.8271479218909125.

Klebsiella_Pneumoniae | Ciprofloxacin | Optuna:  21%|██        | 42/200 [1:07:55<3:41:22, 84.07s/it, best=0.827][A
Klebsiella_Pneumoniae | Ciprofloxacin | Optuna:  21%|██        | 42/200 [1:07:55<3:41:22, 84.07s/it, best=0.827][A[I 2026-02-27 15:56:21,459] Trial 69 finished with value: 0.8365714277389211 and parameters: {'activation': 'logistic', 'solver': 'adam', 'lr': 0.00013947326071020374, 'layer1': 329, 'layer2': 152, 'layer3': 452}. Best is trial 46 with value: 0.8754031846375991.

Pseudomonas_Aeruginosa | Ciprofloxacin | Optuna:  35%|███▌      | 70/200 [1:08:51<2:27:49, 68.23s/it, best=0.875][A
Pseudomonas_Aeruginosa | Ciprofloxacin | Optuna:  35%|███▌      | 70/200 [1:08:51<2:27:49, 68.23s/it, best=0.875][A[I 2026-02-27 15:56:58,003] Trial 70 finished with value: 0.8197321246457167 and parameters: {'activation': 'tanh', 'solver': 'sgd', 'lr': 0.0007892604034431946, 'layer1': 296, 'layer2': 66, 'layer3': 462}. Best is trial 46 with value: 0.8754031846375991.

Pseudomonas_Aeruginosa | Ciprofloxacin | Optuna:  36%|███▌      | 71/200 [1:09:27<2:06:15, 58.72s/it, best=0.875][A
