Escherichia_Coli | Ceftriaxone | Optuna:  34%|███▍      | 68/200 [2:42:45<6:02:24, 164.73s/it, best=0.897][A[I 2026-02-28 01:52:48,127] Trial 155 finished with value: 0.9041796907802369 and parameters: {'activation': 'tanh', 'solver': 'adam', 'lr': 4.431378942522426e-05, 'layer1': 409, 'layer2': 461, 'layer3': 461}. Best is trial 130 with value: 0.9107197512148748.

Klebsiella_Pneumoniae | Ceftriaxone | Optuna:  78%|███████▊  | 156/200 [5:02:09<1:30:41, 123.67s/it, best=0.911][A
Klebsiella_Pneumoniae | Ceftriaxone | Optuna:  78%|███████▊  | 156/200 [5:02:09<1:30:41, 123.67s/it, best=0.911][A[I 2026-02-28 01:53:20,166] Trial 167 finished with value: 0.8560040094752551 and parameters: {'activation': 'logistic', 'solver': 'adam', 'lr': 0.00040169869041803077, 'layer1': 228, 'layer2': 38, 'layer3': 103}. Best is trial 156 with value: 0.8585541372555268.

Staphylococcus_Aureus | Clindamycin | Optuna:  84%|████████▍ | 168/200 [3:55:21<48:54, 91.71s/it, best=0.859][A
Staphylococcus_Aureus | Clindamycin | Optuna:  84%|████████▍ | 168/200 [3:55:21<48:54, 91.71s/it, best=0.859][A[I 2026-02-28 01:53:27,370] Trial 68 finished with value: 0.4508631451604434 and parameters: {'activation': 'relu', 'solver': 'sgd', 'lr': 1.544929010441065e-05, 'layer1': 483, 'layer2': 396, 'layer3': 10}. Best is trial 14 with value: 0.8971256036318559.

Escherichia_Coli | Ceftriaxone | Optuna:  34%|███▍      | 69/200 [2:43:28<4:40:15, 128.36s/it, best=0.897][A
Escherichia_Coli | Ceftriaxone | Optuna:  34%|███▍      | 69/200 [2:43:28<4:40:15, 128.36s/it, best=0.897][A[I 2026-02-28 01:53:28,505] Trial 190 finished with value: 0.8833040007239772 and parameters: {'activation': 'identity', 'solver': 'adam', 'lr': 0.0010020669401702685, 'layer1': 347, 'layer2': 224, 'layer3': 213}. Best is trial 73 with value: 0.8861579932511299.

Pseudomonas_Aeruginosa | Meropenem | Optuna:  96%|█████████▌| 191/200 [3:49:03<09:04, 60.55s/it, best=0.886][A
Pseudomonas_Aeruginosa | Meropenem | Optuna:  96%|█████████▌| 191/200 [3:49:03<09:04, 60.55s/it, best=0.886][A[I 2026-02-28 01:53:43,607] Trial 168 finished with value: 0.7888558471217525 and parameters: {'activation': 'logistic', 'solver': 'sgd', 'lr': 0.00036959016344366435, 'layer1': 225, 'layer2': 37, 'layer3': 123}. Best is trial 156 with value: 0.8585541372555268.

Staphylococcus_Aureus | Clindamycin | Optuna:  84%|████████▍ | 169/200 [3:55:45<36:48, 71.23s/it, best=0.859][A
Staphylococcus_Aureus | Clindamycin | Optuna:  84%|████████▍ | 169/200 [3:55:45<36:48, 71.23s/it, best=0.859][A[I 2026-02-28 01:54:25,682] Trial 69 finished with value: 0.7107931486967348 and parameters: {'activation': 'logistic', 'solver': 'adam', 'lr': 3.173733166392647e-05, 'layer1': 499, 'layer2': 332, 'layer3': 27}. Best is trial 14 with value: 0.8971256036318559.

Escherichia_Coli | Ceftriaxone | Optuna:  35%|███▌      | 70/200 [2:44:27<3:52:35, 107.35s/it, best=0.897][A
Escherichia_Coli | Ceftriaxone | Optuna:  35%|███▌      | 70/200 [2:44:27<3:52:35, 107.35s/it, best=0.897][A[I 2026-02-28 01:54:35,058] Trial 191 finished with value: 0.8829436997975264 and parameters: {'activation': 'identity', 'solver': 'adam', 'lr': 0.0007446276677424506, 'layer1': 126, 'layer2': 248, 'layer3': 438}. Best is trial 73 with value: 0.8861579932511299.

Pseudomonas_Aeruginosa | Meropenem | Optuna:  96%|█████████▌| 192/200 [3:50:10<08:18, 62.35s/it, best=0.886][A
Pseudomonas_Aeruginosa | Meropenem | Optuna:  96%|█████████▌| 192/200 [3:50:10<08:18, 62.35s/it, best=0.886][A[I 2026-02-28 01:54:38,970] Trial 156 finished with value: 0.9067011400236364 and parameters: {'activation': 'tanh', 'solver': 'adam', 'lr': 2.5848054224487758e-05, 'layer1': 374, 'layer2': 414, 'layer3': 478}. Best is trial 130 with value: 0.9107197512148748.

Klebsiella_Pneumoniae | Ceftriaxone | Optuna:  78%|███████▊  | 157/200 [5:04:00<1:25:52, 119.82s/it, best=0.911][A
Klebsiella_Pneumoniae | Ceftriaxone | Optuna:  78%|███████▊  | 157/200 [5:04:00<1:25:52, 119.82s/it, best=0.911][A[I 2026-02-28 01:56:01,717] Trial 169 finished with value: 0.8483092228204416 and parameters: {'activation': 'identity', 'solver': 'adam', 'lr': 0.0004162497928004195, 'layer1': 215, 'layer2': 17, 'layer3': 110}. Best is trial 156 with value: 0.8585541372555268.

Staphylococcus_Aureus | Clindamycin | Optuna:  85%|████████▌ | 170/200 [3:58:03<45:38, 91.29s/it, best=0.859][A
Staphylococcus_Aureus | Clindamycin | Optuna:  85%|████████▌ | 170/200 [3:58:03<45:38, 91.29s/it, best=0.859][A[I 2026-02-28 01:56:03,415] Trial 192 finished with value: 0.8830410411305252 and parameters: {'activation': 'identity', 'solver': 'adam', 'lr': 7.794585971191719e-05, 'layer1': 371, 'layer2': 307, 'layer3': 466}. Best is trial 73 with value: 0.8861579932511299.

Pseudomonas_Aeruginosa | Meropenem | Optuna:  96%|█████████▋| 193/200 [3:51:38<08:11, 70.15s/it, best=0.886][A
Pseudomonas_Aeruginosa | Meropenem | Optuna:  96%|█████████▋| 193/200 [3:51:38<08:11, 70.15s/it, best=0.886][A[I 2026-02-28 01:56:55,090] Trial 170 finished with value: 0.8152090858341626 and parameters: {'activation': 'logistic', 'solver': 'adam', 'lr': 0.0003123040806891774, 'layer1': 261, 'layer2': 31, 'layer3': 101}. Best is trial 156 with value: 0.8585541372555268.

Staphylococcus_Aureus | Clindamycin | Optuna:  86%|████████▌ | 171/200 [3:58:56<38:37, 79.92s/it, best=0.859][A
Staphylococcus_Aureus | Clindamycin | Optuna:  86%|████████▌ | 171/200 [3:58:56<38:37, 79.92s/it, best=0.859][A[I 2026-02-28 01:57:18,190] Trial 193 finished with value: 0.8798653151070613 and parameters: {'activation': 'identity', 'solver': 'adam', 'lr': 0.00014075543595565618, 'layer1': 381, 'layer2': 145, 'layer3': 255}. Best is trial 73 with value: 0.8861579932511299.

Pseudomonas_Aeruginosa | Meropenem | Optuna:  97%|█████████▋| 194/200 [3:52:53<07:09, 71.54s/it, best=0.886][A
Pseudomonas_Aeruginosa | Meropenem | Optuna:  97%|█████████▋| 194/200 [3:52:53<07:09, 71.54s/it, best=0.886][A[I 2026-02-28 01:57:19,830] Trial 157 finished with value: 0.9048259361398033 and parameters: {'activation': 'relu', 'solver': 'adam', 'lr': 3.371732464232905e-05, 'layer1': 286, 'layer2': 428, 'layer3': 451}. Best is trial 130 with value: 0.9107197512148748.

Klebsiella_Pneumoniae | Ceftriaxone | Optuna:  79%|███████▉  | 158/200 [5:06:41<1:32:29, 132.13s/it, best=0.911][A
Klebsiella_Pneumoniae | Ceftriaxone | Optuna:  79%|███████▉  | 158/200 [5:06:41<1:32:29, 132.13s/it, best=0.911][A[I 2026-02-28 01:57:58,085] Trial 70 finished with value: 0.8947064165452406 and parameters: {'activation': 'relu', 'solver': 'adam', 'lr': 2.5274175438434338e-05, 'layer1': 399, 'layer2': 369, 'layer3': 66}. Best is trial 14 with value: 0.8971256036318559.

Escherichia_Coli | Ceftriaxone | Optuna:  36%|███▌      | 71/200 [2:47:59<4:58:33, 138.86s/it, best=0.897][A
Escherichia_Coli | Ceftriaxone | Optuna:  36%|███▌      | 71/200 [2:47:59<4:58:33, 138.86s/it, best=0.897][A[I 2026-02-28 01:58:25,440] Trial 194 finished with value: 0.884680870348134 and parameters: {'activation': 'identity', 'solver': 'adam', 'lr': 0.0005319370352624789, 'layer1': 256, 'layer2': 272, 'layer3': 426}. Best is trial 73 with value: 0.8861579932511299.

Pseudomonas_Aeruginosa | Meropenem | Optuna:  98%|█████████▊| 195/200 [3:54:00<05:51, 70.25s/it, best=0.886][A
Pseudomonas_Aeruginosa | Meropenem | Optuna:  98%|█████████▊| 195/200 [3:54:00<05:51, 70.25s/it, best=0.886][A[I 2026-02-28 01:58:28,120] Trial 171 finished with value: 0.8511851708939071 and parameters: {'activation': 'logistic', 'solver': 'adam', 'lr': 0.0005201813739495699, 'layer1': 273, 'layer2': 47, 'layer3': 94}. Best is trial 156 with value: 0.8585541372555268.

Staphylococcus_Aureus | Clindamycin | Optuna:  86%|████████▌ | 172/200 [4:00:29<39:07, 83.85s/it, best=0.859][A
Staphylococcus_Aureus | Clindamycin | Optuna:  86%|████████▌ | 172/200 [4:00:29<39:07, 83.85s/it, best=0.859][A[I 2026-02-28 01:59:23,042] Trial 195 finished with value: 0.8839915964957331 and parameters: {'activation': 'identity', 'solver': 'adam', 'lr': 0.00048013116247655344, 'layer1': 194, 'layer2': 268, 'layer3': 428}. Best is trial 73 with value: 0.8861579932511299.

Pseudomonas_Aeruginosa | Meropenem | Optuna:  98%|█████████▊| 196/200 [3:54:58<04:25, 66.46s/it, best=0.886][A
Pseudomonas_Aeruginosa | Meropenem | Optuna:  98%|█████████▊| 196/200 [3:54:58<04:25, 66.46s/it, best=0.886][A[I 2026-02-28 02:00:05,993] Trial 172 finished with value: 0.8517056846349146 and parameters: {'activation': 'logistic', 'solver': 'adam', 'lr': 0.0008766209218825302, 'layer1': 238, 'layer2': 56, 'layer3': 70}. Best is trial 156 with value: 0.8585541372555268.

Staphylococcus_Aureus | Clindamycin | Optuna:  86%|████████▋ | 173/200 [4:02:07<39:37, 88.06s/it, best=0.859][A
Staphylococcus_Aureus | Clindamycin | Optuna:  86%|████████▋ | 173/200 [4:02:07<39:37, 88.06s/it, best=0.859][A[I 2026-02-28 02:00:31,341] Trial 158 finished with value: 0.9051044212113011 and parameters: {'activation': 'tanh', 'solver': 'adam', 'lr': 8.86046319767987e-06, 'layer1': 315, 'layer2': 290, 'layer3': 470}. Best is trial 130 with value: 0.9107197512148748.

Klebsiella_Pneumoniae | Ceftriaxone | Optuna:  80%|███████▉  | 159/200 [5:09:52<1:42:27, 149.95s/it, best=0.911][A
Klebsiella_Pneumoniae | Ceftriaxone | Optuna:  80%|███████▉  | 159/200 [5:09:52<1:42:27, 149.95s/it, best=0.911][A[I 2026-02-28 02:00:33,259] Trial 196 finished with value: 0.882480506982098 and parameters: {'activation': 'identity', 'solver': 'adam', 'lr': 0.0003896746009853279, 'layer1': 246, 'layer2': 464, 'layer3': 447}. Best is trial 73 with value: 0.8861579932511299.

Pseudomonas_Aeruginosa | Meropenem | Optuna:  98%|█████████▊| 197/200 [3:56:08<03:22, 67.59s/it, best=0.886][A
Pseudomonas_Aeruginosa | Meropenem | Optuna:  98%|█████████▊| 197/200 [3:56:08<03:22, 67.59s/it, best=0.886][A[I 2026-02-28 02:00:47,154] Trial 71 finished with value: 0.8947186354721891 and parameters: {'activation': 'relu', 'solver': 'adam', 'lr': 6.66723747225679e-05, 'layer1': 467, 'layer2': 282, 'layer3': 42}. Best is trial 14 with value: 0.8971256036318559.

Escherichia_Coli | Ceftriaxone | Optuna:  36%|███▌      | 72/200 [2:50:48<5:15:34, 147.93s/it, best=0.897][A
Escherichia_Coli | Ceftriaxone | Optuna:  36%|███▌      | 72/200 [2:50:48<5:15:34, 147.93s/it, best=0.897][A[I 2026-02-28 02:01:53,391] Trial 197 finished with value: 0.882736081483251 and parameters: {'activation': 'identity', 'solver': 'adam', 'lr': 0.0005628511012315612, 'layer1': 264, 'layer2': 489, 'layer3': 458}. Best is trial 73 with value: 0.8861579932511299.

Pseudomonas_Aeruginosa | Meropenem | Optuna:  99%|█████████▉| 198/200 [3:57:28<02:22, 71.35s/it, best=0.886][A
Pseudomonas_Aeruginosa | Meropenem | Optuna:  99%|█████████▉| 198/200 [3:57:28<02:22, 71.35s/it, best=0.886][A[I 2026-02-28 02:02:04,064] Trial 173 finished with value: 0.8574798450109486 and parameters: {'activation': 'logistic', 'solver': 'adam', 'lr': 0.0005947868822310135, 'layer1': 228, 'layer2': 65, 'layer3': 80}. Best is trial 156 with value: 0.8585541372555268.

Staphylococcus_Aureus | Clindamycin | Optuna:  87%|████████▋ | 174/200 [4:04:05<42:03, 97.06s/it, best=0.859][A
Staphylococcus_Aureus | Clindamycin | Optuna:  87%|████████▋ | 174/200 [4:04:05<42:03, 97.06s/it, best=0.859][A[I 2026-02-28 02:02:35,002] Trial 174 finished with value: 0.7888558471217525 and parameters: {'activation': 'logistic', 'solver': 'adam', 'lr': 7.422606186523002e-05, 'layer1': 256, 'layer2': 68, 'layer3': 62}. Best is trial 156 with value: 0.8585541372555268.

Staphylococcus_Aureus | Clindamycin | Optuna:  88%|████████▊ | 175/200 [4:04:36<32:10, 77.22s/it, best=0.859][A
Staphylococcus_Aureus | Clindamycin | Optuna:  88%|████████▊ | 175/200 [4:04:36<32:10, 77.22s/it, best=0.859][A[I 2026-02-28 02:03:15,166] Trial 159 finished with value: 0.9053873526433298 and parameters: {'activation': 'tanh', 'solver': 'adam', 'lr': 1.235738574472636e-05, 'layer1': 423, 'layer2': 437, 'layer3': 435}. Best is trial 130 with value: 0.9107197512148748.

Klebsiella_Pneumoniae | Ceftriaxone | Optuna:  80%|████████  | 160/200 [5:12:36<1:42:44, 154.11s/it, best=0.911][A
Klebsiella_Pneumoniae | Ceftriaxone | Optuna:  80%|████████  | 160/200 [5:12:36<1:42:44, 154.11s/it, best=0.911][A[I 2026-02-28 02:03:26,019] Trial 198 finished with value: 0.8838761661121366 and parameters: {'activation': 'identity', 'solver': 'adam', 'lr': 0.00080786449343498, 'layer1': 485, 'layer2': 256, 'layer3': 223}. Best is trial 73 with value: 0.8861579932511299.

Pseudomonas_Aeruginosa | Meropenem | Optuna: 100%|█████████▉| 199/200 [3:59:01<01:17, 77.73s/it, best=0.886][A
Pseudomonas_Aeruginosa | Meropenem | Optuna: 100%|█████████▉| 199/200 [3:59:01<01:17, 77.73s/it, best=0.886][A[I 2026-02-28 02:03:50,830] Trial 72 finished with value: 0.8949752170836188 and parameters: {'activation': 'relu', 'solver': 'adam', 'lr': 3.977172161879679e-05, 'layer1': 444, 'layer2': 300, 'layer3': 85}. Best is trial 14 with value: 0.8971256036318559.

Escherichia_Coli | Ceftriaxone | Optuna:  36%|███▋      | 73/200 [2:53:52<5:35:48, 158.65s/it, best=0.897][A
Escherichia_Coli | Ceftriaxone | Optuna:  36%|███▋      | 73/200 [2:53:52<5:35:48, 158.65s/it, best=0.897][A[I 2026-02-28 02:04:24,238] Trial 175 finished with value: 0.8539680352468391 and parameters: {'activation': 'logistic', 'solver': 'adam', 'lr': 0.00041782648105798576, 'layer1': 231, 'layer2': 39, 'layer3': 135}. Best is trial 156 with value: 0.8585541372555268.

Staphylococcus_Aureus | Clindamycin | Optuna:  88%|████████▊ | 176/200 [4:06:25<34:43, 86.83s/it, best=0.859][A
Staphylococcus_Aureus | Clindamycin | Optuna:  88%|████████▊ | 176/200 [4:06:25<34:43, 86.83s/it, best=0.859][A[I 2026-02-28 02:04:37,084] Trial 199 finished with value: 0.8846772968385773 and parameters: {'activation': 'identity', 'solver': 'adam', 'lr': 0.0009644612168455967, 'layer1': 261, 'layer2': 377, 'layer3': 434}. Best is trial 73 with value: 0.8861579932511299.

Pseudomonas_Aeruginosa | Meropenem | Optuna: 100%|██████████| 200/200 [4:00:12<00:00, 75.73s/it, best=0.886][A
Pseudomonas_Aeruginosa | Meropenem | Optuna: 100%|██████████| 200/200 [4:00:12<00:00, 75.73s/it, best=0.886][A
                                                                                                            [A[Pseudomonas_Aeruginosa | Meropenem] [OPTUNA DONE] Best CV WF1=0.8862 | params={'activation': 'identity', 'solver': 'adam', 'lr': 0.0009126863395755617, 'layer1': 376, 'layer2': 186, 'layer3': 487}
[Pseudomonas_Aeruginosa | Meropenem] Retraining with validation early stopping (10% split)...
[Pseudomonas_Aeruginosa | Meropenem] [TEST] WF1=0.8501 | ACC=0.8786 | HL=0.1214 | best_val_WF1=0.9062
Pseudomonas_Aeruginosa | Binary antibiotics: 100%|██████████| 3/3 [11:17:27<00:00, 13677.37s/it] Pseudomonas_Aeruginosa | Binary antibiotics: 100%|██████████| 3/3 [11:17:27<00:00, 13549.21s/it]

[Pseudomonas_Aeruginosa] ===== LPS multiclass training (patterns) =====
[Pseudomonas_Aeruginosa] LPS classes (patterns) on train: 7
[I 2026-02-28 02:04:57,947] A new study created in memory with name: no-name-e0fe22cc-b931-4ca8-82c0-acae2970e4e5
Pseudomonas_Aeruginosa | LPS | Optuna:   0%|          | 0/200 [00:00<?, ?it/s]/export/usuarios01/egarroyo/MALDI_for_AMR_prediction/venv/lib/python3.13/site-packages/sklearn/model_selection/_split.py:813: UserWarning: The least populated class in y has only 4 members, which is less than n_splits=5.
  warnings.warn(
[I 2026-02-28 02:05:22,527] Trial 0 finished with value: 0.6677551203935375 and parameters: {'activation': 'logistic', 'solver': 'sgd', 'lr': 1.7073967431528114e-06, 'layer1': 435, 'layer2': 305, 'layer3': 357}. Best is trial 0 with value: 0.6677551203935375.
Pseudomonas_Aeruginosa | LPS | Optuna:   0%|          | 1/200 [00:24<1:21:31, 24.58s/it]Pseudomonas_Aeruginosa | LPS | Optuna:   0%|          | 1/200 [00:24<1:21:31, 24.58s/it, best=0.668]/export/usuarios01/egarroyo/MALDI_for_AMR_prediction/venv/lib/python3.13/site-packages/sklearn/model_selection/_split.py:813: UserWarning: The least populated class in y has only 4 members, which is less than n_splits=5.
  warnings.warn(
[I 2026-02-28 02:05:28,008] Trial 176 finished with value: 0.8485692922388784 and parameters: {'activation': 'tanh', 'solver': 'adam', 'lr': 0.000463028507403932, 'layer1': 244, 'layer2': 27, 'layer3': 48}. Best is trial 156 with value: 0.8585541372555268.

Staphylococcus_Aureus | Clindamycin | Optuna:  88%|████████▊ | 177/200 [4:07:29<30:37, 79.91s/it, best=0.859][A
Staphylococcus_Aureus | Clindamycin | Optuna:  88%|████████▊ | 177/200 [4:07:29<30:37, 79.91s/it, best=0.859][A[I 2026-02-28 02:05:28,596] Trial 160 finished with value: 0.9058173398674082 and parameters: {'activation': 'tanh', 'solver': 'adam', 'lr': 2.1898250469135415e-05, 'layer1': 301, 'layer2': 482, 'layer3': 495}. Best is trial 130 with value: 0.9107197512148748.

Klebsiella_Pneumoniae | Ceftriaxone | Optuna:  80%|████████  | 161/200 [5:14:50<1:36:08, 147.91s/it, best=0.911][A
Klebsiella_Pneumoniae | Ceftriaxone | Optuna:  80%|████████  | 161/200 [5:14:50<1:36:08, 147.91s/it, best=0.911][A[I 2026-02-28 02:05:51,100] Trial 1 finished with value: 0.8263598388004697 and parameters: {'activation': 'logistic', 'solver': 'adam', 'lr': 1.6480446427978994e-05, 'layer1': 267, 'layer2': 222, 'layer3': 152}. Best is trial 1 with value: 0.8263598388004697.
Pseudomonas_Aeruginosa | LPS | Optuna:   1%|          | 2/200 [00:53<1:28:51, 26.93s/it, best=0.668]Pseudomonas_Aeruginosa | LPS | Optuna:   1%|          | 2/200 [00:53<1:28:51, 26.93s/it, best=0.826]/export/usuarios01/egarroyo/MALDI_for_AMR_prediction/venv/lib/python3.13/site-packages/sklearn/model_selection/_split.py:813: UserWarning: The least populated class in y has only 4 members, which is less than n_splits=5.
  warnings.warn(
[I 2026-02-28 02:06:11,321] Trial 73 finished with value: 0.8933913496964749 and parameters: {'activation': 'relu', 'solver': 'adam', 'lr': 9.858303403401499e-05, 'layer1': 474, 'layer2': 495, 'layer3': 25}. Best is trial 14 with value: 0.8971256036318559.

Escherichia_Coli | Ceftriaxone | Optuna:  37%|███▋      | 74/200 [2:56:12<5:21:43, 153.20s/it, best=0.897][A
Escherichia_Coli | Ceftriaxone | Optuna:  37%|███▋      | 74/200 [2:56:12<5:21:43, 153.20s/it, best=0.897][A[I 2026-02-28 02:07:21,932] Trial 177 finished with value: 0.8553239891719311 and parameters: {'activation': 'logistic', 'solver': 'adam', 'lr': 0.0005348780476333164, 'layer1': 223, 'layer2': 41, 'layer3': 78}. Best is trial 156 with value: 0.8585541372555268.

Staphylococcus_Aureus | Clindamycin | Optuna:  89%|████████▉ | 178/200 [4:09:23<33:02, 90.11s/it, best=0.859][A
Staphylococcus_Aureus | Clindamycin | Optuna:  89%|████████▉ | 178/200 [4:09:23<33:02, 90.11s/it, best=0.859][A[I 2026-02-28 02:07:43,238] Trial 2 finished with value: 0.8302838912374095 and parameters: {'activation': 'identity', 'solver': 'adam', 'lr': 6.290644294586145e-06, 'layer1': 262, 'layer2': 300, 'layer3': 32}. Best is trial 2 with value: 0.8302838912374095.
Pseudomonas_Aeruginosa | LPS | Optuna:   2%|▏         | 3/200 [02:45<3:36:09, 65.84s/it, best=0.826]Pseudomonas_Aeruginosa | LPS | Optuna:   2%|▏         | 3/200 [02:45<3:36:09, 65.84s/it, best=0.83] /export/usuarios01/egarroyo/MALDI_for_AMR_prediction/venv/lib/python3.13/site-packages/sklearn/model_selection/_split.py:813: UserWarning: The least populated class in y has only 4 members, which is less than n_splits=5.
  warnings.warn(
[I 2026-02-28 02:07:43,545] Trial 161 finished with value: 0.9084780576456779 and parameters: {'activation': 'tanh', 'solver': 'adam', 'lr': 1.967420192257622e-05, 'layer1': 261, 'layer2': 486, 'layer3': 417}. Best is trial 130 with value: 0.9107197512148748.

Klebsiella_Pneumoniae | Ceftriaxone | Optuna:  81%|████████  | 162/200 [5:17:05<1:31:12, 144.02s/it, best=0.911][A
Klebsiella_Pneumoniae | Ceftriaxone | Optuna:  81%|████████  | 162/200 [5:17:05<1:31:12, 144.02s/it, best=0.911][A[I 2026-02-28 02:08:17,331] Trial 74 finished with value: 0.8944147780683709 and parameters: {'activation': 'relu', 'solver': 'adam', 'lr': 0.0001676386168821652, 'layer1': 459, 'layer2': 176, 'layer3': 104}. Best is trial 14 with value: 0.8971256036318559.

Escherichia_Coli | Ceftriaxone | Optuna:  38%|███▊      | 75/200 [2:58:18<5:02:10, 145.05s/it, best=0.897][A
Escherichia_Coli | Ceftriaxone | Optuna:  38%|███▊      | 75/200 [2:58:18<5:02:10, 145.05s/it, best=0.897][A[I 2026-02-28 02:08:27,902] Trial 3 finished with value: 0.6538675092557326 and parameters: {'activation': 'relu', 'solver': 'sgd', 'lr': 1.6536937182824424e-05, 'layer1': 57, 'layer2': 345, 'layer3': 226}. Best is trial 2 with value: 0.8302838912374095.
Pseudomonas_Aeruginosa | LPS | Optuna:   2%|▏         | 4/200 [03:29<3:07:45, 57.48s/it, best=0.83]Pseudomonas_Aeruginosa | LPS | Optuna:   2%|▏         | 4/200 [03:29<3:07:45, 57.48s/it, best=0.83]/export/usuarios01/egarroyo/MALDI_for_AMR_prediction/venv/lib/python3.13/site-packages/sklearn/model_selection/_split.py:813: UserWarning: The least populated class in y has only 4 members, which is less than n_splits=5.
  warnings.warn(
[I 2026-02-28 02:09:02,186] Trial 4 finished with value: 0.8262838458259365 and parameters: {'activation': 'relu', 'solver': 'adam', 'lr': 1.7654048052495086e-05, 'layer1': 265, 'layer2': 278, 'layer3': 100}. Best is trial 2 with value: 0.8302838912374095.
Pseudomonas_Aeruginosa | LPS | Optuna:   2%|▎         | 5/200 [04:04<2:39:37, 49.11s/it, best=0.83]Pseudomonas_Aeruginosa | LPS | Optuna:   2%|▎         | 5/200 [04:04<2:39:37, 49.11s/it, best=0.83]/export/usuarios01/egarroyo/MALDI_for_AMR_prediction/venv/lib/python3.13/site-packages/sklearn/model_selection/_split.py:813: UserWarning: The least populated class in y has only 4 members, which is less than n_splits=5.
  warnings.warn(
