Klebsiella_Pneumoniae | Imipenem | Optuna:  39%|███▉      | 78/200 [1:04:45<1:38:26, 48.42s/it, best=0.986][A[I 2026-02-28 04:34:13,814] Trial 100 finished with value: 0.862784994730063 and parameters: {'activation': 'relu', 'solver': 'adam', 'lr': 0.00029887789637135005, 'layer1': 387, 'layer2': 301, 'layer3': 397}. Best is trial 63 with value: 0.8682133709784562.
Pseudomonas_Aeruginosa | LPS | Optuna:  50%|█████     | 101/200 [2:29:15<2:28:05, 89.76s/it, best=0.868]Pseudomonas_Aeruginosa | LPS | Optuna:  50%|█████     | 101/200 [2:29:15<2:28:05, 89.76s/it, best=0.868]/export/usuarios01/egarroyo/MALDI_for_AMR_prediction/venv/lib/python3.13/site-packages/sklearn/model_selection/_split.py:813: UserWarning: The least populated class in y has only 4 members, which is less than n_splits=5.
  warnings.warn(
[I 2026-02-28 04:34:14,730] Trial 78 finished with value: 0.9843755840386772 and parameters: {'activation': 'relu', 'solver': 'adam', 'lr': 0.0011204039650593162, 'layer1': 22, 'layer2': 142, 'layer3': 446}. Best is trial 13 with value: 0.9860492846658779.

Klebsiella_Pneumoniae | Imipenem | Optuna:  40%|███▉      | 79/200 [1:05:27<1:33:45, 46.50s/it, best=0.986][A
Klebsiella_Pneumoniae | Imipenem | Optuna:  40%|███▉      | 79/200 [1:05:27<1:33:45, 46.50s/it, best=0.986][A[I 2026-02-28 04:34:28,322] Trial 67 finished with value: 0.9266139108350673 and parameters: {'activation': 'identity', 'solver': 'adam', 'lr': 0.0001872279996059235, 'layer1': 489, 'layer2': 435, 'layer3': 213}. Best is trial 20 with value: 0.9283335834984147.

Staphylococcus_Aureus | Fusidic acid | Optuna:  34%|███▍      | 68/200 [1:53:37<4:12:49, 114.92s/it, best=0.928][A
Staphylococcus_Aureus | Fusidic acid | Optuna:  34%|███▍      | 68/200 [1:53:37<4:12:49, 114.92s/it, best=0.928][A[I 2026-02-28 04:34:36,991] Trial 79 finished with value: 0.9800270054346416 and parameters: {'activation': 'relu', 'solver': 'sgd', 'lr': 0.005065549272554638, 'layer1': 164, 'layer2': 230, 'layer3': 236}. Best is trial 13 with value: 0.9860492846658779.

Klebsiella_Pneumoniae | Imipenem | Optuna:  40%|████      | 80/200 [1:05:49<1:18:27, 39.23s/it, best=0.986][A
Klebsiella_Pneumoniae | Imipenem | Optuna:  40%|████      | 80/200 [1:05:49<1:18:27, 39.23s/it, best=0.986][A[I 2026-02-28 04:35:13,608] Trial 80 finished with value: 0.9800270054346416 and parameters: {'activation': 'relu', 'solver': 'adam', 'lr': 1.1349347079155775e-05, 'layer1': 466, 'layer2': 206, 'layer3': 317}. Best is trial 13 with value: 0.9860492846658779.

Klebsiella_Pneumoniae | Imipenem | Optuna:  40%|████      | 81/200 [1:06:26<1:16:14, 38.44s/it, best=0.986][A
Klebsiella_Pneumoniae | Imipenem | Optuna:  40%|████      | 81/200 [1:06:26<1:16:14, 38.44s/it, best=0.986][A[I 2026-02-28 04:35:40,768] Trial 81 finished with value: 0.9819898047648248 and parameters: {'activation': 'relu', 'solver': 'adam', 'lr': 0.0010468100180598312, 'layer1': 100, 'layer2': 142, 'layer3': 448}. Best is trial 13 with value: 0.9860492846658779.

Klebsiella_Pneumoniae | Imipenem | Optuna:  41%|████      | 82/200 [1:06:53<1:08:56, 35.06s/it, best=0.986][A
Klebsiella_Pneumoniae | Imipenem | Optuna:  41%|████      | 82/200 [1:06:53<1:08:56, 35.06s/it, best=0.986][A[I 2026-02-28 04:36:10,019] Trial 82 finished with value: 0.9826556815912362 and parameters: {'activation': 'relu', 'solver': 'adam', 'lr': 0.0016948739059998216, 'layer1': 12, 'layer2': 127, 'layer3': 438}. Best is trial 13 with value: 0.9860492846658779.

Klebsiella_Pneumoniae | Imipenem | Optuna:  42%|████▏     | 83/200 [1:07:22<1:04:57, 33.32s/it, best=0.986][A
Klebsiella_Pneumoniae | Imipenem | Optuna:  42%|████▏     | 83/200 [1:07:22<1:04:57, 33.32s/it, best=0.986][A[I 2026-02-28 04:36:10,125] Trial 101 finished with value: 0.8659987187541326 and parameters: {'activation': 'identity', 'solver': 'adam', 'lr': 0.0023753406096849693, 'layer1': 286, 'layer2': 323, 'layer3': 475}. Best is trial 63 with value: 0.8682133709784562.
Pseudomonas_Aeruginosa | LPS | Optuna:  51%|█████     | 102/200 [2:31:12<2:39:36, 97.72s/it, best=0.868]Pseudomonas_Aeruginosa | LPS | Optuna:  51%|█████     | 102/200 [2:31:12<2:39:36, 97.72s/it, best=0.868]/export/usuarios01/egarroyo/MALDI_for_AMR_prediction/venv/lib/python3.13/site-packages/sklearn/model_selection/_split.py:813: UserWarning: The least populated class in y has only 4 members, which is less than n_splits=5.
  warnings.warn(
[I 2026-02-28 04:36:21,082] Trial 129 finished with value: 0.8949637107743879 and parameters: {'activation': 'relu', 'solver': 'adam', 'lr': 2.1804868371482505e-05, 'layer1': 447, 'layer2': 332, 'layer3': 78}. Best is trial 122 with value: 0.897309104499819.

Escherichia_Coli | Ceftriaxone | Optuna:  65%|██████▌   | 130/200 [5:26:22<3:54:12, 200.75s/it, best=0.897][A
Escherichia_Coli | Ceftriaxone | Optuna:  65%|██████▌   | 130/200 [5:26:22<3:54:12, 200.75s/it, best=0.897][A[I 2026-02-28 04:36:35,095] Trial 68 finished with value: 0.9048558056654221 and parameters: {'activation': 'identity', 'solver': 'sgd', 'lr': 0.00010871360965337202, 'layer1': 427, 'layer2': 135, 'layer3': 61}. Best is trial 20 with value: 0.9283335834984147.

Staphylococcus_Aureus | Fusidic acid | Optuna:  34%|███▍      | 69/200 [1:55:44<4:18:40, 118.48s/it, best=0.928][A
Staphylococcus_Aureus | Fusidic acid | Optuna:  34%|███▍      | 69/200 [1:55:44<4:18:40, 118.48s/it, best=0.928][A[I 2026-02-28 04:36:37,413] Trial 83 finished with value: 0.9836392608886904 and parameters: {'activation': 'relu', 'solver': 'adam', 'lr': 0.002866709752497144, 'layer1': 25, 'layer2': 16, 'layer3': 486}. Best is trial 13 with value: 0.9860492846658779.

Klebsiella_Pneumoniae | Imipenem | Optuna:  42%|████▏     | 84/200 [1:07:50<1:00:58, 31.54s/it, best=0.986][A
Klebsiella_Pneumoniae | Imipenem | Optuna:  42%|████▏     | 84/200 [1:07:50<1:00:58, 31.54s/it, best=0.986][A[I 2026-02-28 04:37:21,605] Trial 84 finished with value: 0.9843984797992616 and parameters: {'activation': 'relu', 'solver': 'adam', 'lr': 0.0021483939522770733, 'layer1': 52, 'layer2': 178, 'layer3': 465}. Best is trial 13 with value: 0.9860492846658779.

Klebsiella_Pneumoniae | Imipenem | Optuna:  42%|████▎     | 85/200 [1:08:34<1:07:43, 35.34s/it, best=0.986][A
Klebsiella_Pneumoniae | Imipenem | Optuna:  42%|████▎     | 85/200 [1:08:34<1:07:43, 35.34s/it, best=0.986][A[I 2026-02-28 04:37:45,483] Trial 85 finished with value: 0.9800270054346416 and parameters: {'activation': 'tanh', 'solver': 'adam', 'lr': 0.007760438822951595, 'layer1': 92, 'layer2': 107, 'layer3': 462}. Best is trial 13 with value: 0.9860492846658779.

Klebsiella_Pneumoniae | Imipenem | Optuna:  43%|████▎     | 86/200 [1:08:58<1:00:36, 31.90s/it, best=0.986][A
Klebsiella_Pneumoniae | Imipenem | Optuna:  43%|████▎     | 86/200 [1:08:58<1:00:36, 31.90s/it, best=0.986][A[I 2026-02-28 04:37:46,097] Trial 102 finished with value: 0.8623377640400081 and parameters: {'activation': 'identity', 'solver': 'adam', 'lr': 0.0007755586822894495, 'layer1': 286, 'layer2': 337, 'layer3': 494}. Best is trial 63 with value: 0.8682133709784562.
Pseudomonas_Aeruginosa | LPS | Optuna:  52%|█████▏    | 103/200 [2:32:48<2:37:08, 97.20s/it, best=0.868]Pseudomonas_Aeruginosa | LPS | Optuna:  52%|█████▏    | 103/200 [2:32:48<2:37:08, 97.20s/it, best=0.868]/export/usuarios01/egarroyo/MALDI_for_AMR_prediction/venv/lib/python3.13/site-packages/sklearn/model_selection/_split.py:813: UserWarning: The least populated class in y has only 4 members, which is less than n_splits=5.
  warnings.warn(
[I 2026-02-28 04:37:58,788] Trial 69 finished with value: 0.9127047861283138 and parameters: {'activation': 'tanh', 'solver': 'adam', 'lr': 0.0017392469954965767, 'layer1': 359, 'layer2': 465, 'layer3': 166}. Best is trial 20 with value: 0.9283335834984147.

Staphylococcus_Aureus | Fusidic acid | Optuna:  35%|███▌      | 70/200 [1:57:07<3:54:05, 108.04s/it, best=0.928][A
Staphylococcus_Aureus | Fusidic acid | Optuna:  35%|███▌      | 70/200 [1:57:07<3:54:05, 108.04s/it, best=0.928][A[I 2026-02-28 04:38:33,169] Trial 86 finished with value: 0.9841135825632781 and parameters: {'activation': 'relu', 'solver': 'adam', 'lr': 0.003373173021383921, 'layer1': 43, 'layer2': 171, 'layer3': 500}. Best is trial 13 with value: 0.9860492846658779.

Klebsiella_Pneumoniae | Imipenem | Optuna:  44%|████▎     | 87/200 [1:09:45<1:08:59, 36.63s/it, best=0.986][A
Klebsiella_Pneumoniae | Imipenem | Optuna:  44%|████▎     | 87/200 [1:09:45<1:08:59, 36.63s/it, best=0.986][A[I 2026-02-28 04:39:04,287] Trial 130 finished with value: 0.8934591755707528 and parameters: {'activation': 'relu', 'solver': 'adam', 'lr': 8.109527137147932e-05, 'layer1': 469, 'layer2': 292, 'layer3': 64}. Best is trial 122 with value: 0.897309104499819.

Escherichia_Coli | Ceftriaxone | Optuna:  66%|██████▌   | 131/200 [5:29:05<3:37:54, 189.49s/it, best=0.897][A
Escherichia_Coli | Ceftriaxone | Optuna:  66%|██████▌   | 131/200 [5:29:05<3:37:54, 189.49s/it, best=0.897][A[I 2026-02-28 04:39:19,994] Trial 87 finished with value: 0.9856783887979242 and parameters: {'activation': 'relu', 'solver': 'adam', 'lr': 0.002149744251193036, 'layer1': 144, 'layer2': 187, 'layer3': 372}. Best is trial 13 with value: 0.9860492846658779.

Klebsiella_Pneumoniae | Imipenem | Optuna:  44%|████▍     | 88/200 [1:10:32<1:14:05, 39.69s/it, best=0.986][A
Klebsiella_Pneumoniae | Imipenem | Optuna:  44%|████▍     | 88/200 [1:10:32<1:14:05, 39.69s/it, best=0.986][A[I 2026-02-28 04:39:34,452] Trial 70 finished with value: 0.9258657524684564 and parameters: {'activation': 'identity', 'solver': 'adam', 'lr': 0.0005570326250947896, 'layer1': 464, 'layer2': 223, 'layer3': 97}. Best is trial 20 with value: 0.9283335834984147.

Staphylococcus_Aureus | Fusidic acid | Optuna:  36%|███▌      | 71/200 [1:58:43<3:44:18, 104.33s/it, best=0.928][A
Staphylococcus_Aureus | Fusidic acid | Optuna:  36%|███▌      | 71/200 [1:58:43<3:44:18, 104.33s/it, best=0.928][A[I 2026-02-28 04:39:54,734] Trial 103 finished with value: 0.866050589258009 and parameters: {'activation': 'identity', 'solver': 'adam', 'lr': 0.0026674916916788953, 'layer1': 406, 'layer2': 488, 'layer3': 476}. Best is trial 63 with value: 0.8682133709784562.
Pseudomonas_Aeruginosa | LPS | Optuna:  52%|█████▏    | 104/200 [2:34:56<2:50:36, 106.63s/it, best=0.868]Pseudomonas_Aeruginosa | LPS | Optuna:  52%|█████▏    | 104/200 [2:34:56<2:50:36, 106.63s/it, best=0.868]/export/usuarios01/egarroyo/MALDI_for_AMR_prediction/venv/lib/python3.13/site-packages/sklearn/model_selection/_split.py:813: UserWarning: The least populated class in y has only 4 members, which is less than n_splits=5.
  warnings.warn(
[I 2026-02-28 04:40:03,709] Trial 88 finished with value: 0.98501767773522 and parameters: {'activation': 'relu', 'solver': 'adam', 'lr': 0.002360882089821893, 'layer1': 143, 'layer2': 221, 'layer3': 394}. Best is trial 13 with value: 0.9860492846658779.

Klebsiella_Pneumoniae | Imipenem | Optuna:  44%|████▍     | 89/200 [1:11:16<1:15:39, 40.90s/it, best=0.986][A
Klebsiella_Pneumoniae | Imipenem | Optuna:  44%|████▍     | 89/200 [1:11:16<1:15:39, 40.90s/it, best=0.986][A[I 2026-02-28 04:40:40,038] Trial 89 finished with value: 0.9810084050997332 and parameters: {'activation': 'logistic', 'solver': 'adam', 'lr': 0.0037797549607230777, 'layer1': 196, 'layer2': 221, 'layer3': 213}. Best is trial 13 with value: 0.9860492846658779.

Klebsiella_Pneumoniae | Imipenem | Optuna:  45%|████▌     | 90/200 [1:11:52<1:12:28, 39.53s/it, best=0.986][A
Klebsiella_Pneumoniae | Imipenem | Optuna:  45%|████▌     | 90/200 [1:11:52<1:12:28, 39.53s/it, best=0.986][A[I 2026-02-28 04:41:09,891] Trial 71 finished with value: 0.9208883646396199 and parameters: {'activation': 'identity', 'solver': 'adam', 'lr': 0.0009142043565270085, 'layer1': 440, 'layer2': 275, 'layer3': 258}. Best is trial 20 with value: 0.9283335834984147.

Staphylococcus_Aureus | Fusidic acid | Optuna:  36%|███▌      | 72/200 [2:00:19<3:36:52, 101.66s/it, best=0.928][A
Staphylococcus_Aureus | Fusidic acid | Optuna:  36%|███▌      | 72/200 [2:00:19<3:36:52, 101.66s/it, best=0.928][A[I 2026-02-28 04:41:15,760] Trial 104 finished with value: 0.8623882508450643 and parameters: {'activation': 'identity', 'solver': 'adam', 'lr': 0.003528848397699403, 'layer1': 133, 'layer2': 490, 'layer3': 476}. Best is trial 63 with value: 0.8682133709784562.
Pseudomonas_Aeruginosa | LPS | Optuna:  52%|█████▎    | 105/200 [2:36:17<2:36:40, 98.95s/it, best=0.868] Pseudomonas_Aeruginosa | LPS | Optuna:  52%|█████▎    | 105/200 [2:36:17<2:36:40, 98.95s/it, best=0.868]/export/usuarios01/egarroyo/MALDI_for_AMR_prediction/venv/lib/python3.13/site-packages/sklearn/model_selection/_split.py:813: UserWarning: The least populated class in y has only 4 members, which is less than n_splits=5.
  warnings.warn(
[I 2026-02-28 04:41:33,543] Trial 90 finished with value: 0.9835191730113788 and parameters: {'activation': 'relu', 'solver': 'adam', 'lr': 0.0018202623042775804, 'layer1': 144, 'layer2': 461, 'layer3': 398}. Best is trial 13 with value: 0.9860492846658779.

Klebsiella_Pneumoniae | Imipenem | Optuna:  46%|████▌     | 91/200 [1:12:46<1:19:25, 43.72s/it, best=0.986][A
Klebsiella_Pneumoniae | Imipenem | Optuna:  46%|████▌     | 91/200 [1:12:46<1:19:25, 43.72s/it, best=0.986][A[I 2026-02-28 04:41:49,955] Trial 131 finished with value: 0.8965544607457515 and parameters: {'activation': 'relu', 'solver': 'adam', 'lr': 0.00010267176355285108, 'layer1': 439, 'layer2': 344, 'layer3': 126}. Best is trial 122 with value: 0.897309104499819.

Escherichia_Coli | Ceftriaxone | Optuna:  66%|██████▌   | 132/200 [5:31:51<3:26:39, 182.34s/it, best=0.897][A
Escherichia_Coli | Ceftriaxone | Optuna:  66%|██████▌   | 132/200 [5:31:51<3:26:39, 182.34s/it, best=0.897][A[I 2026-02-28 04:42:32,082] Trial 91 finished with value: 0.9847001446792942 and parameters: {'activation': 'relu', 'solver': 'adam', 'lr': 0.002233628063452984, 'layer1': 175, 'layer2': 196, 'layer3': 385}. Best is trial 13 with value: 0.9860492846658779.

Klebsiella_Pneumoniae | Imipenem | Optuna:  46%|████▌     | 92/200 [1:13:44<1:26:41, 48.17s/it, best=0.986][A
Klebsiella_Pneumoniae | Imipenem | Optuna:  46%|████▌     | 92/200 [1:13:44<1:26:41, 48.17s/it, best=0.986][A[I 2026-02-28 04:43:09,313] Trial 92 finished with value: 0.9826556815912362 and parameters: {'activation': 'relu', 'solver': 'adam', 'lr': 0.002675692829091051, 'layer1': 124, 'layer2': 199, 'layer3': 370}. Best is trial 13 with value: 0.9860492846658779.

Klebsiella_Pneumoniae | Imipenem | Optuna:  46%|████▋     | 93/200 [1:14:21<1:20:02, 44.89s/it, best=0.986][A
Klebsiella_Pneumoniae | Imipenem | Optuna:  46%|████▋     | 93/200 [1:14:21<1:20:02, 44.89s/it, best=0.986][A[I 2026-02-28 04:43:23,959] Trial 72 finished with value: 0.9265832059639095 and parameters: {'activation': 'identity', 'solver': 'adam', 'lr': 0.0009041810030943385, 'layer1': 446, 'layer2': 451, 'layer3': 275}. Best is trial 20 with value: 0.9283335834984147.

Staphylococcus_Aureus | Fusidic acid | Optuna:  36%|███▋      | 73/200 [2:02:33<3:55:45, 111.38s/it, best=0.928][A
Staphylococcus_Aureus | Fusidic acid | Optuna:  36%|███▋      | 73/200 [2:02:33<3:55:45, 111.38s/it, best=0.928][A[I 2026-02-28 04:43:30,692] Trial 105 finished with value: 0.8640164404898751 and parameters: {'activation': 'identity', 'solver': 'adam', 'lr': 0.004856178688416035, 'layer1': 468, 'layer2': 354, 'layer3': 453}. Best is trial 63 with value: 0.8682133709784562.
Pseudomonas_Aeruginosa | LPS | Optuna:  53%|█████▎    | 106/200 [2:38:32<2:51:55, 109.74s/it, best=0.868]Pseudomonas_Aeruginosa | LPS | Optuna:  53%|█████▎    | 106/200 [2:38:32<2:51:55, 109.74s/it, best=0.868]/export/usuarios01/egarroyo/MALDI_for_AMR_prediction/venv/lib/python3.13/site-packages/sklearn/model_selection/_split.py:813: UserWarning: The least populated class in y has only 4 members, which is less than n_splits=5.
  warnings.warn(
[I 2026-02-28 04:43:49,893] Trial 93 finished with value: 0.983637081256328 and parameters: {'activation': 'relu', 'solver': 'adam', 'lr': 0.002119896275214186, 'layer1': 179, 'layer2': 212, 'layer3': 386}. Best is trial 13 with value: 0.9860492846658779.

Klebsiella_Pneumoniae | Imipenem | Optuna:  47%|████▋     | 94/200 [1:15:02<1:17:00, 43.59s/it, best=0.986][A
Klebsiella_Pneumoniae | Imipenem | Optuna:  47%|████▋     | 94/200 [1:15:02<1:17:00, 43.59s/it, best=0.986][A[I 2026-02-28 04:44:11,963] Trial 132 finished with value: 0.8938866429708774 and parameters: {'activation': 'relu', 'solver': 'adam', 'lr': 6.601870390116072e-05, 'layer1': 440, 'layer2': 356, 'layer3': 112}. Best is trial 122 with value: 0.897309104499819.

Escherichia_Coli | Ceftriaxone | Optuna:  66%|██████▋   | 133/200 [5:34:13<3:10:06, 170.24s/it, best=0.897][A
Escherichia_Coli | Ceftriaxone | Optuna:  66%|██████▋   | 133/200 [5:34:13<3:10:06, 170.24s/it, best=0.897][A[I 2026-02-28 04:44:20,697] Trial 94 finished with value: 0.9806907026286907 and parameters: {'activation': 'relu', 'solver': 'adam', 'lr': 0.00010806243302368888, 'layer1': 148, 'layer2': 188, 'layer3': 407}. Best is trial 13 with value: 0.9860492846658779.

Klebsiella_Pneumoniae | Imipenem | Optuna:  48%|████▊     | 95/200 [1:15:33<1:09:34, 39.76s/it, best=0.986][A
Klebsiella_Pneumoniae | Imipenem | Optuna:  48%|████▊     | 95/200 [1:15:33<1:09:34, 39.76s/it, best=0.986][A[I 2026-02-28 04:44:50,994] Trial 73 finished with value: 0.9221155537283432 and parameters: {'activation': 'identity', 'solver': 'adam', 'lr': 0.0014061112963992517, 'layer1': 406, 'layer2': 346, 'layer3': 300}. Best is trial 20 with value: 0.9283335834984147.

Staphylococcus_Aureus | Fusidic acid | Optuna:  37%|███▋      | 74/200 [2:04:00<3:38:33, 104.08s/it, best=0.928][A
Staphylococcus_Aureus | Fusidic acid | Optuna:  37%|███▋      | 74/200 [2:04:00<3:38:33, 104.08s/it, best=0.928][A[I 2026-02-28 04:45:00,992] Trial 106 finished with value: 0.8453294206334554 and parameters: {'activation': 'tanh', 'solver': 'adam', 'lr': 0.002390914443513534, 'layer1': 404, 'layer2': 365, 'layer3': 469}. Best is trial 63 with value: 0.8682133709784562.
Pseudomonas_Aeruginosa | LPS | Optuna:  54%|█████▎    | 107/200 [2:40:03<2:41:03, 103.91s/it, best=0.868]Pseudomonas_Aeruginosa | LPS | Optuna:  54%|█████▎    | 107/200 [2:40:03<2:41:03, 103.91s/it, best=0.868]/export/usuarios01/egarroyo/MALDI_for_AMR_prediction/venv/lib/python3.13/site-packages/sklearn/model_selection/_split.py:813: UserWarning: The least populated class in y has only 4 members, which is less than n_splits=5.
  warnings.warn(
[I 2026-02-28 04:45:03,286] Trial 95 finished with value: 0.9843489471798256 and parameters: {'activation': 'relu', 'solver': 'adam', 'lr': 0.001242622547181183, 'layer1': 143, 'layer2': 227, 'layer3': 363}. Best is trial 13 with value: 0.9860492846658779.

Klebsiella_Pneumoniae | Imipenem | Optuna:  48%|████▊     | 96/200 [1:16:15<1:10:23, 40.61s/it, best=0.986][A
Klebsiella_Pneumoniae | Imipenem | Optuna:  48%|████▊     | 96/200 [1:16:15<1:10:23, 40.61s/it, best=0.986][A[I 2026-02-28 04:45:31,413] Trial 96 finished with value: 0.9826556815912362 and parameters: {'activation': 'identity', 'solver': 'adam', 'lr': 0.0006002745127728835, 'layer1': 113, 'layer2': 245, 'layer3': 357}. Best is trial 13 with value: 0.9860492846658779.

Klebsiella_Pneumoniae | Imipenem | Optuna:  48%|████▊     | 97/200 [1:16:44<1:03:16, 36.86s/it, best=0.986][A
Klebsiella_Pneumoniae | Imipenem | Optuna:  48%|████▊     | 97/200 [1:16:44<1:03:16, 36.86s/it, best=0.986][A[I 2026-02-28 04:46:13,827] Trial 107 finished with value: 0.8660688919013397 and parameters: {'activation': 'identity', 'solver': 'adam', 'lr': 0.007677842080945938, 'layer1': 11, 'layer2': 317, 'layer3': 490}. Best is trial 63 with value: 0.8682133709784562.
Pseudomonas_Aeruginosa | LPS | Optuna:  54%|█████▍    | 108/200 [2:41:15<2:25:02, 94.59s/it, best=0.868] Pseudomonas_Aeruginosa | LPS | Optuna:  54%|█████▍    | 108/200 [2:41:15<2:25:02, 94.59s/it, best=0.868]/export/usuarios01/egarroyo/MALDI_for_AMR_prediction/venv/lib/python3.13/site-packages/sklearn/model_selection/_split.py:813: UserWarning: The least populated class in y has only 4 members, which is less than n_splits=5.
  warnings.warn(
[I 2026-02-28 04:46:14,962] Trial 97 finished with value: 0.9839569633597328 and parameters: {'activation': 'relu', 'solver': 'adam', 'lr': 0.004398942757844121, 'layer1': 177, 'layer2': 259, 'layer3': 331}. Best is trial 13 with value: 0.9860492846658779.

Klebsiella_Pneumoniae | Imipenem | Optuna:  49%|████▉     | 98/200 [1:17:27<1:06:04, 38.87s/it, best=0.986][A
Klebsiella_Pneumoniae | Imipenem | Optuna:  49%|████▉     | 98/200 [1:17:27<1:06:04, 38.87s/it, best=0.986][A[I 2026-02-28 04:46:26,770] Trial 74 finished with value: 0.9274732315817985 and parameters: {'activation': 'identity', 'solver': 'adam', 'lr': 0.0007422920716760656, 'layer1': 486, 'layer2': 118, 'layer3': 236}. Best is trial 20 with value: 0.9283335834984147.

Staphylococcus_Aureus | Fusidic acid | Optuna:  38%|███▊      | 75/200 [2:05:35<3:31:38, 101.59s/it, best=0.928][A
Staphylococcus_Aureus | Fusidic acid | Optuna:  38%|███▊      | 75/200 [2:05:35<3:31:38, 101.59s/it, best=0.928][A[I 2026-02-28 04:46:27,392] Trial 133 finished with value: 0.892934365462159 and parameters: {'activation': 'relu', 'solver': 'adam', 'lr': 0.00010835854351430677, 'layer1': 482, 'layer2': 322, 'layer3': 30}. Best is trial 122 with value: 0.897309104499819.

Escherichia_Coli | Ceftriaxone | Optuna:  67%|██████▋   | 134/200 [5:36:28<2:55:46, 159.80s/it, best=0.897][A
