Klebsiella_Pneumoniae | LPS | Optuna:  55%|█████▌    | 110/200 [2:47:38<2:01:01, 80.68s/it, best=0.926]Klebsiella_Pneumoniae | LPS | Optuna:  55%|█████▌    | 110/200 [2:47:38<2:01:01, 80.68s/it, best=0.926][I 2026-02-28 11:35:30,772] Trial 153 finished with value: 0.8615493053129771 and parameters: {'activation': 'identity', 'solver': 'adam', 'lr': 0.00017414830336541897, 'layer1': 389, 'layer2': 211, 'layer3': 134}. Best is trial 102 with value: 0.8672439264969375.
Pseudomonas_Aeruginosa | DirectMulti | Optuna:  77%|███████▋  | 154/200 [4:39:17<1:21:10, 105.89s/it, best=0.867]Pseudomonas_Aeruginosa | DirectMulti | Optuna:  77%|███████▋  | 154/200 [4:39:17<1:21:10, 105.89s/it, best=0.867]/export/usuarios01/egarroyo/MALDI_for_AMR_prediction/venv/lib/python3.13/site-packages/sklearn/model_selection/_split.py:813: UserWarning: The least populated class in y has only 4 members, which is less than n_splits=5.
  warnings.warn(
[I 2026-02-28 11:35:52,570] Trial 99 finished with value: 0.9105203426022455 and parameters: {'activation': 'relu', 'solver': 'adam', 'lr': 0.003036926665401719, 'layer1': 295, 'layer2': 367, 'layer3': 148}. Best is trial 74 with value: 0.9166002918687234.

Escherichia_Coli | Piperacillin-Tazobactam | Optuna:  50%|█████     | 100/200 [3:31:45<3:36:21, 129.81s/it, best=0.917][A
Escherichia_Coli | Piperacillin-Tazobactam | Optuna:  50%|█████     | 100/200 [3:31:45<3:36:21, 129.81s/it, best=0.917][A[I 2026-02-28 11:36:38,941] Trial 100 finished with value: 0.8964585902939358 and parameters: {'activation': 'relu', 'solver': 'sgd', 'lr': 0.00019566709694450877, 'layer1': 282, 'layer2': 283, 'layer3': 182}. Best is trial 74 with value: 0.9166002918687234.

Escherichia_Coli | Piperacillin-Tazobactam | Optuna:  50%|█████     | 101/200 [3:32:31<2:52:53, 104.78s/it, best=0.917][A
Escherichia_Coli | Piperacillin-Tazobactam | Optuna:  50%|█████     | 101/200 [3:32:31<2:52:53, 104.78s/it, best=0.917][A[I 2026-02-28 11:36:52,436] Trial 93 finished with value: 0.8350499351673666 and parameters: {'activation': 'identity', 'solver': 'adam', 'lr': 3.013779041432989e-06, 'layer1': 244, 'layer2': 123, 'layer3': 346}. Best is trial 8 with value: 0.8879562150966016.
Staphylococcus_Aureus | LPS | Optuna:  47%|████▋     | 94/200 [3:30:38<3:51:55, 131.28s/it, best=0.888]Staphylococcus_Aureus | LPS | Optuna:  47%|████▋     | 94/200 [3:30:38<3:51:55, 131.28s/it, best=0.888][I 2026-02-28 11:37:02,403] Trial 110 finished with value: 0.9234512301986401 and parameters: {'activation': 'identity', 'solver': 'adam', 'lr': 0.00042418552955057645, 'layer1': 402, 'layer2': 276, 'layer3': 60}. Best is trial 71 with value: 0.9257111996592865.
Klebsiella_Pneumoniae | LPS | Optuna:  56%|█████▌    | 111/200 [2:49:18<2:08:23, 86.56s/it, best=0.926]Klebsiella_Pneumoniae | LPS | Optuna:  56%|█████▌    | 111/200 [2:49:18<2:08:23, 86.56s/it, best=0.926][I 2026-02-28 11:37:09,484] Trial 154 finished with value: 0.8629783559253209 and parameters: {'activation': 'identity', 'solver': 'adam', 'lr': 0.0002146331087535937, 'layer1': 422, 'layer2': 239, 'layer3': 123}. Best is trial 102 with value: 0.8672439264969375.
Pseudomonas_Aeruginosa | DirectMulti | Optuna:  78%|███████▊  | 155/200 [4:40:55<1:17:48, 103.74s/it, best=0.867]Pseudomonas_Aeruginosa | DirectMulti | Optuna:  78%|███████▊  | 155/200 [4:40:55<1:17:48, 103.74s/it, best=0.867]/export/usuarios01/egarroyo/MALDI_for_AMR_prediction/venv/lib/python3.13/site-packages/sklearn/model_selection/_split.py:813: UserWarning: The least populated class in y has only 4 members, which is less than n_splits=5.
  warnings.warn(
[I 2026-02-28 11:38:25,654] Trial 111 finished with value: 0.9235934508824395 and parameters: {'activation': 'identity', 'solver': 'adam', 'lr': 9.818915743751403e-05, 'layer1': 76, 'layer2': 292, 'layer3': 121}. Best is trial 71 with value: 0.9257111996592865.
Klebsiella_Pneumoniae | LPS | Optuna:  56%|█████▌    | 112/200 [2:50:41<2:05:29, 85.56s/it, best=0.926]Klebsiella_Pneumoniae | LPS | Optuna:  56%|█████▌    | 112/200 [2:50:41<2:05:29, 85.56s/it, best=0.926][I 2026-02-28 11:38:57,578] Trial 94 finished with value: 0.8863396026327631 and parameters: {'activation': 'identity', 'solver': 'adam', 'lr': 0.00048804851524819864, 'layer1': 210, 'layer2': 409, 'layer3': 292}. Best is trial 8 with value: 0.8879562150966016.
Staphylococcus_Aureus | LPS | Optuna:  48%|████▊     | 95/200 [3:32:43<3:46:31, 129.44s/it, best=0.888]Staphylococcus_Aureus | LPS | Optuna:  48%|████▊     | 95/200 [3:32:43<3:46:31, 129.44s/it, best=0.888][I 2026-02-28 11:39:04,687] Trial 101 finished with value: 0.9148457790362379 and parameters: {'activation': 'relu', 'solver': 'adam', 'lr': 0.00031064182156036077, 'layer1': 334, 'layer2': 326, 'layer3': 135}. Best is trial 74 with value: 0.9166002918687234.

Escherichia_Coli | Piperacillin-Tazobactam | Optuna:  51%|█████     | 102/200 [3:34:57<3:11:12, 117.07s/it, best=0.917][A
Escherichia_Coli | Piperacillin-Tazobactam | Optuna:  51%|█████     | 102/200 [3:34:57<3:11:12, 117.07s/it, best=0.917][A[I 2026-02-28 11:39:07,593] Trial 155 finished with value: 0.8677633336625616 and parameters: {'activation': 'identity', 'solver': 'adam', 'lr': 0.00013788703772465134, 'layer1': 399, 'layer2': 254, 'layer3': 138}. Best is trial 155 with value: 0.8677633336625616.
Pseudomonas_Aeruginosa | DirectMulti | Optuna:  78%|███████▊  | 156/200 [4:42:53<1:19:14, 108.05s/it, best=0.867]Pseudomonas_Aeruginosa | DirectMulti | Optuna:  78%|███████▊  | 156/200 [4:42:53<1:19:14, 108.05s/it, best=0.868]/export/usuarios01/egarroyo/MALDI_for_AMR_prediction/venv/lib/python3.13/site-packages/sklearn/model_selection/_split.py:813: UserWarning: The least populated class in y has only 4 members, which is less than n_splits=5.
  warnings.warn(
[I 2026-02-28 11:40:00,209] Trial 112 finished with value: 0.9240311656698914 and parameters: {'activation': 'identity', 'solver': 'adam', 'lr': 0.0001170053217697836, 'layer1': 136, 'layer2': 320, 'layer3': 104}. Best is trial 71 with value: 0.9257111996592865.
Klebsiella_Pneumoniae | LPS | Optuna:  56%|█████▋    | 113/200 [2:52:16<2:07:58, 88.26s/it, best=0.926]Klebsiella_Pneumoniae | LPS | Optuna:  56%|█████▋    | 113/200 [2:52:16<2:07:58, 88.26s/it, best=0.926][I 2026-02-28 11:40:32,826] Trial 156 finished with value: 0.862834293123562 and parameters: {'activation': 'identity', 'solver': 'adam', 'lr': 0.0001536170978689108, 'layer1': 401, 'layer2': 216, 'layer3': 142}. Best is trial 155 with value: 0.8677633336625616.
Pseudomonas_Aeruginosa | DirectMulti | Optuna:  78%|███████▊  | 157/200 [4:44:19<1:12:31, 101.20s/it, best=0.868]Pseudomonas_Aeruginosa | DirectMulti | Optuna:  78%|███████▊  | 157/200 [4:44:19<1:12:31, 101.20s/it, best=0.868]/export/usuarios01/egarroyo/MALDI_for_AMR_prediction/venv/lib/python3.13/site-packages/sklearn/model_selection/_split.py:813: UserWarning: The least populated class in y has only 4 members, which is less than n_splits=5.
  warnings.warn(
[I 2026-02-28 11:40:53,067] Trial 95 finished with value: 0.884326219651131 and parameters: {'activation': 'identity', 'solver': 'adam', 'lr': 0.00034094361058801295, 'layer1': 327, 'layer2': 79, 'layer3': 315}. Best is trial 8 with value: 0.8879562150966016.
Staphylococcus_Aureus | LPS | Optuna:  48%|████▊     | 96/200 [3:34:39<3:37:06, 125.25s/it, best=0.888]Staphylococcus_Aureus | LPS | Optuna:  48%|████▊     | 96/200 [3:34:39<3:37:06, 125.25s/it, best=0.888][I 2026-02-28 11:41:35,074] Trial 102 finished with value: 0.9145524205079575 and parameters: {'activation': 'relu', 'solver': 'adam', 'lr': 0.0004832369695690162, 'layer1': 327, 'layer2': 321, 'layer3': 267}. Best is trial 74 with value: 0.9166002918687234.

Escherichia_Coli | Piperacillin-Tazobactam | Optuna:  52%|█████▏    | 103/200 [3:37:27<3:25:25, 127.06s/it, best=0.917][A
Escherichia_Coli | Piperacillin-Tazobactam | Optuna:  52%|█████▏    | 103/200 [3:37:27<3:25:25, 127.06s/it, best=0.917][A[I 2026-02-28 11:41:40,211] Trial 113 finished with value: 0.9234050253572657 and parameters: {'activation': 'identity', 'solver': 'adam', 'lr': 6.521917058692568e-05, 'layer1': 130, 'layer2': 291, 'layer3': 84}. Best is trial 71 with value: 0.9257111996592865.
Klebsiella_Pneumoniae | LPS | Optuna:  57%|█████▋    | 114/200 [2:53:56<2:11:33, 91.78s/it, best=0.926]Klebsiella_Pneumoniae | LPS | Optuna:  57%|█████▋    | 114/200 [2:53:56<2:11:33, 91.78s/it, best=0.926][I 2026-02-28 11:42:01,244] Trial 157 finished with value: 0.8573611724812441 and parameters: {'activation': 'relu', 'solver': 'adam', 'lr': 0.00013121667426449314, 'layer1': 424, 'layer2': 240, 'layer3': 107}. Best is trial 155 with value: 0.8677633336625616.
Pseudomonas_Aeruginosa | DirectMulti | Optuna:  79%|███████▉  | 158/200 [4:45:47<1:08:09, 97.37s/it, best=0.868] Pseudomonas_Aeruginosa | DirectMulti | Optuna:  79%|███████▉  | 158/200 [4:45:47<1:08:09, 97.37s/it, best=0.868]/export/usuarios01/egarroyo/MALDI_for_AMR_prediction/venv/lib/python3.13/site-packages/sklearn/model_selection/_split.py:813: UserWarning: The least populated class in y has only 4 members, which is less than n_splits=5.
  warnings.warn(
[I 2026-02-28 11:43:02,831] Trial 114 finished with value: 0.9237696657800883 and parameters: {'activation': 'identity', 'solver': 'adam', 'lr': 0.00016535660400199728, 'layer1': 150, 'layer2': 261, 'layer3': 131}. Best is trial 71 with value: 0.9257111996592865.
Klebsiella_Pneumoniae | LPS | Optuna:  57%|█████▊    | 115/200 [2:55:18<2:06:07, 89.03s/it, best=0.926]Klebsiella_Pneumoniae | LPS | Optuna:  57%|█████▊    | 115/200 [2:55:18<2:06:07, 89.03s/it, best=0.926][I 2026-02-28 11:43:19,842] Trial 96 finished with value: 0.885539480847768 and parameters: {'activation': 'identity', 'solver': 'adam', 'lr': 0.0006150361060913471, 'layer1': 286, 'layer2': 459, 'layer3': 394}. Best is trial 8 with value: 0.8879562150966016.
Staphylococcus_Aureus | LPS | Optuna:  48%|████▊     | 97/200 [3:37:06<3:46:06, 131.71s/it, best=0.888]Staphylococcus_Aureus | LPS | Optuna:  48%|████▊     | 97/200 [3:37:06<3:46:06, 131.71s/it, best=0.888][I 2026-02-28 11:43:26,804] Trial 158 finished with value: 0.8622067710467626 and parameters: {'activation': 'identity', 'solver': 'adam', 'lr': 0.0002575844371688663, 'layer1': 368, 'layer2': 251, 'layer3': 129}. Best is trial 155 with value: 0.8677633336625616.
Pseudomonas_Aeruginosa | DirectMulti | Optuna:  80%|███████▉  | 159/200 [4:47:13<1:04:06, 93.83s/it, best=0.868]Pseudomonas_Aeruginosa | DirectMulti | Optuna:  80%|███████▉  | 159/200 [4:47:13<1:04:06, 93.83s/it, best=0.868]/export/usuarios01/egarroyo/MALDI_for_AMR_prediction/venv/lib/python3.13/site-packages/sklearn/model_selection/_split.py:813: UserWarning: The least populated class in y has only 4 members, which is less than n_splits=5.
  warnings.warn(
[I 2026-02-28 11:43:48,873] Trial 97 finished with value: 0.803778810698921 and parameters: {'activation': 'identity', 'solver': 'sgd', 'lr': 0.0015873354668295742, 'layer1': 256, 'layer2': 98, 'layer3': 404}. Best is trial 8 with value: 0.8879562150966016.
Staphylococcus_Aureus | LPS | Optuna:  49%|████▉     | 98/200 [3:37:35<2:51:32, 100.91s/it, best=0.888]Staphylococcus_Aureus | LPS | Optuna:  49%|████▉     | 98/200 [3:37:35<2:51:32, 100.91s/it, best=0.888][I 2026-02-28 11:44:15,641] Trial 159 finished with value: 0.8557771994028561 and parameters: {'activation': 'tanh', 'solver': 'adam', 'lr': 0.0002076949333783007, 'layer1': 412, 'layer2': 264, 'layer3': 148}. Best is trial 155 with value: 0.8677633336625616.
Pseudomonas_Aeruginosa | DirectMulti | Optuna:  80%|████████  | 160/200 [4:48:01<53:33, 80.33s/it, best=0.868]  Pseudomonas_Aeruginosa | DirectMulti | Optuna:  80%|████████  | 160/200 [4:48:01<53:33, 80.33s/it, best=0.868]/export/usuarios01/egarroyo/MALDI_for_AMR_prediction/venv/lib/python3.13/site-packages/sklearn/model_selection/_split.py:813: UserWarning: The least populated class in y has only 4 members, which is less than n_splits=5.
  warnings.warn(
[I 2026-02-28 11:44:16,033] Trial 103 finished with value: 0.9147461582762102 and parameters: {'activation': 'relu', 'solver': 'adam', 'lr': 0.00016614191239279187, 'layer1': 371, 'layer2': 337, 'layer3': 451}. Best is trial 74 with value: 0.9166002918687234.

Escherichia_Coli | Piperacillin-Tazobactam | Optuna:  52%|█████▏    | 104/200 [3:40:08<3:39:34, 137.23s/it, best=0.917][A
Escherichia_Coli | Piperacillin-Tazobactam | Optuna:  52%|█████▏    | 104/200 [3:40:08<3:39:34, 137.23s/it, best=0.917][A[I 2026-02-28 11:44:27,452] Trial 115 finished with value: 0.922634440083708 and parameters: {'activation': 'identity', 'solver': 'adam', 'lr': 0.00011158332863633937, 'layer1': 109, 'layer2': 241, 'layer3': 111}. Best is trial 71 with value: 0.9257111996592865.
Klebsiella_Pneumoniae | LPS | Optuna:  58%|█████▊    | 116/200 [2:56:43<2:02:47, 87.71s/it, best=0.926]Klebsiella_Pneumoniae | LPS | Optuna:  58%|█████▊    | 116/200 [2:56:43<2:02:47, 87.71s/it, best=0.926][I 2026-02-28 11:44:54,560] Trial 116 finished with value: 0.8702461473038209 and parameters: {'activation': 'logistic', 'solver': 'adam', 'lr': 0.00021900871460122086, 'layer1': 167, 'layer2': 217, 'layer3': 93}. Best is trial 71 with value: 0.9257111996592865.
Klebsiella_Pneumoniae | LPS | Optuna:  58%|█████▊    | 117/200 [2:57:10<1:36:10, 69.53s/it, best=0.926]Klebsiella_Pneumoniae | LPS | Optuna:  58%|█████▊    | 117/200 [2:57:10<1:36:10, 69.53s/it, best=0.926][I 2026-02-28 11:45:58,924] Trial 160 finished with value: 0.8644410087899042 and parameters: {'activation': 'identity', 'solver': 'adam', 'lr': 8.852910992152757e-05, 'layer1': 379, 'layer2': 258, 'layer3': 117}. Best is trial 155 with value: 0.8677633336625616.
Pseudomonas_Aeruginosa | DirectMulti | Optuna:  80%|████████  | 161/200 [4:49:45<56:41, 87.22s/it, best=0.868]Pseudomonas_Aeruginosa | DirectMulti | Optuna:  80%|████████  | 161/200 [4:49:45<56:41, 87.22s/it, best=0.868]/export/usuarios01/egarroyo/MALDI_for_AMR_prediction/venv/lib/python3.13/site-packages/sklearn/model_selection/_split.py:813: UserWarning: The least populated class in y has only 4 members, which is less than n_splits=5.
  warnings.warn(
[I 2026-02-28 11:46:15,626] Trial 117 finished with value: 0.9227984743059094 and parameters: {'activation': 'identity', 'solver': 'adam', 'lr': 0.0003073305536430791, 'layer1': 281, 'layer2': 386, 'layer3': 163}. Best is trial 71 with value: 0.9257111996592865.
Klebsiella_Pneumoniae | LPS | Optuna:  59%|█████▉    | 118/200 [2:58:31<1:39:45, 72.99s/it, best=0.926]Klebsiella_Pneumoniae | LPS | Optuna:  59%|█████▉    | 118/200 [2:58:31<1:39:45, 72.99s/it, best=0.926][I 2026-02-28 11:46:42,754] Trial 118 finished with value: 0.8720292938380109 and parameters: {'activation': 'identity', 'solver': 'sgd', 'lr': 0.0005331967556178244, 'layer1': 36, 'layer2': 228, 'layer3': 197}. Best is trial 71 with value: 0.9257111996592865.
Klebsiella_Pneumoniae | LPS | Optuna:  60%|█████▉    | 119/200 [2:58:58<1:19:57, 59.23s/it, best=0.926]Klebsiella_Pneumoniae | LPS | Optuna:  60%|█████▉    | 119/200 [2:58:58<1:19:57, 59.23s/it, best=0.926][I 2026-02-28 11:46:58,384] Trial 98 finished with value: 0.8743416339052237 and parameters: {'activation': 'identity', 'solver': 'adam', 'lr': 1.9936923594451238e-05, 'layer1': 311, 'layer2': 45, 'layer3': 365}. Best is trial 8 with value: 0.8879562150966016.
Staphylococcus_Aureus | LPS | Optuna:  50%|████▉     | 99/200 [3:40:44<3:34:36, 127.49s/it, best=0.888]Staphylococcus_Aureus | LPS | Optuna:  50%|████▉     | 99/200 [3:40:44<3:34:36, 127.49s/it, best=0.888][I 2026-02-28 11:47:14,713] Trial 104 finished with value: 0.9142277787833765 and parameters: {'activation': 'relu', 'solver': 'adam', 'lr': 0.0004243104177793536, 'layer1': 415, 'layer2': 357, 'layer3': 249}. Best is trial 74 with value: 0.9166002918687234.

Escherichia_Coli | Piperacillin-Tazobactam | Optuna:  52%|█████▎    | 105/200 [3:43:07<3:56:58, 149.67s/it, best=0.917][A
Escherichia_Coli | Piperacillin-Tazobactam | Optuna:  52%|█████▎    | 105/200 [3:43:07<3:56:58, 149.67s/it, best=0.917][A[I 2026-02-28 11:47:39,664] Trial 161 finished with value: 0.8642836380959025 and parameters: {'activation': 'identity', 'solver': 'adam', 'lr': 0.00011728052739418025, 'layer1': 432, 'layer2': 272, 'layer3': 158}. Best is trial 155 with value: 0.8677633336625616.
Pseudomonas_Aeruginosa | DirectMulti | Optuna:  81%|████████  | 162/200 [4:51:25<57:48, 91.27s/it, best=0.868]Pseudomonas_Aeruginosa | DirectMulti | Optuna:  81%|████████  | 162/200 [4:51:25<57:48, 91.27s/it, best=0.868]/export/usuarios01/egarroyo/MALDI_for_AMR_prediction/venv/lib/python3.13/site-packages/sklearn/model_selection/_split.py:813: UserWarning: The least populated class in y has only 4 members, which is less than n_splits=5.
  warnings.warn(
[I 2026-02-28 11:47:44,292] Trial 119 finished with value: 0.9037381475008839 and parameters: {'activation': 'identity', 'solver': 'adam', 'lr': 3.274648668894944e-05, 'layer1': 192, 'layer2': 280, 'layer3': 16}. Best is trial 71 with value: 0.9257111996592865.
Klebsiella_Pneumoniae | LPS | Optuna:  60%|██████    | 120/200 [3:00:00<1:19:53, 59.92s/it, best=0.926]Klebsiella_Pneumoniae | LPS | Optuna:  60%|██████    | 120/200 [3:00:00<1:19:53, 59.92s/it, best=0.926][I 2026-02-28 11:49:08,069] Trial 120 finished with value: 0.9236282884803936 and parameters: {'activation': 'identity', 'solver': 'adam', 'lr': 7.938761240840123e-05, 'layer1': 52, 'layer2': 250, 'layer3': 329}. Best is trial 71 with value: 0.9257111996592865.
Klebsiella_Pneumoniae | LPS | Optuna:  60%|██████    | 121/200 [3:01:24<1:28:19, 67.08s/it, best=0.926]Klebsiella_Pneumoniae | LPS | Optuna:  60%|██████    | 121/200 [3:01:24<1:28:19, 67.08s/it, best=0.926][I 2026-02-28 11:49:12,586] Trial 105 finished with value: 0.9135790675246735 and parameters: {'activation': 'relu', 'solver': 'adam', 'lr': 0.00034052838742930195, 'layer1': 350, 'layer2': 296, 'layer3': 154}. Best is trial 74 with value: 0.9166002918687234.

Escherichia_Coli | Piperacillin-Tazobactam | Optuna:  53%|█████▎    | 106/200 [3:45:05<3:39:32, 140.13s/it, best=0.917][A
Escherichia_Coli | Piperacillin-Tazobactam | Optuna:  53%|█████▎    | 106/200 [3:45:05<3:39:32, 140.13s/it, best=0.917][A[I 2026-02-28 11:49:19,233] Trial 99 finished with value: 0.8876417367208844 and parameters: {'activation': 'identity', 'solver': 'adam', 'lr': 0.0012381596763353004, 'layer1': 86, 'layer2': 388, 'layer3': 454}. Best is trial 8 with value: 0.8879562150966016.
Staphylococcus_Aureus | LPS | Optuna:  50%|█████     | 100/200 [3:43:05<3:39:09, 131.50s/it, best=0.888]Staphylococcus_Aureus | LPS | Optuna:  50%|█████     | 100/200 [3:43:05<3:39:09, 131.50s/it, best=0.888][I 2026-02-28 11:49:40,666] Trial 162 finished with value: 0.8654542131350583 and parameters: {'activation': 'identity', 'solver': 'adam', 'lr': 0.0003904962578900532, 'layer1': 396, 'layer2': 281, 'layer3': 174}. Best is trial 155 with value: 0.8677633336625616.
Pseudomonas_Aeruginosa | DirectMulti | Optuna:  82%|████████▏ | 163/200 [4:53:26<1:01:47, 100.19s/it, best=0.868]Pseudomonas_Aeruginosa | DirectMulti | Optuna:  82%|████████▏ | 163/200 [4:53:26<1:01:47, 100.19s/it, best=0.868]/export/usuarios01/egarroyo/MALDI_for_AMR_prediction/venv/lib/python3.13/site-packages/sklearn/model_selection/_split.py:813: UserWarning: The least populated class in y has only 4 members, which is less than n_splits=5.
  warnings.warn(
[I 2026-02-28 11:50:14,363] Trial 121 finished with value: 0.9238947765857353 and parameters: {'activation': 'identity', 'solver': 'adam', 'lr': 0.00031829930553350125, 'layer1': 102, 'layer2': 272, 'layer3': 113}. Best is trial 71 with value: 0.9257111996592865.
Klebsiella_Pneumoniae | LPS | Optuna:  61%|██████    | 122/200 [3:02:30<1:26:53, 66.84s/it, best=0.926]Klebsiella_Pneumoniae | LPS | Optuna:  61%|██████    | 122/200 [3:02:30<1:26:53, 66.84s/it, best=0.926][I 2026-02-28 11:50:20,018] Trial 106 finished with value: 0.8990433507303159 and parameters: {'activation': 'logistic', 'solver': 'adam', 'lr': 0.00022739704700849362, 'layer1': 337, 'layer2': 311, 'layer3': 94}. Best is trial 74 with value: 0.9166002918687234.

Escherichia_Coli | Piperacillin-Tazobactam | Optuna:  54%|█████▎    | 107/200 [3:46:12<3:03:23, 118.32s/it, best=0.917][A
Escherichia_Coli | Piperacillin-Tazobactam | Optuna:  54%|█████▎    | 107/200 [3:46:12<3:03:23, 118.32s/it, best=0.917][A[I 2026-02-28 11:50:49,159] Trial 100 finished with value: 0.8783006155917017 and parameters: {'activation': 'tanh', 'solver': 'adam', 'lr': 0.0010756275842276964, 'layer1': 91, 'layer2': 384, 'layer3': 465}. Best is trial 8 with value: 0.8879562150966016.
Staphylococcus_Aureus | LPS | Optuna:  50%|█████     | 101/200 [3:44:35<3:16:23, 119.02s/it, best=0.888]Staphylococcus_Aureus | LPS | Optuna:  50%|█████     | 101/200 [3:44:35<3:16:23, 119.02s/it, best=0.888][I 2026-02-28 11:51:18,974] Trial 122 finished with value: 0.9222406559921342 and parameters: {'activation': 'identity', 'solver': 'adam', 'lr': 0.0007240580098064508, 'layer1': 117, 'layer2': 268, 'layer3': 146}. Best is trial 71 with value: 0.9257111996592865.
