Staphylococcus_Aureus | Oxacillin | Optuna:  95%|█████████▌| 190/200 [6:49:48<17:26, 104.60s/it, best=0.91][A[I 2026-02-27 21:37:19,530] Trial 26 finished with value: 0.7877205635373119 and parameters: {'activation': 'identity', 'solver': 'sgd', 'lr': 0.0006315402771255295, 'layer1': 390, 'layer2': 441, 'layer3': 399}. Best is trial 25 with value: 0.9080365798965563.

Klebsiella_Pneumoniae | Ceftriaxone | Optuna:  14%|█▎        | 27/200 [46:41<4:29:29, 93.47s/it, best=0.908] [A
Klebsiella_Pneumoniae | Ceftriaxone | Optuna:  14%|█▎        | 27/200 [46:41<4:29:29, 93.47s/it, best=0.908][A[I 2026-02-27 21:37:43,932] Trial 177 finished with value: 0.8628113094534822 and parameters: {'activation': 'logistic', 'solver': 'adam', 'lr': 0.0005969918975620463, 'layer1': 467, 'layer2': 389, 'layer3': 94}. Best is trial 126 with value: 0.8664911301660769.

Pseudomonas_Aeruginosa | Imipenem | Optuna:  89%|████████▉ | 178/200 [3:05:38<27:49, 75.90s/it, best=0.867][A
Pseudomonas_Aeruginosa | Imipenem | Optuna:  89%|████████▉ | 178/200 [3:05:38<27:49, 75.90s/it, best=0.867][A[I 2026-02-27 21:38:54,421] Trial 190 finished with value: 0.9018483332113826 and parameters: {'activation': 'relu', 'solver': 'adam', 'lr': 0.0004127214752430765, 'layer1': 357, 'layer2': 227, 'layer3': 385}. Best is trial 152 with value: 0.9102139153966748.

Staphylococcus_Aureus | Oxacillin | Optuna:  96%|█████████▌| 191/200 [6:51:24<15:16, 101.85s/it, best=0.91][A
Staphylococcus_Aureus | Oxacillin | Optuna:  96%|█████████▌| 191/200 [6:51:24<15:16, 101.85s/it, best=0.91][A[I 2026-02-27 21:38:54,904] Trial 178 finished with value: 0.8615431055621758 and parameters: {'activation': 'relu', 'solver': 'adam', 'lr': 0.000505948494842427, 'layer1': 490, 'layer2': 268, 'layer3': 80}. Best is trial 126 with value: 0.8664911301660769.

Pseudomonas_Aeruginosa | Imipenem | Optuna:  90%|████████▉ | 179/200 [3:06:49<26:02, 74.42s/it, best=0.867][A
Pseudomonas_Aeruginosa | Imipenem | Optuna:  90%|████████▉ | 179/200 [3:06:49<26:02, 74.42s/it, best=0.867][A[I 2026-02-27 21:39:05,874] Trial 27 finished with value: 0.8722442604982346 and parameters: {'activation': 'logistic', 'solver': 'adam', 'lr': 0.002526204652054459, 'layer1': 458, 'layer2': 481, 'layer3': 286}. Best is trial 25 with value: 0.9080365798965563.

Klebsiella_Pneumoniae | Ceftriaxone | Optuna:  14%|█▍        | 28/200 [48:27<4:39:00, 97.33s/it, best=0.908][A
Klebsiella_Pneumoniae | Ceftriaxone | Optuna:  14%|█▍        | 28/200 [48:27<4:39:00, 97.33s/it, best=0.908][A[I 2026-02-27 21:40:02,126] Trial 179 finished with value: 0.8635978348582917 and parameters: {'activation': 'relu', 'solver': 'adam', 'lr': 0.00019883752892882483, 'layer1': 297, 'layer2': 334, 'layer3': 239}. Best is trial 126 with value: 0.8664911301660769.

Pseudomonas_Aeruginosa | Imipenem | Optuna:  90%|█████████ | 180/200 [3:07:56<24:05, 72.26s/it, best=0.867][A
Pseudomonas_Aeruginosa | Imipenem | Optuna:  90%|█████████ | 180/200 [3:07:56<24:05, 72.26s/it, best=0.867][A[I 2026-02-27 21:40:07,468] Trial 28 finished with value: 0.9012305662888431 and parameters: {'activation': 'tanh', 'solver': 'adam', 'lr': 0.0002318611726164737, 'layer1': 320, 'layer2': 316, 'layer3': 462}. Best is trial 25 with value: 0.9080365798965563.

Klebsiella_Pneumoniae | Ceftriaxone | Optuna:  14%|█▍        | 29/200 [49:29<4:06:50, 86.61s/it, best=0.908][A
Klebsiella_Pneumoniae | Ceftriaxone | Optuna:  14%|█▍        | 29/200 [49:29<4:06:50, 86.61s/it, best=0.908][A[I 2026-02-27 21:40:23,546] Trial 169 finished with value: 0.6074715807492548 and parameters: {'activation': 'tanh', 'solver': 'sgd', 'lr': 2.945125694484207e-05, 'layer1': 327, 'layer2': 219, 'layer3': 73}. Best is trial 124 with value: 0.8095465376114227.

Escherichia_Coli | Ciprofloxacin | Optuna:  85%|████████▌ | 170/200 [6:52:52<1:08:16, 136.56s/it, best=0.809][A
Escherichia_Coli | Ciprofloxacin | Optuna:  85%|████████▌ | 170/200 [6:52:52<1:08:16, 136.56s/it, best=0.809][A[I 2026-02-27 21:40:28,946] Trial 191 finished with value: 0.9028079069688267 and parameters: {'activation': 'identity', 'solver': 'adam', 'lr': 6.668021201094727e-05, 'layer1': 209, 'layer2': 407, 'layer3': 479}. Best is trial 152 with value: 0.9102139153966748.

Staphylococcus_Aureus | Oxacillin | Optuna:  96%|█████████▌| 192/200 [6:52:58<13:17, 99.65s/it, best=0.91] [A
Staphylococcus_Aureus | Oxacillin | Optuna:  96%|█████████▌| 192/200 [6:52:58<13:17, 99.65s/it, best=0.91][A[I 2026-02-27 21:40:37,125] Trial 29 finished with value: 0.782466545914998 and parameters: {'activation': 'logistic', 'solver': 'sgd', 'lr': 0.0003818712823479646, 'layer1': 425, 'layer2': 416, 'layer3': 338}. Best is trial 25 with value: 0.9080365798965563.

Klebsiella_Pneumoniae | Ceftriaxone | Optuna:  15%|█▌        | 30/200 [49:58<3:16:58, 69.52s/it, best=0.908][A
Klebsiella_Pneumoniae | Ceftriaxone | Optuna:  15%|█▌        | 30/200 [49:58<3:16:58, 69.52s/it, best=0.908][A[I 2026-02-27 21:41:40,195] Trial 180 finished with value: 0.8655389084465297 and parameters: {'activation': 'relu', 'solver': 'adam', 'lr': 0.000182842770008834, 'layer1': 325, 'layer2': 339, 'layer3': 435}. Best is trial 126 with value: 0.8664911301660769.

Pseudomonas_Aeruginosa | Imipenem | Optuna:  90%|█████████ | 181/200 [3:09:34<25:20, 80.01s/it, best=0.867][A
Pseudomonas_Aeruginosa | Imipenem | Optuna:  90%|█████████ | 181/200 [3:09:34<25:20, 80.01s/it, best=0.867][A[I 2026-02-27 21:42:35,792] Trial 192 finished with value: 0.9089441041479039 and parameters: {'activation': 'identity', 'solver': 'adam', 'lr': 9.882477166643016e-05, 'layer1': 252, 'layer2': 429, 'layer3': 484}. Best is trial 152 with value: 0.9102139153966748.

Staphylococcus_Aureus | Oxacillin | Optuna:  96%|█████████▋| 193/200 [6:55:05<12:34, 107.81s/it, best=0.91][A
Staphylococcus_Aureus | Oxacillin | Optuna:  96%|█████████▋| 193/200 [6:55:05<12:34, 107.81s/it, best=0.91][A[I 2026-02-27 21:42:58,841] Trial 181 finished with value: 0.8632078796767895 and parameters: {'activation': 'relu', 'solver': 'adam', 'lr': 0.0001622594916871996, 'layer1': 304, 'layer2': 337, 'layer3': 412}. Best is trial 126 with value: 0.8664911301660769.

Pseudomonas_Aeruginosa | Imipenem | Optuna:  91%|█████████ | 182/200 [3:10:53<23:52, 79.60s/it, best=0.867][A
Pseudomonas_Aeruginosa | Imipenem | Optuna:  91%|█████████ | 182/200 [3:10:53<23:52, 79.60s/it, best=0.867][A[I 2026-02-27 21:43:25,933] Trial 30 finished with value: 0.8900594910374972 and parameters: {'activation': 'identity', 'solver': 'adam', 'lr': 8.761007757937238e-06, 'layer1': 460, 'layer2': 465, 'layer3': 383}. Best is trial 25 with value: 0.9080365798965563.

Klebsiella_Pneumoniae | Ceftriaxone | Optuna:  16%|█▌        | 31/200 [52:47<4:39:43, 99.31s/it, best=0.908][A
Klebsiella_Pneumoniae | Ceftriaxone | Optuna:  16%|█▌        | 31/200 [52:47<4:39:43, 99.31s/it, best=0.908][A[I 2026-02-27 21:43:38,233] Trial 170 finished with value: 0.8075104885475703 and parameters: {'activation': 'tanh', 'solver': 'adam', 'lr': 2.2045202693046886e-05, 'layer1': 240, 'layer2': 291, 'layer3': 52}. Best is trial 124 with value: 0.8095465376114227.

Escherichia_Coli | Ciprofloxacin | Optuna:  86%|████████▌ | 171/200 [6:56:07<1:14:26, 154.00s/it, best=0.809][A
Escherichia_Coli | Ciprofloxacin | Optuna:  86%|████████▌ | 171/200 [6:56:07<1:14:26, 154.00s/it, best=0.809][A[I 2026-02-27 21:44:08,602] Trial 182 finished with value: 0.8579963165534537 and parameters: {'activation': 'relu', 'solver': 'adam', 'lr': 7.795196264343575e-05, 'layer1': 297, 'layer2': 346, 'layer3': 228}. Best is trial 126 with value: 0.8664911301660769.

Pseudomonas_Aeruginosa | Imipenem | Optuna:  92%|█████████▏| 183/200 [3:12:02<21:42, 76.65s/it, best=0.867][A
Pseudomonas_Aeruginosa | Imipenem | Optuna:  92%|█████████▏| 183/200 [3:12:02<21:42, 76.65s/it, best=0.867][A[I 2026-02-27 21:44:43,498] Trial 193 finished with value: 0.9058318036687731 and parameters: {'activation': 'identity', 'solver': 'adam', 'lr': 0.00010239781135679765, 'layer1': 260, 'layer2': 429, 'layer3': 488}. Best is trial 152 with value: 0.9102139153966748.

Staphylococcus_Aureus | Oxacillin | Optuna:  97%|█████████▋| 194/200 [6:57:13<11:22, 113.78s/it, best=0.91][A
Staphylococcus_Aureus | Oxacillin | Optuna:  97%|█████████▋| 194/200 [6:57:13<11:22, 113.78s/it, best=0.91][A[I 2026-02-27 21:45:17,342] Trial 31 finished with value: 0.9036387506488008 and parameters: {'activation': 'identity', 'solver': 'adam', 'lr': 0.00010588646826785321, 'layer1': 498, 'layer2': 384, 'layer3': 494}. Best is trial 25 with value: 0.9080365798965563.

Klebsiella_Pneumoniae | Ceftriaxone | Optuna:  16%|█▌        | 32/200 [54:38<4:48:13, 102.94s/it, best=0.908][A
Klebsiella_Pneumoniae | Ceftriaxone | Optuna:  16%|█▌        | 32/200 [54:38<4:48:13, 102.94s/it, best=0.908][A[I 2026-02-27 21:45:27,641] Trial 183 finished with value: 0.863924899620718 and parameters: {'activation': 'relu', 'solver': 'adam', 'lr': 0.00019673713879933297, 'layer1': 313, 'layer2': 362, 'layer3': 442}. Best is trial 126 with value: 0.8664911301660769.

Pseudomonas_Aeruginosa | Imipenem | Optuna:  92%|█████████▏| 184/200 [3:13:21<20:37, 77.36s/it, best=0.867][A
Pseudomonas_Aeruginosa | Imipenem | Optuna:  92%|█████████▏| 184/200 [3:13:21<20:37, 77.36s/it, best=0.867][A[I 2026-02-27 21:46:45,047] Trial 184 finished with value: 0.8628305614009657 and parameters: {'activation': 'relu', 'solver': 'adam', 'lr': 0.0002750494866961227, 'layer1': 340, 'layer2': 355, 'layer3': 443}. Best is trial 126 with value: 0.8664911301660769.

Pseudomonas_Aeruginosa | Imipenem | Optuna:  92%|█████████▎| 185/200 [3:14:39<19:20, 77.38s/it, best=0.867][A
Pseudomonas_Aeruginosa | Imipenem | Optuna:  92%|█████████▎| 185/200 [3:14:39<19:20, 77.38s/it, best=0.867][A[I 2026-02-27 21:46:51,028] Trial 171 finished with value: 0.8061913822375167 and parameters: {'activation': 'tanh', 'solver': 'adam', 'lr': 1.96500738631464e-05, 'layer1': 240, 'layer2': 292, 'layer3': 52}. Best is trial 124 with value: 0.8095465376114227.

Escherichia_Coli | Ciprofloxacin | Optuna:  86%|████████▌ | 172/200 [6:59:20<1:17:17, 165.64s/it, best=0.809][A
Escherichia_Coli | Ciprofloxacin | Optuna:  86%|████████▌ | 172/200 [6:59:20<1:17:17, 165.64s/it, best=0.809][A[I 2026-02-27 21:47:04,710] Trial 194 finished with value: 0.9068922929985878 and parameters: {'activation': 'identity', 'solver': 'adam', 'lr': 0.00012768994190152596, 'layer1': 271, 'layer2': 219, 'layer3': 459}. Best is trial 152 with value: 0.9102139153966748.

Staphylococcus_Aureus | Oxacillin | Optuna:  98%|█████████▊| 195/200 [6:59:34<10:10, 122.01s/it, best=0.91][A
Staphylococcus_Aureus | Oxacillin | Optuna:  98%|█████████▊| 195/200 [6:59:34<10:10, 122.01s/it, best=0.91][A[I 2026-02-27 21:47:32,886] Trial 32 finished with value: 0.9031033190633622 and parameters: {'activation': 'identity', 'solver': 'adam', 'lr': 2.5203277188421747e-05, 'layer1': 472, 'layer2': 274, 'layer3': 431}. Best is trial 25 with value: 0.9080365798965563.

Klebsiella_Pneumoniae | Ceftriaxone | Optuna:  16%|█▋        | 33/200 [56:54<5:13:44, 112.72s/it, best=0.908][A
Klebsiella_Pneumoniae | Ceftriaxone | Optuna:  16%|█▋        | 33/200 [56:54<5:13:44, 112.72s/it, best=0.908][A[I 2026-02-27 21:48:02,378] Trial 185 finished with value: 0.8610569125726943 and parameters: {'activation': 'relu', 'solver': 'adam', 'lr': 0.0001318530172007472, 'layer1': 363, 'layer2': 366, 'layer3': 434}. Best is trial 126 with value: 0.8664911301660769.

Pseudomonas_Aeruginosa | Imipenem | Optuna:  93%|█████████▎| 186/200 [3:15:56<18:03, 77.36s/it, best=0.867][A
Pseudomonas_Aeruginosa | Imipenem | Optuna:  93%|█████████▎| 186/200 [3:15:56<18:03, 77.36s/it, best=0.867][A[I 2026-02-27 21:48:57,865] Trial 195 finished with value: 0.906695830442465 and parameters: {'activation': 'identity', 'solver': 'adam', 'lr': 0.00014013807761129675, 'layer1': 246, 'layer2': 74, 'layer3': 467}. Best is trial 152 with value: 0.9102139153966748.

Staphylococcus_Aureus | Oxacillin | Optuna:  98%|█████████▊| 196/200 [7:01:27<07:57, 119.35s/it, best=0.91][A
Staphylococcus_Aureus | Oxacillin | Optuna:  98%|█████████▊| 196/200 [7:01:27<07:57, 119.35s/it, best=0.91][A[I 2026-02-27 21:49:15,142] Trial 186 finished with value: 0.8551010965880652 and parameters: {'activation': 'identity', 'solver': 'adam', 'lr': 0.00022280116176265886, 'layer1': 445, 'layer2': 363, 'layer3': 407}. Best is trial 126 with value: 0.8664911301660769.

Pseudomonas_Aeruginosa | Imipenem | Optuna:  94%|█████████▎| 187/200 [3:17:09<16:27, 75.98s/it, best=0.867][A
Pseudomonas_Aeruginosa | Imipenem | Optuna:  94%|█████████▎| 187/200 [3:17:09<16:27, 75.98s/it, best=0.867][A[I 2026-02-27 21:49:34,045] Trial 33 finished with value: 0.9076944867455434 and parameters: {'activation': 'identity', 'solver': 'adam', 'lr': 8.35566525109609e-05, 'layer1': 417, 'layer2': 313, 'layer3': 470}. Best is trial 25 with value: 0.9080365798965563.

Klebsiella_Pneumoniae | Ceftriaxone | Optuna:  17%|█▋        | 34/200 [58:55<5:18:51, 115.25s/it, best=0.908][A
Klebsiella_Pneumoniae | Ceftriaxone | Optuna:  17%|█▋        | 34/200 [58:55<5:18:51, 115.25s/it, best=0.908][A[I 2026-02-27 21:50:00,625] Trial 172 finished with value: 0.8026279989451677 and parameters: {'activation': 'tanh', 'solver': 'adam', 'lr': 1.6142797520039136e-05, 'layer1': 256, 'layer2': 280, 'layer3': 62}. Best is trial 124 with value: 0.8095465376114227.

Escherichia_Coli | Ciprofloxacin | Optuna:  86%|████████▋ | 173/200 [7:02:29<1:17:46, 172.83s/it, best=0.809][A
Escherichia_Coli | Ciprofloxacin | Optuna:  86%|████████▋ | 173/200 [7:02:29<1:17:46, 172.83s/it, best=0.809][A[I 2026-02-27 21:50:32,426] Trial 187 finished with value: 0.859947637484983 and parameters: {'activation': 'relu', 'solver': 'adam', 'lr': 0.000333463993449916, 'layer1': 459, 'layer2': 411, 'layer3': 435}. Best is trial 126 with value: 0.8664911301660769.

Pseudomonas_Aeruginosa | Imipenem | Optuna:  94%|█████████▍| 188/200 [3:18:26<15:16, 76.37s/it, best=0.867][A
Pseudomonas_Aeruginosa | Imipenem | Optuna:  94%|█████████▍| 188/200 [3:18:26<15:16, 76.37s/it, best=0.867][A[I 2026-02-27 21:51:12,819] Trial 196 finished with value: 0.9076357104663364 and parameters: {'activation': 'identity', 'solver': 'adam', 'lr': 5.5136850773729795e-05, 'layer1': 337, 'layer2': 193, 'layer3': 452}. Best is trial 152 with value: 0.9102139153966748.

Staphylococcus_Aureus | Oxacillin | Optuna:  98%|█████████▊| 197/200 [7:03:42<06:12, 124.03s/it, best=0.91][A
Staphylococcus_Aureus | Oxacillin | Optuna:  98%|█████████▊| 197/200 [7:03:42<06:12, 124.03s/it, best=0.91][A[I 2026-02-27 21:51:21,063] Trial 34 finished with value: 0.90305320963681 and parameters: {'activation': 'identity', 'solver': 'adam', 'lr': 5.260883886025689e-05, 'layer1': 417, 'layer2': 309, 'layer3': 469}. Best is trial 25 with value: 0.9080365798965563.

Klebsiella_Pneumoniae | Ceftriaxone | Optuna:  18%|█▊        | 35/200 [1:00:42<5:10:09, 112.78s/it, best=0.908][A
Klebsiella_Pneumoniae | Ceftriaxone | Optuna:  18%|█▊        | 35/200 [1:00:42<5:10:09, 112.78s/it, best=0.908][A[I 2026-02-27 21:51:56,621] Trial 188 finished with value: 0.8626406797858943 and parameters: {'activation': 'relu', 'solver': 'adam', 'lr': 0.0001743259847316495, 'layer1': 386, 'layer2': 375, 'layer3': 453}. Best is trial 126 with value: 0.8664911301660769.

Pseudomonas_Aeruginosa | Imipenem | Optuna:  94%|█████████▍| 189/200 [3:19:50<14:25, 78.72s/it, best=0.867][A
Pseudomonas_Aeruginosa | Imipenem | Optuna:  94%|█████████▍| 189/200 [3:19:50<14:25, 78.72s/it, best=0.867][A[I 2026-02-27 21:52:00,323] Trial 35 finished with value: 0.782466545914998 and parameters: {'activation': 'logistic', 'solver': 'adam', 'lr': 7.811352829507434e-06, 'layer1': 369, 'layer2': 337, 'layer3': 412}. Best is trial 25 with value: 0.9080365798965563.

Klebsiella_Pneumoniae | Ceftriaxone | Optuna:  18%|█▊        | 36/200 [1:01:21<4:07:58, 90.73s/it, best=0.908] [A
Klebsiella_Pneumoniae | Ceftriaxone | Optuna:  18%|█▊        | 36/200 [1:01:21<4:07:58, 90.73s/it, best=0.908][A[I 2026-02-27 21:52:59,718] Trial 189 finished with value: 0.8551903774307469 and parameters: {'activation': 'relu', 'solver': 'adam', 'lr': 0.00040998578337055215, 'layer1': 334, 'layer2': 394, 'layer3': 436}. Best is trial 126 with value: 0.8664911301660769.

Pseudomonas_Aeruginosa | Imipenem | Optuna:  95%|█████████▌| 190/200 [3:20:53<12:20, 74.03s/it, best=0.867][A
Pseudomonas_Aeruginosa | Imipenem | Optuna:  95%|█████████▌| 190/200 [3:20:53<12:20, 74.03s/it, best=0.867][A[I 2026-02-27 21:53:03,062] Trial 173 finished with value: 0.8036521149139005 and parameters: {'activation': 'tanh', 'solver': 'adam', 'lr': 2.302795901985934e-05, 'layer1': 211, 'layer2': 300, 'layer3': 40}. Best is trial 124 with value: 0.8095465376114227.

Escherichia_Coli | Ciprofloxacin | Optuna:  87%|████████▋ | 174/200 [7:05:32<1:16:08, 175.71s/it, best=0.809][A
Escherichia_Coli | Ciprofloxacin | Optuna:  87%|████████▋ | 174/200 [7:05:32<1:16:08, 175.71s/it, best=0.809][A[I 2026-02-27 21:53:41,678] Trial 197 finished with value: 0.9063343035637784 and parameters: {'activation': 'identity', 'solver': 'adam', 'lr': 7.484005864590733e-05, 'layer1': 329, 'layer2': 445, 'layer3': 479}. Best is trial 152 with value: 0.9102139153966748.

Staphylococcus_Aureus | Oxacillin | Optuna:  99%|█████████▉| 198/200 [7:06:11<04:22, 131.48s/it, best=0.91][A
Staphylococcus_Aureus | Oxacillin | Optuna:  99%|█████████▉| 198/200 [7:06:11<04:22, 131.48s/it, best=0.91][A[I 2026-02-27 21:53:58,799] Trial 36 finished with value: 0.903178284966258 and parameters: {'activation': 'relu', 'solver': 'adam', 'lr': 0.0001776841755575057, 'layer1': 290, 'layer2': 281, 'layer3': 455}. Best is trial 25 with value: 0.9080365798965563.

Klebsiella_Pneumoniae | Ceftriaxone | Optuna:  18%|█▊        | 37/200 [1:03:20<4:29:05, 99.05s/it, best=0.908][A
Klebsiella_Pneumoniae | Ceftriaxone | Optuna:  18%|█▊        | 37/200 [1:03:20<4:29:05, 99.05s/it, best=0.908][A[I 2026-02-27 21:54:16,835] Trial 190 finished with value: 0.8627450945859547 and parameters: {'activation': 'relu', 'solver': 'adam', 'lr': 0.0002671862735626084, 'layer1': 401, 'layer2': 340, 'layer3': 385}. Best is trial 126 with value: 0.8664911301660769.

Pseudomonas_Aeruginosa | Imipenem | Optuna:  96%|█████████▌| 191/200 [3:22:11<11:14, 74.96s/it, best=0.867][A
Pseudomonas_Aeruginosa | Imipenem | Optuna:  96%|█████████▌| 191/200 [3:22:11<11:14, 74.96s/it, best=0.867][A[I 2026-02-27 21:55:32,040] Trial 191 finished with value: 0.8625848731888001 and parameters: {'activation': 'relu', 'solver': 'adam', 'lr': 0.00022077276390857346, 'layer1': 471, 'layer2': 329, 'layer3': 299}. Best is trial 126 with value: 0.8664911301660769.

Pseudomonas_Aeruginosa | Imipenem | Optuna:  96%|█████████▌| 192/200 [3:23:26<10:00, 75.03s/it, best=0.867][A
Pseudomonas_Aeruginosa | Imipenem | Optuna:  96%|█████████▌| 192/200 [3:23:26<10:00, 75.03s/it, best=0.867][A[I 2026-02-27 21:55:47,420] Trial 198 finished with value: 0.906659335084832 and parameters: {'activation': 'identity', 'solver': 'adam', 'lr': 0.00010776255493533118, 'layer1': 253, 'layer2': 432, 'layer3': 494}. Best is trial 152 with value: 0.9102139153966748.

Staphylococcus_Aureus | Oxacillin | Optuna: 100%|█████████▉| 199/200 [7:08:17<02:09, 129.76s/it, best=0.91][A
Staphylococcus_Aureus | Oxacillin | Optuna: 100%|█████████▉| 199/200 [7:08:17<02:09, 129.76s/it, best=0.91][A[I 2026-02-27 21:55:50,903] Trial 37 finished with value: 0.8951666170270263 and parameters: {'activation': 'identity', 'solver': 'adam', 'lr': 2.0073911831863086e-05, 'layer1': 445, 'layer2': 234, 'layer3': 139}. Best is trial 25 with value: 0.9080365798965563.

Klebsiella_Pneumoniae | Ceftriaxone | Optuna:  19%|█▉        | 38/200 [1:05:12<4:38:00, 102.97s/it, best=0.908][A
Klebsiella_Pneumoniae | Ceftriaxone | Optuna:  19%|█▉        | 38/200 [1:05:12<4:38:00, 102.97s/it, best=0.908][A[I 2026-02-27 21:56:43,535] Trial 174 finished with value: 0.8000096189650152 and parameters: {'activation': 'tanh', 'solver': 'adam', 'lr': 1.2972014969926037e-05, 'layer1': 276, 'layer2': 254, 'layer3': 94}. Best is trial 124 with value: 0.8095465376114227.

Escherichia_Coli | Ciprofloxacin | Optuna:  88%|████████▊ | 175/200 [7:09:12<1:18:48, 189.14s/it, best=0.809][A
Escherichia_Coli | Ciprofloxacin | Optuna:  88%|████████▊ | 175/200 [7:09:12<1:18:48, 189.14s/it, best=0.809][A[I 2026-02-27 21:56:54,098] Trial 192 finished with value: 0.8639910884195248 and parameters: {'activation': 'relu', 'solver': 'adam', 'lr': 0.0001931114671733077, 'layer1': 325, 'layer2': 352, 'layer3': 242}. Best is trial 126 with value: 0.8664911301660769.

Pseudomonas_Aeruginosa | Imipenem | Optuna:  96%|█████████▋| 193/200 [3:24:48<08:59, 77.14s/it, best=0.867][A
Pseudomonas_Aeruginosa | Imipenem | Optuna:  96%|█████████▋| 193/200 [3:24:48<08:59, 77.14s/it, best=0.867][A[I 2026-02-27 21:57:35,335] Trial 38 finished with value: 0.7315644470126023 and parameters: {'activation': 'identity', 'solver': 'sgd', 'lr': 7.002224751515646e-05, 'layer1': 404, 'layer2': 420, 'layer3': 346}. Best is trial 25 with value: 0.9080365798965563.

Klebsiella_Pneumoniae | Ceftriaxone | Optuna:  20%|█▉        | 39/200 [1:06:56<4:37:28, 103.41s/it, best=0.908][A
