Klebsiella_Pneumoniae | Meropenem | Optuna:  96%|█████████▋| 193/200 [2:43:47<05:21, 45.87s/it, best=0.985][A[I 2026-02-28 08:43:24,251] Trial 65 finished with value: 0.8669592494429758 and parameters: {'activation': 'identity', 'solver': 'adam', 'lr': 0.00014739674632785452, 'layer1': 492, 'layer2': 388, 'layer3': 128}. Best is trial 65 with value: 0.8669592494429758.
Pseudomonas_Aeruginosa | DirectMulti | Optuna:  33%|███▎      | 66/200 [1:47:10<4:01:23, 108.09s/it, best=0.866]Pseudomonas_Aeruginosa | DirectMulti | Optuna:  33%|███▎      | 66/200 [1:47:10<4:01:23, 108.09s/it, best=0.867]/export/usuarios01/egarroyo/MALDI_for_AMR_prediction/venv/lib/python3.13/site-packages/sklearn/model_selection/_split.py:813: UserWarning: The least populated class in y has only 4 members, which is less than n_splits=5.
  warnings.warn(
[I 2026-02-28 08:43:31,346] Trial 193 finished with value: 0.9767069569332589 and parameters: {'activation': 'logistic', 'solver': 'adam', 'lr': 0.0009243831364878071, 'layer1': 111, 'layer2': 325, 'layer3': 94}. Best is trial 161 with value: 0.9845171402894224.

Klebsiella_Pneumoniae | Meropenem | Optuna:  97%|█████████▋| 194/200 [2:44:11<03:55, 39.33s/it, best=0.985][A
Klebsiella_Pneumoniae | Meropenem | Optuna:  97%|█████████▋| 194/200 [2:44:11<03:55, 39.33s/it, best=0.985][A[I 2026-02-28 08:43:44,350] Trial 15 finished with value: 0.8851309464821806 and parameters: {'activation': 'identity', 'solver': 'adam', 'lr': 0.0035569563031038675, 'layer1': 324, 'layer2': 397, 'layer3': 236}. Best is trial 8 with value: 0.8879562150966016.
Staphylococcus_Aureus | LPS | Optuna:   8%|▊         | 16/200 [37:30<7:53:37, 154.44s/it, best=0.888]Staphylococcus_Aureus | LPS | Optuna:   8%|▊         | 16/200 [37:30<7:53:37, 154.44s/it, best=0.888][I 2026-02-28 08:44:11,681] Trial 194 finished with value: 0.9798558282622597 and parameters: {'activation': 'tanh', 'solver': 'adam', 'lr': 0.0014167971464665047, 'layer1': 330, 'layer2': 291, 'layer3': 102}. Best is trial 161 with value: 0.9845171402894224.

Klebsiella_Pneumoniae | Meropenem | Optuna:  98%|█████████▊| 195/200 [2:44:52<03:18, 39.63s/it, best=0.985][A
Klebsiella_Pneumoniae | Meropenem | Optuna:  98%|█████████▊| 195/200 [2:44:52<03:18, 39.63s/it, best=0.985][A[I 2026-02-28 08:44:33,179] Trial 66 finished with value: 0.8601680396077335 and parameters: {'activation': 'tanh', 'solver': 'adam', 'lr': 0.00013809799574344847, 'layer1': 489, 'layer2': 385, 'layer3': 127}. Best is trial 65 with value: 0.8669592494429758.
Pseudomonas_Aeruginosa | DirectMulti | Optuna:  34%|███▎      | 67/200 [1:48:19<3:33:33, 96.34s/it, best=0.867] Pseudomonas_Aeruginosa | DirectMulti | Optuna:  34%|███▎      | 67/200 [1:48:19<3:33:33, 96.34s/it, best=0.867]/export/usuarios01/egarroyo/MALDI_for_AMR_prediction/venv/lib/python3.13/site-packages/sklearn/model_selection/_split.py:813: UserWarning: The least populated class in y has only 4 members, which is less than n_splits=5.
  warnings.warn(
[I 2026-02-28 08:44:45,680] Trial 21 finished with value: 0.9140323521093153 and parameters: {'activation': 'tanh', 'solver': 'adam', 'lr': 5.551359264911533e-05, 'layer1': 489, 'layer2': 83, 'layer3': 394}. Best is trial 16 with value: 0.9144489703452822.

Escherichia_Coli | Piperacillin-Tazobactam | Optuna:  11%|█         | 22/200 [40:38<6:04:41, 122.93s/it, best=0.914][A
Escherichia_Coli | Piperacillin-Tazobactam | Optuna:  11%|█         | 22/200 [40:38<6:04:41, 122.93s/it, best=0.914][A[I 2026-02-28 08:45:00,125] Trial 195 finished with value: 0.9805524148362078 and parameters: {'activation': 'tanh', 'solver': 'adam', 'lr': 0.0007017047973760938, 'layer1': 318, 'layer2': 317, 'layer3': 75}. Best is trial 161 with value: 0.9845171402894224.

Klebsiella_Pneumoniae | Meropenem | Optuna:  98%|█████████▊| 196/200 [2:45:40<02:49, 42.28s/it, best=0.985][A
Klebsiella_Pneumoniae | Meropenem | Optuna:  98%|█████████▊| 196/200 [2:45:40<02:49, 42.28s/it, best=0.985][A[I 2026-02-28 08:45:31,032] Trial 196 finished with value: 0.9796994947054969 and parameters: {'activation': 'identity', 'solver': 'adam', 'lr': 0.001066691840955283, 'layer1': 133, 'layer2': 308, 'layer3': 63}. Best is trial 161 with value: 0.9845171402894224.

Klebsiella_Pneumoniae | Meropenem | Optuna:  98%|█████████▊| 197/200 [2:46:11<01:56, 38.87s/it, best=0.985][A
Klebsiella_Pneumoniae | Meropenem | Optuna:  98%|█████████▊| 197/200 [2:46:11<01:56, 38.87s/it, best=0.985][A[I 2026-02-28 08:46:19,986] Trial 197 finished with value: 0.9809381777124033 and parameters: {'activation': 'tanh', 'solver': 'adam', 'lr': 0.0008025583117526743, 'layer1': 305, 'layer2': 355, 'layer3': 84}. Best is trial 161 with value: 0.9845171402894224.

Klebsiella_Pneumoniae | Meropenem | Optuna:  99%|█████████▉| 198/200 [2:47:00<01:23, 41.89s/it, best=0.985][A
Klebsiella_Pneumoniae | Meropenem | Optuna:  99%|█████████▉| 198/200 [2:47:00<01:23, 41.89s/it, best=0.985][A[I 2026-02-28 08:46:22,969] Trial 16 finished with value: 0.8834812871853271 and parameters: {'activation': 'identity', 'solver': 'adam', 'lr': 6.547325059262442e-05, 'layer1': 193, 'layer2': 382, 'layer3': 379}. Best is trial 8 with value: 0.8879562150966016.
Staphylococcus_Aureus | LPS | Optuna:   8%|▊         | 17/200 [40:09<7:54:52, 155.70s/it, best=0.888]Staphylococcus_Aureus | LPS | Optuna:   8%|▊         | 17/200 [40:09<7:54:52, 155.70s/it, best=0.888][I 2026-02-28 08:46:44,718] Trial 22 finished with value: 0.9119384260789563 and parameters: {'activation': 'tanh', 'solver': 'adam', 'lr': 4.171603788807969e-05, 'layer1': 452, 'layer2': 80, 'layer3': 400}. Best is trial 16 with value: 0.9144489703452822.

Escherichia_Coli | Piperacillin-Tazobactam | Optuna:  12%|█▏        | 23/200 [42:37<5:59:12, 121.76s/it, best=0.914][A
Escherichia_Coli | Piperacillin-Tazobactam | Optuna:  12%|█▏        | 23/200 [42:37<5:59:12, 121.76s/it, best=0.914][A[I 2026-02-28 08:46:48,743] Trial 198 finished with value: 0.978789818452851 and parameters: {'activation': 'tanh', 'solver': 'adam', 'lr': 0.0018931754495949923, 'layer1': 40, 'layer2': 333, 'layer3': 110}. Best is trial 161 with value: 0.9845171402894224.

Klebsiella_Pneumoniae | Meropenem | Optuna: 100%|█████████▉| 199/200 [2:47:29<00:37, 37.95s/it, best=0.985][A
Klebsiella_Pneumoniae | Meropenem | Optuna: 100%|█████████▉| 199/200 [2:47:29<00:37, 37.95s/it, best=0.985][A[I 2026-02-28 08:47:35,179] Trial 199 finished with value: 0.9702801436635452 and parameters: {'activation': 'tanh', 'solver': 'sgd', 'lr': 0.000585118183316032, 'layer1': 309, 'layer2': 299, 'layer3': 95}. Best is trial 161 with value: 0.9845171402894224.

Klebsiella_Pneumoniae | Meropenem | Optuna: 100%|██████████| 200/200 [2:48:15<00:00, 40.50s/it, best=0.985][A
Klebsiella_Pneumoniae | Meropenem | Optuna: 100%|██████████| 200/200 [2:48:15<00:00, 40.50s/it, best=0.985][A
                                                                                                           [A[Klebsiella_Pneumoniae | Meropenem] [OPTUNA DONE] Best CV WF1=0.9845 | params={'activation': 'tanh', 'solver': 'adam', 'lr': 0.0006818289798983198, 'layer1': 152, 'layer2': 310, 'layer3': 78}
[Klebsiella_Pneumoniae | Meropenem] Retraining with validation early stopping (10% split)...
[Klebsiella_Pneumoniae | Meropenem] [TEST] WF1=0.9785 | ACC=0.9804 | HL=0.0196 | best_val_WF1=0.9762
Klebsiella_Pneumoniae | Binary antibiotics: 100%|██████████| 4/4 [18:00:13<00:00, 14056.76s/it]  Klebsiella_Pneumoniae | Binary antibiotics: 100%|██████████| 4/4 [18:00:13<00:00, 16203.38s/it]

[Klebsiella_Pneumoniae] ===== LPS multiclass training (patterns) =====
[Klebsiella_Pneumoniae] LPS classes (patterns) on train: 7
[I 2026-02-28 08:47:43,941] A new study created in memory with name: no-name-bac9cf57-1286-4c5d-94c9-e4de06844ba7
Klebsiella_Pneumoniae | LPS | Optuna:   0%|          | 0/200 [00:00<?, ?it/s][I 2026-02-28 08:48:15,201] Trial 0 finished with value: 0.6266603115446941 and parameters: {'activation': 'logistic', 'solver': 'sgd', 'lr': 1.7073967431528114e-06, 'layer1': 435, 'layer2': 305, 'layer3': 357}. Best is trial 0 with value: 0.6266603115446941.
Klebsiella_Pneumoniae | LPS | Optuna:   0%|          | 1/200 [00:31<1:43:40, 31.26s/it]Klebsiella_Pneumoniae | LPS | Optuna:   0%|          | 1/200 [00:31<1:43:40, 31.26s/it, best=0.627][I 2026-02-28 08:48:26,016] Trial 23 finished with value: 0.9097200475022793 and parameters: {'activation': 'tanh', 'solver': 'adam', 'lr': 0.0003324660431103181, 'layer1': 363, 'layer2': 103, 'layer3': 310}. Best is trial 16 with value: 0.9144489703452822.

Escherichia_Coli | Piperacillin-Tazobactam | Optuna:  12%|█▏        | 24/200 [44:18<5:39:09, 115.62s/it, best=0.914][A
Escherichia_Coli | Piperacillin-Tazobactam | Optuna:  12%|█▏        | 24/200 [44:18<5:39:09, 115.62s/it, best=0.914][A[I 2026-02-28 08:48:50,974] Trial 1 finished with value: 0.8702461473038209 and parameters: {'activation': 'logistic', 'solver': 'adam', 'lr': 1.6480446427978994e-05, 'layer1': 267, 'layer2': 222, 'layer3': 152}. Best is trial 1 with value: 0.8702461473038209.
Klebsiella_Pneumoniae | LPS | Optuna:   1%|          | 2/200 [01:07<1:51:55, 33.91s/it, best=0.627]Klebsiella_Pneumoniae | LPS | Optuna:   1%|          | 2/200 [01:07<1:51:55, 33.91s/it, best=0.87] [I 2026-02-28 08:49:17,347] Trial 17 finished with value: 0.8850221020803888 and parameters: {'activation': 'identity', 'solver': 'adam', 'lr': 0.000921749190177906, 'layer1': 450, 'layer2': 426, 'layer3': 485}. Best is trial 8 with value: 0.8879562150966016.
Staphylococcus_Aureus | LPS | Optuna:   9%|▉         | 18/200 [43:03<8:09:18, 161.31s/it, best=0.888]Staphylococcus_Aureus | LPS | Optuna:   9%|▉         | 18/200 [43:03<8:09:18, 161.31s/it, best=0.888][I 2026-02-28 08:49:56,619] Trial 18 finished with value: 0.8040981858091817 and parameters: {'activation': 'tanh', 'solver': 'sgd', 'lr': 0.002993703907495748, 'layer1': 316, 'layer2': 339, 'layer3': 285}. Best is trial 8 with value: 0.8879562150966016.
Staphylococcus_Aureus | LPS | Optuna:  10%|▉         | 19/200 [43:42<6:16:02, 124.66s/it, best=0.888]Staphylococcus_Aureus | LPS | Optuna:  10%|▉         | 19/200 [43:42<6:16:02, 124.66s/it, best=0.888][I 2026-02-28 08:50:02,493] Trial 24 finished with value: 0.904904333020777 and parameters: {'activation': 'tanh', 'solver': 'adam', 'lr': 0.0022361530523536373, 'layer1': 387, 'layer2': 201, 'layer3': 447}. Best is trial 16 with value: 0.9144489703452822.

Escherichia_Coli | Piperacillin-Tazobactam | Optuna:  12%|█▎        | 25/200 [45:55<5:20:28, 109.88s/it, best=0.914][A
Escherichia_Coli | Piperacillin-Tazobactam | Optuna:  12%|█▎        | 25/200 [45:55<5:20:28, 109.88s/it, best=0.914][A[I 2026-02-28 08:50:12,779] Trial 67 finished with value: 0.8240533160980215 and parameters: {'activation': 'identity', 'solver': 'sgd', 'lr': 7.65964398283892e-05, 'layer1': 500, 'layer2': 449, 'layer3': 179}. Best is trial 65 with value: 0.8669592494429758.
Pseudomonas_Aeruginosa | DirectMulti | Optuna:  34%|███▍      | 68/200 [1:53:59<6:12:29, 169.32s/it, best=0.867]Pseudomonas_Aeruginosa | DirectMulti | Optuna:  34%|███▍      | 68/200 [1:53:59<6:12:29, 169.32s/it, best=0.867]/export/usuarios01/egarroyo/MALDI_for_AMR_prediction/venv/lib/python3.13/site-packages/sklearn/model_selection/_split.py:813: UserWarning: The least populated class in y has only 4 members, which is less than n_splits=5.
  warnings.warn(
[I 2026-02-28 08:50:54,680] Trial 2 finished with value: 0.8971464417416122 and parameters: {'activation': 'identity', 'solver': 'adam', 'lr': 6.290644294586145e-06, 'layer1': 262, 'layer2': 300, 'layer3': 32}. Best is trial 2 with value: 0.8971464417416122.
Klebsiella_Pneumoniae | LPS | Optuna:   2%|▏         | 3/200 [03:10<4:05:58, 74.92s/it, best=0.87]Klebsiella_Pneumoniae | LPS | Optuna:   2%|▏         | 3/200 [03:10<4:05:58, 74.92s/it, best=0.897][I 2026-02-28 08:51:31,100] Trial 19 finished with value: 0.8189418992810769 and parameters: {'activation': 'logistic', 'solver': 'adam', 'lr': 8.686865419501421e-05, 'layer1': 400, 'layer2': 440, 'layer3': 176}. Best is trial 8 with value: 0.8879562150966016.
Staphylococcus_Aureus | LPS | Optuna:  10%|█         | 20/200 [45:17<5:46:47, 115.60s/it, best=0.888]Staphylococcus_Aureus | LPS | Optuna:  10%|█         | 20/200 [45:17<5:46:47, 115.60s/it, best=0.888][I 2026-02-28 08:51:53,384] Trial 68 finished with value: 0.8621398809252966 and parameters: {'activation': 'identity', 'solver': 'adam', 'lr': 0.0013089083159745036, 'layer1': 481, 'layer2': 422, 'layer3': 61}. Best is trial 65 with value: 0.8669592494429758.
Pseudomonas_Aeruginosa | DirectMulti | Optuna:  34%|███▍      | 69/200 [1:55:39<5:24:40, 148.70s/it, best=0.867]Pseudomonas_Aeruginosa | DirectMulti | Optuna:  34%|███▍      | 69/200 [1:55:39<5:24:40, 148.70s/it, best=0.867]/export/usuarios01/egarroyo/MALDI_for_AMR_prediction/venv/lib/python3.13/site-packages/sklearn/model_selection/_split.py:813: UserWarning: The least populated class in y has only 4 members, which is less than n_splits=5.
  warnings.warn(
[I 2026-02-28 08:53:06,851] Trial 25 finished with value: 0.9103797867686654 and parameters: {'activation': 'relu', 'solver': 'adam', 'lr': 4.4106313512541124e-05, 'layer1': 465, 'layer2': 65, 'layer3': 364}. Best is trial 16 with value: 0.9144489703452822.

Escherichia_Coli | Piperacillin-Tazobactam | Optuna:  13%|█▎        | 26/200 [48:59<6:23:27, 132.22s/it, best=0.914][A
Escherichia_Coli | Piperacillin-Tazobactam | Optuna:  13%|█▎        | 26/200 [48:59<6:23:27, 132.22s/it, best=0.914][A[I 2026-02-28 08:53:08,802] Trial 69 finished with value: 0.8564790705953824 and parameters: {'activation': 'logistic', 'solver': 'adam', 'lr': 0.0006940326343227004, 'layer1': 463, 'layer2': 288, 'layer3': 132}. Best is trial 65 with value: 0.8669592494429758.
Pseudomonas_Aeruginosa | DirectMulti | Optuna:  35%|███▌      | 70/200 [1:56:55<4:34:33, 126.72s/it, best=0.867]Pseudomonas_Aeruginosa | DirectMulti | Optuna:  35%|███▌      | 70/200 [1:56:55<4:34:33, 126.72s/it, best=0.867]/export/usuarios01/egarroyo/MALDI_for_AMR_prediction/venv/lib/python3.13/site-packages/sklearn/model_selection/_split.py:813: UserWarning: The least populated class in y has only 4 members, which is less than n_splits=5.
  warnings.warn(
[I 2026-02-28 08:53:09,628] Trial 3 finished with value: 0.8709512858596078 and parameters: {'activation': 'relu', 'solver': 'sgd', 'lr': 1.6536937182824424e-05, 'layer1': 57, 'layer2': 345, 'layer3': 226}. Best is trial 2 with value: 0.8971464417416122.
Klebsiella_Pneumoniae | LPS | Optuna:   2%|▏         | 4/200 [05:25<5:22:08, 98.62s/it, best=0.897]Klebsiella_Pneumoniae | LPS | Optuna:   2%|▏         | 4/200 [05:25<5:22:08, 98.62s/it, best=0.897][I 2026-02-28 08:53:15,599] Trial 20 finished with value: 0.8859430154620478 and parameters: {'activation': 'identity', 'solver': 'adam', 'lr': 0.0003140255160275796, 'layer1': 304, 'layer2': 119, 'layer3': 342}. Best is trial 8 with value: 0.8879562150966016.
Staphylococcus_Aureus | LPS | Optuna:  10%|█         | 21/200 [47:01<5:34:55, 112.27s/it, best=0.888]Staphylococcus_Aureus | LPS | Optuna:  10%|█         | 21/200 [47:01<5:34:55, 112.27s/it, best=0.888][I 2026-02-28 08:53:46,358] Trial 4 finished with value: 0.8711134619315135 and parameters: {'activation': 'relu', 'solver': 'adam', 'lr': 1.7654048052495086e-05, 'layer1': 265, 'layer2': 278, 'layer3': 100}. Best is trial 2 with value: 0.8971464417416122.
Klebsiella_Pneumoniae | LPS | Optuna:   2%|▎         | 5/200 [06:02<4:07:58, 76.30s/it, best=0.897]Klebsiella_Pneumoniae | LPS | Optuna:   2%|▎         | 5/200 [06:02<4:07:58, 76.30s/it, best=0.897][I 2026-02-28 08:53:46,620] Trial 26 finished with value: 0.8973123000815452 and parameters: {'activation': 'relu', 'solver': 'sgd', 'lr': 0.00024070288163804683, 'layer1': 308, 'layer2': 135, 'layer3': 420}. Best is trial 16 with value: 0.9144489703452822.

Escherichia_Coli | Piperacillin-Tazobactam | Optuna:  14%|█▎        | 27/200 [49:39<5:01:16, 104.49s/it, best=0.914][A
Escherichia_Coli | Piperacillin-Tazobactam | Optuna:  14%|█▎        | 27/200 [49:39<5:01:16, 104.49s/it, best=0.914][A[I 2026-02-28 08:54:53,785] Trial 70 finished with value: 0.8650725529368295 and parameters: {'activation': 'identity', 'solver': 'adam', 'lr': 0.00023236322990221144, 'layer1': 485, 'layer2': 467, 'layer3': 89}. Best is trial 65 with value: 0.8669592494429758.
Pseudomonas_Aeruginosa | DirectMulti | Optuna:  36%|███▌      | 71/200 [1:58:40<4:18:25, 120.20s/it, best=0.867]Pseudomonas_Aeruginosa | DirectMulti | Optuna:  36%|███▌      | 71/200 [1:58:40<4:18:25, 120.20s/it, best=0.867]/export/usuarios01/egarroyo/MALDI_for_AMR_prediction/venv/lib/python3.13/site-packages/sklearn/model_selection/_split.py:813: UserWarning: The least populated class in y has only 4 members, which is less than n_splits=5.
  warnings.warn(
[I 2026-02-28 08:55:01,463] Trial 27 finished with value: 0.9071789835062681 and parameters: {'activation': 'tanh', 'solver': 'adam', 'lr': 0.0006873507737550959, 'layer1': 401, 'layer2': 18, 'layer3': 286}. Best is trial 16 with value: 0.9144489703452822.

Escherichia_Coli | Piperacillin-Tazobactam | Optuna:  14%|█▍        | 28/200 [50:54<4:34:01, 95.59s/it, best=0.914] [A
Escherichia_Coli | Piperacillin-Tazobactam | Optuna:  14%|█▍        | 28/200 [50:54<4:34:01, 95.59s/it, best=0.914][A[I 2026-02-28 08:55:50,469] Trial 21 finished with value: 0.8867417429888118 and parameters: {'activation': 'identity', 'solver': 'adam', 'lr': 0.00034960596081395716, 'layer1': 303, 'layer2': 108, 'layer3': 342}. Best is trial 8 with value: 0.8879562150966016.
Staphylococcus_Aureus | LPS | Optuna:  11%|█         | 22/200 [49:36<6:10:59, 125.05s/it, best=0.888]Staphylococcus_Aureus | LPS | Optuna:  11%|█         | 22/200 [49:36<6:10:59, 125.05s/it, best=0.888][I 2026-02-28 08:55:53,570] Trial 5 finished with value: 0.8831248832993628 and parameters: {'activation': 'identity', 'solver': 'adam', 'lr': 2.259279742015697e-06, 'layer1': 106, 'layer2': 32, 'layer3': 169}. Best is trial 2 with value: 0.8971464417416122.
Klebsiella_Pneumoniae | LPS | Optuna:   3%|▎         | 6/200 [08:09<5:02:40, 93.61s/it, best=0.897]Klebsiella_Pneumoniae | LPS | Optuna:   3%|▎         | 6/200 [08:09<5:02:40, 93.61s/it, best=0.897][I 2026-02-28 08:55:58,019] Trial 28 finished with value: 0.8958344038173316 and parameters: {'activation': 'logistic', 'solver': 'adam', 'lr': 5.520350166411609e-05, 'layer1': 495, 'layer2': 164, 'layer3': 465}. Best is trial 16 with value: 0.9144489703452822.

Escherichia_Coli | Piperacillin-Tazobactam | Optuna:  14%|█▍        | 29/200 [51:50<3:59:03, 83.88s/it, best=0.914][A
Escherichia_Coli | Piperacillin-Tazobactam | Optuna:  14%|█▍        | 29/200 [51:50<3:59:03, 83.88s/it, best=0.914][A[I 2026-02-28 08:56:38,041] Trial 71 finished with value: 0.8643390184580936 and parameters: {'activation': 'identity', 'solver': 'adam', 'lr': 0.00026338624907852875, 'layer1': 483, 'layer2': 464, 'layer3': 84}. Best is trial 65 with value: 0.8669592494429758.
Pseudomonas_Aeruginosa | DirectMulti | Optuna:  36%|███▌      | 72/200 [2:00:24<4:06:13, 115.42s/it, best=0.867]Pseudomonas_Aeruginosa | DirectMulti | Optuna:  36%|███▌      | 72/200 [2:00:24<4:06:13, 115.42s/it, best=0.867]/export/usuarios01/egarroyo/MALDI_for_AMR_prediction/venv/lib/python3.13/site-packages/sklearn/model_selection/_split.py:813: UserWarning: The least populated class in y has only 4 members, which is less than n_splits=5.
  warnings.warn(
[I 2026-02-28 08:56:40,718] Trial 29 finished with value: 0.8958344038173316 and parameters: {'activation': 'logistic', 'solver': 'sgd', 'lr': 0.0028222059774847957, 'layer1': 424, 'layer2': 249, 'layer3': 355}. Best is trial 16 with value: 0.9144489703452822.

Escherichia_Coli | Piperacillin-Tazobactam | Optuna:  15%|█▌        | 30/200 [52:33<3:22:39, 71.53s/it, best=0.914][A
Escherichia_Coli | Piperacillin-Tazobactam | Optuna:  15%|█▌        | 30/200 [52:33<3:22:39, 71.53s/it, best=0.914][A[I 2026-02-28 08:57:27,012] Trial 22 finished with value: 0.884055035268618 and parameters: {'activation': 'identity', 'solver': 'adam', 'lr': 0.0005953936167965904, 'layer1': 221, 'layer2': 99, 'layer3': 421}. Best is trial 8 with value: 0.8879562150966016.
Staphylococcus_Aureus | LPS | Optuna:  12%|█▏        | 23/200 [51:13<5:43:39, 116.50s/it, best=0.888]Staphylococcus_Aureus | LPS | Optuna:  12%|█▏        | 23/200 [51:13<5:43:39, 116.50s/it, best=0.888][I 2026-02-28 08:58:18,957] Trial 72 finished with value: 0.8625960421062885 and parameters: {'activation': 'identity', 'solver': 'adam', 'lr': 9.22575658230855e-05, 'layer1': 450, 'layer2': 484, 'layer3': 161}. Best is trial 65 with value: 0.8669592494429758.
Pseudomonas_Aeruginosa | DirectMulti | Optuna:  36%|███▋      | 73/200 [2:02:05<3:55:05, 111.07s/it, best=0.867]Pseudomonas_Aeruginosa | DirectMulti | Optuna:  36%|███▋      | 73/200 [2:02:05<3:55:05, 111.07s/it, best=0.867]/export/usuarios01/egarroyo/MALDI_for_AMR_prediction/venv/lib/python3.13/site-packages/sklearn/model_selection/_split.py:813: UserWarning: The least populated class in y has only 4 members, which is less than n_splits=5.
  warnings.warn(
[I 2026-02-28 08:59:28,901] Trial 30 finished with value: 0.9129340771456274 and parameters: {'activation': 'relu', 'solver': 'adam', 'lr': 7.27004647362587e-05, 'layer1': 460, 'layer2': 54, 'layer3': 389}. Best is trial 16 with value: 0.9144489703452822.

Escherichia_Coli | Piperacillin-Tazobactam | Optuna:  16%|█▌        | 31/200 [55:21<4:43:08, 100.52s/it, best=0.914][A
