[I 2026-02-28 10:20:50,783] Trial 62 finished with value: 0.9153123957197387 and parameters: {'activation': 'relu', 'solver': 'adam', 'lr': 0.00019070200645633276, 'layer1': 341, 'layer2': 317, 'layer3': 141}. Best is trial 61 with value: 0.9154206699278487.

Escherichia_Coli | Piperacillin-Tazobactam | Optuna:  32%|███▏      | 63/200 [2:16:43<5:36:08, 147.22s/it, best=0.915][A
Escherichia_Coli | Piperacillin-Tazobactam | Optuna:  32%|███▏      | 63/200 [2:16:43<5:36:08, 147.22s/it, best=0.915][A[I 2026-02-28 10:20:59,899] Trial 59 finished with value: 0.8863232337114366 and parameters: {'activation': 'identity', 'solver': 'adam', 'lr': 0.00023946760555919013, 'layer1': 443, 'layer2': 105, 'layer3': 123}. Best is trial 8 with value: 0.8879562150966016.
Staphylococcus_Aureus | LPS | Optuna:  30%|███       | 60/200 [2:14:46<5:18:38, 136.56s/it, best=0.888]Staphylococcus_Aureus | LPS | Optuna:  30%|███       | 60/200 [2:14:46<5:18:38, 136.56s/it, best=0.888][I 2026-02-28 10:21:54,703] Trial 55 finished with value: 0.9228851961645702 and parameters: {'activation': 'identity', 'solver': 'adam', 'lr': 0.00018520154228568163, 'layer1': 183, 'layer2': 359, 'layer3': 49}. Best is trial 23 with value: 0.9252230330428246.
Klebsiella_Pneumoniae | LPS | Optuna:  28%|██▊       | 56/200 [1:34:10<3:27:44, 86.56s/it, best=0.925]Klebsiella_Pneumoniae | LPS | Optuna:  28%|██▊       | 56/200 [1:34:10<3:27:44, 86.56s/it, best=0.925][I 2026-02-28 10:22:25,177] Trial 116 finished with value: 0.8486953265324194 and parameters: {'activation': 'identity', 'solver': 'adam', 'lr': 2.6673884792129703e-05, 'layer1': 423, 'layer2': 241, 'layer3': 179}. Best is trial 102 with value: 0.8672439264969375.
Pseudomonas_Aeruginosa | DirectMulti | Optuna:  58%|█████▊    | 117/200 [3:26:11<2:43:15, 118.02s/it, best=0.867]Pseudomonas_Aeruginosa | DirectMulti | Optuna:  58%|█████▊    | 117/200 [3:26:11<2:43:15, 118.02s/it, best=0.867]/export/usuarios01/egarroyo/MALDI_for_AMR_prediction/venv/lib/python3.13/site-packages/sklearn/model_selection/_split.py:813: UserWarning: The least populated class in y has only 4 members, which is less than n_splits=5.
  warnings.warn(
[I 2026-02-28 10:23:09,790] Trial 63 finished with value: 0.915273851534019 and parameters: {'activation': 'relu', 'solver': 'adam', 'lr': 0.00026265825201901224, 'layer1': 347, 'layer2': 311, 'layer3': 144}. Best is trial 61 with value: 0.9154206699278487.

Escherichia_Coli | Piperacillin-Tazobactam | Optuna:  32%|███▏      | 64/200 [2:19:02<5:28:06, 144.75s/it, best=0.915][A
Escherichia_Coli | Piperacillin-Tazobactam | Optuna:  32%|███▏      | 64/200 [2:19:02<5:28:06, 144.75s/it, best=0.915][A[I 2026-02-28 10:23:13,969] Trial 60 finished with value: 0.8859767887337263 and parameters: {'activation': 'identity', 'solver': 'adam', 'lr': 0.0002365385376325901, 'layer1': 498, 'layer2': 96, 'layer3': 46}. Best is trial 8 with value: 0.8879562150966016.
Staphylococcus_Aureus | LPS | Optuna:  30%|███       | 61/200 [2:17:00<5:14:38, 135.81s/it, best=0.888]Staphylococcus_Aureus | LPS | Optuna:  30%|███       | 61/200 [2:17:00<5:14:38, 135.81s/it, best=0.888][I 2026-02-28 10:23:16,630] Trial 56 finished with value: 0.91871864411975 and parameters: {'activation': 'identity', 'solver': 'adam', 'lr': 6.892127714329487e-05, 'layer1': 32, 'layer2': 411, 'layer3': 15}. Best is trial 23 with value: 0.9252230330428246.
Klebsiella_Pneumoniae | LPS | Optuna:  28%|██▊       | 57/200 [1:35:32<3:22:58, 85.17s/it, best=0.925]Klebsiella_Pneumoniae | LPS | Optuna:  28%|██▊       | 57/200 [1:35:32<3:22:58, 85.17s/it, best=0.925][I 2026-02-28 10:24:16,387] Trial 57 finished with value: 0.9238926219288857 and parameters: {'activation': 'identity', 'solver': 'adam', 'lr': 0.00045873674042166344, 'layer1': 100, 'layer2': 315, 'layer3': 40}. Best is trial 23 with value: 0.9252230330428246.
Klebsiella_Pneumoniae | LPS | Optuna:  29%|██▉       | 58/200 [1:36:32<3:03:31, 77.54s/it, best=0.925]Klebsiella_Pneumoniae | LPS | Optuna:  29%|██▉       | 58/200 [1:36:32<3:03:31, 77.54s/it, best=0.925][I 2026-02-28 10:24:41,034] Trial 58 finished with value: 0.8706932280311135 and parameters: {'activation': 'identity', 'solver': 'sgd', 'lr': 0.0018251783980106826, 'layer1': 170, 'layer2': 343, 'layer3': 64}. Best is trial 23 with value: 0.9252230330428246.
Klebsiella_Pneumoniae | LPS | Optuna:  30%|██▉       | 59/200 [1:36:57<2:24:56, 61.67s/it, best=0.925]Klebsiella_Pneumoniae | LPS | Optuna:  30%|██▉       | 59/200 [1:36:57<2:24:56, 61.67s/it, best=0.925][I 2026-02-28 10:25:08,013] Trial 59 finished with value: 0.8702461473038209 and parameters: {'activation': 'logistic', 'solver': 'adam', 'lr': 0.0001498329309192885, 'layer1': 120, 'layer2': 255, 'layer3': 85}. Best is trial 23 with value: 0.9252230330428246.
Klebsiella_Pneumoniae | LPS | Optuna:  30%|███       | 60/200 [1:37:24<1:59:37, 51.27s/it, best=0.925]Klebsiella_Pneumoniae | LPS | Optuna:  30%|███       | 60/200 [1:37:24<1:59:37, 51.27s/it, best=0.925][I 2026-02-28 10:25:50,801] Trial 61 finished with value: 0.8823590259069676 and parameters: {'activation': 'identity', 'solver': 'adam', 'lr': 8.973503422126405e-05, 'layer1': 440, 'layer2': 124, 'layer3': 126}. Best is trial 8 with value: 0.8879562150966016.
Staphylococcus_Aureus | LPS | Optuna:  31%|███       | 62/200 [2:19:37<5:26:52, 142.12s/it, best=0.888]Staphylococcus_Aureus | LPS | Optuna:  31%|███       | 62/200 [2:19:37<5:26:52, 142.12s/it, best=0.888][I 2026-02-28 10:25:53,477] Trial 64 finished with value: 0.915999331951523 and parameters: {'activation': 'relu', 'solver': 'adam', 'lr': 0.00015268235956483316, 'layer1': 332, 'layer2': 319, 'layer3': 141}. Best is trial 64 with value: 0.915999331951523.

Escherichia_Coli | Piperacillin-Tazobactam | Optuna:  32%|███▎      | 65/200 [2:21:46<5:38:28, 150.43s/it, best=0.915][A
Escherichia_Coli | Piperacillin-Tazobactam | Optuna:  32%|███▎      | 65/200 [2:21:46<5:38:28, 150.43s/it, best=0.916][A[I 2026-02-28 10:26:38,738] Trial 60 finished with value: 0.9133047560707294 and parameters: {'activation': 'identity', 'solver': 'adam', 'lr': 3.779332360095546e-05, 'layer1': 249, 'layer2': 366, 'layer3': 108}. Best is trial 23 with value: 0.9252230330428246.
Klebsiella_Pneumoniae | LPS | Optuna:  30%|███       | 61/200 [1:38:54<2:26:11, 63.10s/it, best=0.925]Klebsiella_Pneumoniae | LPS | Optuna:  30%|███       | 61/200 [1:38:54<2:26:11, 63.10s/it, best=0.925][I 2026-02-28 10:27:43,366] Trial 61 finished with value: 0.9235464470998863 and parameters: {'activation': 'identity', 'solver': 'adam', 'lr': 0.0002469139287934554, 'layer1': 69, 'layer2': 340, 'layer3': 63}. Best is trial 23 with value: 0.9252230330428246.
Klebsiella_Pneumoniae | LPS | Optuna:  31%|███       | 62/200 [1:39:59<2:26:11, 63.56s/it, best=0.925]Klebsiella_Pneumoniae | LPS | Optuna:  31%|███       | 62/200 [1:39:59<2:26:11, 63.56s/it, best=0.925][I 2026-02-28 10:28:02,621] Trial 65 finished with value: 0.9156565461311796 and parameters: {'activation': 'relu', 'solver': 'adam', 'lr': 0.0002756532882123271, 'layer1': 339, 'layer2': 310, 'layer3': 145}. Best is trial 64 with value: 0.915999331951523.

Escherichia_Coli | Piperacillin-Tazobactam | Optuna:  33%|███▎      | 66/200 [2:23:55<5:21:42, 144.05s/it, best=0.916][A
Escherichia_Coli | Piperacillin-Tazobactam | Optuna:  33%|███▎      | 66/200 [2:23:55<5:21:42, 144.05s/it, best=0.916][A[I 2026-02-28 10:28:12,950] Trial 62 finished with value: 0.8869165903016466 and parameters: {'activation': 'identity', 'solver': 'adam', 'lr': 0.0003478978508098654, 'layer1': 412, 'layer2': 113, 'layer3': 106}. Best is trial 8 with value: 0.8879562150966016.
Staphylococcus_Aureus | LPS | Optuna:  32%|███▏      | 63/200 [2:21:59<5:24:31, 142.13s/it, best=0.888]Staphylococcus_Aureus | LPS | Optuna:  32%|███▏      | 63/200 [2:21:59<5:24:31, 142.13s/it, best=0.888][I 2026-02-28 10:28:30,111] Trial 117 finished with value: 0.7402286927674714 and parameters: {'activation': 'identity', 'solver': 'sgd', 'lr': 3.015869080292595e-05, 'layer1': 466, 'layer2': 438, 'layer3': 152}. Best is trial 102 with value: 0.8672439264969375.
Pseudomonas_Aeruginosa | DirectMulti | Optuna:  59%|█████▉    | 118/200 [3:32:16<4:22:31, 192.09s/it, best=0.867]Pseudomonas_Aeruginosa | DirectMulti | Optuna:  59%|█████▉    | 118/200 [3:32:16<4:22:31, 192.09s/it, best=0.867]/export/usuarios01/egarroyo/MALDI_for_AMR_prediction/venv/lib/python3.13/site-packages/sklearn/model_selection/_split.py:813: UserWarning: The least populated class in y has only 4 members, which is less than n_splits=5.
  warnings.warn(
[I 2026-02-28 10:29:04,918] Trial 62 finished with value: 0.9246232788477855 and parameters: {'activation': 'identity', 'solver': 'adam', 'lr': 0.000406970246487733, 'layer1': 135, 'layer2': 228, 'layer3': 147}. Best is trial 23 with value: 0.9252230330428246.
Klebsiella_Pneumoniae | LPS | Optuna:  32%|███▏      | 63/200 [1:41:20<2:37:27, 68.96s/it, best=0.925]Klebsiella_Pneumoniae | LPS | Optuna:  32%|███▏      | 63/200 [1:41:20<2:37:27, 68.96s/it, best=0.925][I 2026-02-28 10:30:03,298] Trial 63 finished with value: 0.8839446661329505 and parameters: {'activation': 'identity', 'solver': 'adam', 'lr': 0.0003513010556162428, 'layer1': 457, 'layer2': 202, 'layer3': 100}. Best is trial 8 with value: 0.8879562150966016.
Staphylococcus_Aureus | LPS | Optuna:  32%|███▏      | 64/200 [2:23:49<5:00:32, 132.59s/it, best=0.888]Staphylococcus_Aureus | LPS | Optuna:  32%|███▏      | 64/200 [2:23:49<5:00:32, 132.59s/it, best=0.888][I 2026-02-28 10:30:05,030] Trial 66 finished with value: 0.9140626217328169 and parameters: {'activation': 'relu', 'solver': 'adam', 'lr': 0.00029000957409314263, 'layer1': 284, 'layer2': 314, 'layer3': 143}. Best is trial 64 with value: 0.915999331951523.

Escherichia_Coli | Piperacillin-Tazobactam | Optuna:  34%|███▎      | 67/200 [2:25:57<5:04:54, 137.56s/it, best=0.916][A
Escherichia_Coli | Piperacillin-Tazobactam | Optuna:  34%|███▎      | 67/200 [2:25:57<5:04:54, 137.56s/it, best=0.916][A[I 2026-02-28 10:30:17,363] Trial 118 finished with value: 0.8630858121977532 and parameters: {'activation': 'identity', 'solver': 'adam', 'lr': 0.00018677576686167163, 'layer1': 476, 'layer2': 416, 'layer3': 442}. Best is trial 102 with value: 0.8672439264969375.
Pseudomonas_Aeruginosa | DirectMulti | Optuna:  60%|█████▉    | 119/200 [3:34:03<3:44:57, 166.64s/it, best=0.867]Pseudomonas_Aeruginosa | DirectMulti | Optuna:  60%|█████▉    | 119/200 [3:34:03<3:44:57, 166.64s/it, best=0.867]/export/usuarios01/egarroyo/MALDI_for_AMR_prediction/venv/lib/python3.13/site-packages/sklearn/model_selection/_split.py:813: UserWarning: The least populated class in y has only 4 members, which is less than n_splits=5.
  warnings.warn(
[I 2026-02-28 10:30:30,716] Trial 63 finished with value: 0.9230062556282842 and parameters: {'activation': 'identity', 'solver': 'adam', 'lr': 0.0008934797232328935, 'layer1': 141, 'layer2': 233, 'layer3': 146}. Best is trial 23 with value: 0.9252230330428246.
Klebsiella_Pneumoniae | LPS | Optuna:  32%|███▏      | 64/200 [1:42:46<2:47:45, 74.01s/it, best=0.925]Klebsiella_Pneumoniae | LPS | Optuna:  32%|███▏      | 64/200 [1:42:46<2:47:45, 74.01s/it, best=0.925][I 2026-02-28 10:31:54,757] Trial 64 finished with value: 0.9245441858446783 and parameters: {'activation': 'identity', 'solver': 'adam', 'lr': 0.00010979810140848295, 'layer1': 133, 'layer2': 289, 'layer3': 119}. Best is trial 23 with value: 0.9252230330428246.
Klebsiella_Pneumoniae | LPS | Optuna:  32%|███▎      | 65/200 [1:44:10<2:53:17, 77.02s/it, best=0.925]Klebsiella_Pneumoniae | LPS | Optuna:  32%|███▎      | 65/200 [1:44:10<2:53:17, 77.02s/it, best=0.925][I 2026-02-28 10:32:08,097] Trial 119 finished with value: 0.8637621344869071 and parameters: {'activation': 'identity', 'solver': 'adam', 'lr': 0.00015994365045000927, 'layer1': 492, 'layer2': 115, 'layer3': 458}. Best is trial 102 with value: 0.8672439264969375.
Pseudomonas_Aeruginosa | DirectMulti | Optuna:  60%|██████    | 120/200 [3:35:54<3:19:49, 149.87s/it, best=0.867]Pseudomonas_Aeruginosa | DirectMulti | Optuna:  60%|██████    | 120/200 [3:35:54<3:19:49, 149.87s/it, best=0.867]/export/usuarios01/egarroyo/MALDI_for_AMR_prediction/venv/lib/python3.13/site-packages/sklearn/model_selection/_split.py:813: UserWarning: The least populated class in y has only 4 members, which is less than n_splits=5.
  warnings.warn(
[I 2026-02-28 10:32:14,881] Trial 64 finished with value: 0.885890139580394 and parameters: {'activation': 'identity', 'solver': 'adam', 'lr': 0.0006125564313624406, 'layer1': 437, 'layer2': 80, 'layer3': 86}. Best is trial 8 with value: 0.8879562150966016.
Staphylococcus_Aureus | LPS | Optuna:  32%|███▎      | 65/200 [2:26:01<4:57:39, 132.29s/it, best=0.888]Staphylococcus_Aureus | LPS | Optuna:  32%|███▎      | 65/200 [2:26:01<4:57:39, 132.29s/it, best=0.888][I 2026-02-28 10:32:41,465] Trial 67 finished with value: 0.9143488632168193 and parameters: {'activation': 'relu', 'solver': 'adam', 'lr': 0.0006538683253468358, 'layer1': 329, 'layer2': 290, 'layer3': 152}. Best is trial 64 with value: 0.915999331951523.

Escherichia_Coli | Piperacillin-Tazobactam | Optuna:  34%|███▍      | 68/200 [2:28:34<5:15:04, 143.22s/it, best=0.916][A
Escherichia_Coli | Piperacillin-Tazobactam | Optuna:  34%|███▍      | 68/200 [2:28:34<5:15:04, 143.22s/it, best=0.916][A[I 2026-02-28 10:32:52,530] Trial 65 finished with value: 0.9227608358986904 and parameters: {'activation': 'identity', 'solver': 'adam', 'lr': 0.00036595801389482815, 'layer1': 138, 'layer2': 287, 'layer3': 119}. Best is trial 23 with value: 0.9252230330428246.
Klebsiella_Pneumoniae | LPS | Optuna:  33%|███▎      | 66/200 [1:45:08<2:39:06, 71.25s/it, best=0.925]Klebsiella_Pneumoniae | LPS | Optuna:  33%|███▎      | 66/200 [1:45:08<2:39:06, 71.25s/it, best=0.925][I 2026-02-28 10:33:44,747] Trial 120 finished with value: 0.8620599471481531 and parameters: {'activation': 'identity', 'solver': 'adam', 'lr': 0.00010260686565866354, 'layer1': 411, 'layer2': 289, 'layer3': 473}. Best is trial 102 with value: 0.8672439264969375.
Pseudomonas_Aeruginosa | DirectMulti | Optuna:  60%|██████    | 121/200 [3:37:31<2:56:18, 133.90s/it, best=0.867]Pseudomonas_Aeruginosa | DirectMulti | Optuna:  60%|██████    | 121/200 [3:37:31<2:56:18, 133.90s/it, best=0.867]/export/usuarios01/egarroyo/MALDI_for_AMR_prediction/venv/lib/python3.13/site-packages/sklearn/model_selection/_split.py:813: UserWarning: The least populated class in y has only 4 members, which is less than n_splits=5.
  warnings.warn(
[I 2026-02-28 10:34:32,918] Trial 65 finished with value: 0.8849541142917567 and parameters: {'activation': 'identity', 'solver': 'adam', 'lr': 0.000983088838092958, 'layer1': 419, 'layer2': 106, 'layer3': 30}. Best is trial 8 with value: 0.8879562150966016.
Staphylococcus_Aureus | LPS | Optuna:  33%|███▎      | 66/200 [2:28:19<4:59:18, 134.01s/it, best=0.888]Staphylococcus_Aureus | LPS | Optuna:  33%|███▎      | 66/200 [2:28:19<4:59:18, 134.01s/it, best=0.888][I 2026-02-28 10:34:33,305] Trial 66 finished with value: 0.9233840663925068 and parameters: {'activation': 'identity', 'solver': 'adam', 'lr': 9.940409325419721e-05, 'layer1': 157, 'layer2': 202, 'layer3': 78}. Best is trial 23 with value: 0.9252230330428246.
Klebsiella_Pneumoniae | LPS | Optuna:  34%|███▎      | 67/200 [1:46:49<2:57:33, 80.10s/it, best=0.925]Klebsiella_Pneumoniae | LPS | Optuna:  34%|███▎      | 67/200 [1:46:49<2:57:33, 80.10s/it, best=0.925][I 2026-02-28 10:34:54,592] Trial 68 finished with value: 0.9141303965679619 and parameters: {'activation': 'relu', 'solver': 'adam', 'lr': 0.00042207931491780706, 'layer1': 346, 'layer2': 264, 'layer3': 95}. Best is trial 64 with value: 0.915999331951523.

Escherichia_Coli | Piperacillin-Tazobactam | Optuna:  34%|███▍      | 69/200 [2:30:47<5:06:05, 140.19s/it, best=0.916][A
Escherichia_Coli | Piperacillin-Tazobactam | Optuna:  34%|███▍      | 69/200 [2:30:47<5:06:05, 140.19s/it, best=0.916][A[I 2026-02-28 10:35:19,341] Trial 121 finished with value: 0.8595012035486136 and parameters: {'activation': 'identity', 'solver': 'adam', 'lr': 5.2133114371690873e-05, 'layer1': 417, 'layer2': 349, 'layer3': 172}. Best is trial 102 with value: 0.8672439264969375.
Pseudomonas_Aeruginosa | DirectMulti | Optuna:  61%|██████    | 122/200 [3:39:05<2:38:44, 122.11s/it, best=0.867]Pseudomonas_Aeruginosa | DirectMulti | Optuna:  61%|██████    | 122/200 [3:39:05<2:38:44, 122.11s/it, best=0.867]/export/usuarios01/egarroyo/MALDI_for_AMR_prediction/venv/lib/python3.13/site-packages/sklearn/model_selection/_split.py:813: UserWarning: The least populated class in y has only 4 members, which is less than n_splits=5.
  warnings.warn(
[I 2026-02-28 10:36:15,068] Trial 67 finished with value: 0.9226778997693629 and parameters: {'activation': 'tanh', 'solver': 'adam', 'lr': 5.696043481494078e-05, 'layer1': 123, 'layer2': 397, 'layer3': 23}. Best is trial 23 with value: 0.9252230330428246.
Klebsiella_Pneumoniae | LPS | Optuna:  34%|███▍      | 68/200 [1:48:31<3:10:31, 86.60s/it, best=0.925]Klebsiella_Pneumoniae | LPS | Optuna:  34%|███▍      | 68/200 [1:48:31<3:10:31, 86.60s/it, best=0.925][I 2026-02-28 10:36:40,799] Trial 66 finished with value: 0.8829323607926787 and parameters: {'activation': 'tanh', 'solver': 'adam', 'lr': 0.00019384849310359636, 'layer1': 484, 'layer2': 34, 'layer3': 66}. Best is trial 8 with value: 0.8879562150966016.
Staphylococcus_Aureus | LPS | Optuna:  34%|███▎      | 67/200 [2:30:27<4:52:59, 132.17s/it, best=0.888]Staphylococcus_Aureus | LPS | Optuna:  34%|███▎      | 67/200 [2:30:27<4:52:59, 132.17s/it, best=0.888][I 2026-02-28 10:36:47,990] Trial 69 finished with value: 0.913328306018634 and parameters: {'activation': 'relu', 'solver': 'adam', 'lr': 0.00025637202991276247, 'layer1': 252, 'layer2': 303, 'layer3': 178}. Best is trial 64 with value: 0.915999331951523.

Escherichia_Coli | Piperacillin-Tazobactam | Optuna:  35%|███▌      | 70/200 [2:32:40<4:46:19, 132.15s/it, best=0.916][A
Escherichia_Coli | Piperacillin-Tazobactam | Optuna:  35%|███▌      | 70/200 [2:32:40<4:46:19, 132.15s/it, best=0.916][A[I 2026-02-28 10:37:24,001] Trial 70 finished with value: 0.8958344038173316 and parameters: {'activation': 'relu', 'solver': 'sgd', 'lr': 0.0008134778675684583, 'layer1': 342, 'layer2': 326, 'layer3': 121}. Best is trial 64 with value: 0.915999331951523.

Escherichia_Coli | Piperacillin-Tazobactam | Optuna:  36%|███▌      | 71/200 [2:33:16<3:42:07, 103.31s/it, best=0.916][A
Escherichia_Coli | Piperacillin-Tazobactam | Optuna:  36%|███▌      | 71/200 [2:33:16<3:42:07, 103.31s/it, best=0.916][A[I 2026-02-28 10:37:33,524] Trial 122 finished with value: 0.8663290446257331 and parameters: {'activation': 'identity', 'solver': 'adam', 'lr': 6.472876049568626e-05, 'layer1': 398, 'layer2': 355, 'layer3': 215}. Best is trial 102 with value: 0.8672439264969375.
Pseudomonas_Aeruginosa | DirectMulti | Optuna:  62%|██████▏   | 123/200 [3:41:19<2:41:21, 125.73s/it, best=0.867]Pseudomonas_Aeruginosa | DirectMulti | Optuna:  62%|██████▏   | 123/200 [3:41:19<2:41:21, 125.73s/it, best=0.867]/export/usuarios01/egarroyo/MALDI_for_AMR_prediction/venv/lib/python3.13/site-packages/sklearn/model_selection/_split.py:813: UserWarning: The least populated class in y has only 4 members, which is less than n_splits=5.
  warnings.warn(
[I 2026-02-28 10:37:45,784] Trial 68 finished with value: 0.918212099756109 and parameters: {'activation': 'relu', 'solver': 'adam', 'lr': 0.00015560880775356196, 'layer1': 49, 'layer2': 222, 'layer3': 171}. Best is trial 23 with value: 0.9252230330428246.
Klebsiella_Pneumoniae | LPS | Optuna:  34%|███▍      | 69/200 [1:50:01<3:11:46, 87.84s/it, best=0.925]Klebsiella_Pneumoniae | LPS | Optuna:  34%|███▍      | 69/200 [1:50:01<3:11:46, 87.84s/it, best=0.925][I 2026-02-28 10:38:49,912] Trial 67 finished with value: 0.8839363501284261 and parameters: {'activation': 'relu', 'solver': 'adam', 'lr': 0.0002924501992192947, 'layer1': 349, 'layer2': 152, 'layer3': 127}. Best is trial 8 with value: 0.8879562150966016.
Staphylococcus_Aureus | LPS | Optuna:  34%|███▍      | 68/200 [2:32:36<4:48:45, 131.26s/it, best=0.888]Staphylococcus_Aureus | LPS | Optuna:  34%|███▍      | 68/200 [2:32:36<4:48:45, 131.26s/it, best=0.888][I 2026-02-28 10:39:11,524] Trial 123 finished with value: 0.8637284974696661 and parameters: {'activation': 'identity', 'solver': 'adam', 'lr': 6.537119837893014e-05, 'layer1': 391, 'layer2': 365, 'layer3': 212}. Best is trial 102 with value: 0.8672439264969375.
Pseudomonas_Aeruginosa | DirectMulti | Optuna:  62%|██████▏   | 124/200 [3:42:57<2:28:43, 117.41s/it, best=0.867]Pseudomonas_Aeruginosa | DirectMulti | Optuna:  62%|██████▏   | 124/200 [3:42:57<2:28:43, 117.41s/it, best=0.867]/export/usuarios01/egarroyo/MALDI_for_AMR_prediction/venv/lib/python3.13/site-packages/sklearn/model_selection/_split.py:813: UserWarning: The least populated class in y has only 4 members, which is less than n_splits=5.
  warnings.warn(
[I 2026-02-28 10:39:24,147] Trial 69 finished with value: 0.9241696687526867 and parameters: {'activation': 'identity', 'solver': 'adam', 'lr': 0.00010548095636788273, 'layer1': 205, 'layer2': 188, 'layer3': 30}. Best is trial 23 with value: 0.9252230330428246.
Klebsiella_Pneumoniae | LPS | Optuna:  35%|███▌      | 70/200 [1:51:40<3:17:09, 90.99s/it, best=0.925]Klebsiella_Pneumoniae | LPS | Optuna:  35%|███▌      | 70/200 [1:51:40<3:17:09, 90.99s/it, best=0.925][I 2026-02-28 10:39:40,620] Trial 71 finished with value: 0.912980165950618 and parameters: {'activation': 'relu', 'solver': 'adam', 'lr': 0.00018871785410374943, 'layer1': 364, 'layer2': 273, 'layer3': 140}. Best is trial 64 with value: 0.915999331951523.

Escherichia_Coli | Piperacillin-Tazobactam | Optuna:  36%|███▌      | 72/200 [2:35:33<4:01:42, 113.30s/it, best=0.916][A
