Klebsiella_Pneumoniae | Meropenem | Optuna:  86%|████████▋ | 173/200 [2:29:18<17:58, 39.93s/it, best=0.985][A[I 2026-02-28 08:29:20,373] Trial 173 finished with value: 0.9817761603536146 and parameters: {'activation': 'tanh', 'solver': 'adam', 'lr': 0.000475071376960302, 'layer1': 166, 'layer2': 346, 'layer3': 47}. Best is trial 161 with value: 0.9845171402894224.

Klebsiella_Pneumoniae | Meropenem | Optuna:  87%|████████▋ | 174/200 [2:30:00<17:38, 40.71s/it, best=0.985][A
Klebsiella_Pneumoniae | Meropenem | Optuna:  87%|████████▋ | 174/200 [2:30:00<17:38, 40.71s/it, best=0.985][A[I 2026-02-28 08:29:37,456] Trial 57 finished with value: 0.8374489139870833 and parameters: {'activation': 'logistic', 'solver': 'adam', 'lr': 0.0002914174907255376, 'layer1': 473, 'layer2': 368, 'layer3': 100}. Best is trial 31 with value: 0.866367214803268.
Pseudomonas_Aeruginosa | DirectMulti | Optuna:  29%|██▉       | 58/200 [1:33:23<3:05:20, 78.31s/it, best=0.866]Pseudomonas_Aeruginosa | DirectMulti | Optuna:  29%|██▉       | 58/200 [1:33:23<3:05:20, 78.31s/it, best=0.866]/export/usuarios01/egarroyo/MALDI_for_AMR_prediction/venv/lib/python3.13/site-packages/sklearn/model_selection/_split.py:813: UserWarning: The least populated class in y has only 4 members, which is less than n_splits=5.
  warnings.warn(
[I 2026-02-28 08:29:55,744] Trial 174 finished with value: 0.9805934724842255 and parameters: {'activation': 'tanh', 'solver': 'adam', 'lr': 0.00038424975737652583, 'layer1': 155, 'layer2': 322, 'layer3': 89}. Best is trial 161 with value: 0.9845171402894224.

Klebsiella_Pneumoniae | Meropenem | Optuna:  88%|████████▊ | 175/200 [2:30:36<16:17, 39.11s/it, best=0.985][A
Klebsiella_Pneumoniae | Meropenem | Optuna:  88%|████████▊ | 175/200 [2:30:36<16:17, 39.11s/it, best=0.985][A[I 2026-02-28 08:30:34,631] Trial 14 finished with value: 0.912323922202986 and parameters: {'activation': 'relu', 'solver': 'adam', 'lr': 0.00016547887417433184, 'layer1': 178, 'layer2': 129, 'layer3': 462}. Best is trial 13 with value: 0.9126969711814088.

Escherichia_Coli | Piperacillin-Tazobactam | Optuna:   8%|▊         | 15/200 [26:27<6:07:45, 119.27s/it, best=0.913][A
Escherichia_Coli | Piperacillin-Tazobactam | Optuna:   8%|▊         | 15/200 [26:27<6:07:45, 119.27s/it, best=0.913][A[I 2026-02-28 08:30:40,406] Trial 175 finished with value: 0.9823773406169879 and parameters: {'activation': 'tanh', 'solver': 'adam', 'lr': 0.000629283204560442, 'layer1': 171, 'layer2': 320, 'layer3': 71}. Best is trial 161 with value: 0.9845171402894224.

Klebsiella_Pneumoniae | Meropenem | Optuna:  88%|████████▊ | 176/200 [2:31:20<16:18, 40.78s/it, best=0.985][A
Klebsiella_Pneumoniae | Meropenem | Optuna:  88%|████████▊ | 176/200 [2:31:20<16:18, 40.78s/it, best=0.985][A[I 2026-02-28 08:31:13,068] Trial 176 finished with value: 0.9795271467755923 and parameters: {'activation': 'tanh', 'solver': 'adam', 'lr': 0.0009770538696580624, 'layer1': 169, 'layer2': 347, 'layer3': 83}. Best is trial 161 with value: 0.9845171402894224.

Klebsiella_Pneumoniae | Meropenem | Optuna:  88%|████████▊ | 177/200 [2:31:53<14:41, 38.34s/it, best=0.985][A
Klebsiella_Pneumoniae | Meropenem | Optuna:  88%|████████▊ | 177/200 [2:31:53<14:41, 38.34s/it, best=0.985][A[I 2026-02-28 08:31:22,183] Trial 58 finished with value: 0.8629254729120495 and parameters: {'activation': 'identity', 'solver': 'adam', 'lr': 0.0011380499358938697, 'layer1': 457, 'layer2': 477, 'layer3': 274}. Best is trial 31 with value: 0.866367214803268.
Pseudomonas_Aeruginosa | DirectMulti | Optuna:  30%|██▉       | 59/200 [1:35:08<3:22:39, 86.24s/it, best=0.866]Pseudomonas_Aeruginosa | DirectMulti | Optuna:  30%|██▉       | 59/200 [1:35:08<3:22:39, 86.24s/it, best=0.866]/export/usuarios01/egarroyo/MALDI_for_AMR_prediction/venv/lib/python3.13/site-packages/sklearn/model_selection/_split.py:813: UserWarning: The least populated class in y has only 4 members, which is less than n_splits=5.
  warnings.warn(
[I 2026-02-28 08:31:58,123] Trial 10 finished with value: 0.8746653881047527 and parameters: {'activation': 'identity', 'solver': 'sgd', 'lr': 0.007553503645583194, 'layer1': 366, 'layer2': 492, 'layer3': 320}. Best is trial 8 with value: 0.8879562150966016.
Staphylococcus_Aureus | LPS | Optuna:   6%|▌         | 11/200 [25:44<9:28:03, 180.34s/it, best=0.888]Staphylococcus_Aureus | LPS | Optuna:   6%|▌         | 11/200 [25:44<9:28:03, 180.34s/it, best=0.888][I 2026-02-28 08:32:04,788] Trial 177 finished with value: 0.9819213967898168 and parameters: {'activation': 'tanh', 'solver': 'adam', 'lr': 0.0006655606942573531, 'layer1': 184, 'layer2': 300, 'layer3': 103}. Best is trial 161 with value: 0.9845171402894224.

Klebsiella_Pneumoniae | Meropenem | Optuna:  89%|████████▉ | 178/200 [2:32:45<15:31, 42.35s/it, best=0.985][A
Klebsiella_Pneumoniae | Meropenem | Optuna:  89%|████████▉ | 178/200 [2:32:45<15:31, 42.35s/it, best=0.985][A[I 2026-02-28 08:32:26,251] Trial 15 finished with value: 0.9095404965569571 and parameters: {'activation': 'relu', 'solver': 'adam', 'lr': 0.00012899855432602412, 'layer1': 153, 'layer2': 125, 'layer3': 500}. Best is trial 13 with value: 0.9126969711814088.

Escherichia_Coli | Piperacillin-Tazobactam | Optuna:   8%|▊         | 16/200 [28:18<5:58:42, 116.97s/it, best=0.913][A
Escherichia_Coli | Piperacillin-Tazobactam | Optuna:   8%|▊         | 16/200 [28:18<5:58:42, 116.97s/it, best=0.913][A[I 2026-02-28 08:32:31,270] Trial 178 finished with value: 0.9806984824671616 and parameters: {'activation': 'tanh', 'solver': 'adam', 'lr': 0.0008136654748662096, 'layer1': 33, 'layer2': 404, 'layer3': 82}. Best is trial 161 with value: 0.9845171402894224.

Klebsiella_Pneumoniae | Meropenem | Optuna:  90%|████████▉ | 179/200 [2:33:11<13:09, 37.59s/it, best=0.985][A
Klebsiella_Pneumoniae | Meropenem | Optuna:  90%|████████▉ | 179/200 [2:33:11<13:09, 37.59s/it, best=0.985][A[I 2026-02-28 08:32:54,086] Trial 59 finished with value: 0.8633297678322578 and parameters: {'activation': 'identity', 'solver': 'adam', 'lr': 0.0004370016271951919, 'layer1': 360, 'layer2': 401, 'layer3': 385}. Best is trial 31 with value: 0.866367214803268.
Pseudomonas_Aeruginosa | DirectMulti | Optuna:  30%|███       | 60/200 [1:36:40<3:25:11, 87.94s/it, best=0.866]Pseudomonas_Aeruginosa | DirectMulti | Optuna:  30%|███       | 60/200 [1:36:40<3:25:11, 87.94s/it, best=0.866]/export/usuarios01/egarroyo/MALDI_for_AMR_prediction/venv/lib/python3.13/site-packages/sklearn/model_selection/_split.py:813: UserWarning: The least populated class in y has only 4 members, which is less than n_splits=5.
  warnings.warn(
[I 2026-02-28 08:33:05,548] Trial 179 finished with value: 0.9807194464711507 and parameters: {'activation': 'tanh', 'solver': 'adam', 'lr': 0.0010361984282103267, 'layer1': 130, 'layer2': 338, 'layer3': 54}. Best is trial 161 with value: 0.9845171402894224.

Klebsiella_Pneumoniae | Meropenem | Optuna:  90%|█████████ | 180/200 [2:33:46<12:11, 36.60s/it, best=0.985][A
Klebsiella_Pneumoniae | Meropenem | Optuna:  90%|█████████ | 180/200 [2:33:46<12:11, 36.60s/it, best=0.985][A[I 2026-02-28 08:33:24,649] Trial 11 finished with value: 0.8774848634316414 and parameters: {'activation': 'relu', 'solver': 'adam', 'lr': 0.0013124793805688133, 'layer1': 150, 'layer2': 163, 'layer3': 284}. Best is trial 8 with value: 0.8879562150966016.
Staphylococcus_Aureus | LPS | Optuna:   6%|▌         | 12/200 [27:11<7:55:37, 151.80s/it, best=0.888]Staphylococcus_Aureus | LPS | Optuna:   6%|▌         | 12/200 [27:11<7:55:37, 151.80s/it, best=0.888][I 2026-02-28 08:33:52,225] Trial 180 finished with value: 0.9819036102015912 and parameters: {'activation': 'tanh', 'solver': 'adam', 'lr': 0.0006141121025180775, 'layer1': 92, 'layer2': 317, 'layer3': 70}. Best is trial 161 with value: 0.9845171402894224.

Klebsiella_Pneumoniae | Meropenem | Optuna:  90%|█████████ | 181/200 [2:34:32<12:32, 39.62s/it, best=0.985][A
Klebsiella_Pneumoniae | Meropenem | Optuna:  90%|█████████ | 181/200 [2:34:32<12:32, 39.62s/it, best=0.985][A[I 2026-02-28 08:34:07,852] Trial 60 finished with value: 0.8556173665115591 and parameters: {'activation': 'relu', 'solver': 'adam', 'lr': 0.002350746199200579, 'layer1': 279, 'layer2': 434, 'layer3': 483}. Best is trial 31 with value: 0.866367214803268.
Pseudomonas_Aeruginosa | DirectMulti | Optuna:  30%|███       | 61/200 [1:37:54<3:13:52, 83.69s/it, best=0.866]Pseudomonas_Aeruginosa | DirectMulti | Optuna:  30%|███       | 61/200 [1:37:54<3:13:52, 83.69s/it, best=0.866]/export/usuarios01/egarroyo/MALDI_for_AMR_prediction/venv/lib/python3.13/site-packages/sklearn/model_selection/_split.py:813: UserWarning: The least populated class in y has only 4 members, which is less than n_splits=5.
  warnings.warn(
[I 2026-02-28 08:34:36,801] Trial 181 finished with value: 0.9811631990793719 and parameters: {'activation': 'tanh', 'solver': 'adam', 'lr': 0.0005584424961828621, 'layer1': 174, 'layer2': 332, 'layer3': 74}. Best is trial 161 with value: 0.9845171402894224.

Klebsiella_Pneumoniae | Meropenem | Optuna:  91%|█████████ | 182/200 [2:35:17<12:19, 41.11s/it, best=0.985][A
Klebsiella_Pneumoniae | Meropenem | Optuna:  91%|█████████ | 182/200 [2:35:17<12:19, 41.11s/it, best=0.985][A[I 2026-02-28 08:35:11,301] Trial 16 finished with value: 0.9144489703452822 and parameters: {'activation': 'relu', 'solver': 'adam', 'lr': 0.0003474460606684778, 'layer1': 499, 'layer2': 104, 'layer3': 425}. Best is trial 16 with value: 0.9144489703452822.

Escherichia_Coli | Piperacillin-Tazobactam | Optuna:   8%|▊         | 17/200 [31:03<6:40:51, 131.43s/it, best=0.913][A
Escherichia_Coli | Piperacillin-Tazobactam | Optuna:   8%|▊         | 17/200 [31:03<6:40:51, 131.43s/it, best=0.914][A[I 2026-02-28 08:35:25,393] Trial 182 finished with value: 0.982108531536246 and parameters: {'activation': 'tanh', 'solver': 'adam', 'lr': 0.0007040599050160548, 'layer1': 109, 'layer2': 324, 'layer3': 63}. Best is trial 161 with value: 0.9845171402894224.

Klebsiella_Pneumoniae | Meropenem | Optuna:  92%|█████████▏| 183/200 [2:36:05<12:17, 43.35s/it, best=0.985][A
Klebsiella_Pneumoniae | Meropenem | Optuna:  92%|█████████▏| 183/200 [2:36:05<12:17, 43.35s/it, best=0.985][A[I 2026-02-28 08:35:41,693] Trial 61 finished with value: 0.862660277204232 and parameters: {'activation': 'identity', 'solver': 'adam', 'lr': 0.0016821275630099725, 'layer1': 436, 'layer2': 372, 'layer3': 202}. Best is trial 31 with value: 0.866367214803268.
Pseudomonas_Aeruginosa | DirectMulti | Optuna:  31%|███       | 62/200 [1:39:27<3:19:29, 86.73s/it, best=0.866]Pseudomonas_Aeruginosa | DirectMulti | Optuna:  31%|███       | 62/200 [1:39:27<3:19:29, 86.73s/it, best=0.866]/export/usuarios01/egarroyo/MALDI_for_AMR_prediction/venv/lib/python3.13/site-packages/sklearn/model_selection/_split.py:813: UserWarning: The least populated class in y has only 4 members, which is less than n_splits=5.
  warnings.warn(
[I 2026-02-28 08:35:45,802] Trial 12 finished with value: 0.8857978191421818 and parameters: {'activation': 'identity', 'solver': 'adam', 'lr': 0.00046544039809979403, 'layer1': 347, 'layer2': 434, 'layer3': 419}. Best is trial 8 with value: 0.8879562150966016.
Staphylococcus_Aureus | LPS | Optuna:   6%|▋         | 13/200 [29:32<7:43:03, 148.57s/it, best=0.888]Staphylococcus_Aureus | LPS | Optuna:   6%|▋         | 13/200 [29:32<7:43:03, 148.57s/it, best=0.888][I 2026-02-28 08:35:57,464] Trial 183 finished with value: 0.9795197315613748 and parameters: {'activation': 'tanh', 'solver': 'adam', 'lr': 0.00070689818358285, 'layer1': 118, 'layer2': 295, 'layer3': 33}. Best is trial 161 with value: 0.9845171402894224.

Klebsiella_Pneumoniae | Meropenem | Optuna:  92%|█████████▏| 184/200 [2:36:37<10:39, 39.97s/it, best=0.985][A
Klebsiella_Pneumoniae | Meropenem | Optuna:  92%|█████████▏| 184/200 [2:36:37<10:39, 39.97s/it, best=0.985][A[I 2026-02-28 08:36:59,914] Trial 184 finished with value: 0.982453514942614 and parameters: {'activation': 'tanh', 'solver': 'adam', 'lr': 0.0009289178977941016, 'layer1': 323, 'layer2': 317, 'layer3': 61}. Best is trial 161 with value: 0.9845171402894224.

Klebsiella_Pneumoniae | Meropenem | Optuna:  92%|█████████▎| 185/200 [2:37:40<11:40, 46.71s/it, best=0.985][A
Klebsiella_Pneumoniae | Meropenem | Optuna:  92%|█████████▎| 185/200 [2:37:40<11:40, 46.71s/it, best=0.985][A[I 2026-02-28 08:37:28,277] Trial 17 finished with value: 0.9137123936701951 and parameters: {'activation': 'relu', 'solver': 'adam', 'lr': 0.0003560763379486619, 'layer1': 482, 'layer2': 104, 'layer3': 400}. Best is trial 16 with value: 0.9144489703452822.

Escherichia_Coli | Piperacillin-Tazobactam | Optuna:   9%|▉         | 18/200 [33:20<6:43:43, 133.10s/it, best=0.914][A
Escherichia_Coli | Piperacillin-Tazobactam | Optuna:   9%|▉         | 18/200 [33:20<6:43:43, 133.10s/it, best=0.914][A[I 2026-02-28 08:37:33,549] Trial 185 finished with value: 0.9817960156809151 and parameters: {'activation': 'tanh', 'solver': 'adam', 'lr': 0.0009498619896384687, 'layer1': 76, 'layer2': 321, 'layer3': 48}. Best is trial 161 with value: 0.9845171402894224.

Klebsiella_Pneumoniae | Meropenem | Optuna:  93%|█████████▎| 186/200 [2:38:14<09:59, 42.79s/it, best=0.985][A
Klebsiella_Pneumoniae | Meropenem | Optuna:  93%|█████████▎| 186/200 [2:38:14<09:59, 42.79s/it, best=0.985][A[I 2026-02-28 08:37:43,288] Trial 62 finished with value: 0.8642887501403511 and parameters: {'activation': 'identity', 'solver': 'adam', 'lr': 0.0034838846475854536, 'layer1': 401, 'layer2': 318, 'layer3': 236}. Best is trial 31 with value: 0.866367214803268.
Pseudomonas_Aeruginosa | DirectMulti | Optuna:  32%|███▏      | 63/200 [1:41:29<3:41:55, 97.19s/it, best=0.866]Pseudomonas_Aeruginosa | DirectMulti | Optuna:  32%|███▏      | 63/200 [1:41:29<3:41:55, 97.19s/it, best=0.866]/export/usuarios01/egarroyo/MALDI_for_AMR_prediction/venv/lib/python3.13/site-packages/sklearn/model_selection/_split.py:813: UserWarning: The least populated class in y has only 4 members, which is less than n_splits=5.
  warnings.warn(
[I 2026-02-28 08:38:06,999] Trial 18 finished with value: 0.8958344038173316 and parameters: {'activation': 'relu', 'solver': 'sgd', 'lr': 0.005649859841309965, 'layer1': 490, 'layer2': 79, 'layer3': 415}. Best is trial 16 with value: 0.9144489703452822.

Escherichia_Coli | Piperacillin-Tazobactam | Optuna:  10%|▉         | 19/200 [33:59<5:15:59, 104.75s/it, best=0.914][A
Escherichia_Coli | Piperacillin-Tazobactam | Optuna:  10%|▉         | 19/200 [33:59<5:15:59, 104.75s/it, best=0.914][A[I 2026-02-28 08:38:08,831] Trial 186 finished with value: 0.9812900427354954 and parameters: {'activation': 'tanh', 'solver': 'adam', 'lr': 0.0008326130628214224, 'layer1': 107, 'layer2': 345, 'layer3': 58}. Best is trial 161 with value: 0.9845171402894224.

Klebsiella_Pneumoniae | Meropenem | Optuna:  94%|█████████▎| 187/200 [2:38:49<08:46, 40.54s/it, best=0.985][A
Klebsiella_Pneumoniae | Meropenem | Optuna:  94%|█████████▎| 187/200 [2:38:49<08:46, 40.54s/it, best=0.985][A[I 2026-02-28 08:38:44,833] Trial 13 finished with value: 0.8847774097920491 and parameters: {'activation': 'identity', 'solver': 'adam', 'lr': 0.00025548240574830476, 'layer1': 499, 'layer2': 471, 'layer3': 419}. Best is trial 8 with value: 0.8879562150966016.
Staphylococcus_Aureus | LPS | Optuna:   7%|▋         | 14/200 [32:31<8:09:05, 157.77s/it, best=0.888]Staphylococcus_Aureus | LPS | Optuna:   7%|▋         | 14/200 [32:31<8:09:05, 157.77s/it, best=0.888][I 2026-02-28 08:39:13,477] Trial 187 finished with value: 0.9822982572664246 and parameters: {'activation': 'tanh', 'solver': 'adam', 'lr': 0.0011758228756772102, 'layer1': 307, 'layer2': 313, 'layer3': 65}. Best is trial 161 with value: 0.9845171402894224.

Klebsiella_Pneumoniae | Meropenem | Optuna:  94%|█████████▍| 188/200 [2:39:53<09:33, 47.77s/it, best=0.985][A
Klebsiella_Pneumoniae | Meropenem | Optuna:  94%|█████████▍| 188/200 [2:39:53<09:33, 47.77s/it, best=0.985][A[I 2026-02-28 08:39:37,289] Trial 63 finished with value: 0.8626214953625535 and parameters: {'activation': 'identity', 'solver': 'adam', 'lr': 0.0009205874466575429, 'layer1': 441, 'layer2': 349, 'layer3': 212}. Best is trial 31 with value: 0.866367214803268.
Pseudomonas_Aeruginosa | DirectMulti | Optuna:  32%|███▏      | 64/200 [1:43:23<3:51:43, 102.23s/it, best=0.866]Pseudomonas_Aeruginosa | DirectMulti | Optuna:  32%|███▏      | 64/200 [1:43:23<3:51:43, 102.23s/it, best=0.866]/export/usuarios01/egarroyo/MALDI_for_AMR_prediction/venv/lib/python3.13/site-packages/sklearn/model_selection/_split.py:813: UserWarning: The least populated class in y has only 4 members, which is less than n_splits=5.
  warnings.warn(
[I 2026-02-28 08:40:04,205] Trial 188 finished with value: 0.9806984824671616 and parameters: {'activation': 'tanh', 'solver': 'adam', 'lr': 0.0016287310663956407, 'layer1': 301, 'layer2': 315, 'layer3': 67}. Best is trial 161 with value: 0.9845171402894224.

Klebsiella_Pneumoniae | Meropenem | Optuna:  94%|█████████▍| 189/200 [2:40:44<08:55, 48.66s/it, best=0.985][A
Klebsiella_Pneumoniae | Meropenem | Optuna:  94%|█████████▍| 189/200 [2:40:44<08:55, 48.66s/it, best=0.985][A[I 2026-02-28 08:40:26,273] Trial 19 finished with value: 0.9130836998875788 and parameters: {'activation': 'tanh', 'solver': 'adam', 'lr': 5.6903847709191106e-05, 'layer1': 494, 'layer2': 93, 'layer3': 382}. Best is trial 16 with value: 0.9144489703452822.

Escherichia_Coli | Piperacillin-Tazobactam | Optuna:  10%|█         | 20/200 [36:18<5:45:20, 115.12s/it, best=0.914][A
Escherichia_Coli | Piperacillin-Tazobactam | Optuna:  10%|█         | 20/200 [36:18<5:45:20, 115.12s/it, best=0.914][A[I 2026-02-28 08:40:46,847] Trial 189 finished with value: 0.9803889127013818 and parameters: {'activation': 'tanh', 'solver': 'adam', 'lr': 0.0012587626391149845, 'layer1': 321, 'layer2': 304, 'layer3': 63}. Best is trial 161 with value: 0.9845171402894224.

Klebsiella_Pneumoniae | Meropenem | Optuna:  95%|█████████▌| 190/200 [2:41:27<07:48, 46.85s/it, best=0.985][A
Klebsiella_Pneumoniae | Meropenem | Optuna:  95%|█████████▌| 190/200 [2:41:27<07:48, 46.85s/it, best=0.985][A[I 2026-02-28 08:41:06,076] Trial 14 finished with value: 0.8863875296539099 and parameters: {'activation': 'identity', 'solver': 'adam', 'lr': 0.0007479355404409705, 'layer1': 340, 'layer2': 392, 'layer3': 396}. Best is trial 8 with value: 0.8879562150966016.
Staphylococcus_Aureus | LPS | Optuna:   8%|▊         | 15/200 [34:52<7:51:06, 152.79s/it, best=0.888]Staphylococcus_Aureus | LPS | Optuna:   8%|▊         | 15/200 [34:52<7:51:06, 152.79s/it, best=0.888][I 2026-02-28 08:41:29,468] Trial 64 finished with value: 0.8650253944448035 and parameters: {'activation': 'identity', 'solver': 'adam', 'lr': 0.0013931144068204204, 'layer1': 482, 'layer2': 389, 'layer3': 181}. Best is trial 31 with value: 0.866367214803268.
Pseudomonas_Aeruginosa | DirectMulti | Optuna:  32%|███▎      | 65/200 [1:45:15<3:56:44, 105.22s/it, best=0.866]Pseudomonas_Aeruginosa | DirectMulti | Optuna:  32%|███▎      | 65/200 [1:45:15<3:56:44, 105.22s/it, best=0.866]/export/usuarios01/egarroyo/MALDI_for_AMR_prediction/venv/lib/python3.13/site-packages/sklearn/model_selection/_split.py:813: UserWarning: The least populated class in y has only 4 members, which is less than n_splits=5.
  warnings.warn(
[I 2026-02-28 08:41:42,111] Trial 190 finished with value: 0.9809044584595783 and parameters: {'activation': 'tanh', 'solver': 'adam', 'lr': 0.001145538958863385, 'layer1': 343, 'layer2': 330, 'layer3': 37}. Best is trial 161 with value: 0.9845171402894224.

Klebsiella_Pneumoniae | Meropenem | Optuna:  96%|█████████▌| 191/200 [2:42:22<07:24, 49.38s/it, best=0.985][A
Klebsiella_Pneumoniae | Meropenem | Optuna:  96%|█████████▌| 191/200 [2:42:22<07:24, 49.38s/it, best=0.985][A[I 2026-02-28 08:42:25,125] Trial 191 finished with value: 0.9812870702666826 and parameters: {'activation': 'tanh', 'solver': 'adam', 'lr': 0.0009986943490108034, 'layer1': 289, 'layer2': 312, 'layer3': 81}. Best is trial 161 with value: 0.9845171402894224.

Klebsiella_Pneumoniae | Meropenem | Optuna:  96%|█████████▌| 192/200 [2:43:05<06:19, 47.47s/it, best=0.985][A
Klebsiella_Pneumoniae | Meropenem | Optuna:  96%|█████████▌| 192/200 [2:43:05<06:19, 47.47s/it, best=0.985][A[I 2026-02-28 08:42:31,836] Trial 20 finished with value: 0.9017422291222434 and parameters: {'activation': 'logistic', 'solver': 'adam', 'lr': 0.003988956930078274, 'layer1': 435, 'layer2': 224, 'layer3': 313}. Best is trial 16 with value: 0.9144489703452822.

Escherichia_Coli | Piperacillin-Tazobactam | Optuna:  10%|█         | 21/200 [38:24<5:52:47, 118.25s/it, best=0.914][A
Escherichia_Coli | Piperacillin-Tazobactam | Optuna:  10%|█         | 21/200 [38:24<5:52:47, 118.25s/it, best=0.914][A[I 2026-02-28 08:43:07,269] Trial 192 finished with value: 0.9803866999450037 and parameters: {'activation': 'tanh', 'solver': 'adam', 'lr': 0.0007801105743642187, 'layer1': 199, 'layer2': 299, 'layer3': 49}. Best is trial 161 with value: 0.9845171402894224.

Klebsiella_Pneumoniae | Meropenem | Optuna:  96%|█████████▋| 193/200 [2:43:47<05:21, 45.87s/it, best=0.985][A
