Staphylococcus_Aureus | LPS | Optuna:   3%|▎         | 6/200 [08:41<5:34:34, 103.48s/it, best=0.844]Staphylococcus_Aureus | LPS | Optuna:   3%|▎         | 6/200 [08:41<5:34:34, 103.48s/it, best=0.844][I 2026-02-28 08:15:29,905] Trial 153 finished with value: 0.9819515207740785 and parameters: {'activation': 'tanh', 'solver': 'adam', 'lr': 0.0008192421991598906, 'layer1': 162, 'layer2': 283, 'layer3': 93}. Best is trial 119 with value: 0.983615836127451.

Klebsiella_Pneumoniae | Meropenem | Optuna:  77%|███████▋  | 154/200 [2:16:10<31:40, 41.31s/it, best=0.984][A
Klebsiella_Pneumoniae | Meropenem | Optuna:  77%|███████▋  | 154/200 [2:16:10<31:40, 41.31s/it, best=0.984][A[I 2026-02-28 08:16:04,062] Trial 154 finished with value: 0.9793539796755649 and parameters: {'activation': 'tanh', 'solver': 'adam', 'lr': 0.0007753698655914839, 'layer1': 151, 'layer2': 279, 'layer3': 121}. Best is trial 119 with value: 0.983615836127451.

Klebsiella_Pneumoniae | Meropenem | Optuna:  78%|███████▊  | 155/200 [2:16:44<29:22, 39.16s/it, best=0.984][A
Klebsiella_Pneumoniae | Meropenem | Optuna:  78%|███████▊  | 155/200 [2:16:44<29:22, 39.16s/it, best=0.984][A[I 2026-02-28 08:16:21,539] Trial 7 finished with value: 0.9102875991548827 and parameters: {'activation': 'relu', 'solver': 'adam', 'lr': 0.0012164139351417069, 'layer1': 46, 'layer2': 186, 'layer3': 66}. Best is trial 7 with value: 0.9102875991548827.

Escherichia_Coli | Piperacillin-Tazobactam | Optuna:   4%|▍         | 8/200 [12:14<5:59:55, 112.48s/it, best=0.9][A
Escherichia_Coli | Piperacillin-Tazobactam | Optuna:   4%|▍         | 8/200 [12:14<5:59:55, 112.48s/it, best=0.91][A[I 2026-02-28 08:16:23,952] Trial 48 finished with value: 0.8643084018728227 and parameters: {'activation': 'identity', 'solver': 'adam', 'lr': 0.0018822019724277534, 'layer1': 384, 'layer2': 424, 'layer3': 339}. Best is trial 31 with value: 0.866367214803268.
Pseudomonas_Aeruginosa | DirectMulti | Optuna:  24%|██▍       | 49/200 [1:20:10<3:37:53, 86.58s/it, best=0.866]Pseudomonas_Aeruginosa | DirectMulti | Optuna:  24%|██▍       | 49/200 [1:20:10<3:37:53, 86.58s/it, best=0.866]/export/usuarios01/egarroyo/MALDI_for_AMR_prediction/venv/lib/python3.13/site-packages/sklearn/model_selection/_split.py:813: UserWarning: The least populated class in y has only 4 members, which is less than n_splits=5.
  warnings.warn(
[I 2026-02-28 08:16:38,133] Trial 155 finished with value: 0.9798543039544757 and parameters: {'activation': 'tanh', 'solver': 'adam', 'lr': 0.0014463364102461761, 'layer1': 52, 'layer2': 297, 'layer3': 91}. Best is trial 119 with value: 0.983615836127451.

Klebsiella_Pneumoniae | Meropenem | Optuna:  78%|███████▊  | 156/200 [2:17:18<27:36, 37.64s/it, best=0.984][A
Klebsiella_Pneumoniae | Meropenem | Optuna:  78%|███████▊  | 156/200 [2:17:18<27:36, 37.64s/it, best=0.984][A[I 2026-02-28 08:17:15,296] Trial 156 finished with value: 0.9815229095425437 and parameters: {'activation': 'tanh', 'solver': 'adam', 'lr': 0.0011902418427768117, 'layer1': 122, 'layer2': 327, 'layer3': 105}. Best is trial 119 with value: 0.983615836127451.

Klebsiella_Pneumoniae | Meropenem | Optuna:  78%|███████▊  | 157/200 [2:17:55<26:52, 37.49s/it, best=0.984][A
Klebsiella_Pneumoniae | Meropenem | Optuna:  78%|███████▊  | 157/200 [2:17:55<26:52, 37.49s/it, best=0.984][A[I 2026-02-28 08:17:33,116] Trial 49 finished with value: 0.845342093369062 and parameters: {'activation': 'tanh', 'solver': 'adam', 'lr': 0.004635872448471087, 'layer1': 195, 'layer2': 499, 'layer3': 439}. Best is trial 31 with value: 0.866367214803268.
Pseudomonas_Aeruginosa | DirectMulti | Optuna:  25%|██▌       | 50/200 [1:21:19<3:23:23, 81.36s/it, best=0.866]Pseudomonas_Aeruginosa | DirectMulti | Optuna:  25%|██▌       | 50/200 [1:21:19<3:23:23, 81.36s/it, best=0.866]/export/usuarios01/egarroyo/MALDI_for_AMR_prediction/venv/lib/python3.13/site-packages/sklearn/model_selection/_split.py:813: UserWarning: The least populated class in y has only 4 members, which is less than n_splits=5.
  warnings.warn(
[I 2026-02-28 08:18:24,996] Trial 157 finished with value: 0.9774865610245852 and parameters: {'activation': 'tanh', 'solver': 'adam', 'lr': 1.3459168397000321e-05, 'layer1': 158, 'layer2': 316, 'layer3': 117}. Best is trial 119 with value: 0.983615836127451.

Klebsiella_Pneumoniae | Meropenem | Optuna:  79%|███████▉  | 158/200 [2:19:05<33:00, 47.16s/it, best=0.984][A
Klebsiella_Pneumoniae | Meropenem | Optuna:  79%|███████▉  | 158/200 [2:19:05<33:00, 47.16s/it, best=0.984][A[I 2026-02-28 08:19:01,493] Trial 8 finished with value: 0.9100838563004894 and parameters: {'activation': 'identity', 'solver': 'adam', 'lr': 0.000828752236376816, 'layer1': 323, 'layer2': 445, 'layer3': 241}. Best is trial 7 with value: 0.9102875991548827.

Escherichia_Coli | Piperacillin-Tazobactam | Optuna:   4%|▍         | 9/200 [14:54<6:45:18, 127.32s/it, best=0.91][A
Escherichia_Coli | Piperacillin-Tazobactam | Optuna:   4%|▍         | 9/200 [14:54<6:45:18, 127.32s/it, best=0.91][A[I 2026-02-28 08:19:06,071] Trial 158 finished with value: 0.9822821001716759 and parameters: {'activation': 'tanh', 'solver': 'adam', 'lr': 0.0008691676054403616, 'layer1': 42, 'layer2': 288, 'layer3': 94}. Best is trial 119 with value: 0.983615836127451.

Klebsiella_Pneumoniae | Meropenem | Optuna:  80%|███████▉  | 159/200 [2:19:46<30:58, 45.33s/it, best=0.984][A
Klebsiella_Pneumoniae | Meropenem | Optuna:  80%|███████▉  | 159/200 [2:19:46<30:58, 45.33s/it, best=0.984][A[I 2026-02-28 08:19:30,811] Trial 159 finished with value: 0.9785121352724172 and parameters: {'activation': 'identity', 'solver': 'adam', 'lr': 0.0008832133968246068, 'layer1': 98, 'layer2': 281, 'layer3': 92}. Best is trial 119 with value: 0.983615836127451.

Klebsiella_Pneumoniae | Meropenem | Optuna:  80%|████████  | 160/200 [2:20:11<26:06, 39.15s/it, best=0.984][A
Klebsiella_Pneumoniae | Meropenem | Optuna:  80%|████████  | 160/200 [2:20:11<26:06, 39.15s/it, best=0.984][A[I 2026-02-28 08:19:41,674] Trial 50 finished with value: 0.8644084084557955 and parameters: {'activation': 'identity', 'solver': 'adam', 'lr': 0.009875605439892094, 'layer1': 500, 'layer2': 445, 'layer3': 178}. Best is trial 31 with value: 0.866367214803268.
Pseudomonas_Aeruginosa | DirectMulti | Optuna:  26%|██▌       | 51/200 [1:23:27<3:57:12, 95.52s/it, best=0.866]Pseudomonas_Aeruginosa | DirectMulti | Optuna:  26%|██▌       | 51/200 [1:23:27<3:57:12, 95.52s/it, best=0.866]/export/usuarios01/egarroyo/MALDI_for_AMR_prediction/venv/lib/python3.13/site-packages/sklearn/model_selection/_split.py:813: UserWarning: The least populated class in y has only 4 members, which is less than n_splits=5.
  warnings.warn(
[I 2026-02-28 08:20:13,592] Trial 160 finished with value: 0.9819157827997269 and parameters: {'activation': 'tanh', 'solver': 'adam', 'lr': 0.0006283321701076901, 'layer1': 138, 'layer2': 310, 'layer3': 76}. Best is trial 119 with value: 0.983615836127451.

Klebsiella_Pneumoniae | Meropenem | Optuna:  80%|████████  | 161/200 [2:20:54<26:09, 40.24s/it, best=0.984][A
Klebsiella_Pneumoniae | Meropenem | Optuna:  80%|████████  | 161/200 [2:20:54<26:09, 40.24s/it, best=0.984][A[I 2026-02-28 08:20:43,507] Trial 51 finished with value: 0.8628232159528519 and parameters: {'activation': 'identity', 'solver': 'adam', 'lr': 0.00019210611594738027, 'layer1': 11, 'layer2': 405, 'layer3': 454}. Best is trial 31 with value: 0.866367214803268.
Pseudomonas_Aeruginosa | DirectMulti | Optuna:  26%|██▌       | 52/200 [1:24:29<3:30:40, 85.41s/it, best=0.866]Pseudomonas_Aeruginosa | DirectMulti | Optuna:  26%|██▌       | 52/200 [1:24:29<3:30:40, 85.41s/it, best=0.866]/export/usuarios01/egarroyo/MALDI_for_AMR_prediction/venv/lib/python3.13/site-packages/sklearn/model_selection/_split.py:813: UserWarning: The least populated class in y has only 4 members, which is less than n_splits=5.
  warnings.warn(
[I 2026-02-28 08:21:05,075] Trial 161 finished with value: 0.9845171402894224 and parameters: {'activation': 'tanh', 'solver': 'adam', 'lr': 0.0006818289798983198, 'layer1': 152, 'layer2': 310, 'layer3': 78}. Best is trial 161 with value: 0.9845171402894224.

Klebsiella_Pneumoniae | Meropenem | Optuna:  81%|████████  | 162/200 [2:21:45<27:37, 43.61s/it, best=0.984][A
Klebsiella_Pneumoniae | Meropenem | Optuna:  81%|████████  | 162/200 [2:21:45<27:37, 43.61s/it, best=0.985][A[I 2026-02-28 08:21:22,155] Trial 9 finished with value: 0.8994467986468562 and parameters: {'activation': 'tanh', 'solver': 'sgd', 'lr': 0.00012329098365270507, 'layer1': 219, 'layer2': 22, 'layer3': 62}. Best is trial 7 with value: 0.9102875991548827.

Escherichia_Coli | Piperacillin-Tazobactam | Optuna:   5%|▌         | 10/200 [17:14<6:56:13, 131.44s/it, best=0.91][A
Escherichia_Coli | Piperacillin-Tazobactam | Optuna:   5%|▌         | 10/200 [17:14<6:56:13, 131.44s/it, best=0.91][A[I 2026-02-28 08:21:32,125] Trial 6 finished with value: 0.8567930608493644 and parameters: {'activation': 'tanh', 'solver': 'adam', 'lr': 3.6618192203924288e-06, 'layer1': 403, 'layer2': 46, 'layer3': 494}. Best is trial 6 with value: 0.8567930608493644.
Staphylococcus_Aureus | LPS | Optuna:   4%|▎         | 7/200 [15:18<10:41:19, 199.37s/it, best=0.844]Staphylococcus_Aureus | LPS | Optuna:   4%|▎         | 7/200 [15:18<10:41:19, 199.37s/it, best=0.857][I 2026-02-28 08:21:46,294] Trial 162 finished with value: 0.9809863570347914 and parameters: {'activation': 'tanh', 'solver': 'adam', 'lr': 0.0006502175784844342, 'layer1': 149, 'layer2': 310, 'layer3': 76}. Best is trial 161 with value: 0.9845171402894224.

Klebsiella_Pneumoniae | Meropenem | Optuna:  82%|████████▏ | 163/200 [2:22:26<26:27, 42.90s/it, best=0.985][A
Klebsiella_Pneumoniae | Meropenem | Optuna:  82%|████████▏ | 163/200 [2:22:26<26:27, 42.90s/it, best=0.985][A[I 2026-02-28 08:21:46,838] Trial 10 finished with value: 0.8958344038173316 and parameters: {'activation': 'relu', 'solver': 'sgd', 'lr': 0.007553503645583194, 'layer1': 18, 'layer2': 151, 'layer3': 348}. Best is trial 7 with value: 0.9102875991548827.

Escherichia_Coli | Piperacillin-Tazobactam | Optuna:   6%|▌         | 11/200 [17:39<5:11:06, 98.77s/it, best=0.91] [A
Escherichia_Coli | Piperacillin-Tazobactam | Optuna:   6%|▌         | 11/200 [17:39<5:11:06, 98.77s/it, best=0.91][A[I 2026-02-28 08:22:20,552] Trial 163 finished with value: 0.9819693896568655 and parameters: {'activation': 'tanh', 'solver': 'adam', 'lr': 0.0005231071499717454, 'layer1': 143, 'layer2': 324, 'layer3': 68}. Best is trial 161 with value: 0.9845171402894224.

Klebsiella_Pneumoniae | Meropenem | Optuna:  82%|████████▏ | 164/200 [2:23:01<24:10, 40.30s/it, best=0.985][A
Klebsiella_Pneumoniae | Meropenem | Optuna:  82%|████████▏ | 164/200 [2:23:01<24:10, 40.30s/it, best=0.985][A[I 2026-02-28 08:22:44,323] Trial 52 finished with value: 0.8641892905895812 and parameters: {'activation': 'identity', 'solver': 'adam', 'lr': 0.0003962544846409297, 'layer1': 466, 'layer2': 386, 'layer3': 480}. Best is trial 31 with value: 0.866367214803268.
Pseudomonas_Aeruginosa | DirectMulti | Optuna:  26%|██▋       | 53/200 [1:26:30<3:55:16, 96.03s/it, best=0.866]Pseudomonas_Aeruginosa | DirectMulti | Optuna:  26%|██▋       | 53/200 [1:26:30<3:55:16, 96.03s/it, best=0.866]/export/usuarios01/egarroyo/MALDI_for_AMR_prediction/venv/lib/python3.13/site-packages/sklearn/model_selection/_split.py:813: UserWarning: The least populated class in y has only 4 members, which is less than n_splits=5.
  warnings.warn(
[I 2026-02-28 08:22:52,838] Trial 164 finished with value: 0.9795988695877622 and parameters: {'activation': 'tanh', 'solver': 'adam', 'lr': 0.0005289830703637844, 'layer1': 144, 'layer2': 338, 'layer3': 55}. Best is trial 161 with value: 0.9845171402894224.

Klebsiella_Pneumoniae | Meropenem | Optuna:  82%|████████▎ | 165/200 [2:23:33<22:06, 37.90s/it, best=0.985][A
Klebsiella_Pneumoniae | Meropenem | Optuna:  82%|████████▎ | 165/200 [2:23:33<22:06, 37.90s/it, best=0.985][A[I 2026-02-28 08:22:56,277] Trial 7 finished with value: 0.8776635352511292 and parameters: {'activation': 'relu', 'solver': 'adam', 'lr': 0.0012164139351417069, 'layer1': 46, 'layer2': 186, 'layer3': 66}. Best is trial 7 with value: 0.8776635352511292.
Staphylococcus_Aureus | LPS | Optuna:   4%|▍         | 8/200 [16:42<8:40:37, 162.69s/it, best=0.857] Staphylococcus_Aureus | LPS | Optuna:   4%|▍         | 8/200 [16:42<8:40:37, 162.69s/it, best=0.878][I 2026-02-28 08:23:43,641] Trial 165 finished with value: 0.9822686834847563 and parameters: {'activation': 'tanh', 'solver': 'adam', 'lr': 0.0006401536572045225, 'layer1': 168, 'layer2': 324, 'layer3': 70}. Best is trial 161 with value: 0.9845171402894224.

Klebsiella_Pneumoniae | Meropenem | Optuna:  83%|████████▎ | 166/200 [2:24:24<23:40, 41.77s/it, best=0.985][A
Klebsiella_Pneumoniae | Meropenem | Optuna:  83%|████████▎ | 166/200 [2:24:24<23:40, 41.77s/it, best=0.985][A[I 2026-02-28 08:24:20,369] Trial 11 finished with value: 0.908175596865379 and parameters: {'activation': 'identity', 'solver': 'adam', 'lr': 0.0013124793805688133, 'layer1': 347, 'layer2': 497, 'layer3': 312}. Best is trial 7 with value: 0.9102875991548827.

Escherichia_Coli | Piperacillin-Tazobactam | Optuna:   6%|▌         | 12/200 [20:13<6:01:40, 115.43s/it, best=0.91][A
Escherichia_Coli | Piperacillin-Tazobactam | Optuna:   6%|▌         | 12/200 [20:13<6:01:40, 115.43s/it, best=0.91][A[I 2026-02-28 08:24:29,308] Trial 166 finished with value: 0.9821058428385495 and parameters: {'activation': 'tanh', 'solver': 'adam', 'lr': 0.0007847838673054876, 'layer1': 129, 'layer2': 327, 'layer3': 69}. Best is trial 161 with value: 0.9845171402894224.

Klebsiella_Pneumoniae | Meropenem | Optuna:  84%|████████▎ | 167/200 [2:25:09<23:36, 42.94s/it, best=0.985][A
Klebsiella_Pneumoniae | Meropenem | Optuna:  84%|████████▎ | 167/200 [2:25:09<23:36, 42.94s/it, best=0.985][A[I 2026-02-28 08:24:39,206] Trial 53 finished with value: 0.8645892131449073 and parameters: {'activation': 'identity', 'solver': 'adam', 'lr': 0.00016935387365167148, 'layer1': 454, 'layer2': 416, 'layer3': 452}. Best is trial 31 with value: 0.866367214803268.
Pseudomonas_Aeruginosa | DirectMulti | Optuna:  27%|██▋       | 54/200 [1:28:25<4:07:26, 101.69s/it, best=0.866]Pseudomonas_Aeruginosa | DirectMulti | Optuna:  27%|██▋       | 54/200 [1:28:25<4:07:26, 101.69s/it, best=0.866]/export/usuarios01/egarroyo/MALDI_for_AMR_prediction/venv/lib/python3.13/site-packages/sklearn/model_selection/_split.py:813: UserWarning: The least populated class in y has only 4 members, which is less than n_splits=5.
  warnings.warn(
[I 2026-02-28 08:25:07,683] Trial 167 finished with value: 0.9805941246814942 and parameters: {'activation': 'tanh', 'solver': 'adam', 'lr': 0.0004555241681323181, 'layer1': 125, 'layer2': 327, 'layer3': 72}. Best is trial 161 with value: 0.9845171402894224.

Klebsiella_Pneumoniae | Meropenem | Optuna:  84%|████████▍ | 168/200 [2:25:48<22:10, 41.57s/it, best=0.985][A
Klebsiella_Pneumoniae | Meropenem | Optuna:  84%|████████▍ | 168/200 [2:25:48<22:10, 41.57s/it, best=0.985][A[I 2026-02-28 08:26:04,044] Trial 168 finished with value: 0.9838663442139299 and parameters: {'activation': 'tanh', 'solver': 'adam', 'lr': 0.0007100977059225701, 'layer1': 175, 'layer2': 349, 'layer3': 65}. Best is trial 161 with value: 0.9845171402894224.

Klebsiella_Pneumoniae | Meropenem | Optuna:  84%|████████▍ | 169/200 [2:26:44<23:46, 46.01s/it, best=0.985][A
Klebsiella_Pneumoniae | Meropenem | Optuna:  84%|████████▍ | 169/200 [2:26:44<23:46, 46.01s/it, best=0.985][A[I 2026-02-28 08:26:06,953] Trial 8 finished with value: 0.8879562150966016 and parameters: {'activation': 'identity', 'solver': 'adam', 'lr': 0.000828752236376816, 'layer1': 323, 'layer2': 445, 'layer3': 241}. Best is trial 8 with value: 0.8879562150966016.
Staphylococcus_Aureus | LPS | Optuna:   4%|▍         | 9/200 [19:53<9:05:45, 171.44s/it, best=0.878]Staphylococcus_Aureus | LPS | Optuna:   4%|▍         | 9/200 [19:53<9:05:45, 171.44s/it, best=0.888][I 2026-02-28 08:26:09,005] Trial 54 finished with value: 0.8613444359577809 and parameters: {'activation': 'identity', 'solver': 'adam', 'lr': 0.0001078937078299845, 'layer1': 414, 'layer2': 65, 'layer3': 227}. Best is trial 31 with value: 0.866367214803268.
Pseudomonas_Aeruginosa | DirectMulti | Optuna:  28%|██▊       | 55/200 [1:29:55<3:57:07, 98.12s/it, best=0.866] Pseudomonas_Aeruginosa | DirectMulti | Optuna:  28%|██▊       | 55/200 [1:29:55<3:57:07, 98.12s/it, best=0.866]/export/usuarios01/egarroyo/MALDI_for_AMR_prediction/venv/lib/python3.13/site-packages/sklearn/model_selection/_split.py:813: UserWarning: The least populated class in y has only 4 members, which is less than n_splits=5.
  warnings.warn(
[I 2026-02-28 08:26:46,279] Trial 169 finished with value: 0.9767069569332589 and parameters: {'activation': 'tanh', 'solver': 'sgd', 'lr': 0.0007256965005631592, 'layer1': 177, 'layer2': 367, 'layer3': 284}. Best is trial 161 with value: 0.9845171402894224.

Klebsiella_Pneumoniae | Meropenem | Optuna:  85%|████████▌ | 170/200 [2:27:26<22:26, 44.88s/it, best=0.985][A
Klebsiella_Pneumoniae | Meropenem | Optuna:  85%|████████▌ | 170/200 [2:27:26<22:26, 44.88s/it, best=0.985][A[I 2026-02-28 08:26:54,621] Trial 12 finished with value: 0.91091892691744 and parameters: {'activation': 'identity', 'solver': 'adam', 'lr': 0.00046544039809979403, 'layer1': 166, 'layer2': 434, 'layer3': 247}. Best is trial 12 with value: 0.91091892691744.

Escherichia_Coli | Piperacillin-Tazobactam | Optuna:   6%|▋         | 13/200 [22:47<6:36:24, 127.19s/it, best=0.91][A
Escherichia_Coli | Piperacillin-Tazobactam | Optuna:   6%|▋         | 13/200 [22:47<6:36:24, 127.19s/it, best=0.911][A[I 2026-02-28 08:27:21,274] Trial 170 finished with value: 0.9817450173746816 and parameters: {'activation': 'tanh', 'solver': 'adam', 'lr': 0.0008869162181023046, 'layer1': 65, 'layer2': 335, 'layer3': 59}. Best is trial 161 with value: 0.9845171402894224.

Klebsiella_Pneumoniae | Meropenem | Optuna:  86%|████████▌ | 171/200 [2:28:01<20:15, 41.91s/it, best=0.985][A
Klebsiella_Pneumoniae | Meropenem | Optuna:  86%|████████▌ | 171/200 [2:28:01<20:15, 41.91s/it, best=0.985][A[I 2026-02-28 08:27:28,426] Trial 55 finished with value: 0.8609511273938842 and parameters: {'activation': 'identity', 'solver': 'adam', 'lr': 5.0499069183492044e-05, 'layer1': 103, 'layer2': 336, 'layer3': 408}. Best is trial 31 with value: 0.866367214803268.
Pseudomonas_Aeruginosa | DirectMulti | Optuna:  28%|██▊       | 56/200 [1:31:14<3:42:01, 92.51s/it, best=0.866]Pseudomonas_Aeruginosa | DirectMulti | Optuna:  28%|██▊       | 56/200 [1:31:14<3:42:01, 92.51s/it, best=0.866]/export/usuarios01/egarroyo/MALDI_for_AMR_prediction/venv/lib/python3.13/site-packages/sklearn/model_selection/_split.py:813: UserWarning: The least populated class in y has only 4 members, which is less than n_splits=5.
  warnings.warn(
[I 2026-02-28 08:27:49,147] Trial 9 finished with value: 0.8033412728511508 and parameters: {'activation': 'tanh', 'solver': 'sgd', 'lr': 0.00012329098365270507, 'layer1': 219, 'layer2': 22, 'layer3': 62}. Best is trial 8 with value: 0.8879562150966016.
Staphylococcus_Aureus | LPS | Optuna:   5%|▌         | 10/200 [21:35<7:55:11, 150.06s/it, best=0.888]Staphylococcus_Aureus | LPS | Optuna:   5%|▌         | 10/200 [21:35<7:55:11, 150.06s/it, best=0.888][I 2026-02-28 08:28:00,983] Trial 171 finished with value: 0.9814617994933101 and parameters: {'activation': 'tanh', 'solver': 'adam', 'lr': 0.0005603125807832235, 'layer1': 135, 'layer2': 377, 'layer3': 66}. Best is trial 161 with value: 0.9845171402894224.

Klebsiella_Pneumoniae | Meropenem | Optuna:  86%|████████▌ | 172/200 [2:28:41<19:15, 41.25s/it, best=0.985][A
Klebsiella_Pneumoniae | Meropenem | Optuna:  86%|████████▌ | 172/200 [2:28:41<19:15, 41.25s/it, best=0.985][A[I 2026-02-28 08:28:32,060] Trial 56 finished with value: 0.826779055404294 and parameters: {'activation': 'identity', 'solver': 'sgd', 'lr': 0.0006637676275835948, 'layer1': 435, 'layer2': 455, 'layer3': 374}. Best is trial 31 with value: 0.866367214803268.
Pseudomonas_Aeruginosa | DirectMulti | Optuna:  28%|██▊       | 57/200 [1:32:18<3:19:50, 83.85s/it, best=0.866]Pseudomonas_Aeruginosa | DirectMulti | Optuna:  28%|██▊       | 57/200 [1:32:18<3:19:50, 83.85s/it, best=0.866]/export/usuarios01/egarroyo/MALDI_for_AMR_prediction/venv/lib/python3.13/site-packages/sklearn/model_selection/_split.py:813: UserWarning: The least populated class in y has only 4 members, which is less than n_splits=5.
  warnings.warn(
[I 2026-02-28 08:28:34,767] Trial 13 finished with value: 0.9126969711814088 and parameters: {'activation': 'relu', 'solver': 'adam', 'lr': 0.00035283375750011015, 'layer1': 140, 'layer2': 164, 'layer3': 438}. Best is trial 13 with value: 0.9126969711814088.

Escherichia_Coli | Piperacillin-Tazobactam | Optuna:   7%|▋         | 14/200 [24:27<6:08:57, 119.02s/it, best=0.911][A
Escherichia_Coli | Piperacillin-Tazobactam | Optuna:   7%|▋         | 14/200 [24:27<6:08:57, 119.02s/it, best=0.913][A[I 2026-02-28 08:28:37,846] Trial 172 finished with value: 0.9805152580957672 and parameters: {'activation': 'tanh', 'solver': 'adam', 'lr': 0.0007308903655731801, 'layer1': 187, 'layer2': 357, 'layer3': 100}. Best is trial 161 with value: 0.9845171402894224.

Klebsiella_Pneumoniae | Meropenem | Optuna:  86%|████████▋ | 173/200 [2:29:18<17:58, 39.93s/it, best=0.985][A
