Escherichia_Coli | Cefepime | Optuna:   9%|▉         | 18/200 [35:28<5:56:38, 117.58s/it, best=0.891][A[I 2026-02-28 15:33:19,646] Trial 24 finished with value: 0.8850454957013463 and parameters: {'activation': 'identity', 'solver': 'adam', 'lr': 4.530539877053948e-05, 'layer1': 320, 'layer2': 423, 'layer3': 393}. Best is trial 13 with value: 0.8854966355859718.
Staphylococcus_Aureus | DirectMulti | Optuna:  12%|█▎        | 25/200 [1:03:25<7:46:16, 159.87s/it, best=0.885]Staphylococcus_Aureus | DirectMulti | Optuna:  12%|█▎        | 25/200 [1:03:25<7:46:16, 159.87s/it, best=0.885][I 2026-02-28 15:33:48,817] Trial 18 finished with value: 0.7583753901834622 and parameters: {'activation': 'relu', 'solver': 'sgd', 'lr': 5.179303904439729e-05, 'layer1': 366, 'layer2': 215, 'layer3': 416}. Best is trial 14 with value: 0.8911503569339929.

Escherichia_Coli | Cefepime | Optuna:  10%|▉         | 19/200 [36:13<4:48:52, 95.76s/it, best=0.891] [A
Escherichia_Coli | Cefepime | Optuna:  10%|▉         | 19/200 [36:13<4:48:52, 95.76s/it, best=0.891][A[I 2026-02-28 15:34:47,566] Trial 19 finished with value: 0.8774656742569074 and parameters: {'activation': 'tanh', 'solver': 'adam', 'lr': 0.00036385901209335086, 'layer1': 439, 'layer2': 88, 'layer3': 464}. Best is trial 14 with value: 0.8911503569339929.

Escherichia_Coli | Cefepime | Optuna:  10%|█         | 20/200 [37:12<4:13:56, 84.65s/it, best=0.891][A
Escherichia_Coli | Cefepime | Optuna:  10%|█         | 20/200 [37:12<4:13:56, 84.65s/it, best=0.891][A[I 2026-02-28 15:34:58,496] Trial 80 finished with value: 0.8416929039936154 and parameters: {'activation': 'tanh', 'solver': 'sgd', 'lr': 4.280810214506467e-05, 'layer1': 49, 'layer2': 466, 'layer3': 421}. Best is trial 71 with value: 0.9223964650152305.
Klebsiella_Pneumoniae | DirectMulti | Optuna:  40%|████      | 81/200 [2:08:44<5:19:26, 161.07s/it, best=0.922]Klebsiella_Pneumoniae | DirectMulti | Optuna:  40%|████      | 81/200 [2:08:44<5:19:26, 161.07s/it, best=0.922][I 2026-02-28 15:36:04,427] Trial 81 finished with value: 0.9197213349810534 and parameters: {'activation': 'tanh', 'solver': 'adam', 'lr': 0.00012202047461878874, 'layer1': 11, 'layer2': 406, 'layer3': 355}. Best is trial 71 with value: 0.9223964650152305.
Klebsiella_Pneumoniae | DirectMulti | Optuna:  41%|████      | 82/200 [2:09:50<4:20:37, 132.53s/it, best=0.922]Klebsiella_Pneumoniae | DirectMulti | Optuna:  41%|████      | 82/200 [2:09:50<4:20:37, 132.53s/it, best=0.922][I 2026-02-28 15:36:06,997] Trial 25 finished with value: 0.8832551554102792 and parameters: {'activation': 'identity', 'solver': 'adam', 'lr': 3.298146611664649e-05, 'layer1': 311, 'layer2': 427, 'layer3': 295}. Best is trial 13 with value: 0.8854966355859718.
Staphylococcus_Aureus | DirectMulti | Optuna:  13%|█▎        | 26/200 [1:06:12<7:50:07, 162.11s/it, best=0.885]Staphylococcus_Aureus | DirectMulti | Optuna:  13%|█▎        | 26/200 [1:06:12<7:50:07, 162.11s/it, best=0.885][I 2026-02-28 15:37:12,707] Trial 82 finished with value: 0.9215245402780742 and parameters: {'activation': 'tanh', 'solver': 'adam', 'lr': 6.8503399954197e-05, 'layer1': 36, 'layer2': 443, 'layer3': 373}. Best is trial 71 with value: 0.9223964650152305.
Klebsiella_Pneumoniae | DirectMulti | Optuna:  42%|████▏     | 83/200 [2:10:58<3:40:50, 113.25s/it, best=0.922]Klebsiella_Pneumoniae | DirectMulti | Optuna:  42%|████▏     | 83/200 [2:10:58<3:40:50, 113.25s/it, best=0.922][I 2026-02-28 15:37:17,783] Trial 20 finished with value: 0.8728641500476195 and parameters: {'activation': 'logistic', 'solver': 'adam', 'lr': 0.003988956930078274, 'layer1': 486, 'layer2': 175, 'layer3': 392}. Best is trial 14 with value: 0.8911503569339929.

Escherichia_Coli | Cefepime | Optuna:  10%|█         | 21/200 [39:42<5:11:15, 104.33s/it, best=0.891][A
Escherichia_Coli | Cefepime | Optuna:  10%|█         | 21/200 [39:42<5:11:15, 104.33s/it, best=0.891][A[I 2026-02-28 15:38:44,893] Trial 83 finished with value: 0.9225890834679372 and parameters: {'activation': 'tanh', 'solver': 'adam', 'lr': 5.860357028197782e-05, 'layer1': 35, 'layer2': 487, 'layer3': 376}. Best is trial 83 with value: 0.9225890834679372.
Klebsiella_Pneumoniae | DirectMulti | Optuna:  42%|████▏     | 84/200 [2:12:30<3:26:44, 106.93s/it, best=0.922]Klebsiella_Pneumoniae | DirectMulti | Optuna:  42%|████▏     | 84/200 [2:12:30<3:26:44, 106.93s/it, best=0.923][I 2026-02-28 15:38:47,589] Trial 21 finished with value: 0.8887218569330841 and parameters: {'activation': 'relu', 'solver': 'adam', 'lr': 0.00017549272177738462, 'layer1': 489, 'layer2': 101, 'layer3': 499}. Best is trial 14 with value: 0.8911503569339929.

Escherichia_Coli | Cefepime | Optuna:  11%|█         | 22/200 [41:12<4:56:34, 99.97s/it, best=0.891] [A
Escherichia_Coli | Cefepime | Optuna:  11%|█         | 22/200 [41:12<4:56:34, 99.97s/it, best=0.891][A[I 2026-02-28 15:40:07,267] Trial 84 finished with value: 0.9228685877627578 and parameters: {'activation': 'tanh', 'solver': 'adam', 'lr': 6.798417259768039e-05, 'layer1': 35, 'layer2': 487, 'layer3': 386}. Best is trial 84 with value: 0.9228685877627578.
Klebsiella_Pneumoniae | DirectMulti | Optuna:  42%|████▎     | 85/200 [2:13:52<3:10:49, 99.56s/it, best=0.923] Klebsiella_Pneumoniae | DirectMulti | Optuna:  42%|████▎     | 85/200 [2:13:52<3:10:49, 99.56s/it, best=0.923][I 2026-02-28 15:40:15,285] Trial 22 finished with value: 0.8887585733564516 and parameters: {'activation': 'relu', 'solver': 'adam', 'lr': 0.00026252183524392685, 'layer1': 453, 'layer2': 80, 'layer3': 467}. Best is trial 14 with value: 0.8911503569339929.

Escherichia_Coli | Cefepime | Optuna:  12%|█▏        | 23/200 [42:40<4:44:02, 96.29s/it, best=0.891][A
Escherichia_Coli | Cefepime | Optuna:  12%|█▏        | 23/200 [42:40<4:44:02, 96.29s/it, best=0.891][A[I 2026-02-28 15:40:22,673] Trial 26 finished with value: 0.8023595511605647 and parameters: {'activation': 'identity', 'solver': 'sgd', 'lr': 8.770980037016198e-05, 'layer1': 363, 'layer2': 327, 'layer3': 385}. Best is trial 13 with value: 0.8854966355859718.
Staphylococcus_Aureus | DirectMulti | Optuna:  14%|█▎        | 27/200 [1:10:28<9:08:21, 190.18s/it, best=0.885]Staphylococcus_Aureus | DirectMulti | Optuna:  14%|█▎        | 27/200 [1:10:28<9:08:21, 190.18s/it, best=0.885][I 2026-02-28 15:41:42,605] Trial 85 finished with value: 0.9225976577629027 and parameters: {'activation': 'tanh', 'solver': 'adam', 'lr': 6.473903456462614e-05, 'layer1': 55, 'layer2': 484, 'layer3': 383}. Best is trial 84 with value: 0.9228685877627578.
Klebsiella_Pneumoniae | DirectMulti | Optuna:  43%|████▎     | 86/200 [2:15:28<3:06:45, 98.30s/it, best=0.923]Klebsiella_Pneumoniae | DirectMulti | Optuna:  43%|████▎     | 86/200 [2:15:28<3:06:45, 98.30s/it, best=0.923][I 2026-02-28 15:41:59,546] Trial 27 finished with value: 0.8846552902080219 and parameters: {'activation': 'logistic', 'solver': 'adam', 'lr': 0.0007121477037970717, 'layer1': 174, 'layer2': 478, 'layer3': 457}. Best is trial 13 with value: 0.8854966355859718.
Staphylococcus_Aureus | DirectMulti | Optuna:  14%|█▍        | 28/200 [1:12:04<7:44:56, 162.19s/it, best=0.885]Staphylococcus_Aureus | DirectMulti | Optuna:  14%|█▍        | 28/200 [1:12:04<7:44:56, 162.19s/it, best=0.885][I 2026-02-28 15:42:16,905] Trial 23 finished with value: 0.8874594803198527 and parameters: {'activation': 'relu', 'solver': 'adam', 'lr': 3.955292386203551e-05, 'layer1': 390, 'layer2': 88, 'layer3': 455}. Best is trial 14 with value: 0.8911503569339929.

Escherichia_Coli | Cefepime | Optuna:  12%|█▏        | 24/200 [44:41<5:04:44, 103.89s/it, best=0.891][A
Escherichia_Coli | Cefepime | Optuna:  12%|█▏        | 24/200 [44:41<5:04:44, 103.89s/it, best=0.891][A[I 2026-02-28 15:43:07,541] Trial 86 finished with value: 0.9210408657823944 and parameters: {'activation': 'tanh', 'solver': 'adam', 'lr': 6.601365736553934e-05, 'layer1': 92, 'layer2': 479, 'layer3': 410}. Best is trial 84 with value: 0.9228685877627578.
Klebsiella_Pneumoniae | DirectMulti | Optuna:  44%|████▎     | 87/200 [2:16:53<2:57:34, 94.29s/it, best=0.923]Klebsiella_Pneumoniae | DirectMulti | Optuna:  44%|████▎     | 87/200 [2:16:53<2:57:34, 94.29s/it, best=0.923][I 2026-02-28 15:43:41,074] Trial 28 finished with value: 0.884791147395136 and parameters: {'activation': 'tanh', 'solver': 'adam', 'lr': 0.00019619706810975647, 'layer1': 308, 'layer2': 423, 'layer3': 492}. Best is trial 13 with value: 0.8854966355859718.
Staphylococcus_Aureus | DirectMulti | Optuna:  14%|█▍        | 29/200 [1:13:46<6:50:22, 143.99s/it, best=0.885]Staphylococcus_Aureus | DirectMulti | Optuna:  14%|█▍        | 29/200 [1:13:46<6:50:22, 143.99s/it, best=0.885][I 2026-02-28 15:43:52,856] Trial 24 finished with value: 0.8894235056506774 and parameters: {'activation': 'relu', 'solver': 'adam', 'lr': 0.00031038487662837804, 'layer1': 450, 'layer2': 55, 'layer3': 380}. Best is trial 14 with value: 0.8911503569339929.

Escherichia_Coli | Cefepime | Optuna:  12%|█▎        | 25/200 [46:17<4:56:03, 101.51s/it, best=0.891][A
Escherichia_Coli | Cefepime | Optuna:  12%|█▎        | 25/200 [46:17<4:56:03, 101.51s/it, best=0.891][A[I 2026-02-28 15:44:19,917] Trial 87 finished with value: 0.9209063871557299 and parameters: {'activation': 'tanh', 'solver': 'adam', 'lr': 8.93737037661182e-05, 'layer1': 22, 'layer2': 489, 'layer3': 383}. Best is trial 84 with value: 0.9228685877627578.
Klebsiella_Pneumoniae | DirectMulti | Optuna:  44%|████▍     | 88/200 [2:18:05<2:43:44, 87.71s/it, best=0.923]Klebsiella_Pneumoniae | DirectMulti | Optuna:  44%|████▍     | 88/200 [2:18:05<2:43:44, 87.71s/it, best=0.923][I 2026-02-28 15:44:21,979] Trial 29 finished with value: 0.6915676937579154 and parameters: {'activation': 'logistic', 'solver': 'sgd', 'lr': 2.8912644384523117e-05, 'layer1': 409, 'layer2': 258, 'layer3': 338}. Best is trial 13 with value: 0.8854966355859718.
Staphylococcus_Aureus | DirectMulti | Optuna:  15%|█▌        | 30/200 [1:14:27<5:20:20, 113.06s/it, best=0.885]Staphylococcus_Aureus | DirectMulti | Optuna:  15%|█▌        | 30/200 [1:14:27<5:20:20, 113.06s/it, best=0.885][I 2026-02-28 15:45:22,308] Trial 25 finished with value: 0.8839252778737865 and parameters: {'activation': 'relu', 'solver': 'adam', 'lr': 0.0005741803677895337, 'layer1': 307, 'layer2': 17, 'layer3': 392}. Best is trial 14 with value: 0.8911503569339929.

Escherichia_Coli | Cefepime | Optuna:  13%|█▎        | 26/200 [47:47<4:43:52, 97.89s/it, best=0.891] [A
Escherichia_Coli | Cefepime | Optuna:  13%|█▎        | 26/200 [47:47<4:43:52, 97.89s/it, best=0.891][A[I 2026-02-28 15:45:41,597] Trial 88 finished with value: 0.9219529298470819 and parameters: {'activation': 'tanh', 'solver': 'adam', 'lr': 5.611651046803874e-05, 'layer1': 48, 'layer2': 500, 'layer3': 427}. Best is trial 84 with value: 0.9228685877627578.
Klebsiella_Pneumoniae | DirectMulti | Optuna:  44%|████▍     | 89/200 [2:19:27<2:38:55, 85.90s/it, best=0.923]Klebsiella_Pneumoniae | DirectMulti | Optuna:  44%|████▍     | 89/200 [2:19:27<2:38:55, 85.90s/it, best=0.923][I 2026-02-28 15:46:07,146] Trial 26 finished with value: 0.7583187308455208 and parameters: {'activation': 'relu', 'solver': 'sgd', 'lr': 3.440360098267864e-05, 'layer1': 390, 'layer2': 57, 'layer3': 295}. Best is trial 14 with value: 0.8911503569339929.

Escherichia_Coli | Cefepime | Optuna:  14%|█▎        | 27/200 [48:31<3:56:21, 81.97s/it, best=0.891][A
Escherichia_Coli | Cefepime | Optuna:  14%|█▎        | 27/200 [48:31<3:56:21, 81.97s/it, best=0.891][A[I 2026-02-28 15:46:44,859] Trial 89 finished with value: 0.9211193303754337 and parameters: {'activation': 'tanh', 'solver': 'adam', 'lr': 0.00012205400538075585, 'layer1': 48, 'layer2': 499, 'layer3': 450}. Best is trial 84 with value: 0.9228685877627578.
Klebsiella_Pneumoniae | DirectMulti | Optuna:  45%|████▌     | 90/200 [2:20:30<2:25:02, 79.11s/it, best=0.923]Klebsiella_Pneumoniae | DirectMulti | Optuna:  45%|████▌     | 90/200 [2:20:30<2:25:02, 79.11s/it, best=0.923][I 2026-02-28 15:47:18,049] Trial 30 finished with value: 0.8867563884140054 and parameters: {'activation': 'identity', 'solver': 'adam', 'lr': 0.0032158716864543694, 'layer1': 499, 'layer2': 465, 'layer3': 395}. Best is trial 30 with value: 0.8867563884140054.
Staphylococcus_Aureus | DirectMulti | Optuna:  16%|█▌        | 31/200 [1:17:23<6:11:42, 131.97s/it, best=0.885]Staphylococcus_Aureus | DirectMulti | Optuna:  16%|█▌        | 31/200 [1:17:23<6:11:42, 131.97s/it, best=0.887][I 2026-02-28 15:47:55,543] Trial 27 finished with value: 0.8886856243526626 and parameters: {'activation': 'relu', 'solver': 'adam', 'lr': 8.12707817564774e-05, 'layer1': 453, 'layer2': 163, 'layer3': 384}. Best is trial 14 with value: 0.8911503569339929.

Escherichia_Coli | Cefepime | Optuna:  14%|█▍        | 28/200 [50:20<4:17:42, 89.90s/it, best=0.891][A
Escherichia_Coli | Cefepime | Optuna:  14%|█▍        | 28/200 [50:20<4:17:42, 89.90s/it, best=0.891][A[I 2026-02-28 15:48:21,193] Trial 90 finished with value: 0.9068152625526809 and parameters: {'activation': 'relu', 'solver': 'adam', 'lr': 4.922192625596416e-05, 'layer1': 68, 'layer2': 483, 'layer3': 441}. Best is trial 84 with value: 0.9228685877627578.
Klebsiella_Pneumoniae | DirectMulti | Optuna:  46%|████▌     | 91/200 [2:22:06<2:33:06, 84.28s/it, best=0.923]Klebsiella_Pneumoniae | DirectMulti | Optuna:  46%|████▌     | 91/200 [2:22:06<2:33:06, 84.28s/it, best=0.923][I 2026-02-28 15:49:43,367] Trial 91 finished with value: 0.9220032116160486 and parameters: {'activation': 'tanh', 'solver': 'adam', 'lr': 6.259586901625717e-05, 'layer1': 38, 'layer2': 468, 'layer3': 369}. Best is trial 84 with value: 0.9228685877627578.
Klebsiella_Pneumoniae | DirectMulti | Optuna:  46%|████▌     | 92/200 [2:23:29<2:30:33, 83.65s/it, best=0.923]Klebsiella_Pneumoniae | DirectMulti | Optuna:  46%|████▌     | 92/200 [2:23:29<2:30:33, 83.65s/it, best=0.923][I 2026-02-28 15:49:49,070] Trial 28 finished with value: 0.8679907611600985 and parameters: {'activation': 'logistic', 'solver': 'adam', 'lr': 0.0024184088027272197, 'layer1': 462, 'layer2': 213, 'layer3': 300}. Best is trial 14 with value: 0.8911503569339929.

Escherichia_Coli | Cefepime | Optuna:  14%|█▍        | 29/200 [52:13<4:36:25, 96.99s/it, best=0.891][A
Escherichia_Coli | Cefepime | Optuna:  14%|█▍        | 29/200 [52:13<4:36:25, 96.99s/it, best=0.891][A[I 2026-02-28 15:50:14,072] Trial 31 finished with value: 0.8825371698059452 and parameters: {'activation': 'identity', 'solver': 'adam', 'lr': 0.0020655557967181703, 'layer1': 477, 'layer2': 470, 'layer3': 393}. Best is trial 30 with value: 0.8867563884140054.
Staphylococcus_Aureus | DirectMulti | Optuna:  16%|█▌        | 32/200 [1:20:19<6:46:30, 145.18s/it, best=0.887]Staphylococcus_Aureus | DirectMulti | Optuna:  16%|█▌        | 32/200 [1:20:19<6:46:30, 145.18s/it, best=0.887][I 2026-02-28 15:51:02,122] Trial 92 finished with value: 0.9220060543274068 and parameters: {'activation': 'tanh', 'solver': 'adam', 'lr': 5.706098786955179e-05, 'layer1': 18, 'layer2': 469, 'layer3': 475}. Best is trial 84 with value: 0.9228685877627578.
Klebsiella_Pneumoniae | DirectMulti | Optuna:  46%|████▋     | 93/200 [2:24:47<2:26:33, 82.18s/it, best=0.923]Klebsiella_Pneumoniae | DirectMulti | Optuna:  46%|████▋     | 93/200 [2:24:47<2:26:33, 82.18s/it, best=0.923][I 2026-02-28 15:51:05,305] Trial 29 finished with value: 0.7613141457343829 and parameters: {'activation': 'tanh', 'solver': 'sgd', 'lr': 0.0006092757637642444, 'layer1': 409, 'layer2': 376, 'layer3': 409}. Best is trial 14 with value: 0.8911503569339929.

Escherichia_Coli | Cefepime | Optuna:  15%|█▌        | 30/200 [53:30<4:17:09, 90.76s/it, best=0.891][A
Escherichia_Coli | Cefepime | Optuna:  15%|█▌        | 30/200 [53:30<4:17:09, 90.76s/it, best=0.891][A[I 2026-02-28 15:52:26,663] Trial 93 finished with value: 0.9216391028830977 and parameters: {'activation': 'tanh', 'solver': 'adam', 'lr': 5.545740220964356e-05, 'layer1': 17, 'layer2': 468, 'layer3': 427}. Best is trial 84 with value: 0.9228685877627578.
Klebsiella_Pneumoniae | DirectMulti | Optuna:  47%|████▋     | 94/200 [2:26:12<2:26:26, 82.89s/it, best=0.923]Klebsiella_Pneumoniae | DirectMulti | Optuna:  47%|████▋     | 94/200 [2:26:12<2:26:26, 82.89s/it, best=0.923][I 2026-02-28 15:52:36,979] Trial 30 finished with value: 0.8839928265948416 and parameters: {'activation': 'logistic', 'solver': 'adam', 'lr': 0.0002290326333779832, 'layer1': 366, 'layer2': 255, 'layer3': 334}. Best is trial 14 with value: 0.8911503569339929.

Escherichia_Coli | Cefepime | Optuna:  16%|█▌        | 31/200 [55:01<4:16:25, 91.04s/it, best=0.891][A
Escherichia_Coli | Cefepime | Optuna:  16%|█▌        | 31/200 [55:01<4:16:25, 91.04s/it, best=0.891][A[I 2026-02-28 15:52:58,406] Trial 32 finished with value: 0.8844356144737292 and parameters: {'activation': 'identity', 'solver': 'adam', 'lr': 0.004768845380805212, 'layer1': 500, 'layer2': 415, 'layer3': 449}. Best is trial 30 with value: 0.8867563884140054.
Staphylococcus_Aureus | DirectMulti | Optuna:  16%|█▋        | 33/200 [1:23:03<7:00:05, 150.93s/it, best=0.887]Staphylococcus_Aureus | DirectMulti | Optuna:  16%|█▋        | 33/200 [1:23:03<7:00:05, 150.93s/it, best=0.887][I 2026-02-28 15:53:52,718] Trial 94 finished with value: 0.9208669154020424 and parameters: {'activation': 'tanh', 'solver': 'adam', 'lr': 4.2068217695642794e-05, 'layer1': 51, 'layer2': 488, 'layer3': 389}. Best is trial 84 with value: 0.9228685877627578.
Klebsiella_Pneumoniae | DirectMulti | Optuna:  48%|████▊     | 95/200 [2:27:38<2:26:42, 83.84s/it, best=0.923]Klebsiella_Pneumoniae | DirectMulti | Optuna:  48%|████▊     | 95/200 [2:27:38<2:26:42, 83.84s/it, best=0.923][I 2026-02-28 15:54:15,991] Trial 31 finished with value: 0.8879670319081576 and parameters: {'activation': 'relu', 'solver': 'adam', 'lr': 0.00027017782731909986, 'layer1': 455, 'layer2': 72, 'layer3': 464}. Best is trial 14 with value: 0.8911503569339929.

Escherichia_Coli | Cefepime | Optuna:  16%|█▌        | 32/200 [56:40<4:21:36, 93.43s/it, best=0.891][A
Escherichia_Coli | Cefepime | Optuna:  16%|█▌        | 32/200 [56:40<4:21:36, 93.43s/it, best=0.891][A[I 2026-02-28 15:55:53,600] Trial 32 finished with value: 0.8880253172374346 and parameters: {'activation': 'relu', 'solver': 'adam', 'lr': 0.00010047821406177011, 'layer1': 470, 'layer2': 128, 'layer3': 469}. Best is trial 14 with value: 0.8911503569339929.

Escherichia_Coli | Cefepime | Optuna:  16%|█▋        | 33/200 [58:18<4:23:32, 94.68s/it, best=0.891][A
Escherichia_Coli | Cefepime | Optuna:  16%|█▋        | 33/200 [58:18<4:23:32, 94.68s/it, best=0.891][A[I 2026-02-28 15:56:07,591] Trial 33 finished with value: 0.8561887784522751 and parameters: {'activation': 'identity', 'solver': 'adam', 'lr': 9.132127331919702e-06, 'layer1': 440, 'layer2': 495, 'layer3': 353}. Best is trial 30 with value: 0.8867563884140054.
Staphylococcus_Aureus | DirectMulti | Optuna:  17%|█▋        | 34/200 [1:26:13<7:29:19, 162.41s/it, best=0.887]Staphylococcus_Aureus | DirectMulti | Optuna:  17%|█▋        | 34/200 [1:26:13<7:29:19, 162.41s/it, best=0.887][I 2026-02-28 15:56:26,918] Trial 95 finished with value: 0.9212704745073295 and parameters: {'activation': 'tanh', 'solver': 'adam', 'lr': 2.0851645558167097e-05, 'layer1': 123, 'layer2': 462, 'layer3': 410}. Best is trial 84 with value: 0.9228685877627578.
Klebsiella_Pneumoniae | DirectMulti | Optuna:  48%|████▊     | 96/200 [2:30:12<3:01:54, 104.95s/it, best=0.923]Klebsiella_Pneumoniae | DirectMulti | Optuna:  48%|████▊     | 96/200 [2:30:12<3:01:54, 104.95s/it, best=0.923][I 2026-02-28 15:57:41,588] Trial 96 finished with value: 0.9216243185358994 and parameters: {'activation': 'tanh', 'solver': 'adam', 'lr': 8.460984918940063e-05, 'layer1': 28, 'layer2': 475, 'layer3': 482}. Best is trial 84 with value: 0.9228685877627578.
Klebsiella_Pneumoniae | DirectMulti | Optuna:  48%|████▊     | 97/200 [2:31:27<2:44:33, 95.86s/it, best=0.923] Klebsiella_Pneumoniae | DirectMulti | Optuna:  48%|████▊     | 97/200 [2:31:27<2:44:33, 95.86s/it, best=0.923][I 2026-02-28 15:58:45,874] Trial 33 finished with value: 0.8877174943759067 and parameters: {'activation': 'relu', 'solver': 'adam', 'lr': 2.8352978490026965e-05, 'layer1': 435, 'layer2': 116, 'layer3': 442}. Best is trial 14 with value: 0.8911503569339929.

Escherichia_Coli | Cefepime | Optuna:  17%|█▋        | 34/200 [1:01:10<5:26:21, 117.96s/it, best=0.891][A
Escherichia_Coli | Cefepime | Optuna:  17%|█▋        | 34/200 [1:01:10<5:26:21, 117.96s/it, best=0.891][A[I 2026-02-28 15:59:02,634] Trial 34 finished with value: 0.8854577244976074 and parameters: {'activation': 'identity', 'solver': 'adam', 'lr': 7.959620910629344e-05, 'layer1': 467, 'layer2': 451, 'layer3': 398}. Best is trial 30 with value: 0.8867563884140054.
Staphylococcus_Aureus | DirectMulti | Optuna:  18%|█▊        | 35/200 [1:29:08<7:37:02, 166.20s/it, best=0.887]Staphylococcus_Aureus | DirectMulti | Optuna:  18%|█▊        | 35/200 [1:29:08<7:37:02, 166.20s/it, best=0.887][I 2026-02-28 15:59:31,107] Trial 97 finished with value: 0.9191537494966223 and parameters: {'activation': 'tanh', 'solver': 'adam', 'lr': 2.8477074174529707e-05, 'layer1': 42, 'layer2': 487, 'layer3': 478}. Best is trial 84 with value: 0.9228685877627578.
Klebsiella_Pneumoniae | DirectMulti | Optuna:  49%|████▉     | 98/200 [2:33:16<2:49:55, 99.96s/it, best=0.923]Klebsiella_Pneumoniae | DirectMulti | Optuna:  49%|████▉     | 98/200 [2:33:16<2:49:55, 99.96s/it, best=0.923][I 2026-02-28 16:00:21,427] Trial 34 finished with value: 0.8861328482007851 and parameters: {'activation': 'relu', 'solver': 'adam', 'lr': 0.00042739184421278486, 'layer1': 424, 'layer2': 61, 'layer3': 378}. Best is trial 14 with value: 0.8911503569339929.

Escherichia_Coli | Cefepime | Optuna:  18%|█▊        | 35/200 [1:02:46<5:05:54, 111.24s/it, best=0.891][A
