Staphylococcus_Aureus | Clindamycin | Optuna:  64%|██████▍   | 129/200 [2:58:14<1:52:43, 95.26s/it, best=0.857][A[I 2026-02-28 00:56:14,845] Trial 143 finished with value: 0.8842652873969363 and parameters: {'activation': 'identity', 'solver': 'adam', 'lr': 0.0004084140131259012, 'layer1': 351, 'layer2': 470, 'layer3': 423}. Best is trial 73 with value: 0.8861579932511299.

Pseudomonas_Aeruginosa | Meropenem | Optuna:  72%|███████▏  | 144/200 [2:51:50<1:18:59, 84.64s/it, best=0.886][A
Pseudomonas_Aeruginosa | Meropenem | Optuna:  72%|███████▏  | 144/200 [2:51:50<1:18:59, 84.64s/it, best=0.886][A[I 2026-02-28 00:56:36,745] Trial 45 finished with value: 0.8923712495286168 and parameters: {'activation': 'relu', 'solver': 'adam', 'lr': 0.00014569280517938972, 'layer1': 457, 'layer2': 177, 'layer3': 70}. Best is trial 14 with value: 0.8971256036318559.

Escherichia_Coli | Ceftriaxone | Optuna:  23%|██▎       | 46/200 [1:46:38<5:42:31, 133.45s/it, best=0.897][A
Escherichia_Coli | Ceftriaxone | Optuna:  23%|██▎       | 46/200 [1:46:38<5:42:31, 133.45s/it, best=0.897][A[I 2026-02-28 00:57:38,162] Trial 144 finished with value: 0.8813980640070767 and parameters: {'activation': 'identity', 'solver': 'adam', 'lr': 0.0005459587947953995, 'layer1': 318, 'layer2': 483, 'layer3': 394}. Best is trial 73 with value: 0.8861579932511299.

Pseudomonas_Aeruginosa | Meropenem | Optuna:  72%|███████▎  | 145/200 [2:53:13<1:17:13, 84.24s/it, best=0.886][A
Pseudomonas_Aeruginosa | Meropenem | Optuna:  72%|███████▎  | 145/200 [2:53:13<1:17:13, 84.24s/it, best=0.886][A[I 2026-02-28 00:58:01,412] Trial 130 finished with value: 0.9107197512148748 and parameters: {'activation': 'tanh', 'solver': 'adam', 'lr': 1.453964372748168e-05, 'layer1': 403, 'layer2': 470, 'layer3': 389}. Best is trial 130 with value: 0.9107197512148748.

Klebsiella_Pneumoniae | Ceftriaxone | Optuna:  66%|██████▌   | 131/200 [4:07:22<2:54:27, 151.70s/it, best=0.909][A
Klebsiella_Pneumoniae | Ceftriaxone | Optuna:  66%|██████▌   | 131/200 [4:07:22<2:54:27, 151.70s/it, best=0.911][A[I 2026-02-28 00:58:27,328] Trial 129 finished with value: 0.8544355868891416 and parameters: {'activation': 'logistic', 'solver': 'adam', 'lr': 0.00038062338666270946, 'layer1': 442, 'layer2': 132, 'layer3': 23}. Best is trial 105 with value: 0.857392473801258.

Staphylococcus_Aureus | Clindamycin | Optuna:  65%|██████▌   | 130/200 [3:00:28<2:04:46, 106.95s/it, best=0.857][A
Staphylococcus_Aureus | Clindamycin | Optuna:  65%|██████▌   | 130/200 [3:00:28<2:04:46, 106.95s/it, best=0.857][A[I 2026-02-28 00:59:05,057] Trial 145 finished with value: 0.8818259068269366 and parameters: {'activation': 'identity', 'solver': 'adam', 'lr': 0.00022405571555279247, 'layer1': 366, 'layer2': 422, 'layer3': 469}. Best is trial 73 with value: 0.8861579932511299.

Pseudomonas_Aeruginosa | Meropenem | Optuna:  73%|███████▎  | 146/200 [2:54:40<1:16:32, 85.04s/it, best=0.886][A
Pseudomonas_Aeruginosa | Meropenem | Optuna:  73%|███████▎  | 146/200 [2:54:40<1:16:32, 85.04s/it, best=0.886][A[I 2026-02-28 00:59:07,696] Trial 130 finished with value: 0.7888558471217525 and parameters: {'activation': 'logistic', 'solver': 'adam', 'lr': 0.00016587454548033507, 'layer1': 452, 'layer2': 49, 'layer3': 18}. Best is trial 105 with value: 0.857392473801258.

Staphylococcus_Aureus | Clindamycin | Optuna:  66%|██████▌   | 131/200 [3:01:09<1:40:01, 86.97s/it, best=0.857] [A
Staphylococcus_Aureus | Clindamycin | Optuna:  66%|██████▌   | 131/200 [3:01:09<1:40:01, 86.97s/it, best=0.857][A[I 2026-02-28 00:59:11,854] Trial 46 finished with value: 0.8959571457146345 and parameters: {'activation': 'relu', 'solver': 'adam', 'lr': 9.144792017528137e-05, 'layer1': 428, 'layer2': 212, 'layer3': 172}. Best is trial 14 with value: 0.8971256036318559.

Escherichia_Coli | Ceftriaxone | Optuna:  24%|██▎       | 47/200 [1:49:13<5:56:52, 139.95s/it, best=0.897][A
Escherichia_Coli | Ceftriaxone | Optuna:  24%|██▎       | 47/200 [1:49:13<5:56:52, 139.95s/it, best=0.897][A[I 2026-02-28 00:59:49,285] Trial 146 finished with value: 0.8469614590127893 and parameters: {'activation': 'identity', 'solver': 'adam', 'lr': 7.5747207188550066e-06, 'layer1': 244, 'layer2': 448, 'layer3': 357}. Best is trial 73 with value: 0.8861579932511299.

Pseudomonas_Aeruginosa | Meropenem | Optuna:  74%|███████▎  | 147/200 [2:55:24<1:04:18, 72.80s/it, best=0.886][A
Pseudomonas_Aeruginosa | Meropenem | Optuna:  74%|███████▎  | 147/200 [2:55:24<1:04:18, 72.80s/it, best=0.886][A[I 2026-02-28 01:00:08,267] Trial 47 finished with value: 0.7103749076978716 and parameters: {'activation': 'relu', 'solver': 'sgd', 'lr': 8.969421087567505e-05, 'layer1': 432, 'layer2': 218, 'layer3': 288}. Best is trial 14 with value: 0.8971256036318559.

Escherichia_Coli | Ceftriaxone | Optuna:  24%|██▍       | 48/200 [1:50:09<4:51:02, 114.89s/it, best=0.897][A
Escherichia_Coli | Ceftriaxone | Optuna:  24%|██▍       | 48/200 [1:50:09<4:51:02, 114.89s/it, best=0.897][A[I 2026-02-28 01:00:29,797] Trial 131 finished with value: 0.9038814750893204 and parameters: {'activation': 'tanh', 'solver': 'adam', 'lr': 1.496696081691743e-05, 'layer1': 377, 'layer2': 469, 'layer3': 399}. Best is trial 130 with value: 0.9107197512148748.

Klebsiella_Pneumoniae | Ceftriaxone | Optuna:  66%|██████▌   | 132/200 [4:09:51<2:50:47, 150.70s/it, best=0.911][A
Klebsiella_Pneumoniae | Ceftriaxone | Optuna:  66%|██████▌   | 132/200 [4:09:51<2:50:47, 150.70s/it, best=0.911][A[I 2026-02-28 01:01:07,211] Trial 147 finished with value: 0.8798052778640241 and parameters: {'activation': 'tanh', 'solver': 'adam', 'lr': 6.49753973438206e-05, 'layer1': 463, 'layer2': 204, 'layer3': 335}. Best is trial 73 with value: 0.8861579932511299.

Pseudomonas_Aeruginosa | Meropenem | Optuna:  74%|███████▍  | 148/200 [2:56:42<1:04:25, 74.34s/it, best=0.886][A
Pseudomonas_Aeruginosa | Meropenem | Optuna:  74%|███████▍  | 148/200 [2:56:42<1:04:25, 74.34s/it, best=0.886][A[I 2026-02-28 01:01:43,799] Trial 131 finished with value: 0.8512176150936099 and parameters: {'activation': 'logistic', 'solver': 'adam', 'lr': 0.00038105579191007873, 'layer1': 424, 'layer2': 137, 'layer3': 24}. Best is trial 105 with value: 0.857392473801258.

Staphylococcus_Aureus | Clindamycin | Optuna:  66%|██████▌   | 132/200 [3:03:45<2:02:04, 107.71s/it, best=0.857][A
Staphylococcus_Aureus | Clindamycin | Optuna:  66%|██████▌   | 132/200 [3:03:45<2:02:04, 107.71s/it, best=0.857][A[I 2026-02-28 01:02:22,589] Trial 148 finished with value: 0.8846161873221439 and parameters: {'activation': 'identity', 'solver': 'adam', 'lr': 0.0009472366745266191, 'layer1': 336, 'layer2': 277, 'layer3': 437}. Best is trial 73 with value: 0.8861579932511299.

Pseudomonas_Aeruginosa | Meropenem | Optuna:  74%|███████▍  | 149/200 [2:57:57<1:03:27, 74.65s/it, best=0.886][A
Pseudomonas_Aeruginosa | Meropenem | Optuna:  74%|███████▍  | 149/200 [2:57:57<1:03:27, 74.65s/it, best=0.886][A[I 2026-02-28 01:03:11,628] Trial 48 finished with value: 0.8931431100284405 and parameters: {'activation': 'relu', 'solver': 'adam', 'lr': 3.629986174307126e-05, 'layer1': 243, 'layer2': 271, 'layer3': 173}. Best is trial 14 with value: 0.8971256036318559.

Escherichia_Coli | Ceftriaxone | Optuna:  24%|██▍       | 49/200 [1:53:13<5:40:49, 135.43s/it, best=0.897][A
Escherichia_Coli | Ceftriaxone | Optuna:  24%|██▍       | 49/200 [1:53:13<5:40:49, 135.43s/it, best=0.897][A[I 2026-02-28 01:03:31,604] Trial 149 finished with value: 0.8769469985991677 and parameters: {'activation': 'relu', 'solver': 'adam', 'lr': 0.0009001815082572672, 'layer1': 329, 'layer2': 295, 'layer3': 489}. Best is trial 73 with value: 0.8861579932511299.

Pseudomonas_Aeruginosa | Meropenem | Optuna:  75%|███████▌  | 150/200 [2:59:06<1:00:47, 72.96s/it, best=0.886][A
Pseudomonas_Aeruginosa | Meropenem | Optuna:  75%|███████▌  | 150/200 [2:59:06<1:00:47, 72.96s/it, best=0.886][A[I 2026-02-28 01:03:55,900] Trial 150 finished with value: 0.8429744308639442 and parameters: {'activation': 'identity', 'solver': 'sgd', 'lr': 0.0017625826508044303, 'layer1': 342, 'layer2': 274, 'layer3': 437}. Best is trial 73 with value: 0.8861579932511299.

Pseudomonas_Aeruginosa | Meropenem | Optuna:  76%|███████▌  | 151/200 [2:59:31<47:39, 58.36s/it, best=0.886]  [A
Pseudomonas_Aeruginosa | Meropenem | Optuna:  76%|███████▌  | 151/200 [2:59:31<47:39, 58.36s/it, best=0.886][A[I 2026-02-28 01:04:01,636] Trial 132 finished with value: 0.8552356651868109 and parameters: {'activation': 'logistic', 'solver': 'adam', 'lr': 0.0004665401074422769, 'layer1': 416, 'layer2': 128, 'layer3': 58}. Best is trial 105 with value: 0.857392473801258.

Staphylococcus_Aureus | Clindamycin | Optuna:  66%|██████▋   | 133/200 [3:06:03<2:10:22, 116.75s/it, best=0.857][A
Staphylococcus_Aureus | Clindamycin | Optuna:  66%|██████▋   | 133/200 [3:06:03<2:10:22, 116.75s/it, best=0.857][A[I 2026-02-28 01:04:40,571] Trial 132 finished with value: 0.9035011326739827 and parameters: {'activation': 'tanh', 'solver': 'adam', 'lr': 6.222750184610314e-06, 'layer1': 395, 'layer2': 488, 'layer3': 389}. Best is trial 130 with value: 0.9107197512148748.

Klebsiella_Pneumoniae | Ceftriaxone | Optuna:  66%|██████▋   | 133/200 [4:14:02<3:21:48, 180.73s/it, best=0.911][A
Klebsiella_Pneumoniae | Ceftriaxone | Optuna:  66%|██████▋   | 133/200 [4:14:02<3:21:48, 180.73s/it, best=0.911][A[I 2026-02-28 01:05:27,249] Trial 151 finished with value: 0.8804276181245166 and parameters: {'activation': 'identity', 'solver': 'adam', 'lr': 0.0006951356507763147, 'layer1': 350, 'layer2': 500, 'layer3': 416}. Best is trial 73 with value: 0.8861579932511299.

Pseudomonas_Aeruginosa | Meropenem | Optuna:  76%|███████▌  | 152/200 [3:01:02<54:36, 68.26s/it, best=0.886][A
Pseudomonas_Aeruginosa | Meropenem | Optuna:  76%|███████▌  | 152/200 [3:01:02<54:36, 68.26s/it, best=0.886][A[I 2026-02-28 01:06:19,904] Trial 133 finished with value: 0.8523281376419648 and parameters: {'activation': 'logistic', 'solver': 'adam', 'lr': 0.0004922155437021693, 'layer1': 441, 'layer2': 145, 'layer3': 61}. Best is trial 105 with value: 0.857392473801258.

Staphylococcus_Aureus | Clindamycin | Optuna:  67%|██████▋   | 134/200 [3:08:21<2:15:31, 123.20s/it, best=0.857][A
Staphylococcus_Aureus | Clindamycin | Optuna:  67%|██████▋   | 134/200 [3:08:21<2:15:31, 123.20s/it, best=0.857][A[I 2026-02-28 01:06:29,318] Trial 49 finished with value: 0.8888988957398938 and parameters: {'activation': 'tanh', 'solver': 'adam', 'lr': 1.3331268685198481e-05, 'layer1': 490, 'layer2': 315, 'layer3': 256}. Best is trial 14 with value: 0.8971256036318559.

Escherichia_Coli | Ceftriaxone | Optuna:  25%|██▌       | 50/200 [1:56:30<6:25:16, 154.11s/it, best=0.897][A
Escherichia_Coli | Ceftriaxone | Optuna:  25%|██▌       | 50/200 [1:56:30<6:25:16, 154.11s/it, best=0.897][A[I 2026-02-28 01:06:53,229] Trial 152 finished with value: 0.8834788323745191 and parameters: {'activation': 'identity', 'solver': 'adam', 'lr': 0.0011878686219784435, 'layer1': 361, 'layer2': 305, 'layer3': 447}. Best is trial 73 with value: 0.8861579932511299.

Pseudomonas_Aeruginosa | Meropenem | Optuna:  76%|███████▋  | 153/200 [3:02:28<57:37, 73.57s/it, best=0.886][A
Pseudomonas_Aeruginosa | Meropenem | Optuna:  76%|███████▋  | 153/200 [3:02:28<57:37, 73.57s/it, best=0.886][A[I 2026-02-28 01:07:18,564] Trial 134 finished with value: 0.8042145046679107 and parameters: {'activation': 'logistic', 'solver': 'adam', 'lr': 0.0002227671241390875, 'layer1': 121, 'layer2': 157, 'layer3': 84}. Best is trial 105 with value: 0.857392473801258.

Staphylococcus_Aureus | Clindamycin | Optuna:  68%|██████▊   | 135/200 [3:09:20<1:52:29, 103.84s/it, best=0.857][A
Staphylococcus_Aureus | Clindamycin | Optuna:  68%|██████▊   | 135/200 [3:09:20<1:52:29, 103.84s/it, best=0.857][A[I 2026-02-28 01:07:25,671] Trial 133 finished with value: 0.9021664831702356 and parameters: {'activation': 'tanh', 'solver': 'adam', 'lr': 1.2186251625035656e-05, 'layer1': 375, 'layer2': 454, 'layer3': 377}. Best is trial 130 with value: 0.9107197512148748.

Klebsiella_Pneumoniae | Ceftriaxone | Optuna:  67%|██████▋   | 134/200 [4:16:47<3:13:38, 176.04s/it, best=0.911][A
Klebsiella_Pneumoniae | Ceftriaxone | Optuna:  67%|██████▋   | 134/200 [4:16:47<3:13:38, 176.04s/it, best=0.911][A[I 2026-02-28 01:08:06,122] Trial 153 finished with value: 0.8798024613573376 and parameters: {'activation': 'identity', 'solver': 'adam', 'lr': 0.0008127238389668844, 'layer1': 393, 'layer2': 312, 'layer3': 464}. Best is trial 73 with value: 0.8861579932511299.

Pseudomonas_Aeruginosa | Meropenem | Optuna:  77%|███████▋  | 154/200 [3:03:41<56:14, 73.37s/it, best=0.886][A
Pseudomonas_Aeruginosa | Meropenem | Optuna:  77%|███████▋  | 154/200 [3:03:41<56:14, 73.37s/it, best=0.886][A[I 2026-02-28 01:09:03,664] Trial 50 finished with value: 0.8947593060745163 and parameters: {'activation': 'relu', 'solver': 'adam', 'lr': 5.1461409739577216e-05, 'layer1': 190, 'layer2': 194, 'layer3': 27}. Best is trial 14 with value: 0.8971256036318559.

Escherichia_Coli | Ceftriaxone | Optuna:  26%|██▌       | 51/200 [1:59:05<6:22:52, 154.18s/it, best=0.897][A
Escherichia_Coli | Ceftriaxone | Optuna:  26%|██▌       | 51/200 [1:59:05<6:22:52, 154.18s/it, best=0.897][A[I 2026-02-28 01:09:06,815] Trial 134 finished with value: 0.9057253848051354 and parameters: {'activation': 'tanh', 'solver': 'adam', 'lr': 3.123849671164969e-05, 'layer1': 355, 'layer2': 480, 'layer3': 408}. Best is trial 130 with value: 0.9107197512148748.

Klebsiella_Pneumoniae | Ceftriaxone | Optuna:  68%|██████▊   | 135/200 [4:18:28<2:46:22, 153.57s/it, best=0.911][A
Klebsiella_Pneumoniae | Ceftriaxone | Optuna:  68%|██████▊   | 135/200 [4:18:28<2:46:22, 153.57s/it, best=0.911][A[I 2026-02-28 01:09:09,347] Trial 135 finished with value: 0.8538052728974371 and parameters: {'activation': 'logistic', 'solver': 'adam', 'lr': 0.0005852543786055057, 'layer1': 453, 'layer2': 37, 'layer3': 35}. Best is trial 105 with value: 0.857392473801258.

Staphylococcus_Aureus | Clindamycin | Optuna:  68%|██████▊   | 136/200 [3:11:11<1:52:59, 105.92s/it, best=0.857][A
Staphylococcus_Aureus | Clindamycin | Optuna:  68%|██████▊   | 136/200 [3:11:11<1:52:59, 105.92s/it, best=0.857][A[I 2026-02-28 01:09:36,079] Trial 154 finished with value: 0.8846082635596593 and parameters: {'activation': 'identity', 'solver': 'adam', 'lr': 9.221561451827945e-05, 'layer1': 380, 'layer2': 282, 'layer3': 404}. Best is trial 73 with value: 0.8861579932511299.

Pseudomonas_Aeruginosa | Meropenem | Optuna:  78%|███████▊  | 155/200 [3:05:11<58:45, 78.35s/it, best=0.886][A
Pseudomonas_Aeruginosa | Meropenem | Optuna:  78%|███████▊  | 155/200 [3:05:11<58:45, 78.35s/it, best=0.886][A[I 2026-02-28 01:10:53,388] Trial 136 finished with value: 0.8407415849191994 and parameters: {'activation': 'logistic', 'solver': 'adam', 'lr': 0.0011988509465037055, 'layer1': 459, 'layer2': 132, 'layer3': 47}. Best is trial 105 with value: 0.857392473801258.

Staphylococcus_Aureus | Clindamycin | Optuna:  68%|██████▊   | 137/200 [3:12:55<1:50:37, 105.36s/it, best=0.857][A
Staphylococcus_Aureus | Clindamycin | Optuna:  68%|██████▊   | 137/200 [3:12:55<1:50:37, 105.36s/it, best=0.857][A[I 2026-02-28 01:11:21,894] Trial 51 finished with value: 0.8921208049262275 and parameters: {'activation': 'relu', 'solver': 'adam', 'lr': 0.0007216475055894022, 'layer1': 405, 'layer2': 86, 'layer3': 126}. Best is trial 14 with value: 0.8971256036318559.

Escherichia_Coli | Ceftriaxone | Optuna:  26%|██▌       | 52/200 [2:01:23<6:08:30, 149.39s/it, best=0.897][A
Escherichia_Coli | Ceftriaxone | Optuna:  26%|██▌       | 52/200 [2:01:23<6:08:30, 149.39s/it, best=0.897][A[I 2026-02-28 01:11:23,117] Trial 155 finished with value: 0.8834593200376137 and parameters: {'activation': 'identity', 'solver': 'adam', 'lr': 0.00010121875656892343, 'layer1': 402, 'layer2': 283, 'layer3': 407}. Best is trial 73 with value: 0.8861579932511299.

Pseudomonas_Aeruginosa | Meropenem | Optuna:  78%|███████▊  | 156/200 [3:06:58<1:03:45, 86.95s/it, best=0.886][A
Pseudomonas_Aeruginosa | Meropenem | Optuna:  78%|███████▊  | 156/200 [3:06:58<1:03:45, 86.95s/it, best=0.886][A[I 2026-02-28 01:11:56,238] Trial 135 finished with value: 0.9026956029238828 and parameters: {'activation': 'tanh', 'solver': 'adam', 'lr': 1.0452615222958326e-05, 'layer1': 405, 'layer2': 496, 'layer3': 356}. Best is trial 130 with value: 0.9107197512148748.

Klebsiella_Pneumoniae | Ceftriaxone | Optuna:  68%|██████▊   | 136/200 [4:21:17<2:48:52, 158.33s/it, best=0.911][A
Klebsiella_Pneumoniae | Ceftriaxone | Optuna:  68%|██████▊   | 136/200 [4:21:17<2:48:52, 158.33s/it, best=0.911][A[I 2026-02-28 01:12:35,097] Trial 137 finished with value: 0.8296719088463822 and parameters: {'activation': 'logistic', 'solver': 'adam', 'lr': 0.0002704675384302129, 'layer1': 220, 'layer2': 104, 'layer3': 99}. Best is trial 105 with value: 0.857392473801258.

Staphylococcus_Aureus | Clindamycin | Optuna:  69%|██████▉   | 138/200 [3:14:36<1:47:44, 104.26s/it, best=0.857][A
Staphylococcus_Aureus | Clindamycin | Optuna:  69%|██████▉   | 138/200 [3:14:36<1:47:44, 104.26s/it, best=0.857][A[I 2026-02-28 01:12:46,195] Trial 156 finished with value: 0.8779260740975522 and parameters: {'activation': 'identity', 'solver': 'adam', 'lr': 5.460325175530122e-05, 'layer1': 384, 'layer2': 294, 'layer3': 373}. Best is trial 73 with value: 0.8861579932511299.

Pseudomonas_Aeruginosa | Meropenem | Optuna:  78%|███████▊  | 157/200 [3:08:21<1:01:29, 85.79s/it, best=0.886][A
Pseudomonas_Aeruginosa | Meropenem | Optuna:  78%|███████▊  | 157/200 [3:08:21<1:01:29, 85.79s/it, best=0.886][A[I 2026-02-28 01:12:59,201] Trial 138 finished with value: 0.7888558471217525 and parameters: {'activation': 'logistic', 'solver': 'sgd', 'lr': 0.00032805344326683846, 'layer1': 161, 'layer2': 89, 'layer3': 414}. Best is trial 105 with value: 0.857392473801258.

Staphylococcus_Aureus | Clindamycin | Optuna:  70%|██████▉   | 139/200 [3:15:00<1:21:33, 80.22s/it, best=0.857] [A
Staphylococcus_Aureus | Clindamycin | Optuna:  70%|██████▉   | 139/200 [3:15:00<1:21:33, 80.22s/it, best=0.857][A[I 2026-02-28 01:13:01,140] Trial 52 finished with value: 0.8910633992507899 and parameters: {'activation': 'relu', 'solver': 'adam', 'lr': 0.0002768072161241762, 'layer1': 353, 'layer2': 112, 'layer3': 56}. Best is trial 14 with value: 0.8971256036318559.

Escherichia_Coli | Ceftriaxone | Optuna:  26%|██▋       | 53/200 [2:03:02<5:29:09, 134.35s/it, best=0.897][A
Escherichia_Coli | Ceftriaxone | Optuna:  26%|██▋       | 53/200 [2:03:02<5:29:09, 134.35s/it, best=0.897][A[I 2026-02-28 01:13:55,732] Trial 157 finished with value: 0.879817648764314 and parameters: {'activation': 'identity', 'solver': 'adam', 'lr': 8.50770176577719e-05, 'layer1': 374, 'layer2': 264, 'layer3': 220}. Best is trial 73 with value: 0.8861579932511299.

Pseudomonas_Aeruginosa | Meropenem | Optuna:  79%|███████▉  | 158/200 [3:09:30<56:38, 80.91s/it, best=0.886]  [A
Pseudomonas_Aeruginosa | Meropenem | Optuna:  79%|███████▉  | 158/200 [3:09:30<56:38, 80.91s/it, best=0.886][A[I 2026-02-28 01:14:20,386] Trial 136 finished with value: 0.9066518176611289 and parameters: {'activation': 'tanh', 'solver': 'adam', 'lr': 2.0546359878224527e-05, 'layer1': 392, 'layer2': 464, 'layer3': 391}. Best is trial 130 with value: 0.9107197512148748.

Klebsiella_Pneumoniae | Ceftriaxone | Optuna:  68%|██████▊   | 137/200 [4:23:41<2:41:46, 154.07s/it, best=0.911][A
Klebsiella_Pneumoniae | Ceftriaxone | Optuna:  68%|██████▊   | 137/200 [4:23:41<2:41:46, 154.07s/it, best=0.911][A[I 2026-02-28 01:14:27,081] Trial 139 finished with value: 0.8514069692752898 and parameters: {'activation': 'logistic', 'solver': 'adam', 'lr': 0.0008537708630143142, 'layer1': 193, 'layer2': 30, 'layer3': 54}. Best is trial 105 with value: 0.857392473801258.

Staphylococcus_Aureus | Clindamycin | Optuna:  70%|███████   | 140/200 [3:16:28<1:22:30, 82.52s/it, best=0.857][A
Staphylococcus_Aureus | Clindamycin | Optuna:  70%|███████   | 140/200 [3:16:28<1:22:30, 82.52s/it, best=0.857][A[I 2026-02-28 01:15:11,647] Trial 140 finished with value: 0.802547703032279 and parameters: {'activation': 'logistic', 'solver': 'adam', 'lr': 0.0004431532268142585, 'layer1': 171, 'layer2': 126, 'layer3': 10}. Best is trial 105 with value: 0.857392473801258.

Staphylococcus_Aureus | Clindamycin | Optuna:  70%|███████   | 141/200 [3:17:13<1:09:56, 71.13s/it, best=0.857][A
Staphylococcus_Aureus | Clindamycin | Optuna:  70%|███████   | 141/200 [3:17:13<1:09:56, 71.13s/it, best=0.857][A[I 2026-02-28 01:15:17,492] Trial 158 finished with value: 0.8830837759682371 and parameters: {'activation': 'identity', 'solver': 'adam', 'lr': 0.001348751545311426, 'layer1': 337, 'layer2': 171, 'layer3': 401}. Best is trial 73 with value: 0.8861579932511299.

Pseudomonas_Aeruginosa | Meropenem | Optuna:  80%|███████▉  | 159/200 [3:10:52<55:27, 81.17s/it, best=0.886][A
Pseudomonas_Aeruginosa | Meropenem | Optuna:  80%|███████▉  | 159/200 [3:10:52<55:27, 81.17s/it, best=0.886][A[I 2026-02-28 01:15:36,407] Trial 53 finished with value: 0.8970623155325438 and parameters: {'activation': 'relu', 'solver': 'adam', 'lr': 9.586726899376191e-05, 'layer1': 477, 'layer2': 147, 'layer3': 92}. Best is trial 14 with value: 0.8971256036318559.

Escherichia_Coli | Ceftriaxone | Optuna:  27%|██▋       | 54/200 [2:05:37<5:42:11, 140.63s/it, best=0.897][A
