Escherichia_Coli | Ceftriaxone | Optuna:  56%|█████▌    | 112/200 [4:38:27<3:25:35, 140.17s/it, best=0.897][A[I 2026-02-28 03:49:06,373] Trial 25 finished with value: 0.9843765156726396 and parameters: {'activation': 'relu', 'solver': 'adam', 'lr': 0.0015307978913182258, 'layer1': 307, 'layer2': 153, 'layer3': 339}. Best is trial 13 with value: 0.9860492846658779.

Klebsiella_Pneumoniae | Imipenem | Optuna:  13%|█▎        | 26/200 [20:18<1:57:52, 40.64s/it, best=0.986][A
Klebsiella_Pneumoniae | Imipenem | Optuna:  13%|█▎        | 26/200 [20:18<1:57:52, 40.64s/it, best=0.986][A[I 2026-02-28 03:49:10,507] Trial 44 finished with value: 0.9278746472826658 and parameters: {'activation': 'tanh', 'solver': 'adam', 'lr': 7.601922958860231e-05, 'layer1': 387, 'layer2': 437, 'layer3': 86}. Best is trial 20 with value: 0.9283335834984147.

Staphylococcus_Aureus | Fusidic acid | Optuna:  22%|██▎       | 45/200 [1:08:19<5:02:45, 117.20s/it, best=0.928][A
Staphylococcus_Aureus | Fusidic acid | Optuna:  22%|██▎       | 45/200 [1:08:19<5:02:45, 117.20s/it, best=0.928][A[I 2026-02-28 03:49:33,774] Trial 26 finished with value: 0.9800270054346416 and parameters: {'activation': 'relu', 'solver': 'sgd', 'lr': 0.0011910939561097392, 'layer1': 436, 'layer2': 142, 'layer3': 342}. Best is trial 13 with value: 0.9860492846658779.

Klebsiella_Pneumoniae | Imipenem | Optuna:  14%|█▎        | 27/200 [20:46<1:45:44, 36.67s/it, best=0.986][A
Klebsiella_Pneumoniae | Imipenem | Optuna:  14%|█▎        | 27/200 [20:46<1:45:44, 36.67s/it, best=0.986][A[I 2026-02-28 03:49:36,049] Trial 72 finished with value: 0.8644400759081481 and parameters: {'activation': 'identity', 'solver': 'adam', 'lr': 0.0007381683716411103, 'layer1': 319, 'layer2': 422, 'layer3': 357}. Best is trial 63 with value: 0.8682133709784562.
Pseudomonas_Aeruginosa | LPS | Optuna:  36%|███▋      | 73/200 [1:44:38<3:17:55, 93.50s/it, best=0.868]Pseudomonas_Aeruginosa | LPS | Optuna:  36%|███▋      | 73/200 [1:44:38<3:17:55, 93.50s/it, best=0.868]/export/usuarios01/egarroyo/MALDI_for_AMR_prediction/venv/lib/python3.13/site-packages/sklearn/model_selection/_split.py:813: UserWarning: The least populated class in y has only 4 members, which is less than n_splits=5.
  warnings.warn(
[I 2026-02-28 03:50:21,524] Trial 27 finished with value: 0.9829733840622789 and parameters: {'activation': 'relu', 'solver': 'adam', 'lr': 0.0018753585885416413, 'layer1': 355, 'layer2': 100, 'layer3': 383}. Best is trial 13 with value: 0.9860492846658779.

Klebsiella_Pneumoniae | Imipenem | Optuna:  14%|█▍        | 28/200 [21:34<1:54:39, 40.00s/it, best=0.986][A
Klebsiella_Pneumoniae | Imipenem | Optuna:  14%|█▍        | 28/200 [21:34<1:54:39, 40.00s/it, best=0.986][A[I 2026-02-28 03:50:49,023] Trial 112 finished with value: 0.8949541643833705 and parameters: {'activation': 'relu', 'solver': 'adam', 'lr': 0.00010719293574577633, 'layer1': 493, 'layer2': 29, 'layer3': 467}. Best is trial 14 with value: 0.8971256036318559.

Escherichia_Coli | Ceftriaxone | Optuna:  56%|█████▋    | 113/200 [4:40:50<3:24:33, 141.07s/it, best=0.897][A
Escherichia_Coli | Ceftriaxone | Optuna:  56%|█████▋    | 113/200 [4:40:50<3:24:33, 141.07s/it, best=0.897][A[I 2026-02-28 03:50:59,474] Trial 45 finished with value: 0.9260023669027218 and parameters: {'activation': 'tanh', 'solver': 'adam', 'lr': 4.612121641996221e-05, 'layer1': 404, 'layer2': 435, 'layer3': 78}. Best is trial 20 with value: 0.9283335834984147.

Staphylococcus_Aureus | Fusidic acid | Optuna:  23%|██▎       | 46/200 [1:10:08<4:54:28, 114.73s/it, best=0.928][A
Staphylococcus_Aureus | Fusidic acid | Optuna:  23%|██▎       | 46/200 [1:10:08<4:54:28, 114.73s/it, best=0.928][A[I 2026-02-28 03:51:05,126] Trial 28 finished with value: 0.9810105847320957 and parameters: {'activation': 'logistic', 'solver': 'adam', 'lr': 0.0048181835570626505, 'layer1': 299, 'layer2': 160, 'layer3': 427}. Best is trial 13 with value: 0.9860492846658779.

Klebsiella_Pneumoniae | Imipenem | Optuna:  14%|█▍        | 29/200 [22:17<1:57:04, 41.08s/it, best=0.986][A
Klebsiella_Pneumoniae | Imipenem | Optuna:  14%|█▍        | 29/200 [22:17<1:57:04, 41.08s/it, best=0.986][A[I 2026-02-28 03:51:09,234] Trial 73 finished with value: 0.8632359284677971 and parameters: {'activation': 'identity', 'solver': 'adam', 'lr': 0.0009821549775025833, 'layer1': 231, 'layer2': 468, 'layer3': 397}. Best is trial 63 with value: 0.8682133709784562.
Pseudomonas_Aeruginosa | LPS | Optuna:  37%|███▋      | 74/200 [1:46:11<3:16:09, 93.41s/it, best=0.868]Pseudomonas_Aeruginosa | LPS | Optuna:  37%|███▋      | 74/200 [1:46:11<3:16:09, 93.41s/it, best=0.868]/export/usuarios01/egarroyo/MALDI_for_AMR_prediction/venv/lib/python3.13/site-packages/sklearn/model_selection/_split.py:813: UserWarning: The least populated class in y has only 4 members, which is less than n_splits=5.
  warnings.warn(
[I 2026-02-28 03:51:43,924] Trial 29 finished with value: 0.9800270054346416 and parameters: {'activation': 'tanh', 'solver': 'sgd', 'lr': 0.0014118078255700068, 'layer1': 438, 'layer2': 114, 'layer3': 454}. Best is trial 13 with value: 0.9860492846658779.

Klebsiella_Pneumoniae | Imipenem | Optuna:  15%|█▌        | 30/200 [22:56<1:54:26, 40.39s/it, best=0.986][A
Klebsiella_Pneumoniae | Imipenem | Optuna:  15%|█▌        | 30/200 [22:56<1:54:26, 40.39s/it, best=0.986][A[I 2026-02-28 03:52:26,263] Trial 113 finished with value: 0.8896443579145243 and parameters: {'activation': 'relu', 'solver': 'adam', 'lr': 0.00022399253224614002, 'layer1': 45, 'layer2': 449, 'layer3': 445}. Best is trial 14 with value: 0.8971256036318559.

Escherichia_Coli | Ceftriaxone | Optuna:  57%|█████▋    | 114/200 [4:42:27<3:03:21, 127.92s/it, best=0.897][A
Escherichia_Coli | Ceftriaxone | Optuna:  57%|█████▋    | 114/200 [4:42:27<3:03:21, 127.92s/it, best=0.897][A[I 2026-02-28 03:52:33,809] Trial 30 finished with value: 0.9810084050997332 and parameters: {'activation': 'logistic', 'solver': 'adam', 'lr': 0.0057458270832300064, 'layer1': 389, 'layer2': 236, 'layer3': 378}. Best is trial 13 with value: 0.9860492846658779.

Klebsiella_Pneumoniae | Imipenem | Optuna:  16%|█▌        | 31/200 [23:46<2:01:47, 43.24s/it, best=0.986][A
Klebsiella_Pneumoniae | Imipenem | Optuna:  16%|█▌        | 31/200 [23:46<2:01:47, 43.24s/it, best=0.986][A[I 2026-02-28 03:52:56,099] Trial 74 finished with value: 0.8649146889584939 and parameters: {'activation': 'identity', 'solver': 'adam', 'lr': 0.0031471274492014534, 'layer1': 270, 'layer2': 486, 'layer3': 369}. Best is trial 63 with value: 0.8682133709784562.
Pseudomonas_Aeruginosa | LPS | Optuna:  38%|███▊      | 75/200 [1:47:58<3:23:00, 97.45s/it, best=0.868]Pseudomonas_Aeruginosa | LPS | Optuna:  38%|███▊      | 75/200 [1:47:58<3:23:00, 97.45s/it, best=0.868]/export/usuarios01/egarroyo/MALDI_for_AMR_prediction/venv/lib/python3.13/site-packages/sklearn/model_selection/_split.py:813: UserWarning: The least populated class in y has only 4 members, which is less than n_splits=5.
  warnings.warn(
[I 2026-02-28 03:53:29,840] Trial 31 finished with value: 0.9840292331433652 and parameters: {'activation': 'relu', 'solver': 'adam', 'lr': 0.0003907304851089257, 'layer1': 216, 'layer2': 197, 'layer3': 259}. Best is trial 13 with value: 0.9860492846658779.

Klebsiella_Pneumoniae | Imipenem | Optuna:  16%|█▌        | 32/200 [24:42<2:11:49, 47.08s/it, best=0.986][A
Klebsiella_Pneumoniae | Imipenem | Optuna:  16%|█▌        | 32/200 [24:42<2:11:49, 47.08s/it, best=0.986][A[I 2026-02-28 03:53:49,543] Trial 46 finished with value: 0.8937375448262361 and parameters: {'activation': 'tanh', 'solver': 'sgd', 'lr': 0.00012492736048248996, 'layer1': 436, 'layer2': 325, 'layer3': 55}. Best is trial 20 with value: 0.9283335834984147.

Staphylococcus_Aureus | Fusidic acid | Optuna:  24%|██▎       | 47/200 [1:12:58<5:34:53, 131.33s/it, best=0.928][A
Staphylococcus_Aureus | Fusidic acid | Optuna:  24%|██▎       | 47/200 [1:12:58<5:34:53, 131.33s/it, best=0.928][A[I 2026-02-28 03:54:18,330] Trial 32 finished with value: 0.9830528681877911 and parameters: {'activation': 'relu', 'solver': 'adam', 'lr': 0.0005134964606452588, 'layer1': 218, 'layer2': 278, 'layer3': 194}. Best is trial 13 with value: 0.9860492846658779.

Klebsiella_Pneumoniae | Imipenem | Optuna:  16%|█▋        | 33/200 [25:30<2:12:12, 47.50s/it, best=0.986][A
Klebsiella_Pneumoniae | Imipenem | Optuna:  16%|█▋        | 33/200 [25:30<2:12:12, 47.50s/it, best=0.986][A[I 2026-02-28 03:54:41,461] Trial 75 finished with value: 0.8658857686426099 and parameters: {'activation': 'identity', 'solver': 'adam', 'lr': 0.0017349700962705197, 'layer1': 300, 'layer2': 404, 'layer3': 418}. Best is trial 63 with value: 0.8682133709784562.
Pseudomonas_Aeruginosa | LPS | Optuna:  38%|███▊      | 76/200 [1:49:43<3:26:17, 99.82s/it, best=0.868]Pseudomonas_Aeruginosa | LPS | Optuna:  38%|███▊      | 76/200 [1:49:43<3:26:17, 99.82s/it, best=0.868]/export/usuarios01/egarroyo/MALDI_for_AMR_prediction/venv/lib/python3.13/site-packages/sklearn/model_selection/_split.py:813: UserWarning: The least populated class in y has only 4 members, which is less than n_splits=5.
  warnings.warn(
[I 2026-02-28 03:54:53,385] Trial 114 finished with value: 0.8932134078206359 and parameters: {'activation': 'relu', 'solver': 'adam', 'lr': 9.081872130123133e-05, 'layer1': 456, 'layer2': 43, 'layer3': 479}. Best is trial 14 with value: 0.8971256036318559.

Escherichia_Coli | Ceftriaxone | Optuna:  57%|█████▊    | 115/200 [4:44:54<3:09:22, 133.68s/it, best=0.897][A
Escherichia_Coli | Ceftriaxone | Optuna:  57%|█████▊    | 115/200 [4:44:54<3:09:22, 133.68s/it, best=0.897][A[I 2026-02-28 03:54:54,258] Trial 33 finished with value: 0.9819898047648248 and parameters: {'activation': 'relu', 'solver': 'adam', 'lr': 0.0008313264602012913, 'layer1': 244, 'layer2': 216, 'layer3': 266}. Best is trial 13 with value: 0.9860492846658779.

Klebsiella_Pneumoniae | Imipenem | Optuna:  17%|█▋        | 34/200 [26:06<2:01:48, 44.03s/it, best=0.986][A
Klebsiella_Pneumoniae | Imipenem | Optuna:  17%|█▋        | 34/200 [26:06<2:01:48, 44.03s/it, best=0.986][A[I 2026-02-28 03:55:50,894] Trial 34 finished with value: 0.9827487241092493 and parameters: {'activation': 'relu', 'solver': 'adam', 'lr': 0.00017716119655388835, 'layer1': 296, 'layer2': 336, 'layer3': 331}. Best is trial 13 with value: 0.9860492846658779.

Klebsiella_Pneumoniae | Imipenem | Optuna:  18%|█▊        | 35/200 [27:03<2:11:28, 47.81s/it, best=0.986][A
Klebsiella_Pneumoniae | Imipenem | Optuna:  18%|█▊        | 35/200 [27:03<2:11:28, 47.81s/it, best=0.986][A[I 2026-02-28 03:56:04,435] Trial 76 finished with value: 0.8611680665630008 and parameters: {'activation': 'identity', 'solver': 'adam', 'lr': 0.0011050171696229928, 'layer1': 259, 'layer2': 329, 'layer3': 467}. Best is trial 63 with value: 0.8682133709784562.
Pseudomonas_Aeruginosa | LPS | Optuna:  38%|███▊      | 77/200 [1:51:06<3:14:16, 94.77s/it, best=0.868]Pseudomonas_Aeruginosa | LPS | Optuna:  38%|███▊      | 77/200 [1:51:06<3:14:16, 94.77s/it, best=0.868]/export/usuarios01/egarroyo/MALDI_for_AMR_prediction/venv/lib/python3.13/site-packages/sklearn/model_selection/_split.py:813: UserWarning: The least populated class in y has only 4 members, which is less than n_splits=5.
  warnings.warn(
[I 2026-02-28 03:56:04,606] Trial 47 finished with value: 0.9256481853166274 and parameters: {'activation': 'tanh', 'solver': 'adam', 'lr': 2.6339417437707315e-05, 'layer1': 336, 'layer2': 295, 'layer3': 171}. Best is trial 20 with value: 0.9283335834984147.

Staphylococcus_Aureus | Fusidic acid | Optuna:  24%|██▍       | 48/200 [1:15:13<5:35:32, 132.45s/it, best=0.928][A
Staphylococcus_Aureus | Fusidic acid | Optuna:  24%|██▍       | 48/200 [1:15:13<5:35:32, 132.45s/it, best=0.928][A[I 2026-02-28 03:56:31,054] Trial 35 finished with value: 0.9824106050761315 and parameters: {'activation': 'relu', 'solver': 'adam', 'lr': 0.0040595670292092115, 'layer1': 246, 'layer2': 162, 'layer3': 230}. Best is trial 13 with value: 0.9860492846658779.

Klebsiella_Pneumoniae | Imipenem | Optuna:  18%|█▊        | 36/200 [27:43<2:04:24, 45.52s/it, best=0.986][A
Klebsiella_Pneumoniae | Imipenem | Optuna:  18%|█▊        | 36/200 [27:43<2:04:24, 45.52s/it, best=0.986][A[I 2026-02-28 03:56:46,262] Trial 115 finished with value: 0.8933361522030033 and parameters: {'activation': 'relu', 'solver': 'adam', 'lr': 0.00016595243996694441, 'layer1': 479, 'layer2': 62, 'layer3': 305}. Best is trial 14 with value: 0.8971256036318559.

Escherichia_Coli | Ceftriaxone | Optuna:  58%|█████▊    | 116/200 [4:46:47<2:58:24, 127.44s/it, best=0.897][A
Escherichia_Coli | Ceftriaxone | Optuna:  58%|█████▊    | 116/200 [4:46:47<2:58:24, 127.44s/it, best=0.897][A[I 2026-02-28 03:57:41,107] Trial 36 finished with value: 0.9837980532921868 and parameters: {'activation': 'relu', 'solver': 'adam', 'lr': 0.0018622063773942983, 'layer1': 472, 'layer2': 271, 'layer3': 321}. Best is trial 13 with value: 0.9860492846658779.

Klebsiella_Pneumoniae | Imipenem | Optuna:  18%|█▊        | 37/200 [28:53<2:23:38, 52.88s/it, best=0.986][A
Klebsiella_Pneumoniae | Imipenem | Optuna:  18%|█▊        | 37/200 [28:53<2:23:38, 52.88s/it, best=0.986][A[I 2026-02-28 03:57:50,243] Trial 77 finished with value: 0.8645938833297511 and parameters: {'activation': 'identity', 'solver': 'adam', 'lr': 0.0003330283859798595, 'layer1': 333, 'layer2': 272, 'layer3': 452}. Best is trial 63 with value: 0.8682133709784562.
Pseudomonas_Aeruginosa | LPS | Optuna:  39%|███▉      | 78/200 [1:52:52<3:19:25, 98.08s/it, best=0.868]Pseudomonas_Aeruginosa | LPS | Optuna:  39%|███▉      | 78/200 [1:52:52<3:19:25, 98.08s/it, best=0.868]/export/usuarios01/egarroyo/MALDI_for_AMR_prediction/venv/lib/python3.13/site-packages/sklearn/model_selection/_split.py:813: UserWarning: The least populated class in y has only 4 members, which is less than n_splits=5.
  warnings.warn(
[I 2026-02-28 03:58:04,629] Trial 37 finished with value: 0.9800270054346416 and parameters: {'activation': 'logistic', 'solver': 'adam', 'lr': 4.5469980694719234e-05, 'layer1': 69, 'layer2': 63, 'layer3': 139}. Best is trial 13 with value: 0.9860492846658779.

Klebsiella_Pneumoniae | Imipenem | Optuna:  19%|█▉        | 38/200 [29:17<1:58:59, 44.07s/it, best=0.986][A
Klebsiella_Pneumoniae | Imipenem | Optuna:  19%|█▉        | 38/200 [29:17<1:58:59, 44.07s/it, best=0.986][A[I 2026-02-28 03:58:26,344] Trial 38 finished with value: 0.9800270054346416 and parameters: {'activation': 'relu', 'solver': 'sgd', 'lr': 0.0004251609318937849, 'layer1': 131, 'layer2': 190, 'layer3': 361}. Best is trial 13 with value: 0.9860492846658779.

Klebsiella_Pneumoniae | Imipenem | Optuna:  20%|█▉        | 39/200 [29:38<1:40:15, 37.36s/it, best=0.986][A
Klebsiella_Pneumoniae | Imipenem | Optuna:  20%|█▉        | 39/200 [29:38<1:40:15, 37.36s/it, best=0.986][A[I 2026-02-28 03:58:31,279] Trial 116 finished with value: 0.7190722362250481 and parameters: {'activation': 'identity', 'solver': 'sgd', 'lr': 7.419697086153198e-05, 'layer1': 443, 'layer2': 141, 'layer3': 430}. Best is trial 14 with value: 0.8971256036318559.

Escherichia_Coli | Ceftriaxone | Optuna:  58%|█████▊    | 117/200 [4:48:32<2:46:59, 120.71s/it, best=0.897][A
Escherichia_Coli | Ceftriaxone | Optuna:  58%|█████▊    | 117/200 [4:48:32<2:46:59, 120.71s/it, best=0.897][A[I 2026-02-28 03:58:59,276] Trial 39 finished with value: 0.9823572724640488 and parameters: {'activation': 'relu', 'solver': 'adam', 'lr': 0.0008980166371581811, 'layer1': 79, 'layer2': 236, 'layer3': 257}. Best is trial 13 with value: 0.9860492846658779.

Klebsiella_Pneumoniae | Imipenem | Optuna:  20%|██        | 40/200 [30:11<1:36:05, 36.03s/it, best=0.986][A
Klebsiella_Pneumoniae | Imipenem | Optuna:  20%|██        | 40/200 [30:11<1:36:05, 36.03s/it, best=0.986][A[I 2026-02-28 03:59:10,117] Trial 48 finished with value: 0.924992255845735 and parameters: {'activation': 'tanh', 'solver': 'adam', 'lr': 1.2068720188994675e-05, 'layer1': 391, 'layer2': 441, 'layer3': 133}. Best is trial 20 with value: 0.9283335834984147.

Staphylococcus_Aureus | Fusidic acid | Optuna:  24%|██▍       | 49/200 [1:18:19<6:13:23, 148.37s/it, best=0.928][A
Staphylococcus_Aureus | Fusidic acid | Optuna:  24%|██▍       | 49/200 [1:18:19<6:13:23, 148.37s/it, best=0.928][A[I 2026-02-28 03:59:39,056] Trial 78 finished with value: 0.8640618689388397 and parameters: {'activation': 'identity', 'solver': 'adam', 'lr': 0.00017625840234918537, 'layer1': 416, 'layer2': 460, 'layer3': 430}. Best is trial 63 with value: 0.8682133709784562.
Pseudomonas_Aeruginosa | LPS | Optuna:  40%|███▉      | 79/200 [1:54:41<3:24:17, 101.30s/it, best=0.868]Pseudomonas_Aeruginosa | LPS | Optuna:  40%|███▉      | 79/200 [1:54:41<3:24:17, 101.30s/it, best=0.868]/export/usuarios01/egarroyo/MALDI_for_AMR_prediction/venv/lib/python3.13/site-packages/sklearn/model_selection/_split.py:813: UserWarning: The least populated class in y has only 4 members, which is less than n_splits=5.
  warnings.warn(
[I 2026-02-28 03:59:57,780] Trial 40 finished with value: 0.9801402680099323 and parameters: {'activation': 'tanh', 'solver': 'adam', 'lr': 2.394739752960538e-05, 'layer1': 196, 'layer2': 135, 'layer3': 179}. Best is trial 13 with value: 0.9860492846658779.

Klebsiella_Pneumoniae | Imipenem | Optuna:  20%|██        | 41/200 [31:10<1:53:21, 42.78s/it, best=0.986][A
Klebsiella_Pneumoniae | Imipenem | Optuna:  20%|██        | 41/200 [31:10<1:53:21, 42.78s/it, best=0.986][A[I 2026-02-28 04:00:27,634] Trial 117 finished with value: 0.8951390047669863 and parameters: {'activation': 'relu', 'solver': 'adam', 'lr': 0.00010038063327207128, 'layer1': 483, 'layer2': 88, 'layer3': 382}. Best is trial 14 with value: 0.8971256036318559.

Escherichia_Coli | Ceftriaxone | Optuna:  59%|█████▉    | 118/200 [4:50:29<2:43:11, 119.41s/it, best=0.897][A
Escherichia_Coli | Ceftriaxone | Optuna:  59%|█████▉    | 118/200 [4:50:29<2:43:11, 119.41s/it, best=0.897][A[I 2026-02-28 04:00:51,049] Trial 41 finished with value: 0.9839569633597328 and parameters: {'activation': 'relu', 'solver': 'adam', 'lr': 0.001697464859196593, 'layer1': 466, 'layer2': 276, 'layer3': 311}. Best is trial 13 with value: 0.9860492846658779.

Klebsiella_Pneumoniae | Imipenem | Optuna:  21%|██        | 42/200 [32:03<2:00:55, 45.92s/it, best=0.986][A
Klebsiella_Pneumoniae | Imipenem | Optuna:  21%|██        | 42/200 [32:03<2:00:55, 45.92s/it, best=0.986][A[I 2026-02-28 04:01:17,639] Trial 79 finished with value: 0.8631993155916222 and parameters: {'activation': 'identity', 'solver': 'adam', 'lr': 0.000708420839343777, 'layer1': 347, 'layer2': 385, 'layer3': 340}. Best is trial 63 with value: 0.8682133709784562.
Pseudomonas_Aeruginosa | LPS | Optuna:  40%|████      | 80/200 [1:56:19<3:20:58, 100.48s/it, best=0.868]Pseudomonas_Aeruginosa | LPS | Optuna:  40%|████      | 80/200 [1:56:19<3:20:58, 100.48s/it, best=0.868]/export/usuarios01/egarroyo/MALDI_for_AMR_prediction/venv/lib/python3.13/site-packages/sklearn/model_selection/_split.py:813: UserWarning: The least populated class in y has only 4 members, which is less than n_splits=5.
  warnings.warn(
[I 2026-02-28 04:01:59,553] Trial 80 finished with value: 0.8264372404926329 and parameters: {'activation': 'relu', 'solver': 'sgd', 'lr': 0.00010422986509821902, 'layer1': 192, 'layer2': 426, 'layer3': 325}. Best is trial 63 with value: 0.8682133709784562.
Pseudomonas_Aeruginosa | LPS | Optuna:  40%|████      | 81/200 [1:57:01<2:44:26, 82.91s/it, best=0.868] Pseudomonas_Aeruginosa | LPS | Optuna:  40%|████      | 81/200 [1:57:01<2:44:26, 82.91s/it, best=0.868]/export/usuarios01/egarroyo/MALDI_for_AMR_prediction/venv/lib/python3.13/site-packages/sklearn/model_selection/_split.py:813: UserWarning: The least populated class in y has only 4 members, which is less than n_splits=5.
  warnings.warn(
[I 2026-02-28 04:02:00,430] Trial 42 finished with value: 0.9847001446792942 and parameters: {'activation': 'relu', 'solver': 'adam', 'lr': 0.0017266557894619172, 'layer1': 472, 'layer2': 315, 'layer3': 399}. Best is trial 13 with value: 0.9860492846658779.

Klebsiella_Pneumoniae | Imipenem | Optuna:  22%|██▏       | 43/200 [33:13<2:18:34, 52.96s/it, best=0.986][A
Klebsiella_Pneumoniae | Imipenem | Optuna:  22%|██▏       | 43/200 [33:13<2:18:34, 52.96s/it, best=0.986][A[I 2026-02-28 04:02:47,931] Trial 49 finished with value: 0.9068037097282134 and parameters: {'activation': 'tanh', 'solver': 'adam', 'lr': 2.9381386806459037e-06, 'layer1': 240, 'layer2': 482, 'layer3': 83}. Best is trial 20 with value: 0.9283335834984147.

Staphylococcus_Aureus | Fusidic acid | Optuna:  25%|██▌       | 50/200 [1:21:57<7:03:00, 169.20s/it, best=0.928][A
Staphylococcus_Aureus | Fusidic acid | Optuna:  25%|██▌       | 50/200 [1:21:57<7:03:00, 169.20s/it, best=0.928][A[I 2026-02-28 04:02:56,918] Trial 118 finished with value: 0.8925748876663224 and parameters: {'activation': 'relu', 'solver': 'adam', 'lr': 0.00019157755806903563, 'layer1': 500, 'layer2': 57, 'layer3': 38}. Best is trial 14 with value: 0.8971256036318559.

Escherichia_Coli | Ceftriaxone | Optuna:  60%|█████▉    | 119/200 [4:52:58<2:53:17, 128.37s/it, best=0.897][A
